[I 2023-06-11 23:25:18,887] Trial 71 finished with value: 71.33333587646484 and parameters: {'Fwd': 0.0038000257861523614, 'K': 7, 'alpha': 0.45, 'dropout': 0.9, 'gnnepoch': 120, 'lambda1': 0.9500000000000001, 'lambda2': 3.1792566983865647, 'loop': 0, 'loss': 'CE', 'lr': 0.004281485300690869, 'softmaxF': False, 'useGCN': True, 'weight_decay': 2.2754691604826635e-06, 'weightedloss': True}. Best is trial 43 with value: 71.66666412353516.
/home/wxy/miniconda3/lib/python3.10/site-packages/optuna/distributions.py:685: UserWarning: The distribution is specified by [0, 1.00001] and step=0.05, but the range is not divisible by `step`. It will be replaced by [0, 1.0].
  warnings.warn(
K:  7
alpha:  0.45
lr:  0.004294603298381671
weight_decay:  2.3041113011937206e-06
dropout:  0.9
fix split and run 3 times
Data: Data(x=[3327, 3703], y=[3327], train_mask=[3327], val_mask=[3327], test_mask=[3327], adj_t=[3327, 3327, nnz=9104])
num_train tensor(120)
num_noise 0
noise: tensor(0)
data feature 3703
ALTOPT(
  (lins): Sequential(
    (0): Linear(in_features=3703, out_features=64, bias=True)
    (1): BatchNorm1d(64, eps=1e-05, momentum=0.1, affine=True, track_running_stats=True)
    (2): Dropout(p=0.9, inplace=True)
    (3): ReLU(inplace=True)
    (4): Linear(in_features=64, out_features=6, bias=True)
    (5): LogSoftmax(dim=-1)
  )
  (prop): Propagation(K=7, mode=None, lambda1=None, lambda2=None, L21=True, alpha=0.45)
  (gcn): GCN(
    (convs): ModuleList(
      (0): GCNConv(3703, 64)
      (1): GCNConv(64, 6)
    )
    (bns): ModuleList(
      (0): BatchNorm1d(64, eps=1e-05, momentum=0.1, affine=True, track_running_stats=True)
    )
    (output): LogSoftmax(dim=-1)
  )
)
propagate done
init label
Split: 01, Run: 01
None time:  1.0190935030113906
None Run 01:
Highest Train: 100.00
Highest Valid: 71.40
  Final Train: 100.00
   Final Test: 70.20
Split: 01, Run: 02
None time:  1.0358121001627296
None Run 02:
Highest Train: 100.00
Highest Valid: 71.40
  Final Train: 100.00
   Final Test: 70.10
Split: 01, Run: 03
None time:  1.142840376822278
None Run 03:
Highest Train: 100.00
Highest Valid: 71.60
  Final Train: 98.33
   Final Test: 70.50
run time now: 3.2383389472961426
total time:  3.294227105099708
None All runs:
Highest Train: 100.00 ± 0.00
Highest Valid: 71.47 ± 0.12
  Final Train: 99.44 ± 0.96
   Final Test: 70.27 ± 0.21
[I 2023-06-11 23:25:22,729] Trial 72 finished with value: 71.46666717529297 and parameters: {'Fwd': 0.0053326156180993674, 'K': 7, 'alpha': 0.45, 'dropout': 0.9, 'gnnepoch': 120, 'lambda1': 0.9500000000000001, 'lambda2': 3.15041340494554, 'loop': 0, 'loss': 'CE', 'lr': 0.004294603298381671, 'softmaxF': False, 'useGCN': True, 'weight_decay': 2.3041113011937206e-06, 'weightedloss': True}. Best is trial 43 with value: 71.66666412353516.
/home/wxy/miniconda3/lib/python3.10/site-packages/optuna/distributions.py:685: UserWarning: The distribution is specified by [0, 1.00001] and step=0.05, but the range is not divisible by `step`. It will be replaced by [0, 1.0].
  warnings.warn(
K:  7
alpha:  0.4
lr:  0.00449330889723915
weight_decay:  2.2811185882175555e-06
dropout:  0.9
fix split and run 3 times
Data: Data(x=[3327, 3703], y=[3327], train_mask=[3327], val_mask=[3327], test_mask=[3327], adj_t=[3327, 3327, nnz=9104])
num_train tensor(120)
num_noise 0
noise: tensor(0)
data feature 3703
ALTOPT(
  (lins): Sequential(
    (0): Linear(in_features=3703, out_features=64, bias=True)
    (1): BatchNorm1d(64, eps=1e-05, momentum=0.1, affine=True, track_running_stats=True)
    (2): Dropout(p=0.9, inplace=True)
    (3): ReLU(inplace=True)
    (4): Linear(in_features=64, out_features=6, bias=True)
    (5): LogSoftmax(dim=-1)
  )
  (prop): Propagation(K=7, mode=None, lambda1=None, lambda2=None, L21=True, alpha=0.4)
  (gcn): GCN(
    (convs): ModuleList(
      (0): GCNConv(3703, 64)
      (1): GCNConv(64, 6)
    )
    (bns): ModuleList(
      (0): BatchNorm1d(64, eps=1e-05, momentum=0.1, affine=True, track_running_stats=True)
    )
    (output): LogSoftmax(dim=-1)
  )
)
propagate done
init label
Split: 01, Run: 01
None time:  0.9679953299928457
None Run 01:
Highest Train: 100.00
Highest Valid: 71.80
  Final Train: 99.17
   Final Test: 70.20
Split: 01, Run: 02
None time:  0.9231034670956433
None Run 02:
Highest Train: 100.00
Highest Valid: 70.80
  Final Train: 98.33
   Final Test: 70.00
Split: 01, Run: 03
None time:  1.0770777268335223
None Run 03:
Highest Train: 100.00
Highest Valid: 71.40
  Final Train: 98.33
   Final Test: 70.30
run time now: 3.008174180984497
total time:  3.0548533988185227
None All runs:
Highest Train: 100.00 ± 0.00
Highest Valid: 71.33 ± 0.50
  Final Train: 98.61 ± 0.48
   Final Test: 70.17 ± 0.15
[I 2023-06-11 23:25:26,205] Trial 73 finished with value: 71.33333587646484 and parameters: {'Fwd': 0.0026732335330348286, 'K': 7, 'alpha': 0.4, 'dropout': 0.9, 'gnnepoch': 120, 'lambda1': 1.0, 'lambda2': 3.151738200562359, 'loop': 0, 'loss': 'CE', 'lr': 0.00449330889723915, 'softmaxF': False, 'useGCN': True, 'weight_decay': 2.2811185882175555e-06, 'weightedloss': True}. Best is trial 43 with value: 71.66666412353516.
/home/wxy/miniconda3/lib/python3.10/site-packages/optuna/distributions.py:685: UserWarning: The distribution is specified by [0, 1.00001] and step=0.05, but the range is not divisible by `step`. It will be replaced by [0, 1.0].
  warnings.warn(
K:  7
alpha:  0.4
lr:  0.005257661300829245
weight_decay:  2.26213001378252e-06
dropout:  0.8
fix split and run 3 times
Data: Data(x=[3327, 3703], y=[3327], train_mask=[3327], val_mask=[3327], test_mask=[3327], adj_t=[3327, 3327, nnz=9104])
num_train tensor(120)
num_noise 0
noise: tensor(0)
data feature 3703
ALTOPT(
  (lins): Sequential(
    (0): Linear(in_features=3703, out_features=64, bias=True)
    (1): BatchNorm1d(64, eps=1e-05, momentum=0.1, affine=True, track_running_stats=True)
    (2): Dropout(p=0.8, inplace=True)
    (3): ReLU(inplace=True)
    (4): Linear(in_features=64, out_features=6, bias=True)
    (5): LogSoftmax(dim=-1)
  )
  (prop): Propagation(K=7, mode=None, lambda1=None, lambda2=None, L21=True, alpha=0.4)
  (gcn): GCN(
    (convs): ModuleList(
      (0): GCNConv(3703, 64)
      (1): GCNConv(64, 6)
    )
    (bns): ModuleList(
      (0): BatchNorm1d(64, eps=1e-05, momentum=0.1, affine=True, track_running_stats=True)
    )
    (output): LogSoftmax(dim=-1)
  )
)
propagate done
init label
Split: 01, Run: 01
None time:  1.080472273984924
None Run 01:
Highest Train: 100.00
Highest Valid: 70.80
  Final Train: 97.50
   Final Test: 70.20
Split: 01, Run: 02
None time:  1.2348401271738112
None Run 02:
Highest Train: 100.00
Highest Valid: 70.40
  Final Train: 95.00
   Final Test: 69.60
Split: 01, Run: 03
None time:  1.0797733119688928
None Run 03:
Highest Train: 100.00
Highest Valid: 71.20
  Final Train: 93.33
   Final Test: 69.30
run time now: 3.4359993934631348
total time:  3.494674094952643
None All runs:
Highest Train: 100.00 ± 0.00
Highest Valid: 70.80 ± 0.40
  Final Train: 95.28 ± 2.10
   Final Test: 69.70 ± 0.46
[I 2023-06-11 23:25:30,143] Trial 74 finished with value: 70.80001068115234 and parameters: {'Fwd': 0.0022377272898116292, 'K': 7, 'alpha': 0.4, 'dropout': 0.8, 'gnnepoch': 120, 'lambda1': 1.0, 'lambda2': 2.862103152187424, 'loop': 0, 'loss': 'CE', 'lr': 0.005257661300829245, 'softmaxF': False, 'useGCN': True, 'weight_decay': 2.26213001378252e-06, 'weightedloss': True}. Best is trial 43 with value: 71.66666412353516.
/home/wxy/miniconda3/lib/python3.10/site-packages/optuna/distributions.py:685: UserWarning: The distribution is specified by [0, 1.00001] and step=0.05, but the range is not divisible by `step`. It will be replaced by [0, 1.0].
  warnings.warn(
K:  6
alpha:  0.30000000000000004
lr:  0.0041965970514823234
weight_decay:  3.245705220588152e-06
dropout:  0.9
fix split and run 3 times
Data: Data(x=[3327, 3703], y=[3327], train_mask=[3327], val_mask=[3327], test_mask=[3327], adj_t=[3327, 3327, nnz=9104])
num_train tensor(120)
num_noise 0
noise: tensor(0)
data feature 3703
ALTOPT(
  (lins): Sequential(
    (0): Linear(in_features=3703, out_features=64, bias=True)
    (1): BatchNorm1d(64, eps=1e-05, momentum=0.1, affine=True, track_running_stats=True)
    (2): Dropout(p=0.9, inplace=True)
    (3): ReLU(inplace=True)
    (4): Linear(in_features=64, out_features=6, bias=True)
    (5): LogSoftmax(dim=-1)
  )
  (prop): Propagation(K=6, mode=None, lambda1=None, lambda2=None, L21=True, alpha=0.30000000000000004)
  (gcn): GCN(
    (convs): ModuleList(
      (0): GCNConv(3703, 64)
      (1): GCNConv(64, 6)
    )
    (bns): ModuleList(
      (0): BatchNorm1d(64, eps=1e-05, momentum=0.1, affine=True, track_running_stats=True)
    )
    (output): LogSoftmax(dim=-1)
  )
)
propagate done
init label
Split: 01, Run: 01
None time:  1.0444908009376377
None Run 01:
Highest Train: 100.00
Highest Valid: 71.60
  Final Train: 99.17
   Final Test: 69.80
Split: 01, Run: 02
None time:  1.031755224103108
None Run 02:
Highest Train: 100.00
Highest Valid: 71.40
  Final Train: 98.33
   Final Test: 70.30
Split: 01, Run: 03
None time:  0.9898673770949244
None Run 03:
Highest Train: 100.00
Highest Valid: 71.40
  Final Train: 98.33
   Final Test: 70.40
run time now: 3.1107044219970703
total time:  3.1743233469314873
None All runs:
Highest Train: 100.00 ± 0.00
Highest Valid: 71.47 ± 0.12
  Final Train: 98.61 ± 0.48
   Final Test: 70.17 ± 0.32
[I 2023-06-11 23:25:33,782] Trial 75 finished with value: 71.46666717529297 and parameters: {'Fwd': 0.0059136680569116615, 'K': 6, 'alpha': 0.30000000000000004, 'dropout': 0.9, 'gnnepoch': 120, 'lambda1': 0.9500000000000001, 'lambda2': 2.5112778780997207, 'loop': 0, 'loss': 'CE', 'lr': 0.0041965970514823234, 'softmaxF': False, 'useGCN': True, 'weight_decay': 3.245705220588152e-06, 'weightedloss': True}. Best is trial 43 with value: 71.66666412353516.
/home/wxy/miniconda3/lib/python3.10/site-packages/optuna/distributions.py:685: UserWarning: The distribution is specified by [0, 1.00001] and step=0.05, but the range is not divisible by `step`. It will be replaced by [0, 1.0].
  warnings.warn(
K:  6
alpha:  0.30000000000000004
lr:  0.004120506298298244
weight_decay:  3.4644007482112784e-06
dropout:  0.8
fix split and run 3 times
Data: Data(x=[3327, 3703], y=[3327], train_mask=[3327], val_mask=[3327], test_mask=[3327], adj_t=[3327, 3327, nnz=9104])
num_train tensor(120)
num_noise 0
noise: tensor(0)
data feature 3703
ALTOPT(
  (lins): Sequential(
    (0): Linear(in_features=3703, out_features=64, bias=True)
    (1): BatchNorm1d(64, eps=1e-05, momentum=0.1, affine=True, track_running_stats=True)
    (2): Dropout(p=0.8, inplace=True)
    (3): ReLU(inplace=True)
    (4): Linear(in_features=64, out_features=6, bias=True)
    (5): LogSoftmax(dim=-1)
  )
  (prop): Propagation(K=6, mode=None, lambda1=None, lambda2=None, L21=True, alpha=0.30000000000000004)
  (gcn): GCN(
    (convs): ModuleList(
      (0): GCNConv(3703, 64)
      (1): GCNConv(64, 6)
    )
    (bns): ModuleList(
      (0): BatchNorm1d(64, eps=1e-05, momentum=0.1, affine=True, track_running_stats=True)
    )
    (output): LogSoftmax(dim=-1)
  )
)
propagate done
init label
Split: 01, Run: 01
None time:  1.028044112958014
None Run 01:
Highest Train: 100.00
Highest Valid: 70.60
  Final Train: 97.50
   Final Test: 70.20
Split: 01, Run: 02
None time:  1.0385150199290365
None Run 02:
Highest Train: 100.00
Highest Valid: 71.00
  Final Train: 95.00
   Final Test: 69.90
Split: 01, Run: 03
None time:  1.0737028729636222
None Run 03:
Highest Train: 100.00
Highest Valid: 70.60
  Final Train: 98.33
   Final Test: 69.80
run time now: 3.179201364517212
total time:  3.2352341760415584
None All runs:
Highest Train: 100.00 ± 0.00
Highest Valid: 70.73 ± 0.23
  Final Train: 96.94 ± 1.73
   Final Test: 69.97 ± 0.21
[I 2023-06-11 23:25:37,461] Trial 76 finished with value: 70.73333740234375 and parameters: {'Fwd': 0.0058895370399784175, 'K': 6, 'alpha': 0.30000000000000004, 'dropout': 0.8, 'gnnepoch': 120, 'lambda1': 0.9500000000000001, 'lambda2': 2.3716274897441036, 'loop': 0, 'loss': 'CE', 'lr': 0.004120506298298244, 'softmaxF': False, 'useGCN': True, 'weight_decay': 3.4644007482112784e-06, 'weightedloss': True}. Best is trial 43 with value: 71.66666412353516.
/home/wxy/miniconda3/lib/python3.10/site-packages/optuna/distributions.py:685: UserWarning: The distribution is specified by [0, 1.00001] and step=0.05, but the range is not divisible by `step`. It will be replaced by [0, 1.0].
  warnings.warn(
K:  6
alpha:  0.15000000000000002
lr:  0.006010476281860966
weight_decay:  1.4348161478266182e-06
dropout:  0.9
fix split and run 3 times
Data: Data(x=[3327, 3703], y=[3327], train_mask=[3327], val_mask=[3327], test_mask=[3327], adj_t=[3327, 3327, nnz=9104])
num_train tensor(120)
num_noise 0
noise: tensor(0)
data feature 3703
ALTOPT(
  (lins): Sequential(
    (0): Linear(in_features=3703, out_features=64, bias=True)
    (1): BatchNorm1d(64, eps=1e-05, momentum=0.1, affine=True, track_running_stats=True)
    (2): Dropout(p=0.9, inplace=True)
    (3): ReLU(inplace=True)
    (4): Linear(in_features=64, out_features=6, bias=True)
    (5): LogSoftmax(dim=-1)
  )
  (prop): Propagation(K=6, mode=None, lambda1=None, lambda2=None, L21=True, alpha=0.15000000000000002)
  (gcn): GCN(
    (convs): ModuleList(
      (0): GCNConv(3703, 64)
      (1): GCNConv(64, 6)
    )
    (bns): ModuleList(
      (0): BatchNorm1d(64, eps=1e-05, momentum=0.1, affine=True, track_running_stats=True)
    )
    (output): LogSoftmax(dim=-1)
  )
)
propagate done
init label
Split: 01, Run: 01
None time:  1.096560758072883
None Run 01:
Highest Train: 100.00
Highest Valid: 70.60
  Final Train: 99.17
   Final Test: 69.60
Split: 01, Run: 02
None time:  1.023330416996032
None Run 02:
Highest Train: 100.00
Highest Valid: 71.00
  Final Train: 99.17
   Final Test: 70.40
Split: 01, Run: 03
None time:  1.1863975878804922
None Run 03:
Highest Train: 100.00
Highest Valid: 70.80
  Final Train: 95.00
   Final Test: 69.80
run time now: 3.3445777893066406
total time:  3.398271454963833
None All runs:
Highest Train: 100.00 ± 0.00
Highest Valid: 70.80 ± 0.20
  Final Train: 97.78 ± 2.41
   Final Test: 69.93 ± 0.42
[I 2023-06-11 23:25:41,273] Trial 77 finished with value: 70.80000305175781 and parameters: {'Fwd': 0.005955750338343579, 'K': 6, 'alpha': 0.15000000000000002, 'dropout': 0.9, 'gnnepoch': 120, 'lambda1': 0.9500000000000001, 'lambda2': 3.44603319635788, 'loop': 0, 'loss': 'CE', 'lr': 0.006010476281860966, 'softmaxF': False, 'useGCN': True, 'weight_decay': 1.4348161478266182e-06, 'weightedloss': False}. Best is trial 43 with value: 71.66666412353516.
/home/wxy/miniconda3/lib/python3.10/site-packages/optuna/distributions.py:685: UserWarning: The distribution is specified by [0, 1.00001] and step=0.05, but the range is not divisible by `step`. It will be replaced by [0, 1.0].
  warnings.warn(
K:  7
alpha:  0.45
lr:  0.007014287997873564
weight_decay:  1.0592798553470758e-05
dropout:  0.9
fix split and run 3 times
Data: Data(x=[3327, 3703], y=[3327], train_mask=[3327], val_mask=[3327], test_mask=[3327], adj_t=[3327, 3327, nnz=9104])
num_train tensor(120)
num_noise 0
noise: tensor(0)
data feature 3703
ALTOPT(
  (lins): Sequential(
    (0): Linear(in_features=3703, out_features=64, bias=True)
    (1): BatchNorm1d(64, eps=1e-05, momentum=0.1, affine=True, track_running_stats=True)
    (2): Dropout(p=0.9, inplace=True)
    (3): ReLU(inplace=True)
    (4): Linear(in_features=64, out_features=6, bias=True)
    (5): LogSoftmax(dim=-1)
  )
  (prop): Propagation(K=7, mode=None, lambda1=None, lambda2=None, L21=True, alpha=0.45)
  (gcn): GCN(
    (convs): ModuleList(
      (0): GCNConv(3703, 64)
      (1): GCNConv(64, 6)
    )
    (bns): ModuleList(
      (0): BatchNorm1d(64, eps=1e-05, momentum=0.1, affine=True, track_running_stats=True)
    )
    (output): LogSoftmax(dim=-1)
  )
)
propagate done
init label
Split: 01, Run: 01
None time:  0.8173438350204378
None Run 01:
Highest Train: 100.00
Highest Valid: 69.40
  Final Train: 95.83
   Final Test: 66.20
Split: 01, Run: 02
None time:  0.707874980987981
None Run 02:
Highest Train: 100.00
Highest Valid: 64.80
  Final Train: 95.83
   Final Test: 63.80
Split: 01, Run: 03
None time:  0.738404574804008
None Run 03:
Highest Train: 100.00
Highest Valid: 57.40
  Final Train: 96.67
   Final Test: 57.70
run time now: 2.303647756576538
total time:  2.3516680682078004
None All runs:
Highest Train: 100.00 ± 0.00
Highest Valid: 63.87 ± 6.05
  Final Train: 96.11 ± 0.48
   Final Test: 62.57 ± 4.38
[I 2023-06-11 23:25:44,036] Trial 78 finished with value: 63.866668701171875 and parameters: {'Fwd': 0.009601575943033697, 'K': 7, 'alpha': 0.45, 'dropout': 0.9, 'gnnepoch': 120, 'lambda1': 0.9, 'lambda2': 2.699229004442966, 'loop': 0, 'loss': 'CE', 'lr': 0.007014287997873564, 'softmaxF': False, 'useGCN': False, 'weight_decay': 1.0592798553470758e-05, 'weightedloss': True}. Best is trial 43 with value: 71.66666412353516.
/home/wxy/miniconda3/lib/python3.10/site-packages/optuna/distributions.py:685: UserWarning: The distribution is specified by [0, 1.00001] and step=0.05, but the range is not divisible by `step`. It will be replaced by [0, 1.0].
  warnings.warn(
K:  6
alpha:  0.30000000000000004
lr:  0.0037697229237077055
weight_decay:  1.3321304771327547e-06
dropout:  0.8
fix split and run 3 times
Data: Data(x=[3327, 3703], y=[3327], train_mask=[3327], val_mask=[3327], test_mask=[3327], adj_t=[3327, 3327, nnz=9104])
num_train tensor(120)
num_noise 0
noise: tensor(0)
data feature 3703
ALTOPT(
  (lins): Sequential(
    (0): Linear(in_features=3703, out_features=64, bias=True)
    (1): BatchNorm1d(64, eps=1e-05, momentum=0.1, affine=True, track_running_stats=True)
    (2): Dropout(p=0.8, inplace=True)
    (3): ReLU(inplace=True)
    (4): Linear(in_features=64, out_features=6, bias=True)
    (5): LogSoftmax(dim=-1)
  )
  (prop): Propagation(K=6, mode=None, lambda1=None, lambda2=None, L21=True, alpha=0.30000000000000004)
  (gcn): GCN(
    (convs): ModuleList(
      (0): GCNConv(3703, 64)
      (1): GCNConv(64, 6)
    )
    (bns): ModuleList(
      (0): BatchNorm1d(64, eps=1e-05, momentum=0.1, affine=True, track_running_stats=True)
    )
    (output): LogSoftmax(dim=-1)
  )
)
propagate done
init label
Split: 01, Run: 01
None time:  1.156241161050275
None Run 01:
Highest Train: 100.00
Highest Valid: 70.60
  Final Train: 95.83
   Final Test: 69.30
Split: 01, Run: 02
None time:  1.164187079994008
None Run 02:
Highest Train: 100.00
Highest Valid: 70.00
  Final Train: 95.00
   Final Test: 70.10
Split: 01, Run: 03
None time:  1.171577522996813
None Run 03:
Highest Train: 100.00
Highest Valid: 69.80
  Final Train: 98.33
   Final Test: 69.30
run time now: 3.536189556121826
total time:  3.5808589209336787
None All runs:
Highest Train: 100.00 ± 0.00
Highest Valid: 70.13 ± 0.42
  Final Train: 96.39 ± 1.73
   Final Test: 69.57 ± 0.46
[I 2023-06-11 23:25:48,039] Trial 79 finished with value: 70.13333892822266 and parameters: {'Fwd': 0.0011807751856593473, 'K': 6, 'alpha': 0.30000000000000004, 'dropout': 0.8, 'gnnepoch': 120, 'lambda1': 0.9, 'lambda2': 1.9191113030793483, 'loop': 1, 'loss': 'CE', 'lr': 0.0037697229237077055, 'softmaxF': False, 'useGCN': True, 'weight_decay': 1.3321304771327547e-06, 'weightedloss': True}. Best is trial 43 with value: 71.66666412353516.
/home/wxy/miniconda3/lib/python3.10/site-packages/optuna/distributions.py:685: UserWarning: The distribution is specified by [0, 1.00001] and step=0.05, but the range is not divisible by `step`. It will be replaced by [0, 1.0].
  warnings.warn(
K:  7
alpha:  0.0
lr:  0.0037838008146809728
weight_decay:  2.8649948217563266e-06
dropout:  0.8
fix split and run 3 times
Data: Data(x=[3327, 3703], y=[3327], train_mask=[3327], val_mask=[3327], test_mask=[3327], adj_t=[3327, 3327, nnz=9104])
num_train tensor(120)
num_noise 0
noise: tensor(0)
data feature 3703
ALTOPT(
  (lins): Sequential(
    (0): Linear(in_features=3703, out_features=64, bias=True)
    (1): BatchNorm1d(64, eps=1e-05, momentum=0.1, affine=True, track_running_stats=True)
    (2): Dropout(p=0.8, inplace=True)
    (3): ReLU(inplace=True)
    (4): Linear(in_features=64, out_features=6, bias=True)
    (5): LogSoftmax(dim=-1)
  )
  (prop): Propagation(K=7, mode=None, lambda1=None, lambda2=None, L21=True, alpha=0.0)
  (gcn): GCN(
    (convs): ModuleList(
      (0): GCNConv(3703, 64)
      (1): GCNConv(64, 6)
    )
    (bns): ModuleList(
      (0): BatchNorm1d(64, eps=1e-05, momentum=0.1, affine=True, track_running_stats=True)
    )
    (output): LogSoftmax(dim=-1)
  )
)
propagate done
init label
Split: 01, Run: 01
None time:  0.8939201890025288
None Run 01:
Highest Train: 100.00
Highest Valid: 71.60
  Final Train: 99.17
   Final Test: 70.20
Split: 01, Run: 02
None time:  1.0177202990744263
None Run 02:
Highest Train: 100.00
Highest Valid: 70.40
  Final Train: 99.17
   Final Test: 69.00
Split: 01, Run: 03
None time:  0.9162844379898161
None Run 03:
Highest Train: 100.00
Highest Valid: 69.80
  Final Train: 99.17
   Final Test: 69.70
run time now: 2.8692240715026855
total time:  2.938838941976428
None All runs:
Highest Train: 100.00 ± 0.00
Highest Valid: 70.60 ± 0.92
  Final Train: 99.17 ± 0.00
   Final Test: 69.63 ± 0.60
