[I 2023-06-12 00:00:14,648] Trial 620 finished with value: 70.20000457763672 and parameters: {'Fwd': 1.3551969391476741e-05, 'K': 7, 'alpha': 0.65, 'dropout': 0.8, 'gnnepoch': 110, 'lambda1': 0.7000000000000001, 'lambda2': 6.526871602822931, 'loop': 0, 'loss': 'CE', 'lr': 0.0011925922769308065, 'softmaxF': False, 'useGCN': True, 'weight_decay': 8.735848767381182e-06, 'weightedloss': True}. Best is trial 605 with value: 72.13333129882812.
/home/wxy/miniconda3/lib/python3.10/site-packages/optuna/distributions.py:685: UserWarning: The distribution is specified by [0, 1.00001] and step=0.05, but the range is not divisible by `step`. It will be replaced by [0, 1.0].
  warnings.warn(
K:  9
alpha:  0.7000000000000001
lr:  0.0006482894022726185
weight_decay:  1.3070987337649308e-05
dropout:  0.8
fix split and run 3 times
Data: Data(x=[3327, 3703], y=[3327], train_mask=[3327], val_mask=[3327], test_mask=[3327], adj_t=[3327, 3327, nnz=9104])
num_train tensor(120)
num_noise 0
noise: tensor(0)
data feature 3703
ALTOPT(
  (lins): Sequential(
    (0): Linear(in_features=3703, out_features=64, bias=True)
    (1): BatchNorm1d(64, eps=1e-05, momentum=0.1, affine=True, track_running_stats=True)
    (2): Dropout(p=0.8, inplace=True)
    (3): ReLU(inplace=True)
    (4): Linear(in_features=64, out_features=6, bias=True)
    (5): Identity()
  )
  (prop): Propagation(K=9, mode=None, lambda1=None, lambda2=None, L21=True, alpha=0.7000000000000001)
  (gcn): GCN(
    (convs): ModuleList(
      (0): GCNConv(3703, 64)
      (1): GCNConv(64, 6)
    )
    (bns): ModuleList(
      (0): BatchNorm1d(64, eps=1e-05, momentum=0.1, affine=True, track_running_stats=True)
    )
    (output): Identity()
  )
)
propagate done
init label
Split: 01, Run: 01, Epoch: 100, Loss: 0.0000, Train: 100.00%, Valid: 69.80% Test: 68.20%
Split: 01, Run: 01
None time:  1.8474327879957855
None Run 01:
Highest Train: 100.00
Highest Valid: 69.80
  Final Train: 100.00
   Final Test: 68.20
Split: 01, Run: 02, Epoch: 100, Loss: 0.0000, Train: 100.00%, Valid: 70.00% Test: 69.50%
Split: 01, Run: 02
None time:  1.7836986801121384
None Run 02:
Highest Train: 100.00
Highest Valid: 70.00
  Final Train: 100.00
   Final Test: 69.50
Split: 01, Run: 03, Epoch: 100, Loss: 0.0000, Train: 100.00%, Valid: 69.00% Test: 68.40%
Split: 01, Run: 03
None time:  1.9142313899938017
None Run 03:
Highest Train: 100.00
Highest Valid: 69.00
  Final Train: 100.00
   Final Test: 68.50
run time now: 5.59049916267395
total time:  5.646505828946829
None All runs:
Highest Train: 100.00 ± 0.00
Highest Valid: 69.60 ± 0.53
  Final Train: 100.00 ± 0.00
   Final Test: 68.73 ± 0.68
[I 2023-06-12 00:00:20,889] Trial 621 finished with value: 69.5999984741211 and parameters: {'Fwd': 1.6572876654014998e-06, 'K': 9, 'alpha': 0.7000000000000001, 'dropout': 0.8, 'gnnepoch': 120, 'lambda1': 0.75, 'lambda2': 4.544139836066914, 'loop': 0, 'loss': 'MSE', 'lr': 0.0006482894022726185, 'softmaxF': False, 'useGCN': True, 'weight_decay': 1.3070987337649308e-05, 'weightedloss': True}. Best is trial 605 with value: 72.13333129882812.
/home/wxy/miniconda3/lib/python3.10/site-packages/optuna/distributions.py:685: UserWarning: The distribution is specified by [0, 1.00001] and step=0.05, but the range is not divisible by `step`. It will be replaced by [0, 1.0].
  warnings.warn(
K:  8
alpha:  0.75
lr:  0.0013796080845734208
weight_decay:  0.00021845394542104794
dropout:  0.7000000000000001
fix split and run 3 times
Data: Data(x=[3327, 3703], y=[3327], train_mask=[3327], val_mask=[3327], test_mask=[3327], adj_t=[3327, 3327, nnz=9104])
num_train tensor(120)
num_noise 0
noise: tensor(0)
data feature 3703
ALTOPT(
  (lins): Sequential(
    (0): Linear(in_features=3703, out_features=64, bias=True)
    (1): BatchNorm1d(64, eps=1e-05, momentum=0.1, affine=True, track_running_stats=True)
    (2): Dropout(p=0.7000000000000001, inplace=True)
    (3): ReLU(inplace=True)
    (4): Linear(in_features=64, out_features=6, bias=True)
    (5): LogSoftmax(dim=-1)
  )
  (prop): Propagation(K=8, mode=None, lambda1=None, lambda2=None, L21=True, alpha=0.75)
  (gcn): GCN(
    (convs): ModuleList(
      (0): GCNConv(3703, 64)
      (1): GCNConv(64, 6)
    )
    (bns): ModuleList(
      (0): BatchNorm1d(64, eps=1e-05, momentum=0.1, affine=True, track_running_stats=True)
    )
    (output): LogSoftmax(dim=-1)
  )
)
propagate done
init label
Split: 01, Run: 01
None time:  1.1529293551575392
None Run 01:
Highest Train: 100.00
Highest Valid: 71.40
  Final Train: 100.00
   Final Test: 69.70
Split: 01, Run: 02
None time:  1.0311077958904207
None Run 02:
Highest Train: 100.00
Highest Valid: 72.20
  Final Train: 100.00
   Final Test: 70.10
Split: 01, Run: 03
None time:  1.0755972790066153
None Run 03:
Highest Train: 100.00
Highest Valid: 71.40
  Final Train: 100.00
   Final Test: 70.70
run time now: 3.3015925884246826
total time:  3.3538677499163896
None All runs:
Highest Train: 100.00 ± 0.00
Highest Valid: 71.67 ± 0.46
  Final Train: 100.00 ± 0.00
   Final Test: 70.17 ± 0.50
[I 2023-06-12 00:00:24,751] Trial 622 finished with value: 71.66666412353516 and parameters: {'Fwd': 2.8005653024550013e-05, 'K': 8, 'alpha': 0.75, 'dropout': 0.7000000000000001, 'gnnepoch': 120, 'lambda1': 0.75, 'lambda2': 8.21660637684129, 'loop': 0, 'loss': 'CE', 'lr': 0.0013796080845734208, 'softmaxF': True, 'useGCN': True, 'weight_decay': 0.00021845394542104794, 'weightedloss': True}. Best is trial 605 with value: 72.13333129882812.
/home/wxy/miniconda3/lib/python3.10/site-packages/optuna/distributions.py:685: UserWarning: The distribution is specified by [0, 1.00001] and step=0.05, but the range is not divisible by `step`. It will be replaced by [0, 1.0].
  warnings.warn(
K:  8
alpha:  0.6000000000000001
lr:  0.0007048691543719568
weight_decay:  0.004291786120701108
dropout:  0.9
fix split and run 3 times
Data: Data(x=[3327, 3703], y=[3327], train_mask=[3327], val_mask=[3327], test_mask=[3327], adj_t=[3327, 3327, nnz=9104])
num_train tensor(120)
num_noise 0
noise: tensor(0)
data feature 3703
ALTOPT(
  (lins): Sequential(
    (0): Linear(in_features=3703, out_features=64, bias=True)
    (1): BatchNorm1d(64, eps=1e-05, momentum=0.1, affine=True, track_running_stats=True)
    (2): Dropout(p=0.9, inplace=True)
    (3): ReLU(inplace=True)
    (4): Linear(in_features=64, out_features=6, bias=True)
    (5): LogSoftmax(dim=-1)
  )
  (prop): Propagation(K=8, mode=None, lambda1=None, lambda2=None, L21=True, alpha=0.6000000000000001)
  (gcn): GCN(
    (convs): ModuleList(
      (0): GCNConv(3703, 64)
      (1): GCNConv(64, 6)
    )
    (bns): ModuleList(
      (0): BatchNorm1d(64, eps=1e-05, momentum=0.1, affine=True, track_running_stats=True)
    )
    (output): LogSoftmax(dim=-1)
  )
)
propagate done
init label
Split: 01, Run: 01
None time:  0.9404415530152619
None Run 01:
Highest Train: 100.00
Highest Valid: 70.60
  Final Train: 100.00
   Final Test: 69.50
Split: 01, Run: 02
None time:  0.9919054468628019
None Run 02:
Highest Train: 100.00
Highest Valid: 68.40
  Final Train: 99.17
   Final Test: 68.40
Split: 01, Run: 03
None time:  1.1143897180445492
None Run 03:
Highest Train: 100.00
Highest Valid: 69.40
  Final Train: 100.00
   Final Test: 70.40
run time now: 3.0871567726135254
total time:  3.1417831999715418
None All runs:
Highest Train: 100.00 ± 0.00
Highest Valid: 69.47 ± 1.10
  Final Train: 99.72 ± 0.48
   Final Test: 69.43 ± 1.00
[I 2023-06-12 00:00:28,390] Trial 623 finished with value: 69.46666717529297 and parameters: {'Fwd': 0.0006178918182082555, 'K': 8, 'alpha': 0.6000000000000001, 'dropout': 0.9, 'gnnepoch': 110, 'lambda1': 0.7000000000000001, 'lambda2': 0.4674499367943463, 'loop': 0, 'loss': 'CE', 'lr': 0.0007048691543719568, 'softmaxF': False, 'useGCN': True, 'weight_decay': 0.004291786120701108, 'weightedloss': True}. Best is trial 605 with value: 72.13333129882812.
/home/wxy/miniconda3/lib/python3.10/site-packages/optuna/distributions.py:685: UserWarning: The distribution is specified by [0, 1.00001] and step=0.05, but the range is not divisible by `step`. It will be replaced by [0, 1.0].
  warnings.warn(
K:  8
alpha:  0.55
lr:  0.0011267948269646697
weight_decay:  0.00572198772549773
dropout:  0.8
fix split and run 3 times
Data: Data(x=[3327, 3703], y=[3327], train_mask=[3327], val_mask=[3327], test_mask=[3327], adj_t=[3327, 3327, nnz=9104])
num_train tensor(120)
num_noise 0
noise: tensor(0)
data feature 3703
ALTOPT(
  (lins): Sequential(
    (0): Linear(in_features=3703, out_features=64, bias=True)
    (1): BatchNorm1d(64, eps=1e-05, momentum=0.1, affine=True, track_running_stats=True)
    (2): Dropout(p=0.8, inplace=True)
    (3): ReLU(inplace=True)
    (4): Linear(in_features=64, out_features=6, bias=True)
    (5): LogSoftmax(dim=-1)
  )
  (prop): Propagation(K=8, mode=None, lambda1=None, lambda2=None, L21=True, alpha=0.55)
  (gcn): GCN(
    (convs): ModuleList(
      (0): GCNConv(3703, 64)
      (1): GCNConv(64, 6)
    )
    (bns): ModuleList(
      (0): BatchNorm1d(64, eps=1e-05, momentum=0.1, affine=True, track_running_stats=True)
    )
    (output): LogSoftmax(dim=-1)
  )
)
propagate done
init label
Split: 01, Run: 01
None time:  0.8946989078540355
None Run 01:
Highest Train: 100.00
Highest Valid: 71.00
  Final Train: 100.00
   Final Test: 69.70
Split: 01, Run: 02
None time:  0.8824513079598546
None Run 02:
Highest Train: 100.00
Highest Valid: 72.40
  Final Train: 100.00
   Final Test: 70.80
Split: 01, Run: 03
None time:  0.8153060260228813
None Run 03:
Highest Train: 100.00
Highest Valid: 69.80
  Final Train: 100.00
   Final Test: 68.80
run time now: 2.6360409259796143
total time:  2.6908287049736828
None All runs:
Highest Train: 100.00 ± 0.00
Highest Valid: 71.07 ± 1.30
  Final Train: 100.00 ± 0.00
   Final Test: 69.77 ± 1.00
[I 2023-06-12 00:00:31,612] Trial 624 finished with value: 71.06666564941406 and parameters: {'Fwd': 0.0004633454637747534, 'K': 8, 'alpha': 0.55, 'dropout': 0.8, 'gnnepoch': 90, 'lambda1': 0.65, 'lambda2': 7.637863819011943, 'loop': 0, 'loss': 'CE', 'lr': 0.0011267948269646697, 'softmaxF': False, 'useGCN': True, 'weight_decay': 0.00572198772549773, 'weightedloss': True}. Best is trial 605 with value: 72.13333129882812.
/home/wxy/miniconda3/lib/python3.10/site-packages/optuna/distributions.py:685: UserWarning: The distribution is specified by [0, 1.00001] and step=0.05, but the range is not divisible by `step`. It will be replaced by [0, 1.0].
  warnings.warn(
K:  8
alpha:  0.8
lr:  0.0008786765464335438
weight_decay:  3.746799170848992e-05
dropout:  0.8
fix split and run 3 times
Data: Data(x=[3327, 3703], y=[3327], train_mask=[3327], val_mask=[3327], test_mask=[3327], adj_t=[3327, 3327, nnz=9104])
num_train tensor(120)
num_noise 0
noise: tensor(0)
data feature 3703
ALTOPT(
  (lins): Sequential(
    (0): Linear(in_features=3703, out_features=64, bias=True)
    (1): BatchNorm1d(64, eps=1e-05, momentum=0.1, affine=True, track_running_stats=True)
    (2): Dropout(p=0.8, inplace=True)
    (3): ReLU(inplace=True)
    (4): Linear(in_features=64, out_features=6, bias=True)
    (5): LogSoftmax(dim=-1)
  )
  (prop): Propagation(K=8, mode=None, lambda1=None, lambda2=None, L21=True, alpha=0.8)
  (gcn): GCN(
    (convs): ModuleList(
      (0): GCNConv(3703, 64)
      (1): GCNConv(64, 6)
    )
    (bns): ModuleList(
      (0): BatchNorm1d(64, eps=1e-05, momentum=0.1, affine=True, track_running_stats=True)
    )
    (output): LogSoftmax(dim=-1)
  )
)
propagate done
init label
Split: 01, Run: 01
None time:  1.0662510741967708
None Run 01:
Highest Train: 100.00
Highest Valid: 70.20
  Final Train: 100.00
   Final Test: 69.30
Split: 01, Run: 02
None time:  1.037943912902847
None Run 02:
Highest Train: 100.00
Highest Valid: 72.00
  Final Train: 100.00
   Final Test: 70.20
Split: 01, Run: 03
None time:  1.0620381790213287
None Run 03:
Highest Train: 100.00
Highest Valid: 71.00
  Final Train: 100.00
   Final Test: 70.40
run time now: 3.2074687480926514
total time:  3.259691999061033
None All runs:
Highest Train: 100.00 ± 0.00
Highest Valid: 71.07 ± 0.90
  Final Train: 100.00 ± 0.00
   Final Test: 69.97 ± 0.59
[I 2023-06-12 00:00:35,383] Trial 625 finished with value: 71.0666732788086 and parameters: {'Fwd': 5.3370612040468456e-06, 'K': 8, 'alpha': 0.8, 'dropout': 0.8, 'gnnepoch': 120, 'lambda1': 0.6000000000000001, 'lambda2': 5.342488486900101, 'loop': 0, 'loss': 'CE', 'lr': 0.0008786765464335438, 'softmaxF': False, 'useGCN': True, 'weight_decay': 3.746799170848992e-05, 'weightedloss': True}. Best is trial 605 with value: 72.13333129882812.
/home/wxy/miniconda3/lib/python3.10/site-packages/optuna/distributions.py:685: UserWarning: The distribution is specified by [0, 1.00001] and step=0.05, but the range is not divisible by `step`. It will be replaced by [0, 1.0].
  warnings.warn(
K:  8
alpha:  0.65
lr:  0.007375447789879852
weight_decay:  3.269214365631076e-05
dropout:  0.8
fix split and run 3 times
Data: Data(x=[3327, 3703], y=[3327], train_mask=[3327], val_mask=[3327], test_mask=[3327], adj_t=[3327, 3327, nnz=9104])
num_train tensor(120)
num_noise 0
noise: tensor(0)
data feature 3703
ALTOPT(
  (lins): Sequential(
    (0): Linear(in_features=3703, out_features=64, bias=True)
    (1): BatchNorm1d(64, eps=1e-05, momentum=0.1, affine=True, track_running_stats=True)
    (2): Dropout(p=0.8, inplace=True)
    (3): ReLU(inplace=True)
    (4): Linear(in_features=64, out_features=6, bias=True)
    (5): LogSoftmax(dim=-1)
  )
  (prop): Propagation(K=8, mode=None, lambda1=None, lambda2=None, L21=True, alpha=0.65)
  (gcn): GCN(
    (convs): ModuleList(
      (0): GCNConv(3703, 64)
      (1): GCNConv(64, 6)
    )
    (bns): ModuleList(
      (0): BatchNorm1d(64, eps=1e-05, momentum=0.1, affine=True, track_running_stats=True)
    )
    (output): LogSoftmax(dim=-1)
  )
)
propagate done
init label
Split: 01, Run: 01
None time:  1.2209812151268125
None Run 01:
Highest Train: 100.00
Highest Valid: 70.00
  Final Train: 91.67
   Final Test: 69.70
Split: 01, Run: 02
None time:  1.1374617519322783
None Run 02:
Highest Train: 100.00
Highest Valid: 70.20
  Final Train: 93.33
   Final Test: 69.60
Split: 01, Run: 03
None time:  1.0596544470172375
None Run 03:
Highest Train: 100.00
Highest Valid: 70.40
  Final Train: 96.67
   Final Test: 69.50
run time now: 3.4662129878997803
total time:  3.5188795139547437
None All runs:
Highest Train: 100.00 ± 0.00
Highest Valid: 70.20 ± 0.20
  Final Train: 93.89 ± 2.55
   Final Test: 69.60 ± 0.10
[I 2023-06-12 00:00:39,558] Trial 626 finished with value: 70.20000457763672 and parameters: {'Fwd': 0.00026215079148695297, 'K': 8, 'alpha': 0.65, 'dropout': 0.8, 'gnnepoch': 120, 'lambda1': 0.75, 'lambda2': 0.7565161493493857, 'loop': 0, 'loss': 'CE', 'lr': 0.007375447789879852, 'softmaxF': False, 'useGCN': True, 'weight_decay': 3.269214365631076e-05, 'weightedloss': True}. Best is trial 605 with value: 72.13333129882812.
/home/wxy/miniconda3/lib/python3.10/site-packages/optuna/distributions.py:685: UserWarning: The distribution is specified by [0, 1.00001] and step=0.05, but the range is not divisible by `step`. It will be replaced by [0, 1.0].
  warnings.warn(
K:  8
alpha:  0.5
lr:  0.005710703816197725
weight_decay:  0.00040632575204502903
dropout:  0.8
fix split and run 3 times
Data: Data(x=[3327, 3703], y=[3327], train_mask=[3327], val_mask=[3327], test_mask=[3327], adj_t=[3327, 3327, nnz=9104])
num_train tensor(120)
num_noise 0
noise: tensor(0)
data feature 3703
ALTOPT(
  (lins): Sequential(
    (0): Linear(in_features=3703, out_features=64, bias=True)
    (1): BatchNorm1d(64, eps=1e-05, momentum=0.1, affine=True, track_running_stats=True)
    (2): Dropout(p=0.8, inplace=True)
    (3): ReLU(inplace=True)
    (4): Linear(in_features=64, out_features=6, bias=True)
    (5): LogSoftmax(dim=-1)
  )
  (prop): Propagation(K=8, mode=None, lambda1=None, lambda2=None, L21=True, alpha=0.5)
  (gcn): GCN(
    (convs): ModuleList(
      (0): GCNConv(3703, 64)
      (1): GCNConv(64, 6)
    )
    (bns): ModuleList(
      (0): BatchNorm1d(64, eps=1e-05, momentum=0.1, affine=True, track_running_stats=True)
    )
    (output): LogSoftmax(dim=-1)
  )
)
propagate done
init label
Split: 01, Run: 01
None time:  1.0795968640595675
None Run 01:
Highest Train: 100.00
Highest Valid: 70.80
  Final Train: 99.17
   Final Test: 69.90
Split: 01, Run: 02
None time:  1.1443697588983923
None Run 02:
Highest Train: 100.00
Highest Valid: 70.60
  Final Train: 98.33
   Final Test: 69.60
Split: 01, Run: 03
None time:  1.093492287909612
None Run 03:
Highest Train: 100.00
Highest Valid: 70.80
  Final Train: 100.00
   Final Test: 69.20
run time now: 3.3646020889282227
total time:  3.431048210011795
None All runs:
Highest Train: 100.00 ± 0.00
Highest Valid: 70.73 ± 0.12
  Final Train: 99.17 ± 0.83
   Final Test: 69.57 ± 0.35
[I 2023-06-12 00:00:43,465] Trial 627 finished with value: 70.73332977294922 and parameters: {'Fwd': 0.0007706051264828907, 'K': 8, 'alpha': 0.5, 'dropout': 0.8, 'gnnepoch': 120, 'lambda1': 0.7000000000000001, 'lambda2': 6.95088184914281, 'loop': 0, 'loss': 'CE', 'lr': 0.005710703816197725, 'softmaxF': False, 'useGCN': True, 'weight_decay': 0.00040632575204502903, 'weightedloss': True}. Best is trial 605 with value: 72.13333129882812.
/home/wxy/miniconda3/lib/python3.10/site-packages/optuna/distributions.py:685: UserWarning: The distribution is specified by [0, 1.00001] and step=0.05, but the range is not divisible by `step`. It will be replaced by [0, 1.0].
  warnings.warn(
K:  8
alpha:  0.7000000000000001
lr:  0.0014677250603017122
weight_decay:  0.02729081629444386
dropout:  0.8
fix split and run 3 times
Data: Data(x=[3327, 3703], y=[3327], train_mask=[3327], val_mask=[3327], test_mask=[3327], adj_t=[3327, 3327, nnz=9104])
num_train tensor(120)
num_noise 0
noise: tensor(0)
data feature 3703
ALTOPT(
  (lins): Sequential(
    (0): Linear(in_features=3703, out_features=64, bias=True)
    (1): BatchNorm1d(64, eps=1e-05, momentum=0.1, affine=True, track_running_stats=True)
    (2): Dropout(p=0.8, inplace=True)
    (3): ReLU(inplace=True)
    (4): Linear(in_features=64, out_features=6, bias=True)
    (5): LogSoftmax(dim=-1)
  )
  (prop): Propagation(K=8, mode=None, lambda1=None, lambda2=None, L21=True, alpha=0.7000000000000001)
  (gcn): GCN(
    (convs): ModuleList(
      (0): GCNConv(3703, 64)
      (1): GCNConv(64, 6)
    )
    (bns): ModuleList(
      (0): BatchNorm1d(64, eps=1e-05, momentum=0.1, affine=True, track_running_stats=True)
    )
    (output): LogSoftmax(dim=-1)
  )
)
propagate done
init label
Split: 01, Run: 01
None time:  1.0482310941442847
None Run 01:
Highest Train: 100.00
Highest Valid: 71.20
  Final Train: 100.00
   Final Test: 69.90
Split: 01, Run: 02
None time:  1.0578447689767927
None Run 02:
Highest Train: 100.00
Highest Valid: 72.00
  Final Train: 100.00
   Final Test: 70.10
Split: 01, Run: 03
None time:  1.1061328591313213
None Run 03:
Highest Train: 100.00
Highest Valid: 71.40
  Final Train: 100.00
   Final Test: 71.10
run time now: 3.253170967102051
total time:  3.2983830240555108
None All runs:
Highest Train: 100.00 ± 0.00
Highest Valid: 71.53 ± 0.42
  Final Train: 100.00 ± 0.00
   Final Test: 70.37 ± 0.64
[I 2023-06-12 00:00:47,320] Trial 628 finished with value: 71.53333282470703 and parameters: {'Fwd': 0.00042824894016568944, 'K': 8, 'alpha': 0.7000000000000001, 'dropout': 0.8, 'gnnepoch': 120, 'lambda1': 0.55, 'lambda2': 4.831048841285098, 'loop': 0, 'loss': 'CE', 'lr': 0.0014677250603017122, 'softmaxF': False, 'useGCN': True, 'weight_decay': 0.02729081629444386, 'weightedloss': True}. Best is trial 605 with value: 72.13333129882812.
/home/wxy/miniconda3/lib/python3.10/site-packages/optuna/distributions.py:685: UserWarning: The distribution is specified by [0, 1.00001] and step=0.05, but the range is not divisible by `step`. It will be replaced by [0, 1.0].
  warnings.warn(
K:  7
alpha:  0.9
lr:  0.0004790293409628604
weight_decay:  5.8223472698446976e-05
dropout:  0.8
fix split and run 3 times
Data: Data(x=[3327, 3703], y=[3327], train_mask=[3327], val_mask=[3327], test_mask=[3327], adj_t=[3327, 3327, nnz=9104])
num_train tensor(120)
num_noise 0
noise: tensor(0)
data feature 3703
ALTOPT(
  (lins): Sequential(
    (0): Linear(in_features=3703, out_features=64, bias=True)
    (1): BatchNorm1d(64, eps=1e-05, momentum=0.1, affine=True, track_running_stats=True)
    (2): Dropout(p=0.8, inplace=True)
    (3): ReLU(inplace=True)
    (4): Linear(in_features=64, out_features=6, bias=True)
    (5): LogSoftmax(dim=-1)
  )
  (prop): Propagation(K=7, mode=None, lambda1=None, lambda2=None, L21=True, alpha=0.9)
  (gcn): GCN(
    (convs): ModuleList(
      (0): GCNConv(3703, 64)
      (1): GCNConv(64, 6)
    )
    (bns): ModuleList(
      (0): BatchNorm1d(64, eps=1e-05, momentum=0.1, affine=True, track_running_stats=True)
    )
    (output): LogSoftmax(dim=-1)
  )
)
propagate done
init label
Split: 01, Run: 01
None time:  0.7359304910060018
None Run 01:
Highest Train: 100.00
Highest Valid: 68.40
  Final Train: 99.17
   Final Test: 65.30
Split: 01, Run: 02
None time:  0.9633238532114774
None Run 02:
Highest Train: 100.00
Highest Valid: 65.40
  Final Train: 98.33
   Final Test: 63.10
Split: 01, Run: 03, Epoch: 100, Loss: 0.0000, Train: 97.50%, Valid: 61.60% Test: 61.40%
Split: 01, Run: 03
None time:  1.3075990870129317
None Run 03:
Highest Train: 100.00
Highest Valid: 61.60
  Final Train: 97.50
   Final Test: 61.40
run time now: 3.048802375793457
total time:  3.1085340450517833
None All runs:
Highest Train: 100.00 ± 0.00
Highest Valid: 65.13 ± 3.41
  Final Train: 98.33 ± 0.83
   Final Test: 63.27 ± 1.96
