[I 2023-06-11 23:24:44,994] Trial 62 finished with value: 71.33333587646484 and parameters: {'Fwd': 0.00855402978603928, 'K': 9, 'alpha': 0.1, 'dropout': 0.7000000000000001, 'gnnepoch': 110, 'lambda1': 0.65, 'lambda2': 3.8248112560931196, 'loop': 0, 'loss': 'CE', 'lr': 0.0023464773146322205, 'softmaxF': False, 'useGCN': True, 'weight_decay': 2.5668487686349097e-06, 'weightedloss': True}. Best is trial 43 with value: 71.66666412353516.
/home/wxy/miniconda3/lib/python3.10/site-packages/optuna/distributions.py:685: UserWarning: The distribution is specified by [0, 1.00001] and step=0.05, but the range is not divisible by `step`. It will be replaced by [0, 1.0].
  warnings.warn(
K:  10
alpha:  0.1
lr:  0.0019234751131926606
weight_decay:  2.602974366076645e-06
dropout:  0.8
fix split and run 3 times
Data: Data(x=[3327, 3703], y=[3327], train_mask=[3327], val_mask=[3327], test_mask=[3327], adj_t=[3327, 3327, nnz=9104])
num_train tensor(120)
num_noise 0
noise: tensor(0)
data feature 3703
ALTOPT(
  (lins): Sequential(
    (0): Linear(in_features=3703, out_features=64, bias=True)
    (1): BatchNorm1d(64, eps=1e-05, momentum=0.1, affine=True, track_running_stats=True)
    (2): Dropout(p=0.8, inplace=True)
    (3): ReLU(inplace=True)
    (4): Linear(in_features=64, out_features=6, bias=True)
    (5): LogSoftmax(dim=-1)
  )
  (prop): Propagation(K=10, mode=None, lambda1=None, lambda2=None, L21=True, alpha=0.1)
  (gcn): GCN(
    (convs): ModuleList(
      (0): GCNConv(3703, 64)
      (1): GCNConv(64, 6)
    )
    (bns): ModuleList(
      (0): BatchNorm1d(64, eps=1e-05, momentum=0.1, affine=True, track_running_stats=True)
    )
    (output): LogSoftmax(dim=-1)
  )
)
propagate done
init label
Split: 01, Run: 01
None time:  0.9766742228530347
None Run 01:
Highest Train: 100.00
Highest Valid: 71.00
  Final Train: 100.00
   Final Test: 69.50
Split: 01, Run: 02
None time:  1.0241980149876326
None Run 02:
Highest Train: 100.00
Highest Valid: 70.20
  Final Train: 100.00
   Final Test: 68.30
Split: 01, Run: 03
None time:  0.9984900529962033
None Run 03:
Highest Train: 100.00
Highest Valid: 71.40
  Final Train: 100.00
   Final Test: 70.40
run time now: 3.0499448776245117
total time:  3.1167755268979818
None All runs:
Highest Train: 100.00 ± 0.00
Highest Valid: 70.87 ± 0.61
  Final Train: 100.00 ± 0.00
   Final Test: 69.40 ± 1.05
[I 2023-06-11 23:24:48,544] Trial 63 finished with value: 70.86666870117188 and parameters: {'Fwd': 0.00795477600751653, 'K': 10, 'alpha': 0.1, 'dropout': 0.8, 'gnnepoch': 110, 'lambda1': 0.7000000000000001, 'lambda2': 3.7235618725463793, 'loop': 0, 'loss': 'CE', 'lr': 0.0019234751131926606, 'softmaxF': False, 'useGCN': True, 'weight_decay': 2.602974366076645e-06, 'weightedloss': True}. Best is trial 43 with value: 71.66666412353516.
/home/wxy/miniconda3/lib/python3.10/site-packages/optuna/distributions.py:685: UserWarning: The distribution is specified by [0, 1.00001] and step=0.05, but the range is not divisible by `step`. It will be replaced by [0, 1.0].
  warnings.warn(
K:  8
alpha:  0.5
lr:  0.0027142422420850256
weight_decay:  2.153303968690215e-06
dropout:  0.9
fix split and run 3 times
Data: Data(x=[3327, 3703], y=[3327], train_mask=[3327], val_mask=[3327], test_mask=[3327], adj_t=[3327, 3327, nnz=9104])
num_train tensor(120)
num_noise 0
noise: tensor(0)
data feature 3703
ALTOPT(
  (lins): Sequential(
    (0): Linear(in_features=3703, out_features=64, bias=True)
    (1): BatchNorm1d(64, eps=1e-05, momentum=0.1, affine=True, track_running_stats=True)
    (2): Dropout(p=0.9, inplace=True)
    (3): ReLU(inplace=True)
    (4): Linear(in_features=64, out_features=6, bias=True)
    (5): LogSoftmax(dim=-1)
  )
  (prop): Propagation(K=8, mode=None, lambda1=None, lambda2=None, L21=True, alpha=0.5)
  (gcn): GCN(
    (convs): ModuleList(
      (0): GCNConv(3703, 64)
      (1): GCNConv(64, 6)
    )
    (bns): ModuleList(
      (0): BatchNorm1d(64, eps=1e-05, momentum=0.1, affine=True, track_running_stats=True)
    )
    (output): LogSoftmax(dim=-1)
  )
)
propagate done
init label
Split: 01, Run: 01
None time:  0.911764521850273
None Run 01:
Highest Train: 100.00
Highest Valid: 71.60
  Final Train: 100.00
   Final Test: 69.80
Split: 01, Run: 02
None time:  0.9550466497894377
None Run 02:
Highest Train: 100.00
Highest Valid: 70.80
  Final Train: 99.17
   Final Test: 70.40
Split: 01, Run: 03
None time:  0.8941118179354817
None Run 03:
Highest Train: 100.00
Highest Valid: 71.80
  Final Train: 100.00
   Final Test: 69.30
run time now: 2.800935983657837
total time:  2.856796353124082
None All runs:
Highest Train: 100.00 ± 0.00
Highest Valid: 71.40 ± 0.53
  Final Train: 99.72 ± 0.48
   Final Test: 69.83 ± 0.55
[I 2023-06-11 23:24:51,879] Trial 64 finished with value: 71.4000015258789 and parameters: {'Fwd': 0.010174476691686635, 'K': 8, 'alpha': 0.5, 'dropout': 0.9, 'gnnepoch': 100, 'lambda1': 0.7000000000000001, 'lambda2': 3.2373601390990734, 'loop': 0, 'loss': 'CE', 'lr': 0.0027142422420850256, 'softmaxF': False, 'useGCN': True, 'weight_decay': 2.153303968690215e-06, 'weightedloss': True}. Best is trial 43 with value: 71.66666412353516.
/home/wxy/miniconda3/lib/python3.10/site-packages/optuna/distributions.py:685: UserWarning: The distribution is specified by [0, 1.00001] and step=0.05, but the range is not divisible by `step`. It will be replaced by [0, 1.0].
  warnings.warn(
K:  8
alpha:  0.5
lr:  0.002604039480226568
weight_decay:  2.2409516875999517e-06
dropout:  0.9
fix split and run 3 times
Data: Data(x=[3327, 3703], y=[3327], train_mask=[3327], val_mask=[3327], test_mask=[3327], adj_t=[3327, 3327, nnz=9104])
num_train tensor(120)
num_noise 0
noise: tensor(0)
data feature 3703
ALTOPT(
  (lins): Sequential(
    (0): Linear(in_features=3703, out_features=64, bias=True)
    (1): BatchNorm1d(64, eps=1e-05, momentum=0.1, affine=True, track_running_stats=True)
    (2): Dropout(p=0.9, inplace=True)
    (3): ReLU(inplace=True)
    (4): Linear(in_features=64, out_features=6, bias=True)
    (5): LogSoftmax(dim=-1)
  )
  (prop): Propagation(K=8, mode=None, lambda1=None, lambda2=None, L21=True, alpha=0.5)
  (gcn): GCN(
    (convs): ModuleList(
      (0): GCNConv(3703, 64)
      (1): GCNConv(64, 6)
    )
    (bns): ModuleList(
      (0): BatchNorm1d(64, eps=1e-05, momentum=0.1, affine=True, track_running_stats=True)
    )
    (output): LogSoftmax(dim=-1)
  )
)
propagate done
init label
Split: 01, Run: 01
None time:  0.9719804839696735
None Run 01:
Highest Train: 100.00
Highest Valid: 71.20
  Final Train: 100.00
   Final Test: 69.50
Split: 01, Run: 02
None time:  1.0165140361059457
None Run 02:
Highest Train: 100.00
Highest Valid: 70.80
  Final Train: 100.00
   Final Test: 68.10
Split: 01, Run: 03
None time:  0.9333796878345311
None Run 03:
Highest Train: 100.00
Highest Valid: 71.80
  Final Train: 100.00
   Final Test: 70.30
run time now: 2.963019371032715
total time:  3.0178281320258975
None All runs:
Highest Train: 100.00 ± 0.00
Highest Valid: 71.27 ± 0.50
  Final Train: 100.00 ± 0.00
   Final Test: 69.30 ± 1.11
[I 2023-06-11 23:24:55,349] Trial 65 finished with value: 71.26667022705078 and parameters: {'Fwd': 0.004430017832501441, 'K': 8, 'alpha': 0.5, 'dropout': 0.9, 'gnnepoch': 110, 'lambda1': 0.75, 'lambda2': 3.890948523840204, 'loop': 0, 'loss': 'CE', 'lr': 0.002604039480226568, 'softmaxF': False, 'useGCN': True, 'weight_decay': 2.2409516875999517e-06, 'weightedloss': True}. Best is trial 43 with value: 71.66666412353516.
/home/wxy/miniconda3/lib/python3.10/site-packages/optuna/distributions.py:685: UserWarning: The distribution is specified by [0, 1.00001] and step=0.05, but the range is not divisible by `step`. It will be replaced by [0, 1.0].
  warnings.warn(
K:  8
alpha:  0.45
lr:  0.0027596855431409406
weight_decay:  5.0447886058229285e-06
dropout:  0.9
fix split and run 3 times
Data: Data(x=[3327, 3703], y=[3327], train_mask=[3327], val_mask=[3327], test_mask=[3327], adj_t=[3327, 3327, nnz=9104])
num_train tensor(120)
num_noise 0
noise: tensor(0)
data feature 3703
ALTOPT(
  (lins): Sequential(
    (0): Linear(in_features=3703, out_features=64, bias=True)
    (1): BatchNorm1d(64, eps=1e-05, momentum=0.1, affine=True, track_running_stats=True)
    (2): Dropout(p=0.9, inplace=True)
    (3): ReLU(inplace=True)
    (4): Linear(in_features=64, out_features=6, bias=True)
    (5): LogSoftmax(dim=-1)
  )
  (prop): Propagation(K=8, mode=None, lambda1=None, lambda2=None, L21=True, alpha=0.45)
  (gcn): GCN(
    (convs): ModuleList(
      (0): GCNConv(3703, 64)
      (1): GCNConv(64, 6)
    )
    (bns): ModuleList(
      (0): BatchNorm1d(64, eps=1e-05, momentum=0.1, affine=True, track_running_stats=True)
    )
    (output): LogSoftmax(dim=-1)
  )
)
propagate done
init label
Split: 01, Run: 01
None time:  0.9297231349628419
None Run 01:
Highest Train: 100.00
Highest Valid: 71.40
  Final Train: 100.00
   Final Test: 69.60
Split: 01, Run: 02
None time:  0.9765586170833558
None Run 02:
Highest Train: 100.00
Highest Valid: 70.60
  Final Train: 99.17
   Final Test: 67.80
Split: 01, Run: 03
None time:  1.0687251018825918
None Run 03:
Highest Train: 100.00
Highest Valid: 71.80
  Final Train: 100.00
   Final Test: 69.90
run time now: 3.021385669708252
total time:  3.08010006416589
None All runs:
Highest Train: 100.00 ± 0.00
Highest Valid: 71.27 ± 0.61
  Final Train: 99.72 ± 0.48
   Final Test: 69.10 ± 1.14
[I 2023-06-11 23:24:58,881] Trial 66 finished with value: 71.26667022705078 and parameters: {'Fwd': 0.004170099359762041, 'K': 8, 'alpha': 0.45, 'dropout': 0.9, 'gnnepoch': 110, 'lambda1': 0.8500000000000001, 'lambda2': 3.2456442457308157, 'loop': 0, 'loss': 'CE', 'lr': 0.0027596855431409406, 'softmaxF': False, 'useGCN': True, 'weight_decay': 5.0447886058229285e-06, 'weightedloss': True}. Best is trial 43 with value: 71.66666412353516.
/home/wxy/miniconda3/lib/python3.10/site-packages/optuna/distributions.py:685: UserWarning: The distribution is specified by [0, 1.00001] and step=0.05, but the range is not divisible by `step`. It will be replaced by [0, 1.0].
  warnings.warn(
K:  8
alpha:  0.35000000000000003
lr:  0.0033862176760667195
weight_decay:  3.7909233347045787e-06
dropout:  0.9
fix split and run 3 times
Data: Data(x=[3327, 3703], y=[3327], train_mask=[3327], val_mask=[3327], test_mask=[3327], adj_t=[3327, 3327, nnz=9104])
num_train tensor(120)
num_noise 0
noise: tensor(0)
data feature 3703
ALTOPT(
  (lins): Sequential(
    (0): Linear(in_features=3703, out_features=64, bias=True)
    (1): BatchNorm1d(64, eps=1e-05, momentum=0.1, affine=True, track_running_stats=True)
    (2): Dropout(p=0.9, inplace=True)
    (3): ReLU(inplace=True)
    (4): Linear(in_features=64, out_features=6, bias=True)
    (5): LogSoftmax(dim=-1)
  )
  (prop): Propagation(K=8, mode=None, lambda1=None, lambda2=None, L21=True, alpha=0.35000000000000003)
  (gcn): GCN(
    (convs): ModuleList(
      (0): GCNConv(3703, 64)
      (1): GCNConv(64, 6)
    )
    (bns): ModuleList(
      (0): BatchNorm1d(64, eps=1e-05, momentum=0.1, affine=True, track_running_stats=True)
    )
    (output): LogSoftmax(dim=-1)
  )
)
propagate done
init label
Split: 01, Run: 01
None time:  0.8953113460447639
None Run 01:
Highest Train: 100.00
Highest Valid: 71.80
  Final Train: 100.00
   Final Test: 69.20
Split: 01, Run: 02
None time:  0.9709207022096962
None Run 02:
Highest Train: 100.00
Highest Valid: 70.60
  Final Train: 100.00
   Final Test: 68.00
Split: 01, Run: 03
None time:  1.028644774807617
None Run 03:
Highest Train: 100.00
Highest Valid: 71.20
  Final Train: 100.00
   Final Test: 70.00
run time now: 2.935373306274414
total time:  2.9896877971477807
None All runs:
Highest Train: 100.00 ± 0.00
Highest Valid: 71.20 ± 0.60
  Final Train: 100.00 ± 0.00
   Final Test: 69.07 ± 1.01
[I 2023-06-11 23:25:02,277] Trial 67 finished with value: 71.20000457763672 and parameters: {'Fwd': 0.0034978658340070654, 'K': 8, 'alpha': 0.35000000000000003, 'dropout': 0.9, 'gnnepoch': 110, 'lambda1': 0.8500000000000001, 'lambda2': 3.2409344201440895, 'loop': 0, 'loss': 'CE', 'lr': 0.0033862176760667195, 'softmaxF': False, 'useGCN': True, 'weight_decay': 3.7909233347045787e-06, 'weightedloss': True}. Best is trial 43 with value: 71.66666412353516.
/home/wxy/miniconda3/lib/python3.10/site-packages/optuna/distributions.py:685: UserWarning: The distribution is specified by [0, 1.00001] and step=0.05, but the range is not divisible by `step`. It will be replaced by [0, 1.0].
  warnings.warn(
K:  8
alpha:  0.5
lr:  0.002669876057920695
weight_decay:  5.412768392750876e-06
dropout:  0.8
fix split and run 3 times
Data: Data(x=[3327, 3703], y=[3327], train_mask=[3327], val_mask=[3327], test_mask=[3327], adj_t=[3327, 3327, nnz=9104])
num_train tensor(120)
num_noise 0
noise: tensor(0)
data feature 3703
ALTOPT(
  (lins): Sequential(
    (0): Linear(in_features=3703, out_features=64, bias=True)
    (1): BatchNorm1d(64, eps=1e-05, momentum=0.1, affine=True, track_running_stats=True)
    (2): Dropout(p=0.8, inplace=True)
    (3): ReLU(inplace=True)
    (4): Linear(in_features=64, out_features=6, bias=True)
    (5): Identity()
  )
  (prop): Propagation(K=8, mode=None, lambda1=None, lambda2=None, L21=True, alpha=0.5)
  (gcn): GCN(
    (convs): ModuleList(
      (0): GCNConv(3703, 64)
      (1): GCNConv(64, 6)
    )
    (bns): ModuleList(
      (0): BatchNorm1d(64, eps=1e-05, momentum=0.1, affine=True, track_running_stats=True)
    )
    (output): Identity()
  )
)
propagate done
init label
Split: 01, Run: 01, Epoch: 100, Loss: 0.0000, Train: 100.00%, Valid: 67.40% Test: 68.50%
Split: 01, Run: 01
None time:  1.6636178460903466
None Run 01:
Highest Train: 100.00
Highest Valid: 67.40
  Final Train: 100.00
   Final Test: 68.30
Split: 01, Run: 02, Epoch: 100, Loss: 0.0000, Train: 100.00%, Valid: 68.20% Test: 69.30%
Split: 01, Run: 02
None time:  1.698547445004806
None Run 02:
Highest Train: 100.00
Highest Valid: 68.20
  Final Train: 100.00
   Final Test: 69.20
Split: 01, Run: 03, Epoch: 100, Loss: 0.0000, Train: 100.00%, Valid: 66.40% Test: 68.30%
Split: 01, Run: 03
None time:  1.6507643649820238
None Run 03:
Highest Train: 100.00
Highest Valid: 66.40
  Final Train: 100.00
   Final Test: 68.20
run time now: 5.06403112411499
total time:  5.119060091208667
None All runs:
Highest Train: 100.00 ± 0.00
Highest Valid: 67.33 ± 0.90
  Final Train: 100.00 ± 0.00
   Final Test: 68.57 ± 0.55
[I 2023-06-11 23:25:07,794] Trial 68 finished with value: 67.33333587646484 and parameters: {'Fwd': 0.0015841352573933377, 'K': 8, 'alpha': 0.5, 'dropout': 0.8, 'gnnepoch': 110, 'lambda1': 0.8500000000000001, 'lambda2': 3.817175805188477, 'loop': 0, 'loss': 'MSE', 'lr': 0.002669876057920695, 'softmaxF': False, 'useGCN': True, 'weight_decay': 5.412768392750876e-06, 'weightedloss': True}. Best is trial 43 with value: 71.66666412353516.
/home/wxy/miniconda3/lib/python3.10/site-packages/optuna/distributions.py:685: UserWarning: The distribution is specified by [0, 1.00001] and step=0.05, but the range is not divisible by `step`. It will be replaced by [0, 1.0].
  warnings.warn(
K:  8
alpha:  0.45
lr:  0.0031367596461155892
weight_decay:  2.2134554571643665e-06
dropout:  0.9
fix split and run 3 times
Data: Data(x=[3327, 3703], y=[3327], train_mask=[3327], val_mask=[3327], test_mask=[3327], adj_t=[3327, 3327, nnz=9104])
num_train tensor(120)
num_noise 0
noise: tensor(0)
data feature 3703
ALTOPT(
  (lins): Sequential(
    (0): Linear(in_features=3703, out_features=64, bias=True)
    (1): BatchNorm1d(64, eps=1e-05, momentum=0.1, affine=True, track_running_stats=True)
    (2): Dropout(p=0.9, inplace=True)
    (3): ReLU(inplace=True)
    (4): Linear(in_features=64, out_features=6, bias=True)
    (5): LogSoftmax(dim=-1)
  )
  (prop): Propagation(K=8, mode=None, lambda1=None, lambda2=None, L21=True, alpha=0.45)
  (gcn): GCN(
    (convs): ModuleList(
      (0): GCNConv(3703, 64)
      (1): GCNConv(64, 6)
    )
    (bns): ModuleList(
      (0): BatchNorm1d(64, eps=1e-05, momentum=0.1, affine=True, track_running_stats=True)
    )
    (output): LogSoftmax(dim=-1)
  )
)
propagate done
init label
Split: 01, Run: 01
None time:  1.0333621299359947
None Run 01:
Highest Train: 100.00
Highest Valid: 71.60
  Final Train: 100.00
   Final Test: 69.20
Split: 01, Run: 02
None time:  1.0093166697770357
None Run 02:
Highest Train: 100.00
Highest Valid: 71.80
  Final Train: 100.00
   Final Test: 70.30
Split: 01, Run: 03
None time:  1.0592343718744814
None Run 03:
Highest Train: 100.00
Highest Valid: 71.60
  Final Train: 100.00
   Final Test: 69.70
run time now: 3.1427793502807617
total time:  3.193257451057434
None All runs:
Highest Train: 100.00 ± 0.00
Highest Valid: 71.67 ± 0.12
  Final Train: 100.00 ± 0.00
   Final Test: 69.73 ± 0.55
[I 2023-06-11 23:25:11,421] Trial 69 finished with value: 71.66666412353516 and parameters: {'Fwd': 0.005144563635258102, 'K': 8, 'alpha': 0.45, 'dropout': 0.9, 'gnnepoch': 120, 'lambda1': 0.9, 'lambda2': 3.1386252269948383, 'loop': 0, 'loss': 'CE', 'lr': 0.0031367596461155892, 'softmaxF': False, 'useGCN': True, 'weight_decay': 2.2134554571643665e-06, 'weightedloss': True}. Best is trial 43 with value: 71.66666412353516.
/home/wxy/miniconda3/lib/python3.10/site-packages/optuna/distributions.py:685: UserWarning: The distribution is specified by [0, 1.00001] and step=0.05, but the range is not divisible by `step`. It will be replaced by [0, 1.0].
  warnings.warn(
K:  7
alpha:  0.45
lr:  0.0040548002488196505
weight_decay:  2.3426589609920833e-06
dropout:  0.9
fix split and run 3 times
Data: Data(x=[3327, 3703], y=[3327], train_mask=[3327], val_mask=[3327], test_mask=[3327], adj_t=[3327, 3327, nnz=9104])
num_train tensor(120)
num_noise 0
noise: tensor(0)
data feature 3703
ALTOPT(
  (lins): Sequential(
    (0): Linear(in_features=3703, out_features=64, bias=True)
    (1): BatchNorm1d(64, eps=1e-05, momentum=0.1, affine=True, track_running_stats=True)
    (2): Dropout(p=0.9, inplace=True)
    (3): ReLU(inplace=True)
    (4): Linear(in_features=64, out_features=6, bias=True)
    (5): LogSoftmax(dim=-1)
  )
  (prop): Propagation(K=7, mode=None, lambda1=None, lambda2=None, L21=True, alpha=0.45)
  (gcn): GCN(
    (convs): ModuleList(
      (0): GCNConv(3703, 64)
      (1): GCNConv(64, 6)
    )
    (bns): ModuleList(
      (0): BatchNorm1d(64, eps=1e-05, momentum=0.1, affine=True, track_running_stats=True)
    )
    (output): LogSoftmax(dim=-1)
  )
)
propagate done
init label
Split: 01, Run: 01
None time:  0.9936040230095387
None Run 01:
Highest Train: 100.00
Highest Valid: 71.40
  Final Train: 99.17
   Final Test: 69.50
Split: 01, Run: 02
None time:  1.103152381023392
None Run 02:
Highest Train: 100.00
Highest Valid: 71.40
  Final Train: 100.00
   Final Test: 70.10
Split: 01, Run: 03
None time:  1.033797790063545
None Run 03:
Highest Train: 100.00
Highest Valid: 71.60
  Final Train: 99.17
   Final Test: 70.20
run time now: 3.1759302616119385
total time:  3.2283001409377903
None All runs:
Highest Train: 100.00 ± 0.00
Highest Valid: 71.47 ± 0.12
  Final Train: 99.44 ± 0.48
   Final Test: 69.93 ± 0.38
[I 2023-06-11 23:25:15,062] Trial 70 finished with value: 71.46666717529297 and parameters: {'Fwd': 0.004558458402117302, 'K': 7, 'alpha': 0.45, 'dropout': 0.9, 'gnnepoch': 120, 'lambda1': 0.9500000000000001, 'lambda2': 3.3910834013645736, 'loop': 0, 'loss': 'CE', 'lr': 0.0040548002488196505, 'softmaxF': False, 'useGCN': True, 'weight_decay': 2.3426589609920833e-06, 'weightedloss': True}. Best is trial 43 with value: 71.66666412353516.
/home/wxy/miniconda3/lib/python3.10/site-packages/optuna/distributions.py:685: UserWarning: The distribution is specified by [0, 1.00001] and step=0.05, but the range is not divisible by `step`. It will be replaced by [0, 1.0].
  warnings.warn(
K:  7
alpha:  0.45
lr:  0.004281485300690869
weight_decay:  2.2754691604826635e-06
dropout:  0.9
fix split and run 3 times
Data: Data(x=[3327, 3703], y=[3327], train_mask=[3327], val_mask=[3327], test_mask=[3327], adj_t=[3327, 3327, nnz=9104])
num_train tensor(120)
num_noise 0
noise: tensor(0)
data feature 3703
ALTOPT(
  (lins): Sequential(
    (0): Linear(in_features=3703, out_features=64, bias=True)
    (1): BatchNorm1d(64, eps=1e-05, momentum=0.1, affine=True, track_running_stats=True)
    (2): Dropout(p=0.9, inplace=True)
    (3): ReLU(inplace=True)
    (4): Linear(in_features=64, out_features=6, bias=True)
    (5): LogSoftmax(dim=-1)
  )
  (prop): Propagation(K=7, mode=None, lambda1=None, lambda2=None, L21=True, alpha=0.45)
  (gcn): GCN(
    (convs): ModuleList(
      (0): GCNConv(3703, 64)
      (1): GCNConv(64, 6)
    )
    (bns): ModuleList(
      (0): BatchNorm1d(64, eps=1e-05, momentum=0.1, affine=True, track_running_stats=True)
    )
    (output): LogSoftmax(dim=-1)
  )
)
propagate done
init label
Split: 01, Run: 01
None time:  1.0719319970812649
None Run 01:
Highest Train: 100.00
Highest Valid: 71.40
  Final Train: 100.00
   Final Test: 70.20
Split: 01, Run: 02
None time:  1.0690348269417882
None Run 02:
Highest Train: 100.00
Highest Valid: 71.20
  Final Train: 98.33
   Final Test: 70.50
Split: 01, Run: 03
None time:  1.131652053911239
None Run 03:
Highest Train: 100.00
Highest Valid: 71.40
  Final Train: 98.33
   Final Test: 70.40
run time now: 3.3140108585357666
total time:  3.371447436977178
None All runs:
Highest Train: 100.00 ± 0.00
Highest Valid: 71.33 ± 0.12
  Final Train: 98.89 ± 0.96
   Final Test: 70.37 ± 0.15
