[I 2023-06-11 23:24:13,009] Trial 53 finished with value: 70.79999542236328 and parameters: {'Fwd': 0.015468977023093144, 'K': 10, 'alpha': 0.8, 'dropout': 0.4, 'gnnepoch': 110, 'lambda1': 0.35000000000000003, 'lambda2': 2.3319592877620567, 'loop': 0, 'loss': 'CE', 'lr': 0.0017194995354140258, 'softmaxF': True, 'useGCN': True, 'weight_decay': 1.5047296262065971e-06, 'weightedloss': True}. Best is trial 43 with value: 71.66666412353516.
/home/wxy/miniconda3/lib/python3.10/site-packages/optuna/distributions.py:685: UserWarning: The distribution is specified by [0, 1.00001] and step=0.05, but the range is not divisible by `step`. It will be replaced by [0, 1.0].
  warnings.warn(
K:  9
alpha:  0.9
lr:  0.0021017272479541362
weight_decay:  4.514462903618602e-06
dropout:  0.5
fix split and run 3 times
Data: Data(x=[3327, 3703], y=[3327], train_mask=[3327], val_mask=[3327], test_mask=[3327], adj_t=[3327, 3327, nnz=9104])
num_train tensor(120)
num_noise 0
noise: tensor(0)
data feature 3703
ALTOPT(
  (lins): Sequential(
    (0): Linear(in_features=3703, out_features=64, bias=True)
    (1): BatchNorm1d(64, eps=1e-05, momentum=0.1, affine=True, track_running_stats=True)
    (2): Dropout(p=0.5, inplace=True)
    (3): ReLU(inplace=True)
    (4): Linear(in_features=64, out_features=6, bias=True)
    (5): LogSoftmax(dim=-1)
  )
  (prop): Propagation(K=9, mode=None, lambda1=None, lambda2=None, L21=True, alpha=0.9)
  (gcn): GCN(
    (convs): ModuleList(
      (0): GCNConv(3703, 64)
      (1): GCNConv(64, 6)
    )
    (bns): ModuleList(
      (0): BatchNorm1d(64, eps=1e-05, momentum=0.1, affine=True, track_running_stats=True)
    )
    (output): LogSoftmax(dim=-1)
  )
)
propagate done
init label
Split: 01, Run: 01
None time:  1.0996509930118918
None Run 01:
Highest Train: 100.00
Highest Valid: 70.80
  Final Train: 100.00
   Final Test: 70.00
Split: 01, Run: 02
None time:  1.1429691661614925
None Run 02:
Highest Train: 100.00
Highest Valid: 71.20
  Final Train: 100.00
   Final Test: 69.60
Split: 01, Run: 03
None time:  1.0686153180431575
None Run 03:
Highest Train: 100.00
Highest Valid: 70.60
  Final Train: 100.00
   Final Test: 68.90
run time now: 3.353337049484253
total time:  3.412250286899507
None All runs:
Highest Train: 100.00 ± 0.00
Highest Valid: 70.87 ± 0.31
  Final Train: 100.00 ± 0.00
   Final Test: 69.50 ± 0.56
[I 2023-06-11 23:24:16,873] Trial 54 finished with value: 70.86666870117188 and parameters: {'Fwd': 0.03870769237252128, 'K': 9, 'alpha': 0.9, 'dropout': 0.5, 'gnnepoch': 120, 'lambda1': 0.45, 'lambda2': 3.6436183918904383, 'loop': 0, 'loss': 'CE', 'lr': 0.0021017272479541362, 'softmaxF': True, 'useGCN': True, 'weight_decay': 4.514462903618602e-06, 'weightedloss': True}. Best is trial 43 with value: 71.66666412353516.
/home/wxy/miniconda3/lib/python3.10/site-packages/optuna/distributions.py:685: UserWarning: The distribution is specified by [0, 1.00001] and step=0.05, but the range is not divisible by `step`. It will be replaced by [0, 1.0].
  warnings.warn(
K:  10
alpha:  0.9500000000000001
lr:  0.001310280444884375
weight_decay:  1.0500162898282214e-06
dropout:  0.2
fix split and run 3 times
Data: Data(x=[3327, 3703], y=[3327], train_mask=[3327], val_mask=[3327], test_mask=[3327], adj_t=[3327, 3327, nnz=9104])
num_train tensor(120)
num_noise 0
noise: tensor(0)
data feature 3703
ALTOPT(
  (lins): Sequential(
    (0): Linear(in_features=3703, out_features=64, bias=True)
    (1): BatchNorm1d(64, eps=1e-05, momentum=0.1, affine=True, track_running_stats=True)
    (2): Dropout(p=0.2, inplace=True)
    (3): ReLU(inplace=True)
    (4): Linear(in_features=64, out_features=6, bias=True)
    (5): LogSoftmax(dim=-1)
  )
  (prop): Propagation(K=10, mode=None, lambda1=None, lambda2=None, L21=True, alpha=0.9500000000000001)
  (gcn): GCN(
    (convs): ModuleList(
      (0): GCNConv(3703, 64)
      (1): GCNConv(64, 6)
    )
    (bns): ModuleList(
      (0): BatchNorm1d(64, eps=1e-05, momentum=0.1, affine=True, track_running_stats=True)
    )
    (output): LogSoftmax(dim=-1)
  )
)
propagate done
init label
Split: 01, Run: 01
None time:  0.8476761800702661
None Run 01:
Highest Train: 100.00
Highest Valid: 70.80
  Final Train: 100.00
   Final Test: 69.10
Split: 01, Run: 02, Epoch: 100, Loss: 0.0000, Train: 100.00%, Valid: 70.20% Test: 69.80%
Split: 01, Run: 02
None time:  1.8336139349266887
None Run 02:
Highest Train: 100.00
Highest Valid: 70.20
  Final Train: 100.00
   Final Test: 69.50
Split: 01, Run: 03
None time:  0.8752298098988831
None Run 03:
Highest Train: 100.00
Highest Valid: 69.80
  Final Train: 100.00
   Final Test: 68.80
run time now: 3.6119544506073
total time:  3.679773753043264
None All runs:
Highest Train: 100.00 ± 0.00
Highest Valid: 70.27 ± 0.50
  Final Train: 100.00 ± 0.00
   Final Test: 69.13 ± 0.35
[I 2023-06-11 23:24:21,048] Trial 55 finished with value: 70.26667022705078 and parameters: {'Fwd': 0.06669208522456845, 'K': 10, 'alpha': 0.9500000000000001, 'dropout': 0.2, 'gnnepoch': 90, 'lambda1': 0.4, 'lambda2': 1.4687778342969793, 'loop': 0, 'loss': 'CE', 'lr': 0.001310280444884375, 'softmaxF': True, 'useGCN': True, 'weight_decay': 1.0500162898282214e-06, 'weightedloss': True}. Best is trial 43 with value: 71.66666412353516.
/home/wxy/miniconda3/lib/python3.10/site-packages/optuna/distributions.py:685: UserWarning: The distribution is specified by [0, 1.00001] and step=0.05, but the range is not divisible by `step`. It will be replaced by [0, 1.0].
  warnings.warn(
K:  9
alpha:  0.5
lr:  0.0016372845101015163
weight_decay:  7.2921095440052405e-06
dropout:  0.30000000000000004
fix split and run 3 times
Data: Data(x=[3327, 3703], y=[3327], train_mask=[3327], val_mask=[3327], test_mask=[3327], adj_t=[3327, 3327, nnz=9104])
num_train tensor(120)
num_noise 0
noise: tensor(0)
data feature 3703
ALTOPT(
  (lins): Sequential(
    (0): Linear(in_features=3703, out_features=64, bias=True)
    (1): BatchNorm1d(64, eps=1e-05, momentum=0.1, affine=True, track_running_stats=True)
    (2): Dropout(p=0.30000000000000004, inplace=True)
    (3): ReLU(inplace=True)
    (4): Linear(in_features=64, out_features=6, bias=True)
    (5): LogSoftmax(dim=-1)
  )
  (prop): Propagation(K=9, mode=None, lambda1=None, lambda2=None, L21=True, alpha=0.5)
  (gcn): GCN(
    (convs): ModuleList(
      (0): GCNConv(3703, 64)
      (1): GCNConv(64, 6)
    )
    (bns): ModuleList(
      (0): BatchNorm1d(64, eps=1e-05, momentum=0.1, affine=True, track_running_stats=True)
    )
    (output): LogSoftmax(dim=-1)
  )
)
propagate done
init label
Split: 01, Run: 01
None time:  0.7589357900433242
None Run 01:
Highest Train: 100.00
Highest Valid: 71.00
  Final Train: 100.00
   Final Test: 69.40
Split: 01, Run: 02
None time:  0.7898005610331893
None Run 02:
Highest Train: 100.00
Highest Valid: 70.20
  Final Train: 100.00
   Final Test: 69.40
Split: 01, Run: 03
None time:  0.7393079460598528
None Run 03:
Highest Train: 100.00
Highest Valid: 70.80
  Final Train: 100.00
   Final Test: 68.90
run time now: 2.329573631286621
total time:  2.3852819679304957
None All runs:
Highest Train: 100.00 ± 0.00
Highest Valid: 70.67 ± 0.42
  Final Train: 100.00 ± 0.00
   Final Test: 69.23 ± 0.29
[I 2023-06-11 23:24:23,916] Trial 56 finished with value: 70.66667175292969 and parameters: {'Fwd': 0.0064795953005829824, 'K': 9, 'alpha': 0.5, 'dropout': 0.30000000000000004, 'gnnepoch': 80, 'lambda1': 0.65, 'lambda2': 3.0221170815400855, 'loop': 0, 'loss': 'CE', 'lr': 0.0016372845101015163, 'softmaxF': False, 'useGCN': True, 'weight_decay': 7.2921095440052405e-06, 'weightedloss': True}. Best is trial 43 with value: 71.66666412353516.
/home/wxy/miniconda3/lib/python3.10/site-packages/optuna/distributions.py:685: UserWarning: The distribution is specified by [0, 1.00001] and step=0.05, but the range is not divisible by `step`. It will be replaced by [0, 1.0].
  warnings.warn(
K:  7
alpha:  0.6000000000000001
lr:  0.0021063023031032903
weight_decay:  2.6879437056894033e-06
dropout:  0.4
fix split and run 3 times
Data: Data(x=[3327, 3703], y=[3327], train_mask=[3327], val_mask=[3327], test_mask=[3327], adj_t=[3327, 3327, nnz=9104])
num_train tensor(120)
num_noise 0
noise: tensor(0)
data feature 3703
ALTOPT(
  (lins): Sequential(
    (0): Linear(in_features=3703, out_features=64, bias=True)
    (1): BatchNorm1d(64, eps=1e-05, momentum=0.1, affine=True, track_running_stats=True)
    (2): Dropout(p=0.4, inplace=True)
    (3): ReLU(inplace=True)
    (4): Linear(in_features=64, out_features=6, bias=True)
    (5): Identity()
  )
  (prop): Propagation(K=7, mode=None, lambda1=None, lambda2=None, L21=True, alpha=0.6000000000000001)
  (gcn): GCN(
    (convs): ModuleList(
      (0): GCNConv(3703, 64)
      (1): GCNConv(64, 6)
    )
    (bns): ModuleList(
      (0): BatchNorm1d(64, eps=1e-05, momentum=0.1, affine=True, track_running_stats=True)
    )
    (output): Identity()
  )
)
propagate done
init label
Split: 01, Run: 01, Epoch: 100, Loss: 0.0000, Train: 100.00%, Valid: 66.80% Test: 68.50%
Split: 01, Run: 01
None time:  1.5153627109248191
None Run 01:
Highest Train: 100.00
Highest Valid: 66.80
  Final Train: 100.00
   Final Test: 68.50
Split: 01, Run: 02, Epoch: 100, Loss: 0.0000, Train: 100.00%, Valid: 67.60% Test: 68.30%
Split: 01, Run: 02
None time:  1.634095752146095
None Run 02:
Highest Train: 100.00
Highest Valid: 67.60
  Final Train: 100.00
   Final Test: 68.20
Split: 01, Run: 03, Epoch: 100, Loss: 0.0000, Train: 100.00%, Valid: 67.60% Test: 68.10%
Split: 01, Run: 03
None time:  1.568526108050719
None Run 03:
Highest Train: 100.00
Highest Valid: 67.60
  Final Train: 100.00
   Final Test: 68.10
run time now: 4.757350921630859
total time:  4.815703527070582
None All runs:
Highest Train: 100.00 ± 0.00
Highest Valid: 67.33 ± 0.46
  Final Train: 100.00 ± 0.00
   Final Test: 68.27 ± 0.21
[I 2023-06-11 23:24:29,165] Trial 57 finished with value: 67.33333587646484 and parameters: {'Fwd': 0.017339251732507208, 'K': 7, 'alpha': 0.6000000000000001, 'dropout': 0.4, 'gnnepoch': 100, 'lambda1': 0.5, 'lambda2': 4.166224273669282, 'loop': 0, 'loss': 'MSE', 'lr': 0.0021063023031032903, 'softmaxF': True, 'useGCN': True, 'weight_decay': 2.6879437056894033e-06, 'weightedloss': True}. Best is trial 43 with value: 71.66666412353516.
/home/wxy/miniconda3/lib/python3.10/site-packages/optuna/distributions.py:685: UserWarning: The distribution is specified by [0, 1.00001] and step=0.05, but the range is not divisible by `step`. It will be replaced by [0, 1.0].
  warnings.warn(
K:  10
alpha:  0.8500000000000001
lr:  0.002990927424897835
weight_decay:  3.889821533840429e-06
dropout:  0.6000000000000001
fix split and run 3 times
Data: Data(x=[3327, 3703], y=[3327], train_mask=[3327], val_mask=[3327], test_mask=[3327], adj_t=[3327, 3327, nnz=9104])
num_train tensor(120)
num_noise 0
noise: tensor(0)
data feature 3703
ALTOPT(
  (lins): Sequential(
    (0): Linear(in_features=3703, out_features=64, bias=True)
    (1): BatchNorm1d(64, eps=1e-05, momentum=0.1, affine=True, track_running_stats=True)
    (2): Dropout(p=0.6000000000000001, inplace=True)
    (3): ReLU(inplace=True)
    (4): Linear(in_features=64, out_features=6, bias=True)
    (5): LogSoftmax(dim=-1)
  )
  (prop): Propagation(K=10, mode=None, lambda1=None, lambda2=None, L21=True, alpha=0.8500000000000001)
  (gcn): GCN(
    (convs): ModuleList(
      (0): GCNConv(3703, 64)
      (1): GCNConv(64, 6)
    )
    (bns): ModuleList(
      (0): BatchNorm1d(64, eps=1e-05, momentum=0.1, affine=True, track_running_stats=True)
    )
    (output): LogSoftmax(dim=-1)
  )
)
propagate done
init label
Split: 01, Run: 01, Epoch: 100, Loss: 0.0000, Train: 100.00%, Valid: 52.00% Test: 53.00%
Split: 01, Run: 01
None time:  1.3921398129314184
None Run 01:
Highest Train: 100.00
Highest Valid: 52.00
  Final Train: 100.00
   Final Test: 52.90
Split: 01, Run: 02
None time:  0.7224926631897688
None Run 02:
Highest Train: 100.00
Highest Valid: 56.20
  Final Train: 100.00
   Final Test: 54.00
Split: 01, Run: 03
None time:  0.7937244260683656
None Run 03:
Highest Train: 100.00
Highest Valid: 47.20
  Final Train: 100.00
   Final Test: 46.70
run time now: 2.9518821239471436
total time:  3.0034244949929416
None All runs:
Highest Train: 100.00 ± 0.00
Highest Valid: 51.80 ± 4.50
  Final Train: 100.00 ± 0.00
   Final Test: 51.20 ± 3.94
[I 2023-06-11 23:24:32,601] Trial 58 finished with value: 51.79999923706055 and parameters: {'Fwd': 0.07128541548549518, 'K': 10, 'alpha': 0.8500000000000001, 'dropout': 0.6000000000000001, 'gnnepoch': 120, 'lambda1': 0.6000000000000001, 'lambda2': 4.846626080372298, 'loop': 0, 'loss': 'CE', 'lr': 0.002990927424897835, 'softmaxF': True, 'useGCN': False, 'weight_decay': 3.889821533840429e-06, 'weightedloss': True}. Best is trial 43 with value: 71.66666412353516.
/home/wxy/miniconda3/lib/python3.10/site-packages/optuna/distributions.py:685: UserWarning: The distribution is specified by [0, 1.00001] and step=0.05, but the range is not divisible by `step`. It will be replaced by [0, 1.0].
  warnings.warn(
K:  4
alpha:  0.75
lr:  0.0014225745188597779
weight_decay:  9.90460014369509e-06
dropout:  0.30000000000000004
fix split and run 3 times
Data: Data(x=[3327, 3703], y=[3327], train_mask=[3327], val_mask=[3327], test_mask=[3327], adj_t=[3327, 3327, nnz=9104])
num_train tensor(120)
num_noise 0
noise: tensor(0)
data feature 3703
ALTOPT(
  (lins): Sequential(
    (0): Linear(in_features=3703, out_features=64, bias=True)
    (1): BatchNorm1d(64, eps=1e-05, momentum=0.1, affine=True, track_running_stats=True)
    (2): Dropout(p=0.30000000000000004, inplace=True)
    (3): ReLU(inplace=True)
    (4): Linear(in_features=64, out_features=6, bias=True)
    (5): LogSoftmax(dim=-1)
  )
  (prop): Propagation(K=4, mode=None, lambda1=None, lambda2=None, L21=True, alpha=0.75)
  (gcn): GCN(
    (convs): ModuleList(
      (0): GCNConv(3703, 64)
      (1): GCNConv(64, 6)
    )
    (bns): ModuleList(
      (0): BatchNorm1d(64, eps=1e-05, momentum=0.1, affine=True, track_running_stats=True)
    )
    (output): LogSoftmax(dim=-1)
  )
)
propagate done
init label
Split: 01, Run: 01
None time:  0.129993150010705
None Run 01:
Highest Train: 100.00
Highest Valid: 52.00
  Final Train: 100.00
   Final Test: 50.00
Split: 01, Run: 02, Epoch: 100, Loss: 0.0000, Train: 100.00%, Valid: 51.00% Test: 49.30%
Split: 01, Run: 02
None time:  0.6400502629112452
None Run 02:
Highest Train: 100.00
Highest Valid: 51.00
  Final Train: 100.00
   Final Test: 49.20
Split: 01, Run: 03, Epoch: 100, Loss: 0.0000, Train: 100.00%, Valid: 51.80% Test: 53.40%
Split: 01, Run: 03
None time:  0.6678198268637061
None Run 03:
Highest Train: 100.00
Highest Valid: 51.80
  Final Train: 100.00
   Final Test: 52.80
run time now: 1.4755079746246338
total time:  1.5338285388424993
None All runs:
Highest Train: 100.00 ± 0.00
Highest Valid: 51.60 ± 0.53
  Final Train: 100.00 ± 0.00
   Final Test: 50.67 ± 1.89
[I 2023-06-11 23:24:34,506] Trial 59 finished with value: 51.60000228881836 and parameters: {'Fwd': 0.036052661448961534, 'K': 4, 'alpha': 0.75, 'dropout': 0.30000000000000004, 'gnnepoch': 0, 'lambda1': 0.55, 'lambda2': 5.520828158550007, 'loop': 0, 'loss': 'CE', 'lr': 0.0014225745188597779, 'softmaxF': True, 'useGCN': True, 'weight_decay': 9.90460014369509e-06, 'weightedloss': False}. Best is trial 43 with value: 71.66666412353516.
/home/wxy/miniconda3/lib/python3.10/site-packages/optuna/distributions.py:685: UserWarning: The distribution is specified by [0, 1.00001] and step=0.05, but the range is not divisible by `step`. It will be replaced by [0, 1.0].
  warnings.warn(
K:  2
alpha:  0.65
lr:  0.001216429908405978
weight_decay:  1.5130570190007354e-06
dropout:  0.5
fix split and run 3 times
Data: Data(x=[3327, 3703], y=[3327], train_mask=[3327], val_mask=[3327], test_mask=[3327], adj_t=[3327, 3327, nnz=9104])
num_train tensor(120)
num_noise 0
noise: tensor(0)
data feature 3703
ALTOPT(
  (lins): Sequential(
    (0): Linear(in_features=3703, out_features=64, bias=True)
    (1): BatchNorm1d(64, eps=1e-05, momentum=0.1, affine=True, track_running_stats=True)
    (2): Dropout(p=0.5, inplace=True)
    (3): ReLU(inplace=True)
    (4): Linear(in_features=64, out_features=6, bias=True)
    (5): LogSoftmax(dim=-1)
  )
  (prop): Propagation(K=2, mode=None, lambda1=None, lambda2=None, L21=True, alpha=0.65)
  (gcn): GCN(
    (convs): ModuleList(
      (0): GCNConv(3703, 64)
      (1): GCNConv(64, 6)
    )
    (bns): ModuleList(
      (0): BatchNorm1d(64, eps=1e-05, momentum=0.1, affine=True, track_running_stats=True)
    )
    (output): LogSoftmax(dim=-1)
  )
)
propagate done
init label
Split: 01, Run: 01
None time:  0.9455519178882241
None Run 01:
Highest Train: 100.00
Highest Valid: 70.60
  Final Train: 100.00
   Final Test: 69.10
Split: 01, Run: 02
None time:  0.924837184837088
None Run 02:
Highest Train: 100.00
Highest Valid: 70.00
  Final Train: 99.17
   Final Test: 68.60
Split: 01, Run: 03
None time:  0.8690774091519415
None Run 03:
Highest Train: 100.00
Highest Valid: 70.00
  Final Train: 100.00
   Final Test: 69.40
run time now: 2.774390697479248
total time:  2.828582762973383
None All runs:
Highest Train: 100.00 ± 0.00
Highest Valid: 70.20 ± 0.35
  Final Train: 99.72 ± 0.48
   Final Test: 69.03 ± 0.40
[I 2023-06-11 23:24:37,841] Trial 60 finished with value: 70.20000457763672 and parameters: {'Fwd': 0.09942273205169604, 'K': 2, 'alpha': 0.65, 'dropout': 0.5, 'gnnepoch': 80, 'lambda1': 0.25, 'lambda2': 0.07975090531475004, 'loop': 2, 'loss': 'CE', 'lr': 0.001216429908405978, 'softmaxF': True, 'useGCN': True, 'weight_decay': 1.5130570190007354e-06, 'weightedloss': True}. Best is trial 43 with value: 71.66666412353516.
/home/wxy/miniconda3/lib/python3.10/site-packages/optuna/distributions.py:685: UserWarning: The distribution is specified by [0, 1.00001] and step=0.05, but the range is not divisible by `step`. It will be replaced by [0, 1.0].
  warnings.warn(
K:  9
alpha:  0.25
lr:  0.002214162365474469
weight_decay:  7.1814038698280754e-06
dropout:  0.6000000000000001
fix split and run 3 times
Data: Data(x=[3327, 3703], y=[3327], train_mask=[3327], val_mask=[3327], test_mask=[3327], adj_t=[3327, 3327, nnz=9104])
num_train tensor(120)
num_noise 0
noise: tensor(0)
data feature 3703
ALTOPT(
  (lins): Sequential(
    (0): Linear(in_features=3703, out_features=64, bias=True)
    (1): BatchNorm1d(64, eps=1e-05, momentum=0.1, affine=True, track_running_stats=True)
    (2): Dropout(p=0.6000000000000001, inplace=True)
    (3): ReLU(inplace=True)
    (4): Linear(in_features=64, out_features=6, bias=True)
    (5): LogSoftmax(dim=-1)
  )
  (prop): Propagation(K=9, mode=None, lambda1=None, lambda2=None, L21=True, alpha=0.25)
  (gcn): GCN(
    (convs): ModuleList(
      (0): GCNConv(3703, 64)
      (1): GCNConv(64, 6)
    )
    (bns): ModuleList(
      (0): BatchNorm1d(64, eps=1e-05, momentum=0.1, affine=True, track_running_stats=True)
    )
    (output): LogSoftmax(dim=-1)
  )
)
propagate done
init label
Split: 01, Run: 01
None time:  0.9565765319857746
None Run 01:
Highest Train: 100.00
Highest Valid: 70.80
  Final Train: 100.00
   Final Test: 70.10
Split: 01, Run: 02
None time:  0.9438368640840054
None Run 02:
Highest Train: 100.00
Highest Valid: 71.40
  Final Train: 100.00
   Final Test: 70.10
Split: 01, Run: 03
None time:  1.078386059962213
None Run 03:
Highest Train: 100.00
Highest Valid: 70.80
  Final Train: 100.00
   Final Test: 69.20
run time now: 3.027038097381592
total time:  3.0874142420943826
None All runs:
Highest Train: 100.00 ± 0.00
Highest Valid: 71.00 ± 0.35
  Final Train: 100.00 ± 0.00
   Final Test: 69.80 ± 0.52
[I 2023-06-11 23:24:41,479] Trial 61 finished with value: 71.00000762939453 and parameters: {'Fwd': 0.015296325547385872, 'K': 9, 'alpha': 0.25, 'dropout': 0.6000000000000001, 'gnnepoch': 120, 'lambda1': 0.6000000000000001, 'lambda2': 4.224317834690916, 'loop': 0, 'loss': 'CE', 'lr': 0.002214162365474469, 'softmaxF': False, 'useGCN': True, 'weight_decay': 7.1814038698280754e-06, 'weightedloss': True}. Best is trial 43 with value: 71.66666412353516.
/home/wxy/miniconda3/lib/python3.10/site-packages/optuna/distributions.py:685: UserWarning: The distribution is specified by [0, 1.00001] and step=0.05, but the range is not divisible by `step`. It will be replaced by [0, 1.0].
  warnings.warn(
K:  9
alpha:  0.1
lr:  0.0023464773146322205
weight_decay:  2.5668487686349097e-06
dropout:  0.7000000000000001
fix split and run 3 times
Data: Data(x=[3327, 3703], y=[3327], train_mask=[3327], val_mask=[3327], test_mask=[3327], adj_t=[3327, 3327, nnz=9104])
num_train tensor(120)
num_noise 0
noise: tensor(0)
data feature 3703
ALTOPT(
  (lins): Sequential(
    (0): Linear(in_features=3703, out_features=64, bias=True)
    (1): BatchNorm1d(64, eps=1e-05, momentum=0.1, affine=True, track_running_stats=True)
    (2): Dropout(p=0.7000000000000001, inplace=True)
    (3): ReLU(inplace=True)
    (4): Linear(in_features=64, out_features=6, bias=True)
    (5): LogSoftmax(dim=-1)
  )
  (prop): Propagation(K=9, mode=None, lambda1=None, lambda2=None, L21=True, alpha=0.1)
  (gcn): GCN(
    (convs): ModuleList(
      (0): GCNConv(3703, 64)
      (1): GCNConv(64, 6)
    )
    (bns): ModuleList(
      (0): BatchNorm1d(64, eps=1e-05, momentum=0.1, affine=True, track_running_stats=True)
    )
    (output): LogSoftmax(dim=-1)
  )
)
propagate done
init label
Split: 01, Run: 01
None time:  0.9767926861532032
None Run 01:
Highest Train: 100.00
Highest Valid: 71.80
  Final Train: 100.00
   Final Test: 69.80
Split: 01, Run: 02
None time:  1.0167241028975695
None Run 02:
Highest Train: 100.00
Highest Valid: 70.80
  Final Train: 100.00
   Final Test: 69.10
Split: 01, Run: 03
None time:  1.0087561919353902
None Run 03:
Highest Train: 100.00
Highest Valid: 71.40
  Final Train: 100.00
   Final Test: 69.40
run time now: 3.0447568893432617
total time:  3.0991955699864775
None All runs:
Highest Train: 100.00 ± 0.00
Highest Valid: 71.33 ± 0.50
  Final Train: 100.00 ± 0.00
   Final Test: 69.43 ± 0.35
