[I 2023-06-12 00:13:50,675] Trial 17 finished with value: 79.5999984741211 and parameters: {'Fwd': 0.08059608375164927, 'K': 8, 'alpha': 0.75, 'dropout': 0.8, 'gnnepoch': 70, 'lambda1': 0.1, 'lambda2': 9.843115888237566, 'loop': 2, 'loss': 'CE', 'lr': 0.0040860551931358085, 'softmaxF': False, 'useGCN': True, 'weight_decay': 0.002491410702465506, 'weightedloss': True}. Best is trial 17 with value: 79.5999984741211.
/home/wxy/miniconda3/lib/python3.10/site-packages/optuna/distributions.py:685: UserWarning: The distribution is specified by [0, 1.00001] and step=0.05, but the range is not divisible by `step`. It will be replaced by [0, 1.0].
  warnings.warn(
K:  8
alpha:  0.75
lr:  0.004122112129074228
weight_decay:  0.024098331961989686
dropout:  0.8
fix split and run 3 times
Data: Data(x=[2708, 1433], y=[2708], train_mask=[2708], val_mask=[2708], test_mask=[2708], adj_t=[2708, 2708, nnz=10556])
num_train tensor(140)
num_noise 0
noise: tensor(0)
data feature 1433
ALTOPT(
  (lins): Sequential(
    (0): Linear(in_features=1433, out_features=64, bias=True)
    (1): BatchNorm1d(64, eps=1e-05, momentum=0.1, affine=True, track_running_stats=True)
    (2): Dropout(p=0.8, inplace=True)
    (3): ReLU(inplace=True)
    (4): Linear(in_features=64, out_features=7, bias=True)
    (5): Identity()
  )
  (prop): Propagation(K=8, mode=None, lambda1=None, lambda2=None, L21=True, alpha=0.75)
  (gcn): GCN(
    (convs): ModuleList(
      (0): GCNConv(1433, 64)
      (1): GCNConv(64, 7)
    )
    (bns): ModuleList(
      (0): BatchNorm1d(64, eps=1e-05, momentum=0.1, affine=True, track_running_stats=True)
    )
    (output): Identity()
  )
)
propagate done
init label
Split: 01, Run: 01
None time:  2.3775270979385823
None Run 01:
Highest Train: 100.00
Highest Valid: 79.80
  Final Train: 100.00
   Final Test: 80.00
Split: 01, Run: 02
None time:  3.6631861010100693
None Run 02:
Highest Train: 100.00
Highest Valid: 81.20
  Final Train: 100.00
   Final Test: 82.80
Split: 01, Run: 03
None time:  1.3147898120805621
None Run 03:
Highest Train: 100.00
Highest Valid: 79.00
  Final Train: 100.00
   Final Test: 80.00
run time now: 7.383740186691284
total time:  7.401145511073992
None All runs:
Highest Train: 100.00 ± 0.00
Highest Valid: 80.00 ± 1.11
  Final Train: 100.00 ± 0.00
   Final Test: 80.93 ± 1.62
[I 2023-06-12 00:13:58,621] Trial 18 finished with value: 80.0 and parameters: {'Fwd': 0.061861981757085835, 'K': 8, 'alpha': 0.75, 'dropout': 0.8, 'gnnepoch': 80, 'lambda1': 0.1, 'lambda2': 9.547807356123998, 'loop': 1, 'loss': 'MSE', 'lr': 0.004122112129074228, 'softmaxF': False, 'useGCN': True, 'weight_decay': 0.024098331961989686, 'weightedloss': True}. Best is trial 18 with value: 80.0.
/home/wxy/miniconda3/lib/python3.10/site-packages/optuna/distributions.py:685: UserWarning: The distribution is specified by [0, 1.00001] and step=0.05, but the range is not divisible by `step`. It will be replaced by [0, 1.0].
  warnings.warn(
K:  4
alpha:  0.75
lr:  0.004981896933255861
weight_decay:  0.0019112170504015796
dropout:  0.8
fix split and run 3 times
Data: Data(x=[2708, 1433], y=[2708], train_mask=[2708], val_mask=[2708], test_mask=[2708], adj_t=[2708, 2708, nnz=10556])
num_train tensor(140)
num_noise 0
noise: tensor(0)
data feature 1433
ALTOPT(
  (lins): Sequential(
    (0): Linear(in_features=1433, out_features=64, bias=True)
    (1): BatchNorm1d(64, eps=1e-05, momentum=0.1, affine=True, track_running_stats=True)
    (2): Dropout(p=0.8, inplace=True)
    (3): ReLU(inplace=True)
    (4): Linear(in_features=64, out_features=7, bias=True)
    (5): Identity()
  )
  (prop): Propagation(K=4, mode=None, lambda1=None, lambda2=None, L21=True, alpha=0.75)
  (gcn): GCN(
    (convs): ModuleList(
      (0): GCNConv(1433, 64)
      (1): GCNConv(64, 7)
    )
    (bns): ModuleList(
      (0): BatchNorm1d(64, eps=1e-05, momentum=0.1, affine=True, track_running_stats=True)
    )
    (output): Identity()
  )
)
propagate done
init label
Split: 01, Run: 01
None time:  1.6613855171017349
None Run 01:
Highest Train: 100.00
Highest Valid: 79.60
  Final Train: 100.00
   Final Test: 80.40
Split: 01, Run: 02
None time:  2.102658992866054
None Run 02:
Highest Train: 100.00
Highest Valid: 79.20
  Final Train: 100.00
   Final Test: 79.40
Split: 01, Run: 03
None time:  2.743333112914115
None Run 03:
Highest Train: 100.00
Highest Valid: 81.20
  Final Train: 100.00
   Final Test: 80.40
run time now: 6.533331632614136
total time:  6.560381466988474
None All runs:
Highest Train: 100.00 ± 0.00
Highest Valid: 80.00 ± 1.06
  Final Train: 100.00 ± 0.00
   Final Test: 80.07 ± 0.58
[I 2023-06-12 00:14:05,746] Trial 19 finished with value: 79.99999237060547 and parameters: {'Fwd': 0.04392146848057891, 'K': 4, 'alpha': 0.75, 'dropout': 0.8, 'gnnepoch': 70, 'lambda1': 0.1, 'lambda2': 9.82886908597373, 'loop': 1, 'loss': 'MSE', 'lr': 0.004981896933255861, 'softmaxF': False, 'useGCN': True, 'weight_decay': 0.0019112170504015796, 'weightedloss': True}. Best is trial 18 with value: 80.0.
/home/wxy/miniconda3/lib/python3.10/site-packages/optuna/distributions.py:685: UserWarning: The distribution is specified by [0, 1.00001] and step=0.05, but the range is not divisible by `step`. It will be replaced by [0, 1.0].
  warnings.warn(
K:  4
alpha:  1.0
lr:  0.007344251556911888
weight_decay:  0.023061042040638104
dropout:  0.8
fix split and run 3 times
Data: Data(x=[2708, 1433], y=[2708], train_mask=[2708], val_mask=[2708], test_mask=[2708], adj_t=[2708, 2708, nnz=10556])
num_train tensor(140)
num_noise 0
noise: tensor(0)
data feature 1433
ALTOPT(
  (lins): Sequential(
    (0): Linear(in_features=1433, out_features=64, bias=True)
    (1): BatchNorm1d(64, eps=1e-05, momentum=0.1, affine=True, track_running_stats=True)
    (2): Dropout(p=0.8, inplace=True)
    (3): ReLU(inplace=True)
    (4): Linear(in_features=64, out_features=7, bias=True)
    (5): Identity()
  )
  (prop): Propagation(K=4, mode=None, lambda1=None, lambda2=None, L21=True, alpha=1.0)
  (gcn): GCN(
    (convs): ModuleList(
      (0): GCNConv(1433, 64)
      (1): GCNConv(64, 7)
    )
    (bns): ModuleList(
      (0): BatchNorm1d(64, eps=1e-05, momentum=0.1, affine=True, track_running_stats=True)
    )
    (output): Identity()
  )
)
propagate done
init label
Split: 01, Run: 01, Epoch: 100, Loss: 0.1551, Train: 100.00%, Valid: 72.60% Test: 73.20%
Split: 01, Run: 01
None time:  4.971466238843277
None Run 01:
Highest Train: 100.00
Highest Valid: 72.60
  Final Train: 100.00
   Final Test: 73.20
Split: 01, Run: 02, Epoch: 100, Loss: 0.1591, Train: 100.00%, Valid: 72.60% Test: 73.20%
Split: 01, Run: 02
None time:  5.02408313495107
None Run 02:
Highest Train: 100.00
Highest Valid: 72.60
  Final Train: 100.00
   Final Test: 73.20
Split: 01, Run: 03, Epoch: 100, Loss: 0.1629, Train: 100.00%, Valid: 72.60% Test: 73.20%
Split: 01, Run: 03
None time:  4.880301327910274
None Run 03:
Highest Train: 100.00
Highest Valid: 72.60
  Final Train: 100.00
   Final Test: 73.20
run time now: 14.900028944015503
total time:  14.928459024988115
None All runs:
Highest Train: 100.00 ± 0.00
Highest Valid: 72.60 ± 0.00
  Final Train: 100.00 ± 0.00
   Final Test: 73.20 ± 0.00
[I 2023-06-12 00:14:21,133] Trial 20 finished with value: 72.5999984741211 and parameters: {'Fwd': 0.09354602821307596, 'K': 4, 'alpha': 1.0, 'dropout': 0.8, 'gnnepoch': 100, 'lambda1': 0.0, 'lambda2': 9.757724066330166, 'loop': 1, 'loss': 'MSE', 'lr': 0.007344251556911888, 'softmaxF': False, 'useGCN': True, 'weight_decay': 0.023061042040638104, 'weightedloss': True}. Best is trial 18 with value: 80.0.
/home/wxy/miniconda3/lib/python3.10/site-packages/optuna/distributions.py:685: UserWarning: The distribution is specified by [0, 1.00001] and step=0.05, but the range is not divisible by `step`. It will be replaced by [0, 1.0].
  warnings.warn(
K:  4
alpha:  0.75
lr:  0.004374203004754441
weight_decay:  0.0018953434849108904
dropout:  0.8
fix split and run 3 times
Data: Data(x=[2708, 1433], y=[2708], train_mask=[2708], val_mask=[2708], test_mask=[2708], adj_t=[2708, 2708, nnz=10556])
num_train tensor(140)
num_noise 0
noise: tensor(0)
data feature 1433
ALTOPT(
  (lins): Sequential(
    (0): Linear(in_features=1433, out_features=64, bias=True)
    (1): BatchNorm1d(64, eps=1e-05, momentum=0.1, affine=True, track_running_stats=True)
    (2): Dropout(p=0.8, inplace=True)
    (3): ReLU(inplace=True)
    (4): Linear(in_features=64, out_features=7, bias=True)
    (5): Identity()
  )
  (prop): Propagation(K=4, mode=None, lambda1=None, lambda2=None, L21=True, alpha=0.75)
  (gcn): GCN(
    (convs): ModuleList(
      (0): GCNConv(1433, 64)
      (1): GCNConv(64, 7)
    )
    (bns): ModuleList(
      (0): BatchNorm1d(64, eps=1e-05, momentum=0.1, affine=True, track_running_stats=True)
    )
    (output): Identity()
  )
)
propagate done
init label
Split: 01, Run: 01
None time:  2.0485788439400494
None Run 01:
Highest Train: 100.00
Highest Valid: 79.40
  Final Train: 100.00
   Final Test: 79.10
Split: 01, Run: 02
None time:  1.793287588050589
None Run 02:
Highest Train: 100.00
Highest Valid: 79.20
  Final Train: 100.00
   Final Test: 81.00
Split: 01, Run: 03
None time:  1.734334760112688
None Run 03:
Highest Train: 100.00
Highest Valid: 78.80
  Final Train: 100.00
   Final Test: 78.60
run time now: 5.599426507949829
total time:  5.621456522960216
None All runs:
Highest Train: 100.00 ± 0.00
Highest Valid: 79.13 ± 0.31
  Final Train: 100.00 ± 0.00
   Final Test: 79.57 ± 1.27
[I 2023-06-12 00:14:27,216] Trial 21 finished with value: 79.13333129882812 and parameters: {'Fwd': 0.09878889410907046, 'K': 4, 'alpha': 0.75, 'dropout': 0.8, 'gnnepoch': 70, 'lambda1': 0.1, 'lambda2': 9.94940708859267, 'loop': 1, 'loss': 'MSE', 'lr': 0.004374203004754441, 'softmaxF': False, 'useGCN': True, 'weight_decay': 0.0018953434849108904, 'weightedloss': True}. Best is trial 18 with value: 80.0.
/home/wxy/miniconda3/lib/python3.10/site-packages/optuna/distributions.py:685: UserWarning: The distribution is specified by [0, 1.00001] and step=0.05, but the range is not divisible by `step`. It will be replaced by [0, 1.0].
  warnings.warn(
K:  5
alpha:  0.8
lr:  0.004705558515445022
weight_decay:  0.0011708560981867912
dropout:  0.8
fix split and run 3 times
Data: Data(x=[2708, 1433], y=[2708], train_mask=[2708], val_mask=[2708], test_mask=[2708], adj_t=[2708, 2708, nnz=10556])
num_train tensor(140)
num_noise 0
noise: tensor(0)
data feature 1433
ALTOPT(
  (lins): Sequential(
    (0): Linear(in_features=1433, out_features=64, bias=True)
    (1): BatchNorm1d(64, eps=1e-05, momentum=0.1, affine=True, track_running_stats=True)
    (2): Dropout(p=0.8, inplace=True)
    (3): ReLU(inplace=True)
    (4): Linear(in_features=64, out_features=7, bias=True)
    (5): Identity()
  )
  (prop): Propagation(K=5, mode=None, lambda1=None, lambda2=None, L21=True, alpha=0.8)
  (gcn): GCN(
    (convs): ModuleList(
      (0): GCNConv(1433, 64)
      (1): GCNConv(64, 7)
    )
    (bns): ModuleList(
      (0): BatchNorm1d(64, eps=1e-05, momentum=0.1, affine=True, track_running_stats=True)
    )
    (output): Identity()
  )
)
propagate done
init label
Split: 01, Run: 01
None time:  1.651206969982013
None Run 01:
Highest Train: 100.00
Highest Valid: 79.40
  Final Train: 100.00
   Final Test: 80.30
Split: 01, Run: 02
None time:  3.9322058288380504
None Run 02:
Highest Train: 100.00
Highest Valid: 80.00
  Final Train: 100.00
   Final Test: 80.60
Split: 01, Run: 03
None time:  3.104379286058247
None Run 03:
Highest Train: 100.00
Highest Valid: 80.20
  Final Train: 100.00
   Final Test: 81.60
run time now: 8.713324069976807
total time:  8.733215742046013
None All runs:
Highest Train: 100.00 ± 0.00
Highest Valid: 79.87 ± 0.42
  Final Train: 100.00 ± 0.00
   Final Test: 80.83 ± 0.68
[I 2023-06-12 00:14:36,426] Trial 22 finished with value: 79.86666107177734 and parameters: {'Fwd': 0.012011677032433143, 'K': 5, 'alpha': 0.8, 'dropout': 0.8, 'gnnepoch': 70, 'lambda1': 0.1, 'lambda2': 8.930219803139915, 'loop': 1, 'loss': 'MSE', 'lr': 0.004705558515445022, 'softmaxF': False, 'useGCN': True, 'weight_decay': 0.0011708560981867912, 'weightedloss': True}. Best is trial 18 with value: 80.0.
/home/wxy/miniconda3/lib/python3.10/site-packages/optuna/distributions.py:685: UserWarning: The distribution is specified by [0, 1.00001] and step=0.05, but the range is not divisible by `step`. It will be replaced by [0, 1.0].
  warnings.warn(
K:  5
alpha:  0.8500000000000001
lr:  0.008949881902058879
weight_decay:  0.000889659503336198
dropout:  0.5
fix split and run 3 times
Data: Data(x=[2708, 1433], y=[2708], train_mask=[2708], val_mask=[2708], test_mask=[2708], adj_t=[2708, 2708, nnz=10556])
num_train tensor(140)
num_noise 0
noise: tensor(0)
data feature 1433
ALTOPT(
  (lins): Sequential(
    (0): Linear(in_features=1433, out_features=64, bias=True)
    (1): BatchNorm1d(64, eps=1e-05, momentum=0.1, affine=True, track_running_stats=True)
    (2): Dropout(p=0.5, inplace=True)
    (3): ReLU(inplace=True)
    (4): Linear(in_features=64, out_features=7, bias=True)
    (5): Identity()
  )
  (prop): Propagation(K=5, mode=None, lambda1=None, lambda2=None, L21=True, alpha=0.8500000000000001)
  (gcn): GCN(
    (convs): ModuleList(
      (0): GCNConv(1433, 64)
      (1): GCNConv(64, 7)
    )
    (bns): ModuleList(
      (0): BatchNorm1d(64, eps=1e-05, momentum=0.1, affine=True, track_running_stats=True)
    )
    (output): Identity()
  )
)
propagate done
init label
Split: 01, Run: 01
None time:  2.2322472240775824
None Run 01:
Highest Train: 100.00
Highest Valid: 79.20
  Final Train: 100.00
   Final Test: 79.10
Split: 01, Run: 02
None time:  2.5310608549043536
None Run 02:
Highest Train: 100.00
Highest Valid: 80.00
  Final Train: 100.00
   Final Test: 79.50
Split: 01, Run: 03
None time:  2.1704953440930694
None Run 03:
Highest Train: 100.00
Highest Valid: 78.60
  Final Train: 100.00
   Final Test: 78.50
run time now: 6.961454629898071
total time:  6.989048861898482
None All runs:
Highest Train: 100.00 ± 0.00
Highest Valid: 79.27 ± 0.70
  Final Train: 100.00 ± 0.00
   Final Test: 79.03 ± 0.50
[I 2023-06-12 00:14:43,947] Trial 23 finished with value: 79.26666259765625 and parameters: {'Fwd': 0.010344347418332733, 'K': 5, 'alpha': 0.8500000000000001, 'dropout': 0.5, 'gnnepoch': 90, 'lambda1': 0.15000000000000002, 'lambda2': 8.863311596870576, 'loop': 1, 'loss': 'MSE', 'lr': 0.008949881902058879, 'softmaxF': False, 'useGCN': True, 'weight_decay': 0.000889659503336198, 'weightedloss': True}. Best is trial 18 with value: 80.0.
/home/wxy/miniconda3/lib/python3.10/site-packages/optuna/distributions.py:685: UserWarning: The distribution is specified by [0, 1.00001] and step=0.05, but the range is not divisible by `step`. It will be replaced by [0, 1.0].
  warnings.warn(
K:  1
alpha:  0.8500000000000001
lr:  0.006081318796857736
weight_decay:  0.004367813657018277
dropout:  0.7000000000000001
fix split and run 3 times
Data: Data(x=[2708, 1433], y=[2708], train_mask=[2708], val_mask=[2708], test_mask=[2708], adj_t=[2708, 2708, nnz=10556])
num_train tensor(140)
num_noise 0
noise: tensor(0)
data feature 1433
ALTOPT(
  (lins): Sequential(
    (0): Linear(in_features=1433, out_features=64, bias=True)
    (1): BatchNorm1d(64, eps=1e-05, momentum=0.1, affine=True, track_running_stats=True)
    (2): Dropout(p=0.7000000000000001, inplace=True)
    (3): ReLU(inplace=True)
    (4): Linear(in_features=64, out_features=7, bias=True)
    (5): Identity()
  )
  (prop): Propagation(K=1, mode=None, lambda1=None, lambda2=None, L21=True, alpha=0.8500000000000001)
  (gcn): GCN(
    (convs): ModuleList(
      (0): GCNConv(1433, 64)
      (1): GCNConv(64, 7)
    )
    (bns): ModuleList(
      (0): BatchNorm1d(64, eps=1e-05, momentum=0.1, affine=True, track_running_stats=True)
    )
    (output): Identity()
  )
)
propagate done
init label
Split: 01, Run: 01
None time:  1.9802161490079015
None Run 01:
Highest Train: 100.00
Highest Valid: 78.00
  Final Train: 100.00
   Final Test: 79.60
Split: 01, Run: 02
None time:  1.566369203850627
None Run 02:
Highest Train: 100.00
Highest Valid: 79.20
  Final Train: 100.00
   Final Test: 79.60
Split: 01, Run: 03
None time:  1.5043554578442127
None Run 03:
Highest Train: 100.00
Highest Valid: 81.60
  Final Train: 100.00
   Final Test: 79.90
run time now: 5.074992418289185
total time:  5.102999889990315
None All runs:
Highest Train: 100.00 ± 0.00
Highest Valid: 79.60 ± 1.83
  Final Train: 100.00 ± 0.00
   Final Test: 79.70 ± 0.17
[I 2023-06-12 00:14:49,473] Trial 24 finished with value: 79.5999984741211 and parameters: {'Fwd': 0.010021256717254158, 'K': 1, 'alpha': 0.8500000000000001, 'dropout': 0.7000000000000001, 'gnnepoch': 70, 'lambda1': 0.4, 'lambda2': 9.134763334511357, 'loop': 1, 'loss': 'MSE', 'lr': 0.006081318796857736, 'softmaxF': False, 'useGCN': True, 'weight_decay': 0.004367813657018277, 'weightedloss': True}. Best is trial 18 with value: 80.0.
/home/wxy/miniconda3/lib/python3.10/site-packages/optuna/distributions.py:685: UserWarning: The distribution is specified by [0, 1.00001] and step=0.05, but the range is not divisible by `step`. It will be replaced by [0, 1.0].
  warnings.warn(
K:  5
alpha:  0.7000000000000001
lr:  0.0033517209497927573
weight_decay:  0.0015466525985814283
dropout:  0.9
fix split and run 3 times
Data: Data(x=[2708, 1433], y=[2708], train_mask=[2708], val_mask=[2708], test_mask=[2708], adj_t=[2708, 2708, nnz=10556])
num_train tensor(140)
num_noise 0
noise: tensor(0)
data feature 1433
ALTOPT(
  (lins): Sequential(
    (0): Linear(in_features=1433, out_features=64, bias=True)
    (1): BatchNorm1d(64, eps=1e-05, momentum=0.1, affine=True, track_running_stats=True)
    (2): Dropout(p=0.9, inplace=True)
    (3): ReLU(inplace=True)
    (4): Linear(in_features=64, out_features=7, bias=True)
    (5): Identity()
  )
  (prop): Propagation(K=5, mode=None, lambda1=None, lambda2=None, L21=True, alpha=0.7000000000000001)
  (gcn): GCN(
    (convs): ModuleList(
      (0): GCNConv(1433, 64)
      (1): GCNConv(64, 7)
    )
    (bns): ModuleList(
      (0): BatchNorm1d(64, eps=1e-05, momentum=0.1, affine=True, track_running_stats=True)
    )
    (output): Identity()
  )
)
propagate done
init label
Split: 01, Run: 01, Epoch: 100, Loss: 0.0000, Train: 100.00%, Valid: 79.00% Test: 79.40%
Split: 01, Run: 01
None time:  2.773493078071624
None Run 01:
Highest Train: 100.00
Highest Valid: 79.00
  Final Train: 100.00
   Final Test: 79.40
Split: 01, Run: 02, Epoch: 100, Loss: 0.0000, Train: 100.00%, Valid: 78.80% Test: 80.10%
Split: 01, Run: 02
None time:  3.0671842370647937
None Run 02:
Highest Train: 100.00
Highest Valid: 78.80
  Final Train: 100.00
   Final Test: 80.00
Split: 01, Run: 03, Epoch: 100, Loss: 0.0000, Train: 100.00%, Valid: 78.20% Test: 81.50%
Split: 01, Run: 03
None time:  2.3171706979628652
None Run 03:
Highest Train: 100.00
Highest Valid: 78.20
  Final Train: 100.00
   Final Test: 81.50
run time now: 8.18464183807373
total time:  8.21162823610939
None All runs:
Highest Train: 100.00 ± 0.00
Highest Valid: 78.67 ± 0.42
  Final Train: 100.00 ± 0.00
   Final Test: 80.30 ± 1.08
[I 2023-06-12 00:14:58,156] Trial 25 finished with value: 78.66666412353516 and parameters: {'Fwd': 0.03648357382043641, 'K': 5, 'alpha': 0.7000000000000001, 'dropout': 0.9, 'gnnepoch': 50, 'lambda1': 0.4, 'lambda2': 8.832235841718296, 'loop': 0, 'loss': 'MSE', 'lr': 0.0033517209497927573, 'softmaxF': False, 'useGCN': True, 'weight_decay': 0.0015466525985814283, 'weightedloss': True}. Best is trial 18 with value: 80.0.
/home/wxy/miniconda3/lib/python3.10/site-packages/optuna/distributions.py:685: UserWarning: The distribution is specified by [0, 1.00001] and step=0.05, but the range is not divisible by `step`. It will be replaced by [0, 1.0].
  warnings.warn(
K:  3
alpha:  0.9
lr:  0.005470092171174219
weight_decay:  0.0002219793174723349
dropout:  0.8
fix split and run 3 times
Data: Data(x=[2708, 1433], y=[2708], train_mask=[2708], val_mask=[2708], test_mask=[2708], adj_t=[2708, 2708, nnz=10556])
num_train tensor(140)
num_noise 0
noise: tensor(0)
data feature 1433
ALTOPT(
  (lins): Sequential(
    (0): Linear(in_features=1433, out_features=64, bias=True)
    (1): BatchNorm1d(64, eps=1e-05, momentum=0.1, affine=True, track_running_stats=True)
    (2): Dropout(p=0.8, inplace=True)
    (3): ReLU(inplace=True)
    (4): Linear(in_features=64, out_features=7, bias=True)
    (5): Identity()
  )
  (prop): Propagation(K=3, mode=None, lambda1=None, lambda2=None, L21=True, alpha=0.9)
  (gcn): GCN(
    (convs): ModuleList(
      (0): GCNConv(1433, 64)
      (1): GCNConv(64, 7)
    )
    (bns): ModuleList(
      (0): BatchNorm1d(64, eps=1e-05, momentum=0.1, affine=True, track_running_stats=True)
    )
    (output): Identity()
  )
)
propagate done
init label
Split: 01, Run: 01, Epoch: 100, Loss: 0.1479, Train: 100.00%, Valid: 78.40% Test: 79.70%
Split: 01, Run: 01
None time:  4.810107914963737
None Run 01:
Highest Train: 100.00
Highest Valid: 78.60
  Final Train: 100.00
   Final Test: 78.80
Split: 01, Run: 02
None time:  2.1769377710297704
None Run 02:
Highest Train: 100.00
Highest Valid: 78.20
  Final Train: 100.00
   Final Test: 79.70
Split: 01, Run: 03
None time:  3.470981378108263
None Run 03:
Highest Train: 100.00
Highest Valid: 79.20
  Final Train: 100.00
   Final Test: 79.00
run time now: 10.484734058380127
total time:  10.50429095607251
None All runs:
Highest Train: 100.00 ± 0.00
Highest Valid: 78.67 ± 0.50
  Final Train: 100.00 ± 0.00
   Final Test: 79.17 ± 0.47
