[I 2023-06-12 00:50:39,787] Trial 404 finished with value: 82.06666564941406 and parameters: {'Fwd': 8.384641345618995e-06, 'K': 10, 'alpha': 0.9500000000000001, 'dropout': 0.9, 'gnnepoch': 60, 'lambda1': 0.8, 'lambda2': 6.432951581180478, 'loop': 1, 'loss': 'MSE', 'lr': 0.0028140311690349274, 'softmaxF': True, 'useGCN': False, 'weight_decay': 0.0005668548461733435, 'weightedloss': False}. Best is trial 364 with value: 83.66666412353516.
/home/wxy/miniconda3/lib/python3.10/site-packages/optuna/distributions.py:685: UserWarning: The distribution is specified by [0, 1.00001] and step=0.05, but the range is not divisible by `step`. It will be replaced by [0, 1.0].
  warnings.warn(
K:  9
alpha:  1.0
lr:  0.005253526557791411
weight_decay:  0.003910799689639088
dropout:  0.30000000000000004
fix split and run 3 times
Data: Data(x=[19717, 500], y=[19717], train_mask=[19717], val_mask=[19717], test_mask=[19717], adj_t=[19717, 19717, nnz=88648])
num_train tensor(60)
num_noise 0
noise: tensor(0)
data feature 500
ALTOPT(
  (lins): Sequential(
    (0): Linear(in_features=500, out_features=64, bias=True)
    (1): BatchNorm1d(64, eps=1e-05, momentum=0.1, affine=True, track_running_stats=True)
    (2): Dropout(p=0.30000000000000004, inplace=True)
    (3): ReLU(inplace=True)
    (4): Linear(in_features=64, out_features=3, bias=True)
    (5): Identity()
  )
  (prop): Propagation(K=9, mode=None, lambda1=None, lambda2=None, L21=True, alpha=1.0)
  (gcn): GCN(
    (convs): ModuleList(
      (0): GCNConv(500, 64)
      (1): GCNConv(64, 3)
    )
    (bns): ModuleList(
      (0): BatchNorm1d(64, eps=1e-05, momentum=0.1, affine=True, track_running_stats=True)
    )
    (output): Identity()
  )
)
propagate done
init label
Split: 01, Run: 01
None time:  1.3026065491139889
None Run 01:
Highest Train: 100.00
Highest Valid: 75.20
  Final Train: 100.00
   Final Test: 73.10
Split: 01, Run: 02
None time:  0.615275643998757
None Run 02:
Highest Train: 100.00
Highest Valid: 79.40
  Final Train: 100.00
   Final Test: 77.50
Split: 01, Run: 03
None time:  0.9803595060948282
None Run 03:
Highest Train: 100.00
Highest Valid: 77.40
  Final Train: 100.00
   Final Test: 76.80
run time now: 2.9453887939453125
total time:  2.994613620918244
None All runs:
Highest Train: 100.00 ± 0.00
Highest Valid: 77.33 ± 2.10
  Final Train: 100.00 ± 0.00
   Final Test: 75.80 ± 2.36
[I 2023-06-12 00:50:43,316] Trial 405 finished with value: 77.33333587646484 and parameters: {'Fwd': 4.023938387416601e-06, 'K': 9, 'alpha': 1.0, 'dropout': 0.30000000000000004, 'gnnepoch': 60, 'lambda1': 0.75, 'lambda2': 8.197378099339355, 'loop': 1, 'loss': 'MSE', 'lr': 0.005253526557791411, 'softmaxF': True, 'useGCN': False, 'weight_decay': 0.003910799689639088, 'weightedloss': False}. Best is trial 364 with value: 83.66666412353516.
/home/wxy/miniconda3/lib/python3.10/site-packages/optuna/distributions.py:685: UserWarning: The distribution is specified by [0, 1.00001] and step=0.05, but the range is not divisible by `step`. It will be replaced by [0, 1.0].
  warnings.warn(
K:  10
alpha:  0.75
lr:  0.0005079221242091496
weight_decay:  0.06915659885258156
dropout:  0.0
fix split and run 3 times
Data: Data(x=[19717, 500], y=[19717], train_mask=[19717], val_mask=[19717], test_mask=[19717], adj_t=[19717, 19717, nnz=88648])
num_train tensor(60)
num_noise 0
noise: tensor(0)
data feature 500
ALTOPT(
  (lins): Sequential(
    (0): Linear(in_features=500, out_features=64, bias=True)
    (1): BatchNorm1d(64, eps=1e-05, momentum=0.1, affine=True, track_running_stats=True)
    (2): Dropout(p=0.0, inplace=True)
    (3): ReLU(inplace=True)
    (4): Linear(in_features=64, out_features=3, bias=True)
    (5): Identity()
  )
  (prop): Propagation(K=10, mode=None, lambda1=None, lambda2=None, L21=True, alpha=0.75)
  (gcn): GCN(
    (convs): ModuleList(
      (0): GCNConv(500, 64)
      (1): GCNConv(64, 3)
    )
    (bns): ModuleList(
      (0): BatchNorm1d(64, eps=1e-05, momentum=0.1, affine=True, track_running_stats=True)
    )
    (output): Identity()
  )
)
propagate done
init label
Split: 01, Run: 01
None time:  0.8933277181349695
None Run 01:
Highest Train: 100.00
Highest Valid: 69.00
  Final Train: 100.00
   Final Test: 69.30
Split: 01, Run: 02
None time:  1.2167278139386326
None Run 02:
Highest Train: 100.00
Highest Valid: 77.20
  Final Train: 100.00
   Final Test: 75.10
Split: 01, Run: 03
None time:  1.8515516370534897
None Run 03:
Highest Train: 100.00
Highest Valid: 78.20
  Final Train: 100.00
   Final Test: 76.80
run time now: 4.007008790969849
total time:  4.0623750309459865
None All runs:
Highest Train: 100.00 ± 0.00
Highest Valid: 74.80 ± 5.05
  Final Train: 100.00 ± 0.00
   Final Test: 73.73 ± 3.93
[I 2023-06-12 00:50:47,879] Trial 406 finished with value: 74.80000305175781 and parameters: {'Fwd': 4.6325531129808254e-05, 'K': 10, 'alpha': 0.75, 'dropout': 0.0, 'gnnepoch': 60, 'lambda1': 0.8500000000000001, 'lambda2': 6.145642798413597, 'loop': 1, 'loss': 'MSE', 'lr': 0.0005079221242091496, 'softmaxF': True, 'useGCN': False, 'weight_decay': 0.06915659885258156, 'weightedloss': False}. Best is trial 364 with value: 83.66666412353516.
/home/wxy/miniconda3/lib/python3.10/site-packages/optuna/distributions.py:685: UserWarning: The distribution is specified by [0, 1.00001] and step=0.05, but the range is not divisible by `step`. It will be replaced by [0, 1.0].
  warnings.warn(
K:  10
alpha:  0.9
lr:  0.0006718105696922528
weight_decay:  0.0004113786400119552
dropout:  0.9
fix split and run 3 times
Data: Data(x=[19717, 500], y=[19717], train_mask=[19717], val_mask=[19717], test_mask=[19717], adj_t=[19717, 19717, nnz=88648])
num_train tensor(60)
num_noise 0
noise: tensor(0)
data feature 500
ALTOPT(
  (lins): Sequential(
    (0): Linear(in_features=500, out_features=64, bias=True)
    (1): BatchNorm1d(64, eps=1e-05, momentum=0.1, affine=True, track_running_stats=True)
    (2): Dropout(p=0.9, inplace=True)
    (3): ReLU(inplace=True)
    (4): Linear(in_features=64, out_features=3, bias=True)
    (5): Identity()
  )
  (prop): Propagation(K=10, mode=None, lambda1=None, lambda2=None, L21=True, alpha=0.9)
  (gcn): GCN(
    (convs): ModuleList(
      (0): GCNConv(500, 64)
      (1): GCNConv(64, 3)
    )
    (bns): ModuleList(
      (0): BatchNorm1d(64, eps=1e-05, momentum=0.1, affine=True, track_running_stats=True)
    )
    (output): Identity()
  )
)
propagate done
init label
Split: 01, Run: 01
None time:  1.6941591349896044
None Run 01:
Highest Train: 100.00
Highest Valid: 69.80
  Final Train: 100.00
   Final Test: 69.60
Split: 01, Run: 02
None time:  1.6714938869699836
None Run 02:
Highest Train: 100.00
Highest Valid: 69.80
  Final Train: 100.00
   Final Test: 69.60
Split: 01, Run: 03
None time:  4.54862627806142
None Run 03:
Highest Train: 100.00
Highest Valid: 75.00
  Final Train: 100.00
   Final Test: 72.20
run time now: 7.961904048919678
total time:  8.012581809889525
None All runs:
Highest Train: 100.00 ± 0.00
Highest Valid: 71.53 ± 3.00
  Final Train: 100.00 ± 0.00
   Final Test: 70.47 ± 1.50
[I 2023-06-12 00:50:56,410] Trial 407 finished with value: 71.53333282470703 and parameters: {'Fwd': 6.721558346899671e-06, 'K': 10, 'alpha': 0.9, 'dropout': 0.9, 'gnnepoch': 70, 'lambda1': 0.65, 'lambda2': 4.618766254495537, 'loop': 1, 'loss': 'MSE', 'lr': 0.0006718105696922528, 'softmaxF': True, 'useGCN': True, 'weight_decay': 0.0004113786400119552, 'weightedloss': False}. Best is trial 364 with value: 83.66666412353516.
/home/wxy/miniconda3/lib/python3.10/site-packages/optuna/distributions.py:685: UserWarning: The distribution is specified by [0, 1.00001] and step=0.05, but the range is not divisible by `step`. It will be replaced by [0, 1.0].
  warnings.warn(
K:  10
alpha:  0.9500000000000001
lr:  0.0031925012566706725
weight_decay:  0.0065967139924864165
dropout:  0.9
fix split and run 3 times
Data: Data(x=[19717, 500], y=[19717], train_mask=[19717], val_mask=[19717], test_mask=[19717], adj_t=[19717, 19717, nnz=88648])
num_train tensor(60)
num_noise 0
noise: tensor(0)
data feature 500
ALTOPT(
  (lins): Sequential(
    (0): Linear(in_features=500, out_features=64, bias=True)
    (1): BatchNorm1d(64, eps=1e-05, momentum=0.1, affine=True, track_running_stats=True)
    (2): Dropout(p=0.9, inplace=True)
    (3): ReLU(inplace=True)
    (4): Linear(in_features=64, out_features=3, bias=True)
    (5): Identity()
  )
  (prop): Propagation(K=10, mode=None, lambda1=None, lambda2=None, L21=True, alpha=0.9500000000000001)
  (gcn): GCN(
    (convs): ModuleList(
      (0): GCNConv(500, 64)
      (1): GCNConv(64, 3)
    )
    (bns): ModuleList(
      (0): BatchNorm1d(64, eps=1e-05, momentum=0.1, affine=True, track_running_stats=True)
    )
    (output): Identity()
  )
)
propagate done
init label
Split: 01, Run: 01, Epoch: 100, Loss: 0.2948, Train: 100.00%, Valid: 80.40% Test: 77.70%
Split: 01, Run: 01
None time:  3.7780314029660076
None Run 01:
Highest Train: 100.00
Highest Valid: 80.40
  Final Train: 100.00
   Final Test: 77.60
Split: 01, Run: 02
None time:  2.0263301201630384
None Run 02:
Highest Train: 100.00
Highest Valid: 82.20
  Final Train: 100.00
   Final Test: 78.60
Split: 01, Run: 03
None time:  1.0238983458839357
None Run 03:
Highest Train: 100.00
Highest Valid: 82.60
  Final Train: 100.00
   Final Test: 77.90
run time now: 6.874068737030029
total time:  6.919144384097308
None All runs:
Highest Train: 100.00 ± 0.00
Highest Valid: 81.73 ± 1.17
  Final Train: 100.00 ± 0.00
   Final Test: 78.03 ± 0.51
[I 2023-06-12 00:51:03,988] Trial 408 finished with value: 81.73333740234375 and parameters: {'Fwd': 2.6233375148942502e-06, 'K': 10, 'alpha': 0.9500000000000001, 'dropout': 0.9, 'gnnepoch': 60, 'lambda1': 0.55, 'lambda2': 4.09398534318553, 'loop': 1, 'loss': 'MSE', 'lr': 0.0031925012566706725, 'softmaxF': True, 'useGCN': False, 'weight_decay': 0.0065967139924864165, 'weightedloss': False}. Best is trial 364 with value: 83.66666412353516.
/home/wxy/miniconda3/lib/python3.10/site-packages/optuna/distributions.py:685: UserWarning: The distribution is specified by [0, 1.00001] and step=0.05, but the range is not divisible by `step`. It will be replaced by [0, 1.0].
  warnings.warn(
K:  10
alpha:  1.0
lr:  0.002348767038694483
weight_decay:  9.262708237195564e-05
dropout:  0.9
fix split and run 3 times
Data: Data(x=[19717, 500], y=[19717], train_mask=[19717], val_mask=[19717], test_mask=[19717], adj_t=[19717, 19717, nnz=88648])
num_train tensor(60)
num_noise 0
noise: tensor(0)
data feature 500
ALTOPT(
  (lins): Sequential(
    (0): Linear(in_features=500, out_features=64, bias=True)
    (1): BatchNorm1d(64, eps=1e-05, momentum=0.1, affine=True, track_running_stats=True)
    (2): Dropout(p=0.9, inplace=True)
    (3): ReLU(inplace=True)
    (4): Linear(in_features=64, out_features=3, bias=True)
    (5): Identity()
  )
  (prop): Propagation(K=10, mode=None, lambda1=None, lambda2=None, L21=True, alpha=1.0)
  (gcn): GCN(
    (convs): ModuleList(
      (0): GCNConv(500, 64)
      (1): GCNConv(64, 3)
    )
    (bns): ModuleList(
      (0): BatchNorm1d(64, eps=1e-05, momentum=0.1, affine=True, track_running_stats=True)
    )
    (output): Identity()
  )
)
propagate done
init label
Split: 01, Run: 01, Epoch: 100, Loss: 0.3294, Train: 100.00%, Valid: 82.60% Test: 78.90%
Split: 01, Run: 01
None time:  3.7006930829957128
None Run 01:
Highest Train: 100.00
Highest Valid: 82.60
  Final Train: 100.00
   Final Test: 78.10
Split: 01, Run: 02
None time:  1.588509449036792
None Run 02:
Highest Train: 100.00
Highest Valid: 84.40
  Final Train: 100.00
   Final Test: 78.50
Split: 01, Run: 03
None time:  3.0461866760160774
None Run 03:
Highest Train: 100.00
Highest Valid: 80.00
  Final Train: 100.00
   Final Test: 79.10
run time now: 8.383579730987549
total time:  8.43050904199481
None All runs:
Highest Train: 100.00 ± 0.00
Highest Valid: 82.33 ± 2.21
  Final Train: 100.00 ± 0.00
   Final Test: 78.57 ± 0.50
[I 2023-06-12 00:51:13,027] Trial 409 finished with value: 82.33333587646484 and parameters: {'Fwd': 1.0578108491523068e-05, 'K': 10, 'alpha': 1.0, 'dropout': 0.9, 'gnnepoch': 60, 'lambda1': 0.6000000000000001, 'lambda2': 5.267571314051051, 'loop': 1, 'loss': 'MSE', 'lr': 0.002348767038694483, 'softmaxF': True, 'useGCN': False, 'weight_decay': 9.262708237195564e-05, 'weightedloss': False}. Best is trial 364 with value: 83.66666412353516.
/home/wxy/miniconda3/lib/python3.10/site-packages/optuna/distributions.py:685: UserWarning: The distribution is specified by [0, 1.00001] and step=0.05, but the range is not divisible by `step`. It will be replaced by [0, 1.0].
  warnings.warn(
K:  4
alpha:  0.9500000000000001
lr:  0.0026346017745948816
weight_decay:  9.061939876688191e-06
dropout:  0.8
fix split and run 3 times
Data: Data(x=[19717, 500], y=[19717], train_mask=[19717], val_mask=[19717], test_mask=[19717], adj_t=[19717, 19717, nnz=88648])
num_train tensor(60)
num_noise 0
noise: tensor(0)
data feature 500
ALTOPT(
  (lins): Sequential(
    (0): Linear(in_features=500, out_features=64, bias=True)
    (1): BatchNorm1d(64, eps=1e-05, momentum=0.1, affine=True, track_running_stats=True)
    (2): Dropout(p=0.8, inplace=True)
    (3): ReLU(inplace=True)
    (4): Linear(in_features=64, out_features=3, bias=True)
    (5): Identity()
  )
  (prop): Propagation(K=4, mode=None, lambda1=None, lambda2=None, L21=True, alpha=0.9500000000000001)
  (gcn): GCN(
    (convs): ModuleList(
      (0): GCNConv(500, 64)
      (1): GCNConv(64, 3)
    )
    (bns): ModuleList(
      (0): BatchNorm1d(64, eps=1e-05, momentum=0.1, affine=True, track_running_stats=True)
    )
    (output): Identity()
  )
)
propagate done
init label
Split: 01, Run: 01
None time:  2.7610473800450563
None Run 01:
Highest Train: 100.00
Highest Valid: 79.40
  Final Train: 100.00
   Final Test: 75.90
Split: 01, Run: 02
None time:  1.319815831957385
None Run 02:
Highest Train: 100.00
Highest Valid: 80.60
  Final Train: 100.00
   Final Test: 77.90
Split: 01, Run: 03
None time:  0.7100396850146353
None Run 03:
Highest Train: 100.00
Highest Valid: 80.60
  Final Train: 100.00
   Final Test: 77.80
run time now: 4.828066110610962
total time:  4.878349740058184
None All runs:
Highest Train: 100.00 ± 0.00
Highest Valid: 80.20 ± 0.69
  Final Train: 100.00 ± 0.00
   Final Test: 77.20 ± 1.13
[I 2023-06-12 00:51:18,508] Trial 410 finished with value: 80.20000457763672 and parameters: {'Fwd': 0.0004877316269534425, 'K': 4, 'alpha': 0.9500000000000001, 'dropout': 0.8, 'gnnepoch': 50, 'lambda1': 1.0, 'lambda2': 5.959649261755376, 'loop': 2, 'loss': 'MSE', 'lr': 0.0026346017745948816, 'softmaxF': True, 'useGCN': False, 'weight_decay': 9.061939876688191e-06, 'weightedloss': False}. Best is trial 364 with value: 83.66666412353516.
/home/wxy/miniconda3/lib/python3.10/site-packages/optuna/distributions.py:685: UserWarning: The distribution is specified by [0, 1.00001] and step=0.05, but the range is not divisible by `step`. It will be replaced by [0, 1.0].
  warnings.warn(
K:  10
alpha:  0.9
lr:  0.002125035959025001
weight_decay:  8.190267729206342e-05
dropout:  0.9
fix split and run 3 times
Data: Data(x=[19717, 500], y=[19717], train_mask=[19717], val_mask=[19717], test_mask=[19717], adj_t=[19717, 19717, nnz=88648])
num_train tensor(60)
num_noise 0
noise: tensor(0)
data feature 500
ALTOPT(
  (lins): Sequential(
    (0): Linear(in_features=500, out_features=64, bias=True)
    (1): BatchNorm1d(64, eps=1e-05, momentum=0.1, affine=True, track_running_stats=True)
    (2): Dropout(p=0.9, inplace=True)
    (3): ReLU(inplace=True)
    (4): Linear(in_features=64, out_features=3, bias=True)
    (5): Identity()
  )
  (prop): Propagation(K=10, mode=None, lambda1=None, lambda2=None, L21=True, alpha=0.9)
  (gcn): GCN(
    (convs): ModuleList(
      (0): GCNConv(500, 64)
      (1): GCNConv(64, 3)
    )
    (bns): ModuleList(
      (0): BatchNorm1d(64, eps=1e-05, momentum=0.1, affine=True, track_running_stats=True)
    )
    (output): Identity()
  )
)
propagate done
init label
Split: 01, Run: 01
None time:  3.4808447959367186
None Run 01:
Highest Train: 100.00
Highest Valid: 80.40
  Final Train: 100.00
   Final Test: 76.40
Split: 01, Run: 02
None time:  1.1556291789747775
None Run 02:
Highest Train: 100.00
Highest Valid: 81.60
  Final Train: 100.00
   Final Test: 79.90
Split: 01, Run: 03
None time:  1.0857636739965528
None Run 03:
Highest Train: 100.00
Highest Valid: 83.20
  Final Train: 100.00
   Final Test: 79.90
run time now: 5.771543264389038
total time:  5.813876965083182
None All runs:
Highest Train: 100.00 ± 0.00
Highest Valid: 81.73 ± 1.40
  Final Train: 100.00 ± 0.00
   Final Test: 78.73 ± 2.02
[I 2023-06-12 00:51:24,929] Trial 411 finished with value: 81.73333740234375 and parameters: {'Fwd': 5.316509519977103e-06, 'K': 10, 'alpha': 0.9, 'dropout': 0.9, 'gnnepoch': 70, 'lambda1': 0.9, 'lambda2': 3.15905873195007, 'loop': 1, 'loss': 'MSE', 'lr': 0.002125035959025001, 'softmaxF': True, 'useGCN': False, 'weight_decay': 8.190267729206342e-05, 'weightedloss': False}. Best is trial 364 with value: 83.66666412353516.
/home/wxy/miniconda3/lib/python3.10/site-packages/optuna/distributions.py:685: UserWarning: The distribution is specified by [0, 1.00001] and step=0.05, but the range is not divisible by `step`. It will be replaced by [0, 1.0].
  warnings.warn(
K:  10
alpha:  0.8500000000000001
lr:  0.0033148102319859062
weight_decay:  6.113086857977731e-05
dropout:  0.9
fix split and run 3 times
Data: Data(x=[19717, 500], y=[19717], train_mask=[19717], val_mask=[19717], test_mask=[19717], adj_t=[19717, 19717, nnz=88648])
num_train tensor(60)
num_noise 0
noise: tensor(0)
data feature 500
ALTOPT(
  (lins): Sequential(
    (0): Linear(in_features=500, out_features=64, bias=True)
    (1): BatchNorm1d(64, eps=1e-05, momentum=0.1, affine=True, track_running_stats=True)
    (2): Dropout(p=0.9, inplace=True)
    (3): ReLU(inplace=True)
    (4): Linear(in_features=64, out_features=3, bias=True)
    (5): Identity()
  )
  (prop): Propagation(K=10, mode=None, lambda1=None, lambda2=None, L21=True, alpha=0.8500000000000001)
  (gcn): GCN(
    (convs): ModuleList(
      (0): GCNConv(500, 64)
      (1): GCNConv(64, 3)
    )
    (bns): ModuleList(
      (0): BatchNorm1d(64, eps=1e-05, momentum=0.1, affine=True, track_running_stats=True)
    )
    (output): Identity()
  )
)
propagate done
init label
Split: 01, Run: 01, Epoch: 100, Loss: 0.3572, Train: 100.00%, Valid: 82.20% Test: 76.50%
Split: 01, Run: 01
None time:  3.5753071950748563
None Run 01:
Highest Train: 100.00
Highest Valid: 82.20
  Final Train: 100.00
   Final Test: 76.00
Split: 01, Run: 02
None time:  1.0214795710053295
None Run 02:
Highest Train: 100.00
Highest Valid: 83.00
  Final Train: 100.00
   Final Test: 78.50
Split: 01, Run: 03
None time:  1.0123533781152219
None Run 03:
Highest Train: 100.00
Highest Valid: 80.00
  Final Train: 100.00
   Final Test: 77.30
run time now: 5.662338733673096
total time:  5.704115467146039
None All runs:
Highest Train: 100.00 ± 0.00
Highest Valid: 81.73 ± 1.55
  Final Train: 100.00 ± 0.00
   Final Test: 77.27 ± 1.25
[I 2023-06-12 00:51:31,283] Trial 412 finished with value: 81.73333740234375 and parameters: {'Fwd': 3.599946799406721e-06, 'K': 10, 'alpha': 0.8500000000000001, 'dropout': 0.9, 'gnnepoch': 60, 'lambda1': 0.75, 'lambda2': 3.858637550817284, 'loop': 1, 'loss': 'MSE', 'lr': 0.0033148102319859062, 'softmaxF': True, 'useGCN': False, 'weight_decay': 6.113086857977731e-05, 'weightedloss': False}. Best is trial 364 with value: 83.66666412353516.
/home/wxy/miniconda3/lib/python3.10/site-packages/optuna/distributions.py:685: UserWarning: The distribution is specified by [0, 1.00001] and step=0.05, but the range is not divisible by `step`. It will be replaced by [0, 1.0].
  warnings.warn(
K:  10
alpha:  0.9500000000000001
lr:  0.003554676233956987
weight_decay:  0.0002210345560255198
dropout:  0.9
fix split and run 3 times
Data: Data(x=[19717, 500], y=[19717], train_mask=[19717], val_mask=[19717], test_mask=[19717], adj_t=[19717, 19717, nnz=88648])
num_train tensor(60)
num_noise 0
noise: tensor(0)
data feature 500
ALTOPT(
  (lins): Sequential(
    (0): Linear(in_features=500, out_features=64, bias=True)
    (1): BatchNorm1d(64, eps=1e-05, momentum=0.1, affine=True, track_running_stats=True)
    (2): Dropout(p=0.9, inplace=True)
    (3): ReLU(inplace=True)
    (4): Linear(in_features=64, out_features=3, bias=True)
    (5): Identity()
  )
  (prop): Propagation(K=10, mode=None, lambda1=None, lambda2=None, L21=True, alpha=0.9500000000000001)
  (gcn): GCN(
    (convs): ModuleList(
      (0): GCNConv(500, 64)
      (1): GCNConv(64, 3)
    )
    (bns): ModuleList(
      (0): BatchNorm1d(64, eps=1e-05, momentum=0.1, affine=True, track_running_stats=True)
    )
    (output): Identity()
  )
)
propagate done
init label
Split: 01, Run: 01
None time:  0.9105308100115508
None Run 01:
Highest Train: 100.00
Highest Valid: 69.40
  Final Train: 100.00
   Final Test: 69.20
Split: 01, Run: 02
None time:  1.8111443459056318
None Run 02:
Highest Train: 100.00
Highest Valid: 81.40
  Final Train: 100.00
   Final Test: 78.70
Split: 01, Run: 03
None time:  0.8729147240519524
None Run 03:
Highest Train: 100.00
Highest Valid: 80.80
  Final Train: 100.00
   Final Test: 79.10
run time now: 3.6425247192382812
total time:  3.6819351059384644
None All runs:
Highest Train: 100.00 ± 0.00
Highest Valid: 77.20 ± 6.76
  Final Train: 100.00 ± 0.00
   Final Test: 75.67 ± 5.60
