[I 2023-06-12 00:53:22,903] Trial 439 finished with value: 81.19999694824219 and parameters: {'Fwd': 0.0820052566305344, 'K': 5, 'alpha': 0.7000000000000001, 'dropout': 0.5, 'gnnepoch': 60, 'lambda1': 0.9, 'lambda2': 5.268659855633464, 'loop': 1, 'loss': 'CE', 'lr': 0.006269313730071467, 'softmaxF': True, 'useGCN': True, 'weight_decay': 0.0014105326829066856, 'weightedloss': False}. Best is trial 112 with value: 81.66667175292969.
/home/wxy/miniconda3/lib/python3.10/site-packages/optuna/distributions.py:685: UserWarning: The distribution is specified by [0, 1.00001] and step=0.05, but the range is not divisible by `step`. It will be replaced by [0, 1.0].
  warnings.warn(
K:  9
alpha:  0.35000000000000003
lr:  0.007747789460437374
weight_decay:  6.246527062356296e-06
dropout:  0.0
fix split and run 3 times
Data: Data(x=[2708, 1433], y=[2708], train_mask=[2708], val_mask=[2708], test_mask=[2708], adj_t=[2708, 2708, nnz=10556])
num_train tensor(140)
num_noise 0
noise: tensor(0)
data feature 1433
ALTOPT(
  (lins): Sequential(
    (0): Linear(in_features=1433, out_features=64, bias=True)
    (1): BatchNorm1d(64, eps=1e-05, momentum=0.1, affine=True, track_running_stats=True)
    (2): Dropout(p=0.0, inplace=True)
    (3): ReLU(inplace=True)
    (4): Linear(in_features=64, out_features=7, bias=True)
    (5): LogSoftmax(dim=-1)
  )
  (prop): Propagation(K=9, mode=None, lambda1=None, lambda2=None, L21=True, alpha=0.35000000000000003)
  (gcn): GCN(
    (convs): ModuleList(
      (0): GCNConv(1433, 64)
      (1): GCNConv(64, 7)
    )
    (bns): ModuleList(
      (0): BatchNorm1d(64, eps=1e-05, momentum=0.1, affine=True, track_running_stats=True)
    )
    (output): LogSoftmax(dim=-1)
  )
)
propagate done
init label
Split: 01, Run: 01
None time:  1.4494286349508911
None Run 01:
Highest Train: 100.00
Highest Valid: 81.20
  Final Train: 100.00
   Final Test: 82.20
Split: 01, Run: 02
None time:  1.2200490080285817
None Run 02:
Highest Train: 100.00
Highest Valid: 81.40
  Final Train: 100.00
   Final Test: 81.60
Split: 01, Run: 03
None time:  1.4340351182036102
None Run 03:
Highest Train: 100.00
Highest Valid: 81.00
  Final Train: 100.00
   Final Test: 81.50
run time now: 4.126605987548828
total time:  4.1460732109844685
None All runs:
Highest Train: 100.00 ± 0.00
Highest Valid: 81.20 ± 0.20
  Final Train: 100.00 ± 0.00
   Final Test: 81.77 ± 0.38
[I 2023-06-12 00:53:27,698] Trial 440 finished with value: 81.20000457763672 and parameters: {'Fwd': 0.00031978266670273806, 'K': 9, 'alpha': 0.35000000000000003, 'dropout': 0.0, 'gnnepoch': 60, 'lambda1': 0.8500000000000001, 'lambda2': 5.93129095539253, 'loop': 1, 'loss': 'CE', 'lr': 0.007747789460437374, 'softmaxF': True, 'useGCN': True, 'weight_decay': 6.246527062356296e-06, 'weightedloss': True}. Best is trial 112 with value: 81.66667175292969.
/home/wxy/miniconda3/lib/python3.10/site-packages/optuna/distributions.py:685: UserWarning: The distribution is specified by [0, 1.00001] and step=0.05, but the range is not divisible by `step`. It will be replaced by [0, 1.0].
  warnings.warn(
K:  10
alpha:  0.55
lr:  0.0018084287865904125
weight_decay:  2.606704581750674e-05
dropout:  0.4
fix split and run 3 times
Data: Data(x=[2708, 1433], y=[2708], train_mask=[2708], val_mask=[2708], test_mask=[2708], adj_t=[2708, 2708, nnz=10556])
num_train tensor(140)
num_noise 0
noise: tensor(0)
data feature 1433
ALTOPT(
  (lins): Sequential(
    (0): Linear(in_features=1433, out_features=64, bias=True)
    (1): BatchNorm1d(64, eps=1e-05, momentum=0.1, affine=True, track_running_stats=True)
    (2): Dropout(p=0.4, inplace=True)
    (3): ReLU(inplace=True)
    (4): Linear(in_features=64, out_features=7, bias=True)
    (5): LogSoftmax(dim=-1)
  )
  (prop): Propagation(K=10, mode=None, lambda1=None, lambda2=None, L21=True, alpha=0.55)
  (gcn): GCN(
    (convs): ModuleList(
      (0): GCNConv(1433, 64)
      (1): GCNConv(64, 7)
    )
    (bns): ModuleList(
      (0): BatchNorm1d(64, eps=1e-05, momentum=0.1, affine=True, track_running_stats=True)
    )
    (output): LogSoftmax(dim=-1)
  )
)
propagate done
init label
Split: 01, Run: 01
None time:  1.8561395620927215
None Run 01:
Highest Train: 100.00
Highest Valid: 79.60
  Final Train: 100.00
   Final Test: 80.00
Split: 01, Run: 02
None time:  1.8979619881138206
None Run 02:
Highest Train: 100.00
Highest Valid: 79.00
  Final Train: 100.00
   Final Test: 79.50
Split: 01, Run: 03
None time:  1.446726034861058
None Run 03:
Highest Train: 100.00
Highest Valid: 79.40
  Final Train: 100.00
   Final Test: 80.60
run time now: 5.229956865310669
total time:  5.243791023036465
None All runs:
Highest Train: 100.00 ± 0.00
Highest Valid: 79.33 ± 0.31
  Final Train: 100.00 ± 0.00
   Final Test: 80.03 ± 0.55
[I 2023-06-12 00:53:33,476] Trial 441 finished with value: 79.33333587646484 and parameters: {'Fwd': 0.05616287908103181, 'K': 10, 'alpha': 0.55, 'dropout': 0.4, 'gnnepoch': 70, 'lambda1': 0.8500000000000001, 'lambda2': 7.779761584760677, 'loop': 1, 'loss': 'CE', 'lr': 0.0018084287865904125, 'softmaxF': True, 'useGCN': True, 'weight_decay': 2.606704581750674e-05, 'weightedloss': False}. Best is trial 112 with value: 81.66667175292969.
/home/wxy/miniconda3/lib/python3.10/site-packages/optuna/distributions.py:685: UserWarning: The distribution is specified by [0, 1.00001] and step=0.05, but the range is not divisible by `step`. It will be replaced by [0, 1.0].
  warnings.warn(
K:  6
alpha:  0.5
lr:  0.002332488247306823
weight_decay:  5.445683491882845e-05
dropout:  0.4
fix split and run 3 times
Data: Data(x=[2708, 1433], y=[2708], train_mask=[2708], val_mask=[2708], test_mask=[2708], adj_t=[2708, 2708, nnz=10556])
num_train tensor(140)
num_noise 0
noise: tensor(0)
data feature 1433
ALTOPT(
  (lins): Sequential(
    (0): Linear(in_features=1433, out_features=64, bias=True)
    (1): BatchNorm1d(64, eps=1e-05, momentum=0.1, affine=True, track_running_stats=True)
    (2): Dropout(p=0.4, inplace=True)
    (3): ReLU(inplace=True)
    (4): Linear(in_features=64, out_features=7, bias=True)
    (5): LogSoftmax(dim=-1)
  )
  (prop): Propagation(K=6, mode=None, lambda1=None, lambda2=None, L21=True, alpha=0.5)
  (gcn): GCN(
    (convs): ModuleList(
      (0): GCNConv(1433, 64)
      (1): GCNConv(64, 7)
    )
    (bns): ModuleList(
      (0): BatchNorm1d(64, eps=1e-05, momentum=0.1, affine=True, track_running_stats=True)
    )
    (output): LogSoftmax(dim=-1)
  )
)
propagate done
init label
Split: 01, Run: 01
None time:  2.203567228047177
None Run 01:
Highest Train: 100.00
Highest Valid: 80.80
  Final Train: 100.00
   Final Test: 82.10
Split: 01, Run: 02
None time:  1.9914429190102965
None Run 02:
Highest Train: 100.00
Highest Valid: 80.00
  Final Train: 100.00
   Final Test: 80.90
Split: 01, Run: 03
None time:  1.8694673089776188
None Run 03:
Highest Train: 100.00
Highest Valid: 80.00
  Final Train: 100.00
   Final Test: 81.10
run time now: 6.113818645477295
total time:  6.153111438034102
None All runs:
Highest Train: 100.00 ± 0.00
Highest Valid: 80.27 ± 0.46
  Final Train: 100.00 ± 0.00
   Final Test: 81.37 ± 0.64
[I 2023-06-12 00:53:40,250] Trial 442 finished with value: 80.26667022705078 and parameters: {'Fwd': 0.0001978014776284405, 'K': 6, 'alpha': 0.5, 'dropout': 0.4, 'gnnepoch': 100, 'lambda1': 0.8, 'lambda2': 6.462495199680762, 'loop': 1, 'loss': 'CE', 'lr': 0.002332488247306823, 'softmaxF': True, 'useGCN': True, 'weight_decay': 5.445683491882845e-05, 'weightedloss': False}. Best is trial 112 with value: 81.66667175292969.
/home/wxy/miniconda3/lib/python3.10/site-packages/optuna/distributions.py:685: UserWarning: The distribution is specified by [0, 1.00001] and step=0.05, but the range is not divisible by `step`. It will be replaced by [0, 1.0].
  warnings.warn(
K:  10
alpha:  0.30000000000000004
lr:  0.007000560577112239
weight_decay:  6.547526544400417e-05
dropout:  0.4
fix split and run 3 times
Data: Data(x=[2708, 1433], y=[2708], train_mask=[2708], val_mask=[2708], test_mask=[2708], adj_t=[2708, 2708, nnz=10556])
num_train tensor(140)
num_noise 0
noise: tensor(0)
data feature 1433
ALTOPT(
  (lins): Sequential(
    (0): Linear(in_features=1433, out_features=64, bias=True)
    (1): BatchNorm1d(64, eps=1e-05, momentum=0.1, affine=True, track_running_stats=True)
    (2): Dropout(p=0.4, inplace=True)
    (3): ReLU(inplace=True)
    (4): Linear(in_features=64, out_features=7, bias=True)
    (5): Identity()
  )
  (prop): Propagation(K=10, mode=None, lambda1=None, lambda2=None, L21=True, alpha=0.30000000000000004)
  (gcn): GCN(
    (convs): ModuleList(
      (0): GCNConv(1433, 64)
      (1): GCNConv(64, 7)
    )
    (bns): ModuleList(
      (0): BatchNorm1d(64, eps=1e-05, momentum=0.1, affine=True, track_running_stats=True)
    )
    (output): Identity()
  )
)
propagate done
init label
Split: 01, Run: 01
None time:  2.0640470900107175
None Run 01:
Highest Train: 100.00
Highest Valid: 80.40
  Final Train: 100.00
   Final Test: 79.90
Split: 01, Run: 02
None time:  1.6033185638953
None Run 02:
Highest Train: 100.00
Highest Valid: 80.20
  Final Train: 100.00
   Final Test: 80.10
Split: 01, Run: 03
None time:  1.7682956119533628
None Run 03:
Highest Train: 100.00
Highest Valid: 78.20
  Final Train: 100.00
   Final Test: 78.60
run time now: 5.463945388793945
total time:  5.483829281060025
None All runs:
Highest Train: 100.00 ± 0.00
Highest Valid: 79.60 ± 1.22
  Final Train: 100.00 ± 0.00
   Final Test: 79.53 ± 0.81
[I 2023-06-12 00:53:46,330] Trial 443 finished with value: 79.5999984741211 and parameters: {'Fwd': 0.00015266288339345344, 'K': 10, 'alpha': 0.30000000000000004, 'dropout': 0.4, 'gnnepoch': 60, 'lambda1': 0.9500000000000001, 'lambda2': 5.680418283277371, 'loop': 1, 'loss': 'MSE', 'lr': 0.007000560577112239, 'softmaxF': True, 'useGCN': True, 'weight_decay': 6.547526544400417e-05, 'weightedloss': True}. Best is trial 112 with value: 81.66667175292969.
/home/wxy/miniconda3/lib/python3.10/site-packages/optuna/distributions.py:685: UserWarning: The distribution is specified by [0, 1.00001] and step=0.05, but the range is not divisible by `step`. It will be replaced by [0, 1.0].
  warnings.warn(
K:  10
alpha:  0.8500000000000001
lr:  0.004978832224033239
weight_decay:  0.00035009866414153893
dropout:  0.5
fix split and run 3 times
Data: Data(x=[2708, 1433], y=[2708], train_mask=[2708], val_mask=[2708], test_mask=[2708], adj_t=[2708, 2708, nnz=10556])
num_train tensor(140)
num_noise 0
noise: tensor(0)
data feature 1433
ALTOPT(
  (lins): Sequential(
    (0): Linear(in_features=1433, out_features=64, bias=True)
    (1): BatchNorm1d(64, eps=1e-05, momentum=0.1, affine=True, track_running_stats=True)
    (2): Dropout(p=0.5, inplace=True)
    (3): ReLU(inplace=True)
    (4): Linear(in_features=64, out_features=7, bias=True)
    (5): LogSoftmax(dim=-1)
  )
  (prop): Propagation(K=10, mode=None, lambda1=None, lambda2=None, L21=True, alpha=0.8500000000000001)
  (gcn): GCN(
    (convs): ModuleList(
      (0): GCNConv(1433, 64)
      (1): GCNConv(64, 7)
    )
    (bns): ModuleList(
      (0): BatchNorm1d(64, eps=1e-05, momentum=0.1, affine=True, track_running_stats=True)
    )
    (output): LogSoftmax(dim=-1)
  )
)
propagate done
init label
Split: 01, Run: 01
None time:  0.9608203279785812
None Run 01:
Highest Train: 100.00
Highest Valid: 81.00
  Final Train: 100.00
   Final Test: 81.10
Split: 01, Run: 02
None time:  1.3800134968478233
None Run 02:
Highest Train: 100.00
Highest Valid: 80.20
  Final Train: 100.00
   Final Test: 81.40
Split: 01, Run: 03
None time:  1.469751153839752
None Run 03:
Highest Train: 100.00
Highest Valid: 80.80
  Final Train: 100.00
   Final Test: 81.40
run time now: 3.83420991897583
total time:  3.8506709951907396
None All runs:
Highest Train: 100.00 ± 0.00
Highest Valid: 80.67 ± 0.42
  Final Train: 100.00 ± 0.00
   Final Test: 81.30 ± 0.17
[I 2023-06-12 00:53:50,832] Trial 444 finished with value: 80.66666412353516 and parameters: {'Fwd': 0.0005022797405708372, 'K': 10, 'alpha': 0.8500000000000001, 'dropout': 0.5, 'gnnepoch': 50, 'lambda1': 0.9, 'lambda2': 4.655814189525472, 'loop': 1, 'loss': 'CE', 'lr': 0.004978832224033239, 'softmaxF': True, 'useGCN': True, 'weight_decay': 0.00035009866414153893, 'weightedloss': False}. Best is trial 112 with value: 81.66667175292969.
/home/wxy/miniconda3/lib/python3.10/site-packages/optuna/distributions.py:685: UserWarning: The distribution is specified by [0, 1.00001] and step=0.05, but the range is not divisible by `step`. It will be replaced by [0, 1.0].
  warnings.warn(
K:  10
alpha:  0.6000000000000001
lr:  0.0026903028817861765
weight_decay:  3.960577917797306e-05
dropout:  0.6000000000000001
fix split and run 3 times
Data: Data(x=[2708, 1433], y=[2708], train_mask=[2708], val_mask=[2708], test_mask=[2708], adj_t=[2708, 2708, nnz=10556])
num_train tensor(140)
num_noise 0
noise: tensor(0)
data feature 1433
ALTOPT(
  (lins): Sequential(
    (0): Linear(in_features=1433, out_features=64, bias=True)
    (1): BatchNorm1d(64, eps=1e-05, momentum=0.1, affine=True, track_running_stats=True)
    (2): Dropout(p=0.6000000000000001, inplace=True)
    (3): ReLU(inplace=True)
    (4): Linear(in_features=64, out_features=7, bias=True)
    (5): LogSoftmax(dim=-1)
  )
  (prop): Propagation(K=10, mode=None, lambda1=None, lambda2=None, L21=True, alpha=0.6000000000000001)
  (gcn): GCN(
    (convs): ModuleList(
      (0): GCNConv(1433, 64)
      (1): GCNConv(64, 7)
    )
    (bns): ModuleList(
      (0): BatchNorm1d(64, eps=1e-05, momentum=0.1, affine=True, track_running_stats=True)
    )
    (output): LogSoftmax(dim=-1)
  )
)
propagate done
init label
Split: 01, Run: 01
None time:  1.3908904241397977
None Run 01:
Highest Train: 100.00
Highest Valid: 80.00
  Final Train: 100.00
   Final Test: 81.40
Split: 01, Run: 02
None time:  1.6668918619398028
None Run 02:
Highest Train: 100.00
Highest Valid: 80.00
  Final Train: 100.00
   Final Test: 79.60
Split: 01, Run: 03
None time:  1.438118610996753
None Run 03:
Highest Train: 100.00
Highest Valid: 78.00
  Final Train: 100.00
   Final Test: 79.20
run time now: 4.521516799926758
total time:  4.544990339083597
None All runs:
Highest Train: 100.00 ± 0.00
Highest Valid: 79.33 ± 1.15
  Final Train: 100.00 ± 0.00
   Final Test: 80.07 ± 1.17
[I 2023-06-12 00:53:55,895] Trial 445 finished with value: 79.33333587646484 and parameters: {'Fwd': 0.0003310324987603263, 'K': 10, 'alpha': 0.6000000000000001, 'dropout': 0.6000000000000001, 'gnnepoch': 60, 'lambda1': 0.8, 'lambda2': 9.683447758088002, 'loop': 1, 'loss': 'CE', 'lr': 0.0026903028817861765, 'softmaxF': True, 'useGCN': True, 'weight_decay': 3.960577917797306e-05, 'weightedloss': False}. Best is trial 112 with value: 81.66667175292969.
/home/wxy/miniconda3/lib/python3.10/site-packages/optuna/distributions.py:685: UserWarning: The distribution is specified by [0, 1.00001] and step=0.05, but the range is not divisible by `step`. It will be replaced by [0, 1.0].
  warnings.warn(
K:  9
alpha:  0.7000000000000001
lr:  0.0005397142640172127
weight_decay:  4.830412091784113e-05
dropout:  0.4
fix split and run 3 times
Data: Data(x=[2708, 1433], y=[2708], train_mask=[2708], val_mask=[2708], test_mask=[2708], adj_t=[2708, 2708, nnz=10556])
num_train tensor(140)
num_noise 0
noise: tensor(0)
data feature 1433
ALTOPT(
  (lins): Sequential(
    (0): Linear(in_features=1433, out_features=64, bias=True)
    (1): BatchNorm1d(64, eps=1e-05, momentum=0.1, affine=True, track_running_stats=True)
    (2): Dropout(p=0.4, inplace=True)
    (3): ReLU(inplace=True)
    (4): Linear(in_features=64, out_features=7, bias=True)
    (5): LogSoftmax(dim=-1)
  )
  (prop): Propagation(K=9, mode=None, lambda1=None, lambda2=None, L21=True, alpha=0.7000000000000001)
  (gcn): GCN(
    (convs): ModuleList(
      (0): GCNConv(1433, 64)
      (1): GCNConv(64, 7)
    )
    (bns): ModuleList(
      (0): BatchNorm1d(64, eps=1e-05, momentum=0.1, affine=True, track_running_stats=True)
    )
    (output): LogSoftmax(dim=-1)
  )
)
propagate done
init label
Split: 01, Run: 01
None time:  1.9297569619957358
None Run 01:
Highest Train: 100.00
Highest Valid: 79.80
  Final Train: 100.00
   Final Test: 79.50
Split: 01, Run: 02
None time:  1.8610060119535774
None Run 02:
Highest Train: 100.00
Highest Valid: 78.80
  Final Train: 100.00
   Final Test: 79.10
Split: 01, Run: 03
None time:  1.713303522206843
None Run 03:
Highest Train: 100.00
Highest Valid: 74.60
  Final Train: 100.00
   Final Test: 74.10
run time now: 5.531037330627441
total time:  5.548362253932282
None All runs:
Highest Train: 100.00 ± 0.00
Highest Valid: 77.73 ± 2.76
  Final Train: 100.00 ± 0.00
   Final Test: 77.57 ± 3.01
[I 2023-06-12 00:54:01,958] Trial 446 finished with value: 77.73332977294922 and parameters: {'Fwd': 0.07047651017436529, 'K': 9, 'alpha': 0.7000000000000001, 'dropout': 0.4, 'gnnepoch': 60, 'lambda1': 0.8500000000000001, 'lambda2': 5.430401773947224, 'loop': 1, 'loss': 'CE', 'lr': 0.0005397142640172127, 'softmaxF': True, 'useGCN': True, 'weight_decay': 4.830412091784113e-05, 'weightedloss': False}. Best is trial 112 with value: 81.66667175292969.
/home/wxy/miniconda3/lib/python3.10/site-packages/optuna/distributions.py:685: UserWarning: The distribution is specified by [0, 1.00001] and step=0.05, but the range is not divisible by `step`. It will be replaced by [0, 1.0].
  warnings.warn(
K:  7
alpha:  0.65
lr:  0.008479708558618185
weight_decay:  0.00015328488667905142
dropout:  0.1
fix split and run 3 times
Data: Data(x=[2708, 1433], y=[2708], train_mask=[2708], val_mask=[2708], test_mask=[2708], adj_t=[2708, 2708, nnz=10556])
num_train tensor(140)
num_noise 0
noise: tensor(0)
data feature 1433
ALTOPT(
  (lins): Sequential(
    (0): Linear(in_features=1433, out_features=64, bias=True)
    (1): BatchNorm1d(64, eps=1e-05, momentum=0.1, affine=True, track_running_stats=True)
    (2): Dropout(p=0.1, inplace=True)
    (3): ReLU(inplace=True)
    (4): Linear(in_features=64, out_features=7, bias=True)
    (5): LogSoftmax(dim=-1)
  )
  (prop): Propagation(K=7, mode=None, lambda1=None, lambda2=None, L21=True, alpha=0.65)
  (gcn): GCN(
    (convs): ModuleList(
      (0): GCNConv(1433, 64)
      (1): GCNConv(64, 7)
    )
    (bns): ModuleList(
      (0): BatchNorm1d(64, eps=1e-05, momentum=0.1, affine=True, track_running_stats=True)
    )
    (output): LogSoftmax(dim=-1)
  )
)
propagate done
init label
Split: 01, Run: 01
None time:  1.5598621000535786
None Run 01:
Highest Train: 100.00
Highest Valid: 80.40
  Final Train: 100.00
   Final Test: 81.90
Split: 01, Run: 02
None time:  1.68680793303065
None Run 02:
Highest Train: 100.00
Highest Valid: 80.60
  Final Train: 100.00
   Final Test: 81.60
Split: 01, Run: 03
None time:  1.6233089310117066
None Run 03:
Highest Train: 100.00
Highest Valid: 80.40
  Final Train: 100.00
   Final Test: 81.20
run time now: 4.894554615020752
total time:  4.916614999063313
None All runs:
Highest Train: 100.00 ± 0.00
Highest Valid: 80.47 ± 0.12
  Final Train: 100.00 ± 0.00
   Final Test: 81.57 ± 0.35
[I 2023-06-12 00:54:07,470] Trial 447 finished with value: 80.46666717529297 and parameters: {'Fwd': 4.4700143108805136e-05, 'K': 7, 'alpha': 0.65, 'dropout': 0.1, 'gnnepoch': 70, 'lambda1': 0.8500000000000001, 'lambda2': 2.846594164883412, 'loop': 1, 'loss': 'CE', 'lr': 0.008479708558618185, 'softmaxF': True, 'useGCN': True, 'weight_decay': 0.00015328488667905142, 'weightedloss': True}. Best is trial 112 with value: 81.66667175292969.
/home/wxy/miniconda3/lib/python3.10/site-packages/optuna/distributions.py:685: UserWarning: The distribution is specified by [0, 1.00001] and step=0.05, but the range is not divisible by `step`. It will be replaced by [0, 1.0].
  warnings.warn(
K:  10
alpha:  0.45
lr:  0.00041943435467666336
weight_decay:  7.621790630312755e-05
dropout:  0.7000000000000001
fix split and run 3 times
Data: Data(x=[2708, 1433], y=[2708], train_mask=[2708], val_mask=[2708], test_mask=[2708], adj_t=[2708, 2708, nnz=10556])
num_train tensor(140)
num_noise 0
noise: tensor(0)
data feature 1433
ALTOPT(
  (lins): Sequential(
    (0): Linear(in_features=1433, out_features=64, bias=True)
    (1): BatchNorm1d(64, eps=1e-05, momentum=0.1, affine=True, track_running_stats=True)
    (2): Dropout(p=0.7000000000000001, inplace=True)
    (3): ReLU(inplace=True)
    (4): Linear(in_features=64, out_features=7, bias=True)
    (5): LogSoftmax(dim=-1)
  )
  (prop): Propagation(K=10, mode=None, lambda1=None, lambda2=None, L21=True, alpha=0.45)
  (gcn): GCN(
    (convs): ModuleList(
      (0): GCNConv(1433, 64)
      (1): GCNConv(64, 7)
    )
    (bns): ModuleList(
      (0): BatchNorm1d(64, eps=1e-05, momentum=0.1, affine=True, track_running_stats=True)
    )
    (output): LogSoftmax(dim=-1)
  )
)
propagate done
init label
Split: 01, Run: 01
None time:  1.4826826381031424
None Run 01:
Highest Train: 100.00
Highest Valid: 79.20
  Final Train: 100.00
   Final Test: 78.60
Split: 01, Run: 02
None time:  1.7917394549585879
None Run 02:
Highest Train: 100.00
Highest Valid: 77.60
  Final Train: 100.00
   Final Test: 76.50
Split: 01, Run: 03
None time:  1.5138746940065175
None Run 03:
Highest Train: 100.00
Highest Valid: 77.80
  Final Train: 100.00
   Final Test: 77.50
run time now: 4.814049959182739
total time:  4.829442393034697
None All runs:
Highest Train: 100.00 ± 0.00
Highest Valid: 78.20 ± 0.87
  Final Train: 100.00 ± 0.00
   Final Test: 77.53 ± 1.05
