[I 2023-06-11 23:22:45,154] Trial 26 finished with value: 66.13333129882812 and parameters: {'Fwd': 0.03187082359424061, 'K': 6, 'alpha': 0.6000000000000001, 'dropout': 0.5, 'gnnepoch': 90, 'lambda1': 0.30000000000000004, 'lambda2': 4.475665867746036, 'loop': 0, 'loss': 'MSE', 'lr': 0.0036264365066789443, 'softmaxF': True, 'useGCN': True, 'weight_decay': 2.7456996816491036e-06, 'weightedloss': False}. Best is trial 10 with value: 71.20000457763672.
/home/wxy/miniconda3/lib/python3.10/site-packages/optuna/distributions.py:685: UserWarning: The distribution is specified by [0, 1.00001] and step=0.05, but the range is not divisible by `step`. It will be replaced by [0, 1.0].
  warnings.warn(
K:  3
alpha:  0.4
lr:  0.002241158785083253
weight_decay:  8.680431100449985e-05
dropout:  0.4
fix split and run 3 times
Data: Data(x=[3327, 3703], y=[3327], train_mask=[3327], val_mask=[3327], test_mask=[3327], adj_t=[3327, 3327, nnz=9104])
num_train tensor(120)
num_noise 0
noise: tensor(0)
data feature 3703
ALTOPT(
  (lins): Sequential(
    (0): Linear(in_features=3703, out_features=64, bias=True)
    (1): BatchNorm1d(64, eps=1e-05, momentum=0.1, affine=True, track_running_stats=True)
    (2): Dropout(p=0.4, inplace=True)
    (3): ReLU(inplace=True)
    (4): Linear(in_features=64, out_features=6, bias=True)
    (5): LogSoftmax(dim=-1)
  )
  (prop): Propagation(K=3, mode=None, lambda1=None, lambda2=None, L21=True, alpha=0.4)
  (gcn): GCN(
    (convs): ModuleList(
      (0): GCNConv(3703, 64)
      (1): GCNConv(64, 6)
    )
    (bns): ModuleList(
      (0): BatchNorm1d(64, eps=1e-05, momentum=0.1, affine=True, track_running_stats=True)
    )
    (output): LogSoftmax(dim=-1)
  )
)
propagate done
init label
Split: 01, Run: 01
None time:  0.7619797689840198
None Run 01:
Highest Train: 100.00
Highest Valid: 71.40
  Final Train: 100.00
   Final Test: 69.60
Split: 01, Run: 02
None time:  0.7375925730448216
None Run 02:
Highest Train: 100.00
Highest Valid: 69.40
  Final Train: 100.00
   Final Test: 68.60
Split: 01, Run: 03
None time:  0.7614115560427308
None Run 03:
Highest Train: 100.00
Highest Valid: 70.20
  Final Train: 100.00
   Final Test: 69.50
run time now: 2.29636287689209
total time:  2.347475458867848
None All runs:
Highest Train: 100.00 ± 0.00
Highest Valid: 70.33 ± 1.01
  Final Train: 100.00 ± 0.00
   Final Test: 69.23 ± 0.55
[I 2023-06-11 23:22:47,920] Trial 27 finished with value: 70.33333587646484 and parameters: {'Fwd': 0.04510348383616077, 'K': 3, 'alpha': 0.4, 'dropout': 0.4, 'gnnepoch': 70, 'lambda1': 0.55, 'lambda2': 5.40035184176363, 'loop': 1, 'loss': 'CE', 'lr': 0.002241158785083253, 'softmaxF': False, 'useGCN': True, 'weight_decay': 8.680431100449985e-05, 'weightedloss': True}. Best is trial 10 with value: 71.20000457763672.
/home/wxy/miniconda3/lib/python3.10/site-packages/optuna/distributions.py:685: UserWarning: The distribution is specified by [0, 1.00001] and step=0.05, but the range is not divisible by `step`. It will be replaced by [0, 1.0].
  warnings.warn(
K:  9
alpha:  0.7000000000000001
lr:  0.0012783952985468468
weight_decay:  2.2598211157228172e-06
dropout:  0.30000000000000004
fix split and run 3 times
Data: Data(x=[3327, 3703], y=[3327], train_mask=[3327], val_mask=[3327], test_mask=[3327], adj_t=[3327, 3327, nnz=9104])
num_train tensor(120)
num_noise 0
noise: tensor(0)
data feature 3703
ALTOPT(
  (lins): Sequential(
    (0): Linear(in_features=3703, out_features=64, bias=True)
    (1): BatchNorm1d(64, eps=1e-05, momentum=0.1, affine=True, track_running_stats=True)
    (2): Dropout(p=0.30000000000000004, inplace=True)
    (3): ReLU(inplace=True)
    (4): Linear(in_features=64, out_features=6, bias=True)
    (5): LogSoftmax(dim=-1)
  )
  (prop): Propagation(K=9, mode=None, lambda1=None, lambda2=None, L21=True, alpha=0.7000000000000001)
  (gcn): GCN(
    (convs): ModuleList(
      (0): GCNConv(3703, 64)
      (1): GCNConv(64, 6)
    )
    (bns): ModuleList(
      (0): BatchNorm1d(64, eps=1e-05, momentum=0.1, affine=True, track_running_stats=True)
    )
    (output): LogSoftmax(dim=-1)
  )
)
propagate done
init label
Split: 01, Run: 01
None time:  0.7897036201320589
None Run 01:
Highest Train: 100.00
Highest Valid: 70.60
  Final Train: 100.00
   Final Test: 68.80
Split: 01, Run: 02
None time:  0.8125402890145779
None Run 02:
Highest Train: 100.00
Highest Valid: 70.60
  Final Train: 100.00
   Final Test: 70.00
Split: 01, Run: 03
None time:  0.8541866738814861
None Run 03:
Highest Train: 100.00
Highest Valid: 70.20
  Final Train: 100.00
   Final Test: 68.50
run time now: 2.498948812484741
total time:  2.555413037771359
None All runs:
Highest Train: 100.00 ± 0.00
Highest Valid: 70.47 ± 0.23
  Final Train: 100.00 ± 0.00
   Final Test: 69.10 ± 0.79
[I 2023-06-11 23:22:50,886] Trial 28 finished with value: 70.46666717529297 and parameters: {'Fwd': 0.011789453735034875, 'K': 9, 'alpha': 0.7000000000000001, 'dropout': 0.30000000000000004, 'gnnepoch': 90, 'lambda1': 0.9, 'lambda2': 6.237015877184054, 'loop': 0, 'loss': 'CE', 'lr': 0.0012783952985468468, 'softmaxF': True, 'useGCN': True, 'weight_decay': 2.2598211157228172e-06, 'weightedloss': True}. Best is trial 10 with value: 71.20000457763672.
/home/wxy/miniconda3/lib/python3.10/site-packages/optuna/distributions.py:685: UserWarning: The distribution is specified by [0, 1.00001] and step=0.05, but the range is not divisible by `step`. It will be replaced by [0, 1.0].
  warnings.warn(
K:  1
alpha:  0.45
lr:  0.005740673594795228
weight_decay:  2.901496999022837e-05
dropout:  0.6000000000000001
fix split and run 3 times
Data: Data(x=[3327, 3703], y=[3327], train_mask=[3327], val_mask=[3327], test_mask=[3327], adj_t=[3327, 3327, nnz=9104])
num_train tensor(120)
num_noise 0
noise: tensor(0)
data feature 3703
ALTOPT(
  (lins): Sequential(
    (0): Linear(in_features=3703, out_features=64, bias=True)
    (1): BatchNorm1d(64, eps=1e-05, momentum=0.1, affine=True, track_running_stats=True)
    (2): Dropout(p=0.6000000000000001, inplace=True)
    (3): ReLU(inplace=True)
    (4): Linear(in_features=64, out_features=6, bias=True)
    (5): Identity()
  )
  (prop): Propagation(K=1, mode=None, lambda1=None, lambda2=None, L21=True, alpha=0.45)
  (gcn): GCN(
    (convs): ModuleList(
      (0): GCNConv(3703, 64)
      (1): GCNConv(64, 6)
    )
    (bns): ModuleList(
      (0): BatchNorm1d(64, eps=1e-05, momentum=0.1, affine=True, track_running_stats=True)
    )
    (output): Identity()
  )
)
propagate done
init label
Split: 01, Run: 01
None time:  0.3862289199605584
None Run 01:
Highest Train: 100.00
Highest Valid: 69.00
  Final Train: 100.00
   Final Test: 68.40
Split: 01, Run: 02
None time:  0.3929734551347792
None Run 02:
Highest Train: 100.00
Highest Valid: 70.60
  Final Train: 100.00
   Final Test: 68.30
Split: 01, Run: 03
None time:  0.3241007619071752
None Run 03:
Highest Train: 100.00
Highest Valid: 69.60
  Final Train: 100.00
   Final Test: 66.60
run time now: 1.13608980178833
total time:  1.1950099649839103
None All runs:
Highest Train: 100.00 ± 0.00
Highest Valid: 69.73 ± 0.81
  Final Train: 100.00 ± 0.00
   Final Test: 67.77 ± 1.01
[I 2023-06-11 23:22:52,504] Trial 29 finished with value: 69.73333740234375 and parameters: {'Fwd': 0.0011815909908377085, 'K': 1, 'alpha': 0.45, 'dropout': 0.6000000000000001, 'gnnepoch': 20, 'lambda1': 0.25, 'lambda2': 7.550103808861229, 'loop': 1, 'loss': 'MSE', 'lr': 0.005740673594795228, 'softmaxF': False, 'useGCN': True, 'weight_decay': 2.901496999022837e-05, 'weightedloss': False}. Best is trial 10 with value: 71.20000457763672.
/home/wxy/miniconda3/lib/python3.10/site-packages/optuna/distributions.py:685: UserWarning: The distribution is specified by [0, 1.00001] and step=0.05, but the range is not divisible by `step`. It will be replaced by [0, 1.0].
  warnings.warn(
K:  10
alpha:  0.55
lr:  0.0009687684558468798
weight_decay:  1.0321076410338516e-05
dropout:  0.1
fix split and run 3 times
Data: Data(x=[3327, 3703], y=[3327], train_mask=[3327], val_mask=[3327], test_mask=[3327], adj_t=[3327, 3327, nnz=9104])
num_train tensor(120)
num_noise 0
noise: tensor(0)
data feature 3703
ALTOPT(
  (lins): Sequential(
    (0): Linear(in_features=3703, out_features=64, bias=True)
    (1): BatchNorm1d(64, eps=1e-05, momentum=0.1, affine=True, track_running_stats=True)
    (2): Dropout(p=0.1, inplace=True)
    (3): ReLU(inplace=True)
    (4): Linear(in_features=64, out_features=6, bias=True)
    (5): LogSoftmax(dim=-1)
  )
  (prop): Propagation(K=10, mode=None, lambda1=None, lambda2=None, L21=True, alpha=0.55)
  (gcn): GCN(
    (convs): ModuleList(
      (0): GCNConv(3703, 64)
      (1): GCNConv(64, 6)
    )
    (bns): ModuleList(
      (0): BatchNorm1d(64, eps=1e-05, momentum=0.1, affine=True, track_running_stats=True)
    )
    (output): LogSoftmax(dim=-1)
  )
)
propagate done
init label
Split: 01, Run: 01
None time:  1.0025707948952913
None Run 01:
Highest Train: 100.00
Highest Valid: 70.80
  Final Train: 100.00
   Final Test: 69.50
Split: 01, Run: 02
None time:  0.9561531930230558
None Run 02:
Highest Train: 100.00
Highest Valid: 68.60
  Final Train: 100.00
   Final Test: 67.30
Split: 01, Run: 03
None time:  1.0753678530454636
None Run 03:
Highest Train: 100.00
Highest Valid: 70.60
  Final Train: 100.00
   Final Test: 69.40
run time now: 3.0778276920318604
total time:  3.1411258410662413
None All runs:
Highest Train: 100.00 ± 0.00
Highest Valid: 70.00 ± 1.22
  Final Train: 100.00 ± 0.00
   Final Test: 68.73 ± 1.24
[I 2023-06-11 23:22:56,059] Trial 30 finished with value: 70.0 and parameters: {'Fwd': 0.004659849677350294, 'K': 10, 'alpha': 0.55, 'dropout': 0.1, 'gnnepoch': 110, 'lambda1': 0.45, 'lambda2': 8.240740881032965, 'loop': 0, 'loss': 'CE', 'lr': 0.0009687684558468798, 'softmaxF': True, 'useGCN': True, 'weight_decay': 1.0321076410338516e-05, 'weightedloss': True}. Best is trial 10 with value: 71.20000457763672.
/home/wxy/miniconda3/lib/python3.10/site-packages/optuna/distributions.py:685: UserWarning: The distribution is specified by [0, 1.00001] and step=0.05, but the range is not divisible by `step`. It will be replaced by [0, 1.0].
  warnings.warn(
K:  7
alpha:  0.65
lr:  0.001406148235133464
weight_decay:  1.8433239470947709e-06
dropout:  0.30000000000000004
fix split and run 3 times
Data: Data(x=[3327, 3703], y=[3327], train_mask=[3327], val_mask=[3327], test_mask=[3327], adj_t=[3327, 3327, nnz=9104])
num_train tensor(120)
num_noise 0
noise: tensor(0)
data feature 3703
ALTOPT(
  (lins): Sequential(
    (0): Linear(in_features=3703, out_features=64, bias=True)
    (1): BatchNorm1d(64, eps=1e-05, momentum=0.1, affine=True, track_running_stats=True)
    (2): Dropout(p=0.30000000000000004, inplace=True)
    (3): ReLU(inplace=True)
    (4): Linear(in_features=64, out_features=6, bias=True)
    (5): LogSoftmax(dim=-1)
  )
  (prop): Propagation(K=7, mode=None, lambda1=None, lambda2=None, L21=True, alpha=0.65)
  (gcn): GCN(
    (convs): ModuleList(
      (0): GCNConv(3703, 64)
      (1): GCNConv(64, 6)
    )
    (bns): ModuleList(
      (0): BatchNorm1d(64, eps=1e-05, momentum=0.1, affine=True, track_running_stats=True)
    )
    (output): LogSoftmax(dim=-1)
  )
)
propagate done
init label
Split: 01, Run: 01
None time:  0.8338224468752742
None Run 01:
Highest Train: 100.00
Highest Valid: 71.00
  Final Train: 100.00
   Final Test: 69.70
Split: 01, Run: 02
None time:  0.9558342949021608
None Run 02:
Highest Train: 100.00
Highest Valid: 70.40
  Final Train: 100.00
   Final Test: 68.80
Split: 01, Run: 03
None time:  0.9718434019014239
None Run 03:
Highest Train: 100.00
Highest Valid: 71.40
  Final Train: 100.00
   Final Test: 69.00
run time now: 2.802191972732544
total time:  2.8599395940545946
None All runs:
Highest Train: 100.00 ± 0.00
Highest Valid: 70.93 ± 0.50
  Final Train: 100.00 ± 0.00
   Final Test: 69.17 ± 0.47
[I 2023-06-11 23:22:59,341] Trial 31 finished with value: 70.9333267211914 and parameters: {'Fwd': 0.023979912916201468, 'K': 7, 'alpha': 0.65, 'dropout': 0.30000000000000004, 'gnnepoch': 100, 'lambda1': 0.5, 'lambda2': 4.606389411707437, 'loop': 0, 'loss': 'CE', 'lr': 0.001406148235133464, 'softmaxF': True, 'useGCN': True, 'weight_decay': 1.8433239470947709e-06, 'weightedloss': True}. Best is trial 10 with value: 71.20000457763672.
/home/wxy/miniconda3/lib/python3.10/site-packages/optuna/distributions.py:685: UserWarning: The distribution is specified by [0, 1.00001] and step=0.05, but the range is not divisible by `step`. It will be replaced by [0, 1.0].
  warnings.warn(
K:  8
alpha:  0.65
lr:  0.0018316610204900236
weight_decay:  1.0503575657682308e-06
dropout:  0.2
fix split and run 3 times
Data: Data(x=[3327, 3703], y=[3327], train_mask=[3327], val_mask=[3327], test_mask=[3327], adj_t=[3327, 3327, nnz=9104])
num_train tensor(120)
num_noise 0
noise: tensor(0)
data feature 3703
ALTOPT(
  (lins): Sequential(
    (0): Linear(in_features=3703, out_features=64, bias=True)
    (1): BatchNorm1d(64, eps=1e-05, momentum=0.1, affine=True, track_running_stats=True)
    (2): Dropout(p=0.2, inplace=True)
    (3): ReLU(inplace=True)
    (4): Linear(in_features=64, out_features=6, bias=True)
    (5): LogSoftmax(dim=-1)
  )
  (prop): Propagation(K=8, mode=None, lambda1=None, lambda2=None, L21=True, alpha=0.65)
  (gcn): GCN(
    (convs): ModuleList(
      (0): GCNConv(3703, 64)
      (1): GCNConv(64, 6)
    )
    (bns): ModuleList(
      (0): BatchNorm1d(64, eps=1e-05, momentum=0.1, affine=True, track_running_stats=True)
    )
    (output): LogSoftmax(dim=-1)
  )
)
propagate done
init label
Split: 01, Run: 01
None time:  0.9084804130252451
None Run 01:
Highest Train: 100.00
Highest Valid: 71.20
  Final Train: 100.00
   Final Test: 69.50
Split: 01, Run: 02
None time:  0.9188871411606669
None Run 02:
Highest Train: 100.00
Highest Valid: 71.00
  Final Train: 100.00
   Final Test: 68.90
Split: 01, Run: 03
None time:  0.9224358210340142
None Run 03:
Highest Train: 100.00
Highest Valid: 71.00
  Final Train: 100.00
   Final Test: 68.80
run time now: 2.78993821144104
total time:  2.84624219709076
None All runs:
Highest Train: 100.00 ± 0.00
Highest Valid: 71.07 ± 0.12
  Final Train: 100.00 ± 0.00
   Final Test: 69.07 ± 0.38
[I 2023-06-11 23:23:02,636] Trial 32 finished with value: 71.0666732788086 and parameters: {'Fwd': 0.04608914172069539, 'K': 8, 'alpha': 0.65, 'dropout': 0.2, 'gnnepoch': 100, 'lambda1': 0.7000000000000001, 'lambda2': 4.8385472892445405, 'loop': 0, 'loss': 'CE', 'lr': 0.0018316610204900236, 'softmaxF': True, 'useGCN': True, 'weight_decay': 1.0503575657682308e-06, 'weightedloss': True}. Best is trial 10 with value: 71.20000457763672.
/home/wxy/miniconda3/lib/python3.10/site-packages/optuna/distributions.py:685: UserWarning: The distribution is specified by [0, 1.00001] and step=0.05, but the range is not divisible by `step`. It will be replaced by [0, 1.0].
  warnings.warn(
K:  5
alpha:  0.45
lr:  0.001909934233243353
weight_decay:  5.247728668840667e-06
dropout:  0.4
fix split and run 3 times
Data: Data(x=[3327, 3703], y=[3327], train_mask=[3327], val_mask=[3327], test_mask=[3327], adj_t=[3327, 3327, nnz=9104])
num_train tensor(120)
num_noise 0
noise: tensor(0)
data feature 3703
ALTOPT(
  (lins): Sequential(
    (0): Linear(in_features=3703, out_features=64, bias=True)
    (1): BatchNorm1d(64, eps=1e-05, momentum=0.1, affine=True, track_running_stats=True)
    (2): Dropout(p=0.4, inplace=True)
    (3): ReLU(inplace=True)
    (4): Linear(in_features=64, out_features=6, bias=True)
    (5): LogSoftmax(dim=-1)
  )
  (prop): Propagation(K=5, mode=None, lambda1=None, lambda2=None, L21=True, alpha=0.45)
  (gcn): GCN(
    (convs): ModuleList(
      (0): GCNConv(3703, 64)
      (1): GCNConv(64, 6)
    )
    (bns): ModuleList(
      (0): BatchNorm1d(64, eps=1e-05, momentum=0.1, affine=True, track_running_stats=True)
    )
    (output): LogSoftmax(dim=-1)
  )
)
propagate done
init label
Split: 01, Run: 01
None time:  1.0898809228092432
None Run 01:
Highest Train: 100.00
Highest Valid: 70.80
  Final Train: 100.00
   Final Test: 70.20
Split: 01, Run: 02
None time:  1.0664717420004308
None Run 02:
Highest Train: 100.00
Highest Valid: 71.00
  Final Train: 100.00
   Final Test: 69.50
Split: 01, Run: 03
None time:  1.0383564250078052
None Run 03:
Highest Train: 100.00
Highest Valid: 70.60
  Final Train: 100.00
   Final Test: 68.80
run time now: 3.232060194015503
total time:  3.293735750950873
None All runs:
Highest Train: 100.00 ± 0.00
Highest Valid: 70.80 ± 0.20
  Final Train: 100.00 ± 0.00
   Final Test: 69.50 ± 0.70
[I 2023-06-11 23:23:06,408] Trial 33 finished with value: 70.79999542236328 and parameters: {'Fwd': 0.013110701152987366, 'K': 5, 'alpha': 0.45, 'dropout': 0.4, 'gnnepoch': 120, 'lambda1': 0.6000000000000001, 'lambda2': 3.779996880120024, 'loop': 0, 'loss': 'CE', 'lr': 0.001909934233243353, 'softmaxF': True, 'useGCN': True, 'weight_decay': 5.247728668840667e-06, 'weightedloss': True}. Best is trial 10 with value: 71.20000457763672.
/home/wxy/miniconda3/lib/python3.10/site-packages/optuna/distributions.py:685: UserWarning: The distribution is specified by [0, 1.00001] and step=0.05, but the range is not divisible by `step`. It will be replaced by [0, 1.0].
  warnings.warn(
K:  6
alpha:  0.55
lr:  0.002837804357143556
weight_decay:  2.064516853578985e-06
dropout:  0.5
fix split and run 3 times
Data: Data(x=[3327, 3703], y=[3327], train_mask=[3327], val_mask=[3327], test_mask=[3327], adj_t=[3327, 3327, nnz=9104])
num_train tensor(120)
num_noise 0
noise: tensor(0)
data feature 3703
ALTOPT(
  (lins): Sequential(
    (0): Linear(in_features=3703, out_features=64, bias=True)
    (1): BatchNorm1d(64, eps=1e-05, momentum=0.1, affine=True, track_running_stats=True)
    (2): Dropout(p=0.5, inplace=True)
    (3): ReLU(inplace=True)
    (4): Linear(in_features=64, out_features=6, bias=True)
    (5): LogSoftmax(dim=-1)
  )
  (prop): Propagation(K=6, mode=None, lambda1=None, lambda2=None, L21=True, alpha=0.55)
  (gcn): GCN(
    (convs): ModuleList(
      (0): GCNConv(3703, 64)
      (1): GCNConv(64, 6)
    )
    (bns): ModuleList(
      (0): BatchNorm1d(64, eps=1e-05, momentum=0.1, affine=True, track_running_stats=True)
    )
    (output): LogSoftmax(dim=-1)
  )
)
propagate done
init label
Split: 01, Run: 01
None time:  0.47826120001263916
None Run 01:
Highest Train: 100.00
Highest Valid: 70.80
  Final Train: 100.00
   Final Test: 69.10
Split: 01, Run: 02
None time:  0.4822995748836547
None Run 02:
Highest Train: 100.00
Highest Valid: 70.80
  Final Train: 100.00
   Final Test: 69.00
Split: 01, Run: 03
None time:  0.48274311516433954
None Run 03:
Highest Train: 100.00
Highest Valid: 71.40
  Final Train: 100.00
   Final Test: 70.00
run time now: 1.4821898937225342
total time:  1.5385967150796205
None All runs:
Highest Train: 100.00 ± 0.00
Highest Valid: 71.00 ± 0.35
  Final Train: 100.00 ± 0.00
   Final Test: 69.37 ± 0.55
[I 2023-06-11 23:23:08,338] Trial 34 finished with value: 71.0 and parameters: {'Fwd': 0.06356977704432952, 'K': 6, 'alpha': 0.55, 'dropout': 0.5, 'gnnepoch': 50, 'lambda1': 0.5, 'lambda2': 3.4293430323554723, 'loop': 0, 'loss': 'CE', 'lr': 0.002837804357143556, 'softmaxF': True, 'useGCN': True, 'weight_decay': 2.064516853578985e-06, 'weightedloss': True}. Best is trial 10 with value: 71.20000457763672.
/home/wxy/miniconda3/lib/python3.10/site-packages/optuna/distributions.py:685: UserWarning: The distribution is specified by [0, 1.00001] and step=0.05, but the range is not divisible by `step`. It will be replaced by [0, 1.0].
  warnings.warn(
K:  10
alpha:  0.8
lr:  0.004144298495195237
weight_decay:  1.856683534111956e-06
dropout:  0.30000000000000004
fix split and run 3 times
Data: Data(x=[3327, 3703], y=[3327], train_mask=[3327], val_mask=[3327], test_mask=[3327], adj_t=[3327, 3327, nnz=9104])
num_train tensor(120)
num_noise 0
noise: tensor(0)
data feature 3703
ALTOPT(
  (lins): Sequential(
    (0): Linear(in_features=3703, out_features=64, bias=True)
    (1): BatchNorm1d(64, eps=1e-05, momentum=0.1, affine=True, track_running_stats=True)
    (2): Dropout(p=0.30000000000000004, inplace=True)
    (3): ReLU(inplace=True)
    (4): Linear(in_features=64, out_features=6, bias=True)
    (5): LogSoftmax(dim=-1)
  )
  (prop): Propagation(K=10, mode=None, lambda1=None, lambda2=None, L21=True, alpha=0.8)
  (gcn): GCN(
    (convs): ModuleList(
      (0): GCNConv(3703, 64)
      (1): GCNConv(64, 6)
    )
    (bns): ModuleList(
      (0): BatchNorm1d(64, eps=1e-05, momentum=0.1, affine=True, track_running_stats=True)
    )
    (output): LogSoftmax(dim=-1)
  )
)
propagate done
init label
Split: 01, Run: 01, Epoch: 100, Loss: 0.0000, Train: 100.00%, Valid: 70.80% Test: 69.50%
Split: 01, Run: 01
None time:  1.6632639260496944
None Run 01:
Highest Train: 100.00
Highest Valid: 70.80
  Final Train: 100.00
   Final Test: 69.50
Split: 01, Run: 02, Epoch: 100, Loss: 0.0000, Train: 100.00%, Valid: 69.80% Test: 69.70%
Split: 01, Run: 02
None time:  1.706215123878792
None Run 02:
Highest Train: 100.00
Highest Valid: 69.80
  Final Train: 100.00
   Final Test: 70.10
Split: 01, Run: 03, Epoch: 100, Loss: 0.0000, Train: 100.00%, Valid: 70.00% Test: 68.90%
Split: 01, Run: 03
None time:  1.630890010856092
None Run 03:
Highest Train: 100.00
Highest Valid: 70.00
  Final Train: 100.00
   Final Test: 68.80
run time now: 5.043700456619263
total time:  5.095595933962613
None All runs:
Highest Train: 100.00 ± 0.00
Highest Valid: 70.20 ± 0.53
  Final Train: 100.00 ± 0.00
   Final Test: 69.47 ± 0.65
