[I 2023-06-12 00:41:00,849] Trial 304 finished with value: 81.13333129882812 and parameters: {'Fwd': 0.08320629847228075, 'K': 9, 'alpha': 0.75, 'dropout': 0.4, 'gnnepoch': 50, 'lambda1': 0.8500000000000001, 'lambda2': 5.587434480814984, 'loop': 1, 'loss': 'CE', 'lr': 0.008181533456061155, 'softmaxF': True, 'useGCN': True, 'weight_decay': 4.17128077382697e-05, 'weightedloss': True}. Best is trial 112 with value: 81.66667175292969.
/home/wxy/miniconda3/lib/python3.10/site-packages/optuna/distributions.py:685: UserWarning: The distribution is specified by [0, 1.00001] and step=0.05, but the range is not divisible by `step`. It will be replaced by [0, 1.0].
  warnings.warn(
K:  10
alpha:  0.45
lr:  0.009208621067606787
weight_decay:  2.9775912586648463e-05
dropout:  0.5
fix split and run 3 times
Data: Data(x=[2708, 1433], y=[2708], train_mask=[2708], val_mask=[2708], test_mask=[2708], adj_t=[2708, 2708, nnz=10556])
num_train tensor(140)
num_noise 0
noise: tensor(0)
data feature 1433
ALTOPT(
  (lins): Sequential(
    (0): Linear(in_features=1433, out_features=64, bias=True)
    (1): BatchNorm1d(64, eps=1e-05, momentum=0.1, affine=True, track_running_stats=True)
    (2): Dropout(p=0.5, inplace=True)
    (3): ReLU(inplace=True)
    (4): Linear(in_features=64, out_features=7, bias=True)
    (5): LogSoftmax(dim=-1)
  )
  (prop): Propagation(K=10, mode=None, lambda1=None, lambda2=None, L21=True, alpha=0.45)
  (gcn): GCN(
    (convs): ModuleList(
      (0): GCNConv(1433, 64)
      (1): GCNConv(64, 7)
    )
    (bns): ModuleList(
      (0): BatchNorm1d(64, eps=1e-05, momentum=0.1, affine=True, track_running_stats=True)
    )
    (output): LogSoftmax(dim=-1)
  )
)
propagate done
init label
Split: 01, Run: 01
None time:  1.3845222310628742
None Run 01:
Highest Train: 100.00
Highest Valid: 81.80
  Final Train: 100.00
   Final Test: 82.30
Split: 01, Run: 02
None time:  1.5859527562279254
None Run 02:
Highest Train: 100.00
Highest Valid: 80.80
  Final Train: 100.00
   Final Test: 80.00
Split: 01, Run: 03
None time:  1.714060345897451
None Run 03:
Highest Train: 100.00
Highest Valid: 80.80
  Final Train: 100.00
   Final Test: 81.00
run time now: 4.711689472198486
total time:  4.7252136510796845
None All runs:
Highest Train: 100.00 ± 0.00
Highest Valid: 81.13 ± 0.58
  Final Train: 100.00 ± 0.00
   Final Test: 81.10 ± 1.15
[I 2023-06-12 00:41:06,127] Trial 305 finished with value: 81.13333892822266 and parameters: {'Fwd': 0.08541817975470695, 'K': 10, 'alpha': 0.45, 'dropout': 0.5, 'gnnepoch': 60, 'lambda1': 0.9, 'lambda2': 5.287420163987639, 'loop': 1, 'loss': 'CE', 'lr': 0.009208621067606787, 'softmaxF': True, 'useGCN': True, 'weight_decay': 2.9775912586648463e-05, 'weightedloss': False}. Best is trial 112 with value: 81.66667175292969.
/home/wxy/miniconda3/lib/python3.10/site-packages/optuna/distributions.py:685: UserWarning: The distribution is specified by [0, 1.00001] and step=0.05, but the range is not divisible by `step`. It will be replaced by [0, 1.0].
  warnings.warn(
K:  10
alpha:  0.65
lr:  0.00783989038404382
weight_decay:  5.256810891067785e-05
dropout:  0.4
fix split and run 3 times
Data: Data(x=[2708, 1433], y=[2708], train_mask=[2708], val_mask=[2708], test_mask=[2708], adj_t=[2708, 2708, nnz=10556])
num_train tensor(140)
num_noise 0
noise: tensor(0)
data feature 1433
ALTOPT(
  (lins): Sequential(
    (0): Linear(in_features=1433, out_features=64, bias=True)
    (1): BatchNorm1d(64, eps=1e-05, momentum=0.1, affine=True, track_running_stats=True)
    (2): Dropout(p=0.4, inplace=True)
    (3): ReLU(inplace=True)
    (4): Linear(in_features=64, out_features=7, bias=True)
    (5): LogSoftmax(dim=-1)
  )
  (prop): Propagation(K=10, mode=None, lambda1=None, lambda2=None, L21=True, alpha=0.65)
  (gcn): GCN(
    (convs): ModuleList(
      (0): GCNConv(1433, 64)
      (1): GCNConv(64, 7)
    )
    (bns): ModuleList(
      (0): BatchNorm1d(64, eps=1e-05, momentum=0.1, affine=True, track_running_stats=True)
    )
    (output): LogSoftmax(dim=-1)
  )
)
propagate done
init label
Split: 01, Run: 01
None time:  1.5780766049865633
None Run 01:
Highest Train: 100.00
Highest Valid: 82.00
  Final Train: 100.00
   Final Test: 82.30
Split: 01, Run: 02
None time:  1.1092459801584482
None Run 02:
Highest Train: 100.00
Highest Valid: 81.40
  Final Train: 100.00
   Final Test: 81.40
Split: 01, Run: 03
None time:  1.7511617748532444
None Run 03:
Highest Train: 100.00
Highest Valid: 81.00
  Final Train: 100.00
   Final Test: 80.60
run time now: 4.469613552093506
total time:  4.5203850930556655
None All runs:
Highest Train: 100.00 ± 0.00
Highest Valid: 81.47 ± 0.50
  Final Train: 100.00 ± 0.00
   Final Test: 81.43 ± 0.85
[I 2023-06-12 00:41:11,183] Trial 306 finished with value: 81.46666717529297 and parameters: {'Fwd': 0.09977332655998528, 'K': 10, 'alpha': 0.65, 'dropout': 0.4, 'gnnepoch': 60, 'lambda1': 0.8, 'lambda2': 5.797415238396782, 'loop': 1, 'loss': 'CE', 'lr': 0.00783989038404382, 'softmaxF': True, 'useGCN': True, 'weight_decay': 5.256810891067785e-05, 'weightedloss': False}. Best is trial 112 with value: 81.66667175292969.
/home/wxy/miniconda3/lib/python3.10/site-packages/optuna/distributions.py:685: UserWarning: The distribution is specified by [0, 1.00001] and step=0.05, but the range is not divisible by `step`. It will be replaced by [0, 1.0].
  warnings.warn(
K:  10
alpha:  0.6000000000000001
lr:  0.0014204431715839731
weight_decay:  6.581126702104277e-05
dropout:  0.4
fix split and run 3 times
Data: Data(x=[2708, 1433], y=[2708], train_mask=[2708], val_mask=[2708], test_mask=[2708], adj_t=[2708, 2708, nnz=10556])
num_train tensor(140)
num_noise 0
noise: tensor(0)
data feature 1433
ALTOPT(
  (lins): Sequential(
    (0): Linear(in_features=1433, out_features=64, bias=True)
    (1): BatchNorm1d(64, eps=1e-05, momentum=0.1, affine=True, track_running_stats=True)
    (2): Dropout(p=0.4, inplace=True)
    (3): ReLU(inplace=True)
    (4): Linear(in_features=64, out_features=7, bias=True)
    (5): LogSoftmax(dim=-1)
  )
  (prop): Propagation(K=10, mode=None, lambda1=None, lambda2=None, L21=True, alpha=0.6000000000000001)
  (gcn): GCN(
    (convs): ModuleList(
      (0): GCNConv(1433, 64)
      (1): GCNConv(64, 7)
    )
    (bns): ModuleList(
      (0): BatchNorm1d(64, eps=1e-05, momentum=0.1, affine=True, track_running_stats=True)
    )
    (output): LogSoftmax(dim=-1)
  )
)
propagate done
init label
Split: 01, Run: 01
None time:  1.5911954680923373
None Run 01:
Highest Train: 100.00
Highest Valid: 79.60
  Final Train: 100.00
   Final Test: 79.50
Split: 01, Run: 02
None time:  1.9458933537825942
None Run 02:
Highest Train: 100.00
Highest Valid: 78.40
  Final Train: 100.00
   Final Test: 78.20
Split: 01, Run: 03
None time:  1.619146766141057
None Run 03:
Highest Train: 100.00
Highest Valid: 79.00
  Final Train: 100.00
   Final Test: 79.60
run time now: 5.1837263107299805
total time:  5.202684220159426
None All runs:
Highest Train: 100.00 ± 0.00
Highest Valid: 79.00 ± 0.60
  Final Train: 100.00 ± 0.00
   Final Test: 79.10 ± 0.78
[I 2023-06-12 00:41:16,865] Trial 307 finished with value: 79.0 and parameters: {'Fwd': 0.0713595547760346, 'K': 10, 'alpha': 0.6000000000000001, 'dropout': 0.4, 'gnnepoch': 70, 'lambda1': 0.8, 'lambda2': 6.0537202309810985, 'loop': 1, 'loss': 'CE', 'lr': 0.0014204431715839731, 'softmaxF': True, 'useGCN': True, 'weight_decay': 6.581126702104277e-05, 'weightedloss': False}. Best is trial 112 with value: 81.66667175292969.
/home/wxy/miniconda3/lib/python3.10/site-packages/optuna/distributions.py:685: UserWarning: The distribution is specified by [0, 1.00001] and step=0.05, but the range is not divisible by `step`. It will be replaced by [0, 1.0].
  warnings.warn(
K:  10
alpha:  0.55
lr:  0.0022378824639877693
weight_decay:  4.341755241389731e-05
dropout:  0.4
fix split and run 3 times
Data: Data(x=[2708, 1433], y=[2708], train_mask=[2708], val_mask=[2708], test_mask=[2708], adj_t=[2708, 2708, nnz=10556])
num_train tensor(140)
num_noise 0
noise: tensor(0)
data feature 1433
ALTOPT(
  (lins): Sequential(
    (0): Linear(in_features=1433, out_features=64, bias=True)
    (1): BatchNorm1d(64, eps=1e-05, momentum=0.1, affine=True, track_running_stats=True)
    (2): Dropout(p=0.4, inplace=True)
    (3): ReLU(inplace=True)
    (4): Linear(in_features=64, out_features=7, bias=True)
    (5): Identity()
  )
  (prop): Propagation(K=10, mode=None, lambda1=None, lambda2=None, L21=True, alpha=0.55)
  (gcn): GCN(
    (convs): ModuleList(
      (0): GCNConv(1433, 64)
      (1): GCNConv(64, 7)
    )
    (bns): ModuleList(
      (0): BatchNorm1d(64, eps=1e-05, momentum=0.1, affine=True, track_running_stats=True)
    )
    (output): Identity()
  )
)
propagate done
init label
Split: 01, Run: 01
None time:  2.483248624019325
None Run 01:
Highest Train: 100.00
Highest Valid: 79.40
  Final Train: 100.00
   Final Test: 80.60
Split: 01, Run: 02
None time:  3.802363079972565
None Run 02:
Highest Train: 100.00
Highest Valid: 80.40
  Final Train: 100.00
   Final Test: 80.90
Split: 01, Run: 03
None time:  3.6445038858801126
None Run 03:
Highest Train: 100.00
Highest Valid: 79.60
  Final Train: 100.00
   Final Test: 80.80
run time now: 9.95615029335022
total time:  9.971407043049112
None All runs:
Highest Train: 100.00 ± 0.00
Highest Valid: 79.80 ± 0.53
  Final Train: 100.00 ± 0.00
   Final Test: 80.77 ± 0.15
[I 2023-06-12 00:41:27,282] Trial 308 finished with value: 79.79999542236328 and parameters: {'Fwd': 0.09885164479754595, 'K': 10, 'alpha': 0.55, 'dropout': 0.4, 'gnnepoch': 60, 'lambda1': 0.8500000000000001, 'lambda2': 5.07583853141134, 'loop': 1, 'loss': 'MSE', 'lr': 0.0022378824639877693, 'softmaxF': True, 'useGCN': True, 'weight_decay': 4.341755241389731e-05, 'weightedloss': True}. Best is trial 112 with value: 81.66667175292969.
/home/wxy/miniconda3/lib/python3.10/site-packages/optuna/distributions.py:685: UserWarning: The distribution is specified by [0, 1.00001] and step=0.05, but the range is not divisible by `step`. It will be replaced by [0, 1.0].
  warnings.warn(
K:  10
alpha:  0.65
lr:  0.008669392436935049
weight_decay:  7.019366545724868e-05
dropout:  0.4
fix split and run 3 times
Data: Data(x=[2708, 1433], y=[2708], train_mask=[2708], val_mask=[2708], test_mask=[2708], adj_t=[2708, 2708, nnz=10556])
num_train tensor(140)
num_noise 0
noise: tensor(0)
data feature 1433
ALTOPT(
  (lins): Sequential(
    (0): Linear(in_features=1433, out_features=64, bias=True)
    (1): BatchNorm1d(64, eps=1e-05, momentum=0.1, affine=True, track_running_stats=True)
    (2): Dropout(p=0.4, inplace=True)
    (3): ReLU(inplace=True)
    (4): Linear(in_features=64, out_features=7, bias=True)
    (5): LogSoftmax(dim=-1)
  )
  (prop): Propagation(K=10, mode=None, lambda1=None, lambda2=None, L21=True, alpha=0.65)
  (gcn): GCN(
    (convs): ModuleList(
      (0): GCNConv(1433, 64)
      (1): GCNConv(64, 7)
    )
    (bns): ModuleList(
      (0): BatchNorm1d(64, eps=1e-05, momentum=0.1, affine=True, track_running_stats=True)
    )
    (output): LogSoftmax(dim=-1)
  )
)
propagate done
init label
Split: 01, Run: 01
None time:  1.7004072780255228
None Run 01:
Highest Train: 100.00
Highest Valid: 82.00
  Final Train: 100.00
   Final Test: 82.00
Split: 01, Run: 02
None time:  1.7755546800326556
None Run 02:
Highest Train: 100.00
Highest Valid: 81.20
  Final Train: 100.00
   Final Test: 81.10
Split: 01, Run: 03
None time:  1.4393383469432592
None Run 03:
Highest Train: 100.00
Highest Valid: 81.00
  Final Train: 100.00
   Final Test: 81.10
run time now: 4.941033124923706
total time:  4.9551674500107765
None All runs:
Highest Train: 100.00 ± 0.00
Highest Valid: 81.40 ± 0.53
  Final Train: 100.00 ± 0.00
   Final Test: 81.40 ± 0.52
[I 2023-06-12 00:41:32,723] Trial 309 finished with value: 81.4000015258789 and parameters: {'Fwd': 0.03767352063939488, 'K': 10, 'alpha': 0.65, 'dropout': 0.4, 'gnnepoch': 60, 'lambda1': 0.9500000000000001, 'lambda2': 3.0012523781954172, 'loop': 1, 'loss': 'CE', 'lr': 0.008669392436935049, 'softmaxF': True, 'useGCN': True, 'weight_decay': 7.019366545724868e-05, 'weightedloss': False}. Best is trial 112 with value: 81.66667175292969.
/home/wxy/miniconda3/lib/python3.10/site-packages/optuna/distributions.py:685: UserWarning: The distribution is specified by [0, 1.00001] and step=0.05, but the range is not divisible by `step`. It will be replaced by [0, 1.0].
  warnings.warn(
K:  10
alpha:  0.7000000000000001
lr:  0.007225871011157576
weight_decay:  2.6653768312812962e-05
dropout:  0.4
fix split and run 3 times
Data: Data(x=[2708, 1433], y=[2708], train_mask=[2708], val_mask=[2708], test_mask=[2708], adj_t=[2708, 2708, nnz=10556])
num_train tensor(140)
num_noise 0
noise: tensor(0)
data feature 1433
ALTOPT(
  (lins): Sequential(
    (0): Linear(in_features=1433, out_features=64, bias=True)
    (1): BatchNorm1d(64, eps=1e-05, momentum=0.1, affine=True, track_running_stats=True)
    (2): Dropout(p=0.4, inplace=True)
    (3): ReLU(inplace=True)
    (4): Linear(in_features=64, out_features=7, bias=True)
    (5): LogSoftmax(dim=-1)
  )
  (prop): Propagation(K=10, mode=None, lambda1=None, lambda2=None, L21=True, alpha=0.7000000000000001)
  (gcn): GCN(
    (convs): ModuleList(
      (0): GCNConv(1433, 64)
      (1): GCNConv(64, 7)
    )
    (bns): ModuleList(
      (0): BatchNorm1d(64, eps=1e-05, momentum=0.1, affine=True, track_running_stats=True)
    )
    (output): LogSoftmax(dim=-1)
  )
)
propagate done
init label
Split: 01, Run: 01
None time:  1.592954077059403
None Run 01:
Highest Train: 100.00
Highest Valid: 82.00
  Final Train: 100.00
   Final Test: 82.30
Split: 01, Run: 02
None time:  1.600510778138414
None Run 02:
Highest Train: 100.00
Highest Valid: 81.80
  Final Train: 100.00
   Final Test: 81.90
Split: 01, Run: 03
None time:  1.590648751007393
None Run 03:
Highest Train: 100.00
Highest Valid: 80.80
  Final Train: 100.00
   Final Test: 80.60
run time now: 4.808405876159668
total time:  4.827975091058761
None All runs:
Highest Train: 100.00 ± 0.00
Highest Valid: 81.53 ± 0.64
  Final Train: 100.00 ± 0.00
   Final Test: 81.60 ± 0.89
[I 2023-06-12 00:41:38,127] Trial 310 finished with value: 81.53333282470703 and parameters: {'Fwd': 0.07914837610256709, 'K': 10, 'alpha': 0.7000000000000001, 'dropout': 0.4, 'gnnepoch': 60, 'lambda1': 0.9, 'lambda2': 4.461374440870858, 'loop': 1, 'loss': 'CE', 'lr': 0.007225871011157576, 'softmaxF': True, 'useGCN': True, 'weight_decay': 2.6653768312812962e-05, 'weightedloss': False}. Best is trial 112 with value: 81.66667175292969.
/home/wxy/miniconda3/lib/python3.10/site-packages/optuna/distributions.py:685: UserWarning: The distribution is specified by [0, 1.00001] and step=0.05, but the range is not divisible by `step`. It will be replaced by [0, 1.0].
  warnings.warn(
K:  10
alpha:  0.55
lr:  0.00961118531025267
weight_decay:  5.284252435510624e-05
dropout:  0.5
fix split and run 3 times
Data: Data(x=[2708, 1433], y=[2708], train_mask=[2708], val_mask=[2708], test_mask=[2708], adj_t=[2708, 2708, nnz=10556])
num_train tensor(140)
num_noise 0
noise: tensor(0)
data feature 1433
ALTOPT(
  (lins): Sequential(
    (0): Linear(in_features=1433, out_features=64, bias=True)
    (1): BatchNorm1d(64, eps=1e-05, momentum=0.1, affine=True, track_running_stats=True)
    (2): Dropout(p=0.5, inplace=True)
    (3): ReLU(inplace=True)
    (4): Linear(in_features=64, out_features=7, bias=True)
    (5): LogSoftmax(dim=-1)
  )
  (prop): Propagation(K=10, mode=None, lambda1=None, lambda2=None, L21=True, alpha=0.55)
  (gcn): GCN(
    (convs): ModuleList(
      (0): GCNConv(1433, 64)
      (1): GCNConv(64, 7)
    )
    (bns): ModuleList(
      (0): BatchNorm1d(64, eps=1e-05, momentum=0.1, affine=True, track_running_stats=True)
    )
    (output): LogSoftmax(dim=-1)
  )
)
propagate done
init label
Split: 01, Run: 01
None time:  1.3415580110158771
None Run 01:
Highest Train: 100.00
Highest Valid: 81.80
  Final Train: 99.29
   Final Test: 82.00
Split: 01, Run: 02
None time:  1.4803446589503437
None Run 02:
Highest Train: 100.00
Highest Valid: 81.00
  Final Train: 99.29
   Final Test: 82.20
Split: 01, Run: 03
None time:  1.522877051960677
None Run 03:
Highest Train: 100.00
Highest Valid: 81.00
  Final Train: 99.29
   Final Test: 81.20
run time now: 4.372174501419067
total time:  4.390111701097339
None All runs:
Highest Train: 100.00 ± 0.00
Highest Valid: 81.27 ± 0.46
  Final Train: 99.29 ± 0.00
   Final Test: 81.80 ± 0.53
[I 2023-06-12 00:41:42,985] Trial 311 finished with value: 81.26667022705078 and parameters: {'Fwd': 0.06033873435867379, 'K': 10, 'alpha': 0.55, 'dropout': 0.5, 'gnnepoch': 50, 'lambda1': 0.8500000000000001, 'lambda2': 1.0101931356425808, 'loop': 1, 'loss': 'CE', 'lr': 0.00961118531025267, 'softmaxF': True, 'useGCN': True, 'weight_decay': 5.284252435510624e-05, 'weightedloss': False}. Best is trial 112 with value: 81.66667175292969.
/home/wxy/miniconda3/lib/python3.10/site-packages/optuna/distributions.py:685: UserWarning: The distribution is specified by [0, 1.00001] and step=0.05, but the range is not divisible by `step`. It will be replaced by [0, 1.0].
  warnings.warn(
K:  9
alpha:  0.4
lr:  0.009938886841158597
weight_decay:  9.869962042846298e-05
dropout:  0.4
fix split and run 3 times
Data: Data(x=[2708, 1433], y=[2708], train_mask=[2708], val_mask=[2708], test_mask=[2708], adj_t=[2708, 2708, nnz=10556])
num_train tensor(140)
num_noise 0
noise: tensor(0)
data feature 1433
ALTOPT(
  (lins): Sequential(
    (0): Linear(in_features=1433, out_features=64, bias=True)
    (1): BatchNorm1d(64, eps=1e-05, momentum=0.1, affine=True, track_running_stats=True)
    (2): Dropout(p=0.4, inplace=True)
    (3): ReLU(inplace=True)
    (4): Linear(in_features=64, out_features=7, bias=True)
    (5): LogSoftmax(dim=-1)
  )
  (prop): Propagation(K=9, mode=None, lambda1=None, lambda2=None, L21=True, alpha=0.4)
  (gcn): GCN(
    (convs): ModuleList(
      (0): GCNConv(1433, 64)
      (1): GCNConv(64, 7)
    )
    (bns): ModuleList(
      (0): BatchNorm1d(64, eps=1e-05, momentum=0.1, affine=True, track_running_stats=True)
    )
    (output): LogSoftmax(dim=-1)
  )
)
propagate done
init label
Split: 01, Run: 01
None time:  1.4750541469547898
None Run 01:
Highest Train: 100.00
Highest Valid: 81.00
  Final Train: 100.00
   Final Test: 82.90
Split: 01, Run: 02
None time:  1.7185575210023671
None Run 02:
Highest Train: 100.00
Highest Valid: 81.60
  Final Train: 100.00
   Final Test: 81.80
Split: 01, Run: 03
None time:  1.3686784871388227
None Run 03:
Highest Train: 100.00
Highest Valid: 81.20
  Final Train: 100.00
   Final Test: 82.10
run time now: 4.590558052062988
total time:  4.60929337493144
None All runs:
Highest Train: 100.00 ± 0.00
Highest Valid: 81.27 ± 0.31
  Final Train: 100.00 ± 0.00
   Final Test: 82.27 ± 0.57
[I 2023-06-12 00:41:48,030] Trial 312 finished with value: 81.26667022705078 and parameters: {'Fwd': 0.048317564362767865, 'K': 9, 'alpha': 0.4, 'dropout': 0.4, 'gnnepoch': 60, 'lambda1': 0.8, 'lambda2': 5.460078776960139, 'loop': 1, 'loss': 'CE', 'lr': 0.009938886841158597, 'softmaxF': True, 'useGCN': True, 'weight_decay': 9.869962042846298e-05, 'weightedloss': True}. Best is trial 112 with value: 81.66667175292969.
/home/wxy/miniconda3/lib/python3.10/site-packages/optuna/distributions.py:685: UserWarning: The distribution is specified by [0, 1.00001] and step=0.05, but the range is not divisible by `step`. It will be replaced by [0, 1.0].
  warnings.warn(
K:  10
alpha:  0.6000000000000001
lr:  0.004757175760897719
weight_decay:  8.153054065005013e-05
dropout:  0.30000000000000004
fix split and run 3 times
Data: Data(x=[2708, 1433], y=[2708], train_mask=[2708], val_mask=[2708], test_mask=[2708], adj_t=[2708, 2708, nnz=10556])
num_train tensor(140)
num_noise 0
noise: tensor(0)
data feature 1433
ALTOPT(
  (lins): Sequential(
    (0): Linear(in_features=1433, out_features=64, bias=True)
    (1): BatchNorm1d(64, eps=1e-05, momentum=0.1, affine=True, track_running_stats=True)
    (2): Dropout(p=0.30000000000000004, inplace=True)
    (3): ReLU(inplace=True)
    (4): Linear(in_features=64, out_features=7, bias=True)
    (5): LogSoftmax(dim=-1)
  )
  (prop): Propagation(K=10, mode=None, lambda1=None, lambda2=None, L21=True, alpha=0.6000000000000001)
  (gcn): GCN(
    (convs): ModuleList(
      (0): GCNConv(1433, 64)
      (1): GCNConv(64, 7)
    )
    (bns): ModuleList(
      (0): BatchNorm1d(64, eps=1e-05, momentum=0.1, affine=True, track_running_stats=True)
    )
    (output): LogSoftmax(dim=-1)
  )
)
propagate done
init label
Split: 01, Run: 01
None time:  1.450034397887066
None Run 01:
Highest Train: 100.00
Highest Valid: 81.60
  Final Train: 100.00
   Final Test: 82.20
Split: 01, Run: 02
None time:  1.6706048001069576
None Run 02:
Highest Train: 100.00
Highest Valid: 80.80
  Final Train: 100.00
   Final Test: 81.20
Split: 01, Run: 03
None time:  1.647847895976156
None Run 03:
Highest Train: 100.00
Highest Valid: 80.60
  Final Train: 100.00
   Final Test: 81.60
run time now: 4.795966148376465
total time:  4.8160501040983945
None All runs:
Highest Train: 100.00 ± 0.00
Highest Valid: 81.00 ± 0.53
  Final Train: 100.00 ± 0.00
   Final Test: 81.67 ± 0.50
