[I 2023-06-12 00:02:03,254] Trial 647 finished with value: 70.66667175292969 and parameters: {'Fwd': 3.4820628348320446e-05, 'K': 7, 'alpha': 0.75, 'dropout': 0.8, 'gnnepoch': 110, 'lambda1': 0.65, 'lambda2': 4.616511277776958, 'loop': 0, 'loss': 'CE', 'lr': 0.001575488670483464, 'softmaxF': False, 'useGCN': True, 'weight_decay': 6.631734399239105e-06, 'weightedloss': True}. Best is trial 605 with value: 72.13333129882812.
/home/wxy/miniconda3/lib/python3.10/site-packages/optuna/distributions.py:685: UserWarning: The distribution is specified by [0, 1.00001] and step=0.05, but the range is not divisible by `step`. It will be replaced by [0, 1.0].
  warnings.warn(
K:  8
alpha:  0.4
lr:  0.0019563148098402116
weight_decay:  1.9433135147469206e-05
dropout:  0.8
fix split and run 3 times
Data: Data(x=[3327, 3703], y=[3327], train_mask=[3327], val_mask=[3327], test_mask=[3327], adj_t=[3327, 3327, nnz=9104])
num_train tensor(120)
num_noise 0
noise: tensor(0)
data feature 3703
ALTOPT(
  (lins): Sequential(
    (0): Linear(in_features=3703, out_features=64, bias=True)
    (1): BatchNorm1d(64, eps=1e-05, momentum=0.1, affine=True, track_running_stats=True)
    (2): Dropout(p=0.8, inplace=True)
    (3): ReLU(inplace=True)
    (4): Linear(in_features=64, out_features=6, bias=True)
    (5): LogSoftmax(dim=-1)
  )
  (prop): Propagation(K=8, mode=None, lambda1=None, lambda2=None, L21=True, alpha=0.4)
  (gcn): GCN(
    (convs): ModuleList(
      (0): GCNConv(3703, 64)
      (1): GCNConv(64, 6)
    )
    (bns): ModuleList(
      (0): BatchNorm1d(64, eps=1e-05, momentum=0.1, affine=True, track_running_stats=True)
    )
    (output): LogSoftmax(dim=-1)
  )
)
propagate done
init label
Split: 01, Run: 01
None time:  0.6445921009872109
None Run 01:
Highest Train: 100.00
Highest Valid: 46.80
  Final Train: 100.00
   Final Test: 46.40
Split: 01, Run: 02
None time:  0.7205338049679995
None Run 02:
Highest Train: 100.00
Highest Valid: 56.40
  Final Train: 100.00
   Final Test: 59.40
Split: 01, Run: 03
None time:  0.7678552058059722
None Run 03:
Highest Train: 100.00
Highest Valid: 62.40
  Final Train: 98.33
   Final Test: 63.10
run time now: 2.1716201305389404
total time:  2.2188616571947932
None All runs:
Highest Train: 100.00 ± 0.00
Highest Valid: 55.20 ± 7.87
  Final Train: 99.44 ± 0.96
   Final Test: 56.30 ± 8.77
[I 2023-06-12 00:02:06,105] Trial 648 finished with value: 55.20000076293945 and parameters: {'Fwd': 0.002097090379606805, 'K': 8, 'alpha': 0.4, 'dropout': 0.8, 'gnnepoch': 120, 'lambda1': 0.8, 'lambda2': 5.293718703126865, 'loop': 0, 'loss': 'CE', 'lr': 0.0019563148098402116, 'softmaxF': False, 'useGCN': False, 'weight_decay': 1.9433135147469206e-05, 'weightedloss': True}. Best is trial 605 with value: 72.13333129882812.
/home/wxy/miniconda3/lib/python3.10/site-packages/optuna/distributions.py:685: UserWarning: The distribution is specified by [0, 1.00001] and step=0.05, but the range is not divisible by `step`. It will be replaced by [0, 1.0].
  warnings.warn(
K:  8
alpha:  0.5
lr:  0.0002632892871679312
weight_decay:  0.000199860947916384
dropout:  0.7000000000000001
fix split and run 3 times
Data: Data(x=[3327, 3703], y=[3327], train_mask=[3327], val_mask=[3327], test_mask=[3327], adj_t=[3327, 3327, nnz=9104])
num_train tensor(120)
num_noise 0
noise: tensor(0)
data feature 3703
ALTOPT(
  (lins): Sequential(
    (0): Linear(in_features=3703, out_features=64, bias=True)
    (1): BatchNorm1d(64, eps=1e-05, momentum=0.1, affine=True, track_running_stats=True)
    (2): Dropout(p=0.7000000000000001, inplace=True)
    (3): ReLU(inplace=True)
    (4): Linear(in_features=64, out_features=6, bias=True)
    (5): LogSoftmax(dim=-1)
  )
  (prop): Propagation(K=8, mode=None, lambda1=None, lambda2=None, L21=True, alpha=0.5)
  (gcn): GCN(
    (convs): ModuleList(
      (0): GCNConv(3703, 64)
      (1): GCNConv(64, 6)
    )
    (bns): ModuleList(
      (0): BatchNorm1d(64, eps=1e-05, momentum=0.1, affine=True, track_running_stats=True)
    )
    (output): LogSoftmax(dim=-1)
  )
)
propagate done
init label
Split: 01, Run: 01
None time:  1.0752797280438244
None Run 01:
Highest Train: 100.00
Highest Valid: 69.80
  Final Train: 100.00
   Final Test: 69.10
Split: 01, Run: 02, Epoch: 100, Loss: 0.0000, Train: 100.00%, Valid: 70.20% Test: 69.90%
Split: 01, Run: 02
None time:  1.736269178101793
None Run 02:
Highest Train: 100.00
Highest Valid: 70.20
  Final Train: 100.00
   Final Test: 69.90
Split: 01, Run: 03
None time:  1.0548360201064497
None Run 03:
Highest Train: 100.00
Highest Valid: 68.60
  Final Train: 100.00
   Final Test: 70.70
run time now: 3.90983247756958
total time:  3.9682780168950558
None All runs:
Highest Train: 100.00 ± 0.00
Highest Valid: 69.53 ± 0.83
  Final Train: 100.00 ± 0.00
   Final Test: 69.90 ± 0.80
[I 2023-06-12 00:02:10,586] Trial 649 finished with value: 69.53333282470703 and parameters: {'Fwd': 0.041746218318249304, 'K': 8, 'alpha': 0.5, 'dropout': 0.7000000000000001, 'gnnepoch': 120, 'lambda1': 0.75, 'lambda2': 9.593097995933796, 'loop': 0, 'loss': 'CE', 'lr': 0.0002632892871679312, 'softmaxF': False, 'useGCN': True, 'weight_decay': 0.000199860947916384, 'weightedloss': True}. Best is trial 605 with value: 72.13333129882812.
/home/wxy/miniconda3/lib/python3.10/site-packages/optuna/distributions.py:685: UserWarning: The distribution is specified by [0, 1.00001] and step=0.05, but the range is not divisible by `step`. It will be replaced by [0, 1.0].
  warnings.warn(
K:  8
alpha:  0.8500000000000001
lr:  0.003557158835064328
weight_decay:  3.6726514652742556e-05
dropout:  0.8
fix split and run 3 times
Data: Data(x=[3327, 3703], y=[3327], train_mask=[3327], val_mask=[3327], test_mask=[3327], adj_t=[3327, 3327, nnz=9104])
num_train tensor(120)
num_noise 0
noise: tensor(0)
data feature 3703
ALTOPT(
  (lins): Sequential(
    (0): Linear(in_features=3703, out_features=64, bias=True)
    (1): BatchNorm1d(64, eps=1e-05, momentum=0.1, affine=True, track_running_stats=True)
    (2): Dropout(p=0.8, inplace=True)
    (3): ReLU(inplace=True)
    (4): Linear(in_features=64, out_features=6, bias=True)
    (5): LogSoftmax(dim=-1)
  )
  (prop): Propagation(K=8, mode=None, lambda1=None, lambda2=None, L21=True, alpha=0.8500000000000001)
  (gcn): GCN(
    (convs): ModuleList(
      (0): GCNConv(3703, 64)
      (1): GCNConv(64, 6)
    )
    (bns): ModuleList(
      (0): BatchNorm1d(64, eps=1e-05, momentum=0.1, affine=True, track_running_stats=True)
    )
    (output): LogSoftmax(dim=-1)
  )
)
propagate done
init label
Split: 01, Run: 01
None time:  1.110220008995384
None Run 01:
Highest Train: 100.00
Highest Valid: 70.60
  Final Train: 100.00
   Final Test: 70.00
Split: 01, Run: 02, Epoch: 100, Loss: 0.0000, Train: 100.00%, Valid: 70.60% Test: 70.20%
Split: 01, Run: 02
None time:  1.8516513349022716
None Run 02:
Highest Train: 100.00
Highest Valid: 70.60
  Final Train: 100.00
   Final Test: 70.10
Split: 01, Run: 03
None time:  1.127617449965328
None Run 03:
Highest Train: 100.00
Highest Valid: 71.00
  Final Train: 100.00
   Final Test: 69.90
run time now: 4.13105320930481
total time:  4.188937004189938
None All runs:
Highest Train: 100.00 ± 0.00
Highest Valid: 70.73 ± 0.23
  Final Train: 100.00 ± 0.00
   Final Test: 70.00 ± 0.10
[I 2023-06-12 00:02:15,344] Trial 650 finished with value: 70.73332977294922 and parameters: {'Fwd': 0.06775243926209319, 'K': 8, 'alpha': 0.8500000000000001, 'dropout': 0.8, 'gnnepoch': 120, 'lambda1': 0.25, 'lambda2': 8.86220826944456, 'loop': 0, 'loss': 'CE', 'lr': 0.003557158835064328, 'softmaxF': False, 'useGCN': True, 'weight_decay': 3.6726514652742556e-05, 'weightedloss': True}. Best is trial 605 with value: 72.13333129882812.
/home/wxy/miniconda3/lib/python3.10/site-packages/optuna/distributions.py:685: UserWarning: The distribution is specified by [0, 1.00001] and step=0.05, but the range is not divisible by `step`. It will be replaced by [0, 1.0].
  warnings.warn(
K:  8
alpha:  0.9500000000000001
lr:  0.0012895875021279115
weight_decay:  0.00032940445971650926
dropout:  0.8
fix split and run 3 times
Data: Data(x=[3327, 3703], y=[3327], train_mask=[3327], val_mask=[3327], test_mask=[3327], adj_t=[3327, 3327, nnz=9104])
num_train tensor(120)
num_noise 0
noise: tensor(0)
data feature 3703
ALTOPT(
  (lins): Sequential(
    (0): Linear(in_features=3703, out_features=64, bias=True)
    (1): BatchNorm1d(64, eps=1e-05, momentum=0.1, affine=True, track_running_stats=True)
    (2): Dropout(p=0.8, inplace=True)
    (3): ReLU(inplace=True)
    (4): Linear(in_features=64, out_features=6, bias=True)
    (5): LogSoftmax(dim=-1)
  )
  (prop): Propagation(K=8, mode=None, lambda1=None, lambda2=None, L21=True, alpha=0.9500000000000001)
  (gcn): GCN(
    (convs): ModuleList(
      (0): GCNConv(3703, 64)
      (1): GCNConv(64, 6)
    )
    (bns): ModuleList(
      (0): BatchNorm1d(64, eps=1e-05, momentum=0.1, affine=True, track_running_stats=True)
    )
    (output): LogSoftmax(dim=-1)
  )
)
propagate done
init label
Split: 01, Run: 01
None time:  1.0368235770147294
None Run 01:
Highest Train: 100.00
Highest Valid: 71.60
  Final Train: 100.00
   Final Test: 69.50
Split: 01, Run: 02
None time:  0.9955072009470314
None Run 02:
Highest Train: 100.00
Highest Valid: 72.40
  Final Train: 100.00
   Final Test: 69.80
Split: 01, Run: 03
None time:  1.0639446540735662
None Run 03:
Highest Train: 100.00
Highest Valid: 71.60
  Final Train: 100.00
   Final Test: 70.70
run time now: 3.136047840118408
total time:  3.1930318539962173
None All runs:
Highest Train: 100.00 ± 0.00
Highest Valid: 71.87 ± 0.46
  Final Train: 100.00 ± 0.00
   Final Test: 70.00 ± 0.62
[I 2023-06-12 00:02:19,111] Trial 651 finished with value: 71.86666870117188 and parameters: {'Fwd': 0.001755449115186333, 'K': 8, 'alpha': 0.9500000000000001, 'dropout': 0.8, 'gnnepoch': 120, 'lambda1': 0.7000000000000001, 'lambda2': 6.089006474736955, 'loop': 0, 'loss': 'CE', 'lr': 0.0012895875021279115, 'softmaxF': False, 'useGCN': True, 'weight_decay': 0.00032940445971650926, 'weightedloss': True}. Best is trial 605 with value: 72.13333129882812.
/home/wxy/miniconda3/lib/python3.10/site-packages/optuna/distributions.py:685: UserWarning: The distribution is specified by [0, 1.00001] and step=0.05, but the range is not divisible by `step`. It will be replaced by [0, 1.0].
  warnings.warn(
K:  8
alpha:  0.7000000000000001
lr:  0.0014419504281191673
weight_decay:  0.0007332562765910337
dropout:  0.8
fix split and run 3 times
Data: Data(x=[3327, 3703], y=[3327], train_mask=[3327], val_mask=[3327], test_mask=[3327], adj_t=[3327, 3327, nnz=9104])
num_train tensor(120)
num_noise 0
noise: tensor(0)
data feature 3703
ALTOPT(
  (lins): Sequential(
    (0): Linear(in_features=3703, out_features=64, bias=True)
    (1): BatchNorm1d(64, eps=1e-05, momentum=0.1, affine=True, track_running_stats=True)
    (2): Dropout(p=0.8, inplace=True)
    (3): ReLU(inplace=True)
    (4): Linear(in_features=64, out_features=6, bias=True)
    (5): LogSoftmax(dim=-1)
  )
  (prop): Propagation(K=8, mode=None, lambda1=None, lambda2=None, L21=True, alpha=0.7000000000000001)
  (gcn): GCN(
    (convs): ModuleList(
      (0): GCNConv(3703, 64)
      (1): GCNConv(64, 6)
    )
    (bns): ModuleList(
      (0): BatchNorm1d(64, eps=1e-05, momentum=0.1, affine=True, track_running_stats=True)
    )
    (output): LogSoftmax(dim=-1)
  )
)
propagate done
init label
Split: 01, Run: 01
None time:  1.002199118025601
None Run 01:
Highest Train: 100.00
Highest Valid: 70.80
  Final Train: 100.00
   Final Test: 69.10
Split: 01, Run: 02
None time:  0.9669981668703258
None Run 02:
Highest Train: 100.00
Highest Valid: 68.60
  Final Train: 100.00
   Final Test: 68.20
Split: 01, Run: 03
None time:  0.9273298848420382
None Run 03:
Highest Train: 100.00
Highest Valid: 71.40
  Final Train: 100.00
   Final Test: 70.60
run time now: 2.9363884925842285
total time:  2.988213036907837
None All runs:
Highest Train: 100.00 ± 0.00
Highest Valid: 70.27 ± 1.47
  Final Train: 100.00 ± 0.00
   Final Test: 69.30 ± 1.21
[I 2023-06-12 00:02:22,597] Trial 652 finished with value: 70.26666259765625 and parameters: {'Fwd': 1.2219904045059781e-06, 'K': 8, 'alpha': 0.7000000000000001, 'dropout': 0.8, 'gnnepoch': 110, 'lambda1': 0.75, 'lambda2': 6.40604189106754, 'loop': 0, 'loss': 'CE', 'lr': 0.0014419504281191673, 'softmaxF': False, 'useGCN': True, 'weight_decay': 0.0007332562765910337, 'weightedloss': True}. Best is trial 605 with value: 72.13333129882812.
/home/wxy/miniconda3/lib/python3.10/site-packages/optuna/distributions.py:685: UserWarning: The distribution is specified by [0, 1.00001] and step=0.05, but the range is not divisible by `step`. It will be replaced by [0, 1.0].
  warnings.warn(
K:  8
alpha:  0.6000000000000001
lr:  0.001195744062554794
weight_decay:  2.8740700397772138e-05
dropout:  0.8
fix split and run 3 times
Data: Data(x=[3327, 3703], y=[3327], train_mask=[3327], val_mask=[3327], test_mask=[3327], adj_t=[3327, 3327, nnz=9104])
num_train tensor(120)
num_noise 0
noise: tensor(0)
data feature 3703
ALTOPT(
  (lins): Sequential(
    (0): Linear(in_features=3703, out_features=64, bias=True)
    (1): BatchNorm1d(64, eps=1e-05, momentum=0.1, affine=True, track_running_stats=True)
    (2): Dropout(p=0.8, inplace=True)
    (3): ReLU(inplace=True)
    (4): Linear(in_features=64, out_features=6, bias=True)
    (5): LogSoftmax(dim=-1)
  )
  (prop): Propagation(K=8, mode=None, lambda1=None, lambda2=None, L21=True, alpha=0.6000000000000001)
  (gcn): GCN(
    (convs): ModuleList(
      (0): GCNConv(3703, 64)
      (1): GCNConv(64, 6)
    )
    (bns): ModuleList(
      (0): BatchNorm1d(64, eps=1e-05, momentum=0.1, affine=True, track_running_stats=True)
    )
    (output): LogSoftmax(dim=-1)
  )
)
propagate done
init label
Split: 01, Run: 01
None time:  0.7494982739444822
None Run 01:
Highest Train: 100.00
Highest Valid: 70.40
  Final Train: 100.00
   Final Test: 69.00
Split: 01, Run: 02
None time:  0.8223184880334884
None Run 02:
Highest Train: 100.00
Highest Valid: 71.40
  Final Train: 100.00
   Final Test: 69.80
Split: 01, Run: 03
None time:  0.7873104210011661
None Run 03:
Highest Train: 100.00
Highest Valid: 70.60
  Final Train: 100.00
   Final Test: 70.00
run time now: 2.3995041847229004
total time:  2.4501801000442356
None All runs:
Highest Train: 100.00 ± 0.00
Highest Valid: 70.80 ± 0.53
  Final Train: 100.00 ± 0.00
   Final Test: 69.60 ± 0.53
[I 2023-06-12 00:02:25,532] Trial 653 finished with value: 70.79999542236328 and parameters: {'Fwd': 0.0013101205247911724, 'K': 8, 'alpha': 0.6000000000000001, 'dropout': 0.8, 'gnnepoch': 80, 'lambda1': 0.7000000000000001, 'lambda2': 9.203984362283071, 'loop': 0, 'loss': 'CE', 'lr': 0.001195744062554794, 'softmaxF': False, 'useGCN': True, 'weight_decay': 2.8740700397772138e-05, 'weightedloss': True}. Best is trial 605 with value: 72.13333129882812.
/home/wxy/miniconda3/lib/python3.10/site-packages/optuna/distributions.py:685: UserWarning: The distribution is specified by [0, 1.00001] and step=0.05, but the range is not divisible by `step`. It will be replaced by [0, 1.0].
  warnings.warn(
K:  8
alpha:  0.9
lr:  0.003941585630962798
weight_decay:  0.0036722558749089098
dropout:  0.8
fix split and run 3 times
Data: Data(x=[3327, 3703], y=[3327], train_mask=[3327], val_mask=[3327], test_mask=[3327], adj_t=[3327, 3327, nnz=9104])
num_train tensor(120)
num_noise 0
noise: tensor(0)
data feature 3703
ALTOPT(
  (lins): Sequential(
    (0): Linear(in_features=3703, out_features=64, bias=True)
    (1): BatchNorm1d(64, eps=1e-05, momentum=0.1, affine=True, track_running_stats=True)
    (2): Dropout(p=0.8, inplace=True)
    (3): ReLU(inplace=True)
    (4): Linear(in_features=64, out_features=6, bias=True)
    (5): LogSoftmax(dim=-1)
  )
  (prop): Propagation(K=8, mode=None, lambda1=None, lambda2=None, L21=True, alpha=0.9)
  (gcn): GCN(
    (convs): ModuleList(
      (0): GCNConv(3703, 64)
      (1): GCNConv(64, 6)
    )
    (bns): ModuleList(
      (0): BatchNorm1d(64, eps=1e-05, momentum=0.1, affine=True, track_running_stats=True)
    )
    (output): LogSoftmax(dim=-1)
  )
)
propagate done
init label
Split: 01, Run: 01
None time:  1.172043995000422
None Run 01:
Highest Train: 100.00
Highest Valid: 70.40
  Final Train: 99.17
   Final Test: 70.00
Split: 01, Run: 02
None time:  1.2285257999319583
None Run 02:
Highest Train: 100.00
Highest Valid: 71.00
  Final Train: 99.17
   Final Test: 70.40
Split: 01, Run: 03
None time:  1.1088957430329174
None Run 03:
Highest Train: 100.00
Highest Valid: 71.00
  Final Train: 100.00
   Final Test: 69.30
run time now: 3.5521247386932373
total time:  3.608105869963765
None All runs:
Highest Train: 100.00 ± 0.00
Highest Valid: 70.80 ± 0.35
  Final Train: 99.44 ± 0.48
   Final Test: 69.90 ± 0.56
[I 2023-06-12 00:02:29,690] Trial 654 finished with value: 70.79999542236328 and parameters: {'Fwd': 0.005330648727257796, 'K': 8, 'alpha': 0.9, 'dropout': 0.8, 'gnnepoch': 120, 'lambda1': 0.65, 'lambda2': 5.602236653262714, 'loop': 0, 'loss': 'CE', 'lr': 0.003941585630962798, 'softmaxF': False, 'useGCN': True, 'weight_decay': 0.0036722558749089098, 'weightedloss': True}. Best is trial 605 with value: 72.13333129882812.
/home/wxy/miniconda3/lib/python3.10/site-packages/optuna/distributions.py:685: UserWarning: The distribution is specified by [0, 1.00001] and step=0.05, but the range is not divisible by `step`. It will be replaced by [0, 1.0].
  warnings.warn(
K:  8
alpha:  0.55
lr:  0.00018330496847478373
weight_decay:  4.084833505675314e-06
dropout:  0.8
fix split and run 3 times
Data: Data(x=[3327, 3703], y=[3327], train_mask=[3327], val_mask=[3327], test_mask=[3327], adj_t=[3327, 3327, nnz=9104])
num_train tensor(120)
num_noise 0
noise: tensor(0)
data feature 3703
ALTOPT(
  (lins): Sequential(
    (0): Linear(in_features=3703, out_features=64, bias=True)
    (1): BatchNorm1d(64, eps=1e-05, momentum=0.1, affine=True, track_running_stats=True)
    (2): Dropout(p=0.8, inplace=True)
    (3): ReLU(inplace=True)
    (4): Linear(in_features=64, out_features=6, bias=True)
    (5): LogSoftmax(dim=-1)
  )
  (prop): Propagation(K=8, mode=None, lambda1=None, lambda2=None, L21=True, alpha=0.55)
  (gcn): GCN(
    (convs): ModuleList(
      (0): GCNConv(3703, 64)
      (1): GCNConv(64, 6)
    )
    (bns): ModuleList(
      (0): BatchNorm1d(64, eps=1e-05, momentum=0.1, affine=True, track_running_stats=True)
    )
    (output): LogSoftmax(dim=-1)
  )
)
propagate done
init label
Split: 01, Run: 01
None time:  1.0973136669490486
None Run 01:
Highest Train: 100.00
Highest Valid: 68.60
  Final Train: 100.00
   Final Test: 68.20
Split: 01, Run: 02
None time:  1.1117557201068848
None Run 02:
Highest Train: 100.00
Highest Valid: 69.20
  Final Train: 100.00
   Final Test: 70.10
Split: 01, Run: 03
None time:  1.0840790309011936
None Run 03:
Highest Train: 100.00
Highest Valid: 68.80
  Final Train: 100.00
   Final Test: 69.90
run time now: 3.332761287689209
total time:  3.381546420045197
None All runs:
Highest Train: 100.00 ± 0.00
Highest Valid: 68.87 ± 0.31
  Final Train: 100.00 ± 0.00
   Final Test: 69.40 ± 1.04
[I 2023-06-12 00:02:33,561] Trial 655 finished with value: 68.86666107177734 and parameters: {'Fwd': 4.483331812393555e-06, 'K': 8, 'alpha': 0.55, 'dropout': 0.8, 'gnnepoch': 120, 'lambda1': 0.8, 'lambda2': 2.166102650728975, 'loop': 0, 'loss': 'CE', 'lr': 0.00018330496847478373, 'softmaxF': True, 'useGCN': True, 'weight_decay': 4.084833505675314e-06, 'weightedloss': True}. Best is trial 605 with value: 72.13333129882812.
/home/wxy/miniconda3/lib/python3.10/site-packages/optuna/distributions.py:685: UserWarning: The distribution is specified by [0, 1.00001] and step=0.05, but the range is not divisible by `step`. It will be replaced by [0, 1.0].
  warnings.warn(
K:  8
alpha:  0.8
lr:  0.0009958865304307478
weight_decay:  0.0024517205685978174
dropout:  0.9
fix split and run 3 times
Data: Data(x=[3327, 3703], y=[3327], train_mask=[3327], val_mask=[3327], test_mask=[3327], adj_t=[3327, 3327, nnz=9104])
num_train tensor(120)
num_noise 0
noise: tensor(0)
data feature 3703
ALTOPT(
  (lins): Sequential(
    (0): Linear(in_features=3703, out_features=64, bias=True)
    (1): BatchNorm1d(64, eps=1e-05, momentum=0.1, affine=True, track_running_stats=True)
    (2): Dropout(p=0.9, inplace=True)
    (3): ReLU(inplace=True)
    (4): Linear(in_features=64, out_features=6, bias=True)
    (5): LogSoftmax(dim=-1)
  )
  (prop): Propagation(K=8, mode=None, lambda1=None, lambda2=None, L21=True, alpha=0.8)
  (gcn): GCN(
    (convs): ModuleList(
      (0): GCNConv(3703, 64)
      (1): GCNConv(64, 6)
    )
    (bns): ModuleList(
      (0): BatchNorm1d(64, eps=1e-05, momentum=0.1, affine=True, track_running_stats=True)
    )
    (output): LogSoftmax(dim=-1)
  )
)
propagate done
init label
Split: 01, Run: 01
None time:  1.0544597341213375
None Run 01:
Highest Train: 100.00
Highest Valid: 70.20
  Final Train: 100.00
   Final Test: 69.30
Split: 01, Run: 02
None time:  0.9963009010534734
None Run 02:
Highest Train: 100.00
Highest Valid: 70.80
  Final Train: 100.00
   Final Test: 69.90
Split: 01, Run: 03
None time:  1.1378719818312675
None Run 03:
Highest Train: 100.00
Highest Valid: 71.60
  Final Train: 100.00
   Final Test: 70.40
run time now: 3.2331924438476562
total time:  3.280800050124526
None All runs:
Highest Train: 100.00 ± 0.00
Highest Valid: 70.87 ± 0.70
  Final Train: 100.00 ± 0.00
   Final Test: 69.87 ± 0.55
