[I 2023-06-12 00:36:10,825] Trial 250 finished with value: 81.19999694824219 and parameters: {'Fwd': 2.4661612382403172e-06, 'K': 10, 'alpha': 0.55, 'dropout': 0.5, 'gnnepoch': 60, 'lambda1': 0.9, 'lambda2': 5.93558839783017, 'loop': 1, 'loss': 'CE', 'lr': 0.008434850166612553, 'softmaxF': True, 'useGCN': True, 'weight_decay': 4.5862713174850964e-05, 'weightedloss': False}. Best is trial 112 with value: 81.66667175292969.
/home/wxy/miniconda3/lib/python3.10/site-packages/optuna/distributions.py:685: UserWarning: The distribution is specified by [0, 1.00001] and step=0.05, but the range is not divisible by `step`. It will be replaced by [0, 1.0].
  warnings.warn(
K:  10
alpha:  0.6000000000000001
lr:  0.005979842915518326
weight_decay:  0.0001149820773096006
dropout:  0.30000000000000004
fix split and run 3 times
Data: Data(x=[2708, 1433], y=[2708], train_mask=[2708], val_mask=[2708], test_mask=[2708], adj_t=[2708, 2708, nnz=10556])
num_train tensor(140)
num_noise 0
noise: tensor(0)
data feature 1433
ALTOPT(
  (lins): Sequential(
    (0): Linear(in_features=1433, out_features=64, bias=True)
    (1): BatchNorm1d(64, eps=1e-05, momentum=0.1, affine=True, track_running_stats=True)
    (2): Dropout(p=0.30000000000000004, inplace=True)
    (3): ReLU(inplace=True)
    (4): Linear(in_features=64, out_features=7, bias=True)
    (5): LogSoftmax(dim=-1)
  )
  (prop): Propagation(K=10, mode=None, lambda1=None, lambda2=None, L21=True, alpha=0.6000000000000001)
  (gcn): GCN(
    (convs): ModuleList(
      (0): GCNConv(1433, 64)
      (1): GCNConv(64, 7)
    )
    (bns): ModuleList(
      (0): BatchNorm1d(64, eps=1e-05, momentum=0.1, affine=True, track_running_stats=True)
    )
    (output): LogSoftmax(dim=-1)
  )
)
propagate done
init label
Split: 01, Run: 01
None time:  1.6234954809769988
None Run 01:
Highest Train: 100.00
Highest Valid: 81.60
  Final Train: 100.00
   Final Test: 82.10
Split: 01, Run: 02
None time:  1.6615720679983497
None Run 02:
Highest Train: 100.00
Highest Valid: 81.40
  Final Train: 100.00
   Final Test: 81.50
Split: 01, Run: 03
None time:  1.40374293201603
None Run 03:
Highest Train: 100.00
Highest Valid: 81.00
  Final Train: 100.00
   Final Test: 81.20
run time now: 4.716487407684326
total time:  4.730890995822847
None All runs:
Highest Train: 100.00 ± 0.00
Highest Valid: 81.33 ± 0.31
  Final Train: 100.00 ± 0.00
   Final Test: 81.60 ± 0.46
[I 2023-06-12 00:36:16,157] Trial 251 finished with value: 81.33333587646484 and parameters: {'Fwd': 0.06629800844167681, 'K': 10, 'alpha': 0.6000000000000001, 'dropout': 0.30000000000000004, 'gnnepoch': 60, 'lambda1': 0.9, 'lambda2': 5.63587155735633, 'loop': 1, 'loss': 'CE', 'lr': 0.005979842915518326, 'softmaxF': True, 'useGCN': True, 'weight_decay': 0.0001149820773096006, 'weightedloss': False}. Best is trial 112 with value: 81.66667175292969.
/home/wxy/miniconda3/lib/python3.10/site-packages/optuna/distributions.py:685: UserWarning: The distribution is specified by [0, 1.00001] and step=0.05, but the range is not divisible by `step`. It will be replaced by [0, 1.0].
  warnings.warn(
K:  9
alpha:  0.6000000000000001
lr:  0.007420938768682291
weight_decay:  6.712383567889804e-05
dropout:  0.4
fix split and run 3 times
Data: Data(x=[2708, 1433], y=[2708], train_mask=[2708], val_mask=[2708], test_mask=[2708], adj_t=[2708, 2708, nnz=10556])
num_train tensor(140)
num_noise 0
noise: tensor(0)
data feature 1433
ALTOPT(
  (lins): Sequential(
    (0): Linear(in_features=1433, out_features=64, bias=True)
    (1): BatchNorm1d(64, eps=1e-05, momentum=0.1, affine=True, track_running_stats=True)
    (2): Dropout(p=0.4, inplace=True)
    (3): ReLU(inplace=True)
    (4): Linear(in_features=64, out_features=7, bias=True)
    (5): LogSoftmax(dim=-1)
  )
  (prop): Propagation(K=9, mode=None, lambda1=None, lambda2=None, L21=True, alpha=0.6000000000000001)
  (gcn): GCN(
    (convs): ModuleList(
      (0): GCNConv(1433, 64)
      (1): GCNConv(64, 7)
    )
    (bns): ModuleList(
      (0): BatchNorm1d(64, eps=1e-05, momentum=0.1, affine=True, track_running_stats=True)
    )
    (output): LogSoftmax(dim=-1)
  )
)
propagate done
init label
Split: 01, Run: 01
None time:  1.6642837240360677
None Run 01:
Highest Train: 100.00
Highest Valid: 81.40
  Final Train: 100.00
   Final Test: 82.60
Split: 01, Run: 02
None time:  1.774450798984617
None Run 02:
Highest Train: 100.00
Highest Valid: 80.40
  Final Train: 100.00
   Final Test: 81.00
Split: 01, Run: 03
None time:  1.8599667558446527
None Run 03:
Highest Train: 100.00
Highest Valid: 81.20
  Final Train: 100.00
   Final Test: 80.90
run time now: 5.334021329879761
total time:  5.356046122964472
None All runs:
Highest Train: 100.00 ± 0.00
Highest Valid: 81.00 ± 0.53
  Final Train: 100.00 ± 0.00
   Final Test: 81.50 ± 0.95
[I 2023-06-12 00:36:22,004] Trial 252 finished with value: 81.0 and parameters: {'Fwd': 0.08396858384940149, 'K': 9, 'alpha': 0.6000000000000001, 'dropout': 0.4, 'gnnepoch': 70, 'lambda1': 0.75, 'lambda2': 4.187855895903794, 'loop': 1, 'loss': 'CE', 'lr': 0.007420938768682291, 'softmaxF': True, 'useGCN': True, 'weight_decay': 6.712383567889804e-05, 'weightedloss': False}. Best is trial 112 with value: 81.66667175292969.
/home/wxy/miniconda3/lib/python3.10/site-packages/optuna/distributions.py:685: UserWarning: The distribution is specified by [0, 1.00001] and step=0.05, but the range is not divisible by `step`. It will be replaced by [0, 1.0].
  warnings.warn(
K:  10
alpha:  0.65
lr:  0.00999580152646387
weight_decay:  8.576310751790532e-05
dropout:  0.4
fix split and run 3 times
Data: Data(x=[2708, 1433], y=[2708], train_mask=[2708], val_mask=[2708], test_mask=[2708], adj_t=[2708, 2708, nnz=10556])
num_train tensor(140)
num_noise 0
noise: tensor(0)
data feature 1433
ALTOPT(
  (lins): Sequential(
    (0): Linear(in_features=1433, out_features=64, bias=True)
    (1): BatchNorm1d(64, eps=1e-05, momentum=0.1, affine=True, track_running_stats=True)
    (2): Dropout(p=0.4, inplace=True)
    (3): ReLU(inplace=True)
    (4): Linear(in_features=64, out_features=7, bias=True)
    (5): LogSoftmax(dim=-1)
  )
  (prop): Propagation(K=10, mode=None, lambda1=None, lambda2=None, L21=True, alpha=0.65)
  (gcn): GCN(
    (convs): ModuleList(
      (0): GCNConv(1433, 64)
      (1): GCNConv(64, 7)
    )
    (bns): ModuleList(
      (0): BatchNorm1d(64, eps=1e-05, momentum=0.1, affine=True, track_running_stats=True)
    )
    (output): LogSoftmax(dim=-1)
  )
)
propagate done
init label
Split: 01, Run: 01
None time:  1.316620809957385
None Run 01:
Highest Train: 100.00
Highest Valid: 81.60
  Final Train: 100.00
   Final Test: 81.90
Split: 01, Run: 02
None time:  1.5857165239285678
None Run 02:
Highest Train: 100.00
Highest Valid: 80.40
  Final Train: 100.00
   Final Test: 79.90
Split: 01, Run: 03
None time:  1.6729909020941705
None Run 03:
Highest Train: 100.00
Highest Valid: 80.60
  Final Train: 100.00
   Final Test: 80.70
run time now: 4.6043126583099365
total time:  4.622765969019383
None All runs:
Highest Train: 100.00 ± 0.00
Highest Valid: 80.87 ± 0.64
  Final Train: 100.00 ± 0.00
   Final Test: 80.83 ± 1.01
[I 2023-06-12 00:36:27,125] Trial 253 finished with value: 80.86666870117188 and parameters: {'Fwd': 0.04002396010174569, 'K': 10, 'alpha': 0.65, 'dropout': 0.4, 'gnnepoch': 60, 'lambda1': 0.8500000000000001, 'lambda2': 5.12279824445927, 'loop': 1, 'loss': 'CE', 'lr': 0.00999580152646387, 'softmaxF': True, 'useGCN': True, 'weight_decay': 8.576310751790532e-05, 'weightedloss': False}. Best is trial 112 with value: 81.66667175292969.
/home/wxy/miniconda3/lib/python3.10/site-packages/optuna/distributions.py:685: UserWarning: The distribution is specified by [0, 1.00001] and step=0.05, but the range is not divisible by `step`. It will be replaced by [0, 1.0].
  warnings.warn(
K:  10
alpha:  0.65
lr:  0.006596609214882212
weight_decay:  0.00013633589191412206
dropout:  0.4
fix split and run 3 times
Data: Data(x=[2708, 1433], y=[2708], train_mask=[2708], val_mask=[2708], test_mask=[2708], adj_t=[2708, 2708, nnz=10556])
num_train tensor(140)
num_noise 0
noise: tensor(0)
data feature 1433
ALTOPT(
  (lins): Sequential(
    (0): Linear(in_features=1433, out_features=64, bias=True)
    (1): BatchNorm1d(64, eps=1e-05, momentum=0.1, affine=True, track_running_stats=True)
    (2): Dropout(p=0.4, inplace=True)
    (3): ReLU(inplace=True)
    (4): Linear(in_features=64, out_features=7, bias=True)
    (5): LogSoftmax(dim=-1)
  )
  (prop): Propagation(K=10, mode=None, lambda1=None, lambda2=None, L21=True, alpha=0.65)
  (gcn): GCN(
    (convs): ModuleList(
      (0): GCNConv(1433, 64)
      (1): GCNConv(64, 7)
    )
    (bns): ModuleList(
      (0): BatchNorm1d(64, eps=1e-05, momentum=0.1, affine=True, track_running_stats=True)
    )
    (output): LogSoftmax(dim=-1)
  )
)
propagate done
init label
Split: 01, Run: 01
None time:  1.6656593249645084
None Run 01:
Highest Train: 100.00
Highest Valid: 81.80
  Final Train: 100.00
   Final Test: 81.80
Split: 01, Run: 02
None time:  1.6831937020178884
None Run 02:
Highest Train: 100.00
Highest Valid: 81.60
  Final Train: 100.00
   Final Test: 81.40
Split: 01, Run: 03
None time:  1.3341077910736203
None Run 03:
Highest Train: 100.00
Highest Valid: 80.80
  Final Train: 100.00
   Final Test: 81.20
run time now: 4.710984945297241
total time:  4.725343342870474
None All runs:
Highest Train: 100.00 ± 0.00
Highest Valid: 81.40 ± 0.53
  Final Train: 100.00 ± 0.00
   Final Test: 81.47 ± 0.31
[I 2023-06-12 00:36:32,413] Trial 254 finished with value: 81.4000015258789 and parameters: {'Fwd': 0.05702344656463378, 'K': 10, 'alpha': 0.65, 'dropout': 0.4, 'gnnepoch': 60, 'lambda1': 0.8, 'lambda2': 5.317819495443307, 'loop': 1, 'loss': 'CE', 'lr': 0.006596609214882212, 'softmaxF': True, 'useGCN': True, 'weight_decay': 0.00013633589191412206, 'weightedloss': False}. Best is trial 112 with value: 81.66667175292969.
/home/wxy/miniconda3/lib/python3.10/site-packages/optuna/distributions.py:685: UserWarning: The distribution is specified by [0, 1.00001] and step=0.05, but the range is not divisible by `step`. It will be replaced by [0, 1.0].
  warnings.warn(
K:  10
alpha:  0.7000000000000001
lr:  0.00791842178703061
weight_decay:  3.687009964684008e-05
dropout:  0.5
fix split and run 3 times
Data: Data(x=[2708, 1433], y=[2708], train_mask=[2708], val_mask=[2708], test_mask=[2708], adj_t=[2708, 2708, nnz=10556])
num_train tensor(140)
num_noise 0
noise: tensor(0)
data feature 1433
ALTOPT(
  (lins): Sequential(
    (0): Linear(in_features=1433, out_features=64, bias=True)
    (1): BatchNorm1d(64, eps=1e-05, momentum=0.1, affine=True, track_running_stats=True)
    (2): Dropout(p=0.5, inplace=True)
    (3): ReLU(inplace=True)
    (4): Linear(in_features=64, out_features=7, bias=True)
    (5): LogSoftmax(dim=-1)
  )
  (prop): Propagation(K=10, mode=None, lambda1=None, lambda2=None, L21=True, alpha=0.7000000000000001)
  (gcn): GCN(
    (convs): ModuleList(
      (0): GCNConv(1433, 64)
      (1): GCNConv(64, 7)
    )
    (bns): ModuleList(
      (0): BatchNorm1d(64, eps=1e-05, momentum=0.1, affine=True, track_running_stats=True)
    )
    (output): LogSoftmax(dim=-1)
  )
)
propagate done
init label
Split: 01, Run: 01
None time:  1.4789917289745063
None Run 01:
Highest Train: 100.00
Highest Valid: 81.80
  Final Train: 100.00
   Final Test: 81.80
Split: 01, Run: 02
None time:  1.6015235928352922
None Run 02:
Highest Train: 100.00
Highest Valid: 81.20
  Final Train: 100.00
   Final Test: 81.90
Split: 01, Run: 03
None time:  1.5125537640415132
None Run 03:
Highest Train: 100.00
Highest Valid: 80.80
  Final Train: 100.00
   Final Test: 81.50
run time now: 4.634716272354126
total time:  4.6641619491856545
None All runs:
Highest Train: 100.00 ± 0.00
Highest Valid: 81.27 ± 0.50
  Final Train: 100.00 ± 0.00
   Final Test: 81.73 ± 0.21
[I 2023-06-12 00:36:37,620] Trial 255 finished with value: 81.26667022705078 and parameters: {'Fwd': 0.09934759715657805, 'K': 10, 'alpha': 0.7000000000000001, 'dropout': 0.5, 'gnnepoch': 50, 'lambda1': 0.8500000000000001, 'lambda2': 5.709250250959826, 'loop': 1, 'loss': 'CE', 'lr': 0.00791842178703061, 'softmaxF': True, 'useGCN': True, 'weight_decay': 3.687009964684008e-05, 'weightedloss': False}. Best is trial 112 with value: 81.66667175292969.
/home/wxy/miniconda3/lib/python3.10/site-packages/optuna/distributions.py:685: UserWarning: The distribution is specified by [0, 1.00001] and step=0.05, but the range is not divisible by `step`. It will be replaced by [0, 1.0].
  warnings.warn(
K:  10
alpha:  0.6000000000000001
lr:  0.002081908082600027
weight_decay:  5.306249498339687e-05
dropout:  0.4
fix split and run 3 times
Data: Data(x=[2708, 1433], y=[2708], train_mask=[2708], val_mask=[2708], test_mask=[2708], adj_t=[2708, 2708, nnz=10556])
num_train tensor(140)
num_noise 0
noise: tensor(0)
data feature 1433
ALTOPT(
  (lins): Sequential(
    (0): Linear(in_features=1433, out_features=64, bias=True)
    (1): BatchNorm1d(64, eps=1e-05, momentum=0.1, affine=True, track_running_stats=True)
    (2): Dropout(p=0.4, inplace=True)
    (3): ReLU(inplace=True)
    (4): Linear(in_features=64, out_features=7, bias=True)
    (5): LogSoftmax(dim=-1)
  )
  (prop): Propagation(K=10, mode=None, lambda1=None, lambda2=None, L21=True, alpha=0.6000000000000001)
  (gcn): GCN(
    (convs): ModuleList(
      (0): GCNConv(1433, 64)
      (1): GCNConv(64, 7)
    )
    (bns): ModuleList(
      (0): BatchNorm1d(64, eps=1e-05, momentum=0.1, affine=True, track_running_stats=True)
    )
    (output): LogSoftmax(dim=-1)
  )
)
propagate done
init label
Split: 01, Run: 01
None time:  0.8505109690595418
None Run 01:
Highest Train: 100.00
Highest Valid: 73.80
  Final Train: 100.00
   Final Test: 77.30
Split: 01, Run: 02
None time:  0.7801517809275538
None Run 02:
Highest Train: 100.00
Highest Valid: 68.80
  Final Train: 100.00
   Final Test: 69.90
Split: 01, Run: 03
None time:  1.0061831888742745
None Run 03:
Highest Train: 100.00
Highest Valid: 69.80
  Final Train: 100.00
   Final Test: 71.00
run time now: 2.685061454772949
total time:  2.7000365150161088
None All runs:
Highest Train: 100.00 ± 0.00
Highest Valid: 70.80 ± 2.65
  Final Train: 100.00 ± 0.00
   Final Test: 72.73 ± 3.99
[I 2023-06-12 00:36:40,934] Trial 256 finished with value: 70.80000305175781 and parameters: {'Fwd': 0.07678718725570333, 'K': 10, 'alpha': 0.6000000000000001, 'dropout': 0.4, 'gnnepoch': 60, 'lambda1': 0.9500000000000001, 'lambda2': 5.454507547976542, 'loop': 1, 'loss': 'CE', 'lr': 0.002081908082600027, 'softmaxF': True, 'useGCN': False, 'weight_decay': 5.306249498339687e-05, 'weightedloss': False}. Best is trial 112 with value: 81.66667175292969.
/home/wxy/miniconda3/lib/python3.10/site-packages/optuna/distributions.py:685: UserWarning: The distribution is specified by [0, 1.00001] and step=0.05, but the range is not divisible by `step`. It will be replaced by [0, 1.0].
  warnings.warn(
K:  10
alpha:  0.55
lr:  0.008902442550446883
weight_decay:  0.0001757256604982646
dropout:  0.4
fix split and run 3 times
Data: Data(x=[2708, 1433], y=[2708], train_mask=[2708], val_mask=[2708], test_mask=[2708], adj_t=[2708, 2708, nnz=10556])
num_train tensor(140)
num_noise 0
noise: tensor(0)
data feature 1433
ALTOPT(
  (lins): Sequential(
    (0): Linear(in_features=1433, out_features=64, bias=True)
    (1): BatchNorm1d(64, eps=1e-05, momentum=0.1, affine=True, track_running_stats=True)
    (2): Dropout(p=0.4, inplace=True)
    (3): ReLU(inplace=True)
    (4): Linear(in_features=64, out_features=7, bias=True)
    (5): LogSoftmax(dim=-1)
  )
  (prop): Propagation(K=10, mode=None, lambda1=None, lambda2=None, L21=True, alpha=0.55)
  (gcn): GCN(
    (convs): ModuleList(
      (0): GCNConv(1433, 64)
      (1): GCNConv(64, 7)
    )
    (bns): ModuleList(
      (0): BatchNorm1d(64, eps=1e-05, momentum=0.1, affine=True, track_running_stats=True)
    )
    (output): LogSoftmax(dim=-1)
  )
)
propagate done
init label
Split: 01, Run: 01
None time:  1.8058806310873479
None Run 01:
Highest Train: 100.00
Highest Valid: 81.20
  Final Train: 100.00
   Final Test: 82.40
Split: 01, Run: 02
None time:  1.7090756751131266
None Run 02:
Highest Train: 100.00
Highest Valid: 80.40
  Final Train: 100.00
   Final Test: 81.20
Split: 01, Run: 03
None time:  1.8801388358697295
None Run 03:
Highest Train: 100.00
Highest Valid: 81.00
  Final Train: 100.00
   Final Test: 81.00
run time now: 5.424816131591797
total time:  5.443380721146241
None All runs:
Highest Train: 100.00 ± 0.00
Highest Valid: 80.87 ± 0.42
  Final Train: 100.00 ± 0.00
   Final Test: 81.53 ± 0.76
[I 2023-06-12 00:36:46,989] Trial 257 finished with value: 80.86666870117188 and parameters: {'Fwd': 0.022525872808140956, 'K': 10, 'alpha': 0.55, 'dropout': 0.4, 'gnnepoch': 70, 'lambda1': 0.8500000000000001, 'lambda2': 4.964980092278569, 'loop': 1, 'loss': 'CE', 'lr': 0.008902442550446883, 'softmaxF': True, 'useGCN': True, 'weight_decay': 0.0001757256604982646, 'weightedloss': False}. Best is trial 112 with value: 81.66667175292969.
/home/wxy/miniconda3/lib/python3.10/site-packages/optuna/distributions.py:685: UserWarning: The distribution is specified by [0, 1.00001] and step=0.05, but the range is not divisible by `step`. It will be replaced by [0, 1.0].
  warnings.warn(
K:  10
alpha:  0.65
lr:  0.0057376956445698325
weight_decay:  0.00010115283759848803
dropout:  0.4
fix split and run 3 times
Data: Data(x=[2708, 1433], y=[2708], train_mask=[2708], val_mask=[2708], test_mask=[2708], adj_t=[2708, 2708, nnz=10556])
num_train tensor(140)
num_noise 0
noise: tensor(0)
data feature 1433
ALTOPT(
  (lins): Sequential(
    (0): Linear(in_features=1433, out_features=64, bias=True)
    (1): BatchNorm1d(64, eps=1e-05, momentum=0.1, affine=True, track_running_stats=True)
    (2): Dropout(p=0.4, inplace=True)
    (3): ReLU(inplace=True)
    (4): Linear(in_features=64, out_features=7, bias=True)
    (5): LogSoftmax(dim=-1)
  )
  (prop): Propagation(K=10, mode=None, lambda1=None, lambda2=None, L21=True, alpha=0.65)
  (gcn): GCN(
    (convs): ModuleList(
      (0): GCNConv(1433, 64)
      (1): GCNConv(64, 7)
    )
    (bns): ModuleList(
      (0): BatchNorm1d(64, eps=1e-05, momentum=0.1, affine=True, track_running_stats=True)
    )
    (output): LogSoftmax(dim=-1)
  )
)
propagate done
init label
Split: 01, Run: 01
None time:  1.3911816971376538
None Run 01:
Highest Train: 100.00
Highest Valid: 81.40
  Final Train: 100.00
   Final Test: 81.70
Split: 01, Run: 02
None time:  1.37704040389508
None Run 02:
Highest Train: 100.00
Highest Valid: 80.80
  Final Train: 100.00
   Final Test: 81.30
Split: 01, Run: 03
None time:  1.6625544640701264
None Run 03:
Highest Train: 100.00
Highest Valid: 80.60
  Final Train: 100.00
   Final Test: 81.30
run time now: 4.459991216659546
total time:  4.478977099992335
None All runs:
Highest Train: 100.00 ± 0.00
Highest Valid: 80.93 ± 0.42
  Final Train: 100.00 ± 0.00
   Final Test: 81.43 ± 0.23
[I 2023-06-12 00:36:51,998] Trial 258 finished with value: 80.93334197998047 and parameters: {'Fwd': 0.058326642514539145, 'K': 10, 'alpha': 0.65, 'dropout': 0.4, 'gnnepoch': 60, 'lambda1': 0.9, 'lambda2': 6.121135998225091, 'loop': 1, 'loss': 'CE', 'lr': 0.0057376956445698325, 'softmaxF': True, 'useGCN': True, 'weight_decay': 0.00010115283759848803, 'weightedloss': False}. Best is trial 112 with value: 81.66667175292969.
/home/wxy/miniconda3/lib/python3.10/site-packages/optuna/distributions.py:685: UserWarning: The distribution is specified by [0, 1.00001] and step=0.05, but the range is not divisible by `step`. It will be replaced by [0, 1.0].
  warnings.warn(
K:  10
alpha:  0.45
lr:  0.0070991241093297346
weight_decay:  7.027212003390809e-05
dropout:  0.4
fix split and run 3 times
Data: Data(x=[2708, 1433], y=[2708], train_mask=[2708], val_mask=[2708], test_mask=[2708], adj_t=[2708, 2708, nnz=10556])
num_train tensor(140)
num_noise 0
noise: tensor(0)
data feature 1433
ALTOPT(
  (lins): Sequential(
    (0): Linear(in_features=1433, out_features=64, bias=True)
    (1): BatchNorm1d(64, eps=1e-05, momentum=0.1, affine=True, track_running_stats=True)
    (2): Dropout(p=0.4, inplace=True)
    (3): ReLU(inplace=True)
    (4): Linear(in_features=64, out_features=7, bias=True)
    (5): LogSoftmax(dim=-1)
  )
  (prop): Propagation(K=10, mode=None, lambda1=None, lambda2=None, L21=True, alpha=0.45)
  (gcn): GCN(
    (convs): ModuleList(
      (0): GCNConv(1433, 64)
      (1): GCNConv(64, 7)
    )
    (bns): ModuleList(
      (0): BatchNorm1d(64, eps=1e-05, momentum=0.1, affine=True, track_running_stats=True)
    )
    (output): LogSoftmax(dim=-1)
  )
)
propagate done
init label
Split: 01, Run: 01
None time:  1.722814731998369
None Run 01:
Highest Train: 100.00
Highest Valid: 82.20
  Final Train: 100.00
   Final Test: 82.10
Split: 01, Run: 02
None time:  1.7075477309990674
None Run 02:
Highest Train: 100.00
Highest Valid: 81.80
  Final Train: 100.00
   Final Test: 81.90
Split: 01, Run: 03
None time:  1.534434145083651
None Run 03:
Highest Train: 100.00
Highest Valid: 81.00
  Final Train: 100.00
   Final Test: 80.50
run time now: 4.993526220321655
total time:  5.008617888903245
None All runs:
Highest Train: 100.00 ± 0.00
Highest Valid: 81.67 ± 0.61
  Final Train: 100.00 ± 0.00
   Final Test: 81.50 ± 0.87
