[I 2023-06-12 00:09:15,896] Trial 755 finished with value: 70.5999984741211 and parameters: {'Fwd': 2.6703294146087828e-06, 'K': 8, 'alpha': 0.4, 'dropout': 0.8, 'gnnepoch': 120, 'lambda1': 0.65, 'lambda2': 6.469389605498561, 'loop': 0, 'loss': 'CE', 'lr': 0.0046057252328973244, 'softmaxF': False, 'useGCN': True, 'weight_decay': 4.764606247063216e-06, 'weightedloss': True}. Best is trial 605 with value: 72.13333129882812.
/home/wxy/miniconda3/lib/python3.10/site-packages/optuna/distributions.py:685: UserWarning: The distribution is specified by [0, 1.00001] and step=0.05, but the range is not divisible by `step`. It will be replaced by [0, 1.0].
  warnings.warn(
K:  8
alpha:  0.45
lr:  0.0015364056365869444
weight_decay:  1.4667730127010153e-05
dropout:  0.8
fix split and run 3 times
Data: Data(x=[3327, 3703], y=[3327], train_mask=[3327], val_mask=[3327], test_mask=[3327], adj_t=[3327, 3327, nnz=9104])
num_train tensor(120)
num_noise 0
noise: tensor(0)
data feature 3703
ALTOPT(
  (lins): Sequential(
    (0): Linear(in_features=3703, out_features=64, bias=True)
    (1): BatchNorm1d(64, eps=1e-05, momentum=0.1, affine=True, track_running_stats=True)
    (2): Dropout(p=0.8, inplace=True)
    (3): ReLU(inplace=True)
    (4): Linear(in_features=64, out_features=6, bias=True)
    (5): LogSoftmax(dim=-1)
  )
  (prop): Propagation(K=8, mode=None, lambda1=None, lambda2=None, L21=True, alpha=0.45)
  (gcn): GCN(
    (convs): ModuleList(
      (0): GCNConv(3703, 64)
      (1): GCNConv(64, 6)
    )
    (bns): ModuleList(
      (0): BatchNorm1d(64, eps=1e-05, momentum=0.1, affine=True, track_running_stats=True)
    )
    (output): LogSoftmax(dim=-1)
  )
)
propagate done
init label
Split: 01, Run: 01
None time:  1.0794331599026918
None Run 01:
Highest Train: 100.00
Highest Valid: 71.40
  Final Train: 100.00
   Final Test: 69.50
Split: 01, Run: 02
None time:  1.0955459719989449
None Run 02:
Highest Train: 100.00
Highest Valid: 72.20
  Final Train: 100.00
   Final Test: 70.10
Split: 01, Run: 03
None time:  1.1261185379698873
None Run 03:
Highest Train: 100.00
Highest Valid: 71.40
  Final Train: 100.00
   Final Test: 70.60
run time now: 3.3417677879333496
total time:  3.3997112940996885
None All runs:
Highest Train: 100.00 ± 0.00
Highest Valid: 71.67 ± 0.46
  Final Train: 100.00 ± 0.00
   Final Test: 70.07 ± 0.55
[I 2023-06-12 00:09:19,846] Trial 756 finished with value: 71.66666412353516 and parameters: {'Fwd': 0.014928144714810118, 'K': 8, 'alpha': 0.45, 'dropout': 0.8, 'gnnepoch': 120, 'lambda1': 0.8, 'lambda2': 4.9670479351718475, 'loop': 0, 'loss': 'CE', 'lr': 0.0015364056365869444, 'softmaxF': False, 'useGCN': True, 'weight_decay': 1.4667730127010153e-05, 'weightedloss': True}. Best is trial 605 with value: 72.13333129882812.
/home/wxy/miniconda3/lib/python3.10/site-packages/optuna/distributions.py:685: UserWarning: The distribution is specified by [0, 1.00001] and step=0.05, but the range is not divisible by `step`. It will be replaced by [0, 1.0].
  warnings.warn(
K:  7
alpha:  0.55
lr:  0.0012407713936928842
weight_decay:  1.991078460476571e-06
dropout:  0.8
fix split and run 3 times
Data: Data(x=[3327, 3703], y=[3327], train_mask=[3327], val_mask=[3327], test_mask=[3327], adj_t=[3327, 3327, nnz=9104])
num_train tensor(120)
num_noise 0
noise: tensor(0)
data feature 3703
ALTOPT(
  (lins): Sequential(
    (0): Linear(in_features=3703, out_features=64, bias=True)
    (1): BatchNorm1d(64, eps=1e-05, momentum=0.1, affine=True, track_running_stats=True)
    (2): Dropout(p=0.8, inplace=True)
    (3): ReLU(inplace=True)
    (4): Linear(in_features=64, out_features=6, bias=True)
    (5): LogSoftmax(dim=-1)
  )
  (prop): Propagation(K=7, mode=None, lambda1=None, lambda2=None, L21=True, alpha=0.55)
  (gcn): GCN(
    (convs): ModuleList(
      (0): GCNConv(3703, 64)
      (1): GCNConv(64, 6)
    )
    (bns): ModuleList(
      (0): BatchNorm1d(64, eps=1e-05, momentum=0.1, affine=True, track_running_stats=True)
    )
    (output): LogSoftmax(dim=-1)
  )
)
propagate done
init label
Split: 01, Run: 01, Epoch: 100, Loss: 0.0000, Train: 100.00%, Valid: 51.20% Test: 49.60%
Split: 01, Run: 01
None time:  0.8448515040799975
None Run 01:
Highest Train: 100.00
Highest Valid: 51.20
  Final Train: 100.00
   Final Test: 49.20
Split: 01, Run: 02, Epoch: 100, Loss: 0.0000, Train: 100.00%, Valid: 48.80% Test: 47.30%
Split: 01, Run: 02
None time:  0.8174194940365851
None Run 02:
Highest Train: 100.00
Highest Valid: 48.80
  Final Train: 100.00
   Final Test: 47.10
Split: 01, Run: 03, Epoch: 100, Loss: 0.0000, Train: 100.00%, Valid: 50.60% Test: 51.30%
Split: 01, Run: 03
None time:  0.8527756889816374
None Run 03:
Highest Train: 100.00
Highest Valid: 50.60
  Final Train: 100.00
   Final Test: 51.10
run time now: 2.561328649520874
total time:  2.611879443982616
None All runs:
Highest Train: 100.00 ± 0.00
Highest Valid: 50.20 ± 1.25
  Final Train: 100.00 ± 0.00
   Final Test: 49.13 ± 2.00
[I 2023-06-12 00:09:23,036] Trial 757 finished with value: 50.20000076293945 and parameters: {'Fwd': 0.07902712170063807, 'K': 7, 'alpha': 0.55, 'dropout': 0.8, 'gnnepoch': 0, 'lambda1': 0.65, 'lambda2': 8.831945676892094, 'loop': 0, 'loss': 'CE', 'lr': 0.0012407713936928842, 'softmaxF': False, 'useGCN': True, 'weight_decay': 1.991078460476571e-06, 'weightedloss': True}. Best is trial 605 with value: 72.13333129882812.
/home/wxy/miniconda3/lib/python3.10/site-packages/optuna/distributions.py:685: UserWarning: The distribution is specified by [0, 1.00001] and step=0.05, but the range is not divisible by `step`. It will be replaced by [0, 1.0].
  warnings.warn(
K:  9
alpha:  0.8500000000000001
lr:  0.0013524557473506066
weight_decay:  9.54420693416356e-06
dropout:  0.8
fix split and run 3 times
Data: Data(x=[3327, 3703], y=[3327], train_mask=[3327], val_mask=[3327], test_mask=[3327], adj_t=[3327, 3327, nnz=9104])
num_train tensor(120)
num_noise 0
noise: tensor(0)
data feature 3703
ALTOPT(
  (lins): Sequential(
    (0): Linear(in_features=3703, out_features=64, bias=True)
    (1): BatchNorm1d(64, eps=1e-05, momentum=0.1, affine=True, track_running_stats=True)
    (2): Dropout(p=0.8, inplace=True)
    (3): ReLU(inplace=True)
    (4): Linear(in_features=64, out_features=6, bias=True)
    (5): LogSoftmax(dim=-1)
  )
  (prop): Propagation(K=9, mode=None, lambda1=None, lambda2=None, L21=True, alpha=0.8500000000000001)
  (gcn): GCN(
    (convs): ModuleList(
      (0): GCNConv(3703, 64)
      (1): GCNConv(64, 6)
    )
    (bns): ModuleList(
      (0): BatchNorm1d(64, eps=1e-05, momentum=0.1, affine=True, track_running_stats=True)
    )
    (output): LogSoftmax(dim=-1)
  )
)
propagate done
init label
Split: 01, Run: 01
None time:  1.1153288308996707
None Run 01:
Highest Train: 100.00
Highest Valid: 71.60
  Final Train: 100.00
   Final Test: 69.20
Split: 01, Run: 02
None time:  1.0195242518093437
None Run 02:
Highest Train: 100.00
Highest Valid: 72.40
  Final Train: 100.00
   Final Test: 69.90
Split: 01, Run: 03
None time:  1.0926130239386111
None Run 03:
Highest Train: 100.00
Highest Valid: 71.80
  Final Train: 100.00
   Final Test: 70.40
run time now: 3.300788640975952
total time:  3.3576183142140508
None All runs:
Highest Train: 100.00 ± 0.00
Highest Valid: 71.93 ± 0.42
  Final Train: 100.00 ± 0.00
   Final Test: 69.83 ± 0.60
[I 2023-06-12 00:09:26,885] Trial 758 finished with value: 71.93333435058594 and parameters: {'Fwd': 0.04410843925892296, 'K': 9, 'alpha': 0.8500000000000001, 'dropout': 0.8, 'gnnepoch': 120, 'lambda1': 0.7000000000000001, 'lambda2': 4.664522546004467, 'loop': 0, 'loss': 'CE', 'lr': 0.0013524557473506066, 'softmaxF': False, 'useGCN': True, 'weight_decay': 9.54420693416356e-06, 'weightedloss': True}. Best is trial 605 with value: 72.13333129882812.
/home/wxy/miniconda3/lib/python3.10/site-packages/optuna/distributions.py:685: UserWarning: The distribution is specified by [0, 1.00001] and step=0.05, but the range is not divisible by `step`. It will be replaced by [0, 1.0].
  warnings.warn(
K:  8
alpha:  0.7000000000000001
lr:  0.0018514140419363466
weight_decay:  7.377128457017583e-06
dropout:  0.8
fix split and run 3 times
Data: Data(x=[3327, 3703], y=[3327], train_mask=[3327], val_mask=[3327], test_mask=[3327], adj_t=[3327, 3327, nnz=9104])
num_train tensor(120)
num_noise 0
noise: tensor(0)
data feature 3703
ALTOPT(
  (lins): Sequential(
    (0): Linear(in_features=3703, out_features=64, bias=True)
    (1): BatchNorm1d(64, eps=1e-05, momentum=0.1, affine=True, track_running_stats=True)
    (2): Dropout(p=0.8, inplace=True)
    (3): ReLU(inplace=True)
    (4): Linear(in_features=64, out_features=6, bias=True)
    (5): LogSoftmax(dim=-1)
  )
  (prop): Propagation(K=8, mode=None, lambda1=None, lambda2=None, L21=True, alpha=0.7000000000000001)
  (gcn): GCN(
    (convs): ModuleList(
      (0): GCNConv(3703, 64)
      (1): GCNConv(64, 6)
    )
    (bns): ModuleList(
      (0): BatchNorm1d(64, eps=1e-05, momentum=0.1, affine=True, track_running_stats=True)
    )
    (output): LogSoftmax(dim=-1)
  )
)
propagate done
init label
Split: 01, Run: 01
None time:  0.8942282299976796
None Run 01:
Highest Train: 100.00
Highest Valid: 71.20
  Final Train: 100.00
   Final Test: 69.80
Split: 01, Run: 02
None time:  1.1011597469914705
None Run 02:
Highest Train: 100.00
Highest Valid: 69.60
  Final Train: 100.00
   Final Test: 68.60
Split: 01, Run: 03
None time:  0.965375353815034
None Run 03:
Highest Train: 100.00
Highest Valid: 71.80
  Final Train: 100.00
   Final Test: 70.40
run time now: 3.000835418701172
total time:  3.0453232950530946
None All runs:
Highest Train: 100.00 ± 0.00
Highest Valid: 70.87 ± 1.14
  Final Train: 100.00 ± 0.00
   Final Test: 69.60 ± 0.92
[I 2023-06-12 00:09:30,418] Trial 759 finished with value: 70.86666870117188 and parameters: {'Fwd': 0.004569769205870795, 'K': 8, 'alpha': 0.7000000000000001, 'dropout': 0.8, 'gnnepoch': 110, 'lambda1': 0.75, 'lambda2': 6.096506939227283, 'loop': 0, 'loss': 'CE', 'lr': 0.0018514140419363466, 'softmaxF': True, 'useGCN': True, 'weight_decay': 7.377128457017583e-06, 'weightedloss': True}. Best is trial 605 with value: 72.13333129882812.
/home/wxy/miniconda3/lib/python3.10/site-packages/optuna/distributions.py:685: UserWarning: The distribution is specified by [0, 1.00001] and step=0.05, but the range is not divisible by `step`. It will be replaced by [0, 1.0].
  warnings.warn(
K:  8
alpha:  0.8
lr:  0.00146150587280441
weight_decay:  0.02195547728044944
dropout:  0.8
fix split and run 3 times
Data: Data(x=[3327, 3703], y=[3327], train_mask=[3327], val_mask=[3327], test_mask=[3327], adj_t=[3327, 3327, nnz=9104])
num_train tensor(120)
num_noise 0
noise: tensor(0)
data feature 3703
ALTOPT(
  (lins): Sequential(
    (0): Linear(in_features=3703, out_features=64, bias=True)
    (1): BatchNorm1d(64, eps=1e-05, momentum=0.1, affine=True, track_running_stats=True)
    (2): Dropout(p=0.8, inplace=True)
    (3): ReLU(inplace=True)
    (4): Linear(in_features=64, out_features=6, bias=True)
    (5): LogSoftmax(dim=-1)
  )
  (prop): Propagation(K=8, mode=None, lambda1=None, lambda2=None, L21=True, alpha=0.8)
  (gcn): GCN(
    (convs): ModuleList(
      (0): GCNConv(3703, 64)
      (1): GCNConv(64, 6)
    )
    (bns): ModuleList(
      (0): BatchNorm1d(64, eps=1e-05, momentum=0.1, affine=True, track_running_stats=True)
    )
    (output): LogSoftmax(dim=-1)
  )
)
propagate done
init label
Split: 01, Run: 01, Epoch: 100, Loss: 0.0000, Train: 100.00%, Valid: 64.60% Test: 62.30%
Split: 01, Run: 01
None time:  0.9485896178521216
None Run 01:
Highest Train: 100.00
Highest Valid: 64.60
  Final Train: 100.00
   Final Test: 62.30
Split: 01, Run: 02
None time:  0.24545264290645719
None Run 02:
Highest Train: 100.00
Highest Valid: 65.40
  Final Train: 100.00
   Final Test: 65.20
Split: 01, Run: 03, Epoch: 100, Loss: 0.0000, Train: 100.00%, Valid: 64.40% Test: 65.90%
Split: 01, Run: 03
None time:  1.020030922954902
None Run 03:
Highest Train: 100.00
Highest Valid: 64.40
  Final Train: 100.00
   Final Test: 65.60
run time now: 2.259369373321533
total time:  2.308740740874782
None All runs:
Highest Train: 100.00 ± 0.00
Highest Valid: 64.80 ± 0.53
  Final Train: 100.00 ± 0.00
   Final Test: 64.37 ± 1.80
[I 2023-06-12 00:09:33,264] Trial 760 finished with value: 64.79999542236328 and parameters: {'Fwd': 0.06271543142365628, 'K': 8, 'alpha': 0.8, 'dropout': 0.8, 'gnnepoch': 10, 'lambda1': 0.7000000000000001, 'lambda2': 4.258858218505155, 'loop': 0, 'loss': 'CE', 'lr': 0.00146150587280441, 'softmaxF': False, 'useGCN': True, 'weight_decay': 0.02195547728044944, 'weightedloss': True}. Best is trial 605 with value: 72.13333129882812.
/home/wxy/miniconda3/lib/python3.10/site-packages/optuna/distributions.py:685: UserWarning: The distribution is specified by [0, 1.00001] and step=0.05, but the range is not divisible by `step`. It will be replaced by [0, 1.0].
  warnings.warn(
K:  8
alpha:  0.65
lr:  0.0001508103092030731
weight_decay:  1.764214972420471e-05
dropout:  0.8
fix split and run 3 times
Data: Data(x=[3327, 3703], y=[3327], train_mask=[3327], val_mask=[3327], test_mask=[3327], adj_t=[3327, 3327, nnz=9104])
num_train tensor(120)
num_noise 0
noise: tensor(0)
data feature 3703
ALTOPT(
  (lins): Sequential(
    (0): Linear(in_features=3703, out_features=64, bias=True)
    (1): BatchNorm1d(64, eps=1e-05, momentum=0.1, affine=True, track_running_stats=True)
    (2): Dropout(p=0.8, inplace=True)
    (3): ReLU(inplace=True)
    (4): Linear(in_features=64, out_features=6, bias=True)
    (5): LogSoftmax(dim=-1)
  )
  (prop): Propagation(K=8, mode=None, lambda1=None, lambda2=None, L21=True, alpha=0.65)
  (gcn): GCN(
    (convs): ModuleList(
      (0): GCNConv(3703, 64)
      (1): GCNConv(64, 6)
    )
    (bns): ModuleList(
      (0): BatchNorm1d(64, eps=1e-05, momentum=0.1, affine=True, track_running_stats=True)
    )
    (output): LogSoftmax(dim=-1)
  )
)
propagate done
init label
Split: 01, Run: 01, Epoch: 100, Loss: 0.0000, Train: 100.00%, Valid: 67.20% Test: 68.00%
Split: 01, Run: 01
None time:  1.8346871170215309
None Run 01:
Highest Train: 100.00
Highest Valid: 67.20
  Final Train: 100.00
   Final Test: 68.20
Split: 01, Run: 02, Epoch: 100, Loss: 0.0000, Train: 100.00%, Valid: 67.80% Test: 69.30%
Split: 01, Run: 02
None time:  1.8875352679751813
None Run 02:
Highest Train: 100.00
Highest Valid: 67.80
  Final Train: 100.00
   Final Test: 69.00
Split: 01, Run: 03
None time:  1.1651071840897202
None Run 03:
Highest Train: 100.00
Highest Valid: 67.20
  Final Train: 100.00
   Final Test: 69.80
run time now: 4.930202007293701
total time:  4.9932992837857455
None All runs:
Highest Train: 100.00 ± 0.00
Highest Valid: 67.40 ± 0.35
  Final Train: 100.00 ± 0.00
   Final Test: 69.00 ± 0.80
[I 2023-06-12 00:09:38,809] Trial 761 finished with value: 67.4000015258789 and parameters: {'Fwd': 0.032359036961257026, 'K': 8, 'alpha': 0.65, 'dropout': 0.8, 'gnnepoch': 120, 'lambda1': 0.5, 'lambda2': 9.809708159577811, 'loop': 0, 'loss': 'CE', 'lr': 0.0001508103092030731, 'softmaxF': False, 'useGCN': True, 'weight_decay': 1.764214972420471e-05, 'weightedloss': True}. Best is trial 605 with value: 72.13333129882812.
/home/wxy/miniconda3/lib/python3.10/site-packages/optuna/distributions.py:685: UserWarning: The distribution is specified by [0, 1.00001] and step=0.05, but the range is not divisible by `step`. It will be replaced by [0, 1.0].
  warnings.warn(
K:  8
alpha:  0.5
lr:  0.0011555772497683966
weight_decay:  2.983172998414988e-05
dropout:  0.8
fix split and run 3 times
Data: Data(x=[3327, 3703], y=[3327], train_mask=[3327], val_mask=[3327], test_mask=[3327], adj_t=[3327, 3327, nnz=9104])
num_train tensor(120)
num_noise 0
noise: tensor(0)
data feature 3703
ALTOPT(
  (lins): Sequential(
    (0): Linear(in_features=3703, out_features=64, bias=True)
    (1): BatchNorm1d(64, eps=1e-05, momentum=0.1, affine=True, track_running_stats=True)
    (2): Dropout(p=0.8, inplace=True)
    (3): ReLU(inplace=True)
    (4): Linear(in_features=64, out_features=6, bias=True)
    (5): LogSoftmax(dim=-1)
  )
  (prop): Propagation(K=8, mode=None, lambda1=None, lambda2=None, L21=True, alpha=0.5)
  (gcn): GCN(
    (convs): ModuleList(
      (0): GCNConv(3703, 64)
      (1): GCNConv(64, 6)
    )
    (bns): ModuleList(
      (0): BatchNorm1d(64, eps=1e-05, momentum=0.1, affine=True, track_running_stats=True)
    )
    (output): LogSoftmax(dim=-1)
  )
)
propagate done
init label
Split: 01, Run: 01
None time:  0.7823393491562456
None Run 01:
Highest Train: 100.00
Highest Valid: 48.60
  Final Train: 100.00
   Final Test: 48.70
Split: 01, Run: 02
None time:  0.7139019181486219
None Run 02:
Highest Train: 100.00
Highest Valid: 62.20
  Final Train: 100.00
   Final Test: 61.30
Split: 01, Run: 03
None time:  0.8253709629643708
None Run 03:
Highest Train: 100.00
Highest Valid: 53.60
  Final Train: 100.00
   Final Test: 53.80
run time now: 2.365119457244873
total time:  2.420609842054546
None All runs:
Highest Train: 100.00 ± 0.00
Highest Valid: 54.80 ± 6.88
  Final Train: 100.00 ± 0.00
   Final Test: 54.60 ± 6.34
[I 2023-06-12 00:09:41,845] Trial 762 finished with value: 54.79999923706055 and parameters: {'Fwd': 0.022170454556320857, 'K': 8, 'alpha': 0.5, 'dropout': 0.8, 'gnnepoch': 120, 'lambda1': 0.75, 'lambda2': 9.484368393297547, 'loop': 0, 'loss': 'CE', 'lr': 0.0011555772497683966, 'softmaxF': False, 'useGCN': False, 'weight_decay': 2.983172998414988e-05, 'weightedloss': True}. Best is trial 605 with value: 72.13333129882812.
/home/wxy/miniconda3/lib/python3.10/site-packages/optuna/distributions.py:685: UserWarning: The distribution is specified by [0, 1.00001] and step=0.05, but the range is not divisible by `step`. It will be replaced by [0, 1.0].
  warnings.warn(
K:  8
alpha:  0.6000000000000001
lr:  0.0012862445871904742
weight_decay:  0.0006259002164458689
dropout:  0.8
fix split and run 3 times
Data: Data(x=[3327, 3703], y=[3327], train_mask=[3327], val_mask=[3327], test_mask=[3327], adj_t=[3327, 3327, nnz=9104])
num_train tensor(120)
num_noise 0
noise: tensor(0)
data feature 3703
ALTOPT(
  (lins): Sequential(
    (0): Linear(in_features=3703, out_features=64, bias=True)
    (1): BatchNorm1d(64, eps=1e-05, momentum=0.1, affine=True, track_running_stats=True)
    (2): Dropout(p=0.8, inplace=True)
    (3): ReLU(inplace=True)
    (4): Linear(in_features=64, out_features=6, bias=True)
    (5): LogSoftmax(dim=-1)
  )
  (prop): Propagation(K=8, mode=None, lambda1=None, lambda2=None, L21=True, alpha=0.6000000000000001)
  (gcn): GCN(
    (convs): ModuleList(
      (0): GCNConv(3703, 64)
      (1): GCNConv(64, 6)
    )
    (bns): ModuleList(
      (0): BatchNorm1d(64, eps=1e-05, momentum=0.1, affine=True, track_running_stats=True)
    )
    (output): LogSoftmax(dim=-1)
  )
)
propagate done
init label
Split: 01, Run: 01
None time:  0.5909427618607879
None Run 01:
Highest Train: 100.00
Highest Valid: 70.00
  Final Train: 100.00
   Final Test: 69.60
Split: 01, Run: 02
None time:  0.6089798221364617
None Run 02:
Highest Train: 100.00
Highest Valid: 69.80
  Final Train: 100.00
   Final Test: 69.10
Split: 01, Run: 03
None time:  0.6342466347850859
None Run 03:
Highest Train: 100.00
Highest Valid: 69.80
  Final Train: 100.00
   Final Test: 68.60
run time now: 1.8859550952911377
total time:  1.934725906001404
None All runs:
Highest Train: 100.00 ± 0.00
Highest Valid: 69.87 ± 0.12
  Final Train: 100.00 ± 0.00
   Final Test: 69.10 ± 0.50
[I 2023-06-12 00:09:44,514] Trial 763 finished with value: 69.86666870117188 and parameters: {'Fwd': 2.6903916088154594e-05, 'K': 8, 'alpha': 0.6000000000000001, 'dropout': 0.8, 'gnnepoch': 60, 'lambda1': 0.6000000000000001, 'lambda2': 3.8329714131252075, 'loop': 0, 'loss': 'CE', 'lr': 0.0012862445871904742, 'softmaxF': False, 'useGCN': True, 'weight_decay': 0.0006259002164458689, 'weightedloss': True}. Best is trial 605 with value: 72.13333129882812.
/home/wxy/miniconda3/lib/python3.10/site-packages/optuna/distributions.py:685: UserWarning: The distribution is specified by [0, 1.00001] and step=0.05, but the range is not divisible by `step`. It will be replaced by [0, 1.0].
  warnings.warn(
K:  8
alpha:  0.75
lr:  0.001637063759472283
weight_decay:  4.142738176462727e-05
dropout:  0.9
fix split and run 3 times
Data: Data(x=[3327, 3703], y=[3327], train_mask=[3327], val_mask=[3327], test_mask=[3327], adj_t=[3327, 3327, nnz=9104])
num_train tensor(120)
num_noise 0
noise: tensor(0)
data feature 3703
ALTOPT(
  (lins): Sequential(
    (0): Linear(in_features=3703, out_features=64, bias=True)
    (1): BatchNorm1d(64, eps=1e-05, momentum=0.1, affine=True, track_running_stats=True)
    (2): Dropout(p=0.9, inplace=True)
    (3): ReLU(inplace=True)
    (4): Linear(in_features=64, out_features=6, bias=True)
    (5): LogSoftmax(dim=-1)
  )
  (prop): Propagation(K=8, mode=None, lambda1=None, lambda2=None, L21=True, alpha=0.75)
  (gcn): GCN(
    (convs): ModuleList(
      (0): GCNConv(3703, 64)
      (1): GCNConv(64, 6)
    )
    (bns): ModuleList(
      (0): BatchNorm1d(64, eps=1e-05, momentum=0.1, affine=True, track_running_stats=True)
    )
    (output): LogSoftmax(dim=-1)
  )
)
propagate done
init label
Split: 01, Run: 01
None time:  1.0843612658791244
None Run 01:
Highest Train: 100.00
Highest Valid: 70.60
  Final Train: 100.00
   Final Test: 68.90
Split: 01, Run: 02
None time:  1.083708070917055
None Run 02:
Highest Train: 100.00
Highest Valid: 71.40
  Final Train: 100.00
   Final Test: 69.90
Split: 01, Run: 03
None time:  1.1416514799930155
None Run 03:
Highest Train: 100.00
Highest Valid: 72.20
  Final Train: 100.00
   Final Test: 71.30
run time now: 3.3492937088012695
total time:  3.4002767060883343
None All runs:
Highest Train: 100.00 ± 0.00
Highest Valid: 71.40 ± 0.80
  Final Train: 100.00 ± 0.00
   Final Test: 70.03 ± 1.21
