[I 2023-06-12 00:56:50,212] Trial 475 finished with value: 81.0666732788086 and parameters: {'Fwd': 0.09961246652355728, 'K': 4, 'alpha': 0.55, 'dropout': 0.4, 'gnnepoch': 60, 'lambda1': 0.8500000000000001, 'lambda2': 5.468607936971741, 'loop': 1, 'loss': 'CE', 'lr': 0.0045988583764933555, 'softmaxF': True, 'useGCN': True, 'weight_decay': 2.503149300920981e-05, 'weightedloss': False}. Best is trial 112 with value: 81.66667175292969.
/home/wxy/miniconda3/lib/python3.10/site-packages/optuna/distributions.py:685: UserWarning: The distribution is specified by [0, 1.00001] and step=0.05, but the range is not divisible by `step`. It will be replaced by [0, 1.0].
  warnings.warn(
K:  10
alpha:  0.6000000000000001
lr:  0.0005580405896255053
weight_decay:  1.708508810428651e-05
dropout:  0.4
fix split and run 3 times
Data: Data(x=[2708, 1433], y=[2708], train_mask=[2708], val_mask=[2708], test_mask=[2708], adj_t=[2708, 2708, nnz=10556])
num_train tensor(140)
num_noise 0
noise: tensor(0)
data feature 1433
ALTOPT(
  (lins): Sequential(
    (0): Linear(in_features=1433, out_features=64, bias=True)
    (1): BatchNorm1d(64, eps=1e-05, momentum=0.1, affine=True, track_running_stats=True)
    (2): Dropout(p=0.4, inplace=True)
    (3): ReLU(inplace=True)
    (4): Linear(in_features=64, out_features=7, bias=True)
    (5): LogSoftmax(dim=-1)
  )
  (prop): Propagation(K=10, mode=None, lambda1=None, lambda2=None, L21=True, alpha=0.6000000000000001)
  (gcn): GCN(
    (convs): ModuleList(
      (0): GCNConv(1433, 64)
      (1): GCNConv(64, 7)
    )
    (bns): ModuleList(
      (0): BatchNorm1d(64, eps=1e-05, momentum=0.1, affine=True, track_running_stats=True)
    )
    (output): LogSoftmax(dim=-1)
  )
)
propagate done
init label
Split: 01, Run: 01
None time:  1.4250704341102391
None Run 01:
Highest Train: 100.00
Highest Valid: 79.40
  Final Train: 100.00
   Final Test: 78.80
Split: 01, Run: 02
None time:  1.841947415145114
None Run 02:
Highest Train: 100.00
Highest Valid: 74.60
  Final Train: 100.00
   Final Test: 74.80
Split: 01, Run: 03
None time:  1.6771746641024947
None Run 03:
Highest Train: 100.00
Highest Valid: 78.60
  Final Train: 100.00
   Final Test: 77.80
run time now: 4.974245071411133
total time:  4.993793225148693
None All runs:
Highest Train: 100.00 ± 0.00
Highest Valid: 77.53 ± 2.57
  Final Train: 100.00 ± 0.00
   Final Test: 77.13 ± 2.08
[I 2023-06-12 00:56:55,738] Trial 476 finished with value: 77.53333282470703 and parameters: {'Fwd': 4.801880873924543e-06, 'K': 10, 'alpha': 0.6000000000000001, 'dropout': 0.4, 'gnnepoch': 60, 'lambda1': 0.7000000000000001, 'lambda2': 5.07779633065192, 'loop': 1, 'loss': 'CE', 'lr': 0.0005580405896255053, 'softmaxF': True, 'useGCN': True, 'weight_decay': 1.708508810428651e-05, 'weightedloss': True}. Best is trial 112 with value: 81.66667175292969.
/home/wxy/miniconda3/lib/python3.10/site-packages/optuna/distributions.py:685: UserWarning: The distribution is specified by [0, 1.00001] and step=0.05, but the range is not divisible by `step`. It will be replaced by [0, 1.0].
  warnings.warn(
K:  10
alpha:  0.65
lr:  0.0004094872204461879
weight_decay:  0.00013317420388221193
dropout:  0.30000000000000004
fix split and run 3 times
Data: Data(x=[2708, 1433], y=[2708], train_mask=[2708], val_mask=[2708], test_mask=[2708], adj_t=[2708, 2708, nnz=10556])
num_train tensor(140)
num_noise 0
noise: tensor(0)
data feature 1433
ALTOPT(
  (lins): Sequential(
    (0): Linear(in_features=1433, out_features=64, bias=True)
    (1): BatchNorm1d(64, eps=1e-05, momentum=0.1, affine=True, track_running_stats=True)
    (2): Dropout(p=0.30000000000000004, inplace=True)
    (3): ReLU(inplace=True)
    (4): Linear(in_features=64, out_features=7, bias=True)
    (5): LogSoftmax(dim=-1)
  )
  (prop): Propagation(K=10, mode=None, lambda1=None, lambda2=None, L21=True, alpha=0.65)
  (gcn): GCN(
    (convs): ModuleList(
      (0): GCNConv(1433, 64)
      (1): GCNConv(64, 7)
    )
    (bns): ModuleList(
      (0): BatchNorm1d(64, eps=1e-05, momentum=0.1, affine=True, track_running_stats=True)
    )
    (output): LogSoftmax(dim=-1)
  )
)
propagate done
init label
Split: 01, Run: 01
None time:  1.4483399849850684
None Run 01:
Highest Train: 100.00
Highest Valid: 79.60
  Final Train: 100.00
   Final Test: 78.70
Split: 01, Run: 02
None time:  1.592798839090392
None Run 02:
Highest Train: 100.00
Highest Valid: 73.80
  Final Train: 100.00
   Final Test: 74.20
Split: 01, Run: 03
None time:  1.7547255929093808
None Run 03:
Highest Train: 100.00
Highest Valid: 78.20
  Final Train: 100.00
   Final Test: 78.60
run time now: 4.818181753158569
total time:  4.833903972990811
None All runs:
Highest Train: 100.00 ± 0.00
Highest Valid: 77.20 ± 3.03
  Final Train: 100.00 ± 0.00
   Final Test: 77.17 ± 2.57
[I 2023-06-12 00:57:01,116] Trial 477 finished with value: 77.19999694824219 and parameters: {'Fwd': 0.000886242828771195, 'K': 10, 'alpha': 0.65, 'dropout': 0.30000000000000004, 'gnnepoch': 60, 'lambda1': 0.9500000000000001, 'lambda2': 4.60038067716391, 'loop': 1, 'loss': 'CE', 'lr': 0.0004094872204461879, 'softmaxF': True, 'useGCN': True, 'weight_decay': 0.00013317420388221193, 'weightedloss': False}. Best is trial 112 with value: 81.66667175292969.
/home/wxy/miniconda3/lib/python3.10/site-packages/optuna/distributions.py:685: UserWarning: The distribution is specified by [0, 1.00001] and step=0.05, but the range is not divisible by `step`. It will be replaced by [0, 1.0].
  warnings.warn(
K:  10
alpha:  0.45
lr:  0.006677919991191364
weight_decay:  5.4704259496120816e-05
dropout:  0.4
fix split and run 3 times
Data: Data(x=[2708, 1433], y=[2708], train_mask=[2708], val_mask=[2708], test_mask=[2708], adj_t=[2708, 2708, nnz=10556])
num_train tensor(140)
num_noise 0
noise: tensor(0)
data feature 1433
ALTOPT(
  (lins): Sequential(
    (0): Linear(in_features=1433, out_features=64, bias=True)
    (1): BatchNorm1d(64, eps=1e-05, momentum=0.1, affine=True, track_running_stats=True)
    (2): Dropout(p=0.4, inplace=True)
    (3): ReLU(inplace=True)
    (4): Linear(in_features=64, out_features=7, bias=True)
    (5): LogSoftmax(dim=-1)
  )
  (prop): Propagation(K=10, mode=None, lambda1=None, lambda2=None, L21=True, alpha=0.45)
  (gcn): GCN(
    (convs): ModuleList(
      (0): GCNConv(1433, 64)
      (1): GCNConv(64, 7)
    )
    (bns): ModuleList(
      (0): BatchNorm1d(64, eps=1e-05, momentum=0.1, affine=True, track_running_stats=True)
    )
    (output): LogSoftmax(dim=-1)
  )
)
propagate done
init label
Split: 01, Run: 01
None time:  1.7071931790560484
None Run 01:
Highest Train: 100.00
Highest Valid: 82.00
  Final Train: 100.00
   Final Test: 82.10
Split: 01, Run: 02
None time:  1.4641392449848354
None Run 02:
Highest Train: 100.00
Highest Valid: 80.60
  Final Train: 100.00
   Final Test: 81.00
Split: 01, Run: 03
None time:  1.8586127508897334
None Run 03:
Highest Train: 100.00
Highest Valid: 80.60
  Final Train: 100.00
   Final Test: 80.50
run time now: 5.057347536087036
total time:  5.07495981012471
None All runs:
Highest Train: 100.00 ± 0.00
Highest Valid: 81.07 ± 0.81
  Final Train: 100.00 ± 0.00
   Final Test: 81.20 ± 0.82
[I 2023-06-12 00:57:06,733] Trial 478 finished with value: 81.0666732788086 and parameters: {'Fwd': 0.016443345882078166, 'K': 10, 'alpha': 0.45, 'dropout': 0.4, 'gnnepoch': 70, 'lambda1': 0.75, 'lambda2': 5.929543714826393, 'loop': 1, 'loss': 'CE', 'lr': 0.006677919991191364, 'softmaxF': True, 'useGCN': True, 'weight_decay': 5.4704259496120816e-05, 'weightedloss': False}. Best is trial 112 with value: 81.66667175292969.
/home/wxy/miniconda3/lib/python3.10/site-packages/optuna/distributions.py:685: UserWarning: The distribution is specified by [0, 1.00001] and step=0.05, but the range is not divisible by `step`. It will be replaced by [0, 1.0].
  warnings.warn(
K:  9
alpha:  0.4
lr:  0.009224123309237523
weight_decay:  0.0004834703892851982
dropout:  0.5
fix split and run 3 times
Data: Data(x=[2708, 1433], y=[2708], train_mask=[2708], val_mask=[2708], test_mask=[2708], adj_t=[2708, 2708, nnz=10556])
num_train tensor(140)
num_noise 0
noise: tensor(0)
data feature 1433
ALTOPT(
  (lins): Sequential(
    (0): Linear(in_features=1433, out_features=64, bias=True)
    (1): BatchNorm1d(64, eps=1e-05, momentum=0.1, affine=True, track_running_stats=True)
    (2): Dropout(p=0.5, inplace=True)
    (3): ReLU(inplace=True)
    (4): Linear(in_features=64, out_features=7, bias=True)
    (5): LogSoftmax(dim=-1)
  )
  (prop): Propagation(K=9, mode=None, lambda1=None, lambda2=None, L21=True, alpha=0.4)
  (gcn): GCN(
    (convs): ModuleList(
      (0): GCNConv(1433, 64)
      (1): GCNConv(64, 7)
    )
    (bns): ModuleList(
      (0): BatchNorm1d(64, eps=1e-05, momentum=0.1, affine=True, track_running_stats=True)
    )
    (output): LogSoftmax(dim=-1)
  )
)
propagate done
init label
Split: 01, Run: 01
None time:  1.5181194529868662
None Run 01:
Highest Train: 100.00
Highest Valid: 81.80
  Final Train: 100.00
   Final Test: 82.20
Split: 01, Run: 02
None time:  1.715740012936294
None Run 02:
Highest Train: 100.00
Highest Valid: 80.80
  Final Train: 100.00
   Final Test: 80.00
Split: 01, Run: 03
None time:  1.3262775060720742
None Run 03:
Highest Train: 100.00
Highest Valid: 81.00
  Final Train: 100.00
   Final Test: 80.90
run time now: 4.586449861526489
total time:  4.60111822700128
None All runs:
Highest Train: 100.00 ± 0.00
Highest Valid: 81.20 ± 0.53
  Final Train: 100.00 ± 0.00
   Final Test: 81.03 ± 1.11
[I 2023-06-12 00:57:11,826] Trial 479 finished with value: 81.20000457763672 and parameters: {'Fwd': 0.08099059754096868, 'K': 9, 'alpha': 0.4, 'dropout': 0.5, 'gnnepoch': 60, 'lambda1': 0.8, 'lambda2': 5.6034472419333845, 'loop': 1, 'loss': 'CE', 'lr': 0.009224123309237523, 'softmaxF': True, 'useGCN': True, 'weight_decay': 0.0004834703892851982, 'weightedloss': False}. Best is trial 112 with value: 81.66667175292969.
/home/wxy/miniconda3/lib/python3.10/site-packages/optuna/distributions.py:685: UserWarning: The distribution is specified by [0, 1.00001] and step=0.05, but the range is not divisible by `step`. It will be replaced by [0, 1.0].
  warnings.warn(
K:  10
alpha:  0.7000000000000001
lr:  0.000678376319084904
weight_decay:  9.902054533484706e-05
dropout:  0.4
fix split and run 3 times
Data: Data(x=[2708, 1433], y=[2708], train_mask=[2708], val_mask=[2708], test_mask=[2708], adj_t=[2708, 2708, nnz=10556])
num_train tensor(140)
num_noise 0
noise: tensor(0)
data feature 1433
ALTOPT(
  (lins): Sequential(
    (0): Linear(in_features=1433, out_features=64, bias=True)
    (1): BatchNorm1d(64, eps=1e-05, momentum=0.1, affine=True, track_running_stats=True)
    (2): Dropout(p=0.4, inplace=True)
    (3): ReLU(inplace=True)
    (4): Linear(in_features=64, out_features=7, bias=True)
    (5): LogSoftmax(dim=-1)
  )
  (prop): Propagation(K=10, mode=None, lambda1=None, lambda2=None, L21=True, alpha=0.7000000000000001)
  (gcn): GCN(
    (convs): ModuleList(
      (0): GCNConv(1433, 64)
      (1): GCNConv(64, 7)
    )
    (bns): ModuleList(
      (0): BatchNorm1d(64, eps=1e-05, momentum=0.1, affine=True, track_running_stats=True)
    )
    (output): LogSoftmax(dim=-1)
  )
)
propagate done
init label
Split: 01, Run: 01
None time:  1.7044548159465194
None Run 01:
Highest Train: 100.00
Highest Valid: 79.40
  Final Train: 100.00
   Final Test: 79.00
Split: 01, Run: 02
None time:  1.5674318810924888
None Run 02:
Highest Train: 100.00
Highest Valid: 75.20
  Final Train: 100.00
   Final Test: 74.70
Split: 01, Run: 03
None time:  1.681137328967452
None Run 03:
Highest Train: 100.00
Highest Valid: 77.60
  Final Train: 100.00
   Final Test: 78.00
run time now: 4.980729579925537
total time:  4.9950995210092515
None All runs:
Highest Train: 100.00 ± 0.00
Highest Valid: 77.40 ± 2.11
  Final Train: 100.00 ± 0.00
   Final Test: 77.23 ± 2.25
[I 2023-06-12 00:57:17,316] Trial 480 finished with value: 77.4000015258789 and parameters: {'Fwd': 0.002352388132117054, 'K': 10, 'alpha': 0.7000000000000001, 'dropout': 0.4, 'gnnepoch': 60, 'lambda1': 0.8500000000000001, 'lambda2': 5.333284790821891, 'loop': 1, 'loss': 'CE', 'lr': 0.000678376319084904, 'softmaxF': True, 'useGCN': True, 'weight_decay': 9.902054533484706e-05, 'weightedloss': True}. Best is trial 112 with value: 81.66667175292969.
/home/wxy/miniconda3/lib/python3.10/site-packages/optuna/distributions.py:685: UserWarning: The distribution is specified by [0, 1.00001] and step=0.05, but the range is not divisible by `step`. It will be replaced by [0, 1.0].
  warnings.warn(
K:  10
alpha:  0.6000000000000001
lr:  0.007315622150531277
weight_decay:  3.753171837525114e-05
dropout:  0.4
fix split and run 3 times
Data: Data(x=[2708, 1433], y=[2708], train_mask=[2708], val_mask=[2708], test_mask=[2708], adj_t=[2708, 2708, nnz=10556])
num_train tensor(140)
num_noise 0
noise: tensor(0)
data feature 1433
ALTOPT(
  (lins): Sequential(
    (0): Linear(in_features=1433, out_features=64, bias=True)
    (1): BatchNorm1d(64, eps=1e-05, momentum=0.1, affine=True, track_running_stats=True)
    (2): Dropout(p=0.4, inplace=True)
    (3): ReLU(inplace=True)
    (4): Linear(in_features=64, out_features=7, bias=True)
    (5): Identity()
  )
  (prop): Propagation(K=10, mode=None, lambda1=None, lambda2=None, L21=True, alpha=0.6000000000000001)
  (gcn): GCN(
    (convs): ModuleList(
      (0): GCNConv(1433, 64)
      (1): GCNConv(64, 7)
    )
    (bns): ModuleList(
      (0): BatchNorm1d(64, eps=1e-05, momentum=0.1, affine=True, track_running_stats=True)
    )
    (output): Identity()
  )
)
propagate done
init label
Split: 01, Run: 01
None time:  1.4383369921706617
None Run 01:
Highest Train: 100.00
Highest Valid: 80.40
  Final Train: 100.00
   Final Test: 80.30
Split: 01, Run: 02
None time:  1.4536892450414598
None Run 02:
Highest Train: 100.00
Highest Valid: 80.20
  Final Train: 100.00
   Final Test: 79.60
Split: 01, Run: 03
None time:  3.243104469962418
None Run 03:
Highest Train: 100.00
Highest Valid: 80.00
  Final Train: 100.00
   Final Test: 81.30
run time now: 6.160455226898193
total time:  6.175516226794571
None All runs:
Highest Train: 100.00 ± 0.00
Highest Valid: 80.20 ± 0.20
  Final Train: 100.00 ± 0.00
   Final Test: 80.40 ± 0.85
[I 2023-06-12 00:57:24,099] Trial 481 finished with value: 80.20000457763672 and parameters: {'Fwd': 0.06529427500691524, 'K': 10, 'alpha': 0.6000000000000001, 'dropout': 0.4, 'gnnepoch': 50, 'lambda1': 0.9, 'lambda2': 4.788708409854873, 'loop': 1, 'loss': 'MSE', 'lr': 0.007315622150531277, 'softmaxF': True, 'useGCN': True, 'weight_decay': 3.753171837525114e-05, 'weightedloss': False}. Best is trial 112 with value: 81.66667175292969.
/home/wxy/miniconda3/lib/python3.10/site-packages/optuna/distributions.py:685: UserWarning: The distribution is specified by [0, 1.00001] and step=0.05, but the range is not divisible by `step`. It will be replaced by [0, 1.0].
  warnings.warn(
K:  10
alpha:  0.5
lr:  0.0007762668483113382
weight_decay:  0.001972768629615365
dropout:  0.4
fix split and run 3 times
Data: Data(x=[2708, 1433], y=[2708], train_mask=[2708], val_mask=[2708], test_mask=[2708], adj_t=[2708, 2708, nnz=10556])
num_train tensor(140)
num_noise 0
noise: tensor(0)
data feature 1433
ALTOPT(
  (lins): Sequential(
    (0): Linear(in_features=1433, out_features=64, bias=True)
    (1): BatchNorm1d(64, eps=1e-05, momentum=0.1, affine=True, track_running_stats=True)
    (2): Dropout(p=0.4, inplace=True)
    (3): ReLU(inplace=True)
    (4): Linear(in_features=64, out_features=7, bias=True)
    (5): LogSoftmax(dim=-1)
  )
  (prop): Propagation(K=10, mode=None, lambda1=None, lambda2=None, L21=True, alpha=0.5)
  (gcn): GCN(
    (convs): ModuleList(
      (0): GCNConv(1433, 64)
      (1): GCNConv(64, 7)
    )
    (bns): ModuleList(
      (0): BatchNorm1d(64, eps=1e-05, momentum=0.1, affine=True, track_running_stats=True)
    )
    (output): LogSoftmax(dim=-1)
  )
)
propagate done
init label
Split: 01, Run: 01
None time:  1.8055972459260374
None Run 01:
Highest Train: 100.00
Highest Valid: 79.40
  Final Train: 100.00
   Final Test: 80.00
Split: 01, Run: 02
None time:  1.8066094820387661
None Run 02:
Highest Train: 100.00
Highest Valid: 78.00
  Final Train: 100.00
   Final Test: 77.40
Split: 01, Run: 03
None time:  1.6264033110346645
None Run 03:
Highest Train: 100.00
Highest Valid: 77.20
  Final Train: 100.00
   Final Test: 77.10
run time now: 5.304696798324585
total time:  5.3427264471538365
None All runs:
Highest Train: 100.00 ± 0.00
Highest Valid: 78.20 ± 1.11
  Final Train: 100.00 ± 0.00
   Final Test: 78.17 ± 1.59
[I 2023-06-12 00:57:29,997] Trial 482 finished with value: 78.20000457763672 and parameters: {'Fwd': 0.03327240054613089, 'K': 10, 'alpha': 0.5, 'dropout': 0.4, 'gnnepoch': 70, 'lambda1': 0.8, 'lambda2': 6.086990206187258, 'loop': 1, 'loss': 'CE', 'lr': 0.0007762668483113382, 'softmaxF': True, 'useGCN': True, 'weight_decay': 0.001972768629615365, 'weightedloss': False}. Best is trial 112 with value: 81.66667175292969.
/home/wxy/miniconda3/lib/python3.10/site-packages/optuna/distributions.py:685: UserWarning: The distribution is specified by [0, 1.00001] and step=0.05, but the range is not divisible by `step`. It will be replaced by [0, 1.0].
  warnings.warn(
K:  10
alpha:  0.55
lr:  0.0012333261218322867
weight_decay:  7.592787529401295e-05
dropout:  0.5
fix split and run 3 times
Data: Data(x=[2708, 1433], y=[2708], train_mask=[2708], val_mask=[2708], test_mask=[2708], adj_t=[2708, 2708, nnz=10556])
num_train tensor(140)
num_noise 0
noise: tensor(0)
data feature 1433
ALTOPT(
  (lins): Sequential(
    (0): Linear(in_features=1433, out_features=64, bias=True)
    (1): BatchNorm1d(64, eps=1e-05, momentum=0.1, affine=True, track_running_stats=True)
    (2): Dropout(p=0.5, inplace=True)
    (3): ReLU(inplace=True)
    (4): Linear(in_features=64, out_features=7, bias=True)
    (5): LogSoftmax(dim=-1)
  )
  (prop): Propagation(K=10, mode=None, lambda1=None, lambda2=None, L21=True, alpha=0.55)
  (gcn): GCN(
    (convs): ModuleList(
      (0): GCNConv(1433, 64)
      (1): GCNConv(64, 7)
    )
    (bns): ModuleList(
      (0): BatchNorm1d(64, eps=1e-05, momentum=0.1, affine=True, track_running_stats=True)
    )
    (output): LogSoftmax(dim=-1)
  )
)
propagate done
init label
Split: 01, Run: 01
None time:  1.841256279964
None Run 01:
Highest Train: 100.00
Highest Valid: 80.00
  Final Train: 100.00
   Final Test: 80.40
Split: 01, Run: 02
None time:  1.3607579628005624
None Run 02:
Highest Train: 100.00
Highest Valid: 76.00
  Final Train: 100.00
   Final Test: 76.10
Split: 01, Run: 03
None time:  1.6340688068885356
None Run 03:
Highest Train: 100.00
Highest Valid: 78.80
  Final Train: 100.00
   Final Test: 78.50
run time now: 4.865448951721191
total time:  4.879948902875185
None All runs:
Highest Train: 100.00 ± 0.00
Highest Valid: 78.27 ± 2.05
  Final Train: 100.00 ± 0.00
   Final Test: 78.33 ± 2.15
[I 2023-06-12 00:57:35,374] Trial 483 finished with value: 78.26666259765625 and parameters: {'Fwd': 0.08141798100029989, 'K': 10, 'alpha': 0.55, 'dropout': 0.5, 'gnnepoch': 60, 'lambda1': 0.8500000000000001, 'lambda2': 9.403478489799292, 'loop': 1, 'loss': 'CE', 'lr': 0.0012333261218322867, 'softmaxF': True, 'useGCN': True, 'weight_decay': 7.592787529401295e-05, 'weightedloss': True}. Best is trial 112 with value: 81.66667175292969.
/home/wxy/miniconda3/lib/python3.10/site-packages/optuna/distributions.py:685: UserWarning: The distribution is specified by [0, 1.00001] and step=0.05, but the range is not divisible by `step`. It will be replaced by [0, 1.0].
  warnings.warn(
K:  8
alpha:  0.65
lr:  0.0020442045566124037
weight_decay:  0.00015066463602267992
dropout:  0.4
fix split and run 3 times
Data: Data(x=[2708, 1433], y=[2708], train_mask=[2708], val_mask=[2708], test_mask=[2708], adj_t=[2708, 2708, nnz=10556])
num_train tensor(140)
num_noise 0
noise: tensor(0)
data feature 1433
ALTOPT(
  (lins): Sequential(
    (0): Linear(in_features=1433, out_features=64, bias=True)
    (1): BatchNorm1d(64, eps=1e-05, momentum=0.1, affine=True, track_running_stats=True)
    (2): Dropout(p=0.4, inplace=True)
    (3): ReLU(inplace=True)
    (4): Linear(in_features=64, out_features=7, bias=True)
    (5): LogSoftmax(dim=-1)
  )
  (prop): Propagation(K=8, mode=None, lambda1=None, lambda2=None, L21=True, alpha=0.65)
  (gcn): GCN(
    (convs): ModuleList(
      (0): GCNConv(1433, 64)
      (1): GCNConv(64, 7)
    )
    (bns): ModuleList(
      (0): BatchNorm1d(64, eps=1e-05, momentum=0.1, affine=True, track_running_stats=True)
    )
    (output): LogSoftmax(dim=-1)
  )
)
propagate done
init label
Split: 01, Run: 01
None time:  1.4678147451486439
None Run 01:
Highest Train: 100.00
Highest Valid: 80.00
  Final Train: 100.00
   Final Test: 80.40
Split: 01, Run: 02
None time:  1.65076995594427
None Run 02:
Highest Train: 100.00
Highest Valid: 78.60
  Final Train: 100.00
   Final Test: 78.10
Split: 01, Run: 03
None time:  1.4365644068457186
None Run 03:
Highest Train: 100.00
Highest Valid: 77.60
  Final Train: 100.00
   Final Test: 78.20
run time now: 4.668248891830444
total time:  4.7566212981473655
None All runs:
Highest Train: 100.00 ± 0.00
Highest Valid: 78.73 ± 1.21
  Final Train: 100.00 ± 0.00
   Final Test: 78.90 ± 1.30
