[I 2023-06-12 00:09:48,440] Trial 764 finished with value: 71.4000015258789 and parameters: {'Fwd': 0.051127240809106085, 'K': 8, 'alpha': 0.75, 'dropout': 0.9, 'gnnepoch': 120, 'lambda1': 0.8, 'lambda2': 7.811446302957687, 'loop': 0, 'loss': 'CE', 'lr': 0.001637063759472283, 'softmaxF': False, 'useGCN': True, 'weight_decay': 4.142738176462727e-05, 'weightedloss': True}. Best is trial 605 with value: 72.13333129882812.
/home/wxy/miniconda3/lib/python3.10/site-packages/optuna/distributions.py:685: UserWarning: The distribution is specified by [0, 1.00001] and step=0.05, but the range is not divisible by `step`. It will be replaced by [0, 1.0].
  warnings.warn(
K:  8
alpha:  0.8500000000000001
lr:  0.0010754456428638498
weight_decay:  5.8887224732184e-05
dropout:  0.8
fix split and run 3 times
Data: Data(x=[3327, 3703], y=[3327], train_mask=[3327], val_mask=[3327], test_mask=[3327], adj_t=[3327, 3327, nnz=9104])
num_train tensor(120)
num_noise 0
noise: tensor(0)
data feature 3703
ALTOPT(
  (lins): Sequential(
    (0): Linear(in_features=3703, out_features=64, bias=True)
    (1): BatchNorm1d(64, eps=1e-05, momentum=0.1, affine=True, track_running_stats=True)
    (2): Dropout(p=0.8, inplace=True)
    (3): ReLU(inplace=True)
    (4): Linear(in_features=64, out_features=6, bias=True)
    (5): LogSoftmax(dim=-1)
  )
  (prop): Propagation(K=8, mode=None, lambda1=None, lambda2=None, L21=True, alpha=0.8500000000000001)
  (gcn): GCN(
    (convs): ModuleList(
      (0): GCNConv(3703, 64)
      (1): GCNConv(64, 6)
    )
    (bns): ModuleList(
      (0): BatchNorm1d(64, eps=1e-05, momentum=0.1, affine=True, track_running_stats=True)
    )
    (output): LogSoftmax(dim=-1)
  )
)
propagate done
init label
Split: 01, Run: 01
None time:  1.0634030159562826
None Run 01:
Highest Train: 100.00
Highest Valid: 71.00
  Final Train: 100.00
   Final Test: 69.40
Split: 01, Run: 02
None time:  1.0232147290371358
None Run 02:
Highest Train: 100.00
Highest Valid: 72.40
  Final Train: 100.00
   Final Test: 69.60
Split: 01, Run: 03
None time:  1.2253423910588026
None Run 03:
Highest Train: 100.00
Highest Valid: 71.80
  Final Train: 100.00
   Final Test: 70.60
run time now: 3.358456611633301
total time:  3.4035537419840693
None All runs:
Highest Train: 100.00 ± 0.00
Highest Valid: 71.73 ± 0.70
  Final Train: 100.00 ± 0.00
   Final Test: 69.87 ± 0.64
[I 2023-06-12 00:09:52,381] Trial 765 finished with value: 71.73332977294922 and parameters: {'Fwd': 0.010107331669856646, 'K': 8, 'alpha': 0.8500000000000001, 'dropout': 0.8, 'gnnepoch': 120, 'lambda1': 0.65, 'lambda2': 5.860644021126899, 'loop': 0, 'loss': 'CE', 'lr': 0.0010754456428638498, 'softmaxF': False, 'useGCN': True, 'weight_decay': 5.8887224732184e-05, 'weightedloss': True}. Best is trial 605 with value: 72.13333129882812.
/home/wxy/miniconda3/lib/python3.10/site-packages/optuna/distributions.py:685: UserWarning: The distribution is specified by [0, 1.00001] and step=0.05, but the range is not divisible by `step`. It will be replaced by [0, 1.0].
  warnings.warn(
K:  8
alpha:  0.9500000000000001
lr:  0.0014323895602228053
weight_decay:  8.630781665360837e-05
dropout:  0.8
fix split and run 3 times
Data: Data(x=[3327, 3703], y=[3327], train_mask=[3327], val_mask=[3327], test_mask=[3327], adj_t=[3327, 3327, nnz=9104])
num_train tensor(120)
num_noise 0
noise: tensor(0)
data feature 3703
ALTOPT(
  (lins): Sequential(
    (0): Linear(in_features=3703, out_features=64, bias=True)
    (1): BatchNorm1d(64, eps=1e-05, momentum=0.1, affine=True, track_running_stats=True)
    (2): Dropout(p=0.8, inplace=True)
    (3): ReLU(inplace=True)
    (4): Linear(in_features=64, out_features=6, bias=True)
    (5): LogSoftmax(dim=-1)
  )
  (prop): Propagation(K=8, mode=None, lambda1=None, lambda2=None, L21=True, alpha=0.9500000000000001)
  (gcn): GCN(
    (convs): ModuleList(
      (0): GCNConv(3703, 64)
      (1): GCNConv(64, 6)
    )
    (bns): ModuleList(
      (0): BatchNorm1d(64, eps=1e-05, momentum=0.1, affine=True, track_running_stats=True)
    )
    (output): LogSoftmax(dim=-1)
  )
)
propagate done
init label
Split: 01, Run: 01
None time:  1.0856210349593312
None Run 01:
Highest Train: 100.00
Highest Valid: 71.20
  Final Train: 100.00
   Final Test: 69.50
Split: 01, Run: 02
None time:  1.0899270561058074
None Run 02:
Highest Train: 100.00
Highest Valid: 72.20
  Final Train: 100.00
   Final Test: 70.00
Split: 01, Run: 03
None time:  1.0765396999195218
None Run 03:
Highest Train: 100.00
Highest Valid: 71.60
  Final Train: 100.00
   Final Test: 71.00
run time now: 3.2955288887023926
total time:  3.3487667380832136
None All runs:
Highest Train: 100.00 ± 0.00
Highest Valid: 71.67 ± 0.50
  Final Train: 100.00 ± 0.00
   Final Test: 70.17 ± 0.76
[I 2023-06-12 00:09:56,288] Trial 766 finished with value: 71.66666412353516 and parameters: {'Fwd': 4.6455060598564756e-05, 'K': 8, 'alpha': 0.9500000000000001, 'dropout': 0.8, 'gnnepoch': 120, 'lambda1': 0.7000000000000001, 'lambda2': 6.671344809685965, 'loop': 0, 'loss': 'CE', 'lr': 0.0014323895602228053, 'softmaxF': False, 'useGCN': True, 'weight_decay': 8.630781665360837e-05, 'weightedloss': True}. Best is trial 605 with value: 72.13333129882812.
/home/wxy/miniconda3/lib/python3.10/site-packages/optuna/distributions.py:685: UserWarning: The distribution is specified by [0, 1.00001] and step=0.05, but the range is not divisible by `step`. It will be replaced by [0, 1.0].
  warnings.warn(
K:  7
alpha:  0.9
lr:  0.0012546179051095658
weight_decay:  0.0013419589707529115
dropout:  0.7000000000000001
fix split and run 3 times
Data: Data(x=[3327, 3703], y=[3327], train_mask=[3327], val_mask=[3327], test_mask=[3327], adj_t=[3327, 3327, nnz=9104])
num_train tensor(120)
num_noise 0
noise: tensor(0)
data feature 3703
ALTOPT(
  (lins): Sequential(
    (0): Linear(in_features=3703, out_features=64, bias=True)
    (1): BatchNorm1d(64, eps=1e-05, momentum=0.1, affine=True, track_running_stats=True)
    (2): Dropout(p=0.7000000000000001, inplace=True)
    (3): ReLU(inplace=True)
    (4): Linear(in_features=64, out_features=6, bias=True)
    (5): LogSoftmax(dim=-1)
  )
  (prop): Propagation(K=7, mode=None, lambda1=None, lambda2=None, L21=True, alpha=0.9)
  (gcn): GCN(
    (convs): ModuleList(
      (0): GCNConv(3703, 64)
      (1): GCNConv(64, 6)
    )
    (bns): ModuleList(
      (0): BatchNorm1d(64, eps=1e-05, momentum=0.1, affine=True, track_running_stats=True)
    )
    (output): LogSoftmax(dim=-1)
  )
)
propagate done
init label
Split: 01, Run: 01
None time:  0.9759268069174141
None Run 01:
Highest Train: 100.00
Highest Valid: 71.80
  Final Train: 100.00
   Final Test: 69.40
Split: 01, Run: 02
None time:  1.0464892371091992
None Run 02:
Highest Train: 100.00
Highest Valid: 71.80
  Final Train: 100.00
   Final Test: 70.10
Split: 01, Run: 03
None time:  1.1742803601082414
None Run 03:
Highest Train: 100.00
Highest Valid: 71.40
  Final Train: 100.00
   Final Test: 70.50
run time now: 3.236400604248047
total time:  3.2873106310144067
None All runs:
Highest Train: 100.00 ± 0.00
Highest Valid: 71.67 ± 0.23
  Final Train: 100.00 ± 0.00
   Final Test: 70.00 ± 0.56
[I 2023-06-12 00:10:00,136] Trial 767 finished with value: 71.66666412353516 and parameters: {'Fwd': 5.864690428018276e-06, 'K': 7, 'alpha': 0.9, 'dropout': 0.7000000000000001, 'gnnepoch': 120, 'lambda1': 0.75, 'lambda2': 5.075094048170147, 'loop': 0, 'loss': 'CE', 'lr': 0.0012546179051095658, 'softmaxF': True, 'useGCN': True, 'weight_decay': 0.0013419589707529115, 'weightedloss': True}. Best is trial 605 with value: 72.13333129882812.
/home/wxy/miniconda3/lib/python3.10/site-packages/optuna/distributions.py:685: UserWarning: The distribution is specified by [0, 1.00001] and step=0.05, but the range is not divisible by `step`. It will be replaced by [0, 1.0].
  warnings.warn(
K:  6
alpha:  0.7000000000000001
lr:  0.001960794325795903
weight_decay:  1.1678506761240981e-05
dropout:  0.8
fix split and run 3 times
Data: Data(x=[3327, 3703], y=[3327], train_mask=[3327], val_mask=[3327], test_mask=[3327], adj_t=[3327, 3327, nnz=9104])
num_train tensor(120)
num_noise 0
noise: tensor(0)
data feature 3703
ALTOPT(
  (lins): Sequential(
    (0): Linear(in_features=3703, out_features=64, bias=True)
    (1): BatchNorm1d(64, eps=1e-05, momentum=0.1, affine=True, track_running_stats=True)
    (2): Dropout(p=0.8, inplace=True)
    (3): ReLU(inplace=True)
    (4): Linear(in_features=64, out_features=6, bias=True)
    (5): LogSoftmax(dim=-1)
  )
  (prop): Propagation(K=6, mode=None, lambda1=None, lambda2=None, L21=True, alpha=0.7000000000000001)
  (gcn): GCN(
    (convs): ModuleList(
      (0): GCNConv(3703, 64)
      (1): GCNConv(64, 6)
    )
    (bns): ModuleList(
      (0): BatchNorm1d(64, eps=1e-05, momentum=0.1, affine=True, track_running_stats=True)
    )
    (output): LogSoftmax(dim=-1)
  )
)
propagate done
init label
Split: 01, Run: 01
None time:  0.9513784318696707
None Run 01:
Highest Train: 100.00
Highest Valid: 71.40
  Final Train: 100.00
   Final Test: 69.90
Split: 01, Run: 02
None time:  0.9573619170114398
None Run 02:
Highest Train: 100.00
Highest Valid: 70.00
  Final Train: 100.00
   Final Test: 68.40
Split: 01, Run: 03
None time:  1.0843696179799736
None Run 03:
Highest Train: 100.00
Highest Valid: 71.60
  Final Train: 100.00
   Final Test: 70.40
run time now: 3.0318973064422607
total time:  3.083074948983267
None All runs:
Highest Train: 100.00 ± 0.00
Highest Valid: 71.00 ± 0.87
  Final Train: 100.00 ± 0.00
   Final Test: 69.57 ± 1.04
[I 2023-06-12 00:10:03,756] Trial 768 finished with value: 71.0 and parameters: {'Fwd': 0.001916520394616476, 'K': 6, 'alpha': 0.7000000000000001, 'dropout': 0.8, 'gnnepoch': 110, 'lambda1': 0.7000000000000001, 'lambda2': 8.261871255557846, 'loop': 0, 'loss': 'CE', 'lr': 0.001960794325795903, 'softmaxF': False, 'useGCN': True, 'weight_decay': 1.1678506761240981e-05, 'weightedloss': True}. Best is trial 605 with value: 72.13333129882812.
/home/wxy/miniconda3/lib/python3.10/site-packages/optuna/distributions.py:685: UserWarning: The distribution is specified by [0, 1.00001] and step=0.05, but the range is not divisible by `step`. It will be replaced by [0, 1.0].
  warnings.warn(
K:  8
alpha:  0.55
lr:  0.0015632967906048204
weight_decay:  0.046466405264169945
dropout:  0.5
fix split and run 3 times
Data: Data(x=[3327, 3703], y=[3327], train_mask=[3327], val_mask=[3327], test_mask=[3327], adj_t=[3327, 3327, nnz=9104])
num_train tensor(120)
num_noise 0
noise: tensor(0)
data feature 3703
ALTOPT(
  (lins): Sequential(
    (0): Linear(in_features=3703, out_features=64, bias=True)
    (1): BatchNorm1d(64, eps=1e-05, momentum=0.1, affine=True, track_running_stats=True)
    (2): Dropout(p=0.5, inplace=True)
    (3): ReLU(inplace=True)
    (4): Linear(in_features=64, out_features=6, bias=True)
    (5): LogSoftmax(dim=-1)
  )
  (prop): Propagation(K=8, mode=None, lambda1=None, lambda2=None, L21=True, alpha=0.55)
  (gcn): GCN(
    (convs): ModuleList(
      (0): GCNConv(3703, 64)
      (1): GCNConv(64, 6)
    )
    (bns): ModuleList(
      (0): BatchNorm1d(64, eps=1e-05, momentum=0.1, affine=True, track_running_stats=True)
    )
    (output): LogSoftmax(dim=-1)
  )
)
propagate done
init label
Split: 01, Run: 01
None time:  1.0589454870205373
None Run 01:
Highest Train: 100.00
Highest Valid: 71.40
  Final Train: 97.50
   Final Test: 69.20
Split: 01, Run: 02
None time:  1.1108631039969623
None Run 02:
Highest Train: 100.00
Highest Valid: 71.60
  Final Train: 97.50
   Final Test: 69.90
Split: 01, Run: 03
None time:  1.001797845121473
None Run 03:
Highest Train: 100.00
Highest Valid: 71.60
  Final Train: 92.50
   Final Test: 70.40
run time now: 3.2106826305389404
total time:  3.270284297177568
None All runs:
Highest Train: 100.00 ± 0.00
Highest Valid: 71.53 ± 0.12
  Final Train: 95.83 ± 2.89
   Final Test: 69.83 ± 0.60
[I 2023-06-12 00:10:07,523] Trial 769 finished with value: 71.53333282470703 and parameters: {'Fwd': 1.3461183239226406e-06, 'K': 8, 'alpha': 0.55, 'dropout': 0.5, 'gnnepoch': 120, 'lambda1': 0.8500000000000001, 'lambda2': 0.6132789121346827, 'loop': 0, 'loss': 'CE', 'lr': 0.0015632967906048204, 'softmaxF': False, 'useGCN': True, 'weight_decay': 0.046466405264169945, 'weightedloss': True}. Best is trial 605 with value: 72.13333129882812.
/home/wxy/miniconda3/lib/python3.10/site-packages/optuna/distributions.py:685: UserWarning: The distribution is specified by [0, 1.00001] and step=0.05, but the range is not divisible by `step`. It will be replaced by [0, 1.0].
  warnings.warn(
K:  8
alpha:  0.5
lr:  0.0025986871169936406
weight_decay:  2.0773997632286402e-05
dropout:  0.8
fix split and run 3 times
Data: Data(x=[3327, 3703], y=[3327], train_mask=[3327], val_mask=[3327], test_mask=[3327], adj_t=[3327, 3327, nnz=9104])
num_train tensor(120)
num_noise 0
noise: tensor(0)
data feature 3703
ALTOPT(
  (lins): Sequential(
    (0): Linear(in_features=3703, out_features=64, bias=True)
    (1): BatchNorm1d(64, eps=1e-05, momentum=0.1, affine=True, track_running_stats=True)
    (2): Dropout(p=0.8, inplace=True)
    (3): ReLU(inplace=True)
    (4): Linear(in_features=64, out_features=6, bias=True)
    (5): LogSoftmax(dim=-1)
  )
  (prop): Propagation(K=8, mode=None, lambda1=None, lambda2=None, L21=True, alpha=0.5)
  (gcn): GCN(
    (convs): ModuleList(
      (0): GCNConv(3703, 64)
      (1): GCNConv(64, 6)
    )
    (bns): ModuleList(
      (0): BatchNorm1d(64, eps=1e-05, momentum=0.1, affine=True, track_running_stats=True)
    )
    (output): LogSoftmax(dim=-1)
  )
)
propagate done
init label
Split: 01, Run: 01
None time:  1.0563899909611791
None Run 01:
Highest Train: 100.00
Highest Valid: 71.60
  Final Train: 100.00
   Final Test: 70.00
Split: 01, Run: 02
None time:  1.0643624840304255
None Run 02:
Highest Train: 100.00
Highest Valid: 71.80
  Final Train: 100.00
   Final Test: 70.60
Split: 01, Run: 03
None time:  1.0616663109976798
None Run 03:
Highest Train: 100.00
Highest Valid: 71.20
  Final Train: 100.00
   Final Test: 69.30
run time now: 3.2239620685577393
total time:  3.281645423034206
None All runs:
Highest Train: 100.00 ± 0.00
Highest Valid: 71.53 ± 0.31
  Final Train: 100.00 ± 0.00
   Final Test: 69.97 ± 0.65
[I 2023-06-12 00:10:11,314] Trial 770 finished with value: 71.53333282470703 and parameters: {'Fwd': 0.038231641650193535, 'K': 8, 'alpha': 0.5, 'dropout': 0.8, 'gnnepoch': 120, 'lambda1': 0.35000000000000003, 'lambda2': 5.529405014291552, 'loop': 0, 'loss': 'CE', 'lr': 0.0025986871169936406, 'softmaxF': False, 'useGCN': True, 'weight_decay': 2.0773997632286402e-05, 'weightedloss': True}. Best is trial 605 with value: 72.13333129882812.
/home/wxy/miniconda3/lib/python3.10/site-packages/optuna/distributions.py:685: UserWarning: The distribution is specified by [0, 1.00001] and step=0.05, but the range is not divisible by `step`. It will be replaced by [0, 1.0].
  warnings.warn(
K:  8
alpha:  0.75
lr:  0.00031236755928325466
weight_decay:  3.181919352320067e-06
dropout:  0.8
fix split and run 3 times
Data: Data(x=[3327, 3703], y=[3327], train_mask=[3327], val_mask=[3327], test_mask=[3327], adj_t=[3327, 3327, nnz=9104])
num_train tensor(120)
num_noise 0
noise: tensor(0)
data feature 3703
ALTOPT(
  (lins): Sequential(
    (0): Linear(in_features=3703, out_features=64, bias=True)
    (1): BatchNorm1d(64, eps=1e-05, momentum=0.1, affine=True, track_running_stats=True)
    (2): Dropout(p=0.8, inplace=True)
    (3): ReLU(inplace=True)
    (4): Linear(in_features=64, out_features=6, bias=True)
    (5): LogSoftmax(dim=-1)
  )
  (prop): Propagation(K=8, mode=None, lambda1=None, lambda2=None, L21=True, alpha=0.75)
  (gcn): GCN(
    (convs): ModuleList(
      (0): GCNConv(3703, 64)
      (1): GCNConv(64, 6)
    )
    (bns): ModuleList(
      (0): BatchNorm1d(64, eps=1e-05, momentum=0.1, affine=True, track_running_stats=True)
    )
    (output): LogSoftmax(dim=-1)
  )
)
propagate done
init label
Split: 01, Run: 01
None time:  1.0483612089883536
None Run 01:
Highest Train: 100.00
Highest Valid: 70.20
  Final Train: 100.00
   Final Test: 69.10
Split: 01, Run: 02
None time:  1.1013115490786731
None Run 02:
Highest Train: 100.00
Highest Valid: 70.00
  Final Train: 100.00
   Final Test: 69.90
Split: 01, Run: 03
None time:  1.2732042260468006
None Run 03:
Highest Train: 100.00
Highest Valid: 69.00
  Final Train: 100.00
   Final Test: 69.80
run time now: 3.46478009223938
total time:  3.5181752699427307
None All runs:
Highest Train: 100.00 ± 0.00
Highest Valid: 69.73 ± 0.64
  Final Train: 100.00 ± 0.00
   Final Test: 69.60 ± 0.44
[I 2023-06-12 00:10:15,363] Trial 771 finished with value: 69.73333740234375 and parameters: {'Fwd': 0.0001702220795027496, 'K': 8, 'alpha': 0.75, 'dropout': 0.8, 'gnnepoch': 120, 'lambda1': 0.8, 'lambda2': 4.507585549304498, 'loop': 0, 'loss': 'CE', 'lr': 0.00031236755928325466, 'softmaxF': False, 'useGCN': True, 'weight_decay': 3.181919352320067e-06, 'weightedloss': True}. Best is trial 605 with value: 72.13333129882812.
/home/wxy/miniconda3/lib/python3.10/site-packages/optuna/distributions.py:685: UserWarning: The distribution is specified by [0, 1.00001] and step=0.05, but the range is not divisible by `step`. It will be replaced by [0, 1.0].
  warnings.warn(
K:  8
alpha:  0.9
lr:  0.0001233804578832158
weight_decay:  3.492558235202765e-05
dropout:  0.4
fix split and run 3 times
Data: Data(x=[3327, 3703], y=[3327], train_mask=[3327], val_mask=[3327], test_mask=[3327], adj_t=[3327, 3327, nnz=9104])
num_train tensor(120)
num_noise 0
noise: tensor(0)
data feature 3703
ALTOPT(
  (lins): Sequential(
    (0): Linear(in_features=3703, out_features=64, bias=True)
    (1): BatchNorm1d(64, eps=1e-05, momentum=0.1, affine=True, track_running_stats=True)
    (2): Dropout(p=0.4, inplace=True)
    (3): ReLU(inplace=True)
    (4): Linear(in_features=64, out_features=6, bias=True)
    (5): LogSoftmax(dim=-1)
  )
  (prop): Propagation(K=8, mode=None, lambda1=None, lambda2=None, L21=True, alpha=0.9)
  (gcn): GCN(
    (convs): ModuleList(
      (0): GCNConv(3703, 64)
      (1): GCNConv(64, 6)
    )
    (bns): ModuleList(
      (0): BatchNorm1d(64, eps=1e-05, momentum=0.1, affine=True, track_running_stats=True)
    )
    (output): LogSoftmax(dim=-1)
  )
)
propagate done
init label
Split: 01, Run: 01
None time:  1.022334311157465
None Run 01:
Highest Train: 100.00
Highest Valid: 67.20
  Final Train: 100.00
   Final Test: 68.00
Split: 01, Run: 02
None time:  1.0794119990896434
None Run 02:
Highest Train: 100.00
Highest Valid: 68.20
  Final Train: 100.00
   Final Test: 68.50
Split: 01, Run: 03
None time:  1.1423514909110963
None Run 03:
Highest Train: 100.00
Highest Valid: 67.80
  Final Train: 100.00
   Final Test: 69.10
run time now: 3.288039445877075
total time:  3.335336129879579
None All runs:
Highest Train: 100.00 ± 0.00
Highest Valid: 67.73 ± 0.50
  Final Train: 100.00 ± 0.00
   Final Test: 68.53 ± 0.55
[I 2023-06-12 00:10:19,240] Trial 772 finished with value: 67.73332977294922 and parameters: {'Fwd': 9.880801549354152e-05, 'K': 8, 'alpha': 0.9, 'dropout': 0.4, 'gnnepoch': 120, 'lambda1': 0.65, 'lambda2': 6.892919288209371, 'loop': 0, 'loss': 'CE', 'lr': 0.0001233804578832158, 'softmaxF': False, 'useGCN': True, 'weight_decay': 3.492558235202765e-05, 'weightedloss': True}. Best is trial 605 with value: 72.13333129882812.
/home/wxy/miniconda3/lib/python3.10/site-packages/optuna/distributions.py:685: UserWarning: The distribution is specified by [0, 1.00001] and step=0.05, but the range is not divisible by `step`. It will be replaced by [0, 1.0].
  warnings.warn(
K:  9
alpha:  0.8
lr:  0.0013500699690003587
weight_decay:  6.059314074852282e-06
dropout:  0.8
fix split and run 3 times
Data: Data(x=[3327, 3703], y=[3327], train_mask=[3327], val_mask=[3327], test_mask=[3327], adj_t=[3327, 3327, nnz=9104])
num_train tensor(120)
num_noise 0
noise: tensor(0)
data feature 3703
ALTOPT(
  (lins): Sequential(
    (0): Linear(in_features=3703, out_features=64, bias=True)
    (1): BatchNorm1d(64, eps=1e-05, momentum=0.1, affine=True, track_running_stats=True)
    (2): Dropout(p=0.8, inplace=True)
    (3): ReLU(inplace=True)
    (4): Linear(in_features=64, out_features=6, bias=True)
    (5): Identity()
  )
  (prop): Propagation(K=9, mode=None, lambda1=None, lambda2=None, L21=True, alpha=0.8)
  (gcn): GCN(
    (convs): ModuleList(
      (0): GCNConv(3703, 64)
      (1): GCNConv(64, 6)
    )
    (bns): ModuleList(
      (0): BatchNorm1d(64, eps=1e-05, momentum=0.1, affine=True, track_running_stats=True)
    )
    (output): Identity()
  )
)
propagate done
init label
Split: 01, Run: 01, Epoch: 100, Loss: 0.0000, Train: 100.00%, Valid: 70.80% Test: 69.50%
Split: 01, Run: 01
None time:  1.7270344099961221
None Run 01:
Highest Train: 100.00
Highest Valid: 70.80
  Final Train: 100.00
   Final Test: 69.50
Split: 01, Run: 02, Epoch: 100, Loss: 0.0000, Train: 100.00%, Valid: 70.20% Test: 69.40%
Split: 01, Run: 02
None time:  1.7805810240097344
None Run 02:
Highest Train: 100.00
Highest Valid: 70.20
  Final Train: 100.00
   Final Test: 69.40
Split: 01, Run: 03, Epoch: 100, Loss: 0.0000, Train: 100.00%, Valid: 69.20% Test: 70.30%
Split: 01, Run: 03
None time:  1.6966538589913398
None Run 03:
Highest Train: 100.00
Highest Valid: 69.20
  Final Train: 100.00
   Final Test: 70.30
run time now: 5.248716592788696
total time:  5.299295864999294
None All runs:
Highest Train: 100.00 ± 0.00
Highest Valid: 70.07 ± 0.81
  Final Train: 100.00 ± 0.00
   Final Test: 69.73 ± 0.49
