[I 2023-06-12 00:19:32,291] Trial 61 finished with value: 81.13333129882812 and parameters: {'Fwd': 0.012464634012660583, 'K': 10, 'alpha': 0.45, 'dropout': 0.6000000000000001, 'gnnepoch': 70, 'lambda1': 0.55, 'lambda2': 5.088247940358712, 'loop': 1, 'loss': 'CE', 'lr': 0.00328884575735386, 'softmaxF': True, 'useGCN': True, 'weight_decay': 0.00017865586492576803, 'weightedloss': True}. Best is trial 60 with value: 81.33333587646484.
/home/wxy/miniconda3/lib/python3.10/site-packages/optuna/distributions.py:685: UserWarning: The distribution is specified by [0, 1.00001] and step=0.05, but the range is not divisible by `step`. It will be replaced by [0, 1.0].
  warnings.warn(
K:  10
alpha:  0.35000000000000003
lr:  0.003303513621564397
weight_decay:  0.00014732412390555327
dropout:  0.6000000000000001
fix split and run 3 times
Data: Data(x=[2708, 1433], y=[2708], train_mask=[2708], val_mask=[2708], test_mask=[2708], adj_t=[2708, 2708, nnz=10556])
num_train tensor(140)
num_noise 0
noise: tensor(0)
data feature 1433
ALTOPT(
  (lins): Sequential(
    (0): Linear(in_features=1433, out_features=64, bias=True)
    (1): BatchNorm1d(64, eps=1e-05, momentum=0.1, affine=True, track_running_stats=True)
    (2): Dropout(p=0.6000000000000001, inplace=True)
    (3): ReLU(inplace=True)
    (4): Linear(in_features=64, out_features=7, bias=True)
    (5): LogSoftmax(dim=-1)
  )
  (prop): Propagation(K=10, mode=None, lambda1=None, lambda2=None, L21=True, alpha=0.35000000000000003)
  (gcn): GCN(
    (convs): ModuleList(
      (0): GCNConv(1433, 64)
      (1): GCNConv(64, 7)
    )
    (bns): ModuleList(
      (0): BatchNorm1d(64, eps=1e-05, momentum=0.1, affine=True, track_running_stats=True)
    )
    (output): LogSoftmax(dim=-1)
  )
)
propagate done
init label
Split: 01, Run: 01
None time:  1.5896845820825547
None Run 01:
Highest Train: 100.00
Highest Valid: 80.80
  Final Train: 100.00
   Final Test: 81.50
Split: 01, Run: 02
None time:  2.547990360064432
None Run 02:
Highest Train: 100.00
Highest Valid: 81.20
  Final Train: 100.00
   Final Test: 81.70
Split: 01, Run: 03
None time:  1.672295501921326
None Run 03:
Highest Train: 100.00
Highest Valid: 80.20
  Final Train: 100.00
   Final Test: 81.00
run time now: 5.837104558944702
total time:  5.85670710215345
None All runs:
Highest Train: 100.00 ± 0.00
Highest Valid: 80.73 ± 0.50
  Final Train: 100.00 ± 0.00
   Final Test: 81.40 ± 0.36
[I 2023-06-12 00:19:38,670] Trial 62 finished with value: 80.73332977294922 and parameters: {'Fwd': 0.01094763959177329, 'K': 10, 'alpha': 0.35000000000000003, 'dropout': 0.6000000000000001, 'gnnepoch': 70, 'lambda1': 0.6000000000000001, 'lambda2': 5.04595459091451, 'loop': 1, 'loss': 'CE', 'lr': 0.003303513621564397, 'softmaxF': True, 'useGCN': True, 'weight_decay': 0.00014732412390555327, 'weightedloss': True}. Best is trial 60 with value: 81.33333587646484.
/home/wxy/miniconda3/lib/python3.10/site-packages/optuna/distributions.py:685: UserWarning: The distribution is specified by [0, 1.00001] and step=0.05, but the range is not divisible by `step`. It will be replaced by [0, 1.0].
  warnings.warn(
K:  10
alpha:  0.35000000000000003
lr:  0.0035046693928264187
weight_decay:  0.00014225875978587097
dropout:  0.6000000000000001
fix split and run 3 times
Data: Data(x=[2708, 1433], y=[2708], train_mask=[2708], val_mask=[2708], test_mask=[2708], adj_t=[2708, 2708, nnz=10556])
num_train tensor(140)
num_noise 0
noise: tensor(0)
data feature 1433
ALTOPT(
  (lins): Sequential(
    (0): Linear(in_features=1433, out_features=64, bias=True)
    (1): BatchNorm1d(64, eps=1e-05, momentum=0.1, affine=True, track_running_stats=True)
    (2): Dropout(p=0.6000000000000001, inplace=True)
    (3): ReLU(inplace=True)
    (4): Linear(in_features=64, out_features=7, bias=True)
    (5): LogSoftmax(dim=-1)
  )
  (prop): Propagation(K=10, mode=None, lambda1=None, lambda2=None, L21=True, alpha=0.35000000000000003)
  (gcn): GCN(
    (convs): ModuleList(
      (0): GCNConv(1433, 64)
      (1): GCNConv(64, 7)
    )
    (bns): ModuleList(
      (0): BatchNorm1d(64, eps=1e-05, momentum=0.1, affine=True, track_running_stats=True)
    )
    (output): LogSoftmax(dim=-1)
  )
)
propagate done
init label
Split: 01, Run: 01
None time:  2.3932193729560822
None Run 01:
Highest Train: 100.00
Highest Valid: 80.20
  Final Train: 100.00
   Final Test: 82.50
Split: 01, Run: 02
None time:  1.87355956598185
None Run 02:
Highest Train: 100.00
Highest Valid: 80.20
  Final Train: 100.00
   Final Test: 80.10
Split: 01, Run: 03
None time:  2.2899563701357692
None Run 03:
Highest Train: 100.00
Highest Valid: 78.20
  Final Train: 100.00
   Final Test: 77.50
run time now: 6.588334560394287
total time:  6.626090950099751
None All runs:
Highest Train: 100.00 ± 0.00
Highest Valid: 79.53 ± 1.15
  Final Train: 100.00 ± 0.00
   Final Test: 80.03 ± 2.50
[I 2023-06-12 00:19:45,753] Trial 63 finished with value: 79.53333282470703 and parameters: {'Fwd': 0.011952204451046432, 'K': 10, 'alpha': 0.35000000000000003, 'dropout': 0.6000000000000001, 'gnnepoch': 50, 'lambda1': 0.65, 'lambda2': 5.235045339274492, 'loop': 1, 'loss': 'CE', 'lr': 0.0035046693928264187, 'softmaxF': True, 'useGCN': True, 'weight_decay': 0.00014225875978587097, 'weightedloss': True}. Best is trial 60 with value: 81.33333587646484.
/home/wxy/miniconda3/lib/python3.10/site-packages/optuna/distributions.py:685: UserWarning: The distribution is specified by [0, 1.00001] and step=0.05, but the range is not divisible by `step`. It will be replaced by [0, 1.0].
  warnings.warn(
K:  10
alpha:  0.25
lr:  0.003065564501424174
weight_decay:  0.00021580753348067003
dropout:  0.6000000000000001
fix split and run 3 times
Data: Data(x=[2708, 1433], y=[2708], train_mask=[2708], val_mask=[2708], test_mask=[2708], adj_t=[2708, 2708, nnz=10556])
num_train tensor(140)
num_noise 0
noise: tensor(0)
data feature 1433
ALTOPT(
  (lins): Sequential(
    (0): Linear(in_features=1433, out_features=64, bias=True)
    (1): BatchNorm1d(64, eps=1e-05, momentum=0.1, affine=True, track_running_stats=True)
    (2): Dropout(p=0.6000000000000001, inplace=True)
    (3): ReLU(inplace=True)
    (4): Linear(in_features=64, out_features=7, bias=True)
    (5): LogSoftmax(dim=-1)
  )
  (prop): Propagation(K=10, mode=None, lambda1=None, lambda2=None, L21=True, alpha=0.25)
  (gcn): GCN(
    (convs): ModuleList(
      (0): GCNConv(1433, 64)
      (1): GCNConv(64, 7)
    )
    (bns): ModuleList(
      (0): BatchNorm1d(64, eps=1e-05, momentum=0.1, affine=True, track_running_stats=True)
    )
    (output): LogSoftmax(dim=-1)
  )
)
propagate done
init label
Split: 01, Run: 01
None time:  1.8292706219945103
None Run 01:
Highest Train: 100.00
Highest Valid: 80.60
  Final Train: 100.00
   Final Test: 81.20
Split: 01, Run: 02
None time:  1.7368788528256118
None Run 02:
Highest Train: 100.00
Highest Valid: 80.20
  Final Train: 100.00
   Final Test: 80.30
Split: 01, Run: 03
None time:  1.8178434420842677
None Run 03:
Highest Train: 100.00
Highest Valid: 80.20
  Final Train: 100.00
   Final Test: 81.50
run time now: 5.410165309906006
total time:  5.43719996092841
None All runs:
Highest Train: 100.00 ± 0.00
Highest Valid: 80.33 ± 0.23
  Final Train: 100.00 ± 0.00
   Final Test: 81.00 ± 0.62
[I 2023-06-12 00:19:51,734] Trial 64 finished with value: 80.33332824707031 and parameters: {'Fwd': 0.005845219687474326, 'K': 10, 'alpha': 0.25, 'dropout': 0.6000000000000001, 'gnnepoch': 70, 'lambda1': 0.55, 'lambda2': 4.8669207300249635, 'loop': 1, 'loss': 'CE', 'lr': 0.003065564501424174, 'softmaxF': True, 'useGCN': True, 'weight_decay': 0.00021580753348067003, 'weightedloss': True}. Best is trial 60 with value: 81.33333587646484.
/home/wxy/miniconda3/lib/python3.10/site-packages/optuna/distributions.py:685: UserWarning: The distribution is specified by [0, 1.00001] and step=0.05, but the range is not divisible by `step`. It will be replaced by [0, 1.0].
  warnings.warn(
K:  10
alpha:  0.2
lr:  0.003077165066088968
weight_decay:  0.00018786029358644577
dropout:  0.6000000000000001
fix split and run 3 times
Data: Data(x=[2708, 1433], y=[2708], train_mask=[2708], val_mask=[2708], test_mask=[2708], adj_t=[2708, 2708, nnz=10556])
num_train tensor(140)
num_noise 0
noise: tensor(0)
data feature 1433
ALTOPT(
  (lins): Sequential(
    (0): Linear(in_features=1433, out_features=64, bias=True)
    (1): BatchNorm1d(64, eps=1e-05, momentum=0.1, affine=True, track_running_stats=True)
    (2): Dropout(p=0.6000000000000001, inplace=True)
    (3): ReLU(inplace=True)
    (4): Linear(in_features=64, out_features=7, bias=True)
    (5): LogSoftmax(dim=-1)
  )
  (prop): Propagation(K=10, mode=None, lambda1=None, lambda2=None, L21=True, alpha=0.2)
  (gcn): GCN(
    (convs): ModuleList(
      (0): GCNConv(1433, 64)
      (1): GCNConv(64, 7)
    )
    (bns): ModuleList(
      (0): BatchNorm1d(64, eps=1e-05, momentum=0.1, affine=True, track_running_stats=True)
    )
    (output): LogSoftmax(dim=-1)
  )
)
propagate done
init label
Split: 01, Run: 01
None time:  1.478827720042318
None Run 01:
Highest Train: 100.00
Highest Valid: 80.60
  Final Train: 100.00
   Final Test: 81.20
Split: 01, Run: 02
None time:  1.7665369198657572
None Run 02:
Highest Train: 100.00
Highest Valid: 80.00
  Final Train: 100.00
   Final Test: 80.40
Split: 01, Run: 03
None time:  1.8010275780688971
None Run 03:
Highest Train: 100.00
Highest Valid: 80.20
  Final Train: 100.00
   Final Test: 81.50
run time now: 5.074968099594116
total time:  5.093217499088496
None All runs:
Highest Train: 100.00 ± 0.00
Highest Valid: 80.27 ± 0.31
  Final Train: 100.00 ± 0.00
   Final Test: 81.03 ± 0.57
[I 2023-06-12 00:19:57,338] Trial 65 finished with value: 80.26667022705078 and parameters: {'Fwd': 0.0024281581745937944, 'K': 10, 'alpha': 0.2, 'dropout': 0.6000000000000001, 'gnnepoch': 70, 'lambda1': 0.55, 'lambda2': 5.60816787166895, 'loop': 1, 'loss': 'CE', 'lr': 0.003077165066088968, 'softmaxF': True, 'useGCN': True, 'weight_decay': 0.00018786029358644577, 'weightedloss': True}. Best is trial 60 with value: 81.33333587646484.
/home/wxy/miniconda3/lib/python3.10/site-packages/optuna/distributions.py:685: UserWarning: The distribution is specified by [0, 1.00001] and step=0.05, but the range is not divisible by `step`. It will be replaced by [0, 1.0].
  warnings.warn(
K:  10
alpha:  0.25
lr:  0.0020200066048184813
weight_decay:  8.435617150268757e-05
dropout:  0.6000000000000001
fix split and run 3 times
Data: Data(x=[2708, 1433], y=[2708], train_mask=[2708], val_mask=[2708], test_mask=[2708], adj_t=[2708, 2708, nnz=10556])
num_train tensor(140)
num_noise 0
noise: tensor(0)
data feature 1433
ALTOPT(
  (lins): Sequential(
    (0): Linear(in_features=1433, out_features=64, bias=True)
    (1): BatchNorm1d(64, eps=1e-05, momentum=0.1, affine=True, track_running_stats=True)
    (2): Dropout(p=0.6000000000000001, inplace=True)
    (3): ReLU(inplace=True)
    (4): Linear(in_features=64, out_features=7, bias=True)
    (5): LogSoftmax(dim=-1)
  )
  (prop): Propagation(K=10, mode=None, lambda1=None, lambda2=None, L21=True, alpha=0.25)
  (gcn): GCN(
    (convs): ModuleList(
      (0): GCNConv(1433, 64)
      (1): GCNConv(64, 7)
    )
    (bns): ModuleList(
      (0): BatchNorm1d(64, eps=1e-05, momentum=0.1, affine=True, track_running_stats=True)
    )
    (output): LogSoftmax(dim=-1)
  )
)
propagate done
init label
Split: 01, Run: 01
None time:  1.511763557093218
None Run 01:
Highest Train: 100.00
Highest Valid: 80.20
  Final Train: 100.00
   Final Test: 80.70
Split: 01, Run: 02
None time:  1.9730986829381436
None Run 02:
Highest Train: 100.00
Highest Valid: 78.60
  Final Train: 100.00
   Final Test: 78.40
Split: 01, Run: 03
None time:  1.7344655969645828
None Run 03:
Highest Train: 100.00
Highest Valid: 79.80
  Final Train: 100.00
   Final Test: 80.30
run time now: 5.243535041809082
total time:  5.268405543873087
None All runs:
Highest Train: 100.00 ± 0.00
Highest Valid: 79.53 ± 0.83
  Final Train: 100.00 ± 0.00
   Final Test: 79.80 ± 1.23
[I 2023-06-12 00:20:03,071] Trial 66 finished with value: 79.5333251953125 and parameters: {'Fwd': 0.0023252548641165753, 'K': 10, 'alpha': 0.25, 'dropout': 0.6000000000000001, 'gnnepoch': 60, 'lambda1': 0.55, 'lambda2': 5.650533932979505, 'loop': 1, 'loss': 'CE', 'lr': 0.0020200066048184813, 'softmaxF': True, 'useGCN': True, 'weight_decay': 8.435617150268757e-05, 'weightedloss': True}. Best is trial 60 with value: 81.33333587646484.
/home/wxy/miniconda3/lib/python3.10/site-packages/optuna/distributions.py:685: UserWarning: The distribution is specified by [0, 1.00001] and step=0.05, but the range is not divisible by `step`. It will be replaced by [0, 1.0].
  warnings.warn(
K:  10
alpha:  0.15000000000000002
lr:  0.0030366084319056004
weight_decay:  0.00021032594216563284
dropout:  0.7000000000000001
fix split and run 3 times
Data: Data(x=[2708, 1433], y=[2708], train_mask=[2708], val_mask=[2708], test_mask=[2708], adj_t=[2708, 2708, nnz=10556])
num_train tensor(140)
num_noise 0
noise: tensor(0)
data feature 1433
ALTOPT(
  (lins): Sequential(
    (0): Linear(in_features=1433, out_features=64, bias=True)
    (1): BatchNorm1d(64, eps=1e-05, momentum=0.1, affine=True, track_running_stats=True)
    (2): Dropout(p=0.7000000000000001, inplace=True)
    (3): ReLU(inplace=True)
    (4): Linear(in_features=64, out_features=7, bias=True)
    (5): LogSoftmax(dim=-1)
  )
  (prop): Propagation(K=10, mode=None, lambda1=None, lambda2=None, L21=True, alpha=0.15000000000000002)
  (gcn): GCN(
    (convs): ModuleList(
      (0): GCNConv(1433, 64)
      (1): GCNConv(64, 7)
    )
    (bns): ModuleList(
      (0): BatchNorm1d(64, eps=1e-05, momentum=0.1, affine=True, track_running_stats=True)
    )
    (output): LogSoftmax(dim=-1)
  )
)
propagate done
init label
Split: 01, Run: 01
None time:  1.141911264974624
None Run 01:
Highest Train: 100.00
Highest Valid: 81.00
  Final Train: 100.00
   Final Test: 81.70
Split: 01, Run: 02
None time:  2.5659002671018243
None Run 02:
Highest Train: 100.00
Highest Valid: 80.20
  Final Train: 100.00
   Final Test: 80.80
Split: 01, Run: 03
None time:  1.8492570200469345
None Run 03:
Highest Train: 100.00
Highest Valid: 79.20
  Final Train: 100.00
   Final Test: 80.00
run time now: 5.580540895462036
total time:  5.607288046972826
None All runs:
Highest Train: 100.00 ± 0.00
Highest Valid: 80.13 ± 0.90
  Final Train: 100.00 ± 0.00
   Final Test: 80.83 ± 0.85
[I 2023-06-12 00:20:09,311] Trial 67 finished with value: 80.13333129882812 and parameters: {'Fwd': 0.0055473020537092155, 'K': 10, 'alpha': 0.15000000000000002, 'dropout': 0.7000000000000001, 'gnnepoch': 70, 'lambda1': 0.55, 'lambda2': 5.0109007184236845, 'loop': 1, 'loss': 'CE', 'lr': 0.0030366084319056004, 'softmaxF': True, 'useGCN': True, 'weight_decay': 0.00021032594216563284, 'weightedloss': True}. Best is trial 60 with value: 81.33333587646484.
/home/wxy/miniconda3/lib/python3.10/site-packages/optuna/distributions.py:685: UserWarning: The distribution is specified by [0, 1.00001] and step=0.05, but the range is not divisible by `step`. It will be replaced by [0, 1.0].
  warnings.warn(
K:  9
alpha:  0.2
lr:  0.0026562172244832564
weight_decay:  0.00019072132356604503
dropout:  0.6000000000000001
fix split and run 3 times
Data: Data(x=[2708, 1433], y=[2708], train_mask=[2708], val_mask=[2708], test_mask=[2708], adj_t=[2708, 2708, nnz=10556])
num_train tensor(140)
num_noise 0
noise: tensor(0)
data feature 1433
ALTOPT(
  (lins): Sequential(
    (0): Linear(in_features=1433, out_features=64, bias=True)
    (1): BatchNorm1d(64, eps=1e-05, momentum=0.1, affine=True, track_running_stats=True)
    (2): Dropout(p=0.6000000000000001, inplace=True)
    (3): ReLU(inplace=True)
    (4): Linear(in_features=64, out_features=7, bias=True)
    (5): LogSoftmax(dim=-1)
  )
  (prop): Propagation(K=9, mode=None, lambda1=None, lambda2=None, L21=True, alpha=0.2)
  (gcn): GCN(
    (convs): ModuleList(
      (0): GCNConv(1433, 64)
      (1): GCNConv(64, 7)
    )
    (bns): ModuleList(
      (0): BatchNorm1d(64, eps=1e-05, momentum=0.1, affine=True, track_running_stats=True)
    )
    (output): LogSoftmax(dim=-1)
  )
)
propagate done
init label
Split: 01, Run: 01
None time:  1.669934110948816
None Run 01:
Highest Train: 100.00
Highest Valid: 79.60
  Final Train: 100.00
   Final Test: 80.90
Split: 01, Run: 02
None time:  1.8820102158933878
None Run 02:
Highest Train: 100.00
Highest Valid: 79.80
  Final Train: 100.00
   Final Test: 78.90
Split: 01, Run: 03
None time:  1.421463827136904
None Run 03:
Highest Train: 100.00
Highest Valid: 78.80
  Final Train: 100.00
   Final Test: 77.40
run time now: 5.001996040344238
total time:  5.021641734056175
None All runs:
Highest Train: 100.00 ± 0.00
Highest Valid: 79.40 ± 0.53
  Final Train: 100.00 ± 0.00
   Final Test: 79.07 ± 1.76
[I 2023-06-12 00:20:14,852] Trial 68 finished with value: 79.39999389648438 and parameters: {'Fwd': 0.0039008341860264925, 'K': 9, 'alpha': 0.2, 'dropout': 0.6000000000000001, 'gnnepoch': 50, 'lambda1': 0.65, 'lambda2': 5.952651890927488, 'loop': 1, 'loss': 'CE', 'lr': 0.0026562172244832564, 'softmaxF': True, 'useGCN': True, 'weight_decay': 0.00019072132356604503, 'weightedloss': True}. Best is trial 60 with value: 81.33333587646484.
/home/wxy/miniconda3/lib/python3.10/site-packages/optuna/distributions.py:685: UserWarning: The distribution is specified by [0, 1.00001] and step=0.05, but the range is not divisible by `step`. It will be replaced by [0, 1.0].
  warnings.warn(
K:  10
alpha:  0.30000000000000004
lr:  0.0033343003088393735
weight_decay:  0.0002509094682437975
dropout:  0.5
fix split and run 3 times
Data: Data(x=[2708, 1433], y=[2708], train_mask=[2708], val_mask=[2708], test_mask=[2708], adj_t=[2708, 2708, nnz=10556])
num_train tensor(140)
num_noise 0
noise: tensor(0)
data feature 1433
ALTOPT(
  (lins): Sequential(
    (0): Linear(in_features=1433, out_features=64, bias=True)
    (1): BatchNorm1d(64, eps=1e-05, momentum=0.1, affine=True, track_running_stats=True)
    (2): Dropout(p=0.5, inplace=True)
    (3): ReLU(inplace=True)
    (4): Linear(in_features=64, out_features=7, bias=True)
    (5): LogSoftmax(dim=-1)
  )
  (prop): Propagation(K=10, mode=None, lambda1=None, lambda2=None, L21=True, alpha=0.30000000000000004)
  (gcn): GCN(
    (convs): ModuleList(
      (0): GCNConv(1433, 64)
      (1): GCNConv(64, 7)
    )
    (bns): ModuleList(
      (0): BatchNorm1d(64, eps=1e-05, momentum=0.1, affine=True, track_running_stats=True)
    )
    (output): LogSoftmax(dim=-1)
  )
)
propagate done
init label
Split: 01, Run: 01
None time:  1.3254611040465534
None Run 01:
Highest Train: 100.00
Highest Valid: 80.80
  Final Train: 100.00
   Final Test: 81.60
Split: 01, Run: 02
None time:  2.178099437151104
None Run 02:
Highest Train: 100.00
Highest Valid: 80.80
  Final Train: 100.00
   Final Test: 80.70
Split: 01, Run: 03
None time:  1.6664608279243112
None Run 03:
Highest Train: 100.00
Highest Valid: 80.40
  Final Train: 100.00
   Final Test: 79.80
run time now: 5.202834606170654
total time:  5.225694179069251
None All runs:
Highest Train: 100.00 ± 0.00
Highest Valid: 80.67 ± 0.23
  Final Train: 100.00 ± 0.00
   Final Test: 80.70 ± 0.90
[I 2023-06-12 00:20:20,662] Trial 69 finished with value: 80.66666412353516 and parameters: {'Fwd': 0.008069278628048938, 'K': 10, 'alpha': 0.30000000000000004, 'dropout': 0.5, 'gnnepoch': 60, 'lambda1': 0.5, 'lambda2': 5.522251403976448, 'loop': 1, 'loss': 'CE', 'lr': 0.0033343003088393735, 'softmaxF': True, 'useGCN': True, 'weight_decay': 0.0002509094682437975, 'weightedloss': True}. Best is trial 60 with value: 81.33333587646484.
/home/wxy/miniconda3/lib/python3.10/site-packages/optuna/distributions.py:685: UserWarning: The distribution is specified by [0, 1.00001] and step=0.05, but the range is not divisible by `step`. It will be replaced by [0, 1.0].
  warnings.warn(
K:  9
alpha:  0.35000000000000003
lr:  0.0015314850830917682
weight_decay:  0.00026253057892381776
dropout:  0.5
fix split and run 3 times
Data: Data(x=[2708, 1433], y=[2708], train_mask=[2708], val_mask=[2708], test_mask=[2708], adj_t=[2708, 2708, nnz=10556])
num_train tensor(140)
num_noise 0
noise: tensor(0)
data feature 1433
ALTOPT(
  (lins): Sequential(
    (0): Linear(in_features=1433, out_features=64, bias=True)
    (1): BatchNorm1d(64, eps=1e-05, momentum=0.1, affine=True, track_running_stats=True)
    (2): Dropout(p=0.5, inplace=True)
    (3): ReLU(inplace=True)
    (4): Linear(in_features=64, out_features=7, bias=True)
    (5): LogSoftmax(dim=-1)
  )
  (prop): Propagation(K=9, mode=None, lambda1=None, lambda2=None, L21=True, alpha=0.35000000000000003)
  (gcn): GCN(
    (convs): ModuleList(
      (0): GCNConv(1433, 64)
      (1): GCNConv(64, 7)
    )
    (bns): ModuleList(
      (0): BatchNorm1d(64, eps=1e-05, momentum=0.1, affine=True, track_running_stats=True)
    )
    (output): LogSoftmax(dim=-1)
  )
)
propagate done
init label
Split: 01, Run: 01
None time:  1.1755182538181543
None Run 01:
Highest Train: 100.00
Highest Valid: 79.40
  Final Train: 100.00
   Final Test: 79.10
Split: 01, Run: 02
None time:  1.0289009250700474
None Run 02:
Highest Train: 100.00
Highest Valid: 79.20
  Final Train: 100.00
   Final Test: 78.60
Split: 01, Run: 03
None time:  1.2974066259339452
None Run 03:
Highest Train: 100.00
Highest Valid: 81.40
  Final Train: 100.00
   Final Test: 82.00
run time now: 3.525113105773926
total time:  3.5436014330480248
None All runs:
Highest Train: 100.00 ± 0.00
Highest Valid: 80.00 ± 1.22
  Final Train: 100.00 ± 0.00
   Final Test: 79.90 ± 1.84
