[I 2023-06-12 00:29:57,457] Trial 178 finished with value: 81.46666717529297 and parameters: {'Fwd': 0.0999221099048836, 'K': 10, 'alpha': 0.65, 'dropout': 0.4, 'gnnepoch': 60, 'lambda1': 0.8500000000000001, 'lambda2': 5.312959533628305, 'loop': 1, 'loss': 'CE', 'lr': 0.008647043186261145, 'softmaxF': True, 'useGCN': True, 'weight_decay': 0.0003311254719227267, 'weightedloss': False}. Best is trial 112 with value: 81.66667175292969.
/home/wxy/miniconda3/lib/python3.10/site-packages/optuna/distributions.py:685: UserWarning: The distribution is specified by [0, 1.00001] and step=0.05, but the range is not divisible by `step`. It will be replaced by [0, 1.0].
  warnings.warn(
K:  10
alpha:  0.55
lr:  0.007167927721799556
weight_decay:  0.00011211781635076486
dropout:  0.30000000000000004
fix split and run 3 times
Data: Data(x=[2708, 1433], y=[2708], train_mask=[2708], val_mask=[2708], test_mask=[2708], adj_t=[2708, 2708, nnz=10556])
num_train tensor(140)
num_noise 0
noise: tensor(0)
data feature 1433
ALTOPT(
  (lins): Sequential(
    (0): Linear(in_features=1433, out_features=64, bias=True)
    (1): BatchNorm1d(64, eps=1e-05, momentum=0.1, affine=True, track_running_stats=True)
    (2): Dropout(p=0.30000000000000004, inplace=True)
    (3): ReLU(inplace=True)
    (4): Linear(in_features=64, out_features=7, bias=True)
    (5): LogSoftmax(dim=-1)
  )
  (prop): Propagation(K=10, mode=None, lambda1=None, lambda2=None, L21=True, alpha=0.55)
  (gcn): GCN(
    (convs): ModuleList(
      (0): GCNConv(1433, 64)
      (1): GCNConv(64, 7)
    )
    (bns): ModuleList(
      (0): BatchNorm1d(64, eps=1e-05, momentum=0.1, affine=True, track_running_stats=True)
    )
    (output): LogSoftmax(dim=-1)
  )
)
propagate done
init label
Split: 01, Run: 01
None time:  1.0014474280178547
None Run 01:
Highest Train: 100.00
Highest Valid: 81.40
  Final Train: 100.00
   Final Test: 81.60
Split: 01, Run: 02
None time:  1.5634057740680873
None Run 02:
Highest Train: 100.00
Highest Valid: 81.00
  Final Train: 100.00
   Final Test: 81.70
Split: 01, Run: 03
None time:  1.4803156058769673
None Run 03:
Highest Train: 100.00
Highest Valid: 80.20
  Final Train: 100.00
   Final Test: 81.70
run time now: 4.072375774383545
total time:  4.0923147930298
None All runs:
Highest Train: 100.00 ± 0.00
Highest Valid: 80.87 ± 0.61
  Final Train: 100.00 ± 0.00
   Final Test: 81.67 ± 0.06
[I 2023-06-12 00:30:02,101] Trial 179 finished with value: 80.86666107177734 and parameters: {'Fwd': 0.05579442598136889, 'K': 10, 'alpha': 0.55, 'dropout': 0.30000000000000004, 'gnnepoch': 50, 'lambda1': 0.9, 'lambda2': 5.598507690722227, 'loop': 1, 'loss': 'CE', 'lr': 0.007167927721799556, 'softmaxF': True, 'useGCN': True, 'weight_decay': 0.00011211781635076486, 'weightedloss': False}. Best is trial 112 with value: 81.66667175292969.
/home/wxy/miniconda3/lib/python3.10/site-packages/optuna/distributions.py:685: UserWarning: The distribution is specified by [0, 1.00001] and step=0.05, but the range is not divisible by `step`. It will be replaced by [0, 1.0].
  warnings.warn(
K:  10
alpha:  0.65
lr:  0.006097765203321831
weight_decay:  6.239860294868192e-05
dropout:  0.4
fix split and run 3 times
Data: Data(x=[2708, 1433], y=[2708], train_mask=[2708], val_mask=[2708], test_mask=[2708], adj_t=[2708, 2708, nnz=10556])
num_train tensor(140)
num_noise 0
noise: tensor(0)
data feature 1433
ALTOPT(
  (lins): Sequential(
    (0): Linear(in_features=1433, out_features=64, bias=True)
    (1): BatchNorm1d(64, eps=1e-05, momentum=0.1, affine=True, track_running_stats=True)
    (2): Dropout(p=0.4, inplace=True)
    (3): ReLU(inplace=True)
    (4): Linear(in_features=64, out_features=7, bias=True)
    (5): LogSoftmax(dim=-1)
  )
  (prop): Propagation(K=10, mode=None, lambda1=None, lambda2=None, L21=True, alpha=0.65)
  (gcn): GCN(
    (convs): ModuleList(
      (0): GCNConv(1433, 64)
      (1): GCNConv(64, 7)
    )
    (bns): ModuleList(
      (0): BatchNorm1d(64, eps=1e-05, momentum=0.1, affine=True, track_running_stats=True)
    )
    (output): LogSoftmax(dim=-1)
  )
)
propagate done
init label
Split: 01, Run: 01
None time:  1.6389344059862196
None Run 01:
Highest Train: 100.00
Highest Valid: 82.20
  Final Train: 100.00
   Final Test: 82.30
Split: 01, Run: 02
None time:  1.8207239490002394
None Run 02:
Highest Train: 100.00
Highest Valid: 80.40
  Final Train: 100.00
   Final Test: 81.10
Split: 01, Run: 03
None time:  1.8043552341405302
None Run 03:
Highest Train: 100.00
Highest Valid: 80.40
  Final Train: 100.00
   Final Test: 80.40
run time now: 5.294345378875732
total time:  5.3157052849419415
None All runs:
Highest Train: 100.00 ± 0.00
Highest Valid: 81.00 ± 1.04
  Final Train: 100.00 ± 0.00
   Final Test: 81.27 ± 0.96
[I 2023-06-12 00:30:07,927] Trial 180 finished with value: 81.0 and parameters: {'Fwd': 0.02739434573516678, 'K': 10, 'alpha': 0.65, 'dropout': 0.4, 'gnnepoch': 70, 'lambda1': 0.9500000000000001, 'lambda2': 5.906189372969873, 'loop': 1, 'loss': 'CE', 'lr': 0.006097765203321831, 'softmaxF': True, 'useGCN': True, 'weight_decay': 6.239860294868192e-05, 'weightedloss': False}. Best is trial 112 with value: 81.66667175292969.
/home/wxy/miniconda3/lib/python3.10/site-packages/optuna/distributions.py:685: UserWarning: The distribution is specified by [0, 1.00001] and step=0.05, but the range is not divisible by `step`. It will be replaced by [0, 1.0].
  warnings.warn(
K:  10
alpha:  0.7000000000000001
lr:  0.006822239967910496
weight_decay:  9.344058201258602e-05
dropout:  0.4
fix split and run 3 times
Data: Data(x=[2708, 1433], y=[2708], train_mask=[2708], val_mask=[2708], test_mask=[2708], adj_t=[2708, 2708, nnz=10556])
num_train tensor(140)
num_noise 0
noise: tensor(0)
data feature 1433
ALTOPT(
  (lins): Sequential(
    (0): Linear(in_features=1433, out_features=64, bias=True)
    (1): BatchNorm1d(64, eps=1e-05, momentum=0.1, affine=True, track_running_stats=True)
    (2): Dropout(p=0.4, inplace=True)
    (3): ReLU(inplace=True)
    (4): Linear(in_features=64, out_features=7, bias=True)
    (5): LogSoftmax(dim=-1)
  )
  (prop): Propagation(K=10, mode=None, lambda1=None, lambda2=None, L21=True, alpha=0.7000000000000001)
  (gcn): GCN(
    (convs): ModuleList(
      (0): GCNConv(1433, 64)
      (1): GCNConv(64, 7)
    )
    (bns): ModuleList(
      (0): BatchNorm1d(64, eps=1e-05, momentum=0.1, affine=True, track_running_stats=True)
    )
    (output): LogSoftmax(dim=-1)
  )
)
propagate done
init label
Split: 01, Run: 01
None time:  1.4168872660957277
None Run 01:
Highest Train: 100.00
Highest Valid: 82.20
  Final Train: 100.00
   Final Test: 82.00
Split: 01, Run: 02
None time:  1.6594467679969966
None Run 02:
Highest Train: 100.00
Highest Valid: 81.60
  Final Train: 100.00
   Final Test: 81.60
Split: 01, Run: 03
None time:  1.4964852510020137
None Run 03:
Highest Train: 100.00
Highest Valid: 80.80
  Final Train: 100.00
   Final Test: 81.10
run time now: 4.6018946170806885
total time:  4.617006431799382
None All runs:
Highest Train: 100.00 ± 0.00
Highest Valid: 81.53 ± 0.70
  Final Train: 100.00 ± 0.00
   Final Test: 81.57 ± 0.45
[I 2023-06-12 00:30:13,001] Trial 181 finished with value: 81.53333282470703 and parameters: {'Fwd': 0.06551323354851059, 'K': 10, 'alpha': 0.7000000000000001, 'dropout': 0.4, 'gnnepoch': 60, 'lambda1': 0.8500000000000001, 'lambda2': 5.390346887166908, 'loop': 1, 'loss': 'CE', 'lr': 0.006822239967910496, 'softmaxF': True, 'useGCN': True, 'weight_decay': 9.344058201258602e-05, 'weightedloss': False}. Best is trial 112 with value: 81.66667175292969.
/home/wxy/miniconda3/lib/python3.10/site-packages/optuna/distributions.py:685: UserWarning: The distribution is specified by [0, 1.00001] and step=0.05, but the range is not divisible by `step`. It will be replaced by [0, 1.0].
  warnings.warn(
K:  10
alpha:  0.6000000000000001
lr:  0.00802490659336426
weight_decay:  8.080494910888168e-05
dropout:  0.4
fix split and run 3 times
Data: Data(x=[2708, 1433], y=[2708], train_mask=[2708], val_mask=[2708], test_mask=[2708], adj_t=[2708, 2708, nnz=10556])
num_train tensor(140)
num_noise 0
noise: tensor(0)
data feature 1433
ALTOPT(
  (lins): Sequential(
    (0): Linear(in_features=1433, out_features=64, bias=True)
    (1): BatchNorm1d(64, eps=1e-05, momentum=0.1, affine=True, track_running_stats=True)
    (2): Dropout(p=0.4, inplace=True)
    (3): ReLU(inplace=True)
    (4): Linear(in_features=64, out_features=7, bias=True)
    (5): LogSoftmax(dim=-1)
  )
  (prop): Propagation(K=10, mode=None, lambda1=None, lambda2=None, L21=True, alpha=0.6000000000000001)
  (gcn): GCN(
    (convs): ModuleList(
      (0): GCNConv(1433, 64)
      (1): GCNConv(64, 7)
    )
    (bns): ModuleList(
      (0): BatchNorm1d(64, eps=1e-05, momentum=0.1, affine=True, track_running_stats=True)
    )
    (output): LogSoftmax(dim=-1)
  )
)
propagate done
init label
Split: 01, Run: 01
None time:  1.4899695399217308
None Run 01:
Highest Train: 100.00
Highest Valid: 82.00
  Final Train: 100.00
   Final Test: 82.00
Split: 01, Run: 02
None time:  1.5687140498775989
None Run 02:
Highest Train: 100.00
Highest Valid: 81.60
  Final Train: 100.00
   Final Test: 81.20
Split: 01, Run: 03
None time:  1.7466395350638777
None Run 03:
Highest Train: 100.00
Highest Valid: 80.80
  Final Train: 100.00
   Final Test: 80.40
run time now: 4.8330299854278564
total time:  4.8460142409894615
None All runs:
Highest Train: 100.00 ± 0.00
Highest Valid: 81.47 ± 0.61
  Final Train: 100.00 ± 0.00
   Final Test: 81.20 ± 0.80
[I 2023-06-12 00:30:18,365] Trial 182 finished with value: 81.46666717529297 and parameters: {'Fwd': 0.07059854401496725, 'K': 10, 'alpha': 0.6000000000000001, 'dropout': 0.4, 'gnnepoch': 60, 'lambda1': 0.8500000000000001, 'lambda2': 5.603635330155103, 'loop': 1, 'loss': 'CE', 'lr': 0.00802490659336426, 'softmaxF': True, 'useGCN': True, 'weight_decay': 8.080494910888168e-05, 'weightedloss': False}. Best is trial 112 with value: 81.66667175292969.
/home/wxy/miniconda3/lib/python3.10/site-packages/optuna/distributions.py:685: UserWarning: The distribution is specified by [0, 1.00001] and step=0.05, but the range is not divisible by `step`. It will be replaced by [0, 1.0].
  warnings.warn(
K:  10
alpha:  0.65
lr:  0.009000216709465329
weight_decay:  5.4039433988203626e-05
dropout:  0.4
fix split and run 3 times
Data: Data(x=[2708, 1433], y=[2708], train_mask=[2708], val_mask=[2708], test_mask=[2708], adj_t=[2708, 2708, nnz=10556])
num_train tensor(140)
num_noise 0
noise: tensor(0)
data feature 1433
ALTOPT(
  (lins): Sequential(
    (0): Linear(in_features=1433, out_features=64, bias=True)
    (1): BatchNorm1d(64, eps=1e-05, momentum=0.1, affine=True, track_running_stats=True)
    (2): Dropout(p=0.4, inplace=True)
    (3): ReLU(inplace=True)
    (4): Linear(in_features=64, out_features=7, bias=True)
    (5): LogSoftmax(dim=-1)
  )
  (prop): Propagation(K=10, mode=None, lambda1=None, lambda2=None, L21=True, alpha=0.65)
  (gcn): GCN(
    (convs): ModuleList(
      (0): GCNConv(1433, 64)
      (1): GCNConv(64, 7)
    )
    (bns): ModuleList(
      (0): BatchNorm1d(64, eps=1e-05, momentum=0.1, affine=True, track_running_stats=True)
    )
    (output): LogSoftmax(dim=-1)
  )
)
propagate done
init label
Split: 01, Run: 01
None time:  1.3881494970992208
None Run 01:
Highest Train: 100.00
Highest Valid: 81.80
  Final Train: 100.00
   Final Test: 82.10
Split: 01, Run: 02
None time:  1.4705594840925187
None Run 02:
Highest Train: 100.00
Highest Valid: 81.20
  Final Train: 100.00
   Final Test: 81.00
Split: 01, Run: 03
None time:  1.7715758809354156
None Run 03:
Highest Train: 100.00
Highest Valid: 80.80
  Final Train: 100.00
   Final Test: 80.90
run time now: 4.658228158950806
total time:  4.674604133935645
None All runs:
Highest Train: 100.00 ± 0.00
Highest Valid: 81.27 ± 0.50
  Final Train: 100.00 ± 0.00
   Final Test: 81.33 ± 0.67
[I 2023-06-12 00:30:23,621] Trial 183 finished with value: 81.26667022705078 and parameters: {'Fwd': 0.0378432272616789, 'K': 10, 'alpha': 0.65, 'dropout': 0.4, 'gnnepoch': 60, 'lambda1': 0.8, 'lambda2': 5.152883348068598, 'loop': 1, 'loss': 'CE', 'lr': 0.009000216709465329, 'softmaxF': True, 'useGCN': True, 'weight_decay': 5.4039433988203626e-05, 'weightedloss': False}. Best is trial 112 with value: 81.66667175292969.
/home/wxy/miniconda3/lib/python3.10/site-packages/optuna/distributions.py:685: UserWarning: The distribution is specified by [0, 1.00001] and step=0.05, but the range is not divisible by `step`. It will be replaced by [0, 1.0].
  warnings.warn(
K:  10
alpha:  0.65
lr:  0.0011656185692782736
weight_decay:  0.00010054318319316492
dropout:  0.4
fix split and run 3 times
Data: Data(x=[2708, 1433], y=[2708], train_mask=[2708], val_mask=[2708], test_mask=[2708], adj_t=[2708, 2708, nnz=10556])
num_train tensor(140)
num_noise 0
noise: tensor(0)
data feature 1433
ALTOPT(
  (lins): Sequential(
    (0): Linear(in_features=1433, out_features=64, bias=True)
    (1): BatchNorm1d(64, eps=1e-05, momentum=0.1, affine=True, track_running_stats=True)
    (2): Dropout(p=0.4, inplace=True)
    (3): ReLU(inplace=True)
    (4): Linear(in_features=64, out_features=7, bias=True)
    (5): LogSoftmax(dim=-1)
  )
  (prop): Propagation(K=10, mode=None, lambda1=None, lambda2=None, L21=True, alpha=0.65)
  (gcn): GCN(
    (convs): ModuleList(
      (0): GCNConv(1433, 64)
      (1): GCNConv(64, 7)
    )
    (bns): ModuleList(
      (0): BatchNorm1d(64, eps=1e-05, momentum=0.1, affine=True, track_running_stats=True)
    )
    (output): LogSoftmax(dim=-1)
  )
)
propagate done
init label
Split: 01, Run: 01
None time:  1.7671572479885072
None Run 01:
Highest Train: 100.00
Highest Valid: 79.60
  Final Train: 100.00
   Final Test: 79.40
Split: 01, Run: 02
None time:  1.5850537861697376
None Run 02:
Highest Train: 100.00
Highest Valid: 75.40
  Final Train: 100.00
   Final Test: 76.00
Split: 01, Run: 03
None time:  1.2234727919567376
None Run 03:
Highest Train: 100.00
Highest Valid: 75.40
  Final Train: 100.00
   Final Test: 76.80
run time now: 4.60713267326355
total time:  4.627554971957579
None All runs:
Highest Train: 100.00 ± 0.00
Highest Valid: 76.80 ± 2.42
  Final Train: 100.00 ± 0.00
   Final Test: 77.40 ± 1.78
[I 2023-06-12 00:30:28,830] Trial 184 finished with value: 76.79999542236328 and parameters: {'Fwd': 0.06355349293255387, 'K': 10, 'alpha': 0.65, 'dropout': 0.4, 'gnnepoch': 60, 'lambda1': 0.9, 'lambda2': 5.427228120146009, 'loop': 1, 'loss': 'CE', 'lr': 0.0011656185692782736, 'softmaxF': True, 'useGCN': True, 'weight_decay': 0.00010054318319316492, 'weightedloss': False}. Best is trial 112 with value: 81.66667175292969.
/home/wxy/miniconda3/lib/python3.10/site-packages/optuna/distributions.py:685: UserWarning: The distribution is specified by [0, 1.00001] and step=0.05, but the range is not divisible by `step`. It will be replaced by [0, 1.0].
  warnings.warn(
K:  10
alpha:  0.5
lr:  0.007112806282789784
weight_decay:  4.904967433987394e-05
dropout:  0.4
fix split and run 3 times
Data: Data(x=[2708, 1433], y=[2708], train_mask=[2708], val_mask=[2708], test_mask=[2708], adj_t=[2708, 2708, nnz=10556])
num_train tensor(140)
num_noise 0
noise: tensor(0)
data feature 1433
ALTOPT(
  (lins): Sequential(
    (0): Linear(in_features=1433, out_features=64, bias=True)
    (1): BatchNorm1d(64, eps=1e-05, momentum=0.1, affine=True, track_running_stats=True)
    (2): Dropout(p=0.4, inplace=True)
    (3): ReLU(inplace=True)
    (4): Linear(in_features=64, out_features=7, bias=True)
    (5): LogSoftmax(dim=-1)
  )
  (prop): Propagation(K=10, mode=None, lambda1=None, lambda2=None, L21=True, alpha=0.5)
  (gcn): GCN(
    (convs): ModuleList(
      (0): GCNConv(1433, 64)
      (1): GCNConv(64, 7)
    )
    (bns): ModuleList(
      (0): BatchNorm1d(64, eps=1e-05, momentum=0.1, affine=True, track_running_stats=True)
    )
    (output): LogSoftmax(dim=-1)
  )
)
propagate done
init label
Split: 01, Run: 01
None time:  1.65076536196284
None Run 01:
Highest Train: 100.00
Highest Valid: 82.20
  Final Train: 100.00
   Final Test: 82.30
Split: 01, Run: 02
None time:  1.650760558899492
None Run 02:
Highest Train: 100.00
Highest Valid: 81.80
  Final Train: 100.00
   Final Test: 81.80
Split: 01, Run: 03
None time:  1.4929459909908473
None Run 03:
Highest Train: 100.00
Highest Valid: 80.80
  Final Train: 100.00
   Final Test: 80.50
run time now: 4.824574708938599
total time:  4.845049232011661
None All runs:
Highest Train: 100.00 ± 0.00
Highest Valid: 81.60 ± 0.72
  Final Train: 100.00 ± 0.00
   Final Test: 81.53 ± 0.93
[I 2023-06-12 00:30:34,120] Trial 185 finished with value: 81.5999984741211 and parameters: {'Fwd': 0.07904401161208513, 'K': 10, 'alpha': 0.5, 'dropout': 0.4, 'gnnepoch': 60, 'lambda1': 0.8500000000000001, 'lambda2': 5.74048707835048, 'loop': 1, 'loss': 'CE', 'lr': 0.007112806282789784, 'softmaxF': True, 'useGCN': True, 'weight_decay': 4.904967433987394e-05, 'weightedloss': False}. Best is trial 112 with value: 81.66667175292969.
/home/wxy/miniconda3/lib/python3.10/site-packages/optuna/distributions.py:685: UserWarning: The distribution is specified by [0, 1.00001] and step=0.05, but the range is not divisible by `step`. It will be replaced by [0, 1.0].
  warnings.warn(
K:  10
alpha:  0.5
lr:  0.007648261824759848
weight_decay:  4.579768377959935e-05
dropout:  0.4
fix split and run 3 times
Data: Data(x=[2708, 1433], y=[2708], train_mask=[2708], val_mask=[2708], test_mask=[2708], adj_t=[2708, 2708, nnz=10556])
num_train tensor(140)
num_noise 0
noise: tensor(0)
data feature 1433
ALTOPT(
  (lins): Sequential(
    (0): Linear(in_features=1433, out_features=64, bias=True)
    (1): BatchNorm1d(64, eps=1e-05, momentum=0.1, affine=True, track_running_stats=True)
    (2): Dropout(p=0.4, inplace=True)
    (3): ReLU(inplace=True)
    (4): Linear(in_features=64, out_features=7, bias=True)
    (5): LogSoftmax(dim=-1)
  )
  (prop): Propagation(K=10, mode=None, lambda1=None, lambda2=None, L21=True, alpha=0.5)
  (gcn): GCN(
    (convs): ModuleList(
      (0): GCNConv(1433, 64)
      (1): GCNConv(64, 7)
    )
    (bns): ModuleList(
      (0): BatchNorm1d(64, eps=1e-05, momentum=0.1, affine=True, track_running_stats=True)
    )
    (output): LogSoftmax(dim=-1)
  )
)
propagate done
init label
Split: 01, Run: 01
None time:  1.4060356519185007
None Run 01:
Highest Train: 100.00
Highest Valid: 82.00
  Final Train: 100.00
   Final Test: 82.20
Split: 01, Run: 02
None time:  1.6504784310236573
None Run 02:
Highest Train: 100.00
Highest Valid: 81.40
  Final Train: 100.00
   Final Test: 81.50
Split: 01, Run: 03
None time:  1.7675481191836298
None Run 03:
Highest Train: 100.00
Highest Valid: 81.00
  Final Train: 100.00
   Final Test: 80.80
run time now: 4.851193189620972
total time:  4.864681167062372
None All runs:
Highest Train: 100.00 ± 0.00
Highest Valid: 81.47 ± 0.50
  Final Train: 100.00 ± 0.00
   Final Test: 81.50 ± 0.70
[I 2023-06-12 00:30:39,566] Trial 186 finished with value: 81.46666717529297 and parameters: {'Fwd': 0.09801442587813958, 'K': 10, 'alpha': 0.5, 'dropout': 0.4, 'gnnepoch': 60, 'lambda1': 0.8, 'lambda2': 5.778649799218555, 'loop': 1, 'loss': 'CE', 'lr': 0.007648261824759848, 'softmaxF': True, 'useGCN': True, 'weight_decay': 4.579768377959935e-05, 'weightedloss': False}. Best is trial 112 with value: 81.66667175292969.
/home/wxy/miniconda3/lib/python3.10/site-packages/optuna/distributions.py:685: UserWarning: The distribution is specified by [0, 1.00001] and step=0.05, but the range is not divisible by `step`. It will be replaced by [0, 1.0].
  warnings.warn(
K:  10
alpha:  0.55
lr:  0.000577973078877323
weight_decay:  3.5616309046121924e-05
dropout:  0.30000000000000004
fix split and run 3 times
Data: Data(x=[2708, 1433], y=[2708], train_mask=[2708], val_mask=[2708], test_mask=[2708], adj_t=[2708, 2708, nnz=10556])
num_train tensor(140)
num_noise 0
noise: tensor(0)
data feature 1433
ALTOPT(
  (lins): Sequential(
    (0): Linear(in_features=1433, out_features=64, bias=True)
    (1): BatchNorm1d(64, eps=1e-05, momentum=0.1, affine=True, track_running_stats=True)
    (2): Dropout(p=0.30000000000000004, inplace=True)
    (3): ReLU(inplace=True)
    (4): Linear(in_features=64, out_features=7, bias=True)
    (5): LogSoftmax(dim=-1)
  )
  (prop): Propagation(K=10, mode=None, lambda1=None, lambda2=None, L21=True, alpha=0.55)
  (gcn): GCN(
    (convs): ModuleList(
      (0): GCNConv(1433, 64)
      (1): GCNConv(64, 7)
    )
    (bns): ModuleList(
      (0): BatchNorm1d(64, eps=1e-05, momentum=0.1, affine=True, track_running_stats=True)
    )
    (output): LogSoftmax(dim=-1)
  )
)
propagate done
init label
Split: 01, Run: 01
None time:  1.8524321308359504
None Run 01:
Highest Train: 100.00
Highest Valid: 79.20
  Final Train: 100.00
   Final Test: 79.20
Split: 01, Run: 02
None time:  1.616430088179186
None Run 02:
Highest Train: 100.00
Highest Valid: 78.40
  Final Train: 100.00
   Final Test: 78.80
Split: 01, Run: 03
None time:  1.757028104038909
None Run 03:
Highest Train: 100.00
Highest Valid: 78.80
  Final Train: 100.00
   Final Test: 78.70
run time now: 5.251360654830933
total time:  5.2653729328885674
None All runs:
Highest Train: 100.00 ± 0.00
Highest Valid: 78.80 ± 0.40
  Final Train: 100.00 ± 0.00
   Final Test: 78.90 ± 0.26
