[I 2023-06-12 00:28:44,499] Trial 179 finished with value: 78.46666717529297 and parameters: {'Fwd': 1.2280535640494242e-06, 'K': 9, 'alpha': 1.0, 'dropout': 0.7000000000000001, 'gnnepoch': 60, 'lambda1': 0.6000000000000001, 'lambda2': 6.976025328596968, 'loop': 1, 'loss': 'MSE', 'lr': 0.002377874446977875, 'softmaxF': False, 'useGCN': False, 'weight_decay': 0.002076974074650159, 'weightedloss': False}. Best is trial 132 with value: 83.0666732788086.
/home/wxy/miniconda3/lib/python3.10/site-packages/optuna/distributions.py:685: UserWarning: The distribution is specified by [0, 1.00001] and step=0.05, but the range is not divisible by `step`. It will be replaced by [0, 1.0].
  warnings.warn(
K:  8
alpha:  0.9500000000000001
lr:  0.002117010183225798
weight_decay:  0.011719763625975536
dropout:  0.8
fix split and run 3 times
Data: Data(x=[19717, 500], y=[19717], train_mask=[19717], val_mask=[19717], test_mask=[19717], adj_t=[19717, 19717, nnz=88648])
num_train tensor(60)
num_noise 0
noise: tensor(0)
data feature 500
ALTOPT(
  (lins): Sequential(
    (0): Linear(in_features=500, out_features=64, bias=True)
    (1): BatchNorm1d(64, eps=1e-05, momentum=0.1, affine=True, track_running_stats=True)
    (2): Dropout(p=0.8, inplace=True)
    (3): ReLU(inplace=True)
    (4): Linear(in_features=64, out_features=3, bias=True)
    (5): Identity()
  )
  (prop): Propagation(K=8, mode=None, lambda1=None, lambda2=None, L21=True, alpha=0.9500000000000001)
  (gcn): GCN(
    (convs): ModuleList(
      (0): GCNConv(500, 64)
      (1): GCNConv(64, 3)
    )
    (bns): ModuleList(
      (0): BatchNorm1d(64, eps=1e-05, momentum=0.1, affine=True, track_running_stats=True)
    )
    (output): Identity()
  )
)
propagate done
init label
Split: 01, Run: 01
None time:  1.258819585898891
None Run 01:
Highest Train: 100.00
Highest Valid: 81.60
  Final Train: 100.00
   Final Test: 77.20
Split: 01, Run: 02
None time:  1.4402637709863484
None Run 02:
Highest Train: 100.00
Highest Valid: 82.20
  Final Train: 100.00
   Final Test: 77.70
Split: 01, Run: 03
None time:  1.9543850638438016
None Run 03:
Highest Train: 100.00
Highest Valid: 79.60
  Final Train: 100.00
   Final Test: 78.50
run time now: 4.704019784927368
total time:  4.7517657049465925
None All runs:
Highest Train: 100.00 ± 0.00
Highest Valid: 81.13 ± 1.36
  Final Train: 100.00 ± 0.00
   Final Test: 77.80 ± 0.66
[I 2023-06-12 00:28:49,828] Trial 180 finished with value: 81.13333129882812 and parameters: {'Fwd': 1.0110170681801375e-06, 'K': 8, 'alpha': 0.9500000000000001, 'dropout': 0.8, 'gnnepoch': 80, 'lambda1': 0.65, 'lambda2': 7.309856269910785, 'loop': 1, 'loss': 'MSE', 'lr': 0.002117010183225798, 'softmaxF': True, 'useGCN': False, 'weight_decay': 0.011719763625975536, 'weightedloss': False}. Best is trial 132 with value: 83.0666732788086.
/home/wxy/miniconda3/lib/python3.10/site-packages/optuna/distributions.py:685: UserWarning: The distribution is specified by [0, 1.00001] and step=0.05, but the range is not divisible by `step`. It will be replaced by [0, 1.0].
  warnings.warn(
K:  10
alpha:  0.9500000000000001
lr:  0.0026486534410087854
weight_decay:  0.0027526539031308777
dropout:  0.9
fix split and run 3 times
Data: Data(x=[19717, 500], y=[19717], train_mask=[19717], val_mask=[19717], test_mask=[19717], adj_t=[19717, 19717, nnz=88648])
num_train tensor(60)
num_noise 0
noise: tensor(0)
data feature 500
ALTOPT(
  (lins): Sequential(
    (0): Linear(in_features=500, out_features=64, bias=True)
    (1): BatchNorm1d(64, eps=1e-05, momentum=0.1, affine=True, track_running_stats=True)
    (2): Dropout(p=0.9, inplace=True)
    (3): ReLU(inplace=True)
    (4): Linear(in_features=64, out_features=3, bias=True)
    (5): Identity()
  )
  (prop): Propagation(K=10, mode=None, lambda1=None, lambda2=None, L21=True, alpha=0.9500000000000001)
  (gcn): GCN(
    (convs): ModuleList(
      (0): GCNConv(500, 64)
      (1): GCNConv(64, 3)
    )
    (bns): ModuleList(
      (0): BatchNorm1d(64, eps=1e-05, momentum=0.1, affine=True, track_running_stats=True)
    )
    (output): Identity()
  )
)
propagate done
init label
Split: 01, Run: 01
None time:  2.543815255863592
None Run 01:
Highest Train: 100.00
Highest Valid: 81.80
  Final Train: 100.00
   Final Test: 78.20
Split: 01, Run: 02, Epoch: 100, Loss: 0.1783, Train: 100.00%, Valid: 82.80% Test: 79.80%
Split: 01, Run: 02
None time:  3.6981307121459395
None Run 02:
Highest Train: 100.00
Highest Valid: 82.80
  Final Train: 100.00
   Final Test: 79.70
Split: 01, Run: 03
None time:  1.2666468620300293
None Run 03:
Highest Train: 100.00
Highest Valid: 83.00
  Final Train: 100.00
   Final Test: 80.60
run time now: 7.55649733543396
total time:  7.616403190884739
None All runs:
Highest Train: 100.00 ± 0.00
Highest Valid: 82.53 ± 0.64
  Final Train: 100.00 ± 0.00
   Final Test: 79.50 ± 1.21
[I 2023-06-12 00:28:58,086] Trial 181 finished with value: 82.53333282470703 and parameters: {'Fwd': 1.5553955811063045e-06, 'K': 10, 'alpha': 0.9500000000000001, 'dropout': 0.9, 'gnnepoch': 60, 'lambda1': 0.55, 'lambda2': 6.661797682690282, 'loop': 1, 'loss': 'MSE', 'lr': 0.0026486534410087854, 'softmaxF': True, 'useGCN': False, 'weight_decay': 0.0027526539031308777, 'weightedloss': False}. Best is trial 132 with value: 83.0666732788086.
/home/wxy/miniconda3/lib/python3.10/site-packages/optuna/distributions.py:685: UserWarning: The distribution is specified by [0, 1.00001] and step=0.05, but the range is not divisible by `step`. It will be replaced by [0, 1.0].
  warnings.warn(
K:  10
alpha:  0.9500000000000001
lr:  0.0027452614514931685
weight_decay:  0.0027071382142995265
dropout:  0.9
fix split and run 3 times
Data: Data(x=[19717, 500], y=[19717], train_mask=[19717], val_mask=[19717], test_mask=[19717], adj_t=[19717, 19717, nnz=88648])
num_train tensor(60)
num_noise 0
noise: tensor(0)
data feature 500
ALTOPT(
  (lins): Sequential(
    (0): Linear(in_features=500, out_features=64, bias=True)
    (1): BatchNorm1d(64, eps=1e-05, momentum=0.1, affine=True, track_running_stats=True)
    (2): Dropout(p=0.9, inplace=True)
    (3): ReLU(inplace=True)
    (4): Linear(in_features=64, out_features=3, bias=True)
    (5): Identity()
  )
  (prop): Propagation(K=10, mode=None, lambda1=None, lambda2=None, L21=True, alpha=0.9500000000000001)
  (gcn): GCN(
    (convs): ModuleList(
      (0): GCNConv(500, 64)
      (1): GCNConv(64, 3)
    )
    (bns): ModuleList(
      (0): BatchNorm1d(64, eps=1e-05, momentum=0.1, affine=True, track_running_stats=True)
    )
    (output): Identity()
  )
)
propagate done
init label
Split: 01, Run: 01
None time:  3.406512909801677
None Run 01:
Highest Train: 100.00
Highest Valid: 81.80
  Final Train: 100.00
   Final Test: 78.00
Split: 01, Run: 02
None time:  1.0031600389629602
None Run 02:
Highest Train: 100.00
Highest Valid: 82.80
  Final Train: 100.00
   Final Test: 79.40
Split: 01, Run: 03
None time:  2.128069797065109
None Run 03:
Highest Train: 100.00
Highest Valid: 80.80
  Final Train: 100.00
   Final Test: 77.70
run time now: 6.660618543624878
total time:  6.716263827867806
None All runs:
Highest Train: 100.00 ± 0.00
Highest Valid: 81.80 ± 1.00
  Final Train: 100.00 ± 0.00
   Final Test: 78.37 ± 0.91
[I 2023-06-12 00:29:05,409] Trial 182 finished with value: 81.80000305175781 and parameters: {'Fwd': 0.0001132033789034464, 'K': 10, 'alpha': 0.9500000000000001, 'dropout': 0.9, 'gnnepoch': 60, 'lambda1': 0.55, 'lambda2': 7.49492335714359, 'loop': 1, 'loss': 'MSE', 'lr': 0.0027452614514931685, 'softmaxF': True, 'useGCN': False, 'weight_decay': 0.0027071382142995265, 'weightedloss': False}. Best is trial 132 with value: 83.0666732788086.
/home/wxy/miniconda3/lib/python3.10/site-packages/optuna/distributions.py:685: UserWarning: The distribution is specified by [0, 1.00001] and step=0.05, but the range is not divisible by `step`. It will be replaced by [0, 1.0].
  warnings.warn(
K:  10
alpha:  0.9
lr:  0.0032425746088863773
weight_decay:  0.005013391236470936
dropout:  0.9
fix split and run 3 times
Data: Data(x=[19717, 500], y=[19717], train_mask=[19717], val_mask=[19717], test_mask=[19717], adj_t=[19717, 19717, nnz=88648])
num_train tensor(60)
num_noise 0
noise: tensor(0)
data feature 500
ALTOPT(
  (lins): Sequential(
    (0): Linear(in_features=500, out_features=64, bias=True)
    (1): BatchNorm1d(64, eps=1e-05, momentum=0.1, affine=True, track_running_stats=True)
    (2): Dropout(p=0.9, inplace=True)
    (3): ReLU(inplace=True)
    (4): Linear(in_features=64, out_features=3, bias=True)
    (5): Identity()
  )
  (prop): Propagation(K=10, mode=None, lambda1=None, lambda2=None, L21=True, alpha=0.9)
  (gcn): GCN(
    (convs): ModuleList(
      (0): GCNConv(500, 64)
      (1): GCNConv(64, 3)
    )
    (bns): ModuleList(
      (0): BatchNorm1d(64, eps=1e-05, momentum=0.1, affine=True, track_running_stats=True)
    )
    (output): Identity()
  )
)
propagate done
init label
Split: 01, Run: 01
None time:  0.882594645023346
None Run 01:
Highest Train: 100.00
Highest Valid: 69.60
  Final Train: 100.00
   Final Test: 69.50
Split: 01, Run: 02
None time:  0.7869287319481373
None Run 02:
Highest Train: 100.00
Highest Valid: 82.00
  Final Train: 100.00
   Final Test: 76.80
Split: 01, Run: 03
None time:  0.8977740840055048
None Run 03:
Highest Train: 100.00
Highest Valid: 81.40
  Final Train: 100.00
   Final Test: 79.00
run time now: 2.613738775253296
total time:  2.6640565781854093
None All runs:
Highest Train: 100.00 ± 0.00
Highest Valid: 77.67 ± 6.99
  Final Train: 100.00 ± 0.00
   Final Test: 75.10 ± 4.97
[I 2023-06-12 00:29:08,564] Trial 183 finished with value: 77.66666412353516 and parameters: {'Fwd': 1.696042363967824e-06, 'K': 10, 'alpha': 0.9, 'dropout': 0.9, 'gnnepoch': 50, 'lambda1': 0.7000000000000001, 'lambda2': 6.796998357771259, 'loop': 1, 'loss': 'MSE', 'lr': 0.0032425746088863773, 'softmaxF': True, 'useGCN': False, 'weight_decay': 0.005013391236470936, 'weightedloss': False}. Best is trial 132 with value: 83.0666732788086.
/home/wxy/miniconda3/lib/python3.10/site-packages/optuna/distributions.py:685: UserWarning: The distribution is specified by [0, 1.00001] and step=0.05, but the range is not divisible by `step`. It will be replaced by [0, 1.0].
  warnings.warn(
K:  10
alpha:  0.9500000000000001
lr:  0.0024500004324587857
weight_decay:  0.0038345260203053477
dropout:  0.9
fix split and run 3 times
Data: Data(x=[19717, 500], y=[19717], train_mask=[19717], val_mask=[19717], test_mask=[19717], adj_t=[19717, 19717, nnz=88648])
num_train tensor(60)
num_noise 0
noise: tensor(0)
data feature 500
ALTOPT(
  (lins): Sequential(
    (0): Linear(in_features=500, out_features=64, bias=True)
    (1): BatchNorm1d(64, eps=1e-05, momentum=0.1, affine=True, track_running_stats=True)
    (2): Dropout(p=0.9, inplace=True)
    (3): ReLU(inplace=True)
    (4): Linear(in_features=64, out_features=3, bias=True)
    (5): Identity()
  )
  (prop): Propagation(K=10, mode=None, lambda1=None, lambda2=None, L21=True, alpha=0.9500000000000001)
  (gcn): GCN(
    (convs): ModuleList(
      (0): GCNConv(500, 64)
      (1): GCNConv(64, 3)
    )
    (bns): ModuleList(
      (0): BatchNorm1d(64, eps=1e-05, momentum=0.1, affine=True, track_running_stats=True)
    )
    (output): Identity()
  )
)
propagate done
init label
Split: 01, Run: 01
None time:  2.2138141919858754
None Run 01:
Highest Train: 100.00
Highest Valid: 82.20
  Final Train: 100.00
   Final Test: 78.00
Split: 01, Run: 02
None time:  1.0158870329614729
None Run 02:
Highest Train: 100.00
Highest Valid: 81.20
  Final Train: 100.00
   Final Test: 77.40
Split: 01, Run: 03
None time:  1.757173146121204
None Run 03:
Highest Train: 100.00
Highest Valid: 83.40
  Final Train: 100.00
   Final Test: 80.70
run time now: 5.037136793136597
total time:  5.078507897909731
None All runs:
Highest Train: 100.00 ± 0.00
Highest Valid: 82.27 ± 1.10
  Final Train: 100.00 ± 0.00
   Final Test: 78.70 ± 1.76
[I 2023-06-12 00:29:14,131] Trial 184 finished with value: 82.26666259765625 and parameters: {'Fwd': 2.2202549507243356e-06, 'K': 10, 'alpha': 0.9500000000000001, 'dropout': 0.9, 'gnnepoch': 60, 'lambda1': 0.55, 'lambda2': 6.947506910139457, 'loop': 1, 'loss': 'MSE', 'lr': 0.0024500004324587857, 'softmaxF': True, 'useGCN': False, 'weight_decay': 0.0038345260203053477, 'weightedloss': False}. Best is trial 132 with value: 83.0666732788086.
/home/wxy/miniconda3/lib/python3.10/site-packages/optuna/distributions.py:685: UserWarning: The distribution is specified by [0, 1.00001] and step=0.05, but the range is not divisible by `step`. It will be replaced by [0, 1.0].
  warnings.warn(
K:  10
alpha:  1.0
lr:  0.0020479367215256255
weight_decay:  0.002194465081944171
dropout:  0.9
fix split and run 3 times
Data: Data(x=[19717, 500], y=[19717], train_mask=[19717], val_mask=[19717], test_mask=[19717], adj_t=[19717, 19717, nnz=88648])
num_train tensor(60)
num_noise 0
noise: tensor(0)
data feature 500
ALTOPT(
  (lins): Sequential(
    (0): Linear(in_features=500, out_features=64, bias=True)
    (1): BatchNorm1d(64, eps=1e-05, momentum=0.1, affine=True, track_running_stats=True)
    (2): Dropout(p=0.9, inplace=True)
    (3): ReLU(inplace=True)
    (4): Linear(in_features=64, out_features=3, bias=True)
    (5): Identity()
  )
  (prop): Propagation(K=10, mode=None, lambda1=None, lambda2=None, L21=True, alpha=1.0)
  (gcn): GCN(
    (convs): ModuleList(
      (0): GCNConv(500, 64)
      (1): GCNConv(64, 3)
    )
    (bns): ModuleList(
      (0): BatchNorm1d(64, eps=1e-05, momentum=0.1, affine=True, track_running_stats=True)
    )
    (output): Identity()
  )
)
propagate done
init label
Split: 01, Run: 01
None time:  1.4964926932007074
None Run 01:
Highest Train: 100.00
Highest Valid: 82.00
  Final Train: 100.00
   Final Test: 77.30
Split: 01, Run: 02
None time:  1.1134495320729911
None Run 02:
Highest Train: 100.00
Highest Valid: 80.20
  Final Train: 100.00
   Final Test: 78.40
Split: 01, Run: 03
None time:  2.4976089808624238
None Run 03:
Highest Train: 100.00
Highest Valid: 82.00
  Final Train: 100.00
   Final Test: 80.10
run time now: 5.151203870773315
total time:  5.196755556156859
None All runs:
Highest Train: 100.00 ± 0.00
Highest Valid: 81.40 ± 1.04
  Final Train: 100.00 ± 0.00
   Final Test: 78.60 ± 1.41
[I 2023-06-12 00:29:19,933] Trial 185 finished with value: 81.4000015258789 and parameters: {'Fwd': 2.86394982092235e-06, 'K': 10, 'alpha': 1.0, 'dropout': 0.9, 'gnnepoch': 70, 'lambda1': 0.6000000000000001, 'lambda2': 7.698912228387759, 'loop': 1, 'loss': 'MSE', 'lr': 0.0020479367215256255, 'softmaxF': True, 'useGCN': False, 'weight_decay': 0.002194465081944171, 'weightedloss': False}. Best is trial 132 with value: 83.0666732788086.
/home/wxy/miniconda3/lib/python3.10/site-packages/optuna/distributions.py:685: UserWarning: The distribution is specified by [0, 1.00001] and step=0.05, but the range is not divisible by `step`. It will be replaced by [0, 1.0].
  warnings.warn(
K:  9
alpha:  0.9
lr:  0.003888591243780814
weight_decay:  0.002853134233722185
dropout:  0.9
fix split and run 3 times
Data: Data(x=[19717, 500], y=[19717], train_mask=[19717], val_mask=[19717], test_mask=[19717], adj_t=[19717, 19717, nnz=88648])
num_train tensor(60)
num_noise 0
noise: tensor(0)
data feature 500
ALTOPT(
  (lins): Sequential(
    (0): Linear(in_features=500, out_features=64, bias=True)
    (1): BatchNorm1d(64, eps=1e-05, momentum=0.1, affine=True, track_running_stats=True)
    (2): Dropout(p=0.9, inplace=True)
    (3): ReLU(inplace=True)
    (4): Linear(in_features=64, out_features=3, bias=True)
    (5): Identity()
  )
  (prop): Propagation(K=9, mode=None, lambda1=None, lambda2=None, L21=True, alpha=0.9)
  (gcn): GCN(
    (convs): ModuleList(
      (0): GCNConv(500, 64)
      (1): GCNConv(64, 3)
    )
    (bns): ModuleList(
      (0): BatchNorm1d(64, eps=1e-05, momentum=0.1, affine=True, track_running_stats=True)
    )
    (output): Identity()
  )
)
propagate done
init label
Split: 01, Run: 01
None time:  2.141284819226712
None Run 01:
Highest Train: 100.00
Highest Valid: 82.60
  Final Train: 100.00
   Final Test: 78.00
Split: 01, Run: 02
None time:  1.0894253579899669
None Run 02:
Highest Train: 100.00
Highest Valid: 81.40
  Final Train: 100.00
   Final Test: 77.80
Split: 01, Run: 03
None time:  0.9781870390288532
None Run 03:
Highest Train: 100.00
Highest Valid: 82.80
  Final Train: 100.00
   Final Test: 79.60
run time now: 4.260642766952515
total time:  4.313270046142861
None All runs:
Highest Train: 100.00 ± 0.00
Highest Valid: 82.27 ± 0.76
  Final Train: 100.00 ± 0.00
   Final Test: 78.47 ± 0.99
[I 2023-06-12 00:29:24,794] Trial 186 finished with value: 82.26667022705078 and parameters: {'Fwd': 1.4079305266021304e-06, 'K': 9, 'alpha': 0.9, 'dropout': 0.9, 'gnnepoch': 70, 'lambda1': 0.5, 'lambda2': 6.320372146838928, 'loop': 1, 'loss': 'MSE', 'lr': 0.003888591243780814, 'softmaxF': True, 'useGCN': False, 'weight_decay': 0.002853134233722185, 'weightedloss': False}. Best is trial 132 with value: 83.0666732788086.
/home/wxy/miniconda3/lib/python3.10/site-packages/optuna/distributions.py:685: UserWarning: The distribution is specified by [0, 1.00001] and step=0.05, but the range is not divisible by `step`. It will be replaced by [0, 1.0].
  warnings.warn(
K:  10
alpha:  0.9500000000000001
lr:  0.002892029025806344
weight_decay:  0.0016639957287677152
dropout:  0.7000000000000001
fix split and run 3 times
Data: Data(x=[19717, 500], y=[19717], train_mask=[19717], val_mask=[19717], test_mask=[19717], adj_t=[19717, 19717, nnz=88648])
num_train tensor(60)
num_noise 0
noise: tensor(0)
data feature 500
ALTOPT(
  (lins): Sequential(
    (0): Linear(in_features=500, out_features=64, bias=True)
    (1): BatchNorm1d(64, eps=1e-05, momentum=0.1, affine=True, track_running_stats=True)
    (2): Dropout(p=0.7000000000000001, inplace=True)
    (3): ReLU(inplace=True)
    (4): Linear(in_features=64, out_features=3, bias=True)
    (5): Identity()
  )
  (prop): Propagation(K=10, mode=None, lambda1=None, lambda2=None, L21=True, alpha=0.9500000000000001)
  (gcn): GCN(
    (convs): ModuleList(
      (0): GCNConv(500, 64)
      (1): GCNConv(64, 3)
    )
    (bns): ModuleList(
      (0): BatchNorm1d(64, eps=1e-05, momentum=0.1, affine=True, track_running_stats=True)
    )
    (output): Identity()
  )
)
propagate done
init label
Split: 01, Run: 01, Epoch: 100, Loss: 0.1691, Train: 100.00%, Valid: 81.40% Test: 77.70%
Split: 01, Run: 01
None time:  3.4628151138313115
None Run 01:
Highest Train: 100.00
Highest Valid: 81.40
  Final Train: 100.00
   Final Test: 77.70
Split: 01, Run: 02
None time:  1.260499268071726
None Run 02:
Highest Train: 100.00
Highest Valid: 83.00
  Final Train: 100.00
   Final Test: 79.80
Split: 01, Run: 03
None time:  0.9864395230542868
None Run 03:
Highest Train: 100.00
Highest Valid: 81.00
  Final Train: 100.00
   Final Test: 79.60
run time now: 5.753704071044922
total time:  5.808263501850888
None All runs:
Highest Train: 100.00 ± 0.00
Highest Valid: 81.80 ± 1.06
  Final Train: 100.00 ± 0.00
   Final Test: 79.03 ± 1.16
[I 2023-06-12 00:29:31,080] Trial 187 finished with value: 81.79999542236328 and parameters: {'Fwd': 1.9009707613715906e-06, 'K': 10, 'alpha': 0.9500000000000001, 'dropout': 0.7000000000000001, 'gnnepoch': 60, 'lambda1': 0.55, 'lambda2': 6.067882614539527, 'loop': 1, 'loss': 'MSE', 'lr': 0.002892029025806344, 'softmaxF': True, 'useGCN': False, 'weight_decay': 0.0016639957287677152, 'weightedloss': False}. Best is trial 132 with value: 83.0666732788086.
/home/wxy/miniconda3/lib/python3.10/site-packages/optuna/distributions.py:685: UserWarning: The distribution is specified by [0, 1.00001] and step=0.05, but the range is not divisible by `step`. It will be replaced by [0, 1.0].
  warnings.warn(
K:  10
alpha:  1.0
lr:  0.0026022366249250904
weight_decay:  0.0009205089818882629
dropout:  0.9
fix split and run 3 times
Data: Data(x=[19717, 500], y=[19717], train_mask=[19717], val_mask=[19717], test_mask=[19717], adj_t=[19717, 19717, nnz=88648])
num_train tensor(60)
num_noise 0
noise: tensor(0)
data feature 500
ALTOPT(
  (lins): Sequential(
    (0): Linear(in_features=500, out_features=64, bias=True)
    (1): BatchNorm1d(64, eps=1e-05, momentum=0.1, affine=True, track_running_stats=True)
    (2): Dropout(p=0.9, inplace=True)
    (3): ReLU(inplace=True)
    (4): Linear(in_features=64, out_features=3, bias=True)
    (5): Identity()
  )
  (prop): Propagation(K=10, mode=None, lambda1=None, lambda2=None, L21=True, alpha=1.0)
  (gcn): GCN(
    (convs): ModuleList(
      (0): GCNConv(500, 64)
      (1): GCNConv(64, 3)
    )
    (bns): ModuleList(
      (0): BatchNorm1d(64, eps=1e-05, momentum=0.1, affine=True, track_running_stats=True)
    )
    (output): Identity()
  )
)
propagate done
init label
Split: 01, Run: 01, Epoch: 100, Loss: 0.2943, Train: 100.00%, Valid: 83.60% Test: 80.10%
Split: 01, Run: 01
None time:  3.687162356916815
None Run 01:
Highest Train: 100.00
Highest Valid: 83.60
  Final Train: 100.00
   Final Test: 79.90
Split: 01, Run: 02
None time:  3.499459713930264
None Run 02:
Highest Train: 100.00
Highest Valid: 81.00
  Final Train: 100.00
   Final Test: 79.50
Split: 01, Run: 03
None time:  1.399530858034268
None Run 03:
Highest Train: 100.00
Highest Valid: 82.20
  Final Train: 100.00
   Final Test: 79.90
run time now: 8.634522199630737
total time:  8.682868550997227
None All runs:
Highest Train: 100.00 ± 0.00
Highest Valid: 82.27 ± 1.30
  Final Train: 100.00 ± 0.00
   Final Test: 79.77 ± 0.23
