[I 2023-06-12 00:27:49,544] Trial 170 finished with value: 79.9333267211914 and parameters: {'Fwd': 2.7966136761958904e-06, 'K': 9, 'alpha': 1.0, 'dropout': 0.7000000000000001, 'gnnepoch': 50, 'lambda1': 0.45, 'lambda2': 7.363547924023588, 'loop': 1, 'loss': 'MSE', 'lr': 0.0024691747630757686, 'softmaxF': True, 'useGCN': False, 'weight_decay': 0.002704225840445123, 'weightedloss': True}. Best is trial 132 with value: 83.0666732788086.
/home/wxy/miniconda3/lib/python3.10/site-packages/optuna/distributions.py:685: UserWarning: The distribution is specified by [0, 1.00001] and step=0.05, but the range is not divisible by `step`. It will be replaced by [0, 1.0].
  warnings.warn(
K:  10
alpha:  0.9500000000000001
lr:  0.002631145383129101
weight_decay:  0.0019879600122840605
dropout:  0.9
fix split and run 3 times
Data: Data(x=[19717, 500], y=[19717], train_mask=[19717], val_mask=[19717], test_mask=[19717], adj_t=[19717, 19717, nnz=88648])
num_train tensor(60)
num_noise 0
noise: tensor(0)
data feature 500
ALTOPT(
  (lins): Sequential(
    (0): Linear(in_features=500, out_features=64, bias=True)
    (1): BatchNorm1d(64, eps=1e-05, momentum=0.1, affine=True, track_running_stats=True)
    (2): Dropout(p=0.9, inplace=True)
    (3): ReLU(inplace=True)
    (4): Linear(in_features=64, out_features=3, bias=True)
    (5): Identity()
  )
  (prop): Propagation(K=10, mode=None, lambda1=None, lambda2=None, L21=True, alpha=0.9500000000000001)
  (gcn): GCN(
    (convs): ModuleList(
      (0): GCNConv(500, 64)
      (1): GCNConv(64, 3)
    )
    (bns): ModuleList(
      (0): BatchNorm1d(64, eps=1e-05, momentum=0.1, affine=True, track_running_stats=True)
    )
    (output): Identity()
  )
)
propagate done
init label
Split: 01, Run: 01
None time:  2.5960737261921167
None Run 01:
Highest Train: 100.00
Highest Valid: 82.20
  Final Train: 100.00
   Final Test: 78.70
Split: 01, Run: 02
None time:  1.8778155951295048
None Run 02:
Highest Train: 100.00
Highest Valid: 81.40
  Final Train: 100.00
   Final Test: 79.20
Split: 01, Run: 03
None time:  2.3767365249805152
None Run 03:
Highest Train: 100.00
Highest Valid: 82.80
  Final Train: 100.00
   Final Test: 79.30
run time now: 6.905309677124023
total time:  6.950771318050101
None All runs:
Highest Train: 100.00 ± 0.00
Highest Valid: 82.13 ± 0.70
  Final Train: 100.00 ± 0.00
   Final Test: 79.07 ± 0.32
[I 2023-06-12 00:27:57,071] Trial 171 finished with value: 82.13333892822266 and parameters: {'Fwd': 1.649117019852089e-06, 'K': 10, 'alpha': 0.9500000000000001, 'dropout': 0.9, 'gnnepoch': 60, 'lambda1': 0.5, 'lambda2': 6.855930142406799, 'loop': 1, 'loss': 'MSE', 'lr': 0.002631145383129101, 'softmaxF': True, 'useGCN': False, 'weight_decay': 0.0019879600122840605, 'weightedloss': False}. Best is trial 132 with value: 83.0666732788086.
/home/wxy/miniconda3/lib/python3.10/site-packages/optuna/distributions.py:685: UserWarning: The distribution is specified by [0, 1.00001] and step=0.05, but the range is not divisible by `step`. It will be replaced by [0, 1.0].
  warnings.warn(
K:  9
alpha:  0.9500000000000001
lr:  0.0019208868366276685
weight_decay:  0.003472397118855611
dropout:  0.8
fix split and run 3 times
Data: Data(x=[19717, 500], y=[19717], train_mask=[19717], val_mask=[19717], test_mask=[19717], adj_t=[19717, 19717, nnz=88648])
num_train tensor(60)
num_noise 0
noise: tensor(0)
data feature 500
ALTOPT(
  (lins): Sequential(
    (0): Linear(in_features=500, out_features=64, bias=True)
    (1): BatchNorm1d(64, eps=1e-05, momentum=0.1, affine=True, track_running_stats=True)
    (2): Dropout(p=0.8, inplace=True)
    (3): ReLU(inplace=True)
    (4): Linear(in_features=64, out_features=3, bias=True)
    (5): Identity()
  )
  (prop): Propagation(K=9, mode=None, lambda1=None, lambda2=None, L21=True, alpha=0.9500000000000001)
  (gcn): GCN(
    (convs): ModuleList(
      (0): GCNConv(500, 64)
      (1): GCNConv(64, 3)
    )
    (bns): ModuleList(
      (0): BatchNorm1d(64, eps=1e-05, momentum=0.1, affine=True, track_running_stats=True)
    )
    (output): Identity()
  )
)
propagate done
init label
Split: 01, Run: 01
None time:  2.8857668980490416
None Run 01:
Highest Train: 100.00
Highest Valid: 82.40
  Final Train: 100.00
   Final Test: 78.70
Split: 01, Run: 02
None time:  1.8826959219295532
None Run 02:
Highest Train: 100.00
Highest Valid: 82.40
  Final Train: 100.00
   Final Test: 79.00
Split: 01, Run: 03
None time:  1.3704381149727851
None Run 03:
Highest Train: 100.00
Highest Valid: 81.20
  Final Train: 100.00
   Final Test: 79.80
run time now: 6.181226491928101
total time:  6.2291663540527225
None All runs:
Highest Train: 100.00 ± 0.00
Highest Valid: 82.00 ± 0.69
  Final Train: 100.00 ± 0.00
   Final Test: 79.17 ± 0.57
[I 2023-06-12 00:28:03,834] Trial 172 finished with value: 82.0 and parameters: {'Fwd': 1.3931574469625522e-06, 'K': 9, 'alpha': 0.9500000000000001, 'dropout': 0.8, 'gnnepoch': 60, 'lambda1': 0.5, 'lambda2': 7.2294281063302135, 'loop': 1, 'loss': 'MSE', 'lr': 0.0019208868366276685, 'softmaxF': True, 'useGCN': False, 'weight_decay': 0.003472397118855611, 'weightedloss': False}. Best is trial 132 with value: 83.0666732788086.
/home/wxy/miniconda3/lib/python3.10/site-packages/optuna/distributions.py:685: UserWarning: The distribution is specified by [0, 1.00001] and step=0.05, but the range is not divisible by `step`. It will be replaced by [0, 1.0].
  warnings.warn(
K:  9
alpha:  0.9500000000000001
lr:  0.0029624090174813727
weight_decay:  0.0015835206273858485
dropout:  0.9
fix split and run 3 times
Data: Data(x=[19717, 500], y=[19717], train_mask=[19717], val_mask=[19717], test_mask=[19717], adj_t=[19717, 19717, nnz=88648])
num_train tensor(60)
num_noise 0
noise: tensor(0)
data feature 500
ALTOPT(
  (lins): Sequential(
    (0): Linear(in_features=500, out_features=64, bias=True)
    (1): BatchNorm1d(64, eps=1e-05, momentum=0.1, affine=True, track_running_stats=True)
    (2): Dropout(p=0.9, inplace=True)
    (3): ReLU(inplace=True)
    (4): Linear(in_features=64, out_features=3, bias=True)
    (5): Identity()
  )
  (prop): Propagation(K=9, mode=None, lambda1=None, lambda2=None, L21=True, alpha=0.9500000000000001)
  (gcn): GCN(
    (convs): ModuleList(
      (0): GCNConv(500, 64)
      (1): GCNConv(64, 3)
    )
    (bns): ModuleList(
      (0): BatchNorm1d(64, eps=1e-05, momentum=0.1, affine=True, track_running_stats=True)
    )
    (output): Identity()
  )
)
propagate done
init label
Split: 01, Run: 01
None time:  2.0377588470000774
None Run 01:
Highest Train: 100.00
Highest Valid: 82.20
  Final Train: 100.00
   Final Test: 77.70
Split: 01, Run: 02
None time:  1.2318992458749563
None Run 02:
Highest Train: 100.00
Highest Valid: 82.20
  Final Train: 100.00
   Final Test: 79.00
Split: 01, Run: 03
None time:  1.2939119178336114
None Run 03:
Highest Train: 100.00
Highest Valid: 83.80
  Final Train: 100.00
   Final Test: 79.50
run time now: 4.606323480606079
total time:  4.652751039015129
None All runs:
Highest Train: 100.00 ± 0.00
Highest Valid: 82.73 ± 0.92
  Final Train: 100.00 ± 0.00
   Final Test: 78.73 ± 0.93
[I 2023-06-12 00:28:08,951] Trial 173 finished with value: 82.73333740234375 and parameters: {'Fwd': 1.942648054725819e-06, 'K': 9, 'alpha': 0.9500000000000001, 'dropout': 0.9, 'gnnepoch': 70, 'lambda1': 0.6000000000000001, 'lambda2': 7.562196621095347, 'loop': 1, 'loss': 'MSE', 'lr': 0.0029624090174813727, 'softmaxF': True, 'useGCN': False, 'weight_decay': 0.0015835206273858485, 'weightedloss': False}. Best is trial 132 with value: 83.0666732788086.
/home/wxy/miniconda3/lib/python3.10/site-packages/optuna/distributions.py:685: UserWarning: The distribution is specified by [0, 1.00001] and step=0.05, but the range is not divisible by `step`. It will be replaced by [0, 1.0].
  warnings.warn(
K:  8
alpha:  0.9
lr:  0.0029100457681997213
weight_decay:  0.0024572472844582374
dropout:  0.9
fix split and run 3 times
Data: Data(x=[19717, 500], y=[19717], train_mask=[19717], val_mask=[19717], test_mask=[19717], adj_t=[19717, 19717, nnz=88648])
num_train tensor(60)
num_noise 0
noise: tensor(0)
data feature 500
ALTOPT(
  (lins): Sequential(
    (0): Linear(in_features=500, out_features=64, bias=True)
    (1): BatchNorm1d(64, eps=1e-05, momentum=0.1, affine=True, track_running_stats=True)
    (2): Dropout(p=0.9, inplace=True)
    (3): ReLU(inplace=True)
    (4): Linear(in_features=64, out_features=3, bias=True)
    (5): Identity()
  )
  (prop): Propagation(K=8, mode=None, lambda1=None, lambda2=None, L21=True, alpha=0.9)
  (gcn): GCN(
    (convs): ModuleList(
      (0): GCNConv(500, 64)
      (1): GCNConv(64, 3)
    )
    (bns): ModuleList(
      (0): BatchNorm1d(64, eps=1e-05, momentum=0.1, affine=True, track_running_stats=True)
    )
    (output): Identity()
  )
)
propagate done
init label
Split: 01, Run: 01
None time:  2.7684899079613388
None Run 01:
Highest Train: 100.00
Highest Valid: 82.00
  Final Train: 100.00
   Final Test: 77.90
Split: 01, Run: 02
None time:  2.0376973040401936
None Run 02:
Highest Train: 100.00
Highest Valid: 83.00
  Final Train: 100.00
   Final Test: 79.00
Split: 01, Run: 03
None time:  1.3507446069270372
None Run 03:
Highest Train: 100.00
Highest Valid: 80.20
  Final Train: 100.00
   Final Test: 77.70
run time now: 6.243095397949219
total time:  6.296967045869678
None All runs:
Highest Train: 100.00 ± 0.00
Highest Valid: 81.73 ± 1.42
  Final Train: 100.00 ± 0.00
   Final Test: 78.20 ± 0.70
[I 2023-06-12 00:28:15,683] Trial 174 finished with value: 81.73332977294922 and parameters: {'Fwd': 2.013342235158801e-06, 'K': 8, 'alpha': 0.9, 'dropout': 0.9, 'gnnepoch': 70, 'lambda1': 0.6000000000000001, 'lambda2': 7.593473135222121, 'loop': 1, 'loss': 'MSE', 'lr': 0.0029100457681997213, 'softmaxF': True, 'useGCN': False, 'weight_decay': 0.0024572472844582374, 'weightedloss': False}. Best is trial 132 with value: 83.0666732788086.
/home/wxy/miniconda3/lib/python3.10/site-packages/optuna/distributions.py:685: UserWarning: The distribution is specified by [0, 1.00001] and step=0.05, but the range is not divisible by `step`. It will be replaced by [0, 1.0].
  warnings.warn(
K:  9
alpha:  0.9500000000000001
lr:  0.0035973362210344807
weight_decay:  0.0017907283714957407
dropout:  0.9
fix split and run 3 times
Data: Data(x=[19717, 500], y=[19717], train_mask=[19717], val_mask=[19717], test_mask=[19717], adj_t=[19717, 19717, nnz=88648])
num_train tensor(60)
num_noise 0
noise: tensor(0)
data feature 500
ALTOPT(
  (lins): Sequential(
    (0): Linear(in_features=500, out_features=64, bias=True)
    (1): BatchNorm1d(64, eps=1e-05, momentum=0.1, affine=True, track_running_stats=True)
    (2): Dropout(p=0.9, inplace=True)
    (3): ReLU(inplace=True)
    (4): Linear(in_features=64, out_features=3, bias=True)
    (5): Identity()
  )
  (prop): Propagation(K=9, mode=None, lambda1=None, lambda2=None, L21=True, alpha=0.9500000000000001)
  (gcn): GCN(
    (convs): ModuleList(
      (0): GCNConv(500, 64)
      (1): GCNConv(64, 3)
    )
    (bns): ModuleList(
      (0): BatchNorm1d(64, eps=1e-05, momentum=0.1, affine=True, track_running_stats=True)
    )
    (output): Identity()
  )
)
propagate done
init label
Split: 01, Run: 01
None time:  2.0044098219368607
None Run 01:
Highest Train: 100.00
Highest Valid: 82.60
  Final Train: 100.00
   Final Test: 77.80
Split: 01, Run: 02
None time:  1.0047001610510051
None Run 02:
Highest Train: 100.00
Highest Valid: 81.00
  Final Train: 100.00
   Final Test: 77.20
Split: 01, Run: 03
None time:  1.027693459065631
None Run 03:
Highest Train: 100.00
Highest Valid: 83.00
  Final Train: 100.00
   Final Test: 78.70
run time now: 4.087105989456177
total time:  4.135735121089965
None All runs:
Highest Train: 100.00 ± 0.00
Highest Valid: 82.20 ± 1.06
  Final Train: 100.00 ± 0.00
   Final Test: 77.90 ± 0.75
[I 2023-06-12 00:28:20,256] Trial 175 finished with value: 82.20000457763672 and parameters: {'Fwd': 3.6114522401360674e-06, 'K': 9, 'alpha': 0.9500000000000001, 'dropout': 0.9, 'gnnepoch': 70, 'lambda1': 0.65, 'lambda2': 5.403552210643416, 'loop': 1, 'loss': 'MSE', 'lr': 0.0035973362210344807, 'softmaxF': True, 'useGCN': False, 'weight_decay': 0.0017907283714957407, 'weightedloss': False}. Best is trial 132 with value: 83.0666732788086.
/home/wxy/miniconda3/lib/python3.10/site-packages/optuna/distributions.py:685: UserWarning: The distribution is specified by [0, 1.00001] and step=0.05, but the range is not divisible by `step`. It will be replaced by [0, 1.0].
  warnings.warn(
K:  9
alpha:  1.0
lr:  0.002279987716239378
weight_decay:  0.00332827692110524
dropout:  0.8
fix split and run 3 times
Data: Data(x=[19717, 500], y=[19717], train_mask=[19717], val_mask=[19717], test_mask=[19717], adj_t=[19717, 19717, nnz=88648])
num_train tensor(60)
num_noise 0
noise: tensor(0)
data feature 500
ALTOPT(
  (lins): Sequential(
    (0): Linear(in_features=500, out_features=64, bias=True)
    (1): BatchNorm1d(64, eps=1e-05, momentum=0.1, affine=True, track_running_stats=True)
    (2): Dropout(p=0.8, inplace=True)
    (3): ReLU(inplace=True)
    (4): Linear(in_features=64, out_features=3, bias=True)
    (5): Identity()
  )
  (prop): Propagation(K=9, mode=None, lambda1=None, lambda2=None, L21=True, alpha=1.0)
  (gcn): GCN(
    (convs): ModuleList(
      (0): GCNConv(500, 64)
      (1): GCNConv(64, 3)
    )
    (bns): ModuleList(
      (0): BatchNorm1d(64, eps=1e-05, momentum=0.1, affine=True, track_running_stats=True)
    )
    (output): Identity()
  )
)
propagate done
init label
Split: 01, Run: 01
None time:  1.1423992791678756
None Run 01:
Highest Train: 100.00
Highest Valid: 82.00
  Final Train: 100.00
   Final Test: 78.80
Split: 01, Run: 02
None time:  1.7743194890208542
None Run 02:
Highest Train: 100.00
Highest Valid: 81.20
  Final Train: 100.00
   Final Test: 77.80
Split: 01, Run: 03
None time:  1.1617765880655497
None Run 03:
Highest Train: 100.00
Highest Valid: 76.80
  Final Train: 100.00
   Final Test: 75.20
run time now: 4.124533176422119
total time:  4.176526493858546
None All runs:
Highest Train: 100.00 ± 0.00
Highest Valid: 80.00 ± 2.80
  Final Train: 100.00 ± 0.00
   Final Test: 77.27 ± 1.86
[I 2023-06-12 00:28:24,897] Trial 176 finished with value: 80.0 and parameters: {'Fwd': 4.5974066871988135e-06, 'K': 9, 'alpha': 1.0, 'dropout': 0.8, 'gnnepoch': 80, 'lambda1': 0.45, 'lambda2': 7.515221399558703, 'loop': 1, 'loss': 'MSE', 'lr': 0.002279987716239378, 'softmaxF': True, 'useGCN': False, 'weight_decay': 0.00332827692110524, 'weightedloss': False}. Best is trial 132 with value: 83.0666732788086.
/home/wxy/miniconda3/lib/python3.10/site-packages/optuna/distributions.py:685: UserWarning: The distribution is specified by [0, 1.00001] and step=0.05, but the range is not divisible by `step`. It will be replaced by [0, 1.0].
  warnings.warn(
K:  9
alpha:  0.9500000000000001
lr:  0.0030066792817003887
weight_decay:  0.001466363088841547
dropout:  0.9
fix split and run 3 times
Data: Data(x=[19717, 500], y=[19717], train_mask=[19717], val_mask=[19717], test_mask=[19717], adj_t=[19717, 19717, nnz=88648])
num_train tensor(60)
num_noise 0
noise: tensor(0)
data feature 500
ALTOPT(
  (lins): Sequential(
    (0): Linear(in_features=500, out_features=64, bias=True)
    (1): BatchNorm1d(64, eps=1e-05, momentum=0.1, affine=True, track_running_stats=True)
    (2): Dropout(p=0.9, inplace=True)
    (3): ReLU(inplace=True)
    (4): Linear(in_features=64, out_features=3, bias=True)
    (5): Identity()
  )
  (prop): Propagation(K=9, mode=None, lambda1=None, lambda2=None, L21=True, alpha=0.9500000000000001)
  (gcn): GCN(
    (convs): ModuleList(
      (0): GCNConv(500, 64)
      (1): GCNConv(64, 3)
    )
    (bns): ModuleList(
      (0): BatchNorm1d(64, eps=1e-05, momentum=0.1, affine=True, track_running_stats=True)
    )
    (output): Identity()
  )
)
propagate done
init label
Split: 01, Run: 01
None time:  1.9450769310351461
None Run 01:
Highest Train: 100.00
Highest Valid: 81.60
  Final Train: 100.00
   Final Test: 76.20
Split: 01, Run: 02
None time:  2.292615757090971
None Run 02:
Highest Train: 100.00
Highest Valid: 81.20
  Final Train: 100.00
   Final Test: 78.40
Split: 01, Run: 03
None time:  1.280073655070737
None Run 03:
Highest Train: 100.00
Highest Valid: 84.20
  Final Train: 100.00
   Final Test: 80.00
run time now: 5.567588806152344
total time:  5.609673424158245
None All runs:
Highest Train: 100.00 ± 0.00
Highest Valid: 82.33 ± 1.63
  Final Train: 100.00 ± 0.00
   Final Test: 78.20 ± 1.91
[I 2023-06-12 00:28:30,991] Trial 177 finished with value: 82.33332824707031 and parameters: {'Fwd': 2.5113237168949886e-06, 'K': 9, 'alpha': 0.9500000000000001, 'dropout': 0.9, 'gnnepoch': 70, 'lambda1': 0.75, 'lambda2': 7.828189445418801, 'loop': 1, 'loss': 'MSE', 'lr': 0.0030066792817003887, 'softmaxF': True, 'useGCN': False, 'weight_decay': 0.001466363088841547, 'weightedloss': False}. Best is trial 132 with value: 83.0666732788086.
/home/wxy/miniconda3/lib/python3.10/site-packages/optuna/distributions.py:685: UserWarning: The distribution is specified by [0, 1.00001] and step=0.05, but the range is not divisible by `step`. It will be replaced by [0, 1.0].
  warnings.warn(
K:  9
alpha:  0.9
lr:  0.0018548396649740503
weight_decay:  0.006427731499027508
dropout:  0.9
fix split and run 3 times
Data: Data(x=[19717, 500], y=[19717], train_mask=[19717], val_mask=[19717], test_mask=[19717], adj_t=[19717, 19717, nnz=88648])
num_train tensor(60)
num_noise 0
noise: tensor(0)
data feature 500
ALTOPT(
  (lins): Sequential(
    (0): Linear(in_features=500, out_features=64, bias=True)
    (1): BatchNorm1d(64, eps=1e-05, momentum=0.1, affine=True, track_running_stats=True)
    (2): Dropout(p=0.9, inplace=True)
    (3): ReLU(inplace=True)
    (4): Linear(in_features=64, out_features=3, bias=True)
    (5): Identity()
  )
  (prop): Propagation(K=9, mode=None, lambda1=None, lambda2=None, L21=True, alpha=0.9)
  (gcn): GCN(
    (convs): ModuleList(
      (0): GCNConv(500, 64)
      (1): GCNConv(64, 3)
    )
    (bns): ModuleList(
      (0): BatchNorm1d(64, eps=1e-05, momentum=0.1, affine=True, track_running_stats=True)
    )
    (output): Identity()
  )
)
propagate done
init label
Split: 01, Run: 01
None time:  1.94582844292745
None Run 01:
Highest Train: 100.00
Highest Valid: 75.60
  Final Train: 100.00
   Final Test: 74.70
Split: 01, Run: 02
None time:  5.446009895997122
None Run 02:
Highest Train: 100.00
Highest Valid: 75.80
  Final Train: 100.00
   Final Test: 73.90
Split: 01, Run: 03
None time:  1.7213339710142463
None Run 03:
Highest Train: 100.00
Highest Valid: 75.40
  Final Train: 100.00
   Final Test: 73.40
run time now: 9.159960508346558
total time:  9.210542621091008
None All runs:
Highest Train: 100.00 ± 0.00
Highest Valid: 75.60 ± 0.20
  Final Train: 100.00 ± 0.00
   Final Test: 74.00 ± 0.66
[I 2023-06-12 00:28:40,613] Trial 178 finished with value: 75.5999984741211 and parameters: {'Fwd': 1.8635447133258264e-06, 'K': 9, 'alpha': 0.9, 'dropout': 0.9, 'gnnepoch': 70, 'lambda1': 0.4, 'lambda2': 7.220980722699462, 'loop': 1, 'loss': 'MSE', 'lr': 0.0018548396649740503, 'softmaxF': True, 'useGCN': True, 'weight_decay': 0.006427731499027508, 'weightedloss': False}. Best is trial 132 with value: 83.0666732788086.
/home/wxy/miniconda3/lib/python3.10/site-packages/optuna/distributions.py:685: UserWarning: The distribution is specified by [0, 1.00001] and step=0.05, but the range is not divisible by `step`. It will be replaced by [0, 1.0].
  warnings.warn(
K:  9
alpha:  1.0
lr:  0.002377874446977875
weight_decay:  0.002076974074650159
dropout:  0.7000000000000001
fix split and run 3 times
Data: Data(x=[19717, 500], y=[19717], train_mask=[19717], val_mask=[19717], test_mask=[19717], adj_t=[19717, 19717, nnz=88648])
num_train tensor(60)
num_noise 0
noise: tensor(0)
data feature 500
ALTOPT(
  (lins): Sequential(
    (0): Linear(in_features=500, out_features=64, bias=True)
    (1): BatchNorm1d(64, eps=1e-05, momentum=0.1, affine=True, track_running_stats=True)
    (2): Dropout(p=0.7000000000000001, inplace=True)
    (3): ReLU(inplace=True)
    (4): Linear(in_features=64, out_features=3, bias=True)
    (5): Identity()
  )
  (prop): Propagation(K=9, mode=None, lambda1=None, lambda2=None, L21=True, alpha=1.0)
  (gcn): GCN(
    (convs): ModuleList(
      (0): GCNConv(500, 64)
      (1): GCNConv(64, 3)
    )
    (bns): ModuleList(
      (0): BatchNorm1d(64, eps=1e-05, momentum=0.1, affine=True, track_running_stats=True)
    )
    (output): Identity()
  )
)
propagate done
init label
Split: 01, Run: 01
None time:  1.2139634098857641
None Run 01:
Highest Train: 100.00
Highest Valid: 80.80
  Final Train: 100.00
   Final Test: 76.70
Split: 01, Run: 02
None time:  0.9846679421607405
None Run 02:
Highest Train: 100.00
Highest Valid: 78.20
  Final Train: 100.00
   Final Test: 77.30
Split: 01, Run: 03
None time:  1.0138182761147618
None Run 03:
Highest Train: 100.00
Highest Valid: 76.40
  Final Train: 100.00
   Final Test: 76.20
run time now: 3.2680232524871826
total time:  3.3145267830695957
None All runs:
Highest Train: 100.00 ± 0.00
Highest Valid: 78.47 ± 2.21
  Final Train: 100.00 ± 0.00
   Final Test: 76.73 ± 0.55
