[I 2023-06-12 00:44:29,086] Trial 341 finished with value: 81.20000457763672 and parameters: {'Fwd': 8.016492288249046e-06, 'K': 10, 'alpha': 0.9, 'dropout': 0.8, 'gnnepoch': 70, 'lambda1': 0.65, 'lambda2': 3.2325273808751556, 'loop': 1, 'loss': 'MSE', 'lr': 0.0018469273808191598, 'softmaxF': True, 'useGCN': False, 'weight_decay': 0.027358741012177997, 'weightedloss': False}. Best is trial 205 with value: 83.53333282470703.
/home/wxy/miniconda3/lib/python3.10/site-packages/optuna/distributions.py:685: UserWarning: The distribution is specified by [0, 1.00001] and step=0.05, but the range is not divisible by `step`. It will be replaced by [0, 1.0].
  warnings.warn(
K:  10
alpha:  1.0
lr:  0.002320556985714232
weight_decay:  0.022128043759419205
dropout:  0.9
fix split and run 3 times
Data: Data(x=[19717, 500], y=[19717], train_mask=[19717], val_mask=[19717], test_mask=[19717], adj_t=[19717, 19717, nnz=88648])
num_train tensor(60)
num_noise 0
noise: tensor(0)
data feature 500
ALTOPT(
  (lins): Sequential(
    (0): Linear(in_features=500, out_features=64, bias=True)
    (1): BatchNorm1d(64, eps=1e-05, momentum=0.1, affine=True, track_running_stats=True)
    (2): Dropout(p=0.9, inplace=True)
    (3): ReLU(inplace=True)
    (4): Linear(in_features=64, out_features=3, bias=True)
    (5): LogSoftmax(dim=-1)
  )
  (prop): Propagation(K=10, mode=None, lambda1=None, lambda2=None, L21=True, alpha=1.0)
  (gcn): GCN(
    (convs): ModuleList(
      (0): GCNConv(500, 64)
      (1): GCNConv(64, 3)
    )
    (bns): ModuleList(
      (0): BatchNorm1d(64, eps=1e-05, momentum=0.1, affine=True, track_running_stats=True)
    )
    (output): LogSoftmax(dim=-1)
  )
)
propagate done
init label
Split: 01, Run: 01
None time:  1.078328711912036
None Run 01:
Highest Train: 100.00
Highest Valid: 75.00
  Final Train: 100.00
   Final Test: 72.60
Split: 01, Run: 02
None time:  1.1015915151219815
None Run 02:
Highest Train: 100.00
Highest Valid: 79.00
  Final Train: 95.00
   Final Test: 77.20
Split: 01, Run: 03
None time:  0.9728797820862383
None Run 03:
Highest Train: 100.00
Highest Valid: 79.40
  Final Train: 98.33
   Final Test: 78.90
run time now: 3.203906774520874
total time:  3.249696800019592
None All runs:
Highest Train: 100.00 ± 0.00
Highest Valid: 77.80 ± 2.43
  Final Train: 97.78 ± 2.55
   Final Test: 76.23 ± 3.26
[I 2023-06-12 00:44:32,802] Trial 342 finished with value: 77.79999542236328 and parameters: {'Fwd': 6.086035092773187e-06, 'K': 10, 'alpha': 1.0, 'dropout': 0.9, 'gnnepoch': 60, 'lambda1': 0.9, 'lambda2': 3.3402078670017783, 'loop': 1, 'loss': 'CE', 'lr': 0.002320556985714232, 'softmaxF': True, 'useGCN': False, 'weight_decay': 0.022128043759419205, 'weightedloss': True}. Best is trial 205 with value: 83.53333282470703.
/home/wxy/miniconda3/lib/python3.10/site-packages/optuna/distributions.py:685: UserWarning: The distribution is specified by [0, 1.00001] and step=0.05, but the range is not divisible by `step`. It will be replaced by [0, 1.0].
  warnings.warn(
K:  10
alpha:  0.9500000000000001
lr:  0.0025705169862632765
weight_decay:  0.0006121650656885589
dropout:  0.9
fix split and run 3 times
Data: Data(x=[19717, 500], y=[19717], train_mask=[19717], val_mask=[19717], test_mask=[19717], adj_t=[19717, 19717, nnz=88648])
num_train tensor(60)
num_noise 0
noise: tensor(0)
data feature 500
ALTOPT(
  (lins): Sequential(
    (0): Linear(in_features=500, out_features=64, bias=True)
    (1): BatchNorm1d(64, eps=1e-05, momentum=0.1, affine=True, track_running_stats=True)
    (2): Dropout(p=0.9, inplace=True)
    (3): ReLU(inplace=True)
    (4): Linear(in_features=64, out_features=3, bias=True)
    (5): Identity()
  )
  (prop): Propagation(K=10, mode=None, lambda1=None, lambda2=None, L21=True, alpha=0.9500000000000001)
  (gcn): GCN(
    (convs): ModuleList(
      (0): GCNConv(500, 64)
      (1): GCNConv(64, 3)
    )
    (bns): ModuleList(
      (0): BatchNorm1d(64, eps=1e-05, momentum=0.1, affine=True, track_running_stats=True)
    )
    (output): Identity()
  )
)
propagate done
init label
Split: 01, Run: 01
None time:  2.2736588509287685
None Run 01:
Highest Train: 100.00
Highest Valid: 81.60
  Final Train: 100.00
   Final Test: 77.70
Split: 01, Run: 02
None time:  3.377647286048159
None Run 02:
Highest Train: 100.00
Highest Valid: 81.80
  Final Train: 100.00
   Final Test: 78.30
Split: 01, Run: 03
None time:  1.0920832748524845
None Run 03:
Highest Train: 100.00
Highest Valid: 82.00
  Final Train: 100.00
   Final Test: 79.30
run time now: 6.800410747528076
total time:  6.845049118855968
None All runs:
Highest Train: 100.00 ± 0.00
Highest Valid: 81.80 ± 0.20
  Final Train: 100.00 ± 0.00
   Final Test: 78.43 ± 0.81
[I 2023-06-12 00:44:40,198] Trial 343 finished with value: 81.79999542236328 and parameters: {'Fwd': 9.955911092571964e-06, 'K': 10, 'alpha': 0.9500000000000001, 'dropout': 0.9, 'gnnepoch': 60, 'lambda1': 0.75, 'lambda2': 2.69931881941504, 'loop': 1, 'loss': 'MSE', 'lr': 0.0025705169862632765, 'softmaxF': True, 'useGCN': False, 'weight_decay': 0.0006121650656885589, 'weightedloss': False}. Best is trial 205 with value: 83.53333282470703.
/home/wxy/miniconda3/lib/python3.10/site-packages/optuna/distributions.py:685: UserWarning: The distribution is specified by [0, 1.00001] and step=0.05, but the range is not divisible by `step`. It will be replaced by [0, 1.0].
  warnings.warn(
K:  10
alpha:  0.9500000000000001
lr:  0.007264202420654587
weight_decay:  0.05058863723598004
dropout:  0.9
fix split and run 3 times
Data: Data(x=[19717, 500], y=[19717], train_mask=[19717], val_mask=[19717], test_mask=[19717], adj_t=[19717, 19717, nnz=88648])
num_train tensor(60)
num_noise 0
noise: tensor(0)
data feature 500
ALTOPT(
  (lins): Sequential(
    (0): Linear(in_features=500, out_features=64, bias=True)
    (1): BatchNorm1d(64, eps=1e-05, momentum=0.1, affine=True, track_running_stats=True)
    (2): Dropout(p=0.9, inplace=True)
    (3): ReLU(inplace=True)
    (4): Linear(in_features=64, out_features=3, bias=True)
    (5): Identity()
  )
  (prop): Propagation(K=10, mode=None, lambda1=None, lambda2=None, L21=True, alpha=0.9500000000000001)
  (gcn): GCN(
    (convs): ModuleList(
      (0): GCNConv(500, 64)
      (1): GCNConv(64, 3)
    )
    (bns): ModuleList(
      (0): BatchNorm1d(64, eps=1e-05, momentum=0.1, affine=True, track_running_stats=True)
    )
    (output): Identity()
  )
)
propagate done
init label
Split: 01, Run: 01, Epoch: 100, Loss: 0.0000, Train: 100.00%, Valid: 77.20% Test: 72.80%
Split: 01, Run: 01
None time:  2.986875883070752
None Run 01:
Highest Train: 100.00
Highest Valid: 77.20
  Final Train: 100.00
   Final Test: 72.80
Split: 01, Run: 02, Epoch: 100, Loss: 0.0000, Train: 100.00%, Valid: 82.80% Test: 79.80%
Split: 01, Run: 02
None time:  2.714375547831878
None Run 02:
Highest Train: 100.00
Highest Valid: 82.80
  Final Train: 100.00
   Final Test: 79.80
Split: 01, Run: 03, Epoch: 100, Loss: 0.0000, Train: 100.00%, Valid: 82.40% Test: 80.40%
Split: 01, Run: 03
None time:  2.864100452978164
None Run 03:
Highest Train: 100.00
Highest Valid: 82.40
  Final Train: 100.00
   Final Test: 80.50
run time now: 8.614315032958984
total time:  8.654245561920106
None All runs:
Highest Train: 100.00 ± 0.00
Highest Valid: 80.80 ± 3.12
  Final Train: 100.00 ± 0.00
   Final Test: 77.70 ± 4.26
[I 2023-06-12 00:44:49,362] Trial 344 finished with value: 80.79999542236328 and parameters: {'Fwd': 3.1325111297546645e-06, 'K': 10, 'alpha': 0.9500000000000001, 'dropout': 0.9, 'gnnepoch': 70, 'lambda1': 0.8, 'lambda2': 5.328260705913914, 'loop': 0, 'loss': 'MSE', 'lr': 0.007264202420654587, 'softmaxF': False, 'useGCN': False, 'weight_decay': 0.05058863723598004, 'weightedloss': False}. Best is trial 205 with value: 83.53333282470703.
/home/wxy/miniconda3/lib/python3.10/site-packages/optuna/distributions.py:685: UserWarning: The distribution is specified by [0, 1.00001] and step=0.05, but the range is not divisible by `step`. It will be replaced by [0, 1.0].
  warnings.warn(
K:  10
alpha:  0.9
lr:  0.0028924973307273305
weight_decay:  0.07599242562336209
dropout:  0.4
fix split and run 3 times
Data: Data(x=[19717, 500], y=[19717], train_mask=[19717], val_mask=[19717], test_mask=[19717], adj_t=[19717, 19717, nnz=88648])
num_train tensor(60)
num_noise 0
noise: tensor(0)
data feature 500
ALTOPT(
  (lins): Sequential(
    (0): Linear(in_features=500, out_features=64, bias=True)
    (1): BatchNorm1d(64, eps=1e-05, momentum=0.1, affine=True, track_running_stats=True)
    (2): Dropout(p=0.4, inplace=True)
    (3): ReLU(inplace=True)
    (4): Linear(in_features=64, out_features=3, bias=True)
    (5): Identity()
  )
  (prop): Propagation(K=10, mode=None, lambda1=None, lambda2=None, L21=True, alpha=0.9)
  (gcn): GCN(
    (convs): ModuleList(
      (0): GCNConv(500, 64)
      (1): GCNConv(64, 3)
    )
    (bns): ModuleList(
      (0): BatchNorm1d(64, eps=1e-05, momentum=0.1, affine=True, track_running_stats=True)
    )
    (output): Identity()
  )
)
propagate done
init label
Split: 01, Run: 01, Epoch: 100, Loss: 0.0923, Train: 100.00%, Valid: 81.20% Test: 77.20%
Split: 01, Run: 01
None time:  3.6506194800604135
None Run 01:
Highest Train: 100.00
Highest Valid: 81.20
  Final Train: 100.00
   Final Test: 77.30
Split: 01, Run: 02
None time:  1.250342020066455
None Run 02:
Highest Train: 100.00
Highest Valid: 81.80
  Final Train: 100.00
   Final Test: 78.40
Split: 01, Run: 03
None time:  1.1014126189984381
None Run 03:
Highest Train: 100.00
Highest Valid: 81.80
  Final Train: 100.00
   Final Test: 79.20
run time now: 6.051983594894409
total time:  6.09206917299889
None All runs:
Highest Train: 100.00 ± 0.00
Highest Valid: 81.60 ± 0.35
  Final Train: 100.00 ± 0.00
   Final Test: 78.30 ± 0.95
[I 2023-06-12 00:44:55,924] Trial 345 finished with value: 81.5999984741211 and parameters: {'Fwd': 5.6070019531036375e-06, 'K': 10, 'alpha': 0.9, 'dropout': 0.4, 'gnnepoch': 60, 'lambda1': 0.8500000000000001, 'lambda2': 6.170460589983938, 'loop': 1, 'loss': 'MSE', 'lr': 0.0028924973307273305, 'softmaxF': True, 'useGCN': False, 'weight_decay': 0.07599242562336209, 'weightedloss': False}. Best is trial 205 with value: 83.53333282470703.
/home/wxy/miniconda3/lib/python3.10/site-packages/optuna/distributions.py:685: UserWarning: The distribution is specified by [0, 1.00001] and step=0.05, but the range is not divisible by `step`. It will be replaced by [0, 1.0].
  warnings.warn(
K:  10
alpha:  1.0
lr:  0.0010845947606396226
weight_decay:  0.017118285869023177
dropout:  0.9
fix split and run 3 times
Data: Data(x=[19717, 500], y=[19717], train_mask=[19717], val_mask=[19717], test_mask=[19717], adj_t=[19717, 19717, nnz=88648])
num_train tensor(60)
num_noise 0
noise: tensor(0)
data feature 500
ALTOPT(
  (lins): Sequential(
    (0): Linear(in_features=500, out_features=64, bias=True)
    (1): BatchNorm1d(64, eps=1e-05, momentum=0.1, affine=True, track_running_stats=True)
    (2): Dropout(p=0.9, inplace=True)
    (3): ReLU(inplace=True)
    (4): Linear(in_features=64, out_features=3, bias=True)
    (5): Identity()
  )
  (prop): Propagation(K=10, mode=None, lambda1=None, lambda2=None, L21=True, alpha=1.0)
  (gcn): GCN(
    (convs): ModuleList(
      (0): GCNConv(500, 64)
      (1): GCNConv(64, 3)
    )
    (bns): ModuleList(
      (0): BatchNorm1d(64, eps=1e-05, momentum=0.1, affine=True, track_running_stats=True)
    )
    (output): Identity()
  )
)
propagate done
init label
Split: 01, Run: 01
None time:  0.8761355299502611
None Run 01:
Highest Train: 100.00
Highest Valid: 69.40
  Final Train: 100.00
   Final Test: 69.20
Split: 01, Run: 02
None time:  1.6319513190537691
None Run 02:
Highest Train: 100.00
Highest Valid: 81.80
  Final Train: 100.00
   Final Test: 78.60
Split: 01, Run: 03
None time:  3.3850456830114126
None Run 03:
Highest Train: 100.00
Highest Valid: 83.00
  Final Train: 100.00
   Final Test: 79.90
run time now: 5.9430201053619385
total time:  5.990380535833538
None All runs:
Highest Train: 100.00 ± 0.00
Highest Valid: 78.07 ± 7.53
  Final Train: 100.00 ± 0.00
   Final Test: 75.90 ± 5.84
[I 2023-06-12 00:45:02,329] Trial 346 finished with value: 78.0666732788086 and parameters: {'Fwd': 7.426911489635861e-06, 'K': 10, 'alpha': 1.0, 'dropout': 0.9, 'gnnepoch': 50, 'lambda1': 0.8, 'lambda2': 4.797917929347322, 'loop': 1, 'loss': 'MSE', 'lr': 0.0010845947606396226, 'softmaxF': True, 'useGCN': False, 'weight_decay': 0.017118285869023177, 'weightedloss': False}. Best is trial 205 with value: 83.53333282470703.
/home/wxy/miniconda3/lib/python3.10/site-packages/optuna/distributions.py:685: UserWarning: The distribution is specified by [0, 1.00001] and step=0.05, but the range is not divisible by `step`. It will be replaced by [0, 1.0].
  warnings.warn(
K:  10
alpha:  0.9500000000000001
lr:  0.000804802281659029
weight_decay:  0.023272617101317672
dropout:  0.9
fix split and run 3 times
Data: Data(x=[19717, 500], y=[19717], train_mask=[19717], val_mask=[19717], test_mask=[19717], adj_t=[19717, 19717, nnz=88648])
num_train tensor(60)
num_noise 0
noise: tensor(0)
data feature 500
ALTOPT(
  (lins): Sequential(
    (0): Linear(in_features=500, out_features=64, bias=True)
    (1): BatchNorm1d(64, eps=1e-05, momentum=0.1, affine=True, track_running_stats=True)
    (2): Dropout(p=0.9, inplace=True)
    (3): ReLU(inplace=True)
    (4): Linear(in_features=64, out_features=3, bias=True)
    (5): Identity()
  )
  (prop): Propagation(K=10, mode=None, lambda1=None, lambda2=None, L21=True, alpha=0.9500000000000001)
  (gcn): GCN(
    (convs): ModuleList(
      (0): GCNConv(500, 64)
      (1): GCNConv(64, 3)
    )
    (bns): ModuleList(
      (0): BatchNorm1d(64, eps=1e-05, momentum=0.1, affine=True, track_running_stats=True)
    )
    (output): Identity()
  )
)
propagate done
init label
Split: 01, Run: 01
None time:  3.263961474876851
None Run 01:
Highest Train: 100.00
Highest Valid: 71.20
  Final Train: 100.00
   Final Test: 70.00
Split: 01, Run: 02
None time:  1.41536810901016
None Run 02:
Highest Train: 100.00
Highest Valid: 72.80
  Final Train: 100.00
   Final Test: 71.20
Split: 01, Run: 03
None time:  1.711268193088472
None Run 03:
Highest Train: 100.00
Highest Valid: 75.40
  Final Train: 100.00
   Final Test: 73.80
run time now: 6.45080828666687
total time:  6.493923943955451
None All runs:
Highest Train: 100.00 ± 0.00
Highest Valid: 73.13 ± 2.12
  Final Train: 100.00 ± 0.00
   Final Test: 71.67 ± 1.94
[I 2023-06-12 00:45:09,381] Trial 347 finished with value: 73.13333129882812 and parameters: {'Fwd': 0.00012831613384312748, 'K': 10, 'alpha': 0.9500000000000001, 'dropout': 0.9, 'gnnepoch': 60, 'lambda1': 0.6000000000000001, 'lambda2': 1.3804737662914697, 'loop': 1, 'loss': 'MSE', 'lr': 0.000804802281659029, 'softmaxF': True, 'useGCN': True, 'weight_decay': 0.023272617101317672, 'weightedloss': False}. Best is trial 205 with value: 83.53333282470703.
/home/wxy/miniconda3/lib/python3.10/site-packages/optuna/distributions.py:685: UserWarning: The distribution is specified by [0, 1.00001] and step=0.05, but the range is not divisible by `step`. It will be replaced by [0, 1.0].
  warnings.warn(
K:  10
alpha:  0.9500000000000001
lr:  0.0021210871506653836
weight_decay:  0.009916138840495256
dropout:  0.9
fix split and run 3 times
Data: Data(x=[19717, 500], y=[19717], train_mask=[19717], val_mask=[19717], test_mask=[19717], adj_t=[19717, 19717, nnz=88648])
num_train tensor(60)
num_noise 0
noise: tensor(0)
data feature 500
ALTOPT(
  (lins): Sequential(
    (0): Linear(in_features=500, out_features=64, bias=True)
    (1): BatchNorm1d(64, eps=1e-05, momentum=0.1, affine=True, track_running_stats=True)
    (2): Dropout(p=0.9, inplace=True)
    (3): ReLU(inplace=True)
    (4): Linear(in_features=64, out_features=3, bias=True)
    (5): Identity()
  )
  (prop): Propagation(K=10, mode=None, lambda1=None, lambda2=None, L21=True, alpha=0.9500000000000001)
  (gcn): GCN(
    (convs): ModuleList(
      (0): GCNConv(500, 64)
      (1): GCNConv(64, 3)
    )
    (bns): ModuleList(
      (0): BatchNorm1d(64, eps=1e-05, momentum=0.1, affine=True, track_running_stats=True)
    )
    (output): Identity()
  )
)
propagate done
init label
Split: 01, Run: 01
None time:  2.272341008996591
None Run 01:
Highest Train: 100.00
Highest Valid: 81.80
  Final Train: 100.00
   Final Test: 77.80
Split: 01, Run: 02
None time:  0.9719775340054184
None Run 02:
Highest Train: 100.00
Highest Valid: 82.80
  Final Train: 100.00
   Final Test: 79.70
Split: 01, Run: 03, Epoch: 100, Loss: 0.1623, Train: 100.00%, Valid: 83.00% Test: 80.50%
Split: 01, Run: 03
None time:  3.4832703517749906
None Run 03:
Highest Train: 100.00
Highest Valid: 83.40
  Final Train: 100.00
   Final Test: 80.30
run time now: 6.781394720077515
total time:  6.8230896750465035
None All runs:
Highest Train: 100.00 ± 0.00
Highest Valid: 82.67 ± 0.81
  Final Train: 100.00 ± 0.00
   Final Test: 79.27 ± 1.31
[I 2023-06-12 00:45:16,722] Trial 348 finished with value: 82.66666412353516 and parameters: {'Fwd': 0.00020104482351527577, 'K': 10, 'alpha': 0.9500000000000001, 'dropout': 0.9, 'gnnepoch': 60, 'lambda1': 0.75, 'lambda2': 4.272889791364597, 'loop': 1, 'loss': 'MSE', 'lr': 0.0021210871506653836, 'softmaxF': True, 'useGCN': False, 'weight_decay': 0.009916138840495256, 'weightedloss': False}. Best is trial 205 with value: 83.53333282470703.
/home/wxy/miniconda3/lib/python3.10/site-packages/optuna/distributions.py:685: UserWarning: The distribution is specified by [0, 1.00001] and step=0.05, but the range is not divisible by `step`. It will be replaced by [0, 1.0].
  warnings.warn(
K:  10
alpha:  0.9
lr:  0.003177535229472873
weight_decay:  0.012780213539169279
dropout:  0.9
fix split and run 3 times
Data: Data(x=[19717, 500], y=[19717], train_mask=[19717], val_mask=[19717], test_mask=[19717], adj_t=[19717, 19717, nnz=88648])
num_train tensor(60)
num_noise 0
noise: tensor(0)
data feature 500
ALTOPT(
  (lins): Sequential(
    (0): Linear(in_features=500, out_features=64, bias=True)
    (1): BatchNorm1d(64, eps=1e-05, momentum=0.1, affine=True, track_running_stats=True)
    (2): Dropout(p=0.9, inplace=True)
    (3): ReLU(inplace=True)
    (4): Linear(in_features=64, out_features=3, bias=True)
    (5): Identity()
  )
  (prop): Propagation(K=10, mode=None, lambda1=None, lambda2=None, L21=True, alpha=0.9)
  (gcn): GCN(
    (convs): ModuleList(
      (0): GCNConv(500, 64)
      (1): GCNConv(64, 3)
    )
    (bns): ModuleList(
      (0): BatchNorm1d(64, eps=1e-05, momentum=0.1, affine=True, track_running_stats=True)
    )
    (output): Identity()
  )
)
propagate done
init label
Split: 01, Run: 01
None time:  0.7697183229029179
None Run 01:
Highest Train: 100.00
Highest Valid: 69.60
  Final Train: 100.00
   Final Test: 69.50
Split: 01, Run: 02
None time:  0.9192236370872706
None Run 02:
Highest Train: 100.00
Highest Valid: 81.00
  Final Train: 100.00
   Final Test: 78.60
Split: 01, Run: 03
None time:  0.8953772210516036
None Run 03:
Highest Train: 100.00
Highest Valid: 81.60
  Final Train: 100.00
   Final Test: 78.40
run time now: 2.6362271308898926
total time:  2.6986691469792277
None All runs:
Highest Train: 100.00 ± 0.00
Highest Valid: 77.40 ± 6.76
  Final Train: 100.00 ± 0.00
   Final Test: 75.50 ± 5.20
[I 2023-06-12 00:45:20,097] Trial 349 finished with value: 77.4000015258789 and parameters: {'Fwd': 1.9323475792184275e-05, 'K': 10, 'alpha': 0.9, 'dropout': 0.9, 'gnnepoch': 50, 'lambda1': 0.55, 'lambda2': 6.47200281304151, 'loop': 1, 'loss': 'MSE', 'lr': 0.003177535229472873, 'softmaxF': False, 'useGCN': False, 'weight_decay': 0.012780213539169279, 'weightedloss': False}. Best is trial 205 with value: 83.53333282470703.
/home/wxy/miniconda3/lib/python3.10/site-packages/optuna/distributions.py:685: UserWarning: The distribution is specified by [0, 1.00001] and step=0.05, but the range is not divisible by `step`. It will be replaced by [0, 1.0].
  warnings.warn(
K:  10
alpha:  0.8500000000000001
lr:  0.003715087693445811
weight_decay:  0.0076627858352104625
dropout:  0.9
fix split and run 3 times
Data: Data(x=[19717, 500], y=[19717], train_mask=[19717], val_mask=[19717], test_mask=[19717], adj_t=[19717, 19717, nnz=88648])
num_train tensor(60)
num_noise 0
noise: tensor(0)
data feature 500
ALTOPT(
  (lins): Sequential(
    (0): Linear(in_features=500, out_features=64, bias=True)
    (1): BatchNorm1d(64, eps=1e-05, momentum=0.1, affine=True, track_running_stats=True)
    (2): Dropout(p=0.9, inplace=True)
    (3): ReLU(inplace=True)
    (4): Linear(in_features=64, out_features=3, bias=True)
    (5): Identity()
  )
  (prop): Propagation(K=10, mode=None, lambda1=None, lambda2=None, L21=True, alpha=0.8500000000000001)
  (gcn): GCN(
    (convs): ModuleList(
      (0): GCNConv(500, 64)
      (1): GCNConv(64, 3)
    )
    (bns): ModuleList(
      (0): BatchNorm1d(64, eps=1e-05, momentum=0.1, affine=True, track_running_stats=True)
    )
    (output): Identity()
  )
)
propagate done
init label
Split: 01, Run: 01, Epoch: 100, Loss: 0.3123, Train: 100.00%, Valid: 81.80% Test: 77.40%
Split: 01, Run: 01
None time:  3.2636944490950555
None Run 01:
Highest Train: 100.00
Highest Valid: 81.80
  Final Train: 100.00
   Final Test: 77.10
Split: 01, Run: 02
None time:  0.9808487389236689
None Run 02:
Highest Train: 100.00
Highest Valid: 82.20
  Final Train: 100.00
   Final Test: 78.10
Split: 01, Run: 03
None time:  0.9821917458903044
None Run 03:
Highest Train: 100.00
Highest Valid: 82.40
  Final Train: 100.00
   Final Test: 77.70
run time now: 5.276504039764404
total time:  5.329479311127216
None All runs:
Highest Train: 100.00 ± 0.00
Highest Valid: 82.13 ± 0.31
  Final Train: 100.00 ± 0.00
   Final Test: 77.63 ± 0.50
