[I 2023-06-12 00:36:49,575] Trial 260 finished with value: 81.53333282470703 and parameters: {'Fwd': 9.044191389581004e-06, 'K': 10, 'alpha': 0.9, 'dropout': 0.9, 'gnnepoch': 60, 'lambda1': 0.8, 'lambda2': 5.565641294654234, 'loop': 1, 'loss': 'MSE', 'lr': 0.0037594420693973013, 'softmaxF': False, 'useGCN': False, 'weight_decay': 0.007931006416958215, 'weightedloss': False}. Best is trial 205 with value: 83.53333282470703.
/home/wxy/miniconda3/lib/python3.10/site-packages/optuna/distributions.py:685: UserWarning: The distribution is specified by [0, 1.00001] and step=0.05, but the range is not divisible by `step`. It will be replaced by [0, 1.0].
  warnings.warn(
K:  10
alpha:  0.9
lr:  0.004220542147598312
weight_decay:  0.010706603200070474
dropout:  0.9
fix split and run 3 times
Data: Data(x=[19717, 500], y=[19717], train_mask=[19717], val_mask=[19717], test_mask=[19717], adj_t=[19717, 19717, nnz=88648])
num_train tensor(60)
num_noise 0
noise: tensor(0)
data feature 500
ALTOPT(
  (lins): Sequential(
    (0): Linear(in_features=500, out_features=64, bias=True)
    (1): BatchNorm1d(64, eps=1e-05, momentum=0.1, affine=True, track_running_stats=True)
    (2): Dropout(p=0.9, inplace=True)
    (3): ReLU(inplace=True)
    (4): Linear(in_features=64, out_features=3, bias=True)
    (5): Identity()
  )
  (prop): Propagation(K=10, mode=None, lambda1=None, lambda2=None, L21=True, alpha=0.9)
  (gcn): GCN(
    (convs): ModuleList(
      (0): GCNConv(500, 64)
      (1): GCNConv(64, 3)
    )
    (bns): ModuleList(
      (0): BatchNorm1d(64, eps=1e-05, momentum=0.1, affine=True, track_running_stats=True)
    )
    (output): Identity()
  )
)
propagate done
init label
Split: 01, Run: 01, Epoch: 100, Loss: 0.1967, Train: 100.00%, Valid: 83.00% Test: 78.50%
Split: 01, Run: 01
None time:  3.67192317917943
None Run 01:
Highest Train: 100.00
Highest Valid: 83.00
  Final Train: 100.00
   Final Test: 78.50
Split: 01, Run: 02
None time:  1.6246838059742004
None Run 02:
Highest Train: 100.00
Highest Valid: 82.20
  Final Train: 100.00
   Final Test: 78.30
Split: 01, Run: 03
None time:  1.5111621101386845
None Run 03:
Highest Train: 100.00
Highest Valid: 83.00
  Final Train: 100.00
   Final Test: 78.70
run time now: 6.857320308685303
total time:  6.906408621929586
None All runs:
Highest Train: 100.00 ± 0.00
Highest Valid: 82.73 ± 0.46
  Final Train: 100.00 ± 0.00
   Final Test: 78.50 ± 0.20
[I 2023-06-12 00:36:56,975] Trial 261 finished with value: 82.73333740234375 and parameters: {'Fwd': 6.325365271951268e-06, 'K': 10, 'alpha': 0.9, 'dropout': 0.9, 'gnnepoch': 60, 'lambda1': 0.9, 'lambda2': 5.976432607075159, 'loop': 1, 'loss': 'MSE', 'lr': 0.004220542147598312, 'softmaxF': False, 'useGCN': False, 'weight_decay': 0.010706603200070474, 'weightedloss': False}. Best is trial 205 with value: 83.53333282470703.
/home/wxy/miniconda3/lib/python3.10/site-packages/optuna/distributions.py:685: UserWarning: The distribution is specified by [0, 1.00001] and step=0.05, but the range is not divisible by `step`. It will be replaced by [0, 1.0].
  warnings.warn(
K:  10
alpha:  0.8500000000000001
lr:  0.003826415119726035
weight_decay:  0.008526108468834363
dropout:  0.9
fix split and run 3 times
Data: Data(x=[19717, 500], y=[19717], train_mask=[19717], val_mask=[19717], test_mask=[19717], adj_t=[19717, 19717, nnz=88648])
num_train tensor(60)
num_noise 0
noise: tensor(0)
data feature 500
ALTOPT(
  (lins): Sequential(
    (0): Linear(in_features=500, out_features=64, bias=True)
    (1): BatchNorm1d(64, eps=1e-05, momentum=0.1, affine=True, track_running_stats=True)
    (2): Dropout(p=0.9, inplace=True)
    (3): ReLU(inplace=True)
    (4): Linear(in_features=64, out_features=3, bias=True)
    (5): Identity()
  )
  (prop): Propagation(K=10, mode=None, lambda1=None, lambda2=None, L21=True, alpha=0.8500000000000001)
  (gcn): GCN(
    (convs): ModuleList(
      (0): GCNConv(500, 64)
      (1): GCNConv(64, 3)
    )
    (bns): ModuleList(
      (0): BatchNorm1d(64, eps=1e-05, momentum=0.1, affine=True, track_running_stats=True)
    )
    (output): Identity()
  )
)
propagate done
init label
Split: 01, Run: 01, Epoch: 100, Loss: 0.2468, Train: 100.00%, Valid: 81.00% Test: 77.30%
Split: 01, Run: 01
None time:  3.4127848350908607
None Run 01:
Highest Train: 100.00
Highest Valid: 81.00
  Final Train: 100.00
   Final Test: 77.20
Split: 01, Run: 02
None time:  1.1153135451022536
None Run 02:
Highest Train: 100.00
Highest Valid: 83.40
  Final Train: 100.00
   Final Test: 78.20
Split: 01, Run: 03
None time:  1.0134989109355956
None Run 03:
Highest Train: 100.00
Highest Valid: 81.20
  Final Train: 100.00
   Final Test: 78.00
run time now: 5.593188285827637
total time:  5.644110240973532
None All runs:
Highest Train: 100.00 ± 0.00
Highest Valid: 81.87 ± 1.33
  Final Train: 100.00 ± 0.00
   Final Test: 77.80 ± 0.53
[I 2023-06-12 00:37:03,089] Trial 262 finished with value: 81.86666107177734 and parameters: {'Fwd': 9.67613351045574e-06, 'K': 10, 'alpha': 0.8500000000000001, 'dropout': 0.9, 'gnnepoch': 60, 'lambda1': 0.8500000000000001, 'lambda2': 5.703905285013671, 'loop': 1, 'loss': 'MSE', 'lr': 0.003826415119726035, 'softmaxF': False, 'useGCN': False, 'weight_decay': 0.008526108468834363, 'weightedloss': False}. Best is trial 205 with value: 83.53333282470703.
/home/wxy/miniconda3/lib/python3.10/site-packages/optuna/distributions.py:685: UserWarning: The distribution is specified by [0, 1.00001] and step=0.05, but the range is not divisible by `step`. It will be replaced by [0, 1.0].
  warnings.warn(
K:  10
alpha:  0.9
lr:  0.004583353770802473
weight_decay:  0.010130716189564485
dropout:  0.9
fix split and run 3 times
Data: Data(x=[19717, 500], y=[19717], train_mask=[19717], val_mask=[19717], test_mask=[19717], adj_t=[19717, 19717, nnz=88648])
num_train tensor(60)
num_noise 0
noise: tensor(0)
data feature 500
ALTOPT(
  (lins): Sequential(
    (0): Linear(in_features=500, out_features=64, bias=True)
    (1): BatchNorm1d(64, eps=1e-05, momentum=0.1, affine=True, track_running_stats=True)
    (2): Dropout(p=0.9, inplace=True)
    (3): ReLU(inplace=True)
    (4): Linear(in_features=64, out_features=3, bias=True)
    (5): Identity()
  )
  (prop): Propagation(K=10, mode=None, lambda1=None, lambda2=None, L21=True, alpha=0.9)
  (gcn): GCN(
    (convs): ModuleList(
      (0): GCNConv(500, 64)
      (1): GCNConv(64, 3)
    )
    (bns): ModuleList(
      (0): BatchNorm1d(64, eps=1e-05, momentum=0.1, affine=True, track_running_stats=True)
    )
    (output): Identity()
  )
)
propagate done
init label
Split: 01, Run: 01
None time:  0.8595549119636416
None Run 01:
Highest Train: 100.00
Highest Valid: 69.00
  Final Train: 100.00
   Final Test: 69.30
Split: 01, Run: 02
None time:  0.9238391239196062
None Run 02:
Highest Train: 100.00
Highest Valid: 83.60
  Final Train: 100.00
   Final Test: 79.40
Split: 01, Run: 03
None time:  1.0207316959276795
None Run 03:
Highest Train: 100.00
Highest Valid: 82.80
  Final Train: 100.00
   Final Test: 78.00
run time now: 2.863971710205078
total time:  2.912839172873646
None All runs:
Highest Train: 100.00 ± 0.00
Highest Valid: 78.47 ± 8.21
  Final Train: 100.00 ± 0.00
   Final Test: 75.57 ± 5.47
[I 2023-06-12 00:37:06,570] Trial 263 finished with value: 78.46666717529297 and parameters: {'Fwd': 6.191246160616322e-06, 'K': 10, 'alpha': 0.9, 'dropout': 0.9, 'gnnepoch': 50, 'lambda1': 0.8500000000000001, 'lambda2': 5.385503235764527, 'loop': 1, 'loss': 'MSE', 'lr': 0.004583353770802473, 'softmaxF': False, 'useGCN': False, 'weight_decay': 0.010130716189564485, 'weightedloss': True}. Best is trial 205 with value: 83.53333282470703.
/home/wxy/miniconda3/lib/python3.10/site-packages/optuna/distributions.py:685: UserWarning: The distribution is specified by [0, 1.00001] and step=0.05, but the range is not divisible by `step`. It will be replaced by [0, 1.0].
  warnings.warn(
K:  10
alpha:  0.9
lr:  0.003617423894684607
weight_decay:  0.014284192576559978
dropout:  0.9
fix split and run 3 times
Data: Data(x=[19717, 500], y=[19717], train_mask=[19717], val_mask=[19717], test_mask=[19717], adj_t=[19717, 19717, nnz=88648])
num_train tensor(60)
num_noise 0
noise: tensor(0)
data feature 500
ALTOPT(
  (lins): Sequential(
    (0): Linear(in_features=500, out_features=64, bias=True)
    (1): BatchNorm1d(64, eps=1e-05, momentum=0.1, affine=True, track_running_stats=True)
    (2): Dropout(p=0.9, inplace=True)
    (3): ReLU(inplace=True)
    (4): Linear(in_features=64, out_features=3, bias=True)
    (5): Identity()
  )
  (prop): Propagation(K=10, mode=None, lambda1=None, lambda2=None, L21=True, alpha=0.9)
  (gcn): GCN(
    (convs): ModuleList(
      (0): GCNConv(500, 64)
      (1): GCNConv(64, 3)
    )
    (bns): ModuleList(
      (0): BatchNorm1d(64, eps=1e-05, momentum=0.1, affine=True, track_running_stats=True)
    )
    (output): Identity()
  )
)
propagate done
init label
Split: 01, Run: 01
None time:  0.671948374947533
None Run 01:
Highest Train: 100.00
Highest Valid: 69.40
  Final Train: 100.00
   Final Test: 69.20
Split: 01, Run: 02, Epoch: 100, Loss: 0.0000, Train: 100.00%, Valid: 80.40% Test: 77.30%
Split: 01, Run: 02
None time:  2.793456824030727
None Run 02:
Highest Train: 100.00
Highest Valid: 80.40
  Final Train: 100.00
   Final Test: 77.30
Split: 01, Run: 03, Epoch: 100, Loss: 0.0000, Train: 100.00%, Valid: 83.20% Test: 79.90%
Split: 01, Run: 03
None time:  2.4059910690411925
None Run 03:
Highest Train: 100.00
Highest Valid: 83.20
  Final Train: 100.00
   Final Test: 79.90
run time now: 5.919043064117432
total time:  5.9638637288007885
None All runs:
Highest Train: 100.00 ± 0.00
Highest Valid: 77.67 ± 7.29
  Final Train: 100.00 ± 0.00
   Final Test: 75.47 ± 5.58
[I 2023-06-12 00:37:13,139] Trial 264 finished with value: 77.66666412353516 and parameters: {'Fwd': 4.6225296918811246e-05, 'K': 10, 'alpha': 0.9, 'dropout': 0.9, 'gnnepoch': 60, 'lambda1': 0.8, 'lambda2': 6.0400530216640815, 'loop': 0, 'loss': 'MSE', 'lr': 0.003617423894684607, 'softmaxF': False, 'useGCN': False, 'weight_decay': 0.014284192576559978, 'weightedloss': False}. Best is trial 205 with value: 83.53333282470703.
/home/wxy/miniconda3/lib/python3.10/site-packages/optuna/distributions.py:685: UserWarning: The distribution is specified by [0, 1.00001] and step=0.05, but the range is not divisible by `step`. It will be replaced by [0, 1.0].
  warnings.warn(
K:  10
alpha:  0.9
lr:  0.005826163315704052
weight_decay:  0.011761606752614628
dropout:  0.9
fix split and run 3 times
Data: Data(x=[19717, 500], y=[19717], train_mask=[19717], val_mask=[19717], test_mask=[19717], adj_t=[19717, 19717, nnz=88648])
num_train tensor(60)
num_noise 0
noise: tensor(0)
data feature 500
ALTOPT(
  (lins): Sequential(
    (0): Linear(in_features=500, out_features=64, bias=True)
    (1): BatchNorm1d(64, eps=1e-05, momentum=0.1, affine=True, track_running_stats=True)
    (2): Dropout(p=0.9, inplace=True)
    (3): ReLU(inplace=True)
    (4): Linear(in_features=64, out_features=3, bias=True)
    (5): LogSoftmax(dim=-1)
  )
  (prop): Propagation(K=10, mode=None, lambda1=None, lambda2=None, L21=True, alpha=0.9)
  (gcn): GCN(
    (convs): ModuleList(
      (0): GCNConv(500, 64)
      (1): GCNConv(64, 3)
    )
    (bns): ModuleList(
      (0): BatchNorm1d(64, eps=1e-05, momentum=0.1, affine=True, track_running_stats=True)
    )
    (output): LogSoftmax(dim=-1)
  )
)
propagate done
init label
Split: 01, Run: 01
None time:  1.038012963021174
None Run 01:
Highest Train: 100.00
Highest Valid: 71.40
  Final Train: 100.00
   Final Test: 71.00
Split: 01, Run: 02
None time:  1.1112109899986535
None Run 02:
Highest Train: 100.00
Highest Valid: 82.60
  Final Train: 96.67
   Final Test: 80.70
Split: 01, Run: 03
None time:  1.0541114769876003
None Run 03:
Highest Train: 100.00
Highest Valid: 81.40
  Final Train: 96.67
   Final Test: 80.60
run time now: 3.2515664100646973
total time:  3.3006609010044485
None All runs:
Highest Train: 100.00 ± 0.00
Highest Valid: 78.47 ± 6.15
  Final Train: 97.78 ± 1.92
   Final Test: 77.43 ± 5.57
[I 2023-06-12 00:37:17,002] Trial 265 finished with value: 78.46666717529297 and parameters: {'Fwd': 1.3461590772547791e-05, 'K': 10, 'alpha': 0.9, 'dropout': 0.9, 'gnnepoch': 60, 'lambda1': 0.9, 'lambda2': 5.051982527597478, 'loop': 1, 'loss': 'CE', 'lr': 0.005826163315704052, 'softmaxF': False, 'useGCN': False, 'weight_decay': 0.011761606752614628, 'weightedloss': False}. Best is trial 205 with value: 83.53333282470703.
/home/wxy/miniconda3/lib/python3.10/site-packages/optuna/distributions.py:685: UserWarning: The distribution is specified by [0, 1.00001] and step=0.05, but the range is not divisible by `step`. It will be replaced by [0, 1.0].
  warnings.warn(
K:  10
alpha:  0.9500000000000001
lr:  0.003699722695270108
weight_decay:  0.018616676349816324
dropout:  0.9
fix split and run 3 times
Data: Data(x=[19717, 500], y=[19717], train_mask=[19717], val_mask=[19717], test_mask=[19717], adj_t=[19717, 19717, nnz=88648])
num_train tensor(60)
num_noise 0
noise: tensor(0)
data feature 500
ALTOPT(
  (lins): Sequential(
    (0): Linear(in_features=500, out_features=64, bias=True)
    (1): BatchNorm1d(64, eps=1e-05, momentum=0.1, affine=True, track_running_stats=True)
    (2): Dropout(p=0.9, inplace=True)
    (3): ReLU(inplace=True)
    (4): Linear(in_features=64, out_features=3, bias=True)
    (5): Identity()
  )
  (prop): Propagation(K=10, mode=None, lambda1=None, lambda2=None, L21=True, alpha=0.9500000000000001)
  (gcn): GCN(
    (convs): ModuleList(
      (0): GCNConv(500, 64)
      (1): GCNConv(64, 3)
    )
    (bns): ModuleList(
      (0): BatchNorm1d(64, eps=1e-05, momentum=0.1, affine=True, track_running_stats=True)
    )
    (output): Identity()
  )
)
propagate done
init label
Split: 01, Run: 01
None time:  2.4231940349563956
None Run 01:
Highest Train: 100.00
Highest Valid: 81.80
  Final Train: 100.00
   Final Test: 78.70
Split: 01, Run: 02
None time:  0.8949219819623977
None Run 02:
Highest Train: 100.00
Highest Valid: 80.80
  Final Train: 100.00
   Final Test: 78.30
Split: 01, Run: 03
None time:  1.3990410801488906
None Run 03:
Highest Train: 100.00
Highest Valid: 83.60
  Final Train: 100.00
   Final Test: 80.60
run time now: 4.775480508804321
total time:  4.819344563875347
None All runs:
Highest Train: 100.00 ± 0.00
Highest Valid: 82.07 ± 1.42
  Final Train: 100.00 ± 0.00
   Final Test: 79.20 ± 1.23
[I 2023-06-12 00:37:22,442] Trial 266 finished with value: 82.0666732788086 and parameters: {'Fwd': 5.309235720346906e-06, 'K': 10, 'alpha': 0.9500000000000001, 'dropout': 0.9, 'gnnepoch': 60, 'lambda1': 0.8, 'lambda2': 5.441408101244246, 'loop': 1, 'loss': 'MSE', 'lr': 0.003699722695270108, 'softmaxF': False, 'useGCN': False, 'weight_decay': 0.018616676349816324, 'weightedloss': False}. Best is trial 205 with value: 83.53333282470703.
/home/wxy/miniconda3/lib/python3.10/site-packages/optuna/distributions.py:685: UserWarning: The distribution is specified by [0, 1.00001] and step=0.05, but the range is not divisible by `step`. It will be replaced by [0, 1.0].
  warnings.warn(
K:  10
alpha:  0.9500000000000001
lr:  0.004465822756796875
weight_decay:  0.016883939032951708
dropout:  0.9
fix split and run 3 times
Data: Data(x=[19717, 500], y=[19717], train_mask=[19717], val_mask=[19717], test_mask=[19717], adj_t=[19717, 19717, nnz=88648])
num_train tensor(60)
num_noise 0
noise: tensor(0)
data feature 500
ALTOPT(
  (lins): Sequential(
    (0): Linear(in_features=500, out_features=64, bias=True)
    (1): BatchNorm1d(64, eps=1e-05, momentum=0.1, affine=True, track_running_stats=True)
    (2): Dropout(p=0.9, inplace=True)
    (3): ReLU(inplace=True)
    (4): Linear(in_features=64, out_features=3, bias=True)
    (5): Identity()
  )
  (prop): Propagation(K=10, mode=None, lambda1=None, lambda2=None, L21=True, alpha=0.9500000000000001)
  (gcn): GCN(
    (convs): ModuleList(
      (0): GCNConv(500, 64)
      (1): GCNConv(64, 3)
    )
    (bns): ModuleList(
      (0): BatchNorm1d(64, eps=1e-05, momentum=0.1, affine=True, track_running_stats=True)
    )
    (output): Identity()
  )
)
propagate done
init label
Split: 01, Run: 01
None time:  2.2756083451677114
None Run 01:
Highest Train: 100.00
Highest Valid: 80.60
  Final Train: 100.00
   Final Test: 77.10
Split: 01, Run: 02
None time:  1.9569325251504779
None Run 02:
Highest Train: 100.00
Highest Valid: 80.60
  Final Train: 100.00
   Final Test: 77.20
Split: 01, Run: 03
None time:  2.5475412709638476
None Run 03:
Highest Train: 100.00
Highest Valid: 83.80
  Final Train: 100.00
   Final Test: 79.70
run time now: 6.828555107116699
total time:  6.875271836062893
None All runs:
Highest Train: 100.00 ± 0.00
Highest Valid: 81.67 ± 1.85
  Final Train: 100.00 ± 0.00
   Final Test: 78.00 ± 1.47
[I 2023-06-12 00:37:29,782] Trial 267 finished with value: 81.66666412353516 and parameters: {'Fwd': 7.403722179043511e-06, 'K': 10, 'alpha': 0.9500000000000001, 'dropout': 0.9, 'gnnepoch': 60, 'lambda1': 0.8500000000000001, 'lambda2': 5.86743959099369, 'loop': 1, 'loss': 'MSE', 'lr': 0.004465822756796875, 'softmaxF': False, 'useGCN': False, 'weight_decay': 0.016883939032951708, 'weightedloss': False}. Best is trial 205 with value: 83.53333282470703.
/home/wxy/miniconda3/lib/python3.10/site-packages/optuna/distributions.py:685: UserWarning: The distribution is specified by [0, 1.00001] and step=0.05, but the range is not divisible by `step`. It will be replaced by [0, 1.0].
  warnings.warn(
K:  10
alpha:  0.9500000000000001
lr:  0.005378968670458779
weight_decay:  0.01395981073938088
dropout:  0.9
fix split and run 3 times
Data: Data(x=[19717, 500], y=[19717], train_mask=[19717], val_mask=[19717], test_mask=[19717], adj_t=[19717, 19717, nnz=88648])
num_train tensor(60)
num_noise 0
noise: tensor(0)
data feature 500
ALTOPT(
  (lins): Sequential(
    (0): Linear(in_features=500, out_features=64, bias=True)
    (1): BatchNorm1d(64, eps=1e-05, momentum=0.1, affine=True, track_running_stats=True)
    (2): Dropout(p=0.9, inplace=True)
    (3): ReLU(inplace=True)
    (4): Linear(in_features=64, out_features=3, bias=True)
    (5): Identity()
  )
  (prop): Propagation(K=10, mode=None, lambda1=None, lambda2=None, L21=True, alpha=0.9500000000000001)
  (gcn): GCN(
    (convs): ModuleList(
      (0): GCNConv(500, 64)
      (1): GCNConv(64, 3)
    )
    (bns): ModuleList(
      (0): BatchNorm1d(64, eps=1e-05, momentum=0.1, affine=True, track_running_stats=True)
    )
    (output): Identity()
  )
)
propagate done
init label
Split: 01, Run: 01
None time:  2.342423927038908
None Run 01:
Highest Train: 100.00
Highest Valid: 81.60
  Final Train: 100.00
   Final Test: 77.90
Split: 01, Run: 02
None time:  1.2352108568884432
None Run 02:
Highest Train: 100.00
Highest Valid: 82.00
  Final Train: 100.00
   Final Test: 79.30
Split: 01, Run: 03
None time:  1.573701350018382
None Run 03:
Highest Train: 100.00
Highest Valid: 84.00
  Final Train: 100.00
   Final Test: 78.90
run time now: 5.198871612548828
total time:  5.251242893980816
None All runs:
Highest Train: 100.00 ± 0.00
Highest Valid: 82.53 ± 1.29
  Final Train: 100.00 ± 0.00
   Final Test: 78.70 ± 0.72
[I 2023-06-12 00:37:35,628] Trial 268 finished with value: 82.53333282470703 and parameters: {'Fwd': 4.901198813271818e-06, 'K': 10, 'alpha': 0.9500000000000001, 'dropout': 0.9, 'gnnepoch': 60, 'lambda1': 0.9500000000000001, 'lambda2': 5.689587402238125, 'loop': 1, 'loss': 'MSE', 'lr': 0.005378968670458779, 'softmaxF': False, 'useGCN': False, 'weight_decay': 0.01395981073938088, 'weightedloss': False}. Best is trial 205 with value: 83.53333282470703.
/home/wxy/miniconda3/lib/python3.10/site-packages/optuna/distributions.py:685: UserWarning: The distribution is specified by [0, 1.00001] and step=0.05, but the range is not divisible by `step`. It will be replaced by [0, 1.0].
  warnings.warn(
K:  10
alpha:  0.9
lr:  0.0038815971543658652
weight_decay:  0.008552208073299407
dropout:  0.9
fix split and run 3 times
Data: Data(x=[19717, 500], y=[19717], train_mask=[19717], val_mask=[19717], test_mask=[19717], adj_t=[19717, 19717, nnz=88648])
num_train tensor(60)
num_noise 0
noise: tensor(0)
data feature 500
ALTOPT(
  (lins): Sequential(
    (0): Linear(in_features=500, out_features=64, bias=True)
    (1): BatchNorm1d(64, eps=1e-05, momentum=0.1, affine=True, track_running_stats=True)
    (2): Dropout(p=0.9, inplace=True)
    (3): ReLU(inplace=True)
    (4): Linear(in_features=64, out_features=3, bias=True)
    (5): Identity()
  )
  (prop): Propagation(K=10, mode=None, lambda1=None, lambda2=None, L21=True, alpha=0.9)
  (gcn): GCN(
    (convs): ModuleList(
      (0): GCNConv(500, 64)
      (1): GCNConv(64, 3)
    )
    (bns): ModuleList(
      (0): BatchNorm1d(64, eps=1e-05, momentum=0.1, affine=True, track_running_stats=True)
    )
    (output): Identity()
  )
)
propagate done
init label
Split: 01, Run: 01
None time:  2.733189052902162
None Run 01:
Highest Train: 100.00
Highest Valid: 83.00
  Final Train: 100.00
   Final Test: 77.80
Split: 01, Run: 02
None time:  1.002443270990625
None Run 02:
Highest Train: 100.00
Highest Valid: 80.80
  Final Train: 100.00
   Final Test: 78.70
Split: 01, Run: 03
None time:  1.0382444609422237
None Run 03:
Highest Train: 100.00
Highest Valid: 81.40
  Final Train: 100.00
   Final Test: 78.90
run time now: 4.82464075088501
total time:  4.881024644942954
None All runs:
Highest Train: 100.00 ± 0.00
Highest Valid: 81.73 ± 1.14
  Final Train: 100.00 ± 0.00
   Final Test: 78.47 ± 0.59
