[I 2023-06-12 00:42:44,535] Trial 323 finished with value: 78.9333267211914 and parameters: {'Fwd': 2.6215331667667298e-05, 'K': 10, 'alpha': 0.9500000000000001, 'dropout': 0.9, 'gnnepoch': 70, 'lambda1': 0.9, 'lambda2': 5.90354525583274, 'loop': 1, 'loss': 'CE', 'lr': 0.0020273810338636636, 'softmaxF': True, 'useGCN': False, 'weight_decay': 0.004935283981066827, 'weightedloss': False}. Best is trial 205 with value: 83.53333282470703.
/home/wxy/miniconda3/lib/python3.10/site-packages/optuna/distributions.py:685: UserWarning: The distribution is specified by [0, 1.00001] and step=0.05, but the range is not divisible by `step`. It will be replaced by [0, 1.0].
  warnings.warn(
K:  10
alpha:  0.9
lr:  0.0032105192402768342
weight_decay:  0.027894744228019092
dropout:  0.9
fix split and run 3 times
Data: Data(x=[19717, 500], y=[19717], train_mask=[19717], val_mask=[19717], test_mask=[19717], adj_t=[19717, 19717, nnz=88648])
num_train tensor(60)
num_noise 0
noise: tensor(0)
data feature 500
ALTOPT(
  (lins): Sequential(
    (0): Linear(in_features=500, out_features=64, bias=True)
    (1): BatchNorm1d(64, eps=1e-05, momentum=0.1, affine=True, track_running_stats=True)
    (2): Dropout(p=0.9, inplace=True)
    (3): ReLU(inplace=True)
    (4): Linear(in_features=64, out_features=3, bias=True)
    (5): Identity()
  )
  (prop): Propagation(K=10, mode=None, lambda1=None, lambda2=None, L21=True, alpha=0.9)
  (gcn): GCN(
    (convs): ModuleList(
      (0): GCNConv(500, 64)
      (1): GCNConv(64, 3)
    )
    (bns): ModuleList(
      (0): BatchNorm1d(64, eps=1e-05, momentum=0.1, affine=True, track_running_stats=True)
    )
    (output): Identity()
  )
)
propagate done
init label
Split: 01, Run: 01
None time:  1.973169001052156
None Run 01:
Highest Train: 100.00
Highest Valid: 81.80
  Final Train: 100.00
   Final Test: 77.50
Split: 01, Run: 02
None time:  1.6844782780390233
None Run 02:
Highest Train: 100.00
Highest Valid: 83.80
  Final Train: 100.00
   Final Test: 78.70
Split: 01, Run: 03
None time:  1.5485715330578387
None Run 03:
Highest Train: 100.00
Highest Valid: 82.20
  Final Train: 100.00
   Final Test: 79.30
run time now: 5.262904405593872
total time:  5.323838569922373
None All runs:
Highest Train: 100.00 ± 0.00
Highest Valid: 82.60 ± 1.06
  Final Train: 100.00 ± 0.00
   Final Test: 78.50 ± 0.92
[I 2023-06-12 00:42:50,389] Trial 324 finished with value: 82.60000610351562 and parameters: {'Fwd': 7.133124848013256e-06, 'K': 10, 'alpha': 0.9, 'dropout': 0.9, 'gnnepoch': 60, 'lambda1': 0.7000000000000001, 'lambda2': 6.258797306631804, 'loop': 1, 'loss': 'MSE', 'lr': 0.0032105192402768342, 'softmaxF': True, 'useGCN': False, 'weight_decay': 0.027894744228019092, 'weightedloss': False}. Best is trial 205 with value: 83.53333282470703.
/home/wxy/miniconda3/lib/python3.10/site-packages/optuna/distributions.py:685: UserWarning: The distribution is specified by [0, 1.00001] and step=0.05, but the range is not divisible by `step`. It will be replaced by [0, 1.0].
  warnings.warn(
K:  10
alpha:  1.0
lr:  0.000562664727272764
weight_decay:  0.007058228940824271
dropout:  0.8
fix split and run 3 times
Data: Data(x=[19717, 500], y=[19717], train_mask=[19717], val_mask=[19717], test_mask=[19717], adj_t=[19717, 19717, nnz=88648])
num_train tensor(60)
num_noise 0
noise: tensor(0)
data feature 500
ALTOPT(
  (lins): Sequential(
    (0): Linear(in_features=500, out_features=64, bias=True)
    (1): BatchNorm1d(64, eps=1e-05, momentum=0.1, affine=True, track_running_stats=True)
    (2): Dropout(p=0.8, inplace=True)
    (3): ReLU(inplace=True)
    (4): Linear(in_features=64, out_features=3, bias=True)
    (5): Identity()
  )
  (prop): Propagation(K=10, mode=None, lambda1=None, lambda2=None, L21=True, alpha=1.0)
  (gcn): GCN(
    (convs): ModuleList(
      (0): GCNConv(500, 64)
      (1): GCNConv(64, 3)
    )
    (bns): ModuleList(
      (0): BatchNorm1d(64, eps=1e-05, momentum=0.1, affine=True, track_running_stats=True)
    )
    (output): Identity()
  )
)
propagate done
init label
Split: 01, Run: 01
None time:  2.110584327019751
None Run 01:
Highest Train: 100.00
Highest Valid: 82.80
  Final Train: 100.00
   Final Test: 77.10
Split: 01, Run: 02
None time:  1.5535648511722684
None Run 02:
Highest Train: 100.00
Highest Valid: 82.40
  Final Train: 100.00
   Final Test: 77.80
Split: 01, Run: 03
None time:  1.0444565580692142
None Run 03:
Highest Train: 100.00
Highest Valid: 81.60
  Final Train: 100.00
   Final Test: 79.40
run time now: 4.756739377975464
total time:  4.802988767856732
None All runs:
Highest Train: 100.00 ± 0.00
Highest Valid: 82.27 ± 0.61
  Final Train: 100.00 ± 0.00
   Final Test: 78.10 ± 1.18
[I 2023-06-12 00:42:55,722] Trial 325 finished with value: 82.26667022705078 and parameters: {'Fwd': 8.943703759156091e-06, 'K': 10, 'alpha': 1.0, 'dropout': 0.8, 'gnnepoch': 60, 'lambda1': 0.8500000000000001, 'lambda2': 6.071925479172656, 'loop': 1, 'loss': 'MSE', 'lr': 0.000562664727272764, 'softmaxF': True, 'useGCN': False, 'weight_decay': 0.007058228940824271, 'weightedloss': False}. Best is trial 205 with value: 83.53333282470703.
/home/wxy/miniconda3/lib/python3.10/site-packages/optuna/distributions.py:685: UserWarning: The distribution is specified by [0, 1.00001] and step=0.05, but the range is not divisible by `step`. It will be replaced by [0, 1.0].
  warnings.warn(
K:  10
alpha:  0.9500000000000001
lr:  0.0024487701427496943
weight_decay:  0.000708317967574708
dropout:  0.9
fix split and run 3 times
Data: Data(x=[19717, 500], y=[19717], train_mask=[19717], val_mask=[19717], test_mask=[19717], adj_t=[19717, 19717, nnz=88648])
num_train tensor(60)
num_noise 0
noise: tensor(0)
data feature 500
ALTOPT(
  (lins): Sequential(
    (0): Linear(in_features=500, out_features=64, bias=True)
    (1): BatchNorm1d(64, eps=1e-05, momentum=0.1, affine=True, track_running_stats=True)
    (2): Dropout(p=0.9, inplace=True)
    (3): ReLU(inplace=True)
    (4): Linear(in_features=64, out_features=3, bias=True)
    (5): Identity()
  )
  (prop): Propagation(K=10, mode=None, lambda1=None, lambda2=None, L21=True, alpha=0.9500000000000001)
  (gcn): GCN(
    (convs): ModuleList(
      (0): GCNConv(500, 64)
      (1): GCNConv(64, 3)
    )
    (bns): ModuleList(
      (0): BatchNorm1d(64, eps=1e-05, momentum=0.1, affine=True, track_running_stats=True)
    )
    (output): Identity()
  )
)
propagate done
init label
Split: 01, Run: 01
None time:  2.3541197709273547
None Run 01:
Highest Train: 100.00
Highest Valid: 81.60
  Final Train: 100.00
   Final Test: 77.40
Split: 01, Run: 02
None time:  1.5948267590720206
None Run 02:
Highest Train: 100.00
Highest Valid: 83.20
  Final Train: 100.00
   Final Test: 78.30
Split: 01, Run: 03
None time:  1.809756221016869
None Run 03:
Highest Train: 100.00
Highest Valid: 82.20
  Final Train: 100.00
   Final Test: 79.10
run time now: 5.807097673416138
total time:  5.848963179858401
None All runs:
Highest Train: 100.00 ± 0.00
Highest Valid: 82.33 ± 0.81
  Final Train: 100.00 ± 0.00
   Final Test: 78.27 ± 0.85
[I 2023-06-12 00:43:02,101] Trial 326 finished with value: 82.33333587646484 and parameters: {'Fwd': 3.0658213330448412e-06, 'K': 10, 'alpha': 0.9500000000000001, 'dropout': 0.9, 'gnnepoch': 60, 'lambda1': 0.75, 'lambda2': 5.792516904473315, 'loop': 1, 'loss': 'MSE', 'lr': 0.0024487701427496943, 'softmaxF': True, 'useGCN': False, 'weight_decay': 0.000708317967574708, 'weightedloss': False}. Best is trial 205 with value: 83.53333282470703.
/home/wxy/miniconda3/lib/python3.10/site-packages/optuna/distributions.py:685: UserWarning: The distribution is specified by [0, 1.00001] and step=0.05, but the range is not divisible by `step`. It will be replaced by [0, 1.0].
  warnings.warn(
K:  10
alpha:  0.9500000000000001
lr:  0.0009719475554105845
weight_decay:  0.00024573955984618875
dropout:  0.9
fix split and run 3 times
Data: Data(x=[19717, 500], y=[19717], train_mask=[19717], val_mask=[19717], test_mask=[19717], adj_t=[19717, 19717, nnz=88648])
num_train tensor(60)
num_noise 0
noise: tensor(0)
data feature 500
ALTOPT(
  (lins): Sequential(
    (0): Linear(in_features=500, out_features=64, bias=True)
    (1): BatchNorm1d(64, eps=1e-05, momentum=0.1, affine=True, track_running_stats=True)
    (2): Dropout(p=0.9, inplace=True)
    (3): ReLU(inplace=True)
    (4): Linear(in_features=64, out_features=3, bias=True)
    (5): Identity()
  )
  (prop): Propagation(K=10, mode=None, lambda1=None, lambda2=None, L21=True, alpha=0.9500000000000001)
  (gcn): GCN(
    (convs): ModuleList(
      (0): GCNConv(500, 64)
      (1): GCNConv(64, 3)
    )
    (bns): ModuleList(
      (0): BatchNorm1d(64, eps=1e-05, momentum=0.1, affine=True, track_running_stats=True)
    )
    (output): Identity()
  )
)
propagate done
init label
Split: 01, Run: 01
None time:  2.11095212912187
None Run 01:
Highest Train: 100.00
Highest Valid: 79.80
  Final Train: 100.00
   Final Test: 76.30
Split: 01, Run: 02
None time:  1.825633809901774
None Run 02:
Highest Train: 100.00
Highest Valid: 82.60
  Final Train: 100.00
   Final Test: 78.60
Split: 01, Run: 03
None time:  0.7560577031690627
None Run 03:
Highest Train: 100.00
Highest Valid: 83.40
  Final Train: 100.00
   Final Test: 79.30
run time now: 4.744078159332275
total time:  4.790595395956188
None All runs:
Highest Train: 100.00 ± 0.00
Highest Valid: 81.93 ± 1.89
  Final Train: 100.00 ± 0.00
   Final Test: 78.07 ± 1.57
[I 2023-06-12 00:43:07,453] Trial 327 finished with value: 81.9333267211914 and parameters: {'Fwd': 4.851336478356279e-06, 'K': 10, 'alpha': 0.9500000000000001, 'dropout': 0.9, 'gnnepoch': 60, 'lambda1': 0.9, 'lambda2': 4.612234870617971, 'loop': 1, 'loss': 'MSE', 'lr': 0.0009719475554105845, 'softmaxF': True, 'useGCN': False, 'weight_decay': 0.00024573955984618875, 'weightedloss': False}. Best is trial 205 with value: 83.53333282470703.
/home/wxy/miniconda3/lib/python3.10/site-packages/optuna/distributions.py:685: UserWarning: The distribution is specified by [0, 1.00001] and step=0.05, but the range is not divisible by `step`. It will be replaced by [0, 1.0].
  warnings.warn(
K:  10
alpha:  0.7000000000000001
lr:  0.008936820654149222
weight_decay:  0.0037068173992456177
dropout:  0.9
fix split and run 3 times
Data: Data(x=[19717, 500], y=[19717], train_mask=[19717], val_mask=[19717], test_mask=[19717], adj_t=[19717, 19717, nnz=88648])
num_train tensor(60)
num_noise 0
noise: tensor(0)
data feature 500
ALTOPT(
  (lins): Sequential(
    (0): Linear(in_features=500, out_features=64, bias=True)
    (1): BatchNorm1d(64, eps=1e-05, momentum=0.1, affine=True, track_running_stats=True)
    (2): Dropout(p=0.9, inplace=True)
    (3): ReLU(inplace=True)
    (4): Linear(in_features=64, out_features=3, bias=True)
    (5): Identity()
  )
  (prop): Propagation(K=10, mode=None, lambda1=None, lambda2=None, L21=True, alpha=0.7000000000000001)
  (gcn): GCN(
    (convs): ModuleList(
      (0): GCNConv(500, 64)
      (1): GCNConv(64, 3)
    )
    (bns): ModuleList(
      (0): BatchNorm1d(64, eps=1e-05, momentum=0.1, affine=True, track_running_stats=True)
    )
    (output): Identity()
  )
)
propagate done
init label
Split: 01, Run: 01
None time:  1.0460949218831956
None Run 01:
Highest Train: 100.00
Highest Valid: 74.60
  Final Train: 100.00
   Final Test: 73.70
Split: 01, Run: 02
None time:  1.8944284520111978
None Run 02:
Highest Train: 100.00
Highest Valid: 75.60
  Final Train: 100.00
   Final Test: 73.50
Split: 01, Run: 03
None time:  1.3167559560388327
None Run 03:
Highest Train: 100.00
Highest Valid: 75.20
  Final Train: 100.00
   Final Test: 73.10
run time now: 4.308171033859253
total time:  4.368409181013703
None All runs:
Highest Train: 100.00 ± 0.00
Highest Valid: 75.13 ± 0.50
  Final Train: 100.00 ± 0.00
   Final Test: 73.43 ± 0.31
[I 2023-06-12 00:43:12,352] Trial 328 finished with value: 75.13333129882812 and parameters: {'Fwd': 6.754780110129963e-06, 'K': 10, 'alpha': 0.7000000000000001, 'dropout': 0.9, 'gnnepoch': 20, 'lambda1': 0.8500000000000001, 'lambda2': 4.080276114088295, 'loop': 1, 'loss': 'MSE', 'lr': 0.008936820654149222, 'softmaxF': True, 'useGCN': True, 'weight_decay': 0.0037068173992456177, 'weightedloss': False}. Best is trial 205 with value: 83.53333282470703.
/home/wxy/miniconda3/lib/python3.10/site-packages/optuna/distributions.py:685: UserWarning: The distribution is specified by [0, 1.00001] and step=0.05, but the range is not divisible by `step`. It will be replaced by [0, 1.0].
  warnings.warn(
K:  10
alpha:  0.9
lr:  0.002844527247253665
weight_decay:  0.010392665979739603
dropout:  0.9
fix split and run 3 times
Data: Data(x=[19717, 500], y=[19717], train_mask=[19717], val_mask=[19717], test_mask=[19717], adj_t=[19717, 19717, nnz=88648])
num_train tensor(60)
num_noise 0
noise: tensor(0)
data feature 500
ALTOPT(
  (lins): Sequential(
    (0): Linear(in_features=500, out_features=64, bias=True)
    (1): BatchNorm1d(64, eps=1e-05, momentum=0.1, affine=True, track_running_stats=True)
    (2): Dropout(p=0.9, inplace=True)
    (3): ReLU(inplace=True)
    (4): Linear(in_features=64, out_features=3, bias=True)
    (5): Identity()
  )
  (prop): Propagation(K=10, mode=None, lambda1=None, lambda2=None, L21=True, alpha=0.9)
  (gcn): GCN(
    (convs): ModuleList(
      (0): GCNConv(500, 64)
      (1): GCNConv(64, 3)
    )
    (bns): ModuleList(
      (0): BatchNorm1d(64, eps=1e-05, momentum=0.1, affine=True, track_running_stats=True)
    )
    (output): Identity()
  )
)
propagate done
init label
Split: 01, Run: 01
None time:  2.888804140035063
None Run 01:
Highest Train: 100.00
Highest Valid: 82.20
  Final Train: 100.00
   Final Test: 76.80
Split: 01, Run: 02
None time:  1.5535096768289804
None Run 02:
Highest Train: 100.00
Highest Valid: 83.00
  Final Train: 100.00
   Final Test: 80.30
Split: 01, Run: 03
None time:  1.0008629749063402
None Run 03:
Highest Train: 100.00
Highest Valid: 82.00
  Final Train: 100.00
   Final Test: 79.30
run time now: 5.492196321487427
total time:  5.535900871036574
None All runs:
Highest Train: 100.00 ± 0.00
Highest Valid: 82.40 ± 0.53
  Final Train: 100.00 ± 0.00
   Final Test: 78.80 ± 1.80
[I 2023-06-12 00:43:18,394] Trial 329 finished with value: 82.4000015258789 and parameters: {'Fwd': 3.6414627060200635e-06, 'K': 10, 'alpha': 0.9, 'dropout': 0.9, 'gnnepoch': 70, 'lambda1': 0.8, 'lambda2': 3.7052395879783626, 'loop': 1, 'loss': 'MSE', 'lr': 0.002844527247253665, 'softmaxF': True, 'useGCN': False, 'weight_decay': 0.010392665979739603, 'weightedloss': False}. Best is trial 205 with value: 83.53333282470703.
/home/wxy/miniconda3/lib/python3.10/site-packages/optuna/distributions.py:685: UserWarning: The distribution is specified by [0, 1.00001] and step=0.05, but the range is not divisible by `step`. It will be replaced by [0, 1.0].
  warnings.warn(
K:  3
alpha:  1.0
lr:  0.0022708077593218273
weight_decay:  0.0058174899006228796
dropout:  0.9
fix split and run 3 times
Data: Data(x=[19717, 500], y=[19717], train_mask=[19717], val_mask=[19717], test_mask=[19717], adj_t=[19717, 19717, nnz=88648])
num_train tensor(60)
num_noise 0
noise: tensor(0)
data feature 500
ALTOPT(
  (lins): Sequential(
    (0): Linear(in_features=500, out_features=64, bias=True)
    (1): BatchNorm1d(64, eps=1e-05, momentum=0.1, affine=True, track_running_stats=True)
    (2): Dropout(p=0.9, inplace=True)
    (3): ReLU(inplace=True)
    (4): Linear(in_features=64, out_features=3, bias=True)
    (5): Identity()
  )
  (prop): Propagation(K=3, mode=None, lambda1=None, lambda2=None, L21=True, alpha=1.0)
  (gcn): GCN(
    (convs): ModuleList(
      (0): GCNConv(500, 64)
      (1): GCNConv(64, 3)
    )
    (bns): ModuleList(
      (0): BatchNorm1d(64, eps=1e-05, momentum=0.1, affine=True, track_running_stats=True)
    )
    (output): Identity()
  )
)
propagate done
init label
Split: 01, Run: 01
None time:  2.006630705203861
None Run 01:
Highest Train: 100.00
Highest Valid: 78.60
  Final Train: 100.00
   Final Test: 74.30
Split: 01, Run: 02
None time:  0.9130114009603858
None Run 02:
Highest Train: 100.00
Highest Valid: 81.40
  Final Train: 100.00
   Final Test: 74.70
Split: 01, Run: 03
None time:  2.2463294060435146
None Run 03:
Highest Train: 100.00
Highest Valid: 81.60
  Final Train: 100.00
   Final Test: 76.70
run time now: 5.208969354629517
total time:  5.255856193834916
None All runs:
Highest Train: 100.00 ± 0.00
Highest Valid: 80.53 ± 1.68
  Final Train: 100.00 ± 0.00
   Final Test: 75.23 ± 1.29
[I 2023-06-12 00:43:24,168] Trial 330 finished with value: 80.53333282470703 and parameters: {'Fwd': 1.3712714382217725e-05, 'K': 3, 'alpha': 1.0, 'dropout': 0.9, 'gnnepoch': 60, 'lambda1': 0.6000000000000001, 'lambda2': 2.299704912189305, 'loop': 1, 'loss': 'MSE', 'lr': 0.0022708077593218273, 'softmaxF': True, 'useGCN': False, 'weight_decay': 0.0058174899006228796, 'weightedloss': False}. Best is trial 205 with value: 83.53333282470703.
/home/wxy/miniconda3/lib/python3.10/site-packages/optuna/distributions.py:685: UserWarning: The distribution is specified by [0, 1.00001] and step=0.05, but the range is not divisible by `step`. It will be replaced by [0, 1.0].
  warnings.warn(
K:  10
alpha:  0.9500000000000001
lr:  0.001511403485680371
weight_decay:  0.013497340322843426
dropout:  0.9
fix split and run 3 times
Data: Data(x=[19717, 500], y=[19717], train_mask=[19717], val_mask=[19717], test_mask=[19717], adj_t=[19717, 19717, nnz=88648])
num_train tensor(60)
num_noise 0
noise: tensor(0)
data feature 500
ALTOPT(
  (lins): Sequential(
    (0): Linear(in_features=500, out_features=64, bias=True)
    (1): BatchNorm1d(64, eps=1e-05, momentum=0.1, affine=True, track_running_stats=True)
    (2): Dropout(p=0.9, inplace=True)
    (3): ReLU(inplace=True)
    (4): Linear(in_features=64, out_features=3, bias=True)
    (5): Identity()
  )
  (prop): Propagation(K=10, mode=None, lambda1=None, lambda2=None, L21=True, alpha=0.9500000000000001)
  (gcn): GCN(
    (convs): ModuleList(
      (0): GCNConv(500, 64)
      (1): GCNConv(64, 3)
    )
    (bns): ModuleList(
      (0): BatchNorm1d(64, eps=1e-05, momentum=0.1, affine=True, track_running_stats=True)
    )
    (output): Identity()
  )
)
propagate done
init label
Split: 01, Run: 01
None time:  0.734122812980786
None Run 01:
Highest Train: 100.00
Highest Valid: 69.00
  Final Train: 100.00
   Final Test: 69.30
Split: 01, Run: 02
None time:  1.1637363501358777
None Run 02:
Highest Train: 100.00
Highest Valid: 80.80
  Final Train: 100.00
   Final Test: 78.60
Split: 01, Run: 03
None time:  1.2607781840488315
None Run 03:
Highest Train: 100.00
Highest Valid: 83.40
  Final Train: 100.00
   Final Test: 80.80
run time now: 3.216273784637451
total time:  3.269860853208229
None All runs:
Highest Train: 100.00 ± 0.00
Highest Valid: 77.73 ± 7.67
  Final Train: 100.00 ± 0.00
   Final Test: 76.23 ± 6.10
[I 2023-06-12 00:43:27,870] Trial 331 finished with value: 77.73333740234375 and parameters: {'Fwd': 2.66901480180082e-06, 'K': 10, 'alpha': 0.9500000000000001, 'dropout': 0.9, 'gnnepoch': 50, 'lambda1': 0.8500000000000001, 'lambda2': 4.876761724959542, 'loop': 1, 'loss': 'MSE', 'lr': 0.001511403485680371, 'softmaxF': True, 'useGCN': False, 'weight_decay': 0.013497340322843426, 'weightedloss': False}. Best is trial 205 with value: 83.53333282470703.
/home/wxy/miniconda3/lib/python3.10/site-packages/optuna/distributions.py:685: UserWarning: The distribution is specified by [0, 1.00001] and step=0.05, but the range is not divisible by `step`. It will be replaced by [0, 1.0].
  warnings.warn(
K:  10
alpha:  0.9500000000000001
lr:  0.002585599024770964
weight_decay:  0.007930862449587475
dropout:  0.9
fix split and run 3 times
Data: Data(x=[19717, 500], y=[19717], train_mask=[19717], val_mask=[19717], test_mask=[19717], adj_t=[19717, 19717, nnz=88648])
num_train tensor(60)
num_noise 0
noise: tensor(0)
data feature 500
ALTOPT(
  (lins): Sequential(
    (0): Linear(in_features=500, out_features=64, bias=True)
    (1): BatchNorm1d(64, eps=1e-05, momentum=0.1, affine=True, track_running_stats=True)
    (2): Dropout(p=0.9, inplace=True)
    (3): ReLU(inplace=True)
    (4): Linear(in_features=64, out_features=3, bias=True)
    (5): Identity()
  )
  (prop): Propagation(K=10, mode=None, lambda1=None, lambda2=None, L21=True, alpha=0.9500000000000001)
  (gcn): GCN(
    (convs): ModuleList(
      (0): GCNConv(500, 64)
      (1): GCNConv(64, 3)
    )
    (bns): ModuleList(
      (0): BatchNorm1d(64, eps=1e-05, momentum=0.1, affine=True, track_running_stats=True)
    )
    (output): Identity()
  )
)
propagate done
init label
Split: 01, Run: 01
None time:  1.8119295157957822
None Run 01:
Highest Train: 100.00
Highest Valid: 82.20
  Final Train: 100.00
   Final Test: 78.50
Split: 01, Run: 02
None time:  1.0800005400087684
None Run 02:
Highest Train: 100.00
Highest Valid: 83.40
  Final Train: 100.00
   Final Test: 79.20
Split: 01, Run: 03
None time:  2.832768965046853
None Run 03:
Highest Train: 100.00
Highest Valid: 82.40
  Final Train: 100.00
   Final Test: 80.20
run time now: 5.792473316192627
total time:  5.843840071931481
None All runs:
Highest Train: 100.00 ± 0.00
Highest Valid: 82.67 ± 0.64
  Final Train: 100.00 ± 0.00
   Final Test: 79.30 ± 0.85
