[I 2023-06-12 00:51:35,499] Trial 413 finished with value: 77.20000457763672 and parameters: {'Fwd': 7.818622803583008e-06, 'K': 10, 'alpha': 0.9500000000000001, 'dropout': 0.9, 'gnnepoch': 50, 'lambda1': 0.8, 'lambda2': 2.857535465742515, 'loop': 1, 'loss': 'MSE', 'lr': 0.003554676233956987, 'softmaxF': True, 'useGCN': False, 'weight_decay': 0.0002210345560255198, 'weightedloss': False}. Best is trial 364 with value: 83.66666412353516.
/home/wxy/miniconda3/lib/python3.10/site-packages/optuna/distributions.py:685: UserWarning: The distribution is specified by [0, 1.00001] and step=0.05, but the range is not divisible by `step`. It will be replaced by [0, 1.0].
  warnings.warn(
K:  10
alpha:  0.7000000000000001
lr:  0.0018416047143910057
weight_decay:  0.010201247216813269
dropout:  0.9
fix split and run 3 times
Data: Data(x=[19717, 500], y=[19717], train_mask=[19717], val_mask=[19717], test_mask=[19717], adj_t=[19717, 19717, nnz=88648])
num_train tensor(60)
num_noise 0
noise: tensor(0)
data feature 500
ALTOPT(
  (lins): Sequential(
    (0): Linear(in_features=500, out_features=64, bias=True)
    (1): BatchNorm1d(64, eps=1e-05, momentum=0.1, affine=True, track_running_stats=True)
    (2): Dropout(p=0.9, inplace=True)
    (3): ReLU(inplace=True)
    (4): Linear(in_features=64, out_features=3, bias=True)
    (5): Identity()
  )
  (prop): Propagation(K=10, mode=None, lambda1=None, lambda2=None, L21=True, alpha=0.7000000000000001)
  (gcn): GCN(
    (convs): ModuleList(
      (0): GCNConv(500, 64)
      (1): GCNConv(64, 3)
    )
    (bns): ModuleList(
      (0): BatchNorm1d(64, eps=1e-05, momentum=0.1, affine=True, track_running_stats=True)
    )
    (output): Identity()
  )
)
propagate done
init label
Split: 01, Run: 01
None time:  2.0927181718870997
None Run 01:
Highest Train: 100.00
Highest Valid: 72.40
  Final Train: 100.00
   Final Test: 71.70
Split: 01, Run: 02
None time:  1.4712675460614264
None Run 02:
Highest Train: 100.00
Highest Valid: 78.00
  Final Train: 100.00
   Final Test: 76.00
Split: 01, Run: 03
None time:  1.5415783759672195
None Run 03:
Highest Train: 100.00
Highest Valid: 78.60
  Final Train: 100.00
   Final Test: 75.60
run time now: 5.150729417800903
total time:  5.191601027967408
None All runs:
Highest Train: 100.00 ± 0.00
Highest Valid: 76.33 ± 3.42
  Final Train: 100.00 ± 0.00
   Final Test: 74.43 ± 2.38
[I 2023-06-12 00:51:41,348] Trial 414 finished with value: 76.33333587646484 and parameters: {'Fwd': 4.590071425644028e-06, 'K': 10, 'alpha': 0.7000000000000001, 'dropout': 0.9, 'gnnepoch': 110, 'lambda1': 0.65, 'lambda2': 5.627941564784237, 'loop': 1, 'loss': 'MSE', 'lr': 0.0018416047143910057, 'softmaxF': True, 'useGCN': False, 'weight_decay': 0.010201247216813269, 'weightedloss': False}. Best is trial 364 with value: 83.66666412353516.
/home/wxy/miniconda3/lib/python3.10/site-packages/optuna/distributions.py:685: UserWarning: The distribution is specified by [0, 1.00001] and step=0.05, but the range is not divisible by `step`. It will be replaced by [0, 1.0].
  warnings.warn(
K:  10
alpha:  1.0
lr:  0.002930687714492656
weight_decay:  0.015043023010917644
dropout:  0.9
fix split and run 3 times
Data: Data(x=[19717, 500], y=[19717], train_mask=[19717], val_mask=[19717], test_mask=[19717], adj_t=[19717, 19717, nnz=88648])
num_train tensor(60)
num_noise 0
noise: tensor(0)
data feature 500
ALTOPT(
  (lins): Sequential(
    (0): Linear(in_features=500, out_features=64, bias=True)
    (1): BatchNorm1d(64, eps=1e-05, momentum=0.1, affine=True, track_running_stats=True)
    (2): Dropout(p=0.9, inplace=True)
    (3): ReLU(inplace=True)
    (4): Linear(in_features=64, out_features=3, bias=True)
    (5): Identity()
  )
  (prop): Propagation(K=10, mode=None, lambda1=None, lambda2=None, L21=True, alpha=1.0)
  (gcn): GCN(
    (convs): ModuleList(
      (0): GCNConv(500, 64)
      (1): GCNConv(64, 3)
    )
    (bns): ModuleList(
      (0): BatchNorm1d(64, eps=1e-05, momentum=0.1, affine=True, track_running_stats=True)
    )
    (output): Identity()
  )
)
propagate done
init label
Split: 01, Run: 01
None time:  1.6256227479316294
None Run 01:
Highest Train: 100.00
Highest Valid: 81.80
  Final Train: 100.00
   Final Test: 76.90
Split: 01, Run: 02
None time:  1.9979879560414702
None Run 02:
Highest Train: 100.00
Highest Valid: 80.60
  Final Train: 100.00
   Final Test: 78.70
Split: 01, Run: 03
None time:  1.144091219874099
None Run 03:
Highest Train: 100.00
Highest Valid: 79.80
  Final Train: 100.00
   Final Test: 78.70
run time now: 4.8168113231658936
total time:  4.862558820983395
None All runs:
Highest Train: 100.00 ± 0.00
Highest Valid: 80.73 ± 1.01
  Final Train: 100.00 ± 0.00
   Final Test: 78.10 ± 1.04
[I 2023-06-12 00:51:46,852] Trial 415 finished with value: 80.73332977294922 and parameters: {'Fwd': 0.0003340936554072009, 'K': 10, 'alpha': 1.0, 'dropout': 0.9, 'gnnepoch': 60, 'lambda1': 0.7000000000000001, 'lambda2': 6.530985062778368, 'loop': 1, 'loss': 'MSE', 'lr': 0.002930687714492656, 'softmaxF': True, 'useGCN': False, 'weight_decay': 0.015043023010917644, 'weightedloss': False}. Best is trial 364 with value: 83.66666412353516.
/home/wxy/miniconda3/lib/python3.10/site-packages/optuna/distributions.py:685: UserWarning: The distribution is specified by [0, 1.00001] and step=0.05, but the range is not divisible by `step`. It will be replaced by [0, 1.0].
  warnings.warn(
K:  9
alpha:  0.9500000000000001
lr:  0.0024848959642362035
weight_decay:  0.0035117334249535
dropout:  0.9
fix split and run 3 times
Data: Data(x=[19717, 500], y=[19717], train_mask=[19717], val_mask=[19717], test_mask=[19717], adj_t=[19717, 19717, nnz=88648])
num_train tensor(60)
num_noise 0
noise: tensor(0)
data feature 500
ALTOPT(
  (lins): Sequential(
    (0): Linear(in_features=500, out_features=64, bias=True)
    (1): BatchNorm1d(64, eps=1e-05, momentum=0.1, affine=True, track_running_stats=True)
    (2): Dropout(p=0.9, inplace=True)
    (3): ReLU(inplace=True)
    (4): Linear(in_features=64, out_features=3, bias=True)
    (5): Identity()
  )
  (prop): Propagation(K=9, mode=None, lambda1=None, lambda2=None, L21=True, alpha=0.9500000000000001)
  (gcn): GCN(
    (convs): ModuleList(
      (0): GCNConv(500, 64)
      (1): GCNConv(64, 3)
    )
    (bns): ModuleList(
      (0): BatchNorm1d(64, eps=1e-05, momentum=0.1, affine=True, track_running_stats=True)
    )
    (output): Identity()
  )
)
propagate done
init label
Split: 01, Run: 01
None time:  2.344420673092827
None Run 01:
Highest Train: 100.00
Highest Valid: 81.20
  Final Train: 100.00
   Final Test: 77.70
Split: 01, Run: 02
None time:  0.7541243399027735
None Run 02:
Highest Train: 100.00
Highest Valid: 80.20
  Final Train: 100.00
   Final Test: 77.30
Split: 01, Run: 03
None time:  1.0543047240935266
None Run 03:
Highest Train: 100.00
Highest Valid: 83.60
  Final Train: 100.00
   Final Test: 79.40
run time now: 4.19940972328186
total time:  4.246727869147435
None All runs:
Highest Train: 100.00 ± 0.00
Highest Valid: 81.67 ± 1.75
  Final Train: 100.00 ± 0.00
   Final Test: 78.13 ± 1.12
[I 2023-06-12 00:51:51,682] Trial 416 finished with value: 81.66666412353516 and parameters: {'Fwd': 3.0647243108588395e-05, 'K': 9, 'alpha': 0.9500000000000001, 'dropout': 0.9, 'gnnepoch': 60, 'lambda1': 0.8500000000000001, 'lambda2': 5.446733094749935, 'loop': 1, 'loss': 'MSE', 'lr': 0.0024848959642362035, 'softmaxF': True, 'useGCN': False, 'weight_decay': 0.0035117334249535, 'weightedloss': False}. Best is trial 364 with value: 83.66666412353516.
/home/wxy/miniconda3/lib/python3.10/site-packages/optuna/distributions.py:685: UserWarning: The distribution is specified by [0, 1.00001] and step=0.05, but the range is not divisible by `step`. It will be replaced by [0, 1.0].
  warnings.warn(
K:  3
alpha:  0.9
lr:  0.0010007502528380581
weight_decay:  0.004564736081099302
dropout:  0.9
fix split and run 3 times
Data: Data(x=[19717, 500], y=[19717], train_mask=[19717], val_mask=[19717], test_mask=[19717], adj_t=[19717, 19717, nnz=88648])
num_train tensor(60)
num_noise 0
noise: tensor(0)
data feature 500
ALTOPT(
  (lins): Sequential(
    (0): Linear(in_features=500, out_features=64, bias=True)
    (1): BatchNorm1d(64, eps=1e-05, momentum=0.1, affine=True, track_running_stats=True)
    (2): Dropout(p=0.9, inplace=True)
    (3): ReLU(inplace=True)
    (4): Linear(in_features=64, out_features=3, bias=True)
    (5): Identity()
  )
  (prop): Propagation(K=3, mode=None, lambda1=None, lambda2=None, L21=True, alpha=0.9)
  (gcn): GCN(
    (convs): ModuleList(
      (0): GCNConv(500, 64)
      (1): GCNConv(64, 3)
    )
    (bns): ModuleList(
      (0): BatchNorm1d(64, eps=1e-05, momentum=0.1, affine=True, track_running_stats=True)
    )
    (output): Identity()
  )
)
propagate done
init label
Split: 01, Run: 01
None time:  2.308941547991708
None Run 01:
Highest Train: 100.00
Highest Valid: 76.80
  Final Train: 100.00
   Final Test: 72.00
Split: 01, Run: 02
None time:  1.3931009690277278
None Run 02:
Highest Train: 100.00
Highest Valid: 75.60
  Final Train: 100.00
   Final Test: 73.30
Split: 01, Run: 03
None time:  0.9111868448089808
None Run 03:
Highest Train: 100.00
Highest Valid: 76.00
  Final Train: 100.00
   Final Test: 73.60
run time now: 4.650972366333008
total time:  4.702497791033238
None All runs:
Highest Train: 100.00 ± 0.00
Highest Valid: 76.13 ± 0.61
  Final Train: 100.00 ± 0.00
   Final Test: 72.97 ± 0.85
[I 2023-06-12 00:51:56,914] Trial 417 finished with value: 76.13333129882812 and parameters: {'Fwd': 0.00022251735190623837, 'K': 3, 'alpha': 0.9, 'dropout': 0.9, 'gnnepoch': 70, 'lambda1': 0.9500000000000001, 'lambda2': 6.308643591172225, 'loop': 1, 'loss': 'MSE', 'lr': 0.0010007502528380581, 'softmaxF': True, 'useGCN': False, 'weight_decay': 0.004564736081099302, 'weightedloss': False}. Best is trial 364 with value: 83.66666412353516.
/home/wxy/miniconda3/lib/python3.10/site-packages/optuna/distributions.py:685: UserWarning: The distribution is specified by [0, 1.00001] and step=0.05, but the range is not divisible by `step`. It will be replaced by [0, 1.0].
  warnings.warn(
K:  10
alpha:  0.9500000000000001
lr:  0.0008056016356004639
weight_decay:  0.007831953558334938
dropout:  0.8
fix split and run 3 times
Data: Data(x=[19717, 500], y=[19717], train_mask=[19717], val_mask=[19717], test_mask=[19717], adj_t=[19717, 19717, nnz=88648])
num_train tensor(60)
num_noise 0
noise: tensor(0)
data feature 500
ALTOPT(
  (lins): Sequential(
    (0): Linear(in_features=500, out_features=64, bias=True)
    (1): BatchNorm1d(64, eps=1e-05, momentum=0.1, affine=True, track_running_stats=True)
    (2): Dropout(p=0.8, inplace=True)
    (3): ReLU(inplace=True)
    (4): Linear(in_features=64, out_features=3, bias=True)
    (5): Identity()
  )
  (prop): Propagation(K=10, mode=None, lambda1=None, lambda2=None, L21=True, alpha=0.9500000000000001)
  (gcn): GCN(
    (convs): ModuleList(
      (0): GCNConv(500, 64)
      (1): GCNConv(64, 3)
    )
    (bns): ModuleList(
      (0): BatchNorm1d(64, eps=1e-05, momentum=0.1, affine=True, track_running_stats=True)
    )
    (output): Identity()
  )
)
propagate done
init label
Split: 01, Run: 01
None time:  1.7006131410598755
None Run 01:
Highest Train: 100.00
Highest Valid: 81.80
  Final Train: 100.00
   Final Test: 78.30
Split: 01, Run: 02
None time:  1.382074954919517
None Run 02:
Highest Train: 100.00
Highest Valid: 82.40
  Final Train: 100.00
   Final Test: 78.40
Split: 01, Run: 03
None time:  1.5308466700371355
None Run 03:
Highest Train: 100.00
Highest Valid: 82.00
  Final Train: 100.00
   Final Test: 79.00
run time now: 4.66156268119812
total time:  4.716085721040145
None All runs:
Highest Train: 100.00 ± 0.00
Highest Valid: 82.07 ± 0.31
  Final Train: 100.00 ± 0.00
   Final Test: 78.57 ± 0.38
[I 2023-06-12 00:52:02,196] Trial 418 finished with value: 82.0666732788086 and parameters: {'Fwd': 9.691705817832774e-05, 'K': 10, 'alpha': 0.9500000000000001, 'dropout': 0.8, 'gnnepoch': 60, 'lambda1': 0.6000000000000001, 'lambda2': 5.988393002121856, 'loop': 1, 'loss': 'MSE', 'lr': 0.0008056016356004639, 'softmaxF': True, 'useGCN': False, 'weight_decay': 0.007831953558334938, 'weightedloss': False}. Best is trial 364 with value: 83.66666412353516.
/home/wxy/miniconda3/lib/python3.10/site-packages/optuna/distributions.py:685: UserWarning: The distribution is specified by [0, 1.00001] and step=0.05, but the range is not divisible by `step`. It will be replaced by [0, 1.0].
  warnings.warn(
K:  10
alpha:  1.0
lr:  0.0022434830679205976
weight_decay:  0.09482885941178287
dropout:  0.9
fix split and run 3 times
Data: Data(x=[19717, 500], y=[19717], train_mask=[19717], val_mask=[19717], test_mask=[19717], adj_t=[19717, 19717, nnz=88648])
num_train tensor(60)
num_noise 0
noise: tensor(0)
data feature 500
ALTOPT(
  (lins): Sequential(
    (0): Linear(in_features=500, out_features=64, bias=True)
    (1): BatchNorm1d(64, eps=1e-05, momentum=0.1, affine=True, track_running_stats=True)
    (2): Dropout(p=0.9, inplace=True)
    (3): ReLU(inplace=True)
    (4): Linear(in_features=64, out_features=3, bias=True)
    (5): Identity()
  )
  (prop): Propagation(K=10, mode=None, lambda1=None, lambda2=None, L21=True, alpha=1.0)
  (gcn): GCN(
    (convs): ModuleList(
      (0): GCNConv(500, 64)
      (1): GCNConv(64, 3)
    )
    (bns): ModuleList(
      (0): BatchNorm1d(64, eps=1e-05, momentum=0.1, affine=True, track_running_stats=True)
    )
    (output): Identity()
  )
)
propagate done
init label
Split: 01, Run: 01
None time:  2.15178493084386
None Run 01:
Highest Train: 100.00
Highest Valid: 83.40
  Final Train: 100.00
   Final Test: 78.30
Split: 01, Run: 02
None time:  2.083894934039563
None Run 02:
Highest Train: 100.00
Highest Valid: 79.80
  Final Train: 100.00
   Final Test: 78.70
Split: 01, Run: 03
None time:  1.7975938860327005
None Run 03:
Highest Train: 100.00
Highest Valid: 81.60
  Final Train: 100.00
   Final Test: 79.70
run time now: 6.079189300537109
total time:  6.125864003086463
None All runs:
Highest Train: 100.00 ± 0.00
Highest Valid: 81.60 ± 1.80
  Final Train: 100.00 ± 0.00
   Final Test: 78.90 ± 0.72
[I 2023-06-12 00:52:08,895] Trial 419 finished with value: 81.5999984741211 and parameters: {'Fwd': 3.026911077550431e-06, 'K': 10, 'alpha': 1.0, 'dropout': 0.9, 'gnnepoch': 70, 'lambda1': 0.8500000000000001, 'lambda2': 6.719319239584887, 'loop': 1, 'loss': 'MSE', 'lr': 0.0022434830679205976, 'softmaxF': True, 'useGCN': False, 'weight_decay': 0.09482885941178287, 'weightedloss': True}. Best is trial 364 with value: 83.66666412353516.
/home/wxy/miniconda3/lib/python3.10/site-packages/optuna/distributions.py:685: UserWarning: The distribution is specified by [0, 1.00001] and step=0.05, but the range is not divisible by `step`. It will be replaced by [0, 1.0].
  warnings.warn(
K:  10
alpha:  0.9
lr:  0.0027473768493975308
weight_decay:  0.0010556720724575648
dropout:  0.9
fix split and run 3 times
Data: Data(x=[19717, 500], y=[19717], train_mask=[19717], val_mask=[19717], test_mask=[19717], adj_t=[19717, 19717, nnz=88648])
num_train tensor(60)
num_noise 0
noise: tensor(0)
data feature 500
ALTOPT(
  (lins): Sequential(
    (0): Linear(in_features=500, out_features=64, bias=True)
    (1): BatchNorm1d(64, eps=1e-05, momentum=0.1, affine=True, track_running_stats=True)
    (2): Dropout(p=0.9, inplace=True)
    (3): ReLU(inplace=True)
    (4): Linear(in_features=64, out_features=3, bias=True)
    (5): LogSoftmax(dim=-1)
  )
  (prop): Propagation(K=10, mode=None, lambda1=None, lambda2=None, L21=True, alpha=0.9)
  (gcn): GCN(
    (convs): ModuleList(
      (0): GCNConv(500, 64)
      (1): GCNConv(64, 3)
    )
    (bns): ModuleList(
      (0): BatchNorm1d(64, eps=1e-05, momentum=0.1, affine=True, track_running_stats=True)
    )
    (output): LogSoftmax(dim=-1)
  )
)
propagate done
init label
Split: 01, Run: 01
None time:  0.7319915951229632
None Run 01:
Highest Train: 100.00
Highest Valid: 74.20
  Final Train: 100.00
   Final Test: 71.30
Split: 01, Run: 02
None time:  0.9653612338006496
None Run 02:
Highest Train: 100.00
Highest Valid: 79.20
  Final Train: 95.00
   Final Test: 76.50
Split: 01, Run: 03
None time:  1.0533104829955846
None Run 03:
Highest Train: 100.00
Highest Valid: 79.20
  Final Train: 96.67
   Final Test: 76.40
run time now: 2.794703960418701
total time:  2.8407854540273547
None All runs:
Highest Train: 100.00 ± 0.00
Highest Valid: 77.53 ± 2.89
  Final Train: 97.22 ± 2.55
   Final Test: 74.73 ± 2.97
[I 2023-06-12 00:52:12,242] Trial 420 finished with value: 77.53333282470703 and parameters: {'Fwd': 1.774850698731057e-05, 'K': 10, 'alpha': 0.9, 'dropout': 0.9, 'gnnepoch': 60, 'lambda1': 0.8, 'lambda2': 1.0550676207217826, 'loop': 1, 'loss': 'CE', 'lr': 0.0027473768493975308, 'softmaxF': True, 'useGCN': False, 'weight_decay': 0.0010556720724575648, 'weightedloss': False}. Best is trial 364 with value: 83.66666412353516.
/home/wxy/miniconda3/lib/python3.10/site-packages/optuna/distributions.py:685: UserWarning: The distribution is specified by [0, 1.00001] and step=0.05, but the range is not divisible by `step`. It will be replaced by [0, 1.0].
  warnings.warn(
K:  10
alpha:  0.9500000000000001
lr:  0.0044948384141643045
weight_decay:  0.021268672392591274
dropout:  0.9
fix split and run 3 times
Data: Data(x=[19717, 500], y=[19717], train_mask=[19717], val_mask=[19717], test_mask=[19717], adj_t=[19717, 19717, nnz=88648])
num_train tensor(60)
num_noise 0
noise: tensor(0)
data feature 500
ALTOPT(
  (lins): Sequential(
    (0): Linear(in_features=500, out_features=64, bias=True)
    (1): BatchNorm1d(64, eps=1e-05, momentum=0.1, affine=True, track_running_stats=True)
    (2): Dropout(p=0.9, inplace=True)
    (3): ReLU(inplace=True)
    (4): Linear(in_features=64, out_features=3, bias=True)
    (5): Identity()
  )
  (prop): Propagation(K=10, mode=None, lambda1=None, lambda2=None, L21=True, alpha=0.9500000000000001)
  (gcn): GCN(
    (convs): ModuleList(
      (0): GCNConv(500, 64)
      (1): GCNConv(64, 3)
    )
    (bns): ModuleList(
      (0): BatchNorm1d(64, eps=1e-05, momentum=0.1, affine=True, track_running_stats=True)
    )
    (output): Identity()
  )
)
propagate done
init label
Split: 01, Run: 01
None time:  1.559794164961204
None Run 01:
Highest Train: 100.00
Highest Valid: 79.60
  Final Train: 100.00
   Final Test: 74.90
Split: 01, Run: 02
None time:  0.9177992201875895
None Run 02:
Highest Train: 100.00
Highest Valid: 82.40
  Final Train: 100.00
   Final Test: 79.30
Split: 01, Run: 03
None time:  2.1030630241148174
None Run 03:
Highest Train: 100.00
Highest Valid: 80.40
  Final Train: 100.00
   Final Test: 77.20
run time now: 4.629697322845459
total time:  4.679227401036769
None All runs:
Highest Train: 100.00 ± 0.00
Highest Valid: 80.80 ± 1.44
  Final Train: 100.00 ± 0.00
   Final Test: 77.13 ± 2.20
[I 2023-06-12 00:52:17,507] Trial 421 finished with value: 80.79999542236328 and parameters: {'Fwd': 2.161682006767716e-06, 'K': 10, 'alpha': 0.9500000000000001, 'dropout': 0.9, 'gnnepoch': 60, 'lambda1': 0.9, 'lambda2': 5.103183096630495, 'loop': 1, 'loss': 'MSE', 'lr': 0.0044948384141643045, 'softmaxF': True, 'useGCN': False, 'weight_decay': 0.021268672392591274, 'weightedloss': False}. Best is trial 364 with value: 83.66666412353516.
/home/wxy/miniconda3/lib/python3.10/site-packages/optuna/distributions.py:685: UserWarning: The distribution is specified by [0, 1.00001] and step=0.05, but the range is not divisible by `step`. It will be replaced by [0, 1.0].
  warnings.warn(
K:  10
alpha:  0.9500000000000001
lr:  0.002512814575782126
weight_decay:  1.8101079329995513e-05
dropout:  0.9
fix split and run 3 times
Data: Data(x=[19717, 500], y=[19717], train_mask=[19717], val_mask=[19717], test_mask=[19717], adj_t=[19717, 19717, nnz=88648])
num_train tensor(60)
num_noise 0
noise: tensor(0)
data feature 500
ALTOPT(
  (lins): Sequential(
    (0): Linear(in_features=500, out_features=64, bias=True)
    (1): BatchNorm1d(64, eps=1e-05, momentum=0.1, affine=True, track_running_stats=True)
    (2): Dropout(p=0.9, inplace=True)
    (3): ReLU(inplace=True)
    (4): Linear(in_features=64, out_features=3, bias=True)
    (5): Identity()
  )
  (prop): Propagation(K=10, mode=None, lambda1=None, lambda2=None, L21=True, alpha=0.9500000000000001)
  (gcn): GCN(
    (convs): ModuleList(
      (0): GCNConv(500, 64)
      (1): GCNConv(64, 3)
    )
    (bns): ModuleList(
      (0): BatchNorm1d(64, eps=1e-05, momentum=0.1, affine=True, track_running_stats=True)
    )
    (output): Identity()
  )
)
propagate done
init label
Split: 01, Run: 01
None time:  1.8350151891354471
None Run 01:
Highest Train: 100.00
Highest Valid: 82.00
  Final Train: 100.00
   Final Test: 77.00
Split: 01, Run: 02
None time:  1.2160411749500781
None Run 02:
Highest Train: 100.00
Highest Valid: 83.80
  Final Train: 100.00
   Final Test: 80.80
Split: 01, Run: 03
None time:  1.1373190730810165
None Run 03:
Highest Train: 100.00
Highest Valid: 84.20
  Final Train: 100.00
   Final Test: 80.20
run time now: 4.242086887359619
total time:  4.282494381768629
None All runs:
Highest Train: 100.00 ± 0.00
Highest Valid: 83.33 ± 1.17
  Final Train: 100.00 ± 0.00
   Final Test: 79.33 ± 2.04
