[I 2023-06-12 00:05:40,668] Trial 701 finished with value: 71.80000305175781 and parameters: {'Fwd': 0.049829560796930586, 'K': 8, 'alpha': 0.55, 'dropout': 0.8, 'gnnepoch': 120, 'lambda1': 0.65, 'lambda2': 3.872836880342353, 'loop': 0, 'loss': 'CE', 'lr': 0.0015186728607967073, 'softmaxF': False, 'useGCN': True, 'weight_decay': 1.5015005800559288e-05, 'weightedloss': True}. Best is trial 605 with value: 72.13333129882812.
/home/wxy/miniconda3/lib/python3.10/site-packages/optuna/distributions.py:685: UserWarning: The distribution is specified by [0, 1.00001] and step=0.05, but the range is not divisible by `step`. It will be replaced by [0, 1.0].
  warnings.warn(
K:  8
alpha:  0.7000000000000001
lr:  0.00281188159637678
weight_decay:  3.90213754228075e-06
dropout:  0.8
fix split and run 3 times
Data: Data(x=[3327, 3703], y=[3327], train_mask=[3327], val_mask=[3327], test_mask=[3327], adj_t=[3327, 3327, nnz=9104])
num_train tensor(120)
num_noise 0
noise: tensor(0)
data feature 3703
ALTOPT(
  (lins): Sequential(
    (0): Linear(in_features=3703, out_features=64, bias=True)
    (1): BatchNorm1d(64, eps=1e-05, momentum=0.1, affine=True, track_running_stats=True)
    (2): Dropout(p=0.8, inplace=True)
    (3): ReLU(inplace=True)
    (4): Linear(in_features=64, out_features=6, bias=True)
    (5): LogSoftmax(dim=-1)
  )
  (prop): Propagation(K=8, mode=None, lambda1=None, lambda2=None, L21=True, alpha=0.7000000000000001)
  (gcn): GCN(
    (convs): ModuleList(
      (0): GCNConv(3703, 64)
      (1): GCNConv(64, 6)
    )
    (bns): ModuleList(
      (0): BatchNorm1d(64, eps=1e-05, momentum=0.1, affine=True, track_running_stats=True)
    )
    (output): LogSoftmax(dim=-1)
  )
)
propagate done
init label
Split: 01, Run: 01
None time:  1.0544742031488568
None Run 01:
Highest Train: 100.00
Highest Valid: 71.60
  Final Train: 100.00
   Final Test: 69.90
Split: 01, Run: 02
None time:  1.034907041117549
None Run 02:
Highest Train: 100.00
Highest Valid: 71.80
  Final Train: 100.00
   Final Test: 70.00
Split: 01, Run: 03
None time:  1.108701451914385
None Run 03:
Highest Train: 100.00
Highest Valid: 70.80
  Final Train: 100.00
   Final Test: 69.00
run time now: 3.2428767681121826
total time:  3.2982189811300486
None All runs:
Highest Train: 100.00 ± 0.00
Highest Valid: 71.40 ± 0.53
  Final Train: 100.00 ± 0.00
   Final Test: 69.63 ± 0.55
[I 2023-06-12 00:05:44,547] Trial 702 finished with value: 71.4000015258789 and parameters: {'Fwd': 0.03363515250888381, 'K': 8, 'alpha': 0.7000000000000001, 'dropout': 0.8, 'gnnepoch': 120, 'lambda1': 0.7000000000000001, 'lambda2': 5.4693282386690045, 'loop': 0, 'loss': 'CE', 'lr': 0.00281188159637678, 'softmaxF': False, 'useGCN': True, 'weight_decay': 3.90213754228075e-06, 'weightedloss': True}. Best is trial 605 with value: 72.13333129882812.
/home/wxy/miniconda3/lib/python3.10/site-packages/optuna/distributions.py:685: UserWarning: The distribution is specified by [0, 1.00001] and step=0.05, but the range is not divisible by `step`. It will be replaced by [0, 1.0].
  warnings.warn(
K:  8
alpha:  0.8
lr:  0.0010891716569418847
weight_decay:  2.223695798425838e-05
dropout:  0.7000000000000001
fix split and run 3 times
Data: Data(x=[3327, 3703], y=[3327], train_mask=[3327], val_mask=[3327], test_mask=[3327], adj_t=[3327, 3327, nnz=9104])
num_train tensor(120)
num_noise 0
noise: tensor(0)
data feature 3703
ALTOPT(
  (lins): Sequential(
    (0): Linear(in_features=3703, out_features=64, bias=True)
    (1): BatchNorm1d(64, eps=1e-05, momentum=0.1, affine=True, track_running_stats=True)
    (2): Dropout(p=0.7000000000000001, inplace=True)
    (3): ReLU(inplace=True)
    (4): Linear(in_features=64, out_features=6, bias=True)
    (5): LogSoftmax(dim=-1)
  )
  (prop): Propagation(K=8, mode=None, lambda1=None, lambda2=None, L21=True, alpha=0.8)
  (gcn): GCN(
    (convs): ModuleList(
      (0): GCNConv(3703, 64)
      (1): GCNConv(64, 6)
    )
    (bns): ModuleList(
      (0): BatchNorm1d(64, eps=1e-05, momentum=0.1, affine=True, track_running_stats=True)
    )
    (output): LogSoftmax(dim=-1)
  )
)
propagate done
init label
Split: 01, Run: 01
None time:  1.2043713331222534
None Run 01:
Highest Train: 100.00
Highest Valid: 71.00
  Final Train: 100.00
   Final Test: 69.60
Split: 01, Run: 02
None time:  1.2087336729746312
None Run 02:
Highest Train: 100.00
Highest Valid: 71.40
  Final Train: 100.00
   Final Test: 69.80
Split: 01, Run: 03
None time:  1.118842639029026
None Run 03:
Highest Train: 100.00
Highest Valid: 70.60
  Final Train: 100.00
   Final Test: 68.90
run time now: 3.5746915340423584
total time:  3.636870717164129
None All runs:
Highest Train: 100.00 ± 0.00
Highest Valid: 71.00 ± 0.40
  Final Train: 100.00 ± 0.00
   Final Test: 69.43 ± 0.47
[I 2023-06-12 00:05:48,738] Trial 703 finished with value: 71.0 and parameters: {'Fwd': 9.778176931794982e-05, 'K': 8, 'alpha': 0.8, 'dropout': 0.7000000000000001, 'gnnepoch': 120, 'lambda1': 0.7000000000000001, 'lambda2': 6.386992323559787, 'loop': 1, 'loss': 'CE', 'lr': 0.0010891716569418847, 'softmaxF': True, 'useGCN': True, 'weight_decay': 2.223695798425838e-05, 'weightedloss': True}. Best is trial 605 with value: 72.13333129882812.
/home/wxy/miniconda3/lib/python3.10/site-packages/optuna/distributions.py:685: UserWarning: The distribution is specified by [0, 1.00001] and step=0.05, but the range is not divisible by `step`. It will be replaced by [0, 1.0].
  warnings.warn(
K:  8
alpha:  0.65
lr:  0.0002068915683368082
weight_decay:  0.0009396352784278576
dropout:  0.8
fix split and run 3 times
Data: Data(x=[3327, 3703], y=[3327], train_mask=[3327], val_mask=[3327], test_mask=[3327], adj_t=[3327, 3327, nnz=9104])
num_train tensor(120)
num_noise 0
noise: tensor(0)
data feature 3703
ALTOPT(
  (lins): Sequential(
    (0): Linear(in_features=3703, out_features=64, bias=True)
    (1): BatchNorm1d(64, eps=1e-05, momentum=0.1, affine=True, track_running_stats=True)
    (2): Dropout(p=0.8, inplace=True)
    (3): ReLU(inplace=True)
    (4): Linear(in_features=64, out_features=6, bias=True)
    (5): LogSoftmax(dim=-1)
  )
  (prop): Propagation(K=8, mode=None, lambda1=None, lambda2=None, L21=True, alpha=0.65)
  (gcn): GCN(
    (convs): ModuleList(
      (0): GCNConv(3703, 64)
      (1): GCNConv(64, 6)
    )
    (bns): ModuleList(
      (0): BatchNorm1d(64, eps=1e-05, momentum=0.1, affine=True, track_running_stats=True)
    )
    (output): LogSoftmax(dim=-1)
  )
)
propagate done
init label
Split: 01, Run: 01
None time:  0.9931332319974899
None Run 01:
Highest Train: 100.00
Highest Valid: 68.60
  Final Train: 100.00
   Final Test: 68.90
Split: 01, Run: 02
None time:  1.0978058180771768
None Run 02:
Highest Train: 100.00
Highest Valid: 67.60
  Final Train: 100.00
   Final Test: 67.30
Split: 01, Run: 03
None time:  1.028642073040828
None Run 03:
Highest Train: 100.00
Highest Valid: 67.20
  Final Train: 100.00
   Final Test: 67.80
run time now: 3.159252643585205
total time:  3.21100240200758
None All runs:
Highest Train: 100.00 ± 0.00
Highest Valid: 67.80 ± 0.72
  Final Train: 100.00 ± 0.00
   Final Test: 68.00 ± 0.82
[I 2023-06-12 00:05:52,441] Trial 704 finished with value: 67.79999542236328 and parameters: {'Fwd': 0.023396831175524484, 'K': 8, 'alpha': 0.65, 'dropout': 0.8, 'gnnepoch': 110, 'lambda1': 0.6000000000000001, 'lambda2': 5.133011671403709, 'loop': 0, 'loss': 'CE', 'lr': 0.0002068915683368082, 'softmaxF': False, 'useGCN': True, 'weight_decay': 0.0009396352784278576, 'weightedloss': True}. Best is trial 605 with value: 72.13333129882812.
/home/wxy/miniconda3/lib/python3.10/site-packages/optuna/distributions.py:685: UserWarning: The distribution is specified by [0, 1.00001] and step=0.05, but the range is not divisible by `step`. It will be replaced by [0, 1.0].
  warnings.warn(
K:  7
alpha:  0.6000000000000001
lr:  0.001711786967187056
weight_decay:  0.03470038686608449
dropout:  0.8
fix split and run 3 times
Data: Data(x=[3327, 3703], y=[3327], train_mask=[3327], val_mask=[3327], test_mask=[3327], adj_t=[3327, 3327, nnz=9104])
num_train tensor(120)
num_noise 0
noise: tensor(0)
data feature 3703
ALTOPT(
  (lins): Sequential(
    (0): Linear(in_features=3703, out_features=64, bias=True)
    (1): BatchNorm1d(64, eps=1e-05, momentum=0.1, affine=True, track_running_stats=True)
    (2): Dropout(p=0.8, inplace=True)
    (3): ReLU(inplace=True)
    (4): Linear(in_features=64, out_features=6, bias=True)
    (5): LogSoftmax(dim=-1)
  )
  (prop): Propagation(K=7, mode=None, lambda1=None, lambda2=None, L21=True, alpha=0.6000000000000001)
  (gcn): GCN(
    (convs): ModuleList(
      (0): GCNConv(3703, 64)
      (1): GCNConv(64, 6)
    )
    (bns): ModuleList(
      (0): BatchNorm1d(64, eps=1e-05, momentum=0.1, affine=True, track_running_stats=True)
    )
    (output): LogSoftmax(dim=-1)
  )
)
propagate done
init label
Split: 01, Run: 01
None time:  0.7299528149887919
None Run 01:
Highest Train: 100.00
Highest Valid: 46.80
  Final Train: 100.00
   Final Test: 46.20
Split: 01, Run: 02
None time:  0.7157812730874866
None Run 02:
Highest Train: 100.00
Highest Valid: 53.60
  Final Train: 100.00
   Final Test: 55.50
Split: 01, Run: 03, Epoch: 100, Loss: 0.0000, Train: 100.00%, Valid: 56.80% Test: 55.00%
Split: 01, Run: 03
None time:  1.2630527629517019
None Run 03:
Highest Train: 100.00
Highest Valid: 56.80
  Final Train: 100.00
   Final Test: 55.00
run time now: 2.7462968826293945
total time:  2.7985377500299364
None All runs:
Highest Train: 100.00 ± 0.00
Highest Valid: 52.40 ± 5.11
  Final Train: 100.00 ± 0.00
   Final Test: 52.23 ± 5.23
[I 2023-06-12 00:05:55,806] Trial 705 finished with value: 52.40000534057617 and parameters: {'Fwd': 0.06388519334812717, 'K': 7, 'alpha': 0.6000000000000001, 'dropout': 0.8, 'gnnepoch': 120, 'lambda1': 0.75, 'lambda2': 8.193583943123345, 'loop': 0, 'loss': 'CE', 'lr': 0.001711786967187056, 'softmaxF': False, 'useGCN': False, 'weight_decay': 0.03470038686608449, 'weightedloss': True}. Best is trial 605 with value: 72.13333129882812.
/home/wxy/miniconda3/lib/python3.10/site-packages/optuna/distributions.py:685: UserWarning: The distribution is specified by [0, 1.00001] and step=0.05, but the range is not divisible by `step`. It will be replaced by [0, 1.0].
  warnings.warn(
K:  8
alpha:  0.5
lr:  0.0024568473277108544
weight_decay:  0.00011480761065736925
dropout:  0.8
fix split and run 3 times
Data: Data(x=[3327, 3703], y=[3327], train_mask=[3327], val_mask=[3327], test_mask=[3327], adj_t=[3327, 3327, nnz=9104])
num_train tensor(120)
num_noise 0
noise: tensor(0)
data feature 3703
ALTOPT(
  (lins): Sequential(
    (0): Linear(in_features=3703, out_features=64, bias=True)
    (1): BatchNorm1d(64, eps=1e-05, momentum=0.1, affine=True, track_running_stats=True)
    (2): Dropout(p=0.8, inplace=True)
    (3): ReLU(inplace=True)
    (4): Linear(in_features=64, out_features=6, bias=True)
    (5): LogSoftmax(dim=-1)
  )
  (prop): Propagation(K=8, mode=None, lambda1=None, lambda2=None, L21=True, alpha=0.5)
  (gcn): GCN(
    (convs): ModuleList(
      (0): GCNConv(3703, 64)
      (1): GCNConv(64, 6)
    )
    (bns): ModuleList(
      (0): BatchNorm1d(64, eps=1e-05, momentum=0.1, affine=True, track_running_stats=True)
    )
    (output): LogSoftmax(dim=-1)
  )
)
propagate done
init label
Split: 01, Run: 01
None time:  1.0708512880373746
None Run 01:
Highest Train: 100.00
Highest Valid: 71.20
  Final Train: 100.00
   Final Test: 69.90
Split: 01, Run: 02
None time:  1.0531165970023721
None Run 02:
Highest Train: 100.00
Highest Valid: 72.40
  Final Train: 100.00
   Final Test: 70.10
Split: 01, Run: 03
None time:  1.129640518920496
None Run 03:
Highest Train: 100.00
Highest Valid: 71.40
  Final Train: 100.00
   Final Test: 69.20
run time now: 3.29425311088562
total time:  3.344602297991514
None All runs:
Highest Train: 100.00 ± 0.00
Highest Valid: 71.67 ± 0.64
  Final Train: 100.00 ± 0.00
   Final Test: 69.73 ± 0.47
[I 2023-06-12 00:05:59,689] Trial 706 finished with value: 71.66666412353516 and parameters: {'Fwd': 7.820649038783653e-05, 'K': 8, 'alpha': 0.5, 'dropout': 0.8, 'gnnepoch': 120, 'lambda1': 0.8, 'lambda2': 7.03052311344363, 'loop': 0, 'loss': 'CE', 'lr': 0.0024568473277108544, 'softmaxF': False, 'useGCN': True, 'weight_decay': 0.00011480761065736925, 'weightedloss': True}. Best is trial 605 with value: 72.13333129882812.
/home/wxy/miniconda3/lib/python3.10/site-packages/optuna/distributions.py:685: UserWarning: The distribution is specified by [0, 1.00001] and step=0.05, but the range is not divisible by `step`. It will be replaced by [0, 1.0].
  warnings.warn(
K:  8
alpha:  0.75
lr:  0.0012317897721235802
weight_decay:  2.671668276227861e-05
dropout:  0.8
fix split and run 3 times
Data: Data(x=[3327, 3703], y=[3327], train_mask=[3327], val_mask=[3327], test_mask=[3327], adj_t=[3327, 3327, nnz=9104])
num_train tensor(120)
num_noise 0
noise: tensor(0)
data feature 3703
ALTOPT(
  (lins): Sequential(
    (0): Linear(in_features=3703, out_features=64, bias=True)
    (1): BatchNorm1d(64, eps=1e-05, momentum=0.1, affine=True, track_running_stats=True)
    (2): Dropout(p=0.8, inplace=True)
    (3): ReLU(inplace=True)
    (4): Linear(in_features=64, out_features=6, bias=True)
    (5): LogSoftmax(dim=-1)
  )
  (prop): Propagation(K=8, mode=None, lambda1=None, lambda2=None, L21=True, alpha=0.75)
  (gcn): GCN(
    (convs): ModuleList(
      (0): GCNConv(3703, 64)
      (1): GCNConv(64, 6)
    )
    (bns): ModuleList(
      (0): BatchNorm1d(64, eps=1e-05, momentum=0.1, affine=True, track_running_stats=True)
    )
    (output): LogSoftmax(dim=-1)
  )
)
propagate done
init label
Split: 01, Run: 01
None time:  0.846781644038856
None Run 01:
Highest Train: 100.00
Highest Valid: 70.80
  Final Train: 100.00
   Final Test: 70.00
Split: 01, Run: 02
None time:  0.9328911118209362
None Run 02:
Highest Train: 100.00
Highest Valid: 69.80
  Final Train: 100.00
   Final Test: 69.00
Split: 01, Run: 03
None time:  0.825071529019624
None Run 03:
Highest Train: 100.00
Highest Valid: 71.60
  Final Train: 100.00
   Final Test: 69.30
run time now: 2.646588087081909
total time:  2.702426344854757
None All runs:
Highest Train: 100.00 ± 0.00
Highest Valid: 70.73 ± 0.90
  Final Train: 100.00 ± 0.00
   Final Test: 69.43 ± 0.51
[I 2023-06-12 00:06:02,992] Trial 707 finished with value: 70.73333740234375 and parameters: {'Fwd': 0.04396849255404202, 'K': 8, 'alpha': 0.75, 'dropout': 0.8, 'gnnepoch': 100, 'lambda1': 0.7000000000000001, 'lambda2': 8.449128993955373, 'loop': 0, 'loss': 'CE', 'lr': 0.0012317897721235802, 'softmaxF': False, 'useGCN': True, 'weight_decay': 2.671668276227861e-05, 'weightedloss': True}. Best is trial 605 with value: 72.13333129882812.
/home/wxy/miniconda3/lib/python3.10/site-packages/optuna/distributions.py:685: UserWarning: The distribution is specified by [0, 1.00001] and step=0.05, but the range is not divisible by `step`. It will be replaced by [0, 1.0].
  warnings.warn(
K:  6
alpha:  0.8500000000000001
lr:  0.0020157606776961333
weight_decay:  4.8648349957983097e-05
dropout:  0.8
fix split and run 3 times
Data: Data(x=[3327, 3703], y=[3327], train_mask=[3327], val_mask=[3327], test_mask=[3327], adj_t=[3327, 3327, nnz=9104])
num_train tensor(120)
num_noise 0
noise: tensor(0)
data feature 3703
ALTOPT(
  (lins): Sequential(
    (0): Linear(in_features=3703, out_features=64, bias=True)
    (1): BatchNorm1d(64, eps=1e-05, momentum=0.1, affine=True, track_running_stats=True)
    (2): Dropout(p=0.8, inplace=True)
    (3): ReLU(inplace=True)
    (4): Linear(in_features=64, out_features=6, bias=True)
    (5): LogSoftmax(dim=-1)
  )
  (prop): Propagation(K=6, mode=None, lambda1=None, lambda2=None, L21=True, alpha=0.8500000000000001)
  (gcn): GCN(
    (convs): ModuleList(
      (0): GCNConv(3703, 64)
      (1): GCNConv(64, 6)
    )
    (bns): ModuleList(
      (0): BatchNorm1d(64, eps=1e-05, momentum=0.1, affine=True, track_running_stats=True)
    )
    (output): LogSoftmax(dim=-1)
  )
)
propagate done
init label
Split: 01, Run: 01
None time:  1.036709126085043
None Run 01:
Highest Train: 100.00
Highest Valid: 71.60
  Final Train: 100.00
   Final Test: 69.80
Split: 01, Run: 02
None time:  1.0822985540144145
None Run 02:
Highest Train: 100.00
Highest Valid: 72.20
  Final Train: 100.00
   Final Test: 70.20
Split: 01, Run: 03
None time:  1.0026979881804436
None Run 03:
Highest Train: 100.00
Highest Valid: 71.60
  Final Train: 100.00
   Final Test: 69.80
run time now: 3.1716179847717285
total time:  3.227637992007658
None All runs:
Highest Train: 100.00 ± 0.00
Highest Valid: 71.80 ± 0.35
  Final Train: 100.00 ± 0.00
   Final Test: 69.93 ± 0.23
[I 2023-06-12 00:06:06,705] Trial 708 finished with value: 71.79999542236328 and parameters: {'Fwd': 1.7430720375426917e-05, 'K': 6, 'alpha': 0.8500000000000001, 'dropout': 0.8, 'gnnepoch': 120, 'lambda1': 0.65, 'lambda2': 4.426805717472807, 'loop': 0, 'loss': 'CE', 'lr': 0.0020157606776961333, 'softmaxF': False, 'useGCN': True, 'weight_decay': 4.8648349957983097e-05, 'weightedloss': True}. Best is trial 605 with value: 72.13333129882812.
/home/wxy/miniconda3/lib/python3.10/site-packages/optuna/distributions.py:685: UserWarning: The distribution is specified by [0, 1.00001] and step=0.05, but the range is not divisible by `step`. It will be replaced by [0, 1.0].
  warnings.warn(
K:  8
alpha:  0.9
lr:  0.001397562393320963
weight_decay:  8.31688950436897e-06
dropout:  0.9
fix split and run 3 times
Data: Data(x=[3327, 3703], y=[3327], train_mask=[3327], val_mask=[3327], test_mask=[3327], adj_t=[3327, 3327, nnz=9104])
num_train tensor(120)
num_noise 0
noise: tensor(0)
data feature 3703
ALTOPT(
  (lins): Sequential(
    (0): Linear(in_features=3703, out_features=64, bias=True)
    (1): BatchNorm1d(64, eps=1e-05, momentum=0.1, affine=True, track_running_stats=True)
    (2): Dropout(p=0.9, inplace=True)
    (3): ReLU(inplace=True)
    (4): Linear(in_features=64, out_features=6, bias=True)
    (5): LogSoftmax(dim=-1)
  )
  (prop): Propagation(K=8, mode=None, lambda1=None, lambda2=None, L21=True, alpha=0.9)
  (gcn): GCN(
    (convs): ModuleList(
      (0): GCNConv(3703, 64)
      (1): GCNConv(64, 6)
    )
    (bns): ModuleList(
      (0): BatchNorm1d(64, eps=1e-05, momentum=0.1, affine=True, track_running_stats=True)
    )
    (output): LogSoftmax(dim=-1)
  )
)
propagate done
init label
Split: 01, Run: 01
None time:  1.0055984111968428
None Run 01:
Highest Train: 100.00
Highest Valid: 70.40
  Final Train: 99.17
   Final Test: 68.90
Split: 01, Run: 02
None time:  1.1584406609181315
None Run 02:
Highest Train: 100.00
Highest Valid: 71.20
  Final Train: 98.33
   Final Test: 70.10
Split: 01, Run: 03
None time:  1.0704631060361862
None Run 03:
Highest Train: 100.00
Highest Valid: 72.00
  Final Train: 95.83
   Final Test: 70.60
run time now: 3.2746639251708984
total time:  3.326847149990499
None All runs:
Highest Train: 100.00 ± 0.00
Highest Valid: 71.20 ± 0.80
  Final Train: 97.78 ± 1.73
   Final Test: 69.87 ± 0.87
[I 2023-06-12 00:06:10,574] Trial 709 finished with value: 71.20000457763672 and parameters: {'Fwd': 0.0039002619541873168, 'K': 8, 'alpha': 0.9, 'dropout': 0.9, 'gnnepoch': 120, 'lambda1': 0.75, 'lambda2': 0.6090077931383533, 'loop': 0, 'loss': 'CE', 'lr': 0.001397562393320963, 'softmaxF': False, 'useGCN': True, 'weight_decay': 8.31688950436897e-06, 'weightedloss': True}. Best is trial 605 with value: 72.13333129882812.
/home/wxy/miniconda3/lib/python3.10/site-packages/optuna/distributions.py:685: UserWarning: The distribution is specified by [0, 1.00001] and step=0.05, but the range is not divisible by `step`. It will be replaced by [0, 1.0].
  warnings.warn(
K:  8
alpha:  0.6000000000000001
lr:  0.006144451231923726
weight_decay:  1.234884659433469e-05
dropout:  0.8
fix split and run 3 times
Data: Data(x=[3327, 3703], y=[3327], train_mask=[3327], val_mask=[3327], test_mask=[3327], adj_t=[3327, 3327, nnz=9104])
num_train tensor(120)
num_noise 0
noise: tensor(0)
data feature 3703
ALTOPT(
  (lins): Sequential(
    (0): Linear(in_features=3703, out_features=64, bias=True)
    (1): BatchNorm1d(64, eps=1e-05, momentum=0.1, affine=True, track_running_stats=True)
    (2): Dropout(p=0.8, inplace=True)
    (3): ReLU(inplace=True)
    (4): Linear(in_features=64, out_features=6, bias=True)
    (5): LogSoftmax(dim=-1)
  )
  (prop): Propagation(K=8, mode=None, lambda1=None, lambda2=None, L21=True, alpha=0.6000000000000001)
  (gcn): GCN(
    (convs): ModuleList(
      (0): GCNConv(3703, 64)
      (1): GCNConv(64, 6)
    )
    (bns): ModuleList(
      (0): BatchNorm1d(64, eps=1e-05, momentum=0.1, affine=True, track_running_stats=True)
    )
    (output): LogSoftmax(dim=-1)
  )
)
propagate done
init label
Split: 01, Run: 01
None time:  1.168327647028491
None Run 01:
Highest Train: 100.00
Highest Valid: 70.80
  Final Train: 99.17
   Final Test: 69.50
Split: 01, Run: 02
None time:  1.1226490479893982
None Run 02:
Highest Train: 100.00
Highest Valid: 70.60
  Final Train: 99.17
   Final Test: 69.10
Split: 01, Run: 03
None time:  1.115482916124165
None Run 03:
Highest Train: 100.00
Highest Valid: 70.80
  Final Train: 100.00
   Final Test: 69.60
run time now: 3.4473366737365723
total time:  3.4983128218445927
None All runs:
Highest Train: 100.00 ± 0.00
Highest Valid: 70.73 ± 0.12
  Final Train: 99.44 ± 0.48
   Final Test: 69.40 ± 0.26
