[I 2023-06-11 23:51:44,211] Trial 485 finished with value: 72.0 and parameters: {'Fwd': 0.043646905613037267, 'K': 8, 'alpha': 0.75, 'dropout': 0.8, 'gnnepoch': 120, 'lambda1': 0.75, 'lambda2': 9.460281493330312, 'loop': 0, 'loss': 'CE', 'lr': 0.0013451006464758855, 'softmaxF': False, 'useGCN': True, 'weight_decay': 0.0007782530917397301, 'weightedloss': True}. Best is trial 271 with value: 72.06666564941406.
/home/wxy/miniconda3/lib/python3.10/site-packages/optuna/distributions.py:685: UserWarning: The distribution is specified by [0, 1.00001] and step=0.05, but the range is not divisible by `step`. It will be replaced by [0, 1.0].
  warnings.warn(
K:  8
alpha:  0.8
lr:  0.0012383805982482165
weight_decay:  0.0012513613868438624
dropout:  0.8
fix split and run 3 times
Data: Data(x=[3327, 3703], y=[3327], train_mask=[3327], val_mask=[3327], test_mask=[3327], adj_t=[3327, 3327, nnz=9104])
num_train tensor(120)
num_noise 0
noise: tensor(0)
data feature 3703
ALTOPT(
  (lins): Sequential(
    (0): Linear(in_features=3703, out_features=64, bias=True)
    (1): BatchNorm1d(64, eps=1e-05, momentum=0.1, affine=True, track_running_stats=True)
    (2): Dropout(p=0.8, inplace=True)
    (3): ReLU(inplace=True)
    (4): Linear(in_features=64, out_features=6, bias=True)
    (5): LogSoftmax(dim=-1)
  )
  (prop): Propagation(K=8, mode=None, lambda1=None, lambda2=None, L21=True, alpha=0.8)
  (gcn): GCN(
    (convs): ModuleList(
      (0): GCNConv(3703, 64)
      (1): GCNConv(64, 6)
    )
    (bns): ModuleList(
      (0): BatchNorm1d(64, eps=1e-05, momentum=0.1, affine=True, track_running_stats=True)
    )
    (output): LogSoftmax(dim=-1)
  )
)
propagate done
init label
Split: 01, Run: 01
None time:  0.9644867000170052
None Run 01:
Highest Train: 100.00
Highest Valid: 71.60
  Final Train: 100.00
   Final Test: 69.70
Split: 01, Run: 02
None time:  1.0020881791133434
None Run 02:
Highest Train: 100.00
Highest Valid: 72.40
  Final Train: 100.00
   Final Test: 69.80
Split: 01, Run: 03
None time:  1.0811439352110028
None Run 03:
Highest Train: 100.00
Highest Valid: 71.80
  Final Train: 100.00
   Final Test: 70.60
run time now: 3.0883569717407227
total time:  3.145279407966882
None All runs:
Highest Train: 100.00 ± 0.00
Highest Valid: 71.93 ± 0.42
  Final Train: 100.00 ± 0.00
   Final Test: 70.03 ± 0.49
[I 2023-06-11 23:51:47,861] Trial 486 finished with value: 71.93333435058594 and parameters: {'Fwd': 2.246109857124923e-06, 'K': 8, 'alpha': 0.8, 'dropout': 0.8, 'gnnepoch': 120, 'lambda1': 0.75, 'lambda2': 7.041016913234772, 'loop': 0, 'loss': 'CE', 'lr': 0.0012383805982482165, 'softmaxF': False, 'useGCN': True, 'weight_decay': 0.0012513613868438624, 'weightedloss': True}. Best is trial 271 with value: 72.06666564941406.
/home/wxy/miniconda3/lib/python3.10/site-packages/optuna/distributions.py:685: UserWarning: The distribution is specified by [0, 1.00001] and step=0.05, but the range is not divisible by `step`. It will be replaced by [0, 1.0].
  warnings.warn(
K:  8
alpha:  0.8
lr:  0.0011173951426382536
weight_decay:  0.0018927782704230053
dropout:  0.8
fix split and run 3 times
Data: Data(x=[3327, 3703], y=[3327], train_mask=[3327], val_mask=[3327], test_mask=[3327], adj_t=[3327, 3327, nnz=9104])
num_train tensor(120)
num_noise 0
noise: tensor(0)
data feature 3703
ALTOPT(
  (lins): Sequential(
    (0): Linear(in_features=3703, out_features=64, bias=True)
    (1): BatchNorm1d(64, eps=1e-05, momentum=0.1, affine=True, track_running_stats=True)
    (2): Dropout(p=0.8, inplace=True)
    (3): ReLU(inplace=True)
    (4): Linear(in_features=64, out_features=6, bias=True)
    (5): Identity()
  )
  (prop): Propagation(K=8, mode=None, lambda1=None, lambda2=None, L21=True, alpha=0.8)
  (gcn): GCN(
    (convs): ModuleList(
      (0): GCNConv(3703, 64)
      (1): GCNConv(64, 6)
    )
    (bns): ModuleList(
      (0): BatchNorm1d(64, eps=1e-05, momentum=0.1, affine=True, track_running_stats=True)
    )
    (output): Identity()
  )
)
propagate done
init label
Split: 01, Run: 01, Epoch: 100, Loss: 0.0000, Train: 100.00%, Valid: 70.40% Test: 69.50%
Split: 01, Run: 01
None time:  1.756024147151038
None Run 01:
Highest Train: 100.00
Highest Valid: 70.40
  Final Train: 100.00
   Final Test: 69.50
Split: 01, Run: 02, Epoch: 100, Loss: 0.0000, Train: 100.00%, Valid: 70.40% Test: 69.70%
Split: 01, Run: 02
None time:  1.8088016400579363
None Run 02:
Highest Train: 100.00
Highest Valid: 70.40
  Final Train: 100.00
   Final Test: 69.70
Split: 01, Run: 03, Epoch: 100, Loss: 0.0000, Train: 100.00%, Valid: 69.20% Test: 69.60%
Split: 01, Run: 03
None time:  1.8041247089859098
None Run 03:
Highest Train: 100.00
Highest Valid: 69.20
  Final Train: 100.00
   Final Test: 69.60
run time now: 5.410748243331909
total time:  5.467655434040353
None All runs:
Highest Train: 100.00 ± 0.00
Highest Valid: 70.00 ± 0.69
  Final Train: 100.00 ± 0.00
   Final Test: 69.60 ± 0.10
[I 2023-06-11 23:51:53,899] Trial 487 finished with value: 70.0 and parameters: {'Fwd': 0.0022970038212877697, 'K': 8, 'alpha': 0.8, 'dropout': 0.8, 'gnnepoch': 120, 'lambda1': 0.75, 'lambda2': 6.853873797783335, 'loop': 0, 'loss': 'MSE', 'lr': 0.0011173951426382536, 'softmaxF': False, 'useGCN': True, 'weight_decay': 0.0018927782704230053, 'weightedloss': True}. Best is trial 271 with value: 72.06666564941406.
/home/wxy/miniconda3/lib/python3.10/site-packages/optuna/distributions.py:685: UserWarning: The distribution is specified by [0, 1.00001] and step=0.05, but the range is not divisible by `step`. It will be replaced by [0, 1.0].
  warnings.warn(
K:  9
alpha:  0.8
lr:  0.0007344421114978206
weight_decay:  0.001086523348533165
dropout:  0.8
fix split and run 3 times
Data: Data(x=[3327, 3703], y=[3327], train_mask=[3327], val_mask=[3327], test_mask=[3327], adj_t=[3327, 3327, nnz=9104])
num_train tensor(120)
num_noise 0
noise: tensor(0)
data feature 3703
ALTOPT(
  (lins): Sequential(
    (0): Linear(in_features=3703, out_features=64, bias=True)
    (1): BatchNorm1d(64, eps=1e-05, momentum=0.1, affine=True, track_running_stats=True)
    (2): Dropout(p=0.8, inplace=True)
    (3): ReLU(inplace=True)
    (4): Linear(in_features=64, out_features=6, bias=True)
    (5): LogSoftmax(dim=-1)
  )
  (prop): Propagation(K=9, mode=None, lambda1=None, lambda2=None, L21=True, alpha=0.8)
  (gcn): GCN(
    (convs): ModuleList(
      (0): GCNConv(3703, 64)
      (1): GCNConv(64, 6)
    )
    (bns): ModuleList(
      (0): BatchNorm1d(64, eps=1e-05, momentum=0.1, affine=True, track_running_stats=True)
    )
    (output): LogSoftmax(dim=-1)
  )
)
propagate done
init label
Split: 01, Run: 01
None time:  1.0744624328799546
None Run 01:
Highest Train: 100.00
Highest Valid: 70.60
  Final Train: 100.00
   Final Test: 69.00
Split: 01, Run: 02
None time:  1.1110427628736943
None Run 02:
Highest Train: 100.00
Highest Valid: 71.40
  Final Train: 100.00
   Final Test: 69.70
Split: 01, Run: 03
None time:  1.0563709689304233
None Run 03:
Highest Train: 100.00
Highest Valid: 69.60
  Final Train: 100.00
   Final Test: 69.60
run time now: 3.2833621501922607
total time:  3.3381520081311464
None All runs:
Highest Train: 100.00 ± 0.00
Highest Valid: 70.53 ± 0.90
  Final Train: 100.00 ± 0.00
   Final Test: 69.43 ± 0.38
[I 2023-06-11 23:51:57,737] Trial 488 finished with value: 70.53333282470703 and parameters: {'Fwd': 0.07532278738090374, 'K': 9, 'alpha': 0.8, 'dropout': 0.8, 'gnnepoch': 120, 'lambda1': 0.75, 'lambda2': 9.32540526648334, 'loop': 0, 'loss': 'CE', 'lr': 0.0007344421114978206, 'softmaxF': False, 'useGCN': True, 'weight_decay': 0.001086523348533165, 'weightedloss': True}. Best is trial 271 with value: 72.06666564941406.
/home/wxy/miniconda3/lib/python3.10/site-packages/optuna/distributions.py:685: UserWarning: The distribution is specified by [0, 1.00001] and step=0.05, but the range is not divisible by `step`. It will be replaced by [0, 1.0].
  warnings.warn(
K:  8
alpha:  0.8500000000000001
lr:  0.0011893853212902718
weight_decay:  0.0007512710633237333
dropout:  0.8
fix split and run 3 times
Data: Data(x=[3327, 3703], y=[3327], train_mask=[3327], val_mask=[3327], test_mask=[3327], adj_t=[3327, 3327, nnz=9104])
num_train tensor(120)
num_noise 0
noise: tensor(0)
data feature 3703
ALTOPT(
  (lins): Sequential(
    (0): Linear(in_features=3703, out_features=64, bias=True)
    (1): BatchNorm1d(64, eps=1e-05, momentum=0.1, affine=True, track_running_stats=True)
    (2): Dropout(p=0.8, inplace=True)
    (3): ReLU(inplace=True)
    (4): Linear(in_features=64, out_features=6, bias=True)
    (5): LogSoftmax(dim=-1)
  )
  (prop): Propagation(K=8, mode=None, lambda1=None, lambda2=None, L21=True, alpha=0.8500000000000001)
  (gcn): GCN(
    (convs): ModuleList(
      (0): GCNConv(3703, 64)
      (1): GCNConv(64, 6)
    )
    (bns): ModuleList(
      (0): BatchNorm1d(64, eps=1e-05, momentum=0.1, affine=True, track_running_stats=True)
    )
    (output): LogSoftmax(dim=-1)
  )
)
propagate done
init label
Split: 01, Run: 01
None time:  0.9468494059983641
None Run 01:
Highest Train: 100.00
Highest Valid: 71.00
  Final Train: 100.00
   Final Test: 70.10
Split: 01, Run: 02
None time:  1.0684973350726068
None Run 02:
Highest Train: 100.00
Highest Valid: 68.60
  Final Train: 100.00
   Final Test: 67.90
Split: 01, Run: 03
None time:  0.9251433329191059
None Run 03:
Highest Train: 100.00
Highest Valid: 70.80
  Final Train: 100.00
   Final Test: 70.70
run time now: 2.9815659523010254
total time:  3.0343261379748583
None All runs:
Highest Train: 100.00 ± 0.00
Highest Valid: 70.13 ± 1.33
  Final Train: 100.00 ± 0.00
   Final Test: 69.57 ± 1.47
[I 2023-06-11 23:52:01,382] Trial 489 finished with value: 70.13333892822266 and parameters: {'Fwd': 3.627013003822317e-05, 'K': 8, 'alpha': 0.8500000000000001, 'dropout': 0.8, 'gnnepoch': 110, 'lambda1': 0.75, 'lambda2': 9.216931834500524, 'loop': 0, 'loss': 'CE', 'lr': 0.0011893853212902718, 'softmaxF': False, 'useGCN': True, 'weight_decay': 0.0007512710633237333, 'weightedloss': True}. Best is trial 271 with value: 72.06666564941406.
/home/wxy/miniconda3/lib/python3.10/site-packages/optuna/distributions.py:685: UserWarning: The distribution is specified by [0, 1.00001] and step=0.05, but the range is not divisible by `step`. It will be replaced by [0, 1.0].
  warnings.warn(
K:  8
alpha:  0.8
lr:  0.0008521224445141481
weight_decay:  0.001230099098805373
dropout:  0.8
fix split and run 3 times
Data: Data(x=[3327, 3703], y=[3327], train_mask=[3327], val_mask=[3327], test_mask=[3327], adj_t=[3327, 3327, nnz=9104])
num_train tensor(120)
num_noise 0
noise: tensor(0)
data feature 3703
ALTOPT(
  (lins): Sequential(
    (0): Linear(in_features=3703, out_features=64, bias=True)
    (1): BatchNorm1d(64, eps=1e-05, momentum=0.1, affine=True, track_running_stats=True)
    (2): Dropout(p=0.8, inplace=True)
    (3): ReLU(inplace=True)
    (4): Linear(in_features=64, out_features=6, bias=True)
    (5): LogSoftmax(dim=-1)
  )
  (prop): Propagation(K=8, mode=None, lambda1=None, lambda2=None, L21=True, alpha=0.8)
  (gcn): GCN(
    (convs): ModuleList(
      (0): GCNConv(3703, 64)
      (1): GCNConv(64, 6)
    )
    (bns): ModuleList(
      (0): BatchNorm1d(64, eps=1e-05, momentum=0.1, affine=True, track_running_stats=True)
    )
    (output): LogSoftmax(dim=-1)
  )
)
propagate done
init label
Split: 01, Run: 01
None time:  0.9781573379877955
None Run 01:
Highest Train: 100.00
Highest Valid: 70.20
  Final Train: 100.00
   Final Test: 69.30
Split: 01, Run: 02
None time:  1.061934102093801
None Run 02:
Highest Train: 100.00
Highest Valid: 71.80
  Final Train: 100.00
   Final Test: 70.00
Split: 01, Run: 03
None time:  1.131840460933745
None Run 03:
Highest Train: 100.00
Highest Valid: 71.00
  Final Train: 100.00
   Final Test: 70.50
run time now: 3.212228775024414
total time:  3.2596204958390445
None All runs:
Highest Train: 100.00 ± 0.00
Highest Valid: 71.00 ± 0.80
  Final Train: 100.00 ± 0.00
   Final Test: 69.93 ± 0.60
[I 2023-06-11 23:52:05,142] Trial 490 finished with value: 71.0 and parameters: {'Fwd': 2.5252414762572525e-05, 'K': 8, 'alpha': 0.8, 'dropout': 0.8, 'gnnepoch': 120, 'lambda1': 0.75, 'lambda2': 7.27714450823189, 'loop': 0, 'loss': 'CE', 'lr': 0.0008521224445141481, 'softmaxF': False, 'useGCN': True, 'weight_decay': 0.001230099098805373, 'weightedloss': True}. Best is trial 271 with value: 72.06666564941406.
/home/wxy/miniconda3/lib/python3.10/site-packages/optuna/distributions.py:685: UserWarning: The distribution is specified by [0, 1.00001] and step=0.05, but the range is not divisible by `step`. It will be replaced by [0, 1.0].
  warnings.warn(
K:  8
alpha:  0.8500000000000001
lr:  0.001271211850490216
weight_decay:  0.0009361095976897816
dropout:  0.8
fix split and run 3 times
Data: Data(x=[3327, 3703], y=[3327], train_mask=[3327], val_mask=[3327], test_mask=[3327], adj_t=[3327, 3327, nnz=9104])
num_train tensor(120)
num_noise 0
noise: tensor(0)
data feature 3703
ALTOPT(
  (lins): Sequential(
    (0): Linear(in_features=3703, out_features=64, bias=True)
    (1): BatchNorm1d(64, eps=1e-05, momentum=0.1, affine=True, track_running_stats=True)
    (2): Dropout(p=0.8, inplace=True)
    (3): ReLU(inplace=True)
    (4): Linear(in_features=64, out_features=6, bias=True)
    (5): LogSoftmax(dim=-1)
  )
  (prop): Propagation(K=8, mode=None, lambda1=None, lambda2=None, L21=True, alpha=0.8500000000000001)
  (gcn): GCN(
    (convs): ModuleList(
      (0): GCNConv(3703, 64)
      (1): GCNConv(64, 6)
    )
    (bns): ModuleList(
      (0): BatchNorm1d(64, eps=1e-05, momentum=0.1, affine=True, track_running_stats=True)
    )
    (output): LogSoftmax(dim=-1)
  )
)
propagate done
init label
Split: 01, Run: 01
None time:  0.9915744059253484
None Run 01:
Highest Train: 100.00
Highest Valid: 71.60
  Final Train: 100.00
   Final Test: 69.60
Split: 01, Run: 02
None time:  1.065562724135816
None Run 02:
Highest Train: 100.00
Highest Valid: 72.40
  Final Train: 100.00
   Final Test: 69.80
Split: 01, Run: 03
None time:  1.1084726720582694
None Run 03:
Highest Train: 100.00
Highest Valid: 71.80
  Final Train: 100.00
   Final Test: 70.70
run time now: 3.2071189880371094
total time:  3.2687504270579666
None All runs:
Highest Train: 100.00 ± 0.00
Highest Valid: 71.93 ± 0.42
  Final Train: 100.00 ± 0.00
   Final Test: 70.03 ± 0.59
[I 2023-06-11 23:52:08,857] Trial 491 finished with value: 71.93333435058594 and parameters: {'Fwd': 1.3681752486083252e-06, 'K': 8, 'alpha': 0.8500000000000001, 'dropout': 0.8, 'gnnepoch': 120, 'lambda1': 0.75, 'lambda2': 9.736886962442684, 'loop': 0, 'loss': 'CE', 'lr': 0.001271211850490216, 'softmaxF': False, 'useGCN': True, 'weight_decay': 0.0009361095976897816, 'weightedloss': True}. Best is trial 271 with value: 72.06666564941406.
/home/wxy/miniconda3/lib/python3.10/site-packages/optuna/distributions.py:685: UserWarning: The distribution is specified by [0, 1.00001] and step=0.05, but the range is not divisible by `step`. It will be replaced by [0, 1.0].
  warnings.warn(
K:  8
alpha:  0.8500000000000001
lr:  0.0010111383324602936
weight_decay:  0.0007994123005645153
dropout:  0.8
fix split and run 3 times
Data: Data(x=[3327, 3703], y=[3327], train_mask=[3327], val_mask=[3327], test_mask=[3327], adj_t=[3327, 3327, nnz=9104])
num_train tensor(120)
num_noise 0
noise: tensor(0)
data feature 3703
ALTOPT(
  (lins): Sequential(
    (0): Linear(in_features=3703, out_features=64, bias=True)
    (1): BatchNorm1d(64, eps=1e-05, momentum=0.1, affine=True, track_running_stats=True)
    (2): Dropout(p=0.8, inplace=True)
    (3): ReLU(inplace=True)
    (4): Linear(in_features=64, out_features=6, bias=True)
    (5): LogSoftmax(dim=-1)
  )
  (prop): Propagation(K=8, mode=None, lambda1=None, lambda2=None, L21=True, alpha=0.8500000000000001)
  (gcn): GCN(
    (convs): ModuleList(
      (0): GCNConv(3703, 64)
      (1): GCNConv(64, 6)
    )
    (bns): ModuleList(
      (0): BatchNorm1d(64, eps=1e-05, momentum=0.1, affine=True, track_running_stats=True)
    )
    (output): LogSoftmax(dim=-1)
  )
)
propagate done
init label
Split: 01, Run: 01
None time:  1.033502658130601
None Run 01:
Highest Train: 100.00
Highest Valid: 70.60
  Final Train: 100.00
   Final Test: 69.40
Split: 01, Run: 02
None time:  1.0437135100364685
None Run 02:
Highest Train: 100.00
Highest Valid: 72.40
  Final Train: 100.00
   Final Test: 69.60
Split: 01, Run: 03
None time:  1.1105563470628113
None Run 03:
Highest Train: 100.00
Highest Valid: 71.40
  Final Train: 100.00
   Final Test: 70.40
run time now: 3.2317516803741455
total time:  3.285470373928547
None All runs:
Highest Train: 100.00 ± 0.00
Highest Valid: 71.47 ± 0.90
  Final Train: 100.00 ± 0.00
   Final Test: 69.80 ± 0.53
[I 2023-06-11 23:52:12,571] Trial 492 finished with value: 71.46666717529297 and parameters: {'Fwd': 1.9908657045838128e-06, 'K': 8, 'alpha': 0.8500000000000001, 'dropout': 0.8, 'gnnepoch': 120, 'lambda1': 0.75, 'lambda2': 9.413262772696502, 'loop': 0, 'loss': 'CE', 'lr': 0.0010111383324602936, 'softmaxF': True, 'useGCN': True, 'weight_decay': 0.0007994123005645153, 'weightedloss': True}. Best is trial 271 with value: 72.06666564941406.
/home/wxy/miniconda3/lib/python3.10/site-packages/optuna/distributions.py:685: UserWarning: The distribution is specified by [0, 1.00001] and step=0.05, but the range is not divisible by `step`. It will be replaced by [0, 1.0].
  warnings.warn(
K:  8
alpha:  0.8500000000000001
lr:  0.0012413832020848727
weight_decay:  0.0010686767816297424
dropout:  0.7000000000000001
fix split and run 3 times
Data: Data(x=[3327, 3703], y=[3327], train_mask=[3327], val_mask=[3327], test_mask=[3327], adj_t=[3327, 3327, nnz=9104])
num_train tensor(120)
num_noise 0
noise: tensor(0)
data feature 3703
ALTOPT(
  (lins): Sequential(
    (0): Linear(in_features=3703, out_features=64, bias=True)
    (1): BatchNorm1d(64, eps=1e-05, momentum=0.1, affine=True, track_running_stats=True)
    (2): Dropout(p=0.7000000000000001, inplace=True)
    (3): ReLU(inplace=True)
    (4): Linear(in_features=64, out_features=6, bias=True)
    (5): LogSoftmax(dim=-1)
  )
  (prop): Propagation(K=8, mode=None, lambda1=None, lambda2=None, L21=True, alpha=0.8500000000000001)
  (gcn): GCN(
    (convs): ModuleList(
      (0): GCNConv(3703, 64)
      (1): GCNConv(64, 6)
    )
    (bns): ModuleList(
      (0): BatchNorm1d(64, eps=1e-05, momentum=0.1, affine=True, track_running_stats=True)
    )
    (output): LogSoftmax(dim=-1)
  )
)
propagate done
init label
Split: 01, Run: 01
None time:  0.4511376798618585
None Run 01:
Highest Train: 100.00
Highest Valid: 70.20
  Final Train: 100.00
   Final Test: 69.00
Split: 01, Run: 02
None time:  0.4863583769183606
None Run 02:
Highest Train: 100.00
Highest Valid: 67.00
  Final Train: 100.00
   Final Test: 65.80
Split: 01, Run: 03
None time:  0.45523587707430124
None Run 03:
Highest Train: 100.00
Highest Valid: 70.40
  Final Train: 100.00
   Final Test: 69.80
run time now: 1.4336719512939453
total time:  1.480844764970243
None All runs:
Highest Train: 100.00 ± 0.00
Highest Valid: 69.20 ± 1.91
  Final Train: 100.00 ± 0.00
   Final Test: 68.20 ± 2.12
[I 2023-06-11 23:52:14,599] Trial 493 finished with value: 69.20000457763672 and parameters: {'Fwd': 1.032554346824167e-06, 'K': 8, 'alpha': 0.8500000000000001, 'dropout': 0.7000000000000001, 'gnnepoch': 40, 'lambda1': 0.55, 'lambda2': 9.866734100419094, 'loop': 0, 'loss': 'CE', 'lr': 0.0012413832020848727, 'softmaxF': False, 'useGCN': True, 'weight_decay': 0.0010686767816297424, 'weightedloss': True}. Best is trial 271 with value: 72.06666564941406.
/home/wxy/miniconda3/lib/python3.10/site-packages/optuna/distributions.py:685: UserWarning: The distribution is specified by [0, 1.00001] and step=0.05, but the range is not divisible by `step`. It will be replaced by [0, 1.0].
  warnings.warn(
K:  9
alpha:  0.9
lr:  0.001058413311091664
weight_decay:  0.0007430896763539266
dropout:  0.8
fix split and run 3 times
Data: Data(x=[3327, 3703], y=[3327], train_mask=[3327], val_mask=[3327], test_mask=[3327], adj_t=[3327, 3327, nnz=9104])
num_train tensor(120)
num_noise 0
noise: tensor(0)
data feature 3703
ALTOPT(
  (lins): Sequential(
    (0): Linear(in_features=3703, out_features=64, bias=True)
    (1): BatchNorm1d(64, eps=1e-05, momentum=0.1, affine=True, track_running_stats=True)
    (2): Dropout(p=0.8, inplace=True)
    (3): ReLU(inplace=True)
    (4): Linear(in_features=64, out_features=6, bias=True)
    (5): LogSoftmax(dim=-1)
  )
  (prop): Propagation(K=9, mode=None, lambda1=None, lambda2=None, L21=True, alpha=0.9)
  (gcn): GCN(
    (convs): ModuleList(
      (0): GCNConv(3703, 64)
      (1): GCNConv(64, 6)
    )
    (bns): ModuleList(
      (0): BatchNorm1d(64, eps=1e-05, momentum=0.1, affine=True, track_running_stats=True)
    )
    (output): LogSoftmax(dim=-1)
  )
)
propagate done
init label
Split: 01, Run: 01
None time:  1.0972391569521278
None Run 01:
Highest Train: 100.00
Highest Valid: 70.40
  Final Train: 100.00
   Final Test: 69.50
Split: 01, Run: 02
None time:  1.0347092770971358
None Run 02:
Highest Train: 100.00
Highest Valid: 71.80
  Final Train: 100.00
   Final Test: 69.80
Split: 01, Run: 03
None time:  1.0299794061575085
None Run 03:
Highest Train: 100.00
Highest Valid: 71.40
  Final Train: 100.00
   Final Test: 70.30
run time now: 3.2046563625335693
total time:  3.264897827990353
None All runs:
Highest Train: 100.00 ± 0.00
Highest Valid: 71.20 ± 0.72
  Final Train: 100.00 ± 0.00
   Final Test: 69.87 ± 0.40
