[I 2023-06-12 00:50:56,890] Trial 412 finished with value: 78.53333282470703 and parameters: {'Fwd': 0.0821778745529184, 'K': 9, 'alpha': 0.7000000000000001, 'dropout': 0.30000000000000004, 'gnnepoch': 70, 'lambda1': 0.9500000000000001, 'lambda2': 3.2706932192765352, 'loop': 1, 'loss': 'CE', 'lr': 0.0007784078975168969, 'softmaxF': True, 'useGCN': True, 'weight_decay': 2.914568849621758e-05, 'weightedloss': True}. Best is trial 112 with value: 81.66667175292969.
/home/wxy/miniconda3/lib/python3.10/site-packages/optuna/distributions.py:685: UserWarning: The distribution is specified by [0, 1.00001] and step=0.05, but the range is not divisible by `step`. It will be replaced by [0, 1.0].
  warnings.warn(
K:  10
alpha:  0.75
lr:  0.00852320747719124
weight_decay:  0.00018140057358487192
dropout:  0.5
fix split and run 3 times
Data: Data(x=[2708, 1433], y=[2708], train_mask=[2708], val_mask=[2708], test_mask=[2708], adj_t=[2708, 2708, nnz=10556])
num_train tensor(140)
num_noise 0
noise: tensor(0)
data feature 1433
ALTOPT(
  (lins): Sequential(
    (0): Linear(in_features=1433, out_features=64, bias=True)
    (1): BatchNorm1d(64, eps=1e-05, momentum=0.1, affine=True, track_running_stats=True)
    (2): Dropout(p=0.5, inplace=True)
    (3): ReLU(inplace=True)
    (4): Linear(in_features=64, out_features=7, bias=True)
    (5): LogSoftmax(dim=-1)
  )
  (prop): Propagation(K=10, mode=None, lambda1=None, lambda2=None, L21=True, alpha=0.75)
  (gcn): GCN(
    (convs): ModuleList(
      (0): GCNConv(1433, 64)
      (1): GCNConv(64, 7)
    )
    (bns): ModuleList(
      (0): BatchNorm1d(64, eps=1e-05, momentum=0.1, affine=True, track_running_stats=True)
    )
    (output): LogSoftmax(dim=-1)
  )
)
propagate done
init label
Split: 01, Run: 01
None time:  1.7021998099517077
None Run 01:
Highest Train: 100.00
Highest Valid: 81.20
  Final Train: 100.00
   Final Test: 82.30
Split: 01, Run: 02
None time:  1.7268948601558805
None Run 02:
Highest Train: 100.00
Highest Valid: 81.00
  Final Train: 100.00
   Final Test: 81.70
Split: 01, Run: 03
None time:  1.7562777660787106
None Run 03:
Highest Train: 100.00
Highest Valid: 80.60
  Final Train: 100.00
   Final Test: 81.80
run time now: 5.213304042816162
total time:  5.229339543031529
None All runs:
Highest Train: 100.00 ± 0.00
Highest Valid: 80.93 ± 0.31
  Final Train: 100.00 ± 0.00
   Final Test: 81.93 ± 0.32
[I 2023-06-12 00:51:02,630] Trial 413 finished with value: 80.9333267211914 and parameters: {'Fwd': 0.004548777255111314, 'K': 10, 'alpha': 0.75, 'dropout': 0.5, 'gnnepoch': 60, 'lambda1': 0.9, 'lambda2': 4.610388007260656, 'loop': 1, 'loss': 'CE', 'lr': 0.00852320747719124, 'softmaxF': True, 'useGCN': True, 'weight_decay': 0.00018140057358487192, 'weightedloss': True}. Best is trial 112 with value: 81.66667175292969.
/home/wxy/miniconda3/lib/python3.10/site-packages/optuna/distributions.py:685: UserWarning: The distribution is specified by [0, 1.00001] and step=0.05, but the range is not divisible by `step`. It will be replaced by [0, 1.0].
  warnings.warn(
K:  10
alpha:  0.7000000000000001
lr:  0.00269056886177147
weight_decay:  0.00022311216897495247
dropout:  0.4
fix split and run 3 times
Data: Data(x=[2708, 1433], y=[2708], train_mask=[2708], val_mask=[2708], test_mask=[2708], adj_t=[2708, 2708, nnz=10556])
num_train tensor(140)
num_noise 0
noise: tensor(0)
data feature 1433
ALTOPT(
  (lins): Sequential(
    (0): Linear(in_features=1433, out_features=64, bias=True)
    (1): BatchNorm1d(64, eps=1e-05, momentum=0.1, affine=True, track_running_stats=True)
    (2): Dropout(p=0.4, inplace=True)
    (3): ReLU(inplace=True)
    (4): Linear(in_features=64, out_features=7, bias=True)
    (5): LogSoftmax(dim=-1)
  )
  (prop): Propagation(K=10, mode=None, lambda1=None, lambda2=None, L21=True, alpha=0.7000000000000001)
  (gcn): GCN(
    (convs): ModuleList(
      (0): GCNConv(1433, 64)
      (1): GCNConv(64, 7)
    )
    (bns): ModuleList(
      (0): BatchNorm1d(64, eps=1e-05, momentum=0.1, affine=True, track_running_stats=True)
    )
    (output): LogSoftmax(dim=-1)
  )
)
propagate done
init label
Split: 01, Run: 01
None time:  0.8232047650963068
None Run 01:
Highest Train: 100.00
Highest Valid: 77.20
  Final Train: 100.00
   Final Test: 78.30
Split: 01, Run: 02
None time:  0.5779864289797843
None Run 02:
Highest Train: 100.00
Highest Valid: 74.00
  Final Train: 100.00
   Final Test: 75.00
Split: 01, Run: 03
None time:  0.9351507199462503
None Run 03:
Highest Train: 100.00
Highest Valid: 68.80
  Final Train: 100.00
   Final Test: 69.90
run time now: 2.3635404109954834
total time:  2.3788122918922454
None All runs:
Highest Train: 100.00 ± 0.00
Highest Valid: 73.33 ± 4.24
  Final Train: 100.00 ± 0.00
   Final Test: 74.40 ± 4.23
[I 2023-06-12 00:51:05,464] Trial 414 finished with value: 73.33333587646484 and parameters: {'Fwd': 0.07496624275139435, 'K': 10, 'alpha': 0.7000000000000001, 'dropout': 0.4, 'gnnepoch': 20, 'lambda1': 0.9, 'lambda2': 8.455464232853444, 'loop': 1, 'loss': 'CE', 'lr': 0.00269056886177147, 'softmaxF': True, 'useGCN': True, 'weight_decay': 0.00022311216897495247, 'weightedloss': True}. Best is trial 112 with value: 81.66667175292969.
/home/wxy/miniconda3/lib/python3.10/site-packages/optuna/distributions.py:685: UserWarning: The distribution is specified by [0, 1.00001] and step=0.05, but the range is not divisible by `step`. It will be replaced by [0, 1.0].
  warnings.warn(
K:  10
alpha:  0.5
lr:  0.0020822131594856797
weight_decay:  0.09775474695015582
dropout:  0.4
fix split and run 3 times
Data: Data(x=[2708, 1433], y=[2708], train_mask=[2708], val_mask=[2708], test_mask=[2708], adj_t=[2708, 2708, nnz=10556])
num_train tensor(140)
num_noise 0
noise: tensor(0)
data feature 1433
ALTOPT(
  (lins): Sequential(
    (0): Linear(in_features=1433, out_features=64, bias=True)
    (1): BatchNorm1d(64, eps=1e-05, momentum=0.1, affine=True, track_running_stats=True)
    (2): Dropout(p=0.4, inplace=True)
    (3): ReLU(inplace=True)
    (4): Linear(in_features=64, out_features=7, bias=True)
    (5): LogSoftmax(dim=-1)
  )
  (prop): Propagation(K=10, mode=None, lambda1=None, lambda2=None, L21=True, alpha=0.5)
  (gcn): GCN(
    (convs): ModuleList(
      (0): GCNConv(1433, 64)
      (1): GCNConv(64, 7)
    )
    (bns): ModuleList(
      (0): BatchNorm1d(64, eps=1e-05, momentum=0.1, affine=True, track_running_stats=True)
    )
    (output): LogSoftmax(dim=-1)
  )
)
propagate done
init label
Split: 01, Run: 01
None time:  2.661940417950973
None Run 01:
Highest Train: 100.00
Highest Valid: 80.60
  Final Train: 100.00
   Final Test: 82.00
Split: 01, Run: 02
None time:  2.34194919699803
None Run 02:
Highest Train: 100.00
Highest Valid: 80.60
  Final Train: 100.00
   Final Test: 81.70
Split: 01, Run: 03
None time:  2.322459941962734
None Run 03:
Highest Train: 100.00
Highest Valid: 81.60
  Final Train: 100.00
   Final Test: 82.70
run time now: 7.358285903930664
total time:  7.376948029035702
None All runs:
Highest Train: 100.00 ± 0.00
Highest Valid: 80.93 ± 0.58
  Final Train: 100.00 ± 0.00
   Final Test: 82.13 ± 0.51
[I 2023-06-12 00:51:13,305] Trial 415 finished with value: 80.9333267211914 and parameters: {'Fwd': 0.08251474462888868, 'K': 10, 'alpha': 0.5, 'dropout': 0.4, 'gnnepoch': 90, 'lambda1': 0.9500000000000001, 'lambda2': 4.407815849316523, 'loop': 1, 'loss': 'CE', 'lr': 0.0020822131594856797, 'softmaxF': True, 'useGCN': True, 'weight_decay': 0.09775474695015582, 'weightedloss': True}. Best is trial 112 with value: 81.66667175292969.
/home/wxy/miniconda3/lib/python3.10/site-packages/optuna/distributions.py:685: UserWarning: The distribution is specified by [0, 1.00001] and step=0.05, but the range is not divisible by `step`. It will be replaced by [0, 1.0].
  warnings.warn(
K:  10
alpha:  0.4
lr:  0.008497151038420503
weight_decay:  5.3097829317126985e-05
dropout:  0.4
fix split and run 3 times
Data: Data(x=[2708, 1433], y=[2708], train_mask=[2708], val_mask=[2708], test_mask=[2708], adj_t=[2708, 2708, nnz=10556])
num_train tensor(140)
num_noise 0
noise: tensor(0)
data feature 1433
ALTOPT(
  (lins): Sequential(
    (0): Linear(in_features=1433, out_features=64, bias=True)
    (1): BatchNorm1d(64, eps=1e-05, momentum=0.1, affine=True, track_running_stats=True)
    (2): Dropout(p=0.4, inplace=True)
    (3): ReLU(inplace=True)
    (4): Linear(in_features=64, out_features=7, bias=True)
    (5): LogSoftmax(dim=-1)
  )
  (prop): Propagation(K=10, mode=None, lambda1=None, lambda2=None, L21=True, alpha=0.4)
  (gcn): GCN(
    (convs): ModuleList(
      (0): GCNConv(1433, 64)
      (1): GCNConv(64, 7)
    )
    (bns): ModuleList(
      (0): BatchNorm1d(64, eps=1e-05, momentum=0.1, affine=True, track_running_stats=True)
    )
    (output): LogSoftmax(dim=-1)
  )
)
propagate done
init label
Split: 01, Run: 01
None time:  1.6462771820370108
None Run 01:
Highest Train: 100.00
Highest Valid: 80.80
  Final Train: 100.00
   Final Test: 82.60
Split: 01, Run: 02
None time:  1.6594940591603518
None Run 02:
Highest Train: 100.00
Highest Valid: 81.00
  Final Train: 100.00
   Final Test: 81.80
Split: 01, Run: 03
None time:  1.3261877498589456
None Run 03:
Highest Train: 100.00
Highest Valid: 80.60
  Final Train: 100.00
   Final Test: 81.30
run time now: 4.666623592376709
total time:  4.681702526984736
None All runs:
Highest Train: 100.00 ± 0.00
Highest Valid: 80.80 ± 0.20
  Final Train: 100.00 ± 0.00
   Final Test: 81.90 ± 0.66
[I 2023-06-12 00:51:18,523] Trial 416 finished with value: 80.79999542236328 and parameters: {'Fwd': 0.01439405341747688, 'K': 10, 'alpha': 0.4, 'dropout': 0.4, 'gnnepoch': 60, 'lambda1': 0.9, 'lambda2': 8.34164057135678, 'loop': 1, 'loss': 'CE', 'lr': 0.008497151038420503, 'softmaxF': False, 'useGCN': True, 'weight_decay': 5.3097829317126985e-05, 'weightedloss': True}. Best is trial 112 with value: 81.66667175292969.
/home/wxy/miniconda3/lib/python3.10/site-packages/optuna/distributions.py:685: UserWarning: The distribution is specified by [0, 1.00001] and step=0.05, but the range is not divisible by `step`. It will be replaced by [0, 1.0].
  warnings.warn(
K:  10
alpha:  0.55
lr:  0.009983697898093167
weight_decay:  0.00040702200393959875
dropout:  0.5
fix split and run 3 times
Data: Data(x=[2708, 1433], y=[2708], train_mask=[2708], val_mask=[2708], test_mask=[2708], adj_t=[2708, 2708, nnz=10556])
num_train tensor(140)
num_noise 0
noise: tensor(0)
data feature 1433
ALTOPT(
  (lins): Sequential(
    (0): Linear(in_features=1433, out_features=64, bias=True)
    (1): BatchNorm1d(64, eps=1e-05, momentum=0.1, affine=True, track_running_stats=True)
    (2): Dropout(p=0.5, inplace=True)
    (3): ReLU(inplace=True)
    (4): Linear(in_features=64, out_features=7, bias=True)
    (5): LogSoftmax(dim=-1)
  )
  (prop): Propagation(K=10, mode=None, lambda1=None, lambda2=None, L21=True, alpha=0.55)
  (gcn): GCN(
    (convs): ModuleList(
      (0): GCNConv(1433, 64)
      (1): GCNConv(64, 7)
    )
    (bns): ModuleList(
      (0): BatchNorm1d(64, eps=1e-05, momentum=0.1, affine=True, track_running_stats=True)
    )
    (output): LogSoftmax(dim=-1)
  )
)
propagate done
init label
Split: 01, Run: 01
None time:  1.8423633181955665
None Run 01:
Highest Train: 100.00
Highest Valid: 80.60
  Final Train: 100.00
   Final Test: 82.60
Split: 01, Run: 02
None time:  1.8400479468982667
None Run 02:
Highest Train: 100.00
Highest Valid: 80.80
  Final Train: 100.00
   Final Test: 82.50
Split: 01, Run: 03
None time:  1.827935985988006
None Run 03:
Highest Train: 100.00
Highest Valid: 80.00
  Final Train: 100.00
   Final Test: 80.60
run time now: 5.533176422119141
total time:  5.549688776023686
None All runs:
Highest Train: 100.00 ± 0.00
Highest Valid: 80.47 ± 0.42
  Final Train: 100.00 ± 0.00
   Final Test: 81.90 ± 1.13
[I 2023-06-12 00:51:24,619] Trial 417 finished with value: 80.46666717529297 and parameters: {'Fwd': 0.06423739859047643, 'K': 10, 'alpha': 0.55, 'dropout': 0.5, 'gnnepoch': 70, 'lambda1': 0.8500000000000001, 'lambda2': 4.839799804494743, 'loop': 1, 'loss': 'CE', 'lr': 0.009983697898093167, 'softmaxF': True, 'useGCN': True, 'weight_decay': 0.00040702200393959875, 'weightedloss': True}. Best is trial 112 with value: 81.66667175292969.
/home/wxy/miniconda3/lib/python3.10/site-packages/optuna/distributions.py:685: UserWarning: The distribution is specified by [0, 1.00001] and step=0.05, but the range is not divisible by `step`. It will be replaced by [0, 1.0].
  warnings.warn(
K:  10
alpha:  0.7000000000000001
lr:  0.0009135744446301052
weight_decay:  0.00019828036699125212
dropout:  0.4
fix split and run 3 times
Data: Data(x=[2708, 1433], y=[2708], train_mask=[2708], val_mask=[2708], test_mask=[2708], adj_t=[2708, 2708, nnz=10556])
num_train tensor(140)
num_noise 0
noise: tensor(0)
data feature 1433
ALTOPT(
  (lins): Sequential(
    (0): Linear(in_features=1433, out_features=64, bias=True)
    (1): BatchNorm1d(64, eps=1e-05, momentum=0.1, affine=True, track_running_stats=True)
    (2): Dropout(p=0.4, inplace=True)
    (3): ReLU(inplace=True)
    (4): Linear(in_features=64, out_features=7, bias=True)
    (5): LogSoftmax(dim=-1)
  )
  (prop): Propagation(K=10, mode=None, lambda1=None, lambda2=None, L21=True, alpha=0.7000000000000001)
  (gcn): GCN(
    (convs): ModuleList(
      (0): GCNConv(1433, 64)
      (1): GCNConv(64, 7)
    )
    (bns): ModuleList(
      (0): BatchNorm1d(64, eps=1e-05, momentum=0.1, affine=True, track_running_stats=True)
    )
    (output): LogSoftmax(dim=-1)
  )
)
propagate done
init label
Split: 01, Run: 01
None time:  1.4793119728565216
None Run 01:
Highest Train: 100.00
Highest Valid: 79.80
  Final Train: 100.00
   Final Test: 79.40
Split: 01, Run: 02
None time:  1.6108155669644475
None Run 02:
Highest Train: 100.00
Highest Valid: 73.80
  Final Train: 100.00
   Final Test: 75.10
Split: 01, Run: 03
None time:  1.7230673108715564
None Run 03:
Highest Train: 100.00
Highest Valid: 75.60
  Final Train: 100.00
   Final Test: 76.80
run time now: 4.836744785308838
total time:  4.855334243969992
None All runs:
Highest Train: 100.00 ± 0.00
Highest Valid: 76.40 ± 3.08
  Final Train: 100.00 ± 0.00
   Final Test: 77.10 ± 2.17
[I 2023-06-12 00:51:30,045] Trial 418 finished with value: 76.39999389648438 and parameters: {'Fwd': 0.09981961255623165, 'K': 10, 'alpha': 0.7000000000000001, 'dropout': 0.4, 'gnnepoch': 60, 'lambda1': 0.9, 'lambda2': 4.24368467729796, 'loop': 1, 'loss': 'CE', 'lr': 0.0009135744446301052, 'softmaxF': True, 'useGCN': True, 'weight_decay': 0.00019828036699125212, 'weightedloss': True}. Best is trial 112 with value: 81.66667175292969.
/home/wxy/miniconda3/lib/python3.10/site-packages/optuna/distributions.py:685: UserWarning: The distribution is specified by [0, 1.00001] and step=0.05, but the range is not divisible by `step`. It will be replaced by [0, 1.0].
  warnings.warn(
K:  9
alpha:  0.8
lr:  0.0011183514508135218
weight_decay:  0.0035410035453954107
dropout:  0.4
fix split and run 3 times
Data: Data(x=[2708, 1433], y=[2708], train_mask=[2708], val_mask=[2708], test_mask=[2708], adj_t=[2708, 2708, nnz=10556])
num_train tensor(140)
num_noise 0
noise: tensor(0)
data feature 1433
ALTOPT(
  (lins): Sequential(
    (0): Linear(in_features=1433, out_features=64, bias=True)
    (1): BatchNorm1d(64, eps=1e-05, momentum=0.1, affine=True, track_running_stats=True)
    (2): Dropout(p=0.4, inplace=True)
    (3): ReLU(inplace=True)
    (4): Linear(in_features=64, out_features=7, bias=True)
    (5): LogSoftmax(dim=-1)
  )
  (prop): Propagation(K=9, mode=None, lambda1=None, lambda2=None, L21=True, alpha=0.8)
  (gcn): GCN(
    (convs): ModuleList(
      (0): GCNConv(1433, 64)
      (1): GCNConv(64, 7)
    )
    (bns): ModuleList(
      (0): BatchNorm1d(64, eps=1e-05, momentum=0.1, affine=True, track_running_stats=True)
    )
    (output): LogSoftmax(dim=-1)
  )
)
propagate done
init label
Split: 01, Run: 01
None time:  1.589220677036792
None Run 01:
Highest Train: 100.00
Highest Valid: 79.60
  Final Train: 100.00
   Final Test: 80.30
Split: 01, Run: 02
None time:  1.6367793439421803
None Run 02:
Highest Train: 100.00
Highest Valid: 78.40
  Final Train: 100.00
   Final Test: 79.00
Split: 01, Run: 03
None time:  1.5749313009437174
None Run 03:
Highest Train: 100.00
Highest Valid: 68.80
  Final Train: 100.00
   Final Test: 69.90
run time now: 4.8303139209747314
total time:  4.843837291933596
None All runs:
Highest Train: 100.00 ± 0.00
Highest Valid: 75.60 ± 5.92
  Final Train: 100.00 ± 0.00
   Final Test: 76.40 ± 5.67
[I 2023-06-12 00:51:35,392] Trial 419 finished with value: 75.5999984741211 and parameters: {'Fwd': 0.04683996367790755, 'K': 9, 'alpha': 0.8, 'dropout': 0.4, 'gnnepoch': 60, 'lambda1': 0.8500000000000001, 'lambda2': 4.95884070252809, 'loop': 1, 'loss': 'CE', 'lr': 0.0011183514508135218, 'softmaxF': True, 'useGCN': True, 'weight_decay': 0.0035410035453954107, 'weightedloss': True}. Best is trial 112 with value: 81.66667175292969.
/home/wxy/miniconda3/lib/python3.10/site-packages/optuna/distributions.py:685: UserWarning: The distribution is specified by [0, 1.00001] and step=0.05, but the range is not divisible by `step`. It will be replaced by [0, 1.0].
  warnings.warn(
K:  10
alpha:  0.45
lr:  0.003351684880509601
weight_decay:  3.778671653007616e-05
dropout:  0.4
fix split and run 3 times
Data: Data(x=[2708, 1433], y=[2708], train_mask=[2708], val_mask=[2708], test_mask=[2708], adj_t=[2708, 2708, nnz=10556])
num_train tensor(140)
num_noise 0
noise: tensor(0)
data feature 1433
ALTOPT(
  (lins): Sequential(
    (0): Linear(in_features=1433, out_features=64, bias=True)
    (1): BatchNorm1d(64, eps=1e-05, momentum=0.1, affine=True, track_running_stats=True)
    (2): Dropout(p=0.4, inplace=True)
    (3): ReLU(inplace=True)
    (4): Linear(in_features=64, out_features=7, bias=True)
    (5): LogSoftmax(dim=-1)
  )
  (prop): Propagation(K=10, mode=None, lambda1=None, lambda2=None, L21=True, alpha=0.45)
  (gcn): GCN(
    (convs): ModuleList(
      (0): GCNConv(1433, 64)
      (1): GCNConv(64, 7)
    )
    (bns): ModuleList(
      (0): BatchNorm1d(64, eps=1e-05, momentum=0.1, affine=True, track_running_stats=True)
    )
    (output): LogSoftmax(dim=-1)
  )
)
propagate done
init label
Split: 01, Run: 01
None time:  1.9693386040162295
None Run 01:
Highest Train: 100.00
Highest Valid: 80.40
  Final Train: 100.00
   Final Test: 81.20
Split: 01, Run: 02
None time:  1.8515443939249963
None Run 02:
Highest Train: 100.00
Highest Valid: 80.00
  Final Train: 100.00
   Final Test: 80.30
Split: 01, Run: 03
None time:  1.8451075239572674
None Run 03:
Highest Train: 100.00
Highest Valid: 79.40
  Final Train: 100.00
   Final Test: 80.50
run time now: 5.689809083938599
total time:  5.709662504028529
None All runs:
Highest Train: 100.00 ± 0.00
Highest Valid: 79.93 ± 0.50
  Final Train: 100.00 ± 0.00
   Final Test: 80.67 ± 0.47
[I 2023-06-12 00:51:41,786] Trial 420 finished with value: 79.9333267211914 and parameters: {'Fwd': 0.0006512825865473667, 'K': 10, 'alpha': 0.45, 'dropout': 0.4, 'gnnepoch': 50, 'lambda1': 0.75, 'lambda2': 6.306412746859551, 'loop': 1, 'loss': 'CE', 'lr': 0.003351684880509601, 'softmaxF': True, 'useGCN': True, 'weight_decay': 3.778671653007616e-05, 'weightedloss': True}. Best is trial 112 with value: 81.66667175292969.
/home/wxy/miniconda3/lib/python3.10/site-packages/optuna/distributions.py:685: UserWarning: The distribution is specified by [0, 1.00001] and step=0.05, but the range is not divisible by `step`. It will be replaced by [0, 1.0].
  warnings.warn(
K:  10
alpha:  0.4
lr:  0.0013726483068342143
weight_decay:  7.081245960722974e-05
dropout:  0.30000000000000004
fix split and run 3 times
Data: Data(x=[2708, 1433], y=[2708], train_mask=[2708], val_mask=[2708], test_mask=[2708], adj_t=[2708, 2708, nnz=10556])
num_train tensor(140)
num_noise 0
noise: tensor(0)
data feature 1433
ALTOPT(
  (lins): Sequential(
    (0): Linear(in_features=1433, out_features=64, bias=True)
    (1): BatchNorm1d(64, eps=1e-05, momentum=0.1, affine=True, track_running_stats=True)
    (2): Dropout(p=0.30000000000000004, inplace=True)
    (3): ReLU(inplace=True)
    (4): Linear(in_features=64, out_features=7, bias=True)
    (5): LogSoftmax(dim=-1)
  )
  (prop): Propagation(K=10, mode=None, lambda1=None, lambda2=None, L21=True, alpha=0.4)
  (gcn): GCN(
    (convs): ModuleList(
      (0): GCNConv(1433, 64)
      (1): GCNConv(64, 7)
    )
    (bns): ModuleList(
      (0): BatchNorm1d(64, eps=1e-05, momentum=0.1, affine=True, track_running_stats=True)
    )
    (output): LogSoftmax(dim=-1)
  )
)
propagate done
init label
Split: 01, Run: 01
None time:  1.452212065923959
None Run 01:
Highest Train: 100.00
Highest Valid: 79.20
  Final Train: 100.00
   Final Test: 79.80
Split: 01, Run: 02
None time:  1.693587000016123
None Run 02:
Highest Train: 100.00
Highest Valid: 76.40
  Final Train: 100.00
   Final Test: 76.70
Split: 01, Run: 03
None time:  1.607218910008669
None Run 03:
Highest Train: 100.00
Highest Valid: 73.20
  Final Train: 100.00
   Final Test: 74.40
run time now: 4.780048608779907
total time:  4.7943156061228365
None All runs:
Highest Train: 100.00 ± 0.00
Highest Valid: 76.27 ± 3.00
  Final Train: 100.00 ± 0.00
   Final Test: 76.97 ± 2.71
