[I 2023-06-12 00:55:38,669] Trial 458 finished with value: 76.13333892822266 and parameters: {'Fwd': 0.0005440741978507645, 'K': 10, 'alpha': 0.4, 'dropout': 0.9, 'gnnepoch': 70, 'lambda1': 0.6000000000000001, 'lambda2': 7.133069638685007, 'loop': 1, 'loss': 'MSE', 'lr': 0.004265265305117819, 'softmaxF': True, 'useGCN': False, 'weight_decay': 0.0029945028120340915, 'weightedloss': False}. Best is trial 364 with value: 83.66666412353516.
/home/wxy/miniconda3/lib/python3.10/site-packages/optuna/distributions.py:685: UserWarning: The distribution is specified by [0, 1.00001] and step=0.05, but the range is not divisible by `step`. It will be replaced by [0, 1.0].
  warnings.warn(
K:  10
alpha:  0.9
lr:  0.002994170540658881
weight_decay:  9.243490878287431e-06
dropout:  0.9
fix split and run 3 times
Data: Data(x=[19717, 500], y=[19717], train_mask=[19717], val_mask=[19717], test_mask=[19717], adj_t=[19717, 19717, nnz=88648])
num_train tensor(60)
num_noise 0
noise: tensor(0)
data feature 500
ALTOPT(
  (lins): Sequential(
    (0): Linear(in_features=500, out_features=64, bias=True)
    (1): BatchNorm1d(64, eps=1e-05, momentum=0.1, affine=True, track_running_stats=True)
    (2): Dropout(p=0.9, inplace=True)
    (3): ReLU(inplace=True)
    (4): Linear(in_features=64, out_features=3, bias=True)
    (5): LogSoftmax(dim=-1)
  )
  (prop): Propagation(K=10, mode=None, lambda1=None, lambda2=None, L21=True, alpha=0.9)
  (gcn): GCN(
    (convs): ModuleList(
      (0): GCNConv(500, 64)
      (1): GCNConv(64, 3)
    )
    (bns): ModuleList(
      (0): BatchNorm1d(64, eps=1e-05, momentum=0.1, affine=True, track_running_stats=True)
    )
    (output): LogSoftmax(dim=-1)
  )
)
propagate done
init label
Split: 01, Run: 01
None time:  1.1206502879504114
None Run 01:
Highest Train: 100.00
Highest Valid: 77.40
  Final Train: 100.00
   Final Test: 73.60
Split: 01, Run: 02
None time:  1.1374219730496407
None Run 02:
Highest Train: 100.00
Highest Valid: 79.80
  Final Train: 100.00
   Final Test: 77.40
Split: 01, Run: 03
None time:  1.053930721944198
None Run 03:
Highest Train: 100.00
Highest Valid: 80.20
  Final Train: 98.33
   Final Test: 79.00
run time now: 3.3693184852600098
total time:  3.411597799975425
None All runs:
Highest Train: 100.00 ± 0.00
Highest Valid: 79.13 ± 1.51
  Final Train: 99.44 ± 0.96
   Final Test: 76.67 ± 2.77
[I 2023-06-12 00:55:42,567] Trial 459 finished with value: 79.13333129882812 and parameters: {'Fwd': 0.0002954107913937886, 'K': 10, 'alpha': 0.9, 'dropout': 0.9, 'gnnepoch': 70, 'lambda1': 0.5, 'lambda2': 5.104076428076664, 'loop': 1, 'loss': 'CE', 'lr': 0.002994170540658881, 'softmaxF': True, 'useGCN': False, 'weight_decay': 9.243490878287431e-06, 'weightedloss': True}. Best is trial 364 with value: 83.66666412353516.
/home/wxy/miniconda3/lib/python3.10/site-packages/optuna/distributions.py:685: UserWarning: The distribution is specified by [0, 1.00001] and step=0.05, but the range is not divisible by `step`. It will be replaced by [0, 1.0].
  warnings.warn(
K:  10
alpha:  0.9
lr:  0.004149144501168855
weight_decay:  4.428458299375109e-06
dropout:  0.9
fix split and run 3 times
Data: Data(x=[19717, 500], y=[19717], train_mask=[19717], val_mask=[19717], test_mask=[19717], adj_t=[19717, 19717, nnz=88648])
num_train tensor(60)
num_noise 0
noise: tensor(0)
data feature 500
ALTOPT(
  (lins): Sequential(
    (0): Linear(in_features=500, out_features=64, bias=True)
    (1): BatchNorm1d(64, eps=1e-05, momentum=0.1, affine=True, track_running_stats=True)
    (2): Dropout(p=0.9, inplace=True)
    (3): ReLU(inplace=True)
    (4): Linear(in_features=64, out_features=3, bias=True)
    (5): Identity()
  )
  (prop): Propagation(K=10, mode=None, lambda1=None, lambda2=None, L21=True, alpha=0.9)
  (gcn): GCN(
    (convs): ModuleList(
      (0): GCNConv(500, 64)
      (1): GCNConv(64, 3)
    )
    (bns): ModuleList(
      (0): BatchNorm1d(64, eps=1e-05, momentum=0.1, affine=True, track_running_stats=True)
    )
    (output): Identity()
  )
)
propagate done
init label
Split: 01, Run: 01
None time:  2.2928514399100095
None Run 01:
Highest Train: 100.00
Highest Valid: 82.40
  Final Train: 100.00
   Final Test: 77.50
Split: 01, Run: 02
None time:  2.518468608846888
None Run 02:
Highest Train: 100.00
Highest Valid: 83.00
  Final Train: 100.00
   Final Test: 79.50
Split: 01, Run: 03
None time:  1.196399920154363
None Run 03:
Highest Train: 100.00
Highest Valid: 82.40
  Final Train: 100.00
   Final Test: 79.10
run time now: 6.0578062534332275
total time:  6.110135020921007
None All runs:
Highest Train: 100.00 ± 0.00
Highest Valid: 82.60 ± 0.35
  Final Train: 100.00 ± 0.00
   Final Test: 78.70 ± 1.06
[I 2023-06-12 00:55:49,247] Trial 460 finished with value: 82.5999984741211 and parameters: {'Fwd': 0.0006192921792264018, 'K': 10, 'alpha': 0.9, 'dropout': 0.9, 'gnnepoch': 70, 'lambda1': 0.55, 'lambda2': 5.272627743885805, 'loop': 1, 'loss': 'MSE', 'lr': 0.004149144501168855, 'softmaxF': True, 'useGCN': False, 'weight_decay': 4.428458299375109e-06, 'weightedloss': False}. Best is trial 364 with value: 83.66666412353516.
/home/wxy/miniconda3/lib/python3.10/site-packages/optuna/distributions.py:685: UserWarning: The distribution is specified by [0, 1.00001] and step=0.05, but the range is not divisible by `step`. It will be replaced by [0, 1.0].
  warnings.warn(
K:  10
alpha:  0.9
lr:  0.002774193901830987
weight_decay:  9.11201124919319e-06
dropout:  0.9
fix split and run 3 times
Data: Data(x=[19717, 500], y=[19717], train_mask=[19717], val_mask=[19717], test_mask=[19717], adj_t=[19717, 19717, nnz=88648])
num_train tensor(60)
num_noise 0
noise: tensor(0)
data feature 500
ALTOPT(
  (lins): Sequential(
    (0): Linear(in_features=500, out_features=64, bias=True)
    (1): BatchNorm1d(64, eps=1e-05, momentum=0.1, affine=True, track_running_stats=True)
    (2): Dropout(p=0.9, inplace=True)
    (3): ReLU(inplace=True)
    (4): Linear(in_features=64, out_features=3, bias=True)
    (5): Identity()
  )
  (prop): Propagation(K=10, mode=None, lambda1=None, lambda2=None, L21=True, alpha=0.9)
  (gcn): GCN(
    (convs): ModuleList(
      (0): GCNConv(500, 64)
      (1): GCNConv(64, 3)
    )
    (bns): ModuleList(
      (0): BatchNorm1d(64, eps=1e-05, momentum=0.1, affine=True, track_running_stats=True)
    )
    (output): Identity()
  )
)
propagate done
init label
Split: 01, Run: 01
None time:  2.4151415680535138
None Run 01:
Highest Train: 100.00
Highest Valid: 82.00
  Final Train: 100.00
   Final Test: 76.80
Split: 01, Run: 02
None time:  2.3443237389437854
None Run 02:
Highest Train: 100.00
Highest Valid: 84.40
  Final Train: 100.00
   Final Test: 80.40
Split: 01, Run: 03
None time:  2.6425873569678515
None Run 03:
Highest Train: 100.00
Highest Valid: 81.40
  Final Train: 100.00
   Final Test: 77.50
run time now: 7.450585126876831
total time:  7.498754841974005
None All runs:
Highest Train: 100.00 ± 0.00
Highest Valid: 82.60 ± 1.59
  Final Train: 100.00 ± 0.00
   Final Test: 78.23 ± 1.91
[I 2023-06-12 00:55:57,242] Trial 461 finished with value: 82.5999984741211 and parameters: {'Fwd': 0.0008512765479741397, 'K': 10, 'alpha': 0.9, 'dropout': 0.9, 'gnnepoch': 70, 'lambda1': 0.6000000000000001, 'lambda2': 5.599595853328408, 'loop': 1, 'loss': 'MSE', 'lr': 0.002774193901830987, 'softmaxF': False, 'useGCN': False, 'weight_decay': 9.11201124919319e-06, 'weightedloss': False}. Best is trial 364 with value: 83.66666412353516.
/home/wxy/miniconda3/lib/python3.10/site-packages/optuna/distributions.py:685: UserWarning: The distribution is specified by [0, 1.00001] and step=0.05, but the range is not divisible by `step`. It will be replaced by [0, 1.0].
  warnings.warn(
K:  9
alpha:  0.9
lr:  0.0035521258362369366
weight_decay:  4.732346702411013e-06
dropout:  0.9
fix split and run 3 times
Data: Data(x=[19717, 500], y=[19717], train_mask=[19717], val_mask=[19717], test_mask=[19717], adj_t=[19717, 19717, nnz=88648])
num_train tensor(60)
num_noise 0
noise: tensor(0)
data feature 500
ALTOPT(
  (lins): Sequential(
    (0): Linear(in_features=500, out_features=64, bias=True)
    (1): BatchNorm1d(64, eps=1e-05, momentum=0.1, affine=True, track_running_stats=True)
    (2): Dropout(p=0.9, inplace=True)
    (3): ReLU(inplace=True)
    (4): Linear(in_features=64, out_features=3, bias=True)
    (5): Identity()
  )
  (prop): Propagation(K=9, mode=None, lambda1=None, lambda2=None, L21=True, alpha=0.9)
  (gcn): GCN(
    (convs): ModuleList(
      (0): GCNConv(500, 64)
      (1): GCNConv(64, 3)
    )
    (bns): ModuleList(
      (0): BatchNorm1d(64, eps=1e-05, momentum=0.1, affine=True, track_running_stats=True)
    )
    (output): Identity()
  )
)
propagate done
init label
Split: 01, Run: 01, Epoch: 100, Loss: 0.2910, Train: 100.00%, Valid: 82.20% Test: 77.60%
Split: 01, Run: 01
None time:  3.3020283880177885
None Run 01:
Highest Train: 100.00
Highest Valid: 82.20
  Final Train: 100.00
   Final Test: 77.40
Split: 01, Run: 02
None time:  1.5591123318299651
None Run 02:
Highest Train: 100.00
Highest Valid: 82.60
  Final Train: 100.00
   Final Test: 78.70
Split: 01, Run: 03
None time:  1.009500244865194
None Run 03:
Highest Train: 100.00
Highest Valid: 82.40
  Final Train: 100.00
   Final Test: 78.50
run time now: 5.913851499557495
total time:  5.963709296891466
None All runs:
Highest Train: 100.00 ± 0.00
Highest Valid: 82.40 ± 0.20
  Final Train: 100.00 ± 0.00
   Final Test: 78.20 ± 0.70
[I 2023-06-12 00:56:03,818] Trial 462 finished with value: 82.4000015258789 and parameters: {'Fwd': 0.000449806090306511, 'K': 9, 'alpha': 0.9, 'dropout': 0.9, 'gnnepoch': 60, 'lambda1': 0.6000000000000001, 'lambda2': 4.4349078326932885, 'loop': 1, 'loss': 'MSE', 'lr': 0.0035521258362369366, 'softmaxF': True, 'useGCN': False, 'weight_decay': 4.732346702411013e-06, 'weightedloss': False}. Best is trial 364 with value: 83.66666412353516.
/home/wxy/miniconda3/lib/python3.10/site-packages/optuna/distributions.py:685: UserWarning: The distribution is specified by [0, 1.00001] and step=0.05, but the range is not divisible by `step`. It will be replaced by [0, 1.0].
  warnings.warn(
K:  10
alpha:  0.9500000000000001
lr:  0.0025948391255718657
weight_decay:  6.532657081036038e-06
dropout:  0.30000000000000004
fix split and run 3 times
Data: Data(x=[19717, 500], y=[19717], train_mask=[19717], val_mask=[19717], test_mask=[19717], adj_t=[19717, 19717, nnz=88648])
num_train tensor(60)
num_noise 0
noise: tensor(0)
data feature 500
ALTOPT(
  (lins): Sequential(
    (0): Linear(in_features=500, out_features=64, bias=True)
    (1): BatchNorm1d(64, eps=1e-05, momentum=0.1, affine=True, track_running_stats=True)
    (2): Dropout(p=0.30000000000000004, inplace=True)
    (3): ReLU(inplace=True)
    (4): Linear(in_features=64, out_features=3, bias=True)
    (5): Identity()
  )
  (prop): Propagation(K=10, mode=None, lambda1=None, lambda2=None, L21=True, alpha=0.9500000000000001)
  (gcn): GCN(
    (convs): ModuleList(
      (0): GCNConv(500, 64)
      (1): GCNConv(64, 3)
    )
    (bns): ModuleList(
      (0): BatchNorm1d(64, eps=1e-05, momentum=0.1, affine=True, track_running_stats=True)
    )
    (output): Identity()
  )
)
propagate done
init label
Split: 01, Run: 01
None time:  1.6347060578409582
None Run 01:
Highest Train: 100.00
Highest Valid: 80.60
  Final Train: 100.00
   Final Test: 78.50
Split: 01, Run: 02
None time:  1.2000363629776984
None Run 02:
Highest Train: 100.00
Highest Valid: 82.20
  Final Train: 100.00
   Final Test: 79.40
Split: 01, Run: 03
None time:  1.1491177121642977
None Run 03:
Highest Train: 100.00
Highest Valid: 80.20
  Final Train: 100.00
   Final Test: 78.70
run time now: 4.034450531005859
total time:  4.09280570782721
None All runs:
Highest Train: 100.00 ± 0.00
Highest Valid: 81.00 ± 1.06
  Final Train: 100.00 ± 0.00
   Final Test: 78.87 ± 0.47
[I 2023-06-12 00:56:08,446] Trial 463 finished with value: 81.0 and parameters: {'Fwd': 8.482318015409781e-05, 'K': 10, 'alpha': 0.9500000000000001, 'dropout': 0.30000000000000004, 'gnnepoch': 70, 'lambda1': 0.55, 'lambda2': 4.890675291929464, 'loop': 1, 'loss': 'MSE', 'lr': 0.0025948391255718657, 'softmaxF': True, 'useGCN': False, 'weight_decay': 6.532657081036038e-06, 'weightedloss': False}. Best is trial 364 with value: 83.66666412353516.
/home/wxy/miniconda3/lib/python3.10/site-packages/optuna/distributions.py:685: UserWarning: The distribution is specified by [0, 1.00001] and step=0.05, but the range is not divisible by `step`. It will be replaced by [0, 1.0].
  warnings.warn(
K:  10
alpha:  0.9500000000000001
lr:  0.0032927631395655143
weight_decay:  1.4713005452707128e-05
dropout:  0.9
fix split and run 3 times
Data: Data(x=[19717, 500], y=[19717], train_mask=[19717], val_mask=[19717], test_mask=[19717], adj_t=[19717, 19717, nnz=88648])
num_train tensor(60)
num_noise 0
noise: tensor(0)
data feature 500
ALTOPT(
  (lins): Sequential(
    (0): Linear(in_features=500, out_features=64, bias=True)
    (1): BatchNorm1d(64, eps=1e-05, momentum=0.1, affine=True, track_running_stats=True)
    (2): Dropout(p=0.9, inplace=True)
    (3): ReLU(inplace=True)
    (4): Linear(in_features=64, out_features=3, bias=True)
    (5): Identity()
  )
  (prop): Propagation(K=10, mode=None, lambda1=None, lambda2=None, L21=True, alpha=0.9500000000000001)
  (gcn): GCN(
    (convs): ModuleList(
      (0): GCNConv(500, 64)
      (1): GCNConv(64, 3)
    )
    (bns): ModuleList(
      (0): BatchNorm1d(64, eps=1e-05, momentum=0.1, affine=True, track_running_stats=True)
    )
    (output): Identity()
  )
)
propagate done
init label
Split: 01, Run: 01
None time:  1.0542054891120642
None Run 01:
Highest Train: 100.00
Highest Valid: 77.40
  Final Train: 100.00
   Final Test: 75.70
Split: 01, Run: 02
None time:  2.118726575979963
None Run 02:
Highest Train: 100.00
Highest Valid: 75.80
  Final Train: 100.00
   Final Test: 73.90
Split: 01, Run: 03
None time:  2.386157965986058
None Run 03:
Highest Train: 100.00
Highest Valid: 76.60
  Final Train: 100.00
   Final Test: 73.90
run time now: 5.605737209320068
total time:  5.658208573004231
None All runs:
Highest Train: 100.00 ± 0.00
Highest Valid: 76.60 ± 0.80
  Final Train: 100.00 ± 0.00
   Final Test: 74.50 ± 1.04
[I 2023-06-12 00:56:14,640] Trial 464 finished with value: 76.60000610351562 and parameters: {'Fwd': 0.0011710825076621447, 'K': 10, 'alpha': 0.9500000000000001, 'dropout': 0.9, 'gnnepoch': 60, 'lambda1': 0.6000000000000001, 'lambda2': 5.636079577973873, 'loop': 1, 'loss': 'MSE', 'lr': 0.0032927631395655143, 'softmaxF': True, 'useGCN': True, 'weight_decay': 1.4713005452707128e-05, 'weightedloss': False}. Best is trial 364 with value: 83.66666412353516.
/home/wxy/miniconda3/lib/python3.10/site-packages/optuna/distributions.py:685: UserWarning: The distribution is specified by [0, 1.00001] and step=0.05, but the range is not divisible by `step`. It will be replaced by [0, 1.0].
  warnings.warn(
K:  10
alpha:  0.8500000000000001
lr:  0.0029391938453236935
weight_decay:  8.949292350602824e-06
dropout:  0.9
fix split and run 3 times
Data: Data(x=[19717, 500], y=[19717], train_mask=[19717], val_mask=[19717], test_mask=[19717], adj_t=[19717, 19717, nnz=88648])
num_train tensor(60)
num_noise 0
noise: tensor(0)
data feature 500
ALTOPT(
  (lins): Sequential(
    (0): Linear(in_features=500, out_features=64, bias=True)
    (1): BatchNorm1d(64, eps=1e-05, momentum=0.1, affine=True, track_running_stats=True)
    (2): Dropout(p=0.9, inplace=True)
    (3): ReLU(inplace=True)
    (4): Linear(in_features=64, out_features=3, bias=True)
    (5): Identity()
  )
  (prop): Propagation(K=10, mode=None, lambda1=None, lambda2=None, L21=True, alpha=0.8500000000000001)
  (gcn): GCN(
    (convs): ModuleList(
      (0): GCNConv(500, 64)
      (1): GCNConv(64, 3)
    )
    (bns): ModuleList(
      (0): BatchNorm1d(64, eps=1e-05, momentum=0.1, affine=True, track_running_stats=True)
    )
    (output): Identity()
  )
)
propagate done
init label
Split: 01, Run: 01
None time:  2.4576154449023306
None Run 01:
Highest Train: 100.00
Highest Valid: 80.80
  Final Train: 100.00
   Final Test: 75.80
Split: 01, Run: 02
None time:  1.034018075093627
None Run 02:
Highest Train: 100.00
Highest Valid: 83.60
  Final Train: 100.00
   Final Test: 79.00
Split: 01, Run: 03
None time:  1.5045553999952972
None Run 03:
Highest Train: 100.00
Highest Valid: 84.00
  Final Train: 100.00
   Final Test: 79.50
run time now: 5.040652513504028
total time:  5.0919805120211095
None All runs:
Highest Train: 100.00 ± 0.00
Highest Valid: 82.80 ± 1.74
  Final Train: 100.00 ± 0.00
   Final Test: 78.10 ± 2.01
[I 2023-06-12 00:56:20,320] Trial 465 finished with value: 82.80000305175781 and parameters: {'Fwd': 2.3641442672717105e-06, 'K': 10, 'alpha': 0.8500000000000001, 'dropout': 0.9, 'gnnepoch': 60, 'lambda1': 0.65, 'lambda2': 8.40332661112723, 'loop': 1, 'loss': 'MSE', 'lr': 0.0029391938453236935, 'softmaxF': True, 'useGCN': False, 'weight_decay': 8.949292350602824e-06, 'weightedloss': False}. Best is trial 364 with value: 83.66666412353516.
/home/wxy/miniconda3/lib/python3.10/site-packages/optuna/distributions.py:685: UserWarning: The distribution is specified by [0, 1.00001] and step=0.05, but the range is not divisible by `step`. It will be replaced by [0, 1.0].
  warnings.warn(
K:  10
alpha:  1.0
lr:  0.003999632379994243
weight_decay:  6.467637737745671e-06
dropout:  0.9
fix split and run 3 times
Data: Data(x=[19717, 500], y=[19717], train_mask=[19717], val_mask=[19717], test_mask=[19717], adj_t=[19717, 19717, nnz=88648])
num_train tensor(60)
num_noise 0
noise: tensor(0)
data feature 500
ALTOPT(
  (lins): Sequential(
    (0): Linear(in_features=500, out_features=64, bias=True)
    (1): BatchNorm1d(64, eps=1e-05, momentum=0.1, affine=True, track_running_stats=True)
    (2): Dropout(p=0.9, inplace=True)
    (3): ReLU(inplace=True)
    (4): Linear(in_features=64, out_features=3, bias=True)
    (5): Identity()
  )
  (prop): Propagation(K=10, mode=None, lambda1=None, lambda2=None, L21=True, alpha=1.0)
  (gcn): GCN(
    (convs): ModuleList(
      (0): GCNConv(500, 64)
      (1): GCNConv(64, 3)
    )
    (bns): ModuleList(
      (0): BatchNorm1d(64, eps=1e-05, momentum=0.1, affine=True, track_running_stats=True)
    )
    (output): Identity()
  )
)
propagate done
init label
Split: 01, Run: 01
None time:  2.2797292699106038
None Run 01:
Highest Train: 100.00
Highest Valid: 81.00
  Final Train: 100.00
   Final Test: 76.80
Split: 01, Run: 02
None time:  1.4108707960695028
None Run 02:
Highest Train: 100.00
Highest Valid: 79.40
  Final Train: 100.00
   Final Test: 76.80
Split: 01, Run: 03
None time:  1.1036234889179468
None Run 03:
Highest Train: 100.00
Highest Valid: 81.60
  Final Train: 100.00
   Final Test: 77.70
run time now: 4.846231698989868
total time:  4.892213944811374
None All runs:
Highest Train: 100.00 ± 0.00
Highest Valid: 80.67 ± 1.14
  Final Train: 100.00 ± 0.00
   Final Test: 77.10 ± 0.52
[I 2023-06-12 00:56:25,734] Trial 466 finished with value: 80.66666412353516 and parameters: {'Fwd': 0.0008186554554509877, 'K': 10, 'alpha': 1.0, 'dropout': 0.9, 'gnnepoch': 70, 'lambda1': 0.65, 'lambda2': 6.9432519434200834, 'loop': 1, 'loss': 'MSE', 'lr': 0.003999632379994243, 'softmaxF': True, 'useGCN': False, 'weight_decay': 6.467637737745671e-06, 'weightedloss': False}. Best is trial 364 with value: 83.66666412353516.
/home/wxy/miniconda3/lib/python3.10/site-packages/optuna/distributions.py:685: UserWarning: The distribution is specified by [0, 1.00001] and step=0.05, but the range is not divisible by `step`. It will be replaced by [0, 1.0].
  warnings.warn(
K:  10
alpha:  0.9500000000000001
lr:  0.0006234342804109466
weight_decay:  1.2125052789519787e-05
dropout:  0.9
fix split and run 3 times
Data: Data(x=[19717, 500], y=[19717], train_mask=[19717], val_mask=[19717], test_mask=[19717], adj_t=[19717, 19717, nnz=88648])
num_train tensor(60)
num_noise 0
noise: tensor(0)
data feature 500
ALTOPT(
  (lins): Sequential(
    (0): Linear(in_features=500, out_features=64, bias=True)
    (1): BatchNorm1d(64, eps=1e-05, momentum=0.1, affine=True, track_running_stats=True)
    (2): Dropout(p=0.9, inplace=True)
    (3): ReLU(inplace=True)
    (4): Linear(in_features=64, out_features=3, bias=True)
    (5): Identity()
  )
  (prop): Propagation(K=10, mode=None, lambda1=None, lambda2=None, L21=True, alpha=0.9500000000000001)
  (gcn): GCN(
    (convs): ModuleList(
      (0): GCNConv(500, 64)
      (1): GCNConv(64, 3)
    )
    (bns): ModuleList(
      (0): BatchNorm1d(64, eps=1e-05, momentum=0.1, affine=True, track_running_stats=True)
    )
    (output): Identity()
  )
)
propagate done
init label
Split: 01, Run: 01
None time:  0.9943462570663542
None Run 01:
Highest Train: 100.00
Highest Valid: 70.20
  Final Train: 100.00
   Final Test: 69.50
Split: 01, Run: 02
None time:  2.835106644080952
None Run 02:
Highest Train: 100.00
Highest Valid: 80.60
  Final Train: 100.00
   Final Test: 76.00
Split: 01, Run: 03
None time:  2.0110791369806975
None Run 03:
Highest Train: 100.00
Highest Valid: 82.20
  Final Train: 100.00
   Final Test: 78.30
run time now: 5.892561674118042
total time:  5.934255035128444
None All runs:
Highest Train: 100.00 ± 0.00
Highest Valid: 77.67 ± 6.52
  Final Train: 100.00 ± 0.00
   Final Test: 74.60 ± 4.56
