[I 2023-06-12 00:17:38,125] Trial 62 finished with value: 80.86666870117188 and parameters: {'Fwd': 7.274319141669895e-06, 'K': 6, 'alpha': 0.9500000000000001, 'dropout': 0.2, 'gnnepoch': 60, 'lambda1': 0.25, 'lambda2': 7.8503934575228005, 'loop': 1, 'loss': 'MSE', 'lr': 0.001485550911693597, 'softmaxF': True, 'useGCN': False, 'weight_decay': 0.00012562199721547024, 'weightedloss': False}. Best is trial 54 with value: 82.06666564941406.
/home/wxy/miniconda3/lib/python3.10/site-packages/optuna/distributions.py:685: UserWarning: The distribution is specified by [0, 1.00001] and step=0.05, but the range is not divisible by `step`. It will be replaced by [0, 1.0].
  warnings.warn(
K:  5
alpha:  1.0
lr:  0.0013726964037176737
weight_decay:  0.00012228809115240015
dropout:  0.1
fix split and run 3 times
Data: Data(x=[19717, 500], y=[19717], train_mask=[19717], val_mask=[19717], test_mask=[19717], adj_t=[19717, 19717, nnz=88648])
num_train tensor(60)
num_noise 0
noise: tensor(0)
data feature 500
ALTOPT(
  (lins): Sequential(
    (0): Linear(in_features=500, out_features=64, bias=True)
    (1): BatchNorm1d(64, eps=1e-05, momentum=0.1, affine=True, track_running_stats=True)
    (2): Dropout(p=0.1, inplace=True)
    (3): ReLU(inplace=True)
    (4): Linear(in_features=64, out_features=3, bias=True)
    (5): Identity()
  )
  (prop): Propagation(K=5, mode=None, lambda1=None, lambda2=None, L21=True, alpha=1.0)
  (gcn): GCN(
    (convs): ModuleList(
      (0): GCNConv(500, 64)
      (1): GCNConv(64, 3)
    )
    (bns): ModuleList(
      (0): BatchNorm1d(64, eps=1e-05, momentum=0.1, affine=True, track_running_stats=True)
    )
    (output): Identity()
  )
)
propagate done
init label
Split: 01, Run: 01
None time:  0.9603924639523029
None Run 01:
Highest Train: 100.00
Highest Valid: 76.80
  Final Train: 100.00
   Final Test: 74.90
Split: 01, Run: 02
None time:  1.4025315470062196
None Run 02:
Highest Train: 100.00
Highest Valid: 80.40
  Final Train: 100.00
   Final Test: 77.70
Split: 01, Run: 03
None time:  2.608599927974865
None Run 03:
Highest Train: 100.00
Highest Valid: 79.80
  Final Train: 100.00
   Final Test: 79.00
run time now: 5.014161586761475
total time:  5.067232955945656
None All runs:
Highest Train: 100.00 ± 0.00
Highest Valid: 79.00 ± 1.93
  Final Train: 100.00 ± 0.00
   Final Test: 77.20 ± 2.10
[I 2023-06-12 00:17:43,658] Trial 63 finished with value: 79.0 and parameters: {'Fwd': 7.032697457966282e-06, 'K': 5, 'alpha': 1.0, 'dropout': 0.1, 'gnnepoch': 70, 'lambda1': 0.30000000000000004, 'lambda2': 7.68279831880603, 'loop': 1, 'loss': 'MSE', 'lr': 0.0013726964037176737, 'softmaxF': True, 'useGCN': False, 'weight_decay': 0.00012228809115240015, 'weightedloss': False}. Best is trial 54 with value: 82.06666564941406.
/home/wxy/miniconda3/lib/python3.10/site-packages/optuna/distributions.py:685: UserWarning: The distribution is specified by [0, 1.00001] and step=0.05, but the range is not divisible by `step`. It will be replaced by [0, 1.0].
  warnings.warn(
K:  6
alpha:  0.9
lr:  0.0011345609186479788
weight_decay:  0.00015031142497678348
dropout:  0.2
fix split and run 3 times
Data: Data(x=[19717, 500], y=[19717], train_mask=[19717], val_mask=[19717], test_mask=[19717], adj_t=[19717, 19717, nnz=88648])
num_train tensor(60)
num_noise 0
noise: tensor(0)
data feature 500
ALTOPT(
  (lins): Sequential(
    (0): Linear(in_features=500, out_features=64, bias=True)
    (1): BatchNorm1d(64, eps=1e-05, momentum=0.1, affine=True, track_running_stats=True)
    (2): Dropout(p=0.2, inplace=True)
    (3): ReLU(inplace=True)
    (4): Linear(in_features=64, out_features=3, bias=True)
    (5): Identity()
  )
  (prop): Propagation(K=6, mode=None, lambda1=None, lambda2=None, L21=True, alpha=0.9)
  (gcn): GCN(
    (convs): ModuleList(
      (0): GCNConv(500, 64)
      (1): GCNConv(64, 3)
    )
    (bns): ModuleList(
      (0): BatchNorm1d(64, eps=1e-05, momentum=0.1, affine=True, track_running_stats=True)
    )
    (output): Identity()
  )
)
propagate done
init label
Split: 01, Run: 01
None time:  1.2200584020465612
None Run 01:
Highest Train: 100.00
Highest Valid: 81.80
  Final Train: 100.00
   Final Test: 78.00
Split: 01, Run: 02
None time:  3.2066466209944338
None Run 02:
Highest Train: 100.00
Highest Valid: 82.60
  Final Train: 100.00
   Final Test: 80.30
Split: 01, Run: 03
None time:  1.3149493529926986
None Run 03:
Highest Train: 100.00
Highest Valid: 80.80
  Final Train: 100.00
   Final Test: 78.10
run time now: 5.780117750167847
total time:  5.824729060987011
None All runs:
Highest Train: 100.00 ± 0.00
Highest Valid: 81.73 ± 0.90
  Final Train: 100.00 ± 0.00
   Final Test: 78.80 ± 1.30
[I 2023-06-12 00:17:50,039] Trial 64 finished with value: 81.73332977294922 and parameters: {'Fwd': 1.8364073750048432e-06, 'K': 6, 'alpha': 0.9, 'dropout': 0.2, 'gnnepoch': 80, 'lambda1': 0.25, 'lambda2': 8.198311292329334, 'loop': 1, 'loss': 'MSE', 'lr': 0.0011345609186479788, 'softmaxF': True, 'useGCN': False, 'weight_decay': 0.00015031142497678348, 'weightedloss': False}. Best is trial 54 with value: 82.06666564941406.
/home/wxy/miniconda3/lib/python3.10/site-packages/optuna/distributions.py:685: UserWarning: The distribution is specified by [0, 1.00001] and step=0.05, but the range is not divisible by `step`. It will be replaced by [0, 1.0].
  warnings.warn(
K:  5
alpha:  0.8
lr:  0.0011141667072337505
weight_decay:  0.00022194135013463382
dropout:  0.5
fix split and run 3 times
Data: Data(x=[19717, 500], y=[19717], train_mask=[19717], val_mask=[19717], test_mask=[19717], adj_t=[19717, 19717, nnz=88648])
num_train tensor(60)
num_noise 0
noise: tensor(0)
data feature 500
ALTOPT(
  (lins): Sequential(
    (0): Linear(in_features=500, out_features=64, bias=True)
    (1): BatchNorm1d(64, eps=1e-05, momentum=0.1, affine=True, track_running_stats=True)
    (2): Dropout(p=0.5, inplace=True)
    (3): ReLU(inplace=True)
    (4): Linear(in_features=64, out_features=3, bias=True)
    (5): Identity()
  )
  (prop): Propagation(K=5, mode=None, lambda1=None, lambda2=None, L21=True, alpha=0.8)
  (gcn): GCN(
    (convs): ModuleList(
      (0): GCNConv(500, 64)
      (1): GCNConv(64, 3)
    )
    (bns): ModuleList(
      (0): BatchNorm1d(64, eps=1e-05, momentum=0.1, affine=True, track_running_stats=True)
    )
    (output): Identity()
  )
)
propagate done
init label
Split: 01, Run: 01
None time:  1.1620566509664059
None Run 01:
Highest Train: 100.00
Highest Valid: 77.80
  Final Train: 100.00
   Final Test: 75.70
Split: 01, Run: 02
None time:  1.1409028838388622
None Run 02:
Highest Train: 100.00
Highest Valid: 82.20
  Final Train: 100.00
   Final Test: 78.70
Split: 01, Run: 03
None time:  1.4625431559979916
None Run 03:
Highest Train: 100.00
Highest Valid: 81.60
  Final Train: 100.00
   Final Test: 79.40
run time now: 3.8073322772979736
total time:  3.858912296127528
None All runs:
Highest Train: 100.00 ± 0.00
Highest Valid: 80.53 ± 2.39
  Final Train: 100.00 ± 0.00
   Final Test: 77.93 ± 1.97
[I 2023-06-12 00:17:54,369] Trial 65 finished with value: 80.53333282470703 and parameters: {'Fwd': 1.791759574851155e-06, 'K': 5, 'alpha': 0.8, 'dropout': 0.5, 'gnnepoch': 80, 'lambda1': 0.2, 'lambda2': 8.878260261391365, 'loop': 1, 'loss': 'MSE', 'lr': 0.0011141667072337505, 'softmaxF': True, 'useGCN': False, 'weight_decay': 0.00022194135013463382, 'weightedloss': False}. Best is trial 54 with value: 82.06666564941406.
/home/wxy/miniconda3/lib/python3.10/site-packages/optuna/distributions.py:685: UserWarning: The distribution is specified by [0, 1.00001] and step=0.05, but the range is not divisible by `step`. It will be replaced by [0, 1.0].
  warnings.warn(
K:  7
alpha:  0.9
lr:  0.0009183837535134037
weight_decay:  0.000328358453439123
dropout:  0.8
fix split and run 3 times
Data: Data(x=[19717, 500], y=[19717], train_mask=[19717], val_mask=[19717], test_mask=[19717], adj_t=[19717, 19717, nnz=88648])
num_train tensor(60)
num_noise 0
noise: tensor(0)
data feature 500
ALTOPT(
  (lins): Sequential(
    (0): Linear(in_features=500, out_features=64, bias=True)
    (1): BatchNorm1d(64, eps=1e-05, momentum=0.1, affine=True, track_running_stats=True)
    (2): Dropout(p=0.8, inplace=True)
    (3): ReLU(inplace=True)
    (4): Linear(in_features=64, out_features=3, bias=True)
    (5): Identity()
  )
  (prop): Propagation(K=7, mode=None, lambda1=None, lambda2=None, L21=True, alpha=0.9)
  (gcn): GCN(
    (convs): ModuleList(
      (0): GCNConv(500, 64)
      (1): GCNConv(64, 3)
    )
    (bns): ModuleList(
      (0): BatchNorm1d(64, eps=1e-05, momentum=0.1, affine=True, track_running_stats=True)
    )
    (output): Identity()
  )
)
propagate done
init label
Split: 01, Run: 01
None time:  0.9521671268157661
None Run 01:
Highest Train: 100.00
Highest Valid: 79.80
  Final Train: 100.00
   Final Test: 77.60
Split: 01, Run: 02
None time:  1.1902134490665048
None Run 02:
Highest Train: 100.00
Highest Valid: 80.40
  Final Train: 100.00
   Final Test: 77.30
Split: 01, Run: 03
None time:  1.1734425169415772
None Run 03:
Highest Train: 100.00
Highest Valid: 82.40
  Final Train: 100.00
   Final Test: 78.70
run time now: 3.360386610031128
total time:  3.4092807369306684
None All runs:
Highest Train: 100.00 ± 0.00
Highest Valid: 80.87 ± 1.36
  Final Train: 100.00 ± 0.00
   Final Test: 77.87 ± 0.74
[I 2023-06-12 00:17:58,201] Trial 66 finished with value: 80.86666870117188 and parameters: {'Fwd': 2.3655260686597474e-06, 'K': 7, 'alpha': 0.9, 'dropout': 0.8, 'gnnepoch': 80, 'lambda1': 0.25, 'lambda2': 8.303271128611458, 'loop': 1, 'loss': 'MSE', 'lr': 0.0009183837535134037, 'softmaxF': True, 'useGCN': False, 'weight_decay': 0.000328358453439123, 'weightedloss': False}. Best is trial 54 with value: 82.06666564941406.
/home/wxy/miniconda3/lib/python3.10/site-packages/optuna/distributions.py:685: UserWarning: The distribution is specified by [0, 1.00001] and step=0.05, but the range is not divisible by `step`. It will be replaced by [0, 1.0].
  warnings.warn(
K:  6
alpha:  0.8500000000000001
lr:  0.001154041285087692
weight_decay:  0.0001879829762801207
dropout:  0.30000000000000004
fix split and run 3 times
Data: Data(x=[19717, 500], y=[19717], train_mask=[19717], val_mask=[19717], test_mask=[19717], adj_t=[19717, 19717, nnz=88648])
num_train tensor(60)
num_noise 0
noise: tensor(0)
data feature 500
ALTOPT(
  (lins): Sequential(
    (0): Linear(in_features=500, out_features=64, bias=True)
    (1): BatchNorm1d(64, eps=1e-05, momentum=0.1, affine=True, track_running_stats=True)
    (2): Dropout(p=0.30000000000000004, inplace=True)
    (3): ReLU(inplace=True)
    (4): Linear(in_features=64, out_features=3, bias=True)
    (5): Identity()
  )
  (prop): Propagation(K=6, mode=None, lambda1=None, lambda2=None, L21=True, alpha=0.8500000000000001)
  (gcn): GCN(
    (convs): ModuleList(
      (0): GCNConv(500, 64)
      (1): GCNConv(64, 3)
    )
    (bns): ModuleList(
      (0): BatchNorm1d(64, eps=1e-05, momentum=0.1, affine=True, track_running_stats=True)
    )
    (output): Identity()
  )
)
propagate done
init label
Split: 01, Run: 01
None time:  1.6629541320726275
None Run 01:
Highest Train: 100.00
Highest Valid: 79.80
  Final Train: 100.00
   Final Test: 76.80
Split: 01, Run: 02
None time:  1.0582939088344574
None Run 02:
Highest Train: 100.00
Highest Valid: 75.20
  Final Train: 100.00
   Final Test: 73.10
Split: 01, Run: 03, Epoch: 100, Loss: 0.0680, Train: 100.00%, Valid: 81.40% Test: 81.30%
Split: 01, Run: 03
None time:  2.826808544108644
None Run 03:
Highest Train: 100.00
Highest Valid: 81.40
  Final Train: 100.00
   Final Test: 80.50
run time now: 5.595454454421997
total time:  5.6481342560146
None All runs:
Highest Train: 100.00 ± 0.00
Highest Valid: 78.80 ± 3.22
  Final Train: 100.00 ± 0.00
   Final Test: 76.80 ± 3.70
[I 2023-06-12 00:18:04,262] Trial 67 finished with value: 78.79999542236328 and parameters: {'Fwd': 1.4233729906314343e-06, 'K': 6, 'alpha': 0.8500000000000001, 'dropout': 0.30000000000000004, 'gnnepoch': 70, 'lambda1': 0.45, 'lambda2': 7.27070722792695, 'loop': 1, 'loss': 'MSE', 'lr': 0.001154041285087692, 'softmaxF': True, 'useGCN': False, 'weight_decay': 0.0001879829762801207, 'weightedloss': False}. Best is trial 54 with value: 82.06666564941406.
/home/wxy/miniconda3/lib/python3.10/site-packages/optuna/distributions.py:685: UserWarning: The distribution is specified by [0, 1.00001] and step=0.05, but the range is not divisible by `step`. It will be replaced by [0, 1.0].
  warnings.warn(
K:  7
alpha:  0.35000000000000003
lr:  0.0017806305590773405
weight_decay:  0.0004583207591465438
dropout:  0.2
fix split and run 3 times
Data: Data(x=[19717, 500], y=[19717], train_mask=[19717], val_mask=[19717], test_mask=[19717], adj_t=[19717, 19717, nnz=88648])
num_train tensor(60)
num_noise 0
noise: tensor(0)
data feature 500
ALTOPT(
  (lins): Sequential(
    (0): Linear(in_features=500, out_features=64, bias=True)
    (1): BatchNorm1d(64, eps=1e-05, momentum=0.1, affine=True, track_running_stats=True)
    (2): Dropout(p=0.2, inplace=True)
    (3): ReLU(inplace=True)
    (4): Linear(in_features=64, out_features=3, bias=True)
    (5): LogSoftmax(dim=-1)
  )
  (prop): Propagation(K=7, mode=None, lambda1=None, lambda2=None, L21=True, alpha=0.35000000000000003)
  (gcn): GCN(
    (convs): ModuleList(
      (0): GCNConv(500, 64)
      (1): GCNConv(64, 3)
    )
    (bns): ModuleList(
      (0): BatchNorm1d(64, eps=1e-05, momentum=0.1, affine=True, track_running_stats=True)
    )
    (output): LogSoftmax(dim=-1)
  )
)
propagate done
init label
Split: 01, Run: 01
None time:  1.0322496329899877
None Run 01:
Highest Train: 100.00
Highest Valid: 72.20
  Final Train: 100.00
   Final Test: 70.10
Split: 01, Run: 02
None time:  0.8295072978362441
None Run 02:
Highest Train: 100.00
Highest Valid: 74.80
  Final Train: 100.00
   Final Test: 73.70
Split: 01, Run: 03
None time:  0.8022433938458562
None Run 03:
Highest Train: 100.00
Highest Valid: 76.20
  Final Train: 100.00
   Final Test: 74.90
run time now: 2.7104954719543457
total time:  2.7567032938823104
None All runs:
Highest Train: 100.00 ± 0.00
Highest Valid: 74.40 ± 2.03
  Final Train: 100.00 ± 0.00
   Final Test: 72.90 ± 2.50
[I 2023-06-12 00:18:07,507] Trial 68 finished with value: 74.4000015258789 and parameters: {'Fwd': 3.6920967377532805e-06, 'K': 7, 'alpha': 0.35000000000000003, 'dropout': 0.2, 'gnnepoch': 50, 'lambda1': 0.1, 'lambda2': 8.00277506272433, 'loop': 1, 'loss': 'CE', 'lr': 0.0017806305590773405, 'softmaxF': True, 'useGCN': False, 'weight_decay': 0.0004583207591465438, 'weightedloss': False}. Best is trial 54 with value: 82.06666564941406.
/home/wxy/miniconda3/lib/python3.10/site-packages/optuna/distributions.py:685: UserWarning: The distribution is specified by [0, 1.00001] and step=0.05, but the range is not divisible by `step`. It will be replaced by [0, 1.0].
  warnings.warn(
K:  6
alpha:  0.9
lr:  0.0007238306800118632
weight_decay:  8.959068320930715e-05
dropout:  0.1
fix split and run 3 times
Data: Data(x=[19717, 500], y=[19717], train_mask=[19717], val_mask=[19717], test_mask=[19717], adj_t=[19717, 19717, nnz=88648])
num_train tensor(60)
num_noise 0
noise: tensor(0)
data feature 500
ALTOPT(
  (lins): Sequential(
    (0): Linear(in_features=500, out_features=64, bias=True)
    (1): BatchNorm1d(64, eps=1e-05, momentum=0.1, affine=True, track_running_stats=True)
    (2): Dropout(p=0.1, inplace=True)
    (3): ReLU(inplace=True)
    (4): Linear(in_features=64, out_features=3, bias=True)
    (5): Identity()
  )
  (prop): Propagation(K=6, mode=None, lambda1=None, lambda2=None, L21=True, alpha=0.9)
  (gcn): GCN(
    (convs): ModuleList(
      (0): GCNConv(500, 64)
      (1): GCNConv(64, 3)
    )
    (bns): ModuleList(
      (0): BatchNorm1d(64, eps=1e-05, momentum=0.1, affine=True, track_running_stats=True)
    )
    (output): Identity()
  )
)
propagate done
init label
Split: 01, Run: 01, Epoch: 100, Loss: 0.0108, Train: 100.00%, Valid: 76.60% Test: 74.80%
Split: 01, Run: 01
None time:  4.93714304594323
None Run 01:
Highest Train: 100.00
Highest Valid: 76.60
  Final Train: 100.00
   Final Test: 75.00
Split: 01, Run: 02
None time:  1.90488545387052
None Run 02:
Highest Train: 100.00
Highest Valid: 73.00
  Final Train: 100.00
   Final Test: 71.90
Split: 01, Run: 03
None time:  2.3618050899822265
None Run 03:
Highest Train: 100.00
Highest Valid: 74.80
  Final Train: 100.00
   Final Test: 73.00
run time now: 9.24537706375122
total time:  9.300774854142219
None All runs:
Highest Train: 100.00 ± 0.00
Highest Valid: 74.80 ± 1.80
  Final Train: 100.00 ± 0.00
   Final Test: 73.30 ± 1.57
[I 2023-06-12 00:18:17,420] Trial 69 finished with value: 74.80000305175781 and parameters: {'Fwd': 2.789227741912511e-06, 'K': 6, 'alpha': 0.9, 'dropout': 0.1, 'gnnepoch': 80, 'lambda1': 0.05, 'lambda2': 6.969822235780018, 'loop': 1, 'loss': 'MSE', 'lr': 0.0007238306800118632, 'softmaxF': False, 'useGCN': True, 'weight_decay': 8.959068320930715e-05, 'weightedloss': False}. Best is trial 54 with value: 82.06666564941406.
/home/wxy/miniconda3/lib/python3.10/site-packages/optuna/distributions.py:685: UserWarning: The distribution is specified by [0, 1.00001] and step=0.05, but the range is not divisible by `step`. It will be replaced by [0, 1.0].
  warnings.warn(
K:  8
alpha:  0.2
lr:  0.0015843139677761485
weight_decay:  0.00014171410816675464
dropout:  0.0
fix split and run 3 times
Data: Data(x=[19717, 500], y=[19717], train_mask=[19717], val_mask=[19717], test_mask=[19717], adj_t=[19717, 19717, nnz=88648])
num_train tensor(60)
num_noise 0
noise: tensor(0)
data feature 500
ALTOPT(
  (lins): Sequential(
    (0): Linear(in_features=500, out_features=64, bias=True)
    (1): BatchNorm1d(64, eps=1e-05, momentum=0.1, affine=True, track_running_stats=True)
    (2): Dropout(p=0.0, inplace=True)
    (3): ReLU(inplace=True)
    (4): Linear(in_features=64, out_features=3, bias=True)
    (5): Identity()
  )
  (prop): Propagation(K=8, mode=None, lambda1=None, lambda2=None, L21=True, alpha=0.2)
  (gcn): GCN(
    (convs): ModuleList(
      (0): GCNConv(500, 64)
      (1): GCNConv(64, 3)
    )
    (bns): ModuleList(
      (0): BatchNorm1d(64, eps=1e-05, momentum=0.1, affine=True, track_running_stats=True)
    )
    (output): Identity()
  )
)
propagate done
init label
Split: 01, Run: 01
None time:  0.6044005251023918
None Run 01:
Highest Train: 100.00
Highest Valid: 70.20
  Final Train: 100.00
   Final Test: 69.80
Split: 01, Run: 02
None time:  1.1576798481401056
None Run 02:
Highest Train: 100.00
Highest Valid: 72.20
  Final Train: 100.00
   Final Test: 72.20
Split: 01, Run: 03
None time:  0.8082541681360453
None Run 03:
Highest Train: 100.00
Highest Valid: 75.00
  Final Train: 100.00
   Final Test: 75.40
run time now: 2.6532037258148193
total time:  2.722681515151635
None All runs:
Highest Train: 100.00 ± 0.00
Highest Valid: 72.47 ± 2.41
  Final Train: 100.00 ± 0.00
   Final Test: 72.47 ± 2.81
[I 2023-06-12 00:18:20,688] Trial 70 finished with value: 72.46666717529297 and parameters: {'Fwd': 4.930815707593781e-06, 'K': 8, 'alpha': 0.2, 'dropout': 0.0, 'gnnepoch': 30, 'lambda1': 0.4, 'lambda2': 8.92659059666961, 'loop': 1, 'loss': 'MSE', 'lr': 0.0015843139677761485, 'softmaxF': True, 'useGCN': False, 'weight_decay': 0.00014171410816675464, 'weightedloss': True}. Best is trial 54 with value: 82.06666564941406.
/home/wxy/miniconda3/lib/python3.10/site-packages/optuna/distributions.py:685: UserWarning: The distribution is specified by [0, 1.00001] and step=0.05, but the range is not divisible by `step`. It will be replaced by [0, 1.0].
  warnings.warn(
K:  6
alpha:  0.9500000000000001
lr:  0.0013314622274204573
weight_decay:  0.00017880234418509987
dropout:  0.2
fix split and run 3 times
Data: Data(x=[19717, 500], y=[19717], train_mask=[19717], val_mask=[19717], test_mask=[19717], adj_t=[19717, 19717, nnz=88648])
num_train tensor(60)
num_noise 0
noise: tensor(0)
data feature 500
ALTOPT(
  (lins): Sequential(
    (0): Linear(in_features=500, out_features=64, bias=True)
    (1): BatchNorm1d(64, eps=1e-05, momentum=0.1, affine=True, track_running_stats=True)
    (2): Dropout(p=0.2, inplace=True)
    (3): ReLU(inplace=True)
    (4): Linear(in_features=64, out_features=3, bias=True)
    (5): Identity()
  )
  (prop): Propagation(K=6, mode=None, lambda1=None, lambda2=None, L21=True, alpha=0.9500000000000001)
  (gcn): GCN(
    (convs): ModuleList(
      (0): GCNConv(500, 64)
      (1): GCNConv(64, 3)
    )
    (bns): ModuleList(
      (0): BatchNorm1d(64, eps=1e-05, momentum=0.1, affine=True, track_running_stats=True)
    )
    (output): Identity()
  )
)
propagate done
init label
Split: 01, Run: 01
None time:  1.7669958239421248
None Run 01:
Highest Train: 100.00
Highest Valid: 80.00
  Final Train: 100.00
   Final Test: 77.70
Split: 01, Run: 02
None time:  1.5174169049132615
None Run 02:
Highest Train: 100.00
Highest Valid: 81.60
  Final Train: 100.00
   Final Test: 79.10
Split: 01, Run: 03
None time:  1.0108879879117012
None Run 03:
Highest Train: 100.00
Highest Valid: 80.80
  Final Train: 100.00
   Final Test: 80.10
run time now: 4.337550163269043
total time:  4.379731738939881
None All runs:
Highest Train: 100.00 ± 0.00
Highest Valid: 80.80 ± 0.80
  Final Train: 100.00 ± 0.00
   Final Test: 78.97 ± 1.21
