[I 2023-06-12 00:13:52,482] Trial 17 finished with value: 76.53333282470703 and parameters: {'Fwd': 6.872313368963582e-05, 'K': 5, 'alpha': 0.2, 'dropout': 0.1, 'gnnepoch': 110, 'lambda1': 0.2, 'lambda2': 8.77962004097162, 'loop': 2, 'loss': 'MSE', 'lr': 0.002402380422958828, 'softmaxF': True, 'useGCN': False, 'weight_decay': 0.00013964903700743346, 'weightedloss': False}. Best is trial 11 with value: 80.26666259765625.
/home/wxy/miniconda3/lib/python3.10/site-packages/optuna/distributions.py:685: UserWarning: The distribution is specified by [0, 1.00001] and step=0.05, but the range is not divisible by `step`. It will be replaced by [0, 1.0].
  warnings.warn(
K:  1
alpha:  0.4
lr:  0.0012038786573776883
weight_decay:  3.770175765736464e-05
dropout:  0.30000000000000004
fix split and run 3 times
Data: Data(x=[19717, 500], y=[19717], train_mask=[19717], val_mask=[19717], test_mask=[19717], adj_t=[19717, 19717, nnz=88648])
num_train tensor(60)
num_noise 0
noise: tensor(0)
data feature 500
ALTOPT(
  (lins): Sequential(
    (0): Linear(in_features=500, out_features=64, bias=True)
    (1): BatchNorm1d(64, eps=1e-05, momentum=0.1, affine=True, track_running_stats=True)
    (2): Dropout(p=0.30000000000000004, inplace=True)
    (3): ReLU(inplace=True)
    (4): Linear(in_features=64, out_features=3, bias=True)
    (5): LogSoftmax(dim=-1)
  )
  (prop): Propagation(K=1, mode=None, lambda1=None, lambda2=None, L21=True, alpha=0.4)
  (gcn): GCN(
    (convs): ModuleList(
      (0): GCNConv(500, 64)
      (1): GCNConv(64, 3)
    )
    (bns): ModuleList(
      (0): BatchNorm1d(64, eps=1e-05, momentum=0.1, affine=True, track_running_stats=True)
    )
    (output): LogSoftmax(dim=-1)
  )
)
propagate done
init label
Split: 01, Run: 01
None time:  1.7765310970135033
None Run 01:
Highest Train: 100.00
Highest Valid: 76.60
  Final Train: 100.00
   Final Test: 74.70
Split: 01, Run: 02
None time:  1.5165568280499429
None Run 02:
Highest Train: 100.00
Highest Valid: 76.00
  Final Train: 100.00
   Final Test: 73.90
Split: 01, Run: 03
None time:  1.4928719010204077
None Run 03:
Highest Train: 100.00
Highest Valid: 75.20
  Final Train: 100.00
   Final Test: 72.10
run time now: 4.821002006530762
total time:  4.876117466017604
None All runs:
Highest Train: 100.00 ± 0.00
Highest Valid: 75.93 ± 0.70
  Final Train: 100.00 ± 0.00
   Final Test: 73.57 ± 1.33
[I 2023-06-12 00:13:57,756] Trial 18 finished with value: 75.93333435058594 and parameters: {'Fwd': 9.504814557773033e-06, 'K': 1, 'alpha': 0.4, 'dropout': 0.30000000000000004, 'gnnepoch': 80, 'lambda1': 1.0, 'lambda2': 6.755666911326216, 'loop': 0, 'loss': 'CE', 'lr': 0.0012038786573776883, 'softmaxF': False, 'useGCN': True, 'weight_decay': 3.770175765736464e-05, 'weightedloss': False}. Best is trial 11 with value: 80.26666259765625.
/home/wxy/miniconda3/lib/python3.10/site-packages/optuna/distributions.py:685: UserWarning: The distribution is specified by [0, 1.00001] and step=0.05, but the range is not divisible by `step`. It will be replaced by [0, 1.0].
  warnings.warn(
K:  4
alpha:  1.0
lr:  0.006449520060021922
weight_decay:  7.153593980194316e-06
dropout:  0.1
fix split and run 3 times
Data: Data(x=[19717, 500], y=[19717], train_mask=[19717], val_mask=[19717], test_mask=[19717], adj_t=[19717, 19717, nnz=88648])
num_train tensor(60)
num_noise 0
noise: tensor(0)
data feature 500
ALTOPT(
  (lins): Sequential(
    (0): Linear(in_features=500, out_features=64, bias=True)
    (1): BatchNorm1d(64, eps=1e-05, momentum=0.1, affine=True, track_running_stats=True)
    (2): Dropout(p=0.1, inplace=True)
    (3): ReLU(inplace=True)
    (4): Linear(in_features=64, out_features=3, bias=True)
    (5): Identity()
  )
  (prop): Propagation(K=4, mode=None, lambda1=None, lambda2=None, L21=True, alpha=1.0)
  (gcn): GCN(
    (convs): ModuleList(
      (0): GCNConv(500, 64)
      (1): GCNConv(64, 3)
    )
    (bns): ModuleList(
      (0): BatchNorm1d(64, eps=1e-05, momentum=0.1, affine=True, track_running_stats=True)
    )
    (output): Identity()
  )
)
propagate done
init label
Split: 01, Run: 01
None time:  0.5283088369760662
None Run 01:
Highest Train: 100.00
Highest Valid: 63.20
  Final Train: 100.00
   Final Test: 64.10
Split: 01, Run: 02
None time:  0.5965502229519188
None Run 02:
Highest Train: 100.00
Highest Valid: 76.60
  Final Train: 100.00
   Final Test: 75.90
Split: 01, Run: 03
None time:  1.0509677240625024
None Run 03:
Highest Train: 100.00
Highest Valid: 81.00
  Final Train: 100.00
   Final Test: 77.80
run time now: 2.2488133907318115
total time:  2.316834779921919
None All runs:
Highest Train: 100.00 ± 0.00
Highest Valid: 73.60 ± 9.27
  Final Train: 100.00 ± 0.00
   Final Test: 72.60 ± 7.42
[I 2023-06-12 00:14:00,572] Trial 19 finished with value: 73.5999984741211 and parameters: {'Fwd': 0.0005462120974736118, 'K': 4, 'alpha': 1.0, 'dropout': 0.1, 'gnnepoch': 40, 'lambda1': 0.8500000000000001, 'lambda2': 4.424804127361265, 'loop': 1, 'loss': 'MSE', 'lr': 0.006449520060021922, 'softmaxF': True, 'useGCN': False, 'weight_decay': 7.153593980194316e-06, 'weightedloss': False}. Best is trial 11 with value: 80.26666259765625.
/home/wxy/miniconda3/lib/python3.10/site-packages/optuna/distributions.py:685: UserWarning: The distribution is specified by [0, 1.00001] and step=0.05, but the range is not divisible by `step`. It will be replaced by [0, 1.0].
  warnings.warn(
K:  7
alpha:  0.65
lr:  0.0030334039629268846
weight_decay:  0.0003307147673960515
dropout:  0.5
fix split and run 3 times
Data: Data(x=[19717, 500], y=[19717], train_mask=[19717], val_mask=[19717], test_mask=[19717], adj_t=[19717, 19717, nnz=88648])
num_train tensor(60)
num_noise 0
noise: tensor(0)
data feature 500
ALTOPT(
  (lins): Sequential(
    (0): Linear(in_features=500, out_features=64, bias=True)
    (1): BatchNorm1d(64, eps=1e-05, momentum=0.1, affine=True, track_running_stats=True)
    (2): Dropout(p=0.5, inplace=True)
    (3): ReLU(inplace=True)
    (4): Linear(in_features=64, out_features=3, bias=True)
    (5): Identity()
  )
  (prop): Propagation(K=7, mode=None, lambda1=None, lambda2=None, L21=True, alpha=0.65)
  (gcn): GCN(
    (convs): ModuleList(
      (0): GCNConv(500, 64)
      (1): GCNConv(64, 3)
    )
    (bns): ModuleList(
      (0): BatchNorm1d(64, eps=1e-05, momentum=0.1, affine=True, track_running_stats=True)
    )
    (output): Identity()
  )
)
propagate done
init label
Split: 01, Run: 01, Epoch: 100, Loss: 0.1491, Train: 100.00%, Valid: 81.40% Test: 79.90%
Split: 01, Run: 01
None time:  3.32197542488575
None Run 01:
Highest Train: 100.00
Highest Valid: 81.40
  Final Train: 100.00
   Final Test: 80.00
Split: 01, Run: 02
None time:  1.213810081128031
None Run 02:
Highest Train: 100.00
Highest Valid: 81.20
  Final Train: 100.00
   Final Test: 78.40
Split: 01, Run: 03
None time:  0.9919302691705525
None Run 03:
Highest Train: 100.00
Highest Valid: 80.60
  Final Train: 100.00
   Final Test: 78.70
run time now: 5.573023319244385
total time:  5.625014256918803
None All runs:
Highest Train: 100.00 ± 0.00
Highest Valid: 81.07 ± 0.42
  Final Train: 100.00 ± 0.00
   Final Test: 79.03 ± 0.85
[I 2023-06-12 00:14:06,635] Trial 20 finished with value: 81.0666732788086 and parameters: {'Fwd': 6.588604738619063e-05, 'K': 7, 'alpha': 0.65, 'dropout': 0.5, 'gnnepoch': 70, 'lambda1': 0.25, 'lambda2': 8.193349344822003, 'loop': 1, 'loss': 'MSE', 'lr': 0.0030334039629268846, 'softmaxF': True, 'useGCN': False, 'weight_decay': 0.0003307147673960515, 'weightedloss': False}. Best is trial 20 with value: 81.0666732788086.
/home/wxy/miniconda3/lib/python3.10/site-packages/optuna/distributions.py:685: UserWarning: The distribution is specified by [0, 1.00001] and step=0.05, but the range is not divisible by `step`. It will be replaced by [0, 1.0].
  warnings.warn(
K:  7
alpha:  0.65
lr:  0.0030849047910859735
weight_decay:  0.0004578437512944869
dropout:  0.5
fix split and run 3 times
Data: Data(x=[19717, 500], y=[19717], train_mask=[19717], val_mask=[19717], test_mask=[19717], adj_t=[19717, 19717, nnz=88648])
num_train tensor(60)
num_noise 0
noise: tensor(0)
data feature 500
ALTOPT(
  (lins): Sequential(
    (0): Linear(in_features=500, out_features=64, bias=True)
    (1): BatchNorm1d(64, eps=1e-05, momentum=0.1, affine=True, track_running_stats=True)
    (2): Dropout(p=0.5, inplace=True)
    (3): ReLU(inplace=True)
    (4): Linear(in_features=64, out_features=3, bias=True)
    (5): Identity()
  )
  (prop): Propagation(K=7, mode=None, lambda1=None, lambda2=None, L21=True, alpha=0.65)
  (gcn): GCN(
    (convs): ModuleList(
      (0): GCNConv(500, 64)
      (1): GCNConv(64, 3)
    )
    (bns): ModuleList(
      (0): BatchNorm1d(64, eps=1e-05, momentum=0.1, affine=True, track_running_stats=True)
    )
    (output): Identity()
  )
)
propagate done
init label
Split: 01, Run: 01
None time:  1.6438007769174874
None Run 01:
Highest Train: 100.00
Highest Valid: 79.00
  Final Train: 100.00
   Final Test: 78.00
Split: 01, Run: 02
None time:  0.996546199079603
None Run 02:
Highest Train: 100.00
Highest Valid: 80.00
  Final Train: 100.00
   Final Test: 76.20
Split: 01, Run: 03
None time:  1.0642989850603044
None Run 03:
Highest Train: 100.00
Highest Valid: 77.20
  Final Train: 100.00
   Final Test: 74.50
run time now: 3.752845048904419
total time:  3.7999919198919088
None All runs:
Highest Train: 100.00 ± 0.00
Highest Valid: 78.73 ± 1.42
  Final Train: 100.00 ± 0.00
   Final Test: 76.23 ± 1.75
[I 2023-06-12 00:14:10,891] Trial 21 finished with value: 78.73333740234375 and parameters: {'Fwd': 5.6426471228880466e-05, 'K': 7, 'alpha': 0.65, 'dropout': 0.5, 'gnnepoch': 70, 'lambda1': 0.2, 'lambda2': 9.07680289402724, 'loop': 1, 'loss': 'MSE', 'lr': 0.0030849047910859735, 'softmaxF': True, 'useGCN': False, 'weight_decay': 0.0004578437512944869, 'weightedloss': False}. Best is trial 20 with value: 81.0666732788086.
/home/wxy/miniconda3/lib/python3.10/site-packages/optuna/distributions.py:685: UserWarning: The distribution is specified by [0, 1.00001] and step=0.05, but the range is not divisible by `step`. It will be replaced by [0, 1.0].
  warnings.warn(
K:  9
alpha:  0.5
lr:  0.0016235546336473984
weight_decay:  3.409514566589007e-05
dropout:  0.6000000000000001
fix split and run 3 times
Data: Data(x=[19717, 500], y=[19717], train_mask=[19717], val_mask=[19717], test_mask=[19717], adj_t=[19717, 19717, nnz=88648])
num_train tensor(60)
num_noise 0
noise: tensor(0)
data feature 500
ALTOPT(
  (lins): Sequential(
    (0): Linear(in_features=500, out_features=64, bias=True)
    (1): BatchNorm1d(64, eps=1e-05, momentum=0.1, affine=True, track_running_stats=True)
    (2): Dropout(p=0.6000000000000001, inplace=True)
    (3): ReLU(inplace=True)
    (4): Linear(in_features=64, out_features=3, bias=True)
    (5): Identity()
  )
  (prop): Propagation(K=9, mode=None, lambda1=None, lambda2=None, L21=True, alpha=0.5)
  (gcn): GCN(
    (convs): ModuleList(
      (0): GCNConv(500, 64)
      (1): GCNConv(64, 3)
    )
    (bns): ModuleList(
      (0): BatchNorm1d(64, eps=1e-05, momentum=0.1, affine=True, track_running_stats=True)
    )
    (output): Identity()
  )
)
propagate done
init label
Split: 01, Run: 01, Epoch: 100, Loss: 0.2998, Train: 100.00%, Valid: 75.00% Test: 74.70%
Split: 01, Run: 01
None time:  3.7125955398660153
None Run 01:
Highest Train: 100.00
Highest Valid: 75.00
  Final Train: 100.00
   Final Test: 74.60
Split: 01, Run: 02
None time:  1.3688810269813985
None Run 02:
Highest Train: 100.00
Highest Valid: 79.80
  Final Train: 100.00
   Final Test: 78.50
Split: 01, Run: 03
None time:  1.3504427538719028
None Run 03:
Highest Train: 100.00
Highest Valid: 78.40
  Final Train: 100.00
   Final Test: 76.80
run time now: 6.479223012924194
total time:  6.531134573975578
None All runs:
Highest Train: 100.00 ± 0.00
Highest Valid: 77.73 ± 2.47
  Final Train: 100.00 ± 0.00
   Final Test: 76.63 ± 1.96
[I 2023-06-12 00:14:17,814] Trial 22 finished with value: 77.73332977294922 and parameters: {'Fwd': 0.00011536449349510707, 'K': 9, 'alpha': 0.5, 'dropout': 0.6000000000000001, 'gnnepoch': 100, 'lambda1': 0.30000000000000004, 'lambda2': 8.12131923795917, 'loop': 1, 'loss': 'MSE', 'lr': 0.0016235546336473984, 'softmaxF': True, 'useGCN': False, 'weight_decay': 3.409514566589007e-05, 'weightedloss': False}. Best is trial 20 with value: 81.0666732788086.
/home/wxy/miniconda3/lib/python3.10/site-packages/optuna/distributions.py:685: UserWarning: The distribution is specified by [0, 1.00001] and step=0.05, but the range is not divisible by `step`. It will be replaced by [0, 1.0].
  warnings.warn(
K:  7
alpha:  0.5
lr:  0.002924868178545388
weight_decay:  0.00022899430198304146
dropout:  0.4
fix split and run 3 times
Data: Data(x=[19717, 500], y=[19717], train_mask=[19717], val_mask=[19717], test_mask=[19717], adj_t=[19717, 19717, nnz=88648])
num_train tensor(60)
num_noise 0
noise: tensor(0)
data feature 500
ALTOPT(
  (lins): Sequential(
    (0): Linear(in_features=500, out_features=64, bias=True)
    (1): BatchNorm1d(64, eps=1e-05, momentum=0.1, affine=True, track_running_stats=True)
    (2): Dropout(p=0.4, inplace=True)
    (3): ReLU(inplace=True)
    (4): Linear(in_features=64, out_features=3, bias=True)
    (5): Identity()
  )
  (prop): Propagation(K=7, mode=None, lambda1=None, lambda2=None, L21=True, alpha=0.5)
  (gcn): GCN(
    (convs): ModuleList(
      (0): GCNConv(500, 64)
      (1): GCNConv(64, 3)
    )
    (bns): ModuleList(
      (0): BatchNorm1d(64, eps=1e-05, momentum=0.1, affine=True, track_running_stats=True)
    )
    (output): Identity()
  )
)
propagate done
init label
Split: 01, Run: 01
None time:  1.3212111920583993
None Run 01:
Highest Train: 100.00
Highest Valid: 77.60
  Final Train: 100.00
   Final Test: 75.50
Split: 01, Run: 02
None time:  0.9077462458517402
None Run 02:
Highest Train: 100.00
Highest Valid: 78.80
  Final Train: 100.00
   Final Test: 77.20
Split: 01, Run: 03
None time:  1.0358303969260305
None Run 03:
Highest Train: 100.00
Highest Valid: 78.20
  Final Train: 100.00
   Final Test: 77.00
run time now: 3.308192729949951
total time:  3.3601678020786494
None All runs:
Highest Train: 100.00 ± 0.00
Highest Valid: 78.20 ± 0.60
  Final Train: 100.00 ± 0.00
   Final Test: 76.57 ± 0.93
[I 2023-06-12 00:14:21,602] Trial 23 finished with value: 78.19999694824219 and parameters: {'Fwd': 3.43353591380593e-05, 'K': 7, 'alpha': 0.5, 'dropout': 0.4, 'gnnepoch': 70, 'lambda1': 0.45, 'lambda2': 9.990880809131214, 'loop': 1, 'loss': 'MSE', 'lr': 0.002924868178545388, 'softmaxF': True, 'useGCN': False, 'weight_decay': 0.00022899430198304146, 'weightedloss': False}. Best is trial 20 with value: 81.0666732788086.
/home/wxy/miniconda3/lib/python3.10/site-packages/optuna/distributions.py:685: UserWarning: The distribution is specified by [0, 1.00001] and step=0.05, but the range is not divisible by `step`. It will be replaced by [0, 1.0].
  warnings.warn(
K:  6
alpha:  0.8
lr:  0.004714871505861856
weight_decay:  0.0003601740893561208
dropout:  0.30000000000000004
fix split and run 3 times
Data: Data(x=[19717, 500], y=[19717], train_mask=[19717], val_mask=[19717], test_mask=[19717], adj_t=[19717, 19717, nnz=88648])
num_train tensor(60)
num_noise 0
noise: tensor(0)
data feature 500
ALTOPT(
  (lins): Sequential(
    (0): Linear(in_features=500, out_features=64, bias=True)
    (1): BatchNorm1d(64, eps=1e-05, momentum=0.1, affine=True, track_running_stats=True)
    (2): Dropout(p=0.30000000000000004, inplace=True)
    (3): ReLU(inplace=True)
    (4): Linear(in_features=64, out_features=3, bias=True)
    (5): Identity()
  )
  (prop): Propagation(K=6, mode=None, lambda1=None, lambda2=None, L21=True, alpha=0.8)
  (gcn): GCN(
    (convs): ModuleList(
      (0): GCNConv(500, 64)
      (1): GCNConv(64, 3)
    )
    (bns): ModuleList(
      (0): BatchNorm1d(64, eps=1e-05, momentum=0.1, affine=True, track_running_stats=True)
    )
    (output): Identity()
  )
)
propagate done
init label
Split: 01, Run: 01
None time:  1.17881262418814
None Run 01:
Highest Train: 100.00
Highest Valid: 79.20
  Final Train: 100.00
   Final Test: 75.80
Split: 01, Run: 02
None time:  1.3269746589940041
None Run 02:
Highest Train: 100.00
Highest Valid: 82.20
  Final Train: 100.00
   Final Test: 78.70
Split: 01, Run: 03
None time:  1.362703647930175
None Run 03:
Highest Train: 100.00
Highest Valid: 80.60
  Final Train: 100.00
   Final Test: 77.10
run time now: 3.9126124382019043
total time:  3.963813694892451
None All runs:
Highest Train: 100.00 ± 0.00
Highest Valid: 80.67 ± 1.50
  Final Train: 100.00 ± 0.00
   Final Test: 77.20 ± 1.45
[I 2023-06-12 00:14:26,023] Trial 24 finished with value: 80.66666412353516 and parameters: {'Fwd': 0.00020230176662783755, 'K': 6, 'alpha': 0.8, 'dropout': 0.30000000000000004, 'gnnepoch': 90, 'lambda1': 0.6000000000000001, 'lambda2': 9.088827515897234, 'loop': 1, 'loss': 'MSE', 'lr': 0.004714871505861856, 'softmaxF': True, 'useGCN': False, 'weight_decay': 0.0003601740893561208, 'weightedloss': False}. Best is trial 20 with value: 81.0666732788086.
/home/wxy/miniconda3/lib/python3.10/site-packages/optuna/distributions.py:685: UserWarning: The distribution is specified by [0, 1.00001] and step=0.05, but the range is not divisible by `step`. It will be replaced by [0, 1.0].
  warnings.warn(
K:  6
alpha:  0.8
lr:  0.005086928453270978
weight_decay:  0.00045075417450995953
dropout:  0.30000000000000004
fix split and run 3 times
Data: Data(x=[19717, 500], y=[19717], train_mask=[19717], val_mask=[19717], test_mask=[19717], adj_t=[19717, 19717, nnz=88648])
num_train tensor(60)
num_noise 0
noise: tensor(0)
data feature 500
ALTOPT(
  (lins): Sequential(
    (0): Linear(in_features=500, out_features=64, bias=True)
    (1): BatchNorm1d(64, eps=1e-05, momentum=0.1, affine=True, track_running_stats=True)
    (2): Dropout(p=0.30000000000000004, inplace=True)
    (3): ReLU(inplace=True)
    (4): Linear(in_features=64, out_features=3, bias=True)
    (5): Identity()
  )
  (prop): Propagation(K=6, mode=None, lambda1=None, lambda2=None, L21=True, alpha=0.8)
  (gcn): GCN(
    (convs): ModuleList(
      (0): GCNConv(500, 64)
      (1): GCNConv(64, 3)
    )
    (bns): ModuleList(
      (0): BatchNorm1d(64, eps=1e-05, momentum=0.1, affine=True, track_running_stats=True)
    )
    (output): Identity()
  )
)
propagate done
init label
Split: 01, Run: 01, Epoch: 100, Loss: 0.0000, Train: 100.00%, Valid: 79.40% Test: 76.10%
Split: 01, Run: 01
None time:  1.8178971621673554
None Run 01:
Highest Train: 100.00
Highest Valid: 79.40
  Final Train: 100.00
   Final Test: 76.10
Split: 01, Run: 02, Epoch: 100, Loss: 0.0000, Train: 100.00%, Valid: 79.20% Test: 78.70%
Split: 01, Run: 02
None time:  2.4786435218993574
None Run 02:
Highest Train: 100.00
Highest Valid: 79.20
  Final Train: 100.00
   Final Test: 78.50
Split: 01, Run: 03, Epoch: 100, Loss: 0.0000, Train: 100.00%, Valid: 79.20% Test: 77.70%
Split: 01, Run: 03
None time:  2.5060436117928475
None Run 03:
Highest Train: 100.00
Highest Valid: 79.20
  Final Train: 100.00
   Final Test: 77.80
run time now: 6.844250440597534
total time:  6.89414427196607
None All runs:
Highest Train: 100.00 ± 0.00
Highest Valid: 79.27 ± 0.12
  Final Train: 100.00 ± 0.00
   Final Test: 77.47 ± 1.23
[I 2023-06-12 00:14:33,367] Trial 25 finished with value: 79.26667022705078 and parameters: {'Fwd': 0.00015966706327327264, 'K': 6, 'alpha': 0.8, 'dropout': 0.30000000000000004, 'gnnepoch': 110, 'lambda1': 0.6000000000000001, 'lambda2': 8.976573202866625, 'loop': 0, 'loss': 'MSE', 'lr': 0.005086928453270978, 'softmaxF': True, 'useGCN': False, 'weight_decay': 0.00045075417450995953, 'weightedloss': False}. Best is trial 20 with value: 81.0666732788086.
/home/wxy/miniconda3/lib/python3.10/site-packages/optuna/distributions.py:685: UserWarning: The distribution is specified by [0, 1.00001] and step=0.05, but the range is not divisible by `step`. It will be replaced by [0, 1.0].
  warnings.warn(
K:  9
alpha:  0.75
lr:  0.004973376886317986
weight_decay:  0.0020589315194632983
dropout:  0.6000000000000001
fix split and run 3 times
Data: Data(x=[19717, 500], y=[19717], train_mask=[19717], val_mask=[19717], test_mask=[19717], adj_t=[19717, 19717, nnz=88648])
num_train tensor(60)
num_noise 0
noise: tensor(0)
data feature 500
ALTOPT(
  (lins): Sequential(
    (0): Linear(in_features=500, out_features=64, bias=True)
    (1): BatchNorm1d(64, eps=1e-05, momentum=0.1, affine=True, track_running_stats=True)
    (2): Dropout(p=0.6000000000000001, inplace=True)
    (3): ReLU(inplace=True)
    (4): Linear(in_features=64, out_features=3, bias=True)
    (5): Identity()
  )
  (prop): Propagation(K=9, mode=None, lambda1=None, lambda2=None, L21=True, alpha=0.75)
  (gcn): GCN(
    (convs): ModuleList(
      (0): GCNConv(500, 64)
      (1): GCNConv(64, 3)
    )
    (bns): ModuleList(
      (0): BatchNorm1d(64, eps=1e-05, momentum=0.1, affine=True, track_running_stats=True)
    )
    (output): Identity()
  )
)
propagate done
init label
Split: 01, Run: 01
None time:  1.3590511470101774
None Run 01:
Highest Train: 100.00
Highest Valid: 78.20
  Final Train: 100.00
   Final Test: 74.80
Split: 01, Run: 02
None time:  1.2969915200956166
None Run 02:
Highest Train: 100.00
Highest Valid: 77.40
  Final Train: 100.00
   Final Test: 75.80
Split: 01, Run: 03
None time:  1.298641567118466
None Run 03:
Highest Train: 100.00
Highest Valid: 75.60
  Final Train: 100.00
   Final Test: 73.00
run time now: 3.9970858097076416
total time:  4.048849196173251
None All runs:
Highest Train: 100.00 ± 0.00
Highest Valid: 77.07 ± 1.33
  Final Train: 100.00 ± 0.00
   Final Test: 74.53 ± 1.42
