[I 2023-06-12 00:52:22,369] Trial 422 finished with value: 83.33333587646484 and parameters: {'Fwd': 6.246120134057227e-06, 'K': 10, 'alpha': 0.9500000000000001, 'dropout': 0.9, 'gnnepoch': 60, 'lambda1': 0.6000000000000001, 'lambda2': 3.6937569778563946, 'loop': 1, 'loss': 'MSE', 'lr': 0.002512814575782126, 'softmaxF': True, 'useGCN': False, 'weight_decay': 1.8101079329995513e-05, 'weightedloss': False}. Best is trial 364 with value: 83.66666412353516.
/home/wxy/miniconda3/lib/python3.10/site-packages/optuna/distributions.py:685: UserWarning: The distribution is specified by [0, 1.00001] and step=0.05, but the range is not divisible by `step`. It will be replaced by [0, 1.0].
  warnings.warn(
K:  10
alpha:  1.0
lr:  0.0020113326230658006
weight_decay:  0.017047927659722757
dropout:  0.9
fix split and run 3 times
Data: Data(x=[19717, 500], y=[19717], train_mask=[19717], val_mask=[19717], test_mask=[19717], adj_t=[19717, 19717, nnz=88648])
num_train tensor(60)
num_noise 0
noise: tensor(0)
data feature 500
ALTOPT(
  (lins): Sequential(
    (0): Linear(in_features=500, out_features=64, bias=True)
    (1): BatchNorm1d(64, eps=1e-05, momentum=0.1, affine=True, track_running_stats=True)
    (2): Dropout(p=0.9, inplace=True)
    (3): ReLU(inplace=True)
    (4): Linear(in_features=64, out_features=3, bias=True)
    (5): Identity()
  )
  (prop): Propagation(K=10, mode=None, lambda1=None, lambda2=None, L21=True, alpha=1.0)
  (gcn): GCN(
    (convs): ModuleList(
      (0): GCNConv(500, 64)
      (1): GCNConv(64, 3)
    )
    (bns): ModuleList(
      (0): BatchNorm1d(64, eps=1e-05, momentum=0.1, affine=True, track_running_stats=True)
    )
    (output): Identity()
  )
)
propagate done
init label
Split: 01, Run: 01
None time:  1.051412781002
None Run 01:
Highest Train: 100.00
Highest Valid: 81.80
  Final Train: 100.00
   Final Test: 76.80
Split: 01, Run: 02
None time:  1.589371426962316
None Run 02:
Highest Train: 100.00
Highest Valid: 84.20
  Final Train: 100.00
   Final Test: 79.60
Split: 01, Run: 03
None time:  1.1934283999726176
None Run 03:
Highest Train: 100.00
Highest Valid: 82.40
  Final Train: 100.00
   Final Test: 79.40
run time now: 3.8923463821411133
total time:  3.9409647108986974
None All runs:
Highest Train: 100.00 ± 0.00
Highest Valid: 82.80 ± 1.25
  Final Train: 100.00 ± 0.00
   Final Test: 78.60 ± 1.56
[I 2023-06-12 00:52:26,830] Trial 423 finished with value: 82.79999542236328 and parameters: {'Fwd': 6.094833679720725e-06, 'K': 10, 'alpha': 1.0, 'dropout': 0.9, 'gnnepoch': 80, 'lambda1': 0.6000000000000001, 'lambda2': 3.7505306404254117, 'loop': 1, 'loss': 'MSE', 'lr': 0.0020113326230658006, 'softmaxF': True, 'useGCN': False, 'weight_decay': 0.017047927659722757, 'weightedloss': False}. Best is trial 364 with value: 83.66666412353516.
/home/wxy/miniconda3/lib/python3.10/site-packages/optuna/distributions.py:685: UserWarning: The distribution is specified by [0, 1.00001] and step=0.05, but the range is not divisible by `step`. It will be replaced by [0, 1.0].
  warnings.warn(
K:  10
alpha:  0.9500000000000001
lr:  0.0015370841944201093
weight_decay:  2.7368966186729315e-06
dropout:  0.9
fix split and run 3 times
Data: Data(x=[19717, 500], y=[19717], train_mask=[19717], val_mask=[19717], test_mask=[19717], adj_t=[19717, 19717, nnz=88648])
num_train tensor(60)
num_noise 0
noise: tensor(0)
data feature 500
ALTOPT(
  (lins): Sequential(
    (0): Linear(in_features=500, out_features=64, bias=True)
    (1): BatchNorm1d(64, eps=1e-05, momentum=0.1, affine=True, track_running_stats=True)
    (2): Dropout(p=0.9, inplace=True)
    (3): ReLU(inplace=True)
    (4): Linear(in_features=64, out_features=3, bias=True)
    (5): Identity()
  )
  (prop): Propagation(K=10, mode=None, lambda1=None, lambda2=None, L21=True, alpha=0.9500000000000001)
  (gcn): GCN(
    (convs): ModuleList(
      (0): GCNConv(500, 64)
      (1): GCNConv(64, 3)
    )
    (bns): ModuleList(
      (0): BatchNorm1d(64, eps=1e-05, momentum=0.1, affine=True, track_running_stats=True)
    )
    (output): Identity()
  )
)
propagate done
init label
Split: 01, Run: 01
None time:  2.765791092067957
None Run 01:
Highest Train: 100.00
Highest Valid: 81.80
  Final Train: 100.00
   Final Test: 78.10
Split: 01, Run: 02
None time:  2.023981997044757
None Run 02:
Highest Train: 100.00
Highest Valid: 81.40
  Final Train: 100.00
   Final Test: 78.50
Split: 01, Run: 03
None time:  1.1059099838603288
None Run 03:
Highest Train: 100.00
Highest Valid: 84.40
  Final Train: 100.00
   Final Test: 78.90
run time now: 5.94908595085144
total time:  5.997117317048833
None All runs:
Highest Train: 100.00 ± 0.00
Highest Valid: 82.53 ± 1.63
  Final Train: 100.00 ± 0.00
   Final Test: 78.50 ± 0.40
[I 2023-06-12 00:52:33,354] Trial 424 finished with value: 82.53333282470703 and parameters: {'Fwd': 9.367958286534242e-06, 'K': 10, 'alpha': 0.9500000000000001, 'dropout': 0.9, 'gnnepoch': 60, 'lambda1': 0.6000000000000001, 'lambda2': 8.636204968657102, 'loop': 1, 'loss': 'MSE', 'lr': 0.0015370841944201093, 'softmaxF': True, 'useGCN': False, 'weight_decay': 2.7368966186729315e-06, 'weightedloss': False}. Best is trial 364 with value: 83.66666412353516.
/home/wxy/miniconda3/lib/python3.10/site-packages/optuna/distributions.py:685: UserWarning: The distribution is specified by [0, 1.00001] and step=0.05, but the range is not divisible by `step`. It will be replaced by [0, 1.0].
  warnings.warn(
K:  10
alpha:  0.9
lr:  0.00589960140133953
weight_decay:  9.056002447829617e-05
dropout:  0.9
fix split and run 3 times
Data: Data(x=[19717, 500], y=[19717], train_mask=[19717], val_mask=[19717], test_mask=[19717], adj_t=[19717, 19717, nnz=88648])
num_train tensor(60)
num_noise 0
noise: tensor(0)
data feature 500
ALTOPT(
  (lins): Sequential(
    (0): Linear(in_features=500, out_features=64, bias=True)
    (1): BatchNorm1d(64, eps=1e-05, momentum=0.1, affine=True, track_running_stats=True)
    (2): Dropout(p=0.9, inplace=True)
    (3): ReLU(inplace=True)
    (4): Linear(in_features=64, out_features=3, bias=True)
    (5): Identity()
  )
  (prop): Propagation(K=10, mode=None, lambda1=None, lambda2=None, L21=True, alpha=0.9)
  (gcn): GCN(
    (convs): ModuleList(
      (0): GCNConv(500, 64)
      (1): GCNConv(64, 3)
    )
    (bns): ModuleList(
      (0): BatchNorm1d(64, eps=1e-05, momentum=0.1, affine=True, track_running_stats=True)
    )
    (output): Identity()
  )
)
propagate done
init label
Split: 01, Run: 01
None time:  3.5836205289233476
None Run 01:
Highest Train: 100.00
Highest Valid: 83.20
  Final Train: 100.00
   Final Test: 79.00
Split: 01, Run: 02
None time:  0.994735507061705
None Run 02:
Highest Train: 100.00
Highest Valid: 83.60
  Final Train: 100.00
   Final Test: 78.80
Split: 01, Run: 03
None time:  1.1499389170203358
None Run 03:
Highest Train: 100.00
Highest Valid: 80.80
  Final Train: 100.00
   Final Test: 77.20
run time now: 5.782174110412598
total time:  5.825518923113123
None All runs:
Highest Train: 100.00 ± 0.00
Highest Valid: 82.53 ± 1.51
  Final Train: 100.00 ± 0.00
   Final Test: 78.33 ± 0.99
[I 2023-06-12 00:52:39,746] Trial 425 finished with value: 82.53334045410156 and parameters: {'Fwd': 6.7870431137711265e-06, 'K': 10, 'alpha': 0.9, 'dropout': 0.9, 'gnnepoch': 70, 'lambda1': 0.65, 'lambda2': 4.5132963119980944, 'loop': 1, 'loss': 'MSE', 'lr': 0.00589960140133953, 'softmaxF': True, 'useGCN': False, 'weight_decay': 9.056002447829617e-05, 'weightedloss': False}. Best is trial 364 with value: 83.66666412353516.
/home/wxy/miniconda3/lib/python3.10/site-packages/optuna/distributions.py:685: UserWarning: The distribution is specified by [0, 1.00001] and step=0.05, but the range is not divisible by `step`. It will be replaced by [0, 1.0].
  warnings.warn(
K:  9
alpha:  1.0
lr:  0.002370150758682381
weight_decay:  0.00011278168094237912
dropout:  0.9
fix split and run 3 times
Data: Data(x=[19717, 500], y=[19717], train_mask=[19717], val_mask=[19717], test_mask=[19717], adj_t=[19717, 19717, nnz=88648])
num_train tensor(60)
num_noise 0
noise: tensor(0)
data feature 500
ALTOPT(
  (lins): Sequential(
    (0): Linear(in_features=500, out_features=64, bias=True)
    (1): BatchNorm1d(64, eps=1e-05, momentum=0.1, affine=True, track_running_stats=True)
    (2): Dropout(p=0.9, inplace=True)
    (3): ReLU(inplace=True)
    (4): Linear(in_features=64, out_features=3, bias=True)
    (5): Identity()
  )
  (prop): Propagation(K=9, mode=None, lambda1=None, lambda2=None, L21=True, alpha=1.0)
  (gcn): GCN(
    (convs): ModuleList(
      (0): GCNConv(500, 64)
      (1): GCNConv(64, 3)
    )
    (bns): ModuleList(
      (0): BatchNorm1d(64, eps=1e-05, momentum=0.1, affine=True, track_running_stats=True)
    )
    (output): Identity()
  )
)
propagate done
init label
Split: 01, Run: 01
None time:  2.381895411061123
None Run 01:
Highest Train: 100.00
Highest Valid: 81.60
  Final Train: 100.00
   Final Test: 77.10
Split: 01, Run: 02
None time:  1.1423811260610819
None Run 02:
Highest Train: 100.00
Highest Valid: 83.00
  Final Train: 100.00
   Final Test: 80.20
Split: 01, Run: 03
None time:  1.0618603411130607
None Run 03:
Highest Train: 100.00
Highest Valid: 80.80
  Final Train: 100.00
   Final Test: 79.70
run time now: 4.635575532913208
total time:  4.684185256017372
None All runs:
Highest Train: 100.00 ± 0.00
Highest Valid: 81.80 ± 1.11
  Final Train: 100.00 ± 0.00
   Final Test: 79.00 ± 1.66
[I 2023-06-12 00:52:44,919] Trial 426 finished with value: 81.80000305175781 and parameters: {'Fwd': 4.603667188145789e-06, 'K': 9, 'alpha': 1.0, 'dropout': 0.9, 'gnnepoch': 60, 'lambda1': 0.7000000000000001, 'lambda2': 2.241663550549703, 'loop': 1, 'loss': 'MSE', 'lr': 0.002370150758682381, 'softmaxF': True, 'useGCN': False, 'weight_decay': 0.00011278168094237912, 'weightedloss': False}. Best is trial 364 with value: 83.66666412353516.
/home/wxy/miniconda3/lib/python3.10/site-packages/optuna/distributions.py:685: UserWarning: The distribution is specified by [0, 1.00001] and step=0.05, but the range is not divisible by `step`. It will be replaced by [0, 1.0].
  warnings.warn(
K:  10
alpha:  0.9500000000000001
lr:  0.0025093544194213194
weight_decay:  2.550515145283895e-05
dropout:  0.9
fix split and run 3 times
Data: Data(x=[19717, 500], y=[19717], train_mask=[19717], val_mask=[19717], test_mask=[19717], adj_t=[19717, 19717, nnz=88648])
num_train tensor(60)
num_noise 0
noise: tensor(0)
data feature 500
ALTOPT(
  (lins): Sequential(
    (0): Linear(in_features=500, out_features=64, bias=True)
    (1): BatchNorm1d(64, eps=1e-05, momentum=0.1, affine=True, track_running_stats=True)
    (2): Dropout(p=0.9, inplace=True)
    (3): ReLU(inplace=True)
    (4): Linear(in_features=64, out_features=3, bias=True)
    (5): Identity()
  )
  (prop): Propagation(K=10, mode=None, lambda1=None, lambda2=None, L21=True, alpha=0.9500000000000001)
  (gcn): GCN(
    (convs): ModuleList(
      (0): GCNConv(500, 64)
      (1): GCNConv(64, 3)
    )
    (bns): ModuleList(
      (0): BatchNorm1d(64, eps=1e-05, momentum=0.1, affine=True, track_running_stats=True)
    )
    (output): Identity()
  )
)
propagate done
init label
Split: 01, Run: 01
None time:  2.4149133360479027
None Run 01:
Highest Train: 100.00
Highest Valid: 76.80
  Final Train: 100.00
   Final Test: 75.80
Split: 01, Run: 02
None time:  2.1119376779533923
None Run 02:
Highest Train: 100.00
Highest Valid: 76.00
  Final Train: 100.00
   Final Test: 74.00
Split: 01, Run: 03
None time:  3.501270119100809
None Run 03:
Highest Train: 100.00
Highest Valid: 75.80
  Final Train: 100.00
   Final Test: 73.20
run time now: 8.072118282318115
total time:  8.113810687093064
None All runs:
Highest Train: 100.00 ± 0.00
Highest Valid: 76.20 ± 0.53
  Final Train: 100.00 ± 0.00
   Final Test: 74.33 ± 1.33
[I 2023-06-12 00:52:53,676] Trial 427 finished with value: 76.20000457763672 and parameters: {'Fwd': 5.203845331727829e-06, 'K': 10, 'alpha': 0.9500000000000001, 'dropout': 0.9, 'gnnepoch': 60, 'lambda1': 0.65, 'lambda2': 4.026027565896529, 'loop': 1, 'loss': 'MSE', 'lr': 0.0025093544194213194, 'softmaxF': True, 'useGCN': True, 'weight_decay': 2.550515145283895e-05, 'weightedloss': False}. Best is trial 364 with value: 83.66666412353516.
/home/wxy/miniconda3/lib/python3.10/site-packages/optuna/distributions.py:685: UserWarning: The distribution is specified by [0, 1.00001] and step=0.05, but the range is not divisible by `step`. It will be replaced by [0, 1.0].
  warnings.warn(
K:  10
alpha:  0.25
lr:  0.0021109140157840743
weight_decay:  5.0541029283247494e-05
dropout:  0.9
fix split and run 3 times
Data: Data(x=[19717, 500], y=[19717], train_mask=[19717], val_mask=[19717], test_mask=[19717], adj_t=[19717, 19717, nnz=88648])
num_train tensor(60)
num_noise 0
noise: tensor(0)
data feature 500
ALTOPT(
  (lins): Sequential(
    (0): Linear(in_features=500, out_features=64, bias=True)
    (1): BatchNorm1d(64, eps=1e-05, momentum=0.1, affine=True, track_running_stats=True)
    (2): Dropout(p=0.9, inplace=True)
    (3): ReLU(inplace=True)
    (4): Linear(in_features=64, out_features=3, bias=True)
    (5): Identity()
  )
  (prop): Propagation(K=10, mode=None, lambda1=None, lambda2=None, L21=True, alpha=0.25)
  (gcn): GCN(
    (convs): ModuleList(
      (0): GCNConv(500, 64)
      (1): GCNConv(64, 3)
    )
    (bns): ModuleList(
      (0): BatchNorm1d(64, eps=1e-05, momentum=0.1, affine=True, track_running_stats=True)
    )
    (output): Identity()
  )
)
propagate done
init label
Split: 01, Run: 01
None time:  0.7796649499796331
None Run 01:
Highest Train: 100.00
Highest Valid: 69.80
  Final Train: 100.00
   Final Test: 69.60
Split: 01, Run: 02
None time:  1.2627985370345414
None Run 02:
Highest Train: 100.00
Highest Valid: 73.80
  Final Train: 100.00
   Final Test: 73.90
Split: 01, Run: 03
None time:  1.5297722718678415
None Run 03:
Highest Train: 100.00
Highest Valid: 72.60
  Final Train: 100.00
   Final Test: 71.90
run time now: 3.620262384414673
total time:  3.671139070065692
None All runs:
Highest Train: 100.00 ± 0.00
Highest Valid: 72.07 ± 2.05
  Final Train: 100.00 ± 0.00
   Final Test: 71.80 ± 2.15
[I 2023-06-12 00:52:57,873] Trial 428 finished with value: 72.0666732788086 and parameters: {'Fwd': 8.071258123735393e-06, 'K': 10, 'alpha': 0.25, 'dropout': 0.9, 'gnnepoch': 40, 'lambda1': 0.65, 'lambda2': 3.509515725023924, 'loop': 1, 'loss': 'MSE', 'lr': 0.0021109140157840743, 'softmaxF': True, 'useGCN': False, 'weight_decay': 5.0541029283247494e-05, 'weightedloss': False}. Best is trial 364 with value: 83.66666412353516.
/home/wxy/miniconda3/lib/python3.10/site-packages/optuna/distributions.py:685: UserWarning: The distribution is specified by [0, 1.00001] and step=0.05, but the range is not divisible by `step`. It will be replaced by [0, 1.0].
  warnings.warn(
K:  10
alpha:  0.9500000000000001
lr:  0.0017395937987489225
weight_decay:  2.4813859240713358e-05
dropout:  0.8
fix split and run 3 times
Data: Data(x=[19717, 500], y=[19717], train_mask=[19717], val_mask=[19717], test_mask=[19717], adj_t=[19717, 19717, nnz=88648])
num_train tensor(60)
num_noise 0
noise: tensor(0)
data feature 500
ALTOPT(
  (lins): Sequential(
    (0): Linear(in_features=500, out_features=64, bias=True)
    (1): BatchNorm1d(64, eps=1e-05, momentum=0.1, affine=True, track_running_stats=True)
    (2): Dropout(p=0.8, inplace=True)
    (3): ReLU(inplace=True)
    (4): Linear(in_features=64, out_features=3, bias=True)
    (5): Identity()
  )
  (prop): Propagation(K=10, mode=None, lambda1=None, lambda2=None, L21=True, alpha=0.9500000000000001)
  (gcn): GCN(
    (convs): ModuleList(
      (0): GCNConv(500, 64)
      (1): GCNConv(64, 3)
    )
    (bns): ModuleList(
      (0): BatchNorm1d(64, eps=1e-05, momentum=0.1, affine=True, track_running_stats=True)
    )
    (output): Identity()
  )
)
propagate done
init label
Split: 01, Run: 01
None time:  1.83375089103356
None Run 01:
Highest Train: 100.00
Highest Valid: 81.00
  Final Train: 100.00
   Final Test: 79.10
Split: 01, Run: 02
None time:  1.7590671931393445
None Run 02:
Highest Train: 100.00
Highest Valid: 82.80
  Final Train: 100.00
   Final Test: 78.70
Split: 01, Run: 03
None time:  1.8982928860932589
None Run 03:
Highest Train: 100.00
Highest Valid: 81.00
  Final Train: 100.00
   Final Test: 78.30
run time now: 5.592524528503418
total time:  5.641980574000627
None All runs:
Highest Train: 100.00 ± 0.00
Highest Valid: 81.60 ± 1.04
  Final Train: 100.00 ± 0.00
   Final Test: 78.70 ± 0.40
[I 2023-06-12 00:53:04,152] Trial 429 finished with value: 81.5999984741211 and parameters: {'Fwd': 3.8507949637792255e-06, 'K': 10, 'alpha': 0.9500000000000001, 'dropout': 0.8, 'gnnepoch': 50, 'lambda1': 0.75, 'lambda2': 3.4117681468372543, 'loop': 1, 'loss': 'MSE', 'lr': 0.0017395937987489225, 'softmaxF': True, 'useGCN': False, 'weight_decay': 2.4813859240713358e-05, 'weightedloss': False}. Best is trial 364 with value: 83.66666412353516.
/home/wxy/miniconda3/lib/python3.10/site-packages/optuna/distributions.py:685: UserWarning: The distribution is specified by [0, 1.00001] and step=0.05, but the range is not divisible by `step`. It will be replaced by [0, 1.0].
  warnings.warn(
K:  10
alpha:  0.9
lr:  0.002939668417353781
weight_decay:  0.04612581629110408
dropout:  0.9
fix split and run 3 times
Data: Data(x=[19717, 500], y=[19717], train_mask=[19717], val_mask=[19717], test_mask=[19717], adj_t=[19717, 19717, nnz=88648])
num_train tensor(60)
num_noise 0
noise: tensor(0)
data feature 500
ALTOPT(
  (lins): Sequential(
    (0): Linear(in_features=500, out_features=64, bias=True)
    (1): BatchNorm1d(64, eps=1e-05, momentum=0.1, affine=True, track_running_stats=True)
    (2): Dropout(p=0.9, inplace=True)
    (3): ReLU(inplace=True)
    (4): Linear(in_features=64, out_features=3, bias=True)
    (5): Identity()
  )
  (prop): Propagation(K=10, mode=None, lambda1=None, lambda2=None, L21=True, alpha=0.9)
  (gcn): GCN(
    (convs): ModuleList(
      (0): GCNConv(500, 64)
      (1): GCNConv(64, 3)
    )
    (bns): ModuleList(
      (0): BatchNorm1d(64, eps=1e-05, momentum=0.1, affine=True, track_running_stats=True)
    )
    (output): Identity()
  )
)
propagate done
init label
Split: 01, Run: 01
None time:  2.7909287640359253
None Run 01:
Highest Train: 100.00
Highest Valid: 81.20
  Final Train: 100.00
   Final Test: 76.40
Split: 01, Run: 02
None time:  1.1572394710965455
None Run 02:
Highest Train: 100.00
Highest Valid: 81.80
  Final Train: 100.00
   Final Test: 79.20
Split: 01, Run: 03
None time:  1.1220993108581752
None Run 03:
Highest Train: 100.00
Highest Valid: 83.00
  Final Train: 100.00
   Final Test: 79.10
run time now: 5.122758150100708
total time:  5.165891516022384
None All runs:
Highest Train: 100.00 ± 0.00
Highest Valid: 82.00 ± 0.92
  Final Train: 100.00 ± 0.00
   Final Test: 78.23 ± 1.59
[I 2023-06-12 00:53:09,966] Trial 430 finished with value: 82.0 and parameters: {'Fwd': 5.931662109067018e-06, 'K': 10, 'alpha': 0.9, 'dropout': 0.9, 'gnnepoch': 60, 'lambda1': 0.8, 'lambda2': 3.6818826051470186, 'loop': 1, 'loss': 'MSE', 'lr': 0.002939668417353781, 'softmaxF': True, 'useGCN': False, 'weight_decay': 0.04612581629110408, 'weightedloss': False}. Best is trial 364 with value: 83.66666412353516.
/home/wxy/miniconda3/lib/python3.10/site-packages/optuna/distributions.py:685: UserWarning: The distribution is specified by [0, 1.00001] and step=0.05, but the range is not divisible by `step`. It will be replaced by [0, 1.0].
  warnings.warn(
K:  10
alpha:  0.8500000000000001
lr:  0.0025574086037183654
weight_decay:  5.2617595880696024e-05
dropout:  0.9
fix split and run 3 times
Data: Data(x=[19717, 500], y=[19717], train_mask=[19717], val_mask=[19717], test_mask=[19717], adj_t=[19717, 19717, nnz=88648])
num_train tensor(60)
num_noise 0
noise: tensor(0)
data feature 500
ALTOPT(
  (lins): Sequential(
    (0): Linear(in_features=500, out_features=64, bias=True)
    (1): BatchNorm1d(64, eps=1e-05, momentum=0.1, affine=True, track_running_stats=True)
    (2): Dropout(p=0.9, inplace=True)
    (3): ReLU(inplace=True)
    (4): Linear(in_features=64, out_features=3, bias=True)
    (5): Identity()
  )
  (prop): Propagation(K=10, mode=None, lambda1=None, lambda2=None, L21=True, alpha=0.8500000000000001)
  (gcn): GCN(
    (convs): ModuleList(
      (0): GCNConv(500, 64)
      (1): GCNConv(64, 3)
    )
    (bns): ModuleList(
      (0): BatchNorm1d(64, eps=1e-05, momentum=0.1, affine=True, track_running_stats=True)
    )
    (output): Identity()
  )
)
propagate done
init label
Split: 01, Run: 01
None time:  1.9355902208480984
None Run 01:
Highest Train: 100.00
Highest Valid: 79.80
  Final Train: 100.00
   Final Test: 74.40
Split: 01, Run: 02
None time:  1.1041127780918032
None Run 02:
Highest Train: 100.00
Highest Valid: 82.40
  Final Train: 100.00
   Final Test: 79.10
Split: 01, Run: 03
None time:  1.2108980938792229
None Run 03:
Highest Train: 100.00
Highest Valid: 81.00
  Final Train: 100.00
   Final Test: 77.50
run time now: 4.297714710235596
total time:  4.335576407145709
None All runs:
Highest Train: 100.00 ± 0.00
Highest Valid: 81.07 ± 1.30
  Final Train: 100.00 ± 0.00
   Final Test: 77.00 ± 2.39
