[I 2023-06-12 00:38:33,576] Trial 278 finished with value: 78.46666717529297 and parameters: {'Fwd': 5.814793702086379e-06, 'K': 10, 'alpha': 0.9500000000000001, 'dropout': 0.9, 'gnnepoch': 50, 'lambda1': 0.9, 'lambda2': 6.041714459910383, 'loop': 1, 'loss': 'MSE', 'lr': 0.002608727211398458, 'softmaxF': False, 'useGCN': False, 'weight_decay': 0.010383858899503402, 'weightedloss': False}. Best is trial 205 with value: 83.53333282470703.
/home/wxy/miniconda3/lib/python3.10/site-packages/optuna/distributions.py:685: UserWarning: The distribution is specified by [0, 1.00001] and step=0.05, but the range is not divisible by `step`. It will be replaced by [0, 1.0].
  warnings.warn(
K:  10
alpha:  0.6000000000000001
lr:  0.007672072594877333
weight_decay:  0.005811355553367978
dropout:  0.9
fix split and run 3 times
Data: Data(x=[19717, 500], y=[19717], train_mask=[19717], val_mask=[19717], test_mask=[19717], adj_t=[19717, 19717, nnz=88648])
num_train tensor(60)
num_noise 0
noise: tensor(0)
data feature 500
ALTOPT(
  (lins): Sequential(
    (0): Linear(in_features=500, out_features=64, bias=True)
    (1): BatchNorm1d(64, eps=1e-05, momentum=0.1, affine=True, track_running_stats=True)
    (2): Dropout(p=0.9, inplace=True)
    (3): ReLU(inplace=True)
    (4): Linear(in_features=64, out_features=3, bias=True)
    (5): Identity()
  )
  (prop): Propagation(K=10, mode=None, lambda1=None, lambda2=None, L21=True, alpha=0.6000000000000001)
  (gcn): GCN(
    (convs): ModuleList(
      (0): GCNConv(500, 64)
      (1): GCNConv(64, 3)
    )
    (bns): ModuleList(
      (0): BatchNorm1d(64, eps=1e-05, momentum=0.1, affine=True, track_running_stats=True)
    )
    (output): Identity()
  )
)
propagate done
init label
Split: 01, Run: 01
None time:  2.7885938540566713
None Run 01:
Highest Train: 100.00
Highest Valid: 75.40
  Final Train: 100.00
   Final Test: 75.10
Split: 01, Run: 02
None time:  0.9744260378647596
None Run 02:
Highest Train: 100.00
Highest Valid: 74.20
  Final Train: 100.00
   Final Test: 72.10
Split: 01, Run: 03
None time:  2.9532062869984657
None Run 03:
Highest Train: 100.00
Highest Valid: 77.60
  Final Train: 100.00
   Final Test: 75.90
run time now: 6.76606297492981
total time:  6.8156791378278285
None All runs:
Highest Train: 100.00 ± 0.00
Highest Valid: 75.73 ± 1.72
  Final Train: 100.00 ± 0.00
   Final Test: 74.37 ± 2.00
[I 2023-06-12 00:38:40,946] Trial 279 finished with value: 75.73333740234375 and parameters: {'Fwd': 8.747667115868423e-06, 'K': 10, 'alpha': 0.6000000000000001, 'dropout': 0.9, 'gnnepoch': 60, 'lambda1': 0.8500000000000001, 'lambda2': 5.822962316918047, 'loop': 1, 'loss': 'MSE', 'lr': 0.007672072594877333, 'softmaxF': False, 'useGCN': False, 'weight_decay': 0.005811355553367978, 'weightedloss': False}. Best is trial 205 with value: 83.53333282470703.
/home/wxy/miniconda3/lib/python3.10/site-packages/optuna/distributions.py:685: UserWarning: The distribution is specified by [0, 1.00001] and step=0.05, but the range is not divisible by `step`. It will be replaced by [0, 1.0].
  warnings.warn(
K:  2
alpha:  0.9
lr:  0.002995719961262022
weight_decay:  0.01405005551389494
dropout:  0.9
fix split and run 3 times
Data: Data(x=[19717, 500], y=[19717], train_mask=[19717], val_mask=[19717], test_mask=[19717], adj_t=[19717, 19717, nnz=88648])
num_train tensor(60)
num_noise 0
noise: tensor(0)
data feature 500
ALTOPT(
  (lins): Sequential(
    (0): Linear(in_features=500, out_features=64, bias=True)
    (1): BatchNorm1d(64, eps=1e-05, momentum=0.1, affine=True, track_running_stats=True)
    (2): Dropout(p=0.9, inplace=True)
    (3): ReLU(inplace=True)
    (4): Linear(in_features=64, out_features=3, bias=True)
    (5): Identity()
  )
  (prop): Propagation(K=2, mode=None, lambda1=None, lambda2=None, L21=True, alpha=0.9)
  (gcn): GCN(
    (convs): ModuleList(
      (0): GCNConv(500, 64)
      (1): GCNConv(64, 3)
    )
    (bns): ModuleList(
      (0): BatchNorm1d(64, eps=1e-05, momentum=0.1, affine=True, track_running_stats=True)
    )
    (output): Identity()
  )
)
propagate done
init label
Split: 01, Run: 01
None time:  1.7272487410809845
None Run 01:
Highest Train: 100.00
Highest Valid: 77.20
  Final Train: 100.00
   Final Test: 73.90
Split: 01, Run: 02
None time:  0.9989560758695006
None Run 02:
Highest Train: 100.00
Highest Valid: 81.00
  Final Train: 100.00
   Final Test: 77.20
Split: 01, Run: 03
None time:  0.9065393118653446
None Run 03:
Highest Train: 100.00
Highest Valid: 81.60
  Final Train: 100.00
   Final Test: 77.50
run time now: 3.672111749649048
total time:  3.7256157600786537
None All runs:
Highest Train: 100.00 ± 0.00
Highest Valid: 79.93 ± 2.39
  Final Train: 100.00 ± 0.00
   Final Test: 76.20 ± 2.00
[I 2023-06-12 00:38:45,237] Trial 280 finished with value: 79.93334197998047 and parameters: {'Fwd': 3.103605384420114e-05, 'K': 2, 'alpha': 0.9, 'dropout': 0.9, 'gnnepoch': 60, 'lambda1': 0.8, 'lambda2': 3.870628159555735, 'loop': 1, 'loss': 'MSE', 'lr': 0.002995719961262022, 'softmaxF': False, 'useGCN': False, 'weight_decay': 0.01405005551389494, 'weightedloss': False}. Best is trial 205 with value: 83.53333282470703.
/home/wxy/miniconda3/lib/python3.10/site-packages/optuna/distributions.py:685: UserWarning: The distribution is specified by [0, 1.00001] and step=0.05, but the range is not divisible by `step`. It will be replaced by [0, 1.0].
  warnings.warn(
K:  10
alpha:  0.9500000000000001
lr:  0.0006749321983111004
weight_decay:  0.007535019920744356
dropout:  0.9
fix split and run 3 times
Data: Data(x=[19717, 500], y=[19717], train_mask=[19717], val_mask=[19717], test_mask=[19717], adj_t=[19717, 19717, nnz=88648])
num_train tensor(60)
num_noise 0
noise: tensor(0)
data feature 500
ALTOPT(
  (lins): Sequential(
    (0): Linear(in_features=500, out_features=64, bias=True)
    (1): BatchNorm1d(64, eps=1e-05, momentum=0.1, affine=True, track_running_stats=True)
    (2): Dropout(p=0.9, inplace=True)
    (3): ReLU(inplace=True)
    (4): Linear(in_features=64, out_features=3, bias=True)
    (5): Identity()
  )
  (prop): Propagation(K=10, mode=None, lambda1=None, lambda2=None, L21=True, alpha=0.9500000000000001)
  (gcn): GCN(
    (convs): ModuleList(
      (0): GCNConv(500, 64)
      (1): GCNConv(64, 3)
    )
    (bns): ModuleList(
      (0): BatchNorm1d(64, eps=1e-05, momentum=0.1, affine=True, track_running_stats=True)
    )
    (output): Identity()
  )
)
propagate done
init label
Split: 01, Run: 01
None time:  0.8998204180970788
None Run 01:
Highest Train: 100.00
Highest Valid: 69.00
  Final Train: 100.00
   Final Test: 69.30
Split: 01, Run: 02
None time:  1.6371176259126514
None Run 02:
Highest Train: 100.00
Highest Valid: 81.20
  Final Train: 100.00
   Final Test: 76.50
Split: 01, Run: 03
None time:  1.7638986308593303
None Run 03:
Highest Train: 100.00
Highest Valid: 81.80
  Final Train: 100.00
   Final Test: 77.40
run time now: 4.349450349807739
total time:  4.414103192975745
None All runs:
Highest Train: 100.00 ± 0.00
Highest Valid: 77.33 ± 7.22
  Final Train: 100.00 ± 0.00
   Final Test: 74.40 ± 4.44
[I 2023-06-12 00:38:50,193] Trial 281 finished with value: 77.33333587646484 and parameters: {'Fwd': 7.102120858208606e-06, 'K': 10, 'alpha': 0.9500000000000001, 'dropout': 0.9, 'gnnepoch': 50, 'lambda1': 0.8500000000000001, 'lambda2': 5.3129808933340055, 'loop': 1, 'loss': 'MSE', 'lr': 0.0006749321983111004, 'softmaxF': False, 'useGCN': False, 'weight_decay': 0.007535019920744356, 'weightedloss': False}. Best is trial 205 with value: 83.53333282470703.
/home/wxy/miniconda3/lib/python3.10/site-packages/optuna/distributions.py:685: UserWarning: The distribution is specified by [0, 1.00001] and step=0.05, but the range is not divisible by `step`. It will be replaced by [0, 1.0].
  warnings.warn(
K:  10
alpha:  0.30000000000000004
lr:  0.0035665763684768277
weight_decay:  0.016764751590186807
dropout:  0.9
fix split and run 3 times
Data: Data(x=[19717, 500], y=[19717], train_mask=[19717], val_mask=[19717], test_mask=[19717], adj_t=[19717, 19717, nnz=88648])
num_train tensor(60)
num_noise 0
noise: tensor(0)
data feature 500
ALTOPT(
  (lins): Sequential(
    (0): Linear(in_features=500, out_features=64, bias=True)
    (1): BatchNorm1d(64, eps=1e-05, momentum=0.1, affine=True, track_running_stats=True)
    (2): Dropout(p=0.9, inplace=True)
    (3): ReLU(inplace=True)
    (4): Linear(in_features=64, out_features=3, bias=True)
    (5): Identity()
  )
  (prop): Propagation(K=10, mode=None, lambda1=None, lambda2=None, L21=True, alpha=0.30000000000000004)
  (gcn): GCN(
    (convs): ModuleList(
      (0): GCNConv(500, 64)
      (1): GCNConv(64, 3)
    )
    (bns): ModuleList(
      (0): BatchNorm1d(64, eps=1e-05, momentum=0.1, affine=True, track_running_stats=True)
    )
    (output): Identity()
  )
)
propagate done
init label
Split: 01, Run: 01
None time:  1.0033619229216129
None Run 01:
Highest Train: 100.00
Highest Valid: 69.40
  Final Train: 100.00
   Final Test: 69.30
Split: 01, Run: 02
None time:  2.269694770919159
None Run 02:
Highest Train: 100.00
Highest Valid: 75.00
  Final Train: 100.00
   Final Test: 74.20
Split: 01, Run: 03
None time:  0.9502890368457884
None Run 03:
Highest Train: 100.00
Highest Valid: 75.20
  Final Train: 100.00
   Final Test: 73.40
run time now: 4.275182247161865
total time:  4.3220771020278335
None All runs:
Highest Train: 100.00 ± 0.00
Highest Valid: 73.20 ± 3.29
  Final Train: 100.00 ± 0.00
   Final Test: 72.30 ± 2.63
[I 2023-06-12 00:38:55,089] Trial 282 finished with value: 73.19999694824219 and parameters: {'Fwd': 4.183064636228407e-06, 'K': 10, 'alpha': 0.30000000000000004, 'dropout': 0.9, 'gnnepoch': 60, 'lambda1': 0.75, 'lambda2': 5.598140199951354, 'loop': 1, 'loss': 'MSE', 'lr': 0.0035665763684768277, 'softmaxF': False, 'useGCN': False, 'weight_decay': 0.016764751590186807, 'weightedloss': False}. Best is trial 205 with value: 83.53333282470703.
/home/wxy/miniconda3/lib/python3.10/site-packages/optuna/distributions.py:685: UserWarning: The distribution is specified by [0, 1.00001] and step=0.05, but the range is not divisible by `step`. It will be replaced by [0, 1.0].
  warnings.warn(
K:  10
alpha:  0.9500000000000001
lr:  0.002562215555027208
weight_decay:  0.02472057935599452
dropout:  0.9
fix split and run 3 times
Data: Data(x=[19717, 500], y=[19717], train_mask=[19717], val_mask=[19717], test_mask=[19717], adj_t=[19717, 19717, nnz=88648])
num_train tensor(60)
num_noise 0
noise: tensor(0)
data feature 500
ALTOPT(
  (lins): Sequential(
    (0): Linear(in_features=500, out_features=64, bias=True)
    (1): BatchNorm1d(64, eps=1e-05, momentum=0.1, affine=True, track_running_stats=True)
    (2): Dropout(p=0.9, inplace=True)
    (3): ReLU(inplace=True)
    (4): Linear(in_features=64, out_features=3, bias=True)
    (5): Identity()
  )
  (prop): Propagation(K=10, mode=None, lambda1=None, lambda2=None, L21=True, alpha=0.9500000000000001)
  (gcn): GCN(
    (convs): ModuleList(
      (0): GCNConv(500, 64)
      (1): GCNConv(64, 3)
    )
    (bns): ModuleList(
      (0): BatchNorm1d(64, eps=1e-05, momentum=0.1, affine=True, track_running_stats=True)
    )
    (output): Identity()
  )
)
propagate done
init label
Split: 01, Run: 01
None time:  2.5008202460594475
None Run 01:
Highest Train: 100.00
Highest Valid: 81.60
  Final Train: 100.00
   Final Test: 77.90
Split: 01, Run: 02
None time:  1.9304547901265323
None Run 02:
Highest Train: 100.00
Highest Valid: 82.20
  Final Train: 100.00
   Final Test: 79.60
Split: 01, Run: 03
None time:  1.6182120039593428
None Run 03:
Highest Train: 100.00
Highest Valid: 82.60
  Final Train: 100.00
   Final Test: 80.40
run time now: 6.101255893707275
total time:  6.167074861936271
None All runs:
Highest Train: 100.00 ± 0.00
Highest Valid: 82.13 ± 0.50
  Final Train: 100.00 ± 0.00
   Final Test: 79.30 ± 1.28
[I 2023-06-12 00:39:01,829] Trial 283 finished with value: 82.13333129882812 and parameters: {'Fwd': 5.394801369400876e-06, 'K': 10, 'alpha': 0.9500000000000001, 'dropout': 0.9, 'gnnepoch': 60, 'lambda1': 0.8, 'lambda2': 6.100906107741692, 'loop': 1, 'loss': 'MSE', 'lr': 0.002562215555027208, 'softmaxF': True, 'useGCN': False, 'weight_decay': 0.02472057935599452, 'weightedloss': False}. Best is trial 205 with value: 83.53333282470703.
/home/wxy/miniconda3/lib/python3.10/site-packages/optuna/distributions.py:685: UserWarning: The distribution is specified by [0, 1.00001] and step=0.05, but the range is not divisible by `step`. It will be replaced by [0, 1.0].
  warnings.warn(
K:  10
alpha:  0.9
lr:  0.0028672628773627807
weight_decay:  0.011713656410370876
dropout:  0.9
fix split and run 3 times
Data: Data(x=[19717, 500], y=[19717], train_mask=[19717], val_mask=[19717], test_mask=[19717], adj_t=[19717, 19717, nnz=88648])
num_train tensor(60)
num_noise 0
noise: tensor(0)
data feature 500
ALTOPT(
  (lins): Sequential(
    (0): Linear(in_features=500, out_features=64, bias=True)
    (1): BatchNorm1d(64, eps=1e-05, momentum=0.1, affine=True, track_running_stats=True)
    (2): Dropout(p=0.9, inplace=True)
    (3): ReLU(inplace=True)
    (4): Linear(in_features=64, out_features=3, bias=True)
    (5): LogSoftmax(dim=-1)
  )
  (prop): Propagation(K=10, mode=None, lambda1=None, lambda2=None, L21=True, alpha=0.9)
  (gcn): GCN(
    (convs): ModuleList(
      (0): GCNConv(500, 64)
      (1): GCNConv(64, 3)
    )
    (bns): ModuleList(
      (0): BatchNorm1d(64, eps=1e-05, momentum=0.1, affine=True, track_running_stats=True)
    )
    (output): LogSoftmax(dim=-1)
  )
)
propagate done
init label
Split: 01, Run: 01
None time:  1.1873327160719782
None Run 01:
Highest Train: 100.00
Highest Valid: 76.20
  Final Train: 100.00
   Final Test: 72.30
Split: 01, Run: 02
None time:  1.1393077210523188
None Run 02:
Highest Train: 100.00
Highest Valid: 79.60
  Final Train: 96.67
   Final Test: 77.00
Split: 01, Run: 03
None time:  1.0032907528802752
None Run 03:
Highest Train: 100.00
Highest Valid: 79.60
  Final Train: 98.33
   Final Test: 77.70
run time now: 3.3776350021362305
total time:  3.418475904967636
None All runs:
Highest Train: 100.00 ± 0.00
Highest Valid: 78.47 ± 1.96
  Final Train: 98.33 ± 1.67
   Final Test: 75.67 ± 2.94
[I 2023-06-12 00:39:05,828] Trial 284 finished with value: 78.46666717529297 and parameters: {'Fwd': 0.00041151697578210573, 'K': 10, 'alpha': 0.9, 'dropout': 0.9, 'gnnepoch': 60, 'lambda1': 0.8500000000000001, 'lambda2': 4.923712137280821, 'loop': 1, 'loss': 'CE', 'lr': 0.0028672628773627807, 'softmaxF': True, 'useGCN': False, 'weight_decay': 0.011713656410370876, 'weightedloss': True}. Best is trial 205 with value: 83.53333282470703.
/home/wxy/miniconda3/lib/python3.10/site-packages/optuna/distributions.py:685: UserWarning: The distribution is specified by [0, 1.00001] and step=0.05, but the range is not divisible by `step`. It will be replaced by [0, 1.0].
  warnings.warn(
K:  10
alpha:  0.9500000000000001
lr:  0.0023922581433187913
weight_decay:  0.008974754546848596
dropout:  0.9
fix split and run 3 times
Data: Data(x=[19717, 500], y=[19717], train_mask=[19717], val_mask=[19717], test_mask=[19717], adj_t=[19717, 19717, nnz=88648])
num_train tensor(60)
num_noise 0
noise: tensor(0)
data feature 500
ALTOPT(
  (lins): Sequential(
    (0): Linear(in_features=500, out_features=64, bias=True)
    (1): BatchNorm1d(64, eps=1e-05, momentum=0.1, affine=True, track_running_stats=True)
    (2): Dropout(p=0.9, inplace=True)
    (3): ReLU(inplace=True)
    (4): Linear(in_features=64, out_features=3, bias=True)
    (5): Identity()
  )
  (prop): Propagation(K=10, mode=None, lambda1=None, lambda2=None, L21=True, alpha=0.9500000000000001)
  (gcn): GCN(
    (convs): ModuleList(
      (0): GCNConv(500, 64)
      (1): GCNConv(64, 3)
    )
    (bns): ModuleList(
      (0): BatchNorm1d(64, eps=1e-05, momentum=0.1, affine=True, track_running_stats=True)
    )
    (output): Identity()
  )
)
propagate done
init label
Split: 01, Run: 01, Epoch: 100, Loss: 0.3658, Train: 100.00%, Valid: 81.60% Test: 77.70%
Split: 01, Run: 01
None time:  3.3186024830210954
None Run 01:
Highest Train: 100.00
Highest Valid: 81.60
  Final Train: 100.00
   Final Test: 77.70
Split: 01, Run: 02
None time:  1.2773566220421344
None Run 02:
Highest Train: 100.00
Highest Valid: 84.80
  Final Train: 100.00
   Final Test: 79.50
Split: 01, Run: 03
None time:  0.9844164969399571
None Run 03:
Highest Train: 100.00
Highest Valid: 80.20
  Final Train: 100.00
   Final Test: 78.50
run time now: 5.629456520080566
total time:  5.673639337997884
None All runs:
Highest Train: 100.00 ± 0.00
Highest Valid: 82.20 ± 2.36
  Final Train: 100.00 ± 0.00
   Final Test: 78.57 ± 0.90
[I 2023-06-12 00:39:12,071] Trial 285 finished with value: 82.19999694824219 and parameters: {'Fwd': 3.883118507816502e-06, 'K': 10, 'alpha': 0.9500000000000001, 'dropout': 0.9, 'gnnepoch': 60, 'lambda1': 0.75, 'lambda2': 5.811380499207048, 'loop': 1, 'loss': 'MSE', 'lr': 0.0023922581433187913, 'softmaxF': True, 'useGCN': False, 'weight_decay': 0.008974754546848596, 'weightedloss': False}. Best is trial 205 with value: 83.53333282470703.
/home/wxy/miniconda3/lib/python3.10/site-packages/optuna/distributions.py:685: UserWarning: The distribution is specified by [0, 1.00001] and step=0.05, but the range is not divisible by `step`. It will be replaced by [0, 1.0].
  warnings.warn(
K:  10
alpha:  0.9500000000000001
lr:  0.0038729369144157692
weight_decay:  0.00567391134873342
dropout:  0.8
fix split and run 3 times
Data: Data(x=[19717, 500], y=[19717], train_mask=[19717], val_mask=[19717], test_mask=[19717], adj_t=[19717, 19717, nnz=88648])
num_train tensor(60)
num_noise 0
noise: tensor(0)
data feature 500
ALTOPT(
  (lins): Sequential(
    (0): Linear(in_features=500, out_features=64, bias=True)
    (1): BatchNorm1d(64, eps=1e-05, momentum=0.1, affine=True, track_running_stats=True)
    (2): Dropout(p=0.8, inplace=True)
    (3): ReLU(inplace=True)
    (4): Linear(in_features=64, out_features=3, bias=True)
    (5): Identity()
  )
  (prop): Propagation(K=10, mode=None, lambda1=None, lambda2=None, L21=True, alpha=0.9500000000000001)
  (gcn): GCN(
    (convs): ModuleList(
      (0): GCNConv(500, 64)
      (1): GCNConv(64, 3)
    )
    (bns): ModuleList(
      (0): BatchNorm1d(64, eps=1e-05, momentum=0.1, affine=True, track_running_stats=True)
    )
    (output): Identity()
  )
)
propagate done
init label
Split: 01, Run: 01
None time:  0.8988521739374846
None Run 01:
Highest Train: 100.00
Highest Valid: 69.20
  Final Train: 100.00
   Final Test: 69.00
Split: 01, Run: 02
None time:  1.1035275850445032
None Run 02:
Highest Train: 100.00
Highest Valid: 82.80
  Final Train: 100.00
   Final Test: 80.70
Split: 01, Run: 03
None time:  0.7969134550075978
None Run 03:
Highest Train: 100.00
Highest Valid: 79.20
  Final Train: 100.00
   Final Test: 76.20
run time now: 2.8441219329833984
total time:  2.8984147429000586
None All runs:
Highest Train: 100.00 ± 0.00
Highest Valid: 77.07 ± 7.05
  Final Train: 100.00 ± 0.00
   Final Test: 75.30 ± 5.90
[I 2023-06-12 00:39:15,538] Trial 286 finished with value: 77.06666564941406 and parameters: {'Fwd': 9.081016400635921e-05, 'K': 10, 'alpha': 0.9500000000000001, 'dropout': 0.8, 'gnnepoch': 50, 'lambda1': 0.9, 'lambda2': 5.4778555923347625, 'loop': 1, 'loss': 'MSE', 'lr': 0.0038729369144157692, 'softmaxF': True, 'useGCN': False, 'weight_decay': 0.00567391134873342, 'weightedloss': False}. Best is trial 205 with value: 83.53333282470703.
/home/wxy/miniconda3/lib/python3.10/site-packages/optuna/distributions.py:685: UserWarning: The distribution is specified by [0, 1.00001] and step=0.05, but the range is not divisible by `step`. It will be replaced by [0, 1.0].
  warnings.warn(
K:  10
alpha:  0.65
lr:  0.0032948481031062505
weight_decay:  0.016829267158036915
dropout:  0.9
fix split and run 3 times
Data: Data(x=[19717, 500], y=[19717], train_mask=[19717], val_mask=[19717], test_mask=[19717], adj_t=[19717, 19717, nnz=88648])
num_train tensor(60)
num_noise 0
noise: tensor(0)
data feature 500
ALTOPT(
  (lins): Sequential(
    (0): Linear(in_features=500, out_features=64, bias=True)
    (1): BatchNorm1d(64, eps=1e-05, momentum=0.1, affine=True, track_running_stats=True)
    (2): Dropout(p=0.9, inplace=True)
    (3): ReLU(inplace=True)
    (4): Linear(in_features=64, out_features=3, bias=True)
    (5): Identity()
  )
  (prop): Propagation(K=10, mode=None, lambda1=None, lambda2=None, L21=True, alpha=0.65)
  (gcn): GCN(
    (convs): ModuleList(
      (0): GCNConv(500, 64)
      (1): GCNConv(64, 3)
    )
    (bns): ModuleList(
      (0): BatchNorm1d(64, eps=1e-05, momentum=0.1, affine=True, track_running_stats=True)
    )
    (output): Identity()
  )
)
propagate done
init label
Split: 01, Run: 01
None time:  0.9677000469528139
None Run 01:
Highest Train: 100.00
Highest Valid: 69.40
  Final Train: 100.00
   Final Test: 69.20
Split: 01, Run: 02, Epoch: 100, Loss: 0.1372, Train: 100.00%, Valid: 80.40% Test: 77.60%
Split: 01, Run: 02
None time:  3.7748158909380436
None Run 02:
Highest Train: 100.00
Highest Valid: 80.80
  Final Train: 100.00
   Final Test: 77.50
Split: 01, Run: 03
None time:  1.0364077710546553
None Run 03:
Highest Train: 100.00
Highest Valid: 80.20
  Final Train: 100.00
   Final Test: 77.40
run time now: 5.82462477684021
total time:  5.863806338049471
None All runs:
Highest Train: 100.00 ± 0.00
Highest Valid: 76.80 ± 6.42
  Final Train: 100.00 ± 0.00
   Final Test: 74.70 ± 4.76
