[I 2023-06-11 23:45:11,315] Trial 386 finished with value: 71.5999984741211 and parameters: {'Fwd': 0.054515673299707995, 'K': 8, 'alpha': 0.7000000000000001, 'dropout': 0.8, 'gnnepoch': 120, 'lambda1': 0.65, 'lambda2': 5.856388309124623, 'loop': 0, 'loss': 'CE', 'lr': 0.0011555552832174896, 'softmaxF': False, 'useGCN': True, 'weight_decay': 2.924543780486063e-06, 'weightedloss': True}. Best is trial 271 with value: 72.06666564941406.
/home/wxy/miniconda3/lib/python3.10/site-packages/optuna/distributions.py:685: UserWarning: The distribution is specified by [0, 1.00001] and step=0.05, but the range is not divisible by `step`. It will be replaced by [0, 1.0].
  warnings.warn(
K:  8
alpha:  0.7000000000000001
lr:  0.0013121312641276323
weight_decay:  2.7414853666048425e-06
dropout:  0.8
fix split and run 3 times
Data: Data(x=[3327, 3703], y=[3327], train_mask=[3327], val_mask=[3327], test_mask=[3327], adj_t=[3327, 3327, nnz=9104])
num_train tensor(120)
num_noise 0
noise: tensor(0)
data feature 3703
ALTOPT(
  (lins): Sequential(
    (0): Linear(in_features=3703, out_features=64, bias=True)
    (1): BatchNorm1d(64, eps=1e-05, momentum=0.1, affine=True, track_running_stats=True)
    (2): Dropout(p=0.8, inplace=True)
    (3): ReLU(inplace=True)
    (4): Linear(in_features=64, out_features=6, bias=True)
    (5): LogSoftmax(dim=-1)
  )
  (prop): Propagation(K=8, mode=None, lambda1=None, lambda2=None, L21=True, alpha=0.7000000000000001)
  (gcn): GCN(
    (convs): ModuleList(
      (0): GCNConv(3703, 64)
      (1): GCNConv(64, 6)
    )
    (bns): ModuleList(
      (0): BatchNorm1d(64, eps=1e-05, momentum=0.1, affine=True, track_running_stats=True)
    )
    (output): LogSoftmax(dim=-1)
  )
)
propagate done
init label
Split: 01, Run: 01
None time:  1.111443897942081
None Run 01:
Highest Train: 100.00
Highest Valid: 71.60
  Final Train: 100.00
   Final Test: 69.80
Split: 01, Run: 02
None time:  1.0848588389344513
None Run 02:
Highest Train: 100.00
Highest Valid: 72.40
  Final Train: 100.00
   Final Test: 69.90
Split: 01, Run: 03
None time:  1.120332483900711
None Run 03:
Highest Train: 100.00
Highest Valid: 71.40
  Final Train: 100.00
   Final Test: 70.30
run time now: 3.3570644855499268
total time:  3.414045033045113
None All runs:
Highest Train: 100.00 ± 0.00
Highest Valid: 71.80 ± 0.53
  Final Train: 100.00 ± 0.00
   Final Test: 70.00 ± 0.26
[I 2023-06-11 23:45:15,241] Trial 387 finished with value: 71.79999542236328 and parameters: {'Fwd': 0.06914338456745858, 'K': 8, 'alpha': 0.7000000000000001, 'dropout': 0.8, 'gnnepoch': 120, 'lambda1': 0.55, 'lambda2': 5.541761642669086, 'loop': 0, 'loss': 'CE', 'lr': 0.0013121312641276323, 'softmaxF': False, 'useGCN': True, 'weight_decay': 2.7414853666048425e-06, 'weightedloss': True}. Best is trial 271 with value: 72.06666564941406.
/home/wxy/miniconda3/lib/python3.10/site-packages/optuna/distributions.py:685: UserWarning: The distribution is specified by [0, 1.00001] and step=0.05, but the range is not divisible by `step`. It will be replaced by [0, 1.0].
  warnings.warn(
K:  8
alpha:  0.7000000000000001
lr:  0.0009447548080843225
weight_decay:  3.240662663952496e-06
dropout:  0.8
fix split and run 3 times
Data: Data(x=[3327, 3703], y=[3327], train_mask=[3327], val_mask=[3327], test_mask=[3327], adj_t=[3327, 3327, nnz=9104])
num_train tensor(120)
num_noise 0
noise: tensor(0)
data feature 3703
ALTOPT(
  (lins): Sequential(
    (0): Linear(in_features=3703, out_features=64, bias=True)
    (1): BatchNorm1d(64, eps=1e-05, momentum=0.1, affine=True, track_running_stats=True)
    (2): Dropout(p=0.8, inplace=True)
    (3): ReLU(inplace=True)
    (4): Linear(in_features=64, out_features=6, bias=True)
    (5): LogSoftmax(dim=-1)
  )
  (prop): Propagation(K=8, mode=None, lambda1=None, lambda2=None, L21=True, alpha=0.7000000000000001)
  (gcn): GCN(
    (convs): ModuleList(
      (0): GCNConv(3703, 64)
      (1): GCNConv(64, 6)
    )
    (bns): ModuleList(
      (0): BatchNorm1d(64, eps=1e-05, momentum=0.1, affine=True, track_running_stats=True)
    )
    (output): LogSoftmax(dim=-1)
  )
)
propagate done
init label
Split: 01, Run: 01
None time:  1.0813985401764512
None Run 01:
Highest Train: 100.00
Highest Valid: 70.60
  Final Train: 100.00
   Final Test: 69.40
Split: 01, Run: 02
None time:  1.0823268829844892
None Run 02:
Highest Train: 100.00
Highest Valid: 72.20
  Final Train: 100.00
   Final Test: 69.90
Split: 01, Run: 03, Epoch: 100, Loss: 0.0000, Train: 100.00%, Valid: 70.40% Test: 70.30%
Split: 01, Run: 03
None time:  1.8553017110098153
None Run 03:
Highest Train: 100.00
Highest Valid: 70.40
  Final Train: 100.00
   Final Test: 69.70
run time now: 4.0603063106536865
total time:  4.121647954918444
None All runs:
Highest Train: 100.00 ± 0.00
Highest Valid: 71.07 ± 0.99
  Final Train: 100.00 ± 0.00
   Final Test: 69.67 ± 0.25
[I 2023-06-11 23:45:19,846] Trial 388 finished with value: 71.06665802001953 and parameters: {'Fwd': 0.07801708674897911, 'K': 8, 'alpha': 0.7000000000000001, 'dropout': 0.8, 'gnnepoch': 120, 'lambda1': 0.6000000000000001, 'lambda2': 5.967466607291526, 'loop': 0, 'loss': 'CE', 'lr': 0.0009447548080843225, 'softmaxF': False, 'useGCN': True, 'weight_decay': 3.240662663952496e-06, 'weightedloss': True}. Best is trial 271 with value: 72.06666564941406.
/home/wxy/miniconda3/lib/python3.10/site-packages/optuna/distributions.py:685: UserWarning: The distribution is specified by [0, 1.00001] and step=0.05, but the range is not divisible by `step`. It will be replaced by [0, 1.0].
  warnings.warn(
K:  8
alpha:  0.65
lr:  0.0014088563636190073
weight_decay:  0.00010722561563825551
dropout:  0.8
fix split and run 3 times
Data: Data(x=[3327, 3703], y=[3327], train_mask=[3327], val_mask=[3327], test_mask=[3327], adj_t=[3327, 3327, nnz=9104])
num_train tensor(120)
num_noise 0
noise: tensor(0)
data feature 3703
ALTOPT(
  (lins): Sequential(
    (0): Linear(in_features=3703, out_features=64, bias=True)
    (1): BatchNorm1d(64, eps=1e-05, momentum=0.1, affine=True, track_running_stats=True)
    (2): Dropout(p=0.8, inplace=True)
    (3): ReLU(inplace=True)
    (4): Linear(in_features=64, out_features=6, bias=True)
    (5): Identity()
  )
  (prop): Propagation(K=8, mode=None, lambda1=None, lambda2=None, L21=True, alpha=0.65)
  (gcn): GCN(
    (convs): ModuleList(
      (0): GCNConv(3703, 64)
      (1): GCNConv(64, 6)
    )
    (bns): ModuleList(
      (0): BatchNorm1d(64, eps=1e-05, momentum=0.1, affine=True, track_running_stats=True)
    )
    (output): Identity()
  )
)
propagate done
init label
Split: 01, Run: 01, Epoch: 100, Loss: 0.0000, Train: 100.00%, Valid: 70.80% Test: 69.50%
Split: 01, Run: 01
None time:  1.7195732230320573
None Run 01:
Highest Train: 100.00
Highest Valid: 70.80
  Final Train: 100.00
   Final Test: 69.50
Split: 01, Run: 02, Epoch: 100, Loss: 0.0000, Train: 100.00%, Valid: 70.00% Test: 69.30%
Split: 01, Run: 02
None time:  1.693582777865231
None Run 02:
Highest Train: 100.00
Highest Valid: 70.00
  Final Train: 100.00
   Final Test: 69.40
Split: 01, Run: 03, Epoch: 100, Loss: 0.0000, Train: 100.00%, Valid: 69.00% Test: 69.90%
Split: 01, Run: 03
None time:  1.6904107078444213
None Run 03:
Highest Train: 100.00
Highest Valid: 69.00
  Final Train: 100.00
   Final Test: 70.10
run time now: 5.149658441543579
total time:  5.20945169008337
None All runs:
Highest Train: 100.00 ± 0.00
Highest Valid: 69.93 ± 0.90
  Final Train: 100.00 ± 0.00
   Final Test: 69.67 ± 0.38
[I 2023-06-11 23:45:25,618] Trial 389 finished with value: 69.93333435058594 and parameters: {'Fwd': 0.0013874623378092078, 'K': 8, 'alpha': 0.65, 'dropout': 0.8, 'gnnepoch': 110, 'lambda1': 0.65, 'lambda2': 6.366897083122955, 'loop': 0, 'loss': 'MSE', 'lr': 0.0014088563636190073, 'softmaxF': False, 'useGCN': True, 'weight_decay': 0.00010722561563825551, 'weightedloss': True}. Best is trial 271 with value: 72.06666564941406.
/home/wxy/miniconda3/lib/python3.10/site-packages/optuna/distributions.py:685: UserWarning: The distribution is specified by [0, 1.00001] and step=0.05, but the range is not divisible by `step`. It will be replaced by [0, 1.0].
  warnings.warn(
K:  9
alpha:  0.75
lr:  0.0004812679440952283
weight_decay:  1.9709122535654462e-05
dropout:  0.7000000000000001
fix split and run 3 times
Data: Data(x=[3327, 3703], y=[3327], train_mask=[3327], val_mask=[3327], test_mask=[3327], adj_t=[3327, 3327, nnz=9104])
num_train tensor(120)
num_noise 0
noise: tensor(0)
data feature 3703
ALTOPT(
  (lins): Sequential(
    (0): Linear(in_features=3703, out_features=64, bias=True)
    (1): BatchNorm1d(64, eps=1e-05, momentum=0.1, affine=True, track_running_stats=True)
    (2): Dropout(p=0.7000000000000001, inplace=True)
    (3): ReLU(inplace=True)
    (4): Linear(in_features=64, out_features=6, bias=True)
    (5): LogSoftmax(dim=-1)
  )
  (prop): Propagation(K=9, mode=None, lambda1=None, lambda2=None, L21=True, alpha=0.75)
  (gcn): GCN(
    (convs): ModuleList(
      (0): GCNConv(3703, 64)
      (1): GCNConv(64, 6)
    )
    (bns): ModuleList(
      (0): BatchNorm1d(64, eps=1e-05, momentum=0.1, affine=True, track_running_stats=True)
    )
    (output): LogSoftmax(dim=-1)
  )
)
propagate done
init label
Split: 01, Run: 01
None time:  1.2399114170111716
None Run 01:
Highest Train: 100.00
Highest Valid: 70.00
  Final Train: 100.00
   Final Test: 69.40
Split: 01, Run: 02
None time:  1.2010234468616545
None Run 02:
Highest Train: 100.00
Highest Valid: 72.00
  Final Train: 100.00
   Final Test: 71.00
Split: 01, Run: 03
None time:  1.1459724069572985
None Run 03:
Highest Train: 100.00
Highest Valid: 70.20
  Final Train: 100.00
   Final Test: 70.00
run time now: 3.6292386054992676
total time:  3.7002492588944733
None All runs:
Highest Train: 100.00 ± 0.00
Highest Valid: 70.73 ± 1.10
  Final Train: 100.00 ± 0.00
   Final Test: 70.13 ± 0.81
[I 2023-06-11 23:45:29,789] Trial 390 finished with value: 70.73333740234375 and parameters: {'Fwd': 0.048983310267936994, 'K': 9, 'alpha': 0.75, 'dropout': 0.7000000000000001, 'gnnepoch': 120, 'lambda1': 0.65, 'lambda2': 6.060550321169906, 'loop': 1, 'loss': 'CE', 'lr': 0.0004812679440952283, 'softmaxF': False, 'useGCN': True, 'weight_decay': 1.9709122535654462e-05, 'weightedloss': True}. Best is trial 271 with value: 72.06666564941406.
/home/wxy/miniconda3/lib/python3.10/site-packages/optuna/distributions.py:685: UserWarning: The distribution is specified by [0, 1.00001] and step=0.05, but the range is not divisible by `step`. It will be replaced by [0, 1.0].
  warnings.warn(
K:  8
alpha:  0.7000000000000001
lr:  0.0012368531401310242
weight_decay:  1.4979826948384108e-05
dropout:  0.8
fix split and run 3 times
Data: Data(x=[3327, 3703], y=[3327], train_mask=[3327], val_mask=[3327], test_mask=[3327], adj_t=[3327, 3327, nnz=9104])
num_train tensor(120)
num_noise 0
noise: tensor(0)
data feature 3703
ALTOPT(
  (lins): Sequential(
    (0): Linear(in_features=3703, out_features=64, bias=True)
    (1): BatchNorm1d(64, eps=1e-05, momentum=0.1, affine=True, track_running_stats=True)
    (2): Dropout(p=0.8, inplace=True)
    (3): ReLU(inplace=True)
    (4): Linear(in_features=64, out_features=6, bias=True)
    (5): LogSoftmax(dim=-1)
  )
  (prop): Propagation(K=8, mode=None, lambda1=None, lambda2=None, L21=True, alpha=0.7000000000000001)
  (gcn): GCN(
    (convs): ModuleList(
      (0): GCNConv(3703, 64)
      (1): GCNConv(64, 6)
    )
    (bns): ModuleList(
      (0): BatchNorm1d(64, eps=1e-05, momentum=0.1, affine=True, track_running_stats=True)
    )
    (output): LogSoftmax(dim=-1)
  )
)
propagate done
init label
Split: 01, Run: 01
None time:  1.0337813110090792
None Run 01:
Highest Train: 100.00
Highest Valid: 71.40
  Final Train: 100.00
   Final Test: 69.70
Split: 01, Run: 02
None time:  1.044189905980602
None Run 02:
Highest Train: 100.00
Highest Valid: 72.40
  Final Train: 100.00
   Final Test: 69.90
Split: 01, Run: 03
None time:  1.0530985470395535
None Run 03:
Highest Train: 100.00
Highest Valid: 71.80
  Final Train: 100.00
   Final Test: 70.70
run time now: 3.1895833015441895
total time:  3.2675065190996975
None All runs:
Highest Train: 100.00 ± 0.00
Highest Valid: 71.87 ± 0.50
  Final Train: 100.00 ± 0.00
   Final Test: 70.10 ± 0.53
[I 2023-06-11 23:45:33,559] Trial 391 finished with value: 71.86666107177734 and parameters: {'Fwd': 0.0027167251950572244, 'K': 8, 'alpha': 0.7000000000000001, 'dropout': 0.8, 'gnnepoch': 120, 'lambda1': 0.6000000000000001, 'lambda2': 7.768171162713104, 'loop': 0, 'loss': 'CE', 'lr': 0.0012368531401310242, 'softmaxF': True, 'useGCN': True, 'weight_decay': 1.4979826948384108e-05, 'weightedloss': True}. Best is trial 271 with value: 72.06666564941406.
/home/wxy/miniconda3/lib/python3.10/site-packages/optuna/distributions.py:685: UserWarning: The distribution is specified by [0, 1.00001] and step=0.05, but the range is not divisible by `step`. It will be replaced by [0, 1.0].
  warnings.warn(
K:  8
alpha:  0.65
lr:  0.0010100281867298272
weight_decay:  0.0014788175259586565
dropout:  0.8
fix split and run 3 times
Data: Data(x=[3327, 3703], y=[3327], train_mask=[3327], val_mask=[3327], test_mask=[3327], adj_t=[3327, 3327, nnz=9104])
num_train tensor(120)
num_noise 0
noise: tensor(0)
data feature 3703
ALTOPT(
  (lins): Sequential(
    (0): Linear(in_features=3703, out_features=64, bias=True)
    (1): BatchNorm1d(64, eps=1e-05, momentum=0.1, affine=True, track_running_stats=True)
    (2): Dropout(p=0.8, inplace=True)
    (3): ReLU(inplace=True)
    (4): Linear(in_features=64, out_features=6, bias=True)
    (5): LogSoftmax(dim=-1)
  )
  (prop): Propagation(K=8, mode=None, lambda1=None, lambda2=None, L21=True, alpha=0.65)
  (gcn): GCN(
    (convs): ModuleList(
      (0): GCNConv(3703, 64)
      (1): GCNConv(64, 6)
    )
    (bns): ModuleList(
      (0): BatchNorm1d(64, eps=1e-05, momentum=0.1, affine=True, track_running_stats=True)
    )
    (output): LogSoftmax(dim=-1)
  )
)
propagate done
init label
Split: 01, Run: 01
None time:  1.085407939972356
None Run 01:
Highest Train: 100.00
Highest Valid: 70.60
  Final Train: 100.00
   Final Test: 69.50
Split: 01, Run: 02
None time:  1.1017350431066006
None Run 02:
Highest Train: 100.00
Highest Valid: 72.40
  Final Train: 100.00
   Final Test: 69.70
Split: 01, Run: 03, Epoch: 100, Loss: 0.0000, Train: 100.00%, Valid: 71.20% Test: 70.30%
Split: 01, Run: 03
None time:  1.7419001839589328
None Run 03:
Highest Train: 100.00
Highest Valid: 71.20
  Final Train: 100.00
   Final Test: 70.30
run time now: 3.971179485321045
total time:  4.019686366198584
None All runs:
Highest Train: 100.00 ± 0.00
Highest Valid: 71.40 ± 0.92
  Final Train: 100.00 ± 0.00
   Final Test: 69.83 ± 0.42
[I 2023-06-11 23:45:38,077] Trial 392 finished with value: 71.4000015258789 and parameters: {'Fwd': 0.04181748012254827, 'K': 8, 'alpha': 0.65, 'dropout': 0.8, 'gnnepoch': 120, 'lambda1': 0.7000000000000001, 'lambda2': 5.081395397005641, 'loop': 0, 'loss': 'CE', 'lr': 0.0010100281867298272, 'softmaxF': False, 'useGCN': True, 'weight_decay': 0.0014788175259586565, 'weightedloss': True}. Best is trial 271 with value: 72.06666564941406.
/home/wxy/miniconda3/lib/python3.10/site-packages/optuna/distributions.py:685: UserWarning: The distribution is specified by [0, 1.00001] and step=0.05, but the range is not divisible by `step`. It will be replaced by [0, 1.0].
  warnings.warn(
K:  8
alpha:  0.75
lr:  0.009587950076328141
weight_decay:  2.5552904501372196e-05
dropout:  0.8
fix split and run 3 times
Data: Data(x=[3327, 3703], y=[3327], train_mask=[3327], val_mask=[3327], test_mask=[3327], adj_t=[3327, 3327, nnz=9104])
num_train tensor(120)
num_noise 0
noise: tensor(0)
data feature 3703
ALTOPT(
  (lins): Sequential(
    (0): Linear(in_features=3703, out_features=64, bias=True)
    (1): BatchNorm1d(64, eps=1e-05, momentum=0.1, affine=True, track_running_stats=True)
    (2): Dropout(p=0.8, inplace=True)
    (3): ReLU(inplace=True)
    (4): Linear(in_features=64, out_features=6, bias=True)
    (5): LogSoftmax(dim=-1)
  )
  (prop): Propagation(K=8, mode=None, lambda1=None, lambda2=None, L21=True, alpha=0.75)
  (gcn): GCN(
    (convs): ModuleList(
      (0): GCNConv(3703, 64)
      (1): GCNConv(64, 6)
    )
    (bns): ModuleList(
      (0): BatchNorm1d(64, eps=1e-05, momentum=0.1, affine=True, track_running_stats=True)
    )
    (output): LogSoftmax(dim=-1)
  )
)
propagate done
init label
Split: 01, Run: 01, Epoch: 100, Loss: 0.0000, Train: 100.00%, Valid: 69.40% Test: 69.20%
Split: 01, Run: 01
None time:  1.8106393348425627
None Run 01:
Highest Train: 100.00
Highest Valid: 69.40
  Final Train: 100.00
   Final Test: 69.20
Split: 01, Run: 02
None time:  1.070888867136091
None Run 02:
Highest Train: 100.00
Highest Valid: 68.60
  Final Train: 100.00
   Final Test: 68.30
Split: 01, Run: 03, Epoch: 100, Loss: 0.0000, Train: 100.00%, Valid: 69.60% Test: 69.20%
Split: 01, Run: 03
None time:  1.8914146970491856
None Run 03:
Highest Train: 100.00
Highest Valid: 69.60
  Final Train: 100.00
   Final Test: 69.20
run time now: 4.827816009521484
total time:  4.874481202103198
None All runs:
Highest Train: 100.00 ± 0.00
Highest Valid: 69.20 ± 0.53
  Final Train: 100.00 ± 0.00
   Final Test: 68.90 ± 0.52
[I 2023-06-11 23:45:43,439] Trial 393 finished with value: 69.20000457763672 and parameters: {'Fwd': 0.061630717374933204, 'K': 8, 'alpha': 0.75, 'dropout': 0.8, 'gnnepoch': 120, 'lambda1': 0.7000000000000001, 'lambda2': 9.683239787942924, 'loop': 0, 'loss': 'CE', 'lr': 0.009587950076328141, 'softmaxF': False, 'useGCN': True, 'weight_decay': 2.5552904501372196e-05, 'weightedloss': True}. Best is trial 271 with value: 72.06666564941406.
/home/wxy/miniconda3/lib/python3.10/site-packages/optuna/distributions.py:685: UserWarning: The distribution is specified by [0, 1.00001] and step=0.05, but the range is not divisible by `step`. It will be replaced by [0, 1.0].
  warnings.warn(
K:  8
alpha:  0.8
lr:  0.0015541816862614283
weight_decay:  2.2034152184395558e-05
dropout:  0.8
fix split and run 3 times
Data: Data(x=[3327, 3703], y=[3327], train_mask=[3327], val_mask=[3327], test_mask=[3327], adj_t=[3327, 3327, nnz=9104])
num_train tensor(120)
num_noise 0
noise: tensor(0)
data feature 3703
ALTOPT(
  (lins): Sequential(
    (0): Linear(in_features=3703, out_features=64, bias=True)
    (1): BatchNorm1d(64, eps=1e-05, momentum=0.1, affine=True, track_running_stats=True)
    (2): Dropout(p=0.8, inplace=True)
    (3): ReLU(inplace=True)
    (4): Linear(in_features=64, out_features=6, bias=True)
    (5): LogSoftmax(dim=-1)
  )
  (prop): Propagation(K=8, mode=None, lambda1=None, lambda2=None, L21=True, alpha=0.8)
  (gcn): GCN(
    (convs): ModuleList(
      (0): GCNConv(3703, 64)
      (1): GCNConv(64, 6)
    )
    (bns): ModuleList(
      (0): BatchNorm1d(64, eps=1e-05, momentum=0.1, affine=True, track_running_stats=True)
    )
    (output): LogSoftmax(dim=-1)
  )
)
propagate done
init label
Split: 01, Run: 01
None time:  0.8612079741433263
None Run 01:
Highest Train: 100.00
Highest Valid: 71.20
  Final Train: 100.00
   Final Test: 69.90
Split: 01, Run: 02
None time:  1.077490716939792
None Run 02:
Highest Train: 100.00
Highest Valid: 68.80
  Final Train: 100.00
   Final Test: 68.90
Split: 01, Run: 03
None time:  0.9780383869074285
None Run 03:
Highest Train: 100.00
Highest Valid: 71.60
  Final Train: 100.00
   Final Test: 70.30
run time now: 2.9581995010375977
total time:  3.027349716052413
None All runs:
Highest Train: 100.00 ± 0.00
Highest Valid: 70.53 ± 1.51
  Final Train: 100.00 ± 0.00
   Final Test: 69.70 ± 0.72
[I 2023-06-11 23:45:47,006] Trial 394 finished with value: 70.53333282470703 and parameters: {'Fwd': 4.007089337707338e-05, 'K': 8, 'alpha': 0.8, 'dropout': 0.8, 'gnnepoch': 110, 'lambda1': 0.7000000000000001, 'lambda2': 5.340422384013777, 'loop': 0, 'loss': 'CE', 'lr': 0.0015541816862614283, 'softmaxF': False, 'useGCN': True, 'weight_decay': 2.2034152184395558e-05, 'weightedloss': True}. Best is trial 271 with value: 72.06666564941406.
/home/wxy/miniconda3/lib/python3.10/site-packages/optuna/distributions.py:685: UserWarning: The distribution is specified by [0, 1.00001] and step=0.05, but the range is not divisible by `step`. It will be replaced by [0, 1.0].
  warnings.warn(
K:  8
alpha:  0.8500000000000001
lr:  0.001139724399116849
weight_decay:  3.0209963064043547e-05
dropout:  0.8
fix split and run 3 times
Data: Data(x=[3327, 3703], y=[3327], train_mask=[3327], val_mask=[3327], test_mask=[3327], adj_t=[3327, 3327, nnz=9104])
num_train tensor(120)
num_noise 0
noise: tensor(0)
data feature 3703
ALTOPT(
  (lins): Sequential(
    (0): Linear(in_features=3703, out_features=64, bias=True)
    (1): BatchNorm1d(64, eps=1e-05, momentum=0.1, affine=True, track_running_stats=True)
    (2): Dropout(p=0.8, inplace=True)
    (3): ReLU(inplace=True)
    (4): Linear(in_features=64, out_features=6, bias=True)
    (5): LogSoftmax(dim=-1)
  )
  (prop): Propagation(K=8, mode=None, lambda1=None, lambda2=None, L21=True, alpha=0.8500000000000001)
  (gcn): GCN(
    (convs): ModuleList(
      (0): GCNConv(3703, 64)
      (1): GCNConv(64, 6)
    )
    (bns): ModuleList(
      (0): BatchNorm1d(64, eps=1e-05, momentum=0.1, affine=True, track_running_stats=True)
    )
    (output): LogSoftmax(dim=-1)
  )
)
propagate done
init label
Split: 01, Run: 01
None time:  1.07870076992549
None Run 01:
Highest Train: 100.00
Highest Valid: 71.00
  Final Train: 100.00
   Final Test: 69.50
Split: 01, Run: 02
None time:  1.0754789020866156
None Run 02:
Highest Train: 100.00
Highest Valid: 72.40
  Final Train: 100.00
   Final Test: 69.70
Split: 01, Run: 03
None time:  1.1306801040191203
None Run 03:
Highest Train: 100.00
Highest Valid: 71.80
  Final Train: 100.00
   Final Test: 70.50
run time now: 3.325575828552246
total time:  3.389049038058147
None All runs:
Highest Train: 100.00 ± 0.00
Highest Valid: 71.73 ± 0.70
  Final Train: 100.00 ± 0.00
   Final Test: 69.90 ± 0.53
