[I 2023-06-11 23:31:25,250] Trial 170 finished with value: 69.93334197998047 and parameters: {'Fwd': 0.016488952542180735, 'K': 9, 'alpha': 0.45, 'dropout': 0.8, 'gnnepoch': 60, 'lambda1': 1.0, 'lambda2': 3.627000072305777, 'loop': 0, 'loss': 'MSE', 'lr': 0.0035724402331388967, 'softmaxF': False, 'useGCN': True, 'weight_decay': 0.0010231652466994666, 'weightedloss': False}. Best is trial 146 with value: 71.86666870117188.
/home/wxy/miniconda3/lib/python3.10/site-packages/optuna/distributions.py:685: UserWarning: The distribution is specified by [0, 1.00001] and step=0.05, but the range is not divisible by `step`. It will be replaced by [0, 1.0].
  warnings.warn(
K:  8
alpha:  0.4
lr:  0.002541748336235583
weight_decay:  3.0958455977967846e-06
dropout:  0.9
fix split and run 3 times
Data: Data(x=[3327, 3703], y=[3327], train_mask=[3327], val_mask=[3327], test_mask=[3327], adj_t=[3327, 3327, nnz=9104])
num_train tensor(120)
num_noise 0
noise: tensor(0)
data feature 3703
ALTOPT(
  (lins): Sequential(
    (0): Linear(in_features=3703, out_features=64, bias=True)
    (1): BatchNorm1d(64, eps=1e-05, momentum=0.1, affine=True, track_running_stats=True)
    (2): Dropout(p=0.9, inplace=True)
    (3): ReLU(inplace=True)
    (4): Linear(in_features=64, out_features=6, bias=True)
    (5): LogSoftmax(dim=-1)
  )
  (prop): Propagation(K=8, mode=None, lambda1=None, lambda2=None, L21=True, alpha=0.4)
  (gcn): GCN(
    (convs): ModuleList(
      (0): GCNConv(3703, 64)
      (1): GCNConv(64, 6)
    )
    (bns): ModuleList(
      (0): BatchNorm1d(64, eps=1e-05, momentum=0.1, affine=True, track_running_stats=True)
    )
    (output): LogSoftmax(dim=-1)
  )
)
propagate done
init label
Split: 01, Run: 01
None time:  1.0707102019805461
None Run 01:
Highest Train: 100.00
Highest Valid: 71.20
  Final Train: 99.17
   Final Test: 69.10
Split: 01, Run: 02
None time:  0.9456272390671074
None Run 02:
Highest Train: 100.00
Highest Valid: 71.80
  Final Train: 100.00
   Final Test: 70.00
Split: 01, Run: 03
None time:  1.1208567300345749
None Run 03:
Highest Train: 100.00
Highest Valid: 71.80
  Final Train: 100.00
   Final Test: 70.40
run time now: 3.1890618801116943
total time:  3.244184438837692
None All runs:
Highest Train: 100.00 ± 0.00
Highest Valid: 71.60 ± 0.35
  Final Train: 99.72 ± 0.48
   Final Test: 69.83 ± 0.67
[I 2023-06-11 23:31:28,923] Trial 171 finished with value: 71.5999984741211 and parameters: {'Fwd': 0.022414092042107765, 'K': 8, 'alpha': 0.4, 'dropout': 0.9, 'gnnepoch': 120, 'lambda1': 0.9500000000000001, 'lambda2': 2.2784874628289895, 'loop': 0, 'loss': 'CE', 'lr': 0.002541748336235583, 'softmaxF': False, 'useGCN': True, 'weight_decay': 3.0958455977967846e-06, 'weightedloss': False}. Best is trial 146 with value: 71.86666870117188.
/home/wxy/miniconda3/lib/python3.10/site-packages/optuna/distributions.py:685: UserWarning: The distribution is specified by [0, 1.00001] and step=0.05, but the range is not divisible by `step`. It will be replaced by [0, 1.0].
  warnings.warn(
K:  8
alpha:  0.05
lr:  0.002212410377438246
weight_decay:  6.6212994854953145e-06
dropout:  0.9
fix split and run 3 times
Data: Data(x=[3327, 3703], y=[3327], train_mask=[3327], val_mask=[3327], test_mask=[3327], adj_t=[3327, 3327, nnz=9104])
num_train tensor(120)
num_noise 0
noise: tensor(0)
data feature 3703
ALTOPT(
  (lins): Sequential(
    (0): Linear(in_features=3703, out_features=64, bias=True)
    (1): BatchNorm1d(64, eps=1e-05, momentum=0.1, affine=True, track_running_stats=True)
    (2): Dropout(p=0.9, inplace=True)
    (3): ReLU(inplace=True)
    (4): Linear(in_features=64, out_features=6, bias=True)
    (5): LogSoftmax(dim=-1)
  )
  (prop): Propagation(K=8, mode=None, lambda1=None, lambda2=None, L21=True, alpha=0.05)
  (gcn): GCN(
    (convs): ModuleList(
      (0): GCNConv(3703, 64)
      (1): GCNConv(64, 6)
    )
    (bns): ModuleList(
      (0): BatchNorm1d(64, eps=1e-05, momentum=0.1, affine=True, track_running_stats=True)
    )
    (output): LogSoftmax(dim=-1)
  )
)
propagate done
init label
Split: 01, Run: 01
None time:  1.0273502359632403
None Run 01:
Highest Train: 100.00
Highest Valid: 71.00
  Final Train: 100.00
   Final Test: 68.90
Split: 01, Run: 02
None time:  1.0436863040085882
None Run 02:
Highest Train: 100.00
Highest Valid: 71.80
  Final Train: 100.00
   Final Test: 70.10
Split: 01, Run: 03
None time:  1.0212345740292221
None Run 03:
Highest Train: 100.00
Highest Valid: 71.80
  Final Train: 100.00
   Final Test: 70.10
run time now: 3.1321330070495605
total time:  3.1947612268850207
None All runs:
Highest Train: 100.00 ± 0.00
Highest Valid: 71.53 ± 0.46
  Final Train: 100.00 ± 0.00
   Final Test: 69.70 ± 0.69
[I 2023-06-11 23:31:32,567] Trial 172 finished with value: 71.53333282470703 and parameters: {'Fwd': 0.012048142321519139, 'K': 8, 'alpha': 0.05, 'dropout': 0.9, 'gnnepoch': 120, 'lambda1': 0.9500000000000001, 'lambda2': 2.8958429445895195, 'loop': 0, 'loss': 'CE', 'lr': 0.002212410377438246, 'softmaxF': False, 'useGCN': True, 'weight_decay': 6.6212994854953145e-06, 'weightedloss': False}. Best is trial 146 with value: 71.86666870117188.
/home/wxy/miniconda3/lib/python3.10/site-packages/optuna/distributions.py:685: UserWarning: The distribution is specified by [0, 1.00001] and step=0.05, but the range is not divisible by `step`. It will be replaced by [0, 1.0].
  warnings.warn(
K:  8
alpha:  0.0
lr:  0.0032839052120195596
weight_decay:  4.587211432633404e-06
dropout:  0.9
fix split and run 3 times
Data: Data(x=[3327, 3703], y=[3327], train_mask=[3327], val_mask=[3327], test_mask=[3327], adj_t=[3327, 3327, nnz=9104])
num_train tensor(120)
num_noise 0
noise: tensor(0)
data feature 3703
ALTOPT(
  (lins): Sequential(
    (0): Linear(in_features=3703, out_features=64, bias=True)
    (1): BatchNorm1d(64, eps=1e-05, momentum=0.1, affine=True, track_running_stats=True)
    (2): Dropout(p=0.9, inplace=True)
    (3): ReLU(inplace=True)
    (4): Linear(in_features=64, out_features=6, bias=True)
    (5): LogSoftmax(dim=-1)
  )
  (prop): Propagation(K=8, mode=None, lambda1=None, lambda2=None, L21=True, alpha=0.0)
  (gcn): GCN(
    (convs): ModuleList(
      (0): GCNConv(3703, 64)
      (1): GCNConv(64, 6)
    )
    (bns): ModuleList(
      (0): BatchNorm1d(64, eps=1e-05, momentum=0.1, affine=True, track_running_stats=True)
    )
    (output): LogSoftmax(dim=-1)
  )
)
propagate done
init label
Split: 01, Run: 01
None time:  1.0705901479814202
None Run 01:
Highest Train: 100.00
Highest Valid: 71.60
  Final Train: 100.00
   Final Test: 69.20
Split: 01, Run: 02
None time:  0.9466350341681391
None Run 02:
Highest Train: 100.00
Highest Valid: 71.80
  Final Train: 100.00
   Final Test: 69.90
Split: 01, Run: 03
None time:  1.0508144767954946
None Run 03:
Highest Train: 100.00
Highest Valid: 71.40
  Final Train: 100.00
   Final Test: 69.60
run time now: 3.110275983810425
total time:  3.169663993176073
None All runs:
Highest Train: 100.00 ± 0.00
Highest Valid: 71.60 ± 0.20
  Final Train: 100.00 ± 0.00
   Final Test: 69.57 ± 0.35
[I 2023-06-11 23:31:36,289] Trial 173 finished with value: 71.5999984741211 and parameters: {'Fwd': 0.017454881596339455, 'K': 8, 'alpha': 0.0, 'dropout': 0.9, 'gnnepoch': 120, 'lambda1': 1.0, 'lambda2': 5.052876544433137, 'loop': 0, 'loss': 'CE', 'lr': 0.0032839052120195596, 'softmaxF': False, 'useGCN': True, 'weight_decay': 4.587211432633404e-06, 'weightedloss': False}. Best is trial 146 with value: 71.86666870117188.
/home/wxy/miniconda3/lib/python3.10/site-packages/optuna/distributions.py:685: UserWarning: The distribution is specified by [0, 1.00001] and step=0.05, but the range is not divisible by `step`. It will be replaced by [0, 1.0].
  warnings.warn(
K:  8
alpha:  0.30000000000000004
lr:  0.0029733250045401666
weight_decay:  1.6401685273807903e-06
dropout:  0.9
fix split and run 3 times
Data: Data(x=[3327, 3703], y=[3327], train_mask=[3327], val_mask=[3327], test_mask=[3327], adj_t=[3327, 3327, nnz=9104])
num_train tensor(120)
num_noise 0
noise: tensor(0)
data feature 3703
ALTOPT(
  (lins): Sequential(
    (0): Linear(in_features=3703, out_features=64, bias=True)
    (1): BatchNorm1d(64, eps=1e-05, momentum=0.1, affine=True, track_running_stats=True)
    (2): Dropout(p=0.9, inplace=True)
    (3): ReLU(inplace=True)
    (4): Linear(in_features=64, out_features=6, bias=True)
    (5): LogSoftmax(dim=-1)
  )
  (prop): Propagation(K=8, mode=None, lambda1=None, lambda2=None, L21=True, alpha=0.30000000000000004)
  (gcn): GCN(
    (convs): ModuleList(
      (0): GCNConv(3703, 64)
      (1): GCNConv(64, 6)
    )
    (bns): ModuleList(
      (0): BatchNorm1d(64, eps=1e-05, momentum=0.1, affine=True, track_running_stats=True)
    )
    (output): LogSoftmax(dim=-1)
  )
)
propagate done
init label
Split: 01, Run: 01
None time:  1.1092660499271005
None Run 01:
Highest Train: 100.00
Highest Valid: 71.40
  Final Train: 100.00
   Final Test: 69.00
Split: 01, Run: 02
None time:  0.9677236538846046
None Run 02:
Highest Train: 100.00
Highest Valid: 71.80
  Final Train: 100.00
   Final Test: 69.90
Split: 01, Run: 03
None time:  1.0012323420960456
None Run 03:
Highest Train: 100.00
Highest Valid: 71.60
  Final Train: 100.00
   Final Test: 69.90
run time now: 3.1232244968414307
total time:  3.173890566918999
None All runs:
Highest Train: 100.00 ± 0.00
Highest Valid: 71.60 ± 0.20
  Final Train: 100.00 ± 0.00
   Final Test: 69.60 ± 0.52
[I 2023-06-11 23:31:39,946] Trial 174 finished with value: 71.60000610351562 and parameters: {'Fwd': 0.03001860865516318, 'K': 8, 'alpha': 0.30000000000000004, 'dropout': 0.9, 'gnnepoch': 120, 'lambda1': 0.9500000000000001, 'lambda2': 3.163185962263947, 'loop': 0, 'loss': 'CE', 'lr': 0.0029733250045401666, 'softmaxF': False, 'useGCN': True, 'weight_decay': 1.6401685273807903e-06, 'weightedloss': False}. Best is trial 146 with value: 71.86666870117188.
/home/wxy/miniconda3/lib/python3.10/site-packages/optuna/distributions.py:685: UserWarning: The distribution is specified by [0, 1.00001] and step=0.05, but the range is not divisible by `step`. It will be replaced by [0, 1.0].
  warnings.warn(
K:  8
alpha:  0.4
lr:  0.0027024471772974343
weight_decay:  2.551894771417788e-06
dropout:  0.9
fix split and run 3 times
Data: Data(x=[3327, 3703], y=[3327], train_mask=[3327], val_mask=[3327], test_mask=[3327], adj_t=[3327, 3327, nnz=9104])
num_train tensor(120)
num_noise 0
noise: tensor(0)
data feature 3703
ALTOPT(
  (lins): Sequential(
    (0): Linear(in_features=3703, out_features=64, bias=True)
    (1): BatchNorm1d(64, eps=1e-05, momentum=0.1, affine=True, track_running_stats=True)
    (2): Dropout(p=0.9, inplace=True)
    (3): ReLU(inplace=True)
    (4): Linear(in_features=64, out_features=6, bias=True)
    (5): LogSoftmax(dim=-1)
  )
  (prop): Propagation(K=8, mode=None, lambda1=None, lambda2=None, L21=True, alpha=0.4)
  (gcn): GCN(
    (convs): ModuleList(
      (0): GCNConv(3703, 64)
      (1): GCNConv(64, 6)
    )
    (bns): ModuleList(
      (0): BatchNorm1d(64, eps=1e-05, momentum=0.1, affine=True, track_running_stats=True)
    )
    (output): LogSoftmax(dim=-1)
  )
)
propagate done
init label
Split: 01, Run: 01
None time:  1.0276009349618107
None Run 01:
Highest Train: 100.00
Highest Valid: 71.00
  Final Train: 100.00
   Final Test: 69.30
Split: 01, Run: 02
None time:  1.0660067780409008
None Run 02:
Highest Train: 100.00
Highest Valid: 71.60
  Final Train: 100.00
   Final Test: 70.00
Split: 01, Run: 03
None time:  1.0487364172004163
None Run 03:
Highest Train: 100.00
Highest Valid: 71.80
  Final Train: 97.50
   Final Test: 70.90
run time now: 3.188887357711792
total time:  3.24520320398733
None All runs:
Highest Train: 100.00 ± 0.00
Highest Valid: 71.47 ± 0.42
  Final Train: 99.17 ± 1.44
   Final Test: 70.07 ± 0.80
[I 2023-06-11 23:31:43,621] Trial 175 finished with value: 71.46666717529297 and parameters: {'Fwd': 0.0065762368265787925, 'K': 8, 'alpha': 0.4, 'dropout': 0.9, 'gnnepoch': 120, 'lambda1': 0.9, 'lambda2': 2.782960132357182, 'loop': 0, 'loss': 'CE', 'lr': 0.0027024471772974343, 'softmaxF': False, 'useGCN': True, 'weight_decay': 2.551894771417788e-06, 'weightedloss': False}. Best is trial 146 with value: 71.86666870117188.
/home/wxy/miniconda3/lib/python3.10/site-packages/optuna/distributions.py:685: UserWarning: The distribution is specified by [0, 1.00001] and step=0.05, but the range is not divisible by `step`. It will be replaced by [0, 1.0].
  warnings.warn(
K:  7
alpha:  0.1
lr:  0.0024330109785023492
weight_decay:  2.089688828550243e-06
dropout:  0.9
fix split and run 3 times
Data: Data(x=[3327, 3703], y=[3327], train_mask=[3327], val_mask=[3327], test_mask=[3327], adj_t=[3327, 3327, nnz=9104])
num_train tensor(120)
num_noise 0
noise: tensor(0)
data feature 3703
ALTOPT(
  (lins): Sequential(
    (0): Linear(in_features=3703, out_features=64, bias=True)
    (1): BatchNorm1d(64, eps=1e-05, momentum=0.1, affine=True, track_running_stats=True)
    (2): Dropout(p=0.9, inplace=True)
    (3): ReLU(inplace=True)
    (4): Linear(in_features=64, out_features=6, bias=True)
    (5): LogSoftmax(dim=-1)
  )
  (prop): Propagation(K=7, mode=None, lambda1=None, lambda2=None, L21=True, alpha=0.1)
  (gcn): GCN(
    (convs): ModuleList(
      (0): GCNConv(3703, 64)
      (1): GCNConv(64, 6)
    )
    (bns): ModuleList(
      (0): BatchNorm1d(64, eps=1e-05, momentum=0.1, affine=True, track_running_stats=True)
    )
    (output): LogSoftmax(dim=-1)
  )
)
propagate done
init label
Split: 01, Run: 01
None time:  0.9937932079192251
None Run 01:
Highest Train: 100.00
Highest Valid: 71.20
  Final Train: 100.00
   Final Test: 69.50
Split: 01, Run: 02
None time:  1.036019089864567
None Run 02:
Highest Train: 100.00
Highest Valid: 71.80
  Final Train: 100.00
   Final Test: 70.00
Split: 01, Run: 03
None time:  1.0161553889047354
None Run 03:
Highest Train: 100.00
Highest Valid: 71.80
  Final Train: 100.00
   Final Test: 70.20
run time now: 3.0859241485595703
total time:  3.144197568995878
None All runs:
Highest Train: 100.00 ± 0.00
Highest Valid: 71.60 ± 0.35
  Final Train: 100.00 ± 0.00
   Final Test: 69.90 ± 0.36
[I 2023-06-11 23:31:47,198] Trial 176 finished with value: 71.5999984741211 and parameters: {'Fwd': 0.010510088013727065, 'K': 7, 'alpha': 0.1, 'dropout': 0.9, 'gnnepoch': 120, 'lambda1': 1.0, 'lambda2': 2.4618935819196297, 'loop': 0, 'loss': 'CE', 'lr': 0.0024330109785023492, 'softmaxF': False, 'useGCN': True, 'weight_decay': 2.089688828550243e-06, 'weightedloss': False}. Best is trial 146 with value: 71.86666870117188.
/home/wxy/miniconda3/lib/python3.10/site-packages/optuna/distributions.py:685: UserWarning: The distribution is specified by [0, 1.00001] and step=0.05, but the range is not divisible by `step`. It will be replaced by [0, 1.0].
  warnings.warn(
K:  9
alpha:  0.25
lr:  0.0037983113272353703
weight_decay:  1.5539818525592502e-06
dropout:  0.9
fix split and run 3 times
Data: Data(x=[3327, 3703], y=[3327], train_mask=[3327], val_mask=[3327], test_mask=[3327], adj_t=[3327, 3327, nnz=9104])
num_train tensor(120)
num_noise 0
noise: tensor(0)
data feature 3703
ALTOPT(
  (lins): Sequential(
    (0): Linear(in_features=3703, out_features=64, bias=True)
    (1): BatchNorm1d(64, eps=1e-05, momentum=0.1, affine=True, track_running_stats=True)
    (2): Dropout(p=0.9, inplace=True)
    (3): ReLU(inplace=True)
    (4): Linear(in_features=64, out_features=6, bias=True)
    (5): LogSoftmax(dim=-1)
  )
  (prop): Propagation(K=9, mode=None, lambda1=None, lambda2=None, L21=True, alpha=0.25)
  (gcn): GCN(
    (convs): ModuleList(
      (0): GCNConv(3703, 64)
      (1): GCNConv(64, 6)
    )
    (bns): ModuleList(
      (0): BatchNorm1d(64, eps=1e-05, momentum=0.1, affine=True, track_running_stats=True)
    )
    (output): LogSoftmax(dim=-1)
  )
)
propagate done
init label
Split: 01, Run: 01
None time:  1.0664645968936384
None Run 01:
Highest Train: 100.00
Highest Valid: 71.40
  Final Train: 99.17
   Final Test: 69.60
Split: 01, Run: 02
None time:  1.080021157860756
None Run 02:
Highest Train: 100.00
Highest Valid: 71.60
  Final Train: 100.00
   Final Test: 70.00
Split: 01, Run: 03
None time:  1.08150061708875
None Run 03:
Highest Train: 100.00
Highest Valid: 71.40
  Final Train: 99.17
   Final Test: 70.40
run time now: 3.2761905193328857
total time:  3.337871190859005
None All runs:
Highest Train: 100.00 ± 0.00
Highest Valid: 71.47 ± 0.12
  Final Train: 99.44 ± 0.48
   Final Test: 70.00 ± 0.40
[I 2023-06-11 23:31:50,946] Trial 177 finished with value: 71.46666717529297 and parameters: {'Fwd': 0.01392829561364131, 'K': 9, 'alpha': 0.25, 'dropout': 0.9, 'gnnepoch': 120, 'lambda1': 0.9500000000000001, 'lambda2': 3.2098891029086523, 'loop': 0, 'loss': 'CE', 'lr': 0.0037983113272353703, 'softmaxF': False, 'useGCN': True, 'weight_decay': 1.5539818525592502e-06, 'weightedloss': False}. Best is trial 146 with value: 71.86666870117188.
/home/wxy/miniconda3/lib/python3.10/site-packages/optuna/distributions.py:685: UserWarning: The distribution is specified by [0, 1.00001] and step=0.05, but the range is not divisible by `step`. It will be replaced by [0, 1.0].
  warnings.warn(
K:  8
alpha:  0.5
lr:  0.0016844938755317547
weight_decay:  3.3163277418741537e-06
dropout:  0.9
fix split and run 3 times
Data: Data(x=[3327, 3703], y=[3327], train_mask=[3327], val_mask=[3327], test_mask=[3327], adj_t=[3327, 3327, nnz=9104])
num_train tensor(120)
num_noise 0
noise: tensor(0)
data feature 3703
ALTOPT(
  (lins): Sequential(
    (0): Linear(in_features=3703, out_features=64, bias=True)
    (1): BatchNorm1d(64, eps=1e-05, momentum=0.1, affine=True, track_running_stats=True)
    (2): Dropout(p=0.9, inplace=True)
    (3): ReLU(inplace=True)
    (4): Linear(in_features=64, out_features=6, bias=True)
    (5): LogSoftmax(dim=-1)
  )
  (prop): Propagation(K=8, mode=None, lambda1=None, lambda2=None, L21=True, alpha=0.5)
  (gcn): GCN(
    (convs): ModuleList(
      (0): GCNConv(3703, 64)
      (1): GCNConv(64, 6)
    )
    (bns): ModuleList(
      (0): BatchNorm1d(64, eps=1e-05, momentum=0.1, affine=True, track_running_stats=True)
    )
    (output): LogSoftmax(dim=-1)
  )
)
propagate done
init label
Split: 01, Run: 01
None time:  1.0697872380260378
None Run 01:
Highest Train: 100.00
Highest Valid: 71.00
  Final Train: 100.00
   Final Test: 69.30
Split: 01, Run: 02
None time:  0.9453411039430648
None Run 02:
Highest Train: 100.00
Highest Valid: 69.20
  Final Train: 99.17
   Final Test: 69.00
Split: 01, Run: 03
None time:  0.8975068600848317
None Run 03:
Highest Train: 100.00
Highest Valid: 71.00
  Final Train: 100.00
   Final Test: 70.60
run time now: 2.959901809692383
total time:  3.0143708910327405
None All runs:
Highest Train: 100.00 ± 0.00
Highest Valid: 70.40 ± 1.04
  Final Train: 99.72 ± 0.48
   Final Test: 69.63 ± 0.85
[I 2023-06-11 23:31:54,389] Trial 178 finished with value: 70.4000015258789 and parameters: {'Fwd': 0.00852538047716825, 'K': 8, 'alpha': 0.5, 'dropout': 0.9, 'gnnepoch': 110, 'lambda1': 0.9, 'lambda2': 2.606304116191394, 'loop': 0, 'loss': 'CE', 'lr': 0.0016844938755317547, 'softmaxF': False, 'useGCN': True, 'weight_decay': 3.3163277418741537e-06, 'weightedloss': False}. Best is trial 146 with value: 71.86666870117188.
/home/wxy/miniconda3/lib/python3.10/site-packages/optuna/distributions.py:685: UserWarning: The distribution is specified by [0, 1.00001] and step=0.05, but the range is not divisible by `step`. It will be replaced by [0, 1.0].
  warnings.warn(
K:  8
alpha:  0.45
lr:  0.001337349687677668
weight_decay:  1.2634613437191103e-06
dropout:  0.9
fix split and run 3 times
Data: Data(x=[3327, 3703], y=[3327], train_mask=[3327], val_mask=[3327], test_mask=[3327], adj_t=[3327, 3327, nnz=9104])
num_train tensor(120)
num_noise 0
noise: tensor(0)
data feature 3703
ALTOPT(
  (lins): Sequential(
    (0): Linear(in_features=3703, out_features=64, bias=True)
    (1): BatchNorm1d(64, eps=1e-05, momentum=0.1, affine=True, track_running_stats=True)
    (2): Dropout(p=0.9, inplace=True)
    (3): ReLU(inplace=True)
    (4): Linear(in_features=64, out_features=6, bias=True)
    (5): LogSoftmax(dim=-1)
  )
  (prop): Propagation(K=8, mode=None, lambda1=None, lambda2=None, L21=True, alpha=0.45)
  (gcn): GCN(
    (convs): ModuleList(
      (0): GCNConv(3703, 64)
      (1): GCNConv(64, 6)
    )
    (bns): ModuleList(
      (0): BatchNorm1d(64, eps=1e-05, momentum=0.1, affine=True, track_running_stats=True)
    )
    (output): LogSoftmax(dim=-1)
  )
)
propagate done
init label
Split: 01, Run: 01
None time:  1.0377010439988226
None Run 01:
Highest Train: 100.00
Highest Valid: 70.60
  Final Train: 100.00
   Final Test: 68.70
Split: 01, Run: 02
None time:  1.016178318997845
None Run 02:
Highest Train: 100.00
Highest Valid: 71.00
  Final Train: 100.00
   Final Test: 69.70
Split: 01, Run: 03
None time:  1.061450146138668
None Run 03:
Highest Train: 100.00
Highest Valid: 72.20
  Final Train: 100.00
   Final Test: 70.70
run time now: 3.1568613052368164
total time:  3.216365342028439
None All runs:
Highest Train: 100.00 ± 0.00
Highest Valid: 71.27 ± 0.83
  Final Train: 100.00 ± 0.00
   Final Test: 69.70 ± 1.00
