[I 2023-06-12 00:41:58,851] Trial 314 finished with value: 82.4666748046875 and parameters: {'Fwd': 2.129517768027047e-05, 'K': 10, 'alpha': 0.9500000000000001, 'dropout': 0.8, 'gnnepoch': 60, 'lambda1': 0.8500000000000001, 'lambda2': 5.415259294227758, 'loop': 1, 'loss': 'MSE', 'lr': 0.0034720692921094186, 'softmaxF': True, 'useGCN': False, 'weight_decay': 0.008790143161086752, 'weightedloss': False}. Best is trial 205 with value: 83.53333282470703.
/home/wxy/miniconda3/lib/python3.10/site-packages/optuna/distributions.py:685: UserWarning: The distribution is specified by [0, 1.00001] and step=0.05, but the range is not divisible by `step`. It will be replaced by [0, 1.0].
  warnings.warn(
K:  10
alpha:  0.9500000000000001
lr:  0.002726463455564346
weight_decay:  1.2526360665856374e-05
dropout:  0.9
fix split and run 3 times
Data: Data(x=[19717, 500], y=[19717], train_mask=[19717], val_mask=[19717], test_mask=[19717], adj_t=[19717, 19717, nnz=88648])
num_train tensor(60)
num_noise 0
noise: tensor(0)
data feature 500
ALTOPT(
  (lins): Sequential(
    (0): Linear(in_features=500, out_features=64, bias=True)
    (1): BatchNorm1d(64, eps=1e-05, momentum=0.1, affine=True, track_running_stats=True)
    (2): Dropout(p=0.9, inplace=True)
    (3): ReLU(inplace=True)
    (4): Linear(in_features=64, out_features=3, bias=True)
    (5): Identity()
  )
  (prop): Propagation(K=10, mode=None, lambda1=None, lambda2=None, L21=True, alpha=0.9500000000000001)
  (gcn): GCN(
    (convs): ModuleList(
      (0): GCNConv(500, 64)
      (1): GCNConv(64, 3)
    )
    (bns): ModuleList(
      (0): BatchNorm1d(64, eps=1e-05, momentum=0.1, affine=True, track_running_stats=True)
    )
    (output): Identity()
  )
)
propagate done
init label
Split: 01, Run: 01
None time:  1.987074235919863
None Run 01:
Highest Train: 100.00
Highest Valid: 83.00
  Final Train: 100.00
   Final Test: 78.10
Split: 01, Run: 02
None time:  1.1227298439480364
None Run 02:
Highest Train: 100.00
Highest Valid: 81.40
  Final Train: 100.00
   Final Test: 80.10
Split: 01, Run: 03
None time:  0.7962323790416121
None Run 03:
Highest Train: 100.00
Highest Valid: 82.60
  Final Train: 100.00
   Final Test: 80.30
run time now: 3.9566452503204346
total time:  4.011656323913485
None All runs:
Highest Train: 100.00 ± 0.00
Highest Valid: 82.33 ± 0.83
  Final Train: 100.00 ± 0.00
   Final Test: 79.50 ± 1.22
[I 2023-06-12 00:42:03,413] Trial 315 finished with value: 82.33333587646484 and parameters: {'Fwd': 2.8139475527161066e-06, 'K': 10, 'alpha': 0.9500000000000001, 'dropout': 0.9, 'gnnepoch': 70, 'lambda1': 0.7000000000000001, 'lambda2': 5.775988096754397, 'loop': 1, 'loss': 'MSE', 'lr': 0.002726463455564346, 'softmaxF': True, 'useGCN': False, 'weight_decay': 1.2526360665856374e-05, 'weightedloss': False}. Best is trial 205 with value: 83.53333282470703.
/home/wxy/miniconda3/lib/python3.10/site-packages/optuna/distributions.py:685: UserWarning: The distribution is specified by [0, 1.00001] and step=0.05, but the range is not divisible by `step`. It will be replaced by [0, 1.0].
  warnings.warn(
K:  10
alpha:  1.0
lr:  0.0008943635836844625
weight_decay:  0.017733875146247528
dropout:  0.9
fix split and run 3 times
Data: Data(x=[19717, 500], y=[19717], train_mask=[19717], val_mask=[19717], test_mask=[19717], adj_t=[19717, 19717, nnz=88648])
num_train tensor(60)
num_noise 0
noise: tensor(0)
data feature 500
ALTOPT(
  (lins): Sequential(
    (0): Linear(in_features=500, out_features=64, bias=True)
    (1): BatchNorm1d(64, eps=1e-05, momentum=0.1, affine=True, track_running_stats=True)
    (2): Dropout(p=0.9, inplace=True)
    (3): ReLU(inplace=True)
    (4): Linear(in_features=64, out_features=3, bias=True)
    (5): Identity()
  )
  (prop): Propagation(K=10, mode=None, lambda1=None, lambda2=None, L21=True, alpha=1.0)
  (gcn): GCN(
    (convs): ModuleList(
      (0): GCNConv(500, 64)
      (1): GCNConv(64, 3)
    )
    (bns): ModuleList(
      (0): BatchNorm1d(64, eps=1e-05, momentum=0.1, affine=True, track_running_stats=True)
    )
    (output): Identity()
  )
)
propagate done
init label
Split: 01, Run: 01
None time:  1.5409457799978554
None Run 01:
Highest Train: 100.00
Highest Valid: 81.80
  Final Train: 100.00
   Final Test: 76.70
Split: 01, Run: 02
None time:  1.8877993731293827
None Run 02:
Highest Train: 100.00
Highest Valid: 83.60
  Final Train: 100.00
   Final Test: 79.30
Split: 01, Run: 03
None time:  1.7557803399395198
None Run 03:
Highest Train: 100.00
Highest Valid: 81.80
  Final Train: 100.00
   Final Test: 78.40
run time now: 5.268235921859741
total time:  5.323403293034062
None All runs:
Highest Train: 100.00 ± 0.00
Highest Valid: 82.40 ± 1.04
  Final Train: 100.00 ± 0.00
   Final Test: 78.13 ± 1.32
[I 2023-06-12 00:42:09,294] Trial 316 finished with value: 82.4000015258789 and parameters: {'Fwd': 5.436292853077178e-06, 'K': 10, 'alpha': 1.0, 'dropout': 0.9, 'gnnepoch': 60, 'lambda1': 0.8, 'lambda2': 2.9760026659561998, 'loop': 1, 'loss': 'MSE', 'lr': 0.0008943635836844625, 'softmaxF': True, 'useGCN': False, 'weight_decay': 0.017733875146247528, 'weightedloss': False}. Best is trial 205 with value: 83.53333282470703.
/home/wxy/miniconda3/lib/python3.10/site-packages/optuna/distributions.py:685: UserWarning: The distribution is specified by [0, 1.00001] and step=0.05, but the range is not divisible by `step`. It will be replaced by [0, 1.0].
  warnings.warn(
K:  10
alpha:  0.9
lr:  0.002438249182798589
weight_decay:  0.013075031373006122
dropout:  0.9
fix split and run 3 times
Data: Data(x=[19717, 500], y=[19717], train_mask=[19717], val_mask=[19717], test_mask=[19717], adj_t=[19717, 19717, nnz=88648])
num_train tensor(60)
num_noise 0
noise: tensor(0)
data feature 500
ALTOPT(
  (lins): Sequential(
    (0): Linear(in_features=500, out_features=64, bias=True)
    (1): BatchNorm1d(64, eps=1e-05, momentum=0.1, affine=True, track_running_stats=True)
    (2): Dropout(p=0.9, inplace=True)
    (3): ReLU(inplace=True)
    (4): Linear(in_features=64, out_features=3, bias=True)
    (5): Identity()
  )
  (prop): Propagation(K=10, mode=None, lambda1=None, lambda2=None, L21=True, alpha=0.9)
  (gcn): GCN(
    (convs): ModuleList(
      (0): GCNConv(500, 64)
      (1): GCNConv(64, 3)
    )
    (bns): ModuleList(
      (0): BatchNorm1d(64, eps=1e-05, momentum=0.1, affine=True, track_running_stats=True)
    )
    (output): Identity()
  )
)
propagate done
init label
Split: 01, Run: 01
None time:  0.8959583470132202
None Run 01:
Highest Train: 100.00
Highest Valid: 69.80
  Final Train: 100.00
   Final Test: 69.60
Split: 01, Run: 02
None time:  1.8139283880591393
None Run 02:
Highest Train: 100.00
Highest Valid: 82.40
  Final Train: 98.33
   Final Test: 78.90
Split: 01, Run: 03
None time:  0.8204503750894219
None Run 03:
Highest Train: 100.00
Highest Valid: 81.80
  Final Train: 100.00
   Final Test: 79.40
run time now: 3.580777883529663
total time:  3.63384118094109
None All runs:
Highest Train: 100.00 ± 0.00
Highest Valid: 78.00 ± 7.11
  Final Train: 99.44 ± 0.96
   Final Test: 75.97 ± 5.52
[I 2023-06-12 00:42:13,464] Trial 317 finished with value: 78.00000762939453 and parameters: {'Fwd': 5.3277108765273716e-05, 'K': 10, 'alpha': 0.9, 'dropout': 0.9, 'gnnepoch': 50, 'lambda1': 0.8500000000000001, 'lambda2': 0.5032301339079583, 'loop': 1, 'loss': 'MSE', 'lr': 0.002438249182798589, 'softmaxF': True, 'useGCN': False, 'weight_decay': 0.013075031373006122, 'weightedloss': False}. Best is trial 205 with value: 83.53333282470703.
/home/wxy/miniconda3/lib/python3.10/site-packages/optuna/distributions.py:685: UserWarning: The distribution is specified by [0, 1.00001] and step=0.05, but the range is not divisible by `step`. It will be replaced by [0, 1.0].
  warnings.warn(
K:  10
alpha:  0.9500000000000001
lr:  0.0021877041676708836
weight_decay:  0.006348991952004367
dropout:  0.9
fix split and run 3 times
Data: Data(x=[19717, 500], y=[19717], train_mask=[19717], val_mask=[19717], test_mask=[19717], adj_t=[19717, 19717, nnz=88648])
num_train tensor(60)
num_noise 0
noise: tensor(0)
data feature 500
ALTOPT(
  (lins): Sequential(
    (0): Linear(in_features=500, out_features=64, bias=True)
    (1): BatchNorm1d(64, eps=1e-05, momentum=0.1, affine=True, track_running_stats=True)
    (2): Dropout(p=0.9, inplace=True)
    (3): ReLU(inplace=True)
    (4): Linear(in_features=64, out_features=3, bias=True)
    (5): Identity()
  )
  (prop): Propagation(K=10, mode=None, lambda1=None, lambda2=None, L21=True, alpha=0.9500000000000001)
  (gcn): GCN(
    (convs): ModuleList(
      (0): GCNConv(500, 64)
      (1): GCNConv(64, 3)
    )
    (bns): ModuleList(
      (0): BatchNorm1d(64, eps=1e-05, momentum=0.1, affine=True, track_running_stats=True)
    )
    (output): Identity()
  )
)
propagate done
init label
Split: 01, Run: 01
None time:  2.3118503629229963
None Run 01:
Highest Train: 100.00
Highest Valid: 81.40
  Final Train: 100.00
   Final Test: 77.60
Split: 01, Run: 02
None time:  1.0634190409909934
None Run 02:
Highest Train: 100.00
Highest Valid: 83.00
  Final Train: 100.00
   Final Test: 80.80
Split: 01, Run: 03
None time:  2.3584710829891264
None Run 03:
Highest Train: 100.00
Highest Valid: 84.40
  Final Train: 100.00
   Final Test: 80.50
run time now: 5.785236597061157
total time:  5.827720395056531
None All runs:
Highest Train: 100.00 ± 0.00
Highest Valid: 82.93 ± 1.50
  Final Train: 100.00 ± 0.00
   Final Test: 79.63 ± 1.77
[I 2023-06-12 00:42:19,794] Trial 318 finished with value: 82.9333267211914 and parameters: {'Fwd': 7.227199934071725e-06, 'K': 10, 'alpha': 0.9500000000000001, 'dropout': 0.9, 'gnnepoch': 60, 'lambda1': 0.75, 'lambda2': 6.207725279513693, 'loop': 1, 'loss': 'MSE', 'lr': 0.0021877041676708836, 'softmaxF': True, 'useGCN': False, 'weight_decay': 0.006348991952004367, 'weightedloss': False}. Best is trial 205 with value: 83.53333282470703.
/home/wxy/miniconda3/lib/python3.10/site-packages/optuna/distributions.py:685: UserWarning: The distribution is specified by [0, 1.00001] and step=0.05, but the range is not divisible by `step`. It will be replaced by [0, 1.0].
  warnings.warn(
K:  10
alpha:  1.0
lr:  0.0019255367878744962
weight_decay:  0.004653116112451502
dropout:  0.9
fix split and run 3 times
Data: Data(x=[19717, 500], y=[19717], train_mask=[19717], val_mask=[19717], test_mask=[19717], adj_t=[19717, 19717, nnz=88648])
num_train tensor(60)
num_noise 0
noise: tensor(0)
data feature 500
ALTOPT(
  (lins): Sequential(
    (0): Linear(in_features=500, out_features=64, bias=True)
    (1): BatchNorm1d(64, eps=1e-05, momentum=0.1, affine=True, track_running_stats=True)
    (2): Dropout(p=0.9, inplace=True)
    (3): ReLU(inplace=True)
    (4): Linear(in_features=64, out_features=3, bias=True)
    (5): Identity()
  )
  (prop): Propagation(K=10, mode=None, lambda1=None, lambda2=None, L21=True, alpha=1.0)
  (gcn): GCN(
    (convs): ModuleList(
      (0): GCNConv(500, 64)
      (1): GCNConv(64, 3)
    )
    (bns): ModuleList(
      (0): BatchNorm1d(64, eps=1e-05, momentum=0.1, affine=True, track_running_stats=True)
    )
    (output): Identity()
  )
)
propagate done
init label
Split: 01, Run: 01
None time:  2.897012688918039
None Run 01:
Highest Train: 100.00
Highest Valid: 82.40
  Final Train: 100.00
   Final Test: 78.00
Split: 01, Run: 02
None time:  2.4182140410412103
None Run 02:
Highest Train: 100.00
Highest Valid: 80.00
  Final Train: 100.00
   Final Test: 78.60
Split: 01, Run: 03
None time:  1.0941127710975707
None Run 03:
Highest Train: 100.00
Highest Valid: 83.20
  Final Train: 100.00
   Final Test: 79.70
run time now: 6.4547154903411865
total time:  6.49771687714383
None All runs:
Highest Train: 100.00 ± 0.00
Highest Valid: 81.87 ± 1.67
  Final Train: 100.00 ± 0.00
   Final Test: 78.77 ± 0.86
[I 2023-06-12 00:42:26,795] Trial 319 finished with value: 81.86666870117188 and parameters: {'Fwd': 7.388091605399882e-06, 'K': 10, 'alpha': 1.0, 'dropout': 0.9, 'gnnepoch': 60, 'lambda1': 0.75, 'lambda2': 6.192497202914316, 'loop': 1, 'loss': 'MSE', 'lr': 0.0019255367878744962, 'softmaxF': True, 'useGCN': False, 'weight_decay': 0.004653116112451502, 'weightedloss': False}. Best is trial 205 with value: 83.53333282470703.
/home/wxy/miniconda3/lib/python3.10/site-packages/optuna/distributions.py:685: UserWarning: The distribution is specified by [0, 1.00001] and step=0.05, but the range is not divisible by `step`. It will be replaced by [0, 1.0].
  warnings.warn(
K:  10
alpha:  0.9500000000000001
lr:  0.0021273903118712487
weight_decay:  0.0062063661706850265
dropout:  0.9
fix split and run 3 times
Data: Data(x=[19717, 500], y=[19717], train_mask=[19717], val_mask=[19717], test_mask=[19717], adj_t=[19717, 19717, nnz=88648])
num_train tensor(60)
num_noise 0
noise: tensor(0)
data feature 500
ALTOPT(
  (lins): Sequential(
    (0): Linear(in_features=500, out_features=64, bias=True)
    (1): BatchNorm1d(64, eps=1e-05, momentum=0.1, affine=True, track_running_stats=True)
    (2): Dropout(p=0.9, inplace=True)
    (3): ReLU(inplace=True)
    (4): Linear(in_features=64, out_features=3, bias=True)
    (5): Identity()
  )
  (prop): Propagation(K=10, mode=None, lambda1=None, lambda2=None, L21=True, alpha=0.9500000000000001)
  (gcn): GCN(
    (convs): ModuleList(
      (0): GCNConv(500, 64)
      (1): GCNConv(64, 3)
    )
    (bns): ModuleList(
      (0): BatchNorm1d(64, eps=1e-05, momentum=0.1, affine=True, track_running_stats=True)
    )
    (output): Identity()
  )
)
propagate done
init label
Split: 01, Run: 01
None time:  1.8432921858038753
None Run 01:
Highest Train: 100.00
Highest Valid: 81.40
  Final Train: 100.00
   Final Test: 78.10
Split: 01, Run: 02
None time:  1.5248028188943863
None Run 02:
Highest Train: 100.00
Highest Valid: 81.20
  Final Train: 100.00
   Final Test: 78.80
Split: 01, Run: 03
None time:  1.3369224229827523
None Run 03:
Highest Train: 100.00
Highest Valid: 82.60
  Final Train: 100.00
   Final Test: 80.10
run time now: 4.753671169281006
total time:  4.79900686792098
None All runs:
Highest Train: 100.00 ± 0.00
Highest Valid: 81.73 ± 0.76
  Final Train: 100.00 ± 0.00
   Final Test: 79.00 ± 1.01
[I 2023-06-12 00:42:32,196] Trial 320 finished with value: 81.73333740234375 and parameters: {'Fwd': 1.0461604687633243e-05, 'K': 10, 'alpha': 0.9500000000000001, 'dropout': 0.9, 'gnnepoch': 60, 'lambda1': 0.7000000000000001, 'lambda2': 6.391053993876254, 'loop': 2, 'loss': 'MSE', 'lr': 0.0021273903118712487, 'softmaxF': True, 'useGCN': False, 'weight_decay': 0.0062063661706850265, 'weightedloss': False}. Best is trial 205 with value: 83.53333282470703.
/home/wxy/miniconda3/lib/python3.10/site-packages/optuna/distributions.py:685: UserWarning: The distribution is specified by [0, 1.00001] and step=0.05, but the range is not divisible by `step`. It will be replaced by [0, 1.0].
  warnings.warn(
K:  10
alpha:  0.9500000000000001
lr:  0.002265896453134264
weight_decay:  2.7792619346989192e-05
dropout:  0.9
fix split and run 3 times
Data: Data(x=[19717, 500], y=[19717], train_mask=[19717], val_mask=[19717], test_mask=[19717], adj_t=[19717, 19717, nnz=88648])
num_train tensor(60)
num_noise 0
noise: tensor(0)
data feature 500
ALTOPT(
  (lins): Sequential(
    (0): Linear(in_features=500, out_features=64, bias=True)
    (1): BatchNorm1d(64, eps=1e-05, momentum=0.1, affine=True, track_running_stats=True)
    (2): Dropout(p=0.9, inplace=True)
    (3): ReLU(inplace=True)
    (4): Linear(in_features=64, out_features=3, bias=True)
    (5): Identity()
  )
  (prop): Propagation(K=10, mode=None, lambda1=None, lambda2=None, L21=True, alpha=0.9500000000000001)
  (gcn): GCN(
    (convs): ModuleList(
      (0): GCNConv(500, 64)
      (1): GCNConv(64, 3)
    )
    (bns): ModuleList(
      (0): BatchNorm1d(64, eps=1e-05, momentum=0.1, affine=True, track_running_stats=True)
    )
    (output): Identity()
  )
)
propagate done
init label
Split: 01, Run: 01
None time:  2.156911397119984
None Run 01:
Highest Train: 100.00
Highest Valid: 81.40
  Final Train: 100.00
   Final Test: 77.80
Split: 01, Run: 02
None time:  1.0374930119141936
None Run 02:
Highest Train: 100.00
Highest Valid: 75.00
  Final Train: 100.00
   Final Test: 74.00
Split: 01, Run: 03
None time:  1.272950991988182
None Run 03:
Highest Train: 100.00
Highest Valid: 82.60
  Final Train: 100.00
   Final Test: 80.10
run time now: 4.517528533935547
total time:  4.567242731805891
None All runs:
Highest Train: 100.00 ± 0.00
Highest Valid: 79.67 ± 4.09
  Final Train: 100.00 ± 0.00
   Final Test: 77.30 ± 3.08
[I 2023-06-12 00:42:37,241] Trial 321 finished with value: 79.66666412353516 and parameters: {'Fwd': 1.599626066543919e-05, 'K': 10, 'alpha': 0.9500000000000001, 'dropout': 0.9, 'gnnepoch': 60, 'lambda1': 0.7000000000000001, 'lambda2': 6.062428947853349, 'loop': 1, 'loss': 'MSE', 'lr': 0.002265896453134264, 'softmaxF': True, 'useGCN': False, 'weight_decay': 2.7792619346989192e-05, 'weightedloss': False}. Best is trial 205 with value: 83.53333282470703.
/home/wxy/miniconda3/lib/python3.10/site-packages/optuna/distributions.py:685: UserWarning: The distribution is specified by [0, 1.00001] and step=0.05, but the range is not divisible by `step`. It will be replaced by [0, 1.0].
  warnings.warn(
K:  10
alpha:  0.9
lr:  0.0062961735388683045
weight_decay:  0.0036788228420158607
dropout:  0.9
fix split and run 3 times
Data: Data(x=[19717, 500], y=[19717], train_mask=[19717], val_mask=[19717], test_mask=[19717], adj_t=[19717, 19717, nnz=88648])
num_train tensor(60)
num_noise 0
noise: tensor(0)
data feature 500
ALTOPT(
  (lins): Sequential(
    (0): Linear(in_features=500, out_features=64, bias=True)
    (1): BatchNorm1d(64, eps=1e-05, momentum=0.1, affine=True, track_running_stats=True)
    (2): Dropout(p=0.9, inplace=True)
    (3): ReLU(inplace=True)
    (4): Linear(in_features=64, out_features=3, bias=True)
    (5): Identity()
  )
  (prop): Propagation(K=10, mode=None, lambda1=None, lambda2=None, L21=True, alpha=0.9)
  (gcn): GCN(
    (convs): ModuleList(
      (0): GCNConv(500, 64)
      (1): GCNConv(64, 3)
    )
    (bns): ModuleList(
      (0): BatchNorm1d(64, eps=1e-05, momentum=0.1, affine=True, track_running_stats=True)
    )
    (output): Identity()
  )
)
propagate done
init label
Split: 01, Run: 01
None time:  0.8548918669112027
None Run 01:
Highest Train: 100.00
Highest Valid: 69.40
  Final Train: 100.00
   Final Test: 69.30
Split: 01, Run: 02
None time:  1.020719091873616
None Run 02:
Highest Train: 100.00
Highest Valid: 80.80
  Final Train: 100.00
   Final Test: 77.10
Split: 01, Run: 03
None time:  0.9739398269448429
None Run 03:
Highest Train: 100.00
Highest Valid: 81.40
  Final Train: 100.00
   Final Test: 78.00
run time now: 2.897711992263794
total time:  2.9420674650464207
None All runs:
Highest Train: 100.00 ± 0.00
Highest Valid: 77.20 ± 6.76
  Final Train: 100.00 ± 0.00
   Final Test: 74.80 ± 4.78
[I 2023-06-12 00:42:40,668] Trial 322 finished with value: 77.20000457763672 and parameters: {'Fwd': 4.040600597939461e-06, 'K': 10, 'alpha': 0.9, 'dropout': 0.9, 'gnnepoch': 50, 'lambda1': 0.75, 'lambda2': 5.064410883015345, 'loop': 1, 'loss': 'MSE', 'lr': 0.0062961735388683045, 'softmaxF': True, 'useGCN': False, 'weight_decay': 0.0036788228420158607, 'weightedloss': True}. Best is trial 205 with value: 83.53333282470703.
/home/wxy/miniconda3/lib/python3.10/site-packages/optuna/distributions.py:685: UserWarning: The distribution is specified by [0, 1.00001] and step=0.05, but the range is not divisible by `step`. It will be replaced by [0, 1.0].
  warnings.warn(
K:  10
alpha:  0.9500000000000001
lr:  0.0020273810338636636
weight_decay:  0.004935283981066827
dropout:  0.9
fix split and run 3 times
Data: Data(x=[19717, 500], y=[19717], train_mask=[19717], val_mask=[19717], test_mask=[19717], adj_t=[19717, 19717, nnz=88648])
num_train tensor(60)
num_noise 0
noise: tensor(0)
data feature 500
ALTOPT(
  (lins): Sequential(
    (0): Linear(in_features=500, out_features=64, bias=True)
    (1): BatchNorm1d(64, eps=1e-05, momentum=0.1, affine=True, track_running_stats=True)
    (2): Dropout(p=0.9, inplace=True)
    (3): ReLU(inplace=True)
    (4): Linear(in_features=64, out_features=3, bias=True)
    (5): LogSoftmax(dim=-1)
  )
  (prop): Propagation(K=10, mode=None, lambda1=None, lambda2=None, L21=True, alpha=0.9500000000000001)
  (gcn): GCN(
    (convs): ModuleList(
      (0): GCNConv(500, 64)
      (1): GCNConv(64, 3)
    )
    (bns): ModuleList(
      (0): BatchNorm1d(64, eps=1e-05, momentum=0.1, affine=True, track_running_stats=True)
    )
    (output): LogSoftmax(dim=-1)
  )
)
propagate done
init label
Split: 01, Run: 01
None time:  1.0950185358524323
None Run 01:
Highest Train: 100.00
Highest Valid: 78.60
  Final Train: 100.00
   Final Test: 75.30
Split: 01, Run: 02
None time:  1.1373029141686857
None Run 02:
Highest Train: 100.00
Highest Valid: 78.60
  Final Train: 98.33
   Final Test: 75.60
Split: 01, Run: 03
None time:  1.0541323630604893
None Run 03:
Highest Train: 100.00
Highest Valid: 79.60
  Final Train: 98.33
   Final Test: 77.70
run time now: 3.334990978240967
total time:  3.3837182510178536
None All runs:
Highest Train: 100.00 ± 0.00
Highest Valid: 78.93 ± 0.58
  Final Train: 98.89 ± 0.96
   Final Test: 76.20 ± 1.31
