[I 2023-06-11 23:36:51,725] Trial 260 finished with value: 71.60000610351562 and parameters: {'Fwd': 4.923646985188706e-06, 'K': 7, 'alpha': 0.5, 'dropout': 0.8, 'gnnepoch': 120, 'lambda1': 0.8500000000000001, 'lambda2': 4.2857462500306625, 'loop': 0, 'loss': 'CE', 'lr': 0.002500644949264951, 'softmaxF': False, 'useGCN': True, 'weight_decay': 4.414093735553406e-06, 'weightedloss': True}. Best is trial 203 with value: 71.93333435058594.
/home/wxy/miniconda3/lib/python3.10/site-packages/optuna/distributions.py:685: UserWarning: The distribution is specified by [0, 1.00001] and step=0.05, but the range is not divisible by `step`. It will be replaced by [0, 1.0].
  warnings.warn(
K:  7
alpha:  0.55
lr:  0.0019959953466395603
weight_decay:  6.547898773681213e-06
dropout:  0.8
fix split and run 3 times
Data: Data(x=[3327, 3703], y=[3327], train_mask=[3327], val_mask=[3327], test_mask=[3327], adj_t=[3327, 3327, nnz=9104])
num_train tensor(120)
num_noise 0
noise: tensor(0)
data feature 3703
ALTOPT(
  (lins): Sequential(
    (0): Linear(in_features=3703, out_features=64, bias=True)
    (1): BatchNorm1d(64, eps=1e-05, momentum=0.1, affine=True, track_running_stats=True)
    (2): Dropout(p=0.8, inplace=True)
    (3): ReLU(inplace=True)
    (4): Linear(in_features=64, out_features=6, bias=True)
    (5): LogSoftmax(dim=-1)
  )
  (prop): Propagation(K=7, mode=None, lambda1=None, lambda2=None, L21=True, alpha=0.55)
  (gcn): GCN(
    (convs): ModuleList(
      (0): GCNConv(3703, 64)
      (1): GCNConv(64, 6)
    )
    (bns): ModuleList(
      (0): BatchNorm1d(64, eps=1e-05, momentum=0.1, affine=True, track_running_stats=True)
    )
    (output): LogSoftmax(dim=-1)
  )
)
propagate done
init label
Split: 01, Run: 01
None time:  0.9338074850384146
None Run 01:
Highest Train: 100.00
Highest Valid: 71.20
  Final Train: 100.00
   Final Test: 69.90
Split: 01, Run: 02
None time:  0.9382758128922433
None Run 02:
Highest Train: 100.00
Highest Valid: 69.60
  Final Train: 100.00
   Final Test: 68.30
Split: 01, Run: 03
None time:  0.9351593188475817
None Run 03:
Highest Train: 100.00
Highest Valid: 71.40
  Final Train: 100.00
   Final Test: 70.50
run time now: 2.848410129547119
total time:  2.911984165897593
None All runs:
Highest Train: 100.00 ± 0.00
Highest Valid: 70.73 ± 0.99
  Final Train: 100.00 ± 0.00
   Final Test: 69.57 ± 1.14
[I 2023-06-11 23:36:55,139] Trial 261 finished with value: 70.73333740234375 and parameters: {'Fwd': 5.142198556586079e-05, 'K': 7, 'alpha': 0.55, 'dropout': 0.8, 'gnnepoch': 110, 'lambda1': 0.75, 'lambda2': 4.599964664020206, 'loop': 0, 'loss': 'CE', 'lr': 0.0019959953466395603, 'softmaxF': False, 'useGCN': True, 'weight_decay': 6.547898773681213e-06, 'weightedloss': True}. Best is trial 203 with value: 71.93333435058594.
/home/wxy/miniconda3/lib/python3.10/site-packages/optuna/distributions.py:685: UserWarning: The distribution is specified by [0, 1.00001] and step=0.05, but the range is not divisible by `step`. It will be replaced by [0, 1.0].
  warnings.warn(
K:  7
alpha:  0.5
lr:  0.0021900390717441228
weight_decay:  5.457995781508085e-06
dropout:  0.7000000000000001
fix split and run 3 times
Data: Data(x=[3327, 3703], y=[3327], train_mask=[3327], val_mask=[3327], test_mask=[3327], adj_t=[3327, 3327, nnz=9104])
num_train tensor(120)
num_noise 0
noise: tensor(0)
data feature 3703
ALTOPT(
  (lins): Sequential(
    (0): Linear(in_features=3703, out_features=64, bias=True)
    (1): BatchNorm1d(64, eps=1e-05, momentum=0.1, affine=True, track_running_stats=True)
    (2): Dropout(p=0.7000000000000001, inplace=True)
    (3): ReLU(inplace=True)
    (4): Linear(in_features=64, out_features=6, bias=True)
    (5): LogSoftmax(dim=-1)
  )
  (prop): Propagation(K=7, mode=None, lambda1=None, lambda2=None, L21=True, alpha=0.5)
  (gcn): GCN(
    (convs): ModuleList(
      (0): GCNConv(3703, 64)
      (1): GCNConv(64, 6)
    )
    (bns): ModuleList(
      (0): BatchNorm1d(64, eps=1e-05, momentum=0.1, affine=True, track_running_stats=True)
    )
    (output): LogSoftmax(dim=-1)
  )
)
propagate done
init label
Split: 01, Run: 01
None time:  1.027697263052687
None Run 01:
Highest Train: 100.00
Highest Valid: 71.60
  Final Train: 100.00
   Final Test: 69.90
Split: 01, Run: 02
None time:  1.006853116909042
None Run 02:
Highest Train: 100.00
Highest Valid: 71.80
  Final Train: 100.00
   Final Test: 70.10
Split: 01, Run: 03
None time:  0.9848932770546526
None Run 03:
Highest Train: 100.00
Highest Valid: 71.00
  Final Train: 99.17
   Final Test: 70.00
run time now: 3.0629117488861084
total time:  3.1147536078933626
None All runs:
Highest Train: 100.00 ± 0.00
Highest Valid: 71.47 ± 0.42
  Final Train: 99.72 ± 0.48
   Final Test: 70.00 ± 0.10
[I 2023-06-11 23:36:58,769] Trial 262 finished with value: 71.46666717529297 and parameters: {'Fwd': 0.0023719965742979043, 'K': 7, 'alpha': 0.5, 'dropout': 0.7000000000000001, 'gnnepoch': 120, 'lambda1': 0.8, 'lambda2': 3.973992271854617, 'loop': 0, 'loss': 'CE', 'lr': 0.0021900390717441228, 'softmaxF': False, 'useGCN': True, 'weight_decay': 5.457995781508085e-06, 'weightedloss': True}. Best is trial 203 with value: 71.93333435058594.
/home/wxy/miniconda3/lib/python3.10/site-packages/optuna/distributions.py:685: UserWarning: The distribution is specified by [0, 1.00001] and step=0.05, but the range is not divisible by `step`. It will be replaced by [0, 1.0].
  warnings.warn(
K:  7
alpha:  0.55
lr:  0.0024087212519058325
weight_decay:  3.4040001935508883e-06
dropout:  0.8
fix split and run 3 times
Data: Data(x=[3327, 3703], y=[3327], train_mask=[3327], val_mask=[3327], test_mask=[3327], adj_t=[3327, 3327, nnz=9104])
num_train tensor(120)
num_noise 0
noise: tensor(0)
data feature 3703
ALTOPT(
  (lins): Sequential(
    (0): Linear(in_features=3703, out_features=64, bias=True)
    (1): BatchNorm1d(64, eps=1e-05, momentum=0.1, affine=True, track_running_stats=True)
    (2): Dropout(p=0.8, inplace=True)
    (3): ReLU(inplace=True)
    (4): Linear(in_features=64, out_features=6, bias=True)
    (5): LogSoftmax(dim=-1)
  )
  (prop): Propagation(K=7, mode=None, lambda1=None, lambda2=None, L21=True, alpha=0.55)
  (gcn): GCN(
    (convs): ModuleList(
      (0): GCNConv(3703, 64)
      (1): GCNConv(64, 6)
    )
    (bns): ModuleList(
      (0): BatchNorm1d(64, eps=1e-05, momentum=0.1, affine=True, track_running_stats=True)
    )
    (output): LogSoftmax(dim=-1)
  )
)
propagate done
init label
Split: 01, Run: 01
None time:  0.9970504930242896
None Run 01:
Highest Train: 100.00
Highest Valid: 71.40
  Final Train: 100.00
   Final Test: 69.90
Split: 01, Run: 02
None time:  1.1255926471203566
None Run 02:
Highest Train: 100.00
Highest Valid: 72.20
  Final Train: 100.00
   Final Test: 70.20
Split: 01, Run: 03
None time:  1.0552853008266538
None Run 03:
Highest Train: 100.00
Highest Valid: 71.40
  Final Train: 100.00
   Final Test: 69.00
run time now: 3.217625856399536
total time:  3.266404651803896
None All runs:
Highest Train: 100.00 ± 0.00
Highest Valid: 71.67 ± 0.46
  Final Train: 100.00 ± 0.00
   Final Test: 69.70 ± 0.62
[I 2023-06-11 23:37:02,580] Trial 263 finished with value: 71.66666412353516 and parameters: {'Fwd': 3.0265636848864877e-06, 'K': 7, 'alpha': 0.55, 'dropout': 0.8, 'gnnepoch': 120, 'lambda1': 0.8, 'lambda2': 3.714517330694459, 'loop': 0, 'loss': 'CE', 'lr': 0.0024087212519058325, 'softmaxF': False, 'useGCN': True, 'weight_decay': 3.4040001935508883e-06, 'weightedloss': True}. Best is trial 203 with value: 71.93333435058594.
/home/wxy/miniconda3/lib/python3.10/site-packages/optuna/distributions.py:685: UserWarning: The distribution is specified by [0, 1.00001] and step=0.05, but the range is not divisible by `step`. It will be replaced by [0, 1.0].
  warnings.warn(
K:  7
alpha:  0.6000000000000001
lr:  0.001702110162576241
weight_decay:  7.867530136331146e-06
dropout:  0.8
fix split and run 3 times
Data: Data(x=[3327, 3703], y=[3327], train_mask=[3327], val_mask=[3327], test_mask=[3327], adj_t=[3327, 3327, nnz=9104])
num_train tensor(120)
num_noise 0
noise: tensor(0)
data feature 3703
ALTOPT(
  (lins): Sequential(
    (0): Linear(in_features=3703, out_features=64, bias=True)
    (1): BatchNorm1d(64, eps=1e-05, momentum=0.1, affine=True, track_running_stats=True)
    (2): Dropout(p=0.8, inplace=True)
    (3): ReLU(inplace=True)
    (4): Linear(in_features=64, out_features=6, bias=True)
    (5): LogSoftmax(dim=-1)
  )
  (prop): Propagation(K=7, mode=None, lambda1=None, lambda2=None, L21=True, alpha=0.6000000000000001)
  (gcn): GCN(
    (convs): ModuleList(
      (0): GCNConv(3703, 64)
      (1): GCNConv(64, 6)
    )
    (bns): ModuleList(
      (0): BatchNorm1d(64, eps=1e-05, momentum=0.1, affine=True, track_running_stats=True)
    )
    (output): LogSoftmax(dim=-1)
  )
)
propagate done
init label
Split: 01, Run: 01
None time:  1.0546838829759508
None Run 01:
Highest Train: 100.00
Highest Valid: 71.40
  Final Train: 100.00
   Final Test: 69.50
Split: 01, Run: 02
None time:  1.0978694721125066
None Run 02:
Highest Train: 100.00
Highest Valid: 71.60
  Final Train: 100.00
   Final Test: 70.10
Split: 01, Run: 03
None time:  1.0532870080787688
None Run 03:
Highest Train: 100.00
Highest Valid: 72.00
  Final Train: 100.00
   Final Test: 70.40
run time now: 3.24550461769104
total time:  3.3060288010165095
None All runs:
Highest Train: 100.00 ± 0.00
Highest Valid: 71.67 ± 0.31
  Final Train: 100.00 ± 0.00
   Final Test: 70.00 ± 0.46
[I 2023-06-11 23:37:06,360] Trial 264 finished with value: 71.66666412353516 and parameters: {'Fwd': 0.0808889144846147, 'K': 7, 'alpha': 0.6000000000000001, 'dropout': 0.8, 'gnnepoch': 120, 'lambda1': 0.8500000000000001, 'lambda2': 4.415528647276606, 'loop': 0, 'loss': 'CE', 'lr': 0.001702110162576241, 'softmaxF': False, 'useGCN': True, 'weight_decay': 7.867530136331146e-06, 'weightedloss': True}. Best is trial 203 with value: 71.93333435058594.
/home/wxy/miniconda3/lib/python3.10/site-packages/optuna/distributions.py:685: UserWarning: The distribution is specified by [0, 1.00001] and step=0.05, but the range is not divisible by `step`. It will be replaced by [0, 1.0].
  warnings.warn(
K:  6
alpha:  0.45
lr:  0.0008973103851280034
weight_decay:  6.778010595563845e-05
dropout:  0.8
fix split and run 3 times
Data: Data(x=[3327, 3703], y=[3327], train_mask=[3327], val_mask=[3327], test_mask=[3327], adj_t=[3327, 3327, nnz=9104])
num_train tensor(120)
num_noise 0
noise: tensor(0)
data feature 3703
ALTOPT(
  (lins): Sequential(
    (0): Linear(in_features=3703, out_features=64, bias=True)
    (1): BatchNorm1d(64, eps=1e-05, momentum=0.1, affine=True, track_running_stats=True)
    (2): Dropout(p=0.8, inplace=True)
    (3): ReLU(inplace=True)
    (4): Linear(in_features=64, out_features=6, bias=True)
    (5): LogSoftmax(dim=-1)
  )
  (prop): Propagation(K=6, mode=None, lambda1=None, lambda2=None, L21=True, alpha=0.45)
  (gcn): GCN(
    (convs): ModuleList(
      (0): GCNConv(3703, 64)
      (1): GCNConv(64, 6)
    )
    (bns): ModuleList(
      (0): BatchNorm1d(64, eps=1e-05, momentum=0.1, affine=True, track_running_stats=True)
    )
    (output): LogSoftmax(dim=-1)
  )
)
propagate done
init label
Split: 01, Run: 01
None time:  1.015896124066785
None Run 01:
Highest Train: 100.00
Highest Valid: 70.60
  Final Train: 100.00
   Final Test: 69.20
Split: 01, Run: 02
None time:  1.0234583369456232
None Run 02:
Highest Train: 100.00
Highest Valid: 71.80
  Final Train: 100.00
   Final Test: 70.10
Split: 01, Run: 03
None time:  0.9928724300116301
None Run 03:
Highest Train: 100.00
Highest Valid: 71.20
  Final Train: 100.00
   Final Test: 70.10
run time now: 3.0713117122650146
total time:  3.129134027985856
None All runs:
Highest Train: 100.00 ± 0.00
Highest Valid: 71.20 ± 0.60
  Final Train: 100.00 ± 0.00
   Final Test: 69.80 ± 0.52
[I 2023-06-11 23:37:09,923] Trial 265 finished with value: 71.20000457763672 and parameters: {'Fwd': 0.006581417674073133, 'K': 6, 'alpha': 0.45, 'dropout': 0.8, 'gnnepoch': 120, 'lambda1': 0.8, 'lambda2': 4.802209845003248, 'loop': 0, 'loss': 'CE', 'lr': 0.0008973103851280034, 'softmaxF': False, 'useGCN': True, 'weight_decay': 6.778010595563845e-05, 'weightedloss': True}. Best is trial 203 with value: 71.93333435058594.
/home/wxy/miniconda3/lib/python3.10/site-packages/optuna/distributions.py:685: UserWarning: The distribution is specified by [0, 1.00001] and step=0.05, but the range is not divisible by `step`. It will be replaced by [0, 1.0].
  warnings.warn(
K:  7
alpha:  0.5
lr:  0.0014814719572635378
weight_decay:  4.555891925955799e-06
dropout:  0.8
fix split and run 3 times
Data: Data(x=[3327, 3703], y=[3327], train_mask=[3327], val_mask=[3327], test_mask=[3327], adj_t=[3327, 3327, nnz=9104])
num_train tensor(120)
num_noise 0
noise: tensor(0)
data feature 3703
ALTOPT(
  (lins): Sequential(
    (0): Linear(in_features=3703, out_features=64, bias=True)
    (1): BatchNorm1d(64, eps=1e-05, momentum=0.1, affine=True, track_running_stats=True)
    (2): Dropout(p=0.8, inplace=True)
    (3): ReLU(inplace=True)
    (4): Linear(in_features=64, out_features=6, bias=True)
    (5): LogSoftmax(dim=-1)
  )
  (prop): Propagation(K=7, mode=None, lambda1=None, lambda2=None, L21=True, alpha=0.5)
  (gcn): GCN(
    (convs): ModuleList(
      (0): GCNConv(3703, 64)
      (1): GCNConv(64, 6)
    )
    (bns): ModuleList(
      (0): BatchNorm1d(64, eps=1e-05, momentum=0.1, affine=True, track_running_stats=True)
    )
    (output): LogSoftmax(dim=-1)
  )
)
propagate done
init label
Split: 01, Run: 01
None time:  1.006972226081416
None Run 01:
Highest Train: 100.00
Highest Valid: 71.20
  Final Train: 100.00
   Final Test: 69.80
Split: 01, Run: 02
None time:  0.9710424260701984
None Run 02:
Highest Train: 100.00
Highest Valid: 72.20
  Final Train: 100.00
   Final Test: 69.90
Split: 01, Run: 03
None time:  1.109883195022121
None Run 03:
Highest Train: 100.00
Highest Valid: 71.40
  Final Train: 100.00
   Final Test: 70.70
run time now: 3.130829095840454
total time:  3.1820031229872257
None All runs:
Highest Train: 100.00 ± 0.00
Highest Valid: 71.60 ± 0.53
  Final Train: 100.00 ± 0.00
   Final Test: 70.13 ± 0.49
[I 2023-06-11 23:37:13,517] Trial 266 finished with value: 71.5999984741211 and parameters: {'Fwd': 0.00204215675231139, 'K': 7, 'alpha': 0.5, 'dropout': 0.8, 'gnnepoch': 120, 'lambda1': 0.75, 'lambda2': 4.1214012467884205, 'loop': 0, 'loss': 'CE', 'lr': 0.0014814719572635378, 'softmaxF': False, 'useGCN': True, 'weight_decay': 4.555891925955799e-06, 'weightedloss': True}. Best is trial 203 with value: 71.93333435058594.
/home/wxy/miniconda3/lib/python3.10/site-packages/optuna/distributions.py:685: UserWarning: The distribution is specified by [0, 1.00001] and step=0.05, but the range is not divisible by `step`. It will be replaced by [0, 1.0].
  warnings.warn(
K:  2
alpha:  0.6000000000000001
lr:  0.0019775349684480964
weight_decay:  9.665322877707421e-06
dropout:  0.8
fix split and run 3 times
Data: Data(x=[3327, 3703], y=[3327], train_mask=[3327], val_mask=[3327], test_mask=[3327], adj_t=[3327, 3327, nnz=9104])
num_train tensor(120)
num_noise 0
noise: tensor(0)
data feature 3703
ALTOPT(
  (lins): Sequential(
    (0): Linear(in_features=3703, out_features=64, bias=True)
    (1): BatchNorm1d(64, eps=1e-05, momentum=0.1, affine=True, track_running_stats=True)
    (2): Dropout(p=0.8, inplace=True)
    (3): ReLU(inplace=True)
    (4): Linear(in_features=64, out_features=6, bias=True)
    (5): Identity()
  )
  (prop): Propagation(K=2, mode=None, lambda1=None, lambda2=None, L21=True, alpha=0.6000000000000001)
  (gcn): GCN(
    (convs): ModuleList(
      (0): GCNConv(3703, 64)
      (1): GCNConv(64, 6)
    )
    (bns): ModuleList(
      (0): BatchNorm1d(64, eps=1e-05, momentum=0.1, affine=True, track_running_stats=True)
    )
    (output): Identity()
  )
)
propagate done
init label
Split: 01, Run: 01
None time:  0.9772601760923862
None Run 01:
Highest Train: 100.00
Highest Valid: 68.60
  Final Train: 100.00
   Final Test: 69.70
Split: 01, Run: 02, Epoch: 100, Loss: 0.0000, Train: 100.00%, Valid: 68.40% Test: 69.50%
Split: 01, Run: 02
None time:  1.5013770922087133
None Run 02:
Highest Train: 100.00
Highest Valid: 68.40
  Final Train: 100.00
   Final Test: 69.60
Split: 01, Run: 03, Epoch: 100, Loss: 0.0000, Train: 100.00%, Valid: 68.40% Test: 69.30%
Split: 01, Run: 03
None time:  1.4622178308200091
None Run 03:
Highest Train: 100.00
Highest Valid: 68.40
  Final Train: 100.00
   Final Test: 69.30
run time now: 3.976639747619629
total time:  4.028094582958147
None All runs:
Highest Train: 100.00 ± 0.00
Highest Valid: 68.47 ± 0.12
  Final Train: 100.00 ± 0.00
   Final Test: 69.53 ± 0.21
[I 2023-06-11 23:37:18,026] Trial 267 finished with value: 68.46666717529297 and parameters: {'Fwd': 0.0008444112476330315, 'K': 2, 'alpha': 0.6000000000000001, 'dropout': 0.8, 'gnnepoch': 120, 'lambda1': 0.8, 'lambda2': 5.176412150704919, 'loop': 0, 'loss': 'MSE', 'lr': 0.0019775349684480964, 'softmaxF': False, 'useGCN': True, 'weight_decay': 9.665322877707421e-06, 'weightedloss': True}. Best is trial 203 with value: 71.93333435058594.
/home/wxy/miniconda3/lib/python3.10/site-packages/optuna/distributions.py:685: UserWarning: The distribution is specified by [0, 1.00001] and step=0.05, but the range is not divisible by `step`. It will be replaced by [0, 1.0].
  warnings.warn(
K:  7
alpha:  0.55
lr:  0.002594530261090089
weight_decay:  0.000265888081250489
dropout:  0.8
fix split and run 3 times
Data: Data(x=[3327, 3703], y=[3327], train_mask=[3327], val_mask=[3327], test_mask=[3327], adj_t=[3327, 3327, nnz=9104])
num_train tensor(120)
num_noise 0
noise: tensor(0)
data feature 3703
ALTOPT(
  (lins): Sequential(
    (0): Linear(in_features=3703, out_features=64, bias=True)
    (1): BatchNorm1d(64, eps=1e-05, momentum=0.1, affine=True, track_running_stats=True)
    (2): Dropout(p=0.8, inplace=True)
    (3): ReLU(inplace=True)
    (4): Linear(in_features=64, out_features=6, bias=True)
    (5): LogSoftmax(dim=-1)
  )
  (prop): Propagation(K=7, mode=None, lambda1=None, lambda2=None, L21=True, alpha=0.55)
  (gcn): GCN(
    (convs): ModuleList(
      (0): GCNConv(3703, 64)
      (1): GCNConv(64, 6)
    )
    (bns): ModuleList(
      (0): BatchNorm1d(64, eps=1e-05, momentum=0.1, affine=True, track_running_stats=True)
    )
    (output): LogSoftmax(dim=-1)
  )
)
propagate done
init label
Split: 01, Run: 01
None time:  0.87803341797553
None Run 01:
Highest Train: 100.00
Highest Valid: 71.40
  Final Train: 100.00
   Final Test: 69.80
Split: 01, Run: 02
None time:  0.9394323560409248
None Run 02:
Highest Train: 100.00
Highest Valid: 70.80
  Final Train: 100.00
   Final Test: 68.60
Split: 01, Run: 03
None time:  1.023374754935503
None Run 03:
Highest Train: 100.00
Highest Valid: 71.20
  Final Train: 100.00
   Final Test: 69.80
run time now: 2.881502866744995
total time:  2.928599591134116
None All runs:
Highest Train: 100.00 ± 0.00
Highest Valid: 71.13 ± 0.31
  Final Train: 100.00 ± 0.00
   Final Test: 69.40 ± 0.69
[I 2023-06-11 23:37:21,405] Trial 268 finished with value: 71.13333892822266 and parameters: {'Fwd': 1.0389434396747639e-06, 'K': 7, 'alpha': 0.55, 'dropout': 0.8, 'gnnepoch': 110, 'lambda1': 0.8, 'lambda2': 4.237703669584041, 'loop': 0, 'loss': 'CE', 'lr': 0.002594530261090089, 'softmaxF': False, 'useGCN': True, 'weight_decay': 0.000265888081250489, 'weightedloss': True}. Best is trial 203 with value: 71.93333435058594.
/home/wxy/miniconda3/lib/python3.10/site-packages/optuna/distributions.py:685: UserWarning: The distribution is specified by [0, 1.00001] and step=0.05, but the range is not divisible by `step`. It will be replaced by [0, 1.0].
  warnings.warn(
K:  5
alpha:  0.55
lr:  0.0021918773222392505
weight_decay:  1.2017022209291735e-05
dropout:  0.7000000000000001
fix split and run 3 times
Data: Data(x=[3327, 3703], y=[3327], train_mask=[3327], val_mask=[3327], test_mask=[3327], adj_t=[3327, 3327, nnz=9104])
num_train tensor(120)
num_noise 0
noise: tensor(0)
data feature 3703
ALTOPT(
  (lins): Sequential(
    (0): Linear(in_features=3703, out_features=64, bias=True)
    (1): BatchNorm1d(64, eps=1e-05, momentum=0.1, affine=True, track_running_stats=True)
    (2): Dropout(p=0.7000000000000001, inplace=True)
    (3): ReLU(inplace=True)
    (4): Linear(in_features=64, out_features=6, bias=True)
    (5): LogSoftmax(dim=-1)
  )
  (prop): Propagation(K=5, mode=None, lambda1=None, lambda2=None, L21=True, alpha=0.55)
  (gcn): GCN(
    (convs): ModuleList(
      (0): GCNConv(3703, 64)
      (1): GCNConv(64, 6)
    )
    (bns): ModuleList(
      (0): BatchNorm1d(64, eps=1e-05, momentum=0.1, affine=True, track_running_stats=True)
    )
    (output): LogSoftmax(dim=-1)
  )
)
propagate done
init label
Split: 01, Run: 01
None time:  1.0015812499914318
None Run 01:
Highest Train: 100.00
Highest Valid: 71.60
  Final Train: 100.00
   Final Test: 70.00
Split: 01, Run: 02
None time:  1.0674858330748975
None Run 02:
Highest Train: 100.00
Highest Valid: 72.40
  Final Train: 100.00
   Final Test: 70.30
Split: 01, Run: 03
None time:  1.092312433058396
None Run 03:
Highest Train: 100.00
Highest Valid: 71.00
  Final Train: 99.17
   Final Test: 70.00
run time now: 3.2108538150787354
total time:  3.2647001401055604
None All runs:
Highest Train: 100.00 ± 0.00
Highest Valid: 71.67 ± 0.70
  Final Train: 99.72 ± 0.48
   Final Test: 70.10 ± 0.17
