[I 2023-06-11 23:55:40,521] Trial 548 finished with value: 71.66667175292969 and parameters: {'Fwd': 0.0003627066272687776, 'K': 8, 'alpha': 0.75, 'dropout': 0.8, 'gnnepoch': 120, 'lambda1': 0.7000000000000001, 'lambda2': 6.472161784631791, 'loop': 0, 'loss': 'CE', 'lr': 0.001710309605417095, 'softmaxF': False, 'useGCN': True, 'weight_decay': 0.0005982083666737368, 'weightedloss': True}. Best is trial 271 with value: 72.06666564941406.
/home/wxy/miniconda3/lib/python3.10/site-packages/optuna/distributions.py:685: UserWarning: The distribution is specified by [0, 1.00001] and step=0.05, but the range is not divisible by `step`. It will be replaced by [0, 1.0].
  warnings.warn(
K:  8
alpha:  0.8
lr:  0.00125156566763898
weight_decay:  0.000301859506858709
dropout:  0.6000000000000001
fix split and run 3 times
Data: Data(x=[3327, 3703], y=[3327], train_mask=[3327], val_mask=[3327], test_mask=[3327], adj_t=[3327, 3327, nnz=9104])
num_train tensor(120)
num_noise 0
noise: tensor(0)
data feature 3703
ALTOPT(
  (lins): Sequential(
    (0): Linear(in_features=3703, out_features=64, bias=True)
    (1): BatchNorm1d(64, eps=1e-05, momentum=0.1, affine=True, track_running_stats=True)
    (2): Dropout(p=0.6000000000000001, inplace=True)
    (3): ReLU(inplace=True)
    (4): Linear(in_features=64, out_features=6, bias=True)
    (5): LogSoftmax(dim=-1)
  )
  (prop): Propagation(K=8, mode=None, lambda1=None, lambda2=None, L21=True, alpha=0.8)
  (gcn): GCN(
    (convs): ModuleList(
      (0): GCNConv(3703, 64)
      (1): GCNConv(64, 6)
    )
    (bns): ModuleList(
      (0): BatchNorm1d(64, eps=1e-05, momentum=0.1, affine=True, track_running_stats=True)
    )
    (output): LogSoftmax(dim=-1)
  )
)
propagate done
init label
Split: 01, Run: 01
None time:  1.0429793670773506
None Run 01:
Highest Train: 100.00
Highest Valid: 71.20
  Final Train: 100.00
   Final Test: 69.90
Split: 01, Run: 02
None time:  1.0406007640995085
None Run 02:
Highest Train: 100.00
Highest Valid: 72.20
  Final Train: 100.00
   Final Test: 70.00
Split: 01, Run: 03
None time:  1.0615477850660682
None Run 03:
Highest Train: 100.00
Highest Valid: 71.20
  Final Train: 100.00
   Final Test: 70.90
run time now: 3.1848721504211426
total time:  3.2441395721398294
None All runs:
Highest Train: 100.00 ± 0.00
Highest Valid: 71.53 ± 0.58
  Final Train: 100.00 ± 0.00
   Final Test: 70.27 ± 0.55
[I 2023-06-11 23:55:44,280] Trial 549 finished with value: 71.53333282470703 and parameters: {'Fwd': 1.10210434801195e-06, 'K': 8, 'alpha': 0.8, 'dropout': 0.6000000000000001, 'gnnepoch': 120, 'lambda1': 0.65, 'lambda2': 7.7034018393718275, 'loop': 0, 'loss': 'CE', 'lr': 0.00125156566763898, 'softmaxF': False, 'useGCN': True, 'weight_decay': 0.000301859506858709, 'weightedloss': True}. Best is trial 271 with value: 72.06666564941406.
/home/wxy/miniconda3/lib/python3.10/site-packages/optuna/distributions.py:685: UserWarning: The distribution is specified by [0, 1.00001] and step=0.05, but the range is not divisible by `step`. It will be replaced by [0, 1.0].
  warnings.warn(
K:  8
alpha:  0.8500000000000001
lr:  0.001535880993106578
weight_decay:  4.201625227545599e-05
dropout:  0.7000000000000001
fix split and run 3 times
Data: Data(x=[3327, 3703], y=[3327], train_mask=[3327], val_mask=[3327], test_mask=[3327], adj_t=[3327, 3327, nnz=9104])
num_train tensor(120)
num_noise 0
noise: tensor(0)
data feature 3703
ALTOPT(
  (lins): Sequential(
    (0): Linear(in_features=3703, out_features=64, bias=True)
    (1): BatchNorm1d(64, eps=1e-05, momentum=0.1, affine=True, track_running_stats=True)
    (2): Dropout(p=0.7000000000000001, inplace=True)
    (3): ReLU(inplace=True)
    (4): Linear(in_features=64, out_features=6, bias=True)
    (5): LogSoftmax(dim=-1)
  )
  (prop): Propagation(K=8, mode=None, lambda1=None, lambda2=None, L21=True, alpha=0.8500000000000001)
  (gcn): GCN(
    (convs): ModuleList(
      (0): GCNConv(3703, 64)
      (1): GCNConv(64, 6)
    )
    (bns): ModuleList(
      (0): BatchNorm1d(64, eps=1e-05, momentum=0.1, affine=True, track_running_stats=True)
    )
    (output): LogSoftmax(dim=-1)
  )
)
propagate done
init label
Split: 01, Run: 01
None time:  0.4437892069108784
None Run 01:
Highest Train: 100.00
Highest Valid: 70.00
  Final Train: 100.00
   Final Test: 69.20
Split: 01, Run: 02
None time:  0.46352137601934373
None Run 02:
Highest Train: 100.00
Highest Valid: 67.20
  Final Train: 100.00
   Final Test: 65.80
Split: 01, Run: 03
None time:  0.423963749082759
None Run 03:
Highest Train: 100.00
Highest Valid: 70.20
  Final Train: 100.00
   Final Test: 69.50
run time now: 1.3821463584899902
total time:  1.4462857861071825
None All runs:
Highest Train: 100.00 ± 0.00
Highest Valid: 69.13 ± 1.68
  Final Train: 100.00 ± 0.00
   Final Test: 68.17 ± 2.06
[I 2023-06-11 23:55:46,327] Trial 550 finished with value: 69.13333129882812 and parameters: {'Fwd': 0.0020371436069853165, 'K': 8, 'alpha': 0.8500000000000001, 'dropout': 0.7000000000000001, 'gnnepoch': 40, 'lambda1': 0.8, 'lambda2': 7.108184204686645, 'loop': 0, 'loss': 'CE', 'lr': 0.001535880993106578, 'softmaxF': True, 'useGCN': True, 'weight_decay': 4.201625227545599e-05, 'weightedloss': True}. Best is trial 271 with value: 72.06666564941406.
/home/wxy/miniconda3/lib/python3.10/site-packages/optuna/distributions.py:685: UserWarning: The distribution is specified by [0, 1.00001] and step=0.05, but the range is not divisible by `step`. It will be replaced by [0, 1.0].
  warnings.warn(
K:  8
alpha:  0.6000000000000001
lr:  0.001369440758415269
weight_decay:  7.826021501648183e-05
dropout:  0.8
fix split and run 3 times
Data: Data(x=[3327, 3703], y=[3327], train_mask=[3327], val_mask=[3327], test_mask=[3327], adj_t=[3327, 3327, nnz=9104])
num_train tensor(120)
num_noise 0
noise: tensor(0)
data feature 3703
ALTOPT(
  (lins): Sequential(
    (0): Linear(in_features=3703, out_features=64, bias=True)
    (1): BatchNorm1d(64, eps=1e-05, momentum=0.1, affine=True, track_running_stats=True)
    (2): Dropout(p=0.8, inplace=True)
    (3): ReLU(inplace=True)
    (4): Linear(in_features=64, out_features=6, bias=True)
    (5): LogSoftmax(dim=-1)
  )
  (prop): Propagation(K=8, mode=None, lambda1=None, lambda2=None, L21=True, alpha=0.6000000000000001)
  (gcn): GCN(
    (convs): ModuleList(
      (0): GCNConv(3703, 64)
      (1): GCNConv(64, 6)
    )
    (bns): ModuleList(
      (0): BatchNorm1d(64, eps=1e-05, momentum=0.1, affine=True, track_running_stats=True)
    )
    (output): LogSoftmax(dim=-1)
  )
)
propagate done
init label
Split: 01, Run: 01
None time:  0.9650829201564193
None Run 01:
Highest Train: 100.00
Highest Valid: 70.60
  Final Train: 100.00
   Final Test: 70.20
Split: 01, Run: 02
None time:  1.17847596318461
None Run 02:
Highest Train: 100.00
Highest Valid: 68.60
  Final Train: 100.00
   Final Test: 67.90
Split: 01, Run: 03
None time:  1.018742245156318
None Run 03:
Highest Train: 100.00
Highest Valid: 71.20
  Final Train: 100.00
   Final Test: 70.40
run time now: 3.206394910812378
total time:  3.2574620319064707
None All runs:
Highest Train: 100.00 ± 0.00
Highest Valid: 70.13 ± 1.36
  Final Train: 100.00 ± 0.00
   Final Test: 69.50 ± 1.39
[I 2023-06-11 23:55:50,077] Trial 551 finished with value: 70.13333129882812 and parameters: {'Fwd': 5.747238070353417e-06, 'K': 8, 'alpha': 0.6000000000000001, 'dropout': 0.8, 'gnnepoch': 110, 'lambda1': 0.75, 'lambda2': 8.556606329375446, 'loop': 0, 'loss': 'CE', 'lr': 0.001369440758415269, 'softmaxF': False, 'useGCN': True, 'weight_decay': 7.826021501648183e-05, 'weightedloss': True}. Best is trial 271 with value: 72.06666564941406.
/home/wxy/miniconda3/lib/python3.10/site-packages/optuna/distributions.py:685: UserWarning: The distribution is specified by [0, 1.00001] and step=0.05, but the range is not divisible by `step`. It will be replaced by [0, 1.0].
  warnings.warn(
K:  8
alpha:  0.9
lr:  0.0010341934526196743
weight_decay:  0.00022073625342658928
dropout:  0.8
fix split and run 3 times
Data: Data(x=[3327, 3703], y=[3327], train_mask=[3327], val_mask=[3327], test_mask=[3327], adj_t=[3327, 3327, nnz=9104])
num_train tensor(120)
num_noise 0
noise: tensor(0)
data feature 3703
ALTOPT(
  (lins): Sequential(
    (0): Linear(in_features=3703, out_features=64, bias=True)
    (1): BatchNorm1d(64, eps=1e-05, momentum=0.1, affine=True, track_running_stats=True)
    (2): Dropout(p=0.8, inplace=True)
    (3): ReLU(inplace=True)
    (4): Linear(in_features=64, out_features=6, bias=True)
    (5): LogSoftmax(dim=-1)
  )
  (prop): Propagation(K=8, mode=None, lambda1=None, lambda2=None, L21=True, alpha=0.9)
  (gcn): GCN(
    (convs): ModuleList(
      (0): GCNConv(3703, 64)
      (1): GCNConv(64, 6)
    )
    (bns): ModuleList(
      (0): BatchNorm1d(64, eps=1e-05, momentum=0.1, affine=True, track_running_stats=True)
    )
    (output): LogSoftmax(dim=-1)
  )
)
propagate done
init label
Split: 01, Run: 01
None time:  1.0543778450228274
None Run 01:
Highest Train: 100.00
Highest Valid: 70.40
  Final Train: 100.00
   Final Test: 69.50
Split: 01, Run: 02
None time:  1.1671574339270592
None Run 02:
Highest Train: 100.00
Highest Valid: 71.00
  Final Train: 100.00
   Final Test: 70.70
Split: 01, Run: 03
None time:  1.1134240659885108
None Run 03:
Highest Train: 100.00
Highest Valid: 71.20
  Final Train: 100.00
   Final Test: 70.10
run time now: 3.3930842876434326
total time:  3.455851879902184
None All runs:
Highest Train: 100.00 ± 0.00
Highest Valid: 70.87 ± 0.42
  Final Train: 100.00 ± 0.00
   Final Test: 70.10 ± 0.60
[I 2023-06-11 23:55:54,072] Trial 552 finished with value: 70.86666870117188 and parameters: {'Fwd': 2.0769457319885744e-05, 'K': 8, 'alpha': 0.9, 'dropout': 0.8, 'gnnepoch': 120, 'lambda1': 0.7000000000000001, 'lambda2': 6.153017912114042, 'loop': 1, 'loss': 'CE', 'lr': 0.0010341934526196743, 'softmaxF': False, 'useGCN': True, 'weight_decay': 0.00022073625342658928, 'weightedloss': True}. Best is trial 271 with value: 72.06666564941406.
/home/wxy/miniconda3/lib/python3.10/site-packages/optuna/distributions.py:685: UserWarning: The distribution is specified by [0, 1.00001] and step=0.05, but the range is not divisible by `step`. It will be replaced by [0, 1.0].
  warnings.warn(
K:  8
alpha:  0.8500000000000001
lr:  0.0011764517873001047
weight_decay:  0.0005079830787681691
dropout:  0.8
fix split and run 3 times
Data: Data(x=[3327, 3703], y=[3327], train_mask=[3327], val_mask=[3327], test_mask=[3327], adj_t=[3327, 3327, nnz=9104])
num_train tensor(120)
num_noise 0
noise: tensor(0)
data feature 3703
ALTOPT(
  (lins): Sequential(
    (0): Linear(in_features=3703, out_features=64, bias=True)
    (1): BatchNorm1d(64, eps=1e-05, momentum=0.1, affine=True, track_running_stats=True)
    (2): Dropout(p=0.8, inplace=True)
    (3): ReLU(inplace=True)
    (4): Linear(in_features=64, out_features=6, bias=True)
    (5): LogSoftmax(dim=-1)
  )
  (prop): Propagation(K=8, mode=None, lambda1=None, lambda2=None, L21=True, alpha=0.8500000000000001)
  (gcn): GCN(
    (convs): ModuleList(
      (0): GCNConv(3703, 64)
      (1): GCNConv(64, 6)
    )
    (bns): ModuleList(
      (0): BatchNorm1d(64, eps=1e-05, momentum=0.1, affine=True, track_running_stats=True)
    )
    (output): LogSoftmax(dim=-1)
  )
)
propagate done
init label
Split: 01, Run: 01
None time:  0.7540242408867925
None Run 01:
Highest Train: 100.00
Highest Valid: 53.00
  Final Train: 100.00
   Final Test: 54.30
Split: 01, Run: 02
None time:  1.2122894099447876
None Run 02:
Highest Train: 100.00
Highest Valid: 62.60
  Final Train: 97.50
   Final Test: 62.60
Split: 01, Run: 03
None time:  0.7591935768723488
None Run 03:
Highest Train: 100.00
Highest Valid: 61.80
  Final Train: 98.33
   Final Test: 59.50
run time now: 2.768232583999634
total time:  2.819653309881687
None All runs:
Highest Train: 100.00 ± 0.00
Highest Valid: 59.13 ± 5.33
  Final Train: 98.61 ± 1.27
   Final Test: 58.80 ± 4.19
[I 2023-06-11 23:55:57,407] Trial 553 finished with value: 59.133331298828125 and parameters: {'Fwd': 0.0001222990367106017, 'K': 8, 'alpha': 0.8500000000000001, 'dropout': 0.8, 'gnnepoch': 120, 'lambda1': 0.8, 'lambda2': 9.15283984954997, 'loop': 0, 'loss': 'CE', 'lr': 0.0011764517873001047, 'softmaxF': False, 'useGCN': False, 'weight_decay': 0.0005079830787681691, 'weightedloss': True}. Best is trial 271 with value: 72.06666564941406.
/home/wxy/miniconda3/lib/python3.10/site-packages/optuna/distributions.py:685: UserWarning: The distribution is specified by [0, 1.00001] and step=0.05, but the range is not divisible by `step`. It will be replaced by [0, 1.0].
  warnings.warn(
K:  9
alpha:  0.8
lr:  0.0014914658367334124
weight_decay:  0.0010224326493302237
dropout:  0.30000000000000004
fix split and run 3 times
Data: Data(x=[3327, 3703], y=[3327], train_mask=[3327], val_mask=[3327], test_mask=[3327], adj_t=[3327, 3327, nnz=9104])
num_train tensor(120)
num_noise 0
noise: tensor(0)
data feature 3703
ALTOPT(
  (lins): Sequential(
    (0): Linear(in_features=3703, out_features=64, bias=True)
    (1): BatchNorm1d(64, eps=1e-05, momentum=0.1, affine=True, track_running_stats=True)
    (2): Dropout(p=0.30000000000000004, inplace=True)
    (3): ReLU(inplace=True)
    (4): Linear(in_features=64, out_features=6, bias=True)
    (5): LogSoftmax(dim=-1)
  )
  (prop): Propagation(K=9, mode=None, lambda1=None, lambda2=None, L21=True, alpha=0.8)
  (gcn): GCN(
    (convs): ModuleList(
      (0): GCNConv(3703, 64)
      (1): GCNConv(64, 6)
    )
    (bns): ModuleList(
      (0): BatchNorm1d(64, eps=1e-05, momentum=0.1, affine=True, track_running_stats=True)
    )
    (output): LogSoftmax(dim=-1)
  )
)
propagate done
init label
Split: 01, Run: 01
None time:  0.19695602310821414
None Run 01:
Highest Train: 100.00
Highest Valid: 53.00
  Final Train: 100.00
   Final Test: 51.60
Split: 01, Run: 02
None time:  0.17898256797343493
None Run 02:
Highest Train: 100.00
Highest Valid: 52.00
  Final Train: 100.00
   Final Test: 50.20
Split: 01, Run: 03
None time:  0.20271257194690406
None Run 03:
Highest Train: 100.00
Highest Valid: 53.20
  Final Train: 100.00
   Final Test: 55.20
run time now: 0.6212637424468994
total time:  0.6684331619180739
None All runs:
Highest Train: 100.00 ± 0.00
Highest Valid: 52.73 ± 0.64
  Final Train: 100.00 ± 0.00
   Final Test: 52.33 ± 2.58
[I 2023-06-11 23:55:58,585] Trial 554 finished with value: 52.733333587646484 and parameters: {'Fwd': 4.958648926226127e-06, 'K': 9, 'alpha': 0.8, 'dropout': 0.30000000000000004, 'gnnepoch': 0, 'lambda1': 0.75, 'lambda2': 6.789140453762332, 'loop': 0, 'loss': 'CE', 'lr': 0.0014914658367334124, 'softmaxF': False, 'useGCN': True, 'weight_decay': 0.0010224326493302237, 'weightedloss': True}. Best is trial 271 with value: 72.06666564941406.
/home/wxy/miniconda3/lib/python3.10/site-packages/optuna/distributions.py:685: UserWarning: The distribution is specified by [0, 1.00001] and step=0.05, but the range is not divisible by `step`. It will be replaced by [0, 1.0].
  warnings.warn(
K:  8
alpha:  1.0
lr:  0.004675557268782474
weight_decay:  0.0013373326215202746
dropout:  0.8
fix split and run 3 times
Data: Data(x=[3327, 3703], y=[3327], train_mask=[3327], val_mask=[3327], test_mask=[3327], adj_t=[3327, 3327, nnz=9104])
num_train tensor(120)
num_noise 0
noise: tensor(0)
data feature 3703
ALTOPT(
  (lins): Sequential(
    (0): Linear(in_features=3703, out_features=64, bias=True)
    (1): BatchNorm1d(64, eps=1e-05, momentum=0.1, affine=True, track_running_stats=True)
    (2): Dropout(p=0.8, inplace=True)
    (3): ReLU(inplace=True)
    (4): Linear(in_features=64, out_features=6, bias=True)
    (5): LogSoftmax(dim=-1)
  )
  (prop): Propagation(K=8, mode=None, lambda1=None, lambda2=None, L21=True, alpha=1.0)
  (gcn): GCN(
    (convs): ModuleList(
      (0): GCNConv(3703, 64)
      (1): GCNConv(64, 6)
    )
    (bns): ModuleList(
      (0): BatchNorm1d(64, eps=1e-05, momentum=0.1, affine=True, track_running_stats=True)
    )
    (output): LogSoftmax(dim=-1)
  )
)
propagate done
init label
Split: 01, Run: 01
None time:  1.0393163140397519
None Run 01:
Highest Train: 100.00
Highest Valid: 70.80
  Final Train: 99.17
   Final Test: 70.10
Split: 01, Run: 02
None time:  1.0929126711562276
None Run 02:
Highest Train: 100.00
Highest Valid: 70.40
  Final Train: 98.33
   Final Test: 69.90
Split: 01, Run: 03
None time:  1.2595827570185065
None Run 03:
Highest Train: 100.00
Highest Valid: 70.40
  Final Train: 100.00
   Final Test: 69.30
run time now: 3.432873487472534
total time:  3.4856130259577185
None All runs:
Highest Train: 100.00 ± 0.00
Highest Valid: 70.53 ± 0.23
  Final Train: 99.17 ± 0.83
   Final Test: 69.77 ± 0.42
[I 2023-06-11 23:56:02,589] Trial 555 finished with value: 70.53333282470703 and parameters: {'Fwd': 1.8438444618950627e-05, 'K': 8, 'alpha': 1.0, 'dropout': 0.8, 'gnnepoch': 120, 'lambda1': 0.65, 'lambda2': 5.838365900166574, 'loop': 0, 'loss': 'CE', 'lr': 0.004675557268782474, 'softmaxF': False, 'useGCN': True, 'weight_decay': 0.0013373326215202746, 'weightedloss': True}. Best is trial 271 with value: 72.06666564941406.
/home/wxy/miniconda3/lib/python3.10/site-packages/optuna/distributions.py:685: UserWarning: The distribution is specified by [0, 1.00001] and step=0.05, but the range is not divisible by `step`. It will be replaced by [0, 1.0].
  warnings.warn(
K:  8
alpha:  0.8500000000000001
lr:  0.0007741308127905914
weight_decay:  9.098339969135283e-05
dropout:  0.8
fix split and run 3 times
Data: Data(x=[3327, 3703], y=[3327], train_mask=[3327], val_mask=[3327], test_mask=[3327], adj_t=[3327, 3327, nnz=9104])
num_train tensor(120)
num_noise 0
noise: tensor(0)
data feature 3703
ALTOPT(
  (lins): Sequential(
    (0): Linear(in_features=3703, out_features=64, bias=True)
    (1): BatchNorm1d(64, eps=1e-05, momentum=0.1, affine=True, track_running_stats=True)
    (2): Dropout(p=0.8, inplace=True)
    (3): ReLU(inplace=True)
    (4): Linear(in_features=64, out_features=6, bias=True)
    (5): LogSoftmax(dim=-1)
  )
  (prop): Propagation(K=8, mode=None, lambda1=None, lambda2=None, L21=True, alpha=0.8500000000000001)
  (gcn): GCN(
    (convs): ModuleList(
      (0): GCNConv(3703, 64)
      (1): GCNConv(64, 6)
    )
    (bns): ModuleList(
      (0): BatchNorm1d(64, eps=1e-05, momentum=0.1, affine=True, track_running_stats=True)
    )
    (output): LogSoftmax(dim=-1)
  )
)
propagate done
init label
Split: 01, Run: 01
None time:  1.0220626888331026
None Run 01:
Highest Train: 100.00
Highest Valid: 70.40
  Final Train: 98.33
   Final Test: 69.10
Split: 01, Run: 02
None time:  1.0390015309676528
None Run 02:
Highest Train: 100.00
Highest Valid: 71.20
  Final Train: 91.67
   Final Test: 70.50
Split: 01, Run: 03
None time:  1.1147242840379477
None Run 03:
Highest Train: 100.00
Highest Valid: 70.60
  Final Train: 91.67
   Final Test: 70.30
run time now: 3.2155799865722656
total time:  3.270749493036419
None All runs:
Highest Train: 100.00 ± 0.00
Highest Valid: 70.73 ± 0.42
  Final Train: 93.89 ± 3.85
   Final Test: 69.97 ± 0.76
[I 2023-06-11 23:56:06,463] Trial 556 finished with value: 70.73333740234375 and parameters: {'Fwd': 1.9686981170364764e-06, 'K': 8, 'alpha': 0.8500000000000001, 'dropout': 0.8, 'gnnepoch': 120, 'lambda1': 0.7000000000000001, 'lambda2': 0.2158878923782428, 'loop': 0, 'loss': 'CE', 'lr': 0.0007741308127905914, 'softmaxF': False, 'useGCN': True, 'weight_decay': 9.098339969135283e-05, 'weightedloss': True}. Best is trial 271 with value: 72.06666564941406.
/home/wxy/miniconda3/lib/python3.10/site-packages/optuna/distributions.py:685: UserWarning: The distribution is specified by [0, 1.00001] and step=0.05, but the range is not divisible by `step`. It will be replaced by [0, 1.0].
  warnings.warn(
K:  8
alpha:  0.75
lr:  0.0013097141167546314
weight_decay:  0.0017540690145069592
dropout:  0.8
fix split and run 3 times
Data: Data(x=[3327, 3703], y=[3327], train_mask=[3327], val_mask=[3327], test_mask=[3327], adj_t=[3327, 3327, nnz=9104])
num_train tensor(120)
num_noise 0
noise: tensor(0)
data feature 3703
ALTOPT(
  (lins): Sequential(
    (0): Linear(in_features=3703, out_features=64, bias=True)
    (1): BatchNorm1d(64, eps=1e-05, momentum=0.1, affine=True, track_running_stats=True)
    (2): Dropout(p=0.8, inplace=True)
    (3): ReLU(inplace=True)
    (4): Linear(in_features=64, out_features=6, bias=True)
    (5): LogSoftmax(dim=-1)
  )
  (prop): Propagation(K=8, mode=None, lambda1=None, lambda2=None, L21=True, alpha=0.75)
  (gcn): GCN(
    (convs): ModuleList(
      (0): GCNConv(3703, 64)
      (1): GCNConv(64, 6)
    )
    (bns): ModuleList(
      (0): BatchNorm1d(64, eps=1e-05, momentum=0.1, affine=True, track_running_stats=True)
    )
    (output): LogSoftmax(dim=-1)
  )
)
propagate done
init label
Split: 01, Run: 01
None time:  1.0472355540841818
None Run 01:
Highest Train: 100.00
Highest Valid: 71.60
  Final Train: 100.00
   Final Test: 69.60
Split: 01, Run: 02
None time:  1.0375342301558703
None Run 02:
Highest Train: 100.00
Highest Valid: 72.40
  Final Train: 100.00
   Final Test: 70.00
Split: 01, Run: 03
None time:  1.066453997977078
None Run 03:
Highest Train: 100.00
Highest Valid: 71.60
  Final Train: 100.00
   Final Test: 71.00
run time now: 3.1912295818328857
total time:  3.241126430919394
None All runs:
Highest Train: 100.00 ± 0.00
Highest Valid: 71.87 ± 0.46
  Final Train: 100.00 ± 0.00
   Final Test: 70.20 ± 0.72
