[I 2023-06-12 00:45:25,967] Trial 350 finished with value: 82.13333129882812 and parameters: {'Fwd': 0.00010780656617325082, 'K': 10, 'alpha': 0.8500000000000001, 'dropout': 0.9, 'gnnepoch': 60, 'lambda1': 0.8500000000000001, 'lambda2': 5.686130535742597, 'loop': 1, 'loss': 'MSE', 'lr': 0.003715087693445811, 'softmaxF': True, 'useGCN': False, 'weight_decay': 0.0076627858352104625, 'weightedloss': False}. Best is trial 205 with value: 83.53333282470703.
/home/wxy/miniconda3/lib/python3.10/site-packages/optuna/distributions.py:685: UserWarning: The distribution is specified by [0, 1.00001] and step=0.05, but the range is not divisible by `step`. It will be replaced by [0, 1.0].
  warnings.warn(
K:  10
alpha:  1.0
lr:  0.002506061351735518
weight_decay:  0.0059706984181136505
dropout:  0.9
fix split and run 3 times
Data: Data(x=[19717, 500], y=[19717], train_mask=[19717], val_mask=[19717], test_mask=[19717], adj_t=[19717, 19717, nnz=88648])
num_train tensor(60)
num_noise 0
noise: tensor(0)
data feature 500
ALTOPT(
  (lins): Sequential(
    (0): Linear(in_features=500, out_features=64, bias=True)
    (1): BatchNorm1d(64, eps=1e-05, momentum=0.1, affine=True, track_running_stats=True)
    (2): Dropout(p=0.9, inplace=True)
    (3): ReLU(inplace=True)
    (4): Linear(in_features=64, out_features=3, bias=True)
    (5): Identity()
  )
  (prop): Propagation(K=10, mode=None, lambda1=None, lambda2=None, L21=True, alpha=1.0)
  (gcn): GCN(
    (convs): ModuleList(
      (0): GCNConv(500, 64)
      (1): GCNConv(64, 3)
    )
    (bns): ModuleList(
      (0): BatchNorm1d(64, eps=1e-05, momentum=0.1, affine=True, track_running_stats=True)
    )
    (output): Identity()
  )
)
propagate done
init label
Split: 01, Run: 01
None time:  2.0456881939899176
None Run 01:
Highest Train: 100.00
Highest Valid: 83.40
  Final Train: 100.00
   Final Test: 79.30
Split: 01, Run: 02
None time:  1.3855350310914218
None Run 02:
Highest Train: 100.00
Highest Valid: 83.20
  Final Train: 100.00
   Final Test: 79.40
Split: 01, Run: 03
None time:  1.3049143750686198
None Run 03:
Highest Train: 100.00
Highest Valid: 83.20
  Final Train: 100.00
   Final Test: 79.90
run time now: 4.789624929428101
total time:  4.834486647043377
None All runs:
Highest Train: 100.00 ± 0.00
Highest Valid: 83.27 ± 0.12
  Final Train: 100.00 ± 0.00
   Final Test: 79.53 ± 0.32
[I 2023-06-12 00:45:31,294] Trial 351 finished with value: 83.26667022705078 and parameters: {'Fwd': 4.2271351231855224e-06, 'K': 10, 'alpha': 1.0, 'dropout': 0.9, 'gnnepoch': 70, 'lambda1': 0.9, 'lambda2': 5.4883300108321205, 'loop': 1, 'loss': 'MSE', 'lr': 0.002506061351735518, 'softmaxF': True, 'useGCN': False, 'weight_decay': 0.0059706984181136505, 'weightedloss': False}. Best is trial 205 with value: 83.53333282470703.
/home/wxy/miniconda3/lib/python3.10/site-packages/optuna/distributions.py:685: UserWarning: The distribution is specified by [0, 1.00001] and step=0.05, but the range is not divisible by `step`. It will be replaced by [0, 1.0].
  warnings.warn(
K:  10
alpha:  1.0
lr:  0.0019392451018992725
weight_decay:  0.005564107215177691
dropout:  0.9
fix split and run 3 times
Data: Data(x=[19717, 500], y=[19717], train_mask=[19717], val_mask=[19717], test_mask=[19717], adj_t=[19717, 19717, nnz=88648])
num_train tensor(60)
num_noise 0
noise: tensor(0)
data feature 500
ALTOPT(
  (lins): Sequential(
    (0): Linear(in_features=500, out_features=64, bias=True)
    (1): BatchNorm1d(64, eps=1e-05, momentum=0.1, affine=True, track_running_stats=True)
    (2): Dropout(p=0.9, inplace=True)
    (3): ReLU(inplace=True)
    (4): Linear(in_features=64, out_features=3, bias=True)
    (5): Identity()
  )
  (prop): Propagation(K=10, mode=None, lambda1=None, lambda2=None, L21=True, alpha=1.0)
  (gcn): GCN(
    (convs): ModuleList(
      (0): GCNConv(500, 64)
      (1): GCNConv(64, 3)
    )
    (bns): ModuleList(
      (0): BatchNorm1d(64, eps=1e-05, momentum=0.1, affine=True, track_running_stats=True)
    )
    (output): Identity()
  )
)
propagate done
init label
Split: 01, Run: 01, Epoch: 100, Loss: 0.3652, Train: 100.00%, Valid: 83.00% Test: 79.20%
Split: 01, Run: 01
None time:  3.7277830517850816
None Run 01:
Highest Train: 100.00
Highest Valid: 83.00
  Final Train: 100.00
   Final Test: 79.20
Split: 01, Run: 02
None time:  1.8539014151319861
None Run 02:
Highest Train: 100.00
Highest Valid: 80.60
  Final Train: 100.00
   Final Test: 78.10
Split: 01, Run: 03
None time:  1.3631644861306995
None Run 03:
Highest Train: 100.00
Highest Valid: 81.60
  Final Train: 100.00
   Final Test: 80.10
run time now: 6.997696399688721
total time:  7.039385913871229
None All runs:
Highest Train: 100.00 ± 0.00
Highest Valid: 81.73 ± 1.21
  Final Train: 100.00 ± 0.00
   Final Test: 79.13 ± 1.00
[I 2023-06-12 00:45:38,900] Trial 352 finished with value: 81.73333740234375 and parameters: {'Fwd': 3.89400434488926e-06, 'K': 10, 'alpha': 1.0, 'dropout': 0.9, 'gnnepoch': 70, 'lambda1': 0.9, 'lambda2': 5.443817221308851, 'loop': 1, 'loss': 'MSE', 'lr': 0.0019392451018992725, 'softmaxF': True, 'useGCN': False, 'weight_decay': 0.005564107215177691, 'weightedloss': False}. Best is trial 205 with value: 83.53333282470703.
/home/wxy/miniconda3/lib/python3.10/site-packages/optuna/distributions.py:685: UserWarning: The distribution is specified by [0, 1.00001] and step=0.05, but the range is not divisible by `step`. It will be replaced by [0, 1.0].
  warnings.warn(
K:  10
alpha:  1.0
lr:  0.00025409980770307384
weight_decay:  0.09343628009748053
dropout:  0.9
fix split and run 3 times
Data: Data(x=[19717, 500], y=[19717], train_mask=[19717], val_mask=[19717], test_mask=[19717], adj_t=[19717, 19717, nnz=88648])
num_train tensor(60)
num_noise 0
noise: tensor(0)
data feature 500
ALTOPT(
  (lins): Sequential(
    (0): Linear(in_features=500, out_features=64, bias=True)
    (1): BatchNorm1d(64, eps=1e-05, momentum=0.1, affine=True, track_running_stats=True)
    (2): Dropout(p=0.9, inplace=True)
    (3): ReLU(inplace=True)
    (4): Linear(in_features=64, out_features=3, bias=True)
    (5): Identity()
  )
  (prop): Propagation(K=10, mode=None, lambda1=None, lambda2=None, L21=True, alpha=1.0)
  (gcn): GCN(
    (convs): ModuleList(
      (0): GCNConv(500, 64)
      (1): GCNConv(64, 3)
    )
    (bns): ModuleList(
      (0): BatchNorm1d(64, eps=1e-05, momentum=0.1, affine=True, track_running_stats=True)
    )
    (output): Identity()
  )
)
propagate done
init label
Split: 01, Run: 01
None time:  1.0529832949396223
None Run 01:
Highest Train: 100.00
Highest Valid: 69.20
  Final Train: 100.00
   Final Test: 69.10
Split: 01, Run: 02
None time:  1.3670181969646364
None Run 02:
Highest Train: 100.00
Highest Valid: 80.60
  Final Train: 100.00
   Final Test: 75.30
Split: 01, Run: 03
None time:  0.996804571012035
None Run 03:
Highest Train: 100.00
Highest Valid: 81.00
  Final Train: 100.00
   Final Test: 77.60
run time now: 3.46746563911438
total time:  3.520940620917827
None All runs:
Highest Train: 100.00 ± 0.00
Highest Valid: 76.93 ± 6.70
  Final Train: 100.00 ± 0.00
   Final Test: 74.00 ± 4.40
[I 2023-06-12 00:45:43,080] Trial 353 finished with value: 76.9333267211914 and parameters: {'Fwd': 2.3823385637340746e-06, 'K': 10, 'alpha': 1.0, 'dropout': 0.9, 'gnnepoch': 70, 'lambda1': 0.9500000000000001, 'lambda2': 5.234033235444196, 'loop': 1, 'loss': 'MSE', 'lr': 0.00025409980770307384, 'softmaxF': True, 'useGCN': False, 'weight_decay': 0.09343628009748053, 'weightedloss': False}. Best is trial 205 with value: 83.53333282470703.
/home/wxy/miniconda3/lib/python3.10/site-packages/optuna/distributions.py:685: UserWarning: The distribution is specified by [0, 1.00001] and step=0.05, but the range is not divisible by `step`. It will be replaced by [0, 1.0].
  warnings.warn(
K:  10
alpha:  1.0
lr:  0.002349033301273567
weight_decay:  0.006714408916418687
dropout:  0.8
fix split and run 3 times
Data: Data(x=[19717, 500], y=[19717], train_mask=[19717], val_mask=[19717], test_mask=[19717], adj_t=[19717, 19717, nnz=88648])
num_train tensor(60)
num_noise 0
noise: tensor(0)
data feature 500
ALTOPT(
  (lins): Sequential(
    (0): Linear(in_features=500, out_features=64, bias=True)
    (1): BatchNorm1d(64, eps=1e-05, momentum=0.1, affine=True, track_running_stats=True)
    (2): Dropout(p=0.8, inplace=True)
    (3): ReLU(inplace=True)
    (4): Linear(in_features=64, out_features=3, bias=True)
    (5): Identity()
  )
  (prop): Propagation(K=10, mode=None, lambda1=None, lambda2=None, L21=True, alpha=1.0)
  (gcn): GCN(
    (convs): ModuleList(
      (0): GCNConv(500, 64)
      (1): GCNConv(64, 3)
    )
    (bns): ModuleList(
      (0): BatchNorm1d(64, eps=1e-05, momentum=0.1, affine=True, track_running_stats=True)
    )
    (output): Identity()
  )
)
propagate done
init label
Split: 01, Run: 01
None time:  1.9236552079673856
None Run 01:
Highest Train: 100.00
Highest Valid: 82.00
  Final Train: 100.00
   Final Test: 78.30
Split: 01, Run: 02
None time:  1.940084407106042
None Run 02:
Highest Train: 100.00
Highest Valid: 81.00
  Final Train: 100.00
   Final Test: 77.40
Split: 01, Run: 03
None time:  1.0659813869278878
None Run 03:
Highest Train: 100.00
Highest Valid: 78.40
  Final Train: 100.00
   Final Test: 76.90
run time now: 4.9827399253845215
total time:  5.025813301093876
None All runs:
Highest Train: 100.00 ± 0.00
Highest Valid: 80.47 ± 1.86
  Final Train: 100.00 ± 0.00
   Final Test: 77.53 ± 0.71
[I 2023-06-12 00:45:48,571] Trial 354 finished with value: 80.46666717529297 and parameters: {'Fwd': 4.512476401583716e-06, 'K': 10, 'alpha': 1.0, 'dropout': 0.8, 'gnnepoch': 70, 'lambda1': 0.65, 'lambda2': 3.2173038472425386, 'loop': 1, 'loss': 'MSE', 'lr': 0.002349033301273567, 'softmaxF': True, 'useGCN': False, 'weight_decay': 0.006714408916418687, 'weightedloss': False}. Best is trial 205 with value: 83.53333282470703.
/home/wxy/miniconda3/lib/python3.10/site-packages/optuna/distributions.py:685: UserWarning: The distribution is specified by [0, 1.00001] and step=0.05, but the range is not divisible by `step`. It will be replaced by [0, 1.0].
  warnings.warn(
K:  10
alpha:  1.0
lr:  0.002491517114419624
weight_decay:  0.005327443593882579
dropout:  0.9
fix split and run 3 times
Data: Data(x=[19717, 500], y=[19717], train_mask=[19717], val_mask=[19717], test_mask=[19717], adj_t=[19717, 19717, nnz=88648])
num_train tensor(60)
num_noise 0
noise: tensor(0)
data feature 500
ALTOPT(
  (lins): Sequential(
    (0): Linear(in_features=500, out_features=64, bias=True)
    (1): BatchNorm1d(64, eps=1e-05, momentum=0.1, affine=True, track_running_stats=True)
    (2): Dropout(p=0.9, inplace=True)
    (3): ReLU(inplace=True)
    (4): Linear(in_features=64, out_features=3, bias=True)
    (5): Identity()
  )
  (prop): Propagation(K=10, mode=None, lambda1=None, lambda2=None, L21=True, alpha=1.0)
  (gcn): GCN(
    (convs): ModuleList(
      (0): GCNConv(500, 64)
      (1): GCNConv(64, 3)
    )
    (bns): ModuleList(
      (0): BatchNorm1d(64, eps=1e-05, momentum=0.1, affine=True, track_running_stats=True)
    )
    (output): Identity()
  )
)
propagate done
init label
Split: 01, Run: 01
None time:  2.4655508790165186
None Run 01:
Highest Train: 100.00
Highest Valid: 83.20
  Final Train: 100.00
   Final Test: 79.20
Split: 01, Run: 02
None time:  1.5400926338043064
None Run 02:
Highest Train: 100.00
Highest Valid: 82.40
  Final Train: 100.00
   Final Test: 80.00
Split: 01, Run: 03
None time:  2.467539125820622
None Run 03:
Highest Train: 100.00
Highest Valid: 81.20
  Final Train: 100.00
   Final Test: 78.90
run time now: 6.523301124572754
total time:  6.576143522048369
None All runs:
Highest Train: 100.00 ± 0.00
Highest Valid: 82.27 ± 1.01
  Final Train: 100.00 ± 0.00
   Final Test: 79.37 ± 0.57
[I 2023-06-12 00:45:55,677] Trial 355 finished with value: 82.26667022705078 and parameters: {'Fwd': 3.1017033371705247e-06, 'K': 10, 'alpha': 1.0, 'dropout': 0.9, 'gnnepoch': 70, 'lambda1': 0.7000000000000001, 'lambda2': 5.03313646490154, 'loop': 1, 'loss': 'MSE', 'lr': 0.002491517114419624, 'softmaxF': True, 'useGCN': False, 'weight_decay': 0.005327443593882579, 'weightedloss': False}. Best is trial 205 with value: 83.53333282470703.
/home/wxy/miniconda3/lib/python3.10/site-packages/optuna/distributions.py:685: UserWarning: The distribution is specified by [0, 1.00001] and step=0.05, but the range is not divisible by `step`. It will be replaced by [0, 1.0].
  warnings.warn(
K:  10
alpha:  0.9500000000000001
lr:  0.00208331952584973
weight_decay:  0.004309616484972938
dropout:  0.9
fix split and run 3 times
Data: Data(x=[19717, 500], y=[19717], train_mask=[19717], val_mask=[19717], test_mask=[19717], adj_t=[19717, 19717, nnz=88648])
num_train tensor(60)
num_noise 0
noise: tensor(0)
data feature 500
ALTOPT(
  (lins): Sequential(
    (0): Linear(in_features=500, out_features=64, bias=True)
    (1): BatchNorm1d(64, eps=1e-05, momentum=0.1, affine=True, track_running_stats=True)
    (2): Dropout(p=0.9, inplace=True)
    (3): ReLU(inplace=True)
    (4): Linear(in_features=64, out_features=3, bias=True)
    (5): Identity()
  )
  (prop): Propagation(K=10, mode=None, lambda1=None, lambda2=None, L21=True, alpha=0.9500000000000001)
  (gcn): GCN(
    (convs): ModuleList(
      (0): GCNConv(500, 64)
      (1): GCNConv(64, 3)
    )
    (bns): ModuleList(
      (0): BatchNorm1d(64, eps=1e-05, momentum=0.1, affine=True, track_running_stats=True)
    )
    (output): Identity()
  )
)
propagate done
init label
Split: 01, Run: 01
None time:  2.068374545779079
None Run 01:
Highest Train: 100.00
Highest Valid: 83.00
  Final Train: 100.00
   Final Test: 77.60
Split: 01, Run: 02
None time:  1.9438210148364305
None Run 02:
Highest Train: 100.00
Highest Valid: 83.00
  Final Train: 100.00
   Final Test: 79.60
Split: 01, Run: 03
None time:  2.8753649939317256
None Run 03:
Highest Train: 100.00
Highest Valid: 83.20
  Final Train: 100.00
   Final Test: 80.20
run time now: 6.938920021057129
total time:  6.9882041569799185
None All runs:
Highest Train: 100.00 ± 0.00
Highest Valid: 83.07 ± 0.12
  Final Train: 100.00 ± 0.00
   Final Test: 79.13 ± 1.36
[I 2023-06-12 00:46:03,115] Trial 356 finished with value: 83.0666732788086 and parameters: {'Fwd': 3.6988904444744836e-06, 'K': 10, 'alpha': 0.9500000000000001, 'dropout': 0.9, 'gnnepoch': 70, 'lambda1': 0.9, 'lambda2': 3.4174152641659976, 'loop': 1, 'loss': 'MSE', 'lr': 0.00208331952584973, 'softmaxF': True, 'useGCN': False, 'weight_decay': 0.004309616484972938, 'weightedloss': False}. Best is trial 205 with value: 83.53333282470703.
/home/wxy/miniconda3/lib/python3.10/site-packages/optuna/distributions.py:685: UserWarning: The distribution is specified by [0, 1.00001] and step=0.05, but the range is not divisible by `step`. It will be replaced by [0, 1.0].
  warnings.warn(
K:  10
alpha:  1.0
lr:  0.0019988306899134164
weight_decay:  0.004401688341697552
dropout:  0.9
fix split and run 3 times
Data: Data(x=[19717, 500], y=[19717], train_mask=[19717], val_mask=[19717], test_mask=[19717], adj_t=[19717, 19717, nnz=88648])
num_train tensor(60)
num_noise 0
noise: tensor(0)
data feature 500
ALTOPT(
  (lins): Sequential(
    (0): Linear(in_features=500, out_features=64, bias=True)
    (1): BatchNorm1d(64, eps=1e-05, momentum=0.1, affine=True, track_running_stats=True)
    (2): Dropout(p=0.9, inplace=True)
    (3): ReLU(inplace=True)
    (4): Linear(in_features=64, out_features=3, bias=True)
    (5): Identity()
  )
  (prop): Propagation(K=10, mode=None, lambda1=None, lambda2=None, L21=True, alpha=1.0)
  (gcn): GCN(
    (convs): ModuleList(
      (0): GCNConv(500, 64)
      (1): GCNConv(64, 3)
    )
    (bns): ModuleList(
      (0): BatchNorm1d(64, eps=1e-05, momentum=0.1, affine=True, track_running_stats=True)
    )
    (output): Identity()
  )
)
propagate done
init label
Split: 01, Run: 01
None time:  2.033044173149392
None Run 01:
Highest Train: 100.00
Highest Valid: 82.00
  Final Train: 100.00
   Final Test: 78.80
Split: 01, Run: 02, Epoch: 100, Loss: 0.2041, Train: 100.00%, Valid: 81.40% Test: 79.10%
Split: 01, Run: 02
None time:  3.957530722953379
None Run 02:
Highest Train: 100.00
Highest Valid: 81.60
  Final Train: 100.00
   Final Test: 79.20
Split: 01, Run: 03
None time:  1.2770746250171214
None Run 03:
Highest Train: 100.00
Highest Valid: 82.60
  Final Train: 100.00
   Final Test: 80.10
run time now: 7.310812950134277
total time:  7.35712819499895
None All runs:
Highest Train: 100.00 ± 0.00
Highest Valid: 82.07 ± 0.50
  Final Train: 100.00 ± 0.00
   Final Test: 79.37 ± 0.67
[I 2023-06-12 00:46:11,079] Trial 357 finished with value: 82.0666732788086 and parameters: {'Fwd': 4.87916303821333e-06, 'K': 10, 'alpha': 1.0, 'dropout': 0.9, 'gnnepoch': 70, 'lambda1': 0.9500000000000001, 'lambda2': 3.345506162780314, 'loop': 1, 'loss': 'MSE', 'lr': 0.0019988306899134164, 'softmaxF': True, 'useGCN': False, 'weight_decay': 0.004401688341697552, 'weightedloss': False}. Best is trial 205 with value: 83.53333282470703.
/home/wxy/miniconda3/lib/python3.10/site-packages/optuna/distributions.py:685: UserWarning: The distribution is specified by [0, 1.00001] and step=0.05, but the range is not divisible by `step`. It will be replaced by [0, 1.0].
  warnings.warn(
K:  10
alpha:  0.9500000000000001
lr:  0.004822614355073063
weight_decay:  0.0067080013152148715
dropout:  0.9
fix split and run 3 times
Data: Data(x=[19717, 500], y=[19717], train_mask=[19717], val_mask=[19717], test_mask=[19717], adj_t=[19717, 19717, nnz=88648])
num_train tensor(60)
num_noise 0
noise: tensor(0)
data feature 500
ALTOPT(
  (lins): Sequential(
    (0): Linear(in_features=500, out_features=64, bias=True)
    (1): BatchNorm1d(64, eps=1e-05, momentum=0.1, affine=True, track_running_stats=True)
    (2): Dropout(p=0.9, inplace=True)
    (3): ReLU(inplace=True)
    (4): Linear(in_features=64, out_features=3, bias=True)
    (5): Identity()
  )
  (prop): Propagation(K=10, mode=None, lambda1=None, lambda2=None, L21=True, alpha=0.9500000000000001)
  (gcn): GCN(
    (convs): ModuleList(
      (0): GCNConv(500, 64)
      (1): GCNConv(64, 3)
    )
    (bns): ModuleList(
      (0): BatchNorm1d(64, eps=1e-05, momentum=0.1, affine=True, track_running_stats=True)
    )
    (output): Identity()
  )
)
propagate done
init label
Split: 01, Run: 01
None time:  2.12825372396037
None Run 01:
Highest Train: 100.00
Highest Valid: 83.80
  Final Train: 100.00
   Final Test: 79.20
Split: 01, Run: 02
None time:  1.8620549319311976
None Run 02:
Highest Train: 100.00
Highest Valid: 82.40
  Final Train: 100.00
   Final Test: 79.00
Split: 01, Run: 03
None time:  1.008876623120159
None Run 03:
Highest Train: 100.00
Highest Valid: 81.20
  Final Train: 100.00
   Final Test: 78.40
run time now: 5.060795307159424
total time:  5.112849517958239
None All runs:
Highest Train: 100.00 ± 0.00
Highest Valid: 82.47 ± 1.30
  Final Train: 100.00 ± 0.00
   Final Test: 78.87 ± 0.42
[I 2023-06-12 00:46:16,799] Trial 358 finished with value: 82.46666717529297 and parameters: {'Fwd': 5.719806551878442e-06, 'K': 10, 'alpha': 0.9500000000000001, 'dropout': 0.9, 'gnnepoch': 70, 'lambda1': 0.9, 'lambda2': 3.5701566180993876, 'loop': 1, 'loss': 'MSE', 'lr': 0.004822614355073063, 'softmaxF': True, 'useGCN': False, 'weight_decay': 0.0067080013152148715, 'weightedloss': False}. Best is trial 205 with value: 83.53333282470703.
/home/wxy/miniconda3/lib/python3.10/site-packages/optuna/distributions.py:685: UserWarning: The distribution is specified by [0, 1.00001] and step=0.05, but the range is not divisible by `step`. It will be replaced by [0, 1.0].
  warnings.warn(
K:  10
alpha:  0.9
lr:  0.0018115457055371976
weight_decay:  0.008598861776813382
dropout:  0.9
fix split and run 3 times
Data: Data(x=[19717, 500], y=[19717], train_mask=[19717], val_mask=[19717], test_mask=[19717], adj_t=[19717, 19717, nnz=88648])
num_train tensor(60)
num_noise 0
noise: tensor(0)
data feature 500
ALTOPT(
  (lins): Sequential(
    (0): Linear(in_features=500, out_features=64, bias=True)
    (1): BatchNorm1d(64, eps=1e-05, momentum=0.1, affine=True, track_running_stats=True)
    (2): Dropout(p=0.9, inplace=True)
    (3): ReLU(inplace=True)
    (4): Linear(in_features=64, out_features=3, bias=True)
    (5): Identity()
  )
  (prop): Propagation(K=10, mode=None, lambda1=None, lambda2=None, L21=True, alpha=0.9)
  (gcn): GCN(
    (convs): ModuleList(
      (0): GCNConv(500, 64)
      (1): GCNConv(64, 3)
    )
    (bns): ModuleList(
      (0): BatchNorm1d(64, eps=1e-05, momentum=0.1, affine=True, track_running_stats=True)
    )
    (output): Identity()
  )
)
propagate done
init label
Split: 01, Run: 01
None time:  2.102058429038152
None Run 01:
Highest Train: 100.00
Highest Valid: 81.40
  Final Train: 100.00
   Final Test: 76.80
Split: 01, Run: 02
None time:  1.3114693241659552
None Run 02:
Highest Train: 100.00
Highest Valid: 82.40
  Final Train: 100.00
   Final Test: 78.60
Split: 01, Run: 03
None time:  1.244450049009174
None Run 03:
Highest Train: 100.00
Highest Valid: 83.00
  Final Train: 100.00
   Final Test: 80.50
run time now: 4.721214771270752
total time:  4.771942537045106
None All runs:
Highest Train: 100.00 ± 0.00
Highest Valid: 82.27 ± 0.81
  Final Train: 100.00 ± 0.00
   Final Test: 78.63 ± 1.85
