[I 2023-06-12 00:47:37,460] Trial 376 finished with value: 81.33333587646484 and parameters: {'Fwd': 0.08145601849412151, 'K': 10, 'alpha': 0.7000000000000001, 'dropout': 0.5, 'gnnepoch': 60, 'lambda1': 0.8500000000000001, 'lambda2': 6.302806599178782, 'loop': 1, 'loss': 'CE', 'lr': 0.0087423363010977, 'softmaxF': True, 'useGCN': True, 'weight_decay': 0.00012475454510850378, 'weightedloss': False}. Best is trial 112 with value: 81.66667175292969.
/home/wxy/miniconda3/lib/python3.10/site-packages/optuna/distributions.py:685: UserWarning: The distribution is specified by [0, 1.00001] and step=0.05, but the range is not divisible by `step`. It will be replaced by [0, 1.0].
  warnings.warn(
K:  10
alpha:  0.5
lr:  0.007785019786387413
weight_decay:  4.869197617650519e-05
dropout:  0.6000000000000001
fix split and run 3 times
Data: Data(x=[2708, 1433], y=[2708], train_mask=[2708], val_mask=[2708], test_mask=[2708], adj_t=[2708, 2708, nnz=10556])
num_train tensor(140)
num_noise 0
noise: tensor(0)
data feature 1433
ALTOPT(
  (lins): Sequential(
    (0): Linear(in_features=1433, out_features=64, bias=True)
    (1): BatchNorm1d(64, eps=1e-05, momentum=0.1, affine=True, track_running_stats=True)
    (2): Dropout(p=0.6000000000000001, inplace=True)
    (3): ReLU(inplace=True)
    (4): Linear(in_features=64, out_features=7, bias=True)
    (5): LogSoftmax(dim=-1)
  )
  (prop): Propagation(K=10, mode=None, lambda1=None, lambda2=None, L21=True, alpha=0.5)
  (gcn): GCN(
    (convs): ModuleList(
      (0): GCNConv(1433, 64)
      (1): GCNConv(64, 7)
    )
    (bns): ModuleList(
      (0): BatchNorm1d(64, eps=1e-05, momentum=0.1, affine=True, track_running_stats=True)
    )
    (output): LogSoftmax(dim=-1)
  )
)
propagate done
init label
Split: 01, Run: 01
None time:  1.3963817269541323
None Run 01:
Highest Train: 100.00
Highest Valid: 81.80
  Final Train: 100.00
   Final Test: 82.50
Split: 01, Run: 02
None time:  1.5780602770391852
None Run 02:
Highest Train: 100.00
Highest Valid: 81.00
  Final Train: 100.00
   Final Test: 81.60
Split: 01, Run: 03
None time:  1.3825382329523563
None Run 03:
Highest Train: 100.00
Highest Valid: 80.60
  Final Train: 100.00
   Final Test: 81.70
run time now: 4.387516975402832
total time:  4.4058457592036575
None All runs:
Highest Train: 100.00 ± 0.00
Highest Valid: 81.13 ± 0.61
  Final Train: 100.00 ± 0.00
   Final Test: 81.93 ± 0.49
[I 2023-06-12 00:47:42,390] Trial 377 finished with value: 81.13333129882812 and parameters: {'Fwd': 0.06386184643595665, 'K': 10, 'alpha': 0.5, 'dropout': 0.6000000000000001, 'gnnepoch': 60, 'lambda1': 0.9, 'lambda2': 5.584454047701074, 'loop': 1, 'loss': 'CE', 'lr': 0.007785019786387413, 'softmaxF': False, 'useGCN': True, 'weight_decay': 4.869197617650519e-05, 'weightedloss': False}. Best is trial 112 with value: 81.66667175292969.
/home/wxy/miniconda3/lib/python3.10/site-packages/optuna/distributions.py:685: UserWarning: The distribution is specified by [0, 1.00001] and step=0.05, but the range is not divisible by `step`. It will be replaced by [0, 1.0].
  warnings.warn(
K:  10
alpha:  0.55
lr:  0.0055523090474004
weight_decay:  0.00016817443993400675
dropout:  0.4
fix split and run 3 times
Data: Data(x=[2708, 1433], y=[2708], train_mask=[2708], val_mask=[2708], test_mask=[2708], adj_t=[2708, 2708, nnz=10556])
num_train tensor(140)
num_noise 0
noise: tensor(0)
data feature 1433
ALTOPT(
  (lins): Sequential(
    (0): Linear(in_features=1433, out_features=64, bias=True)
    (1): BatchNorm1d(64, eps=1e-05, momentum=0.1, affine=True, track_running_stats=True)
    (2): Dropout(p=0.4, inplace=True)
    (3): ReLU(inplace=True)
    (4): Linear(in_features=64, out_features=7, bias=True)
    (5): LogSoftmax(dim=-1)
  )
  (prop): Propagation(K=10, mode=None, lambda1=None, lambda2=None, L21=True, alpha=0.55)
  (gcn): GCN(
    (convs): ModuleList(
      (0): GCNConv(1433, 64)
      (1): GCNConv(64, 7)
    )
    (bns): ModuleList(
      (0): BatchNorm1d(64, eps=1e-05, momentum=0.1, affine=True, track_running_stats=True)
    )
    (output): LogSoftmax(dim=-1)
  )
)
propagate done
init label
Split: 01, Run: 01
None time:  1.4580617700703442
None Run 01:
Highest Train: 100.00
Highest Valid: 81.40
  Final Train: 100.00
   Final Test: 81.80
Split: 01, Run: 02
None time:  1.2920563779771328
None Run 02:
Highest Train: 100.00
Highest Valid: 81.20
  Final Train: 100.00
   Final Test: 81.30
Split: 01, Run: 03
None time:  1.6617863809224218
None Run 03:
Highest Train: 100.00
Highest Valid: 80.80
  Final Train: 100.00
   Final Test: 81.30
run time now: 4.439611196517944
total time:  4.468027669005096
None All runs:
Highest Train: 100.00 ± 0.00
Highest Valid: 81.13 ± 0.31
  Final Train: 100.00 ± 0.00
   Final Test: 81.47 ± 0.29
[I 2023-06-12 00:47:47,432] Trial 378 finished with value: 81.13333892822266 and parameters: {'Fwd': 0.09928605630815976, 'K': 10, 'alpha': 0.55, 'dropout': 0.4, 'gnnepoch': 60, 'lambda1': 0.8, 'lambda2': 5.325202328585184, 'loop': 1, 'loss': 'CE', 'lr': 0.0055523090474004, 'softmaxF': True, 'useGCN': True, 'weight_decay': 0.00016817443993400675, 'weightedloss': False}. Best is trial 112 with value: 81.66667175292969.
/home/wxy/miniconda3/lib/python3.10/site-packages/optuna/distributions.py:685: UserWarning: The distribution is specified by [0, 1.00001] and step=0.05, but the range is not divisible by `step`. It will be replaced by [0, 1.0].
  warnings.warn(
K:  10
alpha:  0.65
lr:  0.006745024146587626
weight_decay:  8.96072858753315e-05
dropout:  0.4
fix split and run 3 times
Data: Data(x=[2708, 1433], y=[2708], train_mask=[2708], val_mask=[2708], test_mask=[2708], adj_t=[2708, 2708, nnz=10556])
num_train tensor(140)
num_noise 0
noise: tensor(0)
data feature 1433
ALTOPT(
  (lins): Sequential(
    (0): Linear(in_features=1433, out_features=64, bias=True)
    (1): BatchNorm1d(64, eps=1e-05, momentum=0.1, affine=True, track_running_stats=True)
    (2): Dropout(p=0.4, inplace=True)
    (3): ReLU(inplace=True)
    (4): Linear(in_features=64, out_features=7, bias=True)
    (5): LogSoftmax(dim=-1)
  )
  (prop): Propagation(K=10, mode=None, lambda1=None, lambda2=None, L21=True, alpha=0.65)
  (gcn): GCN(
    (convs): ModuleList(
      (0): GCNConv(1433, 64)
      (1): GCNConv(64, 7)
    )
    (bns): ModuleList(
      (0): BatchNorm1d(64, eps=1e-05, momentum=0.1, affine=True, track_running_stats=True)
    )
    (output): LogSoftmax(dim=-1)
  )
)
propagate done
init label
Split: 01, Run: 01
None time:  1.792553620878607
None Run 01:
Highest Train: 100.00
Highest Valid: 80.60
  Final Train: 100.00
   Final Test: 82.80
Split: 01, Run: 02
None time:  1.6543179000727832
None Run 02:
Highest Train: 100.00
Highest Valid: 81.00
  Final Train: 100.00
   Final Test: 82.10
Split: 01, Run: 03
None time:  1.5310264590661973
None Run 03:
Highest Train: 100.00
Highest Valid: 80.40
  Final Train: 100.00
   Final Test: 81.00
run time now: 5.004407167434692
total time:  5.019078345969319
None All runs:
Highest Train: 100.00 ± 0.00
Highest Valid: 80.67 ± 0.31
  Final Train: 100.00 ± 0.00
   Final Test: 81.97 ± 0.91
[I 2023-06-12 00:47:53,003] Trial 379 finished with value: 80.66666412353516 and parameters: {'Fwd': 0.012112101901593566, 'K': 10, 'alpha': 0.65, 'dropout': 0.4, 'gnnepoch': 70, 'lambda1': 0.9, 'lambda2': 6.002153879973697, 'loop': 1, 'loss': 'CE', 'lr': 0.006745024146587626, 'softmaxF': True, 'useGCN': True, 'weight_decay': 8.96072858753315e-05, 'weightedloss': True}. Best is trial 112 with value: 81.66667175292969.
/home/wxy/miniconda3/lib/python3.10/site-packages/optuna/distributions.py:685: UserWarning: The distribution is specified by [0, 1.00001] and step=0.05, but the range is not divisible by `step`. It will be replaced by [0, 1.0].
  warnings.warn(
K:  10
alpha:  0.45
lr:  0.00923828263010662
weight_decay:  7.379887822003652e-05
dropout:  0.4
fix split and run 3 times
Data: Data(x=[2708, 1433], y=[2708], train_mask=[2708], val_mask=[2708], test_mask=[2708], adj_t=[2708, 2708, nnz=10556])
num_train tensor(140)
num_noise 0
noise: tensor(0)
data feature 1433
ALTOPT(
  (lins): Sequential(
    (0): Linear(in_features=1433, out_features=64, bias=True)
    (1): BatchNorm1d(64, eps=1e-05, momentum=0.1, affine=True, track_running_stats=True)
    (2): Dropout(p=0.4, inplace=True)
    (3): ReLU(inplace=True)
    (4): Linear(in_features=64, out_features=7, bias=True)
    (5): LogSoftmax(dim=-1)
  )
  (prop): Propagation(K=10, mode=None, lambda1=None, lambda2=None, L21=True, alpha=0.45)
  (gcn): GCN(
    (convs): ModuleList(
      (0): GCNConv(1433, 64)
      (1): GCNConv(64, 7)
    )
    (bns): ModuleList(
      (0): BatchNorm1d(64, eps=1e-05, momentum=0.1, affine=True, track_running_stats=True)
    )
    (output): LogSoftmax(dim=-1)
  )
)
propagate done
init label
Split: 01, Run: 01
None time:  1.5059837389271706
None Run 01:
Highest Train: 100.00
Highest Valid: 81.60
  Final Train: 100.00
   Final Test: 82.10
Split: 01, Run: 02
None time:  1.4340091119520366
None Run 02:
Highest Train: 100.00
Highest Valid: 81.40
  Final Train: 100.00
   Final Test: 81.00
Split: 01, Run: 03
None time:  1.6820477941073477
None Run 03:
Highest Train: 100.00
Highest Valid: 81.00
  Final Train: 100.00
   Final Test: 81.00
run time now: 4.66057014465332
total time:  4.680382869904861
None All runs:
Highest Train: 100.00 ± 0.00
Highest Valid: 81.33 ± 0.31
  Final Train: 100.00 ± 0.00
   Final Test: 81.37 ± 0.64
[I 2023-06-12 00:47:58,155] Trial 380 finished with value: 81.33333587646484 and parameters: {'Fwd': 0.0484285522678397, 'K': 10, 'alpha': 0.45, 'dropout': 0.4, 'gnnepoch': 60, 'lambda1': 0.8500000000000001, 'lambda2': 5.815265794650826, 'loop': 1, 'loss': 'CE', 'lr': 0.00923828263010662, 'softmaxF': True, 'useGCN': True, 'weight_decay': 7.379887822003652e-05, 'weightedloss': False}. Best is trial 112 with value: 81.66667175292969.
/home/wxy/miniconda3/lib/python3.10/site-packages/optuna/distributions.py:685: UserWarning: The distribution is specified by [0, 1.00001] and step=0.05, but the range is not divisible by `step`. It will be replaced by [0, 1.0].
  warnings.warn(
K:  10
alpha:  0.35000000000000003
lr:  0.008150562525953213
weight_decay:  2.641292804521514e-05
dropout:  0.5
fix split and run 3 times
Data: Data(x=[2708, 1433], y=[2708], train_mask=[2708], val_mask=[2708], test_mask=[2708], adj_t=[2708, 2708, nnz=10556])
num_train tensor(140)
num_noise 0
noise: tensor(0)
data feature 1433
ALTOPT(
  (lins): Sequential(
    (0): Linear(in_features=1433, out_features=64, bias=True)
    (1): BatchNorm1d(64, eps=1e-05, momentum=0.1, affine=True, track_running_stats=True)
    (2): Dropout(p=0.5, inplace=True)
    (3): ReLU(inplace=True)
    (4): Linear(in_features=64, out_features=7, bias=True)
    (5): LogSoftmax(dim=-1)
  )
  (prop): Propagation(K=10, mode=None, lambda1=None, lambda2=None, L21=True, alpha=0.35000000000000003)
  (gcn): GCN(
    (convs): ModuleList(
      (0): GCNConv(1433, 64)
      (1): GCNConv(64, 7)
    )
    (bns): ModuleList(
      (0): BatchNorm1d(64, eps=1e-05, momentum=0.1, affine=True, track_running_stats=True)
    )
    (output): LogSoftmax(dim=-1)
  )
)
propagate done
init label
Split: 01, Run: 01
None time:  1.342346103163436
None Run 01:
Highest Train: 100.00
Highest Valid: 82.40
  Final Train: 100.00
   Final Test: 82.30
Split: 01, Run: 02
None time:  1.616616687970236
None Run 02:
Highest Train: 100.00
Highest Valid: 81.20
  Final Train: 100.00
   Final Test: 80.90
Split: 01, Run: 03
None time:  1.6885767420753837
None Run 03:
Highest Train: 100.00
Highest Valid: 81.00
  Final Train: 100.00
   Final Test: 81.00
run time now: 4.674493074417114
total time:  4.698596623027697
None All runs:
Highest Train: 100.00 ± 0.00
Highest Valid: 81.53 ± 0.76
  Final Train: 100.00 ± 0.00
   Final Test: 81.40 ± 0.78
[I 2023-06-12 00:48:03,379] Trial 381 finished with value: 81.53333282470703 and parameters: {'Fwd': 0.07877455657163336, 'K': 10, 'alpha': 0.35000000000000003, 'dropout': 0.5, 'gnnepoch': 60, 'lambda1': 0.8, 'lambda2': 5.136414153487724, 'loop': 1, 'loss': 'CE', 'lr': 0.008150562525953213, 'softmaxF': True, 'useGCN': True, 'weight_decay': 2.641292804521514e-05, 'weightedloss': False}. Best is trial 112 with value: 81.66667175292969.
/home/wxy/miniconda3/lib/python3.10/site-packages/optuna/distributions.py:685: UserWarning: The distribution is specified by [0, 1.00001] and step=0.05, but the range is not divisible by `step`. It will be replaced by [0, 1.0].
  warnings.warn(
K:  10
alpha:  0.6000000000000001
lr:  0.006858871517778136
weight_decay:  0.019699920543702804
dropout:  0.4
fix split and run 3 times
Data: Data(x=[2708, 1433], y=[2708], train_mask=[2708], val_mask=[2708], test_mask=[2708], adj_t=[2708, 2708, nnz=10556])
num_train tensor(140)
num_noise 0
noise: tensor(0)
data feature 1433
ALTOPT(
  (lins): Sequential(
    (0): Linear(in_features=1433, out_features=64, bias=True)
    (1): BatchNorm1d(64, eps=1e-05, momentum=0.1, affine=True, track_running_stats=True)
    (2): Dropout(p=0.4, inplace=True)
    (3): ReLU(inplace=True)
    (4): Linear(in_features=64, out_features=7, bias=True)
    (5): LogSoftmax(dim=-1)
  )
  (prop): Propagation(K=10, mode=None, lambda1=None, lambda2=None, L21=True, alpha=0.6000000000000001)
  (gcn): GCN(
    (convs): ModuleList(
      (0): GCNConv(1433, 64)
      (1): GCNConv(64, 7)
    )
    (bns): ModuleList(
      (0): BatchNorm1d(64, eps=1e-05, momentum=0.1, affine=True, track_running_stats=True)
    )
    (output): LogSoftmax(dim=-1)
  )
)
propagate done
init label
Split: 01, Run: 01
None time:  1.407658803043887
None Run 01:
Highest Train: 100.00
Highest Valid: 81.40
  Final Train: 100.00
   Final Test: 81.50
Split: 01, Run: 02
None time:  1.0429812700022012
None Run 02:
Highest Train: 100.00
Highest Valid: 81.00
  Final Train: 100.00
   Final Test: 81.30
Split: 01, Run: 03
None time:  1.4738413179293275
None Run 03:
Highest Train: 100.00
Highest Valid: 81.20
  Final Train: 100.00
   Final Test: 81.40
run time now: 3.9562828540802
total time:  3.979809907032177
None All runs:
Highest Train: 100.00 ± 0.00
Highest Valid: 81.20 ± 0.20
  Final Train: 100.00 ± 0.00
   Final Test: 81.40 ± 0.10
[I 2023-06-12 00:48:07,840] Trial 382 finished with value: 81.19999694824219 and parameters: {'Fwd': 0.0004179210948133004, 'K': 10, 'alpha': 0.6000000000000001, 'dropout': 0.4, 'gnnepoch': 50, 'lambda1': 0.8500000000000001, 'lambda2': 5.41198775336579, 'loop': 1, 'loss': 'CE', 'lr': 0.006858871517778136, 'softmaxF': True, 'useGCN': True, 'weight_decay': 0.019699920543702804, 'weightedloss': False}. Best is trial 112 with value: 81.66667175292969.
/home/wxy/miniconda3/lib/python3.10/site-packages/optuna/distributions.py:685: UserWarning: The distribution is specified by [0, 1.00001] and step=0.05, but the range is not divisible by `step`. It will be replaced by [0, 1.0].
  warnings.warn(
K:  5
alpha:  0.55
lr:  0.009962175842966221
weight_decay:  0.0006699353615039714
dropout:  0.4
fix split and run 3 times
Data: Data(x=[2708, 1433], y=[2708], train_mask=[2708], val_mask=[2708], test_mask=[2708], adj_t=[2708, 2708, nnz=10556])
num_train tensor(140)
num_noise 0
noise: tensor(0)
data feature 1433
ALTOPT(
  (lins): Sequential(
    (0): Linear(in_features=1433, out_features=64, bias=True)
    (1): BatchNorm1d(64, eps=1e-05, momentum=0.1, affine=True, track_running_stats=True)
    (2): Dropout(p=0.4, inplace=True)
    (3): ReLU(inplace=True)
    (4): Linear(in_features=64, out_features=7, bias=True)
    (5): LogSoftmax(dim=-1)
  )
  (prop): Propagation(K=5, mode=None, lambda1=None, lambda2=None, L21=True, alpha=0.55)
  (gcn): GCN(
    (convs): ModuleList(
      (0): GCNConv(1433, 64)
      (1): GCNConv(64, 7)
    )
    (bns): ModuleList(
      (0): BatchNorm1d(64, eps=1e-05, momentum=0.1, affine=True, track_running_stats=True)
    )
    (output): LogSoftmax(dim=-1)
  )
)
propagate done
init label
Split: 01, Run: 01
None time:  1.5727416530717164
None Run 01:
Highest Train: 100.00
Highest Valid: 81.00
  Final Train: 100.00
   Final Test: 82.90
Split: 01, Run: 02
None time:  1.534422712866217
None Run 02:
Highest Train: 100.00
Highest Valid: 80.20
  Final Train: 99.29
   Final Test: 80.50
Split: 01, Run: 03
None time:  1.240039920900017
None Run 03:
Highest Train: 100.00
Highest Valid: 81.20
  Final Train: 99.29
   Final Test: 82.20
run time now: 4.373760938644409
total time:  4.387322677997872
None All runs:
Highest Train: 100.00 ± 0.00
Highest Valid: 80.80 ± 0.53
  Final Train: 99.52 ± 0.41
   Final Test: 81.87 ± 1.23
[I 2023-06-12 00:48:12,754] Trial 383 finished with value: 80.79999542236328 and parameters: {'Fwd': 0.00025418886286816714, 'K': 5, 'alpha': 0.55, 'dropout': 0.4, 'gnnepoch': 60, 'lambda1': 0.9, 'lambda2': 1.5933008573500063, 'loop': 1, 'loss': 'CE', 'lr': 0.009962175842966221, 'softmaxF': True, 'useGCN': True, 'weight_decay': 0.0006699353615039714, 'weightedloss': True}. Best is trial 112 with value: 81.66667175292969.
/home/wxy/miniconda3/lib/python3.10/site-packages/optuna/distributions.py:685: UserWarning: The distribution is specified by [0, 1.00001] and step=0.05, but the range is not divisible by `step`. It will be replaced by [0, 1.0].
  warnings.warn(
K:  10
alpha:  0.75
lr:  0.0073381266496067975
weight_decay:  0.0001097498339847602
dropout:  0.5
fix split and run 3 times
Data: Data(x=[2708, 1433], y=[2708], train_mask=[2708], val_mask=[2708], test_mask=[2708], adj_t=[2708, 2708, nnz=10556])
num_train tensor(140)
num_noise 0
noise: tensor(0)
data feature 1433
ALTOPT(
  (lins): Sequential(
    (0): Linear(in_features=1433, out_features=64, bias=True)
    (1): BatchNorm1d(64, eps=1e-05, momentum=0.1, affine=True, track_running_stats=True)
    (2): Dropout(p=0.5, inplace=True)
    (3): ReLU(inplace=True)
    (4): Linear(in_features=64, out_features=7, bias=True)
    (5): LogSoftmax(dim=-1)
  )
  (prop): Propagation(K=10, mode=None, lambda1=None, lambda2=None, L21=True, alpha=0.75)
  (gcn): GCN(
    (convs): ModuleList(
      (0): GCNConv(1433, 64)
      (1): GCNConv(64, 7)
    )
    (bns): ModuleList(
      (0): BatchNorm1d(64, eps=1e-05, momentum=0.1, affine=True, track_running_stats=True)
    )
    (output): LogSoftmax(dim=-1)
  )
)
propagate done
init label
Split: 01, Run: 01
None time:  1.6347051330376416
None Run 01:
Highest Train: 100.00
Highest Valid: 82.20
  Final Train: 99.29
   Final Test: 81.60
Split: 01, Run: 02
None time:  1.6267133648507297
None Run 02:
Highest Train: 100.00
Highest Valid: 81.40
  Final Train: 99.29
   Final Test: 81.00
Split: 01, Run: 03
None time:  1.644994179951027
None Run 03:
Highest Train: 100.00
Highest Valid: 80.80
  Final Train: 98.57
   Final Test: 81.50
run time now: 4.936269521713257
total time:  4.960735474945977
None All runs:
Highest Train: 100.00 ± 0.00
Highest Valid: 81.47 ± 0.70
  Final Train: 99.05 ± 0.41
   Final Test: 81.37 ± 0.32
[I 2023-06-12 00:48:18,328] Trial 384 finished with value: 81.46666717529297 and parameters: {'Fwd': 0.06106309193005317, 'K': 10, 'alpha': 0.75, 'dropout': 0.5, 'gnnepoch': 60, 'lambda1': 0.9500000000000001, 'lambda2': 0.5212924799790315, 'loop': 1, 'loss': 'CE', 'lr': 0.0073381266496067975, 'softmaxF': True, 'useGCN': True, 'weight_decay': 0.0001097498339847602, 'weightedloss': False}. Best is trial 112 with value: 81.66667175292969.
/home/wxy/miniconda3/lib/python3.10/site-packages/optuna/distributions.py:685: UserWarning: The distribution is specified by [0, 1.00001] and step=0.05, but the range is not divisible by `step`. It will be replaced by [0, 1.0].
  warnings.warn(
K:  9
alpha:  0.6000000000000001
lr:  0.006307819158372166
weight_decay:  0.008070613560281072
dropout:  0.4
fix split and run 3 times
Data: Data(x=[2708, 1433], y=[2708], train_mask=[2708], val_mask=[2708], test_mask=[2708], adj_t=[2708, 2708, nnz=10556])
num_train tensor(140)
num_noise 0
noise: tensor(0)
data feature 1433
ALTOPT(
  (lins): Sequential(
    (0): Linear(in_features=1433, out_features=64, bias=True)
    (1): BatchNorm1d(64, eps=1e-05, momentum=0.1, affine=True, track_running_stats=True)
    (2): Dropout(p=0.4, inplace=True)
    (3): ReLU(inplace=True)
    (4): Linear(in_features=64, out_features=7, bias=True)
    (5): Identity()
  )
  (prop): Propagation(K=9, mode=None, lambda1=None, lambda2=None, L21=True, alpha=0.6000000000000001)
  (gcn): GCN(
    (convs): ModuleList(
      (0): GCNConv(1433, 64)
      (1): GCNConv(64, 7)
    )
    (bns): ModuleList(
      (0): BatchNorm1d(64, eps=1e-05, momentum=0.1, affine=True, track_running_stats=True)
    )
    (output): Identity()
  )
)
propagate done
init label
Split: 01, Run: 01
None time:  2.53321294602938
None Run 01:
Highest Train: 100.00
Highest Valid: 80.00
  Final Train: 100.00
   Final Test: 79.40
Split: 01, Run: 02
None time:  1.8272853640373796
None Run 02:
Highest Train: 100.00
Highest Valid: 78.60
  Final Train: 100.00
   Final Test: 78.20
Split: 01, Run: 03
None time:  1.4996912269853055
None Run 03:
Highest Train: 100.00
Highest Valid: 78.00
  Final Train: 100.00
   Final Test: 78.40
run time now: 5.885054111480713
total time:  5.9023067250382155
None All runs:
Highest Train: 100.00 ± 0.00
Highest Valid: 78.87 ± 1.03
  Final Train: 100.00 ± 0.00
   Final Test: 78.67 ± 0.64
