[I 2023-06-12 00:21:11,929] Trial 79 finished with value: 79.13333129882812 and parameters: {'Fwd': 0.003003359133549789, 'K': 10, 'alpha': 0.05, 'dropout': 0.7000000000000001, 'gnnepoch': 30, 'lambda1': 0.45, 'lambda2': 5.083620722998586, 'loop': 1, 'loss': 'CE', 'lr': 0.004427644634650626, 'softmaxF': True, 'useGCN': True, 'weight_decay': 3.458850024212269e-05, 'weightedloss': True}. Best is trial 60 with value: 81.33333587646484.
/home/wxy/miniconda3/lib/python3.10/site-packages/optuna/distributions.py:685: UserWarning: The distribution is specified by [0, 1.00001] and step=0.05, but the range is not divisible by `step`. It will be replaced by [0, 1.0].
  warnings.warn(
K:  9
alpha:  0.05
lr:  0.0048862174133565105
weight_decay:  1.7058821436207823e-05
dropout:  0.5
fix split and run 3 times
Data: Data(x=[2708, 1433], y=[2708], train_mask=[2708], val_mask=[2708], test_mask=[2708], adj_t=[2708, 2708, nnz=10556])
num_train tensor(140)
num_noise 0
noise: tensor(0)
data feature 1433
ALTOPT(
  (lins): Sequential(
    (0): Linear(in_features=1433, out_features=64, bias=True)
    (1): BatchNorm1d(64, eps=1e-05, momentum=0.1, affine=True, track_running_stats=True)
    (2): Dropout(p=0.5, inplace=True)
    (3): ReLU(inplace=True)
    (4): Linear(in_features=64, out_features=7, bias=True)
    (5): LogSoftmax(dim=-1)
  )
  (prop): Propagation(K=9, mode=None, lambda1=None, lambda2=None, L21=True, alpha=0.05)
  (gcn): GCN(
    (convs): ModuleList(
      (0): GCNConv(1433, 64)
      (1): GCNConv(64, 7)
    )
    (bns): ModuleList(
      (0): BatchNorm1d(64, eps=1e-05, momentum=0.1, affine=True, track_running_stats=True)
    )
    (output): LogSoftmax(dim=-1)
  )
)
propagate done
init label
Split: 01, Run: 01
None time:  1.4746122849173844
None Run 01:
Highest Train: 100.00
Highest Valid: 81.40
  Final Train: 100.00
   Final Test: 81.60
Split: 01, Run: 02
None time:  1.6043497798964381
None Run 02:
Highest Train: 100.00
Highest Valid: 80.60
  Final Train: 100.00
   Final Test: 82.20
Split: 01, Run: 03
None time:  1.2651713681407273
None Run 03:
Highest Train: 100.00
Highest Valid: 81.00
  Final Train: 100.00
   Final Test: 80.60
run time now: 4.378994703292847
total time:  4.399067038903013
None All runs:
Highest Train: 100.00 ± 0.00
Highest Valid: 81.00 ± 0.40
  Final Train: 100.00 ± 0.00
   Final Test: 81.47 ± 0.81
[I 2023-06-12 00:21:16,791] Trial 80 finished with value: 81.0 and parameters: {'Fwd': 0.010903991007748554, 'K': 9, 'alpha': 0.05, 'dropout': 0.5, 'gnnepoch': 50, 'lambda1': 0.45, 'lambda2': 6.009657490232007, 'loop': 1, 'loss': 'CE', 'lr': 0.0048862174133565105, 'softmaxF': True, 'useGCN': True, 'weight_decay': 1.7058821436207823e-05, 'weightedloss': True}. Best is trial 60 with value: 81.33333587646484.
/home/wxy/miniconda3/lib/python3.10/site-packages/optuna/distributions.py:685: UserWarning: The distribution is specified by [0, 1.00001] and step=0.05, but the range is not divisible by `step`. It will be replaced by [0, 1.0].
  warnings.warn(
K:  9
alpha:  0.05
lr:  0.005021507966195523
weight_decay:  1.5606966791347438e-05
dropout:  0.5
fix split and run 3 times
Data: Data(x=[2708, 1433], y=[2708], train_mask=[2708], val_mask=[2708], test_mask=[2708], adj_t=[2708, 2708, nnz=10556])
num_train tensor(140)
num_noise 0
noise: tensor(0)
data feature 1433
ALTOPT(
  (lins): Sequential(
    (0): Linear(in_features=1433, out_features=64, bias=True)
    (1): BatchNorm1d(64, eps=1e-05, momentum=0.1, affine=True, track_running_stats=True)
    (2): Dropout(p=0.5, inplace=True)
    (3): ReLU(inplace=True)
    (4): Linear(in_features=64, out_features=7, bias=True)
    (5): LogSoftmax(dim=-1)
  )
  (prop): Propagation(K=9, mode=None, lambda1=None, lambda2=None, L21=True, alpha=0.05)
  (gcn): GCN(
    (convs): ModuleList(
      (0): GCNConv(1433, 64)
      (1): GCNConv(64, 7)
    )
    (bns): ModuleList(
      (0): BatchNorm1d(64, eps=1e-05, momentum=0.1, affine=True, track_running_stats=True)
    )
    (output): LogSoftmax(dim=-1)
  )
)
propagate done
init label
Split: 01, Run: 01
None time:  1.4718357590027153
None Run 01:
Highest Train: 100.00
Highest Valid: 81.40
  Final Train: 100.00
   Final Test: 81.80
Split: 01, Run: 02
None time:  1.802547027124092
None Run 02:
Highest Train: 100.00
Highest Valid: 80.60
  Final Train: 100.00
   Final Test: 82.40
Split: 01, Run: 03
None time:  1.4633967359550297
None Run 03:
Highest Train: 100.00
Highest Valid: 81.00
  Final Train: 100.00
   Final Test: 80.50
run time now: 4.7649946212768555
total time:  4.789728943025693
None All runs:
Highest Train: 100.00 ± 0.00
Highest Valid: 81.00 ± 0.40
  Final Train: 100.00 ± 0.00
   Final Test: 81.57 ± 0.97
[I 2023-06-12 00:21:22,101] Trial 81 finished with value: 81.0 and parameters: {'Fwd': 0.011559738202838427, 'K': 9, 'alpha': 0.05, 'dropout': 0.5, 'gnnepoch': 50, 'lambda1': 0.45, 'lambda2': 5.951556864139292, 'loop': 1, 'loss': 'CE', 'lr': 0.005021507966195523, 'softmaxF': True, 'useGCN': True, 'weight_decay': 1.5606966791347438e-05, 'weightedloss': True}. Best is trial 60 with value: 81.33333587646484.
/home/wxy/miniconda3/lib/python3.10/site-packages/optuna/distributions.py:685: UserWarning: The distribution is specified by [0, 1.00001] and step=0.05, but the range is not divisible by `step`. It will be replaced by [0, 1.0].
  warnings.warn(
K:  9
alpha:  0.05
lr:  0.005197549357863539
weight_decay:  1.5196952004941916e-05
dropout:  0.5
fix split and run 3 times
Data: Data(x=[2708, 1433], y=[2708], train_mask=[2708], val_mask=[2708], test_mask=[2708], adj_t=[2708, 2708, nnz=10556])
num_train tensor(140)
num_noise 0
noise: tensor(0)
data feature 1433
ALTOPT(
  (lins): Sequential(
    (0): Linear(in_features=1433, out_features=64, bias=True)
    (1): BatchNorm1d(64, eps=1e-05, momentum=0.1, affine=True, track_running_stats=True)
    (2): Dropout(p=0.5, inplace=True)
    (3): ReLU(inplace=True)
    (4): Linear(in_features=64, out_features=7, bias=True)
    (5): LogSoftmax(dim=-1)
  )
  (prop): Propagation(K=9, mode=None, lambda1=None, lambda2=None, L21=True, alpha=0.05)
  (gcn): GCN(
    (convs): ModuleList(
      (0): GCNConv(1433, 64)
      (1): GCNConv(64, 7)
    )
    (bns): ModuleList(
      (0): BatchNorm1d(64, eps=1e-05, momentum=0.1, affine=True, track_running_stats=True)
    )
    (output): LogSoftmax(dim=-1)
  )
)
propagate done
init label
Split: 01, Run: 01
None time:  1.372832708992064
None Run 01:
Highest Train: 100.00
Highest Valid: 81.20
  Final Train: 100.00
   Final Test: 82.20
Split: 01, Run: 02
None time:  1.6491749279666692
None Run 02:
Highest Train: 100.00
Highest Valid: 80.60
  Final Train: 100.00
   Final Test: 82.20
Split: 01, Run: 03
None time:  1.449075856944546
None Run 03:
Highest Train: 100.00
Highest Valid: 81.00
  Final Train: 100.00
   Final Test: 80.50
run time now: 4.49855375289917
total time:  4.524146392010152
None All runs:
Highest Train: 100.00 ± 0.00
Highest Valid: 80.93 ± 0.31
  Final Train: 100.00 ± 0.00
   Final Test: 81.63 ± 0.98
[I 2023-06-12 00:21:27,179] Trial 82 finished with value: 80.9333267211914 and parameters: {'Fwd': 0.010263440996947162, 'K': 9, 'alpha': 0.05, 'dropout': 0.5, 'gnnepoch': 50, 'lambda1': 0.5, 'lambda2': 6.033942984006932, 'loop': 1, 'loss': 'CE', 'lr': 0.005197549357863539, 'softmaxF': True, 'useGCN': True, 'weight_decay': 1.5196952004941916e-05, 'weightedloss': True}. Best is trial 60 with value: 81.33333587646484.
/home/wxy/miniconda3/lib/python3.10/site-packages/optuna/distributions.py:685: UserWarning: The distribution is specified by [0, 1.00001] and step=0.05, but the range is not divisible by `step`. It will be replaced by [0, 1.0].
  warnings.warn(
K:  9
alpha:  0.05
lr:  0.0049856787449352276
weight_decay:  1.1562317549706022e-05
dropout:  0.5
fix split and run 3 times
Data: Data(x=[2708, 1433], y=[2708], train_mask=[2708], val_mask=[2708], test_mask=[2708], adj_t=[2708, 2708, nnz=10556])
num_train tensor(140)
num_noise 0
noise: tensor(0)
data feature 1433
ALTOPT(
  (lins): Sequential(
    (0): Linear(in_features=1433, out_features=64, bias=True)
    (1): BatchNorm1d(64, eps=1e-05, momentum=0.1, affine=True, track_running_stats=True)
    (2): Dropout(p=0.5, inplace=True)
    (3): ReLU(inplace=True)
    (4): Linear(in_features=64, out_features=7, bias=True)
    (5): LogSoftmax(dim=-1)
  )
  (prop): Propagation(K=9, mode=None, lambda1=None, lambda2=None, L21=True, alpha=0.05)
  (gcn): GCN(
    (convs): ModuleList(
      (0): GCNConv(1433, 64)
      (1): GCNConv(64, 7)
    )
    (bns): ModuleList(
      (0): BatchNorm1d(64, eps=1e-05, momentum=0.1, affine=True, track_running_stats=True)
    )
    (output): LogSoftmax(dim=-1)
  )
)
propagate done
init label
Split: 01, Run: 01
None time:  0.973123705945909
None Run 01:
Highest Train: 100.00
Highest Valid: 81.00
  Final Train: 100.00
   Final Test: 81.60
Split: 01, Run: 02
None time:  1.4795887358486652
None Run 02:
Highest Train: 100.00
Highest Valid: 80.40
  Final Train: 100.00
   Final Test: 81.60
Split: 01, Run: 03
None time:  1.4859994100406766
None Run 03:
Highest Train: 100.00
Highest Valid: 80.60
  Final Train: 100.00
   Final Test: 81.70
run time now: 3.9601633548736572
total time:  3.9827411151491106
None All runs:
Highest Train: 100.00 ± 0.00
Highest Valid: 80.67 ± 0.31
  Final Train: 100.00 ± 0.00
   Final Test: 81.63 ± 0.06
[I 2023-06-12 00:21:31,718] Trial 83 finished with value: 80.66666412353516 and parameters: {'Fwd': 0.02896530535197473, 'K': 9, 'alpha': 0.05, 'dropout': 0.5, 'gnnepoch': 50, 'lambda1': 0.5, 'lambda2': 6.06769442439326, 'loop': 1, 'loss': 'CE', 'lr': 0.0049856787449352276, 'softmaxF': True, 'useGCN': True, 'weight_decay': 1.1562317549706022e-05, 'weightedloss': True}. Best is trial 60 with value: 81.33333587646484.
/home/wxy/miniconda3/lib/python3.10/site-packages/optuna/distributions.py:685: UserWarning: The distribution is specified by [0, 1.00001] and step=0.05, but the range is not divisible by `step`. It will be replaced by [0, 1.0].
  warnings.warn(
K:  8
alpha:  0.0
lr:  0.007370538791837362
weight_decay:  1.4334233381602623e-05
dropout:  0.6000000000000001
fix split and run 3 times
Data: Data(x=[2708, 1433], y=[2708], train_mask=[2708], val_mask=[2708], test_mask=[2708], adj_t=[2708, 2708, nnz=10556])
num_train tensor(140)
num_noise 0
noise: tensor(0)
data feature 1433
ALTOPT(
  (lins): Sequential(
    (0): Linear(in_features=1433, out_features=64, bias=True)
    (1): BatchNorm1d(64, eps=1e-05, momentum=0.1, affine=True, track_running_stats=True)
    (2): Dropout(p=0.6000000000000001, inplace=True)
    (3): ReLU(inplace=True)
    (4): Linear(in_features=64, out_features=7, bias=True)
    (5): LogSoftmax(dim=-1)
  )
  (prop): Propagation(K=8, mode=None, lambda1=None, lambda2=None, L21=True, alpha=0.0)
  (gcn): GCN(
    (convs): ModuleList(
      (0): GCNConv(1433, 64)
      (1): GCNConv(64, 7)
    )
    (bns): ModuleList(
      (0): BatchNorm1d(64, eps=1e-05, momentum=0.1, affine=True, track_running_stats=True)
    )
    (output): LogSoftmax(dim=-1)
  )
)
propagate done
init label
Split: 01, Run: 01
None time:  1.5145894158631563
None Run 01:
Highest Train: 100.00
Highest Valid: 80.20
  Final Train: 100.00
   Final Test: 81.10
Split: 01, Run: 02
None time:  1.3273930810391903
None Run 02:
Highest Train: 100.00
Highest Valid: 80.00
  Final Train: 100.00
   Final Test: 81.10
Split: 01, Run: 03
None time:  1.497228167951107
None Run 03:
Highest Train: 100.00
Highest Valid: 80.60
  Final Train: 100.00
   Final Test: 80.70
run time now: 4.367613792419434
total time:  4.3869847531896085
None All runs:
Highest Train: 100.00 ± 0.00
Highest Valid: 80.27 ± 0.31
  Final Train: 100.00 ± 0.00
   Final Test: 80.97 ± 0.23
[I 2023-06-12 00:21:36,549] Trial 84 finished with value: 80.26666259765625 and parameters: {'Fwd': 0.0045110531776715035, 'K': 8, 'alpha': 0.0, 'dropout': 0.6000000000000001, 'gnnepoch': 30, 'lambda1': 0.6000000000000001, 'lambda2': 6.360827611084806, 'loop': 1, 'loss': 'CE', 'lr': 0.007370538791837362, 'softmaxF': True, 'useGCN': True, 'weight_decay': 1.4334233381602623e-05, 'weightedloss': True}. Best is trial 60 with value: 81.33333587646484.
/home/wxy/miniconda3/lib/python3.10/site-packages/optuna/distributions.py:685: UserWarning: The distribution is specified by [0, 1.00001] and step=0.05, but the range is not divisible by `step`. It will be replaced by [0, 1.0].
  warnings.warn(
K:  9
alpha:  0.05
lr:  0.0065496742611271
weight_decay:  1.818946051971741e-05
dropout:  0.7000000000000001
fix split and run 3 times
Data: Data(x=[2708, 1433], y=[2708], train_mask=[2708], val_mask=[2708], test_mask=[2708], adj_t=[2708, 2708, nnz=10556])
num_train tensor(140)
num_noise 0
noise: tensor(0)
data feature 1433
ALTOPT(
  (lins): Sequential(
    (0): Linear(in_features=1433, out_features=64, bias=True)
    (1): BatchNorm1d(64, eps=1e-05, momentum=0.1, affine=True, track_running_stats=True)
    (2): Dropout(p=0.7000000000000001, inplace=True)
    (3): ReLU(inplace=True)
    (4): Linear(in_features=64, out_features=7, bias=True)
    (5): LogSoftmax(dim=-1)
  )
  (prop): Propagation(K=9, mode=None, lambda1=None, lambda2=None, L21=True, alpha=0.05)
  (gcn): GCN(
    (convs): ModuleList(
      (0): GCNConv(1433, 64)
      (1): GCNConv(64, 7)
    )
    (bns): ModuleList(
      (0): BatchNorm1d(64, eps=1e-05, momentum=0.1, affine=True, track_running_stats=True)
    )
    (output): LogSoftmax(dim=-1)
  )
)
propagate done
init label
Split: 01, Run: 01
None time:  1.977662389865145
None Run 01:
Highest Train: 100.00
Highest Valid: 80.40
  Final Train: 100.00
   Final Test: 82.80
Split: 01, Run: 02
None time:  1.5376234131399542
None Run 02:
Highest Train: 100.00
Highest Valid: 80.40
  Final Train: 100.00
   Final Test: 81.10
Split: 01, Run: 03
None time:  1.1010377949569374
None Run 03:
Highest Train: 100.00
Highest Valid: 80.60
  Final Train: 100.00
   Final Test: 81.70
run time now: 4.643376350402832
total time:  4.666146719828248
None All runs:
Highest Train: 100.00 ± 0.00
Highest Valid: 80.47 ± 0.12
  Final Train: 100.00 ± 0.00
   Final Test: 81.87 ± 0.86
[I 2023-06-12 00:21:41,788] Trial 85 finished with value: 80.46666717529297 and parameters: {'Fwd': 0.009316725165894232, 'K': 9, 'alpha': 0.05, 'dropout': 0.7000000000000001, 'gnnepoch': 40, 'lambda1': 0.4, 'lambda2': 5.821303399213785, 'loop': 1, 'loss': 'CE', 'lr': 0.0065496742611271, 'softmaxF': True, 'useGCN': True, 'weight_decay': 1.818946051971741e-05, 'weightedloss': True}. Best is trial 60 with value: 81.33333587646484.
/home/wxy/miniconda3/lib/python3.10/site-packages/optuna/distributions.py:685: UserWarning: The distribution is specified by [0, 1.00001] and step=0.05, but the range is not divisible by `step`. It will be replaced by [0, 1.0].
  warnings.warn(
K:  8
alpha:  0.15000000000000002
lr:  0.00522388233034574
weight_decay:  1.0337218033901429e-05
dropout:  0.5
fix split and run 3 times
Data: Data(x=[2708, 1433], y=[2708], train_mask=[2708], val_mask=[2708], test_mask=[2708], adj_t=[2708, 2708, nnz=10556])
num_train tensor(140)
num_noise 0
noise: tensor(0)
data feature 1433
ALTOPT(
  (lins): Sequential(
    (0): Linear(in_features=1433, out_features=64, bias=True)
    (1): BatchNorm1d(64, eps=1e-05, momentum=0.1, affine=True, track_running_stats=True)
    (2): Dropout(p=0.5, inplace=True)
    (3): ReLU(inplace=True)
    (4): Linear(in_features=64, out_features=7, bias=True)
    (5): LogSoftmax(dim=-1)
  )
  (prop): Propagation(K=8, mode=None, lambda1=None, lambda2=None, L21=True, alpha=0.15000000000000002)
  (gcn): GCN(
    (convs): ModuleList(
      (0): GCNConv(1433, 64)
      (1): GCNConv(64, 7)
    )
    (bns): ModuleList(
      (0): BatchNorm1d(64, eps=1e-05, momentum=0.1, affine=True, track_running_stats=True)
    )
    (output): LogSoftmax(dim=-1)
  )
)
propagate done
init label
Split: 01, Run: 01
None time:  1.4187709661200643
None Run 01:
Highest Train: 100.00
Highest Valid: 81.20
  Final Train: 100.00
   Final Test: 82.30
Split: 01, Run: 02
None time:  1.7625656200107187
None Run 02:
Highest Train: 100.00
Highest Valid: 80.60
  Final Train: 100.00
   Final Test: 82.40
Split: 01, Run: 03
None time:  1.3317344191018492
None Run 03:
Highest Train: 100.00
Highest Valid: 80.80
  Final Train: 100.00
   Final Test: 80.50
run time now: 4.541965484619141
total time:  4.568736387882382
None All runs:
Highest Train: 100.00 ± 0.00
Highest Valid: 80.87 ± 0.31
  Final Train: 100.00 ± 0.00
   Final Test: 81.73 ± 1.07
[I 2023-06-12 00:21:46,875] Trial 86 finished with value: 80.86666107177734 and parameters: {'Fwd': 0.006282280235753748, 'K': 8, 'alpha': 0.15000000000000002, 'dropout': 0.5, 'gnnepoch': 50, 'lambda1': 0.5, 'lambda2': 5.92853209611747, 'loop': 1, 'loss': 'CE', 'lr': 0.00522388233034574, 'softmaxF': True, 'useGCN': True, 'weight_decay': 1.0337218033901429e-05, 'weightedloss': True}. Best is trial 60 with value: 81.33333587646484.
/home/wxy/miniconda3/lib/python3.10/site-packages/optuna/distributions.py:685: UserWarning: The distribution is specified by [0, 1.00001] and step=0.05, but the range is not divisible by `step`. It will be replaced by [0, 1.0].
  warnings.warn(
K:  8
alpha:  0.45
lr:  0.005006555705700685
weight_decay:  7.620870130499539e-06
dropout:  0.6000000000000001
fix split and run 3 times
Data: Data(x=[2708, 1433], y=[2708], train_mask=[2708], val_mask=[2708], test_mask=[2708], adj_t=[2708, 2708, nnz=10556])
num_train tensor(140)
num_noise 0
noise: tensor(0)
data feature 1433
ALTOPT(
  (lins): Sequential(
    (0): Linear(in_features=1433, out_features=64, bias=True)
    (1): BatchNorm1d(64, eps=1e-05, momentum=0.1, affine=True, track_running_stats=True)
    (2): Dropout(p=0.6000000000000001, inplace=True)
    (3): ReLU(inplace=True)
    (4): Linear(in_features=64, out_features=7, bias=True)
    (5): LogSoftmax(dim=-1)
  )
  (prop): Propagation(K=8, mode=None, lambda1=None, lambda2=None, L21=True, alpha=0.45)
  (gcn): GCN(
    (convs): ModuleList(
      (0): GCNConv(1433, 64)
      (1): GCNConv(64, 7)
    )
    (bns): ModuleList(
      (0): BatchNorm1d(64, eps=1e-05, momentum=0.1, affine=True, track_running_stats=True)
    )
    (output): LogSoftmax(dim=-1)
  )
)
propagate done
init label
Split: 01, Run: 01
None time:  1.157957597868517
None Run 01:
Highest Train: 100.00
Highest Valid: 81.20
  Final Train: 100.00
   Final Test: 82.50
Split: 01, Run: 02
None time:  1.5759872100315988
None Run 02:
Highest Train: 100.00
Highest Valid: 80.20
  Final Train: 100.00
   Final Test: 81.60
Split: 01, Run: 03
None time:  1.4119568311143667
None Run 03:
Highest Train: 100.00
Highest Valid: 80.60
  Final Train: 100.00
   Final Test: 80.80
run time now: 4.168936729431152
total time:  4.1966566811315715
None All runs:
Highest Train: 100.00 ± 0.00
Highest Valid: 80.67 ± 0.50
  Final Train: 100.00 ± 0.00
   Final Test: 81.63 ± 0.85
[I 2023-06-12 00:21:51,555] Trial 87 finished with value: 80.66666412353516 and parameters: {'Fwd': 0.016816406046589297, 'K': 8, 'alpha': 0.45, 'dropout': 0.6000000000000001, 'gnnepoch': 50, 'lambda1': 0.55, 'lambda2': 6.662939017537526, 'loop': 1, 'loss': 'CE', 'lr': 0.005006555705700685, 'softmaxF': True, 'useGCN': True, 'weight_decay': 7.620870130499539e-06, 'weightedloss': True}. Best is trial 60 with value: 81.33333587646484.
/home/wxy/miniconda3/lib/python3.10/site-packages/optuna/distributions.py:685: UserWarning: The distribution is specified by [0, 1.00001] and step=0.05, but the range is not divisible by `step`. It will be replaced by [0, 1.0].
  warnings.warn(
K:  9
alpha:  0.15000000000000002
lr:  0.008385985770651746
weight_decay:  3.737693547836208e-05
dropout:  0.6000000000000001
fix split and run 3 times
Data: Data(x=[2708, 1433], y=[2708], train_mask=[2708], val_mask=[2708], test_mask=[2708], adj_t=[2708, 2708, nnz=10556])
num_train tensor(140)
num_noise 0
noise: tensor(0)
data feature 1433
ALTOPT(
  (lins): Sequential(
    (0): Linear(in_features=1433, out_features=64, bias=True)
    (1): BatchNorm1d(64, eps=1e-05, momentum=0.1, affine=True, track_running_stats=True)
    (2): Dropout(p=0.6000000000000001, inplace=True)
    (3): ReLU(inplace=True)
    (4): Linear(in_features=64, out_features=7, bias=True)
    (5): LogSoftmax(dim=-1)
  )
  (prop): Propagation(K=9, mode=None, lambda1=None, lambda2=None, L21=True, alpha=0.15000000000000002)
  (gcn): GCN(
    (convs): ModuleList(
      (0): GCNConv(1433, 64)
      (1): GCNConv(64, 7)
    )
    (bns): ModuleList(
      (0): BatchNorm1d(64, eps=1e-05, momentum=0.1, affine=True, track_running_stats=True)
    )
    (output): LogSoftmax(dim=-1)
  )
)
propagate done
init label
Split: 01, Run: 01
None time:  1.4115144689567387
None Run 01:
Highest Train: 100.00
Highest Valid: 81.40
  Final Train: 100.00
   Final Test: 82.60
Split: 01, Run: 02
None time:  0.8484303329605609
None Run 02:
Highest Train: 100.00
Highest Valid: 81.00
  Final Train: 100.00
   Final Test: 81.90
Split: 01, Run: 03
None time:  1.26492797001265
None Run 03:
Highest Train: 100.00
Highest Valid: 81.40
  Final Train: 100.00
   Final Test: 81.60
run time now: 3.553070068359375
total time:  3.5750362570397556
None All runs:
Highest Train: 100.00 ± 0.00
Highest Valid: 81.27 ± 0.23
  Final Train: 100.00 ± 0.00
   Final Test: 82.03 ± 0.51
