[I 2023-06-12 00:26:15,770] Trial 152 finished with value: 82.66666412353516 and parameters: {'Fwd': 3.817747140228634e-06, 'K': 10, 'alpha': 1.0, 'dropout': 0.9, 'gnnepoch': 60, 'lambda1': 0.7000000000000001, 'lambda2': 7.425667938300996, 'loop': 1, 'loss': 'MSE', 'lr': 0.0028182453675267834, 'softmaxF': True, 'useGCN': False, 'weight_decay': 0.004088612059051921, 'weightedloss': False}. Best is trial 132 with value: 83.0666732788086.
/home/wxy/miniconda3/lib/python3.10/site-packages/optuna/distributions.py:685: UserWarning: The distribution is specified by [0, 1.00001] and step=0.05, but the range is not divisible by `step`. It will be replaced by [0, 1.0].
  warnings.warn(
K:  10
alpha:  0.9500000000000001
lr:  0.002550892481293161
weight_decay:  0.004085521753107069
dropout:  0.9
fix split and run 3 times
Data: Data(x=[19717, 500], y=[19717], train_mask=[19717], val_mask=[19717], test_mask=[19717], adj_t=[19717, 19717, nnz=88648])
num_train tensor(60)
num_noise 0
noise: tensor(0)
data feature 500
ALTOPT(
  (lins): Sequential(
    (0): Linear(in_features=500, out_features=64, bias=True)
    (1): BatchNorm1d(64, eps=1e-05, momentum=0.1, affine=True, track_running_stats=True)
    (2): Dropout(p=0.9, inplace=True)
    (3): ReLU(inplace=True)
    (4): Linear(in_features=64, out_features=3, bias=True)
    (5): Identity()
  )
  (prop): Propagation(K=10, mode=None, lambda1=None, lambda2=None, L21=True, alpha=0.9500000000000001)
  (gcn): GCN(
    (convs): ModuleList(
      (0): GCNConv(500, 64)
      (1): GCNConv(64, 3)
    )
    (bns): ModuleList(
      (0): BatchNorm1d(64, eps=1e-05, momentum=0.1, affine=True, track_running_stats=True)
    )
    (output): Identity()
  )
)
propagate done
init label
Split: 01, Run: 01
None time:  2.0331199569627643
None Run 01:
Highest Train: 100.00
Highest Valid: 82.00
  Final Train: 100.00
   Final Test: 77.90
Split: 01, Run: 02
None time:  1.3901323578320444
None Run 02:
Highest Train: 100.00
Highest Valid: 84.00
  Final Train: 100.00
   Final Test: 79.90
Split: 01, Run: 03
None time:  1.5210738040041178
None Run 03:
Highest Train: 100.00
Highest Valid: 83.00
  Final Train: 100.00
   Final Test: 80.20
run time now: 4.995396137237549
total time:  5.043835769873112
None All runs:
Highest Train: 100.00 ± 0.00
Highest Valid: 83.00 ± 1.00
  Final Train: 100.00 ± 0.00
   Final Test: 79.33 ± 1.25
[I 2023-06-12 00:26:21,376] Trial 153 finished with value: 83.0 and parameters: {'Fwd': 4.069675694938258e-06, 'K': 10, 'alpha': 0.9500000000000001, 'dropout': 0.9, 'gnnepoch': 60, 'lambda1': 0.65, 'lambda2': 7.459084757828441, 'loop': 1, 'loss': 'MSE', 'lr': 0.002550892481293161, 'softmaxF': True, 'useGCN': False, 'weight_decay': 0.004085521753107069, 'weightedloss': False}. Best is trial 132 with value: 83.0666732788086.
/home/wxy/miniconda3/lib/python3.10/site-packages/optuna/distributions.py:685: UserWarning: The distribution is specified by [0, 1.00001] and step=0.05, but the range is not divisible by `step`. It will be replaced by [0, 1.0].
  warnings.warn(
K:  10
alpha:  0.9
lr:  0.002507983783981295
weight_decay:  0.004129663664558365
dropout:  0.8
fix split and run 3 times
Data: Data(x=[19717, 500], y=[19717], train_mask=[19717], val_mask=[19717], test_mask=[19717], adj_t=[19717, 19717, nnz=88648])
num_train tensor(60)
num_noise 0
noise: tensor(0)
data feature 500
ALTOPT(
  (lins): Sequential(
    (0): Linear(in_features=500, out_features=64, bias=True)
    (1): BatchNorm1d(64, eps=1e-05, momentum=0.1, affine=True, track_running_stats=True)
    (2): Dropout(p=0.8, inplace=True)
    (3): ReLU(inplace=True)
    (4): Linear(in_features=64, out_features=3, bias=True)
    (5): Identity()
  )
  (prop): Propagation(K=10, mode=None, lambda1=None, lambda2=None, L21=True, alpha=0.9)
  (gcn): GCN(
    (convs): ModuleList(
      (0): GCNConv(500, 64)
      (1): GCNConv(64, 3)
    )
    (bns): ModuleList(
      (0): BatchNorm1d(64, eps=1e-05, momentum=0.1, affine=True, track_running_stats=True)
    )
    (output): Identity()
  )
)
propagate done
init label
Split: 01, Run: 01
None time:  0.8461854800116271
None Run 01:
Highest Train: 100.00
Highest Valid: 69.60
  Final Train: 100.00
   Final Test: 69.50
Split: 01, Run: 02
None time:  0.8025140699464828
None Run 02:
Highest Train: 100.00
Highest Valid: 81.80
  Final Train: 100.00
   Final Test: 79.10
Split: 01, Run: 03
None time:  0.990668746875599
None Run 03:
Highest Train: 100.00
Highest Valid: 81.40
  Final Train: 100.00
   Final Test: 79.70
run time now: 2.687866687774658
total time:  2.7408525648061186
None All runs:
Highest Train: 100.00 ± 0.00
Highest Valid: 77.60 ± 6.93
  Final Train: 100.00 ± 0.00
   Final Test: 76.10 ± 5.72
[I 2023-06-12 00:26:24,675] Trial 154 finished with value: 77.5999984741211 and parameters: {'Fwd': 3.3403707977855566e-06, 'K': 10, 'alpha': 0.9, 'dropout': 0.8, 'gnnepoch': 50, 'lambda1': 0.7000000000000001, 'lambda2': 7.68277385310422, 'loop': 1, 'loss': 'MSE', 'lr': 0.002507983783981295, 'softmaxF': True, 'useGCN': False, 'weight_decay': 0.004129663664558365, 'weightedloss': False}. Best is trial 132 with value: 83.0666732788086.
/home/wxy/miniconda3/lib/python3.10/site-packages/optuna/distributions.py:685: UserWarning: The distribution is specified by [0, 1.00001] and step=0.05, but the range is not divisible by `step`. It will be replaced by [0, 1.0].
  warnings.warn(
K:  9
alpha:  0.9500000000000001
lr:  0.0023305776881328085
weight_decay:  0.007549683578916321
dropout:  0.9
fix split and run 3 times
Data: Data(x=[19717, 500], y=[19717], train_mask=[19717], val_mask=[19717], test_mask=[19717], adj_t=[19717, 19717, nnz=88648])
num_train tensor(60)
num_noise 0
noise: tensor(0)
data feature 500
ALTOPT(
  (lins): Sequential(
    (0): Linear(in_features=500, out_features=64, bias=True)
    (1): BatchNorm1d(64, eps=1e-05, momentum=0.1, affine=True, track_running_stats=True)
    (2): Dropout(p=0.9, inplace=True)
    (3): ReLU(inplace=True)
    (4): Linear(in_features=64, out_features=3, bias=True)
    (5): Identity()
  )
  (prop): Propagation(K=9, mode=None, lambda1=None, lambda2=None, L21=True, alpha=0.9500000000000001)
  (gcn): GCN(
    (convs): ModuleList(
      (0): GCNConv(500, 64)
      (1): GCNConv(64, 3)
    )
    (bns): ModuleList(
      (0): BatchNorm1d(64, eps=1e-05, momentum=0.1, affine=True, track_running_stats=True)
    )
    (output): Identity()
  )
)
propagate done
init label
Split: 01, Run: 01, Epoch: 100, Loss: 0.3676, Train: 100.00%, Valid: 82.20% Test: 78.40%
Split: 01, Run: 01
None time:  3.368178406963125
None Run 01:
Highest Train: 100.00
Highest Valid: 82.20
  Final Train: 100.00
   Final Test: 78.00
Split: 01, Run: 02
None time:  1.9985970801208168
None Run 02:
Highest Train: 100.00
Highest Valid: 83.40
  Final Train: 100.00
   Final Test: 80.10
Split: 01, Run: 03
None time:  2.409833427052945
None Run 03:
Highest Train: 100.00
Highest Valid: 83.40
  Final Train: 100.00
   Final Test: 80.60
run time now: 7.8240907192230225
total time:  7.87598487501964
None All runs:
Highest Train: 100.00 ± 0.00
Highest Valid: 83.00 ± 0.69
  Final Train: 100.00 ± 0.00
   Final Test: 79.57 ± 1.38
[I 2023-06-12 00:26:33,018] Trial 155 finished with value: 83.0 and parameters: {'Fwd': 4.456255126079659e-06, 'K': 9, 'alpha': 0.9500000000000001, 'dropout': 0.9, 'gnnepoch': 70, 'lambda1': 0.65, 'lambda2': 7.222095606889866, 'loop': 1, 'loss': 'MSE', 'lr': 0.0023305776881328085, 'softmaxF': True, 'useGCN': False, 'weight_decay': 0.007549683578916321, 'weightedloss': False}. Best is trial 132 with value: 83.0666732788086.
/home/wxy/miniconda3/lib/python3.10/site-packages/optuna/distributions.py:685: UserWarning: The distribution is specified by [0, 1.00001] and step=0.05, but the range is not divisible by `step`. It will be replaced by [0, 1.0].
  warnings.warn(
K:  9
alpha:  0.25
lr:  0.0019874103702952027
weight_decay:  0.005870124216048954
dropout:  0.9
fix split and run 3 times
Data: Data(x=[19717, 500], y=[19717], train_mask=[19717], val_mask=[19717], test_mask=[19717], adj_t=[19717, 19717, nnz=88648])
num_train tensor(60)
num_noise 0
noise: tensor(0)
data feature 500
ALTOPT(
  (lins): Sequential(
    (0): Linear(in_features=500, out_features=64, bias=True)
    (1): BatchNorm1d(64, eps=1e-05, momentum=0.1, affine=True, track_running_stats=True)
    (2): Dropout(p=0.9, inplace=True)
    (3): ReLU(inplace=True)
    (4): Linear(in_features=64, out_features=3, bias=True)
    (5): Identity()
  )
  (prop): Propagation(K=9, mode=None, lambda1=None, lambda2=None, L21=True, alpha=0.25)
  (gcn): GCN(
    (convs): ModuleList(
      (0): GCNConv(500, 64)
      (1): GCNConv(64, 3)
    )
    (bns): ModuleList(
      (0): BatchNorm1d(64, eps=1e-05, momentum=0.1, affine=True, track_running_stats=True)
    )
    (output): Identity()
  )
)
propagate done
init label
Split: 01, Run: 01
None time:  0.5980680810753256
None Run 01:
Highest Train: 100.00
Highest Valid: 69.40
  Final Train: 100.00
   Final Test: 69.30
Split: 01, Run: 02
None time:  1.90275027602911
None Run 02:
Highest Train: 100.00
Highest Valid: 75.00
  Final Train: 100.00
   Final Test: 73.20
Split: 01, Run: 03
None time:  1.3444914449937642
None Run 03:
Highest Train: 100.00
Highest Valid: 76.80
  Final Train: 100.00
   Final Test: 76.00
run time now: 3.886366605758667
total time:  3.9286344598513097
None All runs:
Highest Train: 100.00 ± 0.00
Highest Valid: 73.73 ± 3.86
  Final Train: 100.00 ± 0.00
   Final Test: 72.83 ± 3.37
[I 2023-06-12 00:26:37,408] Trial 156 finished with value: 73.73332977294922 and parameters: {'Fwd': 4.3830502137554985e-06, 'K': 9, 'alpha': 0.25, 'dropout': 0.9, 'gnnepoch': 70, 'lambda1': 0.65, 'lambda2': 7.4951330090229416, 'loop': 1, 'loss': 'MSE', 'lr': 0.0019874103702952027, 'softmaxF': True, 'useGCN': False, 'weight_decay': 0.005870124216048954, 'weightedloss': False}. Best is trial 132 with value: 83.0666732788086.
/home/wxy/miniconda3/lib/python3.10/site-packages/optuna/distributions.py:685: UserWarning: The distribution is specified by [0, 1.00001] and step=0.05, but the range is not divisible by `step`. It will be replaced by [0, 1.0].
  warnings.warn(
K:  9
alpha:  0.9
lr:  0.002207977673951061
weight_decay:  0.008841368153873458
dropout:  0.8
fix split and run 3 times
Data: Data(x=[19717, 500], y=[19717], train_mask=[19717], val_mask=[19717], test_mask=[19717], adj_t=[19717, 19717, nnz=88648])
num_train tensor(60)
num_noise 0
noise: tensor(0)
data feature 500
ALTOPT(
  (lins): Sequential(
    (0): Linear(in_features=500, out_features=64, bias=True)
    (1): BatchNorm1d(64, eps=1e-05, momentum=0.1, affine=True, track_running_stats=True)
    (2): Dropout(p=0.8, inplace=True)
    (3): ReLU(inplace=True)
    (4): Linear(in_features=64, out_features=3, bias=True)
    (5): Identity()
  )
  (prop): Propagation(K=9, mode=None, lambda1=None, lambda2=None, L21=True, alpha=0.9)
  (gcn): GCN(
    (convs): ModuleList(
      (0): GCNConv(500, 64)
      (1): GCNConv(64, 3)
    )
    (bns): ModuleList(
      (0): BatchNorm1d(64, eps=1e-05, momentum=0.1, affine=True, track_running_stats=True)
    )
    (output): Identity()
  )
)
propagate done
init label
Split: 01, Run: 01
None time:  1.4119241200387478
None Run 01:
Highest Train: 100.00
Highest Valid: 81.00
  Final Train: 100.00
   Final Test: 76.80
Split: 01, Run: 02
None time:  1.6855536210350692
None Run 02:
Highest Train: 100.00
Highest Valid: 81.40
  Final Train: 100.00
   Final Test: 77.40
Split: 01, Run: 03
None time:  1.0882693820167333
None Run 03:
Highest Train: 100.00
Highest Valid: 81.60
  Final Train: 100.00
   Final Test: 78.90
run time now: 4.24355149269104
total time:  4.290792188141495
None All runs:
Highest Train: 100.00 ± 0.00
Highest Valid: 81.33 ± 0.31
  Final Train: 100.00 ± 0.00
   Final Test: 77.70 ± 1.08
[I 2023-06-12 00:26:42,154] Trial 157 finished with value: 81.33333587646484 and parameters: {'Fwd': 5.074062588830555e-06, 'K': 9, 'alpha': 0.9, 'dropout': 0.8, 'gnnepoch': 70, 'lambda1': 0.65, 'lambda2': 7.250689766586676, 'loop': 1, 'loss': 'MSE', 'lr': 0.002207977673951061, 'softmaxF': True, 'useGCN': False, 'weight_decay': 0.008841368153873458, 'weightedloss': False}. Best is trial 132 with value: 83.0666732788086.
/home/wxy/miniconda3/lib/python3.10/site-packages/optuna/distributions.py:685: UserWarning: The distribution is specified by [0, 1.00001] and step=0.05, but the range is not divisible by `step`. It will be replaced by [0, 1.0].
  warnings.warn(
K:  9
alpha:  0.9
lr:  0.0020190852845780416
weight_decay:  0.003983573727499237
dropout:  0.9
fix split and run 3 times
Data: Data(x=[19717, 500], y=[19717], train_mask=[19717], val_mask=[19717], test_mask=[19717], adj_t=[19717, 19717, nnz=88648])
num_train tensor(60)
num_noise 0
noise: tensor(0)
data feature 500
ALTOPT(
  (lins): Sequential(
    (0): Linear(in_features=500, out_features=64, bias=True)
    (1): BatchNorm1d(64, eps=1e-05, momentum=0.1, affine=True, track_running_stats=True)
    (2): Dropout(p=0.9, inplace=True)
    (3): ReLU(inplace=True)
    (4): Linear(in_features=64, out_features=3, bias=True)
    (5): Identity()
  )
  (prop): Propagation(K=9, mode=None, lambda1=None, lambda2=None, L21=True, alpha=0.9)
  (gcn): GCN(
    (convs): ModuleList(
      (0): GCNConv(500, 64)
      (1): GCNConv(64, 3)
    )
    (bns): ModuleList(
      (0): BatchNorm1d(64, eps=1e-05, momentum=0.1, affine=True, track_running_stats=True)
    )
    (output): Identity()
  )
)
propagate done
init label
Split: 01, Run: 01
None time:  0.36855214298702776
None Run 01:
Highest Train: 100.00
Highest Valid: 69.60
  Final Train: 100.00
   Final Test: 69.40
Split: 01, Run: 02
None time:  0.364810778060928
None Run 02:
Highest Train: 100.00
Highest Valid: 69.60
  Final Train: 100.00
   Final Test: 69.40
Split: 01, Run: 03
None time:  0.3626044518314302
None Run 03:
Highest Train: 100.00
Highest Valid: 69.60
  Final Train: 100.00
   Final Test: 69.40
run time now: 1.153010606765747
total time:  1.2220876340288669
None All runs:
Highest Train: 100.00 ± 0.00
Highest Valid: 69.60 ± 0.00
  Final Train: 100.00 ± 0.00
   Final Test: 69.40 ± 0.00
[I 2023-06-12 00:26:43,905] Trial 158 finished with value: 69.5999984741211 and parameters: {'Fwd': 3.838261880296467e-06, 'K': 9, 'alpha': 0.9, 'dropout': 0.9, 'gnnepoch': 0, 'lambda1': 0.6000000000000001, 'lambda2': 7.156435777515763, 'loop': 1, 'loss': 'MSE', 'lr': 0.0020190852845780416, 'softmaxF': True, 'useGCN': False, 'weight_decay': 0.003983573727499237, 'weightedloss': False}. Best is trial 132 with value: 83.0666732788086.
/home/wxy/miniconda3/lib/python3.10/site-packages/optuna/distributions.py:685: UserWarning: The distribution is specified by [0, 1.00001] and step=0.05, but the range is not divisible by `step`. It will be replaced by [0, 1.0].
  warnings.warn(
K:  9
alpha:  0.9500000000000001
lr:  0.0023547700232434605
weight_decay:  0.008277301961222538
dropout:  0.9
fix split and run 3 times
Data: Data(x=[19717, 500], y=[19717], train_mask=[19717], val_mask=[19717], test_mask=[19717], adj_t=[19717, 19717, nnz=88648])
num_train tensor(60)
num_noise 0
noise: tensor(0)
data feature 500
ALTOPT(
  (lins): Sequential(
    (0): Linear(in_features=500, out_features=64, bias=True)
    (1): BatchNorm1d(64, eps=1e-05, momentum=0.1, affine=True, track_running_stats=True)
    (2): Dropout(p=0.9, inplace=True)
    (3): ReLU(inplace=True)
    (4): Linear(in_features=64, out_features=3, bias=True)
    (5): Identity()
  )
  (prop): Propagation(K=9, mode=None, lambda1=None, lambda2=None, L21=True, alpha=0.9500000000000001)
  (gcn): GCN(
    (convs): ModuleList(
      (0): GCNConv(500, 64)
      (1): GCNConv(64, 3)
    )
    (bns): ModuleList(
      (0): BatchNorm1d(64, eps=1e-05, momentum=0.1, affine=True, track_running_stats=True)
    )
    (output): Identity()
  )
)
propagate done
init label
Split: 01, Run: 01, Epoch: 100, Loss: 0.3665, Train: 100.00%, Valid: 82.40% Test: 78.30%
Split: 01, Run: 01
None time:  3.7495981701649725
None Run 01:
Highest Train: 100.00
Highest Valid: 82.40
  Final Train: 100.00
   Final Test: 78.20
Split: 01, Run: 02
None time:  1.0569932830985636
None Run 02:
Highest Train: 100.00
Highest Valid: 83.00
  Final Train: 100.00
   Final Test: 79.00
Split: 01, Run: 03
None time:  0.730674851918593
None Run 03:
Highest Train: 100.00
Highest Valid: 80.40
  Final Train: 100.00
   Final Test: 78.10
run time now: 5.625193119049072
total time:  5.6774904588237405
None All runs:
Highest Train: 100.00 ± 0.00
Highest Valid: 81.93 ± 1.36
  Final Train: 100.00 ± 0.00
   Final Test: 78.43 ± 0.49
[I 2023-06-12 00:26:50,186] Trial 159 finished with value: 81.9333267211914 and parameters: {'Fwd': 6.548794256014678e-06, 'K': 9, 'alpha': 0.9500000000000001, 'dropout': 0.9, 'gnnepoch': 70, 'lambda1': 0.75, 'lambda2': 7.746394977133612, 'loop': 1, 'loss': 'MSE', 'lr': 0.0023547700232434605, 'softmaxF': True, 'useGCN': False, 'weight_decay': 0.008277301961222538, 'weightedloss': False}. Best is trial 132 with value: 83.0666732788086.
/home/wxy/miniconda3/lib/python3.10/site-packages/optuna/distributions.py:685: UserWarning: The distribution is specified by [0, 1.00001] and step=0.05, but the range is not divisible by `step`. It will be replaced by [0, 1.0].
  warnings.warn(
K:  9
alpha:  0.8500000000000001
lr:  0.0022305713388225956
weight_decay:  0.004722660633679454
dropout:  0.8
fix split and run 3 times
Data: Data(x=[19717, 500], y=[19717], train_mask=[19717], val_mask=[19717], test_mask=[19717], adj_t=[19717, 19717, nnz=88648])
num_train tensor(60)
num_noise 0
noise: tensor(0)
data feature 500
ALTOPT(
  (lins): Sequential(
    (0): Linear(in_features=500, out_features=64, bias=True)
    (1): BatchNorm1d(64, eps=1e-05, momentum=0.1, affine=True, track_running_stats=True)
    (2): Dropout(p=0.8, inplace=True)
    (3): ReLU(inplace=True)
    (4): Linear(in_features=64, out_features=3, bias=True)
    (5): Identity()
  )
  (prop): Propagation(K=9, mode=None, lambda1=None, lambda2=None, L21=True, alpha=0.8500000000000001)
  (gcn): GCN(
    (convs): ModuleList(
      (0): GCNConv(500, 64)
      (1): GCNConv(64, 3)
    )
    (bns): ModuleList(
      (0): BatchNorm1d(64, eps=1e-05, momentum=0.1, affine=True, track_running_stats=True)
    )
    (output): Identity()
  )
)
propagate done
init label
Split: 01, Run: 01
None time:  1.9495921949855983
None Run 01:
Highest Train: 100.00
Highest Valid: 79.80
  Final Train: 100.00
   Final Test: 76.20
Split: 01, Run: 02
None time:  1.5469543568324298
None Run 02:
Highest Train: 100.00
Highest Valid: 81.40
  Final Train: 100.00
   Final Test: 76.80
Split: 01, Run: 03
None time:  1.0874552251771092
None Run 03:
Highest Train: 100.00
Highest Valid: 81.80
  Final Train: 100.00
   Final Test: 78.90
run time now: 4.630627632141113
total time:  4.678586637834087
None All runs:
Highest Train: 100.00 ± 0.00
Highest Valid: 81.00 ± 1.06
  Final Train: 100.00 ± 0.00
   Final Test: 77.30 ± 1.42
[I 2023-06-12 00:26:55,401] Trial 160 finished with value: 81.0 and parameters: {'Fwd': 5.446007597251732e-06, 'K': 9, 'alpha': 0.8500000000000001, 'dropout': 0.8, 'gnnepoch': 70, 'lambda1': 0.4, 'lambda2': 7.033072890174291, 'loop': 1, 'loss': 'MSE', 'lr': 0.0022305713388225956, 'softmaxF': True, 'useGCN': False, 'weight_decay': 0.004722660633679454, 'weightedloss': False}. Best is trial 132 with value: 83.0666732788086.
/home/wxy/miniconda3/lib/python3.10/site-packages/optuna/distributions.py:685: UserWarning: The distribution is specified by [0, 1.00001] and step=0.05, but the range is not divisible by `step`. It will be replaced by [0, 1.0].
  warnings.warn(
K:  10
alpha:  0.9500000000000001
lr:  0.002557972184951698
weight_decay:  0.0029022341413721246
dropout:  0.9
fix split and run 3 times
Data: Data(x=[19717, 500], y=[19717], train_mask=[19717], val_mask=[19717], test_mask=[19717], adj_t=[19717, 19717, nnz=88648])
num_train tensor(60)
num_noise 0
noise: tensor(0)
data feature 500
ALTOPT(
  (lins): Sequential(
    (0): Linear(in_features=500, out_features=64, bias=True)
    (1): BatchNorm1d(64, eps=1e-05, momentum=0.1, affine=True, track_running_stats=True)
    (2): Dropout(p=0.9, inplace=True)
    (3): ReLU(inplace=True)
    (4): Linear(in_features=64, out_features=3, bias=True)
    (5): Identity()
  )
  (prop): Propagation(K=10, mode=None, lambda1=None, lambda2=None, L21=True, alpha=0.9500000000000001)
  (gcn): GCN(
    (convs): ModuleList(
      (0): GCNConv(500, 64)
      (1): GCNConv(64, 3)
    )
    (bns): ModuleList(
      (0): BatchNorm1d(64, eps=1e-05, momentum=0.1, affine=True, track_running_stats=True)
    )
    (output): Identity()
  )
)
propagate done
init label
Split: 01, Run: 01
None time:  2.2643872061744332
None Run 01:
Highest Train: 100.00
Highest Valid: 81.60
  Final Train: 100.00
   Final Test: 78.10
Split: 01, Run: 02
None time:  1.7523979721590877
None Run 02:
Highest Train: 100.00
Highest Valid: 82.60
  Final Train: 100.00
   Final Test: 78.80
Split: 01, Run: 03
None time:  0.8502471589017659
None Run 03:
Highest Train: 100.00
Highest Valid: 81.40
  Final Train: 100.00
   Final Test: 78.70
run time now: 4.91415810585022
total time:  4.970590628916398
None All runs:
Highest Train: 100.00 ± 0.00
Highest Valid: 81.87 ± 0.64
  Final Train: 100.00 ± 0.00
   Final Test: 78.53 ± 0.38
