[I 2023-06-12 00:22:36,082] Trial 97 finished with value: 80.66666412353516 and parameters: {'Fwd': 0.001638833431855222, 'K': 8, 'alpha': 0.2, 'dropout': 0.6000000000000001, 'gnnepoch': 40, 'lambda1': 0.45, 'lambda2': 7.048144271997295, 'loop': 1, 'loss': 'CE', 'lr': 0.00785447805538578, 'softmaxF': True, 'useGCN': True, 'weight_decay': 1.478713832925985e-05, 'weightedloss': True}. Best is trial 60 with value: 81.33333587646484.
/home/wxy/miniconda3/lib/python3.10/site-packages/optuna/distributions.py:685: UserWarning: The distribution is specified by [0, 1.00001] and step=0.05, but the range is not divisible by `step`. It will be replaced by [0, 1.0].
  warnings.warn(
K:  7
alpha:  0.15000000000000002
lr:  0.0053643524618362335
weight_decay:  2.3970893983781916e-05
dropout:  0.7000000000000001
fix split and run 3 times
Data: Data(x=[2708, 1433], y=[2708], train_mask=[2708], val_mask=[2708], test_mask=[2708], adj_t=[2708, 2708, nnz=10556])
num_train tensor(140)
num_noise 0
noise: tensor(0)
data feature 1433
ALTOPT(
  (lins): Sequential(
    (0): Linear(in_features=1433, out_features=64, bias=True)
    (1): BatchNorm1d(64, eps=1e-05, momentum=0.1, affine=True, track_running_stats=True)
    (2): Dropout(p=0.7000000000000001, inplace=True)
    (3): ReLU(inplace=True)
    (4): Linear(in_features=64, out_features=7, bias=True)
    (5): LogSoftmax(dim=-1)
  )
  (prop): Propagation(K=7, mode=None, lambda1=None, lambda2=None, L21=True, alpha=0.15000000000000002)
  (gcn): GCN(
    (convs): ModuleList(
      (0): GCNConv(1433, 64)
      (1): GCNConv(64, 7)
    )
    (bns): ModuleList(
      (0): BatchNorm1d(64, eps=1e-05, momentum=0.1, affine=True, track_running_stats=True)
    )
    (output): LogSoftmax(dim=-1)
  )
)
propagate done
init label
Split: 01, Run: 01
None time:  1.3355002698954195
None Run 01:
Highest Train: 100.00
Highest Valid: 81.00
  Final Train: 100.00
   Final Test: 81.90
Split: 01, Run: 02
None time:  1.4610770200379193
None Run 02:
Highest Train: 100.00
Highest Valid: 80.20
  Final Train: 100.00
   Final Test: 81.70
Split: 01, Run: 03
None time:  1.4575853531714529
None Run 03:
Highest Train: 100.00
Highest Valid: 81.20
  Final Train: 100.00
   Final Test: 81.10
run time now: 4.278784513473511
total time:  4.306463999906555
None All runs:
Highest Train: 100.00 ± 0.00
Highest Valid: 80.80 ± 0.53
  Final Train: 100.00 ± 0.00
   Final Test: 81.57 ± 0.42
[I 2023-06-12 00:22:40,891] Trial 98 finished with value: 80.79999542236328 and parameters: {'Fwd': 0.017039453629267422, 'K': 7, 'alpha': 0.15000000000000002, 'dropout': 0.7000000000000001, 'gnnepoch': 50, 'lambda1': 0.55, 'lambda2': 7.224335640080138, 'loop': 1, 'loss': 'CE', 'lr': 0.0053643524618362335, 'softmaxF': True, 'useGCN': True, 'weight_decay': 2.3970893983781916e-05, 'weightedloss': True}. Best is trial 60 with value: 81.33333587646484.
/home/wxy/miniconda3/lib/python3.10/site-packages/optuna/distributions.py:685: UserWarning: The distribution is specified by [0, 1.00001] and step=0.05, but the range is not divisible by `step`. It will be replaced by [0, 1.0].
  warnings.warn(
K:  9
alpha:  0.1
lr:  0.006180314602556683
weight_decay:  1.2171330492073562e-05
dropout:  0.8
fix split and run 3 times
Data: Data(x=[2708, 1433], y=[2708], train_mask=[2708], val_mask=[2708], test_mask=[2708], adj_t=[2708, 2708, nnz=10556])
num_train tensor(140)
num_noise 0
noise: tensor(0)
data feature 1433
ALTOPT(
  (lins): Sequential(
    (0): Linear(in_features=1433, out_features=64, bias=True)
    (1): BatchNorm1d(64, eps=1e-05, momentum=0.1, affine=True, track_running_stats=True)
    (2): Dropout(p=0.8, inplace=True)
    (3): ReLU(inplace=True)
    (4): Linear(in_features=64, out_features=7, bias=True)
    (5): LogSoftmax(dim=-1)
  )
  (prop): Propagation(K=9, mode=None, lambda1=None, lambda2=None, L21=True, alpha=0.1)
  (gcn): GCN(
    (convs): ModuleList(
      (0): GCNConv(1433, 64)
      (1): GCNConv(64, 7)
    )
    (bns): ModuleList(
      (0): BatchNorm1d(64, eps=1e-05, momentum=0.1, affine=True, track_running_stats=True)
    )
    (output): LogSoftmax(dim=-1)
  )
)
propagate done
init label
Split: 01, Run: 01
None time:  1.4574313540942967
None Run 01:
Highest Train: 100.00
Highest Valid: 81.40
  Final Train: 100.00
   Final Test: 82.40
Split: 01, Run: 02
None time:  1.6119112269952893
None Run 02:
Highest Train: 100.00
Highest Valid: 80.40
  Final Train: 100.00
   Final Test: 81.50
Split: 01, Run: 03
None time:  1.4856478839647025
None Run 03:
Highest Train: 100.00
Highest Valid: 80.60
  Final Train: 100.00
   Final Test: 80.80
run time now: 4.58412766456604
total time:  4.6119737471453846
None All runs:
Highest Train: 100.00 ± 0.00
Highest Valid: 80.80 ± 0.53
  Final Train: 100.00 ± 0.00
   Final Test: 81.57 ± 0.80
[I 2023-06-12 00:22:45,973] Trial 99 finished with value: 80.79999542236328 and parameters: {'Fwd': 0.004858183144164983, 'K': 9, 'alpha': 0.1, 'dropout': 0.8, 'gnnepoch': 50, 'lambda1': 0.35000000000000003, 'lambda2': 5.767671453484122, 'loop': 1, 'loss': 'CE', 'lr': 0.006180314602556683, 'softmaxF': True, 'useGCN': True, 'weight_decay': 1.2171330492073562e-05, 'weightedloss': True}. Best is trial 60 with value: 81.33333587646484.
/home/wxy/miniconda3/lib/python3.10/site-packages/optuna/distributions.py:685: UserWarning: The distribution is specified by [0, 1.00001] and step=0.05, but the range is not divisible by `step`. It will be replaced by [0, 1.0].
  warnings.warn(
K:  8
alpha:  0.15000000000000002
lr:  0.008306533467100332
weight_decay:  5.591598446026762e-06
dropout:  0.6000000000000001
fix split and run 3 times
Data: Data(x=[2708, 1433], y=[2708], train_mask=[2708], val_mask=[2708], test_mask=[2708], adj_t=[2708, 2708, nnz=10556])
num_train tensor(140)
num_noise 0
noise: tensor(0)
data feature 1433
ALTOPT(
  (lins): Sequential(
    (0): Linear(in_features=1433, out_features=64, bias=True)
    (1): BatchNorm1d(64, eps=1e-05, momentum=0.1, affine=True, track_running_stats=True)
    (2): Dropout(p=0.6000000000000001, inplace=True)
    (3): ReLU(inplace=True)
    (4): Linear(in_features=64, out_features=7, bias=True)
    (5): LogSoftmax(dim=-1)
  )
  (prop): Propagation(K=8, mode=None, lambda1=None, lambda2=None, L21=True, alpha=0.15000000000000002)
  (gcn): GCN(
    (convs): ModuleList(
      (0): GCNConv(1433, 64)
      (1): GCNConv(64, 7)
    )
    (bns): ModuleList(
      (0): BatchNorm1d(64, eps=1e-05, momentum=0.1, affine=True, track_running_stats=True)
    )
    (output): LogSoftmax(dim=-1)
  )
)
propagate done
init label
Split: 01, Run: 01
None time:  1.0467535299248993
None Run 01:
Highest Train: 100.00
Highest Valid: 81.40
  Final Train: 100.00
   Final Test: 82.00
Split: 01, Run: 02
None time:  1.1919592679478228
None Run 02:
Highest Train: 100.00
Highest Valid: 80.60
  Final Train: 100.00
   Final Test: 80.50
Split: 01, Run: 03
None time:  1.5455789098050445
None Run 03:
Highest Train: 100.00
Highest Valid: 80.20
  Final Train: 100.00
   Final Test: 80.80
run time now: 3.8074264526367188
total time:  3.832126140827313
None All runs:
Highest Train: 100.00 ± 0.00
Highest Valid: 80.73 ± 0.61
  Final Train: 100.00 ± 0.00
   Final Test: 81.10 ± 0.79
[I 2023-06-12 00:22:50,396] Trial 100 finished with value: 80.73332977294922 and parameters: {'Fwd': 0.00690549625612198, 'K': 8, 'alpha': 0.15000000000000002, 'dropout': 0.6000000000000001, 'gnnepoch': 40, 'lambda1': 0.45, 'lambda2': 6.61315697943306, 'loop': 1, 'loss': 'CE', 'lr': 0.008306533467100332, 'softmaxF': True, 'useGCN': True, 'weight_decay': 5.591598446026762e-06, 'weightedloss': True}. Best is trial 60 with value: 81.33333587646484.
/home/wxy/miniconda3/lib/python3.10/site-packages/optuna/distributions.py:685: UserWarning: The distribution is specified by [0, 1.00001] and step=0.05, but the range is not divisible by `step`. It will be replaced by [0, 1.0].
  warnings.warn(
K:  8
alpha:  0.0
lr:  0.007035973808520262
weight_decay:  1.760204600182178e-05
dropout:  0.7000000000000001
fix split and run 3 times
Data: Data(x=[2708, 1433], y=[2708], train_mask=[2708], val_mask=[2708], test_mask=[2708], adj_t=[2708, 2708, nnz=10556])
num_train tensor(140)
num_noise 0
noise: tensor(0)
data feature 1433
ALTOPT(
  (lins): Sequential(
    (0): Linear(in_features=1433, out_features=64, bias=True)
    (1): BatchNorm1d(64, eps=1e-05, momentum=0.1, affine=True, track_running_stats=True)
    (2): Dropout(p=0.7000000000000001, inplace=True)
    (3): ReLU(inplace=True)
    (4): Linear(in_features=64, out_features=7, bias=True)
    (5): LogSoftmax(dim=-1)
  )
  (prop): Propagation(K=8, mode=None, lambda1=None, lambda2=None, L21=True, alpha=0.0)
  (gcn): GCN(
    (convs): ModuleList(
      (0): GCNConv(1433, 64)
      (1): GCNConv(64, 7)
    )
    (bns): ModuleList(
      (0): BatchNorm1d(64, eps=1e-05, momentum=0.1, affine=True, track_running_stats=True)
    )
    (output): LogSoftmax(dim=-1)
  )
)
propagate done
init label
Split: 01, Run: 01
None time:  1.39092505001463
None Run 01:
Highest Train: 100.00
Highest Valid: 81.00
  Final Train: 100.00
   Final Test: 82.00
Split: 01, Run: 02
None time:  1.525856874883175
None Run 02:
Highest Train: 100.00
Highest Valid: 80.40
  Final Train: 100.00
   Final Test: 82.50
Split: 01, Run: 03
None time:  1.0527379219420254
None Run 03:
Highest Train: 100.00
Highest Valid: 81.20
  Final Train: 100.00
   Final Test: 81.30
run time now: 3.9940783977508545
total time:  4.012565741082653
None All runs:
Highest Train: 100.00 ± 0.00
Highest Valid: 80.87 ± 0.42
  Final Train: 100.00 ± 0.00
   Final Test: 81.93 ± 0.60
[I 2023-06-12 00:22:54,842] Trial 101 finished with value: 80.86666107177734 and parameters: {'Fwd': 0.006804057754326129, 'K': 8, 'alpha': 0.0, 'dropout': 0.7000000000000001, 'gnnepoch': 50, 'lambda1': 0.5, 'lambda2': 6.2937749200839574, 'loop': 1, 'loss': 'CE', 'lr': 0.007035973808520262, 'softmaxF': True, 'useGCN': True, 'weight_decay': 1.760204600182178e-05, 'weightedloss': True}. Best is trial 60 with value: 81.33333587646484.
/home/wxy/miniconda3/lib/python3.10/site-packages/optuna/distributions.py:685: UserWarning: The distribution is specified by [0, 1.00001] and step=0.05, but the range is not divisible by `step`. It will be replaced by [0, 1.0].
  warnings.warn(
K:  8
alpha:  0.0
lr:  0.006634738216090488
weight_decay:  1.9172027591048995e-05
dropout:  0.7000000000000001
fix split and run 3 times
Data: Data(x=[2708, 1433], y=[2708], train_mask=[2708], val_mask=[2708], test_mask=[2708], adj_t=[2708, 2708, nnz=10556])
num_train tensor(140)
num_noise 0
noise: tensor(0)
data feature 1433
ALTOPT(
  (lins): Sequential(
    (0): Linear(in_features=1433, out_features=64, bias=True)
    (1): BatchNorm1d(64, eps=1e-05, momentum=0.1, affine=True, track_running_stats=True)
    (2): Dropout(p=0.7000000000000001, inplace=True)
    (3): ReLU(inplace=True)
    (4): Linear(in_features=64, out_features=7, bias=True)
    (5): LogSoftmax(dim=-1)
  )
  (prop): Propagation(K=8, mode=None, lambda1=None, lambda2=None, L21=True, alpha=0.0)
  (gcn): GCN(
    (convs): ModuleList(
      (0): GCNConv(1433, 64)
      (1): GCNConv(64, 7)
    )
    (bns): ModuleList(
      (0): BatchNorm1d(64, eps=1e-05, momentum=0.1, affine=True, track_running_stats=True)
    )
    (output): LogSoftmax(dim=-1)
  )
)
propagate done
init label
Split: 01, Run: 01
None time:  1.2574522229842842
None Run 01:
Highest Train: 100.00
Highest Valid: 80.80
  Final Train: 100.00
   Final Test: 81.80
Split: 01, Run: 02
None time:  1.770996920997277
None Run 02:
Highest Train: 100.00
Highest Valid: 80.60
  Final Train: 100.00
   Final Test: 81.70
Split: 01, Run: 03
None time:  1.6712433700449765
None Run 03:
Highest Train: 100.00
Highest Valid: 80.60
  Final Train: 100.00
   Final Test: 82.10
run time now: 4.726577520370483
total time:  4.747785493033007
None All runs:
Highest Train: 100.00 ± 0.00
Highest Valid: 80.67 ± 0.12
  Final Train: 100.00 ± 0.00
   Final Test: 81.87 ± 0.21
[I 2023-06-12 00:23:00,047] Trial 102 finished with value: 80.66666412353516 and parameters: {'Fwd': 0.0037387027944793295, 'K': 8, 'alpha': 0.0, 'dropout': 0.7000000000000001, 'gnnepoch': 40, 'lambda1': 0.5, 'lambda2': 6.397114188215078, 'loop': 1, 'loss': 'CE', 'lr': 0.006634738216090488, 'softmaxF': True, 'useGCN': True, 'weight_decay': 1.9172027591048995e-05, 'weightedloss': True}. Best is trial 60 with value: 81.33333587646484.
/home/wxy/miniconda3/lib/python3.10/site-packages/optuna/distributions.py:685: UserWarning: The distribution is specified by [0, 1.00001] and step=0.05, but the range is not divisible by `step`. It will be replaced by [0, 1.0].
  warnings.warn(
K:  7
alpha:  0.0
lr:  0.005757202266181107
weight_decay:  9.861262308951875e-06
dropout:  0.8
fix split and run 3 times
Data: Data(x=[2708, 1433], y=[2708], train_mask=[2708], val_mask=[2708], test_mask=[2708], adj_t=[2708, 2708, nnz=10556])
num_train tensor(140)
num_noise 0
noise: tensor(0)
data feature 1433
ALTOPT(
  (lins): Sequential(
    (0): Linear(in_features=1433, out_features=64, bias=True)
    (1): BatchNorm1d(64, eps=1e-05, momentum=0.1, affine=True, track_running_stats=True)
    (2): Dropout(p=0.8, inplace=True)
    (3): ReLU(inplace=True)
    (4): Linear(in_features=64, out_features=7, bias=True)
    (5): LogSoftmax(dim=-1)
  )
  (prop): Propagation(K=7, mode=None, lambda1=None, lambda2=None, L21=True, alpha=0.0)
  (gcn): GCN(
    (convs): ModuleList(
      (0): GCNConv(1433, 64)
      (1): GCNConv(64, 7)
    )
    (bns): ModuleList(
      (0): BatchNorm1d(64, eps=1e-05, momentum=0.1, affine=True, track_running_stats=True)
    )
    (output): LogSoftmax(dim=-1)
  )
)
propagate done
init label
Split: 01, Run: 01
None time:  1.410259481985122
None Run 01:
Highest Train: 100.00
Highest Valid: 81.60
  Final Train: 100.00
   Final Test: 82.90
Split: 01, Run: 02
None time:  1.8365718021523207
None Run 02:
Highest Train: 100.00
Highest Valid: 80.20
  Final Train: 100.00
   Final Test: 82.80
Split: 01, Run: 03
None time:  1.4172890291083604
None Run 03:
Highest Train: 100.00
Highest Valid: 80.60
  Final Train: 100.00
   Final Test: 80.60
run time now: 4.689270734786987
total time:  4.709916946012527
None All runs:
Highest Train: 100.00 ± 0.00
Highest Valid: 80.80 ± 0.72
  Final Train: 100.00 ± 0.00
   Final Test: 82.10 ± 1.30
[I 2023-06-12 00:23:05,344] Trial 103 finished with value: 80.79999542236328 and parameters: {'Fwd': 0.015430615816316095, 'K': 7, 'alpha': 0.0, 'dropout': 0.8, 'gnnepoch': 50, 'lambda1': 0.4, 'lambda2': 6.861254561968873, 'loop': 1, 'loss': 'CE', 'lr': 0.005757202266181107, 'softmaxF': True, 'useGCN': True, 'weight_decay': 9.861262308951875e-06, 'weightedloss': True}. Best is trial 60 with value: 81.33333587646484.
/home/wxy/miniconda3/lib/python3.10/site-packages/optuna/distributions.py:685: UserWarning: The distribution is specified by [0, 1.00001] and step=0.05, but the range is not divisible by `step`. It will be replaced by [0, 1.0].
  warnings.warn(
K:  9
alpha:  0.1
lr:  0.00746434699683464
weight_decay:  1.8351720325555382e-05
dropout:  0.7000000000000001
fix split and run 3 times
Data: Data(x=[2708, 1433], y=[2708], train_mask=[2708], val_mask=[2708], test_mask=[2708], adj_t=[2708, 2708, nnz=10556])
num_train tensor(140)
num_noise 0
noise: tensor(0)
data feature 1433
ALTOPT(
  (lins): Sequential(
    (0): Linear(in_features=1433, out_features=64, bias=True)
    (1): BatchNorm1d(64, eps=1e-05, momentum=0.1, affine=True, track_running_stats=True)
    (2): Dropout(p=0.7000000000000001, inplace=True)
    (3): ReLU(inplace=True)
    (4): Linear(in_features=64, out_features=7, bias=True)
    (5): LogSoftmax(dim=-1)
  )
  (prop): Propagation(K=9, mode=None, lambda1=None, lambda2=None, L21=True, alpha=0.1)
  (gcn): GCN(
    (convs): ModuleList(
      (0): GCNConv(1433, 64)
      (1): GCNConv(64, 7)
    )
    (bns): ModuleList(
      (0): BatchNorm1d(64, eps=1e-05, momentum=0.1, affine=True, track_running_stats=True)
    )
    (output): LogSoftmax(dim=-1)
  )
)
propagate done
init label
Split: 01, Run: 01
None time:  1.4513422020245343
None Run 01:
Highest Train: 100.00
Highest Valid: 81.20
  Final Train: 100.00
   Final Test: 82.40
Split: 01, Run: 02
None time:  1.4811583440750837
None Run 02:
Highest Train: 100.00
Highest Valid: 80.60
  Final Train: 100.00
   Final Test: 81.80
Split: 01, Run: 03
None time:  1.6979110788088292
None Run 03:
Highest Train: 100.00
Highest Valid: 80.60
  Final Train: 100.00
   Final Test: 82.20
run time now: 4.699656009674072
total time:  4.731820857152343
None All runs:
Highest Train: 100.00 ± 0.00
Highest Valid: 80.80 ± 0.35
  Final Train: 100.00 ± 0.00
   Final Test: 82.13 ± 0.31
[I 2023-06-12 00:23:10,660] Trial 104 finished with value: 80.79999542236328 and parameters: {'Fwd': 0.008407665730066226, 'K': 9, 'alpha': 0.1, 'dropout': 0.7000000000000001, 'gnnepoch': 50, 'lambda1': 0.55, 'lambda2': 6.582158322374272, 'loop': 1, 'loss': 'CE', 'lr': 0.00746434699683464, 'softmaxF': True, 'useGCN': True, 'weight_decay': 1.8351720325555382e-05, 'weightedloss': True}. Best is trial 60 with value: 81.33333587646484.
/home/wxy/miniconda3/lib/python3.10/site-packages/optuna/distributions.py:685: UserWarning: The distribution is specified by [0, 1.00001] and step=0.05, but the range is not divisible by `step`. It will be replaced by [0, 1.0].
  warnings.warn(
K:  9
alpha:  0.45
lr:  0.008689715442487608
weight_decay:  1.4275020601797904e-05
dropout:  0.5
fix split and run 3 times
Data: Data(x=[2708, 1433], y=[2708], train_mask=[2708], val_mask=[2708], test_mask=[2708], adj_t=[2708, 2708, nnz=10556])
num_train tensor(140)
num_noise 0
noise: tensor(0)
data feature 1433
ALTOPT(
  (lins): Sequential(
    (0): Linear(in_features=1433, out_features=64, bias=True)
    (1): BatchNorm1d(64, eps=1e-05, momentum=0.1, affine=True, track_running_stats=True)
    (2): Dropout(p=0.5, inplace=True)
    (3): ReLU(inplace=True)
    (4): Linear(in_features=64, out_features=7, bias=True)
    (5): LogSoftmax(dim=-1)
  )
  (prop): Propagation(K=9, mode=None, lambda1=None, lambda2=None, L21=True, alpha=0.45)
  (gcn): GCN(
    (convs): ModuleList(
      (0): GCNConv(1433, 64)
      (1): GCNConv(64, 7)
    )
    (bns): ModuleList(
      (0): BatchNorm1d(64, eps=1e-05, momentum=0.1, affine=True, track_running_stats=True)
    )
    (output): LogSoftmax(dim=-1)
  )
)
propagate done
init label
Split: 01, Run: 01
None time:  1.0390099710784853
None Run 01:
Highest Train: 100.00
Highest Valid: 81.40
  Final Train: 100.00
   Final Test: 82.50
Split: 01, Run: 02
None time:  1.8951791059225798
None Run 02:
Highest Train: 100.00
Highest Valid: 80.80
  Final Train: 100.00
   Final Test: 81.60
Split: 01, Run: 03
None time:  1.7498137529473752
None Run 03:
Highest Train: 100.00
Highest Valid: 80.40
  Final Train: 100.00
   Final Test: 81.00
run time now: 4.704524993896484
total time:  4.723484985064715
None All runs:
Highest Train: 100.00 ± 0.00
Highest Valid: 80.87 ± 0.50
  Final Train: 100.00 ± 0.00
   Final Test: 81.70 ± 0.75
[I 2023-06-12 00:23:15,929] Trial 105 finished with value: 80.86666870117188 and parameters: {'Fwd': 0.02092084118753465, 'K': 9, 'alpha': 0.45, 'dropout': 0.5, 'gnnepoch': 60, 'lambda1': 0.6000000000000001, 'lambda2': 6.0254141380722555, 'loop': 1, 'loss': 'CE', 'lr': 0.008689715442487608, 'softmaxF': True, 'useGCN': True, 'weight_decay': 1.4275020601797904e-05, 'weightedloss': True}. Best is trial 60 with value: 81.33333587646484.
/home/wxy/miniconda3/lib/python3.10/site-packages/optuna/distributions.py:685: UserWarning: The distribution is specified by [0, 1.00001] and step=0.05, but the range is not divisible by `step`. It will be replaced by [0, 1.0].
  warnings.warn(
K:  9
alpha:  0.4
lr:  0.008622518575148706
weight_decay:  2.276718415220109e-05
dropout:  0.5
fix split and run 3 times
Data: Data(x=[2708, 1433], y=[2708], train_mask=[2708], val_mask=[2708], test_mask=[2708], adj_t=[2708, 2708, nnz=10556])
num_train tensor(140)
num_noise 0
noise: tensor(0)
data feature 1433
ALTOPT(
  (lins): Sequential(
    (0): Linear(in_features=1433, out_features=64, bias=True)
    (1): BatchNorm1d(64, eps=1e-05, momentum=0.1, affine=True, track_running_stats=True)
    (2): Dropout(p=0.5, inplace=True)
    (3): ReLU(inplace=True)
    (4): Linear(in_features=64, out_features=7, bias=True)
    (5): LogSoftmax(dim=-1)
  )
  (prop): Propagation(K=9, mode=None, lambda1=None, lambda2=None, L21=True, alpha=0.4)
  (gcn): GCN(
    (convs): ModuleList(
      (0): GCNConv(1433, 64)
      (1): GCNConv(64, 7)
    )
    (bns): ModuleList(
      (0): BatchNorm1d(64, eps=1e-05, momentum=0.1, affine=True, track_running_stats=True)
    )
    (output): LogSoftmax(dim=-1)
  )
)
propagate done
init label
Split: 01, Run: 01
None time:  1.6112598369363695
None Run 01:
Highest Train: 100.00
Highest Valid: 81.40
  Final Train: 100.00
   Final Test: 82.50
Split: 01, Run: 02
None time:  1.3913632109761238
None Run 02:
Highest Train: 100.00
Highest Valid: 80.80
  Final Train: 100.00
   Final Test: 81.70
Split: 01, Run: 03
None time:  1.696772496914491
None Run 03:
Highest Train: 100.00
Highest Valid: 80.40
  Final Train: 100.00
   Final Test: 81.00
run time now: 4.726248025894165
total time:  4.760536674177274
None All runs:
Highest Train: 100.00 ± 0.00
Highest Valid: 80.87 ± 0.50
  Final Train: 100.00 ± 0.00
   Final Test: 81.73 ± 0.75
