[I 2023-06-12 00:58:04,113] Trial 485 finished with value: 82.4000015258789 and parameters: {'Fwd': 3.322066258913691e-06, 'K': 10, 'alpha': 0.9, 'dropout': 0.9, 'gnnepoch': 70, 'lambda1': 0.8500000000000001, 'lambda2': 8.826189051929639, 'loop': 1, 'loss': 'MSE', 'lr': 0.005148417506082193, 'softmaxF': True, 'useGCN': False, 'weight_decay': 4.737857551607516e-06, 'weightedloss': False}. Best is trial 483 with value: 83.73332977294922.
/home/wxy/miniconda3/lib/python3.10/site-packages/optuna/distributions.py:685: UserWarning: The distribution is specified by [0, 1.00001] and step=0.05, but the range is not divisible by `step`. It will be replaced by [0, 1.0].
  warnings.warn(
K:  10
alpha:  0.9500000000000001
lr:  0.00012224933491197104
weight_decay:  2.136036002854343e-05
dropout:  0.9
fix split and run 3 times
Data: Data(x=[19717, 500], y=[19717], train_mask=[19717], val_mask=[19717], test_mask=[19717], adj_t=[19717, 19717, nnz=88648])
num_train tensor(60)
num_noise 0
noise: tensor(0)
data feature 500
ALTOPT(
  (lins): Sequential(
    (0): Linear(in_features=500, out_features=64, bias=True)
    (1): BatchNorm1d(64, eps=1e-05, momentum=0.1, affine=True, track_running_stats=True)
    (2): Dropout(p=0.9, inplace=True)
    (3): ReLU(inplace=True)
    (4): Linear(in_features=64, out_features=3, bias=True)
    (5): Identity()
  )
  (prop): Propagation(K=10, mode=None, lambda1=None, lambda2=None, L21=True, alpha=0.9500000000000001)
  (gcn): GCN(
    (convs): ModuleList(
      (0): GCNConv(500, 64)
      (1): GCNConv(64, 3)
    )
    (bns): ModuleList(
      (0): BatchNorm1d(64, eps=1e-05, momentum=0.1, affine=True, track_running_stats=True)
    )
    (output): Identity()
  )
)
propagate done
init label
Split: 01, Run: 01
None time:  1.067815822083503
None Run 01:
Highest Train: 100.00
Highest Valid: 69.20
  Final Train: 100.00
   Final Test: 69.10
Split: 01, Run: 02, Epoch: 100, Loss: 0.8506, Train: 100.00%, Valid: 76.60% Test: 71.90%
Split: 01, Run: 02
None time:  3.658641873160377
None Run 02:
Highest Train: 100.00
Highest Valid: 76.60
  Final Train: 100.00
   Final Test: 72.00
Split: 01, Run: 03
None time:  3.373069741996005
None Run 03:
Highest Train: 100.00
Highest Valid: 78.80
  Final Train: 100.00
   Final Test: 75.50
run time now: 8.150437116622925
total time:  8.194155876990408
None All runs:
Highest Train: 100.00 ± 0.00
Highest Valid: 74.87 ± 5.03
  Final Train: 100.00 ± 0.00
   Final Test: 72.20 ± 3.20
[I 2023-06-12 00:58:12,847] Trial 486 finished with value: 74.86666107177734 and parameters: {'Fwd': 2.119074630812988e-06, 'K': 10, 'alpha': 0.9500000000000001, 'dropout': 0.9, 'gnnepoch': 70, 'lambda1': 0.9, 'lambda2': 8.389121371052552, 'loop': 1, 'loss': 'MSE', 'lr': 0.00012224933491197104, 'softmaxF': True, 'useGCN': False, 'weight_decay': 2.136036002854343e-05, 'weightedloss': False}. Best is trial 483 with value: 83.73332977294922.
/home/wxy/miniconda3/lib/python3.10/site-packages/optuna/distributions.py:685: UserWarning: The distribution is specified by [0, 1.00001] and step=0.05, but the range is not divisible by `step`. It will be replaced by [0, 1.0].
  warnings.warn(
K:  9
alpha:  0.8
lr:  0.004817803712977417
weight_decay:  1.1150382748897523e-05
dropout:  0.9
fix split and run 3 times
Data: Data(x=[19717, 500], y=[19717], train_mask=[19717], val_mask=[19717], test_mask=[19717], adj_t=[19717, 19717, nnz=88648])
num_train tensor(60)
num_noise 0
noise: tensor(0)
data feature 500
ALTOPT(
  (lins): Sequential(
    (0): Linear(in_features=500, out_features=64, bias=True)
    (1): BatchNorm1d(64, eps=1e-05, momentum=0.1, affine=True, track_running_stats=True)
    (2): Dropout(p=0.9, inplace=True)
    (3): ReLU(inplace=True)
    (4): Linear(in_features=64, out_features=3, bias=True)
    (5): Identity()
  )
  (prop): Propagation(K=9, mode=None, lambda1=None, lambda2=None, L21=True, alpha=0.8)
  (gcn): GCN(
    (convs): ModuleList(
      (0): GCNConv(500, 64)
      (1): GCNConv(64, 3)
    )
    (bns): ModuleList(
      (0): BatchNorm1d(64, eps=1e-05, momentum=0.1, affine=True, track_running_stats=True)
    )
    (output): Identity()
  )
)
propagate done
init label
Split: 01, Run: 01
None time:  1.9234077231958508
None Run 01:
Highest Train: 100.00
Highest Valid: 80.40
  Final Train: 100.00
   Final Test: 77.20
Split: 01, Run: 02
None time:  1.6274020820856094
None Run 02:
Highest Train: 100.00
Highest Valid: 81.20
  Final Train: 100.00
   Final Test: 78.30
Split: 01, Run: 03
None time:  2.1982353560160846
None Run 03:
Highest Train: 100.00
Highest Valid: 79.80
  Final Train: 100.00
   Final Test: 77.40
run time now: 5.799437522888184
total time:  5.853715694043785
None All runs:
Highest Train: 100.00 ± 0.00
Highest Valid: 80.47 ± 0.70
  Final Train: 100.00 ± 0.00
   Final Test: 77.63 ± 0.59
[I 2023-06-12 00:58:19,315] Trial 487 finished with value: 80.46666717529297 and parameters: {'Fwd': 3.951596527491841e-06, 'K': 9, 'alpha': 0.8, 'dropout': 0.9, 'gnnepoch': 70, 'lambda1': 0.8500000000000001, 'lambda2': 8.000053158481785, 'loop': 1, 'loss': 'MSE', 'lr': 0.004817803712977417, 'softmaxF': True, 'useGCN': False, 'weight_decay': 1.1150382748897523e-05, 'weightedloss': False}. Best is trial 483 with value: 83.73332977294922.
/home/wxy/miniconda3/lib/python3.10/site-packages/optuna/distributions.py:685: UserWarning: The distribution is specified by [0, 1.00001] and step=0.05, but the range is not divisible by `step`. It will be replaced by [0, 1.0].
  warnings.warn(
K:  5
alpha:  1.0
lr:  0.005438774083816825
weight_decay:  1.7216244244858035e-06
dropout:  0.9
fix split and run 3 times
Data: Data(x=[19717, 500], y=[19717], train_mask=[19717], val_mask=[19717], test_mask=[19717], adj_t=[19717, 19717, nnz=88648])
num_train tensor(60)
num_noise 0
noise: tensor(0)
data feature 500
ALTOPT(
  (lins): Sequential(
    (0): Linear(in_features=500, out_features=64, bias=True)
    (1): BatchNorm1d(64, eps=1e-05, momentum=0.1, affine=True, track_running_stats=True)
    (2): Dropout(p=0.9, inplace=True)
    (3): ReLU(inplace=True)
    (4): Linear(in_features=64, out_features=3, bias=True)
    (5): Identity()
  )
  (prop): Propagation(K=5, mode=None, lambda1=None, lambda2=None, L21=True, alpha=1.0)
  (gcn): GCN(
    (convs): ModuleList(
      (0): GCNConv(500, 64)
      (1): GCNConv(64, 3)
    )
    (bns): ModuleList(
      (0): BatchNorm1d(64, eps=1e-05, momentum=0.1, affine=True, track_running_stats=True)
    )
    (output): Identity()
  )
)
propagate done
init label
Split: 01, Run: 01
None time:  1.690791886067018
None Run 01:
Highest Train: 100.00
Highest Valid: 82.20
  Final Train: 100.00
   Final Test: 77.60
Split: 01, Run: 02
None time:  1.649217550875619
None Run 02:
Highest Train: 100.00
Highest Valid: 82.60
  Final Train: 100.00
   Final Test: 78.80
Split: 01, Run: 03
None time:  0.9632580990437418
None Run 03:
Highest Train: 100.00
Highest Valid: 81.20
  Final Train: 100.00
   Final Test: 78.00
run time now: 4.339775800704956
total time:  4.383133952971548
None All runs:
Highest Train: 100.00 ± 0.00
Highest Valid: 82.00 ± 0.72
  Final Train: 100.00 ± 0.00
   Final Test: 78.13 ± 0.61
[I 2023-06-12 00:58:24,321] Trial 488 finished with value: 82.0 and parameters: {'Fwd': 0.0007414590602895177, 'K': 5, 'alpha': 1.0, 'dropout': 0.9, 'gnnepoch': 70, 'lambda1': 1.0, 'lambda2': 6.848363624052607, 'loop': 1, 'loss': 'MSE', 'lr': 0.005438774083816825, 'softmaxF': True, 'useGCN': False, 'weight_decay': 1.7216244244858035e-06, 'weightedloss': False}. Best is trial 483 with value: 83.73332977294922.
/home/wxy/miniconda3/lib/python3.10/site-packages/optuna/distributions.py:685: UserWarning: The distribution is specified by [0, 1.00001] and step=0.05, but the range is not divisible by `step`. It will be replaced by [0, 1.0].
  warnings.warn(
K:  10
alpha:  0.9500000000000001
lr:  0.0034524400742605614
weight_decay:  1.2104260082164694e-06
dropout:  0.9
fix split and run 3 times
Data: Data(x=[19717, 500], y=[19717], train_mask=[19717], val_mask=[19717], test_mask=[19717], adj_t=[19717, 19717, nnz=88648])
num_train tensor(60)
num_noise 0
noise: tensor(0)
data feature 500
ALTOPT(
  (lins): Sequential(
    (0): Linear(in_features=500, out_features=64, bias=True)
    (1): BatchNorm1d(64, eps=1e-05, momentum=0.1, affine=True, track_running_stats=True)
    (2): Dropout(p=0.9, inplace=True)
    (3): ReLU(inplace=True)
    (4): Linear(in_features=64, out_features=3, bias=True)
    (5): Identity()
  )
  (prop): Propagation(K=10, mode=None, lambda1=None, lambda2=None, L21=True, alpha=0.9500000000000001)
  (gcn): GCN(
    (convs): ModuleList(
      (0): GCNConv(500, 64)
      (1): GCNConv(64, 3)
    )
    (bns): ModuleList(
      (0): BatchNorm1d(64, eps=1e-05, momentum=0.1, affine=True, track_running_stats=True)
    )
    (output): Identity()
  )
)
propagate done
init label
Split: 01, Run: 01
None time:  2.5052996531594545
None Run 01:
Highest Train: 100.00
Highest Valid: 81.40
  Final Train: 100.00
   Final Test: 78.00
Split: 01, Run: 02
None time:  1.3666928210295737
None Run 02:
Highest Train: 100.00
Highest Valid: 81.80
  Final Train: 100.00
   Final Test: 78.90
Split: 01, Run: 03
None time:  1.5277496890630573
None Run 03:
Highest Train: 100.00
Highest Valid: 82.60
  Final Train: 100.00
   Final Test: 79.50
run time now: 5.443365812301636
total time:  5.487869939068332
None All runs:
Highest Train: 100.00 ± 0.00
Highest Valid: 81.93 ± 0.61
  Final Train: 100.00 ± 0.00
   Final Test: 78.80 ± 0.75
[I 2023-06-12 00:58:30,521] Trial 489 finished with value: 81.93334197998047 and parameters: {'Fwd': 0.0002458011548366806, 'K': 10, 'alpha': 0.9500000000000001, 'dropout': 0.9, 'gnnepoch': 70, 'lambda1': 0.9500000000000001, 'lambda2': 9.37310224938092, 'loop': 1, 'loss': 'MSE', 'lr': 0.0034524400742605614, 'softmaxF': True, 'useGCN': False, 'weight_decay': 1.2104260082164694e-06, 'weightedloss': False}. Best is trial 483 with value: 83.73332977294922.
/home/wxy/miniconda3/lib/python3.10/site-packages/optuna/distributions.py:685: UserWarning: The distribution is specified by [0, 1.00001] and step=0.05, but the range is not divisible by `step`. It will be replaced by [0, 1.0].
  warnings.warn(
K:  10
alpha:  0.9
lr:  0.000769384037183383
weight_decay:  4.578883045469642e-05
dropout:  0.9
fix split and run 3 times
Data: Data(x=[19717, 500], y=[19717], train_mask=[19717], val_mask=[19717], test_mask=[19717], adj_t=[19717, 19717, nnz=88648])
num_train tensor(60)
num_noise 0
noise: tensor(0)
data feature 500
ALTOPT(
  (lins): Sequential(
    (0): Linear(in_features=500, out_features=64, bias=True)
    (1): BatchNorm1d(64, eps=1e-05, momentum=0.1, affine=True, track_running_stats=True)
    (2): Dropout(p=0.9, inplace=True)
    (3): ReLU(inplace=True)
    (4): Linear(in_features=64, out_features=3, bias=True)
    (5): Identity()
  )
  (prop): Propagation(K=10, mode=None, lambda1=None, lambda2=None, L21=True, alpha=0.9)
  (gcn): GCN(
    (convs): ModuleList(
      (0): GCNConv(500, 64)
      (1): GCNConv(64, 3)
    )
    (bns): ModuleList(
      (0): BatchNorm1d(64, eps=1e-05, momentum=0.1, affine=True, track_running_stats=True)
    )
    (output): Identity()
  )
)
propagate done
init label
Split: 01, Run: 01
None time:  2.0285794970113784
None Run 01:
Highest Train: 100.00
Highest Valid: 77.40
  Final Train: 100.00
   Final Test: 72.40
Split: 01, Run: 02
None time:  1.054236883064732
None Run 02:
Highest Train: 100.00
Highest Valid: 78.80
  Final Train: 100.00
   Final Test: 76.60
Split: 01, Run: 03, Epoch: 100, Loss: 0.3823, Train: 100.00%, Valid: 81.20% Test: 76.50%
Split: 01, Run: 03
None time:  3.680138358846307
None Run 03:
Highest Train: 100.00
Highest Valid: 81.20
  Final Train: 100.00
   Final Test: 76.40
run time now: 6.826379060745239
total time:  6.869090477004647
None All runs:
Highest Train: 100.00 ± 0.00
Highest Valid: 79.13 ± 1.92
  Final Train: 100.00 ± 0.00
   Final Test: 75.13 ± 2.37
[I 2023-06-12 00:58:38,001] Trial 490 finished with value: 79.13333129882812 and parameters: {'Fwd': 4.795525575512539e-06, 'K': 10, 'alpha': 0.9, 'dropout': 0.9, 'gnnepoch': 70, 'lambda1': 0.9, 'lambda2': 8.158446927715051, 'loop': 1, 'loss': 'MSE', 'lr': 0.000769384037183383, 'softmaxF': True, 'useGCN': False, 'weight_decay': 4.578883045469642e-05, 'weightedloss': False}. Best is trial 483 with value: 83.73332977294922.
/home/wxy/miniconda3/lib/python3.10/site-packages/optuna/distributions.py:685: UserWarning: The distribution is specified by [0, 1.00001] and step=0.05, but the range is not divisible by `step`. It will be replaced by [0, 1.0].
  warnings.warn(
K:  10
alpha:  0.9500000000000001
lr:  0.0058887403922634396
weight_decay:  2.6696940244513745e-06
dropout:  0.9
fix split and run 3 times
Data: Data(x=[19717, 500], y=[19717], train_mask=[19717], val_mask=[19717], test_mask=[19717], adj_t=[19717, 19717, nnz=88648])
num_train tensor(60)
num_noise 0
noise: tensor(0)
data feature 500
ALTOPT(
  (lins): Sequential(
    (0): Linear(in_features=500, out_features=64, bias=True)
    (1): BatchNorm1d(64, eps=1e-05, momentum=0.1, affine=True, track_running_stats=True)
    (2): Dropout(p=0.9, inplace=True)
    (3): ReLU(inplace=True)
    (4): Linear(in_features=64, out_features=3, bias=True)
    (5): Identity()
  )
  (prop): Propagation(K=10, mode=None, lambda1=None, lambda2=None, L21=True, alpha=0.9500000000000001)
  (gcn): GCN(
    (convs): ModuleList(
      (0): GCNConv(500, 64)
      (1): GCNConv(64, 3)
    )
    (bns): ModuleList(
      (0): BatchNorm1d(64, eps=1e-05, momentum=0.1, affine=True, track_running_stats=True)
    )
    (output): Identity()
  )
)
propagate done
init label
Split: 01, Run: 01
None time:  3.7693105759099126
None Run 01:
Highest Train: 100.00
Highest Valid: 83.20
  Final Train: 100.00
   Final Test: 80.00
Split: 01, Run: 02
None time:  1.138501302106306
None Run 02:
Highest Train: 100.00
Highest Valid: 80.80
  Final Train: 100.00
   Final Test: 78.70
Split: 01, Run: 03
None time:  1.0151071138679981
None Run 03:
Highest Train: 100.00
Highest Valid: 82.40
  Final Train: 100.00
   Final Test: 79.30
run time now: 5.971924543380737
total time:  6.014435660094023
None All runs:
Highest Train: 100.00 ± 0.00
Highest Valid: 82.13 ± 1.22
  Final Train: 100.00 ± 0.00
   Final Test: 79.33 ± 0.65
[I 2023-06-12 00:58:44,554] Trial 491 finished with value: 82.13333129882812 and parameters: {'Fwd': 2.9394305197981473e-06, 'K': 10, 'alpha': 0.9500000000000001, 'dropout': 0.9, 'gnnepoch': 70, 'lambda1': 0.8500000000000001, 'lambda2': 8.44368887806288, 'loop': 1, 'loss': 'MSE', 'lr': 0.0058887403922634396, 'softmaxF': True, 'useGCN': False, 'weight_decay': 2.6696940244513745e-06, 'weightedloss': False}. Best is trial 483 with value: 83.73332977294922.
/home/wxy/miniconda3/lib/python3.10/site-packages/optuna/distributions.py:685: UserWarning: The distribution is specified by [0, 1.00001] and step=0.05, but the range is not divisible by `step`. It will be replaced by [0, 1.0].
  warnings.warn(
K:  10
alpha:  1.0
lr:  0.0004781258217440213
weight_decay:  6.251016088746664e-06
dropout:  0.8
fix split and run 3 times
Data: Data(x=[19717, 500], y=[19717], train_mask=[19717], val_mask=[19717], test_mask=[19717], adj_t=[19717, 19717, nnz=88648])
num_train tensor(60)
num_noise 0
noise: tensor(0)
data feature 500
ALTOPT(
  (lins): Sequential(
    (0): Linear(in_features=500, out_features=64, bias=True)
    (1): BatchNorm1d(64, eps=1e-05, momentum=0.1, affine=True, track_running_stats=True)
    (2): Dropout(p=0.8, inplace=True)
    (3): ReLU(inplace=True)
    (4): Linear(in_features=64, out_features=3, bias=True)
    (5): Identity()
  )
  (prop): Propagation(K=10, mode=None, lambda1=None, lambda2=None, L21=True, alpha=1.0)
  (gcn): GCN(
    (convs): ModuleList(
      (0): GCNConv(500, 64)
      (1): GCNConv(64, 3)
    )
    (bns): ModuleList(
      (0): BatchNorm1d(64, eps=1e-05, momentum=0.1, affine=True, track_running_stats=True)
    )
    (output): Identity()
  )
)
propagate done
init label
Split: 01, Run: 01
None time:  2.6221925790887326
None Run 01:
Highest Train: 100.00
Highest Valid: 82.80
  Final Train: 100.00
   Final Test: 77.50
Split: 01, Run: 02
None time:  2.1025338110048324
None Run 02:
Highest Train: 100.00
Highest Valid: 82.80
  Final Train: 100.00
   Final Test: 79.20
Split: 01, Run: 03
None time:  2.3664657729677856
None Run 03:
Highest Train: 100.00
Highest Valid: 81.40
  Final Train: 100.00
   Final Test: 78.90
run time now: 7.140653371810913
total time:  7.182561365189031
None All runs:
Highest Train: 100.00 ± 0.00
Highest Valid: 82.33 ± 0.81
  Final Train: 100.00 ± 0.00
   Final Test: 78.53 ± 0.91
[I 2023-06-12 00:58:52,222] Trial 492 finished with value: 82.33333587646484 and parameters: {'Fwd': 5.238158245529275e-06, 'K': 10, 'alpha': 1.0, 'dropout': 0.8, 'gnnepoch': 70, 'lambda1': 0.8, 'lambda2': 8.28613862830495, 'loop': 1, 'loss': 'MSE', 'lr': 0.0004781258217440213, 'softmaxF': False, 'useGCN': False, 'weight_decay': 6.251016088746664e-06, 'weightedloss': False}. Best is trial 483 with value: 83.73332977294922.
