[I 2023-06-12 00:49:52,353] Trial 395 finished with value: 82.33333587646484 and parameters: {'Fwd': 2.4947580693318392e-05, 'K': 10, 'alpha': 0.9500000000000001, 'dropout': 0.9, 'gnnepoch': 60, 'lambda1': 0.8500000000000001, 'lambda2': 6.220875243758748, 'loop': 1, 'loss': 'MSE', 'lr': 0.001752852722954858, 'softmaxF': True, 'useGCN': False, 'weight_decay': 0.06250360646033064, 'weightedloss': False}. Best is trial 364 with value: 83.66666412353516.
/home/wxy/miniconda3/lib/python3.10/site-packages/optuna/distributions.py:685: UserWarning: The distribution is specified by [0, 1.00001] and step=0.05, but the range is not divisible by `step`. It will be replaced by [0, 1.0].
  warnings.warn(
K:  10
alpha:  0.9
lr:  0.002346556158977727
weight_decay:  4.113503905442288e-05
dropout:  0.9
fix split and run 3 times
Data: Data(x=[19717, 500], y=[19717], train_mask=[19717], val_mask=[19717], test_mask=[19717], adj_t=[19717, 19717, nnz=88648])
num_train tensor(60)
num_noise 0
noise: tensor(0)
data feature 500
ALTOPT(
  (lins): Sequential(
    (0): Linear(in_features=500, out_features=64, bias=True)
    (1): BatchNorm1d(64, eps=1e-05, momentum=0.1, affine=True, track_running_stats=True)
    (2): Dropout(p=0.9, inplace=True)
    (3): ReLU(inplace=True)
    (4): Linear(in_features=64, out_features=3, bias=True)
    (5): Identity()
  )
  (prop): Propagation(K=10, mode=None, lambda1=None, lambda2=None, L21=True, alpha=0.9)
  (gcn): GCN(
    (convs): ModuleList(
      (0): GCNConv(500, 64)
      (1): GCNConv(64, 3)
    )
    (bns): ModuleList(
      (0): BatchNorm1d(64, eps=1e-05, momentum=0.1, affine=True, track_running_stats=True)
    )
    (output): Identity()
  )
)
propagate done
init label
Split: 01, Run: 01
None time:  2.037159665953368
None Run 01:
Highest Train: 100.00
Highest Valid: 79.80
  Final Train: 100.00
   Final Test: 76.30
Split: 01, Run: 02
None time:  1.156711048912257
None Run 02:
Highest Train: 100.00
Highest Valid: 84.00
  Final Train: 100.00
   Final Test: 79.10
Split: 01, Run: 03
None time:  1.6003880540374666
None Run 03:
Highest Train: 100.00
Highest Valid: 84.40
  Final Train: 100.00
   Final Test: 78.90
run time now: 4.840641498565674
total time:  4.8920617969706655
None All runs:
Highest Train: 100.00 ± 0.00
Highest Valid: 82.73 ± 2.55
  Final Train: 100.00 ± 0.00
   Final Test: 78.10 ± 1.56
[I 2023-06-12 00:49:57,832] Trial 396 finished with value: 82.73332977294922 and parameters: {'Fwd': 0.0006876277652708103, 'K': 10, 'alpha': 0.9, 'dropout': 0.9, 'gnnepoch': 70, 'lambda1': 0.65, 'lambda2': 5.329306578263229, 'loop': 1, 'loss': 'MSE', 'lr': 0.002346556158977727, 'softmaxF': True, 'useGCN': False, 'weight_decay': 4.113503905442288e-05, 'weightedloss': False}. Best is trial 364 with value: 83.66666412353516.
/home/wxy/miniconda3/lib/python3.10/site-packages/optuna/distributions.py:685: UserWarning: The distribution is specified by [0, 1.00001] and step=0.05, but the range is not divisible by `step`. It will be replaced by [0, 1.0].
  warnings.warn(
K:  10
alpha:  0.9500000000000001
lr:  0.002767223801479066
weight_decay:  0.0003118658290270658
dropout:  0.9
fix split and run 3 times
Data: Data(x=[19717, 500], y=[19717], train_mask=[19717], val_mask=[19717], test_mask=[19717], adj_t=[19717, 19717, nnz=88648])
num_train tensor(60)
num_noise 0
noise: tensor(0)
data feature 500
ALTOPT(
  (lins): Sequential(
    (0): Linear(in_features=500, out_features=64, bias=True)
    (1): BatchNorm1d(64, eps=1e-05, momentum=0.1, affine=True, track_running_stats=True)
    (2): Dropout(p=0.9, inplace=True)
    (3): ReLU(inplace=True)
    (4): Linear(in_features=64, out_features=3, bias=True)
    (5): Identity()
  )
  (prop): Propagation(K=10, mode=None, lambda1=None, lambda2=None, L21=True, alpha=0.9500000000000001)
  (gcn): GCN(
    (convs): ModuleList(
      (0): GCNConv(500, 64)
      (1): GCNConv(64, 3)
    )
    (bns): ModuleList(
      (0): BatchNorm1d(64, eps=1e-05, momentum=0.1, affine=True, track_running_stats=True)
    )
    (output): Identity()
  )
)
propagate done
init label
Split: 01, Run: 01
None time:  0.5431921128183603
None Run 01:
Highest Train: 100.00
Highest Valid: 73.40
  Final Train: 100.00
   Final Test: 72.00
Split: 01, Run: 02
None time:  0.5643646740354598
None Run 02:
Highest Train: 100.00
Highest Valid: 73.40
  Final Train: 100.00
   Final Test: 72.00
Split: 01, Run: 03
None time:  0.5744163519702852
None Run 03:
Highest Train: 100.00
Highest Valid: 73.40
  Final Train: 100.00
   Final Test: 72.00
run time now: 1.733949899673462
total time:  1.7845359910279512
None All runs:
Highest Train: 100.00 ± 0.00
Highest Valid: 73.40 ± 0.00
  Final Train: 100.00 ± 0.00
   Final Test: 72.00 ± 0.00
[I 2023-06-12 00:50:00,212] Trial 397 finished with value: 73.4000015258789 and parameters: {'Fwd': 3.381790237679682e-06, 'K': 10, 'alpha': 0.9500000000000001, 'dropout': 0.9, 'gnnepoch': 20, 'lambda1': 0.0, 'lambda2': 9.552107731457465, 'loop': 0, 'loss': 'MSE', 'lr': 0.002767223801479066, 'softmaxF': True, 'useGCN': False, 'weight_decay': 0.0003118658290270658, 'weightedloss': False}. Best is trial 364 with value: 83.66666412353516.
/home/wxy/miniconda3/lib/python3.10/site-packages/optuna/distributions.py:685: UserWarning: The distribution is specified by [0, 1.00001] and step=0.05, but the range is not divisible by `step`. It will be replaced by [0, 1.0].
  warnings.warn(
K:  9
alpha:  1.0
lr:  0.0024637264704743616
weight_decay:  0.03250221227170042
dropout:  0.8
fix split and run 3 times
Data: Data(x=[19717, 500], y=[19717], train_mask=[19717], val_mask=[19717], test_mask=[19717], adj_t=[19717, 19717, nnz=88648])
num_train tensor(60)
num_noise 0
noise: tensor(0)
data feature 500
ALTOPT(
  (lins): Sequential(
    (0): Linear(in_features=500, out_features=64, bias=True)
    (1): BatchNorm1d(64, eps=1e-05, momentum=0.1, affine=True, track_running_stats=True)
    (2): Dropout(p=0.8, inplace=True)
    (3): ReLU(inplace=True)
    (4): Linear(in_features=64, out_features=3, bias=True)
    (5): Identity()
  )
  (prop): Propagation(K=9, mode=None, lambda1=None, lambda2=None, L21=True, alpha=1.0)
  (gcn): GCN(
    (convs): ModuleList(
      (0): GCNConv(500, 64)
      (1): GCNConv(64, 3)
    )
    (bns): ModuleList(
      (0): BatchNorm1d(64, eps=1e-05, momentum=0.1, affine=True, track_running_stats=True)
    )
    (output): Identity()
  )
)
propagate done
init label
Split: 01, Run: 01
None time:  2.3160275779664516
None Run 01:
Highest Train: 100.00
Highest Valid: 82.40
  Final Train: 100.00
   Final Test: 79.10
Split: 01, Run: 02
None time:  0.6306359439622611
None Run 02:
Highest Train: 100.00
Highest Valid: 80.40
  Final Train: 100.00
   Final Test: 76.70
Split: 01, Run: 03
None time:  1.70968081895262
None Run 03:
Highest Train: 100.00
Highest Valid: 80.40
  Final Train: 100.00
   Final Test: 78.00
run time now: 4.740503787994385
total time:  4.800811255117878
None All runs:
Highest Train: 100.00 ± 0.00
Highest Valid: 81.07 ± 1.15
  Final Train: 100.00 ± 0.00
   Final Test: 77.93 ± 1.20
[I 2023-06-12 00:50:05,533] Trial 398 finished with value: 81.0666732788086 and parameters: {'Fwd': 0.001881972932510414, 'K': 9, 'alpha': 1.0, 'dropout': 0.8, 'gnnepoch': 50, 'lambda1': 0.8, 'lambda2': 6.661739785947502, 'loop': 1, 'loss': 'MSE', 'lr': 0.0024637264704743616, 'softmaxF': True, 'useGCN': False, 'weight_decay': 0.03250221227170042, 'weightedloss': False}. Best is trial 364 with value: 83.66666412353516.
/home/wxy/miniconda3/lib/python3.10/site-packages/optuna/distributions.py:685: UserWarning: The distribution is specified by [0, 1.00001] and step=0.05, but the range is not divisible by `step`. It will be replaced by [0, 1.0].
  warnings.warn(
K:  10
alpha:  0.9500000000000001
lr:  0.003041735438613791
weight_decay:  0.0029428821649437925
dropout:  0.9
fix split and run 3 times
Data: Data(x=[19717, 500], y=[19717], train_mask=[19717], val_mask=[19717], test_mask=[19717], adj_t=[19717, 19717, nnz=88648])
num_train tensor(60)
num_noise 0
noise: tensor(0)
data feature 500
ALTOPT(
  (lins): Sequential(
    (0): Linear(in_features=500, out_features=64, bias=True)
    (1): BatchNorm1d(64, eps=1e-05, momentum=0.1, affine=True, track_running_stats=True)
    (2): Dropout(p=0.9, inplace=True)
    (3): ReLU(inplace=True)
    (4): Linear(in_features=64, out_features=3, bias=True)
    (5): Identity()
  )
  (prop): Propagation(K=10, mode=None, lambda1=None, lambda2=None, L21=True, alpha=0.9500000000000001)
  (gcn): GCN(
    (convs): ModuleList(
      (0): GCNConv(500, 64)
      (1): GCNConv(64, 3)
    )
    (bns): ModuleList(
      (0): BatchNorm1d(64, eps=1e-05, momentum=0.1, affine=True, track_running_stats=True)
    )
    (output): Identity()
  )
)
propagate done
init label
Split: 01, Run: 01
None time:  2.4837016810197383
None Run 01:
Highest Train: 100.00
Highest Valid: 81.00
  Final Train: 100.00
   Final Test: 77.50
Split: 01, Run: 02
None time:  1.0312312659807503
None Run 02:
Highest Train: 100.00
Highest Valid: 81.00
  Final Train: 100.00
   Final Test: 79.50
Split: 01, Run: 03
None time:  1.9566073899623007
None Run 03:
Highest Train: 100.00
Highest Valid: 83.40
  Final Train: 100.00
   Final Test: 80.20
run time now: 5.519919395446777
total time:  5.56755399890244
None All runs:
Highest Train: 100.00 ± 0.00
Highest Valid: 81.80 ± 1.39
  Final Train: 100.00 ± 0.00
   Final Test: 79.07 ± 1.40
[I 2023-06-12 00:50:11,601] Trial 399 finished with value: 81.79999542236328 and parameters: {'Fwd': 1.2062549359177199e-05, 'K': 10, 'alpha': 0.9500000000000001, 'dropout': 0.9, 'gnnepoch': 60, 'lambda1': 0.6000000000000001, 'lambda2': 2.563736054073754, 'loop': 1, 'loss': 'MSE', 'lr': 0.003041735438613791, 'softmaxF': True, 'useGCN': False, 'weight_decay': 0.0029428821649437925, 'weightedloss': False}. Best is trial 364 with value: 83.66666412353516.
/home/wxy/miniconda3/lib/python3.10/site-packages/optuna/distributions.py:685: UserWarning: The distribution is specified by [0, 1.00001] and step=0.05, but the range is not divisible by `step`. It will be replaced by [0, 1.0].
  warnings.warn(
K:  10
alpha:  1.0
lr:  0.00197911952884231
weight_decay:  0.008471642061482192
dropout:  0.9
fix split and run 3 times
Data: Data(x=[19717, 500], y=[19717], train_mask=[19717], val_mask=[19717], test_mask=[19717], adj_t=[19717, 19717, nnz=88648])
num_train tensor(60)
num_noise 0
noise: tensor(0)
data feature 500
ALTOPT(
  (lins): Sequential(
    (0): Linear(in_features=500, out_features=64, bias=True)
    (1): BatchNorm1d(64, eps=1e-05, momentum=0.1, affine=True, track_running_stats=True)
    (2): Dropout(p=0.9, inplace=True)
    (3): ReLU(inplace=True)
    (4): Linear(in_features=64, out_features=3, bias=True)
    (5): Identity()
  )
  (prop): Propagation(K=10, mode=None, lambda1=None, lambda2=None, L21=True, alpha=1.0)
  (gcn): GCN(
    (convs): ModuleList(
      (0): GCNConv(500, 64)
      (1): GCNConv(64, 3)
    )
    (bns): ModuleList(
      (0): BatchNorm1d(64, eps=1e-05, momentum=0.1, affine=True, track_running_stats=True)
    )
    (output): Identity()
  )
)
propagate done
init label
Split: 01, Run: 01, Epoch: 100, Loss: 0.5560, Train: 100.00%, Valid: 82.40% Test: 79.10%
Split: 01, Run: 01
None time:  3.905991839012131
None Run 01:
Highest Train: 100.00
Highest Valid: 82.80
  Final Train: 100.00
   Final Test: 78.80
Split: 01, Run: 02
None time:  1.5535901440307498
None Run 02:
Highest Train: 100.00
Highest Valid: 82.80
  Final Train: 100.00
   Final Test: 78.70
Split: 01, Run: 03
None time:  2.076766151934862
None Run 03:
Highest Train: 100.00
Highest Valid: 81.60
  Final Train: 100.00
   Final Test: 79.20
run time now: 7.646790266036987
total time:  7.694773635827005
None All runs:
Highest Train: 100.00 ± 0.00
Highest Valid: 82.40 ± 0.69
  Final Train: 100.00 ± 0.00
   Final Test: 78.90 ± 0.26
[I 2023-06-12 00:50:19,812] Trial 400 finished with value: 82.4000015258789 and parameters: {'Fwd': 5.517965471658553e-06, 'K': 10, 'alpha': 1.0, 'dropout': 0.9, 'gnnepoch': 60, 'lambda1': 0.7000000000000001, 'lambda2': 3.5175466974578278, 'loop': 1, 'loss': 'MSE', 'lr': 0.00197911952884231, 'softmaxF': True, 'useGCN': False, 'weight_decay': 0.008471642061482192, 'weightedloss': True}. Best is trial 364 with value: 83.66666412353516.
/home/wxy/miniconda3/lib/python3.10/site-packages/optuna/distributions.py:685: UserWarning: The distribution is specified by [0, 1.00001] and step=0.05, but the range is not divisible by `step`. It will be replaced by [0, 1.0].
  warnings.warn(
K:  10
alpha:  0.9
lr:  0.0026001131492777666
weight_decay:  0.005114493760131206
dropout:  0.9
fix split and run 3 times
Data: Data(x=[19717, 500], y=[19717], train_mask=[19717], val_mask=[19717], test_mask=[19717], adj_t=[19717, 19717, nnz=88648])
num_train tensor(60)
num_noise 0
noise: tensor(0)
data feature 500
ALTOPT(
  (lins): Sequential(
    (0): Linear(in_features=500, out_features=64, bias=True)
    (1): BatchNorm1d(64, eps=1e-05, momentum=0.1, affine=True, track_running_stats=True)
    (2): Dropout(p=0.9, inplace=True)
    (3): ReLU(inplace=True)
    (4): Linear(in_features=64, out_features=3, bias=True)
    (5): Identity()
  )
  (prop): Propagation(K=10, mode=None, lambda1=None, lambda2=None, L21=True, alpha=0.9)
  (gcn): GCN(
    (convs): ModuleList(
      (0): GCNConv(500, 64)
      (1): GCNConv(64, 3)
    )
    (bns): ModuleList(
      (0): BatchNorm1d(64, eps=1e-05, momentum=0.1, affine=True, track_running_stats=True)
    )
    (output): Identity()
  )
)
propagate done
init label
Split: 01, Run: 01
None time:  2.193597662029788
None Run 01:
Highest Train: 100.00
Highest Valid: 82.20
  Final Train: 100.00
   Final Test: 77.30
Split: 01, Run: 02
None time:  1.2281454210169613
None Run 02:
Highest Train: 100.00
Highest Valid: 84.00
  Final Train: 100.00
   Final Test: 79.40
Split: 01, Run: 03
None time:  1.2128588429186493
None Run 03:
Highest Train: 100.00
Highest Valid: 82.00
  Final Train: 100.00
   Final Test: 78.10
run time now: 4.704201698303223
total time:  4.758985253050923
None All runs:
Highest Train: 100.00 ± 0.00
Highest Valid: 82.73 ± 1.10
  Final Train: 100.00 ± 0.00
   Final Test: 78.27 ± 1.06
[I 2023-06-12 00:50:25,214] Trial 401 finished with value: 82.73333740234375 and parameters: {'Fwd': 6.0284858342958525e-05, 'K': 10, 'alpha': 0.9, 'dropout': 0.9, 'gnnepoch': 80, 'lambda1': 0.8500000000000001, 'lambda2': 5.555151681773287, 'loop': 1, 'loss': 'MSE', 'lr': 0.0026001131492777666, 'softmaxF': True, 'useGCN': False, 'weight_decay': 0.005114493760131206, 'weightedloss': False}. Best is trial 364 with value: 83.66666412353516.
/home/wxy/miniconda3/lib/python3.10/site-packages/optuna/distributions.py:685: UserWarning: The distribution is specified by [0, 1.00001] and step=0.05, but the range is not divisible by `step`. It will be replaced by [0, 1.0].
  warnings.warn(
K:  10
alpha:  0.9500000000000001
lr:  0.002220667718972499
weight_decay:  0.002494076647877236
dropout:  0.9
fix split and run 3 times
Data: Data(x=[19717, 500], y=[19717], train_mask=[19717], val_mask=[19717], test_mask=[19717], adj_t=[19717, 19717, nnz=88648])
num_train tensor(60)
num_noise 0
noise: tensor(0)
data feature 500
ALTOPT(
  (lins): Sequential(
    (0): Linear(in_features=500, out_features=64, bias=True)
    (1): BatchNorm1d(64, eps=1e-05, momentum=0.1, affine=True, track_running_stats=True)
    (2): Dropout(p=0.9, inplace=True)
    (3): ReLU(inplace=True)
    (4): Linear(in_features=64, out_features=3, bias=True)
    (5): LogSoftmax(dim=-1)
  )
  (prop): Propagation(K=10, mode=None, lambda1=None, lambda2=None, L21=True, alpha=0.9500000000000001)
  (gcn): GCN(
    (convs): ModuleList(
      (0): GCNConv(500, 64)
      (1): GCNConv(64, 3)
    )
    (bns): ModuleList(
      (0): BatchNorm1d(64, eps=1e-05, momentum=0.1, affine=True, track_running_stats=True)
    )
    (output): LogSoftmax(dim=-1)
  )
)
propagate done
init label
Split: 01, Run: 01
None time:  1.208069026004523
None Run 01:
Highest Train: 100.00
Highest Valid: 79.20
  Final Train: 100.00
   Final Test: 76.70
Split: 01, Run: 02
None time:  0.8907773471437395
None Run 02:
Highest Train: 100.00
Highest Valid: 80.20
  Final Train: 98.33
   Final Test: 78.20
Split: 01, Run: 03
None time:  1.0645511541515589
None Run 03:
Highest Train: 100.00
Highest Valid: 79.80
  Final Train: 100.00
   Final Test: 77.50
run time now: 3.2128217220306396
total time:  3.252994173904881
None All runs:
Highest Train: 100.00 ± 0.00
Highest Valid: 79.73 ± 0.50
  Final Train: 99.44 ± 0.96
   Final Test: 77.47 ± 0.75
[I 2023-06-12 00:50:29,046] Trial 402 finished with value: 79.73332977294922 and parameters: {'Fwd': 0.008640255409370313, 'K': 10, 'alpha': 0.9500000000000001, 'dropout': 0.9, 'gnnepoch': 60, 'lambda1': 0.55, 'lambda2': 4.928344186436653, 'loop': 1, 'loss': 'CE', 'lr': 0.002220667718972499, 'softmaxF': True, 'useGCN': False, 'weight_decay': 0.002494076647877236, 'weightedloss': False}. Best is trial 364 with value: 83.66666412353516.
/home/wxy/miniconda3/lib/python3.10/site-packages/optuna/distributions.py:685: UserWarning: The distribution is specified by [0, 1.00001] and step=0.05, but the range is not divisible by `step`. It will be replaced by [0, 1.0].
  warnings.warn(
K:  10
alpha:  0.9500000000000001
lr:  0.008739574921656473
weight_decay:  0.00013954870093105682
dropout:  0.9
fix split and run 3 times
Data: Data(x=[19717, 500], y=[19717], train_mask=[19717], val_mask=[19717], test_mask=[19717], adj_t=[19717, 19717, nnz=88648])
num_train tensor(60)
num_noise 0
noise: tensor(0)
data feature 500
ALTOPT(
  (lins): Sequential(
    (0): Linear(in_features=500, out_features=64, bias=True)
    (1): BatchNorm1d(64, eps=1e-05, momentum=0.1, affine=True, track_running_stats=True)
    (2): Dropout(p=0.9, inplace=True)
    (3): ReLU(inplace=True)
    (4): Linear(in_features=64, out_features=3, bias=True)
    (5): Identity()
  )
  (prop): Propagation(K=10, mode=None, lambda1=None, lambda2=None, L21=True, alpha=0.9500000000000001)
  (gcn): GCN(
    (convs): ModuleList(
      (0): GCNConv(500, 64)
      (1): GCNConv(64, 3)
    )
    (bns): ModuleList(
      (0): BatchNorm1d(64, eps=1e-05, momentum=0.1, affine=True, track_running_stats=True)
    )
    (output): Identity()
  )
)
propagate done
init label
Split: 01, Run: 01
None time:  2.0152404292020947
None Run 01:
Highest Train: 100.00
Highest Valid: 80.60
  Final Train: 100.00
   Final Test: 76.70
Split: 01, Run: 02
None time:  1.3699858461041003
None Run 02:
Highest Train: 100.00
Highest Valid: 80.20
  Final Train: 100.00
   Final Test: 78.20
Split: 01, Run: 03
None time:  1.110947353998199
None Run 03:
Highest Train: 100.00
Highest Valid: 82.40
  Final Train: 100.00
   Final Test: 79.40
run time now: 4.540182828903198
total time:  4.593118403106928
None All runs:
Highest Train: 100.00 ± 0.00
Highest Valid: 81.07 ± 1.17
  Final Train: 100.00 ± 0.00
   Final Test: 78.10 ± 1.35
[I 2023-06-12 00:50:34,173] Trial 403 finished with value: 81.06665802001953 and parameters: {'Fwd': 0.04742679692828313, 'K': 10, 'alpha': 0.9500000000000001, 'dropout': 0.9, 'gnnepoch': 70, 'lambda1': 0.9, 'lambda2': 9.211163373098987, 'loop': 1, 'loss': 'MSE', 'lr': 0.008739574921656473, 'softmaxF': True, 'useGCN': False, 'weight_decay': 0.00013954870093105682, 'weightedloss': False}. Best is trial 364 with value: 83.66666412353516.
/home/wxy/miniconda3/lib/python3.10/site-packages/optuna/distributions.py:685: UserWarning: The distribution is specified by [0, 1.00001] and step=0.05, but the range is not divisible by `step`. It will be replaced by [0, 1.0].
  warnings.warn(
K:  10
alpha:  0.9500000000000001
lr:  0.0028140311690349274
weight_decay:  0.0005668548461733435
dropout:  0.9
fix split and run 3 times
Data: Data(x=[19717, 500], y=[19717], train_mask=[19717], val_mask=[19717], test_mask=[19717], adj_t=[19717, 19717, nnz=88648])
num_train tensor(60)
num_noise 0
noise: tensor(0)
data feature 500
ALTOPT(
  (lins): Sequential(
    (0): Linear(in_features=500, out_features=64, bias=True)
    (1): BatchNorm1d(64, eps=1e-05, momentum=0.1, affine=True, track_running_stats=True)
    (2): Dropout(p=0.9, inplace=True)
    (3): ReLU(inplace=True)
    (4): Linear(in_features=64, out_features=3, bias=True)
    (5): Identity()
  )
  (prop): Propagation(K=10, mode=None, lambda1=None, lambda2=None, L21=True, alpha=0.9500000000000001)
  (gcn): GCN(
    (convs): ModuleList(
      (0): GCNConv(500, 64)
      (1): GCNConv(64, 3)
    )
    (bns): ModuleList(
      (0): BatchNorm1d(64, eps=1e-05, momentum=0.1, affine=True, track_running_stats=True)
    )
    (output): Identity()
  )
)
propagate done
init label
Split: 01, Run: 01
None time:  2.8269084200728685
None Run 01:
Highest Train: 100.00
Highest Valid: 81.80
  Final Train: 100.00
   Final Test: 77.40
Split: 01, Run: 02
None time:  0.9529412700794637
None Run 02:
Highest Train: 100.00
Highest Valid: 80.60
  Final Train: 100.00
   Final Test: 78.80
Split: 01, Run: 03
None time:  1.2267365171574056
None Run 03:
Highest Train: 100.00
Highest Valid: 83.80
  Final Train: 100.00
   Final Test: 79.50
run time now: 5.056004762649536
total time:  5.108742453856394
None All runs:
Highest Train: 100.00 ± 0.00
Highest Valid: 82.07 ± 1.62
  Final Train: 100.00 ± 0.00
   Final Test: 78.57 ± 1.07
