[I 2023-06-12 00:22:38,092] Trial 116 finished with value: 82.53333282470703 and parameters: {'Fwd': 1.0059865515147148e-06, 'K': 10, 'alpha': 0.9500000000000001, 'dropout': 0.7000000000000001, 'gnnepoch': 70, 'lambda1': 0.5, 'lambda2': 6.908521635119531, 'loop': 1, 'loss': 'MSE', 'lr': 0.0020667608816246, 'softmaxF': True, 'useGCN': False, 'weight_decay': 0.0022216705238668026, 'weightedloss': False}. Best is trial 107 with value: 82.73332977294922.
/home/wxy/miniconda3/lib/python3.10/site-packages/optuna/distributions.py:685: UserWarning: The distribution is specified by [0, 1.00001] and step=0.05, but the range is not divisible by `step`. It will be replaced by [0, 1.0].
  warnings.warn(
K:  10
alpha:  0.9500000000000001
lr:  0.0028185962082591318
weight_decay:  0.0032746280823824007
dropout:  0.7000000000000001
fix split and run 3 times
Data: Data(x=[19717, 500], y=[19717], train_mask=[19717], val_mask=[19717], test_mask=[19717], adj_t=[19717, 19717, nnz=88648])
num_train tensor(60)
num_noise 0
noise: tensor(0)
data feature 500
ALTOPT(
  (lins): Sequential(
    (0): Linear(in_features=500, out_features=64, bias=True)
    (1): BatchNorm1d(64, eps=1e-05, momentum=0.1, affine=True, track_running_stats=True)
    (2): Dropout(p=0.7000000000000001, inplace=True)
    (3): ReLU(inplace=True)
    (4): Linear(in_features=64, out_features=3, bias=True)
    (5): Identity()
  )
  (prop): Propagation(K=10, mode=None, lambda1=None, lambda2=None, L21=True, alpha=0.9500000000000001)
  (gcn): GCN(
    (convs): ModuleList(
      (0): GCNConv(500, 64)
      (1): GCNConv(64, 3)
    )
    (bns): ModuleList(
      (0): BatchNorm1d(64, eps=1e-05, momentum=0.1, affine=True, track_running_stats=True)
    )
    (output): Identity()
  )
)
propagate done
init label
Split: 01, Run: 01
None time:  2.7387505560182035
None Run 01:
Highest Train: 100.00
Highest Valid: 82.40
  Final Train: 100.00
   Final Test: 78.90
Split: 01, Run: 02
None time:  1.2961361138150096
None Run 02:
Highest Train: 100.00
Highest Valid: 81.60
  Final Train: 100.00
   Final Test: 78.30
Split: 01, Run: 03
None time:  1.2445055819116533
None Run 03:
Highest Train: 100.00
Highest Valid: 78.80
  Final Train: 100.00
   Final Test: 77.10
run time now: 5.328221321105957
total time:  5.3973183198831975
None All runs:
Highest Train: 100.00 ± 0.00
Highest Valid: 80.93 ± 1.89
  Final Train: 100.00 ± 0.00
   Final Test: 78.10 ± 0.92
[I 2023-06-12 00:22:44,061] Trial 117 finished with value: 80.9333267211914 and parameters: {'Fwd': 1.5440668504721868e-06, 'K': 10, 'alpha': 0.9500000000000001, 'dropout': 0.7000000000000001, 'gnnepoch': 70, 'lambda1': 0.7000000000000001, 'lambda2': 6.160211891739253, 'loop': 1, 'loss': 'MSE', 'lr': 0.0028185962082591318, 'softmaxF': True, 'useGCN': False, 'weight_decay': 0.0032746280823824007, 'weightedloss': False}. Best is trial 107 with value: 82.73332977294922.
/home/wxy/miniconda3/lib/python3.10/site-packages/optuna/distributions.py:685: UserWarning: The distribution is specified by [0, 1.00001] and step=0.05, but the range is not divisible by `step`. It will be replaced by [0, 1.0].
  warnings.warn(
K:  10
alpha:  1.0
lr:  0.002170898773116169
weight_decay:  0.002378920058138639
dropout:  0.8
fix split and run 3 times
Data: Data(x=[19717, 500], y=[19717], train_mask=[19717], val_mask=[19717], test_mask=[19717], adj_t=[19717, 19717, nnz=88648])
num_train tensor(60)
num_noise 0
noise: tensor(0)
data feature 500
ALTOPT(
  (lins): Sequential(
    (0): Linear(in_features=500, out_features=64, bias=True)
    (1): BatchNorm1d(64, eps=1e-05, momentum=0.1, affine=True, track_running_stats=True)
    (2): Dropout(p=0.8, inplace=True)
    (3): ReLU(inplace=True)
    (4): Linear(in_features=64, out_features=3, bias=True)
    (5): LogSoftmax(dim=-1)
  )
  (prop): Propagation(K=10, mode=None, lambda1=None, lambda2=None, L21=True, alpha=1.0)
  (gcn): GCN(
    (convs): ModuleList(
      (0): GCNConv(500, 64)
      (1): GCNConv(64, 3)
    )
    (bns): ModuleList(
      (0): BatchNorm1d(64, eps=1e-05, momentum=0.1, affine=True, track_running_stats=True)
    )
    (output): LogSoftmax(dim=-1)
  )
)
propagate done
init label
Split: 01, Run: 01
None time:  1.0932064410299063
None Run 01:
Highest Train: 100.00
Highest Valid: 71.40
  Final Train: 100.00
   Final Test: 71.00
Split: 01, Run: 02
None time:  0.7392606299836189
None Run 02:
Highest Train: 100.00
Highest Valid: 80.00
  Final Train: 98.33
   Final Test: 78.90
Split: 01, Run: 03
None time:  1.0302761469502002
None Run 03:
Highest Train: 100.00
Highest Valid: 78.40
  Final Train: 98.33
   Final Test: 78.30
run time now: 2.9151322841644287
total time:  2.9577569160610437
None All runs:
Highest Train: 100.00 ± 0.00
Highest Valid: 76.60 ± 4.57
  Final Train: 98.89 ± 0.96
   Final Test: 76.07 ± 4.40
[I 2023-06-12 00:22:47,475] Trial 118 finished with value: 76.5999984741211 and parameters: {'Fwd': 3.1350279875700744e-06, 'K': 10, 'alpha': 1.0, 'dropout': 0.8, 'gnnepoch': 70, 'lambda1': 0.5, 'lambda2': 6.377870527684402, 'loop': 1, 'loss': 'CE', 'lr': 0.002170898773116169, 'softmaxF': True, 'useGCN': False, 'weight_decay': 0.002378920058138639, 'weightedloss': False}. Best is trial 107 with value: 82.73332977294922.
/home/wxy/miniconda3/lib/python3.10/site-packages/optuna/distributions.py:685: UserWarning: The distribution is specified by [0, 1.00001] and step=0.05, but the range is not divisible by `step`. It will be replaced by [0, 1.0].
  warnings.warn(
K:  9
alpha:  0.9
lr:  0.0019908276288231655
weight_decay:  0.002048650520309738
dropout:  0.8
fix split and run 3 times
Data: Data(x=[19717, 500], y=[19717], train_mask=[19717], val_mask=[19717], test_mask=[19717], adj_t=[19717, 19717, nnz=88648])
num_train tensor(60)
num_noise 0
noise: tensor(0)
data feature 500
ALTOPT(
  (lins): Sequential(
    (0): Linear(in_features=500, out_features=64, bias=True)
    (1): BatchNorm1d(64, eps=1e-05, momentum=0.1, affine=True, track_running_stats=True)
    (2): Dropout(p=0.8, inplace=True)
    (3): ReLU(inplace=True)
    (4): Linear(in_features=64, out_features=3, bias=True)
    (5): Identity()
  )
  (prop): Propagation(K=9, mode=None, lambda1=None, lambda2=None, L21=True, alpha=0.9)
  (gcn): GCN(
    (convs): ModuleList(
      (0): GCNConv(500, 64)
      (1): GCNConv(64, 3)
    )
    (bns): ModuleList(
      (0): BatchNorm1d(64, eps=1e-05, momentum=0.1, affine=True, track_running_stats=True)
    )
    (output): Identity()
  )
)
propagate done
init label
Split: 01, Run: 01, Epoch: 100, Loss: 0.3232, Train: 100.00%, Valid: 81.60% Test: 77.70%
Split: 01, Run: 01
None time:  3.437814672011882
None Run 01:
Highest Train: 100.00
Highest Valid: 81.60
  Final Train: 100.00
   Final Test: 77.40
Split: 01, Run: 02
None time:  1.0698553510010242
None Run 02:
Highest Train: 100.00
Highest Valid: 82.20
  Final Train: 100.00
   Final Test: 79.00
Split: 01, Run: 03
None time:  1.0253734779544175
None Run 03:
Highest Train: 100.00
Highest Valid: 81.20
  Final Train: 100.00
   Final Test: 77.40
run time now: 5.581016302108765
total time:  5.629540877882391
None All runs:
Highest Train: 100.00 ± 0.00
Highest Valid: 81.67 ± 0.50
  Final Train: 100.00 ± 0.00
   Final Test: 77.93 ± 0.92
[I 2023-06-12 00:22:53,533] Trial 119 finished with value: 81.66666412353516 and parameters: {'Fwd': 1.2459316554124474e-06, 'K': 9, 'alpha': 0.9, 'dropout': 0.8, 'gnnepoch': 60, 'lambda1': 0.65, 'lambda2': 6.87228693666908, 'loop': 1, 'loss': 'MSE', 'lr': 0.0019908276288231655, 'softmaxF': True, 'useGCN': False, 'weight_decay': 0.002048650520309738, 'weightedloss': False}. Best is trial 107 with value: 82.73332977294922.
/home/wxy/miniconda3/lib/python3.10/site-packages/optuna/distributions.py:685: UserWarning: The distribution is specified by [0, 1.00001] and step=0.05, but the range is not divisible by `step`. It will be replaced by [0, 1.0].
  warnings.warn(
K:  9
alpha:  0.9500000000000001
lr:  0.0029367012841352677
weight_decay:  0.0013643981613651937
dropout:  0.9
fix split and run 3 times
Data: Data(x=[19717, 500], y=[19717], train_mask=[19717], val_mask=[19717], test_mask=[19717], adj_t=[19717, 19717, nnz=88648])
num_train tensor(60)
num_noise 0
noise: tensor(0)
data feature 500
ALTOPT(
  (lins): Sequential(
    (0): Linear(in_features=500, out_features=64, bias=True)
    (1): BatchNorm1d(64, eps=1e-05, momentum=0.1, affine=True, track_running_stats=True)
    (2): Dropout(p=0.9, inplace=True)
    (3): ReLU(inplace=True)
    (4): Linear(in_features=64, out_features=3, bias=True)
    (5): Identity()
  )
  (prop): Propagation(K=9, mode=None, lambda1=None, lambda2=None, L21=True, alpha=0.9500000000000001)
  (gcn): GCN(
    (convs): ModuleList(
      (0): GCNConv(500, 64)
      (1): GCNConv(64, 3)
    )
    (bns): ModuleList(
      (0): BatchNorm1d(64, eps=1e-05, momentum=0.1, affine=True, track_running_stats=True)
    )
    (output): Identity()
  )
)
propagate done
init label
Split: 01, Run: 01
None time:  2.332201319048181
None Run 01:
Highest Train: 100.00
Highest Valid: 81.80
  Final Train: 100.00
   Final Test: 77.60
Split: 01, Run: 02
None time:  2.6849636579863727
None Run 02:
Highest Train: 100.00
Highest Valid: 82.60
  Final Train: 100.00
   Final Test: 79.40
Split: 01, Run: 03
None time:  1.065082130022347
None Run 03:
Highest Train: 100.00
Highest Valid: 82.80
  Final Train: 100.00
   Final Test: 79.90
run time now: 6.126163721084595
total time:  6.165483241900802
None All runs:
Highest Train: 100.00 ± 0.00
Highest Valid: 82.40 ± 0.53
  Final Train: 100.00 ± 0.00
   Final Test: 78.97 ± 1.21
[I 2023-06-12 00:23:00,299] Trial 120 finished with value: 82.4000015258789 and parameters: {'Fwd': 2.1056585189513807e-06, 'K': 9, 'alpha': 0.9500000000000001, 'dropout': 0.9, 'gnnepoch': 60, 'lambda1': 0.55, 'lambda2': 6.036781417382259, 'loop': 1, 'loss': 'MSE', 'lr': 0.0029367012841352677, 'softmaxF': True, 'useGCN': False, 'weight_decay': 0.0013643981613651937, 'weightedloss': False}. Best is trial 107 with value: 82.73332977294922.
/home/wxy/miniconda3/lib/python3.10/site-packages/optuna/distributions.py:685: UserWarning: The distribution is specified by [0, 1.00001] and step=0.05, but the range is not divisible by `step`. It will be replaced by [0, 1.0].
  warnings.warn(
K:  9
alpha:  0.1
lr:  0.003029512754522188
weight_decay:  0.001282596509811279
dropout:  0.9
fix split and run 3 times
Data: Data(x=[19717, 500], y=[19717], train_mask=[19717], val_mask=[19717], test_mask=[19717], adj_t=[19717, 19717, nnz=88648])
num_train tensor(60)
num_noise 0
noise: tensor(0)
data feature 500
ALTOPT(
  (lins): Sequential(
    (0): Linear(in_features=500, out_features=64, bias=True)
    (1): BatchNorm1d(64, eps=1e-05, momentum=0.1, affine=True, track_running_stats=True)
    (2): Dropout(p=0.9, inplace=True)
    (3): ReLU(inplace=True)
    (4): Linear(in_features=64, out_features=3, bias=True)
    (5): Identity()
  )
  (prop): Propagation(K=9, mode=None, lambda1=None, lambda2=None, L21=True, alpha=0.1)
  (gcn): GCN(
    (convs): ModuleList(
      (0): GCNConv(500, 64)
      (1): GCNConv(64, 3)
    )
    (bns): ModuleList(
      (0): BatchNorm1d(64, eps=1e-05, momentum=0.1, affine=True, track_running_stats=True)
    )
    (output): Identity()
  )
)
propagate done
init label
Split: 01, Run: 01
None time:  0.930689729982987
None Run 01:
Highest Train: 100.00
Highest Valid: 69.60
  Final Train: 100.00
   Final Test: 69.50
Split: 01, Run: 02
None time:  2.4509173170663416
None Run 02:
Highest Train: 100.00
Highest Valid: 76.20
  Final Train: 100.00
   Final Test: 74.80
Split: 01, Run: 03
None time:  1.010605308925733
None Run 03:
Highest Train: 100.00
Highest Valid: 73.20
  Final Train: 100.00
   Final Test: 73.10
run time now: 4.439648151397705
total time:  4.490495300851762
None All runs:
Highest Train: 100.00 ± 0.00
Highest Valid: 73.00 ± 3.30
  Final Train: 100.00 ± 0.00
   Final Test: 72.47 ± 2.71
[I 2023-06-12 00:23:05,311] Trial 121 finished with value: 73.0 and parameters: {'Fwd': 1.0329228835132683e-06, 'K': 9, 'alpha': 0.1, 'dropout': 0.9, 'gnnepoch': 60, 'lambda1': 0.6000000000000001, 'lambda2': 6.617773708991535, 'loop': 1, 'loss': 'MSE', 'lr': 0.003029512754522188, 'softmaxF': True, 'useGCN': False, 'weight_decay': 0.001282596509811279, 'weightedloss': False}. Best is trial 107 with value: 82.73332977294922.
/home/wxy/miniconda3/lib/python3.10/site-packages/optuna/distributions.py:685: UserWarning: The distribution is specified by [0, 1.00001] and step=0.05, but the range is not divisible by `step`. It will be replaced by [0, 1.0].
  warnings.warn(
K:  9
alpha:  0.9500000000000001
lr:  0.002502698339088866
weight_decay:  0.003584463494081031
dropout:  0.9
fix split and run 3 times
Data: Data(x=[19717, 500], y=[19717], train_mask=[19717], val_mask=[19717], test_mask=[19717], adj_t=[19717, 19717, nnz=88648])
num_train tensor(60)
num_noise 0
noise: tensor(0)
data feature 500
ALTOPT(
  (lins): Sequential(
    (0): Linear(in_features=500, out_features=64, bias=True)
    (1): BatchNorm1d(64, eps=1e-05, momentum=0.1, affine=True, track_running_stats=True)
    (2): Dropout(p=0.9, inplace=True)
    (3): ReLU(inplace=True)
    (4): Linear(in_features=64, out_features=3, bias=True)
    (5): Identity()
  )
  (prop): Propagation(K=9, mode=None, lambda1=None, lambda2=None, L21=True, alpha=0.9500000000000001)
  (gcn): GCN(
    (convs): ModuleList(
      (0): GCNConv(500, 64)
      (1): GCNConv(64, 3)
    )
    (bns): ModuleList(
      (0): BatchNorm1d(64, eps=1e-05, momentum=0.1, affine=True, track_running_stats=True)
    )
    (output): Identity()
  )
)
propagate done
init label
Split: 01, Run: 01
None time:  2.445510658901185
None Run 01:
Highest Train: 100.00
Highest Valid: 82.60
  Final Train: 100.00
   Final Test: 78.00
Split: 01, Run: 02
None time:  1.340958908898756
None Run 02:
Highest Train: 100.00
Highest Valid: 80.20
  Final Train: 100.00
   Final Test: 79.10
Split: 01, Run: 03
None time:  1.1158430820796639
None Run 03:
Highest Train: 100.00
Highest Valid: 83.40
  Final Train: 100.00
   Final Test: 79.20
run time now: 4.964393615722656
total time:  5.018965648952872
None All runs:
Highest Train: 100.00 ± 0.00
Highest Valid: 82.07 ± 1.67
  Final Train: 100.00 ± 0.00
   Final Test: 78.77 ± 0.67
[I 2023-06-12 00:23:10,927] Trial 122 finished with value: 82.06665802001953 and parameters: {'Fwd': 2.0796666444145158e-06, 'K': 9, 'alpha': 0.9500000000000001, 'dropout': 0.9, 'gnnepoch': 70, 'lambda1': 0.55, 'lambda2': 7.064151227996396, 'loop': 1, 'loss': 'MSE', 'lr': 0.002502698339088866, 'softmaxF': True, 'useGCN': False, 'weight_decay': 0.003584463494081031, 'weightedloss': False}. Best is trial 107 with value: 82.73332977294922.
/home/wxy/miniconda3/lib/python3.10/site-packages/optuna/distributions.py:685: UserWarning: The distribution is specified by [0, 1.00001] and step=0.05, but the range is not divisible by `step`. It will be replaced by [0, 1.0].
  warnings.warn(
K:  10
alpha:  0.9500000000000001
lr:  0.002681515017098236
weight_decay:  0.0027204300988228456
dropout:  0.9
fix split and run 3 times
Data: Data(x=[19717, 500], y=[19717], train_mask=[19717], val_mask=[19717], test_mask=[19717], adj_t=[19717, 19717, nnz=88648])
num_train tensor(60)
num_noise 0
noise: tensor(0)
data feature 500
ALTOPT(
  (lins): Sequential(
    (0): Linear(in_features=500, out_features=64, bias=True)
    (1): BatchNorm1d(64, eps=1e-05, momentum=0.1, affine=True, track_running_stats=True)
    (2): Dropout(p=0.9, inplace=True)
    (3): ReLU(inplace=True)
    (4): Linear(in_features=64, out_features=3, bias=True)
    (5): Identity()
  )
  (prop): Propagation(K=10, mode=None, lambda1=None, lambda2=None, L21=True, alpha=0.9500000000000001)
  (gcn): GCN(
    (convs): ModuleList(
      (0): GCNConv(500, 64)
      (1): GCNConv(64, 3)
    )
    (bns): ModuleList(
      (0): BatchNorm1d(64, eps=1e-05, momentum=0.1, affine=True, track_running_stats=True)
    )
    (output): Identity()
  )
)
propagate done
init label
Split: 01, Run: 01
None time:  3.3425654501188546
None Run 01:
Highest Train: 100.00
Highest Valid: 81.80
  Final Train: 100.00
   Final Test: 78.40
Split: 01, Run: 02
None time:  1.3636748329736292
None Run 02:
Highest Train: 100.00
Highest Valid: 84.20
  Final Train: 100.00
   Final Test: 80.50
Split: 01, Run: 03
None time:  1.6451509920880198
None Run 03:
Highest Train: 100.00
Highest Valid: 82.80
  Final Train: 100.00
   Final Test: 78.80
run time now: 6.397979736328125
total time:  6.440901475027204
None All runs:
Highest Train: 100.00 ± 0.00
Highest Valid: 82.93 ± 1.21
  Final Train: 100.00 ± 0.00
   Final Test: 79.23 ± 1.12
[I 2023-06-12 00:23:17,915] Trial 123 finished with value: 82.93333435058594 and parameters: {'Fwd': 2.110038101994924e-06, 'K': 10, 'alpha': 0.9500000000000001, 'dropout': 0.9, 'gnnepoch': 60, 'lambda1': 0.55, 'lambda2': 6.76166646536929, 'loop': 1, 'loss': 'MSE', 'lr': 0.002681515017098236, 'softmaxF': True, 'useGCN': False, 'weight_decay': 0.0027204300988228456, 'weightedloss': False}. Best is trial 123 with value: 82.93333435058594.
/home/wxy/miniconda3/lib/python3.10/site-packages/optuna/distributions.py:685: UserWarning: The distribution is specified by [0, 1.00001] and step=0.05, but the range is not divisible by `step`. It will be replaced by [0, 1.0].
  warnings.warn(
K:  10
alpha:  0.9500000000000001
lr:  0.002688500124372204
weight_decay:  0.0015035539453619508
dropout:  0.9
fix split and run 3 times
Data: Data(x=[19717, 500], y=[19717], train_mask=[19717], val_mask=[19717], test_mask=[19717], adj_t=[19717, 19717, nnz=88648])
num_train tensor(60)
num_noise 0
noise: tensor(0)
data feature 500
ALTOPT(
  (lins): Sequential(
    (0): Linear(in_features=500, out_features=64, bias=True)
    (1): BatchNorm1d(64, eps=1e-05, momentum=0.1, affine=True, track_running_stats=True)
    (2): Dropout(p=0.9, inplace=True)
    (3): ReLU(inplace=True)
    (4): Linear(in_features=64, out_features=3, bias=True)
    (5): Identity()
  )
  (prop): Propagation(K=10, mode=None, lambda1=None, lambda2=None, L21=True, alpha=0.9500000000000001)
  (gcn): GCN(
    (convs): ModuleList(
      (0): GCNConv(500, 64)
      (1): GCNConv(64, 3)
    )
    (bns): ModuleList(
      (0): BatchNorm1d(64, eps=1e-05, momentum=0.1, affine=True, track_running_stats=True)
    )
    (output): Identity()
  )
)
propagate done
init label
Split: 01, Run: 01
None time:  3.005963935982436
None Run 01:
Highest Train: 100.00
Highest Valid: 82.00
  Final Train: 100.00
   Final Test: 78.10
Split: 01, Run: 02
None time:  1.7942491648718715
None Run 02:
Highest Train: 100.00
Highest Valid: 80.60
  Final Train: 100.00
   Final Test: 78.30
Split: 01, Run: 03
None time:  1.1052760249003768
None Run 03:
Highest Train: 100.00
Highest Valid: 82.00
  Final Train: 100.00
   Final Test: 79.20
run time now: 5.971508741378784
total time:  6.029336125822738
None All runs:
Highest Train: 100.00 ± 0.00
Highest Valid: 81.53 ± 0.81
  Final Train: 100.00 ± 0.00
   Final Test: 78.53 ± 0.59
[I 2023-06-12 00:23:24,449] Trial 124 finished with value: 81.53333282470703 and parameters: {'Fwd': 1.9352364978527282e-06, 'K': 10, 'alpha': 0.9500000000000001, 'dropout': 0.9, 'gnnepoch': 60, 'lambda1': 0.65, 'lambda2': 5.868872474569157, 'loop': 1, 'loss': 'MSE', 'lr': 0.002688500124372204, 'softmaxF': True, 'useGCN': False, 'weight_decay': 0.0015035539453619508, 'weightedloss': False}. Best is trial 123 with value: 82.93333435058594.
/home/wxy/miniconda3/lib/python3.10/site-packages/optuna/distributions.py:685: UserWarning: The distribution is specified by [0, 1.00001] and step=0.05, but the range is not divisible by `step`. It will be replaced by [0, 1.0].
  warnings.warn(
K:  10
alpha:  0.9500000000000001
lr:  0.002441452185777674
weight_decay:  0.0019416933615435607
dropout:  0.9
fix split and run 3 times
Data: Data(x=[19717, 500], y=[19717], train_mask=[19717], val_mask=[19717], test_mask=[19717], adj_t=[19717, 19717, nnz=88648])
num_train tensor(60)
num_noise 0
noise: tensor(0)
data feature 500
ALTOPT(
  (lins): Sequential(
    (0): Linear(in_features=500, out_features=64, bias=True)
    (1): BatchNorm1d(64, eps=1e-05, momentum=0.1, affine=True, track_running_stats=True)
    (2): Dropout(p=0.9, inplace=True)
    (3): ReLU(inplace=True)
    (4): Linear(in_features=64, out_features=3, bias=True)
    (5): Identity()
  )
  (prop): Propagation(K=10, mode=None, lambda1=None, lambda2=None, L21=True, alpha=0.9500000000000001)
  (gcn): GCN(
    (convs): ModuleList(
      (0): GCNConv(500, 64)
      (1): GCNConv(64, 3)
    )
    (bns): ModuleList(
      (0): BatchNorm1d(64, eps=1e-05, momentum=0.1, affine=True, track_running_stats=True)
    )
    (output): Identity()
  )
)
propagate done
init label
Split: 01, Run: 01
None time:  2.2915190260391682
None Run 01:
Highest Train: 100.00
Highest Valid: 82.00
  Final Train: 100.00
   Final Test: 77.50
Split: 01, Run: 02
None time:  0.9883695929311216
None Run 02:
Highest Train: 100.00
Highest Valid: 83.00
  Final Train: 100.00
   Final Test: 78.60
Split: 01, Run: 03
None time:  1.779634808190167
None Run 03:
Highest Train: 100.00
Highest Valid: 83.40
  Final Train: 100.00
   Final Test: 79.40
run time now: 5.137284517288208
total time:  5.192297102883458
None All runs:
Highest Train: 100.00 ± 0.00
Highest Valid: 82.80 ± 0.72
  Final Train: 100.00 ± 0.00
   Final Test: 78.50 ± 0.95
