[I 2023-06-12 00:52:34,039] Trial 430 finished with value: 79.9333267211914 and parameters: {'Fwd': 0.09985248840606772, 'K': 10, 'alpha': 0.6000000000000001, 'dropout': 0.4, 'gnnepoch': 60, 'lambda1': 0.7000000000000001, 'lambda2': 4.79909906490502, 'loop': 1, 'loss': 'CE', 'lr': 0.009090384362292706, 'softmaxF': True, 'useGCN': False, 'weight_decay': 9.076657299856945e-05, 'weightedloss': False}. Best is trial 112 with value: 81.66667175292969.
/home/wxy/miniconda3/lib/python3.10/site-packages/optuna/distributions.py:685: UserWarning: The distribution is specified by [0, 1.00001] and step=0.05, but the range is not divisible by `step`. It will be replaced by [0, 1.0].
  warnings.warn(
K:  10
alpha:  0.65
lr:  0.007258235243737311
weight_decay:  4.352643632339685e-05
dropout:  0.4
fix split and run 3 times
Data: Data(x=[2708, 1433], y=[2708], train_mask=[2708], val_mask=[2708], test_mask=[2708], adj_t=[2708, 2708, nnz=10556])
num_train tensor(140)
num_noise 0
noise: tensor(0)
data feature 1433
ALTOPT(
  (lins): Sequential(
    (0): Linear(in_features=1433, out_features=64, bias=True)
    (1): BatchNorm1d(64, eps=1e-05, momentum=0.1, affine=True, track_running_stats=True)
    (2): Dropout(p=0.4, inplace=True)
    (3): ReLU(inplace=True)
    (4): Linear(in_features=64, out_features=7, bias=True)
    (5): LogSoftmax(dim=-1)
  )
  (prop): Propagation(K=10, mode=None, lambda1=None, lambda2=None, L21=True, alpha=0.65)
  (gcn): GCN(
    (convs): ModuleList(
      (0): GCNConv(1433, 64)
      (1): GCNConv(64, 7)
    )
    (bns): ModuleList(
      (0): BatchNorm1d(64, eps=1e-05, momentum=0.1, affine=True, track_running_stats=True)
    )
    (output): LogSoftmax(dim=-1)
  )
)
propagate done
init label
Split: 01, Run: 01
None time:  1.648474141024053
None Run 01:
Highest Train: 100.00
Highest Valid: 82.00
  Final Train: 100.00
   Final Test: 82.20
Split: 01, Run: 02
None time:  1.6905034892261028
None Run 02:
Highest Train: 100.00
Highest Valid: 81.80
  Final Train: 100.00
   Final Test: 81.90
Split: 01, Run: 03
None time:  1.4113180339336395
None Run 03:
Highest Train: 100.00
Highest Valid: 81.00
  Final Train: 100.00
   Final Test: 80.70
run time now: 4.7784905433654785
total time:  4.792103979969397
None All runs:
Highest Train: 100.00 ± 0.00
Highest Valid: 81.60 ± 0.53
  Final Train: 100.00 ± 0.00
   Final Test: 81.60 ± 0.79
[I 2023-06-12 00:52:39,348] Trial 431 finished with value: 81.5999984741211 and parameters: {'Fwd': 0.06621012200954177, 'K': 10, 'alpha': 0.65, 'dropout': 0.4, 'gnnepoch': 60, 'lambda1': 0.8, 'lambda2': 5.4865107473289845, 'loop': 1, 'loss': 'CE', 'lr': 0.007258235243737311, 'softmaxF': True, 'useGCN': True, 'weight_decay': 4.352643632339685e-05, 'weightedloss': False}. Best is trial 112 with value: 81.66667175292969.
/home/wxy/miniconda3/lib/python3.10/site-packages/optuna/distributions.py:685: UserWarning: The distribution is specified by [0, 1.00001] and step=0.05, but the range is not divisible by `step`. It will be replaced by [0, 1.0].
  warnings.warn(
K:  10
alpha:  0.7000000000000001
lr:  0.0014509163189069287
weight_decay:  3.939188029628909e-05
dropout:  0.4
fix split and run 3 times
Data: Data(x=[2708, 1433], y=[2708], train_mask=[2708], val_mask=[2708], test_mask=[2708], adj_t=[2708, 2708, nnz=10556])
num_train tensor(140)
num_noise 0
noise: tensor(0)
data feature 1433
ALTOPT(
  (lins): Sequential(
    (0): Linear(in_features=1433, out_features=64, bias=True)
    (1): BatchNorm1d(64, eps=1e-05, momentum=0.1, affine=True, track_running_stats=True)
    (2): Dropout(p=0.4, inplace=True)
    (3): ReLU(inplace=True)
    (4): Linear(in_features=64, out_features=7, bias=True)
    (5): LogSoftmax(dim=-1)
  )
  (prop): Propagation(K=10, mode=None, lambda1=None, lambda2=None, L21=True, alpha=0.7000000000000001)
  (gcn): GCN(
    (convs): ModuleList(
      (0): GCNConv(1433, 64)
      (1): GCNConv(64, 7)
    )
    (bns): ModuleList(
      (0): BatchNorm1d(64, eps=1e-05, momentum=0.1, affine=True, track_running_stats=True)
    )
    (output): LogSoftmax(dim=-1)
  )
)
propagate done
init label
Split: 01, Run: 01
None time:  1.6286316069308668
None Run 01:
Highest Train: 100.00
Highest Valid: 79.60
  Final Train: 100.00
   Final Test: 80.50
Split: 01, Run: 02
None time:  1.7920664970297366
None Run 02:
Highest Train: 100.00
Highest Valid: 77.60
  Final Train: 100.00
   Final Test: 79.00
Split: 01, Run: 03
None time:  1.6959941869135946
None Run 03:
Highest Train: 100.00
Highest Valid: 74.60
  Final Train: 100.00
   Final Test: 74.90
run time now: 5.141999006271362
total time:  5.158479760866612
None All runs:
Highest Train: 100.00 ± 0.00
Highest Valid: 77.27 ± 2.52
  Final Train: 100.00 ± 0.00
   Final Test: 78.13 ± 2.90
[I 2023-06-12 00:52:45,039] Trial 432 finished with value: 77.26667022705078 and parameters: {'Fwd': 0.04639779866471726, 'K': 10, 'alpha': 0.7000000000000001, 'dropout': 0.4, 'gnnepoch': 50, 'lambda1': 0.75, 'lambda2': 7.241066371547971, 'loop': 2, 'loss': 'CE', 'lr': 0.0014509163189069287, 'softmaxF': True, 'useGCN': True, 'weight_decay': 3.939188029628909e-05, 'weightedloss': False}. Best is trial 112 with value: 81.66667175292969.
/home/wxy/miniconda3/lib/python3.10/site-packages/optuna/distributions.py:685: UserWarning: The distribution is specified by [0, 1.00001] and step=0.05, but the range is not divisible by `step`. It will be replaced by [0, 1.0].
  warnings.warn(
K:  1
alpha:  0.65
lr:  0.007326587005626041
weight_decay:  0.0008419658933167799
dropout:  0.5
fix split and run 3 times
Data: Data(x=[2708, 1433], y=[2708], train_mask=[2708], val_mask=[2708], test_mask=[2708], adj_t=[2708, 2708, nnz=10556])
num_train tensor(140)
num_noise 0
noise: tensor(0)
data feature 1433
ALTOPT(
  (lins): Sequential(
    (0): Linear(in_features=1433, out_features=64, bias=True)
    (1): BatchNorm1d(64, eps=1e-05, momentum=0.1, affine=True, track_running_stats=True)
    (2): Dropout(p=0.5, inplace=True)
    (3): ReLU(inplace=True)
    (4): Linear(in_features=64, out_features=7, bias=True)
    (5): LogSoftmax(dim=-1)
  )
  (prop): Propagation(K=1, mode=None, lambda1=None, lambda2=None, L21=True, alpha=0.65)
  (gcn): GCN(
    (convs): ModuleList(
      (0): GCNConv(1433, 64)
      (1): GCNConv(64, 7)
    )
    (bns): ModuleList(
      (0): BatchNorm1d(64, eps=1e-05, momentum=0.1, affine=True, track_running_stats=True)
    )
    (output): LogSoftmax(dim=-1)
  )
)
propagate done
init label
Split: 01, Run: 01
None time:  1.5828231391496956
None Run 01:
Highest Train: 100.00
Highest Valid: 81.80
  Final Train: 100.00
   Final Test: 81.80
Split: 01, Run: 02
None time:  1.8869772220496088
None Run 02:
Highest Train: 100.00
Highest Valid: 81.00
  Final Train: 100.00
   Final Test: 82.00
Split: 01, Run: 03
None time:  1.9144615719560534
None Run 03:
Highest Train: 100.00
Highest Valid: 80.80
  Final Train: 100.00
   Final Test: 81.80
run time now: 5.416671276092529
total time:  5.449959432007745
None All runs:
Highest Train: 100.00 ± 0.00
Highest Valid: 81.20 ± 0.53
  Final Train: 100.00 ± 0.00
   Final Test: 81.87 ± 0.12
[I 2023-06-12 00:52:51,137] Trial 433 finished with value: 81.20000457763672 and parameters: {'Fwd': 0.00428158876926832, 'K': 1, 'alpha': 0.65, 'dropout': 0.5, 'gnnepoch': 60, 'lambda1': 0.8, 'lambda2': 5.143553046687859, 'loop': 1, 'loss': 'CE', 'lr': 0.007326587005626041, 'softmaxF': True, 'useGCN': True, 'weight_decay': 0.0008419658933167799, 'weightedloss': True}. Best is trial 112 with value: 81.66667175292969.
/home/wxy/miniconda3/lib/python3.10/site-packages/optuna/distributions.py:685: UserWarning: The distribution is specified by [0, 1.00001] and step=0.05, but the range is not divisible by `step`. It will be replaced by [0, 1.0].
  warnings.warn(
K:  10
alpha:  0.5
lr:  0.0008614240615739013
weight_decay:  4.404549246853247e-05
dropout:  0.4
fix split and run 3 times
Data: Data(x=[2708, 1433], y=[2708], train_mask=[2708], val_mask=[2708], test_mask=[2708], adj_t=[2708, 2708, nnz=10556])
num_train tensor(140)
num_noise 0
noise: tensor(0)
data feature 1433
ALTOPT(
  (lins): Sequential(
    (0): Linear(in_features=1433, out_features=64, bias=True)
    (1): BatchNorm1d(64, eps=1e-05, momentum=0.1, affine=True, track_running_stats=True)
    (2): Dropout(p=0.4, inplace=True)
    (3): ReLU(inplace=True)
    (4): Linear(in_features=64, out_features=7, bias=True)
    (5): LogSoftmax(dim=-1)
  )
  (prop): Propagation(K=10, mode=None, lambda1=None, lambda2=None, L21=True, alpha=0.5)
  (gcn): GCN(
    (convs): ModuleList(
      (0): GCNConv(1433, 64)
      (1): GCNConv(64, 7)
    )
    (bns): ModuleList(
      (0): BatchNorm1d(64, eps=1e-05, momentum=0.1, affine=True, track_running_stats=True)
    )
    (output): LogSoftmax(dim=-1)
  )
)
propagate done
init label
Split: 01, Run: 01
None time:  1.6328628740739077
None Run 01:
Highest Train: 100.00
Highest Valid: 79.60
  Final Train: 100.00
   Final Test: 79.50
Split: 01, Run: 02
None time:  1.3977380760479718
None Run 02:
Highest Train: 100.00
Highest Valid: 76.80
  Final Train: 100.00
   Final Test: 76.50
Split: 01, Run: 03
None time:  1.679310373030603
None Run 03:
Highest Train: 100.00
Highest Valid: 72.80
  Final Train: 100.00
   Final Test: 73.20
run time now: 4.743204355239868
total time:  4.755613502813503
None All runs:
Highest Train: 100.00 ± 0.00
Highest Valid: 76.40 ± 3.42
  Final Train: 100.00 ± 0.00
   Final Test: 76.40 ± 3.15
[I 2023-06-12 00:52:56,416] Trial 434 finished with value: 76.39999389648438 and parameters: {'Fwd': 0.0003794249302211291, 'K': 10, 'alpha': 0.5, 'dropout': 0.4, 'gnnepoch': 60, 'lambda1': 0.75, 'lambda2': 5.425503653370686, 'loop': 1, 'loss': 'CE', 'lr': 0.0008614240615739013, 'softmaxF': True, 'useGCN': True, 'weight_decay': 4.404549246853247e-05, 'weightedloss': False}. Best is trial 112 with value: 81.66667175292969.
/home/wxy/miniconda3/lib/python3.10/site-packages/optuna/distributions.py:685: UserWarning: The distribution is specified by [0, 1.00001] and step=0.05, but the range is not divisible by `step`. It will be replaced by [0, 1.0].
  warnings.warn(
K:  10
alpha:  0.6000000000000001
lr:  0.008153671113105665
weight_decay:  2.1286219740283463e-05
dropout:  0.4
fix split and run 3 times
Data: Data(x=[2708, 1433], y=[2708], train_mask=[2708], val_mask=[2708], test_mask=[2708], adj_t=[2708, 2708, nnz=10556])
num_train tensor(140)
num_noise 0
noise: tensor(0)
data feature 1433
ALTOPT(
  (lins): Sequential(
    (0): Linear(in_features=1433, out_features=64, bias=True)
    (1): BatchNorm1d(64, eps=1e-05, momentum=0.1, affine=True, track_running_stats=True)
    (2): Dropout(p=0.4, inplace=True)
    (3): ReLU(inplace=True)
    (4): Linear(in_features=64, out_features=7, bias=True)
    (5): LogSoftmax(dim=-1)
  )
  (prop): Propagation(K=10, mode=None, lambda1=None, lambda2=None, L21=True, alpha=0.6000000000000001)
  (gcn): GCN(
    (convs): ModuleList(
      (0): GCNConv(1433, 64)
      (1): GCNConv(64, 7)
    )
    (bns): ModuleList(
      (0): BatchNorm1d(64, eps=1e-05, momentum=0.1, affine=True, track_running_stats=True)
    )
    (output): LogSoftmax(dim=-1)
  )
)
propagate done
init label
Split: 01, Run: 01
None time:  1.2025889959186316
None Run 01:
Highest Train: 100.00
Highest Valid: 81.20
  Final Train: 100.00
   Final Test: 82.60
Split: 01, Run: 02
None time:  1.2055984491016716
None Run 02:
Highest Train: 100.00
Highest Valid: 81.20
  Final Train: 100.00
   Final Test: 81.80
Split: 01, Run: 03
None time:  1.6349189470056444
None Run 03:
Highest Train: 100.00
Highest Valid: 80.80
  Final Train: 100.00
   Final Test: 81.20
run time now: 4.073031902313232
total time:  4.091483799973503
None All runs:
Highest Train: 100.00 ± 0.00
Highest Valid: 81.07 ± 0.23
  Final Train: 100.00 ± 0.00
   Final Test: 81.87 ± 0.70
[I 2023-06-12 00:53:01,007] Trial 435 finished with value: 81.06666564941406 and parameters: {'Fwd': 0.0256702275942957, 'K': 10, 'alpha': 0.6000000000000001, 'dropout': 0.4, 'gnnepoch': 60, 'lambda1': 0.8, 'lambda2': 5.806784488039129, 'loop': 1, 'loss': 'CE', 'lr': 0.008153671113105665, 'softmaxF': False, 'useGCN': True, 'weight_decay': 2.1286219740283463e-05, 'weightedloss': False}. Best is trial 112 with value: 81.66667175292969.
/home/wxy/miniconda3/lib/python3.10/site-packages/optuna/distributions.py:685: UserWarning: The distribution is specified by [0, 1.00001] and step=0.05, but the range is not divisible by `step`. It will be replaced by [0, 1.0].
  warnings.warn(
K:  10
alpha:  0.6000000000000001
lr:  0.009231454979843137
weight_decay:  3.0372159417300016e-05
dropout:  0.30000000000000004
fix split and run 3 times
Data: Data(x=[2708, 1433], y=[2708], train_mask=[2708], val_mask=[2708], test_mask=[2708], adj_t=[2708, 2708, nnz=10556])
num_train tensor(140)
num_noise 0
noise: tensor(0)
data feature 1433
ALTOPT(
  (lins): Sequential(
    (0): Linear(in_features=1433, out_features=64, bias=True)
    (1): BatchNorm1d(64, eps=1e-05, momentum=0.1, affine=True, track_running_stats=True)
    (2): Dropout(p=0.30000000000000004, inplace=True)
    (3): ReLU(inplace=True)
    (4): Linear(in_features=64, out_features=7, bias=True)
    (5): LogSoftmax(dim=-1)
  )
  (prop): Propagation(K=10, mode=None, lambda1=None, lambda2=None, L21=True, alpha=0.6000000000000001)
  (gcn): GCN(
    (convs): ModuleList(
      (0): GCNConv(1433, 64)
      (1): GCNConv(64, 7)
    )
    (bns): ModuleList(
      (0): BatchNorm1d(64, eps=1e-05, momentum=0.1, affine=True, track_running_stats=True)
    )
    (output): LogSoftmax(dim=-1)
  )
)
propagate done
init label
Split: 01, Run: 01
None time:  1.5774912459310144
None Run 01:
Highest Train: 100.00
Highest Valid: 81.20
  Final Train: 100.00
   Final Test: 82.80
Split: 01, Run: 02
None time:  2.6478221940342337
None Run 02:
Highest Train: 100.00
Highest Valid: 81.20
  Final Train: 100.00
   Final Test: 83.20
Split: 01, Run: 03
None time:  1.5778873548842967
None Run 03:
Highest Train: 100.00
Highest Valid: 81.00
  Final Train: 100.00
   Final Test: 82.10
run time now: 5.82994270324707
total time:  5.845484807156026
None All runs:
Highest Train: 100.00 ± 0.00
Highest Valid: 81.13 ± 0.12
  Final Train: 100.00 ± 0.00
   Final Test: 82.70 ± 0.56
[I 2023-06-12 00:53:07,330] Trial 436 finished with value: 81.13333129882812 and parameters: {'Fwd': 0.09889190577699211, 'K': 10, 'alpha': 0.6000000000000001, 'dropout': 0.30000000000000004, 'gnnepoch': 50, 'lambda1': 0.8, 'lambda2': 5.548237681321682, 'loop': 1, 'loss': 'CE', 'lr': 0.009231454979843137, 'softmaxF': True, 'useGCN': True, 'weight_decay': 3.0372159417300016e-05, 'weightedloss': True}. Best is trial 112 with value: 81.66667175292969.
/home/wxy/miniconda3/lib/python3.10/site-packages/optuna/distributions.py:685: UserWarning: The distribution is specified by [0, 1.00001] and step=0.05, but the range is not divisible by `step`. It will be replaced by [0, 1.0].
  warnings.warn(
K:  10
alpha:  0.55
lr:  0.0006646192571564273
weight_decay:  0.0002467845771862229
dropout:  0.4
fix split and run 3 times
Data: Data(x=[2708, 1433], y=[2708], train_mask=[2708], val_mask=[2708], test_mask=[2708], adj_t=[2708, 2708, nnz=10556])
num_train tensor(140)
num_noise 0
noise: tensor(0)
data feature 1433
ALTOPT(
  (lins): Sequential(
    (0): Linear(in_features=1433, out_features=64, bias=True)
    (1): BatchNorm1d(64, eps=1e-05, momentum=0.1, affine=True, track_running_stats=True)
    (2): Dropout(p=0.4, inplace=True)
    (3): ReLU(inplace=True)
    (4): Linear(in_features=64, out_features=7, bias=True)
    (5): LogSoftmax(dim=-1)
  )
  (prop): Propagation(K=10, mode=None, lambda1=None, lambda2=None, L21=True, alpha=0.55)
  (gcn): GCN(
    (convs): ModuleList(
      (0): GCNConv(1433, 64)
      (1): GCNConv(64, 7)
    )
    (bns): ModuleList(
      (0): BatchNorm1d(64, eps=1e-05, momentum=0.1, affine=True, track_running_stats=True)
    )
    (output): LogSoftmax(dim=-1)
  )
)
propagate done
init label
Split: 01, Run: 01
None time:  1.6916437800973654
None Run 01:
Highest Train: 100.00
Highest Valid: 79.80
  Final Train: 100.00
   Final Test: 79.40
Split: 01, Run: 02
None time:  1.1930534990970045
None Run 02:
Highest Train: 100.00
Highest Valid: 75.20
  Final Train: 100.00
   Final Test: 74.40
Split: 01, Run: 03
None time:  1.668729550903663
None Run 03:
Highest Train: 100.00
Highest Valid: 77.80
  Final Train: 100.00
   Final Test: 78.20
run time now: 4.580356121063232
total time:  4.603069182951003
None All runs:
Highest Train: 100.00 ± 0.00
Highest Valid: 77.60 ± 2.31
  Final Train: 100.00 ± 0.00
   Final Test: 77.33 ± 2.61
[I 2023-06-12 00:53:12,434] Trial 437 finished with value: 77.5999984741211 and parameters: {'Fwd': 0.001773119492325082, 'K': 10, 'alpha': 0.55, 'dropout': 0.4, 'gnnepoch': 60, 'lambda1': 0.8, 'lambda2': 6.147633314787866, 'loop': 1, 'loss': 'CE', 'lr': 0.0006646192571564273, 'softmaxF': True, 'useGCN': True, 'weight_decay': 0.0002467845771862229, 'weightedloss': False}. Best is trial 112 with value: 81.66667175292969.
/home/wxy/miniconda3/lib/python3.10/site-packages/optuna/distributions.py:685: UserWarning: The distribution is specified by [0, 1.00001] and step=0.05, but the range is not divisible by `step`. It will be replaced by [0, 1.0].
  warnings.warn(
K:  10
alpha:  0.65
lr:  0.00994425145365285
weight_decay:  1.503316934290214e-05
dropout:  0.4
fix split and run 3 times
Data: Data(x=[2708, 1433], y=[2708], train_mask=[2708], val_mask=[2708], test_mask=[2708], adj_t=[2708, 2708, nnz=10556])
num_train tensor(140)
num_noise 0
noise: tensor(0)
data feature 1433
ALTOPT(
  (lins): Sequential(
    (0): Linear(in_features=1433, out_features=64, bias=True)
    (1): BatchNorm1d(64, eps=1e-05, momentum=0.1, affine=True, track_running_stats=True)
    (2): Dropout(p=0.4, inplace=True)
    (3): ReLU(inplace=True)
    (4): Linear(in_features=64, out_features=7, bias=True)
    (5): LogSoftmax(dim=-1)
  )
  (prop): Propagation(K=10, mode=None, lambda1=None, lambda2=None, L21=True, alpha=0.65)
  (gcn): GCN(
    (convs): ModuleList(
      (0): GCNConv(1433, 64)
      (1): GCNConv(64, 7)
    )
    (bns): ModuleList(
      (0): BatchNorm1d(64, eps=1e-05, momentum=0.1, affine=True, track_running_stats=True)
    )
    (output): LogSoftmax(dim=-1)
  )
)
propagate done
init label
Split: 01, Run: 01
None time:  1.6233779359608889
None Run 01:
Highest Train: 100.00
Highest Valid: 81.40
  Final Train: 100.00
   Final Test: 82.10
Split: 01, Run: 02
None time:  1.5122522118035704
None Run 02:
Highest Train: 100.00
Highest Valid: 81.60
  Final Train: 100.00
   Final Test: 80.40
Split: 01, Run: 03
None time:  1.75246049487032
None Run 03:
Highest Train: 100.00
Highest Valid: 80.80
  Final Train: 100.00
   Final Test: 81.10
run time now: 4.924533843994141
total time:  4.943240044871345
None All runs:
Highest Train: 100.00 ± 0.00
Highest Valid: 81.27 ± 0.42
  Final Train: 100.00 ± 0.00
   Final Test: 81.20 ± 0.85
[I 2023-06-12 00:53:17,873] Trial 438 finished with value: 81.26667022705078 and parameters: {'Fwd': 0.06808266577767676, 'K': 10, 'alpha': 0.65, 'dropout': 0.4, 'gnnepoch': 60, 'lambda1': 0.75, 'lambda2': 4.949596947484804, 'loop': 1, 'loss': 'CE', 'lr': 0.00994425145365285, 'softmaxF': True, 'useGCN': True, 'weight_decay': 1.503316934290214e-05, 'weightedloss': False}. Best is trial 112 with value: 81.66667175292969.
/home/wxy/miniconda3/lib/python3.10/site-packages/optuna/distributions.py:685: UserWarning: The distribution is specified by [0, 1.00001] and step=0.05, but the range is not divisible by `step`. It will be replaced by [0, 1.0].
  warnings.warn(
K:  5
alpha:  0.7000000000000001
lr:  0.006269313730071467
weight_decay:  0.0014105326829066856
dropout:  0.5
fix split and run 3 times
Data: Data(x=[2708, 1433], y=[2708], train_mask=[2708], val_mask=[2708], test_mask=[2708], adj_t=[2708, 2708, nnz=10556])
num_train tensor(140)
num_noise 0
noise: tensor(0)
data feature 1433
ALTOPT(
  (lins): Sequential(
    (0): Linear(in_features=1433, out_features=64, bias=True)
    (1): BatchNorm1d(64, eps=1e-05, momentum=0.1, affine=True, track_running_stats=True)
    (2): Dropout(p=0.5, inplace=True)
    (3): ReLU(inplace=True)
    (4): Linear(in_features=64, out_features=7, bias=True)
    (5): LogSoftmax(dim=-1)
  )
  (prop): Propagation(K=5, mode=None, lambda1=None, lambda2=None, L21=True, alpha=0.7000000000000001)
  (gcn): GCN(
    (convs): ModuleList(
      (0): GCNConv(1433, 64)
      (1): GCNConv(64, 7)
    )
    (bns): ModuleList(
      (0): BatchNorm1d(64, eps=1e-05, momentum=0.1, affine=True, track_running_stats=True)
    )
    (output): LogSoftmax(dim=-1)
  )
)
propagate done
init label
Split: 01, Run: 01
None time:  1.2331145210191607
None Run 01:
Highest Train: 100.00
Highest Valid: 81.60
  Final Train: 100.00
   Final Test: 81.60
Split: 01, Run: 02
None time:  1.5432176620233804
None Run 02:
Highest Train: 100.00
Highest Valid: 81.20
  Final Train: 100.00
   Final Test: 81.10
Split: 01, Run: 03
None time:  1.564644284080714
None Run 03:
Highest Train: 100.00
Highest Valid: 80.80
  Final Train: 100.00
   Final Test: 80.90
run time now: 4.360619306564331
total time:  4.375496210996062
None All runs:
Highest Train: 100.00 ± 0.00
Highest Valid: 81.20 ± 0.40
  Final Train: 100.00 ± 0.00
   Final Test: 81.20 ± 0.36
