[I 2023-06-12 00:15:36,049] Trial 35 finished with value: 79.73332977294922 and parameters: {'Fwd': 5.4501953176254e-05, 'K': 7, 'alpha': 0.7000000000000001, 'dropout': 0.30000000000000004, 'gnnepoch': 100, 'lambda1': 0.55, 'lambda2': 9.410545326174313, 'loop': 1, 'loss': 'MSE', 'lr': 0.002560005214908762, 'softmaxF': True, 'useGCN': False, 'weight_decay': 6.7655372806444e-05, 'weightedloss': False}. Best is trial 20 with value: 81.0666732788086.
/home/wxy/miniconda3/lib/python3.10/site-packages/optuna/distributions.py:685: UserWarning: The distribution is specified by [0, 1.00001] and step=0.05, but the range is not divisible by `step`. It will be replaced by [0, 1.0].
  warnings.warn(
K:  8
alpha:  0.8500000000000001
lr:  0.0016308630800190974
weight_decay:  6.266588524462078e-05
dropout:  0.5
fix split and run 3 times
Data: Data(x=[19717, 500], y=[19717], train_mask=[19717], val_mask=[19717], test_mask=[19717], adj_t=[19717, 19717, nnz=88648])
num_train tensor(60)
num_noise 0
noise: tensor(0)
data feature 500
ALTOPT(
  (lins): Sequential(
    (0): Linear(in_features=500, out_features=64, bias=True)
    (1): BatchNorm1d(64, eps=1e-05, momentum=0.1, affine=True, track_running_stats=True)
    (2): Dropout(p=0.5, inplace=True)
    (3): ReLU(inplace=True)
    (4): Linear(in_features=64, out_features=3, bias=True)
    (5): Identity()
  )
  (prop): Propagation(K=8, mode=None, lambda1=None, lambda2=None, L21=True, alpha=0.8500000000000001)
  (gcn): GCN(
    (convs): ModuleList(
      (0): GCNConv(500, 64)
      (1): GCNConv(64, 3)
    )
    (bns): ModuleList(
      (0): BatchNorm1d(64, eps=1e-05, momentum=0.1, affine=True, track_running_stats=True)
    )
    (output): Identity()
  )
)
propagate done
init label
Split: 01, Run: 01
None time:  1.33375173388049
None Run 01:
Highest Train: 100.00
Highest Valid: 80.20
  Final Train: 100.00
   Final Test: 76.00
Split: 01, Run: 02
None time:  1.8301707650534809
None Run 02:
Highest Train: 100.00
Highest Valid: 82.20
  Final Train: 100.00
   Final Test: 79.30
Split: 01, Run: 03
None time:  1.803220132831484
None Run 03:
Highest Train: 100.00
Highest Valid: 81.60
  Final Train: 100.00
   Final Test: 79.10
run time now: 5.049852132797241
total time:  5.10755088320002
None All runs:
Highest Train: 100.00 ± 0.00
Highest Valid: 81.33 ± 1.03
  Final Train: 100.00 ± 0.00
   Final Test: 78.13 ± 1.85
[I 2023-06-12 00:15:41,703] Trial 36 finished with value: 81.33333587646484 and parameters: {'Fwd': 3.254363763525761e-05, 'K': 8, 'alpha': 0.8500000000000001, 'dropout': 0.5, 'gnnepoch': 90, 'lambda1': 0.30000000000000004, 'lambda2': 9.339513797973689, 'loop': 1, 'loss': 'MSE', 'lr': 0.0016308630800190974, 'softmaxF': True, 'useGCN': False, 'weight_decay': 6.266588524462078e-05, 'weightedloss': True}. Best is trial 36 with value: 81.33333587646484.
/home/wxy/miniconda3/lib/python3.10/site-packages/optuna/distributions.py:685: UserWarning: The distribution is specified by [0, 1.00001] and step=0.05, but the range is not divisible by `step`. It will be replaced by [0, 1.0].
  warnings.warn(
K:  10
alpha:  0.9500000000000001
lr:  0.0014996172924092192
weight_decay:  0.00011562658189151232
dropout:  0.5
fix split and run 3 times
Data: Data(x=[19717, 500], y=[19717], train_mask=[19717], val_mask=[19717], test_mask=[19717], adj_t=[19717, 19717, nnz=88648])
num_train tensor(60)
num_noise 0
noise: tensor(0)
data feature 500
ALTOPT(
  (lins): Sequential(
    (0): Linear(in_features=500, out_features=64, bias=True)
    (1): BatchNorm1d(64, eps=1e-05, momentum=0.1, affine=True, track_running_stats=True)
    (2): Dropout(p=0.5, inplace=True)
    (3): ReLU(inplace=True)
    (4): Linear(in_features=64, out_features=3, bias=True)
    (5): LogSoftmax(dim=-1)
  )
  (prop): Propagation(K=10, mode=None, lambda1=None, lambda2=None, L21=True, alpha=0.9500000000000001)
  (gcn): GCN(
    (convs): ModuleList(
      (0): GCNConv(500, 64)
      (1): GCNConv(64, 3)
    )
    (bns): ModuleList(
      (0): BatchNorm1d(64, eps=1e-05, momentum=0.1, affine=True, track_running_stats=True)
    )
    (output): LogSoftmax(dim=-1)
  )
)
propagate done
init label
Split: 01, Run: 01
None time:  0.7568022250197828
None Run 01:
Highest Train: 100.00
Highest Valid: 71.40
  Final Train: 100.00
   Final Test: 71.00
Split: 01, Run: 02
None time:  1.249126638052985
None Run 02:
Highest Train: 100.00
Highest Valid: 80.60
  Final Train: 98.33
   Final Test: 77.30
Split: 01, Run: 03
None time:  1.2475493580568582
None Run 03:
Highest Train: 100.00
Highest Valid: 82.40
  Final Train: 100.00
   Final Test: 79.70
run time now: 3.299283504486084
total time:  3.3497717091813684
None All runs:
Highest Train: 100.00 ± 0.00
Highest Valid: 78.13 ± 5.90
  Final Train: 99.44 ± 0.96
   Final Test: 76.00 ± 4.49
[I 2023-06-12 00:15:45,492] Trial 37 finished with value: 78.13333129882812 and parameters: {'Fwd': 3.68893774618669e-05, 'K': 10, 'alpha': 0.9500000000000001, 'dropout': 0.5, 'gnnepoch': 80, 'lambda1': 0.15000000000000002, 'lambda2': 8.61918397558096, 'loop': 1, 'loss': 'CE', 'lr': 0.0014996172924092192, 'softmaxF': True, 'useGCN': False, 'weight_decay': 0.00011562658189151232, 'weightedloss': True}. Best is trial 36 with value: 81.33333587646484.
/home/wxy/miniconda3/lib/python3.10/site-packages/optuna/distributions.py:685: UserWarning: The distribution is specified by [0, 1.00001] and step=0.05, but the range is not divisible by `step`. It will be replaced by [0, 1.0].
  warnings.warn(
K:  8
alpha:  0.8500000000000001
lr:  0.000811843970480752
weight_decay:  2.3001518109084836e-05
dropout:  0.6000000000000001
fix split and run 3 times
Data: Data(x=[19717, 500], y=[19717], train_mask=[19717], val_mask=[19717], test_mask=[19717], adj_t=[19717, 19717, nnz=88648])
num_train tensor(60)
num_noise 0
noise: tensor(0)
data feature 500
ALTOPT(
  (lins): Sequential(
    (0): Linear(in_features=500, out_features=64, bias=True)
    (1): BatchNorm1d(64, eps=1e-05, momentum=0.1, affine=True, track_running_stats=True)
    (2): Dropout(p=0.6000000000000001, inplace=True)
    (3): ReLU(inplace=True)
    (4): Linear(in_features=64, out_features=3, bias=True)
    (5): Identity()
  )
  (prop): Propagation(K=8, mode=None, lambda1=None, lambda2=None, L21=True, alpha=0.8500000000000001)
  (gcn): GCN(
    (convs): ModuleList(
      (0): GCNConv(500, 64)
      (1): GCNConv(64, 3)
    )
    (bns): ModuleList(
      (0): BatchNorm1d(64, eps=1e-05, momentum=0.1, affine=True, track_running_stats=True)
    )
    (output): Identity()
  )
)
propagate done
init label
Split: 01, Run: 01
None time:  0.5518262588884681
None Run 01:
Highest Train: 100.00
Highest Valid: 70.20
  Final Train: 100.00
   Final Test: 69.80
Split: 01, Run: 02
None time:  0.5490538361482322
None Run 02:
Highest Train: 100.00
Highest Valid: 70.20
  Final Train: 100.00
   Final Test: 69.80
Split: 01, Run: 03
None time:  0.5686111720278859
None Run 03:
Highest Train: 100.00
Highest Valid: 70.20
  Final Train: 100.00
   Final Test: 69.80
run time now: 1.7149019241333008
total time:  1.7622976119164377
None All runs:
Highest Train: 100.00 ± 0.00
Highest Valid: 70.20 ± 0.00
  Final Train: 100.00 ± 0.00
   Final Test: 69.80 ± 0.00
[I 2023-06-12 00:15:47,660] Trial 38 finished with value: 70.20000457763672 and parameters: {'Fwd': 9.345825326369705e-05, 'K': 8, 'alpha': 0.8500000000000001, 'dropout': 0.6000000000000001, 'gnnepoch': 0, 'lambda1': 0.30000000000000004, 'lambda2': 7.812623268504137, 'loop': 1, 'loss': 'MSE', 'lr': 0.000811843970480752, 'softmaxF': True, 'useGCN': True, 'weight_decay': 2.3001518109084836e-05, 'weightedloss': True}. Best is trial 36 with value: 81.33333587646484.
/home/wxy/miniconda3/lib/python3.10/site-packages/optuna/distributions.py:685: UserWarning: The distribution is specified by [0, 1.00001] and step=0.05, but the range is not divisible by `step`. It will be replaced by [0, 1.0].
  warnings.warn(
K:  9
alpha:  0.8500000000000001
lr:  0.003368657420026055
weight_decay:  0.00016977184836480867
dropout:  0.4
fix split and run 3 times
Data: Data(x=[19717, 500], y=[19717], train_mask=[19717], val_mask=[19717], test_mask=[19717], adj_t=[19717, 19717, nnz=88648])
num_train tensor(60)
num_noise 0
noise: tensor(0)
data feature 500
ALTOPT(
  (lins): Sequential(
    (0): Linear(in_features=500, out_features=64, bias=True)
    (1): BatchNorm1d(64, eps=1e-05, momentum=0.1, affine=True, track_running_stats=True)
    (2): Dropout(p=0.4, inplace=True)
    (3): ReLU(inplace=True)
    (4): Linear(in_features=64, out_features=3, bias=True)
    (5): Identity()
  )
  (prop): Propagation(K=9, mode=None, lambda1=None, lambda2=None, L21=True, alpha=0.8500000000000001)
  (gcn): GCN(
    (convs): ModuleList(
      (0): GCNConv(500, 64)
      (1): GCNConv(64, 3)
    )
    (bns): ModuleList(
      (0): BatchNorm1d(64, eps=1e-05, momentum=0.1, affine=True, track_running_stats=True)
    )
    (output): Identity()
  )
)
propagate done
init label
Split: 01, Run: 01
None time:  1.1520171568263322
None Run 01:
Highest Train: 100.00
Highest Valid: 76.80
  Final Train: 100.00
   Final Test: 74.00
Split: 01, Run: 02
None time:  0.936703909188509
None Run 02:
Highest Train: 100.00
Highest Valid: 81.00
  Final Train: 100.00
   Final Test: 77.10
Split: 01, Run: 03
None time:  1.4273100751452148
None Run 03:
Highest Train: 100.00
Highest Valid: 80.40
  Final Train: 100.00
   Final Test: 78.50
run time now: 3.5629661083221436
total time:  3.609211331931874
None All runs:
Highest Train: 100.00 ± 0.00
Highest Valid: 79.40 ± 2.27
  Final Train: 100.00 ± 0.00
   Final Test: 76.53 ± 2.30
[I 2023-06-12 00:15:51,732] Trial 39 finished with value: 79.4000015258789 and parameters: {'Fwd': 2.5486164759016817e-05, 'K': 9, 'alpha': 0.8500000000000001, 'dropout': 0.4, 'gnnepoch': 60, 'lambda1': 0.35000000000000003, 'lambda2': 9.388556105078365, 'loop': 1, 'loss': 'MSE', 'lr': 0.003368657420026055, 'softmaxF': False, 'useGCN': False, 'weight_decay': 0.00016977184836480867, 'weightedloss': True}. Best is trial 36 with value: 81.33333587646484.
/home/wxy/miniconda3/lib/python3.10/site-packages/optuna/distributions.py:685: UserWarning: The distribution is specified by [0, 1.00001] and step=0.05, but the range is not divisible by `step`. It will be replaced by [0, 1.0].
  warnings.warn(
K:  4
alpha:  0.75
lr:  0.00204636746728137
weight_decay:  6.933582710946928e-05
dropout:  0.7000000000000001
fix split and run 3 times
Data: Data(x=[19717, 500], y=[19717], train_mask=[19717], val_mask=[19717], test_mask=[19717], adj_t=[19717, 19717, nnz=88648])
num_train tensor(60)
num_noise 0
noise: tensor(0)
data feature 500
ALTOPT(
  (lins): Sequential(
    (0): Linear(in_features=500, out_features=64, bias=True)
    (1): BatchNorm1d(64, eps=1e-05, momentum=0.1, affine=True, track_running_stats=True)
    (2): Dropout(p=0.7000000000000001, inplace=True)
    (3): ReLU(inplace=True)
    (4): Linear(in_features=64, out_features=3, bias=True)
    (5): LogSoftmax(dim=-1)
  )
  (prop): Propagation(K=4, mode=None, lambda1=None, lambda2=None, L21=True, alpha=0.75)
  (gcn): GCN(
    (convs): ModuleList(
      (0): GCNConv(500, 64)
      (1): GCNConv(64, 3)
    )
    (bns): ModuleList(
      (0): BatchNorm1d(64, eps=1e-05, momentum=0.1, affine=True, track_running_stats=True)
    )
    (output): LogSoftmax(dim=-1)
  )
)
propagate done
init label
Split: 01, Run: 01
None time:  1.2928225679788738
None Run 01:
Highest Train: 100.00
Highest Valid: 80.40
  Final Train: 100.00
   Final Test: 77.40
Split: 01, Run: 02
None time:  1.2533313541207463
None Run 02:
Highest Train: 100.00
Highest Valid: 78.60
  Final Train: 100.00
   Final Test: 76.90
Split: 01, Run: 03
None time:  1.4109716890379786
None Run 03:
Highest Train: 100.00
Highest Valid: 79.00
  Final Train: 98.33
   Final Test: 78.50
run time now: 4.004641056060791
total time:  4.045858565950766
None All runs:
Highest Train: 100.00 ± 0.00
Highest Valid: 79.33 ± 0.95
  Final Train: 99.44 ± 0.96
   Final Test: 77.60 ± 0.82
[I 2023-06-12 00:15:56,275] Trial 40 finished with value: 79.33333587646484 and parameters: {'Fwd': 0.0003789720970051278, 'K': 4, 'alpha': 0.75, 'dropout': 0.7000000000000001, 'gnnepoch': 90, 'lambda1': 0.9, 'lambda2': 8.691050602649428, 'loop': 2, 'loss': 'CE', 'lr': 0.00204636746728137, 'softmaxF': True, 'useGCN': False, 'weight_decay': 6.933582710946928e-05, 'weightedloss': True}. Best is trial 36 with value: 81.33333587646484.
/home/wxy/miniconda3/lib/python3.10/site-packages/optuna/distributions.py:685: UserWarning: The distribution is specified by [0, 1.00001] and step=0.05, but the range is not divisible by `step`. It will be replaced by [0, 1.0].
  warnings.warn(
K:  7
alpha:  0.55
lr:  0.002491215445057662
weight_decay:  5.926245939308773e-05
dropout:  0.4
fix split and run 3 times
Data: Data(x=[19717, 500], y=[19717], train_mask=[19717], val_mask=[19717], test_mask=[19717], adj_t=[19717, 19717, nnz=88648])
num_train tensor(60)
num_noise 0
noise: tensor(0)
data feature 500
ALTOPT(
  (lins): Sequential(
    (0): Linear(in_features=500, out_features=64, bias=True)
    (1): BatchNorm1d(64, eps=1e-05, momentum=0.1, affine=True, track_running_stats=True)
    (2): Dropout(p=0.4, inplace=True)
    (3): ReLU(inplace=True)
    (4): Linear(in_features=64, out_features=3, bias=True)
    (5): Identity()
  )
  (prop): Propagation(K=7, mode=None, lambda1=None, lambda2=None, L21=True, alpha=0.55)
  (gcn): GCN(
    (convs): ModuleList(
      (0): GCNConv(500, 64)
      (1): GCNConv(64, 3)
    )
    (bns): ModuleList(
      (0): BatchNorm1d(64, eps=1e-05, momentum=0.1, affine=True, track_running_stats=True)
    )
    (output): Identity()
  )
)
propagate done
init label
Split: 01, Run: 01
None time:  1.5733343390747905
None Run 01:
Highest Train: 100.00
Highest Valid: 77.80
  Final Train: 100.00
   Final Test: 76.10
Split: 01, Run: 02
None time:  1.5355609050020576
None Run 02:
Highest Train: 100.00
Highest Valid: 80.00
  Final Train: 100.00
   Final Test: 78.20
Split: 01, Run: 03
None time:  1.3061060179024935
None Run 03:
Highest Train: 100.00
Highest Valid: 77.40
  Final Train: 100.00
   Final Test: 77.20
run time now: 4.463326454162598
total time:  4.511985719902441
None All runs:
Highest Train: 100.00 ± 0.00
Highest Valid: 78.40 ± 1.40
  Final Train: 100.00 ± 0.00
   Final Test: 77.17 ± 1.05
[I 2023-06-12 00:16:01,342] Trial 41 finished with value: 78.4000015258789 and parameters: {'Fwd': 5.034774383025325e-05, 'K': 7, 'alpha': 0.55, 'dropout': 0.4, 'gnnepoch': 100, 'lambda1': 0.4, 'lambda2': 9.498308122662904, 'loop': 1, 'loss': 'MSE', 'lr': 0.002491215445057662, 'softmaxF': True, 'useGCN': False, 'weight_decay': 5.926245939308773e-05, 'weightedloss': True}. Best is trial 36 with value: 81.33333587646484.
/home/wxy/miniconda3/lib/python3.10/site-packages/optuna/distributions.py:685: UserWarning: The distribution is specified by [0, 1.00001] and step=0.05, but the range is not divisible by `step`. It will be replaced by [0, 1.0].
  warnings.warn(
K:  8
alpha:  0.65
lr:  0.004027134861033404
weight_decay:  9.576389239146771e-05
dropout:  0.2
fix split and run 3 times
Data: Data(x=[19717, 500], y=[19717], train_mask=[19717], val_mask=[19717], test_mask=[19717], adj_t=[19717, 19717, nnz=88648])
num_train tensor(60)
num_noise 0
noise: tensor(0)
data feature 500
ALTOPT(
  (lins): Sequential(
    (0): Linear(in_features=500, out_features=64, bias=True)
    (1): BatchNorm1d(64, eps=1e-05, momentum=0.1, affine=True, track_running_stats=True)
    (2): Dropout(p=0.2, inplace=True)
    (3): ReLU(inplace=True)
    (4): Linear(in_features=64, out_features=3, bias=True)
    (5): Identity()
  )
  (prop): Propagation(K=8, mode=None, lambda1=None, lambda2=None, L21=True, alpha=0.65)
  (gcn): GCN(
    (convs): ModuleList(
      (0): GCNConv(500, 64)
      (1): GCNConv(64, 3)
    )
    (bns): ModuleList(
      (0): BatchNorm1d(64, eps=1e-05, momentum=0.1, affine=True, track_running_stats=True)
    )
    (output): Identity()
  )
)
propagate done
init label
Split: 01, Run: 01
None time:  1.3985422258265316
None Run 01:
Highest Train: 100.00
Highest Valid: 80.40
  Final Train: 100.00
   Final Test: 78.90
Split: 01, Run: 02
None time:  0.9963717269711196
None Run 02:
Highest Train: 100.00
Highest Valid: 78.20
  Final Train: 100.00
   Final Test: 78.40
Split: 01, Run: 03
None time:  1.4385246629826725
None Run 03:
Highest Train: 100.00
Highest Valid: 78.80
  Final Train: 100.00
   Final Test: 77.70
run time now: 3.885507106781006
total time:  3.93540320196189
None All runs:
Highest Train: 100.00 ± 0.00
Highest Valid: 79.13 ± 1.14
  Final Train: 100.00 ± 0.00
   Final Test: 78.33 ± 0.60
[I 2023-06-12 00:16:05,671] Trial 42 finished with value: 79.13333129882812 and parameters: {'Fwd': 8.367588444518429e-05, 'K': 8, 'alpha': 0.65, 'dropout': 0.2, 'gnnepoch': 100, 'lambda1': 0.45, 'lambda2': 9.462412554850559, 'loop': 1, 'loss': 'MSE', 'lr': 0.004027134861033404, 'softmaxF': True, 'useGCN': False, 'weight_decay': 9.576389239146771e-05, 'weightedloss': True}. Best is trial 36 with value: 81.33333587646484.
/home/wxy/miniconda3/lib/python3.10/site-packages/optuna/distributions.py:685: UserWarning: The distribution is specified by [0, 1.00001] and step=0.05, but the range is not divisible by `step`. It will be replaced by [0, 1.0].
  warnings.warn(
K:  6
alpha:  0.75
lr:  0.003268950904368674
weight_decay:  4.681525008442185e-05
dropout:  0.5
fix split and run 3 times
Data: Data(x=[19717, 500], y=[19717], train_mask=[19717], val_mask=[19717], test_mask=[19717], adj_t=[19717, 19717, nnz=88648])
num_train tensor(60)
num_noise 0
noise: tensor(0)
data feature 500
ALTOPT(
  (lins): Sequential(
    (0): Linear(in_features=500, out_features=64, bias=True)
    (1): BatchNorm1d(64, eps=1e-05, momentum=0.1, affine=True, track_running_stats=True)
    (2): Dropout(p=0.5, inplace=True)
    (3): ReLU(inplace=True)
    (4): Linear(in_features=64, out_features=3, bias=True)
    (5): Identity()
  )
  (prop): Propagation(K=6, mode=None, lambda1=None, lambda2=None, L21=True, alpha=0.75)
  (gcn): GCN(
    (convs): ModuleList(
      (0): GCNConv(500, 64)
      (1): GCNConv(64, 3)
    )
    (bns): ModuleList(
      (0): BatchNorm1d(64, eps=1e-05, momentum=0.1, affine=True, track_running_stats=True)
    )
    (output): Identity()
  )
)
propagate done
init label
Split: 01, Run: 01
None time:  1.2448759800754488
None Run 01:
Highest Train: 100.00
Highest Valid: 78.20
  Final Train: 100.00
   Final Test: 75.30
Split: 01, Run: 02
None time:  1.1983788618817925
None Run 02:
Highest Train: 100.00
Highest Valid: 80.40
  Final Train: 100.00
   Final Test: 78.00
Split: 01, Run: 03
None time:  1.3785957868676633
None Run 03:
Highest Train: 100.00
Highest Valid: 80.20
  Final Train: 100.00
   Final Test: 76.70
run time now: 3.8655905723571777
total time:  3.9110222591552883
None All runs:
Highest Train: 100.00 ± 0.00
Highest Valid: 79.60 ± 1.22
  Final Train: 100.00 ± 0.00
   Final Test: 76.67 ± 1.35
[I 2023-06-12 00:16:10,065] Trial 43 finished with value: 79.5999984741211 and parameters: {'Fwd': 3.344574236572565e-05, 'K': 6, 'alpha': 0.75, 'dropout': 0.5, 'gnnepoch': 90, 'lambda1': 0.30000000000000004, 'lambda2': 9.99370752524815, 'loop': 1, 'loss': 'MSE', 'lr': 0.003268950904368674, 'softmaxF': True, 'useGCN': False, 'weight_decay': 4.681525008442185e-05, 'weightedloss': False}. Best is trial 36 with value: 81.33333587646484.
/home/wxy/miniconda3/lib/python3.10/site-packages/optuna/distributions.py:685: UserWarning: The distribution is specified by [0, 1.00001] and step=0.05, but the range is not divisible by `step`. It will be replaced by [0, 1.0].
  warnings.warn(
K:  5
alpha:  0.9
lr:  0.0016081080215640856
weight_decay:  2.2552514549796766e-05
dropout:  0.30000000000000004
fix split and run 3 times
Data: Data(x=[19717, 500], y=[19717], train_mask=[19717], val_mask=[19717], test_mask=[19717], adj_t=[19717, 19717, nnz=88648])
num_train tensor(60)
num_noise 0
noise: tensor(0)
data feature 500
ALTOPT(
  (lins): Sequential(
    (0): Linear(in_features=500, out_features=64, bias=True)
    (1): BatchNorm1d(64, eps=1e-05, momentum=0.1, affine=True, track_running_stats=True)
    (2): Dropout(p=0.30000000000000004, inplace=True)
    (3): ReLU(inplace=True)
    (4): Linear(in_features=64, out_features=3, bias=True)
    (5): Identity()
  )
  (prop): Propagation(K=5, mode=None, lambda1=None, lambda2=None, L21=True, alpha=0.9)
  (gcn): GCN(
    (convs): ModuleList(
      (0): GCNConv(500, 64)
      (1): GCNConv(64, 3)
    )
    (bns): ModuleList(
      (0): BatchNorm1d(64, eps=1e-05, momentum=0.1, affine=True, track_running_stats=True)
    )
    (output): Identity()
  )
)
propagate done
init label
Split: 01, Run: 01
None time:  0.7596119970548898
None Run 01:
Highest Train: 100.00
Highest Valid: 78.00
  Final Train: 100.00
   Final Test: 75.30
Split: 01, Run: 02
None time:  1.1705846211407334
None Run 02:
Highest Train: 100.00
Highest Valid: 78.80
  Final Train: 100.00
   Final Test: 76.50
Split: 01, Run: 03
None time:  1.0375963980332017
None Run 03:
Highest Train: 100.00
Highest Valid: 80.40
  Final Train: 100.00
   Final Test: 77.90
run time now: 3.0089001655578613
total time:  3.0575669889803976
None All runs:
Highest Train: 100.00 ± 0.00
Highest Valid: 79.07 ± 1.22
  Final Train: 100.00 ± 0.00
   Final Test: 76.57 ± 1.30
