[I 2023-06-12 00:17:28,122] Trial 43 finished with value: 78.79999542236328 and parameters: {'Fwd': 0.003719387247729223, 'K': 4, 'alpha': 0.6000000000000001, 'dropout': 0.1, 'gnnepoch': 60, 'lambda1': 0.05, 'lambda2': 7.0010777048156045, 'loop': 1, 'loss': 'MSE', 'lr': 0.004771297032897276, 'softmaxF': False, 'useGCN': True, 'weight_decay': 0.0007697649444636374, 'weightedloss': True}. Best is trial 31 with value: 80.26666259765625.
/home/wxy/miniconda3/lib/python3.10/site-packages/optuna/distributions.py:685: UserWarning: The distribution is specified by [0, 1.00001] and step=0.05, but the range is not divisible by `step`. It will be replaced by [0, 1.0].
  warnings.warn(
K:  6
alpha:  0.9
lr:  0.0029431624598387353
weight_decay:  0.00030552335796661786
dropout:  0.5
fix split and run 3 times
Data: Data(x=[2708, 1433], y=[2708], train_mask=[2708], val_mask=[2708], test_mask=[2708], adj_t=[2708, 2708, nnz=10556])
num_train tensor(140)
num_noise 0
noise: tensor(0)
data feature 1433
ALTOPT(
  (lins): Sequential(
    (0): Linear(in_features=1433, out_features=64, bias=True)
    (1): BatchNorm1d(64, eps=1e-05, momentum=0.1, affine=True, track_running_stats=True)
    (2): Dropout(p=0.5, inplace=True)
    (3): ReLU(inplace=True)
    (4): Linear(in_features=64, out_features=7, bias=True)
    (5): Identity()
  )
  (prop): Propagation(K=6, mode=None, lambda1=None, lambda2=None, L21=True, alpha=0.9)
  (gcn): GCN(
    (convs): ModuleList(
      (0): GCNConv(1433, 64)
      (1): GCNConv(64, 7)
    )
    (bns): ModuleList(
      (0): BatchNorm1d(64, eps=1e-05, momentum=0.1, affine=True, track_running_stats=True)
    )
    (output): Identity()
  )
)
propagate done
init label
Split: 01, Run: 01
None time:  2.0193218691274524
None Run 01:
Highest Train: 100.00
Highest Valid: 80.00
  Final Train: 100.00
   Final Test: 81.00
Split: 01, Run: 02
None time:  1.9928574978839606
None Run 02:
Highest Train: 100.00
Highest Valid: 80.20
  Final Train: 100.00
   Final Test: 80.00
Split: 01, Run: 03
None time:  1.7522959529887885
None Run 03:
Highest Train: 100.00
Highest Valid: 79.60
  Final Train: 100.00
   Final Test: 80.90
run time now: 5.790924549102783
total time:  5.824409681139514
None All runs:
Highest Train: 100.00 ± 0.00
Highest Valid: 79.93 ± 0.31
  Final Train: 100.00 ± 0.00
   Final Test: 80.63 ± 0.55
[I 2023-06-12 00:17:34,458] Trial 44 finished with value: 79.9333267211914 and parameters: {'Fwd': 0.008491291367841481, 'K': 6, 'alpha': 0.9, 'dropout': 0.5, 'gnnepoch': 80, 'lambda1': 0.2, 'lambda2': 4.003470268826169, 'loop': 1, 'loss': 'MSE', 'lr': 0.0029431624598387353, 'softmaxF': True, 'useGCN': True, 'weight_decay': 0.00030552335796661786, 'weightedloss': True}. Best is trial 31 with value: 80.26666259765625.
/home/wxy/miniconda3/lib/python3.10/site-packages/optuna/distributions.py:685: UserWarning: The distribution is specified by [0, 1.00001] and step=0.05, but the range is not divisible by `step`. It will be replaced by [0, 1.0].
  warnings.warn(
K:  7
alpha:  0.9
lr:  0.0029007472486060897
weight_decay:  0.00029125633818752317
dropout:  0.5
fix split and run 3 times
Data: Data(x=[2708, 1433], y=[2708], train_mask=[2708], val_mask=[2708], test_mask=[2708], adj_t=[2708, 2708, nnz=10556])
num_train tensor(140)
num_noise 0
noise: tensor(0)
data feature 1433
ALTOPT(
  (lins): Sequential(
    (0): Linear(in_features=1433, out_features=64, bias=True)
    (1): BatchNorm1d(64, eps=1e-05, momentum=0.1, affine=True, track_running_stats=True)
    (2): Dropout(p=0.5, inplace=True)
    (3): ReLU(inplace=True)
    (4): Linear(in_features=64, out_features=7, bias=True)
    (5): Identity()
  )
  (prop): Propagation(K=7, mode=None, lambda1=None, lambda2=None, L21=True, alpha=0.9)
  (gcn): GCN(
    (convs): ModuleList(
      (0): GCNConv(1433, 64)
      (1): GCNConv(64, 7)
    )
    (bns): ModuleList(
      (0): BatchNorm1d(64, eps=1e-05, momentum=0.1, affine=True, track_running_stats=True)
    )
    (output): Identity()
  )
)
propagate done
init label
Split: 01, Run: 01
None time:  1.8264561160467565
None Run 01:
Highest Train: 100.00
Highest Valid: 80.40
  Final Train: 100.00
   Final Test: 80.90
Split: 01, Run: 02, Epoch: 100, Loss: 0.0000, Train: 100.00%, Valid: 79.40% Test: 81.70%
Split: 01, Run: 02
None time:  3.342934186803177
None Run 02:
Highest Train: 100.00
Highest Valid: 79.40
  Final Train: 100.00
   Final Test: 81.60
Split: 01, Run: 03, Epoch: 100, Loss: 0.0000, Train: 100.00%, Valid: 79.80% Test: 80.70%
Split: 01, Run: 03
None time:  3.774675684981048
None Run 03:
Highest Train: 100.00
Highest Valid: 79.80
  Final Train: 100.00
   Final Test: 80.70
run time now: 8.971490144729614
total time:  8.989357847021893
None All runs:
Highest Train: 100.00 ± 0.00
Highest Valid: 79.87 ± 0.50
  Final Train: 100.00 ± 0.00
   Final Test: 81.07 ± 0.47
[I 2023-06-12 00:17:43,889] Trial 45 finished with value: 79.86666870117188 and parameters: {'Fwd': 0.0073819880302618, 'K': 7, 'alpha': 0.9, 'dropout': 0.5, 'gnnepoch': 90, 'lambda1': 0.25, 'lambda2': 3.9456046951084573, 'loop': 0, 'loss': 'MSE', 'lr': 0.0029007472486060897, 'softmaxF': True, 'useGCN': True, 'weight_decay': 0.00029125633818752317, 'weightedloss': False}. Best is trial 31 with value: 80.26666259765625.
/home/wxy/miniconda3/lib/python3.10/site-packages/optuna/distributions.py:685: UserWarning: The distribution is specified by [0, 1.00001] and step=0.05, but the range is not divisible by `step`. It will be replaced by [0, 1.0].
  warnings.warn(
K:  6
alpha:  0.9
lr:  0.002414996960832458
weight_decay:  0.00012184896969613897
dropout:  0.30000000000000004
fix split and run 3 times
Data: Data(x=[2708, 1433], y=[2708], train_mask=[2708], val_mask=[2708], test_mask=[2708], adj_t=[2708, 2708, nnz=10556])
num_train tensor(140)
num_noise 0
noise: tensor(0)
data feature 1433
ALTOPT(
  (lins): Sequential(
    (0): Linear(in_features=1433, out_features=64, bias=True)
    (1): BatchNorm1d(64, eps=1e-05, momentum=0.1, affine=True, track_running_stats=True)
    (2): Dropout(p=0.30000000000000004, inplace=True)
    (3): ReLU(inplace=True)
    (4): Linear(in_features=64, out_features=7, bias=True)
    (5): Identity()
  )
  (prop): Propagation(K=6, mode=None, lambda1=None, lambda2=None, L21=True, alpha=0.9)
  (gcn): GCN(
    (convs): ModuleList(
      (0): GCNConv(1433, 64)
      (1): GCNConv(64, 7)
    )
    (bns): ModuleList(
      (0): BatchNorm1d(64, eps=1e-05, momentum=0.1, affine=True, track_running_stats=True)
    )
    (output): Identity()
  )
)
propagate done
init label
Split: 01, Run: 01
None time:  2.0892411270178854
None Run 01:
Highest Train: 100.00
Highest Valid: 79.80
  Final Train: 100.00
   Final Test: 80.30
Split: 01, Run: 02
None time:  3.4914683680981398
None Run 02:
Highest Train: 100.00
Highest Valid: 80.40
  Final Train: 100.00
   Final Test: 80.50
Split: 01, Run: 03, Epoch: 100, Loss: 0.0771, Train: 100.00%, Valid: 80.00% Test: 80.70%
Split: 01, Run: 03
None time:  4.901584197068587
None Run 03:
Highest Train: 100.00
Highest Valid: 80.20
  Final Train: 100.00
   Final Test: 80.80
run time now: 10.507185220718384
total time:  10.529062452027574
None All runs:
Highest Train: 100.00 ± 0.00
Highest Valid: 80.13 ± 0.31
  Final Train: 100.00 ± 0.00
   Final Test: 80.53 ± 0.25
[I 2023-06-12 00:17:54,926] Trial 46 finished with value: 80.13333129882812 and parameters: {'Fwd': 0.021582964921109296, 'K': 6, 'alpha': 0.9, 'dropout': 0.30000000000000004, 'gnnepoch': 80, 'lambda1': 0.2, 'lambda2': 3.676169793152593, 'loop': 1, 'loss': 'MSE', 'lr': 0.002414996960832458, 'softmaxF': True, 'useGCN': True, 'weight_decay': 0.00012184896969613897, 'weightedloss': True}. Best is trial 31 with value: 80.26666259765625.
/home/wxy/miniconda3/lib/python3.10/site-packages/optuna/distributions.py:685: UserWarning: The distribution is specified by [0, 1.00001] and step=0.05, but the range is not divisible by `step`. It will be replaced by [0, 1.0].
  warnings.warn(
K:  7
alpha:  0.7000000000000001
lr:  0.0022815188336940163
weight_decay:  0.00011750703339645701
dropout:  0.2
fix split and run 3 times
Data: Data(x=[2708, 1433], y=[2708], train_mask=[2708], val_mask=[2708], test_mask=[2708], adj_t=[2708, 2708, nnz=10556])
num_train tensor(140)
num_noise 0
noise: tensor(0)
data feature 1433
ALTOPT(
  (lins): Sequential(
    (0): Linear(in_features=1433, out_features=64, bias=True)
    (1): BatchNorm1d(64, eps=1e-05, momentum=0.1, affine=True, track_running_stats=True)
    (2): Dropout(p=0.2, inplace=True)
    (3): ReLU(inplace=True)
    (4): Linear(in_features=64, out_features=7, bias=True)
    (5): Identity()
  )
  (prop): Propagation(K=7, mode=None, lambda1=None, lambda2=None, L21=True, alpha=0.7000000000000001)
  (gcn): GCN(
    (convs): ModuleList(
      (0): GCNConv(1433, 64)
      (1): GCNConv(64, 7)
    )
    (bns): ModuleList(
      (0): BatchNorm1d(64, eps=1e-05, momentum=0.1, affine=True, track_running_stats=True)
    )
    (output): Identity()
  )
)
propagate done
init label
Split: 01, Run: 01
None time:  1.2950315449852496
None Run 01:
Highest Train: 100.00
Highest Valid: 79.20
  Final Train: 100.00
   Final Test: 78.20
Split: 01, Run: 02
None time:  1.7443430009298027
None Run 02:
Highest Train: 100.00
Highest Valid: 79.40
  Final Train: 100.00
   Final Test: 79.70
Split: 01, Run: 03
None time:  1.3182841709349304
None Run 03:
Highest Train: 100.00
Highest Valid: 79.00
  Final Train: 100.00
   Final Test: 80.70
run time now: 4.38327693939209
total time:  4.404881889000535
None All runs:
Highest Train: 100.00 ± 0.00
Highest Valid: 79.20 ± 0.20
  Final Train: 100.00 ± 0.00
   Final Test: 79.53 ± 1.26
[I 2023-06-12 00:17:59,755] Trial 47 finished with value: 79.20000457763672 and parameters: {'Fwd': 0.0013150456086694084, 'K': 7, 'alpha': 0.7000000000000001, 'dropout': 0.2, 'gnnepoch': 100, 'lambda1': 0.30000000000000004, 'lambda2': 3.1602834313783985, 'loop': 1, 'loss': 'MSE', 'lr': 0.0022815188336940163, 'softmaxF': True, 'useGCN': False, 'weight_decay': 0.00011750703339645701, 'weightedloss': True}. Best is trial 31 with value: 80.26666259765625.
/home/wxy/miniconda3/lib/python3.10/site-packages/optuna/distributions.py:685: UserWarning: The distribution is specified by [0, 1.00001] and step=0.05, but the range is not divisible by `step`. It will be replaced by [0, 1.0].
  warnings.warn(
K:  3
alpha:  0.9500000000000001
lr:  0.003691203883591762
weight_decay:  2.786997076763642e-05
dropout:  0.4
fix split and run 3 times
Data: Data(x=[2708, 1433], y=[2708], train_mask=[2708], val_mask=[2708], test_mask=[2708], adj_t=[2708, 2708, nnz=10556])
num_train tensor(140)
num_noise 0
noise: tensor(0)
data feature 1433
ALTOPT(
  (lins): Sequential(
    (0): Linear(in_features=1433, out_features=64, bias=True)
    (1): BatchNorm1d(64, eps=1e-05, momentum=0.1, affine=True, track_running_stats=True)
    (2): Dropout(p=0.4, inplace=True)
    (3): ReLU(inplace=True)
    (4): Linear(in_features=64, out_features=7, bias=True)
    (5): Identity()
  )
  (prop): Propagation(K=3, mode=None, lambda1=None, lambda2=None, L21=True, alpha=0.9500000000000001)
  (gcn): GCN(
    (convs): ModuleList(
      (0): GCNConv(1433, 64)
      (1): GCNConv(64, 7)
    )
    (bns): ModuleList(
      (0): BatchNorm1d(64, eps=1e-05, momentum=0.1, affine=True, track_running_stats=True)
    )
    (output): Identity()
  )
)
propagate done
init label
Split: 01, Run: 01
None time:  1.8550740899518132
None Run 01:
Highest Train: 100.00
Highest Valid: 79.80
  Final Train: 100.00
   Final Test: 80.00
Split: 01, Run: 02
None time:  1.6761167428921908
None Run 02:
Highest Train: 100.00
Highest Valid: 79.20
  Final Train: 100.00
   Final Test: 80.90
Split: 01, Run: 03
None time:  2.7584837439935654
None Run 03:
Highest Train: 100.00
Highest Valid: 80.60
  Final Train: 100.00
   Final Test: 81.40
run time now: 6.314002275466919
total time:  6.334478090982884
None All runs:
Highest Train: 100.00 ± 0.00
Highest Valid: 79.87 ± 0.70
  Final Train: 100.00 ± 0.00
   Final Test: 80.77 ± 0.71
[I 2023-06-12 00:18:06,544] Trial 48 finished with value: 79.86666870117188 and parameters: {'Fwd': 0.017586720851628802, 'K': 3, 'alpha': 0.9500000000000001, 'dropout': 0.4, 'gnnepoch': 80, 'lambda1': 0.2, 'lambda2': 5.702726621696998, 'loop': 1, 'loss': 'MSE', 'lr': 0.003691203883591762, 'softmaxF': True, 'useGCN': True, 'weight_decay': 2.786997076763642e-05, 'weightedloss': True}. Best is trial 31 with value: 80.26666259765625.
/home/wxy/miniconda3/lib/python3.10/site-packages/optuna/distributions.py:685: UserWarning: The distribution is specified by [0, 1.00001] and step=0.05, but the range is not divisible by `step`. It will be replaced by [0, 1.0].
  warnings.warn(
K:  8
alpha:  0.45
lr:  0.0023537650116958477
weight_decay:  0.0001226506563958736
dropout:  0.30000000000000004
fix split and run 3 times
Data: Data(x=[2708, 1433], y=[2708], train_mask=[2708], val_mask=[2708], test_mask=[2708], adj_t=[2708, 2708, nnz=10556])
num_train tensor(140)
num_noise 0
noise: tensor(0)
data feature 1433
ALTOPT(
  (lins): Sequential(
    (0): Linear(in_features=1433, out_features=64, bias=True)
    (1): BatchNorm1d(64, eps=1e-05, momentum=0.1, affine=True, track_running_stats=True)
    (2): Dropout(p=0.30000000000000004, inplace=True)
    (3): ReLU(inplace=True)
    (4): Linear(in_features=64, out_features=7, bias=True)
    (5): Identity()
  )
  (prop): Propagation(K=8, mode=None, lambda1=None, lambda2=None, L21=True, alpha=0.45)
  (gcn): GCN(
    (convs): ModuleList(
      (0): GCNConv(1433, 64)
      (1): GCNConv(64, 7)
    )
    (bns): ModuleList(
      (0): BatchNorm1d(64, eps=1e-05, momentum=0.1, affine=True, track_running_stats=True)
    )
    (output): Identity()
  )
)
propagate done
init label
Split: 01, Run: 01
None time:  0.3473681949544698
None Run 01:
Highest Train: 100.00
Highest Valid: 66.80
  Final Train: 100.00
   Final Test: 68.20
Split: 01, Run: 02
None time:  0.24312358302995563
None Run 02:
Highest Train: 100.00
Highest Valid: 66.80
  Final Train: 100.00
   Final Test: 68.20
Split: 01, Run: 03
None time:  0.2210461930371821
None Run 03:
Highest Train: 100.00
Highest Valid: 66.80
  Final Train: 100.00
   Final Test: 68.20
run time now: 0.8650379180908203
total time:  0.8893820401281118
None All runs:
Highest Train: 100.00 ± 0.00
Highest Valid: 66.80 ± 0.00
  Final Train: 100.00 ± 0.00
   Final Test: 68.20 ± 0.00
[I 2023-06-12 00:18:07,913] Trial 49 finished with value: 66.79999542236328 and parameters: {'Fwd': 0.049834129512506896, 'K': 8, 'alpha': 0.45, 'dropout': 0.30000000000000004, 'gnnepoch': 0, 'lambda1': 0.35000000000000003, 'lambda2': 5.285187262626859, 'loop': 0, 'loss': 'MSE', 'lr': 0.0023537650116958477, 'softmaxF': True, 'useGCN': True, 'weight_decay': 0.0001226506563958736, 'weightedloss': False}. Best is trial 31 with value: 80.26666259765625.
/home/wxy/miniconda3/lib/python3.10/site-packages/optuna/distributions.py:685: UserWarning: The distribution is specified by [0, 1.00001] and step=0.05, but the range is not divisible by `step`. It will be replaced by [0, 1.0].
  warnings.warn(
K:  4
alpha:  0.6000000000000001
lr:  0.007724321580969404
weight_decay:  6.0161713381668695e-05
dropout:  0.1
fix split and run 3 times
Data: Data(x=[2708, 1433], y=[2708], train_mask=[2708], val_mask=[2708], test_mask=[2708], adj_t=[2708, 2708, nnz=10556])
num_train tensor(140)
num_noise 0
noise: tensor(0)
data feature 1433
ALTOPT(
  (lins): Sequential(
    (0): Linear(in_features=1433, out_features=64, bias=True)
    (1): BatchNorm1d(64, eps=1e-05, momentum=0.1, affine=True, track_running_stats=True)
    (2): Dropout(p=0.1, inplace=True)
    (3): ReLU(inplace=True)
    (4): Linear(in_features=64, out_features=7, bias=True)
    (5): Identity()
  )
  (prop): Propagation(K=4, mode=None, lambda1=None, lambda2=None, L21=True, alpha=0.6000000000000001)
  (gcn): GCN(
    (convs): ModuleList(
      (0): GCNConv(1433, 64)
      (1): GCNConv(64, 7)
    )
    (bns): ModuleList(
      (0): BatchNorm1d(64, eps=1e-05, momentum=0.1, affine=True, track_running_stats=True)
    )
    (output): Identity()
  )
)
propagate done
init label
Split: 01, Run: 01
None time:  1.5072248270735145
None Run 01:
Highest Train: 100.00
Highest Valid: 76.20
  Final Train: 100.00
   Final Test: 77.00
Split: 01, Run: 02
None time:  1.7298537760507315
None Run 02:
Highest Train: 100.00
Highest Valid: 77.20
  Final Train: 100.00
   Final Test: 79.10
Split: 01, Run: 03
None time:  2.2117500589229167
None Run 03:
Highest Train: 100.00
Highest Valid: 75.40
  Final Train: 100.00
   Final Test: 77.90
run time now: 5.475750684738159
total time:  5.494803857058287
None All runs:
Highest Train: 100.00 ± 0.00
Highest Valid: 76.27 ± 0.90
  Final Train: 100.00 ± 0.00
   Final Test: 78.00 ± 1.05
[I 2023-06-12 00:18:13,915] Trial 50 finished with value: 76.26667022705078 and parameters: {'Fwd': 0.003247962136425007, 'K': 4, 'alpha': 0.6000000000000001, 'dropout': 0.1, 'gnnepoch': 120, 'lambda1': 1.0, 'lambda2': 2.387546770826605, 'loop': 2, 'loss': 'MSE', 'lr': 0.007724321580969404, 'softmaxF': True, 'useGCN': False, 'weight_decay': 6.0161713381668695e-05, 'weightedloss': True}. Best is trial 31 with value: 80.26666259765625.
/home/wxy/miniconda3/lib/python3.10/site-packages/optuna/distributions.py:685: UserWarning: The distribution is specified by [0, 1.00001] and step=0.05, but the range is not divisible by `step`. It will be replaced by [0, 1.0].
  warnings.warn(
K:  6
alpha:  0.9
lr:  0.002682123183134981
weight_decay:  0.00029911505321239464
dropout:  0.2
fix split and run 3 times
Data: Data(x=[2708, 1433], y=[2708], train_mask=[2708], val_mask=[2708], test_mask=[2708], adj_t=[2708, 2708, nnz=10556])
num_train tensor(140)
num_noise 0
noise: tensor(0)
data feature 1433
ALTOPT(
  (lins): Sequential(
    (0): Linear(in_features=1433, out_features=64, bias=True)
    (1): BatchNorm1d(64, eps=1e-05, momentum=0.1, affine=True, track_running_stats=True)
    (2): Dropout(p=0.2, inplace=True)
    (3): ReLU(inplace=True)
    (4): Linear(in_features=64, out_features=7, bias=True)
    (5): Identity()
  )
  (prop): Propagation(K=6, mode=None, lambda1=None, lambda2=None, L21=True, alpha=0.9)
  (gcn): GCN(
    (convs): ModuleList(
      (0): GCNConv(1433, 64)
      (1): GCNConv(64, 7)
    )
    (bns): ModuleList(
      (0): BatchNorm1d(64, eps=1e-05, momentum=0.1, affine=True, track_running_stats=True)
    )
    (output): Identity()
  )
)
propagate done
init label
Split: 01, Run: 01
None time:  2.0683599528856575
None Run 01:
Highest Train: 100.00
Highest Valid: 79.20
  Final Train: 100.00
   Final Test: 79.90
Split: 01, Run: 02
None time:  1.5407281580846757
None Run 02:
Highest Train: 100.00
Highest Valid: 80.00
  Final Train: 100.00
   Final Test: 80.30
Split: 01, Run: 03
None time:  2.1118865511380136
None Run 03:
Highest Train: 100.00
Highest Valid: 79.40
  Final Train: 100.00
   Final Test: 80.80
run time now: 5.7467732429504395
total time:  5.769970003981143
None All runs:
Highest Train: 100.00 ± 0.00
Highest Valid: 79.53 ± 0.42
  Final Train: 100.00 ± 0.00
   Final Test: 80.33 ± 0.45
[I 2023-06-12 00:18:20,132] Trial 51 finished with value: 79.53333282470703 and parameters: {'Fwd': 0.022804580487113767, 'K': 6, 'alpha': 0.9, 'dropout': 0.2, 'gnnepoch': 80, 'lambda1': 0.2, 'lambda2': 3.825922634097364, 'loop': 1, 'loss': 'MSE', 'lr': 0.002682123183134981, 'softmaxF': True, 'useGCN': True, 'weight_decay': 0.00029911505321239464, 'weightedloss': True}. Best is trial 31 with value: 80.26666259765625.
/home/wxy/miniconda3/lib/python3.10/site-packages/optuna/distributions.py:685: UserWarning: The distribution is specified by [0, 1.00001] and step=0.05, but the range is not divisible by `step`. It will be replaced by [0, 1.0].
  warnings.warn(
K:  6
alpha:  0.9500000000000001
lr:  0.003974451003145635
weight_decay:  0.0004004241875748034
dropout:  0.4
fix split and run 3 times
Data: Data(x=[2708, 1433], y=[2708], train_mask=[2708], val_mask=[2708], test_mask=[2708], adj_t=[2708, 2708, nnz=10556])
num_train tensor(140)
num_noise 0
noise: tensor(0)
data feature 1433
ALTOPT(
  (lins): Sequential(
    (0): Linear(in_features=1433, out_features=64, bias=True)
    (1): BatchNorm1d(64, eps=1e-05, momentum=0.1, affine=True, track_running_stats=True)
    (2): Dropout(p=0.4, inplace=True)
    (3): ReLU(inplace=True)
    (4): Linear(in_features=64, out_features=7, bias=True)
    (5): Identity()
  )
  (prop): Propagation(K=6, mode=None, lambda1=None, lambda2=None, L21=True, alpha=0.9500000000000001)
  (gcn): GCN(
    (convs): ModuleList(
      (0): GCNConv(1433, 64)
      (1): GCNConv(64, 7)
    )
    (bns): ModuleList(
      (0): BatchNorm1d(64, eps=1e-05, momentum=0.1, affine=True, track_running_stats=True)
    )
    (output): Identity()
  )
)
propagate done
init label
Split: 01, Run: 01
None time:  2.2401458469685167
None Run 01:
Highest Train: 100.00
Highest Valid: 80.00
  Final Train: 100.00
   Final Test: 80.10
Split: 01, Run: 02
None time:  2.0402822319883853
None Run 02:
Highest Train: 100.00
Highest Valid: 79.80
  Final Train: 100.00
   Final Test: 79.90
Split: 01, Run: 03
None time:  2.08783513517119
None Run 03:
Highest Train: 100.00
Highest Valid: 81.20
  Final Train: 100.00
   Final Test: 80.40
run time now: 6.396048307418823
total time:  6.419986434048042
None All runs:
Highest Train: 100.00 ± 0.00
Highest Valid: 80.33 ± 0.76
  Final Train: 100.00 ± 0.00
   Final Test: 80.13 ± 0.25
