[I 2023-06-12 00:16:50,595] Trial 835 finished with value: 68.5999984741211 and parameters: {'Fwd': 6.854195306394655e-06, 'K': 6, 'alpha': 0.5, 'dropout': 0.8, 'gnnepoch': 110, 'lambda1': 0.7000000000000001, 'lambda2': 6.171277572902375, 'loop': 0, 'loss': 'CE', 'lr': 0.00029232890115880796, 'softmaxF': False, 'useGCN': True, 'weight_decay': 9.832880064789281e-06, 'weightedloss': True}. Best is trial 605 with value: 72.13333129882812.
/home/wxy/miniconda3/lib/python3.10/site-packages/optuna/distributions.py:685: UserWarning: The distribution is specified by [0, 1.00001] and step=0.05, but the range is not divisible by `step`. It will be replaced by [0, 1.0].
  warnings.warn(
K:  7
alpha:  0.9
lr:  0.00018561531006447437
weight_decay:  0.0020486024234130946
dropout:  0.8
fix split and run 3 times
Data: Data(x=[3327, 3703], y=[3327], train_mask=[3327], val_mask=[3327], test_mask=[3327], adj_t=[3327, 3327, nnz=9104])
num_train tensor(120)
num_noise 0
noise: tensor(0)
data feature 3703
ALTOPT(
  (lins): Sequential(
    (0): Linear(in_features=3703, out_features=64, bias=True)
    (1): BatchNorm1d(64, eps=1e-05, momentum=0.1, affine=True, track_running_stats=True)
    (2): Dropout(p=0.8, inplace=True)
    (3): ReLU(inplace=True)
    (4): Linear(in_features=64, out_features=6, bias=True)
    (5): LogSoftmax(dim=-1)
  )
  (prop): Propagation(K=7, mode=None, lambda1=None, lambda2=None, L21=True, alpha=0.9)
  (gcn): GCN(
    (convs): ModuleList(
      (0): GCNConv(3703, 64)
      (1): GCNConv(64, 6)
    )
    (bns): ModuleList(
      (0): BatchNorm1d(64, eps=1e-05, momentum=0.1, affine=True, track_running_stats=True)
    )
    (output): LogSoftmax(dim=-1)
  )
)
propagate done
init label
Split: 01, Run: 01
None time:  2.067099146079272
None Run 01:
Highest Train: 100.00
Highest Valid: 68.40
  Final Train: 100.00
   Final Test: 68.30
Split: 01, Run: 02
None time:  2.382855898933485
None Run 02:
Highest Train: 100.00
Highest Valid: 69.20
  Final Train: 100.00
   Final Test: 69.80
Split: 01, Run: 03
None time:  2.1924002789892256
None Run 03:
Highest Train: 100.00
Highest Valid: 68.60
  Final Train: 100.00
   Final Test: 69.70
run time now: 6.691936731338501
total time:  6.73728335602209
None All runs:
Highest Train: 100.00 ± 0.00
Highest Valid: 68.73 ± 0.42
  Final Train: 100.00 ± 0.00
   Final Test: 69.27 ± 0.84
[I 2023-06-12 00:16:57,880] Trial 836 finished with value: 68.73333740234375 and parameters: {'Fwd': 0.0001308525139748968, 'K': 7, 'alpha': 0.9, 'dropout': 0.8, 'gnnepoch': 120, 'lambda1': 0.65, 'lambda2': 7.582260266421269, 'loop': 0, 'loss': 'CE', 'lr': 0.00018561531006447437, 'softmaxF': False, 'useGCN': True, 'weight_decay': 0.0020486024234130946, 'weightedloss': True}. Best is trial 605 with value: 72.13333129882812.
/home/wxy/miniconda3/lib/python3.10/site-packages/optuna/distributions.py:685: UserWarning: The distribution is specified by [0, 1.00001] and step=0.05, but the range is not divisible by `step`. It will be replaced by [0, 1.0].
  warnings.warn(
K:  9
alpha:  0.75
lr:  0.0001442057597205056
weight_decay:  3.566553572089515e-05
dropout:  0.8
fix split and run 3 times
Data: Data(x=[3327, 3703], y=[3327], train_mask=[3327], val_mask=[3327], test_mask=[3327], adj_t=[3327, 3327, nnz=9104])
num_train tensor(120)
num_noise 0
noise: tensor(0)
data feature 3703
ALTOPT(
  (lins): Sequential(
    (0): Linear(in_features=3703, out_features=64, bias=True)
    (1): BatchNorm1d(64, eps=1e-05, momentum=0.1, affine=True, track_running_stats=True)
    (2): Dropout(p=0.8, inplace=True)
    (3): ReLU(inplace=True)
    (4): Linear(in_features=64, out_features=6, bias=True)
    (5): LogSoftmax(dim=-1)
  )
  (prop): Propagation(K=9, mode=None, lambda1=None, lambda2=None, L21=True, alpha=0.75)
  (gcn): GCN(
    (convs): ModuleList(
      (0): GCNConv(3703, 64)
      (1): GCNConv(64, 6)
    )
    (bns): ModuleList(
      (0): BatchNorm1d(64, eps=1e-05, momentum=0.1, affine=True, track_running_stats=True)
    )
    (output): LogSoftmax(dim=-1)
  )
)
propagate done
init label
Split: 01, Run: 01
None time:  1.5099801910109818
None Run 01:
Highest Train: 100.00
Highest Valid: 67.60
  Final Train: 100.00
   Final Test: 65.60
Split: 01, Run: 02
None time:  1.493381954031065
None Run 02:
Highest Train: 100.00
Highest Valid: 66.80
  Final Train: 100.00
   Final Test: 65.20
Split: 01, Run: 03
None time:  1.191888083005324
None Run 03:
Highest Train: 100.00
Highest Valid: 67.00
  Final Train: 100.00
   Final Test: 65.50
run time now: 4.250293731689453
total time:  4.297140323091298
None All runs:
Highest Train: 100.00 ± 0.00
Highest Valid: 67.13 ± 0.42
  Final Train: 100.00 ± 0.00
   Final Test: 65.43 ± 0.21
[I 2023-06-12 00:17:02,715] Trial 837 finished with value: 67.13333129882812 and parameters: {'Fwd': 0.0023972781627477143, 'K': 9, 'alpha': 0.75, 'dropout': 0.8, 'gnnepoch': 120, 'lambda1': 0.75, 'lambda2': 9.831573966050708, 'loop': 0, 'loss': 'CE', 'lr': 0.0001442057597205056, 'softmaxF': False, 'useGCN': False, 'weight_decay': 3.566553572089515e-05, 'weightedloss': True}. Best is trial 605 with value: 72.13333129882812.
/home/wxy/miniconda3/lib/python3.10/site-packages/optuna/distributions.py:685: UserWarning: The distribution is specified by [0, 1.00001] and step=0.05, but the range is not divisible by `step`. It will be replaced by [0, 1.0].
  warnings.warn(
K:  8
alpha:  0.7000000000000001
lr:  0.00020154090316448333
weight_decay:  0.030359884596994357
dropout:  0.8
fix split and run 3 times
Data: Data(x=[3327, 3703], y=[3327], train_mask=[3327], val_mask=[3327], test_mask=[3327], adj_t=[3327, 3327, nnz=9104])
num_train tensor(120)
num_noise 0
noise: tensor(0)
data feature 3703
ALTOPT(
  (lins): Sequential(
    (0): Linear(in_features=3703, out_features=64, bias=True)
    (1): BatchNorm1d(64, eps=1e-05, momentum=0.1, affine=True, track_running_stats=True)
    (2): Dropout(p=0.8, inplace=True)
    (3): ReLU(inplace=True)
    (4): Linear(in_features=64, out_features=6, bias=True)
    (5): LogSoftmax(dim=-1)
  )
  (prop): Propagation(K=8, mode=None, lambda1=None, lambda2=None, L21=True, alpha=0.7000000000000001)
  (gcn): GCN(
    (convs): ModuleList(
      (0): GCNConv(3703, 64)
      (1): GCNConv(64, 6)
    )
    (bns): ModuleList(
      (0): BatchNorm1d(64, eps=1e-05, momentum=0.1, affine=True, track_running_stats=True)
    )
    (output): LogSoftmax(dim=-1)
  )
)
propagate done
init label
Split: 01, Run: 01, Epoch: 100, Loss: 0.0000, Train: 100.00%, Valid: 68.20% Test: 68.80%
Split: 01, Run: 01
None time:  4.244750667130575
None Run 01:
Highest Train: 100.00
Highest Valid: 68.20
  Final Train: 100.00
   Final Test: 68.60
Split: 01, Run: 02
None time:  2.2846732810139656
None Run 02:
Highest Train: 100.00
Highest Valid: 69.00
  Final Train: 100.00
   Final Test: 70.10
Split: 01, Run: 03, Epoch: 100, Loss: 0.0000, Train: 100.00%, Valid: 68.20% Test: 70.10%
Split: 01, Run: 03
None time:  4.194990825140849
None Run 03:
Highest Train: 100.00
Highest Valid: 68.20
  Final Train: 100.00
   Final Test: 70.30
run time now: 10.76961374282837
total time:  10.81534450291656
None All runs:
Highest Train: 100.00 ± 0.00
Highest Valid: 68.47 ± 0.46
  Final Train: 100.00 ± 0.00
   Final Test: 69.67 ± 0.93
