[I 2023-06-12 00:36:57,553] Trial 259 finished with value: 81.66666412353516 and parameters: {'Fwd': 0.08059910941195424, 'K': 10, 'alpha': 0.45, 'dropout': 0.4, 'gnnepoch': 60, 'lambda1': 0.8, 'lambda2': 5.91015474482695, 'loop': 1, 'loss': 'CE', 'lr': 0.0070991241093297346, 'softmaxF': True, 'useGCN': True, 'weight_decay': 7.027212003390809e-05, 'weightedloss': False}. Best is trial 112 with value: 81.66667175292969.
/home/wxy/miniconda3/lib/python3.10/site-packages/optuna/distributions.py:685: UserWarning: The distribution is specified by [0, 1.00001] and step=0.05, but the range is not divisible by `step`. It will be replaced by [0, 1.0].
  warnings.warn(
K:  9
alpha:  0.45
lr:  0.008341097071868529
weight_decay:  6.285741144879929e-05
dropout:  0.4
fix split and run 3 times
Data: Data(x=[2708, 1433], y=[2708], train_mask=[2708], val_mask=[2708], test_mask=[2708], adj_t=[2708, 2708, nnz=10556])
num_train tensor(140)
num_noise 0
noise: tensor(0)
data feature 1433
ALTOPT(
  (lins): Sequential(
    (0): Linear(in_features=1433, out_features=64, bias=True)
    (1): BatchNorm1d(64, eps=1e-05, momentum=0.1, affine=True, track_running_stats=True)
    (2): Dropout(p=0.4, inplace=True)
    (3): ReLU(inplace=True)
    (4): Linear(in_features=64, out_features=7, bias=True)
    (5): LogSoftmax(dim=-1)
  )
  (prop): Propagation(K=9, mode=None, lambda1=None, lambda2=None, L21=True, alpha=0.45)
  (gcn): GCN(
    (convs): ModuleList(
      (0): GCNConv(1433, 64)
      (1): GCNConv(64, 7)
    )
    (bns): ModuleList(
      (0): BatchNorm1d(64, eps=1e-05, momentum=0.1, affine=True, track_running_stats=True)
    )
    (output): LogSoftmax(dim=-1)
  )
)
propagate done
init label
Split: 01, Run: 01
None time:  1.5745750810019672
None Run 01:
Highest Train: 100.00
Highest Valid: 81.60
  Final Train: 100.00
   Final Test: 82.20
Split: 01, Run: 02
None time:  1.685366728110239
None Run 02:
Highest Train: 100.00
Highest Valid: 80.80
  Final Train: 100.00
   Final Test: 80.40
Split: 01, Run: 03
None time:  1.6655492789577693
None Run 03:
Highest Train: 100.00
Highest Valid: 80.80
  Final Train: 100.00
   Final Test: 80.80
run time now: 4.9515979290008545
total time:  4.970834097126499
None All runs:
Highest Train: 100.00 ± 0.00
Highest Valid: 81.07 ± 0.46
  Final Train: 100.00 ± 0.00
   Final Test: 81.13 ± 0.95
[I 2023-06-12 00:37:02,999] Trial 260 finished with value: 81.06666564941406 and parameters: {'Fwd': 0.09977727793911967, 'K': 9, 'alpha': 0.45, 'dropout': 0.4, 'gnnepoch': 60, 'lambda1': 0.75, 'lambda2': 5.866681653388024, 'loop': 1, 'loss': 'CE', 'lr': 0.008341097071868529, 'softmaxF': True, 'useGCN': True, 'weight_decay': 6.285741144879929e-05, 'weightedloss': False}. Best is trial 112 with value: 81.66667175292969.
/home/wxy/miniconda3/lib/python3.10/site-packages/optuna/distributions.py:685: UserWarning: The distribution is specified by [0, 1.00001] and step=0.05, but the range is not divisible by `step`. It will be replaced by [0, 1.0].
  warnings.warn(
K:  10
alpha:  0.4
lr:  0.007403704679508535
weight_decay:  7.284106430376663e-05
dropout:  0.5
fix split and run 3 times
Data: Data(x=[2708, 1433], y=[2708], train_mask=[2708], val_mask=[2708], test_mask=[2708], adj_t=[2708, 2708, nnz=10556])
num_train tensor(140)
num_noise 0
noise: tensor(0)
data feature 1433
ALTOPT(
  (lins): Sequential(
    (0): Linear(in_features=1433, out_features=64, bias=True)
    (1): BatchNorm1d(64, eps=1e-05, momentum=0.1, affine=True, track_running_stats=True)
    (2): Dropout(p=0.5, inplace=True)
    (3): ReLU(inplace=True)
    (4): Linear(in_features=64, out_features=7, bias=True)
    (5): LogSoftmax(dim=-1)
  )
  (prop): Propagation(K=10, mode=None, lambda1=None, lambda2=None, L21=True, alpha=0.4)
  (gcn): GCN(
    (convs): ModuleList(
      (0): GCNConv(1433, 64)
      (1): GCNConv(64, 7)
    )
    (bns): ModuleList(
      (0): BatchNorm1d(64, eps=1e-05, momentum=0.1, affine=True, track_running_stats=True)
    )
    (output): LogSoftmax(dim=-1)
  )
)
propagate done
init label
Split: 01, Run: 01
None time:  1.4006955130025744
None Run 01:
Highest Train: 100.00
Highest Valid: 81.00
  Final Train: 100.00
   Final Test: 82.00
Split: 01, Run: 02
None time:  1.236506599932909
None Run 02:
Highest Train: 100.00
Highest Valid: 81.20
  Final Train: 100.00
   Final Test: 82.30
Split: 01, Run: 03
None time:  1.1578078609891236
None Run 03:
Highest Train: 100.00
Highest Valid: 81.60
  Final Train: 100.00
   Final Test: 82.10
run time now: 3.82352352142334
total time:  3.842974692117423
None All runs:
Highest Train: 100.00 ± 0.00
Highest Valid: 81.27 ± 0.31
  Final Train: 100.00 ± 0.00
   Final Test: 82.13 ± 0.15
[I 2023-06-12 00:37:07,390] Trial 261 finished with value: 81.26666259765625 and parameters: {'Fwd': 0.07911602840183418, 'K': 10, 'alpha': 0.4, 'dropout': 0.5, 'gnnepoch': 50, 'lambda1': 0.8, 'lambda2': 5.958165257343968, 'loop': 1, 'loss': 'CE', 'lr': 0.007403704679508535, 'softmaxF': False, 'useGCN': True, 'weight_decay': 7.284106430376663e-05, 'weightedloss': False}. Best is trial 112 with value: 81.66667175292969.
/home/wxy/miniconda3/lib/python3.10/site-packages/optuna/distributions.py:685: UserWarning: The distribution is specified by [0, 1.00001] and step=0.05, but the range is not divisible by `step`. It will be replaced by [0, 1.0].
  warnings.warn(
K:  10
alpha:  0.5
lr:  0.0063629761507023016
weight_decay:  1.4977145781170811e-06
dropout:  0.4
fix split and run 3 times
Data: Data(x=[2708, 1433], y=[2708], train_mask=[2708], val_mask=[2708], test_mask=[2708], adj_t=[2708, 2708, nnz=10556])
num_train tensor(140)
num_noise 0
noise: tensor(0)
data feature 1433
ALTOPT(
  (lins): Sequential(
    (0): Linear(in_features=1433, out_features=64, bias=True)
    (1): BatchNorm1d(64, eps=1e-05, momentum=0.1, affine=True, track_running_stats=True)
    (2): Dropout(p=0.4, inplace=True)
    (3): ReLU(inplace=True)
    (4): Linear(in_features=64, out_features=7, bias=True)
    (5): LogSoftmax(dim=-1)
  )
  (prop): Propagation(K=10, mode=None, lambda1=None, lambda2=None, L21=True, alpha=0.5)
  (gcn): GCN(
    (convs): ModuleList(
      (0): GCNConv(1433, 64)
      (1): GCNConv(64, 7)
    )
    (bns): ModuleList(
      (0): BatchNorm1d(64, eps=1e-05, momentum=0.1, affine=True, track_running_stats=True)
    )
    (output): LogSoftmax(dim=-1)
  )
)
propagate done
init label
Split: 01, Run: 01
None time:  1.6404068358242512
None Run 01:
Highest Train: 100.00
Highest Valid: 81.40
  Final Train: 100.00
   Final Test: 81.80
Split: 01, Run: 02
None time:  1.627894300967455
None Run 02:
Highest Train: 100.00
Highest Valid: 81.60
  Final Train: 100.00
   Final Test: 81.20
Split: 01, Run: 03
None time:  1.6479690379928797
None Run 03:
Highest Train: 100.00
Highest Valid: 80.80
  Final Train: 100.00
   Final Test: 81.50
run time now: 4.94677996635437
total time:  4.970433737151325
None All runs:
Highest Train: 100.00 ± 0.00
Highest Valid: 81.27 ± 0.42
  Final Train: 100.00 ± 0.00
   Final Test: 81.50 ± 0.30
[I 2023-06-12 00:37:12,886] Trial 262 finished with value: 81.26667022705078 and parameters: {'Fwd': 0.04679985645906063, 'K': 10, 'alpha': 0.5, 'dropout': 0.4, 'gnnepoch': 60, 'lambda1': 0.8, 'lambda2': 5.7150819768044325, 'loop': 1, 'loss': 'CE', 'lr': 0.0063629761507023016, 'softmaxF': True, 'useGCN': True, 'weight_decay': 1.4977145781170811e-06, 'weightedloss': False}. Best is trial 112 with value: 81.66667175292969.
/home/wxy/miniconda3/lib/python3.10/site-packages/optuna/distributions.py:685: UserWarning: The distribution is specified by [0, 1.00001] and step=0.05, but the range is not divisible by `step`. It will be replaced by [0, 1.0].
  warnings.warn(
K:  10
alpha:  0.45
lr:  0.0012314963455432788
weight_decay:  0.0005158340493188168
dropout:  0.4
fix split and run 3 times
Data: Data(x=[2708, 1433], y=[2708], train_mask=[2708], val_mask=[2708], test_mask=[2708], adj_t=[2708, 2708, nnz=10556])
num_train tensor(140)
num_noise 0
noise: tensor(0)
data feature 1433
ALTOPT(
  (lins): Sequential(
    (0): Linear(in_features=1433, out_features=64, bias=True)
    (1): BatchNorm1d(64, eps=1e-05, momentum=0.1, affine=True, track_running_stats=True)
    (2): Dropout(p=0.4, inplace=True)
    (3): ReLU(inplace=True)
    (4): Linear(in_features=64, out_features=7, bias=True)
    (5): LogSoftmax(dim=-1)
  )
  (prop): Propagation(K=10, mode=None, lambda1=None, lambda2=None, L21=True, alpha=0.45)
  (gcn): GCN(
    (convs): ModuleList(
      (0): GCNConv(1433, 64)
      (1): GCNConv(64, 7)
    )
    (bns): ModuleList(
      (0): BatchNorm1d(64, eps=1e-05, momentum=0.1, affine=True, track_running_stats=True)
    )
    (output): LogSoftmax(dim=-1)
  )
)
propagate done
init label
Split: 01, Run: 01
None time:  1.6549440389499068
None Run 01:
Highest Train: 100.00
Highest Valid: 79.60
  Final Train: 100.00
   Final Test: 79.70
Split: 01, Run: 02
None time:  1.8508990209084004
None Run 02:
Highest Train: 100.00
Highest Valid: 78.20
  Final Train: 100.00
   Final Test: 77.00
Split: 01, Run: 03
None time:  1.7946532061323524
None Run 03:
Highest Train: 100.00
Highest Valid: 78.80
  Final Train: 100.00
   Final Test: 80.50
run time now: 5.325514078140259
total time:  5.343862114939839
None All runs:
Highest Train: 100.00 ± 0.00
Highest Valid: 78.87 ± 0.70
  Final Train: 100.00 ± 0.00
   Final Test: 79.07 ± 1.83
[I 2023-06-12 00:37:18,828] Trial 263 finished with value: 78.86666107177734 and parameters: {'Fwd': 0.033242641366464064, 'K': 10, 'alpha': 0.45, 'dropout': 0.4, 'gnnepoch': 70, 'lambda1': 0.9500000000000001, 'lambda2': 6.236355586312921, 'loop': 1, 'loss': 'CE', 'lr': 0.0012314963455432788, 'softmaxF': True, 'useGCN': True, 'weight_decay': 0.0005158340493188168, 'weightedloss': False}. Best is trial 112 with value: 81.66667175292969.
/home/wxy/miniconda3/lib/python3.10/site-packages/optuna/distributions.py:685: UserWarning: The distribution is specified by [0, 1.00001] and step=0.05, but the range is not divisible by `step`. It will be replaced by [0, 1.0].
  warnings.warn(
K:  10
alpha:  0.35000000000000003
lr:  0.009142307830187157
weight_decay:  4.519931877722177e-05
dropout:  0.5
fix split and run 3 times
Data: Data(x=[2708, 1433], y=[2708], train_mask=[2708], val_mask=[2708], test_mask=[2708], adj_t=[2708, 2708, nnz=10556])
num_train tensor(140)
num_noise 0
noise: tensor(0)
data feature 1433
ALTOPT(
  (lins): Sequential(
    (0): Linear(in_features=1433, out_features=64, bias=True)
    (1): BatchNorm1d(64, eps=1e-05, momentum=0.1, affine=True, track_running_stats=True)
    (2): Dropout(p=0.5, inplace=True)
    (3): ReLU(inplace=True)
    (4): Linear(in_features=64, out_features=7, bias=True)
    (5): LogSoftmax(dim=-1)
  )
  (prop): Propagation(K=10, mode=None, lambda1=None, lambda2=None, L21=True, alpha=0.35000000000000003)
  (gcn): GCN(
    (convs): ModuleList(
      (0): GCNConv(1433, 64)
      (1): GCNConv(64, 7)
    )
    (bns): ModuleList(
      (0): BatchNorm1d(64, eps=1e-05, momentum=0.1, affine=True, track_running_stats=True)
    )
    (output): LogSoftmax(dim=-1)
  )
)
propagate done
init label
Split: 01, Run: 01
None time:  1.3199386079795659
None Run 01:
Highest Train: 100.00
Highest Valid: 81.40
  Final Train: 100.00
   Final Test: 82.00
Split: 01, Run: 02
None time:  1.7073667391669005
None Run 02:
Highest Train: 100.00
Highest Valid: 80.80
  Final Train: 100.00
   Final Test: 80.60
Split: 01, Run: 03
None time:  1.5051502648275346
None Run 03:
Highest Train: 100.00
Highest Valid: 80.80
  Final Train: 100.00
   Final Test: 81.20
run time now: 4.561384201049805
total time:  4.5773077150806785
None All runs:
Highest Train: 100.00 ± 0.00
Highest Valid: 81.00 ± 0.35
  Final Train: 100.00 ± 0.00
   Final Test: 81.27 ± 0.70
[I 2023-06-12 00:37:23,827] Trial 264 finished with value: 81.00000762939453 and parameters: {'Fwd': 0.025687605624709814, 'K': 10, 'alpha': 0.35000000000000003, 'dropout': 0.5, 'gnnepoch': 60, 'lambda1': 0.8, 'lambda2': 9.979301197299916, 'loop': 1, 'loss': 'CE', 'lr': 0.009142307830187157, 'softmaxF': True, 'useGCN': True, 'weight_decay': 4.519931877722177e-05, 'weightedloss': False}. Best is trial 112 with value: 81.66667175292969.
/home/wxy/miniconda3/lib/python3.10/site-packages/optuna/distributions.py:685: UserWarning: The distribution is specified by [0, 1.00001] and step=0.05, but the range is not divisible by `step`. It will be replaced by [0, 1.0].
  warnings.warn(
K:  10
alpha:  0.45
lr:  0.00393958968228246
weight_decay:  3.015992479565004e-05
dropout:  0.4
fix split and run 3 times
Data: Data(x=[2708, 1433], y=[2708], train_mask=[2708], val_mask=[2708], test_mask=[2708], adj_t=[2708, 2708, nnz=10556])
num_train tensor(140)
num_noise 0
noise: tensor(0)
data feature 1433
ALTOPT(
  (lins): Sequential(
    (0): Linear(in_features=1433, out_features=64, bias=True)
    (1): BatchNorm1d(64, eps=1e-05, momentum=0.1, affine=True, track_running_stats=True)
    (2): Dropout(p=0.4, inplace=True)
    (3): ReLU(inplace=True)
    (4): Linear(in_features=64, out_features=7, bias=True)
    (5): LogSoftmax(dim=-1)
  )
  (prop): Propagation(K=10, mode=None, lambda1=None, lambda2=None, L21=True, alpha=0.45)
  (gcn): GCN(
    (convs): ModuleList(
      (0): GCNConv(1433, 64)
      (1): GCNConv(64, 7)
    )
    (bns): ModuleList(
      (0): BatchNorm1d(64, eps=1e-05, momentum=0.1, affine=True, track_running_stats=True)
    )
    (output): LogSoftmax(dim=-1)
  )
)
propagate done
init label
Split: 01, Run: 01
None time:  1.662911695893854
None Run 01:
Highest Train: 100.00
Highest Valid: 81.20
  Final Train: 100.00
   Final Test: 81.90
Split: 01, Run: 02
None time:  1.6081490048673004
None Run 02:
Highest Train: 100.00
Highest Valid: 80.80
  Final Train: 100.00
   Final Test: 81.40
Split: 01, Run: 03
None time:  1.6538308020681143
None Run 03:
Highest Train: 100.00
Highest Valid: 80.40
  Final Train: 100.00
   Final Test: 80.80
run time now: 4.9532246589660645
total time:  4.975816871970892
None All runs:
Highest Train: 100.00 ± 0.00
Highest Valid: 80.80 ± 0.40
  Final Train: 100.00 ± 0.00
   Final Test: 81.37 ± 0.55
[I 2023-06-12 00:37:29,301] Trial 265 finished with value: 80.79999542236328 and parameters: {'Fwd': 0.08039077022611069, 'K': 10, 'alpha': 0.45, 'dropout': 0.4, 'gnnepoch': 60, 'lambda1': 0.9, 'lambda2': 4.7993855773521865, 'loop': 1, 'loss': 'CE', 'lr': 0.00393958968228246, 'softmaxF': True, 'useGCN': True, 'weight_decay': 3.015992479565004e-05, 'weightedloss': False}. Best is trial 112 with value: 81.66667175292969.
/home/wxy/miniconda3/lib/python3.10/site-packages/optuna/distributions.py:685: UserWarning: The distribution is specified by [0, 1.00001] and step=0.05, but the range is not divisible by `step`. It will be replaced by [0, 1.0].
  warnings.warn(
K:  10
alpha:  0.5
lr:  0.0077071051335207445
weight_decay:  5.4193881660672415e-05
dropout:  0.4
fix split and run 3 times
Data: Data(x=[2708, 1433], y=[2708], train_mask=[2708], val_mask=[2708], test_mask=[2708], adj_t=[2708, 2708, nnz=10556])
num_train tensor(140)
num_noise 0
noise: tensor(0)
data feature 1433
ALTOPT(
  (lins): Sequential(
    (0): Linear(in_features=1433, out_features=64, bias=True)
    (1): BatchNorm1d(64, eps=1e-05, momentum=0.1, affine=True, track_running_stats=True)
    (2): Dropout(p=0.4, inplace=True)
    (3): ReLU(inplace=True)
    (4): Linear(in_features=64, out_features=7, bias=True)
    (5): LogSoftmax(dim=-1)
  )
  (prop): Propagation(K=10, mode=None, lambda1=None, lambda2=None, L21=True, alpha=0.5)
  (gcn): GCN(
    (convs): ModuleList(
      (0): GCNConv(1433, 64)
      (1): GCNConv(64, 7)
    )
    (bns): ModuleList(
      (0): BatchNorm1d(64, eps=1e-05, momentum=0.1, affine=True, track_running_stats=True)
    )
    (output): LogSoftmax(dim=-1)
  )
)
propagate done
init label
Split: 01, Run: 01
None time:  1.2845906091388315
None Run 01:
Highest Train: 100.00
Highest Valid: 81.80
  Final Train: 100.00
   Final Test: 82.00
Split: 01, Run: 02
None time:  1.7433905738871545
None Run 02:
Highest Train: 100.00
Highest Valid: 80.80
  Final Train: 100.00
   Final Test: 81.00
Split: 01, Run: 03
None time:  1.738044073106721
None Run 03:
Highest Train: 100.00
Highest Valid: 80.60
  Final Train: 100.00
   Final Test: 81.00
run time now: 4.786069631576538
total time:  4.815030476776883
None All runs:
Highest Train: 100.00 ± 0.00
Highest Valid: 81.07 ± 0.64
  Final Train: 100.00 ± 0.00
   Final Test: 81.33 ± 0.58
[I 2023-06-12 00:37:34,664] Trial 266 finished with value: 81.0666732788086 and parameters: {'Fwd': 0.001017777925593404, 'K': 10, 'alpha': 0.5, 'dropout': 0.4, 'gnnepoch': 60, 'lambda1': 0.8500000000000001, 'lambda2': 5.193372496838106, 'loop': 1, 'loss': 'CE', 'lr': 0.0077071051335207445, 'softmaxF': True, 'useGCN': True, 'weight_decay': 5.4193881660672415e-05, 'weightedloss': False}. Best is trial 112 with value: 81.66667175292969.
/home/wxy/miniconda3/lib/python3.10/site-packages/optuna/distributions.py:685: UserWarning: The distribution is specified by [0, 1.00001] and step=0.05, but the range is not divisible by `step`. It will be replaced by [0, 1.0].
  warnings.warn(
K:  10
alpha:  0.4
lr:  0.006894060309642131
weight_decay:  0.00012672395118103362
dropout:  0.30000000000000004
fix split and run 3 times
Data: Data(x=[2708, 1433], y=[2708], train_mask=[2708], val_mask=[2708], test_mask=[2708], adj_t=[2708, 2708, nnz=10556])
num_train tensor(140)
num_noise 0
noise: tensor(0)
data feature 1433
ALTOPT(
  (lins): Sequential(
    (0): Linear(in_features=1433, out_features=64, bias=True)
    (1): BatchNorm1d(64, eps=1e-05, momentum=0.1, affine=True, track_running_stats=True)
    (2): Dropout(p=0.30000000000000004, inplace=True)
    (3): ReLU(inplace=True)
    (4): Linear(in_features=64, out_features=7, bias=True)
    (5): LogSoftmax(dim=-1)
  )
  (prop): Propagation(K=10, mode=None, lambda1=None, lambda2=None, L21=True, alpha=0.4)
  (gcn): GCN(
    (convs): ModuleList(
      (0): GCNConv(1433, 64)
      (1): GCNConv(64, 7)
    )
    (bns): ModuleList(
      (0): BatchNorm1d(64, eps=1e-05, momentum=0.1, affine=True, track_running_stats=True)
    )
    (output): LogSoftmax(dim=-1)
  )
)
propagate done
init label
Split: 01, Run: 01
None time:  1.3475919771008193
None Run 01:
Highest Train: 100.00
Highest Valid: 81.40
  Final Train: 100.00
   Final Test: 81.50
Split: 01, Run: 02
None time:  1.3369617918506265
None Run 02:
Highest Train: 100.00
Highest Valid: 81.20
  Final Train: 100.00
   Final Test: 81.70
Split: 01, Run: 03
None time:  1.4210489250253886
None Run 03:
Highest Train: 100.00
Highest Valid: 80.00
  Final Train: 100.00
   Final Test: 81.60
run time now: 4.134443998336792
total time:  4.148915804922581
None All runs:
Highest Train: 100.00 ± 0.00
Highest Valid: 80.87 ± 0.76
  Final Train: 100.00 ± 0.00
   Final Test: 81.60 ± 0.10
[I 2023-06-12 00:37:39,230] Trial 267 finished with value: 80.86666870117188 and parameters: {'Fwd': 0.06098401393482457, 'K': 10, 'alpha': 0.4, 'dropout': 0.30000000000000004, 'gnnepoch': 50, 'lambda1': 0.8, 'lambda2': 5.569246805620218, 'loop': 1, 'loss': 'CE', 'lr': 0.006894060309642131, 'softmaxF': True, 'useGCN': True, 'weight_decay': 0.00012672395118103362, 'weightedloss': False}. Best is trial 112 with value: 81.66667175292969.
/home/wxy/miniconda3/lib/python3.10/site-packages/optuna/distributions.py:685: UserWarning: The distribution is specified by [0, 1.00001] and step=0.05, but the range is not divisible by `step`. It will be replaced by [0, 1.0].
  warnings.warn(
K:  9
alpha:  0.75
lr:  0.005197227401741741
weight_decay:  7.734833901893253e-05
dropout:  0.4
fix split and run 3 times
Data: Data(x=[2708, 1433], y=[2708], train_mask=[2708], val_mask=[2708], test_mask=[2708], adj_t=[2708, 2708, nnz=10556])
num_train tensor(140)
num_noise 0
noise: tensor(0)
data feature 1433
ALTOPT(
  (lins): Sequential(
    (0): Linear(in_features=1433, out_features=64, bias=True)
    (1): BatchNorm1d(64, eps=1e-05, momentum=0.1, affine=True, track_running_stats=True)
    (2): Dropout(p=0.4, inplace=True)
    (3): ReLU(inplace=True)
    (4): Linear(in_features=64, out_features=7, bias=True)
    (5): LogSoftmax(dim=-1)
  )
  (prop): Propagation(K=9, mode=None, lambda1=None, lambda2=None, L21=True, alpha=0.75)
  (gcn): GCN(
    (convs): ModuleList(
      (0): GCNConv(1433, 64)
      (1): GCNConv(64, 7)
    )
    (bns): ModuleList(
      (0): BatchNorm1d(64, eps=1e-05, momentum=0.1, affine=True, track_running_stats=True)
    )
    (output): LogSoftmax(dim=-1)
  )
)
propagate done
init label
Split: 01, Run: 01
None time:  1.6858903800603002
None Run 01:
Highest Train: 100.00
Highest Valid: 81.20
  Final Train: 100.00
   Final Test: 81.10
Split: 01, Run: 02
None time:  1.84839041903615
None Run 02:
Highest Train: 100.00
Highest Valid: 80.00
  Final Train: 100.00
   Final Test: 81.40
Split: 01, Run: 03
None time:  1.9037259449250996
None Run 03:
Highest Train: 100.00
Highest Valid: 80.80
  Final Train: 100.00
   Final Test: 80.40
run time now: 5.466376781463623
total time:  5.480203639017418
None All runs:
Highest Train: 100.00 ± 0.00
Highest Valid: 80.67 ± 0.61
  Final Train: 100.00 ± 0.00
   Final Test: 80.97 ± 0.51
