[I 2023-06-12 00:46:53,027] Trial 367 finished with value: 81.13333129882812 and parameters: {'Fwd': 0.0018730510846553651, 'K': 10, 'alpha': 0.55, 'dropout': 0.4, 'gnnepoch': 50, 'lambda1': 0.8500000000000001, 'lambda2': 4.450631735138491, 'loop': 1, 'loss': 'CE', 'lr': 0.006563856803355245, 'softmaxF': True, 'useGCN': True, 'weight_decay': 0.0001309348757201878, 'weightedloss': False}. Best is trial 112 with value: 81.66667175292969.
/home/wxy/miniconda3/lib/python3.10/site-packages/optuna/distributions.py:685: UserWarning: The distribution is specified by [0, 1.00001] and step=0.05, but the range is not divisible by `step`. It will be replaced by [0, 1.0].
  warnings.warn(
K:  10
alpha:  0.5
lr:  0.008542726496901912
weight_decay:  0.001859456961486732
dropout:  0.5
fix split and run 3 times
Data: Data(x=[2708, 1433], y=[2708], train_mask=[2708], val_mask=[2708], test_mask=[2708], adj_t=[2708, 2708, nnz=10556])
num_train tensor(140)
num_noise 0
noise: tensor(0)
data feature 1433
ALTOPT(
  (lins): Sequential(
    (0): Linear(in_features=1433, out_features=64, bias=True)
    (1): BatchNorm1d(64, eps=1e-05, momentum=0.1, affine=True, track_running_stats=True)
    (2): Dropout(p=0.5, inplace=True)
    (3): ReLU(inplace=True)
    (4): Linear(in_features=64, out_features=7, bias=True)
    (5): LogSoftmax(dim=-1)
  )
  (prop): Propagation(K=10, mode=None, lambda1=None, lambda2=None, L21=True, alpha=0.5)
  (gcn): GCN(
    (convs): ModuleList(
      (0): GCNConv(1433, 64)
      (1): GCNConv(64, 7)
    )
    (bns): ModuleList(
      (0): BatchNorm1d(64, eps=1e-05, momentum=0.1, affine=True, track_running_stats=True)
    )
    (output): LogSoftmax(dim=-1)
  )
)
propagate done
init label
Split: 01, Run: 01
None time:  1.6212407080456614
None Run 01:
Highest Train: 100.00
Highest Valid: 81.40
  Final Train: 100.00
   Final Test: 82.30
Split: 01, Run: 02
None time:  1.4928389401175082
None Run 02:
Highest Train: 100.00
Highest Valid: 81.20
  Final Train: 100.00
   Final Test: 81.70
Split: 01, Run: 03
None time:  1.72865414689295
None Run 03:
Highest Train: 100.00
Highest Valid: 80.80
  Final Train: 100.00
   Final Test: 81.60
run time now: 4.869720935821533
total time:  4.883788652019575
None All runs:
Highest Train: 100.00 ± 0.00
Highest Valid: 81.13 ± 0.31
  Final Train: 100.00 ± 0.00
   Final Test: 81.87 ± 0.38
[I 2023-06-12 00:46:58,493] Trial 368 finished with value: 81.13333892822266 and parameters: {'Fwd': 0.03252240272550546, 'K': 10, 'alpha': 0.5, 'dropout': 0.5, 'gnnepoch': 60, 'lambda1': 0.8, 'lambda2': 4.986998330511598, 'loop': 1, 'loss': 'CE', 'lr': 0.008542726496901912, 'softmaxF': True, 'useGCN': True, 'weight_decay': 0.001859456961486732, 'weightedloss': True}. Best is trial 112 with value: 81.66667175292969.
/home/wxy/miniconda3/lib/python3.10/site-packages/optuna/distributions.py:685: UserWarning: The distribution is specified by [0, 1.00001] and step=0.05, but the range is not divisible by `step`. It will be replaced by [0, 1.0].
  warnings.warn(
K:  10
alpha:  0.7000000000000001
lr:  0.009981072693545175
weight_decay:  7.66094745437098e-05
dropout:  0.4
fix split and run 3 times
Data: Data(x=[2708, 1433], y=[2708], train_mask=[2708], val_mask=[2708], test_mask=[2708], adj_t=[2708, 2708, nnz=10556])
num_train tensor(140)
num_noise 0
noise: tensor(0)
data feature 1433
ALTOPT(
  (lins): Sequential(
    (0): Linear(in_features=1433, out_features=64, bias=True)
    (1): BatchNorm1d(64, eps=1e-05, momentum=0.1, affine=True, track_running_stats=True)
    (2): Dropout(p=0.4, inplace=True)
    (3): ReLU(inplace=True)
    (4): Linear(in_features=64, out_features=7, bias=True)
    (5): LogSoftmax(dim=-1)
  )
  (prop): Propagation(K=10, mode=None, lambda1=None, lambda2=None, L21=True, alpha=0.7000000000000001)
  (gcn): GCN(
    (convs): ModuleList(
      (0): GCNConv(1433, 64)
      (1): GCNConv(64, 7)
    )
    (bns): ModuleList(
      (0): BatchNorm1d(64, eps=1e-05, momentum=0.1, affine=True, track_running_stats=True)
    )
    (output): LogSoftmax(dim=-1)
  )
)
propagate done
init label
Split: 01, Run: 01
None time:  1.7352601359598339
None Run 01:
Highest Train: 100.00
Highest Valid: 81.40
  Final Train: 100.00
   Final Test: 82.00
Split: 01, Run: 02
None time:  1.686066007008776
None Run 02:
Highest Train: 100.00
Highest Valid: 81.40
  Final Train: 100.00
   Final Test: 81.30
Split: 01, Run: 03
None time:  1.3255532421171665
None Run 03:
Highest Train: 100.00
Highest Valid: 79.80
  Final Train: 100.00
   Final Test: 79.60
run time now: 4.769911527633667
total time:  4.784643780905753
None All runs:
Highest Train: 100.00 ± 0.00
Highest Valid: 80.87 ± 0.92
  Final Train: 100.00 ± 0.00
   Final Test: 80.97 ± 1.23
[I 2023-06-12 00:47:03,707] Trial 369 finished with value: 80.86666870117188 and parameters: {'Fwd': 0.09972397121981182, 'K': 10, 'alpha': 0.7000000000000001, 'dropout': 0.4, 'gnnepoch': 60, 'lambda1': 0.9, 'lambda2': 5.650004196294009, 'loop': 1, 'loss': 'CE', 'lr': 0.009981072693545175, 'softmaxF': True, 'useGCN': True, 'weight_decay': 7.66094745437098e-05, 'weightedloss': False}. Best is trial 112 with value: 81.66667175292969.
/home/wxy/miniconda3/lib/python3.10/site-packages/optuna/distributions.py:685: UserWarning: The distribution is specified by [0, 1.00001] and step=0.05, but the range is not divisible by `step`. It will be replaced by [0, 1.0].
  warnings.warn(
K:  10
alpha:  0.75
lr:  0.0023229610812394424
weight_decay:  9.64470218571773e-05
dropout:  0.2
fix split and run 3 times
Data: Data(x=[2708, 1433], y=[2708], train_mask=[2708], val_mask=[2708], test_mask=[2708], adj_t=[2708, 2708, nnz=10556])
num_train tensor(140)
num_noise 0
noise: tensor(0)
data feature 1433
ALTOPT(
  (lins): Sequential(
    (0): Linear(in_features=1433, out_features=64, bias=True)
    (1): BatchNorm1d(64, eps=1e-05, momentum=0.1, affine=True, track_running_stats=True)
    (2): Dropout(p=0.2, inplace=True)
    (3): ReLU(inplace=True)
    (4): Linear(in_features=64, out_features=7, bias=True)
    (5): LogSoftmax(dim=-1)
  )
  (prop): Propagation(K=10, mode=None, lambda1=None, lambda2=None, L21=True, alpha=0.75)
  (gcn): GCN(
    (convs): ModuleList(
      (0): GCNConv(1433, 64)
      (1): GCNConv(64, 7)
    )
    (bns): ModuleList(
      (0): BatchNorm1d(64, eps=1e-05, momentum=0.1, affine=True, track_running_stats=True)
    )
    (output): LogSoftmax(dim=-1)
  )
)
propagate done
init label
Split: 01, Run: 01
None time:  1.7036020790692419
None Run 01:
Highest Train: 100.00
Highest Valid: 80.00
  Final Train: 100.00
   Final Test: 79.80
Split: 01, Run: 02
None time:  1.416287394007668
None Run 02:
Highest Train: 100.00
Highest Valid: 79.60
  Final Train: 100.00
   Final Test: 79.10
Split: 01, Run: 03
None time:  1.0818070890381932
None Run 03:
Highest Train: 100.00
Highest Valid: 77.20
  Final Train: 100.00
   Final Test: 77.90
run time now: 4.228008031845093
total time:  4.24555839295499
None All runs:
Highest Train: 100.00 ± 0.00
Highest Valid: 78.93 ± 1.51
  Final Train: 100.00 ± 0.00
   Final Test: 78.93 ± 0.96
[I 2023-06-12 00:47:08,416] Trial 370 finished with value: 78.93334197998047 and parameters: {'Fwd': 0.005135146916847572, 'K': 10, 'alpha': 0.75, 'dropout': 0.2, 'gnnepoch': 60, 'lambda1': 0.9500000000000001, 'lambda2': 5.386904289496458, 'loop': 1, 'loss': 'CE', 'lr': 0.0023229610812394424, 'softmaxF': True, 'useGCN': True, 'weight_decay': 9.64470218571773e-05, 'weightedloss': False}. Best is trial 112 with value: 81.66667175292969.
/home/wxy/miniconda3/lib/python3.10/site-packages/optuna/distributions.py:685: UserWarning: The distribution is specified by [0, 1.00001] and step=0.05, but the range is not divisible by `step`. It will be replaced by [0, 1.0].
  warnings.warn(
K:  9
alpha:  0.65
lr:  0.007792960179531579
weight_decay:  2.1295802778567067e-05
dropout:  0.4
fix split and run 3 times
Data: Data(x=[2708, 1433], y=[2708], train_mask=[2708], val_mask=[2708], test_mask=[2708], adj_t=[2708, 2708, nnz=10556])
num_train tensor(140)
num_noise 0
noise: tensor(0)
data feature 1433
ALTOPT(
  (lins): Sequential(
    (0): Linear(in_features=1433, out_features=64, bias=True)
    (1): BatchNorm1d(64, eps=1e-05, momentum=0.1, affine=True, track_running_stats=True)
    (2): Dropout(p=0.4, inplace=True)
    (3): ReLU(inplace=True)
    (4): Linear(in_features=64, out_features=7, bias=True)
    (5): LogSoftmax(dim=-1)
  )
  (prop): Propagation(K=9, mode=None, lambda1=None, lambda2=None, L21=True, alpha=0.65)
  (gcn): GCN(
    (convs): ModuleList(
      (0): GCNConv(1433, 64)
      (1): GCNConv(64, 7)
    )
    (bns): ModuleList(
      (0): BatchNorm1d(64, eps=1e-05, momentum=0.1, affine=True, track_running_stats=True)
    )
    (output): LogSoftmax(dim=-1)
  )
)
propagate done
init label
Split: 01, Run: 01
None time:  1.5140000691171736
None Run 01:
Highest Train: 100.00
Highest Valid: 81.80
  Final Train: 100.00
   Final Test: 81.40
Split: 01, Run: 02
None time:  1.565563949989155
None Run 02:
Highest Train: 100.00
Highest Valid: 81.00
  Final Train: 100.00
   Final Test: 81.60
Split: 01, Run: 03
None time:  1.5252446488011628
None Run 03:
Highest Train: 100.00
Highest Valid: 80.80
  Final Train: 100.00
   Final Test: 81.70
run time now: 4.6438422203063965
total time:  4.659506926080212
None All runs:
Highest Train: 100.00 ± 0.00
Highest Valid: 81.20 ± 0.53
  Final Train: 100.00 ± 0.00
   Final Test: 81.57 ± 0.15
[I 2023-06-12 00:47:13,570] Trial 371 finished with value: 81.20000457763672 and parameters: {'Fwd': 0.05441305920602525, 'K': 9, 'alpha': 0.65, 'dropout': 0.4, 'gnnepoch': 50, 'lambda1': 0.8500000000000001, 'lambda2': 5.845070253058499, 'loop': 1, 'loss': 'CE', 'lr': 0.007792960179531579, 'softmaxF': True, 'useGCN': True, 'weight_decay': 2.1295802778567067e-05, 'weightedloss': False}. Best is trial 112 with value: 81.66667175292969.
/home/wxy/miniconda3/lib/python3.10/site-packages/optuna/distributions.py:685: UserWarning: The distribution is specified by [0, 1.00001] and step=0.05, but the range is not divisible by `step`. It will be replaced by [0, 1.0].
  warnings.warn(
K:  10
alpha:  0.6000000000000001
lr:  0.004813789959144903
weight_decay:  5.7973094076241374e-05
dropout:  0.4
fix split and run 3 times
Data: Data(x=[2708, 1433], y=[2708], train_mask=[2708], val_mask=[2708], test_mask=[2708], adj_t=[2708, 2708, nnz=10556])
num_train tensor(140)
num_noise 0
noise: tensor(0)
data feature 1433
ALTOPT(
  (lins): Sequential(
    (0): Linear(in_features=1433, out_features=64, bias=True)
    (1): BatchNorm1d(64, eps=1e-05, momentum=0.1, affine=True, track_running_stats=True)
    (2): Dropout(p=0.4, inplace=True)
    (3): ReLU(inplace=True)
    (4): Linear(in_features=64, out_features=7, bias=True)
    (5): LogSoftmax(dim=-1)
  )
  (prop): Propagation(K=10, mode=None, lambda1=None, lambda2=None, L21=True, alpha=0.6000000000000001)
  (gcn): GCN(
    (convs): ModuleList(
      (0): GCNConv(1433, 64)
      (1): GCNConv(64, 7)
    )
    (bns): ModuleList(
      (0): BatchNorm1d(64, eps=1e-05, momentum=0.1, affine=True, track_running_stats=True)
    )
    (output): LogSoftmax(dim=-1)
  )
)
propagate done
init label
Split: 01, Run: 01
None time:  0.7692252169363201
None Run 01:
Highest Train: 100.00
Highest Valid: 80.60
  Final Train: 100.00
   Final Test: 80.90
Split: 01, Run: 02
None time:  0.8883621629793197
None Run 02:
Highest Train: 100.00
Highest Valid: 76.80
  Final Train: 100.00
   Final Test: 76.30
Split: 01, Run: 03
None time:  1.16636219387874
None Run 03:
Highest Train: 100.00
Highest Valid: 76.40
  Final Train: 100.00
   Final Test: 78.50
run time now: 2.851766347885132
total time:  2.8702508478891104
None All runs:
Highest Train: 100.00 ± 0.00
Highest Valid: 77.93 ± 2.32
  Final Train: 100.00 ± 0.00
   Final Test: 78.57 ± 2.30
[I 2023-06-12 00:47:17,020] Trial 372 finished with value: 77.9333267211914 and parameters: {'Fwd': 0.004511128587809397, 'K': 10, 'alpha': 0.6000000000000001, 'dropout': 0.4, 'gnnepoch': 60, 'lambda1': 0.8, 'lambda2': 4.632799727053076, 'loop': 1, 'loss': 'CE', 'lr': 0.004813789959144903, 'softmaxF': True, 'useGCN': False, 'weight_decay': 5.7973094076241374e-05, 'weightedloss': True}. Best is trial 112 with value: 81.66667175292969.
/home/wxy/miniconda3/lib/python3.10/site-packages/optuna/distributions.py:685: UserWarning: The distribution is specified by [0, 1.00001] and step=0.05, but the range is not divisible by `step`. It will be replaced by [0, 1.0].
  warnings.warn(
K:  10
alpha:  0.55
lr:  0.003413157583878306
weight_decay:  1.9590788675211337e-06
dropout:  0.4
fix split and run 3 times
Data: Data(x=[2708, 1433], y=[2708], train_mask=[2708], val_mask=[2708], test_mask=[2708], adj_t=[2708, 2708, nnz=10556])
num_train tensor(140)
num_noise 0
noise: tensor(0)
data feature 1433
ALTOPT(
  (lins): Sequential(
    (0): Linear(in_features=1433, out_features=64, bias=True)
    (1): BatchNorm1d(64, eps=1e-05, momentum=0.1, affine=True, track_running_stats=True)
    (2): Dropout(p=0.4, inplace=True)
    (3): ReLU(inplace=True)
    (4): Linear(in_features=64, out_features=7, bias=True)
    (5): LogSoftmax(dim=-1)
  )
  (prop): Propagation(K=10, mode=None, lambda1=None, lambda2=None, L21=True, alpha=0.55)
  (gcn): GCN(
    (convs): ModuleList(
      (0): GCNConv(1433, 64)
      (1): GCNConv(64, 7)
    )
    (bns): ModuleList(
      (0): BatchNorm1d(64, eps=1e-05, momentum=0.1, affine=True, track_running_stats=True)
    )
    (output): LogSoftmax(dim=-1)
  )
)
propagate done
init label
Split: 01, Run: 01
None time:  1.8241082790773362
None Run 01:
Highest Train: 100.00
Highest Valid: 80.80
  Final Train: 100.00
   Final Test: 81.90
Split: 01, Run: 02
None time:  1.8885146158281714
None Run 02:
Highest Train: 100.00
Highest Valid: 79.80
  Final Train: 100.00
   Final Test: 81.00
Split: 01, Run: 03
None time:  1.708975617075339
None Run 03:
Highest Train: 100.00
Highest Valid: 80.20
  Final Train: 100.00
   Final Test: 81.20
run time now: 5.455977439880371
total time:  5.475658556213602
None All runs:
Highest Train: 100.00 ± 0.00
Highest Valid: 80.27 ± 0.50
  Final Train: 100.00 ± 0.00
   Final Test: 81.37 ± 0.47
[I 2023-06-12 00:47:23,023] Trial 373 finished with value: 80.26667022705078 and parameters: {'Fwd': 0.07055745244205877, 'K': 10, 'alpha': 0.55, 'dropout': 0.4, 'gnnepoch': 70, 'lambda1': 0.8500000000000001, 'lambda2': 5.596942458406459, 'loop': 1, 'loss': 'CE', 'lr': 0.003413157583878306, 'softmaxF': True, 'useGCN': True, 'weight_decay': 1.9590788675211337e-06, 'weightedloss': False}. Best is trial 112 with value: 81.66667175292969.
/home/wxy/miniconda3/lib/python3.10/site-packages/optuna/distributions.py:685: UserWarning: The distribution is specified by [0, 1.00001] and step=0.05, but the range is not divisible by `step`. It will be replaced by [0, 1.0].
  warnings.warn(
K:  10
alpha:  0.6000000000000001
lr:  0.006191960435057273
weight_decay:  3.837708136397142e-05
dropout:  0.4
fix split and run 3 times
Data: Data(x=[2708, 1433], y=[2708], train_mask=[2708], val_mask=[2708], test_mask=[2708], adj_t=[2708, 2708, nnz=10556])
num_train tensor(140)
num_noise 0
noise: tensor(0)
data feature 1433
ALTOPT(
  (lins): Sequential(
    (0): Linear(in_features=1433, out_features=64, bias=True)
    (1): BatchNorm1d(64, eps=1e-05, momentum=0.1, affine=True, track_running_stats=True)
    (2): Dropout(p=0.4, inplace=True)
    (3): ReLU(inplace=True)
    (4): Linear(in_features=64, out_features=7, bias=True)
    (5): LogSoftmax(dim=-1)
  )
  (prop): Propagation(K=10, mode=None, lambda1=None, lambda2=None, L21=True, alpha=0.6000000000000001)
  (gcn): GCN(
    (convs): ModuleList(
      (0): GCNConv(1433, 64)
      (1): GCNConv(64, 7)
    )
    (bns): ModuleList(
      (0): BatchNorm1d(64, eps=1e-05, momentum=0.1, affine=True, track_running_stats=True)
    )
    (output): LogSoftmax(dim=-1)
  )
)
propagate done
init label
Split: 01, Run: 01
None time:  0.7876630930695683
None Run 01:
Highest Train: 100.00
Highest Valid: 77.20
  Final Train: 100.00
   Final Test: 77.60
Split: 01, Run: 02
None time:  0.8334799080621451
None Run 02:
Highest Train: 100.00
Highest Valid: 76.20
  Final Train: 100.00
   Final Test: 77.00
Split: 01, Run: 03
None time:  0.8733977528754622
None Run 03:
Highest Train: 100.00
Highest Valid: 77.00
  Final Train: 100.00
   Final Test: 77.70
run time now: 2.525271415710449
total time:  2.540239815134555
None All runs:
Highest Train: 100.00 ± 0.00
Highest Valid: 76.80 ± 0.53
  Final Train: 100.00 ± 0.00
   Final Test: 77.43 ± 0.38
[I 2023-06-12 00:47:26,142] Trial 374 finished with value: 76.80000305175781 and parameters: {'Fwd': 1.3915449880446048e-06, 'K': 10, 'alpha': 0.6000000000000001, 'dropout': 0.4, 'gnnepoch': 10, 'lambda1': 0.9, 'lambda2': 4.897853171042235, 'loop': 1, 'loss': 'CE', 'lr': 0.006191960435057273, 'softmaxF': True, 'useGCN': True, 'weight_decay': 3.837708136397142e-05, 'weightedloss': False}. Best is trial 112 with value: 81.66667175292969.
/home/wxy/miniconda3/lib/python3.10/site-packages/optuna/distributions.py:685: UserWarning: The distribution is specified by [0, 1.00001] and step=0.05, but the range is not divisible by `step`. It will be replaced by [0, 1.0].
  warnings.warn(
K:  10
alpha:  0.65
lr:  0.007218098057904572
weight_decay:  7.116915719494973e-05
dropout:  0.30000000000000004
fix split and run 3 times
Data: Data(x=[2708, 1433], y=[2708], train_mask=[2708], val_mask=[2708], test_mask=[2708], adj_t=[2708, 2708, nnz=10556])
num_train tensor(140)
num_noise 0
noise: tensor(0)
data feature 1433
ALTOPT(
  (lins): Sequential(
    (0): Linear(in_features=1433, out_features=64, bias=True)
    (1): BatchNorm1d(64, eps=1e-05, momentum=0.1, affine=True, track_running_stats=True)
    (2): Dropout(p=0.30000000000000004, inplace=True)
    (3): ReLU(inplace=True)
    (4): Linear(in_features=64, out_features=7, bias=True)
    (5): LogSoftmax(dim=-1)
  )
  (prop): Propagation(K=10, mode=None, lambda1=None, lambda2=None, L21=True, alpha=0.65)
  (gcn): GCN(
    (convs): ModuleList(
      (0): GCNConv(1433, 64)
      (1): GCNConv(64, 7)
    )
    (bns): ModuleList(
      (0): BatchNorm1d(64, eps=1e-05, momentum=0.1, affine=True, track_running_stats=True)
    )
    (output): LogSoftmax(dim=-1)
  )
)
propagate done
init label
Split: 01, Run: 01
None time:  1.3023696038872004
None Run 01:
Highest Train: 100.00
Highest Valid: 80.40
  Final Train: 100.00
   Final Test: 82.70
Split: 01, Run: 02
None time:  1.6639324410352856
None Run 02:
Highest Train: 100.00
Highest Valid: 81.20
  Final Train: 100.00
   Final Test: 81.70
Split: 01, Run: 03
None time:  2.0131335959304124
None Run 03:
Highest Train: 100.00
Highest Valid: 80.80
  Final Train: 100.00
   Final Test: 81.30
run time now: 4.999866008758545
total time:  5.012546293903142
None All runs:
Highest Train: 100.00 ± 0.00
Highest Valid: 80.80 ± 0.40
  Final Train: 100.00 ± 0.00
   Final Test: 81.90 ± 0.72
[I 2023-06-12 00:47:31,782] Trial 375 finished with value: 80.80000305175781 and parameters: {'Fwd': 0.04019842303478303, 'K': 10, 'alpha': 0.65, 'dropout': 0.30000000000000004, 'gnnepoch': 60, 'lambda1': 0.8500000000000001, 'lambda2': 5.154685577021765, 'loop': 1, 'loss': 'CE', 'lr': 0.007218098057904572, 'softmaxF': True, 'useGCN': True, 'weight_decay': 7.116915719494973e-05, 'weightedloss': True}. Best is trial 112 with value: 81.66667175292969.
/home/wxy/miniconda3/lib/python3.10/site-packages/optuna/distributions.py:685: UserWarning: The distribution is specified by [0, 1.00001] and step=0.05, but the range is not divisible by `step`. It will be replaced by [0, 1.0].
  warnings.warn(
K:  10
alpha:  0.7000000000000001
lr:  0.0087423363010977
weight_decay:  0.00012475454510850378
dropout:  0.5
fix split and run 3 times
Data: Data(x=[2708, 1433], y=[2708], train_mask=[2708], val_mask=[2708], test_mask=[2708], adj_t=[2708, 2708, nnz=10556])
num_train tensor(140)
num_noise 0
noise: tensor(0)
data feature 1433
ALTOPT(
  (lins): Sequential(
    (0): Linear(in_features=1433, out_features=64, bias=True)
    (1): BatchNorm1d(64, eps=1e-05, momentum=0.1, affine=True, track_running_stats=True)
    (2): Dropout(p=0.5, inplace=True)
    (3): ReLU(inplace=True)
    (4): Linear(in_features=64, out_features=7, bias=True)
    (5): LogSoftmax(dim=-1)
  )
  (prop): Propagation(K=10, mode=None, lambda1=None, lambda2=None, L21=True, alpha=0.7000000000000001)
  (gcn): GCN(
    (convs): ModuleList(
      (0): GCNConv(1433, 64)
      (1): GCNConv(64, 7)
    )
    (bns): ModuleList(
      (0): BatchNorm1d(64, eps=1e-05, momentum=0.1, affine=True, track_running_stats=True)
    )
    (output): LogSoftmax(dim=-1)
  )
)
propagate done
init label
Split: 01, Run: 01
None time:  1.671024170005694
None Run 01:
Highest Train: 100.00
Highest Valid: 82.00
  Final Train: 100.00
   Final Test: 82.30
Split: 01, Run: 02
None time:  1.7612883469555527
None Run 02:
Highest Train: 100.00
Highest Valid: 81.20
  Final Train: 100.00
   Final Test: 81.20
Split: 01, Run: 03
None time:  1.6431800050195307
None Run 03:
Highest Train: 100.00
Highest Valid: 80.80
  Final Train: 100.00
   Final Test: 81.30
run time now: 5.105170249938965
total time:  5.121063042199239
None All runs:
Highest Train: 100.00 ± 0.00
Highest Valid: 81.33 ± 0.61
  Final Train: 100.00 ± 0.00
   Final Test: 81.60 ± 0.61
