[I 2023-06-12 00:53:55,658] Trial 440 finished with value: 79.5999984741211 and parameters: {'Fwd': 1.237715036690993e-05, 'K': 10, 'alpha': 0.9500000000000001, 'dropout': 0.9, 'gnnepoch': 60, 'lambda1': 0.6000000000000001, 'lambda2': 3.2035013023863685, 'loop': 1, 'loss': 'CE', 'lr': 0.003161650638832764, 'softmaxF': True, 'useGCN': False, 'weight_decay': 0.0002942095385457357, 'weightedloss': False}. Best is trial 364 with value: 83.66666412353516.
/home/wxy/miniconda3/lib/python3.10/site-packages/optuna/distributions.py:685: UserWarning: The distribution is specified by [0, 1.00001] and step=0.05, but the range is not divisible by `step`. It will be replaced by [0, 1.0].
  warnings.warn(
K:  9
alpha:  1.0
lr:  0.002338409826238471
weight_decay:  7.2412057722464175e-06
dropout:  0.9
fix split and run 3 times
Data: Data(x=[19717, 500], y=[19717], train_mask=[19717], val_mask=[19717], test_mask=[19717], adj_t=[19717, 19717, nnz=88648])
num_train tensor(60)
num_noise 0
noise: tensor(0)
data feature 500
ALTOPT(
  (lins): Sequential(
    (0): Linear(in_features=500, out_features=64, bias=True)
    (1): BatchNorm1d(64, eps=1e-05, momentum=0.1, affine=True, track_running_stats=True)
    (2): Dropout(p=0.9, inplace=True)
    (3): ReLU(inplace=True)
    (4): Linear(in_features=64, out_features=3, bias=True)
    (5): Identity()
  )
  (prop): Propagation(K=9, mode=None, lambda1=None, lambda2=None, L21=True, alpha=1.0)
  (gcn): GCN(
    (convs): ModuleList(
      (0): GCNConv(500, 64)
      (1): GCNConv(64, 3)
    )
    (bns): ModuleList(
      (0): BatchNorm1d(64, eps=1e-05, momentum=0.1, affine=True, track_running_stats=True)
    )
    (output): Identity()
  )
)
propagate done
init label
Split: 01, Run: 01, Epoch: 100, Loss: 0.3394, Train: 100.00%, Valid: 82.40% Test: 77.60%
Split: 01, Run: 01
None time:  3.5789232461247593
None Run 01:
Highest Train: 100.00
Highest Valid: 82.40
  Final Train: 100.00
   Final Test: 77.60
Split: 01, Run: 02
None time:  1.5993227399885654
None Run 02:
Highest Train: 100.00
Highest Valid: 83.40
  Final Train: 100.00
   Final Test: 79.70
Split: 01, Run: 03
None time:  1.2456902971025556
None Run 03:
Highest Train: 100.00
Highest Valid: 82.20
  Final Train: 100.00
   Final Test: 79.90
run time now: 6.468850135803223
total time:  6.511768748052418
None All runs:
Highest Train: 100.00 ± 0.00
Highest Valid: 82.67 ± 0.64
  Final Train: 100.00 ± 0.00
   Final Test: 79.07 ± 1.27
[I 2023-06-12 00:54:02,698] Trial 441 finished with value: 82.66666412353516 and parameters: {'Fwd': 8.943661286167127e-06, 'K': 9, 'alpha': 1.0, 'dropout': 0.9, 'gnnepoch': 60, 'lambda1': 0.8500000000000001, 'lambda2': 3.539878769747558, 'loop': 1, 'loss': 'MSE', 'lr': 0.002338409826238471, 'softmaxF': True, 'useGCN': False, 'weight_decay': 7.2412057722464175e-06, 'weightedloss': False}. Best is trial 364 with value: 83.66666412353516.
/home/wxy/miniconda3/lib/python3.10/site-packages/optuna/distributions.py:685: UserWarning: The distribution is specified by [0, 1.00001] and step=0.05, but the range is not divisible by `step`. It will be replaced by [0, 1.0].
  warnings.warn(
K:  10
alpha:  0.9500000000000001
lr:  0.003487726416338089
weight_decay:  0.008822820225834301
dropout:  0.9
fix split and run 3 times
Data: Data(x=[19717, 500], y=[19717], train_mask=[19717], val_mask=[19717], test_mask=[19717], adj_t=[19717, 19717, nnz=88648])
num_train tensor(60)
num_noise 0
noise: tensor(0)
data feature 500
ALTOPT(
  (lins): Sequential(
    (0): Linear(in_features=500, out_features=64, bias=True)
    (1): BatchNorm1d(64, eps=1e-05, momentum=0.1, affine=True, track_running_stats=True)
    (2): Dropout(p=0.9, inplace=True)
    (3): ReLU(inplace=True)
    (4): Linear(in_features=64, out_features=3, bias=True)
    (5): Identity()
  )
  (prop): Propagation(K=10, mode=None, lambda1=None, lambda2=None, L21=True, alpha=0.9500000000000001)
  (gcn): GCN(
    (convs): ModuleList(
      (0): GCNConv(500, 64)
      (1): GCNConv(64, 3)
    )
    (bns): ModuleList(
      (0): BatchNorm1d(64, eps=1e-05, momentum=0.1, affine=True, track_running_stats=True)
    )
    (output): Identity()
  )
)
propagate done
init label
Split: 01, Run: 01
None time:  0.8885717638768256
None Run 01:
Highest Train: 100.00
Highest Valid: 69.40
  Final Train: 100.00
   Final Test: 69.40
Split: 01, Run: 02
None time:  0.9520044790115207
None Run 02:
Highest Train: 100.00
Highest Valid: 83.40
  Final Train: 100.00
   Final Test: 80.40
Split: 01, Run: 03
None time:  1.7977468059398234
None Run 03:
Highest Train: 100.00
Highest Valid: 82.40
  Final Train: 100.00
   Final Test: 80.10
run time now: 3.718794584274292
total time:  3.794889993034303
None All runs:
Highest Train: 100.00 ± 0.00
Highest Valid: 78.40 ± 7.81
  Final Train: 100.00 ± 0.00
   Final Test: 76.63 ± 6.27
[I 2023-06-12 00:54:07,044] Trial 442 finished with value: 78.4000015258789 and parameters: {'Fwd': 4.303150077377161e-06, 'K': 10, 'alpha': 0.9500000000000001, 'dropout': 0.9, 'gnnepoch': 50, 'lambda1': 0.75, 'lambda2': 3.9521016963606894, 'loop': 1, 'loss': 'MSE', 'lr': 0.003487726416338089, 'softmaxF': True, 'useGCN': False, 'weight_decay': 0.008822820225834301, 'weightedloss': False}. Best is trial 364 with value: 83.66666412353516.
/home/wxy/miniconda3/lib/python3.10/site-packages/optuna/distributions.py:685: UserWarning: The distribution is specified by [0, 1.00001] and step=0.05, but the range is not divisible by `step`. It will be replaced by [0, 1.0].
  warnings.warn(
K:  10
alpha:  0.9
lr:  0.004818605939973623
weight_decay:  0.0001797527463201966
dropout:  0.9
fix split and run 3 times
Data: Data(x=[19717, 500], y=[19717], train_mask=[19717], val_mask=[19717], test_mask=[19717], adj_t=[19717, 19717, nnz=88648])
num_train tensor(60)
num_noise 0
noise: tensor(0)
data feature 500
ALTOPT(
  (lins): Sequential(
    (0): Linear(in_features=500, out_features=64, bias=True)
    (1): BatchNorm1d(64, eps=1e-05, momentum=0.1, affine=True, track_running_stats=True)
    (2): Dropout(p=0.9, inplace=True)
    (3): ReLU(inplace=True)
    (4): Linear(in_features=64, out_features=3, bias=True)
    (5): Identity()
  )
  (prop): Propagation(K=10, mode=None, lambda1=None, lambda2=None, L21=True, alpha=0.9)
  (gcn): GCN(
    (convs): ModuleList(
      (0): GCNConv(500, 64)
      (1): GCNConv(64, 3)
    )
    (bns): ModuleList(
      (0): BatchNorm1d(64, eps=1e-05, momentum=0.1, affine=True, track_running_stats=True)
    )
    (output): Identity()
  )
)
propagate done
init label
Split: 01, Run: 01
None time:  1.9254685349296778
None Run 01:
Highest Train: 100.00
Highest Valid: 82.40
  Final Train: 100.00
   Final Test: 78.60
Split: 01, Run: 02
None time:  1.4904394529294223
None Run 02:
Highest Train: 100.00
Highest Valid: 81.40
  Final Train: 100.00
   Final Test: 79.50
Split: 01, Run: 03
None time:  1.1445426871068776
None Run 03:
Highest Train: 100.00
Highest Valid: 82.00
  Final Train: 100.00
   Final Test: 78.50
run time now: 4.611414670944214
total time:  4.668532093986869
None All runs:
Highest Train: 100.00 ± 0.00
Highest Valid: 81.93 ± 0.50
  Final Train: 100.00 ± 0.00
   Final Test: 78.87 ± 0.55
[I 2023-06-12 00:54:12,336] Trial 443 finished with value: 81.93333435058594 and parameters: {'Fwd': 2.883909615354362e-06, 'K': 10, 'alpha': 0.9, 'dropout': 0.9, 'gnnepoch': 70, 'lambda1': 0.9, 'lambda2': 5.797493006064399, 'loop': 1, 'loss': 'MSE', 'lr': 0.004818605939973623, 'softmaxF': True, 'useGCN': False, 'weight_decay': 0.0001797527463201966, 'weightedloss': False}. Best is trial 364 with value: 83.66666412353516.
/home/wxy/miniconda3/lib/python3.10/site-packages/optuna/distributions.py:685: UserWarning: The distribution is specified by [0, 1.00001] and step=0.05, but the range is not divisible by `step`. It will be replaced by [0, 1.0].
  warnings.warn(
K:  10
alpha:  0.9500000000000001
lr:  0.002546424838845051
weight_decay:  6.0676365116282995e-06
dropout:  0.9
fix split and run 3 times
Data: Data(x=[19717, 500], y=[19717], train_mask=[19717], val_mask=[19717], test_mask=[19717], adj_t=[19717, 19717, nnz=88648])
num_train tensor(60)
num_noise 0
noise: tensor(0)
data feature 500
ALTOPT(
  (lins): Sequential(
    (0): Linear(in_features=500, out_features=64, bias=True)
    (1): BatchNorm1d(64, eps=1e-05, momentum=0.1, affine=True, track_running_stats=True)
    (2): Dropout(p=0.9, inplace=True)
    (3): ReLU(inplace=True)
    (4): Linear(in_features=64, out_features=3, bias=True)
    (5): Identity()
  )
  (prop): Propagation(K=10, mode=None, lambda1=None, lambda2=None, L21=True, alpha=0.9500000000000001)
  (gcn): GCN(
    (convs): ModuleList(
      (0): GCNConv(500, 64)
      (1): GCNConv(64, 3)
    )
    (bns): ModuleList(
      (0): BatchNorm1d(64, eps=1e-05, momentum=0.1, affine=True, track_running_stats=True)
    )
    (output): Identity()
  )
)
propagate done
init label
Split: 01, Run: 01
None time:  2.2458368209190667
None Run 01:
Highest Train: 100.00
Highest Valid: 82.00
  Final Train: 100.00
   Final Test: 77.40
Split: 01, Run: 02
None time:  2.0197166078723967
None Run 02:
Highest Train: 100.00
Highest Valid: 84.20
  Final Train: 100.00
   Final Test: 79.40
Split: 01, Run: 03
None time:  0.9283168199472129
None Run 03:
Highest Train: 100.00
Highest Valid: 83.40
  Final Train: 100.00
   Final Test: 79.60
run time now: 5.238170862197876
total time:  5.291906251106411
None All runs:
Highest Train: 100.00 ± 0.00
Highest Valid: 83.20 ± 1.11
  Final Train: 100.00 ± 0.00
   Final Test: 78.80 ± 1.22
[I 2023-06-12 00:54:18,152] Trial 444 finished with value: 83.20000457763672 and parameters: {'Fwd': 0.00066405926982645, 'K': 10, 'alpha': 0.9500000000000001, 'dropout': 0.9, 'gnnepoch': 60, 'lambda1': 0.65, 'lambda2': 4.193541310810274, 'loop': 1, 'loss': 'MSE', 'lr': 0.002546424838845051, 'softmaxF': True, 'useGCN': False, 'weight_decay': 6.0676365116282995e-06, 'weightedloss': False}. Best is trial 364 with value: 83.66666412353516.
/home/wxy/miniconda3/lib/python3.10/site-packages/optuna/distributions.py:685: UserWarning: The distribution is specified by [0, 1.00001] and step=0.05, but the range is not divisible by `step`. It will be replaced by [0, 1.0].
  warnings.warn(
K:  10
alpha:  0.9
lr:  0.002946752675450872
weight_decay:  8.02154772796928e-06
dropout:  0.9
fix split and run 3 times
Data: Data(x=[19717, 500], y=[19717], train_mask=[19717], val_mask=[19717], test_mask=[19717], adj_t=[19717, 19717, nnz=88648])
num_train tensor(60)
num_noise 0
noise: tensor(0)
data feature 500
ALTOPT(
  (lins): Sequential(
    (0): Linear(in_features=500, out_features=64, bias=True)
    (1): BatchNorm1d(64, eps=1e-05, momentum=0.1, affine=True, track_running_stats=True)
    (2): Dropout(p=0.9, inplace=True)
    (3): ReLU(inplace=True)
    (4): Linear(in_features=64, out_features=3, bias=True)
    (5): Identity()
  )
  (prop): Propagation(K=10, mode=None, lambda1=None, lambda2=None, L21=True, alpha=0.9)
  (gcn): GCN(
    (convs): ModuleList(
      (0): GCNConv(500, 64)
      (1): GCNConv(64, 3)
    )
    (bns): ModuleList(
      (0): BatchNorm1d(64, eps=1e-05, momentum=0.1, affine=True, track_running_stats=True)
    )
    (output): Identity()
  )
)
propagate done
init label
Split: 01, Run: 01
None time:  1.7778666180092841
None Run 01:
Highest Train: 100.00
Highest Valid: 77.20
  Final Train: 100.00
   Final Test: 75.60
Split: 01, Run: 02
None time:  2.7947068179491907
None Run 02:
Highest Train: 100.00
Highest Valid: 76.60
  Final Train: 100.00
   Final Test: 74.60
Split: 01, Run: 03
None time:  2.236617603804916
None Run 03:
Highest Train: 100.00
Highest Valid: 76.40
  Final Train: 100.00
   Final Test: 72.90
run time now: 6.864732265472412
total time:  6.915868570795283
None All runs:
Highest Train: 100.00 ± 0.00
Highest Valid: 76.73 ± 0.42
  Final Train: 100.00 ± 0.00
   Final Test: 74.37 ± 1.37
[I 2023-06-12 00:54:25,615] Trial 445 finished with value: 76.73333740234375 and parameters: {'Fwd': 0.0012402627176345824, 'K': 10, 'alpha': 0.9, 'dropout': 0.9, 'gnnepoch': 60, 'lambda1': 0.7000000000000001, 'lambda2': 9.754717360284898, 'loop': 1, 'loss': 'MSE', 'lr': 0.002946752675450872, 'softmaxF': True, 'useGCN': True, 'weight_decay': 8.02154772796928e-06, 'weightedloss': False}. Best is trial 364 with value: 83.66666412353516.
/home/wxy/miniconda3/lib/python3.10/site-packages/optuna/distributions.py:685: UserWarning: The distribution is specified by [0, 1.00001] and step=0.05, but the range is not divisible by `step`. It will be replaced by [0, 1.0].
  warnings.warn(
K:  10
alpha:  1.0
lr:  0.00010180389693081222
weight_decay:  6.229051310961053e-06
dropout:  0.9
fix split and run 3 times
Data: Data(x=[19717, 500], y=[19717], train_mask=[19717], val_mask=[19717], test_mask=[19717], adj_t=[19717, 19717, nnz=88648])
num_train tensor(60)
num_noise 0
noise: tensor(0)
data feature 500
ALTOPT(
  (lins): Sequential(
    (0): Linear(in_features=500, out_features=64, bias=True)
    (1): BatchNorm1d(64, eps=1e-05, momentum=0.1, affine=True, track_running_stats=True)
    (2): Dropout(p=0.9, inplace=True)
    (3): ReLU(inplace=True)
    (4): Linear(in_features=64, out_features=3, bias=True)
    (5): Identity()
  )
  (prop): Propagation(K=10, mode=None, lambda1=None, lambda2=None, L21=True, alpha=1.0)
  (gcn): GCN(
    (convs): ModuleList(
      (0): GCNConv(500, 64)
      (1): GCNConv(64, 3)
    )
    (bns): ModuleList(
      (0): BatchNorm1d(64, eps=1e-05, momentum=0.1, affine=True, track_running_stats=True)
    )
    (output): Identity()
  )
)
propagate done
init label
Split: 01, Run: 01
None time:  0.9679142769891769
None Run 01:
Highest Train: 100.00
Highest Valid: 70.20
  Final Train: 100.00
   Final Test: 69.30
Split: 01, Run: 02
None time:  1.4471162571571767
None Run 02:
Highest Train: 100.00
Highest Valid: 76.60
  Final Train: 98.33
   Final Test: 71.60
Split: 01, Run: 03
None time:  1.0404502740129828
None Run 03:
Highest Train: 100.00
Highest Valid: 79.00
  Final Train: 98.33
   Final Test: 74.60
run time now: 3.5459649562835693
total time:  3.5981470718979836
None All runs:
Highest Train: 100.00 ± 0.00
Highest Valid: 75.27 ± 4.55
  Final Train: 98.89 ± 0.96
   Final Test: 71.83 ± 2.66
[I 2023-06-12 00:54:29,804] Trial 446 finished with value: 75.26667022705078 and parameters: {'Fwd': 0.0005508364891169062, 'K': 10, 'alpha': 1.0, 'dropout': 0.9, 'gnnepoch': 60, 'lambda1': 0.65, 'lambda2': 0.4549987597666849, 'loop': 1, 'loss': 'MSE', 'lr': 0.00010180389693081222, 'softmaxF': True, 'useGCN': False, 'weight_decay': 6.229051310961053e-06, 'weightedloss': False}. Best is trial 364 with value: 83.66666412353516.
/home/wxy/miniconda3/lib/python3.10/site-packages/optuna/distributions.py:685: UserWarning: The distribution is specified by [0, 1.00001] and step=0.05, but the range is not divisible by `step`. It will be replaced by [0, 1.0].
  warnings.warn(
K:  10
alpha:  0.9500000000000001
lr:  0.0026002065556867686
weight_decay:  0.005209680280651212
dropout:  0.9
fix split and run 3 times
Data: Data(x=[19717, 500], y=[19717], train_mask=[19717], val_mask=[19717], test_mask=[19717], adj_t=[19717, 19717, nnz=88648])
num_train tensor(60)
num_noise 0
noise: tensor(0)
data feature 500
ALTOPT(
  (lins): Sequential(
    (0): Linear(in_features=500, out_features=64, bias=True)
    (1): BatchNorm1d(64, eps=1e-05, momentum=0.1, affine=True, track_running_stats=True)
    (2): Dropout(p=0.9, inplace=True)
    (3): ReLU(inplace=True)
    (4): Linear(in_features=64, out_features=3, bias=True)
    (5): Identity()
  )
  (prop): Propagation(K=10, mode=None, lambda1=None, lambda2=None, L21=True, alpha=0.9500000000000001)
  (gcn): GCN(
    (convs): ModuleList(
      (0): GCNConv(500, 64)
      (1): GCNConv(64, 3)
    )
    (bns): ModuleList(
      (0): BatchNorm1d(64, eps=1e-05, momentum=0.1, affine=True, track_running_stats=True)
    )
    (output): Identity()
  )
)
propagate done
init label
Split: 01, Run: 01
None time:  2.1621012948453426
None Run 01:
Highest Train: 100.00
Highest Valid: 84.00
  Final Train: 100.00
   Final Test: 79.30
Split: 01, Run: 02
None time:  1.211482359096408
None Run 02:
Highest Train: 100.00
Highest Valid: 80.80
  Final Train: 100.00
   Final Test: 78.60
Split: 01, Run: 03
None time:  1.6890853228978813
None Run 03:
Highest Train: 100.00
Highest Valid: 81.80
  Final Train: 100.00
   Final Test: 77.80
run time now: 5.131555557250977
total time:  5.177326782839373
None All runs:
Highest Train: 100.00 ± 0.00
Highest Valid: 82.20 ± 1.64
  Final Train: 100.00 ± 0.00
   Final Test: 78.57 ± 0.75
[I 2023-06-12 00:54:35,473] Trial 447 finished with value: 82.20000457763672 and parameters: {'Fwd': 0.0006620246234901033, 'K': 10, 'alpha': 0.9500000000000001, 'dropout': 0.9, 'gnnepoch': 70, 'lambda1': 0.65, 'lambda2': 7.798682665315785, 'loop': 1, 'loss': 'MSE', 'lr': 0.0026002065556867686, 'softmaxF': True, 'useGCN': False, 'weight_decay': 0.005209680280651212, 'weightedloss': False}. Best is trial 364 with value: 83.66666412353516.
/home/wxy/miniconda3/lib/python3.10/site-packages/optuna/distributions.py:685: UserWarning: The distribution is specified by [0, 1.00001] and step=0.05, but the range is not divisible by `step`. It will be replaced by [0, 1.0].
  warnings.warn(
K:  10
alpha:  0.9500000000000001
lr:  0.002816376216370892
weight_decay:  3.474983721197853e-06
dropout:  0.9
fix split and run 3 times
Data: Data(x=[19717, 500], y=[19717], train_mask=[19717], val_mask=[19717], test_mask=[19717], adj_t=[19717, 19717, nnz=88648])
num_train tensor(60)
num_noise 0
noise: tensor(0)
data feature 500
ALTOPT(
  (lins): Sequential(
    (0): Linear(in_features=500, out_features=64, bias=True)
    (1): BatchNorm1d(64, eps=1e-05, momentum=0.1, affine=True, track_running_stats=True)
    (2): Dropout(p=0.9, inplace=True)
    (3): ReLU(inplace=True)
    (4): Linear(in_features=64, out_features=3, bias=True)
    (5): Identity()
  )
  (prop): Propagation(K=10, mode=None, lambda1=None, lambda2=None, L21=True, alpha=0.9500000000000001)
  (gcn): GCN(
    (convs): ModuleList(
      (0): GCNConv(500, 64)
      (1): GCNConv(64, 3)
    )
    (bns): ModuleList(
      (0): BatchNorm1d(64, eps=1e-05, momentum=0.1, affine=True, track_running_stats=True)
    )
    (output): Identity()
  )
)
propagate done
init label
Split: 01, Run: 01
None time:  2.519494473002851
None Run 01:
Highest Train: 100.00
Highest Valid: 82.00
  Final Train: 100.00
   Final Test: 77.60
Split: 01, Run: 02
None time:  0.7439547078683972
None Run 02:
Highest Train: 100.00
Highest Valid: 83.60
  Final Train: 100.00
   Final Test: 78.20
Split: 01, Run: 03, Epoch: 100, Loss: 0.1405, Train: 100.00%, Valid: 82.60% Test: 79.80%
Split: 01, Run: 03
None time:  3.605354896048084
None Run 03:
Highest Train: 100.00
Highest Valid: 82.60
  Final Train: 100.00
   Final Test: 79.90
run time now: 6.919524431228638
total time:  6.969086328987032
None All runs:
Highest Train: 100.00 ± 0.00
Highest Valid: 82.73 ± 0.81
  Final Train: 100.00 ± 0.00
   Final Test: 78.57 ± 1.19
[I 2023-06-12 00:54:42,932] Trial 448 finished with value: 82.73333740234375 and parameters: {'Fwd': 0.00029348414208964994, 'K': 10, 'alpha': 0.9500000000000001, 'dropout': 0.9, 'gnnepoch': 60, 'lambda1': 0.65, 'lambda2': 4.3172362937882705, 'loop': 1, 'loss': 'MSE', 'lr': 0.002816376216370892, 'softmaxF': True, 'useGCN': False, 'weight_decay': 3.474983721197853e-06, 'weightedloss': False}. Best is trial 364 with value: 83.66666412353516.
/home/wxy/miniconda3/lib/python3.10/site-packages/optuna/distributions.py:685: UserWarning: The distribution is specified by [0, 1.00001] and step=0.05, but the range is not divisible by `step`. It will be replaced by [0, 1.0].
  warnings.warn(
K:  10
alpha:  1.0
lr:  0.0069419479261523765
weight_decay:  5.147910972253482e-06
dropout:  0.8
fix split and run 3 times
Data: Data(x=[19717, 500], y=[19717], train_mask=[19717], val_mask=[19717], test_mask=[19717], adj_t=[19717, 19717, nnz=88648])
num_train tensor(60)
num_noise 0
noise: tensor(0)
data feature 500
ALTOPT(
  (lins): Sequential(
    (0): Linear(in_features=500, out_features=64, bias=True)
    (1): BatchNorm1d(64, eps=1e-05, momentum=0.1, affine=True, track_running_stats=True)
    (2): Dropout(p=0.8, inplace=True)
    (3): ReLU(inplace=True)
    (4): Linear(in_features=64, out_features=3, bias=True)
    (5): Identity()
  )
  (prop): Propagation(K=10, mode=None, lambda1=None, lambda2=None, L21=True, alpha=1.0)
  (gcn): GCN(
    (convs): ModuleList(
      (0): GCNConv(500, 64)
      (1): GCNConv(64, 3)
    )
    (bns): ModuleList(
      (0): BatchNorm1d(64, eps=1e-05, momentum=0.1, affine=True, track_running_stats=True)
    )
    (output): Identity()
  )
)
propagate done
init label
Split: 01, Run: 01
None time:  0.8810133000370115
None Run 01:
Highest Train: 100.00
Highest Valid: 69.80
  Final Train: 100.00
   Final Test: 69.60
Split: 01, Run: 02
None time:  1.396626451984048
None Run 02:
Highest Train: 100.00
Highest Valid: 82.40
  Final Train: 100.00
   Final Test: 79.20
Split: 01, Run: 03
None time:  0.8840028431732208
None Run 03:
Highest Train: 100.00
Highest Valid: 80.60
  Final Train: 100.00
   Final Test: 77.70
run time now: 3.215535879135132
total time:  3.2623144588433206
None All runs:
Highest Train: 100.00 ± 0.00
Highest Valid: 77.60 ± 6.81
  Final Train: 100.00 ± 0.00
   Final Test: 75.50 ± 5.16
