[I 2023-06-12 00:16:13,676] Trial 44 finished with value: 79.06665802001953 and parameters: {'Fwd': 1.872677209016309e-05, 'K': 5, 'alpha': 0.9, 'dropout': 0.30000000000000004, 'gnnepoch': 70, 'lambda1': 0.65, 'lambda2': 8.29688884229423, 'loop': 1, 'loss': 'MSE', 'lr': 0.0016081080215640856, 'softmaxF': True, 'useGCN': False, 'weight_decay': 2.2552514549796766e-05, 'weightedloss': True}. Best is trial 36 with value: 81.33333587646484.
/home/wxy/miniconda3/lib/python3.10/site-packages/optuna/distributions.py:685: UserWarning: The distribution is specified by [0, 1.00001] and step=0.05, but the range is not divisible by `step`. It will be replaced by [0, 1.0].
  warnings.warn(
K:  7
alpha:  0.7000000000000001
lr:  0.0028148573211726
weight_decay:  0.000145476223962776
dropout:  0.6000000000000001
fix split and run 3 times
Data: Data(x=[19717, 500], y=[19717], train_mask=[19717], val_mask=[19717], test_mask=[19717], adj_t=[19717, 19717, nnz=88648])
num_train tensor(60)
num_noise 0
noise: tensor(0)
data feature 500
ALTOPT(
  (lins): Sequential(
    (0): Linear(in_features=500, out_features=64, bias=True)
    (1): BatchNorm1d(64, eps=1e-05, momentum=0.1, affine=True, track_running_stats=True)
    (2): Dropout(p=0.6000000000000001, inplace=True)
    (3): ReLU(inplace=True)
    (4): Linear(in_features=64, out_features=3, bias=True)
    (5): Identity()
  )
  (prop): Propagation(K=7, mode=None, lambda1=None, lambda2=None, L21=True, alpha=0.7000000000000001)
  (gcn): GCN(
    (convs): ModuleList(
      (0): GCNConv(500, 64)
      (1): GCNConv(64, 3)
    )
    (bns): ModuleList(
      (0): BatchNorm1d(64, eps=1e-05, momentum=0.1, affine=True, track_running_stats=True)
    )
    (output): Identity()
  )
)
propagate done
init label
Split: 01, Run: 01
None time:  1.7150034359656274
None Run 01:
Highest Train: 100.00
Highest Valid: 79.80
  Final Train: 100.00
   Final Test: 76.60
Split: 01, Run: 02
None time:  2.033434512093663
None Run 02:
Highest Train: 100.00
Highest Valid: 79.60
  Final Train: 100.00
   Final Test: 77.60
Split: 01, Run: 03
None time:  1.3375392251182348
None Run 03:
Highest Train: 100.00
Highest Valid: 77.80
  Final Train: 100.00
   Final Test: 76.60
run time now: 5.1294944286346436
total time:  5.176369698951021
None All runs:
Highest Train: 100.00 ± 0.00
Highest Valid: 79.07 ± 1.10
  Final Train: 100.00 ± 0.00
   Final Test: 76.93 ± 0.58
[I 2023-06-12 00:16:19,261] Trial 45 finished with value: 79.06666564941406 and parameters: {'Fwd': 7.462311257345786e-05, 'K': 7, 'alpha': 0.7000000000000001, 'dropout': 0.6000000000000001, 'gnnepoch': 110, 'lambda1': 0.55, 'lambda2': 8.806364395685318, 'loop': 1, 'loss': 'MSE', 'lr': 0.0028148573211726, 'softmaxF': True, 'useGCN': False, 'weight_decay': 0.000145476223962776, 'weightedloss': False}. Best is trial 36 with value: 81.33333587646484.
/home/wxy/miniconda3/lib/python3.10/site-packages/optuna/distributions.py:685: UserWarning: The distribution is specified by [0, 1.00001] and step=0.05, but the range is not divisible by `step`. It will be replaced by [0, 1.0].
  warnings.warn(
K:  6
alpha:  0.9500000000000001
lr:  0.0020907378090920144
weight_decay:  0.0006471779986696478
dropout:  0.2
fix split and run 3 times
Data: Data(x=[19717, 500], y=[19717], train_mask=[19717], val_mask=[19717], test_mask=[19717], adj_t=[19717, 19717, nnz=88648])
num_train tensor(60)
num_noise 0
noise: tensor(0)
data feature 500
ALTOPT(
  (lins): Sequential(
    (0): Linear(in_features=500, out_features=64, bias=True)
    (1): BatchNorm1d(64, eps=1e-05, momentum=0.1, affine=True, track_running_stats=True)
    (2): Dropout(p=0.2, inplace=True)
    (3): ReLU(inplace=True)
    (4): Linear(in_features=64, out_features=3, bias=True)
    (5): Identity()
  )
  (prop): Propagation(K=6, mode=None, lambda1=None, lambda2=None, L21=True, alpha=0.9500000000000001)
  (gcn): GCN(
    (convs): ModuleList(
      (0): GCNConv(500, 64)
      (1): GCNConv(64, 3)
    )
    (bns): ModuleList(
      (0): BatchNorm1d(64, eps=1e-05, momentum=0.1, affine=True, track_running_stats=True)
    )
    (output): Identity()
  )
)
propagate done
init label
Split: 01, Run: 01
None time:  1.0481381891295314
None Run 01:
Highest Train: 100.00
Highest Valid: 80.60
  Final Train: 100.00
   Final Test: 78.10
Split: 01, Run: 02
None time:  1.456660286989063
None Run 02:
Highest Train: 100.00
Highest Valid: 81.60
  Final Train: 100.00
   Final Test: 79.60
Split: 01, Run: 03
None time:  0.8244515769183636
None Run 03:
Highest Train: 100.00
Highest Valid: 80.20
  Final Train: 100.00
   Final Test: 78.30
run time now: 3.371809244155884
total time:  3.4158959600608796
None All runs:
Highest Train: 100.00 ± 0.00
Highest Valid: 80.80 ± 0.72
  Final Train: 100.00 ± 0.00
   Final Test: 78.67 ± 0.81
[I 2023-06-12 00:16:23,165] Trial 46 finished with value: 80.79999542236328 and parameters: {'Fwd': 9.146349265685479e-06, 'K': 6, 'alpha': 0.9500000000000001, 'dropout': 0.2, 'gnnepoch': 60, 'lambda1': 0.15000000000000002, 'lambda2': 9.45357176308195, 'loop': 1, 'loss': 'MSE', 'lr': 0.0020907378090920144, 'softmaxF': True, 'useGCN': False, 'weight_decay': 0.0006471779986696478, 'weightedloss': False}. Best is trial 36 with value: 81.33333587646484.
/home/wxy/miniconda3/lib/python3.10/site-packages/optuna/distributions.py:685: UserWarning: The distribution is specified by [0, 1.00001] and step=0.05, but the range is not divisible by `step`. It will be replaced by [0, 1.0].
  warnings.warn(
K:  6
alpha:  0.9500000000000001
lr:  0.0020744153189269725
weight_decay:  0.0014339615815063605
dropout:  0.1
fix split and run 3 times
Data: Data(x=[19717, 500], y=[19717], train_mask=[19717], val_mask=[19717], test_mask=[19717], adj_t=[19717, 19717, nnz=88648])
num_train tensor(60)
num_noise 0
noise: tensor(0)
data feature 500
ALTOPT(
  (lins): Sequential(
    (0): Linear(in_features=500, out_features=64, bias=True)
    (1): BatchNorm1d(64, eps=1e-05, momentum=0.1, affine=True, track_running_stats=True)
    (2): Dropout(p=0.1, inplace=True)
    (3): ReLU(inplace=True)
    (4): Linear(in_features=64, out_features=3, bias=True)
    (5): Identity()
  )
  (prop): Propagation(K=6, mode=None, lambda1=None, lambda2=None, L21=True, alpha=0.9500000000000001)
  (gcn): GCN(
    (convs): ModuleList(
      (0): GCNConv(500, 64)
      (1): GCNConv(64, 3)
    )
    (bns): ModuleList(
      (0): BatchNorm1d(64, eps=1e-05, momentum=0.1, affine=True, track_running_stats=True)
    )
    (output): Identity()
  )
)
propagate done
init label
Split: 01, Run: 01
None time:  2.0564009121153504
None Run 01:
Highest Train: 100.00
Highest Valid: 77.20
  Final Train: 100.00
   Final Test: 76.50
Split: 01, Run: 02
None time:  2.259298738790676
None Run 02:
Highest Train: 100.00
Highest Valid: 78.00
  Final Train: 100.00
   Final Test: 76.70
Split: 01, Run: 03
None time:  2.409588106907904
None Run 03:
Highest Train: 100.00
Highest Valid: 78.00
  Final Train: 100.00
   Final Test: 76.00
run time now: 6.7756781578063965
total time:  6.823538014898077
None All runs:
Highest Train: 100.00 ± 0.00
Highest Valid: 77.73 ± 0.46
  Final Train: 100.00 ± 0.00
   Final Test: 76.40 ± 0.36
[I 2023-06-12 00:16:30,467] Trial 47 finished with value: 77.73333740234375 and parameters: {'Fwd': 9.044035176654971e-06, 'K': 6, 'alpha': 0.9500000000000001, 'dropout': 0.1, 'gnnepoch': 60, 'lambda1': 0.15000000000000002, 'lambda2': 9.701612209862592, 'loop': 1, 'loss': 'MSE', 'lr': 0.0020744153189269725, 'softmaxF': False, 'useGCN': True, 'weight_decay': 0.0014339615815063605, 'weightedloss': True}. Best is trial 36 with value: 81.33333587646484.
/home/wxy/miniconda3/lib/python3.10/site-packages/optuna/distributions.py:685: UserWarning: The distribution is specified by [0, 1.00001] and step=0.05, but the range is not divisible by `step`. It will be replaced by [0, 1.0].
  warnings.warn(
K:  6
alpha:  0.9500000000000001
lr:  0.0013161977757559576
weight_decay:  0.0006767481502592912
dropout:  0.2
fix split and run 3 times
Data: Data(x=[19717, 500], y=[19717], train_mask=[19717], val_mask=[19717], test_mask=[19717], adj_t=[19717, 19717, nnz=88648])
num_train tensor(60)
num_noise 0
noise: tensor(0)
data feature 500
ALTOPT(
  (lins): Sequential(
    (0): Linear(in_features=500, out_features=64, bias=True)
    (1): BatchNorm1d(64, eps=1e-05, momentum=0.1, affine=True, track_running_stats=True)
    (2): Dropout(p=0.2, inplace=True)
    (3): ReLU(inplace=True)
    (4): Linear(in_features=64, out_features=3, bias=True)
    (5): Identity()
  )
  (prop): Propagation(K=6, mode=None, lambda1=None, lambda2=None, L21=True, alpha=0.9500000000000001)
  (gcn): GCN(
    (convs): ModuleList(
      (0): GCNConv(500, 64)
      (1): GCNConv(64, 3)
    )
    (bns): ModuleList(
      (0): BatchNorm1d(64, eps=1e-05, momentum=0.1, affine=True, track_running_stats=True)
    )
    (output): Identity()
  )
)
propagate done
init label
Split: 01, Run: 01
None time:  1.1822283300571144
None Run 01:
Highest Train: 100.00
Highest Valid: 80.80
  Final Train: 100.00
   Final Test: 78.20
Split: 01, Run: 02
None time:  2.243958994979039
None Run 02:
Highest Train: 100.00
Highest Valid: 82.00
  Final Train: 100.00
   Final Test: 79.50
Split: 01, Run: 03
None time:  1.4169931719079614
None Run 03:
Highest Train: 100.00
Highest Valid: 81.80
  Final Train: 100.00
   Final Test: 80.70
run time now: 4.892749786376953
total time:  4.946453502867371
None All runs:
Highest Train: 100.00 ± 0.00
Highest Valid: 81.53 ± 0.64
  Final Train: 100.00 ± 0.00
   Final Test: 79.47 ± 1.25
[I 2023-06-12 00:16:35,869] Trial 48 finished with value: 81.53333282470703 and parameters: {'Fwd': 3.979867008319731e-06, 'K': 6, 'alpha': 0.9500000000000001, 'dropout': 0.2, 'gnnepoch': 50, 'lambda1': 0.05, 'lambda2': 8.246034073718224, 'loop': 2, 'loss': 'MSE', 'lr': 0.0013161977757559576, 'softmaxF': True, 'useGCN': False, 'weight_decay': 0.0006767481502592912, 'weightedloss': False}. Best is trial 48 with value: 81.53333282470703.
/home/wxy/miniconda3/lib/python3.10/site-packages/optuna/distributions.py:685: UserWarning: The distribution is specified by [0, 1.00001] and step=0.05, but the range is not divisible by `step`. It will be replaced by [0, 1.0].
  warnings.warn(
K:  4
alpha:  0.9500000000000001
lr:  0.001006980262109759
weight_decay:  0.0006095280501591056
dropout:  0.2
fix split and run 3 times
Data: Data(x=[19717, 500], y=[19717], train_mask=[19717], val_mask=[19717], test_mask=[19717], adj_t=[19717, 19717, nnz=88648])
num_train tensor(60)
num_noise 0
noise: tensor(0)
data feature 500
ALTOPT(
  (lins): Sequential(
    (0): Linear(in_features=500, out_features=64, bias=True)
    (1): BatchNorm1d(64, eps=1e-05, momentum=0.1, affine=True, track_running_stats=True)
    (2): Dropout(p=0.2, inplace=True)
    (3): ReLU(inplace=True)
    (4): Linear(in_features=64, out_features=3, bias=True)
    (5): Identity()
  )
  (prop): Propagation(K=4, mode=None, lambda1=None, lambda2=None, L21=True, alpha=0.9500000000000001)
  (gcn): GCN(
    (convs): ModuleList(
      (0): GCNConv(500, 64)
      (1): GCNConv(64, 3)
    )
    (bns): ModuleList(
      (0): BatchNorm1d(64, eps=1e-05, momentum=0.1, affine=True, track_running_stats=True)
    )
    (output): Identity()
  )
)
propagate done
init label
Split: 01, Run: 01
None time:  1.1234442919958383
None Run 01:
Highest Train: 100.00
Highest Valid: 73.40
  Final Train: 100.00
   Final Test: 72.00
Split: 01, Run: 02
None time:  1.0594177460297942
None Run 02:
Highest Train: 100.00
Highest Valid: 73.40
  Final Train: 100.00
   Final Test: 72.00
Split: 01, Run: 03
None time:  1.068539029918611
None Run 03:
Highest Train: 100.00
Highest Valid: 73.40
  Final Train: 100.00
   Final Test: 72.00
run time now: 3.3141720294952393
total time:  3.417070942930877
None All runs:
Highest Train: 100.00 ± 0.00
Highest Valid: 73.40 ± 0.00
  Final Train: 100.00 ± 0.00
   Final Test: 72.00 ± 0.00
[I 2023-06-12 00:16:39,745] Trial 49 finished with value: 73.4000015258789 and parameters: {'Fwd': 4.3086433712285545e-06, 'K': 4, 'alpha': 0.9500000000000001, 'dropout': 0.2, 'gnnepoch': 40, 'lambda1': 0.0, 'lambda2': 8.049140992520535, 'loop': 2, 'loss': 'MSE', 'lr': 0.001006980262109759, 'softmaxF': True, 'useGCN': False, 'weight_decay': 0.0006095280501591056, 'weightedloss': False}. Best is trial 48 with value: 81.53333282470703.
/home/wxy/miniconda3/lib/python3.10/site-packages/optuna/distributions.py:685: UserWarning: The distribution is specified by [0, 1.00001] and step=0.05, but the range is not divisible by `step`. It will be replaced by [0, 1.0].
  warnings.warn(
K:  5
alpha:  0.8
lr:  0.001417553356682082
weight_decay:  0.0027041045654275556
dropout:  0.0
fix split and run 3 times
Data: Data(x=[19717, 500], y=[19717], train_mask=[19717], val_mask=[19717], test_mask=[19717], adj_t=[19717, 19717, nnz=88648])
num_train tensor(60)
num_noise 0
noise: tensor(0)
data feature 500
ALTOPT(
  (lins): Sequential(
    (0): Linear(in_features=500, out_features=64, bias=True)
    (1): BatchNorm1d(64, eps=1e-05, momentum=0.1, affine=True, track_running_stats=True)
    (2): Dropout(p=0.0, inplace=True)
    (3): ReLU(inplace=True)
    (4): Linear(in_features=64, out_features=3, bias=True)
    (5): Identity()
  )
  (prop): Propagation(K=5, mode=None, lambda1=None, lambda2=None, L21=True, alpha=0.8)
  (gcn): GCN(
    (convs): ModuleList(
      (0): GCNConv(500, 64)
      (1): GCNConv(64, 3)
    )
    (bns): ModuleList(
      (0): BatchNorm1d(64, eps=1e-05, momentum=0.1, affine=True, track_running_stats=True)
    )
    (output): Identity()
  )
)
propagate done
init label
Split: 01, Run: 01
None time:  0.753466472029686
None Run 01:
Highest Train: 100.00
Highest Valid: 67.80
  Final Train: 100.00
   Final Test: 68.10
Split: 01, Run: 02
None time:  0.9080908549949527
None Run 02:
Highest Train: 100.00
Highest Valid: 81.80
  Final Train: 100.00
   Final Test: 78.40
Split: 01, Run: 03
None time:  1.0886748949997127
None Run 03:
Highest Train: 100.00
Highest Valid: 79.80
  Final Train: 100.00
   Final Test: 78.90
run time now: 2.79171085357666
total time:  2.838391182012856
None All runs:
Highest Train: 100.00 ± 0.00
Highest Valid: 76.47 ± 7.57
  Final Train: 100.00 ± 0.00
   Final Test: 75.13 ± 6.10
[I 2023-06-12 00:16:43,099] Trial 50 finished with value: 76.46666717529297 and parameters: {'Fwd': 1.846094478425923e-06, 'K': 5, 'alpha': 0.8, 'dropout': 0.0, 'gnnepoch': 40, 'lambda1': 0.1, 'lambda2': 6.270922567036455, 'loop': 2, 'loss': 'MSE', 'lr': 0.001417553356682082, 'softmaxF': True, 'useGCN': False, 'weight_decay': 0.0027041045654275556, 'weightedloss': False}. Best is trial 48 with value: 81.53333282470703.
/home/wxy/miniconda3/lib/python3.10/site-packages/optuna/distributions.py:685: UserWarning: The distribution is specified by [0, 1.00001] and step=0.05, but the range is not divisible by `step`. It will be replaced by [0, 1.0].
  warnings.warn(
K:  6
alpha:  1.0
lr:  0.0018723392830442263
weight_decay:  0.000843977174898508
dropout:  0.2
fix split and run 3 times
Data: Data(x=[19717, 500], y=[19717], train_mask=[19717], val_mask=[19717], test_mask=[19717], adj_t=[19717, 19717, nnz=88648])
num_train tensor(60)
num_noise 0
noise: tensor(0)
data feature 500
ALTOPT(
  (lins): Sequential(
    (0): Linear(in_features=500, out_features=64, bias=True)
    (1): BatchNorm1d(64, eps=1e-05, momentum=0.1, affine=True, track_running_stats=True)
    (2): Dropout(p=0.2, inplace=True)
    (3): ReLU(inplace=True)
    (4): Linear(in_features=64, out_features=3, bias=True)
    (5): Identity()
  )
  (prop): Propagation(K=6, mode=None, lambda1=None, lambda2=None, L21=True, alpha=1.0)
  (gcn): GCN(
    (convs): ModuleList(
      (0): GCNConv(500, 64)
      (1): GCNConv(64, 3)
    )
    (bns): ModuleList(
      (0): BatchNorm1d(64, eps=1e-05, momentum=0.1, affine=True, track_running_stats=True)
    )
    (output): Identity()
  )
)
propagate done
init label
Split: 01, Run: 01
None time:  1.494236207101494
None Run 01:
Highest Train: 100.00
Highest Valid: 81.40
  Final Train: 100.00
   Final Test: 78.40
Split: 01, Run: 02
None time:  0.8317461300175637
None Run 02:
Highest Train: 100.00
Highest Valid: 80.80
  Final Train: 100.00
   Final Test: 78.60
Split: 01, Run: 03
None time:  0.8609231400769204
None Run 03:
Highest Train: 100.00
Highest Valid: 77.40
  Final Train: 100.00
   Final Test: 75.50
run time now: 3.23598575592041
total time:  3.277180502889678
None All runs:
Highest Train: 100.00 ± 0.00
Highest Valid: 79.87 ± 2.16
  Final Train: 100.00 ± 0.00
   Final Test: 77.50 ± 1.73
[I 2023-06-12 00:16:46,846] Trial 51 finished with value: 79.86666870117188 and parameters: {'Fwd': 1.0519302844077844e-05, 'K': 6, 'alpha': 1.0, 'dropout': 0.2, 'gnnepoch': 50, 'lambda1': 0.05, 'lambda2': 8.627459881820345, 'loop': 1, 'loss': 'MSE', 'lr': 0.0018723392830442263, 'softmaxF': True, 'useGCN': False, 'weight_decay': 0.000843977174898508, 'weightedloss': False}. Best is trial 48 with value: 81.53333282470703.
/home/wxy/miniconda3/lib/python3.10/site-packages/optuna/distributions.py:685: UserWarning: The distribution is specified by [0, 1.00001] and step=0.05, but the range is not divisible by `step`. It will be replaced by [0, 1.0].
  warnings.warn(
K:  6
alpha:  0.8500000000000001
lr:  0.0012907818355673865
weight_decay:  0.0003294686467881127
dropout:  0.2
fix split and run 3 times
Data: Data(x=[19717, 500], y=[19717], train_mask=[19717], val_mask=[19717], test_mask=[19717], adj_t=[19717, 19717, nnz=88648])
num_train tensor(60)
num_noise 0
noise: tensor(0)
data feature 500
ALTOPT(
  (lins): Sequential(
    (0): Linear(in_features=500, out_features=64, bias=True)
    (1): BatchNorm1d(64, eps=1e-05, momentum=0.1, affine=True, track_running_stats=True)
    (2): Dropout(p=0.2, inplace=True)
    (3): ReLU(inplace=True)
    (4): Linear(in_features=64, out_features=3, bias=True)
    (5): Identity()
  )
  (prop): Propagation(K=6, mode=None, lambda1=None, lambda2=None, L21=True, alpha=0.8500000000000001)
  (gcn): GCN(
    (convs): ModuleList(
      (0): GCNConv(500, 64)
      (1): GCNConv(64, 3)
    )
    (bns): ModuleList(
      (0): BatchNorm1d(64, eps=1e-05, momentum=0.1, affine=True, track_running_stats=True)
    )
    (output): Identity()
  )
)
propagate done
init label
Split: 01, Run: 01
None time:  2.168093192856759
None Run 01:
Highest Train: 100.00
Highest Valid: 79.80
  Final Train: 100.00
   Final Test: 78.00
Split: 01, Run: 02
None time:  1.3013002390507609
None Run 02:
Highest Train: 100.00
Highest Valid: 82.40
  Final Train: 100.00
   Final Test: 78.90
Split: 01, Run: 03
None time:  0.9268415330443531
None Run 03:
Highest Train: 100.00
Highest Valid: 81.80
  Final Train: 100.00
   Final Test: 79.90
run time now: 4.443978548049927
total time:  4.502283507026732
None All runs:
Highest Train: 100.00 ± 0.00
Highest Valid: 81.33 ± 1.36
  Final Train: 100.00 ± 0.00
   Final Test: 78.93 ± 0.95
[I 2023-06-12 00:16:51,909] Trial 52 finished with value: 81.33333587646484 and parameters: {'Fwd': 4.2006545283743925e-06, 'K': 6, 'alpha': 0.8500000000000001, 'dropout': 0.2, 'gnnepoch': 60, 'lambda1': 0.25, 'lambda2': 8.94863089416723, 'loop': 1, 'loss': 'MSE', 'lr': 0.0012907818355673865, 'softmaxF': True, 'useGCN': False, 'weight_decay': 0.0003294686467881127, 'weightedloss': False}. Best is trial 48 with value: 81.53333282470703.
/home/wxy/miniconda3/lib/python3.10/site-packages/optuna/distributions.py:685: UserWarning: The distribution is specified by [0, 1.00001] and step=0.05, but the range is not divisible by `step`. It will be replaced by [0, 1.0].
  warnings.warn(
K:  6
alpha:  0.9
lr:  0.0012284601313462516
weight_decay:  0.0003220410725438849
dropout:  0.2
fix split and run 3 times
Data: Data(x=[19717, 500], y=[19717], train_mask=[19717], val_mask=[19717], test_mask=[19717], adj_t=[19717, 19717, nnz=88648])
num_train tensor(60)
num_noise 0
noise: tensor(0)
data feature 500
ALTOPT(
  (lins): Sequential(
    (0): Linear(in_features=500, out_features=64, bias=True)
    (1): BatchNorm1d(64, eps=1e-05, momentum=0.1, affine=True, track_running_stats=True)
    (2): Dropout(p=0.2, inplace=True)
    (3): ReLU(inplace=True)
    (4): Linear(in_features=64, out_features=3, bias=True)
    (5): Identity()
  )
  (prop): Propagation(K=6, mode=None, lambda1=None, lambda2=None, L21=True, alpha=0.9)
  (gcn): GCN(
    (convs): ModuleList(
      (0): GCNConv(500, 64)
      (1): GCNConv(64, 3)
    )
    (bns): ModuleList(
      (0): BatchNorm1d(64, eps=1e-05, momentum=0.1, affine=True, track_running_stats=True)
    )
    (output): Identity()
  )
)
propagate done
init label
Split: 01, Run: 01
None time:  1.592415879946202
None Run 01:
Highest Train: 100.00
Highest Valid: 79.40
  Final Train: 100.00
   Final Test: 76.90
Split: 01, Run: 02
None time:  1.4467885801568627
None Run 02:
Highest Train: 100.00
Highest Valid: 83.00
  Final Train: 100.00
   Final Test: 77.90
Split: 01, Run: 03
None time:  0.9898555991239846
None Run 03:
Highest Train: 100.00
Highest Valid: 81.00
  Final Train: 100.00
   Final Test: 78.80
run time now: 4.090518236160278
total time:  4.15334791992791
None All runs:
Highest Train: 100.00 ± 0.00
Highest Valid: 81.13 ± 1.80
  Final Train: 100.00 ± 0.00
   Final Test: 77.87 ± 0.95
