[I 2023-06-11 23:54:02,580] Trial 521 finished with value: 71.66667175292969 and parameters: {'Fwd': 0.0001882090027884734, 'K': 8, 'alpha': 0.9, 'dropout': 0.8, 'gnnepoch': 120, 'lambda1': 0.6000000000000001, 'lambda2': 8.92348967890748, 'loop': 0, 'loss': 'CE', 'lr': 0.00178293898402484, 'softmaxF': False, 'useGCN': True, 'weight_decay': 0.0010357132361354488, 'weightedloss': True}. Best is trial 271 with value: 72.06666564941406.
/home/wxy/miniconda3/lib/python3.10/site-packages/optuna/distributions.py:685: UserWarning: The distribution is specified by [0, 1.00001] and step=0.05, but the range is not divisible by `step`. It will be replaced by [0, 1.0].
  warnings.warn(
K:  8
alpha:  0.8500000000000001
lr:  0.007717916034071523
weight_decay:  0.0015570068329180413
dropout:  0.8
fix split and run 3 times
Data: Data(x=[3327, 3703], y=[3327], train_mask=[3327], val_mask=[3327], test_mask=[3327], adj_t=[3327, 3327, nnz=9104])
num_train tensor(120)
num_noise 0
noise: tensor(0)
data feature 3703
ALTOPT(
  (lins): Sequential(
    (0): Linear(in_features=3703, out_features=64, bias=True)
    (1): BatchNorm1d(64, eps=1e-05, momentum=0.1, affine=True, track_running_stats=True)
    (2): Dropout(p=0.8, inplace=True)
    (3): ReLU(inplace=True)
    (4): Linear(in_features=64, out_features=6, bias=True)
    (5): LogSoftmax(dim=-1)
  )
  (prop): Propagation(K=8, mode=None, lambda1=None, lambda2=None, L21=True, alpha=0.8500000000000001)
  (gcn): GCN(
    (convs): ModuleList(
      (0): GCNConv(3703, 64)
      (1): GCNConv(64, 6)
    )
    (bns): ModuleList(
      (0): BatchNorm1d(64, eps=1e-05, momentum=0.1, affine=True, track_running_stats=True)
    )
    (output): LogSoftmax(dim=-1)
  )
)
propagate done
init label
Split: 01, Run: 01
None time:  1.1508196638897061
None Run 01:
Highest Train: 100.00
Highest Valid: 70.00
  Final Train: 99.17
   Final Test: 69.10
Split: 01, Run: 02
None time:  1.114543406991288
None Run 02:
Highest Train: 100.00
Highest Valid: 70.20
  Final Train: 99.17
   Final Test: 69.70
Split: 01, Run: 03
None time:  1.13385144690983
None Run 03:
Highest Train: 100.00
Highest Valid: 71.00
  Final Train: 100.00
   Final Test: 69.50
run time now: 3.4417030811309814
total time:  3.507004987914115
None All runs:
Highest Train: 100.00 ± 0.00
Highest Valid: 70.40 ± 0.53
  Final Train: 99.44 ± 0.48
   Final Test: 69.43 ± 0.31
[I 2023-06-11 23:54:06,553] Trial 522 finished with value: 70.4000015258789 and parameters: {'Fwd': 6.188250985012617e-06, 'K': 8, 'alpha': 0.8500000000000001, 'dropout': 0.8, 'gnnepoch': 120, 'lambda1': 0.4, 'lambda2': 7.420881655860248, 'loop': 0, 'loss': 'CE', 'lr': 0.007717916034071523, 'softmaxF': False, 'useGCN': True, 'weight_decay': 0.0015570068329180413, 'weightedloss': True}. Best is trial 271 with value: 72.06666564941406.
/home/wxy/miniconda3/lib/python3.10/site-packages/optuna/distributions.py:685: UserWarning: The distribution is specified by [0, 1.00001] and step=0.05, but the range is not divisible by `step`. It will be replaced by [0, 1.0].
  warnings.warn(
K:  8
alpha:  0.8
lr:  0.0010887930291305858
weight_decay:  0.0005469532216910098
dropout:  0.8
fix split and run 3 times
Data: Data(x=[3327, 3703], y=[3327], train_mask=[3327], val_mask=[3327], test_mask=[3327], adj_t=[3327, 3327, nnz=9104])
num_train tensor(120)
num_noise 0
noise: tensor(0)
data feature 3703
ALTOPT(
  (lins): Sequential(
    (0): Linear(in_features=3703, out_features=64, bias=True)
    (1): BatchNorm1d(64, eps=1e-05, momentum=0.1, affine=True, track_running_stats=True)
    (2): Dropout(p=0.8, inplace=True)
    (3): ReLU(inplace=True)
    (4): Linear(in_features=64, out_features=6, bias=True)
    (5): LogSoftmax(dim=-1)
  )
  (prop): Propagation(K=8, mode=None, lambda1=None, lambda2=None, L21=True, alpha=0.8)
  (gcn): GCN(
    (convs): ModuleList(
      (0): GCNConv(3703, 64)
      (1): GCNConv(64, 6)
    )
    (bns): ModuleList(
      (0): BatchNorm1d(64, eps=1e-05, momentum=0.1, affine=True, track_running_stats=True)
    )
    (output): LogSoftmax(dim=-1)
  )
)
propagate done
init label
Split: 01, Run: 01
None time:  1.0716063601430506
None Run 01:
Highest Train: 100.00
Highest Valid: 71.00
  Final Train: 100.00
   Final Test: 69.50
Split: 01, Run: 02
None time:  1.1136183349881321
None Run 02:
Highest Train: 100.00
Highest Valid: 72.40
  Final Train: 100.00
   Final Test: 69.70
Split: 01, Run: 03
None time:  1.109756438061595
None Run 03:
Highest Train: 100.00
Highest Valid: 71.80
  Final Train: 100.00
   Final Test: 70.60
run time now: 3.3361895084381104
total time:  3.391749707981944
None All runs:
Highest Train: 100.00 ± 0.00
Highest Valid: 71.73 ± 0.70
  Final Train: 100.00 ± 0.00
   Final Test: 69.93 ± 0.59
[I 2023-06-11 23:54:10,439] Trial 523 finished with value: 71.73332977294922 and parameters: {'Fwd': 0.00024300345291809435, 'K': 8, 'alpha': 0.8, 'dropout': 0.8, 'gnnepoch': 120, 'lambda1': 0.8, 'lambda2': 8.442371853562914, 'loop': 0, 'loss': 'CE', 'lr': 0.0010887930291305858, 'softmaxF': False, 'useGCN': True, 'weight_decay': 0.0005469532216910098, 'weightedloss': True}. Best is trial 271 with value: 72.06666564941406.
/home/wxy/miniconda3/lib/python3.10/site-packages/optuna/distributions.py:685: UserWarning: The distribution is specified by [0, 1.00001] and step=0.05, but the range is not divisible by `step`. It will be replaced by [0, 1.0].
  warnings.warn(
K:  8
alpha:  0.8500000000000001
lr:  0.001193075108145321
weight_decay:  0.002406321299249358
dropout:  0.8
fix split and run 3 times
Data: Data(x=[3327, 3703], y=[3327], train_mask=[3327], val_mask=[3327], test_mask=[3327], adj_t=[3327, 3327, nnz=9104])
num_train tensor(120)
num_noise 0
noise: tensor(0)
data feature 3703
ALTOPT(
  (lins): Sequential(
    (0): Linear(in_features=3703, out_features=64, bias=True)
    (1): BatchNorm1d(64, eps=1e-05, momentum=0.1, affine=True, track_running_stats=True)
    (2): Dropout(p=0.8, inplace=True)
    (3): ReLU(inplace=True)
    (4): Linear(in_features=64, out_features=6, bias=True)
    (5): LogSoftmax(dim=-1)
  )
  (prop): Propagation(K=8, mode=None, lambda1=None, lambda2=None, L21=True, alpha=0.8500000000000001)
  (gcn): GCN(
    (convs): ModuleList(
      (0): GCNConv(3703, 64)
      (1): GCNConv(64, 6)
    )
    (bns): ModuleList(
      (0): BatchNorm1d(64, eps=1e-05, momentum=0.1, affine=True, track_running_stats=True)
    )
    (output): LogSoftmax(dim=-1)
  )
)
propagate done
init label
Split: 01, Run: 01
None time:  0.764709061011672
None Run 01:
Highest Train: 100.00
Highest Valid: 70.20
  Final Train: 100.00
   Final Test: 69.60
Split: 01, Run: 02
None time:  0.7188471409026533
None Run 02:
Highest Train: 100.00
Highest Valid: 71.40
  Final Train: 100.00
   Final Test: 70.00
Split: 01, Run: 03
None time:  0.7352681399788707
None Run 03:
Highest Train: 100.00
Highest Valid: 70.60
  Final Train: 100.00
   Final Test: 69.70
run time now: 2.259361743927002
total time:  2.3360018129460514
None All runs:
Highest Train: 100.00 ± 0.00
Highest Valid: 70.73 ± 0.61
  Final Train: 100.00 ± 0.00
   Final Test: 69.77 ± 0.21
[I 2023-06-11 23:54:13,389] Trial 524 finished with value: 70.73333740234375 and parameters: {'Fwd': 0.0010707856780117228, 'K': 8, 'alpha': 0.8500000000000001, 'dropout': 0.8, 'gnnepoch': 80, 'lambda1': 0.75, 'lambda2': 8.626572537542971, 'loop': 0, 'loss': 'CE', 'lr': 0.001193075108145321, 'softmaxF': False, 'useGCN': True, 'weight_decay': 0.002406321299249358, 'weightedloss': True}. Best is trial 271 with value: 72.06666564941406.
/home/wxy/miniconda3/lib/python3.10/site-packages/optuna/distributions.py:685: UserWarning: The distribution is specified by [0, 1.00001] and step=0.05, but the range is not divisible by `step`. It will be replaced by [0, 1.0].
  warnings.warn(
K:  8
alpha:  0.6000000000000001
lr:  0.0015392505993735903
weight_decay:  0.00018337071399345285
dropout:  0.8
fix split and run 3 times
Data: Data(x=[3327, 3703], y=[3327], train_mask=[3327], val_mask=[3327], test_mask=[3327], adj_t=[3327, 3327, nnz=9104])
num_train tensor(120)
num_noise 0
noise: tensor(0)
data feature 3703
ALTOPT(
  (lins): Sequential(
    (0): Linear(in_features=3703, out_features=64, bias=True)
    (1): BatchNorm1d(64, eps=1e-05, momentum=0.1, affine=True, track_running_stats=True)
    (2): Dropout(p=0.8, inplace=True)
    (3): ReLU(inplace=True)
    (4): Linear(in_features=64, out_features=6, bias=True)
    (5): LogSoftmax(dim=-1)
  )
  (prop): Propagation(K=8, mode=None, lambda1=None, lambda2=None, L21=True, alpha=0.6000000000000001)
  (gcn): GCN(
    (convs): ModuleList(
      (0): GCNConv(3703, 64)
      (1): GCNConv(64, 6)
    )
    (bns): ModuleList(
      (0): BatchNorm1d(64, eps=1e-05, momentum=0.1, affine=True, track_running_stats=True)
    )
    (output): LogSoftmax(dim=-1)
  )
)
propagate done
init label
Split: 01, Run: 01
None time:  1.101455138064921
None Run 01:
Highest Train: 100.00
Highest Valid: 71.40
  Final Train: 100.00
   Final Test: 69.50
Split: 01, Run: 02
None time:  1.020958575187251
None Run 02:
Highest Train: 100.00
Highest Valid: 72.00
  Final Train: 100.00
   Final Test: 70.10
Split: 01, Run: 03
None time:  1.1673749508336186
None Run 03:
Highest Train: 100.00
Highest Valid: 71.40
  Final Train: 100.00
   Final Test: 70.70
run time now: 3.3306045532226562
total time:  3.385955971898511
None All runs:
Highest Train: 100.00 ± 0.00
Highest Valid: 71.60 ± 0.35
  Final Train: 100.00 ± 0.00
   Final Test: 70.10 ± 0.60
[I 2023-06-11 23:54:17,273] Trial 525 finished with value: 71.5999984741211 and parameters: {'Fwd': 2.4872828534364233e-05, 'K': 8, 'alpha': 0.6000000000000001, 'dropout': 0.8, 'gnnepoch': 120, 'lambda1': 0.75, 'lambda2': 6.059799187654691, 'loop': 0, 'loss': 'CE', 'lr': 0.0015392505993735903, 'softmaxF': False, 'useGCN': True, 'weight_decay': 0.00018337071399345285, 'weightedloss': True}. Best is trial 271 with value: 72.06666564941406.
/home/wxy/miniconda3/lib/python3.10/site-packages/optuna/distributions.py:685: UserWarning: The distribution is specified by [0, 1.00001] and step=0.05, but the range is not divisible by `step`. It will be replaced by [0, 1.0].
  warnings.warn(
K:  8
alpha:  0.9500000000000001
lr:  0.0013387253503309774
weight_decay:  0.0003744125218999858
dropout:  0.1
fix split and run 3 times
Data: Data(x=[3327, 3703], y=[3327], train_mask=[3327], val_mask=[3327], test_mask=[3327], adj_t=[3327, 3327, nnz=9104])
num_train tensor(120)
num_noise 0
noise: tensor(0)
data feature 3703
ALTOPT(
  (lins): Sequential(
    (0): Linear(in_features=3703, out_features=64, bias=True)
    (1): BatchNorm1d(64, eps=1e-05, momentum=0.1, affine=True, track_running_stats=True)
    (2): Dropout(p=0.1, inplace=True)
    (3): ReLU(inplace=True)
    (4): Linear(in_features=64, out_features=6, bias=True)
    (5): Identity()
  )
  (prop): Propagation(K=8, mode=None, lambda1=None, lambda2=None, L21=True, alpha=0.9500000000000001)
  (gcn): GCN(
    (convs): ModuleList(
      (0): GCNConv(3703, 64)
      (1): GCNConv(64, 6)
    )
    (bns): ModuleList(
      (0): BatchNorm1d(64, eps=1e-05, momentum=0.1, affine=True, track_running_stats=True)
    )
    (output): Identity()
  )
)
propagate done
init label
Split: 01, Run: 01, Epoch: 100, Loss: 0.0000, Train: 100.00%, Valid: 67.40% Test: 68.50%
Split: 01, Run: 01
None time:  1.7815463219303638
None Run 01:
Highest Train: 100.00
Highest Valid: 67.40
  Final Train: 100.00
   Final Test: 68.50
Split: 01, Run: 02, Epoch: 100, Loss: 0.0000, Train: 100.00%, Valid: 68.00% Test: 68.40%
Split: 01, Run: 02
None time:  1.7495648139156401
None Run 02:
Highest Train: 100.00
Highest Valid: 68.00
  Final Train: 100.00
   Final Test: 68.30
Split: 01, Run: 03, Epoch: 100, Loss: 0.0000, Train: 100.00%, Valid: 67.80% Test: 68.90%
Split: 01, Run: 03
None time:  1.6403683768585324
None Run 03:
Highest Train: 100.00
Highest Valid: 67.80
  Final Train: 100.00
   Final Test: 68.80
run time now: 5.213390350341797
total time:  5.2561298061627895
None All runs:
Highest Train: 100.00 ± 0.00
Highest Valid: 67.73 ± 0.31
  Final Train: 100.00 ± 0.00
   Final Test: 68.53 ± 0.25
[I 2023-06-11 23:54:23,044] Trial 526 finished with value: 67.73332977294922 and parameters: {'Fwd': 0.003127538068673888, 'K': 8, 'alpha': 0.9500000000000001, 'dropout': 0.1, 'gnnepoch': 120, 'lambda1': 0.6000000000000001, 'lambda2': 9.027475136599186, 'loop': 0, 'loss': 'MSE', 'lr': 0.0013387253503309774, 'softmaxF': True, 'useGCN': True, 'weight_decay': 0.0003744125218999858, 'weightedloss': True}. Best is trial 271 with value: 72.06666564941406.
/home/wxy/miniconda3/lib/python3.10/site-packages/optuna/distributions.py:685: UserWarning: The distribution is specified by [0, 1.00001] and step=0.05, but the range is not divisible by `step`. It will be replaced by [0, 1.0].
  warnings.warn(
K:  8
alpha:  0.9
lr:  0.0014072567764296798
weight_decay:  0.0006925405543389158
dropout:  0.8
fix split and run 3 times
Data: Data(x=[3327, 3703], y=[3327], train_mask=[3327], val_mask=[3327], test_mask=[3327], adj_t=[3327, 3327, nnz=9104])
num_train tensor(120)
num_noise 0
noise: tensor(0)
data feature 3703
ALTOPT(
  (lins): Sequential(
    (0): Linear(in_features=3703, out_features=64, bias=True)
    (1): BatchNorm1d(64, eps=1e-05, momentum=0.1, affine=True, track_running_stats=True)
    (2): Dropout(p=0.8, inplace=True)
    (3): ReLU(inplace=True)
    (4): Linear(in_features=64, out_features=6, bias=True)
    (5): LogSoftmax(dim=-1)
  )
  (prop): Propagation(K=8, mode=None, lambda1=None, lambda2=None, L21=True, alpha=0.9)
  (gcn): GCN(
    (convs): ModuleList(
      (0): GCNConv(3703, 64)
      (1): GCNConv(64, 6)
    )
    (bns): ModuleList(
      (0): BatchNorm1d(64, eps=1e-05, momentum=0.1, affine=True, track_running_stats=True)
    )
    (output): LogSoftmax(dim=-1)
  )
)
propagate done
init label
Split: 01, Run: 01
None time:  1.1033063579816371
None Run 01:
Highest Train: 100.00
Highest Valid: 71.20
  Final Train: 100.00
   Final Test: 69.70
Split: 01, Run: 02
None time:  0.9919799577910453
None Run 02:
Highest Train: 100.00
Highest Valid: 72.20
  Final Train: 100.00
   Final Test: 69.90
Split: 01, Run: 03
None time:  1.1181857432238758
None Run 03:
Highest Train: 100.00
Highest Valid: 71.60
  Final Train: 100.00
   Final Test: 70.40
run time now: 3.254865884780884
total time:  3.311674459138885
None All runs:
Highest Train: 100.00 ± 0.00
Highest Valid: 71.67 ± 0.50
  Final Train: 100.00 ± 0.00
   Final Test: 70.00 ± 0.36
[I 2023-06-11 23:54:26,791] Trial 527 finished with value: 71.66666412353516 and parameters: {'Fwd': 8.093788204952939e-05, 'K': 8, 'alpha': 0.9, 'dropout': 0.8, 'gnnepoch': 120, 'lambda1': 0.75, 'lambda2': 7.180462860449074, 'loop': 0, 'loss': 'CE', 'lr': 0.0014072567764296798, 'softmaxF': False, 'useGCN': True, 'weight_decay': 0.0006925405543389158, 'weightedloss': True}. Best is trial 271 with value: 72.06666564941406.
/home/wxy/miniconda3/lib/python3.10/site-packages/optuna/distributions.py:685: UserWarning: The distribution is specified by [0, 1.00001] and step=0.05, but the range is not divisible by `step`. It will be replaced by [0, 1.0].
  warnings.warn(
K:  9
alpha:  0.8
lr:  0.0011623826002217395
weight_decay:  0.001199748483507304
dropout:  0.8
fix split and run 3 times
Data: Data(x=[3327, 3703], y=[3327], train_mask=[3327], val_mask=[3327], test_mask=[3327], adj_t=[3327, 3327, nnz=9104])
num_train tensor(120)
num_noise 0
noise: tensor(0)
data feature 3703
ALTOPT(
  (lins): Sequential(
    (0): Linear(in_features=3703, out_features=64, bias=True)
    (1): BatchNorm1d(64, eps=1e-05, momentum=0.1, affine=True, track_running_stats=True)
    (2): Dropout(p=0.8, inplace=True)
    (3): ReLU(inplace=True)
    (4): Linear(in_features=64, out_features=6, bias=True)
    (5): LogSoftmax(dim=-1)
  )
  (prop): Propagation(K=9, mode=None, lambda1=None, lambda2=None, L21=True, alpha=0.8)
  (gcn): GCN(
    (convs): ModuleList(
      (0): GCNConv(3703, 64)
      (1): GCNConv(64, 6)
    )
    (bns): ModuleList(
      (0): BatchNorm1d(64, eps=1e-05, momentum=0.1, affine=True, track_running_stats=True)
    )
    (output): LogSoftmax(dim=-1)
  )
)
propagate done
init label
Split: 01, Run: 01
None time:  0.9860852370038629
None Run 01:
Highest Train: 100.00
Highest Valid: 71.00
  Final Train: 100.00
   Final Test: 70.20
Split: 01, Run: 02
None time:  1.0089628850109875
None Run 02:
Highest Train: 100.00
Highest Valid: 68.40
  Final Train: 100.00
   Final Test: 68.60
Split: 01, Run: 03
None time:  1.0151323238387704
None Run 03:
Highest Train: 100.00
Highest Valid: 71.00
  Final Train: 100.00
   Final Test: 70.70
run time now: 3.051818609237671
total time:  3.101128197973594
None All runs:
Highest Train: 100.00 ± 0.00
Highest Valid: 70.13 ± 1.50
  Final Train: 100.00 ± 0.00
   Final Test: 69.83 ± 1.10
[I 2023-06-11 23:54:30,428] Trial 528 finished with value: 70.13333129882812 and parameters: {'Fwd': 0.0006170300443957973, 'K': 9, 'alpha': 0.8, 'dropout': 0.8, 'gnnepoch': 110, 'lambda1': 0.8, 'lambda2': 9.96683988391308, 'loop': 0, 'loss': 'CE', 'lr': 0.0011623826002217395, 'softmaxF': False, 'useGCN': True, 'weight_decay': 0.001199748483507304, 'weightedloss': True}. Best is trial 271 with value: 72.06666564941406.
/home/wxy/miniconda3/lib/python3.10/site-packages/optuna/distributions.py:685: UserWarning: The distribution is specified by [0, 1.00001] and step=0.05, but the range is not divisible by `step`. It will be replaced by [0, 1.0].
  warnings.warn(
K:  8
alpha:  0.8500000000000001
lr:  0.0015966552461342438
weight_decay:  0.0002124705431422281
dropout:  0.8
fix split and run 3 times
Data: Data(x=[3327, 3703], y=[3327], train_mask=[3327], val_mask=[3327], test_mask=[3327], adj_t=[3327, 3327, nnz=9104])
num_train tensor(120)
num_noise 0
noise: tensor(0)
data feature 3703
ALTOPT(
  (lins): Sequential(
    (0): Linear(in_features=3703, out_features=64, bias=True)
    (1): BatchNorm1d(64, eps=1e-05, momentum=0.1, affine=True, track_running_stats=True)
    (2): Dropout(p=0.8, inplace=True)
    (3): ReLU(inplace=True)
    (4): Linear(in_features=64, out_features=6, bias=True)
    (5): LogSoftmax(dim=-1)
  )
  (prop): Propagation(K=8, mode=None, lambda1=None, lambda2=None, L21=True, alpha=0.8500000000000001)
  (gcn): GCN(
    (convs): ModuleList(
      (0): GCNConv(3703, 64)
      (1): GCNConv(64, 6)
    )
    (bns): ModuleList(
      (0): BatchNorm1d(64, eps=1e-05, momentum=0.1, affine=True, track_running_stats=True)
    )
    (output): LogSoftmax(dim=-1)
  )
)
propagate done
init label
Split: 01, Run: 01
None time:  0.4724197220057249
None Run 01:
Highest Train: 100.00
Highest Valid: 70.40
  Final Train: 100.00
   Final Test: 69.30
Split: 01, Run: 02
None time:  0.511745996074751
None Run 02:
Highest Train: 100.00
Highest Valid: 72.20
  Final Train: 100.00
   Final Test: 70.40
Split: 01, Run: 03
None time:  0.5191688660997897
None Run 03:
Highest Train: 100.00
Highest Valid: 72.00
  Final Train: 100.00
   Final Test: 70.90
run time now: 1.5535533428192139
total time:  1.6075355762150139
None All runs:
Highest Train: 100.00 ± 0.00
Highest Valid: 71.53 ± 0.99
  Final Train: 100.00 ± 0.00
   Final Test: 70.20 ± 0.82
[I 2023-06-11 23:54:32,525] Trial 529 finished with value: 71.53333282470703 and parameters: {'Fwd': 0.0005112448182807022, 'K': 8, 'alpha': 0.8500000000000001, 'dropout': 0.8, 'gnnepoch': 50, 'lambda1': 0.65, 'lambda2': 6.457374003279814, 'loop': 0, 'loss': 'CE', 'lr': 0.0015966552461342438, 'softmaxF': False, 'useGCN': True, 'weight_decay': 0.0002124705431422281, 'weightedloss': True}. Best is trial 271 with value: 72.06666564941406.
/home/wxy/miniconda3/lib/python3.10/site-packages/optuna/distributions.py:685: UserWarning: The distribution is specified by [0, 1.00001] and step=0.05, but the range is not divisible by `step`. It will be replaced by [0, 1.0].
  warnings.warn(
K:  8
alpha:  0.8
lr:  0.0012650362421669664
weight_decay:  0.0008264895695251227
dropout:  0.8
fix split and run 3 times
Data: Data(x=[3327, 3703], y=[3327], train_mask=[3327], val_mask=[3327], test_mask=[3327], adj_t=[3327, 3327, nnz=9104])
num_train tensor(120)
num_noise 0
noise: tensor(0)
data feature 3703
ALTOPT(
  (lins): Sequential(
    (0): Linear(in_features=3703, out_features=64, bias=True)
    (1): BatchNorm1d(64, eps=1e-05, momentum=0.1, affine=True, track_running_stats=True)
    (2): Dropout(p=0.8, inplace=True)
    (3): ReLU(inplace=True)
    (4): Linear(in_features=64, out_features=6, bias=True)
    (5): LogSoftmax(dim=-1)
  )
  (prop): Propagation(K=8, mode=None, lambda1=None, lambda2=None, L21=True, alpha=0.8)
  (gcn): GCN(
    (convs): ModuleList(
      (0): GCNConv(3703, 64)
      (1): GCNConv(64, 6)
    )
    (bns): ModuleList(
      (0): BatchNorm1d(64, eps=1e-05, momentum=0.1, affine=True, track_running_stats=True)
    )
    (output): LogSoftmax(dim=-1)
  )
)
propagate done
init label
Split: 01, Run: 01
None time:  1.0175138630438596
None Run 01:
Highest Train: 100.00
Highest Valid: 71.40
  Final Train: 100.00
   Final Test: 69.70
Split: 01, Run: 02
None time:  1.0857255898881704
None Run 02:
Highest Train: 100.00
Highest Valid: 72.40
  Final Train: 100.00
   Final Test: 69.80
Split: 01, Run: 03
None time:  1.067021206021309
None Run 03:
Highest Train: 100.00
Highest Valid: 71.60
  Final Train: 100.00
   Final Test: 70.60
run time now: 3.233846664428711
total time:  3.2966906169895083
None All runs:
Highest Train: 100.00 ± 0.00
Highest Valid: 71.80 ± 0.53
  Final Train: 100.00 ± 0.00
   Final Test: 70.03 ± 0.49
