[I 2023-06-12 00:34:36,148] Trial 232 finished with value: 81.26667022705078 and parameters: {'Fwd': 0.06427286305779052, 'K': 10, 'alpha': 0.7000000000000001, 'dropout': 0.4, 'gnnepoch': 60, 'lambda1': 0.8500000000000001, 'lambda2': 5.339108494315594, 'loop': 1, 'loss': 'CE', 'lr': 0.006232510739740094, 'softmaxF': True, 'useGCN': True, 'weight_decay': 9.472496763433553e-05, 'weightedloss': False}. Best is trial 112 with value: 81.66667175292969.
/home/wxy/miniconda3/lib/python3.10/site-packages/optuna/distributions.py:685: UserWarning: The distribution is specified by [0, 1.00001] and step=0.05, but the range is not divisible by `step`. It will be replaced by [0, 1.0].
  warnings.warn(
K:  10
alpha:  0.65
lr:  0.007373625575093303
weight_decay:  0.00024794085066081543
dropout:  0.4
fix split and run 3 times
Data: Data(x=[2708, 1433], y=[2708], train_mask=[2708], val_mask=[2708], test_mask=[2708], adj_t=[2708, 2708, nnz=10556])
num_train tensor(140)
num_noise 0
noise: tensor(0)
data feature 1433
ALTOPT(
  (lins): Sequential(
    (0): Linear(in_features=1433, out_features=64, bias=True)
    (1): BatchNorm1d(64, eps=1e-05, momentum=0.1, affine=True, track_running_stats=True)
    (2): Dropout(p=0.4, inplace=True)
    (3): ReLU(inplace=True)
    (4): Linear(in_features=64, out_features=7, bias=True)
    (5): LogSoftmax(dim=-1)
  )
  (prop): Propagation(K=10, mode=None, lambda1=None, lambda2=None, L21=True, alpha=0.65)
  (gcn): GCN(
    (convs): ModuleList(
      (0): GCNConv(1433, 64)
      (1): GCNConv(64, 7)
    )
    (bns): ModuleList(
      (0): BatchNorm1d(64, eps=1e-05, momentum=0.1, affine=True, track_running_stats=True)
    )
    (output): LogSoftmax(dim=-1)
  )
)
propagate done
init label
Split: 01, Run: 01
None time:  1.3604598408564925
None Run 01:
Highest Train: 100.00
Highest Valid: 82.00
  Final Train: 100.00
   Final Test: 82.20
Split: 01, Run: 02
None time:  1.4701445060782135
None Run 02:
Highest Train: 100.00
Highest Valid: 81.80
  Final Train: 100.00
   Final Test: 81.60
Split: 01, Run: 03
None time:  1.6963867768645287
None Run 03:
Highest Train: 100.00
Highest Valid: 80.80
  Final Train: 100.00
   Final Test: 80.70
run time now: 4.559602737426758
total time:  4.585410695988685
None All runs:
Highest Train: 100.00 ± 0.00
Highest Valid: 81.53 ± 0.64
  Final Train: 100.00 ± 0.00
   Final Test: 81.50 ± 0.75
[I 2023-06-12 00:34:41,188] Trial 233 finished with value: 81.53333282470703 and parameters: {'Fwd': 0.08565610209484506, 'K': 10, 'alpha': 0.65, 'dropout': 0.4, 'gnnepoch': 60, 'lambda1': 0.9, 'lambda2': 5.884432028231103, 'loop': 1, 'loss': 'CE', 'lr': 0.007373625575093303, 'softmaxF': True, 'useGCN': True, 'weight_decay': 0.00024794085066081543, 'weightedloss': False}. Best is trial 112 with value: 81.66667175292969.
/home/wxy/miniconda3/lib/python3.10/site-packages/optuna/distributions.py:685: UserWarning: The distribution is specified by [0, 1.00001] and step=0.05, but the range is not divisible by `step`. It will be replaced by [0, 1.0].
  warnings.warn(
K:  10
alpha:  0.5
lr:  0.00820128856551024
weight_decay:  0.00012097040328808648
dropout:  0.4
fix split and run 3 times
Data: Data(x=[2708, 1433], y=[2708], train_mask=[2708], val_mask=[2708], test_mask=[2708], adj_t=[2708, 2708, nnz=10556])
num_train tensor(140)
num_noise 0
noise: tensor(0)
data feature 1433
ALTOPT(
  (lins): Sequential(
    (0): Linear(in_features=1433, out_features=64, bias=True)
    (1): BatchNorm1d(64, eps=1e-05, momentum=0.1, affine=True, track_running_stats=True)
    (2): Dropout(p=0.4, inplace=True)
    (3): ReLU(inplace=True)
    (4): Linear(in_features=64, out_features=7, bias=True)
    (5): LogSoftmax(dim=-1)
  )
  (prop): Propagation(K=10, mode=None, lambda1=None, lambda2=None, L21=True, alpha=0.5)
  (gcn): GCN(
    (convs): ModuleList(
      (0): GCNConv(1433, 64)
      (1): GCNConv(64, 7)
    )
    (bns): ModuleList(
      (0): BatchNorm1d(64, eps=1e-05, momentum=0.1, affine=True, track_running_stats=True)
    )
    (output): LogSoftmax(dim=-1)
  )
)
propagate done
init label
Split: 01, Run: 01
None time:  1.4692122940905392
None Run 01:
Highest Train: 100.00
Highest Valid: 82.00
  Final Train: 100.00
   Final Test: 82.00
Split: 01, Run: 02
None time:  1.5377562469802797
None Run 02:
Highest Train: 100.00
Highest Valid: 81.80
  Final Train: 100.00
   Final Test: 81.20
Split: 01, Run: 03
None time:  1.4807765427976847
None Run 03:
Highest Train: 100.00
Highest Valid: 81.00
  Final Train: 100.00
   Final Test: 80.50
run time now: 4.513383626937866
total time:  4.533205167856067
None All runs:
Highest Train: 100.00 ± 0.00
Highest Valid: 81.60 ± 0.53
  Final Train: 100.00 ± 0.00
   Final Test: 81.23 ± 0.75
[I 2023-06-12 00:34:46,183] Trial 234 finished with value: 81.5999984741211 and parameters: {'Fwd': 0.09934953845249091, 'K': 10, 'alpha': 0.5, 'dropout': 0.4, 'gnnepoch': 60, 'lambda1': 0.8500000000000001, 'lambda2': 4.936944327233365, 'loop': 1, 'loss': 'CE', 'lr': 0.00820128856551024, 'softmaxF': True, 'useGCN': True, 'weight_decay': 0.00012097040328808648, 'weightedloss': False}. Best is trial 112 with value: 81.66667175292969.
/home/wxy/miniconda3/lib/python3.10/site-packages/optuna/distributions.py:685: UserWarning: The distribution is specified by [0, 1.00001] and step=0.05, but the range is not divisible by `step`. It will be replaced by [0, 1.0].
  warnings.warn(
K:  10
alpha:  0.5
lr:  0.008158452936933432
weight_decay:  0.0001288047159429529
dropout:  0.4
fix split and run 3 times
Data: Data(x=[2708, 1433], y=[2708], train_mask=[2708], val_mask=[2708], test_mask=[2708], adj_t=[2708, 2708, nnz=10556])
num_train tensor(140)
num_noise 0
noise: tensor(0)
data feature 1433
ALTOPT(
  (lins): Sequential(
    (0): Linear(in_features=1433, out_features=64, bias=True)
    (1): BatchNorm1d(64, eps=1e-05, momentum=0.1, affine=True, track_running_stats=True)
    (2): Dropout(p=0.4, inplace=True)
    (3): ReLU(inplace=True)
    (4): Linear(in_features=64, out_features=7, bias=True)
    (5): LogSoftmax(dim=-1)
  )
  (prop): Propagation(K=10, mode=None, lambda1=None, lambda2=None, L21=True, alpha=0.5)
  (gcn): GCN(
    (convs): ModuleList(
      (0): GCNConv(1433, 64)
      (1): GCNConv(64, 7)
    )
    (bns): ModuleList(
      (0): BatchNorm1d(64, eps=1e-05, momentum=0.1, affine=True, track_running_stats=True)
    )
    (output): LogSoftmax(dim=-1)
  )
)
propagate done
init label
Split: 01, Run: 01
None time:  1.4490233149845153
None Run 01:
Highest Train: 100.00
Highest Valid: 82.00
  Final Train: 100.00
   Final Test: 82.00
Split: 01, Run: 02
None time:  1.5953595319297165
None Run 02:
Highest Train: 100.00
Highest Valid: 81.80
  Final Train: 100.00
   Final Test: 81.20
Split: 01, Run: 03
None time:  1.7642467860132456
None Run 03:
Highest Train: 100.00
Highest Valid: 81.00
  Final Train: 100.00
   Final Test: 80.50
run time now: 4.839879989624023
total time:  4.8620613540988415
None All runs:
Highest Train: 100.00 ± 0.00
Highest Valid: 81.60 ± 0.53
  Final Train: 100.00 ± 0.00
   Final Test: 81.23 ± 0.75
[I 2023-06-12 00:34:51,510] Trial 235 finished with value: 81.5999984741211 and parameters: {'Fwd': 0.09896302635660403, 'K': 10, 'alpha': 0.5, 'dropout': 0.4, 'gnnepoch': 60, 'lambda1': 0.8500000000000001, 'lambda2': 4.8697469803008016, 'loop': 1, 'loss': 'CE', 'lr': 0.008158452936933432, 'softmaxF': True, 'useGCN': True, 'weight_decay': 0.0001288047159429529, 'weightedloss': False}. Best is trial 112 with value: 81.66667175292969.
/home/wxy/miniconda3/lib/python3.10/site-packages/optuna/distributions.py:685: UserWarning: The distribution is specified by [0, 1.00001] and step=0.05, but the range is not divisible by `step`. It will be replaced by [0, 1.0].
  warnings.warn(
K:  10
alpha:  0.5
lr:  0.00845060710024089
weight_decay:  0.00018560557957781983
dropout:  0.4
fix split and run 3 times
Data: Data(x=[2708, 1433], y=[2708], train_mask=[2708], val_mask=[2708], test_mask=[2708], adj_t=[2708, 2708, nnz=10556])
num_train tensor(140)
num_noise 0
noise: tensor(0)
data feature 1433
ALTOPT(
  (lins): Sequential(
    (0): Linear(in_features=1433, out_features=64, bias=True)
    (1): BatchNorm1d(64, eps=1e-05, momentum=0.1, affine=True, track_running_stats=True)
    (2): Dropout(p=0.4, inplace=True)
    (3): ReLU(inplace=True)
    (4): Linear(in_features=64, out_features=7, bias=True)
    (5): LogSoftmax(dim=-1)
  )
  (prop): Propagation(K=10, mode=None, lambda1=None, lambda2=None, L21=True, alpha=0.5)
  (gcn): GCN(
    (convs): ModuleList(
      (0): GCNConv(1433, 64)
      (1): GCNConv(64, 7)
    )
    (bns): ModuleList(
      (0): BatchNorm1d(64, eps=1e-05, momentum=0.1, affine=True, track_running_stats=True)
    )
    (output): LogSoftmax(dim=-1)
  )
)
propagate done
init label
Split: 01, Run: 01
None time:  1.292509312974289
None Run 01:
Highest Train: 100.00
Highest Valid: 81.80
  Final Train: 100.00
   Final Test: 82.00
Split: 01, Run: 02
None time:  1.460553513141349
None Run 02:
Highest Train: 100.00
Highest Valid: 81.60
  Final Train: 100.00
   Final Test: 81.80
Split: 01, Run: 03
None time:  1.6141520491801202
None Run 03:
Highest Train: 100.00
Highest Valid: 80.80
  Final Train: 100.00
   Final Test: 80.30
run time now: 4.394985675811768
total time:  4.413924653083086
None All runs:
Highest Train: 100.00 ± 0.00
Highest Valid: 81.40 ± 0.53
  Final Train: 100.00 ± 0.00
   Final Test: 81.37 ± 0.93
[I 2023-06-12 00:34:56,473] Trial 236 finished with value: 81.4000015258789 and parameters: {'Fwd': 0.09462407279205448, 'K': 10, 'alpha': 0.5, 'dropout': 0.4, 'gnnepoch': 50, 'lambda1': 0.8, 'lambda2': 4.861361035053839, 'loop': 1, 'loss': 'CE', 'lr': 0.00845060710024089, 'softmaxF': True, 'useGCN': True, 'weight_decay': 0.00018560557957781983, 'weightedloss': False}. Best is trial 112 with value: 81.66667175292969.
/home/wxy/miniconda3/lib/python3.10/site-packages/optuna/distributions.py:685: UserWarning: The distribution is specified by [0, 1.00001] and step=0.05, but the range is not divisible by `step`. It will be replaced by [0, 1.0].
  warnings.warn(
K:  10
alpha:  0.5
lr:  0.0022360945888743496
weight_decay:  0.00013123465399451437
dropout:  0.4
fix split and run 3 times
Data: Data(x=[2708, 1433], y=[2708], train_mask=[2708], val_mask=[2708], test_mask=[2708], adj_t=[2708, 2708, nnz=10556])
num_train tensor(140)
num_noise 0
noise: tensor(0)
data feature 1433
ALTOPT(
  (lins): Sequential(
    (0): Linear(in_features=1433, out_features=64, bias=True)
    (1): BatchNorm1d(64, eps=1e-05, momentum=0.1, affine=True, track_running_stats=True)
    (2): Dropout(p=0.4, inplace=True)
    (3): ReLU(inplace=True)
    (4): Linear(in_features=64, out_features=7, bias=True)
    (5): LogSoftmax(dim=-1)
  )
  (prop): Propagation(K=10, mode=None, lambda1=None, lambda2=None, L21=True, alpha=0.5)
  (gcn): GCN(
    (convs): ModuleList(
      (0): GCNConv(1433, 64)
      (1): GCNConv(64, 7)
    )
    (bns): ModuleList(
      (0): BatchNorm1d(64, eps=1e-05, momentum=0.1, affine=True, track_running_stats=True)
    )
    (output): LogSoftmax(dim=-1)
  )
)
propagate done
init label
Split: 01, Run: 01
None time:  1.6552822978701442
None Run 01:
Highest Train: 100.00
Highest Valid: 79.80
  Final Train: 100.00
   Final Test: 80.00
Split: 01, Run: 02
None time:  1.3239577480126172
None Run 02:
Highest Train: 100.00
Highest Valid: 79.60
  Final Train: 100.00
   Final Test: 79.20
Split: 01, Run: 03
None time:  1.5119643560610712
None Run 03:
Highest Train: 100.00
Highest Valid: 76.40
  Final Train: 100.00
   Final Test: 77.50
run time now: 4.521559238433838
total time:  4.5425672121346
None All runs:
Highest Train: 100.00 ± 0.00
Highest Valid: 78.60 ± 1.91
  Final Train: 100.00 ± 0.00
   Final Test: 78.90 ± 1.28
[I 2023-06-12 00:35:01,472] Trial 237 finished with value: 78.5999984741211 and parameters: {'Fwd': 0.08144894614801916, 'K': 10, 'alpha': 0.5, 'dropout': 0.4, 'gnnepoch': 60, 'lambda1': 0.8500000000000001, 'lambda2': 4.584795415233605, 'loop': 1, 'loss': 'CE', 'lr': 0.0022360945888743496, 'softmaxF': True, 'useGCN': True, 'weight_decay': 0.00013123465399451437, 'weightedloss': False}. Best is trial 112 with value: 81.66667175292969.
/home/wxy/miniconda3/lib/python3.10/site-packages/optuna/distributions.py:685: UserWarning: The distribution is specified by [0, 1.00001] and step=0.05, but the range is not divisible by `step`. It will be replaced by [0, 1.0].
  warnings.warn(
K:  10
alpha:  0.5
lr:  0.008116874267682414
weight_decay:  0.0003008620906303358
dropout:  0.0
fix split and run 3 times
Data: Data(x=[2708, 1433], y=[2708], train_mask=[2708], val_mask=[2708], test_mask=[2708], adj_t=[2708, 2708, nnz=10556])
num_train tensor(140)
num_noise 0
noise: tensor(0)
data feature 1433
ALTOPT(
  (lins): Sequential(
    (0): Linear(in_features=1433, out_features=64, bias=True)
    (1): BatchNorm1d(64, eps=1e-05, momentum=0.1, affine=True, track_running_stats=True)
    (2): Dropout(p=0.0, inplace=True)
    (3): ReLU(inplace=True)
    (4): Linear(in_features=64, out_features=7, bias=True)
    (5): LogSoftmax(dim=-1)
  )
  (prop): Propagation(K=10, mode=None, lambda1=None, lambda2=None, L21=True, alpha=0.5)
  (gcn): GCN(
    (convs): ModuleList(
      (0): GCNConv(1433, 64)
      (1): GCNConv(64, 7)
    )
    (bns): ModuleList(
      (0): BatchNorm1d(64, eps=1e-05, momentum=0.1, affine=True, track_running_stats=True)
    )
    (output): LogSoftmax(dim=-1)
  )
)
propagate done
init label
Split: 01, Run: 01
None time:  1.667985568055883
None Run 01:
Highest Train: 100.00
Highest Valid: 81.20
  Final Train: 100.00
   Final Test: 81.00
Split: 01, Run: 02
None time:  1.6551840777974576
None Run 02:
Highest Train: 100.00
Highest Valid: 81.00
  Final Train: 100.00
   Final Test: 80.20
Split: 01, Run: 03
None time:  1.6643958741333336
None Run 03:
Highest Train: 100.00
Highest Valid: 80.20
  Final Train: 100.00
   Final Test: 79.50
run time now: 5.020238399505615
total time:  5.040076799923554
None All runs:
Highest Train: 100.00 ± 0.00
Highest Valid: 80.80 ± 0.53
  Final Train: 100.00 ± 0.00
   Final Test: 80.23 ± 0.75
[I 2023-06-12 00:35:06,980] Trial 238 finished with value: 80.79999542236328 and parameters: {'Fwd': 0.0983020131783541, 'K': 10, 'alpha': 0.5, 'dropout': 0.0, 'gnnepoch': 60, 'lambda1': 0.9, 'lambda2': 4.938037108742855, 'loop': 1, 'loss': 'CE', 'lr': 0.008116874267682414, 'softmaxF': True, 'useGCN': True, 'weight_decay': 0.0003008620906303358, 'weightedloss': False}. Best is trial 112 with value: 81.66667175292969.
/home/wxy/miniconda3/lib/python3.10/site-packages/optuna/distributions.py:685: UserWarning: The distribution is specified by [0, 1.00001] and step=0.05, but the range is not divisible by `step`. It will be replaced by [0, 1.0].
  warnings.warn(
K:  10
alpha:  0.55
lr:  0.00937980025804344
weight_decay:  0.0001572571236446245
dropout:  0.4
fix split and run 3 times
Data: Data(x=[2708, 1433], y=[2708], train_mask=[2708], val_mask=[2708], test_mask=[2708], adj_t=[2708, 2708, nnz=10556])
num_train tensor(140)
num_noise 0
noise: tensor(0)
data feature 1433
ALTOPT(
  (lins): Sequential(
    (0): Linear(in_features=1433, out_features=64, bias=True)
    (1): BatchNorm1d(64, eps=1e-05, momentum=0.1, affine=True, track_running_stats=True)
    (2): Dropout(p=0.4, inplace=True)
    (3): ReLU(inplace=True)
    (4): Linear(in_features=64, out_features=7, bias=True)
    (5): LogSoftmax(dim=-1)
  )
  (prop): Propagation(K=10, mode=None, lambda1=None, lambda2=None, L21=True, alpha=0.55)
  (gcn): GCN(
    (convs): ModuleList(
      (0): GCNConv(1433, 64)
      (1): GCNConv(64, 7)
    )
    (bns): ModuleList(
      (0): BatchNorm1d(64, eps=1e-05, momentum=0.1, affine=True, track_running_stats=True)
    )
    (output): LogSoftmax(dim=-1)
  )
)
propagate done
init label
Split: 01, Run: 01
None time:  1.818361486075446
None Run 01:
Highest Train: 100.00
Highest Valid: 80.80
  Final Train: 100.00
   Final Test: 82.80
Split: 01, Run: 02
None time:  1.8032016570214182
None Run 02:
Highest Train: 100.00
Highest Valid: 80.40
  Final Train: 100.00
   Final Test: 82.20
Split: 01, Run: 03
None time:  1.5599189950153232
None Run 03:
Highest Train: 100.00
Highest Valid: 80.00
  Final Train: 100.00
   Final Test: 80.60
run time now: 5.209342002868652
total time:  5.2255315980874
None All runs:
Highest Train: 100.00 ± 0.00
Highest Valid: 80.40 ± 0.40
  Final Train: 100.00 ± 0.00
   Final Test: 81.87 ± 1.14
[I 2023-06-12 00:35:12,713] Trial 239 finished with value: 80.4000015258789 and parameters: {'Fwd': 0.05197760435809071, 'K': 10, 'alpha': 0.55, 'dropout': 0.4, 'gnnepoch': 70, 'lambda1': 0.8, 'lambda2': 4.3460394881837745, 'loop': 1, 'loss': 'CE', 'lr': 0.00937980025804344, 'softmaxF': False, 'useGCN': True, 'weight_decay': 0.0001572571236446245, 'weightedloss': False}. Best is trial 112 with value: 81.66667175292969.
/home/wxy/miniconda3/lib/python3.10/site-packages/optuna/distributions.py:685: UserWarning: The distribution is specified by [0, 1.00001] and step=0.05, but the range is not divisible by `step`. It will be replaced by [0, 1.0].
  warnings.warn(
K:  10
alpha:  0.5
lr:  0.008603144339234757
weight_decay:  7.379875562743152e-05
dropout:  0.5
fix split and run 3 times
Data: Data(x=[2708, 1433], y=[2708], train_mask=[2708], val_mask=[2708], test_mask=[2708], adj_t=[2708, 2708, nnz=10556])
num_train tensor(140)
num_noise 0
noise: tensor(0)
data feature 1433
ALTOPT(
  (lins): Sequential(
    (0): Linear(in_features=1433, out_features=64, bias=True)
    (1): BatchNorm1d(64, eps=1e-05, momentum=0.1, affine=True, track_running_stats=True)
    (2): Dropout(p=0.5, inplace=True)
    (3): ReLU(inplace=True)
    (4): Linear(in_features=64, out_features=7, bias=True)
    (5): LogSoftmax(dim=-1)
  )
  (prop): Propagation(K=10, mode=None, lambda1=None, lambda2=None, L21=True, alpha=0.5)
  (gcn): GCN(
    (convs): ModuleList(
      (0): GCNConv(1433, 64)
      (1): GCNConv(64, 7)
    )
    (bns): ModuleList(
      (0): BatchNorm1d(64, eps=1e-05, momentum=0.1, affine=True, track_running_stats=True)
    )
    (output): LogSoftmax(dim=-1)
  )
)
propagate done
init label
Split: 01, Run: 01
None time:  1.6622568920720369
None Run 01:
Highest Train: 100.00
Highest Valid: 82.00
  Final Train: 100.00
   Final Test: 82.30
Split: 01, Run: 02
None time:  1.7743398661259562
None Run 02:
Highest Train: 100.00
Highest Valid: 81.20
  Final Train: 100.00
   Final Test: 80.80
Split: 01, Run: 03
None time:  1.6675174050033092
None Run 03:
Highest Train: 100.00
Highest Valid: 80.60
  Final Train: 100.00
   Final Test: 81.10
run time now: 5.128847599029541
total time:  5.145103103015572
None All runs:
Highest Train: 100.00 ± 0.00
Highest Valid: 81.27 ± 0.70
  Final Train: 100.00 ± 0.00
   Final Test: 81.40 ± 0.79
[I 2023-06-12 00:35:18,453] Trial 240 finished with value: 81.26666259765625 and parameters: {'Fwd': 0.07366952703920791, 'K': 10, 'alpha': 0.5, 'dropout': 0.5, 'gnnepoch': 60, 'lambda1': 0.8500000000000001, 'lambda2': 4.7205058077862665, 'loop': 1, 'loss': 'CE', 'lr': 0.008603144339234757, 'softmaxF': True, 'useGCN': True, 'weight_decay': 7.379875562743152e-05, 'weightedloss': False}. Best is trial 112 with value: 81.66667175292969.
/home/wxy/miniconda3/lib/python3.10/site-packages/optuna/distributions.py:685: UserWarning: The distribution is specified by [0, 1.00001] and step=0.05, but the range is not divisible by `step`. It will be replaced by [0, 1.0].
  warnings.warn(
K:  10
alpha:  0.55
lr:  0.007808832272828655
weight_decay:  8.737105291887713e-05
dropout:  0.4
fix split and run 3 times
Data: Data(x=[2708, 1433], y=[2708], train_mask=[2708], val_mask=[2708], test_mask=[2708], adj_t=[2708, 2708, nnz=10556])
num_train tensor(140)
num_noise 0
noise: tensor(0)
data feature 1433
ALTOPT(
  (lins): Sequential(
    (0): Linear(in_features=1433, out_features=64, bias=True)
    (1): BatchNorm1d(64, eps=1e-05, momentum=0.1, affine=True, track_running_stats=True)
    (2): Dropout(p=0.4, inplace=True)
    (3): ReLU(inplace=True)
    (4): Linear(in_features=64, out_features=7, bias=True)
    (5): LogSoftmax(dim=-1)
  )
  (prop): Propagation(K=10, mode=None, lambda1=None, lambda2=None, L21=True, alpha=0.55)
  (gcn): GCN(
    (convs): ModuleList(
      (0): GCNConv(1433, 64)
      (1): GCNConv(64, 7)
    )
    (bns): ModuleList(
      (0): BatchNorm1d(64, eps=1e-05, momentum=0.1, affine=True, track_running_stats=True)
    )
    (output): LogSoftmax(dim=-1)
  )
)
propagate done
init label
Split: 01, Run: 01
None time:  1.3124469679314643
None Run 01:
Highest Train: 100.00
Highest Valid: 81.60
  Final Train: 100.00
   Final Test: 81.90
Split: 01, Run: 02
None time:  1.717000009957701
None Run 02:
Highest Train: 100.00
Highest Valid: 80.80
  Final Train: 100.00
   Final Test: 81.00
Split: 01, Run: 03
None time:  1.723965578014031
None Run 03:
Highest Train: 100.00
Highest Valid: 80.60
  Final Train: 100.00
   Final Test: 81.10
run time now: 4.773340702056885
total time:  4.797015895834193
None All runs:
Highest Train: 100.00 ± 0.00
Highest Valid: 81.00 ± 0.53
  Final Train: 100.00 ± 0.00
   Final Test: 81.33 ± 0.49
