[I 2023-06-12 00:04:27,807] Trial 683 finished with value: 71.66667175292969 and parameters: {'Fwd': 0.0002247517305463259, 'K': 8, 'alpha': 0.6000000000000001, 'dropout': 0.8, 'gnnepoch': 120, 'lambda1': 0.7000000000000001, 'lambda2': 6.178472615089727, 'loop': 0, 'loss': 'CE', 'lr': 0.001652250228641387, 'softmaxF': False, 'useGCN': True, 'weight_decay': 1.337200087837858e-05, 'weightedloss': True}. Best is trial 605 with value: 72.13333129882812.
/home/wxy/miniconda3/lib/python3.10/site-packages/optuna/distributions.py:685: UserWarning: The distribution is specified by [0, 1.00001] and step=0.05, but the range is not divisible by `step`. It will be replaced by [0, 1.0].
  warnings.warn(
K:  2
alpha:  0.55
lr:  0.0012345330129223083
weight_decay:  2.3981223132987947e-05
dropout:  0.8
fix split and run 3 times
Data: Data(x=[3327, 3703], y=[3327], train_mask=[3327], val_mask=[3327], test_mask=[3327], adj_t=[3327, 3327, nnz=9104])
num_train tensor(120)
num_noise 0
noise: tensor(0)
data feature 3703
ALTOPT(
  (lins): Sequential(
    (0): Linear(in_features=3703, out_features=64, bias=True)
    (1): BatchNorm1d(64, eps=1e-05, momentum=0.1, affine=True, track_running_stats=True)
    (2): Dropout(p=0.8, inplace=True)
    (3): ReLU(inplace=True)
    (4): Linear(in_features=64, out_features=6, bias=True)
    (5): LogSoftmax(dim=-1)
  )
  (prop): Propagation(K=2, mode=None, lambda1=None, lambda2=None, L21=True, alpha=0.55)
  (gcn): GCN(
    (convs): ModuleList(
      (0): GCNConv(3703, 64)
      (1): GCNConv(64, 6)
    )
    (bns): ModuleList(
      (0): BatchNorm1d(64, eps=1e-05, momentum=0.1, affine=True, track_running_stats=True)
    )
    (output): LogSoftmax(dim=-1)
  )
)
propagate done
init label
Split: 01, Run: 01
None time:  0.9373094930779189
None Run 01:
Highest Train: 100.00
Highest Valid: 71.00
  Final Train: 100.00
   Final Test: 69.90
Split: 01, Run: 02
None time:  1.0295109539292753
None Run 02:
Highest Train: 100.00
Highest Valid: 68.60
  Final Train: 100.00
   Final Test: 67.80
Split: 01, Run: 03
None time:  0.9955653040669858
None Run 03:
Highest Train: 100.00
Highest Valid: 71.20
  Final Train: 100.00
   Final Test: 70.60
run time now: 2.9983890056610107
total time:  3.055882061831653
None All runs:
Highest Train: 100.00 ± 0.00
Highest Valid: 70.27 ± 1.45
  Final Train: 100.00 ± 0.00
   Final Test: 69.43 ± 1.46
[I 2023-06-12 00:04:31,424] Trial 684 finished with value: 70.26667022705078 and parameters: {'Fwd': 0.0001231231860887054, 'K': 2, 'alpha': 0.55, 'dropout': 0.8, 'gnnepoch': 110, 'lambda1': 0.6000000000000001, 'lambda2': 5.003370634753812, 'loop': 0, 'loss': 'CE', 'lr': 0.0012345330129223083, 'softmaxF': False, 'useGCN': True, 'weight_decay': 2.3981223132987947e-05, 'weightedloss': True}. Best is trial 605 with value: 72.13333129882812.
/home/wxy/miniconda3/lib/python3.10/site-packages/optuna/distributions.py:685: UserWarning: The distribution is specified by [0, 1.00001] and step=0.05, but the range is not divisible by `step`. It will be replaced by [0, 1.0].
  warnings.warn(
K:  8
alpha:  0.65
lr:  0.001453917421352773
weight_decay:  0.004568654415388179
dropout:  0.8
fix split and run 3 times
Data: Data(x=[3327, 3703], y=[3327], train_mask=[3327], val_mask=[3327], test_mask=[3327], adj_t=[3327, 3327, nnz=9104])
num_train tensor(120)
num_noise 0
noise: tensor(0)
data feature 3703
ALTOPT(
  (lins): Sequential(
    (0): Linear(in_features=3703, out_features=64, bias=True)
    (1): BatchNorm1d(64, eps=1e-05, momentum=0.1, affine=True, track_running_stats=True)
    (2): Dropout(p=0.8, inplace=True)
    (3): ReLU(inplace=True)
    (4): Linear(in_features=64, out_features=6, bias=True)
    (5): LogSoftmax(dim=-1)
  )
  (prop): Propagation(K=8, mode=None, lambda1=None, lambda2=None, L21=True, alpha=0.65)
  (gcn): GCN(
    (convs): ModuleList(
      (0): GCNConv(3703, 64)
      (1): GCNConv(64, 6)
    )
    (bns): ModuleList(
      (0): BatchNorm1d(64, eps=1e-05, momentum=0.1, affine=True, track_running_stats=True)
    )
    (output): LogSoftmax(dim=-1)
  )
)
propagate done
init label
Split: 01, Run: 01
None time:  1.0683019470889121
None Run 01:
Highest Train: 100.00
Highest Valid: 71.20
  Final Train: 100.00
   Final Test: 69.70
Split: 01, Run: 02
None time:  1.0921178550925106
None Run 02:
Highest Train: 100.00
Highest Valid: 72.00
  Final Train: 100.00
   Final Test: 70.10
Split: 01, Run: 03
None time:  1.0731989110354334
None Run 03:
Highest Train: 100.00
Highest Valid: 71.80
  Final Train: 100.00
   Final Test: 71.10
run time now: 3.274939775466919
total time:  3.3293138328008354
None All runs:
Highest Train: 100.00 ± 0.00
Highest Valid: 71.67 ± 0.42
  Final Train: 100.00 ± 0.00
   Final Test: 70.30 ± 0.72
[I 2023-06-12 00:04:35,277] Trial 685 finished with value: 71.66667175292969 and parameters: {'Fwd': 6.231054729289139e-06, 'K': 8, 'alpha': 0.65, 'dropout': 0.8, 'gnnepoch': 120, 'lambda1': 0.65, 'lambda2': 7.97182507317721, 'loop': 0, 'loss': 'CE', 'lr': 0.001453917421352773, 'softmaxF': False, 'useGCN': True, 'weight_decay': 0.004568654415388179, 'weightedloss': True}. Best is trial 605 with value: 72.13333129882812.
/home/wxy/miniconda3/lib/python3.10/site-packages/optuna/distributions.py:685: UserWarning: The distribution is specified by [0, 1.00001] and step=0.05, but the range is not divisible by `step`. It will be replaced by [0, 1.0].
  warnings.warn(
K:  9
alpha:  0.75
lr:  0.007929238978954357
weight_decay:  3.194020454610639e-06
dropout:  0.8
fix split and run 3 times
Data: Data(x=[3327, 3703], y=[3327], train_mask=[3327], val_mask=[3327], test_mask=[3327], adj_t=[3327, 3327, nnz=9104])
num_train tensor(120)
num_noise 0
noise: tensor(0)
data feature 3703
ALTOPT(
  (lins): Sequential(
    (0): Linear(in_features=3703, out_features=64, bias=True)
    (1): BatchNorm1d(64, eps=1e-05, momentum=0.1, affine=True, track_running_stats=True)
    (2): Dropout(p=0.8, inplace=True)
    (3): ReLU(inplace=True)
    (4): Linear(in_features=64, out_features=6, bias=True)
    (5): LogSoftmax(dim=-1)
  )
  (prop): Propagation(K=9, mode=None, lambda1=None, lambda2=None, L21=True, alpha=0.75)
  (gcn): GCN(
    (convs): ModuleList(
      (0): GCNConv(3703, 64)
      (1): GCNConv(64, 6)
    )
    (bns): ModuleList(
      (0): BatchNorm1d(64, eps=1e-05, momentum=0.1, affine=True, track_running_stats=True)
    )
    (output): LogSoftmax(dim=-1)
  )
)
propagate done
init label
Split: 01, Run: 01
None time:  0.6990637958515435
None Run 01:
Highest Train: 100.00
Highest Valid: 62.20
  Final Train: 97.50
   Final Test: 56.60
Split: 01, Run: 02
None time:  0.7088945750147104
None Run 02:
Highest Train: 100.00
Highest Valid: 65.60
  Final Train: 99.17
   Final Test: 63.30
Split: 01, Run: 03
None time:  0.7650120449252427
None Run 03:
Highest Train: 100.00
Highest Valid: 67.60
  Final Train: 100.00
   Final Test: 65.00
run time now: 2.215693712234497
total time:  2.2632032961118966
None All runs:
Highest Train: 100.00 ± 0.00
Highest Valid: 65.13 ± 2.73
  Final Train: 98.89 ± 1.27
   Final Test: 61.63 ± 4.44
[I 2023-06-12 00:04:38,117] Trial 686 finished with value: 65.13333129882812 and parameters: {'Fwd': 0.00711095723681928, 'K': 9, 'alpha': 0.75, 'dropout': 0.8, 'gnnepoch': 120, 'lambda1': 0.75, 'lambda2': 5.815755901036075, 'loop': 0, 'loss': 'CE', 'lr': 0.007929238978954357, 'softmaxF': False, 'useGCN': False, 'weight_decay': 3.194020454610639e-06, 'weightedloss': True}. Best is trial 605 with value: 72.13333129882812.
/home/wxy/miniconda3/lib/python3.10/site-packages/optuna/distributions.py:685: UserWarning: The distribution is specified by [0, 1.00001] and step=0.05, but the range is not divisible by `step`. It will be replaced by [0, 1.0].
  warnings.warn(
K:  8
alpha:  0.9
lr:  0.0018436350382816647
weight_decay:  2.888404452242414e-05
dropout:  0.8
fix split and run 3 times
Data: Data(x=[3327, 3703], y=[3327], train_mask=[3327], val_mask=[3327], test_mask=[3327], adj_t=[3327, 3327, nnz=9104])
num_train tensor(120)
num_noise 0
noise: tensor(0)
data feature 3703
ALTOPT(
  (lins): Sequential(
    (0): Linear(in_features=3703, out_features=64, bias=True)
    (1): BatchNorm1d(64, eps=1e-05, momentum=0.1, affine=True, track_running_stats=True)
    (2): Dropout(p=0.8, inplace=True)
    (3): ReLU(inplace=True)
    (4): Linear(in_features=64, out_features=6, bias=True)
    (5): LogSoftmax(dim=-1)
  )
  (prop): Propagation(K=8, mode=None, lambda1=None, lambda2=None, L21=True, alpha=0.9)
  (gcn): GCN(
    (convs): ModuleList(
      (0): GCNConv(3703, 64)
      (1): GCNConv(64, 6)
    )
    (bns): ModuleList(
      (0): BatchNorm1d(64, eps=1e-05, momentum=0.1, affine=True, track_running_stats=True)
    )
    (output): LogSoftmax(dim=-1)
  )
)
propagate done
init label
Split: 01, Run: 01
None time:  1.0247305480297655
None Run 01:
Highest Train: 100.00
Highest Valid: 71.20
  Final Train: 100.00
   Final Test: 69.90
Split: 01, Run: 02
None time:  0.9868813070934266
None Run 02:
Highest Train: 100.00
Highest Valid: 71.80
  Final Train: 100.00
   Final Test: 70.10
Split: 01, Run: 03
None time:  1.0707748930435628
None Run 03:
Highest Train: 100.00
Highest Valid: 71.60
  Final Train: 100.00
   Final Test: 70.00
run time now: 3.122882604598999
total time:  3.17566443211399
None All runs:
Highest Train: 100.00 ± 0.00
Highest Valid: 71.53 ± 0.31
  Final Train: 100.00 ± 0.00
   Final Test: 70.00 ± 0.10
[I 2023-06-12 00:04:41,780] Trial 687 finished with value: 71.53333282470703 and parameters: {'Fwd': 0.026388443069104858, 'K': 8, 'alpha': 0.9, 'dropout': 0.8, 'gnnepoch': 120, 'lambda1': 0.65, 'lambda2': 5.216517037513755, 'loop': 0, 'loss': 'CE', 'lr': 0.0018436350382816647, 'softmaxF': True, 'useGCN': True, 'weight_decay': 2.888404452242414e-05, 'weightedloss': True}. Best is trial 605 with value: 72.13333129882812.
/home/wxy/miniconda3/lib/python3.10/site-packages/optuna/distributions.py:685: UserWarning: The distribution is specified by [0, 1.00001] and step=0.05, but the range is not divisible by `step`. It will be replaced by [0, 1.0].
  warnings.warn(
K:  7
alpha:  0.7000000000000001
lr:  0.009344042728415098
weight_decay:  1.905386123071196e-05
dropout:  0.7000000000000001
fix split and run 3 times
Data: Data(x=[3327, 3703], y=[3327], train_mask=[3327], val_mask=[3327], test_mask=[3327], adj_t=[3327, 3327, nnz=9104])
num_train tensor(120)
num_noise 0
noise: tensor(0)
data feature 3703
ALTOPT(
  (lins): Sequential(
    (0): Linear(in_features=3703, out_features=64, bias=True)
    (1): BatchNorm1d(64, eps=1e-05, momentum=0.1, affine=True, track_running_stats=True)
    (2): Dropout(p=0.7000000000000001, inplace=True)
    (3): ReLU(inplace=True)
    (4): Linear(in_features=64, out_features=6, bias=True)
    (5): LogSoftmax(dim=-1)
  )
  (prop): Propagation(K=7, mode=None, lambda1=None, lambda2=None, L21=True, alpha=0.7000000000000001)
  (gcn): GCN(
    (convs): ModuleList(
      (0): GCNConv(3703, 64)
      (1): GCNConv(64, 6)
    )
    (bns): ModuleList(
      (0): BatchNorm1d(64, eps=1e-05, momentum=0.1, affine=True, track_running_stats=True)
    )
    (output): LogSoftmax(dim=-1)
  )
)
propagate done
init label
Split: 01, Run: 01
None time:  1.0357246238272637
None Run 01:
Highest Train: 100.00
Highest Valid: 68.40
  Final Train: 99.17
   Final Test: 68.90
Split: 01, Run: 02, Epoch: 100, Loss: 0.0000, Train: 100.00%, Valid: 67.40% Test: 68.70%
Split: 01, Run: 02
None time:  1.6817460858728737
None Run 02:
Highest Train: 100.00
Highest Valid: 67.40
  Final Train: 100.00
   Final Test: 68.30
Split: 01, Run: 03, Epoch: 100, Loss: 0.0000, Train: 99.17%, Valid: 69.40% Test: 69.20%
Split: 01, Run: 03
None time:  1.7472589409444481
None Run 03:
Highest Train: 100.00
Highest Valid: 69.40
  Final Train: 99.17
   Final Test: 69.30
run time now: 4.506129264831543
total time:  4.567382239038125
None All runs:
Highest Train: 100.00 ± 0.00
Highest Valid: 68.40 ± 1.00
  Final Train: 99.44 ± 0.48
   Final Test: 68.83 ± 0.50
[I 2023-06-12 00:04:46,882] Trial 688 finished with value: 68.4000015258789 and parameters: {'Fwd': 0.0493546081733916, 'K': 7, 'alpha': 0.7000000000000001, 'dropout': 0.7000000000000001, 'gnnepoch': 110, 'lambda1': 0.55, 'lambda2': 4.0724585047808795, 'loop': 0, 'loss': 'CE', 'lr': 0.009344042728415098, 'softmaxF': False, 'useGCN': True, 'weight_decay': 1.905386123071196e-05, 'weightedloss': True}. Best is trial 605 with value: 72.13333129882812.
/home/wxy/miniconda3/lib/python3.10/site-packages/optuna/distributions.py:685: UserWarning: The distribution is specified by [0, 1.00001] and step=0.05, but the range is not divisible by `step`. It will be replaced by [0, 1.0].
  warnings.warn(
K:  8
alpha:  0.8
lr:  0.000895752849692045
weight_decay:  0.005477438572613086
dropout:  0.8
fix split and run 3 times
Data: Data(x=[3327, 3703], y=[3327], train_mask=[3327], val_mask=[3327], test_mask=[3327], adj_t=[3327, 3327, nnz=9104])
num_train tensor(120)
num_noise 0
noise: tensor(0)
data feature 3703
ALTOPT(
  (lins): Sequential(
    (0): Linear(in_features=3703, out_features=64, bias=True)
    (1): BatchNorm1d(64, eps=1e-05, momentum=0.1, affine=True, track_running_stats=True)
    (2): Dropout(p=0.8, inplace=True)
    (3): ReLU(inplace=True)
    (4): Linear(in_features=64, out_features=6, bias=True)
    (5): LogSoftmax(dim=-1)
  )
  (prop): Propagation(K=8, mode=None, lambda1=None, lambda2=None, L21=True, alpha=0.8)
  (gcn): GCN(
    (convs): ModuleList(
      (0): GCNConv(3703, 64)
      (1): GCNConv(64, 6)
    )
    (bns): ModuleList(
      (0): BatchNorm1d(64, eps=1e-05, momentum=0.1, affine=True, track_running_stats=True)
    )
    (output): LogSoftmax(dim=-1)
  )
)
propagate done
init label
Split: 01, Run: 01
None time:  1.0285408769268543
None Run 01:
Highest Train: 100.00
Highest Valid: 70.40
  Final Train: 100.00
   Final Test: 69.30
Split: 01, Run: 02
None time:  1.0758749649394304
None Run 02:
Highest Train: 100.00
Highest Valid: 72.00
  Final Train: 100.00
   Final Test: 70.00
Split: 01, Run: 03
None time:  1.2903593610972166
None Run 03:
Highest Train: 100.00
Highest Valid: 71.00
  Final Train: 100.00
   Final Test: 69.90
run time now: 3.4447479248046875
total time:  3.495817705988884
None All runs:
Highest Train: 100.00 ± 0.00
Highest Valid: 71.13 ± 0.81
  Final Train: 100.00 ± 0.00
   Final Test: 69.73 ± 0.38
[I 2023-06-12 00:04:50,888] Trial 689 finished with value: 71.13333129882812 and parameters: {'Fwd': 1.032654517375257e-05, 'K': 8, 'alpha': 0.8, 'dropout': 0.8, 'gnnepoch': 120, 'lambda1': 0.7000000000000001, 'lambda2': 6.551449690565116, 'loop': 0, 'loss': 'CE', 'lr': 0.000895752849692045, 'softmaxF': False, 'useGCN': True, 'weight_decay': 0.005477438572613086, 'weightedloss': True}. Best is trial 605 with value: 72.13333129882812.
/home/wxy/miniconda3/lib/python3.10/site-packages/optuna/distributions.py:685: UserWarning: The distribution is specified by [0, 1.00001] and step=0.05, but the range is not divisible by `step`. It will be replaced by [0, 1.0].
  warnings.warn(
K:  3
alpha:  0.5
lr:  0.0013308810183369616
weight_decay:  6.561862954916147e-05
dropout:  0.9
fix split and run 3 times
Data: Data(x=[3327, 3703], y=[3327], train_mask=[3327], val_mask=[3327], test_mask=[3327], adj_t=[3327, 3327, nnz=9104])
num_train tensor(120)
num_noise 0
noise: tensor(0)
data feature 3703
ALTOPT(
  (lins): Sequential(
    (0): Linear(in_features=3703, out_features=64, bias=True)
    (1): BatchNorm1d(64, eps=1e-05, momentum=0.1, affine=True, track_running_stats=True)
    (2): Dropout(p=0.9, inplace=True)
    (3): ReLU(inplace=True)
    (4): Linear(in_features=64, out_features=6, bias=True)
    (5): LogSoftmax(dim=-1)
  )
  (prop): Propagation(K=3, mode=None, lambda1=None, lambda2=None, L21=True, alpha=0.5)
  (gcn): GCN(
    (convs): ModuleList(
      (0): GCNConv(3703, 64)
      (1): GCNConv(64, 6)
    )
    (bns): ModuleList(
      (0): BatchNorm1d(64, eps=1e-05, momentum=0.1, affine=True, track_running_stats=True)
    )
    (output): LogSoftmax(dim=-1)
  )
)
propagate done
init label
Split: 01, Run: 01
None time:  0.9921574841719121
None Run 01:
Highest Train: 100.00
Highest Valid: 70.60
  Final Train: 100.00
   Final Test: 69.30
Split: 01, Run: 02
None time:  0.9584514768794179
None Run 02:
Highest Train: 100.00
Highest Valid: 71.20
  Final Train: 100.00
   Final Test: 69.10
Split: 01, Run: 03
None time:  1.0487411259673536
None Run 03:
Highest Train: 100.00
Highest Valid: 72.20
  Final Train: 100.00
   Final Test: 70.40
run time now: 3.036015033721924
total time:  3.090853980043903
None All runs:
Highest Train: 100.00 ± 0.00
Highest Valid: 71.33 ± 0.81
  Final Train: 100.00 ± 0.00
   Final Test: 69.60 ± 0.70
[I 2023-06-12 00:04:54,558] Trial 690 finished with value: 71.33333587646484 and parameters: {'Fwd': 0.03275339796519272, 'K': 3, 'alpha': 0.5, 'dropout': 0.9, 'gnnepoch': 120, 'lambda1': 0.75, 'lambda2': 5.9890632307596725, 'loop': 0, 'loss': 'CE', 'lr': 0.0013308810183369616, 'softmaxF': False, 'useGCN': True, 'weight_decay': 6.561862954916147e-05, 'weightedloss': True}. Best is trial 605 with value: 72.13333129882812.
/home/wxy/miniconda3/lib/python3.10/site-packages/optuna/distributions.py:685: UserWarning: The distribution is specified by [0, 1.00001] and step=0.05, but the range is not divisible by `step`. It will be replaced by [0, 1.0].
  warnings.warn(
K:  8
alpha:  0.6000000000000001
lr:  0.0015674549596655693
weight_decay:  4.476377060923098e-05
dropout:  0.8
fix split and run 3 times
Data: Data(x=[3327, 3703], y=[3327], train_mask=[3327], val_mask=[3327], test_mask=[3327], adj_t=[3327, 3327, nnz=9104])
num_train tensor(120)
num_noise 0
noise: tensor(0)
data feature 3703
ALTOPT(
  (lins): Sequential(
    (0): Linear(in_features=3703, out_features=64, bias=True)
    (1): BatchNorm1d(64, eps=1e-05, momentum=0.1, affine=True, track_running_stats=True)
    (2): Dropout(p=0.8, inplace=True)
    (3): ReLU(inplace=True)
    (4): Linear(in_features=64, out_features=6, bias=True)
    (5): LogSoftmax(dim=-1)
  )
  (prop): Propagation(K=8, mode=None, lambda1=None, lambda2=None, L21=True, alpha=0.6000000000000001)
  (gcn): GCN(
    (convs): ModuleList(
      (0): GCNConv(3703, 64)
      (1): GCNConv(64, 6)
    )
    (bns): ModuleList(
      (0): BatchNorm1d(64, eps=1e-05, momentum=0.1, affine=True, track_running_stats=True)
    )
    (output): LogSoftmax(dim=-1)
  )
)
propagate done
init label
Split: 01, Run: 01
None time:  1.014376405859366
None Run 01:
Highest Train: 100.00
Highest Valid: 71.40
  Final Train: 100.00
   Final Test: 69.30
Split: 01, Run: 02
None time:  1.0450509611982852
None Run 02:
Highest Train: 100.00
Highest Valid: 72.00
  Final Train: 100.00
   Final Test: 70.20
Split: 01, Run: 03
None time:  1.2096057289745659
None Run 03:
Highest Train: 100.00
Highest Valid: 71.80
  Final Train: 100.00
   Final Test: 70.10
run time now: 3.3111319541931152
total time:  3.3629595930688083
None All runs:
Highest Train: 100.00 ± 0.00
Highest Valid: 71.73 ± 0.31
  Final Train: 100.00 ± 0.00
   Final Test: 69.87 ± 0.49
[I 2023-06-12 00:04:58,416] Trial 691 finished with value: 71.73332977294922 and parameters: {'Fwd': 0.0003385008432496907, 'K': 8, 'alpha': 0.6000000000000001, 'dropout': 0.8, 'gnnepoch': 120, 'lambda1': 0.65, 'lambda2': 9.817081731538986, 'loop': 0, 'loss': 'CE', 'lr': 0.0015674549596655693, 'softmaxF': False, 'useGCN': True, 'weight_decay': 4.476377060923098e-05, 'weightedloss': True}. Best is trial 605 with value: 72.13333129882812.
/home/wxy/miniconda3/lib/python3.10/site-packages/optuna/distributions.py:685: UserWarning: The distribution is specified by [0, 1.00001] and step=0.05, but the range is not divisible by `step`. It will be replaced by [0, 1.0].
  warnings.warn(
K:  8
alpha:  0.9500000000000001
lr:  0.00042320030553936956
weight_decay:  1.029536076716043e-05
dropout:  0.8
fix split and run 3 times
Data: Data(x=[3327, 3703], y=[3327], train_mask=[3327], val_mask=[3327], test_mask=[3327], adj_t=[3327, 3327, nnz=9104])
num_train tensor(120)
num_noise 0
noise: tensor(0)
data feature 3703
ALTOPT(
  (lins): Sequential(
    (0): Linear(in_features=3703, out_features=64, bias=True)
    (1): BatchNorm1d(64, eps=1e-05, momentum=0.1, affine=True, track_running_stats=True)
    (2): Dropout(p=0.8, inplace=True)
    (3): ReLU(inplace=True)
    (4): Linear(in_features=64, out_features=6, bias=True)
    (5): LogSoftmax(dim=-1)
  )
  (prop): Propagation(K=8, mode=None, lambda1=None, lambda2=None, L21=True, alpha=0.9500000000000001)
  (gcn): GCN(
    (convs): ModuleList(
      (0): GCNConv(3703, 64)
      (1): GCNConv(64, 6)
    )
    (bns): ModuleList(
      (0): BatchNorm1d(64, eps=1e-05, momentum=0.1, affine=True, track_running_stats=True)
    )
    (output): LogSoftmax(dim=-1)
  )
)
propagate done
init label
Split: 01, Run: 01
None time:  1.2631987950298935
None Run 01:
Highest Train: 100.00
Highest Valid: 70.00
  Final Train: 100.00
   Final Test: 69.60
Split: 01, Run: 02
None time:  1.280833733966574
None Run 02:
Highest Train: 100.00
Highest Valid: 68.60
  Final Train: 100.00
   Final Test: 69.80
Split: 01, Run: 03
None time:  1.2718907191883773
None Run 03:
Highest Train: 100.00
Highest Valid: 70.40
  Final Train: 100.00
   Final Test: 69.60
run time now: 3.857224941253662
total time:  3.907828707015142
None All runs:
Highest Train: 100.00 ± 0.00
Highest Valid: 69.67 ± 0.95
  Final Train: 100.00 ± 0.00
   Final Test: 69.67 ± 0.12
