[I 2023-06-11 23:54:36,339] Trial 530 finished with value: 71.79999542236328 and parameters: {'Fwd': 5.984081814466943e-05, 'K': 8, 'alpha': 0.8, 'dropout': 0.8, 'gnnepoch': 120, 'lambda1': 0.65, 'lambda2': 6.690754880389673, 'loop': 0, 'loss': 'CE', 'lr': 0.0012650362421669664, 'softmaxF': False, 'useGCN': True, 'weight_decay': 0.0008264895695251227, 'weightedloss': True}. Best is trial 271 with value: 72.06666564941406.
/home/wxy/miniconda3/lib/python3.10/site-packages/optuna/distributions.py:685: UserWarning: The distribution is specified by [0, 1.00001] and step=0.05, but the range is not divisible by `step`. It will be replaced by [0, 1.0].
  warnings.warn(
K:  8
alpha:  0.8500000000000001
lr:  0.00108634468522786
weight_decay:  0.00040508146873588144
dropout:  0.8
fix split and run 3 times
Data: Data(x=[3327, 3703], y=[3327], train_mask=[3327], val_mask=[3327], test_mask=[3327], adj_t=[3327, 3327, nnz=9104])
num_train tensor(120)
num_noise 0
noise: tensor(0)
data feature 3703
ALTOPT(
  (lins): Sequential(
    (0): Linear(in_features=3703, out_features=64, bias=True)
    (1): BatchNorm1d(64, eps=1e-05, momentum=0.1, affine=True, track_running_stats=True)
    (2): Dropout(p=0.8, inplace=True)
    (3): ReLU(inplace=True)
    (4): Linear(in_features=64, out_features=6, bias=True)
    (5): LogSoftmax(dim=-1)
  )
  (prop): Propagation(K=8, mode=None, lambda1=None, lambda2=None, L21=True, alpha=0.8500000000000001)
  (gcn): GCN(
    (convs): ModuleList(
      (0): GCNConv(3703, 64)
      (1): GCNConv(64, 6)
    )
    (bns): ModuleList(
      (0): BatchNorm1d(64, eps=1e-05, momentum=0.1, affine=True, track_running_stats=True)
    )
    (output): LogSoftmax(dim=-1)
  )
)
propagate done
init label
Split: 01, Run: 01
None time:  1.033535816008225
None Run 01:
Highest Train: 100.00
Highest Valid: 71.00
  Final Train: 100.00
   Final Test: 70.10
Split: 01, Run: 02
None time:  1.032643378013745
None Run 02:
Highest Train: 100.00
Highest Valid: 68.60
  Final Train: 100.00
   Final Test: 68.40
Split: 01, Run: 03
None time:  0.9617931707762182
None Run 03:
Highest Train: 100.00
Highest Valid: 70.80
  Final Train: 100.00
   Final Test: 70.80
run time now: 3.0798487663269043
total time:  3.126458145910874
None All runs:
Highest Train: 100.00 ± 0.00
Highest Valid: 70.13 ± 1.33
  Final Train: 100.00 ± 0.00
   Final Test: 69.77 ± 1.23
[I 2023-06-11 23:54:40,001] Trial 531 finished with value: 70.13333892822266 and parameters: {'Fwd': 3.7461575504505014e-06, 'K': 8, 'alpha': 0.8500000000000001, 'dropout': 0.8, 'gnnepoch': 110, 'lambda1': 0.6000000000000001, 'lambda2': 8.145247038709744, 'loop': 0, 'loss': 'CE', 'lr': 0.00108634468522786, 'softmaxF': False, 'useGCN': True, 'weight_decay': 0.00040508146873588144, 'weightedloss': True}. Best is trial 271 with value: 72.06666564941406.
/home/wxy/miniconda3/lib/python3.10/site-packages/optuna/distributions.py:685: UserWarning: The distribution is specified by [0, 1.00001] and step=0.05, but the range is not divisible by `step`. It will be replaced by [0, 1.0].
  warnings.warn(
K:  8
alpha:  0.6000000000000001
lr:  0.0017998094960585496
weight_decay:  0.0001248582169355318
dropout:  0.7000000000000001
fix split and run 3 times
Data: Data(x=[3327, 3703], y=[3327], train_mask=[3327], val_mask=[3327], test_mask=[3327], adj_t=[3327, 3327, nnz=9104])
num_train tensor(120)
num_noise 0
noise: tensor(0)
data feature 3703
ALTOPT(
  (lins): Sequential(
    (0): Linear(in_features=3703, out_features=64, bias=True)
    (1): BatchNorm1d(64, eps=1e-05, momentum=0.1, affine=True, track_running_stats=True)
    (2): Dropout(p=0.7000000000000001, inplace=True)
    (3): ReLU(inplace=True)
    (4): Linear(in_features=64, out_features=6, bias=True)
    (5): LogSoftmax(dim=-1)
  )
  (prop): Propagation(K=8, mode=None, lambda1=None, lambda2=None, L21=True, alpha=0.6000000000000001)
  (gcn): GCN(
    (convs): ModuleList(
      (0): GCNConv(3703, 64)
      (1): GCNConv(64, 6)
    )
    (bns): ModuleList(
      (0): BatchNorm1d(64, eps=1e-05, momentum=0.1, affine=True, track_running_stats=True)
    )
    (output): LogSoftmax(dim=-1)
  )
)
propagate done
init label
Split: 01, Run: 01
None time:  1.1375208541285247
None Run 01:
Highest Train: 100.00
Highest Valid: 71.40
  Final Train: 100.00
   Final Test: 69.60
Split: 01, Run: 02
None time:  1.0546198941301554
None Run 02:
Highest Train: 100.00
Highest Valid: 71.60
  Final Train: 100.00
   Final Test: 70.00
Split: 01, Run: 03
None time:  1.0833820779807866
None Run 03:
Highest Train: 100.00
Highest Valid: 71.40
  Final Train: 100.00
   Final Test: 70.20
run time now: 3.317509412765503
total time:  3.3688259050250053
None All runs:
Highest Train: 100.00 ± 0.00
Highest Valid: 71.47 ± 0.12
  Final Train: 100.00 ± 0.00
   Final Test: 69.93 ± 0.31
[I 2023-06-11 23:54:43,889] Trial 532 finished with value: 71.46666717529297 and parameters: {'Fwd': 0.0004210684060323907, 'K': 8, 'alpha': 0.6000000000000001, 'dropout': 0.7000000000000001, 'gnnepoch': 120, 'lambda1': 0.75, 'lambda2': 9.457639321169651, 'loop': 0, 'loss': 'CE', 'lr': 0.0017998094960585496, 'softmaxF': False, 'useGCN': True, 'weight_decay': 0.0001248582169355318, 'weightedloss': True}. Best is trial 271 with value: 72.06666564941406.
/home/wxy/miniconda3/lib/python3.10/site-packages/optuna/distributions.py:685: UserWarning: The distribution is specified by [0, 1.00001] and step=0.05, but the range is not divisible by `step`. It will be replaced by [0, 1.0].
  warnings.warn(
K:  8
alpha:  0.9
lr:  0.001456441528362173
weight_decay:  6.752830355951836e-05
dropout:  0.8
fix split and run 3 times
Data: Data(x=[3327, 3703], y=[3327], train_mask=[3327], val_mask=[3327], test_mask=[3327], adj_t=[3327, 3327, nnz=9104])
num_train tensor(120)
num_noise 0
noise: tensor(0)
data feature 3703
ALTOPT(
  (lins): Sequential(
    (0): Linear(in_features=3703, out_features=64, bias=True)
    (1): BatchNorm1d(64, eps=1e-05, momentum=0.1, affine=True, track_running_stats=True)
    (2): Dropout(p=0.8, inplace=True)
    (3): ReLU(inplace=True)
    (4): Linear(in_features=64, out_features=6, bias=True)
    (5): LogSoftmax(dim=-1)
  )
  (prop): Propagation(K=8, mode=None, lambda1=None, lambda2=None, L21=True, alpha=0.9)
  (gcn): GCN(
    (convs): ModuleList(
      (0): GCNConv(3703, 64)
      (1): GCNConv(64, 6)
    )
    (bns): ModuleList(
      (0): BatchNorm1d(64, eps=1e-05, momentum=0.1, affine=True, track_running_stats=True)
    )
    (output): LogSoftmax(dim=-1)
  )
)
propagate done
init label
Split: 01, Run: 01
None time:  1.0514305990654975
None Run 01:
Highest Train: 100.00
Highest Valid: 71.20
  Final Train: 100.00
   Final Test: 69.50
Split: 01, Run: 02
None time:  1.0560860000550747
None Run 02:
Highest Train: 100.00
Highest Valid: 72.00
  Final Train: 100.00
   Final Test: 70.10
Split: 01, Run: 03
None time:  1.122367839096114
None Run 03:
Highest Train: 100.00
Highest Valid: 71.80
  Final Train: 100.00
   Final Test: 71.10
run time now: 3.2707788944244385
total time:  3.321362149901688
None All runs:
Highest Train: 100.00 ± 0.00
Highest Valid: 71.67 ± 0.42
  Final Train: 100.00 ± 0.00
   Final Test: 70.23 ± 0.81
[I 2023-06-11 23:54:47,717] Trial 533 finished with value: 71.66667175292969 and parameters: {'Fwd': 4.4712257194538795e-06, 'K': 8, 'alpha': 0.9, 'dropout': 0.8, 'gnnepoch': 120, 'lambda1': 0.8, 'lambda2': 7.919507440288493, 'loop': 0, 'loss': 'CE', 'lr': 0.001456441528362173, 'softmaxF': False, 'useGCN': True, 'weight_decay': 6.752830355951836e-05, 'weightedloss': True}. Best is trial 271 with value: 72.06666564941406.
/home/wxy/miniconda3/lib/python3.10/site-packages/optuna/distributions.py:685: UserWarning: The distribution is specified by [0, 1.00001] and step=0.05, but the range is not divisible by `step`. It will be replaced by [0, 1.0].
  warnings.warn(
K:  8
alpha:  0.8500000000000001
lr:  0.0002075544503494174
weight_decay:  0.0003663502018973567
dropout:  0.8
fix split and run 3 times
Data: Data(x=[3327, 3703], y=[3327], train_mask=[3327], val_mask=[3327], test_mask=[3327], adj_t=[3327, 3327, nnz=9104])
num_train tensor(120)
num_noise 0
noise: tensor(0)
data feature 3703
ALTOPT(
  (lins): Sequential(
    (0): Linear(in_features=3703, out_features=64, bias=True)
    (1): BatchNorm1d(64, eps=1e-05, momentum=0.1, affine=True, track_running_stats=True)
    (2): Dropout(p=0.8, inplace=True)
    (3): ReLU(inplace=True)
    (4): Linear(in_features=64, out_features=6, bias=True)
    (5): LogSoftmax(dim=-1)
  )
  (prop): Propagation(K=8, mode=None, lambda1=None, lambda2=None, L21=True, alpha=0.8500000000000001)
  (gcn): GCN(
    (convs): ModuleList(
      (0): GCNConv(3703, 64)
      (1): GCNConv(64, 6)
    )
    (bns): ModuleList(
      (0): BatchNorm1d(64, eps=1e-05, momentum=0.1, affine=True, track_running_stats=True)
    )
    (output): LogSoftmax(dim=-1)
  )
)
propagate done
init label
Split: 01, Run: 01
None time:  0.6583468818571419
None Run 01:
Highest Train: 100.00
Highest Valid: 68.20
  Final Train: 100.00
   Final Test: 65.40
Split: 01, Run: 02
None time:  0.7751243899110705
None Run 02:
Highest Train: 100.00
Highest Valid: 68.40
  Final Train: 100.00
   Final Test: 66.40
Split: 01, Run: 03
None time:  1.1490565710701048
None Run 03:
Highest Train: 100.00
Highest Valid: 66.80
  Final Train: 100.00
   Final Test: 65.20
run time now: 2.624955177307129
total time:  2.6801195750012994
None All runs:
Highest Train: 100.00 ± 0.00
Highest Valid: 67.80 ± 0.87
  Final Train: 100.00 ± 0.00
   Final Test: 65.67 ± 0.64
[I 2023-06-11 23:54:50,884] Trial 534 finished with value: 67.79999542236328 and parameters: {'Fwd': 0.0016054155832837334, 'K': 8, 'alpha': 0.8500000000000001, 'dropout': 0.8, 'gnnepoch': 120, 'lambda1': 0.45, 'lambda2': 8.73894639947503, 'loop': 0, 'loss': 'CE', 'lr': 0.0002075544503494174, 'softmaxF': True, 'useGCN': False, 'weight_decay': 0.0003663502018973567, 'weightedloss': True}. Best is trial 271 with value: 72.06666564941406.
/home/wxy/miniconda3/lib/python3.10/site-packages/optuna/distributions.py:685: UserWarning: The distribution is specified by [0, 1.00001] and step=0.05, but the range is not divisible by `step`. It will be replaced by [0, 1.0].
  warnings.warn(
K:  9
alpha:  0.8
lr:  0.0006763921405923653
weight_decay:  0.00014249807991543583
dropout:  0.4
fix split and run 3 times
Data: Data(x=[3327, 3703], y=[3327], train_mask=[3327], val_mask=[3327], test_mask=[3327], adj_t=[3327, 3327, nnz=9104])
num_train tensor(120)
num_noise 0
noise: tensor(0)
data feature 3703
ALTOPT(
  (lins): Sequential(
    (0): Linear(in_features=3703, out_features=64, bias=True)
    (1): BatchNorm1d(64, eps=1e-05, momentum=0.1, affine=True, track_running_stats=True)
    (2): Dropout(p=0.4, inplace=True)
    (3): ReLU(inplace=True)
    (4): Linear(in_features=64, out_features=6, bias=True)
    (5): LogSoftmax(dim=-1)
  )
  (prop): Propagation(K=9, mode=None, lambda1=None, lambda2=None, L21=True, alpha=0.8)
  (gcn): GCN(
    (convs): ModuleList(
      (0): GCNConv(3703, 64)
      (1): GCNConv(64, 6)
    )
    (bns): ModuleList(
      (0): BatchNorm1d(64, eps=1e-05, momentum=0.1, affine=True, track_running_stats=True)
    )
    (output): LogSoftmax(dim=-1)
  )
)
propagate done
init label
Split: 01, Run: 01
None time:  1.0286936222109944
None Run 01:
Highest Train: 100.00
Highest Valid: 70.40
  Final Train: 100.00
   Final Test: 69.30
Split: 01, Run: 02
None time:  1.1064194971695542
None Run 02:
Highest Train: 100.00
Highest Valid: 70.60
  Final Train: 100.00
   Final Test: 70.80
Split: 01, Run: 03
None time:  1.1143149218987674
None Run 03:
Highest Train: 100.00
Highest Valid: 70.40
  Final Train: 100.00
   Final Test: 70.20
run time now: 3.291820764541626
total time:  3.35377678507939
None All runs:
Highest Train: 100.00 ± 0.00
Highest Valid: 70.47 ± 0.12
  Final Train: 100.00 ± 0.00
   Final Test: 70.10 ± 0.75
[I 2023-06-11 23:54:54,734] Trial 535 finished with value: 70.46666717529297 and parameters: {'Fwd': 0.0002791312011348958, 'K': 9, 'alpha': 0.8, 'dropout': 0.4, 'gnnepoch': 120, 'lambda1': 0.2, 'lambda2': 7.560404600874378, 'loop': 0, 'loss': 'CE', 'lr': 0.0006763921405923653, 'softmaxF': False, 'useGCN': True, 'weight_decay': 0.00014249807991543583, 'weightedloss': True}. Best is trial 271 with value: 72.06666564941406.
/home/wxy/miniconda3/lib/python3.10/site-packages/optuna/distributions.py:685: UserWarning: The distribution is specified by [0, 1.00001] and step=0.05, but the range is not divisible by `step`. It will be replaced by [0, 1.0].
  warnings.warn(
K:  8
alpha:  0.9
lr:  0.0012941603317239195
weight_decay:  0.00020372660048524407
dropout:  0.8
fix split and run 3 times
Data: Data(x=[3327, 3703], y=[3327], train_mask=[3327], val_mask=[3327], test_mask=[3327], adj_t=[3327, 3327, nnz=9104])
num_train tensor(120)
num_noise 0
noise: tensor(0)
data feature 3703
ALTOPT(
  (lins): Sequential(
    (0): Linear(in_features=3703, out_features=64, bias=True)
    (1): BatchNorm1d(64, eps=1e-05, momentum=0.1, affine=True, track_running_stats=True)
    (2): Dropout(p=0.8, inplace=True)
    (3): ReLU(inplace=True)
    (4): Linear(in_features=64, out_features=6, bias=True)
    (5): LogSoftmax(dim=-1)
  )
  (prop): Propagation(K=8, mode=None, lambda1=None, lambda2=None, L21=True, alpha=0.9)
  (gcn): GCN(
    (convs): ModuleList(
      (0): GCNConv(3703, 64)
      (1): GCNConv(64, 6)
    )
    (bns): ModuleList(
      (0): BatchNorm1d(64, eps=1e-05, momentum=0.1, affine=True, track_running_stats=True)
    )
    (output): LogSoftmax(dim=-1)
  )
)
propagate done
init label
Split: 01, Run: 01
None time:  1.083411263069138
None Run 01:
Highest Train: 100.00
Highest Valid: 71.60
  Final Train: 100.00
   Final Test: 69.60
Split: 01, Run: 02
None time:  1.0068025728687644
None Run 02:
Highest Train: 100.00
Highest Valid: 72.40
  Final Train: 100.00
   Final Test: 69.90
Split: 01, Run: 03
None time:  1.1854669461026788
None Run 03:
Highest Train: 100.00
Highest Valid: 71.80
  Final Train: 100.00
   Final Test: 70.90
run time now: 3.3255581855773926
total time:  3.382913365960121
None All runs:
Highest Train: 100.00 ± 0.00
Highest Valid: 71.93 ± 0.42
  Final Train: 100.00 ± 0.00
   Final Test: 70.13 ± 0.68
[I 2023-06-11 23:54:58,645] Trial 536 finished with value: 71.93333435058594 and parameters: {'Fwd': 0.0008333438392575402, 'K': 8, 'alpha': 0.9, 'dropout': 0.8, 'gnnepoch': 120, 'lambda1': 0.75, 'lambda2': 7.01807803810228, 'loop': 0, 'loss': 'CE', 'lr': 0.0012941603317239195, 'softmaxF': False, 'useGCN': True, 'weight_decay': 0.00020372660048524407, 'weightedloss': True}. Best is trial 271 with value: 72.06666564941406.
/home/wxy/miniconda3/lib/python3.10/site-packages/optuna/distributions.py:685: UserWarning: The distribution is specified by [0, 1.00001] and step=0.05, but the range is not divisible by `step`. It will be replaced by [0, 1.0].
  warnings.warn(
K:  8
alpha:  0.8500000000000001
lr:  0.0010203016401519743
weight_decay:  8.874035315103483e-05
dropout:  0.8
fix split and run 3 times
Data: Data(x=[3327, 3703], y=[3327], train_mask=[3327], val_mask=[3327], test_mask=[3327], adj_t=[3327, 3327, nnz=9104])
num_train tensor(120)
num_noise 0
noise: tensor(0)
data feature 3703
ALTOPT(
  (lins): Sequential(
    (0): Linear(in_features=3703, out_features=64, bias=True)
    (1): BatchNorm1d(64, eps=1e-05, momentum=0.1, affine=True, track_running_stats=True)
    (2): Dropout(p=0.8, inplace=True)
    (3): ReLU(inplace=True)
    (4): Linear(in_features=64, out_features=6, bias=True)
    (5): LogSoftmax(dim=-1)
  )
  (prop): Propagation(K=8, mode=None, lambda1=None, lambda2=None, L21=True, alpha=0.8500000000000001)
  (gcn): GCN(
    (convs): ModuleList(
      (0): GCNConv(3703, 64)
      (1): GCNConv(64, 6)
    )
    (bns): ModuleList(
      (0): BatchNorm1d(64, eps=1e-05, momentum=0.1, affine=True, track_running_stats=True)
    )
    (output): LogSoftmax(dim=-1)
  )
)
propagate done
init label
Split: 01, Run: 01
None time:  1.0124086160212755
None Run 01:
Highest Train: 100.00
Highest Valid: 70.40
  Final Train: 100.00
   Final Test: 69.40
Split: 01, Run: 02
None time:  1.055579591076821
None Run 02:
Highest Train: 100.00
Highest Valid: 72.40
  Final Train: 100.00
   Final Test: 69.80
Split: 01, Run: 03
None time:  1.153111161896959
None Run 03:
Highest Train: 100.00
Highest Valid: 71.40
  Final Train: 100.00
   Final Test: 70.30
run time now: 3.262564182281494
total time:  3.3161118449643254
None All runs:
Highest Train: 100.00 ± 0.00
Highest Valid: 71.40 ± 1.00
  Final Train: 100.00 ± 0.00
   Final Test: 69.83 ± 0.45
[I 2023-06-11 23:55:02,447] Trial 537 finished with value: 71.39999389648438 and parameters: {'Fwd': 7.518027126085252e-05, 'K': 8, 'alpha': 0.8500000000000001, 'dropout': 0.8, 'gnnepoch': 120, 'lambda1': 0.65, 'lambda2': 6.270086167365183, 'loop': 0, 'loss': 'CE', 'lr': 0.0010203016401519743, 'softmaxF': False, 'useGCN': True, 'weight_decay': 8.874035315103483e-05, 'weightedloss': True}. Best is trial 271 with value: 72.06666564941406.
/home/wxy/miniconda3/lib/python3.10/site-packages/optuna/distributions.py:685: UserWarning: The distribution is specified by [0, 1.00001] and step=0.05, but the range is not divisible by `step`. It will be replaced by [0, 1.0].
  warnings.warn(
K:  8
alpha:  0.75
lr:  0.0013953544195344097
weight_decay:  0.00010081772869589289
dropout:  0.8
fix split and run 3 times
Data: Data(x=[3327, 3703], y=[3327], train_mask=[3327], val_mask=[3327], test_mask=[3327], adj_t=[3327, 3327, nnz=9104])
num_train tensor(120)
num_noise 0
noise: tensor(0)
data feature 3703
ALTOPT(
  (lins): Sequential(
    (0): Linear(in_features=3703, out_features=64, bias=True)
    (1): BatchNorm1d(64, eps=1e-05, momentum=0.1, affine=True, track_running_stats=True)
    (2): Dropout(p=0.8, inplace=True)
    (3): ReLU(inplace=True)
    (4): Linear(in_features=64, out_features=6, bias=True)
    (5): LogSoftmax(dim=-1)
  )
  (prop): Propagation(K=8, mode=None, lambda1=None, lambda2=None, L21=True, alpha=0.75)
  (gcn): GCN(
    (convs): ModuleList(
      (0): GCNConv(3703, 64)
      (1): GCNConv(64, 6)
    )
    (bns): ModuleList(
      (0): BatchNorm1d(64, eps=1e-05, momentum=0.1, affine=True, track_running_stats=True)
    )
    (output): LogSoftmax(dim=-1)
  )
)
propagate done
init label
Split: 01, Run: 01
None time:  0.9798485550563782
None Run 01:
Highest Train: 100.00
Highest Valid: 70.60
  Final Train: 100.00
   Final Test: 70.10
Split: 01, Run: 02
None time:  0.9776368751190603
None Run 02:
Highest Train: 100.00
Highest Valid: 68.60
  Final Train: 100.00
   Final Test: 68.20
Split: 01, Run: 03
None time:  0.9678660039789975
None Run 03:
Highest Train: 100.00
Highest Valid: 71.20
  Final Train: 100.00
   Final Test: 70.50
run time now: 2.966525077819824
total time:  3.0162762668915093
None All runs:
Highest Train: 100.00 ± 0.00
Highest Valid: 70.13 ± 1.36
  Final Train: 100.00 ± 0.00
   Final Test: 69.60 ± 1.23
[I 2023-06-11 23:55:05,922] Trial 538 finished with value: 70.13333129882812 and parameters: {'Fwd': 1.6914284634056733e-05, 'K': 8, 'alpha': 0.75, 'dropout': 0.8, 'gnnepoch': 110, 'lambda1': 0.75, 'lambda2': 9.293164052851242, 'loop': 0, 'loss': 'CE', 'lr': 0.0013953544195344097, 'softmaxF': False, 'useGCN': True, 'weight_decay': 0.00010081772869589289, 'weightedloss': True}. Best is trial 271 with value: 72.06666564941406.
/home/wxy/miniconda3/lib/python3.10/site-packages/optuna/distributions.py:685: UserWarning: The distribution is specified by [0, 1.00001] and step=0.05, but the range is not divisible by `step`. It will be replaced by [0, 1.0].
  warnings.warn(
K:  8
alpha:  0.8
lr:  0.0094307528146877
weight_decay:  0.00191052865684567
dropout:  0.7000000000000001
fix split and run 3 times
Data: Data(x=[3327, 3703], y=[3327], train_mask=[3327], val_mask=[3327], test_mask=[3327], adj_t=[3327, 3327, nnz=9104])
num_train tensor(120)
num_noise 0
noise: tensor(0)
data feature 3703
ALTOPT(
  (lins): Sequential(
    (0): Linear(in_features=3703, out_features=64, bias=True)
    (1): BatchNorm1d(64, eps=1e-05, momentum=0.1, affine=True, track_running_stats=True)
    (2): Dropout(p=0.7000000000000001, inplace=True)
    (3): ReLU(inplace=True)
    (4): Linear(in_features=64, out_features=6, bias=True)
    (5): LogSoftmax(dim=-1)
  )
  (prop): Propagation(K=8, mode=None, lambda1=None, lambda2=None, L21=True, alpha=0.8)
  (gcn): GCN(
    (convs): ModuleList(
      (0): GCNConv(3703, 64)
      (1): GCNConv(64, 6)
    )
    (bns): ModuleList(
      (0): BatchNorm1d(64, eps=1e-05, momentum=0.1, affine=True, track_running_stats=True)
    )
    (output): LogSoftmax(dim=-1)
  )
)
propagate done
init label
Split: 01, Run: 01
None time:  0.31279260804876685
None Run 01:
Highest Train: 100.00
Highest Valid: 71.20
  Final Train: 99.17
   Final Test: 68.70
Split: 01, Run: 02
None time:  0.32552622887305915
None Run 02:
Highest Train: 100.00
Highest Valid: 72.20
  Final Train: 98.33
   Final Test: 69.90
Split: 01, Run: 03
None time:  0.3498459728434682
None Run 03:
Highest Train: 100.00
Highest Valid: 71.00
  Final Train: 98.33
   Final Test: 69.50
run time now: 1.0292694568634033
total time:  1.0800905330106616
None All runs:
Highest Train: 100.00 ± 0.00
Highest Valid: 71.47 ± 0.64
  Final Train: 98.61 ± 0.48
   Final Test: 69.37 ± 0.61
