[I 2023-06-12 00:54:46,721] Trial 449 finished with value: 77.60000610351562 and parameters: {'Fwd': 5.336533274368038e-06, 'K': 10, 'alpha': 1.0, 'dropout': 0.8, 'gnnepoch': 50, 'lambda1': 0.6000000000000001, 'lambda2': 5.398542297777808, 'loop': 1, 'loss': 'MSE', 'lr': 0.0069419479261523765, 'softmaxF': True, 'useGCN': False, 'weight_decay': 5.147910972253482e-06, 'weightedloss': False}. Best is trial 364 with value: 83.66666412353516.
/home/wxy/miniconda3/lib/python3.10/site-packages/optuna/distributions.py:685: UserWarning: The distribution is specified by [0, 1.00001] and step=0.05, but the range is not divisible by `step`. It will be replaced by [0, 1.0].
  warnings.warn(
K:  9
alpha:  0.9
lr:  0.002134961358885408
weight_decay:  1.2140740211775465e-05
dropout:  0.9
fix split and run 3 times
Data: Data(x=[19717, 500], y=[19717], train_mask=[19717], val_mask=[19717], test_mask=[19717], adj_t=[19717, 19717, nnz=88648])
num_train tensor(60)
num_noise 0
noise: tensor(0)
data feature 500
ALTOPT(
  (lins): Sequential(
    (0): Linear(in_features=500, out_features=64, bias=True)
    (1): BatchNorm1d(64, eps=1e-05, momentum=0.1, affine=True, track_running_stats=True)
    (2): Dropout(p=0.9, inplace=True)
    (3): ReLU(inplace=True)
    (4): Linear(in_features=64, out_features=3, bias=True)
    (5): Identity()
  )
  (prop): Propagation(K=9, mode=None, lambda1=None, lambda2=None, L21=True, alpha=0.9)
  (gcn): GCN(
    (convs): ModuleList(
      (0): GCNConv(500, 64)
      (1): GCNConv(64, 3)
    )
    (bns): ModuleList(
      (0): BatchNorm1d(64, eps=1e-05, momentum=0.1, affine=True, track_running_stats=True)
    )
    (output): Identity()
  )
)
propagate done
init label
Split: 01, Run: 01
None time:  2.7659382910933346
None Run 01:
Highest Train: 100.00
Highest Valid: 79.20
  Final Train: 100.00
   Final Test: 74.90
Split: 01, Run: 02
None time:  1.4471517382189631
None Run 02:
Highest Train: 100.00
Highest Valid: 82.00
  Final Train: 100.00
   Final Test: 80.00
Split: 01, Run: 03
None time:  0.9972541339229792
None Run 03:
Highest Train: 100.00
Highest Valid: 83.60
  Final Train: 100.00
   Final Test: 80.00
run time now: 5.257014989852905
total time:  5.299038939876482
None All runs:
Highest Train: 100.00 ± 0.00
Highest Valid: 81.60 ± 2.23
  Final Train: 100.00 ± 0.00
   Final Test: 78.30 ± 2.94
[I 2023-06-12 00:54:52,681] Trial 450 finished with value: 81.5999984741211 and parameters: {'Fwd': 0.0009921919890828659, 'K': 9, 'alpha': 0.9, 'dropout': 0.9, 'gnnepoch': 60, 'lambda1': 0.7000000000000001, 'lambda2': 5.55659729811333, 'loop': 1, 'loss': 'MSE', 'lr': 0.002134961358885408, 'softmaxF': True, 'useGCN': False, 'weight_decay': 1.2140740211775465e-05, 'weightedloss': False}. Best is trial 364 with value: 83.66666412353516.
/home/wxy/miniconda3/lib/python3.10/site-packages/optuna/distributions.py:685: UserWarning: The distribution is specified by [0, 1.00001] and step=0.05, but the range is not divisible by `step`. It will be replaced by [0, 1.0].
  warnings.warn(
K:  10
alpha:  0.9500000000000001
lr:  0.0025286091860058607
weight_decay:  1.8603673293297527e-05
dropout:  0.9
fix split and run 3 times
Data: Data(x=[19717, 500], y=[19717], train_mask=[19717], val_mask=[19717], test_mask=[19717], adj_t=[19717, 19717, nnz=88648])
num_train tensor(60)
num_noise 0
noise: tensor(0)
data feature 500
ALTOPT(
  (lins): Sequential(
    (0): Linear(in_features=500, out_features=64, bias=True)
    (1): BatchNorm1d(64, eps=1e-05, momentum=0.1, affine=True, track_running_stats=True)
    (2): Dropout(p=0.9, inplace=True)
    (3): ReLU(inplace=True)
    (4): Linear(in_features=64, out_features=3, bias=True)
    (5): Identity()
  )
  (prop): Propagation(K=10, mode=None, lambda1=None, lambda2=None, L21=True, alpha=0.9500000000000001)
  (gcn): GCN(
    (convs): ModuleList(
      (0): GCNConv(500, 64)
      (1): GCNConv(64, 3)
    )
    (bns): ModuleList(
      (0): BatchNorm1d(64, eps=1e-05, momentum=0.1, affine=True, track_running_stats=True)
    )
    (output): Identity()
  )
)
propagate done
init label
Split: 01, Run: 01
None time:  1.578144485130906
None Run 01:
Highest Train: 100.00
Highest Valid: 81.20
  Final Train: 100.00
   Final Test: 76.60
Split: 01, Run: 02
None time:  2.100950173800811
None Run 02:
Highest Train: 100.00
Highest Valid: 83.80
  Final Train: 100.00
   Final Test: 80.30
Split: 01, Run: 03
None time:  1.5755209277849644
None Run 03:
Highest Train: 100.00
Highest Valid: 81.80
  Final Train: 100.00
   Final Test: 79.10
run time now: 5.295872688293457
total time:  5.3468765169382095
None All runs:
Highest Train: 100.00 ± 0.00
Highest Valid: 82.27 ± 1.36
  Final Train: 100.00 ± 0.00
   Final Test: 78.67 ± 1.89
[I 2023-06-12 00:54:58,580] Trial 451 finished with value: 82.26667022705078 and parameters: {'Fwd': 3.6933380237041857e-06, 'K': 10, 'alpha': 0.9500000000000001, 'dropout': 0.9, 'gnnepoch': 60, 'lambda1': 0.65, 'lambda2': 5.117514286811584, 'loop': 1, 'loss': 'MSE', 'lr': 0.0025286091860058607, 'softmaxF': True, 'useGCN': False, 'weight_decay': 1.8603673293297527e-05, 'weightedloss': False}. Best is trial 364 with value: 83.66666412353516.
/home/wxy/miniconda3/lib/python3.10/site-packages/optuna/distributions.py:685: UserWarning: The distribution is specified by [0, 1.00001] and step=0.05, but the range is not divisible by `step`. It will be replaced by [0, 1.0].
  warnings.warn(
K:  7
alpha:  0.9500000000000001
lr:  0.003133491625975468
weight_decay:  1.947923369652543e-06
dropout:  0.9
fix split and run 3 times
Data: Data(x=[19717, 500], y=[19717], train_mask=[19717], val_mask=[19717], test_mask=[19717], adj_t=[19717, 19717, nnz=88648])
num_train tensor(60)
num_noise 0
noise: tensor(0)
data feature 500
ALTOPT(
  (lins): Sequential(
    (0): Linear(in_features=500, out_features=64, bias=True)
    (1): BatchNorm1d(64, eps=1e-05, momentum=0.1, affine=True, track_running_stats=True)
    (2): Dropout(p=0.9, inplace=True)
    (3): ReLU(inplace=True)
    (4): Linear(in_features=64, out_features=3, bias=True)
    (5): Identity()
  )
  (prop): Propagation(K=7, mode=None, lambda1=None, lambda2=None, L21=True, alpha=0.9500000000000001)
  (gcn): GCN(
    (convs): ModuleList(
      (0): GCNConv(500, 64)
      (1): GCNConv(64, 3)
    )
    (bns): ModuleList(
      (0): BatchNorm1d(64, eps=1e-05, momentum=0.1, affine=True, track_running_stats=True)
    )
    (output): Identity()
  )
)
propagate done
init label
Split: 01, Run: 01
None time:  2.031284000026062
None Run 01:
Highest Train: 100.00
Highest Valid: 81.80
  Final Train: 100.00
   Final Test: 76.60
Split: 01, Run: 02
None time:  1.1156254960224032
None Run 02:
Highest Train: 100.00
Highest Valid: 82.60
  Final Train: 100.00
   Final Test: 79.90
Split: 01, Run: 03
None time:  1.6598558579571545
None Run 03:
Highest Train: 100.00
Highest Valid: 82.60
  Final Train: 100.00
   Final Test: 79.70
run time now: 4.861300230026245
total time:  4.903065789025277
None All runs:
Highest Train: 100.00 ± 0.00
Highest Valid: 82.33 ± 0.46
  Final Train: 100.00 ± 0.00
   Final Test: 78.73 ± 1.85
[I 2023-06-12 00:55:04,117] Trial 452 finished with value: 82.33333587646484 and parameters: {'Fwd': 0.002381798118839587, 'K': 7, 'alpha': 0.9500000000000001, 'dropout': 0.9, 'gnnepoch': 60, 'lambda1': 0.6000000000000001, 'lambda2': 4.6593422293320845, 'loop': 1, 'loss': 'MSE', 'lr': 0.003133491625975468, 'softmaxF': True, 'useGCN': False, 'weight_decay': 1.947923369652543e-06, 'weightedloss': False}. Best is trial 364 with value: 83.66666412353516.
/home/wxy/miniconda3/lib/python3.10/site-packages/optuna/distributions.py:685: UserWarning: The distribution is specified by [0, 1.00001] and step=0.05, but the range is not divisible by `step`. It will be replaced by [0, 1.0].
  warnings.warn(
K:  10
alpha:  1.0
lr:  0.0018849337001564381
weight_decay:  1.4451047917288053e-05
dropout:  0.9
fix split and run 3 times
Data: Data(x=[19717, 500], y=[19717], train_mask=[19717], val_mask=[19717], test_mask=[19717], adj_t=[19717, 19717, nnz=88648])
num_train tensor(60)
num_noise 0
noise: tensor(0)
data feature 500
ALTOPT(
  (lins): Sequential(
    (0): Linear(in_features=500, out_features=64, bias=True)
    (1): BatchNorm1d(64, eps=1e-05, momentum=0.1, affine=True, track_running_stats=True)
    (2): Dropout(p=0.9, inplace=True)
    (3): ReLU(inplace=True)
    (4): Linear(in_features=64, out_features=3, bias=True)
    (5): Identity()
  )
  (prop): Propagation(K=10, mode=None, lambda1=None, lambda2=None, L21=True, alpha=1.0)
  (gcn): GCN(
    (convs): ModuleList(
      (0): GCNConv(500, 64)
      (1): GCNConv(64, 3)
    )
    (bns): ModuleList(
      (0): BatchNorm1d(64, eps=1e-05, momentum=0.1, affine=True, track_running_stats=True)
    )
    (output): Identity()
  )
)
propagate done
init label
Split: 01, Run: 01
None time:  2.240541759179905
None Run 01:
Highest Train: 100.00
Highest Valid: 82.80
  Final Train: 100.00
   Final Test: 78.40
Split: 01, Run: 02
None time:  0.9653860020916909
None Run 02:
Highest Train: 100.00
Highest Valid: 81.60
  Final Train: 100.00
   Final Test: 77.40
Split: 01, Run: 03
None time:  1.8594330758787692
None Run 03:
Highest Train: 100.00
Highest Valid: 82.80
  Final Train: 100.00
   Final Test: 80.00
run time now: 5.114776849746704
total time:  5.160133985802531
None All runs:
Highest Train: 100.00 ± 0.00
Highest Valid: 82.40 ± 0.69
  Final Train: 100.00 ± 0.00
   Final Test: 78.60 ± 1.31
[I 2023-06-12 00:55:09,836] Trial 453 finished with value: 82.4000015258789 and parameters: {'Fwd': 6.8609786873545234e-06, 'K': 10, 'alpha': 1.0, 'dropout': 0.9, 'gnnepoch': 70, 'lambda1': 0.65, 'lambda2': 6.727963633647646, 'loop': 1, 'loss': 'MSE', 'lr': 0.0018849337001564381, 'softmaxF': False, 'useGCN': False, 'weight_decay': 1.4451047917288053e-05, 'weightedloss': False}. Best is trial 364 with value: 83.66666412353516.
/home/wxy/miniconda3/lib/python3.10/site-packages/optuna/distributions.py:685: UserWarning: The distribution is specified by [0, 1.00001] and step=0.05, but the range is not divisible by `step`. It will be replaced by [0, 1.0].
  warnings.warn(
K:  10
alpha:  0.9
lr:  0.003788223521899112
weight_decay:  1.0357658642587316e-05
dropout:  0.9
fix split and run 3 times
Data: Data(x=[19717, 500], y=[19717], train_mask=[19717], val_mask=[19717], test_mask=[19717], adj_t=[19717, 19717, nnz=88648])
num_train tensor(60)
num_noise 0
noise: tensor(0)
data feature 500
ALTOPT(
  (lins): Sequential(
    (0): Linear(in_features=500, out_features=64, bias=True)
    (1): BatchNorm1d(64, eps=1e-05, momentum=0.1, affine=True, track_running_stats=True)
    (2): Dropout(p=0.9, inplace=True)
    (3): ReLU(inplace=True)
    (4): Linear(in_features=64, out_features=3, bias=True)
    (5): Identity()
  )
  (prop): Propagation(K=10, mode=None, lambda1=None, lambda2=None, L21=True, alpha=0.9)
  (gcn): GCN(
    (convs): ModuleList(
      (0): GCNConv(500, 64)
      (1): GCNConv(64, 3)
    )
    (bns): ModuleList(
      (0): BatchNorm1d(64, eps=1e-05, momentum=0.1, affine=True, track_running_stats=True)
    )
    (output): Identity()
  )
)
propagate done
init label
Split: 01, Run: 01
None time:  1.9825730121228844
None Run 01:
Highest Train: 100.00
Highest Valid: 83.00
  Final Train: 100.00
   Final Test: 77.60
Split: 01, Run: 02
None time:  1.237827573902905
None Run 02:
Highest Train: 100.00
Highest Valid: 82.80
  Final Train: 100.00
   Final Test: 80.70
Split: 01, Run: 03
None time:  1.0904293679632246
None Run 03:
Highest Train: 100.00
Highest Valid: 83.20
  Final Train: 100.00
   Final Test: 79.20
run time now: 4.357020378112793
total time:  4.395795746007934
None All runs:
Highest Train: 100.00 ± 0.00
Highest Valid: 83.00 ± 0.20
  Final Train: 100.00 ± 0.00
   Final Test: 79.17 ± 1.55
[I 2023-06-12 00:55:14,726] Trial 454 finished with value: 83.0 and parameters: {'Fwd': 0.0007513271429462645, 'K': 10, 'alpha': 0.9, 'dropout': 0.9, 'gnnepoch': 70, 'lambda1': 0.55, 'lambda2': 5.885991050141212, 'loop': 1, 'loss': 'MSE', 'lr': 0.003788223521899112, 'softmaxF': True, 'useGCN': False, 'weight_decay': 1.0357658642587316e-05, 'weightedloss': False}. Best is trial 364 with value: 83.66666412353516.
/home/wxy/miniconda3/lib/python3.10/site-packages/optuna/distributions.py:685: UserWarning: The distribution is specified by [0, 1.00001] and step=0.05, but the range is not divisible by `step`. It will be replaced by [0, 1.0].
  warnings.warn(
K:  10
alpha:  0.8500000000000001
lr:  0.0032982884350550605
weight_decay:  6.997527464638894e-06
dropout:  0.4
fix split and run 3 times
Data: Data(x=[19717, 500], y=[19717], train_mask=[19717], val_mask=[19717], test_mask=[19717], adj_t=[19717, 19717, nnz=88648])
num_train tensor(60)
num_noise 0
noise: tensor(0)
data feature 500
ALTOPT(
  (lins): Sequential(
    (0): Linear(in_features=500, out_features=64, bias=True)
    (1): BatchNorm1d(64, eps=1e-05, momentum=0.1, affine=True, track_running_stats=True)
    (2): Dropout(p=0.4, inplace=True)
    (3): ReLU(inplace=True)
    (4): Linear(in_features=64, out_features=3, bias=True)
    (5): Identity()
  )
  (prop): Propagation(K=10, mode=None, lambda1=None, lambda2=None, L21=True, alpha=0.8500000000000001)
  (gcn): GCN(
    (convs): ModuleList(
      (0): GCNConv(500, 64)
      (1): GCNConv(64, 3)
    )
    (bns): ModuleList(
      (0): BatchNorm1d(64, eps=1e-05, momentum=0.1, affine=True, track_running_stats=True)
    )
    (output): Identity()
  )
)
propagate done
init label
Split: 01, Run: 01
None time:  2.232170956907794
None Run 01:
Highest Train: 100.00
Highest Valid: 79.20
  Final Train: 100.00
   Final Test: 75.40
Split: 01, Run: 02
None time:  2.856028945883736
None Run 02:
Highest Train: 100.00
Highest Valid: 82.60
  Final Train: 100.00
   Final Test: 79.90
Split: 01, Run: 03
None time:  1.0720995678566396
None Run 03:
Highest Train: 100.00
Highest Valid: 81.60
  Final Train: 100.00
   Final Test: 78.50
run time now: 6.223285436630249
total time:  6.264900743030012
None All runs:
Highest Train: 100.00 ± 0.00
Highest Valid: 81.13 ± 1.75
  Final Train: 100.00 ± 0.00
   Final Test: 77.93 ± 2.30
[I 2023-06-12 00:55:21,604] Trial 455 finished with value: 81.13333129882812 and parameters: {'Fwd': 0.00039961234651598597, 'K': 10, 'alpha': 0.8500000000000001, 'dropout': 0.4, 'gnnepoch': 70, 'lambda1': 0.55, 'lambda2': 5.759780745231616, 'loop': 1, 'loss': 'MSE', 'lr': 0.0032982884350550605, 'softmaxF': True, 'useGCN': False, 'weight_decay': 6.997527464638894e-06, 'weightedloss': False}. Best is trial 364 with value: 83.66666412353516.
/home/wxy/miniconda3/lib/python3.10/site-packages/optuna/distributions.py:685: UserWarning: The distribution is specified by [0, 1.00001] and step=0.05, but the range is not divisible by `step`. It will be replaced by [0, 1.0].
  warnings.warn(
K:  10
alpha:  0.9
lr:  0.0036173597512259115
weight_decay:  3.634124127052859e-05
dropout:  0.8
fix split and run 3 times
Data: Data(x=[19717, 500], y=[19717], train_mask=[19717], val_mask=[19717], test_mask=[19717], adj_t=[19717, 19717, nnz=88648])
num_train tensor(60)
num_noise 0
noise: tensor(0)
data feature 500
ALTOPT(
  (lins): Sequential(
    (0): Linear(in_features=500, out_features=64, bias=True)
    (1): BatchNorm1d(64, eps=1e-05, momentum=0.1, affine=True, track_running_stats=True)
    (2): Dropout(p=0.8, inplace=True)
    (3): ReLU(inplace=True)
    (4): Linear(in_features=64, out_features=3, bias=True)
    (5): Identity()
  )
  (prop): Propagation(K=10, mode=None, lambda1=None, lambda2=None, L21=True, alpha=0.9)
  (gcn): GCN(
    (convs): ModuleList(
      (0): GCNConv(500, 64)
      (1): GCNConv(64, 3)
    )
    (bns): ModuleList(
      (0): BatchNorm1d(64, eps=1e-05, momentum=0.1, affine=True, track_running_stats=True)
    )
    (output): Identity()
  )
)
propagate done
init label
Split: 01, Run: 01
None time:  2.606542333960533
None Run 01:
Highest Train: 100.00
Highest Valid: 81.60
  Final Train: 100.00
   Final Test: 77.80
Split: 01, Run: 02
None time:  1.007592153036967
None Run 02:
Highest Train: 100.00
Highest Valid: 82.40
  Final Train: 100.00
   Final Test: 79.90
Split: 01, Run: 03
None time:  1.6565920610446483
None Run 03:
Highest Train: 100.00
Highest Valid: 81.20
  Final Train: 100.00
   Final Test: 78.90
run time now: 5.319591999053955
total time:  5.3670558808371425
None All runs:
Highest Train: 100.00 ± 0.00
Highest Valid: 81.73 ± 0.61
  Final Train: 100.00 ± 0.00
   Final Test: 78.87 ± 1.05
[I 2023-06-12 00:55:27,470] Trial 456 finished with value: 81.73332977294922 and parameters: {'Fwd': 0.0014933672734537627, 'K': 10, 'alpha': 0.9, 'dropout': 0.8, 'gnnepoch': 70, 'lambda1': 0.55, 'lambda2': 5.432802144571161, 'loop': 1, 'loss': 'MSE', 'lr': 0.0036173597512259115, 'softmaxF': True, 'useGCN': False, 'weight_decay': 3.634124127052859e-05, 'weightedloss': False}. Best is trial 364 with value: 83.66666412353516.
/home/wxy/miniconda3/lib/python3.10/site-packages/optuna/distributions.py:685: UserWarning: The distribution is specified by [0, 1.00001] and step=0.05, but the range is not divisible by `step`. It will be replaced by [0, 1.0].
  warnings.warn(
K:  10
alpha:  0.8500000000000001
lr:  0.003739459858754823
weight_decay:  3.942905285517629e-06
dropout:  0.9
fix split and run 3 times
Data: Data(x=[19717, 500], y=[19717], train_mask=[19717], val_mask=[19717], test_mask=[19717], adj_t=[19717, 19717, nnz=88648])
num_train tensor(60)
num_noise 0
noise: tensor(0)
data feature 500
ALTOPT(
  (lins): Sequential(
    (0): Linear(in_features=500, out_features=64, bias=True)
    (1): BatchNorm1d(64, eps=1e-05, momentum=0.1, affine=True, track_running_stats=True)
    (2): Dropout(p=0.9, inplace=True)
    (3): ReLU(inplace=True)
    (4): Linear(in_features=64, out_features=3, bias=True)
    (5): Identity()
  )
  (prop): Propagation(K=10, mode=None, lambda1=None, lambda2=None, L21=True, alpha=0.8500000000000001)
  (gcn): GCN(
    (convs): ModuleList(
      (0): GCNConv(500, 64)
      (1): GCNConv(64, 3)
    )
    (bns): ModuleList(
      (0): BatchNorm1d(64, eps=1e-05, momentum=0.1, affine=True, track_running_stats=True)
    )
    (output): Identity()
  )
)
propagate done
init label
Split: 01, Run: 01
None time:  1.8594398330897093
None Run 01:
Highest Train: 100.00
Highest Valid: 82.60
  Final Train: 100.00
   Final Test: 77.50
Split: 01, Run: 02
None time:  1.2189749570097774
None Run 02:
Highest Train: 100.00
Highest Valid: 81.80
  Final Train: 100.00
   Final Test: 77.20
Split: 01, Run: 03
None time:  0.9889529701322317
None Run 03:
Highest Train: 100.00
Highest Valid: 82.60
  Final Train: 100.00
   Final Test: 78.50
run time now: 4.115908622741699
total time:  4.15893102507107
None All runs:
Highest Train: 100.00 ± 0.00
Highest Valid: 82.33 ± 0.46
  Final Train: 100.00 ± 0.00
   Final Test: 77.73 ± 0.68
[I 2023-06-12 00:55:32,129] Trial 457 finished with value: 82.33333587646484 and parameters: {'Fwd': 0.0008388197268424937, 'K': 10, 'alpha': 0.8500000000000001, 'dropout': 0.9, 'gnnepoch': 70, 'lambda1': 0.55, 'lambda2': 5.909302771407349, 'loop': 1, 'loss': 'MSE', 'lr': 0.003739459858754823, 'softmaxF': True, 'useGCN': False, 'weight_decay': 3.942905285517629e-06, 'weightedloss': False}. Best is trial 364 with value: 83.66666412353516.
/home/wxy/miniconda3/lib/python3.10/site-packages/optuna/distributions.py:685: UserWarning: The distribution is specified by [0, 1.00001] and step=0.05, but the range is not divisible by `step`. It will be replaced by [0, 1.0].
  warnings.warn(
K:  10
alpha:  0.4
lr:  0.004265265305117819
weight_decay:  0.0029945028120340915
dropout:  0.9
fix split and run 3 times
Data: Data(x=[19717, 500], y=[19717], train_mask=[19717], val_mask=[19717], test_mask=[19717], adj_t=[19717, 19717, nnz=88648])
num_train tensor(60)
num_noise 0
noise: tensor(0)
data feature 500
ALTOPT(
  (lins): Sequential(
    (0): Linear(in_features=500, out_features=64, bias=True)
    (1): BatchNorm1d(64, eps=1e-05, momentum=0.1, affine=True, track_running_stats=True)
    (2): Dropout(p=0.9, inplace=True)
    (3): ReLU(inplace=True)
    (4): Linear(in_features=64, out_features=3, bias=True)
    (5): Identity()
  )
  (prop): Propagation(K=10, mode=None, lambda1=None, lambda2=None, L21=True, alpha=0.4)
  (gcn): GCN(
    (convs): ModuleList(
      (0): GCNConv(500, 64)
      (1): GCNConv(64, 3)
    )
    (bns): ModuleList(
      (0): BatchNorm1d(64, eps=1e-05, momentum=0.1, affine=True, track_running_stats=True)
    )
    (output): Identity()
  )
)
propagate done
init label
Split: 01, Run: 01, Epoch: 100, Loss: 0.3039, Train: 100.00%, Valid: 77.00% Test: 74.70%
Split: 01, Run: 01
None time:  3.937812466174364
None Run 01:
Highest Train: 100.00
Highest Valid: 77.20
  Final Train: 100.00
   Final Test: 74.60
Split: 01, Run: 02
None time:  0.9736861081328243
None Run 02:
Highest Train: 100.00
Highest Valid: 76.20
  Final Train: 100.00
   Final Test: 74.80
Split: 01, Run: 03
None time:  1.0224795150570571
None Run 03:
Highest Train: 100.00
Highest Valid: 75.00
  Final Train: 100.00
   Final Test: 73.30
run time now: 5.983937740325928
total time:  6.031048737931997
None All runs:
Highest Train: 100.00 ± 0.00
Highest Valid: 76.13 ± 1.10
  Final Train: 100.00 ± 0.00
   Final Test: 74.23 ± 0.81
