[I 2023-06-12 00:23:21,106] Trial 106 finished with value: 80.86666870117188 and parameters: {'Fwd': 0.020484089562865532, 'K': 9, 'alpha': 0.4, 'dropout': 0.5, 'gnnepoch': 60, 'lambda1': 0.6000000000000001, 'lambda2': 5.929610856988894, 'loop': 1, 'loss': 'CE', 'lr': 0.008622518575148706, 'softmaxF': True, 'useGCN': True, 'weight_decay': 2.276718415220109e-05, 'weightedloss': True}. Best is trial 60 with value: 81.33333587646484.
/home/wxy/miniconda3/lib/python3.10/site-packages/optuna/distributions.py:685: UserWarning: The distribution is specified by [0, 1.00001] and step=0.05, but the range is not divisible by `step`. It will be replaced by [0, 1.0].
  warnings.warn(
K:  9
alpha:  0.4
lr:  0.008888490738082688
weight_decay:  4.444428678817617e-05
dropout:  0.5
fix split and run 3 times
Data: Data(x=[2708, 1433], y=[2708], train_mask=[2708], val_mask=[2708], test_mask=[2708], adj_t=[2708, 2708, nnz=10556])
num_train tensor(140)
num_noise 0
noise: tensor(0)
data feature 1433
ALTOPT(
  (lins): Sequential(
    (0): Linear(in_features=1433, out_features=64, bias=True)
    (1): BatchNorm1d(64, eps=1e-05, momentum=0.1, affine=True, track_running_stats=True)
    (2): Dropout(p=0.5, inplace=True)
    (3): ReLU(inplace=True)
    (4): Linear(in_features=64, out_features=7, bias=True)
    (5): LogSoftmax(dim=-1)
  )
  (prop): Propagation(K=9, mode=None, lambda1=None, lambda2=None, L21=True, alpha=0.4)
  (gcn): GCN(
    (convs): ModuleList(
      (0): GCNConv(1433, 64)
      (1): GCNConv(64, 7)
    )
    (bns): ModuleList(
      (0): BatchNorm1d(64, eps=1e-05, momentum=0.1, affine=True, track_running_stats=True)
    )
    (output): LogSoftmax(dim=-1)
  )
)
propagate done
init label
Split: 01, Run: 01
None time:  1.5824617689941078
None Run 01:
Highest Train: 100.00
Highest Valid: 81.60
  Final Train: 100.00
   Final Test: 82.50
Split: 01, Run: 02
None time:  1.5468421219848096
None Run 02:
Highest Train: 100.00
Highest Valid: 81.20
  Final Train: 100.00
   Final Test: 81.60
Split: 01, Run: 03
None time:  1.5381514551118016
None Run 03:
Highest Train: 100.00
Highest Valid: 81.20
  Final Train: 100.00
   Final Test: 82.00
run time now: 4.696334362030029
total time:  4.726164686027914
None All runs:
Highest Train: 100.00 ± 0.00
Highest Valid: 81.33 ± 0.23
  Final Train: 100.00 ± 0.00
   Final Test: 82.03 ± 0.45
[I 2023-06-12 00:23:26,249] Trial 107 finished with value: 81.33332824707031 and parameters: {'Fwd': 0.04126880732195809, 'K': 9, 'alpha': 0.4, 'dropout': 0.5, 'gnnepoch': 60, 'lambda1': 0.7000000000000001, 'lambda2': 5.356067768604784, 'loop': 1, 'loss': 'CE', 'lr': 0.008888490738082688, 'softmaxF': True, 'useGCN': True, 'weight_decay': 4.444428678817617e-05, 'weightedloss': True}. Best is trial 60 with value: 81.33333587646484.
/home/wxy/miniconda3/lib/python3.10/site-packages/optuna/distributions.py:685: UserWarning: The distribution is specified by [0, 1.00001] and step=0.05, but the range is not divisible by `step`. It will be replaced by [0, 1.0].
  warnings.warn(
K:  9
alpha:  0.45
lr:  0.008698802670838848
weight_decay:  4.0849931510531994e-05
dropout:  0.5
fix split and run 3 times
Data: Data(x=[2708, 1433], y=[2708], train_mask=[2708], val_mask=[2708], test_mask=[2708], adj_t=[2708, 2708, nnz=10556])
num_train tensor(140)
num_noise 0
noise: tensor(0)
data feature 1433
ALTOPT(
  (lins): Sequential(
    (0): Linear(in_features=1433, out_features=64, bias=True)
    (1): BatchNorm1d(64, eps=1e-05, momentum=0.1, affine=True, track_running_stats=True)
    (2): Dropout(p=0.5, inplace=True)
    (3): ReLU(inplace=True)
    (4): Linear(in_features=64, out_features=7, bias=True)
    (5): LogSoftmax(dim=-1)
  )
  (prop): Propagation(K=9, mode=None, lambda1=None, lambda2=None, L21=True, alpha=0.45)
  (gcn): GCN(
    (convs): ModuleList(
      (0): GCNConv(1433, 64)
      (1): GCNConv(64, 7)
    )
    (bns): ModuleList(
      (0): BatchNorm1d(64, eps=1e-05, momentum=0.1, affine=True, track_running_stats=True)
    )
    (output): LogSoftmax(dim=-1)
  )
)
propagate done
init label
Split: 01, Run: 01
None time:  1.6667610069271177
None Run 01:
Highest Train: 100.00
Highest Valid: 81.60
  Final Train: 100.00
   Final Test: 82.60
Split: 01, Run: 02
None time:  1.6730454959906638
None Run 02:
Highest Train: 100.00
Highest Valid: 81.20
  Final Train: 100.00
   Final Test: 81.60
Split: 01, Run: 03
None time:  1.1746363320853561
None Run 03:
Highest Train: 100.00
Highest Valid: 81.20
  Final Train: 100.00
   Final Test: 82.10
run time now: 4.542253017425537
total time:  4.563306394964457
None All runs:
Highest Train: 100.00 ± 0.00
Highest Valid: 81.33 ± 0.23
  Final Train: 100.00 ± 0.00
   Final Test: 82.10 ± 0.50
[I 2023-06-12 00:23:31,251] Trial 108 finished with value: 81.33332824707031 and parameters: {'Fwd': 0.04441802676817254, 'K': 9, 'alpha': 0.45, 'dropout': 0.5, 'gnnepoch': 60, 'lambda1': 0.75, 'lambda2': 5.34726479250776, 'loop': 1, 'loss': 'CE', 'lr': 0.008698802670838848, 'softmaxF': True, 'useGCN': True, 'weight_decay': 4.0849931510531994e-05, 'weightedloss': True}. Best is trial 60 with value: 81.33333587646484.
/home/wxy/miniconda3/lib/python3.10/site-packages/optuna/distributions.py:685: UserWarning: The distribution is specified by [0, 1.00001] and step=0.05, but the range is not divisible by `step`. It will be replaced by [0, 1.0].
  warnings.warn(
K:  9
alpha:  0.45
lr:  0.009989511933710947
weight_decay:  4.244769111383501e-05
dropout:  0.5
fix split and run 3 times
Data: Data(x=[2708, 1433], y=[2708], train_mask=[2708], val_mask=[2708], test_mask=[2708], adj_t=[2708, 2708, nnz=10556])
num_train tensor(140)
num_noise 0
noise: tensor(0)
data feature 1433
ALTOPT(
  (lins): Sequential(
    (0): Linear(in_features=1433, out_features=64, bias=True)
    (1): BatchNorm1d(64, eps=1e-05, momentum=0.1, affine=True, track_running_stats=True)
    (2): Dropout(p=0.5, inplace=True)
    (3): ReLU(inplace=True)
    (4): Linear(in_features=64, out_features=7, bias=True)
    (5): LogSoftmax(dim=-1)
  )
  (prop): Propagation(K=9, mode=None, lambda1=None, lambda2=None, L21=True, alpha=0.45)
  (gcn): GCN(
    (convs): ModuleList(
      (0): GCNConv(1433, 64)
      (1): GCNConv(64, 7)
    )
    (bns): ModuleList(
      (0): BatchNorm1d(64, eps=1e-05, momentum=0.1, affine=True, track_running_stats=True)
    )
    (output): LogSoftmax(dim=-1)
  )
)
propagate done
init label
Split: 01, Run: 01
None time:  1.6858605709858239
None Run 01:
Highest Train: 100.00
Highest Valid: 81.40
  Final Train: 100.00
   Final Test: 82.80
Split: 01, Run: 02
None time:  1.9856723279226571
None Run 02:
Highest Train: 100.00
Highest Valid: 81.40
  Final Train: 100.00
   Final Test: 81.90
Split: 01, Run: 03
None time:  1.8685009069740772
None Run 03:
Highest Train: 100.00
Highest Valid: 81.40
  Final Train: 100.00
   Final Test: 83.10
run time now: 5.56565523147583
total time:  5.583665585145354
None All runs:
Highest Train: 100.00 ± 0.00
Highest Valid: 81.40 ± 0.00
  Final Train: 100.00 ± 0.00
   Final Test: 82.60 ± 0.62
[I 2023-06-12 00:23:37,324] Trial 109 finished with value: 81.4000015258789 and parameters: {'Fwd': 0.08254027725911933, 'K': 9, 'alpha': 0.45, 'dropout': 0.5, 'gnnepoch': 60, 'lambda1': 0.8, 'lambda2': 5.50233378231305, 'loop': 1, 'loss': 'CE', 'lr': 0.009989511933710947, 'softmaxF': True, 'useGCN': True, 'weight_decay': 4.244769111383501e-05, 'weightedloss': True}. Best is trial 109 with value: 81.4000015258789.
/home/wxy/miniconda3/lib/python3.10/site-packages/optuna/distributions.py:685: UserWarning: The distribution is specified by [0, 1.00001] and step=0.05, but the range is not divisible by `step`. It will be replaced by [0, 1.0].
  warnings.warn(
K:  9
alpha:  0.55
lr:  0.009788956432500532
weight_decay:  4.496459826366308e-05
dropout:  0.6000000000000001
fix split and run 3 times
Data: Data(x=[2708, 1433], y=[2708], train_mask=[2708], val_mask=[2708], test_mask=[2708], adj_t=[2708, 2708, nnz=10556])
num_train tensor(140)
num_noise 0
noise: tensor(0)
data feature 1433
ALTOPT(
  (lins): Sequential(
    (0): Linear(in_features=1433, out_features=64, bias=True)
    (1): BatchNorm1d(64, eps=1e-05, momentum=0.1, affine=True, track_running_stats=True)
    (2): Dropout(p=0.6000000000000001, inplace=True)
    (3): ReLU(inplace=True)
    (4): Linear(in_features=64, out_features=7, bias=True)
    (5): LogSoftmax(dim=-1)
  )
  (prop): Propagation(K=9, mode=None, lambda1=None, lambda2=None, L21=True, alpha=0.55)
  (gcn): GCN(
    (convs): ModuleList(
      (0): GCNConv(1433, 64)
      (1): GCNConv(64, 7)
    )
    (bns): ModuleList(
      (0): BatchNorm1d(64, eps=1e-05, momentum=0.1, affine=True, track_running_stats=True)
    )
    (output): LogSoftmax(dim=-1)
  )
)
propagate done
init label
Split: 01, Run: 01
None time:  0.9350102171301842
None Run 01:
Highest Train: 100.00
Highest Valid: 79.80
  Final Train: 100.00
   Final Test: 81.00
Split: 01, Run: 02
None time:  1.0434825019910932
None Run 02:
Highest Train: 100.00
Highest Valid: 78.60
  Final Train: 100.00
   Final Test: 76.30
Split: 01, Run: 03
None time:  0.99371597613208
None Run 03:
Highest Train: 100.00
Highest Valid: 77.20
  Final Train: 100.00
   Final Test: 78.90
run time now: 2.9951884746551514
total time:  3.0215723619330674
None All runs:
Highest Train: 100.00 ± 0.00
Highest Valid: 78.53 ± 1.30
  Final Train: 100.00 ± 0.00
   Final Test: 78.73 ± 2.35
[I 2023-06-12 00:23:40,932] Trial 110 finished with value: 78.53333282470703 and parameters: {'Fwd': 0.04413717183533517, 'K': 9, 'alpha': 0.55, 'dropout': 0.6000000000000001, 'gnnepoch': 60, 'lambda1': 0.8, 'lambda2': 5.53112525078041, 'loop': 1, 'loss': 'CE', 'lr': 0.009788956432500532, 'softmaxF': True, 'useGCN': False, 'weight_decay': 4.496459826366308e-05, 'weightedloss': True}. Best is trial 109 with value: 81.4000015258789.
/home/wxy/miniconda3/lib/python3.10/site-packages/optuna/distributions.py:685: UserWarning: The distribution is specified by [0, 1.00001] and step=0.05, but the range is not divisible by `step`. It will be replaced by [0, 1.0].
  warnings.warn(
K:  9
alpha:  0.45
lr:  0.008815789896973437
weight_decay:  2.86069117090096e-05
dropout:  0.5
fix split and run 3 times
Data: Data(x=[2708, 1433], y=[2708], train_mask=[2708], val_mask=[2708], test_mask=[2708], adj_t=[2708, 2708, nnz=10556])
num_train tensor(140)
num_noise 0
noise: tensor(0)
data feature 1433
ALTOPT(
  (lins): Sequential(
    (0): Linear(in_features=1433, out_features=64, bias=True)
    (1): BatchNorm1d(64, eps=1e-05, momentum=0.1, affine=True, track_running_stats=True)
    (2): Dropout(p=0.5, inplace=True)
    (3): ReLU(inplace=True)
    (4): Linear(in_features=64, out_features=7, bias=True)
    (5): LogSoftmax(dim=-1)
  )
  (prop): Propagation(K=9, mode=None, lambda1=None, lambda2=None, L21=True, alpha=0.45)
  (gcn): GCN(
    (convs): ModuleList(
      (0): GCNConv(1433, 64)
      (1): GCNConv(64, 7)
    )
    (bns): ModuleList(
      (0): BatchNorm1d(64, eps=1e-05, momentum=0.1, affine=True, track_running_stats=True)
    )
    (output): LogSoftmax(dim=-1)
  )
)
propagate done
init label
Split: 01, Run: 01
None time:  1.5957975347992033
None Run 01:
Highest Train: 100.00
Highest Valid: 81.40
  Final Train: 100.00
   Final Test: 82.50
Split: 01, Run: 02
None time:  1.4769034029450268
None Run 02:
Highest Train: 100.00
Highest Valid: 81.00
  Final Train: 100.00
   Final Test: 81.70
Split: 01, Run: 03
None time:  1.3763626678846776
None Run 03:
Highest Train: 100.00
Highest Valid: 81.20
  Final Train: 100.00
   Final Test: 82.10
run time now: 4.478001117706299
total time:  4.504906575893983
None All runs:
Highest Train: 100.00 ± 0.00
Highest Valid: 81.20 ± 0.20
  Final Train: 100.00 ± 0.00
   Final Test: 82.10 ± 0.40
[I 2023-06-12 00:23:45,920] Trial 111 finished with value: 81.19999694824219 and parameters: {'Fwd': 0.038365396123831955, 'K': 9, 'alpha': 0.45, 'dropout': 0.5, 'gnnepoch': 60, 'lambda1': 0.75, 'lambda2': 5.361692287829507, 'loop': 1, 'loss': 'CE', 'lr': 0.008815789896973437, 'softmaxF': True, 'useGCN': True, 'weight_decay': 2.86069117090096e-05, 'weightedloss': True}. Best is trial 109 with value: 81.4000015258789.
/home/wxy/miniconda3/lib/python3.10/site-packages/optuna/distributions.py:685: UserWarning: The distribution is specified by [0, 1.00001] and step=0.05, but the range is not divisible by `step`. It will be replaced by [0, 1.0].
  warnings.warn(
K:  9
alpha:  0.4
lr:  0.009255702180365703
weight_decay:  4.156211312521541e-05
dropout:  0.5
fix split and run 3 times
Data: Data(x=[2708, 1433], y=[2708], train_mask=[2708], val_mask=[2708], test_mask=[2708], adj_t=[2708, 2708, nnz=10556])
num_train tensor(140)
num_noise 0
noise: tensor(0)
data feature 1433
ALTOPT(
  (lins): Sequential(
    (0): Linear(in_features=1433, out_features=64, bias=True)
    (1): BatchNorm1d(64, eps=1e-05, momentum=0.1, affine=True, track_running_stats=True)
    (2): Dropout(p=0.5, inplace=True)
    (3): ReLU(inplace=True)
    (4): Linear(in_features=64, out_features=7, bias=True)
    (5): LogSoftmax(dim=-1)
  )
  (prop): Propagation(K=9, mode=None, lambda1=None, lambda2=None, L21=True, alpha=0.4)
  (gcn): GCN(
    (convs): ModuleList(
      (0): GCNConv(1433, 64)
      (1): GCNConv(64, 7)
    )
    (bns): ModuleList(
      (0): BatchNorm1d(64, eps=1e-05, momentum=0.1, affine=True, track_running_stats=True)
    )
    (output): LogSoftmax(dim=-1)
  )
)
propagate done
init label
Split: 01, Run: 01
None time:  1.6179520569276065
None Run 01:
Highest Train: 100.00
Highest Valid: 81.80
  Final Train: 100.00
   Final Test: 82.60
Split: 01, Run: 02
None time:  1.7020283320453018
None Run 02:
Highest Train: 100.00
Highest Valid: 81.40
  Final Train: 100.00
   Final Test: 81.90
Split: 01, Run: 03
None time:  1.7802001228556037
None Run 03:
Highest Train: 100.00
Highest Valid: 81.80
  Final Train: 100.00
   Final Test: 82.90
run time now: 5.141613245010376
total time:  5.178649859968573
None All runs:
Highest Train: 100.00 ± 0.00
Highest Valid: 81.67 ± 0.23
  Final Train: 100.00 ± 0.00
   Final Test: 82.47 ± 0.51
[I 2023-06-12 00:23:51,560] Trial 112 finished with value: 81.66667175292969 and parameters: {'Fwd': 0.08730550166861663, 'K': 9, 'alpha': 0.4, 'dropout': 0.5, 'gnnepoch': 60, 'lambda1': 0.8, 'lambda2': 5.406675930084522, 'loop': 1, 'loss': 'CE', 'lr': 0.009255702180365703, 'softmaxF': True, 'useGCN': True, 'weight_decay': 4.156211312521541e-05, 'weightedloss': True}. Best is trial 112 with value: 81.66667175292969.
/home/wxy/miniconda3/lib/python3.10/site-packages/optuna/distributions.py:685: UserWarning: The distribution is specified by [0, 1.00001] and step=0.05, but the range is not divisible by `step`. It will be replaced by [0, 1.0].
  warnings.warn(
K:  9
alpha:  0.4
lr:  0.009416720772219533
weight_decay:  4.046497771975774e-05
dropout:  0.5
fix split and run 3 times
Data: Data(x=[2708, 1433], y=[2708], train_mask=[2708], val_mask=[2708], test_mask=[2708], adj_t=[2708, 2708, nnz=10556])
num_train tensor(140)
num_noise 0
noise: tensor(0)
data feature 1433
ALTOPT(
  (lins): Sequential(
    (0): Linear(in_features=1433, out_features=64, bias=True)
    (1): BatchNorm1d(64, eps=1e-05, momentum=0.1, affine=True, track_running_stats=True)
    (2): Dropout(p=0.5, inplace=True)
    (3): ReLU(inplace=True)
    (4): Linear(in_features=64, out_features=7, bias=True)
    (5): LogSoftmax(dim=-1)
  )
  (prop): Propagation(K=9, mode=None, lambda1=None, lambda2=None, L21=True, alpha=0.4)
  (gcn): GCN(
    (convs): ModuleList(
      (0): GCNConv(1433, 64)
      (1): GCNConv(64, 7)
    )
    (bns): ModuleList(
      (0): BatchNorm1d(64, eps=1e-05, momentum=0.1, affine=True, track_running_stats=True)
    )
    (output): LogSoftmax(dim=-1)
  )
)
propagate done
init label
Split: 01, Run: 01
None time:  2.0932681658305228
None Run 01:
Highest Train: 100.00
Highest Valid: 81.20
  Final Train: 100.00
   Final Test: 82.00
Split: 01, Run: 02
None time:  2.2772450749762356
None Run 02:
Highest Train: 100.00
Highest Valid: 80.60
  Final Train: 100.00
   Final Test: 82.50
Split: 01, Run: 03
None time:  2.0250928380992264
None Run 03:
Highest Train: 100.00
Highest Valid: 81.40
  Final Train: 100.00
   Final Test: 82.80
run time now: 6.4197938442230225
total time:  6.441920187091455
None All runs:
Highest Train: 100.00 ± 0.00
Highest Valid: 81.07 ± 0.42
  Final Train: 100.00 ± 0.00
   Final Test: 82.43 ± 0.40
[I 2023-06-12 00:23:58,496] Trial 113 finished with value: 81.06665802001953 and parameters: {'Fwd': 0.0838167255227278, 'K': 9, 'alpha': 0.4, 'dropout': 0.5, 'gnnepoch': 70, 'lambda1': 0.8500000000000001, 'lambda2': 5.3544318630070755, 'loop': 1, 'loss': 'CE', 'lr': 0.009416720772219533, 'softmaxF': True, 'useGCN': True, 'weight_decay': 4.046497771975774e-05, 'weightedloss': True}. Best is trial 112 with value: 81.66667175292969.
/home/wxy/miniconda3/lib/python3.10/site-packages/optuna/distributions.py:685: UserWarning: The distribution is specified by [0, 1.00001] and step=0.05, but the range is not divisible by `step`. It will be replaced by [0, 1.0].
  warnings.warn(
K:  9
alpha:  0.4
lr:  0.009102366045795677
weight_decay:  4.647063288083822e-05
dropout:  0.4
fix split and run 3 times
Data: Data(x=[2708, 1433], y=[2708], train_mask=[2708], val_mask=[2708], test_mask=[2708], adj_t=[2708, 2708, nnz=10556])
num_train tensor(140)
num_noise 0
noise: tensor(0)
data feature 1433
ALTOPT(
  (lins): Sequential(
    (0): Linear(in_features=1433, out_features=64, bias=True)
    (1): BatchNorm1d(64, eps=1e-05, momentum=0.1, affine=True, track_running_stats=True)
    (2): Dropout(p=0.4, inplace=True)
    (3): ReLU(inplace=True)
    (4): Linear(in_features=64, out_features=7, bias=True)
    (5): LogSoftmax(dim=-1)
  )
  (prop): Propagation(K=9, mode=None, lambda1=None, lambda2=None, L21=True, alpha=0.4)
  (gcn): GCN(
    (convs): ModuleList(
      (0): GCNConv(1433, 64)
      (1): GCNConv(64, 7)
    )
    (bns): ModuleList(
      (0): BatchNorm1d(64, eps=1e-05, momentum=0.1, affine=True, track_running_stats=True)
    )
    (output): LogSoftmax(dim=-1)
  )
)
propagate done
init label
Split: 01, Run: 01
None time:  1.5292771488893777
None Run 01:
Highest Train: 100.00
Highest Valid: 81.00
  Final Train: 100.00
   Final Test: 82.60
Split: 01, Run: 02
None time:  1.9549717199988663
None Run 02:
Highest Train: 100.00
Highest Valid: 81.00
  Final Train: 100.00
   Final Test: 82.40
Split: 01, Run: 03
None time:  1.8942165409680456
None Run 03:
Highest Train: 100.00
Highest Valid: 80.40
  Final Train: 100.00
   Final Test: 81.40
run time now: 5.408610820770264
total time:  5.43309857416898
None All runs:
Highest Train: 100.00 ± 0.00
Highest Valid: 80.80 ± 0.35
  Final Train: 100.00 ± 0.00
   Final Test: 82.13 ± 0.64
[I 2023-06-12 00:24:04,502] Trial 114 finished with value: 80.79999542236328 and parameters: {'Fwd': 0.07835401789804317, 'K': 9, 'alpha': 0.4, 'dropout': 0.4, 'gnnepoch': 70, 'lambda1': 0.8500000000000001, 'lambda2': 5.34724237607448, 'loop': 1, 'loss': 'CE', 'lr': 0.009102366045795677, 'softmaxF': True, 'useGCN': True, 'weight_decay': 4.647063288083822e-05, 'weightedloss': True}. Best is trial 112 with value: 81.66667175292969.
/home/wxy/miniconda3/lib/python3.10/site-packages/optuna/distributions.py:685: UserWarning: The distribution is specified by [0, 1.00001] and step=0.05, but the range is not divisible by `step`. It will be replaced by [0, 1.0].
  warnings.warn(
K:  10
alpha:  0.45
lr:  0.008024973644460373
weight_decay:  2.968536121095511e-05
dropout:  0.5
fix split and run 3 times
Data: Data(x=[2708, 1433], y=[2708], train_mask=[2708], val_mask=[2708], test_mask=[2708], adj_t=[2708, 2708, nnz=10556])
num_train tensor(140)
num_noise 0
noise: tensor(0)
data feature 1433
ALTOPT(
  (lins): Sequential(
    (0): Linear(in_features=1433, out_features=64, bias=True)
    (1): BatchNorm1d(64, eps=1e-05, momentum=0.1, affine=True, track_running_stats=True)
    (2): Dropout(p=0.5, inplace=True)
    (3): ReLU(inplace=True)
    (4): Linear(in_features=64, out_features=7, bias=True)
    (5): LogSoftmax(dim=-1)
  )
  (prop): Propagation(K=10, mode=None, lambda1=None, lambda2=None, L21=True, alpha=0.45)
  (gcn): GCN(
    (convs): ModuleList(
      (0): GCNConv(1433, 64)
      (1): GCNConv(64, 7)
    )
    (bns): ModuleList(
      (0): BatchNorm1d(64, eps=1e-05, momentum=0.1, affine=True, track_running_stats=True)
    )
    (output): LogSoftmax(dim=-1)
  )
)
propagate done
init label
Split: 01, Run: 01
None time:  1.6721883090212941
None Run 01:
Highest Train: 100.00
Highest Valid: 81.80
  Final Train: 100.00
   Final Test: 82.60
Split: 01, Run: 02
None time:  1.5451484280638397
None Run 02:
Highest Train: 100.00
Highest Valid: 81.60
  Final Train: 100.00
   Final Test: 82.40
Split: 01, Run: 03
None time:  1.6931355681736022
None Run 03:
Highest Train: 100.00
Highest Valid: 80.80
  Final Train: 100.00
   Final Test: 81.60
run time now: 4.93943977355957
total time:  4.966582268010825
None All runs:
Highest Train: 100.00 ± 0.00
Highest Valid: 81.40 ± 0.53
  Final Train: 100.00 ± 0.00
   Final Test: 82.20 ± 0.53
