[I 2023-06-12 00:38:31,518] Trial 277 finished with value: 81.20000457763672 and parameters: {'Fwd': 0.06512328386029752, 'K': 9, 'alpha': 0.6000000000000001, 'dropout': 0.4, 'gnnepoch': 60, 'lambda1': 0.8, 'lambda2': 5.825638991118461, 'loop': 1, 'loss': 'CE', 'lr': 0.005715722563502596, 'softmaxF': True, 'useGCN': True, 'weight_decay': 5.298775030949031e-05, 'weightedloss': False}. Best is trial 112 with value: 81.66667175292969.
/home/wxy/miniconda3/lib/python3.10/site-packages/optuna/distributions.py:685: UserWarning: The distribution is specified by [0, 1.00001] and step=0.05, but the range is not divisible by `step`. It will be replaced by [0, 1.0].
  warnings.warn(
K:  10
alpha:  0.65
lr:  0.00475854958436011
weight_decay:  0.0008475754061468741
dropout:  0.30000000000000004
fix split and run 3 times
Data: Data(x=[2708, 1433], y=[2708], train_mask=[2708], val_mask=[2708], test_mask=[2708], adj_t=[2708, 2708, nnz=10556])
num_train tensor(140)
num_noise 0
noise: tensor(0)
data feature 1433
ALTOPT(
  (lins): Sequential(
    (0): Linear(in_features=1433, out_features=64, bias=True)
    (1): BatchNorm1d(64, eps=1e-05, momentum=0.1, affine=True, track_running_stats=True)
    (2): Dropout(p=0.30000000000000004, inplace=True)
    (3): ReLU(inplace=True)
    (4): Linear(in_features=64, out_features=7, bias=True)
    (5): LogSoftmax(dim=-1)
  )
  (prop): Propagation(K=10, mode=None, lambda1=None, lambda2=None, L21=True, alpha=0.65)
  (gcn): GCN(
    (convs): ModuleList(
      (0): GCNConv(1433, 64)
      (1): GCNConv(64, 7)
    )
    (bns): ModuleList(
      (0): BatchNorm1d(64, eps=1e-05, momentum=0.1, affine=True, track_running_stats=True)
    )
    (output): LogSoftmax(dim=-1)
  )
)
propagate done
init label
Split: 01, Run: 01
None time:  1.6054138680920005
None Run 01:
Highest Train: 100.00
Highest Valid: 81.20
  Final Train: 100.00
   Final Test: 82.10
Split: 01, Run: 02
None time:  1.546619747998193
None Run 02:
Highest Train: 100.00
Highest Valid: 80.80
  Final Train: 100.00
   Final Test: 81.20
Split: 01, Run: 03
None time:  1.6685479199513793
None Run 03:
Highest Train: 100.00
Highest Valid: 80.80
  Final Train: 100.00
   Final Test: 81.70
run time now: 4.846357107162476
total time:  4.860856292070821
None All runs:
Highest Train: 100.00 ± 0.00
Highest Valid: 80.93 ± 0.23
  Final Train: 100.00 ± 0.00
   Final Test: 81.67 ± 0.45
[I 2023-06-12 00:38:36,948] Trial 278 finished with value: 80.93333435058594 and parameters: {'Fwd': 0.0003918060344633201, 'K': 10, 'alpha': 0.65, 'dropout': 0.30000000000000004, 'gnnepoch': 60, 'lambda1': 1.0, 'lambda2': 8.68468730867735, 'loop': 1, 'loss': 'CE', 'lr': 0.00475854958436011, 'softmaxF': True, 'useGCN': True, 'weight_decay': 0.0008475754061468741, 'weightedloss': False}. Best is trial 112 with value: 81.66667175292969.
/home/wxy/miniconda3/lib/python3.10/site-packages/optuna/distributions.py:685: UserWarning: The distribution is specified by [0, 1.00001] and step=0.05, but the range is not divisible by `step`. It will be replaced by [0, 1.0].
  warnings.warn(
K:  10
alpha:  0.65
lr:  0.006661998851962435
weight_decay:  0.00012896042721298755
dropout:  0.4
fix split and run 3 times
Data: Data(x=[2708, 1433], y=[2708], train_mask=[2708], val_mask=[2708], test_mask=[2708], adj_t=[2708, 2708, nnz=10556])
num_train tensor(140)
num_noise 0
noise: tensor(0)
data feature 1433
ALTOPT(
  (lins): Sequential(
    (0): Linear(in_features=1433, out_features=64, bias=True)
    (1): BatchNorm1d(64, eps=1e-05, momentum=0.1, affine=True, track_running_stats=True)
    (2): Dropout(p=0.4, inplace=True)
    (3): ReLU(inplace=True)
    (4): Linear(in_features=64, out_features=7, bias=True)
    (5): LogSoftmax(dim=-1)
  )
  (prop): Propagation(K=10, mode=None, lambda1=None, lambda2=None, L21=True, alpha=0.65)
  (gcn): GCN(
    (convs): ModuleList(
      (0): GCNConv(1433, 64)
      (1): GCNConv(64, 7)
    )
    (bns): ModuleList(
      (0): BatchNorm1d(64, eps=1e-05, momentum=0.1, affine=True, track_running_stats=True)
    )
    (output): LogSoftmax(dim=-1)
  )
)
propagate done
init label
Split: 01, Run: 01
None time:  1.7594681810587645
None Run 01:
Highest Train: 100.00
Highest Valid: 80.80
  Final Train: 100.00
   Final Test: 82.90
Split: 01, Run: 02
None time:  1.7069059780333191
None Run 02:
Highest Train: 100.00
Highest Valid: 81.00
  Final Train: 100.00
   Final Test: 82.00
Split: 01, Run: 03
None time:  1.6295114171225578
None Run 03:
Highest Train: 100.00
Highest Valid: 80.40
  Final Train: 100.00
   Final Test: 81.00
run time now: 5.174331903457642
total time:  5.196156152058393
None All runs:
Highest Train: 100.00 ± 0.00
Highest Valid: 80.73 ± 0.31
  Final Train: 100.00 ± 0.00
   Final Test: 81.97 ± 0.95
[I 2023-06-12 00:38:42,747] Trial 279 finished with value: 80.73333740234375 and parameters: {'Fwd': 0.0022122401809749693, 'K': 10, 'alpha': 0.65, 'dropout': 0.4, 'gnnepoch': 70, 'lambda1': 0.8500000000000001, 'lambda2': 5.347511356777298, 'loop': 1, 'loss': 'CE', 'lr': 0.006661998851962435, 'softmaxF': True, 'useGCN': True, 'weight_decay': 0.00012896042721298755, 'weightedloss': True}. Best is trial 112 with value: 81.66667175292969.
/home/wxy/miniconda3/lib/python3.10/site-packages/optuna/distributions.py:685: UserWarning: The distribution is specified by [0, 1.00001] and step=0.05, but the range is not divisible by `step`. It will be replaced by [0, 1.0].
  warnings.warn(
K:  10
alpha:  0.5
lr:  0.00012132736661698877
weight_decay:  2.377679778674054e-05
dropout:  0.5
fix split and run 3 times
Data: Data(x=[2708, 1433], y=[2708], train_mask=[2708], val_mask=[2708], test_mask=[2708], adj_t=[2708, 2708, nnz=10556])
num_train tensor(140)
num_noise 0
noise: tensor(0)
data feature 1433
ALTOPT(
  (lins): Sequential(
    (0): Linear(in_features=1433, out_features=64, bias=True)
    (1): BatchNorm1d(64, eps=1e-05, momentum=0.1, affine=True, track_running_stats=True)
    (2): Dropout(p=0.5, inplace=True)
    (3): ReLU(inplace=True)
    (4): Linear(in_features=64, out_features=7, bias=True)
    (5): LogSoftmax(dim=-1)
  )
  (prop): Propagation(K=10, mode=None, lambda1=None, lambda2=None, L21=True, alpha=0.5)
  (gcn): GCN(
    (convs): ModuleList(
      (0): GCNConv(1433, 64)
      (1): GCNConv(64, 7)
    )
    (bns): ModuleList(
      (0): BatchNorm1d(64, eps=1e-05, momentum=0.1, affine=True, track_running_stats=True)
    )
    (output): LogSoftmax(dim=-1)
  )
)
propagate done
init label
Split: 01, Run: 01
None time:  2.164417042862624
None Run 01:
Highest Train: 100.00
Highest Valid: 75.20
  Final Train: 100.00
   Final Test: 76.70
Split: 01, Run: 02
None time:  1.9204859919846058
None Run 02:
Highest Train: 100.00
Highest Valid: 77.00
  Final Train: 100.00
   Final Test: 78.90
Split: 01, Run: 03
None time:  1.2721643410623074
None Run 03:
Highest Train: 100.00
Highest Valid: 68.80
  Final Train: 100.00
   Final Test: 69.90
run time now: 5.397514820098877
total time:  5.411140477051958
None All runs:
Highest Train: 100.00 ± 0.00
Highest Valid: 73.67 ± 4.31
  Final Train: 100.00 ± 0.00
   Final Test: 75.17 ± 4.69
[I 2023-06-12 00:38:48,729] Trial 280 finished with value: 73.66666412353516 and parameters: {'Fwd': 0.09830231490959039, 'K': 10, 'alpha': 0.5, 'dropout': 0.5, 'gnnepoch': 50, 'lambda1': 0.8500000000000001, 'lambda2': 6.086964580499787, 'loop': 1, 'loss': 'CE', 'lr': 0.00012132736661698877, 'softmaxF': True, 'useGCN': True, 'weight_decay': 2.377679778674054e-05, 'weightedloss': False}. Best is trial 112 with value: 81.66667175292969.
/home/wxy/miniconda3/lib/python3.10/site-packages/optuna/distributions.py:685: UserWarning: The distribution is specified by [0, 1.00001] and step=0.05, but the range is not divisible by `step`. It will be replaced by [0, 1.0].
  warnings.warn(
K:  10
alpha:  0.7000000000000001
lr:  0.009996865400628016
weight_decay:  9.505055751693173e-05
dropout:  0.4
fix split and run 3 times
Data: Data(x=[2708, 1433], y=[2708], train_mask=[2708], val_mask=[2708], test_mask=[2708], adj_t=[2708, 2708, nnz=10556])
num_train tensor(140)
num_noise 0
noise: tensor(0)
data feature 1433
ALTOPT(
  (lins): Sequential(
    (0): Linear(in_features=1433, out_features=64, bias=True)
    (1): BatchNorm1d(64, eps=1e-05, momentum=0.1, affine=True, track_running_stats=True)
    (2): Dropout(p=0.4, inplace=True)
    (3): ReLU(inplace=True)
    (4): Linear(in_features=64, out_features=7, bias=True)
    (5): LogSoftmax(dim=-1)
  )
  (prop): Propagation(K=10, mode=None, lambda1=None, lambda2=None, L21=True, alpha=0.7000000000000001)
  (gcn): GCN(
    (convs): ModuleList(
      (0): GCNConv(1433, 64)
      (1): GCNConv(64, 7)
    )
    (bns): ModuleList(
      (0): BatchNorm1d(64, eps=1e-05, momentum=0.1, affine=True, track_running_stats=True)
    )
    (output): LogSoftmax(dim=-1)
  )
)
propagate done
init label
Split: 01, Run: 01
None time:  1.3554759330581874
None Run 01:
Highest Train: 100.00
Highest Valid: 80.40
  Final Train: 100.00
   Final Test: 82.80
Split: 01, Run: 02
None time:  1.6360269871074706
None Run 02:
Highest Train: 100.00
Highest Valid: 81.20
  Final Train: 100.00
   Final Test: 81.90
Split: 01, Run: 03
None time:  1.6773670371621847
None Run 03:
Highest Train: 100.00
Highest Valid: 80.80
  Final Train: 100.00
   Final Test: 81.00
run time now: 4.691492080688477
total time:  4.70523593807593
None All runs:
Highest Train: 100.00 ± 0.00
Highest Valid: 80.80 ± 0.40
  Final Train: 100.00 ± 0.00
   Final Test: 81.90 ± 0.90
[I 2023-06-12 00:38:54,027] Trial 281 finished with value: 80.80000305175781 and parameters: {'Fwd': 0.04521511460430457, 'K': 10, 'alpha': 0.7000000000000001, 'dropout': 0.4, 'gnnepoch': 60, 'lambda1': 0.8, 'lambda2': 5.613891617371568, 'loop': 1, 'loss': 'CE', 'lr': 0.009996865400628016, 'softmaxF': False, 'useGCN': True, 'weight_decay': 9.505055751693173e-05, 'weightedloss': False}. Best is trial 112 with value: 81.66667175292969.
/home/wxy/miniconda3/lib/python3.10/site-packages/optuna/distributions.py:685: UserWarning: The distribution is specified by [0, 1.00001] and step=0.05, but the range is not divisible by `step`. It will be replaced by [0, 1.0].
  warnings.warn(
K:  10
alpha:  0.75
lr:  0.008604549058837558
weight_decay:  7.050031601712747e-05
dropout:  0.4
fix split and run 3 times
Data: Data(x=[2708, 1433], y=[2708], train_mask=[2708], val_mask=[2708], test_mask=[2708], adj_t=[2708, 2708, nnz=10556])
num_train tensor(140)
num_noise 0
noise: tensor(0)
data feature 1433
ALTOPT(
  (lins): Sequential(
    (0): Linear(in_features=1433, out_features=64, bias=True)
    (1): BatchNorm1d(64, eps=1e-05, momentum=0.1, affine=True, track_running_stats=True)
    (2): Dropout(p=0.4, inplace=True)
    (3): ReLU(inplace=True)
    (4): Linear(in_features=64, out_features=7, bias=True)
    (5): LogSoftmax(dim=-1)
  )
  (prop): Propagation(K=10, mode=None, lambda1=None, lambda2=None, L21=True, alpha=0.75)
  (gcn): GCN(
    (convs): ModuleList(
      (0): GCNConv(1433, 64)
      (1): GCNConv(64, 7)
    )
    (bns): ModuleList(
      (0): BatchNorm1d(64, eps=1e-05, momentum=0.1, affine=True, track_running_stats=True)
    )
    (output): LogSoftmax(dim=-1)
  )
)
propagate done
init label
Split: 01, Run: 01
None time:  0.6042914248537272
None Run 01:
Highest Train: 100.00
Highest Valid: 68.80
  Final Train: 100.00
   Final Test: 70.00
Split: 01, Run: 02
None time:  0.4514085138216615
None Run 02:
Highest Train: 100.00
Highest Valid: 68.80
  Final Train: 100.00
   Final Test: 70.00
Split: 01, Run: 03
None time:  0.5599029250442982
None Run 03:
Highest Train: 100.00
Highest Valid: 68.80
  Final Train: 100.00
   Final Test: 70.00
run time now: 1.641470193862915
total time:  1.6560534029267728
None All runs:
Highest Train: 100.00 ± 0.00
Highest Valid: 68.80 ± 0.00
  Final Train: 100.00 ± 0.00
   Final Test: 70.00 ± 0.00
[I 2023-06-12 00:38:56,135] Trial 282 finished with value: 68.80000305175781 and parameters: {'Fwd': 0.0031822294051693225, 'K': 10, 'alpha': 0.75, 'dropout': 0.4, 'gnnepoch': 0, 'lambda1': 0.75, 'lambda2': 4.975247249675635, 'loop': 1, 'loss': 'CE', 'lr': 0.008604549058837558, 'softmaxF': True, 'useGCN': True, 'weight_decay': 7.050031601712747e-05, 'weightedloss': True}. Best is trial 112 with value: 81.66667175292969.
/home/wxy/miniconda3/lib/python3.10/site-packages/optuna/distributions.py:685: UserWarning: The distribution is specified by [0, 1.00001] and step=0.05, but the range is not divisible by `step`. It will be replaced by [0, 1.0].
  warnings.warn(
K:  10
alpha:  0.55
lr:  0.004253692449491806
weight_decay:  0.00020191560232104365
dropout:  0.9
fix split and run 3 times
Data: Data(x=[2708, 1433], y=[2708], train_mask=[2708], val_mask=[2708], test_mask=[2708], adj_t=[2708, 2708, nnz=10556])
num_train tensor(140)
num_noise 0
noise: tensor(0)
data feature 1433
ALTOPT(
  (lins): Sequential(
    (0): Linear(in_features=1433, out_features=64, bias=True)
    (1): BatchNorm1d(64, eps=1e-05, momentum=0.1, affine=True, track_running_stats=True)
    (2): Dropout(p=0.9, inplace=True)
    (3): ReLU(inplace=True)
    (4): Linear(in_features=64, out_features=7, bias=True)
    (5): LogSoftmax(dim=-1)
  )
  (prop): Propagation(K=10, mode=None, lambda1=None, lambda2=None, L21=True, alpha=0.55)
  (gcn): GCN(
    (convs): ModuleList(
      (0): GCNConv(1433, 64)
      (1): GCNConv(64, 7)
    )
    (bns): ModuleList(
      (0): BatchNorm1d(64, eps=1e-05, momentum=0.1, affine=True, track_running_stats=True)
    )
    (output): LogSoftmax(dim=-1)
  )
)
propagate done
init label
Split: 01, Run: 01
None time:  1.6911168089136481
None Run 01:
Highest Train: 100.00
Highest Valid: 81.40
  Final Train: 100.00
   Final Test: 81.70
Split: 01, Run: 02
None time:  1.5688051769975573
None Run 02:
Highest Train: 100.00
Highest Valid: 80.20
  Final Train: 100.00
   Final Test: 81.50
Split: 01, Run: 03
None time:  1.841613463126123
None Run 03:
Highest Train: 100.00
Highest Valid: 79.60
  Final Train: 100.00
   Final Test: 80.00
run time now: 5.131129741668701
total time:  5.14931237208657
None All runs:
Highest Train: 100.00 ± 0.00
Highest Valid: 80.40 ± 0.92
  Final Train: 100.00 ± 0.00
   Final Test: 81.07 ± 0.93
[I 2023-06-12 00:39:01,762] Trial 283 finished with value: 80.4000015258789 and parameters: {'Fwd': 0.0819454880575232, 'K': 10, 'alpha': 0.55, 'dropout': 0.9, 'gnnepoch': 70, 'lambda1': 0.9, 'lambda2': 5.43178608199222, 'loop': 1, 'loss': 'CE', 'lr': 0.004253692449491806, 'softmaxF': True, 'useGCN': True, 'weight_decay': 0.00020191560232104365, 'weightedloss': False}. Best is trial 112 with value: 81.66667175292969.
/home/wxy/miniconda3/lib/python3.10/site-packages/optuna/distributions.py:685: UserWarning: The distribution is specified by [0, 1.00001] and step=0.05, but the range is not divisible by `step`. It will be replaced by [0, 1.0].
  warnings.warn(
K:  9
alpha:  0.6000000000000001
lr:  0.007338522166370978
weight_decay:  0.00015199471001435183
dropout:  0.4
fix split and run 3 times
Data: Data(x=[2708, 1433], y=[2708], train_mask=[2708], val_mask=[2708], test_mask=[2708], adj_t=[2708, 2708, nnz=10556])
num_train tensor(140)
num_noise 0
noise: tensor(0)
data feature 1433
ALTOPT(
  (lins): Sequential(
    (0): Linear(in_features=1433, out_features=64, bias=True)
    (1): BatchNorm1d(64, eps=1e-05, momentum=0.1, affine=True, track_running_stats=True)
    (2): Dropout(p=0.4, inplace=True)
    (3): ReLU(inplace=True)
    (4): Linear(in_features=64, out_features=7, bias=True)
    (5): LogSoftmax(dim=-1)
  )
  (prop): Propagation(K=9, mode=None, lambda1=None, lambda2=None, L21=True, alpha=0.6000000000000001)
  (gcn): GCN(
    (convs): ModuleList(
      (0): GCNConv(1433, 64)
      (1): GCNConv(64, 7)
    )
    (bns): ModuleList(
      (0): BatchNorm1d(64, eps=1e-05, momentum=0.1, affine=True, track_running_stats=True)
    )
    (output): LogSoftmax(dim=-1)
  )
)
propagate done
init label
Split: 01, Run: 01
None time:  1.5696951241698116
None Run 01:
Highest Train: 100.00
Highest Valid: 81.80
  Final Train: 100.00
   Final Test: 82.30
Split: 01, Run: 02
None time:  1.5961012369953096
None Run 02:
Highest Train: 100.00
Highest Valid: 81.80
  Final Train: 100.00
   Final Test: 81.60
Split: 01, Run: 03
None time:  1.539866500068456
None Run 03:
Highest Train: 100.00
Highest Valid: 80.80
  Final Train: 100.00
   Final Test: 80.40
run time now: 4.730704069137573
total time:  4.751318793045357
None All runs:
Highest Train: 100.00 ± 0.00
Highest Valid: 81.47 ± 0.58
  Final Train: 100.00 ± 0.00
   Final Test: 81.43 ± 0.96
[I 2023-06-12 00:39:07,118] Trial 284 finished with value: 81.46666717529297 and parameters: {'Fwd': 0.05986418449128687, 'K': 9, 'alpha': 0.6000000000000001, 'dropout': 0.4, 'gnnepoch': 60, 'lambda1': 0.8500000000000001, 'lambda2': 8.276843172378051, 'loop': 1, 'loss': 'CE', 'lr': 0.007338522166370978, 'softmaxF': True, 'useGCN': True, 'weight_decay': 0.00015199471001435183, 'weightedloss': False}. Best is trial 112 with value: 81.66667175292969.
/home/wxy/miniconda3/lib/python3.10/site-packages/optuna/distributions.py:685: UserWarning: The distribution is specified by [0, 1.00001] and step=0.05, but the range is not divisible by `step`. It will be replaced by [0, 1.0].
  warnings.warn(
K:  2
alpha:  0.45
lr:  0.007974219665765472
weight_decay:  4.644919272882212e-05
dropout:  0.5
fix split and run 3 times
Data: Data(x=[2708, 1433], y=[2708], train_mask=[2708], val_mask=[2708], test_mask=[2708], adj_t=[2708, 2708, nnz=10556])
num_train tensor(140)
num_noise 0
noise: tensor(0)
data feature 1433
ALTOPT(
  (lins): Sequential(
    (0): Linear(in_features=1433, out_features=64, bias=True)
    (1): BatchNorm1d(64, eps=1e-05, momentum=0.1, affine=True, track_running_stats=True)
    (2): Dropout(p=0.5, inplace=True)
    (3): ReLU(inplace=True)
    (4): Linear(in_features=64, out_features=7, bias=True)
    (5): LogSoftmax(dim=-1)
  )
  (prop): Propagation(K=2, mode=None, lambda1=None, lambda2=None, L21=True, alpha=0.45)
  (gcn): GCN(
    (convs): ModuleList(
      (0): GCNConv(1433, 64)
      (1): GCNConv(64, 7)
    )
    (bns): ModuleList(
      (0): BatchNorm1d(64, eps=1e-05, momentum=0.1, affine=True, track_running_stats=True)
    )
    (output): LogSoftmax(dim=-1)
  )
)
propagate done
init label
Split: 01, Run: 01
None time:  1.4700586718972772
None Run 01:
Highest Train: 100.00
Highest Valid: 81.40
  Final Train: 100.00
   Final Test: 82.00
Split: 01, Run: 02
None time:  1.5362409290391952
None Run 02:
Highest Train: 100.00
Highest Valid: 80.60
  Final Train: 100.00
   Final Test: 80.70
Split: 01, Run: 03
None time:  1.511458605993539
None Run 03:
Highest Train: 100.00
Highest Valid: 80.60
  Final Train: 100.00
   Final Test: 81.40
run time now: 4.539473056793213
total time:  4.559834328945726
None All runs:
Highest Train: 100.00 ± 0.00
Highest Valid: 80.87 ± 0.46
  Final Train: 100.00 ± 0.00
   Final Test: 81.37 ± 0.65
[I 2023-06-12 00:39:12,260] Trial 285 finished with value: 80.86666870117188 and parameters: {'Fwd': 0.0017348894475513416, 'K': 2, 'alpha': 0.45, 'dropout': 0.5, 'gnnepoch': 60, 'lambda1': 0.9, 'lambda2': 4.752213303375771, 'loop': 1, 'loss': 'CE', 'lr': 0.007974219665765472, 'softmaxF': True, 'useGCN': True, 'weight_decay': 4.644919272882212e-05, 'weightedloss': False}. Best is trial 112 with value: 81.66667175292969.
/home/wxy/miniconda3/lib/python3.10/site-packages/optuna/distributions.py:685: UserWarning: The distribution is specified by [0, 1.00001] and step=0.05, but the range is not divisible by `step`. It will be replaced by [0, 1.0].
  warnings.warn(
K:  10
alpha:  0.55
lr:  0.00642947803500507
weight_decay:  0.0036374008058741134
dropout:  0.4
fix split and run 3 times
Data: Data(x=[2708, 1433], y=[2708], train_mask=[2708], val_mask=[2708], test_mask=[2708], adj_t=[2708, 2708, nnz=10556])
num_train tensor(140)
num_noise 0
noise: tensor(0)
data feature 1433
ALTOPT(
  (lins): Sequential(
    (0): Linear(in_features=1433, out_features=64, bias=True)
    (1): BatchNorm1d(64, eps=1e-05, momentum=0.1, affine=True, track_running_stats=True)
    (2): Dropout(p=0.4, inplace=True)
    (3): ReLU(inplace=True)
    (4): Linear(in_features=64, out_features=7, bias=True)
    (5): LogSoftmax(dim=-1)
  )
  (prop): Propagation(K=10, mode=None, lambda1=None, lambda2=None, L21=True, alpha=0.55)
  (gcn): GCN(
    (convs): ModuleList(
      (0): GCNConv(1433, 64)
      (1): GCNConv(64, 7)
    )
    (bns): ModuleList(
      (0): BatchNorm1d(64, eps=1e-05, momentum=0.1, affine=True, track_running_stats=True)
    )
    (output): LogSoftmax(dim=-1)
  )
)
propagate done
init label
Split: 01, Run: 01
None time:  2.281712522963062
None Run 01:
Highest Train: 100.00
Highest Valid: 81.20
  Final Train: 100.00
   Final Test: 82.80
Split: 01, Run: 02
None time:  3.4679353560786694
None Run 02:
Highest Train: 100.00
Highest Valid: 81.40
  Final Train: 100.00
   Final Test: 82.20
Split: 01, Run: 03
None time:  3.6398771631065756
None Run 03:
Highest Train: 100.00
Highest Valid: 80.80
  Final Train: 100.00
   Final Test: 82.30
run time now: 9.418225526809692
total time:  9.43662590207532
None All runs:
Highest Train: 100.00 ± 0.00
Highest Valid: 81.13 ± 0.31
  Final Train: 100.00 ± 0.00
   Final Test: 82.43 ± 0.32
