[I 2023-06-12 00:12:20,417] A new study created in RDB with name: PubMed_ALTOPT
/home/wxy/miniconda3/lib/python3.10/site-packages/optuna/distributions.py:685: UserWarning: The distribution is specified by [0, 1.00001] and step=0.05, but the range is not divisible by `step`. It will be replaced by [0, 1.0].
  warnings.warn(
K:  2
alpha:  0.05
lr:  0.008776067019418658
weight_decay:  0.0815348423280955
dropout:  0.6000000000000001
fix split and run 3 times
Data: Data(x=[19717, 500], y=[19717], train_mask=[19717], val_mask=[19717], test_mask=[19717], adj_t=[19717, 19717, nnz=88648])
num_train tensor(60)
num_noise 0
noise: tensor(0)
data feature 500
ALTOPT(
  (lins): Sequential(
    (0): Linear(in_features=500, out_features=64, bias=True)
    (1): BatchNorm1d(64, eps=1e-05, momentum=0.1, affine=True, track_running_stats=True)
    (2): Dropout(p=0.6000000000000001, inplace=True)
    (3): ReLU(inplace=True)
    (4): Linear(in_features=64, out_features=3, bias=True)
    (5): LogSoftmax(dim=-1)
  )
  (prop): Propagation(K=2, mode=None, lambda1=None, lambda2=None, L21=True, alpha=0.05)
  (gcn): GCN(
    (convs): ModuleList(
      (0): GCNConv(500, 64)
      (1): GCNConv(64, 3)
    )
    (bns): ModuleList(
      (0): BatchNorm1d(64, eps=1e-05, momentum=0.1, affine=True, track_running_stats=True)
    )
    (output): LogSoftmax(dim=-1)
  )
)
propagate done
init label
Split: 01, Run: 01
None time:  2.3235012621153146
None Run 01:
Highest Train: 100.00
Highest Valid: 78.60
  Final Train: 100.00
   Final Test: 77.10
Split: 01, Run: 02
None time:  1.2520379440393299
None Run 02:
Highest Train: 100.00
Highest Valid: 78.60
  Final Train: 100.00
   Final Test: 77.00
Split: 01, Run: 03
None time:  1.3720978579949588
None Run 03:
Highest Train: 100.00
Highest Valid: 78.80
  Final Train: 100.00
   Final Test: 76.40
run time now: 5.513173818588257
total time:  7.313033324899152
None All runs:
Highest Train: 100.00 ± 0.00
Highest Valid: 78.67 ± 0.12
  Final Train: 100.00 ± 0.00
   Final Test: 76.83 ± 0.38
[I 2023-06-12 00:12:28,419] Trial 0 finished with value: 78.66666412353516 and parameters: {'Fwd': 0.00032601452271666093, 'K': 2, 'alpha': 0.05, 'dropout': 0.6000000000000001, 'gnnepoch': 50, 'lambda1': 0.05, 'lambda2': 1.4195170997931295, 'loop': 1, 'loss': 'CE', 'lr': 0.008776067019418658, 'softmaxF': False, 'useGCN': True, 'weight_decay': 0.0815348423280955, 'weightedloss': False}. Best is trial 0 with value: 78.66666412353516.
/home/wxy/miniconda3/lib/python3.10/site-packages/optuna/distributions.py:685: UserWarning: The distribution is specified by [0, 1.00001] and step=0.05, but the range is not divisible by `step`. It will be replaced by [0, 1.0].
  warnings.warn(
K:  2
alpha:  0.5
lr:  0.0032002525643192365
weight_decay:  7.194279032921646e-06
dropout:  0.2
fix split and run 3 times
Data: Data(x=[19717, 500], y=[19717], train_mask=[19717], val_mask=[19717], test_mask=[19717], adj_t=[19717, 19717, nnz=88648])
num_train tensor(60)
num_noise 0
noise: tensor(0)
data feature 500
ALTOPT(
  (lins): Sequential(
    (0): Linear(in_features=500, out_features=64, bias=True)
    (1): BatchNorm1d(64, eps=1e-05, momentum=0.1, affine=True, track_running_stats=True)
    (2): Dropout(p=0.2, inplace=True)
    (3): ReLU(inplace=True)
    (4): Linear(in_features=64, out_features=3, bias=True)
    (5): Identity()
  )
  (prop): Propagation(K=2, mode=None, lambda1=None, lambda2=None, L21=True, alpha=0.5)
  (gcn): GCN(
    (convs): ModuleList(
      (0): GCNConv(500, 64)
      (1): GCNConv(64, 3)
    )
    (bns): ModuleList(
      (0): BatchNorm1d(64, eps=1e-05, momentum=0.1, affine=True, track_running_stats=True)
    )
    (output): Identity()
  )
)
propagate done
init label
Split: 01, Run: 01, Epoch: 100, Loss: 0.0941, Train: 100.00%, Valid: 78.80% Test: 77.30%
Split: 01, Run: 01
None time:  2.3243146140594035
None Run 01:
Highest Train: 100.00
Highest Valid: 78.80
  Final Train: 100.00
   Final Test: 77.30
Split: 01, Run: 02
None time:  1.0991205577738583
None Run 02:
Highest Train: 100.00
Highest Valid: 79.60
  Final Train: 100.00
   Final Test: 78.90
Split: 01, Run: 03
None time:  1.289209078066051
None Run 03:
Highest Train: 100.00
Highest Valid: 79.00
  Final Train: 100.00
   Final Test: 76.70
run time now: 4.749793529510498
total time:  4.800064906012267
None All runs:
Highest Train: 100.00 ± 0.00
Highest Valid: 79.13 ± 0.42
  Final Train: 100.00 ± 0.00
   Final Test: 77.63 ± 1.14
[I 2023-06-12 00:12:33,573] Trial 1 finished with value: 79.13333129882812 and parameters: {'Fwd': 0.00038342924319538534, 'K': 2, 'alpha': 0.5, 'dropout': 0.2, 'gnnepoch': 80, 'lambda1': 0.45, 'lambda2': 9.646400174867237, 'loop': 1, 'loss': 'MSE', 'lr': 0.0032002525643192365, 'softmaxF': True, 'useGCN': False, 'weight_decay': 7.194279032921646e-06, 'weightedloss': False}. Best is trial 1 with value: 79.13333129882812.
/home/wxy/miniconda3/lib/python3.10/site-packages/optuna/distributions.py:685: UserWarning: The distribution is specified by [0, 1.00001] and step=0.05, but the range is not divisible by `step`. It will be replaced by [0, 1.0].
  warnings.warn(
K:  10
alpha:  0.8
lr:  0.00010211093571672342
weight_decay:  0.0009639944303940641
dropout:  0.7000000000000001
fix split and run 3 times
Data: Data(x=[19717, 500], y=[19717], train_mask=[19717], val_mask=[19717], test_mask=[19717], adj_t=[19717, 19717, nnz=88648])
num_train tensor(60)
num_noise 0
noise: tensor(0)
data feature 500
ALTOPT(
  (lins): Sequential(
    (0): Linear(in_features=500, out_features=64, bias=True)
    (1): BatchNorm1d(64, eps=1e-05, momentum=0.1, affine=True, track_running_stats=True)
    (2): Dropout(p=0.7000000000000001, inplace=True)
    (3): ReLU(inplace=True)
    (4): Linear(in_features=64, out_features=3, bias=True)
    (5): LogSoftmax(dim=-1)
  )
  (prop): Propagation(K=10, mode=None, lambda1=None, lambda2=None, L21=True, alpha=0.8)
  (gcn): GCN(
    (convs): ModuleList(
      (0): GCNConv(500, 64)
      (1): GCNConv(64, 3)
    )
    (bns): ModuleList(
      (0): BatchNorm1d(64, eps=1e-05, momentum=0.1, affine=True, track_running_stats=True)
    )
    (output): LogSoftmax(dim=-1)
  )
)
propagate done
init label
Split: 01, Run: 01
None time:  0.4006823340896517
None Run 01:
Highest Train: 100.00
Highest Valid: 71.40
  Final Train: 100.00
   Final Test: 71.00
Split: 01, Run: 02
None time:  0.4091573371551931
None Run 02:
Highest Train: 100.00
Highest Valid: 71.40
  Final Train: 100.00
   Final Test: 71.00
Split: 01, Run: 03
None time:  0.408811824163422
None Run 03:
Highest Train: 100.00
Highest Valid: 71.40
  Final Train: 100.00
   Final Test: 71.00
run time now: 1.2892110347747803
total time:  1.337702709948644
None All runs:
Highest Train: 100.00 ± 0.00
Highest Valid: 71.40 ± 0.00
  Final Train: 100.00 ± 0.00
   Final Test: 71.00 ± 0.00
[I 2023-06-12 00:12:35,276] Trial 2 finished with value: 71.4000015258789 and parameters: {'Fwd': 0.004443582980355981, 'K': 10, 'alpha': 0.8, 'dropout': 0.7000000000000001, 'gnnepoch': 10, 'lambda1': 0.35000000000000003, 'lambda2': 5.882638740251495, 'loop': 0, 'loss': 'CE', 'lr': 0.00010211093571672342, 'softmaxF': True, 'useGCN': False, 'weight_decay': 0.0009639944303940641, 'weightedloss': True}. Best is trial 1 with value: 79.13333129882812.
/home/wxy/miniconda3/lib/python3.10/site-packages/optuna/distributions.py:685: UserWarning: The distribution is specified by [0, 1.00001] and step=0.05, but the range is not divisible by `step`. It will be replaced by [0, 1.0].
  warnings.warn(
K:  6
alpha:  0.9
lr:  0.00026777133427402283
weight_decay:  0.0899785843373769
dropout:  0.2
fix split and run 3 times
Data: Data(x=[19717, 500], y=[19717], train_mask=[19717], val_mask=[19717], test_mask=[19717], adj_t=[19717, 19717, nnz=88648])
num_train tensor(60)
num_noise 0
noise: tensor(0)
data feature 500
ALTOPT(
  (lins): Sequential(
    (0): Linear(in_features=500, out_features=64, bias=True)
    (1): BatchNorm1d(64, eps=1e-05, momentum=0.1, affine=True, track_running_stats=True)
    (2): Dropout(p=0.2, inplace=True)
    (3): ReLU(inplace=True)
    (4): Linear(in_features=64, out_features=3, bias=True)
    (5): Identity()
  )
  (prop): Propagation(K=6, mode=None, lambda1=None, lambda2=None, L21=True, alpha=0.9)
  (gcn): GCN(
    (convs): ModuleList(
      (0): GCNConv(500, 64)
      (1): GCNConv(64, 3)
    )
    (bns): ModuleList(
      (0): BatchNorm1d(64, eps=1e-05, momentum=0.1, affine=True, track_running_stats=True)
    )
    (output): Identity()
  )
)
propagate done
init label
Split: 01, Run: 01
None time:  1.9822517309803516
None Run 01:
Highest Train: 100.00
Highest Valid: 79.00
  Final Train: 100.00
   Final Test: 75.70
Split: 01, Run: 02
None time:  2.0001014771405607
None Run 02:
Highest Train: 100.00
Highest Valid: 79.80
  Final Train: 100.00
   Final Test: 76.10
Split: 01, Run: 03
None time:  1.7535132199991494
None Run 03:
Highest Train: 100.00
Highest Valid: 78.60
  Final Train: 100.00
   Final Test: 77.20
run time now: 5.774348258972168
total time:  5.827511855168268
None All runs:
Highest Train: 100.00 ± 0.00
Highest Valid: 79.13 ± 0.61
  Final Train: 100.00 ± 0.00
   Final Test: 76.33 ± 0.78
[I 2023-06-12 00:12:41,538] Trial 3 finished with value: 79.13333129882812 and parameters: {'Fwd': 2.867146334102046e-05, 'K': 6, 'alpha': 0.9, 'dropout': 0.2, 'gnnepoch': 120, 'lambda1': 0.9, 'lambda2': 9.138333024414607, 'loop': 1, 'loss': 'MSE', 'lr': 0.00026777133427402283, 'softmaxF': True, 'useGCN': False, 'weight_decay': 0.0899785843373769, 'weightedloss': False}. Best is trial 1 with value: 79.13333129882812.
/home/wxy/miniconda3/lib/python3.10/site-packages/optuna/distributions.py:685: UserWarning: The distribution is specified by [0, 1.00001] and step=0.05, but the range is not divisible by `step`. It will be replaced by [0, 1.0].
  warnings.warn(
K:  10
alpha:  0.1
lr:  0.00041990439709973685
weight_decay:  2.441019881846215e-06
dropout:  0.30000000000000004
fix split and run 3 times
Data: Data(x=[19717, 500], y=[19717], train_mask=[19717], val_mask=[19717], test_mask=[19717], adj_t=[19717, 19717, nnz=88648])
num_train tensor(60)
num_noise 0
noise: tensor(0)
data feature 500
ALTOPT(
  (lins): Sequential(
    (0): Linear(in_features=500, out_features=64, bias=True)
    (1): BatchNorm1d(64, eps=1e-05, momentum=0.1, affine=True, track_running_stats=True)
    (2): Dropout(p=0.30000000000000004, inplace=True)
    (3): ReLU(inplace=True)
    (4): Linear(in_features=64, out_features=3, bias=True)
    (5): Identity()
  )
  (prop): Propagation(K=10, mode=None, lambda1=None, lambda2=None, L21=True, alpha=0.1)
  (gcn): GCN(
    (convs): ModuleList(
      (0): GCNConv(500, 64)
      (1): GCNConv(64, 3)
    )
    (bns): ModuleList(
      (0): BatchNorm1d(64, eps=1e-05, momentum=0.1, affine=True, track_running_stats=True)
    )
    (output): Identity()
  )
)
propagate done
init label
Split: 01, Run: 01
None time:  2.974120008992031
None Run 01:
Highest Train: 100.00
Highest Valid: 72.60
  Final Train: 100.00
   Final Test: 70.70
Split: 01, Run: 02
None time:  5.125827447976917
None Run 02:
Highest Train: 100.00
Highest Valid: 74.00
  Final Train: 100.00
   Final Test: 68.60
Split: 01, Run: 03
None time:  2.144845893839374
None Run 03:
Highest Train: 100.00
Highest Valid: 73.20
  Final Train: 100.00
   Final Test: 71.70
run time now: 10.321087121963501
total time:  10.36506530502811
None All runs:
Highest Train: 100.00 ± 0.00
Highest Valid: 73.27 ± 0.70
  Final Train: 100.00 ± 0.00
   Final Test: 70.33 ± 1.58
[I 2023-06-12 00:12:52,371] Trial 4 finished with value: 73.26667022705078 and parameters: {'Fwd': 0.00036397859561331804, 'K': 10, 'alpha': 0.1, 'dropout': 0.30000000000000004, 'gnnepoch': 80, 'lambda1': 0.6000000000000001, 'lambda2': 4.299042776192476, 'loop': 2, 'loss': 'MSE', 'lr': 0.00041990439709973685, 'softmaxF': True, 'useGCN': True, 'weight_decay': 2.441019881846215e-06, 'weightedloss': False}. Best is trial 1 with value: 79.13333129882812.
/home/wxy/miniconda3/lib/python3.10/site-packages/optuna/distributions.py:685: UserWarning: The distribution is specified by [0, 1.00001] and step=0.05, but the range is not divisible by `step`. It will be replaced by [0, 1.0].
  warnings.warn(
K:  3
alpha:  0.9
lr:  0.0033745555808960383
weight_decay:  9.90272898753863e-05
dropout:  0.1
fix split and run 3 times
Data: Data(x=[19717, 500], y=[19717], train_mask=[19717], val_mask=[19717], test_mask=[19717], adj_t=[19717, 19717, nnz=88648])
num_train tensor(60)
num_noise 0
noise: tensor(0)
data feature 500
ALTOPT(
  (lins): Sequential(
    (0): Linear(in_features=500, out_features=64, bias=True)
    (1): BatchNorm1d(64, eps=1e-05, momentum=0.1, affine=True, track_running_stats=True)
    (2): Dropout(p=0.1, inplace=True)
    (3): ReLU(inplace=True)
    (4): Linear(in_features=64, out_features=3, bias=True)
    (5): Identity()
  )
  (prop): Propagation(K=3, mode=None, lambda1=None, lambda2=None, L21=True, alpha=0.9)
  (gcn): GCN(
    (convs): ModuleList(
      (0): GCNConv(500, 64)
      (1): GCNConv(64, 3)
    )
    (bns): ModuleList(
      (0): BatchNorm1d(64, eps=1e-05, momentum=0.1, affine=True, track_running_stats=True)
    )
    (output): Identity()
  )
)
propagate done
init label
Split: 01, Run: 01
None time:  0.3275081389583647
None Run 01:
Highest Train: 100.00
Highest Valid: 44.80
  Final Train: 100.00
   Final Test: 42.10
Split: 01, Run: 02
None time:  1.402116223005578
None Run 02:
Highest Train: 100.00
Highest Valid: 77.40
  Final Train: 100.00
   Final Test: 74.50
Split: 01, Run: 03
None time:  0.5002353210002184
None Run 03:
Highest Train: 100.00
Highest Valid: 76.40
  Final Train: 100.00
   Final Test: 71.50
run time now: 2.2673656940460205
total time:  2.312214884907007
None All runs:
Highest Train: 100.00 ± 0.00
Highest Valid: 66.20 ± 18.54
  Final Train: 100.00 ± 0.00
   Final Test: 62.70 ± 17.90
[I 2023-06-12 00:12:55,199] Trial 5 finished with value: 66.20000457763672 and parameters: {'Fwd': 0.0030897793188564074, 'K': 3, 'alpha': 0.9, 'dropout': 0.1, 'gnnepoch': 10, 'lambda1': 0.35000000000000003, 'lambda2': 8.591105226330862, 'loop': 1, 'loss': 'MSE', 'lr': 0.0033745555808960383, 'softmaxF': True, 'useGCN': False, 'weight_decay': 9.90272898753863e-05, 'weightedloss': True}. Best is trial 1 with value: 79.13333129882812.
/home/wxy/miniconda3/lib/python3.10/site-packages/optuna/distributions.py:685: UserWarning: The distribution is specified by [0, 1.00001] and step=0.05, but the range is not divisible by `step`. It will be replaced by [0, 1.0].
  warnings.warn(
K:  2
alpha:  0.9
lr:  0.00015768811568043158
weight_decay:  3.587009802307004e-06
dropout:  0.4
fix split and run 3 times
Data: Data(x=[19717, 500], y=[19717], train_mask=[19717], val_mask=[19717], test_mask=[19717], adj_t=[19717, 19717, nnz=88648])
num_train tensor(60)
num_noise 0
noise: tensor(0)
data feature 500
ALTOPT(
  (lins): Sequential(
    (0): Linear(in_features=500, out_features=64, bias=True)
    (1): BatchNorm1d(64, eps=1e-05, momentum=0.1, affine=True, track_running_stats=True)
    (2): Dropout(p=0.4, inplace=True)
    (3): ReLU(inplace=True)
    (4): Linear(in_features=64, out_features=3, bias=True)
    (5): Identity()
  )
  (prop): Propagation(K=2, mode=None, lambda1=None, lambda2=None, L21=True, alpha=0.9)
  (gcn): GCN(
    (convs): ModuleList(
      (0): GCNConv(500, 64)
      (1): GCNConv(64, 3)
    )
    (bns): ModuleList(
      (0): BatchNorm1d(64, eps=1e-05, momentum=0.1, affine=True, track_running_stats=True)
    )
    (output): Identity()
  )
)
propagate done
init label
Split: 01, Run: 01
None time:  0.6719891638495028
None Run 01:
Highest Train: 100.00
Highest Valid: 48.60
  Final Train: 100.00
   Final Test: 44.80
Split: 01, Run: 02
None time:  0.7076935400255024
None Run 02:
Highest Train: 100.00
Highest Valid: 75.20
  Final Train: 100.00
   Final Test: 72.60
Split: 01, Run: 03
None time:  0.6873822840861976
None Run 03:
Highest Train: 100.00
Highest Valid: 74.80
  Final Train: 100.00
   Final Test: 73.00
run time now: 2.104888439178467
total time:  2.1466641258448362
None All runs:
Highest Train: 100.00 ± 0.00
Highest Valid: 66.20 ± 15.24
  Final Train: 100.00 ± 0.00
   Final Test: 63.47 ± 16.17
[I 2023-06-12 00:12:57,666] Trial 6 finished with value: 66.20000457763672 and parameters: {'Fwd': 0.00017675649146618334, 'K': 2, 'alpha': 0.9, 'dropout': 0.4, 'gnnepoch': 60, 'lambda1': 0.4, 'lambda2': 0.6929001415815583, 'loop': 0, 'loss': 'MSE', 'lr': 0.00015768811568043158, 'softmaxF': False, 'useGCN': False, 'weight_decay': 3.587009802307004e-06, 'weightedloss': True}. Best is trial 1 with value: 79.13333129882812.
/home/wxy/miniconda3/lib/python3.10/site-packages/optuna/distributions.py:685: UserWarning: The distribution is specified by [0, 1.00001] and step=0.05, but the range is not divisible by `step`. It will be replaced by [0, 1.0].
  warnings.warn(
K:  3
alpha:  0.75
lr:  0.0003352244187028976
weight_decay:  0.0011060384827098462
dropout:  0.7000000000000001
fix split and run 3 times
Data: Data(x=[19717, 500], y=[19717], train_mask=[19717], val_mask=[19717], test_mask=[19717], adj_t=[19717, 19717, nnz=88648])
num_train tensor(60)
num_noise 0
noise: tensor(0)
data feature 500
ALTOPT(
  (lins): Sequential(
    (0): Linear(in_features=500, out_features=64, bias=True)
    (1): BatchNorm1d(64, eps=1e-05, momentum=0.1, affine=True, track_running_stats=True)
    (2): Dropout(p=0.7000000000000001, inplace=True)
    (3): ReLU(inplace=True)
    (4): Linear(in_features=64, out_features=3, bias=True)
    (5): LogSoftmax(dim=-1)
  )
  (prop): Propagation(K=3, mode=None, lambda1=None, lambda2=None, L21=True, alpha=0.75)
  (gcn): GCN(
    (convs): ModuleList(
      (0): GCNConv(500, 64)
      (1): GCNConv(64, 3)
    )
    (bns): ModuleList(
      (0): BatchNorm1d(64, eps=1e-05, momentum=0.1, affine=True, track_running_stats=True)
    )
    (output): LogSoftmax(dim=-1)
  )
)
propagate done
init label
Split: 01, Run: 01
None time:  1.136004198109731
None Run 01:
Highest Train: 100.00
Highest Valid: 75.00
  Final Train: 100.00
   Final Test: 70.50
Split: 01, Run: 02
None time:  1.0848030850756913
None Run 02:
Highest Train: 100.00
Highest Valid: 79.20
  Final Train: 98.33
   Final Test: 77.10
Split: 01, Run: 03
None time:  0.7627831790596247
None Run 03:
Highest Train: 100.00
Highest Valid: 81.00
  Final Train: 98.33
   Final Test: 79.40
run time now: 3.0246665477752686
total time:  3.066948028979823
None All runs:
Highest Train: 100.00 ± 0.00
Highest Valid: 78.40 ± 3.08
  Final Train: 98.89 ± 0.96
   Final Test: 75.67 ± 4.62
[I 2023-06-12 00:13:01,095] Trial 7 finished with value: 78.4000015258789 and parameters: {'Fwd': 0.0013142780338881476, 'K': 3, 'alpha': 0.75, 'dropout': 0.7000000000000001, 'gnnepoch': 60, 'lambda1': 1.0, 'lambda2': 6.091700533448485, 'loop': 2, 'loss': 'CE', 'lr': 0.0003352244187028976, 'softmaxF': True, 'useGCN': False, 'weight_decay': 0.0011060384827098462, 'weightedloss': True}. Best is trial 1 with value: 79.13333129882812.
/home/wxy/miniconda3/lib/python3.10/site-packages/optuna/distributions.py:685: UserWarning: The distribution is specified by [0, 1.00001] and step=0.05, but the range is not divisible by `step`. It will be replaced by [0, 1.0].
  warnings.warn(
K:  1
alpha:  0.4
lr:  0.0012189527958586628
weight_decay:  0.004946859078443736
dropout:  0.0
fix split and run 3 times
Data: Data(x=[19717, 500], y=[19717], train_mask=[19717], val_mask=[19717], test_mask=[19717], adj_t=[19717, 19717, nnz=88648])
num_train tensor(60)
num_noise 0
noise: tensor(0)
data feature 500
ALTOPT(
  (lins): Sequential(
    (0): Linear(in_features=500, out_features=64, bias=True)
    (1): BatchNorm1d(64, eps=1e-05, momentum=0.1, affine=True, track_running_stats=True)
    (2): Dropout(p=0.0, inplace=True)
    (3): ReLU(inplace=True)
    (4): Linear(in_features=64, out_features=3, bias=True)
    (5): LogSoftmax(dim=-1)
  )
  (prop): Propagation(K=1, mode=None, lambda1=None, lambda2=None, L21=True, alpha=0.4)
  (gcn): GCN(
    (convs): ModuleList(
      (0): GCNConv(500, 64)
      (1): GCNConv(64, 3)
    )
    (bns): ModuleList(
      (0): BatchNorm1d(64, eps=1e-05, momentum=0.1, affine=True, track_running_stats=True)
    )
    (output): LogSoftmax(dim=-1)
  )
)
propagate done
init label
Split: 01, Run: 01
None time:  1.4697630011942238
None Run 01:
Highest Train: 100.00
Highest Valid: 74.80
  Final Train: 100.00
   Final Test: 73.90
Split: 01, Run: 02
None time:  1.4352696421556175
None Run 02:
Highest Train: 100.00
Highest Valid: 74.40
  Final Train: 100.00
   Final Test: 71.60
Split: 01, Run: 03
None time:  1.2583354371599853
None Run 03:
Highest Train: 100.00
Highest Valid: 74.40
  Final Train: 100.00
   Final Test: 73.80
run time now: 4.2248876094818115
total time:  4.282976810121909
None All runs:
Highest Train: 100.00 ± 0.00
Highest Valid: 74.53 ± 0.23
  Final Train: 100.00 ± 0.00
   Final Test: 73.10 ± 1.30
