[I 2023-06-11 23:56:46,549] Trial 566 finished with value: 70.13333892822266 and parameters: {'Fwd': 1.7101251447242554e-06, 'K': 8, 'alpha': 0.8500000000000001, 'dropout': 0.8, 'gnnepoch': 110, 'lambda1': 0.7000000000000001, 'lambda2': 9.561998586858115, 'loop': 0, 'loss': 'CE', 'lr': 0.0011639007050312565, 'softmaxF': True, 'useGCN': True, 'weight_decay': 0.0008716663234912223, 'weightedloss': True}. Best is trial 271 with value: 72.06666564941406.
/home/wxy/miniconda3/lib/python3.10/site-packages/optuna/distributions.py:685: UserWarning: The distribution is specified by [0, 1.00001] and step=0.05, but the range is not divisible by `step`. It will be replaced by [0, 1.0].
  warnings.warn(
K:  8
alpha:  0.8
lr:  0.0001324371157590343
weight_decay:  4.043762976481175e-05
dropout:  0.8
fix split and run 3 times
Data: Data(x=[3327, 3703], y=[3327], train_mask=[3327], val_mask=[3327], test_mask=[3327], adj_t=[3327, 3327, nnz=9104])
num_train tensor(120)
num_noise 0
noise: tensor(0)
data feature 3703
ALTOPT(
  (lins): Sequential(
    (0): Linear(in_features=3703, out_features=64, bias=True)
    (1): BatchNorm1d(64, eps=1e-05, momentum=0.1, affine=True, track_running_stats=True)
    (2): Dropout(p=0.8, inplace=True)
    (3): ReLU(inplace=True)
    (4): Linear(in_features=64, out_features=6, bias=True)
    (5): LogSoftmax(dim=-1)
  )
  (prop): Propagation(K=8, mode=None, lambda1=None, lambda2=None, L21=True, alpha=0.8)
  (gcn): GCN(
    (convs): ModuleList(
      (0): GCNConv(3703, 64)
      (1): GCNConv(64, 6)
    )
    (bns): ModuleList(
      (0): BatchNorm1d(64, eps=1e-05, momentum=0.1, affine=True, track_running_stats=True)
    )
    (output): LogSoftmax(dim=-1)
  )
)
propagate done
init label
Split: 01, Run: 01
None time:  1.1452626020181924
None Run 01:
Highest Train: 100.00
Highest Valid: 67.20
  Final Train: 100.00
   Final Test: 67.00
Split: 01, Run: 02
None time:  1.013121377909556
None Run 02:
Highest Train: 100.00
Highest Valid: 68.00
  Final Train: 100.00
   Final Test: 69.40
Split: 01, Run: 03
None time:  1.160357696004212
None Run 03:
Highest Train: 100.00
Highest Valid: 67.80
  Final Train: 100.00
   Final Test: 68.70
run time now: 3.3735616207122803
total time:  3.4189141248352826
None All runs:
Highest Train: 100.00 ± 0.00
Highest Valid: 67.67 ± 0.42
  Final Train: 100.00 ± 0.00
   Final Test: 68.37 ± 1.23
[I 2023-06-11 23:56:50,466] Trial 567 finished with value: 67.66666412353516 and parameters: {'Fwd': 0.00020751376851934158, 'K': 8, 'alpha': 0.8, 'dropout': 0.8, 'gnnepoch': 120, 'lambda1': 0.65, 'lambda2': 7.257581820821212, 'loop': 0, 'loss': 'CE', 'lr': 0.0001324371157590343, 'softmaxF': False, 'useGCN': True, 'weight_decay': 4.043762976481175e-05, 'weightedloss': True}. Best is trial 271 with value: 72.06666564941406.
/home/wxy/miniconda3/lib/python3.10/site-packages/optuna/distributions.py:685: UserWarning: The distribution is specified by [0, 1.00001] and step=0.05, but the range is not divisible by `step`. It will be replaced by [0, 1.0].
  warnings.warn(
K:  4
alpha:  0.55
lr:  0.0007139403895461461
weight_decay:  0.0011535947179184892
dropout:  0.8
fix split and run 3 times
Data: Data(x=[3327, 3703], y=[3327], train_mask=[3327], val_mask=[3327], test_mask=[3327], adj_t=[3327, 3327, nnz=9104])
num_train tensor(120)
num_noise 0
noise: tensor(0)
data feature 3703
ALTOPT(
  (lins): Sequential(
    (0): Linear(in_features=3703, out_features=64, bias=True)
    (1): BatchNorm1d(64, eps=1e-05, momentum=0.1, affine=True, track_running_stats=True)
    (2): Dropout(p=0.8, inplace=True)
    (3): ReLU(inplace=True)
    (4): Linear(in_features=64, out_features=6, bias=True)
    (5): LogSoftmax(dim=-1)
  )
  (prop): Propagation(K=4, mode=None, lambda1=None, lambda2=None, L21=True, alpha=0.55)
  (gcn): GCN(
    (convs): ModuleList(
      (0): GCNConv(3703, 64)
      (1): GCNConv(64, 6)
    )
    (bns): ModuleList(
      (0): BatchNorm1d(64, eps=1e-05, momentum=0.1, affine=True, track_running_stats=True)
    )
    (output): LogSoftmax(dim=-1)
  )
)
propagate done
init label
Split: 01, Run: 01
None time:  1.0188091648742557
None Run 01:
Highest Train: 100.00
Highest Valid: 70.40
  Final Train: 100.00
   Final Test: 69.50
Split: 01, Run: 02
None time:  0.9662412058096379
None Run 02:
Highest Train: 100.00
Highest Valid: 71.80
  Final Train: 100.00
   Final Test: 70.30
Split: 01, Run: 03
None time:  1.1880187208298594
None Run 03:
Highest Train: 100.00
Highest Valid: 70.80
  Final Train: 100.00
   Final Test: 69.90
run time now: 3.2087464332580566
total time:  3.2610714808106422
None All runs:
Highest Train: 100.00 ± 0.00
Highest Valid: 71.00 ± 0.72
  Final Train: 100.00 ± 0.00
   Final Test: 69.90 ± 0.40
[I 2023-06-11 23:56:54,276] Trial 568 finished with value: 71.00000762939453 and parameters: {'Fwd': 9.332333984929529e-06, 'K': 4, 'alpha': 0.55, 'dropout': 0.8, 'gnnepoch': 120, 'lambda1': 0.75, 'lambda2': 6.586840118925561, 'loop': 0, 'loss': 'CE', 'lr': 0.0007139403895461461, 'softmaxF': False, 'useGCN': True, 'weight_decay': 0.0011535947179184892, 'weightedloss': True}. Best is trial 271 with value: 72.06666564941406.
/home/wxy/miniconda3/lib/python3.10/site-packages/optuna/distributions.py:685: UserWarning: The distribution is specified by [0, 1.00001] and step=0.05, but the range is not divisible by `step`. It will be replaced by [0, 1.0].
  warnings.warn(
K:  8
alpha:  0.75
lr:  0.0015181797301226543
weight_decay:  0.00025604715596054013
dropout:  0.0
fix split and run 3 times
Data: Data(x=[3327, 3703], y=[3327], train_mask=[3327], val_mask=[3327], test_mask=[3327], adj_t=[3327, 3327, nnz=9104])
num_train tensor(120)
num_noise 0
noise: tensor(0)
data feature 3703
ALTOPT(
  (lins): Sequential(
    (0): Linear(in_features=3703, out_features=64, bias=True)
    (1): BatchNorm1d(64, eps=1e-05, momentum=0.1, affine=True, track_running_stats=True)
    (2): Dropout(p=0.0, inplace=True)
    (3): ReLU(inplace=True)
    (4): Linear(in_features=64, out_features=6, bias=True)
    (5): LogSoftmax(dim=-1)
  )
  (prop): Propagation(K=8, mode=None, lambda1=None, lambda2=None, L21=True, alpha=0.75)
  (gcn): GCN(
    (convs): ModuleList(
      (0): GCNConv(3703, 64)
      (1): GCNConv(64, 6)
    )
    (bns): ModuleList(
      (0): BatchNorm1d(64, eps=1e-05, momentum=0.1, affine=True, track_running_stats=True)
    )
    (output): LogSoftmax(dim=-1)
  )
)
propagate done
init label
Split: 01, Run: 01
None time:  0.9541590269654989
None Run 01:
Highest Train: 100.00
Highest Valid: 71.60
  Final Train: 100.00
   Final Test: 69.60
Split: 01, Run: 02
None time:  1.0891480310820043
None Run 02:
Highest Train: 100.00
Highest Valid: 70.80
  Final Train: 98.33
   Final Test: 68.20
Split: 01, Run: 03
None time:  1.0290720649063587
None Run 03:
Highest Train: 100.00
Highest Valid: 70.40
  Final Train: 100.00
   Final Test: 69.50
run time now: 3.1142187118530273
total time:  3.1722617400810122
None All runs:
Highest Train: 100.00 ± 0.00
Highest Valid: 70.93 ± 0.61
  Final Train: 99.44 ± 0.96
   Final Test: 69.10 ± 0.78
[I 2023-06-11 23:56:58,029] Trial 569 finished with value: 70.9333267211914 and parameters: {'Fwd': 0.0027207799257641316, 'K': 8, 'alpha': 0.75, 'dropout': 0.0, 'gnnepoch': 120, 'lambda1': 0.65, 'lambda2': 2.1529314901613117, 'loop': 0, 'loss': 'CE', 'lr': 0.0015181797301226543, 'softmaxF': False, 'useGCN': True, 'weight_decay': 0.00025604715596054013, 'weightedloss': True}. Best is trial 271 with value: 72.06666564941406.
/home/wxy/miniconda3/lib/python3.10/site-packages/optuna/distributions.py:685: UserWarning: The distribution is specified by [0, 1.00001] and step=0.05, but the range is not divisible by `step`. It will be replaced by [0, 1.0].
  warnings.warn(
K:  8
alpha:  0.8500000000000001
lr:  0.0018548607292446975
weight_decay:  0.0003577095092934668
dropout:  0.8
fix split and run 3 times
Data: Data(x=[3327, 3703], y=[3327], train_mask=[3327], val_mask=[3327], test_mask=[3327], adj_t=[3327, 3327, nnz=9104])
num_train tensor(120)
num_noise 0
noise: tensor(0)
data feature 3703
ALTOPT(
  (lins): Sequential(
    (0): Linear(in_features=3703, out_features=64, bias=True)
    (1): BatchNorm1d(64, eps=1e-05, momentum=0.1, affine=True, track_running_stats=True)
    (2): Dropout(p=0.8, inplace=True)
    (3): ReLU(inplace=True)
    (4): Linear(in_features=64, out_features=6, bias=True)
    (5): LogSoftmax(dim=-1)
  )
  (prop): Propagation(K=8, mode=None, lambda1=None, lambda2=None, L21=True, alpha=0.8500000000000001)
  (gcn): GCN(
    (convs): ModuleList(
      (0): GCNConv(3703, 64)
      (1): GCNConv(64, 6)
    )
    (bns): ModuleList(
      (0): BatchNorm1d(64, eps=1e-05, momentum=0.1, affine=True, track_running_stats=True)
    )
    (output): LogSoftmax(dim=-1)
  )
)
propagate done
init label
Split: 01, Run: 01
None time:  1.060876013012603
None Run 01:
Highest Train: 100.00
Highest Valid: 71.20
  Final Train: 100.00
   Final Test: 69.90
Split: 01, Run: 02
None time:  1.0454523819498718
None Run 02:
Highest Train: 100.00
Highest Valid: 72.00
  Final Train: 100.00
   Final Test: 70.00
Split: 01, Run: 03
None time:  1.0363742881454527
None Run 03:
Highest Train: 100.00
Highest Valid: 71.60
  Final Train: 100.00
   Final Test: 70.10
run time now: 3.183168411254883
total time:  3.2328636369202286
None All runs:
Highest Train: 100.00 ± 0.00
Highest Valid: 71.60 ± 0.40
  Final Train: 100.00 ± 0.00
   Final Test: 70.00 ± 0.10
[I 2023-06-11 23:57:01,965] Trial 570 finished with value: 71.60000610351562 and parameters: {'Fwd': 0.00039833486770899425, 'K': 8, 'alpha': 0.8500000000000001, 'dropout': 0.8, 'gnnepoch': 120, 'lambda1': 0.6000000000000001, 'lambda2': 5.951544036023618, 'loop': 0, 'loss': 'CE', 'lr': 0.0018548607292446975, 'softmaxF': False, 'useGCN': True, 'weight_decay': 0.0003577095092934668, 'weightedloss': True}. Best is trial 271 with value: 72.06666564941406.
/home/wxy/miniconda3/lib/python3.10/site-packages/optuna/distributions.py:685: UserWarning: The distribution is specified by [0, 1.00001] and step=0.05, but the range is not divisible by `step`. It will be replaced by [0, 1.0].
  warnings.warn(
K:  8
alpha:  0.9
lr:  0.001024716094897523
weight_decay:  3.37158582402727e-05
dropout:  0.8
fix split and run 3 times
Data: Data(x=[3327, 3703], y=[3327], train_mask=[3327], val_mask=[3327], test_mask=[3327], adj_t=[3327, 3327, nnz=9104])
num_train tensor(120)
num_noise 0
noise: tensor(0)
data feature 3703
ALTOPT(
  (lins): Sequential(
    (0): Linear(in_features=3703, out_features=64, bias=True)
    (1): BatchNorm1d(64, eps=1e-05, momentum=0.1, affine=True, track_running_stats=True)
    (2): Dropout(p=0.8, inplace=True)
    (3): ReLU(inplace=True)
    (4): Linear(in_features=64, out_features=6, bias=True)
    (5): LogSoftmax(dim=-1)
  )
  (prop): Propagation(K=8, mode=None, lambda1=None, lambda2=None, L21=True, alpha=0.9)
  (gcn): GCN(
    (convs): ModuleList(
      (0): GCNConv(3703, 64)
      (1): GCNConv(64, 6)
    )
    (bns): ModuleList(
      (0): BatchNorm1d(64, eps=1e-05, momentum=0.1, affine=True, track_running_stats=True)
    )
    (output): LogSoftmax(dim=-1)
  )
)
propagate done
init label
Split: 01, Run: 01
None time:  1.014964526053518
None Run 01:
Highest Train: 100.00
Highest Valid: 70.80
  Final Train: 100.00
   Final Test: 69.80
Split: 01, Run: 02
None time:  0.9874680319335312
None Run 02:
Highest Train: 100.00
Highest Valid: 68.00
  Final Train: 100.00
   Final Test: 68.50
Split: 01, Run: 03
None time:  1.0229634509887546
None Run 03:
Highest Train: 100.00
Highest Valid: 70.40
  Final Train: 100.00
   Final Test: 70.00
run time now: 3.0700488090515137
total time:  3.1266329078935087
None All runs:
Highest Train: 100.00 ± 0.00
Highest Valid: 69.73 ± 1.51
  Final Train: 100.00 ± 0.00
   Final Test: 69.43 ± 0.81
[I 2023-06-11 23:57:05,646] Trial 571 finished with value: 69.73333740234375 and parameters: {'Fwd': 3.567228045128457e-06, 'K': 8, 'alpha': 0.9, 'dropout': 0.8, 'gnnepoch': 110, 'lambda1': 0.15000000000000002, 'lambda2': 9.969150398019119, 'loop': 0, 'loss': 'CE', 'lr': 0.001024716094897523, 'softmaxF': False, 'useGCN': True, 'weight_decay': 3.37158582402727e-05, 'weightedloss': True}. Best is trial 271 with value: 72.06666564941406.
/home/wxy/miniconda3/lib/python3.10/site-packages/optuna/distributions.py:685: UserWarning: The distribution is specified by [0, 1.00001] and step=0.05, but the range is not divisible by `step`. It will be replaced by [0, 1.0].
  warnings.warn(
K:  8
alpha:  0.65
lr:  0.000287760418141338
weight_decay:  0.0017940431804760013
dropout:  0.8
fix split and run 3 times
Data: Data(x=[3327, 3703], y=[3327], train_mask=[3327], val_mask=[3327], test_mask=[3327], adj_t=[3327, 3327, nnz=9104])
num_train tensor(120)
num_noise 0
noise: tensor(0)
data feature 3703
ALTOPT(
  (lins): Sequential(
    (0): Linear(in_features=3703, out_features=64, bias=True)
    (1): BatchNorm1d(64, eps=1e-05, momentum=0.1, affine=True, track_running_stats=True)
    (2): Dropout(p=0.8, inplace=True)
    (3): ReLU(inplace=True)
    (4): Linear(in_features=64, out_features=6, bias=True)
    (5): LogSoftmax(dim=-1)
  )
  (prop): Propagation(K=8, mode=None, lambda1=None, lambda2=None, L21=True, alpha=0.65)
  (gcn): GCN(
    (convs): ModuleList(
      (0): GCNConv(3703, 64)
      (1): GCNConv(64, 6)
    )
    (bns): ModuleList(
      (0): BatchNorm1d(64, eps=1e-05, momentum=0.1, affine=True, track_running_stats=True)
    )
    (output): LogSoftmax(dim=-1)
  )
)
propagate done
init label
Split: 01, Run: 01
None time:  0.7326373721007258
None Run 01:
Highest Train: 100.00
Highest Valid: 66.80
  Final Train: 100.00
   Final Test: 66.80
Split: 01, Run: 02
None time:  0.7733657611533999
None Run 02:
Highest Train: 100.00
Highest Valid: 67.00
  Final Train: 99.17
   Final Test: 65.30
Split: 01, Run: 03
None time:  0.8903212810400873
None Run 03:
Highest Train: 100.00
Highest Valid: 65.40
  Final Train: 99.17
   Final Test: 64.70
run time now: 2.4378068447113037
total time:  2.4844107280950993
None All runs:
Highest Train: 100.00 ± 0.00
Highest Valid: 66.40 ± 0.87
  Final Train: 99.44 ± 0.48
   Final Test: 65.60 ± 1.08
[I 2023-06-11 23:57:08,700] Trial 572 finished with value: 66.39999389648438 and parameters: {'Fwd': 1.3849779204808577e-06, 'K': 8, 'alpha': 0.65, 'dropout': 0.8, 'gnnepoch': 120, 'lambda1': 0.7000000000000001, 'lambda2': 7.040804504605481, 'loop': 0, 'loss': 'CE', 'lr': 0.000287760418141338, 'softmaxF': False, 'useGCN': False, 'weight_decay': 0.0017940431804760013, 'weightedloss': True}. Best is trial 271 with value: 72.06666564941406.
/home/wxy/miniconda3/lib/python3.10/site-packages/optuna/distributions.py:685: UserWarning: The distribution is specified by [0, 1.00001] and step=0.05, but the range is not divisible by `step`. It will be replaced by [0, 1.0].
  warnings.warn(
K:  8
alpha:  0.8
lr:  0.0012372519569342378
weight_decay:  0.0006377737014958842
dropout:  0.7000000000000001
fix split and run 3 times
Data: Data(x=[3327, 3703], y=[3327], train_mask=[3327], val_mask=[3327], test_mask=[3327], adj_t=[3327, 3327, nnz=9104])
num_train tensor(120)
num_noise 0
noise: tensor(0)
data feature 3703
ALTOPT(
  (lins): Sequential(
    (0): Linear(in_features=3703, out_features=64, bias=True)
    (1): BatchNorm1d(64, eps=1e-05, momentum=0.1, affine=True, track_running_stats=True)
    (2): Dropout(p=0.7000000000000001, inplace=True)
    (3): ReLU(inplace=True)
    (4): Linear(in_features=64, out_features=6, bias=True)
    (5): LogSoftmax(dim=-1)
  )
  (prop): Propagation(K=8, mode=None, lambda1=None, lambda2=None, L21=True, alpha=0.8)
  (gcn): GCN(
    (convs): ModuleList(
      (0): GCNConv(3703, 64)
      (1): GCNConv(64, 6)
    )
    (bns): ModuleList(
      (0): BatchNorm1d(64, eps=1e-05, momentum=0.1, affine=True, track_running_stats=True)
    )
    (output): LogSoftmax(dim=-1)
  )
)
propagate done
init label
Split: 01, Run: 01
None time:  1.0842728950083256
None Run 01:
Highest Train: 100.00
Highest Valid: 71.80
  Final Train: 100.00
   Final Test: 69.60
Split: 01, Run: 02
None time:  0.9967038419563323
None Run 02:
Highest Train: 100.00
Highest Valid: 71.80
  Final Train: 100.00
   Final Test: 70.10
Split: 01, Run: 03
None time:  1.1557087050750852
None Run 03:
Highest Train: 100.00
Highest Valid: 71.40
  Final Train: 100.00
   Final Test: 71.20
run time now: 3.282675266265869
total time:  3.342740088934079
None All runs:
Highest Train: 100.00 ± 0.00
Highest Valid: 71.67 ± 0.23
  Final Train: 100.00 ± 0.00
   Final Test: 70.30 ± 0.82
[I 2023-06-11 23:57:12,535] Trial 573 finished with value: 71.66666412353516 and parameters: {'Fwd': 1.6656501720076557e-05, 'K': 8, 'alpha': 0.8, 'dropout': 0.7000000000000001, 'gnnepoch': 120, 'lambda1': 0.75, 'lambda2': 7.579594850938674, 'loop': 0, 'loss': 'CE', 'lr': 0.0012372519569342378, 'softmaxF': False, 'useGCN': True, 'weight_decay': 0.0006377737014958842, 'weightedloss': True}. Best is trial 271 with value: 72.06666564941406.
/home/wxy/miniconda3/lib/python3.10/site-packages/optuna/distributions.py:685: UserWarning: The distribution is specified by [0, 1.00001] and step=0.05, but the range is not divisible by `step`. It will be replaced by [0, 1.0].
  warnings.warn(
K:  8
alpha:  0.8500000000000001
lr:  0.0014261494697738
weight_decay:  5.1922563459632714e-05
dropout:  0.8
fix split and run 3 times
Data: Data(x=[3327, 3703], y=[3327], train_mask=[3327], val_mask=[3327], test_mask=[3327], adj_t=[3327, 3327, nnz=9104])
num_train tensor(120)
num_noise 0
noise: tensor(0)
data feature 3703
ALTOPT(
  (lins): Sequential(
    (0): Linear(in_features=3703, out_features=64, bias=True)
    (1): BatchNorm1d(64, eps=1e-05, momentum=0.1, affine=True, track_running_stats=True)
    (2): Dropout(p=0.8, inplace=True)
    (3): ReLU(inplace=True)
    (4): Linear(in_features=64, out_features=6, bias=True)
    (5): LogSoftmax(dim=-1)
  )
  (prop): Propagation(K=8, mode=None, lambda1=None, lambda2=None, L21=True, alpha=0.8500000000000001)
  (gcn): GCN(
    (convs): ModuleList(
      (0): GCNConv(3703, 64)
      (1): GCNConv(64, 6)
    )
    (bns): ModuleList(
      (0): BatchNorm1d(64, eps=1e-05, momentum=0.1, affine=True, track_running_stats=True)
    )
    (output): LogSoftmax(dim=-1)
  )
)
propagate done
init label
Split: 01, Run: 01
None time:  0.8346400738228112
None Run 01:
Highest Train: 100.00
Highest Valid: 71.00
  Final Train: 99.17
   Final Test: 69.90
Split: 01, Run: 02
None time:  0.8989761020056903
None Run 02:
Highest Train: 100.00
Highest Valid: 69.80
  Final Train: 99.17
   Final Test: 68.90
Split: 01, Run: 03
None time:  0.9335520849563181
None Run 03:
Highest Train: 100.00
Highest Valid: 72.00
  Final Train: 98.33
   Final Test: 69.20
run time now: 2.7106130123138428
total time:  2.7611992079764605
None All runs:
Highest Train: 100.00 ± 0.00
Highest Valid: 70.93 ± 1.10
  Final Train: 98.89 ± 0.48
   Final Test: 69.33 ± 0.51
[I 2023-06-11 23:57:15,801] Trial 574 finished with value: 70.93333435058594 and parameters: {'Fwd': 1.5010921122240025e-05, 'K': 8, 'alpha': 0.8500000000000001, 'dropout': 0.8, 'gnnepoch': 100, 'lambda1': 0.8, 'lambda2': 0.5987690177640967, 'loop': 0, 'loss': 'CE', 'lr': 0.0014261494697738, 'softmaxF': True, 'useGCN': True, 'weight_decay': 5.1922563459632714e-05, 'weightedloss': True}. Best is trial 271 with value: 72.06666564941406.
/home/wxy/miniconda3/lib/python3.10/site-packages/optuna/distributions.py:685: UserWarning: The distribution is specified by [0, 1.00001] and step=0.05, but the range is not divisible by `step`. It will be replaced by [0, 1.0].
  warnings.warn(
K:  8
alpha:  0.6000000000000001
lr:  0.000243190623164604
weight_decay:  0.012512632778403128
dropout:  0.8
fix split and run 3 times
Data: Data(x=[3327, 3703], y=[3327], train_mask=[3327], val_mask=[3327], test_mask=[3327], adj_t=[3327, 3327, nnz=9104])
num_train tensor(120)
num_noise 0
noise: tensor(0)
data feature 3703
ALTOPT(
  (lins): Sequential(
    (0): Linear(in_features=3703, out_features=64, bias=True)
    (1): BatchNorm1d(64, eps=1e-05, momentum=0.1, affine=True, track_running_stats=True)
    (2): Dropout(p=0.8, inplace=True)
    (3): ReLU(inplace=True)
    (4): Linear(in_features=64, out_features=6, bias=True)
    (5): LogSoftmax(dim=-1)
  )
  (prop): Propagation(K=8, mode=None, lambda1=None, lambda2=None, L21=True, alpha=0.6000000000000001)
  (gcn): GCN(
    (convs): ModuleList(
      (0): GCNConv(3703, 64)
      (1): GCNConv(64, 6)
    )
    (bns): ModuleList(
      (0): BatchNorm1d(64, eps=1e-05, momentum=0.1, affine=True, track_running_stats=True)
    )
    (output): LogSoftmax(dim=-1)
  )
)
propagate done
init label
Split: 01, Run: 01
None time:  1.2866247799247503
None Run 01:
Highest Train: 100.00
Highest Valid: 69.20
  Final Train: 100.00
   Final Test: 68.70
Split: 01, Run: 02
None time:  1.3110055229626596
None Run 02:
Highest Train: 100.00
Highest Valid: 68.80
  Final Train: 100.00
   Final Test: 69.20
Split: 01, Run: 03
None time:  1.2361120390705764
None Run 03:
Highest Train: 100.00
Highest Valid: 69.40
  Final Train: 100.00
   Final Test: 68.70
run time now: 3.875439167022705
total time:  3.927285694051534
None All runs:
Highest Train: 100.00 ± 0.00
Highest Valid: 69.13 ± 0.31
  Final Train: 100.00 ± 0.00
   Final Test: 68.87 ± 0.29
