[I 2023-06-11 23:26:58,022] Trial 98 finished with value: 71.06666564941406 and parameters: {'Fwd': 0.00322488470796984, 'K': 8, 'alpha': 0.15000000000000002, 'dropout': 0.9, 'gnnepoch': 110, 'lambda1': 0.8500000000000001, 'lambda2': 3.5184379264016665, 'loop': 0, 'loss': 'CE', 'lr': 0.0033474915507598945, 'softmaxF': False, 'useGCN': True, 'weight_decay': 1.5884674430447137e-06, 'weightedloss': False}. Best is trial 82 with value: 71.73332977294922.
/home/wxy/miniconda3/lib/python3.10/site-packages/optuna/distributions.py:685: UserWarning: The distribution is specified by [0, 1.00001] and step=0.05, but the range is not divisible by `step`. It will be replaced by [0, 1.0].
  warnings.warn(
K:  7
alpha:  0.2
lr:  0.00238080727422466
weight_decay:  1.7234387994422928e-06
dropout:  0.8
fix split and run 3 times
Data: Data(x=[3327, 3703], y=[3327], train_mask=[3327], val_mask=[3327], test_mask=[3327], adj_t=[3327, 3327, nnz=9104])
num_train tensor(120)
num_noise 0
noise: tensor(0)
data feature 3703
ALTOPT(
  (lins): Sequential(
    (0): Linear(in_features=3703, out_features=64, bias=True)
    (1): BatchNorm1d(64, eps=1e-05, momentum=0.1, affine=True, track_running_stats=True)
    (2): Dropout(p=0.8, inplace=True)
    (3): ReLU(inplace=True)
    (4): Linear(in_features=64, out_features=6, bias=True)
    (5): LogSoftmax(dim=-1)
  )
  (prop): Propagation(K=7, mode=None, lambda1=None, lambda2=None, L21=True, alpha=0.2)
  (gcn): GCN(
    (convs): ModuleList(
      (0): GCNConv(3703, 64)
      (1): GCNConv(64, 6)
    )
    (bns): ModuleList(
      (0): BatchNorm1d(64, eps=1e-05, momentum=0.1, affine=True, track_running_stats=True)
    )
    (output): LogSoftmax(dim=-1)
  )
)
propagate done
init label
Split: 01, Run: 01
None time:  0.9711604549083859
None Run 01:
Highest Train: 100.00
Highest Valid: 71.40
  Final Train: 100.00
   Final Test: 69.90
Split: 01, Run: 02
None time:  1.0944796530529857
None Run 02:
Highest Train: 100.00
Highest Valid: 72.20
  Final Train: 100.00
   Final Test: 70.10
Split: 01, Run: 03
None time:  1.060389898950234
None Run 03:
Highest Train: 100.00
Highest Valid: 71.60
  Final Train: 100.00
   Final Test: 69.10
run time now: 3.171638250350952
total time:  3.231178304878995
None All runs:
Highest Train: 100.00 ± 0.00
Highest Valid: 71.73 ± 0.42
  Final Train: 100.00 ± 0.00
   Final Test: 69.70 ± 0.53
[I 2023-06-11 23:27:01,717] Trial 99 finished with value: 71.73333740234375 and parameters: {'Fwd': 0.007413521486039155, 'K': 7, 'alpha': 0.2, 'dropout': 0.8, 'gnnepoch': 120, 'lambda1': 0.9, 'lambda2': 2.962586284983743, 'loop': 0, 'loss': 'CE', 'lr': 0.00238080727422466, 'softmaxF': False, 'useGCN': True, 'weight_decay': 1.7234387994422928e-06, 'weightedloss': False}. Best is trial 99 with value: 71.73333740234375.
/home/wxy/miniconda3/lib/python3.10/site-packages/optuna/distributions.py:685: UserWarning: The distribution is specified by [0, 1.00001] and step=0.05, but the range is not divisible by `step`. It will be replaced by [0, 1.0].
  warnings.warn(
K:  6
alpha:  0.2
lr:  0.0023582018550421828
weight_decay:  1.7497293488454578e-06
dropout:  0.8
fix split and run 3 times
Data: Data(x=[3327, 3703], y=[3327], train_mask=[3327], val_mask=[3327], test_mask=[3327], adj_t=[3327, 3327, nnz=9104])
num_train tensor(120)
num_noise 0
noise: tensor(0)
data feature 3703
ALTOPT(
  (lins): Sequential(
    (0): Linear(in_features=3703, out_features=64, bias=True)
    (1): BatchNorm1d(64, eps=1e-05, momentum=0.1, affine=True, track_running_stats=True)
    (2): Dropout(p=0.8, inplace=True)
    (3): ReLU(inplace=True)
    (4): Linear(in_features=64, out_features=6, bias=True)
    (5): LogSoftmax(dim=-1)
  )
  (prop): Propagation(K=6, mode=None, lambda1=None, lambda2=None, L21=True, alpha=0.2)
  (gcn): GCN(
    (convs): ModuleList(
      (0): GCNConv(3703, 64)
      (1): GCNConv(64, 6)
    )
    (bns): ModuleList(
      (0): BatchNorm1d(64, eps=1e-05, momentum=0.1, affine=True, track_running_stats=True)
    )
    (output): LogSoftmax(dim=-1)
  )
)
propagate done
init label
Split: 01, Run: 01
None time:  0.9186684449668974
None Run 01:
Highest Train: 100.00
Highest Valid: 71.60
  Final Train: 100.00
   Final Test: 69.80
Split: 01, Run: 02
None time:  0.9801011579111218
None Run 02:
Highest Train: 100.00
Highest Valid: 70.60
  Final Train: 99.17
   Final Test: 68.70
Split: 01, Run: 03
None time:  0.9421161741483957
None Run 03:
Highest Train: 100.00
Highest Valid: 71.00
  Final Train: 100.00
   Final Test: 70.20
run time now: 2.882319211959839
total time:  2.9456007229164243
None All runs:
Highest Train: 100.00 ± 0.00
Highest Valid: 71.07 ± 0.50
  Final Train: 99.72 ± 0.48
   Final Test: 69.57 ± 0.78
[I 2023-06-11 23:27:05,223] Trial 100 finished with value: 71.06666564941406 and parameters: {'Fwd': 0.007104401203677022, 'K': 6, 'alpha': 0.2, 'dropout': 0.8, 'gnnepoch': 110, 'lambda1': 0.8, 'lambda2': 2.9855640315537597, 'loop': 0, 'loss': 'CE', 'lr': 0.0023582018550421828, 'softmaxF': False, 'useGCN': True, 'weight_decay': 1.7497293488454578e-06, 'weightedloss': False}. Best is trial 99 with value: 71.73333740234375.
/home/wxy/miniconda3/lib/python3.10/site-packages/optuna/distributions.py:685: UserWarning: The distribution is specified by [0, 1.00001] and step=0.05, but the range is not divisible by `step`. It will be replaced by [0, 1.0].
  warnings.warn(
K:  7
alpha:  0.1
lr:  0.0029241000733346385
weight_decay:  1.3289725809676534e-06
dropout:  0.9
fix split and run 3 times
Data: Data(x=[3327, 3703], y=[3327], train_mask=[3327], val_mask=[3327], test_mask=[3327], adj_t=[3327, 3327, nnz=9104])
num_train tensor(120)
num_noise 0
noise: tensor(0)
data feature 3703
ALTOPT(
  (lins): Sequential(
    (0): Linear(in_features=3703, out_features=64, bias=True)
    (1): BatchNorm1d(64, eps=1e-05, momentum=0.1, affine=True, track_running_stats=True)
    (2): Dropout(p=0.9, inplace=True)
    (3): ReLU(inplace=True)
    (4): Linear(in_features=64, out_features=6, bias=True)
    (5): LogSoftmax(dim=-1)
  )
  (prop): Propagation(K=7, mode=None, lambda1=None, lambda2=None, L21=True, alpha=0.1)
  (gcn): GCN(
    (convs): ModuleList(
      (0): GCNConv(3703, 64)
      (1): GCNConv(64, 6)
    )
    (bns): ModuleList(
      (0): BatchNorm1d(64, eps=1e-05, momentum=0.1, affine=True, track_running_stats=True)
    )
    (output): LogSoftmax(dim=-1)
  )
)
propagate done
init label
Split: 01, Run: 01
None time:  1.043144135037437
None Run 01:
Highest Train: 100.00
Highest Valid: 71.60
  Final Train: 100.00
   Final Test: 69.20
Split: 01, Run: 02
None time:  0.9972312378231436
None Run 02:
Highest Train: 100.00
Highest Valid: 71.80
  Final Train: 100.00
   Final Test: 70.10
Split: 01, Run: 03
None time:  1.1337108600419015
None Run 03:
Highest Train: 100.00
Highest Valid: 72.00
  Final Train: 100.00
   Final Test: 70.10
run time now: 3.2146987915039062
total time:  3.264396301936358
None All runs:
Highest Train: 100.00 ± 0.00
Highest Valid: 71.80 ± 0.20
  Final Train: 100.00 ± 0.00
   Final Test: 69.80 ± 0.52
[I 2023-06-11 23:27:08,933] Trial 101 finished with value: 71.79999542236328 and parameters: {'Fwd': 0.013838560373903769, 'K': 7, 'alpha': 0.1, 'dropout': 0.9, 'gnnepoch': 120, 'lambda1': 0.9, 'lambda2': 3.4107890520929813, 'loop': 0, 'loss': 'CE', 'lr': 0.0029241000733346385, 'softmaxF': False, 'useGCN': True, 'weight_decay': 1.3289725809676534e-06, 'weightedloss': False}. Best is trial 101 with value: 71.79999542236328.
/home/wxy/miniconda3/lib/python3.10/site-packages/optuna/distributions.py:685: UserWarning: The distribution is specified by [0, 1.00001] and step=0.05, but the range is not divisible by `step`. It will be replaced by [0, 1.0].
  warnings.warn(
K:  8
alpha:  0.1
lr:  0.0028877769915696353
weight_decay:  1.231380008654693e-06
dropout:  0.9
fix split and run 3 times
Data: Data(x=[3327, 3703], y=[3327], train_mask=[3327], val_mask=[3327], test_mask=[3327], adj_t=[3327, 3327, nnz=9104])
num_train tensor(120)
num_noise 0
noise: tensor(0)
data feature 3703
ALTOPT(
  (lins): Sequential(
    (0): Linear(in_features=3703, out_features=64, bias=True)
    (1): BatchNorm1d(64, eps=1e-05, momentum=0.1, affine=True, track_running_stats=True)
    (2): Dropout(p=0.9, inplace=True)
    (3): ReLU(inplace=True)
    (4): Linear(in_features=64, out_features=6, bias=True)
    (5): LogSoftmax(dim=-1)
  )
  (prop): Propagation(K=8, mode=None, lambda1=None, lambda2=None, L21=True, alpha=0.1)
  (gcn): GCN(
    (convs): ModuleList(
      (0): GCNConv(3703, 64)
      (1): GCNConv(64, 6)
    )
    (bns): ModuleList(
      (0): BatchNorm1d(64, eps=1e-05, momentum=0.1, affine=True, track_running_stats=True)
    )
    (output): LogSoftmax(dim=-1)
  )
)
propagate done
init label
Split: 01, Run: 01
None time:  1.1471214040648192
None Run 01:
Highest Train: 100.00
Highest Valid: 71.40
  Final Train: 100.00
   Final Test: 69.00
Split: 01, Run: 02
None time:  1.0873044258914888
None Run 02:
Highest Train: 100.00
Highest Valid: 71.80
  Final Train: 100.00
   Final Test: 70.10
Split: 01, Run: 03
None time:  1.0630097799003124
None Run 03:
Highest Train: 100.00
Highest Valid: 71.80
  Final Train: 100.00
   Final Test: 70.10
run time now: 3.3382198810577393
total time:  3.393099620938301
None All runs:
Highest Train: 100.00 ± 0.00
Highest Valid: 71.67 ± 0.23
  Final Train: 100.00 ± 0.00
   Final Test: 69.73 ± 0.64
[I 2023-06-11 23:27:12,731] Trial 102 finished with value: 71.66667175292969 and parameters: {'Fwd': 0.013337967693017039, 'K': 8, 'alpha': 0.1, 'dropout': 0.9, 'gnnepoch': 120, 'lambda1': 0.9, 'lambda2': 3.4281497734961484, 'loop': 0, 'loss': 'CE', 'lr': 0.0028877769915696353, 'softmaxF': False, 'useGCN': True, 'weight_decay': 1.231380008654693e-06, 'weightedloss': False}. Best is trial 101 with value: 71.79999542236328.
/home/wxy/miniconda3/lib/python3.10/site-packages/optuna/distributions.py:685: UserWarning: The distribution is specified by [0, 1.00001] and step=0.05, but the range is not divisible by `step`. It will be replaced by [0, 1.0].
  warnings.warn(
K:  8
alpha:  0.1
lr:  0.0029494631968552923
weight_decay:  1.2769155465795745e-06
dropout:  0.8
fix split and run 3 times
Data: Data(x=[3327, 3703], y=[3327], train_mask=[3327], val_mask=[3327], test_mask=[3327], adj_t=[3327, 3327, nnz=9104])
num_train tensor(120)
num_noise 0
noise: tensor(0)
data feature 3703
ALTOPT(
  (lins): Sequential(
    (0): Linear(in_features=3703, out_features=64, bias=True)
    (1): BatchNorm1d(64, eps=1e-05, momentum=0.1, affine=True, track_running_stats=True)
    (2): Dropout(p=0.8, inplace=True)
    (3): ReLU(inplace=True)
    (4): Linear(in_features=64, out_features=6, bias=True)
    (5): LogSoftmax(dim=-1)
  )
  (prop): Propagation(K=8, mode=None, lambda1=None, lambda2=None, L21=True, alpha=0.1)
  (gcn): GCN(
    (convs): ModuleList(
      (0): GCNConv(3703, 64)
      (1): GCNConv(64, 6)
    )
    (bns): ModuleList(
      (0): BatchNorm1d(64, eps=1e-05, momentum=0.1, affine=True, track_running_stats=True)
    )
    (output): LogSoftmax(dim=-1)
  )
)
propagate done
init label
Split: 01, Run: 01
None time:  1.06139948614873
None Run 01:
Highest Train: 100.00
Highest Valid: 71.40
  Final Train: 99.17
   Final Test: 69.90
Split: 01, Run: 02
None time:  1.0801844869274646
None Run 02:
Highest Train: 100.00
Highest Valid: 72.20
  Final Train: 100.00
   Final Test: 70.00
Split: 01, Run: 03
None time:  1.0754885817877948
None Run 03:
Highest Train: 100.00
Highest Valid: 70.60
  Final Train: 100.00
   Final Test: 69.10
run time now: 3.25821852684021
total time:  3.3160515800118446
None All runs:
Highest Train: 100.00 ± 0.00
Highest Valid: 71.40 ± 0.80
  Final Train: 99.72 ± 0.48
   Final Test: 69.67 ± 0.49
[I 2023-06-11 23:27:16,490] Trial 103 finished with value: 71.4000015258789 and parameters: {'Fwd': 0.013336121686491387, 'K': 8, 'alpha': 0.1, 'dropout': 0.8, 'gnnepoch': 120, 'lambda1': 0.9, 'lambda2': 2.7495503438630706, 'loop': 0, 'loss': 'CE', 'lr': 0.0029494631968552923, 'softmaxF': False, 'useGCN': True, 'weight_decay': 1.2769155465795745e-06, 'weightedloss': False}. Best is trial 101 with value: 71.79999542236328.
/home/wxy/miniconda3/lib/python3.10/site-packages/optuna/distributions.py:685: UserWarning: The distribution is specified by [0, 1.00001] and step=0.05, but the range is not divisible by `step`. It will be replaced by [0, 1.0].
  warnings.warn(
K:  8
alpha:  0.05
lr:  0.002555269320547148
weight_decay:  1.2244617440188075e-06
dropout:  0.9
fix split and run 3 times
Data: Data(x=[3327, 3703], y=[3327], train_mask=[3327], val_mask=[3327], test_mask=[3327], adj_t=[3327, 3327, nnz=9104])
num_train tensor(120)
num_noise 0
noise: tensor(0)
data feature 3703
ALTOPT(
  (lins): Sequential(
    (0): Linear(in_features=3703, out_features=64, bias=True)
    (1): BatchNorm1d(64, eps=1e-05, momentum=0.1, affine=True, track_running_stats=True)
    (2): Dropout(p=0.9, inplace=True)
    (3): ReLU(inplace=True)
    (4): Linear(in_features=64, out_features=6, bias=True)
    (5): LogSoftmax(dim=-1)
  )
  (prop): Propagation(K=8, mode=None, lambda1=None, lambda2=None, L21=True, alpha=0.05)
  (gcn): GCN(
    (convs): ModuleList(
      (0): GCNConv(3703, 64)
      (1): GCNConv(64, 6)
    )
    (bns): ModuleList(
      (0): BatchNorm1d(64, eps=1e-05, momentum=0.1, affine=True, track_running_stats=True)
    )
    (output): LogSoftmax(dim=-1)
  )
)
propagate done
init label
Split: 01, Run: 01
None time:  0.9937053150497377
None Run 01:
Highest Train: 100.00
Highest Valid: 71.40
  Final Train: 100.00
   Final Test: 69.40
Split: 01, Run: 02
None time:  0.9478731960989535
None Run 02:
Highest Train: 100.00
Highest Valid: 70.60
  Final Train: 100.00
   Final Test: 68.20
Split: 01, Run: 03
None time:  1.0510577319655567
None Run 03:
Highest Train: 100.00
Highest Valid: 71.80
  Final Train: 100.00
   Final Test: 70.30
run time now: 3.0342750549316406
total time:  3.0883272390346974
None All runs:
Highest Train: 100.00 ± 0.00
Highest Valid: 71.27 ± 0.61
  Final Train: 100.00 ± 0.00
   Final Test: 69.30 ± 1.05
[I 2023-06-11 23:27:19,966] Trial 104 finished with value: 71.26667022705078 and parameters: {'Fwd': 0.01846597634128563, 'K': 8, 'alpha': 0.05, 'dropout': 0.9, 'gnnepoch': 110, 'lambda1': 0.9, 'lambda2': 3.5731482835319928, 'loop': 0, 'loss': 'CE', 'lr': 0.002555269320547148, 'softmaxF': False, 'useGCN': True, 'weight_decay': 1.2244617440188075e-06, 'weightedloss': False}. Best is trial 101 with value: 71.79999542236328.
/home/wxy/miniconda3/lib/python3.10/site-packages/optuna/distributions.py:685: UserWarning: The distribution is specified by [0, 1.00001] and step=0.05, but the range is not divisible by `step`. It will be replaced by [0, 1.0].
  warnings.warn(
K:  8
alpha:  0.05
lr:  0.003092377558302704
weight_decay:  1.035745319264066e-06
dropout:  0.9
fix split and run 3 times
Data: Data(x=[3327, 3703], y=[3327], train_mask=[3327], val_mask=[3327], test_mask=[3327], adj_t=[3327, 3327, nnz=9104])
num_train tensor(120)
num_noise 0
noise: tensor(0)
data feature 3703
ALTOPT(
  (lins): Sequential(
    (0): Linear(in_features=3703, out_features=64, bias=True)
    (1): BatchNorm1d(64, eps=1e-05, momentum=0.1, affine=True, track_running_stats=True)
    (2): Dropout(p=0.9, inplace=True)
    (3): ReLU(inplace=True)
    (4): Linear(in_features=64, out_features=6, bias=True)
    (5): LogSoftmax(dim=-1)
  )
  (prop): Propagation(K=8, mode=None, lambda1=None, lambda2=None, L21=True, alpha=0.05)
  (gcn): GCN(
    (convs): ModuleList(
      (0): GCNConv(3703, 64)
      (1): GCNConv(64, 6)
    )
    (bns): ModuleList(
      (0): BatchNorm1d(64, eps=1e-05, momentum=0.1, affine=True, track_running_stats=True)
    )
    (output): LogSoftmax(dim=-1)
  )
)
propagate done
init label
Split: 01, Run: 01
None time:  1.093012924073264
None Run 01:
Highest Train: 100.00
Highest Valid: 71.60
  Final Train: 100.00
   Final Test: 69.30
Split: 01, Run: 02
None time:  1.0362060109619051
None Run 02:
Highest Train: 100.00
Highest Valid: 71.80
  Final Train: 100.00
   Final Test: 70.30
Split: 01, Run: 03
None time:  1.0296460350509733
None Run 03:
Highest Train: 100.00
Highest Valid: 71.80
  Final Train: 100.00
   Final Test: 69.70
run time now: 3.2005269527435303
total time:  3.2577017380390316
None All runs:
Highest Train: 100.00 ± 0.00
Highest Valid: 71.73 ± 0.12
  Final Train: 100.00 ± 0.00
   Final Test: 69.77 ± 0.50
[I 2023-06-11 23:27:23,707] Trial 105 finished with value: 71.73332977294922 and parameters: {'Fwd': 0.01210310186022907, 'K': 8, 'alpha': 0.05, 'dropout': 0.9, 'gnnepoch': 120, 'lambda1': 0.8500000000000001, 'lambda2': 2.925146795368745, 'loop': 0, 'loss': 'CE', 'lr': 0.003092377558302704, 'softmaxF': False, 'useGCN': True, 'weight_decay': 1.035745319264066e-06, 'weightedloss': False}. Best is trial 101 with value: 71.79999542236328.
/home/wxy/miniconda3/lib/python3.10/site-packages/optuna/distributions.py:685: UserWarning: The distribution is specified by [0, 1.00001] and step=0.05, but the range is not divisible by `step`. It will be replaced by [0, 1.0].
  warnings.warn(
K:  9
alpha:  0.05
lr:  0.0028144609501111017
weight_decay:  1.0018525489560979e-06
dropout:  0.8
fix split and run 3 times
Data: Data(x=[3327, 3703], y=[3327], train_mask=[3327], val_mask=[3327], test_mask=[3327], adj_t=[3327, 3327, nnz=9104])
num_train tensor(120)
num_noise 0
noise: tensor(0)
data feature 3703
ALTOPT(
  (lins): Sequential(
    (0): Linear(in_features=3703, out_features=64, bias=True)
    (1): BatchNorm1d(64, eps=1e-05, momentum=0.1, affine=True, track_running_stats=True)
    (2): Dropout(p=0.8, inplace=True)
    (3): ReLU(inplace=True)
    (4): Linear(in_features=64, out_features=6, bias=True)
    (5): Identity()
  )
  (prop): Propagation(K=9, mode=None, lambda1=None, lambda2=None, L21=True, alpha=0.05)
  (gcn): GCN(
    (convs): ModuleList(
      (0): GCNConv(3703, 64)
      (1): GCNConv(64, 6)
    )
    (bns): ModuleList(
      (0): BatchNorm1d(64, eps=1e-05, momentum=0.1, affine=True, track_running_stats=True)
    )
    (output): Identity()
  )
)
propagate done
init label
Split: 01, Run: 01, Epoch: 100, Loss: 0.0000, Train: 100.00%, Valid: 67.40% Test: 68.60%
Split: 01, Run: 01
None time:  1.8834215940441936
None Run 01:
Highest Train: 100.00
Highest Valid: 67.40
  Final Train: 100.00
   Final Test: 68.60
Split: 01, Run: 02, Epoch: 100, Loss: 0.0000, Train: 100.00%, Valid: 66.60% Test: 69.10%
Split: 01, Run: 02
None time:  1.8779117250815034
None Run 02:
Highest Train: 100.00
Highest Valid: 66.60
  Final Train: 100.00
   Final Test: 69.10
Split: 01, Run: 03, Epoch: 100, Loss: 0.0000, Train: 100.00%, Valid: 67.00% Test: 68.80%
Split: 01, Run: 03
None time:  1.8613282919395715
None Run 03:
Highest Train: 100.00
Highest Valid: 67.00
  Final Train: 100.00
   Final Test: 68.80
run time now: 5.667402267456055
total time:  5.738178187981248
None All runs:
Highest Train: 100.00 ± 0.00
Highest Valid: 67.00 ± 0.40
  Final Train: 100.00 ± 0.00
   Final Test: 68.83 ± 0.25
[I 2023-06-11 23:27:30,057] Trial 106 finished with value: 67.0 and parameters: {'Fwd': 0.01342187054479745, 'K': 9, 'alpha': 0.05, 'dropout': 0.8, 'gnnepoch': 120, 'lambda1': 0.8500000000000001, 'lambda2': 2.9961957984719363, 'loop': 0, 'loss': 'MSE', 'lr': 0.0028144609501111017, 'softmaxF': False, 'useGCN': True, 'weight_decay': 1.0018525489560979e-06, 'weightedloss': False}. Best is trial 101 with value: 71.79999542236328.
/home/wxy/miniconda3/lib/python3.10/site-packages/optuna/distributions.py:685: UserWarning: The distribution is specified by [0, 1.00001] and step=0.05, but the range is not divisible by `step`. It will be replaced by [0, 1.0].
  warnings.warn(
K:  8
alpha:  0.0
lr:  0.002037727326621574
weight_decay:  1.276362635390008e-06
dropout:  0.9
fix split and run 3 times
Data: Data(x=[3327, 3703], y=[3327], train_mask=[3327], val_mask=[3327], test_mask=[3327], adj_t=[3327, 3327, nnz=9104])
num_train tensor(120)
num_noise 0
noise: tensor(0)
data feature 3703
ALTOPT(
  (lins): Sequential(
    (0): Linear(in_features=3703, out_features=64, bias=True)
    (1): BatchNorm1d(64, eps=1e-05, momentum=0.1, affine=True, track_running_stats=True)
    (2): Dropout(p=0.9, inplace=True)
    (3): ReLU(inplace=True)
    (4): Linear(in_features=64, out_features=6, bias=True)
    (5): LogSoftmax(dim=-1)
  )
  (prop): Propagation(K=8, mode=None, lambda1=None, lambda2=None, L21=True, alpha=0.0)
  (gcn): GCN(
    (convs): ModuleList(
      (0): GCNConv(3703, 64)
      (1): GCNConv(64, 6)
    )
    (bns): ModuleList(
      (0): BatchNorm1d(64, eps=1e-05, momentum=0.1, affine=True, track_running_stats=True)
    )
    (output): LogSoftmax(dim=-1)
  )
)
propagate done
init label
Split: 01, Run: 01
None time:  0.2102441149763763
None Run 01:
Highest Train: 100.00
Highest Valid: 66.80
  Final Train: 100.00
   Final Test: 67.20
Split: 01, Run: 02
None time:  0.19823092897422612
None Run 02:
Highest Train: 100.00
Highest Valid: 65.40
  Final Train: 100.00
   Final Test: 65.30
Split: 01, Run: 03
None time:  0.22731462307274342
None Run 03:
Highest Train: 100.00
Highest Valid: 62.00
  Final Train: 100.00
   Final Test: 64.60
run time now: 0.6763949394226074
total time:  0.7344751851633191
None All runs:
Highest Train: 100.00 ± 0.00
Highest Valid: 64.73 ± 2.47
  Final Train: 100.00 ± 0.00
   Final Test: 65.70 ± 1.35
