[I 2023-06-11 23:43:26,068] Trial 359 finished with value: 50.59999465942383 and parameters: {'Fwd': 0.03710544030325772, 'K': 8, 'alpha': 0.75, 'dropout': 0.8, 'gnnepoch': 110, 'lambda1': 0.0, 'lambda2': 4.686508371201374, 'loop': 0, 'loss': 'CE', 'lr': 0.0015964215032598602, 'softmaxF': False, 'useGCN': True, 'weight_decay': 2.961965233272565e-05, 'weightedloss': True}. Best is trial 271 with value: 72.06666564941406.
/home/wxy/miniconda3/lib/python3.10/site-packages/optuna/distributions.py:685: UserWarning: The distribution is specified by [0, 1.00001] and step=0.05, but the range is not divisible by `step`. It will be replaced by [0, 1.0].
  warnings.warn(
K:  8
alpha:  0.7000000000000001
lr:  0.0010420278764302125
weight_decay:  1.8257309098071687e-05
dropout:  0.8
fix split and run 3 times
Data: Data(x=[3327, 3703], y=[3327], train_mask=[3327], val_mask=[3327], test_mask=[3327], adj_t=[3327, 3327, nnz=9104])
num_train tensor(120)
num_noise 0
noise: tensor(0)
data feature 3703
ALTOPT(
  (lins): Sequential(
    (0): Linear(in_features=3703, out_features=64, bias=True)
    (1): BatchNorm1d(64, eps=1e-05, momentum=0.1, affine=True, track_running_stats=True)
    (2): Dropout(p=0.8, inplace=True)
    (3): ReLU(inplace=True)
    (4): Linear(in_features=64, out_features=6, bias=True)
    (5): LogSoftmax(dim=-1)
  )
  (prop): Propagation(K=8, mode=None, lambda1=None, lambda2=None, L21=True, alpha=0.7000000000000001)
  (gcn): GCN(
    (convs): ModuleList(
      (0): GCNConv(3703, 64)
      (1): GCNConv(64, 6)
    )
    (bns): ModuleList(
      (0): BatchNorm1d(64, eps=1e-05, momentum=0.1, affine=True, track_running_stats=True)
    )
    (output): LogSoftmax(dim=-1)
  )
)
propagate done
init label
Split: 01, Run: 01
None time:  0.7044750698842108
None Run 01:
Highest Train: 100.00
Highest Valid: 70.80
  Final Train: 100.00
   Final Test: 69.60
Split: 01, Run: 02
None time:  0.828094715019688
None Run 02:
Highest Train: 100.00
Highest Valid: 71.20
  Final Train: 100.00
   Final Test: 70.30
Split: 01, Run: 03
None time:  0.7073591430671513
None Run 03:
Highest Train: 100.00
Highest Valid: 71.00
  Final Train: 100.00
   Final Test: 70.20
run time now: 2.2814366817474365
total time:  2.3315943889319897
None All runs:
Highest Train: 100.00 ± 0.00
Highest Valid: 71.00 ± 0.20
  Final Train: 100.00 ± 0.00
   Final Test: 70.03 ± 0.38
[I 2023-06-11 23:43:28,853] Trial 360 finished with value: 71.0 and parameters: {'Fwd': 0.09756245267978582, 'K': 8, 'alpha': 0.7000000000000001, 'dropout': 0.8, 'gnnepoch': 80, 'lambda1': 0.75, 'lambda2': 4.8904519408436595, 'loop': 0, 'loss': 'CE', 'lr': 0.0010420278764302125, 'softmaxF': False, 'useGCN': True, 'weight_decay': 1.8257309098071687e-05, 'weightedloss': True}. Best is trial 271 with value: 72.06666564941406.
/home/wxy/miniconda3/lib/python3.10/site-packages/optuna/distributions.py:685: UserWarning: The distribution is specified by [0, 1.00001] and step=0.05, but the range is not divisible by `step`. It will be replaced by [0, 1.0].
  warnings.warn(
K:  8
alpha:  0.7000000000000001
lr:  0.0013237694769646082
weight_decay:  2.3787223552277196e-05
dropout:  0.7000000000000001
fix split and run 3 times
Data: Data(x=[3327, 3703], y=[3327], train_mask=[3327], val_mask=[3327], test_mask=[3327], adj_t=[3327, 3327, nnz=9104])
num_train tensor(120)
num_noise 0
noise: tensor(0)
data feature 3703
ALTOPT(
  (lins): Sequential(
    (0): Linear(in_features=3703, out_features=64, bias=True)
    (1): BatchNorm1d(64, eps=1e-05, momentum=0.1, affine=True, track_running_stats=True)
    (2): Dropout(p=0.7000000000000001, inplace=True)
    (3): ReLU(inplace=True)
    (4): Linear(in_features=64, out_features=6, bias=True)
    (5): LogSoftmax(dim=-1)
  )
  (prop): Propagation(K=8, mode=None, lambda1=None, lambda2=None, L21=True, alpha=0.7000000000000001)
  (gcn): GCN(
    (convs): ModuleList(
      (0): GCNConv(3703, 64)
      (1): GCNConv(64, 6)
    )
    (bns): ModuleList(
      (0): BatchNorm1d(64, eps=1e-05, momentum=0.1, affine=True, track_running_stats=True)
    )
    (output): LogSoftmax(dim=-1)
  )
)
propagate done
init label
Split: 01, Run: 01
None time:  1.0706121020484716
None Run 01:
Highest Train: 100.00
Highest Valid: 71.40
  Final Train: 100.00
   Final Test: 69.90
Split: 01, Run: 02
None time:  1.057282533030957
None Run 02:
Highest Train: 100.00
Highest Valid: 71.80
  Final Train: 100.00
   Final Test: 70.10
Split: 01, Run: 03
None time:  1.09189767902717
None Run 03:
Highest Train: 100.00
Highest Valid: 71.40
  Final Train: 100.00
   Final Test: 70.50
run time now: 3.260307788848877
total time:  3.3167305670212954
None All runs:
Highest Train: 100.00 ± 0.00
Highest Valid: 71.53 ± 0.23
  Final Train: 100.00 ± 0.00
   Final Test: 70.17 ± 0.31
[I 2023-06-11 23:43:32,638] Trial 361 finished with value: 71.53333282470703 and parameters: {'Fwd': 0.06914519519085931, 'K': 8, 'alpha': 0.7000000000000001, 'dropout': 0.7000000000000001, 'gnnepoch': 120, 'lambda1': 0.7000000000000001, 'lambda2': 7.516011206611665, 'loop': 0, 'loss': 'CE', 'lr': 0.0013237694769646082, 'softmaxF': False, 'useGCN': True, 'weight_decay': 2.3787223552277196e-05, 'weightedloss': True}. Best is trial 271 with value: 72.06666564941406.
/home/wxy/miniconda3/lib/python3.10/site-packages/optuna/distributions.py:685: UserWarning: The distribution is specified by [0, 1.00001] and step=0.05, but the range is not divisible by `step`. It will be replaced by [0, 1.0].
  warnings.warn(
K:  8
alpha:  0.8
lr:  0.0017687882119953027
weight_decay:  1.1450103372899239e-05
dropout:  0.8
fix split and run 3 times
Data: Data(x=[3327, 3703], y=[3327], train_mask=[3327], val_mask=[3327], test_mask=[3327], adj_t=[3327, 3327, nnz=9104])
num_train tensor(120)
num_noise 0
noise: tensor(0)
data feature 3703
ALTOPT(
  (lins): Sequential(
    (0): Linear(in_features=3703, out_features=64, bias=True)
    (1): BatchNorm1d(64, eps=1e-05, momentum=0.1, affine=True, track_running_stats=True)
    (2): Dropout(p=0.8, inplace=True)
    (3): ReLU(inplace=True)
    (4): Linear(in_features=64, out_features=6, bias=True)
    (5): LogSoftmax(dim=-1)
  )
  (prop): Propagation(K=8, mode=None, lambda1=None, lambda2=None, L21=True, alpha=0.8)
  (gcn): GCN(
    (convs): ModuleList(
      (0): GCNConv(3703, 64)
      (1): GCNConv(64, 6)
    )
    (bns): ModuleList(
      (0): BatchNorm1d(64, eps=1e-05, momentum=0.1, affine=True, track_running_stats=True)
    )
    (output): LogSoftmax(dim=-1)
  )
)
propagate done
init label
Split: 01, Run: 01
None time:  1.0831496550235897
None Run 01:
Highest Train: 100.00
Highest Valid: 71.20
  Final Train: 100.00
   Final Test: 69.60
Split: 01, Run: 02
None time:  1.10148686892353
None Run 02:
Highest Train: 100.00
Highest Valid: 72.20
  Final Train: 100.00
   Final Test: 70.30
Split: 01, Run: 03
None time:  1.1050738198682666
None Run 03:
Highest Train: 100.00
Highest Valid: 71.80
  Final Train: 100.00
   Final Test: 70.00
run time now: 3.3355112075805664
total time:  3.39411512715742
None All runs:
Highest Train: 100.00 ± 0.00
Highest Valid: 71.73 ± 0.50
  Final Train: 100.00 ± 0.00
   Final Test: 69.97 ± 0.35
[I 2023-06-11 23:43:36,579] Trial 362 finished with value: 71.73332977294922 and parameters: {'Fwd': 0.02796324749585765, 'K': 8, 'alpha': 0.8, 'dropout': 0.8, 'gnnepoch': 120, 'lambda1': 0.7000000000000001, 'lambda2': 5.490336152299118, 'loop': 0, 'loss': 'CE', 'lr': 0.0017687882119953027, 'softmaxF': True, 'useGCN': True, 'weight_decay': 1.1450103372899239e-05, 'weightedloss': True}. Best is trial 271 with value: 72.06666564941406.
/home/wxy/miniconda3/lib/python3.10/site-packages/optuna/distributions.py:685: UserWarning: The distribution is specified by [0, 1.00001] and step=0.05, but the range is not divisible by `step`. It will be replaced by [0, 1.0].
  warnings.warn(
K:  9
alpha:  0.75
lr:  0.0013266095736393006
weight_decay:  1.5280530224109196e-05
dropout:  0.8
fix split and run 3 times
Data: Data(x=[3327, 3703], y=[3327], train_mask=[3327], val_mask=[3327], test_mask=[3327], adj_t=[3327, 3327, nnz=9104])
num_train tensor(120)
num_noise 0
noise: tensor(0)
data feature 3703
ALTOPT(
  (lins): Sequential(
    (0): Linear(in_features=3703, out_features=64, bias=True)
    (1): BatchNorm1d(64, eps=1e-05, momentum=0.1, affine=True, track_running_stats=True)
    (2): Dropout(p=0.8, inplace=True)
    (3): ReLU(inplace=True)
    (4): Linear(in_features=64, out_features=6, bias=True)
    (5): LogSoftmax(dim=-1)
  )
  (prop): Propagation(K=9, mode=None, lambda1=None, lambda2=None, L21=True, alpha=0.75)
  (gcn): GCN(
    (convs): ModuleList(
      (0): GCNConv(3703, 64)
      (1): GCNConv(64, 6)
    )
    (bns): ModuleList(
      (0): BatchNorm1d(64, eps=1e-05, momentum=0.1, affine=True, track_running_stats=True)
    )
    (output): LogSoftmax(dim=-1)
  )
)
propagate done
init label
Split: 01, Run: 01
None time:  1.1169191428925842
None Run 01:
Highest Train: 100.00
Highest Valid: 71.40
  Final Train: 93.33
   Final Test: 69.00
Split: 01, Run: 02
None time:  1.1224834700115025
None Run 02:
Highest Train: 100.00
Highest Valid: 72.20
  Final Train: 93.33
   Final Test: 69.80
Split: 01, Run: 03
None time:  1.062565433094278
None Run 03:
Highest Train: 100.00
Highest Valid: 71.80
  Final Train: 90.83
   Final Test: 70.20
run time now: 3.3438472747802734
total time:  3.391917717177421
None All runs:
Highest Train: 100.00 ± 0.00
Highest Valid: 71.80 ± 0.40
  Final Train: 92.50 ± 1.44
   Final Test: 69.67 ± 0.61
[I 2023-06-11 23:43:40,492] Trial 363 finished with value: 71.80000305175781 and parameters: {'Fwd': 0.04785129146274146, 'K': 9, 'alpha': 0.75, 'dropout': 0.8, 'gnnepoch': 120, 'lambda1': 0.75, 'lambda2': 0.022829691335434, 'loop': 0, 'loss': 'CE', 'lr': 0.0013266095736393006, 'softmaxF': False, 'useGCN': True, 'weight_decay': 1.5280530224109196e-05, 'weightedloss': True}. Best is trial 271 with value: 72.06666564941406.
/home/wxy/miniconda3/lib/python3.10/site-packages/optuna/distributions.py:685: UserWarning: The distribution is specified by [0, 1.00001] and step=0.05, but the range is not divisible by `step`. It will be replaced by [0, 1.0].
  warnings.warn(
K:  8
alpha:  0.7000000000000001
lr:  0.00011713711315915693
weight_decay:  4.504939207610779e-05
dropout:  0.8
fix split and run 3 times
Data: Data(x=[3327, 3703], y=[3327], train_mask=[3327], val_mask=[3327], test_mask=[3327], adj_t=[3327, 3327, nnz=9104])
num_train tensor(120)
num_noise 0
noise: tensor(0)
data feature 3703
ALTOPT(
  (lins): Sequential(
    (0): Linear(in_features=3703, out_features=64, bias=True)
    (1): BatchNorm1d(64, eps=1e-05, momentum=0.1, affine=True, track_running_stats=True)
    (2): Dropout(p=0.8, inplace=True)
    (3): ReLU(inplace=True)
    (4): Linear(in_features=64, out_features=6, bias=True)
    (5): LogSoftmax(dim=-1)
  )
  (prop): Propagation(K=8, mode=None, lambda1=None, lambda2=None, L21=True, alpha=0.7000000000000001)
  (gcn): GCN(
    (convs): ModuleList(
      (0): GCNConv(3703, 64)
      (1): GCNConv(64, 6)
    )
    (bns): ModuleList(
      (0): BatchNorm1d(64, eps=1e-05, momentum=0.1, affine=True, track_running_stats=True)
    )
    (output): LogSoftmax(dim=-1)
  )
)
propagate done
init label
Split: 01, Run: 01, Epoch: 100, Loss: 0.0000, Train: 100.00%, Valid: 67.20% Test: 66.60%
Split: 01, Run: 01
None time:  1.9214870480354875
None Run 01:
Highest Train: 100.00
Highest Valid: 67.20
  Final Train: 100.00
   Final Test: 66.50
Split: 01, Run: 02
None time:  1.0978943780064583
None Run 02:
Highest Train: 100.00
Highest Valid: 66.80
  Final Train: 100.00
   Final Test: 68.00
Split: 01, Run: 03, Epoch: 100, Loss: 0.0000, Train: 100.00%, Valid: 66.00% Test: 69.00%
Split: 01, Run: 03
None time:  1.8729016981087625
None Run 03:
Highest Train: 100.00
Highest Valid: 66.00
  Final Train: 100.00
   Final Test: 69.10
run time now: 4.933003902435303
total time:  4.981060005025938
None All runs:
Highest Train: 100.00 ± 0.00
Highest Valid: 66.67 ± 0.61
  Final Train: 100.00 ± 0.00
   Final Test: 67.87 ± 1.31
[I 2023-06-11 23:43:45,961] Trial 364 finished with value: 66.66666412353516 and parameters: {'Fwd': 0.026363388315959354, 'K': 8, 'alpha': 0.7000000000000001, 'dropout': 0.8, 'gnnepoch': 120, 'lambda1': 0.55, 'lambda2': 6.068230250921143, 'loop': 0, 'loss': 'CE', 'lr': 0.00011713711315915693, 'softmaxF': False, 'useGCN': True, 'weight_decay': 4.504939207610779e-05, 'weightedloss': True}. Best is trial 271 with value: 72.06666564941406.
/home/wxy/miniconda3/lib/python3.10/site-packages/optuna/distributions.py:685: UserWarning: The distribution is specified by [0, 1.00001] and step=0.05, but the range is not divisible by `step`. It will be replaced by [0, 1.0].
  warnings.warn(
K:  8
alpha:  0.7000000000000001
lr:  0.0010962329796640265
weight_decay:  1.257365020272562e-05
dropout:  0.8
fix split and run 3 times
Data: Data(x=[3327, 3703], y=[3327], train_mask=[3327], val_mask=[3327], test_mask=[3327], adj_t=[3327, 3327, nnz=9104])
num_train tensor(120)
num_noise 0
noise: tensor(0)
data feature 3703
ALTOPT(
  (lins): Sequential(
    (0): Linear(in_features=3703, out_features=64, bias=True)
    (1): BatchNorm1d(64, eps=1e-05, momentum=0.1, affine=True, track_running_stats=True)
    (2): Dropout(p=0.8, inplace=True)
    (3): ReLU(inplace=True)
    (4): Linear(in_features=64, out_features=6, bias=True)
    (5): LogSoftmax(dim=-1)
  )
  (prop): Propagation(K=8, mode=None, lambda1=None, lambda2=None, L21=True, alpha=0.7000000000000001)
  (gcn): GCN(
    (convs): ModuleList(
      (0): GCNConv(3703, 64)
      (1): GCNConv(64, 6)
    )
    (bns): ModuleList(
      (0): BatchNorm1d(64, eps=1e-05, momentum=0.1, affine=True, track_running_stats=True)
    )
    (output): LogSoftmax(dim=-1)
  )
)
propagate done
init label
Split: 01, Run: 01
None time:  0.9406531529966742
None Run 01:
Highest Train: 100.00
Highest Valid: 70.80
  Final Train: 100.00
   Final Test: 69.50
Split: 01, Run: 02
None time:  1.115659911185503
None Run 02:
Highest Train: 100.00
Highest Valid: 72.40
  Final Train: 100.00
   Final Test: 69.70
Split: 01, Run: 03, Epoch: 100, Loss: 0.0000, Train: 100.00%, Valid: 70.80% Test: 70.60%
Split: 01, Run: 03
None time:  1.9039981469977647
None Run 03:
Highest Train: 100.00
Highest Valid: 70.80
  Final Train: 100.00
   Final Test: 69.90
run time now: 4.005177974700928
total time:  4.061327855102718
None All runs:
Highest Train: 100.00 ± 0.00
Highest Valid: 71.33 ± 0.92
  Final Train: 100.00 ± 0.00
   Final Test: 69.70 ± 0.20
[I 2023-06-11 23:43:50,508] Trial 365 finished with value: 71.33333587646484 and parameters: {'Fwd': 0.06365729607337994, 'K': 8, 'alpha': 0.7000000000000001, 'dropout': 0.8, 'gnnepoch': 120, 'lambda1': 0.65, 'lambda2': 6.328716895049642, 'loop': 0, 'loss': 'CE', 'lr': 0.0010962329796640265, 'softmaxF': False, 'useGCN': True, 'weight_decay': 1.257365020272562e-05, 'weightedloss': True}. Best is trial 271 with value: 72.06666564941406.
/home/wxy/miniconda3/lib/python3.10/site-packages/optuna/distributions.py:685: UserWarning: The distribution is specified by [0, 1.00001] and step=0.05, but the range is not divisible by `step`. It will be replaced by [0, 1.0].
  warnings.warn(
K:  8
alpha:  0.75
lr:  0.0015163918979456618
weight_decay:  0.0007213984327642676
dropout:  0.8
fix split and run 3 times
Data: Data(x=[3327, 3703], y=[3327], train_mask=[3327], val_mask=[3327], test_mask=[3327], adj_t=[3327, 3327, nnz=9104])
num_train tensor(120)
num_noise 0
noise: tensor(0)
data feature 3703
ALTOPT(
  (lins): Sequential(
    (0): Linear(in_features=3703, out_features=64, bias=True)
    (1): BatchNorm1d(64, eps=1e-05, momentum=0.1, affine=True, track_running_stats=True)
    (2): Dropout(p=0.8, inplace=True)
    (3): ReLU(inplace=True)
    (4): Linear(in_features=64, out_features=6, bias=True)
    (5): LogSoftmax(dim=-1)
  )
  (prop): Propagation(K=8, mode=None, lambda1=None, lambda2=None, L21=True, alpha=0.75)
  (gcn): GCN(
    (convs): ModuleList(
      (0): GCNConv(3703, 64)
      (1): GCNConv(64, 6)
    )
    (bns): ModuleList(
      (0): BatchNorm1d(64, eps=1e-05, momentum=0.1, affine=True, track_running_stats=True)
    )
    (output): LogSoftmax(dim=-1)
  )
)
propagate done
init label
Split: 01, Run: 01
None time:  1.0024311009328812
None Run 01:
Highest Train: 100.00
Highest Valid: 71.00
  Final Train: 100.00
   Final Test: 69.80
Split: 01, Run: 02, Epoch: 100, Loss: 0.0000, Train: 100.00%, Valid: 68.60% Test: 68.40%
Split: 01, Run: 02
None time:  1.8121333660092205
None Run 02:
Highest Train: 100.00
Highest Valid: 68.60
  Final Train: 100.00
   Final Test: 68.90
Split: 01, Run: 03
None time:  0.9996442408300936
None Run 03:
Highest Train: 100.00
Highest Valid: 71.60
  Final Train: 100.00
   Final Test: 70.40
run time now: 3.8552849292755127
total time:  3.9114943330641836
None All runs:
Highest Train: 100.00 ± 0.00
Highest Valid: 70.40 ± 1.59
  Final Train: 100.00 ± 0.00
   Final Test: 69.70 ± 0.75
[I 2023-06-11 23:43:54,866] Trial 366 finished with value: 70.4000015258789 and parameters: {'Fwd': 0.04547573107976609, 'K': 8, 'alpha': 0.75, 'dropout': 0.8, 'gnnepoch': 110, 'lambda1': 0.7000000000000001, 'lambda2': 5.108018179929133, 'loop': 0, 'loss': 'CE', 'lr': 0.0015163918979456618, 'softmaxF': False, 'useGCN': True, 'weight_decay': 0.0007213984327642676, 'weightedloss': True}. Best is trial 271 with value: 72.06666564941406.
/home/wxy/miniconda3/lib/python3.10/site-packages/optuna/distributions.py:685: UserWarning: The distribution is specified by [0, 1.00001] and step=0.05, but the range is not divisible by `step`. It will be replaced by [0, 1.0].
  warnings.warn(
K:  8
alpha:  0.8
lr:  0.001465696288319268
weight_decay:  1.7611614192194284e-05
dropout:  0.6000000000000001
fix split and run 3 times
Data: Data(x=[3327, 3703], y=[3327], train_mask=[3327], val_mask=[3327], test_mask=[3327], adj_t=[3327, 3327, nnz=9104])
num_train tensor(120)
num_noise 0
noise: tensor(0)
data feature 3703
ALTOPT(
  (lins): Sequential(
    (0): Linear(in_features=3703, out_features=64, bias=True)
    (1): BatchNorm1d(64, eps=1e-05, momentum=0.1, affine=True, track_running_stats=True)
    (2): Dropout(p=0.6000000000000001, inplace=True)
    (3): ReLU(inplace=True)
    (4): Linear(in_features=64, out_features=6, bias=True)
    (5): LogSoftmax(dim=-1)
  )
  (prop): Propagation(K=8, mode=None, lambda1=None, lambda2=None, L21=True, alpha=0.8)
  (gcn): GCN(
    (convs): ModuleList(
      (0): GCNConv(3703, 64)
      (1): GCNConv(64, 6)
    )
    (bns): ModuleList(
      (0): BatchNorm1d(64, eps=1e-05, momentum=0.1, affine=True, track_running_stats=True)
    )
    (output): LogSoftmax(dim=-1)
  )
)
propagate done
init label
Split: 01, Run: 01
None time:  0.5027139810845256
None Run 01:
Highest Train: 100.00
Highest Valid: 70.40
  Final Train: 100.00
   Final Test: 69.70
Split: 01, Run: 02
None time:  0.50640774006024
None Run 02:
Highest Train: 100.00
Highest Valid: 71.60
  Final Train: 100.00
   Final Test: 69.20
Split: 01, Run: 03
None time:  0.46824336308054626
None Run 03:
Highest Train: 100.00
Highest Valid: 71.00
  Final Train: 100.00
   Final Test: 70.00
run time now: 1.5283396244049072
total time:  1.5805022870190442
None All runs:
Highest Train: 100.00 ± 0.00
Highest Valid: 71.00 ± 0.60
  Final Train: 100.00 ± 0.00
   Final Test: 69.63 ± 0.40
[I 2023-06-11 23:43:56,929] Trial 367 finished with value: 71.0 and parameters: {'Fwd': 0.03390303781841875, 'K': 8, 'alpha': 0.8, 'dropout': 0.6000000000000001, 'gnnepoch': 50, 'lambda1': 0.75, 'lambda2': 1.5428589241835242, 'loop': 0, 'loss': 'CE', 'lr': 0.001465696288319268, 'softmaxF': False, 'useGCN': True, 'weight_decay': 1.7611614192194284e-05, 'weightedloss': True}. Best is trial 271 with value: 72.06666564941406.
/home/wxy/miniconda3/lib/python3.10/site-packages/optuna/distributions.py:685: UserWarning: The distribution is specified by [0, 1.00001] and step=0.05, but the range is not divisible by `step`. It will be replaced by [0, 1.0].
  warnings.warn(
K:  8
alpha:  0.45
lr:  0.007139402970833544
weight_decay:  2.2672555490333875e-05
dropout:  0.8
fix split and run 3 times
Data: Data(x=[3327, 3703], y=[3327], train_mask=[3327], val_mask=[3327], test_mask=[3327], adj_t=[3327, 3327, nnz=9104])
num_train tensor(120)
num_noise 0
noise: tensor(0)
data feature 3703
ALTOPT(
  (lins): Sequential(
    (0): Linear(in_features=3703, out_features=64, bias=True)
    (1): BatchNorm1d(64, eps=1e-05, momentum=0.1, affine=True, track_running_stats=True)
    (2): Dropout(p=0.8, inplace=True)
    (3): ReLU(inplace=True)
    (4): Linear(in_features=64, out_features=6, bias=True)
    (5): LogSoftmax(dim=-1)
  )
  (prop): Propagation(K=8, mode=None, lambda1=None, lambda2=None, L21=True, alpha=0.45)
  (gcn): GCN(
    (convs): ModuleList(
      (0): GCNConv(3703, 64)
      (1): GCNConv(64, 6)
    )
    (bns): ModuleList(
      (0): BatchNorm1d(64, eps=1e-05, momentum=0.1, affine=True, track_running_stats=True)
    )
    (output): LogSoftmax(dim=-1)
  )
)
propagate done
init label
Split: 01, Run: 01, Epoch: 100, Loss: 0.0000, Train: 100.00%, Valid: 70.00% Test: 70.20%
Split: 01, Run: 01
None time:  1.718558836961165
None Run 01:
Highest Train: 100.00
Highest Valid: 70.00
  Final Train: 100.00
   Final Test: 70.10
Split: 01, Run: 02, Epoch: 100, Loss: 0.0000, Train: 100.00%, Valid: 69.60% Test: 69.10%
Split: 01, Run: 02
None time:  1.7855039190035313
None Run 02:
Highest Train: 100.00
Highest Valid: 69.60
  Final Train: 100.00
   Final Test: 69.10
Split: 01, Run: 03
None time:  1.1652508249972016
None Run 03:
Highest Train: 100.00
Highest Valid: 70.40
  Final Train: 100.00
   Final Test: 69.50
run time now: 4.716763496398926
total time:  4.775444564176723
None All runs:
Highest Train: 100.00 ± 0.00
Highest Valid: 70.00 ± 0.40
  Final Train: 100.00 ± 0.00
   Final Test: 69.57 ± 0.50
