[I 2023-06-11 23:52:18,333] Trial 494 finished with value: 71.20000457763672 and parameters: {'Fwd': 1.8303149503205788e-06, 'K': 9, 'alpha': 0.9, 'dropout': 0.8, 'gnnepoch': 120, 'lambda1': 0.75, 'lambda2': 9.75694861852551, 'loop': 0, 'loss': 'CE', 'lr': 0.001058413311091664, 'softmaxF': False, 'useGCN': True, 'weight_decay': 0.0007430896763539266, 'weightedloss': True}. Best is trial 271 with value: 72.06666564941406.
/home/wxy/miniconda3/lib/python3.10/site-packages/optuna/distributions.py:685: UserWarning: The distribution is specified by [0, 1.00001] and step=0.05, but the range is not divisible by `step`. It will be replaced by [0, 1.0].
  warnings.warn(
K:  8
alpha:  0.8500000000000001
lr:  0.0012721707624720692
weight_decay:  0.000669457562083755
dropout:  0.8
fix split and run 3 times
Data: Data(x=[3327, 3703], y=[3327], train_mask=[3327], val_mask=[3327], test_mask=[3327], adj_t=[3327, 3327, nnz=9104])
num_train tensor(120)
num_noise 0
noise: tensor(0)
data feature 3703
ALTOPT(
  (lins): Sequential(
    (0): Linear(in_features=3703, out_features=64, bias=True)
    (1): BatchNorm1d(64, eps=1e-05, momentum=0.1, affine=True, track_running_stats=True)
    (2): Dropout(p=0.8, inplace=True)
    (3): ReLU(inplace=True)
    (4): Linear(in_features=64, out_features=6, bias=True)
    (5): LogSoftmax(dim=-1)
  )
  (prop): Propagation(K=8, mode=None, lambda1=None, lambda2=None, L21=True, alpha=0.8500000000000001)
  (gcn): GCN(
    (convs): ModuleList(
      (0): GCNConv(3703, 64)
      (1): GCNConv(64, 6)
    )
    (bns): ModuleList(
      (0): BatchNorm1d(64, eps=1e-05, momentum=0.1, affine=True, track_running_stats=True)
    )
    (output): LogSoftmax(dim=-1)
  )
)
propagate done
init label
Split: 01, Run: 01
None time:  0.9228700581006706
None Run 01:
Highest Train: 100.00
Highest Valid: 70.80
  Final Train: 100.00
   Final Test: 70.00
Split: 01, Run: 02
None time:  0.9922337019816041
None Run 02:
Highest Train: 100.00
Highest Valid: 68.60
  Final Train: 100.00
   Final Test: 67.60
Split: 01, Run: 03
None time:  0.8726411070674658
None Run 03:
Highest Train: 100.00
Highest Valid: 71.00
  Final Train: 100.00
   Final Test: 70.60
run time now: 2.8318495750427246
total time:  2.8786696549504995
None All runs:
Highest Train: 100.00 ± 0.00
Highest Valid: 70.13 ± 1.33
  Final Train: 100.00 ± 0.00
   Final Test: 69.40 ± 1.59
[I 2023-06-11 23:52:21,792] Trial 495 finished with value: 70.13333129882812 and parameters: {'Fwd': 1.291648770246693e-06, 'K': 8, 'alpha': 0.8500000000000001, 'dropout': 0.8, 'gnnepoch': 110, 'lambda1': 0.75, 'lambda2': 9.705327566130514, 'loop': 0, 'loss': 'CE', 'lr': 0.0012721707624720692, 'softmaxF': False, 'useGCN': True, 'weight_decay': 0.000669457562083755, 'weightedloss': True}. Best is trial 271 with value: 72.06666564941406.
/home/wxy/miniconda3/lib/python3.10/site-packages/optuna/distributions.py:685: UserWarning: The distribution is specified by [0, 1.00001] and step=0.05, but the range is not divisible by `step`. It will be replaced by [0, 1.0].
  warnings.warn(
K:  8
alpha:  0.8
lr:  0.0056787086803857315
weight_decay:  0.0009123983231916805
dropout:  0.8
fix split and run 3 times
Data: Data(x=[3327, 3703], y=[3327], train_mask=[3327], val_mask=[3327], test_mask=[3327], adj_t=[3327, 3327, nnz=9104])
num_train tensor(120)
num_noise 0
noise: tensor(0)
data feature 3703
ALTOPT(
  (lins): Sequential(
    (0): Linear(in_features=3703, out_features=64, bias=True)
    (1): BatchNorm1d(64, eps=1e-05, momentum=0.1, affine=True, track_running_stats=True)
    (2): Dropout(p=0.8, inplace=True)
    (3): ReLU(inplace=True)
    (4): Linear(in_features=64, out_features=6, bias=True)
    (5): LogSoftmax(dim=-1)
  )
  (prop): Propagation(K=8, mode=None, lambda1=None, lambda2=None, L21=True, alpha=0.8)
  (gcn): GCN(
    (convs): ModuleList(
      (0): GCNConv(3703, 64)
      (1): GCNConv(64, 6)
    )
    (bns): ModuleList(
      (0): BatchNorm1d(64, eps=1e-05, momentum=0.1, affine=True, track_running_stats=True)
    )
    (output): LogSoftmax(dim=-1)
  )
)
propagate done
init label
Split: 01, Run: 01, Epoch: 100, Loss: 0.0000, Train: 100.00%, Valid: 70.60% Test: 70.30%
Split: 01, Run: 01
None time:  1.795812435913831
None Run 01:
Highest Train: 100.00
Highest Valid: 70.60
  Final Train: 100.00
   Final Test: 70.10
Split: 01, Run: 02, Epoch: 100, Loss: 0.0000, Train: 100.00%, Valid: 69.80% Test: 69.40%
Split: 01, Run: 02
None time:  1.8863575460854918
None Run 02:
Highest Train: 100.00
Highest Valid: 69.80
  Final Train: 100.00
   Final Test: 69.30
Split: 01, Run: 03
None time:  1.0943832991179079
None Run 03:
Highest Train: 100.00
Highest Valid: 71.00
  Final Train: 100.00
   Final Test: 69.30
run time now: 4.816721677780151
total time:  4.878626463934779
None All runs:
Highest Train: 100.00 ± 0.00
Highest Valid: 70.47 ± 0.61
  Final Train: 100.00 ± 0.00
   Final Test: 69.57 ± 0.46
[I 2023-06-11 23:52:27,141] Trial 496 finished with value: 70.46666717529297 and parameters: {'Fwd': 0.05405725076145523, 'K': 8, 'alpha': 0.8, 'dropout': 0.8, 'gnnepoch': 120, 'lambda1': 0.6000000000000001, 'lambda2': 9.664569975577471, 'loop': 0, 'loss': 'CE', 'lr': 0.0056787086803857315, 'softmaxF': False, 'useGCN': True, 'weight_decay': 0.0009123983231916805, 'weightedloss': True}. Best is trial 271 with value: 72.06666564941406.
/home/wxy/miniconda3/lib/python3.10/site-packages/optuna/distributions.py:685: UserWarning: The distribution is specified by [0, 1.00001] and step=0.05, but the range is not divisible by `step`. It will be replaced by [0, 1.0].
  warnings.warn(
K:  8
alpha:  0.8500000000000001
lr:  0.001838092394685177
weight_decay:  0.00142277769392129
dropout:  0.8
fix split and run 3 times
Data: Data(x=[3327, 3703], y=[3327], train_mask=[3327], val_mask=[3327], test_mask=[3327], adj_t=[3327, 3327, nnz=9104])
num_train tensor(120)
num_noise 0
noise: tensor(0)
data feature 3703
ALTOPT(
  (lins): Sequential(
    (0): Linear(in_features=3703, out_features=64, bias=True)
    (1): BatchNorm1d(64, eps=1e-05, momentum=0.1, affine=True, track_running_stats=True)
    (2): Dropout(p=0.8, inplace=True)
    (3): ReLU(inplace=True)
    (4): Linear(in_features=64, out_features=6, bias=True)
    (5): LogSoftmax(dim=-1)
  )
  (prop): Propagation(K=8, mode=None, lambda1=None, lambda2=None, L21=True, alpha=0.8500000000000001)
  (gcn): GCN(
    (convs): ModuleList(
      (0): GCNConv(3703, 64)
      (1): GCNConv(64, 6)
    )
    (bns): ModuleList(
      (0): BatchNorm1d(64, eps=1e-05, momentum=0.1, affine=True, track_running_stats=True)
    )
    (output): LogSoftmax(dim=-1)
  )
)
propagate done
init label
Split: 01, Run: 01
None time:  1.0704528749920428
None Run 01:
Highest Train: 100.00
Highest Valid: 71.20
  Final Train: 100.00
   Final Test: 69.90
Split: 01, Run: 02
None time:  1.087226043920964
None Run 02:
Highest Train: 100.00
Highest Valid: 71.80
  Final Train: 100.00
   Final Test: 70.20
Split: 01, Run: 03
None time:  1.0957680421415716
None Run 03:
Highest Train: 100.00
Highest Valid: 71.60
  Final Train: 100.00
   Final Test: 70.00
run time now: 3.29561448097229
total time:  3.346267496002838
None All runs:
Highest Train: 100.00 ± 0.00
Highest Valid: 71.53 ± 0.31
  Final Train: 100.00 ± 0.00
   Final Test: 70.03 ± 0.15
[I 2023-06-11 23:52:30,994] Trial 497 finished with value: 71.53333282470703 and parameters: {'Fwd': 1.60999972778209e-06, 'K': 8, 'alpha': 0.8500000000000001, 'dropout': 0.8, 'gnnepoch': 120, 'lambda1': 0.75, 'lambda2': 9.894679306392804, 'loop': 0, 'loss': 'CE', 'lr': 0.001838092394685177, 'softmaxF': False, 'useGCN': True, 'weight_decay': 0.00142277769392129, 'weightedloss': True}. Best is trial 271 with value: 72.06666564941406.
/home/wxy/miniconda3/lib/python3.10/site-packages/optuna/distributions.py:685: UserWarning: The distribution is specified by [0, 1.00001] and step=0.05, but the range is not divisible by `step`. It will be replaced by [0, 1.0].
  warnings.warn(
K:  8
alpha:  0.9
lr:  0.0011239191620500738
weight_decay:  0.0010352231577794868
dropout:  0.8
fix split and run 3 times
Data: Data(x=[3327, 3703], y=[3327], train_mask=[3327], val_mask=[3327], test_mask=[3327], adj_t=[3327, 3327, nnz=9104])
num_train tensor(120)
num_noise 0
noise: tensor(0)
data feature 3703
ALTOPT(
  (lins): Sequential(
    (0): Linear(in_features=3703, out_features=64, bias=True)
    (1): BatchNorm1d(64, eps=1e-05, momentum=0.1, affine=True, track_running_stats=True)
    (2): Dropout(p=0.8, inplace=True)
    (3): ReLU(inplace=True)
    (4): Linear(in_features=64, out_features=6, bias=True)
    (5): LogSoftmax(dim=-1)
  )
  (prop): Propagation(K=8, mode=None, lambda1=None, lambda2=None, L21=True, alpha=0.9)
  (gcn): GCN(
    (convs): ModuleList(
      (0): GCNConv(3703, 64)
      (1): GCNConv(64, 6)
    )
    (bns): ModuleList(
      (0): BatchNorm1d(64, eps=1e-05, momentum=0.1, affine=True, track_running_stats=True)
    )
    (output): LogSoftmax(dim=-1)
  )
)
propagate done
init label
Split: 01, Run: 01
None time:  0.9195535168983042
None Run 01:
Highest Train: 100.00
Highest Valid: 71.00
  Final Train: 100.00
   Final Test: 70.20
Split: 01, Run: 02
None time:  0.9773180279880762
None Run 02:
Highest Train: 100.00
Highest Valid: 68.40
  Final Train: 100.00
   Final Test: 68.80
Split: 01, Run: 03
None time:  0.9748268350958824
None Run 03:
Highest Train: 100.00
Highest Valid: 70.80
  Final Train: 100.00
   Final Test: 70.70
run time now: 2.917692184448242
total time:  2.9715997797902673
None All runs:
Highest Train: 100.00 ± 0.00
Highest Valid: 70.07 ± 1.45
  Final Train: 100.00 ± 0.00
   Final Test: 69.90 ± 0.98
[I 2023-06-11 23:52:34,470] Trial 498 finished with value: 70.06666564941406 and parameters: {'Fwd': 1.311548333158847e-06, 'K': 8, 'alpha': 0.9, 'dropout': 0.8, 'gnnepoch': 110, 'lambda1': 0.75, 'lambda2': 9.425622543243662, 'loop': 0, 'loss': 'CE', 'lr': 0.0011239191620500738, 'softmaxF': False, 'useGCN': True, 'weight_decay': 0.0010352231577794868, 'weightedloss': True}. Best is trial 271 with value: 72.06666564941406.
/home/wxy/miniconda3/lib/python3.10/site-packages/optuna/distributions.py:685: UserWarning: The distribution is specified by [0, 1.00001] and step=0.05, but the range is not divisible by `step`. It will be replaced by [0, 1.0].
  warnings.warn(
K:  8
alpha:  0.8
lr:  0.0006412627469276547
weight_decay:  0.0005578597005252557
dropout:  0.8
fix split and run 3 times
Data: Data(x=[3327, 3703], y=[3327], train_mask=[3327], val_mask=[3327], test_mask=[3327], adj_t=[3327, 3327, nnz=9104])
num_train tensor(120)
num_noise 0
noise: tensor(0)
data feature 3703
ALTOPT(
  (lins): Sequential(
    (0): Linear(in_features=3703, out_features=64, bias=True)
    (1): BatchNorm1d(64, eps=1e-05, momentum=0.1, affine=True, track_running_stats=True)
    (2): Dropout(p=0.8, inplace=True)
    (3): ReLU(inplace=True)
    (4): Linear(in_features=64, out_features=6, bias=True)
    (5): LogSoftmax(dim=-1)
  )
  (prop): Propagation(K=8, mode=None, lambda1=None, lambda2=None, L21=True, alpha=0.8)
  (gcn): GCN(
    (convs): ModuleList(
      (0): GCNConv(3703, 64)
      (1): GCNConv(64, 6)
    )
    (bns): ModuleList(
      (0): BatchNorm1d(64, eps=1e-05, momentum=0.1, affine=True, track_running_stats=True)
    )
    (output): LogSoftmax(dim=-1)
  )
)
propagate done
init label
Split: 01, Run: 01
None time:  0.7525869298260659
None Run 01:
Highest Train: 100.00
Highest Valid: 62.20
  Final Train: 100.00
   Final Test: 62.00
Split: 01, Run: 02
None time:  0.8089742781594396
None Run 02:
Highest Train: 100.00
Highest Valid: 62.80
  Final Train: 99.17
   Final Test: 62.60
Split: 01, Run: 03
None time:  0.7903074200730771
None Run 03:
Highest Train: 100.00
Highest Valid: 61.60
  Final Train: 100.00
   Final Test: 60.70
run time now: 2.3967761993408203
total time:  2.4571381870191544
None All runs:
Highest Train: 100.00 ± 0.00
Highest Valid: 62.20 ± 0.60
  Final Train: 99.72 ± 0.48
   Final Test: 61.77 ± 0.97
[I 2023-06-11 23:52:37,373] Trial 499 finished with value: 62.20000076293945 and parameters: {'Fwd': 4.126513184258949e-06, 'K': 8, 'alpha': 0.8, 'dropout': 0.8, 'gnnepoch': 120, 'lambda1': 0.75, 'lambda2': 9.539930392670264, 'loop': 0, 'loss': 'CE', 'lr': 0.0006412627469276547, 'softmaxF': False, 'useGCN': False, 'weight_decay': 0.0005578597005252557, 'weightedloss': True}. Best is trial 271 with value: 72.06666564941406.
/home/wxy/miniconda3/lib/python3.10/site-packages/optuna/distributions.py:685: UserWarning: The distribution is specified by [0, 1.00001] and step=0.05, but the range is not divisible by `step`. It will be replaced by [0, 1.0].
  warnings.warn(
K:  8
alpha:  0.8500000000000001
lr:  0.0015248722066404565
weight_decay:  0.0020775542771233595
dropout:  0.8
fix split and run 3 times
Data: Data(x=[3327, 3703], y=[3327], train_mask=[3327], val_mask=[3327], test_mask=[3327], adj_t=[3327, 3327, nnz=9104])
num_train tensor(120)
num_noise 0
noise: tensor(0)
data feature 3703
ALTOPT(
  (lins): Sequential(
    (0): Linear(in_features=3703, out_features=64, bias=True)
    (1): BatchNorm1d(64, eps=1e-05, momentum=0.1, affine=True, track_running_stats=True)
    (2): Dropout(p=0.8, inplace=True)
    (3): ReLU(inplace=True)
    (4): Linear(in_features=64, out_features=6, bias=True)
    (5): LogSoftmax(dim=-1)
  )
  (prop): Propagation(K=8, mode=None, lambda1=None, lambda2=None, L21=True, alpha=0.8500000000000001)
  (gcn): GCN(
    (convs): ModuleList(
      (0): GCNConv(3703, 64)
      (1): GCNConv(64, 6)
    )
    (bns): ModuleList(
      (0): BatchNorm1d(64, eps=1e-05, momentum=0.1, affine=True, track_running_stats=True)
    )
    (output): LogSoftmax(dim=-1)
  )
)
propagate done
init label
Split: 01, Run: 01
None time:  1.0242245581466705
None Run 01:
Highest Train: 100.00
Highest Valid: 71.40
  Final Train: 100.00
   Final Test: 69.50
Split: 01, Run: 02
None time:  0.9683453869074583
None Run 02:
Highest Train: 100.00
Highest Valid: 72.00
  Final Train: 100.00
   Final Test: 70.20
Split: 01, Run: 03
None time:  1.1529852449893951
None Run 03:
Highest Train: 100.00
Highest Valid: 71.60
  Final Train: 100.00
   Final Test: 70.60
run time now: 3.187350273132324
total time:  3.2462652681861073
None All runs:
Highest Train: 100.00 ± 0.00
Highest Valid: 71.67 ± 0.31
  Final Train: 100.00 ± 0.00
   Final Test: 70.10 ± 0.56
[I 2023-06-11 23:52:41,159] Trial 500 finished with value: 71.66666412353516 and parameters: {'Fwd': 2.459995395922561e-06, 'K': 8, 'alpha': 0.8500000000000001, 'dropout': 0.8, 'gnnepoch': 120, 'lambda1': 0.6000000000000001, 'lambda2': 6.965856644780486, 'loop': 0, 'loss': 'CE', 'lr': 0.0015248722066404565, 'softmaxF': True, 'useGCN': True, 'weight_decay': 0.0020775542771233595, 'weightedloss': True}. Best is trial 271 with value: 72.06666564941406.
/home/wxy/miniconda3/lib/python3.10/site-packages/optuna/distributions.py:685: UserWarning: The distribution is specified by [0, 1.00001] and step=0.05, but the range is not divisible by `step`. It will be replaced by [0, 1.0].
  warnings.warn(
K:  8
alpha:  0.9
lr:  0.00124919295297575
weight_decay:  0.001335056369364972
dropout:  0.8
fix split and run 3 times
Data: Data(x=[3327, 3703], y=[3327], train_mask=[3327], val_mask=[3327], test_mask=[3327], adj_t=[3327, 3327, nnz=9104])
num_train tensor(120)
num_noise 0
noise: tensor(0)
data feature 3703
ALTOPT(
  (lins): Sequential(
    (0): Linear(in_features=3703, out_features=64, bias=True)
    (1): BatchNorm1d(64, eps=1e-05, momentum=0.1, affine=True, track_running_stats=True)
    (2): Dropout(p=0.8, inplace=True)
    (3): ReLU(inplace=True)
    (4): Linear(in_features=64, out_features=6, bias=True)
    (5): LogSoftmax(dim=-1)
  )
  (prop): Propagation(K=8, mode=None, lambda1=None, lambda2=None, L21=True, alpha=0.9)
  (gcn): GCN(
    (convs): ModuleList(
      (0): GCNConv(3703, 64)
      (1): GCNConv(64, 6)
    )
    (bns): ModuleList(
      (0): BatchNorm1d(64, eps=1e-05, momentum=0.1, affine=True, track_running_stats=True)
    )
    (output): LogSoftmax(dim=-1)
  )
)
propagate done
init label
Split: 01, Run: 01
None time:  0.8524976880289614
None Run 01:
Highest Train: 100.00
Highest Valid: 70.80
  Final Train: 100.00
   Final Test: 70.00
Split: 01, Run: 02
None time:  0.9613557250704616
None Run 02:
Highest Train: 100.00
Highest Valid: 69.80
  Final Train: 100.00
   Final Test: 69.10
Split: 01, Run: 03
None time:  0.934114808915183
None Run 03:
Highest Train: 100.00
Highest Valid: 71.60
  Final Train: 100.00
   Final Test: 69.30
run time now: 2.7887840270996094
total time:  2.8346307040192187
None All runs:
Highest Train: 100.00 ± 0.00
Highest Valid: 70.73 ± 0.90
  Final Train: 100.00 ± 0.00
   Final Test: 69.47 ± 0.47
[I 2023-06-11 23:52:44,629] Trial 501 finished with value: 70.73333740234375 and parameters: {'Fwd': 0.0022928645691567976, 'K': 8, 'alpha': 0.9, 'dropout': 0.8, 'gnnepoch': 100, 'lambda1': 0.75, 'lambda2': 7.153487519664156, 'loop': 0, 'loss': 'CE', 'lr': 0.00124919295297575, 'softmaxF': False, 'useGCN': True, 'weight_decay': 0.001335056369364972, 'weightedloss': True}. Best is trial 271 with value: 72.06666564941406.
/home/wxy/miniconda3/lib/python3.10/site-packages/optuna/distributions.py:685: UserWarning: The distribution is specified by [0, 1.00001] and step=0.05, but the range is not divisible by `step`. It will be replaced by [0, 1.0].
  warnings.warn(
K:  8
alpha:  0.8500000000000001
lr:  0.0014092938980538546
weight_decay:  0.00046602529145832537
dropout:  0.7000000000000001
fix split and run 3 times
Data: Data(x=[3327, 3703], y=[3327], train_mask=[3327], val_mask=[3327], test_mask=[3327], adj_t=[3327, 3327, nnz=9104])
num_train tensor(120)
num_noise 0
noise: tensor(0)
data feature 3703
ALTOPT(
  (lins): Sequential(
    (0): Linear(in_features=3703, out_features=64, bias=True)
    (1): BatchNorm1d(64, eps=1e-05, momentum=0.1, affine=True, track_running_stats=True)
    (2): Dropout(p=0.7000000000000001, inplace=True)
    (3): ReLU(inplace=True)
    (4): Linear(in_features=64, out_features=6, bias=True)
    (5): LogSoftmax(dim=-1)
  )
  (prop): Propagation(K=8, mode=None, lambda1=None, lambda2=None, L21=True, alpha=0.8500000000000001)
  (gcn): GCN(
    (convs): ModuleList(
      (0): GCNConv(3703, 64)
      (1): GCNConv(64, 6)
    )
    (bns): ModuleList(
      (0): BatchNorm1d(64, eps=1e-05, momentum=0.1, affine=True, track_running_stats=True)
    )
    (output): LogSoftmax(dim=-1)
  )
)
propagate done
init label
Split: 01, Run: 01
None time:  0.8680549471173435
None Run 01:
Highest Train: 100.00
Highest Valid: 71.40
  Final Train: 100.00
   Final Test: 69.60
Split: 01, Run: 02
None time:  0.896019778912887
None Run 02:
Highest Train: 100.00
Highest Valid: 72.40
  Final Train: 100.00
   Final Test: 70.30
Split: 01, Run: 03
None time:  0.8450927007943392
None Run 03:
Highest Train: 100.00
Highest Valid: 70.00
  Final Train: 100.00
   Final Test: 68.80
run time now: 2.6497700214385986
total time:  2.70189452287741
None All runs:
Highest Train: 100.00 ± 0.00
Highest Valid: 71.27 ± 1.21
  Final Train: 100.00 ± 0.00
   Final Test: 69.57 ± 0.75
[I 2023-06-11 23:52:47,907] Trial 502 finished with value: 71.26666259765625 and parameters: {'Fwd': 3.4007282449732212e-06, 'K': 8, 'alpha': 0.8500000000000001, 'dropout': 0.7000000000000001, 'gnnepoch': 90, 'lambda1': 0.8, 'lambda2': 6.449128374219573, 'loop': 0, 'loss': 'CE', 'lr': 0.0014092938980538546, 'softmaxF': False, 'useGCN': True, 'weight_decay': 0.00046602529145832537, 'weightedloss': True}. Best is trial 271 with value: 72.06666564941406.
/home/wxy/miniconda3/lib/python3.10/site-packages/optuna/distributions.py:685: UserWarning: The distribution is specified by [0, 1.00001] and step=0.05, but the range is not divisible by `step`. It will be replaced by [0, 1.0].
  warnings.warn(
K:  8
alpha:  0.8
lr:  0.0009636203837900827
weight_decay:  5.3878766489642544e-05
dropout:  0.8
fix split and run 3 times
Data: Data(x=[3327, 3703], y=[3327], train_mask=[3327], val_mask=[3327], test_mask=[3327], adj_t=[3327, 3327, nnz=9104])
num_train tensor(120)
num_noise 0
noise: tensor(0)
data feature 3703
ALTOPT(
  (lins): Sequential(
    (0): Linear(in_features=3703, out_features=64, bias=True)
    (1): BatchNorm1d(64, eps=1e-05, momentum=0.1, affine=True, track_running_stats=True)
    (2): Dropout(p=0.8, inplace=True)
    (3): ReLU(inplace=True)
    (4): Linear(in_features=64, out_features=6, bias=True)
    (5): LogSoftmax(dim=-1)
  )
  (prop): Propagation(K=8, mode=None, lambda1=None, lambda2=None, L21=True, alpha=0.8)
  (gcn): GCN(
    (convs): ModuleList(
      (0): GCNConv(3703, 64)
      (1): GCNConv(64, 6)
    )
    (bns): ModuleList(
      (0): BatchNorm1d(64, eps=1e-05, momentum=0.1, affine=True, track_running_stats=True)
    )
    (output): LogSoftmax(dim=-1)
  )
)
propagate done
init label
Split: 01, Run: 01
None time:  1.039920340059325
None Run 01:
Highest Train: 100.00
Highest Valid: 70.40
  Final Train: 100.00
   Final Test: 69.40
Split: 01, Run: 02
None time:  1.0629896139726043
None Run 02:
Highest Train: 100.00
Highest Valid: 72.20
  Final Train: 100.00
   Final Test: 69.90
Split: 01, Run: 03
None time:  1.0974441750440747
None Run 03:
Highest Train: 100.00
Highest Valid: 71.00
  Final Train: 100.00
   Final Test: 70.40
run time now: 3.2430825233459473
total time:  3.3102884620893747
None All runs:
Highest Train: 100.00 ± 0.00
Highest Valid: 71.20 ± 0.92
  Final Train: 100.00 ± 0.00
   Final Test: 69.90 ± 0.50
