[I 2023-06-12 00:24:09,991] Trial 115 finished with value: 81.4000015258789 and parameters: {'Fwd': 0.09923243217856093, 'K': 10, 'alpha': 0.45, 'dropout': 0.5, 'gnnepoch': 60, 'lambda1': 0.75, 'lambda2': 5.248325838148042, 'loop': 1, 'loss': 'CE', 'lr': 0.008024973644460373, 'softmaxF': True, 'useGCN': True, 'weight_decay': 2.968536121095511e-05, 'weightedloss': True}. Best is trial 112 with value: 81.66667175292969.
/home/wxy/miniconda3/lib/python3.10/site-packages/optuna/distributions.py:685: UserWarning: The distribution is specified by [0, 1.00001] and step=0.05, but the range is not divisible by `step`. It will be replaced by [0, 1.0].
  warnings.warn(
K:  10
alpha:  0.45
lr:  0.00973992056909721
weight_decay:  7.162493707023494e-05
dropout:  0.5
fix split and run 3 times
Data: Data(x=[2708, 1433], y=[2708], train_mask=[2708], val_mask=[2708], test_mask=[2708], adj_t=[2708, 2708, nnz=10556])
num_train tensor(140)
num_noise 0
noise: tensor(0)
data feature 1433
ALTOPT(
  (lins): Sequential(
    (0): Linear(in_features=1433, out_features=64, bias=True)
    (1): BatchNorm1d(64, eps=1e-05, momentum=0.1, affine=True, track_running_stats=True)
    (2): Dropout(p=0.5, inplace=True)
    (3): ReLU(inplace=True)
    (4): Linear(in_features=64, out_features=7, bias=True)
    (5): LogSoftmax(dim=-1)
  )
  (prop): Propagation(K=10, mode=None, lambda1=None, lambda2=None, L21=True, alpha=0.45)
  (gcn): GCN(
    (convs): ModuleList(
      (0): GCNConv(1433, 64)
      (1): GCNConv(64, 7)
    )
    (bns): ModuleList(
      (0): BatchNorm1d(64, eps=1e-05, momentum=0.1, affine=True, track_running_stats=True)
    )
    (output): LogSoftmax(dim=-1)
  )
)
propagate done
init label
Split: 01, Run: 01
None time:  2.294262956827879
None Run 01:
Highest Train: 100.00
Highest Valid: 82.00
  Final Train: 100.00
   Final Test: 83.50
Split: 01, Run: 02
None time:  2.328744155121967
None Run 02:
Highest Train: 100.00
Highest Valid: 81.40
  Final Train: 100.00
   Final Test: 83.70
Split: 01, Run: 03
None time:  1.8848967999219894
None Run 03:
Highest Train: 100.00
Highest Valid: 81.20
  Final Train: 100.00
   Final Test: 81.10
run time now: 6.539646148681641
total time:  6.558962458977476
None All runs:
Highest Train: 100.00 ± 0.00
Highest Valid: 81.53 ± 0.42
  Final Train: 100.00 ± 0.00
   Final Test: 82.77 ± 1.45
[I 2023-06-12 00:24:17,089] Trial 116 finished with value: 81.53333282470703 and parameters: {'Fwd': 0.09928831413019795, 'K': 10, 'alpha': 0.45, 'dropout': 0.5, 'gnnepoch': 70, 'lambda1': 0.75, 'lambda2': 5.321085257352176, 'loop': 1, 'loss': 'CE', 'lr': 0.00973992056909721, 'softmaxF': True, 'useGCN': True, 'weight_decay': 7.162493707023494e-05, 'weightedloss': True}. Best is trial 112 with value: 81.66667175292969.
/home/wxy/miniconda3/lib/python3.10/site-packages/optuna/distributions.py:685: UserWarning: The distribution is specified by [0, 1.00001] and step=0.05, but the range is not divisible by `step`. It will be replaced by [0, 1.0].
  warnings.warn(
K:  10
alpha:  0.45
lr:  0.00999579269870759
weight_decay:  4.7443572536572425e-05
dropout:  0.6000000000000001
fix split and run 3 times
Data: Data(x=[2708, 1433], y=[2708], train_mask=[2708], val_mask=[2708], test_mask=[2708], adj_t=[2708, 2708, nnz=10556])
num_train tensor(140)
num_noise 0
noise: tensor(0)
data feature 1433
ALTOPT(
  (lins): Sequential(
    (0): Linear(in_features=1433, out_features=64, bias=True)
    (1): BatchNorm1d(64, eps=1e-05, momentum=0.1, affine=True, track_running_stats=True)
    (2): Dropout(p=0.6000000000000001, inplace=True)
    (3): ReLU(inplace=True)
    (4): Linear(in_features=64, out_features=7, bias=True)
    (5): LogSoftmax(dim=-1)
  )
  (prop): Propagation(K=10, mode=None, lambda1=None, lambda2=None, L21=True, alpha=0.45)
  (gcn): GCN(
    (convs): ModuleList(
      (0): GCNConv(1433, 64)
      (1): GCNConv(64, 7)
    )
    (bns): ModuleList(
      (0): BatchNorm1d(64, eps=1e-05, momentum=0.1, affine=True, track_running_stats=True)
    )
    (output): LogSoftmax(dim=-1)
  )
)
propagate done
init label
Split: 01, Run: 01
None time:  2.7423935460392386
None Run 01:
Highest Train: 100.00
Highest Valid: 81.40
  Final Train: 100.00
   Final Test: 82.90
Split: 01, Run: 02
None time:  1.9135322507936507
None Run 02:
Highest Train: 100.00
Highest Valid: 80.80
  Final Train: 100.00
   Final Test: 83.10
Split: 01, Run: 03
None time:  1.9479130969848484
None Run 03:
Highest Train: 100.00
Highest Valid: 81.00
  Final Train: 100.00
   Final Test: 82.60
run time now: 6.629805564880371
total time:  6.654338313033804
None All runs:
Highest Train: 100.00 ± 0.00
Highest Valid: 81.07 ± 0.31
  Final Train: 100.00 ± 0.00
   Final Test: 82.87 ± 0.25
[I 2023-06-12 00:24:24,231] Trial 117 finished with value: 81.0666732788086 and parameters: {'Fwd': 0.0843082745500414, 'K': 10, 'alpha': 0.45, 'dropout': 0.6000000000000001, 'gnnepoch': 70, 'lambda1': 0.75, 'lambda2': 5.287957230749865, 'loop': 1, 'loss': 'CE', 'lr': 0.00999579269870759, 'softmaxF': True, 'useGCN': True, 'weight_decay': 4.7443572536572425e-05, 'weightedloss': True}. Best is trial 112 with value: 81.66667175292969.
/home/wxy/miniconda3/lib/python3.10/site-packages/optuna/distributions.py:685: UserWarning: The distribution is specified by [0, 1.00001] and step=0.05, but the range is not divisible by `step`. It will be replaced by [0, 1.0].
  warnings.warn(
K:  10
alpha:  0.5
lr:  0.009983621971408983
weight_decay:  6.936902521266745e-05
dropout:  0.6000000000000001
fix split and run 3 times
Data: Data(x=[2708, 1433], y=[2708], train_mask=[2708], val_mask=[2708], test_mask=[2708], adj_t=[2708, 2708, nnz=10556])
num_train tensor(140)
num_noise 0
noise: tensor(0)
data feature 1433
ALTOPT(
  (lins): Sequential(
    (0): Linear(in_features=1433, out_features=64, bias=True)
    (1): BatchNorm1d(64, eps=1e-05, momentum=0.1, affine=True, track_running_stats=True)
    (2): Dropout(p=0.6000000000000001, inplace=True)
    (3): ReLU(inplace=True)
    (4): Linear(in_features=64, out_features=7, bias=True)
    (5): LogSoftmax(dim=-1)
  )
  (prop): Propagation(K=10, mode=None, lambda1=None, lambda2=None, L21=True, alpha=0.5)
  (gcn): GCN(
    (convs): ModuleList(
      (0): GCNConv(1433, 64)
      (1): GCNConv(64, 7)
    )
    (bns): ModuleList(
      (0): BatchNorm1d(64, eps=1e-05, momentum=0.1, affine=True, track_running_stats=True)
    )
    (output): LogSoftmax(dim=-1)
  )
)
propagate done
init label
Split: 01, Run: 01
None time:  2.7824432889465243
None Run 01:
Highest Train: 100.00
Highest Valid: 81.80
  Final Train: 100.00
   Final Test: 83.00
Split: 01, Run: 02
None time:  1.9160575200803578
None Run 02:
Highest Train: 100.00
Highest Valid: 81.20
  Final Train: 100.00
   Final Test: 82.70
Split: 01, Run: 03
None time:  1.8455254889559
None Run 03:
Highest Train: 100.00
Highest Valid: 81.20
  Final Train: 100.00
   Final Test: 82.00
run time now: 6.566220760345459
total time:  6.589760118164122
None All runs:
Highest Train: 100.00 ± 0.00
Highest Valid: 81.40 ± 0.35
  Final Train: 100.00 ± 0.00
   Final Test: 82.57 ± 0.51
[I 2023-06-12 00:24:31,373] Trial 118 finished with value: 81.4000015258789 and parameters: {'Fwd': 0.09190220082659384, 'K': 10, 'alpha': 0.5, 'dropout': 0.6000000000000001, 'gnnepoch': 70, 'lambda1': 0.75, 'lambda2': 4.766082713992227, 'loop': 1, 'loss': 'CE', 'lr': 0.009983621971408983, 'softmaxF': True, 'useGCN': True, 'weight_decay': 6.936902521266745e-05, 'weightedloss': True}. Best is trial 112 with value: 81.66667175292969.
/home/wxy/miniconda3/lib/python3.10/site-packages/optuna/distributions.py:685: UserWarning: The distribution is specified by [0, 1.00001] and step=0.05, but the range is not divisible by `step`. It will be replaced by [0, 1.0].
  warnings.warn(
K:  10
alpha:  0.5
lr:  0.00976377406113128
weight_decay:  6.612519754971507e-05
dropout:  0.6000000000000001
fix split and run 3 times
Data: Data(x=[2708, 1433], y=[2708], train_mask=[2708], val_mask=[2708], test_mask=[2708], adj_t=[2708, 2708, nnz=10556])
num_train tensor(140)
num_noise 0
noise: tensor(0)
data feature 1433
ALTOPT(
  (lins): Sequential(
    (0): Linear(in_features=1433, out_features=64, bias=True)
    (1): BatchNorm1d(64, eps=1e-05, momentum=0.1, affine=True, track_running_stats=True)
    (2): Dropout(p=0.6000000000000001, inplace=True)
    (3): ReLU(inplace=True)
    (4): Linear(in_features=64, out_features=7, bias=True)
    (5): LogSoftmax(dim=-1)
  )
  (prop): Propagation(K=10, mode=None, lambda1=None, lambda2=None, L21=True, alpha=0.5)
  (gcn): GCN(
    (convs): ModuleList(
      (0): GCNConv(1433, 64)
      (1): GCNConv(64, 7)
    )
    (bns): ModuleList(
      (0): BatchNorm1d(64, eps=1e-05, momentum=0.1, affine=True, track_running_stats=True)
    )
    (output): LogSoftmax(dim=-1)
  )
)
propagate done
init label
Split: 01, Run: 01
None time:  1.7970510108862072
None Run 01:
Highest Train: 100.00
Highest Valid: 81.40
  Final Train: 100.00
   Final Test: 82.70
Split: 01, Run: 02
None time:  1.7802278641611338
None Run 02:
Highest Train: 100.00
Highest Valid: 80.20
  Final Train: 100.00
   Final Test: 81.20
Split: 01, Run: 03
None time:  1.9870580970309675
None Run 03:
Highest Train: 100.00
Highest Valid: 81.00
  Final Train: 100.00
   Final Test: 82.70
run time now: 5.592378854751587
total time:  5.614209913881496
None All runs:
Highest Train: 100.00 ± 0.00
Highest Valid: 80.87 ± 0.61
  Final Train: 100.00 ± 0.00
   Final Test: 82.20 ± 0.87
[I 2023-06-12 00:24:37,590] Trial 119 finished with value: 80.86666870117188 and parameters: {'Fwd': 0.09998709129392708, 'K': 10, 'alpha': 0.5, 'dropout': 0.6000000000000001, 'gnnepoch': 70, 'lambda1': 0.75, 'lambda2': 4.685673398251509, 'loop': 1, 'loss': 'CE', 'lr': 0.00976377406113128, 'softmaxF': True, 'useGCN': True, 'weight_decay': 6.612519754971507e-05, 'weightedloss': False}. Best is trial 112 with value: 81.66667175292969.
/home/wxy/miniconda3/lib/python3.10/site-packages/optuna/distributions.py:685: UserWarning: The distribution is specified by [0, 1.00001] and step=0.05, but the range is not divisible by `step`. It will be replaced by [0, 1.0].
  warnings.warn(
K:  10
alpha:  0.45
lr:  0.008042899407689682
weight_decay:  7.112021146255947e-05
dropout:  0.6000000000000001
fix split and run 3 times
Data: Data(x=[2708, 1433], y=[2708], train_mask=[2708], val_mask=[2708], test_mask=[2708], adj_t=[2708, 2708, nnz=10556])
num_train tensor(140)
num_noise 0
noise: tensor(0)
data feature 1433
ALTOPT(
  (lins): Sequential(
    (0): Linear(in_features=1433, out_features=64, bias=True)
    (1): BatchNorm1d(64, eps=1e-05, momentum=0.1, affine=True, track_running_stats=True)
    (2): Dropout(p=0.6000000000000001, inplace=True)
    (3): ReLU(inplace=True)
    (4): Linear(in_features=64, out_features=7, bias=True)
    (5): LogSoftmax(dim=-1)
  )
  (prop): Propagation(K=10, mode=None, lambda1=None, lambda2=None, L21=True, alpha=0.45)
  (gcn): GCN(
    (convs): ModuleList(
      (0): GCNConv(1433, 64)
      (1): GCNConv(64, 7)
    )
    (bns): ModuleList(
      (0): BatchNorm1d(64, eps=1e-05, momentum=0.1, affine=True, track_running_stats=True)
    )
    (output): LogSoftmax(dim=-1)
  )
)
propagate done
init label
Split: 01, Run: 01
None time:  1.3602005110587925
None Run 01:
Highest Train: 100.00
Highest Valid: 81.40
  Final Train: 100.00
   Final Test: 83.40
Split: 01, Run: 02
None time:  2.650318233994767
None Run 02:
Highest Train: 100.00
Highest Valid: 81.00
  Final Train: 100.00
   Final Test: 81.80
Split: 01, Run: 03
None time:  1.8426382360048592
None Run 03:
Highest Train: 100.00
Highest Valid: 81.20
  Final Train: 100.00
   Final Test: 81.70
run time now: 5.87908411026001
total time:  5.907584307016805
None All runs:
Highest Train: 100.00 ± 0.00
Highest Valid: 81.20 ± 0.20
  Final Train: 100.00 ± 0.00
   Final Test: 82.30 ± 0.95
[I 2023-06-12 00:24:43,954] Trial 120 finished with value: 81.19999694824219 and parameters: {'Fwd': 0.059891083708075374, 'K': 10, 'alpha': 0.45, 'dropout': 0.6000000000000001, 'gnnepoch': 70, 'lambda1': 0.75, 'lambda2': 4.9422022990163565, 'loop': 1, 'loss': 'CE', 'lr': 0.008042899407689682, 'softmaxF': True, 'useGCN': True, 'weight_decay': 7.112021146255947e-05, 'weightedloss': True}. Best is trial 112 with value: 81.66667175292969.
/home/wxy/miniconda3/lib/python3.10/site-packages/optuna/distributions.py:685: UserWarning: The distribution is specified by [0, 1.00001] and step=0.05, but the range is not divisible by `step`. It will be replaced by [0, 1.0].
  warnings.warn(
K:  10
alpha:  0.45
lr:  0.008237437859957992
weight_decay:  7.55640417535552e-05
dropout:  0.6000000000000001
fix split and run 3 times
Data: Data(x=[2708, 1433], y=[2708], train_mask=[2708], val_mask=[2708], test_mask=[2708], adj_t=[2708, 2708, nnz=10556])
num_train tensor(140)
num_noise 0
noise: tensor(0)
data feature 1433
ALTOPT(
  (lins): Sequential(
    (0): Linear(in_features=1433, out_features=64, bias=True)
    (1): BatchNorm1d(64, eps=1e-05, momentum=0.1, affine=True, track_running_stats=True)
    (2): Dropout(p=0.6000000000000001, inplace=True)
    (3): ReLU(inplace=True)
    (4): Linear(in_features=64, out_features=7, bias=True)
    (5): LogSoftmax(dim=-1)
  )
  (prop): Propagation(K=10, mode=None, lambda1=None, lambda2=None, L21=True, alpha=0.45)
  (gcn): GCN(
    (convs): ModuleList(
      (0): GCNConv(1433, 64)
      (1): GCNConv(64, 7)
    )
    (bns): ModuleList(
      (0): BatchNorm1d(64, eps=1e-05, momentum=0.1, affine=True, track_running_stats=True)
    )
    (output): LogSoftmax(dim=-1)
  )
)
propagate done
init label
Split: 01, Run: 01
None time:  1.6672725300304592
None Run 01:
Highest Train: 100.00
Highest Valid: 81.40
  Final Train: 100.00
   Final Test: 83.40
Split: 01, Run: 02
None time:  2.2059239679947495
None Run 02:
Highest Train: 100.00
Highest Valid: 80.40
  Final Train: 100.00
   Final Test: 82.30
Split: 01, Run: 03
None time:  2.081380994990468
None Run 03:
Highest Train: 100.00
Highest Valid: 80.80
  Final Train: 100.00
   Final Test: 83.10
run time now: 5.982813358306885
total time:  6.007209529168904
None All runs:
Highest Train: 100.00 ± 0.00
Highest Valid: 80.87 ± 0.50
  Final Train: 100.00 ± 0.00
   Final Test: 82.93 ± 0.57
[I 2023-06-12 00:24:50,407] Trial 121 finished with value: 80.86666870117188 and parameters: {'Fwd': 0.06957656172958716, 'K': 10, 'alpha': 0.45, 'dropout': 0.6000000000000001, 'gnnepoch': 70, 'lambda1': 0.75, 'lambda2': 4.890367099603723, 'loop': 1, 'loss': 'CE', 'lr': 0.008237437859957992, 'softmaxF': True, 'useGCN': True, 'weight_decay': 7.55640417535552e-05, 'weightedloss': True}. Best is trial 112 with value: 81.66667175292969.
/home/wxy/miniconda3/lib/python3.10/site-packages/optuna/distributions.py:685: UserWarning: The distribution is specified by [0, 1.00001] and step=0.05, but the range is not divisible by `step`. It will be replaced by [0, 1.0].
  warnings.warn(
K:  10
alpha:  0.5
lr:  0.008902089209249285
weight_decay:  5.4053164677083316e-05
dropout:  0.6000000000000001
fix split and run 3 times
Data: Data(x=[2708, 1433], y=[2708], train_mask=[2708], val_mask=[2708], test_mask=[2708], adj_t=[2708, 2708, nnz=10556])
num_train tensor(140)
num_noise 0
noise: tensor(0)
data feature 1433
ALTOPT(
  (lins): Sequential(
    (0): Linear(in_features=1433, out_features=64, bias=True)
    (1): BatchNorm1d(64, eps=1e-05, momentum=0.1, affine=True, track_running_stats=True)
    (2): Dropout(p=0.6000000000000001, inplace=True)
    (3): ReLU(inplace=True)
    (4): Linear(in_features=64, out_features=7, bias=True)
    (5): LogSoftmax(dim=-1)
  )
  (prop): Propagation(K=10, mode=None, lambda1=None, lambda2=None, L21=True, alpha=0.5)
  (gcn): GCN(
    (convs): ModuleList(
      (0): GCNConv(1433, 64)
      (1): GCNConv(64, 7)
    )
    (bns): ModuleList(
      (0): BatchNorm1d(64, eps=1e-05, momentum=0.1, affine=True, track_running_stats=True)
    )
    (output): LogSoftmax(dim=-1)
  )
)
propagate done
init label
Split: 01, Run: 01
None time:  1.9179807959590107
None Run 01:
Highest Train: 100.00
Highest Valid: 81.40
  Final Train: 100.00
   Final Test: 83.40
Split: 01, Run: 02
None time:  1.961001246003434
None Run 02:
Highest Train: 100.00
Highest Valid: 80.20
  Final Train: 100.00
   Final Test: 81.80
Split: 01, Run: 03
None time:  1.7559970819856972
None Run 03:
Highest Train: 100.00
Highest Valid: 80.40
  Final Train: 100.00
   Final Test: 82.80
run time now: 5.6772778034210205
total time:  5.719616116955876
None All runs:
Highest Train: 100.00 ± 0.00
Highest Valid: 80.67 ± 0.64
  Final Train: 100.00 ± 0.00
   Final Test: 82.67 ± 0.81
[I 2023-06-12 00:24:56,565] Trial 122 finished with value: 80.66666412353516 and parameters: {'Fwd': 0.055855094635824235, 'K': 10, 'alpha': 0.5, 'dropout': 0.6000000000000001, 'gnnepoch': 70, 'lambda1': 0.8, 'lambda2': 5.193401538980489, 'loop': 1, 'loss': 'CE', 'lr': 0.008902089209249285, 'softmaxF': True, 'useGCN': True, 'weight_decay': 5.4053164677083316e-05, 'weightedloss': True}. Best is trial 112 with value: 81.66667175292969.
/home/wxy/miniconda3/lib/python3.10/site-packages/optuna/distributions.py:685: UserWarning: The distribution is specified by [0, 1.00001] and step=0.05, but the range is not divisible by `step`. It will be replaced by [0, 1.0].
  warnings.warn(
K:  10
alpha:  0.45
lr:  0.00808906666501886
weight_decay:  0.00010638153898809372
dropout:  0.6000000000000001
fix split and run 3 times
Data: Data(x=[2708, 1433], y=[2708], train_mask=[2708], val_mask=[2708], test_mask=[2708], adj_t=[2708, 2708, nnz=10556])
num_train tensor(140)
num_noise 0
noise: tensor(0)
data feature 1433
ALTOPT(
  (lins): Sequential(
    (0): Linear(in_features=1433, out_features=64, bias=True)
    (1): BatchNorm1d(64, eps=1e-05, momentum=0.1, affine=True, track_running_stats=True)
    (2): Dropout(p=0.6000000000000001, inplace=True)
    (3): ReLU(inplace=True)
    (4): Linear(in_features=64, out_features=7, bias=True)
    (5): LogSoftmax(dim=-1)
  )
  (prop): Propagation(K=10, mode=None, lambda1=None, lambda2=None, L21=True, alpha=0.45)
  (gcn): GCN(
    (convs): ModuleList(
      (0): GCNConv(1433, 64)
      (1): GCNConv(64, 7)
    )
    (bns): ModuleList(
      (0): BatchNorm1d(64, eps=1e-05, momentum=0.1, affine=True, track_running_stats=True)
    )
    (output): LogSoftmax(dim=-1)
  )
)
propagate done
init label
Split: 01, Run: 01
None time:  1.7711501028388739
None Run 01:
Highest Train: 100.00
Highest Valid: 81.20
  Final Train: 100.00
   Final Test: 82.00
Split: 01, Run: 02
None time:  2.234020072966814
None Run 02:
Highest Train: 100.00
Highest Valid: 80.60
  Final Train: 100.00
   Final Test: 82.10
Split: 01, Run: 03
None time:  1.824624486034736
None Run 03:
Highest Train: 100.00
Highest Valid: 81.60
  Final Train: 100.00
   Final Test: 82.50
run time now: 5.859798908233643
total time:  5.887002147035673
None All runs:
Highest Train: 100.00 ± 0.00
Highest Valid: 81.13 ± 0.50
  Final Train: 100.00 ± 0.00
   Final Test: 82.20 ± 0.26
[I 2023-06-12 00:25:02,869] Trial 123 finished with value: 81.13333129882812 and parameters: {'Fwd': 0.05783225844640866, 'K': 10, 'alpha': 0.45, 'dropout': 0.6000000000000001, 'gnnepoch': 80, 'lambda1': 0.7000000000000001, 'lambda2': 4.5844927363721375, 'loop': 1, 'loss': 'CE', 'lr': 0.00808906666501886, 'softmaxF': True, 'useGCN': True, 'weight_decay': 0.00010638153898809372, 'weightedloss': True}. Best is trial 112 with value: 81.66667175292969.
/home/wxy/miniconda3/lib/python3.10/site-packages/optuna/distributions.py:685: UserWarning: The distribution is specified by [0, 1.00001] and step=0.05, but the range is not divisible by `step`. It will be replaced by [0, 1.0].
  warnings.warn(
K:  10
alpha:  0.5
lr:  0.007945426495517396
weight_decay:  0.00010694835116689181
dropout:  0.6000000000000001
fix split and run 3 times
Data: Data(x=[2708, 1433], y=[2708], train_mask=[2708], val_mask=[2708], test_mask=[2708], adj_t=[2708, 2708, nnz=10556])
num_train tensor(140)
num_noise 0
noise: tensor(0)
data feature 1433
ALTOPT(
  (lins): Sequential(
    (0): Linear(in_features=1433, out_features=64, bias=True)
    (1): BatchNorm1d(64, eps=1e-05, momentum=0.1, affine=True, track_running_stats=True)
    (2): Dropout(p=0.6000000000000001, inplace=True)
    (3): ReLU(inplace=True)
    (4): Linear(in_features=64, out_features=7, bias=True)
    (5): LogSoftmax(dim=-1)
  )
  (prop): Propagation(K=10, mode=None, lambda1=None, lambda2=None, L21=True, alpha=0.5)
  (gcn): GCN(
    (convs): ModuleList(
      (0): GCNConv(1433, 64)
      (1): GCNConv(64, 7)
    )
    (bns): ModuleList(
      (0): BatchNorm1d(64, eps=1e-05, momentum=0.1, affine=True, track_running_stats=True)
    )
    (output): LogSoftmax(dim=-1)
  )
)
propagate done
init label
Split: 01, Run: 01
None time:  1.8563682781532407
None Run 01:
Highest Train: 100.00
Highest Valid: 81.00
  Final Train: 100.00
   Final Test: 82.00
Split: 01, Run: 02
None time:  2.197559447027743
None Run 02:
Highest Train: 100.00
Highest Valid: 80.80
  Final Train: 100.00
   Final Test: 82.30
Split: 01, Run: 03
None time:  1.950933723943308
None Run 03:
Highest Train: 100.00
Highest Valid: 81.20
  Final Train: 100.00
   Final Test: 82.10
run time now: 6.0296852588653564
total time:  6.053557701874524
None All runs:
Highest Train: 100.00 ± 0.00
Highest Valid: 81.00 ± 0.20
  Final Train: 100.00 ± 0.00
   Final Test: 82.13 ± 0.15
