[I 2023-06-11 23:33:36,997] Trial 206 finished with value: 71.4000015258789 and parameters: {'Fwd': 0.011435867534094094, 'K': 8, 'alpha': 0.55, 'dropout': 0.8, 'gnnepoch': 120, 'lambda1': 0.8, 'lambda2': 4.1488456225337815, 'loop': 1, 'loss': 'CE', 'lr': 0.002035646697607373, 'softmaxF': False, 'useGCN': True, 'weight_decay': 9.174607882440501e-06, 'weightedloss': True}. Best is trial 203 with value: 71.93333435058594.
/home/wxy/miniconda3/lib/python3.10/site-packages/optuna/distributions.py:685: UserWarning: The distribution is specified by [0, 1.00001] and step=0.05, but the range is not divisible by `step`. It will be replaced by [0, 1.0].
  warnings.warn(
K:  8
alpha:  0.55
lr:  0.0020799238072688477
weight_decay:  5.968661237275893e-06
dropout:  0.8
fix split and run 3 times
Data: Data(x=[3327, 3703], y=[3327], train_mask=[3327], val_mask=[3327], test_mask=[3327], adj_t=[3327, 3327, nnz=9104])
num_train tensor(120)
num_noise 0
noise: tensor(0)
data feature 3703
ALTOPT(
  (lins): Sequential(
    (0): Linear(in_features=3703, out_features=64, bias=True)
    (1): BatchNorm1d(64, eps=1e-05, momentum=0.1, affine=True, track_running_stats=True)
    (2): Dropout(p=0.8, inplace=True)
    (3): ReLU(inplace=True)
    (4): Linear(in_features=64, out_features=6, bias=True)
    (5): LogSoftmax(dim=-1)
  )
  (prop): Propagation(K=8, mode=None, lambda1=None, lambda2=None, L21=True, alpha=0.55)
  (gcn): GCN(
    (convs): ModuleList(
      (0): GCNConv(3703, 64)
      (1): GCNConv(64, 6)
    )
    (bns): ModuleList(
      (0): BatchNorm1d(64, eps=1e-05, momentum=0.1, affine=True, track_running_stats=True)
    )
    (output): LogSoftmax(dim=-1)
  )
)
propagate done
init label
Split: 01, Run: 01
None time:  0.9909868671093136
None Run 01:
Highest Train: 100.00
Highest Valid: 71.20
  Final Train: 100.00
   Final Test: 69.80
Split: 01, Run: 02
None time:  1.0485196739900857
None Run 02:
Highest Train: 100.00
Highest Valid: 72.60
  Final Train: 100.00
   Final Test: 69.80
Split: 01, Run: 03
None time:  1.0020738248713315
None Run 03:
Highest Train: 100.00
Highest Valid: 71.80
  Final Train: 100.00
   Final Test: 70.60
run time now: 3.083002805709839
total time:  3.1333724439609796
None All runs:
Highest Train: 100.00 ± 0.00
Highest Valid: 71.87 ± 0.70
  Final Train: 100.00 ± 0.00
   Final Test: 70.07 ± 0.46
[I 2023-06-11 23:33:40,624] Trial 207 finished with value: 71.86666870117188 and parameters: {'Fwd': 0.014902669150927535, 'K': 8, 'alpha': 0.55, 'dropout': 0.8, 'gnnepoch': 120, 'lambda1': 0.8, 'lambda2': 4.253286145690714, 'loop': 0, 'loss': 'CE', 'lr': 0.0020799238072688477, 'softmaxF': False, 'useGCN': True, 'weight_decay': 5.968661237275893e-06, 'weightedloss': True}. Best is trial 203 with value: 71.93333435058594.
/home/wxy/miniconda3/lib/python3.10/site-packages/optuna/distributions.py:685: UserWarning: The distribution is specified by [0, 1.00001] and step=0.05, but the range is not divisible by `step`. It will be replaced by [0, 1.0].
  warnings.warn(
K:  8
alpha:  0.55
lr:  0.0017384344534649558
weight_decay:  6.042740747081041e-06
dropout:  0.8
fix split and run 3 times
Data: Data(x=[3327, 3703], y=[3327], train_mask=[3327], val_mask=[3327], test_mask=[3327], adj_t=[3327, 3327, nnz=9104])
num_train tensor(120)
num_noise 0
noise: tensor(0)
data feature 3703
ALTOPT(
  (lins): Sequential(
    (0): Linear(in_features=3703, out_features=64, bias=True)
    (1): BatchNorm1d(64, eps=1e-05, momentum=0.1, affine=True, track_running_stats=True)
    (2): Dropout(p=0.8, inplace=True)
    (3): ReLU(inplace=True)
    (4): Linear(in_features=64, out_features=6, bias=True)
    (5): Identity()
  )
  (prop): Propagation(K=8, mode=None, lambda1=None, lambda2=None, L21=True, alpha=0.55)
  (gcn): GCN(
    (convs): ModuleList(
      (0): GCNConv(3703, 64)
      (1): GCNConv(64, 6)
    )
    (bns): ModuleList(
      (0): BatchNorm1d(64, eps=1e-05, momentum=0.1, affine=True, track_running_stats=True)
    )
    (output): Identity()
  )
)
propagate done
init label
Split: 01, Run: 01, Epoch: 100, Loss: 0.0000, Train: 100.00%, Valid: 69.20% Test: 70.10%
Split: 01, Run: 01
None time:  1.7316626440733671
None Run 01:
Highest Train: 100.00
Highest Valid: 69.20
  Final Train: 100.00
   Final Test: 70.10
Split: 01, Run: 02
None time:  1.08150913589634
None Run 02:
Highest Train: 100.00
Highest Valid: 68.80
  Final Train: 100.00
   Final Test: 69.90
Split: 01, Run: 03, Epoch: 100, Loss: 0.0000, Train: 100.00%, Valid: 68.40% Test: 69.40%
Split: 01, Run: 03
None time:  1.7569824510719627
None Run 03:
Highest Train: 100.00
Highest Valid: 68.40
  Final Train: 100.00
   Final Test: 69.40
run time now: 4.611348390579224
total time:  4.670498494058847
None All runs:
Highest Train: 100.00 ± 0.00
Highest Valid: 68.80 ± 0.40
  Final Train: 100.00 ± 0.00
   Final Test: 69.80 ± 0.36
[I 2023-06-11 23:33:45,759] Trial 208 finished with value: 68.79999542236328 and parameters: {'Fwd': 0.014224571048704563, 'K': 8, 'alpha': 0.55, 'dropout': 0.8, 'gnnepoch': 120, 'lambda1': 0.8, 'lambda2': 4.272951984331451, 'loop': 0, 'loss': 'MSE', 'lr': 0.0017384344534649558, 'softmaxF': False, 'useGCN': True, 'weight_decay': 6.042740747081041e-06, 'weightedloss': True}. Best is trial 203 with value: 71.93333435058594.
/home/wxy/miniconda3/lib/python3.10/site-packages/optuna/distributions.py:685: UserWarning: The distribution is specified by [0, 1.00001] and step=0.05, but the range is not divisible by `step`. It will be replaced by [0, 1.0].
  warnings.warn(
K:  8
alpha:  0.6000000000000001
lr:  0.0020501843149605195
weight_decay:  7.1928233313012625e-06
dropout:  0.8
fix split and run 3 times
Data: Data(x=[3327, 3703], y=[3327], train_mask=[3327], val_mask=[3327], test_mask=[3327], adj_t=[3327, 3327, nnz=9104])
num_train tensor(120)
num_noise 0
noise: tensor(0)
data feature 3703
ALTOPT(
  (lins): Sequential(
    (0): Linear(in_features=3703, out_features=64, bias=True)
    (1): BatchNorm1d(64, eps=1e-05, momentum=0.1, affine=True, track_running_stats=True)
    (2): Dropout(p=0.8, inplace=True)
    (3): ReLU(inplace=True)
    (4): Linear(in_features=64, out_features=6, bias=True)
    (5): LogSoftmax(dim=-1)
  )
  (prop): Propagation(K=8, mode=None, lambda1=None, lambda2=None, L21=True, alpha=0.6000000000000001)
  (gcn): GCN(
    (convs): ModuleList(
      (0): GCNConv(3703, 64)
      (1): GCNConv(64, 6)
    )
    (bns): ModuleList(
      (0): BatchNorm1d(64, eps=1e-05, momentum=0.1, affine=True, track_running_stats=True)
    )
    (output): LogSoftmax(dim=-1)
  )
)
propagate done
init label
Split: 01, Run: 01
None time:  0.9995394570287317
None Run 01:
Highest Train: 100.00
Highest Valid: 71.20
  Final Train: 100.00
   Final Test: 69.70
Split: 01, Run: 02
None time:  1.0927553591318429
None Run 02:
Highest Train: 100.00
Highest Valid: 72.20
  Final Train: 100.00
   Final Test: 70.00
Split: 01, Run: 03
None time:  0.9682758380658925
None Run 03:
Highest Train: 100.00
Highest Valid: 71.80
  Final Train: 100.00
   Final Test: 69.70
run time now: 3.1011929512023926
total time:  3.1544272331520915
None All runs:
Highest Train: 100.00 ± 0.00
Highest Valid: 71.73 ± 0.50
  Final Train: 100.00 ± 0.00
   Final Test: 69.80 ± 0.17
[I 2023-06-11 23:33:49,367] Trial 209 finished with value: 71.73332977294922 and parameters: {'Fwd': 0.01989591327216669, 'K': 8, 'alpha': 0.6000000000000001, 'dropout': 0.8, 'gnnepoch': 120, 'lambda1': 0.8, 'lambda2': 4.497137387599551, 'loop': 0, 'loss': 'CE', 'lr': 0.0020501843149605195, 'softmaxF': False, 'useGCN': True, 'weight_decay': 7.1928233313012625e-06, 'weightedloss': True}. Best is trial 203 with value: 71.93333435058594.
/home/wxy/miniconda3/lib/python3.10/site-packages/optuna/distributions.py:685: UserWarning: The distribution is specified by [0, 1.00001] and step=0.05, but the range is not divisible by `step`. It will be replaced by [0, 1.0].
  warnings.warn(
K:  8
alpha:  0.6000000000000001
lr:  0.002031181010776228
weight_decay:  6.897959037543495e-06
dropout:  0.8
fix split and run 3 times
Data: Data(x=[3327, 3703], y=[3327], train_mask=[3327], val_mask=[3327], test_mask=[3327], adj_t=[3327, 3327, nnz=9104])
num_train tensor(120)
num_noise 0
noise: tensor(0)
data feature 3703
ALTOPT(
  (lins): Sequential(
    (0): Linear(in_features=3703, out_features=64, bias=True)
    (1): BatchNorm1d(64, eps=1e-05, momentum=0.1, affine=True, track_running_stats=True)
    (2): Dropout(p=0.8, inplace=True)
    (3): ReLU(inplace=True)
    (4): Linear(in_features=64, out_features=6, bias=True)
    (5): LogSoftmax(dim=-1)
  )
  (prop): Propagation(K=8, mode=None, lambda1=None, lambda2=None, L21=True, alpha=0.6000000000000001)
  (gcn): GCN(
    (convs): ModuleList(
      (0): GCNConv(3703, 64)
      (1): GCNConv(64, 6)
    )
    (bns): ModuleList(
      (0): BatchNorm1d(64, eps=1e-05, momentum=0.1, affine=True, track_running_stats=True)
    )
    (output): LogSoftmax(dim=-1)
  )
)
propagate done
init label
Split: 01, Run: 01
None time:  0.9914645701646805
None Run 01:
Highest Train: 100.00
Highest Valid: 71.20
  Final Train: 100.00
   Final Test: 69.60
Split: 01, Run: 02
None time:  0.8876304260920733
None Run 02:
Highest Train: 100.00
Highest Valid: 69.60
  Final Train: 100.00
   Final Test: 68.60
Split: 01, Run: 03
None time:  0.9301397718954831
None Run 03:
Highest Train: 100.00
Highest Valid: 71.40
  Final Train: 100.00
   Final Test: 70.40
run time now: 2.8606364727020264
total time:  2.934431695844978
None All runs:
Highest Train: 100.00 ± 0.00
Highest Valid: 70.73 ± 0.99
  Final Train: 100.00 ± 0.00
   Final Test: 69.53 ± 0.90
[I 2023-06-11 23:33:52,898] Trial 210 finished with value: 70.73333740234375 and parameters: {'Fwd': 0.01986604841644933, 'K': 8, 'alpha': 0.6000000000000001, 'dropout': 0.8, 'gnnepoch': 110, 'lambda1': 0.8, 'lambda2': 4.52648256770217, 'loop': 0, 'loss': 'CE', 'lr': 0.002031181010776228, 'softmaxF': False, 'useGCN': True, 'weight_decay': 6.897959037543495e-06, 'weightedloss': True}. Best is trial 203 with value: 71.93333435058594.
/home/wxy/miniconda3/lib/python3.10/site-packages/optuna/distributions.py:685: UserWarning: The distribution is specified by [0, 1.00001] and step=0.05, but the range is not divisible by `step`. It will be replaced by [0, 1.0].
  warnings.warn(
K:  8
alpha:  0.55
lr:  0.0018597780178172746
weight_decay:  3.946019977800224e-06
dropout:  0.8
fix split and run 3 times
Data: Data(x=[3327, 3703], y=[3327], train_mask=[3327], val_mask=[3327], test_mask=[3327], adj_t=[3327, 3327, nnz=9104])
num_train tensor(120)
num_noise 0
noise: tensor(0)
data feature 3703
ALTOPT(
  (lins): Sequential(
    (0): Linear(in_features=3703, out_features=64, bias=True)
    (1): BatchNorm1d(64, eps=1e-05, momentum=0.1, affine=True, track_running_stats=True)
    (2): Dropout(p=0.8, inplace=True)
    (3): ReLU(inplace=True)
    (4): Linear(in_features=64, out_features=6, bias=True)
    (5): LogSoftmax(dim=-1)
  )
  (prop): Propagation(K=8, mode=None, lambda1=None, lambda2=None, L21=True, alpha=0.55)
  (gcn): GCN(
    (convs): ModuleList(
      (0): GCNConv(3703, 64)
      (1): GCNConv(64, 6)
    )
    (bns): ModuleList(
      (0): BatchNorm1d(64, eps=1e-05, momentum=0.1, affine=True, track_running_stats=True)
    )
    (output): LogSoftmax(dim=-1)
  )
)
propagate done
init label
Split: 01, Run: 01
None time:  1.0966141228564084
None Run 01:
Highest Train: 100.00
Highest Valid: 71.20
  Final Train: 100.00
   Final Test: 69.90
Split: 01, Run: 02
None time:  1.0411324079614133
None Run 02:
Highest Train: 100.00
Highest Valid: 71.80
  Final Train: 100.00
   Final Test: 69.90
Split: 01, Run: 03
None time:  1.0407870919443667
None Run 03:
Highest Train: 100.00
Highest Valid: 71.80
  Final Train: 100.00
   Final Test: 69.80
run time now: 3.229281425476074
total time:  3.2869245239999145
None All runs:
Highest Train: 100.00 ± 0.00
Highest Valid: 71.60 ± 0.35
  Final Train: 100.00 ± 0.00
   Final Test: 69.87 ± 0.06
[I 2023-06-11 23:33:56,754] Trial 211 finished with value: 71.5999984741211 and parameters: {'Fwd': 0.013508213330237094, 'K': 8, 'alpha': 0.55, 'dropout': 0.8, 'gnnepoch': 120, 'lambda1': 0.8, 'lambda2': 4.1052735292918, 'loop': 0, 'loss': 'CE', 'lr': 0.0018597780178172746, 'softmaxF': False, 'useGCN': True, 'weight_decay': 3.946019977800224e-06, 'weightedloss': True}. Best is trial 203 with value: 71.93333435058594.
/home/wxy/miniconda3/lib/python3.10/site-packages/optuna/distributions.py:685: UserWarning: The distribution is specified by [0, 1.00001] and step=0.05, but the range is not divisible by `step`. It will be replaced by [0, 1.0].
  warnings.warn(
K:  8
alpha:  0.5
lr:  0.002131029474903065
weight_decay:  6.00312378143877e-06
dropout:  0.8
fix split and run 3 times
Data: Data(x=[3327, 3703], y=[3327], train_mask=[3327], val_mask=[3327], test_mask=[3327], adj_t=[3327, 3327, nnz=9104])
num_train tensor(120)
num_noise 0
noise: tensor(0)
data feature 3703
ALTOPT(
  (lins): Sequential(
    (0): Linear(in_features=3703, out_features=64, bias=True)
    (1): BatchNorm1d(64, eps=1e-05, momentum=0.1, affine=True, track_running_stats=True)
    (2): Dropout(p=0.8, inplace=True)
    (3): ReLU(inplace=True)
    (4): Linear(in_features=64, out_features=6, bias=True)
    (5): LogSoftmax(dim=-1)
  )
  (prop): Propagation(K=8, mode=None, lambda1=None, lambda2=None, L21=True, alpha=0.5)
  (gcn): GCN(
    (convs): ModuleList(
      (0): GCNConv(3703, 64)
      (1): GCNConv(64, 6)
    )
    (bns): ModuleList(
      (0): BatchNorm1d(64, eps=1e-05, momentum=0.1, affine=True, track_running_stats=True)
    )
    (output): LogSoftmax(dim=-1)
  )
)
propagate done
init label
Split: 01, Run: 01
None time:  1.0522613120265305
None Run 01:
Highest Train: 100.00
Highest Valid: 71.20
  Final Train: 100.00
   Final Test: 69.70
Split: 01, Run: 02
None time:  1.009964644908905
None Run 02:
Highest Train: 100.00
Highest Valid: 72.20
  Final Train: 100.00
   Final Test: 70.30
Split: 01, Run: 03
None time:  1.1329202209599316
None Run 03:
Highest Train: 100.00
Highest Valid: 71.80
  Final Train: 100.00
   Final Test: 70.40
run time now: 3.236351728439331
total time:  3.2964626180473715
None All runs:
Highest Train: 100.00 ± 0.00
Highest Valid: 71.73 ± 0.50
  Final Train: 100.00 ± 0.00
   Final Test: 70.13 ± 0.38
[I 2023-06-11 23:34:00,526] Trial 212 finished with value: 71.73332977294922 and parameters: {'Fwd': 0.01753344993379811, 'K': 8, 'alpha': 0.5, 'dropout': 0.8, 'gnnepoch': 120, 'lambda1': 0.8, 'lambda2': 4.419871815895995, 'loop': 0, 'loss': 'CE', 'lr': 0.002131029474903065, 'softmaxF': False, 'useGCN': True, 'weight_decay': 6.00312378143877e-06, 'weightedloss': True}. Best is trial 203 with value: 71.93333435058594.
/home/wxy/miniconda3/lib/python3.10/site-packages/optuna/distributions.py:685: UserWarning: The distribution is specified by [0, 1.00001] and step=0.05, but the range is not divisible by `step`. It will be replaced by [0, 1.0].
  warnings.warn(
K:  8
alpha:  0.5
lr:  0.002153001828265152
weight_decay:  7.759567036489282e-06
dropout:  0.8
fix split and run 3 times
Data: Data(x=[3327, 3703], y=[3327], train_mask=[3327], val_mask=[3327], test_mask=[3327], adj_t=[3327, 3327, nnz=9104])
num_train tensor(120)
num_noise 0
noise: tensor(0)
data feature 3703
ALTOPT(
  (lins): Sequential(
    (0): Linear(in_features=3703, out_features=64, bias=True)
    (1): BatchNorm1d(64, eps=1e-05, momentum=0.1, affine=True, track_running_stats=True)
    (2): Dropout(p=0.8, inplace=True)
    (3): ReLU(inplace=True)
    (4): Linear(in_features=64, out_features=6, bias=True)
    (5): LogSoftmax(dim=-1)
  )
  (prop): Propagation(K=8, mode=None, lambda1=None, lambda2=None, L21=True, alpha=0.5)
  (gcn): GCN(
    (convs): ModuleList(
      (0): GCNConv(3703, 64)
      (1): GCNConv(64, 6)
    )
    (bns): ModuleList(
      (0): BatchNorm1d(64, eps=1e-05, momentum=0.1, affine=True, track_running_stats=True)
    )
    (output): LogSoftmax(dim=-1)
  )
)
propagate done
init label
Split: 01, Run: 01
None time:  1.0969670901540667
None Run 01:
Highest Train: 100.00
Highest Valid: 71.20
  Final Train: 100.00
   Final Test: 69.80
Split: 01, Run: 02
None time:  1.1377558570820838
None Run 02:
Highest Train: 100.00
Highest Valid: 72.40
  Final Train: 100.00
   Final Test: 70.00
Split: 01, Run: 03
None time:  1.1124288069549948
None Run 03:
Highest Train: 100.00
Highest Valid: 71.80
  Final Train: 100.00
   Final Test: 70.60
run time now: 3.393817663192749
total time:  3.4397785859182477
None All runs:
Highest Train: 100.00 ± 0.00
Highest Valid: 71.80 ± 0.60
  Final Train: 100.00 ± 0.00
   Final Test: 70.13 ± 0.42
[I 2023-06-11 23:34:04,433] Trial 213 finished with value: 71.80000305175781 and parameters: {'Fwd': 0.018492881144830546, 'K': 8, 'alpha': 0.5, 'dropout': 0.8, 'gnnepoch': 120, 'lambda1': 0.8, 'lambda2': 4.423116139470013, 'loop': 0, 'loss': 'CE', 'lr': 0.002153001828265152, 'softmaxF': False, 'useGCN': True, 'weight_decay': 7.759567036489282e-06, 'weightedloss': True}. Best is trial 203 with value: 71.93333435058594.
/home/wxy/miniconda3/lib/python3.10/site-packages/optuna/distributions.py:685: UserWarning: The distribution is specified by [0, 1.00001] and step=0.05, but the range is not divisible by `step`. It will be replaced by [0, 1.0].
  warnings.warn(
K:  8
alpha:  0.5
lr:  0.002065888081386806
weight_decay:  7.92043305996891e-06
dropout:  0.8
fix split and run 3 times
Data: Data(x=[3327, 3703], y=[3327], train_mask=[3327], val_mask=[3327], test_mask=[3327], adj_t=[3327, 3327, nnz=9104])
num_train tensor(120)
num_noise 0
noise: tensor(0)
data feature 3703
ALTOPT(
  (lins): Sequential(
    (0): Linear(in_features=3703, out_features=64, bias=True)
    (1): BatchNorm1d(64, eps=1e-05, momentum=0.1, affine=True, track_running_stats=True)
    (2): Dropout(p=0.8, inplace=True)
    (3): ReLU(inplace=True)
    (4): Linear(in_features=64, out_features=6, bias=True)
    (5): LogSoftmax(dim=-1)
  )
  (prop): Propagation(K=8, mode=None, lambda1=None, lambda2=None, L21=True, alpha=0.5)
  (gcn): GCN(
    (convs): ModuleList(
      (0): GCNConv(3703, 64)
      (1): GCNConv(64, 6)
    )
    (bns): ModuleList(
      (0): BatchNorm1d(64, eps=1e-05, momentum=0.1, affine=True, track_running_stats=True)
    )
    (output): LogSoftmax(dim=-1)
  )
)
propagate done
init label
Split: 01, Run: 01
None time:  1.0253563560545444
None Run 01:
Highest Train: 100.00
Highest Valid: 71.20
  Final Train: 100.00
   Final Test: 69.80
Split: 01, Run: 02
None time:  1.1320158699527383
None Run 02:
Highest Train: 100.00
Highest Valid: 72.20
  Final Train: 100.00
   Final Test: 70.00
Split: 01, Run: 03
None time:  1.031587467994541
None Run 03:
Highest Train: 100.00
Highest Valid: 71.80
  Final Train: 100.00
   Final Test: 70.60
run time now: 3.23028302192688
total time:  3.286934570176527
None All runs:
Highest Train: 100.00 ± 0.00
Highest Valid: 71.73 ± 0.50
  Final Train: 100.00 ± 0.00
   Final Test: 70.13 ± 0.42
[I 2023-06-11 23:34:08,187] Trial 214 finished with value: 71.73332977294922 and parameters: {'Fwd': 0.017571114837827723, 'K': 8, 'alpha': 0.5, 'dropout': 0.8, 'gnnepoch': 120, 'lambda1': 0.8, 'lambda2': 4.423606095253722, 'loop': 0, 'loss': 'CE', 'lr': 0.002065888081386806, 'softmaxF': False, 'useGCN': True, 'weight_decay': 7.92043305996891e-06, 'weightedloss': True}. Best is trial 203 with value: 71.93333435058594.
/home/wxy/miniconda3/lib/python3.10/site-packages/optuna/distributions.py:685: UserWarning: The distribution is specified by [0, 1.00001] and step=0.05, but the range is not divisible by `step`. It will be replaced by [0, 1.0].
  warnings.warn(
K:  8
alpha:  0.5
lr:  0.002132593786761777
weight_decay:  7.767758451318654e-06
dropout:  0.8
fix split and run 3 times
Data: Data(x=[3327, 3703], y=[3327], train_mask=[3327], val_mask=[3327], test_mask=[3327], adj_t=[3327, 3327, nnz=9104])
num_train tensor(120)
num_noise 0
noise: tensor(0)
data feature 3703
ALTOPT(
  (lins): Sequential(
    (0): Linear(in_features=3703, out_features=64, bias=True)
    (1): BatchNorm1d(64, eps=1e-05, momentum=0.1, affine=True, track_running_stats=True)
    (2): Dropout(p=0.8, inplace=True)
    (3): ReLU(inplace=True)
    (4): Linear(in_features=64, out_features=6, bias=True)
    (5): LogSoftmax(dim=-1)
  )
  (prop): Propagation(K=8, mode=None, lambda1=None, lambda2=None, L21=True, alpha=0.5)
  (gcn): GCN(
    (convs): ModuleList(
      (0): GCNConv(3703, 64)
      (1): GCNConv(64, 6)
    )
    (bns): ModuleList(
      (0): BatchNorm1d(64, eps=1e-05, momentum=0.1, affine=True, track_running_stats=True)
    )
    (output): LogSoftmax(dim=-1)
  )
)
propagate done
init label
Split: 01, Run: 01
None time:  1.0431552820373327
None Run 01:
Highest Train: 100.00
Highest Valid: 71.20
  Final Train: 100.00
   Final Test: 69.70
Split: 01, Run: 02
None time:  1.0286600748077035
None Run 02:
Highest Train: 100.00
Highest Valid: 72.20
  Final Train: 100.00
   Final Test: 70.20
Split: 01, Run: 03
None time:  1.0841190530918539
None Run 03:
Highest Train: 100.00
Highest Valid: 71.80
  Final Train: 100.00
   Final Test: 69.90
run time now: 3.197927236557007
total time:  3.2664777389727533
None All runs:
Highest Train: 100.00 ± 0.00
Highest Valid: 71.73 ± 0.50
  Final Train: 100.00 ± 0.00
   Final Test: 69.93 ± 0.25
