[I 2023-06-11 23:30:18,057] Trial 152 finished with value: 71.53333282470703 and parameters: {'Fwd': 0.014982727182949209, 'K': 8, 'alpha': 0.45, 'dropout': 0.9, 'gnnepoch': 120, 'lambda1': 0.75, 'lambda2': 3.5396202822771725, 'loop': 0, 'loss': 'CE', 'lr': 0.003766950736110841, 'softmaxF': False, 'useGCN': True, 'weight_decay': 1.6855920957868735e-06, 'weightedloss': False}. Best is trial 146 with value: 71.86666870117188.
/home/wxy/miniconda3/lib/python3.10/site-packages/optuna/distributions.py:685: UserWarning: The distribution is specified by [0, 1.00001] and step=0.05, but the range is not divisible by `step`. It will be replaced by [0, 1.0].
  warnings.warn(
K:  9
alpha:  0.4
lr:  0.0023643253352633323
weight_decay:  2.446781642956351e-06
dropout:  0.6000000000000001
fix split and run 3 times
Data: Data(x=[3327, 3703], y=[3327], train_mask=[3327], val_mask=[3327], test_mask=[3327], adj_t=[3327, 3327, nnz=9104])
num_train tensor(120)
num_noise 0
noise: tensor(0)
data feature 3703
ALTOPT(
  (lins): Sequential(
    (0): Linear(in_features=3703, out_features=64, bias=True)
    (1): BatchNorm1d(64, eps=1e-05, momentum=0.1, affine=True, track_running_stats=True)
    (2): Dropout(p=0.6000000000000001, inplace=True)
    (3): ReLU(inplace=True)
    (4): Linear(in_features=64, out_features=6, bias=True)
    (5): LogSoftmax(dim=-1)
  )
  (prop): Propagation(K=9, mode=None, lambda1=None, lambda2=None, L21=True, alpha=0.4)
  (gcn): GCN(
    (convs): ModuleList(
      (0): GCNConv(3703, 64)
      (1): GCNConv(64, 6)
    )
    (bns): ModuleList(
      (0): BatchNorm1d(64, eps=1e-05, momentum=0.1, affine=True, track_running_stats=True)
    )
    (output): LogSoftmax(dim=-1)
  )
)
propagate done
init label
Split: 01, Run: 01
None time:  1.0722237271256745
None Run 01:
Highest Train: 100.00
Highest Valid: 70.80
  Final Train: 100.00
   Final Test: 69.90
Split: 01, Run: 02
None time:  1.143140940926969
None Run 02:
Highest Train: 100.00
Highest Valid: 71.40
  Final Train: 100.00
   Final Test: 70.00
Split: 01, Run: 03
None time:  1.1310797040350735
None Run 03:
Highest Train: 100.00
Highest Valid: 70.60
  Final Train: 100.00
   Final Test: 69.20
run time now: 3.3899526596069336
total time:  3.4455867169890553
None All runs:
Highest Train: 100.00 ± 0.00
Highest Valid: 70.93 ± 0.42
  Final Train: 100.00 ± 0.00
   Final Test: 69.70 ± 0.44
[I 2023-06-11 23:30:21,996] Trial 153 finished with value: 70.93334197998047 and parameters: {'Fwd': 0.007889532059513375, 'K': 9, 'alpha': 0.4, 'dropout': 0.6000000000000001, 'gnnepoch': 120, 'lambda1': 0.7000000000000001, 'lambda2': 3.145478736512186, 'loop': 0, 'loss': 'CE', 'lr': 0.0023643253352633323, 'softmaxF': False, 'useGCN': True, 'weight_decay': 2.446781642956351e-06, 'weightedloss': False}. Best is trial 146 with value: 71.86666870117188.
/home/wxy/miniconda3/lib/python3.10/site-packages/optuna/distributions.py:685: UserWarning: The distribution is specified by [0, 1.00001] and step=0.05, but the range is not divisible by `step`. It will be replaced by [0, 1.0].
  warnings.warn(
K:  8
alpha:  0.4
lr:  0.0028336917245098134
weight_decay:  1.464461018655495e-06
dropout:  0.9
fix split and run 3 times
Data: Data(x=[3327, 3703], y=[3327], train_mask=[3327], val_mask=[3327], test_mask=[3327], adj_t=[3327, 3327, nnz=9104])
num_train tensor(120)
num_noise 0
noise: tensor(0)
data feature 3703
ALTOPT(
  (lins): Sequential(
    (0): Linear(in_features=3703, out_features=64, bias=True)
    (1): BatchNorm1d(64, eps=1e-05, momentum=0.1, affine=True, track_running_stats=True)
    (2): Dropout(p=0.9, inplace=True)
    (3): ReLU(inplace=True)
    (4): Linear(in_features=64, out_features=6, bias=True)
    (5): LogSoftmax(dim=-1)
  )
  (prop): Propagation(K=8, mode=None, lambda1=None, lambda2=None, L21=True, alpha=0.4)
  (gcn): GCN(
    (convs): ModuleList(
      (0): GCNConv(3703, 64)
      (1): GCNConv(64, 6)
    )
    (bns): ModuleList(
      (0): BatchNorm1d(64, eps=1e-05, momentum=0.1, affine=True, track_running_stats=True)
    )
    (output): LogSoftmax(dim=-1)
  )
)
propagate done
init label
Split: 01, Run: 01
None time:  1.1444597290828824
None Run 01:
Highest Train: 100.00
Highest Valid: 71.00
  Final Train: 100.00
   Final Test: 69.40
Split: 01, Run: 02
None time:  1.0704309889115393
None Run 02:
Highest Train: 100.00
Highest Valid: 71.60
  Final Train: 100.00
   Final Test: 70.30
Split: 01, Run: 03
None time:  1.091813012957573
None Run 03:
Highest Train: 100.00
Highest Valid: 71.80
  Final Train: 100.00
   Final Test: 70.10
run time now: 3.3476996421813965
total time:  3.408148783026263
None All runs:
Highest Train: 100.00 ± 0.00
Highest Valid: 71.47 ± 0.42
  Final Train: 100.00 ± 0.00
   Final Test: 69.93 ± 0.47
[I 2023-06-11 23:30:25,882] Trial 154 finished with value: 71.46666717529297 and parameters: {'Fwd': 0.01077980818805587, 'K': 8, 'alpha': 0.4, 'dropout': 0.9, 'gnnepoch': 120, 'lambda1': 0.9500000000000001, 'lambda2': 3.805666720403662, 'loop': 0, 'loss': 'CE', 'lr': 0.0028336917245098134, 'softmaxF': False, 'useGCN': True, 'weight_decay': 1.464461018655495e-06, 'weightedloss': False}. Best is trial 146 with value: 71.86666870117188.
/home/wxy/miniconda3/lib/python3.10/site-packages/optuna/distributions.py:685: UserWarning: The distribution is specified by [0, 1.00001] and step=0.05, but the range is not divisible by `step`. It will be replaced by [0, 1.0].
  warnings.warn(
K:  8
alpha:  0.35000000000000003
lr:  0.00350108814277948
weight_decay:  2.1855610175630184e-06
dropout:  0.9
fix split and run 3 times
Data: Data(x=[3327, 3703], y=[3327], train_mask=[3327], val_mask=[3327], test_mask=[3327], adj_t=[3327, 3327, nnz=9104])
num_train tensor(120)
num_noise 0
noise: tensor(0)
data feature 3703
ALTOPT(
  (lins): Sequential(
    (0): Linear(in_features=3703, out_features=64, bias=True)
    (1): BatchNorm1d(64, eps=1e-05, momentum=0.1, affine=True, track_running_stats=True)
    (2): Dropout(p=0.9, inplace=True)
    (3): ReLU(inplace=True)
    (4): Linear(in_features=64, out_features=6, bias=True)
    (5): LogSoftmax(dim=-1)
  )
  (prop): Propagation(K=8, mode=None, lambda1=None, lambda2=None, L21=True, alpha=0.35000000000000003)
  (gcn): GCN(
    (convs): ModuleList(
      (0): GCNConv(3703, 64)
      (1): GCNConv(64, 6)
    )
    (bns): ModuleList(
      (0): BatchNorm1d(64, eps=1e-05, momentum=0.1, affine=True, track_running_stats=True)
    )
    (output): LogSoftmax(dim=-1)
  )
)
propagate done
init label
Split: 01, Run: 01
None time:  1.0584060449618846
None Run 01:
Highest Train: 100.00
Highest Valid: 71.40
  Final Train: 100.00
   Final Test: 69.40
Split: 01, Run: 02
None time:  1.0315204290673137
None Run 02:
Highest Train: 100.00
Highest Valid: 71.60
  Final Train: 100.00
   Final Test: 69.90
Split: 01, Run: 03
None time:  1.097954324213788
None Run 03:
Highest Train: 100.00
Highest Valid: 71.40
  Final Train: 99.17
   Final Test: 70.60
run time now: 3.228951930999756
total time:  3.284650241024792
None All runs:
Highest Train: 100.00 ± 0.00
Highest Valid: 71.47 ± 0.12
  Final Train: 99.72 ± 0.48
   Final Test: 69.97 ± 0.60
[I 2023-06-11 23:30:29,634] Trial 155 finished with value: 71.46666717529297 and parameters: {'Fwd': 0.01995740688666291, 'K': 8, 'alpha': 0.35000000000000003, 'dropout': 0.9, 'gnnepoch': 120, 'lambda1': 0.8, 'lambda2': 4.064719597453668, 'loop': 0, 'loss': 'CE', 'lr': 0.00350108814277948, 'softmaxF': False, 'useGCN': True, 'weight_decay': 2.1855610175630184e-06, 'weightedloss': False}. Best is trial 146 with value: 71.86666870117188.
/home/wxy/miniconda3/lib/python3.10/site-packages/optuna/distributions.py:685: UserWarning: The distribution is specified by [0, 1.00001] and step=0.05, but the range is not divisible by `step`. It will be replaced by [0, 1.0].
  warnings.warn(
K:  8
alpha:  0.45
lr:  0.002587511553209876
weight_decay:  1.2920329265010552e-06
dropout:  0.8
fix split and run 3 times
Data: Data(x=[3327, 3703], y=[3327], train_mask=[3327], val_mask=[3327], test_mask=[3327], adj_t=[3327, 3327, nnz=9104])
num_train tensor(120)
num_noise 0
noise: tensor(0)
data feature 3703
ALTOPT(
  (lins): Sequential(
    (0): Linear(in_features=3703, out_features=64, bias=True)
    (1): BatchNorm1d(64, eps=1e-05, momentum=0.1, affine=True, track_running_stats=True)
    (2): Dropout(p=0.8, inplace=True)
    (3): ReLU(inplace=True)
    (4): Linear(in_features=64, out_features=6, bias=True)
    (5): LogSoftmax(dim=-1)
  )
  (prop): Propagation(K=8, mode=None, lambda1=None, lambda2=None, L21=True, alpha=0.45)
  (gcn): GCN(
    (convs): ModuleList(
      (0): GCNConv(3703, 64)
      (1): GCNConv(64, 6)
    )
    (bns): ModuleList(
      (0): BatchNorm1d(64, eps=1e-05, momentum=0.1, affine=True, track_running_stats=True)
    )
    (output): LogSoftmax(dim=-1)
  )
)
propagate done
init label
Split: 01, Run: 01
None time:  1.083034954033792
None Run 01:
Highest Train: 100.00
Highest Valid: 71.60
  Final Train: 100.00
   Final Test: 70.00
Split: 01, Run: 02
None time:  1.153319955104962
None Run 02:
Highest Train: 100.00
Highest Valid: 72.20
  Final Train: 100.00
   Final Test: 70.10
Split: 01, Run: 03
None time:  1.1222898189444095
None Run 03:
Highest Train: 100.00
Highest Valid: 71.00
  Final Train: 100.00
   Final Test: 69.20
run time now: 3.3998541831970215
total time:  3.4670204669237137
None All runs:
Highest Train: 100.00 ± 0.00
Highest Valid: 71.60 ± 0.60
  Final Train: 100.00 ± 0.00
   Final Test: 69.77 ± 0.49
[I 2023-06-11 23:30:33,648] Trial 156 finished with value: 71.5999984741211 and parameters: {'Fwd': 0.025640823898613614, 'K': 8, 'alpha': 0.45, 'dropout': 0.8, 'gnnepoch': 120, 'lambda1': 0.9, 'lambda2': 2.963961187718018, 'loop': 0, 'loss': 'CE', 'lr': 0.002587511553209876, 'softmaxF': False, 'useGCN': True, 'weight_decay': 1.2920329265010552e-06, 'weightedloss': False}. Best is trial 146 with value: 71.86666870117188.
/home/wxy/miniconda3/lib/python3.10/site-packages/optuna/distributions.py:685: UserWarning: The distribution is specified by [0, 1.00001] and step=0.05, but the range is not divisible by `step`. It will be replaced by [0, 1.0].
  warnings.warn(
K:  7
alpha:  0.05
lr:  0.004015796241517216
weight_decay:  1.811802423849988e-06
dropout:  0.9
fix split and run 3 times
Data: Data(x=[3327, 3703], y=[3327], train_mask=[3327], val_mask=[3327], test_mask=[3327], adj_t=[3327, 3327, nnz=9104])
num_train tensor(120)
num_noise 0
noise: tensor(0)
data feature 3703
ALTOPT(
  (lins): Sequential(
    (0): Linear(in_features=3703, out_features=64, bias=True)
    (1): BatchNorm1d(64, eps=1e-05, momentum=0.1, affine=True, track_running_stats=True)
    (2): Dropout(p=0.9, inplace=True)
    (3): ReLU(inplace=True)
    (4): Linear(in_features=64, out_features=6, bias=True)
    (5): LogSoftmax(dim=-1)
  )
  (prop): Propagation(K=7, mode=None, lambda1=None, lambda2=None, L21=True, alpha=0.05)
  (gcn): GCN(
    (convs): ModuleList(
      (0): GCNConv(3703, 64)
      (1): GCNConv(64, 6)
    )
    (bns): ModuleList(
      (0): BatchNorm1d(64, eps=1e-05, momentum=0.1, affine=True, track_running_stats=True)
    )
    (output): LogSoftmax(dim=-1)
  )
)
propagate done
init label
Split: 01, Run: 01
None time:  0.7761824869085103
None Run 01:
Highest Train: 100.00
Highest Valid: 66.80
  Final Train: 99.17
   Final Test: 64.70
Split: 01, Run: 02
None time:  0.7095639759209007
None Run 02:
Highest Train: 100.00
Highest Valid: 56.20
  Final Train: 99.17
   Final Test: 58.30
Split: 01, Run: 03
None time:  0.6808340270072222
None Run 03:
Highest Train: 100.00
Highest Valid: 47.40
  Final Train: 98.33
   Final Test: 47.40
run time now: 2.2051937580108643
total time:  2.257230076007545
None All runs:
Highest Train: 100.00 ± 0.00
Highest Valid: 56.80 ± 9.71
  Final Train: 98.89 ± 0.48
   Final Test: 56.80 ± 8.75
[I 2023-06-11 23:30:36,379] Trial 157 finished with value: 56.79999923706055 and parameters: {'Fwd': 0.012295246527466764, 'K': 7, 'alpha': 0.05, 'dropout': 0.9, 'gnnepoch': 110, 'lambda1': 0.65, 'lambda2': 3.4038944037062184, 'loop': 0, 'loss': 'CE', 'lr': 0.004015796241517216, 'softmaxF': False, 'useGCN': False, 'weight_decay': 1.811802423849988e-06, 'weightedloss': False}. Best is trial 146 with value: 71.86666870117188.
/home/wxy/miniconda3/lib/python3.10/site-packages/optuna/distributions.py:685: UserWarning: The distribution is specified by [0, 1.00001] and step=0.05, but the range is not divisible by `step`. It will be replaced by [0, 1.0].
  warnings.warn(
K:  8
alpha:  0.4
lr:  0.0022139271470579896
weight_decay:  3.252226295899526e-06
dropout:  0.9
fix split and run 3 times
Data: Data(x=[3327, 3703], y=[3327], train_mask=[3327], val_mask=[3327], test_mask=[3327], adj_t=[3327, 3327, nnz=9104])
num_train tensor(120)
num_noise 0
noise: tensor(0)
data feature 3703
ALTOPT(
  (lins): Sequential(
    (0): Linear(in_features=3703, out_features=64, bias=True)
    (1): BatchNorm1d(64, eps=1e-05, momentum=0.1, affine=True, track_running_stats=True)
    (2): Dropout(p=0.9, inplace=True)
    (3): ReLU(inplace=True)
    (4): Linear(in_features=64, out_features=6, bias=True)
    (5): LogSoftmax(dim=-1)
  )
  (prop): Propagation(K=8, mode=None, lambda1=None, lambda2=None, L21=True, alpha=0.4)
  (gcn): GCN(
    (convs): ModuleList(
      (0): GCNConv(3703, 64)
      (1): GCNConv(64, 6)
    )
    (bns): ModuleList(
      (0): BatchNorm1d(64, eps=1e-05, momentum=0.1, affine=True, track_running_stats=True)
    )
    (output): LogSoftmax(dim=-1)
  )
)
propagate done
init label
Split: 01, Run: 01
None time:  1.0335683531593531
None Run 01:
Highest Train: 100.00
Highest Valid: 71.00
  Final Train: 100.00
   Final Test: 68.90
Split: 01, Run: 02
None time:  1.050915758823976
None Run 02:
Highest Train: 100.00
Highest Valid: 71.80
  Final Train: 100.00
   Final Test: 70.20
Split: 01, Run: 03
None time:  1.088451422052458
None Run 03:
Highest Train: 100.00
Highest Valid: 71.80
  Final Train: 100.00
   Final Test: 70.10
run time now: 3.213646411895752
total time:  3.2695557849947363
None All runs:
Highest Train: 100.00 ± 0.00
Highest Valid: 71.53 ± 0.46
  Final Train: 100.00 ± 0.00
   Final Test: 69.73 ± 0.72
[I 2023-06-11 23:30:40,104] Trial 158 finished with value: 71.53333282470703 and parameters: {'Fwd': 0.008617712791569919, 'K': 8, 'alpha': 0.4, 'dropout': 0.9, 'gnnepoch': 120, 'lambda1': 1.0, 'lambda2': 3.207180110169804, 'loop': 0, 'loss': 'CE', 'lr': 0.0022139271470579896, 'softmaxF': False, 'useGCN': True, 'weight_decay': 3.252226295899526e-06, 'weightedloss': False}. Best is trial 146 with value: 71.86666870117188.
/home/wxy/miniconda3/lib/python3.10/site-packages/optuna/distributions.py:685: UserWarning: The distribution is specified by [0, 1.00001] and step=0.05, but the range is not divisible by `step`. It will be replaced by [0, 1.0].
  warnings.warn(
K:  9
alpha:  0.1
lr:  0.0030964340417578323
weight_decay:  4.398775758813102e-05
dropout:  0.9
fix split and run 3 times
Data: Data(x=[3327, 3703], y=[3327], train_mask=[3327], val_mask=[3327], test_mask=[3327], adj_t=[3327, 3327, nnz=9104])
num_train tensor(120)
num_noise 0
noise: tensor(0)
data feature 3703
ALTOPT(
  (lins): Sequential(
    (0): Linear(in_features=3703, out_features=64, bias=True)
    (1): BatchNorm1d(64, eps=1e-05, momentum=0.1, affine=True, track_running_stats=True)
    (2): Dropout(p=0.9, inplace=True)
    (3): ReLU(inplace=True)
    (4): Linear(in_features=64, out_features=6, bias=True)
    (5): LogSoftmax(dim=-1)
  )
  (prop): Propagation(K=9, mode=None, lambda1=None, lambda2=None, L21=True, alpha=0.1)
  (gcn): GCN(
    (convs): ModuleList(
      (0): GCNConv(3703, 64)
      (1): GCNConv(64, 6)
    )
    (bns): ModuleList(
      (0): BatchNorm1d(64, eps=1e-05, momentum=0.1, affine=True, track_running_stats=True)
    )
    (output): LogSoftmax(dim=-1)
  )
)
propagate done
init label
Split: 01, Run: 01
None time:  1.3080981699749827
None Run 01:
Highest Train: 100.00
Highest Valid: 71.80
  Final Train: 100.00
   Final Test: 69.30
Split: 01, Run: 02
None time:  1.2858814711216837
None Run 02:
Highest Train: 100.00
Highest Valid: 70.80
  Final Train: 100.00
   Final Test: 69.50
Split: 01, Run: 03
None time:  1.2379050550516695
None Run 03:
Highest Train: 100.00
Highest Valid: 71.00
  Final Train: 100.00
   Final Test: 70.20
run time now: 3.873227834701538
total time:  3.9301261021755636
None All runs:
Highest Train: 100.00 ± 0.00
Highest Valid: 71.20 ± 0.53
  Final Train: 100.00 ± 0.00
   Final Test: 69.67 ± 0.47
[I 2023-06-11 23:30:44,489] Trial 159 finished with value: 71.20000457763672 and parameters: {'Fwd': 0.016224914044730827, 'K': 9, 'alpha': 0.1, 'dropout': 0.9, 'gnnepoch': 120, 'lambda1': 0.75, 'lambda2': 3.647834260741795, 'loop': 2, 'loss': 'CE', 'lr': 0.0030964340417578323, 'softmaxF': False, 'useGCN': True, 'weight_decay': 4.398775758813102e-05, 'weightedloss': False}. Best is trial 146 with value: 71.86666870117188.
/home/wxy/miniconda3/lib/python3.10/site-packages/optuna/distributions.py:685: UserWarning: The distribution is specified by [0, 1.00001] and step=0.05, but the range is not divisible by `step`. It will be replaced by [0, 1.0].
  warnings.warn(
K:  8
alpha:  0.30000000000000004
lr:  0.0015747201655595766
weight_decay:  1.2483946912650884e-06
dropout:  0.8
fix split and run 3 times
Data: Data(x=[3327, 3703], y=[3327], train_mask=[3327], val_mask=[3327], test_mask=[3327], adj_t=[3327, 3327, nnz=9104])
num_train tensor(120)
num_noise 0
noise: tensor(0)
data feature 3703
ALTOPT(
  (lins): Sequential(
    (0): Linear(in_features=3703, out_features=64, bias=True)
    (1): BatchNorm1d(64, eps=1e-05, momentum=0.1, affine=True, track_running_stats=True)
    (2): Dropout(p=0.8, inplace=True)
    (3): ReLU(inplace=True)
    (4): Linear(in_features=64, out_features=6, bias=True)
    (5): LogSoftmax(dim=-1)
  )
  (prop): Propagation(K=8, mode=None, lambda1=None, lambda2=None, L21=True, alpha=0.30000000000000004)
  (gcn): GCN(
    (convs): ModuleList(
      (0): GCNConv(3703, 64)
      (1): GCNConv(64, 6)
    )
    (bns): ModuleList(
      (0): BatchNorm1d(64, eps=1e-05, momentum=0.1, affine=True, track_running_stats=True)
    )
    (output): LogSoftmax(dim=-1)
  )
)
propagate done
init label
Split: 01, Run: 01
None time:  0.4388174710329622
None Run 01:
Highest Train: 100.00
Highest Valid: 70.60
  Final Train: 100.00
   Final Test: 69.80
Split: 01, Run: 02
None time:  0.4567539489362389
None Run 02:
Highest Train: 100.00
Highest Valid: 68.80
  Final Train: 100.00
   Final Test: 66.80
Split: 01, Run: 03
None time:  0.4137598080560565
None Run 03:
Highest Train: 100.00
Highest Valid: 70.40
  Final Train: 100.00
   Final Test: 70.00
run time now: 1.350846529006958
total time:  1.3993822569027543
None All runs:
Highest Train: 100.00 ± 0.00
Highest Valid: 69.93 ± 0.99
  Final Train: 100.00 ± 0.00
   Final Test: 68.87 ± 1.79
[I 2023-06-11 23:30:46,429] Trial 160 finished with value: 69.9333267211914 and parameters: {'Fwd': 0.0070251663691641405, 'K': 8, 'alpha': 0.30000000000000004, 'dropout': 0.8, 'gnnepoch': 40, 'lambda1': 0.9500000000000001, 'lambda2': 2.510646013548409, 'loop': 0, 'loss': 'CE', 'lr': 0.0015747201655595766, 'softmaxF': False, 'useGCN': True, 'weight_decay': 1.2483946912650884e-06, 'weightedloss': False}. Best is trial 146 with value: 71.86666870117188.
/home/wxy/miniconda3/lib/python3.10/site-packages/optuna/distributions.py:685: UserWarning: The distribution is specified by [0, 1.00001] and step=0.05, but the range is not divisible by `step`. It will be replaced by [0, 1.0].
  warnings.warn(
K:  9
alpha:  0.25
lr:  0.0030543954556622515
weight_decay:  1.0084017316557759e-06
dropout:  0.9
fix split and run 3 times
Data: Data(x=[3327, 3703], y=[3327], train_mask=[3327], val_mask=[3327], test_mask=[3327], adj_t=[3327, 3327, nnz=9104])
num_train tensor(120)
num_noise 0
noise: tensor(0)
data feature 3703
ALTOPT(
  (lins): Sequential(
    (0): Linear(in_features=3703, out_features=64, bias=True)
    (1): BatchNorm1d(64, eps=1e-05, momentum=0.1, affine=True, track_running_stats=True)
    (2): Dropout(p=0.9, inplace=True)
    (3): ReLU(inplace=True)
    (4): Linear(in_features=64, out_features=6, bias=True)
    (5): LogSoftmax(dim=-1)
  )
  (prop): Propagation(K=9, mode=None, lambda1=None, lambda2=None, L21=True, alpha=0.25)
  (gcn): GCN(
    (convs): ModuleList(
      (0): GCNConv(3703, 64)
      (1): GCNConv(64, 6)
    )
    (bns): ModuleList(
      (0): BatchNorm1d(64, eps=1e-05, momentum=0.1, affine=True, track_running_stats=True)
    )
    (output): LogSoftmax(dim=-1)
  )
)
propagate done
init label
Split: 01, Run: 01
None time:  1.000806377036497
None Run 01:
Highest Train: 100.00
Highest Valid: 71.40
  Final Train: 99.17
   Final Test: 69.00
Split: 01, Run: 02
None time:  1.028799792053178
None Run 02:
Highest Train: 100.00
Highest Valid: 71.80
  Final Train: 100.00
   Final Test: 70.30
Split: 01, Run: 03
None time:  1.1397369240876287
None Run 03:
Highest Train: 100.00
Highest Valid: 71.60
  Final Train: 100.00
   Final Test: 70.10
run time now: 3.2108287811279297
total time:  3.2664135270752013
None All runs:
Highest Train: 100.00 ± 0.00
Highest Valid: 71.60 ± 0.20
  Final Train: 99.72 ± 0.48
   Final Test: 69.80 ± 0.70
