[I 2023-06-12 00:35:00,614] Trial 242 finished with value: 81.33333587646484 and parameters: {'Fwd': 8.263010446401596e-06, 'K': 10, 'alpha': 0.9500000000000001, 'dropout': 0.9, 'gnnepoch': 60, 'lambda1': 0.8, 'lambda2': 5.633361107852206, 'loop': 1, 'loss': 'MSE', 'lr': 0.0028665723993100685, 'softmaxF': True, 'useGCN': False, 'weight_decay': 0.0080916537139939, 'weightedloss': False}. Best is trial 205 with value: 83.53333282470703.
/home/wxy/miniconda3/lib/python3.10/site-packages/optuna/distributions.py:685: UserWarning: The distribution is specified by [0, 1.00001] and step=0.05, but the range is not divisible by `step`. It will be replaced by [0, 1.0].
  warnings.warn(
K:  10
alpha:  0.9500000000000001
lr:  0.002703262656121682
weight_decay:  0.012883133657722323
dropout:  0.9
fix split and run 3 times
Data: Data(x=[19717, 500], y=[19717], train_mask=[19717], val_mask=[19717], test_mask=[19717], adj_t=[19717, 19717, nnz=88648])
num_train tensor(60)
num_noise 0
noise: tensor(0)
data feature 500
ALTOPT(
  (lins): Sequential(
    (0): Linear(in_features=500, out_features=64, bias=True)
    (1): BatchNorm1d(64, eps=1e-05, momentum=0.1, affine=True, track_running_stats=True)
    (2): Dropout(p=0.9, inplace=True)
    (3): ReLU(inplace=True)
    (4): Linear(in_features=64, out_features=3, bias=True)
    (5): Identity()
  )
  (prop): Propagation(K=10, mode=None, lambda1=None, lambda2=None, L21=True, alpha=0.9500000000000001)
  (gcn): GCN(
    (convs): ModuleList(
      (0): GCNConv(500, 64)
      (1): GCNConv(64, 3)
    )
    (bns): ModuleList(
      (0): BatchNorm1d(64, eps=1e-05, momentum=0.1, affine=True, track_running_stats=True)
    )
    (output): Identity()
  )
)
propagate done
init label
Split: 01, Run: 01
None time:  2.6693998160772026
None Run 01:
Highest Train: 100.00
Highest Valid: 82.20
  Final Train: 100.00
   Final Test: 77.90
Split: 01, Run: 02
None time:  1.8175906101241708
None Run 02:
Highest Train: 100.00
Highest Valid: 83.80
  Final Train: 100.00
   Final Test: 78.90
Split: 01, Run: 03
None time:  1.0547294840216637
None Run 03:
Highest Train: 100.00
Highest Valid: 82.60
  Final Train: 100.00
   Final Test: 78.70
run time now: 5.593791484832764
total time:  5.634017625125125
None All runs:
Highest Train: 100.00 ± 0.00
Highest Valid: 82.87 ± 0.83
  Final Train: 100.00 ± 0.00
   Final Test: 78.50 ± 0.53
[I 2023-06-12 00:35:06,720] Trial 243 finished with value: 82.86666870117188 and parameters: {'Fwd': 5.561606857777092e-06, 'K': 10, 'alpha': 0.9500000000000001, 'dropout': 0.9, 'gnnepoch': 60, 'lambda1': 0.8500000000000001, 'lambda2': 5.792648890113108, 'loop': 1, 'loss': 'MSE', 'lr': 0.002703262656121682, 'softmaxF': True, 'useGCN': False, 'weight_decay': 0.012883133657722323, 'weightedloss': False}. Best is trial 205 with value: 83.53333282470703.
/home/wxy/miniconda3/lib/python3.10/site-packages/optuna/distributions.py:685: UserWarning: The distribution is specified by [0, 1.00001] and step=0.05, but the range is not divisible by `step`. It will be replaced by [0, 1.0].
  warnings.warn(
K:  10
alpha:  1.0
lr:  0.003040267239381225
weight_decay:  0.013040713330256666
dropout:  0.9
fix split and run 3 times
Data: Data(x=[19717, 500], y=[19717], train_mask=[19717], val_mask=[19717], test_mask=[19717], adj_t=[19717, 19717, nnz=88648])
num_train tensor(60)
num_noise 0
noise: tensor(0)
data feature 500
ALTOPT(
  (lins): Sequential(
    (0): Linear(in_features=500, out_features=64, bias=True)
    (1): BatchNorm1d(64, eps=1e-05, momentum=0.1, affine=True, track_running_stats=True)
    (2): Dropout(p=0.9, inplace=True)
    (3): ReLU(inplace=True)
    (4): Linear(in_features=64, out_features=3, bias=True)
    (5): Identity()
  )
  (prop): Propagation(K=10, mode=None, lambda1=None, lambda2=None, L21=True, alpha=1.0)
  (gcn): GCN(
    (convs): ModuleList(
      (0): GCNConv(500, 64)
      (1): GCNConv(64, 3)
    )
    (bns): ModuleList(
      (0): BatchNorm1d(64, eps=1e-05, momentum=0.1, affine=True, track_running_stats=True)
    )
    (output): Identity()
  )
)
propagate done
init label
Split: 01, Run: 01, Epoch: 100, Loss: 0.2680, Train: 100.00%, Valid: 82.40% Test: 78.20%
Split: 01, Run: 01
None time:  3.7969280581455678
None Run 01:
Highest Train: 100.00
Highest Valid: 82.40
  Final Train: 100.00
   Final Test: 78.10
Split: 01, Run: 02
None time:  0.8106256099417806
None Run 02:
Highest Train: 100.00
Highest Valid: 81.20
  Final Train: 100.00
   Final Test: 79.20
Split: 01, Run: 03
None time:  0.8708149129524827
None Run 03:
Highest Train: 100.00
Highest Valid: 81.40
  Final Train: 100.00
   Final Test: 79.70
run time now: 5.524851083755493
total time:  5.569404084002599
None All runs:
Highest Train: 100.00 ± 0.00
Highest Valid: 81.67 ± 0.64
  Final Train: 100.00 ± 0.00
   Final Test: 79.00 ± 0.82
[I 2023-06-12 00:35:12,838] Trial 244 finished with value: 81.66666412353516 and parameters: {'Fwd': 9.194656005934706e-06, 'K': 10, 'alpha': 1.0, 'dropout': 0.9, 'gnnepoch': 60, 'lambda1': 0.8500000000000001, 'lambda2': 5.799216724284869, 'loop': 1, 'loss': 'MSE', 'lr': 0.003040267239381225, 'softmaxF': True, 'useGCN': False, 'weight_decay': 0.013040713330256666, 'weightedloss': False}. Best is trial 205 with value: 83.53333282470703.
/home/wxy/miniconda3/lib/python3.10/site-packages/optuna/distributions.py:685: UserWarning: The distribution is specified by [0, 1.00001] and step=0.05, but the range is not divisible by `step`. It will be replaced by [0, 1.0].
  warnings.warn(
K:  10
alpha:  0.9500000000000001
lr:  0.002725609742067572
weight_decay:  0.014063819903934289
dropout:  0.9
fix split and run 3 times
Data: Data(x=[19717, 500], y=[19717], train_mask=[19717], val_mask=[19717], test_mask=[19717], adj_t=[19717, 19717, nnz=88648])
num_train tensor(60)
num_noise 0
noise: tensor(0)
data feature 500
ALTOPT(
  (lins): Sequential(
    (0): Linear(in_features=500, out_features=64, bias=True)
    (1): BatchNorm1d(64, eps=1e-05, momentum=0.1, affine=True, track_running_stats=True)
    (2): Dropout(p=0.9, inplace=True)
    (3): ReLU(inplace=True)
    (4): Linear(in_features=64, out_features=3, bias=True)
    (5): Identity()
  )
  (prop): Propagation(K=10, mode=None, lambda1=None, lambda2=None, L21=True, alpha=0.9500000000000001)
  (gcn): GCN(
    (convs): ModuleList(
      (0): GCNConv(500, 64)
      (1): GCNConv(64, 3)
    )
    (bns): ModuleList(
      (0): BatchNorm1d(64, eps=1e-05, momentum=0.1, affine=True, track_running_stats=True)
    )
    (output): Identity()
  )
)
propagate done
init label
Split: 01, Run: 01
None time:  2.803907203953713
None Run 01:
Highest Train: 100.00
Highest Valid: 82.00
  Final Train: 100.00
   Final Test: 78.00
Split: 01, Run: 02
None time:  1.9354855709243566
None Run 02:
Highest Train: 100.00
Highest Valid: 83.80
  Final Train: 100.00
   Final Test: 80.00
Split: 01, Run: 03
None time:  0.7188079608604312
None Run 03:
Highest Train: 100.00
Highest Valid: 83.20
  Final Train: 100.00
   Final Test: 79.70
run time now: 5.5135204792022705
total time:  5.5547423081006855
None All runs:
Highest Train: 100.00 ± 0.00
Highest Valid: 83.00 ± 0.92
  Final Train: 100.00 ± 0.00
   Final Test: 79.23 ± 1.08
[I 2023-06-12 00:35:18,934] Trial 245 finished with value: 83.0 and parameters: {'Fwd': 6.40152556193664e-06, 'K': 10, 'alpha': 0.9500000000000001, 'dropout': 0.9, 'gnnepoch': 60, 'lambda1': 0.8, 'lambda2': 5.386405445292846, 'loop': 1, 'loss': 'MSE', 'lr': 0.002725609742067572, 'softmaxF': True, 'useGCN': False, 'weight_decay': 0.014063819903934289, 'weightedloss': False}. Best is trial 205 with value: 83.53333282470703.
/home/wxy/miniconda3/lib/python3.10/site-packages/optuna/distributions.py:685: UserWarning: The distribution is specified by [0, 1.00001] and step=0.05, but the range is not divisible by `step`. It will be replaced by [0, 1.0].
  warnings.warn(
K:  10
alpha:  0.9
lr:  0.0026883501497687637
weight_decay:  0.01351991400896778
dropout:  0.9
fix split and run 3 times
Data: Data(x=[19717, 500], y=[19717], train_mask=[19717], val_mask=[19717], test_mask=[19717], adj_t=[19717, 19717, nnz=88648])
num_train tensor(60)
num_noise 0
noise: tensor(0)
data feature 500
ALTOPT(
  (lins): Sequential(
    (0): Linear(in_features=500, out_features=64, bias=True)
    (1): BatchNorm1d(64, eps=1e-05, momentum=0.1, affine=True, track_running_stats=True)
    (2): Dropout(p=0.9, inplace=True)
    (3): ReLU(inplace=True)
    (4): Linear(in_features=64, out_features=3, bias=True)
    (5): Identity()
  )
  (prop): Propagation(K=10, mode=None, lambda1=None, lambda2=None, L21=True, alpha=0.9)
  (gcn): GCN(
    (convs): ModuleList(
      (0): GCNConv(500, 64)
      (1): GCNConv(64, 3)
    )
    (bns): ModuleList(
      (0): BatchNorm1d(64, eps=1e-05, momentum=0.1, affine=True, track_running_stats=True)
    )
    (output): Identity()
  )
)
propagate done
init label
Split: 01, Run: 01
None time:  2.844230543123558
None Run 01:
Highest Train: 100.00
Highest Valid: 81.60
  Final Train: 100.00
   Final Test: 75.90
Split: 01, Run: 02
None time:  1.3030319919344038
None Run 02:
Highest Train: 100.00
Highest Valid: 83.60
  Final Train: 100.00
   Final Test: 80.10
Split: 01, Run: 03
None time:  1.037466495996341
None Run 03:
Highest Train: 100.00
Highest Valid: 84.00
  Final Train: 100.00
   Final Test: 79.10
run time now: 5.233578443527222
total time:  5.287233628099784
None All runs:
Highest Train: 100.00 ± 0.00
Highest Valid: 83.07 ± 1.29
  Final Train: 100.00 ± 0.00
   Final Test: 78.37 ± 2.19
[I 2023-06-12 00:35:24,698] Trial 246 finished with value: 83.0666732788086 and parameters: {'Fwd': 5.918774862287247e-06, 'K': 10, 'alpha': 0.9, 'dropout': 0.9, 'gnnepoch': 60, 'lambda1': 0.8500000000000001, 'lambda2': 5.27789355325695, 'loop': 1, 'loss': 'MSE', 'lr': 0.0026883501497687637, 'softmaxF': True, 'useGCN': False, 'weight_decay': 0.01351991400896778, 'weightedloss': False}. Best is trial 205 with value: 83.53333282470703.
/home/wxy/miniconda3/lib/python3.10/site-packages/optuna/distributions.py:685: UserWarning: The distribution is specified by [0, 1.00001] and step=0.05, but the range is not divisible by `step`. It will be replaced by [0, 1.0].
  warnings.warn(
K:  10
alpha:  0.9
lr:  0.002608368014068722
weight_decay:  0.01606021999471142
dropout:  0.9
fix split and run 3 times
Data: Data(x=[19717, 500], y=[19717], train_mask=[19717], val_mask=[19717], test_mask=[19717], adj_t=[19717, 19717, nnz=88648])
num_train tensor(60)
num_noise 0
noise: tensor(0)
data feature 500
ALTOPT(
  (lins): Sequential(
    (0): Linear(in_features=500, out_features=64, bias=True)
    (1): BatchNorm1d(64, eps=1e-05, momentum=0.1, affine=True, track_running_stats=True)
    (2): Dropout(p=0.9, inplace=True)
    (3): ReLU(inplace=True)
    (4): Linear(in_features=64, out_features=3, bias=True)
    (5): Identity()
  )
  (prop): Propagation(K=10, mode=None, lambda1=None, lambda2=None, L21=True, alpha=0.9)
  (gcn): GCN(
    (convs): ModuleList(
      (0): GCNConv(500, 64)
      (1): GCNConv(64, 3)
    )
    (bns): ModuleList(
      (0): BatchNorm1d(64, eps=1e-05, momentum=0.1, affine=True, track_running_stats=True)
    )
    (output): Identity()
  )
)
propagate done
init label
Split: 01, Run: 01
None time:  2.3368455281015486
None Run 01:
Highest Train: 100.00
Highest Valid: 80.60
  Final Train: 100.00
   Final Test: 76.40
Split: 01, Run: 02
None time:  1.6740690330043435
None Run 02:
Highest Train: 100.00
Highest Valid: 83.20
  Final Train: 100.00
   Final Test: 79.50
Split: 01, Run: 03
None time:  1.1117039029486477
None Run 03:
Highest Train: 100.00
Highest Valid: 82.20
  Final Train: 100.00
   Final Test: 79.60
run time now: 5.172705173492432
total time:  5.221967762103304
None All runs:
Highest Train: 100.00 ± 0.00
Highest Valid: 82.00 ± 1.31
  Final Train: 100.00 ± 0.00
   Final Test: 78.50 ± 1.82
[I 2023-06-12 00:35:30,359] Trial 247 finished with value: 82.0 and parameters: {'Fwd': 6.403879448569113e-06, 'K': 10, 'alpha': 0.9, 'dropout': 0.9, 'gnnepoch': 60, 'lambda1': 0.8500000000000001, 'lambda2': 5.388278672418592, 'loop': 1, 'loss': 'MSE', 'lr': 0.002608368014068722, 'softmaxF': True, 'useGCN': False, 'weight_decay': 0.01606021999471142, 'weightedloss': False}. Best is trial 205 with value: 83.53333282470703.
/home/wxy/miniconda3/lib/python3.10/site-packages/optuna/distributions.py:685: UserWarning: The distribution is specified by [0, 1.00001] and step=0.05, but the range is not divisible by `step`. It will be replaced by [0, 1.0].
  warnings.warn(
K:  10
alpha:  0.9500000000000001
lr:  0.003235795706097966
weight_decay:  0.015423611776303147
dropout:  0.9
fix split and run 3 times
Data: Data(x=[19717, 500], y=[19717], train_mask=[19717], val_mask=[19717], test_mask=[19717], adj_t=[19717, 19717, nnz=88648])
num_train tensor(60)
num_noise 0
noise: tensor(0)
data feature 500
ALTOPT(
  (lins): Sequential(
    (0): Linear(in_features=500, out_features=64, bias=True)
    (1): BatchNorm1d(64, eps=1e-05, momentum=0.1, affine=True, track_running_stats=True)
    (2): Dropout(p=0.9, inplace=True)
    (3): ReLU(inplace=True)
    (4): Linear(in_features=64, out_features=3, bias=True)
    (5): Identity()
  )
  (prop): Propagation(K=10, mode=None, lambda1=None, lambda2=None, L21=True, alpha=0.9500000000000001)
  (gcn): GCN(
    (convs): ModuleList(
      (0): GCNConv(500, 64)
      (1): GCNConv(64, 3)
    )
    (bns): ModuleList(
      (0): BatchNorm1d(64, eps=1e-05, momentum=0.1, affine=True, track_running_stats=True)
    )
    (output): Identity()
  )
)
propagate done
init label
Split: 01, Run: 01
None time:  2.441684565972537
None Run 01:
Highest Train: 100.00
Highest Valid: 81.00
  Final Train: 100.00
   Final Test: 77.50
Split: 01, Run: 02
None time:  0.8543055530171841
None Run 02:
Highest Train: 100.00
Highest Valid: 81.20
  Final Train: 100.00
   Final Test: 77.20
Split: 01, Run: 03
None time:  2.6805568169802427
None Run 03:
Highest Train: 100.00
Highest Valid: 82.40
  Final Train: 100.00
   Final Test: 79.50
run time now: 6.0265281200408936
total time:  6.079308087006211
None All runs:
Highest Train: 100.00 ± 0.00
Highest Valid: 81.53 ± 0.76
  Final Train: 100.00 ± 0.00
   Final Test: 78.07 ± 1.25
[I 2023-06-12 00:35:36,919] Trial 248 finished with value: 81.53333282470703 and parameters: {'Fwd': 6.6503086402557985e-06, 'K': 10, 'alpha': 0.9500000000000001, 'dropout': 0.9, 'gnnepoch': 60, 'lambda1': 0.9, 'lambda2': 5.558066626793622, 'loop': 1, 'loss': 'MSE', 'lr': 0.003235795706097966, 'softmaxF': True, 'useGCN': False, 'weight_decay': 0.015423611776303147, 'weightedloss': False}. Best is trial 205 with value: 83.53333282470703.
/home/wxy/miniconda3/lib/python3.10/site-packages/optuna/distributions.py:685: UserWarning: The distribution is specified by [0, 1.00001] and step=0.05, but the range is not divisible by `step`. It will be replaced by [0, 1.0].
  warnings.warn(
K:  10
alpha:  0.9
lr:  0.002609916085709189
weight_decay:  0.015809179683434465
dropout:  0.9
fix split and run 3 times
Data: Data(x=[19717, 500], y=[19717], train_mask=[19717], val_mask=[19717], test_mask=[19717], adj_t=[19717, 19717, nnz=88648])
num_train tensor(60)
num_noise 0
noise: tensor(0)
data feature 500
ALTOPT(
  (lins): Sequential(
    (0): Linear(in_features=500, out_features=64, bias=True)
    (1): BatchNorm1d(64, eps=1e-05, momentum=0.1, affine=True, track_running_stats=True)
    (2): Dropout(p=0.9, inplace=True)
    (3): ReLU(inplace=True)
    (4): Linear(in_features=64, out_features=3, bias=True)
    (5): Identity()
  )
  (prop): Propagation(K=10, mode=None, lambda1=None, lambda2=None, L21=True, alpha=0.9)
  (gcn): GCN(
    (convs): ModuleList(
      (0): GCNConv(500, 64)
      (1): GCNConv(64, 3)
    )
    (bns): ModuleList(
      (0): BatchNorm1d(64, eps=1e-05, momentum=0.1, affine=True, track_running_stats=True)
    )
    (output): Identity()
  )
)
propagate done
init label
Split: 01, Run: 01
None time:  3.9775083949789405
None Run 01:
Highest Train: 100.00
Highest Valid: 76.00
  Final Train: 100.00
   Final Test: 75.30
Split: 01, Run: 02
None time:  1.481551529839635
None Run 02:
Highest Train: 100.00
Highest Valid: 75.00
  Final Train: 100.00
   Final Test: 73.20
Split: 01, Run: 03
None time:  1.5289509070571512
None Run 03:
Highest Train: 100.00
Highest Valid: 75.40
  Final Train: 100.00
   Final Test: 72.40
run time now: 7.040837526321411
total time:  7.089133483124897
None All runs:
Highest Train: 100.00 ± 0.00
Highest Valid: 75.47 ± 0.50
  Final Train: 100.00 ± 0.00
   Final Test: 73.63 ± 1.50
[I 2023-06-12 00:35:44,479] Trial 249 finished with value: 75.46666717529297 and parameters: {'Fwd': 5.210539458921229e-06, 'K': 10, 'alpha': 0.9, 'dropout': 0.9, 'gnnepoch': 50, 'lambda1': 0.8, 'lambda2': 5.214793038456641, 'loop': 1, 'loss': 'MSE', 'lr': 0.002609916085709189, 'softmaxF': True, 'useGCN': True, 'weight_decay': 0.015809179683434465, 'weightedloss': False}. Best is trial 205 with value: 83.53333282470703.
/home/wxy/miniconda3/lib/python3.10/site-packages/optuna/distributions.py:685: UserWarning: The distribution is specified by [0, 1.00001] and step=0.05, but the range is not divisible by `step`. It will be replaced by [0, 1.0].
  warnings.warn(
K:  10
alpha:  0.9500000000000001
lr:  0.0029006457894149447
weight_decay:  0.019183723956751546
dropout:  0.9
fix split and run 3 times
Data: Data(x=[19717, 500], y=[19717], train_mask=[19717], val_mask=[19717], test_mask=[19717], adj_t=[19717, 19717, nnz=88648])
num_train tensor(60)
num_noise 0
noise: tensor(0)
data feature 500
ALTOPT(
  (lins): Sequential(
    (0): Linear(in_features=500, out_features=64, bias=True)
    (1): BatchNorm1d(64, eps=1e-05, momentum=0.1, affine=True, track_running_stats=True)
    (2): Dropout(p=0.9, inplace=True)
    (3): ReLU(inplace=True)
    (4): Linear(in_features=64, out_features=3, bias=True)
    (5): Identity()
  )
  (prop): Propagation(K=10, mode=None, lambda1=None, lambda2=None, L21=True, alpha=0.9500000000000001)
  (gcn): GCN(
    (convs): ModuleList(
      (0): GCNConv(500, 64)
      (1): GCNConv(64, 3)
    )
    (bns): ModuleList(
      (0): BatchNorm1d(64, eps=1e-05, momentum=0.1, affine=True, track_running_stats=True)
    )
    (output): Identity()
  )
)
propagate done
init label
Split: 01, Run: 01, Epoch: 100, Loss: 0.2618, Train: 100.00%, Valid: 81.60% Test: 77.60%
Split: 01, Run: 01
None time:  3.6373617390636355
None Run 01:
Highest Train: 100.00
Highest Valid: 81.60
  Final Train: 100.00
   Final Test: 77.50
Split: 01, Run: 02
None time:  1.063557499088347
None Run 02:
Highest Train: 100.00
Highest Valid: 84.20
  Final Train: 100.00
   Final Test: 80.30
Split: 01, Run: 03
None time:  1.6907309361267835
None Run 03:
Highest Train: 100.00
Highest Valid: 82.80
  Final Train: 100.00
   Final Test: 79.10
run time now: 6.44063138961792
total time:  6.483768021920696
None All runs:
Highest Train: 100.00 ± 0.00
Highest Valid: 82.87 ± 1.30
  Final Train: 100.00 ± 0.00
   Final Test: 78.97 ± 1.40
[I 2023-06-12 00:35:51,453] Trial 250 finished with value: 82.86666107177734 and parameters: {'Fwd': 7.325390431496339e-06, 'K': 10, 'alpha': 0.9500000000000001, 'dropout': 0.9, 'gnnepoch': 60, 'lambda1': 0.8500000000000001, 'lambda2': 5.796607217246942, 'loop': 1, 'loss': 'MSE', 'lr': 0.0029006457894149447, 'softmaxF': False, 'useGCN': False, 'weight_decay': 0.019183723956751546, 'weightedloss': False}. Best is trial 205 with value: 83.53333282470703.
/home/wxy/miniconda3/lib/python3.10/site-packages/optuna/distributions.py:685: UserWarning: The distribution is specified by [0, 1.00001] and step=0.05, but the range is not divisible by `step`. It will be replaced by [0, 1.0].
  warnings.warn(
K:  10
alpha:  0.9500000000000001
lr:  0.0030564191270081044
weight_decay:  0.012593756815797852
dropout:  0.9
fix split and run 3 times
Data: Data(x=[19717, 500], y=[19717], train_mask=[19717], val_mask=[19717], test_mask=[19717], adj_t=[19717, 19717, nnz=88648])
num_train tensor(60)
num_noise 0
noise: tensor(0)
data feature 500
ALTOPT(
  (lins): Sequential(
    (0): Linear(in_features=500, out_features=64, bias=True)
    (1): BatchNorm1d(64, eps=1e-05, momentum=0.1, affine=True, track_running_stats=True)
    (2): Dropout(p=0.9, inplace=True)
    (3): ReLU(inplace=True)
    (4): Linear(in_features=64, out_features=3, bias=True)
    (5): Identity()
  )
  (prop): Propagation(K=10, mode=None, lambda1=None, lambda2=None, L21=True, alpha=0.9500000000000001)
  (gcn): GCN(
    (convs): ModuleList(
      (0): GCNConv(500, 64)
      (1): GCNConv(64, 3)
    )
    (bns): ModuleList(
      (0): BatchNorm1d(64, eps=1e-05, momentum=0.1, affine=True, track_running_stats=True)
    )
    (output): Identity()
  )
)
propagate done
init label
Split: 01, Run: 01
None time:  1.639902878087014
None Run 01:
Highest Train: 100.00
Highest Valid: 80.20
  Final Train: 100.00
   Final Test: 76.10
Split: 01, Run: 02
None time:  1.3628851601388305
None Run 02:
Highest Train: 100.00
Highest Valid: 83.60
  Final Train: 100.00
   Final Test: 80.20
Split: 01, Run: 03
None time:  0.9318677540868521
None Run 03:
Highest Train: 100.00
Highest Valid: 81.20
  Final Train: 100.00
   Final Test: 78.40
run time now: 3.9807095527648926
total time:  4.023914457997307
None All runs:
Highest Train: 100.00 ± 0.00
Highest Valid: 81.67 ± 1.75
  Final Train: 100.00 ± 0.00
   Final Test: 78.23 ± 2.06
