[I 2023-06-12 00:18:25,542] Trial 71 finished with value: 80.80000305175781 and parameters: {'Fwd': 7.342736106091735e-06, 'K': 6, 'alpha': 0.9500000000000001, 'dropout': 0.2, 'gnnepoch': 60, 'lambda1': 0.25, 'lambda2': 7.7848355883534355, 'loop': 1, 'loss': 'MSE', 'lr': 0.0013314622274204573, 'softmaxF': True, 'useGCN': False, 'weight_decay': 0.00017880234418509987, 'weightedloss': False}. Best is trial 54 with value: 82.06666564941406.
/home/wxy/miniconda3/lib/python3.10/site-packages/optuna/distributions.py:685: UserWarning: The distribution is specified by [0, 1.00001] and step=0.05, but the range is not divisible by `step`. It will be replaced by [0, 1.0].
  warnings.warn(
K:  5
alpha:  1.0
lr:  0.0010317864256054862
weight_decay:  0.00010533014299824665
dropout:  0.2
fix split and run 3 times
Data: Data(x=[19717, 500], y=[19717], train_mask=[19717], val_mask=[19717], test_mask=[19717], adj_t=[19717, 19717, nnz=88648])
num_train tensor(60)
num_noise 0
noise: tensor(0)
data feature 500
ALTOPT(
  (lins): Sequential(
    (0): Linear(in_features=500, out_features=64, bias=True)
    (1): BatchNorm1d(64, eps=1e-05, momentum=0.1, affine=True, track_running_stats=True)
    (2): Dropout(p=0.2, inplace=True)
    (3): ReLU(inplace=True)
    (4): Linear(in_features=64, out_features=3, bias=True)
    (5): Identity()
  )
  (prop): Propagation(K=5, mode=None, lambda1=None, lambda2=None, L21=True, alpha=1.0)
  (gcn): GCN(
    (convs): ModuleList(
      (0): GCNConv(500, 64)
      (1): GCNConv(64, 3)
    )
    (bns): ModuleList(
      (0): BatchNorm1d(64, eps=1e-05, momentum=0.1, affine=True, track_running_stats=True)
    )
    (output): Identity()
  )
)
propagate done
init label
Split: 01, Run: 01
None time:  1.0038155079819262
None Run 01:
Highest Train: 100.00
Highest Valid: 78.20
  Final Train: 100.00
   Final Test: 76.20
Split: 01, Run: 02
None time:  1.1172089490573853
None Run 02:
Highest Train: 100.00
Highest Valid: 79.40
  Final Train: 100.00
   Final Test: 75.60
Split: 01, Run: 03
None time:  1.0400839939247817
None Run 03:
Highest Train: 100.00
Highest Valid: 79.20
  Final Train: 100.00
   Final Test: 75.80
run time now: 3.204464912414551
total time:  3.25275260489434
None All runs:
Highest Train: 100.00 ± 0.00
Highest Valid: 78.93 ± 0.64
  Final Train: 100.00 ± 0.00
   Final Test: 75.87 ± 0.31
[I 2023-06-12 00:18:29,280] Trial 72 finished with value: 78.93333435058594 and parameters: {'Fwd': 1.5384072963675487e-06, 'K': 5, 'alpha': 1.0, 'dropout': 0.2, 'gnnepoch': 70, 'lambda1': 0.2, 'lambda2': 7.509558047099422, 'loop': 1, 'loss': 'MSE', 'lr': 0.0010317864256054862, 'softmaxF': True, 'useGCN': False, 'weight_decay': 0.00010533014299824665, 'weightedloss': False}. Best is trial 54 with value: 82.06666564941406.
/home/wxy/miniconda3/lib/python3.10/site-packages/optuna/distributions.py:685: UserWarning: The distribution is specified by [0, 1.00001] and step=0.05, but the range is not divisible by `step`. It will be replaced by [0, 1.0].
  warnings.warn(
K:  6
alpha:  0.75
lr:  0.0014453732470527186
weight_decay:  0.0003035993344912953
dropout:  0.30000000000000004
fix split and run 3 times
Data: Data(x=[19717, 500], y=[19717], train_mask=[19717], val_mask=[19717], test_mask=[19717], adj_t=[19717, 19717, nnz=88648])
num_train tensor(60)
num_noise 0
noise: tensor(0)
data feature 500
ALTOPT(
  (lins): Sequential(
    (0): Linear(in_features=500, out_features=64, bias=True)
    (1): BatchNorm1d(64, eps=1e-05, momentum=0.1, affine=True, track_running_stats=True)
    (2): Dropout(p=0.30000000000000004, inplace=True)
    (3): ReLU(inplace=True)
    (4): Linear(in_features=64, out_features=3, bias=True)
    (5): Identity()
  )
  (prop): Propagation(K=6, mode=None, lambda1=None, lambda2=None, L21=True, alpha=0.75)
  (gcn): GCN(
    (convs): ModuleList(
      (0): GCNConv(500, 64)
      (1): GCNConv(64, 3)
    )
    (bns): ModuleList(
      (0): BatchNorm1d(64, eps=1e-05, momentum=0.1, affine=True, track_running_stats=True)
    )
    (output): Identity()
  )
)
propagate done
init label
Split: 01, Run: 01
None time:  2.0392239571083337
None Run 01:
Highest Train: 100.00
Highest Valid: 78.40
  Final Train: 100.00
   Final Test: 75.60
Split: 01, Run: 02
None time:  1.9735109619796276
None Run 02:
Highest Train: 100.00
Highest Valid: 81.40
  Final Train: 100.00
   Final Test: 78.20
Split: 01, Run: 03
None time:  0.9450750821270049
None Run 03:
Highest Train: 100.00
Highest Valid: 81.60
  Final Train: 100.00
   Final Test: 79.10
run time now: 4.999935626983643
total time:  5.042253162013367
None All runs:
Highest Train: 100.00 ± 0.00
Highest Valid: 80.47 ± 1.79
  Final Train: 100.00 ± 0.00
   Final Test: 77.63 ± 1.82
[I 2023-06-12 00:18:34,801] Trial 73 finished with value: 80.46666717529297 and parameters: {'Fwd': 3.4911937314183783e-06, 'K': 6, 'alpha': 0.75, 'dropout': 0.30000000000000004, 'gnnepoch': 60, 'lambda1': 0.30000000000000004, 'lambda2': 8.164968284615979, 'loop': 1, 'loss': 'MSE', 'lr': 0.0014453732470527186, 'softmaxF': True, 'useGCN': False, 'weight_decay': 0.0003035993344912953, 'weightedloss': False}. Best is trial 54 with value: 82.06666564941406.
/home/wxy/miniconda3/lib/python3.10/site-packages/optuna/distributions.py:685: UserWarning: The distribution is specified by [0, 1.00001] and step=0.05, but the range is not divisible by `step`. It will be replaced by [0, 1.0].
  warnings.warn(
K:  7
alpha:  0.8500000000000001
lr:  0.001728595660762412
weight_decay:  0.00014321661202202507
dropout:  0.1
fix split and run 3 times
Data: Data(x=[19717, 500], y=[19717], train_mask=[19717], val_mask=[19717], test_mask=[19717], adj_t=[19717, 19717, nnz=88648])
num_train tensor(60)
num_noise 0
noise: tensor(0)
data feature 500
ALTOPT(
  (lins): Sequential(
    (0): Linear(in_features=500, out_features=64, bias=True)
    (1): BatchNorm1d(64, eps=1e-05, momentum=0.1, affine=True, track_running_stats=True)
    (2): Dropout(p=0.1, inplace=True)
    (3): ReLU(inplace=True)
    (4): Linear(in_features=64, out_features=3, bias=True)
    (5): Identity()
  )
  (prop): Propagation(K=7, mode=None, lambda1=None, lambda2=None, L21=True, alpha=0.8500000000000001)
  (gcn): GCN(
    (convs): ModuleList(
      (0): GCNConv(500, 64)
      (1): GCNConv(64, 3)
    )
    (bns): ModuleList(
      (0): BatchNorm1d(64, eps=1e-05, momentum=0.1, affine=True, track_running_stats=True)
    )
    (output): Identity()
  )
)
propagate done
init label
Split: 01, Run: 01
None time:  2.132999252062291
None Run 01:
Highest Train: 100.00
Highest Valid: 78.60
  Final Train: 100.00
   Final Test: 75.60
Split: 01, Run: 02
None time:  0.8425254721660167
None Run 02:
Highest Train: 100.00
Highest Valid: 79.20
  Final Train: 100.00
   Final Test: 76.60
Split: 01, Run: 03
None time:  0.7520017339847982
None Run 03:
Highest Train: 100.00
Highest Valid: 80.80
  Final Train: 100.00
   Final Test: 77.80
run time now: 3.788449287414551
total time:  3.843614008044824
None All runs:
Highest Train: 100.00 ± 0.00
Highest Valid: 79.53 ± 1.14
  Final Train: 100.00 ± 0.00
   Final Test: 76.67 ± 1.10
[I 2023-06-12 00:18:39,147] Trial 74 finished with value: 79.53333282470703 and parameters: {'Fwd': 2.198859846915953e-06, 'K': 7, 'alpha': 0.8500000000000001, 'dropout': 0.1, 'gnnepoch': 50, 'lambda1': 0.35000000000000003, 'lambda2': 8.52615087487048, 'loop': 1, 'loss': 'MSE', 'lr': 0.001728595660762412, 'softmaxF': True, 'useGCN': False, 'weight_decay': 0.00014321661202202507, 'weightedloss': False}. Best is trial 54 with value: 82.06666564941406.
/home/wxy/miniconda3/lib/python3.10/site-packages/optuna/distributions.py:685: UserWarning: The distribution is specified by [0, 1.00001] and step=0.05, but the range is not divisible by `step`. It will be replaced by [0, 1.0].
  warnings.warn(
K:  6
alpha:  0.9500000000000001
lr:  0.0012444321348835429
weight_decay:  0.0009197423191352963
dropout:  0.5
fix split and run 3 times
Data: Data(x=[19717, 500], y=[19717], train_mask=[19717], val_mask=[19717], test_mask=[19717], adj_t=[19717, 19717, nnz=88648])
num_train tensor(60)
num_noise 0
noise: tensor(0)
data feature 500
ALTOPT(
  (lins): Sequential(
    (0): Linear(in_features=500, out_features=64, bias=True)
    (1): BatchNorm1d(64, eps=1e-05, momentum=0.1, affine=True, track_running_stats=True)
    (2): Dropout(p=0.5, inplace=True)
    (3): ReLU(inplace=True)
    (4): Linear(in_features=64, out_features=3, bias=True)
    (5): Identity()
  )
  (prop): Propagation(K=6, mode=None, lambda1=None, lambda2=None, L21=True, alpha=0.9500000000000001)
  (gcn): GCN(
    (convs): ModuleList(
      (0): GCNConv(500, 64)
      (1): GCNConv(64, 3)
    )
    (bns): ModuleList(
      (0): BatchNorm1d(64, eps=1e-05, momentum=0.1, affine=True, track_running_stats=True)
    )
    (output): Identity()
  )
)
propagate done
init label
Split: 01, Run: 01, Epoch: 100, Loss: 0.1651, Train: 100.00%, Valid: 80.60% Test: 76.50%
Split: 01, Run: 01
None time:  3.0857984800823033
None Run 01:
Highest Train: 100.00
Highest Valid: 80.60
  Final Train: 100.00
   Final Test: 76.40
Split: 01, Run: 02
None time:  2.4085812519770116
None Run 02:
Highest Train: 100.00
Highest Valid: 81.20
  Final Train: 100.00
   Final Test: 77.00
Split: 01, Run: 03
None time:  1.6699591248761863
None Run 03:
Highest Train: 100.00
Highest Valid: 82.00
  Final Train: 100.00
   Final Test: 79.20
run time now: 7.209567070007324
total time:  7.255350121064112
None All runs:
Highest Train: 100.00 ± 0.00
Highest Valid: 81.27 ± 0.70
  Final Train: 100.00 ± 0.00
   Final Test: 77.53 ± 1.47
[I 2023-06-12 00:18:46,907] Trial 75 finished with value: 81.26666259765625 and parameters: {'Fwd': 1.1726233228732284e-05, 'K': 6, 'alpha': 0.9500000000000001, 'dropout': 0.5, 'gnnepoch': 80, 'lambda1': 0.25, 'lambda2': 7.88096824289544, 'loop': 1, 'loss': 'MSE', 'lr': 0.0012444321348835429, 'softmaxF': True, 'useGCN': False, 'weight_decay': 0.0009197423191352963, 'weightedloss': False}. Best is trial 54 with value: 82.06666564941406.
/home/wxy/miniconda3/lib/python3.10/site-packages/optuna/distributions.py:685: UserWarning: The distribution is specified by [0, 1.00001] and step=0.05, but the range is not divisible by `step`. It will be replaced by [0, 1.0].
  warnings.warn(
K:  7
alpha:  0.8
lr:  0.0022433488532113926
weight_decay:  0.0009985086656034874
dropout:  0.5
fix split and run 3 times
Data: Data(x=[19717, 500], y=[19717], train_mask=[19717], val_mask=[19717], test_mask=[19717], adj_t=[19717, 19717, nnz=88648])
num_train tensor(60)
num_noise 0
noise: tensor(0)
data feature 500
ALTOPT(
  (lins): Sequential(
    (0): Linear(in_features=500, out_features=64, bias=True)
    (1): BatchNorm1d(64, eps=1e-05, momentum=0.1, affine=True, track_running_stats=True)
    (2): Dropout(p=0.5, inplace=True)
    (3): ReLU(inplace=True)
    (4): Linear(in_features=64, out_features=3, bias=True)
    (5): Identity()
  )
  (prop): Propagation(K=7, mode=None, lambda1=None, lambda2=None, L21=True, alpha=0.8)
  (gcn): GCN(
    (convs): ModuleList(
      (0): GCNConv(500, 64)
      (1): GCNConv(64, 3)
    )
    (bns): ModuleList(
      (0): BatchNorm1d(64, eps=1e-05, momentum=0.1, affine=True, track_running_stats=True)
    )
    (output): Identity()
  )
)
propagate done
init label
Split: 01, Run: 01
None time:  2.017919820966199
None Run 01:
Highest Train: 100.00
Highest Valid: 80.60
  Final Train: 100.00
   Final Test: 77.60
Split: 01, Run: 02
None time:  1.0689390520565212
None Run 02:
Highest Train: 100.00
Highest Valid: 82.20
  Final Train: 100.00
   Final Test: 79.80
Split: 01, Run: 03
None time:  1.414954778039828
None Run 03:
Highest Train: 100.00
Highest Valid: 80.00
  Final Train: 100.00
   Final Test: 77.20
run time now: 4.543537855148315
total time:  4.587197608081624
None All runs:
Highest Train: 100.00 ± 0.00
Highest Valid: 80.93 ± 1.14
  Final Train: 100.00 ± 0.00
   Final Test: 78.20 ± 1.40
[I 2023-06-12 00:18:52,035] Trial 76 finished with value: 80.93333435058594 and parameters: {'Fwd': 1.4017384893843312e-05, 'K': 7, 'alpha': 0.8, 'dropout': 0.5, 'gnnepoch': 70, 'lambda1': 0.2, 'lambda2': 8.73339851387806, 'loop': 1, 'loss': 'MSE', 'lr': 0.0022433488532113926, 'softmaxF': True, 'useGCN': False, 'weight_decay': 0.0009985086656034874, 'weightedloss': False}. Best is trial 54 with value: 82.06666564941406.
/home/wxy/miniconda3/lib/python3.10/site-packages/optuna/distributions.py:685: UserWarning: The distribution is specified by [0, 1.00001] and step=0.05, but the range is not divisible by `step`. It will be replaced by [0, 1.0].
  warnings.warn(
K:  5
alpha:  0.9
lr:  0.0011418689943320127
weight_decay:  0.0003858961477130869
dropout:  0.6000000000000001
fix split and run 3 times
Data: Data(x=[19717, 500], y=[19717], train_mask=[19717], val_mask=[19717], test_mask=[19717], adj_t=[19717, 19717, nnz=88648])
num_train tensor(60)
num_noise 0
noise: tensor(0)
data feature 500
ALTOPT(
  (lins): Sequential(
    (0): Linear(in_features=500, out_features=64, bias=True)
    (1): BatchNorm1d(64, eps=1e-05, momentum=0.1, affine=True, track_running_stats=True)
    (2): Dropout(p=0.6000000000000001, inplace=True)
    (3): ReLU(inplace=True)
    (4): Linear(in_features=64, out_features=3, bias=True)
    (5): Identity()
  )
  (prop): Propagation(K=5, mode=None, lambda1=None, lambda2=None, L21=True, alpha=0.9)
  (gcn): GCN(
    (convs): ModuleList(
      (0): GCNConv(500, 64)
      (1): GCNConv(64, 3)
    )
    (bns): ModuleList(
      (0): BatchNorm1d(64, eps=1e-05, momentum=0.1, affine=True, track_running_stats=True)
    )
    (output): Identity()
  )
)
propagate done
init label
Split: 01, Run: 01
None time:  1.0998397388029844
None Run 01:
Highest Train: 100.00
Highest Valid: 81.40
  Final Train: 100.00
   Final Test: 77.40
Split: 01, Run: 02
None time:  0.9577652330044657
None Run 02:
Highest Train: 100.00
Highest Valid: 79.20
  Final Train: 100.00
   Final Test: 75.90
Split: 01, Run: 03
None time:  1.362326803151518
None Run 03:
Highest Train: 100.00
Highest Valid: 82.00
  Final Train: 100.00
   Final Test: 79.10
run time now: 3.462658166885376
total time:  3.5021466170437634
None All runs:
Highest Train: 100.00 ± 0.00
Highest Valid: 80.87 ± 1.47
  Final Train: 100.00 ± 0.00
   Final Test: 77.47 ± 1.60
[I 2023-06-12 00:18:56,037] Trial 77 finished with value: 80.86666870117188 and parameters: {'Fwd': 5.085932518132649e-06, 'K': 5, 'alpha': 0.9, 'dropout': 0.6000000000000001, 'gnnepoch': 80, 'lambda1': 0.30000000000000004, 'lambda2': 8.365624288693857, 'loop': 1, 'loss': 'MSE', 'lr': 0.0011418689943320127, 'softmaxF': True, 'useGCN': False, 'weight_decay': 0.0003858961477130869, 'weightedloss': False}. Best is trial 54 with value: 82.06666564941406.
/home/wxy/miniconda3/lib/python3.10/site-packages/optuna/distributions.py:685: UserWarning: The distribution is specified by [0, 1.00001] and step=0.05, but the range is not divisible by `step`. It will be replaced by [0, 1.0].
  warnings.warn(
K:  8
alpha:  0.8
lr:  0.000881697097671672
weight_decay:  0.00023084619697166073
dropout:  0.4
fix split and run 3 times
Data: Data(x=[19717, 500], y=[19717], train_mask=[19717], val_mask=[19717], test_mask=[19717], adj_t=[19717, 19717, nnz=88648])
num_train tensor(60)
num_noise 0
noise: tensor(0)
data feature 500
ALTOPT(
  (lins): Sequential(
    (0): Linear(in_features=500, out_features=64, bias=True)
    (1): BatchNorm1d(64, eps=1e-05, momentum=0.1, affine=True, track_running_stats=True)
    (2): Dropout(p=0.4, inplace=True)
    (3): ReLU(inplace=True)
    (4): Linear(in_features=64, out_features=3, bias=True)
    (5): Identity()
  )
  (prop): Propagation(K=8, mode=None, lambda1=None, lambda2=None, L21=True, alpha=0.8)
  (gcn): GCN(
    (convs): ModuleList(
      (0): GCNConv(500, 64)
      (1): GCNConv(64, 3)
    )
    (bns): ModuleList(
      (0): BatchNorm1d(64, eps=1e-05, momentum=0.1, affine=True, track_running_stats=True)
    )
    (output): Identity()
  )
)
propagate done
init label
Split: 01, Run: 01
None time:  1.2681846199557185
None Run 01:
Highest Train: 100.00
Highest Valid: 78.40
  Final Train: 100.00
   Final Test: 76.20
Split: 01, Run: 02
None time:  1.1452786610461771
None Run 02:
Highest Train: 100.00
Highest Valid: 79.40
  Final Train: 100.00
   Final Test: 76.80
Split: 01, Run: 03
None time:  1.2531428521033376
None Run 03:
Highest Train: 100.00
Highest Valid: 80.40
  Final Train: 100.00
   Final Test: 77.40
run time now: 3.7120275497436523
total time:  3.7676126109436154
None All runs:
Highest Train: 100.00 ± 0.00
Highest Valid: 79.40 ± 1.00
  Final Train: 100.00 ± 0.00
   Final Test: 76.80 ± 0.60
[I 2023-06-12 00:19:00,271] Trial 78 finished with value: 79.4000015258789 and parameters: {'Fwd': 1.1667434407618762e-05, 'K': 8, 'alpha': 0.8, 'dropout': 0.4, 'gnnepoch': 80, 'lambda1': 0.15000000000000002, 'lambda2': 9.09320161642675, 'loop': 1, 'loss': 'MSE', 'lr': 0.000881697097671672, 'softmaxF': True, 'useGCN': False, 'weight_decay': 0.00023084619697166073, 'weightedloss': False}. Best is trial 54 with value: 82.06666564941406.
/home/wxy/miniconda3/lib/python3.10/site-packages/optuna/distributions.py:685: UserWarning: The distribution is specified by [0, 1.00001] and step=0.05, but the range is not divisible by `step`. It will be replaced by [0, 1.0].
  warnings.warn(
K:  6
alpha:  0.45
lr:  0.0018939775420527788
weight_decay:  0.0007627425615972403
dropout:  0.5
fix split and run 3 times
Data: Data(x=[19717, 500], y=[19717], train_mask=[19717], val_mask=[19717], test_mask=[19717], adj_t=[19717, 19717, nnz=88648])
num_train tensor(60)
num_noise 0
noise: tensor(0)
data feature 500
ALTOPT(
  (lins): Sequential(
    (0): Linear(in_features=500, out_features=64, bias=True)
    (1): BatchNorm1d(64, eps=1e-05, momentum=0.1, affine=True, track_running_stats=True)
    (2): Dropout(p=0.5, inplace=True)
    (3): ReLU(inplace=True)
    (4): Linear(in_features=64, out_features=3, bias=True)
    (5): LogSoftmax(dim=-1)
  )
  (prop): Propagation(K=6, mode=None, lambda1=None, lambda2=None, L21=True, alpha=0.45)
  (gcn): GCN(
    (convs): ModuleList(
      (0): GCNConv(500, 64)
      (1): GCNConv(64, 3)
    )
    (bns): ModuleList(
      (0): BatchNorm1d(64, eps=1e-05, momentum=0.1, affine=True, track_running_stats=True)
    )
    (output): LogSoftmax(dim=-1)
  )
)
propagate done
init label
Split: 01, Run: 01
None time:  1.252087441040203
None Run 01:
Highest Train: 100.00
Highest Valid: 79.80
  Final Train: 98.33
   Final Test: 77.90
Split: 01, Run: 02
None time:  1.171737986849621
None Run 02:
Highest Train: 100.00
Highest Valid: 80.80
  Final Train: 100.00
   Final Test: 78.40
Split: 01, Run: 03
None time:  1.2264575329609215
None Run 03:
Highest Train: 100.00
Highest Valid: 79.60
  Final Train: 100.00
   Final Test: 80.30
run time now: 3.6921989917755127
total time:  3.7440969001036137
None All runs:
Highest Train: 100.00 ± 0.00
Highest Valid: 80.07 ± 0.64
  Final Train: 99.44 ± 0.96
   Final Test: 78.87 ± 1.27
[I 2023-06-12 00:19:04,458] Trial 79 finished with value: 80.0666732788086 and parameters: {'Fwd': 1.8807735214408984e-05, 'K': 6, 'alpha': 0.45, 'dropout': 0.5, 'gnnepoch': 90, 'lambda1': 0.30000000000000004, 'lambda2': 9.686976738020288, 'loop': 1, 'loss': 'CE', 'lr': 0.0018939775420527788, 'softmaxF': True, 'useGCN': False, 'weight_decay': 0.0007627425615972403, 'weightedloss': True}. Best is trial 54 with value: 82.06666564941406.
/home/wxy/miniconda3/lib/python3.10/site-packages/optuna/distributions.py:685: UserWarning: The distribution is specified by [0, 1.00001] and step=0.05, but the range is not divisible by `step`. It will be replaced by [0, 1.0].
  warnings.warn(
K:  7
alpha:  0.9500000000000001
lr:  0.0012456458636343603
weight_decay:  0.0004948857451350149
dropout:  0.6000000000000001
fix split and run 3 times
Data: Data(x=[19717, 500], y=[19717], train_mask=[19717], val_mask=[19717], test_mask=[19717], adj_t=[19717, 19717, nnz=88648])
num_train tensor(60)
num_noise 0
noise: tensor(0)
data feature 500
ALTOPT(
  (lins): Sequential(
    (0): Linear(in_features=500, out_features=64, bias=True)
    (1): BatchNorm1d(64, eps=1e-05, momentum=0.1, affine=True, track_running_stats=True)
    (2): Dropout(p=0.6000000000000001, inplace=True)
    (3): ReLU(inplace=True)
    (4): Linear(in_features=64, out_features=3, bias=True)
    (5): Identity()
  )
  (prop): Propagation(K=7, mode=None, lambda1=None, lambda2=None, L21=True, alpha=0.9500000000000001)
  (gcn): GCN(
    (convs): ModuleList(
      (0): GCNConv(500, 64)
      (1): GCNConv(64, 3)
    )
    (bns): ModuleList(
      (0): BatchNorm1d(64, eps=1e-05, momentum=0.1, affine=True, track_running_stats=True)
    )
    (output): Identity()
  )
)
propagate done
init label
Split: 01, Run: 01
None time:  1.4950208070222288
None Run 01:
Highest Train: 100.00
Highest Valid: 83.40
  Final Train: 100.00
   Final Test: 77.90
Split: 01, Run: 02
None time:  1.0966211950872093
None Run 02:
Highest Train: 100.00
Highest Valid: 80.80
  Final Train: 100.00
   Final Test: 78.60
Split: 01, Run: 03
None time:  1.3812369368970394
None Run 03:
Highest Train: 100.00
Highest Valid: 81.20
  Final Train: 100.00
   Final Test: 79.20
run time now: 4.013982534408569
total time:  4.051691115833819
None All runs:
Highest Train: 100.00 ± 0.00
Highest Valid: 81.80 ± 1.40
  Final Train: 100.00 ± 0.00
   Final Test: 78.57 ± 0.65
