[I 2023-06-12 00:43:30,040] Trial 331 finished with value: 81.06666564941406 and parameters: {'Fwd': 0.059737001039672395, 'K': 9, 'alpha': 0.4, 'dropout': 0.4, 'gnnepoch': 60, 'lambda1': 0.8500000000000001, 'lambda2': 5.362515065426803, 'loop': 1, 'loss': 'CE', 'lr': 0.009140916201138905, 'softmaxF': True, 'useGCN': True, 'weight_decay': 0.000743012539269445, 'weightedloss': False}. Best is trial 112 with value: 81.66667175292969.
/home/wxy/miniconda3/lib/python3.10/site-packages/optuna/distributions.py:685: UserWarning: The distribution is specified by [0, 1.00001] and step=0.05, but the range is not divisible by `step`. It will be replaced by [0, 1.0].
  warnings.warn(
K:  10
alpha:  0.55
lr:  0.008475668760769127
weight_decay:  0.0011511341132580707
dropout:  0.4
fix split and run 3 times
Data: Data(x=[2708, 1433], y=[2708], train_mask=[2708], val_mask=[2708], test_mask=[2708], adj_t=[2708, 2708, nnz=10556])
num_train tensor(140)
num_noise 0
noise: tensor(0)
data feature 1433
ALTOPT(
  (lins): Sequential(
    (0): Linear(in_features=1433, out_features=64, bias=True)
    (1): BatchNorm1d(64, eps=1e-05, momentum=0.1, affine=True, track_running_stats=True)
    (2): Dropout(p=0.4, inplace=True)
    (3): ReLU(inplace=True)
    (4): Linear(in_features=64, out_features=7, bias=True)
    (5): LogSoftmax(dim=-1)
  )
  (prop): Propagation(K=10, mode=None, lambda1=None, lambda2=None, L21=True, alpha=0.55)
  (gcn): GCN(
    (convs): ModuleList(
      (0): GCNConv(1433, 64)
      (1): GCNConv(64, 7)
    )
    (bns): ModuleList(
      (0): BatchNorm1d(64, eps=1e-05, momentum=0.1, affine=True, track_running_stats=True)
    )
    (output): LogSoftmax(dim=-1)
  )
)
propagate done
init label
Split: 01, Run: 01
None time:  1.597584102069959
None Run 01:
Highest Train: 100.00
Highest Valid: 81.80
  Final Train: 100.00
   Final Test: 81.90
Split: 01, Run: 02
None time:  1.6416676179505885
None Run 02:
Highest Train: 100.00
Highest Valid: 81.00
  Final Train: 100.00
   Final Test: 80.80
Split: 01, Run: 03
None time:  1.4910961561836302
None Run 03:
Highest Train: 100.00
Highest Valid: 80.80
  Final Train: 100.00
   Final Test: 80.80
run time now: 4.758244752883911
total time:  4.77618271112442
None All runs:
Highest Train: 100.00 ± 0.00
Highest Valid: 81.20 ± 0.53
  Final Train: 100.00 ± 0.00
   Final Test: 81.17 ± 0.64
[I 2023-06-12 00:43:35,331] Trial 332 finished with value: 81.20000457763672 and parameters: {'Fwd': 0.028651962973058977, 'K': 10, 'alpha': 0.55, 'dropout': 0.4, 'gnnepoch': 60, 'lambda1': 0.9, 'lambda2': 4.925695176708457, 'loop': 1, 'loss': 'CE', 'lr': 0.008475668760769127, 'softmaxF': True, 'useGCN': True, 'weight_decay': 0.0011511341132580707, 'weightedloss': False}. Best is trial 112 with value: 81.66667175292969.
/home/wxy/miniconda3/lib/python3.10/site-packages/optuna/distributions.py:685: UserWarning: The distribution is specified by [0, 1.00001] and step=0.05, but the range is not divisible by `step`. It will be replaced by [0, 1.0].
  warnings.warn(
K:  3
alpha:  0.5
lr:  0.0073902526951033255
weight_decay:  8.551477132965497e-05
dropout:  0.4
fix split and run 3 times
Data: Data(x=[2708, 1433], y=[2708], train_mask=[2708], val_mask=[2708], test_mask=[2708], adj_t=[2708, 2708, nnz=10556])
num_train tensor(140)
num_noise 0
noise: tensor(0)
data feature 1433
ALTOPT(
  (lins): Sequential(
    (0): Linear(in_features=1433, out_features=64, bias=True)
    (1): BatchNorm1d(64, eps=1e-05, momentum=0.1, affine=True, track_running_stats=True)
    (2): Dropout(p=0.4, inplace=True)
    (3): ReLU(inplace=True)
    (4): Linear(in_features=64, out_features=7, bias=True)
    (5): LogSoftmax(dim=-1)
  )
  (prop): Propagation(K=3, mode=None, lambda1=None, lambda2=None, L21=True, alpha=0.5)
  (gcn): GCN(
    (convs): ModuleList(
      (0): GCNConv(1433, 64)
      (1): GCNConv(64, 7)
    )
    (bns): ModuleList(
      (0): BatchNorm1d(64, eps=1e-05, momentum=0.1, affine=True, track_running_stats=True)
    )
    (output): LogSoftmax(dim=-1)
  )
)
propagate done
init label
Split: 01, Run: 01
None time:  0.8457060409709811
None Run 01:
Highest Train: 100.00
Highest Valid: 78.60
  Final Train: 100.00
   Final Test: 80.30
Split: 01, Run: 02
None time:  0.763989354018122
None Run 02:
Highest Train: 100.00
Highest Valid: 76.60
  Final Train: 100.00
   Final Test: 79.80
Split: 01, Run: 03
None time:  0.765716457972303
None Run 03:
Highest Train: 100.00
Highest Valid: 78.00
  Final Train: 100.00
   Final Test: 80.90
run time now: 2.405763626098633
total time:  2.4255195951554924
None All runs:
Highest Train: 100.00 ± 0.00
Highest Valid: 77.73 ± 1.03
  Final Train: 100.00 ± 0.00
   Final Test: 80.33 ± 0.55
[I 2023-06-12 00:43:38,283] Trial 333 finished with value: 77.73332977294922 and parameters: {'Fwd': 0.0020261639598937523, 'K': 3, 'alpha': 0.5, 'dropout': 0.4, 'gnnepoch': 60, 'lambda1': 0.9500000000000001, 'lambda2': 6.011603661190049, 'loop': 1, 'loss': 'CE', 'lr': 0.0073902526951033255, 'softmaxF': True, 'useGCN': False, 'weight_decay': 8.551477132965497e-05, 'weightedloss': False}. Best is trial 112 with value: 81.66667175292969.
/home/wxy/miniconda3/lib/python3.10/site-packages/optuna/distributions.py:685: UserWarning: The distribution is specified by [0, 1.00001] and step=0.05, but the range is not divisible by `step`. It will be replaced by [0, 1.0].
  warnings.warn(
K:  10
alpha:  0.6000000000000001
lr:  0.00565432009982821
weight_decay:  4.833458885578982e-05
dropout:  0.4
fix split and run 3 times
Data: Data(x=[2708, 1433], y=[2708], train_mask=[2708], val_mask=[2708], test_mask=[2708], adj_t=[2708, 2708, nnz=10556])
num_train tensor(140)
num_noise 0
noise: tensor(0)
data feature 1433
ALTOPT(
  (lins): Sequential(
    (0): Linear(in_features=1433, out_features=64, bias=True)
    (1): BatchNorm1d(64, eps=1e-05, momentum=0.1, affine=True, track_running_stats=True)
    (2): Dropout(p=0.4, inplace=True)
    (3): ReLU(inplace=True)
    (4): Linear(in_features=64, out_features=7, bias=True)
    (5): LogSoftmax(dim=-1)
  )
  (prop): Propagation(K=10, mode=None, lambda1=None, lambda2=None, L21=True, alpha=0.6000000000000001)
  (gcn): GCN(
    (convs): ModuleList(
      (0): GCNConv(1433, 64)
      (1): GCNConv(64, 7)
    )
    (bns): ModuleList(
      (0): BatchNorm1d(64, eps=1e-05, momentum=0.1, affine=True, track_running_stats=True)
    )
    (output): LogSoftmax(dim=-1)
  )
)
propagate done
init label
Split: 01, Run: 01
None time:  1.7112711151130497
None Run 01:
Highest Train: 100.00
Highest Valid: 81.00
  Final Train: 100.00
   Final Test: 83.00
Split: 01, Run: 02
None time:  1.419518749928102
None Run 02:
Highest Train: 100.00
Highest Valid: 80.60
  Final Train: 100.00
   Final Test: 80.00
Split: 01, Run: 03
None time:  1.7087450451217592
None Run 03:
Highest Train: 100.00
Highest Valid: 81.20
  Final Train: 100.00
   Final Test: 81.00
run time now: 4.872962713241577
total time:  4.887958652107045
None All runs:
Highest Train: 100.00 ± 0.00
Highest Valid: 80.93 ± 0.31
  Final Train: 100.00 ± 0.00
   Final Test: 81.33 ± 1.53
[I 2023-06-12 00:43:43,626] Trial 334 finished with value: 80.93333435058594 and parameters: {'Fwd': 0.09896902095558047, 'K': 10, 'alpha': 0.6000000000000001, 'dropout': 0.4, 'gnnepoch': 50, 'lambda1': 0.8500000000000001, 'lambda2': 4.674725106936695, 'loop': 1, 'loss': 'CE', 'lr': 0.00565432009982821, 'softmaxF': True, 'useGCN': True, 'weight_decay': 4.833458885578982e-05, 'weightedloss': True}. Best is trial 112 with value: 81.66667175292969.
/home/wxy/miniconda3/lib/python3.10/site-packages/optuna/distributions.py:685: UserWarning: The distribution is specified by [0, 1.00001] and step=0.05, but the range is not divisible by `step`. It will be replaced by [0, 1.0].
  warnings.warn(
K:  10
alpha:  0.65
lr:  0.006536277377338899
weight_decay:  0.00014217086763261715
dropout:  0.30000000000000004
fix split and run 3 times
Data: Data(x=[2708, 1433], y=[2708], train_mask=[2708], val_mask=[2708], test_mask=[2708], adj_t=[2708, 2708, nnz=10556])
num_train tensor(140)
num_noise 0
noise: tensor(0)
data feature 1433
ALTOPT(
  (lins): Sequential(
    (0): Linear(in_features=1433, out_features=64, bias=True)
    (1): BatchNorm1d(64, eps=1e-05, momentum=0.1, affine=True, track_running_stats=True)
    (2): Dropout(p=0.30000000000000004, inplace=True)
    (3): ReLU(inplace=True)
    (4): Linear(in_features=64, out_features=7, bias=True)
    (5): LogSoftmax(dim=-1)
  )
  (prop): Propagation(K=10, mode=None, lambda1=None, lambda2=None, L21=True, alpha=0.65)
  (gcn): GCN(
    (convs): ModuleList(
      (0): GCNConv(1433, 64)
      (1): GCNConv(64, 7)
    )
    (bns): ModuleList(
      (0): BatchNorm1d(64, eps=1e-05, momentum=0.1, affine=True, track_running_stats=True)
    )
    (output): LogSoftmax(dim=-1)
  )
)
propagate done
init label
Split: 01, Run: 01
None time:  1.61948027391918
None Run 01:
Highest Train: 100.00
Highest Valid: 81.60
  Final Train: 100.00
   Final Test: 82.20
Split: 01, Run: 02
None time:  1.9293895980808884
None Run 02:
Highest Train: 100.00
Highest Valid: 79.80
  Final Train: 100.00
   Final Test: 81.20
Split: 01, Run: 03
None time:  1.798512727022171
None Run 03:
Highest Train: 100.00
Highest Valid: 80.80
  Final Train: 100.00
   Final Test: 80.90
run time now: 5.374017238616943
total time:  5.3982838310766965
None All runs:
Highest Train: 100.00 ± 0.00
Highest Valid: 80.73 ± 0.90
  Final Train: 100.00 ± 0.00
   Final Test: 81.43 ± 0.68
[I 2023-06-12 00:43:49,561] Trial 335 finished with value: 80.73332977294922 and parameters: {'Fwd': 0.09982492406686706, 'K': 10, 'alpha': 0.65, 'dropout': 0.30000000000000004, 'gnnepoch': 70, 'lambda1': 0.9, 'lambda2': 5.171890179702432, 'loop': 1, 'loss': 'CE', 'lr': 0.006536277377338899, 'softmaxF': True, 'useGCN': True, 'weight_decay': 0.00014217086763261715, 'weightedloss': False}. Best is trial 112 with value: 81.66667175292969.
/home/wxy/miniconda3/lib/python3.10/site-packages/optuna/distributions.py:685: UserWarning: The distribution is specified by [0, 1.00001] and step=0.05, but the range is not divisible by `step`. It will be replaced by [0, 1.0].
  warnings.warn(
K:  10
alpha:  0.65
lr:  0.0004543477609934458
weight_decay:  0.004530909414064809
dropout:  0.5
fix split and run 3 times
Data: Data(x=[2708, 1433], y=[2708], train_mask=[2708], val_mask=[2708], test_mask=[2708], adj_t=[2708, 2708, nnz=10556])
num_train tensor(140)
num_noise 0
noise: tensor(0)
data feature 1433
ALTOPT(
  (lins): Sequential(
    (0): Linear(in_features=1433, out_features=64, bias=True)
    (1): BatchNorm1d(64, eps=1e-05, momentum=0.1, affine=True, track_running_stats=True)
    (2): Dropout(p=0.5, inplace=True)
    (3): ReLU(inplace=True)
    (4): Linear(in_features=64, out_features=7, bias=True)
    (5): LogSoftmax(dim=-1)
  )
  (prop): Propagation(K=10, mode=None, lambda1=None, lambda2=None, L21=True, alpha=0.65)
  (gcn): GCN(
    (convs): ModuleList(
      (0): GCNConv(1433, 64)
      (1): GCNConv(64, 7)
    )
    (bns): ModuleList(
      (0): BatchNorm1d(64, eps=1e-05, momentum=0.1, affine=True, track_running_stats=True)
    )
    (output): LogSoftmax(dim=-1)
  )
)
propagate done
init label
Split: 01, Run: 01
None time:  1.948275342816487
None Run 01:
Highest Train: 100.00
Highest Valid: 79.20
  Final Train: 100.00
   Final Test: 79.00
Split: 01, Run: 02
None time:  1.8612475208938122
None Run 02:
Highest Train: 100.00
Highest Valid: 78.60
  Final Train: 100.00
   Final Test: 78.30
Split: 01, Run: 03
None time:  1.4241426538210362
None Run 03:
Highest Train: 100.00
Highest Valid: 74.60
  Final Train: 100.00
   Final Test: 74.90
run time now: 5.263511896133423
total time:  5.281705243047327
None All runs:
Highest Train: 100.00 ± 0.00
Highest Valid: 77.47 ± 2.50
  Final Train: 100.00 ± 0.00
   Final Test: 77.40 ± 2.19
[I 2023-06-12 00:43:55,299] Trial 336 finished with value: 77.46666717529297 and parameters: {'Fwd': 0.06848533282832465, 'K': 10, 'alpha': 0.65, 'dropout': 0.5, 'gnnepoch': 60, 'lambda1': 0.8500000000000001, 'lambda2': 5.580408486824439, 'loop': 1, 'loss': 'CE', 'lr': 0.0004543477609934458, 'softmaxF': True, 'useGCN': True, 'weight_decay': 0.004530909414064809, 'weightedloss': False}. Best is trial 112 with value: 81.66667175292969.
/home/wxy/miniconda3/lib/python3.10/site-packages/optuna/distributions.py:685: UserWarning: The distribution is specified by [0, 1.00001] and step=0.05, but the range is not divisible by `step`. It will be replaced by [0, 1.0].
  warnings.warn(
K:  10
alpha:  0.6000000000000001
lr:  0.009258412899311777
weight_decay:  0.000543286090856646
dropout:  0.4
fix split and run 3 times
Data: Data(x=[2708, 1433], y=[2708], train_mask=[2708], val_mask=[2708], test_mask=[2708], adj_t=[2708, 2708, nnz=10556])
num_train tensor(140)
num_noise 0
noise: tensor(0)
data feature 1433
ALTOPT(
  (lins): Sequential(
    (0): Linear(in_features=1433, out_features=64, bias=True)
    (1): BatchNorm1d(64, eps=1e-05, momentum=0.1, affine=True, track_running_stats=True)
    (2): Dropout(p=0.4, inplace=True)
    (3): ReLU(inplace=True)
    (4): Linear(in_features=64, out_features=7, bias=True)
    (5): LogSoftmax(dim=-1)
  )
  (prop): Propagation(K=10, mode=None, lambda1=None, lambda2=None, L21=True, alpha=0.6000000000000001)
  (gcn): GCN(
    (convs): ModuleList(
      (0): GCNConv(1433, 64)
      (1): GCNConv(64, 7)
    )
    (bns): ModuleList(
      (0): BatchNorm1d(64, eps=1e-05, momentum=0.1, affine=True, track_running_stats=True)
    )
    (output): LogSoftmax(dim=-1)
  )
)
propagate done
init label
Split: 01, Run: 01
None time:  1.6262168770190328
None Run 01:
Highest Train: 100.00
Highest Valid: 81.80
  Final Train: 100.00
   Final Test: 81.80
Split: 01, Run: 02
None time:  1.6791148271877319
None Run 02:
Highest Train: 100.00
Highest Valid: 81.40
  Final Train: 100.00
   Final Test: 81.20
Split: 01, Run: 03
None time:  1.7181828208267689
None Run 03:
Highest Train: 100.00
Highest Valid: 80.60
  Final Train: 100.00
   Final Test: 80.50
run time now: 5.054346323013306
total time:  5.070702438941225
None All runs:
Highest Train: 100.00 ± 0.00
Highest Valid: 81.27 ± 0.61
  Final Train: 100.00 ± 0.00
   Final Test: 81.17 ± 0.65
[I 2023-06-12 00:44:00,923] Trial 337 finished with value: 81.26667022705078 and parameters: {'Fwd': 2.3257293798349874e-05, 'K': 10, 'alpha': 0.6000000000000001, 'dropout': 0.4, 'gnnepoch': 60, 'lambda1': 0.8, 'lambda2': 3.519908417220636, 'loop': 1, 'loss': 'CE', 'lr': 0.009258412899311777, 'softmaxF': True, 'useGCN': True, 'weight_decay': 0.000543286090856646, 'weightedloss': False}. Best is trial 112 with value: 81.66667175292969.
/home/wxy/miniconda3/lib/python3.10/site-packages/optuna/distributions.py:685: UserWarning: The distribution is specified by [0, 1.00001] and step=0.05, but the range is not divisible by `step`. It will be replaced by [0, 1.0].
  warnings.warn(
K:  2
alpha:  0.7000000000000001
lr:  0.007794385987225017
weight_decay:  0.00010125675626430572
dropout:  0.4
fix split and run 3 times
Data: Data(x=[2708, 1433], y=[2708], train_mask=[2708], val_mask=[2708], test_mask=[2708], adj_t=[2708, 2708, nnz=10556])
num_train tensor(140)
num_noise 0
noise: tensor(0)
data feature 1433
ALTOPT(
  (lins): Sequential(
    (0): Linear(in_features=1433, out_features=64, bias=True)
    (1): BatchNorm1d(64, eps=1e-05, momentum=0.1, affine=True, track_running_stats=True)
    (2): Dropout(p=0.4, inplace=True)
    (3): ReLU(inplace=True)
    (4): Linear(in_features=64, out_features=7, bias=True)
    (5): LogSoftmax(dim=-1)
  )
  (prop): Propagation(K=2, mode=None, lambda1=None, lambda2=None, L21=True, alpha=0.7000000000000001)
  (gcn): GCN(
    (convs): ModuleList(
      (0): GCNConv(1433, 64)
      (1): GCNConv(64, 7)
    )
    (bns): ModuleList(
      (0): BatchNorm1d(64, eps=1e-05, momentum=0.1, affine=True, track_running_stats=True)
    )
    (output): LogSoftmax(dim=-1)
  )
)
propagate done
init label
Split: 01, Run: 01
None time:  1.3873519860208035
None Run 01:
Highest Train: 100.00
Highest Valid: 81.00
  Final Train: 100.00
   Final Test: 82.70
Split: 01, Run: 02
None time:  1.7192933179903775
None Run 02:
Highest Train: 100.00
Highest Valid: 81.00
  Final Train: 100.00
   Final Test: 81.90
Split: 01, Run: 03
None time:  1.6320746860001236
None Run 03:
Highest Train: 100.00
Highest Valid: 81.40
  Final Train: 100.00
   Final Test: 82.40
run time now: 4.766080379486084
total time:  4.784867430105805
None All runs:
Highest Train: 100.00 ± 0.00
Highest Valid: 81.13 ± 0.23
  Final Train: 100.00 ± 0.00
   Final Test: 82.33 ± 0.40
[I 2023-06-12 00:44:06,295] Trial 338 finished with value: 81.13333129882812 and parameters: {'Fwd': 0.006133631051114958, 'K': 2, 'alpha': 0.7000000000000001, 'dropout': 0.4, 'gnnepoch': 70, 'lambda1': 0.9, 'lambda2': 5.42819613949007, 'loop': 1, 'loss': 'CE', 'lr': 0.007794385987225017, 'softmaxF': True, 'useGCN': True, 'weight_decay': 0.00010125675626430572, 'weightedloss': True}. Best is trial 112 with value: 81.66667175292969.
/home/wxy/miniconda3/lib/python3.10/site-packages/optuna/distributions.py:685: UserWarning: The distribution is specified by [0, 1.00001] and step=0.05, but the range is not divisible by `step`. It will be replaced by [0, 1.0].
  warnings.warn(
K:  10
alpha:  0.55
lr:  0.007177595761467103
weight_decay:  0.00017641627568370098
dropout:  0.4
fix split and run 3 times
Data: Data(x=[2708, 1433], y=[2708], train_mask=[2708], val_mask=[2708], test_mask=[2708], adj_t=[2708, 2708, nnz=10556])
num_train tensor(140)
num_noise 0
noise: tensor(0)
data feature 1433
ALTOPT(
  (lins): Sequential(
    (0): Linear(in_features=1433, out_features=64, bias=True)
    (1): BatchNorm1d(64, eps=1e-05, momentum=0.1, affine=True, track_running_stats=True)
    (2): Dropout(p=0.4, inplace=True)
    (3): ReLU(inplace=True)
    (4): Linear(in_features=64, out_features=7, bias=True)
    (5): LogSoftmax(dim=-1)
  )
  (prop): Propagation(K=10, mode=None, lambda1=None, lambda2=None, L21=True, alpha=0.55)
  (gcn): GCN(
    (convs): ModuleList(
      (0): GCNConv(1433, 64)
      (1): GCNConv(64, 7)
    )
    (bns): ModuleList(
      (0): BatchNorm1d(64, eps=1e-05, momentum=0.1, affine=True, track_running_stats=True)
    )
    (output): LogSoftmax(dim=-1)
  )
)
propagate done
init label
Split: 01, Run: 01
None time:  1.4492090800777078
None Run 01:
Highest Train: 100.00
Highest Valid: 80.80
  Final Train: 100.00
   Final Test: 82.40
Split: 01, Run: 02
None time:  1.5997851379215717
None Run 02:
Highest Train: 100.00
Highest Valid: 81.20
  Final Train: 100.00
   Final Test: 81.70
Split: 01, Run: 03
None time:  1.699874275131151
None Run 03:
Highest Train: 100.00
Highest Valid: 80.80
  Final Train: 100.00
   Final Test: 81.10
run time now: 4.776088714599609
total time:  4.794866246869788
None All runs:
Highest Train: 100.00 ± 0.00
Highest Valid: 80.93 ± 0.23
  Final Train: 100.00 ± 0.00
   Final Test: 81.73 ± 0.65
[I 2023-06-12 00:44:11,571] Trial 339 finished with value: 80.93333435058594 and parameters: {'Fwd': 0.020202497794231302, 'K': 10, 'alpha': 0.55, 'dropout': 0.4, 'gnnepoch': 60, 'lambda1': 0.8500000000000001, 'lambda2': 7.958500856296836, 'loop': 1, 'loss': 'CE', 'lr': 0.007177595761467103, 'softmaxF': False, 'useGCN': True, 'weight_decay': 0.00017641627568370098, 'weightedloss': False}. Best is trial 112 with value: 81.66667175292969.
/home/wxy/miniconda3/lib/python3.10/site-packages/optuna/distributions.py:685: UserWarning: The distribution is specified by [0, 1.00001] and step=0.05, but the range is not divisible by `step`. It will be replaced by [0, 1.0].
  warnings.warn(
K:  10
alpha:  0.5
lr:  0.008307467350520336
weight_decay:  3.18830276966184e-05
dropout:  0.5
fix split and run 3 times
Data: Data(x=[2708, 1433], y=[2708], train_mask=[2708], val_mask=[2708], test_mask=[2708], adj_t=[2708, 2708, nnz=10556])
num_train tensor(140)
num_noise 0
noise: tensor(0)
data feature 1433
ALTOPT(
  (lins): Sequential(
    (0): Linear(in_features=1433, out_features=64, bias=True)
    (1): BatchNorm1d(64, eps=1e-05, momentum=0.1, affine=True, track_running_stats=True)
    (2): Dropout(p=0.5, inplace=True)
    (3): ReLU(inplace=True)
    (4): Linear(in_features=64, out_features=7, bias=True)
    (5): LogSoftmax(dim=-1)
  )
  (prop): Propagation(K=10, mode=None, lambda1=None, lambda2=None, L21=True, alpha=0.5)
  (gcn): GCN(
    (convs): ModuleList(
      (0): GCNConv(1433, 64)
      (1): GCNConv(64, 7)
    )
    (bns): ModuleList(
      (0): BatchNorm1d(64, eps=1e-05, momentum=0.1, affine=True, track_running_stats=True)
    )
    (output): LogSoftmax(dim=-1)
  )
)
propagate done
init label
Split: 01, Run: 01
None time:  1.330883617978543
None Run 01:
Highest Train: 100.00
Highest Valid: 82.00
  Final Train: 100.00
   Final Test: 82.30
Split: 01, Run: 02
None time:  1.5923200289253145
None Run 02:
Highest Train: 100.00
Highest Valid: 81.40
  Final Train: 100.00
   Final Test: 81.20
Split: 01, Run: 03
None time:  1.707712291041389
None Run 03:
Highest Train: 100.00
Highest Valid: 80.80
  Final Train: 100.00
   Final Test: 80.90
run time now: 4.6544623374938965
total time:  4.670540313003585
None All runs:
Highest Train: 100.00 ± 0.00
Highest Valid: 81.40 ± 0.60
  Final Train: 100.00 ± 0.00
   Final Test: 81.47 ± 0.74
