[I 2023-06-11 23:21:26,029] A new study created in RDB with name: CiteSeer_ALTOPT
/home/wxy/miniconda3/lib/python3.10/site-packages/optuna/distributions.py:685: UserWarning: The distribution is specified by [0, 1.00001] and step=0.05, but the range is not divisible by `step`. It will be replaced by [0, 1.0].
  warnings.warn(
K:  1
alpha:  0.45
lr:  0.006420635334837568
weight_decay:  3.4933171759920454e-05
dropout:  0.6000000000000001
fix split and run 3 times
Data: Data(x=[3327, 3703], y=[3327], train_mask=[3327], val_mask=[3327], test_mask=[3327], adj_t=[3327, 3327, nnz=9104])
num_train tensor(120)
num_noise 0
noise: tensor(0)
data feature 3703
ALTOPT(
  (lins): Sequential(
    (0): Linear(in_features=3703, out_features=64, bias=True)
    (1): BatchNorm1d(64, eps=1e-05, momentum=0.1, affine=True, track_running_stats=True)
    (2): Dropout(p=0.6000000000000001, inplace=True)
    (3): ReLU(inplace=True)
    (4): Linear(in_features=64, out_features=6, bias=True)
    (5): Identity()
  )
  (prop): Propagation(K=1, mode=None, lambda1=None, lambda2=None, L21=True, alpha=0.45)
  (gcn): GCN(
    (convs): ModuleList(
      (0): GCNConv(3703, 64)
      (1): GCNConv(64, 6)
    )
    (bns): ModuleList(
      (0): BatchNorm1d(64, eps=1e-05, momentum=0.1, affine=True, track_running_stats=True)
    )
    (output): Identity()
  )
)
propagate done
init label
Split: 01, Run: 01
None time:  1.1004960050340742
None Run 01:
Highest Train: 100.00
Highest Valid: 42.40
  Final Train: 100.00
   Final Test: 37.90
Split: 01, Run: 02, Epoch: 100, Loss: 0.1211, Train: 100.00%, Valid: 67.40% Test: 67.50%
Split: 01, Run: 02
None time:  0.8433673018589616
None Run 02:
Highest Train: 100.00
Highest Valid: 67.40
  Final Train: 100.00
   Final Test: 67.50
Split: 01, Run: 03
None time:  0.1714683030731976
None Run 03:
Highest Train: 100.00
Highest Valid: 60.20
  Final Train: 100.00
   Final Test: 60.20
run time now: 2.1524081230163574
total time:  3.8022965569980443
None All runs:
Highest Train: 100.00 ± 0.00
Highest Valid: 56.67 ± 12.87
  Final Train: 100.00 ± 0.00
   Final Test: 55.20 ± 15.42
[I 2023-06-11 23:21:30,385] Trial 0 finished with value: 56.66666793823242 and parameters: {'Fwd': 3.5355145717963133e-06, 'K': 1, 'alpha': 0.45, 'dropout': 0.6000000000000001, 'gnnepoch': 10, 'lambda1': 0.2, 'lambda2': 8.148698370728935, 'loop': 1, 'loss': 'MSE', 'lr': 0.006420635334837568, 'softmaxF': False, 'useGCN': False, 'weight_decay': 3.4933171759920454e-05, 'weightedloss': False}. Best is trial 0 with value: 56.66666793823242.
/home/wxy/miniconda3/lib/python3.10/site-packages/optuna/distributions.py:685: UserWarning: The distribution is specified by [0, 1.00001] and step=0.05, but the range is not divisible by `step`. It will be replaced by [0, 1.0].
  warnings.warn(
K:  5
alpha:  0.35000000000000003
lr:  0.0004892449562421338
weight_decay:  0.015932180107326145
dropout:  0.5
fix split and run 3 times
Data: Data(x=[3327, 3703], y=[3327], train_mask=[3327], val_mask=[3327], test_mask=[3327], adj_t=[3327, 3327, nnz=9104])
num_train tensor(120)
num_noise 0
noise: tensor(0)
data feature 3703
ALTOPT(
  (lins): Sequential(
    (0): Linear(in_features=3703, out_features=64, bias=True)
    (1): BatchNorm1d(64, eps=1e-05, momentum=0.1, affine=True, track_running_stats=True)
    (2): Dropout(p=0.5, inplace=True)
    (3): ReLU(inplace=True)
    (4): Linear(in_features=64, out_features=6, bias=True)
    (5): LogSoftmax(dim=-1)
  )
  (prop): Propagation(K=5, mode=None, lambda1=None, lambda2=None, L21=True, alpha=0.35000000000000003)
  (gcn): GCN(
    (convs): ModuleList(
      (0): GCNConv(3703, 64)
      (1): GCNConv(64, 6)
    )
    (bns): ModuleList(
      (0): BatchNorm1d(64, eps=1e-05, momentum=0.1, affine=True, track_running_stats=True)
    )
    (output): LogSoftmax(dim=-1)
  )
)
propagate done
init label
Split: 01, Run: 01
None time:  0.3508059149608016
None Run 01:
Highest Train: 100.00
Highest Valid: 46.00
  Final Train: 100.00
   Final Test: 43.40
Split: 01, Run: 02
None time:  0.46827091998420656
None Run 02:
Highest Train: 100.00
Highest Valid: 50.60
  Final Train: 100.00
   Final Test: 50.20
Split: 01, Run: 03
None time:  0.4027395450975746
None Run 03:
Highest Train: 100.00
Highest Valid: 49.80
  Final Train: 100.00
   Final Test: 49.20
run time now: 1.2597146034240723
total time:  1.3160164540167898
None All runs:
Highest Train: 100.00 ± 0.00
Highest Valid: 48.80 ± 2.46
  Final Train: 100.00 ± 0.00
   Final Test: 47.60 ± 3.67
[I 2023-06-11 23:21:32,038] Trial 1 finished with value: 48.79999923706055 and parameters: {'Fwd': 5.766419694714932e-06, 'K': 5, 'alpha': 0.35000000000000003, 'dropout': 0.5, 'gnnepoch': 40, 'lambda1': 0.6000000000000001, 'lambda2': 0.49656273974382326, 'loop': 2, 'loss': 'CE', 'lr': 0.0004892449562421338, 'softmaxF': True, 'useGCN': False, 'weight_decay': 0.015932180107326145, 'weightedloss': False}. Best is trial 0 with value: 56.66666793823242.
/home/wxy/miniconda3/lib/python3.10/site-packages/optuna/distributions.py:685: UserWarning: The distribution is specified by [0, 1.00001] and step=0.05, but the range is not divisible by `step`. It will be replaced by [0, 1.0].
  warnings.warn(
K:  5
alpha:  0.0
lr:  0.0002753256083832034
weight_decay:  0.002836951146949014
dropout:  0.1
fix split and run 3 times
Data: Data(x=[3327, 3703], y=[3327], train_mask=[3327], val_mask=[3327], test_mask=[3327], adj_t=[3327, 3327, nnz=9104])
num_train tensor(120)
num_noise 0
noise: tensor(0)
data feature 3703
ALTOPT(
  (lins): Sequential(
    (0): Linear(in_features=3703, out_features=64, bias=True)
    (1): BatchNorm1d(64, eps=1e-05, momentum=0.1, affine=True, track_running_stats=True)
    (2): Dropout(p=0.1, inplace=True)
    (3): ReLU(inplace=True)
    (4): Linear(in_features=64, out_features=6, bias=True)
    (5): LogSoftmax(dim=-1)
  )
  (prop): Propagation(K=5, mode=None, lambda1=None, lambda2=None, L21=True, alpha=0.0)
  (gcn): GCN(
    (convs): ModuleList(
      (0): GCNConv(3703, 64)
      (1): GCNConv(64, 6)
    )
    (bns): ModuleList(
      (0): BatchNorm1d(64, eps=1e-05, momentum=0.1, affine=True, track_running_stats=True)
    )
    (output): LogSoftmax(dim=-1)
  )
)
propagate done
init label
Split: 01, Run: 01
None time:  0.3573334019165486
None Run 01:
Highest Train: 100.00
Highest Valid: 51.40
  Final Train: 100.00
   Final Test: 51.60
Split: 01, Run: 02
None time:  0.4795722831040621
None Run 02:
Highest Train: 100.00
Highest Valid: 51.40
  Final Train: 100.00
   Final Test: 51.60
Split: 01, Run: 03
None time:  0.4760174690745771
None Run 03:
Highest Train: 100.00
Highest Valid: 51.40
  Final Train: 100.00
   Final Test: 51.60
run time now: 1.3507964611053467
total time:  1.4061265420168638
None All runs:
Highest Train: 100.00 ± 0.00
Highest Valid: 51.40 ± 0.00
  Final Train: 100.00 ± 0.00
   Final Test: 51.60 ± 0.00
[I 2023-06-11 23:21:33,779] Trial 2 finished with value: 51.40000534057617 and parameters: {'Fwd': 2.792204508492434e-05, 'K': 5, 'alpha': 0.0, 'dropout': 0.1, 'gnnepoch': 20, 'lambda1': 0.0, 'lambda2': 3.285284561213305, 'loop': 1, 'loss': 'CE', 'lr': 0.0002753256083832034, 'softmaxF': False, 'useGCN': False, 'weight_decay': 0.002836951146949014, 'weightedloss': True}. Best is trial 0 with value: 56.66666793823242.
/home/wxy/miniconda3/lib/python3.10/site-packages/optuna/distributions.py:685: UserWarning: The distribution is specified by [0, 1.00001] and step=0.05, but the range is not divisible by `step`. It will be replaced by [0, 1.0].
  warnings.warn(
K:  10
alpha:  0.6000000000000001
lr:  0.0049180594086789525
weight_decay:  0.0001482863192561436
dropout:  0.1
fix split and run 3 times
Data: Data(x=[3327, 3703], y=[3327], train_mask=[3327], val_mask=[3327], test_mask=[3327], adj_t=[3327, 3327, nnz=9104])
num_train tensor(120)
num_noise 0
noise: tensor(0)
data feature 3703
ALTOPT(
  (lins): Sequential(
    (0): Linear(in_features=3703, out_features=64, bias=True)
    (1): BatchNorm1d(64, eps=1e-05, momentum=0.1, affine=True, track_running_stats=True)
    (2): Dropout(p=0.1, inplace=True)
    (3): ReLU(inplace=True)
    (4): Linear(in_features=64, out_features=6, bias=True)
    (5): LogSoftmax(dim=-1)
  )
  (prop): Propagation(K=10, mode=None, lambda1=None, lambda2=None, L21=True, alpha=0.6000000000000001)
  (gcn): GCN(
    (convs): ModuleList(
      (0): GCNConv(3703, 64)
      (1): GCNConv(64, 6)
    )
    (bns): ModuleList(
      (0): BatchNorm1d(64, eps=1e-05, momentum=0.1, affine=True, track_running_stats=True)
    )
    (output): LogSoftmax(dim=-1)
  )
)
propagate done
init label
Split: 01, Run: 01
None time:  1.2964983191341162
None Run 01:
Highest Train: 100.00
Highest Valid: 70.00
  Final Train: 95.00
   Final Test: 68.10
Split: 01, Run: 02
None time:  1.1832810118794441
None Run 02:
Highest Train: 100.00
Highest Valid: 70.60
  Final Train: 92.50
   Final Test: 67.90
Split: 01, Run: 03
None time:  1.2255786920432001
None Run 03:
Highest Train: 100.00
Highest Valid: 69.80
  Final Train: 91.67
   Final Test: 68.60
run time now: 3.7480146884918213
total time:  3.803995468886569
None All runs:
Highest Train: 100.00 ± 0.00
Highest Valid: 70.13 ± 0.42
  Final Train: 93.06 ± 1.73
   Final Test: 68.20 ± 0.36
[I 2023-06-11 23:21:37,929] Trial 3 finished with value: 70.13333892822266 and parameters: {'Fwd': 1.54370177862792e-06, 'K': 10, 'alpha': 0.6000000000000001, 'dropout': 0.1, 'gnnepoch': 80, 'lambda1': 0.8500000000000001, 'lambda2': 3.438940754130917, 'loop': 2, 'loss': 'CE', 'lr': 0.0049180594086789525, 'softmaxF': True, 'useGCN': True, 'weight_decay': 0.0001482863192561436, 'weightedloss': True}. Best is trial 3 with value: 70.13333892822266.
/home/wxy/miniconda3/lib/python3.10/site-packages/optuna/distributions.py:685: UserWarning: The distribution is specified by [0, 1.00001] and step=0.05, but the range is not divisible by `step`. It will be replaced by [0, 1.0].
  warnings.warn(
K:  9
alpha:  0.75
lr:  0.0038512691231938644
weight_decay:  0.09481142078311784
dropout:  0.0
fix split and run 3 times
Data: Data(x=[3327, 3703], y=[3327], train_mask=[3327], val_mask=[3327], test_mask=[3327], adj_t=[3327, 3327, nnz=9104])
num_train tensor(120)
num_noise 0
noise: tensor(0)
data feature 3703
ALTOPT(
  (lins): Sequential(
    (0): Linear(in_features=3703, out_features=64, bias=True)
    (1): BatchNorm1d(64, eps=1e-05, momentum=0.1, affine=True, track_running_stats=True)
    (2): Dropout(p=0.0, inplace=True)
    (3): ReLU(inplace=True)
    (4): Linear(in_features=64, out_features=6, bias=True)
    (5): LogSoftmax(dim=-1)
  )
  (prop): Propagation(K=9, mode=None, lambda1=None, lambda2=None, L21=True, alpha=0.75)
  (gcn): GCN(
    (convs): ModuleList(
      (0): GCNConv(3703, 64)
      (1): GCNConv(64, 6)
    )
    (bns): ModuleList(
      (0): BatchNorm1d(64, eps=1e-05, momentum=0.1, affine=True, track_running_stats=True)
    )
    (output): LogSoftmax(dim=-1)
  )
)
propagate done
init label
Split: 01, Run: 01
None time:  0.6286036339588463
None Run 01:
Highest Train: 100.00
Highest Valid: 55.20
  Final Train: 100.00
   Final Test: 53.00
Split: 01, Run: 02
None time:  0.6310402119997889
None Run 02:
Highest Train: 100.00
Highest Valid: 52.60
  Final Train: 100.00
   Final Test: 53.20
Split: 01, Run: 03
None time:  1.7578219920396805
None Run 03:
Highest Train: 100.00
Highest Valid: 56.60
  Final Train: 89.17
   Final Test: 52.10
run time now: 3.0597481727600098
total time:  3.1161161998752505
None All runs:
Highest Train: 100.00 ± 0.00
Highest Valid: 54.80 ± 2.03
  Final Train: 96.39 ± 6.25
   Final Test: 52.77 ± 0.59
[I 2023-06-11 23:21:41,352] Trial 4 finished with value: 54.79999923706055 and parameters: {'Fwd': 0.00033837367052010796, 'K': 9, 'alpha': 0.75, 'dropout': 0.0, 'gnnepoch': 80, 'lambda1': 0.15000000000000002, 'lambda2': 7.070191506528128, 'loop': 2, 'loss': 'CE', 'lr': 0.0038512691231938644, 'softmaxF': True, 'useGCN': False, 'weight_decay': 0.09481142078311784, 'weightedloss': False}. Best is trial 3 with value: 70.13333892822266.
/home/wxy/miniconda3/lib/python3.10/site-packages/optuna/distributions.py:685: UserWarning: The distribution is specified by [0, 1.00001] and step=0.05, but the range is not divisible by `step`. It will be replaced by [0, 1.0].
  warnings.warn(
K:  9
alpha:  0.15000000000000002
lr:  0.00024172529381933508
weight_decay:  3.0918662635095624e-06
dropout:  0.6000000000000001
fix split and run 3 times
Data: Data(x=[3327, 3703], y=[3327], train_mask=[3327], val_mask=[3327], test_mask=[3327], adj_t=[3327, 3327, nnz=9104])
num_train tensor(120)
num_noise 0
noise: tensor(0)
data feature 3703
ALTOPT(
  (lins): Sequential(
    (0): Linear(in_features=3703, out_features=64, bias=True)
    (1): BatchNorm1d(64, eps=1e-05, momentum=0.1, affine=True, track_running_stats=True)
    (2): Dropout(p=0.6000000000000001, inplace=True)
    (3): ReLU(inplace=True)
    (4): Linear(in_features=64, out_features=6, bias=True)
    (5): Identity()
  )
  (prop): Propagation(K=9, mode=None, lambda1=None, lambda2=None, L21=True, alpha=0.15000000000000002)
  (gcn): GCN(
    (convs): ModuleList(
      (0): GCNConv(3703, 64)
      (1): GCNConv(64, 6)
    )
    (bns): ModuleList(
      (0): BatchNorm1d(64, eps=1e-05, momentum=0.1, affine=True, track_running_stats=True)
    )
    (output): Identity()
  )
)
propagate done
init label
Split: 01, Run: 01, Epoch: 100, Loss: 0.5337, Train: 100.00%, Valid: 56.00% Test: 55.90%
Split: 01, Run: 01
None time:  2.4139677511993796
None Run 01:
Highest Train: 100.00
Highest Valid: 56.00
  Final Train: 100.00
   Final Test: 55.90
Split: 01, Run: 02
None time:  0.9221836649812758
None Run 02:
Highest Train: 100.00
Highest Valid: 46.60
  Final Train: 100.00
   Final Test: 45.90
Split: 01, Run: 03
None time:  1.0569677979219705
None Run 03:
Highest Train: 100.00
Highest Valid: 51.20
  Final Train: 100.00
   Final Test: 49.90
run time now: 4.435431003570557
total time:  4.4949717100244015
None All runs:
Highest Train: 100.00 ± 0.00
Highest Valid: 51.27 ± 4.70
  Final Train: 100.00 ± 0.00
   Final Test: 50.57 ± 5.03
[I 2023-06-11 23:21:46,203] Trial 5 finished with value: 51.266666412353516 and parameters: {'Fwd': 0.0003964788373686253, 'K': 9, 'alpha': 0.15000000000000002, 'dropout': 0.6000000000000001, 'gnnepoch': 80, 'lambda1': 0.9500000000000001, 'lambda2': 4.73225951567425, 'loop': 1, 'loss': 'MSE', 'lr': 0.00024172529381933508, 'softmaxF': True, 'useGCN': True, 'weight_decay': 3.0918662635095624e-06, 'weightedloss': True}. Best is trial 3 with value: 70.13333892822266.
/home/wxy/miniconda3/lib/python3.10/site-packages/optuna/distributions.py:685: UserWarning: The distribution is specified by [0, 1.00001] and step=0.05, but the range is not divisible by `step`. It will be replaced by [0, 1.0].
  warnings.warn(
K:  7
alpha:  0.9500000000000001
lr:  0.006929645438291059
weight_decay:  0.00048357365075880367
dropout:  0.2
fix split and run 3 times
Data: Data(x=[3327, 3703], y=[3327], train_mask=[3327], val_mask=[3327], test_mask=[3327], adj_t=[3327, 3327, nnz=9104])
num_train tensor(120)
num_noise 0
noise: tensor(0)
data feature 3703
ALTOPT(
  (lins): Sequential(
    (0): Linear(in_features=3703, out_features=64, bias=True)
    (1): BatchNorm1d(64, eps=1e-05, momentum=0.1, affine=True, track_running_stats=True)
    (2): Dropout(p=0.2, inplace=True)
    (3): ReLU(inplace=True)
    (4): Linear(in_features=64, out_features=6, bias=True)
    (5): LogSoftmax(dim=-1)
  )
  (prop): Propagation(K=7, mode=None, lambda1=None, lambda2=None, L21=True, alpha=0.9500000000000001)
  (gcn): GCN(
    (convs): ModuleList(
      (0): GCNConv(3703, 64)
      (1): GCNConv(64, 6)
    )
    (bns): ModuleList(
      (0): BatchNorm1d(64, eps=1e-05, momentum=0.1, affine=True, track_running_stats=True)
    )
    (output): LogSoftmax(dim=-1)
  )
)
propagate done
init label
Split: 01, Run: 01
None time:  0.8479085508733988
None Run 01:
Highest Train: 100.00
Highest Valid: 52.20
  Final Train: 100.00
   Final Test: 53.10
Split: 01, Run: 02
None time:  1.0514008670579642
None Run 02:
Highest Train: 100.00
Highest Valid: 57.20
  Final Train: 85.83
   Final Test: 53.50
Split: 01, Run: 03
None time:  0.9246250940486789
None Run 03:
Highest Train: 100.00
Highest Valid: 55.00
  Final Train: 98.33
   Final Test: 51.50
run time now: 2.8629209995269775
total time:  2.93192889704369
None All runs:
Highest Train: 100.00 ± 0.00
Highest Valid: 54.80 ± 2.51
  Final Train: 94.72 ± 7.74
   Final Test: 52.70 ± 1.06
[I 2023-06-11 23:21:49,470] Trial 6 finished with value: 54.80000305175781 and parameters: {'Fwd': 1.5527125283508268e-06, 'K': 7, 'alpha': 0.9500000000000001, 'dropout': 0.2, 'gnnepoch': 120, 'lambda1': 0.8, 'lambda2': 6.744083368510293, 'loop': 2, 'loss': 'CE', 'lr': 0.006929645438291059, 'softmaxF': True, 'useGCN': False, 'weight_decay': 0.00048357365075880367, 'weightedloss': True}. Best is trial 3 with value: 70.13333892822266.
/home/wxy/miniconda3/lib/python3.10/site-packages/optuna/distributions.py:685: UserWarning: The distribution is specified by [0, 1.00001] and step=0.05, but the range is not divisible by `step`. It will be replaced by [0, 1.0].
  warnings.warn(
K:  8
alpha:  0.0
lr:  0.00028452034473771046
weight_decay:  1.697776798286908e-05
dropout:  0.1
fix split and run 3 times
Data: Data(x=[3327, 3703], y=[3327], train_mask=[3327], val_mask=[3327], test_mask=[3327], adj_t=[3327, 3327, nnz=9104])
num_train tensor(120)
num_noise 0
noise: tensor(0)
data feature 3703
ALTOPT(
  (lins): Sequential(
    (0): Linear(in_features=3703, out_features=64, bias=True)
    (1): BatchNorm1d(64, eps=1e-05, momentum=0.1, affine=True, track_running_stats=True)
    (2): Dropout(p=0.1, inplace=True)
    (3): ReLU(inplace=True)
    (4): Linear(in_features=64, out_features=6, bias=True)
    (5): LogSoftmax(dim=-1)
  )
  (prop): Propagation(K=8, mode=None, lambda1=None, lambda2=None, L21=True, alpha=0.0)
  (gcn): GCN(
    (convs): ModuleList(
      (0): GCNConv(3703, 64)
      (1): GCNConv(64, 6)
    )
    (bns): ModuleList(
      (0): BatchNorm1d(64, eps=1e-05, momentum=0.1, affine=True, track_running_stats=True)
    )
    (output): LogSoftmax(dim=-1)
  )
)
propagate done
init label
Split: 01, Run: 01
None time:  0.7862587310373783
None Run 01:
Highest Train: 100.00
Highest Valid: 59.60
  Final Train: 100.00
   Final Test: 58.90
Split: 01, Run: 02
None time:  0.8250788459554315
None Run 02:
Highest Train: 100.00
Highest Valid: 61.40
  Final Train: 100.00
   Final Test: 61.40
Split: 01, Run: 03
None time:  0.6961030929815024
None Run 03:
Highest Train: 100.00
Highest Valid: 62.20
  Final Train: 100.00
   Final Test: 62.40
run time now: 2.34828519821167
total time:  2.4057847252115607
None All runs:
Highest Train: 100.00 ± 0.00
Highest Valid: 61.07 ± 1.33
  Final Train: 100.00 ± 0.00
   Final Test: 60.90 ± 1.80
[I 2023-06-11 23:21:52,274] Trial 7 finished with value: 61.06666564941406 and parameters: {'Fwd': 0.0004234375735540433, 'K': 8, 'alpha': 0.0, 'dropout': 0.1, 'gnnepoch': 120, 'lambda1': 0.5, 'lambda2': 9.220462206550188, 'loop': 1, 'loss': 'CE', 'lr': 0.00028452034473771046, 'softmaxF': True, 'useGCN': False, 'weight_decay': 1.697776798286908e-05, 'weightedloss': False}. Best is trial 3 with value: 70.13333892822266.
/home/wxy/miniconda3/lib/python3.10/site-packages/optuna/distributions.py:685: UserWarning: The distribution is specified by [0, 1.00001] and step=0.05, but the range is not divisible by `step`. It will be replaced by [0, 1.0].
  warnings.warn(
K:  8
alpha:  0.4
lr:  0.009663075999838653
weight_decay:  5.803888314026306e-05
dropout:  0.7000000000000001
fix split and run 3 times
Data: Data(x=[3327, 3703], y=[3327], train_mask=[3327], val_mask=[3327], test_mask=[3327], adj_t=[3327, 3327, nnz=9104])
num_train tensor(120)
num_noise 0
noise: tensor(0)
data feature 3703
ALTOPT(
  (lins): Sequential(
    (0): Linear(in_features=3703, out_features=64, bias=True)
    (1): BatchNorm1d(64, eps=1e-05, momentum=0.1, affine=True, track_running_stats=True)
    (2): Dropout(p=0.7000000000000001, inplace=True)
    (3): ReLU(inplace=True)
    (4): Linear(in_features=64, out_features=6, bias=True)
    (5): Identity()
  )
  (prop): Propagation(K=8, mode=None, lambda1=None, lambda2=None, L21=True, alpha=0.4)
  (gcn): GCN(
    (convs): ModuleList(
      (0): GCNConv(3703, 64)
      (1): GCNConv(64, 6)
    )
    (bns): ModuleList(
      (0): BatchNorm1d(64, eps=1e-05, momentum=0.1, affine=True, track_running_stats=True)
    )
    (output): Identity()
  )
)
propagate done
init label
Split: 01, Run: 01
None time:  0.8663752630818635
None Run 01:
Highest Train: 100.00
Highest Valid: 52.00
  Final Train: 100.00
   Final Test: 51.80
Split: 01, Run: 02
None time:  0.8884411209728569
None Run 02:
Highest Train: 100.00
Highest Valid: 52.00
  Final Train: 100.00
   Final Test: 51.80
Split: 01, Run: 03
None time:  0.8890501440037042
None Run 03:
Highest Train: 100.00
Highest Valid: 52.00
  Final Train: 100.00
   Final Test: 51.80
run time now: 2.6877615451812744
total time:  2.7447529518976808
None All runs:
Highest Train: 100.00 ± 0.00
Highest Valid: 52.00 ± 0.00
  Final Train: 100.00 ± 0.00
   Final Test: 51.80 ± 0.00
