[I 2023-06-12 00:20:24,738] Trial 70 finished with value: 80.0 and parameters: {'Fwd': 0.008492192163092556, 'K': 9, 'alpha': 0.35000000000000003, 'dropout': 0.5, 'gnnepoch': 40, 'lambda1': 0.7000000000000001, 'lambda2': 4.631590177003391, 'loop': 1, 'loss': 'CE', 'lr': 0.0015314850830917682, 'softmaxF': True, 'useGCN': True, 'weight_decay': 0.00026253057892381776, 'weightedloss': True}. Best is trial 60 with value: 81.33333587646484.
/home/wxy/miniconda3/lib/python3.10/site-packages/optuna/distributions.py:685: UserWarning: The distribution is specified by [0, 1.00001] and step=0.05, but the range is not divisible by `step`. It will be replaced by [0, 1.0].
  warnings.warn(
K:  10
alpha:  0.1
lr:  0.003264457779700057
weight_decay:  9.219087251597461e-05
dropout:  0.6000000000000001
fix split and run 3 times
Data: Data(x=[2708, 1433], y=[2708], train_mask=[2708], val_mask=[2708], test_mask=[2708], adj_t=[2708, 2708, nnz=10556])
num_train tensor(140)
num_noise 0
noise: tensor(0)
data feature 1433
ALTOPT(
  (lins): Sequential(
    (0): Linear(in_features=1433, out_features=64, bias=True)
    (1): BatchNorm1d(64, eps=1e-05, momentum=0.1, affine=True, track_running_stats=True)
    (2): Dropout(p=0.6000000000000001, inplace=True)
    (3): ReLU(inplace=True)
    (4): Linear(in_features=64, out_features=7, bias=True)
    (5): LogSoftmax(dim=-1)
  )
  (prop): Propagation(K=10, mode=None, lambda1=None, lambda2=None, L21=True, alpha=0.1)
  (gcn): GCN(
    (convs): ModuleList(
      (0): GCNConv(1433, 64)
      (1): GCNConv(64, 7)
    )
    (bns): ModuleList(
      (0): BatchNorm1d(64, eps=1e-05, momentum=0.1, affine=True, track_running_stats=True)
    )
    (output): LogSoftmax(dim=-1)
  )
)
propagate done
init label
Split: 01, Run: 01
None time:  1.7864871539641172
None Run 01:
Highest Train: 100.00
Highest Valid: 80.80
  Final Train: 100.00
   Final Test: 81.30
Split: 01, Run: 02
None time:  1.5750418109819293
None Run 02:
Highest Train: 100.00
Highest Valid: 79.80
  Final Train: 100.00
   Final Test: 81.00
Split: 01, Run: 03
None time:  2.1117444618139416
None Run 03:
Highest Train: 100.00
Highest Valid: 80.40
  Final Train: 100.00
   Final Test: 80.10
run time now: 5.499704360961914
total time:  5.521553063066676
None All runs:
Highest Train: 100.00 ± 0.00
Highest Valid: 80.33 ± 0.50
  Final Train: 100.00 ± 0.00
   Final Test: 80.80 ± 0.62
[I 2023-06-12 00:20:30,718] Trial 71 finished with value: 80.33333587646484 and parameters: {'Fwd': 0.005399846887675347, 'K': 10, 'alpha': 0.1, 'dropout': 0.6000000000000001, 'gnnepoch': 70, 'lambda1': 0.5, 'lambda2': 5.480375843858734, 'loop': 1, 'loss': 'CE', 'lr': 0.003264457779700057, 'softmaxF': True, 'useGCN': True, 'weight_decay': 9.219087251597461e-05, 'weightedloss': True}. Best is trial 60 with value: 81.33333587646484.
/home/wxy/miniconda3/lib/python3.10/site-packages/optuna/distributions.py:685: UserWarning: The distribution is specified by [0, 1.00001] and step=0.05, but the range is not divisible by `step`. It will be replaced by [0, 1.0].
  warnings.warn(
K:  10
alpha:  0.1
lr:  0.0036599837271170665
weight_decay:  8.46488409271379e-05
dropout:  0.5
fix split and run 3 times
Data: Data(x=[2708, 1433], y=[2708], train_mask=[2708], val_mask=[2708], test_mask=[2708], adj_t=[2708, 2708, nnz=10556])
num_train tensor(140)
num_noise 0
noise: tensor(0)
data feature 1433
ALTOPT(
  (lins): Sequential(
    (0): Linear(in_features=1433, out_features=64, bias=True)
    (1): BatchNorm1d(64, eps=1e-05, momentum=0.1, affine=True, track_running_stats=True)
    (2): Dropout(p=0.5, inplace=True)
    (3): ReLU(inplace=True)
    (4): Linear(in_features=64, out_features=7, bias=True)
    (5): LogSoftmax(dim=-1)
  )
  (prop): Propagation(K=10, mode=None, lambda1=None, lambda2=None, L21=True, alpha=0.1)
  (gcn): GCN(
    (convs): ModuleList(
      (0): GCNConv(1433, 64)
      (1): GCNConv(64, 7)
    )
    (bns): ModuleList(
      (0): BatchNorm1d(64, eps=1e-05, momentum=0.1, affine=True, track_running_stats=True)
    )
    (output): LogSoftmax(dim=-1)
  )
)
propagate done
init label
Split: 01, Run: 01
None time:  1.413968272972852
None Run 01:
Highest Train: 100.00
Highest Valid: 81.20
  Final Train: 100.00
   Final Test: 81.70
Split: 01, Run: 02
None time:  2.1098301459569484
None Run 02:
Highest Train: 100.00
Highest Valid: 80.80
  Final Train: 100.00
   Final Test: 80.50
Split: 01, Run: 03
None time:  1.8486021659336984
None Run 03:
Highest Train: 100.00
Highest Valid: 80.20
  Final Train: 100.00
   Final Test: 80.80
run time now: 5.398247480392456
total time:  5.419709810987115
None All runs:
Highest Train: 100.00 ± 0.00
Highest Valid: 80.73 ± 0.50
  Final Train: 100.00 ± 0.00
   Final Test: 81.00 ± 0.62
[I 2023-06-12 00:20:36,610] Trial 72 finished with value: 80.73332977294922 and parameters: {'Fwd': 0.0058205502255513275, 'K': 10, 'alpha': 0.1, 'dropout': 0.5, 'gnnepoch': 60, 'lambda1': 0.5, 'lambda2': 5.042917475878109, 'loop': 1, 'loss': 'CE', 'lr': 0.0036599837271170665, 'softmaxF': True, 'useGCN': True, 'weight_decay': 8.46488409271379e-05, 'weightedloss': True}. Best is trial 60 with value: 81.33333587646484.
/home/wxy/miniconda3/lib/python3.10/site-packages/optuna/distributions.py:685: UserWarning: The distribution is specified by [0, 1.00001] and step=0.05, but the range is not divisible by `step`. It will be replaced by [0, 1.0].
  warnings.warn(
K:  10
alpha:  0.1
lr:  0.0036222901846768756
weight_decay:  5.943754577210104e-05
dropout:  0.5
fix split and run 3 times
Data: Data(x=[2708, 1433], y=[2708], train_mask=[2708], val_mask=[2708], test_mask=[2708], adj_t=[2708, 2708, nnz=10556])
num_train tensor(140)
num_noise 0
noise: tensor(0)
data feature 1433
ALTOPT(
  (lins): Sequential(
    (0): Linear(in_features=1433, out_features=64, bias=True)
    (1): BatchNorm1d(64, eps=1e-05, momentum=0.1, affine=True, track_running_stats=True)
    (2): Dropout(p=0.5, inplace=True)
    (3): ReLU(inplace=True)
    (4): Linear(in_features=64, out_features=7, bias=True)
    (5): LogSoftmax(dim=-1)
  )
  (prop): Propagation(K=10, mode=None, lambda1=None, lambda2=None, L21=True, alpha=0.1)
  (gcn): GCN(
    (convs): ModuleList(
      (0): GCNConv(1433, 64)
      (1): GCNConv(64, 7)
    )
    (bns): ModuleList(
      (0): BatchNorm1d(64, eps=1e-05, momentum=0.1, affine=True, track_running_stats=True)
    )
    (output): LogSoftmax(dim=-1)
  )
)
propagate done
init label
Split: 01, Run: 01
None time:  1.63242396293208
None Run 01:
Highest Train: 100.00
Highest Valid: 81.20
  Final Train: 100.00
   Final Test: 81.70
Split: 01, Run: 02
None time:  1.8518263960722834
None Run 02:
Highest Train: 100.00
Highest Valid: 80.60
  Final Train: 100.00
   Final Test: 80.50
Split: 01, Run: 03
None time:  1.6682110710535198
None Run 03:
Highest Train: 100.00
Highest Valid: 80.40
  Final Train: 100.00
   Final Test: 80.70
run time now: 5.180312156677246
total time:  5.199092583032325
None All runs:
Highest Train: 100.00 ± 0.00
Highest Valid: 80.73 ± 0.42
  Final Train: 100.00 ± 0.00
   Final Test: 80.97 ± 0.64
[I 2023-06-12 00:20:42,255] Trial 73 finished with value: 80.73332977294922 and parameters: {'Fwd': 0.010885784037400918, 'K': 10, 'alpha': 0.1, 'dropout': 0.5, 'gnnepoch': 60, 'lambda1': 0.45, 'lambda2': 5.1796399663649435, 'loop': 1, 'loss': 'CE', 'lr': 0.0036222901846768756, 'softmaxF': True, 'useGCN': True, 'weight_decay': 5.943754577210104e-05, 'weightedloss': True}. Best is trial 60 with value: 81.33333587646484.
/home/wxy/miniconda3/lib/python3.10/site-packages/optuna/distributions.py:685: UserWarning: The distribution is specified by [0, 1.00001] and step=0.05, but the range is not divisible by `step`. It will be replaced by [0, 1.0].
  warnings.warn(
K:  10
alpha:  0.1
lr:  0.004407294372934428
weight_decay:  5.652383887507646e-05
dropout:  0.5
fix split and run 3 times
Data: Data(x=[2708, 1433], y=[2708], train_mask=[2708], val_mask=[2708], test_mask=[2708], adj_t=[2708, 2708, nnz=10556])
num_train tensor(140)
num_noise 0
noise: tensor(0)
data feature 1433
ALTOPT(
  (lins): Sequential(
    (0): Linear(in_features=1433, out_features=64, bias=True)
    (1): BatchNorm1d(64, eps=1e-05, momentum=0.1, affine=True, track_running_stats=True)
    (2): Dropout(p=0.5, inplace=True)
    (3): ReLU(inplace=True)
    (4): Linear(in_features=64, out_features=7, bias=True)
    (5): LogSoftmax(dim=-1)
  )
  (prop): Propagation(K=10, mode=None, lambda1=None, lambda2=None, L21=True, alpha=0.1)
  (gcn): GCN(
    (convs): ModuleList(
      (0): GCNConv(1433, 64)
      (1): GCNConv(64, 7)
    )
    (bns): ModuleList(
      (0): BatchNorm1d(64, eps=1e-05, momentum=0.1, affine=True, track_running_stats=True)
    )
    (output): LogSoftmax(dim=-1)
  )
)
propagate done
init label
Split: 01, Run: 01
None time:  1.3832232609856874
None Run 01:
Highest Train: 100.00
Highest Valid: 81.20
  Final Train: 100.00
   Final Test: 82.00
Split: 01, Run: 02
None time:  1.6217789419461042
None Run 02:
Highest Train: 100.00
Highest Valid: 80.60
  Final Train: 100.00
   Final Test: 80.70
Split: 01, Run: 03
None time:  1.5937590880785137
None Run 03:
Highest Train: 100.00
Highest Valid: 80.40
  Final Train: 100.00
   Final Test: 80.70
run time now: 4.626110553741455
total time:  4.646326084854081
None All runs:
Highest Train: 100.00 ± 0.00
Highest Valid: 80.73 ± 0.42
  Final Train: 100.00 ± 0.00
   Final Test: 81.13 ± 0.75
[I 2023-06-12 00:20:47,363] Trial 74 finished with value: 80.73332977294922 and parameters: {'Fwd': 0.012590887729249938, 'K': 10, 'alpha': 0.1, 'dropout': 0.5, 'gnnepoch': 60, 'lambda1': 0.45, 'lambda2': 5.448111597482266, 'loop': 1, 'loss': 'CE', 'lr': 0.004407294372934428, 'softmaxF': True, 'useGCN': True, 'weight_decay': 5.652383887507646e-05, 'weightedloss': True}. Best is trial 60 with value: 81.33333587646484.
/home/wxy/miniconda3/lib/python3.10/site-packages/optuna/distributions.py:685: UserWarning: The distribution is specified by [0, 1.00001] and step=0.05, but the range is not divisible by `step`. It will be replaced by [0, 1.0].
  warnings.warn(
K:  9
alpha:  0.1
lr:  0.004526173532006074
weight_decay:  5.222021499733668e-05
dropout:  0.5
fix split and run 3 times
Data: Data(x=[2708, 1433], y=[2708], train_mask=[2708], val_mask=[2708], test_mask=[2708], adj_t=[2708, 2708, nnz=10556])
num_train tensor(140)
num_noise 0
noise: tensor(0)
data feature 1433
ALTOPT(
  (lins): Sequential(
    (0): Linear(in_features=1433, out_features=64, bias=True)
    (1): BatchNorm1d(64, eps=1e-05, momentum=0.1, affine=True, track_running_stats=True)
    (2): Dropout(p=0.5, inplace=True)
    (3): ReLU(inplace=True)
    (4): Linear(in_features=64, out_features=7, bias=True)
    (5): LogSoftmax(dim=-1)
  )
  (prop): Propagation(K=9, mode=None, lambda1=None, lambda2=None, L21=True, alpha=0.1)
  (gcn): GCN(
    (convs): ModuleList(
      (0): GCNConv(1433, 64)
      (1): GCNConv(64, 7)
    )
    (bns): ModuleList(
      (0): BatchNorm1d(64, eps=1e-05, momentum=0.1, affine=True, track_running_stats=True)
    )
    (output): LogSoftmax(dim=-1)
  )
)
propagate done
init label
Split: 01, Run: 01
None time:  1.6406860640272498
None Run 01:
Highest Train: 100.00
Highest Valid: 81.20
  Final Train: 100.00
   Final Test: 81.80
Split: 01, Run: 02
None time:  1.6184726140927523
None Run 02:
Highest Train: 100.00
Highest Valid: 80.60
  Final Train: 100.00
   Final Test: 80.80
Split: 01, Run: 03
None time:  2.0285327250603586
None Run 03:
Highest Train: 100.00
Highest Valid: 80.40
  Final Train: 100.00
   Final Test: 80.90
run time now: 5.314815044403076
total time:  5.334275115048513
None All runs:
Highest Train: 100.00 ± 0.00
Highest Valid: 80.73 ± 0.42
  Final Train: 100.00 ± 0.00
   Final Test: 81.17 ± 0.55
[I 2023-06-12 00:20:53,237] Trial 75 finished with value: 80.73332977294922 and parameters: {'Fwd': 0.011852271290826392, 'K': 9, 'alpha': 0.1, 'dropout': 0.5, 'gnnepoch': 60, 'lambda1': 0.45, 'lambda2': 5.886181875204481, 'loop': 1, 'loss': 'CE', 'lr': 0.004526173532006074, 'softmaxF': True, 'useGCN': True, 'weight_decay': 5.222021499733668e-05, 'weightedloss': True}. Best is trial 60 with value: 81.33333587646484.
/home/wxy/miniconda3/lib/python3.10/site-packages/optuna/distributions.py:685: UserWarning: The distribution is specified by [0, 1.00001] and step=0.05, but the range is not divisible by `step`. It will be replaced by [0, 1.0].
  warnings.warn(
K:  9
alpha:  0.05
lr:  0.004257177320565541
weight_decay:  3.2614143286931666e-05
dropout:  0.5
fix split and run 3 times
Data: Data(x=[2708, 1433], y=[2708], train_mask=[2708], val_mask=[2708], test_mask=[2708], adj_t=[2708, 2708, nnz=10556])
num_train tensor(140)
num_noise 0
noise: tensor(0)
data feature 1433
ALTOPT(
  (lins): Sequential(
    (0): Linear(in_features=1433, out_features=64, bias=True)
    (1): BatchNorm1d(64, eps=1e-05, momentum=0.1, affine=True, track_running_stats=True)
    (2): Dropout(p=0.5, inplace=True)
    (3): ReLU(inplace=True)
    (4): Linear(in_features=64, out_features=7, bias=True)
    (5): LogSoftmax(dim=-1)
  )
  (prop): Propagation(K=9, mode=None, lambda1=None, lambda2=None, L21=True, alpha=0.05)
  (gcn): GCN(
    (convs): ModuleList(
      (0): GCNConv(1433, 64)
      (1): GCNConv(64, 7)
    )
    (bns): ModuleList(
      (0): BatchNorm1d(64, eps=1e-05, momentum=0.1, affine=True, track_running_stats=True)
    )
    (output): LogSoftmax(dim=-1)
  )
)
propagate done
init label
Split: 01, Run: 01
None time:  1.2697499098721892
None Run 01:
Highest Train: 100.00
Highest Valid: 81.40
  Final Train: 100.00
   Final Test: 82.00
Split: 01, Run: 02
None time:  1.5323570200707763
None Run 02:
Highest Train: 100.00
Highest Valid: 80.80
  Final Train: 100.00
   Final Test: 80.70
Split: 01, Run: 03
None time:  1.9272431021090597
None Run 03:
Highest Train: 100.00
Highest Valid: 80.00
  Final Train: 100.00
   Final Test: 81.50
run time now: 4.757969617843628
total time:  4.785380280809477
None All runs:
Highest Train: 100.00 ± 0.00
Highest Valid: 80.73 ± 0.70
  Final Train: 100.00 ± 0.00
   Final Test: 81.40 ± 0.66
[I 2023-06-12 00:20:58,664] Trial 76 finished with value: 80.73333740234375 and parameters: {'Fwd': 0.012457758017112953, 'K': 9, 'alpha': 0.05, 'dropout': 0.5, 'gnnepoch': 60, 'lambda1': 0.45, 'lambda2': 5.917410446278809, 'loop': 1, 'loss': 'CE', 'lr': 0.004257177320565541, 'softmaxF': True, 'useGCN': True, 'weight_decay': 3.2614143286931666e-05, 'weightedloss': True}. Best is trial 60 with value: 81.33333587646484.
/home/wxy/miniconda3/lib/python3.10/site-packages/optuna/distributions.py:685: UserWarning: The distribution is specified by [0, 1.00001] and step=0.05, but the range is not divisible by `step`. It will be replaced by [0, 1.0].
  warnings.warn(
K:  9
alpha:  0.05
lr:  0.004565886990654486
weight_decay:  3.202255421446018e-05
dropout:  0.5
fix split and run 3 times
Data: Data(x=[2708, 1433], y=[2708], train_mask=[2708], val_mask=[2708], test_mask=[2708], adj_t=[2708, 2708, nnz=10556])
num_train tensor(140)
num_noise 0
noise: tensor(0)
data feature 1433
ALTOPT(
  (lins): Sequential(
    (0): Linear(in_features=1433, out_features=64, bias=True)
    (1): BatchNorm1d(64, eps=1e-05, momentum=0.1, affine=True, track_running_stats=True)
    (2): Dropout(p=0.5, inplace=True)
    (3): ReLU(inplace=True)
    (4): Linear(in_features=64, out_features=7, bias=True)
    (5): LogSoftmax(dim=-1)
  )
  (prop): Propagation(K=9, mode=None, lambda1=None, lambda2=None, L21=True, alpha=0.05)
  (gcn): GCN(
    (convs): ModuleList(
      (0): GCNConv(1433, 64)
      (1): GCNConv(64, 7)
    )
    (bns): ModuleList(
      (0): BatchNorm1d(64, eps=1e-05, momentum=0.1, affine=True, track_running_stats=True)
    )
    (output): LogSoftmax(dim=-1)
  )
)
propagate done
init label
Split: 01, Run: 01
None time:  1.674415847985074
None Run 01:
Highest Train: 100.00
Highest Valid: 81.20
  Final Train: 100.00
   Final Test: 81.90
Split: 01, Run: 02
None time:  1.985728404019028
None Run 02:
Highest Train: 100.00
Highest Valid: 81.00
  Final Train: 100.00
   Final Test: 81.40
Split: 01, Run: 03
None time:  1.5159642130602151
None Run 03:
Highest Train: 100.00
Highest Valid: 80.80
  Final Train: 100.00
   Final Test: 80.90
run time now: 5.204092264175415
total time:  5.223309224005789
None All runs:
Highest Train: 100.00 ± 0.00
Highest Valid: 81.00 ± 0.20
  Final Train: 100.00 ± 0.00
   Final Test: 81.40 ± 0.50
[I 2023-06-12 00:21:04,320] Trial 77 finished with value: 81.0 and parameters: {'Fwd': 0.00408908432624093, 'K': 9, 'alpha': 0.05, 'dropout': 0.5, 'gnnepoch': 60, 'lambda1': 0.45, 'lambda2': 5.986802178473962, 'loop': 1, 'loss': 'CE', 'lr': 0.004565886990654486, 'softmaxF': True, 'useGCN': True, 'weight_decay': 3.202255421446018e-05, 'weightedloss': True}. Best is trial 60 with value: 81.33333587646484.
/home/wxy/miniconda3/lib/python3.10/site-packages/optuna/distributions.py:685: UserWarning: The distribution is specified by [0, 1.00001] and step=0.05, but the range is not divisible by `step`. It will be replaced by [0, 1.0].
  warnings.warn(
K:  9
alpha:  0.0
lr:  0.003888311481674307
weight_decay:  2.7103578194808388e-05
dropout:  0.5
fix split and run 3 times
Data: Data(x=[2708, 1433], y=[2708], train_mask=[2708], val_mask=[2708], test_mask=[2708], adj_t=[2708, 2708, nnz=10556])
num_train tensor(140)
num_noise 0
noise: tensor(0)
data feature 1433
ALTOPT(
  (lins): Sequential(
    (0): Linear(in_features=1433, out_features=64, bias=True)
    (1): BatchNorm1d(64, eps=1e-05, momentum=0.1, affine=True, track_running_stats=True)
    (2): Dropout(p=0.5, inplace=True)
    (3): ReLU(inplace=True)
    (4): Linear(in_features=64, out_features=7, bias=True)
    (5): LogSoftmax(dim=-1)
  )
  (prop): Propagation(K=9, mode=None, lambda1=None, lambda2=None, L21=True, alpha=0.0)
  (gcn): GCN(
    (convs): ModuleList(
      (0): GCNConv(1433, 64)
      (1): GCNConv(64, 7)
    )
    (bns): ModuleList(
      (0): BatchNorm1d(64, eps=1e-05, momentum=0.1, affine=True, track_running_stats=True)
    )
    (output): LogSoftmax(dim=-1)
  )
)
propagate done
init label
Split: 01, Run: 01
None time:  0.7243811700027436
None Run 01:
Highest Train: 100.00
Highest Valid: 68.80
  Final Train: 100.00
   Final Test: 70.00
Split: 01, Run: 02
None time:  0.8222453980706632
None Run 02:
Highest Train: 100.00
Highest Valid: 68.80
  Final Train: 100.00
   Final Test: 70.00
Split: 01, Run: 03
None time:  1.4089540077839047
None Run 03:
Highest Train: 100.00
Highest Valid: 75.60
  Final Train: 98.57
   Final Test: 75.50
run time now: 2.9856388568878174
total time:  3.012330763041973
None All runs:
Highest Train: 100.00 ± 0.00
Highest Valid: 71.07 ± 3.93
  Final Train: 99.52 ± 0.82
   Final Test: 71.83 ± 3.18
[I 2023-06-12 00:21:07,809] Trial 78 finished with value: 71.0666732788086 and parameters: {'Fwd': 0.0039580303336246405, 'K': 9, 'alpha': 0.0, 'dropout': 0.5, 'gnnepoch': 50, 'lambda1': 0.6000000000000001, 'lambda2': 6.542330875904561, 'loop': 1, 'loss': 'CE', 'lr': 0.003888311481674307, 'softmaxF': True, 'useGCN': False, 'weight_decay': 2.7103578194808388e-05, 'weightedloss': True}. Best is trial 60 with value: 81.33333587646484.
/home/wxy/miniconda3/lib/python3.10/site-packages/optuna/distributions.py:685: UserWarning: The distribution is specified by [0, 1.00001] and step=0.05, but the range is not divisible by `step`. It will be replaced by [0, 1.0].
  warnings.warn(
K:  10
alpha:  0.05
lr:  0.004427644634650626
weight_decay:  3.458850024212269e-05
dropout:  0.7000000000000001
fix split and run 3 times
Data: Data(x=[2708, 1433], y=[2708], train_mask=[2708], val_mask=[2708], test_mask=[2708], adj_t=[2708, 2708, nnz=10556])
num_train tensor(140)
num_noise 0
noise: tensor(0)
data feature 1433
ALTOPT(
  (lins): Sequential(
    (0): Linear(in_features=1433, out_features=64, bias=True)
    (1): BatchNorm1d(64, eps=1e-05, momentum=0.1, affine=True, track_running_stats=True)
    (2): Dropout(p=0.7000000000000001, inplace=True)
    (3): ReLU(inplace=True)
    (4): Linear(in_features=64, out_features=7, bias=True)
    (5): LogSoftmax(dim=-1)
  )
  (prop): Propagation(K=10, mode=None, lambda1=None, lambda2=None, L21=True, alpha=0.05)
  (gcn): GCN(
    (convs): ModuleList(
      (0): GCNConv(1433, 64)
      (1): GCNConv(64, 7)
    )
    (bns): ModuleList(
      (0): BatchNorm1d(64, eps=1e-05, momentum=0.1, affine=True, track_running_stats=True)
    )
    (output): LogSoftmax(dim=-1)
  )
)
propagate done
init label
Split: 01, Run: 01
None time:  1.227012149989605
None Run 01:
Highest Train: 100.00
Highest Valid: 79.60
  Final Train: 100.00
   Final Test: 79.80
Split: 01, Run: 02
None time:  0.9081378008704633
None Run 02:
Highest Train: 100.00
Highest Valid: 79.40
  Final Train: 100.00
   Final Test: 79.10
Split: 01, Run: 03
None time:  1.4413782330229878
None Run 03:
Highest Train: 100.00
Highest Valid: 78.40
  Final Train: 100.00
   Final Test: 79.00
run time now: 3.6039600372314453
total time:  3.622314261039719
None All runs:
Highest Train: 100.00 ± 0.00
Highest Valid: 79.13 ± 0.64
  Final Train: 100.00 ± 0.00
   Final Test: 79.30 ± 0.44
