[I 2023-06-11 23:22:20,997] Trial 17 finished with value: 71.0 and parameters: {'Fwd': 0.006682135605435782, 'K': 9, 'alpha': 0.7000000000000001, 'dropout': 0.30000000000000004, 'gnnepoch': 60, 'lambda1': 0.35000000000000003, 'lambda2': 5.354920935160459, 'loop': 0, 'loss': 'CE', 'lr': 0.002623280933550487, 'softmaxF': True, 'useGCN': True, 'weight_decay': 1.1993324664610628e-06, 'weightedloss': True}. Best is trial 10 with value: 71.20000457763672.
/home/wxy/miniconda3/lib/python3.10/site-packages/optuna/distributions.py:685: UserWarning: The distribution is specified by [0, 1.00001] and step=0.05, but the range is not divisible by `step`. It will be replaced by [0, 1.0].
  warnings.warn(
K:  2
alpha:  0.55
lr:  0.0005974178224721904
weight_decay:  4.050910034298201e-06
dropout:  0.5
fix split and run 3 times
Data: Data(x=[3327, 3703], y=[3327], train_mask=[3327], val_mask=[3327], test_mask=[3327], adj_t=[3327, 3327, nnz=9104])
num_train tensor(120)
num_noise 0
noise: tensor(0)
data feature 3703
ALTOPT(
  (lins): Sequential(
    (0): Linear(in_features=3703, out_features=64, bias=True)
    (1): BatchNorm1d(64, eps=1e-05, momentum=0.1, affine=True, track_running_stats=True)
    (2): Dropout(p=0.5, inplace=True)
    (3): ReLU(inplace=True)
    (4): Linear(in_features=64, out_features=6, bias=True)
    (5): Identity()
  )
  (prop): Propagation(K=2, mode=None, lambda1=None, lambda2=None, L21=True, alpha=0.55)
  (gcn): GCN(
    (convs): ModuleList(
      (0): GCNConv(3703, 64)
      (1): GCNConv(64, 6)
    )
    (bns): ModuleList(
      (0): BatchNorm1d(64, eps=1e-05, momentum=0.1, affine=True, track_running_stats=True)
    )
    (output): Identity()
  )
)
propagate done
init label
Split: 01, Run: 01
None time:  0.8117681439034641
None Run 01:
Highest Train: 100.00
Highest Valid: 68.80
  Final Train: 100.00
   Final Test: 67.00
Split: 01, Run: 02
None time:  0.8797791039105505
None Run 02:
Highest Train: 100.00
Highest Valid: 69.00
  Final Train: 100.00
   Final Test: 68.60
Split: 01, Run: 03, Epoch: 100, Loss: 0.0000, Train: 100.00%, Valid: 67.60% Test: 67.50%
Split: 01, Run: 03
None time:  1.2061793010216206
None Run 03:
Highest Train: 100.00
Highest Valid: 67.60
  Final Train: 100.00
   Final Test: 67.50
run time now: 2.932828903198242
total time:  2.988885710015893
None All runs:
Highest Train: 100.00 ± 0.00
Highest Valid: 68.47 ± 0.76
  Final Train: 100.00 ± 0.00
   Final Test: 67.70 ± 0.82
[I 2023-06-11 23:22:24,425] Trial 18 finished with value: 68.46666717529297 and parameters: {'Fwd': 0.0022254004917289867, 'K': 2, 'alpha': 0.55, 'dropout': 0.5, 'gnnepoch': 90, 'lambda1': 0.2, 'lambda2': 2.0357529616150813, 'loop': 0, 'loss': 'MSE', 'lr': 0.0005974178224721904, 'softmaxF': False, 'useGCN': True, 'weight_decay': 4.050910034298201e-06, 'weightedloss': True}. Best is trial 10 with value: 71.20000457763672.
/home/wxy/miniconda3/lib/python3.10/site-packages/optuna/distributions.py:685: UserWarning: The distribution is specified by [0, 1.00001] and step=0.05, but the range is not divisible by `step`. It will be replaced by [0, 1.0].
  warnings.warn(
K:  6
alpha:  0.9
lr:  0.001538113606229107
weight_decay:  1.3161801509478503e-05
dropout:  0.2
fix split and run 3 times
Data: Data(x=[3327, 3703], y=[3327], train_mask=[3327], val_mask=[3327], test_mask=[3327], adj_t=[3327, 3327, nnz=9104])
num_train tensor(120)
num_noise 0
noise: tensor(0)
data feature 3703
ALTOPT(
  (lins): Sequential(
    (0): Linear(in_features=3703, out_features=64, bias=True)
    (1): BatchNorm1d(64, eps=1e-05, momentum=0.1, affine=True, track_running_stats=True)
    (2): Dropout(p=0.2, inplace=True)
    (3): ReLU(inplace=True)
    (4): Linear(in_features=64, out_features=6, bias=True)
    (5): LogSoftmax(dim=-1)
  )
  (prop): Propagation(K=6, mode=None, lambda1=None, lambda2=None, L21=True, alpha=0.9)
  (gcn): GCN(
    (convs): ModuleList(
      (0): GCNConv(3703, 64)
      (1): GCNConv(64, 6)
    )
    (bns): ModuleList(
      (0): BatchNorm1d(64, eps=1e-05, momentum=0.1, affine=True, track_running_stats=True)
    )
    (output): LogSoftmax(dim=-1)
  )
)
propagate done
init label
Split: 01, Run: 01
None time:  0.41081307106651366
None Run 01:
Highest Train: 100.00
Highest Valid: 70.00
  Final Train: 100.00
   Final Test: 68.60
Split: 01, Run: 02
None time:  0.41687674005515873
None Run 02:
Highest Train: 100.00
Highest Valid: 66.00
  Final Train: 100.00
   Final Test: 64.20
Split: 01, Run: 03
None time:  0.3992290480528027
None Run 03:
Highest Train: 100.00
Highest Valid: 70.20
  Final Train: 100.00
   Final Test: 69.30
run time now: 1.2655885219573975
total time:  1.3126585020218045
None All runs:
Highest Train: 100.00 ± 0.00
Highest Valid: 68.73 ± 2.37
  Final Train: 100.00 ± 0.00
   Final Test: 67.37 ± 2.76
[I 2023-06-11 23:22:26,190] Trial 19 finished with value: 68.73333740234375 and parameters: {'Fwd': 0.01953592908537317, 'K': 6, 'alpha': 0.9, 'dropout': 0.2, 'gnnepoch': 40, 'lambda1': 0.6000000000000001, 'lambda2': 3.997011873527059, 'loop': 0, 'loss': 'CE', 'lr': 0.001538113606229107, 'softmaxF': True, 'useGCN': True, 'weight_decay': 1.3161801509478503e-05, 'weightedloss': True}. Best is trial 10 with value: 71.20000457763672.
/home/wxy/miniconda3/lib/python3.10/site-packages/optuna/distributions.py:685: UserWarning: The distribution is specified by [0, 1.00001] and step=0.05, but the range is not divisible by `step`. It will be replaced by [0, 1.0].
  warnings.warn(
K:  8
alpha:  0.30000000000000004
lr:  0.002924939131548646
weight_decay:  1.0447229400867712e-06
dropout:  0.0
fix split and run 3 times
Data: Data(x=[3327, 3703], y=[3327], train_mask=[3327], val_mask=[3327], test_mask=[3327], adj_t=[3327, 3327, nnz=9104])
num_train tensor(120)
num_noise 0
noise: tensor(0)
data feature 3703
ALTOPT(
  (lins): Sequential(
    (0): Linear(in_features=3703, out_features=64, bias=True)
    (1): BatchNorm1d(64, eps=1e-05, momentum=0.1, affine=True, track_running_stats=True)
    (2): Dropout(p=0.0, inplace=True)
    (3): ReLU(inplace=True)
    (4): Linear(in_features=64, out_features=6, bias=True)
    (5): LogSoftmax(dim=-1)
  )
  (prop): Propagation(K=8, mode=None, lambda1=None, lambda2=None, L21=True, alpha=0.30000000000000004)
  (gcn): GCN(
    (convs): ModuleList(
      (0): GCNConv(3703, 64)
      (1): GCNConv(64, 6)
    )
    (bns): ModuleList(
      (0): BatchNorm1d(64, eps=1e-05, momentum=0.1, affine=True, track_running_stats=True)
    )
    (output): LogSoftmax(dim=-1)
  )
)
propagate done
init label
Split: 01, Run: 01
None time:  1.0166842211037874
None Run 01:
Highest Train: 100.00
Highest Valid: 70.80
  Final Train: 100.00
   Final Test: 69.00
Split: 01, Run: 02
None time:  1.0016817818395793
None Run 02:
Highest Train: 100.00
Highest Valid: 70.60
  Final Train: 99.17
   Final Test: 67.60
Split: 01, Run: 03
None time:  1.0243250541388988
None Run 03:
Highest Train: 100.00
Highest Valid: 69.20
  Final Train: 99.17
   Final Test: 67.70
run time now: 3.0849249362945557
total time:  3.1358287599869072
None All runs:
Highest Train: 100.00 ± 0.00
Highest Valid: 70.20 ± 0.87
  Final Train: 99.44 ± 0.48
   Final Test: 68.10 ± 0.78
[I 2023-06-11 23:22:29,723] Trial 20 finished with value: 70.19999694824219 and parameters: {'Fwd': 0.0028881918828035555, 'K': 8, 'alpha': 0.30000000000000004, 'dropout': 0.0, 'gnnepoch': 110, 'lambda1': 0.45, 'lambda2': 5.6661662603254825, 'loop': 0, 'loss': 'CE', 'lr': 0.002924939131548646, 'softmaxF': True, 'useGCN': True, 'weight_decay': 1.0447229400867712e-06, 'weightedloss': True}. Best is trial 10 with value: 71.20000457763672.
/home/wxy/miniconda3/lib/python3.10/site-packages/optuna/distributions.py:685: UserWarning: The distribution is specified by [0, 1.00001] and step=0.05, but the range is not divisible by `step`. It will be replaced by [0, 1.0].
  warnings.warn(
K:  3
alpha:  0.5
lr:  0.0024081970682931788
weight_decay:  3.8034040817096363e-06
dropout:  0.30000000000000004
fix split and run 3 times
Data: Data(x=[3327, 3703], y=[3327], train_mask=[3327], val_mask=[3327], test_mask=[3327], adj_t=[3327, 3327, nnz=9104])
num_train tensor(120)
num_noise 0
noise: tensor(0)
data feature 3703
ALTOPT(
  (lins): Sequential(
    (0): Linear(in_features=3703, out_features=64, bias=True)
    (1): BatchNorm1d(64, eps=1e-05, momentum=0.1, affine=True, track_running_stats=True)
    (2): Dropout(p=0.30000000000000004, inplace=True)
    (3): ReLU(inplace=True)
    (4): Linear(in_features=64, out_features=6, bias=True)
    (5): LogSoftmax(dim=-1)
  )
  (prop): Propagation(K=3, mode=None, lambda1=None, lambda2=None, L21=True, alpha=0.5)
  (gcn): GCN(
    (convs): ModuleList(
      (0): GCNConv(3703, 64)
      (1): GCNConv(64, 6)
    )
    (bns): ModuleList(
      (0): BatchNorm1d(64, eps=1e-05, momentum=0.1, affine=True, track_running_stats=True)
    )
    (output): LogSoftmax(dim=-1)
  )
)
propagate done
init label
Split: 01, Run: 01
None time:  0.4397624309640378
None Run 01:
Highest Train: 100.00
Highest Valid: 70.60
  Final Train: 100.00
   Final Test: 69.00
Split: 01, Run: 02
None time:  0.49466848908923566
None Run 02:
Highest Train: 100.00
Highest Valid: 71.20
  Final Train: 100.00
   Final Test: 69.60
Split: 01, Run: 03
None time:  0.4537948879878968
None Run 03:
Highest Train: 100.00
Highest Valid: 71.20
  Final Train: 100.00
   Final Test: 70.10
run time now: 1.4230151176452637
total time:  1.4889973849058151
None All runs:
Highest Train: 100.00 ± 0.00
Highest Valid: 71.00 ± 0.35
  Final Train: 100.00 ± 0.00
   Final Test: 69.57 ± 0.55
[I 2023-06-11 23:22:31,696] Trial 21 finished with value: 71.0 and parameters: {'Fwd': 0.01304995194935924, 'K': 3, 'alpha': 0.5, 'dropout': 0.30000000000000004, 'gnnepoch': 50, 'lambda1': 0.65, 'lambda2': 5.717145477681354, 'loop': 0, 'loss': 'CE', 'lr': 0.0024081970682931788, 'softmaxF': True, 'useGCN': True, 'weight_decay': 3.8034040817096363e-06, 'weightedloss': True}. Best is trial 10 with value: 71.20000457763672.
/home/wxy/miniconda3/lib/python3.10/site-packages/optuna/distributions.py:685: UserWarning: The distribution is specified by [0, 1.00001] and step=0.05, but the range is not divisible by `step`. It will be replaced by [0, 1.0].
  warnings.warn(
K:  4
alpha:  0.6000000000000001
lr:  0.0018252483592470236
weight_decay:  8.744950118085825e-06
dropout:  0.2
fix split and run 3 times
Data: Data(x=[3327, 3703], y=[3327], train_mask=[3327], val_mask=[3327], test_mask=[3327], adj_t=[3327, 3327, nnz=9104])
num_train tensor(120)
num_noise 0
noise: tensor(0)
data feature 3703
ALTOPT(
  (lins): Sequential(
    (0): Linear(in_features=3703, out_features=64, bias=True)
    (1): BatchNorm1d(64, eps=1e-05, momentum=0.1, affine=True, track_running_stats=True)
    (2): Dropout(p=0.2, inplace=True)
    (3): ReLU(inplace=True)
    (4): Linear(in_features=64, out_features=6, bias=True)
    (5): LogSoftmax(dim=-1)
  )
  (prop): Propagation(K=4, mode=None, lambda1=None, lambda2=None, L21=True, alpha=0.6000000000000001)
  (gcn): GCN(
    (convs): ModuleList(
      (0): GCNConv(3703, 64)
      (1): GCNConv(64, 6)
    )
    (bns): ModuleList(
      (0): BatchNorm1d(64, eps=1e-05, momentum=0.1, affine=True, track_running_stats=True)
    )
    (output): LogSoftmax(dim=-1)
  )
)
propagate done
init label
Split: 01, Run: 01
None time:  0.6042628569994122
None Run 01:
Highest Train: 100.00
Highest Valid: 70.80
  Final Train: 100.00
   Final Test: 68.80
Split: 01, Run: 02
None time:  0.5953496990259737
None Run 02:
Highest Train: 100.00
Highest Valid: 70.60
  Final Train: 100.00
   Final Test: 67.80
Split: 01, Run: 03
None time:  0.5576433690730482
None Run 03:
Highest Train: 100.00
Highest Valid: 70.20
  Final Train: 100.00
   Final Test: 68.00
run time now: 1.804938554763794
total time:  1.8573781470768154
None All runs:
Highest Train: 100.00 ± 0.00
Highest Valid: 70.53 ± 0.31
  Final Train: 100.00 ± 0.00
   Final Test: 68.20 ± 0.53
[I 2023-06-11 23:22:34,146] Trial 22 finished with value: 70.53333282470703 and parameters: {'Fwd': 0.0993218182526545, 'K': 4, 'alpha': 0.6000000000000001, 'dropout': 0.2, 'gnnepoch': 60, 'lambda1': 0.7000000000000001, 'lambda2': 6.271032050830806, 'loop': 0, 'loss': 'CE', 'lr': 0.0018252483592470236, 'softmaxF': True, 'useGCN': True, 'weight_decay': 8.744950118085825e-06, 'weightedloss': True}. Best is trial 10 with value: 71.20000457763672.
/home/wxy/miniconda3/lib/python3.10/site-packages/optuna/distributions.py:685: UserWarning: The distribution is specified by [0, 1.00001] and step=0.05, but the range is not divisible by `step`. It will be replaced by [0, 1.0].
  warnings.warn(
K:  2
alpha:  0.5
lr:  0.0034644988369427723
weight_decay:  2.894541714792608e-06
dropout:  0.4
fix split and run 3 times
Data: Data(x=[3327, 3703], y=[3327], train_mask=[3327], val_mask=[3327], test_mask=[3327], adj_t=[3327, 3327, nnz=9104])
num_train tensor(120)
num_noise 0
noise: tensor(0)
data feature 3703
ALTOPT(
  (lins): Sequential(
    (0): Linear(in_features=3703, out_features=64, bias=True)
    (1): BatchNorm1d(64, eps=1e-05, momentum=0.1, affine=True, track_running_stats=True)
    (2): Dropout(p=0.4, inplace=True)
    (3): ReLU(inplace=True)
    (4): Linear(in_features=64, out_features=6, bias=True)
    (5): LogSoftmax(dim=-1)
  )
  (prop): Propagation(K=2, mode=None, lambda1=None, lambda2=None, L21=True, alpha=0.5)
  (gcn): GCN(
    (convs): ModuleList(
      (0): GCNConv(3703, 64)
      (1): GCNConv(64, 6)
    )
    (bns): ModuleList(
      (0): BatchNorm1d(64, eps=1e-05, momentum=0.1, affine=True, track_running_stats=True)
    )
    (output): LogSoftmax(dim=-1)
  )
)
propagate done
init label
Split: 01, Run: 01
None time:  0.2960274040233344
None Run 01:
Highest Train: 100.00
Highest Valid: 70.40
  Final Train: 100.00
   Final Test: 69.30
Split: 01, Run: 02
None time:  0.32446467294357717
None Run 02:
Highest Train: 100.00
Highest Valid: 71.60
  Final Train: 100.00
   Final Test: 69.00
Split: 01, Run: 03
None time:  0.3364980719052255
None Run 03:
Highest Train: 100.00
Highest Valid: 70.80
  Final Train: 100.00
   Final Test: 69.40
run time now: 0.9906342029571533
total time:  1.0341152288019657
None All runs:
Highest Train: 100.00 ± 0.00
Highest Valid: 70.93 ± 0.61
  Final Train: 100.00 ± 0.00
   Final Test: 69.23 ± 0.21
[I 2023-06-11 23:22:35,637] Trial 23 finished with value: 70.93333435058594 and parameters: {'Fwd': 0.01643178367283551, 'K': 2, 'alpha': 0.5, 'dropout': 0.4, 'gnnepoch': 30, 'lambda1': 0.75, 'lambda2': 4.966069668205394, 'loop': 0, 'loss': 'CE', 'lr': 0.0034644988369427723, 'softmaxF': True, 'useGCN': True, 'weight_decay': 2.894541714792608e-06, 'weightedloss': True}. Best is trial 10 with value: 71.20000457763672.
/home/wxy/miniconda3/lib/python3.10/site-packages/optuna/distributions.py:685: UserWarning: The distribution is specified by [0, 1.00001] and step=0.05, but the range is not divisible by `step`. It will be replaced by [0, 1.0].
  warnings.warn(
K:  4
alpha:  0.7000000000000001
lr:  0.001199639544443569
weight_decay:  7.049237487049798e-06
dropout:  0.30000000000000004
fix split and run 3 times
Data: Data(x=[3327, 3703], y=[3327], train_mask=[3327], val_mask=[3327], test_mask=[3327], adj_t=[3327, 3327, nnz=9104])
num_train tensor(120)
num_noise 0
noise: tensor(0)
data feature 3703
ALTOPT(
  (lins): Sequential(
    (0): Linear(in_features=3703, out_features=64, bias=True)
    (1): BatchNorm1d(64, eps=1e-05, momentum=0.1, affine=True, track_running_stats=True)
    (2): Dropout(p=0.30000000000000004, inplace=True)
    (3): ReLU(inplace=True)
    (4): Linear(in_features=64, out_features=6, bias=True)
    (5): LogSoftmax(dim=-1)
  )
  (prop): Propagation(K=4, mode=None, lambda1=None, lambda2=None, L21=True, alpha=0.7000000000000001)
  (gcn): GCN(
    (convs): ModuleList(
      (0): GCNConv(3703, 64)
      (1): GCNConv(64, 6)
    )
    (bns): ModuleList(
      (0): BatchNorm1d(64, eps=1e-05, momentum=0.1, affine=True, track_running_stats=True)
    )
    (output): LogSoftmax(dim=-1)
  )
)
propagate done
init label
Split: 01, Run: 01
None time:  0.785068109864369
None Run 01:
Highest Train: 100.00
Highest Valid: 70.60
  Final Train: 100.00
   Final Test: 69.00
Split: 01, Run: 02
None time:  0.8025039189960808
None Run 02:
Highest Train: 100.00
Highest Valid: 67.00
  Final Train: 100.00
   Final Test: 66.90
Split: 01, Run: 03
None time:  0.751560288015753
None Run 03:
Highest Train: 100.00
Highest Valid: 66.40
  Final Train: 100.00
   Final Test: 65.60
run time now: 2.376192569732666
total time:  2.4249006339814514
None All runs:
Highest Train: 100.00 ± 0.00
Highest Valid: 68.00 ± 2.27
  Final Train: 100.00 ± 0.00
   Final Test: 67.17 ± 1.72
[I 2023-06-11 23:22:38,456] Trial 24 finished with value: 68.0 and parameters: {'Fwd': 0.0021057295196421667, 'K': 4, 'alpha': 0.7000000000000001, 'dropout': 0.30000000000000004, 'gnnepoch': 70, 'lambda1': 0.55, 'lambda2': 3.880988026732163, 'loop': 1, 'loss': 'CE', 'lr': 0.001199639544443569, 'softmaxF': True, 'useGCN': True, 'weight_decay': 7.049237487049798e-06, 'weightedloss': True}. Best is trial 10 with value: 71.20000457763672.
/home/wxy/miniconda3/lib/python3.10/site-packages/optuna/distributions.py:685: UserWarning: The distribution is specified by [0, 1.00001] and step=0.05, but the range is not divisible by `step`. It will be replaced by [0, 1.0].
  warnings.warn(
K:  1
alpha:  0.8500000000000001
lr:  0.002083120153546534
weight_decay:  1.8197381038339595e-05
dropout:  0.2
fix split and run 3 times
Data: Data(x=[3327, 3703], y=[3327], train_mask=[3327], val_mask=[3327], test_mask=[3327], adj_t=[3327, 3327, nnz=9104])
num_train tensor(120)
num_noise 0
noise: tensor(0)
data feature 3703
ALTOPT(
  (lins): Sequential(
    (0): Linear(in_features=3703, out_features=64, bias=True)
    (1): BatchNorm1d(64, eps=1e-05, momentum=0.1, affine=True, track_running_stats=True)
    (2): Dropout(p=0.2, inplace=True)
    (3): ReLU(inplace=True)
    (4): Linear(in_features=64, out_features=6, bias=True)
    (5): LogSoftmax(dim=-1)
  )
  (prop): Propagation(K=1, mode=None, lambda1=None, lambda2=None, L21=True, alpha=0.8500000000000001)
  (gcn): GCN(
    (convs): ModuleList(
      (0): GCNConv(3703, 64)
      (1): GCNConv(64, 6)
    )
    (bns): ModuleList(
      (0): BatchNorm1d(64, eps=1e-05, momentum=0.1, affine=True, track_running_stats=True)
    )
    (output): LogSoftmax(dim=-1)
  )
)
propagate done
init label
Split: 01, Run: 01
None time:  0.4666124249342829
None Run 01:
Highest Train: 100.00
Highest Valid: 71.00
  Final Train: 100.00
   Final Test: 69.00
Split: 01, Run: 02
None time:  0.5426240859087557
None Run 02:
Highest Train: 100.00
Highest Valid: 71.00
  Final Train: 100.00
   Final Test: 68.90
Split: 01, Run: 03
None time:  0.4746121410280466
None Run 03:
Highest Train: 100.00
Highest Valid: 70.80
  Final Train: 100.00
   Final Test: 70.40
run time now: 1.5162503719329834
total time:  1.5727262729778886
None All runs:
Highest Train: 100.00 ± 0.00
Highest Valid: 70.93 ± 0.12
  Final Train: 100.00 ± 0.00
   Final Test: 69.43 ± 0.84
[I 2023-06-11 23:22:40,426] Trial 25 finished with value: 70.93333435058594 and parameters: {'Fwd': 0.007788839447145419, 'K': 1, 'alpha': 0.8500000000000001, 'dropout': 0.2, 'gnnepoch': 50, 'lambda1': 1.0, 'lambda2': 3.0273140816895623, 'loop': 0, 'loss': 'CE', 'lr': 0.002083120153546534, 'softmaxF': True, 'useGCN': True, 'weight_decay': 1.8197381038339595e-05, 'weightedloss': True}. Best is trial 10 with value: 71.20000457763672.
/home/wxy/miniconda3/lib/python3.10/site-packages/optuna/distributions.py:685: UserWarning: The distribution is specified by [0, 1.00001] and step=0.05, but the range is not divisible by `step`. It will be replaced by [0, 1.0].
  warnings.warn(
K:  6
alpha:  0.6000000000000001
lr:  0.0036264365066789443
weight_decay:  2.7456996816491036e-06
dropout:  0.5
fix split and run 3 times
Data: Data(x=[3327, 3703], y=[3327], train_mask=[3327], val_mask=[3327], test_mask=[3327], adj_t=[3327, 3327, nnz=9104])
num_train tensor(120)
num_noise 0
noise: tensor(0)
data feature 3703
ALTOPT(
  (lins): Sequential(
    (0): Linear(in_features=3703, out_features=64, bias=True)
    (1): BatchNorm1d(64, eps=1e-05, momentum=0.1, affine=True, track_running_stats=True)
    (2): Dropout(p=0.5, inplace=True)
    (3): ReLU(inplace=True)
    (4): Linear(in_features=64, out_features=6, bias=True)
    (5): Identity()
  )
  (prop): Propagation(K=6, mode=None, lambda1=None, lambda2=None, L21=True, alpha=0.6000000000000001)
  (gcn): GCN(
    (convs): ModuleList(
      (0): GCNConv(3703, 64)
      (1): GCNConv(64, 6)
    )
    (bns): ModuleList(
      (0): BatchNorm1d(64, eps=1e-05, momentum=0.1, affine=True, track_running_stats=True)
    )
    (output): Identity()
  )
)
propagate done
init label
Split: 01, Run: 01, Epoch: 100, Loss: 0.0000, Train: 100.00%, Valid: 65.80% Test: 66.50%
Split: 01, Run: 01
None time:  1.3968295771628618
None Run 01:
Highest Train: 100.00
Highest Valid: 65.80
  Final Train: 100.00
   Final Test: 66.40
Split: 01, Run: 02, Epoch: 100, Loss: 0.0000, Train: 100.00%, Valid: 67.20% Test: 66.90%
Split: 01, Run: 02
None time:  1.3737852710764855
None Run 02:
Highest Train: 100.00
Highest Valid: 67.20
  Final Train: 100.00
   Final Test: 66.90
Split: 01, Run: 03, Epoch: 100, Loss: 0.0000, Train: 100.00%, Valid: 65.40% Test: 66.10%
Split: 01, Run: 03
None time:  1.460870943032205
None Run 03:
Highest Train: 100.00
Highest Valid: 65.40
  Final Train: 100.00
   Final Test: 66.10
run time now: 4.269821643829346
total time:  4.32599872793071
None All runs:
Highest Train: 100.00 ± 0.00
Highest Valid: 66.13 ± 0.95
  Final Train: 100.00 ± 0.00
   Final Test: 66.47 ± 0.40
