[I 2023-06-11 23:27:31,237] Trial 107 finished with value: 64.73332977294922 and parameters: {'Fwd': 0.021132751084388925, 'K': 8, 'alpha': 0.0, 'dropout': 0.9, 'gnnepoch': 10, 'lambda1': 1.0, 'lambda2': 3.964883409064626, 'loop': 0, 'loss': 'CE', 'lr': 0.002037727326621574, 'softmaxF': False, 'useGCN': True, 'weight_decay': 1.276362635390008e-06, 'weightedloss': False}. Best is trial 101 with value: 71.79999542236328.
/home/wxy/miniconda3/lib/python3.10/site-packages/optuna/distributions.py:685: UserWarning: The distribution is specified by [0, 1.00001] and step=0.05, but the range is not divisible by `step`. It will be replaced by [0, 1.0].
  warnings.warn(
K:  8
alpha:  0.1
lr:  0.002789384727419729
weight_decay:  1.9182129540043663e-06
dropout:  0.9
fix split and run 3 times
Data: Data(x=[3327, 3703], y=[3327], train_mask=[3327], val_mask=[3327], test_mask=[3327], adj_t=[3327, 3327, nnz=9104])
num_train tensor(120)
num_noise 0
noise: tensor(0)
data feature 3703
ALTOPT(
  (lins): Sequential(
    (0): Linear(in_features=3703, out_features=64, bias=True)
    (1): BatchNorm1d(64, eps=1e-05, momentum=0.1, affine=True, track_running_stats=True)
    (2): Dropout(p=0.9, inplace=True)
    (3): ReLU(inplace=True)
    (4): Linear(in_features=64, out_features=6, bias=True)
    (5): LogSoftmax(dim=-1)
  )
  (prop): Propagation(K=8, mode=None, lambda1=None, lambda2=None, L21=True, alpha=0.1)
  (gcn): GCN(
    (convs): ModuleList(
      (0): GCNConv(3703, 64)
      (1): GCNConv(64, 6)
    )
    (bns): ModuleList(
      (0): BatchNorm1d(64, eps=1e-05, momentum=0.1, affine=True, track_running_stats=True)
    )
    (output): LogSoftmax(dim=-1)
  )
)
propagate done
init label
Split: 01, Run: 01
None time:  0.9659416968934238
None Run 01:
Highest Train: 100.00
Highest Valid: 71.40
  Final Train: 100.00
   Final Test: 69.60
Split: 01, Run: 02
None time:  0.9966658719349653
None Run 02:
Highest Train: 100.00
Highest Valid: 70.60
  Final Train: 99.17
   Final Test: 68.00
Split: 01, Run: 03
None time:  0.9859833118971437
None Run 03:
Highest Train: 100.00
Highest Valid: 71.80
  Final Train: 100.00
   Final Test: 70.00
run time now: 2.989555835723877
total time:  3.0506770631764084
None All runs:
Highest Train: 100.00 ± 0.00
Highest Valid: 71.27 ± 0.61
  Final Train: 99.72 ± 0.48
   Final Test: 69.20 ± 1.06
[I 2023-06-11 23:27:34,748] Trial 108 finished with value: 71.26667022705078 and parameters: {'Fwd': 0.010364893685829482, 'K': 8, 'alpha': 0.1, 'dropout': 0.9, 'gnnepoch': 110, 'lambda1': 0.9, 'lambda2': 2.8791108076480514, 'loop': 0, 'loss': 'CE', 'lr': 0.002789384727419729, 'softmaxF': False, 'useGCN': True, 'weight_decay': 1.9182129540043663e-06, 'weightedloss': False}. Best is trial 101 with value: 71.79999542236328.
/home/wxy/miniconda3/lib/python3.10/site-packages/optuna/distributions.py:685: UserWarning: The distribution is specified by [0, 1.00001] and step=0.05, but the range is not divisible by `step`. It will be replaced by [0, 1.0].
  warnings.warn(
K:  8
alpha:  0.05
lr:  0.0034763488368759954
weight_decay:  2.8080188325640513e-06
dropout:  0.8
fix split and run 3 times
Data: Data(x=[3327, 3703], y=[3327], train_mask=[3327], val_mask=[3327], test_mask=[3327], adj_t=[3327, 3327, nnz=9104])
num_train tensor(120)
num_noise 0
noise: tensor(0)
data feature 3703
ALTOPT(
  (lins): Sequential(
    (0): Linear(in_features=3703, out_features=64, bias=True)
    (1): BatchNorm1d(64, eps=1e-05, momentum=0.1, affine=True, track_running_stats=True)
    (2): Dropout(p=0.8, inplace=True)
    (3): ReLU(inplace=True)
    (4): Linear(in_features=64, out_features=6, bias=True)
    (5): LogSoftmax(dim=-1)
  )
  (prop): Propagation(K=8, mode=None, lambda1=None, lambda2=None, L21=True, alpha=0.05)
  (gcn): GCN(
    (convs): ModuleList(
      (0): GCNConv(3703, 64)
      (1): GCNConv(64, 6)
    )
    (bns): ModuleList(
      (0): BatchNorm1d(64, eps=1e-05, momentum=0.1, affine=True, track_running_stats=True)
    )
    (output): LogSoftmax(dim=-1)
  )
)
propagate done
init label
Split: 01, Run: 01
None time:  0.7008395728189498
None Run 01:
Highest Train: 100.00
Highest Valid: 48.40
  Final Train: 99.17
   Final Test: 49.00
Split: 01, Run: 02
None time:  0.7250332091934979
None Run 02:
Highest Train: 100.00
Highest Valid: 50.80
  Final Train: 99.17
   Final Test: 53.10
Split: 01, Run: 03
None time:  0.7236386178992689
None Run 03:
Highest Train: 100.00
Highest Valid: 57.80
  Final Train: 98.33
   Final Test: 59.60
run time now: 2.1910383701324463
total time:  2.244055744027719
None All runs:
Highest Train: 100.00 ± 0.00
Highest Valid: 52.33 ± 4.88
  Final Train: 98.89 ± 0.48
   Final Test: 53.90 ± 5.35
[I 2023-06-11 23:27:37,528] Trial 109 finished with value: 52.33333206176758 and parameters: {'Fwd': 0.025689056131549877, 'K': 8, 'alpha': 0.05, 'dropout': 0.8, 'gnnepoch': 120, 'lambda1': 0.9, 'lambda2': 2.5473920673033907, 'loop': 0, 'loss': 'CE', 'lr': 0.0034763488368759954, 'softmaxF': False, 'useGCN': False, 'weight_decay': 2.8080188325640513e-06, 'weightedloss': False}. Best is trial 101 with value: 71.79999542236328.
/home/wxy/miniconda3/lib/python3.10/site-packages/optuna/distributions.py:685: UserWarning: The distribution is specified by [0, 1.00001] and step=0.05, but the range is not divisible by `step`. It will be replaced by [0, 1.0].
  warnings.warn(
K:  9
alpha:  0.15000000000000002
lr:  0.0024016296955250934
weight_decay:  1.726266260914432e-06
dropout:  0.9
fix split and run 3 times
Data: Data(x=[3327, 3703], y=[3327], train_mask=[3327], val_mask=[3327], test_mask=[3327], adj_t=[3327, 3327, nnz=9104])
num_train tensor(120)
num_noise 0
noise: tensor(0)
data feature 3703
ALTOPT(
  (lins): Sequential(
    (0): Linear(in_features=3703, out_features=64, bias=True)
    (1): BatchNorm1d(64, eps=1e-05, momentum=0.1, affine=True, track_running_stats=True)
    (2): Dropout(p=0.9, inplace=True)
    (3): ReLU(inplace=True)
    (4): Linear(in_features=64, out_features=6, bias=True)
    (5): LogSoftmax(dim=-1)
  )
  (prop): Propagation(K=9, mode=None, lambda1=None, lambda2=None, L21=True, alpha=0.15000000000000002)
  (gcn): GCN(
    (convs): ModuleList(
      (0): GCNConv(3703, 64)
      (1): GCNConv(64, 6)
    )
    (bns): ModuleList(
      (0): BatchNorm1d(64, eps=1e-05, momentum=0.1, affine=True, track_running_stats=True)
    )
    (output): LogSoftmax(dim=-1)
  )
)
propagate done
init label
Split: 01, Run: 01
None time:  0.9109474520664662
None Run 01:
Highest Train: 100.00
Highest Valid: 71.20
  Final Train: 100.00
   Final Test: 69.00
Split: 01, Run: 02
None time:  0.968143719015643
None Run 02:
Highest Train: 100.00
Highest Valid: 71.00
  Final Train: 100.00
   Final Test: 68.60
Split: 01, Run: 03
None time:  0.9772481108084321
None Run 03:
Highest Train: 100.00
Highest Valid: 72.00
  Final Train: 100.00
   Final Test: 70.30
run time now: 2.8973464965820312
total time:  2.960144381970167
None All runs:
Highest Train: 100.00 ± 0.00
Highest Valid: 71.40 ± 0.53
  Final Train: 100.00 ± 0.00
   Final Test: 69.30 ± 0.89
[I 2023-06-11 23:27:40,916] Trial 110 finished with value: 71.4000015258789 and parameters: {'Fwd': 0.017382111257209995, 'K': 9, 'alpha': 0.15000000000000002, 'dropout': 0.9, 'gnnepoch': 110, 'lambda1': 0.8500000000000001, 'lambda2': 3.305156686496748, 'loop': 0, 'loss': 'CE', 'lr': 0.0024016296955250934, 'softmaxF': False, 'useGCN': True, 'weight_decay': 1.726266260914432e-06, 'weightedloss': False}. Best is trial 101 with value: 71.79999542236328.
/home/wxy/miniconda3/lib/python3.10/site-packages/optuna/distributions.py:685: UserWarning: The distribution is specified by [0, 1.00001] and step=0.05, but the range is not divisible by `step`. It will be replaced by [0, 1.0].
  warnings.warn(
K:  7
alpha:  0.2
lr:  0.0031653607235820557
weight_decay:  1.5899526256576156e-06
dropout:  0.9
fix split and run 3 times
Data: Data(x=[3327, 3703], y=[3327], train_mask=[3327], val_mask=[3327], test_mask=[3327], adj_t=[3327, 3327, nnz=9104])
num_train tensor(120)
num_noise 0
noise: tensor(0)
data feature 3703
ALTOPT(
  (lins): Sequential(
    (0): Linear(in_features=3703, out_features=64, bias=True)
    (1): BatchNorm1d(64, eps=1e-05, momentum=0.1, affine=True, track_running_stats=True)
    (2): Dropout(p=0.9, inplace=True)
    (3): ReLU(inplace=True)
    (4): Linear(in_features=64, out_features=6, bias=True)
    (5): LogSoftmax(dim=-1)
  )
  (prop): Propagation(K=7, mode=None, lambda1=None, lambda2=None, L21=True, alpha=0.2)
  (gcn): GCN(
    (convs): ModuleList(
      (0): GCNConv(3703, 64)
      (1): GCNConv(64, 6)
    )
    (bns): ModuleList(
      (0): BatchNorm1d(64, eps=1e-05, momentum=0.1, affine=True, track_running_stats=True)
    )
    (output): LogSoftmax(dim=-1)
  )
)
propagate done
init label
Split: 01, Run: 01
None time:  0.9943739189766347
None Run 01:
Highest Train: 100.00
Highest Valid: 71.40
  Final Train: 100.00
   Final Test: 69.40
Split: 01, Run: 02
None time:  1.0344383229967207
None Run 02:
Highest Train: 100.00
Highest Valid: 71.60
  Final Train: 100.00
   Final Test: 70.00
Split: 01, Run: 03
None time:  1.0699908779934049
None Run 03:
Highest Train: 100.00
Highest Valid: 71.60
  Final Train: 99.17
   Final Test: 70.70
run time now: 3.1397194862365723
total time:  3.197288481052965
None All runs:
Highest Train: 100.00 ± 0.00
Highest Valid: 71.53 ± 0.12
  Final Train: 99.72 ± 0.48
   Final Test: 70.03 ± 0.65
[I 2023-06-11 23:27:44,512] Trial 111 finished with value: 71.53333282470703 and parameters: {'Fwd': 0.007423931827729318, 'K': 7, 'alpha': 0.2, 'dropout': 0.9, 'gnnepoch': 120, 'lambda1': 0.8, 'lambda2': 3.667192127587407, 'loop': 0, 'loss': 'CE', 'lr': 0.0031653607235820557, 'softmaxF': False, 'useGCN': True, 'weight_decay': 1.5899526256576156e-06, 'weightedloss': False}. Best is trial 101 with value: 71.79999542236328.
/home/wxy/miniconda3/lib/python3.10/site-packages/optuna/distributions.py:685: UserWarning: The distribution is specified by [0, 1.00001] and step=0.05, but the range is not divisible by `step`. It will be replaced by [0, 1.0].
  warnings.warn(
K:  8
alpha:  0.25
lr:  0.003075031271871134
weight_decay:  1.2089031517093976e-06
dropout:  0.9
fix split and run 3 times
Data: Data(x=[3327, 3703], y=[3327], train_mask=[3327], val_mask=[3327], test_mask=[3327], adj_t=[3327, 3327, nnz=9104])
num_train tensor(120)
num_noise 0
noise: tensor(0)
data feature 3703
ALTOPT(
  (lins): Sequential(
    (0): Linear(in_features=3703, out_features=64, bias=True)
    (1): BatchNorm1d(64, eps=1e-05, momentum=0.1, affine=True, track_running_stats=True)
    (2): Dropout(p=0.9, inplace=True)
    (3): ReLU(inplace=True)
    (4): Linear(in_features=64, out_features=6, bias=True)
    (5): LogSoftmax(dim=-1)
  )
  (prop): Propagation(K=8, mode=None, lambda1=None, lambda2=None, L21=True, alpha=0.25)
  (gcn): GCN(
    (convs): ModuleList(
      (0): GCNConv(3703, 64)
      (1): GCNConv(64, 6)
    )
    (bns): ModuleList(
      (0): BatchNorm1d(64, eps=1e-05, momentum=0.1, affine=True, track_running_stats=True)
    )
    (output): LogSoftmax(dim=-1)
  )
)
propagate done
init label
Split: 01, Run: 01
None time:  1.0328785669989884
None Run 01:
Highest Train: 100.00
Highest Valid: 71.40
  Final Train: 100.00
   Final Test: 69.20
Split: 01, Run: 02
None time:  1.0960220959968865
None Run 02:
Highest Train: 100.00
Highest Valid: 71.80
  Final Train: 100.00
   Final Test: 69.90
Split: 01, Run: 03
None time:  1.01345861912705
None Run 03:
Highest Train: 100.00
Highest Valid: 71.60
  Final Train: 100.00
   Final Test: 69.70
run time now: 3.1839311122894287
total time:  3.238006839994341
None All runs:
Highest Train: 100.00 ± 0.00
Highest Valid: 71.60 ± 0.20
  Final Train: 100.00 ± 0.00
   Final Test: 69.60 ± 0.36
[I 2023-06-11 23:27:48,189] Trial 112 finished with value: 71.60000610351562 and parameters: {'Fwd': 0.009162510419850762, 'K': 8, 'alpha': 0.25, 'dropout': 0.9, 'gnnepoch': 120, 'lambda1': 0.8, 'lambda2': 3.3372576122050814, 'loop': 0, 'loss': 'CE', 'lr': 0.003075031271871134, 'softmaxF': False, 'useGCN': True, 'weight_decay': 1.2089031517093976e-06, 'weightedloss': False}. Best is trial 101 with value: 71.79999542236328.
/home/wxy/miniconda3/lib/python3.10/site-packages/optuna/distributions.py:685: UserWarning: The distribution is specified by [0, 1.00001] and step=0.05, but the range is not divisible by `step`. It will be replaced by [0, 1.0].
  warnings.warn(
K:  8
alpha:  0.15000000000000002
lr:  0.0023119297110995316
weight_decay:  1.2742566717567054e-06
dropout:  0.9
fix split and run 3 times
Data: Data(x=[3327, 3703], y=[3327], train_mask=[3327], val_mask=[3327], test_mask=[3327], adj_t=[3327, 3327, nnz=9104])
num_train tensor(120)
num_noise 0
noise: tensor(0)
data feature 3703
ALTOPT(
  (lins): Sequential(
    (0): Linear(in_features=3703, out_features=64, bias=True)
    (1): BatchNorm1d(64, eps=1e-05, momentum=0.1, affine=True, track_running_stats=True)
    (2): Dropout(p=0.9, inplace=True)
    (3): ReLU(inplace=True)
    (4): Linear(in_features=64, out_features=6, bias=True)
    (5): LogSoftmax(dim=-1)
  )
  (prop): Propagation(K=8, mode=None, lambda1=None, lambda2=None, L21=True, alpha=0.15000000000000002)
  (gcn): GCN(
    (convs): ModuleList(
      (0): GCNConv(3703, 64)
      (1): GCNConv(64, 6)
    )
    (bns): ModuleList(
      (0): BatchNorm1d(64, eps=1e-05, momentum=0.1, affine=True, track_running_stats=True)
    )
    (output): LogSoftmax(dim=-1)
  )
)
propagate done
init label
Split: 01, Run: 01
None time:  0.9692001140210778
None Run 01:
Highest Train: 100.00
Highest Valid: 71.00
  Final Train: 100.00
   Final Test: 69.20
Split: 01, Run: 02
None time:  1.0726218440104276
None Run 02:
Highest Train: 100.00
Highest Valid: 71.80
  Final Train: 100.00
   Final Test: 70.20
Split: 01, Run: 03
None time:  1.11036064196378
None Run 03:
Highest Train: 100.00
Highest Valid: 71.60
  Final Train: 100.00
   Final Test: 70.50
run time now: 3.1933746337890625
total time:  3.2446138439700007
None All runs:
Highest Train: 100.00 ± 0.00
Highest Valid: 71.47 ± 0.42
  Final Train: 100.00 ± 0.00
   Final Test: 69.97 ± 0.68
[I 2023-06-11 23:27:51,847] Trial 113 finished with value: 71.46666717529297 and parameters: {'Fwd': 0.008755204149272085, 'K': 8, 'alpha': 0.15000000000000002, 'dropout': 0.9, 'gnnepoch': 120, 'lambda1': 0.8500000000000001, 'lambda2': 4.202027393925308, 'loop': 0, 'loss': 'CE', 'lr': 0.0023119297110995316, 'softmaxF': False, 'useGCN': True, 'weight_decay': 1.2742566717567054e-06, 'weightedloss': False}. Best is trial 101 with value: 71.79999542236328.
/home/wxy/miniconda3/lib/python3.10/site-packages/optuna/distributions.py:685: UserWarning: The distribution is specified by [0, 1.00001] and step=0.05, but the range is not divisible by `step`. It will be replaced by [0, 1.0].
  warnings.warn(
K:  9
alpha:  0.25
lr:  0.003063475149131127
weight_decay:  1.0480638145675519e-06
dropout:  0.9
fix split and run 3 times
Data: Data(x=[3327, 3703], y=[3327], train_mask=[3327], val_mask=[3327], test_mask=[3327], adj_t=[3327, 3327, nnz=9104])
num_train tensor(120)
num_noise 0
noise: tensor(0)
data feature 3703
ALTOPT(
  (lins): Sequential(
    (0): Linear(in_features=3703, out_features=64, bias=True)
    (1): BatchNorm1d(64, eps=1e-05, momentum=0.1, affine=True, track_running_stats=True)
    (2): Dropout(p=0.9, inplace=True)
    (3): ReLU(inplace=True)
    (4): Linear(in_features=64, out_features=6, bias=True)
    (5): LogSoftmax(dim=-1)
  )
  (prop): Propagation(K=9, mode=None, lambda1=None, lambda2=None, L21=True, alpha=0.25)
  (gcn): GCN(
    (convs): ModuleList(
      (0): GCNConv(3703, 64)
      (1): GCNConv(64, 6)
    )
    (bns): ModuleList(
      (0): BatchNorm1d(64, eps=1e-05, momentum=0.1, affine=True, track_running_stats=True)
    )
    (output): LogSoftmax(dim=-1)
  )
)
propagate done
init label
Split: 01, Run: 01
None time:  1.0844782767817378
None Run 01:
Highest Train: 100.00
Highest Valid: 71.40
  Final Train: 99.17
   Final Test: 69.10
Split: 01, Run: 02
None time:  1.0347749348729849
None Run 02:
Highest Train: 100.00
Highest Valid: 71.80
  Final Train: 100.00
   Final Test: 70.30
Split: 01, Run: 03
None time:  1.059208489023149
None Run 03:
Highest Train: 100.00
Highest Valid: 71.60
  Final Train: 100.00
   Final Test: 70.00
run time now: 3.2205567359924316
total time:  3.2786007209215313
None All runs:
Highest Train: 100.00 ± 0.00
Highest Valid: 71.60 ± 0.20
  Final Train: 99.72 ± 0.48
   Final Test: 69.80 ± 0.62
[I 2023-06-11 23:27:55,577] Trial 114 finished with value: 71.60000610351562 and parameters: {'Fwd': 0.015610841567806264, 'K': 9, 'alpha': 0.25, 'dropout': 0.9, 'gnnepoch': 120, 'lambda1': 1.0, 'lambda2': 2.8847852090620933, 'loop': 0, 'loss': 'CE', 'lr': 0.003063475149131127, 'softmaxF': False, 'useGCN': True, 'weight_decay': 1.0480638145675519e-06, 'weightedloss': False}. Best is trial 101 with value: 71.79999542236328.
/home/wxy/miniconda3/lib/python3.10/site-packages/optuna/distributions.py:685: UserWarning: The distribution is specified by [0, 1.00001] and step=0.05, but the range is not divisible by `step`. It will be replaced by [0, 1.0].
  warnings.warn(
K:  9
alpha:  0.25
lr:  0.0025835923370300853
weight_decay:  1.0248481961434332e-06
dropout:  0.9
fix split and run 3 times
Data: Data(x=[3327, 3703], y=[3327], train_mask=[3327], val_mask=[3327], test_mask=[3327], adj_t=[3327, 3327, nnz=9104])
num_train tensor(120)
num_noise 0
noise: tensor(0)
data feature 3703
ALTOPT(
  (lins): Sequential(
    (0): Linear(in_features=3703, out_features=64, bias=True)
    (1): BatchNorm1d(64, eps=1e-05, momentum=0.1, affine=True, track_running_stats=True)
    (2): Dropout(p=0.9, inplace=True)
    (3): ReLU(inplace=True)
    (4): Linear(in_features=64, out_features=6, bias=True)
    (5): LogSoftmax(dim=-1)
  )
  (prop): Propagation(K=9, mode=None, lambda1=None, lambda2=None, L21=True, alpha=0.25)
  (gcn): GCN(
    (convs): ModuleList(
      (0): GCNConv(3703, 64)
      (1): GCNConv(64, 6)
    )
    (bns): ModuleList(
      (0): BatchNorm1d(64, eps=1e-05, momentum=0.1, affine=True, track_running_stats=True)
    )
    (output): LogSoftmax(dim=-1)
  )
)
propagate done
init label
Split: 01, Run: 01
None time:  1.0735900248400867
None Run 01:
Highest Train: 100.00
Highest Valid: 71.20
  Final Train: 99.17
   Final Test: 69.00
Split: 01, Run: 02
None time:  1.0339997329283506
None Run 02:
Highest Train: 100.00
Highest Valid: 71.20
  Final Train: 100.00
   Final Test: 70.50
Split: 01, Run: 03
None time:  1.1002833091188222
None Run 03:
Highest Train: 100.00
Highest Valid: 71.80
  Final Train: 100.00
   Final Test: 70.40
run time now: 3.24861478805542
total time:  3.3006018311716616
None All runs:
Highest Train: 100.00 ± 0.00
Highest Valid: 71.40 ± 0.35
  Final Train: 99.72 ± 0.48
   Final Test: 69.97 ± 0.84
[I 2023-06-11 23:27:59,434] Trial 115 finished with value: 71.4000015258789 and parameters: {'Fwd': 0.013256076491607111, 'K': 9, 'alpha': 0.25, 'dropout': 0.9, 'gnnepoch': 120, 'lambda1': 1.0, 'lambda2': 2.7883801825541155, 'loop': 0, 'loss': 'CE', 'lr': 0.0025835923370300853, 'softmaxF': False, 'useGCN': True, 'weight_decay': 1.0248481961434332e-06, 'weightedloss': False}. Best is trial 101 with value: 71.79999542236328.
/home/wxy/miniconda3/lib/python3.10/site-packages/optuna/distributions.py:685: UserWarning: The distribution is specified by [0, 1.00001] and step=0.05, but the range is not divisible by `step`. It will be replaced by [0, 1.0].
  warnings.warn(
K:  9
alpha:  0.1
lr:  0.0029833733366881176
weight_decay:  1.339057887234159e-06
dropout:  0.8
fix split and run 3 times
Data: Data(x=[3327, 3703], y=[3327], train_mask=[3327], val_mask=[3327], test_mask=[3327], adj_t=[3327, 3327, nnz=9104])
num_train tensor(120)
num_noise 0
noise: tensor(0)
data feature 3703
ALTOPT(
  (lins): Sequential(
    (0): Linear(in_features=3703, out_features=64, bias=True)
    (1): BatchNorm1d(64, eps=1e-05, momentum=0.1, affine=True, track_running_stats=True)
    (2): Dropout(p=0.8, inplace=True)
    (3): ReLU(inplace=True)
    (4): Linear(in_features=64, out_features=6, bias=True)
    (5): LogSoftmax(dim=-1)
  )
  (prop): Propagation(K=9, mode=None, lambda1=None, lambda2=None, L21=True, alpha=0.1)
  (gcn): GCN(
    (convs): ModuleList(
      (0): GCNConv(3703, 64)
      (1): GCNConv(64, 6)
    )
    (bns): ModuleList(
      (0): BatchNorm1d(64, eps=1e-05, momentum=0.1, affine=True, track_running_stats=True)
    )
    (output): LogSoftmax(dim=-1)
  )
)
propagate done
init label
Split: 01, Run: 01
None time:  1.0002690728288144
None Run 01:
Highest Train: 100.00
Highest Valid: 71.40
  Final Train: 99.17
   Final Test: 70.00
Split: 01, Run: 02
None time:  0.9571616149041802
None Run 02:
Highest Train: 100.00
Highest Valid: 70.60
  Final Train: 100.00
   Final Test: 68.80
Split: 01, Run: 03
None time:  0.9793572081252933
None Run 03:
Highest Train: 100.00
Highest Valid: 70.40
  Final Train: 100.00
   Final Test: 70.00
run time now: 2.992345094680786
total time:  3.069489432964474
None All runs:
Highest Train: 100.00 ± 0.00
Highest Valid: 70.80 ± 0.53
  Final Train: 99.72 ± 0.48
   Final Test: 69.60 ± 0.69
