[I 2023-06-11 23:25:51,439] Trial 80 finished with value: 70.5999984741211 and parameters: {'Fwd': 0.007571076033266116, 'K': 7, 'alpha': 0.0, 'dropout': 0.8, 'gnnepoch': 110, 'lambda1': 0.9500000000000001, 'lambda2': 3.059045269957788, 'loop': 0, 'loss': 'CE', 'lr': 0.0037838008146809728, 'softmaxF': False, 'useGCN': True, 'weight_decay': 2.8649948217563266e-06, 'weightedloss': True}. Best is trial 43 with value: 71.66666412353516.
/home/wxy/miniconda3/lib/python3.10/site-packages/optuna/distributions.py:685: UserWarning: The distribution is specified by [0, 1.00001] and step=0.05, but the range is not divisible by `step`. It will be replaced by [0, 1.0].
  warnings.warn(
K:  7
alpha:  0.4
lr:  0.004499485192758015
weight_decay:  2.0652904390944794e-06
dropout:  0.9
fix split and run 3 times
Data: Data(x=[3327, 3703], y=[3327], train_mask=[3327], val_mask=[3327], test_mask=[3327], adj_t=[3327, 3327, nnz=9104])
num_train tensor(120)
num_noise 0
noise: tensor(0)
data feature 3703
ALTOPT(
  (lins): Sequential(
    (0): Linear(in_features=3703, out_features=64, bias=True)
    (1): BatchNorm1d(64, eps=1e-05, momentum=0.1, affine=True, track_running_stats=True)
    (2): Dropout(p=0.9, inplace=True)
    (3): ReLU(inplace=True)
    (4): Linear(in_features=64, out_features=6, bias=True)
    (5): LogSoftmax(dim=-1)
  )
  (prop): Propagation(K=7, mode=None, lambda1=None, lambda2=None, L21=True, alpha=0.4)
  (gcn): GCN(
    (convs): ModuleList(
      (0): GCNConv(3703, 64)
      (1): GCNConv(64, 6)
    )
    (bns): ModuleList(
      (0): BatchNorm1d(64, eps=1e-05, momentum=0.1, affine=True, track_running_stats=True)
    )
    (output): LogSoftmax(dim=-1)
  )
)
propagate done
init label
Split: 01, Run: 01
None time:  0.9795123699586838
None Run 01:
Highest Train: 100.00
Highest Valid: 71.60
  Final Train: 99.17
   Final Test: 70.30
Split: 01, Run: 02
None time:  1.127287448151037
None Run 02:
Highest Train: 100.00
Highest Valid: 70.80
  Final Train: 98.33
   Final Test: 70.00
Split: 01, Run: 03
None time:  1.1214718869887292
None Run 03:
Highest Train: 100.00
Highest Valid: 71.20
  Final Train: 99.17
   Final Test: 69.70
run time now: 3.2684361934661865
total time:  3.3271165969781578
None All runs:
Highest Train: 100.00 ± 0.00
Highest Valid: 71.20 ± 0.40
  Final Train: 98.89 ± 0.48
   Final Test: 70.00 ± 0.30
[I 2023-06-11 23:25:55,289] Trial 81 finished with value: 71.20000457763672 and parameters: {'Fwd': 0.003376320299937784, 'K': 7, 'alpha': 0.4, 'dropout': 0.9, 'gnnepoch': 120, 'lambda1': 1.0, 'lambda2': 3.1994392033809342, 'loop': 0, 'loss': 'CE', 'lr': 0.004499485192758015, 'softmaxF': False, 'useGCN': True, 'weight_decay': 2.0652904390944794e-06, 'weightedloss': True}. Best is trial 43 with value: 71.66666412353516.
/home/wxy/miniconda3/lib/python3.10/site-packages/optuna/distributions.py:685: UserWarning: The distribution is specified by [0, 1.00001] and step=0.05, but the range is not divisible by `step`. It will be replaced by [0, 1.0].
  warnings.warn(
K:  7
alpha:  0.45
lr:  0.0032709413044576838
weight_decay:  1.9919692960118806e-06
dropout:  0.9
fix split and run 3 times
Data: Data(x=[3327, 3703], y=[3327], train_mask=[3327], val_mask=[3327], test_mask=[3327], adj_t=[3327, 3327, nnz=9104])
num_train tensor(120)
num_noise 0
noise: tensor(0)
data feature 3703
ALTOPT(
  (lins): Sequential(
    (0): Linear(in_features=3703, out_features=64, bias=True)
    (1): BatchNorm1d(64, eps=1e-05, momentum=0.1, affine=True, track_running_stats=True)
    (2): Dropout(p=0.9, inplace=True)
    (3): ReLU(inplace=True)
    (4): Linear(in_features=64, out_features=6, bias=True)
    (5): LogSoftmax(dim=-1)
  )
  (prop): Propagation(K=7, mode=None, lambda1=None, lambda2=None, L21=True, alpha=0.45)
  (gcn): GCN(
    (convs): ModuleList(
      (0): GCNConv(3703, 64)
      (1): GCNConv(64, 6)
    )
    (bns): ModuleList(
      (0): BatchNorm1d(64, eps=1e-05, momentum=0.1, affine=True, track_running_stats=True)
    )
    (output): LogSoftmax(dim=-1)
  )
)
propagate done
init label
Split: 01, Run: 01
None time:  0.9634201051667333
None Run 01:
Highest Train: 100.00
Highest Valid: 71.80
  Final Train: 100.00
   Final Test: 69.30
Split: 01, Run: 02
None time:  1.0176099129021168
None Run 02:
Highest Train: 100.00
Highest Valid: 71.60
  Final Train: 100.00
   Final Test: 69.60
Split: 01, Run: 03
None time:  1.0954134019557387
None Run 03:
Highest Train: 100.00
Highest Valid: 71.80
  Final Train: 100.00
   Final Test: 69.80
run time now: 3.1168127059936523
total time:  3.177680940134451
None All runs:
Highest Train: 100.00 ± 0.00
Highest Valid: 71.73 ± 0.12
  Final Train: 100.00 ± 0.00
   Final Test: 69.57 ± 0.25
[I 2023-06-11 23:25:58,881] Trial 82 finished with value: 71.73332977294922 and parameters: {'Fwd': 0.002589510934790701, 'K': 7, 'alpha': 0.45, 'dropout': 0.9, 'gnnepoch': 120, 'lambda1': 1.0, 'lambda2': 3.5360658606644852, 'loop': 0, 'loss': 'CE', 'lr': 0.0032709413044576838, 'softmaxF': False, 'useGCN': True, 'weight_decay': 1.9919692960118806e-06, 'weightedloss': True}. Best is trial 82 with value: 71.73332977294922.
/home/wxy/miniconda3/lib/python3.10/site-packages/optuna/distributions.py:685: UserWarning: The distribution is specified by [0, 1.00001] and step=0.05, but the range is not divisible by `step`. It will be replaced by [0, 1.0].
  warnings.warn(
K:  7
alpha:  0.35000000000000003
lr:  0.004907099508669079
weight_decay:  3.31896365530331e-06
dropout:  0.9
fix split and run 3 times
Data: Data(x=[3327, 3703], y=[3327], train_mask=[3327], val_mask=[3327], test_mask=[3327], adj_t=[3327, 3327, nnz=9104])
num_train tensor(120)
num_noise 0
noise: tensor(0)
data feature 3703
ALTOPT(
  (lins): Sequential(
    (0): Linear(in_features=3703, out_features=64, bias=True)
    (1): BatchNorm1d(64, eps=1e-05, momentum=0.1, affine=True, track_running_stats=True)
    (2): Dropout(p=0.9, inplace=True)
    (3): ReLU(inplace=True)
    (4): Linear(in_features=64, out_features=6, bias=True)
    (5): LogSoftmax(dim=-1)
  )
  (prop): Propagation(K=7, mode=None, lambda1=None, lambda2=None, L21=True, alpha=0.35000000000000003)
  (gcn): GCN(
    (convs): ModuleList(
      (0): GCNConv(3703, 64)
      (1): GCNConv(64, 6)
    )
    (bns): ModuleList(
      (0): BatchNorm1d(64, eps=1e-05, momentum=0.1, affine=True, track_running_stats=True)
    )
    (output): LogSoftmax(dim=-1)
  )
)
propagate done
init label
Split: 01, Run: 01
None time:  1.1132482609245926
None Run 01:
Highest Train: 100.00
Highest Valid: 71.20
  Final Train: 100.00
   Final Test: 70.70
Split: 01, Run: 02
None time:  1.1482456380035728
None Run 02:
Highest Train: 100.00
Highest Valid: 70.60
  Final Train: 98.33
   Final Test: 70.40
Split: 01, Run: 03
None time:  0.9904839990194887
None Run 03:
Highest Train: 100.00
Highest Valid: 71.40
  Final Train: 99.17
   Final Test: 69.70
run time now: 3.2923502922058105
total time:  3.3491410380229354
None All runs:
Highest Train: 100.00 ± 0.00
Highest Valid: 71.07 ± 0.42
  Final Train: 99.17 ± 0.83
   Final Test: 70.27 ± 0.51
[I 2023-06-11 23:26:02,659] Trial 83 finished with value: 71.0666732788086 and parameters: {'Fwd': 0.011412901729039747, 'K': 7, 'alpha': 0.35000000000000003, 'dropout': 0.9, 'gnnepoch': 120, 'lambda1': 0.9, 'lambda2': 3.49821066003298, 'loop': 0, 'loss': 'CE', 'lr': 0.004907099508669079, 'softmaxF': False, 'useGCN': True, 'weight_decay': 3.31896365530331e-06, 'weightedloss': True}. Best is trial 82 with value: 71.73332977294922.
/home/wxy/miniconda3/lib/python3.10/site-packages/optuna/distributions.py:685: UserWarning: The distribution is specified by [0, 1.00001] and step=0.05, but the range is not divisible by `step`. It will be replaced by [0, 1.0].
  warnings.warn(
K:  6
alpha:  0.45
lr:  0.003362385037005218
weight_decay:  1.8370609778781698e-06
dropout:  0.9
fix split and run 3 times
Data: Data(x=[3327, 3703], y=[3327], train_mask=[3327], val_mask=[3327], test_mask=[3327], adj_t=[3327, 3327, nnz=9104])
num_train tensor(120)
num_noise 0
noise: tensor(0)
data feature 3703
ALTOPT(
  (lins): Sequential(
    (0): Linear(in_features=3703, out_features=64, bias=True)
    (1): BatchNorm1d(64, eps=1e-05, momentum=0.1, affine=True, track_running_stats=True)
    (2): Dropout(p=0.9, inplace=True)
    (3): ReLU(inplace=True)
    (4): Linear(in_features=64, out_features=6, bias=True)
    (5): LogSoftmax(dim=-1)
  )
  (prop): Propagation(K=6, mode=None, lambda1=None, lambda2=None, L21=True, alpha=0.45)
  (gcn): GCN(
    (convs): ModuleList(
      (0): GCNConv(3703, 64)
      (1): GCNConv(64, 6)
    )
    (bns): ModuleList(
      (0): BatchNorm1d(64, eps=1e-05, momentum=0.1, affine=True, track_running_stats=True)
    )
    (output): LogSoftmax(dim=-1)
  )
)
propagate done
init label
Split: 01, Run: 01
None time:  1.0162488911300898
None Run 01:
Highest Train: 100.00
Highest Valid: 71.60
  Final Train: 100.00
   Final Test: 69.80
Split: 01, Run: 02
None time:  1.0449315400328487
None Run 02:
Highest Train: 100.00
Highest Valid: 71.40
  Final Train: 100.00
   Final Test: 69.90
Split: 01, Run: 03
None time:  1.0403718880843371
None Run 03:
Highest Train: 100.00
Highest Valid: 71.60
  Final Train: 100.00
   Final Test: 69.80
run time now: 3.140720844268799
total time:  3.196949982084334
None All runs:
Highest Train: 100.00 ± 0.00
Highest Valid: 71.53 ± 0.12
  Final Train: 100.00 ± 0.00
   Final Test: 69.83 ± 0.06
[I 2023-06-11 23:26:06,283] Trial 84 finished with value: 71.53333282470703 and parameters: {'Fwd': 0.005232210780078319, 'K': 6, 'alpha': 0.45, 'dropout': 0.9, 'gnnepoch': 120, 'lambda1': 0.9500000000000001, 'lambda2': 3.565783041579019, 'loop': 0, 'loss': 'CE', 'lr': 0.003362385037005218, 'softmaxF': False, 'useGCN': True, 'weight_decay': 1.8370609778781698e-06, 'weightedloss': True}. Best is trial 82 with value: 71.73332977294922.
/home/wxy/miniconda3/lib/python3.10/site-packages/optuna/distributions.py:685: UserWarning: The distribution is specified by [0, 1.00001] and step=0.05, but the range is not divisible by `step`. It will be replaced by [0, 1.0].
  warnings.warn(
K:  5
alpha:  0.55
lr:  0.003232002648705019
weight_decay:  1.2789251904708043e-06
dropout:  0.8
fix split and run 3 times
Data: Data(x=[3327, 3703], y=[3327], train_mask=[3327], val_mask=[3327], test_mask=[3327], adj_t=[3327, 3327, nnz=9104])
num_train tensor(120)
num_noise 0
noise: tensor(0)
data feature 3703
ALTOPT(
  (lins): Sequential(
    (0): Linear(in_features=3703, out_features=64, bias=True)
    (1): BatchNorm1d(64, eps=1e-05, momentum=0.1, affine=True, track_running_stats=True)
    (2): Dropout(p=0.8, inplace=True)
    (3): ReLU(inplace=True)
    (4): Linear(in_features=64, out_features=6, bias=True)
    (5): LogSoftmax(dim=-1)
  )
  (prop): Propagation(K=5, mode=None, lambda1=None, lambda2=None, L21=True, alpha=0.55)
  (gcn): GCN(
    (convs): ModuleList(
      (0): GCNConv(3703, 64)
      (1): GCNConv(64, 6)
    )
    (bns): ModuleList(
      (0): BatchNorm1d(64, eps=1e-05, momentum=0.1, affine=True, track_running_stats=True)
    )
    (output): LogSoftmax(dim=-1)
  )
)
propagate done
init label
Split: 01, Run: 01
None time:  0.976257607107982
None Run 01:
Highest Train: 100.00
Highest Valid: 71.60
  Final Train: 100.00
   Final Test: 70.30
Split: 01, Run: 02
None time:  0.9732514340430498
None Run 02:
Highest Train: 100.00
Highest Valid: 70.40
  Final Train: 100.00
   Final Test: 68.80
Split: 01, Run: 03
None time:  1.0551688359118998
None Run 03:
Highest Train: 100.00
Highest Valid: 70.40
  Final Train: 100.00
   Final Test: 69.40
run time now: 3.051597833633423
total time:  3.110176313202828
None All runs:
Highest Train: 100.00 ± 0.00
Highest Valid: 70.80 ± 0.69
  Final Train: 100.00 ± 0.00
   Final Test: 69.50 ± 0.75
[I 2023-06-11 23:26:09,899] Trial 85 finished with value: 70.79999542236328 and parameters: {'Fwd': 0.005195443857161989, 'K': 5, 'alpha': 0.55, 'dropout': 0.8, 'gnnepoch': 110, 'lambda1': 0.8, 'lambda2': 4.445131428814211, 'loop': 0, 'loss': 'CE', 'lr': 0.003232002648705019, 'softmaxF': False, 'useGCN': True, 'weight_decay': 1.2789251904708043e-06, 'weightedloss': True}. Best is trial 82 with value: 71.73332977294922.
/home/wxy/miniconda3/lib/python3.10/site-packages/optuna/distributions.py:685: UserWarning: The distribution is specified by [0, 1.00001] and step=0.05, but the range is not divisible by `step`. It will be replaced by [0, 1.0].
  warnings.warn(
K:  6
alpha:  0.5
lr:  0.0036421244638164102
weight_decay:  1.7752564046339343e-06
dropout:  0.9
fix split and run 3 times
Data: Data(x=[3327, 3703], y=[3327], train_mask=[3327], val_mask=[3327], test_mask=[3327], adj_t=[3327, 3327, nnz=9104])
num_train tensor(120)
num_noise 0
noise: tensor(0)
data feature 3703
ALTOPT(
  (lins): Sequential(
    (0): Linear(in_features=3703, out_features=64, bias=True)
    (1): BatchNorm1d(64, eps=1e-05, momentum=0.1, affine=True, track_running_stats=True)
    (2): Dropout(p=0.9, inplace=True)
    (3): ReLU(inplace=True)
    (4): Linear(in_features=64, out_features=6, bias=True)
    (5): LogSoftmax(dim=-1)
  )
  (prop): Propagation(K=6, mode=None, lambda1=None, lambda2=None, L21=True, alpha=0.5)
  (gcn): GCN(
    (convs): ModuleList(
      (0): GCNConv(3703, 64)
      (1): GCNConv(64, 6)
    )
    (bns): ModuleList(
      (0): BatchNorm1d(64, eps=1e-05, momentum=0.1, affine=True, track_running_stats=True)
    )
    (output): LogSoftmax(dim=-1)
  )
)
propagate done
init label
Split: 01, Run: 01
None time:  1.1552520040422678
None Run 01:
Highest Train: 100.00
Highest Valid: 71.20
  Final Train: 100.00
   Final Test: 69.80
Split: 01, Run: 02
None time:  1.1322829599957913
None Run 02:
Highest Train: 100.00
Highest Valid: 71.40
  Final Train: 99.17
   Final Test: 70.10
Split: 01, Run: 03
None time:  1.1089535360224545
None Run 03:
Highest Train: 100.00
Highest Valid: 69.40
  Final Train: 100.00
   Final Test: 70.50
run time now: 3.4348199367523193
total time:  3.4890223438851535
None All runs:
Highest Train: 100.00 ± 0.00
Highest Valid: 70.67 ± 1.10
  Final Train: 99.72 ± 0.48
   Final Test: 70.13 ± 0.35
[I 2023-06-11 23:26:13,850] Trial 86 finished with value: 70.66666412353516 and parameters: {'Fwd': 0.012128614548802685, 'K': 6, 'alpha': 0.5, 'dropout': 0.9, 'gnnepoch': 120, 'lambda1': 0.9, 'lambda2': 3.6370303564696527, 'loop': 1, 'loss': 'CE', 'lr': 0.0036421244638164102, 'softmaxF': False, 'useGCN': True, 'weight_decay': 1.7752564046339343e-06, 'weightedloss': True}. Best is trial 82 with value: 71.73332977294922.
/home/wxy/miniconda3/lib/python3.10/site-packages/optuna/distributions.py:685: UserWarning: The distribution is specified by [0, 1.00001] and step=0.05, but the range is not divisible by `step`. It will be replaced by [0, 1.0].
  warnings.warn(
K:  6
alpha:  0.35000000000000003
lr:  0.0031033892647863224
weight_decay:  1.0040517648808668e-06
dropout:  0.7000000000000001
fix split and run 3 times
Data: Data(x=[3327, 3703], y=[3327], train_mask=[3327], val_mask=[3327], test_mask=[3327], adj_t=[3327, 3327, nnz=9104])
num_train tensor(120)
num_noise 0
noise: tensor(0)
data feature 3703
ALTOPT(
  (lins): Sequential(
    (0): Linear(in_features=3703, out_features=64, bias=True)
    (1): BatchNorm1d(64, eps=1e-05, momentum=0.1, affine=True, track_running_stats=True)
    (2): Dropout(p=0.7000000000000001, inplace=True)
    (3): ReLU(inplace=True)
    (4): Linear(in_features=64, out_features=6, bias=True)
    (5): Identity()
  )
  (prop): Propagation(K=6, mode=None, lambda1=None, lambda2=None, L21=True, alpha=0.35000000000000003)
  (gcn): GCN(
    (convs): ModuleList(
      (0): GCNConv(3703, 64)
      (1): GCNConv(64, 6)
    )
    (bns): ModuleList(
      (0): BatchNorm1d(64, eps=1e-05, momentum=0.1, affine=True, track_running_stats=True)
    )
    (output): Identity()
  )
)
propagate done
init label
Split: 01, Run: 01, Epoch: 100, Loss: 0.0000, Train: 100.00%, Valid: 65.60% Test: 66.60%
Split: 01, Run: 01
None time:  1.6048203059472144
None Run 01:
Highest Train: 100.00
Highest Valid: 65.60
  Final Train: 100.00
   Final Test: 66.50
Split: 01, Run: 02, Epoch: 100, Loss: 0.0000, Train: 100.00%, Valid: 65.60% Test: 67.50%
Split: 01, Run: 02
None time:  1.5594440649729222
None Run 02:
Highest Train: 100.00
Highest Valid: 65.60
  Final Train: 100.00
   Final Test: 67.60
Split: 01, Run: 03, Epoch: 100, Loss: 0.0000, Train: 100.00%, Valid: 65.40% Test: 67.80%
Split: 01, Run: 03
None time:  1.6266426539514214
None Run 03:
Highest Train: 100.00
Highest Valid: 65.40
  Final Train: 100.00
   Final Test: 67.90
run time now: 4.829950332641602
total time:  4.883979809936136
None All runs:
Highest Train: 100.00 ± 0.00
Highest Valid: 65.53 ± 0.12
  Final Train: 100.00 ± 0.00
   Final Test: 67.33 ± 0.74
[I 2023-06-11 23:26:19,136] Trial 87 finished with value: 65.53333282470703 and parameters: {'Fwd': 0.00819512668739742, 'K': 6, 'alpha': 0.35000000000000003, 'dropout': 0.7000000000000001, 'gnnepoch': 110, 'lambda1': 1.0, 'lambda2': 3.9882504062083646, 'loop': 0, 'loss': 'MSE', 'lr': 0.0031033892647863224, 'softmaxF': False, 'useGCN': True, 'weight_decay': 1.0040517648808668e-06, 'weightedloss': True}. Best is trial 82 with value: 71.73332977294922.
/home/wxy/miniconda3/lib/python3.10/site-packages/optuna/distributions.py:685: UserWarning: The distribution is specified by [0, 1.00001] and step=0.05, but the range is not divisible by `step`. It will be replaced by [0, 1.0].
  warnings.warn(
K:  8
alpha:  0.25
lr:  0.003163471070166898
weight_decay:  4.645468212780108e-06
dropout:  0.9
fix split and run 3 times
Data: Data(x=[3327, 3703], y=[3327], train_mask=[3327], val_mask=[3327], test_mask=[3327], adj_t=[3327, 3327, nnz=9104])
num_train tensor(120)
num_noise 0
noise: tensor(0)
data feature 3703
ALTOPT(
  (lins): Sequential(
    (0): Linear(in_features=3703, out_features=64, bias=True)
    (1): BatchNorm1d(64, eps=1e-05, momentum=0.1, affine=True, track_running_stats=True)
    (2): Dropout(p=0.9, inplace=True)
    (3): ReLU(inplace=True)
    (4): Linear(in_features=64, out_features=6, bias=True)
    (5): LogSoftmax(dim=-1)
  )
  (prop): Propagation(K=8, mode=None, lambda1=None, lambda2=None, L21=True, alpha=0.25)
  (gcn): GCN(
    (convs): ModuleList(
      (0): GCNConv(3703, 64)
      (1): GCNConv(64, 6)
    )
    (bns): ModuleList(
      (0): BatchNorm1d(64, eps=1e-05, momentum=0.1, affine=True, track_running_stats=True)
    )
    (output): LogSoftmax(dim=-1)
  )
)
propagate done
init label
Split: 01, Run: 01
None time:  1.001134549966082
None Run 01:
Highest Train: 100.00
Highest Valid: 71.60
  Final Train: 99.17
   Final Test: 69.20
Split: 01, Run: 02
None time:  0.9621371899265796
None Run 02:
Highest Train: 100.00
Highest Valid: 71.80
  Final Train: 100.00
   Final Test: 70.30
Split: 01, Run: 03
None time:  1.076179115101695
None Run 03:
Highest Train: 100.00
Highest Valid: 71.60
  Final Train: 100.00
   Final Test: 69.80
run time now: 3.081282138824463
total time:  3.1319329279940575
None All runs:
Highest Train: 100.00 ± 0.00
Highest Valid: 71.67 ± 0.12
  Final Train: 99.72 ± 0.48
   Final Test: 69.77 ± 0.55
[I 2023-06-11 23:26:22,713] Trial 88 finished with value: 71.66666412353516 and parameters: {'Fwd': 0.0050719703501266675, 'K': 8, 'alpha': 0.25, 'dropout': 0.9, 'gnnepoch': 120, 'lambda1': 0.9500000000000001, 'lambda2': 2.8860853323126325, 'loop': 0, 'loss': 'CE', 'lr': 0.003163471070166898, 'softmaxF': False, 'useGCN': True, 'weight_decay': 4.645468212780108e-06, 'weightedloss': True}. Best is trial 82 with value: 71.73332977294922.
/home/wxy/miniconda3/lib/python3.10/site-packages/optuna/distributions.py:685: UserWarning: The distribution is specified by [0, 1.00001] and step=0.05, but the range is not divisible by `step`. It will be replaced by [0, 1.0].
  warnings.warn(
K:  8
alpha:  0.25
lr:  0.003899241932102862
weight_decay:  5.779780505060882e-06
dropout:  0.9
fix split and run 3 times
Data: Data(x=[3327, 3703], y=[3327], train_mask=[3327], val_mask=[3327], test_mask=[3327], adj_t=[3327, 3327, nnz=9104])
num_train tensor(120)
num_noise 0
noise: tensor(0)
data feature 3703
ALTOPT(
  (lins): Sequential(
    (0): Linear(in_features=3703, out_features=64, bias=True)
    (1): BatchNorm1d(64, eps=1e-05, momentum=0.1, affine=True, track_running_stats=True)
    (2): Dropout(p=0.9, inplace=True)
    (3): ReLU(inplace=True)
    (4): Linear(in_features=64, out_features=6, bias=True)
    (5): LogSoftmax(dim=-1)
  )
  (prop): Propagation(K=8, mode=None, lambda1=None, lambda2=None, L21=True, alpha=0.25)
  (gcn): GCN(
    (convs): ModuleList(
      (0): GCNConv(3703, 64)
      (1): GCNConv(64, 6)
    )
    (bns): ModuleList(
      (0): BatchNorm1d(64, eps=1e-05, momentum=0.1, affine=True, track_running_stats=True)
    )
    (output): LogSoftmax(dim=-1)
  )
)
propagate done
init label
Split: 01, Run: 01
None time:  1.116169209126383
None Run 01:
Highest Train: 100.00
Highest Valid: 71.20
  Final Train: 99.17
   Final Test: 70.00
Split: 01, Run: 02
None time:  1.0157795110717416
None Run 02:
Highest Train: 100.00
Highest Valid: 71.60
  Final Train: 99.17
   Final Test: 69.80
Split: 01, Run: 03
None time:  1.1072927981149405
None Run 03:
Highest Train: 100.00
Highest Valid: 71.60
  Final Train: 96.67
   Final Test: 70.40
run time now: 3.285984516143799
total time:  3.3440059300046414
None All runs:
Highest Train: 100.00 ± 0.00
Highest Valid: 71.47 ± 0.23
  Final Train: 98.33 ± 1.44
   Final Test: 70.07 ± 0.31
