[I 2023-06-12 00:08:36,142] Trial 746 finished with value: 67.5999984741211 and parameters: {'Fwd': 0.0030470208073792, 'K': 8, 'alpha': 0.9500000000000001, 'dropout': 0.7000000000000001, 'gnnepoch': 120, 'lambda1': 0.8, 'lambda2': 8.514672471474137, 'loop': 0, 'loss': 'CE', 'lr': 0.00012824063990761434, 'softmaxF': False, 'useGCN': True, 'weight_decay': 2.474707559291954e-06, 'weightedloss': True}. Best is trial 605 with value: 72.13333129882812.
/home/wxy/miniconda3/lib/python3.10/site-packages/optuna/distributions.py:685: UserWarning: The distribution is specified by [0, 1.00001] and step=0.05, but the range is not divisible by `step`. It will be replaced by [0, 1.0].
  warnings.warn(
K:  8
alpha:  0.55
lr:  0.0007207058557669923
weight_decay:  3.492138064822603e-05
dropout:  0.8
fix split and run 3 times
Data: Data(x=[3327, 3703], y=[3327], train_mask=[3327], val_mask=[3327], test_mask=[3327], adj_t=[3327, 3327, nnz=9104])
num_train tensor(120)
num_noise 0
noise: tensor(0)
data feature 3703
ALTOPT(
  (lins): Sequential(
    (0): Linear(in_features=3703, out_features=64, bias=True)
    (1): BatchNorm1d(64, eps=1e-05, momentum=0.1, affine=True, track_running_stats=True)
    (2): Dropout(p=0.8, inplace=True)
    (3): ReLU(inplace=True)
    (4): Linear(in_features=64, out_features=6, bias=True)
    (5): LogSoftmax(dim=-1)
  )
  (prop): Propagation(K=8, mode=None, lambda1=None, lambda2=None, L21=True, alpha=0.55)
  (gcn): GCN(
    (convs): ModuleList(
      (0): GCNConv(3703, 64)
      (1): GCNConv(64, 6)
    )
    (bns): ModuleList(
      (0): BatchNorm1d(64, eps=1e-05, momentum=0.1, affine=True, track_running_stats=True)
    )
    (output): LogSoftmax(dim=-1)
  )
)
propagate done
init label
Split: 01, Run: 01
None time:  1.0453130030073225
None Run 01:
Highest Train: 100.00
Highest Valid: 70.20
  Final Train: 100.00
   Final Test: 69.50
Split: 01, Run: 02
None time:  1.0395085630007088
None Run 02:
Highest Train: 100.00
Highest Valid: 71.20
  Final Train: 100.00
   Final Test: 70.10
Split: 01, Run: 03
None time:  1.1156861910130829
None Run 03:
Highest Train: 100.00
Highest Valid: 70.80
  Final Train: 100.00
   Final Test: 70.10
run time now: 3.240590810775757
total time:  3.2946028551086783
None All runs:
Highest Train: 100.00 ± 0.00
Highest Valid: 70.73 ± 0.50
  Final Train: 100.00 ± 0.00
   Final Test: 69.90 ± 0.35
[I 2023-06-12 00:08:39,987] Trial 747 finished with value: 70.73333740234375 and parameters: {'Fwd': 1.1087094692711685e-05, 'K': 8, 'alpha': 0.55, 'dropout': 0.8, 'gnnepoch': 120, 'lambda1': 0.65, 'lambda2': 7.146762546868713, 'loop': 0, 'loss': 'CE', 'lr': 0.0007207058557669923, 'softmaxF': False, 'useGCN': True, 'weight_decay': 3.492138064822603e-05, 'weightedloss': True}. Best is trial 605 with value: 72.13333129882812.
/home/wxy/miniconda3/lib/python3.10/site-packages/optuna/distributions.py:685: UserWarning: The distribution is specified by [0, 1.00001] and step=0.05, but the range is not divisible by `step`. It will be replaced by [0, 1.0].
  warnings.warn(
K:  8
alpha:  0.65
lr:  0.0009846992573579263
weight_decay:  0.00044882422500809686
dropout:  0.8
fix split and run 3 times
Data: Data(x=[3327, 3703], y=[3327], train_mask=[3327], val_mask=[3327], test_mask=[3327], adj_t=[3327, 3327, nnz=9104])
num_train tensor(120)
num_noise 0
noise: tensor(0)
data feature 3703
ALTOPT(
  (lins): Sequential(
    (0): Linear(in_features=3703, out_features=64, bias=True)
    (1): BatchNorm1d(64, eps=1e-05, momentum=0.1, affine=True, track_running_stats=True)
    (2): Dropout(p=0.8, inplace=True)
    (3): ReLU(inplace=True)
    (4): Linear(in_features=64, out_features=6, bias=True)
    (5): LogSoftmax(dim=-1)
  )
  (prop): Propagation(K=8, mode=None, lambda1=None, lambda2=None, L21=True, alpha=0.65)
  (gcn): GCN(
    (convs): ModuleList(
      (0): GCNConv(3703, 64)
      (1): GCNConv(64, 6)
    )
    (bns): ModuleList(
      (0): BatchNorm1d(64, eps=1e-05, momentum=0.1, affine=True, track_running_stats=True)
    )
    (output): LogSoftmax(dim=-1)
  )
)
propagate done
init label
Split: 01, Run: 01
None time:  1.0498305931687355
None Run 01:
Highest Train: 100.00
Highest Valid: 70.40
  Final Train: 100.00
   Final Test: 69.40
Split: 01, Run: 02
None time:  1.0672830641269684
None Run 02:
Highest Train: 100.00
Highest Valid: 72.40
  Final Train: 100.00
   Final Test: 69.70
Split: 01, Run: 03
None time:  1.0337890998926014
None Run 03:
Highest Train: 100.00
Highest Valid: 71.20
  Final Train: 100.00
   Final Test: 70.40
run time now: 3.1899242401123047
total time:  3.234155177138746
None All runs:
Highest Train: 100.00 ± 0.00
Highest Valid: 71.33 ± 1.01
  Final Train: 100.00 ± 0.00
   Final Test: 69.83 ± 0.51
[I 2023-06-12 00:08:43,782] Trial 748 finished with value: 71.33333587646484 and parameters: {'Fwd': 0.001427779948250363, 'K': 8, 'alpha': 0.65, 'dropout': 0.8, 'gnnepoch': 120, 'lambda1': 0.75, 'lambda2': 6.772633721947323, 'loop': 0, 'loss': 'CE', 'lr': 0.0009846992573579263, 'softmaxF': False, 'useGCN': True, 'weight_decay': 0.00044882422500809686, 'weightedloss': True}. Best is trial 605 with value: 72.13333129882812.
/home/wxy/miniconda3/lib/python3.10/site-packages/optuna/distributions.py:685: UserWarning: The distribution is specified by [0, 1.00001] and step=0.05, but the range is not divisible by `step`. It will be replaced by [0, 1.0].
  warnings.warn(
K:  8
alpha:  0.7000000000000001
lr:  0.00036644488296480295
weight_decay:  5.094570521898522e-05
dropout:  0.8
fix split and run 3 times
Data: Data(x=[3327, 3703], y=[3327], train_mask=[3327], val_mask=[3327], test_mask=[3327], adj_t=[3327, 3327, nnz=9104])
num_train tensor(120)
num_noise 0
noise: tensor(0)
data feature 3703
ALTOPT(
  (lins): Sequential(
    (0): Linear(in_features=3703, out_features=64, bias=True)
    (1): BatchNorm1d(64, eps=1e-05, momentum=0.1, affine=True, track_running_stats=True)
    (2): Dropout(p=0.8, inplace=True)
    (3): ReLU(inplace=True)
    (4): Linear(in_features=64, out_features=6, bias=True)
    (5): LogSoftmax(dim=-1)
  )
  (prop): Propagation(K=8, mode=None, lambda1=None, lambda2=None, L21=True, alpha=0.7000000000000001)
  (gcn): GCN(
    (convs): ModuleList(
      (0): GCNConv(3703, 64)
      (1): GCNConv(64, 6)
    )
    (bns): ModuleList(
      (0): BatchNorm1d(64, eps=1e-05, momentum=0.1, affine=True, track_running_stats=True)
    )
    (output): LogSoftmax(dim=-1)
  )
)
propagate done
init label
Split: 01, Run: 01
None time:  0.9582267929799855
None Run 01:
Highest Train: 100.00
Highest Valid: 70.40
  Final Train: 100.00
   Final Test: 68.90
Split: 01, Run: 02
None time:  0.9530430769082159
None Run 02:
Highest Train: 100.00
Highest Valid: 67.60
  Final Train: 100.00
   Final Test: 67.60
Split: 01, Run: 03
None time:  1.0639841679949313
None Run 03:
Highest Train: 100.00
Highest Valid: 68.20
  Final Train: 100.00
   Final Test: 68.30
run time now: 3.0195281505584717
total time:  3.080825777957216
None All runs:
Highest Train: 100.00 ± 0.00
Highest Valid: 68.73 ± 1.47
  Final Train: 100.00 ± 0.00
   Final Test: 68.27 ± 0.65
[I 2023-06-12 00:08:47,350] Trial 749 finished with value: 68.73332977294922 and parameters: {'Fwd': 0.0005873488207378873, 'K': 8, 'alpha': 0.7000000000000001, 'dropout': 0.8, 'gnnepoch': 110, 'lambda1': 0.7000000000000001, 'lambda2': 3.9761687969256125, 'loop': 0, 'loss': 'CE', 'lr': 0.00036644488296480295, 'softmaxF': False, 'useGCN': True, 'weight_decay': 5.094570521898522e-05, 'weightedloss': True}. Best is trial 605 with value: 72.13333129882812.
/home/wxy/miniconda3/lib/python3.10/site-packages/optuna/distributions.py:685: UserWarning: The distribution is specified by [0, 1.00001] and step=0.05, but the range is not divisible by `step`. It will be replaced by [0, 1.0].
  warnings.warn(
K:  8
alpha:  0.8500000000000001
lr:  0.0023832171042012617
weight_decay:  0.0037052814690576863
dropout:  0.9
fix split and run 3 times
Data: Data(x=[3327, 3703], y=[3327], train_mask=[3327], val_mask=[3327], test_mask=[3327], adj_t=[3327, 3327, nnz=9104])
num_train tensor(120)
num_noise 0
noise: tensor(0)
data feature 3703
ALTOPT(
  (lins): Sequential(
    (0): Linear(in_features=3703, out_features=64, bias=True)
    (1): BatchNorm1d(64, eps=1e-05, momentum=0.1, affine=True, track_running_stats=True)
    (2): Dropout(p=0.9, inplace=True)
    (3): ReLU(inplace=True)
    (4): Linear(in_features=64, out_features=6, bias=True)
    (5): LogSoftmax(dim=-1)
  )
  (prop): Propagation(K=8, mode=None, lambda1=None, lambda2=None, L21=True, alpha=0.8500000000000001)
  (gcn): GCN(
    (convs): ModuleList(
      (0): GCNConv(3703, 64)
      (1): GCNConv(64, 6)
    )
    (bns): ModuleList(
      (0): BatchNorm1d(64, eps=1e-05, momentum=0.1, affine=True, track_running_stats=True)
    )
    (output): LogSoftmax(dim=-1)
  )
)
propagate done
init label
Split: 01, Run: 01, Epoch: 100, Loss: 0.0000, Train: 100.00%, Valid: 51.40% Test: 51.90%
Split: 01, Run: 01
None time:  1.8296202151104808
None Run 01:
Highest Train: 100.00
Highest Valid: 51.40
  Final Train: 100.00
   Final Test: 51.50
Split: 01, Run: 02, Epoch: 100, Loss: 0.0000, Train: 100.00%, Valid: 51.40% Test: 51.90%
Split: 01, Run: 02
None time:  1.8126971970777959
None Run 02:
Highest Train: 100.00
Highest Valid: 51.40
  Final Train: 100.00
   Final Test: 51.50
Split: 01, Run: 03, Epoch: 100, Loss: 0.0000, Train: 100.00%, Valid: 51.40% Test: 51.90%
Split: 01, Run: 03
None time:  1.7813280678819865
None Run 03:
Highest Train: 100.00
Highest Valid: 51.40
  Final Train: 100.00
   Final Test: 51.50
run time now: 5.464050054550171
total time:  5.5090895891189575
None All runs:
Highest Train: 100.00 ± 0.00
Highest Valid: 51.40 ± 0.00
  Final Train: 100.00 ± 0.00
   Final Test: 51.50 ± 0.00
[I 2023-06-12 00:08:53,441] Trial 750 finished with value: 51.40000534057617 and parameters: {'Fwd': 0.00028296275495469223, 'K': 8, 'alpha': 0.8500000000000001, 'dropout': 0.9, 'gnnepoch': 120, 'lambda1': 0.0, 'lambda2': 5.380567780575826, 'loop': 0, 'loss': 'CE', 'lr': 0.0023832171042012617, 'softmaxF': False, 'useGCN': True, 'weight_decay': 0.0037052814690576863, 'weightedloss': True}. Best is trial 605 with value: 72.13333129882812.
/home/wxy/miniconda3/lib/python3.10/site-packages/optuna/distributions.py:685: UserWarning: The distribution is specified by [0, 1.00001] and step=0.05, but the range is not divisible by `step`. It will be replaced by [0, 1.0].
  warnings.warn(
K:  9
alpha:  0.6000000000000001
lr:  0.001375975200523791
weight_decay:  2.9160407260601764e-05
dropout:  0.8
fix split and run 3 times
Data: Data(x=[3327, 3703], y=[3327], train_mask=[3327], val_mask=[3327], test_mask=[3327], adj_t=[3327, 3327, nnz=9104])
num_train tensor(120)
num_noise 0
noise: tensor(0)
data feature 3703
ALTOPT(
  (lins): Sequential(
    (0): Linear(in_features=3703, out_features=64, bias=True)
    (1): BatchNorm1d(64, eps=1e-05, momentum=0.1, affine=True, track_running_stats=True)
    (2): Dropout(p=0.8, inplace=True)
    (3): ReLU(inplace=True)
    (4): Linear(in_features=64, out_features=6, bias=True)
    (5): LogSoftmax(dim=-1)
  )
  (prop): Propagation(K=9, mode=None, lambda1=None, lambda2=None, L21=True, alpha=0.6000000000000001)
  (gcn): GCN(
    (convs): ModuleList(
      (0): GCNConv(3703, 64)
      (1): GCNConv(64, 6)
    )
    (bns): ModuleList(
      (0): BatchNorm1d(64, eps=1e-05, momentum=0.1, affine=True, track_running_stats=True)
    )
    (output): LogSoftmax(dim=-1)
  )
)
propagate done
init label
Split: 01, Run: 01
None time:  1.2650593968573958
None Run 01:
Highest Train: 100.00
Highest Valid: 70.60
  Final Train: 100.00
   Final Test: 69.70
Split: 01, Run: 02
None time:  1.377192263957113
None Run 02:
Highest Train: 100.00
Highest Valid: 71.20
  Final Train: 100.00
   Final Test: 69.30
Split: 01, Run: 03
None time:  1.324468492064625
None Run 03:
Highest Train: 100.00
Highest Valid: 70.40
  Final Train: 100.00
   Final Test: 70.50
run time now: 4.02152156829834
total time:  4.07618401106447
None All runs:
Highest Train: 100.00 ± 0.00
Highest Valid: 70.73 ± 0.42
  Final Train: 100.00 ± 0.00
   Final Test: 69.83 ± 0.61
[I 2023-06-12 00:08:58,067] Trial 751 finished with value: 70.73333740234375 and parameters: {'Fwd': 0.00017811728540713251, 'K': 9, 'alpha': 0.6000000000000001, 'dropout': 0.8, 'gnnepoch': 110, 'lambda1': 0.7000000000000001, 'lambda2': 5.717028597131408, 'loop': 2, 'loss': 'CE', 'lr': 0.001375975200523791, 'softmaxF': True, 'useGCN': True, 'weight_decay': 2.9160407260601764e-05, 'weightedloss': True}. Best is trial 605 with value: 72.13333129882812.
/home/wxy/miniconda3/lib/python3.10/site-packages/optuna/distributions.py:685: UserWarning: The distribution is specified by [0, 1.00001] and step=0.05, but the range is not divisible by `step`. It will be replaced by [0, 1.0].
  warnings.warn(
K:  8
alpha:  0.9
lr:  0.0027403711438266135
weight_decay:  0.0011039035938353087
dropout:  0.7000000000000001
fix split and run 3 times
Data: Data(x=[3327, 3703], y=[3327], train_mask=[3327], val_mask=[3327], test_mask=[3327], adj_t=[3327, 3327, nnz=9104])
num_train tensor(120)
num_noise 0
noise: tensor(0)
data feature 3703
ALTOPT(
  (lins): Sequential(
    (0): Linear(in_features=3703, out_features=64, bias=True)
    (1): BatchNorm1d(64, eps=1e-05, momentum=0.1, affine=True, track_running_stats=True)
    (2): Dropout(p=0.7000000000000001, inplace=True)
    (3): ReLU(inplace=True)
    (4): Linear(in_features=64, out_features=6, bias=True)
    (5): LogSoftmax(dim=-1)
  )
  (prop): Propagation(K=8, mode=None, lambda1=None, lambda2=None, L21=True, alpha=0.9)
  (gcn): GCN(
    (convs): ModuleList(
      (0): GCNConv(3703, 64)
      (1): GCNConv(64, 6)
    )
    (bns): ModuleList(
      (0): BatchNorm1d(64, eps=1e-05, momentum=0.1, affine=True, track_running_stats=True)
    )
    (output): LogSoftmax(dim=-1)
  )
)
propagate done
init label
Split: 01, Run: 01
None time:  1.1466485580895096
None Run 01:
Highest Train: 100.00
Highest Valid: 70.40
  Final Train: 100.00
   Final Test: 70.00
Split: 01, Run: 02
None time:  1.073604241013527
None Run 02:
Highest Train: 100.00
Highest Valid: 71.20
  Final Train: 100.00
   Final Test: 70.30
Split: 01, Run: 03
None time:  1.0309352879412472
None Run 03:
Highest Train: 100.00
Highest Valid: 71.00
  Final Train: 100.00
   Final Test: 69.00
run time now: 3.2903523445129395
total time:  3.3403546151239425
None All runs:
Highest Train: 100.00 ± 0.00
Highest Valid: 70.87 ± 0.42
  Final Train: 100.00 ± 0.00
   Final Test: 69.77 ± 0.68
[I 2023-06-12 00:09:02,035] Trial 752 finished with value: 70.86666870117188 and parameters: {'Fwd': 3.323653153872316e-05, 'K': 8, 'alpha': 0.9, 'dropout': 0.7000000000000001, 'gnnepoch': 120, 'lambda1': 0.65, 'lambda2': 6.282568254986576, 'loop': 0, 'loss': 'CE', 'lr': 0.0027403711438266135, 'softmaxF': False, 'useGCN': True, 'weight_decay': 0.0011039035938353087, 'weightedloss': True}. Best is trial 605 with value: 72.13333129882812.
/home/wxy/miniconda3/lib/python3.10/site-packages/optuna/distributions.py:685: UserWarning: The distribution is specified by [0, 1.00001] and step=0.05, but the range is not divisible by `step`. It will be replaced by [0, 1.0].
  warnings.warn(
K:  8
alpha:  0.75
lr:  0.0017454044868726738
weight_decay:  0.00034830572785583233
dropout:  0.1
fix split and run 3 times
Data: Data(x=[3327, 3703], y=[3327], train_mask=[3327], val_mask=[3327], test_mask=[3327], adj_t=[3327, 3327, nnz=9104])
num_train tensor(120)
num_noise 0
noise: tensor(0)
data feature 3703
ALTOPT(
  (lins): Sequential(
    (0): Linear(in_features=3703, out_features=64, bias=True)
    (1): BatchNorm1d(64, eps=1e-05, momentum=0.1, affine=True, track_running_stats=True)
    (2): Dropout(p=0.1, inplace=True)
    (3): ReLU(inplace=True)
    (4): Linear(in_features=64, out_features=6, bias=True)
    (5): LogSoftmax(dim=-1)
  )
  (prop): Propagation(K=8, mode=None, lambda1=None, lambda2=None, L21=True, alpha=0.75)
  (gcn): GCN(
    (convs): ModuleList(
      (0): GCNConv(3703, 64)
      (1): GCNConv(64, 6)
    )
    (bns): ModuleList(
      (0): BatchNorm1d(64, eps=1e-05, momentum=0.1, affine=True, track_running_stats=True)
    )
    (output): LogSoftmax(dim=-1)
  )
)
propagate done
init label
Split: 01, Run: 01
None time:  1.068485074909404
None Run 01:
Highest Train: 100.00
Highest Valid: 71.00
  Final Train: 100.00
   Final Test: 70.00
Split: 01, Run: 02
None time:  0.9851223120931536
None Run 02:
Highest Train: 100.00
Highest Valid: 70.80
  Final Train: 100.00
   Final Test: 69.00
Split: 01, Run: 03
None time:  1.1365406909026206
None Run 03:
Highest Train: 100.00
Highest Valid: 70.20
  Final Train: 100.00
   Final Test: 69.40
run time now: 3.2333505153656006
total time:  3.2870070319622755
None All runs:
Highest Train: 100.00 ± 0.00
Highest Valid: 70.67 ± 0.42
  Final Train: 100.00 ± 0.00
   Final Test: 69.47 ± 0.50
[I 2023-06-12 00:09:05,930] Trial 753 finished with value: 70.66666412353516 and parameters: {'Fwd': 0.0024286410208197986, 'K': 8, 'alpha': 0.75, 'dropout': 0.1, 'gnnepoch': 120, 'lambda1': 0.75, 'lambda2': 6.921159915834436, 'loop': 0, 'loss': 'CE', 'lr': 0.0017454044868726738, 'softmaxF': False, 'useGCN': True, 'weight_decay': 0.00034830572785583233, 'weightedloss': True}. Best is trial 605 with value: 72.13333129882812.
/home/wxy/miniconda3/lib/python3.10/site-packages/optuna/distributions.py:685: UserWarning: The distribution is specified by [0, 1.00001] and step=0.05, but the range is not divisible by `step`. It will be replaced by [0, 1.0].
  warnings.warn(
K:  8
alpha:  0.8
lr:  0.0011160981799105004
weight_decay:  2.2404586114086685e-05
dropout:  0.8
fix split and run 3 times
Data: Data(x=[3327, 3703], y=[3327], train_mask=[3327], val_mask=[3327], test_mask=[3327], adj_t=[3327, 3327, nnz=9104])
num_train tensor(120)
num_noise 0
noise: tensor(0)
data feature 3703
ALTOPT(
  (lins): Sequential(
    (0): Linear(in_features=3703, out_features=64, bias=True)
    (1): BatchNorm1d(64, eps=1e-05, momentum=0.1, affine=True, track_running_stats=True)
    (2): Dropout(p=0.8, inplace=True)
    (3): ReLU(inplace=True)
    (4): Linear(in_features=64, out_features=6, bias=True)
    (5): Identity()
  )
  (prop): Propagation(K=8, mode=None, lambda1=None, lambda2=None, L21=True, alpha=0.8)
  (gcn): GCN(
    (convs): ModuleList(
      (0): GCNConv(3703, 64)
      (1): GCNConv(64, 6)
    )
    (bns): ModuleList(
      (0): BatchNorm1d(64, eps=1e-05, momentum=0.1, affine=True, track_running_stats=True)
    )
    (output): Identity()
  )
)
propagate done
init label
Split: 01, Run: 01, Epoch: 100, Loss: 0.0000, Train: 100.00%, Valid: 70.60% Test: 69.60%
Split: 01, Run: 01
None time:  1.8108489329461008
None Run 01:
Highest Train: 100.00
Highest Valid: 70.60
  Final Train: 100.00
   Final Test: 69.60
Split: 01, Run: 02, Epoch: 100, Loss: 0.0000, Train: 100.00%, Valid: 70.60% Test: 69.70%
Split: 01, Run: 02
None time:  1.796197972027585
None Run 02:
Highest Train: 100.00
Highest Valid: 70.60
  Final Train: 100.00
   Final Test: 69.70
Split: 01, Run: 03, Epoch: 100, Loss: 0.0000, Train: 100.00%, Valid: 69.60% Test: 69.60%
Split: 01, Run: 03
None time:  1.724134923890233
None Run 03:
Highest Train: 100.00
Highest Valid: 69.60
  Final Train: 100.00
   Final Test: 69.60
run time now: 5.378519773483276
total time:  5.429017504910007
None All runs:
Highest Train: 100.00 ± 0.00
Highest Valid: 70.27 ± 0.58
  Final Train: 100.00 ± 0.00
   Final Test: 69.63 ± 0.06
[I 2023-06-12 00:09:11,993] Trial 754 finished with value: 70.26666259765625 and parameters: {'Fwd': 0.000807591554818508, 'K': 8, 'alpha': 0.8, 'dropout': 0.8, 'gnnepoch': 120, 'lambda1': 0.7000000000000001, 'lambda2': 3.3993902370906524, 'loop': 0, 'loss': 'MSE', 'lr': 0.0011160981799105004, 'softmaxF': False, 'useGCN': True, 'weight_decay': 2.2404586114086685e-05, 'weightedloss': True}. Best is trial 605 with value: 72.13333129882812.
/home/wxy/miniconda3/lib/python3.10/site-packages/optuna/distributions.py:685: UserWarning: The distribution is specified by [0, 1.00001] and step=0.05, but the range is not divisible by `step`. It will be replaced by [0, 1.0].
  warnings.warn(
K:  8
alpha:  0.4
lr:  0.0046057252328973244
weight_decay:  4.764606247063216e-06
dropout:  0.8
fix split and run 3 times
Data: Data(x=[3327, 3703], y=[3327], train_mask=[3327], val_mask=[3327], test_mask=[3327], adj_t=[3327, 3327, nnz=9104])
num_train tensor(120)
num_noise 0
noise: tensor(0)
data feature 3703
ALTOPT(
  (lins): Sequential(
    (0): Linear(in_features=3703, out_features=64, bias=True)
    (1): BatchNorm1d(64, eps=1e-05, momentum=0.1, affine=True, track_running_stats=True)
    (2): Dropout(p=0.8, inplace=True)
    (3): ReLU(inplace=True)
    (4): Linear(in_features=64, out_features=6, bias=True)
    (5): LogSoftmax(dim=-1)
  )
  (prop): Propagation(K=8, mode=None, lambda1=None, lambda2=None, L21=True, alpha=0.4)
  (gcn): GCN(
    (convs): ModuleList(
      (0): GCNConv(3703, 64)
      (1): GCNConv(64, 6)
    )
    (bns): ModuleList(
      (0): BatchNorm1d(64, eps=1e-05, momentum=0.1, affine=True, track_running_stats=True)
    )
    (output): LogSoftmax(dim=-1)
  )
)
propagate done
init label
Split: 01, Run: 01
None time:  1.0408222479745746
None Run 01:
Highest Train: 100.00
Highest Valid: 70.60
  Final Train: 99.17
   Final Test: 70.10
Split: 01, Run: 02
None time:  1.035429532872513
None Run 02:
Highest Train: 100.00
Highest Valid: 70.40
  Final Train: 99.17
   Final Test: 70.30
Split: 01, Run: 03
None time:  1.1085212170146406
None Run 03:
Highest Train: 100.00
Highest Valid: 70.80
  Final Train: 100.00
   Final Test: 69.40
run time now: 3.2262306213378906
total time:  3.273288605036214
None All runs:
Highest Train: 100.00 ± 0.00
Highest Valid: 70.60 ± 0.20
  Final Train: 99.44 ± 0.48
   Final Test: 69.93 ± 0.47
