[I 2023-06-12 00:39:21,904] Trial 287 finished with value: 76.80000305175781 and parameters: {'Fwd': 9.290892944724385e-06, 'K': 10, 'alpha': 0.65, 'dropout': 0.9, 'gnnepoch': 60, 'lambda1': 0.8, 'lambda2': 6.205873723469912, 'loop': 1, 'loss': 'MSE', 'lr': 0.0032948481031062505, 'softmaxF': False, 'useGCN': False, 'weight_decay': 0.016829267158036915, 'weightedloss': False}. Best is trial 205 with value: 83.53333282470703.
/home/wxy/miniconda3/lib/python3.10/site-packages/optuna/distributions.py:685: UserWarning: The distribution is specified by [0, 1.00001] and step=0.05, but the range is not divisible by `step`. It will be replaced by [0, 1.0].
  warnings.warn(
K:  10
alpha:  0.9
lr:  0.0026245421139836256
weight_decay:  0.007391400250006614
dropout:  0.9
fix split and run 3 times
Data: Data(x=[19717, 500], y=[19717], train_mask=[19717], val_mask=[19717], test_mask=[19717], adj_t=[19717, 19717, nnz=88648])
num_train tensor(60)
num_noise 0
noise: tensor(0)
data feature 500
ALTOPT(
  (lins): Sequential(
    (0): Linear(in_features=500, out_features=64, bias=True)
    (1): BatchNorm1d(64, eps=1e-05, momentum=0.1, affine=True, track_running_stats=True)
    (2): Dropout(p=0.9, inplace=True)
    (3): ReLU(inplace=True)
    (4): Linear(in_features=64, out_features=3, bias=True)
    (5): Identity()
  )
  (prop): Propagation(K=10, mode=None, lambda1=None, lambda2=None, L21=True, alpha=0.9)
  (gcn): GCN(
    (convs): ModuleList(
      (0): GCNConv(500, 64)
      (1): GCNConv(64, 3)
    )
    (bns): ModuleList(
      (0): BatchNorm1d(64, eps=1e-05, momentum=0.1, affine=True, track_running_stats=True)
    )
    (output): Identity()
  )
)
propagate done
init label
Split: 01, Run: 01, Epoch: 100, Loss: 0.3933, Train: 100.00%, Valid: 80.80% Test: 76.80%
Split: 01, Run: 01
None time:  3.3925626210402697
None Run 01:
Highest Train: 100.00
Highest Valid: 80.80
  Final Train: 100.00
   Final Test: 76.60
Split: 01, Run: 02
None time:  1.3149388611782342
None Run 02:
Highest Train: 100.00
Highest Valid: 84.00
  Final Train: 100.00
   Final Test: 79.90
Split: 01, Run: 03
None time:  1.1187270579393953
None Run 03:
Highest Train: 100.00
Highest Valid: 83.00
  Final Train: 100.00
   Final Test: 79.30
run time now: 5.875313758850098
total time:  5.928580274805427
None All runs:
Highest Train: 100.00 ± 0.00
Highest Valid: 82.60 ± 1.64
  Final Train: 100.00 ± 0.00
   Final Test: 78.60 ± 1.76
[I 2023-06-12 00:39:28,459] Trial 288 finished with value: 82.5999984741211 and parameters: {'Fwd': 6.997117183574018e-06, 'K': 10, 'alpha': 0.9, 'dropout': 0.9, 'gnnepoch': 60, 'lambda1': 0.8500000000000001, 'lambda2': 5.673500774329588, 'loop': 1, 'loss': 'MSE', 'lr': 0.0026245421139836256, 'softmaxF': True, 'useGCN': False, 'weight_decay': 0.007391400250006614, 'weightedloss': False}. Best is trial 205 with value: 83.53333282470703.
/home/wxy/miniconda3/lib/python3.10/site-packages/optuna/distributions.py:685: UserWarning: The distribution is specified by [0, 1.00001] and step=0.05, but the range is not divisible by `step`. It will be replaced by [0, 1.0].
  warnings.warn(
K:  10
alpha:  0.8500000000000001
lr:  0.0030871884283080343
weight_decay:  0.013212263689829208
dropout:  0.9
fix split and run 3 times
Data: Data(x=[19717, 500], y=[19717], train_mask=[19717], val_mask=[19717], test_mask=[19717], adj_t=[19717, 19717, nnz=88648])
num_train tensor(60)
num_noise 0
noise: tensor(0)
data feature 500
ALTOPT(
  (lins): Sequential(
    (0): Linear(in_features=500, out_features=64, bias=True)
    (1): BatchNorm1d(64, eps=1e-05, momentum=0.1, affine=True, track_running_stats=True)
    (2): Dropout(p=0.9, inplace=True)
    (3): ReLU(inplace=True)
    (4): Linear(in_features=64, out_features=3, bias=True)
    (5): Identity()
  )
  (prop): Propagation(K=10, mode=None, lambda1=None, lambda2=None, L21=True, alpha=0.8500000000000001)
  (gcn): GCN(
    (convs): ModuleList(
      (0): GCNConv(500, 64)
      (1): GCNConv(64, 3)
    )
    (bns): ModuleList(
      (0): BatchNorm1d(64, eps=1e-05, momentum=0.1, affine=True, track_running_stats=True)
    )
    (output): Identity()
  )
)
propagate done
init label
Split: 01, Run: 01
None time:  1.5444944759365171
None Run 01:
Highest Train: 100.00
Highest Valid: 77.40
  Final Train: 100.00
   Final Test: 75.40
Split: 01, Run: 02
None time:  4.182178983930498
None Run 02:
Highest Train: 100.00
Highest Valid: 77.00
  Final Train: 100.00
   Final Test: 75.20
Split: 01, Run: 03
None time:  1.6963707371614873
None Run 03:
Highest Train: 100.00
Highest Valid: 76.20
  Final Train: 100.00
   Final Test: 73.70
run time now: 7.472147464752197
total time:  7.516469571972266
None All runs:
Highest Train: 100.00 ± 0.00
Highest Valid: 76.87 ± 0.61
  Final Train: 100.00 ± 0.00
   Final Test: 74.77 ± 0.93
[I 2023-06-12 00:39:36,469] Trial 289 finished with value: 76.86666870117188 and parameters: {'Fwd': 5.072308508348065e-06, 'K': 10, 'alpha': 0.8500000000000001, 'dropout': 0.9, 'gnnepoch': 60, 'lambda1': 0.8, 'lambda2': 5.946637218602978, 'loop': 1, 'loss': 'MSE', 'lr': 0.0030871884283080343, 'softmaxF': True, 'useGCN': True, 'weight_decay': 0.013212263689829208, 'weightedloss': False}. Best is trial 205 with value: 83.53333282470703.
/home/wxy/miniconda3/lib/python3.10/site-packages/optuna/distributions.py:685: UserWarning: The distribution is specified by [0, 1.00001] and step=0.05, but the range is not divisible by `step`. It will be replaced by [0, 1.0].
  warnings.warn(
K:  10
alpha:  0.9500000000000001
lr:  0.005113652162419992
weight_decay:  0.026087233919023345
dropout:  0.9
fix split and run 3 times
Data: Data(x=[19717, 500], y=[19717], train_mask=[19717], val_mask=[19717], test_mask=[19717], adj_t=[19717, 19717, nnz=88648])
num_train tensor(60)
num_noise 0
noise: tensor(0)
data feature 500
ALTOPT(
  (lins): Sequential(
    (0): Linear(in_features=500, out_features=64, bias=True)
    (1): BatchNorm1d(64, eps=1e-05, momentum=0.1, affine=True, track_running_stats=True)
    (2): Dropout(p=0.9, inplace=True)
    (3): ReLU(inplace=True)
    (4): Linear(in_features=64, out_features=3, bias=True)
    (5): Identity()
  )
  (prop): Propagation(K=10, mode=None, lambda1=None, lambda2=None, L21=True, alpha=0.9500000000000001)
  (gcn): GCN(
    (convs): ModuleList(
      (0): GCNConv(500, 64)
      (1): GCNConv(64, 3)
    )
    (bns): ModuleList(
      (0): BatchNorm1d(64, eps=1e-05, momentum=0.1, affine=True, track_running_stats=True)
    )
    (output): Identity()
  )
)
propagate done
init label
Split: 01, Run: 01
None time:  2.2896705789025873
None Run 01:
Highest Train: 100.00
Highest Valid: 81.00
  Final Train: 100.00
   Final Test: 76.80
Split: 01, Run: 02
None time:  0.8898076058831066
None Run 02:
Highest Train: 100.00
Highest Valid: 82.20
  Final Train: 100.00
   Final Test: 79.00
Split: 01, Run: 03
None time:  2.1346135060302913
None Run 03:
Highest Train: 100.00
Highest Valid: 82.20
  Final Train: 100.00
   Final Test: 78.90
run time now: 5.36755633354187
total time:  5.418825255939737
None All runs:
Highest Train: 100.00 ± 0.00
Highest Valid: 81.80 ± 0.69
  Final Train: 100.00 ± 0.00
   Final Test: 78.23 ± 1.24
[I 2023-06-12 00:39:42,440] Trial 290 finished with value: 81.80001068115234 and parameters: {'Fwd': 1.27215734380271e-05, 'K': 10, 'alpha': 0.9500000000000001, 'dropout': 0.9, 'gnnepoch': 60, 'lambda1': 0.8500000000000001, 'lambda2': 5.31908333794697, 'loop': 1, 'loss': 'MSE', 'lr': 0.005113652162419992, 'softmaxF': True, 'useGCN': False, 'weight_decay': 0.026087233919023345, 'weightedloss': False}. Best is trial 205 with value: 83.53333282470703.
/home/wxy/miniconda3/lib/python3.10/site-packages/optuna/distributions.py:685: UserWarning: The distribution is specified by [0, 1.00001] and step=0.05, but the range is not divisible by `step`. It will be replaced by [0, 1.0].
  warnings.warn(
K:  10
alpha:  0.9
lr:  0.0022351807724223923
weight_decay:  0.0052561945491641756
dropout:  0.9
fix split and run 3 times
Data: Data(x=[19717, 500], y=[19717], train_mask=[19717], val_mask=[19717], test_mask=[19717], adj_t=[19717, 19717, nnz=88648])
num_train tensor(60)
num_noise 0
noise: tensor(0)
data feature 500
ALTOPT(
  (lins): Sequential(
    (0): Linear(in_features=500, out_features=64, bias=True)
    (1): BatchNorm1d(64, eps=1e-05, momentum=0.1, affine=True, track_running_stats=True)
    (2): Dropout(p=0.9, inplace=True)
    (3): ReLU(inplace=True)
    (4): Linear(in_features=64, out_features=3, bias=True)
    (5): Identity()
  )
  (prop): Propagation(K=10, mode=None, lambda1=None, lambda2=None, L21=True, alpha=0.9)
  (gcn): GCN(
    (convs): ModuleList(
      (0): GCNConv(500, 64)
      (1): GCNConv(64, 3)
    )
    (bns): ModuleList(
      (0): BatchNorm1d(64, eps=1e-05, momentum=0.1, affine=True, track_running_stats=True)
    )
    (output): Identity()
  )
)
propagate done
init label
Split: 01, Run: 01
None time:  2.4576634629629552
None Run 01:
Highest Train: 100.00
Highest Valid: 79.40
  Final Train: 100.00
   Final Test: 75.60
Split: 01, Run: 02
None time:  1.5621645841747522
None Run 02:
Highest Train: 100.00
Highest Valid: 83.80
  Final Train: 100.00
   Final Test: 78.60
Split: 01, Run: 03
None time:  1.2734368271194398
None Run 03:
Highest Train: 100.00
Highest Valid: 83.60
  Final Train: 100.00
   Final Test: 79.60
run time now: 5.341364145278931
total time:  5.387623895891011
None All runs:
Highest Train: 100.00 ± 0.00
Highest Valid: 82.27 ± 2.48
  Final Train: 100.00 ± 0.00
   Final Test: 77.93 ± 2.08
[I 2023-06-12 00:39:48,282] Trial 291 finished with value: 82.26667022705078 and parameters: {'Fwd': 1.7842750544479854e-05, 'K': 10, 'alpha': 0.9, 'dropout': 0.9, 'gnnepoch': 60, 'lambda1': 0.75, 'lambda2': 5.533416950555383, 'loop': 1, 'loss': 'MSE', 'lr': 0.0022351807724223923, 'softmaxF': True, 'useGCN': False, 'weight_decay': 0.0052561945491641756, 'weightedloss': False}. Best is trial 205 with value: 83.53333282470703.
/home/wxy/miniconda3/lib/python3.10/site-packages/optuna/distributions.py:685: UserWarning: The distribution is specified by [0, 1.00001] and step=0.05, but the range is not divisible by `step`. It will be replaced by [0, 1.0].
  warnings.warn(
K:  10
alpha:  1.0
lr:  0.004334153951697736
weight_decay:  0.00955194424528378
dropout:  0.9
fix split and run 3 times
Data: Data(x=[19717, 500], y=[19717], train_mask=[19717], val_mask=[19717], test_mask=[19717], adj_t=[19717, 19717, nnz=88648])
num_train tensor(60)
num_noise 0
noise: tensor(0)
data feature 500
ALTOPT(
  (lins): Sequential(
    (0): Linear(in_features=500, out_features=64, bias=True)
    (1): BatchNorm1d(64, eps=1e-05, momentum=0.1, affine=True, track_running_stats=True)
    (2): Dropout(p=0.9, inplace=True)
    (3): ReLU(inplace=True)
    (4): Linear(in_features=64, out_features=3, bias=True)
    (5): Identity()
  )
  (prop): Propagation(K=10, mode=None, lambda1=None, lambda2=None, L21=True, alpha=1.0)
  (gcn): GCN(
    (convs): ModuleList(
      (0): GCNConv(500, 64)
      (1): GCNConv(64, 3)
    )
    (bns): ModuleList(
      (0): BatchNorm1d(64, eps=1e-05, momentum=0.1, affine=True, track_running_stats=True)
    )
    (output): Identity()
  )
)
propagate done
init label
Split: 01, Run: 01
None time:  1.6514186339918524
None Run 01:
Highest Train: 100.00
Highest Valid: 80.80
  Final Train: 100.00
   Final Test: 75.80
Split: 01, Run: 02
None time:  1.2415971751324832
None Run 02:
Highest Train: 100.00
Highest Valid: 82.20
  Final Train: 100.00
   Final Test: 79.10
Split: 01, Run: 03
None time:  1.205688341986388
None Run 03:
Highest Train: 100.00
Highest Valid: 82.60
  Final Train: 100.00
   Final Test: 78.80
run time now: 4.148005962371826
total time:  4.190073875011876
None All runs:
Highest Train: 100.00 ± 0.00
Highest Valid: 81.87 ± 0.95
  Final Train: 100.00 ± 0.00
   Final Test: 77.90 ± 1.82
[I 2023-06-12 00:39:52,949] Trial 292 finished with value: 81.86666870117188 and parameters: {'Fwd': 3.4967163765413896e-06, 'K': 10, 'alpha': 1.0, 'dropout': 0.9, 'gnnepoch': 60, 'lambda1': 0.9, 'lambda2': 5.815492498529515, 'loop': 1, 'loss': 'MSE', 'lr': 0.004334153951697736, 'softmaxF': True, 'useGCN': False, 'weight_decay': 0.00955194424528378, 'weightedloss': False}. Best is trial 205 with value: 83.53333282470703.
/home/wxy/miniconda3/lib/python3.10/site-packages/optuna/distributions.py:685: UserWarning: The distribution is specified by [0, 1.00001] and step=0.05, but the range is not divisible by `step`. It will be replaced by [0, 1.0].
  warnings.warn(
K:  10
alpha:  0.9500000000000001
lr:  0.002750900194644495
weight_decay:  0.01825835064088199
dropout:  0.9
fix split and run 3 times
Data: Data(x=[19717, 500], y=[19717], train_mask=[19717], val_mask=[19717], test_mask=[19717], adj_t=[19717, 19717, nnz=88648])
num_train tensor(60)
num_noise 0
noise: tensor(0)
data feature 500
ALTOPT(
  (lins): Sequential(
    (0): Linear(in_features=500, out_features=64, bias=True)
    (1): BatchNorm1d(64, eps=1e-05, momentum=0.1, affine=True, track_running_stats=True)
    (2): Dropout(p=0.9, inplace=True)
    (3): ReLU(inplace=True)
    (4): Linear(in_features=64, out_features=3, bias=True)
    (5): Identity()
  )
  (prop): Propagation(K=10, mode=None, lambda1=None, lambda2=None, L21=True, alpha=0.9500000000000001)
  (gcn): GCN(
    (convs): ModuleList(
      (0): GCNConv(500, 64)
      (1): GCNConv(64, 3)
    )
    (bns): ModuleList(
      (0): BatchNorm1d(64, eps=1e-05, momentum=0.1, affine=True, track_running_stats=True)
    )
    (output): Identity()
  )
)
propagate done
init label
Split: 01, Run: 01
None time:  0.792394916061312
None Run 01:
Highest Train: 100.00
Highest Valid: 69.40
  Final Train: 100.00
   Final Test: 69.20
Split: 01, Run: 02
None time:  1.5163149358704686
None Run 02:
Highest Train: 100.00
Highest Valid: 83.60
  Final Train: 100.00
   Final Test: 79.00
Split: 01, Run: 03
None time:  0.9221934119705111
None Run 03:
Highest Train: 100.00
Highest Valid: 82.00
  Final Train: 100.00
   Final Test: 78.90
run time now: 3.276111125946045
total time:  3.3163577790837735
None All runs:
Highest Train: 100.00 ± 0.00
Highest Valid: 78.33 ± 7.78
  Final Train: 100.00 ± 0.00
   Final Test: 75.70 ± 5.63
[I 2023-06-12 00:39:56,904] Trial 293 finished with value: 78.33333587646484 and parameters: {'Fwd': 6.177332064135484e-06, 'K': 10, 'alpha': 0.9500000000000001, 'dropout': 0.9, 'gnnepoch': 50, 'lambda1': 0.8, 'lambda2': 5.22238309765317, 'loop': 1, 'loss': 'MSE', 'lr': 0.002750900194644495, 'softmaxF': False, 'useGCN': False, 'weight_decay': 0.01825835064088199, 'weightedloss': False}. Best is trial 205 with value: 83.53333282470703.
/home/wxy/miniconda3/lib/python3.10/site-packages/optuna/distributions.py:685: UserWarning: The distribution is specified by [0, 1.00001] and step=0.05, but the range is not divisible by `step`. It will be replaced by [0, 1.0].
  warnings.warn(
K:  10
alpha:  0.9500000000000001
lr:  0.002439186835451642
weight_decay:  0.007184822661832202
dropout:  0.9
fix split and run 3 times
Data: Data(x=[19717, 500], y=[19717], train_mask=[19717], val_mask=[19717], test_mask=[19717], adj_t=[19717, 19717, nnz=88648])
num_train tensor(60)
num_noise 0
noise: tensor(0)
data feature 500
ALTOPT(
  (lins): Sequential(
    (0): Linear(in_features=500, out_features=64, bias=True)
    (1): BatchNorm1d(64, eps=1e-05, momentum=0.1, affine=True, track_running_stats=True)
    (2): Dropout(p=0.9, inplace=True)
    (3): ReLU(inplace=True)
    (4): Linear(in_features=64, out_features=3, bias=True)
    (5): Identity()
  )
  (prop): Propagation(K=10, mode=None, lambda1=None, lambda2=None, L21=True, alpha=0.9500000000000001)
  (gcn): GCN(
    (convs): ModuleList(
      (0): GCNConv(500, 64)
      (1): GCNConv(64, 3)
    )
    (bns): ModuleList(
      (0): BatchNorm1d(64, eps=1e-05, momentum=0.1, affine=True, track_running_stats=True)
    )
    (output): Identity()
  )
)
propagate done
init label
Split: 01, Run: 01
None time:  2.3297560829669237
None Run 01:
Highest Train: 100.00
Highest Valid: 82.00
  Final Train: 100.00
   Final Test: 77.40
Split: 01, Run: 02
None time:  2.198309801053256
None Run 02:
Highest Train: 100.00
Highest Valid: 82.20
  Final Train: 100.00
   Final Test: 79.00
Split: 01, Run: 03
None time:  1.1377864321693778
None Run 03:
Highest Train: 100.00
Highest Valid: 83.20
  Final Train: 100.00
   Final Test: 80.20
run time now: 5.73710036277771
total time:  5.786391098052263
None All runs:
Highest Train: 100.00 ± 0.00
Highest Valid: 82.47 ± 0.64
  Final Train: 100.00 ± 0.00
   Final Test: 78.87 ± 1.40
[I 2023-06-12 00:40:03,144] Trial 294 finished with value: 82.4666748046875 and parameters: {'Fwd': 4.363058337539995e-06, 'K': 10, 'alpha': 0.9500000000000001, 'dropout': 0.9, 'gnnepoch': 60, 'lambda1': 0.8500000000000001, 'lambda2': 6.1669098283219, 'loop': 1, 'loss': 'MSE', 'lr': 0.002439186835451642, 'softmaxF': True, 'useGCN': False, 'weight_decay': 0.007184822661832202, 'weightedloss': False}. Best is trial 205 with value: 83.53333282470703.
/home/wxy/miniconda3/lib/python3.10/site-packages/optuna/distributions.py:685: UserWarning: The distribution is specified by [0, 1.00001] and step=0.05, but the range is not divisible by `step`. It will be replaced by [0, 1.0].
  warnings.warn(
K:  10
alpha:  0.15000000000000002
lr:  0.0029156651523198226
weight_decay:  4.691959626542533e-06
dropout:  0.8
fix split and run 3 times
Data: Data(x=[19717, 500], y=[19717], train_mask=[19717], val_mask=[19717], test_mask=[19717], adj_t=[19717, 19717, nnz=88648])
num_train tensor(60)
num_noise 0
noise: tensor(0)
data feature 500
ALTOPT(
  (lins): Sequential(
    (0): Linear(in_features=500, out_features=64, bias=True)
    (1): BatchNorm1d(64, eps=1e-05, momentum=0.1, affine=True, track_running_stats=True)
    (2): Dropout(p=0.8, inplace=True)
    (3): ReLU(inplace=True)
    (4): Linear(in_features=64, out_features=3, bias=True)
    (5): Identity()
  )
  (prop): Propagation(K=10, mode=None, lambda1=None, lambda2=None, L21=True, alpha=0.15000000000000002)
  (gcn): GCN(
    (convs): ModuleList(
      (0): GCNConv(500, 64)
      (1): GCNConv(64, 3)
    )
    (bns): ModuleList(
      (0): BatchNorm1d(64, eps=1e-05, momentum=0.1, affine=True, track_running_stats=True)
    )
    (output): Identity()
  )
)
propagate done
init label
Split: 01, Run: 01
None time:  1.598903245991096
None Run 01:
Highest Train: 100.00
Highest Valid: 75.60
  Final Train: 100.00
   Final Test: 73.70
Split: 01, Run: 02
None time:  1.02257135999389
None Run 02:
Highest Train: 100.00
Highest Valid: 74.20
  Final Train: 100.00
   Final Test: 73.70
Split: 01, Run: 03
None time:  1.3352685368154198
None Run 03:
Highest Train: 100.00
Highest Valid: 75.80
  Final Train: 100.00
   Final Test: 73.90
run time now: 4.009702444076538
total time:  4.061204104917124
None All runs:
Highest Train: 100.00 ± 0.00
Highest Valid: 75.20 ± 0.87
  Final Train: 100.00 ± 0.00
   Final Test: 73.77 ± 0.12
[I 2023-06-12 00:40:07,678] Trial 295 finished with value: 75.19999694824219 and parameters: {'Fwd': 8.947316793654485e-06, 'K': 10, 'alpha': 0.15000000000000002, 'dropout': 0.8, 'gnnepoch': 60, 'lambda1': 0.75, 'lambda2': 5.646283734248861, 'loop': 1, 'loss': 'MSE', 'lr': 0.0029156651523198226, 'softmaxF': True, 'useGCN': False, 'weight_decay': 4.691959626542533e-06, 'weightedloss': False}. Best is trial 205 with value: 83.53333282470703.
/home/wxy/miniconda3/lib/python3.10/site-packages/optuna/distributions.py:685: UserWarning: The distribution is specified by [0, 1.00001] and step=0.05, but the range is not divisible by `step`. It will be replaced by [0, 1.0].
  warnings.warn(
K:  10
alpha:  1.0
lr:  0.0032468286763150307
weight_decay:  0.03304162973774996
dropout:  0.9
fix split and run 3 times
Data: Data(x=[19717, 500], y=[19717], train_mask=[19717], val_mask=[19717], test_mask=[19717], adj_t=[19717, 19717, nnz=88648])
num_train tensor(60)
num_noise 0
noise: tensor(0)
data feature 500
ALTOPT(
  (lins): Sequential(
    (0): Linear(in_features=500, out_features=64, bias=True)
    (1): BatchNorm1d(64, eps=1e-05, momentum=0.1, affine=True, track_running_stats=True)
    (2): Dropout(p=0.9, inplace=True)
    (3): ReLU(inplace=True)
    (4): Linear(in_features=64, out_features=3, bias=True)
    (5): Identity()
  )
  (prop): Propagation(K=10, mode=None, lambda1=None, lambda2=None, L21=True, alpha=1.0)
  (gcn): GCN(
    (convs): ModuleList(
      (0): GCNConv(500, 64)
      (1): GCNConv(64, 3)
    )
    (bns): ModuleList(
      (0): BatchNorm1d(64, eps=1e-05, momentum=0.1, affine=True, track_running_stats=True)
    )
    (output): Identity()
  )
)
propagate done
init label
Split: 01, Run: 01
None time:  2.0726589797995985
None Run 01:
Highest Train: 100.00
Highest Valid: 80.60
  Final Train: 100.00
   Final Test: 75.70
Split: 01, Run: 02
None time:  3.2868813341483474
None Run 02:
Highest Train: 100.00
Highest Valid: 80.60
  Final Train: 100.00
   Final Test: 79.30
Split: 01, Run: 03
None time:  0.8808056209236383
None Run 03:
Highest Train: 100.00
Highest Valid: 82.40
  Final Train: 100.00
   Final Test: 79.80
run time now: 6.289384365081787
total time:  6.340029509039596
None All runs:
Highest Train: 100.00 ± 0.00
Highest Valid: 81.20 ± 1.04
  Final Train: 100.00 ± 0.00
   Final Test: 78.27 ± 2.24
