[I 2023-06-12 00:43:34,337] Trial 332 finished with value: 82.66666412353516 and parameters: {'Fwd': 4.847509827857863e-06, 'K': 10, 'alpha': 0.9500000000000001, 'dropout': 0.9, 'gnnepoch': 60, 'lambda1': 0.8, 'lambda2': 4.56412186145284, 'loop': 1, 'loss': 'MSE', 'lr': 0.002585599024770964, 'softmaxF': True, 'useGCN': False, 'weight_decay': 0.007930862449587475, 'weightedloss': False}. Best is trial 205 with value: 83.53333282470703.
/home/wxy/miniconda3/lib/python3.10/site-packages/optuna/distributions.py:685: UserWarning: The distribution is specified by [0, 1.00001] and step=0.05, but the range is not divisible by `step`. It will be replaced by [0, 1.0].
  warnings.warn(
K:  10
alpha:  0.9
lr:  0.0030479138076445374
weight_decay:  0.020236388697526014
dropout:  0.8
fix split and run 3 times
Data: Data(x=[19717, 500], y=[19717], train_mask=[19717], val_mask=[19717], test_mask=[19717], adj_t=[19717, 19717, nnz=88648])
num_train tensor(60)
num_noise 0
noise: tensor(0)
data feature 500
ALTOPT(
  (lins): Sequential(
    (0): Linear(in_features=500, out_features=64, bias=True)
    (1): BatchNorm1d(64, eps=1e-05, momentum=0.1, affine=True, track_running_stats=True)
    (2): Dropout(p=0.8, inplace=True)
    (3): ReLU(inplace=True)
    (4): Linear(in_features=64, out_features=3, bias=True)
    (5): Identity()
  )
  (prop): Propagation(K=10, mode=None, lambda1=None, lambda2=None, L21=True, alpha=0.9)
  (gcn): GCN(
    (convs): ModuleList(
      (0): GCNConv(500, 64)
      (1): GCNConv(64, 3)
    )
    (bns): ModuleList(
      (0): BatchNorm1d(64, eps=1e-05, momentum=0.1, affine=True, track_running_stats=True)
    )
    (output): Identity()
  )
)
propagate done
init label
Split: 01, Run: 01
None time:  2.897751570912078
None Run 01:
Highest Train: 100.00
Highest Valid: 82.60
  Final Train: 100.00
   Final Test: 78.90
Split: 01, Run: 02
None time:  1.329164681956172
None Run 02:
Highest Train: 100.00
Highest Valid: 82.20
  Final Train: 100.00
   Final Test: 79.10
Split: 01, Run: 03
None time:  2.0113485609181225
None Run 03:
Highest Train: 100.00
Highest Valid: 81.40
  Final Train: 100.00
   Final Test: 78.10
run time now: 6.296680450439453
total time:  6.359781559091061
None All runs:
Highest Train: 100.00 ± 0.00
Highest Valid: 82.07 ± 0.61
  Final Train: 100.00 ± 0.00
   Final Test: 78.70 ± 0.53
[I 2023-06-12 00:43:41,321] Trial 333 finished with value: 82.0666732788086 and parameters: {'Fwd': 6.301141006022861e-06, 'K': 10, 'alpha': 0.9, 'dropout': 0.8, 'gnnepoch': 60, 'lambda1': 0.75, 'lambda2': 6.435226865518278, 'loop': 1, 'loss': 'MSE', 'lr': 0.0030479138076445374, 'softmaxF': True, 'useGCN': False, 'weight_decay': 0.020236388697526014, 'weightedloss': False}. Best is trial 205 with value: 83.53333282470703.
/home/wxy/miniconda3/lib/python3.10/site-packages/optuna/distributions.py:685: UserWarning: The distribution is specified by [0, 1.00001] and step=0.05, but the range is not divisible by `step`. It will be replaced by [0, 1.0].
  warnings.warn(
K:  10
alpha:  1.0
lr:  0.0034734556371333156
weight_decay:  0.015253343475432125
dropout:  0.9
fix split and run 3 times
Data: Data(x=[19717, 500], y=[19717], train_mask=[19717], val_mask=[19717], test_mask=[19717], adj_t=[19717, 19717, nnz=88648])
num_train tensor(60)
num_noise 0
noise: tensor(0)
data feature 500
ALTOPT(
  (lins): Sequential(
    (0): Linear(in_features=500, out_features=64, bias=True)
    (1): BatchNorm1d(64, eps=1e-05, momentum=0.1, affine=True, track_running_stats=True)
    (2): Dropout(p=0.9, inplace=True)
    (3): ReLU(inplace=True)
    (4): Linear(in_features=64, out_features=3, bias=True)
    (5): Identity()
  )
  (prop): Propagation(K=10, mode=None, lambda1=None, lambda2=None, L21=True, alpha=1.0)
  (gcn): GCN(
    (convs): ModuleList(
      (0): GCNConv(500, 64)
      (1): GCNConv(64, 3)
    )
    (bns): ModuleList(
      (0): BatchNorm1d(64, eps=1e-05, momentum=0.1, affine=True, track_running_stats=True)
    )
    (output): Identity()
  )
)
propagate done
init label
Split: 01, Run: 01
None time:  2.1429842840880156
None Run 01:
Highest Train: 100.00
Highest Valid: 82.00
  Final Train: 100.00
   Final Test: 78.40
Split: 01, Run: 02
None time:  2.9309004929382354
None Run 02:
Highest Train: 100.00
Highest Valid: 82.00
  Final Train: 100.00
   Final Test: 79.30
Split: 01, Run: 03
None time:  1.368462173966691
None Run 03:
Highest Train: 100.00
Highest Valid: 81.40
  Final Train: 100.00
   Final Test: 79.50
run time now: 6.4917755126953125
total time:  6.577558520017192
None All runs:
Highest Train: 100.00 ± 0.00
Highest Valid: 81.80 ± 0.35
  Final Train: 100.00 ± 0.00
   Final Test: 79.07 ± 0.59
[I 2023-06-12 00:43:48,456] Trial 334 finished with value: 81.79999542236328 and parameters: {'Fwd': 4.6671591294165135e-05, 'K': 10, 'alpha': 1.0, 'dropout': 0.9, 'gnnepoch': 70, 'lambda1': 0.65, 'lambda2': 5.255153283473648, 'loop': 1, 'loss': 'MSE', 'lr': 0.0034734556371333156, 'softmaxF': False, 'useGCN': False, 'weight_decay': 0.015253343475432125, 'weightedloss': False}. Best is trial 205 with value: 83.53333282470703.
/home/wxy/miniconda3/lib/python3.10/site-packages/optuna/distributions.py:685: UserWarning: The distribution is specified by [0, 1.00001] and step=0.05, but the range is not divisible by `step`. It will be replaced by [0, 1.0].
  warnings.warn(
K:  10
alpha:  0.9500000000000001
lr:  0.00213699347235661
weight_decay:  0.0404815663954695
dropout:  0.9
fix split and run 3 times
Data: Data(x=[19717, 500], y=[19717], train_mask=[19717], val_mask=[19717], test_mask=[19717], adj_t=[19717, 19717, nnz=88648])
num_train tensor(60)
num_noise 0
noise: tensor(0)
data feature 500
ALTOPT(
  (lins): Sequential(
    (0): Linear(in_features=500, out_features=64, bias=True)
    (1): BatchNorm1d(64, eps=1e-05, momentum=0.1, affine=True, track_running_stats=True)
    (2): Dropout(p=0.9, inplace=True)
    (3): ReLU(inplace=True)
    (4): Linear(in_features=64, out_features=3, bias=True)
    (5): Identity()
  )
  (prop): Propagation(K=10, mode=None, lambda1=None, lambda2=None, L21=True, alpha=0.9500000000000001)
  (gcn): GCN(
    (convs): ModuleList(
      (0): GCNConv(500, 64)
      (1): GCNConv(64, 3)
    )
    (bns): ModuleList(
      (0): BatchNorm1d(64, eps=1e-05, momentum=0.1, affine=True, track_running_stats=True)
    )
    (output): Identity()
  )
)
propagate done
init label
Split: 01, Run: 01
None time:  2.1461454948876053
None Run 01:
Highest Train: 100.00
Highest Valid: 81.80
  Final Train: 100.00
   Final Test: 78.00
Split: 01, Run: 02
None time:  2.8728311378508806
None Run 02:
Highest Train: 100.00
Highest Valid: 82.80
  Final Train: 100.00
   Final Test: 80.90
Split: 01, Run: 03
None time:  1.0206014879513532
None Run 03:
Highest Train: 100.00
Highest Valid: 84.20
  Final Train: 100.00
   Final Test: 79.60
run time now: 6.085493803024292
total time:  6.125652716029435
None All runs:
Highest Train: 100.00 ± 0.00
Highest Valid: 82.93 ± 1.21
  Final Train: 100.00 ± 0.00
   Final Test: 79.50 ± 1.45
[I 2023-06-12 00:43:55,120] Trial 335 finished with value: 82.93333435058594 and parameters: {'Fwd': 8.941728569493614e-06, 'K': 10, 'alpha': 0.9500000000000001, 'dropout': 0.9, 'gnnepoch': 60, 'lambda1': 0.7000000000000001, 'lambda2': 3.332089012401007, 'loop': 1, 'loss': 'MSE', 'lr': 0.00213699347235661, 'softmaxF': True, 'useGCN': False, 'weight_decay': 0.0404815663954695, 'weightedloss': False}. Best is trial 205 with value: 83.53333282470703.
/home/wxy/miniconda3/lib/python3.10/site-packages/optuna/distributions.py:685: UserWarning: The distribution is specified by [0, 1.00001] and step=0.05, but the range is not divisible by `step`. It will be replaced by [0, 1.0].
  warnings.warn(
K:  10
alpha:  1.0
lr:  0.0019293402866537841
weight_decay:  0.046097034560170294
dropout:  0.9
fix split and run 3 times
Data: Data(x=[19717, 500], y=[19717], train_mask=[19717], val_mask=[19717], test_mask=[19717], adj_t=[19717, 19717, nnz=88648])
num_train tensor(60)
num_noise 0
noise: tensor(0)
data feature 500
ALTOPT(
  (lins): Sequential(
    (0): Linear(in_features=500, out_features=64, bias=True)
    (1): BatchNorm1d(64, eps=1e-05, momentum=0.1, affine=True, track_running_stats=True)
    (2): Dropout(p=0.9, inplace=True)
    (3): ReLU(inplace=True)
    (4): Linear(in_features=64, out_features=3, bias=True)
    (5): Identity()
  )
  (prop): Propagation(K=10, mode=None, lambda1=None, lambda2=None, L21=True, alpha=1.0)
  (gcn): GCN(
    (convs): ModuleList(
      (0): GCNConv(500, 64)
      (1): GCNConv(64, 3)
    )
    (bns): ModuleList(
      (0): BatchNorm1d(64, eps=1e-05, momentum=0.1, affine=True, track_running_stats=True)
    )
    (output): Identity()
  )
)
propagate done
init label
Split: 01, Run: 01
None time:  2.8799075500573963
None Run 01:
Highest Train: 100.00
Highest Valid: 83.20
  Final Train: 100.00
   Final Test: 78.00
Split: 01, Run: 02
None time:  2.3465610230341554
None Run 02:
Highest Train: 100.00
Highest Valid: 81.40
  Final Train: 100.00
   Final Test: 78.40
Split: 01, Run: 03
None time:  1.0237255680840462
None Run 03:
Highest Train: 100.00
Highest Valid: 81.60
  Final Train: 100.00
   Final Test: 79.80
run time now: 6.293131351470947
total time:  6.3345568170771
None All runs:
Highest Train: 100.00 ± 0.00
Highest Valid: 82.07 ± 0.99
  Final Train: 100.00 ± 0.00
   Final Test: 78.73 ± 0.95
[I 2023-06-12 00:44:02,058] Trial 336 finished with value: 82.0666732788086 and parameters: {'Fwd': 9.716029663207264e-06, 'K': 10, 'alpha': 1.0, 'dropout': 0.9, 'gnnepoch': 60, 'lambda1': 0.8500000000000001, 'lambda2': 2.9827344403103075, 'loop': 1, 'loss': 'MSE', 'lr': 0.0019293402866537841, 'softmaxF': True, 'useGCN': False, 'weight_decay': 0.046097034560170294, 'weightedloss': False}. Best is trial 205 with value: 83.53333282470703.
/home/wxy/miniconda3/lib/python3.10/site-packages/optuna/distributions.py:685: UserWarning: The distribution is specified by [0, 1.00001] and step=0.05, but the range is not divisible by `step`. It will be replaced by [0, 1.0].
  warnings.warn(
K:  10
alpha:  0.9
lr:  0.002217148903638891
weight_decay:  0.038180638688249974
dropout:  0.9
fix split and run 3 times
Data: Data(x=[19717, 500], y=[19717], train_mask=[19717], val_mask=[19717], test_mask=[19717], adj_t=[19717, 19717, nnz=88648])
num_train tensor(60)
num_noise 0
noise: tensor(0)
data feature 500
ALTOPT(
  (lins): Sequential(
    (0): Linear(in_features=500, out_features=64, bias=True)
    (1): BatchNorm1d(64, eps=1e-05, momentum=0.1, affine=True, track_running_stats=True)
    (2): Dropout(p=0.9, inplace=True)
    (3): ReLU(inplace=True)
    (4): Linear(in_features=64, out_features=3, bias=True)
    (5): Identity()
  )
  (prop): Propagation(K=10, mode=None, lambda1=None, lambda2=None, L21=True, alpha=0.9)
  (gcn): GCN(
    (convs): ModuleList(
      (0): GCNConv(500, 64)
      (1): GCNConv(64, 3)
    )
    (bns): ModuleList(
      (0): BatchNorm1d(64, eps=1e-05, momentum=0.1, affine=True, track_running_stats=True)
    )
    (output): Identity()
  )
)
propagate done
init label
Split: 01, Run: 01
None time:  2.382287464104593
None Run 01:
Highest Train: 100.00
Highest Valid: 79.00
  Final Train: 100.00
   Final Test: 75.10
Split: 01, Run: 02
None time:  1.0384304709732533
None Run 02:
Highest Train: 100.00
Highest Valid: 82.60
  Final Train: 100.00
   Final Test: 78.90
Split: 01, Run: 03
None time:  0.7071864199824631
None Run 03:
Highest Train: 100.00
Highest Valid: 82.40
  Final Train: 100.00
   Final Test: 79.80
run time now: 4.182989835739136
total time:  4.231658906908706
None All runs:
Highest Train: 100.00 ± 0.00
Highest Valid: 81.33 ± 2.02
  Final Train: 100.00 ± 0.00
   Final Test: 77.93 ± 2.49
[I 2023-06-12 00:44:06,950] Trial 337 finished with value: 81.33333587646484 and parameters: {'Fwd': 8.63693563848803e-05, 'K': 10, 'alpha': 0.9, 'dropout': 0.9, 'gnnepoch': 60, 'lambda1': 0.6000000000000001, 'lambda2': 5.06856372634996, 'loop': 1, 'loss': 'MSE', 'lr': 0.002217148903638891, 'softmaxF': True, 'useGCN': False, 'weight_decay': 0.038180638688249974, 'weightedloss': False}. Best is trial 205 with value: 83.53333282470703.
/home/wxy/miniconda3/lib/python3.10/site-packages/optuna/distributions.py:685: UserWarning: The distribution is specified by [0, 1.00001] and step=0.05, but the range is not divisible by `step`. It will be replaced by [0, 1.0].
  warnings.warn(
K:  10
alpha:  0.9500000000000001
lr:  0.0016711500894950827
weight_decay:  0.0001798583828934606
dropout:  0.9
fix split and run 3 times
Data: Data(x=[19717, 500], y=[19717], train_mask=[19717], val_mask=[19717], test_mask=[19717], adj_t=[19717, 19717, nnz=88648])
num_train tensor(60)
num_noise 0
noise: tensor(0)
data feature 500
ALTOPT(
  (lins): Sequential(
    (0): Linear(in_features=500, out_features=64, bias=True)
    (1): BatchNorm1d(64, eps=1e-05, momentum=0.1, affine=True, track_running_stats=True)
    (2): Dropout(p=0.9, inplace=True)
    (3): ReLU(inplace=True)
    (4): Linear(in_features=64, out_features=3, bias=True)
    (5): Identity()
  )
  (prop): Propagation(K=10, mode=None, lambda1=None, lambda2=None, L21=True, alpha=0.9500000000000001)
  (gcn): GCN(
    (convs): ModuleList(
      (0): GCNConv(500, 64)
      (1): GCNConv(64, 3)
    )
    (bns): ModuleList(
      (0): BatchNorm1d(64, eps=1e-05, momentum=0.1, affine=True, track_running_stats=True)
    )
    (output): Identity()
  )
)
propagate done
init label
Split: 01, Run: 01
None time:  0.9154765878338367
None Run 01:
Highest Train: 100.00
Highest Valid: 69.40
  Final Train: 100.00
   Final Test: 69.20
Split: 01, Run: 02
None time:  0.9121572219301015
None Run 02:
Highest Train: 100.00
Highest Valid: 82.60
  Final Train: 100.00
   Final Test: 79.60
Split: 01, Run: 03
None time:  2.5108384620398283
None Run 03:
Highest Train: 100.00
Highest Valid: 84.20
  Final Train: 100.00
   Final Test: 80.00
run time now: 4.394513130187988
total time:  4.443887988105416
None All runs:
Highest Train: 100.00 ± 0.00
Highest Valid: 78.73 ± 8.12
  Final Train: 100.00 ± 0.00
   Final Test: 76.27 ± 6.12
[I 2023-06-12 00:44:11,922] Trial 338 finished with value: 78.73332977294922 and parameters: {'Fwd': 8.17051939676459e-06, 'K': 10, 'alpha': 0.9500000000000001, 'dropout': 0.9, 'gnnepoch': 50, 'lambda1': 0.8, 'lambda2': 3.566279044049287, 'loop': 1, 'loss': 'MSE', 'lr': 0.0016711500894950827, 'softmaxF': True, 'useGCN': False, 'weight_decay': 0.0001798583828934606, 'weightedloss': False}. Best is trial 205 with value: 83.53333282470703.
/home/wxy/miniconda3/lib/python3.10/site-packages/optuna/distributions.py:685: UserWarning: The distribution is specified by [0, 1.00001] and step=0.05, but the range is not divisible by `step`. It will be replaced by [0, 1.0].
  warnings.warn(
K:  10
alpha:  0.35000000000000003
lr:  0.0021093974471175026
weight_decay:  0.051931828055617704
dropout:  0.9
fix split and run 3 times
Data: Data(x=[19717, 500], y=[19717], train_mask=[19717], val_mask=[19717], test_mask=[19717], adj_t=[19717, 19717, nnz=88648])
num_train tensor(60)
num_noise 0
noise: tensor(0)
data feature 500
ALTOPT(
  (lins): Sequential(
    (0): Linear(in_features=500, out_features=64, bias=True)
    (1): BatchNorm1d(64, eps=1e-05, momentum=0.1, affine=True, track_running_stats=True)
    (2): Dropout(p=0.9, inplace=True)
    (3): ReLU(inplace=True)
    (4): Linear(in_features=64, out_features=3, bias=True)
    (5): Identity()
  )
  (prop): Propagation(K=10, mode=None, lambda1=None, lambda2=None, L21=True, alpha=0.35000000000000003)
  (gcn): GCN(
    (convs): ModuleList(
      (0): GCNConv(500, 64)
      (1): GCNConv(64, 3)
    )
    (bns): ModuleList(
      (0): BatchNorm1d(64, eps=1e-05, momentum=0.1, affine=True, track_running_stats=True)
    )
    (output): Identity()
  )
)
propagate done
init label
Split: 01, Run: 01
None time:  0.8556298960465938
None Run 01:
Highest Train: 100.00
Highest Valid: 69.20
  Final Train: 100.00
   Final Test: 69.30
Split: 01, Run: 02
None time:  2.3531799360644072
None Run 02:
Highest Train: 100.00
Highest Valid: 73.60
  Final Train: 100.00
   Final Test: 73.40
Split: 01, Run: 03
None time:  1.0142937139607966
None Run 03:
Highest Train: 100.00
Highest Valid: 72.40
  Final Train: 100.00
   Final Test: 73.30
run time now: 4.2741405963897705
total time:  4.315579945920035
None All runs:
Highest Train: 100.00 ± 0.00
Highest Valid: 71.73 ± 2.27
  Final Train: 100.00 ± 0.00
   Final Test: 72.00 ± 2.34
[I 2023-06-12 00:44:16,749] Trial 339 finished with value: 71.73332977294922 and parameters: {'Fwd': 1.2483243209526083e-05, 'K': 10, 'alpha': 0.35000000000000003, 'dropout': 0.9, 'gnnepoch': 60, 'lambda1': 0.8500000000000001, 'lambda2': 3.6327514205381495, 'loop': 1, 'loss': 'MSE', 'lr': 0.0021093974471175026, 'softmaxF': False, 'useGCN': False, 'weight_decay': 0.051931828055617704, 'weightedloss': False}. Best is trial 205 with value: 83.53333282470703.
/home/wxy/miniconda3/lib/python3.10/site-packages/optuna/distributions.py:685: UserWarning: The distribution is specified by [0, 1.00001] and step=0.05, but the range is not divisible by `step`. It will be replaced by [0, 1.0].
  warnings.warn(
K:  10
alpha:  0.9500000000000001
lr:  0.002429250578498818
weight_decay:  0.010873449278571132
dropout:  0.9
fix split and run 3 times
Data: Data(x=[19717, 500], y=[19717], train_mask=[19717], val_mask=[19717], test_mask=[19717], adj_t=[19717, 19717, nnz=88648])
num_train tensor(60)
num_noise 0
noise: tensor(0)
data feature 500
ALTOPT(
  (lins): Sequential(
    (0): Linear(in_features=500, out_features=64, bias=True)
    (1): BatchNorm1d(64, eps=1e-05, momentum=0.1, affine=True, track_running_stats=True)
    (2): Dropout(p=0.9, inplace=True)
    (3): ReLU(inplace=True)
    (4): Linear(in_features=64, out_features=3, bias=True)
    (5): Identity()
  )
  (prop): Propagation(K=10, mode=None, lambda1=None, lambda2=None, L21=True, alpha=0.9500000000000001)
  (gcn): GCN(
    (convs): ModuleList(
      (0): GCNConv(500, 64)
      (1): GCNConv(64, 3)
    )
    (bns): ModuleList(
      (0): BatchNorm1d(64, eps=1e-05, momentum=0.1, affine=True, track_running_stats=True)
    )
    (output): Identity()
  )
)
propagate done
init label
Split: 01, Run: 01
None time:  2.615133455954492
None Run 01:
Highest Train: 100.00
Highest Valid: 82.00
  Final Train: 100.00
   Final Test: 77.70
Split: 01, Run: 02
None time:  2.21541403606534
None Run 02:
Highest Train: 100.00
Highest Valid: 82.80
  Final Train: 100.00
   Final Test: 79.70
Split: 01, Run: 03
None time:  0.9495273968204856
None Run 03:
Highest Train: 100.00
Highest Valid: 83.20
  Final Train: 100.00
   Final Test: 80.60
run time now: 5.897905588150024
total time:  5.944961396977305
None All runs:
Highest Train: 100.00 ± 0.00
Highest Valid: 82.67 ± 0.61
  Final Train: 100.00 ± 0.00
   Final Test: 79.33 ± 1.48
[I 2023-06-12 00:44:23,297] Trial 340 finished with value: 82.66666412353516 and parameters: {'Fwd': 1.628434821505622e-05, 'K': 10, 'alpha': 0.9500000000000001, 'dropout': 0.9, 'gnnepoch': 60, 'lambda1': 0.7000000000000001, 'lambda2': 5.534545306638843, 'loop': 1, 'loss': 'MSE', 'lr': 0.002429250578498818, 'softmaxF': True, 'useGCN': False, 'weight_decay': 0.010873449278571132, 'weightedloss': False}. Best is trial 205 with value: 83.53333282470703.
/home/wxy/miniconda3/lib/python3.10/site-packages/optuna/distributions.py:685: UserWarning: The distribution is specified by [0, 1.00001] and step=0.05, but the range is not divisible by `step`. It will be replaced by [0, 1.0].
  warnings.warn(
K:  10
alpha:  0.9
lr:  0.0018469273808191598
weight_decay:  0.027358741012177997
dropout:  0.8
fix split and run 3 times
Data: Data(x=[19717, 500], y=[19717], train_mask=[19717], val_mask=[19717], test_mask=[19717], adj_t=[19717, 19717, nnz=88648])
num_train tensor(60)
num_noise 0
noise: tensor(0)
data feature 500
ALTOPT(
  (lins): Sequential(
    (0): Linear(in_features=500, out_features=64, bias=True)
    (1): BatchNorm1d(64, eps=1e-05, momentum=0.1, affine=True, track_running_stats=True)
    (2): Dropout(p=0.8, inplace=True)
    (3): ReLU(inplace=True)
    (4): Linear(in_features=64, out_features=3, bias=True)
    (5): Identity()
  )
  (prop): Propagation(K=10, mode=None, lambda1=None, lambda2=None, L21=True, alpha=0.9)
  (gcn): GCN(
    (convs): ModuleList(
      (0): GCNConv(500, 64)
      (1): GCNConv(64, 3)
    )
    (bns): ModuleList(
      (0): BatchNorm1d(64, eps=1e-05, momentum=0.1, affine=True, track_running_stats=True)
    )
    (output): Identity()
  )
)
propagate done
init label
Split: 01, Run: 01
None time:  1.5138104408979416
None Run 01:
Highest Train: 100.00
Highest Valid: 80.40
  Final Train: 100.00
   Final Test: 75.70
Split: 01, Run: 02
None time:  1.222832883009687
None Run 02:
Highest Train: 100.00
Highest Valid: 80.20
  Final Train: 100.00
   Final Test: 76.80
Split: 01, Run: 03
None time:  2.433977159904316
None Run 03:
Highest Train: 100.00
Highest Valid: 83.00
  Final Train: 100.00
   Final Test: 79.40
run time now: 5.221849679946899
total time:  5.281338755041361
None All runs:
Highest Train: 100.00 ± 0.00
Highest Valid: 81.20 ± 1.56
  Final Train: 100.00 ± 0.00
   Final Test: 77.30 ± 1.90
