[I 2023-06-12 00:49:11,977] Trial 394 finished with value: 80.86666870117188 and parameters: {'Fwd': 0.0001433038933927479, 'K': 10, 'alpha': 0.4, 'dropout': 0.4, 'gnnepoch': 60, 'lambda1': 0.8500000000000001, 'lambda2': 5.933054573321118, 'loop': 1, 'loss': 'CE', 'lr': 0.006070103114377228, 'softmaxF': True, 'useGCN': True, 'weight_decay': 7.223791877588692e-05, 'weightedloss': True}. Best is trial 112 with value: 81.66667175292969.
/home/wxy/miniconda3/lib/python3.10/site-packages/optuna/distributions.py:685: UserWarning: The distribution is specified by [0, 1.00001] and step=0.05, but the range is not divisible by `step`. It will be replaced by [0, 1.0].
  warnings.warn(
K:  9
alpha:  0.65
lr:  0.00693544229102651
weight_decay:  8.480765875786151e-06
dropout:  0.4
fix split and run 3 times
Data: Data(x=[2708, 1433], y=[2708], train_mask=[2708], val_mask=[2708], test_mask=[2708], adj_t=[2708, 2708, nnz=10556])
num_train tensor(140)
num_noise 0
noise: tensor(0)
data feature 1433
ALTOPT(
  (lins): Sequential(
    (0): Linear(in_features=1433, out_features=64, bias=True)
    (1): BatchNorm1d(64, eps=1e-05, momentum=0.1, affine=True, track_running_stats=True)
    (2): Dropout(p=0.4, inplace=True)
    (3): ReLU(inplace=True)
    (4): Linear(in_features=64, out_features=7, bias=True)
    (5): LogSoftmax(dim=-1)
  )
  (prop): Propagation(K=9, mode=None, lambda1=None, lambda2=None, L21=True, alpha=0.65)
  (gcn): GCN(
    (convs): ModuleList(
      (0): GCNConv(1433, 64)
      (1): GCNConv(64, 7)
    )
    (bns): ModuleList(
      (0): BatchNorm1d(64, eps=1e-05, momentum=0.1, affine=True, track_running_stats=True)
    )
    (output): LogSoftmax(dim=-1)
  )
)
propagate done
init label
Split: 01, Run: 01
None time:  1.7114109061658382
None Run 01:
Highest Train: 100.00
Highest Valid: 82.00
  Final Train: 100.00
   Final Test: 82.20
Split: 01, Run: 02
None time:  1.6378536359407008
None Run 02:
Highest Train: 100.00
Highest Valid: 81.40
  Final Train: 100.00
   Final Test: 81.50
Split: 01, Run: 03
None time:  1.643812014022842
None Run 03:
Highest Train: 100.00
Highest Valid: 81.00
  Final Train: 100.00
   Final Test: 80.50
run time now: 5.03242564201355
total time:  5.09046307601966
None All runs:
Highest Train: 100.00 ± 0.00
Highest Valid: 81.47 ± 0.50
  Final Train: 100.00 ± 0.00
   Final Test: 81.40 ± 0.85
[I 2023-06-12 00:49:17,685] Trial 395 finished with value: 81.46666717529297 and parameters: {'Fwd': 0.08163563617602078, 'K': 9, 'alpha': 0.65, 'dropout': 0.4, 'gnnepoch': 60, 'lambda1': 0.8, 'lambda2': 5.38426552988825, 'loop': 1, 'loss': 'CE', 'lr': 0.00693544229102651, 'softmaxF': True, 'useGCN': True, 'weight_decay': 8.480765875786151e-06, 'weightedloss': False}. Best is trial 112 with value: 81.66667175292969.
/home/wxy/miniconda3/lib/python3.10/site-packages/optuna/distributions.py:685: UserWarning: The distribution is specified by [0, 1.00001] and step=0.05, but the range is not divisible by `step`. It will be replaced by [0, 1.0].
  warnings.warn(
K:  10
alpha:  0.7000000000000001
lr:  0.00016015382667846799
weight_decay:  0.0019055271376961786
dropout:  0.4
fix split and run 3 times
Data: Data(x=[2708, 1433], y=[2708], train_mask=[2708], val_mask=[2708], test_mask=[2708], adj_t=[2708, 2708, nnz=10556])
num_train tensor(140)
num_noise 0
noise: tensor(0)
data feature 1433
ALTOPT(
  (lins): Sequential(
    (0): Linear(in_features=1433, out_features=64, bias=True)
    (1): BatchNorm1d(64, eps=1e-05, momentum=0.1, affine=True, track_running_stats=True)
    (2): Dropout(p=0.4, inplace=True)
    (3): ReLU(inplace=True)
    (4): Linear(in_features=64, out_features=7, bias=True)
    (5): LogSoftmax(dim=-1)
  )
  (prop): Propagation(K=10, mode=None, lambda1=None, lambda2=None, L21=True, alpha=0.7000000000000001)
  (gcn): GCN(
    (convs): ModuleList(
      (0): GCNConv(1433, 64)
      (1): GCNConv(64, 7)
    )
    (bns): ModuleList(
      (0): BatchNorm1d(64, eps=1e-05, momentum=0.1, affine=True, track_running_stats=True)
    )
    (output): LogSoftmax(dim=-1)
  )
)
propagate done
init label
Split: 01, Run: 01
None time:  1.343535624910146
None Run 01:
Highest Train: 100.00
Highest Valid: 77.20
  Final Train: 100.00
   Final Test: 77.10
Split: 01, Run: 02
None time:  2.3276038081385195
None Run 02:
Highest Train: 100.00
Highest Valid: 75.80
  Final Train: 100.00
   Final Test: 75.60
Split: 01, Run: 03
None time:  1.6770606031641364
None Run 03:
Highest Train: 100.00
Highest Valid: 71.20
  Final Train: 100.00
   Final Test: 73.10
run time now: 5.382868766784668
total time:  5.410630309954286
None All runs:
Highest Train: 100.00 ± 0.00
Highest Valid: 74.73 ± 3.14
  Final Train: 100.00 ± 0.00
   Final Test: 75.27 ± 2.02
[I 2023-06-12 00:49:23,643] Trial 396 finished with value: 74.73333740234375 and parameters: {'Fwd': 0.015936881286563957, 'K': 10, 'alpha': 0.7000000000000001, 'dropout': 0.4, 'gnnepoch': 60, 'lambda1': 0.30000000000000004, 'lambda2': 4.722869221325617, 'loop': 1, 'loss': 'CE', 'lr': 0.00016015382667846799, 'softmaxF': False, 'useGCN': True, 'weight_decay': 0.0019055271376961786, 'weightedloss': False}. Best is trial 112 with value: 81.66667175292969.
/home/wxy/miniconda3/lib/python3.10/site-packages/optuna/distributions.py:685: UserWarning: The distribution is specified by [0, 1.00001] and step=0.05, but the range is not divisible by `step`. It will be replaced by [0, 1.0].
  warnings.warn(
K:  10
alpha:  0.5
lr:  0.00027663044068982175
weight_decay:  4.8561218843508126e-05
dropout:  0.30000000000000004
fix split and run 3 times
Data: Data(x=[2708, 1433], y=[2708], train_mask=[2708], val_mask=[2708], test_mask=[2708], adj_t=[2708, 2708, nnz=10556])
num_train tensor(140)
num_noise 0
noise: tensor(0)
data feature 1433
ALTOPT(
  (lins): Sequential(
    (0): Linear(in_features=1433, out_features=64, bias=True)
    (1): BatchNorm1d(64, eps=1e-05, momentum=0.1, affine=True, track_running_stats=True)
    (2): Dropout(p=0.30000000000000004, inplace=True)
    (3): ReLU(inplace=True)
    (4): Linear(in_features=64, out_features=7, bias=True)
    (5): LogSoftmax(dim=-1)
  )
  (prop): Propagation(K=10, mode=None, lambda1=None, lambda2=None, L21=True, alpha=0.5)
  (gcn): GCN(
    (convs): ModuleList(
      (0): GCNConv(1433, 64)
      (1): GCNConv(64, 7)
    )
    (bns): ModuleList(
      (0): BatchNorm1d(64, eps=1e-05, momentum=0.1, affine=True, track_running_stats=True)
    )
    (output): LogSoftmax(dim=-1)
  )
)
propagate done
init label
Split: 01, Run: 01
None time:  1.9809816300403327
None Run 01:
Highest Train: 100.00
Highest Valid: 78.60
  Final Train: 100.00
   Final Test: 78.90
Split: 01, Run: 02
None time:  2.178414954105392
None Run 02:
Highest Train: 100.00
Highest Valid: 78.40
  Final Train: 100.00
   Final Test: 79.00
Split: 01, Run: 03
None time:  1.5916358281392604
None Run 03:
Highest Train: 100.00
Highest Valid: 72.80
  Final Train: 100.00
   Final Test: 74.60
run time now: 5.789798736572266
total time:  5.8032762059010565
None All runs:
Highest Train: 100.00 ± 0.00
Highest Valid: 76.60 ± 3.29
  Final Train: 100.00 ± 0.00
   Final Test: 77.50 ± 2.51
[I 2023-06-12 00:49:29,903] Trial 397 finished with value: 76.5999984741211 and parameters: {'Fwd': 0.09986578549798544, 'K': 10, 'alpha': 0.5, 'dropout': 0.30000000000000004, 'gnnepoch': 70, 'lambda1': 0.9500000000000001, 'lambda2': 3.72703214916683, 'loop': 1, 'loss': 'CE', 'lr': 0.00027663044068982175, 'softmaxF': True, 'useGCN': True, 'weight_decay': 4.8561218843508126e-05, 'weightedloss': False}. Best is trial 112 with value: 81.66667175292969.
/home/wxy/miniconda3/lib/python3.10/site-packages/optuna/distributions.py:685: UserWarning: The distribution is specified by [0, 1.00001] and step=0.05, but the range is not divisible by `step`. It will be replaced by [0, 1.0].
  warnings.warn(
K:  10
alpha:  0.6000000000000001
lr:  0.0003512827474667973
weight_decay:  3.6485874709565486e-06
dropout:  0.5
fix split and run 3 times
Data: Data(x=[2708, 1433], y=[2708], train_mask=[2708], val_mask=[2708], test_mask=[2708], adj_t=[2708, 2708, nnz=10556])
num_train tensor(140)
num_noise 0
noise: tensor(0)
data feature 1433
ALTOPT(
  (lins): Sequential(
    (0): Linear(in_features=1433, out_features=64, bias=True)
    (1): BatchNorm1d(64, eps=1e-05, momentum=0.1, affine=True, track_running_stats=True)
    (2): Dropout(p=0.5, inplace=True)
    (3): ReLU(inplace=True)
    (4): Linear(in_features=64, out_features=7, bias=True)
    (5): LogSoftmax(dim=-1)
  )
  (prop): Propagation(K=10, mode=None, lambda1=None, lambda2=None, L21=True, alpha=0.6000000000000001)
  (gcn): GCN(
    (convs): ModuleList(
      (0): GCNConv(1433, 64)
      (1): GCNConv(64, 7)
    )
    (bns): ModuleList(
      (0): BatchNorm1d(64, eps=1e-05, momentum=0.1, affine=True, track_running_stats=True)
    )
    (output): LogSoftmax(dim=-1)
  )
)
propagate done
init label
Split: 01, Run: 01
None time:  1.5843729269690812
None Run 01:
Highest Train: 100.00
Highest Valid: 79.20
  Final Train: 100.00
   Final Test: 78.70
Split: 01, Run: 02
None time:  1.7669054688885808
None Run 02:
Highest Train: 100.00
Highest Valid: 73.60
  Final Train: 100.00
   Final Test: 74.00
Split: 01, Run: 03
None time:  1.5303860281128436
None Run 03:
Highest Train: 100.00
Highest Valid: 77.80
  Final Train: 100.00
   Final Test: 77.50
run time now: 4.9075422286987305
total time:  4.928726608864963
None All runs:
Highest Train: 100.00 ± 0.00
Highest Valid: 76.87 ± 2.91
  Final Train: 100.00 ± 0.00
   Final Test: 76.73 ± 2.44
[I 2023-06-12 00:49:35,413] Trial 398 finished with value: 76.86666107177734 and parameters: {'Fwd': 0.0008433159969284435, 'K': 10, 'alpha': 0.6000000000000001, 'dropout': 0.5, 'gnnepoch': 60, 'lambda1': 0.9, 'lambda2': 2.39834805190954, 'loop': 1, 'loss': 'CE', 'lr': 0.0003512827474667973, 'softmaxF': True, 'useGCN': True, 'weight_decay': 3.6485874709565486e-06, 'weightedloss': True}. Best is trial 112 with value: 81.66667175292969.
/home/wxy/miniconda3/lib/python3.10/site-packages/optuna/distributions.py:685: UserWarning: The distribution is specified by [0, 1.00001] and step=0.05, but the range is not divisible by `step`. It will be replaced by [0, 1.0].
  warnings.warn(
K:  10
alpha:  0.55
lr:  0.008238278242360071
weight_decay:  0.0001240308299557153
dropout:  0.4
fix split and run 3 times
Data: Data(x=[2708, 1433], y=[2708], train_mask=[2708], val_mask=[2708], test_mask=[2708], adj_t=[2708, 2708, nnz=10556])
num_train tensor(140)
num_noise 0
noise: tensor(0)
data feature 1433
ALTOPT(
  (lins): Sequential(
    (0): Linear(in_features=1433, out_features=64, bias=True)
    (1): BatchNorm1d(64, eps=1e-05, momentum=0.1, affine=True, track_running_stats=True)
    (2): Dropout(p=0.4, inplace=True)
    (3): ReLU(inplace=True)
    (4): Linear(in_features=64, out_features=7, bias=True)
    (5): LogSoftmax(dim=-1)
  )
  (prop): Propagation(K=10, mode=None, lambda1=None, lambda2=None, L21=True, alpha=0.55)
  (gcn): GCN(
    (convs): ModuleList(
      (0): GCNConv(1433, 64)
      (1): GCNConv(64, 7)
    )
    (bns): ModuleList(
      (0): BatchNorm1d(64, eps=1e-05, momentum=0.1, affine=True, track_running_stats=True)
    )
    (output): LogSoftmax(dim=-1)
  )
)
propagate done
init label
Split: 01, Run: 01
None time:  1.7840340330731124
None Run 01:
Highest Train: 100.00
Highest Valid: 81.40
  Final Train: 100.00
   Final Test: 81.20
Split: 01, Run: 02
None time:  1.6452925100456923
None Run 02:
Highest Train: 100.00
Highest Valid: 80.80
  Final Train: 100.00
   Final Test: 80.90
Split: 01, Run: 03
None time:  2.1342644880060107
None Run 03:
Highest Train: 100.00
Highest Valid: 80.60
  Final Train: 100.00
   Final Test: 80.10
run time now: 5.588449001312256
total time:  5.607649791054428
None All runs:
Highest Train: 100.00 ± 0.00
Highest Valid: 80.93 ± 0.42
  Final Train: 100.00 ± 0.00
   Final Test: 80.73 ± 0.57
[I 2023-06-12 00:49:41,564] Trial 399 finished with value: 80.93334197998047 and parameters: {'Fwd': 0.06961882017888697, 'K': 10, 'alpha': 0.55, 'dropout': 0.4, 'gnnepoch': 80, 'lambda1': 0.8500000000000001, 'lambda2': 5.481941776965184, 'loop': 1, 'loss': 'CE', 'lr': 0.008238278242360071, 'softmaxF': True, 'useGCN': True, 'weight_decay': 0.0001240308299557153, 'weightedloss': False}. Best is trial 112 with value: 81.66667175292969.
/home/wxy/miniconda3/lib/python3.10/site-packages/optuna/distributions.py:685: UserWarning: The distribution is specified by [0, 1.00001] and step=0.05, but the range is not divisible by `step`. It will be replaced by [0, 1.0].
  warnings.warn(
K:  10
alpha:  0.45
lr:  0.0004962736127095695
weight_decay:  3.39594354052107e-05
dropout:  0.4
fix split and run 3 times
Data: Data(x=[2708, 1433], y=[2708], train_mask=[2708], val_mask=[2708], test_mask=[2708], adj_t=[2708, 2708, nnz=10556])
num_train tensor(140)
num_noise 0
noise: tensor(0)
data feature 1433
ALTOPT(
  (lins): Sequential(
    (0): Linear(in_features=1433, out_features=64, bias=True)
    (1): BatchNorm1d(64, eps=1e-05, momentum=0.1, affine=True, track_running_stats=True)
    (2): Dropout(p=0.4, inplace=True)
    (3): ReLU(inplace=True)
    (4): Linear(in_features=64, out_features=7, bias=True)
    (5): LogSoftmax(dim=-1)
  )
  (prop): Propagation(K=10, mode=None, lambda1=None, lambda2=None, L21=True, alpha=0.45)
  (gcn): GCN(
    (convs): ModuleList(
      (0): GCNConv(1433, 64)
      (1): GCNConv(64, 7)
    )
    (bns): ModuleList(
      (0): BatchNorm1d(64, eps=1e-05, momentum=0.1, affine=True, track_running_stats=True)
    )
    (output): LogSoftmax(dim=-1)
  )
)
propagate done
init label
Split: 01, Run: 01
None time:  1.9014785361941904
None Run 01:
Highest Train: 100.00
Highest Valid: 79.60
  Final Train: 100.00
   Final Test: 79.40
Split: 01, Run: 02
None time:  1.5235924001317471
None Run 02:
Highest Train: 100.00
Highest Valid: 76.80
  Final Train: 100.00
   Final Test: 77.60
Split: 01, Run: 03
None time:  1.7366464640945196
None Run 03:
Highest Train: 100.00
Highest Valid: 78.20
  Final Train: 100.00
   Final Test: 78.10
run time now: 5.209537982940674
total time:  5.232643587980419
None All runs:
Highest Train: 100.00 ± 0.00
Highest Valid: 78.20 ± 1.40
  Final Train: 100.00 ± 0.00
   Final Test: 78.37 ± 0.93
[I 2023-06-12 00:49:47,309] Trial 400 finished with value: 78.19999694824219 and parameters: {'Fwd': 0.053938033731154265, 'K': 10, 'alpha': 0.45, 'dropout': 0.4, 'gnnepoch': 60, 'lambda1': 0.8, 'lambda2': 5.19648573595651, 'loop': 1, 'loss': 'CE', 'lr': 0.0004962736127095695, 'softmaxF': True, 'useGCN': True, 'weight_decay': 3.39594354052107e-05, 'weightedloss': False}. Best is trial 112 with value: 81.66667175292969.
/home/wxy/miniconda3/lib/python3.10/site-packages/optuna/distributions.py:685: UserWarning: The distribution is specified by [0, 1.00001] and step=0.05, but the range is not divisible by `step`. It will be replaced by [0, 1.0].
  warnings.warn(
K:  10
alpha:  0.55
lr:  0.005841381541170957
weight_decay:  8.588424140395095e-05
dropout:  0.8
fix split and run 3 times
Data: Data(x=[2708, 1433], y=[2708], train_mask=[2708], val_mask=[2708], test_mask=[2708], adj_t=[2708, 2708, nnz=10556])
num_train tensor(140)
num_noise 0
noise: tensor(0)
data feature 1433
ALTOPT(
  (lins): Sequential(
    (0): Linear(in_features=1433, out_features=64, bias=True)
    (1): BatchNorm1d(64, eps=1e-05, momentum=0.1, affine=True, track_running_stats=True)
    (2): Dropout(p=0.8, inplace=True)
    (3): ReLU(inplace=True)
    (4): Linear(in_features=64, out_features=7, bias=True)
    (5): LogSoftmax(dim=-1)
  )
  (prop): Propagation(K=10, mode=None, lambda1=None, lambda2=None, L21=True, alpha=0.55)
  (gcn): GCN(
    (convs): ModuleList(
      (0): GCNConv(1433, 64)
      (1): GCNConv(64, 7)
    )
    (bns): ModuleList(
      (0): BatchNorm1d(64, eps=1e-05, momentum=0.1, affine=True, track_running_stats=True)
    )
    (output): LogSoftmax(dim=-1)
  )
)
propagate done
init label
Split: 01, Run: 01
None time:  1.6519390409812331
None Run 01:
Highest Train: 100.00
Highest Valid: 81.20
  Final Train: 100.00
   Final Test: 82.70
Split: 01, Run: 02
None time:  1.70100307604298
None Run 02:
Highest Train: 100.00
Highest Valid: 80.60
  Final Train: 100.00
   Final Test: 80.90
Split: 01, Run: 03
None time:  1.5519825830124319
None Run 03:
Highest Train: 100.00
Highest Valid: 80.40
  Final Train: 100.00
   Final Test: 81.20
run time now: 4.929784774780273
total time:  4.944082269910723
None All runs:
Highest Train: 100.00 ± 0.00
Highest Valid: 80.73 ± 0.42
  Final Train: 100.00 ± 0.00
   Final Test: 81.60 ± 0.96
[I 2023-06-12 00:49:52,787] Trial 401 finished with value: 80.73332977294922 and parameters: {'Fwd': 0.03916016089485131, 'K': 10, 'alpha': 0.55, 'dropout': 0.8, 'gnnepoch': 60, 'lambda1': 0.9, 'lambda2': 5.703308890507515, 'loop': 1, 'loss': 'CE', 'lr': 0.005841381541170957, 'softmaxF': True, 'useGCN': True, 'weight_decay': 8.588424140395095e-05, 'weightedloss': True}. Best is trial 112 with value: 81.66667175292969.
/home/wxy/miniconda3/lib/python3.10/site-packages/optuna/distributions.py:685: UserWarning: The distribution is specified by [0, 1.00001] and step=0.05, but the range is not divisible by `step`. It will be replaced by [0, 1.0].
  warnings.warn(
K:  9
alpha:  0.65
lr:  0.007693790196981301
weight_decay:  6.403125393489225e-05
dropout:  0.5
fix split and run 3 times
Data: Data(x=[2708, 1433], y=[2708], train_mask=[2708], val_mask=[2708], test_mask=[2708], adj_t=[2708, 2708, nnz=10556])
num_train tensor(140)
num_noise 0
noise: tensor(0)
data feature 1433
ALTOPT(
  (lins): Sequential(
    (0): Linear(in_features=1433, out_features=64, bias=True)
    (1): BatchNorm1d(64, eps=1e-05, momentum=0.1, affine=True, track_running_stats=True)
    (2): Dropout(p=0.5, inplace=True)
    (3): ReLU(inplace=True)
    (4): Linear(in_features=64, out_features=7, bias=True)
    (5): LogSoftmax(dim=-1)
  )
  (prop): Propagation(K=9, mode=None, lambda1=None, lambda2=None, L21=True, alpha=0.65)
  (gcn): GCN(
    (convs): ModuleList(
      (0): GCNConv(1433, 64)
      (1): GCNConv(64, 7)
    )
    (bns): ModuleList(
      (0): BatchNorm1d(64, eps=1e-05, momentum=0.1, affine=True, track_running_stats=True)
    )
    (output): LogSoftmax(dim=-1)
  )
)
propagate done
init label
Split: 01, Run: 01
None time:  1.6166870340239257
None Run 01:
Highest Train: 100.00
Highest Valid: 82.00
  Final Train: 100.00
   Final Test: 82.40
Split: 01, Run: 02
None time:  1.5429504809435457
None Run 02:
Highest Train: 100.00
Highest Valid: 81.40
  Final Train: 100.00
   Final Test: 81.30
Split: 01, Run: 03
None time:  1.4797173228580505
None Run 03:
Highest Train: 100.00
Highest Valid: 80.60
  Final Train: 100.00
   Final Test: 81.10
run time now: 4.668798208236694
total time:  4.682795142987743
None All runs:
Highest Train: 100.00 ± 0.00
Highest Valid: 81.33 ± 0.70
  Final Train: 100.00 ± 0.00
   Final Test: 81.60 ± 0.70
[I 2023-06-12 00:49:58,001] Trial 402 finished with value: 81.33333587646484 and parameters: {'Fwd': 0.06907861615125206, 'K': 9, 'alpha': 0.65, 'dropout': 0.5, 'gnnepoch': 60, 'lambda1': 0.75, 'lambda2': 6.1023206720743435, 'loop': 1, 'loss': 'CE', 'lr': 0.007693790196981301, 'softmaxF': True, 'useGCN': True, 'weight_decay': 6.403125393489225e-05, 'weightedloss': False}. Best is trial 112 with value: 81.66667175292969.
/home/wxy/miniconda3/lib/python3.10/site-packages/optuna/distributions.py:685: UserWarning: The distribution is specified by [0, 1.00001] and step=0.05, but the range is not divisible by `step`. It will be replaced by [0, 1.0].
  warnings.warn(
K:  10
alpha:  0.6000000000000001
lr:  0.004353097590861045
weight_decay:  0.00014637303441236097
dropout:  0.4
fix split and run 3 times
Data: Data(x=[2708, 1433], y=[2708], train_mask=[2708], val_mask=[2708], test_mask=[2708], adj_t=[2708, 2708, nnz=10556])
num_train tensor(140)
num_noise 0
noise: tensor(0)
data feature 1433
ALTOPT(
  (lins): Sequential(
    (0): Linear(in_features=1433, out_features=64, bias=True)
    (1): BatchNorm1d(64, eps=1e-05, momentum=0.1, affine=True, track_running_stats=True)
    (2): Dropout(p=0.4, inplace=True)
    (3): ReLU(inplace=True)
    (4): Linear(in_features=64, out_features=7, bias=True)
    (5): LogSoftmax(dim=-1)
  )
  (prop): Propagation(K=10, mode=None, lambda1=None, lambda2=None, L21=True, alpha=0.6000000000000001)
  (gcn): GCN(
    (convs): ModuleList(
      (0): GCNConv(1433, 64)
      (1): GCNConv(64, 7)
    )
    (bns): ModuleList(
      (0): BatchNorm1d(64, eps=1e-05, momentum=0.1, affine=True, track_running_stats=True)
    )
    (output): LogSoftmax(dim=-1)
  )
)
propagate done
init label
Split: 01, Run: 01
None time:  1.5463893651030958
None Run 01:
Highest Train: 100.00
Highest Valid: 80.40
  Final Train: 100.00
   Final Test: 81.00
Split: 01, Run: 02
None time:  1.2958445369731635
None Run 02:
Highest Train: 100.00
Highest Valid: 80.20
  Final Train: 100.00
   Final Test: 81.20
Split: 01, Run: 03
None time:  1.496885976055637
None Run 03:
Highest Train: 100.00
Highest Valid: 80.60
  Final Train: 100.00
   Final Test: 81.20
run time now: 4.366015672683716
total time:  4.3811805041041225
None All runs:
Highest Train: 100.00 ± 0.00
Highest Valid: 80.40 ± 0.20
  Final Train: 100.00 ± 0.00
   Final Test: 81.13 ± 0.12
