[I 2023-06-11 23:23:13,857] Trial 35 finished with value: 70.20000457763672 and parameters: {'Fwd': 0.031078975265994818, 'K': 10, 'alpha': 0.8, 'dropout': 0.30000000000000004, 'gnnepoch': 90, 'lambda1': 0.4, 'lambda2': 5.144623838332326, 'loop': 0, 'loss': 'CE', 'lr': 0.004144298495195237, 'softmaxF': True, 'useGCN': True, 'weight_decay': 1.856683534111956e-06, 'weightedloss': False}. Best is trial 10 with value: 71.20000457763672.
/home/wxy/miniconda3/lib/python3.10/site-packages/optuna/distributions.py:685: UserWarning: The distribution is specified by [0, 1.00001] and step=0.05, but the range is not divisible by `step`. It will be replaced by [0, 1.0].
  warnings.warn(
K:  9
alpha:  0.65
lr:  0.0006915669867447982
weight_decay:  5.7881686004073e-06
dropout:  0.2
fix split and run 3 times
Data: Data(x=[3327, 3703], y=[3327], train_mask=[3327], val_mask=[3327], test_mask=[3327], adj_t=[3327, 3327, nnz=9104])
num_train tensor(120)
num_noise 0
noise: tensor(0)
data feature 3703
ALTOPT(
  (lins): Sequential(
    (0): Linear(in_features=3703, out_features=64, bias=True)
    (1): BatchNorm1d(64, eps=1e-05, momentum=0.1, affine=True, track_running_stats=True)
    (2): Dropout(p=0.2, inplace=True)
    (3): ReLU(inplace=True)
    (4): Linear(in_features=64, out_features=6, bias=True)
    (5): LogSoftmax(dim=-1)
  )
  (prop): Propagation(K=9, mode=None, lambda1=None, lambda2=None, L21=True, alpha=0.65)
  (gcn): GCN(
    (convs): ModuleList(
      (0): GCNConv(3703, 64)
      (1): GCNConv(64, 6)
    )
    (bns): ModuleList(
      (0): BatchNorm1d(64, eps=1e-05, momentum=0.1, affine=True, track_running_stats=True)
    )
    (output): LogSoftmax(dim=-1)
  )
)
propagate done
init label
Split: 01, Run: 01
None time:  0.9868372019845992
None Run 01:
Highest Train: 100.00
Highest Valid: 66.80
  Final Train: 100.00
   Final Test: 65.90
Split: 01, Run: 02
None time:  1.0076739909127355
None Run 02:
Highest Train: 100.00
Highest Valid: 66.80
  Final Train: 99.17
   Final Test: 67.70
Split: 01, Run: 03
None time:  0.6556444459129125
None Run 03:
Highest Train: 100.00
Highest Valid: 62.20
  Final Train: 100.00
   Final Test: 64.10
run time now: 2.6928820610046387
total time:  2.752056155120954
None All runs:
Highest Train: 100.00 ± 0.00
Highest Valid: 65.27 ± 2.66
  Final Train: 99.72 ± 0.48
   Final Test: 65.90 ± 1.80
[I 2023-06-11 23:23:17,075] Trial 36 finished with value: 65.26666259765625 and parameters: {'Fwd': 0.09540307816728166, 'K': 9, 'alpha': 0.65, 'dropout': 0.2, 'gnnepoch': 80, 'lambda1': 0.55, 'lambda2': 4.335795120400479, 'loop': 1, 'loss': 'CE', 'lr': 0.0006915669867447982, 'softmaxF': True, 'useGCN': False, 'weight_decay': 5.7881686004073e-06, 'weightedloss': True}. Best is trial 10 with value: 71.20000457763672.
/home/wxy/miniconda3/lib/python3.10/site-packages/optuna/distributions.py:685: UserWarning: The distribution is specified by [0, 1.00001] and step=0.05, but the range is not divisible by `step`. It will be replaced by [0, 1.0].
  warnings.warn(
K:  3
alpha:  0.75
lr:  0.003018556887060834
weight_decay:  2.3778049660057047e-05
dropout:  0.1
fix split and run 3 times
Data: Data(x=[3327, 3703], y=[3327], train_mask=[3327], val_mask=[3327], test_mask=[3327], adj_t=[3327, 3327, nnz=9104])
num_train tensor(120)
num_noise 0
noise: tensor(0)
data feature 3703
ALTOPT(
  (lins): Sequential(
    (0): Linear(in_features=3703, out_features=64, bias=True)
    (1): BatchNorm1d(64, eps=1e-05, momentum=0.1, affine=True, track_running_stats=True)
    (2): Dropout(p=0.1, inplace=True)
    (3): ReLU(inplace=True)
    (4): Linear(in_features=64, out_features=6, bias=True)
    (5): LogSoftmax(dim=-1)
  )
  (prop): Propagation(K=3, mode=None, lambda1=None, lambda2=None, L21=True, alpha=0.75)
  (gcn): GCN(
    (convs): ModuleList(
      (0): GCNConv(3703, 64)
      (1): GCNConv(64, 6)
    )
    (bns): ModuleList(
      (0): BatchNorm1d(64, eps=1e-05, momentum=0.1, affine=True, track_running_stats=True)
    )
    (output): LogSoftmax(dim=-1)
  )
)
propagate done
init label
Split: 01, Run: 01
None time:  0.3800713249947876
None Run 01:
Highest Train: 100.00
Highest Valid: 71.00
  Final Train: 100.00
   Final Test: 68.40
Split: 01, Run: 02
None time:  0.4718076619319618
None Run 02:
Highest Train: 100.00
Highest Valid: 68.80
  Final Train: 100.00
   Final Test: 66.50
Split: 01, Run: 03
None time:  0.4573748221155256
None Run 03:
Highest Train: 100.00
Highest Valid: 71.00
  Final Train: 100.00
   Final Test: 68.80
run time now: 1.3465993404388428
total time:  1.4061518358066678
None All runs:
Highest Train: 100.00 ± 0.00
Highest Valid: 70.27 ± 1.27
  Final Train: 100.00 ± 0.00
   Final Test: 67.90 ± 1.23
[I 2023-06-11 23:23:18,973] Trial 37 finished with value: 70.26667022705078 and parameters: {'Fwd': 0.023600029940019678, 'K': 3, 'alpha': 0.75, 'dropout': 0.1, 'gnnepoch': 40, 'lambda1': 0.65, 'lambda2': 2.95096653378408, 'loop': 0, 'loss': 'CE', 'lr': 0.003018556887060834, 'softmaxF': False, 'useGCN': True, 'weight_decay': 2.3778049660057047e-05, 'weightedloss': True}. Best is trial 10 with value: 71.20000457763672.
/home/wxy/miniconda3/lib/python3.10/site-packages/optuna/distributions.py:685: UserWarning: The distribution is specified by [0, 1.00001] and step=0.05, but the range is not divisible by `step`. It will be replaced by [0, 1.0].
  warnings.warn(
K:  5
alpha:  0.55
lr:  0.0045889583021127235
weight_decay:  0.00028846953963415726
dropout:  0.30000000000000004
fix split and run 3 times
Data: Data(x=[3327, 3703], y=[3327], train_mask=[3327], val_mask=[3327], test_mask=[3327], adj_t=[3327, 3327, nnz=9104])
num_train tensor(120)
num_noise 0
noise: tensor(0)
data feature 3703
ALTOPT(
  (lins): Sequential(
    (0): Linear(in_features=3703, out_features=64, bias=True)
    (1): BatchNorm1d(64, eps=1e-05, momentum=0.1, affine=True, track_running_stats=True)
    (2): Dropout(p=0.30000000000000004, inplace=True)
    (3): ReLU(inplace=True)
    (4): Linear(in_features=64, out_features=6, bias=True)
    (5): LogSoftmax(dim=-1)
  )
  (prop): Propagation(K=5, mode=None, lambda1=None, lambda2=None, L21=True, alpha=0.55)
  (gcn): GCN(
    (convs): ModuleList(
      (0): GCNConv(3703, 64)
      (1): GCNConv(64, 6)
    )
    (bns): ModuleList(
      (0): BatchNorm1d(64, eps=1e-05, momentum=0.1, affine=True, track_running_stats=True)
    )
    (output): LogSoftmax(dim=-1)
  )
)
propagate done
init label
Split: 01, Run: 01
None time:  1.2816016061697155
None Run 01:
Highest Train: 100.00
Highest Valid: 70.60
  Final Train: 98.33
   Final Test: 69.50
Split: 01, Run: 02
None time:  1.5427511830348521
None Run 02:
Highest Train: 100.00
Highest Valid: 70.60
  Final Train: 95.00
   Final Test: 69.40
Split: 01, Run: 03
None time:  1.53562076902017
None Run 03:
Highest Train: 100.00
Highest Valid: 70.80
  Final Train: 92.50
   Final Test: 69.60
run time now: 4.397920608520508
total time:  4.44500407599844
None All runs:
Highest Train: 100.00 ± 0.00
Highest Valid: 70.67 ± 0.12
  Final Train: 95.28 ± 2.93
   Final Test: 69.50 ± 0.10
[I 2023-06-11 23:23:23,836] Trial 38 finished with value: 70.66666412353516 and parameters: {'Fwd': 0.01010655307757448, 'K': 5, 'alpha': 0.55, 'dropout': 0.30000000000000004, 'gnnepoch': 110, 'lambda1': 0.75, 'lambda2': 3.4773377929789318, 'loop': 1, 'loss': 'CE', 'lr': 0.0045889583021127235, 'softmaxF': True, 'useGCN': True, 'weight_decay': 0.00028846953963415726, 'weightedloss': True}. Best is trial 10 with value: 71.20000457763672.
/home/wxy/miniconda3/lib/python3.10/site-packages/optuna/distributions.py:685: UserWarning: The distribution is specified by [0, 1.00001] and step=0.05, but the range is not divisible by `step`. It will be replaced by [0, 1.0].
  warnings.warn(
K:  7
alpha:  0.35000000000000003
lr:  0.0018080745444032616
weight_decay:  1.3087938715290484e-05
dropout:  0.4
fix split and run 3 times
Data: Data(x=[3327, 3703], y=[3327], train_mask=[3327], val_mask=[3327], test_mask=[3327], adj_t=[3327, 3327, nnz=9104])
num_train tensor(120)
num_noise 0
noise: tensor(0)
data feature 3703
ALTOPT(
  (lins): Sequential(
    (0): Linear(in_features=3703, out_features=64, bias=True)
    (1): BatchNorm1d(64, eps=1e-05, momentum=0.1, affine=True, track_running_stats=True)
    (2): Dropout(p=0.4, inplace=True)
    (3): ReLU(inplace=True)
    (4): Linear(in_features=64, out_features=6, bias=True)
    (5): Identity()
  )
  (prop): Propagation(K=7, mode=None, lambda1=None, lambda2=None, L21=True, alpha=0.35000000000000003)
  (gcn): GCN(
    (convs): ModuleList(
      (0): GCNConv(3703, 64)
      (1): GCNConv(64, 6)
    )
    (bns): ModuleList(
      (0): BatchNorm1d(64, eps=1e-05, momentum=0.1, affine=True, track_running_stats=True)
    )
    (output): Identity()
  )
)
propagate done
init label
Split: 01, Run: 01, Epoch: 100, Loss: 0.0000, Train: 100.00%, Valid: 66.20% Test: 64.00%
Split: 01, Run: 01
None time:  1.0292999821249396
None Run 01:
Highest Train: 100.00
Highest Valid: 66.20
  Final Train: 100.00
   Final Test: 64.10
Split: 01, Run: 02, Epoch: 100, Loss: 0.0000, Train: 100.00%, Valid: 69.00% Test: 68.80%
Split: 01, Run: 02
None time:  1.0070551191456616
None Run 02:
Highest Train: 100.00
Highest Valid: 69.00
  Final Train: 100.00
   Final Test: 68.80
Split: 01, Run: 03
None time:  0.5096084380056709
None Run 03:
Highest Train: 100.00
Highest Valid: 69.80
  Final Train: 100.00
   Final Test: 69.00
run time now: 2.5863375663757324
total time:  2.642958328826353
None All runs:
Highest Train: 100.00 ± 0.00
Highest Valid: 68.33 ± 1.89
  Final Train: 100.00 ± 0.00
   Final Test: 67.30 ± 2.77
[I 2023-06-11 23:23:26,901] Trial 39 finished with value: 68.33333587646484 and parameters: {'Fwd': 0.055579714413653517, 'K': 7, 'alpha': 0.35000000000000003, 'dropout': 0.4, 'gnnepoch': 80, 'lambda1': 0.1, 'lambda2': 4.423399782037232, 'loop': 0, 'loss': 'MSE', 'lr': 0.0018080745444032616, 'softmaxF': True, 'useGCN': False, 'weight_decay': 1.3087938715290484e-05, 'weightedloss': False}. Best is trial 10 with value: 71.20000457763672.
/home/wxy/miniconda3/lib/python3.10/site-packages/optuna/distributions.py:685: UserWarning: The distribution is specified by [0, 1.00001] and step=0.05, but the range is not divisible by `step`. It will be replaced by [0, 1.0].
  warnings.warn(
K:  8
alpha:  0.75
lr:  0.0011156938652293466
weight_decay:  5.3965552331741544e-05
dropout:  0.1
fix split and run 3 times
Data: Data(x=[3327, 3703], y=[3327], train_mask=[3327], val_mask=[3327], test_mask=[3327], adj_t=[3327, 3327, nnz=9104])
num_train tensor(120)
num_noise 0
noise: tensor(0)
data feature 3703
ALTOPT(
  (lins): Sequential(
    (0): Linear(in_features=3703, out_features=64, bias=True)
    (1): BatchNorm1d(64, eps=1e-05, momentum=0.1, affine=True, track_running_stats=True)
    (2): Dropout(p=0.1, inplace=True)
    (3): ReLU(inplace=True)
    (4): Linear(in_features=64, out_features=6, bias=True)
    (5): LogSoftmax(dim=-1)
  )
  (prop): Propagation(K=8, mode=None, lambda1=None, lambda2=None, L21=True, alpha=0.75)
  (gcn): GCN(
    (convs): ModuleList(
      (0): GCNConv(3703, 64)
      (1): GCNConv(64, 6)
    )
    (bns): ModuleList(
      (0): BatchNorm1d(64, eps=1e-05, momentum=0.1, affine=True, track_running_stats=True)
    )
    (output): LogSoftmax(dim=-1)
  )
)
propagate done
init label
Split: 01, Run: 01
None time:  0.5122954549733549
None Run 01:
Highest Train: 100.00
Highest Valid: 68.60
  Final Train: 100.00
   Final Test: 68.40
Split: 01, Run: 02
None time:  0.43555732583627105
None Run 02:
Highest Train: 100.00
Highest Valid: 63.40
  Final Train: 100.00
   Final Test: 62.80
Split: 01, Run: 03
None time:  0.5028164240065962
None Run 03:
Highest Train: 100.00
Highest Valid: 69.40
  Final Train: 100.00
   Final Test: 69.10
run time now: 1.4908177852630615
total time:  1.5475583111401647
None All runs:
Highest Train: 100.00 ± 0.00
Highest Valid: 67.13 ± 3.26
  Final Train: 100.00 ± 0.00
   Final Test: 66.77 ± 3.45
[I 2023-06-11 23:23:28,892] Trial 40 finished with value: 67.13333129882812 and parameters: {'Fwd': 0.021090734117366818, 'K': 8, 'alpha': 0.75, 'dropout': 0.1, 'gnnepoch': 30, 'lambda1': 0.45, 'lambda2': 5.83853548824832, 'loop': 1, 'loss': 'CE', 'lr': 0.0011156938652293466, 'softmaxF': True, 'useGCN': True, 'weight_decay': 5.3965552331741544e-05, 'weightedloss': True}. Best is trial 10 with value: 71.20000457763672.
/home/wxy/miniconda3/lib/python3.10/site-packages/optuna/distributions.py:685: UserWarning: The distribution is specified by [0, 1.00001] and step=0.05, but the range is not divisible by `step`. It will be replaced by [0, 1.0].
  warnings.warn(
K:  10
alpha:  1.0
lr:  0.0014775633747922121
weight_decay:  1.3684127231522182e-06
dropout:  0.4
fix split and run 3 times
Data: Data(x=[3327, 3703], y=[3327], train_mask=[3327], val_mask=[3327], test_mask=[3327], adj_t=[3327, 3327, nnz=9104])
num_train tensor(120)
num_noise 0
noise: tensor(0)
data feature 3703
ALTOPT(
  (lins): Sequential(
    (0): Linear(in_features=3703, out_features=64, bias=True)
    (1): BatchNorm1d(64, eps=1e-05, momentum=0.1, affine=True, track_running_stats=True)
    (2): Dropout(p=0.4, inplace=True)
    (3): ReLU(inplace=True)
    (4): Linear(in_features=64, out_features=6, bias=True)
    (5): LogSoftmax(dim=-1)
  )
  (prop): Propagation(K=10, mode=None, lambda1=None, lambda2=None, L21=True, alpha=1.0)
  (gcn): GCN(
    (convs): ModuleList(
      (0): GCNConv(3703, 64)
      (1): GCNConv(64, 6)
    )
    (bns): ModuleList(
      (0): BatchNorm1d(64, eps=1e-05, momentum=0.1, affine=True, track_running_stats=True)
    )
    (output): LogSoftmax(dim=-1)
  )
)
propagate done
init label
Split: 01, Run: 01
None time:  0.9079392030835152
None Run 01:
Highest Train: 100.00
Highest Valid: 71.20
  Final Train: 100.00
   Final Test: 70.00
Split: 01, Run: 02
None time:  0.9568232039455324
None Run 02:
Highest Train: 100.00
Highest Valid: 71.00
  Final Train: 100.00
   Final Test: 69.00
Split: 01, Run: 03
None time:  0.8991842670366168
None Run 03:
Highest Train: 100.00
Highest Valid: 71.20
  Final Train: 100.00
   Final Test: 69.30
run time now: 2.8087916374206543
total time:  2.854360549012199
None All runs:
Highest Train: 100.00 ± 0.00
Highest Valid: 71.13 ± 0.12
  Final Train: 100.00 ± 0.00
   Final Test: 69.43 ± 0.51
[I 2023-06-11 23:23:32,220] Trial 41 finished with value: 71.13333892822266 and parameters: {'Fwd': 0.038608299294220084, 'K': 10, 'alpha': 1.0, 'dropout': 0.4, 'gnnepoch': 100, 'lambda1': 0.35000000000000003, 'lambda2': 2.6562427119027388, 'loop': 0, 'loss': 'CE', 'lr': 0.0014775633747922121, 'softmaxF': True, 'useGCN': True, 'weight_decay': 1.3684127231522182e-06, 'weightedloss': True}. Best is trial 10 with value: 71.20000457763672.
/home/wxy/miniconda3/lib/python3.10/site-packages/optuna/distributions.py:685: UserWarning: The distribution is specified by [0, 1.00001] and step=0.05, but the range is not divisible by `step`. It will be replaced by [0, 1.0].
  warnings.warn(
K:  10
alpha:  1.0
lr:  0.002530940869305609
weight_decay:  3.6754433850689236e-06
dropout:  0.4
fix split and run 3 times
Data: Data(x=[3327, 3703], y=[3327], train_mask=[3327], val_mask=[3327], test_mask=[3327], adj_t=[3327, 3327, nnz=9104])
num_train tensor(120)
num_noise 0
noise: tensor(0)
data feature 3703
ALTOPT(
  (lins): Sequential(
    (0): Linear(in_features=3703, out_features=64, bias=True)
    (1): BatchNorm1d(64, eps=1e-05, momentum=0.1, affine=True, track_running_stats=True)
    (2): Dropout(p=0.4, inplace=True)
    (3): ReLU(inplace=True)
    (4): Linear(in_features=64, out_features=6, bias=True)
    (5): LogSoftmax(dim=-1)
  )
  (prop): Propagation(K=10, mode=None, lambda1=None, lambda2=None, L21=True, alpha=1.0)
  (gcn): GCN(
    (convs): ModuleList(
      (0): GCNConv(3703, 64)
      (1): GCNConv(64, 6)
    )
    (bns): ModuleList(
      (0): BatchNorm1d(64, eps=1e-05, momentum=0.1, affine=True, track_running_stats=True)
    )
    (output): LogSoftmax(dim=-1)
  )
)
propagate done
init label
Split: 01, Run: 01
None time:  0.8856670369859785
None Run 01:
Highest Train: 100.00
Highest Valid: 71.00
  Final Train: 100.00
   Final Test: 69.80
Split: 01, Run: 02
None time:  0.8479498419910669
None Run 02:
Highest Train: 100.00
Highest Valid: 71.00
  Final Train: 100.00
   Final Test: 69.50
Split: 01, Run: 03
None time:  0.8845078339800239
None Run 03:
Highest Train: 100.00
Highest Valid: 71.20
  Final Train: 100.00
   Final Test: 69.00
run time now: 2.6661598682403564
total time:  2.7213636469095945
None All runs:
Highest Train: 100.00 ± 0.00
Highest Valid: 71.07 ± 0.12
  Final Train: 100.00 ± 0.00
   Final Test: 69.43 ± 0.40
[I 2023-06-11 23:23:35,363] Trial 42 finished with value: 71.0666732788086 and parameters: {'Fwd': 0.03815951414195069, 'K': 10, 'alpha': 1.0, 'dropout': 0.4, 'gnnepoch': 100, 'lambda1': 0.35000000000000003, 'lambda2': 2.6604564849175882, 'loop': 0, 'loss': 'CE', 'lr': 0.002530940869305609, 'softmaxF': True, 'useGCN': True, 'weight_decay': 3.6754433850689236e-06, 'weightedloss': True}. Best is trial 10 with value: 71.20000457763672.
/home/wxy/miniconda3/lib/python3.10/site-packages/optuna/distributions.py:685: UserWarning: The distribution is specified by [0, 1.00001] and step=0.05, but the range is not divisible by `step`. It will be replaced by [0, 1.0].
  warnings.warn(
K:  9
alpha:  0.9
lr:  0.0014772591296656346
weight_decay:  1.7563309432509368e-06
dropout:  0.5
fix split and run 3 times
Data: Data(x=[3327, 3703], y=[3327], train_mask=[3327], val_mask=[3327], test_mask=[3327], adj_t=[3327, 3327, nnz=9104])
num_train tensor(120)
num_noise 0
noise: tensor(0)
data feature 3703
ALTOPT(
  (lins): Sequential(
    (0): Linear(in_features=3703, out_features=64, bias=True)
    (1): BatchNorm1d(64, eps=1e-05, momentum=0.1, affine=True, track_running_stats=True)
    (2): Dropout(p=0.5, inplace=True)
    (3): ReLU(inplace=True)
    (4): Linear(in_features=64, out_features=6, bias=True)
    (5): LogSoftmax(dim=-1)
  )
  (prop): Propagation(K=9, mode=None, lambda1=None, lambda2=None, L21=True, alpha=0.9)
  (gcn): GCN(
    (convs): ModuleList(
      (0): GCNConv(3703, 64)
      (1): GCNConv(64, 6)
    )
    (bns): ModuleList(
      (0): BatchNorm1d(64, eps=1e-05, momentum=0.1, affine=True, track_running_stats=True)
    )
    (output): LogSoftmax(dim=-1)
  )
)
propagate done
init label
Split: 01, Run: 01
None time:  1.057078069075942
None Run 01:
Highest Train: 100.00
Highest Valid: 71.60
  Final Train: 100.00
   Final Test: 69.60
Split: 01, Run: 02
None time:  1.02357134106569
None Run 02:
Highest Train: 100.00
Highest Valid: 72.00
  Final Train: 100.00
   Final Test: 70.30
Split: 01, Run: 03
None time:  1.0434118111152202
None Run 03:
Highest Train: 100.00
Highest Valid: 71.40
  Final Train: 100.00
   Final Test: 70.00
run time now: 3.1653778553009033
total time:  3.2198388730175793
None All runs:
Highest Train: 100.00 ± 0.00
Highest Valid: 71.67 ± 0.31
  Final Train: 100.00 ± 0.00
   Final Test: 69.97 ± 0.35
[I 2023-06-11 23:23:39,005] Trial 43 finished with value: 71.66666412353516 and parameters: {'Fwd': 0.01052743512172137, 'K': 9, 'alpha': 0.9, 'dropout': 0.5, 'gnnepoch': 120, 'lambda1': 0.4, 'lambda2': 4.9179824137633865, 'loop': 0, 'loss': 'CE', 'lr': 0.0014772591296656346, 'softmaxF': True, 'useGCN': True, 'weight_decay': 1.7563309432509368e-06, 'weightedloss': True}. Best is trial 43 with value: 71.66666412353516.
/home/wxy/miniconda3/lib/python3.10/site-packages/optuna/distributions.py:685: UserWarning: The distribution is specified by [0, 1.00001] and step=0.05, but the range is not divisible by `step`. It will be replaced by [0, 1.0].
  warnings.warn(
K:  9
alpha:  0.8500000000000001
lr:  0.001617704939688715
weight_decay:  1.9727908193400475e-06
dropout:  0.7000000000000001
fix split and run 3 times
Data: Data(x=[3327, 3703], y=[3327], train_mask=[3327], val_mask=[3327], test_mask=[3327], adj_t=[3327, 3327, nnz=9104])
num_train tensor(120)
num_noise 0
noise: tensor(0)
data feature 3703
ALTOPT(
  (lins): Sequential(
    (0): Linear(in_features=3703, out_features=64, bias=True)
    (1): BatchNorm1d(64, eps=1e-05, momentum=0.1, affine=True, track_running_stats=True)
    (2): Dropout(p=0.7000000000000001, inplace=True)
    (3): ReLU(inplace=True)
    (4): Linear(in_features=64, out_features=6, bias=True)
    (5): LogSoftmax(dim=-1)
  )
  (prop): Propagation(K=9, mode=None, lambda1=None, lambda2=None, L21=True, alpha=0.8500000000000001)
  (gcn): GCN(
    (convs): ModuleList(
      (0): GCNConv(3703, 64)
      (1): GCNConv(64, 6)
    )
    (bns): ModuleList(
      (0): BatchNorm1d(64, eps=1e-05, momentum=0.1, affine=True, track_running_stats=True)
    )
    (output): LogSoftmax(dim=-1)
  )
)
propagate done
init label
Split: 01, Run: 01
None time:  0.7716667200438678
None Run 01:
Highest Train: 100.00
Highest Valid: 49.20
  Final Train: 97.50
   Final Test: 49.40
Split: 01, Run: 02
None time:  0.7522973380982876
None Run 02:
Highest Train: 100.00
Highest Valid: 52.80
  Final Train: 98.33
   Final Test: 50.60
Split: 01, Run: 03
None time:  0.866198870819062
None Run 03:
Highest Train: 100.00
Highest Valid: 53.20
  Final Train: 98.33
   Final Test: 53.10
run time now: 2.4325175285339355
total time:  2.4814847020898014
None All runs:
Highest Train: 100.00 ± 0.00
Highest Valid: 51.73 ± 2.20
  Final Train: 98.06 ± 0.48
   Final Test: 51.03 ± 1.89
