[I 2023-06-12 00:47:14,082] Trial 368 finished with value: 77.0 and parameters: {'Fwd': 9.132957929495145e-06, 'K': 10, 'alpha': 1.0, 'dropout': 0.9, 'gnnepoch': 70, 'lambda1': 0.65, 'lambda2': 4.835374021782351, 'loop': 1, 'loss': 'MSE', 'lr': 0.0028173938266088717, 'softmaxF': True, 'useGCN': True, 'weight_decay': 0.03603133796522856, 'weightedloss': False}. Best is trial 364 with value: 83.66666412353516.
/home/wxy/miniconda3/lib/python3.10/site-packages/optuna/distributions.py:685: UserWarning: The distribution is specified by [0, 1.00001] and step=0.05, but the range is not divisible by `step`. It will be replaced by [0, 1.0].
  warnings.warn(
K:  10
alpha:  0.9500000000000001
lr:  0.005676777163161523
weight_decay:  0.04129076358948502
dropout:  0.9
fix split and run 3 times
Data: Data(x=[19717, 500], y=[19717], train_mask=[19717], val_mask=[19717], test_mask=[19717], adj_t=[19717, 19717, nnz=88648])
num_train tensor(60)
num_noise 0
noise: tensor(0)
data feature 500
ALTOPT(
  (lins): Sequential(
    (0): Linear(in_features=500, out_features=64, bias=True)
    (1): BatchNorm1d(64, eps=1e-05, momentum=0.1, affine=True, track_running_stats=True)
    (2): Dropout(p=0.9, inplace=True)
    (3): ReLU(inplace=True)
    (4): Linear(in_features=64, out_features=3, bias=True)
    (5): Identity()
  )
  (prop): Propagation(K=10, mode=None, lambda1=None, lambda2=None, L21=True, alpha=0.9500000000000001)
  (gcn): GCN(
    (convs): ModuleList(
      (0): GCNConv(500, 64)
      (1): GCNConv(64, 3)
    )
    (bns): ModuleList(
      (0): BatchNorm1d(64, eps=1e-05, momentum=0.1, affine=True, track_running_stats=True)
    )
    (output): Identity()
  )
)
propagate done
init label
Split: 01, Run: 01, Epoch: 100, Loss: 0.1649, Train: 100.00%, Valid: 84.00% Test: 79.70%
Split: 01, Run: 01
None time:  3.508210245054215
None Run 01:
Highest Train: 100.00
Highest Valid: 84.20
  Final Train: 100.00
   Final Test: 79.80
Split: 01, Run: 02
None time:  1.580959104001522
None Run 02:
Highest Train: 100.00
Highest Valid: 82.00
  Final Train: 100.00
   Final Test: 79.00
Split: 01, Run: 03
None time:  1.4472725621890277
None Run 03:
Highest Train: 100.00
Highest Valid: 82.40
  Final Train: 100.00
   Final Test: 79.40
run time now: 6.594598770141602
total time:  6.6487797510344535
None All runs:
Highest Train: 100.00 ± 0.00
Highest Valid: 82.87 ± 1.17
  Final Train: 100.00 ± 0.00
   Final Test: 79.40 ± 0.40
[I 2023-06-12 00:47:21,333] Trial 369 finished with value: 82.86666870117188 and parameters: {'Fwd': 0.00014620560980772745, 'K': 10, 'alpha': 0.9500000000000001, 'dropout': 0.9, 'gnnepoch': 70, 'lambda1': 0.6000000000000001, 'lambda2': 4.282694217503462, 'loop': 1, 'loss': 'MSE', 'lr': 0.005676777163161523, 'softmaxF': True, 'useGCN': False, 'weight_decay': 0.04129076358948502, 'weightedloss': False}. Best is trial 364 with value: 83.66666412353516.
/home/wxy/miniconda3/lib/python3.10/site-packages/optuna/distributions.py:685: UserWarning: The distribution is specified by [0, 1.00001] and step=0.05, but the range is not divisible by `step`. It will be replaced by [0, 1.0].
  warnings.warn(
K:  10
alpha:  0.9500000000000001
lr:  0.0023595174335647494
weight_decay:  0.06785890186936017
dropout:  0.9
fix split and run 3 times
Data: Data(x=[19717, 500], y=[19717], train_mask=[19717], val_mask=[19717], test_mask=[19717], adj_t=[19717, 19717, nnz=88648])
num_train tensor(60)
num_noise 0
noise: tensor(0)
data feature 500
ALTOPT(
  (lins): Sequential(
    (0): Linear(in_features=500, out_features=64, bias=True)
    (1): BatchNorm1d(64, eps=1e-05, momentum=0.1, affine=True, track_running_stats=True)
    (2): Dropout(p=0.9, inplace=True)
    (3): ReLU(inplace=True)
    (4): Linear(in_features=64, out_features=3, bias=True)
    (5): Identity()
  )
  (prop): Propagation(K=10, mode=None, lambda1=None, lambda2=None, L21=True, alpha=0.9500000000000001)
  (gcn): GCN(
    (convs): ModuleList(
      (0): GCNConv(500, 64)
      (1): GCNConv(64, 3)
    )
    (bns): ModuleList(
      (0): BatchNorm1d(64, eps=1e-05, momentum=0.1, affine=True, track_running_stats=True)
    )
    (output): Identity()
  )
)
propagate done
init label
Split: 01, Run: 01
None time:  1.9307385771535337
None Run 01:
Highest Train: 100.00
Highest Valid: 82.60
  Final Train: 100.00
   Final Test: 78.20
Split: 01, Run: 02
None time:  1.7908123689703643
None Run 02:
Highest Train: 100.00
Highest Valid: 82.80
  Final Train: 100.00
   Final Test: 79.50
Split: 01, Run: 03
None time:  0.9407082789111882
None Run 03:
Highest Train: 100.00
Highest Valid: 83.40
  Final Train: 100.00
   Final Test: 79.20
run time now: 4.7142839431762695
total time:  4.759247706038877
None All runs:
Highest Train: 100.00 ± 0.00
Highest Valid: 82.93 ± 0.42
  Final Train: 100.00 ± 0.00
   Final Test: 78.97 ± 0.68
[I 2023-06-12 00:47:26,626] Trial 370 finished with value: 82.9333267211914 and parameters: {'Fwd': 2.510934531500955e-05, 'K': 10, 'alpha': 0.9500000000000001, 'dropout': 0.9, 'gnnepoch': 80, 'lambda1': 0.9, 'lambda2': 3.82230387229541, 'loop': 1, 'loss': 'MSE', 'lr': 0.0023595174335647494, 'softmaxF': True, 'useGCN': False, 'weight_decay': 0.06785890186936017, 'weightedloss': False}. Best is trial 364 with value: 83.66666412353516.
/home/wxy/miniconda3/lib/python3.10/site-packages/optuna/distributions.py:685: UserWarning: The distribution is specified by [0, 1.00001] and step=0.05, but the range is not divisible by `step`. It will be replaced by [0, 1.0].
  warnings.warn(
K:  10
alpha:  1.0
lr:  0.0023712889724894094
weight_decay:  0.06281879425026077
dropout:  0.9
fix split and run 3 times
Data: Data(x=[19717, 500], y=[19717], train_mask=[19717], val_mask=[19717], test_mask=[19717], adj_t=[19717, 19717, nnz=88648])
num_train tensor(60)
num_noise 0
noise: tensor(0)
data feature 500
ALTOPT(
  (lins): Sequential(
    (0): Linear(in_features=500, out_features=64, bias=True)
    (1): BatchNorm1d(64, eps=1e-05, momentum=0.1, affine=True, track_running_stats=True)
    (2): Dropout(p=0.9, inplace=True)
    (3): ReLU(inplace=True)
    (4): Linear(in_features=64, out_features=3, bias=True)
    (5): Identity()
  )
  (prop): Propagation(K=10, mode=None, lambda1=None, lambda2=None, L21=True, alpha=1.0)
  (gcn): GCN(
    (convs): ModuleList(
      (0): GCNConv(500, 64)
      (1): GCNConv(64, 3)
    )
    (bns): ModuleList(
      (0): BatchNorm1d(64, eps=1e-05, momentum=0.1, affine=True, track_running_stats=True)
    )
    (output): Identity()
  )
)
propagate done
init label
Split: 01, Run: 01, Epoch: 100, Loss: 0.2759, Train: 100.00%, Valid: 82.40% Test: 79.60%
Split: 01, Run: 01
None time:  4.028347173007205
None Run 01:
Highest Train: 100.00
Highest Valid: 82.40
  Final Train: 100.00
   Final Test: 79.60
Split: 01, Run: 02, Epoch: 100, Loss: 0.1654, Train: 100.00%, Valid: 80.20% Test: 79.00%
Split: 01, Run: 02
None time:  3.8491952989716083
None Run 02:
Highest Train: 100.00
Highest Valid: 80.40
  Final Train: 100.00
   Final Test: 79.30
Split: 01, Run: 03
None time:  3.2360024119261652
None Run 03:
Highest Train: 100.00
Highest Valid: 81.20
  Final Train: 100.00
   Final Test: 79.30
run time now: 11.185846328735352
total time:  11.233341126935557
None All runs:
Highest Train: 100.00 ± 0.00
Highest Valid: 81.33 ± 1.01
  Final Train: 100.00 ± 0.00
   Final Test: 79.40 ± 0.17
[I 2023-06-12 00:47:38,467] Trial 371 finished with value: 81.33333587646484 and parameters: {'Fwd': 1.312056996423734e-05, 'K': 10, 'alpha': 1.0, 'dropout': 0.9, 'gnnepoch': 80, 'lambda1': 0.9500000000000001, 'lambda2': 3.2046222455244178, 'loop': 1, 'loss': 'MSE', 'lr': 0.0023712889724894094, 'softmaxF': True, 'useGCN': False, 'weight_decay': 0.06281879425026077, 'weightedloss': False}. Best is trial 364 with value: 83.66666412353516.
/home/wxy/miniconda3/lib/python3.10/site-packages/optuna/distributions.py:685: UserWarning: The distribution is specified by [0, 1.00001] and step=0.05, but the range is not divisible by `step`. It will be replaced by [0, 1.0].
  warnings.warn(
K:  10
alpha:  0.9500000000000001
lr:  0.0021988834505839187
weight_decay:  0.029920144600812493
dropout:  0.8
fix split and run 3 times
Data: Data(x=[19717, 500], y=[19717], train_mask=[19717], val_mask=[19717], test_mask=[19717], adj_t=[19717, 19717, nnz=88648])
num_train tensor(60)
num_noise 0
noise: tensor(0)
data feature 500
ALTOPT(
  (lins): Sequential(
    (0): Linear(in_features=500, out_features=64, bias=True)
    (1): BatchNorm1d(64, eps=1e-05, momentum=0.1, affine=True, track_running_stats=True)
    (2): Dropout(p=0.8, inplace=True)
    (3): ReLU(inplace=True)
    (4): Linear(in_features=64, out_features=3, bias=True)
    (5): Identity()
  )
  (prop): Propagation(K=10, mode=None, lambda1=None, lambda2=None, L21=True, alpha=0.9500000000000001)
  (gcn): GCN(
    (convs): ModuleList(
      (0): GCNConv(500, 64)
      (1): GCNConv(64, 3)
    )
    (bns): ModuleList(
      (0): BatchNorm1d(64, eps=1e-05, momentum=0.1, affine=True, track_running_stats=True)
    )
    (output): Identity()
  )
)
propagate done
init label
Split: 01, Run: 01
None time:  2.106818008935079
None Run 01:
Highest Train: 100.00
Highest Valid: 81.40
  Final Train: 100.00
   Final Test: 78.70
Split: 01, Run: 02
None time:  1.6912325040902942
None Run 02:
Highest Train: 100.00
Highest Valid: 82.00
  Final Train: 100.00
   Final Test: 79.20
Split: 01, Run: 03
None time:  1.697602201020345
None Run 03:
Highest Train: 100.00
Highest Valid: 82.60
  Final Train: 100.00
   Final Test: 79.90
run time now: 5.588926315307617
total time:  5.6410075118765235
None All runs:
Highest Train: 100.00 ± 0.00
Highest Valid: 82.00 ± 0.60
  Final Train: 100.00 ± 0.00
   Final Test: 79.27 ± 0.60
[I 2023-06-12 00:47:44,633] Trial 372 finished with value: 82.0 and parameters: {'Fwd': 2.746387891833546e-05, 'K': 10, 'alpha': 0.9500000000000001, 'dropout': 0.8, 'gnnepoch': 70, 'lambda1': 0.9, 'lambda2': 3.0243422873487558, 'loop': 1, 'loss': 'MSE', 'lr': 0.0021988834505839187, 'softmaxF': True, 'useGCN': False, 'weight_decay': 0.029920144600812493, 'weightedloss': False}. Best is trial 364 with value: 83.66666412353516.
/home/wxy/miniconda3/lib/python3.10/site-packages/optuna/distributions.py:685: UserWarning: The distribution is specified by [0, 1.00001] and step=0.05, but the range is not divisible by `step`. It will be replaced by [0, 1.0].
  warnings.warn(
K:  9
alpha:  0.9500000000000001
lr:  0.0024762019466970063
weight_decay:  0.033461414884098005
dropout:  0.9
fix split and run 3 times
Data: Data(x=[19717, 500], y=[19717], train_mask=[19717], val_mask=[19717], test_mask=[19717], adj_t=[19717, 19717, nnz=88648])
num_train tensor(60)
num_noise 0
noise: tensor(0)
data feature 500
ALTOPT(
  (lins): Sequential(
    (0): Linear(in_features=500, out_features=64, bias=True)
    (1): BatchNorm1d(64, eps=1e-05, momentum=0.1, affine=True, track_running_stats=True)
    (2): Dropout(p=0.9, inplace=True)
    (3): ReLU(inplace=True)
    (4): Linear(in_features=64, out_features=3, bias=True)
    (5): Identity()
  )
  (prop): Propagation(K=9, mode=None, lambda1=None, lambda2=None, L21=True, alpha=0.9500000000000001)
  (gcn): GCN(
    (convs): ModuleList(
      (0): GCNConv(500, 64)
      (1): GCNConv(64, 3)
    )
    (bns): ModuleList(
      (0): BatchNorm1d(64, eps=1e-05, momentum=0.1, affine=True, track_running_stats=True)
    )
    (output): Identity()
  )
)
propagate done
init label
Split: 01, Run: 01
None time:  1.8056714048143476
None Run 01:
Highest Train: 100.00
Highest Valid: 83.00
  Final Train: 100.00
   Final Test: 79.90
Split: 01, Run: 02
None time:  1.4891695270780474
None Run 02:
Highest Train: 100.00
Highest Valid: 83.60
  Final Train: 100.00
   Final Test: 79.60
Split: 01, Run: 03
None time:  1.6396722991485149
None Run 03:
Highest Train: 100.00
Highest Valid: 81.20
  Final Train: 100.00
   Final Test: 79.90
run time now: 4.9852070808410645
total time:  5.030649023130536
None All runs:
Highest Train: 100.00 ± 0.00
Highest Valid: 82.60 ± 1.25
  Final Train: 100.00 ± 0.00
   Final Test: 79.80 ± 0.17
[I 2023-06-12 00:47:50,149] Trial 373 finished with value: 82.5999984741211 and parameters: {'Fwd': 2.2866945103382996e-05, 'K': 9, 'alpha': 0.9500000000000001, 'dropout': 0.9, 'gnnepoch': 120, 'lambda1': 0.9, 'lambda2': 3.8390069047544975, 'loop': 1, 'loss': 'MSE', 'lr': 0.0024762019466970063, 'softmaxF': True, 'useGCN': False, 'weight_decay': 0.033461414884098005, 'weightedloss': False}. Best is trial 364 with value: 83.66666412353516.
/home/wxy/miniconda3/lib/python3.10/site-packages/optuna/distributions.py:685: UserWarning: The distribution is specified by [0, 1.00001] and step=0.05, but the range is not divisible by `step`. It will be replaced by [0, 1.0].
  warnings.warn(
K:  10
alpha:  1.0
lr:  0.002050937010679892
weight_decay:  0.07540925420447812
dropout:  0.9
fix split and run 3 times
Data: Data(x=[19717, 500], y=[19717], train_mask=[19717], val_mask=[19717], test_mask=[19717], adj_t=[19717, 19717, nnz=88648])
num_train tensor(60)
num_noise 0
noise: tensor(0)
data feature 500
ALTOPT(
  (lins): Sequential(
    (0): Linear(in_features=500, out_features=64, bias=True)
    (1): BatchNorm1d(64, eps=1e-05, momentum=0.1, affine=True, track_running_stats=True)
    (2): Dropout(p=0.9, inplace=True)
    (3): ReLU(inplace=True)
    (4): Linear(in_features=64, out_features=3, bias=True)
    (5): Identity()
  )
  (prop): Propagation(K=10, mode=None, lambda1=None, lambda2=None, L21=True, alpha=1.0)
  (gcn): GCN(
    (convs): ModuleList(
      (0): GCNConv(500, 64)
      (1): GCNConv(64, 3)
    )
    (bns): ModuleList(
      (0): BatchNorm1d(64, eps=1e-05, momentum=0.1, affine=True, track_running_stats=True)
    )
    (output): Identity()
  )
)
propagate done
init label
Split: 01, Run: 01
None time:  1.4305371320806444
None Run 01:
Highest Train: 100.00
Highest Valid: 82.80
  Final Train: 100.00
   Final Test: 78.80
Split: 01, Run: 02
None time:  1.3084881210234016
None Run 02:
Highest Train: 100.00
Highest Valid: 84.20
  Final Train: 100.00
   Final Test: 79.40
Split: 01, Run: 03
None time:  1.4042205100413412
None Run 03:
Highest Train: 100.00
Highest Valid: 79.40
  Final Train: 100.00
   Final Test: 78.00
run time now: 4.19636344909668
total time:  4.246273905038834
None All runs:
Highest Train: 100.00 ± 0.00
Highest Valid: 82.13 ± 2.47
  Final Train: 100.00 ± 0.00
   Final Test: 78.73 ± 0.70
[I 2023-06-12 00:47:54,899] Trial 374 finished with value: 82.13333129882812 and parameters: {'Fwd': 1.436854684085342e-05, 'K': 10, 'alpha': 1.0, 'dropout': 0.9, 'gnnepoch': 100, 'lambda1': 0.55, 'lambda2': 3.687568660065104, 'loop': 1, 'loss': 'MSE', 'lr': 0.002050937010679892, 'softmaxF': True, 'useGCN': False, 'weight_decay': 0.07540925420447812, 'weightedloss': False}. Best is trial 364 with value: 83.66666412353516.
/home/wxy/miniconda3/lib/python3.10/site-packages/optuna/distributions.py:685: UserWarning: The distribution is specified by [0, 1.00001] and step=0.05, but the range is not divisible by `step`. It will be replaced by [0, 1.0].
  warnings.warn(
K:  1
alpha:  0.9500000000000001
lr:  0.0018250020038356233
weight_decay:  0.056613184966172084
dropout:  0.9
fix split and run 3 times
Data: Data(x=[19717, 500], y=[19717], train_mask=[19717], val_mask=[19717], test_mask=[19717], adj_t=[19717, 19717, nnz=88648])
num_train tensor(60)
num_noise 0
noise: tensor(0)
data feature 500
ALTOPT(
  (lins): Sequential(
    (0): Linear(in_features=500, out_features=64, bias=True)
    (1): BatchNorm1d(64, eps=1e-05, momentum=0.1, affine=True, track_running_stats=True)
    (2): Dropout(p=0.9, inplace=True)
    (3): ReLU(inplace=True)
    (4): Linear(in_features=64, out_features=3, bias=True)
    (5): Identity()
  )
  (prop): Propagation(K=1, mode=None, lambda1=None, lambda2=None, L21=True, alpha=0.9500000000000001)
  (gcn): GCN(
    (convs): ModuleList(
      (0): GCNConv(500, 64)
      (1): GCNConv(64, 3)
    )
    (bns): ModuleList(
      (0): BatchNorm1d(64, eps=1e-05, momentum=0.1, affine=True, track_running_stats=True)
    )
    (output): Identity()
  )
)
propagate done
init label
Split: 01, Run: 01
None time:  1.9198594780173153
None Run 01:
Highest Train: 100.00
Highest Valid: 71.80
  Final Train: 100.00
   Final Test: 68.60
Split: 01, Run: 02
None time:  1.4921587680000812
None Run 02:
Highest Train: 100.00
Highest Valid: 74.80
  Final Train: 100.00
   Final Test: 72.50
Split: 01, Run: 03
None time:  1.1272943539079279
None Run 03:
Highest Train: 100.00
Highest Valid: 76.00
  Final Train: 100.00
   Final Test: 73.60
run time now: 4.57860255241394
total time:  4.6315418931189924
None All runs:
Highest Train: 100.00 ± 0.00
Highest Valid: 74.20 ± 2.16
  Final Train: 100.00 ± 0.00
   Final Test: 71.57 ± 2.63
[I 2023-06-12 00:48:00,053] Trial 375 finished with value: 74.20000457763672 and parameters: {'Fwd': 2.4198057295486597e-06, 'K': 1, 'alpha': 0.9500000000000001, 'dropout': 0.9, 'gnnepoch': 80, 'lambda1': 0.65, 'lambda2': 3.5318477547385276, 'loop': 1, 'loss': 'MSE', 'lr': 0.0018250020038356233, 'softmaxF': True, 'useGCN': False, 'weight_decay': 0.056613184966172084, 'weightedloss': False}. Best is trial 364 with value: 83.66666412353516.
/home/wxy/miniconda3/lib/python3.10/site-packages/optuna/distributions.py:685: UserWarning: The distribution is specified by [0, 1.00001] and step=0.05, but the range is not divisible by `step`. It will be replaced by [0, 1.0].
  warnings.warn(
K:  10
alpha:  0.9500000000000001
lr:  0.0023116821739975267
weight_decay:  0.045985600619332184
dropout:  0.9
fix split and run 3 times
Data: Data(x=[19717, 500], y=[19717], train_mask=[19717], val_mask=[19717], test_mask=[19717], adj_t=[19717, 19717, nnz=88648])
num_train tensor(60)
num_noise 0
noise: tensor(0)
data feature 500
ALTOPT(
  (lins): Sequential(
    (0): Linear(in_features=500, out_features=64, bias=True)
    (1): BatchNorm1d(64, eps=1e-05, momentum=0.1, affine=True, track_running_stats=True)
    (2): Dropout(p=0.9, inplace=True)
    (3): ReLU(inplace=True)
    (4): Linear(in_features=64, out_features=3, bias=True)
    (5): Identity()
  )
  (prop): Propagation(K=10, mode=None, lambda1=None, lambda2=None, L21=True, alpha=0.9500000000000001)
  (gcn): GCN(
    (convs): ModuleList(
      (0): GCNConv(500, 64)
      (1): GCNConv(64, 3)
    )
    (bns): ModuleList(
      (0): BatchNorm1d(64, eps=1e-05, momentum=0.1, affine=True, track_running_stats=True)
    )
    (output): Identity()
  )
)
propagate done
init label
Split: 01, Run: 01
None time:  2.638874016935006
None Run 01:
Highest Train: 100.00
Highest Valid: 84.00
  Final Train: 100.00
   Final Test: 78.40
Split: 01, Run: 02
None time:  1.1971975041087717
None Run 02:
Highest Train: 100.00
Highest Valid: 82.40
  Final Train: 100.00
   Final Test: 79.80
Split: 01, Run: 03
None time:  1.219466453883797
None Run 03:
Highest Train: 100.00
Highest Valid: 78.80
  Final Train: 100.00
   Final Test: 78.40
run time now: 5.105929851531982
total time:  5.160876839887351
None All runs:
Highest Train: 100.00 ± 0.00
Highest Valid: 81.73 ± 2.66
  Final Train: 100.00 ± 0.00
   Final Test: 78.87 ± 0.81
[I 2023-06-12 00:48:05,743] Trial 376 finished with value: 81.73332977294922 and parameters: {'Fwd': 0.0009324966096438396, 'K': 10, 'alpha': 0.9500000000000001, 'dropout': 0.9, 'gnnepoch': 90, 'lambda1': 0.9, 'lambda2': 2.861599135077068, 'loop': 1, 'loss': 'MSE', 'lr': 0.0023116821739975267, 'softmaxF': True, 'useGCN': False, 'weight_decay': 0.045985600619332184, 'weightedloss': False}. Best is trial 364 with value: 83.66666412353516.
/home/wxy/miniconda3/lib/python3.10/site-packages/optuna/distributions.py:685: UserWarning: The distribution is specified by [0, 1.00001] and step=0.05, but the range is not divisible by `step`. It will be replaced by [0, 1.0].
  warnings.warn(
K:  10
alpha:  1.0
lr:  0.0025061008305743856
weight_decay:  0.003997497784717511
dropout:  0.9
fix split and run 3 times
Data: Data(x=[19717, 500], y=[19717], train_mask=[19717], val_mask=[19717], test_mask=[19717], adj_t=[19717, 19717, nnz=88648])
num_train tensor(60)
num_noise 0
noise: tensor(0)
data feature 500
ALTOPT(
  (lins): Sequential(
    (0): Linear(in_features=500, out_features=64, bias=True)
    (1): BatchNorm1d(64, eps=1e-05, momentum=0.1, affine=True, track_running_stats=True)
    (2): Dropout(p=0.9, inplace=True)
    (3): ReLU(inplace=True)
    (4): Linear(in_features=64, out_features=3, bias=True)
    (5): Identity()
  )
  (prop): Propagation(K=10, mode=None, lambda1=None, lambda2=None, L21=True, alpha=1.0)
  (gcn): GCN(
    (convs): ModuleList(
      (0): GCNConv(500, 64)
      (1): GCNConv(64, 3)
    )
    (bns): ModuleList(
      (0): BatchNorm1d(64, eps=1e-05, momentum=0.1, affine=True, track_running_stats=True)
    )
    (output): Identity()
  )
)
propagate done
init label
Split: 01, Run: 01
None time:  2.1915810029022396
None Run 01:
Highest Train: 100.00
Highest Valid: 83.40
  Final Train: 100.00
   Final Test: 79.10
Split: 01, Run: 02
None time:  1.9763802108354867
None Run 02:
Highest Train: 100.00
Highest Valid: 80.60
  Final Train: 100.00
   Final Test: 79.10
Split: 01, Run: 03
None time:  1.2070210659876466
None Run 03:
Highest Train: 100.00
Highest Valid: 82.00
  Final Train: 100.00
   Final Test: 79.40
run time now: 5.425865411758423
total time:  5.473648906918243
None All runs:
Highest Train: 100.00 ± 0.00
Highest Valid: 82.00 ± 1.40
  Final Train: 100.00 ± 0.00
   Final Test: 79.20 ± 0.17
