[I 2023-06-12 00:21:55,592] Trial 88 finished with value: 81.26666259765625 and parameters: {'Fwd': 0.036794498929931224, 'K': 9, 'alpha': 0.15000000000000002, 'dropout': 0.6000000000000001, 'gnnepoch': 50, 'lambda1': 0.4, 'lambda2': 6.802396552522639, 'loop': 1, 'loss': 'CE', 'lr': 0.008385985770651746, 'softmaxF': True, 'useGCN': True, 'weight_decay': 3.737693547836208e-05, 'weightedloss': True}. Best is trial 60 with value: 81.33333587646484.
/home/wxy/miniconda3/lib/python3.10/site-packages/optuna/distributions.py:685: UserWarning: The distribution is specified by [0, 1.00001] and step=0.05, but the range is not divisible by `step`. It will be replaced by [0, 1.0].
  warnings.warn(
K:  9
alpha:  0.15000000000000002
lr:  0.009006219435232873
weight_decay:  2.311660699365624e-05
dropout:  0.5
fix split and run 3 times
Data: Data(x=[2708, 1433], y=[2708], train_mask=[2708], val_mask=[2708], test_mask=[2708], adj_t=[2708, 2708, nnz=10556])
num_train tensor(140)
num_noise 0
noise: tensor(0)
data feature 1433
ALTOPT(
  (lins): Sequential(
    (0): Linear(in_features=1433, out_features=64, bias=True)
    (1): BatchNorm1d(64, eps=1e-05, momentum=0.1, affine=True, track_running_stats=True)
    (2): Dropout(p=0.5, inplace=True)
    (3): ReLU(inplace=True)
    (4): Linear(in_features=64, out_features=7, bias=True)
    (5): LogSoftmax(dim=-1)
  )
  (prop): Propagation(K=9, mode=None, lambda1=None, lambda2=None, L21=True, alpha=0.15000000000000002)
  (gcn): GCN(
    (convs): ModuleList(
      (0): GCNConv(1433, 64)
      (1): GCNConv(64, 7)
    )
    (bns): ModuleList(
      (0): BatchNorm1d(64, eps=1e-05, momentum=0.1, affine=True, track_running_stats=True)
    )
    (output): LogSoftmax(dim=-1)
  )
)
propagate done
init label
Split: 01, Run: 01
None time:  1.2798005510121584
None Run 01:
Highest Train: 100.00
Highest Valid: 81.00
  Final Train: 100.00
   Final Test: 82.10
Split: 01, Run: 02
None time:  1.2860794779844582
None Run 02:
Highest Train: 100.00
Highest Valid: 80.20
  Final Train: 100.00
   Final Test: 81.30
Split: 01, Run: 03
None time:  1.2893749920185655
None Run 03:
Highest Train: 100.00
Highest Valid: 80.40
  Final Train: 100.00
   Final Test: 81.30
run time now: 3.8835668563842773
total time:  3.9086192611139268
None All runs:
Highest Train: 100.00 ± 0.00
Highest Valid: 80.53 ± 0.42
  Final Train: 100.00 ± 0.00
   Final Test: 81.57 ± 0.46
[I 2023-06-12 00:21:59,965] Trial 89 finished with value: 80.53333282470703 and parameters: {'Fwd': 0.03748625863610942, 'K': 9, 'alpha': 0.15000000000000002, 'dropout': 0.5, 'gnnepoch': 40, 'lambda1': 0.4, 'lambda2': 6.80465866869101, 'loop': 1, 'loss': 'CE', 'lr': 0.009006219435232873, 'softmaxF': True, 'useGCN': True, 'weight_decay': 2.311660699365624e-05, 'weightedloss': True}. Best is trial 60 with value: 81.33333587646484.
/home/wxy/miniconda3/lib/python3.10/site-packages/optuna/distributions.py:685: UserWarning: The distribution is specified by [0, 1.00001] and step=0.05, but the range is not divisible by `step`. It will be replaced by [0, 1.0].
  warnings.warn(
K:  9
alpha:  0.0
lr:  0.00834257411342016
weight_decay:  3.8178891513660434e-05
dropout:  0.5
fix split and run 3 times
Data: Data(x=[2708, 1433], y=[2708], train_mask=[2708], val_mask=[2708], test_mask=[2708], adj_t=[2708, 2708, nnz=10556])
num_train tensor(140)
num_noise 0
noise: tensor(0)
data feature 1433
ALTOPT(
  (lins): Sequential(
    (0): Linear(in_features=1433, out_features=64, bias=True)
    (1): BatchNorm1d(64, eps=1e-05, momentum=0.1, affine=True, track_running_stats=True)
    (2): Dropout(p=0.5, inplace=True)
    (3): ReLU(inplace=True)
    (4): Linear(in_features=64, out_features=7, bias=True)
    (5): LogSoftmax(dim=-1)
  )
  (prop): Propagation(K=9, mode=None, lambda1=None, lambda2=None, L21=True, alpha=0.0)
  (gcn): GCN(
    (convs): ModuleList(
      (0): GCNConv(1433, 64)
      (1): GCNConv(64, 7)
    )
    (bns): ModuleList(
      (0): BatchNorm1d(64, eps=1e-05, momentum=0.1, affine=True, track_running_stats=True)
    )
    (output): LogSoftmax(dim=-1)
  )
)
propagate done
init label
Split: 01, Run: 01
None time:  1.1954864750150591
None Run 01:
Highest Train: 100.00
Highest Valid: 80.40
  Final Train: 100.00
   Final Test: 81.40
Split: 01, Run: 02
None time:  1.585507684852928
None Run 02:
Highest Train: 100.00
Highest Valid: 80.60
  Final Train: 100.00
   Final Test: 81.00
Split: 01, Run: 03
None time:  1.0895443581975996
None Run 03:
Highest Train: 100.00
Highest Valid: 80.80
  Final Train: 100.00
   Final Test: 80.40
run time now: 3.899423122406006
total time:  3.9227419688832015
None All runs:
Highest Train: 100.00 ± 0.00
Highest Valid: 80.60 ± 0.20
  Final Train: 100.00 ± 0.00
   Final Test: 80.93 ± 0.50
[I 2023-06-12 00:22:04,436] Trial 90 finished with value: 80.5999984741211 and parameters: {'Fwd': 0.026395650248319455, 'K': 9, 'alpha': 0.0, 'dropout': 0.5, 'gnnepoch': 30, 'lambda1': 0.4, 'lambda2': 6.413879879040819, 'loop': 1, 'loss': 'CE', 'lr': 0.00834257411342016, 'softmaxF': True, 'useGCN': True, 'weight_decay': 3.8178891513660434e-05, 'weightedloss': True}. Best is trial 60 with value: 81.33333587646484.
/home/wxy/miniconda3/lib/python3.10/site-packages/optuna/distributions.py:685: UserWarning: The distribution is specified by [0, 1.00001] and step=0.05, but the range is not divisible by `step`. It will be replaced by [0, 1.0].
  warnings.warn(
K:  8
alpha:  0.05
lr:  0.005831905026024819
weight_decay:  3.502032252645555e-05
dropout:  0.6000000000000001
fix split and run 3 times
Data: Data(x=[2708, 1433], y=[2708], train_mask=[2708], val_mask=[2708], test_mask=[2708], adj_t=[2708, 2708, nnz=10556])
num_train tensor(140)
num_noise 0
noise: tensor(0)
data feature 1433
ALTOPT(
  (lins): Sequential(
    (0): Linear(in_features=1433, out_features=64, bias=True)
    (1): BatchNorm1d(64, eps=1e-05, momentum=0.1, affine=True, track_running_stats=True)
    (2): Dropout(p=0.6000000000000001, inplace=True)
    (3): ReLU(inplace=True)
    (4): Linear(in_features=64, out_features=7, bias=True)
    (5): LogSoftmax(dim=-1)
  )
  (prop): Propagation(K=8, mode=None, lambda1=None, lambda2=None, L21=True, alpha=0.05)
  (gcn): GCN(
    (convs): ModuleList(
      (0): GCNConv(1433, 64)
      (1): GCNConv(64, 7)
    )
    (bns): ModuleList(
      (0): BatchNorm1d(64, eps=1e-05, momentum=0.1, affine=True, track_running_stats=True)
    )
    (output): LogSoftmax(dim=-1)
  )
)
propagate done
init label
Split: 01, Run: 01
None time:  1.4436704760883003
None Run 01:
Highest Train: 100.00
Highest Valid: 81.00
  Final Train: 100.00
   Final Test: 82.00
Split: 01, Run: 02
None time:  1.7668851630296558
None Run 02:
Highest Train: 100.00
Highest Valid: 80.40
  Final Train: 100.00
   Final Test: 81.60
Split: 01, Run: 03
None time:  1.2675969530828297
None Run 03:
Highest Train: 100.00
Highest Valid: 81.00
  Final Train: 100.00
   Final Test: 80.90
run time now: 4.505693435668945
total time:  4.53163606999442
None All runs:
Highest Train: 100.00 ± 0.00
Highest Valid: 80.80 ± 0.35
  Final Train: 100.00 ± 0.00
   Final Test: 81.50 ± 0.56
[I 2023-06-12 00:22:09,460] Trial 91 finished with value: 80.79999542236328 and parameters: {'Fwd': 0.009798619566014227, 'K': 8, 'alpha': 0.05, 'dropout': 0.6000000000000001, 'gnnepoch': 50, 'lambda1': 0.5, 'lambda2': 6.24992369229208, 'loop': 1, 'loss': 'CE', 'lr': 0.005831905026024819, 'softmaxF': True, 'useGCN': True, 'weight_decay': 3.502032252645555e-05, 'weightedloss': True}. Best is trial 60 with value: 81.33333587646484.
/home/wxy/miniconda3/lib/python3.10/site-packages/optuna/distributions.py:685: UserWarning: The distribution is specified by [0, 1.00001] and step=0.05, but the range is not divisible by `step`. It will be replaced by [0, 1.0].
  warnings.warn(
K:  8
alpha:  0.05
lr:  0.006906987872304511
weight_decay:  1.850649484393071e-05
dropout:  0.7000000000000001
fix split and run 3 times
Data: Data(x=[2708, 1433], y=[2708], train_mask=[2708], val_mask=[2708], test_mask=[2708], adj_t=[2708, 2708, nnz=10556])
num_train tensor(140)
num_noise 0
noise: tensor(0)
data feature 1433
ALTOPT(
  (lins): Sequential(
    (0): Linear(in_features=1433, out_features=64, bias=True)
    (1): BatchNorm1d(64, eps=1e-05, momentum=0.1, affine=True, track_running_stats=True)
    (2): Dropout(p=0.7000000000000001, inplace=True)
    (3): ReLU(inplace=True)
    (4): Linear(in_features=64, out_features=7, bias=True)
    (5): LogSoftmax(dim=-1)
  )
  (prop): Propagation(K=8, mode=None, lambda1=None, lambda2=None, L21=True, alpha=0.05)
  (gcn): GCN(
    (convs): ModuleList(
      (0): GCNConv(1433, 64)
      (1): GCNConv(64, 7)
    )
    (bns): ModuleList(
      (0): BatchNorm1d(64, eps=1e-05, momentum=0.1, affine=True, track_running_stats=True)
    )
    (output): LogSoftmax(dim=-1)
  )
)
propagate done
init label
Split: 01, Run: 01
None time:  1.4416081940289587
None Run 01:
Highest Train: 100.00
Highest Valid: 80.80
  Final Train: 100.00
   Final Test: 82.00
Split: 01, Run: 02
None time:  1.5457200850360096
None Run 02:
Highest Train: 100.00
Highest Valid: 80.40
  Final Train: 100.00
   Final Test: 82.60
Split: 01, Run: 03
None time:  1.3592543550767004
None Run 03:
Highest Train: 100.00
Highest Valid: 81.20
  Final Train: 100.00
   Final Test: 81.30
run time now: 4.391847610473633
total time:  4.414611744927242
None All runs:
Highest Train: 100.00 ± 0.00
Highest Valid: 80.80 ± 0.40
  Final Train: 100.00 ± 0.00
   Final Test: 81.97 ± 0.65
[I 2023-06-12 00:22:14,404] Trial 92 finished with value: 80.80000305175781 and parameters: {'Fwd': 0.007091427241323754, 'K': 8, 'alpha': 0.05, 'dropout': 0.7000000000000001, 'gnnepoch': 50, 'lambda1': 0.5, 'lambda2': 6.196622977611006, 'loop': 1, 'loss': 'CE', 'lr': 0.006906987872304511, 'softmaxF': True, 'useGCN': True, 'weight_decay': 1.850649484393071e-05, 'weightedloss': True}. Best is trial 60 with value: 81.33333587646484.
/home/wxy/miniconda3/lib/python3.10/site-packages/optuna/distributions.py:685: UserWarning: The distribution is specified by [0, 1.00001] and step=0.05, but the range is not divisible by `step`. It will be replaced by [0, 1.0].
  warnings.warn(
K:  8
alpha:  0.2
lr:  0.006791252094986616
weight_decay:  1.016862251353151e-05
dropout:  0.7000000000000001
fix split and run 3 times
Data: Data(x=[2708, 1433], y=[2708], train_mask=[2708], val_mask=[2708], test_mask=[2708], adj_t=[2708, 2708, nnz=10556])
num_train tensor(140)
num_noise 0
noise: tensor(0)
data feature 1433
ALTOPT(
  (lins): Sequential(
    (0): Linear(in_features=1433, out_features=64, bias=True)
    (1): BatchNorm1d(64, eps=1e-05, momentum=0.1, affine=True, track_running_stats=True)
    (2): Dropout(p=0.7000000000000001, inplace=True)
    (3): ReLU(inplace=True)
    (4): Linear(in_features=64, out_features=7, bias=True)
    (5): LogSoftmax(dim=-1)
  )
  (prop): Propagation(K=8, mode=None, lambda1=None, lambda2=None, L21=True, alpha=0.2)
  (gcn): GCN(
    (convs): ModuleList(
      (0): GCNConv(1433, 64)
      (1): GCNConv(64, 7)
    )
    (bns): ModuleList(
      (0): BatchNorm1d(64, eps=1e-05, momentum=0.1, affine=True, track_running_stats=True)
    )
    (output): LogSoftmax(dim=-1)
  )
)
propagate done
init label
Split: 01, Run: 01
None time:  1.4086444489657879
None Run 01:
Highest Train: 100.00
Highest Valid: 81.00
  Final Train: 100.00
   Final Test: 81.80
Split: 01, Run: 02
None time:  1.7777799319010228
None Run 02:
Highest Train: 100.00
Highest Valid: 80.40
  Final Train: 100.00
   Final Test: 82.50
Split: 01, Run: 03
None time:  1.1414419009815902
None Run 03:
Highest Train: 100.00
Highest Valid: 81.20
  Final Train: 100.00
   Final Test: 81.30
run time now: 4.355898857116699
total time:  4.383567490847781
None All runs:
Highest Train: 100.00 ± 0.00
Highest Valid: 80.87 ± 0.42
  Final Train: 100.00 ± 0.00
   Final Test: 81.87 ± 0.60
[I 2023-06-12 00:22:19,336] Trial 93 finished with value: 80.86666107177734 and parameters: {'Fwd': 0.006538202304609314, 'K': 8, 'alpha': 0.2, 'dropout': 0.7000000000000001, 'gnnepoch': 50, 'lambda1': 0.5, 'lambda2': 6.241570220941119, 'loop': 1, 'loss': 'CE', 'lr': 0.006791252094986616, 'softmaxF': True, 'useGCN': True, 'weight_decay': 1.016862251353151e-05, 'weightedloss': True}. Best is trial 60 with value: 81.33333587646484.
/home/wxy/miniconda3/lib/python3.10/site-packages/optuna/distributions.py:685: UserWarning: The distribution is specified by [0, 1.00001] and step=0.05, but the range is not divisible by `step`. It will be replaced by [0, 1.0].
  warnings.warn(
K:  8
alpha:  0.2
lr:  0.006989890264922479
weight_decay:  9.348251040236214e-06
dropout:  0.7000000000000001
fix split and run 3 times
Data: Data(x=[2708, 1433], y=[2708], train_mask=[2708], val_mask=[2708], test_mask=[2708], adj_t=[2708, 2708, nnz=10556])
num_train tensor(140)
num_noise 0
noise: tensor(0)
data feature 1433
ALTOPT(
  (lins): Sequential(
    (0): Linear(in_features=1433, out_features=64, bias=True)
    (1): BatchNorm1d(64, eps=1e-05, momentum=0.1, affine=True, track_running_stats=True)
    (2): Dropout(p=0.7000000000000001, inplace=True)
    (3): ReLU(inplace=True)
    (4): Linear(in_features=64, out_features=7, bias=True)
    (5): LogSoftmax(dim=-1)
  )
  (prop): Propagation(K=8, mode=None, lambda1=None, lambda2=None, L21=True, alpha=0.2)
  (gcn): GCN(
    (convs): ModuleList(
      (0): GCNConv(1433, 64)
      (1): GCNConv(64, 7)
    )
    (bns): ModuleList(
      (0): BatchNorm1d(64, eps=1e-05, momentum=0.1, affine=True, track_running_stats=True)
    )
    (output): LogSoftmax(dim=-1)
  )
)
propagate done
init label
Split: 01, Run: 01
None time:  1.5763323940336704
None Run 01:
Highest Train: 100.00
Highest Valid: 80.20
  Final Train: 100.00
   Final Test: 81.40
Split: 01, Run: 02
None time:  1.2914803160820156
None Run 02:
Highest Train: 100.00
Highest Valid: 80.80
  Final Train: 100.00
   Final Test: 80.80
Split: 01, Run: 03
None time:  1.588276892900467
None Run 03:
Highest Train: 100.00
Highest Valid: 80.60
  Final Train: 100.00
   Final Test: 80.50
run time now: 4.488298177719116
total time:  4.524553894996643
None All runs:
Highest Train: 100.00 ± 0.00
Highest Valid: 80.53 ± 0.31
  Final Train: 100.00 ± 0.00
   Final Test: 80.90 ± 0.46
[I 2023-06-12 00:22:24,275] Trial 94 finished with value: 80.53333282470703 and parameters: {'Fwd': 0.0019210487950838907, 'K': 8, 'alpha': 0.2, 'dropout': 0.7000000000000001, 'gnnepoch': 40, 'lambda1': 0.35000000000000003, 'lambda2': 6.085187927620487, 'loop': 1, 'loss': 'CE', 'lr': 0.006989890264922479, 'softmaxF': True, 'useGCN': True, 'weight_decay': 9.348251040236214e-06, 'weightedloss': True}. Best is trial 60 with value: 81.33333587646484.
/home/wxy/miniconda3/lib/python3.10/site-packages/optuna/distributions.py:685: UserWarning: The distribution is specified by [0, 1.00001] and step=0.05, but the range is not divisible by `step`. It will be replaced by [0, 1.0].
  warnings.warn(
K:  8
alpha:  0.15000000000000002
lr:  0.00743392780028791
weight_decay:  1.9345649358454203e-05
dropout:  0.7000000000000001
fix split and run 3 times
Data: Data(x=[2708, 1433], y=[2708], train_mask=[2708], val_mask=[2708], test_mask=[2708], adj_t=[2708, 2708, nnz=10556])
num_train tensor(140)
num_noise 0
noise: tensor(0)
data feature 1433
ALTOPT(
  (lins): Sequential(
    (0): Linear(in_features=1433, out_features=64, bias=True)
    (1): BatchNorm1d(64, eps=1e-05, momentum=0.1, affine=True, track_running_stats=True)
    (2): Dropout(p=0.7000000000000001, inplace=True)
    (3): ReLU(inplace=True)
    (4): Linear(in_features=64, out_features=7, bias=True)
    (5): LogSoftmax(dim=-1)
  )
  (prop): Propagation(K=8, mode=None, lambda1=None, lambda2=None, L21=True, alpha=0.15000000000000002)
  (gcn): GCN(
    (convs): ModuleList(
      (0): GCNConv(1433, 64)
      (1): GCNConv(64, 7)
    )
    (bns): ModuleList(
      (0): BatchNorm1d(64, eps=1e-05, momentum=0.1, affine=True, track_running_stats=True)
    )
    (output): LogSoftmax(dim=-1)
  )
)
propagate done
init label
Split: 01, Run: 01
None time:  0.9539090869948268
None Run 01:
Highest Train: 100.00
Highest Valid: 81.60
  Final Train: 100.00
   Final Test: 81.90
Split: 01, Run: 02
None time:  1.1968667039182037
None Run 02:
Highest Train: 100.00
Highest Valid: 80.80
  Final Train: 100.00
   Final Test: 81.60
Split: 01, Run: 03
None time:  1.4545832769945264
None Run 03:
Highest Train: 100.00
Highest Valid: 80.80
  Final Train: 100.00
   Final Test: 81.70
run time now: 3.6342082023620605
total time:  3.6603557281196117
None All runs:
Highest Train: 100.00 ± 0.00
Highest Valid: 81.07 ± 0.46
  Final Train: 100.00 ± 0.00
   Final Test: 81.73 ± 0.15
[I 2023-06-12 00:22:28,464] Trial 95 finished with value: 81.06666564941406 and parameters: {'Fwd': 0.0029409393776173437, 'K': 8, 'alpha': 0.15000000000000002, 'dropout': 0.7000000000000001, 'gnnepoch': 50, 'lambda1': 0.4, 'lambda2': 6.8290975242267935, 'loop': 1, 'loss': 'CE', 'lr': 0.00743392780028791, 'softmaxF': True, 'useGCN': True, 'weight_decay': 1.9345649358454203e-05, 'weightedloss': True}. Best is trial 60 with value: 81.33333587646484.
/home/wxy/miniconda3/lib/python3.10/site-packages/optuna/distributions.py:685: UserWarning: The distribution is specified by [0, 1.00001] and step=0.05, but the range is not divisible by `step`. It will be replaced by [0, 1.0].
  warnings.warn(
K:  9
alpha:  0.15000000000000002
lr:  0.00977119030174371
weight_decay:  6.217214645242523e-06
dropout:  0.7000000000000001
fix split and run 3 times
Data: Data(x=[2708, 1433], y=[2708], train_mask=[2708], val_mask=[2708], test_mask=[2708], adj_t=[2708, 2708, nnz=10556])
num_train tensor(140)
num_noise 0
noise: tensor(0)
data feature 1433
ALTOPT(
  (lins): Sequential(
    (0): Linear(in_features=1433, out_features=64, bias=True)
    (1): BatchNorm1d(64, eps=1e-05, momentum=0.1, affine=True, track_running_stats=True)
    (2): Dropout(p=0.7000000000000001, inplace=True)
    (3): ReLU(inplace=True)
    (4): Linear(in_features=64, out_features=7, bias=True)
    (5): LogSoftmax(dim=-1)
  )
  (prop): Propagation(K=9, mode=None, lambda1=None, lambda2=None, L21=True, alpha=0.15000000000000002)
  (gcn): GCN(
    (convs): ModuleList(
      (0): GCNConv(1433, 64)
      (1): GCNConv(64, 7)
    )
    (bns): ModuleList(
      (0): BatchNorm1d(64, eps=1e-05, momentum=0.1, affine=True, track_running_stats=True)
    )
    (output): LogSoftmax(dim=-1)
  )
)
propagate done
init label
Split: 01, Run: 01
None time:  0.8553555579856038
None Run 01:
Highest Train: 100.00
Highest Valid: 68.80
  Final Train: 100.00
   Final Test: 70.00
Split: 01, Run: 02
None time:  0.7371433491352946
None Run 02:
Highest Train: 100.00
Highest Valid: 75.80
  Final Train: 100.00
   Final Test: 78.50
Split: 01, Run: 03
None time:  0.9047533399425447
None Run 03:
Highest Train: 100.00
Highest Valid: 81.20
  Final Train: 100.00
   Final Test: 82.00
run time now: 2.5236656665802
total time:  2.54904513200745
None All runs:
Highest Train: 100.00 ± 0.00
Highest Valid: 75.27 ± 6.22
  Final Train: 100.00 ± 0.00
   Final Test: 76.83 ± 6.17
[I 2023-06-12 00:22:31,455] Trial 96 finished with value: 75.26667022705078 and parameters: {'Fwd': 0.0030922031165872468, 'K': 9, 'alpha': 0.15000000000000002, 'dropout': 0.7000000000000001, 'gnnepoch': 50, 'lambda1': 0.4, 'lambda2': 6.7893543908008045, 'loop': 1, 'loss': 'CE', 'lr': 0.00977119030174371, 'softmaxF': True, 'useGCN': False, 'weight_decay': 6.217214645242523e-06, 'weightedloss': True}. Best is trial 60 with value: 81.33333587646484.
/home/wxy/miniconda3/lib/python3.10/site-packages/optuna/distributions.py:685: UserWarning: The distribution is specified by [0, 1.00001] and step=0.05, but the range is not divisible by `step`. It will be replaced by [0, 1.0].
  warnings.warn(
K:  8
alpha:  0.2
lr:  0.00785447805538578
weight_decay:  1.478713832925985e-05
dropout:  0.6000000000000001
fix split and run 3 times
Data: Data(x=[2708, 1433], y=[2708], train_mask=[2708], val_mask=[2708], test_mask=[2708], adj_t=[2708, 2708, nnz=10556])
num_train tensor(140)
num_noise 0
noise: tensor(0)
data feature 1433
ALTOPT(
  (lins): Sequential(
    (0): Linear(in_features=1433, out_features=64, bias=True)
    (1): BatchNorm1d(64, eps=1e-05, momentum=0.1, affine=True, track_running_stats=True)
    (2): Dropout(p=0.6000000000000001, inplace=True)
    (3): ReLU(inplace=True)
    (4): Linear(in_features=64, out_features=7, bias=True)
    (5): LogSoftmax(dim=-1)
  )
  (prop): Propagation(K=8, mode=None, lambda1=None, lambda2=None, L21=True, alpha=0.2)
  (gcn): GCN(
    (convs): ModuleList(
      (0): GCNConv(1433, 64)
      (1): GCNConv(64, 7)
    )
    (bns): ModuleList(
      (0): BatchNorm1d(64, eps=1e-05, momentum=0.1, affine=True, track_running_stats=True)
    )
    (output): LogSoftmax(dim=-1)
  )
)
propagate done
init label
Split: 01, Run: 01
None time:  1.2802097178064287
None Run 01:
Highest Train: 100.00
Highest Valid: 81.40
  Final Train: 100.00
   Final Test: 82.20
Split: 01, Run: 02
None time:  1.433634788962081
None Run 02:
Highest Train: 100.00
Highest Valid: 80.40
  Final Train: 100.00
   Final Test: 81.10
Split: 01, Run: 03
None time:  1.3001323048956692
None Run 03:
Highest Train: 100.00
Highest Valid: 80.20
  Final Train: 100.00
   Final Test: 80.70
run time now: 4.040440559387207
total time:  4.0617912649177015
None All runs:
Highest Train: 100.00 ± 0.00
Highest Valid: 80.67 ± 0.64
  Final Train: 100.00 ± 0.00
   Final Test: 81.33 ± 0.78
