[I 2023-06-12 00:24:27,434] Trial 134 finished with value: 82.86666870117188 and parameters: {'Fwd': 1.3689557888754016e-06, 'K': 10, 'alpha': 0.9500000000000001, 'dropout': 0.9, 'gnnepoch': 60, 'lambda1': 0.55, 'lambda2': 6.158484226634603, 'loop': 1, 'loss': 'MSE', 'lr': 0.0027141686720156917, 'softmaxF': True, 'useGCN': False, 'weight_decay': 0.0012945935214960652, 'weightedloss': False}. Best is trial 132 with value: 83.0666732788086.
/home/wxy/miniconda3/lib/python3.10/site-packages/optuna/distributions.py:685: UserWarning: The distribution is specified by [0, 1.00001] and step=0.05, but the range is not divisible by `step`. It will be replaced by [0, 1.0].
  warnings.warn(
K:  10
alpha:  0.9500000000000001
lr:  0.002749233737757526
weight_decay:  0.003045803069055489
dropout:  0.9
fix split and run 3 times
Data: Data(x=[19717, 500], y=[19717], train_mask=[19717], val_mask=[19717], test_mask=[19717], adj_t=[19717, 19717, nnz=88648])
num_train tensor(60)
num_noise 0
noise: tensor(0)
data feature 500
ALTOPT(
  (lins): Sequential(
    (0): Linear(in_features=500, out_features=64, bias=True)
    (1): BatchNorm1d(64, eps=1e-05, momentum=0.1, affine=True, track_running_stats=True)
    (2): Dropout(p=0.9, inplace=True)
    (3): ReLU(inplace=True)
    (4): Linear(in_features=64, out_features=3, bias=True)
    (5): Identity()
  )
  (prop): Propagation(K=10, mode=None, lambda1=None, lambda2=None, L21=True, alpha=0.9500000000000001)
  (gcn): GCN(
    (convs): ModuleList(
      (0): GCNConv(500, 64)
      (1): GCNConv(64, 3)
    )
    (bns): ModuleList(
      (0): BatchNorm1d(64, eps=1e-05, momentum=0.1, affine=True, track_running_stats=True)
    )
    (output): Identity()
  )
)
propagate done
init label
Split: 01, Run: 01
None time:  3.3340016140136868
None Run 01:
Highest Train: 100.00
Highest Valid: 81.80
  Final Train: 100.00
   Final Test: 78.30
Split: 01, Run: 02
None time:  0.6051118629984558
None Run 02:
Highest Train: 100.00
Highest Valid: 81.40
  Final Train: 100.00
   Final Test: 79.90
Split: 01, Run: 03
None time:  2.1235179158393294
None Run 03:
Highest Train: 100.00
Highest Valid: 81.60
  Final Train: 100.00
   Final Test: 78.60
run time now: 6.11356258392334
total time:  6.160042903851718
None All runs:
Highest Train: 100.00 ± 0.00
Highest Valid: 81.60 ± 0.20
  Final Train: 100.00 ± 0.00
   Final Test: 78.93 ± 0.85
[I 2023-06-12 00:24:34,035] Trial 135 finished with value: 81.60000610351562 and parameters: {'Fwd': 1.3400780716280972e-06, 'K': 10, 'alpha': 0.9500000000000001, 'dropout': 0.9, 'gnnepoch': 60, 'lambda1': 0.55, 'lambda2': 6.144267048760141, 'loop': 1, 'loss': 'MSE', 'lr': 0.002749233737757526, 'softmaxF': True, 'useGCN': False, 'weight_decay': 0.003045803069055489, 'weightedloss': False}. Best is trial 132 with value: 83.0666732788086.
/home/wxy/miniconda3/lib/python3.10/site-packages/optuna/distributions.py:685: UserWarning: The distribution is specified by [0, 1.00001] and step=0.05, but the range is not divisible by `step`. It will be replaced by [0, 1.0].
  warnings.warn(
K:  10
alpha:  0.9500000000000001
lr:  0.0030328914585017277
weight_decay:  0.00153501013719452
dropout:  0.9
fix split and run 3 times
Data: Data(x=[19717, 500], y=[19717], train_mask=[19717], val_mask=[19717], test_mask=[19717], adj_t=[19717, 19717, nnz=88648])
num_train tensor(60)
num_noise 0
noise: tensor(0)
data feature 500
ALTOPT(
  (lins): Sequential(
    (0): Linear(in_features=500, out_features=64, bias=True)
    (1): BatchNorm1d(64, eps=1e-05, momentum=0.1, affine=True, track_running_stats=True)
    (2): Dropout(p=0.9, inplace=True)
    (3): ReLU(inplace=True)
    (4): Linear(in_features=64, out_features=3, bias=True)
    (5): Identity()
  )
  (prop): Propagation(K=10, mode=None, lambda1=None, lambda2=None, L21=True, alpha=0.9500000000000001)
  (gcn): GCN(
    (convs): ModuleList(
      (0): GCNConv(500, 64)
      (1): GCNConv(64, 3)
    )
    (bns): ModuleList(
      (0): BatchNorm1d(64, eps=1e-05, momentum=0.1, affine=True, track_running_stats=True)
    )
    (output): Identity()
  )
)
propagate done
init label
Split: 01, Run: 01
None time:  0.9274073271080852
None Run 01:
Highest Train: 100.00
Highest Valid: 69.60
  Final Train: 100.00
   Final Test: 69.50
Split: 01, Run: 02
None time:  1.645144070032984
None Run 02:
Highest Train: 100.00
Highest Valid: 83.20
  Final Train: 100.00
   Final Test: 79.20
Split: 01, Run: 03
None time:  0.985040619969368
None Run 03:
Highest Train: 100.00
Highest Valid: 84.00
  Final Train: 100.00
   Final Test: 79.90
run time now: 3.605762243270874
total time:  3.6485782340168953
None All runs:
Highest Train: 100.00 ± 0.00
Highest Valid: 78.93 ± 8.09
  Final Train: 100.00 ± 0.00
   Final Test: 76.20 ± 5.81
[I 2023-06-12 00:24:38,097] Trial 136 finished with value: 78.93333435058594 and parameters: {'Fwd': 2.2074994151638434e-06, 'K': 10, 'alpha': 0.9500000000000001, 'dropout': 0.9, 'gnnepoch': 50, 'lambda1': 0.55, 'lambda2': 5.565000092021004, 'loop': 1, 'loss': 'MSE', 'lr': 0.0030328914585017277, 'softmaxF': True, 'useGCN': False, 'weight_decay': 0.00153501013719452, 'weightedloss': False}. Best is trial 132 with value: 83.0666732788086.
/home/wxy/miniconda3/lib/python3.10/site-packages/optuna/distributions.py:685: UserWarning: The distribution is specified by [0, 1.00001] and step=0.05, but the range is not divisible by `step`. It will be replaced by [0, 1.0].
  warnings.warn(
K:  10
alpha:  0.9500000000000001
lr:  0.0035813941276803566
weight_decay:  0.001172594841629712
dropout:  0.8
fix split and run 3 times
Data: Data(x=[19717, 500], y=[19717], train_mask=[19717], val_mask=[19717], test_mask=[19717], adj_t=[19717, 19717, nnz=88648])
num_train tensor(60)
num_noise 0
noise: tensor(0)
data feature 500
ALTOPT(
  (lins): Sequential(
    (0): Linear(in_features=500, out_features=64, bias=True)
    (1): BatchNorm1d(64, eps=1e-05, momentum=0.1, affine=True, track_running_stats=True)
    (2): Dropout(p=0.8, inplace=True)
    (3): ReLU(inplace=True)
    (4): Linear(in_features=64, out_features=3, bias=True)
    (5): Identity()
  )
  (prop): Propagation(K=10, mode=None, lambda1=None, lambda2=None, L21=True, alpha=0.9500000000000001)
  (gcn): GCN(
    (convs): ModuleList(
      (0): GCNConv(500, 64)
      (1): GCNConv(64, 3)
    )
    (bns): ModuleList(
      (0): BatchNorm1d(64, eps=1e-05, momentum=0.1, affine=True, track_running_stats=True)
    )
    (output): Identity()
  )
)
propagate done
init label
Split: 01, Run: 01, Epoch: 100, Loss: 0.2082, Train: 100.00%, Valid: 82.80% Test: 79.30%
Split: 01, Run: 01
None time:  3.670277951983735
None Run 01:
Highest Train: 100.00
Highest Valid: 82.80
  Final Train: 100.00
   Final Test: 79.20
Split: 01, Run: 02
None time:  1.1014788469765335
None Run 02:
Highest Train: 100.00
Highest Valid: 81.80
  Final Train: 100.00
   Final Test: 78.20
Split: 01, Run: 03
None time:  2.212869114940986
None Run 03:
Highest Train: 100.00
Highest Valid: 81.40
  Final Train: 100.00
   Final Test: 79.20
run time now: 7.030433177947998
total time:  7.081899913959205
None All runs:
Highest Train: 100.00 ± 0.00
Highest Valid: 82.00 ± 0.72
  Final Train: 100.00 ± 0.00
   Final Test: 78.87 ± 0.58
[I 2023-06-12 00:24:45,627] Trial 137 finished with value: 82.0 and parameters: {'Fwd': 2.2700485241629117e-06, 'K': 10, 'alpha': 0.9500000000000001, 'dropout': 0.8, 'gnnepoch': 60, 'lambda1': 0.55, 'lambda2': 6.62469359424183, 'loop': 1, 'loss': 'MSE', 'lr': 0.0035813941276803566, 'softmaxF': True, 'useGCN': False, 'weight_decay': 0.001172594841629712, 'weightedloss': False}. Best is trial 132 with value: 83.0666732788086.
/home/wxy/miniconda3/lib/python3.10/site-packages/optuna/distributions.py:685: UserWarning: The distribution is specified by [0, 1.00001] and step=0.05, but the range is not divisible by `step`. It will be replaced by [0, 1.0].
  warnings.warn(
K:  10
alpha:  0.9500000000000001
lr:  0.0026784209246055023
weight_decay:  0.004387863342202339
dropout:  0.9
fix split and run 3 times
Data: Data(x=[19717, 500], y=[19717], train_mask=[19717], val_mask=[19717], test_mask=[19717], adj_t=[19717, 19717, nnz=88648])
num_train tensor(60)
num_noise 0
noise: tensor(0)
data feature 500
ALTOPT(
  (lins): Sequential(
    (0): Linear(in_features=500, out_features=64, bias=True)
    (1): BatchNorm1d(64, eps=1e-05, momentum=0.1, affine=True, track_running_stats=True)
    (2): Dropout(p=0.9, inplace=True)
    (3): ReLU(inplace=True)
    (4): Linear(in_features=64, out_features=3, bias=True)
    (5): Identity()
  )
  (prop): Propagation(K=10, mode=None, lambda1=None, lambda2=None, L21=True, alpha=0.9500000000000001)
  (gcn): GCN(
    (convs): ModuleList(
      (0): GCNConv(500, 64)
      (1): GCNConv(64, 3)
    )
    (bns): ModuleList(
      (0): BatchNorm1d(64, eps=1e-05, momentum=0.1, affine=True, track_running_stats=True)
    )
    (output): Identity()
  )
)
propagate done
init label
Split: 01, Run: 01
None time:  3.1088750429917127
None Run 01:
Highest Train: 100.00
Highest Valid: 81.80
  Final Train: 100.00
   Final Test: 78.40
Split: 01, Run: 02
None time:  2.4073473589960486
None Run 02:
Highest Train: 100.00
Highest Valid: 80.00
  Final Train: 100.00
   Final Test: 77.90
Split: 01, Run: 03
None time:  1.873252633959055
None Run 03:
Highest Train: 100.00
Highest Valid: 82.00
  Final Train: 100.00
   Final Test: 79.00
run time now: 7.440605163574219
total time:  7.49031524383463
None All runs:
Highest Train: 100.00 ± 0.00
Highest Valid: 81.27 ± 1.10
  Final Train: 100.00 ± 0.00
   Final Test: 78.43 ± 0.55
[I 2023-06-12 00:24:53,571] Trial 138 finished with value: 81.26667022705078 and parameters: {'Fwd': 1.4632135539487154e-06, 'K': 10, 'alpha': 0.9500000000000001, 'dropout': 0.9, 'gnnepoch': 60, 'lambda1': 0.5, 'lambda2': 6.815719606948659, 'loop': 1, 'loss': 'MSE', 'lr': 0.0026784209246055023, 'softmaxF': True, 'useGCN': False, 'weight_decay': 0.004387863342202339, 'weightedloss': False}. Best is trial 132 with value: 83.0666732788086.
/home/wxy/miniconda3/lib/python3.10/site-packages/optuna/distributions.py:685: UserWarning: The distribution is specified by [0, 1.00001] and step=0.05, but the range is not divisible by `step`. It will be replaced by [0, 1.0].
  warnings.warn(
K:  10
alpha:  0.9500000000000001
lr:  0.0024940011023325426
weight_decay:  0.0011206322634242166
dropout:  0.9
fix split and run 3 times
Data: Data(x=[19717, 500], y=[19717], train_mask=[19717], val_mask=[19717], test_mask=[19717], adj_t=[19717, 19717, nnz=88648])
num_train tensor(60)
num_noise 0
noise: tensor(0)
data feature 500
ALTOPT(
  (lins): Sequential(
    (0): Linear(in_features=500, out_features=64, bias=True)
    (1): BatchNorm1d(64, eps=1e-05, momentum=0.1, affine=True, track_running_stats=True)
    (2): Dropout(p=0.9, inplace=True)
    (3): ReLU(inplace=True)
    (4): Linear(in_features=64, out_features=3, bias=True)
    (5): Identity()
  )
  (prop): Propagation(K=10, mode=None, lambda1=None, lambda2=None, L21=True, alpha=0.9500000000000001)
  (gcn): GCN(
    (convs): ModuleList(
      (0): GCNConv(500, 64)
      (1): GCNConv(64, 3)
    )
    (bns): ModuleList(
      (0): BatchNorm1d(64, eps=1e-05, momentum=0.1, affine=True, track_running_stats=True)
    )
    (output): Identity()
  )
)
propagate done
init label
Split: 01, Run: 01
None time:  2.235707781976089
None Run 01:
Highest Train: 100.00
Highest Valid: 81.80
  Final Train: 100.00
   Final Test: 77.00
Split: 01, Run: 02
None time:  0.8664211509749293
None Run 02:
Highest Train: 100.00
Highest Valid: 82.60
  Final Train: 100.00
   Final Test: 79.60
Split: 01, Run: 03
None time:  1.0403553999494761
None Run 03:
Highest Train: 100.00
Highest Valid: 78.60
  Final Train: 100.00
   Final Test: 77.50
run time now: 4.190683364868164
total time:  4.2417942269239575
None All runs:
Highest Train: 100.00 ± 0.00
Highest Valid: 81.00 ± 2.12
  Final Train: 100.00 ± 0.00
   Final Test: 78.03 ± 1.38
[I 2023-06-12 00:24:58,281] Trial 139 finished with value: 81.0 and parameters: {'Fwd': 1.5017331565662377e-06, 'K': 10, 'alpha': 0.9500000000000001, 'dropout': 0.9, 'gnnepoch': 60, 'lambda1': 0.65, 'lambda2': 6.478987741943267, 'loop': 1, 'loss': 'MSE', 'lr': 0.0024940011023325426, 'softmaxF': True, 'useGCN': False, 'weight_decay': 0.0011206322634242166, 'weightedloss': False}. Best is trial 132 with value: 83.0666732788086.
/home/wxy/miniconda3/lib/python3.10/site-packages/optuna/distributions.py:685: UserWarning: The distribution is specified by [0, 1.00001] and step=0.05, but the range is not divisible by `step`. It will be replaced by [0, 1.0].
  warnings.warn(
K:  10
alpha:  0.9500000000000001
lr:  0.0021601246018823537
weight_decay:  0.003180870270019181
dropout:  0.8
fix split and run 3 times
Data: Data(x=[19717, 500], y=[19717], train_mask=[19717], val_mask=[19717], test_mask=[19717], adj_t=[19717, 19717, nnz=88648])
num_train tensor(60)
num_noise 0
noise: tensor(0)
data feature 500
ALTOPT(
  (lins): Sequential(
    (0): Linear(in_features=500, out_features=64, bias=True)
    (1): BatchNorm1d(64, eps=1e-05, momentum=0.1, affine=True, track_running_stats=True)
    (2): Dropout(p=0.8, inplace=True)
    (3): ReLU(inplace=True)
    (4): Linear(in_features=64, out_features=3, bias=True)
    (5): LogSoftmax(dim=-1)
  )
  (prop): Propagation(K=10, mode=None, lambda1=None, lambda2=None, L21=True, alpha=0.9500000000000001)
  (gcn): GCN(
    (convs): ModuleList(
      (0): GCNConv(500, 64)
      (1): GCNConv(64, 3)
    )
    (bns): ModuleList(
      (0): BatchNorm1d(64, eps=1e-05, momentum=0.1, affine=True, track_running_stats=True)
    )
    (output): LogSoftmax(dim=-1)
  )
)
propagate done
init label
Split: 01, Run: 01
None time:  0.9451978160068393
None Run 01:
Highest Train: 100.00
Highest Valid: 71.40
  Final Train: 100.00
   Final Test: 71.00
Split: 01, Run: 02
None time:  0.9003547711763531
None Run 02:
Highest Train: 100.00
Highest Valid: 79.00
  Final Train: 100.00
   Final Test: 77.10
Split: 01, Run: 03
None time:  1.0953491111285985
None Run 03:
Highest Train: 100.00
Highest Valid: 80.00
  Final Train: 96.67
   Final Test: 79.30
run time now: 2.9903223514556885
total time:  3.0340364479925483
None All runs:
Highest Train: 100.00 ± 0.00
Highest Valid: 76.80 ± 4.70
  Final Train: 98.89 ± 1.92
   Final Test: 75.80 ± 4.30
[I 2023-06-12 00:25:01,812] Trial 140 finished with value: 76.79999542236328 and parameters: {'Fwd': 3.9854342888160416e-06, 'K': 10, 'alpha': 0.9500000000000001, 'dropout': 0.8, 'gnnepoch': 50, 'lambda1': 0.45, 'lambda2': 6.963818634085043, 'loop': 1, 'loss': 'CE', 'lr': 0.0021601246018823537, 'softmaxF': True, 'useGCN': False, 'weight_decay': 0.003180870270019181, 'weightedloss': False}. Best is trial 132 with value: 83.0666732788086.
/home/wxy/miniconda3/lib/python3.10/site-packages/optuna/distributions.py:685: UserWarning: The distribution is specified by [0, 1.00001] and step=0.05, but the range is not divisible by `step`. It will be replaced by [0, 1.0].
  warnings.warn(
K:  10
alpha:  1.0
lr:  0.003221722121058635
weight_decay:  0.001780935539061456
dropout:  0.9
fix split and run 3 times
Data: Data(x=[19717, 500], y=[19717], train_mask=[19717], val_mask=[19717], test_mask=[19717], adj_t=[19717, 19717, nnz=88648])
num_train tensor(60)
num_noise 0
noise: tensor(0)
data feature 500
ALTOPT(
  (lins): Sequential(
    (0): Linear(in_features=500, out_features=64, bias=True)
    (1): BatchNorm1d(64, eps=1e-05, momentum=0.1, affine=True, track_running_stats=True)
    (2): Dropout(p=0.9, inplace=True)
    (3): ReLU(inplace=True)
    (4): Linear(in_features=64, out_features=3, bias=True)
    (5): Identity()
  )
  (prop): Propagation(K=10, mode=None, lambda1=None, lambda2=None, L21=True, alpha=1.0)
  (gcn): GCN(
    (convs): ModuleList(
      (0): GCNConv(500, 64)
      (1): GCNConv(64, 3)
    )
    (bns): ModuleList(
      (0): BatchNorm1d(64, eps=1e-05, momentum=0.1, affine=True, track_running_stats=True)
    )
    (output): Identity()
  )
)
propagate done
init label
Split: 01, Run: 01
None time:  2.360186583828181
None Run 01:
Highest Train: 100.00
Highest Valid: 80.80
  Final Train: 100.00
   Final Test: 77.10
Split: 01, Run: 02
None time:  1.4522922509349883
None Run 02:
Highest Train: 100.00
Highest Valid: 80.60
  Final Train: 100.00
   Final Test: 78.70
Split: 01, Run: 03
None time:  1.0473004439845681
None Run 03:
Highest Train: 100.00
Highest Valid: 79.20
  Final Train: 100.00
   Final Test: 78.70
run time now: 4.908848524093628
total time:  4.960832593031228
None All runs:
Highest Train: 100.00 ± 0.00
Highest Valid: 80.20 ± 0.87
  Final Train: 100.00 ± 0.00
   Final Test: 78.17 ± 0.92
[I 2023-06-12 00:25:07,222] Trial 141 finished with value: 80.19999694824219 and parameters: {'Fwd': 1.0006961627514705e-06, 'K': 10, 'alpha': 1.0, 'dropout': 0.9, 'gnnepoch': 60, 'lambda1': 0.6000000000000001, 'lambda2': 6.195977997688103, 'loop': 1, 'loss': 'MSE', 'lr': 0.003221722121058635, 'softmaxF': True, 'useGCN': False, 'weight_decay': 0.001780935539061456, 'weightedloss': False}. Best is trial 132 with value: 83.0666732788086.
/home/wxy/miniconda3/lib/python3.10/site-packages/optuna/distributions.py:685: UserWarning: The distribution is specified by [0, 1.00001] and step=0.05, but the range is not divisible by `step`. It will be replaced by [0, 1.0].
  warnings.warn(
K:  10
alpha:  1.0
lr:  0.0029052998890376452
weight_decay:  0.002123681130706832
dropout:  0.9
fix split and run 3 times
Data: Data(x=[19717, 500], y=[19717], train_mask=[19717], val_mask=[19717], test_mask=[19717], adj_t=[19717, 19717, nnz=88648])
num_train tensor(60)
num_noise 0
noise: tensor(0)
data feature 500
ALTOPT(
  (lins): Sequential(
    (0): Linear(in_features=500, out_features=64, bias=True)
    (1): BatchNorm1d(64, eps=1e-05, momentum=0.1, affine=True, track_running_stats=True)
    (2): Dropout(p=0.9, inplace=True)
    (3): ReLU(inplace=True)
    (4): Linear(in_features=64, out_features=3, bias=True)
    (5): Identity()
  )
  (prop): Propagation(K=10, mode=None, lambda1=None, lambda2=None, L21=True, alpha=1.0)
  (gcn): GCN(
    (convs): ModuleList(
      (0): GCNConv(500, 64)
      (1): GCNConv(64, 3)
    )
    (bns): ModuleList(
      (0): BatchNorm1d(64, eps=1e-05, momentum=0.1, affine=True, track_running_stats=True)
    )
    (output): Identity()
  )
)
propagate done
init label
Split: 01, Run: 01
None time:  1.8889553339686245
None Run 01:
Highest Train: 100.00
Highest Valid: 81.80
  Final Train: 100.00
   Final Test: 76.10
Split: 01, Run: 02
None time:  1.8773875879123807
None Run 02:
Highest Train: 100.00
Highest Valid: 83.00
  Final Train: 100.00
   Final Test: 79.70
Split: 01, Run: 03, Epoch: 100, Loss: 0.1312, Train: 100.00%, Valid: 82.00% Test: 79.50%
Split: 01, Run: 03
None time:  3.7728588900063187
None Run 03:
Highest Train: 100.00
Highest Valid: 82.20
  Final Train: 100.00
   Final Test: 79.60
run time now: 7.589575290679932
total time:  7.63313703215681
None All runs:
Highest Train: 100.00 ± 0.00
Highest Valid: 82.33 ± 0.61
  Final Train: 100.00 ± 0.00
   Final Test: 78.47 ± 2.05
[I 2023-06-12 00:25:15,349] Trial 142 finished with value: 82.33333587646484 and parameters: {'Fwd': 2.9947252937927496e-06, 'K': 10, 'alpha': 1.0, 'dropout': 0.9, 'gnnepoch': 60, 'lambda1': 0.6000000000000001, 'lambda2': 6.45022738896133, 'loop': 1, 'loss': 'MSE', 'lr': 0.0029052998890376452, 'softmaxF': True, 'useGCN': False, 'weight_decay': 0.002123681130706832, 'weightedloss': False}. Best is trial 132 with value: 83.0666732788086.
/home/wxy/miniconda3/lib/python3.10/site-packages/optuna/distributions.py:685: UserWarning: The distribution is specified by [0, 1.00001] and step=0.05, but the range is not divisible by `step`. It will be replaced by [0, 1.0].
  warnings.warn(
K:  10
alpha:  1.0
lr:  0.0036810042447086595
weight_decay:  0.001350976466620722
dropout:  0.9
fix split and run 3 times
Data: Data(x=[19717, 500], y=[19717], train_mask=[19717], val_mask=[19717], test_mask=[19717], adj_t=[19717, 19717, nnz=88648])
num_train tensor(60)
num_noise 0
noise: tensor(0)
data feature 500
ALTOPT(
  (lins): Sequential(
    (0): Linear(in_features=500, out_features=64, bias=True)
    (1): BatchNorm1d(64, eps=1e-05, momentum=0.1, affine=True, track_running_stats=True)
    (2): Dropout(p=0.9, inplace=True)
    (3): ReLU(inplace=True)
    (4): Linear(in_features=64, out_features=3, bias=True)
    (5): Identity()
  )
  (prop): Propagation(K=10, mode=None, lambda1=None, lambda2=None, L21=True, alpha=1.0)
  (gcn): GCN(
    (convs): ModuleList(
      (0): GCNConv(500, 64)
      (1): GCNConv(64, 3)
    )
    (bns): ModuleList(
      (0): BatchNorm1d(64, eps=1e-05, momentum=0.1, affine=True, track_running_stats=True)
    )
    (output): Identity()
  )
)
propagate done
init label
Split: 01, Run: 01
None time:  0.859058832982555
None Run 01:
Highest Train: 100.00
Highest Valid: 69.60
  Final Train: 100.00
   Final Test: 69.50
Split: 01, Run: 02
None time:  1.6412655289750546
None Run 02:
Highest Train: 100.00
Highest Valid: 81.20
  Final Train: 100.00
   Final Test: 79.50
Split: 01, Run: 03
None time:  1.0374998808838427
None Run 03:
Highest Train: 100.00
Highest Valid: 82.60
  Final Train: 100.00
   Final Test: 80.30
run time now: 3.5876171588897705
total time:  3.6345912979450077
None All runs:
Highest Train: 100.00 ± 0.00
Highest Valid: 77.80 ± 7.14
  Final Train: 100.00 ± 0.00
   Final Test: 76.43 ± 6.02
