[I 2023-06-12 00:23:30,219] Trial 125 finished with value: 82.79999542236328 and parameters: {'Fwd': 1.6368170653597397e-06, 'K': 10, 'alpha': 0.9500000000000001, 'dropout': 0.9, 'gnnepoch': 60, 'lambda1': 0.55, 'lambda2': 6.801279010275, 'loop': 1, 'loss': 'MSE', 'lr': 0.002441452185777674, 'softmaxF': True, 'useGCN': False, 'weight_decay': 0.0019416933615435607, 'weightedloss': False}. Best is trial 123 with value: 82.93333435058594.
/home/wxy/miniconda3/lib/python3.10/site-packages/optuna/distributions.py:685: UserWarning: The distribution is specified by [0, 1.00001] and step=0.05, but the range is not divisible by `step`. It will be replaced by [0, 1.0].
  warnings.warn(
K:  10
alpha:  1.0
lr:  0.003021971719730041
weight_decay:  0.0057076277976919765
dropout:  0.9
fix split and run 3 times
Data: Data(x=[19717, 500], y=[19717], train_mask=[19717], val_mask=[19717], test_mask=[19717], adj_t=[19717, 19717, nnz=88648])
num_train tensor(60)
num_noise 0
noise: tensor(0)
data feature 500
ALTOPT(
  (lins): Sequential(
    (0): Linear(in_features=500, out_features=64, bias=True)
    (1): BatchNorm1d(64, eps=1e-05, momentum=0.1, affine=True, track_running_stats=True)
    (2): Dropout(p=0.9, inplace=True)
    (3): ReLU(inplace=True)
    (4): Linear(in_features=64, out_features=3, bias=True)
    (5): Identity()
  )
  (prop): Propagation(K=10, mode=None, lambda1=None, lambda2=None, L21=True, alpha=1.0)
  (gcn): GCN(
    (convs): ModuleList(
      (0): GCNConv(500, 64)
      (1): GCNConv(64, 3)
    )
    (bns): ModuleList(
      (0): BatchNorm1d(64, eps=1e-05, momentum=0.1, affine=True, track_running_stats=True)
    )
    (output): Identity()
  )
)
propagate done
init label
Split: 01, Run: 01
None time:  1.8251550057902932
None Run 01:
Highest Train: 100.00
Highest Valid: 77.00
  Final Train: 100.00
   Final Test: 74.90
Split: 01, Run: 02
None time:  2.7630536179058254
None Run 02:
Highest Train: 100.00
Highest Valid: 75.40
  Final Train: 100.00
   Final Test: 74.00
Split: 01, Run: 03
None time:  1.5957278520800173
None Run 03:
Highest Train: 100.00
Highest Valid: 75.20
  Final Train: 100.00
   Final Test: 72.70
run time now: 6.232227563858032
total time:  6.274899242911488
None All runs:
Highest Train: 100.00 ± 0.00
Highest Valid: 75.87 ± 0.99
  Final Train: 100.00 ± 0.00
   Final Test: 73.87 ± 1.11
[I 2023-06-12 00:23:36,956] Trial 126 finished with value: 75.86666107177734 and parameters: {'Fwd': 1.6773266728973353e-06, 'K': 10, 'alpha': 1.0, 'dropout': 0.9, 'gnnepoch': 50, 'lambda1': 0.55, 'lambda2': 6.7951410142237165, 'loop': 1, 'loss': 'MSE', 'lr': 0.003021971719730041, 'softmaxF': False, 'useGCN': True, 'weight_decay': 0.0057076277976919765, 'weightedloss': False}. Best is trial 123 with value: 82.93333435058594.
/home/wxy/miniconda3/lib/python3.10/site-packages/optuna/distributions.py:685: UserWarning: The distribution is specified by [0, 1.00001] and step=0.05, but the range is not divisible by `step`. It will be replaced by [0, 1.0].
  warnings.warn(
K:  10
alpha:  0.9500000000000001
lr:  0.0023288902303877316
weight_decay:  0.0018134785108208822
dropout:  0.9
fix split and run 3 times
Data: Data(x=[19717, 500], y=[19717], train_mask=[19717], val_mask=[19717], test_mask=[19717], adj_t=[19717, 19717, nnz=88648])
num_train tensor(60)
num_noise 0
noise: tensor(0)
data feature 500
ALTOPT(
  (lins): Sequential(
    (0): Linear(in_features=500, out_features=64, bias=True)
    (1): BatchNorm1d(64, eps=1e-05, momentum=0.1, affine=True, track_running_stats=True)
    (2): Dropout(p=0.9, inplace=True)
    (3): ReLU(inplace=True)
    (4): Linear(in_features=64, out_features=3, bias=True)
    (5): Identity()
  )
  (prop): Propagation(K=10, mode=None, lambda1=None, lambda2=None, L21=True, alpha=0.9500000000000001)
  (gcn): GCN(
    (convs): ModuleList(
      (0): GCNConv(500, 64)
      (1): GCNConv(64, 3)
    )
    (bns): ModuleList(
      (0): BatchNorm1d(64, eps=1e-05, momentum=0.1, affine=True, track_running_stats=True)
    )
    (output): Identity()
  )
)
propagate done
init label
Split: 01, Run: 01, Epoch: 100, Loss: 0.3673, Train: 100.00%, Valid: 82.00% Test: 78.10%
Split: 01, Run: 01
None time:  3.0588787130545825
None Run 01:
Highest Train: 100.00
Highest Valid: 82.00
  Final Train: 100.00
   Final Test: 78.10
Split: 01, Run: 02
None time:  1.4207743490114808
None Run 02:
Highest Train: 100.00
Highest Valid: 83.20
  Final Train: 100.00
   Final Test: 79.00
Split: 01, Run: 03
None time:  1.7366567358840257
None Run 03:
Highest Train: 100.00
Highest Valid: 82.40
  Final Train: 100.00
   Final Test: 79.40
run time now: 6.266732215881348
total time:  6.309862093068659
None All runs:
Highest Train: 100.00 ± 0.00
Highest Valid: 82.53 ± 0.61
  Final Train: 100.00 ± 0.00
   Final Test: 78.83 ± 0.67
[I 2023-06-12 00:23:43,751] Trial 127 finished with value: 82.53333282470703 and parameters: {'Fwd': 3.2719385004865076e-06, 'K': 10, 'alpha': 0.9500000000000001, 'dropout': 0.9, 'gnnepoch': 60, 'lambda1': 0.5, 'lambda2': 7.304315215042794, 'loop': 1, 'loss': 'MSE', 'lr': 0.0023288902303877316, 'softmaxF': True, 'useGCN': False, 'weight_decay': 0.0018134785108208822, 'weightedloss': False}. Best is trial 123 with value: 82.93333435058594.
/home/wxy/miniconda3/lib/python3.10/site-packages/optuna/distributions.py:685: UserWarning: The distribution is specified by [0, 1.00001] and step=0.05, but the range is not divisible by `step`. It will be replaced by [0, 1.0].
  warnings.warn(
K:  10
alpha:  1.0
lr:  0.0023305385855042844
weight_decay:  0.0019207897212891543
dropout:  0.9
fix split and run 3 times
Data: Data(x=[19717, 500], y=[19717], train_mask=[19717], val_mask=[19717], test_mask=[19717], adj_t=[19717, 19717, nnz=88648])
num_train tensor(60)
num_noise 0
noise: tensor(0)
data feature 500
ALTOPT(
  (lins): Sequential(
    (0): Linear(in_features=500, out_features=64, bias=True)
    (1): BatchNorm1d(64, eps=1e-05, momentum=0.1, affine=True, track_running_stats=True)
    (2): Dropout(p=0.9, inplace=True)
    (3): ReLU(inplace=True)
    (4): Linear(in_features=64, out_features=3, bias=True)
    (5): Identity()
  )
  (prop): Propagation(K=10, mode=None, lambda1=None, lambda2=None, L21=True, alpha=1.0)
  (gcn): GCN(
    (convs): ModuleList(
      (0): GCNConv(500, 64)
      (1): GCNConv(64, 3)
    )
    (bns): ModuleList(
      (0): BatchNorm1d(64, eps=1e-05, momentum=0.1, affine=True, track_running_stats=True)
    )
    (output): Identity()
  )
)
propagate done
init label
Split: 01, Run: 01, Epoch: 100, Loss: 0.3309, Train: 100.00%, Valid: 83.00% Test: 78.80%
Split: 01, Run: 01
None time:  3.304847168037668
None Run 01:
Highest Train: 100.00
Highest Valid: 83.00
  Final Train: 100.00
   Final Test: 78.40
Split: 01, Run: 02
None time:  1.7290046939160675
None Run 02:
Highest Train: 100.00
Highest Valid: 82.20
  Final Train: 100.00
   Final Test: 78.40
Split: 01, Run: 03
None time:  2.391173521988094
None Run 03:
Highest Train: 100.00
Highest Valid: 81.20
  Final Train: 100.00
   Final Test: 78.90
run time now: 7.478617906570435
total time:  7.530742364004254
None All runs:
Highest Train: 100.00 ± 0.00
Highest Valid: 82.13 ± 0.90
  Final Train: 100.00 ± 0.00
   Final Test: 78.57 ± 0.29
[I 2023-06-12 00:23:51,850] Trial 128 finished with value: 82.13333892822266 and parameters: {'Fwd': 3.2179189500037838e-06, 'K': 10, 'alpha': 1.0, 'dropout': 0.9, 'gnnepoch': 60, 'lambda1': 0.6000000000000001, 'lambda2': 6.3630102991321715, 'loop': 1, 'loss': 'MSE', 'lr': 0.0023305385855042844, 'softmaxF': True, 'useGCN': False, 'weight_decay': 0.0019207897212891543, 'weightedloss': False}. Best is trial 123 with value: 82.93333435058594.
/home/wxy/miniconda3/lib/python3.10/site-packages/optuna/distributions.py:685: UserWarning: The distribution is specified by [0, 1.00001] and step=0.05, but the range is not divisible by `step`. It will be replaced by [0, 1.0].
  warnings.warn(
K:  10
alpha:  1.0
lr:  0.002363535871042006
weight_decay:  0.0019063589969315177
dropout:  0.9
fix split and run 3 times
Data: Data(x=[19717, 500], y=[19717], train_mask=[19717], val_mask=[19717], test_mask=[19717], adj_t=[19717, 19717, nnz=88648])
num_train tensor(60)
num_noise 0
noise: tensor(0)
data feature 500
ALTOPT(
  (lins): Sequential(
    (0): Linear(in_features=500, out_features=64, bias=True)
    (1): BatchNorm1d(64, eps=1e-05, momentum=0.1, affine=True, track_running_stats=True)
    (2): Dropout(p=0.9, inplace=True)
    (3): ReLU(inplace=True)
    (4): Linear(in_features=64, out_features=3, bias=True)
    (5): Identity()
  )
  (prop): Propagation(K=10, mode=None, lambda1=None, lambda2=None, L21=True, alpha=1.0)
  (gcn): GCN(
    (convs): ModuleList(
      (0): GCNConv(500, 64)
      (1): GCNConv(64, 3)
    )
    (bns): ModuleList(
      (0): BatchNorm1d(64, eps=1e-05, momentum=0.1, affine=True, track_running_stats=True)
    )
    (output): Identity()
  )
)
propagate done
init label
Split: 01, Run: 01, Epoch: 100, Loss: 0.3288, Train: 100.00%, Valid: 83.20% Test: 79.20%
Split: 01, Run: 01
None time:  3.6124298870563507
None Run 01:
Highest Train: 100.00
Highest Valid: 83.20
  Final Train: 100.00
   Final Test: 79.20
Split: 01, Run: 02
None time:  1.2589850900694728
None Run 02:
Highest Train: 100.00
Highest Valid: 81.20
  Final Train: 100.00
   Final Test: 79.00
Split: 01, Run: 03
None time:  1.0140141169540584
None Run 03:
Highest Train: 100.00
Highest Valid: 82.00
  Final Train: 100.00
   Final Test: 79.40
run time now: 5.933771848678589
total time:  5.98273647390306
None All runs:
Highest Train: 100.00 ± 0.00
Highest Valid: 82.13 ± 1.01
  Final Train: 100.00 ± 0.00
   Final Test: 79.20 ± 0.20
[I 2023-06-12 00:23:58,303] Trial 129 finished with value: 82.13333129882812 and parameters: {'Fwd': 3.2256972167721154e-06, 'K': 10, 'alpha': 1.0, 'dropout': 0.9, 'gnnepoch': 60, 'lambda1': 0.6000000000000001, 'lambda2': 5.852063619552261, 'loop': 1, 'loss': 'MSE', 'lr': 0.002363535871042006, 'softmaxF': True, 'useGCN': False, 'weight_decay': 0.0019063589969315177, 'weightedloss': False}. Best is trial 123 with value: 82.93333435058594.
/home/wxy/miniconda3/lib/python3.10/site-packages/optuna/distributions.py:685: UserWarning: The distribution is specified by [0, 1.00001] and step=0.05, but the range is not divisible by `step`. It will be replaced by [0, 1.0].
  warnings.warn(
K:  10
alpha:  1.0
lr:  0.0033756346233859095
weight_decay:  0.0014081886873243523
dropout:  0.9
fix split and run 3 times
Data: Data(x=[19717, 500], y=[19717], train_mask=[19717], val_mask=[19717], test_mask=[19717], adj_t=[19717, 19717, nnz=88648])
num_train tensor(60)
num_noise 0
noise: tensor(0)
data feature 500
ALTOPT(
  (lins): Sequential(
    (0): Linear(in_features=500, out_features=64, bias=True)
    (1): BatchNorm1d(64, eps=1e-05, momentum=0.1, affine=True, track_running_stats=True)
    (2): Dropout(p=0.9, inplace=True)
    (3): ReLU(inplace=True)
    (4): Linear(in_features=64, out_features=3, bias=True)
    (5): Identity()
  )
  (prop): Propagation(K=10, mode=None, lambda1=None, lambda2=None, L21=True, alpha=1.0)
  (gcn): GCN(
    (convs): ModuleList(
      (0): GCNConv(500, 64)
      (1): GCNConv(64, 3)
    )
    (bns): ModuleList(
      (0): BatchNorm1d(64, eps=1e-05, momentum=0.1, affine=True, track_running_stats=True)
    )
    (output): Identity()
  )
)
propagate done
init label
Split: 01, Run: 01
None time:  0.8412905940786004
None Run 01:
Highest Train: 100.00
Highest Valid: 69.60
  Final Train: 100.00
   Final Test: 69.50
Split: 01, Run: 02
None time:  3.0789083698764443
None Run 02:
Highest Train: 100.00
Highest Valid: 79.60
  Final Train: 100.00
   Final Test: 77.20
Split: 01, Run: 03
None time:  0.9807744980789721
None Run 03:
Highest Train: 100.00
Highest Valid: 82.00
  Final Train: 100.00
   Final Test: 80.30
run time now: 4.945601940155029
total time:  4.996555625926703
None All runs:
Highest Train: 100.00 ± 0.00
Highest Valid: 77.07 ± 6.58
  Final Train: 100.00 ± 0.00
   Final Test: 75.67 ± 5.56
[I 2023-06-12 00:24:03,933] Trial 130 finished with value: 77.06666564941406 and parameters: {'Fwd': 1.0193052341770897e-06, 'K': 10, 'alpha': 1.0, 'dropout': 0.9, 'gnnepoch': 50, 'lambda1': 0.55, 'lambda2': 6.33111496848002, 'loop': 1, 'loss': 'MSE', 'lr': 0.0033756346233859095, 'softmaxF': True, 'useGCN': False, 'weight_decay': 0.0014081886873243523, 'weightedloss': False}. Best is trial 123 with value: 82.93333435058594.
/home/wxy/miniconda3/lib/python3.10/site-packages/optuna/distributions.py:685: UserWarning: The distribution is specified by [0, 1.00001] and step=0.05, but the range is not divisible by `step`. It will be replaced by [0, 1.0].
  warnings.warn(
K:  10
alpha:  1.0
lr:  0.0023360851185201567
weight_decay:  0.0019321246691799893
dropout:  0.9
fix split and run 3 times
Data: Data(x=[19717, 500], y=[19717], train_mask=[19717], val_mask=[19717], test_mask=[19717], adj_t=[19717, 19717, nnz=88648])
num_train tensor(60)
num_noise 0
noise: tensor(0)
data feature 500
ALTOPT(
  (lins): Sequential(
    (0): Linear(in_features=500, out_features=64, bias=True)
    (1): BatchNorm1d(64, eps=1e-05, momentum=0.1, affine=True, track_running_stats=True)
    (2): Dropout(p=0.9, inplace=True)
    (3): ReLU(inplace=True)
    (4): Linear(in_features=64, out_features=3, bias=True)
    (5): Identity()
  )
  (prop): Propagation(K=10, mode=None, lambda1=None, lambda2=None, L21=True, alpha=1.0)
  (gcn): GCN(
    (convs): ModuleList(
      (0): GCNConv(500, 64)
      (1): GCNConv(64, 3)
    )
    (bns): ModuleList(
      (0): BatchNorm1d(64, eps=1e-05, momentum=0.1, affine=True, track_running_stats=True)
    )
    (output): Identity()
  )
)
propagate done
init label
Split: 01, Run: 01
None time:  3.1190252490341663
None Run 01:
Highest Train: 100.00
Highest Valid: 82.60
  Final Train: 100.00
   Final Test: 78.30
Split: 01, Run: 02
None time:  1.1882058770861477
None Run 02:
Highest Train: 100.00
Highest Valid: 81.00
  Final Train: 100.00
   Final Test: 79.70
Split: 01, Run: 03
None time:  0.9623347150627524
None Run 03:
Highest Train: 100.00
Highest Valid: 80.40
  Final Train: 100.00
   Final Test: 78.20
run time now: 5.317960262298584
total time:  5.362285736948252
None All runs:
Highest Train: 100.00 ± 0.00
Highest Valid: 81.33 ± 1.14
  Final Train: 100.00 ± 0.00
   Final Test: 78.73 ± 0.84
[I 2023-06-12 00:24:09,840] Trial 131 finished with value: 81.33333587646484 and parameters: {'Fwd': 3.2355862184795818e-06, 'K': 10, 'alpha': 1.0, 'dropout': 0.9, 'gnnepoch': 60, 'lambda1': 0.6000000000000001, 'lambda2': 5.979144695064596, 'loop': 1, 'loss': 'MSE', 'lr': 0.0023360851185201567, 'softmaxF': True, 'useGCN': False, 'weight_decay': 0.0019321246691799893, 'weightedloss': False}. Best is trial 123 with value: 82.93333435058594.
/home/wxy/miniconda3/lib/python3.10/site-packages/optuna/distributions.py:685: UserWarning: The distribution is specified by [0, 1.00001] and step=0.05, but the range is not divisible by `step`. It will be replaced by [0, 1.0].
  warnings.warn(
K:  10
alpha:  0.9500000000000001
lr:  0.0025859788611708565
weight_decay:  0.0021037949756797583
dropout:  0.9
fix split and run 3 times
Data: Data(x=[19717, 500], y=[19717], train_mask=[19717], val_mask=[19717], test_mask=[19717], adj_t=[19717, 19717, nnz=88648])
num_train tensor(60)
num_noise 0
noise: tensor(0)
data feature 500
ALTOPT(
  (lins): Sequential(
    (0): Linear(in_features=500, out_features=64, bias=True)
    (1): BatchNorm1d(64, eps=1e-05, momentum=0.1, affine=True, track_running_stats=True)
    (2): Dropout(p=0.9, inplace=True)
    (3): ReLU(inplace=True)
    (4): Linear(in_features=64, out_features=3, bias=True)
    (5): Identity()
  )
  (prop): Propagation(K=10, mode=None, lambda1=None, lambda2=None, L21=True, alpha=0.9500000000000001)
  (gcn): GCN(
    (convs): ModuleList(
      (0): GCNConv(500, 64)
      (1): GCNConv(64, 3)
    )
    (bns): ModuleList(
      (0): BatchNorm1d(64, eps=1e-05, momentum=0.1, affine=True, track_running_stats=True)
    )
    (output): Identity()
  )
)
propagate done
init label
Split: 01, Run: 01
None time:  2.5067654422018677
None Run 01:
Highest Train: 100.00
Highest Valid: 82.20
  Final Train: 100.00
   Final Test: 78.00
Split: 01, Run: 02
None time:  1.0726868819911033
None Run 02:
Highest Train: 100.00
Highest Valid: 83.20
  Final Train: 100.00
   Final Test: 79.50
Split: 01, Run: 03
None time:  1.0243222480639815
None Run 03:
Highest Train: 100.00
Highest Valid: 83.80
  Final Train: 100.00
   Final Test: 80.40
run time now: 4.649686336517334
total time:  4.691202763002366
None All runs:
Highest Train: 100.00 ± 0.00
Highest Valid: 83.07 ± 0.81
  Final Train: 100.00 ± 0.00
   Final Test: 79.30 ± 1.21
[I 2023-06-12 00:24:15,130] Trial 132 finished with value: 83.0666732788086 and parameters: {'Fwd': 3.527036912991222e-06, 'K': 10, 'alpha': 0.9500000000000001, 'dropout': 0.9, 'gnnepoch': 60, 'lambda1': 0.55, 'lambda2': 5.745271387351655, 'loop': 1, 'loss': 'MSE', 'lr': 0.0025859788611708565, 'softmaxF': True, 'useGCN': False, 'weight_decay': 0.0021037949756797583, 'weightedloss': False}. Best is trial 132 with value: 83.0666732788086.
/home/wxy/miniconda3/lib/python3.10/site-packages/optuna/distributions.py:685: UserWarning: The distribution is specified by [0, 1.00001] and step=0.05, but the range is not divisible by `step`. It will be replaced by [0, 1.0].
  warnings.warn(
K:  10
alpha:  0.9500000000000001
lr:  0.0026459951061653477
weight_decay:  0.001270810154872578
dropout:  0.9
fix split and run 3 times
Data: Data(x=[19717, 500], y=[19717], train_mask=[19717], val_mask=[19717], test_mask=[19717], adj_t=[19717, 19717, nnz=88648])
num_train tensor(60)
num_noise 0
noise: tensor(0)
data feature 500
ALTOPT(
  (lins): Sequential(
    (0): Linear(in_features=500, out_features=64, bias=True)
    (1): BatchNorm1d(64, eps=1e-05, momentum=0.1, affine=True, track_running_stats=True)
    (2): Dropout(p=0.9, inplace=True)
    (3): ReLU(inplace=True)
    (4): Linear(in_features=64, out_features=3, bias=True)
    (5): Identity()
  )
  (prop): Propagation(K=10, mode=None, lambda1=None, lambda2=None, L21=True, alpha=0.9500000000000001)
  (gcn): GCN(
    (convs): ModuleList(
      (0): GCNConv(500, 64)
      (1): GCNConv(64, 3)
    )
    (bns): ModuleList(
      (0): BatchNorm1d(64, eps=1e-05, momentum=0.1, affine=True, track_running_stats=True)
    )
    (output): Identity()
  )
)
propagate done
init label
Split: 01, Run: 01
None time:  2.5566820800304413
None Run 01:
Highest Train: 100.00
Highest Valid: 82.00
  Final Train: 100.00
   Final Test: 78.20
Split: 01, Run: 02
None time:  1.4410174218937755
None Run 02:
Highest Train: 100.00
Highest Valid: 82.00
  Final Train: 100.00
   Final Test: 80.20
Split: 01, Run: 03
None time:  1.5461268560029566
None Run 03:
Highest Train: 100.00
Highest Valid: 83.20
  Final Train: 100.00
   Final Test: 80.50
run time now: 5.593431711196899
total time:  5.651350884931162
None All runs:
Highest Train: 100.00 ± 0.00
Highest Valid: 82.40 ± 0.69
  Final Train: 100.00 ± 0.00
   Final Test: 79.63 ± 1.25
[I 2023-06-12 00:24:21,265] Trial 133 finished with value: 82.4000015258789 and parameters: {'Fwd': 1.4845548770608016e-06, 'K': 10, 'alpha': 0.9500000000000001, 'dropout': 0.9, 'gnnepoch': 60, 'lambda1': 0.55, 'lambda2': 6.609291270739877, 'loop': 1, 'loss': 'MSE', 'lr': 0.0026459951061653477, 'softmaxF': True, 'useGCN': False, 'weight_decay': 0.001270810154872578, 'weightedloss': False}. Best is trial 132 with value: 83.0666732788086.
/home/wxy/miniconda3/lib/python3.10/site-packages/optuna/distributions.py:685: UserWarning: The distribution is specified by [0, 1.00001] and step=0.05, but the range is not divisible by `step`. It will be replaced by [0, 1.0].
  warnings.warn(
K:  10
alpha:  0.9500000000000001
lr:  0.0027141686720156917
weight_decay:  0.0012945935214960652
dropout:  0.9
fix split and run 3 times
Data: Data(x=[19717, 500], y=[19717], train_mask=[19717], val_mask=[19717], test_mask=[19717], adj_t=[19717, 19717, nnz=88648])
num_train tensor(60)
num_noise 0
noise: tensor(0)
data feature 500
ALTOPT(
  (lins): Sequential(
    (0): Linear(in_features=500, out_features=64, bias=True)
    (1): BatchNorm1d(64, eps=1e-05, momentum=0.1, affine=True, track_running_stats=True)
    (2): Dropout(p=0.9, inplace=True)
    (3): ReLU(inplace=True)
    (4): Linear(in_features=64, out_features=3, bias=True)
    (5): Identity()
  )
  (prop): Propagation(K=10, mode=None, lambda1=None, lambda2=None, L21=True, alpha=0.9500000000000001)
  (gcn): GCN(
    (convs): ModuleList(
      (0): GCNConv(500, 64)
      (1): GCNConv(64, 3)
    )
    (bns): ModuleList(
      (0): BatchNorm1d(64, eps=1e-05, momentum=0.1, affine=True, track_running_stats=True)
    )
    (output): Identity()
  )
)
propagate done
init label
Split: 01, Run: 01, Epoch: 100, Loss: 0.3384, Train: 100.00%, Valid: 81.80% Test: 78.70%
Split: 01, Run: 01
None time:  3.222014115191996
None Run 01:
Highest Train: 100.00
Highest Valid: 81.80
  Final Train: 100.00
   Final Test: 78.50
Split: 01, Run: 02
None time:  1.419754474889487
None Run 02:
Highest Train: 100.00
Highest Valid: 84.00
  Final Train: 100.00
   Final Test: 79.50
Split: 01, Run: 03
None time:  0.9886084110476077
None Run 03:
Highest Train: 100.00
Highest Valid: 82.80
  Final Train: 100.00
   Final Test: 80.30
run time now: 5.679953098297119
total time:  5.729454861953855
None All runs:
Highest Train: 100.00 ± 0.00
Highest Valid: 82.87 ± 1.10
  Final Train: 100.00 ± 0.00
   Final Test: 79.43 ± 0.90
