[I 2023-06-12 00:01:25,547] Trial 638 finished with value: 70.13333129882812 and parameters: {'Fwd': 0.00014198897442694515, 'K': 9, 'alpha': 0.65, 'dropout': 0.8, 'gnnepoch': 110, 'lambda1': 0.75, 'lambda2': 6.541054895459819, 'loop': 0, 'loss': 'CE', 'lr': 0.0011749720823417528, 'softmaxF': True, 'useGCN': True, 'weight_decay': 2.107140207386328e-05, 'weightedloss': True}. Best is trial 605 with value: 72.13333129882812.
/home/wxy/miniconda3/lib/python3.10/site-packages/optuna/distributions.py:685: UserWarning: The distribution is specified by [0, 1.00001] and step=0.05, but the range is not divisible by `step`. It will be replaced by [0, 1.0].
  warnings.warn(
K:  8
alpha:  0.75
lr:  0.001050514972675111
weight_decay:  2.9275992789598073e-05
dropout:  0.8
fix split and run 3 times
Data: Data(x=[3327, 3703], y=[3327], train_mask=[3327], val_mask=[3327], test_mask=[3327], adj_t=[3327, 3327, nnz=9104])
num_train tensor(120)
num_noise 0
noise: tensor(0)
data feature 3703
ALTOPT(
  (lins): Sequential(
    (0): Linear(in_features=3703, out_features=64, bias=True)
    (1): BatchNorm1d(64, eps=1e-05, momentum=0.1, affine=True, track_running_stats=True)
    (2): Dropout(p=0.8, inplace=True)
    (3): ReLU(inplace=True)
    (4): Linear(in_features=64, out_features=6, bias=True)
    (5): LogSoftmax(dim=-1)
  )
  (prop): Propagation(K=8, mode=None, lambda1=None, lambda2=None, L21=True, alpha=0.75)
  (gcn): GCN(
    (convs): ModuleList(
      (0): GCNConv(3703, 64)
      (1): GCNConv(64, 6)
    )
    (bns): ModuleList(
      (0): BatchNorm1d(64, eps=1e-05, momentum=0.1, affine=True, track_running_stats=True)
    )
    (output): LogSoftmax(dim=-1)
  )
)
propagate done
init label
Split: 01, Run: 01
None time:  1.1086266308557242
None Run 01:
Highest Train: 100.00
Highest Valid: 70.80
  Final Train: 100.00
   Final Test: 69.40
Split: 01, Run: 02
None time:  1.063323845854029
None Run 02:
Highest Train: 100.00
Highest Valid: 72.40
  Final Train: 100.00
   Final Test: 69.60
Split: 01, Run: 03
None time:  1.1284580379724503
None Run 03:
Highest Train: 100.00
Highest Valid: 71.40
  Final Train: 100.00
   Final Test: 70.40
run time now: 3.3409743309020996
total time:  3.3954085051082075
None All runs:
Highest Train: 100.00 ± 0.00
Highest Valid: 71.53 ± 0.81
  Final Train: 100.00 ± 0.00
   Final Test: 69.80 ± 0.53
[I 2023-06-12 00:01:29,444] Trial 639 finished with value: 71.53333282470703 and parameters: {'Fwd': 0.0034452270144264786, 'K': 8, 'alpha': 0.75, 'dropout': 0.8, 'gnnepoch': 120, 'lambda1': 0.7000000000000001, 'lambda2': 3.9131429207504382, 'loop': 0, 'loss': 'CE', 'lr': 0.001050514972675111, 'softmaxF': False, 'useGCN': True, 'weight_decay': 2.9275992789598073e-05, 'weightedloss': True}. Best is trial 605 with value: 72.13333129882812.
/home/wxy/miniconda3/lib/python3.10/site-packages/optuna/distributions.py:685: UserWarning: The distribution is specified by [0, 1.00001] and step=0.05, but the range is not divisible by `step`. It will be replaced by [0, 1.0].
  warnings.warn(
K:  8
alpha:  0.9500000000000001
lr:  0.0014662403861758272
weight_decay:  8.348530568598903e-06
dropout:  0.8
fix split and run 3 times
Data: Data(x=[3327, 3703], y=[3327], train_mask=[3327], val_mask=[3327], test_mask=[3327], adj_t=[3327, 3327, nnz=9104])
num_train tensor(120)
num_noise 0
noise: tensor(0)
data feature 3703
ALTOPT(
  (lins): Sequential(
    (0): Linear(in_features=3703, out_features=64, bias=True)
    (1): BatchNorm1d(64, eps=1e-05, momentum=0.1, affine=True, track_running_stats=True)
    (2): Dropout(p=0.8, inplace=True)
    (3): ReLU(inplace=True)
    (4): Linear(in_features=64, out_features=6, bias=True)
    (5): Identity()
  )
  (prop): Propagation(K=8, mode=None, lambda1=None, lambda2=None, L21=True, alpha=0.9500000000000001)
  (gcn): GCN(
    (convs): ModuleList(
      (0): GCNConv(3703, 64)
      (1): GCNConv(64, 6)
    )
    (bns): ModuleList(
      (0): BatchNorm1d(64, eps=1e-05, momentum=0.1, affine=True, track_running_stats=True)
    )
    (output): Identity()
  )
)
propagate done
init label
Split: 01, Run: 01, Epoch: 100, Loss: 0.0000, Train: 98.33%, Valid: 70.00% Test: 69.80%
Split: 01, Run: 01
None time:  1.799149053869769
None Run 01:
Highest Train: 100.00
Highest Valid: 70.00
  Final Train: 98.33
   Final Test: 69.80
Split: 01, Run: 02, Epoch: 100, Loss: 0.0000, Train: 98.33%, Valid: 70.20% Test: 69.70%
Split: 01, Run: 02
None time:  1.7655683720950037
None Run 02:
Highest Train: 100.00
Highest Valid: 70.20
  Final Train: 98.33
   Final Test: 69.70
Split: 01, Run: 03, Epoch: 100, Loss: 0.0000, Train: 98.33%, Valid: 69.60% Test: 69.90%
Split: 01, Run: 03
None time:  1.7716796579770744
None Run 03:
Highest Train: 100.00
Highest Valid: 69.60
  Final Train: 98.33
   Final Test: 69.80
run time now: 5.376318454742432
total time:  5.4442508039064705
None All runs:
Highest Train: 100.00 ± 0.00
Highest Valid: 69.93 ± 0.31
  Final Train: 98.33 ± 0.00
   Final Test: 69.77 ± 0.06
[I 2023-06-12 00:01:35,420] Trial 640 finished with value: 69.93334197998047 and parameters: {'Fwd': 0.001056808213291086, 'K': 8, 'alpha': 0.9500000000000001, 'dropout': 0.8, 'gnnepoch': 120, 'lambda1': 0.65, 'lambda2': 0.11652633716005312, 'loop': 0, 'loss': 'MSE', 'lr': 0.0014662403861758272, 'softmaxF': False, 'useGCN': True, 'weight_decay': 8.348530568598903e-06, 'weightedloss': True}. Best is trial 605 with value: 72.13333129882812.
/home/wxy/miniconda3/lib/python3.10/site-packages/optuna/distributions.py:685: UserWarning: The distribution is specified by [0, 1.00001] and step=0.05, but the range is not divisible by `step`. It will be replaced by [0, 1.0].
  warnings.warn(
K:  8
alpha:  0.8
lr:  0.0012403325183762254
weight_decay:  0.0004900057839731231
dropout:  0.8
fix split and run 3 times
Data: Data(x=[3327, 3703], y=[3327], train_mask=[3327], val_mask=[3327], test_mask=[3327], adj_t=[3327, 3327, nnz=9104])
num_train tensor(120)
num_noise 0
noise: tensor(0)
data feature 3703
ALTOPT(
  (lins): Sequential(
    (0): Linear(in_features=3703, out_features=64, bias=True)
    (1): BatchNorm1d(64, eps=1e-05, momentum=0.1, affine=True, track_running_stats=True)
    (2): Dropout(p=0.8, inplace=True)
    (3): ReLU(inplace=True)
    (4): Linear(in_features=64, out_features=6, bias=True)
    (5): LogSoftmax(dim=-1)
  )
  (prop): Propagation(K=8, mode=None, lambda1=None, lambda2=None, L21=True, alpha=0.8)
  (gcn): GCN(
    (convs): ModuleList(
      (0): GCNConv(3703, 64)
      (1): GCNConv(64, 6)
    )
    (bns): ModuleList(
      (0): BatchNorm1d(64, eps=1e-05, momentum=0.1, affine=True, track_running_stats=True)
    )
    (output): LogSoftmax(dim=-1)
  )
)
propagate done
init label
Split: 01, Run: 01
None time:  1.0396472429856658
None Run 01:
Highest Train: 100.00
Highest Valid: 71.60
  Final Train: 100.00
   Final Test: 69.70
Split: 01, Run: 02
None time:  1.0004211510531604
None Run 02:
Highest Train: 100.00
Highest Valid: 72.40
  Final Train: 100.00
   Final Test: 70.00
Split: 01, Run: 03
None time:  1.1316327350214124
None Run 03:
Highest Train: 100.00
Highest Valid: 71.80
  Final Train: 100.00
   Final Test: 70.60
run time now: 3.2106919288635254
total time:  3.2677198969759047
None All runs:
Highest Train: 100.00 ± 0.00
Highest Valid: 71.93 ± 0.42
  Final Train: 100.00 ± 0.00
   Final Test: 70.10 ± 0.46
[I 2023-06-12 00:01:39,164] Trial 641 finished with value: 71.93333435058594 and parameters: {'Fwd': 1.63032349691472e-05, 'K': 8, 'alpha': 0.8, 'dropout': 0.8, 'gnnepoch': 120, 'lambda1': 0.75, 'lambda2': 7.083322471578327, 'loop': 0, 'loss': 'CE', 'lr': 0.0012403325183762254, 'softmaxF': False, 'useGCN': True, 'weight_decay': 0.0004900057839731231, 'weightedloss': True}. Best is trial 605 with value: 72.13333129882812.
/home/wxy/miniconda3/lib/python3.10/site-packages/optuna/distributions.py:685: UserWarning: The distribution is specified by [0, 1.00001] and step=0.05, but the range is not divisible by `step`. It will be replaced by [0, 1.0].
  warnings.warn(
K:  8
alpha:  0.9
lr:  0.00038875968648038065
weight_decay:  0.0001676464707379403
dropout:  0.5
fix split and run 3 times
Data: Data(x=[3327, 3703], y=[3327], train_mask=[3327], val_mask=[3327], test_mask=[3327], adj_t=[3327, 3327, nnz=9104])
num_train tensor(120)
num_noise 0
noise: tensor(0)
data feature 3703
ALTOPT(
  (lins): Sequential(
    (0): Linear(in_features=3703, out_features=64, bias=True)
    (1): BatchNorm1d(64, eps=1e-05, momentum=0.1, affine=True, track_running_stats=True)
    (2): Dropout(p=0.5, inplace=True)
    (3): ReLU(inplace=True)
    (4): Linear(in_features=64, out_features=6, bias=True)
    (5): LogSoftmax(dim=-1)
  )
  (prop): Propagation(K=8, mode=None, lambda1=None, lambda2=None, L21=True, alpha=0.9)
  (gcn): GCN(
    (convs): ModuleList(
      (0): GCNConv(3703, 64)
      (1): GCNConv(64, 6)
    )
    (bns): ModuleList(
      (0): BatchNorm1d(64, eps=1e-05, momentum=0.1, affine=True, track_running_stats=True)
    )
    (output): LogSoftmax(dim=-1)
  )
)
propagate done
init label
Split: 01, Run: 01
None time:  0.9456449979916215
None Run 01:
Highest Train: 100.00
Highest Valid: 70.20
  Final Train: 100.00
   Final Test: 69.80
Split: 01, Run: 02
None time:  1.0359070498961955
None Run 02:
Highest Train: 100.00
Highest Valid: 66.80
  Final Train: 100.00
   Final Test: 65.70
Split: 01, Run: 03
None time:  0.9672357710078359
None Run 03:
Highest Train: 100.00
Highest Valid: 68.40
  Final Train: 100.00
   Final Test: 69.20
run time now: 2.989210367202759
total time:  3.042450370034203
None All runs:
Highest Train: 100.00 ± 0.00
Highest Valid: 68.47 ± 1.70
  Final Train: 100.00 ± 0.00
   Final Test: 68.23 ± 2.21
[I 2023-06-12 00:01:42,738] Trial 642 finished with value: 68.46666717529297 and parameters: {'Fwd': 2.330756803890562e-06, 'K': 8, 'alpha': 0.9, 'dropout': 0.5, 'gnnepoch': 110, 'lambda1': 0.7000000000000001, 'lambda2': 7.473648567242295, 'loop': 0, 'loss': 'CE', 'lr': 0.00038875968648038065, 'softmaxF': False, 'useGCN': True, 'weight_decay': 0.0001676464707379403, 'weightedloss': True}. Best is trial 605 with value: 72.13333129882812.
/home/wxy/miniconda3/lib/python3.10/site-packages/optuna/distributions.py:685: UserWarning: The distribution is specified by [0, 1.00001] and step=0.05, but the range is not divisible by `step`. It will be replaced by [0, 1.0].
  warnings.warn(
K:  8
alpha:  0.7000000000000001
lr:  0.00011409512265135154
weight_decay:  7.349129765706767e-05
dropout:  0.8
fix split and run 3 times
Data: Data(x=[3327, 3703], y=[3327], train_mask=[3327], val_mask=[3327], test_mask=[3327], adj_t=[3327, 3327, nnz=9104])
num_train tensor(120)
num_noise 0
noise: tensor(0)
data feature 3703
ALTOPT(
  (lins): Sequential(
    (0): Linear(in_features=3703, out_features=64, bias=True)
    (1): BatchNorm1d(64, eps=1e-05, momentum=0.1, affine=True, track_running_stats=True)
    (2): Dropout(p=0.8, inplace=True)
    (3): ReLU(inplace=True)
    (4): Linear(in_features=64, out_features=6, bias=True)
    (5): LogSoftmax(dim=-1)
  )
  (prop): Propagation(K=8, mode=None, lambda1=None, lambda2=None, L21=True, alpha=0.7000000000000001)
  (gcn): GCN(
    (convs): ModuleList(
      (0): GCNConv(3703, 64)
      (1): GCNConv(64, 6)
    )
    (bns): ModuleList(
      (0): BatchNorm1d(64, eps=1e-05, momentum=0.1, affine=True, track_running_stats=True)
    )
    (output): LogSoftmax(dim=-1)
  )
)
propagate done
init label
Split: 01, Run: 01, Epoch: 100, Loss: 0.0000, Train: 100.00%, Valid: 67.00% Test: 66.30%
Split: 01, Run: 01
None time:  1.7596421260386705
None Run 01:
Highest Train: 100.00
Highest Valid: 67.00
  Final Train: 100.00
   Final Test: 65.90
Split: 01, Run: 02
None time:  1.187579344958067
None Run 02:
Highest Train: 100.00
Highest Valid: 66.40
  Final Train: 100.00
   Final Test: 66.90
Split: 01, Run: 03, Epoch: 100, Loss: 0.0000, Train: 100.00%, Valid: 66.20% Test: 69.10%
Split: 01, Run: 03
None time:  1.8600714078638703
None Run 03:
Highest Train: 100.00
Highest Valid: 66.20
  Final Train: 100.00
   Final Test: 69.10
run time now: 4.847825765609741
total time:  4.906374684069306
None All runs:
Highest Train: 100.00 ± 0.00
Highest Valid: 66.53 ± 0.42
  Final Train: 100.00 ± 0.00
   Final Test: 67.30 ± 1.64
[I 2023-06-12 00:01:48,172] Trial 643 finished with value: 66.53333282470703 and parameters: {'Fwd': 0.06371202598325557, 'K': 8, 'alpha': 0.7000000000000001, 'dropout': 0.8, 'gnnepoch': 120, 'lambda1': 0.7000000000000001, 'lambda2': 8.572294556715578, 'loop': 0, 'loss': 'CE', 'lr': 0.00011409512265135154, 'softmaxF': False, 'useGCN': True, 'weight_decay': 7.349129765706767e-05, 'weightedloss': True}. Best is trial 605 with value: 72.13333129882812.
/home/wxy/miniconda3/lib/python3.10/site-packages/optuna/distributions.py:685: UserWarning: The distribution is specified by [0, 1.00001] and step=0.05, but the range is not divisible by `step`. It will be replaced by [0, 1.0].
  warnings.warn(
K:  8
alpha:  0.8500000000000001
lr:  0.0017753223057742327
weight_decay:  1.232362332696769e-05
dropout:  0.8
fix split and run 3 times
Data: Data(x=[3327, 3703], y=[3327], train_mask=[3327], val_mask=[3327], test_mask=[3327], adj_t=[3327, 3327, nnz=9104])
num_train tensor(120)
num_noise 0
noise: tensor(0)
data feature 3703
ALTOPT(
  (lins): Sequential(
    (0): Linear(in_features=3703, out_features=64, bias=True)
    (1): BatchNorm1d(64, eps=1e-05, momentum=0.1, affine=True, track_running_stats=True)
    (2): Dropout(p=0.8, inplace=True)
    (3): ReLU(inplace=True)
    (4): Linear(in_features=64, out_features=6, bias=True)
    (5): LogSoftmax(dim=-1)
  )
  (prop): Propagation(K=8, mode=None, lambda1=None, lambda2=None, L21=True, alpha=0.8500000000000001)
  (gcn): GCN(
    (convs): ModuleList(
      (0): GCNConv(3703, 64)
      (1): GCNConv(64, 6)
    )
    (bns): ModuleList(
      (0): BatchNorm1d(64, eps=1e-05, momentum=0.1, affine=True, track_running_stats=True)
    )
    (output): LogSoftmax(dim=-1)
  )
)
propagate done
init label
Split: 01, Run: 01
None time:  1.0378699069842696
None Run 01:
Highest Train: 100.00
Highest Valid: 70.60
  Final Train: 100.00
   Final Test: 69.80
Split: 01, Run: 02
None time:  1.155197286978364
None Run 02:
Highest Train: 100.00
Highest Valid: 71.00
  Final Train: 100.00
   Final Test: 70.90
Split: 01, Run: 03
None time:  1.035350866150111
None Run 03:
Highest Train: 100.00
Highest Valid: 71.40
  Final Train: 100.00
   Final Test: 71.30
run time now: 3.271655559539795
total time:  3.3275786859449
None All runs:
Highest Train: 100.00 ± 0.00
Highest Valid: 71.00 ± 0.40
  Final Train: 100.00 ± 0.00
   Final Test: 70.67 ± 0.78
[I 2023-06-12 00:01:52,007] Trial 644 finished with value: 71.0 and parameters: {'Fwd': 0.0006587726156746257, 'K': 8, 'alpha': 0.8500000000000001, 'dropout': 0.8, 'gnnepoch': 120, 'lambda1': 0.1, 'lambda2': 5.865161693075929, 'loop': 0, 'loss': 'CE', 'lr': 0.0017753223057742327, 'softmaxF': False, 'useGCN': True, 'weight_decay': 1.232362332696769e-05, 'weightedloss': True}. Best is trial 605 with value: 72.13333129882812.
/home/wxy/miniconda3/lib/python3.10/site-packages/optuna/distributions.py:685: UserWarning: The distribution is specified by [0, 1.00001] and step=0.05, but the range is not divisible by `step`. It will be replaced by [0, 1.0].
  warnings.warn(
K:  8
alpha:  0.8
lr:  0.0013768997673059295
weight_decay:  4.871073388186928e-05
dropout:  0.8
fix split and run 3 times
Data: Data(x=[3327, 3703], y=[3327], train_mask=[3327], val_mask=[3327], test_mask=[3327], adj_t=[3327, 3327, nnz=9104])
num_train tensor(120)
num_noise 0
noise: tensor(0)
data feature 3703
ALTOPT(
  (lins): Sequential(
    (0): Linear(in_features=3703, out_features=64, bias=True)
    (1): BatchNorm1d(64, eps=1e-05, momentum=0.1, affine=True, track_running_stats=True)
    (2): Dropout(p=0.8, inplace=True)
    (3): ReLU(inplace=True)
    (4): Linear(in_features=64, out_features=6, bias=True)
    (5): LogSoftmax(dim=-1)
  )
  (prop): Propagation(K=8, mode=None, lambda1=None, lambda2=None, L21=True, alpha=0.8)
  (gcn): GCN(
    (convs): ModuleList(
      (0): GCNConv(3703, 64)
      (1): GCNConv(64, 6)
    )
    (bns): ModuleList(
      (0): BatchNorm1d(64, eps=1e-05, momentum=0.1, affine=True, track_running_stats=True)
    )
    (output): LogSoftmax(dim=-1)
  )
)
propagate done
init label
Split: 01, Run: 01
None time:  1.0003153709694743
None Run 01:
Highest Train: 100.00
Highest Valid: 71.60
  Final Train: 100.00
   Final Test: 69.60
Split: 01, Run: 02
None time:  1.0257039130665362
None Run 02:
Highest Train: 100.00
Highest Valid: 72.20
  Final Train: 100.00
   Final Test: 69.80
Split: 01, Run: 03
None time:  1.1512241610325873
None Run 03:
Highest Train: 100.00
Highest Valid: 72.00
  Final Train: 100.00
   Final Test: 70.20
run time now: 3.2175071239471436
total time:  3.274782483931631
None All runs:
Highest Train: 100.00 ± 0.00
Highest Valid: 71.93 ± 0.31
  Final Train: 100.00 ± 0.00
   Final Test: 69.87 ± 0.31
[I 2023-06-12 00:01:55,808] Trial 645 finished with value: 71.9333267211914 and parameters: {'Fwd': 0.04778131642088943, 'K': 8, 'alpha': 0.8, 'dropout': 0.8, 'gnnepoch': 120, 'lambda1': 0.75, 'lambda2': 4.990536293255364, 'loop': 0, 'loss': 'CE', 'lr': 0.0013768997673059295, 'softmaxF': False, 'useGCN': True, 'weight_decay': 4.871073388186928e-05, 'weightedloss': True}. Best is trial 605 with value: 72.13333129882812.
/home/wxy/miniconda3/lib/python3.10/site-packages/optuna/distributions.py:685: UserWarning: The distribution is specified by [0, 1.00001] and step=0.05, but the range is not divisible by `step`. It will be replaced by [0, 1.0].
  warnings.warn(
K:  9
alpha:  0.6000000000000001
lr:  0.0011242232188930755
weight_decay:  0.00010674826062514966
dropout:  0.9
fix split and run 3 times
Data: Data(x=[3327, 3703], y=[3327], train_mask=[3327], val_mask=[3327], test_mask=[3327], adj_t=[3327, 3327, nnz=9104])
num_train tensor(120)
num_noise 0
noise: tensor(0)
data feature 3703
ALTOPT(
  (lins): Sequential(
    (0): Linear(in_features=3703, out_features=64, bias=True)
    (1): BatchNorm1d(64, eps=1e-05, momentum=0.1, affine=True, track_running_stats=True)
    (2): Dropout(p=0.9, inplace=True)
    (3): ReLU(inplace=True)
    (4): Linear(in_features=64, out_features=6, bias=True)
    (5): LogSoftmax(dim=-1)
  )
  (prop): Propagation(K=9, mode=None, lambda1=None, lambda2=None, L21=True, alpha=0.6000000000000001)
  (gcn): GCN(
    (convs): ModuleList(
      (0): GCNConv(3703, 64)
      (1): GCNConv(64, 6)
    )
    (bns): ModuleList(
      (0): BatchNorm1d(64, eps=1e-05, momentum=0.1, affine=True, track_running_stats=True)
    )
    (output): LogSoftmax(dim=-1)
  )
)
propagate done
init label
Split: 01, Run: 01
None time:  1.0412398709449917
None Run 01:
Highest Train: 100.00
Highest Valid: 70.00
  Final Train: 100.00
   Final Test: 69.10
Split: 01, Run: 02
None time:  1.0564418861176819
None Run 02:
Highest Train: 100.00
Highest Valid: 70.80
  Final Train: 100.00
   Final Test: 70.00
Split: 01, Run: 03
None time:  1.180446685058996
None Run 03:
Highest Train: 100.00
Highest Valid: 71.40
  Final Train: 100.00
   Final Test: 70.20
run time now: 3.319190740585327
total time:  3.37284879013896
None All runs:
Highest Train: 100.00 ± 0.00
Highest Valid: 70.73 ± 0.70
  Final Train: 100.00 ± 0.00
   Final Test: 69.77 ± 0.59
[I 2023-06-12 00:01:59,629] Trial 646 finished with value: 70.73333740234375 and parameters: {'Fwd': 0.023113816510910913, 'K': 9, 'alpha': 0.6000000000000001, 'dropout': 0.9, 'gnnepoch': 120, 'lambda1': 0.6000000000000001, 'lambda2': 4.281612009983706, 'loop': 0, 'loss': 'CE', 'lr': 0.0011242232188930755, 'softmaxF': True, 'useGCN': True, 'weight_decay': 0.00010674826062514966, 'weightedloss': True}. Best is trial 605 with value: 72.13333129882812.
/home/wxy/miniconda3/lib/python3.10/site-packages/optuna/distributions.py:685: UserWarning: The distribution is specified by [0, 1.00001] and step=0.05, but the range is not divisible by `step`. It will be replaced by [0, 1.0].
  warnings.warn(
K:  7
alpha:  0.75
lr:  0.001575488670483464
weight_decay:  6.631734399239105e-06
dropout:  0.8
fix split and run 3 times
Data: Data(x=[3327, 3703], y=[3327], train_mask=[3327], val_mask=[3327], test_mask=[3327], adj_t=[3327, 3327, nnz=9104])
num_train tensor(120)
num_noise 0
noise: tensor(0)
data feature 3703
ALTOPT(
  (lins): Sequential(
    (0): Linear(in_features=3703, out_features=64, bias=True)
    (1): BatchNorm1d(64, eps=1e-05, momentum=0.1, affine=True, track_running_stats=True)
    (2): Dropout(p=0.8, inplace=True)
    (3): ReLU(inplace=True)
    (4): Linear(in_features=64, out_features=6, bias=True)
    (5): LogSoftmax(dim=-1)
  )
  (prop): Propagation(K=7, mode=None, lambda1=None, lambda2=None, L21=True, alpha=0.75)
  (gcn): GCN(
    (convs): ModuleList(
      (0): GCNConv(3703, 64)
      (1): GCNConv(64, 6)
    )
    (bns): ModuleList(
      (0): BatchNorm1d(64, eps=1e-05, momentum=0.1, affine=True, track_running_stats=True)
    )
    (output): LogSoftmax(dim=-1)
  )
)
propagate done
init label
Split: 01, Run: 01
None time:  1.0224724910221994
None Run 01:
Highest Train: 100.00
Highest Valid: 71.20
  Final Train: 100.00
   Final Test: 69.90
Split: 01, Run: 02
None time:  0.9672450590878725
None Run 02:
Highest Train: 100.00
Highest Valid: 69.00
  Final Train: 100.00
   Final Test: 69.00
Split: 01, Run: 03
None time:  0.9791234189178795
None Run 03:
Highest Train: 100.00
Highest Valid: 71.80
  Final Train: 100.00
   Final Test: 70.40
run time now: 3.007298231124878
total time:  3.0645530379842967
None All runs:
Highest Train: 100.00 ± 0.00
Highest Valid: 70.67 ± 1.47
  Final Train: 100.00 ± 0.00
   Final Test: 69.77 ± 0.71
