[I 2023-06-12 00:12:13,060] Trial 799 finished with value: 69.53333282470703 and parameters: {'Fwd': 0.08260034187732902, 'K': 8, 'alpha': 0.55, 'dropout': 0.7000000000000001, 'gnnepoch': 120, 'lambda1': 0.6000000000000001, 'lambda2': 5.071044425858533, 'loop': 0, 'loss': 'CE', 'lr': 0.00028137291882623163, 'softmaxF': True, 'useGCN': True, 'weight_decay': 2.486552562730114e-06, 'weightedloss': True}. Best is trial 605 with value: 72.13333129882812.
/home/wxy/miniconda3/lib/python3.10/site-packages/optuna/distributions.py:685: UserWarning: The distribution is specified by [0, 1.00001] and step=0.05, but the range is not divisible by `step`. It will be replaced by [0, 1.0].
  warnings.warn(
K:  8
alpha:  0.9
lr:  0.005378554846241798
weight_decay:  0.0005961527099976652
dropout:  0.8
fix split and run 3 times
Data: Data(x=[3327, 3703], y=[3327], train_mask=[3327], val_mask=[3327], test_mask=[3327], adj_t=[3327, 3327, nnz=9104])
num_train tensor(120)
num_noise 0
noise: tensor(0)
data feature 3703
ALTOPT(
  (lins): Sequential(
    (0): Linear(in_features=3703, out_features=64, bias=True)
    (1): BatchNorm1d(64, eps=1e-05, momentum=0.1, affine=True, track_running_stats=True)
    (2): Dropout(p=0.8, inplace=True)
    (3): ReLU(inplace=True)
    (4): Linear(in_features=64, out_features=6, bias=True)
    (5): LogSoftmax(dim=-1)
  )
  (prop): Propagation(K=8, mode=None, lambda1=None, lambda2=None, L21=True, alpha=0.9)
  (gcn): GCN(
    (convs): ModuleList(
      (0): GCNConv(3703, 64)
      (1): GCNConv(64, 6)
    )
    (bns): ModuleList(
      (0): BatchNorm1d(64, eps=1e-05, momentum=0.1, affine=True, track_running_stats=True)
    )
    (output): LogSoftmax(dim=-1)
  )
)
propagate done
init label
Split: 01, Run: 01
None time:  0.925784305203706
None Run 01:
Highest Train: 100.00
Highest Valid: 70.20
  Final Train: 100.00
   Final Test: 69.90
Split: 01, Run: 02, Epoch: 100, Loss: 0.0000, Train: 100.00%, Valid: 68.80% Test: 68.50%
Split: 01, Run: 02
None time:  1.684466300997883
None Run 02:
Highest Train: 100.00
Highest Valid: 68.80
  Final Train: 100.00
   Final Test: 68.50
Split: 01, Run: 03, Epoch: 100, Loss: 0.0000, Train: 100.00%, Valid: 68.20% Test: 69.20%
Split: 01, Run: 03
None time:  2.0225614809896797
None Run 03:
Highest Train: 100.00
Highest Valid: 68.20
  Final Train: 100.00
   Final Test: 69.10
run time now: 4.679058790206909
total time:  4.724446409149095
None All runs:
Highest Train: 100.00 ± 0.00
Highest Valid: 69.07 ± 1.03
  Final Train: 100.00 ± 0.00
   Final Test: 69.17 ± 0.70
[I 2023-06-12 00:12:18,311] Trial 800 finished with value: 69.06666564941406 and parameters: {'Fwd': 0.09975865230805263, 'K': 8, 'alpha': 0.9, 'dropout': 0.8, 'gnnepoch': 110, 'lambda1': 0.7000000000000001, 'lambda2': 4.728725920076007, 'loop': 0, 'loss': 'CE', 'lr': 0.005378554846241798, 'softmaxF': False, 'useGCN': True, 'weight_decay': 0.0005961527099976652, 'weightedloss': True}. Best is trial 605 with value: 72.13333129882812.
/home/wxy/miniconda3/lib/python3.10/site-packages/optuna/distributions.py:685: UserWarning: The distribution is specified by [0, 1.00001] and step=0.05, but the range is not divisible by `step`. It will be replaced by [0, 1.0].
  warnings.warn(
K:  8
alpha:  0.75
lr:  0.00769015356498175
weight_decay:  7.634745256586705e-06
dropout:  0.8
fix split and run 3 times
Data: Data(x=[3327, 3703], y=[3327], train_mask=[3327], val_mask=[3327], test_mask=[3327], adj_t=[3327, 3327, nnz=9104])
num_train tensor(120)
num_noise 0
noise: tensor(0)
data feature 3703
ALTOPT(
  (lins): Sequential(
    (0): Linear(in_features=3703, out_features=64, bias=True)
    (1): BatchNorm1d(64, eps=1e-05, momentum=0.1, affine=True, track_running_stats=True)
    (2): Dropout(p=0.8, inplace=True)
    (3): ReLU(inplace=True)
    (4): Linear(in_features=64, out_features=6, bias=True)
    (5): LogSoftmax(dim=-1)
  )
  (prop): Propagation(K=8, mode=None, lambda1=None, lambda2=None, L21=True, alpha=0.75)
  (gcn): GCN(
    (convs): ModuleList(
      (0): GCNConv(3703, 64)
      (1): GCNConv(64, 6)
    )
    (bns): ModuleList(
      (0): BatchNorm1d(64, eps=1e-05, momentum=0.1, affine=True, track_running_stats=True)
    )
    (output): LogSoftmax(dim=-1)
  )
)
propagate done
init label
Split: 01, Run: 01
None time:  0.8576701511628926
None Run 01:
Highest Train: 100.00
Highest Valid: 55.20
  Final Train: 97.50
   Final Test: 53.70
Split: 01, Run: 02
None time:  0.7442936229053885
None Run 02:
Highest Train: 100.00
Highest Valid: 66.20
  Final Train: 98.33
   Final Test: 64.90
Split: 01, Run: 03
None time:  0.8364074439741671
None Run 03:
Highest Train: 100.00
Highest Valid: 64.80
  Final Train: 97.50
   Final Test: 63.80
run time now: 2.481194257736206
total time:  2.534740950912237
None All runs:
Highest Train: 100.00 ± 0.00
Highest Valid: 62.07 ± 5.99
  Final Train: 97.78 ± 0.48
   Final Test: 60.80 ± 6.17
[I 2023-06-12 00:12:21,445] Trial 801 finished with value: 62.06666564941406 and parameters: {'Fwd': 0.00036952046421354437, 'K': 8, 'alpha': 0.75, 'dropout': 0.8, 'gnnepoch': 120, 'lambda1': 0.8, 'lambda2': 6.8914030307601255, 'loop': 0, 'loss': 'CE', 'lr': 0.00769015356498175, 'softmaxF': False, 'useGCN': False, 'weight_decay': 7.634745256586705e-06, 'weightedloss': True}. Best is trial 605 with value: 72.13333129882812.
/home/wxy/miniconda3/lib/python3.10/site-packages/optuna/distributions.py:685: UserWarning: The distribution is specified by [0, 1.00001] and step=0.05, but the range is not divisible by `step`. It will be replaced by [0, 1.0].
  warnings.warn(
K:  4
alpha:  0.8500000000000001
lr:  0.0018414010883771436
weight_decay:  0.00023311701678269294
dropout:  0.8
fix split and run 3 times
Data: Data(x=[3327, 3703], y=[3327], train_mask=[3327], val_mask=[3327], test_mask=[3327], adj_t=[3327, 3327, nnz=9104])
num_train tensor(120)
num_noise 0
noise: tensor(0)
data feature 3703
ALTOPT(
  (lins): Sequential(
    (0): Linear(in_features=3703, out_features=64, bias=True)
    (1): BatchNorm1d(64, eps=1e-05, momentum=0.1, affine=True, track_running_stats=True)
    (2): Dropout(p=0.8, inplace=True)
    (3): ReLU(inplace=True)
    (4): Linear(in_features=64, out_features=6, bias=True)
    (5): LogSoftmax(dim=-1)
  )
  (prop): Propagation(K=4, mode=None, lambda1=None, lambda2=None, L21=True, alpha=0.8500000000000001)
  (gcn): GCN(
    (convs): ModuleList(
      (0): GCNConv(3703, 64)
      (1): GCNConv(64, 6)
    )
    (bns): ModuleList(
      (0): BatchNorm1d(64, eps=1e-05, momentum=0.1, affine=True, track_running_stats=True)
    )
    (output): LogSoftmax(dim=-1)
  )
)
propagate done
init label
Split: 01, Run: 01
None time:  0.9453224360477179
None Run 01:
Highest Train: 100.00
Highest Valid: 70.20
  Final Train: 100.00
   Final Test: 69.00
Split: 01, Run: 02
None time:  0.8966938029043376
None Run 02:
Highest Train: 100.00
Highest Valid: 71.00
  Final Train: 100.00
   Final Test: 70.20
Split: 01, Run: 03
None time:  1.397626494988799
None Run 03:
Highest Train: 100.00
Highest Valid: 70.80
  Final Train: 100.00
   Final Test: 69.80
run time now: 3.2848832607269287
total time:  3.3433951411861926
None All runs:
Highest Train: 100.00 ± 0.00
Highest Valid: 70.67 ± 0.42
  Final Train: 100.00 ± 0.00
   Final Test: 69.67 ± 0.61
[I 2023-06-12 00:12:25,414] Trial 802 finished with value: 70.66667175292969 and parameters: {'Fwd': 5.076437396837155e-05, 'K': 4, 'alpha': 0.8500000000000001, 'dropout': 0.8, 'gnnepoch': 70, 'lambda1': 0.55, 'lambda2': 5.980482873290407, 'loop': 0, 'loss': 'CE', 'lr': 0.0018414010883771436, 'softmaxF': False, 'useGCN': True, 'weight_decay': 0.00023311701678269294, 'weightedloss': True}. Best is trial 605 with value: 72.13333129882812.
/home/wxy/miniconda3/lib/python3.10/site-packages/optuna/distributions.py:685: UserWarning: The distribution is specified by [0, 1.00001] and step=0.05, but the range is not divisible by `step`. It will be replaced by [0, 1.0].
  warnings.warn(
K:  8
alpha:  0.65
lr:  0.006017790107749691
weight_decay:  0.0011950922737650272
dropout:  0.8
fix split and run 3 times
Data: Data(x=[3327, 3703], y=[3327], train_mask=[3327], val_mask=[3327], test_mask=[3327], adj_t=[3327, 3327, nnz=9104])
num_train tensor(120)
num_noise 0
noise: tensor(0)
data feature 3703
ALTOPT(
  (lins): Sequential(
    (0): Linear(in_features=3703, out_features=64, bias=True)
    (1): BatchNorm1d(64, eps=1e-05, momentum=0.1, affine=True, track_running_stats=True)
    (2): Dropout(p=0.8, inplace=True)
    (3): ReLU(inplace=True)
    (4): Linear(in_features=64, out_features=6, bias=True)
    (5): LogSoftmax(dim=-1)
  )
  (prop): Propagation(K=8, mode=None, lambda1=None, lambda2=None, L21=True, alpha=0.65)
  (gcn): GCN(
    (convs): ModuleList(
      (0): GCNConv(3703, 64)
      (1): GCNConv(64, 6)
    )
    (bns): ModuleList(
      (0): BatchNorm1d(64, eps=1e-05, momentum=0.1, affine=True, track_running_stats=True)
    )
    (output): LogSoftmax(dim=-1)
  )
)
propagate done
init label
Split: 01, Run: 01, Epoch: 100, Loss: 0.0000, Train: 99.17%, Valid: 70.60% Test: 70.50%
Split: 01, Run: 01
None time:  4.524032366927713
None Run 01:
Highest Train: 100.00
Highest Valid: 70.60
  Final Train: 99.17
   Final Test: 70.30
Split: 01, Run: 02, Epoch: 100, Loss: 0.0000, Train: 99.17%, Valid: 70.00% Test: 69.50%
Split: 01, Run: 02
None time:  3.940907553071156
None Run 02:
Highest Train: 100.00
Highest Valid: 70.00
  Final Train: 99.17
   Final Test: 69.20
Split: 01, Run: 03
None time:  2.026830559130758
None Run 03:
Highest Train: 100.00
Highest Valid: 71.00
  Final Train: 100.00
   Final Test: 69.40
run time now: 10.545663595199585
total time:  10.59308902407065
None All runs:
Highest Train: 100.00 ± 0.00
Highest Valid: 70.53 ± 0.50
  Final Train: 99.44 ± 0.48
   Final Test: 69.63 ± 0.59
[I 2023-06-12 00:12:36,627] Trial 803 finished with value: 70.53333282470703 and parameters: {'Fwd': 0.04061756962295251, 'K': 8, 'alpha': 0.65, 'dropout': 0.8, 'gnnepoch': 120, 'lambda1': 0.65, 'lambda2': 5.471363877469346, 'loop': 0, 'loss': 'CE', 'lr': 0.006017790107749691, 'softmaxF': False, 'useGCN': True, 'weight_decay': 0.0011950922737650272, 'weightedloss': True}. Best is trial 605 with value: 72.13333129882812.
/home/wxy/miniconda3/lib/python3.10/site-packages/optuna/distributions.py:685: UserWarning: The distribution is specified by [0, 1.00001] and step=0.05, but the range is not divisible by `step`. It will be replaced by [0, 1.0].
  warnings.warn(
K:  9
alpha:  0.7000000000000001
lr:  0.0012079624025041415
weight_decay:  4.488417765144161e-05
dropout:  0.8
fix split and run 3 times
Data: Data(x=[3327, 3703], y=[3327], train_mask=[3327], val_mask=[3327], test_mask=[3327], adj_t=[3327, 3327, nnz=9104])
num_train tensor(120)
num_noise 0
noise: tensor(0)
data feature 3703
ALTOPT(
  (lins): Sequential(
    (0): Linear(in_features=3703, out_features=64, bias=True)
    (1): BatchNorm1d(64, eps=1e-05, momentum=0.1, affine=True, track_running_stats=True)
    (2): Dropout(p=0.8, inplace=True)
    (3): ReLU(inplace=True)
    (4): Linear(in_features=64, out_features=6, bias=True)
    (5): LogSoftmax(dim=-1)
  )
  (prop): Propagation(K=9, mode=None, lambda1=None, lambda2=None, L21=True, alpha=0.7000000000000001)
  (gcn): GCN(
    (convs): ModuleList(
      (0): GCNConv(3703, 64)
      (1): GCNConv(64, 6)
    )
    (bns): ModuleList(
      (0): BatchNorm1d(64, eps=1e-05, momentum=0.1, affine=True, track_running_stats=True)
    )
    (output): LogSoftmax(dim=-1)
  )
)
propagate done
init label
Split: 01, Run: 01
None time:  2.3620731569826603
None Run 01:
Highest Train: 100.00
Highest Valid: 71.20
  Final Train: 100.00
   Final Test: 69.60
Split: 01, Run: 02
None time:  2.1328841131180525
None Run 02:
Highest Train: 100.00
Highest Valid: 71.80
  Final Train: 100.00
   Final Test: 69.90
Split: 01, Run: 03
None time:  2.4216275638900697
None Run 03:
Highest Train: 100.00
Highest Valid: 71.80
  Final Train: 100.00
   Final Test: 70.60
run time now: 6.968227386474609
total time:  7.022760634077713
None All runs:
Highest Train: 100.00 ± 0.00
Highest Valid: 71.60 ± 0.35
  Final Train: 100.00 ± 0.00
   Final Test: 70.03 ± 0.51
[I 2023-06-12 00:12:44,421] Trial 804 finished with value: 71.5999984741211 and parameters: {'Fwd': 1.9173453507065252e-06, 'K': 9, 'alpha': 0.7000000000000001, 'dropout': 0.8, 'gnnepoch': 120, 'lambda1': 0.75, 'lambda2': 9.718318935389538, 'loop': 0, 'loss': 'CE', 'lr': 0.0012079624025041415, 'softmaxF': False, 'useGCN': True, 'weight_decay': 4.488417765144161e-05, 'weightedloss': True}. Best is trial 605 with value: 72.13333129882812.
/home/wxy/miniconda3/lib/python3.10/site-packages/optuna/distributions.py:685: UserWarning: The distribution is specified by [0, 1.00001] and step=0.05, but the range is not divisible by `step`. It will be replaced by [0, 1.0].
  warnings.warn(
K:  8
alpha:  0.75
lr:  0.00011723905480007155
weight_decay:  2.9696335928489536e-05
dropout:  0.2
fix split and run 3 times
Data: Data(x=[3327, 3703], y=[3327], train_mask=[3327], val_mask=[3327], test_mask=[3327], adj_t=[3327, 3327, nnz=9104])
num_train tensor(120)
num_noise 0
noise: tensor(0)
data feature 3703
ALTOPT(
  (lins): Sequential(
    (0): Linear(in_features=3703, out_features=64, bias=True)
    (1): BatchNorm1d(64, eps=1e-05, momentum=0.1, affine=True, track_running_stats=True)
    (2): Dropout(p=0.2, inplace=True)
    (3): ReLU(inplace=True)
    (4): Linear(in_features=64, out_features=6, bias=True)
    (5): LogSoftmax(dim=-1)
  )
  (prop): Propagation(K=8, mode=None, lambda1=None, lambda2=None, L21=True, alpha=0.75)
  (gcn): GCN(
    (convs): ModuleList(
      (0): GCNConv(3703, 64)
      (1): GCNConv(64, 6)
    )
    (bns): ModuleList(
      (0): BatchNorm1d(64, eps=1e-05, momentum=0.1, affine=True, track_running_stats=True)
    )
    (output): LogSoftmax(dim=-1)
  )
)
propagate done
init label
Split: 01, Run: 01
None time:  2.1926541039720178
None Run 01:
Highest Train: 100.00
Highest Valid: 67.40
  Final Train: 100.00
   Final Test: 67.60
Split: 01, Run: 02
None time:  2.4229844000656158
None Run 02:
Highest Train: 100.00
Highest Valid: 61.40
  Final Train: 100.00
   Final Test: 59.30
Split: 01, Run: 03, Epoch: 100, Loss: 0.0000, Train: 100.00%, Valid: 66.60% Test: 67.00%
Split: 01, Run: 03
None time:  4.226615516003221
None Run 03:
Highest Train: 100.00
Highest Valid: 66.60
  Final Train: 100.00
   Final Test: 67.00
run time now: 8.890345573425293
total time:  8.938744890037924
None All runs:
Highest Train: 100.00 ± 0.00
Highest Valid: 65.13 ± 3.26
  Final Train: 100.00 ± 0.00
   Final Test: 64.63 ± 4.63
[I 2023-06-12 00:12:53,925] Trial 805 finished with value: 65.13333129882812 and parameters: {'Fwd': 0.014131140584390823, 'K': 8, 'alpha': 0.75, 'dropout': 0.2, 'gnnepoch': 110, 'lambda1': 0.7000000000000001, 'lambda2': 3.5946124547423985, 'loop': 0, 'loss': 'CE', 'lr': 0.00011723905480007155, 'softmaxF': False, 'useGCN': True, 'weight_decay': 2.9696335928489536e-05, 'weightedloss': True}. Best is trial 605 with value: 72.13333129882812.
/home/wxy/miniconda3/lib/python3.10/site-packages/optuna/distributions.py:685: UserWarning: The distribution is specified by [0, 1.00001] and step=0.05, but the range is not divisible by `step`. It will be replaced by [0, 1.0].
  warnings.warn(
K:  8
alpha:  0.6000000000000001
lr:  0.0002215903657368421
weight_decay:  1.1187318903191006e-05
dropout:  0.0
fix split and run 3 times
Data: Data(x=[3327, 3703], y=[3327], train_mask=[3327], val_mask=[3327], test_mask=[3327], adj_t=[3327, 3327, nnz=9104])
num_train tensor(120)
num_noise 0
noise: tensor(0)
data feature 3703
ALTOPT(
  (lins): Sequential(
    (0): Linear(in_features=3703, out_features=64, bias=True)
    (1): BatchNorm1d(64, eps=1e-05, momentum=0.1, affine=True, track_running_stats=True)
    (2): Dropout(p=0.0, inplace=True)
    (3): ReLU(inplace=True)
    (4): Linear(in_features=64, out_features=6, bias=True)
    (5): LogSoftmax(dim=-1)
  )
  (prop): Propagation(K=8, mode=None, lambda1=None, lambda2=None, L21=True, alpha=0.6000000000000001)
  (gcn): GCN(
    (convs): ModuleList(
      (0): GCNConv(3703, 64)
      (1): GCNConv(64, 6)
    )
    (bns): ModuleList(
      (0): BatchNorm1d(64, eps=1e-05, momentum=0.1, affine=True, track_running_stats=True)
    )
    (output): LogSoftmax(dim=-1)
  )
)
propagate done
init label
Split: 01, Run: 01
None time:  1.9442644708324224
None Run 01:
Highest Train: 100.00
Highest Valid: 69.20
  Final Train: 100.00
   Final Test: 69.20
Split: 01, Run: 02
None time:  2.0566375439520925
None Run 02:
Highest Train: 100.00
Highest Valid: 68.00
  Final Train: 100.00
   Final Test: 68.00
Split: 01, Run: 03
None time:  1.9870803409721702
None Run 03:
Highest Train: 100.00
Highest Valid: 70.40
  Final Train: 100.00
   Final Test: 69.10
run time now: 6.038293123245239
total time:  6.092891121050343
None All runs:
Highest Train: 100.00 ± 0.00
Highest Valid: 69.20 ± 1.20
  Final Train: 100.00 ± 0.00
   Final Test: 68.77 ± 0.67
[I 2023-06-12 00:13:00,648] Trial 806 finished with value: 69.20000457763672 and parameters: {'Fwd': 0.0031936020156828615, 'K': 8, 'alpha': 0.6000000000000001, 'dropout': 0.0, 'gnnepoch': 120, 'lambda1': 0.65, 'lambda2': 0.7134895148931388, 'loop': 0, 'loss': 'CE', 'lr': 0.0002215903657368421, 'softmaxF': False, 'useGCN': True, 'weight_decay': 1.1187318903191006e-05, 'weightedloss': True}. Best is trial 605 with value: 72.13333129882812.
/home/wxy/miniconda3/lib/python3.10/site-packages/optuna/distributions.py:685: UserWarning: The distribution is specified by [0, 1.00001] and step=0.05, but the range is not divisible by `step`. It will be replaced by [0, 1.0].
  warnings.warn(
K:  8
alpha:  1.0
lr:  0.004006024772639522
weight_decay:  0.0008663622930906377
dropout:  0.8
fix split and run 3 times
Data: Data(x=[3327, 3703], y=[3327], train_mask=[3327], val_mask=[3327], test_mask=[3327], adj_t=[3327, 3327, nnz=9104])
num_train tensor(120)
num_noise 0
noise: tensor(0)
data feature 3703
ALTOPT(
  (lins): Sequential(
    (0): Linear(in_features=3703, out_features=64, bias=True)
    (1): BatchNorm1d(64, eps=1e-05, momentum=0.1, affine=True, track_running_stats=True)
    (2): Dropout(p=0.8, inplace=True)
    (3): ReLU(inplace=True)
    (4): Linear(in_features=64, out_features=6, bias=True)
    (5): LogSoftmax(dim=-1)
  )
  (prop): Propagation(K=8, mode=None, lambda1=None, lambda2=None, L21=True, alpha=1.0)
  (gcn): GCN(
    (convs): ModuleList(
      (0): GCNConv(3703, 64)
      (1): GCNConv(64, 6)
    )
    (bns): ModuleList(
      (0): BatchNorm1d(64, eps=1e-05, momentum=0.1, affine=True, track_running_stats=True)
    )
    (output): LogSoftmax(dim=-1)
  )
)
propagate done
init label
Split: 01, Run: 01
None time:  2.377883870154619
None Run 01:
Highest Train: 100.00
Highest Valid: 70.60
  Final Train: 99.17
   Final Test: 69.90
Split: 01, Run: 02
None time:  2.1916125710122287
None Run 02:
Highest Train: 100.00
Highest Valid: 70.80
  Final Train: 99.17
   Final Test: 70.10
Split: 01, Run: 03
None time:  2.3861504439264536
None Run 03:
Highest Train: 100.00
Highest Valid: 70.80
  Final Train: 100.00
   Final Test: 69.50
run time now: 7.003816604614258
total time:  7.060189831070602
None All runs:
Highest Train: 100.00 ± 0.00
Highest Valid: 70.73 ± 0.12
  Final Train: 99.44 ± 0.48
   Final Test: 69.83 ± 0.31
[I 2023-06-12 00:13:08,328] Trial 807 finished with value: 70.73332977294922 and parameters: {'Fwd': 2.2995317518552596e-06, 'K': 8, 'alpha': 1.0, 'dropout': 0.8, 'gnnepoch': 120, 'lambda1': 0.75, 'lambda2': 7.9462687970416575, 'loop': 0, 'loss': 'CE', 'lr': 0.004006024772639522, 'softmaxF': True, 'useGCN': True, 'weight_decay': 0.0008663622930906377, 'weightedloss': False}. Best is trial 605 with value: 72.13333129882812.
/home/wxy/miniconda3/lib/python3.10/site-packages/optuna/distributions.py:685: UserWarning: The distribution is specified by [0, 1.00001] and step=0.05, but the range is not divisible by `step`. It will be replaced by [0, 1.0].
  warnings.warn(
K:  8
alpha:  0.8500000000000001
lr:  0.001545454505219528
weight_decay:  5.9842665344247864e-05
dropout:  0.8
fix split and run 3 times
Data: Data(x=[3327, 3703], y=[3327], train_mask=[3327], val_mask=[3327], test_mask=[3327], adj_t=[3327, 3327, nnz=9104])
num_train tensor(120)
num_noise 0
noise: tensor(0)
data feature 3703
ALTOPT(
  (lins): Sequential(
    (0): Linear(in_features=3703, out_features=64, bias=True)
    (1): BatchNorm1d(64, eps=1e-05, momentum=0.1, affine=True, track_running_stats=True)
    (2): Dropout(p=0.8, inplace=True)
    (3): ReLU(inplace=True)
    (4): Linear(in_features=64, out_features=6, bias=True)
    (5): LogSoftmax(dim=-1)
  )
  (prop): Propagation(K=8, mode=None, lambda1=None, lambda2=None, L21=True, alpha=0.8500000000000001)
  (gcn): GCN(
    (convs): ModuleList(
      (0): GCNConv(3703, 64)
      (1): GCNConv(64, 6)
    )
    (bns): ModuleList(
      (0): BatchNorm1d(64, eps=1e-05, momentum=0.1, affine=True, track_running_stats=True)
    )
    (output): LogSoftmax(dim=-1)
  )
)
propagate done
init label
Split: 01, Run: 01
None time:  2.1387633439153433
None Run 01:
Highest Train: 100.00
Highest Valid: 71.40
  Final Train: 100.00
   Final Test: 69.60
Split: 01, Run: 02
None time:  2.0885508470237255
None Run 02:
Highest Train: 100.00
Highest Valid: 72.20
  Final Train: 100.00
   Final Test: 70.10
Split: 01, Run: 03
None time:  2.1476468229666352
None Run 03:
Highest Train: 100.00
Highest Valid: 71.60
  Final Train: 100.00
   Final Test: 70.00
run time now: 6.431173086166382
total time:  6.476446329150349
None All runs:
Highest Train: 100.00 ± 0.00
Highest Valid: 71.73 ± 0.42
  Final Train: 100.00 ± 0.00
   Final Test: 69.90 ± 0.26
