[I 2023-06-12 00:32:24,611] Trial 215 finished with value: 83.0666732788086 and parameters: {'Fwd': 4.474435704265262e-06, 'K': 10, 'alpha': 0.9500000000000001, 'dropout': 0.9, 'gnnepoch': 60, 'lambda1': 0.65, 'lambda2': 6.494810880285327, 'loop': 1, 'loss': 'MSE', 'lr': 0.002479257619705802, 'softmaxF': True, 'useGCN': False, 'weight_decay': 0.0031178714861049652, 'weightedloss': False}. Best is trial 205 with value: 83.53333282470703.
/home/wxy/miniconda3/lib/python3.10/site-packages/optuna/distributions.py:685: UserWarning: The distribution is specified by [0, 1.00001] and step=0.05, but the range is not divisible by `step`. It will be replaced by [0, 1.0].
  warnings.warn(
K:  10
alpha:  0.9500000000000001
lr:  0.002284307824766884
weight_decay:  0.007879596973037565
dropout:  0.9
fix split and run 3 times
Data: Data(x=[19717, 500], y=[19717], train_mask=[19717], val_mask=[19717], test_mask=[19717], adj_t=[19717, 19717, nnz=88648])
num_train tensor(60)
num_noise 0
noise: tensor(0)
data feature 500
ALTOPT(
  (lins): Sequential(
    (0): Linear(in_features=500, out_features=64, bias=True)
    (1): BatchNorm1d(64, eps=1e-05, momentum=0.1, affine=True, track_running_stats=True)
    (2): Dropout(p=0.9, inplace=True)
    (3): ReLU(inplace=True)
    (4): Linear(in_features=64, out_features=3, bias=True)
    (5): Identity()
  )
  (prop): Propagation(K=10, mode=None, lambda1=None, lambda2=None, L21=True, alpha=0.9500000000000001)
  (gcn): GCN(
    (convs): ModuleList(
      (0): GCNConv(500, 64)
      (1): GCNConv(64, 3)
    )
    (bns): ModuleList(
      (0): BatchNorm1d(64, eps=1e-05, momentum=0.1, affine=True, track_running_stats=True)
    )
    (output): Identity()
  )
)
propagate done
init label
Split: 01, Run: 01
None time:  0.9041348949540406
None Run 01:
Highest Train: 100.00
Highest Valid: 69.80
  Final Train: 100.00
   Final Test: 69.60
Split: 01, Run: 02
None time:  1.7519477219320834
None Run 02:
Highest Train: 100.00
Highest Valid: 82.00
  Final Train: 100.00
   Final Test: 78.80
Split: 01, Run: 03
None time:  1.6327223379630595
None Run 03:
Highest Train: 100.00
Highest Valid: 82.60
  Final Train: 100.00
   Final Test: 79.60
run time now: 4.338717699050903
total time:  4.384996965993196
None All runs:
Highest Train: 100.00 ± 0.00
Highest Valid: 78.13 ± 7.22
  Final Train: 100.00 ± 0.00
   Final Test: 76.00 ± 5.56
[I 2023-06-12 00:32:29,507] Trial 216 finished with value: 78.13333129882812 and parameters: {'Fwd': 4.802396536959539e-06, 'K': 10, 'alpha': 0.9500000000000001, 'dropout': 0.9, 'gnnepoch': 50, 'lambda1': 0.65, 'lambda2': 6.499265187199381, 'loop': 1, 'loss': 'MSE', 'lr': 0.002284307824766884, 'softmaxF': True, 'useGCN': False, 'weight_decay': 0.007879596973037565, 'weightedloss': False}. Best is trial 205 with value: 83.53333282470703.
/home/wxy/miniconda3/lib/python3.10/site-packages/optuna/distributions.py:685: UserWarning: The distribution is specified by [0, 1.00001] and step=0.05, but the range is not divisible by `step`. It will be replaced by [0, 1.0].
  warnings.warn(
K:  10
alpha:  1.0
lr:  0.002424012229076173
weight_decay:  0.0017596787476152173
dropout:  0.9
fix split and run 3 times
Data: Data(x=[19717, 500], y=[19717], train_mask=[19717], val_mask=[19717], test_mask=[19717], adj_t=[19717, 19717, nnz=88648])
num_train tensor(60)
num_noise 0
noise: tensor(0)
data feature 500
ALTOPT(
  (lins): Sequential(
    (0): Linear(in_features=500, out_features=64, bias=True)
    (1): BatchNorm1d(64, eps=1e-05, momentum=0.1, affine=True, track_running_stats=True)
    (2): Dropout(p=0.9, inplace=True)
    (3): ReLU(inplace=True)
    (4): Linear(in_features=64, out_features=3, bias=True)
    (5): Identity()
  )
  (prop): Propagation(K=10, mode=None, lambda1=None, lambda2=None, L21=True, alpha=1.0)
  (gcn): GCN(
    (convs): ModuleList(
      (0): GCNConv(500, 64)
      (1): GCNConv(64, 3)
    )
    (bns): ModuleList(
      (0): BatchNorm1d(64, eps=1e-05, momentum=0.1, affine=True, track_running_stats=True)
    )
    (output): Identity()
  )
)
propagate done
init label
Split: 01, Run: 01
None time:  3.5978109911084175
None Run 01:
Highest Train: 100.00
Highest Valid: 83.40
  Final Train: 100.00
   Final Test: 78.90
Split: 01, Run: 02, Epoch: 100, Loss: 0.1790, Train: 100.00%, Valid: 81.20% Test: 79.00%
Split: 01, Run: 02
None time:  3.339745332952589
None Run 02:
Highest Train: 100.00
Highest Valid: 81.20
  Final Train: 100.00
   Final Test: 79.00
Split: 01, Run: 03
None time:  1.6360508191864938
None Run 03:
Highest Train: 100.00
Highest Valid: 82.40
  Final Train: 100.00
   Final Test: 80.30
run time now: 8.617875337600708
total time:  8.66850637178868
None All runs:
Highest Train: 100.00 ± 0.00
Highest Valid: 82.33 ± 1.10
  Final Train: 100.00 ± 0.00
   Final Test: 79.40 ± 0.78
[I 2023-06-12 00:32:38,642] Trial 217 finished with value: 82.33333587646484 and parameters: {'Fwd': 8.063797050794022e-06, 'K': 10, 'alpha': 1.0, 'dropout': 0.9, 'gnnepoch': 60, 'lambda1': 0.7000000000000001, 'lambda2': 6.984242786987769, 'loop': 1, 'loss': 'MSE', 'lr': 0.002424012229076173, 'softmaxF': True, 'useGCN': False, 'weight_decay': 0.0017596787476152173, 'weightedloss': False}. Best is trial 205 with value: 83.53333282470703.
/home/wxy/miniconda3/lib/python3.10/site-packages/optuna/distributions.py:685: UserWarning: The distribution is specified by [0, 1.00001] and step=0.05, but the range is not divisible by `step`. It will be replaced by [0, 1.0].
  warnings.warn(
K:  10
alpha:  0.9500000000000001
lr:  0.002207263135639023
weight_decay:  0.004198193562038169
dropout:  0.9
fix split and run 3 times
Data: Data(x=[19717, 500], y=[19717], train_mask=[19717], val_mask=[19717], test_mask=[19717], adj_t=[19717, 19717, nnz=88648])
num_train tensor(60)
num_noise 0
noise: tensor(0)
data feature 500
ALTOPT(
  (lins): Sequential(
    (0): Linear(in_features=500, out_features=64, bias=True)
    (1): BatchNorm1d(64, eps=1e-05, momentum=0.1, affine=True, track_running_stats=True)
    (2): Dropout(p=0.9, inplace=True)
    (3): ReLU(inplace=True)
    (4): Linear(in_features=64, out_features=3, bias=True)
    (5): Identity()
  )
  (prop): Propagation(K=10, mode=None, lambda1=None, lambda2=None, L21=True, alpha=0.9500000000000001)
  (gcn): GCN(
    (convs): ModuleList(
      (0): GCNConv(500, 64)
      (1): GCNConv(64, 3)
    )
    (bns): ModuleList(
      (0): BatchNorm1d(64, eps=1e-05, momentum=0.1, affine=True, track_running_stats=True)
    )
    (output): Identity()
  )
)
propagate done
init label
Split: 01, Run: 01
None time:  2.819557646056637
None Run 01:
Highest Train: 100.00
Highest Valid: 81.80
  Final Train: 100.00
   Final Test: 77.90
Split: 01, Run: 02
None time:  1.0991768869571388
None Run 02:
Highest Train: 100.00
Highest Valid: 82.00
  Final Train: 100.00
   Final Test: 77.60
Split: 01, Run: 03
None time:  0.9298436660319567
None Run 03:
Highest Train: 100.00
Highest Valid: 83.00
  Final Train: 100.00
   Final Test: 80.60
run time now: 4.897130012512207
total time:  4.942774133058265
None All runs:
Highest Train: 100.00 ± 0.00
Highest Valid: 82.27 ± 0.64
  Final Train: 100.00 ± 0.00
   Final Test: 78.70 ± 1.65
[I 2023-06-12 00:32:44,125] Trial 218 finished with value: 82.26667022705078 and parameters: {'Fwd': 1.3120163823047794e-05, 'K': 10, 'alpha': 0.9500000000000001, 'dropout': 0.9, 'gnnepoch': 60, 'lambda1': 0.65, 'lambda2': 6.345015525839525, 'loop': 1, 'loss': 'MSE', 'lr': 0.002207263135639023, 'softmaxF': True, 'useGCN': False, 'weight_decay': 0.004198193562038169, 'weightedloss': False}. Best is trial 205 with value: 83.53333282470703.
/home/wxy/miniconda3/lib/python3.10/site-packages/optuna/distributions.py:685: UserWarning: The distribution is specified by [0, 1.00001] and step=0.05, but the range is not divisible by `step`. It will be replaced by [0, 1.0].
  warnings.warn(
K:  10
alpha:  1.0
lr:  0.0030498816065023812
weight_decay:  0.00223595321701423
dropout:  0.9
fix split and run 3 times
Data: Data(x=[19717, 500], y=[19717], train_mask=[19717], val_mask=[19717], test_mask=[19717], adj_t=[19717, 19717, nnz=88648])
num_train tensor(60)
num_noise 0
noise: tensor(0)
data feature 500
ALTOPT(
  (lins): Sequential(
    (0): Linear(in_features=500, out_features=64, bias=True)
    (1): BatchNorm1d(64, eps=1e-05, momentum=0.1, affine=True, track_running_stats=True)
    (2): Dropout(p=0.9, inplace=True)
    (3): ReLU(inplace=True)
    (4): Linear(in_features=64, out_features=3, bias=True)
    (5): Identity()
  )
  (prop): Propagation(K=10, mode=None, lambda1=None, lambda2=None, L21=True, alpha=1.0)
  (gcn): GCN(
    (convs): ModuleList(
      (0): GCNConv(500, 64)
      (1): GCNConv(64, 3)
    )
    (bns): ModuleList(
      (0): BatchNorm1d(64, eps=1e-05, momentum=0.1, affine=True, track_running_stats=True)
    )
    (output): Identity()
  )
)
propagate done
init label
Split: 01, Run: 01
None time:  2.5939563219435513
None Run 01:
Highest Train: 100.00
Highest Valid: 81.40
  Final Train: 100.00
   Final Test: 77.40
Split: 01, Run: 02
None time:  1.7581943650729954
None Run 02:
Highest Train: 100.00
Highest Valid: 80.60
  Final Train: 100.00
   Final Test: 79.10
Split: 01, Run: 03
None time:  1.0439745269250125
None Run 03:
Highest Train: 100.00
Highest Valid: 80.60
  Final Train: 100.00
   Final Test: 79.60
run time now: 5.4451751708984375
total time:  5.493499091826379
None All runs:
Highest Train: 100.00 ± 0.00
Highest Valid: 80.87 ± 0.46
  Final Train: 100.00 ± 0.00
   Final Test: 78.70 ± 1.15
[I 2023-06-12 00:32:50,085] Trial 219 finished with value: 80.86666870117188 and parameters: {'Fwd': 3.9759563081968064e-06, 'K': 10, 'alpha': 1.0, 'dropout': 0.9, 'gnnepoch': 60, 'lambda1': 0.7000000000000001, 'lambda2': 6.20742036889921, 'loop': 1, 'loss': 'MSE', 'lr': 0.0030498816065023812, 'softmaxF': True, 'useGCN': False, 'weight_decay': 0.00223595321701423, 'weightedloss': False}. Best is trial 205 with value: 83.53333282470703.
/home/wxy/miniconda3/lib/python3.10/site-packages/optuna/distributions.py:685: UserWarning: The distribution is specified by [0, 1.00001] and step=0.05, but the range is not divisible by `step`. It will be replaced by [0, 1.0].
  warnings.warn(
K:  10
alpha:  0.9500000000000001
lr:  0.0024809145447946762
weight_decay:  0.003313137004470566
dropout:  0.9
fix split and run 3 times
Data: Data(x=[19717, 500], y=[19717], train_mask=[19717], val_mask=[19717], test_mask=[19717], adj_t=[19717, 19717, nnz=88648])
num_train tensor(60)
num_noise 0
noise: tensor(0)
data feature 500
ALTOPT(
  (lins): Sequential(
    (0): Linear(in_features=500, out_features=64, bias=True)
    (1): BatchNorm1d(64, eps=1e-05, momentum=0.1, affine=True, track_running_stats=True)
    (2): Dropout(p=0.9, inplace=True)
    (3): ReLU(inplace=True)
    (4): Linear(in_features=64, out_features=3, bias=True)
    (5): Identity()
  )
  (prop): Propagation(K=10, mode=None, lambda1=None, lambda2=None, L21=True, alpha=0.9500000000000001)
  (gcn): GCN(
    (convs): ModuleList(
      (0): GCNConv(500, 64)
      (1): GCNConv(64, 3)
    )
    (bns): ModuleList(
      (0): BatchNorm1d(64, eps=1e-05, momentum=0.1, affine=True, track_running_stats=True)
    )
    (output): Identity()
  )
)
propagate done
init label
Split: 01, Run: 01
None time:  0.574906743131578
None Run 01:
Highest Train: 100.00
Highest Valid: 69.80
  Final Train: 100.00
   Final Test: 69.60
Split: 01, Run: 02
None time:  1.12102588894777
None Run 02:
Highest Train: 100.00
Highest Valid: 83.20
  Final Train: 100.00
   Final Test: 78.70
Split: 01, Run: 03
None time:  1.0648733859416097
None Run 03:
Highest Train: 100.00
Highest Valid: 83.40
  Final Train: 100.00
   Final Test: 81.50
run time now: 2.8052773475646973
total time:  2.845985237043351
None All runs:
Highest Train: 100.00 ± 0.00
Highest Valid: 78.80 ± 7.79
  Final Train: 100.00 ± 0.00
   Final Test: 76.60 ± 6.22
[I 2023-06-12 00:32:53,410] Trial 220 finished with value: 78.79999542236328 and parameters: {'Fwd': 6.1192060987204995e-06, 'K': 10, 'alpha': 0.9500000000000001, 'dropout': 0.9, 'gnnepoch': 50, 'lambda1': 0.65, 'lambda2': 7.127240066760726, 'loop': 1, 'loss': 'MSE', 'lr': 0.0024809145447946762, 'softmaxF': True, 'useGCN': False, 'weight_decay': 0.003313137004470566, 'weightedloss': False}. Best is trial 205 with value: 83.53333282470703.
/home/wxy/miniconda3/lib/python3.10/site-packages/optuna/distributions.py:685: UserWarning: The distribution is specified by [0, 1.00001] and step=0.05, but the range is not divisible by `step`. It will be replaced by [0, 1.0].
  warnings.warn(
K:  10
alpha:  0.9500000000000001
lr:  0.0027071710787607076
weight_decay:  0.0024148899005976437
dropout:  0.9
fix split and run 3 times
Data: Data(x=[19717, 500], y=[19717], train_mask=[19717], val_mask=[19717], test_mask=[19717], adj_t=[19717, 19717, nnz=88648])
num_train tensor(60)
num_noise 0
noise: tensor(0)
data feature 500
ALTOPT(
  (lins): Sequential(
    (0): Linear(in_features=500, out_features=64, bias=True)
    (1): BatchNorm1d(64, eps=1e-05, momentum=0.1, affine=True, track_running_stats=True)
    (2): Dropout(p=0.9, inplace=True)
    (3): ReLU(inplace=True)
    (4): Linear(in_features=64, out_features=3, bias=True)
    (5): Identity()
  )
  (prop): Propagation(K=10, mode=None, lambda1=None, lambda2=None, L21=True, alpha=0.9500000000000001)
  (gcn): GCN(
    (convs): ModuleList(
      (0): GCNConv(500, 64)
      (1): GCNConv(64, 3)
    )
    (bns): ModuleList(
      (0): BatchNorm1d(64, eps=1e-05, momentum=0.1, affine=True, track_running_stats=True)
    )
    (output): Identity()
  )
)
propagate done
init label
Split: 01, Run: 01
None time:  2.4007634550798684
None Run 01:
Highest Train: 100.00
Highest Valid: 82.00
  Final Train: 100.00
   Final Test: 78.00
Split: 01, Run: 02
None time:  1.326628307113424
None Run 02:
Highest Train: 100.00
Highest Valid: 84.40
  Final Train: 100.00
   Final Test: 79.70
Split: 01, Run: 03, Epoch: 100, Loss: 0.1379, Train: 100.00%, Valid: 83.60% Test: 79.10%
Split: 01, Run: 03
None time:  3.43961227289401
None Run 03:
Highest Train: 100.00
Highest Valid: 83.60
  Final Train: 100.00
   Final Test: 79.10
run time now: 7.2143330574035645
total time:  7.26186276297085
None All runs:
Highest Train: 100.00 ± 0.00
Highest Valid: 83.33 ± 1.22
  Final Train: 100.00 ± 0.00
   Final Test: 78.93 ± 0.86
[I 2023-06-12 00:33:01,149] Trial 221 finished with value: 83.33333587646484 and parameters: {'Fwd': 3.571629777120064e-06, 'K': 10, 'alpha': 0.9500000000000001, 'dropout': 0.9, 'gnnepoch': 60, 'lambda1': 0.6000000000000001, 'lambda2': 6.759193570834122, 'loop': 1, 'loss': 'MSE', 'lr': 0.0027071710787607076, 'softmaxF': True, 'useGCN': False, 'weight_decay': 0.0024148899005976437, 'weightedloss': False}. Best is trial 205 with value: 83.53333282470703.
/home/wxy/miniconda3/lib/python3.10/site-packages/optuna/distributions.py:685: UserWarning: The distribution is specified by [0, 1.00001] and step=0.05, but the range is not divisible by `step`. It will be replaced by [0, 1.0].
  warnings.warn(
K:  10
alpha:  0.9500000000000001
lr:  0.0027812170377012136
weight_decay:  0.0017648512563344417
dropout:  0.9
fix split and run 3 times
Data: Data(x=[19717, 500], y=[19717], train_mask=[19717], val_mask=[19717], test_mask=[19717], adj_t=[19717, 19717, nnz=88648])
num_train tensor(60)
num_noise 0
noise: tensor(0)
data feature 500
ALTOPT(
  (lins): Sequential(
    (0): Linear(in_features=500, out_features=64, bias=True)
    (1): BatchNorm1d(64, eps=1e-05, momentum=0.1, affine=True, track_running_stats=True)
    (2): Dropout(p=0.9, inplace=True)
    (3): ReLU(inplace=True)
    (4): Linear(in_features=64, out_features=3, bias=True)
    (5): Identity()
  )
  (prop): Propagation(K=10, mode=None, lambda1=None, lambda2=None, L21=True, alpha=0.9500000000000001)
  (gcn): GCN(
    (convs): ModuleList(
      (0): GCNConv(500, 64)
      (1): GCNConv(64, 3)
    )
    (bns): ModuleList(
      (0): BatchNorm1d(64, eps=1e-05, momentum=0.1, affine=True, track_running_stats=True)
    )
    (output): Identity()
  )
)
propagate done
init label
Split: 01, Run: 01
None time:  3.0584065481089056
None Run 01:
Highest Train: 100.00
Highest Valid: 82.00
  Final Train: 100.00
   Final Test: 77.50
Split: 01, Run: 02
None time:  1.4799211600329727
None Run 02:
Highest Train: 100.00
Highest Valid: 83.80
  Final Train: 100.00
   Final Test: 79.40
Split: 01, Run: 03
None time:  0.8683721900451928
None Run 03:
Highest Train: 100.00
Highest Valid: 81.20
  Final Train: 100.00
   Final Test: 78.70
run time now: 5.455118417739868
total time:  5.500598971964791
None All runs:
Highest Train: 100.00 ± 0.00
Highest Valid: 82.33 ± 1.33
  Final Train: 100.00 ± 0.00
   Final Test: 78.53 ± 0.96
[I 2023-06-12 00:33:07,169] Trial 222 finished with value: 82.33333587646484 and parameters: {'Fwd': 4.443003206319804e-06, 'K': 10, 'alpha': 0.9500000000000001, 'dropout': 0.9, 'gnnepoch': 60, 'lambda1': 0.6000000000000001, 'lambda2': 6.797351269540401, 'loop': 1, 'loss': 'MSE', 'lr': 0.0027812170377012136, 'softmaxF': True, 'useGCN': False, 'weight_decay': 0.0017648512563344417, 'weightedloss': False}. Best is trial 205 with value: 83.53333282470703.
/home/wxy/miniconda3/lib/python3.10/site-packages/optuna/distributions.py:685: UserWarning: The distribution is specified by [0, 1.00001] and step=0.05, but the range is not divisible by `step`. It will be replaced by [0, 1.0].
  warnings.warn(
K:  10
alpha:  0.9
lr:  0.0025393304668650646
weight_decay:  0.0029840771263552964
dropout:  0.9
fix split and run 3 times
Data: Data(x=[19717, 500], y=[19717], train_mask=[19717], val_mask=[19717], test_mask=[19717], adj_t=[19717, 19717, nnz=88648])
num_train tensor(60)
num_noise 0
noise: tensor(0)
data feature 500
ALTOPT(
  (lins): Sequential(
    (0): Linear(in_features=500, out_features=64, bias=True)
    (1): BatchNorm1d(64, eps=1e-05, momentum=0.1, affine=True, track_running_stats=True)
    (2): Dropout(p=0.9, inplace=True)
    (3): ReLU(inplace=True)
    (4): Linear(in_features=64, out_features=3, bias=True)
    (5): Identity()
  )
  (prop): Propagation(K=10, mode=None, lambda1=None, lambda2=None, L21=True, alpha=0.9)
  (gcn): GCN(
    (convs): ModuleList(
      (0): GCNConv(500, 64)
      (1): GCNConv(64, 3)
    )
    (bns): ModuleList(
      (0): BatchNorm1d(64, eps=1e-05, momentum=0.1, affine=True, track_running_stats=True)
    )
    (output): Identity()
  )
)
propagate done
init label
Split: 01, Run: 01, Epoch: 100, Loss: 0.4090, Train: 100.00%, Valid: 80.80% Test: 76.80%
Split: 01, Run: 01
None time:  3.724657644983381
None Run 01:
Highest Train: 100.00
Highest Valid: 80.80
  Final Train: 100.00
   Final Test: 76.30
Split: 01, Run: 02
None time:  1.0888496888801455
None Run 02:
Highest Train: 100.00
Highest Valid: 83.20
  Final Train: 100.00
   Final Test: 79.70
Split: 01, Run: 03
None time:  1.3611759450286627
None Run 03:
Highest Train: 100.00
Highest Valid: 81.20
  Final Train: 100.00
   Final Test: 77.60
run time now: 6.233106851577759
total time:  6.296881397021934
None All runs:
Highest Train: 100.00 ± 0.00
Highest Valid: 81.73 ± 1.29
  Final Train: 100.00 ± 0.00
   Final Test: 77.87 ± 1.72
[I 2023-06-12 00:33:13,963] Trial 223 finished with value: 81.73332977294922 and parameters: {'Fwd': 3.432484620153974e-06, 'K': 10, 'alpha': 0.9, 'dropout': 0.9, 'gnnepoch': 60, 'lambda1': 0.65, 'lambda2': 6.951594192683238, 'loop': 1, 'loss': 'MSE', 'lr': 0.0025393304668650646, 'softmaxF': True, 'useGCN': False, 'weight_decay': 0.0029840771263552964, 'weightedloss': False}. Best is trial 205 with value: 83.53333282470703.
/home/wxy/miniconda3/lib/python3.10/site-packages/optuna/distributions.py:685: UserWarning: The distribution is specified by [0, 1.00001] and step=0.05, but the range is not divisible by `step`. It will be replaced by [0, 1.0].
  warnings.warn(
K:  10
alpha:  0.0
lr:  0.002154948907400714
weight_decay:  0.0022897322701629806
dropout:  0.9
fix split and run 3 times
Data: Data(x=[19717, 500], y=[19717], train_mask=[19717], val_mask=[19717], test_mask=[19717], adj_t=[19717, 19717, nnz=88648])
num_train tensor(60)
num_noise 0
noise: tensor(0)
data feature 500
ALTOPT(
  (lins): Sequential(
    (0): Linear(in_features=500, out_features=64, bias=True)
    (1): BatchNorm1d(64, eps=1e-05, momentum=0.1, affine=True, track_running_stats=True)
    (2): Dropout(p=0.9, inplace=True)
    (3): ReLU(inplace=True)
    (4): Linear(in_features=64, out_features=3, bias=True)
    (5): Identity()
  )
  (prop): Propagation(K=10, mode=None, lambda1=None, lambda2=None, L21=True, alpha=0.0)
  (gcn): GCN(
    (convs): ModuleList(
      (0): GCNConv(500, 64)
      (1): GCNConv(64, 3)
    )
    (bns): ModuleList(
      (0): BatchNorm1d(64, eps=1e-05, momentum=0.1, affine=True, track_running_stats=True)
    )
    (output): Identity()
  )
)
propagate done
init label
Split: 01, Run: 01
None time:  0.4641030877828598
None Run 01:
Highest Train: 100.00
Highest Valid: 69.80
  Final Train: 100.00
   Final Test: 69.60
Split: 01, Run: 02
None time:  0.3672050500754267
None Run 02:
Highest Train: 100.00
Highest Valid: 69.80
  Final Train: 100.00
   Final Test: 69.60
Split: 01, Run: 03
None time:  0.46017394377849996
None Run 03:
Highest Train: 100.00
Highest Valid: 69.80
  Final Train: 100.00
   Final Test: 69.60
run time now: 1.3469841480255127
total time:  1.3996403450146317
None All runs:
Highest Train: 100.00 ± 0.00
Highest Valid: 69.80 ± 0.00
  Final Train: 100.00 ± 0.00
   Final Test: 69.60 ± 0.00
