[I 2023-06-11 23:53:28,920] Trial 512 finished with value: 71.93333435058594 and parameters: {'Fwd': 8.285550280462803e-05, 'K': 8, 'alpha': 0.8500000000000001, 'dropout': 0.8, 'gnnepoch': 120, 'lambda1': 0.8, 'lambda2': 9.381876176546399, 'loop': 0, 'loss': 'CE', 'lr': 0.0012358442243855124, 'softmaxF': False, 'useGCN': True, 'weight_decay': 0.001259406313108079, 'weightedloss': True}. Best is trial 271 with value: 72.06666564941406.
/home/wxy/miniconda3/lib/python3.10/site-packages/optuna/distributions.py:685: UserWarning: The distribution is specified by [0, 1.00001] and step=0.05, but the range is not divisible by `step`. It will be replaced by [0, 1.0].
  warnings.warn(
K:  8
alpha:  0.8500000000000001
lr:  0.0011283760389646448
weight_decay:  0.00017402034293185234
dropout:  0.8
fix split and run 3 times
Data: Data(x=[3327, 3703], y=[3327], train_mask=[3327], val_mask=[3327], test_mask=[3327], adj_t=[3327, 3327, nnz=9104])
num_train tensor(120)
num_noise 0
noise: tensor(0)
data feature 3703
ALTOPT(
  (lins): Sequential(
    (0): Linear(in_features=3703, out_features=64, bias=True)
    (1): BatchNorm1d(64, eps=1e-05, momentum=0.1, affine=True, track_running_stats=True)
    (2): Dropout(p=0.8, inplace=True)
    (3): ReLU(inplace=True)
    (4): Linear(in_features=64, out_features=6, bias=True)
    (5): LogSoftmax(dim=-1)
  )
  (prop): Propagation(K=8, mode=None, lambda1=None, lambda2=None, L21=True, alpha=0.8500000000000001)
  (gcn): GCN(
    (convs): ModuleList(
      (0): GCNConv(3703, 64)
      (1): GCNConv(64, 6)
    )
    (bns): ModuleList(
      (0): BatchNorm1d(64, eps=1e-05, momentum=0.1, affine=True, track_running_stats=True)
    )
    (output): LogSoftmax(dim=-1)
  )
)
propagate done
init label
Split: 01, Run: 01
None time:  1.0628121320623904
None Run 01:
Highest Train: 100.00
Highest Valid: 71.00
  Final Train: 100.00
   Final Test: 69.50
Split: 01, Run: 02
None time:  1.1164673380553722
None Run 02:
Highest Train: 100.00
Highest Valid: 72.40
  Final Train: 100.00
   Final Test: 69.60
Split: 01, Run: 03
None time:  1.1076893729623407
None Run 03:
Highest Train: 100.00
Highest Valid: 71.80
  Final Train: 100.00
   Final Test: 70.50
run time now: 3.3292877674102783
total time:  3.3867610450834036
None All runs:
Highest Train: 100.00 ± 0.00
Highest Valid: 71.73 ± 0.70
  Final Train: 100.00 ± 0.00
   Final Test: 69.87 ± 0.55
[I 2023-06-11 23:53:32,898] Trial 513 finished with value: 71.73332977294922 and parameters: {'Fwd': 4.097263267162206e-05, 'K': 8, 'alpha': 0.8500000000000001, 'dropout': 0.8, 'gnnepoch': 120, 'lambda1': 0.8, 'lambda2': 9.400535995844342, 'loop': 0, 'loss': 'CE', 'lr': 0.0011283760389646448, 'softmaxF': False, 'useGCN': True, 'weight_decay': 0.00017402034293185234, 'weightedloss': True}. Best is trial 271 with value: 72.06666564941406.
/home/wxy/miniconda3/lib/python3.10/site-packages/optuna/distributions.py:685: UserWarning: The distribution is specified by [0, 1.00001] and step=0.05, but the range is not divisible by `step`. It will be replaced by [0, 1.0].
  warnings.warn(
K:  8
alpha:  0.8500000000000001
lr:  0.001215034207413959
weight_decay:  0.0012056132096886468
dropout:  0.8
fix split and run 3 times
Data: Data(x=[3327, 3703], y=[3327], train_mask=[3327], val_mask=[3327], test_mask=[3327], adj_t=[3327, 3327, nnz=9104])
num_train tensor(120)
num_noise 0
noise: tensor(0)
data feature 3703
ALTOPT(
  (lins): Sequential(
    (0): Linear(in_features=3703, out_features=64, bias=True)
    (1): BatchNorm1d(64, eps=1e-05, momentum=0.1, affine=True, track_running_stats=True)
    (2): Dropout(p=0.8, inplace=True)
    (3): ReLU(inplace=True)
    (4): Linear(in_features=64, out_features=6, bias=True)
    (5): LogSoftmax(dim=-1)
  )
  (prop): Propagation(K=8, mode=None, lambda1=None, lambda2=None, L21=True, alpha=0.8500000000000001)
  (gcn): GCN(
    (convs): ModuleList(
      (0): GCNConv(3703, 64)
      (1): GCNConv(64, 6)
    )
    (bns): ModuleList(
      (0): BatchNorm1d(64, eps=1e-05, momentum=0.1, affine=True, track_running_stats=True)
    )
    (output): LogSoftmax(dim=-1)
  )
)
propagate done
init label
Split: 01, Run: 01
None time:  0.9426561850123107
None Run 01:
Highest Train: 100.00
Highest Valid: 70.80
  Final Train: 100.00
   Final Test: 70.20
Split: 01, Run: 02
None time:  1.0232159639708698
None Run 02:
Highest Train: 100.00
Highest Valid: 68.60
  Final Train: 100.00
   Final Test: 67.80
Split: 01, Run: 03
None time:  0.9620272070169449
None Run 03:
Highest Train: 100.00
Highest Valid: 71.00
  Final Train: 100.00
   Final Test: 70.60
run time now: 2.988410234451294
total time:  3.04310584301129
None All runs:
Highest Train: 100.00 ± 0.00
Highest Valid: 70.13 ± 1.33
  Final Train: 100.00 ± 0.00
   Final Test: 69.53 ± 1.51
[I 2023-06-11 23:53:36,499] Trial 514 finished with value: 70.13333129882812 and parameters: {'Fwd': 0.006065803055006426, 'K': 8, 'alpha': 0.8500000000000001, 'dropout': 0.8, 'gnnepoch': 110, 'lambda1': 0.8, 'lambda2': 9.170098884079001, 'loop': 0, 'loss': 'CE', 'lr': 0.001215034207413959, 'softmaxF': False, 'useGCN': True, 'weight_decay': 0.0012056132096886468, 'weightedloss': True}. Best is trial 271 with value: 72.06666564941406.
/home/wxy/miniconda3/lib/python3.10/site-packages/optuna/distributions.py:685: UserWarning: The distribution is specified by [0, 1.00001] and step=0.05, but the range is not divisible by `step`. It will be replaced by [0, 1.0].
  warnings.warn(
K:  9
alpha:  0.8
lr:  0.0009101854571785449
weight_decay:  0.000256519374875565
dropout:  0.8
fix split and run 3 times
Data: Data(x=[3327, 3703], y=[3327], train_mask=[3327], val_mask=[3327], test_mask=[3327], adj_t=[3327, 3327, nnz=9104])
num_train tensor(120)
num_noise 0
noise: tensor(0)
data feature 3703
ALTOPT(
  (lins): Sequential(
    (0): Linear(in_features=3703, out_features=64, bias=True)
    (1): BatchNorm1d(64, eps=1e-05, momentum=0.1, affine=True, track_running_stats=True)
    (2): Dropout(p=0.8, inplace=True)
    (3): ReLU(inplace=True)
    (4): Linear(in_features=64, out_features=6, bias=True)
    (5): LogSoftmax(dim=-1)
  )
  (prop): Propagation(K=9, mode=None, lambda1=None, lambda2=None, L21=True, alpha=0.8)
  (gcn): GCN(
    (convs): ModuleList(
      (0): GCNConv(3703, 64)
      (1): GCNConv(64, 6)
    )
    (bns): ModuleList(
      (0): BatchNorm1d(64, eps=1e-05, momentum=0.1, affine=True, track_running_stats=True)
    )
    (output): LogSoftmax(dim=-1)
  )
)
propagate done
init label
Split: 01, Run: 01
None time:  0.7721003510523587
None Run 01:
Highest Train: 100.00
Highest Valid: 55.00
  Final Train: 99.17
   Final Test: 52.00
Split: 01, Run: 02
None time:  0.8527239209506661
None Run 02:
Highest Train: 100.00
Highest Valid: 58.00
  Final Train: 99.17
   Final Test: 57.10
Split: 01, Run: 03
None time:  0.8029396599158645
None Run 03:
Highest Train: 100.00
Highest Valid: 57.40
  Final Train: 98.33
   Final Test: 59.10
run time now: 2.470979928970337
total time:  2.524084674892947
None All runs:
Highest Train: 100.00 ± 0.00
Highest Valid: 56.80 ± 1.59
  Final Train: 98.89 ± 0.48
   Final Test: 56.07 ± 3.66
[I 2023-06-11 23:53:39,537] Trial 515 finished with value: 56.79999923706055 and parameters: {'Fwd': 7.542101562987907e-06, 'K': 9, 'alpha': 0.8, 'dropout': 0.8, 'gnnepoch': 120, 'lambda1': 0.8, 'lambda2': 9.702775345997646, 'loop': 0, 'loss': 'CE', 'lr': 0.0009101854571785449, 'softmaxF': False, 'useGCN': False, 'weight_decay': 0.000256519374875565, 'weightedloss': True}. Best is trial 271 with value: 72.06666564941406.
/home/wxy/miniconda3/lib/python3.10/site-packages/optuna/distributions.py:685: UserWarning: The distribution is specified by [0, 1.00001] and step=0.05, but the range is not divisible by `step`. It will be replaced by [0, 1.0].
  warnings.warn(
K:  8
alpha:  0.9
lr:  0.0012415926637172412
weight_decay:  0.0015564001679881595
dropout:  0.8
fix split and run 3 times
Data: Data(x=[3327, 3703], y=[3327], train_mask=[3327], val_mask=[3327], test_mask=[3327], adj_t=[3327, 3327, nnz=9104])
num_train tensor(120)
num_noise 0
noise: tensor(0)
data feature 3703
ALTOPT(
  (lins): Sequential(
    (0): Linear(in_features=3703, out_features=64, bias=True)
    (1): BatchNorm1d(64, eps=1e-05, momentum=0.1, affine=True, track_running_stats=True)
    (2): Dropout(p=0.8, inplace=True)
    (3): ReLU(inplace=True)
    (4): Linear(in_features=64, out_features=6, bias=True)
    (5): LogSoftmax(dim=-1)
  )
  (prop): Propagation(K=8, mode=None, lambda1=None, lambda2=None, L21=True, alpha=0.9)
  (gcn): GCN(
    (convs): ModuleList(
      (0): GCNConv(3703, 64)
      (1): GCNConv(64, 6)
    )
    (bns): ModuleList(
      (0): BatchNorm1d(64, eps=1e-05, momentum=0.1, affine=True, track_running_stats=True)
    )
    (output): LogSoftmax(dim=-1)
  )
)
propagate done
init label
Split: 01, Run: 01
None time:  1.035716295009479
None Run 01:
Highest Train: 100.00
Highest Valid: 71.60
  Final Train: 100.00
   Final Test: 69.50
Split: 01, Run: 02
None time:  1.069661189103499
None Run 02:
Highest Train: 100.00
Highest Valid: 72.40
  Final Train: 100.00
   Final Test: 70.00
Split: 01, Run: 03
None time:  1.1167312529869378
None Run 03:
Highest Train: 100.00
Highest Valid: 71.80
  Final Train: 100.00
   Final Test: 70.80
run time now: 3.2660915851593018
total time:  3.3224074200261384
None All runs:
Highest Train: 100.00 ± 0.00
Highest Valid: 71.93 ± 0.42
  Final Train: 100.00 ± 0.00
   Final Test: 70.10 ± 0.66
[I 2023-06-11 23:53:43,344] Trial 516 finished with value: 71.93333435058594 and parameters: {'Fwd': 0.00010740382586999312, 'K': 8, 'alpha': 0.9, 'dropout': 0.8, 'gnnepoch': 120, 'lambda1': 0.8, 'lambda2': 9.672769308234441, 'loop': 0, 'loss': 'CE', 'lr': 0.0012415926637172412, 'softmaxF': False, 'useGCN': True, 'weight_decay': 0.0015564001679881595, 'weightedloss': True}. Best is trial 271 with value: 72.06666564941406.
/home/wxy/miniconda3/lib/python3.10/site-packages/optuna/distributions.py:685: UserWarning: The distribution is specified by [0, 1.00001] and step=0.05, but the range is not divisible by `step`. It will be replaced by [0, 1.0].
  warnings.warn(
K:  8
alpha:  0.8500000000000001
lr:  0.0014644686511206362
weight_decay:  0.0009223986507842928
dropout:  0.8
fix split and run 3 times
Data: Data(x=[3327, 3703], y=[3327], train_mask=[3327], val_mask=[3327], test_mask=[3327], adj_t=[3327, 3327, nnz=9104])
num_train tensor(120)
num_noise 0
noise: tensor(0)
data feature 3703
ALTOPT(
  (lins): Sequential(
    (0): Linear(in_features=3703, out_features=64, bias=True)
    (1): BatchNorm1d(64, eps=1e-05, momentum=0.1, affine=True, track_running_stats=True)
    (2): Dropout(p=0.8, inplace=True)
    (3): ReLU(inplace=True)
    (4): Linear(in_features=64, out_features=6, bias=True)
    (5): LogSoftmax(dim=-1)
  )
  (prop): Propagation(K=8, mode=None, lambda1=None, lambda2=None, L21=True, alpha=0.8500000000000001)
  (gcn): GCN(
    (convs): ModuleList(
      (0): GCNConv(3703, 64)
      (1): GCNConv(64, 6)
    )
    (bns): ModuleList(
      (0): BatchNorm1d(64, eps=1e-05, momentum=0.1, affine=True, track_running_stats=True)
    )
    (output): LogSoftmax(dim=-1)
  )
)
propagate done
init label
Split: 01, Run: 01
None time:  1.0216716930735856
None Run 01:
Highest Train: 100.00
Highest Valid: 71.20
  Final Train: 100.00
   Final Test: 69.40
Split: 01, Run: 02
None time:  1.0138900568708777
None Run 02:
Highest Train: 100.00
Highest Valid: 72.00
  Final Train: 100.00
   Final Test: 70.00
Split: 01, Run: 03
None time:  1.1191127500496805
None Run 03:
Highest Train: 100.00
Highest Valid: 71.80
  Final Train: 100.00
   Final Test: 70.70
run time now: 3.1964216232299805
total time:  3.2473905328661203
None All runs:
Highest Train: 100.00 ± 0.00
Highest Valid: 71.67 ± 0.42
  Final Train: 100.00 ± 0.00
   Final Test: 70.03 ± 0.65
[I 2023-06-11 23:53:47,079] Trial 517 finished with value: 71.66667175292969 and parameters: {'Fwd': 1.394527571728733e-05, 'K': 8, 'alpha': 0.8500000000000001, 'dropout': 0.8, 'gnnepoch': 120, 'lambda1': 0.8, 'lambda2': 9.134529839385847, 'loop': 0, 'loss': 'CE', 'lr': 0.0014644686511206362, 'softmaxF': False, 'useGCN': True, 'weight_decay': 0.0009223986507842928, 'weightedloss': True}. Best is trial 271 with value: 72.06666564941406.
/home/wxy/miniconda3/lib/python3.10/site-packages/optuna/distributions.py:685: UserWarning: The distribution is specified by [0, 1.00001] and step=0.05, but the range is not divisible by `step`. It will be replaced by [0, 1.0].
  warnings.warn(
K:  8
alpha:  0.8500000000000001
lr:  0.0009870555728759163
weight_decay:  0.002327945361146137
dropout:  0.8
fix split and run 3 times
Data: Data(x=[3327, 3703], y=[3327], train_mask=[3327], val_mask=[3327], test_mask=[3327], adj_t=[3327, 3327, nnz=9104])
num_train tensor(120)
num_noise 0
noise: tensor(0)
data feature 3703
ALTOPT(
  (lins): Sequential(
    (0): Linear(in_features=3703, out_features=64, bias=True)
    (1): BatchNorm1d(64, eps=1e-05, momentum=0.1, affine=True, track_running_stats=True)
    (2): Dropout(p=0.8, inplace=True)
    (3): ReLU(inplace=True)
    (4): Linear(in_features=64, out_features=6, bias=True)
    (5): LogSoftmax(dim=-1)
  )
  (prop): Propagation(K=8, mode=None, lambda1=None, lambda2=None, L21=True, alpha=0.8500000000000001)
  (gcn): GCN(
    (convs): ModuleList(
      (0): GCNConv(3703, 64)
      (1): GCNConv(64, 6)
    )
    (bns): ModuleList(
      (0): BatchNorm1d(64, eps=1e-05, momentum=0.1, affine=True, track_running_stats=True)
    )
    (output): LogSoftmax(dim=-1)
  )
)
propagate done
init label
Split: 01, Run: 01
None time:  1.1588289740029722
None Run 01:
Highest Train: 100.00
Highest Valid: 70.60
  Final Train: 100.00
   Final Test: 69.60
Split: 01, Run: 02
None time:  1.1409846059978008
None Run 02:
Highest Train: 100.00
Highest Valid: 71.20
  Final Train: 100.00
   Final Test: 69.60
Split: 01, Run: 03
None time:  1.1542581079993397
None Run 03:
Highest Train: 100.00
Highest Valid: 70.00
  Final Train: 100.00
   Final Test: 68.70
run time now: 3.4959824085235596
total time:  3.547377329086885
None All runs:
Highest Train: 100.00 ± 0.00
Highest Valid: 70.60 ± 0.60
  Final Train: 100.00 ± 0.00
   Final Test: 69.30 ± 0.52
[I 2023-06-11 23:53:51,127] Trial 518 finished with value: 70.5999984741211 and parameters: {'Fwd': 6.280322438530493e-05, 'K': 8, 'alpha': 0.8500000000000001, 'dropout': 0.8, 'gnnepoch': 120, 'lambda1': 0.75, 'lambda2': 8.905861611254384, 'loop': 1, 'loss': 'CE', 'lr': 0.0009870555728759163, 'softmaxF': True, 'useGCN': True, 'weight_decay': 0.002327945361146137, 'weightedloss': True}. Best is trial 271 with value: 72.06666564941406.
/home/wxy/miniconda3/lib/python3.10/site-packages/optuna/distributions.py:685: UserWarning: The distribution is specified by [0, 1.00001] and step=0.05, but the range is not divisible by `step`. It will be replaced by [0, 1.0].
  warnings.warn(
K:  8
alpha:  0.9
lr:  0.0005025595773040485
weight_decay:  0.0015700945690543325
dropout:  0.8
fix split and run 3 times
Data: Data(x=[3327, 3703], y=[3327], train_mask=[3327], val_mask=[3327], test_mask=[3327], adj_t=[3327, 3327, nnz=9104])
num_train tensor(120)
num_noise 0
noise: tensor(0)
data feature 3703
ALTOPT(
  (lins): Sequential(
    (0): Linear(in_features=3703, out_features=64, bias=True)
    (1): BatchNorm1d(64, eps=1e-05, momentum=0.1, affine=True, track_running_stats=True)
    (2): Dropout(p=0.8, inplace=True)
    (3): ReLU(inplace=True)
    (4): Linear(in_features=64, out_features=6, bias=True)
    (5): LogSoftmax(dim=-1)
  )
  (prop): Propagation(K=8, mode=None, lambda1=None, lambda2=None, L21=True, alpha=0.9)
  (gcn): GCN(
    (convs): ModuleList(
      (0): GCNConv(3703, 64)
      (1): GCNConv(64, 6)
    )
    (bns): ModuleList(
      (0): BatchNorm1d(64, eps=1e-05, momentum=0.1, affine=True, track_running_stats=True)
    )
    (output): LogSoftmax(dim=-1)
  )
)
propagate done
init label
Split: 01, Run: 01
None time:  0.9872616631910205
None Run 01:
Highest Train: 100.00
Highest Valid: 70.60
  Final Train: 100.00
   Final Test: 69.80
Split: 01, Run: 02
None time:  1.055011214921251
None Run 02:
Highest Train: 100.00
Highest Valid: 67.80
  Final Train: 100.00
   Final Test: 67.70
Split: 01, Run: 03
None time:  1.073347776895389
None Run 03:
Highest Train: 100.00
Highest Valid: 68.80
  Final Train: 100.00
   Final Test: 68.90
run time now: 3.1568500995635986
total time:  3.2041115039028227
None All runs:
Highest Train: 100.00 ± 0.00
Highest Valid: 69.07 ± 1.42
  Final Train: 100.00 ± 0.00
   Final Test: 68.80 ± 1.05
[I 2023-06-11 23:53:54,809] Trial 519 finished with value: 69.06666564941406 and parameters: {'Fwd': 0.00030448150891517145, 'K': 8, 'alpha': 0.9, 'dropout': 0.8, 'gnnepoch': 110, 'lambda1': 0.75, 'lambda2': 6.234374319552599, 'loop': 0, 'loss': 'CE', 'lr': 0.0005025595773040485, 'softmaxF': False, 'useGCN': True, 'weight_decay': 0.0015700945690543325, 'weightedloss': True}. Best is trial 271 with value: 72.06666564941406.
/home/wxy/miniconda3/lib/python3.10/site-packages/optuna/distributions.py:685: UserWarning: The distribution is specified by [0, 1.00001] and step=0.05, but the range is not divisible by `step`. It will be replaced by [0, 1.0].
  warnings.warn(
K:  8
alpha:  0.8
lr:  0.0013150322846362521
weight_decay:  0.0007426425738665673
dropout:  0.7000000000000001
fix split and run 3 times
Data: Data(x=[3327, 3703], y=[3327], train_mask=[3327], val_mask=[3327], test_mask=[3327], adj_t=[3327, 3327, nnz=9104])
num_train tensor(120)
num_noise 0
noise: tensor(0)
data feature 3703
ALTOPT(
  (lins): Sequential(
    (0): Linear(in_features=3703, out_features=64, bias=True)
    (1): BatchNorm1d(64, eps=1e-05, momentum=0.1, affine=True, track_running_stats=True)
    (2): Dropout(p=0.7000000000000001, inplace=True)
    (3): ReLU(inplace=True)
    (4): Linear(in_features=64, out_features=6, bias=True)
    (5): LogSoftmax(dim=-1)
  )
  (prop): Propagation(K=8, mode=None, lambda1=None, lambda2=None, L21=True, alpha=0.8)
  (gcn): GCN(
    (convs): ModuleList(
      (0): GCNConv(3703, 64)
      (1): GCNConv(64, 6)
    )
    (bns): ModuleList(
      (0): BatchNorm1d(64, eps=1e-05, momentum=0.1, affine=True, track_running_stats=True)
    )
    (output): LogSoftmax(dim=-1)
  )
)
propagate done
init label
Split: 01, Run: 01
None time:  1.0530451908707619
None Run 01:
Highest Train: 100.00
Highest Valid: 71.40
  Final Train: 100.00
   Final Test: 69.50
Split: 01, Run: 02
None time:  1.0744223510846496
None Run 02:
Highest Train: 100.00
Highest Valid: 72.00
  Final Train: 100.00
   Final Test: 70.00
Split: 01, Run: 03
None time:  1.1197737550828606
None Run 03:
Highest Train: 100.00
Highest Valid: 71.40
  Final Train: 100.00
   Final Test: 71.30
run time now: 3.289402723312378
total time:  3.3370645658578724
None All runs:
Highest Train: 100.00 ± 0.00
Highest Valid: 71.60 ± 0.35
  Final Train: 100.00 ± 0.00
   Final Test: 70.27 ± 0.93
[I 2023-06-11 23:53:58,710] Trial 520 finished with value: 71.5999984741211 and parameters: {'Fwd': 1.0422160609560346e-05, 'K': 8, 'alpha': 0.8, 'dropout': 0.7000000000000001, 'gnnepoch': 120, 'lambda1': 0.8, 'lambda2': 9.420366001283314, 'loop': 0, 'loss': 'CE', 'lr': 0.0013150322846362521, 'softmaxF': False, 'useGCN': True, 'weight_decay': 0.0007426425738665673, 'weightedloss': True}. Best is trial 271 with value: 72.06666564941406.
/home/wxy/miniconda3/lib/python3.10/site-packages/optuna/distributions.py:685: UserWarning: The distribution is specified by [0, 1.00001] and step=0.05, but the range is not divisible by `step`. It will be replaced by [0, 1.0].
  warnings.warn(
K:  8
alpha:  0.9
lr:  0.00178293898402484
weight_decay:  0.0010357132361354488
dropout:  0.8
fix split and run 3 times
Data: Data(x=[3327, 3703], y=[3327], train_mask=[3327], val_mask=[3327], test_mask=[3327], adj_t=[3327, 3327, nnz=9104])
num_train tensor(120)
num_noise 0
noise: tensor(0)
data feature 3703
ALTOPT(
  (lins): Sequential(
    (0): Linear(in_features=3703, out_features=64, bias=True)
    (1): BatchNorm1d(64, eps=1e-05, momentum=0.1, affine=True, track_running_stats=True)
    (2): Dropout(p=0.8, inplace=True)
    (3): ReLU(inplace=True)
    (4): Linear(in_features=64, out_features=6, bias=True)
    (5): LogSoftmax(dim=-1)
  )
  (prop): Propagation(K=8, mode=None, lambda1=None, lambda2=None, L21=True, alpha=0.9)
  (gcn): GCN(
    (convs): ModuleList(
      (0): GCNConv(3703, 64)
      (1): GCNConv(64, 6)
    )
    (bns): ModuleList(
      (0): BatchNorm1d(64, eps=1e-05, momentum=0.1, affine=True, track_running_stats=True)
    )
    (output): LogSoftmax(dim=-1)
  )
)
propagate done
init label
Split: 01, Run: 01
None time:  1.0636310430709273
None Run 01:
Highest Train: 100.00
Highest Valid: 71.20
  Final Train: 100.00
   Final Test: 69.60
Split: 01, Run: 02
None time:  1.0988933071494102
None Run 02:
Highest Train: 100.00
Highest Valid: 72.00
  Final Train: 100.00
   Final Test: 70.20
Split: 01, Run: 03
None time:  1.0848243290092796
None Run 03:
Highest Train: 100.00
Highest Valid: 71.80
  Final Train: 100.00
   Final Test: 70.00
run time now: 3.2889556884765625
total time:  3.3502460159361362
None All runs:
Highest Train: 100.00 ± 0.00
Highest Valid: 71.67 ± 0.42
  Final Train: 100.00 ± 0.00
   Final Test: 69.93 ± 0.31
