[I 2023-06-11 23:31:58,078] Trial 179 finished with value: 71.26667022705078 and parameters: {'Fwd': 0.04828709295898107, 'K': 8, 'alpha': 0.45, 'dropout': 0.9, 'gnnepoch': 120, 'lambda1': 0.9500000000000001, 'lambda2': 2.981941458658585, 'loop': 0, 'loss': 'CE', 'lr': 0.001337349687677668, 'softmaxF': False, 'useGCN': True, 'weight_decay': 1.2634613437191103e-06, 'weightedloss': False}. Best is trial 146 with value: 71.86666870117188.
/home/wxy/miniconda3/lib/python3.10/site-packages/optuna/distributions.py:685: UserWarning: The distribution is specified by [0, 1.00001] and step=0.05, but the range is not divisible by `step`. It will be replaced by [0, 1.0].
  warnings.warn(
K:  7
alpha:  0.35000000000000003
lr:  0.001839294592515296
weight_decay:  4.6666850029683435e-06
dropout:  0.7000000000000001
fix split and run 3 times
Data: Data(x=[3327, 3703], y=[3327], train_mask=[3327], val_mask=[3327], test_mask=[3327], adj_t=[3327, 3327, nnz=9104])
num_train tensor(120)
num_noise 0
noise: tensor(0)
data feature 3703
ALTOPT(
  (lins): Sequential(
    (0): Linear(in_features=3703, out_features=64, bias=True)
    (1): BatchNorm1d(64, eps=1e-05, momentum=0.1, affine=True, track_running_stats=True)
    (2): Dropout(p=0.7000000000000001, inplace=True)
    (3): ReLU(inplace=True)
    (4): Linear(in_features=64, out_features=6, bias=True)
    (5): LogSoftmax(dim=-1)
  )
  (prop): Propagation(K=7, mode=None, lambda1=None, lambda2=None, L21=True, alpha=0.35000000000000003)
  (gcn): GCN(
    (convs): ModuleList(
      (0): GCNConv(3703, 64)
      (1): GCNConv(64, 6)
    )
    (bns): ModuleList(
      (0): BatchNorm1d(64, eps=1e-05, momentum=0.1, affine=True, track_running_stats=True)
    )
    (output): LogSoftmax(dim=-1)
  )
)
propagate done
init label
Split: 01, Run: 01
None time:  1.0714818860869855
None Run 01:
Highest Train: 100.00
Highest Valid: 71.40
  Final Train: 100.00
   Final Test: 69.70
Split: 01, Run: 02
None time:  0.9835339169949293
None Run 02:
Highest Train: 100.00
Highest Valid: 72.00
  Final Train: 100.00
   Final Test: 70.00
Split: 01, Run: 03
None time:  1.1304693550337106
None Run 03:
Highest Train: 100.00
Highest Valid: 71.40
  Final Train: 99.17
   Final Test: 70.30
run time now: 3.2253577709198
total time:  3.281648064032197
None All runs:
Highest Train: 100.00 ± 0.00
Highest Valid: 71.60 ± 0.35
  Final Train: 99.72 ± 0.48
   Final Test: 70.00 ± 0.30
[I 2023-06-11 23:32:01,868] Trial 180 finished with value: 71.5999984741211 and parameters: {'Fwd': 0.022700480386653572, 'K': 7, 'alpha': 0.35000000000000003, 'dropout': 0.7000000000000001, 'gnnepoch': 120, 'lambda1': 0.8500000000000001, 'lambda2': 3.489812696473786, 'loop': 0, 'loss': 'CE', 'lr': 0.001839294592515296, 'softmaxF': False, 'useGCN': True, 'weight_decay': 4.6666850029683435e-06, 'weightedloss': False}. Best is trial 146 with value: 71.86666870117188.
/home/wxy/miniconda3/lib/python3.10/site-packages/optuna/distributions.py:685: UserWarning: The distribution is specified by [0, 1.00001] and step=0.05, but the range is not divisible by `step`. It will be replaced by [0, 1.0].
  warnings.warn(
K:  8
alpha:  0.25
lr:  0.0031768292034594983
weight_decay:  2.832210894129754e-05
dropout:  0.9
fix split and run 3 times
Data: Data(x=[3327, 3703], y=[3327], train_mask=[3327], val_mask=[3327], test_mask=[3327], adj_t=[3327, 3327, nnz=9104])
num_train tensor(120)
num_noise 0
noise: tensor(0)
data feature 3703
ALTOPT(
  (lins): Sequential(
    (0): Linear(in_features=3703, out_features=64, bias=True)
    (1): BatchNorm1d(64, eps=1e-05, momentum=0.1, affine=True, track_running_stats=True)
    (2): Dropout(p=0.9, inplace=True)
    (3): ReLU(inplace=True)
    (4): Linear(in_features=64, out_features=6, bias=True)
    (5): LogSoftmax(dim=-1)
  )
  (prop): Propagation(K=8, mode=None, lambda1=None, lambda2=None, L21=True, alpha=0.25)
  (gcn): GCN(
    (convs): ModuleList(
      (0): GCNConv(3703, 64)
      (1): GCNConv(64, 6)
    )
    (bns): ModuleList(
      (0): BatchNorm1d(64, eps=1e-05, momentum=0.1, affine=True, track_running_stats=True)
    )
    (output): LogSoftmax(dim=-1)
  )
)
propagate done
init label
Split: 01, Run: 01
None time:  1.0664130640216172
None Run 01:
Highest Train: 100.00
Highest Valid: 71.60
  Final Train: 100.00
   Final Test: 69.10
Split: 01, Run: 02
None time:  1.0280419560149312
None Run 02:
Highest Train: 100.00
Highest Valid: 71.80
  Final Train: 100.00
   Final Test: 70.20
Split: 01, Run: 03
None time:  1.0549176139757037
None Run 03:
Highest Train: 100.00
Highest Valid: 71.80
  Final Train: 100.00
   Final Test: 69.80
run time now: 3.197540760040283
total time:  3.261726405005902
None All runs:
Highest Train: 100.00 ± 0.00
Highest Valid: 71.73 ± 0.12
  Final Train: 100.00 ± 0.00
   Final Test: 69.70 ± 0.56
[I 2023-06-11 23:32:05,625] Trial 181 finished with value: 71.73332977294922 and parameters: {'Fwd': 0.009207696013036976, 'K': 8, 'alpha': 0.25, 'dropout': 0.9, 'gnnepoch': 120, 'lambda1': 0.8, 'lambda2': 3.2869995877346154, 'loop': 0, 'loss': 'CE', 'lr': 0.0031768292034594983, 'softmaxF': False, 'useGCN': True, 'weight_decay': 2.832210894129754e-05, 'weightedloss': False}. Best is trial 146 with value: 71.86666870117188.
/home/wxy/miniconda3/lib/python3.10/site-packages/optuna/distributions.py:685: UserWarning: The distribution is specified by [0, 1.00001] and step=0.05, but the range is not divisible by `step`. It will be replaced by [0, 1.0].
  warnings.warn(
K:  8
alpha:  0.25
lr:  0.0031952833507484773
weight_decay:  7.267321265745574e-06
dropout:  0.9
fix split and run 3 times
Data: Data(x=[3327, 3703], y=[3327], train_mask=[3327], val_mask=[3327], test_mask=[3327], adj_t=[3327, 3327, nnz=9104])
num_train tensor(120)
num_noise 0
noise: tensor(0)
data feature 3703
ALTOPT(
  (lins): Sequential(
    (0): Linear(in_features=3703, out_features=64, bias=True)
    (1): BatchNorm1d(64, eps=1e-05, momentum=0.1, affine=True, track_running_stats=True)
    (2): Dropout(p=0.9, inplace=True)
    (3): ReLU(inplace=True)
    (4): Linear(in_features=64, out_features=6, bias=True)
    (5): LogSoftmax(dim=-1)
  )
  (prop): Propagation(K=8, mode=None, lambda1=None, lambda2=None, L21=True, alpha=0.25)
  (gcn): GCN(
    (convs): ModuleList(
      (0): GCNConv(3703, 64)
      (1): GCNConv(64, 6)
    )
    (bns): ModuleList(
      (0): BatchNorm1d(64, eps=1e-05, momentum=0.1, affine=True, track_running_stats=True)
    )
    (output): LogSoftmax(dim=-1)
  )
)
propagate done
init label
Split: 01, Run: 01
None time:  1.022146720904857
None Run 01:
Highest Train: 100.00
Highest Valid: 71.40
  Final Train: 100.00
   Final Test: 69.20
Split: 01, Run: 02
None time:  0.9699310490395874
None Run 02:
Highest Train: 100.00
Highest Valid: 71.60
  Final Train: 100.00
   Final Test: 70.10
Split: 01, Run: 03
None time:  1.1067442768253386
None Run 03:
Highest Train: 100.00
Highest Valid: 71.80
  Final Train: 100.00
   Final Test: 69.70
run time now: 3.140251636505127
total time:  3.1929925200529397
None All runs:
Highest Train: 100.00 ± 0.00
Highest Valid: 71.60 ± 0.20
  Final Train: 100.00 ± 0.00
   Final Test: 69.67 ± 0.45
[I 2023-06-11 23:32:09,229] Trial 182 finished with value: 71.5999984741211 and parameters: {'Fwd': 0.011247762253742587, 'K': 8, 'alpha': 0.25, 'dropout': 0.9, 'gnnepoch': 120, 'lambda1': 0.75, 'lambda2': 3.283336332081794, 'loop': 0, 'loss': 'CE', 'lr': 0.0031952833507484773, 'softmaxF': False, 'useGCN': True, 'weight_decay': 7.267321265745574e-06, 'weightedloss': False}. Best is trial 146 with value: 71.86666870117188.
/home/wxy/miniconda3/lib/python3.10/site-packages/optuna/distributions.py:685: UserWarning: The distribution is specified by [0, 1.00001] and step=0.05, but the range is not divisible by `step`. It will be replaced by [0, 1.0].
  warnings.warn(
K:  8
alpha:  0.30000000000000004
lr:  0.002867872401522305
weight_decay:  1.9754569143085747e-06
dropout:  0.9
fix split and run 3 times
Data: Data(x=[3327, 3703], y=[3327], train_mask=[3327], val_mask=[3327], test_mask=[3327], adj_t=[3327, 3327, nnz=9104])
num_train tensor(120)
num_noise 0
noise: tensor(0)
data feature 3703
ALTOPT(
  (lins): Sequential(
    (0): Linear(in_features=3703, out_features=64, bias=True)
    (1): BatchNorm1d(64, eps=1e-05, momentum=0.1, affine=True, track_running_stats=True)
    (2): Dropout(p=0.9, inplace=True)
    (3): ReLU(inplace=True)
    (4): Linear(in_features=64, out_features=6, bias=True)
    (5): LogSoftmax(dim=-1)
  )
  (prop): Propagation(K=8, mode=None, lambda1=None, lambda2=None, L21=True, alpha=0.30000000000000004)
  (gcn): GCN(
    (convs): ModuleList(
      (0): GCNConv(3703, 64)
      (1): GCNConv(64, 6)
    )
    (bns): ModuleList(
      (0): BatchNorm1d(64, eps=1e-05, momentum=0.1, affine=True, track_running_stats=True)
    )
    (output): LogSoftmax(dim=-1)
  )
)
propagate done
init label
Split: 01, Run: 01
None time:  1.0658489991910756
None Run 01:
Highest Train: 100.00
Highest Valid: 71.20
  Final Train: 100.00
   Final Test: 69.40
Split: 01, Run: 02
None time:  1.1243375879712403
None Run 02:
Highest Train: 100.00
Highest Valid: 71.20
  Final Train: 100.00
   Final Test: 70.00
Split: 01, Run: 03
None time:  1.066087184008211
None Run 03:
Highest Train: 100.00
Highest Valid: 71.80
  Final Train: 100.00
   Final Test: 71.00
run time now: 3.2991819381713867
total time:  3.3448868659324944
None All runs:
Highest Train: 100.00 ± 0.00
Highest Valid: 71.40 ± 0.35
  Final Train: 100.00 ± 0.00
   Final Test: 70.13 ± 0.81
[I 2023-06-11 23:32:13,144] Trial 183 finished with value: 71.4000015258789 and parameters: {'Fwd': 0.01606450940277375, 'K': 8, 'alpha': 0.30000000000000004, 'dropout': 0.9, 'gnnepoch': 120, 'lambda1': 0.25, 'lambda2': 3.065593682814801, 'loop': 0, 'loss': 'CE', 'lr': 0.002867872401522305, 'softmaxF': False, 'useGCN': True, 'weight_decay': 1.9754569143085747e-06, 'weightedloss': False}. Best is trial 146 with value: 71.86666870117188.
/home/wxy/miniconda3/lib/python3.10/site-packages/optuna/distributions.py:685: UserWarning: The distribution is specified by [0, 1.00001] and step=0.05, but the range is not divisible by `step`. It will be replaced by [0, 1.0].
  warnings.warn(
K:  8
alpha:  0.25
lr:  0.0034061304232534968
weight_decay:  2.635613793580518e-05
dropout:  0.9
fix split and run 3 times
Data: Data(x=[3327, 3703], y=[3327], train_mask=[3327], val_mask=[3327], test_mask=[3327], adj_t=[3327, 3327, nnz=9104])
num_train tensor(120)
num_noise 0
noise: tensor(0)
data feature 3703
ALTOPT(
  (lins): Sequential(
    (0): Linear(in_features=3703, out_features=64, bias=True)
    (1): BatchNorm1d(64, eps=1e-05, momentum=0.1, affine=True, track_running_stats=True)
    (2): Dropout(p=0.9, inplace=True)
    (3): ReLU(inplace=True)
    (4): Linear(in_features=64, out_features=6, bias=True)
    (5): LogSoftmax(dim=-1)
  )
  (prop): Propagation(K=8, mode=None, lambda1=None, lambda2=None, L21=True, alpha=0.25)
  (gcn): GCN(
    (convs): ModuleList(
      (0): GCNConv(3703, 64)
      (1): GCNConv(64, 6)
    )
    (bns): ModuleList(
      (0): BatchNorm1d(64, eps=1e-05, momentum=0.1, affine=True, track_running_stats=True)
    )
    (output): LogSoftmax(dim=-1)
  )
)
propagate done
init label
Split: 01, Run: 01
None time:  1.069555148947984
None Run 01:
Highest Train: 100.00
Highest Valid: 71.40
  Final Train: 100.00
   Final Test: 69.20
Split: 01, Run: 02
None time:  1.0298407019581646
None Run 02:
Highest Train: 100.00
Highest Valid: 71.80
  Final Train: 100.00
   Final Test: 69.60
Split: 01, Run: 03
None time:  1.0533339160028845
None Run 03:
Highest Train: 100.00
Highest Valid: 71.40
  Final Train: 100.00
   Final Test: 69.70
run time now: 3.193791151046753
total time:  3.2508257960435003
None All runs:
Highest Train: 100.00 ± 0.00
Highest Valid: 71.53 ± 0.23
  Final Train: 100.00 ± 0.00
   Final Test: 69.50 ± 0.26
[I 2023-06-11 23:32:16,879] Trial 184 finished with value: 71.53333282470703 and parameters: {'Fwd': 0.007124260371659006, 'K': 8, 'alpha': 0.25, 'dropout': 0.9, 'gnnepoch': 120, 'lambda1': 0.8500000000000001, 'lambda2': 3.8873015914760396, 'loop': 0, 'loss': 'CE', 'lr': 0.0034061304232534968, 'softmaxF': False, 'useGCN': True, 'weight_decay': 2.635613793580518e-05, 'weightedloss': False}. Best is trial 146 with value: 71.86666870117188.
/home/wxy/miniconda3/lib/python3.10/site-packages/optuna/distributions.py:685: UserWarning: The distribution is specified by [0, 1.00001] and step=0.05, but the range is not divisible by `step`. It will be replaced by [0, 1.0].
  warnings.warn(
K:  9
alpha:  0.2
lr:  0.0026389187617057177
weight_decay:  1.227151151278793e-05
dropout:  0.9
fix split and run 3 times
Data: Data(x=[3327, 3703], y=[3327], train_mask=[3327], val_mask=[3327], test_mask=[3327], adj_t=[3327, 3327, nnz=9104])
num_train tensor(120)
num_noise 0
noise: tensor(0)
data feature 3703
ALTOPT(
  (lins): Sequential(
    (0): Linear(in_features=3703, out_features=64, bias=True)
    (1): BatchNorm1d(64, eps=1e-05, momentum=0.1, affine=True, track_running_stats=True)
    (2): Dropout(p=0.9, inplace=True)
    (3): ReLU(inplace=True)
    (4): Linear(in_features=64, out_features=6, bias=True)
    (5): LogSoftmax(dim=-1)
  )
  (prop): Propagation(K=9, mode=None, lambda1=None, lambda2=None, L21=True, alpha=0.2)
  (gcn): GCN(
    (convs): ModuleList(
      (0): GCNConv(3703, 64)
      (1): GCNConv(64, 6)
    )
    (bns): ModuleList(
      (0): BatchNorm1d(64, eps=1e-05, momentum=0.1, affine=True, track_running_stats=True)
    )
    (output): LogSoftmax(dim=-1)
  )
)
propagate done
init label
Split: 01, Run: 01
None time:  1.0349141610786319
None Run 01:
Highest Train: 100.00
Highest Valid: 70.80
  Final Train: 100.00
   Final Test: 69.30
Split: 01, Run: 02
None time:  1.063734307186678
None Run 02:
Highest Train: 100.00
Highest Valid: 71.40
  Final Train: 100.00
   Final Test: 70.80
Split: 01, Run: 03
None time:  1.1166965439915657
None Run 03:
Highest Train: 100.00
Highest Valid: 71.80
  Final Train: 100.00
   Final Test: 70.10
run time now: 3.256660223007202
total time:  3.302771506132558
None All runs:
Highest Train: 100.00 ± 0.00
Highest Valid: 71.33 ± 0.50
  Final Train: 100.00 ± 0.00
   Final Test: 70.07 ± 0.75
[I 2023-06-11 23:32:20,691] Trial 185 finished with value: 71.33333587646484 and parameters: {'Fwd': 0.004266479592520025, 'K': 9, 'alpha': 0.2, 'dropout': 0.9, 'gnnepoch': 120, 'lambda1': 0.4, 'lambda2': 4.768346547221186, 'loop': 0, 'loss': 'CE', 'lr': 0.0026389187617057177, 'softmaxF': False, 'useGCN': True, 'weight_decay': 1.227151151278793e-05, 'weightedloss': False}. Best is trial 146 with value: 71.86666870117188.
/home/wxy/miniconda3/lib/python3.10/site-packages/optuna/distributions.py:685: UserWarning: The distribution is specified by [0, 1.00001] and step=0.05, but the range is not divisible by `step`. It will be replaced by [0, 1.0].
  warnings.warn(
K:  8
alpha:  0.15000000000000002
lr:  0.002963516187700166
weight_decay:  2.809551004551836e-06
dropout:  0.8
fix split and run 3 times
Data: Data(x=[3327, 3703], y=[3327], train_mask=[3327], val_mask=[3327], test_mask=[3327], adj_t=[3327, 3327, nnz=9104])
num_train tensor(120)
num_noise 0
noise: tensor(0)
data feature 3703
ALTOPT(
  (lins): Sequential(
    (0): Linear(in_features=3703, out_features=64, bias=True)
    (1): BatchNorm1d(64, eps=1e-05, momentum=0.1, affine=True, track_running_stats=True)
    (2): Dropout(p=0.8, inplace=True)
    (3): ReLU(inplace=True)
    (4): Linear(in_features=64, out_features=6, bias=True)
    (5): LogSoftmax(dim=-1)
  )
  (prop): Propagation(K=8, mode=None, lambda1=None, lambda2=None, L21=True, alpha=0.15000000000000002)
  (gcn): GCN(
    (convs): ModuleList(
      (0): GCNConv(3703, 64)
      (1): GCNConv(64, 6)
    )
    (bns): ModuleList(
      (0): BatchNorm1d(64, eps=1e-05, momentum=0.1, affine=True, track_running_stats=True)
    )
    (output): LogSoftmax(dim=-1)
  )
)
propagate done
init label
Split: 01, Run: 01
None time:  0.7240450310055166
None Run 01:
Highest Train: 100.00
Highest Valid: 46.80
  Final Train: 100.00
   Final Test: 46.40
Split: 01, Run: 02
None time:  0.73024758300744
None Run 02:
Highest Train: 100.00
Highest Valid: 57.80
  Final Train: 100.00
   Final Test: 57.30
Split: 01, Run: 03
None time:  0.8174577159807086
None Run 03:
Highest Train: 100.00
Highest Valid: 59.80
  Final Train: 97.50
   Final Test: 60.10
run time now: 2.3123159408569336
total time:  2.3762487310450524
None All runs:
Highest Train: 100.00 ± 0.00
Highest Valid: 54.80 ± 7.00
  Final Train: 99.17 ± 1.44
   Final Test: 54.60 ± 7.24
[I 2023-06-11 23:32:23,475] Trial 186 finished with value: 54.79999923706055 and parameters: {'Fwd': 0.012705041984424664, 'K': 8, 'alpha': 0.15000000000000002, 'dropout': 0.8, 'gnnepoch': 120, 'lambda1': 0.7000000000000001, 'lambda2': 5.9761332180223645, 'loop': 0, 'loss': 'CE', 'lr': 0.002963516187700166, 'softmaxF': False, 'useGCN': False, 'weight_decay': 2.809551004551836e-06, 'weightedloss': True}. Best is trial 146 with value: 71.86666870117188.
/home/wxy/miniconda3/lib/python3.10/site-packages/optuna/distributions.py:685: UserWarning: The distribution is specified by [0, 1.00001] and step=0.05, but the range is not divisible by `step`. It will be replaced by [0, 1.0].
  warnings.warn(
K:  8
alpha:  0.30000000000000004
lr:  0.0022235210620715753
weight_decay:  8.842616717183928e-06
dropout:  0.9
fix split and run 3 times
Data: Data(x=[3327, 3703], y=[3327], train_mask=[3327], val_mask=[3327], test_mask=[3327], adj_t=[3327, 3327, nnz=9104])
num_train tensor(120)
num_noise 0
noise: tensor(0)
data feature 3703
ALTOPT(
  (lins): Sequential(
    (0): Linear(in_features=3703, out_features=64, bias=True)
    (1): BatchNorm1d(64, eps=1e-05, momentum=0.1, affine=True, track_running_stats=True)
    (2): Dropout(p=0.9, inplace=True)
    (3): ReLU(inplace=True)
    (4): Linear(in_features=64, out_features=6, bias=True)
    (5): LogSoftmax(dim=-1)
  )
  (prop): Propagation(K=8, mode=None, lambda1=None, lambda2=None, L21=True, alpha=0.30000000000000004)
  (gcn): GCN(
    (convs): ModuleList(
      (0): GCNConv(3703, 64)
      (1): GCNConv(64, 6)
    )
    (bns): ModuleList(
      (0): BatchNorm1d(64, eps=1e-05, momentum=0.1, affine=True, track_running_stats=True)
    )
    (output): LogSoftmax(dim=-1)
  )
)
propagate done
init label
Split: 01, Run: 01
None time:  0.9910621969029307
None Run 01:
Highest Train: 100.00
Highest Valid: 71.00
  Final Train: 100.00
   Final Test: 69.10
Split: 01, Run: 02
None time:  0.9780668700113893
None Run 02:
Highest Train: 100.00
Highest Valid: 70.80
  Final Train: 100.00
   Final Test: 68.30
Split: 01, Run: 03
None time:  0.9695604259613901
None Run 03:
Highest Train: 100.00
Highest Valid: 71.60
  Final Train: 100.00
   Final Test: 70.30
run time now: 2.9800822734832764
total time:  3.039211052004248
None All runs:
Highest Train: 100.00 ± 0.00
Highest Valid: 71.13 ± 0.42
  Final Train: 100.00 ± 0.00
   Final Test: 69.23 ± 1.01
[I 2023-06-11 23:32:26,930] Trial 187 finished with value: 71.13333129882812 and parameters: {'Fwd': 0.00850448784924296, 'K': 8, 'alpha': 0.30000000000000004, 'dropout': 0.9, 'gnnepoch': 110, 'lambda1': 1.0, 'lambda2': 3.5286032050787086, 'loop': 0, 'loss': 'CE', 'lr': 0.0022235210620715753, 'softmaxF': False, 'useGCN': True, 'weight_decay': 8.842616717183928e-06, 'weightedloss': False}. Best is trial 146 with value: 71.86666870117188.
/home/wxy/miniconda3/lib/python3.10/site-packages/optuna/distributions.py:685: UserWarning: The distribution is specified by [0, 1.00001] and step=0.05, but the range is not divisible by `step`. It will be replaced by [0, 1.0].
  warnings.warn(
K:  9
alpha:  0.25
lr:  0.004194192721802844
weight_decay:  1.5990016981579974e-06
dropout:  0.9
fix split and run 3 times
Data: Data(x=[3327, 3703], y=[3327], train_mask=[3327], val_mask=[3327], test_mask=[3327], adj_t=[3327, 3327, nnz=9104])
num_train tensor(120)
num_noise 0
noise: tensor(0)
data feature 3703
ALTOPT(
  (lins): Sequential(
    (0): Linear(in_features=3703, out_features=64, bias=True)
    (1): BatchNorm1d(64, eps=1e-05, momentum=0.1, affine=True, track_running_stats=True)
    (2): Dropout(p=0.9, inplace=True)
    (3): ReLU(inplace=True)
    (4): Linear(in_features=64, out_features=6, bias=True)
    (5): LogSoftmax(dim=-1)
  )
  (prop): Propagation(K=9, mode=None, lambda1=None, lambda2=None, L21=True, alpha=0.25)
  (gcn): GCN(
    (convs): ModuleList(
      (0): GCNConv(3703, 64)
      (1): GCNConv(64, 6)
    )
    (bns): ModuleList(
      (0): BatchNorm1d(64, eps=1e-05, momentum=0.1, affine=True, track_running_stats=True)
    )
    (output): LogSoftmax(dim=-1)
  )
)
propagate done
init label
Split: 01, Run: 01
None time:  1.0647902598138899
None Run 01:
Highest Train: 100.00
Highest Valid: 71.60
  Final Train: 99.17
   Final Test: 69.90
Split: 01, Run: 02
None time:  1.0453466300386935
None Run 02:
Highest Train: 100.00
Highest Valid: 71.20
  Final Train: 99.17
   Final Test: 70.10
Split: 01, Run: 03
None time:  1.0761483719106764
None Run 03:
Highest Train: 100.00
Highest Valid: 71.40
  Final Train: 98.33
   Final Test: 70.40
run time now: 3.230163812637329
total time:  3.2877887380309403
None All runs:
Highest Train: 100.00 ± 0.00
Highest Valid: 71.40 ± 0.20
  Final Train: 98.89 ± 0.48
   Final Test: 70.13 ± 0.25
