[I 2023-06-12 00:08:02,182] Trial 737 finished with value: 71.80000305175781 and parameters: {'Fwd': 1.939159382071929e-06, 'K': 8, 'alpha': 0.45, 'dropout': 0.8, 'gnnepoch': 120, 'lambda1': 0.7000000000000001, 'lambda2': 5.5822757313401326, 'loop': 0, 'loss': 'CE', 'lr': 0.001170914377286405, 'softmaxF': False, 'useGCN': True, 'weight_decay': 0.005975379445904351, 'weightedloss': True}. Best is trial 605 with value: 72.13333129882812.
/home/wxy/miniconda3/lib/python3.10/site-packages/optuna/distributions.py:685: UserWarning: The distribution is specified by [0, 1.00001] and step=0.05, but the range is not divisible by `step`. It will be replaced by [0, 1.0].
  warnings.warn(
K:  8
alpha:  0.8
lr:  0.0002650793370696107
weight_decay:  0.00893415718093286
dropout:  0.8
fix split and run 3 times
Data: Data(x=[3327, 3703], y=[3327], train_mask=[3327], val_mask=[3327], test_mask=[3327], adj_t=[3327, 3327, nnz=9104])
num_train tensor(120)
num_noise 0
noise: tensor(0)
data feature 3703
ALTOPT(
  (lins): Sequential(
    (0): Linear(in_features=3703, out_features=64, bias=True)
    (1): BatchNorm1d(64, eps=1e-05, momentum=0.1, affine=True, track_running_stats=True)
    (2): Dropout(p=0.8, inplace=True)
    (3): ReLU(inplace=True)
    (4): Linear(in_features=64, out_features=6, bias=True)
    (5): LogSoftmax(dim=-1)
  )
  (prop): Propagation(K=8, mode=None, lambda1=None, lambda2=None, L21=True, alpha=0.8)
  (gcn): GCN(
    (convs): ModuleList(
      (0): GCNConv(3703, 64)
      (1): GCNConv(64, 6)
    )
    (bns): ModuleList(
      (0): BatchNorm1d(64, eps=1e-05, momentum=0.1, affine=True, track_running_stats=True)
    )
    (output): LogSoftmax(dim=-1)
  )
)
propagate done
init label
Split: 01, Run: 01
None time:  1.1030497190076858
None Run 01:
Highest Train: 100.00
Highest Valid: 69.60
  Final Train: 100.00
   Final Test: 69.30
Split: 01, Run: 02
None time:  1.3283544438891113
None Run 02:
Highest Train: 100.00
Highest Valid: 72.60
  Final Train: 100.00
   Final Test: 70.20
Split: 01, Run: 03
None time:  1.2487215721048415
None Run 03:
Highest Train: 100.00
Highest Valid: 67.60
  Final Train: 100.00
   Final Test: 67.40
run time now: 3.7211318016052246
total time:  3.7743593719787896
None All runs:
Highest Train: 100.00 ± 0.00
Highest Valid: 69.93 ± 2.52
  Final Train: 100.00 ± 0.00
   Final Test: 68.97 ± 1.43
[I 2023-06-12 00:08:06,473] Trial 738 finished with value: 69.9333267211914 and parameters: {'Fwd': 3.084203014171455e-06, 'K': 8, 'alpha': 0.8, 'dropout': 0.8, 'gnnepoch': 120, 'lambda1': 0.6000000000000001, 'lambda2': 8.088462709706274, 'loop': 1, 'loss': 'CE', 'lr': 0.0002650793370696107, 'softmaxF': False, 'useGCN': True, 'weight_decay': 0.00893415718093286, 'weightedloss': True}. Best is trial 605 with value: 72.13333129882812.
/home/wxy/miniconda3/lib/python3.10/site-packages/optuna/distributions.py:685: UserWarning: The distribution is specified by [0, 1.00001] and step=0.05, but the range is not divisible by `step`. It will be replaced by [0, 1.0].
  warnings.warn(
K:  9
alpha:  0.8500000000000001
lr:  0.0014404511271155069
weight_decay:  8.343012820638563e-06
dropout:  0.9
fix split and run 3 times
Data: Data(x=[3327, 3703], y=[3327], train_mask=[3327], val_mask=[3327], test_mask=[3327], adj_t=[3327, 3327, nnz=9104])
num_train tensor(120)
num_noise 0
noise: tensor(0)
data feature 3703
ALTOPT(
  (lins): Sequential(
    (0): Linear(in_features=3703, out_features=64, bias=True)
    (1): BatchNorm1d(64, eps=1e-05, momentum=0.1, affine=True, track_running_stats=True)
    (2): Dropout(p=0.9, inplace=True)
    (3): ReLU(inplace=True)
    (4): Linear(in_features=64, out_features=6, bias=True)
    (5): LogSoftmax(dim=-1)
  )
  (prop): Propagation(K=9, mode=None, lambda1=None, lambda2=None, L21=True, alpha=0.8500000000000001)
  (gcn): GCN(
    (convs): ModuleList(
      (0): GCNConv(3703, 64)
      (1): GCNConv(64, 6)
    )
    (bns): ModuleList(
      (0): BatchNorm1d(64, eps=1e-05, momentum=0.1, affine=True, track_running_stats=True)
    )
    (output): LogSoftmax(dim=-1)
  )
)
propagate done
init label
Split: 01, Run: 01
None time:  0.7832463709637523
None Run 01:
Highest Train: 100.00
Highest Valid: 70.60
  Final Train: 100.00
   Final Test: 69.80
Split: 01, Run: 02
None time:  0.7889841138385236
None Run 02:
Highest Train: 100.00
Highest Valid: 72.80
  Final Train: 100.00
   Final Test: 70.80
Split: 01, Run: 03
None time:  0.8448480400256813
None Run 03:
Highest Train: 100.00
Highest Valid: 70.60
  Final Train: 100.00
   Final Test: 69.50
run time now: 2.461724042892456
total time:  2.513884849846363
None All runs:
Highest Train: 100.00 ± 0.00
Highest Valid: 71.33 ± 1.27
  Final Train: 100.00 ± 0.00
   Final Test: 70.03 ± 0.68
[I 2023-06-12 00:08:09,516] Trial 739 finished with value: 71.33333587646484 and parameters: {'Fwd': 0.06353310351365946, 'K': 9, 'alpha': 0.8500000000000001, 'dropout': 0.9, 'gnnepoch': 90, 'lambda1': 0.55, 'lambda2': 4.228571303390666, 'loop': 0, 'loss': 'CE', 'lr': 0.0014404511271155069, 'softmaxF': False, 'useGCN': True, 'weight_decay': 8.343012820638563e-06, 'weightedloss': True}. Best is trial 605 with value: 72.13333129882812.
/home/wxy/miniconda3/lib/python3.10/site-packages/optuna/distributions.py:685: UserWarning: The distribution is specified by [0, 1.00001] and step=0.05, but the range is not divisible by `step`. It will be replaced by [0, 1.0].
  warnings.warn(
K:  7
alpha:  0.5
lr:  0.0008801199893362169
weight_decay:  4.236082552895122e-05
dropout:  0.8
fix split and run 3 times
Data: Data(x=[3327, 3703], y=[3327], train_mask=[3327], val_mask=[3327], test_mask=[3327], adj_t=[3327, 3327, nnz=9104])
num_train tensor(120)
num_noise 0
noise: tensor(0)
data feature 3703
ALTOPT(
  (lins): Sequential(
    (0): Linear(in_features=3703, out_features=64, bias=True)
    (1): BatchNorm1d(64, eps=1e-05, momentum=0.1, affine=True, track_running_stats=True)
    (2): Dropout(p=0.8, inplace=True)
    (3): ReLU(inplace=True)
    (4): Linear(in_features=64, out_features=6, bias=True)
    (5): LogSoftmax(dim=-1)
  )
  (prop): Propagation(K=7, mode=None, lambda1=None, lambda2=None, L21=True, alpha=0.5)
  (gcn): GCN(
    (convs): ModuleList(
      (0): GCNConv(3703, 64)
      (1): GCNConv(64, 6)
    )
    (bns): ModuleList(
      (0): BatchNorm1d(64, eps=1e-05, momentum=0.1, affine=True, track_running_stats=True)
    )
    (output): LogSoftmax(dim=-1)
  )
)
propagate done
init label
Split: 01, Run: 01
None time:  1.0143915149383247
None Run 01:
Highest Train: 100.00
Highest Valid: 70.80
  Final Train: 98.33
   Final Test: 69.10
Split: 01, Run: 02
None time:  1.118425098946318
None Run 02:
Highest Train: 100.00
Highest Valid: 71.80
  Final Train: 95.83
   Final Test: 70.30
Split: 01, Run: 03, Epoch: 100, Loss: 0.0000, Train: 92.50%, Valid: 71.20% Test: 70.60%
Split: 01, Run: 03
None time:  1.8471882930025458
None Run 03:
Highest Train: 100.00
Highest Valid: 71.20
  Final Train: 92.50
   Final Test: 70.40
run time now: 4.026906251907349
total time:  4.075385453877971
None All runs:
Highest Train: 100.00 ± 0.00
Highest Valid: 71.27 ± 0.50
  Final Train: 95.56 ± 2.93
   Final Test: 69.93 ± 0.72
[I 2023-06-12 00:08:14,120] Trial 740 finished with value: 71.26667022705078 and parameters: {'Fwd': 0.039210830890630696, 'K': 7, 'alpha': 0.5, 'dropout': 0.8, 'gnnepoch': 120, 'lambda1': 0.75, 'lambda2': 0.27087565711814676, 'loop': 0, 'loss': 'CE', 'lr': 0.0008801199893362169, 'softmaxF': False, 'useGCN': True, 'weight_decay': 4.236082552895122e-05, 'weightedloss': True}. Best is trial 605 with value: 72.13333129882812.
/home/wxy/miniconda3/lib/python3.10/site-packages/optuna/distributions.py:685: UserWarning: The distribution is specified by [0, 1.00001] and step=0.05, but the range is not divisible by `step`. It will be replaced by [0, 1.0].
  warnings.warn(
K:  8
alpha:  0.6000000000000001
lr:  0.0016239916266481793
weight_decay:  1.915381931333541e-05
dropout:  0.8
fix split and run 3 times
Data: Data(x=[3327, 3703], y=[3327], train_mask=[3327], val_mask=[3327], test_mask=[3327], adj_t=[3327, 3327, nnz=9104])
num_train tensor(120)
num_noise 0
noise: tensor(0)
data feature 3703
ALTOPT(
  (lins): Sequential(
    (0): Linear(in_features=3703, out_features=64, bias=True)
    (1): BatchNorm1d(64, eps=1e-05, momentum=0.1, affine=True, track_running_stats=True)
    (2): Dropout(p=0.8, inplace=True)
    (3): ReLU(inplace=True)
    (4): Linear(in_features=64, out_features=6, bias=True)
    (5): LogSoftmax(dim=-1)
  )
  (prop): Propagation(K=8, mode=None, lambda1=None, lambda2=None, L21=True, alpha=0.6000000000000001)
  (gcn): GCN(
    (convs): ModuleList(
      (0): GCNConv(3703, 64)
      (1): GCNConv(64, 6)
    )
    (bns): ModuleList(
      (0): BatchNorm1d(64, eps=1e-05, momentum=0.1, affine=True, track_running_stats=True)
    )
    (output): LogSoftmax(dim=-1)
  )
)
propagate done
init label
Split: 01, Run: 01
None time:  1.0186011230107397
None Run 01:
Highest Train: 100.00
Highest Valid: 71.40
  Final Train: 100.00
   Final Test: 69.50
Split: 01, Run: 02
None time:  0.9706611151341349
None Run 02:
Highest Train: 100.00
Highest Valid: 72.20
  Final Train: 100.00
   Final Test: 70.20
Split: 01, Run: 03
None time:  0.9931801999919116
None Run 03:
Highest Train: 100.00
Highest Valid: 71.60
  Final Train: 100.00
   Final Test: 69.90
run time now: 3.0241787433624268
total time:  3.0874187061563134
None All runs:
Highest Train: 100.00 ± 0.00
Highest Valid: 71.73 ± 0.42
  Final Train: 100.00 ± 0.00
   Final Test: 69.87 ± 0.35
[I 2023-06-12 00:08:17,702] Trial 741 finished with value: 71.73333740234375 and parameters: {'Fwd': 0.03227547821904479, 'K': 8, 'alpha': 0.6000000000000001, 'dropout': 0.8, 'gnnepoch': 120, 'lambda1': 0.65, 'lambda2': 4.492483890806354, 'loop': 0, 'loss': 'CE', 'lr': 0.0016239916266481793, 'softmaxF': False, 'useGCN': True, 'weight_decay': 1.915381931333541e-05, 'weightedloss': True}. Best is trial 605 with value: 72.13333129882812.
/home/wxy/miniconda3/lib/python3.10/site-packages/optuna/distributions.py:685: UserWarning: The distribution is specified by [0, 1.00001] and step=0.05, but the range is not divisible by `step`. It will be replaced by [0, 1.0].
  warnings.warn(
K:  8
alpha:  0.8500000000000001
lr:  0.0004008405170453367
weight_decay:  0.023966283671193845
dropout:  0.8
fix split and run 3 times
Data: Data(x=[3327, 3703], y=[3327], train_mask=[3327], val_mask=[3327], test_mask=[3327], adj_t=[3327, 3327, nnz=9104])
num_train tensor(120)
num_noise 0
noise: tensor(0)
data feature 3703
ALTOPT(
  (lins): Sequential(
    (0): Linear(in_features=3703, out_features=64, bias=True)
    (1): BatchNorm1d(64, eps=1e-05, momentum=0.1, affine=True, track_running_stats=True)
    (2): Dropout(p=0.8, inplace=True)
    (3): ReLU(inplace=True)
    (4): Linear(in_features=64, out_features=6, bias=True)
    (5): LogSoftmax(dim=-1)
  )
  (prop): Propagation(K=8, mode=None, lambda1=None, lambda2=None, L21=True, alpha=0.8500000000000001)
  (gcn): GCN(
    (convs): ModuleList(
      (0): GCNConv(3703, 64)
      (1): GCNConv(64, 6)
    )
    (bns): ModuleList(
      (0): BatchNorm1d(64, eps=1e-05, momentum=0.1, affine=True, track_running_stats=True)
    )
    (output): LogSoftmax(dim=-1)
  )
)
propagate done
init label
Split: 01, Run: 01
None time:  0.5384212308563292
None Run 01:
Highest Train: 100.00
Highest Valid: 68.60
  Final Train: 100.00
   Final Test: 68.80
Split: 01, Run: 02
None time:  0.5788486530072987
None Run 02:
Highest Train: 100.00
Highest Valid: 71.40
  Final Train: 100.00
   Final Test: 70.40
Split: 01, Run: 03
None time:  0.6351559970062226
None Run 03:
Highest Train: 100.00
Highest Valid: 69.00
  Final Train: 100.00
   Final Test: 69.00
run time now: 1.7981488704681396
total time:  1.856395544949919
None All runs:
Highest Train: 100.00 ± 0.00
Highest Valid: 69.67 ± 1.51
  Final Train: 100.00 ± 0.00
   Final Test: 69.40 ± 0.87
[I 2023-06-12 00:08:20,141] Trial 742 finished with value: 69.66666412353516 and parameters: {'Fwd': 4.0482634807276914e-06, 'K': 8, 'alpha': 0.8500000000000001, 'dropout': 0.8, 'gnnepoch': 50, 'lambda1': 0.7000000000000001, 'lambda2': 7.419186692173027, 'loop': 0, 'loss': 'CE', 'lr': 0.0004008405170453367, 'softmaxF': False, 'useGCN': True, 'weight_decay': 0.023966283671193845, 'weightedloss': True}. Best is trial 605 with value: 72.13333129882812.
/home/wxy/miniconda3/lib/python3.10/site-packages/optuna/distributions.py:685: UserWarning: The distribution is specified by [0, 1.00001] and step=0.05, but the range is not divisible by `step`. It will be replaced by [0, 1.0].
  warnings.warn(
K:  7
alpha:  0.75
lr:  0.0021133967584466055
weight_decay:  0.000828335625206619
dropout:  0.8
fix split and run 3 times
Data: Data(x=[3327, 3703], y=[3327], train_mask=[3327], val_mask=[3327], test_mask=[3327], adj_t=[3327, 3327, nnz=9104])
num_train tensor(120)
num_noise 0
noise: tensor(0)
data feature 3703
ALTOPT(
  (lins): Sequential(
    (0): Linear(in_features=3703, out_features=64, bias=True)
    (1): BatchNorm1d(64, eps=1e-05, momentum=0.1, affine=True, track_running_stats=True)
    (2): Dropout(p=0.8, inplace=True)
    (3): ReLU(inplace=True)
    (4): Linear(in_features=64, out_features=6, bias=True)
    (5): LogSoftmax(dim=-1)
  )
  (prop): Propagation(K=7, mode=None, lambda1=None, lambda2=None, L21=True, alpha=0.75)
  (gcn): GCN(
    (convs): ModuleList(
      (0): GCNConv(3703, 64)
      (1): GCNConv(64, 6)
    )
    (bns): ModuleList(
      (0): BatchNorm1d(64, eps=1e-05, momentum=0.1, affine=True, track_running_stats=True)
    )
    (output): LogSoftmax(dim=-1)
  )
)
propagate done
init label
Split: 01, Run: 01
None time:  0.7110350928269327
None Run 01:
Highest Train: 100.00
Highest Valid: 61.00
  Final Train: 99.17
   Final Test: 59.30
Split: 01, Run: 02
None time:  0.7262845579534769
None Run 02:
Highest Train: 100.00
Highest Valid: 59.60
  Final Train: 98.33
   Final Test: 57.30
Split: 01, Run: 03
None time:  0.8061330469790846
None Run 03:
Highest Train: 100.00
Highest Valid: 60.40
  Final Train: 96.67
   Final Test: 61.10
run time now: 2.282719373703003
total time:  2.3312006241176277
None All runs:
Highest Train: 100.00 ± 0.00
Highest Valid: 60.33 ± 0.70
  Final Train: 98.06 ± 1.27
   Final Test: 59.23 ± 1.90
[I 2023-06-12 00:08:23,121] Trial 743 finished with value: 60.33333206176758 and parameters: {'Fwd': 7.0179928740356564e-06, 'K': 7, 'alpha': 0.75, 'dropout': 0.8, 'gnnepoch': 110, 'lambda1': 0.8500000000000001, 'lambda2': 5.184925085598443, 'loop': 0, 'loss': 'CE', 'lr': 0.0021133967584466055, 'softmaxF': True, 'useGCN': False, 'weight_decay': 0.000828335625206619, 'weightedloss': True}. Best is trial 605 with value: 72.13333129882812.
/home/wxy/miniconda3/lib/python3.10/site-packages/optuna/distributions.py:685: UserWarning: The distribution is specified by [0, 1.00001] and step=0.05, but the range is not divisible by `step`. It will be replaced by [0, 1.0].
  warnings.warn(
K:  8
alpha:  0.9
lr:  0.00024105096063466996
weight_decay:  6.817297597998042e-05
dropout:  0.8
fix split and run 3 times
Data: Data(x=[3327, 3703], y=[3327], train_mask=[3327], val_mask=[3327], test_mask=[3327], adj_t=[3327, 3327, nnz=9104])
num_train tensor(120)
num_noise 0
noise: tensor(0)
data feature 3703
ALTOPT(
  (lins): Sequential(
    (0): Linear(in_features=3703, out_features=64, bias=True)
    (1): BatchNorm1d(64, eps=1e-05, momentum=0.1, affine=True, track_running_stats=True)
    (2): Dropout(p=0.8, inplace=True)
    (3): ReLU(inplace=True)
    (4): Linear(in_features=64, out_features=6, bias=True)
    (5): LogSoftmax(dim=-1)
  )
  (prop): Propagation(K=8, mode=None, lambda1=None, lambda2=None, L21=True, alpha=0.9)
  (gcn): GCN(
    (convs): ModuleList(
      (0): GCNConv(3703, 64)
      (1): GCNConv(64, 6)
    )
    (bns): ModuleList(
      (0): BatchNorm1d(64, eps=1e-05, momentum=0.1, affine=True, track_running_stats=True)
    )
    (output): LogSoftmax(dim=-1)
  )
)
propagate done
init label
Split: 01, Run: 01, Epoch: 100, Loss: 0.0000, Train: 100.00%, Valid: 69.40% Test: 69.10%
Split: 01, Run: 01
None time:  1.8230783499311656
None Run 01:
Highest Train: 100.00
Highest Valid: 69.40
  Final Train: 100.00
   Final Test: 69.30
Split: 01, Run: 02
None time:  1.04873262392357
None Run 02:
Highest Train: 100.00
Highest Valid: 69.60
  Final Train: 100.00
   Final Test: 69.90
Split: 01, Run: 03, Epoch: 100, Loss: 0.0000, Train: 100.00%, Valid: 68.40% Test: 70.40%
Split: 01, Run: 03
None time:  1.82852773508057
None Run 03:
Highest Train: 100.00
Highest Valid: 68.40
  Final Train: 100.00
   Final Test: 70.40
run time now: 4.741140365600586
total time:  4.786359410965815
None All runs:
Highest Train: 100.00 ± 0.00
Highest Valid: 69.13 ± 0.64
  Final Train: 100.00 ± 0.00
   Final Test: 69.87 ± 0.55
[I 2023-06-12 00:08:28,466] Trial 744 finished with value: 69.13333129882812 and parameters: {'Fwd': 0.052020430550812326, 'K': 8, 'alpha': 0.9, 'dropout': 0.8, 'gnnepoch': 120, 'lambda1': 0.75, 'lambda2': 7.652829203508821, 'loop': 0, 'loss': 'CE', 'lr': 0.00024105096063466996, 'softmaxF': False, 'useGCN': True, 'weight_decay': 6.817297597998042e-05, 'weightedloss': True}. Best is trial 605 with value: 72.13333129882812.
/home/wxy/miniconda3/lib/python3.10/site-packages/optuna/distributions.py:685: UserWarning: The distribution is specified by [0, 1.00001] and step=0.05, but the range is not divisible by `step`. It will be replaced by [0, 1.0].
  warnings.warn(
K:  8
alpha:  0.8
lr:  0.0012627366583396566
weight_decay:  1.2010875485320153e-05
dropout:  0.8
fix split and run 3 times
Data: Data(x=[3327, 3703], y=[3327], train_mask=[3327], val_mask=[3327], test_mask=[3327], adj_t=[3327, 3327, nnz=9104])
num_train tensor(120)
num_noise 0
noise: tensor(0)
data feature 3703
ALTOPT(
  (lins): Sequential(
    (0): Linear(in_features=3703, out_features=64, bias=True)
    (1): BatchNorm1d(64, eps=1e-05, momentum=0.1, affine=True, track_running_stats=True)
    (2): Dropout(p=0.8, inplace=True)
    (3): ReLU(inplace=True)
    (4): Linear(in_features=64, out_features=6, bias=True)
    (5): LogSoftmax(dim=-1)
  )
  (prop): Propagation(K=8, mode=None, lambda1=None, lambda2=None, L21=True, alpha=0.8)
  (gcn): GCN(
    (convs): ModuleList(
      (0): GCNConv(3703, 64)
      (1): GCNConv(64, 6)
    )
    (bns): ModuleList(
      (0): BatchNorm1d(64, eps=1e-05, momentum=0.1, affine=True, track_running_stats=True)
    )
    (output): LogSoftmax(dim=-1)
  )
)
propagate done
init label
Split: 01, Run: 01
None time:  1.0436834739521146
None Run 01:
Highest Train: 100.00
Highest Valid: 71.40
  Final Train: 100.00
   Final Test: 69.80
Split: 01, Run: 02
None time:  1.0331616702023894
None Run 02:
Highest Train: 100.00
Highest Valid: 72.40
  Final Train: 100.00
   Final Test: 69.90
Split: 01, Run: 03
None time:  1.086274234810844
None Run 03:
Highest Train: 100.00
Highest Valid: 71.60
  Final Train: 100.00
   Final Test: 70.80
run time now: 3.202547073364258
total time:  3.2469042020384222
None All runs:
Highest Train: 100.00 ± 0.00
Highest Valid: 71.80 ± 0.53
  Final Train: 100.00 ± 0.00
   Final Test: 70.17 ± 0.55
[I 2023-06-12 00:08:32,228] Trial 745 finished with value: 71.79999542236328 and parameters: {'Fwd': 0.00035654445082712073, 'K': 8, 'alpha': 0.8, 'dropout': 0.8, 'gnnepoch': 120, 'lambda1': 0.6000000000000001, 'lambda2': 9.35246882565177, 'loop': 0, 'loss': 'CE', 'lr': 0.0012627366583396566, 'softmaxF': False, 'useGCN': True, 'weight_decay': 1.2010875485320153e-05, 'weightedloss': True}. Best is trial 605 with value: 72.13333129882812.
/home/wxy/miniconda3/lib/python3.10/site-packages/optuna/distributions.py:685: UserWarning: The distribution is specified by [0, 1.00001] and step=0.05, but the range is not divisible by `step`. It will be replaced by [0, 1.0].
  warnings.warn(
K:  8
alpha:  0.9500000000000001
lr:  0.00012824063990761434
weight_decay:  2.474707559291954e-06
dropout:  0.7000000000000001
fix split and run 3 times
Data: Data(x=[3327, 3703], y=[3327], train_mask=[3327], val_mask=[3327], test_mask=[3327], adj_t=[3327, 3327, nnz=9104])
num_train tensor(120)
num_noise 0
noise: tensor(0)
data feature 3703
ALTOPT(
  (lins): Sequential(
    (0): Linear(in_features=3703, out_features=64, bias=True)
    (1): BatchNorm1d(64, eps=1e-05, momentum=0.1, affine=True, track_running_stats=True)
    (2): Dropout(p=0.7000000000000001, inplace=True)
    (3): ReLU(inplace=True)
    (4): Linear(in_features=64, out_features=6, bias=True)
    (5): LogSoftmax(dim=-1)
  )
  (prop): Propagation(K=8, mode=None, lambda1=None, lambda2=None, L21=True, alpha=0.9500000000000001)
  (gcn): GCN(
    (convs): ModuleList(
      (0): GCNConv(3703, 64)
      (1): GCNConv(64, 6)
    )
    (bns): ModuleList(
      (0): BatchNorm1d(64, eps=1e-05, momentum=0.1, affine=True, track_running_stats=True)
    )
    (output): LogSoftmax(dim=-1)
  )
)
propagate done
init label
Split: 01, Run: 01
None time:  1.1174376730341464
None Run 01:
Highest Train: 100.00
Highest Valid: 67.40
  Final Train: 100.00
   Final Test: 67.90
Split: 01, Run: 02
None time:  1.0550996591337025
None Run 02:
Highest Train: 100.00
Highest Valid: 68.00
  Final Train: 100.00
   Final Test: 68.50
Split: 01, Run: 03
None time:  1.1042348248884082
None Run 03:
Highest Train: 100.00
Highest Valid: 67.40
  Final Train: 100.00
   Final Test: 69.20
run time now: 3.3206539154052734
total time:  3.3666524419095367
None All runs:
Highest Train: 100.00 ± 0.00
Highest Valid: 67.60 ± 0.35
  Final Train: 100.00 ± 0.00
   Final Test: 68.53 ± 0.65
