[I 2023-06-12 00:13:05,753] Trial 8 finished with value: 74.53333282470703 and parameters: {'Fwd': 0.022099992662141903, 'K': 1, 'alpha': 0.4, 'dropout': 0.0, 'gnnepoch': 50, 'lambda1': 0.65, 'lambda2': 8.444785809247083, 'loop': 2, 'loss': 'CE', 'lr': 0.0012189527958586628, 'softmaxF': False, 'useGCN': True, 'weight_decay': 0.004946859078443736, 'weightedloss': True}. Best is trial 1 with value: 79.13333129882812.
/home/wxy/miniconda3/lib/python3.10/site-packages/optuna/distributions.py:685: UserWarning: The distribution is specified by [0, 1.00001] and step=0.05, but the range is not divisible by `step`. It will be replaced by [0, 1.0].
  warnings.warn(
K:  4
alpha:  0.7000000000000001
lr:  0.000702185890192774
weight_decay:  0.02849618494481141
dropout:  0.4
fix split and run 3 times
Data: Data(x=[19717, 500], y=[19717], train_mask=[19717], val_mask=[19717], test_mask=[19717], adj_t=[19717, 19717, nnz=88648])
num_train tensor(60)
num_noise 0
noise: tensor(0)
data feature 500
ALTOPT(
  (lins): Sequential(
    (0): Linear(in_features=500, out_features=64, bias=True)
    (1): BatchNorm1d(64, eps=1e-05, momentum=0.1, affine=True, track_running_stats=True)
    (2): Dropout(p=0.4, inplace=True)
    (3): ReLU(inplace=True)
    (4): Linear(in_features=64, out_features=3, bias=True)
    (5): Identity()
  )
  (prop): Propagation(K=4, mode=None, lambda1=None, lambda2=None, L21=True, alpha=0.7000000000000001)
  (gcn): GCN(
    (convs): ModuleList(
      (0): GCNConv(500, 64)
      (1): GCNConv(64, 3)
    )
    (bns): ModuleList(
      (0): BatchNorm1d(64, eps=1e-05, momentum=0.1, affine=True, track_running_stats=True)
    )
    (output): Identity()
  )
)
propagate done
init label
Split: 01, Run: 01
None time:  0.6176727951969951
None Run 01:
Highest Train: 100.00
Highest Valid: 64.00
  Final Train: 100.00
   Final Test: 64.20
Split: 01, Run: 02
None time:  0.5714155021123588
None Run 02:
Highest Train: 100.00
Highest Valid: 64.00
  Final Train: 100.00
   Final Test: 64.20
Split: 01, Run: 03, Epoch: 100, Loss: 0.0000, Train: 100.00%, Valid: 64.80% Test: 62.00%
Split: 01, Run: 03
None time:  2.063587989890948
None Run 03:
Highest Train: 100.00
Highest Valid: 64.80
  Final Train: 100.00
   Final Test: 62.00
run time now: 3.3047335147857666
total time:  3.3551951141562313
None All runs:
Highest Train: 100.00 ± 0.00
Highest Valid: 64.27 ± 0.46
  Final Train: 100.00 ± 0.00
   Final Test: 63.47 ± 1.27
[I 2023-06-12 00:13:09,575] Trial 9 finished with value: 64.26667022705078 and parameters: {'Fwd': 9.165709072938221e-05, 'K': 4, 'alpha': 0.7000000000000001, 'dropout': 0.4, 'gnnepoch': 20, 'lambda1': 0.8, 'lambda2': 0.22460974032341485, 'loop': 0, 'loss': 'MSE', 'lr': 0.000702185890192774, 'softmaxF': False, 'useGCN': True, 'weight_decay': 0.02849618494481141, 'weightedloss': False}. Best is trial 1 with value: 79.13333129882812.
/home/wxy/miniconda3/lib/python3.10/site-packages/optuna/distributions.py:685: UserWarning: The distribution is specified by [0, 1.00001] and step=0.05, but the range is not divisible by `step`. It will be replaced by [0, 1.0].
  warnings.warn(
K:  6
alpha:  0.45
lr:  0.0019271737022301535
weight_decay:  2.096411627246161e-05
dropout:  0.9
fix split and run 3 times
Data: Data(x=[19717, 500], y=[19717], train_mask=[19717], val_mask=[19717], test_mask=[19717], adj_t=[19717, 19717, nnz=88648])
num_train tensor(60)
num_noise 0
noise: tensor(0)
data feature 500
ALTOPT(
  (lins): Sequential(
    (0): Linear(in_features=500, out_features=64, bias=True)
    (1): BatchNorm1d(64, eps=1e-05, momentum=0.1, affine=True, track_running_stats=True)
    (2): Dropout(p=0.9, inplace=True)
    (3): ReLU(inplace=True)
    (4): Linear(in_features=64, out_features=3, bias=True)
    (5): Identity()
  )
  (prop): Propagation(K=6, mode=None, lambda1=None, lambda2=None, L21=True, alpha=0.45)
  (gcn): GCN(
    (convs): ModuleList(
      (0): GCNConv(500, 64)
      (1): GCNConv(64, 3)
    )
    (bns): ModuleList(
      (0): BatchNorm1d(64, eps=1e-05, momentum=0.1, affine=True, track_running_stats=True)
    )
    (output): Identity()
  )
)
propagate done
init label
Split: 01, Run: 01
None time:  1.2801683759316802
None Run 01:
Highest Train: 100.00
Highest Valid: 70.00
  Final Train: 100.00
   Final Test: 69.20
Split: 01, Run: 02
None time:  1.2061957530677319
None Run 02:
Highest Train: 100.00
Highest Valid: 72.40
  Final Train: 100.00
   Final Test: 70.20
Split: 01, Run: 03
None time:  1.323241325095296
None Run 03:
Highest Train: 100.00
Highest Valid: 77.20
  Final Train: 100.00
   Final Test: 74.90
run time now: 3.8531341552734375
total time:  3.899938212009147
None All runs:
Highest Train: 100.00 ± 0.00
Highest Valid: 73.20 ± 3.67
  Final Train: 100.00 ± 0.00
   Final Test: 71.43 ± 3.04
[I 2023-06-12 00:13:13,889] Trial 10 finished with value: 73.20000457763672 and parameters: {'Fwd': 2.7487152918424117e-06, 'K': 6, 'alpha': 0.45, 'dropout': 0.9, 'gnnepoch': 100, 'lambda1': 0.05, 'lambda2': 9.815060639041786, 'loop': 1, 'loss': 'MSE', 'lr': 0.0019271737022301535, 'softmaxF': True, 'useGCN': False, 'weight_decay': 2.096411627246161e-05, 'weightedloss': False}. Best is trial 1 with value: 79.13333129882812.
/home/wxy/miniconda3/lib/python3.10/site-packages/optuna/distributions.py:685: UserWarning: The distribution is specified by [0, 1.00001] and step=0.05, but the range is not divisible by `step`. It will be replaced by [0, 1.0].
  warnings.warn(
K:  7
alpha:  0.6000000000000001
lr:  0.003315040475977677
weight_decay:  8.471997884858667e-05
dropout:  0.2
fix split and run 3 times
Data: Data(x=[19717, 500], y=[19717], train_mask=[19717], val_mask=[19717], test_mask=[19717], adj_t=[19717, 19717, nnz=88648])
num_train tensor(60)
num_noise 0
noise: tensor(0)
data feature 500
ALTOPT(
  (lins): Sequential(
    (0): Linear(in_features=500, out_features=64, bias=True)
    (1): BatchNorm1d(64, eps=1e-05, momentum=0.1, affine=True, track_running_stats=True)
    (2): Dropout(p=0.2, inplace=True)
    (3): ReLU(inplace=True)
    (4): Linear(in_features=64, out_features=3, bias=True)
    (5): Identity()
  )
  (prop): Propagation(K=7, mode=None, lambda1=None, lambda2=None, L21=True, alpha=0.6000000000000001)
  (gcn): GCN(
    (convs): ModuleList(
      (0): GCNConv(500, 64)
      (1): GCNConv(64, 3)
    )
    (bns): ModuleList(
      (0): BatchNorm1d(64, eps=1e-05, momentum=0.1, affine=True, track_running_stats=True)
    )
    (output): Identity()
  )
)
propagate done
init label
Split: 01, Run: 01
None time:  2.724312638863921
None Run 01:
Highest Train: 100.00
Highest Valid: 79.60
  Final Train: 100.00
   Final Test: 77.80
Split: 01, Run: 02
None time:  1.8655041840393096
None Run 02:
Highest Train: 100.00
Highest Valid: 81.40
  Final Train: 100.00
   Final Test: 79.00
Split: 01, Run: 03
None time:  1.7080134160351008
None Run 03:
Highest Train: 100.00
Highest Valid: 79.80
  Final Train: 100.00
   Final Test: 78.00
run time now: 6.359869003295898
total time:  6.412292903987691
None All runs:
Highest Train: 100.00 ± 0.00
Highest Valid: 80.27 ± 0.99
  Final Train: 100.00 ± 0.00
   Final Test: 78.27 ± 0.64
[I 2023-06-12 00:13:20,726] Trial 11 finished with value: 80.26666259765625 and parameters: {'Fwd': 2.6433007682621912e-05, 'K': 7, 'alpha': 0.6000000000000001, 'dropout': 0.2, 'gnnepoch': 120, 'lambda1': 1.0, 'lambda2': 9.921483742907768, 'loop': 1, 'loss': 'MSE', 'lr': 0.003315040475977677, 'softmaxF': True, 'useGCN': False, 'weight_decay': 8.471997884858667e-05, 'weightedloss': False}. Best is trial 11 with value: 80.26666259765625.
/home/wxy/miniconda3/lib/python3.10/site-packages/optuna/distributions.py:685: UserWarning: The distribution is specified by [0, 1.00001] and step=0.05, but the range is not divisible by `step`. It will be replaced by [0, 1.0].
  warnings.warn(
K:  8
alpha:  0.6000000000000001
lr:  0.00403450117296386
weight_decay:  3.672564901626868e-05
dropout:  0.2
fix split and run 3 times
Data: Data(x=[19717, 500], y=[19717], train_mask=[19717], val_mask=[19717], test_mask=[19717], adj_t=[19717, 19717, nnz=88648])
num_train tensor(60)
num_noise 0
noise: tensor(0)
data feature 500
ALTOPT(
  (lins): Sequential(
    (0): Linear(in_features=500, out_features=64, bias=True)
    (1): BatchNorm1d(64, eps=1e-05, momentum=0.1, affine=True, track_running_stats=True)
    (2): Dropout(p=0.2, inplace=True)
    (3): ReLU(inplace=True)
    (4): Linear(in_features=64, out_features=3, bias=True)
    (5): Identity()
  )
  (prop): Propagation(K=8, mode=None, lambda1=None, lambda2=None, L21=True, alpha=0.6000000000000001)
  (gcn): GCN(
    (convs): ModuleList(
      (0): GCNConv(500, 64)
      (1): GCNConv(64, 3)
    )
    (bns): ModuleList(
      (0): BatchNorm1d(64, eps=1e-05, momentum=0.1, affine=True, track_running_stats=True)
    )
    (output): Identity()
  )
)
propagate done
init label
Split: 01, Run: 01
None time:  2.5091695520095527
None Run 01:
Highest Train: 100.00
Highest Valid: 79.40
  Final Train: 100.00
   Final Test: 77.30
Split: 01, Run: 02
None time:  1.486880982061848
None Run 02:
Highest Train: 100.00
Highest Valid: 78.60
  Final Train: 100.00
   Final Test: 79.00
Split: 01, Run: 03
None time:  1.7064317702315748
None Run 03:
Highest Train: 100.00
Highest Valid: 78.80
  Final Train: 100.00
   Final Test: 78.00
run time now: 5.747147083282471
total time:  5.800311073195189
None All runs:
Highest Train: 100.00 ± 0.00
Highest Valid: 78.93 ± 0.42
  Final Train: 100.00 ± 0.00
   Final Test: 78.10 ± 0.85
[I 2023-06-12 00:13:26,944] Trial 12 finished with value: 78.9333267211914 and parameters: {'Fwd': 1.411199326848934e-05, 'K': 8, 'alpha': 0.6000000000000001, 'dropout': 0.2, 'gnnepoch': 120, 'lambda1': 0.65, 'lambda2': 9.904236864863947, 'loop': 1, 'loss': 'MSE', 'lr': 0.00403450117296386, 'softmaxF': True, 'useGCN': False, 'weight_decay': 3.672564901626868e-05, 'weightedloss': False}. Best is trial 11 with value: 80.26666259765625.
/home/wxy/miniconda3/lib/python3.10/site-packages/optuna/distributions.py:685: UserWarning: The distribution is specified by [0, 1.00001] and step=0.05, but the range is not divisible by `step`. It will be replaced by [0, 1.0].
  warnings.warn(
K:  8
alpha:  0.30000000000000004
lr:  0.002187572321032164
weight_decay:  1.0083396922312761e-05
dropout:  0.0
fix split and run 3 times
Data: Data(x=[19717, 500], y=[19717], train_mask=[19717], val_mask=[19717], test_mask=[19717], adj_t=[19717, 19717, nnz=88648])
num_train tensor(60)
num_noise 0
noise: tensor(0)
data feature 500
ALTOPT(
  (lins): Sequential(
    (0): Linear(in_features=500, out_features=64, bias=True)
    (1): BatchNorm1d(64, eps=1e-05, momentum=0.1, affine=True, track_running_stats=True)
    (2): Dropout(p=0.0, inplace=True)
    (3): ReLU(inplace=True)
    (4): Linear(in_features=64, out_features=3, bias=True)
    (5): Identity()
  )
  (prop): Propagation(K=8, mode=None, lambda1=None, lambda2=None, L21=True, alpha=0.30000000000000004)
  (gcn): GCN(
    (convs): ModuleList(
      (0): GCNConv(500, 64)
      (1): GCNConv(64, 3)
    )
    (bns): ModuleList(
      (0): BatchNorm1d(64, eps=1e-05, momentum=0.1, affine=True, track_running_stats=True)
    )
    (output): Identity()
  )
)
propagate done
init label
Split: 01, Run: 01
None time:  1.6016662679612637
None Run 01:
Highest Train: 100.00
Highest Valid: 73.40
  Final Train: 100.00
   Final Test: 74.40
Split: 01, Run: 02
None time:  1.4457947849296033
None Run 02:
Highest Train: 100.00
Highest Valid: 78.80
  Final Train: 100.00
   Final Test: 77.40
Split: 01, Run: 03
None time:  1.013316674157977
None Run 03:
Highest Train: 100.00
Highest Valid: 78.40
  Final Train: 100.00
   Final Test: 77.50
run time now: 4.111490726470947
total time:  4.1563019710592926
None All runs:
Highest Train: 100.00 ± 0.00
Highest Valid: 76.87 ± 3.01
  Final Train: 100.00 ± 0.00
   Final Test: 76.43 ± 1.76
[I 2023-06-12 00:13:31,534] Trial 13 finished with value: 76.86666870117188 and parameters: {'Fwd': 1.3460450751824651e-06, 'K': 8, 'alpha': 0.30000000000000004, 'dropout': 0.0, 'gnnepoch': 90, 'lambda1': 0.2, 'lambda2': 7.753315844945015, 'loop': 1, 'loss': 'MSE', 'lr': 0.002187572321032164, 'softmaxF': True, 'useGCN': False, 'weight_decay': 1.0083396922312761e-05, 'weightedloss': False}. Best is trial 11 with value: 80.26666259765625.
/home/wxy/miniconda3/lib/python3.10/site-packages/optuna/distributions.py:685: UserWarning: The distribution is specified by [0, 1.00001] and step=0.05, but the range is not divisible by `step`. It will be replaced by [0, 1.0].
  warnings.warn(
K:  5
alpha:  0.30000000000000004
lr:  0.004472588867864178
weight_decay:  1.0578593303266122e-06
dropout:  0.2
fix split and run 3 times
Data: Data(x=[19717, 500], y=[19717], train_mask=[19717], val_mask=[19717], test_mask=[19717], adj_t=[19717, 19717, nnz=88648])
num_train tensor(60)
num_noise 0
noise: tensor(0)
data feature 500
ALTOPT(
  (lins): Sequential(
    (0): Linear(in_features=500, out_features=64, bias=True)
    (1): BatchNorm1d(64, eps=1e-05, momentum=0.1, affine=True, track_running_stats=True)
    (2): Dropout(p=0.2, inplace=True)
    (3): ReLU(inplace=True)
    (4): Linear(in_features=64, out_features=3, bias=True)
    (5): Identity()
  )
  (prop): Propagation(K=5, mode=None, lambda1=None, lambda2=None, L21=True, alpha=0.30000000000000004)
  (gcn): GCN(
    (convs): ModuleList(
      (0): GCNConv(500, 64)
      (1): GCNConv(64, 3)
    )
    (bns): ModuleList(
      (0): BatchNorm1d(64, eps=1e-05, momentum=0.1, affine=True, track_running_stats=True)
    )
    (output): Identity()
  )
)
propagate done
init label
Split: 01, Run: 01
None time:  1.4643813918810338
None Run 01:
Highest Train: 100.00
Highest Valid: 79.60
  Final Train: 100.00
   Final Test: 76.70
Split: 01, Run: 02
None time:  1.5049148830585182
None Run 02:
Highest Train: 100.00
Highest Valid: 76.40
  Final Train: 100.00
   Final Test: 75.30
Split: 01, Run: 03
None time:  1.4494714147876948
None Run 03:
Highest Train: 100.00
Highest Valid: 77.20
  Final Train: 100.00
   Final Test: 75.60
run time now: 4.491132736206055
total time:  4.570814145030454
None All runs:
Highest Train: 100.00 ± 0.00
Highest Valid: 77.73 ± 1.67
  Final Train: 100.00 ± 0.00
   Final Test: 75.87 ± 0.74
[I 2023-06-12 00:13:36,619] Trial 14 finished with value: 77.73333740234375 and parameters: {'Fwd': 0.08671442768127177, 'K': 5, 'alpha': 0.30000000000000004, 'dropout': 0.2, 'gnnepoch': 100, 'lambda1': 0.75, 'lambda2': 7.420768001171372, 'loop': 2, 'loss': 'MSE', 'lr': 0.004472588867864178, 'softmaxF': True, 'useGCN': False, 'weight_decay': 1.0578593303266122e-06, 'weightedloss': False}. Best is trial 11 with value: 80.26666259765625.
/home/wxy/miniconda3/lib/python3.10/site-packages/optuna/distributions.py:685: UserWarning: The distribution is specified by [0, 1.00001] and step=0.05, but the range is not divisible by `step`. It will be replaced by [0, 1.0].
  warnings.warn(
K:  8
alpha:  0.6000000000000001
lr:  0.0062820385760465275
weight_decay:  0.0001046145018886989
dropout:  0.5
fix split and run 3 times
Data: Data(x=[19717, 500], y=[19717], train_mask=[19717], val_mask=[19717], test_mask=[19717], adj_t=[19717, 19717, nnz=88648])
num_train tensor(60)
num_noise 0
noise: tensor(0)
data feature 500
ALTOPT(
  (lins): Sequential(
    (0): Linear(in_features=500, out_features=64, bias=True)
    (1): BatchNorm1d(64, eps=1e-05, momentum=0.1, affine=True, track_running_stats=True)
    (2): Dropout(p=0.5, inplace=True)
    (3): ReLU(inplace=True)
    (4): Linear(in_features=64, out_features=3, bias=True)
    (5): Identity()
  )
  (prop): Propagation(K=8, mode=None, lambda1=None, lambda2=None, L21=True, alpha=0.6000000000000001)
  (gcn): GCN(
    (convs): ModuleList(
      (0): GCNConv(500, 64)
      (1): GCNConv(64, 3)
    )
    (bns): ModuleList(
      (0): BatchNorm1d(64, eps=1e-05, momentum=0.1, affine=True, track_running_stats=True)
    )
    (output): Identity()
  )
)
propagate done
init label
Split: 01, Run: 01, Epoch: 100, Loss: 0.0000, Train: 100.00%, Valid: 76.60% Test: 75.10%
Split: 01, Run: 01
None time:  2.4830330319236964
None Run 01:
Highest Train: 100.00
Highest Valid: 76.60
  Final Train: 100.00
   Final Test: 75.20
Split: 01, Run: 02, Epoch: 100, Loss: 0.0000, Train: 100.00%, Valid: 77.00% Test: 75.70%
Split: 01, Run: 02
None time:  2.5495466308202595
None Run 02:
Highest Train: 100.00
Highest Valid: 77.00
  Final Train: 100.00
   Final Test: 75.50
Split: 01, Run: 03, Epoch: 100, Loss: 0.0000, Train: 100.00%, Valid: 78.20% Test: 76.50%
Split: 01, Run: 03
None time:  2.159071131842211
None Run 03:
Highest Train: 100.00
Highest Valid: 78.20
  Final Train: 100.00
   Final Test: 76.80
run time now: 7.240829706192017
total time:  7.286984740989283
None All runs:
Highest Train: 100.00 ± 0.00
Highest Valid: 77.27 ± 0.83
  Final Train: 100.00 ± 0.00
   Final Test: 75.83 ± 0.85
[I 2023-06-12 00:13:44,483] Trial 15 finished with value: 77.26667022705078 and parameters: {'Fwd': 2.63701454039314e-05, 'K': 8, 'alpha': 0.6000000000000001, 'dropout': 0.5, 'gnnepoch': 80, 'lambda1': 0.5, 'lambda2': 9.868552272756332, 'loop': 0, 'loss': 'MSE', 'lr': 0.0062820385760465275, 'softmaxF': True, 'useGCN': False, 'weight_decay': 0.0001046145018886989, 'weightedloss': False}. Best is trial 11 with value: 80.26666259765625.
/home/wxy/miniconda3/lib/python3.10/site-packages/optuna/distributions.py:685: UserWarning: The distribution is specified by [0, 1.00001] and step=0.05, but the range is not divisible by `step`. It will be replaced by [0, 1.0].
  warnings.warn(
K:  7
alpha:  0.55
lr:  0.009929652443394821
weight_decay:  1.1817358805554899e-05
dropout:  0.30000000000000004
fix split and run 3 times
Data: Data(x=[19717, 500], y=[19717], train_mask=[19717], val_mask=[19717], test_mask=[19717], adj_t=[19717, 19717, nnz=88648])
num_train tensor(60)
num_noise 0
noise: tensor(0)
data feature 500
ALTOPT(
  (lins): Sequential(
    (0): Linear(in_features=500, out_features=64, bias=True)
    (1): BatchNorm1d(64, eps=1e-05, momentum=0.1, affine=True, track_running_stats=True)
    (2): Dropout(p=0.30000000000000004, inplace=True)
    (3): ReLU(inplace=True)
    (4): Linear(in_features=64, out_features=3, bias=True)
    (5): Identity()
  )
  (prop): Propagation(K=7, mode=None, lambda1=None, lambda2=None, L21=True, alpha=0.55)
  (gcn): GCN(
    (convs): ModuleList(
      (0): GCNConv(500, 64)
      (1): GCNConv(64, 3)
    )
    (bns): ModuleList(
      (0): BatchNorm1d(64, eps=1e-05, momentum=0.1, affine=True, track_running_stats=True)
    )
    (output): Identity()
  )
)
propagate done
init label
Split: 01, Run: 01
None time:  0.6252405471168458
None Run 01:
Highest Train: 100.00
Highest Valid: 69.20
  Final Train: 100.00
   Final Test: 69.20
Split: 01, Run: 02
None time:  0.6837199481669813
None Run 02:
Highest Train: 100.00
Highest Valid: 79.40
  Final Train: 100.00
   Final Test: 77.60
Split: 01, Run: 03
None time:  1.0171813829801977
None Run 03:
Highest Train: 100.00
Highest Valid: 79.60
  Final Train: 100.00
   Final Test: 75.40
run time now: 2.3730263710021973
total time:  2.410305141005665
None All runs:
Highest Train: 100.00 ± 0.00
Highest Valid: 76.07 ± 5.95
  Final Train: 100.00 ± 0.00
   Final Test: 74.07 ± 4.36
[I 2023-06-12 00:13:47,454] Trial 16 finished with value: 76.0666732788086 and parameters: {'Fwd': 6.363101328615333e-06, 'K': 7, 'alpha': 0.55, 'dropout': 0.30000000000000004, 'gnnepoch': 30, 'lambda1': 0.5, 'lambda2': 7.487336797096198, 'loop': 1, 'loss': 'MSE', 'lr': 0.009929652443394821, 'softmaxF': True, 'useGCN': False, 'weight_decay': 1.1817358805554899e-05, 'weightedloss': False}. Best is trial 11 with value: 80.26666259765625.
/home/wxy/miniconda3/lib/python3.10/site-packages/optuna/distributions.py:685: UserWarning: The distribution is specified by [0, 1.00001] and step=0.05, but the range is not divisible by `step`. It will be replaced by [0, 1.0].
  warnings.warn(
K:  5
alpha:  0.2
lr:  0.002402380422958828
weight_decay:  0.00013964903700743346
dropout:  0.1
fix split and run 3 times
Data: Data(x=[19717, 500], y=[19717], train_mask=[19717], val_mask=[19717], test_mask=[19717], adj_t=[19717, 19717, nnz=88648])
num_train tensor(60)
num_noise 0
noise: tensor(0)
data feature 500
ALTOPT(
  (lins): Sequential(
    (0): Linear(in_features=500, out_features=64, bias=True)
    (1): BatchNorm1d(64, eps=1e-05, momentum=0.1, affine=True, track_running_stats=True)
    (2): Dropout(p=0.1, inplace=True)
    (3): ReLU(inplace=True)
    (4): Linear(in_features=64, out_features=3, bias=True)
    (5): Identity()
  )
  (prop): Propagation(K=5, mode=None, lambda1=None, lambda2=None, L21=True, alpha=0.2)
  (gcn): GCN(
    (convs): ModuleList(
      (0): GCNConv(500, 64)
      (1): GCNConv(64, 3)
    )
    (bns): ModuleList(
      (0): BatchNorm1d(64, eps=1e-05, momentum=0.1, affine=True, track_running_stats=True)
    )
    (output): Identity()
  )
)
propagate done
init label
Split: 01, Run: 01
None time:  1.4921852911356837
None Run 01:
Highest Train: 100.00
Highest Valid: 72.20
  Final Train: 100.00
   Final Test: 72.50
Split: 01, Run: 02
None time:  1.4061658189166337
None Run 02:
Highest Train: 100.00
Highest Valid: 78.20
  Final Train: 100.00
   Final Test: 77.30
Split: 01, Run: 03
None time:  1.6008524459321052
None Run 03:
Highest Train: 100.00
Highest Valid: 79.20
  Final Train: 100.00
   Final Test: 77.40
run time now: 4.538515567779541
total time:  4.577005916042253
None All runs:
Highest Train: 100.00 ± 0.00
Highest Valid: 76.53 ± 3.79
  Final Train: 100.00 ± 0.00
   Final Test: 75.73 ± 2.80
