[I 2023-06-12 00:51:47,186] Trial 421 finished with value: 76.26667022705078 and parameters: {'Fwd': 0.000823727802941683, 'K': 10, 'alpha': 0.4, 'dropout': 0.30000000000000004, 'gnnepoch': 60, 'lambda1': 0.8500000000000001, 'lambda2': 4.534522617418883, 'loop': 1, 'loss': 'CE', 'lr': 0.0013726483068342143, 'softmaxF': True, 'useGCN': True, 'weight_decay': 7.081245960722974e-05, 'weightedloss': False}. Best is trial 112 with value: 81.66667175292969.
/home/wxy/miniconda3/lib/python3.10/site-packages/optuna/distributions.py:685: UserWarning: The distribution is specified by [0, 1.00001] and step=0.05, but the range is not divisible by `step`. It will be replaced by [0, 1.0].
  warnings.warn(
K:  10
alpha:  0.55
lr:  0.008002045131942087
weight_decay:  5.311080227948411e-05
dropout:  0.5
fix split and run 3 times
Data: Data(x=[2708, 1433], y=[2708], train_mask=[2708], val_mask=[2708], test_mask=[2708], adj_t=[2708, 2708, nnz=10556])
num_train tensor(140)
num_noise 0
noise: tensor(0)
data feature 1433
ALTOPT(
  (lins): Sequential(
    (0): Linear(in_features=1433, out_features=64, bias=True)
    (1): BatchNorm1d(64, eps=1e-05, momentum=0.1, affine=True, track_running_stats=True)
    (2): Dropout(p=0.5, inplace=True)
    (3): ReLU(inplace=True)
    (4): Linear(in_features=64, out_features=7, bias=True)
    (5): LogSoftmax(dim=-1)
  )
  (prop): Propagation(K=10, mode=None, lambda1=None, lambda2=None, L21=True, alpha=0.55)
  (gcn): GCN(
    (convs): ModuleList(
      (0): GCNConv(1433, 64)
      (1): GCNConv(64, 7)
    )
    (bns): ModuleList(
      (0): BatchNorm1d(64, eps=1e-05, momentum=0.1, affine=True, track_running_stats=True)
    )
    (output): LogSoftmax(dim=-1)
  )
)
propagate done
init label
Split: 01, Run: 01
None time:  1.5308835140895098
None Run 01:
Highest Train: 100.00
Highest Valid: 81.40
  Final Train: 100.00
   Final Test: 82.50
Split: 01, Run: 02
None time:  1.2307199148926884
None Run 02:
Highest Train: 100.00
Highest Valid: 81.40
  Final Train: 100.00
   Final Test: 82.20
Split: 01, Run: 03
None time:  1.5037252740003169
None Run 03:
Highest Train: 100.00
Highest Valid: 81.20
  Final Train: 100.00
   Final Test: 83.00
run time now: 4.300246477127075
total time:  4.317283089039847
None All runs:
Highest Train: 100.00 ± 0.00
Highest Valid: 81.33 ± 0.12
  Final Train: 100.00 ± 0.00
   Final Test: 82.57 ± 0.40
[I 2023-06-12 00:51:52,092] Trial 422 finished with value: 81.33333587646484 and parameters: {'Fwd': 0.06565816253648082, 'K': 10, 'alpha': 0.55, 'dropout': 0.5, 'gnnepoch': 50, 'lambda1': 0.8, 'lambda2': 5.138261557462138, 'loop': 1, 'loss': 'CE', 'lr': 0.008002045131942087, 'softmaxF': True, 'useGCN': True, 'weight_decay': 5.311080227948411e-05, 'weightedloss': True}. Best is trial 112 with value: 81.66667175292969.
/home/wxy/miniconda3/lib/python3.10/site-packages/optuna/distributions.py:685: UserWarning: The distribution is specified by [0, 1.00001] and step=0.05, but the range is not divisible by `step`. It will be replaced by [0, 1.0].
  warnings.warn(
K:  10
alpha:  0.5
lr:  0.009009721252962203
weight_decay:  0.00013880602801305102
dropout:  0.4
fix split and run 3 times
Data: Data(x=[2708, 1433], y=[2708], train_mask=[2708], val_mask=[2708], test_mask=[2708], adj_t=[2708, 2708, nnz=10556])
num_train tensor(140)
num_noise 0
noise: tensor(0)
data feature 1433
ALTOPT(
  (lins): Sequential(
    (0): Linear(in_features=1433, out_features=64, bias=True)
    (1): BatchNorm1d(64, eps=1e-05, momentum=0.1, affine=True, track_running_stats=True)
    (2): Dropout(p=0.4, inplace=True)
    (3): ReLU(inplace=True)
    (4): Linear(in_features=64, out_features=7, bias=True)
    (5): Identity()
  )
  (prop): Propagation(K=10, mode=None, lambda1=None, lambda2=None, L21=True, alpha=0.5)
  (gcn): GCN(
    (convs): ModuleList(
      (0): GCNConv(1433, 64)
      (1): GCNConv(64, 7)
    )
    (bns): ModuleList(
      (0): BatchNorm1d(64, eps=1e-05, momentum=0.1, affine=True, track_running_stats=True)
    )
    (output): Identity()
  )
)
propagate done
init label
Split: 01, Run: 01
None time:  1.845548169920221
None Run 01:
Highest Train: 100.00
Highest Valid: 80.60
  Final Train: 100.00
   Final Test: 80.00
Split: 01, Run: 02
None time:  1.9642143240198493
None Run 02:
Highest Train: 100.00
Highest Valid: 79.00
  Final Train: 100.00
   Final Test: 79.20
Split: 01, Run: 03
None time:  1.6521102068945765
None Run 03:
Highest Train: 100.00
Highest Valid: 80.60
  Final Train: 100.00
   Final Test: 79.40
run time now: 5.491875171661377
total time:  5.511278753867373
None All runs:
Highest Train: 100.00 ± 0.00
Highest Valid: 80.07 ± 0.92
  Final Train: 100.00 ± 0.00
   Final Test: 79.53 ± 0.42
[I 2023-06-12 00:51:58,159] Trial 423 finished with value: 80.0666732788086 and parameters: {'Fwd': 0.08086496015649558, 'K': 10, 'alpha': 0.5, 'dropout': 0.4, 'gnnepoch': 60, 'lambda1': 0.9, 'lambda2': 4.038815794125971, 'loop': 1, 'loss': 'MSE', 'lr': 0.009009721252962203, 'softmaxF': True, 'useGCN': True, 'weight_decay': 0.00013880602801305102, 'weightedloss': False}. Best is trial 112 with value: 81.66667175292969.
/home/wxy/miniconda3/lib/python3.10/site-packages/optuna/distributions.py:685: UserWarning: The distribution is specified by [0, 1.00001] and step=0.05, but the range is not divisible by `step`. It will be replaced by [0, 1.0].
  warnings.warn(
K:  10
alpha:  0.6000000000000001
lr:  0.00750587840157069
weight_decay:  1.0170912540102531e-06
dropout:  0.6000000000000001
fix split and run 3 times
Data: Data(x=[2708, 1433], y=[2708], train_mask=[2708], val_mask=[2708], test_mask=[2708], adj_t=[2708, 2708, nnz=10556])
num_train tensor(140)
num_noise 0
noise: tensor(0)
data feature 1433
ALTOPT(
  (lins): Sequential(
    (0): Linear(in_features=1433, out_features=64, bias=True)
    (1): BatchNorm1d(64, eps=1e-05, momentum=0.1, affine=True, track_running_stats=True)
    (2): Dropout(p=0.6000000000000001, inplace=True)
    (3): ReLU(inplace=True)
    (4): Linear(in_features=64, out_features=7, bias=True)
    (5): LogSoftmax(dim=-1)
  )
  (prop): Propagation(K=10, mode=None, lambda1=None, lambda2=None, L21=True, alpha=0.6000000000000001)
  (gcn): GCN(
    (convs): ModuleList(
      (0): GCNConv(1433, 64)
      (1): GCNConv(64, 7)
    )
    (bns): ModuleList(
      (0): BatchNorm1d(64, eps=1e-05, momentum=0.1, affine=True, track_running_stats=True)
    )
    (output): LogSoftmax(dim=-1)
  )
)
propagate done
init label
Split: 01, Run: 01
None time:  1.8443692829459906
None Run 01:
Highest Train: 100.00
Highest Valid: 82.00
  Final Train: 100.00
   Final Test: 82.80
Split: 01, Run: 02
None time:  1.766644753050059
None Run 02:
Highest Train: 100.00
Highest Valid: 80.20
  Final Train: 100.00
   Final Test: 81.30
Split: 01, Run: 03
None time:  1.3003092431463301
None Run 03:
Highest Train: 100.00
Highest Valid: 81.00
  Final Train: 100.00
   Final Test: 81.10
run time now: 4.940639019012451
total time:  4.960092991124839
None All runs:
Highest Train: 100.00 ± 0.00
Highest Valid: 81.07 ± 0.90
  Final Train: 100.00 ± 0.00
   Final Test: 81.73 ± 0.93
[I 2023-06-12 00:52:03,619] Trial 424 finished with value: 81.06666564941406 and parameters: {'Fwd': 0.05328134792830552, 'K': 10, 'alpha': 0.6000000000000001, 'dropout': 0.6000000000000001, 'gnnepoch': 70, 'lambda1': 1.0, 'lambda2': 4.132600925118556, 'loop': 1, 'loss': 'CE', 'lr': 0.00750587840157069, 'softmaxF': True, 'useGCN': True, 'weight_decay': 1.0170912540102531e-06, 'weightedloss': False}. Best is trial 112 with value: 81.66667175292969.
/home/wxy/miniconda3/lib/python3.10/site-packages/optuna/distributions.py:685: UserWarning: The distribution is specified by [0, 1.00001] and step=0.05, but the range is not divisible by `step`. It will be replaced by [0, 1.0].
  warnings.warn(
K:  10
alpha:  1.0
lr:  0.0002175896133940915
weight_decay:  0.00011743105246664073
dropout:  0.4
fix split and run 3 times
Data: Data(x=[2708, 1433], y=[2708], train_mask=[2708], val_mask=[2708], test_mask=[2708], adj_t=[2708, 2708, nnz=10556])
num_train tensor(140)
num_noise 0
noise: tensor(0)
data feature 1433
ALTOPT(
  (lins): Sequential(
    (0): Linear(in_features=1433, out_features=64, bias=True)
    (1): BatchNorm1d(64, eps=1e-05, momentum=0.1, affine=True, track_running_stats=True)
    (2): Dropout(p=0.4, inplace=True)
    (3): ReLU(inplace=True)
    (4): Linear(in_features=64, out_features=7, bias=True)
    (5): LogSoftmax(dim=-1)
  )
  (prop): Propagation(K=10, mode=None, lambda1=None, lambda2=None, L21=True, alpha=1.0)
  (gcn): GCN(
    (convs): ModuleList(
      (0): GCNConv(1433, 64)
      (1): GCNConv(64, 7)
    )
    (bns): ModuleList(
      (0): BatchNorm1d(64, eps=1e-05, momentum=0.1, affine=True, track_running_stats=True)
    )
    (output): LogSoftmax(dim=-1)
  )
)
propagate done
init label
Split: 01, Run: 01
None time:  2.0704993959516287
None Run 01:
Highest Train: 100.00
Highest Valid: 78.40
  Final Train: 100.00
   Final Test: 77.80
Split: 01, Run: 02
None time:  1.6445996779948473
None Run 02:
Highest Train: 100.00
Highest Valid: 70.60
  Final Train: 100.00
   Final Test: 72.60
Split: 01, Run: 03
None time:  1.5054367680568248
None Run 03:
Highest Train: 100.00
Highest Valid: 72.60
  Final Train: 100.00
   Final Test: 72.60
run time now: 5.248880863189697
total time:  5.268151360098273
None All runs:
Highest Train: 100.00 ± 0.00
Highest Valid: 73.87 ± 4.05
  Final Train: 100.00 ± 0.00
   Final Test: 74.33 ± 3.00
[I 2023-06-12 00:52:09,386] Trial 425 finished with value: 73.86666870117188 and parameters: {'Fwd': 0.0005583278936322952, 'K': 10, 'alpha': 1.0, 'dropout': 0.4, 'gnnepoch': 60, 'lambda1': 0.8, 'lambda2': 3.5712836144791527, 'loop': 1, 'loss': 'CE', 'lr': 0.0002175896133940915, 'softmaxF': True, 'useGCN': True, 'weight_decay': 0.00011743105246664073, 'weightedloss': True}. Best is trial 112 with value: 81.66667175292969.
/home/wxy/miniconda3/lib/python3.10/site-packages/optuna/distributions.py:685: UserWarning: The distribution is specified by [0, 1.00001] and step=0.05, but the range is not divisible by `step`. It will be replaced by [0, 1.0].
  warnings.warn(
K:  10
alpha:  0.65
lr:  0.006502845847142705
weight_decay:  7.322290012218918e-06
dropout:  0.4
fix split and run 3 times
Data: Data(x=[2708, 1433], y=[2708], train_mask=[2708], val_mask=[2708], test_mask=[2708], adj_t=[2708, 2708, nnz=10556])
num_train tensor(140)
num_noise 0
noise: tensor(0)
data feature 1433
ALTOPT(
  (lins): Sequential(
    (0): Linear(in_features=1433, out_features=64, bias=True)
    (1): BatchNorm1d(64, eps=1e-05, momentum=0.1, affine=True, track_running_stats=True)
    (2): Dropout(p=0.4, inplace=True)
    (3): ReLU(inplace=True)
    (4): Linear(in_features=64, out_features=7, bias=True)
    (5): LogSoftmax(dim=-1)
  )
  (prop): Propagation(K=10, mode=None, lambda1=None, lambda2=None, L21=True, alpha=0.65)
  (gcn): GCN(
    (convs): ModuleList(
      (0): GCNConv(1433, 64)
      (1): GCNConv(64, 7)
    )
    (bns): ModuleList(
      (0): BatchNorm1d(64, eps=1e-05, momentum=0.1, affine=True, track_running_stats=True)
    )
    (output): LogSoftmax(dim=-1)
  )
)
propagate done
init label
Split: 01, Run: 01
None time:  1.4543641349300742
None Run 01:
Highest Train: 100.00
Highest Valid: 81.40
  Final Train: 100.00
   Final Test: 81.80
Split: 01, Run: 02
None time:  1.4308448620140553
None Run 02:
Highest Train: 100.00
Highest Valid: 81.60
  Final Train: 100.00
   Final Test: 81.50
Split: 01, Run: 03
None time:  1.7399703599512577
None Run 03:
Highest Train: 100.00
Highest Valid: 81.00
  Final Train: 100.00
   Final Test: 80.90
run time now: 4.649357080459595
total time:  4.662477288860828
None All runs:
Highest Train: 100.00 ± 0.00
Highest Valid: 81.33 ± 0.31
  Final Train: 100.00 ± 0.00
   Final Test: 81.40 ± 0.46
[I 2023-06-12 00:52:14,575] Trial 426 finished with value: 81.33333587646484 and parameters: {'Fwd': 0.08251206137536349, 'K': 10, 'alpha': 0.65, 'dropout': 0.4, 'gnnepoch': 60, 'lambda1': 0.8500000000000001, 'lambda2': 5.347330592619276, 'loop': 1, 'loss': 'CE', 'lr': 0.006502845847142705, 'softmaxF': True, 'useGCN': True, 'weight_decay': 7.322290012218918e-06, 'weightedloss': False}. Best is trial 112 with value: 81.66667175292969.
/home/wxy/miniconda3/lib/python3.10/site-packages/optuna/distributions.py:685: UserWarning: The distribution is specified by [0, 1.00001] and step=0.05, but the range is not divisible by `step`. It will be replaced by [0, 1.0].
  warnings.warn(
K:  7
alpha:  0.75
lr:  0.005446287323298683
weight_decay:  5.994013842475182e-05
dropout:  0.4
fix split and run 3 times
Data: Data(x=[2708, 1433], y=[2708], train_mask=[2708], val_mask=[2708], test_mask=[2708], adj_t=[2708, 2708, nnz=10556])
num_train tensor(140)
num_noise 0
noise: tensor(0)
data feature 1433
ALTOPT(
  (lins): Sequential(
    (0): Linear(in_features=1433, out_features=64, bias=True)
    (1): BatchNorm1d(64, eps=1e-05, momentum=0.1, affine=True, track_running_stats=True)
    (2): Dropout(p=0.4, inplace=True)
    (3): ReLU(inplace=True)
    (4): Linear(in_features=64, out_features=7, bias=True)
    (5): LogSoftmax(dim=-1)
  )
  (prop): Propagation(K=7, mode=None, lambda1=None, lambda2=None, L21=True, alpha=0.75)
  (gcn): GCN(
    (convs): ModuleList(
      (0): GCNConv(1433, 64)
      (1): GCNConv(64, 7)
    )
    (bns): ModuleList(
      (0): BatchNorm1d(64, eps=1e-05, momentum=0.1, affine=True, track_running_stats=True)
    )
    (output): LogSoftmax(dim=-1)
  )
)
propagate done
init label
Split: 01, Run: 01
None time:  1.5643953869584948
None Run 01:
Highest Train: 100.00
Highest Valid: 81.20
  Final Train: 100.00
   Final Test: 81.70
Split: 01, Run: 02
None time:  1.0512583979871124
None Run 02:
Highest Train: 100.00
Highest Valid: 80.60
  Final Train: 100.00
   Final Test: 81.00
Split: 01, Run: 03
None time:  1.3413709942251444
None Run 03:
Highest Train: 100.00
Highest Valid: 80.60
  Final Train: 100.00
   Final Test: 81.50
run time now: 3.9856784343719482
total time:  4.0057515350636095
None All runs:
Highest Train: 100.00 ± 0.00
Highest Valid: 80.80 ± 0.35
  Final Train: 100.00 ± 0.00
   Final Test: 81.40 ± 0.36
[I 2023-06-12 00:52:19,154] Trial 427 finished with value: 80.79999542236328 and parameters: {'Fwd': 0.035088962060109814, 'K': 7, 'alpha': 0.75, 'dropout': 0.4, 'gnnepoch': 60, 'lambda1': 0.9, 'lambda2': 5.975925461177267, 'loop': 1, 'loss': 'CE', 'lr': 0.005446287323298683, 'softmaxF': True, 'useGCN': True, 'weight_decay': 5.994013842475182e-05, 'weightedloss': False}. Best is trial 112 with value: 81.66667175292969.
/home/wxy/miniconda3/lib/python3.10/site-packages/optuna/distributions.py:685: UserWarning: The distribution is specified by [0, 1.00001] and step=0.05, but the range is not divisible by `step`. It will be replaced by [0, 1.0].
  warnings.warn(
K:  9
alpha:  0.55
lr:  0.0012261728438413982
weight_decay:  1.435304124488889e-06
dropout:  0.4
fix split and run 3 times
Data: Data(x=[2708, 1433], y=[2708], train_mask=[2708], val_mask=[2708], test_mask=[2708], adj_t=[2708, 2708, nnz=10556])
num_train tensor(140)
num_noise 0
noise: tensor(0)
data feature 1433
ALTOPT(
  (lins): Sequential(
    (0): Linear(in_features=1433, out_features=64, bias=True)
    (1): BatchNorm1d(64, eps=1e-05, momentum=0.1, affine=True, track_running_stats=True)
    (2): Dropout(p=0.4, inplace=True)
    (3): ReLU(inplace=True)
    (4): Linear(in_features=64, out_features=7, bias=True)
    (5): LogSoftmax(dim=-1)
  )
  (prop): Propagation(K=9, mode=None, lambda1=None, lambda2=None, L21=True, alpha=0.55)
  (gcn): GCN(
    (convs): ModuleList(
      (0): GCNConv(1433, 64)
      (1): GCNConv(64, 7)
    )
    (bns): ModuleList(
      (0): BatchNorm1d(64, eps=1e-05, momentum=0.1, affine=True, track_running_stats=True)
    )
    (output): LogSoftmax(dim=-1)
  )
)
propagate done
init label
Split: 01, Run: 01
None time:  1.7508158250711858
None Run 01:
Highest Train: 100.00
Highest Valid: 79.40
  Final Train: 100.00
   Final Test: 79.60
Split: 01, Run: 02
None time:  1.4558325139805675
None Run 02:
Highest Train: 100.00
Highest Valid: 76.00
  Final Train: 100.00
   Final Test: 75.80
Split: 01, Run: 03
None time:  1.2836905389558524
None Run 03:
Highest Train: 100.00
Highest Valid: 75.20
  Final Train: 100.00
   Final Test: 76.80
run time now: 4.520232439041138
total time:  4.539235537871718
None All runs:
Highest Train: 100.00 ± 0.00
Highest Valid: 76.87 ± 2.23
  Final Train: 100.00 ± 0.00
   Final Test: 77.40 ± 1.97
[I 2023-06-12 00:52:24,187] Trial 428 finished with value: 76.86666107177734 and parameters: {'Fwd': 0.06782325461680302, 'K': 9, 'alpha': 0.55, 'dropout': 0.4, 'gnnepoch': 60, 'lambda1': 0.9500000000000001, 'lambda2': 3.843037061922777, 'loop': 1, 'loss': 'CE', 'lr': 0.0012261728438413982, 'softmaxF': True, 'useGCN': True, 'weight_decay': 1.435304124488889e-06, 'weightedloss': False}. Best is trial 112 with value: 81.66667175292969.
/home/wxy/miniconda3/lib/python3.10/site-packages/optuna/distributions.py:685: UserWarning: The distribution is specified by [0, 1.00001] and step=0.05, but the range is not divisible by `step`. It will be replaced by [0, 1.0].
  warnings.warn(
K:  10
alpha:  0.45
lr:  0.008263675761866943
weight_decay:  0.0015023231437244259
dropout:  0.5
fix split and run 3 times
Data: Data(x=[2708, 1433], y=[2708], train_mask=[2708], val_mask=[2708], test_mask=[2708], adj_t=[2708, 2708, nnz=10556])
num_train tensor(140)
num_noise 0
noise: tensor(0)
data feature 1433
ALTOPT(
  (lins): Sequential(
    (0): Linear(in_features=1433, out_features=64, bias=True)
    (1): BatchNorm1d(64, eps=1e-05, momentum=0.1, affine=True, track_running_stats=True)
    (2): Dropout(p=0.5, inplace=True)
    (3): ReLU(inplace=True)
    (4): Linear(in_features=64, out_features=7, bias=True)
    (5): LogSoftmax(dim=-1)
  )
  (prop): Propagation(K=10, mode=None, lambda1=None, lambda2=None, L21=True, alpha=0.45)
  (gcn): GCN(
    (convs): ModuleList(
      (0): GCNConv(1433, 64)
      (1): GCNConv(64, 7)
    )
    (bns): ModuleList(
      (0): BatchNorm1d(64, eps=1e-05, momentum=0.1, affine=True, track_running_stats=True)
    )
    (output): LogSoftmax(dim=-1)
  )
)
propagate done
init label
Split: 01, Run: 01
None time:  1.8170435710344464
None Run 01:
Highest Train: 100.00
Highest Valid: 80.40
  Final Train: 100.00
   Final Test: 83.10
Split: 01, Run: 02
None time:  1.6438015399035066
None Run 02:
Highest Train: 100.00
Highest Valid: 80.60
  Final Train: 100.00
   Final Test: 82.80
Split: 01, Run: 03
None time:  1.899641013937071
None Run 03:
Highest Train: 100.00
Highest Valid: 80.20
  Final Train: 100.00
   Final Test: 80.50
run time now: 5.390631675720215
total time:  5.407999183051288
None All runs:
Highest Train: 100.00 ± 0.00
Highest Valid: 80.40 ± 0.20
  Final Train: 100.00 ± 0.00
   Final Test: 82.13 ± 1.42
[I 2023-06-12 00:52:30,087] Trial 429 finished with value: 80.4000015258789 and parameters: {'Fwd': 0.00025813110152775017, 'K': 10, 'alpha': 0.45, 'dropout': 0.5, 'gnnepoch': 70, 'lambda1': 0.8500000000000001, 'lambda2': 5.714988859646695, 'loop': 1, 'loss': 'CE', 'lr': 0.008263675761866943, 'softmaxF': True, 'useGCN': True, 'weight_decay': 0.0015023231437244259, 'weightedloss': True}. Best is trial 112 with value: 81.66667175292969.
/home/wxy/miniconda3/lib/python3.10/site-packages/optuna/distributions.py:685: UserWarning: The distribution is specified by [0, 1.00001] and step=0.05, but the range is not divisible by `step`. It will be replaced by [0, 1.0].
  warnings.warn(
K:  10
alpha:  0.6000000000000001
lr:  0.009090384362292706
weight_decay:  9.076657299856945e-05
dropout:  0.4
fix split and run 3 times
Data: Data(x=[2708, 1433], y=[2708], train_mask=[2708], val_mask=[2708], test_mask=[2708], adj_t=[2708, 2708, nnz=10556])
num_train tensor(140)
num_noise 0
noise: tensor(0)
data feature 1433
ALTOPT(
  (lins): Sequential(
    (0): Linear(in_features=1433, out_features=64, bias=True)
    (1): BatchNorm1d(64, eps=1e-05, momentum=0.1, affine=True, track_running_stats=True)
    (2): Dropout(p=0.4, inplace=True)
    (3): ReLU(inplace=True)
    (4): Linear(in_features=64, out_features=7, bias=True)
    (5): LogSoftmax(dim=-1)
  )
  (prop): Propagation(K=10, mode=None, lambda1=None, lambda2=None, L21=True, alpha=0.6000000000000001)
  (gcn): GCN(
    (convs): ModuleList(
      (0): GCNConv(1433, 64)
      (1): GCNConv(64, 7)
    )
    (bns): ModuleList(
      (0): BatchNorm1d(64, eps=1e-05, momentum=0.1, affine=True, track_running_stats=True)
    )
    (output): LogSoftmax(dim=-1)
  )
)
propagate done
init label
Split: 01, Run: 01
None time:  0.9203596080187708
None Run 01:
Highest Train: 100.00
Highest Valid: 79.80
  Final Train: 100.00
   Final Test: 79.40
Split: 01, Run: 02
None time:  1.524357205023989
None Run 02:
Highest Train: 100.00
Highest Valid: 80.20
  Final Train: 99.29
   Final Test: 79.00
Split: 01, Run: 03
None time:  0.8493767201434821
None Run 03:
Highest Train: 100.00
Highest Valid: 79.80
  Final Train: 100.00
   Final Test: 79.50
run time now: 3.325239658355713
total time:  3.3566857089754194
None All runs:
Highest Train: 100.00 ± 0.00
Highest Valid: 79.93 ± 0.23
  Final Train: 99.76 ± 0.41
   Final Test: 79.30 ± 0.26
