[I 2023-06-12 00:27:00,953] Trial 161 finished with value: 81.86666870117188 and parameters: {'Fwd': 2.128159910577047e-06, 'K': 10, 'alpha': 0.9500000000000001, 'dropout': 0.9, 'gnnepoch': 60, 'lambda1': 0.55, 'lambda2': 7.339306277665288, 'loop': 1, 'loss': 'MSE', 'lr': 0.002557972184951698, 'softmaxF': True, 'useGCN': False, 'weight_decay': 0.0029022341413721246, 'weightedloss': False}. Best is trial 132 with value: 83.0666732788086.
/home/wxy/miniconda3/lib/python3.10/site-packages/optuna/distributions.py:685: UserWarning: The distribution is specified by [0, 1.00001] and step=0.05, but the range is not divisible by `step`. It will be replaced by [0, 1.0].
  warnings.warn(
K:  10
alpha:  0.9500000000000001
lr:  0.0033735769570941735
weight_decay:  0.01018822392175817
dropout:  0.9
fix split and run 3 times
Data: Data(x=[19717, 500], y=[19717], train_mask=[19717], val_mask=[19717], test_mask=[19717], adj_t=[19717, 19717, nnz=88648])
num_train tensor(60)
num_noise 0
noise: tensor(0)
data feature 500
ALTOPT(
  (lins): Sequential(
    (0): Linear(in_features=500, out_features=64, bias=True)
    (1): BatchNorm1d(64, eps=1e-05, momentum=0.1, affine=True, track_running_stats=True)
    (2): Dropout(p=0.9, inplace=True)
    (3): ReLU(inplace=True)
    (4): Linear(in_features=64, out_features=3, bias=True)
    (5): Identity()
  )
  (prop): Propagation(K=10, mode=None, lambda1=None, lambda2=None, L21=True, alpha=0.9500000000000001)
  (gcn): GCN(
    (convs): ModuleList(
      (0): GCNConv(500, 64)
      (1): GCNConv(64, 3)
    )
    (bns): ModuleList(
      (0): BatchNorm1d(64, eps=1e-05, momentum=0.1, affine=True, track_running_stats=True)
    )
    (output): Identity()
  )
)
propagate done
init label
Split: 01, Run: 01
None time:  2.6575341019779444
None Run 01:
Highest Train: 100.00
Highest Valid: 81.00
  Final Train: 100.00
   Final Test: 78.30
Split: 01, Run: 02
None time:  1.1191007080487907
None Run 02:
Highest Train: 100.00
Highest Valid: 81.20
  Final Train: 100.00
   Final Test: 78.90
Split: 01, Run: 03
None time:  0.9778348898980767
None Run 03:
Highest Train: 100.00
Highest Valid: 81.60
  Final Train: 100.00
   Final Test: 79.80
run time now: 4.799866437911987
total time:  4.851053869817406
None All runs:
Highest Train: 100.00 ± 0.00
Highest Valid: 81.27 ± 0.31
  Final Train: 100.00 ± 0.00
   Final Test: 79.00 ± 0.75
[I 2023-06-12 00:27:06,292] Trial 162 finished with value: 81.26666259765625 and parameters: {'Fwd': 2.606918754135161e-06, 'K': 10, 'alpha': 0.9500000000000001, 'dropout': 0.9, 'gnnepoch': 60, 'lambda1': 0.6000000000000001, 'lambda2': 6.860714710258399, 'loop': 1, 'loss': 'MSE', 'lr': 0.0033735769570941735, 'softmaxF': True, 'useGCN': False, 'weight_decay': 0.01018822392175817, 'weightedloss': False}. Best is trial 132 with value: 83.0666732788086.
/home/wxy/miniconda3/lib/python3.10/site-packages/optuna/distributions.py:685: UserWarning: The distribution is specified by [0, 1.00001] and step=0.05, but the range is not divisible by `step`. It will be replaced by [0, 1.0].
  warnings.warn(
K:  10
alpha:  0.9500000000000001
lr:  0.0024812058559026194
weight_decay:  0.0031452410764067442
dropout:  0.9
fix split and run 3 times
Data: Data(x=[19717, 500], y=[19717], train_mask=[19717], val_mask=[19717], test_mask=[19717], adj_t=[19717, 19717, nnz=88648])
num_train tensor(60)
num_noise 0
noise: tensor(0)
data feature 500
ALTOPT(
  (lins): Sequential(
    (0): Linear(in_features=500, out_features=64, bias=True)
    (1): BatchNorm1d(64, eps=1e-05, momentum=0.1, affine=True, track_running_stats=True)
    (2): Dropout(p=0.9, inplace=True)
    (3): ReLU(inplace=True)
    (4): Linear(in_features=64, out_features=3, bias=True)
    (5): Identity()
  )
  (prop): Propagation(K=10, mode=None, lambda1=None, lambda2=None, L21=True, alpha=0.9500000000000001)
  (gcn): GCN(
    (convs): ModuleList(
      (0): GCNConv(500, 64)
      (1): GCNConv(64, 3)
    )
    (bns): ModuleList(
      (0): BatchNorm1d(64, eps=1e-05, momentum=0.1, affine=True, track_running_stats=True)
    )
    (output): Identity()
  )
)
propagate done
init label
Split: 01, Run: 01
None time:  2.6402704999782145
None Run 01:
Highest Train: 100.00
Highest Valid: 82.80
  Final Train: 100.00
   Final Test: 78.80
Split: 01, Run: 02
None time:  1.15328908408992
None Run 02:
Highest Train: 100.00
Highest Valid: 82.80
  Final Train: 100.00
   Final Test: 80.40
Split: 01, Run: 03
None time:  0.8816054100170732
None Run 03:
Highest Train: 100.00
Highest Valid: 81.20
  Final Train: 100.00
   Final Test: 79.20
run time now: 4.723675489425659
total time:  4.777962367981672
None All runs:
Highest Train: 100.00 ± 0.00
Highest Valid: 82.27 ± 0.92
  Final Train: 100.00 ± 0.00
   Final Test: 79.47 ± 0.83
[I 2023-06-12 00:27:11,545] Trial 163 finished with value: 82.26667022705078 and parameters: {'Fwd': 8.322799071948656e-06, 'K': 10, 'alpha': 0.9500000000000001, 'dropout': 0.9, 'gnnepoch': 70, 'lambda1': 0.65, 'lambda2': 7.5966809954356345, 'loop': 1, 'loss': 'MSE', 'lr': 0.0024812058559026194, 'softmaxF': True, 'useGCN': False, 'weight_decay': 0.0031452410764067442, 'weightedloss': False}. Best is trial 132 with value: 83.0666732788086.
/home/wxy/miniconda3/lib/python3.10/site-packages/optuna/distributions.py:685: UserWarning: The distribution is specified by [0, 1.00001] and step=0.05, but the range is not divisible by `step`. It will be replaced by [0, 1.0].
  warnings.warn(
K:  3
alpha:  0.9
lr:  0.001967170911119129
weight_decay:  0.005699417178317275
dropout:  0.9
fix split and run 3 times
Data: Data(x=[19717, 500], y=[19717], train_mask=[19717], val_mask=[19717], test_mask=[19717], adj_t=[19717, 19717, nnz=88648])
num_train tensor(60)
num_noise 0
noise: tensor(0)
data feature 500
ALTOPT(
  (lins): Sequential(
    (0): Linear(in_features=500, out_features=64, bias=True)
    (1): BatchNorm1d(64, eps=1e-05, momentum=0.1, affine=True, track_running_stats=True)
    (2): Dropout(p=0.9, inplace=True)
    (3): ReLU(inplace=True)
    (4): Linear(in_features=64, out_features=3, bias=True)
    (5): Identity()
  )
  (prop): Propagation(K=3, mode=None, lambda1=None, lambda2=None, L21=True, alpha=0.9)
  (gcn): GCN(
    (convs): ModuleList(
      (0): GCNConv(500, 64)
      (1): GCNConv(64, 3)
    )
    (bns): ModuleList(
      (0): BatchNorm1d(64, eps=1e-05, momentum=0.1, affine=True, track_running_stats=True)
    )
    (output): Identity()
  )
)
propagate done
init label
Split: 01, Run: 01, Epoch: 100, Loss: 0.6423, Train: 100.00%, Valid: 78.00% Test: 72.90%
Split: 01, Run: 01
None time:  2.564916281029582
None Run 01:
Highest Train: 100.00
Highest Valid: 78.00
  Final Train: 100.00
   Final Test: 72.90
Split: 01, Run: 02
None time:  1.2455115369521081
None Run 02:
Highest Train: 100.00
Highest Valid: 82.00
  Final Train: 100.00
   Final Test: 77.90
Split: 01, Run: 03
None time:  1.0595711851492524
None Run 03:
Highest Train: 100.00
Highest Valid: 80.20
  Final Train: 100.00
   Final Test: 75.50
run time now: 4.908057451248169
total time:  4.958698004018515
None All runs:
Highest Train: 100.00 ± 0.00
Highest Valid: 80.07 ± 2.00
  Final Train: 100.00 ± 0.00
   Final Test: 75.43 ± 2.50
[I 2023-06-12 00:27:16,945] Trial 164 finished with value: 80.06666564941406 and parameters: {'Fwd': 1.249146070757634e-06, 'K': 3, 'alpha': 0.9, 'dropout': 0.9, 'gnnepoch': 60, 'lambda1': 0.55, 'lambda2': 7.052101882188351, 'loop': 1, 'loss': 'MSE', 'lr': 0.001967170911119129, 'softmaxF': True, 'useGCN': False, 'weight_decay': 0.005699417178317275, 'weightedloss': False}. Best is trial 132 with value: 83.0666732788086.
/home/wxy/miniconda3/lib/python3.10/site-packages/optuna/distributions.py:685: UserWarning: The distribution is specified by [0, 1.00001] and step=0.05, but the range is not divisible by `step`. It will be replaced by [0, 1.0].
  warnings.warn(
K:  10
alpha:  0.9500000000000001
lr:  0.0028137616102934145
weight_decay:  0.002233584008727134
dropout:  0.9
fix split and run 3 times
Data: Data(x=[19717, 500], y=[19717], train_mask=[19717], val_mask=[19717], test_mask=[19717], adj_t=[19717, 19717, nnz=88648])
num_train tensor(60)
num_noise 0
noise: tensor(0)
data feature 500
ALTOPT(
  (lins): Sequential(
    (0): Linear(in_features=500, out_features=64, bias=True)
    (1): BatchNorm1d(64, eps=1e-05, momentum=0.1, affine=True, track_running_stats=True)
    (2): Dropout(p=0.9, inplace=True)
    (3): ReLU(inplace=True)
    (4): Linear(in_features=64, out_features=3, bias=True)
    (5): Identity()
  )
  (prop): Propagation(K=10, mode=None, lambda1=None, lambda2=None, L21=True, alpha=0.9500000000000001)
  (gcn): GCN(
    (convs): ModuleList(
      (0): GCNConv(500, 64)
      (1): GCNConv(64, 3)
    )
    (bns): ModuleList(
      (0): BatchNorm1d(64, eps=1e-05, momentum=0.1, affine=True, track_running_stats=True)
    )
    (output): Identity()
  )
)
propagate done
init label
Split: 01, Run: 01
None time:  2.9185802340507507
None Run 01:
Highest Train: 100.00
Highest Valid: 82.00
  Final Train: 100.00
   Final Test: 77.90
Split: 01, Run: 02
None time:  1.7345549170859158
None Run 02:
Highest Train: 100.00
Highest Valid: 83.40
  Final Train: 100.00
   Final Test: 80.40
Split: 01, Run: 03
None time:  1.1382650309242308
None Run 03:
Highest Train: 100.00
Highest Valid: 81.80
  Final Train: 100.00
   Final Test: 78.60
run time now: 5.842003583908081
total time:  5.8849961049854755
None All runs:
Highest Train: 100.00 ± 0.00
Highest Valid: 82.40 ± 0.87
  Final Train: 100.00 ± 0.00
   Final Test: 78.97 ± 1.29
[I 2023-06-12 00:27:23,296] Trial 165 finished with value: 82.4000015258789 and parameters: {'Fwd': 1.817212836398442e-06, 'K': 10, 'alpha': 0.9500000000000001, 'dropout': 0.9, 'gnnepoch': 60, 'lambda1': 0.45, 'lambda2': 6.701947567536634, 'loop': 1, 'loss': 'MSE', 'lr': 0.0028137616102934145, 'softmaxF': True, 'useGCN': False, 'weight_decay': 0.002233584008727134, 'weightedloss': False}. Best is trial 132 with value: 83.0666732788086.
/home/wxy/miniconda3/lib/python3.10/site-packages/optuna/distributions.py:685: UserWarning: The distribution is specified by [0, 1.00001] and step=0.05, but the range is not divisible by `step`. It will be replaced by [0, 1.0].
  warnings.warn(
K:  9
alpha:  0.55
lr:  0.002222512480118959
weight_decay:  0.0036531469055397997
dropout:  0.9
fix split and run 3 times
Data: Data(x=[19717, 500], y=[19717], train_mask=[19717], val_mask=[19717], test_mask=[19717], adj_t=[19717, 19717, nnz=88648])
num_train tensor(60)
num_noise 0
noise: tensor(0)
data feature 500
ALTOPT(
  (lins): Sequential(
    (0): Linear(in_features=500, out_features=64, bias=True)
    (1): BatchNorm1d(64, eps=1e-05, momentum=0.1, affine=True, track_running_stats=True)
    (2): Dropout(p=0.9, inplace=True)
    (3): ReLU(inplace=True)
    (4): Linear(in_features=64, out_features=3, bias=True)
    (5): Identity()
  )
  (prop): Propagation(K=9, mode=None, lambda1=None, lambda2=None, L21=True, alpha=0.55)
  (gcn): GCN(
    (convs): ModuleList(
      (0): GCNConv(500, 64)
      (1): GCNConv(64, 3)
    )
    (bns): ModuleList(
      (0): BatchNorm1d(64, eps=1e-05, momentum=0.1, affine=True, track_running_stats=True)
    )
    (output): Identity()
  )
)
propagate done
init label
Split: 01, Run: 01
None time:  0.9740357091650367
None Run 01:
Highest Train: 100.00
Highest Valid: 69.00
  Final Train: 100.00
   Final Test: 69.40
Split: 01, Run: 02
None time:  1.6856962470337749
None Run 02:
Highest Train: 100.00
Highest Valid: 75.20
  Final Train: 100.00
   Final Test: 72.60
Split: 01, Run: 03
None time:  1.7800104678608477
None Run 03:
Highest Train: 100.00
Highest Valid: 76.60
  Final Train: 100.00
   Final Test: 73.80
run time now: 4.485267639160156
total time:  4.537345377961174
None All runs:
Highest Train: 100.00 ± 0.00
Highest Valid: 73.60 ± 4.04
  Final Train: 100.00 ± 0.00
   Final Test: 71.93 ± 2.27
[I 2023-06-12 00:27:28,289] Trial 166 finished with value: 73.5999984741211 and parameters: {'Fwd': 3.886874511468172e-06, 'K': 9, 'alpha': 0.55, 'dropout': 0.9, 'gnnepoch': 70, 'lambda1': 0.7000000000000001, 'lambda2': 7.434511508699055, 'loop': 1, 'loss': 'MSE', 'lr': 0.002222512480118959, 'softmaxF': True, 'useGCN': False, 'weight_decay': 0.0036531469055397997, 'weightedloss': False}. Best is trial 132 with value: 83.0666732788086.
/home/wxy/miniconda3/lib/python3.10/site-packages/optuna/distributions.py:685: UserWarning: The distribution is specified by [0, 1.00001] and step=0.05, but the range is not divisible by `step`. It will be replaced by [0, 1.0].
  warnings.warn(
K:  10
alpha:  1.0
lr:  0.0031706045420485255
weight_decay:  0.0016045871074660237
dropout:  0.7000000000000001
fix split and run 3 times
Data: Data(x=[19717, 500], y=[19717], train_mask=[19717], val_mask=[19717], test_mask=[19717], adj_t=[19717, 19717, nnz=88648])
num_train tensor(60)
num_noise 0
noise: tensor(0)
data feature 500
ALTOPT(
  (lins): Sequential(
    (0): Linear(in_features=500, out_features=64, bias=True)
    (1): BatchNorm1d(64, eps=1e-05, momentum=0.1, affine=True, track_running_stats=True)
    (2): Dropout(p=0.7000000000000001, inplace=True)
    (3): ReLU(inplace=True)
    (4): Linear(in_features=64, out_features=3, bias=True)
    (5): Identity()
  )
  (prop): Propagation(K=10, mode=None, lambda1=None, lambda2=None, L21=True, alpha=1.0)
  (gcn): GCN(
    (convs): ModuleList(
      (0): GCNConv(500, 64)
      (1): GCNConv(64, 3)
    )
    (bns): ModuleList(
      (0): BatchNorm1d(64, eps=1e-05, momentum=0.1, affine=True, track_running_stats=True)
    )
    (output): Identity()
  )
)
propagate done
init label
Split: 01, Run: 01
None time:  1.6135163840372115
None Run 01:
Highest Train: 100.00
Highest Valid: 80.00
  Final Train: 100.00
   Final Test: 77.90
Split: 01, Run: 02
None time:  1.6308386500459164
None Run 02:
Highest Train: 100.00
Highest Valid: 76.20
  Final Train: 100.00
   Final Test: 74.60
Split: 01, Run: 03
None time:  1.008943276014179
None Run 03:
Highest Train: 100.00
Highest Valid: 79.20
  Final Train: 100.00
   Final Test: 78.00
run time now: 4.302218675613403
total time:  4.3535117278806865
None All runs:
Highest Train: 100.00 ± 0.00
Highest Valid: 78.47 ± 2.00
  Final Train: 100.00 ± 0.00
   Final Test: 76.83 ± 1.93
[I 2023-06-12 00:27:33,192] Trial 167 finished with value: 78.46666717529297 and parameters: {'Fwd': 2.2253518945673584e-06, 'K': 10, 'alpha': 1.0, 'dropout': 0.7000000000000001, 'gnnepoch': 70, 'lambda1': 0.55, 'lambda2': 7.10568857653506, 'loop': 1, 'loss': 'MSE', 'lr': 0.0031706045420485255, 'softmaxF': True, 'useGCN': False, 'weight_decay': 0.0016045871074660237, 'weightedloss': False}. Best is trial 132 with value: 83.0666732788086.
/home/wxy/miniconda3/lib/python3.10/site-packages/optuna/distributions.py:685: UserWarning: The distribution is specified by [0, 1.00001] and step=0.05, but the range is not divisible by `step`. It will be replaced by [0, 1.0].
  warnings.warn(
K:  9
alpha:  0.9500000000000001
lr:  0.002561793345808412
weight_decay:  0.002556895458634913
dropout:  0.8
fix split and run 3 times
Data: Data(x=[19717, 500], y=[19717], train_mask=[19717], val_mask=[19717], test_mask=[19717], adj_t=[19717, 19717, nnz=88648])
num_train tensor(60)
num_noise 0
noise: tensor(0)
data feature 500
ALTOPT(
  (lins): Sequential(
    (0): Linear(in_features=500, out_features=64, bias=True)
    (1): BatchNorm1d(64, eps=1e-05, momentum=0.1, affine=True, track_running_stats=True)
    (2): Dropout(p=0.8, inplace=True)
    (3): ReLU(inplace=True)
    (4): Linear(in_features=64, out_features=3, bias=True)
    (5): Identity()
  )
  (prop): Propagation(K=9, mode=None, lambda1=None, lambda2=None, L21=True, alpha=0.9500000000000001)
  (gcn): GCN(
    (convs): ModuleList(
      (0): GCNConv(500, 64)
      (1): GCNConv(64, 3)
    )
    (bns): ModuleList(
      (0): BatchNorm1d(64, eps=1e-05, momentum=0.1, affine=True, track_running_stats=True)
    )
    (output): Identity()
  )
)
propagate done
init label
Split: 01, Run: 01
None time:  3.3778136011678725
None Run 01:
Highest Train: 100.00
Highest Valid: 82.60
  Final Train: 100.00
   Final Test: 78.30
Split: 01, Run: 02
None time:  2.656052687903866
None Run 02:
Highest Train: 100.00
Highest Valid: 83.60
  Final Train: 100.00
   Final Test: 78.70
Split: 01, Run: 03
None time:  1.0048349520657212
None Run 03:
Highest Train: 100.00
Highest Valid: 81.20
  Final Train: 100.00
   Final Test: 77.70
run time now: 7.085929870605469
total time:  7.135586573043838
None All runs:
Highest Train: 100.00 ± 0.00
Highest Valid: 82.47 ± 1.21
  Final Train: 100.00 ± 0.00
   Final Test: 78.23 ± 0.50
[I 2023-06-12 00:27:40,773] Trial 168 finished with value: 82.46666717529297 and parameters: {'Fwd': 1.4167874670542507e-06, 'K': 9, 'alpha': 0.9500000000000001, 'dropout': 0.8, 'gnnepoch': 60, 'lambda1': 0.5, 'lambda2': 7.295082568218139, 'loop': 1, 'loss': 'MSE', 'lr': 0.002561793345808412, 'softmaxF': True, 'useGCN': False, 'weight_decay': 0.002556895458634913, 'weightedloss': False}. Best is trial 132 with value: 83.0666732788086.
/home/wxy/miniconda3/lib/python3.10/site-packages/optuna/distributions.py:685: UserWarning: The distribution is specified by [0, 1.00001] and step=0.05, but the range is not divisible by `step`. It will be replaced by [0, 1.0].
  warnings.warn(
K:  9
alpha:  0.9
lr:  0.002138377755581732
weight_decay:  0.004609845350480669
dropout:  0.8
fix split and run 3 times
Data: Data(x=[19717, 500], y=[19717], train_mask=[19717], val_mask=[19717], test_mask=[19717], adj_t=[19717, 19717, nnz=88648])
num_train tensor(60)
num_noise 0
noise: tensor(0)
data feature 500
ALTOPT(
  (lins): Sequential(
    (0): Linear(in_features=500, out_features=64, bias=True)
    (1): BatchNorm1d(64, eps=1e-05, momentum=0.1, affine=True, track_running_stats=True)
    (2): Dropout(p=0.8, inplace=True)
    (3): ReLU(inplace=True)
    (4): Linear(in_features=64, out_features=3, bias=True)
    (5): LogSoftmax(dim=-1)
  )
  (prop): Propagation(K=9, mode=None, lambda1=None, lambda2=None, L21=True, alpha=0.9)
  (gcn): GCN(
    (convs): ModuleList(
      (0): GCNConv(500, 64)
      (1): GCNConv(64, 3)
    )
    (bns): ModuleList(
      (0): BatchNorm1d(64, eps=1e-05, momentum=0.1, affine=True, track_running_stats=True)
    )
    (output): LogSoftmax(dim=-1)
  )
)
propagate done
init label
Split: 01, Run: 01
None time:  0.6607415839098394
None Run 01:
Highest Train: 100.00
Highest Valid: 74.60
  Final Train: 100.00
   Final Test: 71.70
Split: 01, Run: 02
None time:  1.0831348188221455
None Run 02:
Highest Train: 100.00
Highest Valid: 78.20
  Final Train: 98.33
   Final Test: 76.40
Split: 01, Run: 03
None time:  1.0364232040010393
None Run 03:
Highest Train: 100.00
Highest Valid: 78.00
  Final Train: 100.00
   Final Test: 76.70
run time now: 2.821441173553467
total time:  2.876839574892074
None All runs:
Highest Train: 100.00 ± 0.00
Highest Valid: 76.93 ± 2.02
  Final Train: 99.44 ± 0.96
   Final Test: 74.93 ± 2.80
[I 2023-06-12 00:27:44,251] Trial 169 finished with value: 76.9333267211914 and parameters: {'Fwd': 1.1913810399843822e-06, 'K': 9, 'alpha': 0.9, 'dropout': 0.8, 'gnnepoch': 60, 'lambda1': 0.5, 'lambda2': 7.8188394215537125, 'loop': 1, 'loss': 'CE', 'lr': 0.002138377755581732, 'softmaxF': True, 'useGCN': False, 'weight_decay': 0.004609845350480669, 'weightedloss': False}. Best is trial 132 with value: 83.0666732788086.
/home/wxy/miniconda3/lib/python3.10/site-packages/optuna/distributions.py:685: UserWarning: The distribution is specified by [0, 1.00001] and step=0.05, but the range is not divisible by `step`. It will be replaced by [0, 1.0].
  warnings.warn(
K:  9
alpha:  1.0
lr:  0.0024691747630757686
weight_decay:  0.002704225840445123
dropout:  0.7000000000000001
fix split and run 3 times
Data: Data(x=[19717, 500], y=[19717], train_mask=[19717], val_mask=[19717], test_mask=[19717], adj_t=[19717, 19717, nnz=88648])
num_train tensor(60)
num_noise 0
noise: tensor(0)
data feature 500
ALTOPT(
  (lins): Sequential(
    (0): Linear(in_features=500, out_features=64, bias=True)
    (1): BatchNorm1d(64, eps=1e-05, momentum=0.1, affine=True, track_running_stats=True)
    (2): Dropout(p=0.7000000000000001, inplace=True)
    (3): ReLU(inplace=True)
    (4): Linear(in_features=64, out_features=3, bias=True)
    (5): Identity()
  )
  (prop): Propagation(K=9, mode=None, lambda1=None, lambda2=None, L21=True, alpha=1.0)
  (gcn): GCN(
    (convs): ModuleList(
      (0): GCNConv(500, 64)
      (1): GCNConv(64, 3)
    )
    (bns): ModuleList(
      (0): BatchNorm1d(64, eps=1e-05, momentum=0.1, affine=True, track_running_stats=True)
    )
    (output): Identity()
  )
)
propagate done
init label
Split: 01, Run: 01
None time:  1.7069210449699312
None Run 01:
Highest Train: 100.00
Highest Valid: 79.80
  Final Train: 100.00
   Final Test: 77.60
Split: 01, Run: 02
None time:  1.9929301980882883
None Run 02:
Highest Train: 100.00
Highest Valid: 81.60
  Final Train: 100.00
   Final Test: 79.00
Split: 01, Run: 03
None time:  0.9782514940015972
None Run 03:
Highest Train: 100.00
Highest Valid: 78.40
  Final Train: 100.00
   Final Test: 77.90
run time now: 4.72238826751709
total time:  4.7725921450182796
None All runs:
Highest Train: 100.00 ± 0.00
Highest Valid: 79.93 ± 1.60
  Final Train: 100.00 ± 0.00
   Final Test: 78.17 ± 0.74
