[I 2023-06-11 23:57:20,267] Trial 575 finished with value: 69.13333129882812 and parameters: {'Fwd': 1.9171726745848756e-06, 'K': 8, 'alpha': 0.6000000000000001, 'dropout': 0.8, 'gnnepoch': 120, 'lambda1': 0.8500000000000001, 'lambda2': 9.274222376504616, 'loop': 2, 'loss': 'CE', 'lr': 0.000243190623164604, 'softmaxF': False, 'useGCN': True, 'weight_decay': 0.012512632778403128, 'weightedloss': True}. Best is trial 271 with value: 72.06666564941406.
/home/wxy/miniconda3/lib/python3.10/site-packages/optuna/distributions.py:685: UserWarning: The distribution is specified by [0, 1.00001] and step=0.05, but the range is not divisible by `step`. It will be replaced by [0, 1.0].
  warnings.warn(
K:  9
alpha:  0.8
lr:  0.0013433133179330118
weight_decay:  0.0004337162421183379
dropout:  0.8
fix split and run 3 times
Data: Data(x=[3327, 3703], y=[3327], train_mask=[3327], val_mask=[3327], test_mask=[3327], adj_t=[3327, 3327, nnz=9104])
num_train tensor(120)
num_noise 0
noise: tensor(0)
data feature 3703
ALTOPT(
  (lins): Sequential(
    (0): Linear(in_features=3703, out_features=64, bias=True)
    (1): BatchNorm1d(64, eps=1e-05, momentum=0.1, affine=True, track_running_stats=True)
    (2): Dropout(p=0.8, inplace=True)
    (3): ReLU(inplace=True)
    (4): Linear(in_features=64, out_features=6, bias=True)
    (5): LogSoftmax(dim=-1)
  )
  (prop): Propagation(K=9, mode=None, lambda1=None, lambda2=None, L21=True, alpha=0.8)
  (gcn): GCN(
    (convs): ModuleList(
      (0): GCNConv(3703, 64)
      (1): GCNConv(64, 6)
    )
    (bns): ModuleList(
      (0): BatchNorm1d(64, eps=1e-05, momentum=0.1, affine=True, track_running_stats=True)
    )
    (output): LogSoftmax(dim=-1)
  )
)
propagate done
init label
Split: 01, Run: 01
None time:  1.0605281570460647
None Run 01:
Highest Train: 100.00
Highest Valid: 71.40
  Final Train: 100.00
   Final Test: 69.50
Split: 01, Run: 02
None time:  1.1085835059639066
None Run 02:
Highest Train: 100.00
Highest Valid: 72.20
  Final Train: 100.00
   Final Test: 70.00
Split: 01, Run: 03
None time:  1.0684263780713081
None Run 03:
Highest Train: 100.00
Highest Valid: 71.80
  Final Train: 100.00
   Final Test: 70.70
run time now: 3.280411958694458
total time:  3.336814999114722
None All runs:
Highest Train: 100.00 ± 0.00
Highest Valid: 71.80 ± 0.40
  Final Train: 100.00 ± 0.00
   Final Test: 70.07 ± 0.60
[I 2023-06-11 23:57:24,089] Trial 576 finished with value: 71.80000305175781 and parameters: {'Fwd': 9.831502458954505e-06, 'K': 9, 'alpha': 0.8, 'dropout': 0.8, 'gnnepoch': 120, 'lambda1': 0.7000000000000001, 'lambda2': 6.834337745953494, 'loop': 0, 'loss': 'CE', 'lr': 0.0013433133179330118, 'softmaxF': False, 'useGCN': True, 'weight_decay': 0.0004337162421183379, 'weightedloss': True}. Best is trial 271 with value: 72.06666564941406.
/home/wxy/miniconda3/lib/python3.10/site-packages/optuna/distributions.py:685: UserWarning: The distribution is specified by [0, 1.00001] and step=0.05, but the range is not divisible by `step`. It will be replaced by [0, 1.0].
  warnings.warn(
K:  8
alpha:  0.75
lr:  0.0010816821504001865
weight_decay:  9.484559154323457e-06
dropout:  0.8
fix split and run 3 times
Data: Data(x=[3327, 3703], y=[3327], train_mask=[3327], val_mask=[3327], test_mask=[3327], adj_t=[3327, 3327, nnz=9104])
num_train tensor(120)
num_noise 0
noise: tensor(0)
data feature 3703
ALTOPT(
  (lins): Sequential(
    (0): Linear(in_features=3703, out_features=64, bias=True)
    (1): BatchNorm1d(64, eps=1e-05, momentum=0.1, affine=True, track_running_stats=True)
    (2): Dropout(p=0.8, inplace=True)
    (3): ReLU(inplace=True)
    (4): Linear(in_features=64, out_features=6, bias=True)
    (5): LogSoftmax(dim=-1)
  )
  (prop): Propagation(K=8, mode=None, lambda1=None, lambda2=None, L21=True, alpha=0.75)
  (gcn): GCN(
    (convs): ModuleList(
      (0): GCNConv(3703, 64)
      (1): GCNConv(64, 6)
    )
    (bns): ModuleList(
      (0): BatchNorm1d(64, eps=1e-05, momentum=0.1, affine=True, track_running_stats=True)
    )
    (output): LogSoftmax(dim=-1)
  )
)
propagate done
init label
Split: 01, Run: 01
None time:  0.9795656511560082
None Run 01:
Highest Train: 100.00
Highest Valid: 71.00
  Final Train: 100.00
   Final Test: 69.40
Split: 01, Run: 02
None time:  1.0094574661925435
None Run 02:
Highest Train: 100.00
Highest Valid: 72.40
  Final Train: 100.00
   Final Test: 69.60
Split: 01, Run: 03
None time:  1.1579268020577729
None Run 03:
Highest Train: 100.00
Highest Valid: 71.60
  Final Train: 100.00
   Final Test: 70.70
run time now: 3.195974111557007
total time:  3.257440601941198
None All runs:
Highest Train: 100.00 ± 0.00
Highest Valid: 71.67 ± 0.70
  Final Train: 100.00 ± 0.00
   Final Test: 69.90 ± 0.70
[I 2023-06-11 23:57:27,843] Trial 577 finished with value: 71.66666412353516 and parameters: {'Fwd': 0.004617162629056572, 'K': 8, 'alpha': 0.75, 'dropout': 0.8, 'gnnepoch': 120, 'lambda1': 0.75, 'lambda2': 4.7236981833984615, 'loop': 0, 'loss': 'CE', 'lr': 0.0010816821504001865, 'softmaxF': False, 'useGCN': True, 'weight_decay': 9.484559154323457e-06, 'weightedloss': True}. Best is trial 271 with value: 72.06666564941406.
/home/wxy/miniconda3/lib/python3.10/site-packages/optuna/distributions.py:685: UserWarning: The distribution is specified by [0, 1.00001] and step=0.05, but the range is not divisible by `step`. It will be replaced by [0, 1.0].
  warnings.warn(
K:  8
alpha:  0.8500000000000001
lr:  0.001602480918130253
weight_decay:  0.001507637151232315
dropout:  0.8
fix split and run 3 times
Data: Data(x=[3327, 3703], y=[3327], train_mask=[3327], val_mask=[3327], test_mask=[3327], adj_t=[3327, 3327, nnz=9104])
num_train tensor(120)
num_noise 0
noise: tensor(0)
data feature 3703
ALTOPT(
  (lins): Sequential(
    (0): Linear(in_features=3703, out_features=64, bias=True)
    (1): BatchNorm1d(64, eps=1e-05, momentum=0.1, affine=True, track_running_stats=True)
    (2): Dropout(p=0.8, inplace=True)
    (3): ReLU(inplace=True)
    (4): Linear(in_features=64, out_features=6, bias=True)
    (5): LogSoftmax(dim=-1)
  )
  (prop): Propagation(K=8, mode=None, lambda1=None, lambda2=None, L21=True, alpha=0.8500000000000001)
  (gcn): GCN(
    (convs): ModuleList(
      (0): GCNConv(3703, 64)
      (1): GCNConv(64, 6)
    )
    (bns): ModuleList(
      (0): BatchNorm1d(64, eps=1e-05, momentum=0.1, affine=True, track_running_stats=True)
    )
    (output): LogSoftmax(dim=-1)
  )
)
propagate done
init label
Split: 01, Run: 01
None time:  1.2306646360084414
None Run 01:
Highest Train: 100.00
Highest Valid: 71.40
  Final Train: 100.00
   Final Test: 69.50
Split: 01, Run: 02
None time:  1.0639958051033318
None Run 02:
Highest Train: 100.00
Highest Valid: 72.00
  Final Train: 100.00
   Final Test: 70.00
Split: 01, Run: 03
None time:  1.0918571869842708
None Run 03:
Highest Train: 100.00
Highest Valid: 71.40
  Final Train: 100.00
   Final Test: 70.00
run time now: 3.4264373779296875
total time:  3.477322840830311
None All runs:
Highest Train: 100.00 ± 0.00
Highest Valid: 71.60 ± 0.35
  Final Train: 100.00 ± 0.00
   Final Test: 69.83 ± 0.29
[I 2023-06-11 23:57:31,881] Trial 578 finished with value: 71.5999984741211 and parameters: {'Fwd': 0.0007513248905085486, 'K': 8, 'alpha': 0.8500000000000001, 'dropout': 0.8, 'gnnepoch': 120, 'lambda1': 0.65, 'lambda2': 6.213335422788789, 'loop': 0, 'loss': 'CE', 'lr': 0.001602480918130253, 'softmaxF': False, 'useGCN': True, 'weight_decay': 0.001507637151232315, 'weightedloss': True}. Best is trial 271 with value: 72.06666564941406.
/home/wxy/miniconda3/lib/python3.10/site-packages/optuna/distributions.py:685: UserWarning: The distribution is specified by [0, 1.00001] and step=0.05, but the range is not divisible by `step`. It will be replaced by [0, 1.0].
  warnings.warn(
K:  8
alpha:  0.9
lr:  0.0007993941131981258
weight_decay:  0.05812570624994175
dropout:  0.8
fix split and run 3 times
Data: Data(x=[3327, 3703], y=[3327], train_mask=[3327], val_mask=[3327], test_mask=[3327], adj_t=[3327, 3327, nnz=9104])
num_train tensor(120)
num_noise 0
noise: tensor(0)
data feature 3703
ALTOPT(
  (lins): Sequential(
    (0): Linear(in_features=3703, out_features=64, bias=True)
    (1): BatchNorm1d(64, eps=1e-05, momentum=0.1, affine=True, track_running_stats=True)
    (2): Dropout(p=0.8, inplace=True)
    (3): ReLU(inplace=True)
    (4): Linear(in_features=64, out_features=6, bias=True)
    (5): LogSoftmax(dim=-1)
  )
  (prop): Propagation(K=8, mode=None, lambda1=None, lambda2=None, L21=True, alpha=0.9)
  (gcn): GCN(
    (convs): ModuleList(
      (0): GCNConv(3703, 64)
      (1): GCNConv(64, 6)
    )
    (bns): ModuleList(
      (0): BatchNorm1d(64, eps=1e-05, momentum=0.1, affine=True, track_running_stats=True)
    )
    (output): LogSoftmax(dim=-1)
  )
)
propagate done
init label
Split: 01, Run: 01
None time:  0.9892563340254128
None Run 01:
Highest Train: 100.00
Highest Valid: 71.00
  Final Train: 100.00
   Final Test: 69.70
Split: 01, Run: 02
None time:  0.9940802881028503
None Run 02:
Highest Train: 100.00
Highest Valid: 68.60
  Final Train: 100.00
   Final Test: 68.00
Split: 01, Run: 03
None time:  1.0132761888671666
None Run 03:
Highest Train: 100.00
Highest Valid: 69.80
  Final Train: 100.00
   Final Test: 69.00
run time now: 3.038180112838745
total time:  3.0986626560334116
None All runs:
Highest Train: 100.00 ± 0.00
Highest Valid: 69.80 ± 1.20
  Final Train: 100.00 ± 0.00
   Final Test: 68.90 ± 0.85
[I 2023-06-11 23:57:35,534] Trial 579 finished with value: 69.80000305175781 and parameters: {'Fwd': 0.0005538866177953935, 'K': 8, 'alpha': 0.9, 'dropout': 0.8, 'gnnepoch': 110, 'lambda1': 0.7000000000000001, 'lambda2': 6.068086960948448, 'loop': 0, 'loss': 'CE', 'lr': 0.0007993941131981258, 'softmaxF': False, 'useGCN': True, 'weight_decay': 0.05812570624994175, 'weightedloss': True}. Best is trial 271 with value: 72.06666564941406.
/home/wxy/miniconda3/lib/python3.10/site-packages/optuna/distributions.py:685: UserWarning: The distribution is specified by [0, 1.00001] and step=0.05, but the range is not divisible by `step`. It will be replaced by [0, 1.0].
  warnings.warn(
K:  8
alpha:  0.55
lr:  0.005617949551053007
weight_decay:  0.0001920751919145516
dropout:  0.9
fix split and run 3 times
Data: Data(x=[3327, 3703], y=[3327], train_mask=[3327], val_mask=[3327], test_mask=[3327], adj_t=[3327, 3327, nnz=9104])
num_train tensor(120)
num_noise 0
noise: tensor(0)
data feature 3703
ALTOPT(
  (lins): Sequential(
    (0): Linear(in_features=3703, out_features=64, bias=True)
    (1): BatchNorm1d(64, eps=1e-05, momentum=0.1, affine=True, track_running_stats=True)
    (2): Dropout(p=0.9, inplace=True)
    (3): ReLU(inplace=True)
    (4): Linear(in_features=64, out_features=6, bias=True)
    (5): LogSoftmax(dim=-1)
  )
  (prop): Propagation(K=8, mode=None, lambda1=None, lambda2=None, L21=True, alpha=0.55)
  (gcn): GCN(
    (convs): ModuleList(
      (0): GCNConv(3703, 64)
      (1): GCNConv(64, 6)
    )
    (bns): ModuleList(
      (0): BatchNorm1d(64, eps=1e-05, momentum=0.1, affine=True, track_running_stats=True)
    )
    (output): LogSoftmax(dim=-1)
  )
)
propagate done
init label
Split: 01, Run: 01
None time:  1.2394490239676088
None Run 01:
Highest Train: 100.00
Highest Valid: 70.80
  Final Train: 100.00
   Final Test: 69.60
Split: 01, Run: 02
None time:  1.2026159879751503
None Run 02:
Highest Train: 100.00
Highest Valid: 70.80
  Final Train: 100.00
   Final Test: 70.60
Split: 01, Run: 03
None time:  1.1886670731473714
None Run 03:
Highest Train: 100.00
Highest Valid: 70.80
  Final Train: 100.00
   Final Test: 69.40
run time now: 3.675309658050537
total time:  3.734524662140757
None All runs:
Highest Train: 100.00 ± 0.00
Highest Valid: 70.80 ± 0.00
  Final Train: 100.00 ± 0.00
   Final Test: 69.87 ± 0.64
[I 2023-06-11 23:57:39,797] Trial 580 finished with value: 70.80000305175781 and parameters: {'Fwd': 8.304652575338868e-05, 'K': 8, 'alpha': 0.55, 'dropout': 0.9, 'gnnepoch': 120, 'lambda1': 0.8, 'lambda2': 9.054521466380695, 'loop': 0, 'loss': 'CE', 'lr': 0.005617949551053007, 'softmaxF': False, 'useGCN': True, 'weight_decay': 0.0001920751919145516, 'weightedloss': True}. Best is trial 271 with value: 72.06666564941406.
/home/wxy/miniconda3/lib/python3.10/site-packages/optuna/distributions.py:685: UserWarning: The distribution is specified by [0, 1.00001] and step=0.05, but the range is not divisible by `step`. It will be replaced by [0, 1.0].
  warnings.warn(
K:  9
alpha:  0.6000000000000001
lr:  0.0012110052000188277
weight_decay:  3.084513131424925e-05
dropout:  0.8
fix split and run 3 times
Data: Data(x=[3327, 3703], y=[3327], train_mask=[3327], val_mask=[3327], test_mask=[3327], adj_t=[3327, 3327, nnz=9104])
num_train tensor(120)
num_noise 0
noise: tensor(0)
data feature 3703
ALTOPT(
  (lins): Sequential(
    (0): Linear(in_features=3703, out_features=64, bias=True)
    (1): BatchNorm1d(64, eps=1e-05, momentum=0.1, affine=True, track_running_stats=True)
    (2): Dropout(p=0.8, inplace=True)
    (3): ReLU(inplace=True)
    (4): Linear(in_features=64, out_features=6, bias=True)
    (5): LogSoftmax(dim=-1)
  )
  (prop): Propagation(K=9, mode=None, lambda1=None, lambda2=None, L21=True, alpha=0.6000000000000001)
  (gcn): GCN(
    (convs): ModuleList(
      (0): GCNConv(3703, 64)
      (1): GCNConv(64, 6)
    )
    (bns): ModuleList(
      (0): BatchNorm1d(64, eps=1e-05, momentum=0.1, affine=True, track_running_stats=True)
    )
    (output): LogSoftmax(dim=-1)
  )
)
propagate done
init label
Split: 01, Run: 01
None time:  1.0492325711529702
None Run 01:
Highest Train: 100.00
Highest Valid: 71.20
  Final Train: 100.00
   Final Test: 69.80
Split: 01, Run: 02
None time:  0.9985388738568872
None Run 02:
Highest Train: 100.00
Highest Valid: 71.80
  Final Train: 100.00
   Final Test: 69.90
Split: 01, Run: 03
None time:  1.1669531029183418
None Run 03:
Highest Train: 100.00
Highest Valid: 71.80
  Final Train: 100.00
   Final Test: 70.60
run time now: 3.257312774658203
total time:  3.310416460968554
None All runs:
Highest Train: 100.00 ± 0.00
Highest Valid: 71.60 ± 0.35
  Final Train: 100.00 ± 0.00
   Final Test: 70.10 ± 0.44
[I 2023-06-11 23:57:43,645] Trial 581 finished with value: 71.5999984741211 and parameters: {'Fwd': 0.0003027453212780905, 'K': 9, 'alpha': 0.6000000000000001, 'dropout': 0.8, 'gnnepoch': 120, 'lambda1': 0.65, 'lambda2': 5.735764355195035, 'loop': 0, 'loss': 'CE', 'lr': 0.0012110052000188277, 'softmaxF': False, 'useGCN': True, 'weight_decay': 3.084513131424925e-05, 'weightedloss': True}. Best is trial 271 with value: 72.06666564941406.
/home/wxy/miniconda3/lib/python3.10/site-packages/optuna/distributions.py:685: UserWarning: The distribution is specified by [0, 1.00001] and step=0.05, but the range is not divisible by `step`. It will be replaced by [0, 1.0].
  warnings.warn(
K:  8
alpha:  0.9500000000000001
lr:  0.00035093441950146597
weight_decay:  4.038253260534236e-05
dropout:  0.8
fix split and run 3 times
Data: Data(x=[3327, 3703], y=[3327], train_mask=[3327], val_mask=[3327], test_mask=[3327], adj_t=[3327, 3327, nnz=9104])
num_train tensor(120)
num_noise 0
noise: tensor(0)
data feature 3703
ALTOPT(
  (lins): Sequential(
    (0): Linear(in_features=3703, out_features=64, bias=True)
    (1): BatchNorm1d(64, eps=1e-05, momentum=0.1, affine=True, track_running_stats=True)
    (2): Dropout(p=0.8, inplace=True)
    (3): ReLU(inplace=True)
    (4): Linear(in_features=64, out_features=6, bias=True)
    (5): LogSoftmax(dim=-1)
  )
  (prop): Propagation(K=8, mode=None, lambda1=None, lambda2=None, L21=True, alpha=0.9500000000000001)
  (gcn): GCN(
    (convs): ModuleList(
      (0): GCNConv(3703, 64)
      (1): GCNConv(64, 6)
    )
    (bns): ModuleList(
      (0): BatchNorm1d(64, eps=1e-05, momentum=0.1, affine=True, track_running_stats=True)
    )
    (output): LogSoftmax(dim=-1)
  )
)
propagate done
init label
Split: 01, Run: 01
None time:  1.075211383169517
None Run 01:
Highest Train: 100.00
Highest Valid: 70.00
  Final Train: 100.00
   Final Test: 69.50
Split: 01, Run: 02
None time:  1.1219673419836909
None Run 02:
Highest Train: 100.00
Highest Valid: 70.20
  Final Train: 100.00
   Final Test: 69.40
Split: 01, Run: 03
None time:  1.3511209939606488
None Run 03:
Highest Train: 100.00
Highest Valid: 69.20
  Final Train: 100.00
   Final Test: 69.60
run time now: 3.5883984565734863
total time:  3.656361266039312
None All runs:
Highest Train: 100.00 ± 0.00
Highest Valid: 69.80 ± 0.53
  Final Train: 100.00 ± 0.00
   Final Test: 69.50 ± 0.10
[I 2023-06-11 23:57:47,837] Trial 582 finished with value: 69.80000305175781 and parameters: {'Fwd': 0.00011408234328714141, 'K': 8, 'alpha': 0.9500000000000001, 'dropout': 0.8, 'gnnepoch': 120, 'lambda1': 0.75, 'lambda2': 6.686463772144301, 'loop': 0, 'loss': 'CE', 'lr': 0.00035093441950146597, 'softmaxF': True, 'useGCN': True, 'weight_decay': 4.038253260534236e-05, 'weightedloss': True}. Best is trial 271 with value: 72.06666564941406.
/home/wxy/miniconda3/lib/python3.10/site-packages/optuna/distributions.py:685: UserWarning: The distribution is specified by [0, 1.00001] and step=0.05, but the range is not divisible by `step`. It will be replaced by [0, 1.0].
  warnings.warn(
K:  8
alpha:  0.8500000000000001
lr:  0.0019547106447436358
weight_decay:  8.925249372136562e-05
dropout:  0.8
fix split and run 3 times
Data: Data(x=[3327, 3703], y=[3327], train_mask=[3327], val_mask=[3327], test_mask=[3327], adj_t=[3327, 3327, nnz=9104])
num_train tensor(120)
num_noise 0
noise: tensor(0)
data feature 3703
ALTOPT(
  (lins): Sequential(
    (0): Linear(in_features=3703, out_features=64, bias=True)
    (1): BatchNorm1d(64, eps=1e-05, momentum=0.1, affine=True, track_running_stats=True)
    (2): Dropout(p=0.8, inplace=True)
    (3): ReLU(inplace=True)
    (4): Linear(in_features=64, out_features=6, bias=True)
    (5): Identity()
  )
  (prop): Propagation(K=8, mode=None, lambda1=None, lambda2=None, L21=True, alpha=0.8500000000000001)
  (gcn): GCN(
    (convs): ModuleList(
      (0): GCNConv(3703, 64)
      (1): GCNConv(64, 6)
    )
    (bns): ModuleList(
      (0): BatchNorm1d(64, eps=1e-05, momentum=0.1, affine=True, track_running_stats=True)
    )
    (output): Identity()
  )
)
propagate done
init label
Split: 01, Run: 01, Epoch: 100, Loss: 0.0000, Train: 100.00%, Valid: 68.60% Test: 69.80%
Split: 01, Run: 01
None time:  1.797435011016205
None Run 01:
Highest Train: 100.00
Highest Valid: 68.60
  Final Train: 100.00
   Final Test: 69.80
Split: 01, Run: 02, Epoch: 100, Loss: 0.0000, Train: 100.00%, Valid: 68.40% Test: 69.50%
Split: 01, Run: 02
None time:  1.7894305209629238
None Run 02:
Highest Train: 100.00
Highest Valid: 68.40
  Final Train: 100.00
   Final Test: 69.50
Split: 01, Run: 03, Epoch: 100, Loss: 0.0000, Train: 100.00%, Valid: 68.60% Test: 69.20%
Split: 01, Run: 03
None time:  1.737580293789506
None Run 03:
Highest Train: 100.00
Highest Valid: 68.60
  Final Train: 100.00
   Final Test: 69.20
run time now: 5.373879432678223
total time:  5.424277194077149
None All runs:
Highest Train: 100.00 ± 0.00
Highest Valid: 68.53 ± 0.12
  Final Train: 100.00 ± 0.00
   Final Test: 69.50 ± 0.30
[I 2023-06-11 23:57:53,753] Trial 583 finished with value: 68.53333282470703 and parameters: {'Fwd': 0.0001010401560366745, 'K': 8, 'alpha': 0.8500000000000001, 'dropout': 0.8, 'gnnepoch': 120, 'lambda1': 0.6000000000000001, 'lambda2': 6.395820500659175, 'loop': 0, 'loss': 'MSE', 'lr': 0.0019547106447436358, 'softmaxF': False, 'useGCN': True, 'weight_decay': 8.925249372136562e-05, 'weightedloss': True}. Best is trial 271 with value: 72.06666564941406.
/home/wxy/miniconda3/lib/python3.10/site-packages/optuna/distributions.py:685: UserWarning: The distribution is specified by [0, 1.00001] and step=0.05, but the range is not divisible by `step`. It will be replaced by [0, 1.0].
  warnings.warn(
K:  8
alpha:  0.5
lr:  0.0014572420281712501
weight_decay:  3.082152123652566e-06
dropout:  0.7000000000000001
fix split and run 3 times
Data: Data(x=[3327, 3703], y=[3327], train_mask=[3327], val_mask=[3327], test_mask=[3327], adj_t=[3327, 3327, nnz=9104])
num_train tensor(120)
num_noise 0
noise: tensor(0)
data feature 3703
ALTOPT(
  (lins): Sequential(
    (0): Linear(in_features=3703, out_features=64, bias=True)
    (1): BatchNorm1d(64, eps=1e-05, momentum=0.1, affine=True, track_running_stats=True)
    (2): Dropout(p=0.7000000000000001, inplace=True)
    (3): ReLU(inplace=True)
    (4): Linear(in_features=64, out_features=6, bias=True)
    (5): LogSoftmax(dim=-1)
  )
  (prop): Propagation(K=8, mode=None, lambda1=None, lambda2=None, L21=True, alpha=0.5)
  (gcn): GCN(
    (convs): ModuleList(
      (0): GCNConv(3703, 64)
      (1): GCNConv(64, 6)
    )
    (bns): ModuleList(
      (0): BatchNorm1d(64, eps=1e-05, momentum=0.1, affine=True, track_running_stats=True)
    )
    (output): LogSoftmax(dim=-1)
  )
)
propagate done
init label
Split: 01, Run: 01
None time:  0.9550519268959761
None Run 01:
Highest Train: 100.00
Highest Valid: 71.80
  Final Train: 100.00
   Final Test: 69.80
Split: 01, Run: 02
None time:  1.017743853153661
None Run 02:
Highest Train: 100.00
Highest Valid: 69.00
  Final Train: 100.00
   Final Test: 68.30
Split: 01, Run: 03
None time:  1.0196108159143478
None Run 03:
Highest Train: 100.00
Highest Valid: 71.40
  Final Train: 100.00
   Final Test: 70.80
run time now: 3.039116144180298
total time:  3.0986903740558773
None All runs:
Highest Train: 100.00 ± 0.00
Highest Valid: 70.73 ± 1.51
  Final Train: 100.00 ± 0.00
   Final Test: 69.63 ± 1.26
