[I 2023-06-12 00:33:05,190] Trial 214 finished with value: 81.4000015258789 and parameters: {'Fwd': 0.05220492865291853, 'K': 10, 'alpha': 0.65, 'dropout': 0.4, 'gnnepoch': 60, 'lambda1': 0.8500000000000001, 'lambda2': 5.0118633196760065, 'loop': 1, 'loss': 'CE', 'lr': 0.008266894973031198, 'softmaxF': True, 'useGCN': True, 'weight_decay': 0.00011835140220364892, 'weightedloss': False}. Best is trial 112 with value: 81.66667175292969.
/home/wxy/miniconda3/lib/python3.10/site-packages/optuna/distributions.py:685: UserWarning: The distribution is specified by [0, 1.00001] and step=0.05, but the range is not divisible by `step`. It will be replaced by [0, 1.0].
  warnings.warn(
K:  10
alpha:  0.65
lr:  0.0061983139189149385
weight_decay:  0.00016013216140488631
dropout:  0.4
fix split and run 3 times
Data: Data(x=[2708, 1433], y=[2708], train_mask=[2708], val_mask=[2708], test_mask=[2708], adj_t=[2708, 2708, nnz=10556])
num_train tensor(140)
num_noise 0
noise: tensor(0)
data feature 1433
ALTOPT(
  (lins): Sequential(
    (0): Linear(in_features=1433, out_features=64, bias=True)
    (1): BatchNorm1d(64, eps=1e-05, momentum=0.1, affine=True, track_running_stats=True)
    (2): Dropout(p=0.4, inplace=True)
    (3): ReLU(inplace=True)
    (4): Linear(in_features=64, out_features=7, bias=True)
    (5): LogSoftmax(dim=-1)
  )
  (prop): Propagation(K=10, mode=None, lambda1=None, lambda2=None, L21=True, alpha=0.65)
  (gcn): GCN(
    (convs): ModuleList(
      (0): GCNConv(1433, 64)
      (1): GCNConv(64, 7)
    )
    (bns): ModuleList(
      (0): BatchNorm1d(64, eps=1e-05, momentum=0.1, affine=True, track_running_stats=True)
    )
    (output): LogSoftmax(dim=-1)
  )
)
propagate done
init label
Split: 01, Run: 01
None time:  1.2590196901001036
None Run 01:
Highest Train: 100.00
Highest Valid: 81.40
  Final Train: 100.00
   Final Test: 81.70
Split: 01, Run: 02
None time:  1.408632674952969
None Run 02:
Highest Train: 100.00
Highest Valid: 81.20
  Final Train: 100.00
   Final Test: 81.20
Split: 01, Run: 03
None time:  1.6799549080897123
None Run 03:
Highest Train: 100.00
Highest Valid: 80.80
  Final Train: 100.00
   Final Test: 81.50
run time now: 4.3771913051605225
total time:  4.393421196844429
None All runs:
Highest Train: 100.00 ± 0.00
Highest Valid: 81.13 ± 0.31
  Final Train: 100.00 ± 0.00
   Final Test: 81.47 ± 0.25
[I 2023-06-12 00:33:10,028] Trial 215 finished with value: 81.13333892822266 and parameters: {'Fwd': 0.03251752995663927, 'K': 10, 'alpha': 0.65, 'dropout': 0.4, 'gnnepoch': 60, 'lambda1': 0.8500000000000001, 'lambda2': 5.460454732065465, 'loop': 1, 'loss': 'CE', 'lr': 0.0061983139189149385, 'softmaxF': True, 'useGCN': True, 'weight_decay': 0.00016013216140488631, 'weightedloss': False}. Best is trial 112 with value: 81.66667175292969.
/home/wxy/miniconda3/lib/python3.10/site-packages/optuna/distributions.py:685: UserWarning: The distribution is specified by [0, 1.00001] and step=0.05, but the range is not divisible by `step`. It will be replaced by [0, 1.0].
  warnings.warn(
K:  10
alpha:  0.55
lr:  0.009214825141110921
weight_decay:  0.00010183606723895325
dropout:  0.4
fix split and run 3 times
Data: Data(x=[2708, 1433], y=[2708], train_mask=[2708], val_mask=[2708], test_mask=[2708], adj_t=[2708, 2708, nnz=10556])
num_train tensor(140)
num_noise 0
noise: tensor(0)
data feature 1433
ALTOPT(
  (lins): Sequential(
    (0): Linear(in_features=1433, out_features=64, bias=True)
    (1): BatchNorm1d(64, eps=1e-05, momentum=0.1, affine=True, track_running_stats=True)
    (2): Dropout(p=0.4, inplace=True)
    (3): ReLU(inplace=True)
    (4): Linear(in_features=64, out_features=7, bias=True)
    (5): LogSoftmax(dim=-1)
  )
  (prop): Propagation(K=10, mode=None, lambda1=None, lambda2=None, L21=True, alpha=0.55)
  (gcn): GCN(
    (convs): ModuleList(
      (0): GCNConv(1433, 64)
      (1): GCNConv(64, 7)
    )
    (bns): ModuleList(
      (0): BatchNorm1d(64, eps=1e-05, momentum=0.1, affine=True, track_running_stats=True)
    )
    (output): LogSoftmax(dim=-1)
  )
)
propagate done
init label
Split: 01, Run: 01
None time:  1.6628929530270398
None Run 01:
Highest Train: 100.00
Highest Valid: 81.60
  Final Train: 100.00
   Final Test: 82.30
Split: 01, Run: 02
None time:  1.6357023119926453
None Run 02:
Highest Train: 100.00
Highest Valid: 81.40
  Final Train: 100.00
   Final Test: 80.30
Split: 01, Run: 03
None time:  1.1582153351046145
None Run 03:
Highest Train: 100.00
Highest Valid: 81.00
  Final Train: 100.00
   Final Test: 81.20
run time now: 4.485558271408081
total time:  4.5015209200792015
None All runs:
Highest Train: 100.00 ± 0.00
Highest Valid: 81.33 ± 0.31
  Final Train: 100.00 ± 0.00
   Final Test: 81.27 ± 1.00
[I 2023-06-12 00:33:14,954] Trial 216 finished with value: 81.33333587646484 and parameters: {'Fwd': 0.08263040619601489, 'K': 10, 'alpha': 0.55, 'dropout': 0.4, 'gnnepoch': 60, 'lambda1': 0.8, 'lambda2': 5.239157510566949, 'loop': 1, 'loss': 'CE', 'lr': 0.009214825141110921, 'softmaxF': True, 'useGCN': True, 'weight_decay': 0.00010183606723895325, 'weightedloss': False}. Best is trial 112 with value: 81.66667175292969.
/home/wxy/miniconda3/lib/python3.10/site-packages/optuna/distributions.py:685: UserWarning: The distribution is specified by [0, 1.00001] and step=0.05, but the range is not divisible by `step`. It will be replaced by [0, 1.0].
  warnings.warn(
K:  10
alpha:  0.6000000000000001
lr:  0.007297270635712468
weight_decay:  4.9322399651907684e-05
dropout:  0.5
fix split and run 3 times
Data: Data(x=[2708, 1433], y=[2708], train_mask=[2708], val_mask=[2708], test_mask=[2708], adj_t=[2708, 2708, nnz=10556])
num_train tensor(140)
num_noise 0
noise: tensor(0)
data feature 1433
ALTOPT(
  (lins): Sequential(
    (0): Linear(in_features=1433, out_features=64, bias=True)
    (1): BatchNorm1d(64, eps=1e-05, momentum=0.1, affine=True, track_running_stats=True)
    (2): Dropout(p=0.5, inplace=True)
    (3): ReLU(inplace=True)
    (4): Linear(in_features=64, out_features=7, bias=True)
    (5): LogSoftmax(dim=-1)
  )
  (prop): Propagation(K=10, mode=None, lambda1=None, lambda2=None, L21=True, alpha=0.6000000000000001)
  (gcn): GCN(
    (convs): ModuleList(
      (0): GCNConv(1433, 64)
      (1): GCNConv(64, 7)
    )
    (bns): ModuleList(
      (0): BatchNorm1d(64, eps=1e-05, momentum=0.1, affine=True, track_running_stats=True)
    )
    (output): LogSoftmax(dim=-1)
  )
)
propagate done
init label
Split: 01, Run: 01
None time:  1.4248116870876402
None Run 01:
Highest Train: 100.00
Highest Valid: 82.40
  Final Train: 100.00
   Final Test: 81.80
Split: 01, Run: 02
None time:  1.718108895001933
None Run 02:
Highest Train: 100.00
Highest Valid: 81.40
  Final Train: 100.00
   Final Test: 81.40
Split: 01, Run: 03
None time:  1.7248562809545547
None Run 03:
Highest Train: 100.00
Highest Valid: 81.00
  Final Train: 100.00
   Final Test: 81.00
run time now: 4.8967132568359375
total time:  4.913224181858823
None All runs:
Highest Train: 100.00 ± 0.00
Highest Valid: 81.60 ± 0.72
  Final Train: 100.00 ± 0.00
   Final Test: 81.40 ± 0.40
[I 2023-06-12 00:33:20,414] Trial 217 finished with value: 81.5999984741211 and parameters: {'Fwd': 0.09988380767314736, 'K': 10, 'alpha': 0.6000000000000001, 'dropout': 0.5, 'gnnepoch': 60, 'lambda1': 0.9, 'lambda2': 5.801908562103427, 'loop': 1, 'loss': 'CE', 'lr': 0.007297270635712468, 'softmaxF': True, 'useGCN': True, 'weight_decay': 4.9322399651907684e-05, 'weightedloss': False}. Best is trial 112 with value: 81.66667175292969.
/home/wxy/miniconda3/lib/python3.10/site-packages/optuna/distributions.py:685: UserWarning: The distribution is specified by [0, 1.00001] and step=0.05, but the range is not divisible by `step`. It will be replaced by [0, 1.0].
  warnings.warn(
K:  10
alpha:  0.6000000000000001
lr:  0.007696862687714449
weight_decay:  5.2531199650878914e-05
dropout:  0.5
fix split and run 3 times
Data: Data(x=[2708, 1433], y=[2708], train_mask=[2708], val_mask=[2708], test_mask=[2708], adj_t=[2708, 2708, nnz=10556])
num_train tensor(140)
num_noise 0
noise: tensor(0)
data feature 1433
ALTOPT(
  (lins): Sequential(
    (0): Linear(in_features=1433, out_features=64, bias=True)
    (1): BatchNorm1d(64, eps=1e-05, momentum=0.1, affine=True, track_running_stats=True)
    (2): Dropout(p=0.5, inplace=True)
    (3): ReLU(inplace=True)
    (4): Linear(in_features=64, out_features=7, bias=True)
    (5): LogSoftmax(dim=-1)
  )
  (prop): Propagation(K=10, mode=None, lambda1=None, lambda2=None, L21=True, alpha=0.6000000000000001)
  (gcn): GCN(
    (convs): ModuleList(
      (0): GCNConv(1433, 64)
      (1): GCNConv(64, 7)
    )
    (bns): ModuleList(
      (0): BatchNorm1d(64, eps=1e-05, momentum=0.1, affine=True, track_running_stats=True)
    )
    (output): LogSoftmax(dim=-1)
  )
)
propagate done
init label
Split: 01, Run: 01
None time:  1.060840736841783
None Run 01:
Highest Train: 100.00
Highest Valid: 82.40
  Final Train: 100.00
   Final Test: 82.30
Split: 01, Run: 02
None time:  1.6116155539639294
None Run 02:
Highest Train: 100.00
Highest Valid: 81.40
  Final Train: 100.00
   Final Test: 81.50
Split: 01, Run: 03
None time:  1.6865135240368545
None Run 03:
Highest Train: 100.00
Highest Valid: 80.80
  Final Train: 100.00
   Final Test: 81.70
run time now: 4.385437250137329
total time:  4.404933262849227
None All runs:
Highest Train: 100.00 ± 0.00
Highest Valid: 81.53 ± 0.81
  Final Train: 100.00 ± 0.00
   Final Test: 81.83 ± 0.42
[I 2023-06-12 00:33:25,306] Trial 218 finished with value: 81.53333282470703 and parameters: {'Fwd': 0.09994930605366166, 'K': 10, 'alpha': 0.6000000000000001, 'dropout': 0.5, 'gnnepoch': 60, 'lambda1': 0.9500000000000001, 'lambda2': 6.057677626943616, 'loop': 1, 'loss': 'CE', 'lr': 0.007696862687714449, 'softmaxF': True, 'useGCN': True, 'weight_decay': 5.2531199650878914e-05, 'weightedloss': False}. Best is trial 112 with value: 81.66667175292969.
/home/wxy/miniconda3/lib/python3.10/site-packages/optuna/distributions.py:685: UserWarning: The distribution is specified by [0, 1.00001] and step=0.05, but the range is not divisible by `step`. It will be replaced by [0, 1.0].
  warnings.warn(
K:  10
alpha:  0.5
lr:  0.008322131849573713
weight_decay:  4.026492784804867e-05
dropout:  0.5
fix split and run 3 times
Data: Data(x=[2708, 1433], y=[2708], train_mask=[2708], val_mask=[2708], test_mask=[2708], adj_t=[2708, 2708, nnz=10556])
num_train tensor(140)
num_noise 0
noise: tensor(0)
data feature 1433
ALTOPT(
  (lins): Sequential(
    (0): Linear(in_features=1433, out_features=64, bias=True)
    (1): BatchNorm1d(64, eps=1e-05, momentum=0.1, affine=True, track_running_stats=True)
    (2): Dropout(p=0.5, inplace=True)
    (3): ReLU(inplace=True)
    (4): Linear(in_features=64, out_features=7, bias=True)
    (5): LogSoftmax(dim=-1)
  )
  (prop): Propagation(K=10, mode=None, lambda1=None, lambda2=None, L21=True, alpha=0.5)
  (gcn): GCN(
    (convs): ModuleList(
      (0): GCNConv(1433, 64)
      (1): GCNConv(64, 7)
    )
    (bns): ModuleList(
      (0): BatchNorm1d(64, eps=1e-05, momentum=0.1, affine=True, track_running_stats=True)
    )
    (output): LogSoftmax(dim=-1)
  )
)
propagate done
init label
Split: 01, Run: 01
None time:  1.675517522962764
None Run 01:
Highest Train: 100.00
Highest Valid: 81.60
  Final Train: 100.00
   Final Test: 82.10
Split: 01, Run: 02
None time:  1.7023284430615604
None Run 02:
Highest Train: 100.00
Highest Valid: 81.40
  Final Train: 100.00
   Final Test: 81.00
Split: 01, Run: 03
None time:  1.7248141020536423
None Run 03:
Highest Train: 100.00
Highest Valid: 80.80
  Final Train: 100.00
   Final Test: 81.00
run time now: 5.131691217422485
total time:  5.150315623963252
None All runs:
Highest Train: 100.00 ± 0.00
Highest Valid: 81.27 ± 0.42
  Final Train: 100.00 ± 0.00
   Final Test: 81.37 ± 0.64
[I 2023-06-12 00:33:30,977] Trial 219 finished with value: 81.26667022705078 and parameters: {'Fwd': 0.00017031821458058762, 'K': 10, 'alpha': 0.5, 'dropout': 0.5, 'gnnepoch': 60, 'lambda1': 0.9, 'lambda2': 5.819456638005959, 'loop': 1, 'loss': 'CE', 'lr': 0.008322131849573713, 'softmaxF': True, 'useGCN': True, 'weight_decay': 4.026492784804867e-05, 'weightedloss': False}. Best is trial 112 with value: 81.66667175292969.
/home/wxy/miniconda3/lib/python3.10/site-packages/optuna/distributions.py:685: UserWarning: The distribution is specified by [0, 1.00001] and step=0.05, but the range is not divisible by `step`. It will be replaced by [0, 1.0].
  warnings.warn(
K:  10
alpha:  0.6000000000000001
lr:  0.001522993938651927
weight_decay:  6.592998496251255e-05
dropout:  0.5
fix split and run 3 times
Data: Data(x=[2708, 1433], y=[2708], train_mask=[2708], val_mask=[2708], test_mask=[2708], adj_t=[2708, 2708, nnz=10556])
num_train tensor(140)
num_noise 0
noise: tensor(0)
data feature 1433
ALTOPT(
  (lins): Sequential(
    (0): Linear(in_features=1433, out_features=64, bias=True)
    (1): BatchNorm1d(64, eps=1e-05, momentum=0.1, affine=True, track_running_stats=True)
    (2): Dropout(p=0.5, inplace=True)
    (3): ReLU(inplace=True)
    (4): Linear(in_features=64, out_features=7, bias=True)
    (5): LogSoftmax(dim=-1)
  )
  (prop): Propagation(K=10, mode=None, lambda1=None, lambda2=None, L21=True, alpha=0.6000000000000001)
  (gcn): GCN(
    (convs): ModuleList(
      (0): GCNConv(1433, 64)
      (1): GCNConv(64, 7)
    )
    (bns): ModuleList(
      (0): BatchNorm1d(64, eps=1e-05, momentum=0.1, affine=True, track_running_stats=True)
    )
    (output): LogSoftmax(dim=-1)
  )
)
propagate done
init label
Split: 01, Run: 01
None time:  1.3994489181786776
None Run 01:
Highest Train: 100.00
Highest Valid: 79.80
  Final Train: 100.00
   Final Test: 80.10
Split: 01, Run: 02
None time:  1.4721290240995586
None Run 02:
Highest Train: 100.00
Highest Valid: 79.60
  Final Train: 100.00
   Final Test: 80.20
Split: 01, Run: 03
None time:  1.179338354850188
None Run 03:
Highest Train: 100.00
Highest Valid: 80.00
  Final Train: 100.00
   Final Test: 80.50
run time now: 4.076959609985352
total time:  4.098677140893415
None All runs:
Highest Train: 100.00 ± 0.00
Highest Valid: 79.80 ± 0.20
  Final Train: 100.00 ± 0.00
   Final Test: 80.27 ± 0.21
[I 2023-06-12 00:33:35,588] Trial 220 finished with value: 79.79999542236328 and parameters: {'Fwd': 0.08060591087925022, 'K': 10, 'alpha': 0.6000000000000001, 'dropout': 0.5, 'gnnepoch': 50, 'lambda1': 0.9500000000000001, 'lambda2': 5.665726865379116, 'loop': 1, 'loss': 'CE', 'lr': 0.001522993938651927, 'softmaxF': True, 'useGCN': True, 'weight_decay': 6.592998496251255e-05, 'weightedloss': False}. Best is trial 112 with value: 81.66667175292969.
/home/wxy/miniconda3/lib/python3.10/site-packages/optuna/distributions.py:685: UserWarning: The distribution is specified by [0, 1.00001] and step=0.05, but the range is not divisible by `step`. It will be replaced by [0, 1.0].
  warnings.warn(
K:  10
alpha:  0.65
lr:  0.007055500036771771
weight_decay:  8.100508461739789e-05
dropout:  0.4
fix split and run 3 times
Data: Data(x=[2708, 1433], y=[2708], train_mask=[2708], val_mask=[2708], test_mask=[2708], adj_t=[2708, 2708, nnz=10556])
num_train tensor(140)
num_noise 0
noise: tensor(0)
data feature 1433
ALTOPT(
  (lins): Sequential(
    (0): Linear(in_features=1433, out_features=64, bias=True)
    (1): BatchNorm1d(64, eps=1e-05, momentum=0.1, affine=True, track_running_stats=True)
    (2): Dropout(p=0.4, inplace=True)
    (3): ReLU(inplace=True)
    (4): Linear(in_features=64, out_features=7, bias=True)
    (5): LogSoftmax(dim=-1)
  )
  (prop): Propagation(K=10, mode=None, lambda1=None, lambda2=None, L21=True, alpha=0.65)
  (gcn): GCN(
    (convs): ModuleList(
      (0): GCNConv(1433, 64)
      (1): GCNConv(64, 7)
    )
    (bns): ModuleList(
      (0): BatchNorm1d(64, eps=1e-05, momentum=0.1, affine=True, track_running_stats=True)
    )
    (output): LogSoftmax(dim=-1)
  )
)
propagate done
init label
Split: 01, Run: 01
None time:  1.6511023079510778
None Run 01:
Highest Train: 100.00
Highest Valid: 82.20
  Final Train: 100.00
   Final Test: 82.00
Split: 01, Run: 02
None time:  1.4688859081361443
None Run 02:
Highest Train: 100.00
Highest Valid: 81.80
  Final Train: 100.00
   Final Test: 81.80
Split: 01, Run: 03
None time:  1.70452408795245
None Run 03:
Highest Train: 100.00
Highest Valid: 81.00
  Final Train: 100.00
   Final Test: 80.30
run time now: 4.856487035751343
total time:  4.877126517007127
None All runs:
Highest Train: 100.00 ± 0.00
Highest Valid: 81.67 ± 0.61
  Final Train: 100.00 ± 0.00
   Final Test: 81.37 ± 0.93
[I 2023-06-12 00:33:41,039] Trial 221 finished with value: 81.66666412353516 and parameters: {'Fwd': 0.06603192599752335, 'K': 10, 'alpha': 0.65, 'dropout': 0.4, 'gnnepoch': 60, 'lambda1': 0.9, 'lambda2': 5.482595516141926, 'loop': 1, 'loss': 'CE', 'lr': 0.007055500036771771, 'softmaxF': True, 'useGCN': True, 'weight_decay': 8.100508461739789e-05, 'weightedloss': False}. Best is trial 112 with value: 81.66667175292969.
/home/wxy/miniconda3/lib/python3.10/site-packages/optuna/distributions.py:685: UserWarning: The distribution is specified by [0, 1.00001] and step=0.05, but the range is not divisible by `step`. It will be replaced by [0, 1.0].
  warnings.warn(
K:  10
alpha:  0.6000000000000001
lr:  0.006637785121736966
weight_decay:  8.506209411998117e-05
dropout:  0.4
fix split and run 3 times
Data: Data(x=[2708, 1433], y=[2708], train_mask=[2708], val_mask=[2708], test_mask=[2708], adj_t=[2708, 2708, nnz=10556])
num_train tensor(140)
num_noise 0
noise: tensor(0)
data feature 1433
ALTOPT(
  (lins): Sequential(
    (0): Linear(in_features=1433, out_features=64, bias=True)
    (1): BatchNorm1d(64, eps=1e-05, momentum=0.1, affine=True, track_running_stats=True)
    (2): Dropout(p=0.4, inplace=True)
    (3): ReLU(inplace=True)
    (4): Linear(in_features=64, out_features=7, bias=True)
    (5): LogSoftmax(dim=-1)
  )
  (prop): Propagation(K=10, mode=None, lambda1=None, lambda2=None, L21=True, alpha=0.6000000000000001)
  (gcn): GCN(
    (convs): ModuleList(
      (0): GCNConv(1433, 64)
      (1): GCNConv(64, 7)
    )
    (bns): ModuleList(
      (0): BatchNorm1d(64, eps=1e-05, momentum=0.1, affine=True, track_running_stats=True)
    )
    (output): LogSoftmax(dim=-1)
  )
)
propagate done
init label
Split: 01, Run: 01
None time:  1.3871899889782071
None Run 01:
Highest Train: 100.00
Highest Valid: 82.20
  Final Train: 100.00
   Final Test: 81.80
Split: 01, Run: 02
None time:  1.6776063970755786
None Run 02:
Highest Train: 100.00
Highest Valid: 81.60
  Final Train: 100.00
   Final Test: 81.40
Split: 01, Run: 03
None time:  1.4876904638949782
None Run 03:
Highest Train: 100.00
Highest Valid: 80.80
  Final Train: 100.00
   Final Test: 81.10
run time now: 4.581216335296631
total time:  4.597736805910245
None All runs:
Highest Train: 100.00 ± 0.00
Highest Valid: 81.53 ± 0.70
  Final Train: 100.00 ± 0.00
   Final Test: 81.43 ± 0.35
[I 2023-06-12 00:33:46,097] Trial 222 finished with value: 81.53333282470703 and parameters: {'Fwd': 0.06241176225490523, 'K': 10, 'alpha': 0.6000000000000001, 'dropout': 0.4, 'gnnepoch': 60, 'lambda1': 0.9, 'lambda2': 5.46581918360116, 'loop': 1, 'loss': 'CE', 'lr': 0.006637785121736966, 'softmaxF': True, 'useGCN': True, 'weight_decay': 8.506209411998117e-05, 'weightedloss': False}. Best is trial 112 with value: 81.66667175292969.
/home/wxy/miniconda3/lib/python3.10/site-packages/optuna/distributions.py:685: UserWarning: The distribution is specified by [0, 1.00001] and step=0.05, but the range is not divisible by `step`. It will be replaced by [0, 1.0].
  warnings.warn(
K:  10
alpha:  0.65
lr:  0.007345579503402726
weight_decay:  5.063939514084764e-05
dropout:  0.4
fix split and run 3 times
Data: Data(x=[2708, 1433], y=[2708], train_mask=[2708], val_mask=[2708], test_mask=[2708], adj_t=[2708, 2708, nnz=10556])
num_train tensor(140)
num_noise 0
noise: tensor(0)
data feature 1433
ALTOPT(
  (lins): Sequential(
    (0): Linear(in_features=1433, out_features=64, bias=True)
    (1): BatchNorm1d(64, eps=1e-05, momentum=0.1, affine=True, track_running_stats=True)
    (2): Dropout(p=0.4, inplace=True)
    (3): ReLU(inplace=True)
    (4): Linear(in_features=64, out_features=7, bias=True)
    (5): LogSoftmax(dim=-1)
  )
  (prop): Propagation(K=10, mode=None, lambda1=None, lambda2=None, L21=True, alpha=0.65)
  (gcn): GCN(
    (convs): ModuleList(
      (0): GCNConv(1433, 64)
      (1): GCNConv(64, 7)
    )
    (bns): ModuleList(
      (0): BatchNorm1d(64, eps=1e-05, momentum=0.1, affine=True, track_running_stats=True)
    )
    (output): LogSoftmax(dim=-1)
  )
)
propagate done
init label
Split: 01, Run: 01
None time:  1.6451871520839632
None Run 01:
Highest Train: 100.00
Highest Valid: 82.00
  Final Train: 100.00
   Final Test: 82.20
Split: 01, Run: 02
None time:  1.190623752772808
None Run 02:
Highest Train: 100.00
Highest Valid: 81.80
  Final Train: 100.00
   Final Test: 81.60
Split: 01, Run: 03
None time:  1.3900698819197714
None Run 03:
Highest Train: 100.00
Highest Valid: 80.80
  Final Train: 100.00
   Final Test: 80.50
run time now: 4.255345344543457
total time:  4.273787464015186
None All runs:
Highest Train: 100.00 ± 0.00
Highest Valid: 81.53 ± 0.64
  Final Train: 100.00 ± 0.00
   Final Test: 81.43 ± 0.86
