[I 2023-06-12 00:46:22,191] Trial 359 finished with value: 82.26667022705078 and parameters: {'Fwd': 3.914147032756864e-06, 'K': 10, 'alpha': 0.9, 'dropout': 0.9, 'gnnepoch': 70, 'lambda1': 0.9, 'lambda2': 2.8055627687335867, 'loop': 1, 'loss': 'MSE', 'lr': 0.0018115457055371976, 'softmaxF': True, 'useGCN': False, 'weight_decay': 0.008598861776813382, 'weightedloss': False}. Best is trial 205 with value: 83.53333282470703.
/home/wxy/miniconda3/lib/python3.10/site-packages/optuna/distributions.py:685: UserWarning: The distribution is specified by [0, 1.00001] and step=0.05, but the range is not divisible by `step`. It will be replaced by [0, 1.0].
  warnings.warn(
K:  10
alpha:  0.9500000000000001
lr:  0.002181781507144208
weight_decay:  0.0047377991147404845
dropout:  0.9
fix split and run 3 times
Data: Data(x=[19717, 500], y=[19717], train_mask=[19717], val_mask=[19717], test_mask=[19717], adj_t=[19717, 19717, nnz=88648])
num_train tensor(60)
num_noise 0
noise: tensor(0)
data feature 500
ALTOPT(
  (lins): Sequential(
    (0): Linear(in_features=500, out_features=64, bias=True)
    (1): BatchNorm1d(64, eps=1e-05, momentum=0.1, affine=True, track_running_stats=True)
    (2): Dropout(p=0.9, inplace=True)
    (3): ReLU(inplace=True)
    (4): Linear(in_features=64, out_features=3, bias=True)
    (5): Identity()
  )
  (prop): Propagation(K=10, mode=None, lambda1=None, lambda2=None, L21=True, alpha=0.9500000000000001)
  (gcn): GCN(
    (convs): ModuleList(
      (0): GCNConv(500, 64)
      (1): GCNConv(64, 3)
    )
    (bns): ModuleList(
      (0): BatchNorm1d(64, eps=1e-05, momentum=0.1, affine=True, track_running_stats=True)
    )
    (output): Identity()
  )
)
propagate done
init label
Split: 01, Run: 01
None time:  2.5198001340031624
None Run 01:
Highest Train: 100.00
Highest Valid: 82.80
  Final Train: 100.00
   Final Test: 78.80
Split: 01, Run: 02
None time:  1.4313012319616973
None Run 02:
Highest Train: 100.00
Highest Valid: 83.40
  Final Train: 100.00
   Final Test: 79.50
Split: 01, Run: 03
None time:  1.8863075759727508
None Run 03:
Highest Train: 100.00
Highest Valid: 82.20
  Final Train: 100.00
   Final Test: 78.80
run time now: 5.893099069595337
total time:  5.936124433064833
None All runs:
Highest Train: 100.00 ± 0.00
Highest Valid: 82.80 ± 0.60
  Final Train: 100.00 ± 0.00
   Final Test: 79.03 ± 0.40
[I 2023-06-12 00:46:28,663] Trial 360 finished with value: 82.80001068115234 and parameters: {'Fwd': 2.691919727528991e-06, 'K': 10, 'alpha': 0.9500000000000001, 'dropout': 0.9, 'gnnepoch': 70, 'lambda1': 0.6000000000000001, 'lambda2': 3.32913257336912, 'loop': 1, 'loss': 'MSE', 'lr': 0.002181781507144208, 'softmaxF': True, 'useGCN': False, 'weight_decay': 0.0047377991147404845, 'weightedloss': False}. Best is trial 205 with value: 83.53333282470703.
/home/wxy/miniconda3/lib/python3.10/site-packages/optuna/distributions.py:685: UserWarning: The distribution is specified by [0, 1.00001] and step=0.05, but the range is not divisible by `step`. It will be replaced by [0, 1.0].
  warnings.warn(
K:  10
alpha:  1.0
lr:  0.0015800388267496039
weight_decay:  0.0645165958617697
dropout:  0.9
fix split and run 3 times
Data: Data(x=[19717, 500], y=[19717], train_mask=[19717], val_mask=[19717], test_mask=[19717], adj_t=[19717, 19717, nnz=88648])
num_train tensor(60)
num_noise 0
noise: tensor(0)
data feature 500
ALTOPT(
  (lins): Sequential(
    (0): Linear(in_features=500, out_features=64, bias=True)
    (1): BatchNorm1d(64, eps=1e-05, momentum=0.1, affine=True, track_running_stats=True)
    (2): Dropout(p=0.9, inplace=True)
    (3): ReLU(inplace=True)
    (4): Linear(in_features=64, out_features=3, bias=True)
    (5): Identity()
  )
  (prop): Propagation(K=10, mode=None, lambda1=None, lambda2=None, L21=True, alpha=1.0)
  (gcn): GCN(
    (convs): ModuleList(
      (0): GCNConv(500, 64)
      (1): GCNConv(64, 3)
    )
    (bns): ModuleList(
      (0): BatchNorm1d(64, eps=1e-05, momentum=0.1, affine=True, track_running_stats=True)
    )
    (output): Identity()
  )
)
propagate done
init label
Split: 01, Run: 01
None time:  1.6363664409145713
None Run 01:
Highest Train: 100.00
Highest Valid: 81.00
  Final Train: 100.00
   Final Test: 75.90
Split: 01, Run: 02
None time:  1.7461190389003605
None Run 02:
Highest Train: 100.00
Highest Valid: 83.20
  Final Train: 100.00
   Final Test: 79.40
Split: 01, Run: 03
None time:  1.189909396925941
None Run 03:
Highest Train: 100.00
Highest Valid: 80.40
  Final Train: 100.00
   Final Test: 78.90
run time now: 4.635244369506836
total time:  4.721642761025578
None All runs:
Highest Train: 100.00 ± 0.00
Highest Valid: 81.53 ± 1.47
  Final Train: 100.00 ± 0.00
   Final Test: 78.07 ± 1.89
[I 2023-06-12 00:46:33,975] Trial 361 finished with value: 81.53333282470703 and parameters: {'Fwd': 0.0004197511246648134, 'K': 10, 'alpha': 1.0, 'dropout': 0.9, 'gnnepoch': 80, 'lambda1': 1.0, 'lambda2': 4.032768876452301, 'loop': 1, 'loss': 'MSE', 'lr': 0.0015800388267496039, 'softmaxF': True, 'useGCN': False, 'weight_decay': 0.0645165958617697, 'weightedloss': True}. Best is trial 205 with value: 83.53333282470703.
/home/wxy/miniconda3/lib/python3.10/site-packages/optuna/distributions.py:685: UserWarning: The distribution is specified by [0, 1.00001] and step=0.05, but the range is not divisible by `step`. It will be replaced by [0, 1.0].
  warnings.warn(
K:  10
alpha:  0.9500000000000001
lr:  0.0003358015135635202
weight_decay:  0.00038263067787171044
dropout:  0.9
fix split and run 3 times
Data: Data(x=[19717, 500], y=[19717], train_mask=[19717], val_mask=[19717], test_mask=[19717], adj_t=[19717, 19717, nnz=88648])
num_train tensor(60)
num_noise 0
noise: tensor(0)
data feature 500
ALTOPT(
  (lins): Sequential(
    (0): Linear(in_features=500, out_features=64, bias=True)
    (1): BatchNorm1d(64, eps=1e-05, momentum=0.1, affine=True, track_running_stats=True)
    (2): Dropout(p=0.9, inplace=True)
    (3): ReLU(inplace=True)
    (4): Linear(in_features=64, out_features=3, bias=True)
    (5): Identity()
  )
  (prop): Propagation(K=10, mode=None, lambda1=None, lambda2=None, L21=True, alpha=0.9500000000000001)
  (gcn): GCN(
    (convs): ModuleList(
      (0): GCNConv(500, 64)
      (1): GCNConv(64, 3)
    )
    (bns): ModuleList(
      (0): BatchNorm1d(64, eps=1e-05, momentum=0.1, affine=True, track_running_stats=True)
    )
    (output): Identity()
  )
)
propagate done
init label
Split: 01, Run: 01
None time:  2.969049771083519
None Run 01:
Highest Train: 100.00
Highest Valid: 77.40
  Final Train: 100.00
   Final Test: 73.80
Split: 01, Run: 02
None time:  1.0566653180867434
None Run 02:
Highest Train: 100.00
Highest Valid: 80.00
  Final Train: 100.00
   Final Test: 75.20
Split: 01, Run: 03
None time:  1.2750073671340942
None Run 03:
Highest Train: 100.00
Highest Valid: 79.00
  Final Train: 100.00
   Final Test: 75.30
run time now: 5.351293087005615
total time:  5.4028179629240185
None All runs:
Highest Train: 100.00 ± 0.00
Highest Valid: 78.80 ± 1.31
  Final Train: 100.00 ± 0.00
   Final Test: 74.77 ± 0.84
[I 2023-06-12 00:46:39,869] Trial 362 finished with value: 78.79999542236328 and parameters: {'Fwd': 7.429267001343781e-05, 'K': 10, 'alpha': 0.9500000000000001, 'dropout': 0.9, 'gnnepoch': 70, 'lambda1': 0.9, 'lambda2': 6.001404406571422, 'loop': 1, 'loss': 'MSE', 'lr': 0.0003358015135635202, 'softmaxF': True, 'useGCN': False, 'weight_decay': 0.00038263067787171044, 'weightedloss': False}. Best is trial 205 with value: 83.53333282470703.
/home/wxy/miniconda3/lib/python3.10/site-packages/optuna/distributions.py:685: UserWarning: The distribution is specified by [0, 1.00001] and step=0.05, but the range is not divisible by `step`. It will be replaced by [0, 1.0].
  warnings.warn(
K:  10
alpha:  0.9
lr:  0.0014172819695374278
weight_decay:  0.07818027144744356
dropout:  0.8
fix split and run 3 times
Data: Data(x=[19717, 500], y=[19717], train_mask=[19717], val_mask=[19717], test_mask=[19717], adj_t=[19717, 19717, nnz=88648])
num_train tensor(60)
num_noise 0
noise: tensor(0)
data feature 500
ALTOPT(
  (lins): Sequential(
    (0): Linear(in_features=500, out_features=64, bias=True)
    (1): BatchNorm1d(64, eps=1e-05, momentum=0.1, affine=True, track_running_stats=True)
    (2): Dropout(p=0.8, inplace=True)
    (3): ReLU(inplace=True)
    (4): Linear(in_features=64, out_features=3, bias=True)
    (5): LogSoftmax(dim=-1)
  )
  (prop): Propagation(K=10, mode=None, lambda1=None, lambda2=None, L21=True, alpha=0.9)
  (gcn): GCN(
    (convs): ModuleList(
      (0): GCNConv(500, 64)
      (1): GCNConv(64, 3)
    )
    (bns): ModuleList(
      (0): BatchNorm1d(64, eps=1e-05, momentum=0.1, affine=True, track_running_stats=True)
    )
    (output): LogSoftmax(dim=-1)
  )
)
propagate done
init label
Split: 01, Run: 01
None time:  1.1504451371729374
None Run 01:
Highest Train: 100.00
Highest Valid: 76.40
  Final Train: 100.00
   Final Test: 72.90
Split: 01, Run: 02
None time:  1.1838489461224526
None Run 02:
Highest Train: 100.00
Highest Valid: 78.60
  Final Train: 98.33
   Final Test: 76.80
Split: 01, Run: 03
None time:  1.1673379028216004
None Run 03:
Highest Train: 100.00
Highest Valid: 78.20
  Final Train: 96.67
   Final Test: 76.60
run time now: 3.5509586334228516
total time:  3.6045911558903754
None All runs:
Highest Train: 100.00 ± 0.00
Highest Valid: 77.73 ± 1.17
  Final Train: 98.33 ± 1.67
   Final Test: 75.43 ± 2.20
[I 2023-06-12 00:46:43,953] Trial 363 finished with value: 77.73332977294922 and parameters: {'Fwd': 4.6417041455569674e-06, 'K': 10, 'alpha': 0.9, 'dropout': 0.8, 'gnnepoch': 70, 'lambda1': 0.9500000000000001, 'lambda2': 4.550488178182168, 'loop': 1, 'loss': 'CE', 'lr': 0.0014172819695374278, 'softmaxF': True, 'useGCN': False, 'weight_decay': 0.07818027144744356, 'weightedloss': False}. Best is trial 205 with value: 83.53333282470703.
/home/wxy/miniconda3/lib/python3.10/site-packages/optuna/distributions.py:685: UserWarning: The distribution is specified by [0, 1.00001] and step=0.05, but the range is not divisible by `step`. It will be replaced by [0, 1.0].
  warnings.warn(
K:  10
alpha:  0.9500000000000001
lr:  0.0026503712914596393
weight_decay:  0.03602667908431621
dropout:  0.9
fix split and run 3 times
Data: Data(x=[19717, 500], y=[19717], train_mask=[19717], val_mask=[19717], test_mask=[19717], adj_t=[19717, 19717, nnz=88648])
num_train tensor(60)
num_noise 0
noise: tensor(0)
data feature 500
ALTOPT(
  (lins): Sequential(
    (0): Linear(in_features=500, out_features=64, bias=True)
    (1): BatchNorm1d(64, eps=1e-05, momentum=0.1, affine=True, track_running_stats=True)
    (2): Dropout(p=0.9, inplace=True)
    (3): ReLU(inplace=True)
    (4): Linear(in_features=64, out_features=3, bias=True)
    (5): Identity()
  )
  (prop): Propagation(K=10, mode=None, lambda1=None, lambda2=None, L21=True, alpha=0.9500000000000001)
  (gcn): GCN(
    (convs): ModuleList(
      (0): GCNConv(500, 64)
      (1): GCNConv(64, 3)
    )
    (bns): ModuleList(
      (0): BatchNorm1d(64, eps=1e-05, momentum=0.1, affine=True, track_running_stats=True)
    )
    (output): Identity()
  )
)
propagate done
init label
Split: 01, Run: 01
None time:  2.2707553431391716
None Run 01:
Highest Train: 100.00
Highest Valid: 83.80
  Final Train: 100.00
   Final Test: 78.90
Split: 01, Run: 02
None time:  1.967681162059307
None Run 02:
Highest Train: 100.00
Highest Valid: 84.00
  Final Train: 100.00
   Final Test: 80.30
Split: 01, Run: 03
None time:  1.0940184271894395
None Run 03:
Highest Train: 100.00
Highest Valid: 83.20
  Final Train: 100.00
   Final Test: 79.90
run time now: 5.385812044143677
total time:  5.436611414887011
None All runs:
Highest Train: 100.00 ± 0.00
Highest Valid: 83.67 ± 0.42
  Final Train: 100.00 ± 0.00
   Final Test: 79.70 ± 0.72
[I 2023-06-12 00:46:49,842] Trial 364 finished with value: 83.66666412353516 and parameters: {'Fwd': 6.390239253670255e-06, 'K': 10, 'alpha': 0.9500000000000001, 'dropout': 0.9, 'gnnepoch': 70, 'lambda1': 0.9, 'lambda2': 3.1707164462942274, 'loop': 1, 'loss': 'MSE', 'lr': 0.0026503712914596393, 'softmaxF': True, 'useGCN': False, 'weight_decay': 0.03602667908431621, 'weightedloss': False}. Best is trial 364 with value: 83.66666412353516.
/home/wxy/miniconda3/lib/python3.10/site-packages/optuna/distributions.py:685: UserWarning: The distribution is specified by [0, 1.00001] and step=0.05, but the range is not divisible by `step`. It will be replaced by [0, 1.0].
  warnings.warn(
K:  9
alpha:  1.0
lr:  0.0026712917936455682
weight_decay:  0.05507646070899631
dropout:  0.9
fix split and run 3 times
Data: Data(x=[19717, 500], y=[19717], train_mask=[19717], val_mask=[19717], test_mask=[19717], adj_t=[19717, 19717, nnz=88648])
num_train tensor(60)
num_noise 0
noise: tensor(0)
data feature 500
ALTOPT(
  (lins): Sequential(
    (0): Linear(in_features=500, out_features=64, bias=True)
    (1): BatchNorm1d(64, eps=1e-05, momentum=0.1, affine=True, track_running_stats=True)
    (2): Dropout(p=0.9, inplace=True)
    (3): ReLU(inplace=True)
    (4): Linear(in_features=64, out_features=3, bias=True)
    (5): Identity()
  )
  (prop): Propagation(K=9, mode=None, lambda1=None, lambda2=None, L21=True, alpha=1.0)
  (gcn): GCN(
    (convs): ModuleList(
      (0): GCNConv(500, 64)
      (1): GCNConv(64, 3)
    )
    (bns): ModuleList(
      (0): BatchNorm1d(64, eps=1e-05, momentum=0.1, affine=True, track_running_stats=True)
    )
    (output): Identity()
  )
)
propagate done
init label
Split: 01, Run: 01
None time:  2.512680310057476
None Run 01:
Highest Train: 100.00
Highest Valid: 83.00
  Final Train: 100.00
   Final Test: 79.70
Split: 01, Run: 02
None time:  1.034553135978058
None Run 02:
Highest Train: 100.00
Highest Valid: 82.00
  Final Train: 100.00
   Final Test: 79.20
Split: 01, Run: 03
None time:  1.1823250628076494
None Run 03:
Highest Train: 100.00
Highest Valid: 78.00
  Final Train: 100.00
   Final Test: 77.40
run time now: 4.777060270309448
total time:  4.821558992145583
None All runs:
Highest Train: 100.00 ± 0.00
Highest Valid: 81.00 ± 2.65
  Final Train: 100.00 ± 0.00
   Final Test: 78.77 ± 1.21
[I 2023-06-12 00:46:55,179] Trial 365 finished with value: 81.0 and parameters: {'Fwd': 1.1051139665568363e-05, 'K': 9, 'alpha': 1.0, 'dropout': 0.9, 'gnnepoch': 80, 'lambda1': 0.9, 'lambda2': 3.1095357988452, 'loop': 1, 'loss': 'MSE', 'lr': 0.0026712917936455682, 'softmaxF': True, 'useGCN': False, 'weight_decay': 0.05507646070899631, 'weightedloss': False}. Best is trial 364 with value: 83.66666412353516.
/home/wxy/miniconda3/lib/python3.10/site-packages/optuna/distributions.py:685: UserWarning: The distribution is specified by [0, 1.00001] and step=0.05, but the range is not divisible by `step`. It will be replaced by [0, 1.0].
  warnings.warn(
K:  10
alpha:  0.9500000000000001
lr:  0.002599059516991735
weight_decay:  0.09819998982153831
dropout:  0.9
fix split and run 3 times
Data: Data(x=[19717, 500], y=[19717], train_mask=[19717], val_mask=[19717], test_mask=[19717], adj_t=[19717, 19717, nnz=88648])
num_train tensor(60)
num_noise 0
noise: tensor(0)
data feature 500
ALTOPT(
  (lins): Sequential(
    (0): Linear(in_features=500, out_features=64, bias=True)
    (1): BatchNorm1d(64, eps=1e-05, momentum=0.1, affine=True, track_running_stats=True)
    (2): Dropout(p=0.9, inplace=True)
    (3): ReLU(inplace=True)
    (4): Linear(in_features=64, out_features=3, bias=True)
    (5): Identity()
  )
  (prop): Propagation(K=10, mode=None, lambda1=None, lambda2=None, L21=True, alpha=0.9500000000000001)
  (gcn): GCN(
    (convs): ModuleList(
      (0): GCNConv(500, 64)
      (1): GCNConv(64, 3)
    )
    (bns): ModuleList(
      (0): BatchNorm1d(64, eps=1e-05, momentum=0.1, affine=True, track_running_stats=True)
    )
    (output): Identity()
  )
)
propagate done
init label
Split: 01, Run: 01
None time:  2.5487510960083455
None Run 01:
Highest Train: 100.00
Highest Valid: 84.00
  Final Train: 100.00
   Final Test: 79.10
Split: 01, Run: 02
None time:  1.5094975871033967
None Run 02:
Highest Train: 100.00
Highest Valid: 82.40
  Final Train: 100.00
   Final Test: 79.40
Split: 01, Run: 03
None time:  2.262294187908992
None Run 03:
Highest Train: 100.00
Highest Valid: 81.80
  Final Train: 100.00
   Final Test: 78.50
run time now: 6.370144844055176
total time:  6.418109525926411
None All runs:
Highest Train: 100.00 ± 0.00
Highest Valid: 82.73 ± 1.14
  Final Train: 100.00 ± 0.00
   Final Test: 79.00 ± 0.46
[I 2023-06-12 00:47:02,075] Trial 366 finished with value: 82.73332977294922 and parameters: {'Fwd': 5.695306865629837e-06, 'K': 10, 'alpha': 0.9500000000000001, 'dropout': 0.9, 'gnnepoch': 70, 'lambda1': 0.9, 'lambda2': 6.405905858991276, 'loop': 1, 'loss': 'MSE', 'lr': 0.002599059516991735, 'softmaxF': True, 'useGCN': False, 'weight_decay': 0.09819998982153831, 'weightedloss': False}. Best is trial 364 with value: 83.66666412353516.
/home/wxy/miniconda3/lib/python3.10/site-packages/optuna/distributions.py:685: UserWarning: The distribution is specified by [0, 1.00001] and step=0.05, but the range is not divisible by `step`. It will be replaced by [0, 1.0].
  warnings.warn(
K:  10
alpha:  0.9500000000000001
lr:  0.0020982872148874
weight_decay:  0.027750858298725894
dropout:  0.9
fix split and run 3 times
Data: Data(x=[19717, 500], y=[19717], train_mask=[19717], val_mask=[19717], test_mask=[19717], adj_t=[19717, 19717, nnz=88648])
num_train tensor(60)
num_noise 0
noise: tensor(0)
data feature 500
ALTOPT(
  (lins): Sequential(
    (0): Linear(in_features=500, out_features=64, bias=True)
    (1): BatchNorm1d(64, eps=1e-05, momentum=0.1, affine=True, track_running_stats=True)
    (2): Dropout(p=0.9, inplace=True)
    (3): ReLU(inplace=True)
    (4): Linear(in_features=64, out_features=3, bias=True)
    (5): Identity()
  )
  (prop): Propagation(K=10, mode=None, lambda1=None, lambda2=None, L21=True, alpha=0.9500000000000001)
  (gcn): GCN(
    (convs): ModuleList(
      (0): GCNConv(500, 64)
      (1): GCNConv(64, 3)
    )
    (bns): ModuleList(
      (0): BatchNorm1d(64, eps=1e-05, momentum=0.1, affine=True, track_running_stats=True)
    )
    (output): Identity()
  )
)
propagate done
init label
Split: 01, Run: 01
None time:  1.5918673330452293
None Run 01:
Highest Train: 100.00
Highest Valid: 82.00
  Final Train: 100.00
   Final Test: 77.90
Split: 01, Run: 02
None time:  1.8833419419825077
None Run 02:
Highest Train: 100.00
Highest Valid: 82.40
  Final Train: 100.00
   Final Test: 79.70
Split: 01, Run: 03
None time:  1.0374016561545432
None Run 03:
Highest Train: 100.00
Highest Valid: 82.40
  Final Train: 100.00
   Final Test: 79.60
run time now: 4.562716722488403
total time:  4.61253949906677
None All runs:
Highest Train: 100.00 ± 0.00
Highest Valid: 82.27 ± 0.23
  Final Train: 100.00 ± 0.00
   Final Test: 79.07 ± 1.01
[I 2023-06-12 00:47:07,261] Trial 367 finished with value: 82.26666259765625 and parameters: {'Fwd': 3.5683502864060395e-06, 'K': 10, 'alpha': 0.9500000000000001, 'dropout': 0.9, 'gnnepoch': 70, 'lambda1': 0.9500000000000001, 'lambda2': 3.4921205081190534, 'loop': 1, 'loss': 'MSE', 'lr': 0.0020982872148874, 'softmaxF': True, 'useGCN': False, 'weight_decay': 0.027750858298725894, 'weightedloss': False}. Best is trial 364 with value: 83.66666412353516.
/home/wxy/miniconda3/lib/python3.10/site-packages/optuna/distributions.py:685: UserWarning: The distribution is specified by [0, 1.00001] and step=0.05, but the range is not divisible by `step`. It will be replaced by [0, 1.0].
  warnings.warn(
K:  10
alpha:  1.0
lr:  0.0028173938266088717
weight_decay:  0.03603133796522856
dropout:  0.9
fix split and run 3 times
Data: Data(x=[19717, 500], y=[19717], train_mask=[19717], val_mask=[19717], test_mask=[19717], adj_t=[19717, 19717, nnz=88648])
num_train tensor(60)
num_noise 0
noise: tensor(0)
data feature 500
ALTOPT(
  (lins): Sequential(
    (0): Linear(in_features=500, out_features=64, bias=True)
    (1): BatchNorm1d(64, eps=1e-05, momentum=0.1, affine=True, track_running_stats=True)
    (2): Dropout(p=0.9, inplace=True)
    (3): ReLU(inplace=True)
    (4): Linear(in_features=64, out_features=3, bias=True)
    (5): Identity()
  )
  (prop): Propagation(K=10, mode=None, lambda1=None, lambda2=None, L21=True, alpha=1.0)
  (gcn): GCN(
    (convs): ModuleList(
      (0): GCNConv(500, 64)
      (1): GCNConv(64, 3)
    )
    (bns): ModuleList(
      (0): BatchNorm1d(64, eps=1e-05, momentum=0.1, affine=True, track_running_stats=True)
    )
    (output): Identity()
  )
)
propagate done
init label
Split: 01, Run: 01
None time:  1.6864140799734741
None Run 01:
Highest Train: 100.00
Highest Valid: 77.60
  Final Train: 100.00
   Final Test: 75.90
Split: 01, Run: 02
None time:  2.4506054630037397
None Run 02:
Highest Train: 100.00
Highest Valid: 76.40
  Final Train: 100.00
   Final Test: 73.60
Split: 01, Run: 03
None time:  1.9382870611734688
None Run 03:
Highest Train: 100.00
Highest Valid: 77.00
  Final Train: 100.00
   Final Test: 74.90
run time now: 6.125796318054199
total time:  6.168767317896709
None All runs:
Highest Train: 100.00 ± 0.00
Highest Valid: 77.00 ± 0.60
  Final Train: 100.00 ± 0.00
   Final Test: 74.80 ± 1.15
