[I 2023-06-12 00:33:50,862] Trial 223 finished with value: 81.53333282470703 and parameters: {'Fwd': 0.08020985209612715, 'K': 10, 'alpha': 0.65, 'dropout': 0.4, 'gnnepoch': 60, 'lambda1': 0.9, 'lambda2': 5.89984206659666, 'loop': 1, 'loss': 'CE', 'lr': 0.007345579503402726, 'softmaxF': True, 'useGCN': True, 'weight_decay': 5.063939514084764e-05, 'weightedloss': False}. Best is trial 112 with value: 81.66667175292969.
/home/wxy/miniconda3/lib/python3.10/site-packages/optuna/distributions.py:685: UserWarning: The distribution is specified by [0, 1.00001] and step=0.05, but the range is not divisible by `step`. It will be replaced by [0, 1.0].
  warnings.warn(
K:  1
alpha:  0.55
lr:  0.006017167716072702
weight_decay:  7.134640479189021e-05
dropout:  0.4
fix split and run 3 times
Data: Data(x=[2708, 1433], y=[2708], train_mask=[2708], val_mask=[2708], test_mask=[2708], adj_t=[2708, 2708, nnz=10556])
num_train tensor(140)
num_noise 0
noise: tensor(0)
data feature 1433
ALTOPT(
  (lins): Sequential(
    (0): Linear(in_features=1433, out_features=64, bias=True)
    (1): BatchNorm1d(64, eps=1e-05, momentum=0.1, affine=True, track_running_stats=True)
    (2): Dropout(p=0.4, inplace=True)
    (3): ReLU(inplace=True)
    (4): Linear(in_features=64, out_features=7, bias=True)
    (5): LogSoftmax(dim=-1)
  )
  (prop): Propagation(K=1, mode=None, lambda1=None, lambda2=None, L21=True, alpha=0.55)
  (gcn): GCN(
    (convs): ModuleList(
      (0): GCNConv(1433, 64)
      (1): GCNConv(64, 7)
    )
    (bns): ModuleList(
      (0): BatchNorm1d(64, eps=1e-05, momentum=0.1, affine=True, track_running_stats=True)
    )
    (output): LogSoftmax(dim=-1)
  )
)
propagate done
init label
Split: 01, Run: 01
None time:  1.529772432986647
None Run 01:
Highest Train: 100.00
Highest Valid: 81.00
  Final Train: 100.00
   Final Test: 81.90
Split: 01, Run: 02
None time:  1.5278356350027025
None Run 02:
Highest Train: 100.00
Highest Valid: 80.20
  Final Train: 100.00
   Final Test: 80.60
Split: 01, Run: 03
None time:  1.3888145762030035
None Run 03:
Highest Train: 100.00
Highest Valid: 80.80
  Final Train: 100.00
   Final Test: 80.60
run time now: 4.469808578491211
total time:  4.484297015005723
None All runs:
Highest Train: 100.00 ± 0.00
Highest Valid: 80.67 ± 0.42
  Final Train: 100.00 ± 0.00
   Final Test: 81.03 ± 0.75
[I 2023-06-12 00:33:55,809] Trial 224 finished with value: 80.66666412353516 and parameters: {'Fwd': 0.09845619868452786, 'K': 1, 'alpha': 0.55, 'dropout': 0.4, 'gnnepoch': 60, 'lambda1': 0.9, 'lambda2': 5.684456996670946, 'loop': 1, 'loss': 'CE', 'lr': 0.006017167716072702, 'softmaxF': True, 'useGCN': True, 'weight_decay': 7.134640479189021e-05, 'weightedloss': False}. Best is trial 112 with value: 81.66667175292969.
/home/wxy/miniconda3/lib/python3.10/site-packages/optuna/distributions.py:685: UserWarning: The distribution is specified by [0, 1.00001] and step=0.05, but the range is not divisible by `step`. It will be replaced by [0, 1.0].
  warnings.warn(
K:  10
alpha:  0.65
lr:  0.009983634862230938
weight_decay:  6.111581664327538e-05
dropout:  0.5
fix split and run 3 times
Data: Data(x=[2708, 1433], y=[2708], train_mask=[2708], val_mask=[2708], test_mask=[2708], adj_t=[2708, 2708, nnz=10556])
num_train tensor(140)
num_noise 0
noise: tensor(0)
data feature 1433
ALTOPT(
  (lins): Sequential(
    (0): Linear(in_features=1433, out_features=64, bias=True)
    (1): BatchNorm1d(64, eps=1e-05, momentum=0.1, affine=True, track_running_stats=True)
    (2): Dropout(p=0.5, inplace=True)
    (3): ReLU(inplace=True)
    (4): Linear(in_features=64, out_features=7, bias=True)
    (5): LogSoftmax(dim=-1)
  )
  (prop): Propagation(K=10, mode=None, lambda1=None, lambda2=None, L21=True, alpha=0.65)
  (gcn): GCN(
    (convs): ModuleList(
      (0): GCNConv(1433, 64)
      (1): GCNConv(64, 7)
    )
    (bns): ModuleList(
      (0): BatchNorm1d(64, eps=1e-05, momentum=0.1, affine=True, track_running_stats=True)
    )
    (output): LogSoftmax(dim=-1)
  )
)
propagate done
init label
Split: 01, Run: 01
None time:  1.4037546848412603
None Run 01:
Highest Train: 100.00
Highest Valid: 82.00
  Final Train: 100.00
   Final Test: 82.10
Split: 01, Run: 02
None time:  1.7745142800267786
None Run 02:
Highest Train: 100.00
Highest Valid: 81.20
  Final Train: 100.00
   Final Test: 80.90
Split: 01, Run: 03
None time:  1.4578245370648801
None Run 03:
Highest Train: 100.00
Highest Valid: 80.60
  Final Train: 100.00
   Final Test: 81.40
run time now: 4.698891878128052
total time:  4.7180377680342644
None All runs:
Highest Train: 100.00 ± 0.00
Highest Valid: 81.27 ± 0.70
  Final Train: 100.00 ± 0.00
   Final Test: 81.47 ± 0.60
[I 2023-06-12 00:34:01,054] Trial 225 finished with value: 81.26666259765625 and parameters: {'Fwd': 0.04642558977082223, 'K': 10, 'alpha': 0.65, 'dropout': 0.5, 'gnnepoch': 60, 'lambda1': 0.8500000000000001, 'lambda2': 5.500944256722635, 'loop': 1, 'loss': 'CE', 'lr': 0.009983634862230938, 'softmaxF': True, 'useGCN': True, 'weight_decay': 6.111581664327538e-05, 'weightedloss': False}. Best is trial 112 with value: 81.66667175292969.
/home/wxy/miniconda3/lib/python3.10/site-packages/optuna/distributions.py:685: UserWarning: The distribution is specified by [0, 1.00001] and step=0.05, but the range is not divisible by `step`. It will be replaced by [0, 1.0].
  warnings.warn(
K:  10
alpha:  0.6000000000000001
lr:  0.0008226364901538562
weight_decay:  8.857836422886486e-05
dropout:  0.4
fix split and run 3 times
Data: Data(x=[2708, 1433], y=[2708], train_mask=[2708], val_mask=[2708], test_mask=[2708], adj_t=[2708, 2708, nnz=10556])
num_train tensor(140)
num_noise 0
noise: tensor(0)
data feature 1433
ALTOPT(
  (lins): Sequential(
    (0): Linear(in_features=1433, out_features=64, bias=True)
    (1): BatchNorm1d(64, eps=1e-05, momentum=0.1, affine=True, track_running_stats=True)
    (2): Dropout(p=0.4, inplace=True)
    (3): ReLU(inplace=True)
    (4): Linear(in_features=64, out_features=7, bias=True)
    (5): LogSoftmax(dim=-1)
  )
  (prop): Propagation(K=10, mode=None, lambda1=None, lambda2=None, L21=True, alpha=0.6000000000000001)
  (gcn): GCN(
    (convs): ModuleList(
      (0): GCNConv(1433, 64)
      (1): GCNConv(64, 7)
    )
    (bns): ModuleList(
      (0): BatchNorm1d(64, eps=1e-05, momentum=0.1, affine=True, track_running_stats=True)
    )
    (output): LogSoftmax(dim=-1)
  )
)
propagate done
init label
Split: 01, Run: 01
None time:  1.8331178878434002
None Run 01:
Highest Train: 100.00
Highest Valid: 80.00
  Final Train: 100.00
   Final Test: 80.10
Split: 01, Run: 02
None time:  1.4401803030632436
None Run 02:
Highest Train: 100.00
Highest Valid: 78.20
  Final Train: 100.00
   Final Test: 79.20
Split: 01, Run: 03
None time:  1.6144445380195975
None Run 03:
Highest Train: 100.00
Highest Valid: 68.80
  Final Train: 100.00
   Final Test: 69.90
run time now: 4.917186260223389
total time:  4.933768384857103
None All runs:
Highest Train: 100.00 ± 0.00
Highest Valid: 75.67 ± 6.01
  Final Train: 100.00 ± 0.00
   Final Test: 76.40 ± 5.65
[I 2023-06-12 00:34:06,464] Trial 226 finished with value: 75.66666412353516 and parameters: {'Fwd': 0.06958563515866278, 'K': 10, 'alpha': 0.6000000000000001, 'dropout': 0.4, 'gnnepoch': 60, 'lambda1': 0.9500000000000001, 'lambda2': 5.745535730018451, 'loop': 1, 'loss': 'CE', 'lr': 0.0008226364901538562, 'softmaxF': True, 'useGCN': True, 'weight_decay': 8.857836422886486e-05, 'weightedloss': False}. Best is trial 112 with value: 81.66667175292969.
/home/wxy/miniconda3/lib/python3.10/site-packages/optuna/distributions.py:685: UserWarning: The distribution is specified by [0, 1.00001] and step=0.05, but the range is not divisible by `step`. It will be replaced by [0, 1.0].
  warnings.warn(
K:  10
alpha:  0.6000000000000001
lr:  0.006912642332851673
weight_decay:  4.577063657965449e-05
dropout:  0.4
fix split and run 3 times
Data: Data(x=[2708, 1433], y=[2708], train_mask=[2708], val_mask=[2708], test_mask=[2708], adj_t=[2708, 2708, nnz=10556])
num_train tensor(140)
num_noise 0
noise: tensor(0)
data feature 1433
ALTOPT(
  (lins): Sequential(
    (0): Linear(in_features=1433, out_features=64, bias=True)
    (1): BatchNorm1d(64, eps=1e-05, momentum=0.1, affine=True, track_running_stats=True)
    (2): Dropout(p=0.4, inplace=True)
    (3): ReLU(inplace=True)
    (4): Linear(in_features=64, out_features=7, bias=True)
    (5): LogSoftmax(dim=-1)
  )
  (prop): Propagation(K=10, mode=None, lambda1=None, lambda2=None, L21=True, alpha=0.6000000000000001)
  (gcn): GCN(
    (convs): ModuleList(
      (0): GCNConv(1433, 64)
      (1): GCNConv(64, 7)
    )
    (bns): ModuleList(
      (0): BatchNorm1d(64, eps=1e-05, momentum=0.1, affine=True, track_running_stats=True)
    )
    (output): LogSoftmax(dim=-1)
  )
)
propagate done
init label
Split: 01, Run: 01
None time:  1.6174761808943003
None Run 01:
Highest Train: 100.00
Highest Valid: 82.20
  Final Train: 100.00
   Final Test: 82.00
Split: 01, Run: 02
None time:  1.4110208249185234
None Run 02:
Highest Train: 100.00
Highest Valid: 81.60
  Final Train: 100.00
   Final Test: 81.60
Split: 01, Run: 03
None time:  1.4671496688388288
None Run 03:
Highest Train: 100.00
Highest Valid: 80.80
  Final Train: 100.00
   Final Test: 81.20
run time now: 4.523618698120117
total time:  4.538096338044852
None All runs:
Highest Train: 100.00 ± 0.00
Highest Valid: 81.53 ± 0.70
  Final Train: 100.00 ± 0.00
   Final Test: 81.60 ± 0.40
[I 2023-06-12 00:34:11,428] Trial 227 finished with value: 81.53333282470703 and parameters: {'Fwd': 0.05657397113536654, 'K': 10, 'alpha': 0.6000000000000001, 'dropout': 0.4, 'gnnepoch': 60, 'lambda1': 0.8500000000000001, 'lambda2': 6.066075713011416, 'loop': 1, 'loss': 'CE', 'lr': 0.006912642332851673, 'softmaxF': True, 'useGCN': True, 'weight_decay': 4.577063657965449e-05, 'weightedloss': False}. Best is trial 112 with value: 81.66667175292969.
/home/wxy/miniconda3/lib/python3.10/site-packages/optuna/distributions.py:685: UserWarning: The distribution is specified by [0, 1.00001] and step=0.05, but the range is not divisible by `step`. It will be replaced by [0, 1.0].
  warnings.warn(
K:  10
alpha:  0.65
lr:  0.0054193378447373
weight_decay:  0.00014152941869556684
dropout:  0.30000000000000004
fix split and run 3 times
Data: Data(x=[2708, 1433], y=[2708], train_mask=[2708], val_mask=[2708], test_mask=[2708], adj_t=[2708, 2708, nnz=10556])
num_train tensor(140)
num_noise 0
noise: tensor(0)
data feature 1433
ALTOPT(
  (lins): Sequential(
    (0): Linear(in_features=1433, out_features=64, bias=True)
    (1): BatchNorm1d(64, eps=1e-05, momentum=0.1, affine=True, track_running_stats=True)
    (2): Dropout(p=0.30000000000000004, inplace=True)
    (3): ReLU(inplace=True)
    (4): Linear(in_features=64, out_features=7, bias=True)
    (5): LogSoftmax(dim=-1)
  )
  (prop): Propagation(K=10, mode=None, lambda1=None, lambda2=None, L21=True, alpha=0.65)
  (gcn): GCN(
    (convs): ModuleList(
      (0): GCNConv(1433, 64)
      (1): GCNConv(64, 7)
    )
    (bns): ModuleList(
      (0): BatchNorm1d(64, eps=1e-05, momentum=0.1, affine=True, track_running_stats=True)
    )
    (output): LogSoftmax(dim=-1)
  )
)
propagate done
init label
Split: 01, Run: 01
None time:  1.8696203387808055
None Run 01:
Highest Train: 100.00
Highest Valid: 81.40
  Final Train: 99.29
   Final Test: 81.80
Split: 01, Run: 02
None time:  1.8665258279070258
None Run 02:
Highest Train: 100.00
Highest Valid: 80.40
  Final Train: 99.29
   Final Test: 80.90
Split: 01, Run: 03
None time:  1.677763634128496
None Run 03:
Highest Train: 100.00
Highest Valid: 80.80
  Final Train: 99.29
   Final Test: 81.30
run time now: 5.443615674972534
total time:  5.466460212133825
None All runs:
Highest Train: 100.00 ± 0.00
Highest Valid: 80.87 ± 0.50
  Final Train: 99.29 ± 0.00
   Final Test: 81.33 ± 0.45
[I 2023-06-12 00:34:17,355] Trial 228 finished with value: 80.86666870117188 and parameters: {'Fwd': 3.675028775449517e-05, 'K': 10, 'alpha': 0.65, 'dropout': 0.30000000000000004, 'gnnepoch': 70, 'lambda1': 0.75, 'lambda2': 1.3819379825101228, 'loop': 1, 'loss': 'CE', 'lr': 0.0054193378447373, 'softmaxF': True, 'useGCN': True, 'weight_decay': 0.00014152941869556684, 'weightedloss': False}. Best is trial 112 with value: 81.66667175292969.
/home/wxy/miniconda3/lib/python3.10/site-packages/optuna/distributions.py:685: UserWarning: The distribution is specified by [0, 1.00001] and step=0.05, but the range is not divisible by `step`. It will be replaced by [0, 1.0].
  warnings.warn(
K:  10
alpha:  0.55
lr:  0.007653401075023516
weight_decay:  3.3109019578295315e-05
dropout:  0.5
fix split and run 3 times
Data: Data(x=[2708, 1433], y=[2708], train_mask=[2708], val_mask=[2708], test_mask=[2708], adj_t=[2708, 2708, nnz=10556])
num_train tensor(140)
num_noise 0
noise: tensor(0)
data feature 1433
ALTOPT(
  (lins): Sequential(
    (0): Linear(in_features=1433, out_features=64, bias=True)
    (1): BatchNorm1d(64, eps=1e-05, momentum=0.1, affine=True, track_running_stats=True)
    (2): Dropout(p=0.5, inplace=True)
    (3): ReLU(inplace=True)
    (4): Linear(in_features=64, out_features=7, bias=True)
    (5): LogSoftmax(dim=-1)
  )
  (prop): Propagation(K=10, mode=None, lambda1=None, lambda2=None, L21=True, alpha=0.55)
  (gcn): GCN(
    (convs): ModuleList(
      (0): GCNConv(1433, 64)
      (1): GCNConv(64, 7)
    )
    (bns): ModuleList(
      (0): BatchNorm1d(64, eps=1e-05, momentum=0.1, affine=True, track_running_stats=True)
    )
    (output): LogSoftmax(dim=-1)
  )
)
propagate done
init label
Split: 01, Run: 01
None time:  1.428472536150366
None Run 01:
Highest Train: 100.00
Highest Valid: 82.60
  Final Train: 100.00
   Final Test: 82.10
Split: 01, Run: 02
None time:  1.542513927910477
None Run 02:
Highest Train: 100.00
Highest Valid: 81.00
  Final Train: 100.00
   Final Test: 81.20
Split: 01, Run: 03
None time:  1.3288263538852334
None Run 03:
Highest Train: 100.00
Highest Valid: 80.60
  Final Train: 100.00
   Final Test: 81.30
run time now: 4.3253490924835205
total time:  4.343988290056586
None All runs:
Highest Train: 100.00 ± 0.00
Highest Valid: 81.40 ± 1.06
  Final Train: 100.00 ± 0.00
   Final Test: 81.53 ± 0.49
[I 2023-06-12 00:34:22,270] Trial 229 finished with value: 81.4000015258789 and parameters: {'Fwd': 0.04037825854333961, 'K': 10, 'alpha': 0.55, 'dropout': 0.5, 'gnnepoch': 60, 'lambda1': 0.9, 'lambda2': 5.32354640291028, 'loop': 1, 'loss': 'CE', 'lr': 0.007653401075023516, 'softmaxF': True, 'useGCN': True, 'weight_decay': 3.3109019578295315e-05, 'weightedloss': False}. Best is trial 112 with value: 81.66667175292969.
/home/wxy/miniconda3/lib/python3.10/site-packages/optuna/distributions.py:685: UserWarning: The distribution is specified by [0, 1.00001] and step=0.05, but the range is not divisible by `step`. It will be replaced by [0, 1.0].
  warnings.warn(
K:  10
alpha:  0.35000000000000003
lr:  0.00902985440067001
weight_decay:  6.892147475714999e-05
dropout:  0.4
fix split and run 3 times
Data: Data(x=[2708, 1433], y=[2708], train_mask=[2708], val_mask=[2708], test_mask=[2708], adj_t=[2708, 2708, nnz=10556])
num_train tensor(140)
num_noise 0
noise: tensor(0)
data feature 1433
ALTOPT(
  (lins): Sequential(
    (0): Linear(in_features=1433, out_features=64, bias=True)
    (1): BatchNorm1d(64, eps=1e-05, momentum=0.1, affine=True, track_running_stats=True)
    (2): Dropout(p=0.4, inplace=True)
    (3): ReLU(inplace=True)
    (4): Linear(in_features=64, out_features=7, bias=True)
    (5): LogSoftmax(dim=-1)
  )
  (prop): Propagation(K=10, mode=None, lambda1=None, lambda2=None, L21=True, alpha=0.35000000000000003)
  (gcn): GCN(
    (convs): ModuleList(
      (0): GCNConv(1433, 64)
      (1): GCNConv(64, 7)
    )
    (bns): ModuleList(
      (0): BatchNorm1d(64, eps=1e-05, momentum=0.1, affine=True, track_running_stats=True)
    )
    (output): LogSoftmax(dim=-1)
  )
)
propagate done
init label
Split: 01, Run: 01
None time:  0.9301907420158386
None Run 01:
Highest Train: 100.00
Highest Valid: 75.20
  Final Train: 100.00
   Final Test: 76.30
Split: 01, Run: 02
None time:  1.0391989587806165
None Run 02:
Highest Train: 100.00
Highest Valid: 76.40
  Final Train: 100.00
   Final Test: 79.60
Split: 01, Run: 03
None time:  1.0664473129436374
None Run 03:
Highest Train: 100.00
Highest Valid: 77.80
  Final Train: 100.00
   Final Test: 79.50
run time now: 3.0622737407684326
total time:  3.077138069085777
None All runs:
Highest Train: 100.00 ± 0.00
Highest Valid: 76.47 ± 1.30
  Final Train: 100.00 ± 0.00
   Final Test: 78.47 ± 1.88
[I 2023-06-12 00:34:25,803] Trial 230 finished with value: 76.46666717529297 and parameters: {'Fwd': 0.07976397679290945, 'K': 10, 'alpha': 0.35000000000000003, 'dropout': 0.4, 'gnnepoch': 60, 'lambda1': 0.8, 'lambda2': 5.599053871055894, 'loop': 1, 'loss': 'CE', 'lr': 0.00902985440067001, 'softmaxF': True, 'useGCN': False, 'weight_decay': 6.892147475714999e-05, 'weightedloss': False}. Best is trial 112 with value: 81.66667175292969.
/home/wxy/miniconda3/lib/python3.10/site-packages/optuna/distributions.py:685: UserWarning: The distribution is specified by [0, 1.00001] and step=0.05, but the range is not divisible by `step`. It will be replaced by [0, 1.0].
  warnings.warn(
K:  10
alpha:  0.7000000000000001
lr:  0.006890008415652722
weight_decay:  0.00011256003069570282
dropout:  0.4
fix split and run 3 times
Data: Data(x=[2708, 1433], y=[2708], train_mask=[2708], val_mask=[2708], test_mask=[2708], adj_t=[2708, 2708, nnz=10556])
num_train tensor(140)
num_noise 0
noise: tensor(0)
data feature 1433
ALTOPT(
  (lins): Sequential(
    (0): Linear(in_features=1433, out_features=64, bias=True)
    (1): BatchNorm1d(64, eps=1e-05, momentum=0.1, affine=True, track_running_stats=True)
    (2): Dropout(p=0.4, inplace=True)
    (3): ReLU(inplace=True)
    (4): Linear(in_features=64, out_features=7, bias=True)
    (5): LogSoftmax(dim=-1)
  )
  (prop): Propagation(K=10, mode=None, lambda1=None, lambda2=None, L21=True, alpha=0.7000000000000001)
  (gcn): GCN(
    (convs): ModuleList(
      (0): GCNConv(1433, 64)
      (1): GCNConv(64, 7)
    )
    (bns): ModuleList(
      (0): BatchNorm1d(64, eps=1e-05, momentum=0.1, affine=True, track_running_stats=True)
    )
    (output): LogSoftmax(dim=-1)
  )
)
propagate done
init label
Split: 01, Run: 01
None time:  1.470596675062552
None Run 01:
Highest Train: 100.00
Highest Valid: 82.20
  Final Train: 100.00
   Final Test: 82.00
Split: 01, Run: 02
None time:  1.675162296043709
None Run 02:
Highest Train: 100.00
Highest Valid: 81.60
  Final Train: 100.00
   Final Test: 81.60
Split: 01, Run: 03
None time:  1.4203411280177534
None Run 03:
Highest Train: 100.00
Highest Valid: 80.80
  Final Train: 100.00
   Final Test: 81.10
run time now: 4.594662666320801
total time:  4.609772783936933
None All runs:
Highest Train: 100.00 ± 0.00
Highest Valid: 81.53 ± 0.70
  Final Train: 100.00 ± 0.00
   Final Test: 81.57 ± 0.45
[I 2023-06-12 00:34:30,856] Trial 231 finished with value: 81.53333282470703 and parameters: {'Fwd': 0.0635202467650533, 'K': 10, 'alpha': 0.7000000000000001, 'dropout': 0.4, 'gnnepoch': 60, 'lambda1': 0.8500000000000001, 'lambda2': 5.12072085276553, 'loop': 1, 'loss': 'CE', 'lr': 0.006890008415652722, 'softmaxF': True, 'useGCN': True, 'weight_decay': 0.00011256003069570282, 'weightedloss': False}. Best is trial 112 with value: 81.66667175292969.
/home/wxy/miniconda3/lib/python3.10/site-packages/optuna/distributions.py:685: UserWarning: The distribution is specified by [0, 1.00001] and step=0.05, but the range is not divisible by `step`. It will be replaced by [0, 1.0].
  warnings.warn(
K:  10
alpha:  0.7000000000000001
lr:  0.006232510739740094
weight_decay:  9.472496763433553e-05
dropout:  0.4
fix split and run 3 times
Data: Data(x=[2708, 1433], y=[2708], train_mask=[2708], val_mask=[2708], test_mask=[2708], adj_t=[2708, 2708, nnz=10556])
num_train tensor(140)
num_noise 0
noise: tensor(0)
data feature 1433
ALTOPT(
  (lins): Sequential(
    (0): Linear(in_features=1433, out_features=64, bias=True)
    (1): BatchNorm1d(64, eps=1e-05, momentum=0.1, affine=True, track_running_stats=True)
    (2): Dropout(p=0.4, inplace=True)
    (3): ReLU(inplace=True)
    (4): Linear(in_features=64, out_features=7, bias=True)
    (5): LogSoftmax(dim=-1)
  )
  (prop): Propagation(K=10, mode=None, lambda1=None, lambda2=None, L21=True, alpha=0.7000000000000001)
  (gcn): GCN(
    (convs): ModuleList(
      (0): GCNConv(1433, 64)
      (1): GCNConv(64, 7)
    )
    (bns): ModuleList(
      (0): BatchNorm1d(64, eps=1e-05, momentum=0.1, affine=True, track_running_stats=True)
    )
    (output): LogSoftmax(dim=-1)
  )
)
propagate done
init label
Split: 01, Run: 01
None time:  1.442897534929216
None Run 01:
Highest Train: 100.00
Highest Valid: 81.40
  Final Train: 100.00
   Final Test: 81.70
Split: 01, Run: 02
None time:  1.6420909110456705
None Run 02:
Highest Train: 100.00
Highest Valid: 81.40
  Final Train: 100.00
   Final Test: 81.20
Split: 01, Run: 03
None time:  1.6500501970294863
None Run 03:
Highest Train: 100.00
Highest Valid: 81.00
  Final Train: 100.00
   Final Test: 81.20
run time now: 4.765918254852295
total time:  4.783209851011634
None All runs:
Highest Train: 100.00 ± 0.00
Highest Valid: 81.27 ± 0.23
  Final Train: 100.00 ± 0.00
   Final Test: 81.37 ± 0.29
