[I 2023-06-12 00:13:00,264] Trial 8 finished with value: 78.33333587646484 and parameters: {'Fwd': 0.02362150837126448, 'K': 6, 'alpha': 0.9500000000000001, 'dropout': 0.6000000000000001, 'gnnepoch': 120, 'lambda1': 1.0, 'lambda2': 2.8415348134826237, 'loop': 2, 'loss': 'MSE', 'lr': 0.0007970507597534947, 'softmaxF': True, 'useGCN': False, 'weight_decay': 3.9659046191106466e-06, 'weightedloss': False}. Best is trial 7 with value: 78.9333267211914.
/home/wxy/miniconda3/lib/python3.10/site-packages/optuna/distributions.py:685: UserWarning: The distribution is specified by [0, 1.00001] and step=0.05, but the range is not divisible by `step`. It will be replaced by [0, 1.0].
  warnings.warn(
K:  2
alpha:  0.8500000000000001
lr:  0.0007114004267274486
weight_decay:  0.00025954559540319167
dropout:  0.2
fix split and run 3 times
Data: Data(x=[2708, 1433], y=[2708], train_mask=[2708], val_mask=[2708], test_mask=[2708], adj_t=[2708, 2708, nnz=10556])
num_train tensor(140)
num_noise 0
noise: tensor(0)
data feature 1433
ALTOPT(
  (lins): Sequential(
    (0): Linear(in_features=1433, out_features=64, bias=True)
    (1): BatchNorm1d(64, eps=1e-05, momentum=0.1, affine=True, track_running_stats=True)
    (2): Dropout(p=0.2, inplace=True)
    (3): ReLU(inplace=True)
    (4): Linear(in_features=64, out_features=7, bias=True)
    (5): Identity()
  )
  (prop): Propagation(K=2, mode=None, lambda1=None, lambda2=None, L21=True, alpha=0.8500000000000001)
  (gcn): GCN(
    (convs): ModuleList(
      (0): GCNConv(1433, 64)
      (1): GCNConv(64, 7)
    )
    (bns): ModuleList(
      (0): BatchNorm1d(64, eps=1e-05, momentum=0.1, affine=True, track_running_stats=True)
    )
    (output): Identity()
  )
)
propagate done
init label
Split: 01, Run: 01
None time:  0.8663801550865173
None Run 01:
Highest Train: 100.00
Highest Valid: 78.20
  Final Train: 100.00
   Final Test: 76.80
Split: 01, Run: 02
None time:  1.1504715310875326
None Run 02:
Highest Train: 100.00
Highest Valid: 76.60
  Final Train: 100.00
   Final Test: 75.90
Split: 01, Run: 03, Epoch: 100, Loss: 0.1089, Train: 100.00%, Valid: 77.60% Test: 78.30%
Split: 01, Run: 03
None time:  2.63012111117132
None Run 03:
Highest Train: 100.00
Highest Valid: 77.60
  Final Train: 100.00
   Final Test: 78.90
run time now: 4.672596216201782
total time:  4.702721308916807
None All runs:
Highest Train: 100.00 ± 0.00
Highest Valid: 77.47 ± 0.81
  Final Train: 100.00 ± 0.00
   Final Test: 77.20 ± 1.54
[I 2023-06-12 00:13:05,300] Trial 9 finished with value: 77.46666717529297 and parameters: {'Fwd': 0.0001295071796393754, 'K': 2, 'alpha': 0.8500000000000001, 'dropout': 0.2, 'gnnepoch': 90, 'lambda1': 0.2, 'lambda2': 9.459353704917222, 'loop': 1, 'loss': 'MSE', 'lr': 0.0007114004267274486, 'softmaxF': True, 'useGCN': False, 'weight_decay': 0.00025954559540319167, 'weightedloss': True}. Best is trial 7 with value: 78.9333267211914.
/home/wxy/miniconda3/lib/python3.10/site-packages/optuna/distributions.py:685: UserWarning: The distribution is specified by [0, 1.00001] and step=0.05, but the range is not divisible by `step`. It will be replaced by [0, 1.0].
  warnings.warn(
K:  10
alpha:  0.45
lr:  0.002651721856923424
weight_decay:  0.08994194134914757
dropout:  0.9
fix split and run 3 times
Data: Data(x=[2708, 1433], y=[2708], train_mask=[2708], val_mask=[2708], test_mask=[2708], adj_t=[2708, 2708, nnz=10556])
num_train tensor(140)
num_noise 0
noise: tensor(0)
data feature 1433
ALTOPT(
  (lins): Sequential(
    (0): Linear(in_features=1433, out_features=64, bias=True)
    (1): BatchNorm1d(64, eps=1e-05, momentum=0.1, affine=True, track_running_stats=True)
    (2): Dropout(p=0.9, inplace=True)
    (3): ReLU(inplace=True)
    (4): Linear(in_features=64, out_features=7, bias=True)
    (5): LogSoftmax(dim=-1)
  )
  (prop): Propagation(K=10, mode=None, lambda1=None, lambda2=None, L21=True, alpha=0.45)
  (gcn): GCN(
    (convs): ModuleList(
      (0): GCNConv(1433, 64)
      (1): GCNConv(64, 7)
    )
    (bns): ModuleList(
      (0): BatchNorm1d(64, eps=1e-05, momentum=0.1, affine=True, track_running_stats=True)
    )
    (output): LogSoftmax(dim=-1)
  )
)
propagate done
init label
Split: 01, Run: 01
None time:  1.8925193750765175
None Run 01:
Highest Train: 100.00
Highest Valid: 79.80
  Final Train: 100.00
   Final Test: 80.90
Split: 01, Run: 02
None time:  1.7849420281127095
None Run 02:
Highest Train: 100.00
Highest Valid: 78.80
  Final Train: 100.00
   Final Test: 78.70
Split: 01, Run: 03
None time:  1.7485283510759473
None Run 03:
Highest Train: 100.00
Highest Valid: 78.20
  Final Train: 100.00
   Final Test: 79.20
run time now: 5.450912952423096
total time:  5.477105554193258
None All runs:
Highest Train: 100.00 ± 0.00
Highest Valid: 78.93 ± 0.81
  Final Train: 100.00 ± 0.00
   Final Test: 79.60 ± 1.15
[I 2023-06-12 00:13:11,205] Trial 10 finished with value: 78.9333267211914 and parameters: {'Fwd': 3.3568772426800454e-05, 'K': 10, 'alpha': 0.45, 'dropout': 0.9, 'gnnepoch': 60, 'lambda1': 0.30000000000000004, 'lambda2': 7.795413112811409, 'loop': 2, 'loss': 'CE', 'lr': 0.002651721856923424, 'softmaxF': False, 'useGCN': True, 'weight_decay': 0.08994194134914757, 'weightedloss': True}. Best is trial 7 with value: 78.9333267211914.
/home/wxy/miniconda3/lib/python3.10/site-packages/optuna/distributions.py:685: UserWarning: The distribution is specified by [0, 1.00001] and step=0.05, but the range is not divisible by `step`. It will be replaced by [0, 1.0].
  warnings.warn(
K:  10
alpha:  0.4
lr:  0.0026753660821477302
weight_decay:  0.08468448768469158
dropout:  0.9
fix split and run 3 times
Data: Data(x=[2708, 1433], y=[2708], train_mask=[2708], val_mask=[2708], test_mask=[2708], adj_t=[2708, 2708, nnz=10556])
num_train tensor(140)
num_noise 0
noise: tensor(0)
data feature 1433
ALTOPT(
  (lins): Sequential(
    (0): Linear(in_features=1433, out_features=64, bias=True)
    (1): BatchNorm1d(64, eps=1e-05, momentum=0.1, affine=True, track_running_stats=True)
    (2): Dropout(p=0.9, inplace=True)
    (3): ReLU(inplace=True)
    (4): Linear(in_features=64, out_features=7, bias=True)
    (5): LogSoftmax(dim=-1)
  )
  (prop): Propagation(K=10, mode=None, lambda1=None, lambda2=None, L21=True, alpha=0.4)
  (gcn): GCN(
    (convs): ModuleList(
      (0): GCNConv(1433, 64)
      (1): GCNConv(64, 7)
    )
    (bns): ModuleList(
      (0): BatchNorm1d(64, eps=1e-05, momentum=0.1, affine=True, track_running_stats=True)
    )
    (output): LogSoftmax(dim=-1)
  )
)
propagate done
init label
Split: 01, Run: 01
None time:  1.8989321428816766
None Run 01:
Highest Train: 100.00
Highest Valid: 79.80
  Final Train: 100.00
   Final Test: 81.00
Split: 01, Run: 02
None time:  1.7820060451049358
None Run 02:
Highest Train: 100.00
Highest Valid: 79.00
  Final Train: 100.00
   Final Test: 78.70
Split: 01, Run: 03
None time:  1.7319599429611117
None Run 03:
Highest Train: 100.00
Highest Valid: 78.00
  Final Train: 100.00
   Final Test: 79.50
run time now: 5.44001579284668
total time:  5.458487113006413
None All runs:
Highest Train: 100.00 ± 0.00
Highest Valid: 78.93 ± 0.90
  Final Train: 100.00 ± 0.00
   Final Test: 79.73 ± 1.17
[I 2023-06-12 00:13:17,187] Trial 11 finished with value: 78.9333267211914 and parameters: {'Fwd': 5.170680827969147e-05, 'K': 10, 'alpha': 0.4, 'dropout': 0.9, 'gnnepoch': 60, 'lambda1': 0.30000000000000004, 'lambda2': 7.649043557050067, 'loop': 2, 'loss': 'CE', 'lr': 0.0026753660821477302, 'softmaxF': False, 'useGCN': True, 'weight_decay': 0.08468448768469158, 'weightedloss': True}. Best is trial 7 with value: 78.9333267211914.
/home/wxy/miniconda3/lib/python3.10/site-packages/optuna/distributions.py:685: UserWarning: The distribution is specified by [0, 1.00001] and step=0.05, but the range is not divisible by `step`. It will be replaced by [0, 1.0].
  warnings.warn(
K:  9
alpha:  0.4
lr:  0.002288280718874187
weight_decay:  0.08508211456845609
dropout:  0.8
fix split and run 3 times
Data: Data(x=[2708, 1433], y=[2708], train_mask=[2708], val_mask=[2708], test_mask=[2708], adj_t=[2708, 2708, nnz=10556])
num_train tensor(140)
num_noise 0
noise: tensor(0)
data feature 1433
ALTOPT(
  (lins): Sequential(
    (0): Linear(in_features=1433, out_features=64, bias=True)
    (1): BatchNorm1d(64, eps=1e-05, momentum=0.1, affine=True, track_running_stats=True)
    (2): Dropout(p=0.8, inplace=True)
    (3): ReLU(inplace=True)
    (4): Linear(in_features=64, out_features=7, bias=True)
    (5): LogSoftmax(dim=-1)
  )
  (prop): Propagation(K=9, mode=None, lambda1=None, lambda2=None, L21=True, alpha=0.4)
  (gcn): GCN(
    (convs): ModuleList(
      (0): GCNConv(1433, 64)
      (1): GCNConv(64, 7)
    )
    (bns): ModuleList(
      (0): BatchNorm1d(64, eps=1e-05, momentum=0.1, affine=True, track_running_stats=True)
    )
    (output): LogSoftmax(dim=-1)
  )
)
propagate done
init label
Split: 01, Run: 01
None time:  2.099466506158933
None Run 01:
Highest Train: 100.00
Highest Valid: 80.20
  Final Train: 100.00
   Final Test: 80.80
Split: 01, Run: 02
None time:  2.023658350808546
None Run 02:
Highest Train: 100.00
Highest Valid: 78.80
  Final Train: 100.00
   Final Test: 79.60
Split: 01, Run: 03
None time:  1.8059361660853028
None Run 03:
Highest Train: 100.00
Highest Valid: 78.80
  Final Train: 100.00
   Final Test: 79.80
run time now: 5.956495761871338
total time:  5.982454532990232
None All runs:
Highest Train: 100.00 ± 0.00
Highest Valid: 79.27 ± 0.81
  Final Train: 100.00 ± 0.00
   Final Test: 80.07 ± 0.64
[I 2023-06-12 00:13:23,606] Trial 12 finished with value: 79.26666259765625 and parameters: {'Fwd': 2.5540472969460064e-05, 'K': 9, 'alpha': 0.4, 'dropout': 0.8, 'gnnepoch': 80, 'lambda1': 0.25, 'lambda2': 8.123063880422347, 'loop': 2, 'loss': 'CE', 'lr': 0.002288280718874187, 'softmaxF': False, 'useGCN': True, 'weight_decay': 0.08508211456845609, 'weightedloss': True}. Best is trial 12 with value: 79.26666259765625.
/home/wxy/miniconda3/lib/python3.10/site-packages/optuna/distributions.py:685: UserWarning: The distribution is specified by [0, 1.00001] and step=0.05, but the range is not divisible by `step`. It will be replaced by [0, 1.0].
  warnings.warn(
K:  8
alpha:  0.4
lr:  0.001941083134380361
weight_decay:  0.0095959819049298
dropout:  0.7000000000000001
fix split and run 3 times
Data: Data(x=[2708, 1433], y=[2708], train_mask=[2708], val_mask=[2708], test_mask=[2708], adj_t=[2708, 2708, nnz=10556])
num_train tensor(140)
num_noise 0
noise: tensor(0)
data feature 1433
ALTOPT(
  (lins): Sequential(
    (0): Linear(in_features=1433, out_features=64, bias=True)
    (1): BatchNorm1d(64, eps=1e-05, momentum=0.1, affine=True, track_running_stats=True)
    (2): Dropout(p=0.7000000000000001, inplace=True)
    (3): ReLU(inplace=True)
    (4): Linear(in_features=64, out_features=7, bias=True)
    (5): LogSoftmax(dim=-1)
  )
  (prop): Propagation(K=8, mode=None, lambda1=None, lambda2=None, L21=True, alpha=0.4)
  (gcn): GCN(
    (convs): ModuleList(
      (0): GCNConv(1433, 64)
      (1): GCNConv(64, 7)
    )
    (bns): ModuleList(
      (0): BatchNorm1d(64, eps=1e-05, momentum=0.1, affine=True, track_running_stats=True)
    )
    (output): LogSoftmax(dim=-1)
  )
)
propagate done
init label
Split: 01, Run: 01
None time:  2.171454151859507
None Run 01:
Highest Train: 100.00
Highest Valid: 80.20
  Final Train: 100.00
   Final Test: 81.00
Split: 01, Run: 02
None time:  2.013328932924196
None Run 02:
Highest Train: 100.00
Highest Valid: 78.40
  Final Train: 100.00
   Final Test: 79.90
Split: 01, Run: 03
None time:  2.1582946290727705
None Run 03:
Highest Train: 100.00
Highest Valid: 77.60
  Final Train: 100.00
   Final Test: 78.20
run time now: 6.368106126785278
total time:  6.3955275469925255
None All runs:
Highest Train: 100.00 ± 0.00
Highest Valid: 78.73 ± 1.33
  Final Train: 100.00 ± 0.00
   Final Test: 79.70 ± 1.41
[I 2023-06-12 00:13:30,472] Trial 13 finished with value: 78.73333740234375 and parameters: {'Fwd': 9.541966400976271e-06, 'K': 8, 'alpha': 0.4, 'dropout': 0.7000000000000001, 'gnnepoch': 80, 'lambda1': 0.25, 'lambda2': 8.578666810804997, 'loop': 2, 'loss': 'CE', 'lr': 0.001941083134380361, 'softmaxF': False, 'useGCN': True, 'weight_decay': 0.0095959819049298, 'weightedloss': True}. Best is trial 12 with value: 79.26666259765625.
/home/wxy/miniconda3/lib/python3.10/site-packages/optuna/distributions.py:685: UserWarning: The distribution is specified by [0, 1.00001] and step=0.05, but the range is not divisible by `step`. It will be replaced by [0, 1.0].
  warnings.warn(
K:  8
alpha:  0.6000000000000001
lr:  0.008509880898413518
weight_decay:  7.785530720387934e-05
dropout:  0.5
fix split and run 3 times
Data: Data(x=[2708, 1433], y=[2708], train_mask=[2708], val_mask=[2708], test_mask=[2708], adj_t=[2708, 2708, nnz=10556])
num_train tensor(140)
num_noise 0
noise: tensor(0)
data feature 1433
ALTOPT(
  (lins): Sequential(
    (0): Linear(in_features=1433, out_features=64, bias=True)
    (1): BatchNorm1d(64, eps=1e-05, momentum=0.1, affine=True, track_running_stats=True)
    (2): Dropout(p=0.5, inplace=True)
    (3): ReLU(inplace=True)
    (4): Linear(in_features=64, out_features=7, bias=True)
    (5): LogSoftmax(dim=-1)
  )
  (prop): Propagation(K=8, mode=None, lambda1=None, lambda2=None, L21=True, alpha=0.6000000000000001)
  (gcn): GCN(
    (convs): ModuleList(
      (0): GCNConv(1433, 64)
      (1): GCNConv(64, 7)
    )
    (bns): ModuleList(
      (0): BatchNorm1d(64, eps=1e-05, momentum=0.1, affine=True, track_running_stats=True)
    )
    (output): LogSoftmax(dim=-1)
  )
)
propagate done
init label
Split: 01, Run: 01
None time:  0.69743955694139
None Run 01:
Highest Train: 100.00
Highest Valid: 68.00
  Final Train: 100.00
   Final Test: 69.50
Split: 01, Run: 02
None time:  0.7039375780150294
None Run 02:
Highest Train: 100.00
Highest Valid: 75.80
  Final Train: 100.00
   Final Test: 75.80
Split: 01, Run: 03
None time:  0.7756369300186634
None Run 03:
Highest Train: 100.00
Highest Valid: 76.80
  Final Train: 100.00
   Final Test: 75.50
run time now: 2.204113721847534
total time:  2.22804105700925
None All runs:
Highest Train: 100.00 ± 0.00
Highest Valid: 73.53 ± 4.82
  Final Train: 100.00 ± 0.00
   Final Test: 73.60 ± 3.55
[I 2023-06-12 00:13:33,125] Trial 14 finished with value: 73.53333282470703 and parameters: {'Fwd': 1.023487478480429e-06, 'K': 8, 'alpha': 0.6000000000000001, 'dropout': 0.5, 'gnnepoch': 40, 'lambda1': 0.15000000000000002, 'lambda2': 5.752815494485354, 'loop': 1, 'loss': 'CE', 'lr': 0.008509880898413518, 'softmaxF': False, 'useGCN': False, 'weight_decay': 7.785530720387934e-05, 'weightedloss': True}. Best is trial 12 with value: 79.26666259765625.
/home/wxy/miniconda3/lib/python3.10/site-packages/optuna/distributions.py:685: UserWarning: The distribution is specified by [0, 1.00001] and step=0.05, but the range is not divisible by `step`. It will be replaced by [0, 1.0].
  warnings.warn(
K:  4
alpha:  0.35000000000000003
lr:  0.0017926246788926496
weight_decay:  0.010139065767836151
dropout:  0.7000000000000001
fix split and run 3 times
Data: Data(x=[2708, 1433], y=[2708], train_mask=[2708], val_mask=[2708], test_mask=[2708], adj_t=[2708, 2708, nnz=10556])
num_train tensor(140)
num_noise 0
noise: tensor(0)
data feature 1433
ALTOPT(
  (lins): Sequential(
    (0): Linear(in_features=1433, out_features=64, bias=True)
    (1): BatchNorm1d(64, eps=1e-05, momentum=0.1, affine=True, track_running_stats=True)
    (2): Dropout(p=0.7000000000000001, inplace=True)
    (3): ReLU(inplace=True)
    (4): Linear(in_features=64, out_features=7, bias=True)
    (5): LogSoftmax(dim=-1)
  )
  (prop): Propagation(K=4, mode=None, lambda1=None, lambda2=None, L21=True, alpha=0.35000000000000003)
  (gcn): GCN(
    (convs): ModuleList(
      (0): GCNConv(1433, 64)
      (1): GCNConv(64, 7)
    )
    (bns): ModuleList(
      (0): BatchNorm1d(64, eps=1e-05, momentum=0.1, affine=True, track_running_stats=True)
    )
    (output): LogSoftmax(dim=-1)
  )
)
propagate done
init label
Split: 01, Run: 01
None time:  2.019657213939354
None Run 01:
Highest Train: 100.00
Highest Valid: 80.20
  Final Train: 100.00
   Final Test: 80.80
Split: 01, Run: 02
None time:  1.5364006177987903
None Run 02:
Highest Train: 100.00
Highest Valid: 78.60
  Final Train: 100.00
   Final Test: 79.70
Split: 01, Run: 03
None time:  2.034078281139955
None Run 03:
Highest Train: 100.00
Highest Valid: 77.00
  Final Train: 100.00
   Final Test: 77.80
run time now: 5.615306615829468
total time:  5.6346457751933485
None All runs:
Highest Train: 100.00 ± 0.00
Highest Valid: 78.60 ± 1.60
  Final Train: 100.00 ± 0.00
   Final Test: 79.43 ± 1.52
[I 2023-06-12 00:13:39,216] Trial 15 finished with value: 78.5999984741211 and parameters: {'Fwd': 0.00029110180176484163, 'K': 4, 'alpha': 0.35000000000000003, 'dropout': 0.7000000000000001, 'gnnepoch': 80, 'lambda1': 0.4, 'lambda2': 8.416868378747663, 'loop': 2, 'loss': 'CE', 'lr': 0.0017926246788926496, 'softmaxF': False, 'useGCN': True, 'weight_decay': 0.010139065767836151, 'weightedloss': True}. Best is trial 12 with value: 79.26666259765625.
/home/wxy/miniconda3/lib/python3.10/site-packages/optuna/distributions.py:685: UserWarning: The distribution is specified by [0, 1.00001] and step=0.05, but the range is not divisible by `step`. It will be replaced by [0, 1.0].
  warnings.warn(
K:  9
alpha:  0.30000000000000004
lr:  0.0016552232708709719
weight_decay:  1.0842156440137096e-06
dropout:  0.4
fix split and run 3 times
Data: Data(x=[2708, 1433], y=[2708], train_mask=[2708], val_mask=[2708], test_mask=[2708], adj_t=[2708, 2708, nnz=10556])
num_train tensor(140)
num_noise 0
noise: tensor(0)
data feature 1433
ALTOPT(
  (lins): Sequential(
    (0): Linear(in_features=1433, out_features=64, bias=True)
    (1): BatchNorm1d(64, eps=1e-05, momentum=0.1, affine=True, track_running_stats=True)
    (2): Dropout(p=0.4, inplace=True)
    (3): ReLU(inplace=True)
    (4): Linear(in_features=64, out_features=7, bias=True)
    (5): LogSoftmax(dim=-1)
  )
  (prop): Propagation(K=9, mode=None, lambda1=None, lambda2=None, L21=True, alpha=0.30000000000000004)
  (gcn): GCN(
    (convs): ModuleList(
      (0): GCNConv(1433, 64)
      (1): GCNConv(64, 7)
    )
    (bns): ModuleList(
      (0): BatchNorm1d(64, eps=1e-05, momentum=0.1, affine=True, track_running_stats=True)
    )
    (output): LogSoftmax(dim=-1)
  )
)
propagate done
init label
Split: 01, Run: 01
None time:  1.5762364699039608
None Run 01:
Highest Train: 100.00
Highest Valid: 74.40
  Final Train: 100.00
   Final Test: 73.30
Split: 01, Run: 02
None time:  1.5921655429992825
None Run 02:
Highest Train: 100.00
Highest Valid: 75.60
  Final Train: 100.00
   Final Test: 78.30
Split: 01, Run: 03
None time:  1.4846815878991038
None Run 03:
Highest Train: 100.00
Highest Valid: 76.20
  Final Train: 100.00
   Final Test: 76.50
run time now: 4.68160343170166
total time:  4.709953560028225
None All runs:
Highest Train: 100.00 ± 0.00
Highest Valid: 75.40 ± 0.92
  Final Train: 100.00 ± 0.00
   Final Test: 76.03 ± 2.53
[I 2023-06-12 00:13:44,382] Trial 16 finished with value: 75.4000015258789 and parameters: {'Fwd': 1.159087281148968e-05, 'K': 9, 'alpha': 0.30000000000000004, 'dropout': 0.4, 'gnnepoch': 110, 'lambda1': 0.65, 'lambda2': 6.752063313349325, 'loop': 1, 'loss': 'CE', 'lr': 0.0016552232708709719, 'softmaxF': True, 'useGCN': False, 'weight_decay': 1.0842156440137096e-06, 'weightedloss': True}. Best is trial 12 with value: 79.26666259765625.
/home/wxy/miniconda3/lib/python3.10/site-packages/optuna/distributions.py:685: UserWarning: The distribution is specified by [0, 1.00001] and step=0.05, but the range is not divisible by `step`. It will be replaced by [0, 1.0].
  warnings.warn(
K:  8
alpha:  0.75
lr:  0.0040860551931358085
weight_decay:  0.002491410702465506
dropout:  0.8
fix split and run 3 times
Data: Data(x=[2708, 1433], y=[2708], train_mask=[2708], val_mask=[2708], test_mask=[2708], adj_t=[2708, 2708, nnz=10556])
num_train tensor(140)
num_noise 0
noise: tensor(0)
data feature 1433
ALTOPT(
  (lins): Sequential(
    (0): Linear(in_features=1433, out_features=64, bias=True)
    (1): BatchNorm1d(64, eps=1e-05, momentum=0.1, affine=True, track_running_stats=True)
    (2): Dropout(p=0.8, inplace=True)
    (3): ReLU(inplace=True)
    (4): Linear(in_features=64, out_features=7, bias=True)
    (5): LogSoftmax(dim=-1)
  )
  (prop): Propagation(K=8, mode=None, lambda1=None, lambda2=None, L21=True, alpha=0.75)
  (gcn): GCN(
    (convs): ModuleList(
      (0): GCNConv(1433, 64)
      (1): GCNConv(64, 7)
    )
    (bns): ModuleList(
      (0): BatchNorm1d(64, eps=1e-05, momentum=0.1, affine=True, track_running_stats=True)
    )
    (output): LogSoftmax(dim=-1)
  )
)
propagate done
init label
Split: 01, Run: 01
None time:  1.9785754659678787
None Run 01:
Highest Train: 100.00
Highest Valid: 80.20
  Final Train: 100.00
   Final Test: 81.90
Split: 01, Run: 02
None time:  1.883380874991417
None Run 02:
Highest Train: 100.00
Highest Valid: 79.60
  Final Train: 100.00
   Final Test: 80.90
Split: 01, Run: 03
None time:  1.7845812330488116
None Run 03:
Highest Train: 100.00
Highest Valid: 79.00
  Final Train: 100.00
   Final Test: 79.80
run time now: 5.6728057861328125
total time:  5.73003876907751
None All runs:
Highest Train: 100.00 ± 0.00
Highest Valid: 79.60 ± 0.60
  Final Train: 100.00 ± 0.00
   Final Test: 80.87 ± 1.05
