[I 2023-06-11 23:36:21,218] Trial 251 finished with value: 70.93334197998047 and parameters: {'Fwd': 0.051477167908603516, 'K': 7, 'alpha': 0.55, 'dropout': 0.8, 'gnnepoch': 110, 'lambda1': 0.8500000000000001, 'lambda2': 3.7506356635320506, 'loop': 0, 'loss': 'CE', 'lr': 0.0023459774635670775, 'softmaxF': False, 'useGCN': True, 'weight_decay': 4.072810082655546e-06, 'weightedloss': True}. Best is trial 203 with value: 71.93333435058594.
/home/wxy/miniconda3/lib/python3.10/site-packages/optuna/distributions.py:685: UserWarning: The distribution is specified by [0, 1.00001] and step=0.05, but the range is not divisible by `step`. It will be replaced by [0, 1.0].
  warnings.warn(
K:  7
alpha:  0.6000000000000001
lr:  0.0024676552540834535
weight_decay:  4.573207654159793e-06
dropout:  0.8
fix split and run 3 times
Data: Data(x=[3327, 3703], y=[3327], train_mask=[3327], val_mask=[3327], test_mask=[3327], adj_t=[3327, 3327, nnz=9104])
num_train tensor(120)
num_noise 0
noise: tensor(0)
data feature 3703
ALTOPT(
  (lins): Sequential(
    (0): Linear(in_features=3703, out_features=64, bias=True)
    (1): BatchNorm1d(64, eps=1e-05, momentum=0.1, affine=True, track_running_stats=True)
    (2): Dropout(p=0.8, inplace=True)
    (3): ReLU(inplace=True)
    (4): Linear(in_features=64, out_features=6, bias=True)
    (5): LogSoftmax(dim=-1)
  )
  (prop): Propagation(K=7, mode=None, lambda1=None, lambda2=None, L21=True, alpha=0.6000000000000001)
  (gcn): GCN(
    (convs): ModuleList(
      (0): GCNConv(3703, 64)
      (1): GCNConv(64, 6)
    )
    (bns): ModuleList(
      (0): BatchNorm1d(64, eps=1e-05, momentum=0.1, affine=True, track_running_stats=True)
    )
    (output): LogSoftmax(dim=-1)
  )
)
propagate done
init label
Split: 01, Run: 01
None time:  1.0818262549582869
None Run 01:
Highest Train: 100.00
Highest Valid: 71.40
  Final Train: 100.00
   Final Test: 70.00
Split: 01, Run: 02
None time:  1.027495990972966
None Run 02:
Highest Train: 100.00
Highest Valid: 72.20
  Final Train: 100.00
   Final Test: 70.20
Split: 01, Run: 03
None time:  1.0245630210265517
None Run 03:
Highest Train: 100.00
Highest Valid: 71.40
  Final Train: 100.00
   Final Test: 69.00
run time now: 3.173021078109741
total time:  3.2294703640509397
None All runs:
Highest Train: 100.00 ± 0.00
Highest Valid: 71.67 ± 0.46
  Final Train: 100.00 ± 0.00
   Final Test: 69.73 ± 0.64
[I 2023-06-11 23:36:24,901] Trial 252 finished with value: 71.66666412353516 and parameters: {'Fwd': 1.9229732059057916e-05, 'K': 7, 'alpha': 0.6000000000000001, 'dropout': 0.8, 'gnnepoch': 120, 'lambda1': 0.8500000000000001, 'lambda2': 3.8517557586152997, 'loop': 0, 'loss': 'CE', 'lr': 0.0024676552540834535, 'softmaxF': False, 'useGCN': True, 'weight_decay': 4.573207654159793e-06, 'weightedloss': True}. Best is trial 203 with value: 71.93333435058594.
/home/wxy/miniconda3/lib/python3.10/site-packages/optuna/distributions.py:685: UserWarning: The distribution is specified by [0, 1.00001] and step=0.05, but the range is not divisible by `step`. It will be replaced by [0, 1.0].
  warnings.warn(
K:  6
alpha:  0.55
lr:  0.002183215841378363
weight_decay:  4.875582471344644e-06
dropout:  0.8
fix split and run 3 times
Data: Data(x=[3327, 3703], y=[3327], train_mask=[3327], val_mask=[3327], test_mask=[3327], adj_t=[3327, 3327, nnz=9104])
num_train tensor(120)
num_noise 0
noise: tensor(0)
data feature 3703
ALTOPT(
  (lins): Sequential(
    (0): Linear(in_features=3703, out_features=64, bias=True)
    (1): BatchNorm1d(64, eps=1e-05, momentum=0.1, affine=True, track_running_stats=True)
    (2): Dropout(p=0.8, inplace=True)
    (3): ReLU(inplace=True)
    (4): Linear(in_features=64, out_features=6, bias=True)
    (5): LogSoftmax(dim=-1)
  )
  (prop): Propagation(K=6, mode=None, lambda1=None, lambda2=None, L21=True, alpha=0.55)
  (gcn): GCN(
    (convs): ModuleList(
      (0): GCNConv(3703, 64)
      (1): GCNConv(64, 6)
    )
    (bns): ModuleList(
      (0): BatchNorm1d(64, eps=1e-05, momentum=0.1, affine=True, track_running_stats=True)
    )
    (output): LogSoftmax(dim=-1)
  )
)
propagate done
init label
Split: 01, Run: 01
None time:  0.987299975939095
None Run 01:
Highest Train: 100.00
Highest Valid: 71.60
  Final Train: 100.00
   Final Test: 69.80
Split: 01, Run: 02
None time:  1.0182122560217977
None Run 02:
Highest Train: 100.00
Highest Valid: 72.00
  Final Train: 100.00
   Final Test: 70.20
Split: 01, Run: 03
None time:  1.0270629371516407
None Run 03:
Highest Train: 100.00
Highest Valid: 71.40
  Final Train: 100.00
   Final Test: 70.70
run time now: 3.0711863040924072
total time:  3.118185125058517
None All runs:
Highest Train: 100.00 ± 0.00
Highest Valid: 71.67 ± 0.31
  Final Train: 100.00 ± 0.00
   Final Test: 70.23 ± 0.45
[I 2023-06-11 23:36:28,524] Trial 253 finished with value: 71.66666412353516 and parameters: {'Fwd': 1.5847959020262451e-06, 'K': 6, 'alpha': 0.55, 'dropout': 0.8, 'gnnepoch': 120, 'lambda1': 0.8500000000000001, 'lambda2': 4.685887492678019, 'loop': 0, 'loss': 'CE', 'lr': 0.002183215841378363, 'softmaxF': False, 'useGCN': True, 'weight_decay': 4.875582471344644e-06, 'weightedloss': True}. Best is trial 203 with value: 71.93333435058594.
/home/wxy/miniconda3/lib/python3.10/site-packages/optuna/distributions.py:685: UserWarning: The distribution is specified by [0, 1.00001] and step=0.05, but the range is not divisible by `step`. It will be replaced by [0, 1.0].
  warnings.warn(
K:  7
alpha:  0.5
lr:  0.002303327583535672
weight_decay:  3.396879194894232e-06
dropout:  0.7000000000000001
fix split and run 3 times
Data: Data(x=[3327, 3703], y=[3327], train_mask=[3327], val_mask=[3327], test_mask=[3327], adj_t=[3327, 3327, nnz=9104])
num_train tensor(120)
num_noise 0
noise: tensor(0)
data feature 3703
ALTOPT(
  (lins): Sequential(
    (0): Linear(in_features=3703, out_features=64, bias=True)
    (1): BatchNorm1d(64, eps=1e-05, momentum=0.1, affine=True, track_running_stats=True)
    (2): Dropout(p=0.7000000000000001, inplace=True)
    (3): ReLU(inplace=True)
    (4): Linear(in_features=64, out_features=6, bias=True)
    (5): LogSoftmax(dim=-1)
  )
  (prop): Propagation(K=7, mode=None, lambda1=None, lambda2=None, L21=True, alpha=0.5)
  (gcn): GCN(
    (convs): ModuleList(
      (0): GCNConv(3703, 64)
      (1): GCNConv(64, 6)
    )
    (bns): ModuleList(
      (0): BatchNorm1d(64, eps=1e-05, momentum=0.1, affine=True, track_running_stats=True)
    )
    (output): LogSoftmax(dim=-1)
  )
)
propagate done
init label
Split: 01, Run: 01
None time:  1.0708034508861601
None Run 01:
Highest Train: 100.00
Highest Valid: 71.80
  Final Train: 100.00
   Final Test: 70.00
Split: 01, Run: 02
None time:  1.1463110940530896
None Run 02:
Highest Train: 100.00
Highest Valid: 71.60
  Final Train: 100.00
   Final Test: 69.60
Split: 01, Run: 03
None time:  1.11542206001468
None Run 03:
Highest Train: 100.00
Highest Valid: 70.80
  Final Train: 99.17
   Final Test: 70.00
run time now: 3.3764939308166504
total time:  3.4270242219790816
None All runs:
Highest Train: 100.00 ± 0.00
Highest Valid: 71.40 ± 0.53
  Final Train: 99.72 ± 0.48
   Final Test: 69.87 ± 0.23
[I 2023-06-11 23:36:32,487] Trial 254 finished with value: 71.4000015258789 and parameters: {'Fwd': 0.0006568866588017064, 'K': 7, 'alpha': 0.5, 'dropout': 0.7000000000000001, 'gnnepoch': 120, 'lambda1': 0.8500000000000001, 'lambda2': 4.924436575419147, 'loop': 0, 'loss': 'CE', 'lr': 0.002303327583535672, 'softmaxF': False, 'useGCN': True, 'weight_decay': 3.396879194894232e-06, 'weightedloss': True}. Best is trial 203 with value: 71.93333435058594.
/home/wxy/miniconda3/lib/python3.10/site-packages/optuna/distributions.py:685: UserWarning: The distribution is specified by [0, 1.00001] and step=0.05, but the range is not divisible by `step`. It will be replaced by [0, 1.0].
  warnings.warn(
K:  7
alpha:  0.45
lr:  0.001919460220615089
weight_decay:  6.108890803159929e-06
dropout:  0.8
fix split and run 3 times
Data: Data(x=[3327, 3703], y=[3327], train_mask=[3327], val_mask=[3327], test_mask=[3327], adj_t=[3327, 3327, nnz=9104])
num_train tensor(120)
num_noise 0
noise: tensor(0)
data feature 3703
ALTOPT(
  (lins): Sequential(
    (0): Linear(in_features=3703, out_features=64, bias=True)
    (1): BatchNorm1d(64, eps=1e-05, momentum=0.1, affine=True, track_running_stats=True)
    (2): Dropout(p=0.8, inplace=True)
    (3): ReLU(inplace=True)
    (4): Linear(in_features=64, out_features=6, bias=True)
    (5): LogSoftmax(dim=-1)
  )
  (prop): Propagation(K=7, mode=None, lambda1=None, lambda2=None, L21=True, alpha=0.45)
  (gcn): GCN(
    (convs): ModuleList(
      (0): GCNConv(3703, 64)
      (1): GCNConv(64, 6)
    )
    (bns): ModuleList(
      (0): BatchNorm1d(64, eps=1e-05, momentum=0.1, affine=True, track_running_stats=True)
    )
    (output): LogSoftmax(dim=-1)
  )
)
propagate done
init label
Split: 01, Run: 01
None time:  0.2281210341025144
None Run 01:
Highest Train: 100.00
Highest Valid: 66.40
  Final Train: 100.00
   Final Test: 65.20
Split: 01, Run: 02
None time:  0.2376260939054191
None Run 02:
Highest Train: 100.00
Highest Valid: 66.60
  Final Train: 100.00
   Final Test: 66.10
Split: 01, Run: 03
None time:  0.3151553049683571
None Run 03:
Highest Train: 100.00
Highest Valid: 65.60
  Final Train: 100.00
   Final Test: 66.10
run time now: 0.8214969635009766
total time:  0.8857250139117241
None All runs:
Highest Train: 100.00 ± 0.00
Highest Valid: 66.20 ± 0.53
  Final Train: 100.00 ± 0.00
   Final Test: 65.80 ± 0.52
[I 2023-06-11 23:36:33,894] Trial 255 finished with value: 66.20000457763672 and parameters: {'Fwd': 9.347060683185072e-06, 'K': 7, 'alpha': 0.45, 'dropout': 0.8, 'gnnepoch': 10, 'lambda1': 0.8500000000000001, 'lambda2': 4.228016273625593, 'loop': 0, 'loss': 'CE', 'lr': 0.001919460220615089, 'softmaxF': False, 'useGCN': True, 'weight_decay': 6.108890803159929e-06, 'weightedloss': True}. Best is trial 203 with value: 71.93333435058594.
/home/wxy/miniconda3/lib/python3.10/site-packages/optuna/distributions.py:685: UserWarning: The distribution is specified by [0, 1.00001] and step=0.05, but the range is not divisible by `step`. It will be replaced by [0, 1.0].
  warnings.warn(
K:  7
alpha:  0.45
lr:  0.002552718562968348
weight_decay:  1.0398629939159598e-05
dropout:  0.8
fix split and run 3 times
Data: Data(x=[3327, 3703], y=[3327], train_mask=[3327], val_mask=[3327], test_mask=[3327], adj_t=[3327, 3327, nnz=9104])
num_train tensor(120)
num_noise 0
noise: tensor(0)
data feature 3703
ALTOPT(
  (lins): Sequential(
    (0): Linear(in_features=3703, out_features=64, bias=True)
    (1): BatchNorm1d(64, eps=1e-05, momentum=0.1, affine=True, track_running_stats=True)
    (2): Dropout(p=0.8, inplace=True)
    (3): ReLU(inplace=True)
    (4): Linear(in_features=64, out_features=6, bias=True)
    (5): LogSoftmax(dim=-1)
  )
  (prop): Propagation(K=7, mode=None, lambda1=None, lambda2=None, L21=True, alpha=0.45)
  (gcn): GCN(
    (convs): ModuleList(
      (0): GCNConv(3703, 64)
      (1): GCNConv(64, 6)
    )
    (bns): ModuleList(
      (0): BatchNorm1d(64, eps=1e-05, momentum=0.1, affine=True, track_running_stats=True)
    )
    (output): LogSoftmax(dim=-1)
  )
)
propagate done
init label
Split: 01, Run: 01
None time:  1.0838332138955593
None Run 01:
Highest Train: 100.00
Highest Valid: 71.40
  Final Train: 100.00
   Final Test: 69.90
Split: 01, Run: 02
None time:  1.1891544838435948
None Run 02:
Highest Train: 100.00
Highest Valid: 72.20
  Final Train: 100.00
   Final Test: 70.00
Split: 01, Run: 03
None time:  1.0336050880141556
None Run 03:
Highest Train: 100.00
Highest Valid: 71.20
  Final Train: 100.00
   Final Test: 69.00
run time now: 3.3501622676849365
total time:  3.3950556328054518
None All runs:
Highest Train: 100.00 ± 0.00
Highest Valid: 71.60 ± 0.53
  Final Train: 100.00 ± 0.00
   Final Test: 69.63 ± 0.55
[I 2023-06-11 23:36:37,718] Trial 256 finished with value: 71.60000610351562 and parameters: {'Fwd': 0.001249118911248178, 'K': 7, 'alpha': 0.45, 'dropout': 0.8, 'gnnepoch': 120, 'lambda1': 0.8, 'lambda2': 3.8535989185387396, 'loop': 0, 'loss': 'CE', 'lr': 0.002552718562968348, 'softmaxF': False, 'useGCN': True, 'weight_decay': 1.0398629939159598e-05, 'weightedloss': True}. Best is trial 203 with value: 71.93333435058594.
/home/wxy/miniconda3/lib/python3.10/site-packages/optuna/distributions.py:685: UserWarning: The distribution is specified by [0, 1.00001] and step=0.05, but the range is not divisible by `step`. It will be replaced by [0, 1.0].
  warnings.warn(
K:  6
alpha:  0.5
lr:  0.0015846224665558698
weight_decay:  5.286921159987652e-06
dropout:  0.8
fix split and run 3 times
Data: Data(x=[3327, 3703], y=[3327], train_mask=[3327], val_mask=[3327], test_mask=[3327], adj_t=[3327, 3327, nnz=9104])
num_train tensor(120)
num_noise 0
noise: tensor(0)
data feature 3703
ALTOPT(
  (lins): Sequential(
    (0): Linear(in_features=3703, out_features=64, bias=True)
    (1): BatchNorm1d(64, eps=1e-05, momentum=0.1, affine=True, track_running_stats=True)
    (2): Dropout(p=0.8, inplace=True)
    (3): ReLU(inplace=True)
    (4): Linear(in_features=64, out_features=6, bias=True)
    (5): LogSoftmax(dim=-1)
  )
  (prop): Propagation(K=6, mode=None, lambda1=None, lambda2=None, L21=True, alpha=0.5)
  (gcn): GCN(
    (convs): ModuleList(
      (0): GCNConv(3703, 64)
      (1): GCNConv(64, 6)
    )
    (bns): ModuleList(
      (0): BatchNorm1d(64, eps=1e-05, momentum=0.1, affine=True, track_running_stats=True)
    )
    (output): LogSoftmax(dim=-1)
  )
)
propagate done
init label
Split: 01, Run: 01
None time:  0.9336614389903843
None Run 01:
Highest Train: 100.00
Highest Valid: 71.40
  Final Train: 100.00
   Final Test: 69.80
Split: 01, Run: 02
None time:  1.0410625680815428
None Run 02:
Highest Train: 100.00
Highest Valid: 68.80
  Final Train: 100.00
   Final Test: 68.70
Split: 01, Run: 03
None time:  0.8953167849685997
None Run 03:
Highest Train: 100.00
Highest Valid: 71.40
  Final Train: 100.00
   Final Test: 70.30
run time now: 2.9150748252868652
total time:  2.972065446898341
None All runs:
Highest Train: 100.00 ± 0.00
Highest Valid: 70.53 ± 1.50
  Final Train: 100.00 ± 0.00
   Final Test: 69.60 ± 0.82
[I 2023-06-11 23:36:41,163] Trial 257 finished with value: 70.53333282470703 and parameters: {'Fwd': 0.002723954588858837, 'K': 6, 'alpha': 0.5, 'dropout': 0.8, 'gnnepoch': 110, 'lambda1': 0.8500000000000001, 'lambda2': 4.411401191693313, 'loop': 0, 'loss': 'CE', 'lr': 0.0015846224665558698, 'softmaxF': False, 'useGCN': True, 'weight_decay': 5.286921159987652e-06, 'weightedloss': True}. Best is trial 203 with value: 71.93333435058594.
/home/wxy/miniconda3/lib/python3.10/site-packages/optuna/distributions.py:685: UserWarning: The distribution is specified by [0, 1.00001] and step=0.05, but the range is not divisible by `step`. It will be replaced by [0, 1.0].
  warnings.warn(
K:  7
alpha:  0.55
lr:  0.002200934758787271
weight_decay:  8.344723607214155e-06
dropout:  0.8
fix split and run 3 times
Data: Data(x=[3327, 3703], y=[3327], train_mask=[3327], val_mask=[3327], test_mask=[3327], adj_t=[3327, 3327, nnz=9104])
num_train tensor(120)
num_noise 0
noise: tensor(0)
data feature 3703
ALTOPT(
  (lins): Sequential(
    (0): Linear(in_features=3703, out_features=64, bias=True)
    (1): BatchNorm1d(64, eps=1e-05, momentum=0.1, affine=True, track_running_stats=True)
    (2): Dropout(p=0.8, inplace=True)
    (3): ReLU(inplace=True)
    (4): Linear(in_features=64, out_features=6, bias=True)
    (5): LogSoftmax(dim=-1)
  )
  (prop): Propagation(K=7, mode=None, lambda1=None, lambda2=None, L21=True, alpha=0.55)
  (gcn): GCN(
    (convs): ModuleList(
      (0): GCNConv(3703, 64)
      (1): GCNConv(64, 6)
    )
    (bns): ModuleList(
      (0): BatchNorm1d(64, eps=1e-05, momentum=0.1, affine=True, track_running_stats=True)
    )
    (output): LogSoftmax(dim=-1)
  )
)
propagate done
init label
Split: 01, Run: 01
None time:  0.724620508030057
None Run 01:
Highest Train: 100.00
Highest Valid: 54.20
  Final Train: 98.33
   Final Test: 54.60
Split: 01, Run: 02
None time:  0.7861450300551951
None Run 02:
Highest Train: 100.00
Highest Valid: 61.00
  Final Train: 98.33
   Final Test: 57.90
Split: 01, Run: 03
None time:  0.7760296510532498
None Run 03:
Highest Train: 100.00
Highest Valid: 51.40
  Final Train: 98.33
   Final Test: 54.00
run time now: 2.3270318508148193
total time:  2.377724678022787
None All runs:
Highest Train: 100.00 ± 0.00
Highest Valid: 55.53 ± 4.94
  Final Train: 98.33 ± 0.00
   Final Test: 55.50 ± 2.10
[I 2023-06-11 23:36:44,117] Trial 258 finished with value: 55.5333366394043 and parameters: {'Fwd': 2.1860579735665113e-06, 'K': 7, 'alpha': 0.55, 'dropout': 0.8, 'gnnepoch': 120, 'lambda1': 0.8, 'lambda2': 4.081130640381367, 'loop': 0, 'loss': 'CE', 'lr': 0.002200934758787271, 'softmaxF': False, 'useGCN': False, 'weight_decay': 8.344723607214155e-06, 'weightedloss': True}. Best is trial 203 with value: 71.93333435058594.
/home/wxy/miniconda3/lib/python3.10/site-packages/optuna/distributions.py:685: UserWarning: The distribution is specified by [0, 1.00001] and step=0.05, but the range is not divisible by `step`. It will be replaced by [0, 1.0].
  warnings.warn(
K:  7
alpha:  0.65
lr:  0.0018584418907437378
weight_decay:  3.4387995450016326e-06
dropout:  0.8
fix split and run 3 times
Data: Data(x=[3327, 3703], y=[3327], train_mask=[3327], val_mask=[3327], test_mask=[3327], adj_t=[3327, 3327, nnz=9104])
num_train tensor(120)
num_noise 0
noise: tensor(0)
data feature 3703
ALTOPT(
  (lins): Sequential(
    (0): Linear(in_features=3703, out_features=64, bias=True)
    (1): BatchNorm1d(64, eps=1e-05, momentum=0.1, affine=True, track_running_stats=True)
    (2): Dropout(p=0.8, inplace=True)
    (3): ReLU(inplace=True)
    (4): Linear(in_features=64, out_features=6, bias=True)
    (5): LogSoftmax(dim=-1)
  )
  (prop): Propagation(K=7, mode=None, lambda1=None, lambda2=None, L21=True, alpha=0.65)
  (gcn): GCN(
    (convs): ModuleList(
      (0): GCNConv(3703, 64)
      (1): GCNConv(64, 6)
    )
    (bns): ModuleList(
      (0): BatchNorm1d(64, eps=1e-05, momentum=0.1, affine=True, track_running_stats=True)
    )
    (output): LogSoftmax(dim=-1)
  )
)
propagate done
init label
Split: 01, Run: 01
None time:  1.0321196720469743
None Run 01:
Highest Train: 100.00
Highest Valid: 71.20
  Final Train: 100.00
   Final Test: 69.90
Split: 01, Run: 02
None time:  1.1284774809610099
None Run 02:
Highest Train: 100.00
Highest Valid: 71.60
  Final Train: 100.00
   Final Test: 70.20
Split: 01, Run: 03
None time:  1.0371268677990884
None Run 03:
Highest Train: 100.00
Highest Valid: 71.80
  Final Train: 100.00
   Final Test: 70.10
run time now: 3.236530065536499
total time:  3.280774886952713
None All runs:
Highest Train: 100.00 ± 0.00
Highest Valid: 71.53 ± 0.31
  Final Train: 100.00 ± 0.00
   Final Test: 70.07 ± 0.15
[I 2023-06-11 23:36:47,951] Trial 259 finished with value: 71.53333282470703 and parameters: {'Fwd': 0.03132793986391977, 'K': 7, 'alpha': 0.65, 'dropout': 0.8, 'gnnepoch': 120, 'lambda1': 0.75, 'lambda2': 3.7279658298456724, 'loop': 0, 'loss': 'CE', 'lr': 0.0018584418907437378, 'softmaxF': False, 'useGCN': True, 'weight_decay': 3.4387995450016326e-06, 'weightedloss': True}. Best is trial 203 with value: 71.93333435058594.
/home/wxy/miniconda3/lib/python3.10/site-packages/optuna/distributions.py:685: UserWarning: The distribution is specified by [0, 1.00001] and step=0.05, but the range is not divisible by `step`. It will be replaced by [0, 1.0].
  warnings.warn(
K:  7
alpha:  0.5
lr:  0.002500644949264951
weight_decay:  4.414093735553406e-06
dropout:  0.8
fix split and run 3 times
Data: Data(x=[3327, 3703], y=[3327], train_mask=[3327], val_mask=[3327], test_mask=[3327], adj_t=[3327, 3327, nnz=9104])
num_train tensor(120)
num_noise 0
noise: tensor(0)
data feature 3703
ALTOPT(
  (lins): Sequential(
    (0): Linear(in_features=3703, out_features=64, bias=True)
    (1): BatchNorm1d(64, eps=1e-05, momentum=0.1, affine=True, track_running_stats=True)
    (2): Dropout(p=0.8, inplace=True)
    (3): ReLU(inplace=True)
    (4): Linear(in_features=64, out_features=6, bias=True)
    (5): LogSoftmax(dim=-1)
  )
  (prop): Propagation(K=7, mode=None, lambda1=None, lambda2=None, L21=True, alpha=0.5)
  (gcn): GCN(
    (convs): ModuleList(
      (0): GCNConv(3703, 64)
      (1): GCNConv(64, 6)
    )
    (bns): ModuleList(
      (0): BatchNorm1d(64, eps=1e-05, momentum=0.1, affine=True, track_running_stats=True)
    )
    (output): LogSoftmax(dim=-1)
  )
)
propagate done
init label
Split: 01, Run: 01
None time:  0.9985637271311134
None Run 01:
Highest Train: 100.00
Highest Valid: 71.40
  Final Train: 100.00
   Final Test: 69.90
Split: 01, Run: 02
None time:  1.068900265963748
None Run 02:
Highest Train: 100.00
Highest Valid: 72.20
  Final Train: 100.00
   Final Test: 70.20
Split: 01, Run: 03
None time:  1.0861148568801582
None Run 03:
Highest Train: 100.00
Highest Valid: 71.20
  Final Train: 100.00
   Final Test: 69.50
run time now: 3.193467855453491
total time:  3.2527540680021048
None All runs:
Highest Train: 100.00 ± 0.00
Highest Valid: 71.60 ± 0.53
  Final Train: 100.00 ± 0.00
   Final Test: 69.87 ± 0.35
