[I 2023-06-11 23:34:11,903] Trial 215 finished with value: 71.73332977294922 and parameters: {'Fwd': 0.024887469382414037, 'K': 8, 'alpha': 0.5, 'dropout': 0.8, 'gnnepoch': 120, 'lambda1': 0.8, 'lambda2': 4.40337696604908, 'loop': 0, 'loss': 'CE', 'lr': 0.002132593786761777, 'softmaxF': False, 'useGCN': True, 'weight_decay': 7.767758451318654e-06, 'weightedloss': True}. Best is trial 203 with value: 71.93333435058594.
/home/wxy/miniconda3/lib/python3.10/site-packages/optuna/distributions.py:685: UserWarning: The distribution is specified by [0, 1.00001] and step=0.05, but the range is not divisible by `step`. It will be replaced by [0, 1.0].
  warnings.warn(
K:  8
alpha:  0.5
lr:  0.002093304191282175
weight_decay:  9.78056839175554e-06
dropout:  0.8
fix split and run 3 times
Data: Data(x=[3327, 3703], y=[3327], train_mask=[3327], val_mask=[3327], test_mask=[3327], adj_t=[3327, 3327, nnz=9104])
num_train tensor(120)
num_noise 0
noise: tensor(0)
data feature 3703
ALTOPT(
  (lins): Sequential(
    (0): Linear(in_features=3703, out_features=64, bias=True)
    (1): BatchNorm1d(64, eps=1e-05, momentum=0.1, affine=True, track_running_stats=True)
    (2): Dropout(p=0.8, inplace=True)
    (3): ReLU(inplace=True)
    (4): Linear(in_features=64, out_features=6, bias=True)
    (5): LogSoftmax(dim=-1)
  )
  (prop): Propagation(K=8, mode=None, lambda1=None, lambda2=None, L21=True, alpha=0.5)
  (gcn): GCN(
    (convs): ModuleList(
      (0): GCNConv(3703, 64)
      (1): GCNConv(64, 6)
    )
    (bns): ModuleList(
      (0): BatchNorm1d(64, eps=1e-05, momentum=0.1, affine=True, track_running_stats=True)
    )
    (output): LogSoftmax(dim=-1)
  )
)
propagate done
init label
Split: 01, Run: 01
None time:  1.0616204380057752
None Run 01:
Highest Train: 100.00
Highest Valid: 71.20
  Final Train: 100.00
   Final Test: 69.80
Split: 01, Run: 02
None time:  1.0255082650110126
None Run 02:
Highest Train: 100.00
Highest Valid: 72.80
  Final Train: 100.00
   Final Test: 70.00
Split: 01, Run: 03
None time:  1.070111169014126
None Run 03:
Highest Train: 100.00
Highest Valid: 71.80
  Final Train: 100.00
   Final Test: 70.60
run time now: 3.197627305984497
total time:  3.242262294050306
None All runs:
Highest Train: 100.00 ± 0.00
Highest Valid: 71.93 ± 0.81
  Final Train: 100.00 ± 0.00
   Final Test: 70.13 ± 0.42
[I 2023-06-11 23:34:15,611] Trial 216 finished with value: 71.93333435058594 and parameters: {'Fwd': 0.022034772984311255, 'K': 8, 'alpha': 0.5, 'dropout': 0.8, 'gnnepoch': 120, 'lambda1': 0.8, 'lambda2': 4.40366319890929, 'loop': 0, 'loss': 'CE', 'lr': 0.002093304191282175, 'softmaxF': False, 'useGCN': True, 'weight_decay': 9.78056839175554e-06, 'weightedloss': True}. Best is trial 203 with value: 71.93333435058594.
/home/wxy/miniconda3/lib/python3.10/site-packages/optuna/distributions.py:685: UserWarning: The distribution is specified by [0, 1.00001] and step=0.05, but the range is not divisible by `step`. It will be replaced by [0, 1.0].
  warnings.warn(
K:  8
alpha:  0.5
lr:  0.0021472179793292794
weight_decay:  8.111144626880768e-06
dropout:  0.8
fix split and run 3 times
Data: Data(x=[3327, 3703], y=[3327], train_mask=[3327], val_mask=[3327], test_mask=[3327], adj_t=[3327, 3327, nnz=9104])
num_train tensor(120)
num_noise 0
noise: tensor(0)
data feature 3703
ALTOPT(
  (lins): Sequential(
    (0): Linear(in_features=3703, out_features=64, bias=True)
    (1): BatchNorm1d(64, eps=1e-05, momentum=0.1, affine=True, track_running_stats=True)
    (2): Dropout(p=0.8, inplace=True)
    (3): ReLU(inplace=True)
    (4): Linear(in_features=64, out_features=6, bias=True)
    (5): LogSoftmax(dim=-1)
  )
  (prop): Propagation(K=8, mode=None, lambda1=None, lambda2=None, L21=True, alpha=0.5)
  (gcn): GCN(
    (convs): ModuleList(
      (0): GCNConv(3703, 64)
      (1): GCNConv(64, 6)
    )
    (bns): ModuleList(
      (0): BatchNorm1d(64, eps=1e-05, momentum=0.1, affine=True, track_running_stats=True)
    )
    (output): LogSoftmax(dim=-1)
  )
)
propagate done
init label
Split: 01, Run: 01
None time:  1.0460368460044265
None Run 01:
Highest Train: 100.00
Highest Valid: 71.20
  Final Train: 100.00
   Final Test: 69.70
Split: 01, Run: 02
None time:  0.9925603410229087
None Run 02:
Highest Train: 100.00
Highest Valid: 72.60
  Final Train: 100.00
   Final Test: 70.00
Split: 01, Run: 03
None time:  1.0878187951166183
None Run 03:
Highest Train: 100.00
Highest Valid: 71.80
  Final Train: 100.00
   Final Test: 70.00
run time now: 3.167316198348999
total time:  3.2174036600627005
None All runs:
Highest Train: 100.00 ± 0.00
Highest Valid: 71.87 ± 0.70
  Final Train: 100.00 ± 0.00
   Final Test: 69.90 ± 0.17
[I 2023-06-11 23:34:19,258] Trial 217 finished with value: 71.86666870117188 and parameters: {'Fwd': 0.027606076632545357, 'K': 8, 'alpha': 0.5, 'dropout': 0.8, 'gnnepoch': 120, 'lambda1': 0.8, 'lambda2': 4.439431566208498, 'loop': 0, 'loss': 'CE', 'lr': 0.0021472179793292794, 'softmaxF': False, 'useGCN': True, 'weight_decay': 8.111144626880768e-06, 'weightedloss': True}. Best is trial 203 with value: 71.93333435058594.
/home/wxy/miniconda3/lib/python3.10/site-packages/optuna/distributions.py:685: UserWarning: The distribution is specified by [0, 1.00001] and step=0.05, but the range is not divisible by `step`. It will be replaced by [0, 1.0].
  warnings.warn(
K:  8
alpha:  0.5
lr:  0.0019365450470663328
weight_decay:  1.0917820391798448e-05
dropout:  0.7000000000000001
fix split and run 3 times
Data: Data(x=[3327, 3703], y=[3327], train_mask=[3327], val_mask=[3327], test_mask=[3327], adj_t=[3327, 3327, nnz=9104])
num_train tensor(120)
num_noise 0
noise: tensor(0)
data feature 3703
ALTOPT(
  (lins): Sequential(
    (0): Linear(in_features=3703, out_features=64, bias=True)
    (1): BatchNorm1d(64, eps=1e-05, momentum=0.1, affine=True, track_running_stats=True)
    (2): Dropout(p=0.7000000000000001, inplace=True)
    (3): ReLU(inplace=True)
    (4): Linear(in_features=64, out_features=6, bias=True)
    (5): LogSoftmax(dim=-1)
  )
  (prop): Propagation(K=8, mode=None, lambda1=None, lambda2=None, L21=True, alpha=0.5)
  (gcn): GCN(
    (convs): ModuleList(
      (0): GCNConv(3703, 64)
      (1): GCNConv(64, 6)
    )
    (bns): ModuleList(
      (0): BatchNorm1d(64, eps=1e-05, momentum=0.1, affine=True, track_running_stats=True)
    )
    (output): LogSoftmax(dim=-1)
  )
)
propagate done
init label
Split: 01, Run: 01
None time:  1.0150274669285864
None Run 01:
Highest Train: 100.00
Highest Valid: 71.40
  Final Train: 100.00
   Final Test: 69.70
Split: 01, Run: 02
None time:  1.0906175929121673
None Run 02:
Highest Train: 100.00
Highest Valid: 72.00
  Final Train: 100.00
   Final Test: 70.20
Split: 01, Run: 03
None time:  1.2627518919762224
None Run 03:
Highest Train: 100.00
Highest Valid: 71.20
  Final Train: 100.00
   Final Test: 69.80
run time now: 3.4109463691711426
total time:  3.472537104971707
None All runs:
Highest Train: 100.00 ± 0.00
Highest Valid: 71.53 ± 0.42
  Final Train: 100.00 ± 0.00
   Final Test: 69.90 ± 0.26
[I 2023-06-11 23:34:23,163] Trial 218 finished with value: 71.53333282470703 and parameters: {'Fwd': 0.027896229372928627, 'K': 8, 'alpha': 0.5, 'dropout': 0.7000000000000001, 'gnnepoch': 120, 'lambda1': 0.8, 'lambda2': 4.617845486312129, 'loop': 0, 'loss': 'CE', 'lr': 0.0019365450470663328, 'softmaxF': False, 'useGCN': True, 'weight_decay': 1.0917820391798448e-05, 'weightedloss': True}. Best is trial 203 with value: 71.93333435058594.
/home/wxy/miniconda3/lib/python3.10/site-packages/optuna/distributions.py:685: UserWarning: The distribution is specified by [0, 1.00001] and step=0.05, but the range is not divisible by `step`. It will be replaced by [0, 1.0].
  warnings.warn(
K:  8
alpha:  0.55
lr:  0.0017751772665489192
weight_decay:  8.619189970147233e-06
dropout:  0.8
fix split and run 3 times
Data: Data(x=[3327, 3703], y=[3327], train_mask=[3327], val_mask=[3327], test_mask=[3327], adj_t=[3327, 3327, nnz=9104])
num_train tensor(120)
num_noise 0
noise: tensor(0)
data feature 3703
ALTOPT(
  (lins): Sequential(
    (0): Linear(in_features=3703, out_features=64, bias=True)
    (1): BatchNorm1d(64, eps=1e-05, momentum=0.1, affine=True, track_running_stats=True)
    (2): Dropout(p=0.8, inplace=True)
    (3): ReLU(inplace=True)
    (4): Linear(in_features=64, out_features=6, bias=True)
    (5): LogSoftmax(dim=-1)
  )
  (prop): Propagation(K=8, mode=None, lambda1=None, lambda2=None, L21=True, alpha=0.55)
  (gcn): GCN(
    (convs): ModuleList(
      (0): GCNConv(3703, 64)
      (1): GCNConv(64, 6)
    )
    (bns): ModuleList(
      (0): BatchNorm1d(64, eps=1e-05, momentum=0.1, affine=True, track_running_stats=True)
    )
    (output): LogSoftmax(dim=-1)
  )
)
propagate done
init label
Split: 01, Run: 01
None time:  1.0420964208897203
None Run 01:
Highest Train: 100.00
Highest Valid: 71.20
  Final Train: 100.00
   Final Test: 69.70
Split: 01, Run: 02
None time:  1.021805264055729
None Run 02:
Highest Train: 100.00
Highest Valid: 71.80
  Final Train: 100.00
   Final Test: 69.90
Split: 01, Run: 03
None time:  0.9941811240278184
None Run 03:
Highest Train: 100.00
Highest Valid: 72.00
  Final Train: 100.00
   Final Test: 69.90
run time now: 3.099616050720215
total time:  3.160962395137176
None All runs:
Highest Train: 100.00 ± 0.00
Highest Valid: 71.67 ± 0.42
  Final Train: 100.00 ± 0.00
   Final Test: 69.83 ± 0.12
[I 2023-06-11 23:34:26,780] Trial 219 finished with value: 71.66666412353516 and parameters: {'Fwd': 0.0372326691061642, 'K': 8, 'alpha': 0.55, 'dropout': 0.8, 'gnnepoch': 120, 'lambda1': 0.8500000000000001, 'lambda2': 4.288001401252315, 'loop': 0, 'loss': 'CE', 'lr': 0.0017751772665489192, 'softmaxF': False, 'useGCN': True, 'weight_decay': 8.619189970147233e-06, 'weightedloss': True}. Best is trial 203 with value: 71.93333435058594.
/home/wxy/miniconda3/lib/python3.10/site-packages/optuna/distributions.py:685: UserWarning: The distribution is specified by [0, 1.00001] and step=0.05, but the range is not divisible by `step`. It will be replaced by [0, 1.0].
  warnings.warn(
K:  7
alpha:  0.55
lr:  0.0020878034418999394
weight_decay:  5.988798259276569e-06
dropout:  0.8
fix split and run 3 times
Data: Data(x=[3327, 3703], y=[3327], train_mask=[3327], val_mask=[3327], test_mask=[3327], adj_t=[3327, 3327, nnz=9104])
num_train tensor(120)
num_noise 0
noise: tensor(0)
data feature 3703
ALTOPT(
  (lins): Sequential(
    (0): Linear(in_features=3703, out_features=64, bias=True)
    (1): BatchNorm1d(64, eps=1e-05, momentum=0.1, affine=True, track_running_stats=True)
    (2): Dropout(p=0.8, inplace=True)
    (3): ReLU(inplace=True)
    (4): Linear(in_features=64, out_features=6, bias=True)
    (5): LogSoftmax(dim=-1)
  )
  (prop): Propagation(K=7, mode=None, lambda1=None, lambda2=None, L21=True, alpha=0.55)
  (gcn): GCN(
    (convs): ModuleList(
      (0): GCNConv(3703, 64)
      (1): GCNConv(64, 6)
    )
    (bns): ModuleList(
      (0): BatchNorm1d(64, eps=1e-05, momentum=0.1, affine=True, track_running_stats=True)
    )
    (output): LogSoftmax(dim=-1)
  )
)
propagate done
init label
Split: 01, Run: 01
None time:  1.0495812899898738
None Run 01:
Highest Train: 100.00
Highest Valid: 71.40
  Final Train: 100.00
   Final Test: 69.60
Split: 01, Run: 02
None time:  0.9760140981525183
None Run 02:
Highest Train: 100.00
Highest Valid: 72.40
  Final Train: 100.00
   Final Test: 70.10
Split: 01, Run: 03
None time:  1.0635714989621192
None Run 03:
Highest Train: 100.00
Highest Valid: 71.60
  Final Train: 100.00
   Final Test: 69.80
run time now: 3.1298811435699463
total time:  3.1849759379401803
None All runs:
Highest Train: 100.00 ± 0.00
Highest Valid: 71.80 ± 0.53
  Final Train: 100.00 ± 0.00
   Final Test: 69.83 ± 0.25
[I 2023-06-11 23:34:30,423] Trial 220 finished with value: 71.79999542236328 and parameters: {'Fwd': 0.01996618019422925, 'K': 7, 'alpha': 0.55, 'dropout': 0.8, 'gnnepoch': 120, 'lambda1': 0.8, 'lambda2': 4.491844874291817, 'loop': 0, 'loss': 'CE', 'lr': 0.0020878034418999394, 'softmaxF': False, 'useGCN': True, 'weight_decay': 5.988798259276569e-06, 'weightedloss': True}. Best is trial 203 with value: 71.93333435058594.
/home/wxy/miniconda3/lib/python3.10/site-packages/optuna/distributions.py:685: UserWarning: The distribution is specified by [0, 1.00001] and step=0.05, but the range is not divisible by `step`. It will be replaced by [0, 1.0].
  warnings.warn(
K:  7
alpha:  0.55
lr:  0.0021018746551376543
weight_decay:  6.570094799718146e-06
dropout:  0.8
fix split and run 3 times
Data: Data(x=[3327, 3703], y=[3327], train_mask=[3327], val_mask=[3327], test_mask=[3327], adj_t=[3327, 3327, nnz=9104])
num_train tensor(120)
num_noise 0
noise: tensor(0)
data feature 3703
ALTOPT(
  (lins): Sequential(
    (0): Linear(in_features=3703, out_features=64, bias=True)
    (1): BatchNorm1d(64, eps=1e-05, momentum=0.1, affine=True, track_running_stats=True)
    (2): Dropout(p=0.8, inplace=True)
    (3): ReLU(inplace=True)
    (4): Linear(in_features=64, out_features=6, bias=True)
    (5): LogSoftmax(dim=-1)
  )
  (prop): Propagation(K=7, mode=None, lambda1=None, lambda2=None, L21=True, alpha=0.55)
  (gcn): GCN(
    (convs): ModuleList(
      (0): GCNConv(3703, 64)
      (1): GCNConv(64, 6)
    )
    (bns): ModuleList(
      (0): BatchNorm1d(64, eps=1e-05, momentum=0.1, affine=True, track_running_stats=True)
    )
    (output): LogSoftmax(dim=-1)
  )
)
propagate done
init label
Split: 01, Run: 01
None time:  1.0256138530094177
None Run 01:
Highest Train: 100.00
Highest Valid: 71.40
  Final Train: 100.00
   Final Test: 69.70
Split: 01, Run: 02
None time:  1.0299983590375632
None Run 02:
Highest Train: 100.00
Highest Valid: 72.20
  Final Train: 100.00
   Final Test: 70.10
Split: 01, Run: 03
None time:  1.0445370830129832
None Run 03:
Highest Train: 100.00
Highest Valid: 71.60
  Final Train: 100.00
   Final Test: 69.80
run time now: 3.1389153003692627
total time:  3.2043259260244668
None All runs:
Highest Train: 100.00 ± 0.00
Highest Valid: 71.73 ± 0.42
  Final Train: 100.00 ± 0.00
   Final Test: 69.87 ± 0.21
[I 2023-06-11 23:34:34,154] Trial 221 finished with value: 71.73333740234375 and parameters: {'Fwd': 0.02078657966466978, 'K': 7, 'alpha': 0.55, 'dropout': 0.8, 'gnnepoch': 120, 'lambda1': 0.8, 'lambda2': 4.5216906514981705, 'loop': 0, 'loss': 'CE', 'lr': 0.0021018746551376543, 'softmaxF': False, 'useGCN': True, 'weight_decay': 6.570094799718146e-06, 'weightedloss': True}. Best is trial 203 with value: 71.93333435058594.
/home/wxy/miniconda3/lib/python3.10/site-packages/optuna/distributions.py:685: UserWarning: The distribution is specified by [0, 1.00001] and step=0.05, but the range is not divisible by `step`. It will be replaced by [0, 1.0].
  warnings.warn(
K:  7
alpha:  0.6000000000000001
lr:  0.0020974182781930647
weight_decay:  5.93118309484662e-06
dropout:  0.8
fix split and run 3 times
Data: Data(x=[3327, 3703], y=[3327], train_mask=[3327], val_mask=[3327], test_mask=[3327], adj_t=[3327, 3327, nnz=9104])
num_train tensor(120)
num_noise 0
noise: tensor(0)
data feature 3703
ALTOPT(
  (lins): Sequential(
    (0): Linear(in_features=3703, out_features=64, bias=True)
    (1): BatchNorm1d(64, eps=1e-05, momentum=0.1, affine=True, track_running_stats=True)
    (2): Dropout(p=0.8, inplace=True)
    (3): ReLU(inplace=True)
    (4): Linear(in_features=64, out_features=6, bias=True)
    (5): LogSoftmax(dim=-1)
  )
  (prop): Propagation(K=7, mode=None, lambda1=None, lambda2=None, L21=True, alpha=0.6000000000000001)
  (gcn): GCN(
    (convs): ModuleList(
      (0): GCNConv(3703, 64)
      (1): GCNConv(64, 6)
    )
    (bns): ModuleList(
      (0): BatchNorm1d(64, eps=1e-05, momentum=0.1, affine=True, track_running_stats=True)
    )
    (output): LogSoftmax(dim=-1)
  )
)
propagate done
init label
Split: 01, Run: 01
None time:  1.0714012600947171
None Run 01:
Highest Train: 100.00
Highest Valid: 71.20
  Final Train: 100.00
   Final Test: 69.80
Split: 01, Run: 02
None time:  1.034609833965078
None Run 02:
Highest Train: 100.00
Highest Valid: 72.20
  Final Train: 100.00
   Final Test: 70.10
Split: 01, Run: 03
None time:  0.9681958071887493
None Run 03:
Highest Train: 100.00
Highest Valid: 71.60
  Final Train: 100.00
   Final Test: 70.10
run time now: 3.1141390800476074
total time:  3.167250126833096
None All runs:
Highest Train: 100.00 ± 0.00
Highest Valid: 71.67 ± 0.50
  Final Train: 100.00 ± 0.00
   Final Test: 70.00 ± 0.17
[I 2023-06-11 23:34:37,777] Trial 222 finished with value: 71.66666412353516 and parameters: {'Fwd': 0.022543522171815926, 'K': 7, 'alpha': 0.6000000000000001, 'dropout': 0.8, 'gnnepoch': 120, 'lambda1': 0.8, 'lambda2': 4.719714573926844, 'loop': 0, 'loss': 'CE', 'lr': 0.0020974182781930647, 'softmaxF': False, 'useGCN': True, 'weight_decay': 5.93118309484662e-06, 'weightedloss': True}. Best is trial 203 with value: 71.93333435058594.
/home/wxy/miniconda3/lib/python3.10/site-packages/optuna/distributions.py:685: UserWarning: The distribution is specified by [0, 1.00001] and step=0.05, but the range is not divisible by `step`. It will be replaced by [0, 1.0].
  warnings.warn(
K:  7
alpha:  0.55
lr:  0.0022168008635242652
weight_decay:  5.890852329744053e-06
dropout:  0.8
fix split and run 3 times
Data: Data(x=[3327, 3703], y=[3327], train_mask=[3327], val_mask=[3327], test_mask=[3327], adj_t=[3327, 3327, nnz=9104])
num_train tensor(120)
num_noise 0
noise: tensor(0)
data feature 3703
ALTOPT(
  (lins): Sequential(
    (0): Linear(in_features=3703, out_features=64, bias=True)
    (1): BatchNorm1d(64, eps=1e-05, momentum=0.1, affine=True, track_running_stats=True)
    (2): Dropout(p=0.8, inplace=True)
    (3): ReLU(inplace=True)
    (4): Linear(in_features=64, out_features=6, bias=True)
    (5): LogSoftmax(dim=-1)
  )
  (prop): Propagation(K=7, mode=None, lambda1=None, lambda2=None, L21=True, alpha=0.55)
  (gcn): GCN(
    (convs): ModuleList(
      (0): GCNConv(3703, 64)
      (1): GCNConv(64, 6)
    )
    (bns): ModuleList(
      (0): BatchNorm1d(64, eps=1e-05, momentum=0.1, affine=True, track_running_stats=True)
    )
    (output): LogSoftmax(dim=-1)
  )
)
propagate done
init label
Split: 01, Run: 01
None time:  1.1064760121516883
None Run 01:
Highest Train: 100.00
Highest Valid: 71.40
  Final Train: 100.00
   Final Test: 69.70
Split: 01, Run: 02
None time:  0.9393258369527757
None Run 02:
Highest Train: 100.00
Highest Valid: 72.40
  Final Train: 100.00
   Final Test: 70.00
Split: 01, Run: 03
None time:  1.0686800538096577
None Run 03:
Highest Train: 100.00
Highest Valid: 71.60
  Final Train: 100.00
   Final Test: 69.80
run time now: 3.1551034450531006
total time:  3.2077171788550913
None All runs:
Highest Train: 100.00 ± 0.00
Highest Valid: 71.80 ± 0.53
  Final Train: 100.00 ± 0.00
   Final Test: 69.83 ± 0.15
[I 2023-06-11 23:34:41,395] Trial 223 finished with value: 71.79999542236328 and parameters: {'Fwd': 0.018831139835920288, 'K': 7, 'alpha': 0.55, 'dropout': 0.8, 'gnnepoch': 120, 'lambda1': 0.8, 'lambda2': 4.185566633712215, 'loop': 0, 'loss': 'CE', 'lr': 0.0022168008635242652, 'softmaxF': False, 'useGCN': True, 'weight_decay': 5.890852329744053e-06, 'weightedloss': True}. Best is trial 203 with value: 71.93333435058594.
/home/wxy/miniconda3/lib/python3.10/site-packages/optuna/distributions.py:685: UserWarning: The distribution is specified by [0, 1.00001] and step=0.05, but the range is not divisible by `step`. It will be replaced by [0, 1.0].
  warnings.warn(
K:  7
alpha:  0.55
lr:  0.001878125834359642
weight_decay:  1.023621905420774e-05
dropout:  0.8
fix split and run 3 times
Data: Data(x=[3327, 3703], y=[3327], train_mask=[3327], val_mask=[3327], test_mask=[3327], adj_t=[3327, 3327, nnz=9104])
num_train tensor(120)
num_noise 0
noise: tensor(0)
data feature 3703
ALTOPT(
  (lins): Sequential(
    (0): Linear(in_features=3703, out_features=64, bias=True)
    (1): BatchNorm1d(64, eps=1e-05, momentum=0.1, affine=True, track_running_stats=True)
    (2): Dropout(p=0.8, inplace=True)
    (3): ReLU(inplace=True)
    (4): Linear(in_features=64, out_features=6, bias=True)
    (5): LogSoftmax(dim=-1)
  )
  (prop): Propagation(K=7, mode=None, lambda1=None, lambda2=None, L21=True, alpha=0.55)
  (gcn): GCN(
    (convs): ModuleList(
      (0): GCNConv(3703, 64)
      (1): GCNConv(64, 6)
    )
    (bns): ModuleList(
      (0): BatchNorm1d(64, eps=1e-05, momentum=0.1, affine=True, track_running_stats=True)
    )
    (output): LogSoftmax(dim=-1)
  )
)
propagate done
init label
Split: 01, Run: 01
None time:  1.0270890260580927
None Run 01:
Highest Train: 100.00
Highest Valid: 71.20
  Final Train: 100.00
   Final Test: 69.80
Split: 01, Run: 02
None time:  1.044366535032168
None Run 02:
Highest Train: 100.00
Highest Valid: 71.80
  Final Train: 100.00
   Final Test: 70.10
Split: 01, Run: 03
None time:  1.0784094519913197
None Run 03:
Highest Train: 100.00
Highest Valid: 71.40
  Final Train: 100.00
   Final Test: 69.80
run time now: 3.1897590160369873
total time:  3.2426748699508607
None All runs:
Highest Train: 100.00 ± 0.00
Highest Valid: 71.47 ± 0.31
  Final Train: 100.00 ± 0.00
   Final Test: 69.90 ± 0.17
