[I 2023-06-12 00:19:57,719] Trial 89 finished with value: 76.19999694824219 and parameters: {'Fwd': 1.1288697254602625e-06, 'K': 8, 'alpha': 0.75, 'dropout': 0.7000000000000001, 'gnnepoch': 50, 'lambda1': 0.5, 'lambda2': 9.238832647102159, 'loop': 1, 'loss': 'MSE', 'lr': 0.0014267584141633056, 'softmaxF': True, 'useGCN': False, 'weight_decay': 0.0013036232951848807, 'weightedloss': False}. Best is trial 81 with value: 82.26667022705078.
/home/wxy/miniconda3/lib/python3.10/site-packages/optuna/distributions.py:685: UserWarning: The distribution is specified by [0, 1.00001] and step=0.05, but the range is not divisible by `step`. It will be replaced by [0, 1.0].
  warnings.warn(
K:  9
alpha:  0.9
lr:  0.0019171802553103958
weight_decay:  0.00054939795900062
dropout:  0.6000000000000001
fix split and run 3 times
Data: Data(x=[19717, 500], y=[19717], train_mask=[19717], val_mask=[19717], test_mask=[19717], adj_t=[19717, 19717, nnz=88648])
num_train tensor(60)
num_noise 0
noise: tensor(0)
data feature 500
ALTOPT(
  (lins): Sequential(
    (0): Linear(in_features=500, out_features=64, bias=True)
    (1): BatchNorm1d(64, eps=1e-05, momentum=0.1, affine=True, track_running_stats=True)
    (2): Dropout(p=0.6000000000000001, inplace=True)
    (3): ReLU(inplace=True)
    (4): Linear(in_features=64, out_features=3, bias=True)
    (5): Identity()
  )
  (prop): Propagation(K=9, mode=None, lambda1=None, lambda2=None, L21=True, alpha=0.9)
  (gcn): GCN(
    (convs): ModuleList(
      (0): GCNConv(500, 64)
      (1): GCNConv(64, 3)
    )
    (bns): ModuleList(
      (0): BatchNorm1d(64, eps=1e-05, momentum=0.1, affine=True, track_running_stats=True)
    )
    (output): Identity()
  )
)
propagate done
init label
Split: 01, Run: 01
None time:  0.7958629580680281
None Run 01:
Highest Train: 100.00
Highest Valid: 70.40
  Final Train: 100.00
   Final Test: 69.50
Split: 01, Run: 02
None time:  2.7508453058544546
None Run 02:
Highest Train: 100.00
Highest Valid: 82.00
  Final Train: 100.00
   Final Test: 78.30
Split: 01, Run: 03
None time:  1.681169067043811
None Run 03:
Highest Train: 100.00
Highest Valid: 81.40
  Final Train: 100.00
   Final Test: 78.60
run time now: 5.2786078453063965
total time:  5.333260246086866
None All runs:
Highest Train: 100.00 ± 0.00
Highest Valid: 77.93 ± 6.53
  Final Train: 100.00 ± 0.00
   Final Test: 75.47 ± 5.17
[I 2023-06-12 00:20:03,540] Trial 90 finished with value: 77.9333267211914 and parameters: {'Fwd': 4.088502108804159e-06, 'K': 9, 'alpha': 0.9, 'dropout': 0.6000000000000001, 'gnnepoch': 40, 'lambda1': 0.35000000000000003, 'lambda2': 6.528232225159902, 'loop': 1, 'loss': 'MSE', 'lr': 0.0019171802553103958, 'softmaxF': True, 'useGCN': False, 'weight_decay': 0.00054939795900062, 'weightedloss': False}. Best is trial 81 with value: 82.26667022705078.
/home/wxy/miniconda3/lib/python3.10/site-packages/optuna/distributions.py:685: UserWarning: The distribution is specified by [0, 1.00001] and step=0.05, but the range is not divisible by `step`. It will be replaced by [0, 1.0].
  warnings.warn(
K:  10
alpha:  0.9500000000000001
lr:  0.002242172768985877
weight_decay:  0.0008295115910854011
dropout:  0.5
fix split and run 3 times
Data: Data(x=[19717, 500], y=[19717], train_mask=[19717], val_mask=[19717], test_mask=[19717], adj_t=[19717, 19717, nnz=88648])
num_train tensor(60)
num_noise 0
noise: tensor(0)
data feature 500
ALTOPT(
  (lins): Sequential(
    (0): Linear(in_features=500, out_features=64, bias=True)
    (1): BatchNorm1d(64, eps=1e-05, momentum=0.1, affine=True, track_running_stats=True)
    (2): Dropout(p=0.5, inplace=True)
    (3): ReLU(inplace=True)
    (4): Linear(in_features=64, out_features=3, bias=True)
    (5): Identity()
  )
  (prop): Propagation(K=10, mode=None, lambda1=None, lambda2=None, L21=True, alpha=0.9500000000000001)
  (gcn): GCN(
    (convs): ModuleList(
      (0): GCNConv(500, 64)
      (1): GCNConv(64, 3)
    )
    (bns): ModuleList(
      (0): BatchNorm1d(64, eps=1e-05, momentum=0.1, affine=True, track_running_stats=True)
    )
    (output): Identity()
  )
)
propagate done
init label
Split: 01, Run: 01
None time:  1.1408583458978683
None Run 01:
Highest Train: 100.00
Highest Valid: 81.00
  Final Train: 100.00
   Final Test: 76.90
Split: 01, Run: 02
None time:  1.9882954158820212
None Run 02:
Highest Train: 100.00
Highest Valid: 81.80
  Final Train: 100.00
   Final Test: 78.70
Split: 01, Run: 03
None time:  1.7199585859198123
None Run 03:
Highest Train: 100.00
Highest Valid: 80.40
  Final Train: 100.00
   Final Test: 78.50
run time now: 4.920718431472778
total time:  4.978364972863346
None All runs:
Highest Train: 100.00 ± 0.00
Highest Valid: 81.07 ± 0.70
  Final Train: 100.00 ± 0.00
   Final Test: 78.03 ± 0.99
[I 2023-06-12 00:20:09,146] Trial 91 finished with value: 81.0666732788086 and parameters: {'Fwd': 6.1468589747367205e-06, 'K': 10, 'alpha': 0.9500000000000001, 'dropout': 0.5, 'gnnepoch': 80, 'lambda1': 0.30000000000000004, 'lambda2': 7.887689477472244, 'loop': 1, 'loss': 'MSE', 'lr': 0.002242172768985877, 'softmaxF': True, 'useGCN': False, 'weight_decay': 0.0008295115910854011, 'weightedloss': False}. Best is trial 81 with value: 82.26667022705078.
/home/wxy/miniconda3/lib/python3.10/site-packages/optuna/distributions.py:685: UserWarning: The distribution is specified by [0, 1.00001] and step=0.05, but the range is not divisible by `step`. It will be replaced by [0, 1.0].
  warnings.warn(
K:  10
alpha:  1.0
lr:  0.0015837937578619707
weight_decay:  0.0010173435960232314
dropout:  0.6000000000000001
fix split and run 3 times
Data: Data(x=[19717, 500], y=[19717], train_mask=[19717], val_mask=[19717], test_mask=[19717], adj_t=[19717, 19717, nnz=88648])
num_train tensor(60)
num_noise 0
noise: tensor(0)
data feature 500
ALTOPT(
  (lins): Sequential(
    (0): Linear(in_features=500, out_features=64, bias=True)
    (1): BatchNorm1d(64, eps=1e-05, momentum=0.1, affine=True, track_running_stats=True)
    (2): Dropout(p=0.6000000000000001, inplace=True)
    (3): ReLU(inplace=True)
    (4): Linear(in_features=64, out_features=3, bias=True)
    (5): Identity()
  )
  (prop): Propagation(K=10, mode=None, lambda1=None, lambda2=None, L21=True, alpha=1.0)
  (gcn): GCN(
    (convs): ModuleList(
      (0): GCNConv(500, 64)
      (1): GCNConv(64, 3)
    )
    (bns): ModuleList(
      (0): BatchNorm1d(64, eps=1e-05, momentum=0.1, affine=True, track_running_stats=True)
    )
    (output): Identity()
  )
)
propagate done
init label
Split: 01, Run: 01
None time:  1.8517991709522903
None Run 01:
Highest Train: 100.00
Highest Valid: 81.80
  Final Train: 100.00
   Final Test: 78.80
Split: 01, Run: 02
None time:  1.8270776600111276
None Run 02:
Highest Train: 100.00
Highest Valid: 78.60
  Final Train: 100.00
   Final Test: 77.90
Split: 01, Run: 03
None time:  1.5034496490843594
None Run 03:
Highest Train: 100.00
Highest Valid: 80.80
  Final Train: 100.00
   Final Test: 78.30
run time now: 5.228261709213257
total time:  5.267433833098039
None All runs:
Highest Train: 100.00 ± 0.00
Highest Valid: 80.40 ± 1.64
  Final Train: 100.00 ± 0.00
   Final Test: 78.33 ± 0.45
[I 2023-06-12 00:20:14,994] Trial 92 finished with value: 80.4000015258789 and parameters: {'Fwd': 4.555492734130501e-06, 'K': 10, 'alpha': 1.0, 'dropout': 0.6000000000000001, 'gnnepoch': 70, 'lambda1': 0.2, 'lambda2': 7.021566209537176, 'loop': 1, 'loss': 'MSE', 'lr': 0.0015837937578619707, 'softmaxF': True, 'useGCN': False, 'weight_decay': 0.0010173435960232314, 'weightedloss': False}. Best is trial 81 with value: 82.26667022705078.
/home/wxy/miniconda3/lib/python3.10/site-packages/optuna/distributions.py:685: UserWarning: The distribution is specified by [0, 1.00001] and step=0.05, but the range is not divisible by `step`. It will be replaced by [0, 1.0].
  warnings.warn(
K:  8
alpha:  0.8
lr:  0.001111128804975112
weight_decay:  0.001747254838903125
dropout:  0.6000000000000001
fix split and run 3 times
Data: Data(x=[19717, 500], y=[19717], train_mask=[19717], val_mask=[19717], test_mask=[19717], adj_t=[19717, 19717, nnz=88648])
num_train tensor(60)
num_noise 0
noise: tensor(0)
data feature 500
ALTOPT(
  (lins): Sequential(
    (0): Linear(in_features=500, out_features=64, bias=True)
    (1): BatchNorm1d(64, eps=1e-05, momentum=0.1, affine=True, track_running_stats=True)
    (2): Dropout(p=0.6000000000000001, inplace=True)
    (3): ReLU(inplace=True)
    (4): Linear(in_features=64, out_features=3, bias=True)
    (5): Identity()
  )
  (prop): Propagation(K=8, mode=None, lambda1=None, lambda2=None, L21=True, alpha=0.8)
  (gcn): GCN(
    (convs): ModuleList(
      (0): GCNConv(500, 64)
      (1): GCNConv(64, 3)
    )
    (bns): ModuleList(
      (0): BatchNorm1d(64, eps=1e-05, momentum=0.1, affine=True, track_running_stats=True)
    )
    (output): Identity()
  )
)
propagate done
init label
Split: 01, Run: 01
None time:  1.3854015890974551
None Run 01:
Highest Train: 100.00
Highest Valid: 78.80
  Final Train: 100.00
   Final Test: 76.30
Split: 01, Run: 02
None time:  1.319877261063084
None Run 02:
Highest Train: 100.00
Highest Valid: 79.20
  Final Train: 100.00
   Final Test: 75.00
Split: 01, Run: 03
None time:  2.7667791799176484
None Run 03:
Highest Train: 100.00
Highest Valid: 81.40
  Final Train: 100.00
   Final Test: 77.90
run time now: 5.513756036758423
total time:  5.566868667956442
None All runs:
Highest Train: 100.00 ± 0.00
Highest Valid: 79.80 ± 1.40
  Final Train: 100.00 ± 0.00
   Final Test: 76.40 ± 1.45
[I 2023-06-12 00:20:21,178] Trial 93 finished with value: 79.79999542236328 and parameters: {'Fwd': 7.986071034377656e-06, 'K': 8, 'alpha': 0.8, 'dropout': 0.6000000000000001, 'gnnepoch': 80, 'lambda1': 0.4, 'lambda2': 7.657428244156327, 'loop': 1, 'loss': 'MSE', 'lr': 0.001111128804975112, 'softmaxF': True, 'useGCN': False, 'weight_decay': 0.001747254838903125, 'weightedloss': False}. Best is trial 81 with value: 82.26667022705078.
/home/wxy/miniconda3/lib/python3.10/site-packages/optuna/distributions.py:685: UserWarning: The distribution is specified by [0, 1.00001] and step=0.05, but the range is not divisible by `step`. It will be replaced by [0, 1.0].
  warnings.warn(
K:  9
alpha:  0.9
lr:  0.0013101789410733492
weight_decay:  0.0026715793505753213
dropout:  0.5
fix split and run 3 times
Data: Data(x=[19717, 500], y=[19717], train_mask=[19717], val_mask=[19717], test_mask=[19717], adj_t=[19717, 19717, nnz=88648])
num_train tensor(60)
num_noise 0
noise: tensor(0)
data feature 500
ALTOPT(
  (lins): Sequential(
    (0): Linear(in_features=500, out_features=64, bias=True)
    (1): BatchNorm1d(64, eps=1e-05, momentum=0.1, affine=True, track_running_stats=True)
    (2): Dropout(p=0.5, inplace=True)
    (3): ReLU(inplace=True)
    (4): Linear(in_features=64, out_features=3, bias=True)
    (5): Identity()
  )
  (prop): Propagation(K=9, mode=None, lambda1=None, lambda2=None, L21=True, alpha=0.9)
  (gcn): GCN(
    (convs): ModuleList(
      (0): GCNConv(500, 64)
      (1): GCNConv(64, 3)
    )
    (bns): ModuleList(
      (0): BatchNorm1d(64, eps=1e-05, momentum=0.1, affine=True, track_running_stats=True)
    )
    (output): Identity()
  )
)
propagate done
init label
Split: 01, Run: 01
None time:  2.31459242105484
None Run 01:
Highest Train: 100.00
Highest Valid: 82.40
  Final Train: 100.00
   Final Test: 77.70
Split: 01, Run: 02
None time:  2.032708217855543
None Run 02:
Highest Train: 100.00
Highest Valid: 82.00
  Final Train: 100.00
   Final Test: 78.40
Split: 01, Run: 03
None time:  1.0760738849639893
None Run 03:
Highest Train: 100.00
Highest Valid: 81.60
  Final Train: 100.00
   Final Test: 80.20
run time now: 5.472526550292969
total time:  5.514856058172882
None All runs:
Highest Train: 100.00 ± 0.00
Highest Valid: 82.00 ± 0.40
  Final Train: 100.00 ± 0.00
   Final Test: 78.77 ± 1.29
[I 2023-06-12 00:20:27,247] Trial 94 finished with value: 82.0 and parameters: {'Fwd': 2.478514325322573e-06, 'K': 9, 'alpha': 0.9, 'dropout': 0.5, 'gnnepoch': 70, 'lambda1': 0.2, 'lambda2': 7.938494161215649, 'loop': 1, 'loss': 'MSE', 'lr': 0.0013101789410733492, 'softmaxF': True, 'useGCN': False, 'weight_decay': 0.0026715793505753213, 'weightedloss': False}. Best is trial 81 with value: 82.26667022705078.
/home/wxy/miniconda3/lib/python3.10/site-packages/optuna/distributions.py:685: UserWarning: The distribution is specified by [0, 1.00001] and step=0.05, but the range is not divisible by `step`. It will be replaced by [0, 1.0].
  warnings.warn(
K:  9
alpha:  0.8500000000000001
lr:  0.0013987649934567744
weight_decay:  0.00639448133907866
dropout:  0.7000000000000001
fix split and run 3 times
Data: Data(x=[19717, 500], y=[19717], train_mask=[19717], val_mask=[19717], test_mask=[19717], adj_t=[19717, 19717, nnz=88648])
num_train tensor(60)
num_noise 0
noise: tensor(0)
data feature 500
ALTOPT(
  (lins): Sequential(
    (0): Linear(in_features=500, out_features=64, bias=True)
    (1): BatchNorm1d(64, eps=1e-05, momentum=0.1, affine=True, track_running_stats=True)
    (2): Dropout(p=0.7000000000000001, inplace=True)
    (3): ReLU(inplace=True)
    (4): Linear(in_features=64, out_features=3, bias=True)
    (5): Identity()
  )
  (prop): Propagation(K=9, mode=None, lambda1=None, lambda2=None, L21=True, alpha=0.8500000000000001)
  (gcn): GCN(
    (convs): ModuleList(
      (0): GCNConv(500, 64)
      (1): GCNConv(64, 3)
    )
    (bns): ModuleList(
      (0): BatchNorm1d(64, eps=1e-05, momentum=0.1, affine=True, track_running_stats=True)
    )
    (output): Identity()
  )
)
propagate done
init label
Split: 01, Run: 01
None time:  2.6179953610990196
None Run 01:
Highest Train: 100.00
Highest Valid: 80.40
  Final Train: 100.00
   Final Test: 76.80
Split: 01, Run: 02
None time:  1.8545785150490701
None Run 02:
Highest Train: 100.00
Highest Valid: 80.20
  Final Train: 100.00
   Final Test: 76.90
Split: 01, Run: 03
None time:  2.4619517100509256
None Run 03:
Highest Train: 100.00
Highest Valid: 81.20
  Final Train: 100.00
   Final Test: 78.20
run time now: 6.983947038650513
total time:  7.026124787982553
None All runs:
Highest Train: 100.00 ± 0.00
Highest Valid: 80.60 ± 0.53
  Final Train: 100.00 ± 0.00
   Final Test: 77.30 ± 0.78
[I 2023-06-12 00:20:34,818] Trial 95 finished with value: 80.5999984741211 and parameters: {'Fwd': 2.7667095497277173e-06, 'K': 9, 'alpha': 0.8500000000000001, 'dropout': 0.7000000000000001, 'gnnepoch': 60, 'lambda1': 0.30000000000000004, 'lambda2': 8.24714619163447, 'loop': 1, 'loss': 'MSE', 'lr': 0.0013987649934567744, 'softmaxF': True, 'useGCN': False, 'weight_decay': 0.00639448133907866, 'weightedloss': False}. Best is trial 81 with value: 82.26667022705078.
/home/wxy/miniconda3/lib/python3.10/site-packages/optuna/distributions.py:685: UserWarning: The distribution is specified by [0, 1.00001] and step=0.05, but the range is not divisible by `step`. It will be replaced by [0, 1.0].
  warnings.warn(
K:  9
alpha:  0.9
lr:  0.001766707250819885
weight_decay:  0.0023538395524938705
dropout:  0.6000000000000001
fix split and run 3 times
Data: Data(x=[19717, 500], y=[19717], train_mask=[19717], val_mask=[19717], test_mask=[19717], adj_t=[19717, 19717, nnz=88648])
num_train tensor(60)
num_noise 0
noise: tensor(0)
data feature 500
ALTOPT(
  (lins): Sequential(
    (0): Linear(in_features=500, out_features=64, bias=True)
    (1): BatchNorm1d(64, eps=1e-05, momentum=0.1, affine=True, track_running_stats=True)
    (2): Dropout(p=0.6000000000000001, inplace=True)
    (3): ReLU(inplace=True)
    (4): Linear(in_features=64, out_features=3, bias=True)
    (5): Identity()
  )
  (prop): Propagation(K=9, mode=None, lambda1=None, lambda2=None, L21=True, alpha=0.9)
  (gcn): GCN(
    (convs): ModuleList(
      (0): GCNConv(500, 64)
      (1): GCNConv(64, 3)
    )
    (bns): ModuleList(
      (0): BatchNorm1d(64, eps=1e-05, momentum=0.1, affine=True, track_running_stats=True)
    )
    (output): Identity()
  )
)
propagate done
init label
Split: 01, Run: 01
None time:  1.8045795599464327
None Run 01:
Highest Train: 100.00
Highest Valid: 82.00
  Final Train: 100.00
   Final Test: 77.70
Split: 01, Run: 02
None time:  1.3308096600230783
None Run 02:
Highest Train: 100.00
Highest Valid: 82.80
  Final Train: 100.00
   Final Test: 78.60
Split: 01, Run: 03
None time:  1.2579785089474171
None Run 03:
Highest Train: 100.00
Highest Valid: 81.60
  Final Train: 100.00
   Final Test: 77.40
run time now: 4.446197271347046
total time:  4.500290570082143
None All runs:
Highest Train: 100.00 ± 0.00
Highest Valid: 82.13 ± 0.61
  Final Train: 100.00 ± 0.00
   Final Test: 77.90 ± 0.62
[I 2023-06-12 00:20:39,800] Trial 96 finished with value: 82.13333129882812 and parameters: {'Fwd': 1.7454950627437076e-06, 'K': 9, 'alpha': 0.9, 'dropout': 0.6000000000000001, 'gnnepoch': 70, 'lambda1': 0.5, 'lambda2': 7.208219632501962, 'loop': 1, 'loss': 'MSE', 'lr': 0.001766707250819885, 'softmaxF': True, 'useGCN': False, 'weight_decay': 0.0023538395524938705, 'weightedloss': False}. Best is trial 81 with value: 82.26667022705078.
/home/wxy/miniconda3/lib/python3.10/site-packages/optuna/distributions.py:685: UserWarning: The distribution is specified by [0, 1.00001] and step=0.05, but the range is not divisible by `step`. It will be replaced by [0, 1.0].
  warnings.warn(
K:  9
alpha:  0.9
lr:  0.0018265646107346817
weight_decay:  0.002851369619152034
dropout:  0.6000000000000001
fix split and run 3 times
Data: Data(x=[19717, 500], y=[19717], train_mask=[19717], val_mask=[19717], test_mask=[19717], adj_t=[19717, 19717, nnz=88648])
num_train tensor(60)
num_noise 0
noise: tensor(0)
data feature 500
ALTOPT(
  (lins): Sequential(
    (0): Linear(in_features=500, out_features=64, bias=True)
    (1): BatchNorm1d(64, eps=1e-05, momentum=0.1, affine=True, track_running_stats=True)
    (2): Dropout(p=0.6000000000000001, inplace=True)
    (3): ReLU(inplace=True)
    (4): Linear(in_features=64, out_features=3, bias=True)
    (5): Identity()
  )
  (prop): Propagation(K=9, mode=None, lambda1=None, lambda2=None, L21=True, alpha=0.9)
  (gcn): GCN(
    (convs): ModuleList(
      (0): GCNConv(500, 64)
      (1): GCNConv(64, 3)
    )
    (bns): ModuleList(
      (0): BatchNorm1d(64, eps=1e-05, momentum=0.1, affine=True, track_running_stats=True)
    )
    (output): Identity()
  )
)
propagate done
init label
Split: 01, Run: 01, Epoch: 100, Loss: 0.1839, Train: 100.00%, Valid: 82.80% Test: 78.40%
Split: 01, Run: 01
None time:  3.3688929879572242
None Run 01:
Highest Train: 100.00
Highest Valid: 82.80
  Final Train: 100.00
   Final Test: 78.40
Split: 01, Run: 02
None time:  1.9545626791659743
None Run 02:
Highest Train: 100.00
Highest Valid: 82.80
  Final Train: 100.00
   Final Test: 79.40
Split: 01, Run: 03
None time:  1.3235956120770425
None Run 03:
Highest Train: 100.00
Highest Valid: 82.00
  Final Train: 100.00
   Final Test: 78.70
run time now: 6.697200298309326
total time:  6.745772291207686
None All runs:
Highest Train: 100.00 ± 0.00
Highest Valid: 82.53 ± 0.46
  Final Train: 100.00 ± 0.00
   Final Test: 78.83 ± 0.51
[I 2023-06-12 00:20:47,136] Trial 97 finished with value: 82.53333282470703 and parameters: {'Fwd': 1.7557516340054431e-06, 'K': 9, 'alpha': 0.9, 'dropout': 0.6000000000000001, 'gnnepoch': 70, 'lambda1': 0.4, 'lambda2': 7.262595521390204, 'loop': 1, 'loss': 'MSE', 'lr': 0.0018265646107346817, 'softmaxF': True, 'useGCN': False, 'weight_decay': 0.002851369619152034, 'weightedloss': False}. Best is trial 97 with value: 82.53333282470703.
/home/wxy/miniconda3/lib/python3.10/site-packages/optuna/distributions.py:685: UserWarning: The distribution is specified by [0, 1.00001] and step=0.05, but the range is not divisible by `step`. It will be replaced by [0, 1.0].
  warnings.warn(
K:  9
alpha:  0.9
lr:  0.001814892373033509
weight_decay:  0.0025268977244496623
dropout:  0.6000000000000001
fix split and run 3 times
Data: Data(x=[19717, 500], y=[19717], train_mask=[19717], val_mask=[19717], test_mask=[19717], adj_t=[19717, 19717, nnz=88648])
num_train tensor(60)
num_noise 0
noise: tensor(0)
data feature 500
ALTOPT(
  (lins): Sequential(
    (0): Linear(in_features=500, out_features=64, bias=True)
    (1): BatchNorm1d(64, eps=1e-05, momentum=0.1, affine=True, track_running_stats=True)
    (2): Dropout(p=0.6000000000000001, inplace=True)
    (3): ReLU(inplace=True)
    (4): Linear(in_features=64, out_features=3, bias=True)
    (5): Identity()
  )
  (prop): Propagation(K=9, mode=None, lambda1=None, lambda2=None, L21=True, alpha=0.9)
  (gcn): GCN(
    (convs): ModuleList(
      (0): GCNConv(500, 64)
      (1): GCNConv(64, 3)
    )
    (bns): ModuleList(
      (0): BatchNorm1d(64, eps=1e-05, momentum=0.1, affine=True, track_running_stats=True)
    )
    (output): Identity()
  )
)
propagate done
init label
Split: 01, Run: 01, Epoch: 100, Loss: 0.1844, Train: 100.00%, Valid: 82.60% Test: 78.40%
Split: 01, Run: 01
None time:  3.663719888078049
None Run 01:
Highest Train: 100.00
Highest Valid: 82.60
  Final Train: 100.00
   Final Test: 78.30
Split: 01, Run: 02
None time:  1.1566807341296226
None Run 02:
Highest Train: 100.00
Highest Valid: 82.00
  Final Train: 100.00
   Final Test: 79.20
Split: 01, Run: 03
None time:  1.682797685964033
None Run 03:
Highest Train: 100.00
Highest Valid: 81.60
  Final Train: 100.00
   Final Test: 76.50
run time now: 6.5472025871276855
total time:  6.587498777080327
None All runs:
Highest Train: 100.00 ± 0.00
Highest Valid: 82.07 ± 0.50
  Final Train: 100.00 ± 0.00
   Final Test: 78.00 ± 1.37
