[I 2023-06-11 23:23:41,914] Trial 44 finished with value: 51.733333587646484 and parameters: {'Fwd': 0.008978089255924734, 'K': 9, 'alpha': 0.8500000000000001, 'dropout': 0.7000000000000001, 'gnnepoch': 120, 'lambda1': 0.55, 'lambda2': 4.627525778698063, 'loop': 0, 'loss': 'CE', 'lr': 0.001617704939688715, 'softmaxF': True, 'useGCN': False, 'weight_decay': 1.9727908193400475e-06, 'weightedloss': True}. Best is trial 43 with value: 71.66666412353516.
/home/wxy/miniconda3/lib/python3.10/site-packages/optuna/distributions.py:685: UserWarning: The distribution is specified by [0, 1.00001] and step=0.05, but the range is not divisible by `step`. It will be replaced by [0, 1.0].
  warnings.warn(
K:  9
alpha:  0.9
lr:  0.0011891220986020978
weight_decay:  4.722763051519333e-06
dropout:  0.5
fix split and run 3 times
Data: Data(x=[3327, 3703], y=[3327], train_mask=[3327], val_mask=[3327], test_mask=[3327], adj_t=[3327, 3327, nnz=9104])
num_train tensor(120)
num_noise 0
noise: tensor(0)
data feature 3703
ALTOPT(
  (lins): Sequential(
    (0): Linear(in_features=3703, out_features=64, bias=True)
    (1): BatchNorm1d(64, eps=1e-05, momentum=0.1, affine=True, track_running_stats=True)
    (2): Dropout(p=0.5, inplace=True)
    (3): ReLU(inplace=True)
    (4): Linear(in_features=64, out_features=6, bias=True)
    (5): LogSoftmax(dim=-1)
  )
  (prop): Propagation(K=9, mode=None, lambda1=None, lambda2=None, L21=True, alpha=0.9)
  (gcn): GCN(
    (convs): ModuleList(
      (0): GCNConv(3703, 64)
      (1): GCNConv(64, 6)
    )
    (bns): ModuleList(
      (0): BatchNorm1d(64, eps=1e-05, momentum=0.1, affine=True, track_running_stats=True)
    )
    (output): LogSoftmax(dim=-1)
  )
)
propagate done
init label
Split: 01, Run: 01
None time:  1.1738828730303794
None Run 01:
Highest Train: 100.00
Highest Valid: 71.00
  Final Train: 100.00
   Final Test: 69.70
Split: 01, Run: 02
None time:  1.9196621850132942
None Run 02:
Highest Train: 100.00
Highest Valid: 71.00
  Final Train: 99.17
   Final Test: 69.10
Split: 01, Run: 03
None time:  1.1763877340126783
None Run 03:
Highest Train: 100.00
Highest Valid: 71.40
  Final Train: 100.00
   Final Test: 69.40
run time now: 4.312298059463501
total time:  4.3689733480568975
None All runs:
Highest Train: 100.00 ± 0.00
Highest Valid: 71.13 ± 0.23
  Final Train: 99.72 ± 0.48
   Final Test: 69.40 ± 0.30
[I 2023-06-11 23:23:46,677] Trial 45 finished with value: 71.13333129882812 and parameters: {'Fwd': 0.0046863199555681224, 'K': 9, 'alpha': 0.9, 'dropout': 0.5, 'gnnepoch': 110, 'lambda1': 0.4, 'lambda2': 5.120969822323227, 'loop': 2, 'loss': 'CE', 'lr': 0.0011891220986020978, 'softmaxF': True, 'useGCN': True, 'weight_decay': 4.722763051519333e-06, 'weightedloss': True}. Best is trial 43 with value: 71.66666412353516.
/home/wxy/miniconda3/lib/python3.10/site-packages/optuna/distributions.py:685: UserWarning: The distribution is specified by [0, 1.00001] and step=0.05, but the range is not divisible by `step`. It will be replaced by [0, 1.0].
  warnings.warn(
K:  9
alpha:  0.05
lr:  0.002194257819123407
weight_decay:  7.4860485448046295e-06
dropout:  0.6000000000000001
fix split and run 3 times
Data: Data(x=[3327, 3703], y=[3327], train_mask=[3327], val_mask=[3327], test_mask=[3327], adj_t=[3327, 3327, nnz=9104])
num_train tensor(120)
num_noise 0
noise: tensor(0)
data feature 3703
ALTOPT(
  (lins): Sequential(
    (0): Linear(in_features=3703, out_features=64, bias=True)
    (1): BatchNorm1d(64, eps=1e-05, momentum=0.1, affine=True, track_running_stats=True)
    (2): Dropout(p=0.6000000000000001, inplace=True)
    (3): ReLU(inplace=True)
    (4): Linear(in_features=64, out_features=6, bias=True)
    (5): LogSoftmax(dim=-1)
  )
  (prop): Propagation(K=9, mode=None, lambda1=None, lambda2=None, L21=True, alpha=0.05)
  (gcn): GCN(
    (convs): ModuleList(
      (0): GCNConv(3703, 64)
      (1): GCNConv(64, 6)
    )
    (bns): ModuleList(
      (0): BatchNorm1d(64, eps=1e-05, momentum=0.1, affine=True, track_running_stats=True)
    )
    (output): LogSoftmax(dim=-1)
  )
)
propagate done
init label
Split: 01, Run: 01
None time:  1.0612850908655673
None Run 01:
Highest Train: 100.00
Highest Valid: 70.80
  Final Train: 100.00
   Final Test: 70.00
Split: 01, Run: 02
None time:  1.0452841070946306
None Run 02:
Highest Train: 100.00
Highest Valid: 71.80
  Final Train: 100.00
   Final Test: 70.20
Split: 01, Run: 03
None time:  1.0759449540637434
None Run 03:
Highest Train: 100.00
Highest Valid: 70.80
  Final Train: 100.00
   Final Test: 69.30
run time now: 3.224769115447998
total time:  3.2775032240897417
None All runs:
Highest Train: 100.00 ± 0.00
Highest Valid: 71.13 ± 0.58
  Final Train: 100.00 ± 0.00
   Final Test: 69.83 ± 0.47
[I 2023-06-11 23:23:50,348] Trial 46 finished with value: 71.13333892822266 and parameters: {'Fwd': 0.015425942658171241, 'K': 9, 'alpha': 0.05, 'dropout': 0.6000000000000001, 'gnnepoch': 120, 'lambda1': 0.6000000000000001, 'lambda2': 4.10410967677396, 'loop': 0, 'loss': 'CE', 'lr': 0.002194257819123407, 'softmaxF': False, 'useGCN': True, 'weight_decay': 7.4860485448046295e-06, 'weightedloss': True}. Best is trial 43 with value: 71.66666412353516.
/home/wxy/miniconda3/lib/python3.10/site-packages/optuna/distributions.py:685: UserWarning: The distribution is specified by [0, 1.00001] and step=0.05, but the range is not divisible by `step`. It will be replaced by [0, 1.0].
  warnings.warn(
K:  10
alpha:  0.6000000000000001
lr:  0.0008558491175741993
weight_decay:  3.024590133894275e-06
dropout:  0.5
fix split and run 3 times
Data: Data(x=[3327, 3703], y=[3327], train_mask=[3327], val_mask=[3327], test_mask=[3327], adj_t=[3327, 3327, nnz=9104])
num_train tensor(120)
num_noise 0
noise: tensor(0)
data feature 3703
ALTOPT(
  (lins): Sequential(
    (0): Linear(in_features=3703, out_features=64, bias=True)
    (1): BatchNorm1d(64, eps=1e-05, momentum=0.1, affine=True, track_running_stats=True)
    (2): Dropout(p=0.5, inplace=True)
    (3): ReLU(inplace=True)
    (4): Linear(in_features=64, out_features=6, bias=True)
    (5): Identity()
  )
  (prop): Propagation(K=10, mode=None, lambda1=None, lambda2=None, L21=True, alpha=0.6000000000000001)
  (gcn): GCN(
    (convs): ModuleList(
      (0): GCNConv(3703, 64)
      (1): GCNConv(64, 6)
    )
    (bns): ModuleList(
      (0): BatchNorm1d(64, eps=1e-05, momentum=0.1, affine=True, track_running_stats=True)
    )
    (output): Identity()
  )
)
propagate done
init label
Split: 01, Run: 01
None time:  0.4786707579623908
None Run 01:
Highest Train: 100.00
Highest Valid: 46.40
  Final Train: 100.00
   Final Test: 46.00
Split: 01, Run: 02, Epoch: 100, Loss: 0.0000, Train: 100.00%, Valid: 66.80% Test: 68.80%
Split: 01, Run: 02
None time:  1.0692943991161883
None Run 02:
Highest Train: 100.00
Highest Valid: 66.80
  Final Train: 100.00
   Final Test: 68.90
Split: 01, Run: 03, Epoch: 100, Loss: 0.0000, Train: 100.00%, Valid: 66.40% Test: 65.10%
Split: 01, Run: 03
None time:  1.0179418199695647
None Run 03:
Highest Train: 100.00
Highest Valid: 66.40
  Final Train: 100.00
   Final Test: 65.10
run time now: 2.6115243434906006
total time:  2.6641654069535434
None All runs:
Highest Train: 100.00 ± 0.00
Highest Valid: 59.87 ± 11.66
  Final Train: 100.00 ± 0.00
   Final Test: 60.00 ± 12.27
[I 2023-06-11 23:23:53,423] Trial 47 finished with value: 59.86666488647461 and parameters: {'Fwd': 0.0066881776381487665, 'K': 10, 'alpha': 0.6000000000000001, 'dropout': 0.5, 'gnnepoch': 70, 'lambda1': 0.5, 'lambda2': 3.730971871717765, 'loop': 0, 'loss': 'MSE', 'lr': 0.0008558491175741993, 'softmaxF': True, 'useGCN': False, 'weight_decay': 3.024590133894275e-06, 'weightedloss': False}. Best is trial 43 with value: 71.66666412353516.
/home/wxy/miniconda3/lib/python3.10/site-packages/optuna/distributions.py:685: UserWarning: The distribution is specified by [0, 1.00001] and step=0.05, but the range is not divisible by `step`. It will be replaced by [0, 1.0].
  warnings.warn(
K:  8
alpha:  0.2
lr:  0.0033761225306590333
weight_decay:  1.5649949741515958e-06
dropout:  0.7000000000000001
fix split and run 3 times
Data: Data(x=[3327, 3703], y=[3327], train_mask=[3327], val_mask=[3327], test_mask=[3327], adj_t=[3327, 3327, nnz=9104])
num_train tensor(120)
num_noise 0
noise: tensor(0)
data feature 3703
ALTOPT(
  (lins): Sequential(
    (0): Linear(in_features=3703, out_features=64, bias=True)
    (1): BatchNorm1d(64, eps=1e-05, momentum=0.1, affine=True, track_running_stats=True)
    (2): Dropout(p=0.7000000000000001, inplace=True)
    (3): ReLU(inplace=True)
    (4): Linear(in_features=64, out_features=6, bias=True)
    (5): LogSoftmax(dim=-1)
  )
  (prop): Propagation(K=8, mode=None, lambda1=None, lambda2=None, L21=True, alpha=0.2)
  (gcn): GCN(
    (convs): ModuleList(
      (0): GCNConv(3703, 64)
      (1): GCNConv(64, 6)
    )
    (bns): ModuleList(
      (0): BatchNorm1d(64, eps=1e-05, momentum=0.1, affine=True, track_running_stats=True)
    )
    (output): LogSoftmax(dim=-1)
  )
)
propagate done
init label
Split: 01, Run: 01
None time:  0.7185228990856558
None Run 01:
Highest Train: 100.00
Highest Valid: 71.40
  Final Train: 100.00
   Final Test: 70.10
Split: 01, Run: 02
None time:  0.8266617869958282
None Run 02:
Highest Train: 100.00
Highest Valid: 70.40
  Final Train: 100.00
   Final Test: 70.10
Split: 01, Run: 03, Epoch: 100, Loss: 0.0000, Train: 100.00%, Valid: 70.60% Test: 70.30%
Split: 01, Run: 03
None time:  1.576749854022637
None Run 03:
Highest Train: 100.00
Highest Valid: 70.60
  Final Train: 100.00
   Final Test: 70.20
run time now: 3.1622581481933594
total time:  3.2179509410634637
None All runs:
Highest Train: 100.00 ± 0.00
Highest Valid: 70.80 ± 0.53
  Final Train: 100.00 ± 0.00
   Final Test: 70.13 ± 0.06
[I 2023-06-11 23:23:57,241] Trial 48 finished with value: 70.79999542236328 and parameters: {'Fwd': 0.058323615631870336, 'K': 8, 'alpha': 0.2, 'dropout': 0.7000000000000001, 'gnnepoch': 90, 'lambda1': 0.45, 'lambda2': 4.769944497376803, 'loop': 0, 'loss': 'CE', 'lr': 0.0033761225306590333, 'softmaxF': True, 'useGCN': True, 'weight_decay': 1.5649949741515958e-06, 'weightedloss': True}. Best is trial 43 with value: 71.66666412353516.
/home/wxy/miniconda3/lib/python3.10/site-packages/optuna/distributions.py:685: UserWarning: The distribution is specified by [0, 1.00001] and step=0.05, but the range is not divisible by `step`. It will be replaced by [0, 1.0].
  warnings.warn(
K:  9
alpha:  0.4
lr:  0.001523626337247665
weight_decay:  1.0547760833233447e-06
dropout:  0.30000000000000004
fix split and run 3 times
Data: Data(x=[3327, 3703], y=[3327], train_mask=[3327], val_mask=[3327], test_mask=[3327], adj_t=[3327, 3327, nnz=9104])
num_train tensor(120)
num_noise 0
noise: tensor(0)
data feature 3703
ALTOPT(
  (lins): Sequential(
    (0): Linear(in_features=3703, out_features=64, bias=True)
    (1): BatchNorm1d(64, eps=1e-05, momentum=0.1, affine=True, track_running_stats=True)
    (2): Dropout(p=0.30000000000000004, inplace=True)
    (3): ReLU(inplace=True)
    (4): Linear(in_features=64, out_features=6, bias=True)
    (5): LogSoftmax(dim=-1)
  )
  (prop): Propagation(K=9, mode=None, lambda1=None, lambda2=None, L21=True, alpha=0.4)
  (gcn): GCN(
    (convs): ModuleList(
      (0): GCNConv(3703, 64)
      (1): GCNConv(64, 6)
    )
    (bns): ModuleList(
      (0): BatchNorm1d(64, eps=1e-05, momentum=0.1, affine=True, track_running_stats=True)
    )
    (output): LogSoftmax(dim=-1)
  )
)
propagate done
init label
Split: 01, Run: 01
None time:  0.64845763402991
None Run 01:
Highest Train: 100.00
Highest Valid: 69.80
  Final Train: 100.00
   Final Test: 69.10
Split: 01, Run: 02
None time:  0.5559550269972533
None Run 02:
Highest Train: 100.00
Highest Valid: 70.40
  Final Train: 100.00
   Final Test: 67.90
Split: 01, Run: 03
None time:  0.5987016640137881
None Run 03:
Highest Train: 100.00
Highest Valid: 70.00
  Final Train: 100.00
   Final Test: 68.00
run time now: 1.8457231521606445
total time:  1.8971458079759032
None All runs:
Highest Train: 100.00 ± 0.00
Highest Valid: 70.07 ± 0.31
  Final Train: 100.00 ± 0.00
   Final Test: 68.33 ± 0.67
[I 2023-06-11 23:23:59,551] Trial 49 finished with value: 70.0666732788086 and parameters: {'Fwd': 0.023157749759342258, 'K': 9, 'alpha': 0.4, 'dropout': 0.30000000000000004, 'gnnepoch': 60, 'lambda1': 0.30000000000000004, 'lambda2': 6.2399972184401395, 'loop': 0, 'loss': 'CE', 'lr': 0.001523626337247665, 'softmaxF': True, 'useGCN': True, 'weight_decay': 1.0547760833233447e-06, 'weightedloss': True}. Best is trial 43 with value: 71.66666412353516.
/home/wxy/miniconda3/lib/python3.10/site-packages/optuna/distributions.py:685: UserWarning: The distribution is specified by [0, 1.00001] and step=0.05, but the range is not divisible by `step`. It will be replaced by [0, 1.0].
  warnings.warn(
K:  8
alpha:  0.7000000000000001
lr:  0.0024821158112342642
weight_decay:  1.80766135123186e-05
dropout:  0.2
fix split and run 3 times
Data: Data(x=[3327, 3703], y=[3327], train_mask=[3327], val_mask=[3327], test_mask=[3327], adj_t=[3327, 3327, nnz=9104])
num_train tensor(120)
num_noise 0
noise: tensor(0)
data feature 3703
ALTOPT(
  (lins): Sequential(
    (0): Linear(in_features=3703, out_features=64, bias=True)
    (1): BatchNorm1d(64, eps=1e-05, momentum=0.1, affine=True, track_running_stats=True)
    (2): Dropout(p=0.2, inplace=True)
    (3): ReLU(inplace=True)
    (4): Linear(in_features=64, out_features=6, bias=True)
    (5): LogSoftmax(dim=-1)
  )
  (prop): Propagation(K=8, mode=None, lambda1=None, lambda2=None, L21=True, alpha=0.7000000000000001)
  (gcn): GCN(
    (convs): ModuleList(
      (0): GCNConv(3703, 64)
      (1): GCNConv(64, 6)
    )
    (bns): ModuleList(
      (0): BatchNorm1d(64, eps=1e-05, momentum=0.1, affine=True, track_running_stats=True)
    )
    (output): LogSoftmax(dim=-1)
  )
)
propagate done
init label
Split: 01, Run: 01
None time:  0.957942564971745
None Run 01:
Highest Train: 100.00
Highest Valid: 70.80
  Final Train: 99.17
   Final Test: 69.40
Split: 01, Run: 02
None time:  0.9919481829274446
None Run 02:
Highest Train: 100.00
Highest Valid: 71.40
  Final Train: 100.00
   Final Test: 69.20
Split: 01, Run: 03
None time:  0.979160716990009
None Run 03:
Highest Train: 100.00
Highest Valid: 70.20
  Final Train: 99.17
   Final Test: 68.20
run time now: 2.984011173248291
total time:  3.042539204005152
None All runs:
Highest Train: 100.00 ± 0.00
Highest Valid: 70.80 ± 0.60
  Final Train: 99.44 ± 0.48
   Final Test: 68.93 ± 0.64
[I 2023-06-11 23:24:03,039] Trial 50 finished with value: 70.80001068115234 and parameters: {'Fwd': 0.0035116660403878347, 'K': 8, 'alpha': 0.7000000000000001, 'dropout': 0.2, 'gnnepoch': 110, 'lambda1': 0.8, 'lambda2': 5.276469762938231, 'loop': 0, 'loss': 'CE', 'lr': 0.0024821158112342642, 'softmaxF': True, 'useGCN': True, 'weight_decay': 1.80766135123186e-05, 'weightedloss': True}. Best is trial 43 with value: 71.66666412353516.
/home/wxy/miniconda3/lib/python3.10/site-packages/optuna/distributions.py:685: UserWarning: The distribution is specified by [0, 1.00001] and step=0.05, but the range is not divisible by `step`. It will be replaced by [0, 1.0].
  warnings.warn(
K:  10
alpha:  0.9500000000000001
lr:  0.001465494941202136
weight_decay:  1.625051931009778e-06
dropout:  0.4
fix split and run 3 times
Data: Data(x=[3327, 3703], y=[3327], train_mask=[3327], val_mask=[3327], test_mask=[3327], adj_t=[3327, 3327, nnz=9104])
num_train tensor(120)
num_noise 0
noise: tensor(0)
data feature 3703
ALTOPT(
  (lins): Sequential(
    (0): Linear(in_features=3703, out_features=64, bias=True)
    (1): BatchNorm1d(64, eps=1e-05, momentum=0.1, affine=True, track_running_stats=True)
    (2): Dropout(p=0.4, inplace=True)
    (3): ReLU(inplace=True)
    (4): Linear(in_features=64, out_features=6, bias=True)
    (5): LogSoftmax(dim=-1)
  )
  (prop): Propagation(K=10, mode=None, lambda1=None, lambda2=None, L21=True, alpha=0.9500000000000001)
  (gcn): GCN(
    (convs): ModuleList(
      (0): GCNConv(3703, 64)
      (1): GCNConv(64, 6)
    )
    (bns): ModuleList(
      (0): BatchNorm1d(64, eps=1e-05, momentum=0.1, affine=True, track_running_stats=True)
    )
    (output): LogSoftmax(dim=-1)
  )
)
propagate done
init label
Split: 01, Run: 01
None time:  0.9048086879774928
None Run 01:
Highest Train: 100.00
Highest Valid: 71.20
  Final Train: 100.00
   Final Test: 69.80
Split: 01, Run: 02
None time:  0.8626337950117886
None Run 02:
Highest Train: 100.00
Highest Valid: 70.80
  Final Train: 100.00
   Final Test: 68.80
Split: 01, Run: 03
None time:  0.9055801399517804
None Run 03:
Highest Train: 100.00
Highest Valid: 71.20
  Final Train: 100.00
   Final Test: 69.30
run time now: 2.7162957191467285
total time:  2.781101631000638
None All runs:
Highest Train: 100.00 ± 0.00
Highest Valid: 71.07 ± 0.23
  Final Train: 100.00 ± 0.00
   Final Test: 69.30 ± 0.50
[I 2023-06-11 23:24:06,242] Trial 51 finished with value: 71.0666732788086 and parameters: {'Fwd': 0.010025060713042851, 'K': 10, 'alpha': 0.9500000000000001, 'dropout': 0.4, 'gnnepoch': 100, 'lambda1': 0.30000000000000004, 'lambda2': 4.14052423024847, 'loop': 0, 'loss': 'CE', 'lr': 0.001465494941202136, 'softmaxF': True, 'useGCN': True, 'weight_decay': 1.625051931009778e-06, 'weightedloss': True}. Best is trial 43 with value: 71.66666412353516.
/home/wxy/miniconda3/lib/python3.10/site-packages/optuna/distributions.py:685: UserWarning: The distribution is specified by [0, 1.00001] and step=0.05, but the range is not divisible by `step`. It will be replaced by [0, 1.0].
  warnings.warn(
K:  10
alpha:  1.0
lr:  0.001052797581658519
weight_decay:  2.950318583906963e-06
dropout:  0.30000000000000004
fix split and run 3 times
Data: Data(x=[3327, 3703], y=[3327], train_mask=[3327], val_mask=[3327], test_mask=[3327], adj_t=[3327, 3327, nnz=9104])
num_train tensor(120)
num_noise 0
noise: tensor(0)
data feature 3703
ALTOPT(
  (lins): Sequential(
    (0): Linear(in_features=3703, out_features=64, bias=True)
    (1): BatchNorm1d(64, eps=1e-05, momentum=0.1, affine=True, track_running_stats=True)
    (2): Dropout(p=0.30000000000000004, inplace=True)
    (3): ReLU(inplace=True)
    (4): Linear(in_features=64, out_features=6, bias=True)
    (5): LogSoftmax(dim=-1)
  )
  (prop): Propagation(K=10, mode=None, lambda1=None, lambda2=None, L21=True, alpha=1.0)
  (gcn): GCN(
    (convs): ModuleList(
      (0): GCNConv(3703, 64)
      (1): GCNConv(64, 6)
    )
    (bns): ModuleList(
      (0): BatchNorm1d(64, eps=1e-05, momentum=0.1, affine=True, track_running_stats=True)
    )
    (output): LogSoftmax(dim=-1)
  )
)
propagate done
init label
Split: 01, Run: 01
None time:  0.866702264174819
None Run 01:
Highest Train: 100.00
Highest Valid: 70.20
  Final Train: 100.00
   Final Test: 69.20
Split: 01, Run: 02
None time:  0.9503114419057965
None Run 02:
Highest Train: 100.00
Highest Valid: 68.80
  Final Train: 100.00
   Final Test: 68.70
Split: 01, Run: 03
None time:  0.8683941159397364
None Run 03:
Highest Train: 100.00
Highest Valid: 71.40
  Final Train: 100.00
   Final Test: 69.30
run time now: 2.729649782180786
total time:  2.786562397144735
None All runs:
Highest Train: 100.00 ± 0.00
Highest Valid: 70.13 ± 1.30
  Final Train: 100.00 ± 0.00
   Final Test: 69.07 ± 0.32
[I 2023-06-11 23:24:09,446] Trial 52 finished with value: 70.13333129882812 and parameters: {'Fwd': 0.027557828000509575, 'K': 10, 'alpha': 1.0, 'dropout': 0.30000000000000004, 'gnnepoch': 100, 'lambda1': 0.2, 'lambda2': 3.337844827961835, 'loop': 0, 'loss': 'CE', 'lr': 0.001052797581658519, 'softmaxF': True, 'useGCN': True, 'weight_decay': 2.950318583906963e-06, 'weightedloss': True}. Best is trial 43 with value: 71.66666412353516.
/home/wxy/miniconda3/lib/python3.10/site-packages/optuna/distributions.py:685: UserWarning: The distribution is specified by [0, 1.00001] and step=0.05, but the range is not divisible by `step`. It will be replaced by [0, 1.0].
  warnings.warn(
K:  10
alpha:  0.8
lr:  0.0017194995354140258
weight_decay:  1.5047296262065971e-06
dropout:  0.4
fix split and run 3 times
Data: Data(x=[3327, 3703], y=[3327], train_mask=[3327], val_mask=[3327], test_mask=[3327], adj_t=[3327, 3327, nnz=9104])
num_train tensor(120)
num_noise 0
noise: tensor(0)
data feature 3703
ALTOPT(
  (lins): Sequential(
    (0): Linear(in_features=3703, out_features=64, bias=True)
    (1): BatchNorm1d(64, eps=1e-05, momentum=0.1, affine=True, track_running_stats=True)
    (2): Dropout(p=0.4, inplace=True)
    (3): ReLU(inplace=True)
    (4): Linear(in_features=64, out_features=6, bias=True)
    (5): LogSoftmax(dim=-1)
  )
  (prop): Propagation(K=10, mode=None, lambda1=None, lambda2=None, L21=True, alpha=0.8)
  (gcn): GCN(
    (convs): ModuleList(
      (0): GCNConv(3703, 64)
      (1): GCNConv(64, 6)
    )
    (bns): ModuleList(
      (0): BatchNorm1d(64, eps=1e-05, momentum=0.1, affine=True, track_running_stats=True)
    )
    (output): LogSoftmax(dim=-1)
  )
)
propagate done
init label
Split: 01, Run: 01
None time:  1.0745127550326288
None Run 01:
Highest Train: 100.00
Highest Valid: 71.60
  Final Train: 100.00
   Final Test: 69.90
Split: 01, Run: 02
None time:  0.9521822689566761
None Run 02:
Highest Train: 100.00
Highest Valid: 70.20
  Final Train: 100.00
   Final Test: 69.20
Split: 01, Run: 03
None time:  0.9959087900351733
None Run 03:
Highest Train: 100.00
Highest Valid: 70.60
  Final Train: 100.00
   Final Test: 69.80
run time now: 3.065483570098877
total time:  3.116296375868842
None All runs:
Highest Train: 100.00 ± 0.00
Highest Valid: 70.80 ± 0.72
  Final Train: 100.00 ± 0.00
   Final Test: 69.63 ± 0.38
