[I 2023-06-11 23:42:12,008] Trial 341 finished with value: 71.73333740234375 and parameters: {'Fwd': 0.031404087233858784, 'K': 8, 'alpha': 0.75, 'dropout': 0.8, 'gnnepoch': 120, 'lambda1': 0.7000000000000001, 'lambda2': 6.646326353410462, 'loop': 0, 'loss': 'CE', 'lr': 0.0015097494113368243, 'softmaxF': False, 'useGCN': True, 'weight_decay': 2.016125141247889e-05, 'weightedloss': True}. Best is trial 271 with value: 72.06666564941406.
/home/wxy/miniconda3/lib/python3.10/site-packages/optuna/distributions.py:685: UserWarning: The distribution is specified by [0, 1.00001] and step=0.05, but the range is not divisible by `step`. It will be replaced by [0, 1.0].
  warnings.warn(
K:  8
alpha:  0.75
lr:  0.0013956207412986407
weight_decay:  1.499254537028843e-05
dropout:  0.8
fix split and run 3 times
Data: Data(x=[3327, 3703], y=[3327], train_mask=[3327], val_mask=[3327], test_mask=[3327], adj_t=[3327, 3327, nnz=9104])
num_train tensor(120)
num_noise 0
noise: tensor(0)
data feature 3703
ALTOPT(
  (lins): Sequential(
    (0): Linear(in_features=3703, out_features=64, bias=True)
    (1): BatchNorm1d(64, eps=1e-05, momentum=0.1, affine=True, track_running_stats=True)
    (2): Dropout(p=0.8, inplace=True)
    (3): ReLU(inplace=True)
    (4): Linear(in_features=64, out_features=6, bias=True)
    (5): LogSoftmax(dim=-1)
  )
  (prop): Propagation(K=8, mode=None, lambda1=None, lambda2=None, L21=True, alpha=0.75)
  (gcn): GCN(
    (convs): ModuleList(
      (0): GCNConv(3703, 64)
      (1): GCNConv(64, 6)
    )
    (bns): ModuleList(
      (0): BatchNorm1d(64, eps=1e-05, momentum=0.1, affine=True, track_running_stats=True)
    )
    (output): LogSoftmax(dim=-1)
  )
)
propagate done
init label
Split: 01, Run: 01
None time:  1.0806503198109567
None Run 01:
Highest Train: 100.00
Highest Valid: 71.60
  Final Train: 100.00
   Final Test: 69.70
Split: 01, Run: 02
None time:  1.0332760089077055
None Run 02:
Highest Train: 100.00
Highest Valid: 72.20
  Final Train: 100.00
   Final Test: 69.90
Split: 01, Run: 03
None time:  1.1535893520340323
None Run 03:
Highest Train: 100.00
Highest Valid: 72.00
  Final Train: 100.00
   Final Test: 70.20
run time now: 3.308627128601074
total time:  3.366927476134151
None All runs:
Highest Train: 100.00 ± 0.00
Highest Valid: 71.93 ± 0.31
  Final Train: 100.00 ± 0.00
   Final Test: 69.93 ± 0.25
[I 2023-06-11 23:42:15,876] Trial 342 finished with value: 71.9333267211914 and parameters: {'Fwd': 0.04763216144027363, 'K': 8, 'alpha': 0.75, 'dropout': 0.8, 'gnnepoch': 120, 'lambda1': 0.7000000000000001, 'lambda2': 4.894383830007154, 'loop': 0, 'loss': 'CE', 'lr': 0.0013956207412986407, 'softmaxF': False, 'useGCN': True, 'weight_decay': 1.499254537028843e-05, 'weightedloss': True}. Best is trial 271 with value: 72.06666564941406.
/home/wxy/miniconda3/lib/python3.10/site-packages/optuna/distributions.py:685: UserWarning: The distribution is specified by [0, 1.00001] and step=0.05, but the range is not divisible by `step`. It will be replaced by [0, 1.0].
  warnings.warn(
K:  8
alpha:  0.75
lr:  0.0013556016825476763
weight_decay:  1.5314023096896343e-05
dropout:  0.8
fix split and run 3 times
Data: Data(x=[3327, 3703], y=[3327], train_mask=[3327], val_mask=[3327], test_mask=[3327], adj_t=[3327, 3327, nnz=9104])
num_train tensor(120)
num_noise 0
noise: tensor(0)
data feature 3703
ALTOPT(
  (lins): Sequential(
    (0): Linear(in_features=3703, out_features=64, bias=True)
    (1): BatchNorm1d(64, eps=1e-05, momentum=0.1, affine=True, track_running_stats=True)
    (2): Dropout(p=0.8, inplace=True)
    (3): ReLU(inplace=True)
    (4): Linear(in_features=64, out_features=6, bias=True)
    (5): LogSoftmax(dim=-1)
  )
  (prop): Propagation(K=8, mode=None, lambda1=None, lambda2=None, L21=True, alpha=0.75)
  (gcn): GCN(
    (convs): ModuleList(
      (0): GCNConv(3703, 64)
      (1): GCNConv(64, 6)
    )
    (bns): ModuleList(
      (0): BatchNorm1d(64, eps=1e-05, momentum=0.1, affine=True, track_running_stats=True)
    )
    (output): LogSoftmax(dim=-1)
  )
)
propagate done
init label
Split: 01, Run: 01
None time:  1.0775829448830336
None Run 01:
Highest Train: 100.00
Highest Valid: 71.60
  Final Train: 100.00
   Final Test: 69.70
Split: 01, Run: 02
None time:  1.1519429781474173
None Run 02:
Highest Train: 100.00
Highest Valid: 72.40
  Final Train: 100.00
   Final Test: 70.10
Split: 01, Run: 03
None time:  1.0760592340957373
None Run 03:
Highest Train: 100.00
Highest Valid: 72.00
  Final Train: 100.00
   Final Test: 70.10
run time now: 3.3525569438934326
total time:  3.4112641979008913
None All runs:
Highest Train: 100.00 ± 0.00
Highest Valid: 72.00 ± 0.40
  Final Train: 100.00 ± 0.00
   Final Test: 69.97 ± 0.23
[I 2023-06-11 23:42:19,794] Trial 343 finished with value: 72.0 and parameters: {'Fwd': 0.05226760111923603, 'K': 8, 'alpha': 0.75, 'dropout': 0.8, 'gnnepoch': 120, 'lambda1': 0.65, 'lambda2': 5.163095391028969, 'loop': 0, 'loss': 'CE', 'lr': 0.0013556016825476763, 'softmaxF': True, 'useGCN': True, 'weight_decay': 1.5314023096896343e-05, 'weightedloss': True}. Best is trial 271 with value: 72.06666564941406.
/home/wxy/miniconda3/lib/python3.10/site-packages/optuna/distributions.py:685: UserWarning: The distribution is specified by [0, 1.00001] and step=0.05, but the range is not divisible by `step`. It will be replaced by [0, 1.0].
  warnings.warn(
K:  8
alpha:  0.75
lr:  0.0013916016869366886
weight_decay:  0.005177229014333365
dropout:  0.8
fix split and run 3 times
Data: Data(x=[3327, 3703], y=[3327], train_mask=[3327], val_mask=[3327], test_mask=[3327], adj_t=[3327, 3327, nnz=9104])
num_train tensor(120)
num_noise 0
noise: tensor(0)
data feature 3703
ALTOPT(
  (lins): Sequential(
    (0): Linear(in_features=3703, out_features=64, bias=True)
    (1): BatchNorm1d(64, eps=1e-05, momentum=0.1, affine=True, track_running_stats=True)
    (2): Dropout(p=0.8, inplace=True)
    (3): ReLU(inplace=True)
    (4): Linear(in_features=64, out_features=6, bias=True)
    (5): LogSoftmax(dim=-1)
  )
  (prop): Propagation(K=8, mode=None, lambda1=None, lambda2=None, L21=True, alpha=0.75)
  (gcn): GCN(
    (convs): ModuleList(
      (0): GCNConv(3703, 64)
      (1): GCNConv(64, 6)
    )
    (bns): ModuleList(
      (0): BatchNorm1d(64, eps=1e-05, momentum=0.1, affine=True, track_running_stats=True)
    )
    (output): LogSoftmax(dim=-1)
  )
)
propagate done
init label
Split: 01, Run: 01
None time:  0.9705172530375421
None Run 01:
Highest Train: 100.00
Highest Valid: 71.00
  Final Train: 100.00
   Final Test: 69.90
Split: 01, Run: 02, Epoch: 100, Loss: 0.0000, Train: 100.00%, Valid: 68.80% Test: 68.00%
Split: 01, Run: 02
None time:  1.8020278681069613
None Run 02:
Highest Train: 100.00
Highest Valid: 68.80
  Final Train: 100.00
   Final Test: 68.50
Split: 01, Run: 03
None time:  0.9058467079885304
None Run 03:
Highest Train: 100.00
Highest Valid: 71.20
  Final Train: 100.00
   Final Test: 70.40
run time now: 3.721809148788452
total time:  3.7750049370806664
None All runs:
Highest Train: 100.00 ± 0.00
Highest Valid: 70.33 ± 1.33
  Final Train: 100.00 ± 0.00
   Final Test: 69.60 ± 0.98
[I 2023-06-11 23:42:24,039] Trial 344 finished with value: 70.33333587646484 and parameters: {'Fwd': 0.05297427496850215, 'K': 8, 'alpha': 0.75, 'dropout': 0.8, 'gnnepoch': 110, 'lambda1': 0.65, 'lambda2': 4.754207401330465, 'loop': 0, 'loss': 'CE', 'lr': 0.0013916016869366886, 'softmaxF': True, 'useGCN': True, 'weight_decay': 0.005177229014333365, 'weightedloss': True}. Best is trial 271 with value: 72.06666564941406.
/home/wxy/miniconda3/lib/python3.10/site-packages/optuna/distributions.py:685: UserWarning: The distribution is specified by [0, 1.00001] and step=0.05, but the range is not divisible by `step`. It will be replaced by [0, 1.0].
  warnings.warn(
K:  8
alpha:  0.8
lr:  0.001631075814910079
weight_decay:  1.6828390469401667e-05
dropout:  0.8
fix split and run 3 times
Data: Data(x=[3327, 3703], y=[3327], train_mask=[3327], val_mask=[3327], test_mask=[3327], adj_t=[3327, 3327, nnz=9104])
num_train tensor(120)
num_noise 0
noise: tensor(0)
data feature 3703
ALTOPT(
  (lins): Sequential(
    (0): Linear(in_features=3703, out_features=64, bias=True)
    (1): BatchNorm1d(64, eps=1e-05, momentum=0.1, affine=True, track_running_stats=True)
    (2): Dropout(p=0.8, inplace=True)
    (3): ReLU(inplace=True)
    (4): Linear(in_features=64, out_features=6, bias=True)
    (5): LogSoftmax(dim=-1)
  )
  (prop): Propagation(K=8, mode=None, lambda1=None, lambda2=None, L21=True, alpha=0.8)
  (gcn): GCN(
    (convs): ModuleList(
      (0): GCNConv(3703, 64)
      (1): GCNConv(64, 6)
    )
    (bns): ModuleList(
      (0): BatchNorm1d(64, eps=1e-05, momentum=0.1, affine=True, track_running_stats=True)
    )
    (output): LogSoftmax(dim=-1)
  )
)
propagate done
init label
Split: 01, Run: 01
None time:  1.064463583054021
None Run 01:
Highest Train: 100.00
Highest Valid: 71.40
  Final Train: 100.00
   Final Test: 69.50
Split: 01, Run: 02
None time:  1.0572757190093398
None Run 02:
Highest Train: 100.00
Highest Valid: 72.20
  Final Train: 100.00
   Final Test: 70.20
Split: 01, Run: 03
None time:  1.10123704187572
None Run 03:
Highest Train: 100.00
Highest Valid: 72.00
  Final Train: 100.00
   Final Test: 70.10
run time now: 3.2647597789764404
total time:  3.320755163906142
None All runs:
Highest Train: 100.00 ± 0.00
Highest Valid: 71.87 ± 0.42
  Final Train: 100.00 ± 0.00
   Final Test: 69.93 ± 0.38
[I 2023-06-11 23:42:27,871] Trial 345 finished with value: 71.86666870117188 and parameters: {'Fwd': 0.06251255891044927, 'K': 8, 'alpha': 0.8, 'dropout': 0.8, 'gnnepoch': 120, 'lambda1': 0.6000000000000001, 'lambda2': 5.1740036994338, 'loop': 0, 'loss': 'CE', 'lr': 0.001631075814910079, 'softmaxF': True, 'useGCN': True, 'weight_decay': 1.6828390469401667e-05, 'weightedloss': True}. Best is trial 271 with value: 72.06666564941406.
/home/wxy/miniconda3/lib/python3.10/site-packages/optuna/distributions.py:685: UserWarning: The distribution is specified by [0, 1.00001] and step=0.05, but the range is not divisible by `step`. It will be replaced by [0, 1.0].
  warnings.warn(
K:  8
alpha:  0.75
lr:  0.0015339201575092728
weight_decay:  9.469058413836771e-05
dropout:  0.8
fix split and run 3 times
Data: Data(x=[3327, 3703], y=[3327], train_mask=[3327], val_mask=[3327], test_mask=[3327], adj_t=[3327, 3327, nnz=9104])
num_train tensor(120)
num_noise 0
noise: tensor(0)
data feature 3703
ALTOPT(
  (lins): Sequential(
    (0): Linear(in_features=3703, out_features=64, bias=True)
    (1): BatchNorm1d(64, eps=1e-05, momentum=0.1, affine=True, track_running_stats=True)
    (2): Dropout(p=0.8, inplace=True)
    (3): ReLU(inplace=True)
    (4): Linear(in_features=64, out_features=6, bias=True)
    (5): LogSoftmax(dim=-1)
  )
  (prop): Propagation(K=8, mode=None, lambda1=None, lambda2=None, L21=True, alpha=0.75)
  (gcn): GCN(
    (convs): ModuleList(
      (0): GCNConv(3703, 64)
      (1): GCNConv(64, 6)
    )
    (bns): ModuleList(
      (0): BatchNorm1d(64, eps=1e-05, momentum=0.1, affine=True, track_running_stats=True)
    )
    (output): LogSoftmax(dim=-1)
  )
)
propagate done
init label
Split: 01, Run: 01
None time:  0.9871037739794701
None Run 01:
Highest Train: 100.00
Highest Valid: 71.20
  Final Train: 100.00
   Final Test: 70.00
Split: 01, Run: 02
None time:  0.9346882819663733
None Run 02:
Highest Train: 100.00
Highest Valid: 68.80
  Final Train: 100.00
   Final Test: 68.90
Split: 01, Run: 03
None time:  0.9302369880024344
None Run 03:
Highest Train: 100.00
Highest Valid: 71.60
  Final Train: 100.00
   Final Test: 70.30
run time now: 2.894335985183716
total time:  2.9488356271758676
None All runs:
Highest Train: 100.00 ± 0.00
Highest Valid: 70.53 ± 1.51
  Final Train: 100.00 ± 0.00
   Final Test: 69.73 ± 0.74
[I 2023-06-11 23:42:31,272] Trial 346 finished with value: 70.53333282470703 and parameters: {'Fwd': 0.029044403294250603, 'K': 8, 'alpha': 0.75, 'dropout': 0.8, 'gnnepoch': 110, 'lambda1': 0.65, 'lambda2': 5.490745547223877, 'loop': 0, 'loss': 'CE', 'lr': 0.0015339201575092728, 'softmaxF': True, 'useGCN': True, 'weight_decay': 9.469058413836771e-05, 'weightedloss': True}. Best is trial 271 with value: 72.06666564941406.
/home/wxy/miniconda3/lib/python3.10/site-packages/optuna/distributions.py:685: UserWarning: The distribution is specified by [0, 1.00001] and step=0.05, but the range is not divisible by `step`. It will be replaced by [0, 1.0].
  warnings.warn(
K:  8
alpha:  0.8
lr:  0.0013370802282008092
weight_decay:  2.411444506184484e-05
dropout:  0.8
fix split and run 3 times
Data: Data(x=[3327, 3703], y=[3327], train_mask=[3327], val_mask=[3327], test_mask=[3327], adj_t=[3327, 3327, nnz=9104])
num_train tensor(120)
num_noise 0
noise: tensor(0)
data feature 3703
ALTOPT(
  (lins): Sequential(
    (0): Linear(in_features=3703, out_features=64, bias=True)
    (1): BatchNorm1d(64, eps=1e-05, momentum=0.1, affine=True, track_running_stats=True)
    (2): Dropout(p=0.8, inplace=True)
    (3): ReLU(inplace=True)
    (4): Linear(in_features=64, out_features=6, bias=True)
    (5): LogSoftmax(dim=-1)
  )
  (prop): Propagation(K=8, mode=None, lambda1=None, lambda2=None, L21=True, alpha=0.8)
  (gcn): GCN(
    (convs): ModuleList(
      (0): GCNConv(3703, 64)
      (1): GCNConv(64, 6)
    )
    (bns): ModuleList(
      (0): BatchNorm1d(64, eps=1e-05, momentum=0.1, affine=True, track_running_stats=True)
    )
    (output): LogSoftmax(dim=-1)
  )
)
propagate done
init label
Split: 01, Run: 01
None time:  1.0111683760769665
None Run 01:
Highest Train: 100.00
Highest Valid: 71.60
  Final Train: 100.00
   Final Test: 69.80
Split: 01, Run: 02
None time:  1.1057539349421859
None Run 02:
Highest Train: 100.00
Highest Valid: 72.40
  Final Train: 100.00
   Final Test: 70.10
Split: 01, Run: 03
None time:  0.9899600511416793
None Run 03:
Highest Train: 100.00
Highest Valid: 72.00
  Final Train: 100.00
   Final Test: 70.10
run time now: 3.155954360961914
total time:  3.2179450190160424
None All runs:
Highest Train: 100.00 ± 0.00
Highest Valid: 72.00 ± 0.40
  Final Train: 100.00 ± 0.00
   Final Test: 70.00 ± 0.17
[I 2023-06-11 23:42:34,946] Trial 347 finished with value: 72.0 and parameters: {'Fwd': 0.0518501460317296, 'K': 8, 'alpha': 0.8, 'dropout': 0.8, 'gnnepoch': 120, 'lambda1': 0.7000000000000001, 'lambda2': 9.275257425140177, 'loop': 0, 'loss': 'CE', 'lr': 0.0013370802282008092, 'softmaxF': True, 'useGCN': True, 'weight_decay': 2.411444506184484e-05, 'weightedloss': True}. Best is trial 271 with value: 72.06666564941406.
/home/wxy/miniconda3/lib/python3.10/site-packages/optuna/distributions.py:685: UserWarning: The distribution is specified by [0, 1.00001] and step=0.05, but the range is not divisible by `step`. It will be replaced by [0, 1.0].
  warnings.warn(
K:  8
alpha:  0.8
lr:  0.0017372545159569572
weight_decay:  2.6712513674219816e-05
dropout:  0.0
fix split and run 3 times
Data: Data(x=[3327, 3703], y=[3327], train_mask=[3327], val_mask=[3327], test_mask=[3327], adj_t=[3327, 3327, nnz=9104])
num_train tensor(120)
num_noise 0
noise: tensor(0)
data feature 3703
ALTOPT(
  (lins): Sequential(
    (0): Linear(in_features=3703, out_features=64, bias=True)
    (1): BatchNorm1d(64, eps=1e-05, momentum=0.1, affine=True, track_running_stats=True)
    (2): Dropout(p=0.0, inplace=True)
    (3): ReLU(inplace=True)
    (4): Linear(in_features=64, out_features=6, bias=True)
    (5): LogSoftmax(dim=-1)
  )
  (prop): Propagation(K=8, mode=None, lambda1=None, lambda2=None, L21=True, alpha=0.8)
  (gcn): GCN(
    (convs): ModuleList(
      (0): GCNConv(3703, 64)
      (1): GCNConv(64, 6)
    )
    (bns): ModuleList(
      (0): BatchNorm1d(64, eps=1e-05, momentum=0.1, affine=True, track_running_stats=True)
    )
    (output): LogSoftmax(dim=-1)
  )
)
propagate done
init label
Split: 01, Run: 01
None time:  0.9937912770546973
None Run 01:
Highest Train: 100.00
Highest Valid: 71.20
  Final Train: 100.00
   Final Test: 69.60
Split: 01, Run: 02, Epoch: 100, Loss: 0.0000, Train: 100.00%, Valid: 70.40% Test: 68.30%
Split: 01, Run: 02
None time:  1.8064201939851046
None Run 02:
Highest Train: 100.00
Highest Valid: 70.40
  Final Train: 100.00
   Final Test: 68.60
Split: 01, Run: 03
None time:  0.9855342339724302
None Run 03:
Highest Train: 100.00
Highest Valid: 69.60
  Final Train: 100.00
   Final Test: 68.70
run time now: 3.833798408508301
total time:  3.892699504038319
None All runs:
Highest Train: 100.00 ± 0.00
Highest Valid: 70.40 ± 0.80
  Final Train: 100.00 ± 0.00
   Final Test: 68.97 ± 0.55
[I 2023-06-11 23:42:39,319] Trial 348 finished with value: 70.4000015258789 and parameters: {'Fwd': 0.06049471128521683, 'K': 8, 'alpha': 0.8, 'dropout': 0.0, 'gnnepoch': 120, 'lambda1': 0.7000000000000001, 'lambda2': 9.27341302774478, 'loop': 0, 'loss': 'CE', 'lr': 0.0017372545159569572, 'softmaxF': True, 'useGCN': True, 'weight_decay': 2.6712513674219816e-05, 'weightedloss': True}. Best is trial 271 with value: 72.06666564941406.
/home/wxy/miniconda3/lib/python3.10/site-packages/optuna/distributions.py:685: UserWarning: The distribution is specified by [0, 1.00001] and step=0.05, but the range is not divisible by `step`. It will be replaced by [0, 1.0].
  warnings.warn(
K:  8
alpha:  0.8500000000000001
lr:  0.0013712199911255988
weight_decay:  3.5481487776249894e-05
dropout:  0.7000000000000001
fix split and run 3 times
Data: Data(x=[3327, 3703], y=[3327], train_mask=[3327], val_mask=[3327], test_mask=[3327], adj_t=[3327, 3327, nnz=9104])
num_train tensor(120)
num_noise 0
noise: tensor(0)
data feature 3703
ALTOPT(
  (lins): Sequential(
    (0): Linear(in_features=3703, out_features=64, bias=True)
    (1): BatchNorm1d(64, eps=1e-05, momentum=0.1, affine=True, track_running_stats=True)
    (2): Dropout(p=0.7000000000000001, inplace=True)
    (3): ReLU(inplace=True)
    (4): Linear(in_features=64, out_features=6, bias=True)
    (5): Identity()
  )
  (prop): Propagation(K=8, mode=None, lambda1=None, lambda2=None, L21=True, alpha=0.8500000000000001)
  (gcn): GCN(
    (convs): ModuleList(
      (0): GCNConv(3703, 64)
      (1): GCNConv(64, 6)
    )
    (bns): ModuleList(
      (0): BatchNorm1d(64, eps=1e-05, momentum=0.1, affine=True, track_running_stats=True)
    )
    (output): Identity()
  )
)
propagate done
init label
Split: 01, Run: 01, Epoch: 100, Loss: 0.0000, Train: 100.00%, Valid: 69.20% Test: 69.60%
Split: 01, Run: 01
None time:  1.8354608309455216
None Run 01:
Highest Train: 100.00
Highest Valid: 69.20
  Final Train: 100.00
   Final Test: 69.70
Split: 01, Run: 02, Epoch: 100, Loss: 0.0000, Train: 100.00%, Valid: 69.40% Test: 69.60%
Split: 01, Run: 02
None time:  1.7996708110440522
None Run 02:
Highest Train: 100.00
Highest Valid: 69.40
  Final Train: 100.00
   Final Test: 69.50
Split: 01, Run: 03, Epoch: 100, Loss: 0.0000, Train: 100.00%, Valid: 69.40% Test: 69.70%
Split: 01, Run: 03
None time:  1.8444812919478863
None Run 03:
Highest Train: 100.00
Highest Valid: 69.40
  Final Train: 100.00
   Final Test: 69.50
run time now: 5.520092487335205
total time:  5.573339071124792
None All runs:
Highest Train: 100.00 ± 0.00
Highest Valid: 69.33 ± 0.12
  Final Train: 100.00 ± 0.00
   Final Test: 69.57 ± 0.12
[I 2023-06-11 23:42:45,375] Trial 349 finished with value: 69.33333587646484 and parameters: {'Fwd': 0.03917643032510262, 'K': 8, 'alpha': 0.8500000000000001, 'dropout': 0.7000000000000001, 'gnnepoch': 120, 'lambda1': 0.7000000000000001, 'lambda2': 9.750123651935992, 'loop': 0, 'loss': 'MSE', 'lr': 0.0013712199911255988, 'softmaxF': True, 'useGCN': True, 'weight_decay': 3.5481487776249894e-05, 'weightedloss': True}. Best is trial 271 with value: 72.06666564941406.
/home/wxy/miniconda3/lib/python3.10/site-packages/optuna/distributions.py:685: UserWarning: The distribution is specified by [0, 1.00001] and step=0.05, but the range is not divisible by `step`. It will be replaced by [0, 1.0].
  warnings.warn(
K:  8
alpha:  0.75
lr:  0.00018842219344636845
weight_decay:  2.2823739325136165e-05
dropout:  0.8
fix split and run 3 times
Data: Data(x=[3327, 3703], y=[3327], train_mask=[3327], val_mask=[3327], test_mask=[3327], adj_t=[3327, 3327, nnz=9104])
num_train tensor(120)
num_noise 0
noise: tensor(0)
data feature 3703
ALTOPT(
  (lins): Sequential(
    (0): Linear(in_features=3703, out_features=64, bias=True)
    (1): BatchNorm1d(64, eps=1e-05, momentum=0.1, affine=True, track_running_stats=True)
    (2): Dropout(p=0.8, inplace=True)
    (3): ReLU(inplace=True)
    (4): Linear(in_features=64, out_features=6, bias=True)
    (5): LogSoftmax(dim=-1)
  )
  (prop): Propagation(K=8, mode=None, lambda1=None, lambda2=None, L21=True, alpha=0.75)
  (gcn): GCN(
    (convs): ModuleList(
      (0): GCNConv(3703, 64)
      (1): GCNConv(64, 6)
    )
    (bns): ModuleList(
      (0): BatchNorm1d(64, eps=1e-05, momentum=0.1, affine=True, track_running_stats=True)
    )
    (output): LogSoftmax(dim=-1)
  )
)
propagate done
init label
Split: 01, Run: 01
None time:  1.4284811548423022
None Run 01:
Highest Train: 100.00
Highest Valid: 68.60
  Final Train: 100.00
   Final Test: 68.10
Split: 01, Run: 02
None time:  1.3425661630462855
None Run 02:
Highest Train: 100.00
Highest Valid: 68.00
  Final Train: 100.00
   Final Test: 68.00
Split: 01, Run: 03
None time:  1.3363268771208823
None Run 03:
Highest Train: 100.00
Highest Valid: 67.00
  Final Train: 100.00
   Final Test: 67.50
run time now: 4.149115085601807
total time:  4.198893940076232
None All runs:
Highest Train: 100.00 ± 0.00
Highest Valid: 67.87 ± 0.81
  Final Train: 100.00 ± 0.00
   Final Test: 67.87 ± 0.32
