[I 2023-06-12 00:41:53,299] Trial 313 finished with value: 81.0 and parameters: {'Fwd': 0.023114514632268043, 'K': 10, 'alpha': 0.6000000000000001, 'dropout': 0.30000000000000004, 'gnnepoch': 60, 'lambda1': 0.8500000000000001, 'lambda2': 5.721305564703493, 'loop': 1, 'loss': 'CE', 'lr': 0.004757175760897719, 'softmaxF': True, 'useGCN': True, 'weight_decay': 8.153054065005013e-05, 'weightedloss': False}. Best is trial 112 with value: 81.66667175292969.
/home/wxy/miniconda3/lib/python3.10/site-packages/optuna/distributions.py:685: UserWarning: The distribution is specified by [0, 1.00001] and step=0.05, but the range is not divisible by `step`. It will be replaced by [0, 1.0].
  warnings.warn(
K:  10
alpha:  0.5
lr:  0.007895418819298481
weight_decay:  3.505734845723603e-05
dropout:  0.4
fix split and run 3 times
Data: Data(x=[2708, 1433], y=[2708], train_mask=[2708], val_mask=[2708], test_mask=[2708], adj_t=[2708, 2708, nnz=10556])
num_train tensor(140)
num_noise 0
noise: tensor(0)
data feature 1433
ALTOPT(
  (lins): Sequential(
    (0): Linear(in_features=1433, out_features=64, bias=True)
    (1): BatchNorm1d(64, eps=1e-05, momentum=0.1, affine=True, track_running_stats=True)
    (2): Dropout(p=0.4, inplace=True)
    (3): ReLU(inplace=True)
    (4): Linear(in_features=64, out_features=7, bias=True)
    (5): LogSoftmax(dim=-1)
  )
  (prop): Propagation(K=10, mode=None, lambda1=None, lambda2=None, L21=True, alpha=0.5)
  (gcn): GCN(
    (convs): ModuleList(
      (0): GCNConv(1433, 64)
      (1): GCNConv(64, 7)
    )
    (bns): ModuleList(
      (0): BatchNorm1d(64, eps=1e-05, momentum=0.1, affine=True, track_running_stats=True)
    )
    (output): LogSoftmax(dim=-1)
  )
)
propagate done
init label
Split: 01, Run: 01
None time:  1.204565871041268
None Run 01:
Highest Train: 100.00
Highest Valid: 82.00
  Final Train: 100.00
   Final Test: 82.20
Split: 01, Run: 02
None time:  1.6498217058833688
None Run 02:
Highest Train: 100.00
Highest Valid: 81.60
  Final Train: 100.00
   Final Test: 81.30
Split: 01, Run: 03
None time:  1.7811248360667378
None Run 03:
Highest Train: 100.00
Highest Valid: 80.80
  Final Train: 100.00
   Final Test: 80.20
run time now: 4.661138534545898
total time:  4.680431792978197
None All runs:
Highest Train: 100.00 ± 0.00
Highest Valid: 81.47 ± 0.61
  Final Train: 100.00 ± 0.00
   Final Test: 81.23 ± 1.00
[I 2023-06-12 00:41:58,450] Trial 314 finished with value: 81.46666717529297 and parameters: {'Fwd': 0.07974459044307967, 'K': 10, 'alpha': 0.5, 'dropout': 0.4, 'gnnepoch': 60, 'lambda1': 0.9, 'lambda2': 5.260050341054186, 'loop': 1, 'loss': 'CE', 'lr': 0.007895418819298481, 'softmaxF': True, 'useGCN': True, 'weight_decay': 3.505734845723603e-05, 'weightedloss': False}. Best is trial 112 with value: 81.66667175292969.
/home/wxy/miniconda3/lib/python3.10/site-packages/optuna/distributions.py:685: UserWarning: The distribution is specified by [0, 1.00001] and step=0.05, but the range is not divisible by `step`. It will be replaced by [0, 1.0].
  warnings.warn(
K:  10
alpha:  0.65
lr:  0.0012276569370996626
weight_decay:  5.8865290368908144e-05
dropout:  0.4
fix split and run 3 times
Data: Data(x=[2708, 1433], y=[2708], train_mask=[2708], val_mask=[2708], test_mask=[2708], adj_t=[2708, 2708, nnz=10556])
num_train tensor(140)
num_noise 0
noise: tensor(0)
data feature 1433
ALTOPT(
  (lins): Sequential(
    (0): Linear(in_features=1433, out_features=64, bias=True)
    (1): BatchNorm1d(64, eps=1e-05, momentum=0.1, affine=True, track_running_stats=True)
    (2): Dropout(p=0.4, inplace=True)
    (3): ReLU(inplace=True)
    (4): Linear(in_features=64, out_features=7, bias=True)
    (5): LogSoftmax(dim=-1)
  )
  (prop): Propagation(K=10, mode=None, lambda1=None, lambda2=None, L21=True, alpha=0.65)
  (gcn): GCN(
    (convs): ModuleList(
      (0): GCNConv(1433, 64)
      (1): GCNConv(64, 7)
    )
    (bns): ModuleList(
      (0): BatchNorm1d(64, eps=1e-05, momentum=0.1, affine=True, track_running_stats=True)
    )
    (output): LogSoftmax(dim=-1)
  )
)
propagate done
init label
Split: 01, Run: 01
None time:  1.0978218580130488
None Run 01:
Highest Train: 100.00
Highest Valid: 78.40
  Final Train: 100.00
   Final Test: 78.20
Split: 01, Run: 02
None time:  1.3534738649614155
None Run 02:
Highest Train: 100.00
Highest Valid: 79.80
  Final Train: 100.00
   Final Test: 80.90
Split: 01, Run: 03
None time:  1.1489180251955986
None Run 03:
Highest Train: 100.00
Highest Valid: 79.00
  Final Train: 100.00
   Final Test: 78.80
run time now: 3.6241719722747803
total time:  3.6487845219671726
None All runs:
Highest Train: 100.00 ± 0.00
Highest Valid: 79.07 ± 0.70
  Final Train: 100.00 ± 0.00
   Final Test: 79.30 ± 1.42
[I 2023-06-12 00:42:02,583] Trial 315 finished with value: 79.06666564941406 and parameters: {'Fwd': 0.06344225800879262, 'K': 10, 'alpha': 0.65, 'dropout': 0.4, 'gnnepoch': 70, 'lambda1': 0.75, 'lambda2': 4.837366283290293, 'loop': 1, 'loss': 'CE', 'lr': 0.0012276569370996626, 'softmaxF': True, 'useGCN': False, 'weight_decay': 5.8865290368908144e-05, 'weightedloss': True}. Best is trial 112 with value: 81.66667175292969.
/home/wxy/miniconda3/lib/python3.10/site-packages/optuna/distributions.py:685: UserWarning: The distribution is specified by [0, 1.00001] and step=0.05, but the range is not divisible by `step`. It will be replaced by [0, 1.0].
  warnings.warn(
K:  10
alpha:  0.8
lr:  0.006707689731729407
weight_decay:  0.00010590570809416946
dropout:  0.5
fix split and run 3 times
Data: Data(x=[2708, 1433], y=[2708], train_mask=[2708], val_mask=[2708], test_mask=[2708], adj_t=[2708, 2708, nnz=10556])
num_train tensor(140)
num_noise 0
noise: tensor(0)
data feature 1433
ALTOPT(
  (lins): Sequential(
    (0): Linear(in_features=1433, out_features=64, bias=True)
    (1): BatchNorm1d(64, eps=1e-05, momentum=0.1, affine=True, track_running_stats=True)
    (2): Dropout(p=0.5, inplace=True)
    (3): ReLU(inplace=True)
    (4): Linear(in_features=64, out_features=7, bias=True)
    (5): LogSoftmax(dim=-1)
  )
  (prop): Propagation(K=10, mode=None, lambda1=None, lambda2=None, L21=True, alpha=0.8)
  (gcn): GCN(
    (convs): ModuleList(
      (0): GCNConv(1433, 64)
      (1): GCNConv(64, 7)
    )
    (bns): ModuleList(
      (0): BatchNorm1d(64, eps=1e-05, momentum=0.1, affine=True, track_running_stats=True)
    )
    (output): LogSoftmax(dim=-1)
  )
)
propagate done
init label
Split: 01, Run: 01
None time:  1.000392350135371
None Run 01:
Highest Train: 100.00
Highest Valid: 81.20
  Final Train: 100.00
   Final Test: 81.80
Split: 01, Run: 02
None time:  1.5464910201262683
None Run 02:
Highest Train: 100.00
Highest Valid: 80.80
  Final Train: 100.00
   Final Test: 82.30
Split: 01, Run: 03
None time:  1.5178346710745245
None Run 03:
Highest Train: 100.00
Highest Valid: 80.40
  Final Train: 100.00
   Final Test: 81.50
run time now: 4.087533712387085
total time:  4.102367534069344
None All runs:
Highest Train: 100.00 ± 0.00
Highest Valid: 80.80 ± 0.40
  Final Train: 100.00 ± 0.00
   Final Test: 81.87 ± 0.40
[I 2023-06-12 00:42:07,215] Trial 316 finished with value: 80.79999542236328 and parameters: {'Fwd': 0.09957449098996111, 'K': 10, 'alpha': 0.8, 'dropout': 0.5, 'gnnepoch': 50, 'lambda1': 0.8500000000000001, 'lambda2': 5.5798704871081215, 'loop': 1, 'loss': 'CE', 'lr': 0.006707689731729407, 'softmaxF': True, 'useGCN': True, 'weight_decay': 0.00010590570809416946, 'weightedloss': False}. Best is trial 112 with value: 81.66667175292969.
/home/wxy/miniconda3/lib/python3.10/site-packages/optuna/distributions.py:685: UserWarning: The distribution is specified by [0, 1.00001] and step=0.05, but the range is not divisible by `step`. It will be replaced by [0, 1.0].
  warnings.warn(
K:  10
alpha:  0.45
lr:  0.008384845023639552
weight_decay:  0.0004338405742144413
dropout:  0.4
fix split and run 3 times
Data: Data(x=[2708, 1433], y=[2708], train_mask=[2708], val_mask=[2708], test_mask=[2708], adj_t=[2708, 2708, nnz=10556])
num_train tensor(140)
num_noise 0
noise: tensor(0)
data feature 1433
ALTOPT(
  (lins): Sequential(
    (0): Linear(in_features=1433, out_features=64, bias=True)
    (1): BatchNorm1d(64, eps=1e-05, momentum=0.1, affine=True, track_running_stats=True)
    (2): Dropout(p=0.4, inplace=True)
    (3): ReLU(inplace=True)
    (4): Linear(in_features=64, out_features=7, bias=True)
    (5): LogSoftmax(dim=-1)
  )
  (prop): Propagation(K=10, mode=None, lambda1=None, lambda2=None, L21=True, alpha=0.45)
  (gcn): GCN(
    (convs): ModuleList(
      (0): GCNConv(1433, 64)
      (1): GCNConv(64, 7)
    )
    (bns): ModuleList(
      (0): BatchNorm1d(64, eps=1e-05, momentum=0.1, affine=True, track_running_stats=True)
    )
    (output): LogSoftmax(dim=-1)
  )
)
propagate done
init label
Split: 01, Run: 01
None time:  1.6191700419876724
None Run 01:
Highest Train: 100.00
Highest Valid: 81.80
  Final Train: 100.00
   Final Test: 82.00
Split: 01, Run: 02
None time:  1.478153983131051
None Run 02:
Highest Train: 100.00
Highest Valid: 81.20
  Final Train: 100.00
   Final Test: 80.80
Split: 01, Run: 03
None time:  1.7660686010494828
None Run 03:
Highest Train: 100.00
Highest Valid: 80.80
  Final Train: 100.00
   Final Test: 81.20
run time now: 4.889507055282593
total time:  4.910033316118643
None All runs:
Highest Train: 100.00 ± 0.00
Highest Valid: 81.27 ± 0.50
  Final Train: 100.00 ± 0.00
   Final Test: 81.33 ± 0.61
[I 2023-06-12 00:42:12,668] Trial 317 finished with value: 81.26667022705078 and parameters: {'Fwd': 0.05284686507242181, 'K': 10, 'alpha': 0.45, 'dropout': 0.4, 'gnnepoch': 60, 'lambda1': 0.8500000000000001, 'lambda2': 9.028581033328846, 'loop': 1, 'loss': 'CE', 'lr': 0.008384845023639552, 'softmaxF': True, 'useGCN': True, 'weight_decay': 0.0004338405742144413, 'weightedloss': False}. Best is trial 112 with value: 81.66667175292969.
/home/wxy/miniconda3/lib/python3.10/site-packages/optuna/distributions.py:685: UserWarning: The distribution is specified by [0, 1.00001] and step=0.05, but the range is not divisible by `step`. It will be replaced by [0, 1.0].
  warnings.warn(
K:  10
alpha:  0.55
lr:  0.005876023981707108
weight_decay:  0.007548221117594622
dropout:  0.4
fix split and run 3 times
Data: Data(x=[2708, 1433], y=[2708], train_mask=[2708], val_mask=[2708], test_mask=[2708], adj_t=[2708, 2708, nnz=10556])
num_train tensor(140)
num_noise 0
noise: tensor(0)
data feature 1433
ALTOPT(
  (lins): Sequential(
    (0): Linear(in_features=1433, out_features=64, bias=True)
    (1): BatchNorm1d(64, eps=1e-05, momentum=0.1, affine=True, track_running_stats=True)
    (2): Dropout(p=0.4, inplace=True)
    (3): ReLU(inplace=True)
    (4): Linear(in_features=64, out_features=7, bias=True)
    (5): LogSoftmax(dim=-1)
  )
  (prop): Propagation(K=10, mode=None, lambda1=None, lambda2=None, L21=True, alpha=0.55)
  (gcn): GCN(
    (convs): ModuleList(
      (0): GCNConv(1433, 64)
      (1): GCNConv(64, 7)
    )
    (bns): ModuleList(
      (0): BatchNorm1d(64, eps=1e-05, momentum=0.1, affine=True, track_running_stats=True)
    )
    (output): LogSoftmax(dim=-1)
  )
)
propagate done
init label
Split: 01, Run: 01
None time:  1.2374008500482887
None Run 01:
Highest Train: 100.00
Highest Valid: 81.40
  Final Train: 100.00
   Final Test: 81.70
Split: 01, Run: 02
None time:  1.5895615310873836
None Run 02:
Highest Train: 100.00
Highest Valid: 81.40
  Final Train: 100.00
   Final Test: 81.30
Split: 01, Run: 03
None time:  1.6159999249503016
None Run 03:
Highest Train: 100.00
Highest Valid: 81.00
  Final Train: 100.00
   Final Test: 81.50
run time now: 4.467898845672607
total time:  4.481294174911454
None All runs:
Highest Train: 100.00 ± 0.00
Highest Valid: 81.27 ± 0.23
  Final Train: 100.00 ± 0.00
   Final Test: 81.50 ± 0.20
[I 2023-06-12 00:42:17,773] Trial 318 finished with value: 81.26667022705078 and parameters: {'Fwd': 0.0723091563325097, 'K': 10, 'alpha': 0.55, 'dropout': 0.4, 'gnnepoch': 60, 'lambda1': 0.9, 'lambda2': 5.844500542014889, 'loop': 1, 'loss': 'CE', 'lr': 0.005876023981707108, 'softmaxF': True, 'useGCN': True, 'weight_decay': 0.007548221117594622, 'weightedloss': False}. Best is trial 112 with value: 81.66667175292969.
/home/wxy/miniconda3/lib/python3.10/site-packages/optuna/distributions.py:685: UserWarning: The distribution is specified by [0, 1.00001] and step=0.05, but the range is not divisible by `step`. It will be replaced by [0, 1.0].
  warnings.warn(
K:  10
alpha:  0.35000000000000003
lr:  0.007462459349966262
weight_decay:  4.007088508990595e-06
dropout:  0.4
fix split and run 3 times
Data: Data(x=[2708, 1433], y=[2708], train_mask=[2708], val_mask=[2708], test_mask=[2708], adj_t=[2708, 2708, nnz=10556])
num_train tensor(140)
num_noise 0
noise: tensor(0)
data feature 1433
ALTOPT(
  (lins): Sequential(
    (0): Linear(in_features=1433, out_features=64, bias=True)
    (1): BatchNorm1d(64, eps=1e-05, momentum=0.1, affine=True, track_running_stats=True)
    (2): Dropout(p=0.4, inplace=True)
    (3): ReLU(inplace=True)
    (4): Linear(in_features=64, out_features=7, bias=True)
    (5): LogSoftmax(dim=-1)
  )
  (prop): Propagation(K=10, mode=None, lambda1=None, lambda2=None, L21=True, alpha=0.35000000000000003)
  (gcn): GCN(
    (convs): ModuleList(
      (0): GCNConv(1433, 64)
      (1): GCNConv(64, 7)
    )
    (bns): ModuleList(
      (0): BatchNorm1d(64, eps=1e-05, momentum=0.1, affine=True, track_running_stats=True)
    )
    (output): LogSoftmax(dim=-1)
  )
)
propagate done
init label
Split: 01, Run: 01
None time:  1.6014640321955085
None Run 01:
Highest Train: 100.00
Highest Valid: 80.80
  Final Train: 100.00
   Final Test: 82.60
Split: 01, Run: 02
None time:  1.5232331780716777
None Run 02:
Highest Train: 100.00
Highest Valid: 81.20
  Final Train: 100.00
   Final Test: 81.90
Split: 01, Run: 03
None time:  1.4175679630134255
None Run 03:
Highest Train: 100.00
Highest Valid: 80.80
  Final Train: 100.00
   Final Test: 81.30
run time now: 4.567844390869141
total time:  4.582665445050225
None All runs:
Highest Train: 100.00 ± 0.00
Highest Valid: 80.93 ± 0.23
  Final Train: 100.00 ± 0.00
   Final Test: 81.93 ± 0.65
[I 2023-06-12 00:42:22,832] Trial 319 finished with value: 80.93333435058594 and parameters: {'Fwd': 0.03402590607395188, 'K': 10, 'alpha': 0.35000000000000003, 'dropout': 0.4, 'gnnepoch': 60, 'lambda1': 0.8, 'lambda2': 6.524243728841834, 'loop': 1, 'loss': 'CE', 'lr': 0.007462459349966262, 'softmaxF': False, 'useGCN': True, 'weight_decay': 4.007088508990595e-06, 'weightedloss': True}. Best is trial 112 with value: 81.66667175292969.
/home/wxy/miniconda3/lib/python3.10/site-packages/optuna/distributions.py:685: UserWarning: The distribution is specified by [0, 1.00001] and step=0.05, but the range is not divisible by `step`. It will be replaced by [0, 1.0].
  warnings.warn(
K:  9
alpha:  0.7000000000000001
lr:  0.00653219788881772
weight_decay:  4.6266386045027204e-05
dropout:  0.5
fix split and run 3 times
Data: Data(x=[2708, 1433], y=[2708], train_mask=[2708], val_mask=[2708], test_mask=[2708], adj_t=[2708, 2708, nnz=10556])
num_train tensor(140)
num_noise 0
noise: tensor(0)
data feature 1433
ALTOPT(
  (lins): Sequential(
    (0): Linear(in_features=1433, out_features=64, bias=True)
    (1): BatchNorm1d(64, eps=1e-05, momentum=0.1, affine=True, track_running_stats=True)
    (2): Dropout(p=0.5, inplace=True)
    (3): ReLU(inplace=True)
    (4): Linear(in_features=64, out_features=7, bias=True)
    (5): LogSoftmax(dim=-1)
  )
  (prop): Propagation(K=9, mode=None, lambda1=None, lambda2=None, L21=True, alpha=0.7000000000000001)
  (gcn): GCN(
    (convs): ModuleList(
      (0): GCNConv(1433, 64)
      (1): GCNConv(64, 7)
    )
    (bns): ModuleList(
      (0): BatchNorm1d(64, eps=1e-05, momentum=0.1, affine=True, track_running_stats=True)
    )
    (output): LogSoftmax(dim=-1)
  )
)
propagate done
init label
Split: 01, Run: 01
None time:  1.646246552001685
None Run 01:
Highest Train: 99.29
Highest Valid: 81.40
  Final Train: 97.86
   Final Test: 81.70
Split: 01, Run: 02
None time:  1.6002676282078028
None Run 02:
Highest Train: 99.29
Highest Valid: 80.80
  Final Train: 97.86
   Final Test: 81.00
Split: 01, Run: 03
None time:  1.4568895439151675
None Run 03:
Highest Train: 99.29
Highest Valid: 80.80
  Final Train: 96.43
   Final Test: 80.60
run time now: 4.727928876876831
total time:  4.742021345067769
None All runs:
Highest Train: 99.29 ± 0.00
Highest Valid: 81.00 ± 0.35
  Final Train: 97.38 ± 0.82
   Final Test: 81.10 ± 0.56
[I 2023-06-12 00:42:28,060] Trial 320 finished with value: 81.00000762939453 and parameters: {'Fwd': 0.08061966931559113, 'K': 9, 'alpha': 0.7000000000000001, 'dropout': 0.5, 'gnnepoch': 60, 'lambda1': 0.9500000000000001, 'lambda2': 0.003659792573742493, 'loop': 1, 'loss': 'CE', 'lr': 0.00653219788881772, 'softmaxF': True, 'useGCN': True, 'weight_decay': 4.6266386045027204e-05, 'weightedloss': False}. Best is trial 112 with value: 81.66667175292969.
/home/wxy/miniconda3/lib/python3.10/site-packages/optuna/distributions.py:685: UserWarning: The distribution is specified by [0, 1.00001] and step=0.05, but the range is not divisible by `step`. It will be replaced by [0, 1.0].
  warnings.warn(
K:  10
alpha:  0.6000000000000001
lr:  0.008614240881563704
weight_decay:  7.343176122664192e-05
dropout:  0.4
fix split and run 3 times
Data: Data(x=[2708, 1433], y=[2708], train_mask=[2708], val_mask=[2708], test_mask=[2708], adj_t=[2708, 2708, nnz=10556])
num_train tensor(140)
num_noise 0
noise: tensor(0)
data feature 1433
ALTOPT(
  (lins): Sequential(
    (0): Linear(in_features=1433, out_features=64, bias=True)
    (1): BatchNorm1d(64, eps=1e-05, momentum=0.1, affine=True, track_running_stats=True)
    (2): Dropout(p=0.4, inplace=True)
    (3): ReLU(inplace=True)
    (4): Linear(in_features=64, out_features=7, bias=True)
    (5): LogSoftmax(dim=-1)
  )
  (prop): Propagation(K=10, mode=None, lambda1=None, lambda2=None, L21=True, alpha=0.6000000000000001)
  (gcn): GCN(
    (convs): ModuleList(
      (0): GCNConv(1433, 64)
      (1): GCNConv(64, 7)
    )
    (bns): ModuleList(
      (0): BatchNorm1d(64, eps=1e-05, momentum=0.1, affine=True, track_running_stats=True)
    )
    (output): LogSoftmax(dim=-1)
  )
)
propagate done
init label
Split: 01, Run: 01
None time:  1.8517253049649298
None Run 01:
Highest Train: 100.00
Highest Valid: 81.40
  Final Train: 100.00
   Final Test: 82.40
Split: 01, Run: 02
None time:  1.4720122620929033
None Run 02:
Highest Train: 100.00
Highest Valid: 80.60
  Final Train: 100.00
   Final Test: 80.20
Split: 01, Run: 03
None time:  1.6555592929944396
None Run 03:
Highest Train: 100.00
Highest Valid: 80.80
  Final Train: 100.00
   Final Test: 80.40
run time now: 5.011452913284302
total time:  5.026744021102786
None All runs:
Highest Train: 100.00 ± 0.00
Highest Valid: 80.93 ± 0.42
  Final Train: 100.00 ± 0.00
   Final Test: 81.00 ± 1.22
[I 2023-06-12 00:42:33,538] Trial 321 finished with value: 80.93333435058594 and parameters: {'Fwd': 0.04526515958602397, 'K': 10, 'alpha': 0.6000000000000001, 'dropout': 0.4, 'gnnepoch': 70, 'lambda1': 0.8, 'lambda2': 7.25958028070162, 'loop': 1, 'loss': 'CE', 'lr': 0.008614240881563704, 'softmaxF': True, 'useGCN': True, 'weight_decay': 7.343176122664192e-05, 'weightedloss': False}. Best is trial 112 with value: 81.66667175292969.
/home/wxy/miniconda3/lib/python3.10/site-packages/optuna/distributions.py:685: UserWarning: The distribution is specified by [0, 1.00001] and step=0.05, but the range is not divisible by `step`. It will be replaced by [0, 1.0].
  warnings.warn(
K:  10
alpha:  0.65
lr:  0.002854783149338956
weight_decay:  0.00012069828986754139
dropout:  0.4
fix split and run 3 times
Data: Data(x=[2708, 1433], y=[2708], train_mask=[2708], val_mask=[2708], test_mask=[2708], adj_t=[2708, 2708, nnz=10556])
num_train tensor(140)
num_noise 0
noise: tensor(0)
data feature 1433
ALTOPT(
  (lins): Sequential(
    (0): Linear(in_features=1433, out_features=64, bias=True)
    (1): BatchNorm1d(64, eps=1e-05, momentum=0.1, affine=True, track_running_stats=True)
    (2): Dropout(p=0.4, inplace=True)
    (3): ReLU(inplace=True)
    (4): Linear(in_features=64, out_features=7, bias=True)
    (5): LogSoftmax(dim=-1)
  )
  (prop): Propagation(K=10, mode=None, lambda1=None, lambda2=None, L21=True, alpha=0.65)
  (gcn): GCN(
    (convs): ModuleList(
      (0): GCNConv(1433, 64)
      (1): GCNConv(64, 7)
    )
    (bns): ModuleList(
      (0): BatchNorm1d(64, eps=1e-05, momentum=0.1, affine=True, track_running_stats=True)
    )
    (output): LogSoftmax(dim=-1)
  )
)
propagate done
init label
Split: 01, Run: 01
None time:  1.5528530511073768
None Run 01:
Highest Train: 100.00
Highest Valid: 80.20
  Final Train: 100.00
   Final Test: 80.50
Split: 01, Run: 02
None time:  1.379843742121011
None Run 02:
Highest Train: 100.00
Highest Valid: 79.80
  Final Train: 100.00
   Final Test: 79.70
Split: 01, Run: 03
None time:  1.4318125189747661
None Run 03:
Highest Train: 100.00
Highest Valid: 79.00
  Final Train: 100.00
   Final Test: 79.70
run time now: 4.394428968429565
total time:  4.4137148121371865
None All runs:
Highest Train: 100.00 ± 0.00
Highest Valid: 79.67 ± 0.61
  Final Train: 100.00 ± 0.00
   Final Test: 79.97 ± 0.46
