[I 2023-06-12 00:18:26,979] Trial 52 finished with value: 80.33332824707031 and parameters: {'Fwd': 0.007454766158451968, 'K': 6, 'alpha': 0.9500000000000001, 'dropout': 0.4, 'gnnepoch': 90, 'lambda1': 0.15000000000000002, 'lambda2': 3.677926463223373, 'loop': 1, 'loss': 'MSE', 'lr': 0.003974451003145635, 'softmaxF': True, 'useGCN': True, 'weight_decay': 0.0004004241875748034, 'weightedloss': True}. Best is trial 52 with value: 80.33332824707031.
/home/wxy/miniconda3/lib/python3.10/site-packages/optuna/distributions.py:685: UserWarning: The distribution is specified by [0, 1.00001] and step=0.05, but the range is not divisible by `step`. It will be replaced by [0, 1.0].
  warnings.warn(
K:  7
alpha:  0.9500000000000001
lr:  0.003914085393288612
weight_decay:  0.00045805181585326294
dropout:  0.4
fix split and run 3 times
Data: Data(x=[2708, 1433], y=[2708], train_mask=[2708], val_mask=[2708], test_mask=[2708], adj_t=[2708, 2708, nnz=10556])
num_train tensor(140)
num_noise 0
noise: tensor(0)
data feature 1433
ALTOPT(
  (lins): Sequential(
    (0): Linear(in_features=1433, out_features=64, bias=True)
    (1): BatchNorm1d(64, eps=1e-05, momentum=0.1, affine=True, track_running_stats=True)
    (2): Dropout(p=0.4, inplace=True)
    (3): ReLU(inplace=True)
    (4): Linear(in_features=64, out_features=7, bias=True)
    (5): Identity()
  )
  (prop): Propagation(K=7, mode=None, lambda1=None, lambda2=None, L21=True, alpha=0.9500000000000001)
  (gcn): GCN(
    (convs): ModuleList(
      (0): GCNConv(1433, 64)
      (1): GCNConv(64, 7)
    )
    (bns): ModuleList(
      (0): BatchNorm1d(64, eps=1e-05, momentum=0.1, affine=True, track_running_stats=True)
    )
    (output): Identity()
  )
)
propagate done
init label
Split: 01, Run: 01, Epoch: 100, Loss: 0.0835, Train: 100.00%, Valid: 79.20% Test: 79.70%
Split: 01, Run: 01
None time:  5.50366611010395
None Run 01:
Highest Train: 100.00
Highest Valid: 79.20
  Final Train: 100.00
   Final Test: 79.60
Split: 01, Run: 02
None time:  5.320442265132442
None Run 02:
Highest Train: 100.00
Highest Valid: 80.00
  Final Train: 100.00
   Final Test: 79.90
Split: 01, Run: 03
None time:  1.4735352050047368
None Run 03:
Highest Train: 100.00
Highest Valid: 78.80
  Final Train: 100.00
   Final Test: 78.80
run time now: 12.40198278427124
total time:  12.429570412961766
None All runs:
Highest Train: 100.00 ± 0.00
Highest Valid: 79.33 ± 0.61
  Final Train: 100.00 ± 0.00
   Final Test: 79.43 ± 0.57
[I 2023-06-12 00:18:39,886] Trial 53 finished with value: 79.33333587646484 and parameters: {'Fwd': 0.06632231429607849, 'K': 7, 'alpha': 0.9500000000000001, 'dropout': 0.4, 'gnnepoch': 90, 'lambda1': 0.05, 'lambda2': 3.4810232311410436, 'loop': 1, 'loss': 'MSE', 'lr': 0.003914085393288612, 'softmaxF': True, 'useGCN': True, 'weight_decay': 0.00045805181585326294, 'weightedloss': True}. Best is trial 52 with value: 80.33332824707031.
/home/wxy/miniconda3/lib/python3.10/site-packages/optuna/distributions.py:685: UserWarning: The distribution is specified by [0, 1.00001] and step=0.05, but the range is not divisible by `step`. It will be replaced by [0, 1.0].
  warnings.warn(
K:  6
alpha:  0.8
lr:  0.0063447533663596335
weight_decay:  0.0019550665817475946
dropout:  0.30000000000000004
fix split and run 3 times
Data: Data(x=[2708, 1433], y=[2708], train_mask=[2708], val_mask=[2708], test_mask=[2708], adj_t=[2708, 2708, nnz=10556])
num_train tensor(140)
num_noise 0
noise: tensor(0)
data feature 1433
ALTOPT(
  (lins): Sequential(
    (0): Linear(in_features=1433, out_features=64, bias=True)
    (1): BatchNorm1d(64, eps=1e-05, momentum=0.1, affine=True, track_running_stats=True)
    (2): Dropout(p=0.30000000000000004, inplace=True)
    (3): ReLU(inplace=True)
    (4): Linear(in_features=64, out_features=7, bias=True)
    (5): Identity()
  )
  (prop): Propagation(K=6, mode=None, lambda1=None, lambda2=None, L21=True, alpha=0.8)
  (gcn): GCN(
    (convs): ModuleList(
      (0): GCNConv(1433, 64)
      (1): GCNConv(64, 7)
    )
    (bns): ModuleList(
      (0): BatchNorm1d(64, eps=1e-05, momentum=0.1, affine=True, track_running_stats=True)
    )
    (output): Identity()
  )
)
propagate done
init label
Split: 01, Run: 01
None time:  2.121452837018296
None Run 01:
Highest Train: 100.00
Highest Valid: 78.40
  Final Train: 100.00
   Final Test: 78.20
Split: 01, Run: 02
None time:  2.099156812997535
None Run 02:
Highest Train: 100.00
Highest Valid: 79.00
  Final Train: 100.00
   Final Test: 78.50
Split: 01, Run: 03
None time:  2.09453545906581
None Run 03:
Highest Train: 100.00
Highest Valid: 80.00
  Final Train: 100.00
   Final Test: 78.80
run time now: 6.351573705673218
total time:  6.375725022051483
None All runs:
Highest Train: 100.00 ± 0.00
Highest Valid: 79.13 ± 0.81
  Final Train: 100.00 ± 0.00
   Final Test: 78.50 ± 0.30
[I 2023-06-12 00:18:46,805] Trial 54 finished with value: 79.13333129882812 and parameters: {'Fwd': 0.03388122336468861, 'K': 6, 'alpha': 0.8, 'dropout': 0.30000000000000004, 'gnnepoch': 90, 'lambda1': 0.15000000000000002, 'lambda2': 7.815558225220965, 'loop': 1, 'loss': 'MSE', 'lr': 0.0063447533663596335, 'softmaxF': True, 'useGCN': True, 'weight_decay': 0.0019550665817475946, 'weightedloss': True}. Best is trial 52 with value: 80.33332824707031.
/home/wxy/miniconda3/lib/python3.10/site-packages/optuna/distributions.py:685: UserWarning: The distribution is specified by [0, 1.00001] and step=0.05, but the range is not divisible by `step`. It will be replaced by [0, 1.0].
  warnings.warn(
K:  10
alpha:  0.75
lr:  0.005618294118561946
weight_decay:  0.00016738992764632102
dropout:  0.4
fix split and run 3 times
Data: Data(x=[2708, 1433], y=[2708], train_mask=[2708], val_mask=[2708], test_mask=[2708], adj_t=[2708, 2708, nnz=10556])
num_train tensor(140)
num_noise 0
noise: tensor(0)
data feature 1433
ALTOPT(
  (lins): Sequential(
    (0): Linear(in_features=1433, out_features=64, bias=True)
    (1): BatchNorm1d(64, eps=1e-05, momentum=0.1, affine=True, track_running_stats=True)
    (2): Dropout(p=0.4, inplace=True)
    (3): ReLU(inplace=True)
    (4): Linear(in_features=64, out_features=7, bias=True)
    (5): Identity()
  )
  (prop): Propagation(K=10, mode=None, lambda1=None, lambda2=None, L21=True, alpha=0.75)
  (gcn): GCN(
    (convs): ModuleList(
      (0): GCNConv(1433, 64)
      (1): GCNConv(64, 7)
    )
    (bns): ModuleList(
      (0): BatchNorm1d(64, eps=1e-05, momentum=0.1, affine=True, track_running_stats=True)
    )
    (output): Identity()
  )
)
propagate done
init label
Split: 01, Run: 01
None time:  1.765659400029108
None Run 01:
Highest Train: 100.00
Highest Valid: 80.80
  Final Train: 100.00
   Final Test: 80.20
Split: 01, Run: 02
None time:  2.1554729950148612
None Run 02:
Highest Train: 100.00
Highest Valid: 80.60
  Final Train: 100.00
   Final Test: 79.50
Split: 01, Run: 03
None time:  3.009727647062391
None Run 03:
Highest Train: 100.00
Highest Valid: 80.40
  Final Train: 100.00
   Final Test: 78.70
run time now: 6.953943729400635
total time:  6.981561067979783
None All runs:
Highest Train: 100.00 ± 0.00
Highest Valid: 80.60 ± 0.20
  Final Train: 100.00 ± 0.00
   Final Test: 79.47 ± 0.75
[I 2023-06-12 00:18:54,314] Trial 55 finished with value: 80.5999984741211 and parameters: {'Fwd': 0.013583139153914393, 'K': 10, 'alpha': 0.75, 'dropout': 0.4, 'gnnepoch': 70, 'lambda1': 0.25, 'lambda2': 4.425957384611478, 'loop': 1, 'loss': 'MSE', 'lr': 0.005618294118561946, 'softmaxF': True, 'useGCN': True, 'weight_decay': 0.00016738992764632102, 'weightedloss': True}. Best is trial 55 with value: 80.5999984741211.
/home/wxy/miniconda3/lib/python3.10/site-packages/optuna/distributions.py:685: UserWarning: The distribution is specified by [0, 1.00001] and step=0.05, but the range is not divisible by `step`. It will be replaced by [0, 1.0].
  warnings.warn(
K:  10
alpha:  0.9500000000000001
lr:  0.00401516228330542
weight_decay:  0.00018515541698285685
dropout:  0.4
fix split and run 3 times
Data: Data(x=[2708, 1433], y=[2708], train_mask=[2708], val_mask=[2708], test_mask=[2708], adj_t=[2708, 2708, nnz=10556])
num_train tensor(140)
num_noise 0
noise: tensor(0)
data feature 1433
ALTOPT(
  (lins): Sequential(
    (0): Linear(in_features=1433, out_features=64, bias=True)
    (1): BatchNorm1d(64, eps=1e-05, momentum=0.1, affine=True, track_running_stats=True)
    (2): Dropout(p=0.4, inplace=True)
    (3): ReLU(inplace=True)
    (4): Linear(in_features=64, out_features=7, bias=True)
    (5): Identity()
  )
  (prop): Propagation(K=10, mode=None, lambda1=None, lambda2=None, L21=True, alpha=0.9500000000000001)
  (gcn): GCN(
    (convs): ModuleList(
      (0): GCNConv(1433, 64)
      (1): GCNConv(64, 7)
    )
    (bns): ModuleList(
      (0): BatchNorm1d(64, eps=1e-05, momentum=0.1, affine=True, track_running_stats=True)
    )
    (output): Identity()
  )
)
propagate done
init label
Split: 01, Run: 01
None time:  3.975581184029579
None Run 01:
Highest Train: 100.00
Highest Valid: 80.60
  Final Train: 100.00
   Final Test: 80.10
Split: 01, Run: 02
None time:  1.591434941161424
None Run 02:
Highest Train: 100.00
Highest Valid: 79.00
  Final Train: 100.00
   Final Test: 80.60
Split: 01, Run: 03
None time:  1.982137423940003
None Run 03:
Highest Train: 100.00
Highest Valid: 80.40
  Final Train: 100.00
   Final Test: 81.00
run time now: 7.572978258132935
total time:  7.5911305288318545
None All runs:
Highest Train: 100.00 ± 0.00
Highest Valid: 80.00 ± 0.87
  Final Train: 100.00 ± 0.00
   Final Test: 80.57 ± 0.45
[I 2023-06-12 00:19:02,393] Trial 56 finished with value: 80.0 and parameters: {'Fwd': 0.013950901291703783, 'K': 10, 'alpha': 0.9500000000000001, 'dropout': 0.4, 'gnnepoch': 60, 'lambda1': 0.25, 'lambda2': 4.878690985352948, 'loop': 1, 'loss': 'MSE', 'lr': 0.00401516228330542, 'softmaxF': True, 'useGCN': True, 'weight_decay': 0.00018515541698285685, 'weightedloss': True}. Best is trial 55 with value: 80.5999984741211.
/home/wxy/miniconda3/lib/python3.10/site-packages/optuna/distributions.py:685: UserWarning: The distribution is specified by [0, 1.00001] and step=0.05, but the range is not divisible by `step`. It will be replaced by [0, 1.0].
  warnings.warn(
K:  9
alpha:  0.8500000000000001
lr:  0.008042440206771764
weight_decay:  9.579806075604583e-05
dropout:  0.4
fix split and run 3 times
Data: Data(x=[2708, 1433], y=[2708], train_mask=[2708], val_mask=[2708], test_mask=[2708], adj_t=[2708, 2708, nnz=10556])
num_train tensor(140)
num_noise 0
noise: tensor(0)
data feature 1433
ALTOPT(
  (lins): Sequential(
    (0): Linear(in_features=1433, out_features=64, bias=True)
    (1): BatchNorm1d(64, eps=1e-05, momentum=0.1, affine=True, track_running_stats=True)
    (2): Dropout(p=0.4, inplace=True)
    (3): ReLU(inplace=True)
    (4): Linear(in_features=64, out_features=7, bias=True)
    (5): LogSoftmax(dim=-1)
  )
  (prop): Propagation(K=9, mode=None, lambda1=None, lambda2=None, L21=True, alpha=0.8500000000000001)
  (gcn): GCN(
    (convs): ModuleList(
      (0): GCNConv(1433, 64)
      (1): GCNConv(64, 7)
    )
    (bns): ModuleList(
      (0): BatchNorm1d(64, eps=1e-05, momentum=0.1, affine=True, track_running_stats=True)
    )
    (output): LogSoftmax(dim=-1)
  )
)
propagate done
init label
Split: 01, Run: 01
None time:  0.8615118400193751
None Run 01:
Highest Train: 100.00
Highest Valid: 76.80
  Final Train: 100.00
   Final Test: 77.80
Split: 01, Run: 02
None time:  0.7439361091237515
None Run 02:
Highest Train: 100.00
Highest Valid: 70.40
  Final Train: 100.00
   Final Test: 71.30
Split: 01, Run: 03
None time:  0.3844248210079968
None Run 03:
Highest Train: 100.00
Highest Valid: 75.60
  Final Train: 100.00
   Final Test: 77.20
run time now: 2.0173239707946777
total time:  2.0373056018725038
None All runs:
Highest Train: 100.00 ± 0.00
Highest Valid: 74.27 ± 3.40
  Final Train: 100.00 ± 0.00
   Final Test: 75.43 ± 3.59
[I 2023-06-12 00:19:04,858] Trial 57 finished with value: 74.26667022705078 and parameters: {'Fwd': 0.06859483625193925, 'K': 9, 'alpha': 0.8500000000000001, 'dropout': 0.4, 'gnnepoch': 10, 'lambda1': 0.25, 'lambda2': 4.279917460307582, 'loop': 1, 'loss': 'CE', 'lr': 0.008042440206771764, 'softmaxF': True, 'useGCN': True, 'weight_decay': 9.579806075604583e-05, 'weightedloss': True}. Best is trial 55 with value: 80.5999984741211.
/home/wxy/miniconda3/lib/python3.10/site-packages/optuna/distributions.py:685: UserWarning: The distribution is specified by [0, 1.00001] and step=0.05, but the range is not divisible by `step`. It will be replaced by [0, 1.0].
  warnings.warn(
K:  9
alpha:  1.0
lr:  0.006136574119290255
weight_decay:  4.415255756156707e-05
dropout:  0.30000000000000004
fix split and run 3 times
Data: Data(x=[2708, 1433], y=[2708], train_mask=[2708], val_mask=[2708], test_mask=[2708], adj_t=[2708, 2708, nnz=10556])
num_train tensor(140)
num_noise 0
noise: tensor(0)
data feature 1433
ALTOPT(
  (lins): Sequential(
    (0): Linear(in_features=1433, out_features=64, bias=True)
    (1): BatchNorm1d(64, eps=1e-05, momentum=0.1, affine=True, track_running_stats=True)
    (2): Dropout(p=0.30000000000000004, inplace=True)
    (3): ReLU(inplace=True)
    (4): Linear(in_features=64, out_features=7, bias=True)
    (5): Identity()
  )
  (prop): Propagation(K=9, mode=None, lambda1=None, lambda2=None, L21=True, alpha=1.0)
  (gcn): GCN(
    (convs): ModuleList(
      (0): GCNConv(1433, 64)
      (1): GCNConv(64, 7)
    )
    (bns): ModuleList(
      (0): BatchNorm1d(64, eps=1e-05, momentum=0.1, affine=True, track_running_stats=True)
    )
    (output): Identity()
  )
)
propagate done
init label
Split: 01, Run: 01
None time:  2.3038199869915843
None Run 01:
Highest Train: 100.00
Highest Valid: 77.80
  Final Train: 100.00
   Final Test: 78.00
Split: 01, Run: 02
None time:  2.6990445267874748
None Run 02:
Highest Train: 100.00
Highest Valid: 79.40
  Final Train: 100.00
   Final Test: 78.20
Split: 01, Run: 03
None time:  2.4266443920787424
None Run 03:
Highest Train: 100.00
Highest Valid: 78.00
  Final Train: 100.00
   Final Test: 76.20
run time now: 7.461054086685181
total time:  7.488354498986155
None All runs:
Highest Train: 100.00 ± 0.00
Highest Valid: 78.40 ± 0.87
  Final Train: 100.00 ± 0.00
   Final Test: 77.47 ± 1.10
[I 2023-06-12 00:19:12,815] Trial 58 finished with value: 78.4000015258789 and parameters: {'Fwd': 0.006807219309006757, 'K': 9, 'alpha': 1.0, 'dropout': 0.30000000000000004, 'gnnepoch': 100, 'lambda1': 0.9, 'lambda2': 2.869344712847715, 'loop': 1, 'loss': 'MSE', 'lr': 0.006136574119290255, 'softmaxF': True, 'useGCN': True, 'weight_decay': 4.415255756156707e-05, 'weightedloss': True}. Best is trial 55 with value: 80.5999984741211.
/home/wxy/miniconda3/lib/python3.10/site-packages/optuna/distributions.py:685: UserWarning: The distribution is specified by [0, 1.00001] and step=0.05, but the range is not divisible by `step`. It will be replaced by [0, 1.0].
  warnings.warn(
K:  8
alpha:  0.75
lr:  0.005216840277861581
weight_decay:  6.830842539713853e-05
dropout:  0.4
fix split and run 3 times
Data: Data(x=[2708, 1433], y=[2708], train_mask=[2708], val_mask=[2708], test_mask=[2708], adj_t=[2708, 2708, nnz=10556])
num_train tensor(140)
num_noise 0
noise: tensor(0)
data feature 1433
ALTOPT(
  (lins): Sequential(
    (0): Linear(in_features=1433, out_features=64, bias=True)
    (1): BatchNorm1d(64, eps=1e-05, momentum=0.1, affine=True, track_running_stats=True)
    (2): Dropout(p=0.4, inplace=True)
    (3): ReLU(inplace=True)
    (4): Linear(in_features=64, out_features=7, bias=True)
    (5): Identity()
  )
  (prop): Propagation(K=8, mode=None, lambda1=None, lambda2=None, L21=True, alpha=0.75)
  (gcn): GCN(
    (convs): ModuleList(
      (0): GCNConv(1433, 64)
      (1): GCNConv(64, 7)
    )
    (bns): ModuleList(
      (0): BatchNorm1d(64, eps=1e-05, momentum=0.1, affine=True, track_running_stats=True)
    )
    (output): Identity()
  )
)
propagate done
init label
Split: 01, Run: 01
None time:  1.4201924179214984
None Run 01:
Highest Train: 100.00
Highest Valid: 80.20
  Final Train: 100.00
   Final Test: 79.20
Split: 01, Run: 02
None time:  1.5230344340670854
None Run 02:
Highest Train: 100.00
Highest Valid: 79.40
  Final Train: 100.00
   Final Test: 80.90
Split: 01, Run: 03
None time:  1.6334310218226165
None Run 03:
Highest Train: 100.00
Highest Valid: 79.40
  Final Train: 100.00
   Final Test: 81.30
run time now: 4.60077166557312
total time:  4.627400303957984
None All runs:
Highest Train: 100.00 ± 0.00
Highest Valid: 79.67 ± 0.46
  Final Train: 100.00 ± 0.00
   Final Test: 80.47 ± 1.12
[I 2023-06-12 00:19:17,928] Trial 59 finished with value: 79.66666412353516 and parameters: {'Fwd': 0.021884233292262145, 'K': 8, 'alpha': 0.75, 'dropout': 0.4, 'gnnepoch': 80, 'lambda1': 0.35000000000000003, 'lambda2': 6.174199742475033, 'loop': 2, 'loss': 'MSE', 'lr': 0.005216840277861581, 'softmaxF': True, 'useGCN': False, 'weight_decay': 6.830842539713853e-05, 'weightedloss': True}. Best is trial 55 with value: 80.5999984741211.
/home/wxy/miniconda3/lib/python3.10/site-packages/optuna/distributions.py:685: UserWarning: The distribution is specified by [0, 1.00001] and step=0.05, but the range is not divisible by `step`. It will be replaced by [0, 1.0].
  warnings.warn(
K:  10
alpha:  0.45
lr:  0.0033958672826060604
weight_decay:  0.0001285101704101432
dropout:  0.6000000000000001
fix split and run 3 times
Data: Data(x=[2708, 1433], y=[2708], train_mask=[2708], val_mask=[2708], test_mask=[2708], adj_t=[2708, 2708, nnz=10556])
num_train tensor(140)
num_noise 0
noise: tensor(0)
data feature 1433
ALTOPT(
  (lins): Sequential(
    (0): Linear(in_features=1433, out_features=64, bias=True)
    (1): BatchNorm1d(64, eps=1e-05, momentum=0.1, affine=True, track_running_stats=True)
    (2): Dropout(p=0.6000000000000001, inplace=True)
    (3): ReLU(inplace=True)
    (4): Linear(in_features=64, out_features=7, bias=True)
    (5): LogSoftmax(dim=-1)
  )
  (prop): Propagation(K=10, mode=None, lambda1=None, lambda2=None, L21=True, alpha=0.45)
  (gcn): GCN(
    (convs): ModuleList(
      (0): GCNConv(1433, 64)
      (1): GCNConv(64, 7)
    )
    (bns): ModuleList(
      (0): BatchNorm1d(64, eps=1e-05, momentum=0.1, affine=True, track_running_stats=True)
    )
    (output): LogSoftmax(dim=-1)
  )
)
propagate done
init label
Split: 01, Run: 01
None time:  1.5300661800429225
None Run 01:
Highest Train: 100.00
Highest Valid: 81.00
  Final Train: 100.00
   Final Test: 81.60
Split: 01, Run: 02
None time:  2.7546648918651044
None Run 02:
Highest Train: 100.00
Highest Valid: 81.40
  Final Train: 100.00
   Final Test: 81.50
Split: 01, Run: 03
None time:  2.2570559170562774
None Run 03:
Highest Train: 100.00
Highest Valid: 81.60
  Final Train: 100.00
   Final Test: 81.90
run time now: 6.567544460296631
total time:  6.594694751081988
None All runs:
Highest Train: 100.00 ± 0.00
Highest Valid: 81.33 ± 0.31
  Final Train: 100.00 ± 0.00
   Final Test: 81.67 ± 0.21
[I 2023-06-12 00:19:24,999] Trial 60 finished with value: 81.33333587646484 and parameters: {'Fwd': 0.012144119671806964, 'K': 10, 'alpha': 0.45, 'dropout': 0.6000000000000001, 'gnnepoch': 70, 'lambda1': 0.55, 'lambda2': 5.086012203037407, 'loop': 1, 'loss': 'CE', 'lr': 0.0033958672826060604, 'softmaxF': True, 'useGCN': True, 'weight_decay': 0.0001285101704101432, 'weightedloss': True}. Best is trial 60 with value: 81.33333587646484.
/home/wxy/miniconda3/lib/python3.10/site-packages/optuna/distributions.py:685: UserWarning: The distribution is specified by [0, 1.00001] and step=0.05, but the range is not divisible by `step`. It will be replaced by [0, 1.0].
  warnings.warn(
K:  10
alpha:  0.45
lr:  0.00328884575735386
weight_decay:  0.00017865586492576803
dropout:  0.6000000000000001
fix split and run 3 times
Data: Data(x=[2708, 1433], y=[2708], train_mask=[2708], val_mask=[2708], test_mask=[2708], adj_t=[2708, 2708, nnz=10556])
num_train tensor(140)
num_noise 0
noise: tensor(0)
data feature 1433
ALTOPT(
  (lins): Sequential(
    (0): Linear(in_features=1433, out_features=64, bias=True)
    (1): BatchNorm1d(64, eps=1e-05, momentum=0.1, affine=True, track_running_stats=True)
    (2): Dropout(p=0.6000000000000001, inplace=True)
    (3): ReLU(inplace=True)
    (4): Linear(in_features=64, out_features=7, bias=True)
    (5): LogSoftmax(dim=-1)
  )
  (prop): Propagation(K=10, mode=None, lambda1=None, lambda2=None, L21=True, alpha=0.45)
  (gcn): GCN(
    (convs): ModuleList(
      (0): GCNConv(1433, 64)
      (1): GCNConv(64, 7)
    )
    (bns): ModuleList(
      (0): BatchNorm1d(64, eps=1e-05, momentum=0.1, affine=True, track_running_stats=True)
    )
    (output): LogSoftmax(dim=-1)
  )
)
propagate done
init label
Split: 01, Run: 01
None time:  1.7440178291872144
None Run 01:
Highest Train: 100.00
Highest Valid: 81.00
  Final Train: 100.00
   Final Test: 81.40
Split: 01, Run: 02
None time:  2.7235824649687856
None Run 02:
Highest Train: 100.00
Highest Valid: 81.40
  Final Train: 100.00
   Final Test: 81.40
Split: 01, Run: 03
None time:  2.31799002783373
None Run 03:
Highest Train: 100.00
Highest Valid: 81.00
  Final Train: 100.00
   Final Test: 80.40
run time now: 6.820678234100342
total time:  6.855693168006837
None All runs:
Highest Train: 100.00 ± 0.00
Highest Valid: 81.13 ± 0.23
  Final Train: 100.00 ± 0.00
   Final Test: 81.07 ± 0.58
