[I 2023-06-12 00:54:12,849] Trial 448 finished with value: 78.20000457763672 and parameters: {'Fwd': 8.66089743898618e-06, 'K': 10, 'alpha': 0.45, 'dropout': 0.7000000000000001, 'gnnepoch': 60, 'lambda1': 0.9, 'lambda2': 5.1450397447845235, 'loop': 1, 'loss': 'CE', 'lr': 0.00041943435467666336, 'softmaxF': True, 'useGCN': True, 'weight_decay': 7.621790630312755e-05, 'weightedloss': False}. Best is trial 112 with value: 81.66667175292969.
/home/wxy/miniconda3/lib/python3.10/site-packages/optuna/distributions.py:685: UserWarning: The distribution is specified by [0, 1.00001] and step=0.05, but the range is not divisible by `step`. It will be replaced by [0, 1.0].
  warnings.warn(
K:  10
alpha:  0.65
lr:  0.003589074093305585
weight_decay:  1.2001371492393722e-05
dropout:  0.4
fix split and run 3 times
Data: Data(x=[2708, 1433], y=[2708], train_mask=[2708], val_mask=[2708], test_mask=[2708], adj_t=[2708, 2708, nnz=10556])
num_train tensor(140)
num_noise 0
noise: tensor(0)
data feature 1433
ALTOPT(
  (lins): Sequential(
    (0): Linear(in_features=1433, out_features=64, bias=True)
    (1): BatchNorm1d(64, eps=1e-05, momentum=0.1, affine=True, track_running_stats=True)
    (2): Dropout(p=0.4, inplace=True)
    (3): ReLU(inplace=True)
    (4): Linear(in_features=64, out_features=7, bias=True)
    (5): LogSoftmax(dim=-1)
  )
  (prop): Propagation(K=10, mode=None, lambda1=None, lambda2=None, L21=True, alpha=0.65)
  (gcn): GCN(
    (convs): ModuleList(
      (0): GCNConv(1433, 64)
      (1): GCNConv(64, 7)
    )
    (bns): ModuleList(
      (0): BatchNorm1d(64, eps=1e-05, momentum=0.1, affine=True, track_running_stats=True)
    )
    (output): LogSoftmax(dim=-1)
  )
)
propagate done
init label
Split: 01, Run: 01, Epoch: 100, Loss: 1.5176, Train: 100.00%, Valid: 72.60% Test: 73.20%
Split: 01, Run: 01
None time:  5.651039119809866
None Run 01:
Highest Train: 100.00
Highest Valid: 72.60
  Final Train: 100.00
   Final Test: 73.20
Split: 01, Run: 02, Epoch: 100, Loss: 1.5173, Train: 100.00%, Valid: 72.60% Test: 73.20%
Split: 01, Run: 02
None time:  6.3419075009878725
None Run 02:
Highest Train: 100.00
Highest Valid: 72.60
  Final Train: 100.00
   Final Test: 73.20
Split: 01, Run: 03, Epoch: 100, Loss: 1.5163, Train: 100.00%, Valid: 72.60% Test: 73.20%
Split: 01, Run: 03
None time:  5.293383525218815
None Run 03:
Highest Train: 100.00
Highest Valid: 72.60
  Final Train: 100.00
   Final Test: 73.20
run time now: 17.315205574035645
total time:  17.32958811498247
None All runs:
Highest Train: 100.00 ± 0.00
Highest Valid: 72.60 ± 0.00
  Final Train: 100.00 ± 0.00
   Final Test: 73.20 ± 0.00
[I 2023-06-12 00:54:30,665] Trial 449 finished with value: 72.5999984741211 and parameters: {'Fwd': 1.7996016538514616e-05, 'K': 10, 'alpha': 0.65, 'dropout': 0.4, 'gnnepoch': 60, 'lambda1': 0.0, 'lambda2': 5.601985038376289, 'loop': 1, 'loss': 'CE', 'lr': 0.003589074093305585, 'softmaxF': True, 'useGCN': True, 'weight_decay': 1.2001371492393722e-05, 'weightedloss': False}. Best is trial 112 with value: 81.66667175292969.
/home/wxy/miniconda3/lib/python3.10/site-packages/optuna/distributions.py:685: UserWarning: The distribution is specified by [0, 1.00001] and step=0.05, but the range is not divisible by `step`. It will be replaced by [0, 1.0].
  warnings.warn(
K:  10
alpha:  0.75
lr:  0.006885041130969879
weight_decay:  3.471057978297755e-05
dropout:  0.4
fix split and run 3 times
Data: Data(x=[2708, 1433], y=[2708], train_mask=[2708], val_mask=[2708], test_mask=[2708], adj_t=[2708, 2708, nnz=10556])
num_train tensor(140)
num_noise 0
noise: tensor(0)
data feature 1433
ALTOPT(
  (lins): Sequential(
    (0): Linear(in_features=1433, out_features=64, bias=True)
    (1): BatchNorm1d(64, eps=1e-05, momentum=0.1, affine=True, track_running_stats=True)
    (2): Dropout(p=0.4, inplace=True)
    (3): ReLU(inplace=True)
    (4): Linear(in_features=64, out_features=7, bias=True)
    (5): LogSoftmax(dim=-1)
  )
  (prop): Propagation(K=10, mode=None, lambda1=None, lambda2=None, L21=True, alpha=0.75)
  (gcn): GCN(
    (convs): ModuleList(
      (0): GCNConv(1433, 64)
      (1): GCNConv(64, 7)
    )
    (bns): ModuleList(
      (0): BatchNorm1d(64, eps=1e-05, momentum=0.1, affine=True, track_running_stats=True)
    )
    (output): LogSoftmax(dim=-1)
  )
)
propagate done
init label
Split: 01, Run: 01
None time:  0.8246857810299844
None Run 01:
Highest Train: 100.00
Highest Valid: 79.80
  Final Train: 100.00
   Final Test: 79.80
Split: 01, Run: 02
None time:  1.0446941358968616
None Run 02:
Highest Train: 100.00
Highest Valid: 72.80
  Final Train: 100.00
   Final Test: 76.90
Split: 01, Run: 03
None time:  1.1636408460326493
None Run 03:
Highest Train: 100.00
Highest Valid: 77.40
  Final Train: 100.00
   Final Test: 79.80
run time now: 3.064336061477661
total time:  3.0791865659411997
None All runs:
Highest Train: 100.00 ± 0.00
Highest Valid: 76.67 ± 3.56
  Final Train: 100.00 ± 0.00
   Final Test: 78.83 ± 1.67
[I 2023-06-12 00:54:34,237] Trial 450 finished with value: 76.66666412353516 and parameters: {'Fwd': 0.09988454783224666, 'K': 10, 'alpha': 0.75, 'dropout': 0.4, 'gnnepoch': 60, 'lambda1': 0.8500000000000001, 'lambda2': 5.913756436534478, 'loop': 1, 'loss': 'CE', 'lr': 0.006885041130969879, 'softmaxF': True, 'useGCN': False, 'weight_decay': 3.471057978297755e-05, 'weightedloss': True}. Best is trial 112 with value: 81.66667175292969.
/home/wxy/miniconda3/lib/python3.10/site-packages/optuna/distributions.py:685: UserWarning: The distribution is specified by [0, 1.00001] and step=0.05, but the range is not divisible by `step`. It will be replaced by [0, 1.0].
  warnings.warn(
K:  10
alpha:  0.5
lr:  0.0031381421120344507
weight_decay:  0.00011182358519672661
dropout:  0.4
fix split and run 3 times
Data: Data(x=[2708, 1433], y=[2708], train_mask=[2708], val_mask=[2708], test_mask=[2708], adj_t=[2708, 2708, nnz=10556])
num_train tensor(140)
num_noise 0
noise: tensor(0)
data feature 1433
ALTOPT(
  (lins): Sequential(
    (0): Linear(in_features=1433, out_features=64, bias=True)
    (1): BatchNorm1d(64, eps=1e-05, momentum=0.1, affine=True, track_running_stats=True)
    (2): Dropout(p=0.4, inplace=True)
    (3): ReLU(inplace=True)
    (4): Linear(in_features=64, out_features=7, bias=True)
    (5): LogSoftmax(dim=-1)
  )
  (prop): Propagation(K=10, mode=None, lambda1=None, lambda2=None, L21=True, alpha=0.5)
  (gcn): GCN(
    (convs): ModuleList(
      (0): GCNConv(1433, 64)
      (1): GCNConv(64, 7)
    )
    (bns): ModuleList(
      (0): BatchNorm1d(64, eps=1e-05, momentum=0.1, affine=True, track_running_stats=True)
    )
    (output): LogSoftmax(dim=-1)
  )
)
propagate done
init label
Split: 01, Run: 01
None time:  1.33917695004493
None Run 01:
Highest Train: 100.00
Highest Valid: 80.00
  Final Train: 100.00
   Final Test: 80.70
Split: 01, Run: 02
None time:  1.511311155045405
None Run 02:
Highest Train: 100.00
Highest Valid: 80.00
  Final Train: 100.00
   Final Test: 81.40
Split: 01, Run: 03
None time:  1.3672978540416807
None Run 03:
Highest Train: 100.00
Highest Valid: 80.20
  Final Train: 100.00
   Final Test: 81.00
run time now: 4.2449729442596436
total time:  4.260234765009955
None All runs:
Highest Train: 100.00 ± 0.00
Highest Valid: 80.07 ± 0.12
  Final Train: 100.00 ± 0.00
   Final Test: 81.03 ± 0.35
[I 2023-06-12 00:54:38,992] Trial 451 finished with value: 80.06666564941406 and parameters: {'Fwd': 0.040720180619924315, 'K': 10, 'alpha': 0.5, 'dropout': 0.4, 'gnnepoch': 50, 'lambda1': 0.8, 'lambda2': 5.313042887908125, 'loop': 1, 'loss': 'CE', 'lr': 0.0031381421120344507, 'softmaxF': True, 'useGCN': True, 'weight_decay': 0.00011182358519672661, 'weightedloss': False}. Best is trial 112 with value: 81.66667175292969.
/home/wxy/miniconda3/lib/python3.10/site-packages/optuna/distributions.py:685: UserWarning: The distribution is specified by [0, 1.00001] and step=0.05, but the range is not divisible by `step`. It will be replaced by [0, 1.0].
  warnings.warn(
K:  10
alpha:  0.55
lr:  0.0002378790024375686
weight_decay:  0.00019835934645028898
dropout:  0.5
fix split and run 3 times
Data: Data(x=[2708, 1433], y=[2708], train_mask=[2708], val_mask=[2708], test_mask=[2708], adj_t=[2708, 2708, nnz=10556])
num_train tensor(140)
num_noise 0
noise: tensor(0)
data feature 1433
ALTOPT(
  (lins): Sequential(
    (0): Linear(in_features=1433, out_features=64, bias=True)
    (1): BatchNorm1d(64, eps=1e-05, momentum=0.1, affine=True, track_running_stats=True)
    (2): Dropout(p=0.5, inplace=True)
    (3): ReLU(inplace=True)
    (4): Linear(in_features=64, out_features=7, bias=True)
    (5): LogSoftmax(dim=-1)
  )
  (prop): Propagation(K=10, mode=None, lambda1=None, lambda2=None, L21=True, alpha=0.55)
  (gcn): GCN(
    (convs): ModuleList(
      (0): GCNConv(1433, 64)
      (1): GCNConv(64, 7)
    )
    (bns): ModuleList(
      (0): BatchNorm1d(64, eps=1e-05, momentum=0.1, affine=True, track_running_stats=True)
    )
    (output): LogSoftmax(dim=-1)
  )
)
propagate done
init label
Split: 01, Run: 01
None time:  1.9408875941298902
None Run 01:
Highest Train: 100.00
Highest Valid: 78.60
  Final Train: 100.00
   Final Test: 77.90
Split: 01, Run: 02
None time:  1.9620357339736074
None Run 02:
Highest Train: 100.00
Highest Valid: 78.80
  Final Train: 100.00
   Final Test: 78.40
Split: 01, Run: 03
None time:  1.8087669231463224
None Run 03:
Highest Train: 100.00
Highest Valid: 73.60
  Final Train: 100.00
   Final Test: 73.30
run time now: 5.74373459815979
total time:  5.769395102048293
None All runs:
Highest Train: 100.00 ± 0.00
Highest Valid: 77.00 ± 2.95
  Final Train: 100.00 ± 0.00
   Final Test: 76.53 ± 2.81
[I 2023-06-12 00:54:45,419] Trial 452 finished with value: 77.0 and parameters: {'Fwd': 9.566310417324044e-05, 'K': 10, 'alpha': 0.55, 'dropout': 0.5, 'gnnepoch': 60, 'lambda1': 0.9, 'lambda2': 4.96098734633497, 'loop': 1, 'loss': 'CE', 'lr': 0.0002378790024375686, 'softmaxF': True, 'useGCN': True, 'weight_decay': 0.00019835934645028898, 'weightedloss': False}. Best is trial 112 with value: 81.66667175292969.
/home/wxy/miniconda3/lib/python3.10/site-packages/optuna/distributions.py:685: UserWarning: The distribution is specified by [0, 1.00001] and step=0.05, but the range is not divisible by `step`. It will be replaced by [0, 1.0].
  warnings.warn(
K:  10
alpha:  0.6000000000000001
lr:  0.0015294647858763843
weight_decay:  0.05942212281951164
dropout:  0.30000000000000004
fix split and run 3 times
Data: Data(x=[2708, 1433], y=[2708], train_mask=[2708], val_mask=[2708], test_mask=[2708], adj_t=[2708, 2708, nnz=10556])
num_train tensor(140)
num_noise 0
noise: tensor(0)
data feature 1433
ALTOPT(
  (lins): Sequential(
    (0): Linear(in_features=1433, out_features=64, bias=True)
    (1): BatchNorm1d(64, eps=1e-05, momentum=0.1, affine=True, track_running_stats=True)
    (2): Dropout(p=0.30000000000000004, inplace=True)
    (3): ReLU(inplace=True)
    (4): Linear(in_features=64, out_features=7, bias=True)
    (5): LogSoftmax(dim=-1)
  )
  (prop): Propagation(K=10, mode=None, lambda1=None, lambda2=None, L21=True, alpha=0.6000000000000001)
  (gcn): GCN(
    (convs): ModuleList(
      (0): GCNConv(1433, 64)
      (1): GCNConv(64, 7)
    )
    (bns): ModuleList(
      (0): BatchNorm1d(64, eps=1e-05, momentum=0.1, affine=True, track_running_stats=True)
    )
    (output): LogSoftmax(dim=-1)
  )
)
propagate done
init label
Split: 01, Run: 01
None time:  2.467218088917434
None Run 01:
Highest Train: 100.00
Highest Valid: 80.40
  Final Train: 100.00
   Final Test: 81.80
Split: 01, Run: 02
None time:  2.3112338341306895
None Run 02:
Highest Train: 100.00
Highest Valid: 78.80
  Final Train: 100.00
   Final Test: 79.00
Split: 01, Run: 03
None time:  2.1945300900842994
None Run 03:
Highest Train: 100.00
Highest Valid: 80.40
  Final Train: 100.00
   Final Test: 80.60
run time now: 7.004389762878418
total time:  7.021366856992245
None All runs:
Highest Train: 100.00 ± 0.00
Highest Valid: 79.87 ± 0.92
  Final Train: 100.00 ± 0.00
   Final Test: 80.47 ± 1.40
[I 2023-06-12 00:54:53,016] Trial 453 finished with value: 79.86666870117188 and parameters: {'Fwd': 0.058724618084855594, 'K': 10, 'alpha': 0.6000000000000001, 'dropout': 0.30000000000000004, 'gnnepoch': 70, 'lambda1': 0.8500000000000001, 'lambda2': 8.964700875136302, 'loop': 1, 'loss': 'CE', 'lr': 0.0015294647858763843, 'softmaxF': True, 'useGCN': True, 'weight_decay': 0.05942212281951164, 'weightedloss': True}. Best is trial 112 with value: 81.66667175292969.
/home/wxy/miniconda3/lib/python3.10/site-packages/optuna/distributions.py:685: UserWarning: The distribution is specified by [0, 1.00001] and step=0.05, but the range is not divisible by `step`. It will be replaced by [0, 1.0].
  warnings.warn(
K:  10
alpha:  0.65
lr:  0.005884289205391472
weight_decay:  0.00967723685723957
dropout:  0.4
fix split and run 3 times
Data: Data(x=[2708, 1433], y=[2708], train_mask=[2708], val_mask=[2708], test_mask=[2708], adj_t=[2708, 2708, nnz=10556])
num_train tensor(140)
num_noise 0
noise: tensor(0)
data feature 1433
ALTOPT(
  (lins): Sequential(
    (0): Linear(in_features=1433, out_features=64, bias=True)
    (1): BatchNorm1d(64, eps=1e-05, momentum=0.1, affine=True, track_running_stats=True)
    (2): Dropout(p=0.4, inplace=True)
    (3): ReLU(inplace=True)
    (4): Linear(in_features=64, out_features=7, bias=True)
    (5): LogSoftmax(dim=-1)
  )
  (prop): Propagation(K=10, mode=None, lambda1=None, lambda2=None, L21=True, alpha=0.65)
  (gcn): GCN(
    (convs): ModuleList(
      (0): GCNConv(1433, 64)
      (1): GCNConv(64, 7)
    )
    (bns): ModuleList(
      (0): BatchNorm1d(64, eps=1e-05, momentum=0.1, affine=True, track_running_stats=True)
    )
    (output): LogSoftmax(dim=-1)
  )
)
propagate done
init label
Split: 01, Run: 01
None time:  1.5870496530551463
None Run 01:
Highest Train: 100.00
Highest Valid: 81.20
  Final Train: 100.00
   Final Test: 81.70
Split: 01, Run: 02
None time:  1.6770210328977555
None Run 02:
Highest Train: 100.00
Highest Valid: 80.80
  Final Train: 100.00
   Final Test: 81.40
Split: 01, Run: 03
None time:  1.653401092858985
None Run 03:
Highest Train: 100.00
Highest Valid: 80.80
  Final Train: 100.00
   Final Test: 81.70
run time now: 4.944231748580933
total time:  4.9571205580141395
None All runs:
Highest Train: 100.00 ± 0.00
Highest Valid: 80.93 ± 0.23
  Final Train: 100.00 ± 0.00
   Final Test: 81.60 ± 0.17
[I 2023-06-12 00:54:58,626] Trial 454 finished with value: 80.93333435058594 and parameters: {'Fwd': 0.0029255630087169095, 'K': 10, 'alpha': 0.65, 'dropout': 0.4, 'gnnepoch': 60, 'lambda1': 0.9500000000000001, 'lambda2': 6.185642771250528, 'loop': 1, 'loss': 'CE', 'lr': 0.005884289205391472, 'softmaxF': True, 'useGCN': True, 'weight_decay': 0.00967723685723957, 'weightedloss': False}. Best is trial 112 with value: 81.66667175292969.
/home/wxy/miniconda3/lib/python3.10/site-packages/optuna/distributions.py:685: UserWarning: The distribution is specified by [0, 1.00001] and step=0.05, but the range is not divisible by `step`. It will be replaced by [0, 1.0].
  warnings.warn(
K:  10
alpha:  0.6000000000000001
lr:  0.007548306313338359
weight_decay:  0.0033735931714329354
dropout:  0.4
fix split and run 3 times
Data: Data(x=[2708, 1433], y=[2708], train_mask=[2708], val_mask=[2708], test_mask=[2708], adj_t=[2708, 2708, nnz=10556])
num_train tensor(140)
num_noise 0
noise: tensor(0)
data feature 1433
ALTOPT(
  (lins): Sequential(
    (0): Linear(in_features=1433, out_features=64, bias=True)
    (1): BatchNorm1d(64, eps=1e-05, momentum=0.1, affine=True, track_running_stats=True)
    (2): Dropout(p=0.4, inplace=True)
    (3): ReLU(inplace=True)
    (4): Linear(in_features=64, out_features=7, bias=True)
    (5): LogSoftmax(dim=-1)
  )
  (prop): Propagation(K=10, mode=None, lambda1=None, lambda2=None, L21=True, alpha=0.6000000000000001)
  (gcn): GCN(
    (convs): ModuleList(
      (0): GCNConv(1433, 64)
      (1): GCNConv(64, 7)
    )
    (bns): ModuleList(
      (0): BatchNorm1d(64, eps=1e-05, momentum=0.1, affine=True, track_running_stats=True)
    )
    (output): LogSoftmax(dim=-1)
  )
)
propagate done
init label
Split: 01, Run: 01
None time:  1.5490241528023034
None Run 01:
Highest Train: 100.00
Highest Valid: 81.00
  Final Train: 100.00
   Final Test: 82.40
Split: 01, Run: 02
None time:  1.5118096561636776
None Run 02:
Highest Train: 100.00
Highest Valid: 81.20
  Final Train: 100.00
   Final Test: 81.70
Split: 01, Run: 03
None time:  1.6122014918364584
None Run 03:
Highest Train: 100.00
Highest Valid: 80.40
  Final Train: 100.00
   Final Test: 81.20
run time now: 4.707803964614868
total time:  4.737937729107216
None All runs:
Highest Train: 100.00 ± 0.00
Highest Valid: 80.87 ± 0.42
  Final Train: 100.00 ± 0.00
   Final Test: 81.77 ± 0.60
[I 2023-06-12 00:55:03,959] Trial 455 finished with value: 80.86666870117188 and parameters: {'Fwd': 0.00011821804281104987, 'K': 10, 'alpha': 0.6000000000000001, 'dropout': 0.4, 'gnnepoch': 60, 'lambda1': 0.75, 'lambda2': 5.721162100537693, 'loop': 1, 'loss': 'CE', 'lr': 0.007548306313338359, 'softmaxF': False, 'useGCN': True, 'weight_decay': 0.0033735931714329354, 'weightedloss': False}. Best is trial 112 with value: 81.66667175292969.
/home/wxy/miniconda3/lib/python3.10/site-packages/optuna/distributions.py:685: UserWarning: The distribution is specified by [0, 1.00001] and step=0.05, but the range is not divisible by `step`. It will be replaced by [0, 1.0].
  warnings.warn(
K:  10
alpha:  0.55
lr:  0.008929230413008079
weight_decay:  6.320989201606894e-05
dropout:  0.4
fix split and run 3 times
Data: Data(x=[2708, 1433], y=[2708], train_mask=[2708], val_mask=[2708], test_mask=[2708], adj_t=[2708, 2708, nnz=10556])
num_train tensor(140)
num_noise 0
noise: tensor(0)
data feature 1433
ALTOPT(
  (lins): Sequential(
    (0): Linear(in_features=1433, out_features=64, bias=True)
    (1): BatchNorm1d(64, eps=1e-05, momentum=0.1, affine=True, track_running_stats=True)
    (2): Dropout(p=0.4, inplace=True)
    (3): ReLU(inplace=True)
    (4): Linear(in_features=64, out_features=7, bias=True)
    (5): LogSoftmax(dim=-1)
  )
  (prop): Propagation(K=10, mode=None, lambda1=None, lambda2=None, L21=True, alpha=0.55)
  (gcn): GCN(
    (convs): ModuleList(
      (0): GCNConv(1433, 64)
      (1): GCNConv(64, 7)
    )
    (bns): ModuleList(
      (0): BatchNorm1d(64, eps=1e-05, momentum=0.1, affine=True, track_running_stats=True)
    )
    (output): LogSoftmax(dim=-1)
  )
)
propagate done
init label
Split: 01, Run: 01
None time:  1.6245848729740828
None Run 01:
Highest Train: 100.00
Highest Valid: 81.80
  Final Train: 100.00
   Final Test: 82.00
Split: 01, Run: 02
None time:  1.3356150130275637
None Run 02:
Highest Train: 100.00
Highest Valid: 81.20
  Final Train: 99.29
   Final Test: 80.80
Split: 01, Run: 03
None time:  1.6457409299910069
None Run 03:
Highest Train: 100.00
Highest Valid: 80.60
  Final Train: 99.29
   Final Test: 80.70
run time now: 4.631744384765625
total time:  4.644477126887068
None All runs:
Highest Train: 100.00 ± 0.00
Highest Valid: 81.20 ± 0.60
  Final Train: 99.52 ± 0.41
   Final Test: 81.17 ± 0.72
[I 2023-06-12 00:55:09,203] Trial 456 finished with value: 81.20000457763672 and parameters: {'Fwd': 3.6770970380264114e-05, 'K': 10, 'alpha': 0.55, 'dropout': 0.4, 'gnnepoch': 60, 'lambda1': 0.9, 'lambda2': 2.2002041671942463, 'loop': 1, 'loss': 'CE', 'lr': 0.008929230413008079, 'softmaxF': True, 'useGCN': True, 'weight_decay': 6.320989201606894e-05, 'weightedloss': False}. Best is trial 112 with value: 81.66667175292969.
/home/wxy/miniconda3/lib/python3.10/site-packages/optuna/distributions.py:685: UserWarning: The distribution is specified by [0, 1.00001] and step=0.05, but the range is not divisible by `step`. It will be replaced by [0, 1.0].
  warnings.warn(
K:  10
alpha:  0.7000000000000001
lr:  0.007984938656189091
weight_decay:  8.994381044233153e-05
dropout:  0.5
fix split and run 3 times
Data: Data(x=[2708, 1433], y=[2708], train_mask=[2708], val_mask=[2708], test_mask=[2708], adj_t=[2708, 2708, nnz=10556])
num_train tensor(140)
num_noise 0
noise: tensor(0)
data feature 1433
ALTOPT(
  (lins): Sequential(
    (0): Linear(in_features=1433, out_features=64, bias=True)
    (1): BatchNorm1d(64, eps=1e-05, momentum=0.1, affine=True, track_running_stats=True)
    (2): Dropout(p=0.5, inplace=True)
    (3): ReLU(inplace=True)
    (4): Linear(in_features=64, out_features=7, bias=True)
    (5): LogSoftmax(dim=-1)
  )
  (prop): Propagation(K=10, mode=None, lambda1=None, lambda2=None, L21=True, alpha=0.7000000000000001)
  (gcn): GCN(
    (convs): ModuleList(
      (0): GCNConv(1433, 64)
      (1): GCNConv(64, 7)
    )
    (bns): ModuleList(
      (0): BatchNorm1d(64, eps=1e-05, momentum=0.1, affine=True, track_running_stats=True)
    )
    (output): LogSoftmax(dim=-1)
  )
)
propagate done
init label
Split: 01, Run: 01
None time:  1.486824827035889
None Run 01:
Highest Train: 100.00
Highest Valid: 81.80
  Final Train: 100.00
   Final Test: 82.60
Split: 01, Run: 02
None time:  1.8015253101475537
None Run 02:
Highest Train: 100.00
Highest Valid: 81.40
  Final Train: 100.00
   Final Test: 81.80
Split: 01, Run: 03
None time:  1.818677990930155
None Run 03:
Highest Train: 100.00
Highest Valid: 81.40
  Final Train: 100.00
   Final Test: 83.00
run time now: 5.13629937171936
total time:  5.151310905814171
None All runs:
Highest Train: 100.00 ± 0.00
Highest Valid: 81.53 ± 0.23
  Final Train: 100.00 ± 0.00
   Final Test: 82.47 ± 0.61
