[I 2023-06-11 23:21:55,385] Trial 8 finished with value: 52.0 and parameters: {'Fwd': 0.00022098430744692984, 'K': 8, 'alpha': 0.4, 'dropout': 0.7000000000000001, 'gnnepoch': 70, 'lambda1': 0.0, 'lambda2': 0.6687038782162369, 'loop': 2, 'loss': 'MSE', 'lr': 0.009663075999838653, 'softmaxF': False, 'useGCN': False, 'weight_decay': 5.803888314026306e-05, 'weightedloss': False}. Best is trial 3 with value: 70.13333892822266.
/home/wxy/miniconda3/lib/python3.10/site-packages/optuna/distributions.py:685: UserWarning: The distribution is specified by [0, 1.00001] and step=0.05, but the range is not divisible by `step`. It will be replaced by [0, 1.0].
  warnings.warn(
K:  4
alpha:  0.8
lr:  0.00016699048609123692
weight_decay:  3.230372102091691e-05
dropout:  0.8
fix split and run 3 times
Data: Data(x=[3327, 3703], y=[3327], train_mask=[3327], val_mask=[3327], test_mask=[3327], adj_t=[3327, 3327, nnz=9104])
num_train tensor(120)
num_noise 0
noise: tensor(0)
data feature 3703
ALTOPT(
  (lins): Sequential(
    (0): Linear(in_features=3703, out_features=64, bias=True)
    (1): BatchNorm1d(64, eps=1e-05, momentum=0.1, affine=True, track_running_stats=True)
    (2): Dropout(p=0.8, inplace=True)
    (3): ReLU(inplace=True)
    (4): Linear(in_features=64, out_features=6, bias=True)
    (5): Identity()
  )
  (prop): Propagation(K=4, mode=None, lambda1=None, lambda2=None, L21=True, alpha=0.8)
  (gcn): GCN(
    (convs): ModuleList(
      (0): GCNConv(3703, 64)
      (1): GCNConv(64, 6)
    )
    (bns): ModuleList(
      (0): BatchNorm1d(64, eps=1e-05, momentum=0.1, affine=True, track_running_stats=True)
    )
    (output): Identity()
  )
)
propagate done
init label
Split: 01, Run: 01
None time:  0.10190773103386164
None Run 01:
Highest Train: 100.00
Highest Valid: 43.00
  Final Train: 100.00
   Final Test: 41.90
Split: 01, Run: 02
None time:  0.1268375450745225
None Run 02:
Highest Train: 100.00
Highest Valid: 43.00
  Final Train: 100.00
   Final Test: 41.90
Split: 01, Run: 03
None time:  0.12079188390634954
None Run 03:
Highest Train: 100.00
Highest Valid: 43.00
  Final Train: 100.00
   Final Test: 41.90
run time now: 0.3856174945831299
total time:  0.44326884509064257
None All runs:
Highest Train: 100.00 ± 0.00
Highest Valid: 43.00 ± 0.00
  Final Train: 100.00 ± 0.00
   Final Test: 41.90 ± 0.00
[I 2023-06-11 23:21:56,196] Trial 9 finished with value: 43.0 and parameters: {'Fwd': 2.933401159313363e-06, 'K': 4, 'alpha': 0.8, 'dropout': 0.8, 'gnnepoch': 0, 'lambda1': 0.8, 'lambda2': 1.0694472901612229, 'loop': 1, 'loss': 'MSE', 'lr': 0.00016699048609123692, 'softmaxF': False, 'useGCN': False, 'weight_decay': 3.230372102091691e-05, 'weightedloss': True}. Best is trial 3 with value: 70.13333892822266.
/home/wxy/miniconda3/lib/python3.10/site-packages/optuna/distributions.py:685: UserWarning: The distribution is specified by [0, 1.00001] and step=0.05, but the range is not divisible by `step`. It will be replaced by [0, 1.0].
  warnings.warn(
K:  10
alpha:  0.6000000000000001
lr:  0.0020242411378393593
weight_decay:  1.081208054806456e-06
dropout:  0.30000000000000004
fix split and run 3 times
Data: Data(x=[3327, 3703], y=[3327], train_mask=[3327], val_mask=[3327], test_mask=[3327], adj_t=[3327, 3327, nnz=9104])
num_train tensor(120)
num_noise 0
noise: tensor(0)
data feature 3703
ALTOPT(
  (lins): Sequential(
    (0): Linear(in_features=3703, out_features=64, bias=True)
    (1): BatchNorm1d(64, eps=1e-05, momentum=0.1, affine=True, track_running_stats=True)
    (2): Dropout(p=0.30000000000000004, inplace=True)
    (3): ReLU(inplace=True)
    (4): Linear(in_features=64, out_features=6, bias=True)
    (5): LogSoftmax(dim=-1)
  )
  (prop): Propagation(K=10, mode=None, lambda1=None, lambda2=None, L21=True, alpha=0.6000000000000001)
  (gcn): GCN(
    (convs): ModuleList(
      (0): GCNConv(3703, 64)
      (1): GCNConv(64, 6)
    )
    (bns): ModuleList(
      (0): BatchNorm1d(64, eps=1e-05, momentum=0.1, affine=True, track_running_stats=True)
    )
    (output): LogSoftmax(dim=-1)
  )
)
propagate done
init label
Split: 01, Run: 01
None time:  0.8867555791512132
None Run 01:
Highest Train: 100.00
Highest Valid: 71.40
  Final Train: 100.00
   Final Test: 69.40
Split: 01, Run: 02
None time:  0.9078025061171502
None Run 02:
Highest Train: 100.00
Highest Valid: 71.00
  Final Train: 100.00
   Final Test: 68.70
Split: 01, Run: 03
None time:  0.9451280881185085
None Run 03:
Highest Train: 100.00
Highest Valid: 71.20
  Final Train: 100.00
   Final Test: 69.00
run time now: 2.7840347290039062
total time:  2.8488526600413024
None All runs:
Highest Train: 100.00 ± 0.00
Highest Valid: 71.20 ± 0.20
  Final Train: 100.00 ± 0.00
   Final Test: 69.03 ± 0.35
[I 2023-06-11 23:21:59,485] Trial 10 finished with value: 71.20000457763672 and parameters: {'Fwd': 0.015899769877339973, 'K': 10, 'alpha': 0.6000000000000001, 'dropout': 0.30000000000000004, 'gnnepoch': 100, 'lambda1': 0.55, 'lambda2': 3.5957016852401176, 'loop': 0, 'loss': 'CE', 'lr': 0.0020242411378393593, 'softmaxF': True, 'useGCN': True, 'weight_decay': 1.081208054806456e-06, 'weightedloss': True}. Best is trial 10 with value: 71.20000457763672.
/home/wxy/miniconda3/lib/python3.10/site-packages/optuna/distributions.py:685: UserWarning: The distribution is specified by [0, 1.00001] and step=0.05, but the range is not divisible by `step`. It will be replaced by [0, 1.0].
  warnings.warn(
K:  10
alpha:  0.65
lr:  0.0015912044694296238
weight_decay:  3.9599473903908694e-06
dropout:  0.30000000000000004
fix split and run 3 times
Data: Data(x=[3327, 3703], y=[3327], train_mask=[3327], val_mask=[3327], test_mask=[3327], adj_t=[3327, 3327, nnz=9104])
num_train tensor(120)
num_noise 0
noise: tensor(0)
data feature 3703
ALTOPT(
  (lins): Sequential(
    (0): Linear(in_features=3703, out_features=64, bias=True)
    (1): BatchNorm1d(64, eps=1e-05, momentum=0.1, affine=True, track_running_stats=True)
    (2): Dropout(p=0.30000000000000004, inplace=True)
    (3): ReLU(inplace=True)
    (4): Linear(in_features=64, out_features=6, bias=True)
    (5): LogSoftmax(dim=-1)
  )
  (prop): Propagation(K=10, mode=None, lambda1=None, lambda2=None, L21=True, alpha=0.65)
  (gcn): GCN(
    (convs): ModuleList(
      (0): GCNConv(3703, 64)
      (1): GCNConv(64, 6)
    )
    (bns): ModuleList(
      (0): BatchNorm1d(64, eps=1e-05, momentum=0.1, affine=True, track_running_stats=True)
    )
    (output): LogSoftmax(dim=-1)
  )
)
propagate done
init label
Split: 01, Run: 01
None time:  0.8516441159881651
None Run 01:
Highest Train: 100.00
Highest Valid: 71.40
  Final Train: 100.00
   Final Test: 69.70
Split: 01, Run: 02
None time:  0.9015728470403701
None Run 02:
Highest Train: 100.00
Highest Valid: 70.80
  Final Train: 100.00
   Final Test: 69.40
Split: 01, Run: 03
None time:  0.9960274109616876
None Run 03:
Highest Train: 100.00
Highest Valid: 71.40
  Final Train: 100.00
   Final Test: 69.50
run time now: 2.8053622245788574
total time:  2.8672576658427715
None All runs:
Highest Train: 100.00 ± 0.00
Highest Valid: 71.20 ± 0.35
  Final Train: 100.00 ± 0.00
   Final Test: 69.53 ± 0.15
[I 2023-06-11 23:22:02,781] Trial 11 finished with value: 71.20000457763672 and parameters: {'Fwd': 0.022168569287272386, 'K': 10, 'alpha': 0.65, 'dropout': 0.30000000000000004, 'gnnepoch': 100, 'lambda1': 0.5, 'lambda2': 4.034557310068713, 'loop': 0, 'loss': 'CE', 'lr': 0.0015912044694296238, 'softmaxF': True, 'useGCN': True, 'weight_decay': 3.9599473903908694e-06, 'weightedloss': True}. Best is trial 10 with value: 71.20000457763672.
/home/wxy/miniconda3/lib/python3.10/site-packages/optuna/distributions.py:685: UserWarning: The distribution is specified by [0, 1.00001] and step=0.05, but the range is not divisible by `step`. It will be replaced by [0, 1.0].
  warnings.warn(
K:  7
alpha:  0.65
lr:  0.0016989967027862274
weight_decay:  1.6286323333249697e-06
dropout:  0.30000000000000004
fix split and run 3 times
Data: Data(x=[3327, 3703], y=[3327], train_mask=[3327], val_mask=[3327], test_mask=[3327], adj_t=[3327, 3327, nnz=9104])
num_train tensor(120)
num_noise 0
noise: tensor(0)
data feature 3703
ALTOPT(
  (lins): Sequential(
    (0): Linear(in_features=3703, out_features=64, bias=True)
    (1): BatchNorm1d(64, eps=1e-05, momentum=0.1, affine=True, track_running_stats=True)
    (2): Dropout(p=0.30000000000000004, inplace=True)
    (3): ReLU(inplace=True)
    (4): Linear(in_features=64, out_features=6, bias=True)
    (5): LogSoftmax(dim=-1)
  )
  (prop): Propagation(K=7, mode=None, lambda1=None, lambda2=None, L21=True, alpha=0.65)
  (gcn): GCN(
    (convs): ModuleList(
      (0): GCNConv(3703, 64)
      (1): GCNConv(64, 6)
    )
    (bns): ModuleList(
      (0): BatchNorm1d(64, eps=1e-05, momentum=0.1, affine=True, track_running_stats=True)
    )
    (output): LogSoftmax(dim=-1)
  )
)
propagate done
init label
Split: 01, Run: 01
None time:  0.9226669569034129
None Run 01:
Highest Train: 100.00
Highest Valid: 71.20
  Final Train: 100.00
   Final Test: 69.60
Split: 01, Run: 02
None time:  0.9080144290346652
None Run 02:
Highest Train: 100.00
Highest Valid: 71.20
  Final Train: 100.00
   Final Test: 68.90
Split: 01, Run: 03
None time:  0.9238731698133051
None Run 03:
Highest Train: 100.00
Highest Valid: 71.00
  Final Train: 100.00
   Final Test: 69.30
run time now: 2.7950263023376465
total time:  2.8546862930525094
None All runs:
Highest Train: 100.00 ± 0.00
Highest Valid: 71.13 ± 0.12
  Final Train: 100.00 ± 0.00
   Final Test: 69.27 ± 0.35
[I 2023-06-11 23:22:06,028] Trial 12 finished with value: 71.13333892822266 and parameters: {'Fwd': 0.041336999354261265, 'K': 7, 'alpha': 0.65, 'dropout': 0.30000000000000004, 'gnnepoch': 100, 'lambda1': 0.5, 'lambda2': 4.6228914483915, 'loop': 0, 'loss': 'CE', 'lr': 0.0016989967027862274, 'softmaxF': True, 'useGCN': True, 'weight_decay': 1.6286323333249697e-06, 'weightedloss': True}. Best is trial 10 with value: 71.20000457763672.
/home/wxy/miniconda3/lib/python3.10/site-packages/optuna/distributions.py:685: UserWarning: The distribution is specified by [0, 1.00001] and step=0.05, but the range is not divisible by `step`. It will be replaced by [0, 1.0].
  warnings.warn(
K:  10
alpha:  1.0
lr:  0.0014684229987594836
weight_decay:  1.075866621184343e-06
dropout:  0.4
fix split and run 3 times
Data: Data(x=[3327, 3703], y=[3327], train_mask=[3327], val_mask=[3327], test_mask=[3327], adj_t=[3327, 3327, nnz=9104])
num_train tensor(120)
num_noise 0
noise: tensor(0)
data feature 3703
ALTOPT(
  (lins): Sequential(
    (0): Linear(in_features=3703, out_features=64, bias=True)
    (1): BatchNorm1d(64, eps=1e-05, momentum=0.1, affine=True, track_running_stats=True)
    (2): Dropout(p=0.4, inplace=True)
    (3): ReLU(inplace=True)
    (4): Linear(in_features=64, out_features=6, bias=True)
    (5): LogSoftmax(dim=-1)
  )
  (prop): Propagation(K=10, mode=None, lambda1=None, lambda2=None, L21=True, alpha=1.0)
  (gcn): GCN(
    (convs): ModuleList(
      (0): GCNConv(3703, 64)
      (1): GCNConv(64, 6)
    )
    (bns): ModuleList(
      (0): BatchNorm1d(64, eps=1e-05, momentum=0.1, affine=True, track_running_stats=True)
    )
    (output): LogSoftmax(dim=-1)
  )
)
propagate done
init label
Split: 01, Run: 01
None time:  0.8428652880247682
None Run 01:
Highest Train: 100.00
Highest Valid: 71.20
  Final Train: 100.00
   Final Test: 70.00
Split: 01, Run: 02
None time:  0.9183936619665474
None Run 02:
Highest Train: 100.00
Highest Valid: 70.80
  Final Train: 100.00
   Final Test: 69.00
Split: 01, Run: 03
None time:  0.9707106680143625
None Run 03:
Highest Train: 100.00
Highest Valid: 71.20
  Final Train: 100.00
   Final Test: 69.20
run time now: 2.7763829231262207
total time:  2.8329628030769527
None All runs:
Highest Train: 100.00 ± 0.00
Highest Valid: 71.07 ± 0.23
  Final Train: 100.00 ± 0.00
   Final Test: 69.40 ± 0.53
[I 2023-06-11 23:22:09,318] Trial 13 finished with value: 71.0666732788086 and parameters: {'Fwd': 0.03846323110299057, 'K': 10, 'alpha': 1.0, 'dropout': 0.4, 'gnnepoch': 100, 'lambda1': 0.4, 'lambda2': 2.6821173906779316, 'loop': 0, 'loss': 'CE', 'lr': 0.0014684229987594836, 'softmaxF': True, 'useGCN': True, 'weight_decay': 1.075866621184343e-06, 'weightedloss': True}. Best is trial 10 with value: 71.20000457763672.
/home/wxy/miniconda3/lib/python3.10/site-packages/optuna/distributions.py:685: UserWarning: The distribution is specified by [0, 1.00001] and step=0.05, but the range is not divisible by `step`. It will be replaced by [0, 1.0].
  warnings.warn(
K:  3
alpha:  0.55
lr:  0.0025166267739454855
weight_decay:  5.779174672323165e-06
dropout:  0.30000000000000004
fix split and run 3 times
Data: Data(x=[3327, 3703], y=[3327], train_mask=[3327], val_mask=[3327], test_mask=[3327], adj_t=[3327, 3327, nnz=9104])
num_train tensor(120)
num_noise 0
noise: tensor(0)
data feature 3703
ALTOPT(
  (lins): Sequential(
    (0): Linear(in_features=3703, out_features=64, bias=True)
    (1): BatchNorm1d(64, eps=1e-05, momentum=0.1, affine=True, track_running_stats=True)
    (2): Dropout(p=0.30000000000000004, inplace=True)
    (3): ReLU(inplace=True)
    (4): Linear(in_features=64, out_features=6, bias=True)
    (5): LogSoftmax(dim=-1)
  )
  (prop): Propagation(K=3, mode=None, lambda1=None, lambda2=None, L21=True, alpha=0.55)
  (gcn): GCN(
    (convs): ModuleList(
      (0): GCNConv(3703, 64)
      (1): GCNConv(64, 6)
    )
    (bns): ModuleList(
      (0): BatchNorm1d(64, eps=1e-05, momentum=0.1, affine=True, track_running_stats=True)
    )
    (output): LogSoftmax(dim=-1)
  )
)
propagate done
init label
Split: 01, Run: 01
None time:  0.4507816119585186
None Run 01:
Highest Train: 100.00
Highest Valid: 71.00
  Final Train: 100.00
   Final Test: 68.80
Split: 01, Run: 02
None time:  0.49642288591712713
None Run 02:
Highest Train: 100.00
Highest Valid: 71.40
  Final Train: 100.00
   Final Test: 69.60
Split: 01, Run: 03
None time:  0.45820933184586465
None Run 03:
Highest Train: 100.00
Highest Valid: 71.20
  Final Train: 100.00
   Final Test: 69.90
run time now: 1.4413480758666992
total time:  1.503613508073613
None All runs:
Highest Train: 100.00 ± 0.00
Highest Valid: 71.20 ± 0.20
  Final Train: 100.00 ± 0.00
   Final Test: 69.43 ± 0.57
[I 2023-06-11 23:22:11,255] Trial 14 finished with value: 71.20000457763672 and parameters: {'Fwd': 0.009717555844564487, 'K': 3, 'alpha': 0.55, 'dropout': 0.30000000000000004, 'gnnepoch': 50, 'lambda1': 0.65, 'lambda2': 5.912184676546965, 'loop': 0, 'loss': 'CE', 'lr': 0.0025166267739454855, 'softmaxF': True, 'useGCN': True, 'weight_decay': 5.779174672323165e-06, 'weightedloss': True}. Best is trial 10 with value: 71.20000457763672.
/home/wxy/miniconda3/lib/python3.10/site-packages/optuna/distributions.py:685: UserWarning: The distribution is specified by [0, 1.00001] and step=0.05, but the range is not divisible by `step`. It will be replaced by [0, 1.0].
  warnings.warn(
K:  10
alpha:  0.8
lr:  0.0008349203940688631
weight_decay:  9.583835422895096e-06
dropout:  0.4
fix split and run 3 times
Data: Data(x=[3327, 3703], y=[3327], train_mask=[3327], val_mask=[3327], test_mask=[3327], adj_t=[3327, 3327, nnz=9104])
num_train tensor(120)
num_noise 0
noise: tensor(0)
data feature 3703
ALTOPT(
  (lins): Sequential(
    (0): Linear(in_features=3703, out_features=64, bias=True)
    (1): BatchNorm1d(64, eps=1e-05, momentum=0.1, affine=True, track_running_stats=True)
    (2): Dropout(p=0.4, inplace=True)
    (3): ReLU(inplace=True)
    (4): Linear(in_features=64, out_features=6, bias=True)
    (5): LogSoftmax(dim=-1)
  )
  (prop): Propagation(K=10, mode=None, lambda1=None, lambda2=None, L21=True, alpha=0.8)
  (gcn): GCN(
    (convs): ModuleList(
      (0): GCNConv(3703, 64)
      (1): GCNConv(64, 6)
    )
    (bns): ModuleList(
      (0): BatchNorm1d(64, eps=1e-05, momentum=0.1, affine=True, track_running_stats=True)
    )
    (output): LogSoftmax(dim=-1)
  )
)
propagate done
init label
Split: 01, Run: 01
None time:  0.9171040370129049
None Run 01:
Highest Train: 100.00
Highest Valid: 70.40
  Final Train: 100.00
   Final Test: 69.60
Split: 01, Run: 02
None time:  0.8674601828679442
None Run 02:
Highest Train: 100.00
Highest Valid: 68.20
  Final Train: 100.00
   Final Test: 67.20
Split: 01, Run: 03
None time:  0.8898371651303023
None Run 03:
Highest Train: 100.00
Highest Valid: 71.00
  Final Train: 100.00
   Final Test: 69.30
run time now: 2.7220888137817383
total time:  2.7865068570245057
None All runs:
Highest Train: 100.00 ± 0.00
Highest Valid: 69.87 ± 1.47
  Final Train: 100.00 ± 0.00
   Final Test: 68.70 ± 1.31
[I 2023-06-11 23:22:14,528] Trial 15 finished with value: 69.86666870117188 and parameters: {'Fwd': 0.005490996698626357, 'K': 10, 'alpha': 0.8, 'dropout': 0.4, 'gnnepoch': 100, 'lambda1': 0.35000000000000003, 'lambda2': 2.009819213914621, 'loop': 0, 'loss': 'CE', 'lr': 0.0008349203940688631, 'softmaxF': True, 'useGCN': True, 'weight_decay': 9.583835422895096e-06, 'weightedloss': True}. Best is trial 10 with value: 71.20000457763672.
/home/wxy/miniconda3/lib/python3.10/site-packages/optuna/distributions.py:685: UserWarning: The distribution is specified by [0, 1.00001] and step=0.05, but the range is not divisible by `step`. It will be replaced by [0, 1.0].
  warnings.warn(
K:  7
alpha:  0.25
lr:  0.000982824479563858
weight_decay:  5.552812535841586e-06
dropout:  0.9
fix split and run 3 times
Data: Data(x=[3327, 3703], y=[3327], train_mask=[3327], val_mask=[3327], test_mask=[3327], adj_t=[3327, 3327, nnz=9104])
num_train tensor(120)
num_noise 0
noise: tensor(0)
data feature 3703
ALTOPT(
  (lins): Sequential(
    (0): Linear(in_features=3703, out_features=64, bias=True)
    (1): BatchNorm1d(64, eps=1e-05, momentum=0.1, affine=True, track_running_stats=True)
    (2): Dropout(p=0.9, inplace=True)
    (3): ReLU(inplace=True)
    (4): Linear(in_features=64, out_features=6, bias=True)
    (5): LogSoftmax(dim=-1)
  )
  (prop): Propagation(K=7, mode=None, lambda1=None, lambda2=None, L21=True, alpha=0.25)
  (gcn): GCN(
    (convs): ModuleList(
      (0): GCNConv(3703, 64)
      (1): GCNConv(64, 6)
    )
    (bns): ModuleList(
      (0): BatchNorm1d(64, eps=1e-05, momentum=0.1, affine=True, track_running_stats=True)
    )
    (output): LogSoftmax(dim=-1)
  )
)
propagate done
init label
Split: 01, Run: 01
None time:  0.9704739791341126
None Run 01:
Highest Train: 100.00
Highest Valid: 70.80
  Final Train: 100.00
   Final Test: 69.90
Split: 01, Run: 02, Epoch: 100, Loss: 0.0000, Train: 100.00%, Valid: 69.00% Test: 69.40%
Split: 01, Run: 02
None time:  1.7042361591011286
None Run 02:
Highest Train: 100.00
Highest Valid: 69.00
  Final Train: 100.00
   Final Test: 69.20
Split: 01, Run: 03
None time:  0.8920020980294794
None Run 03:
Highest Train: 100.00
Highest Valid: 70.20
  Final Train: 100.00
   Final Test: 71.00
run time now: 3.606992483139038
total time:  3.6631962980609387
None All runs:
Highest Train: 100.00 ± 0.00
Highest Valid: 70.00 ± 0.92
  Final Train: 100.00 ± 0.00
   Final Test: 70.03 ± 0.91
[I 2023-06-11 23:22:18,657] Trial 16 finished with value: 70.0 and parameters: {'Fwd': 0.08798295137724872, 'K': 7, 'alpha': 0.25, 'dropout': 0.9, 'gnnepoch': 110, 'lambda1': 0.65, 'lambda2': 4.121183524948027, 'loop': 0, 'loss': 'CE', 'lr': 0.000982824479563858, 'softmaxF': True, 'useGCN': True, 'weight_decay': 5.552812535841586e-06, 'weightedloss': True}. Best is trial 10 with value: 71.20000457763672.
/home/wxy/miniconda3/lib/python3.10/site-packages/optuna/distributions.py:685: UserWarning: The distribution is specified by [0, 1.00001] and step=0.05, but the range is not divisible by `step`. It will be replaced by [0, 1.0].
  warnings.warn(
K:  9
alpha:  0.7000000000000001
lr:  0.002623280933550487
weight_decay:  1.1993324664610628e-06
dropout:  0.30000000000000004
fix split and run 3 times
Data: Data(x=[3327, 3703], y=[3327], train_mask=[3327], val_mask=[3327], test_mask=[3327], adj_t=[3327, 3327, nnz=9104])
num_train tensor(120)
num_noise 0
noise: tensor(0)
data feature 3703
ALTOPT(
  (lins): Sequential(
    (0): Linear(in_features=3703, out_features=64, bias=True)
    (1): BatchNorm1d(64, eps=1e-05, momentum=0.1, affine=True, track_running_stats=True)
    (2): Dropout(p=0.30000000000000004, inplace=True)
    (3): ReLU(inplace=True)
    (4): Linear(in_features=64, out_features=6, bias=True)
    (5): LogSoftmax(dim=-1)
  )
  (prop): Propagation(K=9, mode=None, lambda1=None, lambda2=None, L21=True, alpha=0.7000000000000001)
  (gcn): GCN(
    (convs): ModuleList(
      (0): GCNConv(3703, 64)
      (1): GCNConv(64, 6)
    )
    (bns): ModuleList(
      (0): BatchNorm1d(64, eps=1e-05, momentum=0.1, affine=True, track_running_stats=True)
    )
    (output): LogSoftmax(dim=-1)
  )
)
propagate done
init label
Split: 01, Run: 01
None time:  0.5928666279651225
None Run 01:
Highest Train: 100.00
Highest Valid: 71.60
  Final Train: 100.00
   Final Test: 69.90
Split: 01, Run: 02
None time:  0.5828732610680163
None Run 02:
Highest Train: 100.00
Highest Valid: 70.20
  Final Train: 100.00
   Final Test: 68.50
Split: 01, Run: 03
None time:  0.6197247579693794
None Run 03:
Highest Train: 100.00
Highest Valid: 71.20
  Final Train: 100.00
   Final Test: 68.70
run time now: 1.8384602069854736
total time:  1.9013009211048484
None All runs:
Highest Train: 100.00 ± 0.00
Highest Valid: 71.00 ± 0.72
  Final Train: 100.00 ± 0.00
   Final Test: 69.03 ± 0.76
