[I 2023-06-11 23:26:26,464] Trial 89 finished with value: 71.46666717529297 and parameters: {'Fwd': 0.0026705857788126026, 'K': 8, 'alpha': 0.25, 'dropout': 0.9, 'gnnepoch': 120, 'lambda1': 0.9500000000000001, 'lambda2': 2.3811310309361544, 'loop': 0, 'loss': 'CE', 'lr': 0.003899241932102862, 'softmaxF': False, 'useGCN': True, 'weight_decay': 5.779780505060882e-06, 'weightedloss': False}. Best is trial 82 with value: 71.73332977294922.
/home/wxy/miniconda3/lib/python3.10/site-packages/optuna/distributions.py:685: UserWarning: The distribution is specified by [0, 1.00001] and step=0.05, but the range is not divisible by `step`. It will be replaced by [0, 1.0].
  warnings.warn(
K:  5
alpha:  0.25
lr:  0.003944160553010243
weight_decay:  5.698649847692983e-06
dropout:  0.9
fix split and run 3 times
Data: Data(x=[3327, 3703], y=[3327], train_mask=[3327], val_mask=[3327], test_mask=[3327], adj_t=[3327, 3327, nnz=9104])
num_train tensor(120)
num_noise 0
noise: tensor(0)
data feature 3703
ALTOPT(
  (lins): Sequential(
    (0): Linear(in_features=3703, out_features=64, bias=True)
    (1): BatchNorm1d(64, eps=1e-05, momentum=0.1, affine=True, track_running_stats=True)
    (2): Dropout(p=0.9, inplace=True)
    (3): ReLU(inplace=True)
    (4): Linear(in_features=64, out_features=6, bias=True)
    (5): LogSoftmax(dim=-1)
  )
  (prop): Propagation(K=5, mode=None, lambda1=None, lambda2=None, L21=True, alpha=0.25)
  (gcn): GCN(
    (convs): ModuleList(
      (0): GCNConv(3703, 64)
      (1): GCNConv(64, 6)
    )
    (bns): ModuleList(
      (0): BatchNorm1d(64, eps=1e-05, momentum=0.1, affine=True, track_running_stats=True)
    )
    (output): LogSoftmax(dim=-1)
  )
)
propagate done
init label
Split: 01, Run: 01
None time:  0.6966583498287946
None Run 01:
Highest Train: 100.00
Highest Valid: 65.80
  Final Train: 97.50
   Final Test: 62.70
Split: 01, Run: 02
None time:  0.7120681849773973
None Run 02:
Highest Train: 100.00
Highest Valid: 61.20
  Final Train: 97.50
   Final Test: 61.60
Split: 01, Run: 03
None time:  0.64678072812967
None Run 03:
Highest Train: 100.00
Highest Valid: 60.20
  Final Train: 99.17
   Final Test: 59.90
run time now: 2.0921921730041504
total time:  2.1412703988607973
None All runs:
Highest Train: 100.00 ± 0.00
Highest Valid: 62.40 ± 2.99
  Final Train: 98.06 ± 0.96
   Final Test: 61.40 ± 1.41
[I 2023-06-11 23:26:29,122] Trial 90 finished with value: 62.39999771118164 and parameters: {'Fwd': 0.0027079863590264556, 'K': 5, 'alpha': 0.25, 'dropout': 0.9, 'gnnepoch': 120, 'lambda1': 0.9500000000000001, 'lambda2': 2.3847262110335614, 'loop': 0, 'loss': 'CE', 'lr': 0.003944160553010243, 'softmaxF': False, 'useGCN': False, 'weight_decay': 5.698649847692983e-06, 'weightedloss': False}. Best is trial 82 with value: 71.73332977294922.
/home/wxy/miniconda3/lib/python3.10/site-packages/optuna/distributions.py:685: UserWarning: The distribution is specified by [0, 1.00001] and step=0.05, but the range is not divisible by `step`. It will be replaced by [0, 1.0].
  warnings.warn(
K:  8
alpha:  0.2
lr:  0.0033552333214701643
weight_decay:  4.354623118916161e-06
dropout:  0.9
fix split and run 3 times
Data: Data(x=[3327, 3703], y=[3327], train_mask=[3327], val_mask=[3327], test_mask=[3327], adj_t=[3327, 3327, nnz=9104])
num_train tensor(120)
num_noise 0
noise: tensor(0)
data feature 3703
ALTOPT(
  (lins): Sequential(
    (0): Linear(in_features=3703, out_features=64, bias=True)
    (1): BatchNorm1d(64, eps=1e-05, momentum=0.1, affine=True, track_running_stats=True)
    (2): Dropout(p=0.9, inplace=True)
    (3): ReLU(inplace=True)
    (4): Linear(in_features=64, out_features=6, bias=True)
    (5): LogSoftmax(dim=-1)
  )
  (prop): Propagation(K=8, mode=None, lambda1=None, lambda2=None, L21=True, alpha=0.2)
  (gcn): GCN(
    (convs): ModuleList(
      (0): GCNConv(3703, 64)
      (1): GCNConv(64, 6)
    )
    (bns): ModuleList(
      (0): BatchNorm1d(64, eps=1e-05, momentum=0.1, affine=True, track_running_stats=True)
    )
    (output): LogSoftmax(dim=-1)
  )
)
propagate done
init label
Split: 01, Run: 01
None time:  1.0336068461183459
None Run 01:
Highest Train: 100.00
Highest Valid: 71.60
  Final Train: 99.17
   Final Test: 69.60
Split: 01, Run: 02
None time:  1.0356610619928688
None Run 02:
Highest Train: 100.00
Highest Valid: 71.80
  Final Train: 100.00
   Final Test: 69.80
Split: 01, Run: 03
None time:  1.0071892340201885
None Run 03:
Highest Train: 100.00
Highest Valid: 71.40
  Final Train: 100.00
   Final Test: 69.90
run time now: 3.118429660797119
total time:  3.1735563401598483
None All runs:
Highest Train: 100.00 ± 0.00
Highest Valid: 71.60 ± 0.20
  Final Train: 99.72 ± 0.48
   Final Test: 69.77 ± 0.15
[I 2023-06-11 23:26:32,725] Trial 91 finished with value: 71.5999984741211 and parameters: {'Fwd': 0.005386706133654164, 'K': 8, 'alpha': 0.2, 'dropout': 0.9, 'gnnepoch': 120, 'lambda1': 0.8500000000000001, 'lambda2': 2.8438913072491916, 'loop': 0, 'loss': 'CE', 'lr': 0.0033552333214701643, 'softmaxF': False, 'useGCN': True, 'weight_decay': 4.354623118916161e-06, 'weightedloss': False}. Best is trial 82 with value: 71.73332977294922.
/home/wxy/miniconda3/lib/python3.10/site-packages/optuna/distributions.py:685: UserWarning: The distribution is specified by [0, 1.00001] and step=0.05, but the range is not divisible by `step`. It will be replaced by [0, 1.0].
  warnings.warn(
K:  8
alpha:  0.2
lr:  0.003351589957395604
weight_decay:  4.131484476396944e-06
dropout:  0.9
fix split and run 3 times
Data: Data(x=[3327, 3703], y=[3327], train_mask=[3327], val_mask=[3327], test_mask=[3327], adj_t=[3327, 3327, nnz=9104])
num_train tensor(120)
num_noise 0
noise: tensor(0)
data feature 3703
ALTOPT(
  (lins): Sequential(
    (0): Linear(in_features=3703, out_features=64, bias=True)
    (1): BatchNorm1d(64, eps=1e-05, momentum=0.1, affine=True, track_running_stats=True)
    (2): Dropout(p=0.9, inplace=True)
    (3): ReLU(inplace=True)
    (4): Linear(in_features=64, out_features=6, bias=True)
    (5): LogSoftmax(dim=-1)
  )
  (prop): Propagation(K=8, mode=None, lambda1=None, lambda2=None, L21=True, alpha=0.2)
  (gcn): GCN(
    (convs): ModuleList(
      (0): GCNConv(3703, 64)
      (1): GCNConv(64, 6)
    )
    (bns): ModuleList(
      (0): BatchNorm1d(64, eps=1e-05, momentum=0.1, affine=True, track_running_stats=True)
    )
    (output): LogSoftmax(dim=-1)
  )
)
propagate done
init label
Split: 01, Run: 01
None time:  0.9827156979590654
None Run 01:
Highest Train: 100.00
Highest Valid: 71.60
  Final Train: 99.17
   Final Test: 69.70
Split: 01, Run: 02
None time:  1.056701106019318
None Run 02:
Highest Train: 100.00
Highest Valid: 71.80
  Final Train: 100.00
   Final Test: 69.70
Split: 01, Run: 03
None time:  1.077694769948721
None Run 03:
Highest Train: 100.00
Highest Valid: 71.40
  Final Train: 100.00
   Final Test: 69.90
run time now: 3.162973165512085
total time:  3.2182312570512295
None All runs:
Highest Train: 100.00 ± 0.00
Highest Valid: 71.60 ± 0.20
  Final Train: 99.72 ± 0.48
   Final Test: 69.77 ± 0.12
[I 2023-06-11 23:26:36,367] Trial 92 finished with value: 71.5999984741211 and parameters: {'Fwd': 0.005589128629062403, 'K': 8, 'alpha': 0.2, 'dropout': 0.9, 'gnnepoch': 120, 'lambda1': 0.9500000000000001, 'lambda2': 2.774575474177046, 'loop': 0, 'loss': 'CE', 'lr': 0.003351589957395604, 'softmaxF': False, 'useGCN': True, 'weight_decay': 4.131484476396944e-06, 'weightedloss': False}. Best is trial 82 with value: 71.73332977294922.
/home/wxy/miniconda3/lib/python3.10/site-packages/optuna/distributions.py:685: UserWarning: The distribution is specified by [0, 1.00001] and step=0.05, but the range is not divisible by `step`. It will be replaced by [0, 1.0].
  warnings.warn(
K:  8
alpha:  0.2
lr:  0.0032519550663333576
weight_decay:  4.382800661528447e-06
dropout:  0.8
fix split and run 3 times
Data: Data(x=[3327, 3703], y=[3327], train_mask=[3327], val_mask=[3327], test_mask=[3327], adj_t=[3327, 3327, nnz=9104])
num_train tensor(120)
num_noise 0
noise: tensor(0)
data feature 3703
ALTOPT(
  (lins): Sequential(
    (0): Linear(in_features=3703, out_features=64, bias=True)
    (1): BatchNorm1d(64, eps=1e-05, momentum=0.1, affine=True, track_running_stats=True)
    (2): Dropout(p=0.8, inplace=True)
    (3): ReLU(inplace=True)
    (4): Linear(in_features=64, out_features=6, bias=True)
    (5): LogSoftmax(dim=-1)
  )
  (prop): Propagation(K=8, mode=None, lambda1=None, lambda2=None, L21=True, alpha=0.2)
  (gcn): GCN(
    (convs): ModuleList(
      (0): GCNConv(3703, 64)
      (1): GCNConv(64, 6)
    )
    (bns): ModuleList(
      (0): BatchNorm1d(64, eps=1e-05, momentum=0.1, affine=True, track_running_stats=True)
    )
    (output): LogSoftmax(dim=-1)
  )
)
propagate done
init label
Split: 01, Run: 01
None time:  1.0719487939495593
None Run 01:
Highest Train: 100.00
Highest Valid: 71.40
  Final Train: 99.17
   Final Test: 69.70
Split: 01, Run: 02
None time:  1.0389516158029437
None Run 02:
Highest Train: 100.00
Highest Valid: 71.40
  Final Train: 99.17
   Final Test: 69.90
Split: 01, Run: 03
None time:  0.9492106479592621
None Run 03:
Highest Train: 100.00
Highest Valid: 71.20
  Final Train: 100.00
   Final Test: 68.80
run time now: 3.101243495941162
total time:  3.146709294989705
None All runs:
Highest Train: 100.00 ± 0.00
Highest Valid: 71.33 ± 0.12
  Final Train: 99.44 ± 0.48
   Final Test: 69.47 ± 0.59
[I 2023-06-11 23:26:39,975] Trial 93 finished with value: 71.33333587646484 and parameters: {'Fwd': 0.005614087804198717, 'K': 8, 'alpha': 0.2, 'dropout': 0.8, 'gnnepoch': 120, 'lambda1': 1.0, 'lambda2': 2.833926802355343, 'loop': 0, 'loss': 'CE', 'lr': 0.0032519550663333576, 'softmaxF': False, 'useGCN': True, 'weight_decay': 4.382800661528447e-06, 'weightedloss': False}. Best is trial 82 with value: 71.73332977294922.
/home/wxy/miniconda3/lib/python3.10/site-packages/optuna/distributions.py:685: UserWarning: The distribution is specified by [0, 1.00001] and step=0.05, but the range is not divisible by `step`. It will be replaced by [0, 1.0].
  warnings.warn(
K:  7
alpha:  0.2
lr:  0.005108859269958477
weight_decay:  3.279024562662068e-06
dropout:  0.9
fix split and run 3 times
Data: Data(x=[3327, 3703], y=[3327], train_mask=[3327], val_mask=[3327], test_mask=[3327], adj_t=[3327, 3327, nnz=9104])
num_train tensor(120)
num_noise 0
noise: tensor(0)
data feature 3703
ALTOPT(
  (lins): Sequential(
    (0): Linear(in_features=3703, out_features=64, bias=True)
    (1): BatchNorm1d(64, eps=1e-05, momentum=0.1, affine=True, track_running_stats=True)
    (2): Dropout(p=0.9, inplace=True)
    (3): ReLU(inplace=True)
    (4): Linear(in_features=64, out_features=6, bias=True)
    (5): LogSoftmax(dim=-1)
  )
  (prop): Propagation(K=7, mode=None, lambda1=None, lambda2=None, L21=True, alpha=0.2)
  (gcn): GCN(
    (convs): ModuleList(
      (0): GCNConv(3703, 64)
      (1): GCNConv(64, 6)
    )
    (bns): ModuleList(
      (0): BatchNorm1d(64, eps=1e-05, momentum=0.1, affine=True, track_running_stats=True)
    )
    (output): LogSoftmax(dim=-1)
  )
)
propagate done
init label
Split: 01, Run: 01
None time:  1.072795628104359
None Run 01:
Highest Train: 100.00
Highest Valid: 71.20
  Final Train: 99.17
   Final Test: 70.10
Split: 01, Run: 02
None time:  1.073939923895523
None Run 02:
Highest Train: 100.00
Highest Valid: 71.20
  Final Train: 98.33
   Final Test: 70.20
Split: 01, Run: 03
None time:  1.063034184044227
None Run 03:
Highest Train: 100.00
Highest Valid: 71.40
  Final Train: 98.33
   Final Test: 70.40
run time now: 3.2506775856018066
total time:  3.299459938891232
None All runs:
Highest Train: 100.00 ± 0.00
Highest Valid: 71.27 ± 0.12
  Final Train: 98.61 ± 0.48
   Final Test: 70.23 ± 0.15
[I 2023-06-11 23:26:43,760] Trial 94 finished with value: 71.26667022705078 and parameters: {'Fwd': 0.005236598428009651, 'K': 7, 'alpha': 0.2, 'dropout': 0.9, 'gnnepoch': 120, 'lambda1': 0.8500000000000001, 'lambda2': 2.83457144350296, 'loop': 0, 'loss': 'CE', 'lr': 0.005108859269958477, 'softmaxF': False, 'useGCN': True, 'weight_decay': 3.279024562662068e-06, 'weightedloss': False}. Best is trial 82 with value: 71.73332977294922.
/home/wxy/miniconda3/lib/python3.10/site-packages/optuna/distributions.py:685: UserWarning: The distribution is specified by [0, 1.00001] and step=0.05, but the range is not divisible by `step`. It will be replaced by [0, 1.0].
  warnings.warn(
K:  8
alpha:  0.30000000000000004
lr:  0.0036073340313046583
weight_decay:  8.032411239580695e-06
dropout:  0.9
fix split and run 3 times
Data: Data(x=[3327, 3703], y=[3327], train_mask=[3327], val_mask=[3327], test_mask=[3327], adj_t=[3327, 3327, nnz=9104])
num_train tensor(120)
num_noise 0
noise: tensor(0)
data feature 3703
ALTOPT(
  (lins): Sequential(
    (0): Linear(in_features=3703, out_features=64, bias=True)
    (1): BatchNorm1d(64, eps=1e-05, momentum=0.1, affine=True, track_running_stats=True)
    (2): Dropout(p=0.9, inplace=True)
    (3): ReLU(inplace=True)
    (4): Linear(in_features=64, out_features=6, bias=True)
    (5): LogSoftmax(dim=-1)
  )
  (prop): Propagation(K=8, mode=None, lambda1=None, lambda2=None, L21=True, alpha=0.30000000000000004)
  (gcn): GCN(
    (convs): ModuleList(
      (0): GCNConv(3703, 64)
      (1): GCNConv(64, 6)
    )
    (bns): ModuleList(
      (0): BatchNorm1d(64, eps=1e-05, momentum=0.1, affine=True, track_running_stats=True)
    )
    (output): LogSoftmax(dim=-1)
  )
)
propagate done
init label
Split: 01, Run: 01
None time:  1.0262182510923594
None Run 01:
Highest Train: 100.00
Highest Valid: 71.60
  Final Train: 99.17
   Final Test: 69.40
Split: 01, Run: 02
None time:  0.9320164369419217
None Run 02:
Highest Train: 100.00
Highest Valid: 70.80
  Final Train: 98.33
   Final Test: 68.30
Split: 01, Run: 03
None time:  0.9412027557846159
None Run 03:
Highest Train: 100.00
Highest Valid: 71.20
  Final Train: 100.00
   Final Test: 70.10
run time now: 2.9418153762817383
total time:  3.0012809329200536
None All runs:
Highest Train: 100.00 ± 0.00
Highest Valid: 71.20 ± 0.40
  Final Train: 99.17 ± 0.83
   Final Test: 69.27 ± 0.91
[I 2023-06-11 23:26:47,196] Trial 95 finished with value: 71.20000457763672 and parameters: {'Fwd': 0.0018058845918618577, 'K': 8, 'alpha': 0.30000000000000004, 'dropout': 0.9, 'gnnepoch': 110, 'lambda1': 0.9, 'lambda2': 2.5857244788735345, 'loop': 0, 'loss': 'CE', 'lr': 0.0036073340313046583, 'softmaxF': False, 'useGCN': True, 'weight_decay': 8.032411239580695e-06, 'weightedloss': False}. Best is trial 82 with value: 71.73332977294922.
/home/wxy/miniconda3/lib/python3.10/site-packages/optuna/distributions.py:685: UserWarning: The distribution is specified by [0, 1.00001] and step=0.05, but the range is not divisible by `step`. It will be replaced by [0, 1.0].
  warnings.warn(
K:  7
alpha:  0.15000000000000002
lr:  0.0029677575467501926
weight_decay:  4.0574336487320995e-06
dropout:  0.8
fix split and run 3 times
Data: Data(x=[3327, 3703], y=[3327], train_mask=[3327], val_mask=[3327], test_mask=[3327], adj_t=[3327, 3327, nnz=9104])
num_train tensor(120)
num_noise 0
noise: tensor(0)
data feature 3703
ALTOPT(
  (lins): Sequential(
    (0): Linear(in_features=3703, out_features=64, bias=True)
    (1): BatchNorm1d(64, eps=1e-05, momentum=0.1, affine=True, track_running_stats=True)
    (2): Dropout(p=0.8, inplace=True)
    (3): ReLU(inplace=True)
    (4): Linear(in_features=64, out_features=6, bias=True)
    (5): LogSoftmax(dim=-1)
  )
  (prop): Propagation(K=7, mode=None, lambda1=None, lambda2=None, L21=True, alpha=0.15000000000000002)
  (gcn): GCN(
    (convs): ModuleList(
      (0): GCNConv(3703, 64)
      (1): GCNConv(64, 6)
    )
    (bns): ModuleList(
      (0): BatchNorm1d(64, eps=1e-05, momentum=0.1, affine=True, track_running_stats=True)
    )
    (output): LogSoftmax(dim=-1)
  )
)
propagate done
init label
Split: 01, Run: 01
None time:  0.9663996419403702
None Run 01:
Highest Train: 100.00
Highest Valid: 71.60
  Final Train: 99.17
   Final Test: 70.00
Split: 01, Run: 02
None time:  0.9880976770073175
None Run 02:
Highest Train: 100.00
Highest Valid: 72.00
  Final Train: 99.17
   Final Test: 69.90
Split: 01, Run: 03
None time:  1.161155115114525
None Run 03:
Highest Train: 100.00
Highest Valid: 70.80
  Final Train: 95.83
   Final Test: 69.50
run time now: 3.1554172039031982
total time:  3.217387279961258
None All runs:
Highest Train: 100.00 ± 0.00
Highest Valid: 71.47 ± 0.61
  Final Train: 98.06 ± 1.92
   Final Test: 69.80 ± 0.26
[I 2023-06-11 23:26:50,857] Trial 96 finished with value: 71.46666717529297 and parameters: {'Fwd': 0.004483334460355599, 'K': 7, 'alpha': 0.15000000000000002, 'dropout': 0.8, 'gnnepoch': 120, 'lambda1': 0.9500000000000001, 'lambda2': 2.0640966699905974, 'loop': 0, 'loss': 'CE', 'lr': 0.0029677575467501926, 'softmaxF': False, 'useGCN': True, 'weight_decay': 4.0574336487320995e-06, 'weightedloss': False}. Best is trial 82 with value: 71.73332977294922.
/home/wxy/miniconda3/lib/python3.10/site-packages/optuna/distributions.py:685: UserWarning: The distribution is specified by [0, 1.00001] and step=0.05, but the range is not divisible by `step`. It will be replaced by [0, 1.0].
  warnings.warn(
K:  6
alpha:  0.2
lr:  0.0033724796576560818
weight_decay:  1.6711815456728843e-06
dropout:  0.9
fix split and run 3 times
Data: Data(x=[3327, 3703], y=[3327], train_mask=[3327], val_mask=[3327], test_mask=[3327], adj_t=[3327, 3327, nnz=9104])
num_train tensor(120)
num_noise 0
noise: tensor(0)
data feature 3703
ALTOPT(
  (lins): Sequential(
    (0): Linear(in_features=3703, out_features=64, bias=True)
    (1): BatchNorm1d(64, eps=1e-05, momentum=0.1, affine=True, track_running_stats=True)
    (2): Dropout(p=0.9, inplace=True)
    (3): ReLU(inplace=True)
    (4): Linear(in_features=64, out_features=6, bias=True)
    (5): LogSoftmax(dim=-1)
  )
  (prop): Propagation(K=6, mode=None, lambda1=None, lambda2=None, L21=True, alpha=0.2)
  (gcn): GCN(
    (convs): ModuleList(
      (0): GCNConv(3703, 64)
      (1): GCNConv(64, 6)
    )
    (bns): ModuleList(
      (0): BatchNorm1d(64, eps=1e-05, momentum=0.1, affine=True, track_running_stats=True)
    )
    (output): LogSoftmax(dim=-1)
  )
)
propagate done
init label
Split: 01, Run: 01
None time:  0.9284986290149391
None Run 01:
Highest Train: 100.00
Highest Valid: 71.60
  Final Train: 100.00
   Final Test: 69.80
Split: 01, Run: 02
None time:  1.0874760570004582
None Run 02:
Highest Train: 100.00
Highest Valid: 71.40
  Final Train: 100.00
   Final Test: 70.50
Split: 01, Run: 03
None time:  1.1374532638583332
None Run 03:
Highest Train: 100.00
Highest Valid: 71.60
  Final Train: 100.00
   Final Test: 69.80
run time now: 3.1916685104370117
total time:  3.2499266790691763
None All runs:
Highest Train: 100.00 ± 0.00
Highest Valid: 71.53 ± 0.12
  Final Train: 100.00 ± 0.00
   Final Test: 70.03 ± 0.40
[I 2023-06-11 23:26:54,525] Trial 97 finished with value: 71.53333282470703 and parameters: {'Fwd': 0.007064071142353733, 'K': 6, 'alpha': 0.2, 'dropout': 0.9, 'gnnepoch': 120, 'lambda1': 0.8, 'lambda2': 3.452669463298691, 'loop': 0, 'loss': 'CE', 'lr': 0.0033724796576560818, 'softmaxF': False, 'useGCN': True, 'weight_decay': 1.6711815456728843e-06, 'weightedloss': False}. Best is trial 82 with value: 71.73332977294922.
/home/wxy/miniconda3/lib/python3.10/site-packages/optuna/distributions.py:685: UserWarning: The distribution is specified by [0, 1.00001] and step=0.05, but the range is not divisible by `step`. It will be replaced by [0, 1.0].
  warnings.warn(
K:  8
alpha:  0.15000000000000002
lr:  0.0033474915507598945
weight_decay:  1.5884674430447137e-06
dropout:  0.9
fix split and run 3 times
Data: Data(x=[3327, 3703], y=[3327], train_mask=[3327], val_mask=[3327], test_mask=[3327], adj_t=[3327, 3327, nnz=9104])
num_train tensor(120)
num_noise 0
noise: tensor(0)
data feature 3703
ALTOPT(
  (lins): Sequential(
    (0): Linear(in_features=3703, out_features=64, bias=True)
    (1): BatchNorm1d(64, eps=1e-05, momentum=0.1, affine=True, track_running_stats=True)
    (2): Dropout(p=0.9, inplace=True)
    (3): ReLU(inplace=True)
    (4): Linear(in_features=64, out_features=6, bias=True)
    (5): LogSoftmax(dim=-1)
  )
  (prop): Propagation(K=8, mode=None, lambda1=None, lambda2=None, L21=True, alpha=0.15000000000000002)
  (gcn): GCN(
    (convs): ModuleList(
      (0): GCNConv(3703, 64)
      (1): GCNConv(64, 6)
    )
    (bns): ModuleList(
      (0): BatchNorm1d(64, eps=1e-05, momentum=0.1, affine=True, track_running_stats=True)
    )
    (output): LogSoftmax(dim=-1)
  )
)
propagate done
init label
Split: 01, Run: 01
None time:  0.9989526579156518
None Run 01:
Highest Train: 100.00
Highest Valid: 71.60
  Final Train: 100.00
   Final Test: 69.50
Split: 01, Run: 02
None time:  0.9921473988797516
None Run 02:
Highest Train: 100.00
Highest Valid: 70.60
  Final Train: 100.00
   Final Test: 67.90
Split: 01, Run: 03
None time:  0.9445442659780383
None Run 03:
Highest Train: 100.00
Highest Valid: 71.00
  Final Train: 100.00
   Final Test: 70.10
run time now: 2.977301597595215
total time:  3.041711066151038
None All runs:
Highest Train: 100.00 ± 0.00
Highest Valid: 71.07 ± 0.50
  Final Train: 100.00 ± 0.00
   Final Test: 69.17 ± 1.14
