[I 2023-06-12 00:21:46,393] Trial 107 finished with value: 82.73332977294922 and parameters: {'Fwd': 1.2788196124167418e-06, 'K': 9, 'alpha': 0.9500000000000001, 'dropout': 0.7000000000000001, 'gnnepoch': 70, 'lambda1': 0.45, 'lambda2': 7.131047750637999, 'loop': 1, 'loss': 'MSE', 'lr': 0.0017527579140569822, 'softmaxF': True, 'useGCN': False, 'weight_decay': 0.0021361705862199777, 'weightedloss': False}. Best is trial 107 with value: 82.73332977294922.
/home/wxy/miniconda3/lib/python3.10/site-packages/optuna/distributions.py:685: UserWarning: The distribution is specified by [0, 1.00001] and step=0.05, but the range is not divisible by `step`. It will be replaced by [0, 1.0].
  warnings.warn(
K:  10
alpha:  1.0
lr:  0.0018392948802464365
weight_decay:  0.0021044597933961595
dropout:  0.7000000000000001
fix split and run 3 times
Data: Data(x=[19717, 500], y=[19717], train_mask=[19717], val_mask=[19717], test_mask=[19717], adj_t=[19717, 19717, nnz=88648])
num_train tensor(60)
num_noise 0
noise: tensor(0)
data feature 500
ALTOPT(
  (lins): Sequential(
    (0): Linear(in_features=500, out_features=64, bias=True)
    (1): BatchNorm1d(64, eps=1e-05, momentum=0.1, affine=True, track_running_stats=True)
    (2): Dropout(p=0.7000000000000001, inplace=True)
    (3): ReLU(inplace=True)
    (4): Linear(in_features=64, out_features=3, bias=True)
    (5): Identity()
  )
  (prop): Propagation(K=10, mode=None, lambda1=None, lambda2=None, L21=True, alpha=1.0)
  (gcn): GCN(
    (convs): ModuleList(
      (0): GCNConv(500, 64)
      (1): GCNConv(64, 3)
    )
    (bns): ModuleList(
      (0): BatchNorm1d(64, eps=1e-05, momentum=0.1, affine=True, track_running_stats=True)
    )
    (output): Identity()
  )
)
propagate done
init label
Split: 01, Run: 01
None time:  2.549861751962453
None Run 01:
Highest Train: 100.00
Highest Valid: 82.20
  Final Train: 100.00
   Final Test: 78.70
Split: 01, Run: 02
None time:  2.22317233402282
None Run 02:
Highest Train: 100.00
Highest Valid: 80.40
  Final Train: 100.00
   Final Test: 78.10
Split: 01, Run: 03
None time:  1.9167592320591211
None Run 03:
Highest Train: 100.00
Highest Valid: 77.80
  Final Train: 100.00
   Final Test: 77.40
run time now: 6.737865209579468
total time:  6.809752692934126
None All runs:
Highest Train: 100.00 ± 0.00
Highest Valid: 80.13 ± 2.21
  Final Train: 100.00 ± 0.00
   Final Test: 78.07 ± 0.65
[I 2023-06-12 00:21:53,677] Trial 108 finished with value: 80.13333892822266 and parameters: {'Fwd': 1.5662741063256319e-06, 'K': 10, 'alpha': 1.0, 'dropout': 0.7000000000000001, 'gnnepoch': 70, 'lambda1': 0.45, 'lambda2': 6.946560417414041, 'loop': 1, 'loss': 'MSE', 'lr': 0.0018392948802464365, 'softmaxF': True, 'useGCN': False, 'weight_decay': 0.0021044597933961595, 'weightedloss': False}. Best is trial 107 with value: 82.73332977294922.
/home/wxy/miniconda3/lib/python3.10/site-packages/optuna/distributions.py:685: UserWarning: The distribution is specified by [0, 1.00001] and step=0.05, but the range is not divisible by `step`. It will be replaced by [0, 1.0].
  warnings.warn(
K:  9
alpha:  0.9
lr:  0.00168883876451629
weight_decay:  0.0037277336653925752
dropout:  0.8
fix split and run 3 times
Data: Data(x=[19717, 500], y=[19717], train_mask=[19717], val_mask=[19717], test_mask=[19717], adj_t=[19717, 19717, nnz=88648])
num_train tensor(60)
num_noise 0
noise: tensor(0)
data feature 500
ALTOPT(
  (lins): Sequential(
    (0): Linear(in_features=500, out_features=64, bias=True)
    (1): BatchNorm1d(64, eps=1e-05, momentum=0.1, affine=True, track_running_stats=True)
    (2): Dropout(p=0.8, inplace=True)
    (3): ReLU(inplace=True)
    (4): Linear(in_features=64, out_features=3, bias=True)
    (5): Identity()
  )
  (prop): Propagation(K=9, mode=None, lambda1=None, lambda2=None, L21=True, alpha=0.9)
  (gcn): GCN(
    (convs): ModuleList(
      (0): GCNConv(500, 64)
      (1): GCNConv(64, 3)
    )
    (bns): ModuleList(
      (0): BatchNorm1d(64, eps=1e-05, momentum=0.1, affine=True, track_running_stats=True)
    )
    (output): Identity()
  )
)
propagate done
init label
Split: 01, Run: 01
None time:  1.4899626758415252
None Run 01:
Highest Train: 100.00
Highest Valid: 80.80
  Final Train: 100.00
   Final Test: 76.60
Split: 01, Run: 02
None time:  1.2675654259510338
None Run 02:
Highest Train: 100.00
Highest Valid: 81.60
  Final Train: 100.00
   Final Test: 77.60
Split: 01, Run: 03
None time:  2.731785431969911
None Run 03:
Highest Train: 100.00
Highest Valid: 83.20
  Final Train: 100.00
   Final Test: 79.20
run time now: 5.543686389923096
total time:  5.595314135076478
None All runs:
Highest Train: 100.00 ± 0.00
Highest Valid: 81.87 ± 1.22
  Final Train: 100.00 ± 0.00
   Final Test: 77.80 ± 1.31
[I 2023-06-12 00:21:59,807] Trial 109 finished with value: 81.86666870117188 and parameters: {'Fwd': 1.2438310547847579e-06, 'K': 9, 'alpha': 0.9, 'dropout': 0.8, 'gnnepoch': 70, 'lambda1': 0.45, 'lambda2': 7.063015940916325, 'loop': 1, 'loss': 'MSE', 'lr': 0.00168883876451629, 'softmaxF': True, 'useGCN': False, 'weight_decay': 0.0037277336653925752, 'weightedloss': False}. Best is trial 107 with value: 82.73332977294922.
/home/wxy/miniconda3/lib/python3.10/site-packages/optuna/distributions.py:685: UserWarning: The distribution is specified by [0, 1.00001] and step=0.05, but the range is not divisible by `step`. It will be replaced by [0, 1.0].
  warnings.warn(
K:  9
alpha:  0.9500000000000001
lr:  0.0017259982764894406
weight_decay:  0.0037474832743036885
dropout:  0.8
fix split and run 3 times
Data: Data(x=[19717, 500], y=[19717], train_mask=[19717], val_mask=[19717], test_mask=[19717], adj_t=[19717, 19717, nnz=88648])
num_train tensor(60)
num_noise 0
noise: tensor(0)
data feature 500
ALTOPT(
  (lins): Sequential(
    (0): Linear(in_features=500, out_features=64, bias=True)
    (1): BatchNorm1d(64, eps=1e-05, momentum=0.1, affine=True, track_running_stats=True)
    (2): Dropout(p=0.8, inplace=True)
    (3): ReLU(inplace=True)
    (4): Linear(in_features=64, out_features=3, bias=True)
    (5): Identity()
  )
  (prop): Propagation(K=9, mode=None, lambda1=None, lambda2=None, L21=True, alpha=0.9500000000000001)
  (gcn): GCN(
    (convs): ModuleList(
      (0): GCNConv(500, 64)
      (1): GCNConv(64, 3)
    )
    (bns): ModuleList(
      (0): BatchNorm1d(64, eps=1e-05, momentum=0.1, affine=True, track_running_stats=True)
    )
    (output): Identity()
  )
)
propagate done
init label
Split: 01, Run: 01
None time:  2.1532941958867013
None Run 01:
Highest Train: 100.00
Highest Valid: 81.00
  Final Train: 100.00
   Final Test: 77.60
Split: 01, Run: 02
None time:  2.643256302922964
None Run 02:
Highest Train: 100.00
Highest Valid: 80.40
  Final Train: 100.00
   Final Test: 78.20
Split: 01, Run: 03
None time:  3.014701677020639
None Run 03:
Highest Train: 100.00
Highest Valid: 81.20
  Final Train: 100.00
   Final Test: 79.00
run time now: 7.856493949890137
total time:  7.907441642135382
None All runs:
Highest Train: 100.00 ± 0.00
Highest Valid: 80.87 ± 0.42
  Final Train: 100.00 ± 0.00
   Final Test: 78.27 ± 0.70
[I 2023-06-12 00:22:08,257] Trial 110 finished with value: 80.86666107177734 and parameters: {'Fwd': 1.2384673970061936e-06, 'K': 9, 'alpha': 0.9500000000000001, 'dropout': 0.8, 'gnnepoch': 70, 'lambda1': 0.45, 'lambda2': 6.464149400431928, 'loop': 1, 'loss': 'MSE', 'lr': 0.0017259982764894406, 'softmaxF': True, 'useGCN': False, 'weight_decay': 0.0037474832743036885, 'weightedloss': False}. Best is trial 107 with value: 82.73332977294922.
/home/wxy/miniconda3/lib/python3.10/site-packages/optuna/distributions.py:685: UserWarning: The distribution is specified by [0, 1.00001] and step=0.05, but the range is not divisible by `step`. It will be replaced by [0, 1.0].
  warnings.warn(
K:  9
alpha:  0.9
lr:  0.0019584499585705802
weight_decay:  0.002321099213609256
dropout:  0.8
fix split and run 3 times
Data: Data(x=[19717, 500], y=[19717], train_mask=[19717], val_mask=[19717], test_mask=[19717], adj_t=[19717, 19717, nnz=88648])
num_train tensor(60)
num_noise 0
noise: tensor(0)
data feature 500
ALTOPT(
  (lins): Sequential(
    (0): Linear(in_features=500, out_features=64, bias=True)
    (1): BatchNorm1d(64, eps=1e-05, momentum=0.1, affine=True, track_running_stats=True)
    (2): Dropout(p=0.8, inplace=True)
    (3): ReLU(inplace=True)
    (4): Linear(in_features=64, out_features=3, bias=True)
    (5): Identity()
  )
  (prop): Propagation(K=9, mode=None, lambda1=None, lambda2=None, L21=True, alpha=0.9)
  (gcn): GCN(
    (convs): ModuleList(
      (0): GCNConv(500, 64)
      (1): GCNConv(64, 3)
    )
    (bns): ModuleList(
      (0): BatchNorm1d(64, eps=1e-05, momentum=0.1, affine=True, track_running_stats=True)
    )
    (output): Identity()
  )
)
propagate done
init label
Split: 01, Run: 01
None time:  1.5323922450188547
None Run 01:
Highest Train: 100.00
Highest Valid: 79.80
  Final Train: 100.00
   Final Test: 75.30
Split: 01, Run: 02
None time:  1.529415569966659
None Run 02:
Highest Train: 100.00
Highest Valid: 81.80
  Final Train: 100.00
   Final Test: 78.10
Split: 01, Run: 03
None time:  2.158951697871089
None Run 03:
Highest Train: 100.00
Highest Valid: 82.00
  Final Train: 100.00
   Final Test: 79.30
run time now: 5.386370420455933
total time:  5.430792629951611
None All runs:
Highest Train: 100.00 ± 0.00
Highest Valid: 81.20 ± 1.22
  Final Train: 100.00 ± 0.00
   Final Test: 77.57 ± 2.05
[I 2023-06-12 00:22:14,129] Trial 111 finished with value: 81.20000457763672 and parameters: {'Fwd': 2.047913488509471e-06, 'K': 9, 'alpha': 0.9, 'dropout': 0.8, 'gnnepoch': 80, 'lambda1': 0.55, 'lambda2': 7.14478480269956, 'loop': 1, 'loss': 'MSE', 'lr': 0.0019584499585705802, 'softmaxF': True, 'useGCN': False, 'weight_decay': 0.002321099213609256, 'weightedloss': False}. Best is trial 107 with value: 82.73332977294922.
/home/wxy/miniconda3/lib/python3.10/site-packages/optuna/distributions.py:685: UserWarning: The distribution is specified by [0, 1.00001] and step=0.05, but the range is not divisible by `step`. It will be replaced by [0, 1.0].
  warnings.warn(
K:  9
alpha:  0.9
lr:  0.0014575290300168511
weight_decay:  0.00398031938396746
dropout:  0.9
fix split and run 3 times
Data: Data(x=[19717, 500], y=[19717], train_mask=[19717], val_mask=[19717], test_mask=[19717], adj_t=[19717, 19717, nnz=88648])
num_train tensor(60)
num_noise 0
noise: tensor(0)
data feature 500
ALTOPT(
  (lins): Sequential(
    (0): Linear(in_features=500, out_features=64, bias=True)
    (1): BatchNorm1d(64, eps=1e-05, momentum=0.1, affine=True, track_running_stats=True)
    (2): Dropout(p=0.9, inplace=True)
    (3): ReLU(inplace=True)
    (4): Linear(in_features=64, out_features=3, bias=True)
    (5): Identity()
  )
  (prop): Propagation(K=9, mode=None, lambda1=None, lambda2=None, L21=True, alpha=0.9)
  (gcn): GCN(
    (convs): ModuleList(
      (0): GCNConv(500, 64)
      (1): GCNConv(64, 3)
    )
    (bns): ModuleList(
      (0): BatchNorm1d(64, eps=1e-05, momentum=0.1, affine=True, track_running_stats=True)
    )
    (output): Identity()
  )
)
propagate done
init label
Split: 01, Run: 01
None time:  2.1612959338817745
None Run 01:
Highest Train: 100.00
Highest Valid: 80.80
  Final Train: 100.00
   Final Test: 76.20
Split: 01, Run: 02
None time:  1.495072907069698
None Run 02:
Highest Train: 100.00
Highest Valid: 80.80
  Final Train: 100.00
   Final Test: 77.30
Split: 01, Run: 03
None time:  1.7115022740326822
None Run 03:
Highest Train: 100.00
Highest Valid: 82.40
  Final Train: 100.00
   Final Test: 79.00
run time now: 5.410233974456787
total time:  5.451283656060696
None All runs:
Highest Train: 100.00 ± 0.00
Highest Valid: 81.33 ± 0.92
  Final Train: 100.00 ± 0.00
   Final Test: 77.50 ± 1.41
[I 2023-06-12 00:22:20,154] Trial 112 finished with value: 81.33333587646484 and parameters: {'Fwd': 1.0314166205004433e-06, 'K': 9, 'alpha': 0.9, 'dropout': 0.9, 'gnnepoch': 70, 'lambda1': 0.5, 'lambda2': 6.734611145664193, 'loop': 1, 'loss': 'MSE', 'lr': 0.0014575290300168511, 'softmaxF': True, 'useGCN': False, 'weight_decay': 0.00398031938396746, 'weightedloss': False}. Best is trial 107 with value: 82.73332977294922.
/home/wxy/miniconda3/lib/python3.10/site-packages/optuna/distributions.py:685: UserWarning: The distribution is specified by [0, 1.00001] and step=0.05, but the range is not divisible by `step`. It will be replaced by [0, 1.0].
  warnings.warn(
K:  10
alpha:  0.9500000000000001
lr:  0.0017408583733394681
weight_decay:  0.0075086578120396215
dropout:  0.7000000000000001
fix split and run 3 times
Data: Data(x=[19717, 500], y=[19717], train_mask=[19717], val_mask=[19717], test_mask=[19717], adj_t=[19717, 19717, nnz=88648])
num_train tensor(60)
num_noise 0
noise: tensor(0)
data feature 500
ALTOPT(
  (lins): Sequential(
    (0): Linear(in_features=500, out_features=64, bias=True)
    (1): BatchNorm1d(64, eps=1e-05, momentum=0.1, affine=True, track_running_stats=True)
    (2): Dropout(p=0.7000000000000001, inplace=True)
    (3): ReLU(inplace=True)
    (4): Linear(in_features=64, out_features=3, bias=True)
    (5): Identity()
  )
  (prop): Propagation(K=10, mode=None, lambda1=None, lambda2=None, L21=True, alpha=0.9500000000000001)
  (gcn): GCN(
    (convs): ModuleList(
      (0): GCNConv(500, 64)
      (1): GCNConv(64, 3)
    )
    (bns): ModuleList(
      (0): BatchNorm1d(64, eps=1e-05, momentum=0.1, affine=True, track_running_stats=True)
    )
    (output): Identity()
  )
)
propagate done
init label
Split: 01, Run: 01
None time:  1.859884198056534
None Run 01:
Highest Train: 100.00
Highest Valid: 81.60
  Final Train: 100.00
   Final Test: 78.00
Split: 01, Run: 02
None time:  1.0988936468493193
None Run 02:
Highest Train: 100.00
Highest Valid: 80.20
  Final Train: 100.00
   Final Test: 78.40
Split: 01, Run: 03
None time:  1.477020493010059
None Run 03:
Highest Train: 100.00
Highest Valid: 81.60
  Final Train: 100.00
   Final Test: 79.70
run time now: 4.491772174835205
total time:  4.546621243003756
None All runs:
Highest Train: 100.00 ± 0.00
Highest Valid: 81.13 ± 0.81
  Final Train: 100.00 ± 0.00
   Final Test: 78.70 ± 0.89
[I 2023-06-12 00:22:25,226] Trial 113 finished with value: 81.13333129882812 and parameters: {'Fwd': 2.6470511049625806e-06, 'K': 10, 'alpha': 0.9500000000000001, 'dropout': 0.7000000000000001, 'gnnepoch': 70, 'lambda1': 0.45, 'lambda2': 7.672485878111074, 'loop': 1, 'loss': 'MSE', 'lr': 0.0017408583733394681, 'softmaxF': True, 'useGCN': False, 'weight_decay': 0.0075086578120396215, 'weightedloss': False}. Best is trial 107 with value: 82.73332977294922.
/home/wxy/miniconda3/lib/python3.10/site-packages/optuna/distributions.py:685: UserWarning: The distribution is specified by [0, 1.00001] and step=0.05, but the range is not divisible by `step`. It will be replaced by [0, 1.0].
  warnings.warn(
K:  9
alpha:  0.9500000000000001
lr:  0.002215874458369915
weight_decay:  0.002190706027377547
dropout:  0.7000000000000001
fix split and run 3 times
Data: Data(x=[19717, 500], y=[19717], train_mask=[19717], val_mask=[19717], test_mask=[19717], adj_t=[19717, 19717, nnz=88648])
num_train tensor(60)
num_noise 0
noise: tensor(0)
data feature 500
ALTOPT(
  (lins): Sequential(
    (0): Linear(in_features=500, out_features=64, bias=True)
    (1): BatchNorm1d(64, eps=1e-05, momentum=0.1, affine=True, track_running_stats=True)
    (2): Dropout(p=0.7000000000000001, inplace=True)
    (3): ReLU(inplace=True)
    (4): Linear(in_features=64, out_features=3, bias=True)
    (5): Identity()
  )
  (prop): Propagation(K=9, mode=None, lambda1=None, lambda2=None, L21=True, alpha=0.9500000000000001)
  (gcn): GCN(
    (convs): ModuleList(
      (0): GCNConv(500, 64)
      (1): GCNConv(64, 3)
    )
    (bns): ModuleList(
      (0): BatchNorm1d(64, eps=1e-05, momentum=0.1, affine=True, track_running_stats=True)
    )
    (output): Identity()
  )
)
propagate done
init label
Split: 01, Run: 01
None time:  1.8657724549993873
None Run 01:
Highest Train: 100.00
Highest Valid: 82.80
  Final Train: 100.00
   Final Test: 79.30
Split: 01, Run: 02
None time:  1.0464383468497545
None Run 02:
Highest Train: 100.00
Highest Valid: 82.60
  Final Train: 100.00
   Final Test: 77.60
Split: 01, Run: 03
None time:  1.2518011629581451
None Run 03:
Highest Train: 100.00
Highest Valid: 82.20
  Final Train: 100.00
   Final Test: 78.80
run time now: 4.218358516693115
total time:  4.259639726020396
None All runs:
Highest Train: 100.00 ± 0.00
Highest Valid: 82.53 ± 0.31
  Final Train: 100.00 ± 0.00
   Final Test: 78.57 ± 0.87
[I 2023-06-12 00:22:30,038] Trial 114 finished with value: 82.53333282470703 and parameters: {'Fwd': 1.3487026317660077e-06, 'K': 9, 'alpha': 0.9500000000000001, 'dropout': 0.7000000000000001, 'gnnepoch': 70, 'lambda1': 0.6000000000000001, 'lambda2': 7.300704600324021, 'loop': 1, 'loss': 'MSE', 'lr': 0.002215874458369915, 'softmaxF': True, 'useGCN': False, 'weight_decay': 0.002190706027377547, 'weightedloss': False}. Best is trial 107 with value: 82.73332977294922.
/home/wxy/miniconda3/lib/python3.10/site-packages/optuna/distributions.py:685: UserWarning: The distribution is specified by [0, 1.00001] and step=0.05, but the range is not divisible by `step`. It will be replaced by [0, 1.0].
  warnings.warn(
K:  9
alpha:  1.0
lr:  0.0023646686810058003
weight_decay:  0.001661994284438431
dropout:  0.7000000000000001
fix split and run 3 times
Data: Data(x=[19717, 500], y=[19717], train_mask=[19717], val_mask=[19717], test_mask=[19717], adj_t=[19717, 19717, nnz=88648])
num_train tensor(60)
num_noise 0
noise: tensor(0)
data feature 500
ALTOPT(
  (lins): Sequential(
    (0): Linear(in_features=500, out_features=64, bias=True)
    (1): BatchNorm1d(64, eps=1e-05, momentum=0.1, affine=True, track_running_stats=True)
    (2): Dropout(p=0.7000000000000001, inplace=True)
    (3): ReLU(inplace=True)
    (4): Linear(in_features=64, out_features=3, bias=True)
    (5): Identity()
  )
  (prop): Propagation(K=9, mode=None, lambda1=None, lambda2=None, L21=True, alpha=1.0)
  (gcn): GCN(
    (convs): ModuleList(
      (0): GCNConv(500, 64)
      (1): GCNConv(64, 3)
    )
    (bns): ModuleList(
      (0): BatchNorm1d(64, eps=1e-05, momentum=0.1, affine=True, track_running_stats=True)
    )
    (output): Identity()
  )
)
propagate done
init label
Split: 01, Run: 01
None time:  1.1639340471010655
None Run 01:
Highest Train: 100.00
Highest Valid: 81.20
  Final Train: 100.00
   Final Test: 78.40
Split: 01, Run: 02
None time:  1.0657428379636258
None Run 02:
Highest Train: 100.00
Highest Valid: 81.80
  Final Train: 100.00
   Final Test: 78.20
Split: 01, Run: 03
None time:  0.9416031138971448
None Run 03:
Highest Train: 100.00
Highest Valid: 76.80
  Final Train: 100.00
   Final Test: 76.30
run time now: 3.219790458679199
total time:  3.2733952628914267
None All runs:
Highest Train: 100.00 ± 0.00
Highest Valid: 79.93 ± 2.73
  Final Train: 100.00 ± 0.00
   Final Test: 77.63 ± 1.16
[I 2023-06-12 00:22:33,840] Trial 115 finished with value: 79.93333435058594 and parameters: {'Fwd': 1.3173100864906799e-06, 'K': 9, 'alpha': 1.0, 'dropout': 0.7000000000000001, 'gnnepoch': 60, 'lambda1': 0.6000000000000001, 'lambda2': 7.264364264122033, 'loop': 1, 'loss': 'MSE', 'lr': 0.0023646686810058003, 'softmaxF': True, 'useGCN': False, 'weight_decay': 0.001661994284438431, 'weightedloss': False}. Best is trial 107 with value: 82.73332977294922.
/home/wxy/miniconda3/lib/python3.10/site-packages/optuna/distributions.py:685: UserWarning: The distribution is specified by [0, 1.00001] and step=0.05, but the range is not divisible by `step`. It will be replaced by [0, 1.0].
  warnings.warn(
K:  10
alpha:  0.9500000000000001
lr:  0.0020667608816246
weight_decay:  0.0022216705238668026
dropout:  0.7000000000000001
fix split and run 3 times
Data: Data(x=[19717, 500], y=[19717], train_mask=[19717], val_mask=[19717], test_mask=[19717], adj_t=[19717, 19717, nnz=88648])
num_train tensor(60)
num_noise 0
noise: tensor(0)
data feature 500
ALTOPT(
  (lins): Sequential(
    (0): Linear(in_features=500, out_features=64, bias=True)
    (1): BatchNorm1d(64, eps=1e-05, momentum=0.1, affine=True, track_running_stats=True)
    (2): Dropout(p=0.7000000000000001, inplace=True)
    (3): ReLU(inplace=True)
    (4): Linear(in_features=64, out_features=3, bias=True)
    (5): Identity()
  )
  (prop): Propagation(K=10, mode=None, lambda1=None, lambda2=None, L21=True, alpha=0.9500000000000001)
  (gcn): GCN(
    (convs): ModuleList(
      (0): GCNConv(500, 64)
      (1): GCNConv(64, 3)
    )
    (bns): ModuleList(
      (0): BatchNorm1d(64, eps=1e-05, momentum=0.1, affine=True, track_running_stats=True)
    )
    (output): Identity()
  )
)
propagate done
init label
Split: 01, Run: 01
None time:  1.7702328788582236
None Run 01:
Highest Train: 100.00
Highest Valid: 82.40
  Final Train: 100.00
   Final Test: 78.50
Split: 01, Run: 02
None time:  0.6721559348516166
None Run 02:
Highest Train: 100.00
Highest Valid: 82.80
  Final Train: 100.00
   Final Test: 79.00
Split: 01, Run: 03
None time:  1.2676731401588768
None Run 03:
Highest Train: 100.00
Highest Valid: 82.40
  Final Train: 100.00
   Final Test: 79.10
run time now: 3.762498140335083
total time:  3.812704280950129
None All runs:
Highest Train: 100.00 ± 0.00
Highest Valid: 82.53 ± 0.23
  Final Train: 100.00 ± 0.00
   Final Test: 78.87 ± 0.32
