[I 2023-06-11 23:55:07,617] Trial 539 finished with value: 71.46666717529297 and parameters: {'Fwd': 0.0001399569630740129, 'K': 8, 'alpha': 0.8, 'dropout': 0.7000000000000001, 'gnnepoch': 30, 'lambda1': 0.8, 'lambda2': 1.2152879209934153, 'loop': 0, 'loss': 'CE', 'lr': 0.0094307528146877, 'softmaxF': False, 'useGCN': True, 'weight_decay': 0.00191052865684567, 'weightedloss': True}. Best is trial 271 with value: 72.06666564941406.
/home/wxy/miniconda3/lib/python3.10/site-packages/optuna/distributions.py:685: UserWarning: The distribution is specified by [0, 1.00001] and step=0.05, but the range is not divisible by `step`. It will be replaced by [0, 1.0].
  warnings.warn(
K:  8
alpha:  0.8500000000000001
lr:  0.0016409888640055118
weight_decay:  7.471750557632142e-05
dropout:  0.8
fix split and run 3 times
Data: Data(x=[3327, 3703], y=[3327], train_mask=[3327], val_mask=[3327], test_mask=[3327], adj_t=[3327, 3327, nnz=9104])
num_train tensor(120)
num_noise 0
noise: tensor(0)
data feature 3703
ALTOPT(
  (lins): Sequential(
    (0): Linear(in_features=3703, out_features=64, bias=True)
    (1): BatchNorm1d(64, eps=1e-05, momentum=0.1, affine=True, track_running_stats=True)
    (2): Dropout(p=0.8, inplace=True)
    (3): ReLU(inplace=True)
    (4): Linear(in_features=64, out_features=6, bias=True)
    (5): LogSoftmax(dim=-1)
  )
  (prop): Propagation(K=8, mode=None, lambda1=None, lambda2=None, L21=True, alpha=0.8500000000000001)
  (gcn): GCN(
    (convs): ModuleList(
      (0): GCNConv(3703, 64)
      (1): GCNConv(64, 6)
    )
    (bns): ModuleList(
      (0): BatchNorm1d(64, eps=1e-05, momentum=0.1, affine=True, track_running_stats=True)
    )
    (output): LogSoftmax(dim=-1)
  )
)
propagate done
init label
Split: 01, Run: 01
None time:  0.27487151604145765
None Run 01:
Highest Train: 100.00
Highest Valid: 66.40
  Final Train: 100.00
   Final Test: 64.20
Split: 01, Run: 02
None time:  0.25082239089533687
None Run 02:
Highest Train: 100.00
Highest Valid: 66.80
  Final Train: 100.00
   Final Test: 66.50
Split: 01, Run: 03
None time:  0.2818363809492439
None Run 03:
Highest Train: 100.00
Highest Valid: 66.40
  Final Train: 100.00
   Final Test: 66.30
run time now: 0.8493959903717041
total time:  0.9092592489905655
None All runs:
Highest Train: 100.00 ± 0.00
Highest Valid: 66.53 ± 0.23
  Final Train: 100.00 ± 0.00
   Final Test: 65.67 ± 1.27
[I 2023-06-11 23:55:09,042] Trial 540 finished with value: 66.5333251953125 and parameters: {'Fwd': 0.0019180597397613014, 'K': 8, 'alpha': 0.8500000000000001, 'dropout': 0.8, 'gnnepoch': 10, 'lambda1': 0.7000000000000001, 'lambda2': 5.984202889735417, 'loop': 0, 'loss': 'CE', 'lr': 0.0016409888640055118, 'softmaxF': False, 'useGCN': True, 'weight_decay': 7.471750557632142e-05, 'weightedloss': True}. Best is trial 271 with value: 72.06666564941406.
/home/wxy/miniconda3/lib/python3.10/site-packages/optuna/distributions.py:685: UserWarning: The distribution is specified by [0, 1.00001] and step=0.05, but the range is not divisible by `step`. It will be replaced by [0, 1.0].
  warnings.warn(
K:  8
alpha:  0.9500000000000001
lr:  0.0012127291109614378
weight_decay:  0.0031284538506692106
dropout:  0.8
fix split and run 3 times
Data: Data(x=[3327, 3703], y=[3327], train_mask=[3327], val_mask=[3327], test_mask=[3327], adj_t=[3327, 3327, nnz=9104])
num_train tensor(120)
num_noise 0
noise: tensor(0)
data feature 3703
ALTOPT(
  (lins): Sequential(
    (0): Linear(in_features=3703, out_features=64, bias=True)
    (1): BatchNorm1d(64, eps=1e-05, momentum=0.1, affine=True, track_running_stats=True)
    (2): Dropout(p=0.8, inplace=True)
    (3): ReLU(inplace=True)
    (4): Linear(in_features=64, out_features=6, bias=True)
    (5): LogSoftmax(dim=-1)
  )
  (prop): Propagation(K=8, mode=None, lambda1=None, lambda2=None, L21=True, alpha=0.9500000000000001)
  (gcn): GCN(
    (convs): ModuleList(
      (0): GCNConv(3703, 64)
      (1): GCNConv(64, 6)
    )
    (bns): ModuleList(
      (0): BatchNorm1d(64, eps=1e-05, momentum=0.1, affine=True, track_running_stats=True)
    )
    (output): LogSoftmax(dim=-1)
  )
)
propagate done
init label
Split: 01, Run: 01
None time:  1.0314202799927443
None Run 01:
Highest Train: 100.00
Highest Valid: 71.40
  Final Train: 100.00
   Final Test: 69.60
Split: 01, Run: 02
None time:  1.0473265601322055
None Run 02:
Highest Train: 100.00
Highest Valid: 72.40
  Final Train: 100.00
   Final Test: 69.80
Split: 01, Run: 03
None time:  1.0734722211491317
None Run 03:
Highest Train: 100.00
Highest Valid: 71.80
  Final Train: 100.00
   Final Test: 70.70
run time now: 3.1939797401428223
total time:  3.262190959881991
None All runs:
Highest Train: 100.00 ± 0.00
Highest Valid: 71.87 ± 0.50
  Final Train: 100.00 ± 0.00
   Final Test: 70.03 ± 0.59
[I 2023-06-11 23:55:12,840] Trial 541 finished with value: 71.86666107177734 and parameters: {'Fwd': 0.0008445115791245253, 'K': 8, 'alpha': 0.9500000000000001, 'dropout': 0.8, 'gnnepoch': 120, 'lambda1': 0.65, 'lambda2': 9.762114545179436, 'loop': 0, 'loss': 'CE', 'lr': 0.0012127291109614378, 'softmaxF': False, 'useGCN': True, 'weight_decay': 0.0031284538506692106, 'weightedloss': True}. Best is trial 271 with value: 72.06666564941406.
/home/wxy/miniconda3/lib/python3.10/site-packages/optuna/distributions.py:685: UserWarning: The distribution is specified by [0, 1.00001] and step=0.05, but the range is not divisible by `step`. It will be replaced by [0, 1.0].
  warnings.warn(
K:  8
alpha:  0.6000000000000001
lr:  0.0014797449474271943
weight_decay:  0.0012418232662127578
dropout:  0.8
fix split and run 3 times
Data: Data(x=[3327, 3703], y=[3327], train_mask=[3327], val_mask=[3327], test_mask=[3327], adj_t=[3327, 3327, nnz=9104])
num_train tensor(120)
num_noise 0
noise: tensor(0)
data feature 3703
ALTOPT(
  (lins): Sequential(
    (0): Linear(in_features=3703, out_features=64, bias=True)
    (1): BatchNorm1d(64, eps=1e-05, momentum=0.1, affine=True, track_running_stats=True)
    (2): Dropout(p=0.8, inplace=True)
    (3): ReLU(inplace=True)
    (4): Linear(in_features=64, out_features=6, bias=True)
    (5): LogSoftmax(dim=-1)
  )
  (prop): Propagation(K=8, mode=None, lambda1=None, lambda2=None, L21=True, alpha=0.6000000000000001)
  (gcn): GCN(
    (convs): ModuleList(
      (0): GCNConv(3703, 64)
      (1): GCNConv(64, 6)
    )
    (bns): ModuleList(
      (0): BatchNorm1d(64, eps=1e-05, momentum=0.1, affine=True, track_running_stats=True)
    )
    (output): LogSoftmax(dim=-1)
  )
)
propagate done
init label
Split: 01, Run: 01
None time:  1.0992612100671977
None Run 01:
Highest Train: 100.00
Highest Valid: 71.20
  Final Train: 100.00
   Final Test: 69.60
Split: 01, Run: 02
None time:  1.1007081270217896
None Run 02:
Highest Train: 100.00
Highest Valid: 72.00
  Final Train: 100.00
   Final Test: 70.00
Split: 01, Run: 03
None time:  1.0421742380131036
None Run 03:
Highest Train: 100.00
Highest Valid: 71.40
  Final Train: 100.00
   Final Test: 70.70
run time now: 3.283066511154175
total time:  3.3389596161432564
None All runs:
Highest Train: 100.00 ± 0.00
Highest Valid: 71.53 ± 0.42
  Final Train: 100.00 ± 0.00
   Final Test: 70.10 ± 0.56
[I 2023-06-11 23:55:16,653] Trial 542 finished with value: 71.53333282470703 and parameters: {'Fwd': 7.807058525307413e-06, 'K': 8, 'alpha': 0.6000000000000001, 'dropout': 0.8, 'gnnepoch': 120, 'lambda1': 0.75, 'lambda2': 6.613047709865089, 'loop': 0, 'loss': 'CE', 'lr': 0.0014797449474271943, 'softmaxF': True, 'useGCN': True, 'weight_decay': 0.0012418232662127578, 'weightedloss': True}. Best is trial 271 with value: 72.06666564941406.
/home/wxy/miniconda3/lib/python3.10/site-packages/optuna/distributions.py:685: UserWarning: The distribution is specified by [0, 1.00001] and step=0.05, but the range is not divisible by `step`. It will be replaced by [0, 1.0].
  warnings.warn(
K:  8
alpha:  0.75
lr:  0.001328664887432638
weight_decay:  0.0002995090116300181
dropout:  0.8
fix split and run 3 times
Data: Data(x=[3327, 3703], y=[3327], train_mask=[3327], val_mask=[3327], test_mask=[3327], adj_t=[3327, 3327, nnz=9104])
num_train tensor(120)
num_noise 0
noise: tensor(0)
data feature 3703
ALTOPT(
  (lins): Sequential(
    (0): Linear(in_features=3703, out_features=64, bias=True)
    (1): BatchNorm1d(64, eps=1e-05, momentum=0.1, affine=True, track_running_stats=True)
    (2): Dropout(p=0.8, inplace=True)
    (3): ReLU(inplace=True)
    (4): Linear(in_features=64, out_features=6, bias=True)
    (5): LogSoftmax(dim=-1)
  )
  (prop): Propagation(K=8, mode=None, lambda1=None, lambda2=None, L21=True, alpha=0.75)
  (gcn): GCN(
    (convs): ModuleList(
      (0): GCNConv(3703, 64)
      (1): GCNConv(64, 6)
    )
    (bns): ModuleList(
      (0): BatchNorm1d(64, eps=1e-05, momentum=0.1, affine=True, track_running_stats=True)
    )
    (output): LogSoftmax(dim=-1)
  )
)
propagate done
init label
Split: 01, Run: 01
None time:  0.6250566870439798
None Run 01:
Highest Train: 100.00
Highest Valid: 70.20
  Final Train: 100.00
   Final Test: 69.10
Split: 01, Run: 02
None time:  0.6285624839365482
None Run 02:
Highest Train: 100.00
Highest Valid: 70.20
  Final Train: 100.00
   Final Test: 70.10
Split: 01, Run: 03
None time:  0.7065252240281552
None Run 03:
Highest Train: 100.00
Highest Valid: 70.80
  Final Train: 100.00
   Final Test: 69.30
run time now: 2.000715732574463
total time:  2.0546999021898955
None All runs:
Highest Train: 100.00 ± 0.00
Highest Valid: 70.40 ± 0.35
  Final Train: 100.00 ± 0.00
   Final Test: 69.50 ± 0.53
[I 2023-06-11 23:55:19,198] Trial 543 finished with value: 70.4000015258789 and parameters: {'Fwd': 0.0012714221030485982, 'K': 8, 'alpha': 0.75, 'dropout': 0.8, 'gnnepoch': 70, 'lambda1': 0.65, 'lambda2': 6.862325474167918, 'loop': 0, 'loss': 'CE', 'lr': 0.001328664887432638, 'softmaxF': False, 'useGCN': True, 'weight_decay': 0.0002995090116300181, 'weightedloss': True}. Best is trial 271 with value: 72.06666564941406.
/home/wxy/miniconda3/lib/python3.10/site-packages/optuna/distributions.py:685: UserWarning: The distribution is specified by [0, 1.00001] and step=0.05, but the range is not divisible by `step`. It will be replaced by [0, 1.0].
  warnings.warn(
K:  9
alpha:  0.9
lr:  0.0011474817893542693
weight_decay:  0.00021174629369600465
dropout:  0.2
fix split and run 3 times
Data: Data(x=[3327, 3703], y=[3327], train_mask=[3327], val_mask=[3327], test_mask=[3327], adj_t=[3327, 3327, nnz=9104])
num_train tensor(120)
num_noise 0
noise: tensor(0)
data feature 3703
ALTOPT(
  (lins): Sequential(
    (0): Linear(in_features=3703, out_features=64, bias=True)
    (1): BatchNorm1d(64, eps=1e-05, momentum=0.1, affine=True, track_running_stats=True)
    (2): Dropout(p=0.2, inplace=True)
    (3): ReLU(inplace=True)
    (4): Linear(in_features=64, out_features=6, bias=True)
    (5): LogSoftmax(dim=-1)
  )
  (prop): Propagation(K=9, mode=None, lambda1=None, lambda2=None, L21=True, alpha=0.9)
  (gcn): GCN(
    (convs): ModuleList(
      (0): GCNConv(3703, 64)
      (1): GCNConv(64, 6)
    )
    (bns): ModuleList(
      (0): BatchNorm1d(64, eps=1e-05, momentum=0.1, affine=True, track_running_stats=True)
    )
    (output): LogSoftmax(dim=-1)
  )
)
propagate done
init label
Split: 01, Run: 01
None time:  0.9801656780764461
None Run 01:
Highest Train: 100.00
Highest Valid: 71.40
  Final Train: 100.00
   Final Test: 69.60
Split: 01, Run: 02
None time:  1.0027589749079198
None Run 02:
Highest Train: 100.00
Highest Valid: 70.80
  Final Train: 100.00
   Final Test: 69.70
Split: 01, Run: 03
None time:  1.0746589240152389
None Run 03:
Highest Train: 100.00
Highest Valid: 71.40
  Final Train: 100.00
   Final Test: 70.30
run time now: 3.100311517715454
total time:  3.1569227369036525
None All runs:
Highest Train: 100.00 ± 0.00
Highest Valid: 71.20 ± 0.35
  Final Train: 100.00 ± 0.00
   Final Test: 69.87 ± 0.38
[I 2023-06-11 23:55:22,857] Trial 544 finished with value: 71.20000457763672 and parameters: {'Fwd': 2.2610801270553375e-05, 'K': 9, 'alpha': 0.9, 'dropout': 0.2, 'gnnepoch': 120, 'lambda1': 0.7000000000000001, 'lambda2': 9.013998248550596, 'loop': 0, 'loss': 'CE', 'lr': 0.0011474817893542693, 'softmaxF': False, 'useGCN': True, 'weight_decay': 0.00021174629369600465, 'weightedloss': True}. Best is trial 271 with value: 72.06666564941406.
/home/wxy/miniconda3/lib/python3.10/site-packages/optuna/distributions.py:685: UserWarning: The distribution is specified by [0, 1.00001] and step=0.05, but the range is not divisible by `step`. It will be replaced by [0, 1.0].
  warnings.warn(
K:  10
alpha:  0.8500000000000001
lr:  0.0019101927959954085
weight_decay:  0.00011302853108354853
dropout:  0.8
fix split and run 3 times
Data: Data(x=[3327, 3703], y=[3327], train_mask=[3327], val_mask=[3327], test_mask=[3327], adj_t=[3327, 3327, nnz=9104])
num_train tensor(120)
num_noise 0
noise: tensor(0)
data feature 3703
ALTOPT(
  (lins): Sequential(
    (0): Linear(in_features=3703, out_features=64, bias=True)
    (1): BatchNorm1d(64, eps=1e-05, momentum=0.1, affine=True, track_running_stats=True)
    (2): Dropout(p=0.8, inplace=True)
    (3): ReLU(inplace=True)
    (4): Linear(in_features=64, out_features=6, bias=True)
    (5): Identity()
  )
  (prop): Propagation(K=10, mode=None, lambda1=None, lambda2=None, L21=True, alpha=0.8500000000000001)
  (gcn): GCN(
    (convs): ModuleList(
      (0): GCNConv(3703, 64)
      (1): GCNConv(64, 6)
    )
    (bns): ModuleList(
      (0): BatchNorm1d(64, eps=1e-05, momentum=0.1, affine=True, track_running_stats=True)
    )
    (output): Identity()
  )
)
propagate done
init label
Split: 01, Run: 01, Epoch: 100, Loss: 0.0000, Train: 100.00%, Valid: 69.20% Test: 69.90%
Split: 01, Run: 01
None time:  1.8562787158880383
None Run 01:
Highest Train: 100.00
Highest Valid: 69.20
  Final Train: 100.00
   Final Test: 69.90
Split: 01, Run: 02, Epoch: 100, Loss: 0.0000, Train: 100.00%, Valid: 69.00% Test: 69.60%
Split: 01, Run: 02
None time:  1.8277560230344534
None Run 02:
Highest Train: 100.00
Highest Valid: 69.00
  Final Train: 100.00
   Final Test: 69.60
Split: 01, Run: 03, Epoch: 100, Loss: 0.0000, Train: 100.00%, Valid: 67.80% Test: 70.20%
Split: 01, Run: 03
None time:  1.867312747053802
None Run 03:
Highest Train: 100.00
Highest Valid: 67.80
  Final Train: 100.00
   Final Test: 70.20
run time now: 5.596195936203003
total time:  5.6512190769426525
None All runs:
Highest Train: 100.00 ± 0.00
Highest Valid: 68.67 ± 0.76
  Final Train: 100.00 ± 0.00
   Final Test: 69.90 ± 0.30
[I 2023-06-11 23:55:29,035] Trial 545 finished with value: 68.66666412353516 and parameters: {'Fwd': 0.0007126542852131313, 'K': 10, 'alpha': 0.8500000000000001, 'dropout': 0.8, 'gnnepoch': 110, 'lambda1': 0.8, 'lambda2': 8.325805208293454, 'loop': 0, 'loss': 'MSE', 'lr': 0.0019101927959954085, 'softmaxF': False, 'useGCN': True, 'weight_decay': 0.00011302853108354853, 'weightedloss': True}. Best is trial 271 with value: 72.06666564941406.
/home/wxy/miniconda3/lib/python3.10/site-packages/optuna/distributions.py:685: UserWarning: The distribution is specified by [0, 1.00001] and step=0.05, but the range is not divisible by `step`. It will be replaced by [0, 1.0].
  warnings.warn(
K:  8
alpha:  0.8
lr:  0.0005775292517072832
weight_decay:  0.0008097077067505461
dropout:  0.8
fix split and run 3 times
Data: Data(x=[3327, 3703], y=[3327], train_mask=[3327], val_mask=[3327], test_mask=[3327], adj_t=[3327, 3327, nnz=9104])
num_train tensor(120)
num_noise 0
noise: tensor(0)
data feature 3703
ALTOPT(
  (lins): Sequential(
    (0): Linear(in_features=3703, out_features=64, bias=True)
    (1): BatchNorm1d(64, eps=1e-05, momentum=0.1, affine=True, track_running_stats=True)
    (2): Dropout(p=0.8, inplace=True)
    (3): ReLU(inplace=True)
    (4): Linear(in_features=64, out_features=6, bias=True)
    (5): LogSoftmax(dim=-1)
  )
  (prop): Propagation(K=8, mode=None, lambda1=None, lambda2=None, L21=True, alpha=0.8)
  (gcn): GCN(
    (convs): ModuleList(
      (0): GCNConv(3703, 64)
      (1): GCNConv(64, 6)
    )
    (bns): ModuleList(
      (0): BatchNorm1d(64, eps=1e-05, momentum=0.1, affine=True, track_running_stats=True)
    )
    (output): LogSoftmax(dim=-1)
  )
)
propagate done
init label
Split: 01, Run: 01
None time:  1.0297113959677517
None Run 01:
Highest Train: 100.00
Highest Valid: 70.20
  Final Train: 100.00
   Final Test: 69.80
Split: 01, Run: 02
None time:  1.1335114520043135
None Run 02:
Highest Train: 100.00
Highest Valid: 70.80
  Final Train: 100.00
   Final Test: 70.40
Split: 01, Run: 03
None time:  1.2561300739180297
None Run 03:
Highest Train: 100.00
Highest Valid: 70.40
  Final Train: 100.00
   Final Test: 70.00
run time now: 3.460548162460327
total time:  3.506078553153202
None All runs:
Highest Train: 100.00 ± 0.00
Highest Valid: 70.47 ± 0.31
  Final Train: 100.00 ± 0.00
   Final Test: 70.07 ± 0.31
[I 2023-06-11 23:55:33,047] Trial 546 finished with value: 70.46666717529297 and parameters: {'Fwd': 0.0009834747660406036, 'K': 8, 'alpha': 0.8, 'dropout': 0.8, 'gnnepoch': 120, 'lambda1': 0.6000000000000001, 'lambda2': 9.509621730237345, 'loop': 0, 'loss': 'CE', 'lr': 0.0005775292517072832, 'softmaxF': False, 'useGCN': True, 'weight_decay': 0.0008097077067505461, 'weightedloss': True}. Best is trial 271 with value: 72.06666564941406.
/home/wxy/miniconda3/lib/python3.10/site-packages/optuna/distributions.py:685: UserWarning: The distribution is specified by [0, 1.00001] and step=0.05, but the range is not divisible by `step`. It will be replaced by [0, 1.0].
  warnings.warn(
K:  8
alpha:  0.9
lr:  0.0009421397236400476
weight_decay:  5.354841495700304e-05
dropout:  0.8
fix split and run 3 times
Data: Data(x=[3327, 3703], y=[3327], train_mask=[3327], val_mask=[3327], test_mask=[3327], adj_t=[3327, 3327, nnz=9104])
num_train tensor(120)
num_noise 0
noise: tensor(0)
data feature 3703
ALTOPT(
  (lins): Sequential(
    (0): Linear(in_features=3703, out_features=64, bias=True)
    (1): BatchNorm1d(64, eps=1e-05, momentum=0.1, affine=True, track_running_stats=True)
    (2): Dropout(p=0.8, inplace=True)
    (3): ReLU(inplace=True)
    (4): Linear(in_features=64, out_features=6, bias=True)
    (5): LogSoftmax(dim=-1)
  )
  (prop): Propagation(K=8, mode=None, lambda1=None, lambda2=None, L21=True, alpha=0.9)
  (gcn): GCN(
    (convs): ModuleList(
      (0): GCNConv(3703, 64)
      (1): GCNConv(64, 6)
    )
    (bns): ModuleList(
      (0): BatchNorm1d(64, eps=1e-05, momentum=0.1, affine=True, track_running_stats=True)
    )
    (output): LogSoftmax(dim=-1)
  )
)
propagate done
init label
Split: 01, Run: 01
None time:  0.9841035162098706
None Run 01:
Highest Train: 100.00
Highest Valid: 70.40
  Final Train: 100.00
   Final Test: 69.40
Split: 01, Run: 02
None time:  1.1096167899668217
None Run 02:
Highest Train: 100.00
Highest Valid: 72.20
  Final Train: 100.00
   Final Test: 69.70
Split: 01, Run: 03
None time:  1.0602305240463465
None Run 03:
Highest Train: 100.00
Highest Valid: 71.20
  Final Train: 100.00
   Final Test: 70.30
run time now: 3.1950020790100098
total time:  3.2543148938566446
None All runs:
Highest Train: 100.00 ± 0.00
Highest Valid: 71.27 ± 0.90
  Final Train: 100.00 ± 0.00
   Final Test: 69.80 ± 0.46
[I 2023-06-11 23:55:36,758] Trial 547 finished with value: 71.26667022705078 and parameters: {'Fwd': 2.4995457271654487e-06, 'K': 8, 'alpha': 0.9, 'dropout': 0.8, 'gnnepoch': 120, 'lambda1': 0.75, 'lambda2': 7.362872566996483, 'loop': 0, 'loss': 'CE', 'lr': 0.0009421397236400476, 'softmaxF': False, 'useGCN': True, 'weight_decay': 5.354841495700304e-05, 'weightedloss': True}. Best is trial 271 with value: 72.06666564941406.
/home/wxy/miniconda3/lib/python3.10/site-packages/optuna/distributions.py:685: UserWarning: The distribution is specified by [0, 1.00001] and step=0.05, but the range is not divisible by `step`. It will be replaced by [0, 1.0].
  warnings.warn(
K:  8
alpha:  0.75
lr:  0.001710309605417095
weight_decay:  0.0005982083666737368
dropout:  0.8
fix split and run 3 times
Data: Data(x=[3327, 3703], y=[3327], train_mask=[3327], val_mask=[3327], test_mask=[3327], adj_t=[3327, 3327, nnz=9104])
num_train tensor(120)
num_noise 0
noise: tensor(0)
data feature 3703
ALTOPT(
  (lins): Sequential(
    (0): Linear(in_features=3703, out_features=64, bias=True)
    (1): BatchNorm1d(64, eps=1e-05, momentum=0.1, affine=True, track_running_stats=True)
    (2): Dropout(p=0.8, inplace=True)
    (3): ReLU(inplace=True)
    (4): Linear(in_features=64, out_features=6, bias=True)
    (5): LogSoftmax(dim=-1)
  )
  (prop): Propagation(K=8, mode=None, lambda1=None, lambda2=None, L21=True, alpha=0.75)
  (gcn): GCN(
    (convs): ModuleList(
      (0): GCNConv(3703, 64)
      (1): GCNConv(64, 6)
    )
    (bns): ModuleList(
      (0): BatchNorm1d(64, eps=1e-05, momentum=0.1, affine=True, track_running_stats=True)
    )
    (output): LogSoftmax(dim=-1)
  )
)
propagate done
init label
Split: 01, Run: 01
None time:  1.037622984033078
None Run 01:
Highest Train: 100.00
Highest Valid: 71.40
  Final Train: 100.00
   Final Test: 69.50
Split: 01, Run: 02
None time:  1.0930521821137518
None Run 02:
Highest Train: 100.00
Highest Valid: 71.80
  Final Train: 100.00
   Final Test: 70.30
Split: 01, Run: 03
None time:  1.0933463498950005
None Run 03:
Highest Train: 100.00
Highest Valid: 71.80
  Final Train: 100.00
   Final Test: 70.00
run time now: 3.264216184616089
total time:  3.309455149108544
None All runs:
Highest Train: 100.00 ± 0.00
Highest Valid: 71.67 ± 0.23
  Final Train: 100.00 ± 0.00
   Final Test: 69.93 ± 0.40
