[I 2023-06-12 00:30:32,919] Trial 197 finished with value: 83.26667022705078 and parameters: {'Fwd': 5.850132322043862e-06, 'K': 10, 'alpha': 1.0, 'dropout': 0.9, 'gnnepoch': 70, 'lambda1': 0.65, 'lambda2': 7.5155660338582075, 'loop': 1, 'loss': 'MSE', 'lr': 0.0021694454247795847, 'softmaxF': True, 'useGCN': False, 'weight_decay': 0.0032041970506086898, 'weightedloss': False}. Best is trial 197 with value: 83.26667022705078.
/home/wxy/miniconda3/lib/python3.10/site-packages/optuna/distributions.py:685: UserWarning: The distribution is specified by [0, 1.00001] and step=0.05, but the range is not divisible by `step`. It will be replaced by [0, 1.0].
  warnings.warn(
K:  10
alpha:  1.0
lr:  0.002203175645470059
weight_decay:  0.0032688712905422
dropout:  0.9
fix split and run 3 times
Data: Data(x=[19717, 500], y=[19717], train_mask=[19717], val_mask=[19717], test_mask=[19717], adj_t=[19717, 19717, nnz=88648])
num_train tensor(60)
num_noise 0
noise: tensor(0)
data feature 500
ALTOPT(
  (lins): Sequential(
    (0): Linear(in_features=500, out_features=64, bias=True)
    (1): BatchNorm1d(64, eps=1e-05, momentum=0.1, affine=True, track_running_stats=True)
    (2): Dropout(p=0.9, inplace=True)
    (3): ReLU(inplace=True)
    (4): Linear(in_features=64, out_features=3, bias=True)
    (5): Identity()
  )
  (prop): Propagation(K=10, mode=None, lambda1=None, lambda2=None, L21=True, alpha=1.0)
  (gcn): GCN(
    (convs): ModuleList(
      (0): GCNConv(500, 64)
      (1): GCNConv(64, 3)
    )
    (bns): ModuleList(
      (0): BatchNorm1d(64, eps=1e-05, momentum=0.1, affine=True, track_running_stats=True)
    )
    (output): Identity()
  )
)
propagate done
init label
Split: 01, Run: 01, Epoch: 100, Loss: 0.3461, Train: 100.00%, Valid: 83.40% Test: 78.70%
Split: 01, Run: 01
None time:  3.3575759150553495
None Run 01:
Highest Train: 100.00
Highest Valid: 83.40
  Final Train: 100.00
   Final Test: 78.70
Split: 01, Run: 02
None time:  1.1322024220135063
None Run 02:
Highest Train: 100.00
Highest Valid: 83.80
  Final Train: 100.00
   Final Test: 79.60
Split: 01, Run: 03
None time:  2.013313211966306
None Run 03:
Highest Train: 100.00
Highest Valid: 79.40
  Final Train: 100.00
   Final Test: 78.50
run time now: 6.556499481201172
total time:  6.609147696988657
None All runs:
Highest Train: 100.00 ± 0.00
Highest Valid: 82.20 ± 2.43
  Final Train: 100.00 ± 0.00
   Final Test: 78.93 ± 0.59
[I 2023-06-12 00:30:40,014] Trial 198 finished with value: 82.20000457763672 and parameters: {'Fwd': 6.964278440801518e-06, 'K': 10, 'alpha': 1.0, 'dropout': 0.9, 'gnnepoch': 60, 'lambda1': 0.65, 'lambda2': 7.578730407826647, 'loop': 1, 'loss': 'MSE', 'lr': 0.002203175645470059, 'softmaxF': True, 'useGCN': False, 'weight_decay': 0.0032688712905422, 'weightedloss': False}. Best is trial 197 with value: 83.26667022705078.
/home/wxy/miniconda3/lib/python3.10/site-packages/optuna/distributions.py:685: UserWarning: The distribution is specified by [0, 1.00001] and step=0.05, but the range is not divisible by `step`. It will be replaced by [0, 1.0].
  warnings.warn(
K:  10
alpha:  1.0
lr:  0.0020286883927630723
weight_decay:  0.0021869487241464518
dropout:  0.9
fix split and run 3 times
Data: Data(x=[19717, 500], y=[19717], train_mask=[19717], val_mask=[19717], test_mask=[19717], adj_t=[19717, 19717, nnz=88648])
num_train tensor(60)
num_noise 0
noise: tensor(0)
data feature 500
ALTOPT(
  (lins): Sequential(
    (0): Linear(in_features=500, out_features=64, bias=True)
    (1): BatchNorm1d(64, eps=1e-05, momentum=0.1, affine=True, track_running_stats=True)
    (2): Dropout(p=0.9, inplace=True)
    (3): ReLU(inplace=True)
    (4): Linear(in_features=64, out_features=3, bias=True)
    (5): LogSoftmax(dim=-1)
  )
  (prop): Propagation(K=10, mode=None, lambda1=None, lambda2=None, L21=True, alpha=1.0)
  (gcn): GCN(
    (convs): ModuleList(
      (0): GCNConv(500, 64)
      (1): GCNConv(64, 3)
    )
    (bns): ModuleList(
      (0): BatchNorm1d(64, eps=1e-05, momentum=0.1, affine=True, track_running_stats=True)
    )
    (output): LogSoftmax(dim=-1)
  )
)
propagate done
init label
Split: 01, Run: 01
None time:  1.138767815893516
None Run 01:
Highest Train: 100.00
Highest Valid: 76.80
  Final Train: 100.00
   Final Test: 74.30
Split: 01, Run: 02
None time:  0.9290526730474085
None Run 02:
Highest Train: 100.00
Highest Valid: 79.20
  Final Train: 100.00
   Final Test: 78.20
Split: 01, Run: 03
None time:  1.064151535043493
None Run 03:
Highest Train: 100.00
Highest Valid: 78.40
  Final Train: 100.00
   Final Test: 76.60
run time now: 3.181760787963867
total time:  3.231182770105079
None All runs:
Highest Train: 100.00 ± 0.00
Highest Valid: 78.13 ± 1.22
  Final Train: 100.00 ± 0.00
   Final Test: 76.37 ± 1.96
[I 2023-06-12 00:30:43,747] Trial 199 finished with value: 78.13333129882812 and parameters: {'Fwd': 4.9857707020168394e-06, 'K': 10, 'alpha': 1.0, 'dropout': 0.9, 'gnnepoch': 70, 'lambda1': 0.65, 'lambda2': 7.329177506150383, 'loop': 1, 'loss': 'CE', 'lr': 0.0020286883927630723, 'softmaxF': True, 'useGCN': False, 'weight_decay': 0.0021869487241464518, 'weightedloss': False}. Best is trial 197 with value: 83.26667022705078.
/home/wxy/miniconda3/lib/python3.10/site-packages/optuna/distributions.py:685: UserWarning: The distribution is specified by [0, 1.00001] and step=0.05, but the range is not divisible by `step`. It will be replaced by [0, 1.0].
  warnings.warn(
K:  10
alpha:  1.0
lr:  0.0027101937528788214
weight_decay:  0.0030644367737498973
dropout:  0.9
fix split and run 3 times
Data: Data(x=[19717, 500], y=[19717], train_mask=[19717], val_mask=[19717], test_mask=[19717], adj_t=[19717, 19717, nnz=88648])
num_train tensor(60)
num_noise 0
noise: tensor(0)
data feature 500
ALTOPT(
  (lins): Sequential(
    (0): Linear(in_features=500, out_features=64, bias=True)
    (1): BatchNorm1d(64, eps=1e-05, momentum=0.1, affine=True, track_running_stats=True)
    (2): Dropout(p=0.9, inplace=True)
    (3): ReLU(inplace=True)
    (4): Linear(in_features=64, out_features=3, bias=True)
    (5): Identity()
  )
  (prop): Propagation(K=10, mode=None, lambda1=None, lambda2=None, L21=True, alpha=1.0)
  (gcn): GCN(
    (convs): ModuleList(
      (0): GCNConv(500, 64)
      (1): GCNConv(64, 3)
    )
    (bns): ModuleList(
      (0): BatchNorm1d(64, eps=1e-05, momentum=0.1, affine=True, track_running_stats=True)
    )
    (output): Identity()
  )
)
propagate done
init label
Split: 01, Run: 01
None time:  1.0011816069018096
None Run 01:
Highest Train: 100.00
Highest Valid: 69.60
  Final Train: 100.00
   Final Test: 69.50
Split: 01, Run: 02
None time:  1.7700132101308554
None Run 02:
Highest Train: 100.00
Highest Valid: 82.00
  Final Train: 100.00
   Final Test: 79.80
Split: 01, Run: 03
None time:  1.6130081170704216
None Run 03:
Highest Train: 100.00
Highest Valid: 80.20
  Final Train: 100.00
   Final Test: 78.90
run time now: 4.444518327713013
total time:  4.494178412016481
None All runs:
Highest Train: 100.00 ± 0.00
Highest Valid: 77.27 ± 6.70
  Final Train: 100.00 ± 0.00
   Final Test: 76.07 ± 5.70
[I 2023-06-12 00:30:48,707] Trial 200 finished with value: 77.26667022705078 and parameters: {'Fwd': 3.800464058918039e-06, 'K': 10, 'alpha': 1.0, 'dropout': 0.9, 'gnnepoch': 60, 'lambda1': 0.7000000000000001, 'lambda2': 7.808492430119919, 'loop': 1, 'loss': 'MSE', 'lr': 0.0027101937528788214, 'softmaxF': True, 'useGCN': False, 'weight_decay': 0.0030644367737498973, 'weightedloss': True}. Best is trial 197 with value: 83.26667022705078.
/home/wxy/miniconda3/lib/python3.10/site-packages/optuna/distributions.py:685: UserWarning: The distribution is specified by [0, 1.00001] and step=0.05, but the range is not divisible by `step`. It will be replaced by [0, 1.0].
  warnings.warn(
K:  10
alpha:  1.0
lr:  0.0024262697190075818
weight_decay:  0.004100081055661949
dropout:  0.9
fix split and run 3 times
Data: Data(x=[19717, 500], y=[19717], train_mask=[19717], val_mask=[19717], test_mask=[19717], adj_t=[19717, 19717, nnz=88648])
num_train tensor(60)
num_noise 0
noise: tensor(0)
data feature 500
ALTOPT(
  (lins): Sequential(
    (0): Linear(in_features=500, out_features=64, bias=True)
    (1): BatchNorm1d(64, eps=1e-05, momentum=0.1, affine=True, track_running_stats=True)
    (2): Dropout(p=0.9, inplace=True)
    (3): ReLU(inplace=True)
    (4): Linear(in_features=64, out_features=3, bias=True)
    (5): Identity()
  )
  (prop): Propagation(K=10, mode=None, lambda1=None, lambda2=None, L21=True, alpha=1.0)
  (gcn): GCN(
    (convs): ModuleList(
      (0): GCNConv(500, 64)
      (1): GCNConv(64, 3)
    )
    (bns): ModuleList(
      (0): BatchNorm1d(64, eps=1e-05, momentum=0.1, affine=True, track_running_stats=True)
    )
    (output): Identity()
  )
)
propagate done
init label
Split: 01, Run: 01
None time:  3.586393092991784
None Run 01:
Highest Train: 100.00
Highest Valid: 83.20
  Final Train: 100.00
   Final Test: 79.40
Split: 01, Run: 02
None time:  3.211739213904366
None Run 02:
Highest Train: 100.00
Highest Valid: 82.20
  Final Train: 100.00
   Final Test: 79.80
Split: 01, Run: 03, Epoch: 100, Loss: 0.1488, Train: 100.00%, Valid: 79.80% Test: 78.80%
Split: 01, Run: 03
None time:  3.4379942228551954
None Run 03:
Highest Train: 100.00
Highest Valid: 79.80
  Final Train: 100.00
   Final Test: 78.80
run time now: 10.28486180305481
total time:  10.336245260899886
None All runs:
Highest Train: 100.00 ± 0.00
Highest Valid: 81.73 ± 1.75
  Final Train: 100.00 ± 0.00
   Final Test: 79.33 ± 0.50
[I 2023-06-12 00:30:59,556] Trial 201 finished with value: 81.73333740234375 and parameters: {'Fwd': 2.984813436269473e-06, 'K': 10, 'alpha': 1.0, 'dropout': 0.9, 'gnnepoch': 70, 'lambda1': 0.65, 'lambda2': 7.48857387088216, 'loop': 1, 'loss': 'MSE', 'lr': 0.0024262697190075818, 'softmaxF': True, 'useGCN': False, 'weight_decay': 0.004100081055661949, 'weightedloss': False}. Best is trial 197 with value: 83.26667022705078.
/home/wxy/miniconda3/lib/python3.10/site-packages/optuna/distributions.py:685: UserWarning: The distribution is specified by [0, 1.00001] and step=0.05, but the range is not divisible by `step`. It will be replaced by [0, 1.0].
  warnings.warn(
K:  10
alpha:  0.9500000000000001
lr:  0.0017260287159544454
weight_decay:  0.005172948786098419
dropout:  0.9
fix split and run 3 times
Data: Data(x=[19717, 500], y=[19717], train_mask=[19717], val_mask=[19717], test_mask=[19717], adj_t=[19717, 19717, nnz=88648])
num_train tensor(60)
num_noise 0
noise: tensor(0)
data feature 500
ALTOPT(
  (lins): Sequential(
    (0): Linear(in_features=500, out_features=64, bias=True)
    (1): BatchNorm1d(64, eps=1e-05, momentum=0.1, affine=True, track_running_stats=True)
    (2): Dropout(p=0.9, inplace=True)
    (3): ReLU(inplace=True)
    (4): Linear(in_features=64, out_features=3, bias=True)
    (5): Identity()
  )
  (prop): Propagation(K=10, mode=None, lambda1=None, lambda2=None, L21=True, alpha=0.9500000000000001)
  (gcn): GCN(
    (convs): ModuleList(
      (0): GCNConv(500, 64)
      (1): GCNConv(64, 3)
    )
    (bns): ModuleList(
      (0): BatchNorm1d(64, eps=1e-05, momentum=0.1, affine=True, track_running_stats=True)
    )
    (output): Identity()
  )
)
propagate done
init label
Split: 01, Run: 01
None time:  2.3844283421058208
None Run 01:
Highest Train: 100.00
Highest Valid: 81.80
  Final Train: 100.00
   Final Test: 77.90
Split: 01, Run: 02
None time:  0.9777762391604483
None Run 02:
Highest Train: 100.00
Highest Valid: 80.00
  Final Train: 100.00
   Final Test: 77.20
Split: 01, Run: 03
None time:  1.133508938131854
None Run 03:
Highest Train: 100.00
Highest Valid: 83.40
  Final Train: 100.00
   Final Test: 79.50
run time now: 4.805978536605835
total time:  4.853779104072601
None All runs:
Highest Train: 100.00 ± 0.00
Highest Valid: 81.73 ± 1.70
  Final Train: 100.00 ± 0.00
   Final Test: 78.20 ± 1.18
[I 2023-06-12 00:31:05,045] Trial 202 finished with value: 81.73333740234375 and parameters: {'Fwd': 1.000143039062097e-06, 'K': 10, 'alpha': 0.9500000000000001, 'dropout': 0.9, 'gnnepoch': 70, 'lambda1': 0.7000000000000001, 'lambda2': 7.068500129029423, 'loop': 1, 'loss': 'MSE', 'lr': 0.0017260287159544454, 'softmaxF': True, 'useGCN': False, 'weight_decay': 0.005172948786098419, 'weightedloss': False}. Best is trial 197 with value: 83.26667022705078.
/home/wxy/miniconda3/lib/python3.10/site-packages/optuna/distributions.py:685: UserWarning: The distribution is specified by [0, 1.00001] and step=0.05, but the range is not divisible by `step`. It will be replaced by [0, 1.0].
  warnings.warn(
K:  10
alpha:  1.0
lr:  0.0020557765567790474
weight_decay:  0.0025794246942476796
dropout:  0.9
fix split and run 3 times
Data: Data(x=[19717, 500], y=[19717], train_mask=[19717], val_mask=[19717], test_mask=[19717], adj_t=[19717, 19717, nnz=88648])
num_train tensor(60)
num_noise 0
noise: tensor(0)
data feature 500
ALTOPT(
  (lins): Sequential(
    (0): Linear(in_features=500, out_features=64, bias=True)
    (1): BatchNorm1d(64, eps=1e-05, momentum=0.1, affine=True, track_running_stats=True)
    (2): Dropout(p=0.9, inplace=True)
    (3): ReLU(inplace=True)
    (4): Linear(in_features=64, out_features=3, bias=True)
    (5): Identity()
  )
  (prop): Propagation(K=10, mode=None, lambda1=None, lambda2=None, L21=True, alpha=1.0)
  (gcn): GCN(
    (convs): ModuleList(
      (0): GCNConv(500, 64)
      (1): GCNConv(64, 3)
    )
    (bns): ModuleList(
      (0): BatchNorm1d(64, eps=1e-05, momentum=0.1, affine=True, track_running_stats=True)
    )
    (output): Identity()
  )
)
propagate done
init label
Split: 01, Run: 01
None time:  1.896108339074999
None Run 01:
Highest Train: 100.00
Highest Valid: 81.80
  Final Train: 100.00
   Final Test: 76.40
Split: 01, Run: 02
None time:  2.7278596009127796
None Run 02:
Highest Train: 100.00
Highest Valid: 81.80
  Final Train: 100.00
   Final Test: 78.60
Split: 01, Run: 03
None time:  1.0240251081995666
None Run 03:
Highest Train: 100.00
Highest Valid: 81.00
  Final Train: 100.00
   Final Test: 78.60
run time now: 5.691972255706787
total time:  5.737365759909153
None All runs:
Highest Train: 100.00 ± 0.00
Highest Valid: 81.53 ± 0.46
  Final Train: 100.00 ± 0.00
   Final Test: 77.87 ± 1.27
[I 2023-06-12 00:31:11,347] Trial 203 finished with value: 81.53333282470703 and parameters: {'Fwd': 2.4332088125715316e-05, 'K': 10, 'alpha': 1.0, 'dropout': 0.9, 'gnnepoch': 70, 'lambda1': 0.6000000000000001, 'lambda2': 7.484172306093742, 'loop': 1, 'loss': 'MSE', 'lr': 0.0020557765567790474, 'softmaxF': True, 'useGCN': False, 'weight_decay': 0.0025794246942476796, 'weightedloss': False}. Best is trial 197 with value: 83.26667022705078.
/home/wxy/miniconda3/lib/python3.10/site-packages/optuna/distributions.py:685: UserWarning: The distribution is specified by [0, 1.00001] and step=0.05, but the range is not divisible by `step`. It will be replaced by [0, 1.0].
  warnings.warn(
K:  10
alpha:  0.9500000000000001
lr:  0.002799322079708182
weight_decay:  0.0068944022844190135
dropout:  0.9
fix split and run 3 times
Data: Data(x=[19717, 500], y=[19717], train_mask=[19717], val_mask=[19717], test_mask=[19717], adj_t=[19717, 19717, nnz=88648])
num_train tensor(60)
num_noise 0
noise: tensor(0)
data feature 500
ALTOPT(
  (lins): Sequential(
    (0): Linear(in_features=500, out_features=64, bias=True)
    (1): BatchNorm1d(64, eps=1e-05, momentum=0.1, affine=True, track_running_stats=True)
    (2): Dropout(p=0.9, inplace=True)
    (3): ReLU(inplace=True)
    (4): Linear(in_features=64, out_features=3, bias=True)
    (5): Identity()
  )
  (prop): Propagation(K=10, mode=None, lambda1=None, lambda2=None, L21=True, alpha=0.9500000000000001)
  (gcn): GCN(
    (convs): ModuleList(
      (0): GCNConv(500, 64)
      (1): GCNConv(64, 3)
    )
    (bns): ModuleList(
      (0): BatchNorm1d(64, eps=1e-05, momentum=0.1, affine=True, track_running_stats=True)
    )
    (output): Identity()
  )
)
propagate done
init label
Split: 01, Run: 01
None time:  2.067346401978284
None Run 01:
Highest Train: 100.00
Highest Valid: 81.80
  Final Train: 100.00
   Final Test: 77.60
Split: 01, Run: 02
None time:  1.5972605508286506
None Run 02:
Highest Train: 100.00
Highest Valid: 83.60
  Final Train: 100.00
   Final Test: 80.10
Split: 01, Run: 03
None time:  0.846796303987503
None Run 03:
Highest Train: 100.00
Highest Valid: 82.60
  Final Train: 100.00
   Final Test: 78.90
run time now: 4.560679912567139
total time:  4.60072062513791
None All runs:
Highest Train: 100.00 ± 0.00
Highest Valid: 82.67 ± 0.90
  Final Train: 100.00 ± 0.00
   Final Test: 78.87 ± 1.25
[I 2023-06-12 00:31:16,407] Trial 204 finished with value: 82.66666412353516 and parameters: {'Fwd': 1.0635432094306093e-05, 'K': 10, 'alpha': 0.9500000000000001, 'dropout': 0.9, 'gnnepoch': 60, 'lambda1': 0.65, 'lambda2': 6.933477271069681, 'loop': 1, 'loss': 'MSE', 'lr': 0.002799322079708182, 'softmaxF': True, 'useGCN': False, 'weight_decay': 0.0068944022844190135, 'weightedloss': False}. Best is trial 197 with value: 83.26667022705078.
/home/wxy/miniconda3/lib/python3.10/site-packages/optuna/distributions.py:685: UserWarning: The distribution is specified by [0, 1.00001] and step=0.05, but the range is not divisible by `step`. It will be replaced by [0, 1.0].
  warnings.warn(
K:  10
alpha:  0.9500000000000001
lr:  0.002826211604211708
weight_decay:  0.005838427506559882
dropout:  0.9
fix split and run 3 times
Data: Data(x=[19717, 500], y=[19717], train_mask=[19717], val_mask=[19717], test_mask=[19717], adj_t=[19717, 19717, nnz=88648])
num_train tensor(60)
num_noise 0
noise: tensor(0)
data feature 500
ALTOPT(
  (lins): Sequential(
    (0): Linear(in_features=500, out_features=64, bias=True)
    (1): BatchNorm1d(64, eps=1e-05, momentum=0.1, affine=True, track_running_stats=True)
    (2): Dropout(p=0.9, inplace=True)
    (3): ReLU(inplace=True)
    (4): Linear(in_features=64, out_features=3, bias=True)
    (5): Identity()
  )
  (prop): Propagation(K=10, mode=None, lambda1=None, lambda2=None, L21=True, alpha=0.9500000000000001)
  (gcn): GCN(
    (convs): ModuleList(
      (0): GCNConv(500, 64)
      (1): GCNConv(64, 3)
    )
    (bns): ModuleList(
      (0): BatchNorm1d(64, eps=1e-05, momentum=0.1, affine=True, track_running_stats=True)
    )
    (output): Identity()
  )
)
propagate done
init label
Split: 01, Run: 01
None time:  2.473029820015654
None Run 01:
Highest Train: 100.00
Highest Valid: 82.20
  Final Train: 100.00
   Final Test: 77.80
Split: 01, Run: 02
None time:  1.5030655190348625
None Run 02:
Highest Train: 100.00
Highest Valid: 84.00
  Final Train: 100.00
   Final Test: 79.00
Split: 01, Run: 03
None time:  1.0156570200342685
None Run 03:
Highest Train: 100.00
Highest Valid: 84.40
  Final Train: 100.00
   Final Test: 80.90
run time now: 5.0416364669799805
total time:  5.092619167175144
None All runs:
Highest Train: 100.00 ± 0.00
Highest Valid: 83.53 ± 1.17
  Final Train: 100.00 ± 0.00
   Final Test: 79.23 ± 1.56
[I 2023-06-12 00:31:21,993] Trial 205 finished with value: 83.53333282470703 and parameters: {'Fwd': 8.72257557713595e-06, 'K': 10, 'alpha': 0.9500000000000001, 'dropout': 0.9, 'gnnepoch': 60, 'lambda1': 0.65, 'lambda2': 6.851885022870475, 'loop': 1, 'loss': 'MSE', 'lr': 0.002826211604211708, 'softmaxF': True, 'useGCN': False, 'weight_decay': 0.005838427506559882, 'weightedloss': False}. Best is trial 205 with value: 83.53333282470703.
/home/wxy/miniconda3/lib/python3.10/site-packages/optuna/distributions.py:685: UserWarning: The distribution is specified by [0, 1.00001] and step=0.05, but the range is not divisible by `step`. It will be replaced by [0, 1.0].
  warnings.warn(
K:  10
alpha:  1.0
lr:  0.0027744237997373014
weight_decay:  0.006840789359003517
dropout:  0.9
fix split and run 3 times
Data: Data(x=[19717, 500], y=[19717], train_mask=[19717], val_mask=[19717], test_mask=[19717], adj_t=[19717, 19717, nnz=88648])
num_train tensor(60)
num_noise 0
noise: tensor(0)
data feature 500
ALTOPT(
  (lins): Sequential(
    (0): Linear(in_features=500, out_features=64, bias=True)
    (1): BatchNorm1d(64, eps=1e-05, momentum=0.1, affine=True, track_running_stats=True)
    (2): Dropout(p=0.9, inplace=True)
    (3): ReLU(inplace=True)
    (4): Linear(in_features=64, out_features=3, bias=True)
    (5): Identity()
  )
  (prop): Propagation(K=10, mode=None, lambda1=None, lambda2=None, L21=True, alpha=1.0)
  (gcn): GCN(
    (convs): ModuleList(
      (0): GCNConv(500, 64)
      (1): GCNConv(64, 3)
    )
    (bns): ModuleList(
      (0): BatchNorm1d(64, eps=1e-05, momentum=0.1, affine=True, track_running_stats=True)
    )
    (output): Identity()
  )
)
propagate done
init label
Split: 01, Run: 01
None time:  3.256035042926669
None Run 01:
Highest Train: 100.00
Highest Valid: 82.40
  Final Train: 100.00
   Final Test: 78.30
Split: 01, Run: 02
None time:  1.0070476960390806
None Run 02:
Highest Train: 100.00
Highest Valid: 80.80
  Final Train: 100.00
   Final Test: 79.70
Split: 01, Run: 03
None time:  1.3980653749313205
None Run 03:
Highest Train: 100.00
Highest Valid: 79.40
  Final Train: 100.00
   Final Test: 78.20
run time now: 5.714895009994507
total time:  5.765487118856981
None All runs:
Highest Train: 100.00 ± 0.00
Highest Valid: 80.87 ± 1.50
  Final Train: 100.00 ± 0.00
   Final Test: 78.73 ± 0.84
