[I 2023-06-12 00:19:09,038] Trial 80 finished with value: 81.80000305175781 and parameters: {'Fwd': 2.5981422477926193e-06, 'K': 7, 'alpha': 0.9500000000000001, 'dropout': 0.6000000000000001, 'gnnepoch': 70, 'lambda1': 0.25, 'lambda2': 7.4736152825292255, 'loop': 1, 'loss': 'MSE', 'lr': 0.0012456458636343603, 'softmaxF': True, 'useGCN': False, 'weight_decay': 0.0004948857451350149, 'weightedloss': False}. Best is trial 54 with value: 82.06666564941406.
/home/wxy/miniconda3/lib/python3.10/site-packages/optuna/distributions.py:685: UserWarning: The distribution is specified by [0, 1.00001] and step=0.05, but the range is not divisible by `step`. It will be replaced by [0, 1.0].
  warnings.warn(
K:  7
alpha:  0.9500000000000001
lr:  0.0012702164203162254
weight_decay:  0.0004664044610896143
dropout:  0.6000000000000001
fix split and run 3 times
Data: Data(x=[19717, 500], y=[19717], train_mask=[19717], val_mask=[19717], test_mask=[19717], adj_t=[19717, 19717, nnz=88648])
num_train tensor(60)
num_noise 0
noise: tensor(0)
data feature 500
ALTOPT(
  (lins): Sequential(
    (0): Linear(in_features=500, out_features=64, bias=True)
    (1): BatchNorm1d(64, eps=1e-05, momentum=0.1, affine=True, track_running_stats=True)
    (2): Dropout(p=0.6000000000000001, inplace=True)
    (3): ReLU(inplace=True)
    (4): Linear(in_features=64, out_features=3, bias=True)
    (5): Identity()
  )
  (prop): Propagation(K=7, mode=None, lambda1=None, lambda2=None, L21=True, alpha=0.9500000000000001)
  (gcn): GCN(
    (convs): ModuleList(
      (0): GCNConv(500, 64)
      (1): GCNConv(64, 3)
    )
    (bns): ModuleList(
      (0): BatchNorm1d(64, eps=1e-05, momentum=0.1, affine=True, track_running_stats=True)
    )
    (output): Identity()
  )
)
propagate done
init label
Split: 01, Run: 01
None time:  1.6287623799871653
None Run 01:
Highest Train: 100.00
Highest Valid: 83.20
  Final Train: 100.00
   Final Test: 77.90
Split: 01, Run: 02
None time:  1.0394939589314163
None Run 02:
Highest Train: 100.00
Highest Valid: 81.00
  Final Train: 100.00
   Final Test: 77.00
Split: 01, Run: 03
None time:  0.8131874210666865
None Run 03:
Highest Train: 100.00
Highest Valid: 82.60
  Final Train: 100.00
   Final Test: 79.40
run time now: 3.5263822078704834
total time:  3.5685682559851557
None All runs:
Highest Train: 100.00 ± 0.00
Highest Valid: 82.27 ± 1.14
  Final Train: 100.00 ± 0.00
   Final Test: 78.10 ± 1.21
[I 2023-06-12 00:19:13,114] Trial 81 finished with value: 82.26667022705078 and parameters: {'Fwd': 2.445779019583189e-06, 'K': 7, 'alpha': 0.9500000000000001, 'dropout': 0.6000000000000001, 'gnnepoch': 70, 'lambda1': 0.25, 'lambda2': 7.421037217858997, 'loop': 1, 'loss': 'MSE', 'lr': 0.0012702164203162254, 'softmaxF': True, 'useGCN': False, 'weight_decay': 0.0004664044610896143, 'weightedloss': False}. Best is trial 81 with value: 82.26667022705078.
/home/wxy/miniconda3/lib/python3.10/site-packages/optuna/distributions.py:685: UserWarning: The distribution is specified by [0, 1.00001] and step=0.05, but the range is not divisible by `step`. It will be replaced by [0, 1.0].
  warnings.warn(
K:  7
alpha:  0.9500000000000001
lr:  0.0012965402550960104
weight_decay:  0.0005025646119789928
dropout:  0.7000000000000001
fix split and run 3 times
Data: Data(x=[19717, 500], y=[19717], train_mask=[19717], val_mask=[19717], test_mask=[19717], adj_t=[19717, 19717, nnz=88648])
num_train tensor(60)
num_noise 0
noise: tensor(0)
data feature 500
ALTOPT(
  (lins): Sequential(
    (0): Linear(in_features=500, out_features=64, bias=True)
    (1): BatchNorm1d(64, eps=1e-05, momentum=0.1, affine=True, track_running_stats=True)
    (2): Dropout(p=0.7000000000000001, inplace=True)
    (3): ReLU(inplace=True)
    (4): Linear(in_features=64, out_features=3, bias=True)
    (5): Identity()
  )
  (prop): Propagation(K=7, mode=None, lambda1=None, lambda2=None, L21=True, alpha=0.9500000000000001)
  (gcn): GCN(
    (convs): ModuleList(
      (0): GCNConv(500, 64)
      (1): GCNConv(64, 3)
    )
    (bns): ModuleList(
      (0): BatchNorm1d(64, eps=1e-05, momentum=0.1, affine=True, track_running_stats=True)
    )
    (output): Identity()
  )
)
propagate done
init label
Split: 01, Run: 01
None time:  2.094378156820312
None Run 01:
Highest Train: 100.00
Highest Valid: 81.00
  Final Train: 100.00
   Final Test: 77.90
Split: 01, Run: 02
None time:  1.125190278980881
None Run 02:
Highest Train: 100.00
Highest Valid: 79.20
  Final Train: 100.00
   Final Test: 77.70
Split: 01, Run: 03
None time:  1.4444894730113447
None Run 03:
Highest Train: 100.00
Highest Valid: 81.80
  Final Train: 100.00
   Final Test: 78.20
run time now: 4.714226722717285
total time:  4.764230472967029
None All runs:
Highest Train: 100.00 ± 0.00
Highest Valid: 80.67 ± 1.33
  Final Train: 100.00 ± 0.00
   Final Test: 77.93 ± 0.25
[I 2023-06-12 00:19:18,456] Trial 82 finished with value: 80.66666412353516 and parameters: {'Fwd': 2.4368336242098513e-06, 'K': 7, 'alpha': 0.9500000000000001, 'dropout': 0.7000000000000001, 'gnnepoch': 70, 'lambda1': 0.25, 'lambda2': 6.795816343719182, 'loop': 1, 'loss': 'MSE', 'lr': 0.0012965402550960104, 'softmaxF': True, 'useGCN': False, 'weight_decay': 0.0005025646119789928, 'weightedloss': False}. Best is trial 81 with value: 82.26667022705078.
/home/wxy/miniconda3/lib/python3.10/site-packages/optuna/distributions.py:685: UserWarning: The distribution is specified by [0, 1.00001] and step=0.05, but the range is not divisible by `step`. It will be replaced by [0, 1.0].
  warnings.warn(
K:  6
alpha:  1.0
lr:  0.0012110664104724362
weight_decay:  0.0010418383723463213
dropout:  0.6000000000000001
fix split and run 3 times
Data: Data(x=[19717, 500], y=[19717], train_mask=[19717], val_mask=[19717], test_mask=[19717], adj_t=[19717, 19717, nnz=88648])
num_train tensor(60)
num_noise 0
noise: tensor(0)
data feature 500
ALTOPT(
  (lins): Sequential(
    (0): Linear(in_features=500, out_features=64, bias=True)
    (1): BatchNorm1d(64, eps=1e-05, momentum=0.1, affine=True, track_running_stats=True)
    (2): Dropout(p=0.6000000000000001, inplace=True)
    (3): ReLU(inplace=True)
    (4): Linear(in_features=64, out_features=3, bias=True)
    (5): Identity()
  )
  (prop): Propagation(K=6, mode=None, lambda1=None, lambda2=None, L21=True, alpha=1.0)
  (gcn): GCN(
    (convs): ModuleList(
      (0): GCNConv(500, 64)
      (1): GCNConv(64, 3)
    )
    (bns): ModuleList(
      (0): BatchNorm1d(64, eps=1e-05, momentum=0.1, affine=True, track_running_stats=True)
    )
    (output): Identity()
  )
)
propagate done
init label
Split: 01, Run: 01
None time:  1.5200081430375576
None Run 01:
Highest Train: 100.00
Highest Valid: 81.60
  Final Train: 100.00
   Final Test: 78.50
Split: 01, Run: 02
None time:  1.1342536169104278
None Run 02:
Highest Train: 100.00
Highest Valid: 81.40
  Final Train: 100.00
   Final Test: 77.70
Split: 01, Run: 03
None time:  1.1025055251084268
None Run 03:
Highest Train: 100.00
Highest Valid: 76.20
  Final Train: 100.00
   Final Test: 76.10
run time now: 3.8058230876922607
total time:  3.858271824894473
None All runs:
Highest Train: 100.00 ± 0.00
Highest Valid: 79.73 ± 3.06
  Final Train: 100.00 ± 0.00
   Final Test: 77.43 ± 1.22
[I 2023-06-12 00:19:22,848] Trial 83 finished with value: 79.73333740234375 and parameters: {'Fwd': 1.4810828322980316e-06, 'K': 6, 'alpha': 1.0, 'dropout': 0.6000000000000001, 'gnnepoch': 80, 'lambda1': 0.15000000000000002, 'lambda2': 7.545507649118824, 'loop': 1, 'loss': 'MSE', 'lr': 0.0012110664104724362, 'softmaxF': True, 'useGCN': False, 'weight_decay': 0.0010418383723463213, 'weightedloss': False}. Best is trial 81 with value: 82.26667022705078.
/home/wxy/miniconda3/lib/python3.10/site-packages/optuna/distributions.py:685: UserWarning: The distribution is specified by [0, 1.00001] and step=0.05, but the range is not divisible by `step`. It will be replaced by [0, 1.0].
  warnings.warn(
K:  8
alpha:  0.9500000000000001
lr:  0.0010183883814999445
weight_decay:  0.00047204823828346016
dropout:  0.6000000000000001
fix split and run 3 times
Data: Data(x=[19717, 500], y=[19717], train_mask=[19717], val_mask=[19717], test_mask=[19717], adj_t=[19717, 19717, nnz=88648])
num_train tensor(60)
num_noise 0
noise: tensor(0)
data feature 500
ALTOPT(
  (lins): Sequential(
    (0): Linear(in_features=500, out_features=64, bias=True)
    (1): BatchNorm1d(64, eps=1e-05, momentum=0.1, affine=True, track_running_stats=True)
    (2): Dropout(p=0.6000000000000001, inplace=True)
    (3): ReLU(inplace=True)
    (4): Linear(in_features=64, out_features=3, bias=True)
    (5): Identity()
  )
  (prop): Propagation(K=8, mode=None, lambda1=None, lambda2=None, L21=True, alpha=0.9500000000000001)
  (gcn): GCN(
    (convs): ModuleList(
      (0): GCNConv(500, 64)
      (1): GCNConv(64, 3)
    )
    (bns): ModuleList(
      (0): BatchNorm1d(64, eps=1e-05, momentum=0.1, affine=True, track_running_stats=True)
    )
    (output): Identity()
  )
)
propagate done
init label
Split: 01, Run: 01
None time:  1.3770869059953839
None Run 01:
Highest Train: 100.00
Highest Valid: 81.60
  Final Train: 100.00
   Final Test: 77.00
Split: 01, Run: 02
None time:  1.0893232359085232
None Run 02:
Highest Train: 100.00
Highest Valid: 80.00
  Final Train: 100.00
   Final Test: 77.80
Split: 01, Run: 03
None time:  1.3834616739768535
None Run 03:
Highest Train: 100.00
Highest Valid: 81.00
  Final Train: 100.00
   Final Test: 77.40
run time now: 3.896660327911377
total time:  3.9472278628963977
None All runs:
Highest Train: 100.00 ± 0.00
Highest Valid: 80.87 ± 0.81
  Final Train: 100.00 ± 0.00
   Final Test: 77.40 ± 0.40
[I 2023-06-12 00:19:27,224] Trial 84 finished with value: 80.86666870117188 and parameters: {'Fwd': 3.59448238856688e-06, 'K': 8, 'alpha': 0.9500000000000001, 'dropout': 0.6000000000000001, 'gnnepoch': 90, 'lambda1': 0.35000000000000003, 'lambda2': 7.362567728168101, 'loop': 1, 'loss': 'MSE', 'lr': 0.0010183883814999445, 'softmaxF': True, 'useGCN': False, 'weight_decay': 0.00047204823828346016, 'weightedloss': False}. Best is trial 81 with value: 82.26667022705078.
/home/wxy/miniconda3/lib/python3.10/site-packages/optuna/distributions.py:685: UserWarning: The distribution is specified by [0, 1.00001] and step=0.05, but the range is not divisible by `step`. It will be replaced by [0, 1.0].
  warnings.warn(
K:  9
alpha:  0.8500000000000001
lr:  0.0015567414450377165
weight_decay:  0.0007832960795840343
dropout:  0.6000000000000001
fix split and run 3 times
Data: Data(x=[19717, 500], y=[19717], train_mask=[19717], val_mask=[19717], test_mask=[19717], adj_t=[19717, 19717, nnz=88648])
num_train tensor(60)
num_noise 0
noise: tensor(0)
data feature 500
ALTOPT(
  (lins): Sequential(
    (0): Linear(in_features=500, out_features=64, bias=True)
    (1): BatchNorm1d(64, eps=1e-05, momentum=0.1, affine=True, track_running_stats=True)
    (2): Dropout(p=0.6000000000000001, inplace=True)
    (3): ReLU(inplace=True)
    (4): Linear(in_features=64, out_features=3, bias=True)
    (5): Identity()
  )
  (prop): Propagation(K=9, mode=None, lambda1=None, lambda2=None, L21=True, alpha=0.8500000000000001)
  (gcn): GCN(
    (convs): ModuleList(
      (0): GCNConv(500, 64)
      (1): GCNConv(64, 3)
    )
    (bns): ModuleList(
      (0): BatchNorm1d(64, eps=1e-05, momentum=0.1, affine=True, track_running_stats=True)
    )
    (output): Identity()
  )
)
propagate done
init label
Split: 01, Run: 01
None time:  2.461025591008365
None Run 01:
Highest Train: 100.00
Highest Valid: 80.20
  Final Train: 100.00
   Final Test: 76.20
Split: 01, Run: 02
None time:  1.5578578361310065
None Run 02:
Highest Train: 100.00
Highest Valid: 81.80
  Final Train: 100.00
   Final Test: 78.80
Split: 01, Run: 03
None time:  1.5398961971513927
None Run 03:
Highest Train: 100.00
Highest Valid: 82.80
  Final Train: 100.00
   Final Test: 78.60
run time now: 5.607445240020752
total time:  5.6549048570450395
None All runs:
Highest Train: 100.00 ± 0.00
Highest Valid: 81.60 ± 1.31
  Final Train: 100.00 ± 0.00
   Final Test: 77.87 ± 1.45
[I 2023-06-12 00:19:33,430] Trial 85 finished with value: 81.5999984741211 and parameters: {'Fwd': 5.8838055112128624e-06, 'K': 9, 'alpha': 0.8500000000000001, 'dropout': 0.6000000000000001, 'gnnepoch': 60, 'lambda1': 0.4, 'lambda2': 7.916049619416819, 'loop': 1, 'loss': 'MSE', 'lr': 0.0015567414450377165, 'softmaxF': True, 'useGCN': False, 'weight_decay': 0.0007832960795840343, 'weightedloss': False}. Best is trial 81 with value: 82.26667022705078.
/home/wxy/miniconda3/lib/python3.10/site-packages/optuna/distributions.py:685: UserWarning: The distribution is specified by [0, 1.00001] and step=0.05, but the range is not divisible by `step`. It will be replaced by [0, 1.0].
  warnings.warn(
K:  8
alpha:  0.8500000000000001
lr:  0.001585138183193868
weight_decay:  0.0015881680989736024
dropout:  0.6000000000000001
fix split and run 3 times
Data: Data(x=[19717, 500], y=[19717], train_mask=[19717], val_mask=[19717], test_mask=[19717], adj_t=[19717, 19717, nnz=88648])
num_train tensor(60)
num_noise 0
noise: tensor(0)
data feature 500
ALTOPT(
  (lins): Sequential(
    (0): Linear(in_features=500, out_features=64, bias=True)
    (1): BatchNorm1d(64, eps=1e-05, momentum=0.1, affine=True, track_running_stats=True)
    (2): Dropout(p=0.6000000000000001, inplace=True)
    (3): ReLU(inplace=True)
    (4): Linear(in_features=64, out_features=3, bias=True)
    (5): Identity()
  )
  (prop): Propagation(K=8, mode=None, lambda1=None, lambda2=None, L21=True, alpha=0.8500000000000001)
  (gcn): GCN(
    (convs): ModuleList(
      (0): GCNConv(500, 64)
      (1): GCNConv(64, 3)
    )
    (bns): ModuleList(
      (0): BatchNorm1d(64, eps=1e-05, momentum=0.1, affine=True, track_running_stats=True)
    )
    (output): Identity()
  )
)
propagate done
init label
Split: 01, Run: 01
None time:  1.4622182638850063
None Run 01:
Highest Train: 100.00
Highest Valid: 80.80
  Final Train: 100.00
   Final Test: 76.20
Split: 01, Run: 02
None time:  0.9824912510812283
None Run 02:
Highest Train: 100.00
Highest Valid: 81.60
  Final Train: 100.00
   Final Test: 78.80
Split: 01, Run: 03
None time:  1.7461976120248437
None Run 03:
Highest Train: 100.00
Highest Valid: 82.40
  Final Train: 100.00
   Final Test: 78.50
run time now: 4.246889352798462
total time:  4.2974057260435075
None All runs:
Highest Train: 100.00 ± 0.00
Highest Valid: 81.60 ± 0.80
  Final Train: 100.00 ± 0.00
   Final Test: 77.83 ± 1.42
[I 2023-06-12 00:19:38,277] Trial 86 finished with value: 81.5999984741211 and parameters: {'Fwd': 4.95197293654987e-06, 'K': 8, 'alpha': 0.8500000000000001, 'dropout': 0.6000000000000001, 'gnnepoch': 70, 'lambda1': 0.4, 'lambda2': 7.986215468828916, 'loop': 1, 'loss': 'MSE', 'lr': 0.001585138183193868, 'softmaxF': True, 'useGCN': False, 'weight_decay': 0.0015881680989736024, 'weightedloss': False}. Best is trial 81 with value: 82.26667022705078.
/home/wxy/miniconda3/lib/python3.10/site-packages/optuna/distributions.py:685: UserWarning: The distribution is specified by [0, 1.00001] and step=0.05, but the range is not divisible by `step`. It will be replaced by [0, 1.0].
  warnings.warn(
K:  9
alpha:  0.8500000000000001
lr:  0.0015340016155103958
weight_decay:  0.001873367224327153
dropout:  0.7000000000000001
fix split and run 3 times
Data: Data(x=[19717, 500], y=[19717], train_mask=[19717], val_mask=[19717], test_mask=[19717], adj_t=[19717, 19717, nnz=88648])
num_train tensor(60)
num_noise 0
noise: tensor(0)
data feature 500
ALTOPT(
  (lins): Sequential(
    (0): Linear(in_features=500, out_features=64, bias=True)
    (1): BatchNorm1d(64, eps=1e-05, momentum=0.1, affine=True, track_running_stats=True)
    (2): Dropout(p=0.7000000000000001, inplace=True)
    (3): ReLU(inplace=True)
    (4): Linear(in_features=64, out_features=3, bias=True)
    (5): Identity()
  )
  (prop): Propagation(K=9, mode=None, lambda1=None, lambda2=None, L21=True, alpha=0.8500000000000001)
  (gcn): GCN(
    (convs): ModuleList(
      (0): GCNConv(500, 64)
      (1): GCNConv(64, 3)
    )
    (bns): ModuleList(
      (0): BatchNorm1d(64, eps=1e-05, momentum=0.1, affine=True, track_running_stats=True)
    )
    (output): Identity()
  )
)
propagate done
init label
Split: 01, Run: 01
None time:  2.6422436931170523
None Run 01:
Highest Train: 100.00
Highest Valid: 75.80
  Final Train: 100.00
   Final Test: 75.60
Split: 01, Run: 02
None time:  2.0525757258292288
None Run 02:
Highest Train: 100.00
Highest Valid: 75.00
  Final Train: 100.00
   Final Test: 73.80
Split: 01, Run: 03, Epoch: 100, Loss: 0.0213, Train: 100.00%, Valid: 76.20% Test: 74.10%
Split: 01, Run: 03
None time:  5.206688959849998
None Run 03:
Highest Train: 100.00
Highest Valid: 76.20
  Final Train: 100.00
   Final Test: 73.90
run time now: 9.949053049087524
total time:  10.005286166910082
None All runs:
Highest Train: 100.00 ± 0.00
Highest Valid: 75.67 ± 0.61
  Final Train: 100.00 ± 0.00
   Final Test: 74.43 ± 1.01
[I 2023-06-12 00:19:48,714] Trial 87 finished with value: 75.66666412353516 and parameters: {'Fwd': 5.942858117372143e-06, 'K': 9, 'alpha': 0.8500000000000001, 'dropout': 0.7000000000000001, 'gnnepoch': 70, 'lambda1': 0.4, 'lambda2': 8.107136164430807, 'loop': 1, 'loss': 'MSE', 'lr': 0.0015340016155103958, 'softmaxF': False, 'useGCN': True, 'weight_decay': 0.001873367224327153, 'weightedloss': False}. Best is trial 81 with value: 82.26667022705078.
/home/wxy/miniconda3/lib/python3.10/site-packages/optuna/distributions.py:685: UserWarning: The distribution is specified by [0, 1.00001] and step=0.05, but the range is not divisible by `step`. It will be replaced by [0, 1.0].
  warnings.warn(
K:  9
alpha:  0.8500000000000001
lr:  0.0016676699446057021
weight_decay:  0.0007098762887047687
dropout:  0.6000000000000001
fix split and run 3 times
Data: Data(x=[19717, 500], y=[19717], train_mask=[19717], val_mask=[19717], test_mask=[19717], adj_t=[19717, 19717, nnz=88648])
num_train tensor(60)
num_noise 0
noise: tensor(0)
data feature 500
ALTOPT(
  (lins): Sequential(
    (0): Linear(in_features=500, out_features=64, bias=True)
    (1): BatchNorm1d(64, eps=1e-05, momentum=0.1, affine=True, track_running_stats=True)
    (2): Dropout(p=0.6000000000000001, inplace=True)
    (3): ReLU(inplace=True)
    (4): Linear(in_features=64, out_features=3, bias=True)
    (5): Identity()
  )
  (prop): Propagation(K=9, mode=None, lambda1=None, lambda2=None, L21=True, alpha=0.8500000000000001)
  (gcn): GCN(
    (convs): ModuleList(
      (0): GCNConv(500, 64)
      (1): GCNConv(64, 3)
    )
    (bns): ModuleList(
      (0): BatchNorm1d(64, eps=1e-05, momentum=0.1, affine=True, track_running_stats=True)
    )
    (output): Identity()
  )
)
propagate done
init label
Split: 01, Run: 01
None time:  2.1699852840974927
None Run 01:
Highest Train: 100.00
Highest Valid: 79.40
  Final Train: 100.00
   Final Test: 76.40
Split: 01, Run: 02
None time:  0.820403773104772
None Run 02:
Highest Train: 100.00
Highest Valid: 81.20
  Final Train: 100.00
   Final Test: 78.60
Split: 01, Run: 03
None time:  1.043665625853464
None Run 03:
Highest Train: 100.00
Highest Valid: 81.40
  Final Train: 100.00
   Final Test: 79.00
run time now: 4.080575942993164
total time:  4.129348212154582
None All runs:
Highest Train: 100.00 ± 0.00
Highest Valid: 80.67 ± 1.10
  Final Train: 100.00 ± 0.00
   Final Test: 78.00 ± 1.40
[I 2023-06-12 00:19:53,271] Trial 88 finished with value: 80.66666412353516 and parameters: {'Fwd': 1.9002939984023727e-06, 'K': 9, 'alpha': 0.8500000000000001, 'dropout': 0.6000000000000001, 'gnnepoch': 60, 'lambda1': 0.45, 'lambda2': 8.542718740795213, 'loop': 1, 'loss': 'MSE', 'lr': 0.0016676699446057021, 'softmaxF': True, 'useGCN': False, 'weight_decay': 0.0007098762887047687, 'weightedloss': True}. Best is trial 81 with value: 82.26667022705078.
/home/wxy/miniconda3/lib/python3.10/site-packages/optuna/distributions.py:685: UserWarning: The distribution is specified by [0, 1.00001] and step=0.05, but the range is not divisible by `step`. It will be replaced by [0, 1.0].
  warnings.warn(
K:  8
alpha:  0.75
lr:  0.0014267584141633056
weight_decay:  0.0013036232951848807
dropout:  0.7000000000000001
fix split and run 3 times
Data: Data(x=[19717, 500], y=[19717], train_mask=[19717], val_mask=[19717], test_mask=[19717], adj_t=[19717, 19717, nnz=88648])
num_train tensor(60)
num_noise 0
noise: tensor(0)
data feature 500
ALTOPT(
  (lins): Sequential(
    (0): Linear(in_features=500, out_features=64, bias=True)
    (1): BatchNorm1d(64, eps=1e-05, momentum=0.1, affine=True, track_running_stats=True)
    (2): Dropout(p=0.7000000000000001, inplace=True)
    (3): ReLU(inplace=True)
    (4): Linear(in_features=64, out_features=3, bias=True)
    (5): Identity()
  )
  (prop): Propagation(K=8, mode=None, lambda1=None, lambda2=None, L21=True, alpha=0.75)
  (gcn): GCN(
    (convs): ModuleList(
      (0): GCNConv(500, 64)
      (1): GCNConv(64, 3)
    )
    (bns): ModuleList(
      (0): BatchNorm1d(64, eps=1e-05, momentum=0.1, affine=True, track_running_stats=True)
    )
    (output): Identity()
  )
)
propagate done
init label
Split: 01, Run: 01
None time:  0.815238227834925
None Run 01:
Highest Train: 100.00
Highest Valid: 69.20
  Final Train: 100.00
   Final Test: 69.40
Split: 01, Run: 02
None time:  0.8799766728188843
None Run 02:
Highest Train: 100.00
Highest Valid: 78.20
  Final Train: 100.00
   Final Test: 75.00
Split: 01, Run: 03
None time:  2.093446178128943
None Run 03:
Highest Train: 100.00
Highest Valid: 81.20
  Final Train: 100.00
   Final Test: 78.40
run time now: 3.835085153579712
total time:  3.8820051678922027
None All runs:
Highest Train: 100.00 ± 0.00
Highest Valid: 76.20 ± 6.24
  Final Train: 100.00 ± 0.00
   Final Test: 74.27 ± 4.54
