[I 2023-06-12 00:20:54,274] Trial 98 finished with value: 82.0666732788086 and parameters: {'Fwd': 1.7501573310428727e-06, 'K': 9, 'alpha': 0.9, 'dropout': 0.6000000000000001, 'gnnepoch': 70, 'lambda1': 0.5, 'lambda2': 7.217488666560978, 'loop': 1, 'loss': 'MSE', 'lr': 0.001814892373033509, 'softmaxF': True, 'useGCN': False, 'weight_decay': 0.0025268977244496623, 'weightedloss': False}. Best is trial 97 with value: 82.53333282470703.
/home/wxy/miniconda3/lib/python3.10/site-packages/optuna/distributions.py:685: UserWarning: The distribution is specified by [0, 1.00001] and step=0.05, but the range is not divisible by `step`. It will be replaced by [0, 1.0].
  warnings.warn(
K:  9
alpha:  0.9
lr:  0.0022985498938639637
weight_decay:  0.0027739385150697743
dropout:  0.8
fix split and run 3 times
Data: Data(x=[19717, 500], y=[19717], train_mask=[19717], val_mask=[19717], test_mask=[19717], adj_t=[19717, 19717, nnz=88648])
num_train tensor(60)
num_noise 0
noise: tensor(0)
data feature 500
ALTOPT(
  (lins): Sequential(
    (0): Linear(in_features=500, out_features=64, bias=True)
    (1): BatchNorm1d(64, eps=1e-05, momentum=0.1, affine=True, track_running_stats=True)
    (2): Dropout(p=0.8, inplace=True)
    (3): ReLU(inplace=True)
    (4): Linear(in_features=64, out_features=3, bias=True)
    (5): LogSoftmax(dim=-1)
  )
  (prop): Propagation(K=9, mode=None, lambda1=None, lambda2=None, L21=True, alpha=0.9)
  (gcn): GCN(
    (convs): ModuleList(
      (0): GCNConv(500, 64)
      (1): GCNConv(64, 3)
    )
    (bns): ModuleList(
      (0): BatchNorm1d(64, eps=1e-05, momentum=0.1, affine=True, track_running_stats=True)
    )
    (output): LogSoftmax(dim=-1)
  )
)
propagate done
init label
Split: 01, Run: 01
None time:  0.9080055919475853
None Run 01:
Highest Train: 100.00
Highest Valid: 74.20
  Final Train: 100.00
   Final Test: 71.30
Split: 01, Run: 02
None time:  1.2524294999893755
None Run 02:
Highest Train: 100.00
Highest Valid: 79.60
  Final Train: 98.33
   Final Test: 79.50
Split: 01, Run: 03
None time:  1.1234283179510385
None Run 03:
Highest Train: 100.00
Highest Valid: 78.80
  Final Train: 100.00
   Final Test: 77.50
run time now: 3.334399938583374
total time:  3.3868635760154575
None All runs:
Highest Train: 100.00 ± 0.00
Highest Valid: 77.53 ± 2.91
  Final Train: 99.44 ± 0.96
   Final Test: 76.10 ± 4.28
[I 2023-06-12 00:20:58,122] Trial 99 finished with value: 77.5333251953125 and parameters: {'Fwd': 1.7003466221893942e-06, 'K': 9, 'alpha': 0.9, 'dropout': 0.8, 'gnnepoch': 70, 'lambda1': 0.5, 'lambda2': 7.1858543989994885, 'loop': 1, 'loss': 'CE', 'lr': 0.0022985498938639637, 'softmaxF': True, 'useGCN': False, 'weight_decay': 0.0027739385150697743, 'weightedloss': False}. Best is trial 97 with value: 82.53333282470703.
/home/wxy/miniconda3/lib/python3.10/site-packages/optuna/distributions.py:685: UserWarning: The distribution is specified by [0, 1.00001] and step=0.05, but the range is not divisible by `step`. It will be replaced by [0, 1.0].
  warnings.warn(
K:  10
alpha:  0.9
lr:  0.0018413669523216299
weight_decay:  0.0026773178256944107
dropout:  0.6000000000000001
fix split and run 3 times
Data: Data(x=[19717, 500], y=[19717], train_mask=[19717], val_mask=[19717], test_mask=[19717], adj_t=[19717, 19717, nnz=88648])
num_train tensor(60)
num_noise 0
noise: tensor(0)
data feature 500
ALTOPT(
  (lins): Sequential(
    (0): Linear(in_features=500, out_features=64, bias=True)
    (1): BatchNorm1d(64, eps=1e-05, momentum=0.1, affine=True, track_running_stats=True)
    (2): Dropout(p=0.6000000000000001, inplace=True)
    (3): ReLU(inplace=True)
    (4): Linear(in_features=64, out_features=3, bias=True)
    (5): Identity()
  )
  (prop): Propagation(K=10, mode=None, lambda1=None, lambda2=None, L21=True, alpha=0.9)
  (gcn): GCN(
    (convs): ModuleList(
      (0): GCNConv(500, 64)
      (1): GCNConv(64, 3)
    )
    (bns): ModuleList(
      (0): BatchNorm1d(64, eps=1e-05, momentum=0.1, affine=True, track_running_stats=True)
    )
    (output): Identity()
  )
)
propagate done
init label
Split: 01, Run: 01
None time:  2.815521796932444
None Run 01:
Highest Train: 100.00
Highest Valid: 77.40
  Final Train: 100.00
   Final Test: 76.10
Split: 01, Run: 02
None time:  2.055850184056908
None Run 02:
Highest Train: 100.00
Highest Valid: 76.60
  Final Train: 100.00
   Final Test: 74.70
Split: 01, Run: 03
None time:  1.7046118848957121
None Run 03:
Highest Train: 100.00
Highest Valid: 76.20
  Final Train: 100.00
   Final Test: 74.20
run time now: 6.623349189758301
total time:  6.668124817078933
None All runs:
Highest Train: 100.00 ± 0.00
Highest Valid: 76.73 ± 0.61
  Final Train: 100.00 ± 0.00
   Final Test: 75.00 ± 0.98
[I 2023-06-12 00:21:05,179] Trial 100 finished with value: 76.73333740234375 and parameters: {'Fwd': 1.2831403791442072e-06, 'K': 10, 'alpha': 0.9, 'dropout': 0.6000000000000001, 'gnnepoch': 70, 'lambda1': 0.6000000000000001, 'lambda2': 7.101654908523681, 'loop': 1, 'loss': 'MSE', 'lr': 0.0018413669523216299, 'softmaxF': True, 'useGCN': True, 'weight_decay': 0.0026773178256944107, 'weightedloss': False}. Best is trial 97 with value: 82.53333282470703.
/home/wxy/miniconda3/lib/python3.10/site-packages/optuna/distributions.py:685: UserWarning: The distribution is specified by [0, 1.00001] and step=0.05, but the range is not divisible by `step`. It will be replaced by [0, 1.0].
  warnings.warn(
K:  9
alpha:  0.9500000000000001
lr:  0.0020680358977301916
weight_decay:  0.004723506887593588
dropout:  0.6000000000000001
fix split and run 3 times
Data: Data(x=[19717, 500], y=[19717], train_mask=[19717], val_mask=[19717], test_mask=[19717], adj_t=[19717, 19717, nnz=88648])
num_train tensor(60)
num_noise 0
noise: tensor(0)
data feature 500
ALTOPT(
  (lins): Sequential(
    (0): Linear(in_features=500, out_features=64, bias=True)
    (1): BatchNorm1d(64, eps=1e-05, momentum=0.1, affine=True, track_running_stats=True)
    (2): Dropout(p=0.6000000000000001, inplace=True)
    (3): ReLU(inplace=True)
    (4): Linear(in_features=64, out_features=3, bias=True)
    (5): Identity()
  )
  (prop): Propagation(K=9, mode=None, lambda1=None, lambda2=None, L21=True, alpha=0.9500000000000001)
  (gcn): GCN(
    (convs): ModuleList(
      (0): GCNConv(500, 64)
      (1): GCNConv(64, 3)
    )
    (bns): ModuleList(
      (0): BatchNorm1d(64, eps=1e-05, momentum=0.1, affine=True, track_running_stats=True)
    )
    (output): Identity()
  )
)
propagate done
init label
Split: 01, Run: 01
None time:  1.4209734301548451
None Run 01:
Highest Train: 100.00
Highest Valid: 81.40
  Final Train: 100.00
   Final Test: 78.10
Split: 01, Run: 02
None time:  1.050714640878141
None Run 02:
Highest Train: 100.00
Highest Valid: 81.00
  Final Train: 100.00
   Final Test: 77.70
Split: 01, Run: 03
None time:  2.1731370619963855
None Run 03:
Highest Train: 100.00
Highest Valid: 82.40
  Final Train: 100.00
   Final Test: 79.10
run time now: 4.694096565246582
total time:  4.739845438161865
None All runs:
Highest Train: 100.00 ± 0.00
Highest Valid: 81.60 ± 0.72
  Final Train: 100.00 ± 0.00
   Final Test: 78.30 ± 0.72
[I 2023-06-12 00:21:10,418] Trial 101 finished with value: 81.5999984741211 and parameters: {'Fwd': 2.320400736394241e-06, 'K': 9, 'alpha': 0.9500000000000001, 'dropout': 0.6000000000000001, 'gnnepoch': 70, 'lambda1': 0.5, 'lambda2': 7.29892806170036, 'loop': 1, 'loss': 'MSE', 'lr': 0.0020680358977301916, 'softmaxF': True, 'useGCN': False, 'weight_decay': 0.004723506887593588, 'weightedloss': False}. Best is trial 97 with value: 82.53333282470703.
/home/wxy/miniconda3/lib/python3.10/site-packages/optuna/distributions.py:685: UserWarning: The distribution is specified by [0, 1.00001] and step=0.05, but the range is not divisible by `step`. It will be replaced by [0, 1.0].
  warnings.warn(
K:  9
alpha:  0.9
lr:  0.0020417373995312797
weight_decay:  0.00400125777088147
dropout:  0.6000000000000001
fix split and run 3 times
Data: Data(x=[19717, 500], y=[19717], train_mask=[19717], val_mask=[19717], test_mask=[19717], adj_t=[19717, 19717, nnz=88648])
num_train tensor(60)
num_noise 0
noise: tensor(0)
data feature 500
ALTOPT(
  (lins): Sequential(
    (0): Linear(in_features=500, out_features=64, bias=True)
    (1): BatchNorm1d(64, eps=1e-05, momentum=0.1, affine=True, track_running_stats=True)
    (2): Dropout(p=0.6000000000000001, inplace=True)
    (3): ReLU(inplace=True)
    (4): Linear(in_features=64, out_features=3, bias=True)
    (5): Identity()
  )
  (prop): Propagation(K=9, mode=None, lambda1=None, lambda2=None, L21=True, alpha=0.9)
  (gcn): GCN(
    (convs): ModuleList(
      (0): GCNConv(500, 64)
      (1): GCNConv(64, 3)
    )
    (bns): ModuleList(
      (0): BatchNorm1d(64, eps=1e-05, momentum=0.1, affine=True, track_running_stats=True)
    )
    (output): Identity()
  )
)
propagate done
init label
Split: 01, Run: 01
None time:  1.67862176313065
None Run 01:
Highest Train: 100.00
Highest Valid: 82.40
  Final Train: 100.00
   Final Test: 76.50
Split: 01, Run: 02
None time:  1.2087846470531076
None Run 02:
Highest Train: 100.00
Highest Valid: 83.20
  Final Train: 100.00
   Final Test: 79.20
Split: 01, Run: 03
None time:  1.0907615879550576
None Run 03:
Highest Train: 100.00
Highest Valid: 81.60
  Final Train: 100.00
   Final Test: 78.70
run time now: 4.028372049331665
total time:  4.083392621949315
None All runs:
Highest Train: 100.00 ± 0.00
Highest Valid: 82.40 ± 0.80
  Final Train: 100.00 ± 0.00
   Final Test: 78.13 ± 1.44
[I 2023-06-12 00:21:15,043] Trial 102 finished with value: 82.4000015258789 and parameters: {'Fwd': 2.176918041223777e-06, 'K': 9, 'alpha': 0.9, 'dropout': 0.6000000000000001, 'gnnepoch': 70, 'lambda1': 0.45, 'lambda2': 7.3579098171397215, 'loop': 1, 'loss': 'MSE', 'lr': 0.0020417373995312797, 'softmaxF': True, 'useGCN': False, 'weight_decay': 0.00400125777088147, 'weightedloss': False}. Best is trial 97 with value: 82.53333282470703.
/home/wxy/miniconda3/lib/python3.10/site-packages/optuna/distributions.py:685: UserWarning: The distribution is specified by [0, 1.00001] and step=0.05, but the range is not divisible by `step`. It will be replaced by [0, 1.0].
  warnings.warn(
K:  9
alpha:  0.9
lr:  0.0017596101103029786
weight_decay:  0.0038903070346378455
dropout:  0.6000000000000001
fix split and run 3 times
Data: Data(x=[19717, 500], y=[19717], train_mask=[19717], val_mask=[19717], test_mask=[19717], adj_t=[19717, 19717, nnz=88648])
num_train tensor(60)
num_noise 0
noise: tensor(0)
data feature 500
ALTOPT(
  (lins): Sequential(
    (0): Linear(in_features=500, out_features=64, bias=True)
    (1): BatchNorm1d(64, eps=1e-05, momentum=0.1, affine=True, track_running_stats=True)
    (2): Dropout(p=0.6000000000000001, inplace=True)
    (3): ReLU(inplace=True)
    (4): Linear(in_features=64, out_features=3, bias=True)
    (5): Identity()
  )
  (prop): Propagation(K=9, mode=None, lambda1=None, lambda2=None, L21=True, alpha=0.9)
  (gcn): GCN(
    (convs): ModuleList(
      (0): GCNConv(500, 64)
      (1): GCNConv(64, 3)
    )
    (bns): ModuleList(
      (0): BatchNorm1d(64, eps=1e-05, momentum=0.1, affine=True, track_running_stats=True)
    )
    (output): Identity()
  )
)
propagate done
init label
Split: 01, Run: 01
None time:  1.5092702060937881
None Run 01:
Highest Train: 100.00
Highest Valid: 82.00
  Final Train: 100.00
   Final Test: 77.70
Split: 01, Run: 02
None time:  2.6345309400931
None Run 02:
Highest Train: 100.00
Highest Valid: 83.40
  Final Train: 100.00
   Final Test: 80.40
Split: 01, Run: 03
None time:  2.2355010511819273
None Run 03:
Highest Train: 100.00
Highest Valid: 81.80
  Final Train: 100.00
   Final Test: 78.80
run time now: 6.426029682159424
total time:  6.479169698199257
None All runs:
Highest Train: 100.00 ± 0.00
Highest Valid: 82.40 ± 0.87
  Final Train: 100.00 ± 0.00
   Final Test: 78.97 ± 1.36
[I 2023-06-12 00:21:22,047] Trial 103 finished with value: 82.4000015258789 and parameters: {'Fwd': 1.0113636584294405e-06, 'K': 9, 'alpha': 0.9, 'dropout': 0.6000000000000001, 'gnnepoch': 70, 'lambda1': 0.45, 'lambda2': 7.491204293093673, 'loop': 1, 'loss': 'MSE', 'lr': 0.0017596101103029786, 'softmaxF': True, 'useGCN': False, 'weight_decay': 0.0038903070346378455, 'weightedloss': False}. Best is trial 97 with value: 82.53333282470703.
/home/wxy/miniconda3/lib/python3.10/site-packages/optuna/distributions.py:685: UserWarning: The distribution is specified by [0, 1.00001] and step=0.05, but the range is not divisible by `step`. It will be replaced by [0, 1.0].
  warnings.warn(
K:  9
alpha:  0.9
lr:  0.002688813160726946
weight_decay:  0.004836799789766554
dropout:  0.7000000000000001
fix split and run 3 times
Data: Data(x=[19717, 500], y=[19717], train_mask=[19717], val_mask=[19717], test_mask=[19717], adj_t=[19717, 19717, nnz=88648])
num_train tensor(60)
num_noise 0
noise: tensor(0)
data feature 500
ALTOPT(
  (lins): Sequential(
    (0): Linear(in_features=500, out_features=64, bias=True)
    (1): BatchNorm1d(64, eps=1e-05, momentum=0.1, affine=True, track_running_stats=True)
    (2): Dropout(p=0.7000000000000001, inplace=True)
    (3): ReLU(inplace=True)
    (4): Linear(in_features=64, out_features=3, bias=True)
    (5): Identity()
  )
  (prop): Propagation(K=9, mode=None, lambda1=None, lambda2=None, L21=True, alpha=0.9)
  (gcn): GCN(
    (convs): ModuleList(
      (0): GCNConv(500, 64)
      (1): GCNConv(64, 3)
    )
    (bns): ModuleList(
      (0): BatchNorm1d(64, eps=1e-05, momentum=0.1, affine=True, track_running_stats=True)
    )
    (output): Identity()
  )
)
propagate done
init label
Split: 01, Run: 01
None time:  2.1627663250546902
None Run 01:
Highest Train: 100.00
Highest Valid: 80.80
  Final Train: 100.00
   Final Test: 76.70
Split: 01, Run: 02
None time:  1.1030982451047748
None Run 02:
Highest Train: 100.00
Highest Valid: 79.80
  Final Train: 100.00
   Final Test: 76.30
Split: 01, Run: 03
None time:  1.4448844350408763
None Run 03:
Highest Train: 100.00
Highest Valid: 81.00
  Final Train: 100.00
   Final Test: 78.70
run time now: 4.763290643692017
total time:  4.805578229948878
None All runs:
Highest Train: 100.00 ± 0.00
Highest Valid: 80.53 ± 0.64
  Final Train: 100.00 ± 0.00
   Final Test: 77.23 ± 1.29
[I 2023-06-12 00:21:27,425] Trial 104 finished with value: 80.53333282470703 and parameters: {'Fwd': 1.0446602082689812e-06, 'K': 9, 'alpha': 0.9, 'dropout': 0.7000000000000001, 'gnnepoch': 70, 'lambda1': 0.5, 'lambda2': 6.875126357183221, 'loop': 1, 'loss': 'MSE', 'lr': 0.002688813160726946, 'softmaxF': True, 'useGCN': False, 'weight_decay': 0.004836799789766554, 'weightedloss': False}. Best is trial 97 with value: 82.53333282470703.
/home/wxy/miniconda3/lib/python3.10/site-packages/optuna/distributions.py:685: UserWarning: The distribution is specified by [0, 1.00001] and step=0.05, but the range is not divisible by `step`. It will be replaced by [0, 1.0].
  warnings.warn(
K:  10
alpha:  0.9
lr:  0.002076077104288313
weight_decay:  0.003217795852714664
dropout:  0.6000000000000001
fix split and run 3 times
Data: Data(x=[19717, 500], y=[19717], train_mask=[19717], val_mask=[19717], test_mask=[19717], adj_t=[19717, 19717, nnz=88648])
num_train tensor(60)
num_noise 0
noise: tensor(0)
data feature 500
ALTOPT(
  (lins): Sequential(
    (0): Linear(in_features=500, out_features=64, bias=True)
    (1): BatchNorm1d(64, eps=1e-05, momentum=0.1, affine=True, track_running_stats=True)
    (2): Dropout(p=0.6000000000000001, inplace=True)
    (3): ReLU(inplace=True)
    (4): Linear(in_features=64, out_features=3, bias=True)
    (5): Identity()
  )
  (prop): Propagation(K=10, mode=None, lambda1=None, lambda2=None, L21=True, alpha=0.9)
  (gcn): GCN(
    (convs): ModuleList(
      (0): GCNConv(500, 64)
      (1): GCNConv(64, 3)
    )
    (bns): ModuleList(
      (0): BatchNorm1d(64, eps=1e-05, momentum=0.1, affine=True, track_running_stats=True)
    )
    (output): Identity()
  )
)
propagate done
init label
Split: 01, Run: 01, Epoch: 100, Loss: 0.1758, Train: 100.00%, Valid: 79.80% Test: 78.80%
Split: 01, Run: 01
None time:  3.672689009923488
None Run 01:
Highest Train: 100.00
Highest Valid: 80.00
  Final Train: 100.00
   Final Test: 78.80
Split: 01, Run: 02
None time:  1.696636504959315
None Run 02:
Highest Train: 100.00
Highest Valid: 82.20
  Final Train: 100.00
   Final Test: 78.90
Split: 01, Run: 03
None time:  1.1191701099742204
None Run 03:
Highest Train: 100.00
Highest Valid: 80.80
  Final Train: 100.00
   Final Test: 79.20
run time now: 6.533447742462158
total time:  6.585325432009995
None All runs:
Highest Train: 100.00 ± 0.00
Highest Valid: 81.00 ± 1.11
  Final Train: 100.00 ± 0.00
   Final Test: 78.97 ± 0.21
[I 2023-06-12 00:21:34,594] Trial 105 finished with value: 81.00000762939453 and parameters: {'Fwd': 1.4128066301535776e-06, 'K': 10, 'alpha': 0.9, 'dropout': 0.6000000000000001, 'gnnepoch': 60, 'lambda1': 0.45, 'lambda2': 6.598994656556666, 'loop': 1, 'loss': 'MSE', 'lr': 0.002076077104288313, 'softmaxF': True, 'useGCN': False, 'weight_decay': 0.003217795852714664, 'weightedloss': False}. Best is trial 97 with value: 82.53333282470703.
/home/wxy/miniconda3/lib/python3.10/site-packages/optuna/distributions.py:685: UserWarning: The distribution is specified by [0, 1.00001] and step=0.05, but the range is not divisible by `step`. It will be replaced by [0, 1.0].
  warnings.warn(
K:  9
alpha:  1.0
lr:  0.0024541130605338756
weight_decay:  0.006733635865172556
dropout:  0.6000000000000001
fix split and run 3 times
Data: Data(x=[19717, 500], y=[19717], train_mask=[19717], val_mask=[19717], test_mask=[19717], adj_t=[19717, 19717, nnz=88648])
num_train tensor(60)
num_noise 0
noise: tensor(0)
data feature 500
ALTOPT(
  (lins): Sequential(
    (0): Linear(in_features=500, out_features=64, bias=True)
    (1): BatchNorm1d(64, eps=1e-05, momentum=0.1, affine=True, track_running_stats=True)
    (2): Dropout(p=0.6000000000000001, inplace=True)
    (3): ReLU(inplace=True)
    (4): Linear(in_features=64, out_features=3, bias=True)
    (5): Identity()
  )
  (prop): Propagation(K=9, mode=None, lambda1=None, lambda2=None, L21=True, alpha=1.0)
  (gcn): GCN(
    (convs): ModuleList(
      (0): GCNConv(500, 64)
      (1): GCNConv(64, 3)
    )
    (bns): ModuleList(
      (0): BatchNorm1d(64, eps=1e-05, momentum=0.1, affine=True, track_running_stats=True)
    )
    (output): Identity()
  )
)
propagate done
init label
Split: 01, Run: 01
None time:  1.5409061340615153
None Run 01:
Highest Train: 100.00
Highest Valid: 80.60
  Final Train: 100.00
   Final Test: 78.20
Split: 01, Run: 02
None time:  2.883189738029614
None Run 02:
Highest Train: 100.00
Highest Valid: 78.60
  Final Train: 100.00
   Final Test: 78.50
Split: 01, Run: 03
None time:  1.014068563003093
None Run 03:
Highest Train: 100.00
Highest Valid: 77.60
  Final Train: 100.00
   Final Test: 75.30
run time now: 5.534784555435181
total time:  5.612867736956105
None All runs:
Highest Train: 100.00 ± 0.00
Highest Valid: 78.93 ± 1.53
  Final Train: 100.00 ± 0.00
   Final Test: 77.33 ± 1.77
[I 2023-06-12 00:21:40,688] Trial 106 finished with value: 78.93333435058594 and parameters: {'Fwd': 1.861418922171865e-06, 'K': 9, 'alpha': 1.0, 'dropout': 0.6000000000000001, 'gnnepoch': 80, 'lambda1': 0.55, 'lambda2': 7.464948372220576, 'loop': 1, 'loss': 'MSE', 'lr': 0.0024541130605338756, 'softmaxF': False, 'useGCN': False, 'weight_decay': 0.006733635865172556, 'weightedloss': False}. Best is trial 97 with value: 82.53333282470703.
/home/wxy/miniconda3/lib/python3.10/site-packages/optuna/distributions.py:685: UserWarning: The distribution is specified by [0, 1.00001] and step=0.05, but the range is not divisible by `step`. It will be replaced by [0, 1.0].
  warnings.warn(
K:  9
alpha:  0.9500000000000001
lr:  0.0017527579140569822
weight_decay:  0.0021361705862199777
dropout:  0.7000000000000001
fix split and run 3 times
Data: Data(x=[19717, 500], y=[19717], train_mask=[19717], val_mask=[19717], test_mask=[19717], adj_t=[19717, 19717, nnz=88648])
num_train tensor(60)
num_noise 0
noise: tensor(0)
data feature 500
ALTOPT(
  (lins): Sequential(
    (0): Linear(in_features=500, out_features=64, bias=True)
    (1): BatchNorm1d(64, eps=1e-05, momentum=0.1, affine=True, track_running_stats=True)
    (2): Dropout(p=0.7000000000000001, inplace=True)
    (3): ReLU(inplace=True)
    (4): Linear(in_features=64, out_features=3, bias=True)
    (5): Identity()
  )
  (prop): Propagation(K=9, mode=None, lambda1=None, lambda2=None, L21=True, alpha=0.9500000000000001)
  (gcn): GCN(
    (convs): ModuleList(
      (0): GCNConv(500, 64)
      (1): GCNConv(64, 3)
    )
    (bns): ModuleList(
      (0): BatchNorm1d(64, eps=1e-05, momentum=0.1, affine=True, track_running_stats=True)
    )
    (output): Identity()
  )
)
propagate done
init label
Split: 01, Run: 01
None time:  1.6899189949035645
None Run 01:
Highest Train: 100.00
Highest Valid: 82.40
  Final Train: 100.00
   Final Test: 78.60
Split: 01, Run: 02
None time:  1.241336887003854
None Run 02:
Highest Train: 100.00
Highest Valid: 83.00
  Final Train: 100.00
   Final Test: 78.70
Split: 01, Run: 03
None time:  2.204629770014435
None Run 03:
Highest Train: 100.00
Highest Valid: 82.80
  Final Train: 100.00
   Final Test: 78.80
run time now: 5.186446666717529
total time:  5.2375838190782815
None All runs:
Highest Train: 100.00 ± 0.00
Highest Valid: 82.73 ± 0.31
  Final Train: 100.00 ± 0.00
   Final Test: 78.70 ± 0.10
