[I 2023-06-12 00:16:22,798] Trial 35 finished with value: 72.5999984741211 and parameters: {'Fwd': 0.004809483732644334, 'K': 3, 'alpha': 0.75, 'dropout': 0.2, 'gnnepoch': 40, 'lambda1': 0.0, 'lambda2': 6.128298632982876, 'loop': 1, 'loss': 'MSE', 'lr': 0.009871690091029933, 'softmaxF': False, 'useGCN': True, 'weight_decay': 0.0005061521351028191, 'weightedloss': True}. Best is trial 31 with value: 80.26666259765625.
/home/wxy/miniconda3/lib/python3.10/site-packages/optuna/distributions.py:685: UserWarning: The distribution is specified by [0, 1.00001] and step=0.05, but the range is not divisible by `step`. It will be replaced by [0, 1.0].
  warnings.warn(
K:  4
alpha:  0.65
lr:  0.005864649973087782
weight_decay:  0.00112931526732048
dropout:  0.4
fix split and run 3 times
Data: Data(x=[2708, 1433], y=[2708], train_mask=[2708], val_mask=[2708], test_mask=[2708], adj_t=[2708, 2708, nnz=10556])
num_train tensor(140)
num_noise 0
noise: tensor(0)
data feature 1433
ALTOPT(
  (lins): Sequential(
    (0): Linear(in_features=1433, out_features=64, bias=True)
    (1): BatchNorm1d(64, eps=1e-05, momentum=0.1, affine=True, track_running_stats=True)
    (2): Dropout(p=0.4, inplace=True)
    (3): ReLU(inplace=True)
    (4): Linear(in_features=64, out_features=7, bias=True)
    (5): Identity()
  )
  (prop): Propagation(K=4, mode=None, lambda1=None, lambda2=None, L21=True, alpha=0.65)
  (gcn): GCN(
    (convs): ModuleList(
      (0): GCNConv(1433, 64)
      (1): GCNConv(64, 7)
    )
    (bns): ModuleList(
      (0): BatchNorm1d(64, eps=1e-05, momentum=0.1, affine=True, track_running_stats=True)
    )
    (output): Identity()
  )
)
propagate done
init label
Split: 01, Run: 01, Epoch: 100, Loss: 0.0000, Train: 100.00%, Valid: 79.80% Test: 79.40%
Split: 01, Run: 01
None time:  3.338575383881107
None Run 01:
Highest Train: 100.00
Highest Valid: 79.80
  Final Train: 100.00
   Final Test: 79.20
Split: 01, Run: 02
None time:  1.8761060698889196
None Run 02:
Highest Train: 100.00
Highest Valid: 80.40
  Final Train: 100.00
   Final Test: 80.50
Split: 01, Run: 03, Epoch: 100, Loss: 0.0000, Train: 100.00%, Valid: 79.80% Test: 79.40%
Split: 01, Run: 03
None time:  3.171648055082187
None Run 03:
Highest Train: 100.00
Highest Valid: 79.80
  Final Train: 100.00
   Final Test: 79.40
run time now: 8.40669298171997
total time:  8.423340117093176
None All runs:
Highest Train: 100.00 ± 0.00
Highest Valid: 80.00 ± 0.35
  Final Train: 100.00 ± 0.00
   Final Test: 79.70 ± 0.70
[I 2023-06-12 00:16:31,826] Trial 36 finished with value: 80.0 and parameters: {'Fwd': 0.01984331910937991, 'K': 4, 'alpha': 0.65, 'dropout': 0.4, 'gnnepoch': 90, 'lambda1': 0.2, 'lambda2': 4.349883017256095, 'loop': 0, 'loss': 'MSE', 'lr': 0.005864649973087782, 'softmaxF': False, 'useGCN': True, 'weight_decay': 0.00112931526732048, 'weightedloss': False}. Best is trial 31 with value: 80.26666259765625.
/home/wxy/miniconda3/lib/python3.10/site-packages/optuna/distributions.py:685: UserWarning: The distribution is specified by [0, 1.00001] and step=0.05, but the range is not divisible by `step`. It will be replaced by [0, 1.0].
  warnings.warn(
K:  2
alpha:  0.65
lr:  0.006814166844873412
weight_decay:  0.0003852522509761057
dropout:  0.4
fix split and run 3 times
Data: Data(x=[2708, 1433], y=[2708], train_mask=[2708], val_mask=[2708], test_mask=[2708], adj_t=[2708, 2708, nnz=10556])
num_train tensor(140)
num_noise 0
noise: tensor(0)
data feature 1433
ALTOPT(
  (lins): Sequential(
    (0): Linear(in_features=1433, out_features=64, bias=True)
    (1): BatchNorm1d(64, eps=1e-05, momentum=0.1, affine=True, track_running_stats=True)
    (2): Dropout(p=0.4, inplace=True)
    (3): ReLU(inplace=True)
    (4): Linear(in_features=64, out_features=7, bias=True)
    (5): Identity()
  )
  (prop): Propagation(K=2, mode=None, lambda1=None, lambda2=None, L21=True, alpha=0.65)
  (gcn): GCN(
    (convs): ModuleList(
      (0): GCNConv(1433, 64)
      (1): GCNConv(64, 7)
    )
    (bns): ModuleList(
      (0): BatchNorm1d(64, eps=1e-05, momentum=0.1, affine=True, track_running_stats=True)
    )
    (output): Identity()
  )
)
propagate done
init label
Split: 01, Run: 01, Epoch: 100, Loss: 0.0000, Train: 100.00%, Valid: 79.80% Test: 78.60%
Split: 01, Run: 01
None time:  3.3322673321235925
None Run 01:
Highest Train: 100.00
Highest Valid: 79.80
  Final Train: 100.00
   Final Test: 78.60
Split: 01, Run: 02, Epoch: 100, Loss: 0.0000, Train: 100.00%, Valid: 78.60% Test: 78.80%
Split: 01, Run: 02
None time:  3.1037773790303618
None Run 02:
Highest Train: 100.00
Highest Valid: 78.60
  Final Train: 100.00
   Final Test: 78.70
Split: 01, Run: 03, Epoch: 100, Loss: 0.0000, Train: 100.00%, Valid: 79.40% Test: 78.40%
Split: 01, Run: 03
None time:  3.076035693055019
None Run 03:
Highest Train: 100.00
Highest Valid: 79.40
  Final Train: 100.00
   Final Test: 78.10
run time now: 9.53416395187378
total time:  9.560388612095267
None All runs:
Highest Train: 100.00 ± 0.00
Highest Valid: 79.27 ± 0.61
  Final Train: 100.00 ± 0.00
   Final Test: 78.47 ± 0.32
[I 2023-06-12 00:16:41,901] Trial 37 finished with value: 79.26666259765625 and parameters: {'Fwd': 0.02210758287912289, 'K': 2, 'alpha': 0.65, 'dropout': 0.4, 'gnnepoch': 110, 'lambda1': 0.2, 'lambda2': 4.698920631544495, 'loop': 0, 'loss': 'MSE', 'lr': 0.006814166844873412, 'softmaxF': False, 'useGCN': True, 'weight_decay': 0.0003852522509761057, 'weightedloss': False}. Best is trial 31 with value: 80.26666259765625.
/home/wxy/miniconda3/lib/python3.10/site-packages/optuna/distributions.py:685: UserWarning: The distribution is specified by [0, 1.00001] and step=0.05, but the range is not divisible by `step`. It will be replaced by [0, 1.0].
  warnings.warn(
K:  4
alpha:  0.55
lr:  0.0033993317824266606
weight_decay:  0.0027060218139833853
dropout:  0.1
fix split and run 3 times
Data: Data(x=[2708, 1433], y=[2708], train_mask=[2708], val_mask=[2708], test_mask=[2708], adj_t=[2708, 2708, nnz=10556])
num_train tensor(140)
num_noise 0
noise: tensor(0)
data feature 1433
ALTOPT(
  (lins): Sequential(
    (0): Linear(in_features=1433, out_features=64, bias=True)
    (1): BatchNorm1d(64, eps=1e-05, momentum=0.1, affine=True, track_running_stats=True)
    (2): Dropout(p=0.1, inplace=True)
    (3): ReLU(inplace=True)
    (4): Linear(in_features=64, out_features=7, bias=True)
    (5): Identity()
  )
  (prop): Propagation(K=4, mode=None, lambda1=None, lambda2=None, L21=True, alpha=0.55)
  (gcn): GCN(
    (convs): ModuleList(
      (0): GCNConv(1433, 64)
      (1): GCNConv(64, 7)
    )
    (bns): ModuleList(
      (0): BatchNorm1d(64, eps=1e-05, momentum=0.1, affine=True, track_running_stats=True)
    )
    (output): Identity()
  )
)
propagate done
init label
Split: 01, Run: 01, Epoch: 100, Loss: 0.0000, Train: 100.00%, Valid: 79.40% Test: 79.30%
Split: 01, Run: 01
None time:  2.8054203728679568
None Run 01:
Highest Train: 100.00
Highest Valid: 79.40
  Final Train: 100.00
   Final Test: 79.30
Split: 01, Run: 02, Epoch: 100, Loss: 0.0000, Train: 100.00%, Valid: 80.20% Test: 79.20%
Split: 01, Run: 02
None time:  3.106595109915361
None Run 02:
Highest Train: 100.00
Highest Valid: 80.20
  Final Train: 100.00
   Final Test: 79.20
Split: 01, Run: 03, Epoch: 100, Loss: 0.0000, Train: 100.00%, Valid: 79.60% Test: 78.70%
Split: 01, Run: 03
None time:  2.976278297835961
None Run 03:
Highest Train: 100.00
Highest Valid: 79.60
  Final Train: 100.00
   Final Test: 78.60
run time now: 8.912968635559082
total time:  8.932120203971863
None All runs:
Highest Train: 100.00 ± 0.00
Highest Valid: 79.73 ± 0.42
  Final Train: 100.00 ± 0.00
   Final Test: 79.03 ± 0.38
[I 2023-06-12 00:16:51,319] Trial 38 finished with value: 79.73333740234375 and parameters: {'Fwd': 0.0021314231667682866, 'K': 4, 'alpha': 0.55, 'dropout': 0.1, 'gnnepoch': 90, 'lambda1': 0.6000000000000001, 'lambda2': 4.759158181739015, 'loop': 0, 'loss': 'MSE', 'lr': 0.0033993317824266606, 'softmaxF': False, 'useGCN': True, 'weight_decay': 0.0027060218139833853, 'weightedloss': False}. Best is trial 31 with value: 80.26666259765625.
/home/wxy/miniconda3/lib/python3.10/site-packages/optuna/distributions.py:685: UserWarning: The distribution is specified by [0, 1.00001] and step=0.05, but the range is not divisible by `step`. It will be replaced by [0, 1.0].
  warnings.warn(
K:  3
alpha:  0.0
lr:  0.0013878026352155527
weight_decay:  0.005105238989765077
dropout:  0.5
fix split and run 3 times
Data: Data(x=[2708, 1433], y=[2708], train_mask=[2708], val_mask=[2708], test_mask=[2708], adj_t=[2708, 2708, nnz=10556])
num_train tensor(140)
num_noise 0
noise: tensor(0)
data feature 1433
ALTOPT(
  (lins): Sequential(
    (0): Linear(in_features=1433, out_features=64, bias=True)
    (1): BatchNorm1d(64, eps=1e-05, momentum=0.1, affine=True, track_running_stats=True)
    (2): Dropout(p=0.5, inplace=True)
    (3): ReLU(inplace=True)
    (4): Linear(in_features=64, out_features=7, bias=True)
    (5): Identity()
  )
  (prop): Propagation(K=3, mode=None, lambda1=None, lambda2=None, L21=True, alpha=0.0)
  (gcn): GCN(
    (convs): ModuleList(
      (0): GCNConv(1433, 64)
      (1): GCNConv(64, 7)
    )
    (bns): ModuleList(
      (0): BatchNorm1d(64, eps=1e-05, momentum=0.1, affine=True, track_running_stats=True)
    )
    (output): Identity()
  )
)
propagate done
init label
Split: 01, Run: 01, Epoch: 100, Loss: 0.0000, Train: 100.00%, Valid: 79.40% Test: 80.70%
Split: 01, Run: 01
None time:  3.3825018079951406
None Run 01:
Highest Train: 100.00
Highest Valid: 79.40
  Final Train: 100.00
   Final Test: 80.60
Split: 01, Run: 02, Epoch: 100, Loss: 0.0000, Train: 100.00%, Valid: 79.40% Test: 81.40%
Split: 01, Run: 02
None time:  3.046275335829705
None Run 02:
Highest Train: 100.00
Highest Valid: 79.40
  Final Train: 100.00
   Final Test: 81.10
Split: 01, Run: 03, Epoch: 100, Loss: 0.0000, Train: 100.00%, Valid: 79.00% Test: 81.10%
Split: 01, Run: 03
None time:  3.2602955638431013
None Run 03:
Highest Train: 100.00
Highest Valid: 79.00
  Final Train: 100.00
   Final Test: 81.10
run time now: 9.749881505966187
total time:  9.783421250991523
None All runs:
Highest Train: 100.00 ± 0.00
Highest Valid: 79.27 ± 0.23
  Final Train: 100.00 ± 0.00
   Final Test: 80.93 ± 0.29
[I 2023-06-12 00:17:01,629] Trial 39 finished with value: 79.26667022705078 and parameters: {'Fwd': 0.0558604077535767, 'K': 3, 'alpha': 0.0, 'dropout': 0.5, 'gnnepoch': 110, 'lambda1': 0.30000000000000004, 'lambda2': 4.370068410831479, 'loop': 0, 'loss': 'MSE', 'lr': 0.0013878026352155527, 'softmaxF': True, 'useGCN': True, 'weight_decay': 0.005105238989765077, 'weightedloss': False}. Best is trial 31 with value: 80.26666259765625.
/home/wxy/miniconda3/lib/python3.10/site-packages/optuna/distributions.py:685: UserWarning: The distribution is specified by [0, 1.00001] and step=0.05, but the range is not divisible by `step`. It will be replaced by [0, 1.0].
  warnings.warn(
K:  1
alpha:  0.5
lr:  0.005597385684473243
weight_decay:  0.0005072704043142196
dropout:  0.30000000000000004
fix split and run 3 times
Data: Data(x=[2708, 1433], y=[2708], train_mask=[2708], val_mask=[2708], test_mask=[2708], adj_t=[2708, 2708, nnz=10556])
num_train tensor(140)
num_noise 0
noise: tensor(0)
data feature 1433
ALTOPT(
  (lins): Sequential(
    (0): Linear(in_features=1433, out_features=64, bias=True)
    (1): BatchNorm1d(64, eps=1e-05, momentum=0.1, affine=True, track_running_stats=True)
    (2): Dropout(p=0.30000000000000004, inplace=True)
    (3): ReLU(inplace=True)
    (4): Linear(in_features=64, out_features=7, bias=True)
    (5): Identity()
  )
  (prop): Propagation(K=1, mode=None, lambda1=None, lambda2=None, L21=True, alpha=0.5)
  (gcn): GCN(
    (convs): ModuleList(
      (0): GCNConv(1433, 64)
      (1): GCNConv(64, 7)
    )
    (bns): ModuleList(
      (0): BatchNorm1d(64, eps=1e-05, momentum=0.1, affine=True, track_running_stats=True)
    )
    (output): Identity()
  )
)
propagate done
init label
Split: 01, Run: 01, Epoch: 100, Loss: 0.0000, Train: 100.00%, Valid: 73.00% Test: 75.10%
Split: 01, Run: 01
None time:  1.197469212114811
None Run 01:
Highest Train: 100.00
Highest Valid: 73.00
  Final Train: 100.00
   Final Test: 75.10
Split: 01, Run: 02, Epoch: 100, Loss: 0.0000, Train: 100.00%, Valid: 76.00% Test: 77.50%
Split: 01, Run: 02
None time:  1.5057545730378479
None Run 02:
Highest Train: 100.00
Highest Valid: 76.00
  Final Train: 100.00
   Final Test: 77.50
Split: 01, Run: 03, Epoch: 100, Loss: 0.0000, Train: 100.00%, Valid: 74.00% Test: 76.90%
Split: 01, Run: 03
None time:  1.504443434998393
None Run 03:
Highest Train: 100.00
Highest Valid: 74.00
  Final Train: 100.00
   Final Test: 76.30
run time now: 4.2301976680755615
total time:  4.254099414916709
None All runs:
Highest Train: 100.00 ± 0.00
Highest Valid: 74.33 ± 1.53
  Final Train: 100.00 ± 0.00
   Final Test: 76.30 ± 1.20
[I 2023-06-12 00:17:06,383] Trial 40 finished with value: 74.33333587646484 and parameters: {'Fwd': 0.029994876412995426, 'K': 1, 'alpha': 0.5, 'dropout': 0.30000000000000004, 'gnnepoch': 100, 'lambda1': 0.45, 'lambda2': 5.288506987377546, 'loop': 0, 'loss': 'MSE', 'lr': 0.005597385684473243, 'softmaxF': False, 'useGCN': False, 'weight_decay': 0.0005072704043142196, 'weightedloss': False}. Best is trial 31 with value: 80.26666259765625.
/home/wxy/miniconda3/lib/python3.10/site-packages/optuna/distributions.py:685: UserWarning: The distribution is specified by [0, 1.00001] and step=0.05, but the range is not divisible by `step`. It will be replaced by [0, 1.0].
  warnings.warn(
K:  5
alpha:  0.7000000000000001
lr:  0.004069419018463031
weight_decay:  0.001182849112995525
dropout:  0.4
fix split and run 3 times
Data: Data(x=[2708, 1433], y=[2708], train_mask=[2708], val_mask=[2708], test_mask=[2708], adj_t=[2708, 2708, nnz=10556])
num_train tensor(140)
num_noise 0
noise: tensor(0)
data feature 1433
ALTOPT(
  (lins): Sequential(
    (0): Linear(in_features=1433, out_features=64, bias=True)
    (1): BatchNorm1d(64, eps=1e-05, momentum=0.1, affine=True, track_running_stats=True)
    (2): Dropout(p=0.4, inplace=True)
    (3): ReLU(inplace=True)
    (4): Linear(in_features=64, out_features=7, bias=True)
    (5): Identity()
  )
  (prop): Propagation(K=5, mode=None, lambda1=None, lambda2=None, L21=True, alpha=0.7000000000000001)
  (gcn): GCN(
    (convs): ModuleList(
      (0): GCNConv(1433, 64)
      (1): GCNConv(64, 7)
    )
    (bns): ModuleList(
      (0): BatchNorm1d(64, eps=1e-05, momentum=0.1, affine=True, track_running_stats=True)
    )
    (output): Identity()
  )
)
propagate done
init label
Split: 01, Run: 01
None time:  2.9549794669728726
None Run 01:
Highest Train: 100.00
Highest Valid: 79.20
  Final Train: 100.00
   Final Test: 79.00
Split: 01, Run: 02
None time:  2.179922765120864
None Run 02:
Highest Train: 100.00
Highest Valid: 80.20
  Final Train: 100.00
   Final Test: 80.50
Split: 01, Run: 03
None time:  1.8046136940829456
None Run 03:
Highest Train: 100.00
Highest Valid: 79.20
  Final Train: 100.00
   Final Test: 80.30
run time now: 6.966523885726929
total time:  6.992924500955269
None All runs:
Highest Train: 100.00 ± 0.00
Highest Valid: 79.53 ± 0.58
  Final Train: 100.00 ± 0.00
   Final Test: 79.93 ± 0.81
[I 2023-06-12 00:17:13,902] Trial 41 finished with value: 79.53333282470703 and parameters: {'Fwd': 0.01569256642619218, 'K': 5, 'alpha': 0.7000000000000001, 'dropout': 0.4, 'gnnepoch': 70, 'lambda1': 0.1, 'lambda2': 7.421607322603961, 'loop': 1, 'loss': 'MSE', 'lr': 0.004069419018463031, 'softmaxF': False, 'useGCN': True, 'weight_decay': 0.001182849112995525, 'weightedloss': False}. Best is trial 31 with value: 80.26666259765625.
/home/wxy/miniconda3/lib/python3.10/site-packages/optuna/distributions.py:685: UserWarning: The distribution is specified by [0, 1.00001] and step=0.05, but the range is not divisible by `step`. It will be replaced by [0, 1.0].
  warnings.warn(
K:  6
alpha:  0.8
lr:  0.005458423959289021
weight_decay:  0.0015152070498072878
dropout:  0.6000000000000001
fix split and run 3 times
Data: Data(x=[2708, 1433], y=[2708], train_mask=[2708], val_mask=[2708], test_mask=[2708], adj_t=[2708, 2708, nnz=10556])
num_train tensor(140)
num_noise 0
noise: tensor(0)
data feature 1433
ALTOPT(
  (lins): Sequential(
    (0): Linear(in_features=1433, out_features=64, bias=True)
    (1): BatchNorm1d(64, eps=1e-05, momentum=0.1, affine=True, track_running_stats=True)
    (2): Dropout(p=0.6000000000000001, inplace=True)
    (3): ReLU(inplace=True)
    (4): Linear(in_features=64, out_features=7, bias=True)
    (5): Identity()
  )
  (prop): Propagation(K=6, mode=None, lambda1=None, lambda2=None, L21=True, alpha=0.8)
  (gcn): GCN(
    (convs): ModuleList(
      (0): GCNConv(1433, 64)
      (1): GCNConv(64, 7)
    )
    (bns): ModuleList(
      (0): BatchNorm1d(64, eps=1e-05, momentum=0.1, affine=True, track_running_stats=True)
    )
    (output): Identity()
  )
)
propagate done
init label
Split: 01, Run: 01
None time:  1.9466556790284812
None Run 01:
Highest Train: 100.00
Highest Valid: 79.00
  Final Train: 100.00
   Final Test: 79.70
Split: 01, Run: 02
None time:  2.7529498550575227
None Run 02:
Highest Train: 100.00
Highest Valid: 80.40
  Final Train: 100.00
   Final Test: 80.20
Split: 01, Run: 03
None time:  2.122788071865216
None Run 03:
Highest Train: 100.00
Highest Valid: 79.80
  Final Train: 100.00
   Final Test: 80.20
run time now: 6.859798908233643
total time:  6.880697576794773
None All runs:
Highest Train: 100.00 ± 0.00
Highest Valid: 79.73 ± 0.70
  Final Train: 100.00 ± 0.00
   Final Test: 80.03 ± 0.29
[I 2023-06-12 00:17:21,370] Trial 42 finished with value: 79.73332977294922 and parameters: {'Fwd': 0.02826704103539328, 'K': 6, 'alpha': 0.8, 'dropout': 0.6000000000000001, 'gnnepoch': 80, 'lambda1': 0.15000000000000002, 'lambda2': 9.509681627058846, 'loop': 1, 'loss': 'MSE', 'lr': 0.005458423959289021, 'softmaxF': False, 'useGCN': True, 'weight_decay': 0.0015152070498072878, 'weightedloss': False}. Best is trial 31 with value: 80.26666259765625.
/home/wxy/miniconda3/lib/python3.10/site-packages/optuna/distributions.py:685: UserWarning: The distribution is specified by [0, 1.00001] and step=0.05, but the range is not divisible by `step`. It will be replaced by [0, 1.0].
  warnings.warn(
K:  4
alpha:  0.6000000000000001
lr:  0.004771297032897276
weight_decay:  0.0007697649444636374
dropout:  0.1
fix split and run 3 times
Data: Data(x=[2708, 1433], y=[2708], train_mask=[2708], val_mask=[2708], test_mask=[2708], adj_t=[2708, 2708, nnz=10556])
num_train tensor(140)
num_noise 0
noise: tensor(0)
data feature 1433
ALTOPT(
  (lins): Sequential(
    (0): Linear(in_features=1433, out_features=64, bias=True)
    (1): BatchNorm1d(64, eps=1e-05, momentum=0.1, affine=True, track_running_stats=True)
    (2): Dropout(p=0.1, inplace=True)
    (3): ReLU(inplace=True)
    (4): Linear(in_features=64, out_features=7, bias=True)
    (5): Identity()
  )
  (prop): Propagation(K=4, mode=None, lambda1=None, lambda2=None, L21=True, alpha=0.6000000000000001)
  (gcn): GCN(
    (convs): ModuleList(
      (0): GCNConv(1433, 64)
      (1): GCNConv(64, 7)
    )
    (bns): ModuleList(
      (0): BatchNorm1d(64, eps=1e-05, momentum=0.1, affine=True, track_running_stats=True)
    )
    (output): Identity()
  )
)
propagate done
init label
Split: 01, Run: 01
None time:  1.8679939091671258
None Run 01:
Highest Train: 100.00
Highest Valid: 78.80
  Final Train: 100.00
   Final Test: 79.50
Split: 01, Run: 02
None time:  1.52211380796507
None Run 02:
Highest Train: 100.00
Highest Valid: 78.20
  Final Train: 100.00
   Final Test: 78.80
Split: 01, Run: 03
None time:  2.8206283741164953
None Run 03:
Highest Train: 100.00
Highest Valid: 79.40
  Final Train: 100.00
   Final Test: 80.60
run time now: 6.2363879680633545
total time:  6.264210688183084
None All runs:
Highest Train: 100.00 ± 0.00
Highest Valid: 78.80 ± 0.60
  Final Train: 100.00 ± 0.00
   Final Test: 79.63 ± 0.91
