[I 2023-06-12 00:48:24,851] Trial 385 finished with value: 78.86666870117188 and parameters: {'Fwd': 0.07988430486382302, 'K': 9, 'alpha': 0.6000000000000001, 'dropout': 0.4, 'gnnepoch': 70, 'lambda1': 0.75, 'lambda2': 5.656013528380432, 'loop': 1, 'loss': 'MSE', 'lr': 0.006307819158372166, 'softmaxF': True, 'useGCN': True, 'weight_decay': 0.008070613560281072, 'weightedloss': False}. Best is trial 112 with value: 81.66667175292969.
/home/wxy/miniconda3/lib/python3.10/site-packages/optuna/distributions.py:685: UserWarning: The distribution is specified by [0, 1.00001] and step=0.05, but the range is not divisible by `step`. It will be replaced by [0, 1.0].
  warnings.warn(
K:  10
alpha:  0.65
lr:  0.008352246181293608
weight_decay:  5.8992663949363256e-05
dropout:  0.30000000000000004
fix split and run 3 times
Data: Data(x=[2708, 1433], y=[2708], train_mask=[2708], val_mask=[2708], test_mask=[2708], adj_t=[2708, 2708, nnz=10556])
num_train tensor(140)
num_noise 0
noise: tensor(0)
data feature 1433
ALTOPT(
  (lins): Sequential(
    (0): Linear(in_features=1433, out_features=64, bias=True)
    (1): BatchNorm1d(64, eps=1e-05, momentum=0.1, affine=True, track_running_stats=True)
    (2): Dropout(p=0.30000000000000004, inplace=True)
    (3): ReLU(inplace=True)
    (4): Linear(in_features=64, out_features=7, bias=True)
    (5): LogSoftmax(dim=-1)
  )
  (prop): Propagation(K=10, mode=None, lambda1=None, lambda2=None, L21=True, alpha=0.65)
  (gcn): GCN(
    (convs): ModuleList(
      (0): GCNConv(1433, 64)
      (1): GCNConv(64, 7)
    )
    (bns): ModuleList(
      (0): BatchNorm1d(64, eps=1e-05, momentum=0.1, affine=True, track_running_stats=True)
    )
    (output): LogSoftmax(dim=-1)
  )
)
propagate done
init label
Split: 01, Run: 01
None time:  1.6680244531016797
None Run 01:
Highest Train: 100.00
Highest Valid: 81.60
  Final Train: 100.00
   Final Test: 82.10
Split: 01, Run: 02
None time:  1.7268165070563555
None Run 02:
Highest Train: 100.00
Highest Valid: 81.20
  Final Train: 100.00
   Final Test: 81.20
Split: 01, Run: 03
None time:  1.4664242730941623
None Run 03:
Highest Train: 100.00
Highest Valid: 80.20
  Final Train: 100.00
   Final Test: 81.30
run time now: 4.889404296875
total time:  4.90570768318139
None All runs:
Highest Train: 100.00 ± 0.00
Highest Valid: 81.00 ± 0.72
  Final Train: 100.00 ± 0.00
   Final Test: 81.53 ± 0.49
[I 2023-06-12 00:48:30,322] Trial 386 finished with value: 80.99999237060547 and parameters: {'Fwd': 0.009810493784277311, 'K': 10, 'alpha': 0.65, 'dropout': 0.30000000000000004, 'gnnepoch': 60, 'lambda1': 0.8500000000000001, 'lambda2': 6.115617490382622, 'loop': 1, 'loss': 'CE', 'lr': 0.008352246181293608, 'softmaxF': True, 'useGCN': True, 'weight_decay': 5.8992663949363256e-05, 'weightedloss': False}. Best is trial 112 with value: 81.66667175292969.
/home/wxy/miniconda3/lib/python3.10/site-packages/optuna/distributions.py:685: UserWarning: The distribution is specified by [0, 1.00001] and step=0.05, but the range is not divisible by `step`. It will be replaced by [0, 1.0].
  warnings.warn(
K:  10
alpha:  0.5
lr:  0.003791063481700466
weight_decay:  0.0002081819657969988
dropout:  0.4
fix split and run 3 times
Data: Data(x=[2708, 1433], y=[2708], train_mask=[2708], val_mask=[2708], test_mask=[2708], adj_t=[2708, 2708, nnz=10556])
num_train tensor(140)
num_noise 0
noise: tensor(0)
data feature 1433
ALTOPT(
  (lins): Sequential(
    (0): Linear(in_features=1433, out_features=64, bias=True)
    (1): BatchNorm1d(64, eps=1e-05, momentum=0.1, affine=True, track_running_stats=True)
    (2): Dropout(p=0.4, inplace=True)
    (3): ReLU(inplace=True)
    (4): Linear(in_features=64, out_features=7, bias=True)
    (5): LogSoftmax(dim=-1)
  )
  (prop): Propagation(K=10, mode=None, lambda1=None, lambda2=None, L21=True, alpha=0.5)
  (gcn): GCN(
    (convs): ModuleList(
      (0): GCNConv(1433, 64)
      (1): GCNConv(64, 7)
    )
    (bns): ModuleList(
      (0): BatchNorm1d(64, eps=1e-05, momentum=0.1, affine=True, track_running_stats=True)
    )
    (output): LogSoftmax(dim=-1)
  )
)
propagate done
init label
Split: 01, Run: 01
None time:  1.8968843859620392
None Run 01:
Highest Train: 100.00
Highest Valid: 81.00
  Final Train: 100.00
   Final Test: 82.30
Split: 01, Run: 02
None time:  1.7050661710090935
None Run 02:
Highest Train: 100.00
Highest Valid: 81.40
  Final Train: 100.00
   Final Test: 82.00
Split: 01, Run: 03
None time:  0.960625003091991
None Run 03:
Highest Train: 100.00
Highest Valid: 81.20
  Final Train: 100.00
   Final Test: 81.00
run time now: 4.5912230014801025
total time:  4.6058227240573615
None All runs:
Highest Train: 100.00 ± 0.00
Highest Valid: 81.20 ± 0.20
  Final Train: 100.00 ± 0.00
   Final Test: 81.77 ± 0.68
[I 2023-06-12 00:48:35,437] Trial 387 finished with value: 81.19999694824219 and parameters: {'Fwd': 0.09971456021729146, 'K': 10, 'alpha': 0.5, 'dropout': 0.4, 'gnnepoch': 50, 'lambda1': 0.8, 'lambda2': 4.817115158331738, 'loop': 1, 'loss': 'CE', 'lr': 0.003791063481700466, 'softmaxF': True, 'useGCN': True, 'weight_decay': 0.0002081819657969988, 'weightedloss': True}. Best is trial 112 with value: 81.66667175292969.
/home/wxy/miniconda3/lib/python3.10/site-packages/optuna/distributions.py:685: UserWarning: The distribution is specified by [0, 1.00001] and step=0.05, but the range is not divisible by `step`. It will be replaced by [0, 1.0].
  warnings.warn(
K:  10
alpha:  0.7000000000000001
lr:  0.007607950267047113
weight_decay:  4.1339362319536934e-05
dropout:  0.4
fix split and run 3 times
Data: Data(x=[2708, 1433], y=[2708], train_mask=[2708], val_mask=[2708], test_mask=[2708], adj_t=[2708, 2708, nnz=10556])
num_train tensor(140)
num_noise 0
noise: tensor(0)
data feature 1433
ALTOPT(
  (lins): Sequential(
    (0): Linear(in_features=1433, out_features=64, bias=True)
    (1): BatchNorm1d(64, eps=1e-05, momentum=0.1, affine=True, track_running_stats=True)
    (2): Dropout(p=0.4, inplace=True)
    (3): ReLU(inplace=True)
    (4): Linear(in_features=64, out_features=7, bias=True)
    (5): LogSoftmax(dim=-1)
  )
  (prop): Propagation(K=10, mode=None, lambda1=None, lambda2=None, L21=True, alpha=0.7000000000000001)
  (gcn): GCN(
    (convs): ModuleList(
      (0): GCNConv(1433, 64)
      (1): GCNConv(64, 7)
    )
    (bns): ModuleList(
      (0): BatchNorm1d(64, eps=1e-05, momentum=0.1, affine=True, track_running_stats=True)
    )
    (output): LogSoftmax(dim=-1)
  )
)
propagate done
init label
Split: 01, Run: 01
None time:  1.6500191008672118
None Run 01:
Highest Train: 100.00
Highest Valid: 81.80
  Final Train: 100.00
   Final Test: 82.00
Split: 01, Run: 02
None time:  1.6565450860653073
None Run 02:
Highest Train: 100.00
Highest Valid: 80.80
  Final Train: 100.00
   Final Test: 81.00
Split: 01, Run: 03
None time:  1.524674422107637
None Run 03:
Highest Train: 100.00
Highest Valid: 80.60
  Final Train: 100.00
   Final Test: 81.00
run time now: 4.873728275299072
total time:  4.894176797941327
None All runs:
Highest Train: 100.00 ± 0.00
Highest Valid: 81.07 ± 0.64
  Final Train: 100.00 ± 0.00
   Final Test: 81.33 ± 0.58
[I 2023-06-12 00:48:40,990] Trial 388 finished with value: 81.0666732788086 and parameters: {'Fwd': 5.3873693761940325e-06, 'K': 10, 'alpha': 0.7000000000000001, 'dropout': 0.4, 'gnnepoch': 60, 'lambda1': 0.9, 'lambda2': 5.4977516476465205, 'loop': 1, 'loss': 'CE', 'lr': 0.007607950267047113, 'softmaxF': True, 'useGCN': True, 'weight_decay': 4.1339362319536934e-05, 'weightedloss': False}. Best is trial 112 with value: 81.66667175292969.
/home/wxy/miniconda3/lib/python3.10/site-packages/optuna/distributions.py:685: UserWarning: The distribution is specified by [0, 1.00001] and step=0.05, but the range is not divisible by `step`. It will be replaced by [0, 1.0].
  warnings.warn(
K:  10
alpha:  0.6000000000000001
lr:  0.0025677661133580404
weight_decay:  0.00014583341936344208
dropout:  0.4
fix split and run 3 times
Data: Data(x=[2708, 1433], y=[2708], train_mask=[2708], val_mask=[2708], test_mask=[2708], adj_t=[2708, 2708, nnz=10556])
num_train tensor(140)
num_noise 0
noise: tensor(0)
data feature 1433
ALTOPT(
  (lins): Sequential(
    (0): Linear(in_features=1433, out_features=64, bias=True)
    (1): BatchNorm1d(64, eps=1e-05, momentum=0.1, affine=True, track_running_stats=True)
    (2): Dropout(p=0.4, inplace=True)
    (3): ReLU(inplace=True)
    (4): Linear(in_features=64, out_features=7, bias=True)
    (5): LogSoftmax(dim=-1)
  )
  (prop): Propagation(K=10, mode=None, lambda1=None, lambda2=None, L21=True, alpha=0.6000000000000001)
  (gcn): GCN(
    (convs): ModuleList(
      (0): GCNConv(1433, 64)
      (1): GCNConv(64, 7)
    )
    (bns): ModuleList(
      (0): BatchNorm1d(64, eps=1e-05, momentum=0.1, affine=True, track_running_stats=True)
    )
    (output): LogSoftmax(dim=-1)
  )
)
propagate done
init label
Split: 01, Run: 01
None time:  1.6763527009170502
None Run 01:
Highest Train: 100.00
Highest Valid: 80.00
  Final Train: 100.00
   Final Test: 80.10
Split: 01, Run: 02
None time:  1.3551750199403614
None Run 02:
Highest Train: 100.00
Highest Valid: 80.00
  Final Train: 100.00
   Final Test: 79.80
Split: 01, Run: 03
None time:  1.8593543202150613
None Run 03:
Highest Train: 100.00
Highest Valid: 77.60
  Final Train: 100.00
   Final Test: 78.90
run time now: 4.941143035888672
total time:  4.961232113884762
None All runs:
Highest Train: 100.00 ± 0.00
Highest Valid: 79.20 ± 1.39
  Final Train: 100.00 ± 0.00
   Final Test: 79.60 ± 0.62
[I 2023-06-12 00:48:46,493] Trial 389 finished with value: 79.20000457763672 and parameters: {'Fwd': 0.043099764727193124, 'K': 10, 'alpha': 0.6000000000000001, 'dropout': 0.4, 'gnnepoch': 60, 'lambda1': 0.8500000000000001, 'lambda2': 5.799233929385265, 'loop': 1, 'loss': 'CE', 'lr': 0.0025677661133580404, 'softmaxF': True, 'useGCN': True, 'weight_decay': 0.00014583341936344208, 'weightedloss': False}. Best is trial 112 with value: 81.66667175292969.
/home/wxy/miniconda3/lib/python3.10/site-packages/optuna/distributions.py:685: UserWarning: The distribution is specified by [0, 1.00001] and step=0.05, but the range is not divisible by `step`. It will be replaced by [0, 1.0].
  warnings.warn(
K:  10
alpha:  0.65
lr:  0.0009577962305592896
weight_decay:  0.0003162190978986799
dropout:  0.5
fix split and run 3 times
Data: Data(x=[2708, 1433], y=[2708], train_mask=[2708], val_mask=[2708], test_mask=[2708], adj_t=[2708, 2708, nnz=10556])
num_train tensor(140)
num_noise 0
noise: tensor(0)
data feature 1433
ALTOPT(
  (lins): Sequential(
    (0): Linear(in_features=1433, out_features=64, bias=True)
    (1): BatchNorm1d(64, eps=1e-05, momentum=0.1, affine=True, track_running_stats=True)
    (2): Dropout(p=0.5, inplace=True)
    (3): ReLU(inplace=True)
    (4): Linear(in_features=64, out_features=7, bias=True)
    (5): LogSoftmax(dim=-1)
  )
  (prop): Propagation(K=10, mode=None, lambda1=None, lambda2=None, L21=True, alpha=0.65)
  (gcn): GCN(
    (convs): ModuleList(
      (0): GCNConv(1433, 64)
      (1): GCNConv(64, 7)
    )
    (bns): ModuleList(
      (0): BatchNorm1d(64, eps=1e-05, momentum=0.1, affine=True, track_running_stats=True)
    )
    (output): LogSoftmax(dim=-1)
  )
)
propagate done
init label
Split: 01, Run: 01
None time:  1.6539109710138291
None Run 01:
Highest Train: 100.00
Highest Valid: 80.00
  Final Train: 100.00
   Final Test: 80.50
Split: 01, Run: 02
None time:  1.6515476771164685
None Run 02:
Highest Train: 100.00
Highest Valid: 78.80
  Final Train: 100.00
   Final Test: 79.60
Split: 01, Run: 03
None time:  1.423825410893187
None Run 03:
Highest Train: 100.00
Highest Valid: 76.80
  Final Train: 100.00
   Final Test: 78.60
run time now: 4.756817579269409
total time:  4.773903358960524
None All runs:
Highest Train: 100.00 ± 0.00
Highest Valid: 78.53 ± 1.62
  Final Train: 100.00 ± 0.00
   Final Test: 79.57 ± 0.95
[I 2023-06-12 00:48:51,857] Trial 390 finished with value: 78.53333282470703 and parameters: {'Fwd': 0.024209966763861893, 'K': 10, 'alpha': 0.65, 'dropout': 0.5, 'gnnepoch': 60, 'lambda1': 0.8500000000000001, 'lambda2': 5.24436680089857, 'loop': 1, 'loss': 'CE', 'lr': 0.0009577962305592896, 'softmaxF': True, 'useGCN': True, 'weight_decay': 0.0003162190978986799, 'weightedloss': True}. Best is trial 112 with value: 81.66667175292969.
/home/wxy/miniconda3/lib/python3.10/site-packages/optuna/distributions.py:685: UserWarning: The distribution is specified by [0, 1.00001] and step=0.05, but the range is not divisible by `step`. It will be replaced by [0, 1.0].
  warnings.warn(
K:  10
alpha:  0.45
lr:  0.0006178316502180179
weight_decay:  8.845141997932605e-05
dropout:  0.6000000000000001
fix split and run 3 times
Data: Data(x=[2708, 1433], y=[2708], train_mask=[2708], val_mask=[2708], test_mask=[2708], adj_t=[2708, 2708, nnz=10556])
num_train tensor(140)
num_noise 0
noise: tensor(0)
data feature 1433
ALTOPT(
  (lins): Sequential(
    (0): Linear(in_features=1433, out_features=64, bias=True)
    (1): BatchNorm1d(64, eps=1e-05, momentum=0.1, affine=True, track_running_stats=True)
    (2): Dropout(p=0.6000000000000001, inplace=True)
    (3): ReLU(inplace=True)
    (4): Linear(in_features=64, out_features=7, bias=True)
    (5): LogSoftmax(dim=-1)
  )
  (prop): Propagation(K=10, mode=None, lambda1=None, lambda2=None, L21=True, alpha=0.45)
  (gcn): GCN(
    (convs): ModuleList(
      (0): GCNConv(1433, 64)
      (1): GCNConv(64, 7)
    )
    (bns): ModuleList(
      (0): BatchNorm1d(64, eps=1e-05, momentum=0.1, affine=True, track_running_stats=True)
    )
    (output): LogSoftmax(dim=-1)
  )
)
propagate done
init label
Split: 01, Run: 01
None time:  0.869794201105833
None Run 01:
Highest Train: 100.00
Highest Valid: 68.80
  Final Train: 100.00
   Final Test: 69.90
Split: 01, Run: 02
None time:  1.39907912700437
None Run 02:
Highest Train: 100.00
Highest Valid: 77.00
  Final Train: 100.00
   Final Test: 79.70
Split: 01, Run: 03
None time:  0.8346855079289526
None Run 03:
Highest Train: 100.00
Highest Valid: 77.40
  Final Train: 100.00
   Final Test: 79.70
run time now: 3.1309776306152344
total time:  3.1480304109863937
None All runs:
Highest Train: 100.00 ± 0.00
Highest Valid: 74.40 ± 4.85
  Final Train: 100.00 ± 0.00
   Final Test: 76.43 ± 5.66
[I 2023-06-12 00:48:55,497] Trial 391 finished with value: 74.4000015258789 and parameters: {'Fwd': 0.06596864950699359, 'K': 10, 'alpha': 0.45, 'dropout': 0.6000000000000001, 'gnnepoch': 50, 'lambda1': 0.8, 'lambda2': 6.503193852273832, 'loop': 1, 'loss': 'CE', 'lr': 0.0006178316502180179, 'softmaxF': True, 'useGCN': False, 'weight_decay': 8.845141997932605e-05, 'weightedloss': False}. Best is trial 112 with value: 81.66667175292969.
/home/wxy/miniconda3/lib/python3.10/site-packages/optuna/distributions.py:685: UserWarning: The distribution is specified by [0, 1.00001] and step=0.05, but the range is not divisible by `step`. It will be replaced by [0, 1.0].
  warnings.warn(
K:  10
alpha:  0.55
lr:  0.009011504875623244
weight_decay:  5.629097592412662e-05
dropout:  0.4
fix split and run 3 times
Data: Data(x=[2708, 1433], y=[2708], train_mask=[2708], val_mask=[2708], test_mask=[2708], adj_t=[2708, 2708, nnz=10556])
num_train tensor(140)
num_noise 0
noise: tensor(0)
data feature 1433
ALTOPT(
  (lins): Sequential(
    (0): Linear(in_features=1433, out_features=64, bias=True)
    (1): BatchNorm1d(64, eps=1e-05, momentum=0.1, affine=True, track_running_stats=True)
    (2): Dropout(p=0.4, inplace=True)
    (3): ReLU(inplace=True)
    (4): Linear(in_features=64, out_features=7, bias=True)
    (5): LogSoftmax(dim=-1)
  )
  (prop): Propagation(K=10, mode=None, lambda1=None, lambda2=None, L21=True, alpha=0.55)
  (gcn): GCN(
    (convs): ModuleList(
      (0): GCNConv(1433, 64)
      (1): GCNConv(64, 7)
    )
    (bns): ModuleList(
      (0): BatchNorm1d(64, eps=1e-05, momentum=0.1, affine=True, track_running_stats=True)
    )
    (output): LogSoftmax(dim=-1)
  )
)
propagate done
init label
Split: 01, Run: 01
None time:  1.8418977609835565
None Run 01:
Highest Train: 100.00
Highest Valid: 81.20
  Final Train: 100.00
   Final Test: 82.20
Split: 01, Run: 02
None time:  1.5779178289230913
None Run 02:
Highest Train: 100.00
Highest Valid: 80.20
  Final Train: 100.00
   Final Test: 79.70
Split: 01, Run: 03
None time:  1.7809219150803983
None Run 03:
Highest Train: 100.00
Highest Valid: 80.60
  Final Train: 100.00
   Final Test: 80.40
run time now: 5.229205369949341
total time:  5.245199012104422
None All runs:
Highest Train: 100.00 ± 0.00
Highest Valid: 80.67 ± 0.50
  Final Train: 100.00 ± 0.00
   Final Test: 80.77 ± 1.29
[I 2023-06-12 00:49:01,229] Trial 392 finished with value: 80.66666412353516 and parameters: {'Fwd': 0.030892243968566643, 'K': 10, 'alpha': 0.55, 'dropout': 0.4, 'gnnepoch': 70, 'lambda1': 0.9, 'lambda2': 5.0330534942514005, 'loop': 1, 'loss': 'CE', 'lr': 0.009011504875623244, 'softmaxF': True, 'useGCN': True, 'weight_decay': 5.629097592412662e-05, 'weightedloss': False}. Best is trial 112 with value: 81.66667175292969.
/home/wxy/miniconda3/lib/python3.10/site-packages/optuna/distributions.py:685: UserWarning: The distribution is specified by [0, 1.00001] and step=0.05, but the range is not divisible by `step`. It will be replaced by [0, 1.0].
  warnings.warn(
K:  10
alpha:  0.6000000000000001
lr:  0.005058911665747997
weight_decay:  0.00010722986323228023
dropout:  0.4
fix split and run 3 times
Data: Data(x=[2708, 1433], y=[2708], train_mask=[2708], val_mask=[2708], test_mask=[2708], adj_t=[2708, 2708, nnz=10556])
num_train tensor(140)
num_noise 0
noise: tensor(0)
data feature 1433
ALTOPT(
  (lins): Sequential(
    (0): Linear(in_features=1433, out_features=64, bias=True)
    (1): BatchNorm1d(64, eps=1e-05, momentum=0.1, affine=True, track_running_stats=True)
    (2): Dropout(p=0.4, inplace=True)
    (3): ReLU(inplace=True)
    (4): Linear(in_features=64, out_features=7, bias=True)
    (5): LogSoftmax(dim=-1)
  )
  (prop): Propagation(K=10, mode=None, lambda1=None, lambda2=None, L21=True, alpha=0.6000000000000001)
  (gcn): GCN(
    (convs): ModuleList(
      (0): GCNConv(1433, 64)
      (1): GCNConv(64, 7)
    )
    (bns): ModuleList(
      (0): BatchNorm1d(64, eps=1e-05, momentum=0.1, affine=True, track_running_stats=True)
    )
    (output): LogSoftmax(dim=-1)
  )
)
propagate done
init label
Split: 01, Run: 01
None time:  1.7220320098567754
None Run 01:
Highest Train: 100.00
Highest Valid: 81.40
  Final Train: 100.00
   Final Test: 82.00
Split: 01, Run: 02
None time:  1.428015052108094
None Run 02:
Highest Train: 100.00
Highest Valid: 80.80
  Final Train: 100.00
   Final Test: 81.40
Split: 01, Run: 03
None time:  1.6339054179843515
None Run 03:
Highest Train: 100.00
Highest Valid: 81.00
  Final Train: 100.00
   Final Test: 81.20
run time now: 4.812803030014038
total time:  4.8360767418053
None All runs:
Highest Train: 100.00 ± 0.00
Highest Valid: 81.07 ± 0.31
  Final Train: 100.00 ± 0.00
   Final Test: 81.53 ± 0.42
[I 2023-06-12 00:49:06,727] Trial 393 finished with value: 81.0666732788086 and parameters: {'Fwd': 0.05291823670548073, 'K': 10, 'alpha': 0.6000000000000001, 'dropout': 0.4, 'gnnepoch': 60, 'lambda1': 0.8500000000000001, 'lambda2': 5.648475212835295, 'loop': 1, 'loss': 'CE', 'lr': 0.005058911665747997, 'softmaxF': True, 'useGCN': True, 'weight_decay': 0.00010722986323228023, 'weightedloss': False}. Best is trial 112 with value: 81.66667175292969.
/home/wxy/miniconda3/lib/python3.10/site-packages/optuna/distributions.py:685: UserWarning: The distribution is specified by [0, 1.00001] and step=0.05, but the range is not divisible by `step`. It will be replaced by [0, 1.0].
  warnings.warn(
K:  10
alpha:  0.4
lr:  0.006070103114377228
weight_decay:  7.223791877588692e-05
dropout:  0.4
fix split and run 3 times
Data: Data(x=[2708, 1433], y=[2708], train_mask=[2708], val_mask=[2708], test_mask=[2708], adj_t=[2708, 2708, nnz=10556])
num_train tensor(140)
num_noise 0
noise: tensor(0)
data feature 1433
ALTOPT(
  (lins): Sequential(
    (0): Linear(in_features=1433, out_features=64, bias=True)
    (1): BatchNorm1d(64, eps=1e-05, momentum=0.1, affine=True, track_running_stats=True)
    (2): Dropout(p=0.4, inplace=True)
    (3): ReLU(inplace=True)
    (4): Linear(in_features=64, out_features=7, bias=True)
    (5): LogSoftmax(dim=-1)
  )
  (prop): Propagation(K=10, mode=None, lambda1=None, lambda2=None, L21=True, alpha=0.4)
  (gcn): GCN(
    (convs): ModuleList(
      (0): GCNConv(1433, 64)
      (1): GCNConv(64, 7)
    )
    (bns): ModuleList(
      (0): BatchNorm1d(64, eps=1e-05, momentum=0.1, affine=True, track_running_stats=True)
    )
    (output): LogSoftmax(dim=-1)
  )
)
propagate done
init label
Split: 01, Run: 01
None time:  1.638233128003776
None Run 01:
Highest Train: 100.00
Highest Valid: 80.80
  Final Train: 100.00
   Final Test: 82.10
Split: 01, Run: 02
None time:  1.6134287470486015
None Run 02:
Highest Train: 100.00
Highest Valid: 81.00
  Final Train: 100.00
   Final Test: 81.30
Split: 01, Run: 03
None time:  1.418200861895457
None Run 03:
Highest Train: 100.00
Highest Valid: 80.80
  Final Train: 100.00
   Final Test: 81.50
run time now: 4.695879697799683
total time:  4.713267480954528
None All runs:
Highest Train: 100.00 ± 0.00
Highest Valid: 80.87 ± 0.12
  Final Train: 100.00 ± 0.00
   Final Test: 81.63 ± 0.42
