[I 2023-06-12 00:14:37,938] Trial 26 finished with value: 77.0666732788086 and parameters: {'Fwd': 1.698698662671105e-05, 'K': 9, 'alpha': 0.75, 'dropout': 0.6000000000000001, 'gnnepoch': 90, 'lambda1': 0.75, 'lambda2': 7.948729703853119, 'loop': 2, 'loss': 'MSE', 'lr': 0.004973376886317986, 'softmaxF': True, 'useGCN': False, 'weight_decay': 0.0020589315194632983, 'weightedloss': False}. Best is trial 20 with value: 81.0666732788086.
/home/wxy/miniconda3/lib/python3.10/site-packages/optuna/distributions.py:685: UserWarning: The distribution is specified by [0, 1.00001] and step=0.05, but the range is not divisible by `step`. It will be replaced by [0, 1.0].
  warnings.warn(
K:  7
alpha:  1.0
lr:  0.001871476698866145
weight_decay:  8.067807960177537e-05
dropout:  0.9
fix split and run 3 times
Data: Data(x=[19717, 500], y=[19717], train_mask=[19717], val_mask=[19717], test_mask=[19717], adj_t=[19717, 19717, nnz=88648])
num_train tensor(60)
num_noise 0
noise: tensor(0)
data feature 500
ALTOPT(
  (lins): Sequential(
    (0): Linear(in_features=500, out_features=64, bias=True)
    (1): BatchNorm1d(64, eps=1e-05, momentum=0.1, affine=True, track_running_stats=True)
    (2): Dropout(p=0.9, inplace=True)
    (3): ReLU(inplace=True)
    (4): Linear(in_features=64, out_features=3, bias=True)
    (5): LogSoftmax(dim=-1)
  )
  (prop): Propagation(K=7, mode=None, lambda1=None, lambda2=None, L21=True, alpha=1.0)
  (gcn): GCN(
    (convs): ModuleList(
      (0): GCNConv(500, 64)
      (1): GCNConv(64, 3)
    )
    (bns): ModuleList(
      (0): BatchNorm1d(64, eps=1e-05, momentum=0.1, affine=True, track_running_stats=True)
    )
    (output): LogSoftmax(dim=-1)
  )
)
propagate done
init label
Split: 01, Run: 01
None time:  2.4867258828599006
None Run 01:
Highest Train: 100.00
Highest Valid: 73.20
  Final Train: 100.00
   Final Test: 72.20
Split: 01, Run: 02
None time:  2.63654669187963
None Run 02:
Highest Train: 100.00
Highest Valid: 73.20
  Final Train: 100.00
   Final Test: 72.20
Split: 01, Run: 03
None time:  2.5852638438809663
None Run 03:
Highest Train: 100.00
Highest Valid: 73.20
  Final Train: 100.00
   Final Test: 72.20
run time now: 7.754474401473999
total time:  7.806392031954601
None All runs:
Highest Train: 100.00 ± 0.00
Highest Valid: 73.20 ± 0.00
  Final Train: 100.00 ± 0.00
   Final Test: 72.20 ± 0.00
[I 2023-06-12 00:14:46,272] Trial 27 finished with value: 73.19999694824219 and parameters: {'Fwd': 5.235719380950613e-05, 'K': 7, 'alpha': 1.0, 'dropout': 0.9, 'gnnepoch': 110, 'lambda1': 0.0, 'lambda2': 7.016600980342439, 'loop': 1, 'loss': 'CE', 'lr': 0.001871476698866145, 'softmaxF': False, 'useGCN': True, 'weight_decay': 8.067807960177537e-05, 'weightedloss': True}. Best is trial 20 with value: 81.0666732788086.
/home/wxy/miniconda3/lib/python3.10/site-packages/optuna/distributions.py:685: UserWarning: The distribution is specified by [0, 1.00001] and step=0.05, but the range is not divisible by `step`. It will be replaced by [0, 1.0].
  warnings.warn(
K:  5
alpha:  0.65
lr:  0.006602768443337476
weight_decay:  0.0002567426415208956
dropout:  0.5
fix split and run 3 times
Data: Data(x=[19717, 500], y=[19717], train_mask=[19717], val_mask=[19717], test_mask=[19717], adj_t=[19717, 19717, nnz=88648])
num_train tensor(60)
num_noise 0
noise: tensor(0)
data feature 500
ALTOPT(
  (lins): Sequential(
    (0): Linear(in_features=500, out_features=64, bias=True)
    (1): BatchNorm1d(64, eps=1e-05, momentum=0.1, affine=True, track_running_stats=True)
    (2): Dropout(p=0.5, inplace=True)
    (3): ReLU(inplace=True)
    (4): Linear(in_features=64, out_features=3, bias=True)
    (5): Identity()
  )
  (prop): Propagation(K=5, mode=None, lambda1=None, lambda2=None, L21=True, alpha=0.65)
  (gcn): GCN(
    (convs): ModuleList(
      (0): GCNConv(500, 64)
      (1): GCNConv(64, 3)
    )
    (bns): ModuleList(
      (0): BatchNorm1d(64, eps=1e-05, momentum=0.1, affine=True, track_running_stats=True)
    )
    (output): Identity()
  )
)
propagate done
init label
Split: 01, Run: 01
None time:  1.2539531767833978
None Run 01:
Highest Train: 100.00
Highest Valid: 78.60
  Final Train: 100.00
   Final Test: 76.90
Split: 01, Run: 02
None time:  1.1531427311711013
None Run 02:
Highest Train: 100.00
Highest Valid: 77.60
  Final Train: 100.00
   Final Test: 75.70
Split: 01, Run: 03
None time:  1.429494580021128
None Run 03:
Highest Train: 100.00
Highest Valid: 79.60
  Final Train: 100.00
   Final Test: 76.10
run time now: 3.8792684078216553
total time:  3.9309757901355624
None All runs:
Highest Train: 100.00 ± 0.00
Highest Valid: 78.60 ± 1.00
  Final Train: 100.00 ± 0.00
   Final Test: 76.23 ± 0.61
[I 2023-06-12 00:14:50,638] Trial 28 finished with value: 78.60000610351562 and parameters: {'Fwd': 5.092978233747255e-06, 'K': 5, 'alpha': 0.65, 'dropout': 0.5, 'gnnepoch': 90, 'lambda1': 0.25, 'lambda2': 8.28674940568086, 'loop': 1, 'loss': 'MSE', 'lr': 0.006602768443337476, 'softmaxF': True, 'useGCN': False, 'weight_decay': 0.0002567426415208956, 'weightedloss': False}. Best is trial 20 with value: 81.0666732788086.
/home/wxy/miniconda3/lib/python3.10/site-packages/optuna/distributions.py:685: UserWarning: The distribution is specified by [0, 1.00001] and step=0.05, but the range is not divisible by `step`. It will be replaced by [0, 1.0].
  warnings.warn(
K:  9
alpha:  0.8500000000000001
lr:  0.00383036416633414
weight_decay:  6.170456291116437e-05
dropout:  0.7000000000000001
fix split and run 3 times
Data: Data(x=[19717, 500], y=[19717], train_mask=[19717], val_mask=[19717], test_mask=[19717], adj_t=[19717, 19717, nnz=88648])
num_train tensor(60)
num_noise 0
noise: tensor(0)
data feature 500
ALTOPT(
  (lins): Sequential(
    (0): Linear(in_features=500, out_features=64, bias=True)
    (1): BatchNorm1d(64, eps=1e-05, momentum=0.1, affine=True, track_running_stats=True)
    (2): Dropout(p=0.7000000000000001, inplace=True)
    (3): ReLU(inplace=True)
    (4): Linear(in_features=64, out_features=3, bias=True)
    (5): LogSoftmax(dim=-1)
  )
  (prop): Propagation(K=9, mode=None, lambda1=None, lambda2=None, L21=True, alpha=0.8500000000000001)
  (gcn): GCN(
    (convs): ModuleList(
      (0): GCNConv(500, 64)
      (1): GCNConv(64, 3)
    )
    (bns): ModuleList(
      (0): BatchNorm1d(64, eps=1e-05, momentum=0.1, affine=True, track_running_stats=True)
    )
    (output): LogSoftmax(dim=-1)
  )
)
propagate done
init label
Split: 01, Run: 01
None time:  1.549276074860245
None Run 01:
Highest Train: 100.00
Highest Valid: 77.40
  Final Train: 100.00
   Final Test: 75.50
Split: 01, Run: 02
None time:  1.5230000771116465
None Run 02:
Highest Train: 100.00
Highest Valid: 75.60
  Final Train: 100.00
   Final Test: 73.60
Split: 01, Run: 03
None time:  1.5508208749815822
None Run 03:
Highest Train: 100.00
Highest Valid: 77.20
  Final Train: 100.00
   Final Test: 75.20
run time now: 4.692849636077881
total time:  4.742229557828978
None All runs:
Highest Train: 100.00 ± 0.00
Highest Valid: 76.73 ± 0.99
  Final Train: 100.00 ± 0.00
   Final Test: 74.77 ± 1.02
[I 2023-06-12 00:14:55,926] Trial 29 finished with value: 76.73333740234375 and parameters: {'Fwd': 0.00019352684786626425, 'K': 9, 'alpha': 0.8500000000000001, 'dropout': 0.7000000000000001, 'gnnepoch': 50, 'lambda1': 0.1, 'lambda2': 9.170747030915832, 'loop': 1, 'loss': 'CE', 'lr': 0.00383036416633414, 'softmaxF': False, 'useGCN': True, 'weight_decay': 6.170456291116437e-05, 'weightedloss': False}. Best is trial 20 with value: 81.0666732788086.
/home/wxy/miniconda3/lib/python3.10/site-packages/optuna/distributions.py:685: UserWarning: The distribution is specified by [0, 1.00001] and step=0.05, but the range is not divisible by `step`. It will be replaced by [0, 1.0].
  warnings.warn(
K:  6
alpha:  0.0
lr:  0.007951246828381017
weight_decay:  0.00016901422917884598
dropout:  0.4
fix split and run 3 times
Data: Data(x=[19717, 500], y=[19717], train_mask=[19717], val_mask=[19717], test_mask=[19717], adj_t=[19717, 19717, nnz=88648])
num_train tensor(60)
num_noise 0
noise: tensor(0)
data feature 500
ALTOPT(
  (lins): Sequential(
    (0): Linear(in_features=500, out_features=64, bias=True)
    (1): BatchNorm1d(64, eps=1e-05, momentum=0.1, affine=True, track_running_stats=True)
    (2): Dropout(p=0.4, inplace=True)
    (3): ReLU(inplace=True)
    (4): Linear(in_features=64, out_features=3, bias=True)
    (5): Identity()
  )
  (prop): Propagation(K=6, mode=None, lambda1=None, lambda2=None, L21=True, alpha=0.0)
  (gcn): GCN(
    (convs): ModuleList(
      (0): GCNConv(500, 64)
      (1): GCNConv(64, 3)
    )
    (bns): ModuleList(
      (0): BatchNorm1d(64, eps=1e-05, momentum=0.1, affine=True, track_running_stats=True)
    )
    (output): Identity()
  )
)
propagate done
init label
Split: 01, Run: 01
None time:  1.0903322878293693
None Run 01:
Highest Train: 100.00
Highest Valid: 77.20
  Final Train: 100.00
   Final Test: 74.60
Split: 01, Run: 02
None time:  0.8691589480731636
None Run 02:
Highest Train: 100.00
Highest Valid: 74.80
  Final Train: 100.00
   Final Test: 73.70
Split: 01, Run: 03
None time:  1.0302540978882462
None Run 03:
Highest Train: 100.00
Highest Valid: 75.60
  Final Train: 100.00
   Final Test: 73.70
run time now: 3.0296661853790283
total time:  3.0736929608974606
None All runs:
Highest Train: 100.00 ± 0.00
Highest Valid: 75.87 ± 1.22
  Final Train: 100.00 ± 0.00
   Final Test: 74.00 ± 0.52
[I 2023-06-12 00:14:59,529] Trial 30 finished with value: 75.86666870117188 and parameters: {'Fwd': 1.645601506519462e-05, 'K': 6, 'alpha': 0.0, 'dropout': 0.4, 'gnnepoch': 70, 'lambda1': 0.7000000000000001, 'lambda2': 3.069983519294369, 'loop': 1, 'loss': 'MSE', 'lr': 0.007951246828381017, 'softmaxF': True, 'useGCN': False, 'weight_decay': 0.00016901422917884598, 'weightedloss': False}. Best is trial 20 with value: 81.0666732788086.
/home/wxy/miniconda3/lib/python3.10/site-packages/optuna/distributions.py:685: UserWarning: The distribution is specified by [0, 1.00001] and step=0.05, but the range is not divisible by `step`. It will be replaced by [0, 1.0].
  warnings.warn(
K:  6
alpha:  0.8
lr:  0.005155135342497737
weight_decay:  0.0004211114095041065
dropout:  0.30000000000000004
fix split and run 3 times
Data: Data(x=[19717, 500], y=[19717], train_mask=[19717], val_mask=[19717], test_mask=[19717], adj_t=[19717, 19717, nnz=88648])
num_train tensor(60)
num_noise 0
noise: tensor(0)
data feature 500
ALTOPT(
  (lins): Sequential(
    (0): Linear(in_features=500, out_features=64, bias=True)
    (1): BatchNorm1d(64, eps=1e-05, momentum=0.1, affine=True, track_running_stats=True)
    (2): Dropout(p=0.30000000000000004, inplace=True)
    (3): ReLU(inplace=True)
    (4): Linear(in_features=64, out_features=3, bias=True)
    (5): Identity()
  )
  (prop): Propagation(K=6, mode=None, lambda1=None, lambda2=None, L21=True, alpha=0.8)
  (gcn): GCN(
    (convs): ModuleList(
      (0): GCNConv(500, 64)
      (1): GCNConv(64, 3)
    )
    (bns): ModuleList(
      (0): BatchNorm1d(64, eps=1e-05, momentum=0.1, affine=True, track_running_stats=True)
    )
    (output): Identity()
  )
)
propagate done
init label
Split: 01, Run: 01, Epoch: 100, Loss: 0.0000, Train: 100.00%, Valid: 77.80% Test: 76.10%
Split: 01, Run: 01
None time:  2.5785562698729336
None Run 01:
Highest Train: 100.00
Highest Valid: 77.80
  Final Train: 100.00
   Final Test: 75.90
Split: 01, Run: 02, Epoch: 100, Loss: 0.0000, Train: 100.00%, Valid: 78.60% Test: 76.20%
Split: 01, Run: 02
None time:  2.4661325667984784
None Run 02:
Highest Train: 100.00
Highest Valid: 78.60
  Final Train: 100.00
   Final Test: 76.10
Split: 01, Run: 03, Epoch: 100, Loss: 0.0000, Train: 100.00%, Valid: 77.80% Test: 75.70%
Split: 01, Run: 03
None time:  2.542392607079819
None Run 03:
Highest Train: 100.00
Highest Valid: 77.80
  Final Train: 100.00
   Final Test: 75.70
run time now: 7.627456426620483
total time:  7.664817557903007
None All runs:
Highest Train: 100.00 ± 0.00
Highest Valid: 78.07 ± 0.46
  Final Train: 100.00 ± 0.00
   Final Test: 75.90 ± 0.20
[I 2023-06-12 00:15:07,639] Trial 31 finished with value: 78.06666564941406 and parameters: {'Fwd': 0.00012958692307150668, 'K': 6, 'alpha': 0.8, 'dropout': 0.30000000000000004, 'gnnepoch': 110, 'lambda1': 0.9, 'lambda2': 9.047014444972266, 'loop': 0, 'loss': 'MSE', 'lr': 0.005155135342497737, 'softmaxF': True, 'useGCN': False, 'weight_decay': 0.0004211114095041065, 'weightedloss': False}. Best is trial 20 with value: 81.0666732788086.
/home/wxy/miniconda3/lib/python3.10/site-packages/optuna/distributions.py:685: UserWarning: The distribution is specified by [0, 1.00001] and step=0.05, but the range is not divisible by `step`. It will be replaced by [0, 1.0].
  warnings.warn(
K:  7
alpha:  0.7000000000000001
lr:  0.0025075103556155896
weight_decay:  0.000403794170500728
dropout:  0.30000000000000004
fix split and run 3 times
Data: Data(x=[19717, 500], y=[19717], train_mask=[19717], val_mask=[19717], test_mask=[19717], adj_t=[19717, 19717, nnz=88648])
num_train tensor(60)
num_noise 0
noise: tensor(0)
data feature 500
ALTOPT(
  (lins): Sequential(
    (0): Linear(in_features=500, out_features=64, bias=True)
    (1): BatchNorm1d(64, eps=1e-05, momentum=0.1, affine=True, track_running_stats=True)
    (2): Dropout(p=0.30000000000000004, inplace=True)
    (3): ReLU(inplace=True)
    (4): Linear(in_features=64, out_features=3, bias=True)
    (5): Identity()
  )
  (prop): Propagation(K=7, mode=None, lambda1=None, lambda2=None, L21=True, alpha=0.7000000000000001)
  (gcn): GCN(
    (convs): ModuleList(
      (0): GCNConv(500, 64)
      (1): GCNConv(64, 3)
    )
    (bns): ModuleList(
      (0): BatchNorm1d(64, eps=1e-05, momentum=0.1, affine=True, track_running_stats=True)
    )
    (output): Identity()
  )
)
propagate done
init label
Split: 01, Run: 01, Epoch: 100, Loss: 0.0000, Train: 100.00%, Valid: 77.00% Test: 76.30%
Split: 01, Run: 01
None time:  2.803599987877533
None Run 01:
Highest Train: 100.00
Highest Valid: 77.00
  Final Train: 100.00
   Final Test: 76.30
Split: 01, Run: 02
None time:  1.2175552749540657
None Run 02:
Highest Train: 100.00
Highest Valid: 81.00
  Final Train: 100.00
   Final Test: 79.60
Split: 01, Run: 03, Epoch: 100, Loss: 0.0000, Train: 100.00%, Valid: 80.20% Test: 78.70%
Split: 01, Run: 03
None time:  2.669104191940278
None Run 03:
Highest Train: 100.00
Highest Valid: 80.20
  Final Train: 100.00
   Final Test: 78.70
run time now: 6.73901104927063
total time:  6.782968566054478
None All runs:
Highest Train: 100.00 ± 0.00
Highest Valid: 79.40 ± 2.12
  Final Train: 100.00 ± 0.00
   Final Test: 78.20 ± 1.71
[I 2023-06-12 00:15:14,900] Trial 32 finished with value: 79.4000015258789 and parameters: {'Fwd': 0.00023915946032125233, 'K': 7, 'alpha': 0.7000000000000001, 'dropout': 0.30000000000000004, 'gnnepoch': 120, 'lambda1': 0.55, 'lambda2': 9.230406127849857, 'loop': 0, 'loss': 'MSE', 'lr': 0.0025075103556155896, 'softmaxF': True, 'useGCN': False, 'weight_decay': 0.000403794170500728, 'weightedloss': False}. Best is trial 20 with value: 81.0666732788086.
/home/wxy/miniconda3/lib/python3.10/site-packages/optuna/distributions.py:685: UserWarning: The distribution is specified by [0, 1.00001] and step=0.05, but the range is not divisible by `step`. It will be replaced by [0, 1.0].
  warnings.warn(
K:  8
alpha:  0.7000000000000001
lr:  0.0026460148289371927
weight_decay:  0.000236713672405271
dropout:  0.2
fix split and run 3 times
Data: Data(x=[19717, 500], y=[19717], train_mask=[19717], val_mask=[19717], test_mask=[19717], adj_t=[19717, 19717, nnz=88648])
num_train tensor(60)
num_noise 0
noise: tensor(0)
data feature 500
ALTOPT(
  (lins): Sequential(
    (0): Linear(in_features=500, out_features=64, bias=True)
    (1): BatchNorm1d(64, eps=1e-05, momentum=0.1, affine=True, track_running_stats=True)
    (2): Dropout(p=0.2, inplace=True)
    (3): ReLU(inplace=True)
    (4): Linear(in_features=64, out_features=3, bias=True)
    (5): Identity()
  )
  (prop): Propagation(K=8, mode=None, lambda1=None, lambda2=None, L21=True, alpha=0.7000000000000001)
  (gcn): GCN(
    (convs): ModuleList(
      (0): GCNConv(500, 64)
      (1): GCNConv(64, 3)
    )
    (bns): ModuleList(
      (0): BatchNorm1d(64, eps=1e-05, momentum=0.1, affine=True, track_running_stats=True)
    )
    (output): Identity()
  )
)
propagate done
init label
Split: 01, Run: 01, Epoch: 100, Loss: 0.0000, Train: 100.00%, Valid: 76.80% Test: 76.30%
Split: 01, Run: 01
None time:  2.9712945439387113
None Run 01:
Highest Train: 100.00
Highest Valid: 76.80
  Final Train: 100.00
   Final Test: 76.30
Split: 01, Run: 02
None time:  1.1757595529779792
None Run 02:
Highest Train: 100.00
Highest Valid: 79.00
  Final Train: 100.00
   Final Test: 76.20
Split: 01, Run: 03, Epoch: 100, Loss: 0.0000, Train: 100.00%, Valid: 80.40% Test: 77.10%
Split: 01, Run: 03
None time:  3.073416210943833
None Run 03:
Highest Train: 100.00
Highest Valid: 80.40
  Final Train: 100.00
   Final Test: 77.10
run time now: 7.265798807144165
total time:  7.310240883147344
None All runs:
Highest Train: 100.00 ± 0.00
Highest Valid: 78.73 ± 1.81
  Final Train: 100.00 ± 0.00
   Final Test: 76.53 ± 0.49
[I 2023-06-12 00:15:22,786] Trial 33 finished with value: 78.73333740234375 and parameters: {'Fwd': 0.0006122145935020286, 'K': 8, 'alpha': 0.7000000000000001, 'dropout': 0.2, 'gnnepoch': 120, 'lambda1': 0.55, 'lambda2': 9.424772970570016, 'loop': 0, 'loss': 'MSE', 'lr': 0.0026460148289371927, 'softmaxF': True, 'useGCN': False, 'weight_decay': 0.000236713672405271, 'weightedloss': False}. Best is trial 20 with value: 81.0666732788086.
/home/wxy/miniconda3/lib/python3.10/site-packages/optuna/distributions.py:685: UserWarning: The distribution is specified by [0, 1.00001] and step=0.05, but the range is not divisible by `step`. It will be replaced by [0, 1.0].
  warnings.warn(
K:  7
alpha:  0.6000000000000001
lr:  0.00347643948313598
weight_decay:  0.0008673267745570398
dropout:  0.1
fix split and run 3 times
Data: Data(x=[19717, 500], y=[19717], train_mask=[19717], val_mask=[19717], test_mask=[19717], adj_t=[19717, 19717, nnz=88648])
num_train tensor(60)
num_noise 0
noise: tensor(0)
data feature 500
ALTOPT(
  (lins): Sequential(
    (0): Linear(in_features=500, out_features=64, bias=True)
    (1): BatchNorm1d(64, eps=1e-05, momentum=0.1, affine=True, track_running_stats=True)
    (2): Dropout(p=0.1, inplace=True)
    (3): ReLU(inplace=True)
    (4): Linear(in_features=64, out_features=3, bias=True)
    (5): Identity()
  )
  (prop): Propagation(K=7, mode=None, lambda1=None, lambda2=None, L21=True, alpha=0.6000000000000001)
  (gcn): GCN(
    (convs): ModuleList(
      (0): GCNConv(500, 64)
      (1): GCNConv(64, 3)
    )
    (bns): ModuleList(
      (0): BatchNorm1d(64, eps=1e-05, momentum=0.1, affine=True, track_running_stats=True)
    )
    (output): Identity()
  )
)
propagate done
init label
Split: 01, Run: 01
None time:  1.381520451977849
None Run 01:
Highest Train: 100.00
Highest Valid: 75.60
  Final Train: 100.00
   Final Test: 75.20
Split: 01, Run: 02, Epoch: 100, Loss: 0.0000, Train: 100.00%, Valid: 78.80% Test: 76.50%
Split: 01, Run: 02
None time:  2.648458052193746
None Run 02:
Highest Train: 100.00
Highest Valid: 78.80
  Final Train: 100.00
   Final Test: 76.40
Split: 01, Run: 03
None time:  1.4178520548157394
None Run 03:
Highest Train: 100.00
Highest Valid: 78.00
  Final Train: 100.00
   Final Test: 77.00
run time now: 5.498388290405273
total time:  5.542823298135772
None All runs:
Highest Train: 100.00 ± 0.00
Highest Valid: 77.47 ± 1.67
  Final Train: 100.00 ± 0.00
   Final Test: 76.20 ± 0.92
[I 2023-06-12 00:15:28,741] Trial 34 finished with value: 77.46666717529297 and parameters: {'Fwd': 0.0002612417452693211, 'K': 7, 'alpha': 0.6000000000000001, 'dropout': 0.1, 'gnnepoch': 120, 'lambda1': 0.4, 'lambda2': 8.464322470588119, 'loop': 0, 'loss': 'MSE', 'lr': 0.00347643948313598, 'softmaxF': True, 'useGCN': False, 'weight_decay': 0.0008673267745570398, 'weightedloss': False}. Best is trial 20 with value: 81.0666732788086.
/home/wxy/miniconda3/lib/python3.10/site-packages/optuna/distributions.py:685: UserWarning: The distribution is specified by [0, 1.00001] and step=0.05, but the range is not divisible by `step`. It will be replaced by [0, 1.0].
  warnings.warn(
K:  7
alpha:  0.7000000000000001
lr:  0.002560005214908762
weight_decay:  6.7655372806444e-05
dropout:  0.30000000000000004
fix split and run 3 times
Data: Data(x=[19717, 500], y=[19717], train_mask=[19717], val_mask=[19717], test_mask=[19717], adj_t=[19717, 19717, nnz=88648])
num_train tensor(60)
num_noise 0
noise: tensor(0)
data feature 500
ALTOPT(
  (lins): Sequential(
    (0): Linear(in_features=500, out_features=64, bias=True)
    (1): BatchNorm1d(64, eps=1e-05, momentum=0.1, affine=True, track_running_stats=True)
    (2): Dropout(p=0.30000000000000004, inplace=True)
    (3): ReLU(inplace=True)
    (4): Linear(in_features=64, out_features=3, bias=True)
    (5): Identity()
  )
  (prop): Propagation(K=7, mode=None, lambda1=None, lambda2=None, L21=True, alpha=0.7000000000000001)
  (gcn): GCN(
    (convs): ModuleList(
      (0): GCNConv(500, 64)
      (1): GCNConv(64, 3)
    )
    (bns): ModuleList(
      (0): BatchNorm1d(64, eps=1e-05, momentum=0.1, affine=True, track_running_stats=True)
    )
    (output): Identity()
  )
)
propagate done
init label
Split: 01, Run: 01
None time:  2.8078633199911565
None Run 01:
Highest Train: 100.00
Highest Valid: 78.80
  Final Train: 100.00
   Final Test: 76.40
Split: 01, Run: 02
None time:  1.8742816199082881
None Run 02:
Highest Train: 100.00
Highest Valid: 80.00
  Final Train: 100.00
   Final Test: 77.60
Split: 01, Run: 03
None time:  2.11096741608344
None Run 03:
Highest Train: 100.00
Highest Valid: 80.40
  Final Train: 100.00
   Final Test: 78.50
run time now: 6.835947513580322
total time:  6.8861880821641535
None All runs:
Highest Train: 100.00 ± 0.00
Highest Valid: 79.73 ± 0.83
  Final Train: 100.00 ± 0.00
   Final Test: 77.50 ± 1.05
