[I 2023-06-12 00:25:19,530] Trial 143 finished with value: 77.79999542236328 and parameters: {'Fwd': 2.4783964166437255e-06, 'K': 10, 'alpha': 1.0, 'dropout': 0.9, 'gnnepoch': 50, 'lambda1': 0.55, 'lambda2': 6.678837681903876, 'loop': 1, 'loss': 'MSE', 'lr': 0.0036810042447086595, 'softmaxF': True, 'useGCN': False, 'weight_decay': 0.001350976466620722, 'weightedloss': False}. Best is trial 132 with value: 83.0666732788086.
/home/wxy/miniconda3/lib/python3.10/site-packages/optuna/distributions.py:685: UserWarning: The distribution is specified by [0, 1.00001] and step=0.05, but the range is not divisible by `step`. It will be replaced by [0, 1.0].
  warnings.warn(
K:  10
alpha:  0.9500000000000001
lr:  0.0030212519822124524
weight_decay:  0.0024151842120586032
dropout:  0.9
fix split and run 3 times
Data: Data(x=[19717, 500], y=[19717], train_mask=[19717], val_mask=[19717], test_mask=[19717], adj_t=[19717, 19717, nnz=88648])
num_train tensor(60)
num_noise 0
noise: tensor(0)
data feature 500
ALTOPT(
  (lins): Sequential(
    (0): Linear(in_features=500, out_features=64, bias=True)
    (1): BatchNorm1d(64, eps=1e-05, momentum=0.1, affine=True, track_running_stats=True)
    (2): Dropout(p=0.9, inplace=True)
    (3): ReLU(inplace=True)
    (4): Linear(in_features=64, out_features=3, bias=True)
    (5): Identity()
  )
  (prop): Propagation(K=10, mode=None, lambda1=None, lambda2=None, L21=True, alpha=0.9500000000000001)
  (gcn): GCN(
    (convs): ModuleList(
      (0): GCNConv(500, 64)
      (1): GCNConv(64, 3)
    )
    (bns): ModuleList(
      (0): BatchNorm1d(64, eps=1e-05, momentum=0.1, affine=True, track_running_stats=True)
    )
    (output): Identity()
  )
)
propagate done
init label
Split: 01, Run: 01
None time:  2.5038155522197485
None Run 01:
Highest Train: 100.00
Highest Valid: 81.20
  Final Train: 100.00
   Final Test: 77.20
Split: 01, Run: 02
None time:  1.026313364971429
None Run 02:
Highest Train: 100.00
Highest Valid: 80.20
  Final Train: 100.00
   Final Test: 79.40
Split: 01, Run: 03
None time:  1.1715845400467515
None Run 03:
Highest Train: 100.00
Highest Valid: 81.80
  Final Train: 100.00
   Final Test: 78.50
run time now: 4.752669811248779
total time:  4.800754691939801
None All runs:
Highest Train: 100.00 ± 0.00
Highest Valid: 81.07 ± 0.81
  Final Train: 100.00 ± 0.00
   Final Test: 78.37 ± 1.11
[I 2023-06-12 00:25:24,799] Trial 144 finished with value: 81.06666564941406 and parameters: {'Fwd': 2.0665746767868198e-06, 'K': 10, 'alpha': 0.9500000000000001, 'dropout': 0.9, 'gnnepoch': 60, 'lambda1': 0.5, 'lambda2': 6.518786608283215, 'loop': 1, 'loss': 'MSE', 'lr': 0.0030212519822124524, 'softmaxF': True, 'useGCN': False, 'weight_decay': 0.0024151842120586032, 'weightedloss': False}. Best is trial 132 with value: 83.0666732788086.
/home/wxy/miniconda3/lib/python3.10/site-packages/optuna/distributions.py:685: UserWarning: The distribution is specified by [0, 1.00001] and step=0.05, but the range is not divisible by `step`. It will be replaced by [0, 1.0].
  warnings.warn(
K:  10
alpha:  1.0
lr:  0.0027505408118965852
weight_decay:  0.0011068995155188897
dropout:  0.9
fix split and run 3 times
Data: Data(x=[19717, 500], y=[19717], train_mask=[19717], val_mask=[19717], test_mask=[19717], adj_t=[19717, 19717, nnz=88648])
num_train tensor(60)
num_noise 0
noise: tensor(0)
data feature 500
ALTOPT(
  (lins): Sequential(
    (0): Linear(in_features=500, out_features=64, bias=True)
    (1): BatchNorm1d(64, eps=1e-05, momentum=0.1, affine=True, track_running_stats=True)
    (2): Dropout(p=0.9, inplace=True)
    (3): ReLU(inplace=True)
    (4): Linear(in_features=64, out_features=3, bias=True)
    (5): Identity()
  )
  (prop): Propagation(K=10, mode=None, lambda1=None, lambda2=None, L21=True, alpha=1.0)
  (gcn): GCN(
    (convs): ModuleList(
      (0): GCNConv(500, 64)
      (1): GCNConv(64, 3)
    )
    (bns): ModuleList(
      (0): BatchNorm1d(64, eps=1e-05, momentum=0.1, affine=True, track_running_stats=True)
    )
    (output): Identity()
  )
)
propagate done
init label
Split: 01, Run: 01
None time:  2.8966002089437097
None Run 01:
Highest Train: 100.00
Highest Valid: 83.20
  Final Train: 100.00
   Final Test: 79.30
Split: 01, Run: 02
None time:  1.0560454740189016
None Run 02:
Highest Train: 100.00
Highest Valid: 81.60
  Final Train: 100.00
   Final Test: 80.40
Split: 01, Run: 03
None time:  1.008500659139827
None Run 03:
Highest Train: 100.00
Highest Valid: 82.40
  Final Train: 100.00
   Final Test: 80.50
run time now: 5.013055801391602
total time:  5.0588187370449305
None All runs:
Highest Train: 100.00 ± 0.00
Highest Valid: 82.40 ± 0.80
  Final Train: 100.00 ± 0.00
   Final Test: 80.07 ± 0.67
[I 2023-06-12 00:25:30,316] Trial 145 finished with value: 82.4000015258789 and parameters: {'Fwd': 1.5733916585502644e-06, 'K': 10, 'alpha': 1.0, 'dropout': 0.9, 'gnnepoch': 60, 'lambda1': 0.7000000000000001, 'lambda2': 7.398760834617941, 'loop': 1, 'loss': 'MSE', 'lr': 0.0027505408118965852, 'softmaxF': True, 'useGCN': False, 'weight_decay': 0.0011068995155188897, 'weightedloss': False}. Best is trial 132 with value: 83.0666732788086.
/home/wxy/miniconda3/lib/python3.10/site-packages/optuna/distributions.py:685: UserWarning: The distribution is specified by [0, 1.00001] and step=0.05, but the range is not divisible by `step`. It will be replaced by [0, 1.0].
  warnings.warn(
K:  10
alpha:  1.0
lr:  0.0028526151544010308
weight_decay:  0.0010589336079000443
dropout:  0.9
fix split and run 3 times
Data: Data(x=[19717, 500], y=[19717], train_mask=[19717], val_mask=[19717], test_mask=[19717], adj_t=[19717, 19717, nnz=88648])
num_train tensor(60)
num_noise 0
noise: tensor(0)
data feature 500
ALTOPT(
  (lins): Sequential(
    (0): Linear(in_features=500, out_features=64, bias=True)
    (1): BatchNorm1d(64, eps=1e-05, momentum=0.1, affine=True, track_running_stats=True)
    (2): Dropout(p=0.9, inplace=True)
    (3): ReLU(inplace=True)
    (4): Linear(in_features=64, out_features=3, bias=True)
    (5): Identity()
  )
  (prop): Propagation(K=10, mode=None, lambda1=None, lambda2=None, L21=True, alpha=1.0)
  (gcn): GCN(
    (convs): ModuleList(
      (0): GCNConv(500, 64)
      (1): GCNConv(64, 3)
    )
    (bns): ModuleList(
      (0): BatchNorm1d(64, eps=1e-05, momentum=0.1, affine=True, track_running_stats=True)
    )
    (output): Identity()
  )
)
propagate done
init label
Split: 01, Run: 01, Epoch: 100, Loss: 0.2906, Train: 100.00%, Valid: 82.40% Test: 78.60%
Split: 01, Run: 01
None time:  3.2537787288893014
None Run 01:
Highest Train: 100.00
Highest Valid: 82.40
  Final Train: 100.00
   Final Test: 78.60
Split: 01, Run: 02, Epoch: 100, Loss: 0.1719, Train: 100.00%, Valid: 81.40% Test: 79.60%
Split: 01, Run: 02
None time:  3.8458901061676443
None Run 02:
Highest Train: 100.00
Highest Valid: 81.40
  Final Train: 100.00
   Final Test: 79.70
Split: 01, Run: 03
None time:  1.0348566770553589
None Run 03:
Highest Train: 100.00
Highest Valid: 82.80
  Final Train: 100.00
   Final Test: 79.80
run time now: 8.182535171508789
total time:  8.229706407990307
None All runs:
Highest Train: 100.00 ± 0.00
Highest Valid: 82.20 ± 0.72
  Final Train: 100.00 ± 0.00
   Final Test: 79.37 ± 0.67
[I 2023-06-12 00:25:39,011] Trial 146 finished with value: 82.20000457763672 and parameters: {'Fwd': 1.3145397524053388e-06, 'K': 10, 'alpha': 1.0, 'dropout': 0.9, 'gnnepoch': 60, 'lambda1': 0.8500000000000001, 'lambda2': 6.880290396162613, 'loop': 1, 'loss': 'MSE', 'lr': 0.0028526151544010308, 'softmaxF': True, 'useGCN': False, 'weight_decay': 0.0010589336079000443, 'weightedloss': False}. Best is trial 132 with value: 83.0666732788086.
/home/wxy/miniconda3/lib/python3.10/site-packages/optuna/distributions.py:685: UserWarning: The distribution is specified by [0, 1.00001] and step=0.05, but the range is not divisible by `step`. It will be replaced by [0, 1.0].
  warnings.warn(
K:  10
alpha:  1.0
lr:  0.004063139194033273
weight_decay:  0.005106421436635692
dropout:  0.9
fix split and run 3 times
Data: Data(x=[19717, 500], y=[19717], train_mask=[19717], val_mask=[19717], test_mask=[19717], adj_t=[19717, 19717, nnz=88648])
num_train tensor(60)
num_noise 0
noise: tensor(0)
data feature 500
ALTOPT(
  (lins): Sequential(
    (0): Linear(in_features=500, out_features=64, bias=True)
    (1): BatchNorm1d(64, eps=1e-05, momentum=0.1, affine=True, track_running_stats=True)
    (2): Dropout(p=0.9, inplace=True)
    (3): ReLU(inplace=True)
    (4): Linear(in_features=64, out_features=3, bias=True)
    (5): Identity()
  )
  (prop): Propagation(K=10, mode=None, lambda1=None, lambda2=None, L21=True, alpha=1.0)
  (gcn): GCN(
    (convs): ModuleList(
      (0): GCNConv(500, 64)
      (1): GCNConv(64, 3)
    )
    (bns): ModuleList(
      (0): BatchNorm1d(64, eps=1e-05, momentum=0.1, affine=True, track_running_stats=True)
    )
    (output): Identity()
  )
)
propagate done
init label
Split: 01, Run: 01
None time:  2.477258662926033
None Run 01:
Highest Train: 100.00
Highest Valid: 80.80
  Final Train: 100.00
   Final Test: 76.70
Split: 01, Run: 02
None time:  1.494836213067174
None Run 02:
Highest Train: 100.00
Highest Valid: 81.60
  Final Train: 100.00
   Final Test: 79.70
Split: 01, Run: 03
None time:  0.9040908729657531
None Run 03:
Highest Train: 100.00
Highest Valid: 82.80
  Final Train: 100.00
   Final Test: 80.10
run time now: 4.931630849838257
total time:  4.974743211874738
None All runs:
Highest Train: 100.00 ± 0.00
Highest Valid: 81.73 ± 1.01
  Final Train: 100.00 ± 0.00
   Final Test: 78.83 ± 1.86
[I 2023-06-12 00:25:44,551] Trial 147 finished with value: 81.73332977294922 and parameters: {'Fwd': 1.7861181724640188e-06, 'K': 10, 'alpha': 1.0, 'dropout': 0.9, 'gnnepoch': 60, 'lambda1': 0.7000000000000001, 'lambda2': 6.039611695933495, 'loop': 1, 'loss': 'MSE', 'lr': 0.004063139194033273, 'softmaxF': True, 'useGCN': False, 'weight_decay': 0.005106421436635692, 'weightedloss': False}. Best is trial 132 with value: 83.0666732788086.
/home/wxy/miniconda3/lib/python3.10/site-packages/optuna/distributions.py:685: UserWarning: The distribution is specified by [0, 1.00001] and step=0.05, but the range is not divisible by `step`. It will be replaced by [0, 1.0].
  warnings.warn(
K:  1
alpha:  0.9500000000000001
lr:  0.0026235285863307205
weight_decay:  0.0016086320055216765
dropout:  0.8
fix split and run 3 times
Data: Data(x=[19717, 500], y=[19717], train_mask=[19717], val_mask=[19717], test_mask=[19717], adj_t=[19717, 19717, nnz=88648])
num_train tensor(60)
num_noise 0
noise: tensor(0)
data feature 500
ALTOPT(
  (lins): Sequential(
    (0): Linear(in_features=500, out_features=64, bias=True)
    (1): BatchNorm1d(64, eps=1e-05, momentum=0.1, affine=True, track_running_stats=True)
    (2): Dropout(p=0.8, inplace=True)
    (3): ReLU(inplace=True)
    (4): Linear(in_features=64, out_features=3, bias=True)
    (5): Identity()
  )
  (prop): Propagation(K=1, mode=None, lambda1=None, lambda2=None, L21=True, alpha=0.9500000000000001)
  (gcn): GCN(
    (convs): ModuleList(
      (0): GCNConv(500, 64)
      (1): GCNConv(64, 3)
    )
    (bns): ModuleList(
      (0): BatchNorm1d(64, eps=1e-05, momentum=0.1, affine=True, track_running_stats=True)
    )
    (output): Identity()
  )
)
propagate done
init label
Split: 01, Run: 01
None time:  1.5975205430295318
None Run 01:
Highest Train: 100.00
Highest Valid: 76.80
  Final Train: 100.00
   Final Test: 75.40
Split: 01, Run: 02
None time:  1.7024209471419454
None Run 02:
Highest Train: 100.00
Highest Valid: 74.80
  Final Train: 100.00
   Final Test: 73.00
Split: 01, Run: 03
None time:  1.776657945010811
None Run 03:
Highest Train: 100.00
Highest Valid: 74.60
  Final Train: 100.00
   Final Test: 73.20
run time now: 5.111023426055908
total time:  5.153703086078167
None All runs:
Highest Train: 100.00 ± 0.00
Highest Valid: 75.40 ± 1.22
  Final Train: 100.00 ± 0.00
   Final Test: 73.87 ± 1.33
[I 2023-06-12 00:25:50,213] Trial 148 finished with value: 75.4000015258789 and parameters: {'Fwd': 1.0006626642155232e-06, 'K': 1, 'alpha': 0.9500000000000001, 'dropout': 0.8, 'gnnepoch': 50, 'lambda1': 0.75, 'lambda2': 5.711485185835044, 'loop': 1, 'loss': 'MSE', 'lr': 0.0026235285863307205, 'softmaxF': True, 'useGCN': True, 'weight_decay': 0.0016086320055216765, 'weightedloss': False}. Best is trial 132 with value: 83.0666732788086.
/home/wxy/miniconda3/lib/python3.10/site-packages/optuna/distributions.py:685: UserWarning: The distribution is specified by [0, 1.00001] and step=0.05, but the range is not divisible by `step`. It will be replaced by [0, 1.0].
  warnings.warn(
K:  10
alpha:  0.9500000000000001
lr:  0.0032129868670751687
weight_decay:  0.002961797584624094
dropout:  0.9
fix split and run 3 times
Data: Data(x=[19717, 500], y=[19717], train_mask=[19717], val_mask=[19717], test_mask=[19717], adj_t=[19717, 19717, nnz=88648])
num_train tensor(60)
num_noise 0
noise: tensor(0)
data feature 500
ALTOPT(
  (lins): Sequential(
    (0): Linear(in_features=500, out_features=64, bias=True)
    (1): BatchNorm1d(64, eps=1e-05, momentum=0.1, affine=True, track_running_stats=True)
    (2): Dropout(p=0.9, inplace=True)
    (3): ReLU(inplace=True)
    (4): Linear(in_features=64, out_features=3, bias=True)
    (5): Identity()
  )
  (prop): Propagation(K=10, mode=None, lambda1=None, lambda2=None, L21=True, alpha=0.9500000000000001)
  (gcn): GCN(
    (convs): ModuleList(
      (0): GCNConv(500, 64)
      (1): GCNConv(64, 3)
    )
    (bns): ModuleList(
      (0): BatchNorm1d(64, eps=1e-05, momentum=0.1, affine=True, track_running_stats=True)
    )
    (output): Identity()
  )
)
propagate done
init label
Split: 01, Run: 01
None time:  2.2467487540561706
None Run 01:
Highest Train: 100.00
Highest Valid: 80.60
  Final Train: 100.00
   Final Test: 77.70
Split: 01, Run: 02
None time:  1.9663864460308105
None Run 02:
Highest Train: 100.00
Highest Valid: 82.40
  Final Train: 100.00
   Final Test: 79.80
Split: 01, Run: 03
None time:  1.3523116188589483
None Run 03:
Highest Train: 100.00
Highest Valid: 81.60
  Final Train: 100.00
   Final Test: 79.80
run time now: 5.614973306655884
total time:  5.669156496180221
None All runs:
Highest Train: 100.00 ± 0.00
Highest Valid: 81.53 ± 0.90
  Final Train: 100.00 ± 0.00
   Final Test: 79.10 ± 1.21
[I 2023-06-12 00:25:56,441] Trial 149 finished with value: 81.53333282470703 and parameters: {'Fwd': 1.5165556090937028e-06, 'K': 10, 'alpha': 0.9500000000000001, 'dropout': 0.9, 'gnnepoch': 60, 'lambda1': 0.5, 'lambda2': 6.272261966704553, 'loop': 1, 'loss': 'MSE', 'lr': 0.0032129868670751687, 'softmaxF': False, 'useGCN': False, 'weight_decay': 0.002961797584624094, 'weightedloss': False}. Best is trial 132 with value: 83.0666732788086.
/home/wxy/miniconda3/lib/python3.10/site-packages/optuna/distributions.py:685: UserWarning: The distribution is specified by [0, 1.00001] and step=0.05, but the range is not divisible by `step`. It will be replaced by [0, 1.0].
  warnings.warn(
K:  10
alpha:  1.0
lr:  0.0021504470452464288
weight_decay:  0.0022313998721879918
dropout:  0.9
fix split and run 3 times
Data: Data(x=[19717, 500], y=[19717], train_mask=[19717], val_mask=[19717], test_mask=[19717], adj_t=[19717, 19717, nnz=88648])
num_train tensor(60)
num_noise 0
noise: tensor(0)
data feature 500
ALTOPT(
  (lins): Sequential(
    (0): Linear(in_features=500, out_features=64, bias=True)
    (1): BatchNorm1d(64, eps=1e-05, momentum=0.1, affine=True, track_running_stats=True)
    (2): Dropout(p=0.9, inplace=True)
    (3): ReLU(inplace=True)
    (4): Linear(in_features=64, out_features=3, bias=True)
    (5): Identity()
  )
  (prop): Propagation(K=10, mode=None, lambda1=None, lambda2=None, L21=True, alpha=1.0)
  (gcn): GCN(
    (convs): ModuleList(
      (0): GCNConv(500, 64)
      (1): GCNConv(64, 3)
    )
    (bns): ModuleList(
      (0): BatchNorm1d(64, eps=1e-05, momentum=0.1, affine=True, track_running_stats=True)
    )
    (output): Identity()
  )
)
propagate done
init label
Split: 01, Run: 01, Epoch: 100, Loss: 0.3519, Train: 100.00%, Valid: 83.00% Test: 78.60%
Split: 01, Run: 01
None time:  3.851903175935149
None Run 01:
Highest Train: 100.00
Highest Valid: 83.00
  Final Train: 100.00
   Final Test: 78.60
Split: 01, Run: 02
None time:  1.641841143136844
None Run 02:
Highest Train: 100.00
Highest Valid: 83.00
  Final Train: 100.00
   Final Test: 80.10
Split: 01, Run: 03
None time:  1.3980871620588005
None Run 03:
Highest Train: 100.00
Highest Valid: 82.00
  Final Train: 100.00
   Final Test: 79.80
run time now: 6.9750657081604
total time:  7.022449082927778
None All runs:
Highest Train: 100.00 ± 0.00
Highest Valid: 82.67 ± 0.58
  Final Train: 100.00 ± 0.00
   Final Test: 79.50 ± 0.79
[I 2023-06-12 00:26:04,047] Trial 150 finished with value: 82.66666412353516 and parameters: {'Fwd': 3.547569997831303e-06, 'K': 10, 'alpha': 1.0, 'dropout': 0.9, 'gnnepoch': 60, 'lambda1': 0.65, 'lambda2': 7.627571276151746, 'loop': 1, 'loss': 'MSE', 'lr': 0.0021504470452464288, 'softmaxF': True, 'useGCN': False, 'weight_decay': 0.0022313998721879918, 'weightedloss': False}. Best is trial 132 with value: 83.0666732788086.
/home/wxy/miniconda3/lib/python3.10/site-packages/optuna/distributions.py:685: UserWarning: The distribution is specified by [0, 1.00001] and step=0.05, but the range is not divisible by `step`. It will be replaced by [0, 1.0].
  warnings.warn(
K:  10
alpha:  1.0
lr:  0.0021274951298323784
weight_decay:  0.002452227811782785
dropout:  0.9
fix split and run 3 times
Data: Data(x=[19717, 500], y=[19717], train_mask=[19717], val_mask=[19717], test_mask=[19717], adj_t=[19717, 19717, nnz=88648])
num_train tensor(60)
num_noise 0
noise: tensor(0)
data feature 500
ALTOPT(
  (lins): Sequential(
    (0): Linear(in_features=500, out_features=64, bias=True)
    (1): BatchNorm1d(64, eps=1e-05, momentum=0.1, affine=True, track_running_stats=True)
    (2): Dropout(p=0.9, inplace=True)
    (3): ReLU(inplace=True)
    (4): Linear(in_features=64, out_features=3, bias=True)
    (5): Identity()
  )
  (prop): Propagation(K=10, mode=None, lambda1=None, lambda2=None, L21=True, alpha=1.0)
  (gcn): GCN(
    (convs): ModuleList(
      (0): GCNConv(500, 64)
      (1): GCNConv(64, 3)
    )
    (bns): ModuleList(
      (0): BatchNorm1d(64, eps=1e-05, momentum=0.1, affine=True, track_running_stats=True)
    )
    (output): Identity()
  )
)
propagate done
init label
Split: 01, Run: 01
None time:  2.93300538090989
None Run 01:
Highest Train: 100.00
Highest Valid: 82.60
  Final Train: 100.00
   Final Test: 78.10
Split: 01, Run: 02
None time:  1.1919187249150127
None Run 02:
Highest Train: 100.00
Highest Valid: 81.60
  Final Train: 100.00
   Final Test: 78.70
Split: 01, Run: 03
None time:  1.9240028590429574
None Run 03:
Highest Train: 100.00
Highest Valid: 81.20
  Final Train: 100.00
   Final Test: 79.20
run time now: 6.108996391296387
total time:  6.152492722030729
None All runs:
Highest Train: 100.00 ± 0.00
Highest Valid: 81.80 ± 0.72
  Final Train: 100.00 ± 0.00
   Final Test: 78.67 ± 0.55
[I 2023-06-12 00:26:10,668] Trial 151 finished with value: 81.79999542236328 and parameters: {'Fwd': 2.954400965148391e-06, 'K': 10, 'alpha': 1.0, 'dropout': 0.9, 'gnnepoch': 60, 'lambda1': 0.65, 'lambda2': 7.638355194023439, 'loop': 1, 'loss': 'MSE', 'lr': 0.0021274951298323784, 'softmaxF': True, 'useGCN': False, 'weight_decay': 0.002452227811782785, 'weightedloss': False}. Best is trial 132 with value: 83.0666732788086.
/home/wxy/miniconda3/lib/python3.10/site-packages/optuna/distributions.py:685: UserWarning: The distribution is specified by [0, 1.00001] and step=0.05, but the range is not divisible by `step`. It will be replaced by [0, 1.0].
  warnings.warn(
K:  10
alpha:  1.0
lr:  0.0028182453675267834
weight_decay:  0.004088612059051921
dropout:  0.9
fix split and run 3 times
Data: Data(x=[19717, 500], y=[19717], train_mask=[19717], val_mask=[19717], test_mask=[19717], adj_t=[19717, 19717, nnz=88648])
num_train tensor(60)
num_noise 0
noise: tensor(0)
data feature 500
ALTOPT(
  (lins): Sequential(
    (0): Linear(in_features=500, out_features=64, bias=True)
    (1): BatchNorm1d(64, eps=1e-05, momentum=0.1, affine=True, track_running_stats=True)
    (2): Dropout(p=0.9, inplace=True)
    (3): ReLU(inplace=True)
    (4): Linear(in_features=64, out_features=3, bias=True)
    (5): Identity()
  )
  (prop): Propagation(K=10, mode=None, lambda1=None, lambda2=None, L21=True, alpha=1.0)
  (gcn): GCN(
    (convs): ModuleList(
      (0): GCNConv(500, 64)
      (1): GCNConv(64, 3)
    )
    (bns): ModuleList(
      (0): BatchNorm1d(64, eps=1e-05, momentum=0.1, affine=True, track_running_stats=True)
    )
    (output): Identity()
  )
)
propagate done
init label
Split: 01, Run: 01
None time:  1.9982061840128154
None Run 01:
Highest Train: 100.00
Highest Valid: 81.60
  Final Train: 100.00
   Final Test: 76.20
Split: 01, Run: 02
None time:  1.4246351020410657
None Run 02:
Highest Train: 100.00
Highest Valid: 82.80
  Final Train: 100.00
   Final Test: 80.70
Split: 01, Run: 03
None time:  1.0439447241369635
None Run 03:
Highest Train: 100.00
Highest Valid: 83.60
  Final Train: 100.00
   Final Test: 79.30
run time now: 4.514053583145142
total time:  4.564350909087807
None All runs:
Highest Train: 100.00 ± 0.00
Highest Valid: 82.67 ± 1.01
  Final Train: 100.00 ± 0.00
   Final Test: 78.73 ± 2.30
