[I 2023-06-11 23:29:45,142] Trial 143 finished with value: 71.66667175292969 and parameters: {'Fwd': 0.014503368593785104, 'K': 8, 'alpha': 0.25, 'dropout': 0.9, 'gnnepoch': 120, 'lambda1': 0.7000000000000001, 'lambda2': 3.287249765643951, 'loop': 0, 'loss': 'CE', 'lr': 0.0028880724188138102, 'softmaxF': False, 'useGCN': True, 'weight_decay': 2.266598265164211e-06, 'weightedloss': False}. Best is trial 101 with value: 71.79999542236328.
/home/wxy/miniconda3/lib/python3.10/site-packages/optuna/distributions.py:685: UserWarning: The distribution is specified by [0, 1.00001] and step=0.05, but the range is not divisible by `step`. It will be replaced by [0, 1.0].
  warnings.warn(
K:  8
alpha:  0.30000000000000004
lr:  0.0027616805342311774
weight_decay:  2.205150367449761e-06
dropout:  0.9
fix split and run 3 times
Data: Data(x=[3327, 3703], y=[3327], train_mask=[3327], val_mask=[3327], test_mask=[3327], adj_t=[3327, 3327, nnz=9104])
num_train tensor(120)
num_noise 0
noise: tensor(0)
data feature 3703
ALTOPT(
  (lins): Sequential(
    (0): Linear(in_features=3703, out_features=64, bias=True)
    (1): BatchNorm1d(64, eps=1e-05, momentum=0.1, affine=True, track_running_stats=True)
    (2): Dropout(p=0.9, inplace=True)
    (3): ReLU(inplace=True)
    (4): Linear(in_features=64, out_features=6, bias=True)
    (5): LogSoftmax(dim=-1)
  )
  (prop): Propagation(K=8, mode=None, lambda1=None, lambda2=None, L21=True, alpha=0.30000000000000004)
  (gcn): GCN(
    (convs): ModuleList(
      (0): GCNConv(3703, 64)
      (1): GCNConv(64, 6)
    )
    (bns): ModuleList(
      (0): BatchNorm1d(64, eps=1e-05, momentum=0.1, affine=True, track_running_stats=True)
    )
    (output): LogSoftmax(dim=-1)
  )
)
propagate done
init label
Split: 01, Run: 01
None time:  1.067188112065196
None Run 01:
Highest Train: 100.00
Highest Valid: 71.00
  Final Train: 100.00
   Final Test: 69.20
Split: 01, Run: 02
None time:  1.0205025568138808
None Run 02:
Highest Train: 100.00
Highest Valid: 71.80
  Final Train: 100.00
   Final Test: 70.10
Split: 01, Run: 03
None time:  1.0492286030203104
None Run 03:
Highest Train: 100.00
Highest Valid: 72.00
  Final Train: 100.00
   Final Test: 70.30
run time now: 3.176992416381836
total time:  3.227520567830652
None All runs:
Highest Train: 100.00 ± 0.00
Highest Valid: 71.60 ± 0.53
  Final Train: 100.00 ± 0.00
   Final Test: 69.87 ± 0.59
[I 2023-06-11 23:29:48,787] Trial 144 finished with value: 71.5999984741211 and parameters: {'Fwd': 0.021901935649491083, 'K': 8, 'alpha': 0.30000000000000004, 'dropout': 0.9, 'gnnepoch': 120, 'lambda1': 0.8, 'lambda2': 3.138323649582419, 'loop': 0, 'loss': 'CE', 'lr': 0.0027616805342311774, 'softmaxF': False, 'useGCN': True, 'weight_decay': 2.205150367449761e-06, 'weightedloss': False}. Best is trial 101 with value: 71.79999542236328.
/home/wxy/miniconda3/lib/python3.10/site-packages/optuna/distributions.py:685: UserWarning: The distribution is specified by [0, 1.00001] and step=0.05, but the range is not divisible by `step`. It will be replaced by [0, 1.0].
  warnings.warn(
K:  7
alpha:  0.30000000000000004
lr:  0.002374841132465236
weight_decay:  2.242772068813548e-06
dropout:  0.9
fix split and run 3 times
Data: Data(x=[3327, 3703], y=[3327], train_mask=[3327], val_mask=[3327], test_mask=[3327], adj_t=[3327, 3327, nnz=9104])
num_train tensor(120)
num_noise 0
noise: tensor(0)
data feature 3703
ALTOPT(
  (lins): Sequential(
    (0): Linear(in_features=3703, out_features=64, bias=True)
    (1): BatchNorm1d(64, eps=1e-05, momentum=0.1, affine=True, track_running_stats=True)
    (2): Dropout(p=0.9, inplace=True)
    (3): ReLU(inplace=True)
    (4): Linear(in_features=64, out_features=6, bias=True)
    (5): LogSoftmax(dim=-1)
  )
  (prop): Propagation(K=7, mode=None, lambda1=None, lambda2=None, L21=True, alpha=0.30000000000000004)
  (gcn): GCN(
    (convs): ModuleList(
      (0): GCNConv(3703, 64)
      (1): GCNConv(64, 6)
    )
    (bns): ModuleList(
      (0): BatchNorm1d(64, eps=1e-05, momentum=0.1, affine=True, track_running_stats=True)
    )
    (output): LogSoftmax(dim=-1)
  )
)
propagate done
init label
Split: 01, Run: 01
None time:  0.31767559610307217
None Run 01:
Highest Train: 100.00
Highest Valid: 70.00
  Final Train: 100.00
   Final Test: 69.10
Split: 01, Run: 02
None time:  0.410109766991809
None Run 02:
Highest Train: 100.00
Highest Valid: 70.60
  Final Train: 100.00
   Final Test: 70.20
Split: 01, Run: 03
None time:  0.35676826094277203
None Run 03:
Highest Train: 100.00
Highest Valid: 73.20
  Final Train: 100.00
   Final Test: 70.90
run time now: 1.1313450336456299
total time:  1.1895854228641838
None All runs:
Highest Train: 100.00 ± 0.00
Highest Valid: 71.27 ± 1.70
  Final Train: 100.00 ± 0.00
   Final Test: 70.07 ± 0.91
[I 2023-06-11 23:29:50,425] Trial 145 finished with value: 71.26667022705078 and parameters: {'Fwd': 0.015616316541776079, 'K': 7, 'alpha': 0.30000000000000004, 'dropout': 0.9, 'gnnepoch': 30, 'lambda1': 0.7000000000000001, 'lambda2': 3.0790683000688865, 'loop': 0, 'loss': 'CE', 'lr': 0.002374841132465236, 'softmaxF': False, 'useGCN': True, 'weight_decay': 2.242772068813548e-06, 'weightedloss': False}. Best is trial 101 with value: 71.79999542236328.
/home/wxy/miniconda3/lib/python3.10/site-packages/optuna/distributions.py:685: UserWarning: The distribution is specified by [0, 1.00001] and step=0.05, but the range is not divisible by `step`. It will be replaced by [0, 1.0].
  warnings.warn(
K:  8
alpha:  0.4
lr:  0.00215354486816777
weight_decay:  2.97022728687483e-06
dropout:  0.8
fix split and run 3 times
Data: Data(x=[3327, 3703], y=[3327], train_mask=[3327], val_mask=[3327], test_mask=[3327], adj_t=[3327, 3327, nnz=9104])
num_train tensor(120)
num_noise 0
noise: tensor(0)
data feature 3703
ALTOPT(
  (lins): Sequential(
    (0): Linear(in_features=3703, out_features=64, bias=True)
    (1): BatchNorm1d(64, eps=1e-05, momentum=0.1, affine=True, track_running_stats=True)
    (2): Dropout(p=0.8, inplace=True)
    (3): ReLU(inplace=True)
    (4): Linear(in_features=64, out_features=6, bias=True)
    (5): LogSoftmax(dim=-1)
  )
  (prop): Propagation(K=8, mode=None, lambda1=None, lambda2=None, L21=True, alpha=0.4)
  (gcn): GCN(
    (convs): ModuleList(
      (0): GCNConv(3703, 64)
      (1): GCNConv(64, 6)
    )
    (bns): ModuleList(
      (0): BatchNorm1d(64, eps=1e-05, momentum=0.1, affine=True, track_running_stats=True)
    )
    (output): LogSoftmax(dim=-1)
  )
)
propagate done
init label
Split: 01, Run: 01
None time:  1.072344862157479
None Run 01:
Highest Train: 100.00
Highest Valid: 71.20
  Final Train: 100.00
   Final Test: 69.70
Split: 01, Run: 02
None time:  0.992259917082265
None Run 02:
Highest Train: 100.00
Highest Valid: 72.60
  Final Train: 100.00
   Final Test: 70.00
Split: 01, Run: 03
None time:  1.0728648868389428
None Run 03:
Highest Train: 100.00
Highest Valid: 71.80
  Final Train: 100.00
   Final Test: 70.60
run time now: 3.1793248653411865
total time:  3.237862005829811
None All runs:
Highest Train: 100.00 ± 0.00
Highest Valid: 71.87 ± 0.70
  Final Train: 100.00 ± 0.00
   Final Test: 70.10 ± 0.46
[I 2023-06-11 23:29:54,144] Trial 146 finished with value: 71.86666870117188 and parameters: {'Fwd': 0.015280242112499284, 'K': 8, 'alpha': 0.4, 'dropout': 0.8, 'gnnepoch': 120, 'lambda1': 0.7000000000000001, 'lambda2': 3.6121353692168916, 'loop': 0, 'loss': 'CE', 'lr': 0.00215354486816777, 'softmaxF': False, 'useGCN': True, 'weight_decay': 2.97022728687483e-06, 'weightedloss': False}. Best is trial 146 with value: 71.86666870117188.
/home/wxy/miniconda3/lib/python3.10/site-packages/optuna/distributions.py:685: UserWarning: The distribution is specified by [0, 1.00001] and step=0.05, but the range is not divisible by `step`. It will be replaced by [0, 1.0].
  warnings.warn(
K:  8
alpha:  0.4
lr:  0.0020632089827433775
weight_decay:  3.2502958381020674e-06
dropout:  0.8
fix split and run 3 times
Data: Data(x=[3327, 3703], y=[3327], train_mask=[3327], val_mask=[3327], test_mask=[3327], adj_t=[3327, 3327, nnz=9104])
num_train tensor(120)
num_noise 0
noise: tensor(0)
data feature 3703
ALTOPT(
  (lins): Sequential(
    (0): Linear(in_features=3703, out_features=64, bias=True)
    (1): BatchNorm1d(64, eps=1e-05, momentum=0.1, affine=True, track_running_stats=True)
    (2): Dropout(p=0.8, inplace=True)
    (3): ReLU(inplace=True)
    (4): Linear(in_features=64, out_features=6, bias=True)
    (5): LogSoftmax(dim=-1)
  )
  (prop): Propagation(K=8, mode=None, lambda1=None, lambda2=None, L21=True, alpha=0.4)
  (gcn): GCN(
    (convs): ModuleList(
      (0): GCNConv(3703, 64)
      (1): GCNConv(64, 6)
    )
    (bns): ModuleList(
      (0): BatchNorm1d(64, eps=1e-05, momentum=0.1, affine=True, track_running_stats=True)
    )
    (output): LogSoftmax(dim=-1)
  )
)
propagate done
init label
Split: 01, Run: 01
None time:  0.9709733300842345
None Run 01:
Highest Train: 100.00
Highest Valid: 71.20
  Final Train: 100.00
   Final Test: 69.80
Split: 01, Run: 02
None time:  1.0885998921003193
None Run 02:
Highest Train: 100.00
Highest Valid: 69.60
  Final Train: 100.00
   Final Test: 68.50
Split: 01, Run: 03
None time:  0.9664727719500661
None Run 03:
Highest Train: 100.00
Highest Valid: 71.40
  Final Train: 100.00
   Final Test: 70.40
run time now: 3.0674173831939697
total time:  3.129810177953914
None All runs:
Highest Train: 100.00 ± 0.00
Highest Valid: 70.73 ± 0.99
  Final Train: 100.00 ± 0.00
   Final Test: 69.57 ± 0.97
[I 2023-06-11 23:29:57,724] Trial 147 finished with value: 70.73333740234375 and parameters: {'Fwd': 0.028861330006738857, 'K': 8, 'alpha': 0.4, 'dropout': 0.8, 'gnnepoch': 110, 'lambda1': 0.7000000000000001, 'lambda2': 3.7421893429136266, 'loop': 0, 'loss': 'CE', 'lr': 0.0020632089827433775, 'softmaxF': False, 'useGCN': True, 'weight_decay': 3.2502958381020674e-06, 'weightedloss': False}. Best is trial 146 with value: 71.86666870117188.
/home/wxy/miniconda3/lib/python3.10/site-packages/optuna/distributions.py:685: UserWarning: The distribution is specified by [0, 1.00001] and step=0.05, but the range is not divisible by `step`. It will be replaced by [0, 1.0].
  warnings.warn(
K:  8
alpha:  0.35000000000000003
lr:  0.0021293037565000153
weight_decay:  2.8018939564088708e-06
dropout:  0.8
fix split and run 3 times
Data: Data(x=[3327, 3703], y=[3327], train_mask=[3327], val_mask=[3327], test_mask=[3327], adj_t=[3327, 3327, nnz=9104])
num_train tensor(120)
num_noise 0
noise: tensor(0)
data feature 3703
ALTOPT(
  (lins): Sequential(
    (0): Linear(in_features=3703, out_features=64, bias=True)
    (1): BatchNorm1d(64, eps=1e-05, momentum=0.1, affine=True, track_running_stats=True)
    (2): Dropout(p=0.8, inplace=True)
    (3): ReLU(inplace=True)
    (4): Linear(in_features=64, out_features=6, bias=True)
    (5): Identity()
  )
  (prop): Propagation(K=8, mode=None, lambda1=None, lambda2=None, L21=True, alpha=0.35000000000000003)
  (gcn): GCN(
    (convs): ModuleList(
      (0): GCNConv(3703, 64)
      (1): GCNConv(64, 6)
    )
    (bns): ModuleList(
      (0): BatchNorm1d(64, eps=1e-05, momentum=0.1, affine=True, track_running_stats=True)
    )
    (output): Identity()
  )
)
propagate done
init label
Split: 01, Run: 01, Epoch: 100, Loss: 0.0000, Train: 100.00%, Valid: 67.80% Test: 69.30%
Split: 01, Run: 01
None time:  1.834923068061471
None Run 01:
Highest Train: 100.00
Highest Valid: 67.80
  Final Train: 100.00
   Final Test: 69.30
Split: 01, Run: 02, Epoch: 100, Loss: 0.0000, Train: 100.00%, Valid: 68.00% Test: 69.60%
Split: 01, Run: 02
None time:  1.7154459999874234
None Run 02:
Highest Train: 100.00
Highest Valid: 68.00
  Final Train: 100.00
   Final Test: 69.60
Split: 01, Run: 03, Epoch: 100, Loss: 0.0000, Train: 100.00%, Valid: 68.20% Test: 69.60%
Split: 01, Run: 03
None time:  1.7294749508146197
None Run 03:
Highest Train: 100.00
Highest Valid: 68.20
  Final Train: 100.00
   Final Test: 69.60
run time now: 5.324219226837158
total time:  5.386264626868069
None All runs:
Highest Train: 100.00 ± 0.00
Highest Valid: 68.00 ± 0.20
  Final Train: 100.00 ± 0.00
   Final Test: 69.50 ± 0.17
[I 2023-06-11 23:30:03,517] Trial 148 finished with value: 67.99999237060547 and parameters: {'Fwd': 0.01169421775836363, 'K': 8, 'alpha': 0.35000000000000003, 'dropout': 0.8, 'gnnepoch': 120, 'lambda1': 0.75, 'lambda2': 3.5294519864937137, 'loop': 0, 'loss': 'MSE', 'lr': 0.0021293037565000153, 'softmaxF': False, 'useGCN': True, 'weight_decay': 2.8018939564088708e-06, 'weightedloss': False}. Best is trial 146 with value: 71.86666870117188.
/home/wxy/miniconda3/lib/python3.10/site-packages/optuna/distributions.py:685: UserWarning: The distribution is specified by [0, 1.00001] and step=0.05, but the range is not divisible by `step`. It will be replaced by [0, 1.0].
  warnings.warn(
K:  8
alpha:  0.4
lr:  0.0025091918039692723
weight_decay:  1.970911007347368e-06
dropout:  0.7000000000000001
fix split and run 3 times
Data: Data(x=[3327, 3703], y=[3327], train_mask=[3327], val_mask=[3327], test_mask=[3327], adj_t=[3327, 3327, nnz=9104])
num_train tensor(120)
num_noise 0
noise: tensor(0)
data feature 3703
ALTOPT(
  (lins): Sequential(
    (0): Linear(in_features=3703, out_features=64, bias=True)
    (1): BatchNorm1d(64, eps=1e-05, momentum=0.1, affine=True, track_running_stats=True)
    (2): Dropout(p=0.7000000000000001, inplace=True)
    (3): ReLU(inplace=True)
    (4): Linear(in_features=64, out_features=6, bias=True)
    (5): LogSoftmax(dim=-1)
  )
  (prop): Propagation(K=8, mode=None, lambda1=None, lambda2=None, L21=True, alpha=0.4)
  (gcn): GCN(
    (convs): ModuleList(
      (0): GCNConv(3703, 64)
      (1): GCNConv(64, 6)
    )
    (bns): ModuleList(
      (0): BatchNorm1d(64, eps=1e-05, momentum=0.1, affine=True, track_running_stats=True)
    )
    (output): LogSoftmax(dim=-1)
  )
)
propagate done
init label
Split: 01, Run: 01
None time:  0.9444473839830607
None Run 01:
Highest Train: 100.00
Highest Valid: 71.80
  Final Train: 100.00
   Final Test: 69.90
Split: 01, Run: 02
None time:  1.0214197800960392
None Run 02:
Highest Train: 100.00
Highest Valid: 71.00
  Final Train: 100.00
   Final Test: 68.80
Split: 01, Run: 03
None time:  0.9906358141452074
None Run 03:
Highest Train: 100.00
Highest Valid: 71.40
  Final Train: 100.00
   Final Test: 69.40
run time now: 2.997556209564209
total time:  3.048499464057386
None All runs:
Highest Train: 100.00 ± 0.00
Highest Valid: 71.40 ± 0.40
  Final Train: 100.00 ± 0.00
   Final Test: 69.37 ± 0.55
[I 2023-06-11 23:30:07,016] Trial 149 finished with value: 71.4000015258789 and parameters: {'Fwd': 0.019367883552244, 'K': 8, 'alpha': 0.4, 'dropout': 0.7000000000000001, 'gnnepoch': 110, 'lambda1': 0.7000000000000001, 'lambda2': 4.547999192398249, 'loop': 0, 'loss': 'CE', 'lr': 0.0025091918039692723, 'softmaxF': False, 'useGCN': True, 'weight_decay': 1.970911007347368e-06, 'weightedloss': False}. Best is trial 146 with value: 71.86666870117188.
/home/wxy/miniconda3/lib/python3.10/site-packages/optuna/distributions.py:685: UserWarning: The distribution is specified by [0, 1.00001] and step=0.05, but the range is not divisible by `step`. It will be replaced by [0, 1.0].
  warnings.warn(
K:  7
alpha:  0.35000000000000003
lr:  0.00282876755740134
weight_decay:  1.3004291588321764e-06
dropout:  0.9
fix split and run 3 times
Data: Data(x=[3327, 3703], y=[3327], train_mask=[3327], val_mask=[3327], test_mask=[3327], adj_t=[3327, 3327, nnz=9104])
num_train tensor(120)
num_noise 0
noise: tensor(0)
data feature 3703
ALTOPT(
  (lins): Sequential(
    (0): Linear(in_features=3703, out_features=64, bias=True)
    (1): BatchNorm1d(64, eps=1e-05, momentum=0.1, affine=True, track_running_stats=True)
    (2): Dropout(p=0.9, inplace=True)
    (3): ReLU(inplace=True)
    (4): Linear(in_features=64, out_features=6, bias=True)
    (5): LogSoftmax(dim=-1)
  )
  (prop): Propagation(K=7, mode=None, lambda1=None, lambda2=None, L21=True, alpha=0.35000000000000003)
  (gcn): GCN(
    (convs): ModuleList(
      (0): GCNConv(3703, 64)
      (1): GCNConv(64, 6)
    )
    (bns): ModuleList(
      (0): BatchNorm1d(64, eps=1e-05, momentum=0.1, affine=True, track_running_stats=True)
    )
    (output): LogSoftmax(dim=-1)
  )
)
propagate done
init label
Split: 01, Run: 01
None time:  1.0436206969898194
None Run 01:
Highest Train: 100.00
Highest Valid: 71.40
  Final Train: 100.00
   Final Test: 70.10
Split: 01, Run: 02
None time:  1.090764407068491
None Run 02:
Highest Train: 100.00
Highest Valid: 71.20
  Final Train: 100.00
   Final Test: 70.00
Split: 01, Run: 03
None time:  1.0836394729558378
None Run 03:
Highest Train: 100.00
Highest Valid: 71.80
  Final Train: 100.00
   Final Test: 70.20
run time now: 3.2590396404266357
total time:  3.3265371988527477
None All runs:
Highest Train: 100.00 ± 0.00
Highest Valid: 71.47 ± 0.31
  Final Train: 100.00 ± 0.00
   Final Test: 70.10 ± 0.10
[I 2023-06-11 23:30:10,777] Trial 150 finished with value: 71.46666717529297 and parameters: {'Fwd': 0.042814420397537856, 'K': 7, 'alpha': 0.35000000000000003, 'dropout': 0.9, 'gnnepoch': 120, 'lambda1': 0.65, 'lambda2': 3.304252719770911, 'loop': 0, 'loss': 'CE', 'lr': 0.00282876755740134, 'softmaxF': False, 'useGCN': True, 'weight_decay': 1.3004291588321764e-06, 'weightedloss': False}. Best is trial 146 with value: 71.86666870117188.
/home/wxy/miniconda3/lib/python3.10/site-packages/optuna/distributions.py:685: UserWarning: The distribution is specified by [0, 1.00001] and step=0.05, but the range is not divisible by `step`. It will be replaced by [0, 1.0].
  warnings.warn(
K:  9
alpha:  0.4
lr:  0.0029922683464962147
weight_decay:  1.2504347321480166e-06
dropout:  0.9
fix split and run 3 times
Data: Data(x=[3327, 3703], y=[3327], train_mask=[3327], val_mask=[3327], test_mask=[3327], adj_t=[3327, 3327, nnz=9104])
num_train tensor(120)
num_noise 0
noise: tensor(0)
data feature 3703
ALTOPT(
  (lins): Sequential(
    (0): Linear(in_features=3703, out_features=64, bias=True)
    (1): BatchNorm1d(64, eps=1e-05, momentum=0.1, affine=True, track_running_stats=True)
    (2): Dropout(p=0.9, inplace=True)
    (3): ReLU(inplace=True)
    (4): Linear(in_features=64, out_features=6, bias=True)
    (5): LogSoftmax(dim=-1)
  )
  (prop): Propagation(K=9, mode=None, lambda1=None, lambda2=None, L21=True, alpha=0.4)
  (gcn): GCN(
    (convs): ModuleList(
      (0): GCNConv(3703, 64)
      (1): GCNConv(64, 6)
    )
    (bns): ModuleList(
      (0): BatchNorm1d(64, eps=1e-05, momentum=0.1, affine=True, track_running_stats=True)
    )
    (output): LogSoftmax(dim=-1)
  )
)
propagate done
init label
Split: 01, Run: 01
None time:  0.9909876929596066
None Run 01:
Highest Train: 100.00
Highest Valid: 71.40
  Final Train: 99.17
   Final Test: 68.90
Split: 01, Run: 02
None time:  1.0412736320868134
None Run 02:
Highest Train: 100.00
Highest Valid: 71.80
  Final Train: 100.00
   Final Test: 70.40
Split: 01, Run: 03
None time:  1.0847089630551636
None Run 03:
Highest Train: 100.00
Highest Valid: 71.80
  Final Train: 100.00
   Final Test: 69.80
run time now: 3.158855438232422
total time:  3.2193069278728217
None All runs:
Highest Train: 100.00 ± 0.00
Highest Valid: 71.67 ± 0.23
  Final Train: 99.72 ± 0.48
   Final Test: 69.70 ± 0.75
[I 2023-06-11 23:30:14,413] Trial 151 finished with value: 71.66667175292969 and parameters: {'Fwd': 0.015184302255119705, 'K': 9, 'alpha': 0.4, 'dropout': 0.9, 'gnnepoch': 120, 'lambda1': 1.0, 'lambda2': 3.119560131624738, 'loop': 0, 'loss': 'CE', 'lr': 0.0029922683464962147, 'softmaxF': False, 'useGCN': True, 'weight_decay': 1.2504347321480166e-06, 'weightedloss': False}. Best is trial 146 with value: 71.86666870117188.
/home/wxy/miniconda3/lib/python3.10/site-packages/optuna/distributions.py:685: UserWarning: The distribution is specified by [0, 1.00001] and step=0.05, but the range is not divisible by `step`. It will be replaced by [0, 1.0].
  warnings.warn(
K:  8
alpha:  0.45
lr:  0.003766950736110841
weight_decay:  1.6855920957868735e-06
dropout:  0.9
fix split and run 3 times
Data: Data(x=[3327, 3703], y=[3327], train_mask=[3327], val_mask=[3327], test_mask=[3327], adj_t=[3327, 3327, nnz=9104])
num_train tensor(120)
num_noise 0
noise: tensor(0)
data feature 3703
ALTOPT(
  (lins): Sequential(
    (0): Linear(in_features=3703, out_features=64, bias=True)
    (1): BatchNorm1d(64, eps=1e-05, momentum=0.1, affine=True, track_running_stats=True)
    (2): Dropout(p=0.9, inplace=True)
    (3): ReLU(inplace=True)
    (4): Linear(in_features=64, out_features=6, bias=True)
    (5): LogSoftmax(dim=-1)
  )
  (prop): Propagation(K=8, mode=None, lambda1=None, lambda2=None, L21=True, alpha=0.45)
  (gcn): GCN(
    (convs): ModuleList(
      (0): GCNConv(3703, 64)
      (1): GCNConv(64, 6)
    )
    (bns): ModuleList(
      (0): BatchNorm1d(64, eps=1e-05, momentum=0.1, affine=True, track_running_stats=True)
    )
    (output): LogSoftmax(dim=-1)
  )
)
propagate done
init label
Split: 01, Run: 01
None time:  1.0619264030829072
None Run 01:
Highest Train: 100.00
Highest Valid: 71.60
  Final Train: 99.17
   Final Test: 69.70
Split: 01, Run: 02
None time:  1.0246133541222662
None Run 02:
Highest Train: 100.00
Highest Valid: 71.60
  Final Train: 100.00
   Final Test: 69.70
Split: 01, Run: 03
None time:  1.0042970750946552
None Run 03:
Highest Train: 100.00
Highest Valid: 71.40
  Final Train: 100.00
   Final Test: 70.20
run time now: 3.1318721771240234
total time:  3.1921453829854727
None All runs:
Highest Train: 100.00 ± 0.00
Highest Valid: 71.53 ± 0.12
  Final Train: 99.72 ± 0.48
   Final Test: 69.87 ± 0.29
