[I 2023-06-11 23:28:02,945] Trial 116 finished with value: 70.79999542236328 and parameters: {'Fwd': 0.029926158132469245, 'K': 9, 'alpha': 0.1, 'dropout': 0.8, 'gnnepoch': 110, 'lambda1': 0.9, 'lambda2': 3.012054082218701, 'loop': 0, 'loss': 'CE', 'lr': 0.0029833733366881176, 'softmaxF': False, 'useGCN': True, 'weight_decay': 1.339057887234159e-06, 'weightedloss': False}. Best is trial 101 with value: 71.79999542236328.
/home/wxy/miniconda3/lib/python3.10/site-packages/optuna/distributions.py:685: UserWarning: The distribution is specified by [0, 1.00001] and step=0.05, but the range is not divisible by `step`. It will be replaced by [0, 1.0].
  warnings.warn(
K:  8
alpha:  0.25
lr:  0.002221808528629483
weight_decay:  4.446867585945911e-06
dropout:  0.9
fix split and run 3 times
Data: Data(x=[3327, 3703], y=[3327], train_mask=[3327], val_mask=[3327], test_mask=[3327], adj_t=[3327, 3327, nnz=9104])
num_train tensor(120)
num_noise 0
noise: tensor(0)
data feature 3703
ALTOPT(
  (lins): Sequential(
    (0): Linear(in_features=3703, out_features=64, bias=True)
    (1): BatchNorm1d(64, eps=1e-05, momentum=0.1, affine=True, track_running_stats=True)
    (2): Dropout(p=0.9, inplace=True)
    (3): ReLU(inplace=True)
    (4): Linear(in_features=64, out_features=6, bias=True)
    (5): LogSoftmax(dim=-1)
  )
  (prop): Propagation(K=8, mode=None, lambda1=None, lambda2=None, L21=True, alpha=0.25)
  (gcn): GCN(
    (convs): ModuleList(
      (0): GCNConv(3703, 64)
      (1): GCNConv(64, 6)
    )
    (bns): ModuleList(
      (0): BatchNorm1d(64, eps=1e-05, momentum=0.1, affine=True, track_running_stats=True)
    )
    (output): LogSoftmax(dim=-1)
  )
)
propagate done
init label
Split: 01, Run: 01
None time:  1.2200023930054158
None Run 01:
Highest Train: 100.00
Highest Valid: 71.00
  Final Train: 100.00
   Final Test: 69.10
Split: 01, Run: 02
None time:  1.2552116960287094
None Run 02:
Highest Train: 100.00
Highest Valid: 70.20
  Final Train: 100.00
   Final Test: 69.00
Split: 01, Run: 03
None time:  1.2522521729115397
None Run 03:
Highest Train: 100.00
Highest Valid: 72.20
  Final Train: 100.00
   Final Test: 70.10
run time now: 3.7912867069244385
total time:  3.842276613926515
None All runs:
Highest Train: 100.00 ± 0.00
Highest Valid: 71.13 ± 1.01
  Final Train: 100.00 ± 0.00
   Final Test: 69.40 ± 0.61
[I 2023-06-11 23:28:07,332] Trial 117 finished with value: 71.13333892822266 and parameters: {'Fwd': 0.018615268538506844, 'K': 8, 'alpha': 0.25, 'dropout': 0.9, 'gnnepoch': 120, 'lambda1': 0.75, 'lambda2': 2.2190662598712483, 'loop': 2, 'loss': 'CE', 'lr': 0.002221808528629483, 'softmaxF': False, 'useGCN': True, 'weight_decay': 4.446867585945911e-06, 'weightedloss': False}. Best is trial 101 with value: 71.79999542236328.
/home/wxy/miniconda3/lib/python3.10/site-packages/optuna/distributions.py:685: UserWarning: The distribution is specified by [0, 1.00001] and step=0.05, but the range is not divisible by `step`. It will be replaced by [0, 1.0].
  warnings.warn(
K:  9
alpha:  0.15000000000000002
lr:  0.0028032766135280924
weight_decay:  2.6606168407867755e-06
dropout:  0.8
fix split and run 3 times
Data: Data(x=[3327, 3703], y=[3327], train_mask=[3327], val_mask=[3327], test_mask=[3327], adj_t=[3327, 3327, nnz=9104])
num_train tensor(120)
num_noise 0
noise: tensor(0)
data feature 3703
ALTOPT(
  (lins): Sequential(
    (0): Linear(in_features=3703, out_features=64, bias=True)
    (1): BatchNorm1d(64, eps=1e-05, momentum=0.1, affine=True, track_running_stats=True)
    (2): Dropout(p=0.8, inplace=True)
    (3): ReLU(inplace=True)
    (4): Linear(in_features=64, out_features=6, bias=True)
    (5): LogSoftmax(dim=-1)
  )
  (prop): Propagation(K=9, mode=None, lambda1=None, lambda2=None, L21=True, alpha=0.15000000000000002)
  (gcn): GCN(
    (convs): ModuleList(
      (0): GCNConv(3703, 64)
      (1): GCNConv(64, 6)
    )
    (bns): ModuleList(
      (0): BatchNorm1d(64, eps=1e-05, momentum=0.1, affine=True, track_running_stats=True)
    )
    (output): LogSoftmax(dim=-1)
  )
)
propagate done
init label
Split: 01, Run: 01
None time:  1.0189653169363737
None Run 01:
Highest Train: 100.00
Highest Valid: 71.40
  Final Train: 99.17
   Final Test: 70.00
Split: 01, Run: 02
None time:  1.0228738570585847
None Run 02:
Highest Train: 100.00
Highest Valid: 70.40
  Final Train: 98.33
   Final Test: 68.60
Split: 01, Run: 03
None time:  0.9919819249771535
None Run 03:
Highest Train: 100.00
Highest Valid: 70.60
  Final Train: 99.17
   Final Test: 69.70
run time now: 3.0768587589263916
total time:  3.1335648300591856
None All runs:
Highest Train: 100.00 ± 0.00
Highest Valid: 70.80 ± 0.53
  Final Train: 98.89 ± 0.48
   Final Test: 69.43 ± 0.74
[I 2023-06-11 23:28:10,923] Trial 118 finished with value: 70.79999542236328 and parameters: {'Fwd': 0.011118316112819892, 'K': 9, 'alpha': 0.15000000000000002, 'dropout': 0.8, 'gnnepoch': 110, 'lambda1': 1.0, 'lambda2': 2.5300769499448204, 'loop': 0, 'loss': 'CE', 'lr': 0.0028032766135280924, 'softmaxF': False, 'useGCN': True, 'weight_decay': 2.6606168407867755e-06, 'weightedloss': False}. Best is trial 101 with value: 71.79999542236328.
/home/wxy/miniconda3/lib/python3.10/site-packages/optuna/distributions.py:685: UserWarning: The distribution is specified by [0, 1.00001] and step=0.05, but the range is not divisible by `step`. It will be replaced by [0, 1.0].
  warnings.warn(
K:  8
alpha:  0.2
lr:  0.0018222525375077437
weight_decay:  3.6770818545930856e-06
dropout:  0.9
fix split and run 3 times
Data: Data(x=[3327, 3703], y=[3327], train_mask=[3327], val_mask=[3327], test_mask=[3327], adj_t=[3327, 3327, nnz=9104])
num_train tensor(120)
num_noise 0
noise: tensor(0)
data feature 3703
ALTOPT(
  (lins): Sequential(
    (0): Linear(in_features=3703, out_features=64, bias=True)
    (1): BatchNorm1d(64, eps=1e-05, momentum=0.1, affine=True, track_running_stats=True)
    (2): Dropout(p=0.9, inplace=True)
    (3): ReLU(inplace=True)
    (4): Linear(in_features=64, out_features=6, bias=True)
    (5): LogSoftmax(dim=-1)
  )
  (prop): Propagation(K=8, mode=None, lambda1=None, lambda2=None, L21=True, alpha=0.2)
  (gcn): GCN(
    (convs): ModuleList(
      (0): GCNConv(3703, 64)
      (1): GCNConv(64, 6)
    )
    (bns): ModuleList(
      (0): BatchNorm1d(64, eps=1e-05, momentum=0.1, affine=True, track_running_stats=True)
    )
    (output): LogSoftmax(dim=-1)
  )
)
propagate done
init label
Split: 01, Run: 01
None time:  1.1026471450459212
None Run 01:
Highest Train: 100.00
Highest Valid: 70.60
  Final Train: 100.00
   Final Test: 69.10
Split: 01, Run: 02
None time:  1.0503519200719893
None Run 02:
Highest Train: 100.00
Highest Valid: 72.00
  Final Train: 100.00
   Final Test: 70.10
Split: 01, Run: 03
None time:  0.9706144488882273
None Run 03:
Highest Train: 100.00
Highest Valid: 72.20
  Final Train: 100.00
   Final Test: 69.90
run time now: 3.1657562255859375
total time:  3.223691347055137
None All runs:
Highest Train: 100.00 ± 0.00
Highest Valid: 71.60 ± 0.87
  Final Train: 100.00 ± 0.00
   Final Test: 69.70 ± 0.53
[I 2023-06-11 23:28:14,569] Trial 119 finished with value: 71.5999984741211 and parameters: {'Fwd': 0.009357623317876169, 'K': 8, 'alpha': 0.2, 'dropout': 0.9, 'gnnepoch': 120, 'lambda1': 0.8500000000000001, 'lambda2': 2.6833335081752816, 'loop': 0, 'loss': 'CE', 'lr': 0.0018222525375077437, 'softmaxF': False, 'useGCN': True, 'weight_decay': 3.6770818545930856e-06, 'weightedloss': False}. Best is trial 101 with value: 71.79999542236328.
/home/wxy/miniconda3/lib/python3.10/site-packages/optuna/distributions.py:685: UserWarning: The distribution is specified by [0, 1.00001] and step=0.05, but the range is not divisible by `step`. It will be replaced by [0, 1.0].
  warnings.warn(
K:  9
alpha:  0.05
lr:  0.00201417366023407
weight_decay:  1.9793554107448294e-06
dropout:  0.9
fix split and run 3 times
Data: Data(x=[3327, 3703], y=[3327], train_mask=[3327], val_mask=[3327], test_mask=[3327], adj_t=[3327, 3327, nnz=9104])
num_train tensor(120)
num_noise 0
noise: tensor(0)
data feature 3703
ALTOPT(
  (lins): Sequential(
    (0): Linear(in_features=3703, out_features=64, bias=True)
    (1): BatchNorm1d(64, eps=1e-05, momentum=0.1, affine=True, track_running_stats=True)
    (2): Dropout(p=0.9, inplace=True)
    (3): ReLU(inplace=True)
    (4): Linear(in_features=64, out_features=6, bias=True)
    (5): Identity()
  )
  (prop): Propagation(K=9, mode=None, lambda1=None, lambda2=None, L21=True, alpha=0.05)
  (gcn): GCN(
    (convs): ModuleList(
      (0): GCNConv(3703, 64)
      (1): GCNConv(64, 6)
    )
    (bns): ModuleList(
      (0): BatchNorm1d(64, eps=1e-05, momentum=0.1, affine=True, track_running_stats=True)
    )
    (output): Identity()
  )
)
propagate done
init label
Split: 01, Run: 01, Epoch: 100, Loss: 0.0000, Train: 100.00%, Valid: 69.00% Test: 70.30%
Split: 01, Run: 01
None time:  1.8330642147921026
None Run 01:
Highest Train: 100.00
Highest Valid: 69.00
  Final Train: 100.00
   Final Test: 70.30
Split: 01, Run: 02, Epoch: 100, Loss: 0.0000, Train: 100.00%, Valid: 69.60% Test: 70.00%
Split: 01, Run: 02
None time:  1.8721728390082717
None Run 02:
Highest Train: 100.00
Highest Valid: 69.60
  Final Train: 100.00
   Final Test: 70.00
Split: 01, Run: 03, Epoch: 100, Loss: 0.0000, Train: 100.00%, Valid: 69.40% Test: 69.30%
Split: 01, Run: 03
None time:  1.8112603779882193
None Run 03:
Highest Train: 100.00
Highest Valid: 69.40
  Final Train: 100.00
   Final Test: 69.30
run time now: 5.566213607788086
total time:  5.639826234895736
None All runs:
Highest Train: 100.00 ± 0.00
Highest Valid: 69.33 ± 0.31
  Final Train: 100.00 ± 0.00
   Final Test: 69.87 ± 0.51
[I 2023-06-11 23:28:20,683] Trial 120 finished with value: 69.33333587646484 and parameters: {'Fwd': 0.015262198975301507, 'K': 9, 'alpha': 0.05, 'dropout': 0.9, 'gnnepoch': 120, 'lambda1': 0.9500000000000001, 'lambda2': 3.3323785321735304, 'loop': 0, 'loss': 'MSE', 'lr': 0.00201417366023407, 'softmaxF': False, 'useGCN': True, 'weight_decay': 1.9793554107448294e-06, 'weightedloss': False}. Best is trial 101 with value: 71.79999542236328.
/home/wxy/miniconda3/lib/python3.10/site-packages/optuna/distributions.py:685: UserWarning: The distribution is specified by [0, 1.00001] and step=0.05, but the range is not divisible by `step`. It will be replaced by [0, 1.0].
  warnings.warn(
K:  8
alpha:  0.2
lr:  0.0019179303953471977
weight_decay:  3.796566845234747e-06
dropout:  0.9
fix split and run 3 times
Data: Data(x=[3327, 3703], y=[3327], train_mask=[3327], val_mask=[3327], test_mask=[3327], adj_t=[3327, 3327, nnz=9104])
num_train tensor(120)
num_noise 0
noise: tensor(0)
data feature 3703
ALTOPT(
  (lins): Sequential(
    (0): Linear(in_features=3703, out_features=64, bias=True)
    (1): BatchNorm1d(64, eps=1e-05, momentum=0.1, affine=True, track_running_stats=True)
    (2): Dropout(p=0.9, inplace=True)
    (3): ReLU(inplace=True)
    (4): Linear(in_features=64, out_features=6, bias=True)
    (5): LogSoftmax(dim=-1)
  )
  (prop): Propagation(K=8, mode=None, lambda1=None, lambda2=None, L21=True, alpha=0.2)
  (gcn): GCN(
    (convs): ModuleList(
      (0): GCNConv(3703, 64)
      (1): GCNConv(64, 6)
    )
    (bns): ModuleList(
      (0): BatchNorm1d(64, eps=1e-05, momentum=0.1, affine=True, track_running_stats=True)
    )
    (output): LogSoftmax(dim=-1)
  )
)
propagate done
init label
Split: 01, Run: 01
None time:  1.0762816660571843
None Run 01:
Highest Train: 100.00
Highest Valid: 70.60
  Final Train: 100.00
   Final Test: 68.90
Split: 01, Run: 02
None time:  1.0524819260463119
None Run 02:
Highest Train: 100.00
Highest Valid: 71.80
  Final Train: 100.00
   Final Test: 70.00
Split: 01, Run: 03
None time:  1.0947188320569694
None Run 03:
Highest Train: 100.00
Highest Valid: 71.80
  Final Train: 100.00
   Final Test: 70.00
run time now: 3.2651479244232178
total time:  3.3207223250065
None All runs:
Highest Train: 100.00 ± 0.00
Highest Valid: 71.40 ± 0.69
  Final Train: 100.00 ± 0.00
   Final Test: 69.63 ± 0.64
[I 2023-06-11 23:28:24,467] Trial 121 finished with value: 71.4000015258789 and parameters: {'Fwd': 0.008909289709148076, 'K': 8, 'alpha': 0.2, 'dropout': 0.9, 'gnnepoch': 120, 'lambda1': 0.8, 'lambda2': 2.6658083024322488, 'loop': 0, 'loss': 'CE', 'lr': 0.0019179303953471977, 'softmaxF': False, 'useGCN': True, 'weight_decay': 3.796566845234747e-06, 'weightedloss': False}. Best is trial 101 with value: 71.79999542236328.
/home/wxy/miniconda3/lib/python3.10/site-packages/optuna/distributions.py:685: UserWarning: The distribution is specified by [0, 1.00001] and step=0.05, but the range is not divisible by `step`. It will be replaced by [0, 1.0].
  warnings.warn(
K:  8
alpha:  0.25
lr:  0.0017156762924254358
weight_decay:  3.113285138160977e-06
dropout:  0.9
fix split and run 3 times
Data: Data(x=[3327, 3703], y=[3327], train_mask=[3327], val_mask=[3327], test_mask=[3327], adj_t=[3327, 3327, nnz=9104])
num_train tensor(120)
num_noise 0
noise: tensor(0)
data feature 3703
ALTOPT(
  (lins): Sequential(
    (0): Linear(in_features=3703, out_features=64, bias=True)
    (1): BatchNorm1d(64, eps=1e-05, momentum=0.1, affine=True, track_running_stats=True)
    (2): Dropout(p=0.9, inplace=True)
    (3): ReLU(inplace=True)
    (4): Linear(in_features=64, out_features=6, bias=True)
    (5): LogSoftmax(dim=-1)
  )
  (prop): Propagation(K=8, mode=None, lambda1=None, lambda2=None, L21=True, alpha=0.25)
  (gcn): GCN(
    (convs): ModuleList(
      (0): GCNConv(3703, 64)
      (1): GCNConv(64, 6)
    )
    (bns): ModuleList(
      (0): BatchNorm1d(64, eps=1e-05, momentum=0.1, affine=True, track_running_stats=True)
    )
    (output): LogSoftmax(dim=-1)
  )
)
propagate done
init label
Split: 01, Run: 01
None time:  1.1019123462028801
None Run 01:
Highest Train: 100.00
Highest Valid: 70.60
  Final Train: 100.00
   Final Test: 68.70
Split: 01, Run: 02
None time:  1.0970156439580023
None Run 02:
Highest Train: 100.00
Highest Valid: 71.20
  Final Train: 100.00
   Final Test: 70.10
Split: 01, Run: 03
None time:  0.9856902989558876
None Run 03:
Highest Train: 100.00
Highest Valid: 72.20
  Final Train: 100.00
   Final Test: 70.20
run time now: 3.2287099361419678
total time:  3.2809996139258146
None All runs:
Highest Train: 100.00 ± 0.00
Highest Valid: 71.33 ± 0.81
  Final Train: 100.00 ± 0.00
   Final Test: 69.67 ± 0.84
[I 2023-06-11 23:28:28,198] Trial 122 finished with value: 71.33333587646484 and parameters: {'Fwd': 0.010882528247458445, 'K': 8, 'alpha': 0.25, 'dropout': 0.9, 'gnnepoch': 120, 'lambda1': 0.8500000000000001, 'lambda2': 3.138159006884579, 'loop': 0, 'loss': 'CE', 'lr': 0.0017156762924254358, 'softmaxF': False, 'useGCN': True, 'weight_decay': 3.113285138160977e-06, 'weightedloss': False}. Best is trial 101 with value: 71.79999542236328.
/home/wxy/miniconda3/lib/python3.10/site-packages/optuna/distributions.py:685: UserWarning: The distribution is specified by [0, 1.00001] and step=0.05, but the range is not divisible by `step`. It will be replaced by [0, 1.0].
  warnings.warn(
K:  8
alpha:  0.2
lr:  0.002465123422422608
weight_decay:  6.507189570903828e-06
dropout:  0.9
fix split and run 3 times
Data: Data(x=[3327, 3703], y=[3327], train_mask=[3327], val_mask=[3327], test_mask=[3327], adj_t=[3327, 3327, nnz=9104])
num_train tensor(120)
num_noise 0
noise: tensor(0)
data feature 3703
ALTOPT(
  (lins): Sequential(
    (0): Linear(in_features=3703, out_features=64, bias=True)
    (1): BatchNorm1d(64, eps=1e-05, momentum=0.1, affine=True, track_running_stats=True)
    (2): Dropout(p=0.9, inplace=True)
    (3): ReLU(inplace=True)
    (4): Linear(in_features=64, out_features=6, bias=True)
    (5): LogSoftmax(dim=-1)
  )
  (prop): Propagation(K=8, mode=None, lambda1=None, lambda2=None, L21=True, alpha=0.2)
  (gcn): GCN(
    (convs): ModuleList(
      (0): GCNConv(3703, 64)
      (1): GCNConv(64, 6)
    )
    (bns): ModuleList(
      (0): BatchNorm1d(64, eps=1e-05, momentum=0.1, affine=True, track_running_stats=True)
    )
    (output): LogSoftmax(dim=-1)
  )
)
propagate done
init label
Split: 01, Run: 01
None time:  0.9159500610549003
None Run 01:
Highest Train: 100.00
Highest Valid: 71.20
  Final Train: 100.00
   Final Test: 69.30
Split: 01, Run: 02
None time:  0.9465786200016737
None Run 02:
Highest Train: 100.00
Highest Valid: 71.00
  Final Train: 100.00
   Final Test: 68.30
Split: 01, Run: 03
None time:  0.935068140970543
None Run 03:
Highest Train: 100.00
Highest Valid: 71.80
  Final Train: 100.00
   Final Test: 70.10
run time now: 2.846376419067383
total time:  2.901406046934426
None All runs:
Highest Train: 100.00 ± 0.00
Highest Valid: 71.33 ± 0.42
  Final Train: 100.00 ± 0.00
   Final Test: 69.23 ± 0.90
[I 2023-06-11 23:28:31,511] Trial 123 finished with value: 71.33333587646484 and parameters: {'Fwd': 0.02225138443949028, 'K': 8, 'alpha': 0.2, 'dropout': 0.9, 'gnnepoch': 110, 'lambda1': 0.9, 'lambda2': 2.914382069236502, 'loop': 0, 'loss': 'CE', 'lr': 0.002465123422422608, 'softmaxF': False, 'useGCN': True, 'weight_decay': 6.507189570903828e-06, 'weightedloss': False}. Best is trial 101 with value: 71.79999542236328.
/home/wxy/miniconda3/lib/python3.10/site-packages/optuna/distributions.py:685: UserWarning: The distribution is specified by [0, 1.00001] and step=0.05, but the range is not divisible by `step`. It will be replaced by [0, 1.0].
  warnings.warn(
K:  8
alpha:  0.30000000000000004
lr:  0.003037303378698427
weight_decay:  1.405804423748842e-06
dropout:  0.9
fix split and run 3 times
Data: Data(x=[3327, 3703], y=[3327], train_mask=[3327], val_mask=[3327], test_mask=[3327], adj_t=[3327, 3327, nnz=9104])
num_train tensor(120)
num_noise 0
noise: tensor(0)
data feature 3703
ALTOPT(
  (lins): Sequential(
    (0): Linear(in_features=3703, out_features=64, bias=True)
    (1): BatchNorm1d(64, eps=1e-05, momentum=0.1, affine=True, track_running_stats=True)
    (2): Dropout(p=0.9, inplace=True)
    (3): ReLU(inplace=True)
    (4): Linear(in_features=64, out_features=6, bias=True)
    (5): LogSoftmax(dim=-1)
  )
  (prop): Propagation(K=8, mode=None, lambda1=None, lambda2=None, L21=True, alpha=0.30000000000000004)
  (gcn): GCN(
    (convs): ModuleList(
      (0): GCNConv(3703, 64)
      (1): GCNConv(64, 6)
    )
    (bns): ModuleList(
      (0): BatchNorm1d(64, eps=1e-05, momentum=0.1, affine=True, track_running_stats=True)
    )
    (output): LogSoftmax(dim=-1)
  )
)
propagate done
init label
Split: 01, Run: 01
None time:  1.0424254280515015
None Run 01:
Highest Train: 100.00
Highest Valid: 71.40
  Final Train: 99.17
   Final Test: 69.10
Split: 01, Run: 02
None time:  1.115961944218725
None Run 02:
Highest Train: 100.00
Highest Valid: 71.60
  Final Train: 99.17
   Final Test: 69.90
Split: 01, Run: 03
None time:  1.0536459521390498
None Run 03:
Highest Train: 100.00
Highest Valid: 71.80
  Final Train: 100.00
   Final Test: 70.00
run time now: 3.254396438598633
total time:  3.311204956145957
None All runs:
Highest Train: 100.00 ± 0.00
Highest Valid: 71.60 ± 0.20
  Final Train: 99.44 ± 0.48
   Final Test: 69.67 ± 0.49
[I 2023-06-11 23:28:35,299] Trial 124 finished with value: 71.5999984741211 and parameters: {'Fwd': 0.0068197253124635746, 'K': 8, 'alpha': 0.30000000000000004, 'dropout': 0.9, 'gnnepoch': 120, 'lambda1': 0.9, 'lambda2': 2.179572812395075, 'loop': 0, 'loss': 'CE', 'lr': 0.003037303378698427, 'softmaxF': False, 'useGCN': True, 'weight_decay': 1.405804423748842e-06, 'weightedloss': False}. Best is trial 101 with value: 71.79999542236328.
/home/wxy/miniconda3/lib/python3.10/site-packages/optuna/distributions.py:685: UserWarning: The distribution is specified by [0, 1.00001] and step=0.05, but the range is not divisible by `step`. It will be replaced by [0, 1.0].
  warnings.warn(
K:  9
alpha:  0.1
lr:  0.003566491234557583
weight_decay:  2.509194836235073e-06
dropout:  0.8
fix split and run 3 times
Data: Data(x=[3327, 3703], y=[3327], train_mask=[3327], val_mask=[3327], test_mask=[3327], adj_t=[3327, 3327, nnz=9104])
num_train tensor(120)
num_noise 0
noise: tensor(0)
data feature 3703
ALTOPT(
  (lins): Sequential(
    (0): Linear(in_features=3703, out_features=64, bias=True)
    (1): BatchNorm1d(64, eps=1e-05, momentum=0.1, affine=True, track_running_stats=True)
    (2): Dropout(p=0.8, inplace=True)
    (3): ReLU(inplace=True)
    (4): Linear(in_features=64, out_features=6, bias=True)
    (5): LogSoftmax(dim=-1)
  )
  (prop): Propagation(K=9, mode=None, lambda1=None, lambda2=None, L21=True, alpha=0.1)
  (gcn): GCN(
    (convs): ModuleList(
      (0): GCNConv(3703, 64)
      (1): GCNConv(64, 6)
    )
    (bns): ModuleList(
      (0): BatchNorm1d(64, eps=1e-05, momentum=0.1, affine=True, track_running_stats=True)
    )
    (output): LogSoftmax(dim=-1)
  )
)
propagate done
init label
Split: 01, Run: 01
None time:  1.142884546192363
None Run 01:
Highest Train: 100.00
Highest Valid: 70.80
  Final Train: 100.00
   Final Test: 69.90
Split: 01, Run: 02
None time:  1.1144106979481876
None Run 02:
Highest Train: 100.00
Highest Valid: 70.60
  Final Train: 100.00
   Final Test: 69.90
Split: 01, Run: 03
None time:  1.0007266958709806
None Run 03:
Highest Train: 100.00
Highest Valid: 71.00
  Final Train: 100.00
   Final Test: 69.40
run time now: 3.299391269683838
total time:  3.347944187000394
None All runs:
Highest Train: 100.00 ± 0.00
Highest Valid: 70.80 ± 0.20
  Final Train: 100.00 ± 0.00
   Final Test: 69.73 ± 0.29
