[I 2023-06-12 00:12:20,426] A new study created in RDB with name: Cora_ALTOPT
/home/wxy/miniconda3/lib/python3.10/site-packages/optuna/distributions.py:685: UserWarning: The distribution is specified by [0, 1.00001] and step=0.05, but the range is not divisible by `step`. It will be replaced by [0, 1.0].
  warnings.warn(
K:  10
alpha:  0.15000000000000002
lr:  0.0005641130232810538
weight_decay:  1.5157192410327001e-05
dropout:  0.9
fix split and run 3 times
Data: Data(x=[2708, 1433], y=[2708], train_mask=[2708], val_mask=[2708], test_mask=[2708], adj_t=[2708, 2708, nnz=10556])
num_train tensor(140)
num_noise 0
noise: tensor(0)
data feature 1433
ALTOPT(
  (lins): Sequential(
    (0): Linear(in_features=1433, out_features=64, bias=True)
    (1): BatchNorm1d(64, eps=1e-05, momentum=0.1, affine=True, track_running_stats=True)
    (2): Dropout(p=0.9, inplace=True)
    (3): ReLU(inplace=True)
    (4): Linear(in_features=64, out_features=7, bias=True)
    (5): LogSoftmax(dim=-1)
  )
  (prop): Propagation(K=10, mode=None, lambda1=None, lambda2=None, L21=True, alpha=0.15000000000000002)
  (gcn): GCN(
    (convs): ModuleList(
      (0): GCNConv(1433, 64)
      (1): GCNConv(64, 7)
    )
    (bns): ModuleList(
      (0): BatchNorm1d(64, eps=1e-05, momentum=0.1, affine=True, track_running_stats=True)
    )
    (output): LogSoftmax(dim=-1)
  )
)
propagate done
init label
Split: 01, Run: 01
None time:  2.2817432368174195
None Run 01:
Highest Train: 100.00
Highest Valid: 78.80
  Final Train: 100.00
   Final Test: 77.70
Split: 01, Run: 02
None time:  1.1460212802048773
None Run 02:
Highest Train: 100.00
Highest Valid: 77.20
  Final Train: 100.00
   Final Test: 78.80
Split: 01, Run: 03, Epoch: 100, Loss: 0.0000, Train: 100.00%, Valid: 78.60% Test: 78.70%
Split: 01, Run: 03
None time:  4.0730769000947475
None Run 03:
Highest Train: 100.00
Highest Valid: 78.60
  Final Train: 100.00
   Final Test: 78.80
run time now: 7.5276243686676025
total time:  9.268166882917285
None All runs:
Highest Train: 100.00 ± 0.00
Highest Valid: 78.20 ± 0.87
  Final Train: 100.00 ± 0.00
   Final Test: 78.43 ± 0.64
[I 2023-06-12 00:12:30,408] Trial 0 finished with value: 78.20000457763672 and parameters: {'Fwd': 0.003242215488953444, 'K': 10, 'alpha': 0.15000000000000002, 'dropout': 0.9, 'gnnepoch': 50, 'lambda1': 1.0, 'lambda2': 6.4625375272157015, 'loop': 0, 'loss': 'CE', 'lr': 0.0005641130232810538, 'softmaxF': True, 'useGCN': True, 'weight_decay': 1.5157192410327001e-05, 'weightedloss': False}. Best is trial 0 with value: 78.20000457763672.
/home/wxy/miniconda3/lib/python3.10/site-packages/optuna/distributions.py:685: UserWarning: The distribution is specified by [0, 1.00001] and step=0.05, but the range is not divisible by `step`. It will be replaced by [0, 1.0].
  warnings.warn(
K:  2
alpha:  0.15000000000000002
lr:  0.00010334386356539129
weight_decay:  0.0030641825665396315
dropout:  0.2
fix split and run 3 times
Data: Data(x=[2708, 1433], y=[2708], train_mask=[2708], val_mask=[2708], test_mask=[2708], adj_t=[2708, 2708, nnz=10556])
num_train tensor(140)
num_noise 0
noise: tensor(0)
data feature 1433
ALTOPT(
  (lins): Sequential(
    (0): Linear(in_features=1433, out_features=64, bias=True)
    (1): BatchNorm1d(64, eps=1e-05, momentum=0.1, affine=True, track_running_stats=True)
    (2): Dropout(p=0.2, inplace=True)
    (3): ReLU(inplace=True)
    (4): Linear(in_features=64, out_features=7, bias=True)
    (5): Identity()
  )
  (prop): Propagation(K=2, mode=None, lambda1=None, lambda2=None, L21=True, alpha=0.15000000000000002)
  (gcn): GCN(
    (convs): ModuleList(
      (0): GCNConv(1433, 64)
      (1): GCNConv(64, 7)
    )
    (bns): ModuleList(
      (0): BatchNorm1d(64, eps=1e-05, momentum=0.1, affine=True, track_running_stats=True)
    )
    (output): Identity()
  )
)
propagate done
init label
Split: 01, Run: 01
None time:  0.594500879989937
None Run 01:
Highest Train: 100.00
Highest Valid: 72.40
  Final Train: 100.00
   Final Test: 73.00
Split: 01, Run: 02
None time:  0.5299097830429673
None Run 02:
Highest Train: 100.00
Highest Valid: 72.40
  Final Train: 100.00
   Final Test: 73.00
Split: 01, Run: 03
None time:  0.5935447087977082
None Run 03:
Highest Train: 100.00
Highest Valid: 72.40
  Final Train: 100.00
   Final Test: 73.00
run time now: 1.7414193153381348
total time:  1.766035865060985
None All runs:
Highest Train: 100.00 ± 0.00
Highest Valid: 72.40 ± 0.00
  Final Train: 100.00 ± 0.00
   Final Test: 73.00 ± 0.00
[I 2023-06-12 00:12:32,726] Trial 1 finished with value: 72.39999389648438 and parameters: {'Fwd': 2.1733443573136583e-06, 'K': 2, 'alpha': 0.15000000000000002, 'dropout': 0.2, 'gnnepoch': 10, 'lambda1': 0.0, 'lambda2': 9.731837095573022, 'loop': 0, 'loss': 'MSE', 'lr': 0.00010334386356539129, 'softmaxF': True, 'useGCN': False, 'weight_decay': 0.0030641825665396315, 'weightedloss': False}. Best is trial 0 with value: 78.20000457763672.
/home/wxy/miniconda3/lib/python3.10/site-packages/optuna/distributions.py:685: UserWarning: The distribution is specified by [0, 1.00001] and step=0.05, but the range is not divisible by `step`. It will be replaced by [0, 1.0].
  warnings.warn(
K:  6
alpha:  0.6000000000000001
lr:  0.00029557494619203445
weight_decay:  1.93527790029059e-05
dropout:  0.7000000000000001
fix split and run 3 times
Data: Data(x=[2708, 1433], y=[2708], train_mask=[2708], val_mask=[2708], test_mask=[2708], adj_t=[2708, 2708, nnz=10556])
num_train tensor(140)
num_noise 0
noise: tensor(0)
data feature 1433
ALTOPT(
  (lins): Sequential(
    (0): Linear(in_features=1433, out_features=64, bias=True)
    (1): BatchNorm1d(64, eps=1e-05, momentum=0.1, affine=True, track_running_stats=True)
    (2): Dropout(p=0.7000000000000001, inplace=True)
    (3): ReLU(inplace=True)
    (4): Linear(in_features=64, out_features=7, bias=True)
    (5): LogSoftmax(dim=-1)
  )
  (prop): Propagation(K=6, mode=None, lambda1=None, lambda2=None, L21=True, alpha=0.6000000000000001)
  (gcn): GCN(
    (convs): ModuleList(
      (0): GCNConv(1433, 64)
      (1): GCNConv(64, 7)
    )
    (bns): ModuleList(
      (0): BatchNorm1d(64, eps=1e-05, momentum=0.1, affine=True, track_running_stats=True)
    )
    (output): LogSoftmax(dim=-1)
  )
)
propagate done
init label
Split: 01, Run: 01
None time:  0.5972522171214223
None Run 01:
Highest Train: 100.00
Highest Valid: 66.40
  Final Train: 100.00
   Final Test: 68.10
Split: 01, Run: 02
None time:  0.756099039921537
None Run 02:
Highest Train: 100.00
Highest Valid: 78.80
  Final Train: 100.00
   Final Test: 80.40
Split: 01, Run: 03
None time:  0.8544256018940359
None Run 03:
Highest Train: 100.00
Highest Valid: 79.80
  Final Train: 98.57
   Final Test: 79.20
run time now: 2.2329962253570557
total time:  2.246706746984273
None All runs:
Highest Train: 100.00 ± 0.00
Highest Valid: 75.00 ± 7.46
  Final Train: 99.52 ± 0.82
   Final Test: 75.90 ± 6.78
[I 2023-06-12 00:12:35,446] Trial 2 finished with value: 74.99999237060547 and parameters: {'Fwd': 0.001623690929324474, 'K': 6, 'alpha': 0.6000000000000001, 'dropout': 0.7000000000000001, 'gnnepoch': 30, 'lambda1': 0.6000000000000001, 'lambda2': 3.3461085525513323, 'loop': 2, 'loss': 'CE', 'lr': 0.00029557494619203445, 'softmaxF': False, 'useGCN': False, 'weight_decay': 1.93527790029059e-05, 'weightedloss': False}. Best is trial 0 with value: 78.20000457763672.
/home/wxy/miniconda3/lib/python3.10/site-packages/optuna/distributions.py:685: UserWarning: The distribution is specified by [0, 1.00001] and step=0.05, but the range is not divisible by `step`. It will be replaced by [0, 1.0].
  warnings.warn(
K:  6
alpha:  0.15000000000000002
lr:  0.0009733041995323159
weight_decay:  4.9590200221000706e-05
dropout:  0.4
fix split and run 3 times
Data: Data(x=[2708, 1433], y=[2708], train_mask=[2708], val_mask=[2708], test_mask=[2708], adj_t=[2708, 2708, nnz=10556])
num_train tensor(140)
num_noise 0
noise: tensor(0)
data feature 1433
ALTOPT(
  (lins): Sequential(
    (0): Linear(in_features=1433, out_features=64, bias=True)
    (1): BatchNorm1d(64, eps=1e-05, momentum=0.1, affine=True, track_running_stats=True)
    (2): Dropout(p=0.4, inplace=True)
    (3): ReLU(inplace=True)
    (4): Linear(in_features=64, out_features=7, bias=True)
    (5): LogSoftmax(dim=-1)
  )
  (prop): Propagation(K=6, mode=None, lambda1=None, lambda2=None, L21=True, alpha=0.15000000000000002)
  (gcn): GCN(
    (convs): ModuleList(
      (0): GCNConv(1433, 64)
      (1): GCNConv(64, 7)
    )
    (bns): ModuleList(
      (0): BatchNorm1d(64, eps=1e-05, momentum=0.1, affine=True, track_running_stats=True)
    )
    (output): LogSoftmax(dim=-1)
  )
)
propagate done
init label
Split: 01, Run: 01
None time:  1.9378184461966157
None Run 01:
Highest Train: 100.00
Highest Valid: 79.80
  Final Train: 97.86
   Final Test: 80.20
Split: 01, Run: 02
None time:  2.174165643984452
None Run 02:
Highest Train: 100.00
Highest Valid: 78.40
  Final Train: 97.86
   Final Test: 78.00
Split: 01, Run: 03
None time:  2.0499510690569878
None Run 03:
Highest Train: 100.00
Highest Valid: 74.80
  Final Train: 97.86
   Final Test: 74.50
run time now: 6.196595191955566
total time:  6.244604740990326
None All runs:
Highest Train: 100.00 ± 0.00
Highest Valid: 77.67 ± 2.58
  Final Train: 97.86 ± 0.00
   Final Test: 77.57 ± 2.87
[I 2023-06-12 00:12:42,138] Trial 3 finished with value: 77.66666412353516 and parameters: {'Fwd': 0.00241545564501405, 'K': 6, 'alpha': 0.15000000000000002, 'dropout': 0.4, 'gnnepoch': 100, 'lambda1': 0.8500000000000001, 'lambda2': 0.2514446324048403, 'loop': 1, 'loss': 'CE', 'lr': 0.0009733041995323159, 'softmaxF': True, 'useGCN': True, 'weight_decay': 4.9590200221000706e-05, 'weightedloss': True}. Best is trial 0 with value: 78.20000457763672.
/home/wxy/miniconda3/lib/python3.10/site-packages/optuna/distributions.py:685: UserWarning: The distribution is specified by [0, 1.00001] and step=0.05, but the range is not divisible by `step`. It will be replaced by [0, 1.0].
  warnings.warn(
K:  3
alpha:  0.05
lr:  0.0002626264834047168
weight_decay:  0.0006326062480911402
dropout:  0.2
fix split and run 3 times
Data: Data(x=[2708, 1433], y=[2708], train_mask=[2708], val_mask=[2708], test_mask=[2708], adj_t=[2708, 2708, nnz=10556])
num_train tensor(140)
num_noise 0
noise: tensor(0)
data feature 1433
ALTOPT(
  (lins): Sequential(
    (0): Linear(in_features=1433, out_features=64, bias=True)
    (1): BatchNorm1d(64, eps=1e-05, momentum=0.1, affine=True, track_running_stats=True)
    (2): Dropout(p=0.2, inplace=True)
    (3): ReLU(inplace=True)
    (4): Linear(in_features=64, out_features=7, bias=True)
    (5): LogSoftmax(dim=-1)
  )
  (prop): Propagation(K=3, mode=None, lambda1=None, lambda2=None, L21=True, alpha=0.05)
  (gcn): GCN(
    (convs): ModuleList(
      (0): GCNConv(1433, 64)
      (1): GCNConv(64, 7)
    )
    (bns): ModuleList(
      (0): BatchNorm1d(64, eps=1e-05, momentum=0.1, affine=True, track_running_stats=True)
    )
    (output): LogSoftmax(dim=-1)
  )
)
propagate done
init label
Split: 01, Run: 01, Epoch: 100, Loss: 0.0000, Train: 100.00%, Valid: 70.80% Test: 70.10%
Split: 01, Run: 01
None time:  1.3582667100708932
None Run 01:
Highest Train: 100.00
Highest Valid: 70.80
  Final Train: 100.00
   Final Test: 70.10
Split: 01, Run: 02, Epoch: 100, Loss: 0.0000, Train: 100.00%, Valid: 71.20% Test: 71.90%
Split: 01, Run: 02
None time:  1.0126685111317784
None Run 02:
Highest Train: 100.00
Highest Valid: 71.20
  Final Train: 100.00
   Final Test: 71.90
Split: 01, Run: 03, Epoch: 100, Loss: 0.0000, Train: 100.00%, Valid: 77.20% Test: 76.70%
Split: 01, Run: 03
None time:  1.3053925621788949
None Run 03:
Highest Train: 100.00
Highest Valid: 77.20
  Final Train: 100.00
   Final Test: 76.70
run time now: 3.702666997909546
total time:  3.7310672600287944
None All runs:
Highest Train: 100.00 ± 0.00
Highest Valid: 73.07 ± 3.59
  Final Train: 100.00 ± 0.00
   Final Test: 72.90 ± 3.41
[I 2023-06-12 00:12:46,187] Trial 4 finished with value: 73.0666732788086 and parameters: {'Fwd': 0.02682516663018761, 'K': 3, 'alpha': 0.05, 'dropout': 0.2, 'gnnepoch': 20, 'lambda1': 0.05, 'lambda2': 5.46661989944142, 'loop': 0, 'loss': 'CE', 'lr': 0.0002626264834047168, 'softmaxF': False, 'useGCN': False, 'weight_decay': 0.0006326062480911402, 'weightedloss': False}. Best is trial 0 with value: 78.20000457763672.
/home/wxy/miniconda3/lib/python3.10/site-packages/optuna/distributions.py:685: UserWarning: The distribution is specified by [0, 1.00001] and step=0.05, but the range is not divisible by `step`. It will be replaced by [0, 1.0].
  warnings.warn(
K:  7
alpha:  0.7000000000000001
lr:  0.0050692193900782325
weight_decay:  0.00039773654110796517
dropout:  0.6000000000000001
fix split and run 3 times
Data: Data(x=[2708, 1433], y=[2708], train_mask=[2708], val_mask=[2708], test_mask=[2708], adj_t=[2708, 2708, nnz=10556])
num_train tensor(140)
num_noise 0
noise: tensor(0)
data feature 1433
ALTOPT(
  (lins): Sequential(
    (0): Linear(in_features=1433, out_features=64, bias=True)
    (1): BatchNorm1d(64, eps=1e-05, momentum=0.1, affine=True, track_running_stats=True)
    (2): Dropout(p=0.6000000000000001, inplace=True)
    (3): ReLU(inplace=True)
    (4): Linear(in_features=64, out_features=7, bias=True)
    (5): LogSoftmax(dim=-1)
  )
  (prop): Propagation(K=7, mode=None, lambda1=None, lambda2=None, L21=True, alpha=0.7000000000000001)
  (gcn): GCN(
    (convs): ModuleList(
      (0): GCNConv(1433, 64)
      (1): GCNConv(64, 7)
    )
    (bns): ModuleList(
      (0): BatchNorm1d(64, eps=1e-05, momentum=0.1, affine=True, track_running_stats=True)
    )
    (output): LogSoftmax(dim=-1)
  )
)
propagate done
init label
Split: 01, Run: 01
None time:  0.5952877369709313
None Run 01:
Highest Train: 100.00
Highest Valid: 69.80
  Final Train: 100.00
   Final Test: 74.20
Split: 01, Run: 02
None time:  0.6073597299400717
None Run 02:
Highest Train: 100.00
Highest Valid: 69.20
  Final Train: 100.00
   Final Test: 72.80
Split: 01, Run: 03
None time:  0.5695046610198915
None Run 03:
Highest Train: 100.00
Highest Valid: 67.40
  Final Train: 100.00
   Final Test: 68.90
run time now: 1.8007514476776123
total time:  1.825080615002662
None All runs:
Highest Train: 100.00 ± 0.00
Highest Valid: 68.80 ± 1.25
  Final Train: 100.00 ± 0.00
   Final Test: 71.97 ± 2.75
[I 2023-06-12 00:12:48,356] Trial 5 finished with value: 68.79999542236328 and parameters: {'Fwd': 0.002752748196582699, 'K': 7, 'alpha': 0.7000000000000001, 'dropout': 0.6000000000000001, 'gnnepoch': 0, 'lambda1': 0.5, 'lambda2': 2.2162694957320506, 'loop': 1, 'loss': 'CE', 'lr': 0.0050692193900782325, 'softmaxF': True, 'useGCN': True, 'weight_decay': 0.00039773654110796517, 'weightedloss': False}. Best is trial 0 with value: 78.20000457763672.
/home/wxy/miniconda3/lib/python3.10/site-packages/optuna/distributions.py:685: UserWarning: The distribution is specified by [0, 1.00001] and step=0.05, but the range is not divisible by `step`. It will be replaced by [0, 1.0].
  warnings.warn(
K:  7
alpha:  0.15000000000000002
lr:  0.0005559415389434975
weight_decay:  3.0324696550235855e-06
dropout:  0.0
fix split and run 3 times
Data: Data(x=[2708, 1433], y=[2708], train_mask=[2708], val_mask=[2708], test_mask=[2708], adj_t=[2708, 2708, nnz=10556])
num_train tensor(140)
num_noise 0
noise: tensor(0)
data feature 1433
ALTOPT(
  (lins): Sequential(
    (0): Linear(in_features=1433, out_features=64, bias=True)
    (1): BatchNorm1d(64, eps=1e-05, momentum=0.1, affine=True, track_running_stats=True)
    (2): Dropout(p=0.0, inplace=True)
    (3): ReLU(inplace=True)
    (4): Linear(in_features=64, out_features=7, bias=True)
    (5): Identity()
  )
  (prop): Propagation(K=7, mode=None, lambda1=None, lambda2=None, L21=True, alpha=0.15000000000000002)
  (gcn): GCN(
    (convs): ModuleList(
      (0): GCNConv(1433, 64)
      (1): GCNConv(64, 7)
    )
    (bns): ModuleList(
      (0): BatchNorm1d(64, eps=1e-05, momentum=0.1, affine=True, track_running_stats=True)
    )
    (output): Identity()
  )
)
propagate done
init label
Split: 01, Run: 01
None time:  0.5190135361626744
None Run 01:
Highest Train: 100.00
Highest Valid: 65.80
  Final Train: 100.00
   Final Test: 67.70
Split: 01, Run: 02
None time:  0.4910703038331121
None Run 02:
Highest Train: 100.00
Highest Valid: 65.80
  Final Train: 100.00
   Final Test: 67.70
Split: 01, Run: 03
None time:  0.548884998075664
None Run 03:
Highest Train: 100.00
Highest Valid: 65.80
  Final Train: 100.00
   Final Test: 67.70
run time now: 1.585428237915039
total time:  1.6068464629352093
None All runs:
Highest Train: 100.00 ± 0.00
Highest Valid: 65.80 ± 0.00
  Final Train: 100.00 ± 0.00
   Final Test: 67.70 ± 0.00
[I 2023-06-12 00:12:50,327] Trial 6 finished with value: 65.80000305175781 and parameters: {'Fwd': 0.00044696329638764943, 'K': 7, 'alpha': 0.15000000000000002, 'dropout': 0.0, 'gnnepoch': 10, 'lambda1': 0.5, 'lambda2': 6.97595221261674, 'loop': 2, 'loss': 'MSE', 'lr': 0.0005559415389434975, 'softmaxF': True, 'useGCN': False, 'weight_decay': 3.0324696550235855e-06, 'weightedloss': True}. Best is trial 0 with value: 78.20000457763672.
/home/wxy/miniconda3/lib/python3.10/site-packages/optuna/distributions.py:685: UserWarning: The distribution is specified by [0, 1.00001] and step=0.05, but the range is not divisible by `step`. It will be replaced by [0, 1.0].
  warnings.warn(
K:  9
alpha:  0.55
lr:  0.0009431200994321406
weight_decay:  4.0708602506451635e-05
dropout:  0.6000000000000001
fix split and run 3 times
Data: Data(x=[2708, 1433], y=[2708], train_mask=[2708], val_mask=[2708], test_mask=[2708], adj_t=[2708, 2708, nnz=10556])
num_train tensor(140)
num_noise 0
noise: tensor(0)
data feature 1433
ALTOPT(
  (lins): Sequential(
    (0): Linear(in_features=1433, out_features=64, bias=True)
    (1): BatchNorm1d(64, eps=1e-05, momentum=0.1, affine=True, track_running_stats=True)
    (2): Dropout(p=0.6000000000000001, inplace=True)
    (3): ReLU(inplace=True)
    (4): Linear(in_features=64, out_features=7, bias=True)
    (5): LogSoftmax(dim=-1)
  )
  (prop): Propagation(K=9, mode=None, lambda1=None, lambda2=None, L21=True, alpha=0.55)
  (gcn): GCN(
    (convs): ModuleList(
      (0): GCNConv(1433, 64)
      (1): GCNConv(64, 7)
    )
    (bns): ModuleList(
      (0): BatchNorm1d(64, eps=1e-05, momentum=0.1, affine=True, track_running_stats=True)
    )
    (output): LogSoftmax(dim=-1)
  )
)
propagate done
init label
Split: 01, Run: 01
None time:  1.0665242339018732
None Run 01:
Highest Train: 100.00
Highest Valid: 77.80
  Final Train: 100.00
   Final Test: 78.20
Split: 01, Run: 02
None time:  0.9977770049590617
None Run 02:
Highest Train: 100.00
Highest Valid: 79.20
  Final Train: 100.00
   Final Test: 80.60
Split: 01, Run: 03
None time:  1.087668715044856
None Run 03:
Highest Train: 100.00
Highest Valid: 79.80
  Final Train: 100.00
   Final Test: 80.80
run time now: 3.181626081466675
total time:  3.210539791965857
None All runs:
Highest Train: 100.00 ± 0.00
Highest Valid: 78.93 ± 1.03
  Final Train: 100.00 ± 0.00
   Final Test: 79.87 ± 1.45
[I 2023-06-12 00:12:53,920] Trial 7 finished with value: 78.9333267211914 and parameters: {'Fwd': 0.000995068937537282, 'K': 9, 'alpha': 0.55, 'dropout': 0.6000000000000001, 'gnnepoch': 50, 'lambda1': 0.25, 'lambda2': 7.5644523251095706, 'loop': 2, 'loss': 'CE', 'lr': 0.0009431200994321406, 'softmaxF': True, 'useGCN': False, 'weight_decay': 4.0708602506451635e-05, 'weightedloss': True}. Best is trial 7 with value: 78.9333267211914.
/home/wxy/miniconda3/lib/python3.10/site-packages/optuna/distributions.py:685: UserWarning: The distribution is specified by [0, 1.00001] and step=0.05, but the range is not divisible by `step`. It will be replaced by [0, 1.0].
  warnings.warn(
K:  6
alpha:  0.9500000000000001
lr:  0.0007970507597534947
weight_decay:  3.9659046191106466e-06
dropout:  0.6000000000000001
fix split and run 3 times
Data: Data(x=[2708, 1433], y=[2708], train_mask=[2708], val_mask=[2708], test_mask=[2708], adj_t=[2708, 2708, nnz=10556])
num_train tensor(140)
num_noise 0
noise: tensor(0)
data feature 1433
ALTOPT(
  (lins): Sequential(
    (0): Linear(in_features=1433, out_features=64, bias=True)
    (1): BatchNorm1d(64, eps=1e-05, momentum=0.1, affine=True, track_running_stats=True)
    (2): Dropout(p=0.6000000000000001, inplace=True)
    (3): ReLU(inplace=True)
    (4): Linear(in_features=64, out_features=7, bias=True)
    (5): Identity()
  )
  (prop): Propagation(K=6, mode=None, lambda1=None, lambda2=None, L21=True, alpha=0.9500000000000001)
  (gcn): GCN(
    (convs): ModuleList(
      (0): GCNConv(1433, 64)
      (1): GCNConv(64, 7)
    )
    (bns): ModuleList(
      (0): BatchNorm1d(64, eps=1e-05, momentum=0.1, affine=True, track_running_stats=True)
    )
    (output): Identity()
  )
)
propagate done
init label
Split: 01, Run: 01
None time:  1.450107195880264
None Run 01:
Highest Train: 100.00
Highest Valid: 78.40
  Final Train: 100.00
   Final Test: 77.10
Split: 01, Run: 02
None time:  2.3837228128686547
None Run 02:
Highest Train: 100.00
Highest Valid: 78.80
  Final Train: 100.00
   Final Test: 76.90
Split: 01, Run: 03
None time:  1.997615208150819
None Run 03:
Highest Train: 100.00
Highest Valid: 77.80
  Final Train: 100.00
   Final Test: 76.30
run time now: 5.852769136428833
total time:  5.876139726955444
None All runs:
Highest Train: 100.00 ± 0.00
Highest Valid: 78.33 ± 0.50
  Final Train: 100.00 ± 0.00
   Final Test: 76.77 ± 0.42
