[I 2023-06-11 23:47:36,372] Trial 422 finished with value: 71.73332977294922 and parameters: {'Fwd': 0.07567705637382517, 'K': 8, 'alpha': 0.9500000000000001, 'dropout': 0.8, 'gnnepoch': 120, 'lambda1': 0.65, 'lambda2': 6.185957536167217, 'loop': 0, 'loss': 'CE', 'lr': 0.001177997685614123, 'softmaxF': False, 'useGCN': True, 'weight_decay': 2.1143673901905952e-05, 'weightedloss': True}. Best is trial 271 with value: 72.06666564941406.
/home/wxy/miniconda3/lib/python3.10/site-packages/optuna/distributions.py:685: UserWarning: The distribution is specified by [0, 1.00001] and step=0.05, but the range is not divisible by `step`. It will be replaced by [0, 1.0].
  warnings.warn(
K:  8
alpha:  0.9
lr:  0.0009520328187813068
weight_decay:  2.4452051495690516e-05
dropout:  0.8
fix split and run 3 times
Data: Data(x=[3327, 3703], y=[3327], train_mask=[3327], val_mask=[3327], test_mask=[3327], adj_t=[3327, 3327, nnz=9104])
num_train tensor(120)
num_noise 0
noise: tensor(0)
data feature 3703
ALTOPT(
  (lins): Sequential(
    (0): Linear(in_features=3703, out_features=64, bias=True)
    (1): BatchNorm1d(64, eps=1e-05, momentum=0.1, affine=True, track_running_stats=True)
    (2): Dropout(p=0.8, inplace=True)
    (3): ReLU(inplace=True)
    (4): Linear(in_features=64, out_features=6, bias=True)
    (5): LogSoftmax(dim=-1)
  )
  (prop): Propagation(K=8, mode=None, lambda1=None, lambda2=None, L21=True, alpha=0.9)
  (gcn): GCN(
    (convs): ModuleList(
      (0): GCNConv(3703, 64)
      (1): GCNConv(64, 6)
    )
    (bns): ModuleList(
      (0): BatchNorm1d(64, eps=1e-05, momentum=0.1, affine=True, track_running_stats=True)
    )
    (output): LogSoftmax(dim=-1)
  )
)
propagate done
init label
Split: 01, Run: 01
None time:  1.0091493560466915
None Run 01:
Highest Train: 100.00
Highest Valid: 70.80
  Final Train: 100.00
   Final Test: 69.90
Split: 01, Run: 02
None time:  1.0199884460307658
None Run 02:
Highest Train: 100.00
Highest Valid: 68.60
  Final Train: 100.00
   Final Test: 68.70
Split: 01, Run: 03
None time:  0.9121741091366857
None Run 03:
Highest Train: 100.00
Highest Valid: 70.20
  Final Train: 100.00
   Final Test: 70.50
run time now: 2.983668804168701
total time:  3.0464988499879837
None All runs:
Highest Train: 100.00 ± 0.00
Highest Valid: 69.87 ± 1.14
  Final Train: 100.00 ± 0.00
   Final Test: 69.70 ± 0.92
[I 2023-06-11 23:47:39,983] Trial 423 finished with value: 69.86666870117188 and parameters: {'Fwd': 0.0009920862885891613, 'K': 8, 'alpha': 0.9, 'dropout': 0.8, 'gnnepoch': 110, 'lambda1': 0.65, 'lambda2': 6.523381110673422, 'loop': 0, 'loss': 'CE', 'lr': 0.0009520328187813068, 'softmaxF': False, 'useGCN': True, 'weight_decay': 2.4452051495690516e-05, 'weightedloss': True}. Best is trial 271 with value: 72.06666564941406.
/home/wxy/miniconda3/lib/python3.10/site-packages/optuna/distributions.py:685: UserWarning: The distribution is specified by [0, 1.00001] and step=0.05, but the range is not divisible by `step`. It will be replaced by [0, 1.0].
  warnings.warn(
K:  8
alpha:  0.8500000000000001
lr:  0.001426387565682158
weight_decay:  5.466877210721792e-05
dropout:  0.8
fix split and run 3 times
Data: Data(x=[3327, 3703], y=[3327], train_mask=[3327], val_mask=[3327], test_mask=[3327], adj_t=[3327, 3327, nnz=9104])
num_train tensor(120)
num_noise 0
noise: tensor(0)
data feature 3703
ALTOPT(
  (lins): Sequential(
    (0): Linear(in_features=3703, out_features=64, bias=True)
    (1): BatchNorm1d(64, eps=1e-05, momentum=0.1, affine=True, track_running_stats=True)
    (2): Dropout(p=0.8, inplace=True)
    (3): ReLU(inplace=True)
    (4): Linear(in_features=64, out_features=6, bias=True)
    (5): LogSoftmax(dim=-1)
  )
  (prop): Propagation(K=8, mode=None, lambda1=None, lambda2=None, L21=True, alpha=0.8500000000000001)
  (gcn): GCN(
    (convs): ModuleList(
      (0): GCNConv(3703, 64)
      (1): GCNConv(64, 6)
    )
    (bns): ModuleList(
      (0): BatchNorm1d(64, eps=1e-05, momentum=0.1, affine=True, track_running_stats=True)
    )
    (output): LogSoftmax(dim=-1)
  )
)
propagate done
init label
Split: 01, Run: 01
None time:  0.5718459191266447
None Run 01:
Highest Train: 100.00
Highest Valid: 70.20
  Final Train: 100.00
   Final Test: 69.50
Split: 01, Run: 02
None time:  0.6251358960289508
None Run 02:
Highest Train: 100.00
Highest Valid: 70.00
  Final Train: 100.00
   Final Test: 69.40
Split: 01, Run: 03
None time:  0.6101706349290907
None Run 03:
Highest Train: 100.00
Highest Valid: 70.00
  Final Train: 100.00
   Final Test: 68.70
run time now: 1.864440679550171
total time:  1.9071117818821222
None All runs:
Highest Train: 100.00 ± 0.00
Highest Valid: 70.07 ± 0.12
  Final Train: 100.00 ± 0.00
   Final Test: 69.20 ± 0.44
[I 2023-06-11 23:47:42,373] Trial 424 finished with value: 70.0666732788086 and parameters: {'Fwd': 0.02838327922706619, 'K': 8, 'alpha': 0.8500000000000001, 'dropout': 0.8, 'gnnepoch': 60, 'lambda1': 0.7000000000000001, 'lambda2': 6.152837343215059, 'loop': 0, 'loss': 'CE', 'lr': 0.001426387565682158, 'softmaxF': False, 'useGCN': True, 'weight_decay': 5.466877210721792e-05, 'weightedloss': True}. Best is trial 271 with value: 72.06666564941406.
/home/wxy/miniconda3/lib/python3.10/site-packages/optuna/distributions.py:685: UserWarning: The distribution is specified by [0, 1.00001] and step=0.05, but the range is not divisible by `step`. It will be replaced by [0, 1.0].
  warnings.warn(
K:  8
alpha:  0.9500000000000001
lr:  0.0015615523923013506
weight_decay:  3.0931345484431136e-05
dropout:  0.8
fix split and run 3 times
Data: Data(x=[3327, 3703], y=[3327], train_mask=[3327], val_mask=[3327], test_mask=[3327], adj_t=[3327, 3327, nnz=9104])
num_train tensor(120)
num_noise 0
noise: tensor(0)
data feature 3703
ALTOPT(
  (lins): Sequential(
    (0): Linear(in_features=3703, out_features=64, bias=True)
    (1): BatchNorm1d(64, eps=1e-05, momentum=0.1, affine=True, track_running_stats=True)
    (2): Dropout(p=0.8, inplace=True)
    (3): ReLU(inplace=True)
    (4): Linear(in_features=64, out_features=6, bias=True)
    (5): LogSoftmax(dim=-1)
  )
  (prop): Propagation(K=8, mode=None, lambda1=None, lambda2=None, L21=True, alpha=0.9500000000000001)
  (gcn): GCN(
    (convs): ModuleList(
      (0): GCNConv(3703, 64)
      (1): GCNConv(64, 6)
    )
    (bns): ModuleList(
      (0): BatchNorm1d(64, eps=1e-05, momentum=0.1, affine=True, track_running_stats=True)
    )
    (output): LogSoftmax(dim=-1)
  )
)
propagate done
init label
Split: 01, Run: 01
None time:  1.103307815035805
None Run 01:
Highest Train: 100.00
Highest Valid: 71.40
  Final Train: 100.00
   Final Test: 69.40
Split: 01, Run: 02
None time:  1.0410501740407199
None Run 02:
Highest Train: 100.00
Highest Valid: 72.00
  Final Train: 100.00
   Final Test: 70.10
Split: 01, Run: 03
None time:  1.0333262730855495
None Run 03:
Highest Train: 100.00
Highest Valid: 71.80
  Final Train: 100.00
   Final Test: 70.70
run time now: 3.21876859664917
total time:  3.2737249829806387
None All runs:
Highest Train: 100.00 ± 0.00
Highest Valid: 71.73 ± 0.31
  Final Train: 100.00 ± 0.00
   Final Test: 70.07 ± 0.65
[I 2023-06-11 23:47:46,137] Trial 425 finished with value: 71.73332977294922 and parameters: {'Fwd': 0.0005459530654608029, 'K': 8, 'alpha': 0.9500000000000001, 'dropout': 0.8, 'gnnepoch': 120, 'lambda1': 0.65, 'lambda2': 7.219297960353415, 'loop': 0, 'loss': 'CE', 'lr': 0.0015615523923013506, 'softmaxF': True, 'useGCN': True, 'weight_decay': 3.0931345484431136e-05, 'weightedloss': True}. Best is trial 271 with value: 72.06666564941406.
/home/wxy/miniconda3/lib/python3.10/site-packages/optuna/distributions.py:685: UserWarning: The distribution is specified by [0, 1.00001] and step=0.05, but the range is not divisible by `step`. It will be replaced by [0, 1.0].
  warnings.warn(
K:  8
alpha:  0.8500000000000001
lr:  0.0012893729279979146
weight_decay:  7.86458698820865e-05
dropout:  0.4
fix split and run 3 times
Data: Data(x=[3327, 3703], y=[3327], train_mask=[3327], val_mask=[3327], test_mask=[3327], adj_t=[3327, 3327, nnz=9104])
num_train tensor(120)
num_noise 0
noise: tensor(0)
data feature 3703
ALTOPT(
  (lins): Sequential(
    (0): Linear(in_features=3703, out_features=64, bias=True)
    (1): BatchNorm1d(64, eps=1e-05, momentum=0.1, affine=True, track_running_stats=True)
    (2): Dropout(p=0.4, inplace=True)
    (3): ReLU(inplace=True)
    (4): Linear(in_features=64, out_features=6, bias=True)
    (5): LogSoftmax(dim=-1)
  )
  (prop): Propagation(K=8, mode=None, lambda1=None, lambda2=None, L21=True, alpha=0.8500000000000001)
  (gcn): GCN(
    (convs): ModuleList(
      (0): GCNConv(3703, 64)
      (1): GCNConv(64, 6)
    )
    (bns): ModuleList(
      (0): BatchNorm1d(64, eps=1e-05, momentum=0.1, affine=True, track_running_stats=True)
    )
    (output): LogSoftmax(dim=-1)
  )
)
propagate done
init label
Split: 01, Run: 01
None time:  1.0449363570660353
None Run 01:
Highest Train: 100.00
Highest Valid: 71.40
  Final Train: 100.00
   Final Test: 69.50
Split: 01, Run: 02
None time:  1.0591494580730796
None Run 02:
Highest Train: 100.00
Highest Valid: 71.20
  Final Train: 100.00
   Final Test: 70.20
Split: 01, Run: 03
None time:  1.1459167839493603
None Run 03:
Highest Train: 100.00
Highest Valid: 71.20
  Final Train: 100.00
   Final Test: 70.50
run time now: 3.29313325881958
total time:  3.350027841050178
None All runs:
Highest Train: 100.00 ± 0.00
Highest Valid: 71.27 ± 0.12
  Final Train: 100.00 ± 0.00
   Final Test: 70.07 ± 0.51
[I 2023-06-11 23:47:50,058] Trial 426 finished with value: 71.26667022705078 and parameters: {'Fwd': 0.0003925420944646346, 'K': 8, 'alpha': 0.8500000000000001, 'dropout': 0.4, 'gnnepoch': 120, 'lambda1': 0.7000000000000001, 'lambda2': 7.392755657068429, 'loop': 0, 'loss': 'CE', 'lr': 0.0012893729279979146, 'softmaxF': False, 'useGCN': True, 'weight_decay': 7.86458698820865e-05, 'weightedloss': True}. Best is trial 271 with value: 72.06666564941406.
/home/wxy/miniconda3/lib/python3.10/site-packages/optuna/distributions.py:685: UserWarning: The distribution is specified by [0, 1.00001] and step=0.05, but the range is not divisible by `step`. It will be replaced by [0, 1.0].
  warnings.warn(
K:  8
alpha:  0.9
lr:  0.0010390336680401785
weight_decay:  2.0125756403056267e-05
dropout:  0.8
fix split and run 3 times
Data: Data(x=[3327, 3703], y=[3327], train_mask=[3327], val_mask=[3327], test_mask=[3327], adj_t=[3327, 3327, nnz=9104])
num_train tensor(120)
num_noise 0
noise: tensor(0)
data feature 3703
ALTOPT(
  (lins): Sequential(
    (0): Linear(in_features=3703, out_features=64, bias=True)
    (1): BatchNorm1d(64, eps=1e-05, momentum=0.1, affine=True, track_running_stats=True)
    (2): Dropout(p=0.8, inplace=True)
    (3): ReLU(inplace=True)
    (4): Linear(in_features=64, out_features=6, bias=True)
    (5): LogSoftmax(dim=-1)
  )
  (prop): Propagation(K=8, mode=None, lambda1=None, lambda2=None, L21=True, alpha=0.9)
  (gcn): GCN(
    (convs): ModuleList(
      (0): GCNConv(3703, 64)
      (1): GCNConv(64, 6)
    )
    (bns): ModuleList(
      (0): BatchNorm1d(64, eps=1e-05, momentum=0.1, affine=True, track_running_stats=True)
    )
    (output): LogSoftmax(dim=-1)
  )
)
propagate done
init label
Split: 01, Run: 01
None time:  1.0041958938818425
None Run 01:
Highest Train: 100.00
Highest Valid: 71.00
  Final Train: 100.00
   Final Test: 69.40
Split: 01, Run: 02
None time:  1.097317713079974
None Run 02:
Highest Train: 100.00
Highest Valid: 72.40
  Final Train: 100.00
   Final Test: 69.70
Split: 01, Run: 03, Epoch: 100, Loss: 0.0000, Train: 100.00%, Valid: 71.00% Test: 70.50%
Split: 01, Run: 03
None time:  1.822261530905962
None Run 03:
Highest Train: 100.00
Highest Valid: 71.00
  Final Train: 100.00
   Final Test: 70.40
run time now: 3.965158462524414
total time:  4.018093101913109
None All runs:
Highest Train: 100.00 ± 0.00
Highest Valid: 71.47 ± 0.81
  Final Train: 100.00 ± 0.00
   Final Test: 69.83 ± 0.51
[I 2023-06-11 23:47:54,666] Trial 427 finished with value: 71.46666717529297 and parameters: {'Fwd': 0.04174987825540827, 'K': 8, 'alpha': 0.9, 'dropout': 0.8, 'gnnepoch': 120, 'lambda1': 0.6000000000000001, 'lambda2': 6.912206332357985, 'loop': 0, 'loss': 'CE', 'lr': 0.0010390336680401785, 'softmaxF': False, 'useGCN': True, 'weight_decay': 2.0125756403056267e-05, 'weightedloss': True}. Best is trial 271 with value: 72.06666564941406.
/home/wxy/miniconda3/lib/python3.10/site-packages/optuna/distributions.py:685: UserWarning: The distribution is specified by [0, 1.00001] and step=0.05, but the range is not divisible by `step`. It will be replaced by [0, 1.0].
  warnings.warn(
K:  8
alpha:  0.8
lr:  0.0011516237022419602
weight_decay:  0.00030289021897111066
dropout:  0.2
fix split and run 3 times
Data: Data(x=[3327, 3703], y=[3327], train_mask=[3327], val_mask=[3327], test_mask=[3327], adj_t=[3327, 3327, nnz=9104])
num_train tensor(120)
num_noise 0
noise: tensor(0)
data feature 3703
ALTOPT(
  (lins): Sequential(
    (0): Linear(in_features=3703, out_features=64, bias=True)
    (1): BatchNorm1d(64, eps=1e-05, momentum=0.1, affine=True, track_running_stats=True)
    (2): Dropout(p=0.2, inplace=True)
    (3): ReLU(inplace=True)
    (4): Linear(in_features=64, out_features=6, bias=True)
    (5): LogSoftmax(dim=-1)
  )
  (prop): Propagation(K=8, mode=None, lambda1=None, lambda2=None, L21=True, alpha=0.8)
  (gcn): GCN(
    (convs): ModuleList(
      (0): GCNConv(3703, 64)
      (1): GCNConv(64, 6)
    )
    (bns): ModuleList(
      (0): BatchNorm1d(64, eps=1e-05, momentum=0.1, affine=True, track_running_stats=True)
    )
    (output): LogSoftmax(dim=-1)
  )
)
propagate done
init label
Split: 01, Run: 01
None time:  1.104282946093008
None Run 01:
Highest Train: 100.00
Highest Valid: 71.40
  Final Train: 100.00
   Final Test: 69.70
Split: 01, Run: 02
None time:  1.1293440870940685
None Run 02:
Highest Train: 100.00
Highest Valid: 71.00
  Final Train: 100.00
   Final Test: 69.80
Split: 01, Run: 03
None time:  0.9742450478952378
None Run 03:
Highest Train: 100.00
Highest Valid: 71.20
  Final Train: 100.00
   Final Test: 69.90
run time now: 3.2498769760131836
total time:  3.310523235006258
None All runs:
Highest Train: 100.00 ± 0.00
Highest Valid: 71.20 ± 0.20
  Final Train: 100.00 ± 0.00
   Final Test: 69.80 ± 0.10
[I 2023-06-11 23:47:58,489] Trial 428 finished with value: 71.20000457763672 and parameters: {'Fwd': 0.05859922961409751, 'K': 8, 'alpha': 0.8, 'dropout': 0.2, 'gnnepoch': 120, 'lambda1': 0.7000000000000001, 'lambda2': 6.460445014227638, 'loop': 0, 'loss': 'CE', 'lr': 0.0011516237022419602, 'softmaxF': False, 'useGCN': True, 'weight_decay': 0.00030289021897111066, 'weightedloss': True}. Best is trial 271 with value: 72.06666564941406.
/home/wxy/miniconda3/lib/python3.10/site-packages/optuna/distributions.py:685: UserWarning: The distribution is specified by [0, 1.00001] and step=0.05, but the range is not divisible by `step`. It will be replaced by [0, 1.0].
  warnings.warn(
K:  8
alpha:  0.8
lr:  0.0013985399872369858
weight_decay:  0.0005006179190816339
dropout:  0.8
fix split and run 3 times
Data: Data(x=[3327, 3703], y=[3327], train_mask=[3327], val_mask=[3327], test_mask=[3327], adj_t=[3327, 3327, nnz=9104])
num_train tensor(120)
num_noise 0
noise: tensor(0)
data feature 3703
ALTOPT(
  (lins): Sequential(
    (0): Linear(in_features=3703, out_features=64, bias=True)
    (1): BatchNorm1d(64, eps=1e-05, momentum=0.1, affine=True, track_running_stats=True)
    (2): Dropout(p=0.8, inplace=True)
    (3): ReLU(inplace=True)
    (4): Linear(in_features=64, out_features=6, bias=True)
    (5): Identity()
  )
  (prop): Propagation(K=8, mode=None, lambda1=None, lambda2=None, L21=True, alpha=0.8)
  (gcn): GCN(
    (convs): ModuleList(
      (0): GCNConv(3703, 64)
      (1): GCNConv(64, 6)
    )
    (bns): ModuleList(
      (0): BatchNorm1d(64, eps=1e-05, momentum=0.1, affine=True, track_running_stats=True)
    )
    (output): Identity()
  )
)
propagate done
init label
Split: 01, Run: 01, Epoch: 100, Loss: 0.0000, Train: 100.00%, Valid: 70.00% Test: 69.50%
Split: 01, Run: 01
None time:  1.8779829901177436
None Run 01:
Highest Train: 100.00
Highest Valid: 70.00
  Final Train: 100.00
   Final Test: 69.50
Split: 01, Run: 02, Epoch: 100, Loss: 0.0000, Train: 100.00%, Valid: 69.80% Test: 69.80%
Split: 01, Run: 02
None time:  1.7479575469624251
None Run 02:
Highest Train: 100.00
Highest Valid: 69.80
  Final Train: 100.00
   Final Test: 69.70
Split: 01, Run: 03, Epoch: 100, Loss: 0.0000, Train: 100.00%, Valid: 69.00% Test: 69.50%
Split: 01, Run: 03
None time:  1.7582258540205657
None Run 03:
Highest Train: 100.00
Highest Valid: 69.00
  Final Train: 100.00
   Final Test: 69.50
run time now: 5.4251320362091064
total time:  5.48451399593614
None All runs:
Highest Train: 100.00 ± 0.00
Highest Valid: 69.60 ± 0.53
  Final Train: 100.00 ± 0.00
   Final Test: 69.57 ± 0.12
[I 2023-06-11 23:48:04,559] Trial 429 finished with value: 69.5999984741211 and parameters: {'Fwd': 0.03083053035981992, 'K': 8, 'alpha': 0.8, 'dropout': 0.8, 'gnnepoch': 120, 'lambda1': 0.7000000000000001, 'lambda2': 5.8893168866274985, 'loop': 0, 'loss': 'MSE', 'lr': 0.0013985399872369858, 'softmaxF': False, 'useGCN': True, 'weight_decay': 0.0005006179190816339, 'weightedloss': True}. Best is trial 271 with value: 72.06666564941406.
/home/wxy/miniconda3/lib/python3.10/site-packages/optuna/distributions.py:685: UserWarning: The distribution is specified by [0, 1.00001] and step=0.05, but the range is not divisible by `step`. It will be replaced by [0, 1.0].
  warnings.warn(
K:  8
alpha:  0.75
lr:  0.001612958133725709
weight_decay:  5.609870826340359e-05
dropout:  0.8
fix split and run 3 times
Data: Data(x=[3327, 3703], y=[3327], train_mask=[3327], val_mask=[3327], test_mask=[3327], adj_t=[3327, 3327, nnz=9104])
num_train tensor(120)
num_noise 0
noise: tensor(0)
data feature 3703
ALTOPT(
  (lins): Sequential(
    (0): Linear(in_features=3703, out_features=64, bias=True)
    (1): BatchNorm1d(64, eps=1e-05, momentum=0.1, affine=True, track_running_stats=True)
    (2): Dropout(p=0.8, inplace=True)
    (3): ReLU(inplace=True)
    (4): Linear(in_features=64, out_features=6, bias=True)
    (5): LogSoftmax(dim=-1)
  )
  (prop): Propagation(K=8, mode=None, lambda1=None, lambda2=None, L21=True, alpha=0.75)
  (gcn): GCN(
    (convs): ModuleList(
      (0): GCNConv(3703, 64)
      (1): GCNConv(64, 6)
    )
    (bns): ModuleList(
      (0): BatchNorm1d(64, eps=1e-05, momentum=0.1, affine=True, track_running_stats=True)
    )
    (output): LogSoftmax(dim=-1)
  )
)
propagate done
init label
Split: 01, Run: 01
None time:  1.0222247368656099
None Run 01:
Highest Train: 100.00
Highest Valid: 71.40
  Final Train: 100.00
   Final Test: 69.60
Split: 01, Run: 02
None time:  1.0715183531865478
None Run 02:
Highest Train: 100.00
Highest Valid: 72.20
  Final Train: 100.00
   Final Test: 70.10
Split: 01, Run: 03
None time:  1.1103792609646916
None Run 03:
Highest Train: 100.00
Highest Valid: 71.80
  Final Train: 100.00
   Final Test: 70.10
run time now: 3.245720386505127
total time:  3.3034133489709347
None All runs:
Highest Train: 100.00 ± 0.00
Highest Valid: 71.80 ± 0.40
  Final Train: 100.00 ± 0.00
   Final Test: 69.93 ± 0.29
[I 2023-06-11 23:48:08,399] Trial 430 finished with value: 71.80000305175781 and parameters: {'Fwd': 0.04430027700879352, 'K': 8, 'alpha': 0.75, 'dropout': 0.8, 'gnnepoch': 120, 'lambda1': 0.65, 'lambda2': 7.000941320912161, 'loop': 0, 'loss': 'CE', 'lr': 0.001612958133725709, 'softmaxF': False, 'useGCN': True, 'weight_decay': 5.609870826340359e-05, 'weightedloss': True}. Best is trial 271 with value: 72.06666564941406.
/home/wxy/miniconda3/lib/python3.10/site-packages/optuna/distributions.py:685: UserWarning: The distribution is specified by [0, 1.00001] and step=0.05, but the range is not divisible by `step`. It will be replaced by [0, 1.0].
  warnings.warn(
K:  9
alpha:  0.8500000000000001
lr:  0.0012726267536729452
weight_decay:  4.408817154990559e-05
dropout:  0.7000000000000001
fix split and run 3 times
Data: Data(x=[3327, 3703], y=[3327], train_mask=[3327], val_mask=[3327], test_mask=[3327], adj_t=[3327, 3327, nnz=9104])
num_train tensor(120)
num_noise 0
noise: tensor(0)
data feature 3703
ALTOPT(
  (lins): Sequential(
    (0): Linear(in_features=3703, out_features=64, bias=True)
    (1): BatchNorm1d(64, eps=1e-05, momentum=0.1, affine=True, track_running_stats=True)
    (2): Dropout(p=0.7000000000000001, inplace=True)
    (3): ReLU(inplace=True)
    (4): Linear(in_features=64, out_features=6, bias=True)
    (5): LogSoftmax(dim=-1)
  )
  (prop): Propagation(K=9, mode=None, lambda1=None, lambda2=None, L21=True, alpha=0.8500000000000001)
  (gcn): GCN(
    (convs): ModuleList(
      (0): GCNConv(3703, 64)
      (1): GCNConv(64, 6)
    )
    (bns): ModuleList(
      (0): BatchNorm1d(64, eps=1e-05, momentum=0.1, affine=True, track_running_stats=True)
    )
    (output): LogSoftmax(dim=-1)
  )
)
propagate done
init label
Split: 01, Run: 01
None time:  0.9810125748626888
None Run 01:
Highest Train: 100.00
Highest Valid: 71.80
  Final Train: 100.00
   Final Test: 70.00
Split: 01, Run: 02
None time:  0.976961072999984
None Run 02:
Highest Train: 100.00
Highest Valid: 68.80
  Final Train: 100.00
   Final Test: 68.40
Split: 01, Run: 03
None time:  0.9972121468745172
None Run 03:
Highest Train: 100.00
Highest Valid: 71.40
  Final Train: 100.00
   Final Test: 70.50
run time now: 2.9976117610931396
total time:  3.044511548941955
None All runs:
Highest Train: 100.00 ± 0.00
Highest Valid: 70.67 ± 1.63
  Final Train: 100.00 ± 0.00
   Final Test: 69.63 ± 1.10
