[I 2023-06-12 00:41:08,212] Trial 305 finished with value: 81.5999984741211 and parameters: {'Fwd': 0.0013052724506227881, 'K': 10, 'alpha': 1.0, 'dropout': 0.8, 'gnnepoch': 50, 'lambda1': 0.9, 'lambda2': 4.68045132448019, 'loop': 1, 'loss': 'MSE', 'lr': 0.0022749553267760684, 'softmaxF': True, 'useGCN': False, 'weight_decay': 0.014302153124575981, 'weightedloss': False}. Best is trial 205 with value: 83.53333282470703.
/home/wxy/miniconda3/lib/python3.10/site-packages/optuna/distributions.py:685: UserWarning: The distribution is specified by [0, 1.00001] and step=0.05, but the range is not divisible by `step`. It will be replaced by [0, 1.0].
  warnings.warn(
K:  10
alpha:  0.9500000000000001
lr:  0.002929053340516988
weight_decay:  0.0059452982659243085
dropout:  0.9
fix split and run 3 times
Data: Data(x=[19717, 500], y=[19717], train_mask=[19717], val_mask=[19717], test_mask=[19717], adj_t=[19717, 19717, nnz=88648])
num_train tensor(60)
num_noise 0
noise: tensor(0)
data feature 500
ALTOPT(
  (lins): Sequential(
    (0): Linear(in_features=500, out_features=64, bias=True)
    (1): BatchNorm1d(64, eps=1e-05, momentum=0.1, affine=True, track_running_stats=True)
    (2): Dropout(p=0.9, inplace=True)
    (3): ReLU(inplace=True)
    (4): Linear(in_features=64, out_features=3, bias=True)
    (5): LogSoftmax(dim=-1)
  )
  (prop): Propagation(K=10, mode=None, lambda1=None, lambda2=None, L21=True, alpha=0.9500000000000001)
  (gcn): GCN(
    (convs): ModuleList(
      (0): GCNConv(500, 64)
      (1): GCNConv(64, 3)
    )
    (bns): ModuleList(
      (0): BatchNorm1d(64, eps=1e-05, momentum=0.1, affine=True, track_running_stats=True)
    )
    (output): LogSoftmax(dim=-1)
  )
)
propagate done
init label
Split: 01, Run: 01
None time:  0.9127679220400751
None Run 01:
Highest Train: 100.00
Highest Valid: 78.20
  Final Train: 100.00
   Final Test: 74.50
Split: 01, Run: 02
None time:  1.0316226449795067
None Run 02:
Highest Train: 100.00
Highest Valid: 79.60
  Final Train: 100.00
   Final Test: 75.90
Split: 01, Run: 03
None time:  0.9870900220703334
None Run 03:
Highest Train: 100.00
Highest Valid: 79.60
  Final Train: 98.33
   Final Test: 77.30
run time now: 2.9817051887512207
total time:  3.0302547849714756
None All runs:
Highest Train: 100.00 ± 0.00
Highest Valid: 79.13 ± 0.81
  Final Train: 99.44 ± 0.96
   Final Test: 75.90 ± 1.40
[I 2023-06-12 00:41:11,776] Trial 306 finished with value: 79.13333129882812 and parameters: {'Fwd': 3.488376547279905e-06, 'K': 10, 'alpha': 0.9500000000000001, 'dropout': 0.9, 'gnnepoch': 60, 'lambda1': 0.7000000000000001, 'lambda2': 5.75275305779671, 'loop': 1, 'loss': 'CE', 'lr': 0.002929053340516988, 'softmaxF': True, 'useGCN': False, 'weight_decay': 0.0059452982659243085, 'weightedloss': False}. Best is trial 205 with value: 83.53333282470703.
/home/wxy/miniconda3/lib/python3.10/site-packages/optuna/distributions.py:685: UserWarning: The distribution is specified by [0, 1.00001] and step=0.05, but the range is not divisible by `step`. It will be replaced by [0, 1.0].
  warnings.warn(
K:  10
alpha:  0.9500000000000001
lr:  0.0025157110212071106
weight_decay:  0.011221415460771185
dropout:  0.9
fix split and run 3 times
Data: Data(x=[19717, 500], y=[19717], train_mask=[19717], val_mask=[19717], test_mask=[19717], adj_t=[19717, 19717, nnz=88648])
num_train tensor(60)
num_noise 0
noise: tensor(0)
data feature 500
ALTOPT(
  (lins): Sequential(
    (0): Linear(in_features=500, out_features=64, bias=True)
    (1): BatchNorm1d(64, eps=1e-05, momentum=0.1, affine=True, track_running_stats=True)
    (2): Dropout(p=0.9, inplace=True)
    (3): ReLU(inplace=True)
    (4): Linear(in_features=64, out_features=3, bias=True)
    (5): Identity()
  )
  (prop): Propagation(K=10, mode=None, lambda1=None, lambda2=None, L21=True, alpha=0.9500000000000001)
  (gcn): GCN(
    (convs): ModuleList(
      (0): GCNConv(500, 64)
      (1): GCNConv(64, 3)
    )
    (bns): ModuleList(
      (0): BatchNorm1d(64, eps=1e-05, momentum=0.1, affine=True, track_running_stats=True)
    )
    (output): Identity()
  )
)
propagate done
init label
Split: 01, Run: 01
None time:  3.4216153759043664
None Run 01:
Highest Train: 100.00
Highest Valid: 81.80
  Final Train: 100.00
   Final Test: 77.80
Split: 01, Run: 02
None time:  0.9692320851609111
None Run 02:
Highest Train: 100.00
Highest Valid: 80.40
  Final Train: 100.00
   Final Test: 78.10
Split: 01, Run: 03
None time:  1.4284276568796486
None Run 03:
Highest Train: 100.00
Highest Valid: 82.60
  Final Train: 100.00
   Final Test: 80.20
run time now: 5.868205308914185
total time:  5.923174211988226
None All runs:
Highest Train: 100.00 ± 0.00
Highest Valid: 81.60 ± 1.11
  Final Train: 100.00 ± 0.00
   Final Test: 78.70 ± 1.31
[I 2023-06-12 00:41:18,189] Trial 307 finished with value: 81.60000610351562 and parameters: {'Fwd': 3.4830450346507085e-05, 'K': 10, 'alpha': 0.9500000000000001, 'dropout': 0.9, 'gnnepoch': 60, 'lambda1': 0.8500000000000001, 'lambda2': 4.986573036779708, 'loop': 1, 'loss': 'MSE', 'lr': 0.0025157110212071106, 'softmaxF': True, 'useGCN': False, 'weight_decay': 0.011221415460771185, 'weightedloss': False}. Best is trial 205 with value: 83.53333282470703.
/home/wxy/miniconda3/lib/python3.10/site-packages/optuna/distributions.py:685: UserWarning: The distribution is specified by [0, 1.00001] and step=0.05, but the range is not divisible by `step`. It will be replaced by [0, 1.0].
  warnings.warn(
K:  10
alpha:  1.0
lr:  0.001961755741591148
weight_decay:  0.020051134252875677
dropout:  0.9
fix split and run 3 times
Data: Data(x=[19717, 500], y=[19717], train_mask=[19717], val_mask=[19717], test_mask=[19717], adj_t=[19717, 19717, nnz=88648])
num_train tensor(60)
num_noise 0
noise: tensor(0)
data feature 500
ALTOPT(
  (lins): Sequential(
    (0): Linear(in_features=500, out_features=64, bias=True)
    (1): BatchNorm1d(64, eps=1e-05, momentum=0.1, affine=True, track_running_stats=True)
    (2): Dropout(p=0.9, inplace=True)
    (3): ReLU(inplace=True)
    (4): Linear(in_features=64, out_features=3, bias=True)
    (5): Identity()
  )
  (prop): Propagation(K=10, mode=None, lambda1=None, lambda2=None, L21=True, alpha=1.0)
  (gcn): GCN(
    (convs): ModuleList(
      (0): GCNConv(500, 64)
      (1): GCNConv(64, 3)
    )
    (bns): ModuleList(
      (0): BatchNorm1d(64, eps=1e-05, momentum=0.1, affine=True, track_running_stats=True)
    )
    (output): Identity()
  )
)
propagate done
init label
Split: 01, Run: 01
None time:  0.8711154509801418
None Run 01:
Highest Train: 100.00
Highest Valid: 69.40
  Final Train: 100.00
   Final Test: 69.30
Split: 01, Run: 02
None time:  0.9114412611816078
None Run 02:
Highest Train: 100.00
Highest Valid: 78.20
  Final Train: 100.00
   Final Test: 76.50
Split: 01, Run: 03, Epoch: 100, Loss: 0.1728, Train: 100.00%, Valid: 82.80% Test: 79.80%
Split: 01, Run: 03
None time:  3.4716374368872494
None Run 03:
Highest Train: 100.00
Highest Valid: 82.80
  Final Train: 100.00
   Final Test: 79.80
run time now: 5.3645501136779785
total time:  5.425267095211893
None All runs:
Highest Train: 100.00 ± 0.00
Highest Valid: 76.80 ± 6.81
  Final Train: 100.00 ± 0.00
   Final Test: 75.20 ± 5.37
[I 2023-06-12 00:41:24,155] Trial 308 finished with value: 76.80000305175781 and parameters: {'Fwd': 6.286985492861295e-06, 'K': 10, 'alpha': 1.0, 'dropout': 0.9, 'gnnepoch': 50, 'lambda1': 0.75, 'lambda2': 5.248803190335624, 'loop': 1, 'loss': 'MSE', 'lr': 0.001961755741591148, 'softmaxF': True, 'useGCN': False, 'weight_decay': 0.020051134252875677, 'weightedloss': False}. Best is trial 205 with value: 83.53333282470703.
/home/wxy/miniconda3/lib/python3.10/site-packages/optuna/distributions.py:685: UserWarning: The distribution is specified by [0, 1.00001] and step=0.05, but the range is not divisible by `step`. It will be replaced by [0, 1.0].
  warnings.warn(
K:  10
alpha:  0.5
lr:  0.0026718951353660804
weight_decay:  0.007526649226793528
dropout:  0.9
fix split and run 3 times
Data: Data(x=[19717, 500], y=[19717], train_mask=[19717], val_mask=[19717], test_mask=[19717], adj_t=[19717, 19717, nnz=88648])
num_train tensor(60)
num_noise 0
noise: tensor(0)
data feature 500
ALTOPT(
  (lins): Sequential(
    (0): Linear(in_features=500, out_features=64, bias=True)
    (1): BatchNorm1d(64, eps=1e-05, momentum=0.1, affine=True, track_running_stats=True)
    (2): Dropout(p=0.9, inplace=True)
    (3): ReLU(inplace=True)
    (4): Linear(in_features=64, out_features=3, bias=True)
    (5): Identity()
  )
  (prop): Propagation(K=10, mode=None, lambda1=None, lambda2=None, L21=True, alpha=0.5)
  (gcn): GCN(
    (convs): ModuleList(
      (0): GCNConv(500, 64)
      (1): GCNConv(64, 3)
    )
    (bns): ModuleList(
      (0): BatchNorm1d(64, eps=1e-05, momentum=0.1, affine=True, track_running_stats=True)
    )
    (output): Identity()
  )
)
propagate done
init label
Split: 01, Run: 01
None time:  1.9592967859935015
None Run 01:
Highest Train: 100.00
Highest Valid: 77.00
  Final Train: 100.00
   Final Test: 75.90
Split: 01, Run: 02
None time:  3.166682522976771
None Run 02:
Highest Train: 100.00
Highest Valid: 76.60
  Final Train: 100.00
   Final Test: 74.20
Split: 01, Run: 03
None time:  2.05934867891483
None Run 03:
Highest Train: 100.00
Highest Valid: 78.20
  Final Train: 100.00
   Final Test: 74.90
run time now: 7.233086109161377
total time:  7.286350147798657
None All runs:
Highest Train: 100.00 ± 0.00
Highest Valid: 77.27 ± 0.83
  Final Train: 100.00 ± 0.00
   Final Test: 75.00 ± 0.85
[I 2023-06-12 00:41:32,082] Trial 309 finished with value: 77.26667022705078 and parameters: {'Fwd': 6.705555428931585e-05, 'K': 10, 'alpha': 0.5, 'dropout': 0.9, 'gnnepoch': 60, 'lambda1': 0.8, 'lambda2': 6.331925318083628, 'loop': 1, 'loss': 'MSE', 'lr': 0.0026718951353660804, 'softmaxF': True, 'useGCN': True, 'weight_decay': 0.007526649226793528, 'weightedloss': False}. Best is trial 205 with value: 83.53333282470703.
/home/wxy/miniconda3/lib/python3.10/site-packages/optuna/distributions.py:685: UserWarning: The distribution is specified by [0, 1.00001] and step=0.05, but the range is not divisible by `step`. It will be replaced by [0, 1.0].
  warnings.warn(
K:  10
alpha:  0.9500000000000001
lr:  0.0021816601410197607
weight_decay:  0.005404797559107453
dropout:  0.9
fix split and run 3 times
Data: Data(x=[19717, 500], y=[19717], train_mask=[19717], val_mask=[19717], test_mask=[19717], adj_t=[19717, 19717, nnz=88648])
num_train tensor(60)
num_noise 0
noise: tensor(0)
data feature 500
ALTOPT(
  (lins): Sequential(
    (0): Linear(in_features=500, out_features=64, bias=True)
    (1): BatchNorm1d(64, eps=1e-05, momentum=0.1, affine=True, track_running_stats=True)
    (2): Dropout(p=0.9, inplace=True)
    (3): ReLU(inplace=True)
    (4): Linear(in_features=64, out_features=3, bias=True)
    (5): Identity()
  )
  (prop): Propagation(K=10, mode=None, lambda1=None, lambda2=None, L21=True, alpha=0.9500000000000001)
  (gcn): GCN(
    (convs): ModuleList(
      (0): GCNConv(500, 64)
      (1): GCNConv(64, 3)
    )
    (bns): ModuleList(
      (0): BatchNorm1d(64, eps=1e-05, momentum=0.1, affine=True, track_running_stats=True)
    )
    (output): Identity()
  )
)
propagate done
init label
Split: 01, Run: 01
None time:  1.8622529900167137
None Run 01:
Highest Train: 100.00
Highest Valid: 81.20
  Final Train: 100.00
   Final Test: 77.70
Split: 01, Run: 02
None time:  1.0047192531637847
None Run 02:
Highest Train: 100.00
Highest Valid: 82.60
  Final Train: 100.00
   Final Test: 77.80
Split: 01, Run: 03
None time:  1.6935056580696255
None Run 03:
Highest Train: 100.00
Highest Valid: 83.40
  Final Train: 100.00
   Final Test: 80.00
run time now: 4.606621980667114
total time:  4.649175200844184
None All runs:
Highest Train: 100.00 ± 0.00
Highest Valid: 82.40 ± 1.11
  Final Train: 100.00 ± 0.00
   Final Test: 78.50 ± 1.30
[I 2023-06-12 00:41:37,350] Trial 310 finished with value: 82.39999389648438 and parameters: {'Fwd': 0.00014552374954678997, 'K': 10, 'alpha': 0.9500000000000001, 'dropout': 0.9, 'gnnepoch': 60, 'lambda1': 0.8500000000000001, 'lambda2': 3.925012264146842, 'loop': 1, 'loss': 'MSE', 'lr': 0.0021816601410197607, 'softmaxF': True, 'useGCN': False, 'weight_decay': 0.005404797559107453, 'weightedloss': False}. Best is trial 205 with value: 83.53333282470703.
/home/wxy/miniconda3/lib/python3.10/site-packages/optuna/distributions.py:685: UserWarning: The distribution is specified by [0, 1.00001] and step=0.05, but the range is not divisible by `step`. It will be replaced by [0, 1.0].
  warnings.warn(
K:  10
alpha:  0.9
lr:  0.003105893475563759
weight_decay:  4.940457108664751e-05
dropout:  0.9
fix split and run 3 times
Data: Data(x=[19717, 500], y=[19717], train_mask=[19717], val_mask=[19717], test_mask=[19717], adj_t=[19717, 19717, nnz=88648])
num_train tensor(60)
num_noise 0
noise: tensor(0)
data feature 500
ALTOPT(
  (lins): Sequential(
    (0): Linear(in_features=500, out_features=64, bias=True)
    (1): BatchNorm1d(64, eps=1e-05, momentum=0.1, affine=True, track_running_stats=True)
    (2): Dropout(p=0.9, inplace=True)
    (3): ReLU(inplace=True)
    (4): Linear(in_features=64, out_features=3, bias=True)
    (5): Identity()
  )
  (prop): Propagation(K=10, mode=None, lambda1=None, lambda2=None, L21=True, alpha=0.9)
  (gcn): GCN(
    (convs): ModuleList(
      (0): GCNConv(500, 64)
      (1): GCNConv(64, 3)
    )
    (bns): ModuleList(
      (0): BatchNorm1d(64, eps=1e-05, momentum=0.1, affine=True, track_running_stats=True)
    )
    (output): Identity()
  )
)
propagate done
init label
Split: 01, Run: 01, Epoch: 100, Loss: 0.3333, Train: 100.00%, Valid: 81.20% Test: 77.50%
Split: 01, Run: 01
None time:  3.557915440062061
None Run 01:
Highest Train: 100.00
Highest Valid: 81.40
  Final Train: 100.00
   Final Test: 76.90
Split: 01, Run: 02
None time:  1.090770446928218
None Run 02:
Highest Train: 100.00
Highest Valid: 83.00
  Final Train: 100.00
   Final Test: 79.50
Split: 01, Run: 03
None time:  1.1291383430361748
None Run 03:
Highest Train: 100.00
Highest Valid: 83.00
  Final Train: 100.00
   Final Test: 78.60
run time now: 5.8590734004974365
total time:  5.91908670309931
None All runs:
Highest Train: 100.00 ± 0.00
Highest Valid: 82.47 ± 0.92
  Final Train: 100.00 ± 0.00
   Final Test: 78.33 ± 1.32
[I 2023-06-12 00:41:43,835] Trial 311 finished with value: 82.46666717529297 and parameters: {'Fwd': 0.020353066216979555, 'K': 10, 'alpha': 0.9, 'dropout': 0.9, 'gnnepoch': 60, 'lambda1': 0.9, 'lambda2': 5.997376080236259, 'loop': 1, 'loss': 'MSE', 'lr': 0.003105893475563759, 'softmaxF': True, 'useGCN': False, 'weight_decay': 4.940457108664751e-05, 'weightedloss': False}. Best is trial 205 with value: 83.53333282470703.
/home/wxy/miniconda3/lib/python3.10/site-packages/optuna/distributions.py:685: UserWarning: The distribution is specified by [0, 1.00001] and step=0.05, but the range is not divisible by `step`. It will be replaced by [0, 1.0].
  warnings.warn(
K:  10
alpha:  1.0
lr:  0.0024193925808586826
weight_decay:  0.004083876371807708
dropout:  0.9
fix split and run 3 times
Data: Data(x=[19717, 500], y=[19717], train_mask=[19717], val_mask=[19717], test_mask=[19717], adj_t=[19717, 19717, nnz=88648])
num_train tensor(60)
num_noise 0
noise: tensor(0)
data feature 500
ALTOPT(
  (lins): Sequential(
    (0): Linear(in_features=500, out_features=64, bias=True)
    (1): BatchNorm1d(64, eps=1e-05, momentum=0.1, affine=True, track_running_stats=True)
    (2): Dropout(p=0.9, inplace=True)
    (3): ReLU(inplace=True)
    (4): Linear(in_features=64, out_features=3, bias=True)
    (5): Identity()
  )
  (prop): Propagation(K=10, mode=None, lambda1=None, lambda2=None, L21=True, alpha=1.0)
  (gcn): GCN(
    (convs): ModuleList(
      (0): GCNConv(500, 64)
      (1): GCNConv(64, 3)
    )
    (bns): ModuleList(
      (0): BatchNorm1d(64, eps=1e-05, momentum=0.1, affine=True, track_running_stats=True)
    )
    (output): Identity()
  )
)
propagate done
init label
Split: 01, Run: 01
None time:  1.8974770028144121
None Run 01:
Highest Train: 100.00
Highest Valid: 83.00
  Final Train: 100.00
   Final Test: 78.40
Split: 01, Run: 02
None time:  0.9617823679000139
None Run 02:
Highest Train: 100.00
Highest Valid: 81.20
  Final Train: 100.00
   Final Test: 80.10
Split: 01, Run: 03
None time:  1.4023723488207906
None Run 03:
Highest Train: 100.00
Highest Valid: 83.20
  Final Train: 100.00
   Final Test: 79.40
run time now: 4.311700820922852
total time:  4.355633998056874
None All runs:
Highest Train: 100.00 ± 0.00
Highest Valid: 82.47 ± 1.10
  Final Train: 100.00 ± 0.00
   Final Test: 79.30 ± 0.85
[I 2023-06-12 00:41:48,668] Trial 312 finished with value: 82.46666717529297 and parameters: {'Fwd': 4.035258230425376e-06, 'K': 10, 'alpha': 1.0, 'dropout': 0.9, 'gnnepoch': 70, 'lambda1': 0.8, 'lambda2': 5.595854800408528, 'loop': 1, 'loss': 'MSE', 'lr': 0.0024193925808586826, 'softmaxF': True, 'useGCN': False, 'weight_decay': 0.004083876371807708, 'weightedloss': False}. Best is trial 205 with value: 83.53333282470703.
/home/wxy/miniconda3/lib/python3.10/site-packages/optuna/distributions.py:685: UserWarning: The distribution is specified by [0, 1.00001] and step=0.05, but the range is not divisible by `step`. It will be replaced by [0, 1.0].
  warnings.warn(
K:  10
alpha:  0.9500000000000001
lr:  0.0029340223362641048
weight_decay:  1.273704746643887e-06
dropout:  0.9
fix split and run 3 times
Data: Data(x=[19717, 500], y=[19717], train_mask=[19717], val_mask=[19717], test_mask=[19717], adj_t=[19717, 19717, nnz=88648])
num_train tensor(60)
num_noise 0
noise: tensor(0)
data feature 500
ALTOPT(
  (lins): Sequential(
    (0): Linear(in_features=500, out_features=64, bias=True)
    (1): BatchNorm1d(64, eps=1e-05, momentum=0.1, affine=True, track_running_stats=True)
    (2): Dropout(p=0.9, inplace=True)
    (3): ReLU(inplace=True)
    (4): Linear(in_features=64, out_features=3, bias=True)
    (5): Identity()
  )
  (prop): Propagation(K=10, mode=None, lambda1=None, lambda2=None, L21=True, alpha=0.9500000000000001)
  (gcn): GCN(
    (convs): ModuleList(
      (0): GCNConv(500, 64)
      (1): GCNConv(64, 3)
    )
    (bns): ModuleList(
      (0): BatchNorm1d(64, eps=1e-05, momentum=0.1, affine=True, track_running_stats=True)
    )
    (output): Identity()
  )
)
propagate done
init label
Split: 01, Run: 01
None time:  1.9901670350227505
None Run 01:
Highest Train: 100.00
Highest Valid: 81.00
  Final Train: 100.00
   Final Test: 76.80
Split: 01, Run: 02
None time:  1.4133039771113545
None Run 02:
Highest Train: 100.00
Highest Valid: 83.20
  Final Train: 98.33
   Final Test: 80.00
Split: 01, Run: 03
None time:  0.9444596378598362
None Run 03:
Highest Train: 100.00
Highest Valid: 81.60
  Final Train: 98.33
   Final Test: 78.30
run time now: 4.398438215255737
total time:  4.443369647022337
None All runs:
Highest Train: 100.00 ± 0.00
Highest Valid: 81.93 ± 1.14
  Final Train: 98.89 ± 0.96
   Final Test: 78.37 ± 1.60
[I 2023-06-12 00:41:53,602] Trial 313 finished with value: 81.93334197998047 and parameters: {'Fwd': 0.0002681304220840318, 'K': 10, 'alpha': 0.9500000000000001, 'dropout': 0.9, 'gnnepoch': 60, 'lambda1': 0.9500000000000001, 'lambda2': 0.12756817066764992, 'loop': 1, 'loss': 'MSE', 'lr': 0.0029340223362641048, 'softmaxF': True, 'useGCN': False, 'weight_decay': 1.273704746643887e-06, 'weightedloss': False}. Best is trial 205 with value: 83.53333282470703.
/home/wxy/miniconda3/lib/python3.10/site-packages/optuna/distributions.py:685: UserWarning: The distribution is specified by [0, 1.00001] and step=0.05, but the range is not divisible by `step`. It will be replaced by [0, 1.0].
  warnings.warn(
K:  10
alpha:  0.9500000000000001
lr:  0.0034720692921094186
weight_decay:  0.008790143161086752
dropout:  0.8
fix split and run 3 times
Data: Data(x=[19717, 500], y=[19717], train_mask=[19717], val_mask=[19717], test_mask=[19717], adj_t=[19717, 19717, nnz=88648])
num_train tensor(60)
num_noise 0
noise: tensor(0)
data feature 500
ALTOPT(
  (lins): Sequential(
    (0): Linear(in_features=500, out_features=64, bias=True)
    (1): BatchNorm1d(64, eps=1e-05, momentum=0.1, affine=True, track_running_stats=True)
    (2): Dropout(p=0.8, inplace=True)
    (3): ReLU(inplace=True)
    (4): Linear(in_features=64, out_features=3, bias=True)
    (5): Identity()
  )
  (prop): Propagation(K=10, mode=None, lambda1=None, lambda2=None, L21=True, alpha=0.9500000000000001)
  (gcn): GCN(
    (convs): ModuleList(
      (0): GCNConv(500, 64)
      (1): GCNConv(64, 3)
    )
    (bns): ModuleList(
      (0): BatchNorm1d(64, eps=1e-05, momentum=0.1, affine=True, track_running_stats=True)
    )
    (output): Identity()
  )
)
propagate done
init label
Split: 01, Run: 01
None time:  2.027257523033768
None Run 01:
Highest Train: 100.00
Highest Valid: 82.80
  Final Train: 100.00
   Final Test: 78.70
Split: 01, Run: 02
None time:  1.3011180388275534
None Run 02:
Highest Train: 100.00
Highest Valid: 82.40
  Final Train: 100.00
   Final Test: 79.40
Split: 01, Run: 03
None time:  1.290462871082127
None Run 03:
Highest Train: 100.00
Highest Valid: 82.20
  Final Train: 100.00
   Final Test: 79.90
run time now: 4.67927360534668
total time:  4.724267865996808
None All runs:
Highest Train: 100.00 ± 0.00
Highest Valid: 82.47 ± 0.31
  Final Train: 100.00 ± 0.00
   Final Test: 79.33 ± 0.60
