[I 2023-06-12 00:48:11,706] Trial 377 finished with value: 82.0 and parameters: {'Fwd': 1.5757901160381324e-05, 'K': 10, 'alpha': 1.0, 'dropout': 0.9, 'gnnepoch': 80, 'lambda1': 0.6000000000000001, 'lambda2': 3.284414740724439, 'loop': 1, 'loss': 'MSE', 'lr': 0.0025061008305743856, 'softmaxF': True, 'useGCN': False, 'weight_decay': 0.003997497784717511, 'weightedloss': False}. Best is trial 364 with value: 83.66666412353516.
/home/wxy/miniconda3/lib/python3.10/site-packages/optuna/distributions.py:685: UserWarning: The distribution is specified by [0, 1.00001] and step=0.05, but the range is not divisible by `step`. It will be replaced by [0, 1.0].
  warnings.warn(
K:  10
alpha:  0.9500000000000001
lr:  0.002901246426631209
weight_decay:  0.058170877002612253
dropout:  0.9
fix split and run 3 times
Data: Data(x=[19717, 500], y=[19717], train_mask=[19717], val_mask=[19717], test_mask=[19717], adj_t=[19717, 19717, nnz=88648])
num_train tensor(60)
num_noise 0
noise: tensor(0)
data feature 500
ALTOPT(
  (lins): Sequential(
    (0): Linear(in_features=500, out_features=64, bias=True)
    (1): BatchNorm1d(64, eps=1e-05, momentum=0.1, affine=True, track_running_stats=True)
    (2): Dropout(p=0.9, inplace=True)
    (3): ReLU(inplace=True)
    (4): Linear(in_features=64, out_features=3, bias=True)
    (5): Identity()
  )
  (prop): Propagation(K=10, mode=None, lambda1=None, lambda2=None, L21=True, alpha=0.9500000000000001)
  (gcn): GCN(
    (convs): ModuleList(
      (0): GCNConv(500, 64)
      (1): GCNConv(64, 3)
    )
    (bns): ModuleList(
      (0): BatchNorm1d(64, eps=1e-05, momentum=0.1, affine=True, track_running_stats=True)
    )
    (output): Identity()
  )
)
propagate done
init label
Split: 01, Run: 01
None time:  1.191119252005592
None Run 01:
Highest Train: 100.00
Highest Valid: 82.80
  Final Train: 100.00
   Final Test: 79.90
Split: 01, Run: 02
None time:  1.3005861989222467
None Run 02:
Highest Train: 100.00
Highest Valid: 80.80
  Final Train: 100.00
   Final Test: 78.30
Split: 01, Run: 03
None time:  3.8905959089752287
None Run 03:
Highest Train: 100.00
Highest Valid: 83.00
  Final Train: 100.00
   Final Test: 78.90
run time now: 6.4368345737457275
total time:  6.487475702073425
None All runs:
Highest Train: 100.00 ± 0.00
Highest Valid: 82.20 ± 1.22
  Final Train: 100.00 ± 0.00
   Final Test: 79.03 ± 0.81
[I 2023-06-12 00:48:18,713] Trial 378 finished with value: 82.20000457763672 and parameters: {'Fwd': 3.116321139389216e-05, 'K': 10, 'alpha': 0.9500000000000001, 'dropout': 0.9, 'gnnepoch': 90, 'lambda1': 0.65, 'lambda2': 3.3859557680015615, 'loop': 1, 'loss': 'MSE', 'lr': 0.002901246426631209, 'softmaxF': True, 'useGCN': False, 'weight_decay': 0.058170877002612253, 'weightedloss': False}. Best is trial 364 with value: 83.66666412353516.
/home/wxy/miniconda3/lib/python3.10/site-packages/optuna/distributions.py:685: UserWarning: The distribution is specified by [0, 1.00001] and step=0.05, but the range is not divisible by `step`. It will be replaced by [0, 1.0].
  warnings.warn(
K:  10
alpha:  0.9500000000000001
lr:  0.002199944932992078
weight_decay:  0.037283904823603116
dropout:  0.8
fix split and run 3 times
Data: Data(x=[19717, 500], y=[19717], train_mask=[19717], val_mask=[19717], test_mask=[19717], adj_t=[19717, 19717, nnz=88648])
num_train tensor(60)
num_noise 0
noise: tensor(0)
data feature 500
ALTOPT(
  (lins): Sequential(
    (0): Linear(in_features=500, out_features=64, bias=True)
    (1): BatchNorm1d(64, eps=1e-05, momentum=0.1, affine=True, track_running_stats=True)
    (2): Dropout(p=0.8, inplace=True)
    (3): ReLU(inplace=True)
    (4): Linear(in_features=64, out_features=3, bias=True)
    (5): Identity()
  )
  (prop): Propagation(K=10, mode=None, lambda1=None, lambda2=None, L21=True, alpha=0.9500000000000001)
  (gcn): GCN(
    (convs): ModuleList(
      (0): GCNConv(500, 64)
      (1): GCNConv(64, 3)
    )
    (bns): ModuleList(
      (0): BatchNorm1d(64, eps=1e-05, momentum=0.1, affine=True, track_running_stats=True)
    )
    (output): Identity()
  )
)
propagate done
init label
Split: 01, Run: 01
None time:  1.5664173681288958
None Run 01:
Highest Train: 100.00
Highest Valid: 82.00
  Final Train: 100.00
   Final Test: 78.80
Split: 01, Run: 02
None time:  1.9750979898963124
None Run 02:
Highest Train: 100.00
Highest Valid: 82.00
  Final Train: 100.00
   Final Test: 78.10
Split: 01, Run: 03
None time:  1.298711413051933
None Run 03:
Highest Train: 100.00
Highest Valid: 79.60
  Final Train: 100.00
   Final Test: 77.60
run time now: 4.891048192977905
total time:  4.945956927957013
None All runs:
Highest Train: 100.00 ± 0.00
Highest Valid: 81.20 ± 1.39
  Final Train: 100.00 ± 0.00
   Final Test: 78.17 ± 0.60
[I 2023-06-12 00:48:24,180] Trial 379 finished with value: 81.20000457763672 and parameters: {'Fwd': 1.0898703448585821e-05, 'K': 10, 'alpha': 0.9500000000000001, 'dropout': 0.8, 'gnnepoch': 90, 'lambda1': 0.9, 'lambda2': 3.0710795231221266, 'loop': 1, 'loss': 'MSE', 'lr': 0.002199944932992078, 'softmaxF': True, 'useGCN': False, 'weight_decay': 0.037283904823603116, 'weightedloss': False}. Best is trial 364 with value: 83.66666412353516.
/home/wxy/miniconda3/lib/python3.10/site-packages/optuna/distributions.py:685: UserWarning: The distribution is specified by [0, 1.00001] and step=0.05, but the range is not divisible by `step`. It will be replaced by [0, 1.0].
  warnings.warn(
K:  10
alpha:  0.55
lr:  0.0016354770295811786
weight_decay:  0.042490992079449216
dropout:  0.9
fix split and run 3 times
Data: Data(x=[19717, 500], y=[19717], train_mask=[19717], val_mask=[19717], test_mask=[19717], adj_t=[19717, 19717, nnz=88648])
num_train tensor(60)
num_noise 0
noise: tensor(0)
data feature 500
ALTOPT(
  (lins): Sequential(
    (0): Linear(in_features=500, out_features=64, bias=True)
    (1): BatchNorm1d(64, eps=1e-05, momentum=0.1, affine=True, track_running_stats=True)
    (2): Dropout(p=0.9, inplace=True)
    (3): ReLU(inplace=True)
    (4): Linear(in_features=64, out_features=3, bias=True)
    (5): Identity()
  )
  (prop): Propagation(K=10, mode=None, lambda1=None, lambda2=None, L21=True, alpha=0.55)
  (gcn): GCN(
    (convs): ModuleList(
      (0): GCNConv(500, 64)
      (1): GCNConv(64, 3)
    )
    (bns): ModuleList(
      (0): BatchNorm1d(64, eps=1e-05, momentum=0.1, affine=True, track_running_stats=True)
    )
    (output): Identity()
  )
)
propagate done
init label
Split: 01, Run: 01
None time:  0.5798022761009634
None Run 01:
Highest Train: 100.00
Highest Valid: 69.80
  Final Train: 100.00
   Final Test: 69.50
Split: 01, Run: 02
None time:  1.4243499180302024
None Run 02:
Highest Train: 100.00
Highest Valid: 73.60
  Final Train: 100.00
   Final Test: 71.90
Split: 01, Run: 03
None time:  2.6722613349556923
None Run 03:
Highest Train: 100.00
Highest Valid: 78.20
  Final Train: 100.00
   Final Test: 75.70
run time now: 4.723785638809204
total time:  4.76779605797492
None All runs:
Highest Train: 100.00 ± 0.00
Highest Valid: 73.87 ± 4.21
  Final Train: 100.00 ± 0.00
   Final Test: 72.37 ± 3.13
[I 2023-06-12 00:48:29,444] Trial 380 finished with value: 73.86666107177734 and parameters: {'Fwd': 7.902010190235305e-06, 'K': 10, 'alpha': 0.55, 'dropout': 0.9, 'gnnepoch': 70, 'lambda1': 0.55, 'lambda2': 3.360681600673462, 'loop': 1, 'loss': 'MSE', 'lr': 0.0016354770295811786, 'softmaxF': True, 'useGCN': False, 'weight_decay': 0.042490992079449216, 'weightedloss': False}. Best is trial 364 with value: 83.66666412353516.
/home/wxy/miniconda3/lib/python3.10/site-packages/optuna/distributions.py:685: UserWarning: The distribution is specified by [0, 1.00001] and step=0.05, but the range is not divisible by `step`. It will be replaced by [0, 1.0].
  warnings.warn(
K:  9
alpha:  0.9
lr:  0.002702937400972195
weight_decay:  0.0033753585263283
dropout:  0.9
fix split and run 3 times
Data: Data(x=[19717, 500], y=[19717], train_mask=[19717], val_mask=[19717], test_mask=[19717], adj_t=[19717, 19717, nnz=88648])
num_train tensor(60)
num_noise 0
noise: tensor(0)
data feature 500
ALTOPT(
  (lins): Sequential(
    (0): Linear(in_features=500, out_features=64, bias=True)
    (1): BatchNorm1d(64, eps=1e-05, momentum=0.1, affine=True, track_running_stats=True)
    (2): Dropout(p=0.9, inplace=True)
    (3): ReLU(inplace=True)
    (4): Linear(in_features=64, out_features=3, bias=True)
    (5): Identity()
  )
  (prop): Propagation(K=9, mode=None, lambda1=None, lambda2=None, L21=True, alpha=0.9)
  (gcn): GCN(
    (convs): ModuleList(
      (0): GCNConv(500, 64)
      (1): GCNConv(64, 3)
    )
    (bns): ModuleList(
      (0): BatchNorm1d(64, eps=1e-05, momentum=0.1, affine=True, track_running_stats=True)
    )
    (output): Identity()
  )
)
propagate done
init label
Split: 01, Run: 01
None time:  1.9850847590714693
None Run 01:
Highest Train: 100.00
Highest Valid: 81.20
  Final Train: 100.00
   Final Test: 77.40
Split: 01, Run: 02
None time:  1.7475859459955245
None Run 02:
Highest Train: 100.00
Highest Valid: 83.00
  Final Train: 100.00
   Final Test: 78.20
Split: 01, Run: 03
None time:  1.0604150190483779
None Run 03:
Highest Train: 100.00
Highest Valid: 81.20
  Final Train: 100.00
   Final Test: 77.90
run time now: 4.840813875198364
total time:  4.8942949920892715
None All runs:
Highest Train: 100.00 ± 0.00
Highest Valid: 81.80 ± 1.04
  Final Train: 100.00 ± 0.00
   Final Test: 77.83 ± 0.40
[I 2023-06-12 00:48:34,889] Trial 381 finished with value: 81.79999542236328 and parameters: {'Fwd': 6.485254761097925e-05, 'K': 9, 'alpha': 0.9, 'dropout': 0.9, 'gnnepoch': 70, 'lambda1': 0.9500000000000001, 'lambda2': 3.788627092926905, 'loop': 1, 'loss': 'MSE', 'lr': 0.002702937400972195, 'softmaxF': True, 'useGCN': False, 'weight_decay': 0.0033753585263283, 'weightedloss': True}. Best is trial 364 with value: 83.66666412353516.
/home/wxy/miniconda3/lib/python3.10/site-packages/optuna/distributions.py:685: UserWarning: The distribution is specified by [0, 1.00001] and step=0.05, but the range is not divisible by `step`. It will be replaced by [0, 1.0].
  warnings.warn(
K:  10
alpha:  1.0
lr:  0.0031238072689627194
weight_decay:  0.005496806569229984
dropout:  0.9
fix split and run 3 times
Data: Data(x=[19717, 500], y=[19717], train_mask=[19717], val_mask=[19717], test_mask=[19717], adj_t=[19717, 19717, nnz=88648])
num_train tensor(60)
num_noise 0
noise: tensor(0)
data feature 500
ALTOPT(
  (lins): Sequential(
    (0): Linear(in_features=500, out_features=64, bias=True)
    (1): BatchNorm1d(64, eps=1e-05, momentum=0.1, affine=True, track_running_stats=True)
    (2): Dropout(p=0.9, inplace=True)
    (3): ReLU(inplace=True)
    (4): Linear(in_features=64, out_features=3, bias=True)
    (5): LogSoftmax(dim=-1)
  )
  (prop): Propagation(K=10, mode=None, lambda1=None, lambda2=None, L21=True, alpha=1.0)
  (gcn): GCN(
    (convs): ModuleList(
      (0): GCNConv(500, 64)
      (1): GCNConv(64, 3)
    )
    (bns): ModuleList(
      (0): BatchNorm1d(64, eps=1e-05, momentum=0.1, affine=True, track_running_stats=True)
    )
    (output): LogSoftmax(dim=-1)
  )
)
propagate done
init label
Split: 01, Run: 01
None time:  1.3792246028315276
None Run 01:
Highest Train: 100.00
Highest Valid: 75.20
  Final Train: 90.00
   Final Test: 74.00
Split: 01, Run: 02
None time:  1.2579204810317606
None Run 02:
Highest Train: 100.00
Highest Valid: 80.60
  Final Train: 98.33
   Final Test: 79.30
Split: 01, Run: 03
None time:  1.2100784010253847
None Run 03:
Highest Train: 100.00
Highest Valid: 81.00
  Final Train: 98.33
   Final Test: 80.60
run time now: 3.8924200534820557
total time:  3.9341801849659532
None All runs:
Highest Train: 100.00 ± 0.00
Highest Valid: 78.93 ± 3.24
  Final Train: 95.56 ± 4.81
   Final Test: 77.97 ± 3.50
[I 2023-06-12 00:48:39,385] Trial 382 finished with value: 78.9333267211914 and parameters: {'Fwd': 2.0924327135401533e-05, 'K': 10, 'alpha': 1.0, 'dropout': 0.9, 'gnnepoch': 80, 'lambda1': 0.7000000000000001, 'lambda2': 3.9850487957421077, 'loop': 1, 'loss': 'CE', 'lr': 0.0031238072689627194, 'softmaxF': True, 'useGCN': False, 'weight_decay': 0.005496806569229984, 'weightedloss': False}. Best is trial 364 with value: 83.66666412353516.
/home/wxy/miniconda3/lib/python3.10/site-packages/optuna/distributions.py:685: UserWarning: The distribution is specified by [0, 1.00001] and step=0.05, but the range is not divisible by `step`. It will be replaced by [0, 1.0].
  warnings.warn(
K:  10
alpha:  0.9500000000000001
lr:  0.001973560936602846
weight_decay:  0.00450210845907702
dropout:  0.9
fix split and run 3 times
Data: Data(x=[19717, 500], y=[19717], train_mask=[19717], val_mask=[19717], test_mask=[19717], adj_t=[19717, 19717, nnz=88648])
num_train tensor(60)
num_noise 0
noise: tensor(0)
data feature 500
ALTOPT(
  (lins): Sequential(
    (0): Linear(in_features=500, out_features=64, bias=True)
    (1): BatchNorm1d(64, eps=1e-05, momentum=0.1, affine=True, track_running_stats=True)
    (2): Dropout(p=0.9, inplace=True)
    (3): ReLU(inplace=True)
    (4): Linear(in_features=64, out_features=3, bias=True)
    (5): Identity()
  )
  (prop): Propagation(K=10, mode=None, lambda1=None, lambda2=None, L21=True, alpha=0.9500000000000001)
  (gcn): GCN(
    (convs): ModuleList(
      (0): GCNConv(500, 64)
      (1): GCNConv(64, 3)
    )
    (bns): ModuleList(
      (0): BatchNorm1d(64, eps=1e-05, momentum=0.1, affine=True, track_running_stats=True)
    )
    (output): Identity()
  )
)
propagate done
init label
Split: 01, Run: 01
None time:  3.142235127976164
None Run 01:
Highest Train: 100.00
Highest Valid: 81.60
  Final Train: 100.00
   Final Test: 78.80
Split: 01, Run: 02
None time:  1.2502403219696134
None Run 02:
Highest Train: 100.00
Highest Valid: 83.80
  Final Train: 100.00
   Final Test: 79.90
Split: 01, Run: 03
None time:  1.913908062968403
None Run 03:
Highest Train: 100.00
Highest Valid: 81.40
  Final Train: 100.00
   Final Test: 78.80
run time now: 6.359104633331299
total time:  6.407487882999703
None All runs:
Highest Train: 100.00 ± 0.00
Highest Valid: 82.27 ± 1.33
  Final Train: 100.00 ± 0.00
   Final Test: 79.17 ± 0.64
[I 2023-06-12 00:48:46,288] Trial 383 finished with value: 82.26666259765625 and parameters: {'Fwd': 4.010101796297608e-06, 'K': 10, 'alpha': 0.9500000000000001, 'dropout': 0.9, 'gnnepoch': 60, 'lambda1': 0.6000000000000001, 'lambda2': 6.620198619078705, 'loop': 1, 'loss': 'MSE', 'lr': 0.001973560936602846, 'softmaxF': True, 'useGCN': False, 'weight_decay': 0.00450210845907702, 'weightedloss': False}. Best is trial 364 with value: 83.66666412353516.
/home/wxy/miniconda3/lib/python3.10/site-packages/optuna/distributions.py:685: UserWarning: The distribution is specified by [0, 1.00001] and step=0.05, but the range is not divisible by `step`. It will be replaced by [0, 1.0].
  warnings.warn(
K:  10
alpha:  0.9500000000000001
lr:  0.0011737390189249402
weight_decay:  0.0064782157860301314
dropout:  0.9
fix split and run 3 times
Data: Data(x=[19717, 500], y=[19717], train_mask=[19717], val_mask=[19717], test_mask=[19717], adj_t=[19717, 19717, nnz=88648])
num_train tensor(60)
num_noise 0
noise: tensor(0)
data feature 500
ALTOPT(
  (lins): Sequential(
    (0): Linear(in_features=500, out_features=64, bias=True)
    (1): BatchNorm1d(64, eps=1e-05, momentum=0.1, affine=True, track_running_stats=True)
    (2): Dropout(p=0.9, inplace=True)
    (3): ReLU(inplace=True)
    (4): Linear(in_features=64, out_features=3, bias=True)
    (5): Identity()
  )
  (prop): Propagation(K=10, mode=None, lambda1=None, lambda2=None, L21=True, alpha=0.9500000000000001)
  (gcn): GCN(
    (convs): ModuleList(
      (0): GCNConv(500, 64)
      (1): GCNConv(64, 3)
    )
    (bns): ModuleList(
      (0): BatchNorm1d(64, eps=1e-05, momentum=0.1, affine=True, track_running_stats=True)
    )
    (output): Identity()
  )
)
propagate done
init label
Split: 01, Run: 01
None time:  0.3709504178259522
None Run 01:
Highest Train: 100.00
Highest Valid: 69.80
  Final Train: 100.00
   Final Test: 69.60
Split: 01, Run: 02
None time:  0.389912033919245
None Run 02:
Highest Train: 100.00
Highest Valid: 69.80
  Final Train: 100.00
   Final Test: 69.60
Split: 01, Run: 03
None time:  0.38175849290564656
None Run 03:
Highest Train: 100.00
Highest Valid: 69.80
  Final Train: 100.00
   Final Test: 69.60
run time now: 1.195000171661377
total time:  1.2444700999185443
None All runs:
Highest Train: 100.00 ± 0.00
Highest Valid: 69.80 ± 0.00
  Final Train: 100.00 ± 0.00
   Final Test: 69.60 ± 0.00
[I 2023-06-12 00:48:48,084] Trial 384 finished with value: 69.80000305175781 and parameters: {'Fwd': 3.8603108172417736e-05, 'K': 10, 'alpha': 0.9500000000000001, 'dropout': 0.9, 'gnnepoch': 0, 'lambda1': 0.65, 'lambda2': 4.386343440409444, 'loop': 1, 'loss': 'MSE', 'lr': 0.0011737390189249402, 'softmaxF': True, 'useGCN': False, 'weight_decay': 0.0064782157860301314, 'weightedloss': False}. Best is trial 364 with value: 83.66666412353516.
/home/wxy/miniconda3/lib/python3.10/site-packages/optuna/distributions.py:685: UserWarning: The distribution is specified by [0, 1.00001] and step=0.05, but the range is not divisible by `step`. It will be replaced by [0, 1.0].
  warnings.warn(
K:  10
alpha:  1.0
lr:  0.0024613478939018397
weight_decay:  0.0008750159445391206
dropout:  0.9
fix split and run 3 times
Data: Data(x=[19717, 500], y=[19717], train_mask=[19717], val_mask=[19717], test_mask=[19717], adj_t=[19717, 19717, nnz=88648])
num_train tensor(60)
num_noise 0
noise: tensor(0)
data feature 500
ALTOPT(
  (lins): Sequential(
    (0): Linear(in_features=500, out_features=64, bias=True)
    (1): BatchNorm1d(64, eps=1e-05, momentum=0.1, affine=True, track_running_stats=True)
    (2): Dropout(p=0.9, inplace=True)
    (3): ReLU(inplace=True)
    (4): Linear(in_features=64, out_features=3, bias=True)
    (5): Identity()
  )
  (prop): Propagation(K=10, mode=None, lambda1=None, lambda2=None, L21=True, alpha=1.0)
  (gcn): GCN(
    (convs): ModuleList(
      (0): GCNConv(500, 64)
      (1): GCNConv(64, 3)
    )
    (bns): ModuleList(
      (0): BatchNorm1d(64, eps=1e-05, momentum=0.1, affine=True, track_running_stats=True)
    )
    (output): Identity()
  )
)
propagate done
init label
Split: 01, Run: 01, Epoch: 100, Loss: 0.3184, Train: 100.00%, Valid: 82.80% Test: 79.20%
Split: 01, Run: 01
None time:  3.3938719211146235
None Run 01:
Highest Train: 100.00
Highest Valid: 82.80
  Final Train: 100.00
   Final Test: 79.30
Split: 01, Run: 02
None time:  1.4067985720466822
None Run 02:
Highest Train: 100.00
Highest Valid: 83.80
  Final Train: 100.00
   Final Test: 79.40
Split: 01, Run: 03
None time:  1.0378613790962845
None Run 03:
Highest Train: 100.00
Highest Valid: 77.00
  Final Train: 100.00
   Final Test: 75.80
run time now: 5.897307872772217
total time:  5.945863564964384
None All runs:
Highest Train: 100.00 ± 0.00
Highest Valid: 81.20 ± 3.67
  Final Train: 100.00 ± 0.00
   Final Test: 78.17 ± 2.05
[I 2023-06-12 00:48:54,531] Trial 385 finished with value: 81.20000457763672 and parameters: {'Fwd': 6.588143649097413e-06, 'K': 10, 'alpha': 1.0, 'dropout': 0.9, 'gnnepoch': 60, 'lambda1': 0.55, 'lambda2': 4.212963582771858, 'loop': 1, 'loss': 'MSE', 'lr': 0.0024613478939018397, 'softmaxF': True, 'useGCN': False, 'weight_decay': 0.0008750159445391206, 'weightedloss': False}. Best is trial 364 with value: 83.66666412353516.
/home/wxy/miniconda3/lib/python3.10/site-packages/optuna/distributions.py:685: UserWarning: The distribution is specified by [0, 1.00001] and step=0.05, but the range is not divisible by `step`. It will be replaced by [0, 1.0].
  warnings.warn(
K:  10
alpha:  0.8
lr:  0.0027756762192714304
weight_decay:  0.00290822313050181
dropout:  0.9
fix split and run 3 times
Data: Data(x=[19717, 500], y=[19717], train_mask=[19717], val_mask=[19717], test_mask=[19717], adj_t=[19717, 19717, nnz=88648])
num_train tensor(60)
num_noise 0
noise: tensor(0)
data feature 500
ALTOPT(
  (lins): Sequential(
    (0): Linear(in_features=500, out_features=64, bias=True)
    (1): BatchNorm1d(64, eps=1e-05, momentum=0.1, affine=True, track_running_stats=True)
    (2): Dropout(p=0.9, inplace=True)
    (3): ReLU(inplace=True)
    (4): Linear(in_features=64, out_features=3, bias=True)
    (5): Identity()
  )
  (prop): Propagation(K=10, mode=None, lambda1=None, lambda2=None, L21=True, alpha=0.8)
  (gcn): GCN(
    (convs): ModuleList(
      (0): GCNConv(500, 64)
      (1): GCNConv(64, 3)
    )
    (bns): ModuleList(
      (0): BatchNorm1d(64, eps=1e-05, momentum=0.1, affine=True, track_running_stats=True)
    )
    (output): Identity()
  )
)
propagate done
init label
Split: 01, Run: 01
None time:  3.1303487268742174
None Run 01:
Highest Train: 100.00
Highest Valid: 79.40
  Final Train: 100.00
   Final Test: 75.50
Split: 01, Run: 02
None time:  1.3874699438456446
None Run 02:
Highest Train: 100.00
Highest Valid: 82.20
  Final Train: 100.00
   Final Test: 77.80
Split: 01, Run: 03
None time:  1.364688635803759
None Run 03:
Highest Train: 100.00
Highest Valid: 79.40
  Final Train: 100.00
   Final Test: 77.50
run time now: 5.930408954620361
total time:  5.9791191150434315
None All runs:
Highest Train: 100.00 ± 0.00
Highest Valid: 80.33 ± 1.62
  Final Train: 100.00 ± 0.00
   Final Test: 76.93 ± 1.25
