[I 2023-06-12 00:33:15,922] Trial 224 finished with value: 69.80000305175781 and parameters: {'Fwd': 9.7670209632294e-06, 'K': 10, 'alpha': 0.0, 'dropout': 0.9, 'gnnepoch': 10, 'lambda1': 0.6000000000000001, 'lambda2': 6.686658831750131, 'loop': 1, 'loss': 'MSE', 'lr': 0.002154948907400714, 'softmaxF': True, 'useGCN': False, 'weight_decay': 0.0022897322701629806, 'weightedloss': False}. Best is trial 205 with value: 83.53333282470703.
/home/wxy/miniconda3/lib/python3.10/site-packages/optuna/distributions.py:685: UserWarning: The distribution is specified by [0, 1.00001] and step=0.05, but the range is not divisible by `step`. It will be replaced by [0, 1.0].
  warnings.warn(
K:  10
alpha:  0.9500000000000001
lr:  0.003149201173821627
weight_decay:  0.004644711210256239
dropout:  0.9
fix split and run 3 times
Data: Data(x=[19717, 500], y=[19717], train_mask=[19717], val_mask=[19717], test_mask=[19717], adj_t=[19717, 19717, nnz=88648])
num_train tensor(60)
num_noise 0
noise: tensor(0)
data feature 500
ALTOPT(
  (lins): Sequential(
    (0): Linear(in_features=500, out_features=64, bias=True)
    (1): BatchNorm1d(64, eps=1e-05, momentum=0.1, affine=True, track_running_stats=True)
    (2): Dropout(p=0.9, inplace=True)
    (3): ReLU(inplace=True)
    (4): Linear(in_features=64, out_features=3, bias=True)
    (5): Identity()
  )
  (prop): Propagation(K=10, mode=None, lambda1=None, lambda2=None, L21=True, alpha=0.9500000000000001)
  (gcn): GCN(
    (convs): ModuleList(
      (0): GCNConv(500, 64)
      (1): GCNConv(64, 3)
    )
    (bns): ModuleList(
      (0): BatchNorm1d(64, eps=1e-05, momentum=0.1, affine=True, track_running_stats=True)
    )
    (output): Identity()
  )
)
propagate done
init label
Split: 01, Run: 01
None time:  2.0624302870128304
None Run 01:
Highest Train: 100.00
Highest Valid: 80.40
  Final Train: 100.00
   Final Test: 77.50
Split: 01, Run: 02
None time:  1.1330223029945046
None Run 02:
Highest Train: 100.00
Highest Valid: 83.00
  Final Train: 100.00
   Final Test: 78.50
Split: 01, Run: 03
None time:  1.0466970221605152
None Run 03:
Highest Train: 100.00
Highest Valid: 82.40
  Final Train: 100.00
   Final Test: 80.00
run time now: 4.294156074523926
total time:  4.346510319970548
None All runs:
Highest Train: 100.00 ± 0.00
Highest Valid: 81.93 ± 1.36
  Final Train: 100.00 ± 0.00
   Final Test: 78.67 ± 1.26
[I 2023-06-12 00:33:20,796] Trial 225 finished with value: 81.9333267211914 and parameters: {'Fwd': 5.461069812958612e-06, 'K': 10, 'alpha': 0.9500000000000001, 'dropout': 0.9, 'gnnepoch': 60, 'lambda1': 0.6000000000000001, 'lambda2': 4.741512148544322, 'loop': 1, 'loss': 'MSE', 'lr': 0.003149201173821627, 'softmaxF': True, 'useGCN': False, 'weight_decay': 0.004644711210256239, 'weightedloss': False}. Best is trial 205 with value: 83.53333282470703.
/home/wxy/miniconda3/lib/python3.10/site-packages/optuna/distributions.py:685: UserWarning: The distribution is specified by [0, 1.00001] and step=0.05, but the range is not divisible by `step`. It will be replaced by [0, 1.0].
  warnings.warn(
K:  10
alpha:  1.0
lr:  0.0028752880025887874
weight_decay:  0.0034531459693529893
dropout:  0.9
fix split and run 3 times
Data: Data(x=[19717, 500], y=[19717], train_mask=[19717], val_mask=[19717], test_mask=[19717], adj_t=[19717, 19717, nnz=88648])
num_train tensor(60)
num_noise 0
noise: tensor(0)
data feature 500
ALTOPT(
  (lins): Sequential(
    (0): Linear(in_features=500, out_features=64, bias=True)
    (1): BatchNorm1d(64, eps=1e-05, momentum=0.1, affine=True, track_running_stats=True)
    (2): Dropout(p=0.9, inplace=True)
    (3): ReLU(inplace=True)
    (4): Linear(in_features=64, out_features=3, bias=True)
    (5): Identity()
  )
  (prop): Propagation(K=10, mode=None, lambda1=None, lambda2=None, L21=True, alpha=1.0)
  (gcn): GCN(
    (convs): ModuleList(
      (0): GCNConv(500, 64)
      (1): GCNConv(64, 3)
    )
    (bns): ModuleList(
      (0): BatchNorm1d(64, eps=1e-05, momentum=0.1, affine=True, track_running_stats=True)
    )
    (output): Identity()
  )
)
propagate done
init label
Split: 01, Run: 01
None time:  0.7385225659236312
None Run 01:
Highest Train: 100.00
Highest Valid: 69.80
  Final Train: 100.00
   Final Test: 69.60
Split: 01, Run: 02
None time:  1.8980247960425913
None Run 02:
Highest Train: 100.00
Highest Valid: 83.40
  Final Train: 100.00
   Final Test: 80.00
Split: 01, Run: 03
None time:  0.9914807400200516
None Run 03:
Highest Train: 100.00
Highest Valid: 79.80
  Final Train: 100.00
   Final Test: 76.80
run time now: 3.6784064769744873
total time:  3.7309620219748467
None All runs:
Highest Train: 100.00 ± 0.00
Highest Valid: 77.67 ± 7.05
  Final Train: 100.00 ± 0.00
   Final Test: 75.47 ± 5.33
[I 2023-06-12 00:33:25,095] Trial 226 finished with value: 77.66666412353516 and parameters: {'Fwd': 3.8910740563394025e-06, 'K': 10, 'alpha': 1.0, 'dropout': 0.9, 'gnnepoch': 60, 'lambda1': 0.65, 'lambda2': 7.279840309954992, 'loop': 1, 'loss': 'MSE', 'lr': 0.0028752880025887874, 'softmaxF': True, 'useGCN': False, 'weight_decay': 0.0034531459693529893, 'weightedloss': False}. Best is trial 205 with value: 83.53333282470703.
/home/wxy/miniconda3/lib/python3.10/site-packages/optuna/distributions.py:685: UserWarning: The distribution is specified by [0, 1.00001] and step=0.05, but the range is not divisible by `step`. It will be replaced by [0, 1.0].
  warnings.warn(
K:  10
alpha:  0.9500000000000001
lr:  0.0023562758535156394
weight_decay:  0.0061693259451559524
dropout:  0.9
fix split and run 3 times
Data: Data(x=[19717, 500], y=[19717], train_mask=[19717], val_mask=[19717], test_mask=[19717], adj_t=[19717, 19717, nnz=88648])
num_train tensor(60)
num_noise 0
noise: tensor(0)
data feature 500
ALTOPT(
  (lins): Sequential(
    (0): Linear(in_features=500, out_features=64, bias=True)
    (1): BatchNorm1d(64, eps=1e-05, momentum=0.1, affine=True, track_running_stats=True)
    (2): Dropout(p=0.9, inplace=True)
    (3): ReLU(inplace=True)
    (4): Linear(in_features=64, out_features=3, bias=True)
    (5): Identity()
  )
  (prop): Propagation(K=10, mode=None, lambda1=None, lambda2=None, L21=True, alpha=0.9500000000000001)
  (gcn): GCN(
    (convs): ModuleList(
      (0): GCNConv(500, 64)
      (1): GCNConv(64, 3)
    )
    (bns): ModuleList(
      (0): BatchNorm1d(64, eps=1e-05, momentum=0.1, affine=True, track_running_stats=True)
    )
    (output): Identity()
  )
)
propagate done
init label
Split: 01, Run: 01
None time:  2.123316915007308
None Run 01:
Highest Train: 100.00
Highest Valid: 82.00
  Final Train: 100.00
   Final Test: 77.50
Split: 01, Run: 02
None time:  2.003857356030494
None Run 02:
Highest Train: 100.00
Highest Valid: 84.20
  Final Train: 100.00
   Final Test: 80.30
Split: 01, Run: 03
None time:  1.4508682289160788
None Run 03:
Highest Train: 100.00
Highest Valid: 84.40
  Final Train: 100.00
   Final Test: 79.90
run time now: 5.622335433959961
total time:  5.672940267017111
None All runs:
Highest Train: 100.00 ± 0.00
Highest Valid: 83.53 ± 1.33
  Final Train: 100.00 ± 0.00
   Final Test: 79.23 ± 1.51
[I 2023-06-12 00:33:31,301] Trial 227 finished with value: 83.53333282470703 and parameters: {'Fwd': 3.2313660532055144e-06, 'K': 10, 'alpha': 0.9500000000000001, 'dropout': 0.9, 'gnnepoch': 60, 'lambda1': 0.6000000000000001, 'lambda2': 3.0756985376078476, 'loop': 1, 'loss': 'MSE', 'lr': 0.0023562758535156394, 'softmaxF': True, 'useGCN': False, 'weight_decay': 0.0061693259451559524, 'weightedloss': False}. Best is trial 205 with value: 83.53333282470703.
/home/wxy/miniconda3/lib/python3.10/site-packages/optuna/distributions.py:685: UserWarning: The distribution is specified by [0, 1.00001] and step=0.05, but the range is not divisible by `step`. It will be replaced by [0, 1.0].
  warnings.warn(
K:  10
alpha:  0.9
lr:  0.0025154354358977674
weight_decay:  0.009868329437216022
dropout:  0.9
fix split and run 3 times
Data: Data(x=[19717, 500], y=[19717], train_mask=[19717], val_mask=[19717], test_mask=[19717], adj_t=[19717, 19717, nnz=88648])
num_train tensor(60)
num_noise 0
noise: tensor(0)
data feature 500
ALTOPT(
  (lins): Sequential(
    (0): Linear(in_features=500, out_features=64, bias=True)
    (1): BatchNorm1d(64, eps=1e-05, momentum=0.1, affine=True, track_running_stats=True)
    (2): Dropout(p=0.9, inplace=True)
    (3): ReLU(inplace=True)
    (4): Linear(in_features=64, out_features=3, bias=True)
    (5): Identity()
  )
  (prop): Propagation(K=10, mode=None, lambda1=None, lambda2=None, L21=True, alpha=0.9)
  (gcn): GCN(
    (convs): ModuleList(
      (0): GCNConv(500, 64)
      (1): GCNConv(64, 3)
    )
    (bns): ModuleList(
      (0): BatchNorm1d(64, eps=1e-05, momentum=0.1, affine=True, track_running_stats=True)
    )
    (output): Identity()
  )
)
propagate done
init label
Split: 01, Run: 01, Epoch: 100, Loss: 0.4122, Train: 100.00%, Valid: 80.40% Test: 76.50%
Split: 01, Run: 01
None time:  3.599278162000701
None Run 01:
Highest Train: 100.00
Highest Valid: 80.40
  Final Train: 100.00
   Final Test: 76.40
Split: 01, Run: 02
None time:  1.0696710960473865
None Run 02:
Highest Train: 100.00
Highest Valid: 82.40
  Final Train: 100.00
   Final Test: 77.10
Split: 01, Run: 03
None time:  1.2551345240790397
None Run 03:
Highest Train: 100.00
Highest Valid: 82.20
  Final Train: 100.00
   Final Test: 79.70
run time now: 5.982089519500732
total time:  6.044767459854484
None All runs:
Highest Train: 100.00 ± 0.00
Highest Valid: 81.67 ± 1.10
  Final Train: 100.00 ± 0.00
   Final Test: 77.73 ± 1.74
[I 2023-06-12 00:33:37,837] Trial 228 finished with value: 81.66666412353516 and parameters: {'Fwd': 4.938963898239851e-06, 'K': 10, 'alpha': 0.9, 'dropout': 0.9, 'gnnepoch': 60, 'lambda1': 0.6000000000000001, 'lambda2': 4.363722068352997, 'loop': 1, 'loss': 'MSE', 'lr': 0.0025154354358977674, 'softmaxF': True, 'useGCN': False, 'weight_decay': 0.009868329437216022, 'weightedloss': False}. Best is trial 205 with value: 83.53333282470703.
/home/wxy/miniconda3/lib/python3.10/site-packages/optuna/distributions.py:685: UserWarning: The distribution is specified by [0, 1.00001] and step=0.05, but the range is not divisible by `step`. It will be replaced by [0, 1.0].
  warnings.warn(
K:  10
alpha:  0.9500000000000001
lr:  0.0002515550376304834
weight_decay:  0.006707147737525924
dropout:  0.9
fix split and run 3 times
Data: Data(x=[19717, 500], y=[19717], train_mask=[19717], val_mask=[19717], test_mask=[19717], adj_t=[19717, 19717, nnz=88648])
num_train tensor(60)
num_noise 0
noise: tensor(0)
data feature 500
ALTOPT(
  (lins): Sequential(
    (0): Linear(in_features=500, out_features=64, bias=True)
    (1): BatchNorm1d(64, eps=1e-05, momentum=0.1, affine=True, track_running_stats=True)
    (2): Dropout(p=0.9, inplace=True)
    (3): ReLU(inplace=True)
    (4): Linear(in_features=64, out_features=3, bias=True)
    (5): Identity()
  )
  (prop): Propagation(K=10, mode=None, lambda1=None, lambda2=None, L21=True, alpha=0.9500000000000001)
  (gcn): GCN(
    (convs): ModuleList(
      (0): GCNConv(500, 64)
      (1): GCNConv(64, 3)
    )
    (bns): ModuleList(
      (0): BatchNorm1d(64, eps=1e-05, momentum=0.1, affine=True, track_running_stats=True)
    )
    (output): Identity()
  )
)
propagate done
init label
Split: 01, Run: 01
None time:  1.1239221149589866
None Run 01:
Highest Train: 100.00
Highest Valid: 69.80
  Final Train: 100.00
   Final Test: 69.50
Split: 01, Run: 02
None time:  1.582582503091544
None Run 02:
Highest Train: 100.00
Highest Valid: 79.20
  Final Train: 100.00
   Final Test: 73.40
Split: 01, Run: 03, Epoch: 100, Loss: 0.5600, Train: 100.00%, Valid: 80.20% Test: 76.30%
Split: 01, Run: 03
None time:  3.6534982309676707
None Run 03:
Highest Train: 100.00
Highest Valid: 80.20
  Final Train: 100.00
   Final Test: 76.20
run time now: 6.419579744338989
total time:  6.479930690024048
None All runs:
Highest Train: 100.00 ± 0.00
Highest Valid: 76.40 ± 5.74
  Final Train: 100.00 ± 0.00
   Final Test: 73.03 ± 3.37
[I 2023-06-12 00:33:44,891] Trial 229 finished with value: 76.4000015258789 and parameters: {'Fwd': 2.810889711149313e-06, 'K': 10, 'alpha': 0.9500000000000001, 'dropout': 0.9, 'gnnepoch': 70, 'lambda1': 0.6000000000000001, 'lambda2': 1.75567992849854, 'loop': 1, 'loss': 'MSE', 'lr': 0.0002515550376304834, 'softmaxF': True, 'useGCN': False, 'weight_decay': 0.006707147737525924, 'weightedloss': False}. Best is trial 205 with value: 83.53333282470703.
/home/wxy/miniconda3/lib/python3.10/site-packages/optuna/distributions.py:685: UserWarning: The distribution is specified by [0, 1.00001] and step=0.05, but the range is not divisible by `step`. It will be replaced by [0, 1.0].
  warnings.warn(
K:  10
alpha:  1.0
lr:  0.003519400808254385
weight_decay:  0.004926170284496091
dropout:  0.9
fix split and run 3 times
Data: Data(x=[19717, 500], y=[19717], train_mask=[19717], val_mask=[19717], test_mask=[19717], adj_t=[19717, 19717, nnz=88648])
num_train tensor(60)
num_noise 0
noise: tensor(0)
data feature 500
ALTOPT(
  (lins): Sequential(
    (0): Linear(in_features=500, out_features=64, bias=True)
    (1): BatchNorm1d(64, eps=1e-05, momentum=0.1, affine=True, track_running_stats=True)
    (2): Dropout(p=0.9, inplace=True)
    (3): ReLU(inplace=True)
    (4): Linear(in_features=64, out_features=3, bias=True)
    (5): Identity()
  )
  (prop): Propagation(K=10, mode=None, lambda1=None, lambda2=None, L21=True, alpha=1.0)
  (gcn): GCN(
    (convs): ModuleList(
      (0): GCNConv(500, 64)
      (1): GCNConv(64, 3)
    )
    (bns): ModuleList(
      (0): BatchNorm1d(64, eps=1e-05, momentum=0.1, affine=True, track_running_stats=True)
    )
    (output): Identity()
  )
)
propagate done
init label
Split: 01, Run: 01
None time:  0.8472570239100605
None Run 01:
Highest Train: 100.00
Highest Valid: 69.80
  Final Train: 100.00
   Final Test: 69.60
Split: 01, Run: 02
None time:  1.111750383861363
None Run 02:
Highest Train: 100.00
Highest Valid: 82.20
  Final Train: 100.00
   Final Test: 79.40
Split: 01, Run: 03
None time:  1.6180095931049436
None Run 03:
Highest Train: 100.00
Highest Valid: 82.40
  Final Train: 100.00
   Final Test: 79.50
run time now: 3.629121780395508
total time:  3.6848447620868683
None All runs:
Highest Train: 100.00 ± 0.00
Highest Valid: 78.13 ± 7.22
  Final Train: 100.00 ± 0.00
   Final Test: 76.17 ± 5.69
[I 2023-06-12 00:33:49,014] Trial 230 finished with value: 78.13333129882812 and parameters: {'Fwd': 7.39568069106169e-06, 'K': 10, 'alpha': 1.0, 'dropout': 0.9, 'gnnepoch': 50, 'lambda1': 0.65, 'lambda2': 2.7018243957669528, 'loop': 1, 'loss': 'MSE', 'lr': 0.003519400808254385, 'softmaxF': True, 'useGCN': False, 'weight_decay': 0.004926170284496091, 'weightedloss': False}. Best is trial 205 with value: 83.53333282470703.
/home/wxy/miniconda3/lib/python3.10/site-packages/optuna/distributions.py:685: UserWarning: The distribution is specified by [0, 1.00001] and step=0.05, but the range is not divisible by `step`. It will be replaced by [0, 1.0].
  warnings.warn(
K:  10
alpha:  0.9500000000000001
lr:  0.0023263664673482064
weight_decay:  0.0025690017908001415
dropout:  0.9
fix split and run 3 times
Data: Data(x=[19717, 500], y=[19717], train_mask=[19717], val_mask=[19717], test_mask=[19717], adj_t=[19717, 19717, nnz=88648])
num_train tensor(60)
num_noise 0
noise: tensor(0)
data feature 500
ALTOPT(
  (lins): Sequential(
    (0): Linear(in_features=500, out_features=64, bias=True)
    (1): BatchNorm1d(64, eps=1e-05, momentum=0.1, affine=True, track_running_stats=True)
    (2): Dropout(p=0.9, inplace=True)
    (3): ReLU(inplace=True)
    (4): Linear(in_features=64, out_features=3, bias=True)
    (5): Identity()
  )
  (prop): Propagation(K=10, mode=None, lambda1=None, lambda2=None, L21=True, alpha=0.9500000000000001)
  (gcn): GCN(
    (convs): ModuleList(
      (0): GCNConv(500, 64)
      (1): GCNConv(64, 3)
    )
    (bns): ModuleList(
      (0): BatchNorm1d(64, eps=1e-05, momentum=0.1, affine=True, track_running_stats=True)
    )
    (output): Identity()
  )
)
propagate done
init label
Split: 01, Run: 01
None time:  2.350284883985296
None Run 01:
Highest Train: 100.00
Highest Valid: 81.80
  Final Train: 100.00
   Final Test: 77.70
Split: 01, Run: 02
None time:  1.9351262629497796
None Run 02:
Highest Train: 100.00
Highest Valid: 82.60
  Final Train: 100.00
   Final Test: 78.30
Split: 01, Run: 03
None time:  1.1481495790649205
None Run 03:
Highest Train: 100.00
Highest Valid: 84.20
  Final Train: 100.00
   Final Test: 80.30
run time now: 5.480487585067749
total time:  5.5336108398623765
None All runs:
Highest Train: 100.00 ± 0.00
Highest Valid: 82.87 ± 1.22
  Final Train: 100.00 ± 0.00
   Final Test: 78.77 ± 1.36
[I 2023-06-12 00:33:55,136] Trial 231 finished with value: 82.86666107177734 and parameters: {'Fwd': 3.3615946488283374e-06, 'K': 10, 'alpha': 0.9500000000000001, 'dropout': 0.9, 'gnnepoch': 60, 'lambda1': 0.75, 'lambda2': 5.488839771209995, 'loop': 1, 'loss': 'MSE', 'lr': 0.0023263664673482064, 'softmaxF': True, 'useGCN': False, 'weight_decay': 0.0025690017908001415, 'weightedloss': False}. Best is trial 205 with value: 83.53333282470703.
/home/wxy/miniconda3/lib/python3.10/site-packages/optuna/distributions.py:685: UserWarning: The distribution is specified by [0, 1.00001] and step=0.05, but the range is not divisible by `step`. It will be replaced by [0, 1.0].
  warnings.warn(
K:  10
alpha:  0.9500000000000001
lr:  0.002322931125750052
weight_decay:  0.00290553483928794
dropout:  0.9
fix split and run 3 times
Data: Data(x=[19717, 500], y=[19717], train_mask=[19717], val_mask=[19717], test_mask=[19717], adj_t=[19717, 19717, nnz=88648])
num_train tensor(60)
num_noise 0
noise: tensor(0)
data feature 500
ALTOPT(
  (lins): Sequential(
    (0): Linear(in_features=500, out_features=64, bias=True)
    (1): BatchNorm1d(64, eps=1e-05, momentum=0.1, affine=True, track_running_stats=True)
    (2): Dropout(p=0.9, inplace=True)
    (3): ReLU(inplace=True)
    (4): Linear(in_features=64, out_features=3, bias=True)
    (5): Identity()
  )
  (prop): Propagation(K=10, mode=None, lambda1=None, lambda2=None, L21=True, alpha=0.9500000000000001)
  (gcn): GCN(
    (convs): ModuleList(
      (0): GCNConv(500, 64)
      (1): GCNConv(64, 3)
    )
    (bns): ModuleList(
      (0): BatchNorm1d(64, eps=1e-05, momentum=0.1, affine=True, track_running_stats=True)
    )
    (output): Identity()
  )
)
propagate done
init label
Split: 01, Run: 01
None time:  2.251335356850177
None Run 01:
Highest Train: 100.00
Highest Valid: 81.80
  Final Train: 100.00
   Final Test: 77.80
Split: 01, Run: 02
None time:  1.3824792890809476
None Run 02:
Highest Train: 100.00
Highest Valid: 82.20
  Final Train: 100.00
   Final Test: 78.40
Split: 01, Run: 03
None time:  1.2256776071153581
None Run 03:
Highest Train: 100.00
Highest Valid: 83.20
  Final Train: 100.00
   Final Test: 80.50
run time now: 4.927954435348511
total time:  4.984234591946006
None All runs:
Highest Train: 100.00 ± 0.00
Highest Valid: 82.40 ± 0.72
  Final Train: 100.00 ± 0.00
   Final Test: 78.90 ± 1.42
[I 2023-06-12 00:34:00,594] Trial 232 finished with value: 82.4000015258789 and parameters: {'Fwd': 0.0001725070255465745, 'K': 10, 'alpha': 0.9500000000000001, 'dropout': 0.9, 'gnnepoch': 60, 'lambda1': 0.75, 'lambda2': 5.528999259138837, 'loop': 1, 'loss': 'MSE', 'lr': 0.002322931125750052, 'softmaxF': True, 'useGCN': False, 'weight_decay': 0.00290553483928794, 'weightedloss': False}. Best is trial 205 with value: 83.53333282470703.
/home/wxy/miniconda3/lib/python3.10/site-packages/optuna/distributions.py:685: UserWarning: The distribution is specified by [0, 1.00001] and step=0.05, but the range is not divisible by `step`. It will be replaced by [0, 1.0].
  warnings.warn(
K:  10
alpha:  0.9500000000000001
lr:  0.00269313038923235
weight_decay:  0.0036370261392095096
dropout:  0.9
fix split and run 3 times
Data: Data(x=[19717, 500], y=[19717], train_mask=[19717], val_mask=[19717], test_mask=[19717], adj_t=[19717, 19717, nnz=88648])
num_train tensor(60)
num_noise 0
noise: tensor(0)
data feature 500
ALTOPT(
  (lins): Sequential(
    (0): Linear(in_features=500, out_features=64, bias=True)
    (1): BatchNorm1d(64, eps=1e-05, momentum=0.1, affine=True, track_running_stats=True)
    (2): Dropout(p=0.9, inplace=True)
    (3): ReLU(inplace=True)
    (4): Linear(in_features=64, out_features=3, bias=True)
    (5): Identity()
  )
  (prop): Propagation(K=10, mode=None, lambda1=None, lambda2=None, L21=True, alpha=0.9500000000000001)
  (gcn): GCN(
    (convs): ModuleList(
      (0): GCNConv(500, 64)
      (1): GCNConv(64, 3)
    )
    (bns): ModuleList(
      (0): BatchNorm1d(64, eps=1e-05, momentum=0.1, affine=True, track_running_stats=True)
    )
    (output): Identity()
  )
)
propagate done
init label
Split: 01, Run: 01, Epoch: 100, Loss: 0.3424, Train: 100.00%, Valid: 81.80% Test: 78.20%
Split: 01, Run: 01
None time:  3.5237481619697064
None Run 01:
Highest Train: 100.00
Highest Valid: 81.80
  Final Train: 100.00
   Final Test: 78.10
Split: 01, Run: 02
None time:  3.215370959136635
None Run 02:
Highest Train: 100.00
Highest Valid: 83.80
  Final Train: 100.00
   Final Test: 80.00
Split: 01, Run: 03
None time:  2.530776476021856
None Run 03:
Highest Train: 100.00
Highest Valid: 82.80
  Final Train: 100.00
   Final Test: 80.10
run time now: 9.318558692932129
total time:  9.35899236612022
None All runs:
Highest Train: 100.00 ± 0.00
Highest Valid: 82.80 ± 1.00
  Final Train: 100.00 ± 0.00
   Final Test: 79.40 ± 1.13
