[I 2023-06-12 00:15:35,147] Trial 826 finished with value: 69.86666870117188 and parameters: {'Fwd': 0.02993400984347584, 'K': 8, 'alpha': 0.8, 'dropout': 0.8, 'gnnepoch': 120, 'lambda1': 0.75, 'lambda2': 6.813327353615025, 'loop': 0, 'loss': 'CE', 'lr': 0.00032647158607748147, 'softmaxF': False, 'useGCN': True, 'weight_decay': 2.5627973063105532e-05, 'weightedloss': True}. Best is trial 605 with value: 72.13333129882812.
/home/wxy/miniconda3/lib/python3.10/site-packages/optuna/distributions.py:685: UserWarning: The distribution is specified by [0, 1.00001] and step=0.05, but the range is not divisible by `step`. It will be replaced by [0, 1.0].
  warnings.warn(
K:  7
alpha:  0.8500000000000001
lr:  0.001128830188695293
weight_decay:  0.001049980532766909
dropout:  0.8
fix split and run 3 times
Data: Data(x=[3327, 3703], y=[3327], train_mask=[3327], val_mask=[3327], test_mask=[3327], adj_t=[3327, 3327, nnz=9104])
num_train tensor(120)
num_noise 0
noise: tensor(0)
data feature 3703
ALTOPT(
  (lins): Sequential(
    (0): Linear(in_features=3703, out_features=64, bias=True)
    (1): BatchNorm1d(64, eps=1e-05, momentum=0.1, affine=True, track_running_stats=True)
    (2): Dropout(p=0.8, inplace=True)
    (3): ReLU(inplace=True)
    (4): Linear(in_features=64, out_features=6, bias=True)
    (5): LogSoftmax(dim=-1)
  )
  (prop): Propagation(K=7, mode=None, lambda1=None, lambda2=None, L21=True, alpha=0.8500000000000001)
  (gcn): GCN(
    (convs): ModuleList(
      (0): GCNConv(3703, 64)
      (1): GCNConv(64, 6)
    )
    (bns): ModuleList(
      (0): BatchNorm1d(64, eps=1e-05, momentum=0.1, affine=True, track_running_stats=True)
    )
    (output): LogSoftmax(dim=-1)
  )
)
propagate done
init label
Split: 01, Run: 01
None time:  1.7674200260080397
None Run 01:
Highest Train: 100.00
Highest Valid: 71.00
  Final Train: 100.00
   Final Test: 69.60
Split: 01, Run: 02
None time:  2.2576754661276937
None Run 02:
Highest Train: 100.00
Highest Valid: 72.40
  Final Train: 100.00
   Final Test: 69.70
Split: 01, Run: 03
None time:  2.2832800848409534
None Run 03:
Highest Train: 100.00
Highest Valid: 71.80
  Final Train: 97.50
   Final Test: 70.70
run time now: 6.363166332244873
total time:  6.414327898994088
None All runs:
Highest Train: 100.00 ± 0.00
Highest Valid: 71.73 ± 0.70
  Final Train: 99.17 ± 1.44
   Final Test: 70.00 ± 0.61
[I 2023-06-12 00:15:42,199] Trial 827 finished with value: 71.73332977294922 and parameters: {'Fwd': 1.0143529411916262e-06, 'K': 7, 'alpha': 0.8500000000000001, 'dropout': 0.8, 'gnnepoch': 120, 'lambda1': 0.7000000000000001, 'lambda2': 1.3559730257598224, 'loop': 0, 'loss': 'CE', 'lr': 0.001128830188695293, 'softmaxF': False, 'useGCN': True, 'weight_decay': 0.001049980532766909, 'weightedloss': True}. Best is trial 605 with value: 72.13333129882812.
/home/wxy/miniconda3/lib/python3.10/site-packages/optuna/distributions.py:685: UserWarning: The distribution is specified by [0, 1.00001] and step=0.05, but the range is not divisible by `step`. It will be replaced by [0, 1.0].
  warnings.warn(
K:  10
alpha:  0.9
lr:  0.00030516073554719044
weight_decay:  0.0005173326686305121
dropout:  0.8
fix split and run 3 times
Data: Data(x=[3327, 3703], y=[3327], train_mask=[3327], val_mask=[3327], test_mask=[3327], adj_t=[3327, 3327, nnz=9104])
num_train tensor(120)
num_noise 0
noise: tensor(0)
data feature 3703
ALTOPT(
  (lins): Sequential(
    (0): Linear(in_features=3703, out_features=64, bias=True)
    (1): BatchNorm1d(64, eps=1e-05, momentum=0.1, affine=True, track_running_stats=True)
    (2): Dropout(p=0.8, inplace=True)
    (3): ReLU(inplace=True)
    (4): Linear(in_features=64, out_features=6, bias=True)
    (5): LogSoftmax(dim=-1)
  )
  (prop): Propagation(K=10, mode=None, lambda1=None, lambda2=None, L21=True, alpha=0.9)
  (gcn): GCN(
    (convs): ModuleList(
      (0): GCNConv(3703, 64)
      (1): GCNConv(64, 6)
    )
    (bns): ModuleList(
      (0): BatchNorm1d(64, eps=1e-05, momentum=0.1, affine=True, track_running_stats=True)
    )
    (output): LogSoftmax(dim=-1)
  )
)
propagate done
init label
Split: 01, Run: 01
None time:  2.325323861092329
None Run 01:
Highest Train: 100.00
Highest Valid: 70.00
  Final Train: 100.00
   Final Test: 69.50
Split: 01, Run: 02
None time:  2.372423468856141
None Run 02:
Highest Train: 100.00
Highest Valid: 70.20
  Final Train: 100.00
   Final Test: 69.90
Split: 01, Run: 03
None time:  2.3636330268345773
None Run 03:
Highest Train: 100.00
Highest Valid: 69.00
  Final Train: 100.00
   Final Test: 69.70
run time now: 7.121841192245483
total time:  7.174897633027285
None All runs:
Highest Train: 100.00 ± 0.00
Highest Valid: 69.73 ± 0.64
  Final Train: 100.00 ± 0.00
   Final Test: 69.70 ± 0.20
[I 2023-06-12 00:15:50,107] Trial 828 finished with value: 69.73333740234375 and parameters: {'Fwd': 8.252214157487785e-05, 'K': 10, 'alpha': 0.9, 'dropout': 0.8, 'gnnepoch': 120, 'lambda1': 0.65, 'lambda2': 5.032142140504957, 'loop': 0, 'loss': 'CE', 'lr': 0.00030516073554719044, 'softmaxF': False, 'useGCN': True, 'weight_decay': 0.0005173326686305121, 'weightedloss': True}. Best is trial 605 with value: 72.13333129882812.
/home/wxy/miniconda3/lib/python3.10/site-packages/optuna/distributions.py:685: UserWarning: The distribution is specified by [0, 1.00001] and step=0.05, but the range is not divisible by `step`. It will be replaced by [0, 1.0].
  warnings.warn(
K:  8
alpha:  0.6000000000000001
lr:  0.0055723566219276835
weight_decay:  5.514197237451841e-05
dropout:  0.8
fix split and run 3 times
Data: Data(x=[3327, 3703], y=[3327], train_mask=[3327], val_mask=[3327], test_mask=[3327], adj_t=[3327, 3327, nnz=9104])
num_train tensor(120)
num_noise 0
noise: tensor(0)
data feature 3703
ALTOPT(
  (lins): Sequential(
    (0): Linear(in_features=3703, out_features=64, bias=True)
    (1): BatchNorm1d(64, eps=1e-05, momentum=0.1, affine=True, track_running_stats=True)
    (2): Dropout(p=0.8, inplace=True)
    (3): ReLU(inplace=True)
    (4): Linear(in_features=64, out_features=6, bias=True)
    (5): Identity()
  )
  (prop): Propagation(K=8, mode=None, lambda1=None, lambda2=None, L21=True, alpha=0.6000000000000001)
  (gcn): GCN(
    (convs): ModuleList(
      (0): GCNConv(3703, 64)
      (1): GCNConv(64, 6)
    )
    (bns): ModuleList(
      (0): BatchNorm1d(64, eps=1e-05, momentum=0.1, affine=True, track_running_stats=True)
    )
    (output): Identity()
  )
)
propagate done
init label
Split: 01, Run: 01, Epoch: 100, Loss: 0.0000, Train: 100.00%, Valid: 64.80% Test: 67.10%
Split: 01, Run: 01
None time:  4.3298507269937545
None Run 01:
Highest Train: 100.00
Highest Valid: 64.80
  Final Train: 100.00
   Final Test: 67.10
Split: 01, Run: 02, Epoch: 100, Loss: 0.0000, Train: 100.00%, Valid: 65.00% Test: 67.00%
Split: 01, Run: 02
None time:  3.8823514371179044
None Run 02:
Highest Train: 100.00
Highest Valid: 65.00
  Final Train: 100.00
   Final Test: 66.80
Split: 01, Run: 03, Epoch: 100, Loss: 0.0000, Train: 100.00%, Valid: 64.80% Test: 66.30%
Split: 01, Run: 03
None time:  4.305866091977805
None Run 03:
Highest Train: 100.00
Highest Valid: 64.80
  Final Train: 100.00
   Final Test: 66.30
run time now: 12.578235864639282
total time:  12.629481522832066
None All runs:
Highest Train: 100.00 ± 0.00
Highest Valid: 64.87 ± 0.12
  Final Train: 100.00 ± 0.00
   Final Test: 66.73 ± 0.40
[I 2023-06-12 00:16:03,256] Trial 829 finished with value: 64.86666870117188 and parameters: {'Fwd': 0.05425581228059347, 'K': 8, 'alpha': 0.6000000000000001, 'dropout': 0.8, 'gnnepoch': 120, 'lambda1': 0.55, 'lambda2': 8.607353857262483, 'loop': 0, 'loss': 'MSE', 'lr': 0.0055723566219276835, 'softmaxF': False, 'useGCN': True, 'weight_decay': 5.514197237451841e-05, 'weightedloss': True}. Best is trial 605 with value: 72.13333129882812.
/home/wxy/miniconda3/lib/python3.10/site-packages/optuna/distributions.py:685: UserWarning: The distribution is specified by [0, 1.00001] and step=0.05, but the range is not divisible by `step`. It will be replaced by [0, 1.0].
  warnings.warn(
K:  8
alpha:  0.55
lr:  0.0013589018322549857
weight_decay:  0.01878355960785216
dropout:  0.8
fix split and run 3 times
Data: Data(x=[3327, 3703], y=[3327], train_mask=[3327], val_mask=[3327], test_mask=[3327], adj_t=[3327, 3327, nnz=9104])
num_train tensor(120)
num_noise 0
noise: tensor(0)
data feature 3703
ALTOPT(
  (lins): Sequential(
    (0): Linear(in_features=3703, out_features=64, bias=True)
    (1): BatchNorm1d(64, eps=1e-05, momentum=0.1, affine=True, track_running_stats=True)
    (2): Dropout(p=0.8, inplace=True)
    (3): ReLU(inplace=True)
    (4): Linear(in_features=64, out_features=6, bias=True)
    (5): LogSoftmax(dim=-1)
  )
  (prop): Propagation(K=8, mode=None, lambda1=None, lambda2=None, L21=True, alpha=0.55)
  (gcn): GCN(
    (convs): ModuleList(
      (0): GCNConv(3703, 64)
      (1): GCNConv(64, 6)
    )
    (bns): ModuleList(
      (0): BatchNorm1d(64, eps=1e-05, momentum=0.1, affine=True, track_running_stats=True)
    )
    (output): LogSoftmax(dim=-1)
  )
)
propagate done
init label
Split: 01, Run: 01
None time:  2.03685114486143
None Run 01:
Highest Train: 100.00
Highest Valid: 70.60
  Final Train: 100.00
   Final Test: 70.00
Split: 01, Run: 02
None time:  2.0979095101356506
None Run 02:
Highest Train: 100.00
Highest Valid: 68.60
  Final Train: 100.00
   Final Test: 68.20
Split: 01, Run: 03
None time:  2.023907440016046
None Run 03:
Highest Train: 100.00
Highest Valid: 71.20
  Final Train: 100.00
   Final Test: 70.40
run time now: 6.206132888793945
total time:  6.251712715951726
None All runs:
Highest Train: 100.00 ± 0.00
Highest Valid: 70.13 ± 1.36
  Final Train: 100.00 ± 0.00
   Final Test: 69.53 ± 1.17
[I 2023-06-12 00:16:10,240] Trial 830 finished with value: 70.13333129882812 and parameters: {'Fwd': 4.731067869572362e-06, 'K': 8, 'alpha': 0.55, 'dropout': 0.8, 'gnnepoch': 110, 'lambda1': 0.75, 'lambda2': 5.365567969079995, 'loop': 0, 'loss': 'CE', 'lr': 0.0013589018322549857, 'softmaxF': False, 'useGCN': True, 'weight_decay': 0.01878355960785216, 'weightedloss': True}. Best is trial 605 with value: 72.13333129882812.
/home/wxy/miniconda3/lib/python3.10/site-packages/optuna/distributions.py:685: UserWarning: The distribution is specified by [0, 1.00001] and step=0.05, but the range is not divisible by `step`. It will be replaced by [0, 1.0].
  warnings.warn(
K:  8
alpha:  0.65
lr:  0.00024497637052629323
weight_decay:  1.8849781196407647e-05
dropout:  0.8
fix split and run 3 times
Data: Data(x=[3327, 3703], y=[3327], train_mask=[3327], val_mask=[3327], test_mask=[3327], adj_t=[3327, 3327, nnz=9104])
num_train tensor(120)
num_noise 0
noise: tensor(0)
data feature 3703
ALTOPT(
  (lins): Sequential(
    (0): Linear(in_features=3703, out_features=64, bias=True)
    (1): BatchNorm1d(64, eps=1e-05, momentum=0.1, affine=True, track_running_stats=True)
    (2): Dropout(p=0.8, inplace=True)
    (3): ReLU(inplace=True)
    (4): Linear(in_features=64, out_features=6, bias=True)
    (5): LogSoftmax(dim=-1)
  )
  (prop): Propagation(K=8, mode=None, lambda1=None, lambda2=None, L21=True, alpha=0.65)
  (gcn): GCN(
    (convs): ModuleList(
      (0): GCNConv(3703, 64)
      (1): GCNConv(64, 6)
    )
    (bns): ModuleList(
      (0): BatchNorm1d(64, eps=1e-05, momentum=0.1, affine=True, track_running_stats=True)
    )
    (output): LogSoftmax(dim=-1)
  )
)
propagate done
init label
Split: 01, Run: 01
None time:  2.1512906888965517
None Run 01:
Highest Train: 100.00
Highest Valid: 69.00
  Final Train: 100.00
   Final Test: 68.70
Split: 01, Run: 02
None time:  1.8362150029279292
None Run 02:
Highest Train: 100.00
Highest Valid: 68.80
  Final Train: 100.00
   Final Test: 68.90
Split: 01, Run: 03
None time:  2.1045126270037144
None Run 03:
Highest Train: 100.00
Highest Valid: 70.20
  Final Train: 100.00
   Final Test: 70.60
run time now: 6.165748834609985
total time:  6.245402215979993
None All runs:
Highest Train: 100.00 ± 0.00
Highest Valid: 69.33 ± 0.76
  Final Train: 100.00 ± 0.00
   Final Test: 69.40 ± 1.04
[I 2023-06-12 00:16:17,186] Trial 831 finished with value: 69.33333587646484 and parameters: {'Fwd': 0.002155591023779797, 'K': 8, 'alpha': 0.65, 'dropout': 0.8, 'gnnepoch': 100, 'lambda1': 0.6000000000000001, 'lambda2': 1.9668316574845104, 'loop': 0, 'loss': 'CE', 'lr': 0.00024497637052629323, 'softmaxF': True, 'useGCN': True, 'weight_decay': 1.8849781196407647e-05, 'weightedloss': True}. Best is trial 605 with value: 72.13333129882812.
/home/wxy/miniconda3/lib/python3.10/site-packages/optuna/distributions.py:685: UserWarning: The distribution is specified by [0, 1.00001] and step=0.05, but the range is not divisible by `step`. It will be replaced by [0, 1.0].
  warnings.warn(
K:  8
alpha:  0.8
lr:  0.0014731351484254728
weight_decay:  2.0676160954546555e-06
dropout:  0.8
fix split and run 3 times
Data: Data(x=[3327, 3703], y=[3327], train_mask=[3327], val_mask=[3327], test_mask=[3327], adj_t=[3327, 3327, nnz=9104])
num_train tensor(120)
num_noise 0
noise: tensor(0)
data feature 3703
ALTOPT(
  (lins): Sequential(
    (0): Linear(in_features=3703, out_features=64, bias=True)
    (1): BatchNorm1d(64, eps=1e-05, momentum=0.1, affine=True, track_running_stats=True)
    (2): Dropout(p=0.8, inplace=True)
    (3): ReLU(inplace=True)
    (4): Linear(in_features=64, out_features=6, bias=True)
    (5): LogSoftmax(dim=-1)
  )
  (prop): Propagation(K=8, mode=None, lambda1=None, lambda2=None, L21=True, alpha=0.8)
  (gcn): GCN(
    (convs): ModuleList(
      (0): GCNConv(3703, 64)
      (1): GCNConv(64, 6)
    )
    (bns): ModuleList(
      (0): BatchNorm1d(64, eps=1e-05, momentum=0.1, affine=True, track_running_stats=True)
    )
    (output): LogSoftmax(dim=-1)
  )
)
propagate done
init label
Split: 01, Run: 01
None time:  2.114281593123451
None Run 01:
Highest Train: 100.00
Highest Valid: 71.20
  Final Train: 100.00
   Final Test: 69.50
Split: 01, Run: 02
None time:  2.277828613994643
None Run 02:
Highest Train: 100.00
Highest Valid: 72.00
  Final Train: 100.00
   Final Test: 70.10
Split: 01, Run: 03
None time:  1.8621186579111964
None Run 03:
Highest Train: 100.00
Highest Valid: 71.40
  Final Train: 100.00
   Final Test: 71.10
run time now: 6.307231664657593
total time:  6.352961230091751
None All runs:
Highest Train: 100.00 ± 0.00
Highest Valid: 71.53 ± 0.42
  Final Train: 100.00 ± 0.00
   Final Test: 70.23 ± 0.81
[I 2023-06-12 00:16:24,062] Trial 832 finished with value: 71.53333282470703 and parameters: {'Fwd': 0.0014968776802830339, 'K': 8, 'alpha': 0.8, 'dropout': 0.8, 'gnnepoch': 120, 'lambda1': 0.7000000000000001, 'lambda2': 5.938257709636531, 'loop': 0, 'loss': 'CE', 'lr': 0.0014731351484254728, 'softmaxF': False, 'useGCN': True, 'weight_decay': 2.0676160954546555e-06, 'weightedloss': True}. Best is trial 605 with value: 72.13333129882812.
/home/wxy/miniconda3/lib/python3.10/site-packages/optuna/distributions.py:685: UserWarning: The distribution is specified by [0, 1.00001] and step=0.05, but the range is not divisible by `step`. It will be replaced by [0, 1.0].
  warnings.warn(
K:  8
alpha:  0.8500000000000001
lr:  0.0019446332206412861
weight_decay:  2.9544250465638752e-05
dropout:  0.9
fix split and run 3 times
Data: Data(x=[3327, 3703], y=[3327], train_mask=[3327], val_mask=[3327], test_mask=[3327], adj_t=[3327, 3327, nnz=9104])
num_train tensor(120)
num_noise 0
noise: tensor(0)
data feature 3703
ALTOPT(
  (lins): Sequential(
    (0): Linear(in_features=3703, out_features=64, bias=True)
    (1): BatchNorm1d(64, eps=1e-05, momentum=0.1, affine=True, track_running_stats=True)
    (2): Dropout(p=0.9, inplace=True)
    (3): ReLU(inplace=True)
    (4): Linear(in_features=64, out_features=6, bias=True)
    (5): LogSoftmax(dim=-1)
  )
  (prop): Propagation(K=8, mode=None, lambda1=None, lambda2=None, L21=True, alpha=0.8500000000000001)
  (gcn): GCN(
    (convs): ModuleList(
      (0): GCNConv(3703, 64)
      (1): GCNConv(64, 6)
    )
    (bns): ModuleList(
      (0): BatchNorm1d(64, eps=1e-05, momentum=0.1, affine=True, track_running_stats=True)
    )
    (output): LogSoftmax(dim=-1)
  )
)
propagate done
init label
Split: 01, Run: 01
None time:  2.49348785309121
None Run 01:
Highest Train: 100.00
Highest Valid: 70.60
  Final Train: 100.00
   Final Test: 69.30
Split: 01, Run: 02
None time:  2.405122925993055
None Run 02:
Highest Train: 100.00
Highest Valid: 71.80
  Final Train: 100.00
   Final Test: 70.30
Split: 01, Run: 03
None time:  2.1330407618079334
None Run 03:
Highest Train: 100.00
Highest Valid: 71.80
  Final Train: 100.00
   Final Test: 70.10
run time now: 7.081900596618652
total time:  7.145796928089112
None All runs:
Highest Train: 100.00 ± 0.00
Highest Valid: 71.40 ± 0.69
  Final Train: 100.00 ± 0.00
   Final Test: 69.90 ± 0.53
[I 2023-06-12 00:16:31,771] Trial 833 finished with value: 71.4000015258789 and parameters: {'Fwd': 0.019574036882176963, 'K': 8, 'alpha': 0.8500000000000001, 'dropout': 0.9, 'gnnepoch': 120, 'lambda1': 0.45, 'lambda2': 6.488382267646965, 'loop': 0, 'loss': 'CE', 'lr': 0.0019446332206412861, 'softmaxF': False, 'useGCN': True, 'weight_decay': 2.9544250465638752e-05, 'weightedloss': True}. Best is trial 605 with value: 72.13333129882812.
/home/wxy/miniconda3/lib/python3.10/site-packages/optuna/distributions.py:685: UserWarning: The distribution is specified by [0, 1.00001] and step=0.05, but the range is not divisible by `step`. It will be replaced by [0, 1.0].
  warnings.warn(
K:  8
alpha:  0.45
lr:  0.007086938579324285
weight_decay:  0.002742830277359332
dropout:  0.7000000000000001
fix split and run 3 times
Data: Data(x=[3327, 3703], y=[3327], train_mask=[3327], val_mask=[3327], test_mask=[3327], adj_t=[3327, 3327, nnz=9104])
num_train tensor(120)
num_noise 0
noise: tensor(0)
data feature 3703
ALTOPT(
  (lins): Sequential(
    (0): Linear(in_features=3703, out_features=64, bias=True)
    (1): BatchNorm1d(64, eps=1e-05, momentum=0.1, affine=True, track_running_stats=True)
    (2): Dropout(p=0.7000000000000001, inplace=True)
    (3): ReLU(inplace=True)
    (4): Linear(in_features=64, out_features=6, bias=True)
    (5): LogSoftmax(dim=-1)
  )
  (prop): Propagation(K=8, mode=None, lambda1=None, lambda2=None, L21=True, alpha=0.45)
  (gcn): GCN(
    (convs): ModuleList(
      (0): GCNConv(3703, 64)
      (1): GCNConv(64, 6)
    )
    (bns): ModuleList(
      (0): BatchNorm1d(64, eps=1e-05, momentum=0.1, affine=True, track_running_stats=True)
    )
    (output): LogSoftmax(dim=-1)
  )
)
propagate done
init label
Split: 01, Run: 01, Epoch: 100, Loss: 0.0000, Train: 99.17%, Valid: 69.40% Test: 69.30%
Split: 01, Run: 01
None time:  4.540190411033109
None Run 01:
Highest Train: 100.00
Highest Valid: 69.40
  Final Train: 99.17
   Final Test: 69.30
Split: 01, Run: 02
None time:  2.37185493693687
None Run 02:
Highest Train: 100.00
Highest Valid: 69.40
  Final Train: 99.17
   Final Test: 69.30
Split: 01, Run: 03, Epoch: 100, Loss: 0.0000, Train: 100.00%, Valid: 67.80% Test: 68.60%
Split: 01, Run: 03
None time:  4.1184772229753435
None Run 03:
Highest Train: 100.00
Highest Valid: 67.80
  Final Train: 100.00
   Final Test: 68.20
run time now: 11.080238342285156
total time:  11.136933909030631
None All runs:
Highest Train: 100.00 ± 0.00
Highest Valid: 68.87 ± 0.92
  Final Train: 99.44 ± 0.48
   Final Test: 68.93 ± 0.64
[I 2023-06-12 00:16:43,551] Trial 834 finished with value: 68.86666870117188 and parameters: {'Fwd': 0.07700801769974228, 'K': 8, 'alpha': 0.45, 'dropout': 0.7000000000000001, 'gnnepoch': 120, 'lambda1': 0.8, 'lambda2': 4.085742092797359, 'loop': 0, 'loss': 'CE', 'lr': 0.007086938579324285, 'softmaxF': False, 'useGCN': True, 'weight_decay': 0.002742830277359332, 'weightedloss': True}. Best is trial 605 with value: 72.13333129882812.
/home/wxy/miniconda3/lib/python3.10/site-packages/optuna/distributions.py:685: UserWarning: The distribution is specified by [0, 1.00001] and step=0.05, but the range is not divisible by `step`. It will be replaced by [0, 1.0].
  warnings.warn(
K:  6
alpha:  0.5
lr:  0.00029232890115880796
weight_decay:  9.832880064789281e-06
dropout:  0.8
fix split and run 3 times
Data: Data(x=[3327, 3703], y=[3327], train_mask=[3327], val_mask=[3327], test_mask=[3327], adj_t=[3327, 3327, nnz=9104])
num_train tensor(120)
num_noise 0
noise: tensor(0)
data feature 3703
ALTOPT(
  (lins): Sequential(
    (0): Linear(in_features=3703, out_features=64, bias=True)
    (1): BatchNorm1d(64, eps=1e-05, momentum=0.1, affine=True, track_running_stats=True)
    (2): Dropout(p=0.8, inplace=True)
    (3): ReLU(inplace=True)
    (4): Linear(in_features=64, out_features=6, bias=True)
    (5): LogSoftmax(dim=-1)
  )
  (prop): Propagation(K=6, mode=None, lambda1=None, lambda2=None, L21=True, alpha=0.5)
  (gcn): GCN(
    (convs): ModuleList(
      (0): GCNConv(3703, 64)
      (1): GCNConv(64, 6)
    )
    (bns): ModuleList(
      (0): BatchNorm1d(64, eps=1e-05, momentum=0.1, affine=True, track_running_stats=True)
    )
    (output): LogSoftmax(dim=-1)
  )
)
propagate done
init label
Split: 01, Run: 01
None time:  2.186491817003116
None Run 01:
Highest Train: 100.00
Highest Valid: 69.80
  Final Train: 100.00
   Final Test: 69.20
Split: 01, Run: 02
None time:  2.011373896850273
None Run 02:
Highest Train: 100.00
Highest Valid: 68.00
  Final Train: 100.00
   Final Test: 68.10
Split: 01, Run: 03
None time:  2.167216036003083
None Run 03:
Highest Train: 100.00
Highest Valid: 68.00
  Final Train: 100.00
   Final Test: 68.20
run time now: 6.4136457443237305
total time:  6.466254765866324
None All runs:
Highest Train: 100.00 ± 0.00
Highest Valid: 68.60 ± 1.04
  Final Train: 100.00 ± 0.00
   Final Test: 68.50 ± 0.61
