[I 2023-06-12 00:15:09,168] Trial 26 finished with value: 78.66666412353516 and parameters: {'Fwd': 0.009524139010647538, 'K': 3, 'alpha': 0.9, 'dropout': 0.8, 'gnnepoch': 90, 'lambda1': 0.05, 'lambda2': 8.888183807522843, 'loop': 1, 'loss': 'MSE', 'lr': 0.005470092171174219, 'softmaxF': False, 'useGCN': True, 'weight_decay': 0.0002219793174723349, 'weightedloss': True}. Best is trial 18 with value: 80.0.
/home/wxy/miniconda3/lib/python3.10/site-packages/optuna/distributions.py:685: UserWarning: The distribution is specified by [0, 1.00001] and step=0.05, but the range is not divisible by `step`. It will be replaced by [0, 1.0].
  warnings.warn(
K:  5
alpha:  0.65
lr:  0.009321535058271052
weight_decay:  0.0009165988813407688
dropout:  0.6000000000000001
fix split and run 3 times
Data: Data(x=[2708, 1433], y=[2708], train_mask=[2708], val_mask=[2708], test_mask=[2708], adj_t=[2708, 2708, nnz=10556])
num_train tensor(140)
num_noise 0
noise: tensor(0)
data feature 1433
ALTOPT(
  (lins): Sequential(
    (0): Linear(in_features=1433, out_features=64, bias=True)
    (1): BatchNorm1d(64, eps=1e-05, momentum=0.1, affine=True, track_running_stats=True)
    (2): Dropout(p=0.6000000000000001, inplace=True)
    (3): ReLU(inplace=True)
    (4): Linear(in_features=64, out_features=7, bias=True)
    (5): Identity()
  )
  (prop): Propagation(K=5, mode=None, lambda1=None, lambda2=None, L21=True, alpha=0.65)
  (gcn): GCN(
    (convs): ModuleList(
      (0): GCNConv(1433, 64)
      (1): GCNConv(64, 7)
    )
    (bns): ModuleList(
      (0): BatchNorm1d(64, eps=1e-05, momentum=0.1, affine=True, track_running_stats=True)
    )
    (output): Identity()
  )
)
propagate done
init label
Split: 01, Run: 01
None time:  1.4240617949981242
None Run 01:
Highest Train: 100.00
Highest Valid: 79.20
  Final Train: 100.00
   Final Test: 80.40
Split: 01, Run: 02
None time:  1.4802816950250417
None Run 02:
Highest Train: 100.00
Highest Valid: 78.60
  Final Train: 100.00
   Final Test: 78.80
Split: 01, Run: 03
None time:  1.7027297888416797
None Run 03:
Highest Train: 100.00
Highest Valid: 79.00
  Final Train: 100.00
   Final Test: 79.30
run time now: 4.633464336395264
total time:  4.662790103117004
None All runs:
Highest Train: 100.00 ± 0.00
Highest Valid: 78.93 ± 0.31
  Final Train: 100.00 ± 0.00
   Final Test: 79.50 ± 0.82
[I 2023-06-12 00:15:14,393] Trial 27 finished with value: 78.9333267211914 and parameters: {'Fwd': 0.03589314306956134, 'K': 5, 'alpha': 0.65, 'dropout': 0.6000000000000001, 'gnnepoch': 60, 'lambda1': 0.1, 'lambda2': 8.21611157789311, 'loop': 1, 'loss': 'MSE', 'lr': 0.009321535058271052, 'softmaxF': False, 'useGCN': True, 'weight_decay': 0.0009165988813407688, 'weightedloss': True}. Best is trial 18 with value: 80.0.
/home/wxy/miniconda3/lib/python3.10/site-packages/optuna/distributions.py:685: UserWarning: The distribution is specified by [0, 1.00001] and step=0.05, but the range is not divisible by `step`. It will be replaced by [0, 1.0].
  warnings.warn(
K:  3
alpha:  0.8
lr:  0.0035895781810534218
weight_decay:  0.0057312997906919065
dropout:  0.7000000000000001
fix split and run 3 times
Data: Data(x=[2708, 1433], y=[2708], train_mask=[2708], val_mask=[2708], test_mask=[2708], adj_t=[2708, 2708, nnz=10556])
num_train tensor(140)
num_noise 0
noise: tensor(0)
data feature 1433
ALTOPT(
  (lins): Sequential(
    (0): Linear(in_features=1433, out_features=64, bias=True)
    (1): BatchNorm1d(64, eps=1e-05, momentum=0.1, affine=True, track_running_stats=True)
    (2): Dropout(p=0.7000000000000001, inplace=True)
    (3): ReLU(inplace=True)
    (4): Linear(in_features=64, out_features=7, bias=True)
    (5): Identity()
  )
  (prop): Propagation(K=3, mode=None, lambda1=None, lambda2=None, L21=True, alpha=0.8)
  (gcn): GCN(
    (convs): ModuleList(
      (0): GCNConv(1433, 64)
      (1): GCNConv(64, 7)
    )
    (bns): ModuleList(
      (0): BatchNorm1d(64, eps=1e-05, momentum=0.1, affine=True, track_running_stats=True)
    )
    (output): Identity()
  )
)
propagate done
init label
Split: 01, Run: 01, Epoch: 100, Loss: 0.0000, Train: 100.00%, Valid: 78.80% Test: 79.90%
Split: 01, Run: 01
None time:  2.214274909114465
None Run 01:
Highest Train: 100.00
Highest Valid: 78.80
  Final Train: 100.00
   Final Test: 79.90
Split: 01, Run: 02
None time:  0.927738729165867
None Run 02:
Highest Train: 100.00
Highest Valid: 78.00
  Final Train: 100.00
   Final Test: 79.10
Split: 01, Run: 03
None time:  0.6797498359810561
None Run 03:
Highest Train: 100.00
Highest Valid: 79.00
  Final Train: 100.00
   Final Test: 79.30
run time now: 3.8464696407318115
total time:  3.867889877874404
None All runs:
Highest Train: 100.00 ± 0.00
Highest Valid: 78.60 ± 0.53
  Final Train: 100.00 ± 0.00
   Final Test: 79.43 ± 0.42
[I 2023-06-12 00:15:18,847] Trial 28 finished with value: 78.5999984741211 and parameters: {'Fwd': 0.0062386899131802965, 'K': 3, 'alpha': 0.8, 'dropout': 0.7000000000000001, 'gnnepoch': 40, 'lambda1': 0.75, 'lambda2': 9.319707178084265, 'loop': 0, 'loss': 'MSE', 'lr': 0.0035895781810534218, 'softmaxF': False, 'useGCN': True, 'weight_decay': 0.0057312997906919065, 'weightedloss': True}. Best is trial 18 with value: 80.0.
/home/wxy/miniconda3/lib/python3.10/site-packages/optuna/distributions.py:685: UserWarning: The distribution is specified by [0, 1.00001] and step=0.05, but the range is not divisible by `step`. It will be replaced by [0, 1.0].
  warnings.warn(
K:  7
alpha:  1.0
lr:  0.0064507806026364535
weight_decay:  0.022983753190601176
dropout:  0.9
fix split and run 3 times
Data: Data(x=[2708, 1433], y=[2708], train_mask=[2708], val_mask=[2708], test_mask=[2708], adj_t=[2708, 2708, nnz=10556])
num_train tensor(140)
num_noise 0
noise: tensor(0)
data feature 1433
ALTOPT(
  (lins): Sequential(
    (0): Linear(in_features=1433, out_features=64, bias=True)
    (1): BatchNorm1d(64, eps=1e-05, momentum=0.1, affine=True, track_running_stats=True)
    (2): Dropout(p=0.9, inplace=True)
    (3): ReLU(inplace=True)
    (4): Linear(in_features=64, out_features=7, bias=True)
    (5): Identity()
  )
  (prop): Propagation(K=7, mode=None, lambda1=None, lambda2=None, L21=True, alpha=1.0)
  (gcn): GCN(
    (convs): ModuleList(
      (0): GCNConv(1433, 64)
      (1): GCNConv(64, 7)
    )
    (bns): ModuleList(
      (0): BatchNorm1d(64, eps=1e-05, momentum=0.1, affine=True, track_running_stats=True)
    )
    (output): Identity()
  )
)
propagate done
init label
Split: 01, Run: 01, Epoch: 100, Loss: 0.0000, Train: 100.00%, Valid: 79.40% Test: 82.20%
Split: 01, Run: 01
None time:  3.9446454669814557
None Run 01:
Highest Train: 100.00
Highest Valid: 79.40
  Final Train: 100.00
   Final Test: 81.30
Split: 01, Run: 02, Epoch: 100, Loss: 0.0000, Train: 100.00%, Valid: 79.00% Test: 80.00%
Split: 01, Run: 02
None time:  3.8710955299902707
None Run 02:
Highest Train: 100.00
Highest Valid: 79.00
  Final Train: 100.00
   Final Test: 79.60
Split: 01, Run: 03, Epoch: 100, Loss: 0.0000, Train: 100.00%, Valid: 79.20% Test: 80.90%
Split: 01, Run: 03
None time:  3.822037070058286
None Run 03:
Highest Train: 100.00
Highest Valid: 79.20
  Final Train: 100.00
   Final Test: 80.90
run time now: 11.674805402755737
total time:  11.729665682883933
None All runs:
Highest Train: 100.00 ± 0.00
Highest Valid: 79.20 ± 0.20
  Final Train: 100.00 ± 0.00
   Final Test: 80.60 ± 0.89
[I 2023-06-12 00:15:31,075] Trial 29 finished with value: 79.19999694824219 and parameters: {'Fwd': 0.004703439271523021, 'K': 7, 'alpha': 1.0, 'dropout': 0.9, 'gnnepoch': 100, 'lambda1': 0.35000000000000003, 'lambda2': 7.1688580000687505, 'loop': 0, 'loss': 'MSE', 'lr': 0.0064507806026364535, 'softmaxF': False, 'useGCN': True, 'weight_decay': 0.022983753190601176, 'weightedloss': False}. Best is trial 18 with value: 80.0.
/home/wxy/miniconda3/lib/python3.10/site-packages/optuna/distributions.py:685: UserWarning: The distribution is specified by [0, 1.00001] and step=0.05, but the range is not divisible by `step`. It will be replaced by [0, 1.0].
  warnings.warn(
K:  4
alpha:  0.55
lr:  0.00486067922070782
weight_decay:  0.0013733615458254647
dropout:  0.30000000000000004
fix split and run 3 times
Data: Data(x=[2708, 1433], y=[2708], train_mask=[2708], val_mask=[2708], test_mask=[2708], adj_t=[2708, 2708, nnz=10556])
num_train tensor(140)
num_noise 0
noise: tensor(0)
data feature 1433
ALTOPT(
  (lins): Sequential(
    (0): Linear(in_features=1433, out_features=64, bias=True)
    (1): BatchNorm1d(64, eps=1e-05, momentum=0.1, affine=True, track_running_stats=True)
    (2): Dropout(p=0.30000000000000004, inplace=True)
    (3): ReLU(inplace=True)
    (4): Linear(in_features=64, out_features=7, bias=True)
    (5): Identity()
  )
  (prop): Propagation(K=4, mode=None, lambda1=None, lambda2=None, L21=True, alpha=0.55)
  (gcn): GCN(
    (convs): ModuleList(
      (0): GCNConv(1433, 64)
      (1): GCNConv(64, 7)
    )
    (bns): ModuleList(
      (0): BatchNorm1d(64, eps=1e-05, momentum=0.1, affine=True, track_running_stats=True)
    )
    (output): Identity()
  )
)
propagate done
init label
Split: 01, Run: 01
None time:  1.8594390219077468
None Run 01:
Highest Train: 100.00
Highest Valid: 80.60
  Final Train: 100.00
   Final Test: 80.00
Split: 01, Run: 02
None time:  1.6884769150055945
None Run 02:
Highest Train: 100.00
Highest Valid: 79.40
  Final Train: 100.00
   Final Test: 80.00
Split: 01, Run: 03
None time:  1.4054956948384643
None Run 03:
Highest Train: 100.00
Highest Valid: 79.20
  Final Train: 100.00
   Final Test: 79.30
run time now: 4.979680061340332
total time:  5.003473505144939
None All runs:
Highest Train: 100.00 ± 0.00
Highest Valid: 79.73 ± 0.76
  Final Train: 100.00 ± 0.00
   Final Test: 79.77 ± 0.40
[I 2023-06-12 00:15:36,566] Trial 30 finished with value: 79.73332977294922 and parameters: {'Fwd': 0.014980060070577828, 'K': 4, 'alpha': 0.55, 'dropout': 0.30000000000000004, 'gnnepoch': 70, 'lambda1': 0.15000000000000002, 'lambda2': 8.08909875106204, 'loop': 1, 'loss': 'MSE', 'lr': 0.00486067922070782, 'softmaxF': False, 'useGCN': True, 'weight_decay': 0.0013733615458254647, 'weightedloss': True}. Best is trial 18 with value: 80.0.
/home/wxy/miniconda3/lib/python3.10/site-packages/optuna/distributions.py:685: UserWarning: The distribution is specified by [0, 1.00001] and step=0.05, but the range is not divisible by `step`. It will be replaced by [0, 1.0].
  warnings.warn(
K:  4
alpha:  0.5
lr:  0.004649060625438121
weight_decay:  0.001375598520572717
dropout:  0.30000000000000004
fix split and run 3 times
Data: Data(x=[2708, 1433], y=[2708], train_mask=[2708], val_mask=[2708], test_mask=[2708], adj_t=[2708, 2708, nnz=10556])
num_train tensor(140)
num_noise 0
noise: tensor(0)
data feature 1433
ALTOPT(
  (lins): Sequential(
    (0): Linear(in_features=1433, out_features=64, bias=True)
    (1): BatchNorm1d(64, eps=1e-05, momentum=0.1, affine=True, track_running_stats=True)
    (2): Dropout(p=0.30000000000000004, inplace=True)
    (3): ReLU(inplace=True)
    (4): Linear(in_features=64, out_features=7, bias=True)
    (5): Identity()
  )
  (prop): Propagation(K=4, mode=None, lambda1=None, lambda2=None, L21=True, alpha=0.5)
  (gcn): GCN(
    (convs): ModuleList(
      (0): GCNConv(1433, 64)
      (1): GCNConv(64, 7)
    )
    (bns): ModuleList(
      (0): BatchNorm1d(64, eps=1e-05, momentum=0.1, affine=True, track_running_stats=True)
    )
    (output): Identity()
  )
)
propagate done
init label
Split: 01, Run: 01
None time:  1.9174437311012298
None Run 01:
Highest Train: 100.00
Highest Valid: 80.60
  Final Train: 100.00
   Final Test: 79.80
Split: 01, Run: 02
None time:  2.071241762023419
None Run 02:
Highest Train: 100.00
Highest Valid: 80.40
  Final Train: 100.00
   Final Test: 80.50
Split: 01, Run: 03
None time:  1.525602402864024
None Run 03:
Highest Train: 100.00
Highest Valid: 79.80
  Final Train: 100.00
   Final Test: 80.10
run time now: 5.563336133956909
total time:  5.580261254915968
None All runs:
Highest Train: 100.00 ± 0.00
Highest Valid: 80.27 ± 0.42
  Final Train: 100.00 ± 0.00
   Final Test: 80.13 ± 0.35
[I 2023-06-12 00:15:42,682] Trial 31 finished with value: 80.26666259765625 and parameters: {'Fwd': 0.016684094636973727, 'K': 4, 'alpha': 0.5, 'dropout': 0.30000000000000004, 'gnnepoch': 70, 'lambda1': 0.15000000000000002, 'lambda2': 6.313851107255334, 'loop': 1, 'loss': 'MSE', 'lr': 0.004649060625438121, 'softmaxF': False, 'useGCN': True, 'weight_decay': 0.001375598520572717, 'weightedloss': True}. Best is trial 31 with value: 80.26666259765625.
/home/wxy/miniconda3/lib/python3.10/site-packages/optuna/distributions.py:685: UserWarning: The distribution is specified by [0, 1.00001] and step=0.05, but the range is not divisible by `step`. It will be replaced by [0, 1.0].
  warnings.warn(
K:  5
alpha:  0.5
lr:  0.00316312189023025
weight_decay:  0.002938414856352678
dropout:  0.0
fix split and run 3 times
Data: Data(x=[2708, 1433], y=[2708], train_mask=[2708], val_mask=[2708], test_mask=[2708], adj_t=[2708, 2708, nnz=10556])
num_train tensor(140)
num_noise 0
noise: tensor(0)
data feature 1433
ALTOPT(
  (lins): Sequential(
    (0): Linear(in_features=1433, out_features=64, bias=True)
    (1): BatchNorm1d(64, eps=1e-05, momentum=0.1, affine=True, track_running_stats=True)
    (2): Dropout(p=0.0, inplace=True)
    (3): ReLU(inplace=True)
    (4): Linear(in_features=64, out_features=7, bias=True)
    (5): Identity()
  )
  (prop): Propagation(K=5, mode=None, lambda1=None, lambda2=None, L21=True, alpha=0.5)
  (gcn): GCN(
    (convs): ModuleList(
      (0): GCNConv(1433, 64)
      (1): GCNConv(64, 7)
    )
    (bns): ModuleList(
      (0): BatchNorm1d(64, eps=1e-05, momentum=0.1, affine=True, track_running_stats=True)
    )
    (output): Identity()
  )
)
propagate done
init label
Split: 01, Run: 01, Epoch: 100, Loss: 0.0798, Train: 100.00%, Valid: 72.60% Test: 73.20%
Split: 01, Run: 01
None time:  4.483139849035069
None Run 01:
Highest Train: 100.00
Highest Valid: 72.60
  Final Train: 100.00
   Final Test: 73.20
Split: 01, Run: 02, Epoch: 100, Loss: 0.0843, Train: 100.00%, Valid: 72.60% Test: 73.20%
Split: 01, Run: 02
None time:  4.145672036102042
None Run 02:
Highest Train: 100.00
Highest Valid: 72.60
  Final Train: 100.00
   Final Test: 73.20
Split: 01, Run: 03, Epoch: 100, Loss: 0.0825, Train: 100.00%, Valid: 72.60% Test: 73.20%
Split: 01, Run: 03
None time:  4.451255560154095
None Run 03:
Highest Train: 100.00
Highest Valid: 72.60
  Final Train: 100.00
   Final Test: 73.20
run time now: 13.156989812850952
total time:  13.17601071903482
None All runs:
Highest Train: 100.00 ± 0.00
Highest Valid: 72.60 ± 0.00
  Final Train: 100.00 ± 0.00
   Final Test: 73.20 ± 0.00
[I 2023-06-12 00:15:56,372] Trial 32 finished with value: 72.5999984741211 and parameters: {'Fwd': 0.04920621536062976, 'K': 5, 'alpha': 0.5, 'dropout': 0.0, 'gnnepoch': 50, 'lambda1': 0.0, 'lambda2': 6.474623688133938, 'loop': 1, 'loss': 'MSE', 'lr': 0.00316312189023025, 'softmaxF': False, 'useGCN': True, 'weight_decay': 0.002938414856352678, 'weightedloss': True}. Best is trial 31 with value: 80.26666259765625.
/home/wxy/miniconda3/lib/python3.10/site-packages/optuna/distributions.py:685: UserWarning: The distribution is specified by [0, 1.00001] and step=0.05, but the range is not divisible by `step`. It will be replaced by [0, 1.0].
  warnings.warn(
K:  2
alpha:  0.65
lr:  0.007100490756434099
weight_decay:  0.0006588261876526263
dropout:  0.30000000000000004
fix split and run 3 times
Data: Data(x=[2708, 1433], y=[2708], train_mask=[2708], val_mask=[2708], test_mask=[2708], adj_t=[2708, 2708, nnz=10556])
num_train tensor(140)
num_noise 0
noise: tensor(0)
data feature 1433
ALTOPT(
  (lins): Sequential(
    (0): Linear(in_features=1433, out_features=64, bias=True)
    (1): BatchNorm1d(64, eps=1e-05, momentum=0.1, affine=True, track_running_stats=True)
    (2): Dropout(p=0.30000000000000004, inplace=True)
    (3): ReLU(inplace=True)
    (4): Linear(in_features=64, out_features=7, bias=True)
    (5): Identity()
  )
  (prop): Propagation(K=2, mode=None, lambda1=None, lambda2=None, L21=True, alpha=0.65)
  (gcn): GCN(
    (convs): ModuleList(
      (0): GCNConv(1433, 64)
      (1): GCNConv(64, 7)
    )
    (bns): ModuleList(
      (0): BatchNorm1d(64, eps=1e-05, momentum=0.1, affine=True, track_running_stats=True)
    )
    (output): Identity()
  )
)
propagate done
init label
Split: 01, Run: 01
None time:  1.9565743969287723
None Run 01:
Highest Train: 100.00
Highest Valid: 77.60
  Final Train: 100.00
   Final Test: 78.30
Split: 01, Run: 02
None time:  2.2306593500543386
None Run 02:
Highest Train: 100.00
Highest Valid: 80.60
  Final Train: 100.00
   Final Test: 78.20
Split: 01, Run: 03
None time:  1.8779450540896505
None Run 03:
Highest Train: 100.00
Highest Valid: 80.20
  Final Train: 100.00
   Final Test: 78.30
run time now: 6.089049816131592
total time:  6.114930031821132
None All runs:
Highest Train: 100.00 ± 0.00
Highest Valid: 79.47 ± 1.63
  Final Train: 100.00 ± 0.00
   Final Test: 78.27 ± 0.06
[I 2023-06-12 00:16:03,011] Trial 33 finished with value: 79.46666717529297 and parameters: {'Fwd': 0.018472107946628288, 'K': 2, 'alpha': 0.65, 'dropout': 0.30000000000000004, 'gnnepoch': 80, 'lambda1': 0.2, 'lambda2': 9.888059938726569, 'loop': 1, 'loss': 'MSE', 'lr': 0.007100490756434099, 'softmaxF': False, 'useGCN': True, 'weight_decay': 0.0006588261876526263, 'weightedloss': True}. Best is trial 31 with value: 80.26666259765625.
/home/wxy/miniconda3/lib/python3.10/site-packages/optuna/distributions.py:685: UserWarning: The distribution is specified by [0, 1.00001] and step=0.05, but the range is not divisible by `step`. It will be replaced by [0, 1.0].
  warnings.warn(
K:  6
alpha:  0.25
lr:  0.004547538693886174
weight_decay:  0.000164854047994937
dropout:  0.30000000000000004
fix split and run 3 times
Data: Data(x=[2708, 1433], y=[2708], train_mask=[2708], val_mask=[2708], test_mask=[2708], adj_t=[2708, 2708, nnz=10556])
num_train tensor(140)
num_noise 0
noise: tensor(0)
data feature 1433
ALTOPT(
  (lins): Sequential(
    (0): Linear(in_features=1433, out_features=64, bias=True)
    (1): BatchNorm1d(64, eps=1e-05, momentum=0.1, affine=True, track_running_stats=True)
    (2): Dropout(p=0.30000000000000004, inplace=True)
    (3): ReLU(inplace=True)
    (4): Linear(in_features=64, out_features=7, bias=True)
    (5): Identity()
  )
  (prop): Propagation(K=6, mode=None, lambda1=None, lambda2=None, L21=True, alpha=0.25)
  (gcn): GCN(
    (convs): ModuleList(
      (0): GCNConv(1433, 64)
      (1): GCNConv(64, 7)
    )
    (bns): ModuleList(
      (0): BatchNorm1d(64, eps=1e-05, momentum=0.1, affine=True, track_running_stats=True)
    )
    (output): Identity()
  )
)
propagate done
init label
Split: 01, Run: 01
None time:  3.2449978759977967
None Run 01:
Highest Train: 100.00
Highest Valid: 79.00
  Final Train: 100.00
   Final Test: 80.10
Split: 01, Run: 02
None time:  1.7948432511184365
None Run 02:
Highest Train: 100.00
Highest Valid: 78.60
  Final Train: 100.00
   Final Test: 80.60
Split: 01, Run: 03
None time:  1.654751606984064
None Run 03:
Highest Train: 100.00
Highest Valid: 79.20
  Final Train: 100.00
   Final Test: 80.20
run time now: 6.720288276672363
total time:  6.7393906489014626
None All runs:
Highest Train: 100.00 ± 0.00
Highest Valid: 78.93 ± 0.31
  Final Train: 100.00 ± 0.00
   Final Test: 80.30 ± 0.26
[I 2023-06-12 00:16:10,293] Trial 34 finished with value: 78.93333435058594 and parameters: {'Fwd': 0.05090911208527778, 'K': 6, 'alpha': 0.25, 'dropout': 0.30000000000000004, 'gnnepoch': 60, 'lambda1': 0.05, 'lambda2': 9.206291048353435, 'loop': 1, 'loss': 'MSE', 'lr': 0.004547538693886174, 'softmaxF': False, 'useGCN': True, 'weight_decay': 0.000164854047994937, 'weightedloss': False}. Best is trial 31 with value: 80.26666259765625.
/home/wxy/miniconda3/lib/python3.10/site-packages/optuna/distributions.py:685: UserWarning: The distribution is specified by [0, 1.00001] and step=0.05, but the range is not divisible by `step`. It will be replaced by [0, 1.0].
  warnings.warn(
K:  3
alpha:  0.75
lr:  0.009871690091029933
weight_decay:  0.0005061521351028191
dropout:  0.2
fix split and run 3 times
Data: Data(x=[2708, 1433], y=[2708], train_mask=[2708], val_mask=[2708], test_mask=[2708], adj_t=[2708, 2708, nnz=10556])
num_train tensor(140)
num_noise 0
noise: tensor(0)
data feature 1433
ALTOPT(
  (lins): Sequential(
    (0): Linear(in_features=1433, out_features=64, bias=True)
    (1): BatchNorm1d(64, eps=1e-05, momentum=0.1, affine=True, track_running_stats=True)
    (2): Dropout(p=0.2, inplace=True)
    (3): ReLU(inplace=True)
    (4): Linear(in_features=64, out_features=7, bias=True)
    (5): Identity()
  )
  (prop): Propagation(K=3, mode=None, lambda1=None, lambda2=None, L21=True, alpha=0.75)
  (gcn): GCN(
    (convs): ModuleList(
      (0): GCNConv(1433, 64)
      (1): GCNConv(64, 7)
    )
    (bns): ModuleList(
      (0): BatchNorm1d(64, eps=1e-05, momentum=0.1, affine=True, track_running_stats=True)
    )
    (output): Identity()
  )
)
propagate done
init label
Split: 01, Run: 01, Epoch: 100, Loss: 0.0691, Train: 100.00%, Valid: 72.60% Test: 73.20%
Split: 01, Run: 01
None time:  3.997598585905507
None Run 01:
Highest Train: 100.00
Highest Valid: 72.60
  Final Train: 100.00
   Final Test: 73.20
Split: 01, Run: 02, Epoch: 100, Loss: 0.0700, Train: 100.00%, Valid: 72.60% Test: 73.20%
Split: 01, Run: 02
None time:  3.9101105539593846
None Run 02:
Highest Train: 100.00
Highest Valid: 72.60
  Final Train: 100.00
   Final Test: 73.20
Split: 01, Run: 03, Epoch: 100, Loss: 0.0818, Train: 100.00%, Valid: 72.60% Test: 73.20%
Split: 01, Run: 03
None time:  3.9559919969178736
None Run 03:
Highest Train: 100.00
Highest Valid: 72.60
  Final Train: 100.00
   Final Test: 73.20
run time now: 11.88460397720337
total time:  11.918189845979214
None All runs:
Highest Train: 100.00 ± 0.00
Highest Valid: 72.60 ± 0.00
  Final Train: 100.00 ± 0.00
   Final Test: 73.20 ± 0.00
