[I 2023-06-12 00:16:56,500] Trial 53 finished with value: 81.13333129882812 and parameters: {'Fwd': 2.8684027233368724e-06, 'K': 6, 'alpha': 0.9, 'dropout': 0.2, 'gnnepoch': 60, 'lambda1': 0.25, 'lambda2': 7.415622172024742, 'loop': 1, 'loss': 'MSE', 'lr': 0.0012284601313462516, 'softmaxF': True, 'useGCN': False, 'weight_decay': 0.0003220410725438849, 'weightedloss': False}. Best is trial 48 with value: 81.53333282470703.
/home/wxy/miniconda3/lib/python3.10/site-packages/optuna/distributions.py:685: UserWarning: The distribution is specified by [0, 1.00001] and step=0.05, but the range is not divisible by `step`. It will be replaced by [0, 1.0].
  warnings.warn(
K:  5
alpha:  0.9
lr:  0.0012333238123417585
weight_decay:  0.0002637032755520611
dropout:  0.1
fix split and run 3 times
Data: Data(x=[19717, 500], y=[19717], train_mask=[19717], val_mask=[19717], test_mask=[19717], adj_t=[19717, 19717, nnz=88648])
num_train tensor(60)
num_noise 0
noise: tensor(0)
data feature 500
ALTOPT(
  (lins): Sequential(
    (0): Linear(in_features=500, out_features=64, bias=True)
    (1): BatchNorm1d(64, eps=1e-05, momentum=0.1, affine=True, track_running_stats=True)
    (2): Dropout(p=0.1, inplace=True)
    (3): ReLU(inplace=True)
    (4): Linear(in_features=64, out_features=3, bias=True)
    (5): Identity()
  )
  (prop): Propagation(K=5, mode=None, lambda1=None, lambda2=None, L21=True, alpha=0.9)
  (gcn): GCN(
    (convs): ModuleList(
      (0): GCNConv(500, 64)
      (1): GCNConv(64, 3)
    )
    (bns): ModuleList(
      (0): BatchNorm1d(64, eps=1e-05, momentum=0.1, affine=True, track_running_stats=True)
    )
    (output): Identity()
  )
)
propagate done
init label
Split: 01, Run: 01
None time:  2.411168470978737
None Run 01:
Highest Train: 100.00
Highest Valid: 81.00
  Final Train: 100.00
   Final Test: 77.50
Split: 01, Run: 02
None time:  1.0340795579832047
None Run 02:
Highest Train: 100.00
Highest Valid: 81.00
  Final Train: 100.00
   Final Test: 78.40
Split: 01, Run: 03
None time:  1.603618772001937
None Run 03:
Highest Train: 100.00
Highest Valid: 84.20
  Final Train: 100.00
   Final Test: 79.60
run time now: 5.095972299575806
total time:  5.146392566850409
None All runs:
Highest Train: 100.00 ± 0.00
Highest Valid: 82.07 ± 1.85
  Final Train: 100.00 ± 0.00
   Final Test: 78.50 ± 1.05
[I 2023-06-12 00:17:02,079] Trial 54 finished with value: 82.06666564941406 and parameters: {'Fwd': 2.53952750874469e-06, 'K': 5, 'alpha': 0.9, 'dropout': 0.1, 'gnnepoch': 60, 'lambda1': 0.25, 'lambda2': 7.377022060176429, 'loop': 1, 'loss': 'MSE', 'lr': 0.0012333238123417585, 'softmaxF': True, 'useGCN': False, 'weight_decay': 0.0002637032755520611, 'weightedloss': False}. Best is trial 54 with value: 82.06666564941406.
/home/wxy/miniconda3/lib/python3.10/site-packages/optuna/distributions.py:685: UserWarning: The distribution is specified by [0, 1.00001] and step=0.05, but the range is not divisible by `step`. It will be replaced by [0, 1.0].
  warnings.warn(
K:  5
alpha:  0.9
lr:  0.0012742685456550204
weight_decay:  0.0003266547692820933
dropout:  0.1
fix split and run 3 times
Data: Data(x=[19717, 500], y=[19717], train_mask=[19717], val_mask=[19717], test_mask=[19717], adj_t=[19717, 19717, nnz=88648])
num_train tensor(60)
num_noise 0
noise: tensor(0)
data feature 500
ALTOPT(
  (lins): Sequential(
    (0): Linear(in_features=500, out_features=64, bias=True)
    (1): BatchNorm1d(64, eps=1e-05, momentum=0.1, affine=True, track_running_stats=True)
    (2): Dropout(p=0.1, inplace=True)
    (3): ReLU(inplace=True)
    (4): Linear(in_features=64, out_features=3, bias=True)
    (5): Identity()
  )
  (prop): Propagation(K=5, mode=None, lambda1=None, lambda2=None, L21=True, alpha=0.9)
  (gcn): GCN(
    (convs): ModuleList(
      (0): GCNConv(500, 64)
      (1): GCNConv(64, 3)
    )
    (bns): ModuleList(
      (0): BatchNorm1d(64, eps=1e-05, momentum=0.1, affine=True, track_running_stats=True)
    )
    (output): Identity()
  )
)
propagate done
init label
Split: 01, Run: 01
None time:  2.3010595571249723
None Run 01:
Highest Train: 100.00
Highest Valid: 80.20
  Final Train: 100.00
   Final Test: 77.90
Split: 01, Run: 02
None time:  1.6962998828385025
None Run 02:
Highest Train: 100.00
Highest Valid: 81.20
  Final Train: 100.00
   Final Test: 80.10
Split: 01, Run: 03
None time:  1.0884789528790861
None Run 03:
Highest Train: 100.00
Highest Valid: 81.00
  Final Train: 100.00
   Final Test: 78.70
run time now: 5.12635350227356
total time:  5.166915526846424
None All runs:
Highest Train: 100.00 ± 0.00
Highest Valid: 80.80 ± 0.53
  Final Train: 100.00 ± 0.00
   Final Test: 78.90 ± 1.11
[I 2023-06-12 00:17:07,694] Trial 55 finished with value: 80.79999542236328 and parameters: {'Fwd': 1.1313972717977776e-06, 'K': 5, 'alpha': 0.9, 'dropout': 0.1, 'gnnepoch': 50, 'lambda1': 0.25, 'lambda2': 7.336182189722548, 'loop': 2, 'loss': 'MSE', 'lr': 0.0012742685456550204, 'softmaxF': True, 'useGCN': False, 'weight_decay': 0.0003266547692820933, 'weightedloss': False}. Best is trial 54 with value: 82.06666564941406.
/home/wxy/miniconda3/lib/python3.10/site-packages/optuna/distributions.py:685: UserWarning: The distribution is specified by [0, 1.00001] and step=0.05, but the range is not divisible by `step`. It will be replaced by [0, 1.0].
  warnings.warn(
K:  3
alpha:  0.8500000000000001
lr:  0.0010329818137049284
weight_decay:  0.00026816092946634437
dropout:  0.0
fix split and run 3 times
Data: Data(x=[19717, 500], y=[19717], train_mask=[19717], val_mask=[19717], test_mask=[19717], adj_t=[19717, 19717, nnz=88648])
num_train tensor(60)
num_noise 0
noise: tensor(0)
data feature 500
ALTOPT(
  (lins): Sequential(
    (0): Linear(in_features=500, out_features=64, bias=True)
    (1): BatchNorm1d(64, eps=1e-05, momentum=0.1, affine=True, track_running_stats=True)
    (2): Dropout(p=0.0, inplace=True)
    (3): ReLU(inplace=True)
    (4): Linear(in_features=64, out_features=3, bias=True)
    (5): Identity()
  )
  (prop): Propagation(K=3, mode=None, lambda1=None, lambda2=None, L21=True, alpha=0.8500000000000001)
  (gcn): GCN(
    (convs): ModuleList(
      (0): GCNConv(500, 64)
      (1): GCNConv(64, 3)
    )
    (bns): ModuleList(
      (0): BatchNorm1d(64, eps=1e-05, momentum=0.1, affine=True, track_running_stats=True)
    )
    (output): Identity()
  )
)
propagate done
init label
Split: 01, Run: 01
None time:  0.5161994460504502
None Run 01:
Highest Train: 100.00
Highest Valid: 44.80
  Final Train: 100.00
   Final Test: 42.20
Split: 01, Run: 02
None time:  0.7173590650781989
None Run 02:
Highest Train: 100.00
Highest Valid: 77.40
  Final Train: 100.00
   Final Test: 76.80
Split: 01, Run: 03
None time:  1.054868380073458
None Run 03:
Highest Train: 100.00
Highest Valid: 78.20
  Final Train: 100.00
   Final Test: 76.80
run time now: 2.324169635772705
total time:  2.376565596787259
None All runs:
Highest Train: 100.00 ± 0.00
Highest Valid: 66.80 ± 19.06
  Final Train: 100.00 ± 0.00
   Final Test: 65.27 ± 19.98
[I 2023-06-12 00:17:10,516] Trial 56 finished with value: 66.79999542236328 and parameters: {'Fwd': 2.9603631257574732e-06, 'K': 3, 'alpha': 0.8500000000000001, 'dropout': 0.0, 'gnnepoch': 30, 'lambda1': 0.25, 'lambda2': 7.677849367762157, 'loop': 1, 'loss': 'MSE', 'lr': 0.0010329818137049284, 'softmaxF': True, 'useGCN': False, 'weight_decay': 0.00026816092946634437, 'weightedloss': False}. Best is trial 54 with value: 82.06666564941406.
/home/wxy/miniconda3/lib/python3.10/site-packages/optuna/distributions.py:685: UserWarning: The distribution is specified by [0, 1.00001] and step=0.05, but the range is not divisible by `step`. It will be replaced by [0, 1.0].
  warnings.warn(
K:  5
alpha:  0.8500000000000001
lr:  0.000587672252603408
weight_decay:  0.0012883529852683398
dropout:  0.1
fix split and run 3 times
Data: Data(x=[19717, 500], y=[19717], train_mask=[19717], val_mask=[19717], test_mask=[19717], adj_t=[19717, 19717, nnz=88648])
num_train tensor(60)
num_noise 0
noise: tensor(0)
data feature 500
ALTOPT(
  (lins): Sequential(
    (0): Linear(in_features=500, out_features=64, bias=True)
    (1): BatchNorm1d(64, eps=1e-05, momentum=0.1, affine=True, track_running_stats=True)
    (2): Dropout(p=0.1, inplace=True)
    (3): ReLU(inplace=True)
    (4): Linear(in_features=64, out_features=3, bias=True)
    (5): LogSoftmax(dim=-1)
  )
  (prop): Propagation(K=5, mode=None, lambda1=None, lambda2=None, L21=True, alpha=0.8500000000000001)
  (gcn): GCN(
    (convs): ModuleList(
      (0): GCNConv(500, 64)
      (1): GCNConv(64, 3)
    )
    (bns): ModuleList(
      (0): BatchNorm1d(64, eps=1e-05, momentum=0.1, affine=True, track_running_stats=True)
    )
    (output): LogSoftmax(dim=-1)
  )
)
propagate done
init label
Split: 01, Run: 01
None time:  0.8504911169875413
None Run 01:
Highest Train: 100.00
Highest Valid: 76.40
  Final Train: 100.00
   Final Test: 72.90
Split: 01, Run: 02
None time:  0.9939147920813411
None Run 02:
Highest Train: 100.00
Highest Valid: 78.40
  Final Train: 100.00
   Final Test: 75.60
Split: 01, Run: 03
None time:  0.9818735609296709
None Run 03:
Highest Train: 100.00
Highest Valid: 79.80
  Final Train: 98.33
   Final Test: 79.10
run time now: 2.869201183319092
total time:  2.9226900511421263
None All runs:
Highest Train: 100.00 ± 0.00
Highest Valid: 78.20 ± 1.71
  Final Train: 99.44 ± 0.96
   Final Test: 75.87 ± 3.11
[I 2023-06-12 00:17:13,893] Trial 57 finished with value: 78.20000457763672 and parameters: {'Fwd': 2.1085528924729817e-06, 'K': 5, 'alpha': 0.8500000000000001, 'dropout': 0.1, 'gnnepoch': 60, 'lambda1': 0.35000000000000003, 'lambda2': 7.141774128272155, 'loop': 1, 'loss': 'CE', 'lr': 0.000587672252603408, 'softmaxF': True, 'useGCN': False, 'weight_decay': 0.0012883529852683398, 'weightedloss': False}. Best is trial 54 with value: 82.06666564941406.
/home/wxy/miniconda3/lib/python3.10/site-packages/optuna/distributions.py:685: UserWarning: The distribution is specified by [0, 1.00001] and step=0.05, but the range is not divisible by `step`. It will be replaced by [0, 1.0].
  warnings.warn(
K:  2
alpha:  0.9
lr:  0.0011504351797242747
weight_decay:  0.0005872825945048748
dropout:  0.1
fix split and run 3 times
Data: Data(x=[19717, 500], y=[19717], train_mask=[19717], val_mask=[19717], test_mask=[19717], adj_t=[19717, 19717, nnz=88648])
num_train tensor(60)
num_noise 0
noise: tensor(0)
data feature 500
ALTOPT(
  (lins): Sequential(
    (0): Linear(in_features=500, out_features=64, bias=True)
    (1): BatchNorm1d(64, eps=1e-05, momentum=0.1, affine=True, track_running_stats=True)
    (2): Dropout(p=0.1, inplace=True)
    (3): ReLU(inplace=True)
    (4): Linear(in_features=64, out_features=3, bias=True)
    (5): Identity()
  )
  (prop): Propagation(K=2, mode=None, lambda1=None, lambda2=None, L21=True, alpha=0.9)
  (gcn): GCN(
    (convs): ModuleList(
      (0): GCNConv(500, 64)
      (1): GCNConv(64, 3)
    )
    (bns): ModuleList(
      (0): BatchNorm1d(64, eps=1e-05, momentum=0.1, affine=True, track_running_stats=True)
    )
    (output): Identity()
  )
)
propagate done
init label
Split: 01, Run: 01
None time:  1.6687090070918202
None Run 01:
Highest Train: 100.00
Highest Valid: 75.80
  Final Train: 100.00
   Final Test: 75.30
Split: 01, Run: 02
None time:  2.9814535030163825
None Run 02:
Highest Train: 100.00
Highest Valid: 76.40
  Final Train: 100.00
   Final Test: 74.00
Split: 01, Run: 03
None time:  1.910228522028774
None Run 03:
Highest Train: 100.00
Highest Valid: 74.20
  Final Train: 100.00
   Final Test: 70.30
run time now: 6.599338054656982
total time:  6.662507550092414
None All runs:
Highest Train: 100.00 ± 0.00
Highest Valid: 75.47 ± 1.14
  Final Train: 100.00 ± 0.00
   Final Test: 73.20 ± 2.59
[I 2023-06-12 00:17:21,126] Trial 58 finished with value: 75.46666717529297 and parameters: {'Fwd': 3.1612742739458443e-06, 'K': 2, 'alpha': 0.9, 'dropout': 0.1, 'gnnepoch': 70, 'lambda1': 0.2, 'lambda2': 6.692966954178351, 'loop': 1, 'loss': 'MSE', 'lr': 0.0011504351797242747, 'softmaxF': True, 'useGCN': True, 'weight_decay': 0.0005872825945048748, 'weightedloss': True}. Best is trial 54 with value: 82.06666564941406.
/home/wxy/miniconda3/lib/python3.10/site-packages/optuna/distributions.py:685: UserWarning: The distribution is specified by [0, 1.00001] and step=0.05, but the range is not divisible by `step`. It will be replaced by [0, 1.0].
  warnings.warn(
K:  4
alpha:  0.9
lr:  0.0008829952022861023
weight_decay:  0.00019521692384857504
dropout:  0.0
fix split and run 3 times
Data: Data(x=[19717, 500], y=[19717], train_mask=[19717], val_mask=[19717], test_mask=[19717], adj_t=[19717, 19717, nnz=88648])
num_train tensor(60)
num_noise 0
noise: tensor(0)
data feature 500
ALTOPT(
  (lins): Sequential(
    (0): Linear(in_features=500, out_features=64, bias=True)
    (1): BatchNorm1d(64, eps=1e-05, momentum=0.1, affine=True, track_running_stats=True)
    (2): Dropout(p=0.0, inplace=True)
    (3): ReLU(inplace=True)
    (4): Linear(in_features=64, out_features=3, bias=True)
    (5): Identity()
  )
  (prop): Propagation(K=4, mode=None, lambda1=None, lambda2=None, L21=True, alpha=0.9)
  (gcn): GCN(
    (convs): ModuleList(
      (0): GCNConv(500, 64)
      (1): GCNConv(64, 3)
    )
    (bns): ModuleList(
      (0): BatchNorm1d(64, eps=1e-05, momentum=0.1, affine=True, track_running_stats=True)
    )
    (output): Identity()
  )
)
propagate done
init label
Split: 01, Run: 01
None time:  1.6775692291557789
None Run 01:
Highest Train: 100.00
Highest Valid: 79.00
  Final Train: 100.00
   Final Test: 76.20
Split: 01, Run: 02
None time:  0.9985294200014323
None Run 02:
Highest Train: 100.00
Highest Valid: 81.20
  Final Train: 100.00
   Final Test: 78.10
Split: 01, Run: 03
None time:  0.7758806850761175
None Run 03:
Highest Train: 100.00
Highest Valid: 81.00
  Final Train: 100.00
   Final Test: 77.20
run time now: 3.492033004760742
total time:  3.5544619420543313
None All runs:
Highest Train: 100.00 ± 0.00
Highest Valid: 80.40 ± 1.22
  Final Train: 100.00 ± 0.00
   Final Test: 77.17 ± 0.95
[I 2023-06-12 00:17:25,140] Trial 59 finished with value: 80.4000015258789 and parameters: {'Fwd': 5.849137189457212e-06, 'K': 4, 'alpha': 0.9, 'dropout': 0.0, 'gnnepoch': 50, 'lambda1': 0.1, 'lambda2': 7.569258580555079, 'loop': 1, 'loss': 'MSE', 'lr': 0.0008829952022861023, 'softmaxF': False, 'useGCN': False, 'weight_decay': 0.00019521692384857504, 'weightedloss': False}. Best is trial 54 with value: 82.06666564941406.
/home/wxy/miniconda3/lib/python3.10/site-packages/optuna/distributions.py:685: UserWarning: The distribution is specified by [0, 1.00001] and step=0.05, but the range is not divisible by `step`. It will be replaced by [0, 1.0].
  warnings.warn(
K:  8
alpha:  1.0
lr:  0.0013157716049879069
weight_decay:  0.00029086518427634994
dropout:  0.4
fix split and run 3 times
Data: Data(x=[19717, 500], y=[19717], train_mask=[19717], val_mask=[19717], test_mask=[19717], adj_t=[19717, 19717, nnz=88648])
num_train tensor(60)
num_noise 0
noise: tensor(0)
data feature 500
ALTOPT(
  (lins): Sequential(
    (0): Linear(in_features=500, out_features=64, bias=True)
    (1): BatchNorm1d(64, eps=1e-05, momentum=0.1, affine=True, track_running_stats=True)
    (2): Dropout(p=0.4, inplace=True)
    (3): ReLU(inplace=True)
    (4): Linear(in_features=64, out_features=3, bias=True)
    (5): Identity()
  )
  (prop): Propagation(K=8, mode=None, lambda1=None, lambda2=None, L21=True, alpha=1.0)
  (gcn): GCN(
    (convs): ModuleList(
      (0): GCNConv(500, 64)
      (1): GCNConv(64, 3)
    )
    (bns): ModuleList(
      (0): BatchNorm1d(64, eps=1e-05, momentum=0.1, affine=True, track_running_stats=True)
    )
    (output): Identity()
  )
)
propagate done
init label
Split: 01, Run: 01
None time:  1.3149347801227123
None Run 01:
Highest Train: 100.00
Highest Valid: 79.80
  Final Train: 100.00
   Final Test: 77.00
Split: 01, Run: 02
None time:  1.1164943720214069
None Run 02:
Highest Train: 100.00
Highest Valid: 79.20
  Final Train: 100.00
   Final Test: 76.90
Split: 01, Run: 03
None time:  1.0064729831647128
None Run 03:
Highest Train: 100.00
Highest Valid: 78.40
  Final Train: 100.00
   Final Test: 77.40
run time now: 3.4842419624328613
total time:  3.534901143051684
None All runs:
Highest Train: 100.00 ± 0.00
Highest Valid: 79.13 ± 0.70
  Final Train: 100.00 ± 0.00
   Final Test: 77.10 ± 0.26
[I 2023-06-12 00:17:29,172] Trial 60 finished with value: 79.13333129882812 and parameters: {'Fwd': 1.032569935298427e-06, 'K': 8, 'alpha': 1.0, 'dropout': 0.4, 'gnnepoch': 40, 'lambda1': 0.35000000000000003, 'lambda2': 8.077199763247688, 'loop': 2, 'loss': 'MSE', 'lr': 0.0013157716049879069, 'softmaxF': True, 'useGCN': False, 'weight_decay': 0.00029086518427634994, 'weightedloss': False}. Best is trial 54 with value: 82.06666564941406.
/home/wxy/miniconda3/lib/python3.10/site-packages/optuna/distributions.py:685: UserWarning: The distribution is specified by [0, 1.00001] and step=0.05, but the range is not divisible by `step`. It will be replaced by [0, 1.0].
  warnings.warn(
K:  6
alpha:  0.9500000000000001
lr:  0.0016986216923996012
weight_decay:  0.0006091699802104761
dropout:  0.2
fix split and run 3 times
Data: Data(x=[19717, 500], y=[19717], train_mask=[19717], val_mask=[19717], test_mask=[19717], adj_t=[19717, 19717, nnz=88648])
num_train tensor(60)
num_noise 0
noise: tensor(0)
data feature 500
ALTOPT(
  (lins): Sequential(
    (0): Linear(in_features=500, out_features=64, bias=True)
    (1): BatchNorm1d(64, eps=1e-05, momentum=0.1, affine=True, track_running_stats=True)
    (2): Dropout(p=0.2, inplace=True)
    (3): ReLU(inplace=True)
    (4): Linear(in_features=64, out_features=3, bias=True)
    (5): Identity()
  )
  (prop): Propagation(K=6, mode=None, lambda1=None, lambda2=None, L21=True, alpha=0.9500000000000001)
  (gcn): GCN(
    (convs): ModuleList(
      (0): GCNConv(500, 64)
      (1): GCNConv(64, 3)
    )
    (bns): ModuleList(
      (0): BatchNorm1d(64, eps=1e-05, momentum=0.1, affine=True, track_running_stats=True)
    )
    (output): Identity()
  )
)
propagate done
init label
Split: 01, Run: 01
None time:  1.2811117190867662
None Run 01:
Highest Train: 100.00
Highest Valid: 80.20
  Final Train: 100.00
   Final Test: 77.80
Split: 01, Run: 02
None time:  1.2850865619257092
None Run 02:
Highest Train: 100.00
Highest Valid: 81.40
  Final Train: 100.00
   Final Test: 79.00
Split: 01, Run: 03
None time:  1.3162995839957148
None Run 03:
Highest Train: 100.00
Highest Valid: 80.60
  Final Train: 100.00
   Final Test: 79.30
run time now: 3.9283900260925293
total time:  3.9769072299823165
None All runs:
Highest Train: 100.00 ± 0.00
Highest Valid: 80.73 ± 0.61
  Final Train: 100.00 ± 0.00
   Final Test: 78.70 ± 0.79
[I 2023-06-12 00:17:33,682] Trial 61 finished with value: 80.73333740234375 and parameters: {'Fwd': 4.13014198133408e-06, 'K': 6, 'alpha': 0.9500000000000001, 'dropout': 0.2, 'gnnepoch': 60, 'lambda1': 0.15000000000000002, 'lambda2': 8.40975253765229, 'loop': 1, 'loss': 'MSE', 'lr': 0.0016986216923996012, 'softmaxF': True, 'useGCN': False, 'weight_decay': 0.0006091699802104761, 'weightedloss': False}. Best is trial 54 with value: 82.06666564941406.
/home/wxy/miniconda3/lib/python3.10/site-packages/optuna/distributions.py:685: UserWarning: The distribution is specified by [0, 1.00001] and step=0.05, but the range is not divisible by `step`. It will be replaced by [0, 1.0].
  warnings.warn(
K:  6
alpha:  0.9500000000000001
lr:  0.001485550911693597
weight_decay:  0.00012562199721547024
dropout:  0.2
fix split and run 3 times
Data: Data(x=[19717, 500], y=[19717], train_mask=[19717], val_mask=[19717], test_mask=[19717], adj_t=[19717, 19717, nnz=88648])
num_train tensor(60)
num_noise 0
noise: tensor(0)
data feature 500
ALTOPT(
  (lins): Sequential(
    (0): Linear(in_features=500, out_features=64, bias=True)
    (1): BatchNorm1d(64, eps=1e-05, momentum=0.1, affine=True, track_running_stats=True)
    (2): Dropout(p=0.2, inplace=True)
    (3): ReLU(inplace=True)
    (4): Linear(in_features=64, out_features=3, bias=True)
    (5): Identity()
  )
  (prop): Propagation(K=6, mode=None, lambda1=None, lambda2=None, L21=True, alpha=0.9500000000000001)
  (gcn): GCN(
    (convs): ModuleList(
      (0): GCNConv(500, 64)
      (1): GCNConv(64, 3)
    )
    (bns): ModuleList(
      (0): BatchNorm1d(64, eps=1e-05, momentum=0.1, affine=True, track_running_stats=True)
    )
    (output): Identity()
  )
)
propagate done
init label
Split: 01, Run: 01
None time:  0.8822443161625415
None Run 01:
Highest Train: 100.00
Highest Valid: 79.60
  Final Train: 100.00
   Final Test: 76.40
Split: 01, Run: 02
None time:  1.370490944944322
None Run 02:
Highest Train: 100.00
Highest Valid: 81.00
  Final Train: 100.00
   Final Test: 78.20
Split: 01, Run: 03
None time:  1.5695055518299341
None Run 03:
Highest Train: 100.00
Highest Valid: 82.00
  Final Train: 100.00
   Final Test: 78.30
run time now: 3.86691951751709
total time:  3.917551001999527
None All runs:
Highest Train: 100.00 ± 0.00
Highest Valid: 80.87 ± 1.21
  Final Train: 100.00 ± 0.00
   Final Test: 77.63 ± 1.07
